Gemm_Tune/Meta-Llama-3.1-8B-2000inp/full_tuned3.csv
Validator,PT_VERSION,2.4.0
Validator,ROCM_VERSION,6.1.0.0-82-5fabb4c
Validator,HIPBLASLT_VERSION,0.7.0-1549b021
Validator,GCN_ARCH_NAME,gfx942:sramecc+:xnack-
Validator,ROCBLAS_VERSION,4.1.0-cefa4a9b-dirty
GemmTunableOp_Half_TN,tn_8192_2207_28672,Gemm_Hipblaslt_TN_9762,2.07892
GemmTunableOp_Half_TN,tn_8192_54_8192,Gemm_Hipblaslt_TN_7484,0.038793
GemmTunableOp_Half_TN,tn_8192_4017_8192,Gemm_Rocblas_621294330,0.867799
GemmTunableOp_Half_TN,tn_10240_2255_8192,Gemm_Hipblaslt_TN_9697,0.658812
GemmTunableOp_Half_TN,tn_8192_2191_8192,Gemm_Hipblaslt_TN_9742,0.506478
GemmTunableOp_Half_TN,tn_10240_2369_8192,Gemm_Rocblas_621294315,0.67399
GemmTunableOp_Half_TN,tn_8192_2177_28672,Gemm_Hipblaslt_TN_9762,2.07146
GemmTunableOp_Half_TN,tn_10240_2049_8192,Gemm_Hipblaslt_TN_9691,0.608461
GemmTunableOp_Half_TN,tn_57344_2145_8192,Default,3.92515
GemmTunableOp_Half_TN,tn_8192_2289_28672,Gemm_Hipblaslt_TN_9771,2.26071
GemmTunableOp_Half_TN,tn_8192_2284_28672,Gemm_Hipblaslt_TN_9771,2.25508
GemmTunableOp_Half_TN,tn_8192_55_8192,Gemm_Hipblaslt_TN_7484,0.0391088
GemmTunableOp_Half_TN,tn_8192_2159_28672,Gemm_Hipblaslt_TN_9762,2.06282
GemmTunableOp_Half_TN,tn_8192_2049_8192,Gemm_Hipblaslt_TN_9742,0.492802
GemmTunableOp_Half_TN,tn_8192_2315_8192,Gemm_Hipblaslt_TN_9651,0.55397
GemmTunableOp_Half_TN,tn_8192_2079_8192,Gemm_Hipblaslt_TN_9742,0.498609
GemmTunableOp_Half_TN,tn_57344_2000_8192,Gemm_Hipblaslt_TN_154,3.50451
GemmTunableOp_Half_TN,tn_57344_2112_8192,Gemm_Hipblaslt_TN_156,3.94822
GemmTunableOp_Half_TN,tn_8192_2097_28672,Gemm_Hipblaslt_TN_9762,2.05824
GemmTunableOp_Half_TN,tn_8192_2417_8192,Gemm_Hipblaslt_TN_9274,0.560969
GemmTunableOp_Half_TN,tn_8192_2112_8192,Gemm_Hipblaslt_TN_9742,0.499519
GemmTunableOp_Half_TN,tn_10240_2112_8192,Gemm_Hipblaslt_TN_9209,0.622322
GemmTunableOp_Half_TN,tn_57344_55_8192,Gemm_Rocblas_621294205,0.305504
GemmTunableOp_Half_TN,tn_32000_65_8192,Gemm_Hipblaslt_TN_9479,0.183421
GemmTunableOp_Half_TN,tn_10240_4049_8192,Gemm_Hipblaslt_TN_9743,1.14178
GemmTunableOp_Half_TN,tn_8192_2193_8192,Gemm_Hipblaslt_TN_9742,0.507003
GemmTunableOp_Half_TN,tn_57344_2315_8192,Gemm_Rocblas_621294543,4.40909
GemmTunableOp_Half_TN,tn_32000_56_8192,Gemm_Rocblas_621286466,0.163839
GemmTunableOp_Half_TN,tn_8192_4096_28672,Gemm_Rocblas_621286894,3.46301
GemmTunableOp_Half_TN,tn_8192_2257_8192,Gemm_Hipblaslt_TN_9763,0.509763
GemmTunableOp_Half_TN,tn_57344_2239_8192,Gemm_Rocblas_621294543,4.02561
GemmTunableOp_Half_TN,tn_10240_2225_8192,Gemm_Hipblaslt_TN_9689,0.643863
GemmTunableOp_Half_TN,tn_57344_2417_8192,Default,4.3666
GemmTunableOp_Half_TN,tn_8192_2065_8192,Gemm_Hipblaslt_TN_9742,0.496774
GemmTunableOp_Half_TN,tn_8192_62_28672,Gemm_Rocblas_621294228,0.146239
GemmTunableOp_Half_TN,tn_57344_2017_8192,Gemm_Hipblaslt_TN_9840,3.52199
GemmTunableOp_Half_TN,tn_32000_63_8192,Gemm_Rocblas_621286466,0.164594
GemmTunableOp_Half_TN,tn_8192_64_28672,Gemm_Rocblas_621294228,0.148869
GemmTunableOp_Half_TN,tn_10240_65_8192,Gemm_Hipblaslt_TN_9304,0.0494537
GemmTunableOp_Half_TN,tn_8192_4000_28672,Gemm_Rocblas_621294643,3.43725
GemmTunableOp_Half_TN,tn_8192_2145_28672,Gemm_Hipblaslt_TN_9762,2.06178
GemmTunableOp_Half_TN,tn_10240_2270_8192,Gemm_Rocblas_621286582,0.65816
GemmTunableOp_Half_TN,tn_32000_55_8192,Gemm_Rocblas_621286466,0.162543
GemmTunableOp_Half_TN,tn_8192_28_28672,Gemm_Rocblas_621286354,0.129659
GemmTunableOp_Half_TN,tn_8192_2082_8192,Gemm_Hipblaslt_TN_9742,0.500234
GemmTunableOp_Half_TN,tn_8192_4096_8192,Gemm_Rocblas_621286590,0.89169
GemmTunableOp_Half_TN,tn_8192_2302_28672,Gemm_Hipblaslt_TN_9774,2.25873
GemmTunableOp_Half_TN,tn_8192_2366_8192,Gemm_Hipblaslt_TN_9229,0.5574
GemmTunableOp_Half_TN,tn_8192_66_28672,Gemm_Hipblaslt_TN_8168,0.174792
GemmTunableOp_Half_TN,tn_57344_2415_8192,Gemm_Hipblaslt_TN_9800,4.41012
GemmTunableOp_Half_TN,tn_8192_2178_28672,Gemm_Hipblaslt_TN_9762,2.06728
GemmTunableOp_Half_TN,tn_57344_4066_8192,Gemm_Hipblaslt_TN_9882,6.67455
GemmTunableOp_Half_TN,tn_8192_2158_8192,Gemm_Hipblaslt_TN_9742,0.504906
GemmTunableOp_Half_TN,tn_8192_31_28672,Gemm_Rocblas_621286354,0.12966
GemmTunableOp_Half_TN,tn_8192_4033_8192,Gemm_Hipblaslt_TN_9753,0.882272
GemmTunableOp_Half_TN,tn_10240_2128_8192,Gemm_Hipblaslt_TN_9689,0.630642
GemmTunableOp_Half_TN,tn_8192_2177_8192,Gemm_Hipblaslt_TN_9742,0.507411
GemmTunableOp_Half_TN,tn_8192_2305_8192,Gemm_Hipblaslt_TN_9208,0.554971
GemmTunableOp_Half_TN,tn_8192_2304_8192,Gemm_Hipblaslt_TN_9742,0.514298
GemmTunableOp_Half_TN,tn_10240_57_8192,Gemm_Hipblaslt_TN_9090,0.0483294
GemmTunableOp_Half_TN,tn_8192_2302_8192,Gemm_Hipblaslt_TN_9742,0.524882
GemmTunableOp_Half_TN,tn_8192_2145_8192,Gemm_Hipblaslt_TN_9742,0.502121
GemmTunableOp_Half_TN,tn_57344_66_8192,Gemm_Hipblaslt_TN_9481,0.323056
GemmTunableOp_Half_TN,tn_8192_65_8192,Gemm_Hipblaslt_TN_7093,0.0440381
GemmTunableOp_Half_TN,tn_8192_4048_28672,Gemm_Rocblas_621294658,3.4314
GemmTunableOp_Half_TN,tn_10240_2370_8192,Gemm_Hipblaslt_TN_9691,0.676768
GemmTunableOp_Half_TN,tn_8192_2127_8192,Gemm_Hipblaslt_TN_9742,0.504336
GemmTunableOp_Half_TN,tn_57344_2128_8192,Gemm_Hipblaslt_TN_156,3.96898
GemmTunableOp_Half_TN,tn_8192_2096_8192,Gemm_Hipblaslt_TN_9742,0.498897
GemmTunableOp_Half_TN,tn_10240_2192_8192,Gemm_Hipblaslt_TN_9691,0.639369
GemmTunableOp_Half_TN,tn_8192_2208_8192,Gemm_Hipblaslt_TN_9763,0.508324
GemmTunableOp_Half_TN,tn_8192_4000_8192,Gemm_Hipblaslt_TN_9753,0.870656
GemmTunableOp_Half_TN,tn_8192_31_8192,Gemm_Hipblaslt_TN_9415,0.0338722
GemmTunableOp_Half_TN,tn_8192_68_8192,Gemm_Hipblaslt_TN_8095,0.0446495
GemmTunableOp_Half_TN,tn_57344_65_8192,Gemm_Hipblaslt_TN_9478,0.325256
GemmTunableOp_Half_TN,tn_10240_60_8192,Gemm_Hipblaslt_TN_7492,0.0473358
GemmTunableOp_Half_TN,tn_8192_66_8192,Gemm_Hipblaslt_TN_9304,0.0438119
GemmTunableOp_Half_TN,tn_10240_2081_8192,Gemm_Hipblaslt_TN_9793,0.627996
GemmTunableOp_Half_TN,tn_57344_2082_8192,Gemm_Hipblaslt_TN_9716,3.97663
GemmTunableOp_Half_TN,tn_57344_2413_8192,Default,4.36587
GemmTunableOp_Half_TN,tn_57344_62_8192,Gemm_Rocblas_621294205,0.308524
GemmTunableOp_Half_TN,tn_10240_63_8192,Gemm_Hipblaslt_TN_7492,0.0489664
GemmTunableOp_Half_TN,tn_32000_61_8192,Gemm_Rocblas_621286467,0.161571
GemmTunableOp_Half_TN,tn_57344_2193_8192,Gemm_Hipblaslt_TN_9841,4.04267
GemmTunableOp_Half_TN,tn_57344_28_8192,Gemm_Rocblas_621286348,0.276874
GemmTunableOp_Half_TN,tn_8192_2225_28672,Gemm_Hipblaslt_TN_9762,2.09284
GemmTunableOp_Half_TN,tn_10240_2238_8192,Gemm_Rocblas_621294315,0.646469
GemmTunableOp_Half_TN,tn_8192_2028_28672,Gemm_Hipblaslt_TN_9840,1.77777
GemmStridedBatchedTunableOp_Half_TN,tn_2113_2113_128_B_64,Gemm_Rocblas_621294106,0.367491
GemmStridedBatchedTunableOp_Half_TN,tn_2178_2178_128_B_64,Gemm_Hipblaslt_TN_158,0.375204
GemmStridedBatchedTunableOp_Half_TN,tn_2304_2304_128_B_64,Gemm_Hipblaslt_TN_158,0.338872
GemmStridedBatchedTunableOp_Half_TN,tn_2032_2032_128_B_64,Gemm_Hipblaslt_TN_157,0.333919
GemmStridedBatchedTunableOp_Half_TN,tn_2082_2082_128_B_64,Gemm_Rocblas_621294106,0.363031
GemmStridedBatchedTunableOp_Half_TN,tn_2033_2033_128_B_64,Gemm_Hipblaslt_TN_6950,0.34698
GemmStridedBatchedTunableOp_Half_TN,tn_2177_2177_128_B_64,Gemm_Rocblas_621294106,0.390303
GemmStridedBatchedTunableOp_Half_TN,tn_2465_2465_128_B_64,Gemm_Rocblas_621294106,0.501881
GemmStridedBatchedTunableOp_Half_TN,tn_2225_2225_128_B_64,Gemm_Rocblas_621294533,0.411848
GemmStridedBatchedTunableOp_Half_TN,tn_2159_2159_128_B_64,Gemm_Rocblas_621294106,0.388839
GemmStridedBatchedTunableOp_Half_TN,tn_2208_2208_128_B_64,Gemm_Hipblaslt_TN_158,0.348812
GemmStridedBatchedTunableOp_Half_TN,tn_2257_2257_128_B_64,Gemm_Rocblas_621294106,0.420755
GemmStridedBatchedTunableOp_Half_TN,tn_2000_2000_128_B_64,Gemm_Hipblaslt_TN_9841,0.318635
GemmStridedBatchedTunableOp_Half_TN,tn_2190_2190_128_B_64,Gemm_Rocblas_621294106,0.392161
GemmTunableOp_Half_TN,tn_57344_2096_8192,Gemm_Hipblaslt_TN_156,3.94555
GemmTunableOp_Half_TN,tn_10240_59_8192,Gemm_Hipblaslt_TN_7492,0.0477718
GemmTunableOp_Half_TN,tn_57344_4017_8192,Gemm_Rocblas_621294497,6.73729
GemmTunableOp_Half_TN,tn_10240_2284_8192,Gemm_Hipblaslt_TN_9697,0.6685
GemmTunableOp_Half_TN,tn_57344_2369_8192,Gemm_Rocblas_621294543,4.41756
GemmTunableOp_Half_TN,tn_8192_2321_28672,Gemm_Hipblaslt_TN_9771,2.31272
GemmTunableOp_Half_TN,tn_32000_57_8192,Gemm_Rocblas_621294203,0.163543
GemmTunableOp_Half_TN,tn_8192_2239_28672,Gemm_Hipblaslt_TN_9762,2.12424
GemmTunableOp_Half_TN,tn_10240_2097_8192,Gemm_Hipblaslt_TN_9690,0.64048
GemmTunableOp_Half_TN,tn_57344_2192_8192,Default,3.91262
GemmTunableOp_Half_TN,tn_8192_2370_28672,Gemm_Hipblaslt_TN_9771,2.31189
GemmTunableOp_Half_TN,tn_57344_4081_8192,Gemm_Hipblaslt_TN_9825,6.75677
GemmTunableOp_Half_TN,tn_8192_2000_28672,Gemm_Hipblaslt_TN_9737,1.74314
GemmTunableOp_Half_TN,tn_8192_2082_28672,Gemm_Hipblaslt_TN_9762,2.02236
GemmTunableOp_Half_TN,tn_57344_2321_8192,Default,4.30741
GemmTunableOp_Half_TN,tn_10240_56_8192,Gemm_Hipblaslt_TN_7492,0.0464004
GemmTunableOp_Half_TN,tn_8192_55_28672,Gemm_Rocblas_621286489,0.144596
GemmTunableOp_Half_TN,tn_8192_58_8192,Gemm_Hipblaslt_TN_7484,0.0394376
GemmTunableOp_Half_TN,tn_57344_2257_8192,Gemm_Rocblas_621294469,4.04374
GemmTunableOp_Half_TN,tn_10240_2321_8192,Gemm_Hipblaslt_TN_9690,0.68444
GemmTunableOp_Half_TN,tn_8192_2417_28672,Gemm_Hipblaslt_TN_9771,2.3518
GemmTunableOp_Half_TN,tn_57344_31_8192,Gemm_Hipblaslt_TN_9429,0.253763
GemmTunableOp_Half_TN,tn_8192_2337_28672,Gemm_Hipblaslt_TN_9771,2.32108
GemmTunableOp_Half_TN,tn_10240_2193_8192,Gemm_Hipblaslt_TN_9182,0.650062
GemmTunableOp_Half_TN,tn_10240_4050_8192,Gemm_Hipblaslt_TN_9743,1.14934
GemmTunableOp_Half_TN,tn_57344_29_8192,Gemm_Hipblaslt_TN_9429,0.252698
GemmTunableOp_Half_TN,tn_10240_2315_8192,Gemm_Hipblaslt_TN_9690,0.679134
GemmTunableOp_Half_TN,tn_8192_63_8192,Gemm_Hipblaslt_TN_7484,0.0401256
GemmTunableOp_Half_TN,tn_10240_2158_8192,Gemm_Hipblaslt_TN_9690,0.649715
GemmTunableOp_Half_TN,tn_8192_56_8192,Gemm_Hipblaslt_TN_7484,0.039749
GemmTunableOp_Half_TN,tn_8192_2305_28672,Gemm_Hipblaslt_TN_9771,2.3225
GemmTunableOp_Half_TN,tn_8192_2028_8192,Gemm_Hipblaslt_TN_9742,0.481628
GemmTunableOp_Half_TN,tn_10240_2302_8192,Gemm_Rocblas_621294353,0.670785
GemmTunableOp_Half_TN,tn_8192_2238_8192,Gemm_Hipblaslt_TN_9742,0.524116
GemmTunableOp_Half_TN,tn_8192_2255_8192,Gemm_Hipblaslt_TN_9763,0.522896
GemmTunableOp_Half_TN,tn_8192_4066_8192,Gemm_Rocblas_621294330,0.911543
GemmTunableOp_Half_TN,tn_8192_2017_28672,Gemm_Hipblaslt_TN_9840,1.75622
GemmTunableOp_Half_TN,tn_10240_2415_8192,Gemm_Hipblaslt_TN_9697,0.700302
GemmTunableOp_Half_TN,tn_8192_4049_8192,Gemm_Rocblas_621286590,0.907271
GemmTunableOp_Half_TN,tn_8192_2160_28672,Gemm_Hipblaslt_TN_9762,2.07107
GemmTunableOp_Half_TN,tn_57344_2127_8192,Gemm_Rocblas_621294543,3.96082
GemmTunableOp_Half_TN,tn_10240_55_8192,Gemm_Hipblaslt_TN_7492,0.0464503
GemmTunableOp_Half_TN,tn_8192_2081_28672,Gemm_Hipblaslt_TN_9762,2.06452
GemmTunableOp_Half_TN,tn_8192_2161_28672,Gemm_Hipblaslt_TN_9762,2.07661
GemmTunableOp_Half_TN,tn_57344_2190_8192,Gemm_Rocblas_621294543,3.99731
GemmTunableOp_Half_TN,tn_8192_2239_8192,Gemm_Hipblaslt_TN_9742,0.524551
GemmTunableOp_Half_TN,tn_57344_2065_8192,Default,3.866
GemmTunableOp_Half_TN,tn_10240_31_8192,Gemm_Hipblaslt_TN_9415,0.0404091
GemmTunableOp_Half_TN,tn_32000_60_8192,Gemm_Rocblas_621286466,0.163416
GemmTunableOp_Half_TN,tn_10240_2145_8192,Gemm_Hipblaslt_TN_9182,0.647046
GemmTunableOp_Half_TN,tn_8192_2270_28672,Gemm_Hipblaslt_TN_9774,2.25833
GemmTunableOp_Half_TN,tn_10240_2028_8192,Gemm_Rocblas_621294309,0.614031
GemmTunableOp_Half_TN,tn_8192_28_8192,Gemm_Hipblaslt_TN_9410,0.0332858
GemmTunableOp_Half_TN,tn_8192_2465_28672,Gemm_Hipblaslt_TN_9775,2.40279
GemmTunableOp_Half_TN,tn_8192_2178_8192,Gemm_Hipblaslt_TN_9742,0.518787
GemmTunableOp_Half_TN,tn_10240_4017_8192,Gemm_Hipblaslt_TN_9743,1.13516
GemmTunableOp_Half_TN,tn_57344_2337_8192,Gemm_Rocblas_621294543,4.41072
GemmTunableOp_Half_TN,tn_10240_66_8192,Gemm_Hipblaslt_TN_9304,0.0495657
GemmTunableOp_Half_TN,tn_57344_2097_8192,Gemm_Rocblas_621294543,3.93225
GemmTunableOp_Half_TN,tn_57344_67_8192,Gemm_Hipblaslt_TN_9486,0.315742
GemmTunableOp_Half_TN,tn_10240_4096_8192,Gemm_Hipblaslt_TN_9743,1.1454
GemmTunableOp_Half_TN,tn_8192_2113_28672,Gemm_Hipblaslt_TN_9762,2.03976
GemmTunableOp_Half_TN,tn_57344_4096_8192,Gemm_Hipblaslt_TN_9936,6.77599
GemmTunableOp_Half_TN,tn_57344_59_8192,Gemm_Rocblas_621286467,0.305674
GemmTunableOp_Half_TN,tn_8192_2385_8192,Gemm_Hipblaslt_TN_9698,0.565423
GemmTunableOp_Half_TN,tn_57344_2049_8192,Gemm_Rocblas_621294543,3.91086
GemmTunableOp_Half_TN,tn_32000_68_8192,Gemm_Hipblaslt_TN_9479,0.188029
GemmTunableOp_Half_TN,tn_8192_4033_28672,Gemm_Hipblaslt_TN_9593,3.43206
GemmTunableOp_Half_TN,tn_8192_68_28672,Gemm_Hipblaslt_TN_8168,0.174863
GemmTunableOp_Half_TN,tn_8192_2128_28672,Gemm_Hipblaslt_TN_9762,2.03487
GemmTunableOp_Half_TN,tn_57344_56_8192,Gemm_Hipblaslt_TN_7491,0.304787
GemmTunableOp_Half_TN,tn_8192_2270_8192,Gemm_Hipblaslt_TN_9742,0.524794
GemmTunableOp_Half_TN,tn_32000_62_8192,Gemm_Rocblas_621294203,0.163776
GemmTunableOp_Half_TN,tn_8192_4066_28672,Gemm_Rocblas_621294648,3.47046
GemmTunableOp_Half_TN,tn_10240_4033_8192,Gemm_Hipblaslt_TN_9743,1.15305
GemmTunableOp_Half_TN,tn_10240_2113_8192,Gemm_Hipblaslt_TN_9211,0.643541
GemmTunableOp_Half_TN,tn_32000_30_8192,Gemm_Rocblas_621294193,0.149208
GemmTunableOp_Half_TN,tn_57344_2397_8192,Gemm_Rocblas_621294543,4.46825
GemmTunableOp_Half_TN,tn_8192_2128_8192,Gemm_Hipblaslt_TN_9742,0.507434
GemmStridedBatchedTunableOp_Half_TN,tn_2049_2049_128_B_64,Gemm_Rocblas_621294106,0.356268
GemmStridedBatchedTunableOp_Half_TN,tn_2270_2270_128_B_64,Gemm_Rocblas_621294106,0.413612
GemmStridedBatchedTunableOp_Half_TN,tn_2207_2207_128_B_64,Gemm_Rocblas_621294106,0.408041
GemmStridedBatchedTunableOp_Half_TN,tn_2127_2127_128_B_64,Gemm_Rocblas_621294106,0.381262
GemmStridedBatchedTunableOp_Half_TN,tn_2366_2366_128_B_64,Gemm_Hipblaslt_TN_9831,0.461507
GemmStridedBatchedTunableOp_Half_TN,tn_2238_2238_128_B_64,Gemm_Rocblas_621294533,0.407582
GemmStridedBatchedTunableOp_Half_TN,tn_2284_2284_128_B_64,Gemm_Rocblas_621294106,0.422454
GemmStridedBatchedTunableOp_Half_TN,tn_2370_2370_128_B_64,Gemm_Hipblaslt_TN_9831,0.461653
GemmStridedBatchedTunableOp_Half_TN,tn_2112_2112_128_B_64,Gemm_Hipblaslt_TN_9846,0.326552
GemmStridedBatchedTunableOp_Half_TN,tn_2302_2302_128_B_64,Gemm_Rocblas_621294106,0.429386
GemmStridedBatchedTunableOp_Half_TN,tn_2065_2065_128_B_64,Gemm_Rocblas_621294106,0.363179
GemmStridedBatchedTunableOp_Half_TN,tn_2305_2305_128_B_64,Gemm_Hipblaslt_TN_9831,0.447829
GemmStridedBatchedTunableOp_Half_TN,tn_2321_2321_128_B_64,Gemm_Rocblas_621294106,0.460623
GemmStridedBatchedTunableOp_Half_TN,tn_2315_2315_128_B_64,Gemm_Hipblaslt_TN_9831,0.453599
GemmTunableOp_Half_TN,tn_10240_4048_8192,Gemm_Hipblaslt_TN_9743,1.12806
GemmTunableOp_Half_TN,tn_57344_2284_8192,Default,3.99213
GemmTunableOp_Half_TN,tn_8192_2304_28672,Gemm_Hipblaslt_TN_9774,2.25087
GemmTunableOp_Half_TN,tn_57344_2191_8192,Gemm_Hipblaslt_TN_9716,3.99666
GemmTunableOp_Half_TN,tn_10240_28_8192,Gemm_Hipblaslt_TN_9415,0.0406476
GemmTunableOp_Half_TN,tn_10240_2160_8192,Gemm_Hipblaslt_TN_9690,0.636199
GemmTunableOp_Half_TN,tn_8192_2208_28672,Gemm_Hipblaslt_TN_9762,2.09237
GemmTunableOp_Half_TN,tn_8192_2113_8192,Gemm_Hipblaslt_TN_9742,0.504669
GemmTunableOp_Half_TN,tn_57344_2177_8192,Gemm_Hipblaslt_TN_9757,4.0209
GemmTunableOp_Half_TN,tn_10240_2079_8192,Gemm_Hipblaslt_TN_9690,0.616587
GemmTunableOp_Half_TN,tn_8192_64_8192,Gemm_Hipblaslt_TN_7484,0.0399236
GemmTunableOp_Half_TN,tn_8192_2289_8192,Gemm_Hipblaslt_TN_9763,0.518294
GemmTunableOp_Half_TN,tn_8192_2370_8192,Gemm_Hipblaslt_TN_9229,0.559327
GemmTunableOp_Half_TN,tn_57344_2304_8192,Default,3.97983
GemmTunableOp_Half_TN,tn_10240_2190_8192,Gemm_Rocblas_621286580,0.643775
GemmTunableOp_Half_TN,tn_57344_2238_8192,Default,3.98258
GemmTunableOp_Half_TN,tn_8192_2159_8192,Gemm_Hipblaslt_TN_9763,0.514969
GemmTunableOp_Half_TN,tn_8192_2112_28672,Gemm_Hipblaslt_TN_9762,2.0458
GemmTunableOp_Half_TN,tn_10240_2096_8192,Gemm_Hipblaslt_TN_9182,0.633083
GemmTunableOp_Half_TN,tn_8192_2369_8192,Gemm_Hipblaslt_TN_9651,0.560721
GemmTunableOp_Half_TN,tn_8192_2238_28672,Gemm_Hipblaslt_TN_9762,2.11856
GemmTunableOp_Half_TN,tn_8192_2369_28672,Gemm_Hipblaslt_TN_9771,2.31269
GemmTunableOp_Half_TN,tn_10240_61_8192,Gemm_Hipblaslt_TN_7492,0.0486679
GemmTunableOp_Half_TN,tn_10240_2177_8192,Gemm_Hipblaslt_TN_9691,0.64299
GemmTunableOp_Half_TN,tn_8192_56_28672,Default,0.147023
GemmTunableOp_Half_TN,tn_10240_2304_8192,Gemm_Rocblas_621286613,0.663766
GemmTunableOp_Half_TN,tn_57344_58_8192,Gemm_Rocblas_621286466,0.303539
GemmTunableOp_Half_TN,tn_8192_2193_28672,Gemm_Hipblaslt_TN_9762,2.07761
GemmTunableOp_Half_TN,tn_10240_2065_8192,Gemm_Rocblas_621286580,0.614307
GemmTunableOp_Half_TN,tn_8192_2192_8192,Gemm_Hipblaslt_TN_9742,0.514399
GemmTunableOp_Half_TN,tn_8192_2129_28672,Gemm_Hipblaslt_TN_9762,2.06339
GemmTunableOp_Half_TN,tn_10240_62_8192,Gemm_Hipblaslt_TN_9304,0.048132
GemmTunableOp_Half_TN,tn_8192_54_28672,Gemm_Rocblas_621286489,0.146241
GemmTunableOp_Half_TN,tn_8192_2257_28672,Gemm_Hipblaslt_TN_9774,2.21519
GemmTunableOp_Half_TN,tn_8192_2366_28672,Gemm_Hipblaslt_TN_9771,2.29598
GemmTunableOp_Half_TN,tn_8192_67_28672,Gemm_Hipblaslt_TN_7871,0.172964
GemmTunableOp_Half_TN,tn_8192_29_28672,Gemm_Rocblas_621286354,0.130717
GemmTunableOp_Half_TN,tn_10240_2413_8192,Gemm_Hipblaslt_TN_9192,0.69696
GemmTunableOp_Half_TN,tn_32000_58_8192,Gemm_Rocblas_621286466,0.161217
GemmTunableOp_Half_TN,tn_10240_2159_8192,Gemm_Hipblaslt_TN_9209,0.639343
GemmTunableOp_Half_TN,tn_57344_54_8192,Gemm_Rocblas_621294203,0.301733
GemmTunableOp_Half_TN,tn_10240_2000_8192,Gemm_Rocblas_621294309,0.599124
GemmTunableOp_Half_TN,tn_8192_29_8192,Gemm_Hipblaslt_TN_9408,0.0336661
GemmTunableOp_Half_TN,tn_32000_66_8192,Gemm_Hipblaslt_TN_9479,0.188492
GemmTunableOp_Half_TN,tn_8192_2225_8192,Gemm_Hipblaslt_TN_9742,0.511744
GemmTunableOp_Half_TN,tn_57344_30_8192,Gemm_Hipblaslt_TN_9429,0.25285
GemmTunableOp_Half_TN,tn_8192_2415_28672,Gemm_Hipblaslt_TN_9771,2.3157
GemmTunableOp_Half_TN,tn_57344_2366_8192,Default,4.29846
GemmTunableOp_Half_TN,tn_8192_2127_28672,Gemm_Hipblaslt_TN_9762,2.03806
GemmTunableOp_Half_TN,tn_57344_61_8192,Gemm_Rocblas_621294204,0.305424
GemmTunableOp_Half_TN,tn_10240_2207_8192,Gemm_Hipblaslt_TN_9691,0.645561
GemmTunableOp_Half_TN,tn_8192_2158_28672,Gemm_Hipblaslt_TN_9762,2.05682
GemmTunableOp_Half_TN,tn_10240_2129_8192,Gemm_Hipblaslt_TN_9209,0.631952
GemmTunableOp_Half_TN,tn_57344_2270_8192,Default,3.98791
GemmTunableOp_Half_TN,tn_57344_2159_8192,Gemm_Hipblaslt_TN_9827,4.01118
GemmTunableOp_Half_TN,tn_10240_58_8192,Gemm_Hipblaslt_TN_7492,0.0472821
GemmTunableOp_Half_TN,tn_10240_4066_8192,Gemm_Hipblaslt_TN_9743,1.13493
GemmTunableOp_Half_TN,tn_8192_2207_8192,Gemm_Hipblaslt_TN_9742,0.512717
GemmTunableOp_Half_TN,tn_8192_2097_8192,Gemm_Hipblaslt_TN_9742,0.502943
GemmTunableOp_Half_TN,tn_10240_2161_8192,Gemm_Rocblas_621286580,0.635665
GemmTunableOp_Half_TN,tn_8192_57_8192,Gemm_Hipblaslt_TN_7484,0.0394269
GemmTunableOp_Half_TN,tn_10240_2366_8192,Gemm_Hipblaslt_TN_9182,0.676967
GemmTunableOp_Half_TN,tn_8192_2081_8192,Gemm_Hipblaslt_TN_9763,0.500747
GemmTunableOp_Half_TN,tn_8192_57_28672,Gemm_Rocblas_621286489,0.14499
GemmTunableOp_Half_TN,tn_10240_2257_8192,Gemm_Rocblas_621294353,0.658534
GemmTunableOp_Half_TN,tn_10240_4081_8192,Gemm_Hipblaslt_TN_9743,1.13427
GemmTunableOp_Half_TN,tn_10240_2337_8192,Gemm_Rocblas_621286580,0.677631
GemmTunableOp_Half_TN,tn_57344_2255_8192,Gemm_Rocblas_621294543,4.00004
GemmTunableOp_Half_TN,tn_57344_2207_8192,Default,3.92782
GemmTunableOp_Half_TN,tn_8192_4048_8192,Gemm_Hipblaslt_TN_9704,0.889145
GemmTunableOp_Half_TN,tn_8192_65_28672,Gemm_Hipblaslt_TN_8168,0.171415
GemmTunableOp_Half_TN,tn_8192_58_28672,Gemm_Rocblas_621294228,0.145304
GemmTunableOp_Half_TN,tn_8192_2065_28672,Gemm_Hipblaslt_TN_9763,2.08214
GemmTunableOp_Half_TN,tn_8192_2315_28672,Gemm_Hipblaslt_TN_9649,2.29579
GemmTunableOp_Half_TN,tn_57344_2305_8192,Default,4.27351
GemmTunableOp_Half_TN,tn_10240_2385_8192,Gemm_Hipblaslt_TN_9182,0.676739
GemmTunableOp_Half_TN,tn_57344_2370_8192,Gemm_Hipblaslt_TN_9666,4.44813
GemmTunableOp_Half_TN,tn_8192_2096_28672,Gemm_Hipblaslt_TN_9762,2.05573
GemmTunableOp_Half_TN,tn_57344_64_8192,Gemm_Rocblas_621286467,0.305039
GemmTunableOp_Half_TN,tn_57344_2160_8192,Gemm_Hipblaslt_TN_154,3.96607
GemmTunableOp_Half_TN,tn_8192_63_28672,Gemm_Rocblas_621294228,0.146514
GemmTunableOp_Half_TN,tn_8192_2190_8192,Gemm_Hipblaslt_TN_9742,0.512622
GemmTunableOp_Half_TN,tn_8192_62_8192,Gemm_Hipblaslt_TN_7484,0.0396248
GemmTunableOp_Half_TN,tn_10240_2017_8192,Gemm_Rocblas_621286569,0.600718
GemmTunableOp_Half_TN,tn_8192_61_28672,Gemm_Rocblas_621294228,0.148121
GemmTunableOp_Half_TN,tn_10240_54_8192,Gemm_Hipblaslt_TN_9304,0.0464138
GemmTunableOp_Half_TN,tn_8192_2397_8192,Gemm_Rocblas_621286783,0.560857
GemmTunableOp_Half_TN,tn_57344_60_8192,Gemm_Rocblas_621286466,0.308576
GemmStridedBatchedTunableOp_Half_TN,tn_2096_2096_128_B_64,Gemm_Hipblaslt_TN_158,0.332363
GemmStridedBatchedTunableOp_Half_TN,tn_2192_2192_128_B_64,Gemm_Hipblaslt_TN_158,0.366
GemmStridedBatchedTunableOp_Half_TN,tn_2239_2239_128_B_64,Gemm_Rocblas_621294533,0.411199
GemmStridedBatchedTunableOp_Half_TN,tn_2028_2028_128_B_64,Gemm_Hipblaslt_TN_6950,0.346454
GemmStridedBatchedTunableOp_Half_TN,tn_2017_2017_128_B_64,Gemm_Hipblaslt_TN_6950,0.345606
GemmStridedBatchedTunableOp_Half_TN,tn_2255_2255_128_B_64,Gemm_Rocblas_621294106,0.420632
GemmStridedBatchedTunableOp_Half_TN,tn_2191_2191_128_B_64,Gemm_Rocblas_621294106,0.40032
GemmStridedBatchedTunableOp_Half_TN,tn_16_16_128_B_64,Gemm_Rocblas_621286717,0.00670725
GemmStridedBatchedTunableOp_Half_TN,tn_2097_2097_128_B_64,Gemm_Rocblas_621294106,0.369489
GemmStridedBatchedTunableOp_Half_TN,tn_2079_2079_128_B_64,Gemm_Rocblas_621294106,0.362486
GemmStridedBatchedTunableOp_Half_TN,tn_2193_2193_128_B_64,Gemm_Rocblas_621294106,0.398145
GemmStridedBatchedTunableOp_Half_TN,tn_2417_2417_128_B_64,Gemm_Rocblas_621294106,0.48178
GemmStridedBatchedTunableOp_Half_TN,tn_2158_2158_128_B_64,Gemm_Hipblaslt_TN_158,0.361027
GemmStridedBatchedTunableOp_Half_TN,tn_2161_2161_128_B_64,Gemm_Rocblas_621294106,0.387774
GemmStridedBatchedTunableOp_Half_TN,tn_2385_2385_128_B_64,Gemm_Rocblas_621294106,0.471168
GemmTunableOp_Half_TN,tn_8192_2337_8192,Gemm_Hipblaslt_TN_9274,0.537399
GemmTunableOp_Half_TN,tn_32000_54_8192,Gemm_Rocblas_621294203,0.156865
GemmTunableOp_Half_TN,tn_8192_2321_8192,Gemm_Hipblaslt_TN_9274,0.540739
GemmTunableOp_Half_TN,tn_8192_4050_8192,Gemm_Hipblaslt_TN_9704,0.88003
GemmTunableOp_Half_TN,tn_8192_2413_8192,Gemm_Hipblaslt_TN_9274,0.546622
GemmTunableOp_Half_TN,tn_57344_2302_8192,Gemm_Rocblas_621294543,4.05026
GemmTunableOp_Half_TN,tn_8192_59_28672,Default,0.147163
GemmTunableOp_Half_TN,tn_57344_4048_8192,Gemm_Hipblaslt_TN_9882,6.64359
GemmTunableOp_Half_TN,tn_57344_2289_8192,Default,3.98342
GemmTunableOp_Half_TN,tn_8192_4049_28672,Gemm_Rocblas_621286915,3.42684
GemmTunableOp_Half_TN,tn_8192_4081_8192,Gemm_Rocblas_621294435,0.878181
GemmTunableOp_Half_TN,tn_32000_256_8192,Gemm_Rocblas_621286625,0.319374
GemmTunableOp_Half_TN,tn_8192_2079_28672,Gemm_Hipblaslt_TN_9742,2.07537
GemmTunableOp_Half_TN,tn_8192_2000_8192,Gemm_Hipblaslt_TN_9202,0.430476
GemmTunableOp_Half_TN,tn_8192_2049_28672,Gemm_Hipblaslt_TN_9763,2.07995
GemmTunableOp_Half_TN,tn_8192_30_28672,Gemm_Rocblas_621294226,0.128314
GemmTunableOp_Half_TN,tn_10240_29_8192,Gemm_Hipblaslt_TN_9415,0.0401128
GemmTunableOp_Half_TN,tn_8192_2160_8192,Gemm_Hipblaslt_TN_9763,0.500902
GemmTunableOp_Half_TN,tn_8192_2255_28672,Gemm_Hipblaslt_TN_9649,2.21055
GemmTunableOp_Half_TN,tn_8192_2284_8192,Gemm_Hipblaslt_TN_9742,0.51354
GemmTunableOp_Half_TN,tn_8192_60_8192,Gemm_Hipblaslt_TN_7484,0.0391781
GemmTunableOp_Half_TN,tn_57344_2161_8192,Gemm_Hipblaslt_TN_9827,3.97961
GemmTunableOp_Half_TN,tn_57344_57_8192,Gemm_Rocblas_621286468,0.297431
GemmTunableOp_Half_TN,tn_8192_2465_8192,Gemm_Hipblaslt_TN_9774,0.599659
GemmTunableOp_Half_TN,tn_57344_2158_8192,Gemm_Hipblaslt_TN_9667,3.99609
GemmTunableOp_Half_TN,tn_10240_2208_8192,Gemm_Hipblaslt_TN_9182,0.628946
GemmTunableOp_Half_TN,tn_10240_68_8192,Gemm_Hipblaslt_TN_9304,0.0490416
GemmTunableOp_Half_TN,tn_57344_2028_8192,Gemm_Hipblaslt_TN_9840,3.52748
GemmTunableOp_Half_TN,tn_8192_2129_8192,Gemm_Hipblaslt_TN_9742,0.500959
GemmTunableOp_Half_TN,tn_57344_2079_8192,Gemm_Hipblaslt_TN_9841,3.93579
GemmTunableOp_Half_TN,tn_10240_2082_8192,Gemm_Hipblaslt_TN_9182,0.621378
GemmTunableOp_Half_TN,tn_8192_2413_28672,Gemm_Hipblaslt_TN_9649,2.32072
GemmTunableOp_Half_TN,tn_32000_28_8192,Gemm_Rocblas_621286350,0.14559
GemmTunableOp_Half_TN,tn_57344_2178_8192,Gemm_Hipblaslt_TN_9666,4.01379
GemmTunableOp_Half_TN,tn_57344_4049_8192,Gemm_Hipblaslt_TN_9758,6.62544
GemmTunableOp_Half_TN,tn_57344_2129_8192,Gemm_Hipblaslt_TN_9841,3.98624
GemmTunableOp_Half_TN,tn_57344_2465_8192,Gemm_Rocblas_621294015,4.39778
GemmTunableOp_Half_TN,tn_32000_29_8192,Gemm_Rocblas_621286350,0.144016
GemmTunableOp_Half_TN,tn_57344_2113_8192,Gemm_Hipblaslt_TN_9841,3.96877
GemmTunableOp_Half_TN,tn_8192_30_8192,Gemm_Hipblaslt_TN_9415,0.0339848
GemmTunableOp_Half_TN,tn_10240_30_8192,Gemm_Hipblaslt_TN_9415,0.040314
GemmTunableOp_Half_TN,tn_8192_2017_8192,Gemm_Hipblaslt_TN_9840,0.465344
GemmTunableOp_Half_TN,tn_8192_4017_28672,Gemm_Rocblas_621286894,3.40573
GemmTunableOp_Half_TN,tn_8192_4050_28672,Gemm_Rocblas_621286915,3.41756
GemmTunableOp_Half_TN,tn_8192_61_8192,Gemm_Hipblaslt_TN_7484,0.040736
GemmTunableOp_Half_TN,tn_8192_2190_28672,Gemm_Hipblaslt_TN_9762,2.06001
GemmTunableOp_Half_TN,tn_10240_64_8192,Gemm_Hipblaslt_TN_7492,0.0479107
GemmTunableOp_Half_TN,tn_32000_31_8192,Gemm_Rocblas_621286350,0.147846
GemmTunableOp_Half_TN,tn_32000_64_8192,Gemm_Rocblas_621286466,0.160154
GemmTunableOp_Half_TN,tn_8192_2385_28672,Gemm_Hipblaslt_TN_9771,2.3011
GemmTunableOp_Half_TN,tn_8192_2397_28672,Gemm_Hipblaslt_TN_9771,2.28901
GemmTunableOp_Half_TN,tn_10240_2191_8192,Gemm_Hipblaslt_TN_9211,0.630446
GemmTunableOp_Half_TN,tn_32000_67_8192,Gemm_Hipblaslt_TN_9479,0.184505
GemmTunableOp_Half_TN,tn_10240_2417_8192,Gemm_Hipblaslt_TN_9189,0.685607
GemmTunableOp_Half_TN,tn_57344_63_8192,Gemm_Rocblas_621286468,0.302412
GemmTunableOp_Half_TN,tn_10240_2289_8192,Gemm_Hipblaslt_TN_9182,0.65445
GemmTunableOp_Half_TN,tn_8192_60_28672,Gemm_Rocblas_621286489,0.142376
GemmTunableOp_Half_TN,tn_57344_2225_8192,Gemm_Hipblaslt_TN_9827,4.0099
GemmTunableOp_Half_TN,tn_8192_2161_8192,Gemm_Hipblaslt_TN_9742,0.502939
GemmTunableOp_Half_TN,tn_8192_67_8192,Gemm_Hipblaslt_TN_8197,0.043165
GemmTunableOp_Half_TN,tn_10240_2465_8192,Gemm_Hipblaslt_TN_9697,0.691508
GemmTunableOp_Half_TN,tn_57344_2208_8192,Gemm_Hipblaslt_TN_156,3.98475
GemmTunableOp_Half_TN,tn_10240_2397_8192,Gemm_Hipblaslt_TN_9209,0.667954
GemmTunableOp_Half_TN,tn_32000_59_8192,Gemm_Hipblaslt_TN_9463,0.158254
GemmTunableOp_Half_TN,tn_10240_2239_8192,Gemm_Hipblaslt_TN_9182,0.632384
GemmTunableOp_Half_TN,tn_8192_2192_28672,Gemm_Hipblaslt_TN_9762,2.07256
GemmTunableOp_Half_TN,tn_10240_2178_8192,Gemm_Rocblas_621294320,0.630343
GemmTunableOp_Half_TN,tn_10240_67_8192,Gemm_Hipblaslt_TN_9304,0.0500344
GemmTunableOp_Half_TN,tn_8192_2191_28672,Gemm_Hipblaslt_TN_9762,2.06635
GemmTunableOp_Half_TN,tn_8192_4081_28672,Gemm_Rocblas_621286915,3.43132
GemmTunableOp_Half_TN,tn_57344_4050_8192,Gemm_Hipblaslt_TN_9882,6.62516
GemmTunableOp_Half_TN,tn_57344_4000_8192,Gemm_Hipblaslt_TN_9936,6.59964
GemmTunableOp_Half_TN,tn_10240_4000_8192,Gemm_Hipblaslt_TN_9814,1.09501
GemmTunableOp_Half_TN,tn_57344_2081_8192,Gemm_Hipblaslt_TN_9847,3.93582
GemmTunableOp_Half_TN,tn_8192_2415_8192,Gemm_Hipblaslt_TN_9263,0.552096
GemmTunableOp_Half_TN,tn_8192_59_8192,Gemm_Hipblaslt_TN_7484,0.0392806
GemmTunableOp_Half_TN,tn_10240_2127_8192,Gemm_Hipblaslt_TN_9209,0.625205
GemmTunableOp_Half_TN,tn_57344_68_8192,Gemm_Rocblas_621294520,0.322669
GemmTunableOp_Half_TN,tn_57344_4033_8192,Gemm_Rocblas_621294648,6.63011
GemmTunableOp_Half_TN,tn_10240_2305_8192,Gemm_Hipblaslt_TN_9182,0.655602
GemmTunableOp_Half_TN,tn_57344_2385_8192,Default,4.32417
GemmStridedBatchedTunableOp_Half_TN,tn_2289_2289_128_B_64,Gemm_Rocblas_621294106,0.422266
GemmStridedBatchedTunableOp_Half_TN,tn_2128_2128_128_B_64,Gemm_Hipblaslt_TN_158,0.333041
GemmStridedBatchedTunableOp_Half_TN,tn_2160_2160_128_B_64,Gemm_Hipblaslt_TN_158,0.341052
GemmStridedBatchedTunableOp_Half_TN,tn_2048_2048_128_B_64,Gemm_Hipblaslt_TN_9831,0.275534
GemmStridedBatchedTunableOp_Half_TN,tn_2413_2413_128_B_64,Gemm_Rocblas_621294106,0.468755
GemmStridedBatchedTunableOp_Half_TN,tn_2129_2129_128_B_64,Gemm_Rocblas_621294106,0.369288
GemmStridedBatchedTunableOp_Half_TN,tn_2145_2145_128_B_64,Gemm_Rocblas_621294106,0.377735
GemmStridedBatchedTunableOp_Half_TN,tn_2337_2337_128_B_64,Gemm_Rocblas_621294106,0.451306
GemmStridedBatchedTunableOp_Half_TN,tn_2369_2369_128_B_64,Gemm_Rocblas_621294106,0.457108
GemmStridedBatchedTunableOp_Half_TN,tn_2081_2081_128_B_64,Gemm_Rocblas_621294106,0.353937
GemmStridedBatchedTunableOp_Half_TN,tn_2415_2415_128_B_64,Gemm_Rocblas_621294106,0.473109
GemmStridedBatchedTunableOp_Half_TN,tn_2050_2050_128_B_64,Gemm_Rocblas_621294106,0.339615
GemmStridedBatchedTunableOp_Half_TN,tn_2397_2397_128_B_64,Gemm_Rocblas_621294106,0.464024
