Gemm_Tune/Llama-2-70b-hf-1000inp/full_tuned3.csv
Validator,PT_VERSION,2.4.0
Validator,ROCM_VERSION,6.1.0.0-82-5fabb4c
Validator,HIPBLASLT_VERSION,0.7.0-1549b021
Validator,GCN_ARCH_NAME,gfx942:sramecc+:xnack-
Validator,ROCBLAS_VERSION,4.1.0-cefa4a9b-dirty
GemmTunableOp_Half_TN,tn_28672_938_4096,Gemm_Hipblaslt_TN_9683,0.401578
GemmTunableOp_Half_TN,tn_4096_1900_14336,Gemm_Hipblaslt_TN_9645,0.417182
GemmTunableOp_Half_TN,tn_4096_1822_4096,Gemm_Hipblaslt_TN_9602,0.117899
GemmTunableOp_Half_TN,tn_28672_985_4096,Gemm_Hipblaslt_TN_9716,0.443767
GemmTunableOp_Half_TN,tn_28672_877_4096,Gemm_Hipblaslt_TN_9683,0.391574
GemmTunableOp_Half_TN,tn_4096_1719_14336,Gemm_Hipblaslt_TN_9790,0.370178
GemmTunableOp_Half_TN,tn_4096_835_14336,Gemm_Hipblaslt_TN_9131,0.219967
GemmTunableOp_Half_TN,tn_4096_2793_4096,Gemm_Hipblaslt_TN_9788,0.166813
GemmTunableOp_Half_TN,tn_28672_4471_4096,Gemm_Hipblaslt_TN_9914,1.81321
GemmTunableOp_Half_TN,tn_28672_1600_4096,Gemm_Hipblaslt_TN_9674,0.708313
GemmTunableOp_Half_TN,tn_4096_1817_4096,Gemm_Hipblaslt_TN_9645,0.118711
GemmTunableOp_Half_TN,tn_28672_881_4096,Gemm_Hipblaslt_TN_9683,0.392162
GemmTunableOp_Half_TN,tn_4096_2703_4096,Gemm_Rocblas_621294320,0.16349
GemmTunableOp_Half_TN,tn_4096_901_14336,Gemm_Hipblaslt_TN_9634,0.231438
GemmTunableOp_Half_TN,tn_4096_944_14336,Gemm_Hipblaslt_TN_9634,0.233624
GemmTunableOp_Half_TN,tn_4096_2653_14336,Gemm_Rocblas_621294426,0.549648
GemmTunableOp_Half_TN,tn_28672_4242_4096,Gemm_Hipblaslt_TN_9827,1.66613
GemmTunableOp_Half_TN,tn_28672_7944_4096,Gemm_Hipblaslt_TN_159,3.19397
GemmTunableOp_Half_TN,tn_4096_2602_4096,Gemm_Hipblaslt_TN_9799,0.160325
GemmTunableOp_Half_TN,tn_4096_982_14336,Gemm_Hipblaslt_TN_9586,0.246992
GemmTunableOp_Half_TN,tn_6144_915_4096,Gemm_Hipblaslt_TN_9613,0.0944732
GemmTunableOp_Half_TN,tn_4096_815_4096,Gemm_Hipblaslt_TN_9634,0.0639986
GemmTunableOp_Half_TN,tn_6144_944_4096,Gemm_Hipblaslt_TN_9561,0.0944532
GemmTunableOp_Half_TN,tn_4096_2571_4096,Gemm_Hipblaslt_TN_9657,0.159986
GemmTunableOp_Half_TN,tn_128256_91_4096,Gemm_Hipblaslt_TN_9057,0.399787
GemmTunableOp_Half_TN,tn_6144_3352_4096,Gemm_Rocblas_621294306,0.307306
GemmTunableOp_Half_TN,tn_4096_8007_4096,Gemm_Rocblas_621294127,0.45031
GemmTunableOp_Half_TN,tn_28672_1791_4096,Gemm_Hipblaslt_TN_9217,0.752002
GemmTunableOp_Half_TN,tn_4096_1791_4096,Gemm_Hipblaslt_TN_9134,0.11697
GemmTunableOp_Half_TN,tn_6144_940_4096,Gemm_Hipblaslt_TN_9561,0.0936747
GemmTunableOp_Half_TN,tn_28672_906_4096,Gemm_Hipblaslt_TN_9684,0.395242
GemmTunableOp_Half_TN,tn_6144_848_4096,Gemm_Rocblas_621286778,0.0884342
GemmTunableOp_Half_TN,tn_6144_1644_4096,Gemm_Hipblaslt_TN_9570,0.153349
GemmTunableOp_Half_TN,tn_4096_1835_4096,Gemm_Hipblaslt_TN_9645,0.119849
GemmTunableOp_Half_TN,tn_28672_984_4096,Gemm_Hipblaslt_TN_9666,0.43836
GemmTunableOp_Half_TN,tn_4096_1791_14336,Gemm_Hipblaslt_TN_9645,0.398307
GemmTunableOp_Half_TN,tn_4096_887_4096,Gemm_Hipblaslt_TN_9634,0.0671445
GemmTunableOp_Half_TN,tn_4096_2805_14336,Gemm_Hipblaslt_TN_9799,0.575819
GemmTunableOp_Half_TN,tn_28672_2560_4096,Gemm_Hipblaslt_TN_9846,1.04169
GemmTunableOp_Half_TN,tn_128256_126_4096,Gemm_Hipblaslt_TN_9061,0.438389
GemmTunableOp_Half_TN,tn_4096_797_4096,Gemm_Hipblaslt_TN_9634,0.0629065
GemmTunableOp_Half_TN,tn_4096_844_4096,Gemm_Hipblaslt_TN_9170,0.0651727
GemmTunableOp_Half_TN,tn_4096_240_4096,Gemm_Rocblas_621294230,0.0258657
GemmTunableOp_Half_TN,tn_6144_1807_4096,Gemm_Rocblas_621286684,0.164693
GemmTunableOp_Half_TN,tn_128256_114_4096,Gemm_Hipblaslt_TN_9263,0.434832
GemmTunableOp_Half_TN,tn_4096_1695_14336,Gemm_Hipblaslt_TN_9180,0.368996
GemmTunableOp_Half_TN,tn_28672_2785_4096,Gemm_Hipblaslt_TN_9827,1.19908
GemmTunableOp_Half_TN,tn_28672_1739_4096,Gemm_Hipblaslt_TN_9730,0.7374
GemmTunableOp_Half_TN,tn_28672_940_4096,Gemm_Hipblaslt_TN_9683,0.403227
GemmTunableOp_Half_TN,tn_4096_1757_4096,Gemm_Hipblaslt_TN_9590,0.117999
GemmTunableOp_Half_TN,tn_6144_3447_4096,Gemm_Rocblas_621286753,0.312035
GemmTunableOp_Half_TN,tn_4096_1755_4096,Gemm_Hipblaslt_TN_9645,0.117578
GemmTunableOp_Half_TN,tn_4096_854_14336,Gemm_Hipblaslt_TN_9580,0.216449
GemmTunableOp_Half_TN,tn_8192_3379_28672,Gemm_Hipblaslt_TN_9732,2.94731
GemmTunableOp_Half_TN,tn_128256_175_4096,Gemm_Hipblaslt_TN_9683,0.529804
GemmTunableOp_Half_TN,tn_4096_2636_4096,Gemm_Hipblaslt_TN_9799,0.162638
GemmTunableOp_Half_TN,tn_128256_14_4096,Gemm_Hipblaslt_TN_9405,0.295246
GemmTunableOp_Half_TN,tn_128256_19_4096,Gemm_Hipblaslt_TN_9451,0.310632
GemmTunableOp_Half_TN,tn_4096_947_4096,Gemm_Hipblaslt_TN_9634,0.0687203
GemmTunableOp_Half_TN,tn_6144_790_4096,Gemm_Hipblaslt_TN_9613,0.0864496
GemmTunableOp_Half_TN,tn_6144_982_4096,Gemm_Rocblas_621286571,0.101051
GemmTunableOp_Half_TN,tn_4096_2788_4096,Gemm_Hipblaslt_TN_9787,0.168285
GemmTunableOp_Half_TN,tn_28672_1694_4096,Gemm_Hipblaslt_TN_9730,0.736301
GemmTunableOp_Half_TN,tn_8192_110_8192,Gemm_Hipblaslt_TN_8891,0.0525732
GemmTunableOp_Half_TN,tn_128256_210_4096,Gemm_Hipblaslt_TN_9937,0.580763
GemmTunableOp_Half_TN,tn_6144_1746_4096,Gemm_Rocblas_621286705,0.159708
GemmTunableOp_Half_TN,tn_8192_1256_8192,Gemm_Hipblaslt_TN_9690,0.299051
GemmTunableOp_Half_TN,tn_4096_825_4096,Gemm_Hipblaslt_TN_9352,0.0643234
GemmTunableOp_Half_TN,tn_10240_20_8192,Gemm_Hipblaslt_TN_9415,0.0394634
GemmTunableOp_Half_TN,tn_4096_2764_4096,Gemm_Hipblaslt_TN_9709,0.167667
GemmTunableOp_Half_TN,tn_4096_1785_4096,Gemm_Hipblaslt_TN_9134,0.117352
GemmTunableOp_Half_TN,tn_128256_232_4096,Gemm_Rocblas_621294634,0.602153
GemmTunableOp_Half_TN,tn_6144_112_4096,Gemm_Rocblas_621294168,0.0234621
GemmTunableOp_Half_TN,tn_28672_1867_4096,Gemm_Hipblaslt_TN_9684,0.798731
GemmTunableOp_Half_TN,tn_128256_171_4096,Gemm_Hipblaslt_TN_9661,0.53122
GemmTunableOp_Half_TN,tn_128256_164_4096,Gemm_Hipblaslt_TN_9952,0.524198
GemmTunableOp_Half_TN,tn_128256_122_4096,Gemm_Hipblaslt_TN_9061,0.439068
GemmTunableOp_Half_TN,tn_32000_130_8192,Gemm_Hipblaslt_TN_9506,0.246239
GemmTunableOp_Half_TN,tn_57344_3971_8192,Gemm_Hipblaslt_TN_9936,6.61464
GemmTunableOp_Half_TN,tn_57344_129_8192,Gemm_Hipblaslt_TN_9507,0.3936
GemmTunableOp_Half_TN,tn_128256_108_4096,Gemm_Rocblas_621294011,0.432636
GemmTunableOp_Half_TN,tn_6144_1730_4096,Gemm_Hipblaslt_TN_9691,0.158843
GemmTunableOp_Half_TN,tn_28672_1954_4096,Gemm_Hipblaslt_TN_9846,0.851133
GemmTunableOp_Half_TN,tn_128256_240_4096,Gemm_Rocblas_621286892,0.611092
GemmTunableOp_Half_TN,tn_128256_63_4096,Gemm_Rocblas_621286816,0.359422
GemmTunableOp_Half_TN,tn_8192_109_8192,Gemm_Hipblaslt_TN_8891,0.0515689
GemmTunableOp_Half_TN,tn_10240_1389_8192,Gemm_Hipblaslt_TN_9194,0.396899
GemmTunableOp_Half_TN,tn_57344_121_8192,Gemm_Rocblas_621294214,0.362674
GemmTunableOp_Half_TN,tn_128256_140_4096,Gemm_Hipblaslt_TN_9108,0.475052
GemmTunableOp_Half_TN,tn_128256_185_4096,Gemm_Hipblaslt_TN_9683,0.535812
GemmTunableOp_Half_TN,tn_8192_1153_8192,Gemm_Hipblaslt_TN_9690,0.292739
GemmTunableOp_Half_TN,tn_4096_850_14336,Gemm_Hipblaslt_TN_9580,0.218859
GemmTunableOp_Half_TN,tn_8192_3785_8192,Gemm_Hipblaslt_TN_9753,0.834989
GemmTunableOp_Half_TN,tn_4096_1834_4096,Gemm_Hipblaslt_TN_9645,0.119716
GemmTunableOp_Half_TN,tn_4096_2719_4096,Gemm_Hipblaslt_TN_9799,0.163238
GemmTunableOp_Half_TN,tn_4096_820_14336,Gemm_Hipblaslt_TN_9147,0.217299
GemmTunableOp_Half_TN,tn_28672_8_4096,Gemm_Rocblas_621294053,0.044266
GemmTunableOp_Half_TN,tn_57344_2015_8192,Default,3.4598
GemmTunableOp_Half_TN,tn_8192_127_8192,Gemm_Hipblaslt_TN_7157,0.0535895
GemmTunableOp_Half_TN,tn_32000_25_8192,Gemm_Rocblas_621286350,0.148695
GemmTunableOp_Half_TN,tn_4096_7804_14336,Gemm_Hipblaslt_TN_9749,1.59957
GemmTunableOp_Half_TN,tn_10240_119_8192,Gemm_Rocblas_621286764,0.0616232
GemmTunableOp_Half_TN,tn_10240_2032_8192,Gemm_Rocblas_621286569,0.596716
GemmTunableOp_Half_TN,tn_8192_4096_28672,Gemm_Rocblas_621294648,3.45876
GemmTunableOp_Half_TN,tn_32000_99_8192,Gemm_Rocblas_621286475,0.207638
GemmTunableOp_Half_TN,tn_128256_24_4096,Gemm_Hipblaslt_TN_9451,0.315224
GemmTunableOp_Half_TN,tn_57344_3715_8192,Gemm_Hipblaslt_TN_9937,6.45629
GemmTunableOp_Half_TN,tn_6144_907_4096,Gemm_Hipblaslt_TN_9613,0.0931756
GemmTunableOp_Half_TN,tn_8192_3651_8192,Gemm_Hipblaslt_TN_9753,0.820336
GemmTunableOp_Half_TN,tn_8192_3235_8192,Gemm_Hipblaslt_TN_9697,0.721883
GemmTunableOp_Half_TN,tn_6144_8000_4096,Gemm_Rocblas_621294127,0.67757
GemmTunableOp_Half_TN,tn_128256_166_4096,Gemm_Hipblaslt_TN_9752,0.525815
GemmTunableOp_Half_TN,tn_8192_124_8192,Gemm_Hipblaslt_TN_8891,0.0554615
GemmTunableOp_Half_TN,tn_4096_1672_4096,Gemm_Hipblaslt_TN_9671,0.107002
GemmTunableOp_Half_TN,tn_8192_3619_28672,Gemm_Hipblaslt_TN_9732,3.06592
GemmTunableOp_Half_TN,tn_4096_2699_14336,Gemm_Hipblaslt_TN_9799,0.555627
GemmTunableOp_Half_TN,tn_4096_1733_4096,Gemm_Hipblaslt_TN_9267,0.116897
GemmTunableOp_Half_TN,tn_8192_130_8192,Gemm_Hipblaslt_TN_7561,0.0580712
GemmTunableOp_Half_TN,tn_8192_13_8192,Gemm_Hipblaslt_TN_9392,0.030572
GemmTunableOp_Half_TN,tn_4096_3402_4096,Gemm_Hipblaslt_TN_9697,0.195564
GemmTunableOp_Half_TN,tn_10240_1286_8192,Gemm_Hipblaslt_TN_9697,0.361588
GemmTunableOp_Half_TN,tn_8192_3251_8192,Gemm_Hipblaslt_TN_9697,0.723976
GemmTunableOp_Half_TN,tn_8192_1185_8192,Gemm_Hipblaslt_TN_9690,0.295636
GemmTunableOp_Half_TN,tn_8192_108_28672,Gemm_Hipblaslt_TN_8378,0.204017
GemmTunableOp_Half_TN,tn_8192_1392_28672,Gemm_Hipblaslt_TN_9799,1.28655
GemmTunableOp_Half_TN,tn_8192_4000_28672,Gemm_Rocblas_621294636,3.42523
GemmTunableOp_Half_TN,tn_6144_854_4096,Gemm_Rocblas_621294520,0.088653
GemmTunableOp_Half_TN,tn_8192_112_28672,Gemm_Hipblaslt_TN_8378,0.200572
GemmTunableOp_Half_TN,tn_8192_1271_8192,Gemm_Hipblaslt_TN_9690,0.302509
GemmTunableOp_Half_TN,tn_10240_99_8192,Gemm_Rocblas_621294504,0.0591594
GemmTunableOp_Half_TN,tn_28672_959_4096,Gemm_Hipblaslt_TN_9684,0.403886
GemmTunableOp_Half_TN,tn_57344_3000_8192,Gemm_Hipblaslt_TN_9862,5.06526
GemmTunableOp_Half_TN,tn_4096_208_14336,Gemm_Hipblaslt_TN_7378,0.0706657
GemmTunableOp_Half_TN,tn_10240_1217_8192,Gemm_Hipblaslt_TN_9798,0.35178
GemmTunableOp_Half_TN,tn_28672_893_4096,Gemm_Hipblaslt_TN_9684,0.394026
GemmTunableOp_Half_TN,tn_128256_254_4096,Gemm_Rocblas_621294648,0.615209
GemmTunableOp_Half_TN,tn_4096_2572_4096,Gemm_Hipblaslt_TN_9799,0.158958
GemmTunableOp_Half_TN,tn_6144_7953_4096,Gemm_Hipblaslt_TN_9813,0.671251
GemmTunableOp_Half_TN,tn_10240_1008_8192,Gemm_Rocblas_621294309,0.297457
GemmTunableOp_Half_TN,tn_10240_21_8192,Gemm_Hipblaslt_TN_9415,0.0395195
GemmTunableOp_Half_TN,tn_28672_7817_4096,Gemm_Hipblaslt_TN_159,3.00857
GemmTunableOp_Half_TN,tn_57344_118_8192,Gemm_Rocblas_621286477,0.357627
GemmTunableOp_Half_TN,tn_10240_128_8192,Gemm_Rocblas_621286764,0.061851
GemmTunableOp_Half_TN,tn_128256_9_4096,Gemm_Hipblaslt_TN_9405,0.287412
GemmTunableOp_Half_TN,tn_4096_1748_14336,Gemm_Hipblaslt_TN_9645,0.395337
GemmTunableOp_Half_TN,tn_8192_2692_8192,Gemm_Rocblas_621294315,0.630572
GemmTunableOp_Half_TN,tn_6144_32_4096,Gemm_Rocblas_621286488,0.0138262
GemmTunableOp_Half_TN,tn_28672_1746_4096,Gemm_Hipblaslt_TN_9190,0.741679
GemmTunableOp_Half_TN,tn_8192_121_8192,Gemm_Hipblaslt_TN_8891,0.0558689
GemmTunableOp_Half_TN,tn_4096_1744_14336,Gemm_Hipblaslt_TN_9645,0.395426
GemmTunableOp_Half_TN,tn_4096_840_14336,Gemm_Hipblaslt_TN_9580,0.225167
GemmTunableOp_Half_TN,tn_4096_796_14336,Gemm_Hipblaslt_TN_9158,0.212825
GemmTunableOp_Half_TN,tn_28672_2651_4096,Gemm_Hipblaslt_TN_9827,1.09003
GemmTunableOp_Half_TN,tn_10240_2549_8192,Gemm_Hipblaslt_TN_9814,0.729524
GemmTunableOp_Half_TN,tn_32000_108_8192,Gemm_Rocblas_621286475,0.213711
GemmTunableOp_Half_TN,tn_128256_83_4096,Gemm_Hipblaslt_TN_9057,0.389135
GemmTunableOp_Half_TN,tn_6144_7944_4096,Gemm_Hipblaslt_TN_9815,0.671096
GemmTunableOp_Half_TN,tn_8192_1248_8192,Gemm_Hipblaslt_TN_9690,0.300083
GemmTunableOp_Half_TN,tn_4096_813_4096,Gemm_Hipblaslt_TN_9634,0.0644095
GemmTunableOp_Half_TN,tn_57344_111_8192,Gemm_Rocblas_621286477,0.356697
GemmTunableOp_Half_TN,tn_28672_32_4096,Gemm_Rocblas_621286818,0.0457397
GemmTunableOp_Half_TN,tn_8192_92_28672,Gemm_Hipblaslt_TN_8899,0.187564
GemmTunableOp_Half_TN,tn_10240_1321_8192,Gemm_Hipblaslt_TN_9697,0.365386
GemmTunableOp_Half_TN,tn_10240_129_8192,Gemm_Hipblaslt_TN_9367,0.0668078
GemmTunableOp_Half_TN,tn_57344_99_8192,Gemm_Rocblas_621286477,0.350205
GemmTunableOp_Half_TN,tn_8192_113_8192,Gemm_Hipblaslt_TN_8891,0.0513223
GemmTunableOp_Half_TN,tn_128256_52_4096,Gemm_Rocblas_621294554,0.353627
GemmTunableOp_Half_TN,tn_4096_957_14336,Gemm_Hipblaslt_TN_9634,0.234424
GemmTunableOp_Half_TN,tn_6144_4471_4096,Gemm_Hipblaslt_TN_9677,0.391848
GemmTunableOp_Half_TN,tn_10240_2015_8192,Gemm_Hipblaslt_TN_9649,0.591248
GemmTunableOp_Half_TN,tn_6144_1701_4096,Gemm_Hipblaslt_TN_9690,0.157538
GemmTunableOp_Half_TN,tn_10240_1297_8192,Gemm_Hipblaslt_TN_9697,0.360937
GemmTunableOp_Half_TN,tn_32000_98_8192,Gemm_Rocblas_621294212,0.206123
GemmTunableOp_Half_TN,tn_57344_1256_8192,Gemm_Hipblaslt_TN_9068,2.35432
GemmTunableOp_Half_TN,tn_128256_160_4096,Gemm_Hipblaslt_TN_9108,0.472349
GemmTunableOp_Half_TN,tn_28672_886_4096,Gemm_Hipblaslt_TN_9683,0.39349
GemmTunableOp_Half_TN,tn_10240_111_8192,Gemm_Rocblas_621286764,0.0602024
GemmTunableOp_Half_TN,tn_10240_113_8192,Gemm_Rocblas_621294504,0.0600604
GemmTunableOp_Half_TN,tn_6144_2681_4096,Gemm_Hipblaslt_TN_9813,0.224639
GemmTunableOp_Half_TN,tn_8192_98_8192,Gemm_Hipblaslt_TN_8891,0.0488698
GemmTunableOp_Half_TN,tn_8192_4083_8192,Gemm_Hipblaslt_TN_9768,0.889426
GemmTunableOp_Half_TN,tn_4096_971_4096,Gemm_Hipblaslt_TN_9634,0.0703252
GemmTunableOp_Half_TN,tn_57344_131_8192,Gemm_Hipblaslt_TN_9507,0.39329
GemmTunableOp_Half_TN,tn_32000_9_8192,Gemm_Rocblas_621286321,0.137222
GemmTunableOp_Half_TN,tn_4096_2648_4096,Gemm_Hipblaslt_TN_9799,0.163092
GemmTunableOp_Half_TN,tn_4096_811_14336,Gemm_Hipblaslt_TN_9158,0.216019
GemmTunableOp_Half_TN,tn_10240_1281_8192,Gemm_Hipblaslt_TN_9697,0.359147
GemmTunableOp_Half_TN,tn_32000_101_8192,Gemm_Rocblas_621294212,0.20851
GemmTunableOp_Half_TN,tn_10240_2802_8192,Gemm_Hipblaslt_TN_9743,0.771046
GemmTunableOp_Half_TN,tn_8192_3619_8192,Gemm_Hipblaslt_TN_9677,0.790883
GemmTunableOp_Half_TN,tn_10240_94_8192,Gemm_Hipblaslt_TN_8095,0.0546173
GemmTunableOp_Half_TN,tn_8192_3178_28672,Gemm_Hipblaslt_TN_9732,2.88172
GemmTunableOp_Half_TN,tn_57344_1008_8192,Gemm_Rocblas_621286801,1.80701
GemmTunableOp_Half_TN,tn_10240_2760_8192,Gemm_Hipblaslt_TN_9743,0.766901
GemmTunableOp_Half_TN,tn_32000_21_8192,Gemm_Rocblas_621286348,0.149291
GemmTunableOp_Half_TN,tn_10240_9_8192,Gemm_Hipblaslt_TN_9411,0.0370629
GemmTunableOp_Half_TN,tn_10240_2551_8192,Gemm_Hipblaslt_TN_9832,0.734888
GemmTunableOp_Half_TN,tn_8192_3475_8192,Gemm_Hipblaslt_TN_9697,0.773956
GemmTunableOp_Half_TN,tn_57344_1201_8192,Gemm_Hipblaslt_TN_9068,2.30931
GemmTunableOp_Half_TN,tn_128256_100_4096,Gemm_Hipblaslt_TN_9263,0.42683
GemmTunableOp_Half_TN,tn_10240_1249_8192,Gemm_Hipblaslt_TN_9697,0.357354
GemmTunableOp_Half_TN,tn_8192_4083_28672,Gemm_Rocblas_621294658,3.46438
GemmTunableOp_Half_TN,tn_128256_205_4096,Gemm_Hipblaslt_TN_9937,0.580407
GemmTunableOp_Half_TN,tn_4096_2560_14336,Gemm_Rocblas_621286705,0.528969
GemmTunableOp_Half_TN,tn_28672_2793_4096,Gemm_Hipblaslt_TN_9847,1.19079
GemmTunableOp_Half_TN,tn_4096_852_14336,Gemm_Hipblaslt_TN_9580,0.22042
GemmTunableOp_Half_TN,tn_32000_129_8192,Gemm_Hipblaslt_TN_9506,0.24478
GemmTunableOp_Half_TN,tn_10240_3715_8192,Gemm_Hipblaslt_TN_9743,1.06168
GemmTunableOp_Half_TN,tn_4096_808_14336,Gemm_Hipblaslt_TN_9158,0.214033
GemmTunableOp_Half_TN,tn_32000_23_8192,Gemm_Rocblas_621286348,0.151218
GemmTunableOp_Half_TN,tn_4096_1739_4096,Gemm_Hipblaslt_TN_9645,0.11822
GemmTunableOp_Half_TN,tn_8192_3546_8192,Gemm_Hipblaslt_TN_9697,0.785824
GemmTunableOp_Half_TN,tn_8192_105_28672,Gemm_Hipblaslt_TN_8378,0.200915
GemmTunableOp_Half_TN,tn_6144_2599_4096,Gemm_Rocblas_621294484,0.221365
GemmTunableOp_Half_TN,tn_28672_3671_4096,Gemm_Hipblaslt_TN_9827,1.50979
GemmTunableOp_Half_TN,tn_8192_25_28672,Gemm_Hipblaslt_TN_9426,0.140859
GemmTunableOp_Half_TN,tn_8192_3187_28672,Gemm_Hipblaslt_TN_9732,2.87153
GemmTunableOp_Half_TN,tn_32000_117_8192,Gemm_Rocblas_621286475,0.217375
GemmTunableOp_Half_TN,tn_8192_4091_28672,Gemm_Rocblas_621294658,3.46004
GemmTunableOp_Half_TN,tn_128256_32_4096,Gemm_Rocblas_621294578,0.31246
GemmTunableOp_Half_TN,tn_6144_802_4096,Gemm_Rocblas_621294520,0.0880892
GemmTunableOp_Half_TN,tn_10240_1350_8192,Gemm_Hipblaslt_TN_9284,0.393226
GemmTunableOp_Half_TN,tn_8192_1249_28672,Gemm_Hipblaslt_TN_9774,1.194
GemmTunableOp_Half_TN,tn_10240_4035_8192,Gemm_Hipblaslt_TN_9697,1.14915
GemmTunableOp_Half_TN,tn_28672_898_4096,Gemm_Hipblaslt_TN_9683,0.394379
GemmTunableOp_Half_TN,tn_8192_14_28672,Gemm_Hipblaslt_TN_9403,0.128989
GemmTunableOp_Half_TN,tn_32000_116_8192,Gemm_Rocblas_621294212,0.217223
GemmTunableOp_Half_TN,tn_57344_3299_8192,Gemm_Rocblas_621286892,5.86441
GemmTunableOp_Half_TN,tn_10240_3475_8192,Gemm_Hipblaslt_TN_9799,1.00001
GemmTunableOp_Half_TN,tn_8192_1319_28672,Gemm_Hipblaslt_TN_9774,1.21941
GemmTunableOp_Half_TN,tn_6144_4483_4096,Gemm_Hipblaslt_TN_9697,0.392206
GemmTunableOp_Half_TN,tn_8192_106_8192,Gemm_Hipblaslt_TN_8891,0.051633
GemmTunableOp_Half_TN,tn_8192_1104_28672,Gemm_Hipblaslt_TN_9762,1.0854
GemmTunableOp_Half_TN,tn_6144_1817_4096,Gemm_Hipblaslt_TN_9691,0.164796
GemmTunableOp_Half_TN,tn_4096_1727_14336,Gemm_Hipblaslt_TN_9790,0.372639
GemmTunableOp_Half_TN,tn_57344_1000_8192,Gemm_Rocblas_621294542,1.8047
GemmTunableOp_Half_TN,tn_10240_2000_8192,Gemm_Rocblas_621294310,0.594657
GemmTunableOp_Half_TN,tn_57344_3331_8192,Gemm_Hipblaslt_TN_9816,5.89033
GemmTunableOp_Half_TN,tn_6144_1649_4096,Gemm_Hipblaslt_TN_9570,0.151957
GemmTunableOp_Half_TN,tn_4096_3447_14336,Gemm_Hipblaslt_TN_9832,0.672701
GemmTunableOp_Half_TN,tn_8192_93_28672,Gemm_Hipblaslt_TN_7093,0.187721
GemmTunableOp_Half_TN,tn_57344_2000_8192,Gemm_Hipblaslt_TN_9830,3.50486
GemmTunableOp_Half_TN,tn_32000_92_8192,Gemm_Rocblas_621286475,0.20416
GemmTunableOp_Half_TN,tn_28672_1883_4096,Gemm_Hipblaslt_TN_9684,0.801757
GemmTunableOp_Half_TN,tn_128256_148_4096,Gemm_Hipblaslt_TN_9108,0.47991
GemmTunableOp_Half_TN,tn_10240_3482_8192,Gemm_Hipblaslt_TN_9799,0.998541
GemmTunableOp_Half_TN,tn_4096_3599_14336,Gemm_Hipblaslt_TN_9743,0.695359
GemmTunableOp_Half_TN,tn_8192_1367_28672,Gemm_Hipblaslt_TN_9799,1.28247
GemmTunableOp_Half_TN,tn_10240_5_8192,Gemm_Rocblas_621294049,0.0366135
GemmTunableOp_Half_TN,tn_8192_2622_28672,Gemm_Hipblaslt_TN_9774,2.3852
GemmTunableOp_Half_TN,tn_6144_972_4096,Gemm_Rocblas_621294311,0.100154
GemmTunableOp_Half_TN,tn_10240_102_8192,Gemm_Hipblaslt_TN_8892,0.0607224
GemmTunableOp_Half_TN,tn_4096_830_4096,Gemm_Hipblaslt_TN_9604,0.0646646
GemmTunableOp_Half_TN,tn_28672_8156_4096,Gemm_Hipblaslt_TN_9882,3.3508
GemmTunableOp_Half_TN,tn_6144_2572_4096,Gemm_Hipblaslt_TN_9827,0.219577
GemmTunableOp_Half_TN,tn_57344_3379_8192,Gemm_Hipblaslt_TN_159,5.72099
GemmTunableOp_Half_TN,tn_6144_1827_4096,Gemm_Rocblas_621294426,0.165824
GemmTunableOp_Half_TN,tn_28672_971_4096,Gemm_Hipblaslt_TN_9666,0.441454
GemmTunableOp_Half_TN,tn_4096_2682_14336,Gemm_Hipblaslt_TN_9799,0.555521
GemmTunableOp_Half_TN,tn_10240_126_8192,Gemm_Hipblaslt_TN_7543,0.0645951
GemmTunableOp_Half_TN,tn_6144_888_4096,Gemm_Hipblaslt_TN_9561,0.0924116
GemmTunableOp_Half_TN,tn_8192_107_8192,Gemm_Hipblaslt_TN_8891,0.0504246
GemmTunableOp_Half_TN,tn_4096_1614_4096,Gemm_Hipblaslt_TN_9679,0.105795
GemmTunableOp_Half_TN,tn_8192_111_8192,Gemm_Hipblaslt_TN_7157,0.0510405
GemmTunableOp_Half_TN,tn_8192_111_28672,Gemm_Hipblaslt_TN_8378,0.200296
GemmTunableOp_Half_TN,tn_128256_90_4096,Gemm_Hipblaslt_TN_9057,0.393783
GemmTunableOp_Half_TN,tn_4096_1846_4096,Gemm_Hipblaslt_TN_9645,0.12141
GemmTunableOp_Half_TN,tn_28672_1724_4096,Gemm_Hipblaslt_TN_9223,0.739256
GemmTunableOp_Half_TN,tn_4096_790_4096,Gemm_Hipblaslt_TN_9604,0.0635863
GemmTunableOp_Half_TN,tn_128256_18_4096,Gemm_Rocblas_621294226,0.310678
GemmTunableOp_Half_TN,tn_8192_2041_8192,Gemm_Hipblaslt_TN_9742,0.477404
GemmTunableOp_Half_TN,tn_10240_2166_8192,Gemm_Hipblaslt_TN_9690,0.63851
GemmTunableOp_Half_TN,tn_8192_3603_8192,Gemm_Hipblaslt_TN_9743,0.789094
GemmTunableOp_Half_TN,tn_4096_8070_4096,Gemm_Hipblaslt_TN_9704,0.459059
GemmTunableOp_Half_TN,tn_8192_1268_28672,Gemm_Hipblaslt_TN_9774,1.19408
GemmTunableOp_Half_TN,tn_8192_113_28672,Gemm_Hipblaslt_TN_8378,0.202711
GemmTunableOp_Half_TN,tn_8192_20_8192,Gemm_Hipblaslt_TN_9415,0.0328049
GemmTunableOp_Half_TN,tn_10240_1377_8192,Gemm_Hipblaslt_TN_9284,0.396033
GemmTunableOp_Half_TN,tn_4096_16_4096,Gemm_Rocblas_621294130,0.0101483
GemmTunableOp_Half_TN,tn_10240_122_8192,Gemm_Hipblaslt_TN_7157,0.0623958
GemmTunableOp_Half_TN,tn_57344_3754_8192,Gemm_Hipblaslt_TN_9908,6.40268
GemmTunableOp_Half_TN,tn_4096_1931_4096,Gemm_Hipblaslt_TN_9645,0.122836
GemmTunableOp_Half_TN,tn_4096_1822_14336,Gemm_Hipblaslt_TN_9174,0.411323
GemmTunableOp_Half_TN,tn_8192_3283_28672,Gemm_Hipblaslt_TN_9732,2.90658
GemmTunableOp_Half_TN,tn_8192_3498_28672,Gemm_Hipblaslt_TN_9732,3.01858
GemmTunableOp_Half_TN,tn_8192_105_8192,Gemm_Hipblaslt_TN_8891,0.0508279
GemmTunableOp_Half_TN,tn_8192_3491_8192,Gemm_Hipblaslt_TN_9743,0.776746
GemmTunableOp_Half_TN,tn_8192_3203_28672,Gemm_Hipblaslt_TN_9732,2.8926
GemmTunableOp_Half_TN,tn_28672_3599_4096,Gemm_Hipblaslt_TN_9832,1.47259
GemmTunableOp_Half_TN,tn_10240_1224_8192,Gemm_Hipblaslt_TN_9798,0.354077
GemmTunableOp_Half_TN,tn_4096_946_14336,Gemm_Hipblaslt_TN_9634,0.235299
GemmTunableOp_Half_TN,tn_8192_1374_8192,Gemm_Hipblaslt_TN_9690,0.321774
GemmTunableOp_Half_TN,tn_4096_4483_4096,Gemm_Hipblaslt_TN_9742,0.270962
GemmTunableOp_Half_TN,tn_57344_132_8192,Gemm_Hipblaslt_TN_9507,0.394435
GemmTunableOp_Half_TN,tn_8192_1389_28672,Gemm_Hipblaslt_TN_9672,1.28683
GemmTunableOp_Half_TN,tn_10240_1329_8192,Gemm_Hipblaslt_TN_9697,0.364682
GemmTunableOp_Half_TN,tn_8192_1160_28672,Gemm_Hipblaslt_TN_9774,1.16223
GemmTunableOp_Half_TN,tn_10240_3626_8192,Gemm_Hipblaslt_TN_9743,1.03865
GemmTunableOp_Half_TN,tn_57344_3203_8192,Gemm_Hipblaslt_TN_9818,5.57688
GemmTunableOp_Half_TN,tn_28672_8069_4096,Gemm_Hipblaslt_TN_9841,3.32985
GemmTunableOp_Half_TN,tn_28672_3670_4096,Gemm_Hipblaslt_TN_9827,1.50636
GemmTunableOp_Half_TN,tn_10240_105_8192,Gemm_Rocblas_621286764,0.0584507
GemmTunableOp_Half_TN,tn_4096_1848_14336,Gemm_Hipblaslt_TN_9620,0.412747
GemmTunableOp_Half_TN,tn_28672_1886_4096,Gemm_Hipblaslt_TN_9221,0.815048
GemmTunableOp_Half_TN,tn_8192_95_8192,Gemm_Hipblaslt_TN_8197,0.0478251
GemmTunableOp_Half_TN,tn_128256_153_4096,Gemm_Hipblaslt_TN_9108,0.479332
GemmTunableOp_Half_TN,tn_57344_105_8192,Default,0.351651
GemmTunableOp_Half_TN,tn_6144_922_4096,Gemm_Hipblaslt_TN_9561,0.0931857
GemmTunableOp_Half_TN,tn_6144_1756_4096,Gemm_Hipblaslt_TN_9691,0.159858
GemmTunableOp_Half_TN,tn_128256_106_4096,Gemm_Hipblaslt_TN_9061,0.433366
GemmTunableOp_Half_TN,tn_4096_881_14336,Gemm_Hipblaslt_TN_9580,0.218789
GemmTunableOp_Half_TN,tn_32000_132_8192,Gemm_Hipblaslt_TN_9506,0.246387
GemmTunableOp_Half_TN,tn_8192_4090_8192,Gemm_Rocblas_621286590,0.892876
GemmTunableOp_Half_TN,tn_6144_200_4096,Gemm_Hipblaslt_TN_9495,0.0320797
GemmTunableOp_Half_TN,tn_28672_805_4096,Gemm_Hipblaslt_TN_9684,0.379026
GemmTunableOp_Half_TN,tn_57344_1392_8192,Gemm_Hipblaslt_TN_9830,2.59614
GemmTunableOp_Half_TN,tn_8192_3235_28672,Gemm_Hipblaslt_TN_9732,2.87676
GemmTunableOp_Half_TN,tn_28672_2719_4096,Gemm_Hipblaslt_TN_9787,1.17995
GemmTunableOp_Half_TN,tn_10240_92_8192,Gemm_Hipblaslt_TN_8095,0.0545192
GemmTunableOp_Half_TN,tn_10240_117_8192,Gemm_Hipblaslt_TN_7157,0.0620854
GemmTunableOp_Half_TN,tn_8192_1168_28672,Gemm_Hipblaslt_TN_9774,1.16308
GemmTunableOp_Half_TN,tn_57344_3274_8192,Gemm_Hipblaslt_TN_9816,5.83443
GemmTunableOp_Half_TN,tn_57344_1374_8192,Gemm_Hipblaslt_TN_9830,2.57748
GemmTunableOp_Half_TN,tn_8192_10_28672,Gemm_Hipblaslt_TN_9403,0.126504
GemmTunableOp_Half_TN,tn_28672_1828_4096,Gemm_Hipblaslt_TN_9684,0.796213
GemmTunableOp_Half_TN,tn_8192_2639_28672,Gemm_Hipblaslt_TN_9774,2.39256
GemmTunableOp_Half_TN,tn_28672_900_4096,Gemm_Hipblaslt_TN_9683,0.396834
GemmTunableOp_Half_TN,tn_8192_102_28672,Gemm_Hipblaslt_TN_8378,0.198558
GemmTunableOp_Half_TN,tn_8192_100_8192,Gemm_Hipblaslt_TN_8891,0.0499139
GemmTunableOp_Half_TN,tn_28672_1715_4096,Gemm_Hipblaslt_TN_9223,0.731128
GemmTunableOp_Half_TN,tn_10240_106_8192,Gemm_Hipblaslt_TN_8892,0.0618034
GemmTunableOp_Half_TN,tn_28672_1944_4096,Gemm_Hipblaslt_TN_9846,0.847066
GemmTunableOp_Half_TN,tn_57344_126_8192,Default,0.360546
GemmTunableOp_Half_TN,tn_28672_964_4096,Gemm_Hipblaslt_TN_9666,0.439094
GemmTunableOp_Half_TN,tn_4096_938_14336,Gemm_Hipblaslt_TN_9634,0.232781
GemmTunableOp_Half_TN,tn_8192_22_28672,Gemm_Rocblas_621294226,0.13632
GemmTunableOp_Half_TN,tn_28672_918_4096,Gemm_Hipblaslt_TN_9684,0.394431
GemmTunableOp_Half_TN,tn_6144_927_4096,Gemm_Hipblaslt_TN_9133,0.0945709
GemmTunableOp_Half_TN,tn_8192_1217_8192,Gemm_Hipblaslt_TN_9691,0.296905
GemmTunableOp_Half_TN,tn_32000_105_8192,Gemm_Rocblas_621286475,0.212803
GemmTunableOp_Half_TN,tn_28672_192_4096,Gemm_Hipblaslt_TN_7286,0.0966358
GemmTunableOp_Half_TN,tn_128256_41_4096,Gemm_Hipblaslt_TN_9451,0.333893
GemmTunableOp_Half_TN,tn_57344_3283_8192,Gemm_Hipblaslt_TN_9816,5.84913
GemmTunableOp_Half_TN,tn_8192_19_8192,Gemm_Hipblaslt_TN_9415,0.0327076
GemmTunableOp_Half_TN,tn_8192_116_8192,Gemm_Hipblaslt_TN_8891,0.0507542
GemmTunableOp_Half_TN,tn_57344_3425_8192,Gemm_Hipblaslt_TN_159,5.72687
GemmTunableOp_Half_TN,tn_10240_3178_8192,Gemm_Hipblaslt_TN_9749,0.873697
GemmTunableOp_Half_TN,tn_32000_91_8192,Gemm_Rocblas_621294212,0.201075
GemmTunableOp_Half_TN,tn_32000_17_8192,Gemm_Rocblas_621286348,0.147596
GemmTunableOp_Half_TN,tn_6144_948_4096,Gemm_Hipblaslt_TN_9613,0.0950996
GemmTunableOp_Half_TN,tn_4096_814_4096,Gemm_Hipblaslt_TN_9604,0.0641499
GemmTunableOp_Half_TN,tn_32000_109_8192,Gemm_Hipblaslt_TN_9583,0.213345
GemmTunableOp_Half_TN,tn_10240_14_8192,Gemm_Hipblaslt_TN_9411,0.0374919
GemmTunableOp_Half_TN,tn_10240_3651_8192,Gemm_Hipblaslt_TN_9743,1.05621
GemmTunableOp_Half_TN,tn_128256_7_4096,Gemm_Hipblaslt_TN_9405,0.284894
GemmTunableOp_Half_TN,tn_6144_876_4096,Gemm_Hipblaslt_TN_9613,0.0929329
GemmTunableOp_Half_TN,tn_57344_122_8192,Gemm_Rocblas_621294214,0.359131
GemmTunableOp_Half_TN,tn_8192_3000_8192,Gemm_Rocblas_621286580,0.680981
GemmTunableOp_Half_TN,tn_8192_9_8192,Gemm_Hipblaslt_TN_9388,0.0304166
GemmTunableOp_Half_TN,tn_28672_803_4096,Gemm_Hipblaslt_TN_9684,0.382733
GemmTunableOp_Half_TN,tn_8192_2728_28672,Gemm_Rocblas_621294319,2.51913
GemmTunableOp_Half_TN,tn_8192_2717_28672,Gemm_Rocblas_621294319,2.52719
GemmTunableOp_Half_TN,tn_10240_131_8192,Gemm_Hipblaslt_TN_9367,0.0668032
GemmTunableOp_Half_TN,tn_8192_3411_28672,Gemm_Hipblaslt_TN_9732,2.95208
GemmTunableOp_Half_TN,tn_4096_7436_4096,Gemm_Rocblas_621294127,0.428145
GemmTunableOp_Half_TN,tn_57344_10_8192,Gemm_Rocblas_621294053,0.256885
GemmTunableOp_Half_TN,tn_57344_11_8192,Gemm_Hipblaslt_TN_9405,0.257665
GemmTunableOp_Half_TN,tn_6144_823_4096,Gemm_Rocblas_621294520,0.0889729
GemmTunableOp_Half_TN,tn_8192_2664_28672,Gemm_Hipblaslt_TN_9774,2.40162
GemmTunableOp_Half_TN,tn_57344_16_8192,Gemm_Rocblas_621294053,0.259423
GemmTunableOp_Half_TN,tn_10240_3274_8192,Gemm_Hipblaslt_TN_9223,0.888464
GemmTunableOp_Half_TN,tn_128256_194_4096,Gemm_Hipblaslt_TN_9738,0.572331
GemmTunableOp_Half_TN,tn_57344_1313_8192,Gemm_Hipblaslt_TN_9847,2.37987
GemmTunableOp_Half_TN,tn_8192_2274_8192,Gemm_Hipblaslt_TN_9763,0.506025
GemmTunableOp_Half_TN,tn_32000_118_8192,Gemm_Hipblaslt_TN_9355,0.218477
GemmTunableOp_Half_TN,tn_8192_7_28672,Gemm_Hipblaslt_TN_9403,0.124631
GemmTunableOp_Half_TN,tn_6144_807_4096,Gemm_Rocblas_621294520,0.0875854
GemmTunableOp_Half_TN,tn_4096_1762_4096,Gemm_Hipblaslt_TN_9645,0.117757
GemmTunableOp_Half_TN,tn_4096_2599_4096,Gemm_Hipblaslt_TN_9657,0.161035
GemmTunableOp_Half_TN,tn_6144_992_4096,Gemm_Hipblaslt_TN_9671,0.101499
GemmTunableOp_Half_TN,tn_6144_8054_4096,Gemm_Hipblaslt_TN_9753,0.677175
GemmTunableOp_Half_TN,tn_57344_14_8192,Gemm_Rocblas_621286322,0.259385
GemmTunableOp_Half_TN,tn_4096_1867_4096,Gemm_Hipblaslt_TN_9645,0.121218
GemmTunableOp_Half_TN,tn_6144_1867_4096,Gemm_Rocblas_621294425,0.165671
GemmTunableOp_Half_TN,tn_4096_2721_14336,Gemm_Hipblaslt_TN_9799,0.567437
GemmTunableOp_Half_TN,tn_4096_842_4096,Gemm_Hipblaslt_TN_9170,0.0653355
GemmTunableOp_Half_TN,tn_28672_840_4096,Gemm_Hipblaslt_TN_9684,0.3854
GemmTunableOp_Half_TN,tn_128256_251_4096,Gemm_Rocblas_621286892,0.612531
GemmTunableOp_Half_TN,tn_6144_184_4096,Gemm_Hipblaslt_TN_9470,0.0292183
GemmTunableOp_Half_TN,tn_28672_7787_4096,Gemm_Hipblaslt_TN_159,3.0198
GemmTunableOp_Half_TN,tn_4096_838_14336,Gemm_Hipblaslt_TN_9131,0.226326
GemmTunableOp_Half_TN,tn_6144_929_4096,Gemm_Hipblaslt_TN_9613,0.0944675
GemmTunableOp_Half_TN,tn_4096_871_14336,Gemm_Hipblaslt_TN_9580,0.218052
GemmTunableOp_Half_TN,tn_4096_855_14336,Gemm_Hipblaslt_TN_9580,0.217879
GemmTunableOp_Half_TN,tn_6144_1673_4096,Gemm_Rocblas_621294495,0.156012
GemmTunableOp_Half_TN,tn_4096_949_14336,Gemm_Hipblaslt_TN_9634,0.234979
GemmTunableOp_Half_TN,tn_8192_3139_28672,Gemm_Hipblaslt_TN_9731,2.89003
GemmTunableOp_Half_TN,tn_128256_239_4096,Gemm_Rocblas_621286892,0.60893
GemmTunableOp_Half_TN,tn_128256_223_4096,Gemm_Hipblaslt_TN_9937,0.590073
GemmTunableOp_Half_TN,tn_6144_868_4096,Gemm_Hipblaslt_TN_9133,0.093254
GemmTunableOp_Half_TN,tn_6144_958_4096,Gemm_Hipblaslt_TN_9613,0.0956282
GemmTunableOp_Half_TN,tn_4096_855_4096,Gemm_Hipblaslt_TN_9170,0.0653735
GemmTunableOp_Half_TN,tn_4096_2672_14336,Gemm_Hipblaslt_TN_9799,0.545563
GemmTunableOp_Half_TN,tn_4096_1853_14336,Gemm_Hipblaslt_TN_9268,0.412313
GemmTunableOp_Half_TN,tn_28672_904_4096,Gemm_Hipblaslt_TN_9684,0.394564
GemmTunableOp_Half_TN,tn_4096_1806_4096,Gemm_Hipblaslt_TN_9645,0.120407
GemmTunableOp_Half_TN,tn_128256_85_4096,Gemm_Hipblaslt_TN_9057,0.389679
GemmTunableOp_Half_TN,tn_6144_1778_4096,Gemm_Hipblaslt_TN_9799,0.163319
GemmTunableOp_Half_TN,tn_4096_2734_14336,Gemm_Hipblaslt_TN_9676,0.569437
GemmTunableOp_Half_TN,tn_4096_934_4096,Gemm_Hipblaslt_TN_9634,0.0689942
GemmTunableOp_Half_TN,tn_8192_91_8192,Gemm_Hipblaslt_TN_7093,0.0474658
GemmTunableOp_Half_TN,tn_6144_1853_4096,Gemm_Rocblas_621294425,0.168025
GemmTunableOp_Half_TN,tn_28672_1815_4096,Gemm_Hipblaslt_TN_9684,0.793162
GemmTunableOp_Half_TN,tn_6144_926_4096,Gemm_Hipblaslt_TN_9613,0.0943756
GemmTunableOp_Half_TN,tn_4096_854_4096,Gemm_Hipblaslt_TN_9170,0.0658589
GemmTunableOp_Half_TN,tn_28672_838_4096,Gemm_Hipblaslt_TN_9684,0.385452
GemmTunableOp_Half_TN,tn_4096_3431_4096,Gemm_Hipblaslt_TN_9743,0.195796
GemmTunableOp_Half_TN,tn_6144_1798_4096,Gemm_Rocblas_621286683,0.164439
GemmTunableOp_Half_TN,tn_32000_119_8192,Gemm_Hipblaslt_TN_9356,0.217664
GemmTunableOp_Half_TN,tn_28672_3711_4096,Gemm_Hipblaslt_TN_9827,1.51736
GemmTunableOp_Half_TN,tn_28672_992_4096,Gemm_Hipblaslt_TN_9825,0.438048
GemmTunableOp_Half_TN,tn_6144_1881_4096,Gemm_Rocblas_621286684,0.166786
GemmTunableOp_Half_TN,tn_4096_2651_4096,Gemm_Hipblaslt_TN_9709,0.162645
GemmTunableOp_Half_TN,tn_6144_794_4096,Gemm_Hipblaslt_TN_9357,0.0862202
GemmTunableOp_Half_TN,tn_28672_865_4096,Gemm_Hipblaslt_TN_9684,0.387797
GemmTunableOp_Half_TN,tn_4096_2517_4096,Gemm_Hipblaslt_TN_9674,0.154867
GemmTunableOp_Half_TN,tn_28672_1831_4096,Gemm_Hipblaslt_TN_9684,0.791094
GemmTunableOp_Half_TN,tn_4096_1795_14336,Gemm_Hipblaslt_TN_9645,0.408509
GemmTunableOp_Half_TN,tn_4096_1726_4096,Gemm_Hipblaslt_TN_9671,0.10946
GemmTunableOp_Half_TN,tn_28672_8110_4096,Gemm_Hipblaslt_TN_9920,3.3476
GemmTunableOp_Half_TN,tn_28672_785_4096,Gemm_Hipblaslt_TN_9674,0.354978
GemmTunableOp_Half_TN,tn_128256_212_4096,Gemm_Hipblaslt_TN_9271,0.585163
GemmTunableOp_Half_TN,tn_4096_920_14336,Gemm_Hipblaslt_TN_9634,0.231458
GemmTunableOp_Half_TN,tn_4096_825_14336,Gemm_Hipblaslt_TN_9147,0.215762
GemmTunableOp_Half_TN,tn_28672_1743_4096,Gemm_Hipblaslt_TN_9190,0.741171
GemmTunableOp_Half_TN,tn_4096_1718_14336,Gemm_Hipblaslt_TN_9180,0.373053
GemmTunableOp_Half_TN,tn_4096_3662_14336,Gemm_Hipblaslt_TN_9859,0.723755
GemmTunableOp_Half_TN,tn_10240_1208_8192,Gemm_Hipblaslt_TN_9798,0.35074
GemmTunableOp_Half_TN,tn_4096_893_4096,Gemm_Hipblaslt_TN_9634,0.0671334
GemmTunableOp_Half_TN,tn_6144_801_4096,Gemm_Rocblas_621286778,0.0889445
GemmTunableOp_Half_TN,tn_4096_3402_14336,Gemm_Hipblaslt_TN_9187,0.671113
GemmTunableOp_Half_TN,tn_6144_919_4096,Gemm_Hipblaslt_TN_9613,0.0938114
GemmTunableOp_Half_TN,tn_128256_231_4096,Gemm_Rocblas_621286892,0.601346
GemmTunableOp_Half_TN,tn_28672_804_4096,Gemm_Hipblaslt_TN_9684,0.380058
GemmTunableOp_Half_TN,tn_10240_3299_8192,Gemm_Hipblaslt_TN_9753,0.90449
GemmTunableOp_Half_TN,tn_4096_937_4096,Gemm_Hipblaslt_TN_9634,0.0688908
GemmTunableOp_Half_TN,tn_4096_1807_14336,Gemm_Hipblaslt_TN_9645,0.407358
GemmTunableOp_Half_TN,tn_6144_836_4096,Gemm_Rocblas_621286778,0.0890851
GemmTunableOp_Half_TN,tn_6144_2602_4096,Gemm_Hipblaslt_TN_9827,0.218971
GemmTunableOp_Half_TN,tn_10240_3251_8192,Gemm_Hipblaslt_TN_9753,0.880713
GemmTunableOp_Half_TN,tn_6144_917_4096,Gemm_Hipblaslt_TN_9561,0.0932117
GemmTunableOp_Half_TN,tn_4096_1807_4096,Gemm_Hipblaslt_TN_9645,0.119065
GemmTunableOp_Half_TN,tn_128256_181_4096,Gemm_Hipblaslt_TN_9953,0.533803
GemmTunableOp_Half_TN,tn_4096_1759_4096,Gemm_Hipblaslt_TN_9645,0.116672
GemmTunableOp_Half_TN,tn_6144_224_4096,Gemm_Hipblaslt_TN_9495,0.0338798
GemmTunableOp_Half_TN,tn_4096_1813_4096,Gemm_Hipblaslt_TN_9645,0.119239
GemmTunableOp_Half_TN,tn_32000_135_8192,Gemm_Hipblaslt_TN_9506,0.246449
GemmTunableOp_Half_TN,tn_4096_801_4096,Gemm_Hipblaslt_TN_9634,0.0639384
GemmTunableOp_Half_TN,tn_4096_886_14336,Gemm_Hipblaslt_TN_9580,0.219687
GemmTunableOp_Half_TN,tn_128256_237_4096,Gemm_Rocblas_621286892,0.608317
GemmTunableOp_Half_TN,tn_6144_851_4096,Gemm_Rocblas_621294520,0.0890553
GemmTunableOp_Half_TN,tn_6144_5606_4096,Gemm_Hipblaslt_TN_9690,0.503184
GemmTunableOp_Half_TN,tn_28672_2670_4096,Gemm_Hipblaslt_TN_9827,1.08939
GemmTunableOp_Half_TN,tn_4096_2628_4096,Gemm_Hipblaslt_TN_9657,0.161309
GemmTunableOp_Half_TN,tn_10240_1160_8192,Gemm_Hipblaslt_TN_9798,0.345836
GemmTunableOp_Half_TN,tn_57344_1208_8192,Gemm_Hipblaslt_TN_9827,2.31331
GemmTunableOp_Half_TN,tn_128256_176_4096,Gemm_Hipblaslt_TN_9683,0.528717
GemmTunableOp_Half_TN,tn_4096_849_14336,Gemm_Hipblaslt_TN_9574,0.221155
GemmTunableOp_Half_TN,tn_8192_1392_8192,Gemm_Hipblaslt_TN_9690,0.324233
GemmTunableOp_Half_TN,tn_4096_7863_4096,Gemm_Hipblaslt_TN_9914,0.448441
GemmTunableOp_Half_TN,tn_57344_5_8192,Gemm_Rocblas_621294187,0.253342
GemmTunableOp_Half_TN,tn_4096_845_14336,Gemm_Hipblaslt_TN_9580,0.21995
GemmTunableOp_Half_TN,tn_6144_3556_4096,Gemm_Hipblaslt_TN_9570,0.321631
GemmTunableOp_Half_TN,tn_6144_2793_4096,Gemm_Hipblaslt_TN_9742,0.25774
GemmTunableOp_Half_TN,tn_4096_892_14336,Gemm_Hipblaslt_TN_9580,0.221745
GemmTunableOp_Half_TN,tn_4096_984_14336,Gemm_Hipblaslt_TN_9586,0.246806
GemmTunableOp_Half_TN,tn_6144_878_4096,Gemm_Hipblaslt_TN_9133,0.092727
GemmTunableOp_Half_TN,tn_8192_3120_8192,Gemm_Hipblaslt_TN_9793,0.709199
GemmTunableOp_Half_TN,tn_28672_1803_4096,Gemm_Hipblaslt_TN_9684,0.791619
GemmTunableOp_Half_TN,tn_28672_857_4096,Gemm_Hipblaslt_TN_9192,0.388491
GemmTunableOp_Half_TN,tn_4096_3571_14336,Gemm_Hipblaslt_TN_9743,0.690198
GemmTunableOp_Half_TN,tn_128256_119_4096,Gemm_Hipblaslt_TN_9061,0.439997
GemmTunableOp_Half_TN,tn_4096_3418_14336,Gemm_Hipblaslt_TN_9695,0.672307
GemmTunableOp_Half_TN,tn_4096_2708_14336,Gemm_Rocblas_621294320,0.554947
GemmTunableOp_Half_TN,tn_6144_797_4096,Gemm_Hipblaslt_TN_9613,0.0876257
GemmTunableOp_Half_TN,tn_6144_837_4096,Gemm_Rocblas_621294520,0.0889535
GemmTunableOp_Half_TN,tn_4096_3418_4096,Gemm_Hipblaslt_TN_9814,0.194704
GemmTunableOp_Half_TN,tn_4096_152_4096,Gemm_Rocblas_621286443,0.021927
GemmTunableOp_Half_TN,tn_28672_48_4096,Gemm_Hipblaslt_TN_9532,0.0489337
GemmTunableOp_Half_TN,tn_4096_40_4096,Gemm_Rocblas_621294155,0.0126492
GemmTunableOp_Half_TN,tn_4096_64_14336,Gemm_Hipblaslt_TN_7918,0.0349052
GemmTunableOp_Half_TN,tn_57344_1185_8192,Gemm_Hipblaslt_TN_9841,2.31028
GemmTunableOp_Half_TN,tn_28672_845_4096,Gemm_Hipblaslt_TN_9684,0.385552
GemmTunableOp_Half_TN,tn_4096_866_14336,Gemm_Hipblaslt_TN_9580,0.218675
GemmTunableOp_Half_TN,tn_4096_807_14336,Gemm_Hipblaslt_TN_9147,0.211373
GemmTunableOp_Half_TN,tn_4096_848_14336,Gemm_Hipblaslt_TN_9580,0.219683
GemmTunableOp_Half_TN,tn_6144_2750_4096,Gemm_Hipblaslt_TN_9742,0.25572
GemmTunableOp_Half_TN,tn_4096_3752_14336,Gemm_Rocblas_621294035,0.733419
GemmTunableOp_Half_TN,tn_4096_1854_14336,Gemm_Hipblaslt_TN_9645,0.413771
GemmTunableOp_Half_TN,tn_4096_192_14336,Gemm_Hipblaslt_TN_7586,0.0628266
GemmTunableOp_Half_TN,tn_6144_1931_4096,Gemm_Hipblaslt_TN_9793,0.17669
GemmTunableOp_Half_TN,tn_4096_861_4096,Gemm_Hipblaslt_TN_9604,0.0659531
GemmTunableOp_Half_TN,tn_6144_838_4096,Gemm_Rocblas_621294520,0.0880015
GemmTunableOp_Half_TN,tn_128256_255_4096,Gemm_Rocblas_621286905,0.612094
GemmTunableOp_Half_TN,tn_4096_921_4096,Gemm_Hipblaslt_TN_9604,0.0690557
GemmTunableOp_Half_TN,tn_4096_3565_14336,Gemm_Hipblaslt_TN_9187,0.691184
GemmTunableOp_Half_TN,tn_4096_800_4096,Gemm_Hipblaslt_TN_9634,0.0633704
GemmTunableOp_Half_TN,tn_28672_889_4096,Gemm_Hipblaslt_TN_9684,0.393188
GemmTunableOp_Half_TN,tn_128256_222_4096,Gemm_Hipblaslt_TN_9937,0.58844
GemmTunableOp_Half_TN,tn_28672_240_4096,Gemm_Rocblas_621286584,0.121129
GemmTunableOp_Half_TN,tn_4096_256_14336,Gemm_Hipblaslt_TN_9303,0.0758898
GemmTunableOp_Half_TN,tn_28672_152_4096,Gemm_Hipblaslt_TN_9561,0.0857625
GemmTunableOp_Half_TN,tn_6144_256_4096,Gemm_Rocblas_621294232,0.0366702
GemmTunableOp_Half_TN,tn_4096_8070_14336,Gemm_Hipblaslt_TN_9753,1.65401
GemmTunableOp_Half_TN,tn_6144_1829_4096,Gemm_Rocblas_621294426,0.165977
GemmTunableOp_Half_TN,tn_28672_4463_4096,Gemm_Hipblaslt_TN_9890,1.81103
GemmTunableOp_Half_TN,tn_28672_1854_4096,Gemm_Hipblaslt_TN_9684,0.798048
GemmTunableOp_Half_TN,tn_6144_7804_4096,Gemm_Hipblaslt_TN_9753,0.658367
GemmTunableOp_Half_TN,tn_28672_120_4096,Gemm_Rocblas_621294210,0.0725692
GemmTunableOp_Half_TN,tn_4096_938_4096,Gemm_Hipblaslt_TN_9604,0.0692828
GemmTunableOp_Half_TN,tn_128256_247_4096,Gemm_Rocblas_621294634,0.612148
GemmTunableOp_Half_TN,tn_57344_4063_8192,Gemm_Rocblas_621294286,6.66557
GemmTunableOp_Half_TN,tn_4096_2872_14336,Gemm_Hipblaslt_TN_9788,0.581667
GemmTunableOp_Half_TN,tn_6144_850_4096,Gemm_Rocblas_621286778,0.0879423
GemmTunableOp_Half_TN,tn_4096_160_14336,Gemm_Hipblaslt_TN_7234,0.057599
GemmTunableOp_Half_TN,tn_4096_2826_14336,Gemm_Hipblaslt_TN_9788,0.579203
GemmTunableOp_Half_TN,tn_4096_1850_14336,Gemm_Hipblaslt_TN_9645,0.411853
GemmTunableOp_Half_TN,tn_28672_96_4096,Gemm_Rocblas_621294461,0.0590178
GemmTunableOp_Half_TN,tn_28672_248_4096,Gemm_Rocblas_621294324,0.125178
GemmTunableOp_Half_TN,tn_4096_831_4096,Gemm_Hipblaslt_TN_9634,0.0641412
GemmTunableOp_Half_TN,tn_28672_216_4096,Gemm_Hipblaslt_TN_9680,0.112401
GemmTunableOp_Half_TN,tn_32000_112_8192,Gemm_Rocblas_621286475,0.215258
GemmTunableOp_Half_TN,tn_6144_2785_4096,Gemm_Hipblaslt_TN_9742,0.255358
GemmTunableOp_Half_TN,tn_4096_903_14336,Gemm_Hipblaslt_TN_9604,0.232081
GemmTunableOp_Half_TN,tn_6144_168_4096,Gemm_Rocblas_621286443,0.0287148
GemmTunableOp_Half_TN,tn_4096_985_4096,Gemm_Hipblaslt_TN_9634,0.0723277
GemmTunableOp_Half_TN,tn_4096_1864_14336,Gemm_Hipblaslt_TN_9645,0.414097
GemmTunableOp_Half_TN,tn_4096_7992_4096,Gemm_Rocblas_621286281,0.44857
GemmTunableOp_Half_TN,tn_4096_8110_4096,Gemm_Hipblaslt_TN_9704,0.458845
GemmTunableOp_Half_TN,tn_128256_248_4096,Gemm_Rocblas_621286892,0.616053
GemmTunableOp_Half_TN,tn_8192_3153_8192,Gemm_Hipblaslt_TN_9697,0.715923
GemmTunableOp_Half_TN,tn_4096_3671_14336,Gemm_Hipblaslt_TN_9827,0.724329
GemmTunableOp_Half_TN,tn_128256_217_4096,Gemm_Hipblaslt_TN_9937,0.585624
GemmTunableOp_Half_TN,tn_128256_56_4096,Gemm_Rocblas_621286816,0.360979
GemmTunableOp_Half_TN,tn_4096_24_4096,Gemm_Rocblas_621286330,0.0112711
GemmTunableOp_Half_TN,tn_4096_1673_14336,Gemm_Hipblaslt_TN_9180,0.36616
GemmTunableOp_Half_TN,tn_4096_2592_14336,Gemm_Hipblaslt_TN_9799,0.535687
GemmTunableOp_Half_TN,tn_28672_1673_4096,Gemm_Hipblaslt_TN_9190,0.728292
GemmTunableOp_Half_TN,tn_4096_7299_14336,Gemm_Hipblaslt_TN_9738,1.53234
GemmTunableOp_Half_TN,tn_28672_1644_4096,Gemm_Rocblas_621294420,0.720578
GemmTunableOp_Half_TN,tn_6144_1841_4096,Gemm_Hipblaslt_TN_9687,0.167695
GemmTunableOp_Half_TN,tn_6144_2670_4096,Gemm_Hipblaslt_TN_9813,0.224554
GemmTunableOp_Half_TN,tn_128256_221_4096,Gemm_Hipblaslt_TN_9937,0.587619
GemmTunableOp_Half_TN,tn_28672_884_4096,Gemm_Hipblaslt_TN_9684,0.392023
GemmTunableOp_Half_TN,tn_4096_819_14336,Gemm_Hipblaslt_TN_9147,0.213685
GemmTunableOp_Half_TN,tn_4096_7798_4096,Gemm_Hipblaslt_TN_9933,0.441132
GemmTunableOp_Half_TN,tn_4096_7857_4096,Gemm_Hipblaslt_TN_9914,0.44883
GemmTunableOp_Half_TN,tn_6144_7863_4096,Gemm_Rocblas_621294127,0.667128
GemmTunableOp_Half_TN,tn_4096_8110_14336,Gemm_Hipblaslt_TN_9815,1.65547
GemmTunableOp_Half_TN,tn_6144_120_4096,Gemm_Rocblas_621286443,0.0238711
GemmTunableOp_Half_TN,tn_4096_808_4096,Gemm_Hipblaslt_TN_9634,0.0638231
GemmTunableOp_Half_TN,tn_28672_2648_4096,Gemm_Hipblaslt_TN_9827,1.08964
GemmTunableOp_Half_TN,tn_6144_1880_4096,Gemm_Rocblas_621286683,0.167459
GemmTunableOp_Half_TN,tn_4096_1837_4096,Gemm_Hipblaslt_TN_9645,0.119542
GemmTunableOp_Half_TN,tn_28672_1880_4096,Gemm_Hipblaslt_TN_9684,0.800637
GemmTunableOp_Half_TN,tn_28672_825_4096,Gemm_Hipblaslt_TN_9684,0.383686
GemmTunableOp_Half_TN,tn_28672_2788_4096,Gemm_Hipblaslt_TN_9861,1.20517
GemmTunableOp_Half_TN,tn_28672_2734_4096,Gemm_Hipblaslt_TN_9917,1.19368
GemmTunableOp_Half_TN,tn_4096_1827_14336,Gemm_Hipblaslt_TN_9174,0.412844
GemmTunableOp_Half_TN,tn_6144_795_4096,Gemm_Hipblaslt_TN_9613,0.0869719
GemmTunableOp_Half_TN,tn_4096_795_14336,Gemm_Hipblaslt_TN_9158,0.215208
GemmTunableOp_Half_TN,tn_28672_3752_4096,Gemm_Hipblaslt_TN_9827,1.5166
GemmTunableOp_Half_TN,tn_4096_1768_14336,Gemm_Hipblaslt_TN_9645,0.397517
GemmTunableOp_Half_TN,tn_28672_908_4096,Gemm_Hipblaslt_TN_9684,0.397595
GemmTunableOp_Half_TN,tn_28672_936_4096,Gemm_Hipblaslt_TN_9684,0.402874
GemmTunableOp_Half_TN,tn_8192_118_8192,Gemm_Hipblaslt_TN_8027,0.0544395
GemmTunableOp_Half_TN,tn_28672_1757_4096,Gemm_Hipblaslt_TN_9190,0.742048
GemmTunableOp_Half_TN,tn_4096_846_4096,Gemm_Hipblaslt_TN_9634,0.0647
GemmTunableOp_Half_TN,tn_4096_1798_14336,Gemm_Hipblaslt_TN_9268,0.404921
GemmTunableOp_Half_TN,tn_4096_859_4096,Gemm_Hipblaslt_TN_9634,0.0652428
GemmTunableOp_Half_TN,tn_4096_4471_4096,Gemm_Hipblaslt_TN_9742,0.271677
GemmTunableOp_Half_TN,tn_4096_894_4096,Gemm_Hipblaslt_TN_9634,0.0678623
GemmTunableOp_Half_TN,tn_28672_983_4096,Gemm_Hipblaslt_TN_9863,0.442284
GemmTunableOp_Half_TN,tn_4096_2719_14336,Gemm_Rocblas_621286684,0.557681
GemmTunableOp_Half_TN,tn_6144_2717_4096,Gemm_Hipblaslt_TN_9669,0.26261
GemmTunableOp_Half_TN,tn_28672_1783_4096,Gemm_Rocblas_621294420,0.75468
GemmTunableOp_Half_TN,tn_6144_817_4096,Gemm_Rocblas_621286778,0.0885692
GemmTunableOp_Half_TN,tn_4096_890_14336,Gemm_Hipblaslt_TN_9580,0.219039
GemmTunableOp_Half_TN,tn_28672_2764_4096,Gemm_Hipblaslt_TN_9847,1.18937
GemmTunableOp_Half_TN,tn_128256_12_4096,Gemm_Rocblas_621294224,0.292424
GemmTunableOp_Half_TN,tn_4096_1900_4096,Gemm_Hipblaslt_TN_9645,0.122378
GemmTunableOp_Half_TN,tn_6144_983_4096,Gemm_Rocblas_621294311,0.100508
GemmTunableOp_Half_TN,tn_6144_942_4096,Gemm_Hipblaslt_TN_9613,0.0938154
GemmTunableOp_Half_TN,tn_128256_73_4096,Gemm_Hipblaslt_TN_9057,0.382043
GemmTunableOp_Half_TN,tn_28672_956_4096,Gemm_Hipblaslt_TN_9684,0.401324
GemmTunableOp_Half_TN,tn_6144_3546_4096,Gemm_Hipblaslt_TN_9570,0.321132
GemmTunableOp_Half_TN,tn_4096_144_14336,Gemm_Hipblaslt_TN_7563,0.0560502
GemmTunableOp_Half_TN,tn_28672_875_4096,Gemm_Hipblaslt_TN_9684,0.385804
GemmTunableOp_Half_TN,tn_6144_932_4096,Gemm_Hipblaslt_TN_9606,0.0941185
GemmTunableOp_Half_TN,tn_4096_885_14336,Gemm_Hipblaslt_TN_9580,0.220504
GemmTunableOp_Half_TN,tn_57344_102_8192,Default,0.349649
GemmTunableOp_Half_TN,tn_4096_830_14336,Gemm_Hipblaslt_TN_9147,0.215218
GemmTunableOp_Half_TN,tn_4096_2601_14336,Gemm_Hipblaslt_TN_9799,0.542085
GemmTunableOp_Half_TN,tn_4096_895_4096,Gemm_Hipblaslt_TN_9634,0.0679789
GemmTunableOp_Half_TN,tn_4096_895_14336,Gemm_Hipblaslt_TN_9580,0.219586
GemmTunableOp_Half_TN,tn_6144_2722_4096,Gemm_Hipblaslt_TN_9742,0.254364
GemmTunableOp_Half_TN,tn_4096_7787_14336,Gemm_Hipblaslt_TN_9749,1.59894
GemmTunableOp_Half_TN,tn_6144_1897_4096,Gemm_Rocblas_621286683,0.170221
GemmTunableOp_Half_TN,tn_28672_1897_4096,Gemm_Hipblaslt_TN_9684,0.803668
GemmTunableOp_Half_TN,tn_4096_903_4096,Gemm_Hipblaslt_TN_9634,0.0689459
GemmTunableOp_Half_TN,tn_6144_800_4096,Gemm_Hipblaslt_TN_9613,0.0859665
GemmStridedBatchedTunableOp_Half_TN,tn_879_879_128_B_32,Gemm_Hipblaslt_TN_7483,0.0460626
GemmStridedBatchedTunableOp_Half_TN,tn_937_937_128_B_32,Gemm_Hipblaslt_TN_7519,0.0506079
GemmStridedBatchedTunableOp_Half_TN,tn_953_953_128_B_32,Gemm_Hipblaslt_TN_7519,0.0504586
GemmStridedBatchedTunableOp_Half_TN,tn_956_956_128_B_32,Gemm_Hipblaslt_TN_9351,0.0511512
GemmStridedBatchedTunableOp_Half_TN,tn_873_873_128_B_32,Gemm_Hipblaslt_TN_7483,0.0452967
GemmStridedBatchedTunableOp_Half_TN,tn_861_861_128_B_32,Gemm_Rocblas_621294635,0.0456037
GemmStridedBatchedTunableOp_Half_TN,tn_944_944_128_B_32,Gemm_Rocblas_621293994,0.0459242
GemmStridedBatchedTunableOp_Half_TN,tn_882_882_128_B_32,Gemm_Rocblas_621294635,0.04685
GemmStridedBatchedTunableOp_Half_TN,tn_975_975_128_B_32,Gemm_Rocblas_621286809,0.0529197
GemmStridedBatchedTunableOp_Half_TN,tn_819_819_128_B_32,Gemm_Rocblas_621294635,0.0410838
GemmStridedBatchedTunableOp_Half_TN,tn_989_989_128_B_32,Gemm_Rocblas_621286809,0.0530169
GemmStridedBatchedTunableOp_Half_TN,tn_1280_1280_128_B_64,Gemm_Hipblaslt_TN_158,0.115816
GemmStridedBatchedTunableOp_Half_TN,tn_936_936_128_B_32,Gemm_Hipblaslt_TN_153,0.0474516
GemmStridedBatchedTunableOp_Half_TN,tn_920_920_128_B_32,Gemm_Hipblaslt_TN_153,0.0466862
GemmStridedBatchedTunableOp_Half_TN,tn_921_921_128_B_32,Gemm_Rocblas_621294635,0.0507056
GemmStridedBatchedTunableOp_Half_TN,tn_1383_1383_128_B_64,Gemm_Rocblas_621286412,0.171409
GemmStridedBatchedTunableOp_Half_TN,tn_1279_1279_128_B_64,Gemm_Hipblaslt_TN_6884,0.143823
GemmStridedBatchedTunableOp_Half_TN,tn_1345_1345_128_B_64,Gemm_Rocblas_621294109,0.160292
GemmStridedBatchedTunableOp_Half_TN,tn_948_948_128_B_32,Gemm_Hipblaslt_TN_7519,0.0500539
GemmStridedBatchedTunableOp_Half_TN,tn_1015_1015_128_B_64,Gemm_Hipblaslt_TN_6879,0.102425
GemmStridedBatchedTunableOp_Half_TN,tn_1281_1281_128_B_64,Gemm_Hipblaslt_TN_6884,0.149483
GemmStridedBatchedTunableOp_Half_TN,tn_1112_1112_128_B_64,Gemm_Hipblaslt_TN_6879,0.112249
GemmStridedBatchedTunableOp_Half_TN,tn_862_862_128_B_32,Gemm_Rocblas_621294635,0.0450716
GemmStridedBatchedTunableOp_Half_TN,tn_1185_1185_128_B_64,Gemm_Hipblaslt_TN_6879,0.127566
GemmStridedBatchedTunableOp_Half_TN,tn_1321_1321_128_B_64,Gemm_Rocblas_621286412,0.156189
GemmStridedBatchedTunableOp_Half_TN,tn_1137_1137_128_B_64,Gemm_Hipblaslt_TN_6879,0.118716
GemmStridedBatchedTunableOp_Half_TN,tn_955_955_128_B_32,Gemm_Rocblas_621294635,0.0519352
GemmStridedBatchedTunableOp_Half_TN,tn_977_977_128_B_32,Gemm_Rocblas_621286809,0.0537973
GemmStridedBatchedTunableOp_Half_TN,tn_1271_1271_128_B_64,Gemm_Hipblaslt_TN_6879,0.14088
GemmStridedBatchedTunableOp_Half_TN,tn_1248_1248_128_B_64,Gemm_Rocblas_621294763,0.124466
GemmStridedBatchedTunableOp_Half_TN,tn_1335_1335_128_B_64,Gemm_Rocblas_621286412,0.158749
GemmStridedBatchedTunableOp_Half_TN,tn_1268_1268_128_B_64,Gemm_Hipblaslt_TN_6879,0.139629
GemmStridedBatchedTunableOp_Half_TN,tn_834_834_128_B_32,Gemm_Rocblas_621294635,0.0435347
GemmStridedBatchedTunableOp_Half_TN,tn_1216_1216_128_B_64,Gemm_Rocblas_621286413,0.121511
GemmStridedBatchedTunableOp_Half_TN,tn_1096_1096_128_B_64,Gemm_Hipblaslt_TN_6879,0.111114
GemmStridedBatchedTunableOp_Half_TN,tn_792_792_128_B_32,Gemm_Hipblaslt_TN_150,0.037286
GemmStridedBatchedTunableOp_Half_TN,tn_1329_1329_128_B_64,Gemm_Rocblas_621294109,0.154741
GemmStridedBatchedTunableOp_Half_TN,tn_812_812_128_B_32,Gemm_Rocblas_621294635,0.0404418
GemmStridedBatchedTunableOp_Half_TN,tn_1473_1473_128_B_64,Gemm_Rocblas_621286797,0.190426
GemmStridedBatchedTunableOp_Half_TN,tn_871_871_128_B_32,Gemm_Rocblas_621294635,0.0465166
GemmStridedBatchedTunableOp_Half_TN,tn_795_795_128_B_32,Gemm_Rocblas_621294635,0.0425659
GemmStridedBatchedTunableOp_Half_TN,tn_991_991_128_B_32,Gemm_Rocblas_621286794,0.054214
GemmStridedBatchedTunableOp_Half_TN,tn_1025_1025_128_B_64,Gemm_Rocblas_621294725,0.105751
GemmStridedBatchedTunableOp_Half_TN,tn_826_826_128_B_32,Gemm_Rocblas_621294635,0.0424264
GemmStridedBatchedTunableOp_Half_TN,tn_878_878_128_B_32,Gemm_Rocblas_621286396,0.0467848
GemmStridedBatchedTunableOp_Half_TN,tn_986_986_128_B_32,Gemm_Rocblas_621294550,0.0538725
GemmStridedBatchedTunableOp_Half_TN,tn_949_949_128_B_32,Gemm_Hipblaslt_TN_6879,0.0516845
GemmStridedBatchedTunableOp_Half_TN,tn_970_970_128_B_32,Gemm_Rocblas_621286794,0.0531342
GemmStridedBatchedTunableOp_Half_TN,tn_1160_1160_128_B_64,Gemm_Rocblas_621286397,0.122928
GemmStridedBatchedTunableOp_Half_TN,tn_814_814_128_B_32,Gemm_Rocblas_621294635,0.0418349
GemmStridedBatchedTunableOp_Half_TN,tn_950_950_128_B_32,Gemm_Hipblaslt_TN_6879,0.052535
GemmStridedBatchedTunableOp_Half_TN,tn_841_841_128_B_32,Gemm_Rocblas_621294635,0.0438279
GemmStridedBatchedTunableOp_Half_TN,tn_849_849_128_B_32,Gemm_Hipblaslt_TN_7059,0.045273
GemmStridedBatchedTunableOp_Half_TN,tn_1319_1319_128_B_64,Gemm_Rocblas_621294109,0.154261
GemmStridedBatchedTunableOp_Half_TN,tn_869_869_128_B_32,Gemm_Rocblas_621286785,0.046943
GemmStridedBatchedTunableOp_Half_TN,tn_965_965_128_B_32,Gemm_Rocblas_621286809,0.0525009
GemmStridedBatchedTunableOp_Half_TN,tn_969_969_128_B_32,Gemm_Rocblas_621294550,0.0531268
GemmStridedBatchedTunableOp_Half_TN,tn_1161_1161_128_B_64,Gemm_Hipblaslt_TN_6879,0.125836
GemmStridedBatchedTunableOp_Half_TN,tn_1024_1024_128_B_64,Gemm_Rocblas_621294109,0.0673081
GemmStridedBatchedTunableOp_Half_TN,tn_967_967_128_B_32,Gemm_Rocblas_621294550,0.0525558
GemmStridedBatchedTunableOp_Half_TN,tn_883_883_128_B_32,Gemm_Rocblas_621286412,0.0476547
GemmStridedBatchedTunableOp_Half_TN,tn_838_838_128_B_32,Gemm_Rocblas_621294635,0.0442827
GemmStridedBatchedTunableOp_Half_TN,tn_903_903_128_B_32,Gemm_Hipblaslt_TN_9508,0.0496765
GemmStridedBatchedTunableOp_Half_TN,tn_939_939_128_B_32,Gemm_Rocblas_621286794,0.0524918
GemmStridedBatchedTunableOp_Half_TN,tn_877_877_128_B_32,Gemm_Rocblas_621286396,0.0470284
GemmStridedBatchedTunableOp_Half_TN,tn_32_32_128_B_32,Gemm_Rocblas_621294376,0.00634241
GemmStridedBatchedTunableOp_Half_TN,tn_800_800_128_B_32,Gemm_Hipblaslt_TN_150,0.0338521
GemmStridedBatchedTunableOp_Half_TN,tn_1286_1286_128_B_64,Gemm_Rocblas_621294109,0.148542
GemmStridedBatchedTunableOp_Half_TN,tn_999_999_128_B_32,Gemm_Rocblas_621294550,0.0540537
GemmStridedBatchedTunableOp_Half_TN,tn_791_791_128_B_32,Gemm_Rocblas_621294635,0.0399642
GemmStridedBatchedTunableOp_Half_TN,tn_987_987_128_B_32,Gemm_Rocblas_621286794,0.0538228
GemmStridedBatchedTunableOp_Half_TN,tn_988_988_128_B_32,Gemm_Rocblas_621294550,0.0519221
GemmStridedBatchedTunableOp_Half_TN,tn_859_859_128_B_32,Gemm_Hipblaslt_TN_7483,0.0454093
GemmStridedBatchedTunableOp_Half_TN,tn_809_809_128_B_32,Gemm_Rocblas_621294635,0.041279
GemmTunableOp_Half_TN,tn_28672_830_4096,Gemm_Hipblaslt_TN_9683,0.38776
GemmTunableOp_Half_TN,tn_6144_2708_4096,Gemm_Hipblaslt_TN_9763,0.255992
GemmTunableOp_Half_TN,tn_28672_7283_4096,Gemm_Hipblaslt_TN_159,2.88978
GemmTunableOp_Half_TN,tn_4096_1881_14336,Gemm_Hipblaslt_TN_9645,0.415408
GemmTunableOp_Half_TN,tn_6144_7299_4096,Gemm_Hipblaslt_TN_9959,0.637296
GemmTunableOp_Half_TN,tn_6144_3479_4096,Gemm_Hipblaslt_TN_9690,0.322277
GemmTunableOp_Half_TN,tn_4096_216_14336,Gemm_Hipblaslt_TN_9363,0.0692548
GemmTunableOp_Half_TN,tn_4096_2703_14336,Gemm_Hipblaslt_TN_9799,0.550728
GemmTunableOp_Half_TN,tn_4096_809_14336,Gemm_Hipblaslt_TN_9147,0.213551
GemmTunableOp_Half_TN,tn_4096_872_14336,Gemm_Hipblaslt_TN_9580,0.218335
GemmTunableOp_Half_TN,tn_4096_1905_4096,Gemm_Hipblaslt_TN_9645,0.122109
GemmTunableOp_Half_TN,tn_6144_3752_4096,Gemm_Rocblas_621294315,0.344307
GemmTunableOp_Half_TN,tn_4096_915_14336,Gemm_Hipblaslt_TN_9634,0.228591
GemmTunableOp_Half_TN,tn_6144_819_4096,Gemm_Rocblas_621294520,0.0875239
GemmTunableOp_Half_TN,tn_4096_1828_4096,Gemm_Hipblaslt_TN_9645,0.122187
GemmTunableOp_Half_TN,tn_4096_3310_4096,Gemm_Hipblaslt_TN_9743,0.194531
GemmTunableOp_Half_TN,tn_28672_922_4096,Gemm_Hipblaslt_TN_9684,0.398725
GemmTunableOp_Half_TN,tn_4096_1794_14336,Gemm_Hipblaslt_TN_9645,0.405268
GemmTunableOp_Half_TN,tn_128256_243_4096,Gemm_Rocblas_621286892,0.609797
GemmTunableOp_Half_TN,tn_4096_930_14336,Gemm_Hipblaslt_TN_9589,0.232163
GemmTunableOp_Half_TN,tn_28672_863_4096,Gemm_Hipblaslt_TN_9684,0.389062
GemmTunableOp_Half_TN,tn_28672_2732_4096,Gemm_Hipblaslt_TN_9917,1.20229
GemmTunableOp_Half_TN,tn_4096_2732_4096,Gemm_Rocblas_621286683,0.164196
GemmTunableOp_Half_TN,tn_6144_1791_4096,Gemm_Hipblaslt_TN_9711,0.163389
GemmTunableOp_Half_TN,tn_6144_906_4096,Gemm_Hipblaslt_TN_9613,0.0935089
GemmTunableOp_Half_TN,tn_6144_785_4096,Gemm_Hipblaslt_TN_9253,0.0863183
GemmTunableOp_Half_TN,tn_128256_103_4096,Gemm_Hipblaslt_TN_9060,0.424339
GemmTunableOp_Half_TN,tn_6144_811_4096,Gemm_Rocblas_621286778,0.0870234
GemmTunableOp_Half_TN,tn_4096_887_14336,Gemm_Hipblaslt_TN_9580,0.219677
GemmTunableOp_Half_TN,tn_4096_7239_4096,Gemm_Hipblaslt_TN_9697,0.418464
GemmTunableOp_Half_TN,tn_4096_1763_14336,Gemm_Hipblaslt_TN_9645,0.393413
GemmTunableOp_Half_TN,tn_4096_829_14336,Gemm_Hipblaslt_TN_9158,0.214202
GemmTunableOp_Half_TN,tn_4096_880_4096,Gemm_Hipblaslt_TN_9634,0.0664549
GemmTunableOp_Half_TN,tn_28672_7299_4096,Gemm_Hipblaslt_TN_159,2.92623
GemmTunableOp_Half_TN,tn_4096_2750_14336,Gemm_Hipblaslt_TN_9709,0.577054
GemmTunableOp_Half_TN,tn_6144_875_4096,Gemm_Hipblaslt_TN_9253,0.0927108
GemmTunableOp_Half_TN,tn_28672_873_4096,Gemm_Hipblaslt_TN_9684,0.390825
GemmTunableOp_Half_TN,tn_4096_947_14336,Gemm_Hipblaslt_TN_9604,0.233596
GemmTunableOp_Half_TN,tn_6144_2682_4096,Gemm_Hipblaslt_TN_9827,0.227913
GemmTunableOp_Half_TN,tn_6144_2699_4096,Gemm_Hipblaslt_TN_9742,0.256881
GemmTunableOp_Half_TN,tn_128256_39_4096,Gemm_Hipblaslt_TN_9451,0.331181
GemmTunableOp_Half_TN,tn_4096_878_4096,Gemm_Hipblaslt_TN_9634,0.0668815
GemmTunableOp_Half_TN,tn_4096_905_4096,Gemm_Hipblaslt_TN_9634,0.0684325
GemmTunableOp_Half_TN,tn_28672_854_4096,Gemm_Hipblaslt_TN_9684,0.390866
GemmTunableOp_Half_TN,tn_4096_1795_4096,Gemm_Hipblaslt_TN_9645,0.119867
GemmTunableOp_Half_TN,tn_28672_1841_4096,Gemm_Hipblaslt_TN_9683,0.810734
GemmTunableOp_Half_TN,tn_28672_2636_4096,Gemm_Hipblaslt_TN_9827,1.11558
GemmTunableOp_Half_TN,tn_4096_972_14336,Gemm_Hipblaslt_TN_9586,0.242964
GemmTunableOp_Half_TN,tn_4096_200_4096,Gemm_Rocblas_621294230,0.025051
GemmTunableOp_Half_TN,tn_28672_853_4096,Gemm_Hipblaslt_TN_9684,0.393244
GemmTunableOp_Half_TN,tn_57344_107_8192,Gemm_Rocblas_621294214,0.346614
GemmTunableOp_Half_TN,tn_6144_905_4096,Gemm_Hipblaslt_TN_9133,0.0940046
GemmTunableOp_Half_TN,tn_6144_893_4096,Gemm_Hipblaslt_TN_9613,0.0936098
GemmTunableOp_Half_TN,tn_10240_3603_8192,Gemm_Hipblaslt_TN_9743,1.06231
GemmTunableOp_Half_TN,tn_32000_19_8192,Gemm_Rocblas_621286350,0.150855
GemmTunableOp_Half_TN,tn_4096_3556_14336,Gemm_Hipblaslt_TN_9841,0.69948
GemmTunableOp_Half_TN,tn_4096_1867_14336,Gemm_Hipblaslt_TN_9645,0.414711
GemmTunableOp_Half_TN,tn_6144_825_4096,Gemm_Rocblas_621286778,0.0888367
GemmTunableOp_Half_TN,tn_10240_124_8192,Gemm_Hipblaslt_TN_7543,0.0633008
GemmTunableOp_Half_TN,tn_128256_219_4096,Gemm_Hipblaslt_TN_9937,0.578698
GemmTunableOp_Half_TN,tn_128256_188_4096,Gemm_Hipblaslt_TN_9752,0.521466
GemmTunableOp_Half_TN,tn_128256_80_4096,Gemm_Hipblaslt_TN_9057,0.385924
GemmTunableOp_Half_TN,tn_128256_180_4096,Gemm_Hipblaslt_TN_9803,0.512803
GemmTunableOp_Half_TN,tn_57344_3251_8192,Gemm_Hipblaslt_TN_9803,5.67396
GemmTunableOp_Half_TN,tn_128256_37_4096,Gemm_Hipblaslt_TN_9451,0.327156
GemmTunableOp_Half_TN,tn_128256_21_4096,Gemm_Hipblaslt_TN_9094,0.315842
GemmTunableOp_Half_TN,tn_28672_1693_4096,Gemm_Hipblaslt_TN_9730,0.745798
GemmTunableOp_Half_TN,tn_4096_2698_4096,Gemm_Hipblaslt_TN_9799,0.16349
GemmTunableOp_Half_TN,tn_128256_13_4096,Gemm_Rocblas_621294224,0.297455
GemmTunableOp_Half_TN,tn_57344_114_8192,Gemm_Rocblas_621286477,0.34899
GemmTunableOp_Half_TN,tn_6144_842_4096,Gemm_Rocblas_621294520,0.0892111
GemmTunableOp_Half_TN,tn_6144_248_4096,Gemm_Rocblas_621294232,0.0366237
GemmTunableOp_Half_TN,tn_57344_3347_8192,Gemm_Hipblaslt_TN_9818,5.94065
GemmTunableOp_Half_TN,tn_4096_208_4096,Gemm_Rocblas_621286491,0.0251823
GemmTunableOp_Half_TN,tn_8192_1153_28672,Gemm_Hipblaslt_TN_9774,1.15894
GemmTunableOp_Half_TN,tn_28672_2590_4096,Gemm_Hipblaslt_TN_9827,1.08537
GemmTunableOp_Half_TN,tn_8192_107_28672,Gemm_Hipblaslt_TN_8378,0.200724
GemmTunableOp_Half_TN,tn_128256_154_4096,Gemm_Hipblaslt_TN_9808,0.478941
GemmTunableOp_Half_TN,tn_4096_1644_4096,Gemm_Hipblaslt_TN_9671,0.10616
GemmTunableOp_Half_TN,tn_8192_95_28672,Gemm_Hipblaslt_TN_8168,0.185524
GemmTunableOp_Half_TN,tn_8192_125_28672,Gemm_Hipblaslt_TN_8378,0.21231
GemmTunableOp_Half_TN,tn_4096_797_14336,Gemm_Hipblaslt_TN_9147,0.213933
GemmTunableOp_Half_TN,tn_8192_3299_28672,Gemm_Hipblaslt_TN_9732,2.95025
GemmTunableOp_Half_TN,tn_57344_1296_8192,Gemm_Hipblaslt_TN_9841,2.37395
GemmTunableOp_Half_TN,tn_10240_1025_8192,Gemm_Hipblaslt_TN_9691,0.31333
GemmTunableOp_Half_TN,tn_8192_3498_8192,Gemm_Hipblaslt_TN_9743,0.79161
GemmTunableOp_Half_TN,tn_28672_1881_4096,Gemm_Hipblaslt_TN_9684,0.810173
GemmTunableOp_Half_TN,tn_4096_813_14336,Gemm_Hipblaslt_TN_9158,0.212391
GemmTunableOp_Half_TN,tn_128256_57_4096,Gemm_Rocblas_621294554,0.359614
GemmTunableOp_Half_TN,tn_32000_114_8192,Gemm_Rocblas_621286475,0.213746
GemmTunableOp_Half_TN,tn_57344_1160_8192,Gemm_Hipblaslt_TN_9068,2.31915
GemmTunableOp_Half_TN,tn_10240_1112_8192,Gemm_Rocblas_621286684,0.322099
GemmTunableOp_Half_TN,tn_8192_3482_8192,Gemm_Hipblaslt_TN_9677,0.78861
GemmTunableOp_Half_TN,tn_57344_108_8192,Default,0.34706
GemmTunableOp_Half_TN,tn_128256_123_4096,Gemm_Rocblas_621294762,0.435257
GemmTunableOp_Half_TN,tn_10240_1153_8192,Gemm_Hipblaslt_TN_9798,0.345239
GemmTunableOp_Half_TN,tn_4096_923_14336,Gemm_Hipblaslt_TN_9585,0.232396
GemmTunableOp_Half_TN,tn_32000_113_8192,Gemm_Rocblas_621294212,0.212588
GemmTunableOp_Half_TN,tn_4096_2773_4096,Gemm_Hipblaslt_TN_9852,0.169127
GemmTunableOp_Half_TN,tn_10240_1374_8192,Gemm_Hipblaslt_TN_9193,0.403887
GemmTunableOp_Half_TN,tn_128256_199_4096,Gemm_Hipblaslt_TN_9937,0.56564
GemmTunableOp_Half_TN,tn_4096_1762_14336,Gemm_Hipblaslt_TN_9645,0.396041
GemmTunableOp_Half_TN,tn_6144_799_4096,Gemm_Hipblaslt_TN_9357,0.0867376
GemmTunableOp_Half_TN,tn_8192_3971_8192,Gemm_Hipblaslt_TN_9815,0.88581
GemmTunableOp_Half_TN,tn_6144_232_4096,Gemm_Hipblaslt_TN_9468,0.0340862
GemmTunableOp_Half_TN,tn_28672_847_4096,Gemm_Hipblaslt_TN_9683,0.390796
GemmTunableOp_Half_TN,tn_57344_2859_8192,Gemm_Rocblas_621294490,5.13767
GemmTunableOp_Half_TN,tn_57344_110_8192,Gemm_Rocblas_621286477,0.345247
GemmTunableOp_Half_TN,tn_8192_2032_8192,Gemm_Hipblaslt_TN_9742,0.479308
GemmTunableOp_Half_TN,tn_6144_2786_4096,Gemm_Hipblaslt_TN_9763,0.260244
GemmTunableOp_Half_TN,tn_10240_3411_8192,Gemm_Hipblaslt_TN_9799,1.01537
GemmTunableOp_Half_TN,tn_8192_3715_28672,Default,3.29905
GemmTunableOp_Half_TN,tn_57344_109_8192,Gemm_Rocblas_621294214,0.345517
GemmTunableOp_Half_TN,tn_8192_25_8192,Gemm_Hipblaslt_TN_9408,0.0330493
GemmTunableOp_Half_TN,tn_57344_4000_8192,Gemm_Rocblas_621286915,6.74714
GemmTunableOp_Half_TN,tn_10240_2639_8192,Gemm_Hipblaslt_TN_9798,0.75545
GemmTunableOp_Half_TN,tn_6144_2601_4096,Gemm_Hipblaslt_TN_9768,0.222832
GemmTunableOp_Half_TN,tn_4096_816_14336,Gemm_Hipblaslt_TN_9158,0.213207
GemmTunableOp_Half_TN,tn_8192_121_28672,Gemm_Hipblaslt_TN_8378,0.206968
GemmTunableOp_Half_TN,tn_8192_131_28672,Gemm_Hipblaslt_TN_7251,0.220999
GemmTunableOp_Half_TN,tn_4096_880_14336,Gemm_Hipblaslt_TN_9580,0.218882
GemmTunableOp_Half_TN,tn_6144_7809_4096,Gemm_Hipblaslt_TN_9655,0.671904
GemmTunableOp_Half_TN,tn_57344_2962_8192,Gemm_Rocblas_621286734,5.11874
GemmTunableOp_Half_TN,tn_128256_109_4096,Gemm_Hipblaslt_TN_9061,0.429148
GemmTunableOp_Half_TN,tn_128256_50_4096,Gemm_Rocblas_621286813,0.358682
GemmTunableOp_Half_TN,tn_57344_3369_8192,Gemm_Hipblaslt_TN_159,5.69814
GemmTunableOp_Half_TN,tn_10240_103_8192,Gemm_Rocblas_621294504,0.0582409
GemmTunableOp_Half_TN,tn_28672_855_4096,Gemm_Hipblaslt_TN_9683,0.390812
GemmTunableOp_Half_TN,tn_4096_2682_4096,Gemm_Rocblas_621286705,0.163206
GemmTunableOp_Half_TN,tn_10240_2274_8192,Gemm_Hipblaslt_TN_9697,0.668602
GemmTunableOp_Half_TN,tn_6144_1886_4096,Gemm_Rocblas_621294426,0.165411
GemmTunableOp_Half_TN,tn_10240_118_8192,Gemm_Hipblaslt_TN_8892,0.0619951
GemmTunableOp_Half_TN,tn_28672_846_4096,Gemm_Hipblaslt_TN_9684,0.390987
GemmTunableOp_Half_TN,tn_28672_128_4096,Gemm_Rocblas_621286478,0.0727712
GemmTunableOp_Half_TN,tn_10240_4096_8192,Gemm_Hipblaslt_TN_9743,1.17211
GemmTunableOp_Half_TN,tn_8192_1271_28672,Gemm_Rocblas_621286581,1.21149
GemmTunableOp_Half_TN,tn_4096_862_4096,Gemm_Hipblaslt_TN_9634,0.0663055
GemmTunableOp_Half_TN,tn_57344_95_8192,Gemm_Hipblaslt_TN_9481,0.33119
GemmTunableOp_Half_TN,tn_6144_2628_4096,Gemm_Hipblaslt_TN_9813,0.227177
GemmTunableOp_Half_TN,tn_8192_103_8192,Gemm_Hipblaslt_TN_8891,0.0491092
GemmTunableOp_Half_TN,tn_128256_170_4096,Gemm_Hipblaslt_TN_9684,0.510367
GemmTunableOp_Half_TN,tn_57344_21_8192,Gemm_Hipblaslt_TN_9429,0.258725
GemmTunableOp_Half_TN,tn_8192_3120_28672,Gemm_Rocblas_621294473,2.88259
GemmTunableOp_Half_TN,tn_6144_2658_4096,Gemm_Hipblaslt_TN_9813,0.225329
GemmTunableOp_Half_TN,tn_8192_1297_28672,Gemm_Hipblaslt_TN_9774,1.22838
GemmTunableOp_Half_TN,tn_57344_92_8192,Gemm_Hipblaslt_TN_9481,0.330258
GemmTunableOp_Half_TN,tn_28672_839_4096,Gemm_Hipblaslt_TN_9683,0.388597
GemmTunableOp_Half_TN,tn_8192_3482_28672,Gemm_Rocblas_621286589,3.02869
GemmTunableOp_Half_TN,tn_6144_881_4096,Gemm_Hipblaslt_TN_9148,0.0935042
GemmTunableOp_Half_TN,tn_10240_3619_8192,Gemm_Hipblaslt_TN_9763,1.06215
GemmTunableOp_Half_TN,tn_28672_930_4096,Gemm_Hipblaslt_TN_9683,0.401891
GemmTunableOp_Half_TN,tn_4096_7937_14336,Gemm_Hipblaslt_TN_9713,1.6578
GemmTunableOp_Half_TN,tn_28672_892_4096,Gemm_Hipblaslt_TN_9684,0.39843
GemmTunableOp_Half_TN,tn_6144_1893_4096,Gemm_Rocblas_621294425,0.169927
GemmTunableOp_Half_TN,tn_8192_109_28672,Gemm_Hipblaslt_TN_8378,0.203054
GemmTunableOp_Half_TN,tn_10240_3498_8192,Gemm_Hipblaslt_TN_9799,1.02625
GemmTunableOp_Half_TN,tn_28672_3546_4096,Gemm_Hipblaslt_TN_9827,1.41228
GemmTunableOp_Half_TN,tn_8192_2717_8192,Gemm_Rocblas_621294320,0.640262
GemmTunableOp_Half_TN,tn_4096_944_4096,Gemm_Hipblaslt_TN_9576,0.0706751
GemmTunableOp_Half_TN,tn_8192_2551_8192,Gemm_Rocblas_621286574,0.615593
GemmTunableOp_Half_TN,tn_6144_3430_4096,Gemm_Hipblaslt_TN_9774,0.316023
GemmTunableOp_Half_TN,tn_4096_1813_14336,Gemm_Hipblaslt_TN_9620,0.409971
GemmTunableOp_Half_TN,tn_8192_4025_28672,Gemm_Rocblas_621286894,3.47232
GemmTunableOp_Half_TN,tn_8192_7_8192,Gemm_Hipblaslt_TN_9392,0.0303433
GemmTunableOp_Half_TN,tn_57344_101_8192,Gemm_Rocblas_621286477,0.3385
GemmTunableOp_Half_TN,tn_6144_1723_4096,Gemm_Hipblaslt_TN_9570,0.157526
GemmTunableOp_Half_TN,tn_10240_2866_8192,Gemm_Hipblaslt_TN_9743,0.803631
GemmTunableOp_Half_TN,tn_6144_1835_4096,Gemm_Rocblas_621286683,0.166592
GemmTunableOp_Half_TN,tn_128256_191_4096,Gemm_Hipblaslt_TN_9684,0.519957
GemmTunableOp_Half_TN,tn_4096_1756_4096,Gemm_Hipblaslt_TN_9134,0.117319
GemmTunableOp_Half_TN,tn_8192_3347_8192,Gemm_Hipblaslt_TN_9697,0.765358
GemmTunableOp_Half_TN,tn_10240_4090_8192,Gemm_Hipblaslt_TN_9743,1.15222
GemmTunableOp_Half_TN,tn_28672_2602_4096,Gemm_Hipblaslt_TN_9827,1.0962
GemmTunableOp_Half_TN,tn_6144_821_4096,Gemm_Rocblas_621286778,0.0879626
GemmTunableOp_Half_TN,tn_28672_7266_4096,Gemm_Hipblaslt_TN_159,2.85135
GemmTunableOp_Half_TN,tn_57344_127_8192,Gemm_Rocblas_621294214,0.354033
GemmTunableOp_Half_TN,tn_4096_2699_4096,Gemm_Hipblaslt_TN_9672,0.162839
GemmTunableOp_Half_TN,tn_10240_3347_8192,Gemm_Hipblaslt_TN_9815,0.918604
GemmTunableOp_Half_TN,tn_28672_843_4096,Gemm_Hipblaslt_TN_9683,0.391816
GemmTunableOp_Half_TN,tn_6144_1755_4096,Gemm_Hipblaslt_TN_9799,0.159506
GemmTunableOp_Half_TN,tn_8192_3555_28672,Gemm_Hipblaslt_TN_9732,3.06167
GemmTunableOp_Half_TN,tn_4096_916_14336,Gemm_Hipblaslt_TN_9585,0.231243
GemmTunableOp_Half_TN,tn_6144_2788_4096,Gemm_Hipblaslt_TN_9763,0.259604
GemmTunableOp_Half_TN,tn_6144_1913_4096,Gemm_Rocblas_621294425,0.170168
GemmTunableOp_Half_TN,tn_57344_3642_8192,Gemm_Hipblaslt_TN_9816,6.35836
GemmTunableOp_Half_TN,tn_6144_1614_4096,Gemm_Hipblaslt_TN_9570,0.154026
GemmTunableOp_Half_TN,tn_8192_1281_28672,Gemm_Hipblaslt_TN_9774,1.21988
GemmTunableOp_Half_TN,tn_28672_7863_4096,Gemm_Hipblaslt_TN_159,3.15914
GemmTunableOp_Half_TN,tn_32000_102_8192,Gemm_Rocblas_621286475,0.207629
GemmTunableOp_Half_TN,tn_4096_964_4096,Gemm_Hipblaslt_TN_9547,0.0696677
GemmTunableOp_Half_TN,tn_57344_12_8192,Gemm_Hipblaslt_TN_9429,0.253151
GemmTunableOp_Half_TN,tn_28672_2571_4096,Gemm_Hipblaslt_TN_9827,1.0931
GemmTunableOp_Half_TN,tn_28672_821_4096,Gemm_Hipblaslt_TN_9683,0.386162
GemmTunableOp_Half_TN,tn_8192_92_8192,Gemm_Hipblaslt_TN_8197,0.0471951
GemmTunableOp_Half_TN,tn_57344_106_8192,Gemm_Rocblas_621286477,0.344791
GemmTunableOp_Half_TN,tn_10240_3754_8192,Gemm_Hipblaslt_TN_9743,1.09045
GemmTunableOp_Half_TN,tn_4096_966_4096,Gemm_Hipblaslt_TN_9634,0.0703352
GemmTunableOp_Half_TN,tn_4096_838_4096,Gemm_Hipblaslt_TN_9634,0.0650267
GemmTunableOp_Half_TN,tn_4096_1785_14336,Gemm_Hipblaslt_TN_9645,0.399521
GemmTunableOp_Half_TN,tn_28672_1737_4096,Gemm_Rocblas_621294484,0.748072
GemmTunableOp_Half_TN,tn_10240_100_8192,Gemm_Rocblas_621294504,0.0597929
GemmTunableOp_Half_TN,tn_4096_80_14336,Gemm_Hipblaslt_TN_9294,0.0393447
GemmTunableOp_Half_TN,tn_8192_132_28672,Gemm_Hipblaslt_TN_8662,0.222142
GemmTunableOp_Half_TN,tn_8192_23_8192,Gemm_Hipblaslt_TN_9410,0.0328606
GemmTunableOp_Half_TN,tn_6144_871_4096,Gemm_Hipblaslt_TN_9561,0.0902964
GemmTunableOp_Half_TN,tn_4096_120_4096,Gemm_Rocblas_621286280,0.0172769
GemmTunableOp_Half_TN,tn_8192_3785_28672,Gemm_Rocblas_621286836,3.33938
GemmTunableOp_Half_TN,tn_8192_2760_28672,Gemm_Rocblas_621286579,2.56625
GemmTunableOp_Half_TN,tn_10240_132_8192,Gemm_Hipblaslt_TN_9367,0.0667121
GemmTunableOp_Half_TN,tn_57344_3153_8192,Gemm_Hipblaslt_TN_9803,5.6172
GemmTunableOp_Half_TN,tn_57344_3546_8192,Gemm_Hipblaslt_TN_159,5.79805
GemmTunableOp_Half_TN,tn_28672_2681_4096,Gemm_Hipblaslt_TN_9827,1.1132
GemmTunableOp_Half_TN,tn_6144_959_4096,Gemm_Hipblaslt_TN_9615,0.0948979
GemmTunableOp_Half_TN,tn_8192_20_28672,Gemm_Rocblas_621286354,0.129703
GemmTunableOp_Half_TN,tn_28672_1672_4096,Gemm_Rocblas_621286742,0.736805
GemmTunableOp_Half_TN,tn_8192_2274_28672,Gemm_Hipblaslt_TN_9774,2.26427
GemmTunableOp_Half_TN,tn_128256_46_4096,Gemm_Hipblaslt_TN_9451,0.337976
GemmTunableOp_Half_TN,tn_57344_4082_8192,Gemm_Hipblaslt_TN_9882,6.65181
GemmTunableOp_Half_TN,tn_10240_98_8192,Gemm_Rocblas_621294504,0.059733
GemmTunableOp_Half_TN,tn_8192_2914_28672,Gemm_Hipblaslt_TN_9709,2.70395
GemmTunableOp_Half_TN,tn_10240_1233_8192,Gemm_Hipblaslt_TN_9697,0.354629
GemmTunableOp_Half_TN,tn_8192_1296_8192,Gemm_Rocblas_621286580,0.315887
GemmTunableOp_Half_TN,tn_4096_2762_4096,Gemm_Rocblas_621286705,0.167858
GemmTunableOp_Half_TN,tn_28672_876_4096,Gemm_Hipblaslt_TN_9684,0.397315
GemmTunableOp_Half_TN,tn_57344_3140_8192,Gemm_Hipblaslt_TN_9803,5.61164
GemmTunableOp_Half_TN,tn_10240_1392_8192,Gemm_Hipblaslt_TN_9194,0.403241
GemmTunableOp_Half_TN,tn_57344_2549_8192,Gemm_Hipblaslt_TN_9800,4.54149
GemmTunableOp_Half_TN,tn_6144_809_4096,Gemm_Rocblas_621294520,0.0890086
GemmTunableOp_Half_TN,tn_4096_72_4096,Gemm_Rocblas_621286280,0.0152058
GemmTunableOp_Half_TN,tn_4096_3507_14336,Gemm_Hipblaslt_TN_9841,0.696418
GemmTunableOp_Half_TN,tn_8192_24_8192,Gemm_Hipblaslt_TN_9410,0.0329367
GemmTunableOp_Half_TN,tn_8192_1280_28672,Gemm_Rocblas_621294321,1.20638
GemmTunableOp_Half_TN,tn_4096_948_4096,Gemm_Hipblaslt_TN_9576,0.069837
GemmTunableOp_Half_TN,tn_32000_104_8192,Gemm_Rocblas_621294212,0.210264
GemmTunableOp_Half_TN,tn_10240_23_8192,Gemm_Hipblaslt_TN_9415,0.0398251
GemmTunableOp_Half_TN,tn_128256_94_4096,Gemm_Hipblaslt_TN_9057,0.398537
GemmTunableOp_Half_TN,tn_10240_16_8192,Gemm_Hipblaslt_TN_9411,0.0372784
GemmTunableOp_Half_TN,tn_4096_821_4096,Gemm_Hipblaslt_TN_9634,0.0639869
GemmTunableOp_Half_TN,tn_128256_211_4096,Gemm_Hipblaslt_TN_9937,0.572902
GemmTunableOp_Half_TN,tn_57344_2760_8192,Gemm_Rocblas_621294543,5.01635
GemmTunableOp_Half_TN,tn_4096_805_14336,Gemm_Hipblaslt_TN_9158,0.2124
GemmTunableOp_Half_TN,tn_8192_4063_8192,Gemm_Hipblaslt_TN_9753,0.910266
GemmTunableOp_Half_TN,tn_6144_1850_4096,Gemm_Rocblas_621294349,0.166807
GemmTunableOp_Half_TN,tn_8192_2639_8192,Gemm_Hipblaslt_TN_9799,0.636012
GemmTunableOp_Half_TN,tn_4096_24_14336,Gemm_Hipblaslt_TN_9392,0.0269743
GemmTunableOp_Half_TN,tn_8192_3251_28672,Gemm_Hipblaslt_TN_9732,2.91927
GemmTunableOp_Half_TN,tn_10240_1271_8192,Gemm_Hipblaslt_TN_9697,0.359931
GemmTunableOp_Half_TN,tn_57344_1389_8192,Gemm_Hipblaslt_TN_9830,2.627
GemmTunableOp_Half_TN,tn_10240_97_8192,Gemm_Rocblas_621294504,0.0581278
GemmTunableOp_Half_TN,tn_8192_94_8192,Gemm_Hipblaslt_TN_8197,0.0473787
GemmTunableOp_Half_TN,tn_57344_7_8192,Gemm_Rocblas_621294187,0.252131
GemmTunableOp_Half_TN,tn_10240_18_8192,Gemm_Hipblaslt_TN_9415,0.0387778
GemmTunableOp_Half_TN,tn_8192_1377_8192,Gemm_Rocblas_621294425,0.322926
GemmTunableOp_Half_TN,tn_128256_74_4096,Gemm_Hipblaslt_TN_9057,0.385606
GemmTunableOp_Half_TN,tn_28672_844_4096,Gemm_Hipblaslt_TN_9683,0.390891
GemmTunableOp_Half_TN,tn_6144_1737_4096,Gemm_Hipblaslt_TN_9799,0.160318
GemmTunableOp_Half_TN,tn_4096_908_14336,Gemm_Hipblaslt_TN_9585,0.230851
GemmTunableOp_Half_TN,tn_128256_84_4096,Gemm_Hipblaslt_TN_9058,0.394791
GemmTunableOp_Half_TN,tn_10240_120_8192,Gemm_Hipblaslt_TN_7543,0.0637171
GemmTunableOp_Half_TN,tn_57344_2622_8192,Gemm_Rocblas_621286739,4.62626
GemmTunableOp_Half_TN,tn_128256_236_4096,Gemm_Rocblas_621286892,0.606758
GemmTunableOp_Half_TN,tn_8192_2041_28672,Gemm_Hipblaslt_TN_9840,1.79913
GemmTunableOp_Half_TN,tn_8192_2802_8192,Gemm_Rocblas_621286580,0.660151
GemmTunableOp_Half_TN,tn_8192_1000_8192,Gemm_Hipblaslt_TN_9229,0.247468
GemmTunableOp_Half_TN,tn_8192_1389_8192,Gemm_Hipblaslt_TN_9799,0.324433
GemmTunableOp_Half_TN,tn_8192_125_8192,Gemm_Hipblaslt_TN_8891,0.0534773
GemmTunableOp_Half_TN,tn_8192_1360_28672,Gemm_Hipblaslt_TN_9799,1.26854
GemmTunableOp_Half_TN,tn_28672_812_4096,Gemm_Hipblaslt_TN_9683,0.386985
GemmTunableOp_Half_TN,tn_10240_3379_8192,Gemm_Hipblaslt_TN_9763,1.01317
GemmTunableOp_Half_TN,tn_6144_3565_4096,Gemm_Hipblaslt_TN_9570,0.324149
GemmTunableOp_Half_TN,tn_6144_988_4096,Gemm_Hipblaslt_TN_9671,0.10158
GemmTunableOp_Half_TN,tn_10240_93_8192,Gemm_Hipblaslt_TN_8095,0.053874
GemmTunableOp_Half_TN,tn_57344_1104_8192,Gemm_Hipblaslt_TN_9841,2.03213
GemmTunableOp_Half_TN,tn_4096_898_4096,Gemm_Hipblaslt_TN_9608,0.0667532
GemmTunableOp_Half_TN,tn_128256_30_4096,Gemm_Hipblaslt_TN_9094,0.31762
GemmTunableOp_Half_TN,tn_4096_969_14336,Gemm_Hipblaslt_TN_9608,0.244378
GemmTunableOp_Half_TN,tn_57344_1321_8192,Gemm_Hipblaslt_TN_9841,2.38548
GemmTunableOp_Half_TN,tn_28672_871_4096,Gemm_Hipblaslt_TN_9684,0.393636
GemmTunableOp_Half_TN,tn_57344_1025_8192,Gemm_Hipblaslt_TN_9841,1.97215
GemmTunableOp_Half_TN,tn_128256_25_4096,Gemm_Hipblaslt_TN_9094,0.318026
GemmTunableOp_Half_TN,tn_8192_22_8192,Gemm_Hipblaslt_TN_9410,0.032863
GemmTunableOp_Half_TN,tn_32000_120_8192,Gemm_Rocblas_621286475,0.215142
GemmTunableOp_Half_TN,tn_8192_9_28672,Gemm_Rocblas_621294224,0.123332
GemmTunableOp_Half_TN,tn_8192_2479_8192,Gemm_Rocblas_621286580,0.609996
GemmTunableOp_Half_TN,tn_6144_890_4096,Gemm_Hipblaslt_TN_9253,0.0937276
GemmTunableOp_Half_TN,tn_10240_3400_8192,Gemm_Hipblaslt_TN_9799,1.01326
GemmTunableOp_Half_TN,tn_4096_1905_14336,Gemm_Hipblaslt_TN_9620,0.416692
GemmTunableOp_Half_TN,tn_4096_924_14336,Gemm_Hipblaslt_TN_9634,0.232211
GemmTunableOp_Half_TN,tn_10240_3971_8192,Gemm_Hipblaslt_TN_9683,1.14795
GemmTunableOp_Half_TN,tn_4096_892_4096,Gemm_Hipblaslt_TN_9634,0.066868
GemmTunableOp_Half_TN,tn_8192_11_8192,Gemm_Hipblaslt_TN_9392,0.0305075
GemmTunableOp_Half_TN,tn_8192_129_8192,Gemm_Hipblaslt_TN_9306,0.0567451
GemmTunableOp_Half_TN,tn_4096_1897_4096,Gemm_Hipblaslt_TN_9645,0.121723
GemmTunableOp_Half_TN,tn_57344_1281_8192,Gemm_Hipblaslt_TN_9827,2.3843
GemmTunableOp_Half_TN,tn_8192_115_28672,Gemm_Hipblaslt_TN_8378,0.205597
GemmTunableOp_Half_TN,tn_8192_123_8192,Gemm_Hipblaslt_TN_8891,0.0548619
GemmTunableOp_Half_TN,tn_4096_7436_14336,Gemm_Hipblaslt_TN_9591,1.57565
GemmTunableOp_Half_TN,tn_8192_1319_8192,Gemm_Rocblas_621286684,0.317569
GemmTunableOp_Half_TN,tn_4096_56_14336,Gemm_Hipblaslt_TN_7486,0.0345006
GemmTunableOp_Half_TN,tn_6144_830_4096,Gemm_Rocblas_621294520,0.0886243
GemmTunableOp_Half_TN,tn_10240_1361_8192,Gemm_Hipblaslt_TN_9237,0.399952
GemmTunableOp_Half_TN,tn_128256_31_4096,Gemm_Hipblaslt_TN_9451,0.314527
GemmTunableOp_Half_TN,tn_8192_18_8192,Gemm_Hipblaslt_TN_9410,0.032317
GemmTunableOp_Half_TN,tn_10240_4063_8192,Gemm_Hipblaslt_TN_9743,1.15088
GemmTunableOp_Half_TN,tn_10240_11_8192,Gemm_Hipblaslt_TN_9411,0.0372563
GemmTunableOp_Half_TN,tn_57344_3747_8192,Gemm_Hipblaslt_TN_9908,6.55961
GemmTunableOp_Half_TN,tn_128256_143_4096,Gemm_Hipblaslt_TN_9808,0.474082
GemmTunableOp_Half_TN,tn_28672_1718_4096,Gemm_Hipblaslt_TN_9223,0.743438
GemmTunableOp_Half_TN,tn_8192_133_28672,Gemm_Hipblaslt_TN_8662,0.224435
GemmTunableOp_Half_TN,tn_57344_3290_8192,Gemm_Rocblas_621286901,5.91494
GemmTunableOp_Half_TN,tn_32000_18_8192,Gemm_Rocblas_621286350,0.148326
GemmTunableOp_Half_TN,tn_8192_1256_28672,Gemm_Hipblaslt_TN_9774,1.20212
GemmTunableOp_Half_TN,tn_8192_3626_8192,Gemm_Hipblaslt_TN_9697,0.802922
GemmTunableOp_Half_TN,tn_4096_924_4096,Gemm_Hipblaslt_TN_9576,0.0700804
GemmTunableOp_Half_TN,tn_57344_3187_8192,Gemm_Hipblaslt_TN_9803,5.63109
GemmTunableOp_Half_TN,tn_6144_904_4096,Gemm_Hipblaslt_TN_9613,0.0939716
GemmTunableOp_Half_TN,tn_128256_245_4096,Gemm_Rocblas_621286892,0.612429
GemmTunableOp_Half_TN,tn_4096_879_4096,Gemm_Hipblaslt_TN_9634,0.0673795
GemmTunableOp_Half_TN,tn_8192_1360_8192,Gemm_Hipblaslt_TN_9799,0.320866
GemmTunableOp_Half_TN,tn_57344_20_8192,Gemm_Hipblaslt_TN_9429,0.258439
GemmTunableOp_Half_TN,tn_8192_3642_8192,Gemm_Hipblaslt_TN_9697,0.80717
GemmTunableOp_Half_TN,tn_10240_104_8192,Gemm_Rocblas_621294504,0.0612202
GemmTunableOp_Half_TN,tn_4096_1697_4096,Gemm_Hipblaslt_TN_9616,0.108188
GemmTunableOp_Half_TN,tn_8192_3140_8192,Gemm_Hipblaslt_TN_9192,0.727997
GemmTunableOp_Half_TN,tn_128256_86_4096,Gemm_Hipblaslt_TN_9057,0.390396
GemmTunableOp_Half_TN,tn_8192_2914_8192,Gemm_Hipblaslt_TN_9675,0.690653
GemmTunableOp_Half_TN,tn_8192_2760_8192,Gemm_Rocblas_621286609,0.658736
GemmTunableOp_Half_TN,tn_57344_13_8192,Gemm_Rocblas_621294053,0.255719
GemmTunableOp_Half_TN,tn_6144_986_4096,Gemm_Hipblaslt_TN_9265,0.101571
GemmTunableOp_Half_TN,tn_4096_1701_14336,Gemm_Hipblaslt_TN_9790,0.36938
GemmTunableOp_Half_TN,tn_57344_98_8192,Gemm_Rocblas_621294214,0.336605
GemmTunableOp_Half_TN,tn_8192_1112_8192,Gemm_Hipblaslt_TN_9207,0.267899
GemmTunableOp_Half_TN,tn_6144_1762_4096,Gemm_Hipblaslt_TN_9711,0.163427
GemmTunableOp_Half_TN,tn_6144_930_4096,Gemm_Hipblaslt_TN_9606,0.0950427
GemmTunableOp_Half_TN,tn_8192_97_8192,Gemm_Hipblaslt_TN_8891,0.0484275
GemmTunableOp_Half_TN,tn_57344_1286_8192,Gemm_Hipblaslt_TN_9841,2.38523
GemmTunableOp_Half_TN,tn_10240_130_8192,Gemm_Hipblaslt_TN_7229,0.0693978
GemmTunableOp_Half_TN,tn_6144_2651_4096,Gemm_Hipblaslt_TN_9827,0.224165
GemmTunableOp_Half_TN,tn_4096_2764_14336,Gemm_Hipblaslt_TN_9799,0.571966
GemmTunableOp_Half_TN,tn_4096_795_4096,Gemm_Hipblaslt_TN_9604,0.0642129
GemmTunableOp_Half_TN,tn_4096_224_4096,Gemm_Rocblas_621294230,0.0254795
GemmTunableOp_Half_TN,tn_28672_5606_4096,Gemm_Hipblaslt_TN_9848,2.39305
GemmTunableOp_Half_TN,tn_128256_15_4096,Gemm_Rocblas_621294224,0.299127
GemmTunableOp_Half_TN,tn_57344_96_8192,Gemm_Hipblaslt_TN_9478,0.328609
GemmTunableOp_Half_TN,tn_8192_1350_28672,Gemm_Hipblaslt_TN_9799,1.27934
GemmTunableOp_Half_TN,tn_8192_1280_8192,Gemm_Rocblas_621286684,0.298144
GemmTunableOp_Half_TN,tn_4096_801_14336,Gemm_Hipblaslt_TN_9158,0.213294
GemmTunableOp_Half_TN,tn_8192_3139_8192,Gemm_Hipblaslt_TN_9677,0.729686
GemmTunableOp_Half_TN,tn_57344_1297_8192,Gemm_Hipblaslt_TN_9827,2.3989
GemmTunableOp_Half_TN,tn_8192_1264_8192,Gemm_Hipblaslt_TN_9691,0.299834
GemmTunableOp_Half_TN,tn_57344_4096_8192,Gemm_Rocblas_621294643,6.77452
GemmTunableOp_Half_TN,tn_57344_3206_8192,Gemm_Hipblaslt_TN_9818,5.62901
GemmTunableOp_Half_TN,tn_28672_2592_4096,Gemm_Hipblaslt_TN_9827,1.09021
GemmTunableOp_Half_TN,tn_8192_135_28672,Gemm_Hipblaslt_TN_8662,0.218723
GemmTunableOp_Half_TN,tn_10240_1265_8192,Gemm_Hipblaslt_TN_9189,0.358239
GemmTunableOp_Half_TN,tn_4096_972_4096,Gemm_Hipblaslt_TN_9547,0.0717184
GemmTunableOp_Half_TN,tn_8192_4000_8192,Gemm_Hipblaslt_TN_9655,0.885992
GemmTunableOp_Half_TN,tn_8192_1249_8192,Gemm_Hipblaslt_TN_9691,0.29945
GemmTunableOp_Half_TN,tn_6144_1864_4096,Gemm_Rocblas_621286684,0.167438
GemmTunableOp_Half_TN,tn_28672_1733_4096,Gemm_Hipblaslt_TN_9730,0.74361
GemmTunableOp_Half_TN,tn_4096_2722_4096,Gemm_Rocblas_621286705,0.166272
GemmTunableOp_Half_TN,tn_28672_1762_4096,Gemm_Rocblas_621286590,0.756855
GemmTunableOp_Half_TN,tn_28672_932_4096,Gemm_Hipblaslt_TN_9683,0.403705
GemmTunableOp_Half_TN,tn_6144_949_4096,Gemm_Hipblaslt_TN_9613,0.0951501
GemmTunableOp_Half_TN,tn_10240_1000_8192,Gemm_Rocblas_621294309,0.2979
GemmTunableOp_Half_TN,tn_128256_133_4096,Gemm_Hipblaslt_TN_9108,0.469653
GemmTunableOp_Half_TN,tn_6144_813_4096,Gemm_Rocblas_621286778,0.0873082
GemmTunableOp_Half_TN,tn_28672_795_4096,Gemm_Hipblaslt_TN_9691,0.359326
GemmTunableOp_Half_TN,tn_6144_804_4096,Gemm_Rocblas_621286778,0.0884858
GemmTunableOp_Half_TN,tn_28672_914_4096,Gemm_Hipblaslt_TN_9683,0.398059
GemmTunableOp_Half_TN,tn_128256_190_4096,Gemm_Hipblaslt_TN_9803,0.518642
GemmTunableOp_Half_TN,tn_8192_3274_8192,Gemm_Hipblaslt_TN_9798,0.756006
GemmTunableOp_Half_TN,tn_4096_904_14336,Gemm_Hipblaslt_TN_9634,0.229346
GemmTunableOp_Half_TN,tn_8192_129_28672,Gemm_Hipblaslt_TN_8662,0.215056
GemmTunableOp_Half_TN,tn_28672_862_4096,Gemm_Hipblaslt_TN_9683,0.394661
GemmTunableOp_Half_TN,tn_4096_840_4096,Gemm_Hipblaslt_TN_9170,0.0649656
GemmTunableOp_Half_TN,tn_8192_5_28672,Gemm_Rocblas_621294224,0.121297
GemmTunableOp_Half_TN,tn_4096_2793_14336,Gemm_Hipblaslt_TN_9799,0.571529
GemmTunableOp_Half_TN,tn_28672_2630_4096,Gemm_Hipblaslt_TN_9841,1.10921
GemmTunableOp_Half_TN,tn_10240_17_8192,Gemm_Hipblaslt_TN_9415,0.0386893
GemmTunableOp_Half_TN,tn_4096_7817_14336,Gemm_Hipblaslt_TN_9749,1.62936
GemmTunableOp_Half_TN,tn_128256_252_4096,Gemm_Rocblas_621294634,0.609665
GemmTunableOp_Half_TN,tn_28672_112_4096,Gemm_Hipblaslt_TN_9608,0.0714224
GemmTunableOp_Half_TN,tn_4096_2544_4096,Gemm_Hipblaslt_TN_9799,0.156468
GemmTunableOp_Half_TN,tn_6144_1944_4096,Gemm_Hipblaslt_TN_9187,0.17885
GemmTunableOp_Half_TN,tn_4096_1693_4096,Gemm_Hipblaslt_TN_9607,0.107274
GemmTunableOp_Half_TN,tn_4096_1777_14336,Gemm_Hipblaslt_TN_9645,0.396294
GemmTunableOp_Half_TN,tn_4096_1834_14336,Gemm_Hipblaslt_TN_9645,0.411265
GemmTunableOp_Half_TN,tn_8192_116_28672,Gemm_Hipblaslt_TN_8378,0.205468
GemmTunableOp_Half_TN,tn_6144_894_4096,Gemm_Hipblaslt_TN_9561,0.0922314
GemmTunableOp_Half_TN,tn_4096_990_14336,Gemm_Hipblaslt_TN_9586,0.248866
GemmTunableOp_Half_TN,tn_128256_214_4096,Gemm_Hipblaslt_TN_9937,0.57554
GemmTunableOp_Half_TN,tn_28672_1848_4096,Gemm_Hipblaslt_TN_9684,0.814792
GemmTunableOp_Half_TN,tn_28672_3418_4096,Gemm_Hipblaslt_TN_9827,1.38966
GemmTunableOp_Half_TN,tn_6144_2764_4096,Gemm_Hipblaslt_TN_9763,0.259012
GemmTunableOp_Half_TN,tn_128256_132_4096,Gemm_Hipblaslt_TN_9808,0.469267
GemmTunableOp_Half_TN,tn_6144_4463_4096,Gemm_Hipblaslt_TN_9677,0.389974
GemmTunableOp_Half_TN,tn_4096_1886_4096,Gemm_Hipblaslt_TN_9645,0.123635
GemmTunableOp_Half_TN,tn_6144_889_4096,Gemm_Hipblaslt_TN_9613,0.0933086
GemmTunableOp_Half_TN,tn_28672_1853_4096,Gemm_Hipblaslt_TN_9684,0.809068
GemmTunableOp_Half_TN,tn_8192_1313_8192,Gemm_Rocblas_621294425,0.315821
GemmTunableOp_Half_TN,tn_28672_1768_4096,Gemm_Rocblas_621294484,0.758332
GemmTunableOp_Half_TN,tn_4096_869_14336,Gemm_Hipblaslt_TN_9580,0.219404
GemmTunableOp_Half_TN,tn_4096_152_14336,Gemm_Hipblaslt_TN_8260,0.0563303
GemmTunableOp_Half_TN,tn_28672_2658_4096,Gemm_Hipblaslt_TN_9827,1.11795
GemmTunableOp_Half_TN,tn_4096_7787_4096,Gemm_Hipblaslt_TN_9888,0.446976
GemmTunableOp_Half_TN,tn_4096_40_14336,Gemm_Hipblaslt_TN_8050,0.0308387
GemmTunableOp_Half_TN,tn_28672_1759_4096,Gemm_Hipblaslt_TN_9223,0.755957
GemmTunableOp_Half_TN,tn_6144_1742_4096,Gemm_Hipblaslt_TN_9799,0.159734
GemmTunableOp_Half_TN,tn_128256_48_4096,Gemm_Hipblaslt_TN_9451,0.335384
GemmTunableOp_Half_TN,tn_57344_1217_8192,Gemm_Hipblaslt_TN_9827,2.35016
GemmTunableOp_Half_TN,tn_4096_4483_14336,Gemm_Hipblaslt_TN_9670,0.96956
GemmTunableOp_Half_TN,tn_4096_837_4096,Gemm_Hipblaslt_TN_9170,0.0643819
GemmTunableOp_Half_TN,tn_4096_837_14336,Gemm_Hipblaslt_TN_9131,0.223861
GemmTunableOp_Half_TN,tn_6144_7436_4096,Gemm_Hipblaslt_TN_9753,0.652649
GemmTunableOp_Half_TN,tn_6144_7239_4096,Gemm_Hipblaslt_TN_9697,0.622404
GemmTunableOp_Half_TN,tn_57344_1249_8192,Default,2.35839
GemmTunableOp_Half_TN,tn_28672_848_4096,Gemm_Hipblaslt_TN_9684,0.391701
GemmTunableOp_Half_TN,tn_6144_1795_4096,Gemm_Rocblas_621294425,0.164463
GemmTunableOp_Half_TN,tn_32000_115_8192,Gemm_Rocblas_621286475,0.212377
GemmTunableOp_Half_TN,tn_4096_857_4096,Gemm_Hipblaslt_TN_9170,0.0652208
GemmTunableOp_Half_TN,tn_4096_3507_4096,Gemm_Hipblaslt_TN_9743,0.200245
GemmTunableOp_Half_TN,tn_28672_7953_4096,Gemm_Hipblaslt_TN_159,3.17964
GemmTunableOp_Half_TN,tn_8192_2000_28672,Gemm_Hipblaslt_TN_9737,1.7455
GemmTunableOp_Half_TN,tn_4096_3711_4096,Gemm_Hipblaslt_TN_9813,0.216575
GemmTunableOp_Half_TN,tn_4096_977_14336,Gemm_Hipblaslt_TN_9586,0.242936
GemmTunableOp_Half_TN,tn_128256_76_4096,Gemm_Hipblaslt_TN_9058,0.387063
GemmTunableOp_Half_TN,tn_6144_913_4096,Gemm_Hipblaslt_TN_9611,0.0940987
GemmTunableOp_Half_TN,tn_4096_2635_14336,Gemm_Hipblaslt_TN_9691,0.544581
GemmTunableOp_Half_TN,tn_4096_919_14336,Gemm_Hipblaslt_TN_9585,0.232816
GemmTunableOp_Half_TN,tn_6144_866_4096,Gemm_Hipblaslt_TN_9253,0.0919171
GemmTunableOp_Half_TN,tn_4096_796_4096,Gemm_Hipblaslt_TN_9634,0.0631901
GemmTunableOp_Half_TN,tn_4096_2537_14336,Gemm_Hipblaslt_TN_9709,0.528945
GemmTunableOp_Half_TN,tn_6144_921_4096,Gemm_Hipblaslt_TN_9133,0.0946922
GemmTunableOp_Half_TN,tn_28672_1723_4096,Gemm_Rocblas_621286590,0.753182
GemmTunableOp_Half_TN,tn_6144_3662_4096,Gemm_Rocblas_621286684,0.333943
GemmTunableOp_Half_TN,tn_4096_969_4096,Gemm_Hipblaslt_TN_9576,0.0711055
GemmTunableOp_Half_TN,tn_4096_7239_14336,Gemm_Hipblaslt_TN_9743,1.49693
GemmTunableOp_Half_TN,tn_6144_839_4096,Gemm_Rocblas_621294520,0.0877563
GemmTunableOp_Half_TN,tn_6144_2560_4096,Gemm_Hipblaslt_TN_9841,0.22334
GemmTunableOp_Half_TN,tn_28672_901_4096,Gemm_Hipblaslt_TN_9683,0.399439
GemmTunableOp_Half_TN,tn_128256_127_4096,Gemm_Rocblas_621294762,0.431072
GemmTunableOp_Half_TN,tn_128256_145_4096,Gemm_Hipblaslt_TN_9775,0.472553
GemmTunableOp_Half_TN,tn_28672_2773_4096,Gemm_Hipblaslt_TN_9847,1.20552
GemmTunableOp_Half_TN,tn_128256_229_4096,Gemm_Rocblas_621294634,0.602496
GemmTunableOp_Half_TN,tn_4096_2572_14336,Gemm_Hipblaslt_TN_9799,0.54306
GemmTunableOp_Half_TN,tn_4096_1730_14336,Gemm_Hipblaslt_TN_9645,0.392458
GemmTunableOp_Half_TN,tn_4096_935_14336,Gemm_Hipblaslt_TN_9634,0.232131
GemmTunableOp_Half_TN,tn_6144_144_4096,Gemm_Hipblaslt_TN_9472,0.0265644
GemmTunableOp_Half_TN,tn_4096_956_4096,Gemm_Hipblaslt_TN_9634,0.0701361
GemmTunableOp_Half_TN,tn_4096_817_4096,Gemm_Hipblaslt_TN_9170,0.0640065
GemmTunableOp_Half_TN,tn_4096_1742_4096,Gemm_Hipblaslt_TN_9645,0.116693
GemmTunableOp_Half_TN,tn_4096_2717_14336,Gemm_Hipblaslt_TN_9799,0.55276
GemmTunableOp_Half_TN,tn_4096_2675_14336,Gemm_Hipblaslt_TN_9799,0.549326
GemmTunableOp_Half_TN,tn_6144_1768_4096,Gemm_Hipblaslt_TN_9711,0.163856
GemmTunableOp_Half_TN,tn_4096_1743_14336,Gemm_Hipblaslt_TN_9645,0.391256
GemmTunableOp_Half_TN,tn_4096_1831_4096,Gemm_Hipblaslt_TN_9645,0.121877
GemmTunableOp_Half_TN,tn_4096_896_14336,Gemm_Hipblaslt_TN_9580,0.219284
GemmTunableOp_Half_TN,tn_8192_133_8192,Gemm_Hipblaslt_TN_9306,0.0576584
GemmTunableOp_Half_TN,tn_28672_850_4096,Gemm_Hipblaslt_TN_9683,0.388247
GemmTunableOp_Half_TN,tn_28672_958_4096,Gemm_Hipblaslt_TN_9192,0.409752
GemmTunableOp_Half_TN,tn_4096_7299_4096,Gemm_Hipblaslt_TN_9959,0.4296
GemmTunableOp_Half_TN,tn_6144_936_4096,Gemm_Hipblaslt_TN_9615,0.0951984
GemmTunableOp_Half_TN,tn_4096_2537_4096,Gemm_Hipblaslt_TN_9657,0.156975
GemmTunableOp_Half_TN,tn_57344_2692_8192,Gemm_Hipblaslt_TN_9800,4.95873
GemmTunableOp_Half_TN,tn_28672_905_4096,Gemm_Hipblaslt_TN_9683,0.400776
GemmTunableOp_Half_TN,tn_28672_800_4096,Gemm_Rocblas_621286683,0.357825
GemmTunableOp_Half_TN,tn_28672_988_4096,Gemm_Hipblaslt_TN_9825,0.445282
GemmTunableOp_Half_TN,tn_4096_823_14336,Gemm_Hipblaslt_TN_9158,0.214401
GemmTunableOp_Half_TN,tn_28672_916_4096,Gemm_Hipblaslt_TN_9677,0.40272
GemmTunableOp_Half_TN,tn_10240_1360_8192,Gemm_Hipblaslt_TN_9278,0.401564
GemmTunableOp_Half_TN,tn_6144_160_4096,Gemm_Rocblas_621286440,0.0276736
GemmTunableOp_Half_TN,tn_28672_200_4096,Gemm_Hipblaslt_TN_9267,0.111747
GemmTunableOp_Half_TN,tn_28672_1795_4096,Gemm_Hipblaslt_TN_9684,0.805929
GemmTunableOp_Half_TN,tn_4096_184_4096,Gemm_Rocblas_621286491,0.0232783
GemmTunableOp_Half_TN,tn_6144_835_4096,Gemm_Rocblas_621294520,0.0888722
GemmTunableOp_Half_TN,tn_4096_8192_4096,Gemm_Hipblaslt_TN_9190,0.468212
GemmTunableOp_Half_TN,tn_6144_1803_4096,Gemm_Hipblaslt_TN_9799,0.166766
GemmTunableOp_Half_TN,tn_4096_2509_4096,Gemm_Hipblaslt_TN_9799,0.15715
GemmTunableOp_Half_TN,tn_6144_861_4096,Gemm_Rocblas_621294520,0.0882775
GemmTunableOp_Half_TN,tn_4096_168_4096,Gemm_Rocblas_621286491,0.0224815
GemmTunableOp_Half_TN,tn_4096_834_4096,Gemm_Hipblaslt_TN_9604,0.064327
GemmTunableOp_Half_TN,tn_6144_7266_4096,Gemm_Hipblaslt_TN_9743,0.619806
GemmTunableOp_Half_TN,tn_6144_2509_4096,Gemm_Hipblaslt_TN_9768,0.222579
GemmTunableOp_Half_TN,tn_4096_8049_14336,Gemm_Hipblaslt_TN_9738,1.66944
GemmTunableOp_Half_TN,tn_28672_2786_4096,Gemm_Hipblaslt_TN_9847,1.20626
GemmTunableOp_Half_TN,tn_8192_1008_28672,Gemm_Rocblas_621286974,1.05289
GemmTunableOp_Half_TN,tn_6144_176_4096,Gemm_Rocblas_621286440,0.0285513
GemmTunableOp_Half_TN,tn_4096_8_14336,Gemm_Rocblas_621286312,0.023223
GemmTunableOp_Half_TN,tn_4096_3352_14336,Gemm_Hipblaslt_TN_9743,0.662756
GemmTunableOp_Half_TN,tn_4096_984_4096,Gemm_Hipblaslt_TN_9604,0.0709587
GemmTunableOp_Half_TN,tn_4096_911_4096,Gemm_Hipblaslt_TN_9634,0.0681746
GemmTunableOp_Half_TN,tn_6144_2734_4096,Gemm_Hipblaslt_TN_9742,0.254591
GemmTunableOp_Half_TN,tn_6144_2675_4096,Gemm_Hipblaslt_TN_9827,0.225995
GemmTunableOp_Half_TN,tn_28672_7857_4096,Gemm_Hipblaslt_TN_159,3.159
GemmTunableOp_Half_TN,tn_28672_8192_4096,Gemm_Hipblaslt_TN_9841,3.39272
GemmTunableOp_Half_TN,tn_4096_184_14336,Gemm_Hipblaslt_TN_7585,0.0626804
GemmTunableOp_Half_TN,tn_128256_186_4096,Gemm_Hipblaslt_TN_9817,0.519198
GemmTunableOp_Half_TN,tn_4096_875_4096,Gemm_Hipblaslt_TN_9634,0.066501
GemmTunableOp_Half_TN,tn_6144_925_4096,Gemm_Hipblaslt_TN_9133,0.0947709
GemmTunableOp_Half_TN,tn_4096_168_14336,Gemm_Hipblaslt_TN_7586,0.061238
GemmTunableOp_Half_TN,tn_4096_884_14336,Gemm_Hipblaslt_TN_9580,0.219689
GemmTunableOp_Half_TN,tn_28672_917_4096,Gemm_Hipblaslt_TN_9683,0.400931
GemmTunableOp_Half_TN,tn_28672_160_4096,Gemm_Hipblaslt_TN_9561,0.0861095
GemmTunableOp_Half_TN,tn_4096_3569_4096,Gemm_Hipblaslt_TN_9814,0.201991
GemmTunableOp_Half_TN,tn_128256_5_4096,Gemm_Hipblaslt_TN_9405,0.286493
GemmTunableOp_Half_TN,tn_28672_7967_4096,Gemm_Hipblaslt_TN_159,3.17704
GemmTunableOp_Half_TN,tn_32000_20_8192,Gemm_Rocblas_621294193,0.149583
GemmTunableOp_Half_TN,tn_128256_116_4096,Gemm_Rocblas_621294762,0.431768
GemmTunableOp_Half_TN,tn_4096_1644_14336,Gemm_Hipblaslt_TN_9671,0.36426
GemmTunableOp_Half_TN,tn_4096_7952_14336,Gemm_Hipblaslt_TN_9593,1.64983
GemmTunableOp_Half_TN,tn_28672_7804_4096,Gemm_Hipblaslt_TN_159,3.01711
GemmTunableOp_Half_TN,tn_4096_1700_4096,Gemm_Hipblaslt_TN_9671,0.107506
GemmTunableOp_Half_TN,tn_6144_855_4096,Gemm_Rocblas_621294520,0.0886853
GemmTunableOp_Half_TN,tn_8192_94_28672,Gemm_Hipblaslt_TN_8168,0.186489
GemmTunableOp_Half_TN,tn_4096_872_4096,Gemm_Hipblaslt_TN_9170,0.0659524
GemmTunableOp_Half_TN,tn_6144_8007_4096,Gemm_Rocblas_621294127,0.687505
GemmTunableOp_Half_TN,tn_28672_817_4096,Gemm_Hipblaslt_TN_9683,0.385197
GemmTunableOp_Half_TN,tn_6144_2648_4096,Gemm_Hipblaslt_TN_9813,0.22496
GemmTunableOp_Half_TN,tn_4096_966_14336,Gemm_Hipblaslt_TN_9604,0.241571
GemmTunableOp_Half_TN,tn_28672_870_4096,Gemm_Hipblaslt_TN_9683,0.393484
GemmTunableOp_Half_TN,tn_4096_900_14336,Gemm_Hipblaslt_TN_9634,0.229242
GemmTunableOp_Half_TN,tn_28672_8007_4096,Gemm_Hipblaslt_TN_159,3.16853
GemmTunableOp_Half_TN,tn_4096_8156_4096,Gemm_Hipblaslt_TN_9813,0.469172
GemmTunableOp_Half_TN,tn_4096_7283_4096,Gemm_Hipblaslt_TN_9697,0.421846
GemmTunableOp_Half_TN,tn_28672_1666_4096,Gemm_Rocblas_621294484,0.737242
GemmTunableOp_Half_TN,tn_128256_152_4096,Gemm_Hipblaslt_TN_9709,0.476343
GemmTunableOp_Half_TN,tn_6144_7787_4096,Gemm_Rocblas_621294492,0.676463
GemmTunableOp_Half_TN,tn_4096_917_14336,Gemm_Hipblaslt_TN_9634,0.231882
GemmTunableOp_Half_TN,tn_128256_64_4096,Gemm_Rocblas_621286813,0.358937
GemmTunableOp_Half_TN,tn_6144_990_4096,Gemm_Hipblaslt_TN_9671,0.101147
GemmTunableOp_Half_TN,tn_4096_1954_14336,Gemm_Hipblaslt_TN_9645,0.424772
GemmTunableOp_Half_TN,tn_4096_7823_14336,Gemm_Hipblaslt_TN_9738,1.62732
GemmTunableOp_Half_TN,tn_6144_985_4096,Gemm_Hipblaslt_TN_9671,0.10217
GemmTunableOp_Half_TN,tn_128256_234_4096,Gemm_Rocblas_621286892,0.607012
GemmTunableOp_Half_TN,tn_6144_845_4096,Gemm_Rocblas_621294520,0.0883636
GemmTunableOp_Half_TN,tn_28672_808_4096,Gemm_Hipblaslt_TN_9683,0.386715
GemmTunableOp_Half_TN,tn_8192_3379_8192,Gemm_Hipblaslt_TN_9697,0.762838
GemmTunableOp_Half_TN,tn_4096_804_4096,Gemm_Hipblaslt_TN_9634,0.0635114
GemmTunableOp_Half_TN,tn_28672_1806_4096,Gemm_Hipblaslt_TN_9683,0.801009
GemmTunableOp_Half_TN,tn_128256_146_4096,Gemm_Hipblaslt_TN_9808,0.472922
GemmTunableOp_Half_TN,tn_4096_1759_14336,Gemm_Hipblaslt_TN_9645,0.396629
GemmTunableOp_Half_TN,tn_4096_879_14336,Gemm_Hipblaslt_TN_9580,0.218973
GemmTunableOp_Half_TN,tn_8192_3162_28672,Gemm_Hipblaslt_TN_9732,2.90409
GemmTunableOp_Half_TN,tn_4096_3752_4096,Gemm_Rocblas_621286281,0.215519
GemmTunableOp_Half_TN,tn_28672_799_4096,Gemm_Rocblas_621294425,0.360911
GemmTunableOp_Half_TN,tn_128256_163_4096,Gemm_Hipblaslt_TN_9732,0.505151
GemmTunableOp_Half_TN,tn_4096_2670_14336,Gemm_Rocblas_621286705,0.552055
GemmTunableOp_Half_TN,tn_28672_912_4096,Gemm_Hipblaslt_TN_9684,0.40014
GemmTunableOp_Half_TN,tn_8192_1224_8192,Gemm_Hipblaslt_TN_9691,0.299471
GemmTunableOp_Half_TN,tn_4096_1694_4096,Gemm_Hipblaslt_TN_9607,0.107588
GemmTunableOp_Half_TN,tn_6144_971_4096,Gemm_Rocblas_621294530,0.102666
GemmTunableOp_Half_TN,tn_6144_918_4096,Gemm_Hipblaslt_TN_9613,0.0947611
GemmTunableOp_Half_TN,tn_4096_1715_14336,Gemm_Hipblaslt_TN_9790,0.370019
GemmTunableOp_Half_TN,tn_28672_1730_4096,Gemm_Rocblas_621286742,0.751953
GemmTunableOp_Half_TN,tn_6144_1744_4096,Gemm_Rocblas_621286705,0.160345
GemmTunableOp_Half_TN,tn_128256_107_4096,Gemm_Hipblaslt_TN_9061,0.423041
GemmTunableOp_Half_TN,tn_4096_800_14336,Gemm_Hipblaslt_TN_9147,0.215542
GemmTunableOp_Half_TN,tn_57344_104_8192,Gemm_Rocblas_621286477,0.343449
GemmTunableOp_Half_TN,tn_4096_921_14336,Gemm_Hipblaslt_TN_9585,0.232488
GemmTunableOp_Half_TN,tn_6144_873_4096,Gemm_Hipblaslt_TN_9253,0.093098
GemmTunableOp_Half_TN,tn_6144_3671_4096,Gemm_Rocblas_621294426,0.334051
GemmTunableOp_Half_TN,tn_28672_924_4096,Gemm_Hipblaslt_TN_9683,0.400588
GemmTunableOp_Half_TN,tn_4096_983_4096,Gemm_Hipblaslt_TN_9604,0.0716403
GemmTunableOp_Half_TN,tn_28672_911_4096,Gemm_Hipblaslt_TN_9684,0.400291
GemmTunableOp_Half_TN,tn_28672_7436_4096,Gemm_Hipblaslt_TN_159,2.97713
GemmTunableOp_Half_TN,tn_28672_809_4096,Gemm_Hipblaslt_TN_9684,0.384869
GemmTunableOp_Half_TN,tn_8192_3369_28672,Gemm_Hipblaslt_TN_9732,2.97711
GemmTunableOp_Half_TN,tn_8192_132_8192,Gemm_Hipblaslt_TN_9306,0.0561978
GemmTunableOp_Half_TN,tn_6144_882_4096,Gemm_Hipblaslt_TN_9615,0.0938514
GemmTunableOp_Half_TN,tn_4096_839_4096,Gemm_Hipblaslt_TN_9604,0.0649853
GemmTunableOp_Half_TN,tn_6144_846_4096,Gemm_Hipblaslt_TN_9163,0.0900794
GemmTunableOp_Half_TN,tn_4096_936_14336,Gemm_Hipblaslt_TN_9634,0.231496
GemmTunableOp_Half_TN,tn_4096_200_14336,Gemm_Hipblaslt_TN_9363,0.0677241
GemmTunableOp_Half_TN,tn_6144_977_4096,Gemm_Rocblas_621286571,0.102141
GemmTunableOp_Half_TN,tn_6144_859_4096,Gemm_Rocblas_621286778,0.0890847
GemmTunableOp_Half_TN,tn_4096_2653_4096,Gemm_Hipblaslt_TN_9709,0.162702
GemmTunableOp_Half_TN,tn_28672_903_4096,Gemm_Hipblaslt_TN_9683,0.401364
GemmTunableOp_Half_TN,tn_4096_940_14336,Gemm_Hipblaslt_TN_9634,0.23333
GemmTunableOp_Half_TN,tn_4096_876_4096,Gemm_Hipblaslt_TN_9547,0.0667845
GemmTunableOp_Half_TN,tn_6144_1729_4096,Gemm_Hipblaslt_TN_9799,0.158702
GemmTunableOp_Half_TN,tn_4096_846_14336,Gemm_Hipblaslt_TN_9580,0.220675
GemmTunableOp_Half_TN,tn_6144_1846_4096,Gemm_Hipblaslt_TN_9672,0.165944
GemmTunableOp_Half_TN,tn_4096_1783_14336,Gemm_Hipblaslt_TN_9645,0.398157
GemmTunableOp_Half_TN,tn_28672_986_4096,Gemm_Hipblaslt_TN_9825,0.437301
GemmTunableOp_Half_TN,tn_4096_927_14336,Gemm_Hipblaslt_TN_9589,0.234455
GemmTunableOp_Half_TN,tn_28672_4483_4096,Gemm_Hipblaslt_TN_9958,1.88384
GemmTunableOp_Half_TN,tn_6144_1705_4096,Gemm_Hipblaslt_TN_9799,0.15676
GemmTunableOp_Half_TN,tn_6144_8156_4096,Gemm_Hipblaslt_TN_9749,0.696723
GemmTunableOp_Half_TN,tn_4096_48_14336,Gemm_Hipblaslt_TN_8050,0.0312994
GemmTunableOp_Half_TN,tn_6144_1785_4096,Gemm_Rocblas_621286684,0.164391
GemmTunableOp_Half_TN,tn_6144_1700_4096,Gemm_Rocblas_621286753,0.158315
GemmTunableOp_Half_TN,tn_4096_939_14336,Gemm_Hipblaslt_TN_9634,0.231783
GemmTunableOp_Half_TN,tn_4096_896_4096,Gemm_Hipblaslt_TN_9170,0.0662703
GemmTunableOp_Half_TN,tn_6144_7937_4096,Gemm_Hipblaslt_TN_9753,0.686835
GemmTunableOp_Half_TN,tn_4096_811_4096,Gemm_Hipblaslt_TN_9634,0.0634722
GemmTunableOp_Half_TN,tn_6144_1759_4096,Gemm_Hipblaslt_TN_9799,0.159431
GemmStridedBatchedTunableOp_Half_TN,tn_901_901_128_B_32,Gemm_Hipblaslt_TN_7519,0.0487259
GemmStridedBatchedTunableOp_Half_TN,tn_853_853_128_B_32,Gemm_Rocblas_621294635,0.0436232
GemmStridedBatchedTunableOp_Half_TN,tn_872_872_128_B_32,Gemm_Hipblaslt_TN_150,0.0388624
GemmStridedBatchedTunableOp_Half_TN,tn_880_880_128_B_32,Gemm_Hipblaslt_TN_150,0.0387206
GemmStridedBatchedTunableOp_Half_TN,tn_911_911_128_B_32,Gemm_Hipblaslt_TN_7519,0.0502845
GemmStridedBatchedTunableOp_Half_TN,tn_844_844_128_B_32,Gemm_Rocblas_621294635,0.0422954
GemmStridedBatchedTunableOp_Half_TN,tn_885_885_128_B_32,Gemm_Rocblas_621286396,0.0471998
GemmStridedBatchedTunableOp_Half_TN,tn_918_918_128_B_32,Gemm_Hipblaslt_TN_7519,0.04975
GemmStridedBatchedTunableOp_Half_TN,tn_860_860_128_B_32,Gemm_Rocblas_621294635,0.0441932
GemmStridedBatchedTunableOp_Half_TN,tn_934_934_128_B_32,Gemm_Rocblas_621294635,0.0510769
GemmStridedBatchedTunableOp_Half_TN,tn_951_951_128_B_32,Gemm_Hipblaslt_TN_7519,0.0507243
GemmStridedBatchedTunableOp_Half_TN,tn_932_932_128_B_32,Gemm_Hipblaslt_TN_6879,0.0503759
GemmStridedBatchedTunableOp_Half_TN,tn_943_943_128_B_32,Gemm_Hipblaslt_TN_7519,0.0498175
GemmStridedBatchedTunableOp_Half_TN,tn_887_887_128_B_32,Gemm_Rocblas_621294105,0.0469082
GemmStridedBatchedTunableOp_Half_TN,tn_868_868_128_B_32,Gemm_Hipblaslt_TN_7483,0.0435381
GemmStridedBatchedTunableOp_Half_TN,tn_858_858_128_B_32,Gemm_Rocblas_621294635,0.0449562
GemmStridedBatchedTunableOp_Half_TN,tn_889_889_128_B_32,Gemm_Rocblas_621294517,0.0474138
GemmStridedBatchedTunableOp_Half_TN,tn_845_845_128_B_32,Gemm_Hipblaslt_TN_7483,0.044407
GemmStridedBatchedTunableOp_Half_TN,tn_1201_1201_128_B_64,Gemm_Rocblas_621294106,0.131229
GemmStridedBatchedTunableOp_Half_TN,tn_1489_1489_128_B_64,Gemm_Rocblas_621294106,0.192858
GemmStridedBatchedTunableOp_Half_TN,tn_1360_1360_128_B_64,Gemm_Rocblas_621294109,0.151763
GemmStridedBatchedTunableOp_Half_TN,tn_1382_1382_128_B_64,Gemm_Rocblas_621286412,0.164217
GemmStridedBatchedTunableOp_Half_TN,tn_1457_1457_128_B_64,Gemm_Rocblas_621294106,0.186283
GemmStridedBatchedTunableOp_Half_TN,tn_900_900_128_B_32,Gemm_Hipblaslt_TN_7519,0.0487018
GemmStridedBatchedTunableOp_Half_TN,tn_1301_1301_128_B_64,Gemm_Rocblas_621294109,0.155857
GemmStridedBatchedTunableOp_Half_TN,tn_1176_1176_128_B_64,Gemm_Rocblas_621286397,0.124792
GemmStridedBatchedTunableOp_Half_TN,tn_1119_1119_128_B_64,Gemm_Rocblas_621286397,0.115239
GemmStridedBatchedTunableOp_Half_TN,tn_898_898_128_B_32,Gemm_Hipblaslt_TN_9508,0.0499221
GemmStridedBatchedTunableOp_Half_TN,tn_1042_1042_128_B_64,Gemm_Rocblas_621294725,0.104178
GemmStridedBatchedTunableOp_Half_TN,tn_1089_1089_128_B_64,Gemm_Hipblaslt_TN_6879,0.11221
GemmStridedBatchedTunableOp_Half_TN,tn_1233_1233_128_B_64,Gemm_Hipblaslt_TN_6879,0.137644
GemmStridedBatchedTunableOp_Half_TN,tn_817_817_128_B_32,Gemm_Rocblas_621294635,0.0412635
GemmStridedBatchedTunableOp_Half_TN,tn_796_796_128_B_32,Gemm_Rocblas_621294635,0.0390467
GemmStridedBatchedTunableOp_Half_TN,tn_1168_1168_128_B_64,Gemm_Rocblas_621294110,0.11936
GemmStridedBatchedTunableOp_Half_TN,tn_1272_1272_128_B_64,Gemm_Rocblas_621294106,0.13853
GemmStridedBatchedTunableOp_Half_TN,tn_1208_1208_128_B_64,Gemm_Rocblas_621286397,0.128607
GemmStridedBatchedTunableOp_Half_TN,tn_962_962_128_B_32,Gemm_Hipblaslt_TN_7519,0.0511924
GemmStridedBatchedTunableOp_Half_TN,tn_1316_1316_128_B_64,Gemm_Rocblas_621286412,0.151595
GemmStridedBatchedTunableOp_Half_TN,tn_1409_1409_128_B_64,Gemm_Rocblas_621286397,0.176381
GemmStridedBatchedTunableOp_Half_TN,tn_1276_1276_128_B_64,Gemm_Rocblas_621294106,0.142132
GemmStridedBatchedTunableOp_Half_TN,tn_1000_1000_128_B_64,Gemm_Hipblaslt_TN_153,0.0924409
GemmStridedBatchedTunableOp_Half_TN,tn_831_831_128_B_32,Gemm_Rocblas_621294635,0.0421078
GemmStridedBatchedTunableOp_Half_TN,tn_1073_1073_128_B_64,Gemm_Hipblaslt_TN_6879,0.108624
GemmStridedBatchedTunableOp_Half_TN,tn_1039_1039_128_B_64,Gemm_Rocblas_621294725,0.104955
GemmStridedBatchedTunableOp_Half_TN,tn_832_832_128_B_32,Gemm_Hipblaslt_TN_150,0.0354951
GemmStridedBatchedTunableOp_Half_TN,tn_1169_1169_128_B_64,Gemm_Hipblaslt_TN_6879,0.125293
GemmStridedBatchedTunableOp_Half_TN,tn_1265_1265_128_B_64,Gemm_Hipblaslt_TN_6879,0.143337
GemmStridedBatchedTunableOp_Half_TN,tn_909_909_128_B_32,Gemm_Hipblaslt_TN_7483,0.0502202
GemmStridedBatchedTunableOp_Half_TN,tn_821_821_128_B_32,Gemm_Rocblas_621294635,0.041341
GemmStridedBatchedTunableOp_Half_TN,tn_964_964_128_B_32,Gemm_Rocblas_621286809,0.0520581
GemmStridedBatchedTunableOp_Half_TN,tn_867_867_128_B_32,Gemm_Rocblas_621294517,0.046629
GemmStridedBatchedTunableOp_Half_TN,tn_837_837_128_B_32,Gemm_Rocblas_621294635,0.0435389
GemmStridedBatchedTunableOp_Half_TN,tn_794_794_128_B_32,Gemm_Rocblas_621294551,0.0404581
GemmStridedBatchedTunableOp_Half_TN,tn_789_789_128_B_32,Gemm_Rocblas_621294635,0.0407956
GemmStridedBatchedTunableOp_Half_TN,tn_966_966_128_B_32,Gemm_Hipblaslt_TN_7483,0.0525724
GemmStridedBatchedTunableOp_Half_TN,tn_946_946_128_B_32,Gemm_Hipblaslt_TN_6879,0.0520261
GemmStridedBatchedTunableOp_Half_TN,tn_830_830_128_B_32,Gemm_Rocblas_621294635,0.0399009
GemmStridedBatchedTunableOp_Half_TN,tn_893_893_128_B_32,Gemm_Rocblas_621286396,0.0476337
GemmStridedBatchedTunableOp_Half_TN,tn_933_933_128_B_32,Gemm_Hipblaslt_TN_6879,0.0513568
GemmStridedBatchedTunableOp_Half_TN,tn_840_840_128_B_32,Gemm_Hipblaslt_TN_150,0.0389549
GemmStridedBatchedTunableOp_Half_TN,tn_890_890_128_B_32,Gemm_Rocblas_621286396,0.0467414
GemmStridedBatchedTunableOp_Half_TN,tn_942_942_128_B_32,Gemm_Rocblas_621286938,0.0514571
GemmStridedBatchedTunableOp_Half_TN,tn_913_913_128_B_32,Gemm_Hipblaslt_TN_7519,0.0486379
GemmStridedBatchedTunableOp_Half_TN,tn_930_930_128_B_32,Gemm_Hipblaslt_TN_7519,0.0498003
GemmStridedBatchedTunableOp_Half_TN,tn_992_992_128_B_32,Gemm_Hipblaslt_TN_153,0.0457748
GemmStridedBatchedTunableOp_Half_TN,tn_925_925_128_B_32,Gemm_Hipblaslt_TN_7519,0.0502803
GemmStridedBatchedTunableOp_Half_TN,tn_941_941_128_B_32,Gemm_Hipblaslt_TN_6879,0.0511387
GemmStridedBatchedTunableOp_Half_TN,tn_820_820_128_B_32,Gemm_Rocblas_621294635,0.040676
GemmStridedBatchedTunableOp_Half_TN,tn_908_908_128_B_32,Gemm_Rocblas_621294635,0.0487662
GemmStridedBatchedTunableOp_Half_TN,tn_974_974_128_B_32,Gemm_Hipblaslt_TN_7483,0.0527704
GemmStridedBatchedTunableOp_Half_TN,tn_1048_1048_128_B_64,Gemm_Rocblas_621294725,0.103987
GemmStridedBatchedTunableOp_Half_TN,tn_801_801_128_B_32,Gemm_Rocblas_621294635,0.0398057
GemmStridedBatchedTunableOp_Half_TN,tn_1028_1028_128_B_64,Gemm_Rocblas_621294725,0.0988904
GemmStridedBatchedTunableOp_Half_TN,tn_947_947_128_B_32,Gemm_Hipblaslt_TN_7519,0.0506343
GemmStridedBatchedTunableOp_Half_TN,tn_804_804_128_B_32,Gemm_Rocblas_621294635,0.0401598
GemmTunableOp_Half_TN,tn_4096_1778_4096,Gemm_Hipblaslt_TN_9645,0.116856
GemmTunableOp_Half_TN,tn_28672_948_4096,Gemm_Hipblaslt_TN_9684,0.397771
GemmTunableOp_Half_TN,tn_6144_966_4096,Gemm_Rocblas_621294311,0.101912
GemmTunableOp_Half_TN,tn_28672_1798_4096,Gemm_Hipblaslt_TN_9832,0.796784
GemmTunableOp_Half_TN,tn_128256_6_4096,Gemm_Hipblaslt_TN_9405,0.285006
GemmTunableOp_Half_TN,tn_4096_843_14336,Gemm_Hipblaslt_TN_9580,0.222831
GemmTunableOp_Half_TN,tn_4096_906_14336,Gemm_Hipblaslt_TN_9634,0.230915
GemmTunableOp_Half_TN,tn_4096_176_4096,Gemm_Rocblas_621294230,0.0226774
GemmTunableOp_Half_TN,tn_4096_971_14336,Gemm_Hipblaslt_TN_9604,0.243949
GemmTunableOp_Half_TN,tn_4096_248_14336,Gemm_Hipblaslt_TN_7627,0.0762961
GemmTunableOp_Half_TN,tn_28672_1827_4096,Gemm_Hipblaslt_TN_9684,0.795387
GemmTunableOp_Half_TN,tn_4096_7967_14336,Gemm_Hipblaslt_TN_9749,1.61624
GemmTunableOp_Half_TN,tn_4096_885_4096,Gemm_Hipblaslt_TN_9547,0.0672515
GemmTunableOp_Half_TN,tn_6144_2703_4096,Gemm_Hipblaslt_TN_9742,0.254512
GemmTunableOp_Half_TN,tn_4096_920_4096,Gemm_Hipblaslt_TN_9576,0.0693554
GemmTunableOp_Half_TN,tn_6144_872_4096,Gemm_Hipblaslt_TN_9253,0.0917159
GemmTunableOp_Half_TN,tn_28672_1900_4096,Gemm_Hipblaslt_TN_9684,0.808232
GemmTunableOp_Half_TN,tn_6144_2872_4096,Gemm_Hipblaslt_TN_9567,0.264115
GemmTunableOp_Half_TN,tn_4096_875_14336,Gemm_Hipblaslt_TN_9580,0.219552
GemmTunableOp_Half_TN,tn_28672_944_4096,Gemm_Hipblaslt_TN_9684,0.401775
GemmTunableOp_Half_TN,tn_28672_2572_4096,Gemm_Hipblaslt_TN_9827,1.07794
GemmTunableOp_Half_TN,tn_4096_240_14336,Gemm_Hipblaslt_TN_9303,0.0749942
GemmTunableOp_Half_TN,tn_4096_1893_4096,Gemm_Hipblaslt_TN_9134,0.122464
GemmTunableOp_Half_TN,tn_4096_922_14336,Gemm_Hipblaslt_TN_9634,0.23273
GemmTunableOp_Half_TN,tn_6144_3569_4096,Gemm_Hipblaslt_TN_9570,0.319413
GemmTunableOp_Half_TN,tn_28672_104_4096,Gemm_Hipblaslt_TN_9252,0.0686029
GemmTunableOp_Half_TN,tn_4096_72_14336,Gemm_Hipblaslt_TN_7511,0.0385172
GemmTunableOp_Half_TN,tn_4096_907_14336,Gemm_Hipblaslt_TN_9634,0.232187
GemmTunableOp_Half_TN,tn_4096_891_14336,Gemm_Hipblaslt_TN_9580,0.220973
GemmTunableOp_Half_TN,tn_4096_891_4096,Gemm_Hipblaslt_TN_9634,0.0664919
GemmTunableOp_Half_TN,tn_28672_1835_4096,Gemm_Hipblaslt_TN_9832,0.799864
GemmTunableOp_Half_TN,tn_28672_3569_4096,Gemm_Hipblaslt_TN_9827,1.38589
GemmTunableOp_Half_TN,tn_4096_1944_4096,Gemm_Hipblaslt_TN_9645,0.123867
GemmTunableOp_Half_TN,tn_4096_3546_4096,Gemm_Hipblaslt_TN_9743,0.200453
GemmTunableOp_Half_TN,tn_4096_922_4096,Gemm_Hipblaslt_TN_9576,0.0693648
GemmTunableOp_Half_TN,tn_6144_887_4096,Gemm_Hipblaslt_TN_9561,0.0897271
GemmTunableOp_Half_TN,tn_4096_1954_4096,Gemm_Hipblaslt_TN_9645,0.125352
GemmTunableOp_Half_TN,tn_6144_2805_4096,Gemm_Hipblaslt_TN_9742,0.256611
GemmTunableOp_Half_TN,tn_4096_1748_4096,Gemm_Hipblaslt_TN_9645,0.116365
GemmTunableOp_Half_TN,tn_28672_811_4096,Gemm_Hipblaslt_TN_9684,0.382842
GemmTunableOp_Half_TN,tn_4096_3430_14336,Gemm_Hipblaslt_TN_9743,0.672983
GemmTunableOp_Half_TN,tn_4096_4463_14336,Gemm_Hipblaslt_TN_9698,0.942586
GemmTunableOp_Half_TN,tn_6144_880_4096,Gemm_Hipblaslt_TN_9613,0.0931272
GemmTunableOp_Half_TN,tn_4096_2860_4096,Gemm_Rocblas_621286683,0.170053
GemmTunableOp_Half_TN,tn_4096_7953_14336,Gemm_Hipblaslt_TN_9815,1.62516
GemmTunableOp_Half_TN,tn_4096_1806_14336,Gemm_Hipblaslt_TN_9620,0.411031
GemmTunableOp_Half_TN,tn_4096_1897_14336,Gemm_Hipblaslt_TN_9645,0.416437
GemmTunableOp_Half_TN,tn_4096_3662_4096,Gemm_Hipblaslt_TN_9768,0.211193
GemmTunableOp_Half_TN,tn_6144_900_4096,Gemm_Hipblaslt_TN_9613,0.0932473
GemmTunableOp_Half_TN,tn_28672_1829_4096,Gemm_Hipblaslt_TN_9832,0.799608
GemmTunableOp_Half_TN,tn_4096_836_4096,Gemm_Hipblaslt_TN_9634,0.0650519
GemmTunableOp_Half_TN,tn_28672_819_4096,Gemm_Hipblaslt_TN_9684,0.382826
GemmTunableOp_Half_TN,tn_28672_2805_4096,Gemm_Hipblaslt_TN_9917,1.20395
GemmTunableOp_Half_TN,tn_28672_885_4096,Gemm_Hipblaslt_TN_9684,0.391414
GemmTunableOp_Half_TN,tn_6144_2606_4096,Gemm_Hipblaslt_TN_9827,0.222182
GemmTunableOp_Half_TN,tn_28672_2635_4096,Gemm_Hipblaslt_TN_9827,1.09523
GemmTunableOp_Half_TN,tn_28672_2672_4096,Gemm_Hipblaslt_TN_9827,1.09688
GemmTunableOp_Half_TN,tn_6144_943_4096,Gemm_Hipblaslt_TN_9606,0.094984
GemmTunableOp_Half_TN,tn_28672_1695_4096,Gemm_Rocblas_621294420,0.729052
GemmTunableOp_Half_TN,tn_4096_144_4096,Gemm_Hipblaslt_TN_9474,0.0214984
GemmTunableOp_Half_TN,tn_4096_866_4096,Gemm_Hipblaslt_TN_9634,0.0662575
GemmTunableOp_Half_TN,tn_6144_1739_4096,Gemm_Hipblaslt_TN_9209,0.15997
GemmTunableOp_Half_TN,tn_57344_18_8192,Gemm_Hipblaslt_TN_9424,0.245203
GemmTunableOp_Half_TN,tn_4096_816_4096,Gemm_Hipblaslt_TN_9604,0.0641839
GemmTunableOp_Half_TN,tn_8192_2015_28672,Gemm_Hipblaslt_TN_9840,1.75002
GemmTunableOp_Half_TN,tn_4096_7809_4096,Gemm_Hipblaslt_TN_9815,0.443296
GemmTunableOp_Half_TN,tn_4096_2785_4096,Gemm_Rocblas_621294425,0.16752
GemmTunableOp_Half_TN,tn_4096_926_4096,Gemm_Hipblaslt_TN_9604,0.0680793
GemmTunableOp_Half_TN,tn_4096_1737_14336,Gemm_Hipblaslt_TN_9645,0.395251
GemmTunableOp_Half_TN,tn_8192_3400_8192,Gemm_Hipblaslt_TN_9697,0.753183
GemmTunableOp_Half_TN,tn_28672_1822_4096,Gemm_Hipblaslt_TN_9684,0.799441
GemmTunableOp_Half_TN,tn_10240_107_8192,Gemm_Rocblas_621286764,0.0590083
GemmTunableOp_Half_TN,tn_6144_924_4096,Gemm_Hipblaslt_TN_9613,0.0939295
GemmTunableOp_Half_TN,tn_4096_2722_14336,Gemm_Hipblaslt_TN_9799,0.569075
GemmTunableOp_Half_TN,tn_4096_992_14336,Gemm_Hipblaslt_TN_9586,0.247285
GemmTunableOp_Half_TN,tn_6144_1694_4096,Gemm_Rocblas_621286753,0.156308
GemmTunableOp_Half_TN,tn_4096_812_14336,Gemm_Hipblaslt_TN_9158,0.215017
GemmTunableOp_Half_TN,tn_6144_1794_4096,Gemm_Rocblas_621286576,0.166568
GemmTunableOp_Half_TN,tn_128256_230_4096,Gemm_Rocblas_621294634,0.598664
GemmTunableOp_Half_TN,tn_28672_920_4096,Gemm_Hipblaslt_TN_9677,0.394403
GemmTunableOp_Half_TN,tn_128256_218_4096,Gemm_Hipblaslt_TN_9937,0.576347
GemmTunableOp_Half_TN,tn_4096_958_14336,Gemm_Hipblaslt_TN_9634,0.234175
GemmTunableOp_Half_TN,tn_128256_206_4096,Gemm_Hipblaslt_TN_9919,0.566797
GemmTunableOp_Half_TN,tn_128256_42_4096,Gemm_Hipblaslt_TN_9451,0.331224
GemmTunableOp_Half_TN,tn_4096_925_14336,Gemm_Hipblaslt_TN_9634,0.232965
GemmTunableOp_Half_TN,tn_28672_3556_4096,Gemm_Hipblaslt_TN_9827,1.3822
GemmTunableOp_Half_TN,tn_128256_158_4096,Gemm_Hipblaslt_TN_9808,0.479382
GemmTunableOp_Half_TN,tn_4096_104_4096,Gemm_Rocblas_621286279,0.0170682
GemmTunableOp_Half_TN,tn_128256_69_4096,Gemm_Hipblaslt_TN_9057,0.37922
GemmTunableOp_Half_TN,tn_128256_27_4096,Gemm_Hipblaslt_TN_9094,0.317178
GemmTunableOp_Half_TN,tn_6144_805_4096,Gemm_Rocblas_621286778,0.0886864
GemmTunableOp_Half_TN,tn_28672_2606_4096,Gemm_Hipblaslt_TN_9827,1.08756
GemmTunableOp_Half_TN,tn_6144_152_4096,Gemm_Rocblas_621286443,0.0274917
GemmTunableOp_Half_TN,tn_128256_20_4096,Gemm_Hipblaslt_TN_9451,0.311643
GemmTunableOp_Half_TN,tn_4096_1881_4096,Gemm_Hipblaslt_TN_9645,0.122536
GemmTunableOp_Half_TN,tn_128256_97_4096,Gemm_Rocblas_621294762,0.415533
GemmTunableOp_Half_TN,tn_128256_183_4096,Gemm_Hipblaslt_TN_9752,0.520046
GemmTunableOp_Half_TN,tn_128256_11_4096,Gemm_Hipblaslt_TN_9405,0.289503
GemmTunableOp_Half_TN,tn_4096_853_14336,Gemm_Hipblaslt_TN_9580,0.221696
GemmTunableOp_Half_TN,tn_4096_893_14336,Gemm_Hipblaslt_TN_9580,0.221719
GemmTunableOp_Half_TN,tn_28672_1729_4096,Gemm_Hipblaslt_TN_9184,0.735988
GemmTunableOp_Half_TN,tn_57344_2479_8192,Default,4.38048
GemmTunableOp_Half_TN,tn_4096_882_4096,Gemm_Hipblaslt_TN_9583,0.0670439
GemmTunableOp_Half_TN,tn_8192_2166_8192,Gemm_Hipblaslt_TN_9742,0.512739
GemmTunableOp_Half_TN,tn_8192_1201_28672,Gemm_Hipblaslt_TN_9774,1.18535
GemmTunableOp_Half_TN,tn_57344_3235_8192,Gemm_Hipblaslt_TN_9818,5.57925
GemmTunableOp_Half_TN,tn_8192_3555_8192,Gemm_Hipblaslt_TN_9187,0.776831
GemmTunableOp_Half_TN,tn_4096_835_4096,Gemm_Hipblaslt_TN_9604,0.0644208
GemmTunableOp_Half_TN,tn_4096_832_4096,Gemm_Hipblaslt_TN_9170,0.0645684
GemmTunableOp_Half_TN,tn_4096_1775_14336,Gemm_Hipblaslt_TN_9645,0.394823
GemmTunableOp_Half_TN,tn_10240_1201_8192,Gemm_Hipblaslt_TN_9798,0.35051
GemmTunableOp_Half_TN,tn_28672_814_4096,Gemm_Hipblaslt_TN_9684,0.379305
GemmTunableOp_Half_TN,tn_4096_863_14336,Gemm_Hipblaslt_TN_9580,0.219459
GemmTunableOp_Half_TN,tn_6144_834_4096,Gemm_Rocblas_621286778,0.0879335
GemmTunableOp_Half_TN,tn_57344_125_8192,Gemm_Rocblas_621286477,0.347894
GemmTunableOp_Half_TN,tn_4096_3430_4096,Gemm_Hipblaslt_TN_9743,0.196506
GemmTunableOp_Half_TN,tn_57344_94_8192,Gemm_Rocblas_621294520,0.328555
GemmTunableOp_Half_TN,tn_8192_1361_28672,Gemm_Hipblaslt_TN_9799,1.27653
GemmTunableOp_Half_TN,tn_8192_123_28672,Gemm_Hipblaslt_TN_8378,0.206994
GemmTunableOp_Half_TN,tn_4096_937_14336,Gemm_Hipblaslt_TN_9634,0.232515
GemmTunableOp_Half_TN,tn_28672_866_4096,Gemm_Hipblaslt_TN_9684,0.387679
GemmTunableOp_Half_TN,tn_57344_25_8192,Gemm_Hipblaslt_TN_9429,0.248186
GemmTunableOp_Half_TN,tn_28672_2682_4096,Gemm_Hipblaslt_TN_9827,1.09946
GemmTunableOp_Half_TN,tn_8192_2015_8192,Gemm_Hipblaslt_TN_9815,0.435994
GemmTunableOp_Half_TN,tn_6144_1954_4096,Gemm_Hipblaslt_TN_9693,0.17777
GemmTunableOp_Half_TN,tn_4096_949_4096,Gemm_Hipblaslt_TN_9634,0.0668663
GemmTunableOp_Half_TN,tn_8192_3140_28672,Gemm_Hipblaslt_TN_9732,2.8805
GemmTunableOp_Half_TN,tn_6144_7967_4096,Gemm_Hipblaslt_TN_9704,0.671693
GemmTunableOp_Half_TN,tn_8192_119_8192,Gemm_Hipblaslt_TN_8891,0.0528615
GemmTunableOp_Half_TN,tn_57344_135_8192,Gemm_Hipblaslt_TN_9507,0.380014
GemmTunableOp_Half_TN,tn_57344_2914_8192,Gemm_Hipblaslt_TN_9818,5.01088
GemmTunableOp_Half_TN,tn_4096_914_14336,Gemm_Hipblaslt_TN_9634,0.230463
GemmTunableOp_Half_TN,tn_8192_4082_28672,Gemm_Rocblas_621286894,3.47905
GemmTunableOp_Half_TN,tn_4096_943_4096,Gemm_Hipblaslt_TN_9604,0.06928
GemmTunableOp_Half_TN,tn_8192_4035_8192,Gemm_Hipblaslt_TN_9813,0.887761
GemmTunableOp_Half_TN,tn_10240_121_8192,Gemm_Hipblaslt_TN_7157,0.0619221
GemmTunableOp_Half_TN,tn_8192_115_8192,Gemm_Hipblaslt_TN_8891,0.0530544
GemmTunableOp_Half_TN,tn_128256_121_4096,Gemm_Hipblaslt_TN_9769,0.43548
GemmTunableOp_Half_TN,tn_128256_29_4096,Gemm_Rocblas_621294578,0.315405
GemmTunableOp_Half_TN,tn_10240_112_8192,Gemm_Hipblaslt_TN_7543,0.0605208
GemmTunableOp_Half_TN,tn_57344_1121_8192,Gemm_Hipblaslt_TN_9774,2.08
GemmTunableOp_Half_TN,tn_57344_128_8192,Gemm_Hipblaslt_TN_9486,0.345326
GemmTunableOp_Half_TN,tn_6144_8070_4096,Gemm_Hipblaslt_TN_9753,0.681831
GemmTunableOp_Half_TN,tn_8192_16_28672,Gemm_Rocblas_621294224,0.119835
GemmTunableOp_Half_TN,tn_8192_3715_8192,Gemm_Hipblaslt_TN_9768,0.835843
GemmTunableOp_Half_TN,tn_4096_847_14336,Gemm_Hipblaslt_TN_9580,0.222634
GemmTunableOp_Half_TN,tn_4096_807_4096,Gemm_Hipblaslt_TN_9604,0.0636725
GemmTunableOp_Half_TN,tn_128256_35_4096,Gemm_Hipblaslt_TN_9451,0.328487
GemmTunableOp_Half_TN,tn_32000_14_8192,Gemm_Rocblas_621286319,0.140523
GemmTunableOp_Half_TN,tn_4096_1697_14336,Gemm_Hipblaslt_TN_9180,0.368516
GemmTunableOp_Half_TN,tn_6144_8049_4096,Gemm_Hipblaslt_TN_9655,0.675691
GemmTunableOp_Half_TN,tn_28672_1775_4096,Gemm_Hipblaslt_TN_9191,0.742068
GemmTunableOp_Half_TN,tn_8192_1265_8192,Gemm_Hipblaslt_TN_9209,0.301619
GemmTunableOp_Half_TN,tn_6144_1600_4096,Gemm_Rocblas_621294305,0.147462
GemmTunableOp_Half_TN,tn_4096_2599_14336,Gemm_Hipblaslt_TN_9657,0.546152
GemmTunableOp_Half_TN,tn_57344_9_8192,Gemm_Hipblaslt_TN_9429,0.239616
GemmTunableOp_Half_TN,tn_28672_1744_4096,Gemm_Hipblaslt_TN_9190,0.740076
GemmTunableOp_Half_TN,tn_32000_124_8192,Gemm_Hipblaslt_TN_9252,0.221216
GemmTunableOp_Half_TN,tn_4096_1727_4096,Gemm_Hipblaslt_TN_9164,0.108486
GemmTunableOp_Half_TN,tn_10240_4000_8192,Gemm_Hipblaslt_TN_9743,1.11335
GemmTunableOp_Half_TN,tn_4096_878_14336,Gemm_Hipblaslt_TN_9580,0.219708
GemmTunableOp_Half_TN,tn_8192_1268_8192,Gemm_Hipblaslt_TN_9691,0.304366
GemmTunableOp_Half_TN,tn_10240_1319_8192,Gemm_Hipblaslt_TN_9697,0.363351
GemmTunableOp_Half_TN,tn_4096_1815_14336,Gemm_Hipblaslt_TN_9620,0.408058
GemmTunableOp_Half_TN,tn_28672_929_4096,Gemm_Hipblaslt_TN_9684,0.394682
GemmTunableOp_Half_TN,tn_8192_3475_28672,Gemm_Hipblaslt_TN_9684,3.00226
GemmTunableOp_Half_TN,tn_6144_56_4096,Gemm_Rocblas_621286428,0.015673
GemmTunableOp_Half_TN,tn_6144_1724_4096,Gemm_Hipblaslt_TN_9672,0.156421
GemmTunableOp_Half_TN,tn_4096_1864_4096,Gemm_Hipblaslt_TN_9134,0.122098
GemmTunableOp_Half_TN,tn_57344_1367_8192,Gemm_Hipblaslt_TN_9830,2.5838
GemmTunableOp_Half_TN,tn_128256_169_4096,Gemm_Hipblaslt_TN_9683,0.513721
GemmTunableOp_Half_TN,tn_4096_8000_14336,Gemm_Hipblaslt_TN_9815,1.61588
GemmTunableOp_Half_TN,tn_4096_1746_14336,Gemm_Hipblaslt_TN_9645,0.39503
GemmTunableOp_Half_TN,tn_28672_1913_4096,Gemm_Hipblaslt_TN_9684,0.809629
GemmTunableOp_Half_TN,tn_10240_3331_8192,Gemm_Hipblaslt_TN_9815,0.895822
GemmTunableOp_Half_TN,tn_6144_2698_4096,Gemm_Hipblaslt_TN_9742,0.254469
GemmTunableOp_Half_TN,tn_10240_96_8192,Gemm_Hipblaslt_TN_8095,0.0537085
GemmTunableOp_Half_TN,tn_128256_104_4096,Gemm_Rocblas_621294762,0.419328
GemmTunableOp_Half_TN,tn_4096_2826_4096,Gemm_Rocblas_621294425,0.166637
GemmTunableOp_Half_TN,tn_10240_135_8192,Gemm_Hipblaslt_TN_7240,0.0679029
GemmTunableOp_Half_TN,tn_10240_1256_8192,Gemm_Hipblaslt_TN_9697,0.359583
GemmTunableOp_Half_TN,tn_6144_831_4096,Gemm_Rocblas_621294520,0.0880221
GemmTunableOp_Half_TN,tn_4096_96_14336,Gemm_Hipblaslt_TN_7511,0.0402345
GemmTunableOp_Half_TN,tn_4096_940_4096,Gemm_Hipblaslt_TN_9604,0.068431
GemmTunableOp_Half_TN,tn_32000_131_8192,Gemm_Hipblaslt_TN_9506,0.248304
GemmTunableOp_Half_TN,tn_28672_1748_4096,Gemm_Hipblaslt_TN_9190,0.739464
GemmTunableOp_Half_TN,tn_4096_120_14336,Gemm_Hipblaslt_TN_7534,0.0468399
GemmTunableOp_Half_TN,tn_57344_119_8192,Gemm_Hipblaslt_TN_9491,0.346031
GemmTunableOp_Half_TN,tn_6144_901_4096,Gemm_Hipblaslt_TN_9613,0.0936319
GemmTunableOp_Half_TN,tn_128256_198_4096,Gemm_Hipblaslt_TN_9738,0.564938
GemmTunableOp_Half_TN,tn_10240_3206_8192,Gemm_Hipblaslt_TN_9753,0.881246
GemmTunableOp_Half_TN,tn_8192_128_8192,Gemm_Hipblaslt_TN_8891,0.0527648
GemmTunableOp_Half_TN,tn_57344_2041_8192,Gemm_Hipblaslt_TN_9733,3.52968
GemmTunableOp_Half_TN,tn_8192_128_28672,Gemm_Hipblaslt_TN_8378,0.209361
GemmTunableOp_Half_TN,tn_10240_3425_8192,Gemm_Hipblaslt_TN_9182,0.999607
GemmTunableOp_Half_TN,tn_4096_790_14336,Gemm_Hipblaslt_TN_9147,0.212661
GemmTunableOp_Half_TN,tn_57344_1224_8192,Gemm_Hipblaslt_TN_9841,2.33665
GemmTunableOp_Half_TN,tn_4096_942_14336,Gemm_Hipblaslt_TN_9634,0.23248
GemmTunableOp_Half_TN,tn_128256_71_4096,Gemm_Hipblaslt_TN_9057,0.379494
GemmTunableOp_Half_TN,tn_4096_176_14336,Gemm_Hipblaslt_TN_7586,0.061286
GemmTunableOp_Half_TN,tn_8192_1297_8192,Gemm_Hipblaslt_TN_9209,0.315706
GemmTunableOp_Half_TN,tn_128256_249_4096,Gemm_Rocblas_621286892,0.607315
GemmTunableOp_Half_TN,tn_8192_114_28672,Gemm_Hipblaslt_TN_8378,0.198946
GemmTunableOp_Half_TN,tn_28672_2537_4096,Gemm_Hipblaslt_TN_9846,1.04077
GemmTunableOp_Half_TN,tn_128256_207_4096,Gemm_Hipblaslt_TN_9937,0.568654
GemmTunableOp_Half_TN,tn_8192_4091_8192,Gemm_Hipblaslt_TN_9813,0.893738
GemmTunableOp_Half_TN,tn_4096_1913_14336,Gemm_Hipblaslt_TN_9620,0.418411
GemmTunableOp_Half_TN,tn_57344_2664_8192,Gemm_Rocblas_621286731,4.65537
GemmTunableOp_Half_TN,tn_4096_1600_4096,Gemm_Hipblaslt_TN_9265,0.106477
GemmTunableOp_Half_TN,tn_4096_160_4096,Gemm_Rocblas_621286440,0.022443
GemmTunableOp_Half_TN,tn_8192_3603_28672,Gemm_Hipblaslt_TN_9732,3.05056
GemmTunableOp_Half_TN,tn_128256_62_4096,Gemm_Rocblas_621294557,0.361572
GemmTunableOp_Half_TN,tn_10240_2728_8192,Gemm_Hipblaslt_TN_9677,0.7672
GemmTunableOp_Half_TN,tn_57344_1265_8192,Gemm_Hipblaslt_TN_9841,2.36639
GemmTunableOp_Half_TN,tn_8192_117_28672,Gemm_Hipblaslt_TN_8378,0.203017
GemmTunableOp_Half_TN,tn_8192_16_8192,Gemm_Hipblaslt_TN_9392,0.0308008
GemmTunableOp_Half_TN,tn_4096_912_4096,Gemm_Hipblaslt_TN_9576,0.0692619
GemmTunableOp_Half_TN,tn_8192_3162_8192,Gemm_Hipblaslt_TN_9697,0.724904
GemmTunableOp_Half_TN,tn_4096_3599_4096,Gemm_Hipblaslt_TN_9743,0.202017
GemmTunableOp_Half_TN,tn_128256_242_4096,Gemm_Rocblas_621286892,0.611072
GemmTunableOp_Half_TN,tn_4096_2658_14336,Gemm_Hipblaslt_TN_9799,0.550736
GemmTunableOp_Half_TN,tn_10240_19_8192,Gemm_Hipblaslt_TN_9415,0.0392545
GemmTunableOp_Half_TN,tn_32000_97_8192,Gemm_Rocblas_621286475,0.209629
GemmTunableOp_Half_TN,tn_4096_80_4096,Gemm_Rocblas_621294029,0.015276
GemmTunableOp_Half_TN,tn_10240_3859_8192,Gemm_Hipblaslt_TN_9743,1.09211
GemmTunableOp_Half_TN,tn_4096_2602_14336,Gemm_Hipblaslt_TN_9657,0.544474
GemmTunableOp_Half_TN,tn_4096_3565_4096,Gemm_Hipblaslt_TN_9743,0.202388
GemmTunableOp_Half_TN,tn_57344_3411_8192,Gemm_Hipblaslt_TN_159,5.784
GemmTunableOp_Half_TN,tn_6144_1748_4096,Gemm_Hipblaslt_TN_9799,0.15953
GemmTunableOp_Half_TN,tn_128256_89_4096,Gemm_Hipblaslt_TN_9057,0.393118
GemmTunableOp_Half_TN,tn_128256_209_4096,Gemm_Hipblaslt_TN_9937,0.567755
GemmTunableOp_Half_TN,tn_57344_3555_8192,Gemm_Hipblaslt_TN_9922,5.91269
GemmTunableOp_Half_TN,tn_8192_1233_28672,Gemm_Hipblaslt_TN_9774,1.19525
GemmTunableOp_Half_TN,tn_8192_4063_28672,Gemm_Rocblas_621294648,3.46411
GemmTunableOp_Half_TN,tn_8192_3290_8192,Gemm_Hipblaslt_TN_9677,0.745733
GemmTunableOp_Half_TN,tn_8192_3369_8192,Gemm_Hipblaslt_TN_9677,0.744314
GemmTunableOp_Half_TN,tn_8192_3859_28672,Gemm_Rocblas_621294643,3.388
GemmTunableOp_Half_TN,tn_57344_93_8192,Gemm_Hipblaslt_TN_9322,0.3294
GemmTunableOp_Half_TN,tn_8192_102_8192,Gemm_Hipblaslt_TN_8891,0.0513337
GemmTunableOp_Half_TN,tn_28672_880_4096,Gemm_Hipblaslt_TN_9677,0.390531
GemmTunableOp_Half_TN,tn_10240_1185_8192,Gemm_Hipblaslt_TN_9798,0.348901
GemmTunableOp_Half_TN,tn_8192_1286_28672,Gemm_Hipblaslt_TN_9774,1.2044
GemmTunableOp_Half_TN,tn_8192_2692_28672,Gemm_Rocblas_621294308,2.51807
GemmTunableOp_Half_TN,tn_8192_99_8192,Gemm_Hipblaslt_TN_8891,0.0488555
GemmTunableOp_Half_TN,tn_8192_112_8192,Gemm_Hipblaslt_TN_8891,0.0516971
GemmTunableOp_Half_TN,tn_4096_1724_4096,Gemm_Hipblaslt_TN_9265,0.107946
GemmTunableOp_Half_TN,tn_4096_954_14336,Gemm_Hipblaslt_TN_9634,0.233809
GemmTunableOp_Half_TN,tn_57344_4025_8192,Gemm_Hipblaslt_TN_9758,6.64697
GemmTunableOp_Half_TN,tn_8192_1313_28672,Gemm_Hipblaslt_TN_9774,1.21814
GemmTunableOp_Half_TN,tn_28672_7798_4096,Gemm_Hipblaslt_TN_159,3.03794
GemmTunableOp_Half_TN,tn_8192_1286_8192,Gemm_Hipblaslt_TN_9211,0.31675
GemmTunableOp_Half_TN,tn_6144_1815_4096,Gemm_Hipblaslt_TN_9672,0.165215
GemmTunableOp_Half_TN,tn_6144_847_4096,Gemm_Rocblas_621294520,0.0879689
GemmTunableOp_Half_TN,tn_6144_916_4096,Gemm_Hipblaslt_TN_9613,0.0931588
GemmTunableOp_Half_TN,tn_6144_2721_4096,Gemm_Hipblaslt_TN_9763,0.254833
GemmTunableOp_Half_TN,tn_8192_1276_8192,Gemm_Hipblaslt_TN_9691,0.302014
GemmTunableOp_Half_TN,tn_8192_1104_8192,Gemm_Hipblaslt_TN_9229,0.263782
GemmTunableOp_Half_TN,tn_4096_2670_4096,Gemm_Hipblaslt_TN_9672,0.162061
GemmTunableOp_Half_TN,tn_4096_988_14336,Gemm_Hipblaslt_TN_9586,0.247679
GemmTunableOp_Half_TN,tn_10240_1367_8192,Gemm_Hipblaslt_TN_9193,0.400571
GemmTunableOp_Half_TN,tn_8192_2962_8192,Gemm_Rocblas_621286575,0.678389
GemmTunableOp_Half_TN,tn_57344_1271_8192,Gemm_Hipblaslt_TN_9068,2.36475
GemmTunableOp_Half_TN,tn_6144_208_4096,Gemm_Hipblaslt_TN_9494,0.032365
GemmTunableOp_Half_TN,tn_32000_16_8192,Gemm_Rocblas_621286319,0.139191
GemmTunableOp_Half_TN,tn_4096_136_4096,Gemm_Rocblas_621294168,0.0218197
GemmTunableOp_Half_TN,tn_10240_3290_8192,Gemm_Hipblaslt_TN_9813,0.893256
GemmTunableOp_Half_TN,tn_8192_3747_28672,Gemm_Rocblas_621294734,3.2706
GemmTunableOp_Half_TN,tn_6144_1783_4096,Gemm_Hipblaslt_TN_9691,0.164692
GemmTunableOp_Half_TN,tn_10240_127_8192,Gemm_Rocblas_621294504,0.0625313
GemmTunableOp_Half_TN,tn_6144_840_4096,Gemm_Rocblas_621286778,0.0890446
GemmTunableOp_Half_TN,tn_6144_957_4096,Gemm_Hipblaslt_TN_9613,0.0944198
GemmTunableOp_Half_TN,tn_4096_877_4096,Gemm_Hipblaslt_TN_9604,0.0671332
GemmTunableOp_Half_TN,tn_57344_130_8192,Gemm_Hipblaslt_TN_9507,0.379372
GemmTunableOp_Half_TN,tn_128256_196_4096,Gemm_Hipblaslt_TN_9847,0.564487
GemmTunableOp_Half_TN,tn_6144_816_4096,Gemm_Rocblas_621294520,0.0886338
GemmTunableOp_Half_TN,tn_57344_1153_8192,Gemm_Hipblaslt_TN_9068,2.29439
GemmTunableOp_Half_TN,tn_4096_930_4096,Gemm_Hipblaslt_TN_9604,0.0691959
GemmTunableOp_Half_TN,tn_57344_4090_8192,Gemm_Rocblas_621294636,6.71637
GemmTunableOp_Half_TN,tn_32000_5_8192,Gemm_Rocblas_621286321,0.137884
GemmTunableOp_Half_TN,tn_10240_3491_8192,Gemm_Hipblaslt_TN_9182,1.00289
GemmTunableOp_Half_TN,tn_28672_1726_4096,Gemm_Hipblaslt_TN_9191,0.736044
GemmTunableOp_Half_TN,tn_4096_2651_14336,Gemm_Hipblaslt_TN_9799,0.549506
GemmTunableOp_Half_TN,tn_128256_235_4096,Gemm_Rocblas_621286892,0.603414
GemmTunableOp_Half_TN,tn_8192_17_8192,Gemm_Hipblaslt_TN_9415,0.0323082
GemmTunableOp_Half_TN,tn_8192_14_8192,Gemm_Hipblaslt_TN_9392,0.0305837
GemmTunableOp_Half_TN,tn_8192_3451_8192,Gemm_Hipblaslt_TN_9697,0.756887
GemmTunableOp_Half_TN,tn_6144_920_4096,Gemm_Hipblaslt_TN_9613,0.0930201
GemmTunableOp_Half_TN,tn_10240_3451_8192,Gemm_Hipblaslt_TN_9209,1.00538
GemmTunableOp_Half_TN,tn_4096_2672_4096,Gemm_Hipblaslt_TN_9799,0.162607
GemmTunableOp_Half_TN,tn_4096_899_4096,Gemm_Hipblaslt_TN_9604,0.0682897
GemmTunableOp_Half_TN,tn_57344_3619_8192,Gemm_Hipblaslt_TN_9937,6.37142
GemmTunableOp_Half_TN,tn_28672_2717_4096,Gemm_Hipblaslt_TN_9827,1.16197
GemmTunableOp_Half_TN,tn_57344_3482_8192,Gemm_Hipblaslt_TN_159,5.85496
GemmTunableOp_Half_TN,tn_8192_108_8192,Gemm_Hipblaslt_TN_8891,0.0494024
GemmTunableOp_Half_TN,tn_8192_104_28672,Gemm_Hipblaslt_TN_8378,0.19929
GemmTunableOp_Half_TN,tn_4096_32_4096,Gemm_Rocblas_621286330,0.0116381
GemmTunableOp_Half_TN,tn_8192_3206_28672,Gemm_Hipblaslt_TN_9684,2.88797
GemmTunableOp_Half_TN,tn_10240_3546_8192,Gemm_Hipblaslt_TN_9744,1.02432
GemmTunableOp_Half_TN,tn_10240_115_8192,Gemm_Rocblas_621294504,0.0608555
GemmTunableOp_Half_TN,tn_4096_7266_4096,Gemm_Hipblaslt_TN_9677,0.41304
GemmTunableOp_Half_TN,tn_4096_2590_14336,Gemm_Hipblaslt_TN_9657,0.543243
GemmTunableOp_Half_TN,tn_6144_8154_4096,Gemm_Hipblaslt_TN_9704,0.68271
GemmTunableOp_Half_TN,tn_57344_91_8192,Gemm_Rocblas_621286778,0.328478
GemmTunableOp_Half_TN,tn_6144_1727_4096,Gemm_Rocblas_621286753,0.156232
GemmTunableOp_Half_TN,tn_32000_96_8192,Gemm_Hipblaslt_TN_9354,0.204431
GemmTunableOp_Half_TN,tn_57344_1280_8192,Default,2.3384
GemmTunableOp_Half_TN,tn_10240_3120_8192,Gemm_Hipblaslt_TN_9815,0.858112
GemmTunableOp_Half_TN,tn_57344_133_8192,Gemm_Hipblaslt_TN_9507,0.380385
GemmTunableOp_Half_TN,tn_128256_49_4096,Gemm_Hipblaslt_TN_9097,0.351791
GemmTunableOp_Half_TN,tn_8192_3642_28672,Gemm_Hipblaslt_TN_9732,3.03873
GemmTunableOp_Half_TN,tn_4096_3431_14336,Gemm_Hipblaslt_TN_9187,0.67295
GemmTunableOp_Half_TN,tn_4096_1744_4096,Gemm_Hipblaslt_TN_9645,0.115589
GemmTunableOp_Half_TN,tn_6144_3310_4096,Gemm_Hipblaslt_TN_9570,0.304257
GemmTunableOp_Half_TN,tn_6144_832_4096,Gemm_Rocblas_621294520,0.0883983
GemmTunableOp_Half_TN,tn_8192_1025_28672,Gemm_Hipblaslt_TN_9762,1.06058
GemmTunableOp_Half_TN,tn_28672_1701_4096,Gemm_Hipblaslt_TN_9217,0.731571
GemmTunableOp_Half_TN,tn_4096_948_14336,Gemm_Hipblaslt_TN_9608,0.234888
GemmTunableOp_Half_TN,tn_32000_127_8192,Gemm_Rocblas_621286475,0.222699
GemmTunableOp_Half_TN,tn_8192_1374_28672,Gemm_Hipblaslt_TN_9690,1.28025
GemmTunableOp_Half_TN,tn_10240_4025_8192,Gemm_Hipblaslt_TN_9743,1.131
GemmTunableOp_Half_TN,tn_8192_3153_28672,Gemm_Hipblaslt_TN_9732,2.85591
GemmTunableOp_Half_TN,tn_10240_1280_8192,Gemm_Hipblaslt_TN_9743,0.363268
GemmTunableOp_Half_TN,tn_8192_117_8192,Gemm_Hipblaslt_TN_8891,0.0522801
GemmTunableOp_Half_TN,tn_57344_117_8192,Default,0.344661
GemmTunableOp_Half_TN,tn_8192_126_8192,Gemm_Hipblaslt_TN_8891,0.0538241
GemmTunableOp_Half_TN,tn_8192_101_8192,Gemm_Hipblaslt_TN_8891,0.0486773
GemmTunableOp_Half_TN,tn_4096_112_14336,Gemm_Hipblaslt_TN_7534,0.0448672
GemmTunableOp_Half_TN,tn_28672_2708_4096,Gemm_Hipblaslt_TN_9841,1.17719
GemmTunableOp_Half_TN,tn_57344_3651_8192,Gemm_Hipblaslt_TN_9937,6.37434
GemmTunableOp_Half_TN,tn_8192_101_28672,Gemm_Hipblaslt_TN_8378,0.197272
GemmTunableOp_Half_TN,tn_57344_1361_8192,Gemm_Hipblaslt_TN_9830,2.56612
GemmTunableOp_Half_TN,tn_6144_947_4096,Gemm_Hipblaslt_TN_9163,0.0951517
GemmTunableOp_Half_TN,tn_4096_842_14336,Gemm_Hipblaslt_TN_9580,0.222636
GemmTunableOp_Half_TN,tn_8192_2622_8192,Gemm_Hipblaslt_TN_9774,0.618162
GemmTunableOp_Half_TN,tn_57344_97_8192,Gemm_Rocblas_621286477,0.33219
GemmTunableOp_Half_TN,tn_28672_1834_4096,Gemm_Hipblaslt_TN_9832,0.79783
GemmTunableOp_Half_TN,tn_28672_921_4096,Gemm_Hipblaslt_TN_9677,0.396914
GemmTunableOp_Half_TN,tn_4096_829_4096,Gemm_Hipblaslt_TN_9170,0.064031
GemmTunableOp_Half_TN,tn_32000_121_8192,Gemm_Rocblas_621294212,0.219229
GemmTunableOp_Half_TN,tn_4096_2698_14336,Gemm_Hipblaslt_TN_9799,0.555925
GemmTunableOp_Half_TN,tn_4096_848_4096,Gemm_Hipblaslt_TN_9634,0.0654262
GemmTunableOp_Half_TN,tn_57344_3785_8192,Gemm_Hipblaslt_TN_9937,6.47343
GemmTunableOp_Half_TN,tn_32000_22_8192,Gemm_Rocblas_621286350,0.147107
GemmTunableOp_Half_TN,tn_10240_22_8192,Gemm_Hipblaslt_TN_9415,0.0397263
GemmTunableOp_Half_TN,tn_4096_925_4096,Gemm_Hipblaslt_TN_9576,0.0682644
GemmTunableOp_Half_TN,tn_10240_2622_8192,Gemm_Hipblaslt_TN_9798,0.741318
GemmTunableOp_Half_TN,tn_10240_109_8192,Gemm_Rocblas_621294504,0.0606725
GemmTunableOp_Half_TN,tn_128256_173_4096,Gemm_Hipblaslt_TN_9931,0.514506
GemmTunableOp_Half_TN,tn_4096_2590_4096,Gemm_Hipblaslt_TN_9672,0.158284
GemmTunableOp_Half_TN,tn_4096_1853_4096,Gemm_Hipblaslt_TN_9645,0.119607
GemmTunableOp_Half_TN,tn_8192_21_28672,Gemm_Rocblas_621286354,0.131714
GemmTunableOp_Half_TN,tn_10240_3235_8192,Gemm_Hipblaslt_TN_9815,0.88039
GemmTunableOp_Half_TN,tn_32000_125_8192,Gemm_Rocblas_621286475,0.222792
GemmTunableOp_Half_TN,tn_8192_24_28672,Gemm_Rocblas_621286354,0.133641
GemmTunableOp_Half_TN,tn_128256_131_4096,Gemm_Hipblaslt_TN_9063,0.466521
GemmTunableOp_Half_TN,tn_8192_2479_28672,Gemm_Hipblaslt_TN_9775,2.38083
GemmTunableOp_Half_TN,tn_28672_144_4096,Gemm_Hipblaslt_TN_9370,0.0841877
GemmTunableOp_Half_TN,tn_4096_16_14336,Gemm_Rocblas_621286312,0.0244259
GemmTunableOp_Half_TN,tn_8192_1248_28672,Gemm_Hipblaslt_TN_9774,1.19685
GemmTunableOp_Half_TN,tn_8192_2549_8192,Gemm_Rocblas_621286580,0.608242
GemmTunableOp_Half_TN,tn_8192_2859_28672,Gemm_Hipblaslt_TN_9799,2.6294
GemmTunableOp_Half_TN,tn_128256_165_4096,Gemm_Hipblaslt_TN_9953,0.512131
GemmTunableOp_Half_TN,tn_32000_100_8192,Gemm_Rocblas_621286475,0.212512
GemmTunableOp_Half_TN,tn_4096_3447_4096,Gemm_Hipblaslt_TN_9187,0.197012
GemmTunableOp_Half_TN,tn_8192_1361_8192,Gemm_Rocblas_621286683,0.321952
GemmTunableOp_Half_TN,tn_4096_1783_4096,Gemm_Hipblaslt_TN_9645,0.117979
GemmTunableOp_Half_TN,tn_28672_1846_4096,Gemm_Hipblaslt_TN_9832,0.801183
GemmTunableOp_Half_TN,tn_28672_796_4096,Gemm_Hipblaslt_TN_9674,0.353519
GemmTunableOp_Half_TN,tn_8192_110_28672,Gemm_Hipblaslt_TN_8378,0.201132
GemmTunableOp_Half_TN,tn_8192_1168_8192,Gemm_Hipblaslt_TN_9691,0.294227
GemmTunableOp_Half_TN,tn_28672_794_4096,Gemm_Hipblaslt_TN_9691,0.35399
GemmTunableOp_Half_TN,tn_10240_123_8192,Gemm_Rocblas_621286764,0.0626225
GemmTunableOp_Half_TN,tn_6144_978_4096,Gemm_Rocblas_621294311,0.100845
GemmTunableOp_Half_TN,tn_8192_2166_28672,Gemm_Hipblaslt_TN_9763,2.06724
GemmTunableOp_Half_TN,tn_57344_1264_8192,Gemm_Hipblaslt_TN_9068,2.34667
GemmTunableOp_Half_TN,tn_8192_1367_8192,Gemm_Hipblaslt_TN_9799,0.323391
GemmTunableOp_Half_TN,tn_6144_956_4096,Gemm_Hipblaslt_TN_9615,0.0962101
GemmTunableOp_Half_TN,tn_10240_12_8192,Gemm_Hipblaslt_TN_9411,0.0372508
GemmTunableOp_Half_TN,tn_4096_799_4096,Gemm_Hipblaslt_TN_9634,0.0636174
GemmTunableOp_Half_TN,tn_4096_803_4096,Gemm_Hipblaslt_TN_9634,0.0639709
GemmTunableOp_Half_TN,tn_4096_951_4096,Gemm_Hipblaslt_TN_9604,0.0702142
GemmTunableOp_Half_TN,tn_10240_101_8192,Gemm_Rocblas_621286764,0.0588843
GemmTunableOp_Half_TN,tn_32000_11_8192,Gemm_Rocblas_621286319,0.138262
GemmTunableOp_Half_TN,tn_57344_1350_8192,Gemm_Hipblaslt_TN_9830,2.56846
GemmTunableOp_Half_TN,tn_57344_2551_8192,Default,4.39237
GemmTunableOp_Half_TN,tn_4096_1792_14336,Gemm_Hipblaslt_TN_9645,0.396878
GemmTunableOp_Half_TN,tn_10240_114_8192,Gemm_Rocblas_621294504,0.0609086
GemmTunableOp_Half_TN,tn_8192_1160_8192,Gemm_Hipblaslt_TN_9691,0.29478
GemmTunableOp_Half_TN,tn_8192_3411_8192,Gemm_Hipblaslt_TN_9187,0.754359
GemmTunableOp_Half_TN,tn_4096_918_14336,Gemm_Hipblaslt_TN_9634,0.232034
GemmTunableOp_Half_TN,tn_10240_108_8192,Gemm_Hipblaslt_TN_7543,0.0606096
GemmTunableOp_Half_TN,tn_4096_5606_14336,Gemm_Hipblaslt_TN_9657,1.18077
GemmTunableOp_Half_TN,tn_28672_859_4096,Gemm_Hipblaslt_TN_9684,0.384045
GemmTunableOp_Half_TN,tn_32000_93_8192,Gemm_Hipblaslt_TN_9251,0.203484
GemmTunableOp_Half_TN,tn_4096_803_14336,Gemm_Hipblaslt_TN_9158,0.212157
GemmTunableOp_Half_TN,tn_57344_3859_8192,Gemm_Rocblas_621294643,6.51402
GemmTunableOp_Half_TN,tn_8192_3754_8192,Gemm_Hipblaslt_TN_9815,0.83158
GemmTunableOp_Half_TN,tn_8192_23_28672,Gemm_Rocblas_621286354,0.129986
GemmTunableOp_Half_TN,tn_4096_882_14336,Gemm_Hipblaslt_TN_9580,0.222136
GemmTunableOp_Half_TN,tn_57344_3139_8192,Gemm_Hipblaslt_TN_9752,5.51648
GemmTunableOp_Half_TN,tn_28672_852_4096,Gemm_Hipblaslt_TN_9683,0.387197
GemmTunableOp_Half_TN,tn_10240_1121_8192,Gemm_Hipblaslt_TN_9697,0.327143
GemmTunableOp_Half_TN,tn_4096_986_4096,Gemm_Hipblaslt_TN_9604,0.0713722
GemmTunableOp_Half_TN,tn_6144_903_4096,Gemm_Hipblaslt_TN_9613,0.0924643
GemmTunableOp_Half_TN,tn_4096_7937_4096,Gemm_Hipblaslt_TN_9914,0.445817
GemmTunableOp_Half_TN,tn_4096_1805_14336,Gemm_Hipblaslt_TN_9645,0.408733
GemmTunableOp_Half_TN,tn_4096_1724_14336,Gemm_Hipblaslt_TN_9671,0.369855
GemmTunableOp_Half_TN,tn_6144_1905_4096,Gemm_Rocblas_621294447,0.167052
GemmTunableOp_Half_TN,tn_57344_120_8192,Gemm_Hipblaslt_TN_9636,0.346801
GemmTunableOp_Half_TN,tn_6144_3670_4096,Gemm_Hipblaslt_TN_9690,0.328286
GemmTunableOp_Half_TN,tn_10240_91_8192,Gemm_Hipblaslt_TN_8095,0.0529406
GemmTunableOp_Half_TN,tn_4096_929_4096,Gemm_Hipblaslt_TN_9576,0.0689569
GemmTunableOp_Half_TN,tn_28672_820_4096,Gemm_Hipblaslt_TN_9683,0.381561
GemmTunableOp_Half_TN,tn_4096_957_4096,Gemm_Hipblaslt_TN_9604,0.07005
GemmTunableOp_Half_TN,tn_4096_1846_14336,Gemm_Hipblaslt_TN_9137,0.414767
GemmTunableOp_Half_TN,tn_28672_878_4096,Gemm_Hipblaslt_TN_9684,0.390096
GemmTunableOp_Half_TN,tn_6144_4242_4096,Gemm_Hipblaslt_TN_9697,0.373953
GemmTunableOp_Half_TN,tn_4096_1718_4096,Gemm_Hipblaslt_TN_9607,0.10814
GemmTunableOp_Half_TN,tn_4096_868_14336,Gemm_Hipblaslt_TN_9580,0.220363
GemmTunableOp_Half_TN,tn_4096_1756_14336,Gemm_Hipblaslt_TN_9645,0.393717
GemmTunableOp_Half_TN,tn_4096_56_4096,Gemm_Rocblas_621286488,0.0128872
GemmTunableOp_Half_TN,tn_4096_1695_4096,Gemm_Hipblaslt_TN_9607,0.108046
GemmTunableOp_Half_TN,tn_4096_2509_14336,Gemm_Hipblaslt_TN_9657,0.528309
GemmTunableOp_Half_TN,tn_4096_2773_14336,Gemm_Hipblaslt_TN_9799,0.566447
GemmTunableOp_Half_TN,tn_4096_916_4096,Gemm_Hipblaslt_TN_9576,0.0688189
GemmTunableOp_Half_TN,tn_4096_3556_4096,Gemm_Hipblaslt_TN_9743,0.200278
GemmTunableOp_Half_TN,tn_57344_4083_8192,Gemm_Hipblaslt_TN_9882,6.67368
GemmTunableOp_Half_TN,tn_28672_1649_4096,Gemm_Rocblas_621294420,0.725986
GemmTunableOp_Half_TN,tn_28672_939_4096,Gemm_Hipblaslt_TN_9684,0.399508
GemmTunableOp_Half_TN,tn_4096_1803_14336,Gemm_Hipblaslt_TN_9680,0.409615
GemmTunableOp_Half_TN,tn_8192_120_8192,Gemm_Hipblaslt_TN_8891,0.0531736
GemmTunableOp_Half_TN,tn_4096_2762_14336,Gemm_Hipblaslt_TN_9799,0.566241
GemmTunableOp_Half_TN,tn_4096_8192_14336,Gemm_Hipblaslt_TN_9749,1.65445
GemmTunableOp_Half_TN,tn_28672_2653_4096,Gemm_Hipblaslt_TN_9827,1.1048
GemmTunableOp_Half_TN,tn_57344_103_8192,Gemm_Hipblaslt_TN_9486,0.335977
GemmTunableOp_Half_TN,tn_128256_98_4096,Gemm_Rocblas_621294762,0.416289
GemmTunableOp_Half_TN,tn_28672_978_4096,Gemm_Hipblaslt_TN_9716,0.437105
GemmTunableOp_Half_TN,tn_28672_7239_4096,Gemm_Hipblaslt_TN_159,2.89091
GemmTunableOp_Half_TN,tn_57344_3603_8192,Gemm_Hipblaslt_TN_9908,6.37061
GemmTunableOp_Half_TN,tn_4096_1775_4096,Gemm_Hipblaslt_TN_9267,0.116619
GemmTunableOp_Half_TN,tn_6144_923_4096,Gemm_Hipblaslt_TN_9613,0.0945066
GemmTunableOp_Half_TN,tn_57344_3120_8192,Gemm_Hipblaslt_TN_9816,5.50947
GemmTunableOp_Half_TN,tn_4096_136_14336,Gemm_Hipblaslt_TN_7219,0.0517299
GemmTunableOp_Half_TN,tn_4096_1719_4096,Gemm_Hipblaslt_TN_9265,0.107276
GemmTunableOp_Half_TN,tn_28672_829_4096,Gemm_Hipblaslt_TN_9684,0.381833
GemmTunableOp_Half_TN,tn_4096_1757_14336,Gemm_Hipblaslt_TN_9645,0.394232
GemmTunableOp_Half_TN,tn_128256_65_4096,Gemm_Hipblaslt_TN_9057,0.3708
GemmTunableOp_Half_TN,tn_4096_2606_4096,Gemm_Hipblaslt_TN_9674,0.161665
GemmTunableOp_Half_TN,tn_4096_863_4096,Gemm_Hipblaslt_TN_9604,0.0660998
GemmTunableOp_Half_TN,tn_6144_2762_4096,Gemm_Hipblaslt_TN_9742,0.255636
GemmTunableOp_Half_TN,tn_57344_1377_8192,Gemm_Hipblaslt_TN_9830,2.58612
GemmTunableOp_Half_TN,tn_6144_80_4096,Gemm_Rocblas_621286280,0.0183289
GemmTunableOp_Half_TN,tn_28672_1850_4096,Gemm_Hipblaslt_TN_9832,0.799084
GemmTunableOp_Half_TN,tn_10240_3369_8192,Gemm_Hipblaslt_TN_9209,0.994714
GemmTunableOp_Half_TN,tn_8192_12_28672,Gemm_Rocblas_621294224,0.1213
GemmTunableOp_Half_TN,tn_4096_982_4096,Gemm_Hipblaslt_TN_9589,0.0717664
GemmTunableOp_Half_TN,tn_6144_2635_4096,Gemm_Hipblaslt_TN_9768,0.220842
GemmTunableOp_Half_TN,tn_6144_968_4096,Gemm_Hipblaslt_TN_9266,0.100747
GemmTunableOp_Half_TN,tn_4096_823_4096,Gemm_Hipblaslt_TN_9634,0.064126
GemmTunableOp_Half_TN,tn_28672_1813_4096,Gemm_Hipblaslt_TN_9684,0.801063
GemmTunableOp_Half_TN,tn_4096_927_4096,Gemm_Hipblaslt_TN_9634,0.0684315
GemmTunableOp_Half_TN,tn_128256_189_4096,Gemm_Hipblaslt_TN_9816,0.522983
GemmTunableOp_Half_TN,tn_28672_88_4096,Gemm_Rocblas_621286719,0.0578772
GemmTunableOp_Half_TN,tn_4096_890_4096,Gemm_Hipblaslt_TN_9634,0.0665387
GemmTunableOp_Half_TN,tn_6144_2653_4096,Gemm_Hipblaslt_TN_9827,0.222125
GemmTunableOp_Half_TN,tn_4096_1666_4096,Gemm_Hipblaslt_TN_9607,0.107609
GemmTunableOp_Half_TN,tn_6144_1854_4096,Gemm_Rocblas_621294425,0.166118
GemmTunableOp_Half_TN,tn_28672_2675_4096,Gemm_Hipblaslt_TN_9827,1.0939
GemmTunableOp_Half_TN,tn_6144_216_4096,Gemm_Hipblaslt_TN_9494,0.0347515
GemmTunableOp_Half_TN,tn_28672_861_4096,Gemm_Hipblaslt_TN_9684,0.389934
GemmTunableOp_Half_TN,tn_6144_803_4096,Gemm_Rocblas_621286778,0.0875417
GemmTunableOp_Half_TN,tn_6144_891_4096,Gemm_Hipblaslt_TN_9253,0.0927783
GemmTunableOp_Half_TN,tn_4096_1778_14336,Gemm_Hipblaslt_TN_9645,0.396047
GemmTunableOp_Half_TN,tn_4096_932_4096,Gemm_Hipblaslt_TN_9634,0.0690109
GemmTunableOp_Half_TN,tn_4096_876_14336,Gemm_Hipblaslt_TN_9580,0.219689
GemmTunableOp_Half_TN,tn_4096_1763_4096,Gemm_Hipblaslt_TN_9134,0.117593
GemmTunableOp_Half_TN,tn_4096_1755_14336,Gemm_Hipblaslt_TN_9645,0.395434
GemmTunableOp_Half_TN,tn_4096_3479_14336,Gemm_Hipblaslt_TN_9814,0.683855
GemmTunableOp_Half_TN,tn_4096_889_14336,Gemm_Hipblaslt_TN_9580,0.221253
GemmTunableOp_Half_TN,tn_28672_64_4096,Gemm_Rocblas_621294374,0.048238
GemmTunableOp_Half_TN,tn_4096_785_4096,Gemm_Hipblaslt_TN_9634,0.0642215
GemmTunableOp_Half_TN,tn_6144_7857_4096,Gemm_Hipblaslt_TN_9713,0.66718
GemmTunableOp_Half_TN,tn_4096_817_14336,Gemm_Hipblaslt_TN_9147,0.215178
GemmTunableOp_Half_TN,tn_128256_112_4096,Gemm_Hipblaslt_TN_9061,0.427211
GemmTunableOp_Half_TN,tn_6144_8110_4096,Gemm_Hipblaslt_TN_9768,0.682751
GemmTunableOp_Half_TN,tn_4096_2606_14336,Gemm_Hipblaslt_TN_9799,0.54594
GemmTunableOp_Half_TN,tn_28672_946_4096,Gemm_Hipblaslt_TN_9684,0.4044
GemmTunableOp_Half_TN,tn_28672_966_4096,Gemm_Hipblaslt_TN_9666,0.43428
GemmTunableOp_Half_TN,tn_4096_1805_4096,Gemm_Hipblaslt_TN_9645,0.11967
GemmTunableOp_Half_TN,tn_4096_978_14336,Gemm_Hipblaslt_TN_9632,0.244587
GemmTunableOp_Half_TN,tn_28672_927_4096,Gemm_Hipblaslt_TN_9684,0.398477
GemmTunableOp_Half_TN,tn_4096_1841_4096,Gemm_Hipblaslt_TN_9645,0.120066
GemmTunableOp_Half_TN,tn_4096_2805_4096,Gemm_Rocblas_621294425,0.168841
GemmTunableOp_Half_TN,tn_6144_3711_4096,Gemm_Hipblaslt_TN_9690,0.337085
GemmTunableOp_Half_TN,tn_28672_1785_4096,Gemm_Hipblaslt_TN_9191,0.747495
GemmTunableOp_Half_TN,tn_28672_8070_4096,Gemm_Hipblaslt_TN_9827,3.30467
GemmTunableOp_Half_TN,tn_4096_815_14336,Gemm_Hipblaslt_TN_9147,0.216524
GemmTunableOp_Half_TN,tn_128256_250_4096,Gemm_Rocblas_621286892,0.611016
GemmTunableOp_Half_TN,tn_6144_844_4096,Gemm_Rocblas_621294520,0.0894344
GemmTunableOp_Half_TN,tn_4096_865_4096,Gemm_Hipblaslt_TN_9604,0.066479
GemmTunableOp_Half_TN,tn_6144_1828_4096,Gemm_Hipblaslt_TN_9691,0.166933
GemmTunableOp_Half_TN,tn_128256_144_4096,Gemm_Hipblaslt_TN_9108,0.473254
GemmTunableOp_Half_TN,tn_6144_3418_4096,Gemm_Rocblas_621286753,0.311364
GemmTunableOp_Half_TN,tn_4096_935_4096,Gemm_Hipblaslt_TN_9634,0.0692879
GemmTunableOp_Half_TN,tn_4096_8007_14336,Gemm_Hipblaslt_TN_9815,1.62395
GemmTunableOp_Half_TN,tn_6144_7992_4096,Gemm_Hipblaslt_TN_9815,0.673678
GemmTunableOp_Half_TN,tn_4096_2763_4096,Gemm_Hipblaslt_TN_9799,0.166398
GemmTunableOp_Half_TN,tn_4096_8154_14336,Gemm_Hipblaslt_TN_9753,1.65725
GemmTunableOp_Half_TN,tn_28672_2763_4096,Gemm_Rocblas_621294484,1.1916
GemmTunableOp_Half_TN,tn_28672_1700_4096,Gemm_Rocblas_621294420,0.733805
GemmTunableOp_Half_TN,tn_4096_865_14336,Gemm_Hipblaslt_TN_9580,0.219032
GemmTunableOp_Half_TN,tn_6144_16_4096,Gemm_Rocblas_621286273,0.0130466
GemmTunableOp_Half_TN,tn_4096_1715_4096,Gemm_Hipblaslt_TN_9265,0.108663
GemmTunableOp_Half_TN,tn_4096_820_4096,Gemm_Hipblaslt_TN_9604,0.0645237
GemmTunableOp_Half_TN,tn_128256_8_4096,Gemm_Rocblas_621294224,0.287643
GemmTunableOp_Half_TN,tn_4096_7953_4096,Gemm_Hipblaslt_TN_9933,0.44984
GemmTunableOp_Half_TN,tn_128256_204_4096,Gemm_Hipblaslt_TN_9847,0.567383
GemmTunableOp_Half_TN,tn_6144_814_4096,Gemm_Rocblas_621294520,0.088134
GemmTunableOp_Half_TN,tn_28672_1864_4096,Gemm_Hipblaslt_TN_9683,0.801285
GemmTunableOp_Half_TN,tn_128256_44_4096,Gemm_Hipblaslt_TN_9451,0.336183
GemmTunableOp_Half_TN,tn_4096_96_4096,Gemm_Rocblas_621286279,0.0154831
GemmTunableOp_Half_TN,tn_6144_1792_4096,Gemm_Hipblaslt_TN_9691,0.164672
GemmTunableOp_Half_TN,tn_6144_935_4096,Gemm_Hipblaslt_TN_9613,0.0944343
GemmTunableOp_Half_TN,tn_6144_8_4096,Gemm_Rocblas_621286311,0.0130426
GemmTunableOp_Half_TN,tn_6144_964_4096,Gemm_Hipblaslt_TN_9633,0.102009
GemmTunableOp_Half_TN,tn_128256_139_4096,Gemm_Hipblaslt_TN_9108,0.4713
GemmTunableOp_Half_TN,tn_4096_1729_4096,Gemm_Hipblaslt_TN_9680,0.115475
GemmTunableOp_Half_TN,tn_6144_898_4096,Gemm_Hipblaslt_TN_9613,0.0931427
GemmTunableOp_Half_TN,tn_4096_3352_4096,Gemm_Hipblaslt_TN_9743,0.19398
GemmTunableOp_Half_TN,tn_4096_1723_4096,Gemm_Hipblaslt_TN_9671,0.107306
GemmTunableOp_Half_TN,tn_28672_136_4096,Gemm_Hipblaslt_TN_9370,0.0853896
GemmTunableOp_Half_TN,tn_32000_126_8192,Gemm_Rocblas_621286475,0.220469
GemmTunableOp_Half_TN,tn_6144_2826_4096,Gemm_Hipblaslt_TN_9567,0.260881
GemmTunableOp_Half_TN,tn_6144_934_4096,Gemm_Hipblaslt_TN_9613,0.0941106
GemmTunableOp_Half_TN,tn_10240_7_8192,Gemm_Rocblas_621286314,0.0369728
GemmTunableOp_Half_TN,tn_6144_937_4096,Gemm_Hipblaslt_TN_9613,0.094502
GemmTunableOp_Half_TN,tn_8192_1000_28672,Gemm_Hipblaslt_TN_9638,1.04212
GemmTunableOp_Half_TN,tn_28672_3479_4096,Gemm_Hipblaslt_TN_159,1.40781
GemmTunableOp_Half_TN,tn_4096_128_14336,Gemm_Hipblaslt_TN_7534,0.0462261
GemmTunableOp_Half_TN,tn_28672_968_4096,Gemm_Hipblaslt_TN_9863,0.437182
GemmTunableOp_Half_TN,tn_4096_192_4096,Gemm_Rocblas_621286491,0.0228204
GemmTunableOp_Half_TN,tn_10240_24_8192,Gemm_Hipblaslt_TN_9415,0.0401826
GemmTunableOp_Half_TN,tn_28672_1837_4096,Gemm_Hipblaslt_TN_9684,0.79608
GemmTunableOp_Half_TN,tn_4096_7944_14336,Gemm_Hipblaslt_TN_9815,1.61505
GemmTunableOp_Half_TN,tn_10240_3162_8192,Gemm_Hipblaslt_TN_9815,0.881396
GemmTunableOp_Half_TN,tn_28672_2599_4096,Gemm_Hipblaslt_TN_9827,1.0842
GemmTunableOp_Half_TN,tn_128256_213_4096,Gemm_Hipblaslt_TN_9937,0.572979
GemmTunableOp_Half_TN,tn_4096_834_14336,Gemm_Hipblaslt_TN_9178,0.223213
GemmTunableOp_Half_TN,tn_57344_1276_8192,Gemm_Hipblaslt_TN_9068,2.36569
GemmTunableOp_Half_TN,tn_4096_2635_4096,Gemm_Hipblaslt_TN_9799,0.160464
GemmTunableOp_Half_TN,tn_4096_1705_14336,Gemm_Hipblaslt_TN_9790,0.369897
GemmTunableOp_Half_TN,tn_6144_72_4096,Gemm_Rocblas_621294029,0.0185224
GemmTunableOp_Half_TN,tn_6144_64_4096,Gemm_Rocblas_621286428,0.0157851
GemmTunableOp_Half_TN,tn_4096_112_4096,Gemm_Rocblas_621294164,0.0172926
GemmTunableOp_Half_TN,tn_4096_3310_14336,Gemm_Hipblaslt_TN_9677,0.659922
GemmTunableOp_Half_TN,tn_4096_7823_4096,Gemm_Hipblaslt_TN_9914,0.441332
GemmTunableOp_Half_TN,tn_4096_8_4096,Gemm_Rocblas_621294130,0.00998528
GemmTunableOp_Half_TN,tn_4096_1739_14336,Gemm_Hipblaslt_TN_9645,0.394281
GemmTunableOp_Half_TN,tn_57344_24_8192,Gemm_Hipblaslt_TN_9429,0.248898
GemmTunableOp_Half_TN,tn_4096_908_4096,Gemm_Hipblaslt_TN_9634,0.0679148
GemmTunableOp_Half_TN,tn_6144_7283_4096,Gemm_Hipblaslt_TN_9677,0.609495
GemmTunableOp_Half_TN,tn_8192_1121_28672,Gemm_Hipblaslt_TN_9774,1.11196
GemmTunableOp_Half_TN,tn_6144_136_4096,Gemm_Rocblas_621286443,0.0264738
GemmTunableOp_Half_TN,tn_4096_954_4096,Gemm_Hipblaslt_TN_9576,0.0703432
GemmTunableOp_Half_TN,tn_4096_7804_4096,Gemm_Hipblaslt_TN_9815,0.44215
GemmTunableOp_Half_TN,tn_10240_2914_8192,Gemm_Hipblaslt_TN_9813,0.836543
GemmTunableOp_Half_TN,tn_4096_32_14336,Gemm_Hipblaslt_TN_9388,0.0277573
GemmTunableOp_Half_TN,tn_4096_8000_4096,Gemm_Hipblaslt_TN_9190,0.45122
GemmTunableOp_Half_TN,tn_28672_3447_4096,Gemm_Hipblaslt_TN_9827,1.36617
GemmTunableOp_Half_TN,tn_4096_7863_14336,Gemm_Hipblaslt_TN_9753,1.61476
GemmTunableOp_Half_TN,tn_6144_3402_4096,Gemm_Hipblaslt_TN_9570,0.306855
GemmTunableOp_Half_TN,tn_57344_2639_8192,Gemm_Rocblas_621286725,4.64548
GemmTunableOp_Half_TN,tn_4096_2636_14336,Gemm_Hipblaslt_TN_9657,0.54611
GemmTunableOp_Half_TN,tn_8192_2000_8192,Gemm_Hipblaslt_TN_9190,0.43284
GemmTunableOp_Half_TN,tn_28672_72_4096,Gemm_Rocblas_621294461,0.0549574
GemmTunableOp_Half_TN,tn_4096_2750_4096,Gemm_Hipblaslt_TN_9787,0.167744
GemmTunableOp_Half_TN,tn_4096_48_4096,Gemm_Rocblas_621286426,0.0127318
GemmTunableOp_Half_TN,tn_4096_8054_14336,Gemm_Hipblaslt_TN_9713,1.6306
GemmTunableOp_Half_TN,tn_28672_913_4096,Gemm_Hipblaslt_TN_9683,0.393113
GemmTunableOp_Half_TN,tn_28672_8154_4096,Gemm_Hipblaslt_TN_9827,3.33637
GemmTunableOp_Half_TN,tn_4096_3670_4096,Gemm_Hipblaslt_TN_9841,0.2122
GemmTunableOp_Half_TN,tn_6144_938_4096,Gemm_Hipblaslt_TN_9613,0.0941202
GemmTunableOp_Half_TN,tn_4096_1777_4096,Gemm_Hipblaslt_TN_9645,0.118806
GemmTunableOp_Half_TN,tn_4096_1848_4096,Gemm_Hipblaslt_TN_9645,0.122002
GemmTunableOp_Half_TN,tn_28672_1727_4096,Gemm_Hipblaslt_TN_9217,0.739473
GemmTunableOp_Half_TN,tn_4096_1803_4096,Gemm_Hipblaslt_TN_9645,0.120129
GemmTunableOp_Half_TN,tn_28672_872_4096,Gemm_Hipblaslt_TN_9684,0.389828
GemmTunableOp_Half_TN,tn_6144_40_4096,Gemm_Rocblas_621286426,0.0151876
GemmTunableOp_Half_TN,tn_4096_1743_4096,Gemm_Hipblaslt_TN_9680,0.117038
GemmTunableOp_Half_TN,tn_28672_7992_4096,Gemm_Hipblaslt_TN_159,3.20644
GemmTunableOp_Half_TN,tn_4096_7857_14336,Gemm_Hipblaslt_TN_9749,1.61303
GemmTunableOp_Half_TN,tn_6144_954_4096,Gemm_Hipblaslt_TN_9613,0.094653
GemmTunableOp_Half_TN,tn_28672_16_4096,Gemm_Rocblas_621294053,0.0446713
GemmTunableOp_Half_TN,tn_28672_3402_4096,Gemm_Hipblaslt_TN_9827,1.3625
GemmTunableOp_Half_TN,tn_4096_915_4096,Gemm_Hipblaslt_TN_9576,0.0690084
GemmTunableOp_Half_TN,tn_10240_4083_8192,Gemm_Hipblaslt_TN_9743,1.13534
GemmTunableOp_Half_TN,tn_4096_900_4096,Gemm_Hipblaslt_TN_9604,0.069038
GemmTunableOp_Half_TN,tn_4096_802_4096,Gemm_Hipblaslt_TN_9634,0.0638988
GemmTunableOp_Half_TN,tn_128256_215_4096,Gemm_Hipblaslt_TN_9847,0.572504
GemmTunableOp_Half_TN,tn_4096_1673_4096,Gemm_Hipblaslt_TN_9164,0.105274
GemmTunableOp_Half_TN,tn_28672_40_4096,Gemm_Hipblaslt_TN_9532,0.0487234
GemmTunableOp_Half_TN,tn_6144_912_4096,Gemm_Hipblaslt_TN_9613,0.0934515
GemmTunableOp_Half_TN,tn_28672_1805_4096,Gemm_Hipblaslt_TN_9684,0.793238
GemmTunableOp_Half_TN,tn_4096_943_14336,Gemm_Hipblaslt_TN_9634,0.233726
GemmTunableOp_Half_TN,tn_4096_88_14336,Gemm_Hipblaslt_TN_9294,0.03964
GemmTunableOp_Half_TN,tn_28672_842_4096,Gemm_Hipblaslt_TN_9684,0.388646
GemmTunableOp_Half_TN,tn_4096_918_4096,Gemm_Hipblaslt_TN_9604,0.0693998
GemmTunableOp_Half_TN,tn_4096_1742_14336,Gemm_Hipblaslt_TN_9645,0.394102
GemmTunableOp_Half_TN,tn_4096_1794_4096,Gemm_Hipblaslt_TN_9645,0.119223
GemmTunableOp_Half_TN,tn_28672_947_4096,Gemm_Hipblaslt_TN_9683,0.403892
GemmTunableOp_Half_TN,tn_4096_1768_4096,Gemm_Hipblaslt_TN_9645,0.117606
GemmTunableOp_Half_TN,tn_4096_936_4096,Gemm_Hipblaslt_TN_9604,0.0702242
GemmTunableOp_Half_TN,tn_4096_961_4096,Gemm_Hipblaslt_TN_9604,0.0699238
GemmTunableOp_Half_TN,tn_4096_832_14336,Gemm_Hipblaslt_TN_9131,0.220699
GemmTunableOp_Half_TN,tn_4096_894_14336,Gemm_Hipblaslt_TN_9580,0.22293
GemmTunableOp_Half_TN,tn_128256_54_4096,Gemm_Rocblas_621294554,0.355354
GemmTunableOp_Half_TN,tn_28672_894_4096,Gemm_Hipblaslt_TN_9684,0.394295
GemmTunableOp_Half_TN,tn_6144_1806_4096,Gemm_Rocblas_621286576,0.165202
GemmTunableOp_Half_TN,tn_28672_907_4096,Gemm_Hipblaslt_TN_9684,0.395649
GemmTunableOp_Half_TN,tn_8192_122_8192,Gemm_Hipblaslt_TN_8891,0.0530498
GemmTunableOp_Half_TN,tn_4096_968_14336,Gemm_Hipblaslt_TN_9632,0.243235
GemmTunableOp_Half_TN,tn_128256_81_4096,Gemm_Hipblaslt_TN_9057,0.384132
GemmTunableOp_Half_TN,tn_6144_885_4096,Gemm_Hipblaslt_TN_9613,0.092237
GemmTunableOp_Half_TN,tn_4096_850_4096,Gemm_Hipblaslt_TN_9170,0.0656626
GemmTunableOp_Half_TN,tn_4096_977_4096,Gemm_Hipblaslt_TN_9589,0.0720916
GemmTunableOp_Half_TN,tn_8192_127_28672,Gemm_Hipblaslt_TN_8378,0.208555
GemmTunableOp_Half_TN,tn_28672_882_4096,Gemm_Hipblaslt_TN_9684,0.387008
GemmStridedBatchedTunableOp_Half_TN,tn_914_914_128_B_32,Gemm_Hipblaslt_TN_7519,0.0494433
GemmStridedBatchedTunableOp_Half_TN,tn_857_857_128_B_32,Gemm_Hipblaslt_TN_7483,0.0439428
GemmStridedBatchedTunableOp_Half_TN,tn_864_864_128_B_32,Gemm_Hipblaslt_TN_150,0.0375417
GemmStridedBatchedTunableOp_Half_TN,tn_971_971_128_B_32,Gemm_Rocblas_621286809,0.0516456
GemmStridedBatchedTunableOp_Half_TN,tn_798_798_128_B_32,Gemm_Rocblas_621294635,0.0386377
GemmStridedBatchedTunableOp_Half_TN,tn_854_854_128_B_32,Gemm_Rocblas_621294635,0.043182
GemmStridedBatchedTunableOp_Half_TN,tn_813_813_128_B_32,Gemm_Rocblas_621294635,0.041709
GemmStridedBatchedTunableOp_Half_TN,tn_912_912_128_B_32,Gemm_Rocblas_621293994,0.0451747
GemmStridedBatchedTunableOp_Half_TN,tn_802_802_128_B_32,Gemm_Rocblas_621294635,0.0398266
GemmStridedBatchedTunableOp_Half_TN,tn_984_984_128_B_32,Gemm_Hipblaslt_TN_153,0.0483655
GemmStridedBatchedTunableOp_Half_TN,tn_1013_1013_128_B_64,Gemm_Hipblaslt_TN_6879,0.0991913
GemmStridedBatchedTunableOp_Half_TN,tn_919_919_128_B_32,Gemm_Rocblas_621294635,0.0503006
GemmStridedBatchedTunableOp_Half_TN,tn_985_985_128_B_32,Gemm_Hipblaslt_TN_7483,0.0524008
GemmStridedBatchedTunableOp_Half_TN,tn_1377_1377_128_B_64,Gemm_Rocblas_621294109,0.164342
GemmStridedBatchedTunableOp_Half_TN,tn_954_954_128_B_32,Gemm_Hipblaslt_TN_7519,0.0506316
GemmStridedBatchedTunableOp_Half_TN,tn_1393_1393_128_B_64,Gemm_Rocblas_621294109,0.168127
GemmStridedBatchedTunableOp_Half_TN,tn_1105_1105_128_B_64,Gemm_Hipblaslt_TN_6879,0.112449
GemmStridedBatchedTunableOp_Half_TN,tn_1374_1374_128_B_64,Gemm_Rocblas_621286412,0.161481
GemmStridedBatchedTunableOp_Half_TN,tn_1313_1313_128_B_64,Gemm_Rocblas_621286412,0.153443
GemmStridedBatchedTunableOp_Half_TN,tn_1121_1121_128_B_64,Gemm_Hipblaslt_TN_6879,0.114688
GemmStridedBatchedTunableOp_Half_TN,tn_1152_1152_128_B_64,Gemm_Rocblas_621294530,0.099273
GemmStridedBatchedTunableOp_Half_TN,tn_805_805_128_B_32,Gemm_Rocblas_621294635,0.040898
GemmStridedBatchedTunableOp_Half_TN,tn_1263_1263_128_B_64,Gemm_Hipblaslt_TN_6879,0.142761
GemmStridedBatchedTunableOp_Half_TN,tn_896_896_128_B_32,Gemm_Hipblaslt_TN_9598,0.0357384
GemmStridedBatchedTunableOp_Half_TN,tn_1318_1318_128_B_64,Gemm_Rocblas_621294109,0.152861
GemmStridedBatchedTunableOp_Half_TN,tn_829_829_128_B_32,Gemm_Rocblas_621294635,0.040852
GemmStridedBatchedTunableOp_Half_TN,tn_1391_1391_128_B_64,Gemm_Rocblas_621294106,0.1701
GemmStridedBatchedTunableOp_Half_TN,tn_876_876_128_B_32,Gemm_Rocblas_621294529,0.045679
GemmStridedBatchedTunableOp_Half_TN,tn_929_929_128_B_32,Gemm_Hipblaslt_TN_7519,0.0514548
GemmStridedBatchedTunableOp_Half_TN,tn_982_982_128_B_32,Gemm_Rocblas_621286809,0.050957
GemmStridedBatchedTunableOp_Half_TN,tn_1389_1389_128_B_64,Gemm_Rocblas_621286412,0.16797
GemmStridedBatchedTunableOp_Half_TN,tn_852_852_128_B_32,Gemm_Rocblas_621286396,0.0440814
GemmStridedBatchedTunableOp_Half_TN,tn_785_785_128_B_32,Gemm_Rocblas_621294551,0.0403482
GemmStridedBatchedTunableOp_Half_TN,tn_926_926_128_B_32,Gemm_Hipblaslt_TN_6879,0.0498281
GemmStridedBatchedTunableOp_Half_TN,tn_1057_1057_128_B_64,Gemm_Hipblaslt_TN_6879,0.106352
GemmStridedBatchedTunableOp_Half_TN,tn_856_856_128_B_32,Gemm_Hipblaslt_TN_150,0.0385944
GemmStridedBatchedTunableOp_Half_TN,tn_1341_1341_128_B_64,Gemm_Rocblas_621294109,0.158534
GemmStridedBatchedTunableOp_Half_TN,tn_799_799_128_B_32,Gemm_Rocblas_621294635,0.03915
GemmStridedBatchedTunableOp_Half_TN,tn_916_916_128_B_32,Gemm_Rocblas_621294635,0.0479223
GemmStridedBatchedTunableOp_Half_TN,tn_797_797_128_B_32,Gemm_Rocblas_621294635,0.040314
GemmStridedBatchedTunableOp_Half_TN,tn_1361_1361_128_B_64,Gemm_Rocblas_621286412,0.163405
GemmStridedBatchedTunableOp_Half_TN,tn_851_851_128_B_32,Gemm_Hipblaslt_TN_7483,0.0438054
GemmStridedBatchedTunableOp_Half_TN,tn_827_827_128_B_32,Gemm_Rocblas_621294635,0.0422437
GemmStridedBatchedTunableOp_Half_TN,tn_1287_1287_128_B_64,Gemm_Rocblas_621286412,0.149053
GemmStridedBatchedTunableOp_Half_TN,tn_1151_1151_128_B_64,Gemm_Hipblaslt_TN_6879,0.118739
GemmStridedBatchedTunableOp_Half_TN,tn_808_808_128_B_32,Gemm_Hipblaslt_TN_150,0.0378477
GemmStridedBatchedTunableOp_Half_TN,tn_823_823_128_B_32,Gemm_Rocblas_621294635,0.0408368
GemmStridedBatchedTunableOp_Half_TN,tn_1217_1217_128_B_64,Gemm_Rocblas_621294106,0.131603
GemmStridedBatchedTunableOp_Half_TN,tn_973_973_128_B_32,Gemm_Rocblas_621286809,0.0519979
GemmStridedBatchedTunableOp_Half_TN,tn_922_922_128_B_32,Gemm_Hipblaslt_TN_6879,0.050628
GemmStridedBatchedTunableOp_Half_TN,tn_981_981_128_B_32,Gemm_Rocblas_621294550,0.0524844
GemmStridedBatchedTunableOp_Half_TN,tn_803_803_128_B_32,Gemm_Rocblas_621294635,0.0410068
GemmStridedBatchedTunableOp_Half_TN,tn_1144_1144_128_B_64,Gemm_Rocblas_621294725,0.114131
GemmStridedBatchedTunableOp_Half_TN,tn_888_888_128_B_32,Gemm_Hipblaslt_TN_150,0.0395312
GemmStridedBatchedTunableOp_Half_TN,tn_959_959_128_B_32,Gemm_Hipblaslt_TN_7519,0.05042
GemmStridedBatchedTunableOp_Half_TN,tn_806_806_128_B_32,Gemm_Rocblas_621294635,0.0398078
GemmStridedBatchedTunableOp_Half_TN,tn_940_940_128_B_32,Gemm_Rocblas_621294635,0.0511393
GemmStridedBatchedTunableOp_Half_TN,tn_870_870_128_B_32,Gemm_Rocblas_621294517,0.0460683
GemmStridedBatchedTunableOp_Half_TN,tn_892_892_128_B_32,Gemm_Rocblas_621294105,0.0463191
GemmStridedBatchedTunableOp_Half_TN,tn_895_895_128_B_32,Gemm_Rocblas_621294105,0.0472171
GemmStridedBatchedTunableOp_Half_TN,tn_866_866_128_B_32,Gemm_Rocblas_621286787,0.0457719
GemmStridedBatchedTunableOp_Half_TN,tn_1192_1192_128_B_64,Gemm_Rocblas_621294106,0.124713
GemmStridedBatchedTunableOp_Half_TN,tn_839_839_128_B_32,Gemm_Rocblas_621294635,0.0426575
GemmStridedBatchedTunableOp_Half_TN,tn_1080_1080_128_B_64,Gemm_Rocblas_621286397,0.108139
GemmStridedBatchedTunableOp_Half_TN,tn_810_810_128_B_32,Gemm_Rocblas_621294635,0.0401364
GemmStridedBatchedTunableOp_Half_TN,tn_833_833_128_B_32,Gemm_Rocblas_621294635,0.043564
GemmStridedBatchedTunableOp_Half_TN,tn_995_995_128_B_32,Gemm_Rocblas_621286809,0.0535314
GemmStridedBatchedTunableOp_Half_TN,tn_807_807_128_B_32,Gemm_Rocblas_621294635,0.0401109
GemmStridedBatchedTunableOp_Half_TN,tn_963_963_128_B_32,Gemm_Hipblaslt_TN_7519,0.0512389
GemmStridedBatchedTunableOp_Half_TN,tn_855_855_128_B_32,Gemm_Rocblas_621294635,0.0434859
GemmStridedBatchedTunableOp_Half_TN,tn_990_990_128_B_32,Gemm_Hipblaslt_TN_7483,0.0537469
GemmStridedBatchedTunableOp_Half_TN,tn_891_891_128_B_32,Gemm_Rocblas_621286396,0.0466885
GemmStridedBatchedTunableOp_Half_TN,tn_1351_1351_128_B_64,Gemm_Rocblas_621286412,0.157154
GemmStridedBatchedTunableOp_Half_TN,tn_1264_1264_128_B_64,Gemm_Rocblas_621286411,0.125222
GemmStridedBatchedTunableOp_Half_TN,tn_875_875_128_B_32,Gemm_Hipblaslt_TN_7483,0.0438518
GemmTunableOp_Half_TN,tn_128256_256_4096,Gemm_Rocblas_621294634,0.594108
GemmTunableOp_Half_TN,tn_4096_877_14336,Gemm_Hipblaslt_TN_9580,0.220126
GemmTunableOp_Half_TN,tn_28672_2750_4096,Gemm_Hipblaslt_TN_9184,1.17821
GemmTunableOp_Half_TN,tn_6144_895_4096,Gemm_Hipblaslt_TN_9253,0.0918069
GemmTunableOp_Half_TN,tn_4096_1854_4096,Gemm_Hipblaslt_TN_9645,0.11995
GemmTunableOp_Half_TN,tn_4096_1600_14336,Gemm_Hipblaslt_TN_9671,0.355399
GemmTunableOp_Half_TN,tn_4096_881_4096,Gemm_Hipblaslt_TN_9634,0.0664485
GemmTunableOp_Half_TN,tn_4096_844_14336,Gemm_Hipblaslt_TN_9580,0.222591
GemmTunableOp_Half_TN,tn_28672_1778_4096,Gemm_Hipblaslt_TN_9191,0.738301
GemmTunableOp_Half_TN,tn_4096_985_14336,Gemm_Hipblaslt_TN_9052,0.243459
GemmTunableOp_Half_TN,tn_28672_2703_4096,Gemm_Hipblaslt_TN_9847,1.16222
GemmTunableOp_Half_TN,tn_4096_3546_14336,Gemm_Hipblaslt_TN_9682,0.678795
GemmTunableOp_Half_TN,tn_4096_851_14336,Gemm_Hipblaslt_TN_9580,0.218535
GemmTunableOp_Half_TN,tn_4096_7266_14336,Gemm_Hipblaslt_TN_9814,1.44629
GemmTunableOp_Half_TN,tn_28672_1905_4096,Gemm_Hipblaslt_TN_9684,0.791949
GemmTunableOp_Half_TN,tn_4096_1886_14336,Gemm_Hipblaslt_TN_9645,0.409604
GemmTunableOp_Half_TN,tn_28672_915_4096,Gemm_Hipblaslt_TN_9683,0.387166
GemmTunableOp_Half_TN,tn_4096_1828_14336,Gemm_Hipblaslt_TN_9268,0.400717
GemmTunableOp_Half_TN,tn_4096_2872_4096,Gemm_Hipblaslt_TN_9566,0.165212
GemmTunableOp_Half_TN,tn_4096_2628_14336,Gemm_Hipblaslt_TN_9799,0.534456
GemmTunableOp_Half_TN,tn_6144_2571_4096,Gemm_Hipblaslt_TN_9746,0.217284
GemmTunableOp_Half_TN,tn_28672_2509_4096,Gemm_Hipblaslt_TN_9846,1.02913
GemmTunableOp_Half_TN,tn_6144_1697_4096,Gemm_Hipblaslt_TN_9570,0.154735
GemmTunableOp_Half_TN,tn_4096_2601_4096,Gemm_Hipblaslt_TN_9657,0.158818
GemmTunableOp_Half_TN,tn_4096_2732_14336,Gemm_Hipblaslt_TN_9799,0.556222
GemmTunableOp_Half_TN,tn_6144_820_4096,Gemm_Rocblas_621294520,0.0878289
GemmTunableOp_Half_TN,tn_6144_2630_4096,Gemm_Hipblaslt_TN_9827,0.214496
GemmTunableOp_Half_TN,tn_128256_168_4096,Gemm_Hipblaslt_TN_9752,0.508574
GemmTunableOp_Half_TN,tn_4096_907_4096,Gemm_Hipblaslt_TN_9634,0.0680254
GemmTunableOp_Half_TN,tn_28672_891_4096,Gemm_Hipblaslt_TN_9684,0.38483
GemmTunableOp_Half_TN,tn_6144_2773_4096,Gemm_Hipblaslt_TN_9763,0.256034
GemmTunableOp_Half_TN,tn_6144_796_4096,Gemm_Hipblaslt_TN_9357,0.0854073
GemmTunableOp_Half_TN,tn_6144_2719_4096,Gemm_Hipblaslt_TN_9565,0.252838
GemmTunableOp_Half_TN,tn_28672_887_4096,Gemm_Hipblaslt_TN_9683,0.384456
GemmTunableOp_Half_TN,tn_4096_929_14336,Gemm_Hipblaslt_TN_9589,0.231641
GemmTunableOp_Half_TN,tn_4096_912_14336,Gemm_Hipblaslt_TN_9604,0.230355
GemmTunableOp_Half_TN,tn_57344_115_8192,Gemm_Rocblas_621294214,0.347638
GemmTunableOp_Half_TN,tn_4096_906_4096,Gemm_Hipblaslt_TN_9576,0.0685457
GemmTunableOp_Half_TN,tn_6144_870_4096,Gemm_Hipblaslt_TN_9253,0.0910406
GemmTunableOp_Half_TN,tn_4096_1614_14336,Gemm_Hipblaslt_TN_9610,0.357366
GemmTunableOp_Half_TN,tn_6144_1718_4096,Gemm_Hipblaslt_TN_9570,0.153067
GemmTunableOp_Half_TN,tn_6144_1695_4096,Gemm_Hipblaslt_TN_9672,0.154151
GemmTunableOp_Half_TN,tn_4096_873_14336,Gemm_Hipblaslt_TN_9580,0.218366
GemmTunableOp_Half_TN,tn_28672_1755_4096,Gemm_Rocblas_621286678,0.736517
GemmTunableOp_Half_TN,tn_28672_835_4096,Gemm_Hipblaslt_TN_9684,0.377973
GemmTunableOp_Half_TN,tn_4096_2860_14336,Gemm_Hipblaslt_TN_9799,0.566811
GemmTunableOp_Half_TN,tn_4096_871_4096,Gemm_Hipblaslt_TN_9547,0.0648889
GemmTunableOp_Half_TN,tn_128256_226_4096,Gemm_Rocblas_621286892,0.58617
GemmTunableOp_Half_TN,tn_8192_131_8192,Gemm_Hipblaslt_TN_7561,0.0593538
GemmTunableOp_Half_TN,tn_28672_2601_4096,Gemm_Hipblaslt_TN_9827,1.07181
GemmTunableOp_Half_TN,tn_4096_888_4096,Gemm_Hipblaslt_TN_9634,0.066451
GemmTunableOp_Half_TN,tn_57344_1319_8192,Gemm_Hipblaslt_TN_9841,2.36383
GemmTunableOp_Half_TN,tn_4096_917_4096,Gemm_Hipblaslt_TN_9604,0.0671592
GemmTunableOp_Half_TN,tn_4096_1701_4096,Gemm_Hipblaslt_TN_9265,0.106806
GemmTunableOp_Half_TN,tn_28672_8000_4096,Gemm_Hipblaslt_TN_159,3.16196
GemmTunableOp_Half_TN,tn_4096_104_14336,Gemm_Hipblaslt_TN_7160,0.0446267
GemmTunableOp_Half_TN,tn_28672_790_4096,Gemm_Hipblaslt_TN_9674,0.342971
GemmTunableOp_Half_TN,tn_28672_7952_4096,Gemm_Hipblaslt_TN_9891,3.17916
GemmTunableOp_Half_TN,tn_28672_8049_4096,Gemm_Hipblaslt_TN_159,3.1679
GemmTunableOp_Half_TN,tn_128256_227_4096,Gemm_Rocblas_621286892,0.580458
GemmTunableOp_Half_TN,tn_4096_911_14336,Gemm_Hipblaslt_TN_9634,0.228497
GemmTunableOp_Half_TN,tn_28672_951_4096,Gemm_Hipblaslt_TN_9684,0.394205
GemmTunableOp_Half_TN,tn_128256_253_4096,Gemm_Rocblas_621286892,0.606693
GemmTunableOp_Half_TN,tn_128256_246_4096,Gemm_Rocblas_621286905,0.603072
GemmTunableOp_Half_TN,tn_128256_150_4096,Gemm_Hipblaslt_TN_9108,0.475612
GemmTunableOp_Half_TN,tn_128256_241_4096,Gemm_Rocblas_621294634,0.599659
GemmTunableOp_Half_TN,tn_128256_225_4096,Gemm_Rocblas_621286892,0.58209
GemmTunableOp_Half_TN,tn_8192_1208_28672,Gemm_Hipblaslt_TN_9774,1.17469
GemmTunableOp_Half_TN,tn_128256_182_4096,Gemm_Hipblaslt_TN_9952,0.513667
GemmTunableOp_Half_TN,tn_128256_156_4096,Gemm_Hipblaslt_TN_9108,0.481463
GemmTunableOp_Half_TN,tn_4096_256_4096,Gemm_Rocblas_621286491,0.0260953
GemmTunableOp_Half_TN,tn_4096_913_14336,Gemm_Hipblaslt_TN_9608,0.23117
GemmTunableOp_Half_TN,tn_6144_2636_4096,Gemm_Hipblaslt_TN_9827,0.220427
GemmTunableOp_Half_TN,tn_128256_78_4096,Gemm_Hipblaslt_TN_9057,0.382072
GemmTunableOp_Half_TN,tn_128256_60_4096,Gemm_Rocblas_621286813,0.354922
GemmTunableOp_Half_TN,tn_128256_40_4096,Gemm_Hipblaslt_TN_9451,0.325314
GemmTunableOp_Half_TN,tn_128256_16_4096,Gemm_Hipblaslt_TN_9405,0.28866
GemmTunableOp_Half_TN,tn_10240_1313_8192,Gemm_Hipblaslt_TN_9192,0.359516
GemmTunableOp_Half_TN,tn_8192_3187_8192,Gemm_Hipblaslt_TN_9192,0.707875
GemmTunableOp_Half_TN,tn_57344_113_8192,Gemm_Rocblas_621286477,0.34896
GemmTunableOp_Half_TN,tn_10240_110_8192,Gemm_Rocblas_621294504,0.0604012
GemmTunableOp_Half_TN,tn_4096_1693_14336,Gemm_Hipblaslt_TN_9790,0.361856
GemmTunableOp_Half_TN,tn_28672_815_4096,Gemm_Hipblaslt_TN_9683,0.375887
GemmTunableOp_Half_TN,tn_4096_1829_4096,Gemm_Hipblaslt_TN_9134,0.118819
GemmTunableOp_Half_TN,tn_57344_2728_8192,Gemm_Hipblaslt_TN_9733,4.94154
GemmTunableOp_Half_TN,tn_57344_2802_8192,Gemm_Hipblaslt_TN_9666,4.97109
GemmTunableOp_Half_TN,tn_28672_982_4096,Gemm_Hipblaslt_TN_9666,0.433265
GemmTunableOp_Half_TN,tn_128256_197_4096,Gemm_Hipblaslt_TN_9847,0.554857
GemmTunableOp_Half_TN,tn_8192_2859_8192,Gemm_Rocblas_621286666,0.648759
GemmTunableOp_Half_TN,tn_8192_3400_28672,Gemm_Hipblaslt_TN_9732,2.93481
GemmTunableOp_Half_TN,tn_8192_2866_28672,Gemm_Hipblaslt_TN_9799,2.6049
GemmTunableOp_Half_TN,tn_10240_4091_8192,Gemm_Hipblaslt_TN_9743,1.12087
GemmTunableOp_Half_TN,tn_8192_3747_8192,Gemm_Rocblas_621294435,0.820837
GemmTunableOp_Half_TN,tn_8192_1350_8192,Gemm_Hipblaslt_TN_9799,0.316896
GemmTunableOp_Half_TN,tn_4096_3479_4096,Gemm_Hipblaslt_TN_9743,0.199245
GemmTunableOp_Half_TN,tn_57344_2032_8192,Gemm_Hipblaslt_TN_9840,3.50425
GemmTunableOp_Half_TN,tn_128256_129_4096,Gemm_Hipblaslt_TN_9108,0.458046
GemmTunableOp_Half_TN,tn_8192_120_28672,Gemm_Hipblaslt_TN_8378,0.203959
GemmTunableOp_Half_TN,tn_10240_116_8192,Gemm_Rocblas_621286764,0.0613895
GemmTunableOp_Half_TN,tn_8192_3331_28672,Gemm_Hipblaslt_TN_9732,2.92895
GemmTunableOp_Half_TN,tn_8192_3206_8192,Gemm_Hipblaslt_TN_9189,0.709891
GemmTunableOp_Half_TN,tn_28672_896_4096,Gemm_Hipblaslt_TN_9683,0.384836
GemmTunableOp_Half_TN,tn_57344_19_8192,Gemm_Rocblas_621294194,0.266344
GemmTunableOp_Half_TN,tn_8192_1008_8192,Gemm_Hipblaslt_TN_9208,0.246114
GemmTunableOp_Half_TN,tn_32000_122_8192,Gemm_Rocblas_621286475,0.213711
GemmTunableOp_Half_TN,tn_32000_94_8192,Gemm_Rocblas_621286475,0.196265
GemmTunableOp_Half_TN,tn_128256_68_4096,Gemm_Hipblaslt_TN_9057,0.368745
GemmTunableOp_Half_TN,tn_10240_1104_8192,Gemm_Hipblaslt_TN_9209,0.314138
GemmTunableOp_Half_TN,tn_8192_114_8192,Gemm_Hipblaslt_TN_8891,0.0511646
GemmTunableOp_Half_TN,tn_128256_172_4096,Gemm_Hipblaslt_TN_9661,0.511217
GemmTunableOp_Half_TN,tn_4096_3671_4096,Gemm_Hipblaslt_TN_9768,0.209926
GemmTunableOp_Half_TN,tn_8192_1296_28672,Gemm_Hipblaslt_TN_9774,1.21095
GemmTunableOp_Half_TN,tn_6144_2860_4096,Gemm_Hipblaslt_TN_9567,0.258949
GemmTunableOp_Half_TN,tn_28672_224_4096,Gemm_Hipblaslt_TN_9680,0.112386
GemmTunableOp_Half_TN,tn_6144_1848_4096,Gemm_Hipblaslt_TN_9690,0.165393
GemmTunableOp_Half_TN,tn_4096_1931_14336,Gemm_Hipblaslt_TN_9680,0.416159
GemmTunableOp_Half_TN,tn_4096_853_4096,Gemm_Hipblaslt_TN_9604,0.0657841
GemmTunableOp_Half_TN,tn_32000_103_8192,Gemm_Rocblas_621286475,0.204148
GemmTunableOp_Half_TN,tn_32000_106_8192,Gemm_Rocblas_621294212,0.207943
GemmTunableOp_Half_TN,tn_6144_7823_4096,Gemm_Rocblas_621294455,0.650269
GemmTunableOp_Half_TN,tn_8192_1329_28672,Gemm_Hipblaslt_TN_9774,1.21137
GemmTunableOp_Half_TN,tn_4096_4242_4096,Gemm_Hipblaslt_TN_9827,0.232919
GemmTunableOp_Half_TN,tn_57344_123_8192,Gemm_Rocblas_621286477,0.351796
GemmTunableOp_Half_TN,tn_57344_2717_8192,Gemm_Hipblaslt_TN_9871,4.93526
GemmTunableOp_Half_TN,tn_128256_22_4096,Gemm_Rocblas_621294578,0.311358
GemmTunableOp_Half_TN,tn_4096_232_4096,Gemm_Rocblas_621286491,0.0255669
GemmTunableOp_Half_TN,tn_4096_2571_14336,Gemm_Hipblaslt_TN_9799,0.53104
GemmTunableOp_Half_TN,tn_28672_3565_4096,Gemm_Hipblaslt_TN_9827,1.3732
GemmTunableOp_Half_TN,tn_8192_1185_28672,Gemm_Hipblaslt_TN_9774,1.16309
GemmTunableOp_Half_TN,tn_32000_95_8192,Gemm_Rocblas_621294212,0.196245
GemmTunableOp_Half_TN,tn_8192_4096_8192,Gemm_Hipblaslt_TN_9704,0.883401
GemmTunableOp_Half_TN,tn_4096_1649_14336,Gemm_Hipblaslt_TN_9790,0.358156
GemmTunableOp_Half_TN,tn_8192_3299_8192,Gemm_Hipblaslt_TN_9139,0.733356
GemmTunableOp_Half_TN,tn_8192_1112_28672,Gemm_Hipblaslt_TN_9762,1.08994
GemmTunableOp_Half_TN,tn_4096_932_14336,Gemm_Hipblaslt_TN_9547,0.232021
GemmTunableOp_Half_TN,tn_6144_2672_4096,Gemm_Hipblaslt_TN_9827,0.219093
GemmTunableOp_Half_TN,tn_10240_133_8192,Gemm_Hipblaslt_TN_9367,0.0674465
GemmTunableOp_Half_TN,tn_4096_794_14336,Gemm_Hipblaslt_TN_9158,0.20925
GemmTunableOp_Half_TN,tn_32000_128_8192,Gemm_Rocblas_621286475,0.21451
GemmTunableOp_Half_TN,tn_57344_3178_8192,Gemm_Hipblaslt_TN_9816,5.50631
GemmTunableOp_Half_TN,tn_4096_839_14336,Gemm_Hipblaslt_TN_9099,0.222674
GemmTunableOp_Half_TN,tn_10240_3283_8192,Gemm_Hipblaslt_TN_9753,0.885053
GemmTunableOp_Half_TN,tn_8192_3754_28672,Gemm_Rocblas_621286968,3.25835
GemmTunableOp_Half_TN,tn_4096_2721_4096,Gemm_Hipblaslt_TN_9691,0.164958
GemmTunableOp_Half_TN,tn_57344_17_8192,Gemm_Rocblas_621286351,0.267061
GemmTunableOp_Half_TN,tn_8192_1224_28672,Gemm_Hipblaslt_TN_9774,1.19178
GemmTunableOp_Half_TN,tn_57344_4035_8192,Gemm_Rocblas_621294636,6.60932
GemmTunableOp_Half_TN,tn_8192_3274_28672,Gemm_Hipblaslt_TN_9732,2.86637
GemmTunableOp_Half_TN,tn_8192_3000_28672,Gemm_Hipblaslt_TN_9709,2.64707
GemmTunableOp_Half_TN,tn_28672_926_4096,Gemm_Hipblaslt_TN_9684,0.390701
GemmTunableOp_Half_TN,tn_10240_3153_8192,Gemm_Hipblaslt_TN_9753,0.868047
GemmTunableOp_Half_TN,tn_128256_130_4096,Gemm_Hipblaslt_TN_9108,0.46044
GemmTunableOp_Half_TN,tn_8192_2728_8192,Gemm_Hipblaslt_TN_9691,0.637861
GemmTunableOp_Half_TN,tn_8192_2866_8192,Gemm_Rocblas_621286683,0.646756
GemmTunableOp_Half_TN,tn_10240_1168_8192,Gemm_Hipblaslt_TN_9697,0.341102
GemmTunableOp_Half_TN,tn_8192_1321_8192,Gemm_Hipblaslt_TN_9799,0.312389
GemmTunableOp_Half_TN,tn_28672_256_4096,Gemm_Rocblas_621294324,0.120989
GemmTunableOp_Half_TN,tn_6144_853_4096,Gemm_Rocblas_621286778,0.0879667
GemmTunableOp_Half_TN,tn_4096_1666_14336,Gemm_Hipblaslt_TN_9671,0.359953
GemmTunableOp_Half_TN,tn_8192_103_28672,Gemm_Hipblaslt_TN_8378,0.194709
GemmTunableOp_Half_TN,tn_4096_946_4096,Gemm_Hipblaslt_TN_9634,0.0680644
GemmTunableOp_Half_TN,tn_128256_167_4096,Gemm_Hipblaslt_TN_9683,0.50742
GemmTunableOp_Half_TN,tn_57344_3491_8192,Gemm_Hipblaslt_TN_159,5.74514
GemmTunableOp_Half_TN,tn_28672_2698_4096,Gemm_Hipblaslt_TN_9787,1.15882
GemmTunableOp_Half_TN,tn_8192_135_8192,Gemm_Hipblaslt_TN_9306,0.0594544
GemmTunableOp_Half_TN,tn_6144_3431_4096,Gemm_Hipblaslt_TN_9570,0.303638
GemmTunableOp_Half_TN,tn_4096_852_4096,Gemm_Hipblaslt_TN_9170,0.0647828
GemmTunableOp_Half_TN,tn_4096_934_14336,Gemm_Hipblaslt_TN_9608,0.233393
GemmTunableOp_Half_TN,tn_10240_3203_8192,Gemm_Hipblaslt_TN_9223,0.875816
GemmTunableOp_Half_TN,tn_28672_2699_4096,Gemm_Hipblaslt_TN_9787,1.16497
GemmTunableOp_Half_TN,tn_57344_116_8192,Gemm_Rocblas_621294214,0.349142
GemmTunableOp_Half_TN,tn_6144_896_4096,Gemm_Hipblaslt_TN_9253,0.0918937
GemmTunableOp_Half_TN,tn_6144_849_4096,Gemm_Rocblas_621286778,0.0878239
GemmTunableOp_Half_TN,tn_10240_2664_8192,Gemm_Hipblaslt_TN_9814,0.73296
GemmTunableOp_Half_TN,tn_8192_3651_28672,Default,3.21601
GemmTunableOp_Half_TN,tn_4096_2717_4096,Gemm_Hipblaslt_TN_9799,0.161088
GemmTunableOp_Half_TN,tn_4096_986_14336,Gemm_Hipblaslt_TN_9632,0.246206
GemmTunableOp_Half_TN,tn_6144_2763_4096,Gemm_Hipblaslt_TN_9742,0.25447
GemmTunableOp_Half_TN,tn_6144_951_4096,Gemm_Hipblaslt_TN_9613,0.0944468
GemmTunableOp_Half_TN,tn_28672_972_4096,Gemm_Hipblaslt_TN_9666,0.433339
GemmTunableOp_Half_TN,tn_8192_3859_8192,Gemm_Rocblas_621294435,0.842184
GemmTunableOp_Half_TN,tn_4096_805_4096,Gemm_Hipblaslt_TN_9131,0.064111
GemmTunableOp_Half_TN,tn_28672_849_4096,Gemm_Hipblaslt_TN_9684,0.378659
GemmTunableOp_Half_TN,tn_8192_12_8192,Gemm_Hipblaslt_TN_9392,0.0306557
GemmTunableOp_Half_TN,tn_6144_843_4096,Gemm_Rocblas_621286778,0.0879863
GemmTunableOp_Half_TN,tn_4096_4242_14336,Gemm_Hipblaslt_TN_9813,0.79163
GemmTunableOp_Half_TN,tn_4096_847_4096,Gemm_Hipblaslt_TN_9634,0.0649752
GemmTunableOp_Half_TN,tn_4096_870_14336,Gemm_Hipblaslt_TN_9580,0.218554
GemmTunableOp_Half_TN,tn_10240_2962_8192,Gemm_Hipblaslt_TN_9655,0.827294
GemmTunableOp_Half_TN,tn_4096_1829_14336,Gemm_Hipblaslt_TN_9137,0.402612
GemmTunableOp_Half_TN,tn_6144_914_4096,Gemm_Hipblaslt_TN_9613,0.0929529
GemmTunableOp_Half_TN,tn_4096_8069_4096,Gemm_Rocblas_621294478,0.449452
GemmTunableOp_Half_TN,tn_8192_130_28672,Gemm_Hipblaslt_TN_7251,0.215241
GemmTunableOp_Half_TN,tn_4096_905_14336,Gemm_Hipblaslt_TN_9634,0.228697
GemmTunableOp_Half_TN,tn_8192_18_28672,Gemm_Hipblaslt_TN_9420,0.133786
GemmTunableOp_Half_TN,tn_8192_104_8192,Gemm_Hipblaslt_TN_8891,0.0495559
GemmTunableOp_Half_TN,tn_8192_3331_8192,Gemm_Hipblaslt_TN_9677,0.734268
GemmTunableOp_Half_TN,tn_128256_87_4096,Gemm_Hipblaslt_TN_9057,0.384585
GemmTunableOp_Half_TN,tn_6144_1777_4096,Gemm_Hipblaslt_TN_9672,0.161836
GemmTunableOp_Half_TN,tn_32000_123_8192,Gemm_Rocblas_621286475,0.216959
GemmTunableOp_Half_TN,tn_8192_3425_28672,Gemm_Hipblaslt_TN_9732,2.92925
GemmTunableOp_Half_TN,tn_4096_248_4096,Gemm_Rocblas_621294230,0.0260692
GemmTunableOp_Half_TN,tn_6144_3507_4096,Gemm_Hipblaslt_TN_9570,0.312572
GemmTunableOp_Half_TN,tn_28672_232_4096,Gemm_Rocblas_621294324,0.120142
GemmTunableOp_Half_TN,tn_57344_23_8192,Gemm_Rocblas_621294578,0.268479
GemmTunableOp_Half_TN,tn_32000_133_8192,Gemm_Hipblaslt_TN_9506,0.24102
GemmTunableOp_Half_TN,tn_4096_964_14336,Gemm_Hipblaslt_TN_9604,0.240271
GemmTunableOp_Half_TN,tn_57344_3498_8192,Gemm_Hipblaslt_TN_159,5.7811
GemmTunableOp_Half_TN,tn_57344_1248_8192,Gemm_Hipblaslt_TN_9827,2.33103
GemmTunableOp_Half_TN,tn_6144_1775_4096,Gemm_Hipblaslt_TN_9691,0.162673
GemmTunableOp_Half_TN,tn_8192_1121_8192,Gemm_Hipblaslt_TN_9229,0.262821
GemmTunableOp_Half_TN,tn_4096_3670_14336,Gemm_Hipblaslt_TN_9217,0.715872
GemmTunableOp_Half_TN,tn_57344_3162_8192,Gemm_Hipblaslt_TN_9816,5.5009
GemmTunableOp_Half_TN,tn_28672_3507_4096,Gemm_Hipblaslt_TN_9827,1.36969
GemmTunableOp_Half_TN,tn_128256_233_4096,Gemm_Rocblas_621286892,0.589006
GemmTunableOp_Half_TN,tn_10240_1248_8192,Gemm_Hipblaslt_TN_9697,0.352335
GemmTunableOp_Half_TN,tn_4096_785_14336,Gemm_Hipblaslt_TN_9158,0.208601
GemmTunableOp_Half_TN,tn_4096_988_4096,Gemm_Hipblaslt_TN_9604,0.0722504
GemmTunableOp_Half_TN,tn_10240_2692_8192,Gemm_Hipblaslt_TN_9743,0.758443
GemmTunableOp_Half_TN,tn_57344_3451_8192,Gemm_Hipblaslt_TN_159,5.73401
GemmTunableOp_Half_TN,tn_4096_799_14336,Gemm_Hipblaslt_TN_9158,0.208302
GemmTunableOp_Half_TN,tn_8192_91_28672,Gemm_Hipblaslt_TN_8899,0.183411
GemmTunableOp_Half_TN,tn_57344_3400_8192,Gemm_Hipblaslt_TN_9915,5.71726
GemmTunableOp_Half_TN,tn_57344_22_8192,Gemm_Rocblas_621286351,0.266591
GemmTunableOp_Half_TN,tn_28672_961_4096,Gemm_Hipblaslt_TN_9666,0.430016
GemmTunableOp_Half_TN,tn_128256_216_4096,Gemm_Hipblaslt_TN_9847,0.574229
GemmTunableOp_Half_TN,tn_10240_1296_8192,Gemm_Hipblaslt_TN_9192,0.3568
GemmTunableOp_Half_TN,tn_28672_1792_4096,Gemm_Rocblas_621294330,0.735063
GemmTunableOp_Half_TN,tn_8192_1208_8192,Gemm_Hipblaslt_TN_9691,0.29671
GemmTunableOp_Half_TN,tn_10240_1276_8192,Gemm_Hipblaslt_TN_9192,0.356102
GemmTunableOp_Half_TN,tn_8192_2962_28672,Gemm_Hipblaslt_TN_9687,2.63753
GemmTunableOp_Half_TN,tn_4096_990_4096,Gemm_Hipblaslt_TN_9604,0.0700219
GemmTunableOp_Half_TN,tn_4096_1893_14336,Gemm_Hipblaslt_TN_9620,0.411154
GemmTunableOp_Half_TN,tn_6144_984_4096,Gemm_Hipblaslt_TN_9633,0.10047
GemmTunableOp_Half_TN,tn_8192_1281_8192,Gemm_Rocblas_621286663,0.308435
GemmTunableOp_Half_TN,tn_128256_177_4096,Gemm_Hipblaslt_TN_9661,0.513063
GemmTunableOp_Half_TN,tn_4096_1723_14336,Gemm_Hipblaslt_TN_9164,0.364936
GemmTunableOp_Half_TN,tn_57344_112_8192,Default,0.34593
GemmTunableOp_Half_TN,tn_4096_1694_14336,Gemm_Hipblaslt_TN_9607,0.364525
GemmTunableOp_Half_TN,tn_8192_4090_28672,Gemm_Rocblas_621286915,3.43722
GemmTunableOp_Half_TN,tn_32000_110_8192,Gemm_Rocblas_621294212,0.20933
GemmTunableOp_Half_TN,tn_28672_879_4096,Gemm_Hipblaslt_TN_9684,0.382132
GemmTunableOp_Half_TN,tn_4096_809_4096,Gemm_Hipblaslt_TN_9547,0.0645048
GemmTunableOp_Half_TN,tn_128256_142_4096,Gemm_Hipblaslt_TN_9108,0.467601
GemmTunableOp_Half_TN,tn_8192_96_28672,Gemm_Hipblaslt_TN_8899,0.185306
GemmTunableOp_Half_TN,tn_10240_3555_8192,Gemm_Hipblaslt_TN_9744,1.01361
GemmTunableOp_Half_TN,tn_128256_10_4096,Gemm_Hipblaslt_TN_9405,0.281529
GemmTunableOp_Half_TN,tn_28672_3571_4096,Gemm_Hipblaslt_TN_9827,1.37442
GemmTunableOp_Half_TN,tn_4096_2788_14336,Gemm_Hipblaslt_TN_9799,0.559336
GemmTunableOp_Half_TN,tn_8192_96_8192,Gemm_Hipblaslt_TN_7093,0.0470526
GemmTunableOp_Half_TN,tn_6144_857_4096,Gemm_Rocblas_621294520,0.0869467
GemmTunableOp_Half_TN,tn_28672_836_4096,Gemm_Hipblaslt_TN_9683,0.376979
GemmTunableOp_Half_TN,tn_8192_124_28672,Gemm_Hipblaslt_TN_8378,0.206441
GemmTunableOp_Half_TN,tn_6144_1726_4096,Gemm_Rocblas_621286753,0.155799
GemmTunableOp_Half_TN,tn_8192_3283_8192,Gemm_Hipblaslt_TN_9189,0.731967
GemmTunableOp_Half_TN,tn_28672_24_4096,Gemm_Rocblas_621286346,0.0460077
GemmTunableOp_Half_TN,tn_57344_2866_8192,Gemm_Rocblas_621286655,5.05418
GemmTunableOp_Half_TN,tn_8192_1321_28672,Gemm_Hipblaslt_TN_9774,1.1957
GemmTunableOp_Half_TN,tn_4096_862_14336,Gemm_Hipblaslt_TN_9580,0.218307
GemmTunableOp_Half_TN,tn_28672_832_4096,Gemm_Hipblaslt_TN_9684,0.378633
GemmTunableOp_Half_TN,tn_10240_4082_8192,Gemm_Hipblaslt_TN_9743,1.12938
GemmTunableOp_Half_TN,tn_8192_2549_28672,Gemm_Hipblaslt_TN_9774,2.31884
GemmTunableOp_Half_TN,tn_8192_119_28672,Gemm_Hipblaslt_TN_8378,0.202443
GemmTunableOp_Half_TN,tn_28672_2517_4096,Gemm_Hipblaslt_TN_9846,1.02528
GemmTunableOp_Half_TN,tn_10240_3642_8192,Gemm_Hipblaslt_TN_9743,1.03281
GemmTunableOp_Half_TN,tn_10240_3747_8192,Gemm_Hipblaslt_TN_9763,1.05241
GemmTunableOp_Half_TN,tn_57344_3475_8192,Gemm_Hipblaslt_TN_159,5.79135
GemmTunableOp_Half_TN,tn_32000_256_8192,Gemm_Rocblas_621286625,0.320923
GemmTunableOp_Half_TN,tn_6144_104_4096,Gemm_Rocblas_621294175,0.0233107
GemmTunableOp_Half_TN,tn_8192_3451_28672,Gemm_Hipblaslt_TN_9732,2.94287
GemmTunableOp_Half_TN,tn_128256_124_4096,Gemm_Hipblaslt_TN_9760,0.428662
GemmTunableOp_Half_TN,tn_128256_200_4096,Gemm_Hipblaslt_TN_9937,0.559627
GemmTunableOp_Half_TN,tn_8192_122_28672,Gemm_Hipblaslt_TN_8378,0.204003
GemmTunableOp_Half_TN,tn_128256_117_4096,Gemm_Hipblaslt_TN_9760,0.430988
GemmTunableOp_Half_TN,tn_57344_1268_8192,Gemm_Hipblaslt_TN_9827,2.33358
GemmTunableOp_Half_TN,tn_10240_1268_8192,Gemm_Hipblaslt_TN_9189,0.355923
GemmTunableOp_Half_TN,tn_57344_1360_8192,Gemm_Hipblaslt_TN_9830,2.55953
GemmTunableOp_Half_TN,tn_10240_3140_8192,Gemm_Hipblaslt_TN_9753,0.868955
GemmTunableOp_Half_TN,tn_8192_3491_28672,Gemm_Hipblaslt_TN_9684,2.99291
GemmTunableOp_Half_TN,tn_10240_3187_8192,Gemm_Hipblaslt_TN_9815,0.870756
GemmTunableOp_Half_TN,tn_8192_3178_8192,Gemm_Hipblaslt_TN_9697,0.707339
GemmTunableOp_Half_TN,tn_10240_13_8192,Gemm_Hipblaslt_TN_9411,0.0371058
GemmTunableOp_Half_TN,tn_8192_99_28672,Gemm_Hipblaslt_TN_8378,0.197652
GemmTunableOp_Half_TN,tn_8192_1201_8192,Gemm_Hipblaslt_TN_9799,0.295926
GemmTunableOp_Half_TN,tn_4096_1913_4096,Gemm_Hipblaslt_TN_9620,0.122432
GemmTunableOp_Half_TN,tn_32000_12_8192,Gemm_Rocblas_621294053,0.14405
GemmTunableOp_Half_TN,tn_8192_21_8192,Gemm_Hipblaslt_TN_9410,0.0322565
GemmTunableOp_Half_TN,tn_32000_107_8192,Gemm_Rocblas_621294212,0.207087
GemmTunableOp_Half_TN,tn_10240_3139_8192,Gemm_Hipblaslt_TN_9815,0.869715
GemmTunableOp_Half_TN,tn_8192_17_28672,Gemm_Hipblaslt_TN_9420,0.134108
GemmTunableOp_Half_TN,tn_8192_11_28672,Gemm_Hipblaslt_TN_9402,0.126264
GemmTunableOp_Half_TN,tn_28672_949_4096,Gemm_Hipblaslt_TN_9683,0.392145
GemmTunableOp_Half_TN,tn_6144_1666_4096,Gemm_Rocblas_621286753,0.154211
GemmTunableOp_Half_TN,tn_4096_884_4096,Gemm_Hipblaslt_TN_9634,0.0664593
GemmTunableOp_Half_TN,tn_57344_2166_8192,Gemm_Hipblaslt_TN_9827,3.98114
GemmTunableOp_Half_TN,tn_128256_53_4096,Gemm_Hipblaslt_TN_9097,0.350016
GemmTunableOp_Half_TN,tn_28672_813_4096,Gemm_Hipblaslt_TN_9684,0.376315
GemmTunableOp_Half_TN,tn_8192_2802_28672,Gemm_Rocblas_621286667,2.52995
GemmTunableOp_Half_TN,tn_10240_3785_8192,Gemm_Hipblaslt_TN_9763,1.06008
GemmTunableOp_Half_TN,tn_4096_2517_14336,Gemm_Hipblaslt_TN_9799,0.520586
GemmTunableOp_Half_TN,tn_4096_1815_4096,Gemm_Hipblaslt_TN_9645,0.118833
GemmTunableOp_Half_TN,tn_8192_10_8192,Gemm_Hipblaslt_TN_9392,0.030548
GemmTunableOp_Half_TN,tn_6144_2517_4096,Gemm_Hipblaslt_TN_9184,0.214803
GemmTunableOp_Half_TN,tn_4096_7817_4096,Gemm_Hipblaslt_TN_9815,0.430732
GemmTunableOp_Half_TN,tn_8192_1377_28672,Gemm_Hipblaslt_TN_9799,1.27449
GemmTunableOp_Half_TN,tn_128256_33_4096,Gemm_Hipblaslt_TN_9455,0.317498
GemmTunableOp_Half_TN,tn_8192_93_8192,Gemm_Hipblaslt_TN_8095,0.0478474
GemmTunableOp_Half_TN,tn_4096_1944_14336,Gemm_Hipblaslt_TN_9267,0.416008
GemmTunableOp_Half_TN,tn_8192_1264_28672,Gemm_Hipblaslt_TN_9774,1.19638
GemmTunableOp_Half_TN,tn_128256_201_4096,Gemm_Hipblaslt_TN_9937,0.56659
GemmTunableOp_Half_TN,tn_8192_3203_8192,Gemm_Hipblaslt_TN_9697,0.71057
GemmTunableOp_Half_TN,tn_32000_10_8192,Gemm_Rocblas_621294187,0.143563
GemmTunableOp_Half_TN,tn_57344_1233_8192,Default,2.31264
GemmTunableOp_Half_TN,tn_4096_2786_14336,Gemm_Hipblaslt_TN_9799,0.565199
GemmTunableOp_Half_TN,tn_8192_1265_28672,Gemm_Hipblaslt_TN_9774,1.18819
GemmTunableOp_Half_TN,tn_10240_25_8192,Gemm_Hipblaslt_TN_9415,0.0393237
GemmTunableOp_Half_TN,tn_8192_5_8192,Gemm_Hipblaslt_TN_9388,0.0302916
GemmTunableOp_Half_TN,tn_8192_1233_8192,Gemm_Hipblaslt_TN_9209,0.294369
GemmTunableOp_Half_TN,tn_4096_968_4096,Gemm_Hipblaslt_TN_9604,0.0711099
GemmTunableOp_Half_TN,tn_10240_95_8192,Gemm_Hipblaslt_TN_8095,0.0538335
GemmTunableOp_Half_TN,tn_8192_1025_8192,Gemm_Hipblaslt_TN_9229,0.257024
GemmTunableOp_Half_TN,tn_4096_1850_4096,Gemm_Hipblaslt_TN_9645,0.119783
GemmTunableOp_Half_TN,tn_8192_106_28672,Gemm_Hipblaslt_TN_8378,0.196242
GemmTunableOp_Half_TN,tn_28672_80_4096,Gemm_Rocblas_621294461,0.0549215
GemmTunableOp_Half_TN,tn_28672_816_4096,Gemm_Hipblaslt_TN_9683,0.375946
GemmTunableOp_Half_TN,tn_128256_105_4096,Gemm_Hipblaslt_TN_9061,0.421033
GemmTunableOp_Half_TN,tn_6144_24_4096,Gemm_Rocblas_621294047,0.0139027
GemmTunableOp_Half_TN,tn_4096_2681_4096,Gemm_Hipblaslt_TN_9799,0.160804
GemmTunableOp_Half_TN,tn_8192_126_28672,Gemm_Hipblaslt_TN_8378,0.204925
GemmTunableOp_Half_TN,tn_4096_2708_4096,Gemm_Hipblaslt_TN_9687,0.161823
GemmTunableOp_Half_TN,tn_8192_4035_28672,Gemm_Rocblas_621294658,3.39656
GemmTunableOp_Half_TN,tn_8192_98_28672,Gemm_Hipblaslt_TN_8378,0.195837
GemmTunableOp_Half_TN,tn_28672_2721_4096,Gemm_Hipblaslt_TN_9847,1.16945
GemmTunableOp_Half_TN,tn_8192_2664_8192,Gemm_Hipblaslt_TN_9774,0.615346
GemmTunableOp_Half_TN,tn_28672_1756_4096,Gemm_Hipblaslt_TN_9184,0.732504
GemmTunableOp_Half_TN,tn_32000_7_8192,Gemm_Rocblas_621294578,0.141889
GemmTunableOp_Half_TN,tn_8192_3347_28672,Gemm_Hipblaslt_TN_9732,2.92155
GemmTunableOp_Half_TN,tn_4096_2675_4096,Gemm_Hipblaslt_TN_9657,0.162189
GemmTunableOp_Half_TN,tn_28672_831_4096,Gemm_Hipblaslt_TN_9684,0.37732
GemmTunableOp_Half_TN,tn_6144_88_4096,Gemm_Rocblas_621286278,0.0187607
GemmTunableOp_Half_TN,tn_8192_3626_28672,Gemm_Hipblaslt_TN_9732,3.04195
GemmTunableOp_Half_TN,tn_4096_873_4096,Gemm_Hipblaslt_TN_9634,0.0660153
GemmTunableOp_Half_TN,tn_8192_13_28672,Gemm_Hipblaslt_TN_9403,0.124631
GemmTunableOp_Half_TN,tn_4096_1726_14336,Gemm_Hipblaslt_TN_9607,0.365852
GemmTunableOp_Half_TN,tn_8192_19_28672,Gemm_Hipblaslt_TN_9420,0.135298
GemmTunableOp_Half_TN,tn_6144_939_4096,Gemm_Hipblaslt_TN_9613,0.0942393
GemmTunableOp_Half_TN,tn_6144_1715_4096,Gemm_Hipblaslt_TN_9570,0.154013
GemmTunableOp_Half_TN,tn_8192_3425_8192,Gemm_Hipblaslt_TN_9677,0.744615
GemmTunableOp_Half_TN,tn_10240_10_8192,Gemm_Hipblaslt_TN_9411,0.0370998
GemmTunableOp_Half_TN,tn_8192_4082_8192,Gemm_Rocblas_621286693,0.875161
GemmTunableOp_Half_TN,tn_8192_100_28672,Gemm_Hipblaslt_TN_8378,0.197005
GemmTunableOp_Half_TN,tn_8192_4025_8192,Gemm_Hipblaslt_TN_9190,0.8654
GemmTunableOp_Half_TN,tn_6144_863_4096,Gemm_Rocblas_621286778,0.0880484
GemmTunableOp_Half_TN,tn_10240_2859_8192,Gemm_Hipblaslt_TN_9743,0.777435
GemmTunableOp_Half_TN,tn_4096_868_4096,Gemm_Hipblaslt_TN_9634,0.0669252
GemmTunableOp_Half_TN,tn_6144_1757_4096,Gemm_Hipblaslt_TN_9690,0.15862
GemmTunableOp_Half_TN,tn_4096_914_4096,Gemm_Hipblaslt_TN_9576,0.0679671
GemmTunableOp_Half_TN,tn_4096_128_4096,Gemm_Rocblas_621286280,0.017154
GemmTunableOp_Half_TN,tn_6144_1822_4096,Gemm_Hipblaslt_TN_9691,0.16436
GemmTunableOp_Half_TN,tn_28672_1794_4096,Gemm_Hipblaslt_TN_9684,0.776239
GemmTunableOp_Half_TN,tn_6144_240_4096,Gemm_Hipblaslt_TN_9495,0.0334959
GemmTunableOp_Half_TN,tn_4096_904_4096,Gemm_Hipblaslt_TN_9577,0.0694267
GemmTunableOp_Half_TN,tn_28672_3431_4096,Gemm_Hipblaslt_TN_9827,1.34515
GemmTunableOp_Half_TN,tn_6144_1900_4096,Gemm_Hipblaslt_TN_9690,0.167351
GemmTunableOp_Half_TN,tn_6144_1733_4096,Gemm_Hipblaslt_TN_9691,0.157868
GemmTunableOp_Half_TN,tn_28672_957_4096,Gemm_Hipblaslt_TN_9683,0.395606
GemmTunableOp_Half_TN,tn_4096_926_14336,Gemm_Hipblaslt_TN_9634,0.231367
GemmTunableOp_Half_TN,tn_4096_1746_4096,Gemm_Hipblaslt_TN_9134,0.115354
GemmTunableOp_Half_TN,tn_4096_961_14336,Gemm_Hipblaslt_TN_9608,0.234593
GemmTunableOp_Half_TN,tn_28672_937_4096,Gemm_Hipblaslt_TN_9683,0.391451
GemmTunableOp_Half_TN,tn_6144_1693_4096,Gemm_Hipblaslt_TN_9570,0.154937
GemmTunableOp_Half_TN,tn_28672_2628_4096,Gemm_Hipblaslt_TN_9827,1.07133
GemmTunableOp_Half_TN,tn_4096_2544_14336,Gemm_Hipblaslt_TN_9799,0.520373
GemmTunableOp_Half_TN,tn_4096_7992_14336,Gemm_Hipblaslt_TN_9815,1.61351
GemmTunableOp_Half_TN,tn_4096_1837_14336,Gemm_Hipblaslt_TN_9137,0.401592
GemmTunableOp_Half_TN,tn_6144_1763_4096,Gemm_Rocblas_621294426,0.162175
GemmTunableOp_Half_TN,tn_4096_2786_4096,Gemm_Hipblaslt_TN_9672,0.166359
GemmTunableOp_Half_TN,tn_28672_2544_4096,Gemm_Hipblaslt_TN_9846,1.0306
GemmTunableOp_Half_TN,tn_4096_869_4096,Gemm_Hipblaslt_TN_9547,0.0660562
GemmTunableOp_Half_TN,tn_4096_983_14336,Gemm_Hipblaslt_TN_9052,0.243829
GemmTunableOp_Half_TN,tn_6144_1834_4096,Gemm_Hipblaslt_TN_9691,0.164066
GemmTunableOp_Half_TN,tn_4096_1730_4096,Gemm_Hipblaslt_TN_9134,0.115416
GemmTunableOp_Half_TN,tn_4096_2630_14336,Gemm_Hipblaslt_TN_9799,0.53493
GemmTunableOp_Half_TN,tn_4096_2630_4096,Gemm_Hipblaslt_TN_9799,0.158543
GemmTunableOp_Half_TN,tn_10240_2717_8192,Gemm_Hipblaslt_TN_9743,0.757408
GemmTunableOp_Half_TN,tn_4096_1792_4096,Gemm_Hipblaslt_TN_9134,0.116176
GemmTunableOp_Half_TN,tn_10240_2479_8192,Gemm_Hipblaslt_TN_9139,0.693639
GemmTunableOp_Half_TN,tn_6144_1831_4096,Gemm_Hipblaslt_TN_9690,0.16407
GemmTunableOp_Half_TN,tn_4096_861_14336,Gemm_Hipblaslt_TN_9580,0.217029
GemmTunableOp_Half_TN,tn_28672_1807_4096,Gemm_Hipblaslt_TN_9684,0.780786
GemmTunableOp_Half_TN,tn_6144_128_4096,Gemm_Rocblas_621286445,0.023596
GemmTunableOp_Half_TN,tn_6144_961_4096,Gemm_Hipblaslt_TN_9616,0.09961
GemmTunableOp_Half_TN,tn_4096_958_4096,Gemm_Hipblaslt_TN_9576,0.0693579
GemmTunableOp_Half_TN,tn_57344_1112_8192,Gemm_Hipblaslt_TN_9774,2.04581
GemmTunableOp_Half_TN,tn_28672_990_4096,Gemm_Hipblaslt_TN_9825,0.434599
GemmTunableOp_Half_TN,tn_8192_118_28672,Gemm_Hipblaslt_TN_8378,0.202826
GemmTunableOp_Half_TN,tn_4096_843_4096,Gemm_Hipblaslt_TN_9608,0.0646219
GemmTunableOp_Half_TN,tn_4096_1733_14336,Gemm_Hipblaslt_TN_9645,0.390995
GemmTunableOp_Half_TN,tn_28672_954_4096,Gemm_Hipblaslt_TN_9683,0.393025
GemmTunableOp_Half_TN,tn_4096_923_4096,Gemm_Hipblaslt_TN_9634,0.0687205
GemmTunableOp_Half_TN,tn_28672_935_4096,Gemm_Hipblaslt_TN_9683,0.391382
GemmTunableOp_Half_TN,tn_28672_3310_4096,Gemm_Hipblaslt_TN_9827,1.34761
GemmTunableOp_Half_TN,tn_8192_1329_8192,Gemm_Hipblaslt_TN_9697,0.314536
GemmTunableOp_Half_TN,tn_10240_2041_8192,Gemm_Rocblas_621286569,0.597484
GemmTunableOp_Half_TN,tn_6144_1743_4096,Gemm_Hipblaslt_TN_9799,0.15757
GemmTunableOp_Half_TN,tn_6144_852_4096,Gemm_Rocblas_621286778,0.0880331
GemmTunableOp_Half_TN,tn_4096_836_14336,Gemm_Hipblaslt_TN_9604,0.220207
GemmTunableOp_Half_TN,tn_10240_3000_8192,Gemm_Hipblaslt_TN_9815,0.828499
GemmTunableOp_Half_TN,tn_57344_3626_8192,Gemm_Hipblaslt_TN_9908,6.33591
GemmTunableOp_Half_TN,tn_4096_88_4096,Gemm_Rocblas_621286279,0.0155592
GemmTunableOp_Half_TN,tn_28672_834_4096,Gemm_Hipblaslt_TN_9683,0.378382
GemmTunableOp_Half_TN,tn_6144_886_4096,Gemm_Hipblaslt_TN_9613,0.0917779
GemmTunableOp_Half_TN,tn_4096_978_4096,Gemm_Hipblaslt_TN_9604,0.0686479
GemmTunableOp_Half_TN,tn_4096_794_4096,Gemm_Hipblaslt_TN_9131,0.0637177
GemmTunableOp_Half_TN,tn_4096_1827_4096,Gemm_Hipblaslt_TN_9134,0.119252
GemmTunableOp_Half_TN,tn_32000_24_8192,Gemm_Rocblas_621294578,0.152288
GemmTunableOp_Half_TN,tn_28672_934_4096,Gemm_Hipblaslt_TN_9683,0.391768
GemmTunableOp_Half_TN,tn_28672_56_4096,Gemm_Rocblas_621286463,0.0499969
GemmTunableOp_Half_TN,tn_28672_2762_4096,Gemm_Hipblaslt_TN_9184,1.17971
GemmTunableOp_Half_TN,tn_4096_7952_4096,Gemm_Hipblaslt_TN_9903,0.436285
GemmTunableOp_Half_TN,tn_8192_1217_28672,Gemm_Hipblaslt_TN_9774,1.16791
GemmTunableOp_Half_TN,tn_128256_203_4096,Gemm_Hipblaslt_TN_9847,0.567578
GemmTunableOp_Half_TN,tn_4096_886_4096,Gemm_Hipblaslt_TN_9604,0.0667127
GemmTunableOp_Half_TN,tn_6144_969_4096,Gemm_Hipblaslt_TN_9180,0.100635
GemmTunableOp_Half_TN,tn_4096_7809_14336,Gemm_Hipblaslt_TN_9813,1.57378
GemmTunableOp_Half_TN,tn_28672_2826_4096,Gemm_Hipblaslt_TN_9827,1.15966
GemmTunableOp_Half_TN,tn_6144_899_4096,Gemm_Hipblaslt_TN_9561,0.0930903
GemmTunableOp_Half_TN,tn_4096_5606_4096,Gemm_Hipblaslt_TN_9672,0.333226
GemmTunableOp_Half_TN,tn_6144_2732_4096,Gemm_Hipblaslt_TN_9763,0.254
GemmTunableOp_Half_TN,tn_4096_2734_4096,Gemm_Hipblaslt_TN_9672,0.164952
GemmTunableOp_Half_TN,tn_8192_3546_28672,Gemm_Hipblaslt_TN_9732,3.01
GemmTunableOp_Half_TN,tn_28672_823_4096,Gemm_Hipblaslt_TN_9684,0.375859
GemmTunableOp_Half_TN,tn_4096_224_14336,Gemm_Hipblaslt_TN_9363,0.0703231
GemmTunableOp_Half_TN,tn_4096_992_4096,Gemm_Hipblaslt_TN_9604,0.070622
GemmTunableOp_Half_TN,tn_6144_869_4096,Gemm_Hipblaslt_TN_9613,0.0917611
GemmTunableOp_Half_TN,tn_28672_8054_4096,Gemm_Hipblaslt_TN_159,3.15981
GemmTunableOp_Half_TN,tn_28672_1697_4096,Gemm_Hipblaslt_TN_9223,0.726153
GemmTunableOp_Half_TN,tn_6144_808_4096,Gemm_Rocblas_621294520,0.0869091
GemmTunableOp_Half_TN,tn_6144_48_4096,Gemm_Rocblas_621294155,0.0154489
GemmTunableOp_Half_TN,tn_28672_969_4096,Gemm_Hipblaslt_TN_9716,0.431804
GemmTunableOp_Half_TN,tn_6144_3571_4096,Gemm_Rocblas_621286753,0.314545
GemmTunableOp_Half_TN,tn_6144_1883_4096,Gemm_Rocblas_621294447,0.166075
GemmTunableOp_Half_TN,tn_6144_7798_4096,Gemm_Rocblas_621294420,0.649653
GemmTunableOp_Half_TN,tn_6144_1805_4096,Gemm_Hipblaslt_TN_9672,0.162277
GemmTunableOp_Half_TN,tn_6144_1837_4096,Gemm_Hipblaslt_TN_9691,0.164989
GemmTunableOp_Half_TN,tn_4096_7283_14336,Gemm_Hipblaslt_TN_9743,1.44655
GemmTunableOp_Half_TN,tn_4096_4471_14336,Gemm_Hipblaslt_TN_9826,0.925924
GemmTunableOp_Half_TN,tn_28672_7809_4096,Gemm_Hipblaslt_TN_159,3.03189
GemmTunableOp_Half_TN,tn_28672_2872_4096,Gemm_Hipblaslt_TN_9827,1.16093
GemmTunableOp_Half_TN,tn_6144_96_4096,Gemm_Rocblas_621286278,0.0188482
GemmTunableOp_Half_TN,tn_4096_232_14336,Gemm_Hipblaslt_TN_9303,0.0712445
GemmTunableOp_Half_TN,tn_57344_124_8192,Default,0.35081
GemmTunableOp_Half_TN,tn_8192_2551_28672,Gemm_Hipblaslt_TN_9774,2.32503
GemmTunableOp_Half_TN,tn_4096_870_4096,Gemm_Hipblaslt_TN_9170,0.0664962
GemmTunableOp_Half_TN,tn_4096_3711_14336,Gemm_Hipblaslt_TN_9217,0.718387
GemmTunableOp_Half_TN,tn_4096_2763_14336,Gemm_Hipblaslt_TN_9799,0.554261
GemmTunableOp_Half_TN,tn_6144_908_4096,Gemm_Hipblaslt_TN_9613,0.0926884
GemmTunableOp_Half_TN,tn_4096_819_4096,Gemm_Hipblaslt_TN_9634,0.0638703
GemmTunableOp_Half_TN,tn_6144_2590_4096,Gemm_Hipblaslt_TN_9827,0.216552
GemmTunableOp_Half_TN,tn_4096_4463_4096,Gemm_Hipblaslt_TN_9926,0.266833
GemmTunableOp_Half_TN,tn_4096_1737_4096,Gemm_Hipblaslt_TN_9134,0.11647
GemmTunableOp_Half_TN,tn_6144_8192_4096,Gemm_Rocblas_621286590,0.675135
GemmTunableOp_Half_TN,tn_4096_913_4096,Gemm_Hipblaslt_TN_9634,0.0677285
GemmTunableOp_Half_TN,tn_28672_1817_4096,Gemm_Hipblaslt_TN_9684,0.786907
GemmTunableOp_Half_TN,tn_4096_804_14336,Gemm_Hipblaslt_TN_9147,0.212037
GemmTunableOp_Half_TN,tn_32000_111_8192,Gemm_Rocblas_621286475,0.21054
GemmTunableOp_Half_TN,tn_28672_3430_4096,Gemm_Hipblaslt_TN_9827,1.35416
GemmTunableOp_Half_TN,tn_4096_1700_14336,Gemm_Hipblaslt_TN_9164,0.362301
GemmTunableOp_Half_TN,tn_28672_176_4096,Gemm_Hipblaslt_TN_9616,0.0976065
GemmTunableOp_Half_TN,tn_28672_1614_4096,Gemm_Rocblas_621286678,0.712945
GemmTunableOp_Half_TN,tn_28672_869_4096,Gemm_Hipblaslt_TN_9683,0.383028
GemmTunableOp_Half_TN,tn_28672_802_4096,Gemm_Hipblaslt_TN_9684,0.377148
GemmTunableOp_Half_TN,tn_4096_831_14336,Gemm_Hipblaslt_TN_9147,0.21312
GemmTunableOp_Half_TN,tn_6144_3599_4096,Gemm_Rocblas_621286753,0.316168
GemmTunableOp_Half_TN,tn_4096_216_4096,Gemm_Rocblas_621286491,0.0254018
GemmTunableOp_Half_TN,tn_28672_1777_4096,Gemm_Hipblaslt_TN_9184,0.736825
GemmTunableOp_Half_TN,tn_4096_8156_14336,Gemm_Hipblaslt_TN_9815,1.63258
GemmTunableOp_Half_TN,tn_28672_797_4096,Gemm_Hipblaslt_TN_9691,0.350333
GemmTunableOp_Half_TN,tn_4096_1672_14336,Gemm_Hipblaslt_TN_9265,0.362196
GemmTunableOp_Half_TN,tn_28672_888_4096,Gemm_Hipblaslt_TN_9683,0.383822
GemmTunableOp_Half_TN,tn_28672_1719_4096,Gemm_Hipblaslt_TN_9184,0.729836
GemmTunableOp_Half_TN,tn_32000_13_8192,Gemm_Rocblas_621294187,0.143521
GemmTunableOp_Half_TN,tn_4096_8154_4096,Gemm_Hipblaslt_TN_9704,0.452586
GemmTunableOp_Half_TN,tn_6144_192_4096,Gemm_Rocblas_621286443,0.0283627
GemmTunableOp_Half_TN,tn_6144_2544_4096,Gemm_Hipblaslt_TN_9827,0.216059
GemmTunableOp_Half_TN,tn_28672_837_4096,Gemm_Hipblaslt_TN_9683,0.379776
GemmTunableOp_Half_TN,tn_4096_939_4096,Gemm_Hipblaslt_TN_9604,0.0675313
GemmTunableOp_Half_TN,tn_57344_1168_8192,Gemm_Hipblaslt_TN_9841,2.27633
GemmTunableOp_Half_TN,tn_28672_919_4096,Gemm_Hipblaslt_TN_9683,0.389692
GemmTunableOp_Half_TN,tn_28672_1931_4096,Gemm_Hipblaslt_TN_9846,0.828867
GemmTunableOp_Half_TN,tn_6144_7817_4096,Gemm_Rocblas_621286678,0.646251
GemmTunableOp_Half_TN,tn_6144_946_4096,Gemm_Hipblaslt_TN_9606,0.0943561
GemmTunableOp_Half_TN,tn_4096_2658_4096,Gemm_Hipblaslt_TN_9799,0.158342
GemmTunableOp_Half_TN,tn_6144_7952_4096,Gemm_Hipblaslt_TN_9914,0.660731
GemmTunableOp_Half_TN,tn_28672_801_4096,Gemm_Hipblaslt_TN_9684,0.374264
GemmTunableOp_Half_TN,tn_4096_814_14336,Gemm_Hipblaslt_TN_9158,0.210702
GemmTunableOp_Half_TN,tn_28672_925_4096,Gemm_Hipblaslt_TN_9683,0.389621
GemmTunableOp_Half_TN,tn_4096_859_14336,Gemm_Hipblaslt_TN_9580,0.217793
GemmTunableOp_Half_TN,tn_28672_1705_4096,Gemm_Hipblaslt_TN_9184,0.727982
GemmTunableOp_Half_TN,tn_28672_7823_4096,Gemm_Hipblaslt_TN_159,3.04349
GemmTunableOp_Half_TN,tn_28672_7937_4096,Gemm_Hipblaslt_TN_159,3.1192
GemmTunableOp_Half_TN,tn_28672_2722_4096,Gemm_Hipblaslt_TN_9827,1.16152
GemmTunableOp_Half_TN,tn_6144_865_4096,Gemm_Hipblaslt_TN_9253,0.0903165
GemmTunableOp_Half_TN,tn_28672_1893_4096,Gemm_Hipblaslt_TN_9684,0.79311
GemmTunableOp_Half_TN,tn_4096_1798_4096,Gemm_Hipblaslt_TN_9645,0.118038
GemmTunableOp_Half_TN,tn_6144_862_4096,Gemm_Rocblas_621286778,0.0873173
GemmTunableOp_Half_TN,tn_28672_890_4096,Gemm_Hipblaslt_TN_9683,0.385884
GemmTunableOp_Half_TN,tn_6144_884_4096,Gemm_Hipblaslt_TN_9253,0.0915071
GemmTunableOp_Half_TN,tn_28672_899_4096,Gemm_Hipblaslt_TN_9683,0.385847
GemmTunableOp_Half_TN,tn_4096_802_14336,Gemm_Hipblaslt_TN_9147,0.213471
GemmTunableOp_Half_TN,tn_4096_7798_14336,Gemm_Hipblaslt_TN_9749,1.58561
GemmTunableOp_Half_TN,tn_4096_2681_14336,Gemm_Hipblaslt_TN_9657,0.539255
GemmTunableOp_Half_TN,tn_28672_977_4096,Gemm_Hipblaslt_TN_9716,0.431061
GemmTunableOp_Half_TN,tn_4096_1835_14336,Gemm_Hipblaslt_TN_9137,0.403666
GemmTunableOp_Half_TN,tn_28672_851_4096,Gemm_Hipblaslt_TN_9683,0.380544
GemmTunableOp_Half_TN,tn_28672_807_4096,Gemm_Hipblaslt_TN_9684,0.375241
GemmTunableOp_Half_TN,tn_8192_1276_28672,Gemm_Hipblaslt_TN_9774,1.19378
GemmTunableOp_Half_TN,tn_4096_8069_14336,Gemm_Hipblaslt_TN_9815,1.62784
GemmTunableOp_Half_TN,tn_28672_208_4096,Gemm_Hipblaslt_TN_9267,0.109963
GemmTunableOp_Half_TN,tn_4096_959_4096,Gemm_Hipblaslt_TN_9604,0.0692888
GemmTunableOp_Half_TN,tn_4096_956_14336,Gemm_Hipblaslt_TN_9608,0.23386
GemmTunableOp_Half_TN,tn_4096_8054_4096,Gemm_Hipblaslt_TN_9914,0.441268
GemmTunableOp_Half_TN,tn_28672_1742_4096,Gemm_Hipblaslt_TN_9191,0.730374
GemmTunableOp_Half_TN,tn_4096_7944_4096,Gemm_Hipblaslt_TN_9903,0.43924
GemmTunableOp_Half_TN,tn_57344_2274_8192,Default,3.96841
GemmTunableOp_Half_TN,tn_4096_889_4096,Gemm_Hipblaslt_TN_9634,0.0663532
GemmTunableOp_Half_TN,tn_28672_3352_4096,Gemm_Hipblaslt_TN_9827,1.36681
GemmTunableOp_Half_TN,tn_4096_851_4096,Gemm_Hipblaslt_TN_9604,0.0647569
GemmTunableOp_Half_TN,tn_6144_1813_4096,Gemm_Hipblaslt_TN_9690,0.163411
GemmTunableOp_Half_TN,tn_28672_3662_4096,Gemm_Hipblaslt_TN_9827,1.48792
GemmTunableOp_Half_TN,tn_4096_2560_4096,Gemm_Rocblas_621294426,0.152837
GemmTunableOp_Half_TN,tn_6144_879_4096,Gemm_Hipblaslt_TN_9253,0.0915934
GemmTunableOp_Half_TN,tn_4096_1883_4096,Gemm_Hipblaslt_TN_9645,0.120044
GemmTunableOp_Half_TN,tn_6144_1672_4096,Gemm_Rocblas_621294495,0.154565
GemmTunableOp_Half_TN,tn_4096_2785_14336,Gemm_Hipblaslt_TN_9799,0.563628
GemmTunableOp_Half_TN,tn_28672_942_4096,Gemm_Hipblaslt_TN_9683,0.390588
GemmTunableOp_Half_TN,tn_28672_895_4096,Gemm_Hipblaslt_TN_9683,0.385431
GemmTunableOp_Half_TN,tn_4096_2648_14336,Gemm_Hipblaslt_TN_9799,0.54171
GemmTunableOp_Half_TN,tn_8192_3971_28672,Gemm_Rocblas_621294648,3.399
GemmTunableOp_Half_TN,tn_4096_1880_4096,Gemm_Hipblaslt_TN_9645,0.121233
GemmTunableOp_Half_TN,tn_4096_1880_14336,Gemm_Hipblaslt_TN_9134,0.410205
GemmTunableOp_Half_TN,tn_28672_868_4096,Gemm_Hipblaslt_TN_9684,0.381995
GemmTunableOp_Half_TN,tn_57344_100_8192,Gemm_Rocblas_621286477,0.334971
GemmTunableOp_Half_TN,tn_28672_923_4096,Gemm_Hipblaslt_TN_9683,0.388515
GemmTunableOp_Half_TN,tn_8192_2032_28672,Gemm_Hipblaslt_TN_9840,1.76647
GemmTunableOp_Half_TN,tn_8192_3290_28672,Gemm_Hipblaslt_TN_9732,2.89039
GemmTunableOp_Half_TN,tn_4096_812_4096,Gemm_Hipblaslt_TN_9170,0.0639044
GemmTunableOp_Half_TN,tn_28672_168_4096,Gemm_Hipblaslt_TN_7286,0.0957268
GemmTunableOp_Half_TN,tn_4096_8049_4096,Gemm_Hipblaslt_TN_9959,0.444222
GemmTunableOp_Half_TN,tn_6144_812_4096,Gemm_Rocblas_621294520,0.0869487
GemmTunableOp_Half_TN,tn_6144_877_4096,Gemm_Hipblaslt_TN_9253,0.0902337
GemmTunableOp_Half_TN,tn_6144_8069_4096,Gemm_Rocblas_621294435,0.6716
GemmTunableOp_Half_TN,tn_4096_888_14336,Gemm_Hipblaslt_TN_9580,0.220021
GemmTunableOp_Half_TN,tn_4096_901_4096,Gemm_Hipblaslt_TN_9604,0.0666925
GemmTunableOp_Half_TN,tn_4096_1817_14336,Gemm_Hipblaslt_TN_9134,0.403606
GemmTunableOp_Half_TN,tn_128256_178_4096,Gemm_Hipblaslt_TN_9683,0.514753
GemmTunableOp_Half_TN,tn_4096_951_14336,Gemm_Hipblaslt_TN_9634,0.233188
GemmTunableOp_Half_TN,tn_128256_96_4096,Gemm_Hipblaslt_TN_9057,0.386146
GemmTunableOp_Half_TN,tn_4096_821_14336,Gemm_Hipblaslt_TN_9158,0.212697
GemmTunableOp_Half_TN,tn_6144_892_4096,Gemm_Hipblaslt_TN_9253,0.0910151
GemmTunableOp_Half_TN,tn_57344_4091_8192,Gemm_Hipblaslt_TN_9963,6.66673
GemmTunableOp_Half_TN,tn_4096_3571_4096,Gemm_Hipblaslt_TN_9697,0.199419
GemmTunableOp_Half_TN,tn_4096_3569_14336,Gemm_Hipblaslt_TN_9682,0.684041
GemmTunableOp_Half_TN,tn_4096_919_4096,Gemm_Hipblaslt_TN_9576,0.0685517
GemmTunableOp_Half_TN,tn_4096_2592_4096,Gemm_Hipblaslt_TN_9690,0.15857
GemmTunableOp_Half_TN,tn_8192_97_28672,Gemm_Hipblaslt_TN_8378,0.19223
GemmTunableOp_Half_TN,tn_4096_64_4096,Gemm_Rocblas_621294227,0.012634
GemmTunableOp_Half_TN,tn_57344_1329_8192,Gemm_Hipblaslt_TN_9827,2.36592
GemmTunableOp_Half_TN,tn_6144_815_4096,Gemm_Rocblas_621294520,0.0863798
GemmTunableOp_Half_TN,tn_4096_849_4096,Gemm_Hipblaslt_TN_9604,0.0654103
GemmTunableOp_Half_TN,tn_6144_2592_4096,Gemm_Hipblaslt_TN_9827,0.215961
GemmTunableOp_Half_TN,tn_4096_1649_4096,Gemm_Hipblaslt_TN_9616,0.105876
GemmTunableOp_Half_TN,tn_4096_7967_4096,Gemm_Hipblaslt_TN_9903,0.439827
GemmTunableOp_Half_TN,tn_28672_943_4096,Gemm_Hipblaslt_TN_9684,0.391273
GemmTunableOp_Half_TN,tn_4096_1841_14336,Gemm_Hipblaslt_TN_9268,0.403897
GemmTunableOp_Half_TN,tn_28672_2860_4096,Gemm_Hipblaslt_TN_9827,1.16586
GemmTunableOp_Half_TN,tn_6144_2537_4096,Gemm_Hipblaslt_TN_9184,0.214335
GemmTunableOp_Half_TN,tn_4096_942_4096,Gemm_Hipblaslt_TN_9604,0.0690352
GemmTunableOp_Half_TN,tn_4096_857_14336,Gemm_Hipblaslt_TN_9580,0.218037
GemmTunableOp_Half_TN,tn_4096_1883_14336,Gemm_Hipblaslt_TN_9620,0.410579
GemmTunableOp_Half_TN,tn_4096_845_4096,Gemm_Hipblaslt_TN_9634,0.0647379
GemmTunableOp_Half_TN,tn_4096_1705_4096,Gemm_Hipblaslt_TN_9607,0.105285
GemmTunableOp_Half_TN,tn_10240_1264_8192,Gemm_Hipblaslt_TN_9192,0.352176
GemmTunableOp_Half_TN,tn_6144_911_4096,Gemm_Hipblaslt_TN_9613,0.0925855
GemmTunableOp_Half_TN,tn_28672_184_4096,Gemm_Hipblaslt_TN_9265,0.0992919
GemmTunableOp_Half_TN,tn_4096_899_14336,Gemm_Hipblaslt_TN_9604,0.228835
GemmTunableOp_Half_TN,tn_4096_1729_14336,Gemm_Hipblaslt_TN_9645,0.390766
GemmTunableOp_Half_TN,tn_10240_125_8192,Gemm_Rocblas_621294504,0.0625832
GemmTunableOp_Half_TN,tn_128256_135_4096,Gemm_Hipblaslt_TN_9108,0.467101
GemmTunableOp_Half_TN,tn_4096_898_14336,Gemm_Hipblaslt_TN_9604,0.228689
GemmTunableOp_Half_TN,tn_4096_1831_14336,Gemm_Hipblaslt_TN_9137,0.403843
GemmTunableOp_Half_TN,tn_6144_1719_4096,Gemm_Rocblas_621294495,0.155657
GemmTunableOp_Half_TN,tn_6144_829_4096,Gemm_Rocblas_621294520,0.0870866
GemmTunableOp_Half_TN,tn_4096_959_14336,Gemm_Hipblaslt_TN_9604,0.234105
GemmTunableOp_Half_TN,tn_128256_93_4096,Gemm_Hipblaslt_TN_9057,0.393262
GemmTunableOp_Half_TN,tn_28672_1763_4096,Gemm_Rocblas_621286678,0.73688
GemmStridedBatchedTunableOp_Half_TN,tn_822_822_128_B_32,Gemm_Rocblas_621294635,0.0410792
GemmStridedBatchedTunableOp_Half_TN,tn_957_957_128_B_32,Gemm_Hipblaslt_TN_7519,0.0511881
GemmStridedBatchedTunableOp_Half_TN,tn_904_904_128_B_32,Gemm_Hipblaslt_TN_149,0.0451742
GemmStridedBatchedTunableOp_Half_TN,tn_836_836_128_B_32,Gemm_Rocblas_621294635,0.0422505
GemmStridedBatchedTunableOp_Half_TN,tn_945_945_128_B_32,Gemm_Hipblaslt_TN_7519,0.0502257
GemmStridedBatchedTunableOp_Half_TN,tn_952_952_128_B_32,Gemm_Hipblaslt_TN_153,0.0466165
GemmStridedBatchedTunableOp_Half_TN,tn_846_846_128_B_32,Gemm_Rocblas_621294635,0.0425158
GemmStridedBatchedTunableOp_Half_TN,tn_886_886_128_B_32,Gemm_Hipblaslt_TN_7483,0.0455483
GemmStridedBatchedTunableOp_Half_TN,tn_924_924_128_B_32,Gemm_Rocblas_621294635,0.04663
GemmStridedBatchedTunableOp_Half_TN,tn_915_915_128_B_32,Gemm_Hipblaslt_TN_6879,0.0495118
GemmStridedBatchedTunableOp_Half_TN,tn_899_899_128_B_32,Gemm_Hipblaslt_TN_7483,0.0487911
GemmStridedBatchedTunableOp_Half_TN,tn_1153_1153_128_B_64,Gemm_Hipblaslt_TN_6879,0.122671
GemmStridedBatchedTunableOp_Half_TN,tn_1404_1404_128_B_64,Gemm_Rocblas_621294109,0.162763
GemmStridedBatchedTunableOp_Half_TN,tn_1296_1296_128_B_64,Gemm_Rocblas_621294551,0.137509
GemmStridedBatchedTunableOp_Half_TN,tn_1128_1128_128_B_64,Gemm_Rocblas_621294725,0.111388
GemmStridedBatchedTunableOp_Half_TN,tn_906_906_128_B_32,Gemm_Hipblaslt_TN_7519,0.0478284
GemmStridedBatchedTunableOp_Half_TN,tn_1425_1425_128_B_64,Gemm_Rocblas_621286397,0.171056
GemmStridedBatchedTunableOp_Half_TN,tn_1455_1455_128_B_64,Gemm_Rocblas_621294106,0.179208
GemmStridedBatchedTunableOp_Half_TN,tn_824_824_128_B_32,Gemm_Hipblaslt_TN_150,0.0379772
GemmStridedBatchedTunableOp_Half_TN,tn_1224_1224_128_B_64,Gemm_Rocblas_621294106,0.12797
GemmStridedBatchedTunableOp_Half_TN,tn_905_905_128_B_32,Gemm_Rocblas_621294635,0.0459029
GemmStridedBatchedTunableOp_Half_TN,tn_811_811_128_B_32,Gemm_Rocblas_621294635,0.0392756
GemmStridedBatchedTunableOp_Half_TN,tn_958_958_128_B_32,Gemm_Hipblaslt_TN_7519,0.0501096
GemmStridedBatchedTunableOp_Half_TN,tn_935_935_128_B_32,Gemm_Hipblaslt_TN_7519,0.049235
GemmStridedBatchedTunableOp_Half_TN,tn_850_850_128_B_32,Gemm_Hipblaslt_TN_7483,0.0439101
GemmStridedBatchedTunableOp_Half_TN,tn_847_847_128_B_32,Gemm_Hipblaslt_TN_7059,0.0441504
GemmStridedBatchedTunableOp_Half_TN,tn_790_790_128_B_32,Gemm_Rocblas_621294635,0.0388115
GemmStridedBatchedTunableOp_Half_TN,tn_1064_1064_128_B_64,Gemm_Rocblas_621294106,0.104837
GemmStridedBatchedTunableOp_Half_TN,tn_1010_1010_128_B_64,Gemm_Hipblaslt_TN_6879,0.0968047
GemmStridedBatchedTunableOp_Half_TN,tn_1009_1009_128_B_64,Gemm_Hipblaslt_TN_6935,0.100063
GemmStridedBatchedTunableOp_Half_TN,tn_927_927_128_B_32,Gemm_Rocblas_621294635,0.0472271
GemmStridedBatchedTunableOp_Half_TN,tn_1392_1392_128_B_64,Gemm_Rocblas_621286412,0.146959
GemmStridedBatchedTunableOp_Half_TN,tn_881_881_128_B_32,Gemm_Hipblaslt_TN_7483,0.0452337
GemmStridedBatchedTunableOp_Half_TN,tn_1076_1076_128_B_64,Gemm_Rocblas_621294725,0.105763
GemmStridedBatchedTunableOp_Half_TN,tn_1104_1104_128_B_64,Gemm_Rocblas_621294109,0.1029
GemmStridedBatchedTunableOp_Half_TN,tn_1367_1367_128_B_64,Gemm_Rocblas_621286412,0.158206
GemmStridedBatchedTunableOp_Half_TN,tn_1032_1032_128_B_64,Gemm_Rocblas_621294725,0.100225
GemmStridedBatchedTunableOp_Half_TN,tn_1249_1249_128_B_64,Gemm_Hipblaslt_TN_6879,0.134695
GemmStridedBatchedTunableOp_Half_TN,tn_972_972_128_B_32,Gemm_Rocblas_621294550,0.0519869
GemmStridedBatchedTunableOp_Half_TN,tn_1038_1038_128_B_64,Gemm_Rocblas_621294725,0.101012
GemmStridedBatchedTunableOp_Half_TN,tn_1350_1350_128_B_64,Gemm_Rocblas_621294109,0.154128
GemmStridedBatchedTunableOp_Half_TN,tn_902_902_128_B_32,Gemm_Rocblas_621294635,0.0470626
GemmStridedBatchedTunableOp_Half_TN,tn_816_816_128_B_32,Gemm_Hipblaslt_TN_150,0.036283
GemmStridedBatchedTunableOp_Half_TN,tn_818_818_128_B_32,Gemm_Rocblas_621294635,0.0407931
GemmStridedBatchedTunableOp_Half_TN,tn_16_16_128_B_64,Gemm_Rocblas_621286441,0.00624292
GemmStridedBatchedTunableOp_Half_TN,tn_1368_1368_128_B_64,Gemm_Rocblas_621294109,0.150676
GemmStridedBatchedTunableOp_Half_TN,tn_917_917_128_B_32,Gemm_Rocblas_621294635,0.049248
GemmStridedBatchedTunableOp_Half_TN,tn_938_938_128_B_32,Gemm_Rocblas_621294635,0.0503689
GemmStridedBatchedTunableOp_Half_TN,tn_976_976_128_B_32,Gemm_Hipblaslt_TN_153,0.0453287
GemmStridedBatchedTunableOp_Half_TN,tn_828_828_128_B_32,Gemm_Rocblas_621294635,0.0421451
GemmStridedBatchedTunableOp_Half_TN,tn_835_835_128_B_32,Gemm_Hipblaslt_TN_7059,0.0431095
GemmStridedBatchedTunableOp_Half_TN,tn_1256_1256_128_B_64,Gemm_Rocblas_621294106,0.132538
GemmStridedBatchedTunableOp_Half_TN,tn_894_894_128_B_32,Gemm_Rocblas_621294516,0.0464723
GemmStridedBatchedTunableOp_Half_TN,tn_978_978_128_B_32,Gemm_Rocblas_621294550,0.0521042
GemmStridedBatchedTunableOp_Half_TN,tn_1041_1041_128_B_64,Gemm_Rocblas_621294725,0.103163
GemmStridedBatchedTunableOp_Half_TN,tn_884_884_128_B_32,Gemm_Rocblas_621286982,0.0458608
GemmStridedBatchedTunableOp_Half_TN,tn_907_907_128_B_32,Gemm_Rocblas_621294635,0.0474457
GemmStridedBatchedTunableOp_Half_TN,tn_910_910_128_B_32,Gemm_Rocblas_621294635,0.0482885
GemmStridedBatchedTunableOp_Half_TN,tn_968_968_128_B_32,Gemm_Hipblaslt_TN_149,0.0477226
GemmStridedBatchedTunableOp_Half_TN,tn_786_786_128_B_32,Gemm_Rocblas_621294635,0.0387302
GemmStridedBatchedTunableOp_Half_TN,tn_848_848_128_B_32,Gemm_Hipblaslt_TN_150,0.0369651
GemmStridedBatchedTunableOp_Half_TN,tn_1022_1022_128_B_64,Gemm_Hipblaslt_TN_6879,0.0978995
GemmStridedBatchedTunableOp_Half_TN,tn_842_842_128_B_32,Gemm_Rocblas_621294635,0.0415512
GemmStridedBatchedTunableOp_Half_TN,tn_815_815_128_B_32,Gemm_Rocblas_621294635,0.0400046
GemmStridedBatchedTunableOp_Half_TN,tn_843_843_128_B_32,Gemm_Rocblas_621286982,0.0438533
GemmStridedBatchedTunableOp_Half_TN,tn_1008_1008_128_B_64,Gemm_Rocblas_621294763,0.0898633
GemmStridedBatchedTunableOp_Half_TN,tn_865_865_128_B_32,Gemm_Hipblaslt_TN_7483,0.0458451
GemmStridedBatchedTunableOp_Half_TN,tn_825_825_128_B_32,Gemm_Rocblas_621294635,0.0404651
GemmStridedBatchedTunableOp_Half_TN,tn_863_863_128_B_32,Gemm_Hipblaslt_TN_7059,0.044889
GemmStridedBatchedTunableOp_Half_TN,tn_1297_1297_128_B_64,Gemm_Rocblas_621294109,0.148006
GemmStridedBatchedTunableOp_Half_TN,tn_923_923_128_B_32,Gemm_Rocblas_621294635,0.0498767
GemmStridedBatchedTunableOp_Half_TN,tn_961_961_128_B_32,Gemm_Hipblaslt_TN_7519,0.051172
GemmStridedBatchedTunableOp_Half_TN,tn_874_874_128_B_32,Gemm_Rocblas_621286396,0.0460892
GemmStridedBatchedTunableOp_Half_TN,tn_897_897_128_B_32,Gemm_Hipblaslt_TN_7519,0.0477969
GemmStridedBatchedTunableOp_Half_TN,tn_983_983_128_B_32,Gemm_Rocblas_621286794,0.0536484
GemmStridedBatchedTunableOp_Half_TN,tn_1441_1441_128_B_64,Gemm_Rocblas_621286397,0.176501
GemmStridedBatchedTunableOp_Half_TN,tn_931_931_128_B_32,Gemm_Hipblaslt_TN_7519,0.048386
