Gemm_Tune/afo_tune_device_0_full.csv
Validator,PT_VERSION,2.4.0
Validator,ROCM_VERSION,6.1.0.0-82-5fabb4c
Validator,HIPBLASLT_VERSION,0.7.0-1549b021
Validator,GCN_ARCH_NAME,gfx942:sramecc+:xnack-
Validator,ROCBLAS_VERSION,4.1.0-cefa4a9b-dirty
GemmTunableOp_Half_TN,tn_28672_4000_8192,Gemm_Rocblas_621294634,3.29509
GemmTunableOp_Half_TN,tn_8192_232_4096,Gemm_Rocblas_621286469,0.0419734
GemmTunableOp_Half_TN,tn_16000_256_8192,Gemm_Hipblaslt_TN_9583,0.163047
GemmTunableOp_Half_TN,tn_8192_4000_14336,Gemm_Hipblaslt_TN_9738,1.67379
GemmStridedBatchedTunableOp_Half_TN,tn_2000_2000_128_B_32,Gemm_Rocblas_621286397,0.151745
GemmTunableOp_Half_TN,tn_57344_2096_8192,Gemm_Hipblaslt_TN_156,3.92737
GemmTunableOp_Half_TN,tn_8192_67_28672,Gemm_Hipblaslt_TN_8899,0.170742
GemmTunableOp_Half_TN,tn_57344_2191_8192,Gemm_Hipblaslt_TN_9841,3.9897
GemmTunableOp_Half_TN,tn_10240_28_8192,Gemm_Hipblaslt_TN_9415,0.0403079
GemmTunableOp_Half_TN,tn_10240_2160_8192,Gemm_Hipblaslt_TN_9182,0.626074
GemmTunableOp_Half_TN,tn_57344_4096_8192,Gemm_Hipblaslt_TN_9758,6.61928
GemmTunableOp_Half_TN,tn_32000_65_8192,Gemm_Hipblaslt_TN_9479,0.183831
GemmTunableOp_Half_TN,tn_10240_2239_8192,Gemm_Hipblaslt_TN_9211,0.636046
GemmTunableOp_Half_TN,tn_10240_2129_8192,Gemm_Hipblaslt_TN_9209,0.623886
GemmTunableOp_Half_TN,tn_57344_2315_8192,Gemm_Hipblaslt_TN_9716,4.39373
GemmTunableOp_Half_TN,tn_57344_2284_8192,Gemm_Rocblas_621294543,3.9991
GemmTunableOp_Half_TN,tn_8192_31_28672,Gemm_Rocblas_621286354,0.127873
GemmTunableOp_Half_TN,tn_8192_2315_28672,Gemm_Hipblaslt_TN_9649,2.26267
GemmTunableOp_Half_TN,tn_32000_56_8192,Gemm_Rocblas_621294203,0.157207
GemmTunableOp_Half_TN,tn_10240_4049_8192,Gemm_Hipblaslt_TN_9743,1.12477
GemmTunableOp_Half_TN,tn_57344_55_8192,Gemm_Hipblaslt_TN_9459,0.297329
GemmTunableOp_Half_TN,tn_8192_2385_28672,Gemm_Hipblaslt_TN_9649,2.30161
GemmTunableOp_Half_TN,tn_57344_2417_8192,Gemm_Hipblaslt_TN_9852,4.3833
GemmTunableOp_Half_TN,tn_8192_62_28672,Gemm_Rocblas_621294228,0.143156
GemmTunableOp_Half_TN,tn_8192_2255_28672,Gemm_Hipblaslt_TN_9649,2.20655
GemmTunableOp_Half_TN,tn_57344_2385_8192,Gemm_Hipblaslt_TN_9716,4.45746
GemmTunableOp_Half_TN,tn_57344_2017_8192,Gemm_Hipblaslt_TN_9840,3.50726
GemmTunableOp_Half_TN,tn_8192_2208_28672,Gemm_Hipblaslt_TN_9762,2.08151
GemmTunableOp_Half_TN,tn_8192_4081_8192,Gemm_Hipblaslt_TN_9184,0.880343
GemmTunableOp_Half_TN,tn_10240_2270_8192,Gemm_Rocblas_621294317,0.652952
GemmTunableOp_Half_TN,tn_8192_2082_8192,Gemm_Hipblaslt_TN_9742,0.498407
GemmTunableOp_Half_TN,tn_57344_57_8192,Gemm_Hipblaslt_TN_7491,0.299081
GemmTunableOp_Half_TN,tn_8192_2304_28672,Gemm_Hipblaslt_TN_9774,2.26126
GemmTunableOp_Half_TN,tn_10240_65_8192,Gemm_Hipblaslt_TN_8095,0.049408
GemmTunableOp_Half_TN,tn_57344_4049_8192,Gemm_Hipblaslt_TN_9963,6.63198
GemmTunableOp_Half_TN,tn_57344_2129_8192,Gemm_Hipblaslt_TN_9827,3.95052
GemmTunableOp_Half_TN,tn_8192_2113_8192,Gemm_Hipblaslt_TN_9742,0.499453
GemmTunableOp_Half_TN,tn_8192_2049_28672,Gemm_Hipblaslt_TN_9765,2.0841
GemmTunableOp_Half_TN,tn_57344_2158_8192,Gemm_Hipblaslt_TN_9841,3.99803
GemmTunableOp_Half_TN,tn_57344_4066_8192,Gemm_Hipblaslt_TN_9758,6.65605
GemmTunableOp_Half_TN,tn_10240_2082_8192,Gemm_Hipblaslt_TN_9209,0.620679
GemmTunableOp_Half_TN,tn_8192_2413_28672,Gemm_Hipblaslt_TN_9771,2.31662
GemmTunableOp_Half_TN,tn_10240_2208_8192,Gemm_Hipblaslt_TN_9182,0.629955
GemmTunableOp_Half_TN,tn_8192_2207_28672,Gemm_Hipblaslt_TN_9762,2.0806
GemmTunableOp_Half_TN,tn_8192_2161_8192,Gemm_Hipblaslt_TN_9742,0.504286
GemmTunableOp_Half_TN,tn_8192_2385_8192,Gemm_Hipblaslt_TN_9208,0.547893
GemmTunableOp_Half_TN,tn_10240_2127_8192,Gemm_Hipblaslt_TN_9209,0.621649
GemmTunableOp_Half_TN,tn_57344_4033_8192,Gemm_Rocblas_621294643,6.61371
GemmTunableOp_Half_TN,tn_57344_68_8192,Gemm_Rocblas_621294520,0.309038
GemmTunableOp_Half_TN,tn_8192_2161_28672,Gemm_Hipblaslt_TN_9762,2.0337
GemmTunableOp_Half_TN,tn_10240_2178_8192,Gemm_Hipblaslt_TN_9209,0.627753
GemmTunableOp_Half_TN,tn_8192_2192_28672,Gemm_Hipblaslt_TN_9762,2.06322
GemmTunableOp_Half_TN,tn_10240_67_8192,Gemm_Hipblaslt_TN_9304,0.0492568
GemmTunableOp_Half_TN,tn_57344_2049_8192,Gemm_Hipblaslt_TN_9827,3.92229
GemmTunableOp_Half_TN,tn_8192_2270_28672,Gemm_Hipblaslt_TN_9649,2.23767
GemmTunableOp_Half_TN,tn_32000_68_8192,Gemm_Hipblaslt_TN_9479,0.183112
GemmTunableOp_Half_TN,tn_57344_28_8192,Gemm_Hipblaslt_TN_9424,0.246631
GemmTunableOp_Half_TN,tn_8192_2000_8192,Gemm_Hipblaslt_TN_9202,0.424681
GemmTunableOp_Half_TN,tn_57344_2082_8192,Gemm_Hipblaslt_TN_9827,3.96136
GemmTunableOp_Half_TN,tn_57344_2413_8192,Gemm_Hipblaslt_TN_9800,4.39272
GemmTunableOp_Half_TN,tn_32000_57_8192,Gemm_Rocblas_621286466,0.157747
GemmTunableOp_Half_TN,tn_57344_4050_8192,Gemm_Hipblaslt_TN_9758,6.61453
GemmTunableOp_Half_TN,tn_57344_2081_8192,Gemm_Hipblaslt_TN_9827,3.96586
GemmTunableOp_Half_TN,tn_8192_2415_8192,Gemm_Hipblaslt_TN_9274,0.543291
GemmTunableOp_Half_TN,tn_8192_59_8192,Gemm_Hipblaslt_TN_7484,0.0389573
GemmTunableOp_Half_TN,tn_57344_2161_8192,Gemm_Hipblaslt_TN_9733,4.01283
GemmTunableOp_Half_TN,tn_8192_60_8192,Gemm_Hipblaslt_TN_7484,0.039191
GemmTunableOp_Half_TN,tn_8192_2079_28672,Gemm_Hipblaslt_TN_9650,2.08308
GemmTunableOp_Half_TN,tn_32000_59_8192,Gemm_Hipblaslt_TN_9463,0.15898
GemmTunableOp_Half_TN,tn_10240_2397_8192,Gemm_Hipblaslt_TN_9209,0.667151
GemmTunableOp_Half_TN,tn_57344_2177_8192,Gemm_Hipblaslt_TN_9827,3.99275
GemmTunableOp_Half_TN,tn_10240_2079_8192,Gemm_Hipblaslt_TN_9209,0.608137
GemmTunableOp_Half_TN,tn_10240_2289_8192,Gemm_Rocblas_621286581,0.65422
GemmTunableOp_Half_TN,tn_57344_2465_8192,Gemm_Rocblas_621294015,4.40874
GemmTunableOp_Half_TN,tn_8192_66_28672,Gemm_Hipblaslt_TN_8899,0.16967
GemmTunableOp_Half_TN,tn_57344_2289_8192,Gemm_Hipblaslt_TN_9757,4.06897
GemmTunableOp_Half_TN,tn_57344_56_8192,Gemm_Rocblas_621294203,0.297841
GemmTunableOp_Half_TN,tn_8192_59_28672,Gemm_Rocblas_621294228,0.146126
GemmStridedBatchedTunableOp_Half_TN,tn_2113_2113_128_B_64,Gemm_Rocblas_621294106,0.362799
GemmStridedBatchedTunableOp_Half_TN,tn_2397_2397_128_B_64,Gemm_Rocblas_621294106,0.459517
GemmStridedBatchedTunableOp_Half_TN,tn_2304_2304_128_B_64,Gemm_Rocblas_621294551,0.34973
GemmStridedBatchedTunableOp_Half_TN,tn_2032_2032_128_B_64,Gemm_Hipblaslt_TN_157,0.33286
GemmStridedBatchedTunableOp_Half_TN,tn_2082_2082_128_B_64,Gemm_Rocblas_621294106,0.349689
GemmStridedBatchedTunableOp_Half_TN,tn_2033_2033_128_B_64,Gemm_Hipblaslt_TN_6950,0.346709
GemmStridedBatchedTunableOp_Half_TN,tn_2177_2177_128_B_64,Gemm_Rocblas_621294106,0.386267
GemmStridedBatchedTunableOp_Half_TN,tn_2465_2465_128_B_64,Gemm_Rocblas_621294106,0.489378
GemmStridedBatchedTunableOp_Half_TN,tn_2208_2208_128_B_64,Gemm_Hipblaslt_TN_158,0.358908
GemmStridedBatchedTunableOp_Half_TN,tn_2159_2159_128_B_64,Gemm_Rocblas_621294106,0.379644
GemmStridedBatchedTunableOp_Half_TN,tn_2225_2225_128_B_64,Gemm_Rocblas_621294106,0.396038
GemmStridedBatchedTunableOp_Half_TN,tn_2257_2257_128_B_64,Gemm_Rocblas_621294106,0.413617
GemmStridedBatchedTunableOp_Half_TN,tn_2000_2000_128_B_64,Gemm_Hipblaslt_TN_9841,0.321101
GemmStridedBatchedTunableOp_Half_TN,tn_2190_2190_128_B_64,Gemm_Rocblas_621294106,0.390053
GemmTunableOp_Half_TN,tn_5120_4000_8192,Gemm_Hipblaslt_TN_9649,0.589886
GemmTunableOp_Half_TN,tn_28672_256_8192,Gemm_Hipblaslt_TN_9540,0.295412
GemmTunableOp_Half_TN,tn_5120_4096_8192,Gemm_Rocblas_621294392,0.603401
GemmTunableOp_Half_TN,tn_5120_232_8192,Gemm_Rocblas_621294504,0.0575383
GemmStridedBatchedTunableOp_Half_TN,tn_1000_1000_128_B_32,Gemm_Hipblaslt_TN_149,0.0443002
GemmTunableOp_Half_TN,tn_8192_3206_28672,Gemm_Hipblaslt_TN_9731,2.86292
GemmTunableOp_Half_TN,tn_32000_22_8192,Gemm_Rocblas_621294578,0.148126
GemmTunableOp_Half_TN,tn_10240_3425_8192,Gemm_Hipblaslt_TN_9799,0.987948
GemmTunableOp_Half_TN,tn_10240_121_8192,Gemm_Hipblaslt_TN_8892,0.061312
GemmTunableOp_Half_TN,tn_10240_101_8192,Gemm_Rocblas_621294504,0.0579524
GemmTunableOp_Half_TN,tn_8192_1233_28672,Gemm_Hipblaslt_TN_9774,1.172
GemmTunableOp_Half_TN,tn_32000_16_8192,Gemm_Rocblas_621286319,0.138391
GemmTunableOp_Half_TN,tn_8192_1233_8192,Gemm_Hipblaslt_TN_9182,0.298218
GemmTunableOp_Half_TN,tn_57344_1248_8192,Gemm_Hipblaslt_TN_9783,2.32911
GemmTunableOp_Half_TN,tn_10240_1276_8192,Gemm_Hipblaslt_TN_9192,0.357932
GemmTunableOp_Half_TN,tn_10240_1296_8192,Gemm_Hipblaslt_TN_9697,0.357307
GemmTunableOp_Half_TN,tn_57344_23_8192,Gemm_Rocblas_621294194,0.264892
GemmTunableOp_Half_TN,tn_57344_3162_8192,Gemm_Hipblaslt_TN_9816,5.50549
GemmTunableOp_Half_TN,tn_8192_1121_8192,Gemm_Hipblaslt_TN_9207,0.26232
GemmTunableOp_Half_TN,tn_57344_1168_8192,Gemm_Hipblaslt_TN_9827,2.27444
GemmTunableOp_Half_TN,tn_8192_1208_28672,Gemm_Hipblaslt_TN_9774,1.17172
GemmTunableOp_Half_TN,tn_57344_2274_8192,Gemm_Hipblaslt_TN_9734,4.06523
GemmTunableOp_Half_TN,tn_8192_1321_28672,Gemm_Hipblaslt_TN_9774,1.21152
GemmTunableOp_Half_TN,tn_57344_1112_8192,Gemm_Hipblaslt_TN_9774,2.05476
GemmTunableOp_Half_TN,tn_8192_14_8192,Gemm_Hipblaslt_TN_9392,0.030689
GemmTunableOp_Half_TN,tn_8192_126_28672,Gemm_Hipblaslt_TN_8378,0.201827
GemmTunableOp_Half_TN,tn_8192_1201_28672,Gemm_Hipblaslt_TN_9774,1.164
GemmTunableOp_Half_TN,tn_10240_3451_8192,Gemm_Hipblaslt_TN_9674,0.992147
GemmTunableOp_Half_TN,tn_32000_92_8192,Gemm_Rocblas_621294212,0.192121
GemmTunableOp_Half_TN,tn_57344_3754_8192,Gemm_Hipblaslt_TN_9922,6.40966
GemmTunableOp_Half_TN,tn_10240_113_8192,Gemm_Rocblas_621286764,0.0597835
GemmTunableOp_Half_TN,tn_8192_107_8192,Gemm_Hipblaslt_TN_7544,0.0521501
GemmTunableOp_Half_TN,tn_10240_1297_8192,Gemm_Hipblaslt_TN_9192,0.357414
GemmTunableOp_Half_TN,tn_8192_1360_28672,Gemm_Hipblaslt_TN_9799,1.27205
GemmTunableOp_Half_TN,tn_8192_1360_8192,Gemm_Rocblas_621286683,0.319025
GemmTunableOp_Half_TN,tn_10240_1377_8192,Gemm_Hipblaslt_TN_9278,0.395815
GemmTunableOp_Half_TN,tn_8192_1389_28672,Gemm_Hipblaslt_TN_9799,1.27866
GemmTunableOp_Half_TN,tn_57344_132_8192,Gemm_Hipblaslt_TN_9507,0.395151
GemmTunableOp_Half_TN,tn_10240_1329_8192,Gemm_Hipblaslt_TN_9139,0.361557
GemmTunableOp_Half_TN,tn_8192_1208_8192,Gemm_Hipblaslt_TN_9209,0.2955
GemmTunableOp_Half_TN,tn_8192_3203_28672,Gemm_Hipblaslt_TN_9732,2.87326
GemmTunableOp_Half_TN,tn_8192_1377_8192,Gemm_Hipblaslt_TN_9799,0.320169
GemmTunableOp_Half_TN,tn_57344_2000_8192,Gemm_Hipblaslt_TN_9840,3.48608
GemmTunableOp_Half_TN,tn_10240_2000_8192,Gemm_Hipblaslt_TN_9649,0.58276
GemmTunableOp_Half_TN,tn_8192_2274_8192,Gemm_Hipblaslt_TN_9742,0.512479
GemmTunableOp_Half_TN,tn_10240_2166_8192,Gemm_Hipblaslt_TN_9182,0.629883
GemmTunableOp_Half_TN,tn_8192_1104_28672,Gemm_Hipblaslt_TN_9762,1.07739
GemmTunableOp_Half_TN,tn_8192_111_28672,Gemm_Hipblaslt_TN_8378,0.193754
GemmTunableOp_Half_TN,tn_8192_111_8192,Gemm_Hipblaslt_TN_8891,0.0509529
GemmTunableOp_Half_TN,tn_8192_4083_28672,Gemm_Rocblas_621294658,3.41278
GemmTunableOp_Half_TN,tn_10240_93_8192,Gemm_Hipblaslt_TN_8095,0.053027
GemmTunableOp_Half_TN,tn_32000_91_8192,Gemm_Rocblas_621294212,0.195753
GemmTunableOp_Half_TN,tn_8192_3546_8192,Gemm_Hipblaslt_TN_9677,0.772775
GemmTunableOp_Half_TN,tn_8192_110_8192,Gemm_Hipblaslt_TN_8891,0.0493723
GemmTunableOp_Half_TN,tn_57344_1350_8192,Gemm_Hipblaslt_TN_9830,2.55038
GemmTunableOp_Half_TN,tn_32000_129_8192,Gemm_Hipblaslt_TN_9506,0.236495
GemmTunableOp_Half_TN,tn_8192_3475_8192,Gemm_Hipblaslt_TN_9192,0.767792
GemmTunableOp_Half_TN,tn_10240_1249_8192,Gemm_Hipblaslt_TN_9743,0.352277
GemmTunableOp_Half_TN,tn_8192_1319_28672,Gemm_Hipblaslt_TN_9774,1.20437
GemmTunableOp_Half_TN,tn_57344_12_8192,Gemm_Hipblaslt_TN_9405,0.253979
GemmTunableOp_Half_TN,tn_57344_1374_8192,Gemm_Hipblaslt_TN_9830,2.56532
GemmTunableOp_Half_TN,tn_8192_2639_28672,Gemm_Hipblaslt_TN_9774,2.34689
GemmTunableOp_Half_TN,tn_57344_3379_8192,Gemm_Hipblaslt_TN_159,5.6605
GemmTunableOp_Half_TN,tn_32000_135_8192,Gemm_Hipblaslt_TN_9506,0.238385
GemmTunableOp_Half_TN,tn_8192_3555_8192,Gemm_Hipblaslt_TN_9697,0.772373
GemmTunableOp_Half_TN,tn_10240_3139_8192,Gemm_Hipblaslt_TN_9815,0.866064
GemmTunableOp_Half_TN,tn_8192_3140_8192,Gemm_Hipblaslt_TN_9189,0.710464
GemmTunableOp_Half_TN,tn_10240_13_8192,Gemm_Hipblaslt_TN_9411,0.0370685
GemmTunableOp_Half_TN,tn_8192_3283_28672,Gemm_Hipblaslt_TN_9732,2.87605
GemmTunableOp_Half_TN,tn_10240_3178_8192,Gemm_Hipblaslt_TN_9223,0.867977
GemmTunableOp_Half_TN,tn_57344_1160_8192,Gemm_Hipblaslt_TN_9827,2.27319
GemmTunableOp_Half_TN,tn_57344_3120_8192,Gemm_Hipblaslt_TN_9803,5.48448
GemmTunableOp_Half_TN,tn_32000_127_8192,Gemm_Rocblas_621294212,0.208865
GemmTunableOp_Half_TN,tn_8192_21_28672,Gemm_Rocblas_621294226,0.128864
GemmTunableOp_Half_TN,tn_10240_3482_8192,Gemm_Hipblaslt_TN_9799,0.993983
GemmTunableOp_Half_TN,tn_8192_1276_28672,Gemm_Rocblas_621286579,1.19427
GemmTunableOp_Half_TN,tn_8192_2760_8192,Gemm_Rocblas_621294426,0.640401
GemmTunableOp_Half_TN,tn_8192_2914_8192,Gemm_Rocblas_621294320,0.661242
GemmTunableOp_Half_TN,tn_57344_7_8192,Gemm_Hipblaslt_TN_9405,0.252233
GemmTunableOp_Half_TN,tn_10240_3331_8192,Gemm_Hipblaslt_TN_9815,0.889372
GemmTunableOp_Half_TN,tn_8192_1389_8192,Gemm_Hipblaslt_TN_9674,0.321838
GemmTunableOp_Half_TN,tn_57344_122_8192,Default,0.351052
GemmTunableOp_Half_TN,tn_57344_95_8192,Gemm_Hipblaslt_TN_9478,0.333105
GemmTunableOp_Half_TN,tn_57344_1025_8192,Gemm_Hipblaslt_TN_9841,1.9577
GemmTunableOp_Half_TN,tn_8192_1296_28672,Gemm_Hipblaslt_TN_9774,1.19868
GemmTunableOp_Half_TN,tn_57344_18_8192,Gemm_Rocblas_621286348,0.264097
GemmTunableOp_Half_TN,tn_8192_1249_28672,Gemm_Rocblas_621286579,1.18343
GemmTunableOp_Half_TN,tn_8192_14_28672,Gemm_Rocblas_621294224,0.123434
GemmTunableOp_Half_TN,tn_8192_3235_8192,Gemm_Hipblaslt_TN_9677,0.710094
GemmTunableOp_Half_TN,tn_8192_3619_8192,Gemm_Hipblaslt_TN_9743,0.780459
GemmTunableOp_Half_TN,tn_8192_3206_8192,Gemm_Hipblaslt_TN_9192,0.709996
GemmTunableOp_Half_TN,tn_57344_3715_8192,Gemm_Hipblaslt_TN_9908,6.37549
GemmTunableOp_Half_TN,tn_10240_3555_8192,Gemm_Hipblaslt_TN_9744,1.01429
GemmTunableOp_Half_TN,tn_57344_1000_8192,Gemm_Rocblas_621286801,1.80221
GemmTunableOp_Half_TN,tn_8192_3290_28672,Gemm_Hipblaslt_TN_9684,2.90453
GemmTunableOp_Half_TN,tn_10240_1168_8192,Gemm_Hipblaslt_TN_9697,0.342429
GemmTunableOp_Half_TN,tn_32000_119_8192,Gemm_Rocblas_621286475,0.209632
GemmTunableOp_Half_TN,tn_10240_120_8192,Gemm_Hipblaslt_TN_8892,0.0621913
GemmTunableOp_Half_TN,tn_8192_3785_8192,Gemm_Hipblaslt_TN_9217,0.823607
GemmTunableOp_Half_TN,tn_8192_100_8192,Gemm_Hipblaslt_TN_8891,0.0516247
GemmTunableOp_Half_TN,tn_8192_102_28672,Gemm_Hipblaslt_TN_8378,0.197131
GemmTunableOp_Half_TN,tn_8192_2622_28672,Gemm_Hipblaslt_TN_9774,2.33987
GemmTunableOp_Half_TN,tn_57344_1264_8192,Gemm_Hipblaslt_TN_9841,2.34598
GemmTunableOp_Half_TN,tn_10240_22_8192,Gemm_Hipblaslt_TN_9415,0.0393071
GemmTunableOp_Half_TN,tn_8192_3331_8192,Gemm_Hipblaslt_TN_9697,0.735087
GemmTunableOp_Half_TN,tn_57344_109_8192,Gemm_Rocblas_621286477,0.345704
GemmTunableOp_Half_TN,tn_8192_2692_28672,Gemm_Rocblas_621286568,2.49413
GemmTunableOp_Half_TN,tn_8192_1224_28672,Gemm_Hipblaslt_TN_9774,1.18612
GemmTunableOp_Half_TN,tn_8192_1286_28672,Gemm_Hipblaslt_TN_9774,1.19706
GemmTunableOp_Half_TN,tn_8192_1367_8192,Gemm_Hipblaslt_TN_9799,0.317146
GemmTunableOp_Half_TN,tn_57344_21_8192,Gemm_Rocblas_621286351,0.263805
GemmTunableOp_Half_TN,tn_57344_120_8192,Gemm_Rocblas_621294214,0.351559
GemmTunableOp_Half_TN,tn_32000_17_8192,Gemm_Rocblas_621286350,0.143841
GemmTunableOp_Half_TN,tn_8192_3400_8192,Gemm_Hipblaslt_TN_9187,0.746011
GemmTunableOp_Half_TN,tn_10240_3274_8192,Gemm_Hipblaslt_TN_9815,0.883638
GemmTunableOp_Half_TN,tn_8192_22_8192,Gemm_Hipblaslt_TN_9410,0.0326589
GemmTunableOp_Half_TN,tn_57344_4083_8192,Gemm_Rocblas_621294285,6.6467
GemmTunableOp_Half_TN,tn_10240_2274_8192,Gemm_Hipblaslt_TN_9644,0.65137
GemmTunableOp_Half_TN,tn_8192_95_8192,Gemm_Hipblaslt_TN_7093,0.0473925
GemmTunableOp_Half_TN,tn_10240_1321_8192,Gemm_Hipblaslt_TN_9192,0.361531
GemmTunableOp_Half_TN,tn_57344_3347_8192,Gemm_Hipblaslt_TN_9803,5.86387
GemmTunableOp_Half_TN,tn_10240_3475_8192,Gemm_Hipblaslt_TN_9211,0.997594
GemmTunableOp_Half_TN,tn_10240_3491_8192,Gemm_Hipblaslt_TN_9209,0.993185
GemmTunableOp_Half_TN,tn_10240_3187_8192,Gemm_Hipblaslt_TN_9815,0.870524
GemmTunableOp_Half_TN,tn_10240_129_8192,Gemm_Hipblaslt_TN_9367,0.0660544
GemmTunableOp_Half_TN,tn_8192_5_28672,Gemm_Hipblaslt_TN_9403,0.120593
GemmTunableOp_Half_TN,tn_57344_110_8192,Gemm_Rocblas_621294214,0.344165
GemmTunableOp_Half_TN,tn_57344_2664_8192,Gemm_Rocblas_621286739,4.61163
GemmTunableOp_Half_TN,tn_57344_133_8192,Gemm_Hipblaslt_TN_9507,0.390953
GemmTunableOp_Half_TN,tn_8192_3120_28672,Gemm_Rocblas_621286731,2.81228
GemmTunableOp_Half_TN,tn_8192_24_28672,Gemm_Rocblas_621286354,0.128156
GemmTunableOp_Half_TN,tn_8192_2551_28672,Gemm_Hipblaslt_TN_9774,2.32567
GemmTunableOp_Half_TN,tn_10240_4035_8192,Gemm_Hipblaslt_TN_9743,1.11957
GemmTunableOp_Half_TN,tn_57344_3369_8192,Gemm_Rocblas_621294470,5.63258
GemmTunableOp_Half_TN,tn_8192_3153_8192,Gemm_Hipblaslt_TN_9139,0.706356
GemmTunableOp_Half_TN,tn_10240_1313_8192,Gemm_Hipblaslt_TN_9192,0.358015
GemmTunableOp_Half_TN,tn_8192_4090_8192,Gemm_Hipblaslt_TN_9749,0.886543
GemmTunableOp_Half_TN,tn_8192_3411_8192,Gemm_Hipblaslt_TN_9677,0.743493
GemmTunableOp_Half_TN,tn_10240_1208_8192,Gemm_Hipblaslt_TN_9192,0.347083
GemmTunableOp_Half_TN,tn_10240_108_8192,Gemm_Rocblas_621294504,0.0602939
GemmTunableOp_Half_TN,tn_57344_3140_8192,Gemm_Hipblaslt_TN_9816,5.48204
GemmTunableOp_Half_TN,tn_57344_2914_8192,Gemm_Hipblaslt_TN_9803,4.98425
GemmTunableOp_Half_TN,tn_8192_7_8192,Gemm_Hipblaslt_TN_9388,0.0302743
GemmTunableOp_Half_TN,tn_10240_1201_8192,Gemm_Hipblaslt_TN_9697,0.347524
GemmTunableOp_Half_TN,tn_57344_3187_8192,Gemm_Hipblaslt_TN_9803,5.52408
GemmTunableOp_Half_TN,tn_10240_132_8192,Gemm_Hipblaslt_TN_9367,0.0662572
GemmTunableOp_Half_TN,tn_57344_3451_8192,Gemm_Hipblaslt_TN_159,5.7759
GemmTunableOp_Half_TN,tn_32000_130_8192,Gemm_Hipblaslt_TN_9506,0.239032
GemmTunableOp_Half_TN,tn_8192_92_28672,Gemm_Hipblaslt_TN_8899,0.18318
GemmTunableOp_Half_TN,tn_8192_1248_8192,Gemm_Hipblaslt_TN_9209,0.298163
GemmTunableOp_Half_TN,tn_10240_1256_8192,Gemm_Hipblaslt_TN_9192,0.350989
GemmTunableOp_Half_TN,tn_10240_119_8192,Gemm_Rocblas_621286764,0.0605328
GemmTunableOp_Half_TN,tn_8192_4091_8192,Gemm_Hipblaslt_TN_9753,0.881024
GemmTunableOp_Half_TN,tn_10240_96_8192,Gemm_Hipblaslt_TN_7102,0.0543958
GemmTunableOp_Half_TN,tn_10240_117_8192,Gemm_Hipblaslt_TN_8892,0.0618758
GemmTunableOp_Half_TN,tn_57344_92_8192,Gemm_Hipblaslt_TN_9478,0.329916
GemmTunableOp_Half_TN,tn_8192_127_28672,Gemm_Hipblaslt_TN_8378,0.20511
GemmTunableOp_Half_TN,tn_8192_127_8192,Gemm_Hipblaslt_TN_7157,0.0543573
GemmTunableOp_Half_TN,tn_10240_3369_8192,Gemm_Hipblaslt_TN_9209,0.980313
GemmTunableOp_Half_TN,tn_57344_1367_8192,Gemm_Hipblaslt_TN_9830,2.55672
GemmTunableOp_Half_TN,tn_8192_25_28672,Gemm_Rocblas_621294226,0.129453
GemmTunableOp_Half_TN,tn_8192_3747_28672,Gemm_Rocblas_621286968,3.24186
GemmTunableOp_Half_TN,tn_10240_131_8192,Gemm_Hipblaslt_TN_9367,0.0664025
GemmTunableOp_Half_TN,tn_32000_99_8192,Gemm_Rocblas_621294212,0.195376
GemmTunableOp_Half_TN,tn_10240_3651_8192,Gemm_Hipblaslt_TN_9798,1.04592
GemmTunableOp_Half_TN,tn_8192_1265_8192,Gemm_Hipblaslt_TN_9691,0.300166
GemmTunableOp_Half_TN,tn_8192_16_28672,Gemm_Rocblas_621294224,0.118476
GemmTunableOp_Half_TN,tn_8192_112_8192,Gemm_Hipblaslt_TN_8891,0.0492786
GemmTunableOp_Half_TN,tn_10240_1121_8192,Gemm_Hipblaslt_TN_9697,0.323445
GemmTunableOp_Half_TN,tn_8192_101_8192,Gemm_Hipblaslt_TN_8891,0.0477988
GemmTunableOp_Half_TN,tn_8192_112_28672,Gemm_Hipblaslt_TN_8378,0.196433
GemmTunableOp_Half_TN,tn_57344_2015_8192,Gemm_Hipblaslt_TN_9840,3.49223
GemmTunableOp_Half_TN,tn_8192_11_8192,Gemm_Hipblaslt_TN_9392,0.0304676
GemmTunableOp_Half_TN,tn_10240_3715_8192,Gemm_Hipblaslt_TN_9814,1.05133
GemmTunableOp_Half_TN,tn_10240_1268_8192,Gemm_Hipblaslt_TN_9697,0.354142
GemmTunableOp_Half_TN,tn_32000_116_8192,Gemm_Rocblas_621294212,0.208057
GemmTunableOp_Half_TN,tn_32000_132_8192,Gemm_Hipblaslt_TN_9506,0.242113
GemmTunableOp_Half_TN,tn_57344_1392_8192,Gemm_Hipblaslt_TN_9830,2.57561
GemmTunableOp_Half_TN,tn_8192_2015_8192,Gemm_Hipblaslt_TN_9191,0.429675
GemmTunableOp_Half_TN,tn_57344_25_8192,Gemm_Rocblas_621294194,0.26728
GemmTunableOp_Half_TN,tn_8192_1361_28672,Gemm_Hipblaslt_TN_9799,1.27035
GemmTunableOp_Half_TN,tn_57344_1185_8192,Gemm_Hipblaslt_TN_9068,2.28891
GemmTunableOp_Half_TN,tn_8192_1153_8192,Gemm_Hipblaslt_TN_9672,0.292016
GemmTunableOp_Half_TN,tn_57344_1008_8192,Gemm_Rocblas_621294542,1.8043
GemmTunableOp_Half_TN,tn_8192_109_8192,Gemm_Hipblaslt_TN_7157,0.0523166
GemmTunableOp_Half_TN,tn_10240_1392_8192,Gemm_Hipblaslt_TN_9237,0.397472
GemmTunableOp_Half_TN,tn_32000_109_8192,Gemm_Rocblas_621286475,0.206305
GemmTunableOp_Half_TN,tn_10240_2866_8192,Gemm_Hipblaslt_TN_9814,0.779174
GemmTunableOp_Half_TN,tn_32000_112_8192,Gemm_Rocblas_621286475,0.207164
GemmTunableOp_Half_TN,tn_32000_12_8192,Gemm_Rocblas_621286319,0.135333
GemmTunableOp_Half_TN,tn_8192_3140_28672,Gemm_Hipblaslt_TN_9732,2.85759
GemmTunableOp_Half_TN,tn_8192_101_28672,Gemm_Hipblaslt_TN_8378,0.193395
GemmTunableOp_Half_TN,tn_8192_3619_28672,Gemm_Hipblaslt_TN_9731,3.03672
GemmTunableOp_Half_TN,tn_10240_102_8192,Gemm_Hipblaslt_TN_7157,0.0594041
GemmTunableOp_Half_TN,tn_8192_124_8192,Gemm_Hipblaslt_TN_8891,0.053883
GemmTunableOp_Half_TN,tn_8192_113_28672,Gemm_Hipblaslt_TN_8378,0.196811
GemmTunableOp_Half_TN,tn_10240_112_8192,Gemm_Rocblas_621286764,0.0603158
GemmTunableOp_Half_TN,tn_10240_3251_8192,Gemm_Hipblaslt_TN_9749,0.880188
GemmStridedBatchedTunableOp_Half_TN,tn_1368_1368_128_B_64,Gemm_Rocblas_621294109,0.153186
GemmStridedBatchedTunableOp_Half_TN,tn_1367_1367_128_B_64,Gemm_Rocblas_621286412,0.161519
GemmStridedBatchedTunableOp_Half_TN,tn_1038_1038_128_B_64,Gemm_Rocblas_621294725,0.101263
GemmStridedBatchedTunableOp_Half_TN,tn_1297_1297_128_B_64,Gemm_Rocblas_621294109,0.151135
GemmStridedBatchedTunableOp_Half_TN,tn_1296_1296_128_B_64,Gemm_Rocblas_621286412,0.136165
GemmStridedBatchedTunableOp_Half_TN,tn_1008_1008_128_B_64,Gemm_Rocblas_621294763,0.0904428
GemmStridedBatchedTunableOp_Half_TN,tn_1128_1128_128_B_64,Gemm_Rocblas_621294106,0.113464
GemmStridedBatchedTunableOp_Half_TN,tn_1048_1048_128_B_64,Gemm_Rocblas_621294106,0.102824
GemmStridedBatchedTunableOp_Half_TN,tn_1216_1216_128_B_64,Gemm_Rocblas_621286397,0.117951
GemmStridedBatchedTunableOp_Half_TN,tn_1009_1009_128_B_64,Gemm_Hipblaslt_TN_6879,0.0982249
GemmStridedBatchedTunableOp_Half_TN,tn_1441_1441_128_B_64,Gemm_Rocblas_621286397,0.175661
GemmStridedBatchedTunableOp_Half_TN,tn_16_16_128_B_64,Gemm_Rocblas_621286332,0.00646596
GemmStridedBatchedTunableOp_Half_TN,tn_1350_1350_128_B_64,Gemm_Rocblas_621294109,0.154477
GemmStridedBatchedTunableOp_Half_TN,tn_1064_1064_128_B_64,Gemm_Rocblas_621294725,0.10479
GemmStridedBatchedTunableOp_Half_TN,tn_1076_1076_128_B_64,Gemm_Rocblas_621294725,0.107431
GemmStridedBatchedTunableOp_Half_TN,tn_1256_1256_128_B_64,Gemm_Rocblas_621286397,0.130847
GemmStridedBatchedTunableOp_Half_TN,tn_1392_1392_128_B_64,Gemm_Rocblas_621294109,0.147605
GemmStridedBatchedTunableOp_Half_TN,tn_1010_1010_128_B_64,Gemm_Hipblaslt_TN_6879,0.096948
GemmStridedBatchedTunableOp_Half_TN,tn_1032_1032_128_B_64,Gemm_Rocblas_621294725,0.0990668
GemmStridedBatchedTunableOp_Half_TN,tn_1041_1041_128_B_64,Gemm_Hipblaslt_TN_6879,0.102872
GemmStridedBatchedTunableOp_Half_TN,tn_1022_1022_128_B_64,Gemm_Hipblaslt_TN_6879,0.0990424
GemmStridedBatchedTunableOp_Half_TN,tn_1224_1224_128_B_64,Gemm_Rocblas_621294106,0.126786
GemmStridedBatchedTunableOp_Half_TN,tn_1455_1455_128_B_64,Gemm_Rocblas_621286397,0.18034
GemmStridedBatchedTunableOp_Half_TN,tn_1425_1425_128_B_64,Gemm_Rocblas_621294106,0.173248
GemmStridedBatchedTunableOp_Half_TN,tn_1153_1153_128_B_64,Gemm_Rocblas_621286397,0.120748
GemmStridedBatchedTunableOp_Half_TN,tn_1404_1404_128_B_64,Gemm_Rocblas_621294109,0.163683
GemmTunableOp_Half_TN,tn_4096_3535_4096,Gemm_Hipblaslt_TN_9221,0.200883
GemmTunableOp_Half_TN,tn_22016_3430_4096,Gemm_Hipblaslt_TN_9827,1.06257
GemmTunableOp_Half_TN,tn_12288_2915_4096,Gemm_Rocblas_621286684,0.509656
GemmTunableOp_Half_TN,tn_4096_34_4096,Gemm_Rocblas_621286428,0.0125852
GemmTunableOp_Half_TN,tn_4096_3333_11008,Gemm_Rocblas_621294485,0.507101
GemmTunableOp_Half_TN,tn_12288_3669_4096,Gemm_Rocblas_621286678,0.622962
GemmTunableOp_Half_TN,tn_22016_2802_4096,Gemm_Hipblaslt_TN_9827,0.899041
GemmTunableOp_Half_TN,tn_4096_250_4096,Gemm_Rocblas_621294230,0.0262183
GemmTunableOp_Half_TN,tn_12288_236_4096,Gemm_Rocblas_621286478,0.0567734
GemmTunableOp_Half_TN,tn_32000_253_4096,Gemm_Hipblaslt_TN_9845,0.149471
GemmTunableOp_Half_TN,tn_22016_3843_4096,Gemm_Hipblaslt_TN_9832,1.23071
GemmTunableOp_Half_TN,tn_12288_3843_4096,Gemm_Rocblas_621286742,0.64712
GemmTunableOp_Half_TN,tn_4096_3843_11008,Gemm_Hipblaslt_TN_9827,0.568256
GemmTunableOp_Half_TN,tn_4096_243_11008,Gemm_Hipblaslt_TN_9303,0.0655266
GemmTunableOp_Half_TN,tn_4096_237_11008,Gemm_Hipblaslt_TN_9303,0.0641631
GemmTunableOp_Half_TN,tn_12288_3972_4096,Gemm_Rocblas_621286590,0.653086
GemmTunableOp_Half_TN,tn_4096_4083_4096,Gemm_Hipblaslt_TN_9768,0.227883
GemmTunableOp_Half_TN,tn_4096_3530_4096,Gemm_Hipblaslt_TN_9743,0.199329
GemmTunableOp_Half_TN,tn_4096_2898_11008,Gemm_Hipblaslt_TN_9709,0.446929
GemmTunableOp_Half_TN,tn_4096_233_11008,Gemm_Hipblaslt_TN_7627,0.0639179
GemmTunableOp_Half_TN,tn_22016_225_4096,Gemm_Hipblaslt_TN_9720,0.096063
GemmTunableOp_Half_TN,tn_32000_22_4096,Gemm_Rocblas_621294191,0.0522864
GemmTunableOp_Half_TN,tn_4096_2398_11008,Gemm_Hipblaslt_TN_9698,0.373354
GemmTunableOp_Half_TN,tn_4096_4035_4096,Gemm_Hipblaslt_TN_9768,0.226654
GemmTunableOp_Half_TN,tn_32000_244_4096,Gemm_Hipblaslt_TN_9745,0.149857
GemmTunableOp_Half_TN,tn_12288_1000_4096,Gemm_Hipblaslt_TN_9697,0.181568
GemmTunableOp_Half_TN,tn_4096_239_4096,Gemm_Rocblas_621286491,0.0259694
GemmTunableOp_Half_TN,tn_4096_234_11008,Gemm_Hipblaslt_TN_8879,0.0632156
GemmTunableOp_Half_TN,tn_12288_2958_4096,Gemm_Rocblas_621286684,0.512177
GemmTunableOp_Half_TN,tn_4096_4000_11008,Gemm_Rocblas_621286281,0.578878
GemmTunableOp_Half_TN,tn_22016_2866_4096,Gemm_Hipblaslt_TN_9841,0.906235
GemmTunableOp_Half_TN,tn_4096_2770_11008,Gemm_Hipblaslt_TN_9799,0.430204
GemmTunableOp_Half_TN,tn_12288_2978_4096,Gemm_Rocblas_621286684,0.513586
GemmTunableOp_Half_TN,tn_22016_3891_4096,Gemm_Hipblaslt_TN_9832,1.22293
GemmTunableOp_Half_TN,tn_12288_4021_4096,Gemm_Hipblaslt_TN_9220,0.658736
GemmTunableOp_Half_TN,tn_22016_247_4096,Gemm_Hipblaslt_TN_9641,0.0986421
GemmTunableOp_Half_TN,tn_12288_234_4096,Gemm_Rocblas_621294215,0.0577459
GemmTunableOp_Half_TN,tn_22016_2862_4096,Gemm_Hipblaslt_TN_9827,0.906812
GemmTunableOp_Half_TN,tn_12288_2798_4096,Gemm_Rocblas_621294426,0.49357
GemmTunableOp_Half_TN,tn_4096_3813_4096,Gemm_Hipblaslt_TN_9768,0.216069
GemmTunableOp_Half_TN,tn_12288_3267_4096,Gemm_Hipblaslt_TN_9677,0.565837
GemmTunableOp_Half_TN,tn_4096_9_11008,Gemm_Rocblas_621286312,0.0233867
GemmTunableOp_Half_TN,tn_32000_228_4096,Gemm_Hipblaslt_TN_9845,0.144104
GemmTunableOp_Half_TN,tn_22016_3717_4096,Gemm_Hipblaslt_TN_9841,1.13618
GemmTunableOp_Half_TN,tn_12288_2778_4096,Gemm_Rocblas_621294426,0.495978
GemmTunableOp_Half_TN,tn_12288_235_4096,Gemm_Rocblas_621286478,0.0569684
GemmTunableOp_Half_TN,tn_4096_2802_4096,Gemm_Hipblaslt_TN_9674,0.166152
GemmTunableOp_Half_TN,tn_12288_2946_4096,Gemm_Rocblas_621294426,0.510174
GemmTunableOp_Half_TN,tn_12288_4058_4096,Gemm_Rocblas_621294420,0.673271
GemmTunableOp_Half_TN,tn_4096_219_11008,Gemm_Hipblaslt_TN_7378,0.0586048
GemmTunableOp_Half_TN,tn_4096_3923_4096,Gemm_Hipblaslt_TN_9841,0.218843
GemmTunableOp_Half_TN,tn_12288_245_4096,Gemm_Rocblas_621286478,0.0579762
GemmTunableOp_Half_TN,tn_4096_220_4096,Gemm_Rocblas_621286491,0.0256608
GemmTunableOp_Half_TN,tn_4096_33_11008,Gemm_Rocblas_621286332,0.0268576
GemmTunableOp_Half_TN,tn_12288_2398_4096,Gemm_Hipblaslt_TN_9220,0.409398
GemmTunableOp_Half_TN,tn_4096_241_11008,Gemm_Hipblaslt_TN_8879,0.0651561
GemmTunableOp_Half_TN,tn_22016_3785_4096,Gemm_Hipblaslt_TN_9827,1.1476
GemmTunableOp_Half_TN,tn_4096_2894_4096,Gemm_Hipblaslt_TN_9566,0.170416
GemmTunableOp_Half_TN,tn_12288_217_4096,Gemm_Rocblas_621294215,0.057071
GemmTunableOp_Half_TN,tn_22016_244_4096,Gemm_Hipblaslt_TN_9720,0.097428
GemmTunableOp_Half_TN,tn_4096_34_11008,Gemm_Rocblas_621286332,0.0268375
GemmTunableOp_Half_TN,tn_22016_219_4096,Gemm_Hipblaslt_TN_9720,0.09498
GemmTunableOp_Half_TN,tn_4096_2866_4096,Gemm_Hipblaslt_TN_9672,0.166908
GemmTunableOp_Half_TN,tn_4096_3577_11008,Gemm_Rocblas_621286743,0.526286
GemmTunableOp_Half_TN,tn_22016_11_4096,Gemm_Rocblas_621294186,0.035228
GemmTunableOp_Half_TN,tn_12288_225_4096,Gemm_Rocblas_621286478,0.0566211
GemmTunableOp_Half_TN,tn_22016_3451_4096,Gemm_Hipblaslt_TN_9827,1.07707
GemmTunableOp_Half_TN,tn_4096_19_11008,Gemm_Rocblas_621294054,0.023523
GemmTunableOp_Half_TN,tn_22016_9_4096,Gemm_Rocblas_621294186,0.0353266
GemmTunableOp_Half_TN,tn_12288_251_4096,Gemm_Rocblas_621286478,0.0583451
GemmTunableOp_Half_TN,tn_12288_2786_4096,Gemm_Rocblas_621286684,0.494895
GemmTunableOp_Half_TN,tn_4096_2938_11008,Gemm_Hipblaslt_TN_9709,0.447695
GemmTunableOp_Half_TN,tn_22016_2915_4096,Gemm_Hipblaslt_TN_9827,0.903004
GemmTunableOp_Half_TN,tn_4096_11_4096,Gemm_Rocblas_621294130,0.0100431
GemmTunableOp_Half_TN,tn_12288_21_4096,Gemm_Rocblas_621294064,0.0224674
GemmTunableOp_Half_TN,tn_4096_246_11008,Gemm_Hipblaslt_TN_8879,0.0647122
GemmTunableOp_Half_TN,tn_22016_3621_4096,Gemm_Hipblaslt_TN_9827,1.11081
GemmTunableOp_Half_TN,tn_4096_233_4096,Gemm_Rocblas_621294168,0.0257831
GemmTunableOp_Half_TN,tn_32000_216_4096,Gemm_Hipblaslt_TN_9590,0.139119
GemmTunableOp_Half_TN,tn_4096_27_4096,Gemm_Rocblas_621286330,0.0115622
GemmTunableOp_Half_TN,tn_4096_3987_4096,Gemm_Hipblaslt_TN_9841,0.221735
GemmTunableOp_Half_TN,tn_22016_1293_4096,Gemm_Rocblas_621294455,0.448383
GemmTunableOp_Half_TN,tn_12288_227_4096,Gemm_Rocblas_621294215,0.0568654
GemmTunableOp_Half_TN,tn_4096_21_4096,Gemm_Rocblas_621294139,0.0109623
GemmTunableOp_Half_TN,tn_22016_22_4096,Gemm_Rocblas_621286346,0.0359403
GemmTunableOp_Half_TN,tn_4096_3535_11008,Gemm_Rocblas_621286743,0.526783
GemmTunableOp_Half_TN,tn_4096_3173_11008,Gemm_Hipblaslt_TN_9817,0.491829
GemmTunableOp_Half_TN,tn_12288_220_4096,Gemm_Rocblas_621294215,0.0563784
GemmTunableOp_Half_TN,tn_4096_29_11008,Gemm_Rocblas_621286305,0.0250826
GemmTunableOp_Half_TN,tn_4096_35_11008,Gemm_Rocblas_621286332,0.0274313
GemmTunableOp_Half_TN,tn_12288_36_4096,Gemm_Rocblas_621294171,0.0252905
GemmTunableOp_Half_TN,tn_12288_3621_4096,Gemm_Hipblaslt_TN_9677,0.597918
GemmTunableOp_Half_TN,tn_4096_8_4096,Gemm_Rocblas_621286300,0.00998498
GemmTunableOp_Half_TN,tn_4096_227_11008,Gemm_Hipblaslt_TN_8879,0.0612862
GemmTunableOp_Half_TN,tn_32000_30_4096,Gemm_Rocblas_621286346,0.0527233
GemmTunableOp_Half_TN,tn_12288_3577_4096,Gemm_Hipblaslt_TN_9743,0.595025
GemmTunableOp_Half_TN,tn_4096_3953_11008,Gemm_Hipblaslt_TN_9815,0.576814
GemmTunableOp_Half_TN,tn_4096_1261_11008,Gemm_Hipblaslt_TN_9148,0.231433
GemmTunableOp_Half_TN,tn_12288_241_4096,Gemm_Rocblas_621286478,0.0574092
GemmTunableOp_Half_TN,tn_12288_242_4096,Gemm_Rocblas_621286478,0.057809
GemmTunableOp_Half_TN,tn_32000_27_4096,Gemm_Rocblas_621294191,0.0524928
GemmTunableOp_Half_TN,tn_12288_3813_4096,Gemm_Rocblas_621294420,0.645509
GemmTunableOp_Half_TN,tn_4096_230_11008,Gemm_Hipblaslt_TN_9303,0.064209
GemmTunableOp_Half_TN,tn_4096_224_4096,Gemm_Rocblas_621286440,0.0250363
GemmTunableOp_Half_TN,tn_4096_223_4096,Gemm_Rocblas_621286491,0.0251378
GemmTunableOp_Half_TN,tn_32000_250_4096,Gemm_Hipblaslt_TN_9638,0.149937
GemmTunableOp_Half_TN,tn_22016_4021_4096,Gemm_Hipblaslt_TN_9832,1.25101
GemmTunableOp_Half_TN,tn_12288_250_4096,Gemm_Rocblas_621286478,0.0575596
GemmTunableOp_Half_TN,tn_4096_2834_4096,Gemm_Hipblaslt_TN_9674,0.165348
GemmTunableOp_Half_TN,tn_12288_216_4096,Gemm_Rocblas_621294215,0.056247
GemmTunableOp_Half_TN,tn_22016_2770_4096,Gemm_Hipblaslt_TN_9827,0.889592
GemmTunableOp_Half_TN,tn_32000_248_4096,Gemm_Hipblaslt_TN_9665,0.147262
GemmTunableOp_Half_TN,tn_12288_2866_4096,Gemm_Rocblas_621294426,0.500468
GemmTunableOp_Half_TN,tn_12288_2850_4096,Gemm_Rocblas_621294426,0.497091
GemmTunableOp_Half_TN,tn_4096_3843_4096,Gemm_Hipblaslt_TN_9827,0.218032
GemmTunableOp_Half_TN,tn_4096_250_11008,Gemm_Hipblaslt_TN_9303,0.066369
GemmTunableOp_Half_TN,tn_4096_234_4096,Gemm_Rocblas_621294230,0.0259609
GemmTunableOp_Half_TN,tn_4096_2958_11008,Gemm_Hipblaslt_TN_9689,0.452127
GemmTunableOp_Half_TN,tn_32000_21_4096,Gemm_Rocblas_621286346,0.0522984
GemmTunableOp_Half_TN,tn_32000_221_4096,Gemm_Hipblaslt_TN_9620,0.137854
GemmTunableOp_Half_TN,tn_22016_216_4096,Gemm_Hipblaslt_TN_9641,0.0950367
GemmTunableOp_Half_TN,tn_4096_238_4096,Gemm_Rocblas_621286440,0.0263398
GemmTunableOp_Half_TN,tn_4096_242_11008,Gemm_Hipblaslt_TN_8879,0.0650263
GemmTunableOp_Half_TN,tn_4096_235_11008,Gemm_Hipblaslt_TN_8879,0.0642724
GemmStridedBatchedTunableOp_Half_TN,tn_1021_1021_128_B_32,Gemm_Rocblas_621294536,0.0529556
GemmStridedBatchedTunableOp_Half_TN,tn_1048_1048_128_B_32,Gemm_Hipblaslt_TN_149,0.056004
GemmStridedBatchedTunableOp_Half_TN,tn_1458_1458_128_B_32,Gemm_Rocblas_621294110,0.0926064
GemmStridedBatchedTunableOp_Half_TN,tn_1367_1367_128_B_32,Gemm_Rocblas_621286412,0.0853859
GemmStridedBatchedTunableOp_Half_TN,tn_1489_1489_128_B_32,Gemm_Hipblaslt_TN_6942,0.096901
GemmStridedBatchedTunableOp_Half_TN,tn_1415_1415_128_B_32,Gemm_Rocblas_621286413,0.0908974
GemmStridedBatchedTunableOp_Half_TN,tn_1377_1377_128_B_32,Gemm_Rocblas_621294725,0.0869679
GemmStridedBatchedTunableOp_Half_TN,tn_1479_1479_128_B_32,Gemm_Rocblas_621294106,0.0971239
GemmStridedBatchedTunableOp_Half_TN,tn_1469_1469_128_B_32,Gemm_Rocblas_621286397,0.0952156
GemmStridedBatchedTunableOp_Half_TN,tn_1345_1345_128_B_32,Gemm_Rocblas_621294109,0.0835429
GemmStridedBatchedTunableOp_Half_TN,tn_1219_1219_128_B_32,Gemm_Rocblas_621294725,0.0713163
GemmStridedBatchedTunableOp_Half_TN,tn_1207_1207_128_B_32,Gemm_Rocblas_621294725,0.0667705
GemmStridedBatchedTunableOp_Half_TN,tn_1165_1165_128_B_32,Gemm_Rocblas_621294725,0.0668976
GemmStridedBatchedTunableOp_Half_TN,tn_1222_1222_128_B_32,Gemm_Rocblas_621294725,0.0691948
GemmStridedBatchedTunableOp_Half_TN,tn_1191_1191_128_B_32,Gemm_Rocblas_621294725,0.0672788
GemmStridedBatchedTunableOp_Half_TN,tn_1137_1137_128_B_32,Gemm_Hipblaslt_TN_7483,0.0640044
GemmTunableOp_Half_TN,tn_8192_8192_3584,Gemm_Rocblas_621286590,0.78205
GemmTunableOp_Half_TN,tn_8192_48_1024,Gemm_Rocblas_621286280,0.00694476
GemmTunableOp_Half_TN,tn_8192_32_3584,Gemm_Rocblas_621286335,0.0139708
GemmTunableOp_Half_TN,tn_7168_256_8192,Gemm_Hipblaslt_TN_9514,0.0744018
GemmTunableOp_Half_TN,tn_8192_24_1024,Gemm_Rocblas_621294144,0.00619925
GemmTunableOp_Half_TN,tn_1280_80_8192,Gemm_Rocblas_621294026,0.0133587
GemmTunableOp_Half_TN,tn_1280_112_8192,Gemm_Rocblas_621294162,0.0164818
GemmTunableOp_Half_TN,tn_8192_232_1024,Gemm_Rocblas_621286470,0.0139604
GemmTunableOp_Half_TN,tn_8192_88_1024,Gemm_Rocblas_621286440,0.00860484
GemmTunableOp_Half_TN,tn_1280_184_8192,Gemm_Hipblaslt_TN_9414,0.0211421
GemmTunableOp_Half_TN,tn_8192_152_1024,Gemm_Rocblas_621286472,0.0121197
GemmTunableOp_Half_TN,tn_7168_4_8192,Gemm_Hipblaslt_TN_9392,0.0267948
GemmTunableOp_Half_TN,tn_7168_176_8192,Gemm_Hipblaslt_TN_7582,0.0603365
GemmTunableOp_Half_TN,tn_8192_32_1024,Gemm_Rocblas_621286488,0.00651372
GemmTunableOp_Half_TN,tn_8192_56_3584,Gemm_Rocblas_621286337,0.0171441
GemmTunableOp_Half_TN,tn_1280_160_8192,Gemm_Rocblas_621294163,0.0188273
GemmTunableOp_Half_TN,tn_1280_32_8192,Gemm_Rocblas_621294136,0.00887244
GemmTunableOp_Half_TN,tn_1280_8_8192,Gemm_Rocblas_621286326,0.00876308
GemmTunableOp_Half_TN,tn_8192_216_1024,Gemm_Rocblas_621294209,0.0137335
GemmTunableOp_Half_TN,tn_8192_160_3584,Gemm_Hipblaslt_TN_9495,0.0287411
GemmTunableOp_Half_TN,tn_1280_56_8192,Gemm_Rocblas_621294145,0.0119634
GemmTunableOp_Half_TN,tn_8192_248_1024,Gemm_Rocblas_621286470,0.0140124
GemmTunableOp_Half_TN,tn_7168_136_8192,Gemm_Hipblaslt_TN_9306,0.0535558
GemmTunableOp_Half_TN,tn_7168_152_8192,Gemm_Hipblaslt_TN_8098,0.0555674
GemmTunableOp_Half_TN,tn_8192_2_3584,Gemm_Rocblas_621294041,0.0125491
GemmTunableOp_Half_TN,tn_8192_224_3584,Gemm_Rocblas_621286493,0.0363895
GemmTunableOp_Half_TN,tn_8192_24_3584,Gemm_Rocblas_621286335,0.0135835
GemmTunableOp_Half_TN,tn_8192_248_3584,Gemm_Rocblas_621286470,0.0377852
GemmTunableOp_Half_TN,tn_1280_40_8192,Gemm_Rocblas_621294145,0.0119138
GemmTunableOp_Half_TN,tn_8192_64_3584,Gemm_Rocblas_621286428,0.0168091
GemmTunableOp_Half_TN,tn_7168_8_8192,Gemm_Hipblaslt_TN_9392,0.0270039
GemmTunableOp_Half_TN,tn_7168_128_8192,Gemm_Hipblaslt_TN_7158,0.047804
GemmTunableOp_Half_TN,tn_1280_224_8192,Gemm_Rocblas_621294163,0.0217443
GemmTunableOp_Half_TN,tn_1280_136_8192,Gemm_Hipblaslt_TN_9414,0.0189983
GemmTunableOp_Half_TN,tn_7168_104_8192,Gemm_Hipblaslt_TN_9303,0.0473626
GemmTunableOp_Half_TN,tn_1280_104_8192,Gemm_Rocblas_621286434,0.0164173
GemmTunableOp_Half_TN,tn_8192_112_1024,Gemm_Rocblas_621286447,0.0086436
GemmTunableOp_Half_TN,tn_8192_112_3584,Gemm_Rocblas_621286440,0.0240711
GemmTunableOp_Half_TN,tn_8192_104_1024,Gemm_Rocblas_621294167,0.00863719
GemmTunableOp_Half_TN,tn_57344_3425_8192,Gemm_Hipblaslt_TN_159,5.75101
GemmTunableOp_Half_TN,tn_10240_122_8192,Gemm_Hipblaslt_TN_8892,0.0609699
GemmTunableOp_Half_TN,tn_10240_3299_8192,Gemm_Hipblaslt_TN_9240,0.886451
GemmTunableOp_Half_TN,tn_57344_3331_8192,Gemm_Hipblaslt_TN_9816,5.87814
GemmTunableOp_Half_TN,tn_8192_3603_8192,Gemm_Hipblaslt_TN_9743,0.777253
GemmTunableOp_Half_TN,tn_8192_1367_28672,Gemm_Hipblaslt_TN_9799,1.26873
GemmTunableOp_Half_TN,tn_10240_1276_8192,Gemm_Hipblaslt_TN_9192,0.355321
GemmTunableOp_Half_TN,tn_10240_1296_8192,Gemm_Hipblaslt_TN_9192,0.355652
GemmTunableOp_Half_TN,tn_57344_23_8192,Gemm_Rocblas_621294194,0.264557
GemmTunableOp_Half_TN,tn_57344_3162_8192,Gemm_Hipblaslt_TN_9803,5.51392
GemmTunableOp_Half_TN,tn_8192_1121_8192,Gemm_Hipblaslt_TN_9195,0.262992
GemmTunableOp_Half_TN,tn_57344_2274_8192,Gemm_Hipblaslt_TN_9757,4.06156
GemmTunableOp_Half_TN,tn_10240_13_8192,Gemm_Hipblaslt_TN_9411,0.0371771
GemmTunableOp_Half_TN,tn_8192_3139_28672,Gemm_Hipblaslt_TN_9732,2.85509
GemmTunableOp_Half_TN,tn_57344_1208_8192,Gemm_Hipblaslt_TN_9827,2.31176
GemmTunableOp_Half_TN,tn_32000_118_8192,Gemm_Rocblas_621286475,0.209955
GemmTunableOp_Half_TN,tn_32000_96_8192,Gemm_Rocblas_621286475,0.195905
GemmTunableOp_Half_TN,tn_8192_128_28672,Gemm_Hipblaslt_TN_8378,0.205358
GemmTunableOp_Half_TN,tn_10240_3451_8192,Gemm_Hipblaslt_TN_9674,0.990645
GemmTunableOp_Half_TN,tn_32000_92_8192,Gemm_Rocblas_621286475,0.194982
GemmTunableOp_Half_TN,tn_32000_24_8192,Gemm_Rocblas_621294578,0.146407
GemmTunableOp_Half_TN,tn_8192_4035_28672,Gemm_Rocblas_621286894,3.39548
GemmTunableOp_Half_TN,tn_8192_1025_28672,Gemm_Hipblaslt_TN_9762,1.0214
GemmTunableOp_Half_TN,tn_10240_115_8192,Gemm_Rocblas_621286764,0.060191
GemmTunableOp_Half_TN,tn_57344_94_8192,Gemm_Hipblaslt_TN_9478,0.331338
GemmTunableOp_Half_TN,tn_8192_1389_28672,Gemm_Hipblaslt_TN_9799,1.27354
GemmTunableOp_Half_TN,tn_10240_105_8192,Gemm_Rocblas_621286764,0.0587783
GemmTunableOp_Half_TN,tn_8192_1268_8192,Gemm_Rocblas_621286683,0.301228
GemmTunableOp_Half_TN,tn_8192_1360_8192,Gemm_Rocblas_621286683,0.318293
GemmTunableOp_Half_TN,tn_10240_1392_8192,Gemm_Hipblaslt_TN_9222,0.39607
GemmTunableOp_Half_TN,tn_8192_2760_8192,Gemm_Hipblaslt_TN_9182,0.638707
GemmTunableOp_Half_TN,tn_8192_1377_8192,Gemm_Rocblas_621294425,0.318417
GemmTunableOp_Half_TN,tn_8192_2760_28672,Gemm_Rocblas_621286667,2.52524
GemmTunableOp_Half_TN,tn_8192_2639_8192,Gemm_Hipblaslt_TN_9774,0.612339
GemmTunableOp_Half_TN,tn_8192_132_28672,Gemm_Hipblaslt_TN_8099,0.216367
GemmTunableOp_Half_TN,tn_8192_132_8192,Gemm_Hipblaslt_TN_9306,0.056159
GemmTunableOp_Half_TN,tn_8192_2914_28672,Gemm_Hipblaslt_TN_9799,2.63187
GemmTunableOp_Half_TN,tn_10240_1233_8192,Gemm_Hipblaslt_TN_9192,0.351108
GemmTunableOp_Half_TN,tn_10240_11_8192,Gemm_Hipblaslt_TN_9411,0.0371927
GemmTunableOp_Half_TN,tn_8192_2000_28672,Gemm_Hipblaslt_TN_9591,1.71995
GemmTunableOp_Half_TN,tn_8192_1297_8192,Gemm_Hipblaslt_TN_9182,0.311861
GemmTunableOp_Half_TN,tn_57344_1224_8192,Gemm_Hipblaslt_TN_9827,2.32233
GemmTunableOp_Half_TN,tn_8192_2000_8192,Gemm_Hipblaslt_TN_9190,0.428009
GemmTunableOp_Half_TN,tn_8192_1000_28672,Gemm_Hipblaslt_TN_9665,1.02254
GemmTunableOp_Half_TN,tn_57344_2479_8192,Default,4.3311
GemmTunableOp_Half_TN,tn_8192_1201_28672,Gemm_Hipblaslt_TN_9774,1.16342
GemmTunableOp_Half_TN,tn_8192_2166_8192,Gemm_Hipblaslt_TN_9763,0.503191
GemmTunableOp_Half_TN,tn_57344_1361_8192,Gemm_Hipblaslt_TN_9830,2.55426
GemmTunableOp_Half_TN,tn_10240_10_8192,Gemm_Hipblaslt_TN_9411,0.0370185
GemmTunableOp_Half_TN,tn_10240_3642_8192,Gemm_Hipblaslt_TN_9814,1.03462
GemmTunableOp_Half_TN,tn_8192_99_8192,Gemm_Hipblaslt_TN_8891,0.0489802
GemmTunableOp_Half_TN,tn_57344_1265_8192,Gemm_Hipblaslt_TN_9827,2.32988
GemmTunableOp_Half_TN,tn_8192_3369_8192,Gemm_Hipblaslt_TN_9697,0.738387
GemmTunableOp_Half_TN,tn_10240_3120_8192,Gemm_Hipblaslt_TN_9655,0.842655
GemmTunableOp_Half_TN,tn_8192_113_8192,Gemm_Hipblaslt_TN_8891,0.0497667
GemmTunableOp_Half_TN,tn_57344_93_8192,Gemm_Hipblaslt_TN_9481,0.329687
GemmTunableOp_Half_TN,tn_32000_97_8192,Gemm_Rocblas_621294212,0.197076
GemmTunableOp_Half_TN,tn_57344_3411_8192,Gemm_Hipblaslt_TN_159,5.70627
GemmTunableOp_Half_TN,tn_8192_2664_28672,Gemm_Hipblaslt_TN_9774,2.36006
GemmTunableOp_Half_TN,tn_57344_3482_8192,Gemm_Hipblaslt_TN_159,5.79858
GemmTunableOp_Half_TN,tn_8192_2622_8192,Gemm_Hipblaslt_TN_9774,0.604598
GemmTunableOp_Half_TN,tn_57344_3283_8192,Gemm_Hipblaslt_TN_9818,5.81764
GemmTunableOp_Half_TN,tn_8192_3283_8192,Gemm_Hipblaslt_TN_9677,0.73288
GemmTunableOp_Half_TN,tn_57344_113_8192,Gemm_Rocblas_621286477,0.348115
GemmTunableOp_Half_TN,tn_8192_102_8192,Gemm_Hipblaslt_TN_8891,0.0497925
GemmTunableOp_Half_TN,tn_8192_1025_8192,Gemm_Hipblaslt_TN_9207,0.255963
GemmTunableOp_Half_TN,tn_8192_1160_8192,Gemm_Hipblaslt_TN_9691,0.292767
GemmTunableOp_Half_TN,tn_8192_3411_8192,Gemm_Hipblaslt_TN_9187,0.742745
GemmTunableOp_Half_TN,tn_10240_108_8192,Gemm_Rocblas_621286764,0.0602348
GemmTunableOp_Half_TN,tn_10240_3859_8192,Gemm_Hipblaslt_TN_9743,1.08039
GemmTunableOp_Half_TN,tn_32000_23_8192,Gemm_Rocblas_621294193,0.145611
GemmTunableOp_Half_TN,tn_32000_110_8192,Gemm_Rocblas_621286475,0.206734
GemmTunableOp_Half_TN,tn_8192_3491_8192,Gemm_Hipblaslt_TN_9677,0.766089
GemmTunableOp_Half_TN,tn_57344_1296_8192,Gemm_Hipblaslt_TN_9841,2.34034
GemmTunableOp_Half_TN,tn_8192_2166_28672,Gemm_Hipblaslt_TN_9762,2.05027
GemmTunableOp_Half_TN,tn_8192_2549_8192,Gemm_Hipblaslt_TN_9774,0.604502
GemmTunableOp_Half_TN,tn_57344_3475_8192,Gemm_Hipblaslt_TN_159,5.72304
GemmTunableOp_Half_TN,tn_8192_1248_28672,Gemm_Hipblaslt_TN_9774,1.18341
GemmTunableOp_Half_TN,tn_10240_3626_8192,Gemm_Hipblaslt_TN_9814,1.03386
GemmTunableOp_Half_TN,tn_57344_128_8192,Default,0.351868
GemmTunableOp_Half_TN,tn_10240_4063_8192,Gemm_Hipblaslt_TN_9743,1.12303
GemmTunableOp_Half_TN,tn_10240_1350_8192,Gemm_Hipblaslt_TN_9237,0.392025
GemmTunableOp_Half_TN,tn_57344_100_8192,Gemm_Rocblas_621286477,0.338734
GemmTunableOp_Half_TN,tn_57344_2551_8192,Gemm_Hipblaslt_TN_9800,4.47266
GemmTunableOp_Half_TN,tn_57344_18_8192,Gemm_Rocblas_621286351,0.263249
GemmTunableOp_Half_TN,tn_8192_1319_8192,Gemm_Hipblaslt_TN_9799,0.314183
GemmTunableOp_Half_TN,tn_8192_14_28672,Gemm_Hipblaslt_TN_9398,0.12122
GemmTunableOp_Half_TN,tn_8192_22_28672,Gemm_Rocblas_621286354,0.125961
GemmTunableOp_Half_TN,tn_10240_3785_8192,Gemm_Hipblaslt_TN_9814,1.05069
GemmTunableOp_Half_TN,tn_57344_12_8192,Gemm_Hipblaslt_TN_9405,0.255054
GemmTunableOp_Half_TN,tn_32000_100_8192,Gemm_Rocblas_621286475,0.197539
GemmTunableOp_Half_TN,tn_57344_4090_8192,Gemm_Hipblaslt_TN_9901,6.64593
GemmTunableOp_Half_TN,tn_57344_1153_8192,Default,2.2609
GemmTunableOp_Half_TN,tn_10240_3162_8192,Gemm_Hipblaslt_TN_9815,0.871148
GemmTunableOp_Half_TN,tn_57344_3139_8192,Gemm_Hipblaslt_TN_9816,5.49204
GemmTunableOp_Half_TN,tn_10240_21_8192,Gemm_Hipblaslt_TN_9415,0.039072
GemmTunableOp_Half_TN,tn_57344_11_8192,Gemm_Hipblaslt_TN_9405,0.252837
GemmTunableOp_Half_TN,tn_10240_2622_8192,Gemm_Hipblaslt_TN_9697,0.72815
GemmTunableOp_Half_TN,tn_8192_1256_8192,Gemm_Rocblas_621294426,0.299953
GemmTunableOp_Half_TN,tn_57344_2914_8192,Gemm_Hipblaslt_TN_9816,4.98403
GemmTunableOp_Half_TN,tn_10240_1104_8192,Gemm_Hipblaslt_TN_9209,0.315128
GemmTunableOp_Half_TN,tn_8192_1374_8192,Gemm_Hipblaslt_TN_9209,0.320148
GemmTunableOp_Half_TN,tn_8192_3140_28672,Gemm_Hipblaslt_TN_9732,2.84938
GemmTunableOp_Half_TN,tn_32000_98_8192,Gemm_Rocblas_621286475,0.198003
GemmTunableOp_Half_TN,tn_8192_2692_8192,Gemm_Rocblas_621294320,0.624957
GemmTunableOp_Half_TN,tn_8192_2962_28672,Gemm_Hipblaslt_TN_9799,2.63934
GemmTunableOp_Half_TN,tn_8192_2041_28672,Gemm_Hipblaslt_TN_9840,1.72997
GemmTunableOp_Half_TN,tn_10240_2962_8192,Gemm_Hipblaslt_TN_9815,0.825817
GemmTunableOp_Half_TN,tn_32000_5_8192,Gemm_Rocblas_621294187,0.13447
GemmTunableOp_Half_TN,tn_8192_1313_28672,Gemm_Hipblaslt_TN_9774,1.19816
GemmTunableOp_Half_TN,tn_8192_100_28672,Gemm_Hipblaslt_TN_8378,0.1963
GemmTunableOp_Half_TN,tn_8192_25_28672,Gemm_Rocblas_621286354,0.125983
GemmTunableOp_Half_TN,tn_10240_131_8192,Gemm_Hipblaslt_TN_9367,0.0664484
GemmTunableOp_Half_TN,tn_8192_1280_28672,Gemm_Rocblas_621286613,1.18808
GemmTunableOp_Half_TN,tn_10240_123_8192,Gemm_Rocblas_621294504,0.0615473
GemmTunableOp_Half_TN,tn_8192_2639_28672,Gemm_Hipblaslt_TN_9774,2.35624
GemmTunableOp_Half_TN,tn_10240_4083_8192,Gemm_Hipblaslt_TN_9743,1.12621
GemmTunableOp_Half_TN,tn_10240_3206_8192,Gemm_Hipblaslt_TN_9753,0.875052
GemmTunableOp_Half_TN,tn_10240_1168_8192,Gemm_Hipblaslt_TN_9697,0.341819
GemmTunableOp_Half_TN,tn_8192_126_8192,Gemm_Hipblaslt_TN_8891,0.0527228
GemmTunableOp_Half_TN,tn_8192_3555_8192,Gemm_Hipblaslt_TN_9743,0.77234
GemmTunableOp_Half_TN,tn_32000_135_8192,Gemm_Hipblaslt_TN_9506,0.23797
GemmTunableOp_Half_TN,tn_32000_99_8192,Gemm_Rocblas_621294212,0.199893
GemmTunableOp_Half_TN,tn_57344_117_8192,Gemm_Rocblas_621294214,0.348933
GemmTunableOp_Half_TN,tn_57344_1168_8192,Gemm_Hipblaslt_TN_9068,2.27531
GemmTunableOp_Half_TN,tn_57344_1268_8192,Gemm_Hipblaslt_TN_9793,2.33651
GemmTunableOp_Half_TN,tn_32000_25_8192,Gemm_Rocblas_621286350,0.146317
GemmTunableOp_Half_TN,tn_8192_110_28672,Gemm_Hipblaslt_TN_8378,0.19547
GemmTunableOp_Half_TN,tn_32000_93_8192,Gemm_Rocblas_621294212,0.196292
GemmTunableOp_Half_TN,tn_57344_3451_8192,Gemm_Hipblaslt_TN_159,5.76479
GemmTunableOp_Half_TN,tn_32000_130_8192,Gemm_Hipblaslt_TN_9506,0.23949
GemmTunableOp_Half_TN,tn_10240_129_8192,Gemm_Hipblaslt_TN_9367,0.0655617
GemmTunableOp_Half_TN,tn_8192_1121_28672,Gemm_Hipblaslt_TN_9774,1.10958
GemmTunableOp_Half_TN,tn_57344_1185_8192,Gemm_Hipblaslt_TN_9827,2.2927
GemmTunableOp_Half_TN,tn_8192_92_28672,Gemm_Hipblaslt_TN_8899,0.180633
GemmTunableOp_Half_TN,tn_8192_114_28672,Gemm_Hipblaslt_TN_8378,0.197763
GemmTunableOp_Half_TN,tn_8192_1248_8192,Gemm_Hipblaslt_TN_9674,0.299318
GemmTunableOp_Half_TN,tn_57344_1025_8192,Gemm_Hipblaslt_TN_9841,1.95022
GemmTunableOp_Half_TN,tn_10240_1256_8192,Gemm_Hipblaslt_TN_9697,0.35379
GemmTunableOp_Half_TN,tn_10240_135_8192,Gemm_Hipblaslt_TN_9367,0.0670353
GemmTunableOp_Half_TN,tn_10240_1121_8192,Gemm_Hipblaslt_TN_9697,0.322447
GemmTunableOp_Half_TN,tn_8192_112_8192,Gemm_Hipblaslt_TN_8891,0.0525777
GemmTunableOp_Half_TN,tn_57344_133_8192,Gemm_Hipblaslt_TN_9507,0.394309
GemmTunableOp_Half_TN,tn_10240_4082_8192,Gemm_Hipblaslt_TN_9814,1.13025
GemmTunableOp_Half_TN,tn_57344_3859_8192,Gemm_Rocblas_621286905,6.48505
GemmTunableOp_Half_TN,tn_8192_3290_8192,Gemm_Hipblaslt_TN_9677,0.731875
GemmTunableOp_Half_TN,tn_32000_127_8192,Gemm_Rocblas_621286475,0.214324
GemmTunableOp_Half_TN,tn_8192_4091_8192,Gemm_Rocblas_621294435,0.882518
GemmTunableOp_Half_TN,tn_8192_1249_8192,Gemm_Hipblaslt_TN_9799,0.298531
GemmTunableOp_Half_TN,tn_8192_3651_28672,Default,3.20361
GemmTunableOp_Half_TN,tn_57344_4096_8192,Gemm_Rocblas_621294486,6.65488
GemmTunableOp_Half_TN,tn_8192_131_8192,Gemm_Hipblaslt_TN_9306,0.0577893
GemmTunableOp_Half_TN,tn_8192_100_8192,Gemm_Hipblaslt_TN_8891,0.0483642
GemmTunableOp_Half_TN,tn_8192_108_28672,Gemm_Hipblaslt_TN_8378,0.198778
GemmTunableOp_Half_TN,tn_8192_16_28672,Gemm_Rocblas_621294224,0.119117
GemmTunableOp_Half_TN,tn_8192_3715_8192,Gemm_Hipblaslt_TN_9193,0.81716
GemmTunableOp_Half_TN,tn_8192_1392_8192,Gemm_Rocblas_621294426,0.320389
GemmTunableOp_Half_TN,tn_8192_1104_8192,Gemm_Hipblaslt_TN_9229,0.260819
GemmTunableOp_Half_TN,tn_8192_117_28672,Gemm_Hipblaslt_TN_8378,0.203067
GemmTunableOp_Half_TN,tn_10240_3203_8192,Gemm_Hipblaslt_TN_9753,0.865103
GemmTunableOp_Half_TN,tn_57344_1271_8192,Gemm_Hipblaslt_TN_9827,2.34954
GemmTunableOp_Half_TN,tn_10240_1286_8192,Gemm_Hipblaslt_TN_9189,0.356564
GemmTunableOp_Half_TN,tn_8192_130_8192,Gemm_Hipblaslt_TN_9306,0.0563219
GemmTunableOp_Half_TN,tn_10240_107_8192,Gemm_Hipblaslt_TN_7543,0.0594395
GemmTunableOp_Half_TN,tn_10240_99_8192,Gemm_Rocblas_621294504,0.0590072
GemmTunableOp_Half_TN,tn_8192_1217_28672,Gemm_Hipblaslt_TN_9774,1.18014
GemmTunableOp_Half_TN,tn_8192_3153_8192,Gemm_Hipblaslt_TN_9677,0.707094
GemmTunableOp_Half_TN,tn_57344_3715_8192,Gemm_Hipblaslt_TN_9922,6.40307
GemmTunableOp_Half_TN,tn_10240_3555_8192,Gemm_Hipblaslt_TN_9928,1.02253
GemmTunableOp_Half_TN,tn_57344_120_8192,Gemm_Rocblas_621286477,0.351987
GemmTunableOp_Half_TN,tn_57344_9_8192,Gemm_Hipblaslt_TN_9404,0.252545
GemmTunableOp_Half_TN,tn_8192_1265_8192,Gemm_Rocblas_621294426,0.299695
GemmTunableOp_Half_TN,tn_8192_101_8192,Gemm_Hipblaslt_TN_8891,0.0495095
GemmTunableOp_Half_TN,tn_10240_3251_8192,Gemm_Hipblaslt_TN_9753,0.879414
GemmTunableOp_Half_TN,tn_10240_91_8192,Gemm_Hipblaslt_TN_8095,0.0527323
GemmTunableOp_Half_TN,tn_8192_119_28672,Gemm_Hipblaslt_TN_8378,0.201014
GemmTunableOp_Half_TN,tn_10240_112_8192,Gemm_Rocblas_621286764,0.060096
GemmTunableOp_Half_TN,tn_8192_123_28672,Gemm_Hipblaslt_TN_8378,0.203732
GemmTunableOp_Half_TN,tn_8192_115_8192,Gemm_Hipblaslt_TN_8891,0.0511207
GemmTunableOp_Half_TN,tn_8192_3162_8192,Gemm_Hipblaslt_TN_9677,0.70326
GemmTunableOp_Half_TN,tn_8192_119_8192,Gemm_Hipblaslt_TN_8891,0.0516404
GemmTunableOp_Half_TN,tn_8192_3251_28672,Gemm_Hipblaslt_TN_9732,2.87239
GemmTunableOp_Half_TN,tn_8192_101_28672,Gemm_Hipblaslt_TN_8378,0.193308
GemmTunableOp_Half_TN,tn_57344_105_8192,Gemm_Rocblas_621294214,0.342637
GemmTunableOp_Half_TN,tn_8192_2015_8192,Gemm_Hipblaslt_TN_9217,0.428517
GemmTunableOp_Half_TN,tn_57344_25_8192,Default,0.265998
GemmTunableOp_Half_TN,tn_8192_1361_28672,Gemm_Hipblaslt_TN_9687,1.26923
GemmTunableOp_Half_TN,tn_8192_128_8192,Gemm_Hipblaslt_TN_8891,0.0534785
GemmTunableOp_Half_TN,tn_10240_1201_8192,Gemm_Hipblaslt_TN_9697,0.345088
GemmTunableOp_Half_TN,tn_8192_3651_8192,Gemm_Hipblaslt_TN_9813,0.808918
GemmTunableOp_Half_TN,tn_10240_102_8192,Gemm_Rocblas_621294504,0.059722
GemmTunableOp_Half_TN,tn_8192_124_8192,Gemm_Hipblaslt_TN_8891,0.0534574
GemmStridedBatchedTunableOp_Half_TN,tn_1152_1152_128_B_64,Gemm_Hipblaslt_TN_9774,0.0981979
GemmStridedBatchedTunableOp_Half_TN,tn_1151_1151_128_B_64,Gemm_Hipblaslt_TN_6879,0.118839
GemmStridedBatchedTunableOp_Half_TN,tn_1080_1080_128_B_64,Gemm_Rocblas_621294725,0.106286
GemmStridedBatchedTunableOp_Half_TN,tn_1341_1341_128_B_64,Gemm_Rocblas_621294109,0.155672
GemmStridedBatchedTunableOp_Half_TN,tn_1057_1057_128_B_64,Gemm_Rocblas_621294725,0.107389
GemmStridedBatchedTunableOp_Half_TN,tn_1367_1367_128_B_64,Gemm_Rocblas_621294109,0.158215
GemmStridedBatchedTunableOp_Half_TN,tn_1389_1389_128_B_64,Gemm_Rocblas_621294109,0.163063
GemmStridedBatchedTunableOp_Half_TN,tn_1038_1038_128_B_64,Gemm_Rocblas_621294725,0.10082
GemmStridedBatchedTunableOp_Half_TN,tn_1296_1296_128_B_64,Gemm_Rocblas_621294551,0.136107
GemmStridedBatchedTunableOp_Half_TN,tn_1128_1128_128_B_64,Gemm_Rocblas_621294725,0.114166
GemmStridedBatchedTunableOp_Half_TN,tn_1441_1441_128_B_64,Gemm_Rocblas_621294106,0.174575
GemmStridedBatchedTunableOp_Half_TN,tn_16_16_128_B_64,Gemm_Rocblas_621286717,0.00667556
GemmStridedBatchedTunableOp_Half_TN,tn_1350_1350_128_B_64,Gemm_Rocblas_621286412,0.154488
GemmStridedBatchedTunableOp_Half_TN,tn_1064_1064_128_B_64,Gemm_Rocblas_621294725,0.102961
GemmStridedBatchedTunableOp_Half_TN,tn_1076_1076_128_B_64,Gemm_Rocblas_621286397,0.108036
GemmStridedBatchedTunableOp_Half_TN,tn_1256_1256_128_B_64,Gemm_Rocblas_621294106,0.131775
GemmStridedBatchedTunableOp_Half_TN,tn_1392_1392_128_B_64,Gemm_Rocblas_621286412,0.148962
GemmStridedBatchedTunableOp_Half_TN,tn_1010_1010_128_B_64,Gemm_Hipblaslt_TN_6879,0.0964034
GemmStridedBatchedTunableOp_Half_TN,tn_1032_1032_128_B_64,Gemm_Rocblas_621294725,0.0996483
GemmStridedBatchedTunableOp_Half_TN,tn_1263_1263_128_B_64,Gemm_Hipblaslt_TN_6879,0.136173
GemmStridedBatchedTunableOp_Half_TN,tn_1022_1022_128_B_64,Gemm_Hipblaslt_TN_6879,0.0975572
GemmStridedBatchedTunableOp_Half_TN,tn_1455_1455_128_B_64,Gemm_Rocblas_621286397,0.179817
GemmStridedBatchedTunableOp_Half_TN,tn_1425_1425_128_B_64,Gemm_Rocblas_621294106,0.173502
GemmStridedBatchedTunableOp_Half_TN,tn_1318_1318_128_B_64,Gemm_Rocblas_621294109,0.151668
GemmStridedBatchedTunableOp_Half_TN,tn_1404_1404_128_B_64,Gemm_Rocblas_621286412,0.16285
GemmTunableOp_Half_TN,tn_8192_4096_14336,Gemm_Hipblaslt_TN_9756,1.72167
GemmTunableOp_Half_TN,tn_28672_256_8192,Gemm_Hipblaslt_TN_9540,0.291877
GemmTunableOp_Half_TN,tn_5120_4096_8192,Gemm_Hipblaslt_TN_9649,0.595885
GemmStridedBatchedTunableOp_Half_TN,tn_2000_2000_128_B_32,Gemm_Rocblas_621286397,0.147752
GemmTunableOp_Half_TN,tn_11008_4096_4096,Gemm_Rocblas_621294289,0.632704
GemmTunableOp_Half_TN,tn_4096_4096_2048,Gemm_Rocblas_621286281,0.118001
GemmTunableOp_Half_TN,tn_4096_256_2048,Gemm_Rocblas_621286447,0.0144404
GemmTunableOp_Half_TN,tn_6144_232_4096,Gemm_Rocblas_621294207,0.0356155
GemmStridedBatchedTunableOp_Half_TN,tn_1000_1000_128_B_16,Gemm_Rocblas_621293994,0.0253318
GemmTunableOp_Half_TN,tn_4096_2161_4096,Gemm_Hipblaslt_TN_9686,0.13345
GemmTunableOp_Half_TN,tn_4096_2193_4096,Gemm_Hipblaslt_TN_9698,0.135438
GemmTunableOp_Half_TN,tn_22016_145_4096,Gemm_Hipblaslt_TN_9321,0.0735501
GemmTunableOp_Half_TN,tn_12288_143_4096,Gemm_Hipblaslt_TN_9154,0.0416261
GemmTunableOp_Half_TN,tn_12288_2289_4096,Gemm_Hipblaslt_TN_9677,0.384279
GemmTunableOp_Half_TN,tn_12288_4096_4096,Gemm_Hipblaslt_TN_9220,0.677582
GemmTunableOp_Half_TN,tn_4096_2241_11008,Gemm_Hipblaslt_TN_9698,0.359252
GemmTunableOp_Half_TN,tn_4096_2433_4096,Gemm_Rocblas_621286753,0.151882
GemmTunableOp_Half_TN,tn_12288_2465_4096,Gemm_Hipblaslt_TN_9222,0.424368
GemmTunableOp_Half_TN,tn_12288_2337_4096,Gemm_Rocblas_621294420,0.407826
GemmTunableOp_Half_TN,tn_4096_2193_11008,Gemm_Hipblaslt_TN_9748,0.357324
GemmTunableOp_Half_TN,tn_22016_2497_4096,Gemm_Hipblaslt_TN_9832,0.793345
GemmTunableOp_Half_TN,tn_32000_132_4096,Gemm_Hipblaslt_TN_9564,0.0937796
GemmTunableOp_Half_TN,tn_12288_2225_4096,Gemm_Hipblaslt_TN_9697,0.379236
GemmTunableOp_Half_TN,tn_12288_2129_4096,Gemm_Hipblaslt_TN_9187,0.37315
GemmTunableOp_Half_TN,tn_32000_136_4096,Gemm_Hipblaslt_TN_9564,0.0946117
GemmTunableOp_Half_TN,tn_4096_2465_11008,Gemm_Hipblaslt_TN_9681,0.390969
GemmTunableOp_Half_TN,tn_32000_133_4096,Gemm_Hipblaslt_TN_9564,0.0939486
GemmTunableOp_Half_TN,tn_32000_141_4096,Gemm_Hipblaslt_TN_9564,0.0951893
GemmTunableOp_Half_TN,tn_22016_2177_4096,Gemm_Hipblaslt_TN_9827,0.685704
GemmTunableOp_Half_TN,tn_32000_256_4096,Gemm_Hipblaslt_TN_9845,0.13307
GemmTunableOp_Half_TN,tn_4096_156_11008,Gemm_Hipblaslt_TN_7563,0.0489789
GemmTunableOp_Half_TN,tn_4096_144_4096,Gemm_Hipblaslt_TN_9474,0.0220657
GemmTunableOp_Half_TN,tn_22016_144_4096,Gemm_Hipblaslt_TN_9319,0.0720027
GemmTunableOp_Half_TN,tn_4096_146_11008,Gemm_Hipblaslt_TN_7219,0.0463665
GemmTunableOp_Half_TN,tn_32000_146_4096,Gemm_Hipblaslt_TN_9612,0.0953952
GemmTunableOp_Half_TN,tn_4096_142_11008,Gemm_Hipblaslt_TN_7219,0.0455021
GemmTunableOp_Half_TN,tn_4096_2255_4096,Gemm_Hipblaslt_TN_9627,0.137978
GemmTunableOp_Half_TN,tn_4096_4000_11008,Gemm_Rocblas_621294034,0.575544
GemmTunableOp_Half_TN,tn_32000_149_4096,Gemm_Hipblaslt_TN_9564,0.0958326
GemmTunableOp_Half_TN,tn_4096_137_11008,Gemm_Hipblaslt_TN_8260,0.0446911
GemmTunableOp_Half_TN,tn_4096_149_4096,Gemm_Rocblas_621294168,0.0219267
GemmTunableOp_Half_TN,tn_4096_138_11008,Gemm_Hipblaslt_TN_7219,0.0454972
GemmTunableOp_Half_TN,tn_32000_148_4096,Gemm_Hipblaslt_TN_9564,0.0965265
GemmTunableOp_Half_TN,tn_12288_149_4096,Gemm_Rocblas_621286472,0.0431545
GemmTunableOp_Half_TN,tn_4096_2129_4096,Gemm_Hipblaslt_TN_9698,0.132281
GemmTunableOp_Half_TN,tn_32000_147_4096,Gemm_Hipblaslt_TN_9612,0.0964412
GemmTunableOp_Half_TN,tn_4096_2064_4096,Gemm_Hipblaslt_TN_9728,0.132527
GemmTunableOp_Half_TN,tn_22016_4000_4096,Gemm_Hipblaslt_TN_9832,1.23896
GemmTunableOp_Half_TN,tn_22016_157_4096,Gemm_Hipblaslt_TN_7216,0.0760254
GemmTunableOp_Half_TN,tn_22016_158_4096,Gemm_Hipblaslt_TN_9319,0.0755997
GemmTunableOp_Half_TN,tn_4096_4050_4096,Gemm_Hipblaslt_TN_9191,0.226929
GemmTunableOp_Half_TN,tn_4096_2209_11008,Gemm_Hipblaslt_TN_9698,0.356741
GemmTunableOp_Half_TN,tn_4096_2305_11008,Gemm_Hipblaslt_TN_9698,0.369483
GemmTunableOp_Half_TN,tn_4096_145_11008,Gemm_Hipblaslt_TN_7219,0.0466408
GemmTunableOp_Half_TN,tn_4096_2369_4096,Gemm_Hipblaslt_TN_9698,0.140539
GemmTunableOp_Half_TN,tn_4096_153_4096,Gemm_Rocblas_621294230,0.0221939
GemmTunableOp_Half_TN,tn_4096_161_11008,Gemm_Hipblaslt_TN_7586,0.0495424
GemmTunableOp_Half_TN,tn_32000_5_4096,Gemm_Rocblas_621294053,0.0486438
GemmTunableOp_Half_TN,tn_4096_4017_11008,Gemm_Hipblaslt_TN_9713,0.580137
GemmTunableOp_Half_TN,tn_12288_6_4096,Gemm_Rocblas_621286318,0.0212778
GemmTunableOp_Half_TN,tn_4096_6_4096,Gemm_Rocblas_621294130,0.0100037
GemmTunableOp_Half_TN,tn_4096_5_11008,Gemm_Rocblas_621286323,0.0230981
GemmTunableOp_Half_TN,tn_22016_2080_4096,Gemm_Hipblaslt_TN_9841,0.672568
GemmTunableOp_Half_TN,tn_12288_2303_4096,Gemm_Hipblaslt_TN_9743,0.383851
GemmTunableOp_Half_TN,tn_22016_2065_4096,Gemm_Hipblaslt_TN_9827,0.668176
GemmTunableOp_Half_TN,tn_4096_2081_11008,Gemm_Hipblaslt_TN_9698,0.34512
GemmTunableOp_Half_TN,tn_22016_2274_4096,Gemm_Hipblaslt_TN_9832,0.745586
GemmTunableOp_Half_TN,tn_4096_2272_11008,Gemm_Hipblaslt_TN_9728,0.361183
GemmTunableOp_Half_TN,tn_4096_2145_4096,Gemm_Hipblaslt_TN_9686,0.134112
GemmTunableOp_Half_TN,tn_12288_7_4096,Gemm_Rocblas_621286318,0.0213314
GemmTunableOp_Half_TN,tn_32000_134_4096,Gemm_Hipblaslt_TN_9564,0.0935757
GemmTunableOp_Half_TN,tn_22016_5_4096,Gemm_Rocblas_621286346,0.0350924
GemmTunableOp_Half_TN,tn_22016_2241_4096,Gemm_Hipblaslt_TN_9832,0.734246
GemmTunableOp_Half_TN,tn_22016_2321_4096,Gemm_Hipblaslt_TN_9846,0.780565
GemmTunableOp_Half_TN,tn_12288_136_4096,Gemm_Hipblaslt_TN_9144,0.0419959
GemmTunableOp_Half_TN,tn_4096_158_11008,Gemm_Hipblaslt_TN_8260,0.0475472
GemmTunableOp_Half_TN,tn_22016_4096_4096,Gemm_Hipblaslt_TN_9840,1.28167
GemmTunableOp_Half_TN,tn_12288_148_4096,Gemm_Rocblas_621294209,0.0436437
GemmTunableOp_Half_TN,tn_4096_156_4096,Gemm_Rocblas_621294230,0.0221645
GemmTunableOp_Half_TN,tn_4096_142_4096,Gemm_Hipblaslt_TN_9474,0.0216611
GemmTunableOp_Half_TN,tn_22016_2097_4096,Gemm_Hipblaslt_TN_9827,0.669489
GemmTunableOp_Half_TN,tn_12288_142_4096,Gemm_Rocblas_621286493,0.043452
GemmTunableOp_Half_TN,tn_12288_146_4096,Gemm_Rocblas_621286472,0.042934
GemmTunableOp_Half_TN,tn_4096_4096_4096,Gemm_Hipblaslt_TN_9827,0.227375
GemmTunableOp_Half_TN,tn_4096_2241_4096,Gemm_Hipblaslt_TN_9698,0.136457
GemmTunableOp_Half_TN,tn_32000_154_4096,Gemm_Hipblaslt_TN_9564,0.0965441
GemmTunableOp_Half_TN,tn_4096_7_11008,Gemm_Rocblas_621294054,0.023334
GemmTunableOp_Half_TN,tn_32000_159_4096,Gemm_Hipblaslt_TN_9606,0.0985324
GemmTunableOp_Half_TN,tn_12288_2257_4096,Gemm_Hipblaslt_TN_9743,0.38146
GemmTunableOp_Half_TN,tn_22016_2353_4096,Gemm_Hipblaslt_TN_9832,0.807986
GemmTunableOp_Half_TN,tn_4096_153_11008,Gemm_Hipblaslt_TN_8260,0.048148
GemmTunableOp_Half_TN,tn_12288_2417_4096,Gemm_Hipblaslt_TN_9217,0.410031
GemmTunableOp_Half_TN,tn_12288_145_4096,Gemm_Rocblas_621286472,0.0431609
GemmTunableOp_Half_TN,tn_4096_160_4096,Gemm_Rocblas_621294230,0.0221627
GemmTunableOp_Half_TN,tn_32000_131_4096,Gemm_Hipblaslt_TN_9564,0.0935829
GemmTunableOp_Half_TN,tn_12288_141_4096,Gemm_Rocblas_621286472,0.0428667
GemmTunableOp_Half_TN,tn_12288_2000_4096,Gemm_Rocblas_621286747,0.350137
GemmTunableOp_Half_TN,tn_4096_2258_4096,Gemm_Hipblaslt_TN_9686,0.13835
GemmTunableOp_Half_TN,tn_32000_7_4096,Gemm_Rocblas_621294053,0.0487732
GemmTunableOp_Half_TN,tn_12288_156_4096,Gemm_Rocblas_621286472,0.0432792
GemmStridedBatchedTunableOp_Half_TN,tn_2417_2417_128_B_32,Gemm_Rocblas_621294106,0.238258
GemmStridedBatchedTunableOp_Half_TN,tn_2113_2113_128_B_32,Gemm_Rocblas_621294106,0.180661
GemmStridedBatchedTunableOp_Half_TN,tn_2097_2097_128_B_32,Gemm_Rocblas_621294106,0.180096
GemmStridedBatchedTunableOp_Half_TN,tn_2257_2257_128_B_32,Gemm_Rocblas_621294106,0.208049
GemmStridedBatchedTunableOp_Half_TN,tn_2081_2081_128_B_32,Gemm_Rocblas_621294106,0.17911
GemmStridedBatchedTunableOp_Half_TN,tn_2305_2305_128_B_32,Gemm_Rocblas_621294542,0.223513
GemmStridedBatchedTunableOp_Half_TN,tn_2273_2273_128_B_32,Gemm_Rocblas_621294106,0.21057
GemmStridedBatchedTunableOp_Half_TN,tn_2274_2274_128_B_32,Gemm_Rocblas_621294106,0.207323
GemmStridedBatchedTunableOp_Half_TN,tn_2017_2017_128_B_32,Gemm_Rocblas_621286397,0.164558
GemmStridedBatchedTunableOp_Half_TN,tn_2290_2290_128_B_32,Gemm_Rocblas_621294106,0.210626
GemmTunableOp_Half_TN,tn_6144_4000_4096,Gemm_Rocblas_621294315,0.339748
GemmTunableOp_Half_TN,tn_4096_4096_5504,Gemm_Rocblas_621286281,0.301911
GemmStridedBatchedTunableOp_Half_TN,tn_2000_2000_128_B_16,Gemm_Hipblaslt_TN_153,0.0776304
GemmTunableOp_Half_TN,tn_5120_4000_8192,Gemm_Hipblaslt_TN_9649,0.583654
GemmTunableOp_Half_TN,tn_28672_256_8192,Gemm_Rocblas_621294717,0.290593
GemmTunableOp_Half_TN,tn_5120_4096_8192,Gemm_Rocblas_621286651,0.599902
GemmTunableOp_Half_TN,tn_5120_232_8192,Gemm_Rocblas_621286764,0.0575177
GemmStridedBatchedTunableOp_Half_TN,tn_1000_1000_128_B_32,Gemm_Hipblaslt_TN_149,0.0449833
GemmTunableOp_Half_TN,tn_10240_4048_8192,Gemm_Hipblaslt_TN_9814,1.11924
GemmTunableOp_Half_TN,tn_8192_2096_8192,Gemm_Hipblaslt_TN_9763,0.500206
GemmTunableOp_Half_TN,tn_8192_2284_28672,Gemm_Hipblaslt_TN_9649,2.23739
GemmTunableOp_Half_TN,tn_8192_2177_8192,Gemm_Hipblaslt_TN_9763,0.504617
GemmTunableOp_Half_TN,tn_8192_2239_28672,Gemm_Hipblaslt_TN_9762,2.09422
GemmTunableOp_Half_TN,tn_8192_4049_8192,Gemm_Hipblaslt_TN_9184,0.880015
GemmTunableOp_Half_TN,tn_10240_2255_8192,Gemm_Rocblas_621286580,0.650749
GemmTunableOp_Half_TN,tn_57344_2192_8192,Gemm_Hipblaslt_TN_154,3.99314
GemmTunableOp_Half_TN,tn_10240_2207_8192,Gemm_Hipblaslt_TN_9182,0.627947
GemmTunableOp_Half_TN,tn_57344_2239_8192,Default,3.9479
GemmTunableOp_Half_TN,tn_10240_2193_8192,Gemm_Hipblaslt_TN_9211,0.627612
GemmTunableOp_Half_TN,tn_8192_2049_8192,Gemm_Hipblaslt_TN_9742,0.490938
GemmTunableOp_Half_TN,tn_10240_2370_8192,Gemm_Hipblaslt_TN_9209,0.667175
GemmTunableOp_Half_TN,tn_57344_2304_8192,Gemm_Rocblas_621294542,4.02244
GemmTunableOp_Half_TN,tn_10240_2190_8192,Gemm_Hipblaslt_TN_9211,0.627813
GemmTunableOp_Half_TN,tn_57344_2238_8192,Gemm_Rocblas_621294542,3.97411
GemmTunableOp_Half_TN,tn_8192_2284_8192,Gemm_Hipblaslt_TN_9763,0.513136
GemmTunableOp_Half_TN,tn_57344_2178_8192,Default,3.89852
GemmTunableOp_Half_TN,tn_10240_62_8192,Gemm_Hipblaslt_TN_7492,0.0480553
GemmTunableOp_Half_TN,tn_8192_2465_8192,Gemm_Hipblaslt_TN_9774,0.597415
GemmTunableOp_Half_TN,tn_57344_61_8192,Gemm_Rocblas_621286468,0.304955
GemmTunableOp_Half_TN,tn_8192_4050_28672,Gemm_Rocblas_621294634,3.41561
GemmTunableOp_Half_TN,tn_8192_61_8192,Gemm_Hipblaslt_TN_7484,0.0398102
GemmTunableOp_Half_TN,tn_8192_2415_8192,Gemm_Hipblaslt_TN_9264,0.546526
GemmTunableOp_Half_TN,tn_57344_2208_8192,Gemm_Hipblaslt_TN_156,3.96586
GemmTunableOp_Half_TN,tn_10240_4096_8192,Gemm_Hipblaslt_TN_9743,1.1301
GemmTunableOp_Half_TN,tn_10240_2465_8192,Gemm_Hipblaslt_TN_9697,0.693573
GemmTunableOp_Half_TN,tn_8192_2065_8192,Gemm_Hipblaslt_TN_9742,0.496493
GemmTunableOp_Half_TN,tn_8192_2385_28672,Gemm_Hipblaslt_TN_9649,2.28778
GemmTunableOp_Half_TN,tn_8192_2255_28672,Gemm_Hipblaslt_TN_9649,2.21836
GemmTunableOp_Half_TN,tn_8192_2193_8192,Gemm_Hipblaslt_TN_9763,0.506831
GemmTunableOp_Half_TN,tn_8192_31_28672,Gemm_Rocblas_621286354,0.128482
GemmTunableOp_Half_TN,tn_8192_2302_8192,Gemm_Hipblaslt_TN_9763,0.515886
GemmTunableOp_Half_TN,tn_8192_2145_8192,Gemm_Hipblaslt_TN_9742,0.502815
GemmTunableOp_Half_TN,tn_8192_2159_8192,Gemm_Hipblaslt_TN_9742,0.500722
GemmTunableOp_Half_TN,tn_10240_2305_8192,Gemm_Hipblaslt_TN_9675,0.658696
GemmTunableOp_Half_TN,tn_57344_2017_8192,Gemm_Hipblaslt_TN_9840,3.50167
GemmTunableOp_Half_TN,tn_10240_2191_8192,Gemm_Hipblaslt_TN_9211,0.629069
GemmTunableOp_Half_TN,tn_8192_30_28672,Gemm_Rocblas_621286354,0.12831
GemmTunableOp_Half_TN,tn_32000_63_8192,Gemm_Rocblas_621294203,0.160806
GemmTunableOp_Half_TN,tn_8192_64_28672,Gemm_Rocblas_621286489,0.144765
GemmTunableOp_Half_TN,tn_10240_2270_8192,Gemm_Rocblas_621286617,0.652606
GemmTunableOp_Half_TN,tn_10240_2413_8192,Gemm_Hipblaslt_TN_9139,0.687171
GemmTunableOp_Half_TN,tn_8192_2369_8192,Gemm_Hipblaslt_TN_9229,0.544763
GemmTunableOp_Half_TN,tn_8192_2081_8192,Gemm_Hipblaslt_TN_9742,0.49872
GemmTunableOp_Half_TN,tn_10240_2128_8192,Gemm_Rocblas_621286663,0.62403
GemmTunableOp_Half_TN,tn_8192_2113_28672,Gemm_Hipblaslt_TN_9762,2.032
GemmTunableOp_Half_TN,tn_8192_66_8192,Gemm_Hipblaslt_TN_7093,0.0436711
GemmTunableOp_Half_TN,tn_57344_4096_8192,Gemm_Hipblaslt_TN_9963,6.64372
GemmTunableOp_Half_TN,tn_8192_2385_8192,Gemm_Hipblaslt_TN_9264,0.545936
GemmTunableOp_Half_TN,tn_8192_28_28672,Gemm_Rocblas_621294226,0.129545
GemmTunableOp_Half_TN,tn_10240_2127_8192,Gemm_Rocblas_621286663,0.622773
GemmTunableOp_Half_TN,tn_57344_68_8192,Gemm_Rocblas_621294520,0.321574
GemmTunableOp_Half_TN,tn_8192_2161_28672,Gemm_Hipblaslt_TN_9762,2.05102
GemmTunableOp_Half_TN,tn_10240_2178_8192,Gemm_Hipblaslt_TN_9209,0.627245
GemmTunableOp_Half_TN,tn_10240_67_8192,Gemm_Hipblaslt_TN_9304,0.0497179
GemmTunableOp_Half_TN,tn_10240_2239_8192,Gemm_Hipblaslt_TN_9211,0.634914
GemmTunableOp_Half_TN,tn_8192_2112_28672,Gemm_Hipblaslt_TN_9762,2.02484
GemmTunableOp_Half_TN,tn_57344_4000_8192,Gemm_Rocblas_621294643,6.59492
GemmTunableOp_Half_TN,tn_8192_2177_28672,Gemm_Hipblaslt_TN_9762,2.05391
GemmTunableOp_Half_TN,tn_8192_2397_8192,Gemm_Hipblaslt_TN_9208,0.549206
GemmTunableOp_Half_TN,tn_10240_64_8192,Gemm_Hipblaslt_TN_7492,0.0478092
GemmTunableOp_Half_TN,tn_57344_65_8192,Gemm_Rocblas_621294520,0.31923
GemmTunableOp_Half_TN,tn_10240_60_8192,Gemm_Hipblaslt_TN_9304,0.0470015
GemmTunableOp_Half_TN,tn_57344_63_8192,Gemm_Rocblas_621286468,0.305124
GemmTunableOp_Half_TN,tn_57344_2413_8192,Gemm_Hipblaslt_TN_9924,4.40781
GemmTunableOp_Half_TN,tn_57344_62_8192,Gemm_Rocblas_621286468,0.304352
GemmTunableOp_Half_TN,tn_8192_54_28672,Gemm_Rocblas_621294228,0.141622
GemmTunableOp_Half_TN,tn_57344_2193_8192,Gemm_Hipblaslt_TN_9841,4.01315
GemmTunableOp_Half_TN,tn_57344_28_8192,Gemm_Rocblas_621294194,0.27193
GemmTunableOp_Half_TN,tn_8192_2225_28672,Gemm_Hipblaslt_TN_9762,2.09006
GemmTunableOp_Half_TN,tn_57344_2158_8192,Gemm_Hipblaslt_TN_9827,3.98447
GemmTunableOp_Half_TN,tn_57344_4066_8192,Gemm_Hipblaslt_TN_9882,6.63913
GemmTunableOp_Half_TN,tn_8192_2158_8192,Gemm_Hipblaslt_TN_9763,0.504886
GemmTunableOp_Half_TN,tn_8192_2191_8192,Gemm_Hipblaslt_TN_9763,0.505978
GemmTunableOp_Half_TN,tn_57344_56_8192,Gemm_Rocblas_621286468,0.305049
GemmTunableOp_Half_TN,tn_57344_60_8192,Gemm_Rocblas_621286468,0.303696
GemmTunableOp_Half_TN,tn_57344_2255_8192,Gemm_Hipblaslt_TN_9666,4.07223
GemmTunableOp_Half_TN,tn_10240_2304_8192,Gemm_Rocblas_621286617,0.649122
GemmTunableOp_Half_TN,tn_8192_2238_28672,Gemm_Hipblaslt_TN_9762,2.09348
GemmTunableOp_Half_TN,tn_8192_2369_28672,Gemm_Hipblaslt_TN_9771,2.30076
GemmTunableOp_Half_TN,tn_10240_2096_8192,Gemm_Hipblaslt_TN_9729,0.621161
GemmStridedBatchedTunableOp_Half_TN,tn_2113_2113_128_B_64,Gemm_Rocblas_621294106,0.36754
GemmStridedBatchedTunableOp_Half_TN,tn_2397_2397_128_B_64,Gemm_Rocblas_621294106,0.459404
GemmStridedBatchedTunableOp_Half_TN,tn_2304_2304_128_B_64,Gemm_Hipblaslt_TN_158,0.351234
GemmStridedBatchedTunableOp_Half_TN,tn_2032_2032_128_B_64,Gemm_Rocblas_621286397,0.332543
GemmStridedBatchedTunableOp_Half_TN,tn_2082_2082_128_B_64,Gemm_Rocblas_621294106,0.351159
GemmStridedBatchedTunableOp_Half_TN,tn_2033_2033_128_B_64,Gemm_Hipblaslt_TN_6950,0.344259
GemmStridedBatchedTunableOp_Half_TN,tn_2177_2177_128_B_64,Gemm_Rocblas_621294106,0.380353
GemmStridedBatchedTunableOp_Half_TN,tn_2465_2465_128_B_64,Gemm_Rocblas_621294106,0.477157
GemmStridedBatchedTunableOp_Half_TN,tn_2208_2208_128_B_64,Gemm_Hipblaslt_TN_158,0.362015
GemmStridedBatchedTunableOp_Half_TN,tn_2159_2159_128_B_64,Gemm_Rocblas_621294106,0.376961
GemmStridedBatchedTunableOp_Half_TN,tn_2225_2225_128_B_64,Gemm_Rocblas_621294106,0.394281
GemmStridedBatchedTunableOp_Half_TN,tn_2257_2257_128_B_64,Gemm_Rocblas_621294106,0.403266
GemmStridedBatchedTunableOp_Half_TN,tn_2000_2000_128_B_64,Gemm_Hipblaslt_TN_159,0.32236
GemmStridedBatchedTunableOp_Half_TN,tn_2190_2190_128_B_64,Gemm_Rocblas_621294106,0.388216
GemmTunableOp_Half_TN,tn_8192_2337_8192,Gemm_Hipblaslt_TN_9274,0.537399
GemmTunableOp_Half_TN,tn_32000_54_8192,Gemm_Rocblas_621294203,0.156865
GemmTunableOp_Half_TN,tn_8192_2321_8192,Gemm_Hipblaslt_TN_9274,0.540739
GemmTunableOp_Half_TN,tn_8192_4050_8192,Gemm_Hipblaslt_TN_9704,0.88003
GemmTunableOp_Half_TN,tn_8192_2413_8192,Gemm_Hipblaslt_TN_9274,0.546622
GemmTunableOp_Half_TN,tn_57344_2302_8192,Gemm_Rocblas_621294543,4.05026
GemmTunableOp_Half_TN,tn_8192_59_28672,Default,0.147163
GemmTunableOp_Half_TN,tn_57344_4048_8192,Gemm_Hipblaslt_TN_9882,6.64359
GemmTunableOp_Half_TN,tn_57344_2289_8192,Default,3.98342
GemmTunableOp_Half_TN,tn_8192_4049_28672,Gemm_Rocblas_621286915,3.42684
GemmTunableOp_Half_TN,tn_8192_4081_8192,Gemm_Rocblas_621294435,0.878181
GemmTunableOp_Half_TN,tn_32000_256_8192,Gemm_Rocblas_621286625,0.319374
GemmTunableOp_Half_TN,tn_8192_2079_28672,Gemm_Hipblaslt_TN_9742,2.07537
GemmTunableOp_Half_TN,tn_8192_2000_8192,Gemm_Hipblaslt_TN_9202,0.430476
GemmTunableOp_Half_TN,tn_8192_2049_28672,Gemm_Hipblaslt_TN_9763,2.07995
GemmTunableOp_Half_TN,tn_8192_30_28672,Gemm_Rocblas_621294226,0.128314
GemmTunableOp_Half_TN,tn_10240_29_8192,Gemm_Hipblaslt_TN_9415,0.0401128
GemmTunableOp_Half_TN,tn_8192_2160_8192,Gemm_Hipblaslt_TN_9763,0.500902
GemmTunableOp_Half_TN,tn_8192_2255_28672,Gemm_Hipblaslt_TN_9649,2.21055
GemmTunableOp_Half_TN,tn_8192_2284_8192,Gemm_Hipblaslt_TN_9742,0.51354
GemmTunableOp_Half_TN,tn_8192_60_8192,Gemm_Hipblaslt_TN_7484,0.0391781
GemmTunableOp_Half_TN,tn_57344_2161_8192,Gemm_Hipblaslt_TN_9827,3.97961
GemmTunableOp_Half_TN,tn_57344_57_8192,Gemm_Rocblas_621286468,0.297431
GemmTunableOp_Half_TN,tn_8192_2465_8192,Gemm_Hipblaslt_TN_9774,0.599659
GemmTunableOp_Half_TN,tn_57344_2158_8192,Gemm_Hipblaslt_TN_9667,3.99609
GemmTunableOp_Half_TN,tn_10240_2208_8192,Gemm_Hipblaslt_TN_9182,0.628946
GemmTunableOp_Half_TN,tn_10240_68_8192,Gemm_Hipblaslt_TN_9304,0.0490416
GemmTunableOp_Half_TN,tn_57344_2028_8192,Gemm_Hipblaslt_TN_9840,3.52748
GemmTunableOp_Half_TN,tn_8192_2129_8192,Gemm_Hipblaslt_TN_9742,0.500959
GemmTunableOp_Half_TN,tn_57344_2079_8192,Gemm_Hipblaslt_TN_9841,3.93579
GemmTunableOp_Half_TN,tn_10240_2082_8192,Gemm_Hipblaslt_TN_9182,0.621378
GemmTunableOp_Half_TN,tn_8192_2413_28672,Gemm_Hipblaslt_TN_9649,2.32072
GemmTunableOp_Half_TN,tn_32000_28_8192,Gemm_Rocblas_621286350,0.14559
GemmTunableOp_Half_TN,tn_57344_2178_8192,Gemm_Hipblaslt_TN_9666,4.01379
GemmTunableOp_Half_TN,tn_57344_4049_8192,Gemm_Hipblaslt_TN_9758,6.62544
GemmTunableOp_Half_TN,tn_57344_2129_8192,Gemm_Hipblaslt_TN_9841,3.98624
GemmTunableOp_Half_TN,tn_57344_2465_8192,Gemm_Rocblas_621294015,4.39778
GemmTunableOp_Half_TN,tn_32000_29_8192,Gemm_Rocblas_621286350,0.144016
GemmTunableOp_Half_TN,tn_57344_2113_8192,Gemm_Hipblaslt_TN_9841,3.96877
GemmTunableOp_Half_TN,tn_8192_30_8192,Gemm_Hipblaslt_TN_9415,0.0339848
GemmTunableOp_Half_TN,tn_10240_30_8192,Gemm_Hipblaslt_TN_9415,0.040314
GemmTunableOp_Half_TN,tn_8192_2017_8192,Gemm_Hipblaslt_TN_9840,0.465344
GemmTunableOp_Half_TN,tn_8192_4017_28672,Gemm_Rocblas_621286894,3.40573
GemmTunableOp_Half_TN,tn_8192_4050_28672,Gemm_Rocblas_621286915,3.41756
GemmTunableOp_Half_TN,tn_8192_61_8192,Gemm_Hipblaslt_TN_7484,0.040736
GemmTunableOp_Half_TN,tn_8192_2190_28672,Gemm_Hipblaslt_TN_9762,2.06001
GemmTunableOp_Half_TN,tn_10240_64_8192,Gemm_Hipblaslt_TN_7492,0.0479107
GemmTunableOp_Half_TN,tn_32000_31_8192,Gemm_Rocblas_621286350,0.147846
GemmTunableOp_Half_TN,tn_32000_64_8192,Gemm_Rocblas_621286466,0.160154
GemmTunableOp_Half_TN,tn_8192_2385_28672,Gemm_Hipblaslt_TN_9771,2.3011
GemmTunableOp_Half_TN,tn_8192_2397_28672,Gemm_Hipblaslt_TN_9771,2.28901
GemmTunableOp_Half_TN,tn_10240_2191_8192,Gemm_Hipblaslt_TN_9211,0.630446
GemmTunableOp_Half_TN,tn_32000_67_8192,Gemm_Hipblaslt_TN_9479,0.184505
GemmTunableOp_Half_TN,tn_10240_2417_8192,Gemm_Hipblaslt_TN_9189,0.685607
GemmTunableOp_Half_TN,tn_57344_63_8192,Gemm_Rocblas_621286468,0.302412
GemmTunableOp_Half_TN,tn_10240_2289_8192,Gemm_Hipblaslt_TN_9182,0.65445
GemmTunableOp_Half_TN,tn_8192_60_28672,Gemm_Rocblas_621286489,0.142376
GemmTunableOp_Half_TN,tn_57344_2225_8192,Gemm_Hipblaslt_TN_9827,4.0099
GemmTunableOp_Half_TN,tn_8192_2161_8192,Gemm_Hipblaslt_TN_9742,0.502939
GemmTunableOp_Half_TN,tn_8192_67_8192,Gemm_Hipblaslt_TN_8197,0.043165
GemmTunableOp_Half_TN,tn_10240_2465_8192,Gemm_Hipblaslt_TN_9697,0.691508
GemmTunableOp_Half_TN,tn_57344_2208_8192,Gemm_Hipblaslt_TN_156,3.98475
GemmTunableOp_Half_TN,tn_10240_2397_8192,Gemm_Hipblaslt_TN_9209,0.667954
GemmTunableOp_Half_TN,tn_32000_59_8192,Gemm_Hipblaslt_TN_9463,0.158254
GemmTunableOp_Half_TN,tn_10240_2239_8192,Gemm_Hipblaslt_TN_9182,0.632384
GemmTunableOp_Half_TN,tn_8192_2192_28672,Gemm_Hipblaslt_TN_9762,2.07256
GemmTunableOp_Half_TN,tn_10240_2178_8192,Gemm_Rocblas_621294320,0.630343
GemmTunableOp_Half_TN,tn_10240_67_8192,Gemm_Hipblaslt_TN_9304,0.0500344
GemmTunableOp_Half_TN,tn_8192_2191_28672,Gemm_Hipblaslt_TN_9762,2.06635
GemmTunableOp_Half_TN,tn_8192_4081_28672,Gemm_Rocblas_621286915,3.43132
GemmTunableOp_Half_TN,tn_57344_4050_8192,Gemm_Hipblaslt_TN_9882,6.62516
GemmTunableOp_Half_TN,tn_57344_4000_8192,Gemm_Hipblaslt_TN_9936,6.59964
GemmTunableOp_Half_TN,tn_10240_4000_8192,Gemm_Hipblaslt_TN_9814,1.09501
GemmTunableOp_Half_TN,tn_57344_2081_8192,Gemm_Hipblaslt_TN_9847,3.93582
GemmTunableOp_Half_TN,tn_8192_2415_8192,Gemm_Hipblaslt_TN_9263,0.552096
GemmTunableOp_Half_TN,tn_8192_59_8192,Gemm_Hipblaslt_TN_7484,0.0392806
GemmTunableOp_Half_TN,tn_10240_2127_8192,Gemm_Hipblaslt_TN_9209,0.625205
GemmTunableOp_Half_TN,tn_57344_68_8192,Gemm_Rocblas_621294520,0.322669
GemmTunableOp_Half_TN,tn_57344_4033_8192,Gemm_Rocblas_621294648,6.63011
GemmTunableOp_Half_TN,tn_10240_2305_8192,Gemm_Hipblaslt_TN_9182,0.655602
GemmTunableOp_Half_TN,tn_57344_2385_8192,Default,4.32417
GemmStridedBatchedTunableOp_Half_TN,tn_2289_2289_128_B_64,Gemm_Rocblas_621294106,0.422266
GemmStridedBatchedTunableOp_Half_TN,tn_2128_2128_128_B_64,Gemm_Hipblaslt_TN_158,0.333041
GemmStridedBatchedTunableOp_Half_TN,tn_2160_2160_128_B_64,Gemm_Hipblaslt_TN_158,0.341052
GemmStridedBatchedTunableOp_Half_TN,tn_2048_2048_128_B_64,Gemm_Hipblaslt_TN_9831,0.275534
GemmStridedBatchedTunableOp_Half_TN,tn_2413_2413_128_B_64,Gemm_Rocblas_621294106,0.468755
GemmStridedBatchedTunableOp_Half_TN,tn_2129_2129_128_B_64,Gemm_Rocblas_621294106,0.369288
GemmStridedBatchedTunableOp_Half_TN,tn_2145_2145_128_B_64,Gemm_Rocblas_621294106,0.377735
GemmStridedBatchedTunableOp_Half_TN,tn_2337_2337_128_B_64,Gemm_Rocblas_621294106,0.451306
GemmStridedBatchedTunableOp_Half_TN,tn_2369_2369_128_B_64,Gemm_Rocblas_621294106,0.457108
GemmStridedBatchedTunableOp_Half_TN,tn_2081_2081_128_B_64,Gemm_Rocblas_621294106,0.353937
GemmStridedBatchedTunableOp_Half_TN,tn_2415_2415_128_B_64,Gemm_Rocblas_621294106,0.473109
GemmStridedBatchedTunableOp_Half_TN,tn_2050_2050_128_B_64,Gemm_Rocblas_621294106,0.339615
GemmStridedBatchedTunableOp_Half_TN,tn_2397_2397_128_B_64,Gemm_Rocblas_621294106,0.464024
GemmTunableOp_Half_TN,tn_8192_2549_28672,Gemm_Hipblaslt_TN_9774,2.31884
GemmTunableOp_Half_TN,tn_10240_2692_8192,Gemm_Hipblaslt_TN_9743,0.758443
GemmTunableOp_Half_TN,tn_8192_3331_8192,Gemm_Hipblaslt_TN_9677,0.734268
GemmTunableOp_Half_TN,tn_57344_1248_8192,Gemm_Hipblaslt_TN_9827,2.33103
GemmTunableOp_Half_TN,tn_10240_1276_8192,Gemm_Hipblaslt_TN_9192,0.356102
GemmTunableOp_Half_TN,tn_10240_1296_8192,Gemm_Hipblaslt_TN_9192,0.3568
GemmTunableOp_Half_TN,tn_57344_3451_8192,Gemm_Hipblaslt_TN_159,5.73401
GemmTunableOp_Half_TN,tn_57344_23_8192,Gemm_Rocblas_621294578,0.268479
GemmTunableOp_Half_TN,tn_57344_3162_8192,Gemm_Hipblaslt_TN_9816,5.5009
GemmTunableOp_Half_TN,tn_8192_1121_8192,Gemm_Hipblaslt_TN_9229,0.262821
GemmTunableOp_Half_TN,tn_10240_1168_8192,Gemm_Hipblaslt_TN_9697,0.341102
GemmTunableOp_Half_TN,tn_10240_1268_8192,Gemm_Hipblaslt_TN_9189,0.355923
GemmTunableOp_Half_TN,tn_8192_1208_28672,Gemm_Hipblaslt_TN_9774,1.17469
GemmTunableOp_Half_TN,tn_8192_1208_8192,Gemm_Hipblaslt_TN_9691,0.29671
GemmTunableOp_Half_TN,tn_8192_126_28672,Gemm_Hipblaslt_TN_8378,0.204925
GemmTunableOp_Half_TN,tn_10240_3187_8192,Gemm_Hipblaslt_TN_9815,0.870756
GemmTunableOp_Half_TN,tn_8192_3451_28672,Gemm_Hipblaslt_TN_9732,2.94287
GemmTunableOp_Half_TN,tn_8192_3546_28672,Gemm_Hipblaslt_TN_9732,3.01
GemmTunableOp_Half_TN,tn_57344_1168_8192,Gemm_Hipblaslt_TN_9841,2.27633
GemmTunableOp_Half_TN,tn_57344_1268_8192,Gemm_Hipblaslt_TN_9827,2.33358
GemmTunableOp_Half_TN,tn_32000_24_8192,Gemm_Rocblas_621294578,0.152288
GemmTunableOp_Half_TN,tn_10240_3642_8192,Gemm_Hipblaslt_TN_9743,1.03281
GemmTunableOp_Half_TN,tn_32000_95_8192,Gemm_Rocblas_621294212,0.196245
GemmTunableOp_Half_TN,tn_10240_3140_8192,Gemm_Hipblaslt_TN_9753,0.868955
GemmTunableOp_Half_TN,tn_10240_13_8192,Gemm_Hipblaslt_TN_9411,0.0371058
GemmTunableOp_Half_TN,tn_8192_99_28672,Gemm_Hipblaslt_TN_8378,0.197652
GemmTunableOp_Half_TN,tn_10240_2859_8192,Gemm_Hipblaslt_TN_9743,0.777435
GemmTunableOp_Half_TN,tn_57344_112_8192,Default,0.34593
GemmTunableOp_Half_TN,tn_10240_3747_8192,Gemm_Hipblaslt_TN_9763,1.05241
GemmTunableOp_Half_TN,tn_57344_2274_8192,Default,3.96841
GemmTunableOp_Half_TN,tn_8192_1321_28672,Gemm_Hipblaslt_TN_9774,1.1957
GemmTunableOp_Half_TN,tn_57344_1112_8192,Gemm_Hipblaslt_TN_9774,2.04581
GemmTunableOp_Half_TN,tn_8192_3400_28672,Gemm_Hipblaslt_TN_9732,2.93481
GemmTunableOp_Half_TN,tn_57344_3626_8192,Gemm_Hipblaslt_TN_9908,6.33591
GemmTunableOp_Half_TN,tn_8192_3754_28672,Gemm_Rocblas_621286968,3.25835
GemmTunableOp_Half_TN,tn_8192_3425_28672,Gemm_Hipblaslt_TN_9732,2.92925
GemmTunableOp_Half_TN,tn_8192_103_28672,Gemm_Hipblaslt_TN_8378,0.194709
GemmTunableOp_Half_TN,tn_57344_22_8192,Gemm_Rocblas_621286351,0.266591
GemmTunableOp_Half_TN,tn_8192_96_8192,Gemm_Hipblaslt_TN_7093,0.0470526
GemmTunableOp_Half_TN,tn_8192_3859_8192,Gemm_Rocblas_621294435,0.842184
GemmTunableOp_Half_TN,tn_10240_2962_8192,Gemm_Hipblaslt_TN_9655,0.827294
GemmTunableOp_Half_TN,tn_8192_1281_8192,Gemm_Rocblas_621286663,0.308435
GemmTunableOp_Half_TN,tn_8192_2962_28672,Gemm_Hipblaslt_TN_9687,2.63753
GemmTunableOp_Half_TN,tn_10240_3000_8192,Gemm_Hipblaslt_TN_9815,0.828499
GemmTunableOp_Half_TN,tn_10240_1104_8192,Gemm_Hipblaslt_TN_9209,0.314138
GemmTunableOp_Half_TN,tn_57344_1329_8192,Gemm_Hipblaslt_TN_9827,2.36592
GemmTunableOp_Half_TN,tn_57344_116_8192,Gemm_Rocblas_621294214,0.349142
GemmTunableOp_Half_TN,tn_10240_2664_8192,Gemm_Hipblaslt_TN_9814,0.73296
GemmTunableOp_Half_TN,tn_8192_3290_28672,Gemm_Hipblaslt_TN_9732,2.89039
GemmTunableOp_Half_TN,tn_8192_4035_28672,Gemm_Rocblas_621294658,3.39656
GemmTunableOp_Half_TN,tn_8192_104_8192,Gemm_Hipblaslt_TN_8891,0.0495559
GemmTunableOp_Half_TN,tn_8192_3651_28672,Default,3.21601
GemmTunableOp_Half_TN,tn_8192_119_28672,Gemm_Hipblaslt_TN_8378,0.202443
GemmTunableOp_Half_TN,tn_8192_2551_28672,Gemm_Hipblaslt_TN_9774,2.32503
GemmTunableOp_Half_TN,tn_8192_18_28672,Gemm_Hipblaslt_TN_9420,0.133786
GemmTunableOp_Half_TN,tn_8192_130_28672,Gemm_Hipblaslt_TN_7251,0.215241
GemmTunableOp_Half_TN,tn_10240_3203_8192,Gemm_Hipblaslt_TN_9223,0.875816
GemmTunableOp_Half_TN,tn_8192_1025_8192,Gemm_Hipblaslt_TN_9229,0.257024
GemmTunableOp_Half_TN,tn_10240_2041_8192,Gemm_Rocblas_621286569,0.597484
GemmTunableOp_Half_TN,tn_57344_3475_8192,Gemm_Hipblaslt_TN_159,5.79135
GemmTunableOp_Half_TN,tn_32000_256_8192,Gemm_Rocblas_621286625,0.320923
GemmTunableOp_Half_TN,tn_8192_3274_28672,Gemm_Hipblaslt_TN_9732,2.86637
GemmTunableOp_Half_TN,tn_10240_1248_8192,Gemm_Hipblaslt_TN_9697,0.352335
GemmTunableOp_Half_TN,tn_57344_2032_8192,Gemm_Hipblaslt_TN_9840,3.50425
GemmTunableOp_Half_TN,tn_32000_123_8192,Gemm_Rocblas_621286475,0.216959
GemmTunableOp_Half_TN,tn_32000_110_8192,Gemm_Rocblas_621294212,0.20933
GemmTunableOp_Half_TN,tn_8192_21_8192,Gemm_Hipblaslt_TN_9410,0.0322565
GemmTunableOp_Half_TN,tn_8192_3178_8192,Gemm_Hipblaslt_TN_9697,0.707339
GemmTunableOp_Half_TN,tn_32000_13_8192,Gemm_Rocblas_621294187,0.143521
GemmTunableOp_Half_TN,tn_57344_113_8192,Gemm_Rocblas_621286477,0.34896
GemmTunableOp_Half_TN,tn_10240_4082_8192,Gemm_Hipblaslt_TN_9743,1.12938
GemmTunableOp_Half_TN,tn_8192_1224_28672,Gemm_Hipblaslt_TN_9774,1.19178
GemmTunableOp_Half_TN,tn_8192_1008_8192,Gemm_Hipblaslt_TN_9208,0.246114
GemmTunableOp_Half_TN,tn_57344_2166_8192,Gemm_Hipblaslt_TN_9827,3.98114
GemmTunableOp_Half_TN,tn_8192_2802_28672,Gemm_Rocblas_621286667,2.52995
GemmTunableOp_Half_TN,tn_10240_3785_8192,Gemm_Hipblaslt_TN_9763,1.06008
GemmTunableOp_Half_TN,tn_57344_3400_8192,Gemm_Hipblaslt_TN_9915,5.71726
GemmTunableOp_Half_TN,tn_57344_4091_8192,Gemm_Hipblaslt_TN_9963,6.66673
GemmTunableOp_Half_TN,tn_8192_10_8192,Gemm_Hipblaslt_TN_9392,0.030548
GemmTunableOp_Half_TN,tn_8192_12_8192,Gemm_Hipblaslt_TN_9392,0.0306557
GemmTunableOp_Half_TN,tn_8192_1377_28672,Gemm_Hipblaslt_TN_9799,1.27449
GemmTunableOp_Half_TN,tn_8192_93_8192,Gemm_Hipblaslt_TN_8095,0.0478474
GemmTunableOp_Half_TN,tn_8192_3203_8192,Gemm_Hipblaslt_TN_9697,0.71057
GemmTunableOp_Half_TN,tn_57344_1360_8192,Gemm_Hipblaslt_TN_9830,2.55953
GemmTunableOp_Half_TN,tn_8192_1265_28672,Gemm_Hipblaslt_TN_9774,1.18819
GemmTunableOp_Half_TN,tn_10240_25_8192,Gemm_Hipblaslt_TN_9415,0.0393237
GemmTunableOp_Half_TN,tn_8192_5_8192,Gemm_Hipblaslt_TN_9388,0.0302916
GemmTunableOp_Half_TN,tn_8192_1233_8192,Gemm_Hipblaslt_TN_9209,0.294369
GemmTunableOp_Half_TN,tn_10240_95_8192,Gemm_Hipblaslt_TN_8095,0.0538335
GemmTunableOp_Half_TN,tn_8192_1276_28672,Gemm_Hipblaslt_TN_9774,1.19378
GemmTunableOp_Half_TN,tn_32000_10_8192,Gemm_Rocblas_621294187,0.143563
GemmTunableOp_Half_TN,tn_8192_106_28672,Gemm_Hipblaslt_TN_8378,0.196242
GemmTunableOp_Half_TN,tn_32000_111_8192,Gemm_Rocblas_621286475,0.21054
GemmTunableOp_Half_TN,tn_8192_118_28672,Gemm_Hipblaslt_TN_8378,0.202826
GemmTunableOp_Half_TN,tn_8192_122_28672,Gemm_Hipblaslt_TN_8378,0.204003
GemmTunableOp_Half_TN,tn_8192_98_28672,Gemm_Hipblaslt_TN_8378,0.195837
GemmTunableOp_Half_TN,tn_8192_2664_8192,Gemm_Hipblaslt_TN_9774,0.615346
GemmTunableOp_Half_TN,tn_8192_1264_28672,Gemm_Hipblaslt_TN_9774,1.19638
GemmTunableOp_Half_TN,tn_8192_3347_28672,Gemm_Hipblaslt_TN_9732,2.92155
GemmTunableOp_Half_TN,tn_8192_3626_28672,Gemm_Hipblaslt_TN_9732,3.04195
GemmTunableOp_Half_TN,tn_10240_1264_8192,Gemm_Hipblaslt_TN_9192,0.352176
GemmTunableOp_Half_TN,tn_57344_100_8192,Gemm_Rocblas_621286477,0.334971
GemmTunableOp_Half_TN,tn_8192_13_28672,Gemm_Hipblaslt_TN_9403,0.124631
GemmTunableOp_Half_TN,tn_8192_2032_28672,Gemm_Hipblaslt_TN_9840,1.76647
GemmTunableOp_Half_TN,tn_10240_110_8192,Gemm_Rocblas_621294504,0.0604012
GemmTunableOp_Half_TN,tn_57344_1233_8192,Default,2.31264
GemmTunableOp_Half_TN,tn_32000_7_8192,Gemm_Rocblas_621294578,0.141889
GemmTunableOp_Half_TN,tn_8192_3425_8192,Gemm_Hipblaslt_TN_9677,0.744615
GemmTunableOp_Half_TN,tn_8192_1201_8192,Gemm_Hipblaslt_TN_9799,0.295926
GemmTunableOp_Half_TN,tn_8192_124_28672,Gemm_Hipblaslt_TN_8378,0.206441
GemmTunableOp_Half_TN,tn_8192_1217_28672,Gemm_Hipblaslt_TN_9774,1.16791
GemmTunableOp_Half_TN,tn_10240_1313_8192,Gemm_Hipblaslt_TN_9192,0.359516
GemmTunableOp_Half_TN,tn_32000_107_8192,Gemm_Rocblas_621294212,0.207087
GemmTunableOp_Half_TN,tn_8192_11_28672,Gemm_Hipblaslt_TN_9402,0.126264
GemmTunableOp_Half_TN,tn_8192_17_28672,Gemm_Hipblaslt_TN_9420,0.134108
GemmTunableOp_Half_TN,tn_10240_3139_8192,Gemm_Hipblaslt_TN_9815,0.869715
GemmTunableOp_Half_TN,tn_32000_12_8192,Gemm_Rocblas_621294053,0.14405
GemmTunableOp_Half_TN,tn_57344_3491_8192,Gemm_Hipblaslt_TN_159,5.74514
GemmTunableOp_Half_TN,tn_10240_10_8192,Gemm_Hipblaslt_TN_9411,0.0370998
GemmTunableOp_Half_TN,tn_8192_4082_8192,Gemm_Rocblas_621286693,0.875161
GemmTunableOp_Half_TN,tn_8192_100_28672,Gemm_Hipblaslt_TN_8378,0.197005
GemmTunableOp_Half_TN,tn_8192_96_28672,Gemm_Hipblaslt_TN_8899,0.185306
GemmTunableOp_Half_TN,tn_8192_3283_8192,Gemm_Hipblaslt_TN_9189,0.731967
GemmTunableOp_Half_TN,tn_8192_4025_8192,Gemm_Hipblaslt_TN_9190,0.8654
GemmTunableOp_Half_TN,tn_32000_133_8192,Gemm_Hipblaslt_TN_9506,0.24102
GemmTunableOp_Half_TN,tn_8192_19_28672,Gemm_Hipblaslt_TN_9420,0.135298
GemmTunableOp_Half_TN,tn_8192_3971_28672,Gemm_Rocblas_621294648,3.399
GemmTunableOp_Half_TN,tn_8192_91_28672,Gemm_Hipblaslt_TN_8899,0.183411
GemmTunableOp_Half_TN,tn_8192_1321_8192,Gemm_Hipblaslt_TN_9799,0.312389
GemmTunableOp_Half_TN,tn_10240_125_8192,Gemm_Rocblas_621294504,0.0625832
GemmTunableOp_Half_TN,tn_8192_2866_8192,Gemm_Rocblas_621286683,0.646756
GemmTunableOp_Half_TN,tn_8192_2728_8192,Gemm_Hipblaslt_TN_9691,0.637861
GemmTunableOp_Half_TN,tn_8192_1329_8192,Gemm_Hipblaslt_TN_9697,0.314536
GemmTunableOp_Half_TN,tn_10240_3153_8192,Gemm_Hipblaslt_TN_9753,0.868047
GemmTunableOp_Half_TN,tn_57344_2866_8192,Gemm_Rocblas_621286655,5.05418
GemmTunableOp_Half_TN,tn_8192_3000_28672,Gemm_Hipblaslt_TN_9709,2.64707
GemmTunableOp_Half_TN,tn_57344_4035_8192,Gemm_Rocblas_621294636,6.60932
GemmTunableOp_Half_TN,tn_57344_17_8192,Gemm_Rocblas_621286351,0.267061
GemmTunableOp_Half_TN,tn_57344_3498_8192,Gemm_Hipblaslt_TN_159,5.7811
GemmTunableOp_Half_TN,tn_10240_3283_8192,Gemm_Hipblaslt_TN_9753,0.885053
GemmTunableOp_Half_TN,tn_57344_3178_8192,Gemm_Hipblaslt_TN_9816,5.50631
GemmTunableOp_Half_TN,tn_32000_128_8192,Gemm_Rocblas_621286475,0.21451
GemmTunableOp_Half_TN,tn_10240_133_8192,Gemm_Hipblaslt_TN_9367,0.0674465
GemmTunableOp_Half_TN,tn_8192_3299_8192,Gemm_Hipblaslt_TN_9139,0.733356
GemmTunableOp_Half_TN,tn_8192_4096_8192,Gemm_Hipblaslt_TN_9704,0.883401
GemmTunableOp_Half_TN,tn_8192_1185_28672,Gemm_Hipblaslt_TN_9774,1.16309
GemmTunableOp_Half_TN,tn_57344_124_8192,Default,0.35081
GemmTunableOp_Half_TN,tn_57344_2717_8192,Gemm_Hipblaslt_TN_9871,4.93526
GemmTunableOp_Half_TN,tn_57344_123_8192,Gemm_Rocblas_621286477,0.351796
GemmTunableOp_Half_TN,tn_8192_1329_28672,Gemm_Hipblaslt_TN_9774,1.21137
GemmTunableOp_Half_TN,tn_32000_106_8192,Gemm_Rocblas_621294212,0.207943
GemmTunableOp_Half_TN,tn_10240_2479_8192,Gemm_Hipblaslt_TN_9139,0.693639
GemmTunableOp_Half_TN,tn_32000_103_8192,Gemm_Rocblas_621286475,0.204148
GemmTunableOp_Half_TN,tn_8192_97_28672,Gemm_Hipblaslt_TN_8378,0.19223
GemmTunableOp_Half_TN,tn_8192_1296_28672,Gemm_Hipblaslt_TN_9774,1.21095
GemmTunableOp_Half_TN,tn_8192_131_8192,Gemm_Hipblaslt_TN_7561,0.0593538
GemmTunableOp_Half_TN,tn_8192_114_8192,Gemm_Hipblaslt_TN_8891,0.0511646
GemmTunableOp_Half_TN,tn_57344_19_8192,Gemm_Rocblas_621294194,0.266344
GemmTunableOp_Half_TN,tn_8192_3331_28672,Gemm_Hipblaslt_TN_9732,2.92895
GemmTunableOp_Half_TN,tn_32000_94_8192,Gemm_Rocblas_621286475,0.196265
GemmTunableOp_Half_TN,tn_10240_116_8192,Gemm_Rocblas_621286764,0.0613895
GemmTunableOp_Half_TN,tn_8192_120_28672,Gemm_Hipblaslt_TN_8378,0.203959
GemmTunableOp_Half_TN,tn_8192_3206_8192,Gemm_Hipblaslt_TN_9189,0.709891
GemmTunableOp_Half_TN,tn_57344_1319_8192,Gemm_Hipblaslt_TN_9841,2.36383
GemmTunableOp_Half_TN,tn_10240_3555_8192,Gemm_Hipblaslt_TN_9744,1.01361
GemmTunableOp_Half_TN,tn_8192_1350_8192,Gemm_Hipblaslt_TN_9799,0.316896
GemmTunableOp_Half_TN,tn_8192_3747_8192,Gemm_Rocblas_621294435,0.820837
GemmTunableOp_Half_TN,tn_10240_4091_8192,Gemm_Hipblaslt_TN_9743,1.12087
GemmTunableOp_Half_TN,tn_8192_2866_28672,Gemm_Hipblaslt_TN_9799,2.6049
GemmTunableOp_Half_TN,tn_8192_135_8192,Gemm_Hipblaslt_TN_9306,0.0594544
GemmTunableOp_Half_TN,tn_8192_4090_28672,Gemm_Rocblas_621286915,3.43722
GemmTunableOp_Half_TN,tn_8192_1112_28672,Gemm_Hipblaslt_TN_9762,1.08994
GemmTunableOp_Half_TN,tn_10240_2717_8192,Gemm_Hipblaslt_TN_9743,0.757408
GemmTunableOp_Half_TN,tn_8192_2859_8192,Gemm_Rocblas_621286666,0.648759
GemmTunableOp_Half_TN,tn_57344_115_8192,Gemm_Rocblas_621294214,0.347638
GemmTunableOp_Half_TN,tn_57344_2802_8192,Gemm_Hipblaslt_TN_9666,4.97109
GemmTunableOp_Half_TN,tn_57344_2728_8192,Gemm_Hipblaslt_TN_9733,4.94154
GemmTunableOp_Half_TN,tn_32000_122_8192,Gemm_Rocblas_621286475,0.213711
GemmTunableOp_Half_TN,tn_8192_3491_28672,Gemm_Hipblaslt_TN_9684,2.99291
GemmTunableOp_Half_TN,tn_8192_3187_8192,Gemm_Hipblaslt_TN_9192,0.707875
GemmStridedBatchedTunableOp_Half_TN,tn_1104_1104_128_B_64,Gemm_Rocblas_621294109,0.1029
GemmStridedBatchedTunableOp_Half_TN,tn_1249_1249_128_B_64,Gemm_Hipblaslt_TN_6879,0.134695
GemmStridedBatchedTunableOp_Half_TN,tn_1368_1368_128_B_64,Gemm_Rocblas_621294109,0.150676
GemmStridedBatchedTunableOp_Half_TN,tn_1367_1367_128_B_64,Gemm_Rocblas_621286412,0.158206
GemmStridedBatchedTunableOp_Half_TN,tn_1038_1038_128_B_64,Gemm_Rocblas_621294725,0.101012
GemmStridedBatchedTunableOp_Half_TN,tn_1297_1297_128_B_64,Gemm_Rocblas_621294109,0.148006
GemmStridedBatchedTunableOp_Half_TN,tn_1296_1296_128_B_64,Gemm_Rocblas_621294551,0.137509
GemmStridedBatchedTunableOp_Half_TN,tn_1008_1008_128_B_64,Gemm_Rocblas_621294763,0.0898633
GemmStridedBatchedTunableOp_Half_TN,tn_1128_1128_128_B_64,Gemm_Rocblas_621294725,0.111388
GemmStridedBatchedTunableOp_Half_TN,tn_1009_1009_128_B_64,Gemm_Hipblaslt_TN_6935,0.100063
GemmStridedBatchedTunableOp_Half_TN,tn_1441_1441_128_B_64,Gemm_Rocblas_621286397,0.176501
GemmStridedBatchedTunableOp_Half_TN,tn_16_16_128_B_64,Gemm_Rocblas_621286441,0.00624292
GemmStridedBatchedTunableOp_Half_TN,tn_1350_1350_128_B_64,Gemm_Rocblas_621294109,0.154128
GemmStridedBatchedTunableOp_Half_TN,tn_1064_1064_128_B_64,Gemm_Rocblas_621294106,0.104837
GemmStridedBatchedTunableOp_Half_TN,tn_1076_1076_128_B_64,Gemm_Rocblas_621294725,0.105763
GemmStridedBatchedTunableOp_Half_TN,tn_1256_1256_128_B_64,Gemm_Rocblas_621294106,0.132538
GemmStridedBatchedTunableOp_Half_TN,tn_1392_1392_128_B_64,Gemm_Rocblas_621286412,0.146959
GemmStridedBatchedTunableOp_Half_TN,tn_1010_1010_128_B_64,Gemm_Hipblaslt_TN_6879,0.0968047
GemmStridedBatchedTunableOp_Half_TN,tn_1032_1032_128_B_64,Gemm_Rocblas_621294725,0.100225
GemmStridedBatchedTunableOp_Half_TN,tn_1041_1041_128_B_64,Gemm_Rocblas_621294725,0.103163
GemmStridedBatchedTunableOp_Half_TN,tn_1022_1022_128_B_64,Gemm_Hipblaslt_TN_6879,0.0978995
GemmStridedBatchedTunableOp_Half_TN,tn_1224_1224_128_B_64,Gemm_Rocblas_621294106,0.12797
GemmStridedBatchedTunableOp_Half_TN,tn_1455_1455_128_B_64,Gemm_Rocblas_621294106,0.179208
GemmStridedBatchedTunableOp_Half_TN,tn_1425_1425_128_B_64,Gemm_Rocblas_621286397,0.171056
GemmStridedBatchedTunableOp_Half_TN,tn_1153_1153_128_B_64,Gemm_Hipblaslt_TN_6879,0.122671
GemmStridedBatchedTunableOp_Half_TN,tn_1404_1404_128_B_64,Gemm_Rocblas_621294109,0.162763
Validator,PT_VERSION,2.4.0
Validator,ROCM_VERSION,6.1.0.0-82-5fabb4c
Validator,HIPBLASLT_VERSION,0.7.0-1549b021
Validator,GCN_ARCH_NAME,gfx942:sramecc+:xnack-
Validator,ROCBLAS_VERSION,4.1.0-cefa4a9b-dirty
GemmTunableOp_Half_TN,tn_28672_4000_8192,Gemm_Rocblas_621294634,3.29509
GemmTunableOp_Half_TN,tn_8192_232_4096,Gemm_Rocblas_621286469,0.0419734
GemmTunableOp_Half_TN,tn_16000_256_8192,Gemm_Hipblaslt_TN_9583,0.163047
GemmTunableOp_Half_TN,tn_8192_4000_14336,Gemm_Hipblaslt_TN_9738,1.67379
GemmStridedBatchedTunableOp_Half_TN,tn_2000_2000_128_B_32,Gemm_Rocblas_621286397,0.151745
GemmTunableOp_Half_TN,tn_28672_256_4096,Gemm_Rocblas_621294324,0.119853
GemmTunableOp_Half_TN,tn_4096_256_14336,Gemm_Hipblaslt_TN_7435,0.0795798
GemmTunableOp_Half_TN,tn_6144_256_4096,Gemm_Rocblas_621286472,0.0359745
GemmTunableOp_Half_TN,tn_6144_8000_4096,Gemm_Hipblaslt_TN_9223,0.662565
GemmTunableOp_Half_TN,tn_128256_256_4096,Gemm_Rocblas_621294634,0.58903
GemmTunableOp_Half_TN,tn_4096_8192_4096,Gemm_Rocblas_621286713,0.446472
GemmStridedBatchedTunableOp_Half_TN,tn_1000_1000_128_B_32,Gemm_Hipblaslt_TN_149,0.0442316
GemmTunableOp_Half_TN,tn_57344_2096_8192,Gemm_Hipblaslt_TN_156,3.92737
GemmTunableOp_Half_TN,tn_8192_67_28672,Gemm_Hipblaslt_TN_8899,0.170742
GemmTunableOp_Half_TN,tn_57344_2191_8192,Gemm_Hipblaslt_TN_9841,3.9897
GemmTunableOp_Half_TN,tn_10240_28_8192,Gemm_Hipblaslt_TN_9415,0.0403079
GemmTunableOp_Half_TN,tn_10240_2160_8192,Gemm_Hipblaslt_TN_9182,0.626074
GemmTunableOp_Half_TN,tn_57344_4096_8192,Gemm_Hipblaslt_TN_9758,6.61928
GemmTunableOp_Half_TN,tn_32000_65_8192,Gemm_Hipblaslt_TN_9479,0.183831
GemmTunableOp_Half_TN,tn_10240_2239_8192,Gemm_Hipblaslt_TN_9211,0.636046
GemmTunableOp_Half_TN,tn_10240_2129_8192,Gemm_Hipblaslt_TN_9209,0.623886
GemmTunableOp_Half_TN,tn_57344_2315_8192,Gemm_Hipblaslt_TN_9716,4.39373
GemmTunableOp_Half_TN,tn_57344_2284_8192,Gemm_Rocblas_621294543,3.9991
GemmTunableOp_Half_TN,tn_8192_31_28672,Gemm_Rocblas_621286354,0.127873
GemmTunableOp_Half_TN,tn_8192_2315_28672,Gemm_Hipblaslt_TN_9649,2.26267
GemmTunableOp_Half_TN,tn_32000_56_8192,Gemm_Rocblas_621294203,0.157207
GemmTunableOp_Half_TN,tn_10240_4049_8192,Gemm_Hipblaslt_TN_9743,1.12477
GemmTunableOp_Half_TN,tn_57344_55_8192,Gemm_Hipblaslt_TN_9459,0.297329
GemmTunableOp_Half_TN,tn_8192_2385_28672,Gemm_Hipblaslt_TN_9649,2.30161
GemmTunableOp_Half_TN,tn_57344_2417_8192,Gemm_Hipblaslt_TN_9852,4.3833
GemmTunableOp_Half_TN,tn_8192_62_28672,Gemm_Rocblas_621294228,0.143156
GemmTunableOp_Half_TN,tn_8192_2255_28672,Gemm_Hipblaslt_TN_9649,2.20655
GemmTunableOp_Half_TN,tn_57344_2385_8192,Gemm_Hipblaslt_TN_9716,4.45746
GemmTunableOp_Half_TN,tn_57344_2017_8192,Gemm_Hipblaslt_TN_9840,3.50726
GemmTunableOp_Half_TN,tn_8192_2208_28672,Gemm_Hipblaslt_TN_9762,2.08151
GemmTunableOp_Half_TN,tn_8192_4081_8192,Gemm_Hipblaslt_TN_9184,0.880343
GemmTunableOp_Half_TN,tn_10240_2270_8192,Gemm_Rocblas_621294317,0.652952
GemmTunableOp_Half_TN,tn_8192_2082_8192,Gemm_Hipblaslt_TN_9742,0.498407
GemmTunableOp_Half_TN,tn_57344_57_8192,Gemm_Hipblaslt_TN_7491,0.299081
GemmTunableOp_Half_TN,tn_8192_2304_28672,Gemm_Hipblaslt_TN_9774,2.26126
GemmTunableOp_Half_TN,tn_10240_65_8192,Gemm_Hipblaslt_TN_8095,0.049408
GemmTunableOp_Half_TN,tn_57344_4049_8192,Gemm_Hipblaslt_TN_9963,6.63198
GemmTunableOp_Half_TN,tn_57344_2129_8192,Gemm_Hipblaslt_TN_9827,3.95052
GemmTunableOp_Half_TN,tn_8192_2113_8192,Gemm_Hipblaslt_TN_9742,0.499453
GemmTunableOp_Half_TN,tn_8192_2049_28672,Gemm_Hipblaslt_TN_9765,2.0841
GemmTunableOp_Half_TN,tn_57344_2158_8192,Gemm_Hipblaslt_TN_9841,3.99803
GemmTunableOp_Half_TN,tn_57344_4066_8192,Gemm_Hipblaslt_TN_9758,6.65605
GemmTunableOp_Half_TN,tn_10240_2082_8192,Gemm_Hipblaslt_TN_9209,0.620679
GemmTunableOp_Half_TN,tn_8192_2413_28672,Gemm_Hipblaslt_TN_9771,2.31662
GemmTunableOp_Half_TN,tn_10240_2208_8192,Gemm_Hipblaslt_TN_9182,0.629955
GemmTunableOp_Half_TN,tn_8192_2207_28672,Gemm_Hipblaslt_TN_9762,2.0806
GemmTunableOp_Half_TN,tn_8192_2161_8192,Gemm_Hipblaslt_TN_9742,0.504286
GemmTunableOp_Half_TN,tn_8192_2385_8192,Gemm_Hipblaslt_TN_9208,0.547893
GemmTunableOp_Half_TN,tn_10240_2127_8192,Gemm_Hipblaslt_TN_9209,0.621649
GemmTunableOp_Half_TN,tn_57344_4033_8192,Gemm_Rocblas_621294643,6.61371
GemmTunableOp_Half_TN,tn_57344_68_8192,Gemm_Rocblas_621294520,0.309038
GemmTunableOp_Half_TN,tn_8192_2161_28672,Gemm_Hipblaslt_TN_9762,2.0337
GemmTunableOp_Half_TN,tn_10240_2178_8192,Gemm_Hipblaslt_TN_9209,0.627753
GemmTunableOp_Half_TN,tn_8192_2192_28672,Gemm_Hipblaslt_TN_9762,2.06322
GemmTunableOp_Half_TN,tn_10240_67_8192,Gemm_Hipblaslt_TN_9304,0.0492568
GemmTunableOp_Half_TN,tn_57344_2049_8192,Gemm_Hipblaslt_TN_9827,3.92229
GemmTunableOp_Half_TN,tn_8192_2270_28672,Gemm_Hipblaslt_TN_9649,2.23767
GemmTunableOp_Half_TN,tn_32000_68_8192,Gemm_Hipblaslt_TN_9479,0.183112
GemmTunableOp_Half_TN,tn_57344_28_8192,Gemm_Hipblaslt_TN_9424,0.246631
GemmTunableOp_Half_TN,tn_8192_2000_8192,Gemm_Hipblaslt_TN_9202,0.424681
GemmTunableOp_Half_TN,tn_57344_2082_8192,Gemm_Hipblaslt_TN_9827,3.96136
GemmTunableOp_Half_TN,tn_57344_2413_8192,Gemm_Hipblaslt_TN_9800,4.39272
GemmTunableOp_Half_TN,tn_32000_57_8192,Gemm_Rocblas_621286466,0.157747
GemmTunableOp_Half_TN,tn_57344_4050_8192,Gemm_Hipblaslt_TN_9758,6.61453
GemmTunableOp_Half_TN,tn_57344_2081_8192,Gemm_Hipblaslt_TN_9827,3.96586
GemmTunableOp_Half_TN,tn_8192_2415_8192,Gemm_Hipblaslt_TN_9274,0.543291
GemmTunableOp_Half_TN,tn_8192_59_8192,Gemm_Hipblaslt_TN_7484,0.0389573
GemmTunableOp_Half_TN,tn_57344_2161_8192,Gemm_Hipblaslt_TN_9733,4.01283
GemmTunableOp_Half_TN,tn_8192_60_8192,Gemm_Hipblaslt_TN_7484,0.039191
GemmTunableOp_Half_TN,tn_8192_2079_28672,Gemm_Hipblaslt_TN_9650,2.08308
GemmTunableOp_Half_TN,tn_32000_59_8192,Gemm_Hipblaslt_TN_9463,0.15898
GemmTunableOp_Half_TN,tn_10240_2397_8192,Gemm_Hipblaslt_TN_9209,0.667151
GemmTunableOp_Half_TN,tn_57344_2177_8192,Gemm_Hipblaslt_TN_9827,3.99275
GemmTunableOp_Half_TN,tn_10240_2079_8192,Gemm_Hipblaslt_TN_9209,0.608137
GemmTunableOp_Half_TN,tn_10240_2289_8192,Gemm_Rocblas_621286581,0.65422
GemmTunableOp_Half_TN,tn_57344_2465_8192,Gemm_Rocblas_621294015,4.40874
GemmTunableOp_Half_TN,tn_8192_66_28672,Gemm_Hipblaslt_TN_8899,0.16967
GemmTunableOp_Half_TN,tn_57344_2289_8192,Gemm_Hipblaslt_TN_9757,4.06897
GemmTunableOp_Half_TN,tn_57344_56_8192,Gemm_Rocblas_621294203,0.297841
GemmTunableOp_Half_TN,tn_8192_59_28672,Gemm_Rocblas_621294228,0.146126
GemmStridedBatchedTunableOp_Half_TN,tn_2113_2113_128_B_64,Gemm_Rocblas_621294106,0.362799
GemmStridedBatchedTunableOp_Half_TN,tn_2397_2397_128_B_64,Gemm_Rocblas_621294106,0.459517
GemmStridedBatchedTunableOp_Half_TN,tn_2304_2304_128_B_64,Gemm_Rocblas_621294551,0.34973
GemmStridedBatchedTunableOp_Half_TN,tn_2032_2032_128_B_64,Gemm_Hipblaslt_TN_157,0.33286
GemmStridedBatchedTunableOp_Half_TN,tn_2082_2082_128_B_64,Gemm_Rocblas_621294106,0.349689
GemmStridedBatchedTunableOp_Half_TN,tn_2033_2033_128_B_64,Gemm_Hipblaslt_TN_6950,0.346709
GemmStridedBatchedTunableOp_Half_TN,tn_2177_2177_128_B_64,Gemm_Rocblas_621294106,0.386267
GemmStridedBatchedTunableOp_Half_TN,tn_2465_2465_128_B_64,Gemm_Rocblas_621294106,0.489378
GemmStridedBatchedTunableOp_Half_TN,tn_2208_2208_128_B_64,Gemm_Hipblaslt_TN_158,0.358908
GemmStridedBatchedTunableOp_Half_TN,tn_2159_2159_128_B_64,Gemm_Rocblas_621294106,0.379644
GemmStridedBatchedTunableOp_Half_TN,tn_2225_2225_128_B_64,Gemm_Rocblas_621294106,0.396038
GemmStridedBatchedTunableOp_Half_TN,tn_2257_2257_128_B_64,Gemm_Rocblas_621294106,0.413617
GemmStridedBatchedTunableOp_Half_TN,tn_2000_2000_128_B_64,Gemm_Hipblaslt_TN_9841,0.321101
GemmStridedBatchedTunableOp_Half_TN,tn_2190_2190_128_B_64,Gemm_Rocblas_621294106,0.390053
GemmTunableOp_Half_TN,tn_5120_4000_8192,Gemm_Hipblaslt_TN_9649,0.589886
GemmTunableOp_Half_TN,tn_28672_256_8192,Gemm_Hipblaslt_TN_9540,0.295412
GemmTunableOp_Half_TN,tn_5120_4096_8192,Gemm_Rocblas_621294392,0.603401
GemmTunableOp_Half_TN,tn_5120_232_8192,Gemm_Rocblas_621294504,0.0575383
GemmStridedBatchedTunableOp_Half_TN,tn_1000_1000_128_B_32,Gemm_Hipblaslt_TN_149,0.0443002
GemmTunableOp_Half_TN,tn_8192_3206_28672,Gemm_Hipblaslt_TN_9731,2.86292
GemmTunableOp_Half_TN,tn_32000_22_8192,Gemm_Rocblas_621294578,0.148126
GemmTunableOp_Half_TN,tn_10240_3425_8192,Gemm_Hipblaslt_TN_9799,0.987948
GemmTunableOp_Half_TN,tn_10240_121_8192,Gemm_Hipblaslt_TN_8892,0.061312
GemmTunableOp_Half_TN,tn_10240_101_8192,Gemm_Rocblas_621294504,0.0579524
GemmTunableOp_Half_TN,tn_8192_1233_28672,Gemm_Hipblaslt_TN_9774,1.172
GemmTunableOp_Half_TN,tn_32000_16_8192,Gemm_Rocblas_621286319,0.138391
GemmTunableOp_Half_TN,tn_8192_1233_8192,Gemm_Hipblaslt_TN_9182,0.298218
GemmTunableOp_Half_TN,tn_57344_1248_8192,Gemm_Hipblaslt_TN_9783,2.32911
GemmTunableOp_Half_TN,tn_10240_1276_8192,Gemm_Hipblaslt_TN_9192,0.357932
GemmTunableOp_Half_TN,tn_10240_1296_8192,Gemm_Hipblaslt_TN_9697,0.357307
GemmTunableOp_Half_TN,tn_57344_23_8192,Gemm_Rocblas_621294194,0.264892
GemmTunableOp_Half_TN,tn_57344_3162_8192,Gemm_Hipblaslt_TN_9816,5.50549
GemmTunableOp_Half_TN,tn_8192_1121_8192,Gemm_Hipblaslt_TN_9207,0.26232
GemmTunableOp_Half_TN,tn_57344_1168_8192,Gemm_Hipblaslt_TN_9827,2.27444
GemmTunableOp_Half_TN,tn_8192_1208_28672,Gemm_Hipblaslt_TN_9774,1.17172
GemmTunableOp_Half_TN,tn_57344_2274_8192,Gemm_Hipblaslt_TN_9734,4.06523
GemmTunableOp_Half_TN,tn_8192_1321_28672,Gemm_Hipblaslt_TN_9774,1.21152
GemmTunableOp_Half_TN,tn_57344_1112_8192,Gemm_Hipblaslt_TN_9774,2.05476
GemmTunableOp_Half_TN,tn_8192_14_8192,Gemm_Hipblaslt_TN_9392,0.030689
GemmTunableOp_Half_TN,tn_8192_126_28672,Gemm_Hipblaslt_TN_8378,0.201827
GemmTunableOp_Half_TN,tn_8192_1201_28672,Gemm_Hipblaslt_TN_9774,1.164
GemmTunableOp_Half_TN,tn_10240_3451_8192,Gemm_Hipblaslt_TN_9674,0.992147
GemmTunableOp_Half_TN,tn_32000_92_8192,Gemm_Rocblas_621294212,0.192121
GemmTunableOp_Half_TN,tn_57344_3754_8192,Gemm_Hipblaslt_TN_9922,6.40966
GemmTunableOp_Half_TN,tn_10240_113_8192,Gemm_Rocblas_621286764,0.0597835
GemmTunableOp_Half_TN,tn_8192_107_8192,Gemm_Hipblaslt_TN_7544,0.0521501
GemmTunableOp_Half_TN,tn_10240_1297_8192,Gemm_Hipblaslt_TN_9192,0.357414
GemmTunableOp_Half_TN,tn_8192_1360_28672,Gemm_Hipblaslt_TN_9799,1.27205
GemmTunableOp_Half_TN,tn_8192_1360_8192,Gemm_Rocblas_621286683,0.319025
GemmTunableOp_Half_TN,tn_10240_1377_8192,Gemm_Hipblaslt_TN_9278,0.395815
GemmTunableOp_Half_TN,tn_8192_1389_28672,Gemm_Hipblaslt_TN_9799,1.27866
GemmTunableOp_Half_TN,tn_57344_132_8192,Gemm_Hipblaslt_TN_9507,0.395151
GemmTunableOp_Half_TN,tn_10240_1329_8192,Gemm_Hipblaslt_TN_9139,0.361557
GemmTunableOp_Half_TN,tn_8192_1208_8192,Gemm_Hipblaslt_TN_9209,0.2955
GemmTunableOp_Half_TN,tn_8192_3203_28672,Gemm_Hipblaslt_TN_9732,2.87326
GemmTunableOp_Half_TN,tn_8192_1377_8192,Gemm_Hipblaslt_TN_9799,0.320169
GemmTunableOp_Half_TN,tn_57344_2000_8192,Gemm_Hipblaslt_TN_9840,3.48608
GemmTunableOp_Half_TN,tn_10240_2000_8192,Gemm_Hipblaslt_TN_9649,0.58276
GemmTunableOp_Half_TN,tn_8192_2274_8192,Gemm_Hipblaslt_TN_9742,0.512479
GemmTunableOp_Half_TN,tn_10240_2166_8192,Gemm_Hipblaslt_TN_9182,0.629883
GemmTunableOp_Half_TN,tn_8192_1104_28672,Gemm_Hipblaslt_TN_9762,1.07739
GemmTunableOp_Half_TN,tn_8192_111_28672,Gemm_Hipblaslt_TN_8378,0.193754
GemmTunableOp_Half_TN,tn_8192_111_8192,Gemm_Hipblaslt_TN_8891,0.0509529
GemmTunableOp_Half_TN,tn_8192_4083_28672,Gemm_Rocblas_621294658,3.41278
GemmTunableOp_Half_TN,tn_10240_93_8192,Gemm_Hipblaslt_TN_8095,0.053027
GemmTunableOp_Half_TN,tn_32000_91_8192,Gemm_Rocblas_621294212,0.195753
GemmTunableOp_Half_TN,tn_8192_3546_8192,Gemm_Hipblaslt_TN_9677,0.772775
GemmTunableOp_Half_TN,tn_8192_110_8192,Gemm_Hipblaslt_TN_8891,0.0493723
GemmTunableOp_Half_TN,tn_57344_1350_8192,Gemm_Hipblaslt_TN_9830,2.55038
GemmTunableOp_Half_TN,tn_32000_129_8192,Gemm_Hipblaslt_TN_9506,0.236495
GemmTunableOp_Half_TN,tn_8192_3475_8192,Gemm_Hipblaslt_TN_9192,0.767792
GemmTunableOp_Half_TN,tn_10240_1249_8192,Gemm_Hipblaslt_TN_9743,0.352277
GemmTunableOp_Half_TN,tn_8192_1319_28672,Gemm_Hipblaslt_TN_9774,1.20437
GemmTunableOp_Half_TN,tn_57344_12_8192,Gemm_Hipblaslt_TN_9405,0.253979
GemmTunableOp_Half_TN,tn_57344_1374_8192,Gemm_Hipblaslt_TN_9830,2.56532
GemmTunableOp_Half_TN,tn_8192_2639_28672,Gemm_Hipblaslt_TN_9774,2.34689
GemmTunableOp_Half_TN,tn_57344_3379_8192,Gemm_Hipblaslt_TN_159,5.6605
GemmTunableOp_Half_TN,tn_32000_135_8192,Gemm_Hipblaslt_TN_9506,0.238385
GemmTunableOp_Half_TN,tn_8192_3555_8192,Gemm_Hipblaslt_TN_9697,0.772373
GemmTunableOp_Half_TN,tn_10240_3139_8192,Gemm_Hipblaslt_TN_9815,0.866064
GemmTunableOp_Half_TN,tn_8192_3140_8192,Gemm_Hipblaslt_TN_9189,0.710464
GemmTunableOp_Half_TN,tn_10240_13_8192,Gemm_Hipblaslt_TN_9411,0.0370685
GemmTunableOp_Half_TN,tn_8192_3283_28672,Gemm_Hipblaslt_TN_9732,2.87605
GemmTunableOp_Half_TN,tn_10240_3178_8192,Gemm_Hipblaslt_TN_9223,0.867977
GemmTunableOp_Half_TN,tn_57344_1160_8192,Gemm_Hipblaslt_TN_9827,2.27319
GemmTunableOp_Half_TN,tn_57344_3120_8192,Gemm_Hipblaslt_TN_9803,5.48448
GemmTunableOp_Half_TN,tn_32000_127_8192,Gemm_Rocblas_621294212,0.208865
GemmTunableOp_Half_TN,tn_8192_21_28672,Gemm_Rocblas_621294226,0.128864
GemmTunableOp_Half_TN,tn_10240_3482_8192,Gemm_Hipblaslt_TN_9799,0.993983
GemmTunableOp_Half_TN,tn_8192_1276_28672,Gemm_Rocblas_621286579,1.19427
GemmTunableOp_Half_TN,tn_8192_2760_8192,Gemm_Rocblas_621294426,0.640401
GemmTunableOp_Half_TN,tn_8192_2914_8192,Gemm_Rocblas_621294320,0.661242
GemmTunableOp_Half_TN,tn_57344_7_8192,Gemm_Hipblaslt_TN_9405,0.252233
GemmTunableOp_Half_TN,tn_10240_3331_8192,Gemm_Hipblaslt_TN_9815,0.889372
GemmTunableOp_Half_TN,tn_8192_1389_8192,Gemm_Hipblaslt_TN_9674,0.321838
GemmTunableOp_Half_TN,tn_57344_122_8192,Default,0.351052
GemmTunableOp_Half_TN,tn_57344_95_8192,Gemm_Hipblaslt_TN_9478,0.333105
GemmTunableOp_Half_TN,tn_57344_1025_8192,Gemm_Hipblaslt_TN_9841,1.9577
GemmTunableOp_Half_TN,tn_8192_1296_28672,Gemm_Hipblaslt_TN_9774,1.19868
GemmTunableOp_Half_TN,tn_57344_18_8192,Gemm_Rocblas_621286348,0.264097
GemmTunableOp_Half_TN,tn_8192_1249_28672,Gemm_Rocblas_621286579,1.18343
GemmTunableOp_Half_TN,tn_8192_14_28672,Gemm_Rocblas_621294224,0.123434
GemmTunableOp_Half_TN,tn_8192_3235_8192,Gemm_Hipblaslt_TN_9677,0.710094
GemmTunableOp_Half_TN,tn_8192_3619_8192,Gemm_Hipblaslt_TN_9743,0.780459
GemmTunableOp_Half_TN,tn_8192_3206_8192,Gemm_Hipblaslt_TN_9192,0.709996
GemmTunableOp_Half_TN,tn_57344_3715_8192,Gemm_Hipblaslt_TN_9908,6.37549
GemmTunableOp_Half_TN,tn_10240_3555_8192,Gemm_Hipblaslt_TN_9744,1.01429
GemmTunableOp_Half_TN,tn_57344_1000_8192,Gemm_Rocblas_621286801,1.80221
GemmTunableOp_Half_TN,tn_8192_3290_28672,Gemm_Hipblaslt_TN_9684,2.90453
GemmTunableOp_Half_TN,tn_10240_1168_8192,Gemm_Hipblaslt_TN_9697,0.342429
GemmTunableOp_Half_TN,tn_32000_119_8192,Gemm_Rocblas_621286475,0.209632
GemmTunableOp_Half_TN,tn_10240_120_8192,Gemm_Hipblaslt_TN_8892,0.0621913
GemmTunableOp_Half_TN,tn_8192_3785_8192,Gemm_Hipblaslt_TN_9217,0.823607
GemmTunableOp_Half_TN,tn_8192_100_8192,Gemm_Hipblaslt_TN_8891,0.0516247
GemmTunableOp_Half_TN,tn_8192_102_28672,Gemm_Hipblaslt_TN_8378,0.197131
GemmTunableOp_Half_TN,tn_8192_2622_28672,Gemm_Hipblaslt_TN_9774,2.33987
GemmTunableOp_Half_TN,tn_57344_1264_8192,Gemm_Hipblaslt_TN_9841,2.34598
GemmTunableOp_Half_TN,tn_10240_22_8192,Gemm_Hipblaslt_TN_9415,0.0393071
GemmTunableOp_Half_TN,tn_8192_3331_8192,Gemm_Hipblaslt_TN_9697,0.735087
GemmTunableOp_Half_TN,tn_57344_109_8192,Gemm_Rocblas_621286477,0.345704
GemmTunableOp_Half_TN,tn_8192_2692_28672,Gemm_Rocblas_621286568,2.49413
GemmTunableOp_Half_TN,tn_8192_1224_28672,Gemm_Hipblaslt_TN_9774,1.18612
GemmTunableOp_Half_TN,tn_8192_1286_28672,Gemm_Hipblaslt_TN_9774,1.19706
GemmTunableOp_Half_TN,tn_8192_1367_8192,Gemm_Hipblaslt_TN_9799,0.317146
GemmTunableOp_Half_TN,tn_57344_21_8192,Gemm_Rocblas_621286351,0.263805
GemmTunableOp_Half_TN,tn_57344_120_8192,Gemm_Rocblas_621294214,0.351559
GemmTunableOp_Half_TN,tn_32000_17_8192,Gemm_Rocblas_621286350,0.143841
GemmTunableOp_Half_TN,tn_8192_3400_8192,Gemm_Hipblaslt_TN_9187,0.746011
GemmTunableOp_Half_TN,tn_10240_3274_8192,Gemm_Hipblaslt_TN_9815,0.883638
GemmTunableOp_Half_TN,tn_8192_22_8192,Gemm_Hipblaslt_TN_9410,0.0326589
GemmTunableOp_Half_TN,tn_57344_4083_8192,Gemm_Rocblas_621294285,6.6467
GemmTunableOp_Half_TN,tn_10240_2274_8192,Gemm_Hipblaslt_TN_9644,0.65137
GemmTunableOp_Half_TN,tn_8192_95_8192,Gemm_Hipblaslt_TN_7093,0.0473925
GemmTunableOp_Half_TN,tn_10240_1321_8192,Gemm_Hipblaslt_TN_9192,0.361531
GemmTunableOp_Half_TN,tn_57344_3347_8192,Gemm_Hipblaslt_TN_9803,5.86387
GemmTunableOp_Half_TN,tn_10240_3475_8192,Gemm_Hipblaslt_TN_9211,0.997594
GemmTunableOp_Half_TN,tn_10240_3491_8192,Gemm_Hipblaslt_TN_9209,0.993185
GemmTunableOp_Half_TN,tn_10240_3187_8192,Gemm_Hipblaslt_TN_9815,0.870524
GemmTunableOp_Half_TN,tn_10240_129_8192,Gemm_Hipblaslt_TN_9367,0.0660544
GemmTunableOp_Half_TN,tn_8192_5_28672,Gemm_Hipblaslt_TN_9403,0.120593
GemmTunableOp_Half_TN,tn_57344_110_8192,Gemm_Rocblas_621294214,0.344165
GemmTunableOp_Half_TN,tn_57344_2664_8192,Gemm_Rocblas_621286739,4.61163
GemmTunableOp_Half_TN,tn_57344_133_8192,Gemm_Hipblaslt_TN_9507,0.390953
GemmTunableOp_Half_TN,tn_8192_3120_28672,Gemm_Rocblas_621286731,2.81228
GemmTunableOp_Half_TN,tn_8192_24_28672,Gemm_Rocblas_621286354,0.128156
GemmTunableOp_Half_TN,tn_8192_2551_28672,Gemm_Hipblaslt_TN_9774,2.32567
GemmTunableOp_Half_TN,tn_10240_4035_8192,Gemm_Hipblaslt_TN_9743,1.11957
GemmTunableOp_Half_TN,tn_57344_3369_8192,Gemm_Rocblas_621294470,5.63258
GemmTunableOp_Half_TN,tn_8192_3153_8192,Gemm_Hipblaslt_TN_9139,0.706356
GemmTunableOp_Half_TN,tn_10240_1313_8192,Gemm_Hipblaslt_TN_9192,0.358015
GemmTunableOp_Half_TN,tn_8192_4090_8192,Gemm_Hipblaslt_TN_9749,0.886543
GemmTunableOp_Half_TN,tn_8192_3411_8192,Gemm_Hipblaslt_TN_9677,0.743493
GemmTunableOp_Half_TN,tn_10240_1208_8192,Gemm_Hipblaslt_TN_9192,0.347083
GemmTunableOp_Half_TN,tn_10240_108_8192,Gemm_Rocblas_621294504,0.0602939
GemmTunableOp_Half_TN,tn_57344_3140_8192,Gemm_Hipblaslt_TN_9816,5.48204
GemmTunableOp_Half_TN,tn_57344_2914_8192,Gemm_Hipblaslt_TN_9803,4.98425
GemmTunableOp_Half_TN,tn_8192_7_8192,Gemm_Hipblaslt_TN_9388,0.0302743
GemmTunableOp_Half_TN,tn_10240_1201_8192,Gemm_Hipblaslt_TN_9697,0.347524
GemmTunableOp_Half_TN,tn_57344_3187_8192,Gemm_Hipblaslt_TN_9803,5.52408
GemmTunableOp_Half_TN,tn_10240_132_8192,Gemm_Hipblaslt_TN_9367,0.0662572
GemmTunableOp_Half_TN,tn_57344_3451_8192,Gemm_Hipblaslt_TN_159,5.7759
GemmTunableOp_Half_TN,tn_32000_130_8192,Gemm_Hipblaslt_TN_9506,0.239032
GemmTunableOp_Half_TN,tn_8192_92_28672,Gemm_Hipblaslt_TN_8899,0.18318
GemmTunableOp_Half_TN,tn_8192_1248_8192,Gemm_Hipblaslt_TN_9209,0.298163
GemmTunableOp_Half_TN,tn_10240_1256_8192,Gemm_Hipblaslt_TN_9192,0.350989
GemmTunableOp_Half_TN,tn_10240_119_8192,Gemm_Rocblas_621286764,0.0605328
GemmTunableOp_Half_TN,tn_8192_4091_8192,Gemm_Hipblaslt_TN_9753,0.881024
GemmTunableOp_Half_TN,tn_10240_96_8192,Gemm_Hipblaslt_TN_7102,0.0543958
GemmTunableOp_Half_TN,tn_10240_117_8192,Gemm_Hipblaslt_TN_8892,0.0618758
GemmTunableOp_Half_TN,tn_57344_92_8192,Gemm_Hipblaslt_TN_9478,0.329916
GemmTunableOp_Half_TN,tn_8192_127_28672,Gemm_Hipblaslt_TN_8378,0.20511
GemmTunableOp_Half_TN,tn_8192_127_8192,Gemm_Hipblaslt_TN_7157,0.0543573
GemmTunableOp_Half_TN,tn_10240_3369_8192,Gemm_Hipblaslt_TN_9209,0.980313
GemmTunableOp_Half_TN,tn_57344_1367_8192,Gemm_Hipblaslt_TN_9830,2.55672
GemmTunableOp_Half_TN,tn_8192_25_28672,Gemm_Rocblas_621294226,0.129453
GemmTunableOp_Half_TN,tn_8192_3747_28672,Gemm_Rocblas_621286968,3.24186
GemmTunableOp_Half_TN,tn_10240_131_8192,Gemm_Hipblaslt_TN_9367,0.0664025
GemmTunableOp_Half_TN,tn_32000_99_8192,Gemm_Rocblas_621294212,0.195376
GemmTunableOp_Half_TN,tn_10240_3651_8192,Gemm_Hipblaslt_TN_9798,1.04592
GemmTunableOp_Half_TN,tn_8192_1265_8192,Gemm_Hipblaslt_TN_9691,0.300166
GemmTunableOp_Half_TN,tn_8192_16_28672,Gemm_Rocblas_621294224,0.118476
GemmTunableOp_Half_TN,tn_8192_112_8192,Gemm_Hipblaslt_TN_8891,0.0492786
GemmTunableOp_Half_TN,tn_10240_1121_8192,Gemm_Hipblaslt_TN_9697,0.323445
GemmTunableOp_Half_TN,tn_8192_101_8192,Gemm_Hipblaslt_TN_8891,0.0477988
GemmTunableOp_Half_TN,tn_8192_112_28672,Gemm_Hipblaslt_TN_8378,0.196433
GemmTunableOp_Half_TN,tn_57344_2015_8192,Gemm_Hipblaslt_TN_9840,3.49223
GemmTunableOp_Half_TN,tn_8192_11_8192,Gemm_Hipblaslt_TN_9392,0.0304676
GemmTunableOp_Half_TN,tn_10240_3715_8192,Gemm_Hipblaslt_TN_9814,1.05133
GemmTunableOp_Half_TN,tn_10240_1268_8192,Gemm_Hipblaslt_TN_9697,0.354142
GemmTunableOp_Half_TN,tn_32000_116_8192,Gemm_Rocblas_621294212,0.208057
GemmTunableOp_Half_TN,tn_32000_132_8192,Gemm_Hipblaslt_TN_9506,0.242113
GemmTunableOp_Half_TN,tn_57344_1392_8192,Gemm_Hipblaslt_TN_9830,2.57561
GemmTunableOp_Half_TN,tn_8192_2015_8192,Gemm_Hipblaslt_TN_9191,0.429675
GemmTunableOp_Half_TN,tn_57344_25_8192,Gemm_Rocblas_621294194,0.26728
GemmTunableOp_Half_TN,tn_8192_1361_28672,Gemm_Hipblaslt_TN_9799,1.27035
GemmTunableOp_Half_TN,tn_57344_1185_8192,Gemm_Hipblaslt_TN_9068,2.28891
GemmTunableOp_Half_TN,tn_8192_1153_8192,Gemm_Hipblaslt_TN_9672,0.292016
GemmTunableOp_Half_TN,tn_57344_1008_8192,Gemm_Rocblas_621294542,1.8043
GemmTunableOp_Half_TN,tn_8192_109_8192,Gemm_Hipblaslt_TN_7157,0.0523166
GemmTunableOp_Half_TN,tn_10240_1392_8192,Gemm_Hipblaslt_TN_9237,0.397472
GemmTunableOp_Half_TN,tn_32000_109_8192,Gemm_Rocblas_621286475,0.206305
GemmTunableOp_Half_TN,tn_10240_2866_8192,Gemm_Hipblaslt_TN_9814,0.779174
GemmTunableOp_Half_TN,tn_32000_112_8192,Gemm_Rocblas_621286475,0.207164
GemmTunableOp_Half_TN,tn_32000_12_8192,Gemm_Rocblas_621286319,0.135333
GemmTunableOp_Half_TN,tn_8192_3140_28672,Gemm_Hipblaslt_TN_9732,2.85759
GemmTunableOp_Half_TN,tn_8192_101_28672,Gemm_Hipblaslt_TN_8378,0.193395
GemmTunableOp_Half_TN,tn_8192_3619_28672,Gemm_Hipblaslt_TN_9731,3.03672
GemmTunableOp_Half_TN,tn_10240_102_8192,Gemm_Hipblaslt_TN_7157,0.0594041
GemmTunableOp_Half_TN,tn_8192_124_8192,Gemm_Hipblaslt_TN_8891,0.053883
GemmTunableOp_Half_TN,tn_8192_113_28672,Gemm_Hipblaslt_TN_8378,0.196811
GemmTunableOp_Half_TN,tn_10240_112_8192,Gemm_Rocblas_621286764,0.0603158
GemmTunableOp_Half_TN,tn_10240_3251_8192,Gemm_Hipblaslt_TN_9749,0.880188
GemmStridedBatchedTunableOp_Half_TN,tn_1368_1368_128_B_64,Gemm_Rocblas_621294109,0.153186
GemmStridedBatchedTunableOp_Half_TN,tn_1367_1367_128_B_64,Gemm_Rocblas_621286412,0.161519
GemmStridedBatchedTunableOp_Half_TN,tn_1038_1038_128_B_64,Gemm_Rocblas_621294725,0.101263
GemmStridedBatchedTunableOp_Half_TN,tn_1297_1297_128_B_64,Gemm_Rocblas_621294109,0.151135
GemmStridedBatchedTunableOp_Half_TN,tn_1296_1296_128_B_64,Gemm_Rocblas_621286412,0.136165
GemmStridedBatchedTunableOp_Half_TN,tn_1008_1008_128_B_64,Gemm_Rocblas_621294763,0.0904428
GemmStridedBatchedTunableOp_Half_TN,tn_1128_1128_128_B_64,Gemm_Rocblas_621294106,0.113464
GemmStridedBatchedTunableOp_Half_TN,tn_1048_1048_128_B_64,Gemm_Rocblas_621294106,0.102824
GemmStridedBatchedTunableOp_Half_TN,tn_1216_1216_128_B_64,Gemm_Rocblas_621286397,0.117951
GemmStridedBatchedTunableOp_Half_TN,tn_1009_1009_128_B_64,Gemm_Hipblaslt_TN_6879,0.0982249
GemmStridedBatchedTunableOp_Half_TN,tn_1441_1441_128_B_64,Gemm_Rocblas_621286397,0.175661
GemmStridedBatchedTunableOp_Half_TN,tn_16_16_128_B_64,Gemm_Rocblas_621286332,0.00646596
GemmStridedBatchedTunableOp_Half_TN,tn_1350_1350_128_B_64,Gemm_Rocblas_621294109,0.154477
GemmStridedBatchedTunableOp_Half_TN,tn_1064_1064_128_B_64,Gemm_Rocblas_621294725,0.10479
GemmStridedBatchedTunableOp_Half_TN,tn_1076_1076_128_B_64,Gemm_Rocblas_621294725,0.107431
GemmStridedBatchedTunableOp_Half_TN,tn_1256_1256_128_B_64,Gemm_Rocblas_621286397,0.130847
GemmStridedBatchedTunableOp_Half_TN,tn_1392_1392_128_B_64,Gemm_Rocblas_621294109,0.147605
GemmStridedBatchedTunableOp_Half_TN,tn_1010_1010_128_B_64,Gemm_Hipblaslt_TN_6879,0.096948
GemmStridedBatchedTunableOp_Half_TN,tn_1032_1032_128_B_64,Gemm_Rocblas_621294725,0.0990668
GemmStridedBatchedTunableOp_Half_TN,tn_1041_1041_128_B_64,Gemm_Hipblaslt_TN_6879,0.102872
GemmStridedBatchedTunableOp_Half_TN,tn_1022_1022_128_B_64,Gemm_Hipblaslt_TN_6879,0.0990424
GemmStridedBatchedTunableOp_Half_TN,tn_1224_1224_128_B_64,Gemm_Rocblas_621294106,0.126786
GemmStridedBatchedTunableOp_Half_TN,tn_1455_1455_128_B_64,Gemm_Rocblas_621286397,0.18034
GemmStridedBatchedTunableOp_Half_TN,tn_1425_1425_128_B_64,Gemm_Rocblas_621294106,0.173248
GemmStridedBatchedTunableOp_Half_TN,tn_1153_1153_128_B_64,Gemm_Rocblas_621286397,0.120748
GemmStridedBatchedTunableOp_Half_TN,tn_1404_1404_128_B_64,Gemm_Rocblas_621294109,0.163683
GemmTunableOp_Half_TN,tn_4096_3535_4096,Gemm_Hipblaslt_TN_9221,0.200883
GemmTunableOp_Half_TN,tn_22016_3430_4096,Gemm_Hipblaslt_TN_9827,1.06257
GemmTunableOp_Half_TN,tn_12288_2915_4096,Gemm_Rocblas_621286684,0.509656
GemmTunableOp_Half_TN,tn_4096_34_4096,Gemm_Rocblas_621286428,0.0125852
GemmTunableOp_Half_TN,tn_4096_3333_11008,Gemm_Rocblas_621294485,0.507101
GemmTunableOp_Half_TN,tn_12288_3669_4096,Gemm_Rocblas_621286678,0.622962
GemmTunableOp_Half_TN,tn_22016_2802_4096,Gemm_Hipblaslt_TN_9827,0.899041
GemmTunableOp_Half_TN,tn_4096_250_4096,Gemm_Rocblas_621294230,0.0262183
GemmTunableOp_Half_TN,tn_12288_236_4096,Gemm_Rocblas_621286478,0.0567734
GemmTunableOp_Half_TN,tn_32000_253_4096,Gemm_Hipblaslt_TN_9845,0.149471
GemmTunableOp_Half_TN,tn_22016_3843_4096,Gemm_Hipblaslt_TN_9832,1.23071
GemmTunableOp_Half_TN,tn_12288_3843_4096,Gemm_Rocblas_621286742,0.64712
GemmTunableOp_Half_TN,tn_4096_3843_11008,Gemm_Hipblaslt_TN_9827,0.568256
GemmTunableOp_Half_TN,tn_4096_243_11008,Gemm_Hipblaslt_TN_9303,0.0655266
GemmTunableOp_Half_TN,tn_4096_237_11008,Gemm_Hipblaslt_TN_9303,0.0641631
GemmTunableOp_Half_TN,tn_12288_3972_4096,Gemm_Rocblas_621286590,0.653086
GemmTunableOp_Half_TN,tn_4096_4083_4096,Gemm_Hipblaslt_TN_9768,0.227883
GemmTunableOp_Half_TN,tn_4096_3530_4096,Gemm_Hipblaslt_TN_9743,0.199329
GemmTunableOp_Half_TN,tn_4096_2898_11008,Gemm_Hipblaslt_TN_9709,0.446929
GemmTunableOp_Half_TN,tn_4096_233_11008,Gemm_Hipblaslt_TN_7627,0.0639179
GemmTunableOp_Half_TN,tn_22016_225_4096,Gemm_Hipblaslt_TN_9720,0.096063
GemmTunableOp_Half_TN,tn_32000_22_4096,Gemm_Rocblas_621294191,0.0522864
GemmTunableOp_Half_TN,tn_4096_2398_11008,Gemm_Hipblaslt_TN_9698,0.373354
GemmTunableOp_Half_TN,tn_4096_4035_4096,Gemm_Hipblaslt_TN_9768,0.226654
GemmTunableOp_Half_TN,tn_32000_244_4096,Gemm_Hipblaslt_TN_9745,0.149857
GemmTunableOp_Half_TN,tn_12288_1000_4096,Gemm_Hipblaslt_TN_9697,0.181568
GemmTunableOp_Half_TN,tn_4096_239_4096,Gemm_Rocblas_621286491,0.0259694
GemmTunableOp_Half_TN,tn_4096_234_11008,Gemm_Hipblaslt_TN_8879,0.0632156
GemmTunableOp_Half_TN,tn_12288_2958_4096,Gemm_Rocblas_621286684,0.512177
GemmTunableOp_Half_TN,tn_4096_4000_11008,Gemm_Rocblas_621286281,0.578878
GemmTunableOp_Half_TN,tn_22016_2866_4096,Gemm_Hipblaslt_TN_9841,0.906235
GemmTunableOp_Half_TN,tn_4096_2770_11008,Gemm_Hipblaslt_TN_9799,0.430204
GemmTunableOp_Half_TN,tn_12288_2978_4096,Gemm_Rocblas_621286684,0.513586
GemmTunableOp_Half_TN,tn_22016_3891_4096,Gemm_Hipblaslt_TN_9832,1.22293
GemmTunableOp_Half_TN,tn_12288_4021_4096,Gemm_Hipblaslt_TN_9220,0.658736
GemmTunableOp_Half_TN,tn_22016_247_4096,Gemm_Hipblaslt_TN_9641,0.0986421
GemmTunableOp_Half_TN,tn_12288_234_4096,Gemm_Rocblas_621294215,0.0577459
GemmTunableOp_Half_TN,tn_22016_2862_4096,Gemm_Hipblaslt_TN_9827,0.906812
GemmTunableOp_Half_TN,tn_12288_2798_4096,Gemm_Rocblas_621294426,0.49357
GemmTunableOp_Half_TN,tn_4096_3813_4096,Gemm_Hipblaslt_TN_9768,0.216069
GemmTunableOp_Half_TN,tn_12288_3267_4096,Gemm_Hipblaslt_TN_9677,0.565837
GemmTunableOp_Half_TN,tn_4096_9_11008,Gemm_Rocblas_621286312,0.0233867
GemmTunableOp_Half_TN,tn_32000_228_4096,Gemm_Hipblaslt_TN_9845,0.144104
GemmTunableOp_Half_TN,tn_22016_3717_4096,Gemm_Hipblaslt_TN_9841,1.13618
GemmTunableOp_Half_TN,tn_12288_2778_4096,Gemm_Rocblas_621294426,0.495978
GemmTunableOp_Half_TN,tn_12288_235_4096,Gemm_Rocblas_621286478,0.0569684
GemmTunableOp_Half_TN,tn_4096_2802_4096,Gemm_Hipblaslt_TN_9674,0.166152
GemmTunableOp_Half_TN,tn_12288_2946_4096,Gemm_Rocblas_621294426,0.510174
GemmTunableOp_Half_TN,tn_12288_4058_4096,Gemm_Rocblas_621294420,0.673271
GemmTunableOp_Half_TN,tn_4096_219_11008,Gemm_Hipblaslt_TN_7378,0.0586048
GemmTunableOp_Half_TN,tn_4096_3923_4096,Gemm_Hipblaslt_TN_9841,0.218843
GemmTunableOp_Half_TN,tn_12288_245_4096,Gemm_Rocblas_621286478,0.0579762
GemmTunableOp_Half_TN,tn_4096_220_4096,Gemm_Rocblas_621286491,0.0256608
GemmTunableOp_Half_TN,tn_4096_33_11008,Gemm_Rocblas_621286332,0.0268576
GemmTunableOp_Half_TN,tn_12288_2398_4096,Gemm_Hipblaslt_TN_9220,0.409398
GemmTunableOp_Half_TN,tn_4096_241_11008,Gemm_Hipblaslt_TN_8879,0.0651561
GemmTunableOp_Half_TN,tn_22016_3785_4096,Gemm_Hipblaslt_TN_9827,1.1476
GemmTunableOp_Half_TN,tn_4096_2894_4096,Gemm_Hipblaslt_TN_9566,0.170416
GemmTunableOp_Half_TN,tn_12288_217_4096,Gemm_Rocblas_621294215,0.057071
GemmTunableOp_Half_TN,tn_22016_244_4096,Gemm_Hipblaslt_TN_9720,0.097428
GemmTunableOp_Half_TN,tn_4096_34_11008,Gemm_Rocblas_621286332,0.0268375
GemmTunableOp_Half_TN,tn_22016_219_4096,Gemm_Hipblaslt_TN_9720,0.09498
GemmTunableOp_Half_TN,tn_4096_2866_4096,Gemm_Hipblaslt_TN_9672,0.166908
GemmTunableOp_Half_TN,tn_4096_3577_11008,Gemm_Rocblas_621286743,0.526286
GemmTunableOp_Half_TN,tn_22016_11_4096,Gemm_Rocblas_621294186,0.035228
GemmTunableOp_Half_TN,tn_12288_225_4096,Gemm_Rocblas_621286478,0.0566211
GemmTunableOp_Half_TN,tn_22016_3451_4096,Gemm_Hipblaslt_TN_9827,1.07707
GemmTunableOp_Half_TN,tn_4096_19_11008,Gemm_Rocblas_621294054,0.023523
GemmTunableOp_Half_TN,tn_22016_9_4096,Gemm_Rocblas_621294186,0.0353266
GemmTunableOp_Half_TN,tn_12288_251_4096,Gemm_Rocblas_621286478,0.0583451
GemmTunableOp_Half_TN,tn_12288_2786_4096,Gemm_Rocblas_621286684,0.494895
GemmTunableOp_Half_TN,tn_4096_2938_11008,Gemm_Hipblaslt_TN_9709,0.447695
GemmTunableOp_Half_TN,tn_22016_2915_4096,Gemm_Hipblaslt_TN_9827,0.903004
GemmTunableOp_Half_TN,tn_4096_11_4096,Gemm_Rocblas_621294130,0.0100431
GemmTunableOp_Half_TN,tn_12288_21_4096,Gemm_Rocblas_621294064,0.0224674
GemmTunableOp_Half_TN,tn_4096_246_11008,Gemm_Hipblaslt_TN_8879,0.0647122
GemmTunableOp_Half_TN,tn_22016_3621_4096,Gemm_Hipblaslt_TN_9827,1.11081
GemmTunableOp_Half_TN,tn_4096_233_4096,Gemm_Rocblas_621294168,0.0257831
GemmTunableOp_Half_TN,tn_32000_216_4096,Gemm_Hipblaslt_TN_9590,0.139119
GemmTunableOp_Half_TN,tn_4096_27_4096,Gemm_Rocblas_621286330,0.0115622
GemmTunableOp_Half_TN,tn_4096_3987_4096,Gemm_Hipblaslt_TN_9841,0.221735
GemmTunableOp_Half_TN,tn_22016_1293_4096,Gemm_Rocblas_621294455,0.448383
GemmTunableOp_Half_TN,tn_12288_227_4096,Gemm_Rocblas_621294215,0.0568654
GemmTunableOp_Half_TN,tn_4096_21_4096,Gemm_Rocblas_621294139,0.0109623
GemmTunableOp_Half_TN,tn_22016_22_4096,Gemm_Rocblas_621286346,0.0359403
GemmTunableOp_Half_TN,tn_4096_3535_11008,Gemm_Rocblas_621286743,0.526783
GemmTunableOp_Half_TN,tn_4096_3173_11008,Gemm_Hipblaslt_TN_9817,0.491829
GemmTunableOp_Half_TN,tn_12288_220_4096,Gemm_Rocblas_621294215,0.0563784
GemmTunableOp_Half_TN,tn_4096_29_11008,Gemm_Rocblas_621286305,0.0250826
GemmTunableOp_Half_TN,tn_4096_35_11008,Gemm_Rocblas_621286332,0.0274313
GemmTunableOp_Half_TN,tn_12288_36_4096,Gemm_Rocblas_621294171,0.0252905
GemmTunableOp_Half_TN,tn_12288_3621_4096,Gemm_Hipblaslt_TN_9677,0.597918
GemmTunableOp_Half_TN,tn_4096_8_4096,Gemm_Rocblas_621286300,0.00998498
GemmTunableOp_Half_TN,tn_4096_227_11008,Gemm_Hipblaslt_TN_8879,0.0612862
GemmTunableOp_Half_TN,tn_32000_30_4096,Gemm_Rocblas_621286346,0.0527233
GemmTunableOp_Half_TN,tn_12288_3577_4096,Gemm_Hipblaslt_TN_9743,0.595025
GemmTunableOp_Half_TN,tn_4096_3953_11008,Gemm_Hipblaslt_TN_9815,0.576814
GemmTunableOp_Half_TN,tn_4096_1261_11008,Gemm_Hipblaslt_TN_9148,0.231433
GemmTunableOp_Half_TN,tn_12288_241_4096,Gemm_Rocblas_621286478,0.0574092
GemmTunableOp_Half_TN,tn_12288_242_4096,Gemm_Rocblas_621286478,0.057809
GemmTunableOp_Half_TN,tn_32000_27_4096,Gemm_Rocblas_621294191,0.0524928
GemmTunableOp_Half_TN,tn_12288_3813_4096,Gemm_Rocblas_621294420,0.645509
GemmTunableOp_Half_TN,tn_4096_230_11008,Gemm_Hipblaslt_TN_9303,0.064209
GemmTunableOp_Half_TN,tn_4096_224_4096,Gemm_Rocblas_621286440,0.0250363
GemmTunableOp_Half_TN,tn_4096_223_4096,Gemm_Rocblas_621286491,0.0251378
GemmTunableOp_Half_TN,tn_32000_250_4096,Gemm_Hipblaslt_TN_9638,0.149937
GemmTunableOp_Half_TN,tn_22016_4021_4096,Gemm_Hipblaslt_TN_9832,1.25101
GemmTunableOp_Half_TN,tn_12288_250_4096,Gemm_Rocblas_621286478,0.0575596
GemmTunableOp_Half_TN,tn_4096_2834_4096,Gemm_Hipblaslt_TN_9674,0.165348
GemmTunableOp_Half_TN,tn_12288_216_4096,Gemm_Rocblas_621294215,0.056247
GemmTunableOp_Half_TN,tn_22016_2770_4096,Gemm_Hipblaslt_TN_9827,0.889592
GemmTunableOp_Half_TN,tn_32000_248_4096,Gemm_Hipblaslt_TN_9665,0.147262
GemmTunableOp_Half_TN,tn_12288_2866_4096,Gemm_Rocblas_621294426,0.500468
GemmTunableOp_Half_TN,tn_12288_2850_4096,Gemm_Rocblas_621294426,0.497091
GemmTunableOp_Half_TN,tn_4096_3843_4096,Gemm_Hipblaslt_TN_9827,0.218032
GemmTunableOp_Half_TN,tn_4096_250_11008,Gemm_Hipblaslt_TN_9303,0.066369
GemmTunableOp_Half_TN,tn_4096_234_4096,Gemm_Rocblas_621294230,0.0259609
GemmTunableOp_Half_TN,tn_4096_2958_11008,Gemm_Hipblaslt_TN_9689,0.452127
GemmTunableOp_Half_TN,tn_32000_21_4096,Gemm_Rocblas_621286346,0.0522984
GemmTunableOp_Half_TN,tn_32000_221_4096,Gemm_Hipblaslt_TN_9620,0.137854
GemmTunableOp_Half_TN,tn_22016_216_4096,Gemm_Hipblaslt_TN_9641,0.0950367
GemmTunableOp_Half_TN,tn_4096_238_4096,Gemm_Rocblas_621286440,0.0263398
GemmTunableOp_Half_TN,tn_4096_242_11008,Gemm_Hipblaslt_TN_8879,0.0650263
GemmTunableOp_Half_TN,tn_4096_235_11008,Gemm_Hipblaslt_TN_8879,0.0642724
GemmStridedBatchedTunableOp_Half_TN,tn_1021_1021_128_B_32,Gemm_Rocblas_621294536,0.0529556
GemmStridedBatchedTunableOp_Half_TN,tn_1048_1048_128_B_32,Gemm_Hipblaslt_TN_149,0.056004
GemmStridedBatchedTunableOp_Half_TN,tn_1458_1458_128_B_32,Gemm_Rocblas_621294110,0.0926064
GemmStridedBatchedTunableOp_Half_TN,tn_1367_1367_128_B_32,Gemm_Rocblas_621286412,0.0853859
GemmStridedBatchedTunableOp_Half_TN,tn_1489_1489_128_B_32,Gemm_Hipblaslt_TN_6942,0.096901
GemmStridedBatchedTunableOp_Half_TN,tn_1415_1415_128_B_32,Gemm_Rocblas_621286413,0.0908974
GemmStridedBatchedTunableOp_Half_TN,tn_1377_1377_128_B_32,Gemm_Rocblas_621294725,0.0869679
GemmStridedBatchedTunableOp_Half_TN,tn_1479_1479_128_B_32,Gemm_Rocblas_621294106,0.0971239
GemmStridedBatchedTunableOp_Half_TN,tn_1469_1469_128_B_32,Gemm_Rocblas_621286397,0.0952156
GemmStridedBatchedTunableOp_Half_TN,tn_1345_1345_128_B_32,Gemm_Rocblas_621294109,0.0835429
GemmStridedBatchedTunableOp_Half_TN,tn_1219_1219_128_B_32,Gemm_Rocblas_621294725,0.0713163
GemmStridedBatchedTunableOp_Half_TN,tn_1207_1207_128_B_32,Gemm_Rocblas_621294725,0.0667705
GemmStridedBatchedTunableOp_Half_TN,tn_1165_1165_128_B_32,Gemm_Rocblas_621294725,0.0668976
GemmStridedBatchedTunableOp_Half_TN,tn_1222_1222_128_B_32,Gemm_Rocblas_621294725,0.0691948
GemmStridedBatchedTunableOp_Half_TN,tn_1191_1191_128_B_32,Gemm_Rocblas_621294725,0.0672788
GemmStridedBatchedTunableOp_Half_TN,tn_1137_1137_128_B_32,Gemm_Hipblaslt_TN_7483,0.0640044
GemmTunableOp_Half_TN,tn_8192_8192_3584,Gemm_Rocblas_621286590,0.78205
GemmTunableOp_Half_TN,tn_8192_48_1024,Gemm_Rocblas_621286280,0.00694476
GemmTunableOp_Half_TN,tn_8192_32_3584,Gemm_Rocblas_621286335,0.0139708
GemmTunableOp_Half_TN,tn_7168_256_8192,Gemm_Hipblaslt_TN_9514,0.0744018
GemmTunableOp_Half_TN,tn_8192_24_1024,Gemm_Rocblas_621294144,0.00619925
GemmTunableOp_Half_TN,tn_1280_80_8192,Gemm_Rocblas_621294026,0.0133587
GemmTunableOp_Half_TN,tn_1280_112_8192,Gemm_Rocblas_621294162,0.0164818
GemmTunableOp_Half_TN,tn_8192_232_1024,Gemm_Rocblas_621286470,0.0139604
GemmTunableOp_Half_TN,tn_8192_88_1024,Gemm_Rocblas_621286440,0.00860484
GemmTunableOp_Half_TN,tn_1280_184_8192,Gemm_Hipblaslt_TN_9414,0.0211421
GemmTunableOp_Half_TN,tn_8192_152_1024,Gemm_Rocblas_621286472,0.0121197
GemmTunableOp_Half_TN,tn_7168_4_8192,Gemm_Hipblaslt_TN_9392,0.0267948
GemmTunableOp_Half_TN,tn_7168_176_8192,Gemm_Hipblaslt_TN_7582,0.0603365
GemmTunableOp_Half_TN,tn_8192_32_1024,Gemm_Rocblas_621286488,0.00651372
GemmTunableOp_Half_TN,tn_8192_56_3584,Gemm_Rocblas_621286337,0.0171441
GemmTunableOp_Half_TN,tn_1280_160_8192,Gemm_Rocblas_621294163,0.0188273
GemmTunableOp_Half_TN,tn_1280_32_8192,Gemm_Rocblas_621294136,0.00887244
GemmTunableOp_Half_TN,tn_1280_8_8192,Gemm_Rocblas_621286326,0.00876308
GemmTunableOp_Half_TN,tn_8192_216_1024,Gemm_Rocblas_621294209,0.0137335
GemmTunableOp_Half_TN,tn_8192_160_3584,Gemm_Hipblaslt_TN_9495,0.0287411
GemmTunableOp_Half_TN,tn_1280_56_8192,Gemm_Rocblas_621294145,0.0119634
GemmTunableOp_Half_TN,tn_8192_248_1024,Gemm_Rocblas_621286470,0.0140124
GemmTunableOp_Half_TN,tn_7168_136_8192,Gemm_Hipblaslt_TN_9306,0.0535558
GemmTunableOp_Half_TN,tn_7168_152_8192,Gemm_Hipblaslt_TN_8098,0.0555674
GemmTunableOp_Half_TN,tn_8192_2_3584,Gemm_Rocblas_621294041,0.0125491
GemmTunableOp_Half_TN,tn_8192_224_3584,Gemm_Rocblas_621286493,0.0363895
GemmTunableOp_Half_TN,tn_8192_24_3584,Gemm_Rocblas_621286335,0.0135835
GemmTunableOp_Half_TN,tn_8192_248_3584,Gemm_Rocblas_621286470,0.0377852
GemmTunableOp_Half_TN,tn_1280_40_8192,Gemm_Rocblas_621294145,0.0119138
GemmTunableOp_Half_TN,tn_8192_64_3584,Gemm_Rocblas_621286428,0.0168091
GemmTunableOp_Half_TN,tn_7168_8_8192,Gemm_Hipblaslt_TN_9392,0.0270039
GemmTunableOp_Half_TN,tn_7168_128_8192,Gemm_Hipblaslt_TN_7158,0.047804
GemmTunableOp_Half_TN,tn_1280_224_8192,Gemm_Rocblas_621294163,0.0217443
GemmTunableOp_Half_TN,tn_1280_136_8192,Gemm_Hipblaslt_TN_9414,0.0189983
GemmTunableOp_Half_TN,tn_7168_104_8192,Gemm_Hipblaslt_TN_9303,0.0473626
GemmTunableOp_Half_TN,tn_1280_104_8192,Gemm_Rocblas_621286434,0.0164173
GemmTunableOp_Half_TN,tn_8192_112_1024,Gemm_Rocblas_621286447,0.0086436
GemmTunableOp_Half_TN,tn_8192_112_3584,Gemm_Rocblas_621286440,0.0240711
GemmTunableOp_Half_TN,tn_8192_104_1024,Gemm_Rocblas_621294167,0.00863719
GemmTunableOp_Half_TN,tn_57344_3425_8192,Gemm_Hipblaslt_TN_159,5.75101
GemmTunableOp_Half_TN,tn_10240_122_8192,Gemm_Hipblaslt_TN_8892,0.0609699
GemmTunableOp_Half_TN,tn_10240_3299_8192,Gemm_Hipblaslt_TN_9240,0.886451
GemmTunableOp_Half_TN,tn_57344_3331_8192,Gemm_Hipblaslt_TN_9816,5.87814
GemmTunableOp_Half_TN,tn_8192_3603_8192,Gemm_Hipblaslt_TN_9743,0.777253
GemmTunableOp_Half_TN,tn_8192_1367_28672,Gemm_Hipblaslt_TN_9799,1.26873
GemmTunableOp_Half_TN,tn_10240_1276_8192,Gemm_Hipblaslt_TN_9192,0.355321
GemmTunableOp_Half_TN,tn_10240_1296_8192,Gemm_Hipblaslt_TN_9192,0.355652
GemmTunableOp_Half_TN,tn_57344_23_8192,Gemm_Rocblas_621294194,0.264557
GemmTunableOp_Half_TN,tn_57344_3162_8192,Gemm_Hipblaslt_TN_9803,5.51392
GemmTunableOp_Half_TN,tn_8192_1121_8192,Gemm_Hipblaslt_TN_9195,0.262992
GemmTunableOp_Half_TN,tn_57344_2274_8192,Gemm_Hipblaslt_TN_9757,4.06156
GemmTunableOp_Half_TN,tn_10240_13_8192,Gemm_Hipblaslt_TN_9411,0.0371771
GemmTunableOp_Half_TN,tn_8192_3139_28672,Gemm_Hipblaslt_TN_9732,2.85509
GemmTunableOp_Half_TN,tn_57344_1208_8192,Gemm_Hipblaslt_TN_9827,2.31176
GemmTunableOp_Half_TN,tn_32000_118_8192,Gemm_Rocblas_621286475,0.209955
GemmTunableOp_Half_TN,tn_32000_96_8192,Gemm_Rocblas_621286475,0.195905
GemmTunableOp_Half_TN,tn_8192_128_28672,Gemm_Hipblaslt_TN_8378,0.205358
GemmTunableOp_Half_TN,tn_10240_3451_8192,Gemm_Hipblaslt_TN_9674,0.990645
GemmTunableOp_Half_TN,tn_32000_92_8192,Gemm_Rocblas_621286475,0.194982
GemmTunableOp_Half_TN,tn_32000_24_8192,Gemm_Rocblas_621294578,0.146407
GemmTunableOp_Half_TN,tn_8192_4035_28672,Gemm_Rocblas_621286894,3.39548
GemmTunableOp_Half_TN,tn_8192_1025_28672,Gemm_Hipblaslt_TN_9762,1.0214
GemmTunableOp_Half_TN,tn_10240_115_8192,Gemm_Rocblas_621286764,0.060191
GemmTunableOp_Half_TN,tn_57344_94_8192,Gemm_Hipblaslt_TN_9478,0.331338
GemmTunableOp_Half_TN,tn_8192_1389_28672,Gemm_Hipblaslt_TN_9799,1.27354
GemmTunableOp_Half_TN,tn_10240_105_8192,Gemm_Rocblas_621286764,0.0587783
GemmTunableOp_Half_TN,tn_8192_1268_8192,Gemm_Rocblas_621286683,0.301228
GemmTunableOp_Half_TN,tn_8192_1360_8192,Gemm_Rocblas_621286683,0.318293
GemmTunableOp_Half_TN,tn_10240_1392_8192,Gemm_Hipblaslt_TN_9222,0.39607
GemmTunableOp_Half_TN,tn_8192_2760_8192,Gemm_Hipblaslt_TN_9182,0.638707
GemmTunableOp_Half_TN,tn_8192_1377_8192,Gemm_Rocblas_621294425,0.318417
GemmTunableOp_Half_TN,tn_8192_2760_28672,Gemm_Rocblas_621286667,2.52524
GemmTunableOp_Half_TN,tn_8192_2639_8192,Gemm_Hipblaslt_TN_9774,0.612339
GemmTunableOp_Half_TN,tn_8192_132_28672,Gemm_Hipblaslt_TN_8099,0.216367
GemmTunableOp_Half_TN,tn_8192_132_8192,Gemm_Hipblaslt_TN_9306,0.056159
GemmTunableOp_Half_TN,tn_8192_2914_28672,Gemm_Hipblaslt_TN_9799,2.63187
GemmTunableOp_Half_TN,tn_10240_1233_8192,Gemm_Hipblaslt_TN_9192,0.351108
GemmTunableOp_Half_TN,tn_10240_11_8192,Gemm_Hipblaslt_TN_9411,0.0371927
GemmTunableOp_Half_TN,tn_8192_2000_28672,Gemm_Hipblaslt_TN_9591,1.71995
GemmTunableOp_Half_TN,tn_8192_1297_8192,Gemm_Hipblaslt_TN_9182,0.311861
GemmTunableOp_Half_TN,tn_57344_1224_8192,Gemm_Hipblaslt_TN_9827,2.32233
GemmTunableOp_Half_TN,tn_8192_2000_8192,Gemm_Hipblaslt_TN_9190,0.428009
GemmTunableOp_Half_TN,tn_8192_1000_28672,Gemm_Hipblaslt_TN_9665,1.02254
GemmTunableOp_Half_TN,tn_57344_2479_8192,Default,4.3311
GemmTunableOp_Half_TN,tn_8192_1201_28672,Gemm_Hipblaslt_TN_9774,1.16342
GemmTunableOp_Half_TN,tn_8192_2166_8192,Gemm_Hipblaslt_TN_9763,0.503191
GemmTunableOp_Half_TN,tn_57344_1361_8192,Gemm_Hipblaslt_TN_9830,2.55426
GemmTunableOp_Half_TN,tn_10240_10_8192,Gemm_Hipblaslt_TN_9411,0.0370185
GemmTunableOp_Half_TN,tn_10240_3642_8192,Gemm_Hipblaslt_TN_9814,1.03462
GemmTunableOp_Half_TN,tn_8192_99_8192,Gemm_Hipblaslt_TN_8891,0.0489802
GemmTunableOp_Half_TN,tn_57344_1265_8192,Gemm_Hipblaslt_TN_9827,2.32988
GemmTunableOp_Half_TN,tn_8192_3369_8192,Gemm_Hipblaslt_TN_9697,0.738387
GemmTunableOp_Half_TN,tn_10240_3120_8192,Gemm_Hipblaslt_TN_9655,0.842655
GemmTunableOp_Half_TN,tn_8192_113_8192,Gemm_Hipblaslt_TN_8891,0.0497667
GemmTunableOp_Half_TN,tn_57344_93_8192,Gemm_Hipblaslt_TN_9481,0.329687
GemmTunableOp_Half_TN,tn_32000_97_8192,Gemm_Rocblas_621294212,0.197076
GemmTunableOp_Half_TN,tn_57344_3411_8192,Gemm_Hipblaslt_TN_159,5.70627
GemmTunableOp_Half_TN,tn_8192_2664_28672,Gemm_Hipblaslt_TN_9774,2.36006
GemmTunableOp_Half_TN,tn_57344_3482_8192,Gemm_Hipblaslt_TN_159,5.79858
GemmTunableOp_Half_TN,tn_8192_2622_8192,Gemm_Hipblaslt_TN_9774,0.604598
GemmTunableOp_Half_TN,tn_57344_3283_8192,Gemm_Hipblaslt_TN_9818,5.81764
GemmTunableOp_Half_TN,tn_8192_3283_8192,Gemm_Hipblaslt_TN_9677,0.73288
GemmTunableOp_Half_TN,tn_57344_113_8192,Gemm_Rocblas_621286477,0.348115
GemmTunableOp_Half_TN,tn_8192_102_8192,Gemm_Hipblaslt_TN_8891,0.0497925
GemmTunableOp_Half_TN,tn_8192_1025_8192,Gemm_Hipblaslt_TN_9207,0.255963
GemmTunableOp_Half_TN,tn_8192_1160_8192,Gemm_Hipblaslt_TN_9691,0.292767
GemmTunableOp_Half_TN,tn_8192_3411_8192,Gemm_Hipblaslt_TN_9187,0.742745
GemmTunableOp_Half_TN,tn_10240_108_8192,Gemm_Rocblas_621286764,0.0602348
GemmTunableOp_Half_TN,tn_10240_3859_8192,Gemm_Hipblaslt_TN_9743,1.08039
GemmTunableOp_Half_TN,tn_32000_23_8192,Gemm_Rocblas_621294193,0.145611
GemmTunableOp_Half_TN,tn_32000_110_8192,Gemm_Rocblas_621286475,0.206734
GemmTunableOp_Half_TN,tn_8192_3491_8192,Gemm_Hipblaslt_TN_9677,0.766089
GemmTunableOp_Half_TN,tn_57344_1296_8192,Gemm_Hipblaslt_TN_9841,2.34034
GemmTunableOp_Half_TN,tn_8192_2166_28672,Gemm_Hipblaslt_TN_9762,2.05027
GemmTunableOp_Half_TN,tn_8192_2549_8192,Gemm_Hipblaslt_TN_9774,0.604502
GemmTunableOp_Half_TN,tn_57344_3475_8192,Gemm_Hipblaslt_TN_159,5.72304
GemmTunableOp_Half_TN,tn_8192_1248_28672,Gemm_Hipblaslt_TN_9774,1.18341
GemmTunableOp_Half_TN,tn_10240_3626_8192,Gemm_Hipblaslt_TN_9814,1.03386
GemmTunableOp_Half_TN,tn_57344_128_8192,Default,0.351868
GemmTunableOp_Half_TN,tn_10240_4063_8192,Gemm_Hipblaslt_TN_9743,1.12303
GemmTunableOp_Half_TN,tn_10240_1350_8192,Gemm_Hipblaslt_TN_9237,0.392025
GemmTunableOp_Half_TN,tn_57344_100_8192,Gemm_Rocblas_621286477,0.338734
GemmTunableOp_Half_TN,tn_57344_2551_8192,Gemm_Hipblaslt_TN_9800,4.47266
GemmTunableOp_Half_TN,tn_57344_18_8192,Gemm_Rocblas_621286351,0.263249
GemmTunableOp_Half_TN,tn_8192_1319_8192,Gemm_Hipblaslt_TN_9799,0.314183
GemmTunableOp_Half_TN,tn_8192_14_28672,Gemm_Hipblaslt_TN_9398,0.12122
GemmTunableOp_Half_TN,tn_8192_22_28672,Gemm_Rocblas_621286354,0.125961
GemmTunableOp_Half_TN,tn_10240_3785_8192,Gemm_Hipblaslt_TN_9814,1.05069
GemmTunableOp_Half_TN,tn_57344_12_8192,Gemm_Hipblaslt_TN_9405,0.255054
GemmTunableOp_Half_TN,tn_32000_100_8192,Gemm_Rocblas_621286475,0.197539
GemmTunableOp_Half_TN,tn_57344_4090_8192,Gemm_Hipblaslt_TN_9901,6.64593
GemmTunableOp_Half_TN,tn_57344_1153_8192,Default,2.2609
GemmTunableOp_Half_TN,tn_10240_3162_8192,Gemm_Hipblaslt_TN_9815,0.871148
GemmTunableOp_Half_TN,tn_57344_3139_8192,Gemm_Hipblaslt_TN_9816,5.49204
GemmTunableOp_Half_TN,tn_10240_21_8192,Gemm_Hipblaslt_TN_9415,0.039072
GemmTunableOp_Half_TN,tn_57344_11_8192,Gemm_Hipblaslt_TN_9405,0.252837
GemmTunableOp_Half_TN,tn_10240_2622_8192,Gemm_Hipblaslt_TN_9697,0.72815
GemmTunableOp_Half_TN,tn_8192_1256_8192,Gemm_Rocblas_621294426,0.299953
GemmTunableOp_Half_TN,tn_57344_2914_8192,Gemm_Hipblaslt_TN_9816,4.98403
GemmTunableOp_Half_TN,tn_10240_1104_8192,Gemm_Hipblaslt_TN_9209,0.315128
GemmTunableOp_Half_TN,tn_8192_1374_8192,Gemm_Hipblaslt_TN_9209,0.320148
GemmTunableOp_Half_TN,tn_8192_3140_28672,Gemm_Hipblaslt_TN_9732,2.84938
GemmTunableOp_Half_TN,tn_32000_98_8192,Gemm_Rocblas_621286475,0.198003
GemmTunableOp_Half_TN,tn_8192_2692_8192,Gemm_Rocblas_621294320,0.624957
GemmTunableOp_Half_TN,tn_8192_2962_28672,Gemm_Hipblaslt_TN_9799,2.63934
GemmTunableOp_Half_TN,tn_8192_2041_28672,Gemm_Hipblaslt_TN_9840,1.72997
GemmTunableOp_Half_TN,tn_10240_2962_8192,Gemm_Hipblaslt_TN_9815,0.825817
GemmTunableOp_Half_TN,tn_32000_5_8192,Gemm_Rocblas_621294187,0.13447
GemmTunableOp_Half_TN,tn_8192_1313_28672,Gemm_Hipblaslt_TN_9774,1.19816
GemmTunableOp_Half_TN,tn_8192_100_28672,Gemm_Hipblaslt_TN_8378,0.1963
GemmTunableOp_Half_TN,tn_8192_25_28672,Gemm_Rocblas_621286354,0.125983
GemmTunableOp_Half_TN,tn_10240_131_8192,Gemm_Hipblaslt_TN_9367,0.0664484
GemmTunableOp_Half_TN,tn_8192_1280_28672,Gemm_Rocblas_621286613,1.18808
GemmTunableOp_Half_TN,tn_10240_123_8192,Gemm_Rocblas_621294504,0.0615473
GemmTunableOp_Half_TN,tn_8192_2639_28672,Gemm_Hipblaslt_TN_9774,2.35624
GemmTunableOp_Half_TN,tn_10240_4083_8192,Gemm_Hipblaslt_TN_9743,1.12621
GemmTunableOp_Half_TN,tn_10240_3206_8192,Gemm_Hipblaslt_TN_9753,0.875052
GemmTunableOp_Half_TN,tn_10240_1168_8192,Gemm_Hipblaslt_TN_9697,0.341819
GemmTunableOp_Half_TN,tn_8192_126_8192,Gemm_Hipblaslt_TN_8891,0.0527228
GemmTunableOp_Half_TN,tn_8192_3555_8192,Gemm_Hipblaslt_TN_9743,0.77234
GemmTunableOp_Half_TN,tn_32000_135_8192,Gemm_Hipblaslt_TN_9506,0.23797
GemmTunableOp_Half_TN,tn_32000_99_8192,Gemm_Rocblas_621294212,0.199893
GemmTunableOp_Half_TN,tn_57344_117_8192,Gemm_Rocblas_621294214,0.348933
GemmTunableOp_Half_TN,tn_57344_1168_8192,Gemm_Hipblaslt_TN_9068,2.27531
GemmTunableOp_Half_TN,tn_57344_1268_8192,Gemm_Hipblaslt_TN_9793,2.33651
GemmTunableOp_Half_TN,tn_32000_25_8192,Gemm_Rocblas_621286350,0.146317
GemmTunableOp_Half_TN,tn_8192_110_28672,Gemm_Hipblaslt_TN_8378,0.19547
GemmTunableOp_Half_TN,tn_32000_93_8192,Gemm_Rocblas_621294212,0.196292
GemmTunableOp_Half_TN,tn_57344_3451_8192,Gemm_Hipblaslt_TN_159,5.76479
GemmTunableOp_Half_TN,tn_32000_130_8192,Gemm_Hipblaslt_TN_9506,0.23949
GemmTunableOp_Half_TN,tn_10240_129_8192,Gemm_Hipblaslt_TN_9367,0.0655617
GemmTunableOp_Half_TN,tn_8192_1121_28672,Gemm_Hipblaslt_TN_9774,1.10958
GemmTunableOp_Half_TN,tn_57344_1185_8192,Gemm_Hipblaslt_TN_9827,2.2927
GemmTunableOp_Half_TN,tn_8192_92_28672,Gemm_Hipblaslt_TN_8899,0.180633
GemmTunableOp_Half_TN,tn_8192_114_28672,Gemm_Hipblaslt_TN_8378,0.197763
GemmTunableOp_Half_TN,tn_8192_1248_8192,Gemm_Hipblaslt_TN_9674,0.299318
GemmTunableOp_Half_TN,tn_57344_1025_8192,Gemm_Hipblaslt_TN_9841,1.95022
GemmTunableOp_Half_TN,tn_10240_1256_8192,Gemm_Hipblaslt_TN_9697,0.35379
GemmTunableOp_Half_TN,tn_10240_135_8192,Gemm_Hipblaslt_TN_9367,0.0670353
GemmTunableOp_Half_TN,tn_10240_1121_8192,Gemm_Hipblaslt_TN_9697,0.322447
GemmTunableOp_Half_TN,tn_8192_112_8192,Gemm_Hipblaslt_TN_8891,0.0525777
GemmTunableOp_Half_TN,tn_57344_133_8192,Gemm_Hipblaslt_TN_9507,0.394309
GemmTunableOp_Half_TN,tn_10240_4082_8192,Gemm_Hipblaslt_TN_9814,1.13025
GemmTunableOp_Half_TN,tn_57344_3859_8192,Gemm_Rocblas_621286905,6.48505
GemmTunableOp_Half_TN,tn_8192_3290_8192,Gemm_Hipblaslt_TN_9677,0.731875
GemmTunableOp_Half_TN,tn_32000_127_8192,Gemm_Rocblas_621286475,0.214324
GemmTunableOp_Half_TN,tn_8192_4091_8192,Gemm_Rocblas_621294435,0.882518
GemmTunableOp_Half_TN,tn_8192_1249_8192,Gemm_Hipblaslt_TN_9799,0.298531
GemmTunableOp_Half_TN,tn_8192_3651_28672,Default,3.20361
GemmTunableOp_Half_TN,tn_57344_4096_8192,Gemm_Rocblas_621294486,6.65488
GemmTunableOp_Half_TN,tn_8192_131_8192,Gemm_Hipblaslt_TN_9306,0.0577893
GemmTunableOp_Half_TN,tn_8192_100_8192,Gemm_Hipblaslt_TN_8891,0.0483642
GemmTunableOp_Half_TN,tn_8192_108_28672,Gemm_Hipblaslt_TN_8378,0.198778
GemmTunableOp_Half_TN,tn_8192_16_28672,Gemm_Rocblas_621294224,0.119117
GemmTunableOp_Half_TN,tn_8192_3715_8192,Gemm_Hipblaslt_TN_9193,0.81716
GemmTunableOp_Half_TN,tn_8192_1392_8192,Gemm_Rocblas_621294426,0.320389
GemmTunableOp_Half_TN,tn_8192_1104_8192,Gemm_Hipblaslt_TN_9229,0.260819
GemmTunableOp_Half_TN,tn_8192_117_28672,Gemm_Hipblaslt_TN_8378,0.203067
GemmTunableOp_Half_TN,tn_10240_3203_8192,Gemm_Hipblaslt_TN_9753,0.865103
GemmTunableOp_Half_TN,tn_57344_1271_8192,Gemm_Hipblaslt_TN_9827,2.34954
GemmTunableOp_Half_TN,tn_10240_1286_8192,Gemm_Hipblaslt_TN_9189,0.356564
GemmTunableOp_Half_TN,tn_8192_130_8192,Gemm_Hipblaslt_TN_9306,0.0563219
GemmTunableOp_Half_TN,tn_10240_107_8192,Gemm_Hipblaslt_TN_7543,0.0594395
GemmTunableOp_Half_TN,tn_10240_99_8192,Gemm_Rocblas_621294504,0.0590072
GemmTunableOp_Half_TN,tn_8192_1217_28672,Gemm_Hipblaslt_TN_9774,1.18014
GemmTunableOp_Half_TN,tn_8192_3153_8192,Gemm_Hipblaslt_TN_9677,0.707094
GemmTunableOp_Half_TN,tn_57344_3715_8192,Gemm_Hipblaslt_TN_9922,6.40307
GemmTunableOp_Half_TN,tn_10240_3555_8192,Gemm_Hipblaslt_TN_9928,1.02253
GemmTunableOp_Half_TN,tn_57344_120_8192,Gemm_Rocblas_621286477,0.351987
GemmTunableOp_Half_TN,tn_57344_9_8192,Gemm_Hipblaslt_TN_9404,0.252545
GemmTunableOp_Half_TN,tn_8192_1265_8192,Gemm_Rocblas_621294426,0.299695
GemmTunableOp_Half_TN,tn_8192_101_8192,Gemm_Hipblaslt_TN_8891,0.0495095
GemmTunableOp_Half_TN,tn_10240_3251_8192,Gemm_Hipblaslt_TN_9753,0.879414
GemmTunableOp_Half_TN,tn_10240_91_8192,Gemm_Hipblaslt_TN_8095,0.0527323
GemmTunableOp_Half_TN,tn_8192_119_28672,Gemm_Hipblaslt_TN_8378,0.201014
GemmTunableOp_Half_TN,tn_10240_112_8192,Gemm_Rocblas_621286764,0.060096
GemmTunableOp_Half_TN,tn_8192_123_28672,Gemm_Hipblaslt_TN_8378,0.203732
GemmTunableOp_Half_TN,tn_8192_115_8192,Gemm_Hipblaslt_TN_8891,0.0511207
GemmTunableOp_Half_TN,tn_8192_3162_8192,Gemm_Hipblaslt_TN_9677,0.70326
GemmTunableOp_Half_TN,tn_8192_119_8192,Gemm_Hipblaslt_TN_8891,0.0516404
GemmTunableOp_Half_TN,tn_8192_3251_28672,Gemm_Hipblaslt_TN_9732,2.87239
GemmTunableOp_Half_TN,tn_8192_101_28672,Gemm_Hipblaslt_TN_8378,0.193308
GemmTunableOp_Half_TN,tn_57344_105_8192,Gemm_Rocblas_621294214,0.342637
GemmTunableOp_Half_TN,tn_8192_2015_8192,Gemm_Hipblaslt_TN_9217,0.428517
GemmTunableOp_Half_TN,tn_57344_25_8192,Default,0.265998
GemmTunableOp_Half_TN,tn_8192_1361_28672,Gemm_Hipblaslt_TN_9687,1.26923
GemmTunableOp_Half_TN,tn_8192_128_8192,Gemm_Hipblaslt_TN_8891,0.0534785
GemmTunableOp_Half_TN,tn_10240_1201_8192,Gemm_Hipblaslt_TN_9697,0.345088
GemmTunableOp_Half_TN,tn_8192_3651_8192,Gemm_Hipblaslt_TN_9813,0.808918
GemmTunableOp_Half_TN,tn_10240_102_8192,Gemm_Rocblas_621294504,0.059722
GemmTunableOp_Half_TN,tn_8192_124_8192,Gemm_Hipblaslt_TN_8891,0.0534574
GemmStridedBatchedTunableOp_Half_TN,tn_1152_1152_128_B_64,Gemm_Hipblaslt_TN_9774,0.0981979
GemmStridedBatchedTunableOp_Half_TN,tn_1151_1151_128_B_64,Gemm_Hipblaslt_TN_6879,0.118839
GemmStridedBatchedTunableOp_Half_TN,tn_1080_1080_128_B_64,Gemm_Rocblas_621294725,0.106286
GemmStridedBatchedTunableOp_Half_TN,tn_1341_1341_128_B_64,Gemm_Rocblas_621294109,0.155672
GemmStridedBatchedTunableOp_Half_TN,tn_1057_1057_128_B_64,Gemm_Rocblas_621294725,0.107389
GemmStridedBatchedTunableOp_Half_TN,tn_1367_1367_128_B_64,Gemm_Rocblas_621294109,0.158215
GemmStridedBatchedTunableOp_Half_TN,tn_1389_1389_128_B_64,Gemm_Rocblas_621294109,0.163063
GemmStridedBatchedTunableOp_Half_TN,tn_1038_1038_128_B_64,Gemm_Rocblas_621294725,0.10082
GemmStridedBatchedTunableOp_Half_TN,tn_1296_1296_128_B_64,Gemm_Rocblas_621294551,0.136107
GemmStridedBatchedTunableOp_Half_TN,tn_1128_1128_128_B_64,Gemm_Rocblas_621294725,0.114166
GemmStridedBatchedTunableOp_Half_TN,tn_1441_1441_128_B_64,Gemm_Rocblas_621294106,0.174575
GemmStridedBatchedTunableOp_Half_TN,tn_16_16_128_B_64,Gemm_Rocblas_621286717,0.00667556
GemmStridedBatchedTunableOp_Half_TN,tn_1350_1350_128_B_64,Gemm_Rocblas_621286412,0.154488
GemmStridedBatchedTunableOp_Half_TN,tn_1064_1064_128_B_64,Gemm_Rocblas_621294725,0.102961
GemmStridedBatchedTunableOp_Half_TN,tn_1076_1076_128_B_64,Gemm_Rocblas_621286397,0.108036
GemmStridedBatchedTunableOp_Half_TN,tn_1256_1256_128_B_64,Gemm_Rocblas_621294106,0.131775
GemmStridedBatchedTunableOp_Half_TN,tn_1392_1392_128_B_64,Gemm_Rocblas_621286412,0.148962
GemmStridedBatchedTunableOp_Half_TN,tn_1010_1010_128_B_64,Gemm_Hipblaslt_TN_6879,0.0964034
GemmStridedBatchedTunableOp_Half_TN,tn_1032_1032_128_B_64,Gemm_Rocblas_621294725,0.0996483
GemmStridedBatchedTunableOp_Half_TN,tn_1263_1263_128_B_64,Gemm_Hipblaslt_TN_6879,0.136173
GemmStridedBatchedTunableOp_Half_TN,tn_1022_1022_128_B_64,Gemm_Hipblaslt_TN_6879,0.0975572
GemmStridedBatchedTunableOp_Half_TN,tn_1455_1455_128_B_64,Gemm_Rocblas_621286397,0.179817
GemmStridedBatchedTunableOp_Half_TN,tn_1425_1425_128_B_64,Gemm_Rocblas_621294106,0.173502
GemmStridedBatchedTunableOp_Half_TN,tn_1318_1318_128_B_64,Gemm_Rocblas_621294109,0.151668
GemmStridedBatchedTunableOp_Half_TN,tn_1404_1404_128_B_64,Gemm_Rocblas_621286412,0.16285
GemmTunableOp_Half_TN,tn_8192_4096_14336,Gemm_Hipblaslt_TN_9756,1.72167
GemmTunableOp_Half_TN,tn_28672_256_8192,Gemm_Hipblaslt_TN_9540,0.291877
GemmTunableOp_Half_TN,tn_5120_4096_8192,Gemm_Hipblaslt_TN_9649,0.595885
GemmStridedBatchedTunableOp_Half_TN,tn_2000_2000_128_B_32,Gemm_Rocblas_621286397,0.147752
GemmTunableOp_Half_TN,tn_11008_4096_4096,Gemm_Rocblas_621294289,0.632704
GemmTunableOp_Half_TN,tn_4096_4096_2048,Gemm_Rocblas_621286281,0.118001
GemmTunableOp_Half_TN,tn_4096_256_2048,Gemm_Rocblas_621286447,0.0144404
GemmTunableOp_Half_TN,tn_6144_232_4096,Gemm_Rocblas_621294207,0.0356155
GemmStridedBatchedTunableOp_Half_TN,tn_1000_1000_128_B_16,Gemm_Rocblas_621293994,0.0253318
GemmTunableOp_Half_TN,tn_4096_2161_4096,Gemm_Hipblaslt_TN_9686,0.13345
GemmTunableOp_Half_TN,tn_4096_2193_4096,Gemm_Hipblaslt_TN_9698,0.135438
GemmTunableOp_Half_TN,tn_22016_145_4096,Gemm_Hipblaslt_TN_9321,0.0735501
GemmTunableOp_Half_TN,tn_12288_143_4096,Gemm_Hipblaslt_TN_9154,0.0416261
GemmTunableOp_Half_TN,tn_12288_2289_4096,Gemm_Hipblaslt_TN_9677,0.384279
GemmTunableOp_Half_TN,tn_12288_4096_4096,Gemm_Hipblaslt_TN_9220,0.677582
GemmTunableOp_Half_TN,tn_4096_2241_11008,Gemm_Hipblaslt_TN_9698,0.359252
GemmTunableOp_Half_TN,tn_4096_2433_4096,Gemm_Rocblas_621286753,0.151882
GemmTunableOp_Half_TN,tn_12288_2465_4096,Gemm_Hipblaslt_TN_9222,0.424368
GemmTunableOp_Half_TN,tn_12288_2337_4096,Gemm_Rocblas_621294420,0.407826
GemmTunableOp_Half_TN,tn_4096_2193_11008,Gemm_Hipblaslt_TN_9748,0.357324
GemmTunableOp_Half_TN,tn_22016_2497_4096,Gemm_Hipblaslt_TN_9832,0.793345
GemmTunableOp_Half_TN,tn_32000_132_4096,Gemm_Hipblaslt_TN_9564,0.0937796
GemmTunableOp_Half_TN,tn_12288_2225_4096,Gemm_Hipblaslt_TN_9697,0.379236
GemmTunableOp_Half_TN,tn_12288_2129_4096,Gemm_Hipblaslt_TN_9187,0.37315
GemmTunableOp_Half_TN,tn_32000_136_4096,Gemm_Hipblaslt_TN_9564,0.0946117
GemmTunableOp_Half_TN,tn_4096_2465_11008,Gemm_Hipblaslt_TN_9681,0.390969
GemmTunableOp_Half_TN,tn_32000_133_4096,Gemm_Hipblaslt_TN_9564,0.0939486
GemmTunableOp_Half_TN,tn_32000_141_4096,Gemm_Hipblaslt_TN_9564,0.0951893
GemmTunableOp_Half_TN,tn_22016_2177_4096,Gemm_Hipblaslt_TN_9827,0.685704
GemmTunableOp_Half_TN,tn_32000_256_4096,Gemm_Hipblaslt_TN_9845,0.13307
GemmTunableOp_Half_TN,tn_4096_156_11008,Gemm_Hipblaslt_TN_7563,0.0489789
GemmTunableOp_Half_TN,tn_4096_144_4096,Gemm_Hipblaslt_TN_9474,0.0220657
GemmTunableOp_Half_TN,tn_22016_144_4096,Gemm_Hipblaslt_TN_9319,0.0720027
GemmTunableOp_Half_TN,tn_4096_146_11008,Gemm_Hipblaslt_TN_7219,0.0463665
GemmTunableOp_Half_TN,tn_32000_146_4096,Gemm_Hipblaslt_TN_9612,0.0953952
GemmTunableOp_Half_TN,tn_4096_142_11008,Gemm_Hipblaslt_TN_7219,0.0455021
GemmTunableOp_Half_TN,tn_4096_2255_4096,Gemm_Hipblaslt_TN_9627,0.137978
GemmTunableOp_Half_TN,tn_4096_4000_11008,Gemm_Rocblas_621294034,0.575544
GemmTunableOp_Half_TN,tn_32000_149_4096,Gemm_Hipblaslt_TN_9564,0.0958326
GemmTunableOp_Half_TN,tn_4096_137_11008,Gemm_Hipblaslt_TN_8260,0.0446911
GemmTunableOp_Half_TN,tn_4096_149_4096,Gemm_Rocblas_621294168,0.0219267
GemmTunableOp_Half_TN,tn_4096_138_11008,Gemm_Hipblaslt_TN_7219,0.0454972
GemmTunableOp_Half_TN,tn_32000_148_4096,Gemm_Hipblaslt_TN_9564,0.0965265
GemmTunableOp_Half_TN,tn_12288_149_4096,Gemm_Rocblas_621286472,0.0431545
GemmTunableOp_Half_TN,tn_4096_2129_4096,Gemm_Hipblaslt_TN_9698,0.132281
GemmTunableOp_Half_TN,tn_32000_147_4096,Gemm_Hipblaslt_TN_9612,0.0964412
GemmTunableOp_Half_TN,tn_4096_2064_4096,Gemm_Hipblaslt_TN_9728,0.132527
GemmTunableOp_Half_TN,tn_22016_4000_4096,Gemm_Hipblaslt_TN_9832,1.23896
GemmTunableOp_Half_TN,tn_22016_157_4096,Gemm_Hipblaslt_TN_7216,0.0760254
GemmTunableOp_Half_TN,tn_22016_158_4096,Gemm_Hipblaslt_TN_9319,0.0755997
GemmTunableOp_Half_TN,tn_4096_4050_4096,Gemm_Hipblaslt_TN_9191,0.226929
GemmTunableOp_Half_TN,tn_4096_2209_11008,Gemm_Hipblaslt_TN_9698,0.356741
GemmTunableOp_Half_TN,tn_4096_2305_11008,Gemm_Hipblaslt_TN_9698,0.369483
GemmTunableOp_Half_TN,tn_4096_145_11008,Gemm_Hipblaslt_TN_7219,0.0466408
GemmTunableOp_Half_TN,tn_4096_2369_4096,Gemm_Hipblaslt_TN_9698,0.140539
GemmTunableOp_Half_TN,tn_4096_153_4096,Gemm_Rocblas_621294230,0.0221939
GemmTunableOp_Half_TN,tn_4096_161_11008,Gemm_Hipblaslt_TN_7586,0.0495424
GemmTunableOp_Half_TN,tn_32000_5_4096,Gemm_Rocblas_621294053,0.0486438
GemmTunableOp_Half_TN,tn_4096_4017_11008,Gemm_Hipblaslt_TN_9713,0.580137
GemmTunableOp_Half_TN,tn_12288_6_4096,Gemm_Rocblas_621286318,0.0212778
GemmTunableOp_Half_TN,tn_4096_6_4096,Gemm_Rocblas_621294130,0.0100037
GemmTunableOp_Half_TN,tn_4096_5_11008,Gemm_Rocblas_621286323,0.0230981
GemmTunableOp_Half_TN,tn_22016_2080_4096,Gemm_Hipblaslt_TN_9841,0.672568
GemmTunableOp_Half_TN,tn_12288_2303_4096,Gemm_Hipblaslt_TN_9743,0.383851
GemmTunableOp_Half_TN,tn_22016_2065_4096,Gemm_Hipblaslt_TN_9827,0.668176
GemmTunableOp_Half_TN,tn_4096_2081_11008,Gemm_Hipblaslt_TN_9698,0.34512
GemmTunableOp_Half_TN,tn_22016_2274_4096,Gemm_Hipblaslt_TN_9832,0.745586
GemmTunableOp_Half_TN,tn_4096_2272_11008,Gemm_Hipblaslt_TN_9728,0.361183
GemmTunableOp_Half_TN,tn_4096_2145_4096,Gemm_Hipblaslt_TN_9686,0.134112
GemmTunableOp_Half_TN,tn_12288_7_4096,Gemm_Rocblas_621286318,0.0213314
GemmTunableOp_Half_TN,tn_32000_134_4096,Gemm_Hipblaslt_TN_9564,0.0935757
GemmTunableOp_Half_TN,tn_22016_5_4096,Gemm_Rocblas_621286346,0.0350924
GemmTunableOp_Half_TN,tn_22016_2241_4096,Gemm_Hipblaslt_TN_9832,0.734246
GemmTunableOp_Half_TN,tn_22016_2321_4096,Gemm_Hipblaslt_TN_9846,0.780565
GemmTunableOp_Half_TN,tn_12288_136_4096,Gemm_Hipblaslt_TN_9144,0.0419959
GemmTunableOp_Half_TN,tn_4096_158_11008,Gemm_Hipblaslt_TN_8260,0.0475472
GemmTunableOp_Half_TN,tn_22016_4096_4096,Gemm_Hipblaslt_TN_9840,1.28167
GemmTunableOp_Half_TN,tn_12288_148_4096,Gemm_Rocblas_621294209,0.0436437
GemmTunableOp_Half_TN,tn_4096_156_4096,Gemm_Rocblas_621294230,0.0221645
GemmTunableOp_Half_TN,tn_4096_142_4096,Gemm_Hipblaslt_TN_9474,0.0216611
GemmTunableOp_Half_TN,tn_22016_2097_4096,Gemm_Hipblaslt_TN_9827,0.669489
GemmTunableOp_Half_TN,tn_12288_142_4096,Gemm_Rocblas_621286493,0.043452
GemmTunableOp_Half_TN,tn_12288_146_4096,Gemm_Rocblas_621286472,0.042934
GemmTunableOp_Half_TN,tn_4096_4096_4096,Gemm_Hipblaslt_TN_9827,0.227375
GemmTunableOp_Half_TN,tn_4096_2241_4096,Gemm_Hipblaslt_TN_9698,0.136457
GemmTunableOp_Half_TN,tn_32000_154_4096,Gemm_Hipblaslt_TN_9564,0.0965441
GemmTunableOp_Half_TN,tn_4096_7_11008,Gemm_Rocblas_621294054,0.023334
GemmTunableOp_Half_TN,tn_32000_159_4096,Gemm_Hipblaslt_TN_9606,0.0985324
GemmTunableOp_Half_TN,tn_12288_2257_4096,Gemm_Hipblaslt_TN_9743,0.38146
GemmTunableOp_Half_TN,tn_22016_2353_4096,Gemm_Hipblaslt_TN_9832,0.807986
GemmTunableOp_Half_TN,tn_4096_153_11008,Gemm_Hipblaslt_TN_8260,0.048148
GemmTunableOp_Half_TN,tn_12288_2417_4096,Gemm_Hipblaslt_TN_9217,0.410031
GemmTunableOp_Half_TN,tn_12288_145_4096,Gemm_Rocblas_621286472,0.0431609
GemmTunableOp_Half_TN,tn_4096_160_4096,Gemm_Rocblas_621294230,0.0221627
GemmTunableOp_Half_TN,tn_32000_131_4096,Gemm_Hipblaslt_TN_9564,0.0935829
GemmTunableOp_Half_TN,tn_12288_141_4096,Gemm_Rocblas_621286472,0.0428667
GemmTunableOp_Half_TN,tn_12288_2000_4096,Gemm_Rocblas_621286747,0.350137
GemmTunableOp_Half_TN,tn_4096_2258_4096,Gemm_Hipblaslt_TN_9686,0.13835
GemmTunableOp_Half_TN,tn_32000_7_4096,Gemm_Rocblas_621294053,0.0487732
GemmTunableOp_Half_TN,tn_12288_156_4096,Gemm_Rocblas_621286472,0.0432792
GemmStridedBatchedTunableOp_Half_TN,tn_2417_2417_128_B_32,Gemm_Rocblas_621294106,0.238258
GemmStridedBatchedTunableOp_Half_TN,tn_2113_2113_128_B_32,Gemm_Rocblas_621294106,0.180661
GemmStridedBatchedTunableOp_Half_TN,tn_2097_2097_128_B_32,Gemm_Rocblas_621294106,0.180096
GemmStridedBatchedTunableOp_Half_TN,tn_2257_2257_128_B_32,Gemm_Rocblas_621294106,0.208049
GemmStridedBatchedTunableOp_Half_TN,tn_2081_2081_128_B_32,Gemm_Rocblas_621294106,0.17911
GemmStridedBatchedTunableOp_Half_TN,tn_2305_2305_128_B_32,Gemm_Rocblas_621294542,0.223513
GemmStridedBatchedTunableOp_Half_TN,tn_2273_2273_128_B_32,Gemm_Rocblas_621294106,0.21057
GemmStridedBatchedTunableOp_Half_TN,tn_2274_2274_128_B_32,Gemm_Rocblas_621294106,0.207323
GemmStridedBatchedTunableOp_Half_TN,tn_2017_2017_128_B_32,Gemm_Rocblas_621286397,0.164558
GemmStridedBatchedTunableOp_Half_TN,tn_2290_2290_128_B_32,Gemm_Rocblas_621294106,0.210626
GemmTunableOp_Half_TN,tn_6144_4000_4096,Gemm_Rocblas_621294315,0.339748
GemmTunableOp_Half_TN,tn_4096_4096_5504,Gemm_Rocblas_621286281,0.301911
GemmStridedBatchedTunableOp_Half_TN,tn_2000_2000_128_B_16,Gemm_Hipblaslt_TN_153,0.0776304
GemmTunableOp_Half_TN,tn_5120_4000_8192,Gemm_Hipblaslt_TN_9649,0.583654
GemmTunableOp_Half_TN,tn_28672_256_8192,Gemm_Rocblas_621294717,0.290593
GemmTunableOp_Half_TN,tn_5120_4096_8192,Gemm_Rocblas_621286651,0.599902
GemmTunableOp_Half_TN,tn_5120_232_8192,Gemm_Rocblas_621286764,0.0575177
GemmStridedBatchedTunableOp_Half_TN,tn_1000_1000_128_B_32,Gemm_Hipblaslt_TN_149,0.0449833
GemmTunableOp_Half_TN,tn_4096_256_7168,Gemm_Hipblaslt_TN_9497,0.0437209
GemmTunableOp_Half_TN,tn_3072_8000_4096,Gemm_Hipblaslt_TN_9852,0.344936
GemmTunableOp_Half_TN,tn_3072_256_4096,Gemm_Rocblas_621294171,0.0224059
GemmTunableOp_Half_TN,tn_4096_232_2048,Gemm_Rocblas_621294175,0.0140906
GemmTunableOp_Half_TN,tn_14336_8192_4096,Gemm_Hipblaslt_TN_9929,1.58207
GemmTunableOp_Half_TN,tn_3072_232_4096,Gemm_Rocblas_621294171,0.022754
GemmStridedBatchedTunableOp_Half_TN,tn_2000_2000_128_B_16,Gemm_Hipblaslt_TN_153,0.0773383
GemmTunableOp_Half_TN,tn_10240_4048_8192,Gemm_Hipblaslt_TN_9814,1.11924
GemmTunableOp_Half_TN,tn_8192_2096_8192,Gemm_Hipblaslt_TN_9763,0.500206
GemmTunableOp_Half_TN,tn_8192_2284_28672,Gemm_Hipblaslt_TN_9649,2.23739
GemmTunableOp_Half_TN,tn_8192_2177_8192,Gemm_Hipblaslt_TN_9763,0.504617
GemmTunableOp_Half_TN,tn_8192_2239_28672,Gemm_Hipblaslt_TN_9762,2.09422
GemmTunableOp_Half_TN,tn_8192_4049_8192,Gemm_Hipblaslt_TN_9184,0.880015
GemmTunableOp_Half_TN,tn_10240_2255_8192,Gemm_Rocblas_621286580,0.650749
GemmTunableOp_Half_TN,tn_57344_2192_8192,Gemm_Hipblaslt_TN_154,3.99314
GemmTunableOp_Half_TN,tn_10240_2207_8192,Gemm_Hipblaslt_TN_9182,0.627947
GemmTunableOp_Half_TN,tn_57344_2239_8192,Default,3.9479
GemmTunableOp_Half_TN,tn_10240_2193_8192,Gemm_Hipblaslt_TN_9211,0.627612
GemmTunableOp_Half_TN,tn_8192_2049_8192,Gemm_Hipblaslt_TN_9742,0.490938
GemmTunableOp_Half_TN,tn_10240_2370_8192,Gemm_Hipblaslt_TN_9209,0.667175
GemmTunableOp_Half_TN,tn_57344_2304_8192,Gemm_Rocblas_621294542,4.02244
GemmTunableOp_Half_TN,tn_10240_2190_8192,Gemm_Hipblaslt_TN_9211,0.627813
GemmTunableOp_Half_TN,tn_57344_2238_8192,Gemm_Rocblas_621294542,3.97411
GemmTunableOp_Half_TN,tn_8192_2284_8192,Gemm_Hipblaslt_TN_9763,0.513136
GemmTunableOp_Half_TN,tn_57344_2178_8192,Default,3.89852
GemmTunableOp_Half_TN,tn_10240_62_8192,Gemm_Hipblaslt_TN_7492,0.0480553
GemmTunableOp_Half_TN,tn_8192_2465_8192,Gemm_Hipblaslt_TN_9774,0.597415
GemmTunableOp_Half_TN,tn_57344_61_8192,Gemm_Rocblas_621286468,0.304955
GemmTunableOp_Half_TN,tn_8192_4050_28672,Gemm_Rocblas_621294634,3.41561
GemmTunableOp_Half_TN,tn_8192_61_8192,Gemm_Hipblaslt_TN_7484,0.0398102
GemmTunableOp_Half_TN,tn_8192_2415_8192,Gemm_Hipblaslt_TN_9264,0.546526
GemmTunableOp_Half_TN,tn_57344_2208_8192,Gemm_Hipblaslt_TN_156,3.96586
GemmTunableOp_Half_TN,tn_10240_4096_8192,Gemm_Hipblaslt_TN_9743,1.1301
GemmTunableOp_Half_TN,tn_10240_2465_8192,Gemm_Hipblaslt_TN_9697,0.693573
GemmTunableOp_Half_TN,tn_8192_2065_8192,Gemm_Hipblaslt_TN_9742,0.496493
GemmTunableOp_Half_TN,tn_8192_2385_28672,Gemm_Hipblaslt_TN_9649,2.28778
GemmTunableOp_Half_TN,tn_8192_2255_28672,Gemm_Hipblaslt_TN_9649,2.21836
GemmTunableOp_Half_TN,tn_8192_2193_8192,Gemm_Hipblaslt_TN_9763,0.506831
GemmTunableOp_Half_TN,tn_8192_31_28672,Gemm_Rocblas_621286354,0.128482
GemmTunableOp_Half_TN,tn_8192_2302_8192,Gemm_Hipblaslt_TN_9763,0.515886
GemmTunableOp_Half_TN,tn_8192_2145_8192,Gemm_Hipblaslt_TN_9742,0.502815
GemmTunableOp_Half_TN,tn_8192_2159_8192,Gemm_Hipblaslt_TN_9742,0.500722
GemmTunableOp_Half_TN,tn_10240_2305_8192,Gemm_Hipblaslt_TN_9675,0.658696
GemmTunableOp_Half_TN,tn_57344_2017_8192,Gemm_Hipblaslt_TN_9840,3.50167
GemmTunableOp_Half_TN,tn_10240_2191_8192,Gemm_Hipblaslt_TN_9211,0.629069
GemmTunableOp_Half_TN,tn_8192_30_28672,Gemm_Rocblas_621286354,0.12831
GemmTunableOp_Half_TN,tn_32000_63_8192,Gemm_Rocblas_621294203,0.160806
GemmTunableOp_Half_TN,tn_8192_64_28672,Gemm_Rocblas_621286489,0.144765
GemmTunableOp_Half_TN,tn_10240_2270_8192,Gemm_Rocblas_621286617,0.652606
GemmTunableOp_Half_TN,tn_10240_2413_8192,Gemm_Hipblaslt_TN_9139,0.687171
GemmTunableOp_Half_TN,tn_8192_2369_8192,Gemm_Hipblaslt_TN_9229,0.544763
GemmTunableOp_Half_TN,tn_8192_2081_8192,Gemm_Hipblaslt_TN_9742,0.49872
GemmTunableOp_Half_TN,tn_10240_2128_8192,Gemm_Rocblas_621286663,0.62403
GemmTunableOp_Half_TN,tn_8192_2113_28672,Gemm_Hipblaslt_TN_9762,2.032
GemmTunableOp_Half_TN,tn_8192_66_8192,Gemm_Hipblaslt_TN_7093,0.0436711
GemmTunableOp_Half_TN,tn_57344_4096_8192,Gemm_Hipblaslt_TN_9963,6.64372
GemmTunableOp_Half_TN,tn_8192_2385_8192,Gemm_Hipblaslt_TN_9264,0.545936
GemmTunableOp_Half_TN,tn_8192_28_28672,Gemm_Rocblas_621294226,0.129545
GemmTunableOp_Half_TN,tn_10240_2127_8192,Gemm_Rocblas_621286663,0.622773
GemmTunableOp_Half_TN,tn_57344_68_8192,Gemm_Rocblas_621294520,0.321574
GemmTunableOp_Half_TN,tn_8192_2161_28672,Gemm_Hipblaslt_TN_9762,2.05102
GemmTunableOp_Half_TN,tn_10240_2178_8192,Gemm_Hipblaslt_TN_9209,0.627245
GemmTunableOp_Half_TN,tn_10240_67_8192,Gemm_Hipblaslt_TN_9304,0.0497179
GemmTunableOp_Half_TN,tn_10240_2239_8192,Gemm_Hipblaslt_TN_9211,0.634914
GemmTunableOp_Half_TN,tn_8192_2112_28672,Gemm_Hipblaslt_TN_9762,2.02484
GemmTunableOp_Half_TN,tn_57344_4000_8192,Gemm_Rocblas_621294643,6.59492
GemmTunableOp_Half_TN,tn_8192_2177_28672,Gemm_Hipblaslt_TN_9762,2.05391
GemmTunableOp_Half_TN,tn_8192_2397_8192,Gemm_Hipblaslt_TN_9208,0.549206
GemmTunableOp_Half_TN,tn_10240_64_8192,Gemm_Hipblaslt_TN_7492,0.0478092
GemmTunableOp_Half_TN,tn_57344_65_8192,Gemm_Rocblas_621294520,0.31923
GemmTunableOp_Half_TN,tn_10240_60_8192,Gemm_Hipblaslt_TN_9304,0.0470015
GemmTunableOp_Half_TN,tn_57344_63_8192,Gemm_Rocblas_621286468,0.305124
GemmTunableOp_Half_TN,tn_57344_2413_8192,Gemm_Hipblaslt_TN_9924,4.40781
GemmTunableOp_Half_TN,tn_57344_62_8192,Gemm_Rocblas_621286468,0.304352
GemmTunableOp_Half_TN,tn_8192_54_28672,Gemm_Rocblas_621294228,0.141622
GemmTunableOp_Half_TN,tn_57344_2193_8192,Gemm_Hipblaslt_TN_9841,4.01315
GemmTunableOp_Half_TN,tn_57344_28_8192,Gemm_Rocblas_621294194,0.27193
GemmTunableOp_Half_TN,tn_8192_2225_28672,Gemm_Hipblaslt_TN_9762,2.09006
GemmTunableOp_Half_TN,tn_57344_2158_8192,Gemm_Hipblaslt_TN_9827,3.98447
GemmTunableOp_Half_TN,tn_57344_4066_8192,Gemm_Hipblaslt_TN_9882,6.63913
GemmTunableOp_Half_TN,tn_8192_2158_8192,Gemm_Hipblaslt_TN_9763,0.504886
GemmTunableOp_Half_TN,tn_8192_2191_8192,Gemm_Hipblaslt_TN_9763,0.505978
GemmTunableOp_Half_TN,tn_57344_56_8192,Gemm_Rocblas_621286468,0.305049
GemmTunableOp_Half_TN,tn_57344_60_8192,Gemm_Rocblas_621286468,0.303696
GemmTunableOp_Half_TN,tn_57344_2255_8192,Gemm_Hipblaslt_TN_9666,4.07223
GemmTunableOp_Half_TN,tn_10240_2304_8192,Gemm_Rocblas_621286617,0.649122
GemmTunableOp_Half_TN,tn_8192_2238_28672,Gemm_Hipblaslt_TN_9762,2.09348
GemmTunableOp_Half_TN,tn_8192_2369_28672,Gemm_Hipblaslt_TN_9771,2.30076
GemmTunableOp_Half_TN,tn_10240_2096_8192,Gemm_Hipblaslt_TN_9729,0.621161
GemmStridedBatchedTunableOp_Half_TN,tn_2113_2113_128_B_64,Gemm_Rocblas_621294106,0.36754
GemmStridedBatchedTunableOp_Half_TN,tn_2397_2397_128_B_64,Gemm_Rocblas_621294106,0.459404
GemmStridedBatchedTunableOp_Half_TN,tn_2304_2304_128_B_64,Gemm_Hipblaslt_TN_158,0.351234
GemmStridedBatchedTunableOp_Half_TN,tn_2032_2032_128_B_64,Gemm_Rocblas_621286397,0.332543
GemmStridedBatchedTunableOp_Half_TN,tn_2082_2082_128_B_64,Gemm_Rocblas_621294106,0.351159
GemmStridedBatchedTunableOp_Half_TN,tn_2033_2033_128_B_64,Gemm_Hipblaslt_TN_6950,0.344259
GemmStridedBatchedTunableOp_Half_TN,tn_2177_2177_128_B_64,Gemm_Rocblas_621294106,0.380353
GemmStridedBatchedTunableOp_Half_TN,tn_2465_2465_128_B_64,Gemm_Rocblas_621294106,0.477157
GemmStridedBatchedTunableOp_Half_TN,tn_2208_2208_128_B_64,Gemm_Hipblaslt_TN_158,0.362015
GemmStridedBatchedTunableOp_Half_TN,tn_2159_2159_128_B_64,Gemm_Rocblas_621294106,0.376961
GemmStridedBatchedTunableOp_Half_TN,tn_2225_2225_128_B_64,Gemm_Rocblas_621294106,0.394281
GemmStridedBatchedTunableOp_Half_TN,tn_2257_2257_128_B_64,Gemm_Rocblas_621294106,0.403266
GemmStridedBatchedTunableOp_Half_TN,tn_2000_2000_128_B_64,Gemm_Hipblaslt_TN_159,0.32236
GemmStridedBatchedTunableOp_Half_TN,tn_2190_2190_128_B_64,Gemm_Rocblas_621294106,0.388216
GemmTunableOp_Half_TN,tn_4096_256_14336,Gemm_Hipblaslt_TN_9303,0.0797124
GemmTunableOp_Half_TN,tn_28672_8000_4096,Gemm_Hipblaslt_TN_9888,3.18615
GemmTunableOp_Half_TN,tn_4096_8192_4096,Gemm_Hipblaslt_TN_9914,0.45082
GemmStridedBatchedTunableOp_Half_TN,tn_2000_2000_128_B_32,Gemm_Hipblaslt_TN_150,0.15056
GemmTunableOp_Half_TN,tn_8192_2337_8192,Gemm_Hipblaslt_TN_9274,0.537399
GemmTunableOp_Half_TN,tn_32000_54_8192,Gemm_Rocblas_621294203,0.156865
GemmTunableOp_Half_TN,tn_8192_2321_8192,Gemm_Hipblaslt_TN_9274,0.540739
GemmTunableOp_Half_TN,tn_8192_4050_8192,Gemm_Hipblaslt_TN_9704,0.88003
GemmTunableOp_Half_TN,tn_8192_2413_8192,Gemm_Hipblaslt_TN_9274,0.546622
GemmTunableOp_Half_TN,tn_57344_2302_8192,Gemm_Rocblas_621294543,4.05026
GemmTunableOp_Half_TN,tn_8192_59_28672,Default,0.147163
GemmTunableOp_Half_TN,tn_57344_4048_8192,Gemm_Hipblaslt_TN_9882,6.64359
GemmTunableOp_Half_TN,tn_57344_2289_8192,Default,3.98342
GemmTunableOp_Half_TN,tn_8192_4049_28672,Gemm_Rocblas_621286915,3.42684
GemmTunableOp_Half_TN,tn_8192_4081_8192,Gemm_Rocblas_621294435,0.878181
GemmTunableOp_Half_TN,tn_32000_256_8192,Gemm_Rocblas_621286625,0.319374
GemmTunableOp_Half_TN,tn_8192_2079_28672,Gemm_Hipblaslt_TN_9742,2.07537
GemmTunableOp_Half_TN,tn_8192_2000_8192,Gemm_Hipblaslt_TN_9202,0.430476
GemmTunableOp_Half_TN,tn_8192_2049_28672,Gemm_Hipblaslt_TN_9763,2.07995
GemmTunableOp_Half_TN,tn_8192_30_28672,Gemm_Rocblas_621294226,0.128314
GemmTunableOp_Half_TN,tn_10240_29_8192,Gemm_Hipblaslt_TN_9415,0.0401128
GemmTunableOp_Half_TN,tn_8192_2160_8192,Gemm_Hipblaslt_TN_9763,0.500902
GemmTunableOp_Half_TN,tn_8192_2255_28672,Gemm_Hipblaslt_TN_9649,2.21055
GemmTunableOp_Half_TN,tn_8192_2284_8192,Gemm_Hipblaslt_TN_9742,0.51354
GemmTunableOp_Half_TN,tn_8192_60_8192,Gemm_Hipblaslt_TN_7484,0.0391781
GemmTunableOp_Half_TN,tn_57344_2161_8192,Gemm_Hipblaslt_TN_9827,3.97961
GemmTunableOp_Half_TN,tn_57344_57_8192,Gemm_Rocblas_621286468,0.297431
GemmTunableOp_Half_TN,tn_8192_2465_8192,Gemm_Hipblaslt_TN_9774,0.599659
GemmTunableOp_Half_TN,tn_57344_2158_8192,Gemm_Hipblaslt_TN_9667,3.99609
GemmTunableOp_Half_TN,tn_10240_2208_8192,Gemm_Hipblaslt_TN_9182,0.628946
GemmTunableOp_Half_TN,tn_10240_68_8192,Gemm_Hipblaslt_TN_9304,0.0490416
GemmTunableOp_Half_TN,tn_57344_2028_8192,Gemm_Hipblaslt_TN_9840,3.52748
GemmTunableOp_Half_TN,tn_8192_2129_8192,Gemm_Hipblaslt_TN_9742,0.500959
GemmTunableOp_Half_TN,tn_57344_2079_8192,Gemm_Hipblaslt_TN_9841,3.93579
GemmTunableOp_Half_TN,tn_10240_2082_8192,Gemm_Hipblaslt_TN_9182,0.621378
GemmTunableOp_Half_TN,tn_8192_2413_28672,Gemm_Hipblaslt_TN_9649,2.32072
GemmTunableOp_Half_TN,tn_32000_28_8192,Gemm_Rocblas_621286350,0.14559
GemmTunableOp_Half_TN,tn_57344_2178_8192,Gemm_Hipblaslt_TN_9666,4.01379
GemmTunableOp_Half_TN,tn_57344_4049_8192,Gemm_Hipblaslt_TN_9758,6.62544
GemmTunableOp_Half_TN,tn_57344_2129_8192,Gemm_Hipblaslt_TN_9841,3.98624
GemmTunableOp_Half_TN,tn_57344_2465_8192,Gemm_Rocblas_621294015,4.39778
GemmTunableOp_Half_TN,tn_32000_29_8192,Gemm_Rocblas_621286350,0.144016
GemmTunableOp_Half_TN,tn_57344_2113_8192,Gemm_Hipblaslt_TN_9841,3.96877
GemmTunableOp_Half_TN,tn_8192_30_8192,Gemm_Hipblaslt_TN_9415,0.0339848
GemmTunableOp_Half_TN,tn_10240_30_8192,Gemm_Hipblaslt_TN_9415,0.040314
GemmTunableOp_Half_TN,tn_8192_2017_8192,Gemm_Hipblaslt_TN_9840,0.465344
GemmTunableOp_Half_TN,tn_8192_4017_28672,Gemm_Rocblas_621286894,3.40573
GemmTunableOp_Half_TN,tn_8192_4050_28672,Gemm_Rocblas_621286915,3.41756
GemmTunableOp_Half_TN,tn_8192_61_8192,Gemm_Hipblaslt_TN_7484,0.040736
GemmTunableOp_Half_TN,tn_8192_2190_28672,Gemm_Hipblaslt_TN_9762,2.06001
GemmTunableOp_Half_TN,tn_10240_64_8192,Gemm_Hipblaslt_TN_7492,0.0479107
GemmTunableOp_Half_TN,tn_32000_31_8192,Gemm_Rocblas_621286350,0.147846
GemmTunableOp_Half_TN,tn_32000_64_8192,Gemm_Rocblas_621286466,0.160154
GemmTunableOp_Half_TN,tn_8192_2385_28672,Gemm_Hipblaslt_TN_9771,2.3011
GemmTunableOp_Half_TN,tn_8192_2397_28672,Gemm_Hipblaslt_TN_9771,2.28901
GemmTunableOp_Half_TN,tn_10240_2191_8192,Gemm_Hipblaslt_TN_9211,0.630446
GemmTunableOp_Half_TN,tn_32000_67_8192,Gemm_Hipblaslt_TN_9479,0.184505
GemmTunableOp_Half_TN,tn_10240_2417_8192,Gemm_Hipblaslt_TN_9189,0.685607
GemmTunableOp_Half_TN,tn_57344_63_8192,Gemm_Rocblas_621286468,0.302412
GemmTunableOp_Half_TN,tn_10240_2289_8192,Gemm_Hipblaslt_TN_9182,0.65445
GemmTunableOp_Half_TN,tn_8192_60_28672,Gemm_Rocblas_621286489,0.142376
GemmTunableOp_Half_TN,tn_57344_2225_8192,Gemm_Hipblaslt_TN_9827,4.0099
GemmTunableOp_Half_TN,tn_8192_2161_8192,Gemm_Hipblaslt_TN_9742,0.502939
GemmTunableOp_Half_TN,tn_8192_67_8192,Gemm_Hipblaslt_TN_8197,0.043165
GemmTunableOp_Half_TN,tn_10240_2465_8192,Gemm_Hipblaslt_TN_9697,0.691508
GemmTunableOp_Half_TN,tn_57344_2208_8192,Gemm_Hipblaslt_TN_156,3.98475
GemmTunableOp_Half_TN,tn_10240_2397_8192,Gemm_Hipblaslt_TN_9209,0.667954
GemmTunableOp_Half_TN,tn_32000_59_8192,Gemm_Hipblaslt_TN_9463,0.158254
GemmTunableOp_Half_TN,tn_10240_2239_8192,Gemm_Hipblaslt_TN_9182,0.632384
GemmTunableOp_Half_TN,tn_8192_2192_28672,Gemm_Hipblaslt_TN_9762,2.07256
GemmTunableOp_Half_TN,tn_10240_2178_8192,Gemm_Rocblas_621294320,0.630343
GemmTunableOp_Half_TN,tn_10240_67_8192,Gemm_Hipblaslt_TN_9304,0.0500344
GemmTunableOp_Half_TN,tn_8192_2191_28672,Gemm_Hipblaslt_TN_9762,2.06635
GemmTunableOp_Half_TN,tn_8192_4081_28672,Gemm_Rocblas_621286915,3.43132
GemmTunableOp_Half_TN,tn_57344_4050_8192,Gemm_Hipblaslt_TN_9882,6.62516
GemmTunableOp_Half_TN,tn_57344_4000_8192,Gemm_Hipblaslt_TN_9936,6.59964
GemmTunableOp_Half_TN,tn_10240_4000_8192,Gemm_Hipblaslt_TN_9814,1.09501
GemmTunableOp_Half_TN,tn_57344_2081_8192,Gemm_Hipblaslt_TN_9847,3.93582
GemmTunableOp_Half_TN,tn_8192_2415_8192,Gemm_Hipblaslt_TN_9263,0.552096
GemmTunableOp_Half_TN,tn_8192_59_8192,Gemm_Hipblaslt_TN_7484,0.0392806
GemmTunableOp_Half_TN,tn_10240_2127_8192,Gemm_Hipblaslt_TN_9209,0.625205
GemmTunableOp_Half_TN,tn_57344_68_8192,Gemm_Rocblas_621294520,0.322669
GemmTunableOp_Half_TN,tn_57344_4033_8192,Gemm_Rocblas_621294648,6.63011
GemmTunableOp_Half_TN,tn_10240_2305_8192,Gemm_Hipblaslt_TN_9182,0.655602
GemmTunableOp_Half_TN,tn_57344_2385_8192,Default,4.32417
GemmStridedBatchedTunableOp_Half_TN,tn_2289_2289_128_B_64,Gemm_Rocblas_621294106,0.422266
GemmStridedBatchedTunableOp_Half_TN,tn_2128_2128_128_B_64,Gemm_Hipblaslt_TN_158,0.333041
GemmStridedBatchedTunableOp_Half_TN,tn_2160_2160_128_B_64,Gemm_Hipblaslt_TN_158,0.341052
GemmStridedBatchedTunableOp_Half_TN,tn_2048_2048_128_B_64,Gemm_Hipblaslt_TN_9831,0.275534
GemmStridedBatchedTunableOp_Half_TN,tn_2413_2413_128_B_64,Gemm_Rocblas_621294106,0.468755
GemmStridedBatchedTunableOp_Half_TN,tn_2129_2129_128_B_64,Gemm_Rocblas_621294106,0.369288
GemmStridedBatchedTunableOp_Half_TN,tn_2145_2145_128_B_64,Gemm_Rocblas_621294106,0.377735
GemmStridedBatchedTunableOp_Half_TN,tn_2337_2337_128_B_64,Gemm_Rocblas_621294106,0.451306
GemmStridedBatchedTunableOp_Half_TN,tn_2369_2369_128_B_64,Gemm_Rocblas_621294106,0.457108
GemmStridedBatchedTunableOp_Half_TN,tn_2081_2081_128_B_64,Gemm_Rocblas_621294106,0.353937
GemmStridedBatchedTunableOp_Half_TN,tn_2415_2415_128_B_64,Gemm_Rocblas_621294106,0.473109
GemmStridedBatchedTunableOp_Half_TN,tn_2050_2050_128_B_64,Gemm_Rocblas_621294106,0.339615
GemmStridedBatchedTunableOp_Half_TN,tn_2397_2397_128_B_64,Gemm_Rocblas_621294106,0.464024
GemmTunableOp_Half_TN,tn_8192_2549_28672,Gemm_Hipblaslt_TN_9774,2.31884
GemmTunableOp_Half_TN,tn_10240_2692_8192,Gemm_Hipblaslt_TN_9743,0.758443
GemmTunableOp_Half_TN,tn_8192_3331_8192,Gemm_Hipblaslt_TN_9677,0.734268
GemmTunableOp_Half_TN,tn_57344_1248_8192,Gemm_Hipblaslt_TN_9827,2.33103
GemmTunableOp_Half_TN,tn_10240_1276_8192,Gemm_Hipblaslt_TN_9192,0.356102
GemmTunableOp_Half_TN,tn_10240_1296_8192,Gemm_Hipblaslt_TN_9192,0.3568
GemmTunableOp_Half_TN,tn_57344_3451_8192,Gemm_Hipblaslt_TN_159,5.73401
GemmTunableOp_Half_TN,tn_57344_23_8192,Gemm_Rocblas_621294578,0.268479
GemmTunableOp_Half_TN,tn_57344_3162_8192,Gemm_Hipblaslt_TN_9816,5.5009
GemmTunableOp_Half_TN,tn_8192_1121_8192,Gemm_Hipblaslt_TN_9229,0.262821
GemmTunableOp_Half_TN,tn_10240_1168_8192,Gemm_Hipblaslt_TN_9697,0.341102
GemmTunableOp_Half_TN,tn_10240_1268_8192,Gemm_Hipblaslt_TN_9189,0.355923
GemmTunableOp_Half_TN,tn_8192_1208_28672,Gemm_Hipblaslt_TN_9774,1.17469
GemmTunableOp_Half_TN,tn_8192_1208_8192,Gemm_Hipblaslt_TN_9691,0.29671
GemmTunableOp_Half_TN,tn_8192_126_28672,Gemm_Hipblaslt_TN_8378,0.204925
GemmTunableOp_Half_TN,tn_10240_3187_8192,Gemm_Hipblaslt_TN_9815,0.870756
GemmTunableOp_Half_TN,tn_8192_3451_28672,Gemm_Hipblaslt_TN_9732,2.94287
GemmTunableOp_Half_TN,tn_8192_3546_28672,Gemm_Hipblaslt_TN_9732,3.01
GemmTunableOp_Half_TN,tn_57344_1168_8192,Gemm_Hipblaslt_TN_9841,2.27633
GemmTunableOp_Half_TN,tn_57344_1268_8192,Gemm_Hipblaslt_TN_9827,2.33358
GemmTunableOp_Half_TN,tn_32000_24_8192,Gemm_Rocblas_621294578,0.152288
GemmTunableOp_Half_TN,tn_10240_3642_8192,Gemm_Hipblaslt_TN_9743,1.03281
GemmTunableOp_Half_TN,tn_32000_95_8192,Gemm_Rocblas_621294212,0.196245
GemmTunableOp_Half_TN,tn_10240_3140_8192,Gemm_Hipblaslt_TN_9753,0.868955
GemmTunableOp_Half_TN,tn_10240_13_8192,Gemm_Hipblaslt_TN_9411,0.0371058
GemmTunableOp_Half_TN,tn_8192_99_28672,Gemm_Hipblaslt_TN_8378,0.197652
GemmTunableOp_Half_TN,tn_10240_2859_8192,Gemm_Hipblaslt_TN_9743,0.777435
GemmTunableOp_Half_TN,tn_57344_112_8192,Default,0.34593
GemmTunableOp_Half_TN,tn_10240_3747_8192,Gemm_Hipblaslt_TN_9763,1.05241
GemmTunableOp_Half_TN,tn_57344_2274_8192,Default,3.96841
GemmTunableOp_Half_TN,tn_8192_1321_28672,Gemm_Hipblaslt_TN_9774,1.1957
GemmTunableOp_Half_TN,tn_57344_1112_8192,Gemm_Hipblaslt_TN_9774,2.04581
GemmTunableOp_Half_TN,tn_8192_3400_28672,Gemm_Hipblaslt_TN_9732,2.93481
GemmTunableOp_Half_TN,tn_57344_3626_8192,Gemm_Hipblaslt_TN_9908,6.33591
GemmTunableOp_Half_TN,tn_8192_3754_28672,Gemm_Rocblas_621286968,3.25835
GemmTunableOp_Half_TN,tn_8192_3425_28672,Gemm_Hipblaslt_TN_9732,2.92925
GemmTunableOp_Half_TN,tn_8192_103_28672,Gemm_Hipblaslt_TN_8378,0.194709
GemmTunableOp_Half_TN,tn_57344_22_8192,Gemm_Rocblas_621286351,0.266591
GemmTunableOp_Half_TN,tn_8192_96_8192,Gemm_Hipblaslt_TN_7093,0.0470526
GemmTunableOp_Half_TN,tn_8192_3859_8192,Gemm_Rocblas_621294435,0.842184
GemmTunableOp_Half_TN,tn_10240_2962_8192,Gemm_Hipblaslt_TN_9655,0.827294
GemmTunableOp_Half_TN,tn_8192_1281_8192,Gemm_Rocblas_621286663,0.308435
GemmTunableOp_Half_TN,tn_8192_2962_28672,Gemm_Hipblaslt_TN_9687,2.63753
GemmTunableOp_Half_TN,tn_10240_3000_8192,Gemm_Hipblaslt_TN_9815,0.828499
GemmTunableOp_Half_TN,tn_10240_1104_8192,Gemm_Hipblaslt_TN_9209,0.314138
GemmTunableOp_Half_TN,tn_57344_1329_8192,Gemm_Hipblaslt_TN_9827,2.36592
GemmTunableOp_Half_TN,tn_57344_116_8192,Gemm_Rocblas_621294214,0.349142
GemmTunableOp_Half_TN,tn_10240_2664_8192,Gemm_Hipblaslt_TN_9814,0.73296
GemmTunableOp_Half_TN,tn_8192_3290_28672,Gemm_Hipblaslt_TN_9732,2.89039
GemmTunableOp_Half_TN,tn_8192_4035_28672,Gemm_Rocblas_621294658,3.39656
GemmTunableOp_Half_TN,tn_8192_104_8192,Gemm_Hipblaslt_TN_8891,0.0495559
GemmTunableOp_Half_TN,tn_8192_3651_28672,Default,3.21601
GemmTunableOp_Half_TN,tn_8192_119_28672,Gemm_Hipblaslt_TN_8378,0.202443
GemmTunableOp_Half_TN,tn_8192_2551_28672,Gemm_Hipblaslt_TN_9774,2.32503
GemmTunableOp_Half_TN,tn_8192_18_28672,Gemm_Hipblaslt_TN_9420,0.133786
GemmTunableOp_Half_TN,tn_8192_130_28672,Gemm_Hipblaslt_TN_7251,0.215241
GemmTunableOp_Half_TN,tn_10240_3203_8192,Gemm_Hipblaslt_TN_9223,0.875816
GemmTunableOp_Half_TN,tn_8192_1025_8192,Gemm_Hipblaslt_TN_9229,0.257024
GemmTunableOp_Half_TN,tn_10240_2041_8192,Gemm_Rocblas_621286569,0.597484
GemmTunableOp_Half_TN,tn_57344_3475_8192,Gemm_Hipblaslt_TN_159,5.79135
GemmTunableOp_Half_TN,tn_32000_256_8192,Gemm_Rocblas_621286625,0.320923
GemmTunableOp_Half_TN,tn_8192_3274_28672,Gemm_Hipblaslt_TN_9732,2.86637
GemmTunableOp_Half_TN,tn_10240_1248_8192,Gemm_Hipblaslt_TN_9697,0.352335
GemmTunableOp_Half_TN,tn_57344_2032_8192,Gemm_Hipblaslt_TN_9840,3.50425
GemmTunableOp_Half_TN,tn_32000_123_8192,Gemm_Rocblas_621286475,0.216959
GemmTunableOp_Half_TN,tn_32000_110_8192,Gemm_Rocblas_621294212,0.20933
GemmTunableOp_Half_TN,tn_8192_21_8192,Gemm_Hipblaslt_TN_9410,0.0322565
GemmTunableOp_Half_TN,tn_8192_3178_8192,Gemm_Hipblaslt_TN_9697,0.707339
GemmTunableOp_Half_TN,tn_32000_13_8192,Gemm_Rocblas_621294187,0.143521
GemmTunableOp_Half_TN,tn_57344_113_8192,Gemm_Rocblas_621286477,0.34896
GemmTunableOp_Half_TN,tn_10240_4082_8192,Gemm_Hipblaslt_TN_9743,1.12938
GemmTunableOp_Half_TN,tn_8192_1224_28672,Gemm_Hipblaslt_TN_9774,1.19178
GemmTunableOp_Half_TN,tn_8192_1008_8192,Gemm_Hipblaslt_TN_9208,0.246114
GemmTunableOp_Half_TN,tn_57344_2166_8192,Gemm_Hipblaslt_TN_9827,3.98114
GemmTunableOp_Half_TN,tn_8192_2802_28672,Gemm_Rocblas_621286667,2.52995
GemmTunableOp_Half_TN,tn_10240_3785_8192,Gemm_Hipblaslt_TN_9763,1.06008
GemmTunableOp_Half_TN,tn_57344_3400_8192,Gemm_Hipblaslt_TN_9915,5.71726
GemmTunableOp_Half_TN,tn_57344_4091_8192,Gemm_Hipblaslt_TN_9963,6.66673
GemmTunableOp_Half_TN,tn_8192_10_8192,Gemm_Hipblaslt_TN_9392,0.030548
GemmTunableOp_Half_TN,tn_8192_12_8192,Gemm_Hipblaslt_TN_9392,0.0306557
GemmTunableOp_Half_TN,tn_8192_1377_28672,Gemm_Hipblaslt_TN_9799,1.27449
GemmTunableOp_Half_TN,tn_8192_93_8192,Gemm_Hipblaslt_TN_8095,0.0478474
GemmTunableOp_Half_TN,tn_8192_3203_8192,Gemm_Hipblaslt_TN_9697,0.71057
GemmTunableOp_Half_TN,tn_57344_1360_8192,Gemm_Hipblaslt_TN_9830,2.55953
GemmTunableOp_Half_TN,tn_8192_1265_28672,Gemm_Hipblaslt_TN_9774,1.18819
GemmTunableOp_Half_TN,tn_10240_25_8192,Gemm_Hipblaslt_TN_9415,0.0393237
GemmTunableOp_Half_TN,tn_8192_5_8192,Gemm_Hipblaslt_TN_9388,0.0302916
GemmTunableOp_Half_TN,tn_8192_1233_8192,Gemm_Hipblaslt_TN_9209,0.294369
GemmTunableOp_Half_TN,tn_10240_95_8192,Gemm_Hipblaslt_TN_8095,0.0538335
GemmTunableOp_Half_TN,tn_8192_1276_28672,Gemm_Hipblaslt_TN_9774,1.19378
GemmTunableOp_Half_TN,tn_32000_10_8192,Gemm_Rocblas_621294187,0.143563
GemmTunableOp_Half_TN,tn_8192_106_28672,Gemm_Hipblaslt_TN_8378,0.196242
GemmTunableOp_Half_TN,tn_32000_111_8192,Gemm_Rocblas_621286475,0.21054
GemmTunableOp_Half_TN,tn_8192_118_28672,Gemm_Hipblaslt_TN_8378,0.202826
GemmTunableOp_Half_TN,tn_8192_122_28672,Gemm_Hipblaslt_TN_8378,0.204003
GemmTunableOp_Half_TN,tn_8192_98_28672,Gemm_Hipblaslt_TN_8378,0.195837
GemmTunableOp_Half_TN,tn_8192_2664_8192,Gemm_Hipblaslt_TN_9774,0.615346
GemmTunableOp_Half_TN,tn_8192_1264_28672,Gemm_Hipblaslt_TN_9774,1.19638
GemmTunableOp_Half_TN,tn_8192_3347_28672,Gemm_Hipblaslt_TN_9732,2.92155
GemmTunableOp_Half_TN,tn_8192_3626_28672,Gemm_Hipblaslt_TN_9732,3.04195
GemmTunableOp_Half_TN,tn_10240_1264_8192,Gemm_Hipblaslt_TN_9192,0.352176
GemmTunableOp_Half_TN,tn_57344_100_8192,Gemm_Rocblas_621286477,0.334971
GemmTunableOp_Half_TN,tn_8192_13_28672,Gemm_Hipblaslt_TN_9403,0.124631
GemmTunableOp_Half_TN,tn_8192_2032_28672,Gemm_Hipblaslt_TN_9840,1.76647
GemmTunableOp_Half_TN,tn_10240_110_8192,Gemm_Rocblas_621294504,0.0604012
GemmTunableOp_Half_TN,tn_57344_1233_8192,Default,2.31264
GemmTunableOp_Half_TN,tn_32000_7_8192,Gemm_Rocblas_621294578,0.141889
GemmTunableOp_Half_TN,tn_8192_3425_8192,Gemm_Hipblaslt_TN_9677,0.744615
GemmTunableOp_Half_TN,tn_8192_1201_8192,Gemm_Hipblaslt_TN_9799,0.295926
GemmTunableOp_Half_TN,tn_8192_124_28672,Gemm_Hipblaslt_TN_8378,0.206441
GemmTunableOp_Half_TN,tn_8192_1217_28672,Gemm_Hipblaslt_TN_9774,1.16791
GemmTunableOp_Half_TN,tn_10240_1313_8192,Gemm_Hipblaslt_TN_9192,0.359516
GemmTunableOp_Half_TN,tn_32000_107_8192,Gemm_Rocblas_621294212,0.207087
GemmTunableOp_Half_TN,tn_8192_11_28672,Gemm_Hipblaslt_TN_9402,0.126264
GemmTunableOp_Half_TN,tn_8192_17_28672,Gemm_Hipblaslt_TN_9420,0.134108
GemmTunableOp_Half_TN,tn_10240_3139_8192,Gemm_Hipblaslt_TN_9815,0.869715
GemmTunableOp_Half_TN,tn_32000_12_8192,Gemm_Rocblas_621294053,0.14405
GemmTunableOp_Half_TN,tn_57344_3491_8192,Gemm_Hipblaslt_TN_159,5.74514
GemmTunableOp_Half_TN,tn_10240_10_8192,Gemm_Hipblaslt_TN_9411,0.0370998
GemmTunableOp_Half_TN,tn_8192_4082_8192,Gemm_Rocblas_621286693,0.875161
GemmTunableOp_Half_TN,tn_8192_100_28672,Gemm_Hipblaslt_TN_8378,0.197005
GemmTunableOp_Half_TN,tn_8192_96_28672,Gemm_Hipblaslt_TN_8899,0.185306
GemmTunableOp_Half_TN,tn_8192_3283_8192,Gemm_Hipblaslt_TN_9189,0.731967
GemmTunableOp_Half_TN,tn_8192_4025_8192,Gemm_Hipblaslt_TN_9190,0.8654
GemmTunableOp_Half_TN,tn_32000_133_8192,Gemm_Hipblaslt_TN_9506,0.24102
GemmTunableOp_Half_TN,tn_8192_19_28672,Gemm_Hipblaslt_TN_9420,0.135298
GemmTunableOp_Half_TN,tn_8192_3971_28672,Gemm_Rocblas_621294648,3.399
GemmTunableOp_Half_TN,tn_8192_91_28672,Gemm_Hipblaslt_TN_8899,0.183411
GemmTunableOp_Half_TN,tn_8192_1321_8192,Gemm_Hipblaslt_TN_9799,0.312389
GemmTunableOp_Half_TN,tn_10240_125_8192,Gemm_Rocblas_621294504,0.0625832
GemmTunableOp_Half_TN,tn_8192_2866_8192,Gemm_Rocblas_621286683,0.646756
GemmTunableOp_Half_TN,tn_8192_2728_8192,Gemm_Hipblaslt_TN_9691,0.637861
GemmTunableOp_Half_TN,tn_8192_1329_8192,Gemm_Hipblaslt_TN_9697,0.314536
GemmTunableOp_Half_TN,tn_10240_3153_8192,Gemm_Hipblaslt_TN_9753,0.868047
GemmTunableOp_Half_TN,tn_57344_2866_8192,Gemm_Rocblas_621286655,5.05418
GemmTunableOp_Half_TN,tn_8192_3000_28672,Gemm_Hipblaslt_TN_9709,2.64707
GemmTunableOp_Half_TN,tn_57344_4035_8192,Gemm_Rocblas_621294636,6.60932
GemmTunableOp_Half_TN,tn_57344_17_8192,Gemm_Rocblas_621286351,0.267061
GemmTunableOp_Half_TN,tn_57344_3498_8192,Gemm_Hipblaslt_TN_159,5.7811
GemmTunableOp_Half_TN,tn_10240_3283_8192,Gemm_Hipblaslt_TN_9753,0.885053
GemmTunableOp_Half_TN,tn_57344_3178_8192,Gemm_Hipblaslt_TN_9816,5.50631
GemmTunableOp_Half_TN,tn_32000_128_8192,Gemm_Rocblas_621286475,0.21451
GemmTunableOp_Half_TN,tn_10240_133_8192,Gemm_Hipblaslt_TN_9367,0.0674465
GemmTunableOp_Half_TN,tn_8192_3299_8192,Gemm_Hipblaslt_TN_9139,0.733356
GemmTunableOp_Half_TN,tn_8192_4096_8192,Gemm_Hipblaslt_TN_9704,0.883401
GemmTunableOp_Half_TN,tn_8192_1185_28672,Gemm_Hipblaslt_TN_9774,1.16309
GemmTunableOp_Half_TN,tn_57344_124_8192,Default,0.35081
GemmTunableOp_Half_TN,tn_57344_2717_8192,Gemm_Hipblaslt_TN_9871,4.93526
GemmTunableOp_Half_TN,tn_57344_123_8192,Gemm_Rocblas_621286477,0.351796
GemmTunableOp_Half_TN,tn_8192_1329_28672,Gemm_Hipblaslt_TN_9774,1.21137
GemmTunableOp_Half_TN,tn_32000_106_8192,Gemm_Rocblas_621294212,0.207943
GemmTunableOp_Half_TN,tn_10240_2479_8192,Gemm_Hipblaslt_TN_9139,0.693639
GemmTunableOp_Half_TN,tn_32000_103_8192,Gemm_Rocblas_621286475,0.204148
GemmTunableOp_Half_TN,tn_8192_97_28672,Gemm_Hipblaslt_TN_8378,0.19223
GemmTunableOp_Half_TN,tn_8192_1296_28672,Gemm_Hipblaslt_TN_9774,1.21095
GemmTunableOp_Half_TN,tn_8192_131_8192,Gemm_Hipblaslt_TN_7561,0.0593538
GemmTunableOp_Half_TN,tn_8192_114_8192,Gemm_Hipblaslt_TN_8891,0.0511646
GemmTunableOp_Half_TN,tn_57344_19_8192,Gemm_Rocblas_621294194,0.266344
GemmTunableOp_Half_TN,tn_8192_3331_28672,Gemm_Hipblaslt_TN_9732,2.92895
GemmTunableOp_Half_TN,tn_32000_94_8192,Gemm_Rocblas_621286475,0.196265
GemmTunableOp_Half_TN,tn_10240_116_8192,Gemm_Rocblas_621286764,0.0613895
GemmTunableOp_Half_TN,tn_8192_120_28672,Gemm_Hipblaslt_TN_8378,0.203959
GemmTunableOp_Half_TN,tn_8192_3206_8192,Gemm_Hipblaslt_TN_9189,0.709891
GemmTunableOp_Half_TN,tn_57344_1319_8192,Gemm_Hipblaslt_TN_9841,2.36383
GemmTunableOp_Half_TN,tn_10240_3555_8192,Gemm_Hipblaslt_TN_9744,1.01361
GemmTunableOp_Half_TN,tn_8192_1350_8192,Gemm_Hipblaslt_TN_9799,0.316896
GemmTunableOp_Half_TN,tn_8192_3747_8192,Gemm_Rocblas_621294435,0.820837
GemmTunableOp_Half_TN,tn_10240_4091_8192,Gemm_Hipblaslt_TN_9743,1.12087
GemmTunableOp_Half_TN,tn_8192_2866_28672,Gemm_Hipblaslt_TN_9799,2.6049
GemmTunableOp_Half_TN,tn_8192_135_8192,Gemm_Hipblaslt_TN_9306,0.0594544
GemmTunableOp_Half_TN,tn_8192_4090_28672,Gemm_Rocblas_621286915,3.43722
GemmTunableOp_Half_TN,tn_8192_1112_28672,Gemm_Hipblaslt_TN_9762,1.08994
GemmTunableOp_Half_TN,tn_10240_2717_8192,Gemm_Hipblaslt_TN_9743,0.757408
GemmTunableOp_Half_TN,tn_8192_2859_8192,Gemm_Rocblas_621286666,0.648759
GemmTunableOp_Half_TN,tn_57344_115_8192,Gemm_Rocblas_621294214,0.347638
GemmTunableOp_Half_TN,tn_57344_2802_8192,Gemm_Hipblaslt_TN_9666,4.97109
GemmTunableOp_Half_TN,tn_57344_2728_8192,Gemm_Hipblaslt_TN_9733,4.94154
GemmTunableOp_Half_TN,tn_32000_122_8192,Gemm_Rocblas_621286475,0.213711
GemmTunableOp_Half_TN,tn_8192_3491_28672,Gemm_Hipblaslt_TN_9684,2.99291
GemmTunableOp_Half_TN,tn_8192_3187_8192,Gemm_Hipblaslt_TN_9192,0.707875
GemmStridedBatchedTunableOp_Half_TN,tn_1104_1104_128_B_64,Gemm_Rocblas_621294109,0.1029
GemmStridedBatchedTunableOp_Half_TN,tn_1249_1249_128_B_64,Gemm_Hipblaslt_TN_6879,0.134695
GemmStridedBatchedTunableOp_Half_TN,tn_1368_1368_128_B_64,Gemm_Rocblas_621294109,0.150676
GemmStridedBatchedTunableOp_Half_TN,tn_1367_1367_128_B_64,Gemm_Rocblas_621286412,0.158206
GemmStridedBatchedTunableOp_Half_TN,tn_1038_1038_128_B_64,Gemm_Rocblas_621294725,0.101012
GemmStridedBatchedTunableOp_Half_TN,tn_1297_1297_128_B_64,Gemm_Rocblas_621294109,0.148006
GemmStridedBatchedTunableOp_Half_TN,tn_1296_1296_128_B_64,Gemm_Rocblas_621294551,0.137509
GemmStridedBatchedTunableOp_Half_TN,tn_1008_1008_128_B_64,Gemm_Rocblas_621294763,0.0898633
GemmStridedBatchedTunableOp_Half_TN,tn_1128_1128_128_B_64,Gemm_Rocblas_621294725,0.111388
GemmStridedBatchedTunableOp_Half_TN,tn_1009_1009_128_B_64,Gemm_Hipblaslt_TN_6935,0.100063
GemmStridedBatchedTunableOp_Half_TN,tn_1441_1441_128_B_64,Gemm_Rocblas_621286397,0.176501
GemmStridedBatchedTunableOp_Half_TN,tn_16_16_128_B_64,Gemm_Rocblas_621286441,0.00624292
GemmStridedBatchedTunableOp_Half_TN,tn_1350_1350_128_B_64,Gemm_Rocblas_621294109,0.154128
GemmStridedBatchedTunableOp_Half_TN,tn_1064_1064_128_B_64,Gemm_Rocblas_621294106,0.104837
GemmStridedBatchedTunableOp_Half_TN,tn_1076_1076_128_B_64,Gemm_Rocblas_621294725,0.105763
GemmStridedBatchedTunableOp_Half_TN,tn_1256_1256_128_B_64,Gemm_Rocblas_621294106,0.132538
GemmStridedBatchedTunableOp_Half_TN,tn_1392_1392_128_B_64,Gemm_Rocblas_621286412,0.146959
GemmStridedBatchedTunableOp_Half_TN,tn_1010_1010_128_B_64,Gemm_Hipblaslt_TN_6879,0.0968047
GemmStridedBatchedTunableOp_Half_TN,tn_1032_1032_128_B_64,Gemm_Rocblas_621294725,0.100225
GemmStridedBatchedTunableOp_Half_TN,tn_1041_1041_128_B_64,Gemm_Rocblas_621294725,0.103163
GemmStridedBatchedTunableOp_Half_TN,tn_1022_1022_128_B_64,Gemm_Hipblaslt_TN_6879,0.0978995
GemmStridedBatchedTunableOp_Half_TN,tn_1224_1224_128_B_64,Gemm_Rocblas_621294106,0.12797
GemmStridedBatchedTunableOp_Half_TN,tn_1455_1455_128_B_64,Gemm_Rocblas_621294106,0.179208
GemmStridedBatchedTunableOp_Half_TN,tn_1425_1425_128_B_64,Gemm_Rocblas_621286397,0.171056
GemmStridedBatchedTunableOp_Half_TN,tn_1153_1153_128_B_64,Gemm_Hipblaslt_TN_6879,0.122671
GemmStridedBatchedTunableOp_Half_TN,tn_1404_1404_128_B_64,Gemm_Rocblas_621294109,0.162763
GemmTunableOp_Half_TN,tn_4096_8000_2048,Gemm_Rocblas_621286281,0.232183
GemmTunableOp_Half_TN,tn_64128_256_4096,Gemm_Rocblas_621286905,0.296158
GemmTunableOp_Half_TN,tn_4096_8192_2048,Gemm_Rocblas_621286281,0.232991
GemmTunableOp_Half_TN,tn_4096_256_7168,Gemm_Rocblas_621294230,0.042949
GemmStridedBatchedTunableOp_Half_TN,tn_1000_1000_128_B_16,Gemm_Rocblas_621293994,0.0251432
Validator,PT_VERSION,2.4.0
Validator,ROCM_VERSION,6.1.0.0-82-5fabb4c
Validator,HIPBLASLT_VERSION,0.7.0-1549b021
Validator,GCN_ARCH_NAME,gfx942:sramecc+:xnack-
Validator,ROCBLAS_VERSION,4.1.0-cefa4a9b-dirty
GemmTunableOp_Half_TN,tn_14336_1600_4096,Gemm_Rocblas_621294426,0.319751
GemmTunableOp_Half_TN,tn_4096_1717_7168,Gemm_Hipblaslt_TN_9265,0.184618
GemmTunableOp_Half_TN,tn_3072_1789_4096,Gemm_Rocblas_621286778,0.0906555
GemmTunableOp_Half_TN,tn_4096_1916_7168,Gemm_Hipblaslt_TN_9645,0.208419
GemmTunableOp_Half_TN,tn_4096_3688_2048,Gemm_Rocblas_621286281,0.111001
GemmTunableOp_Half_TN,tn_4096_6761_2048,Gemm_Hipblaslt_TN_9743,0.200224
GemmTunableOp_Half_TN,tn_3072_1794_4096,Gemm_Rocblas_621294520,0.0908009
GemmTunableOp_Half_TN,tn_14336_3920_4096,Gemm_Hipblaslt_TN_9192,0.753054
GemmTunableOp_Half_TN,tn_4096_1731_7168,Gemm_Hipblaslt_TN_9673,0.195857
GemmTunableOp_Half_TN,tn_4096_3710_7168,Gemm_Hipblaslt_TN_9217,0.35933
GemmTunableOp_Half_TN,tn_4096_3214_2048,Gemm_Hipblaslt_TN_9139,0.0990112
GemmTunableOp_Half_TN,tn_4096_3588_2048,Gemm_Hipblaslt_TN_9896,0.10306
GemmTunableOp_Half_TN,tn_4096_5052_2048,Gemm_Hipblaslt_TN_9690,0.163922
GemmTunableOp_Half_TN,tn_3072_1608_4096,Gemm_Rocblas_621286778,0.0865475
GemmTunableOp_Half_TN,tn_3072_1946_4096,Gemm_Hipblaslt_TN_9633,0.0976436
GemmTunableOp_Half_TN,tn_4096_1691_7168,Gemm_Hipblaslt_TN_9265,0.183889
GemmTunableOp_Half_TN,tn_4096_160_7168,Gemm_Rocblas_621294230,0.0371704
GemmTunableOp_Half_TN,tn_4096_3651_7168,Gemm_Hipblaslt_TN_9223,0.355298
GemmTunableOp_Half_TN,tn_14336_3300_4096,Gemm_Rocblas_621294484,0.627752
GemmTunableOp_Half_TN,tn_3072_1813_4096,Gemm_Rocblas_621286778,0.0913717
GemmTunableOp_Half_TN,tn_4096_1603_7168,Gemm_Hipblaslt_TN_9359,0.181274
GemmTunableOp_Half_TN,tn_14336_3592_4096,Gemm_Hipblaslt_TN_9697,0.72392
GemmTunableOp_Half_TN,tn_3072_3369_4096,Gemm_Rocblas_621294495,0.151121
GemmTunableOp_Half_TN,tn_3072_3511_4096,Gemm_Rocblas_621286753,0.155277
GemmTunableOp_Half_TN,tn_4096_1815_7168,Gemm_Hipblaslt_TN_9137,0.202053
GemmTunableOp_Half_TN,tn_3072_1977_4096,Gemm_Hipblaslt_TN_9587,0.100805
GemmTunableOp_Half_TN,tn_4096_1774_2048,Gemm_Hipblaslt_TN_9329,0.0618364
GemmTunableOp_Half_TN,tn_3072_1609_4096,Gemm_Rocblas_621294520,0.0859581
GemmTunableOp_Half_TN,tn_4096_1652_7168,Gemm_Hipblaslt_TN_9587,0.181677
GemmTunableOp_Half_TN,tn_3072_1652_4096,Gemm_Hipblaslt_TN_9561,0.0863447
GemmTunableOp_Half_TN,tn_14336_1622_4096,Gemm_Hipblaslt_TN_9139,0.352826
GemmTunableOp_Half_TN,tn_4096_7579_7168,Gemm_Hipblaslt_TN_9904,0.717813
GemmTunableOp_Half_TN,tn_4096_1928_2048,Gemm_Hipblaslt_TN_9590,0.0644411
GemmTunableOp_Half_TN,tn_14336_1815_4096,Gemm_Hipblaslt_TN_9697,0.367791
GemmTunableOp_Half_TN,tn_14336_7138_4096,Gemm_Hipblaslt_TN_9890,1.3164
GemmTunableOp_Half_TN,tn_4096_6841_7168,Gemm_Hipblaslt_TN_9694,0.65836
GemmTunableOp_Half_TN,tn_4096_1860_7168,Gemm_Hipblaslt_TN_9645,0.205401
GemmTunableOp_Half_TN,tn_14336_1652_4096,Gemm_Hipblaslt_TN_9697,0.350709
GemmTunableOp_Half_TN,tn_4096_3645_7168,Gemm_Hipblaslt_TN_9695,0.342909
GemmTunableOp_Half_TN,tn_4096_1887_2048,Gemm_Hipblaslt_TN_9590,0.063706
GemmTunableOp_Half_TN,tn_14336_7240_4096,Gemm_Hipblaslt_TN_9189,1.37912
GemmTunableOp_Half_TN,tn_14336_1601_4096,Gemm_Hipblaslt_TN_9697,0.347964
GemmTunableOp_Half_TN,tn_3072_3450_4096,Gemm_Hipblaslt_TN_9629,0.152973
GemmTunableOp_Half_TN,tn_14336_1586_4096,Gemm_Rocblas_621286684,0.324439
GemmTunableOp_Half_TN,tn_4096_3597_2048,Gemm_Hipblaslt_TN_9683,0.103294
GemmTunableOp_Half_TN,tn_14336_5357_4096,Gemm_Hipblaslt_TN_9220,1.02868
GemmTunableOp_Half_TN,tn_4096_6979_2048,Gemm_Hipblaslt_TN_9696,0.204712
GemmTunableOp_Half_TN,tn_4096_1647_2048,Gemm_Hipblaslt_TN_9164,0.0566714
GemmTunableOp_Half_TN,tn_14336_1710_4096,Gemm_Hipblaslt_TN_9697,0.354643
GemmTunableOp_Half_TN,tn_4096_1931_2048,Gemm_Hipblaslt_TN_9620,0.0654426
GemmTunableOp_Half_TN,tn_4096_3300_7168,Gemm_Hipblaslt_TN_9187,0.326489
GemmTunableOp_Half_TN,tn_4096_3722_2048,Gemm_Hipblaslt_TN_9827,0.111117
GemmTunableOp_Half_TN,tn_14336_7104_4096,Gemm_Hipblaslt_TN_159,1.30849
GemmTunableOp_Half_TN,tn_4096_1710_2048,Gemm_Hipblaslt_TN_9616,0.0586272
GemmTunableOp_Half_TN,tn_4096_1784_2048,Gemm_Hipblaslt_TN_9329,0.0619717
GemmTunableOp_Half_TN,tn_4096_7171_2048,Gemm_Hipblaslt_TN_9814,0.207418
GemmTunableOp_Half_TN,tn_4096_1866_2048,Gemm_Hipblaslt_TN_9590,0.0640457
GemmTunableOp_Half_TN,tn_4096_3592_7168,Gemm_Hipblaslt_TN_9743,0.342726
GemmTunableOp_Half_TN,tn_4096_6997_2048,Gemm_Hipblaslt_TN_9221,0.204947
GemmTunableOp_Half_TN,tn_4096_3574_2048,Gemm_Hipblaslt_TN_9896,0.10452
GemmTunableOp_Half_TN,tn_3072_1651_4096,Gemm_Hipblaslt_TN_9561,0.0884213
GemmTunableOp_Half_TN,tn_14336_5125_4096,Gemm_Hipblaslt_TN_9192,0.969834
GemmTunableOp_Half_TN,tn_4096_1798_7168,Gemm_Hipblaslt_TN_9680,0.202029
GemmTunableOp_Half_TN,tn_4096_1607_2048,Gemm_Hipblaslt_TN_9607,0.0557794
GemmTunableOp_Half_TN,tn_14336_5570_4096,Gemm_Hipblaslt_TN_9223,1.0587
GemmTunableOp_Half_TN,tn_4096_1633_2048,Gemm_Hipblaslt_TN_9607,0.0561432
GemmTunableOp_Half_TN,tn_4096_5495_7168,Gemm_Hipblaslt_TN_9672,0.555906
GemmTunableOp_Half_TN,tn_4096_1739_7168,Gemm_Hipblaslt_TN_9673,0.193757
GemmTunableOp_Half_TN,tn_4096_1660_7168,Gemm_Hipblaslt_TN_9265,0.183663
GemmTunableOp_Half_TN,tn_14336_1928_4096,Gemm_Hipblaslt_TN_9217,0.393573
GemmTunableOp_Half_TN,tn_4096_1888_7168,Gemm_Hipblaslt_TN_9645,0.206231
GemmTunableOp_Half_TN,tn_4096_1637_7168,Gemm_Hipblaslt_TN_9610,0.181117
GemmTunableOp_Half_TN,tn_4096_1898_2048,Gemm_Hipblaslt_TN_9590,0.0643582
GemmTunableOp_Half_TN,tn_3072_3383_4096,Gemm_Hipblaslt_TN_9619,0.152766
GemmTunableOp_Half_TN,tn_4096_6761_7168,Gemm_Rocblas_621294476,0.651571
GemmTunableOp_Half_TN,tn_14336_3478_4096,Gemm_Hipblaslt_TN_9217,0.645833
GemmTunableOp_Half_TN,tn_14336_1647_4096,Gemm_Hipblaslt_TN_9139,0.350562
GemmTunableOp_Half_TN,tn_3072_88_4096,Gemm_Rocblas_621294027,0.0139036
GemmTunableOp_Half_TN,tn_3072_7196_4096,Gemm_Hipblaslt_TN_9681,0.311358
GemmTunableOp_Half_TN,tn_4096_7552_7168,Gemm_Hipblaslt_TN_9853,0.716021
GemmTunableOp_Half_TN,tn_4096_6902_7168,Gemm_Hipblaslt_TN_9955,0.66535
GemmTunableOp_Half_TN,tn_14336_1933_4096,Gemm_Hipblaslt_TN_9223,0.394118
GemmTunableOp_Half_TN,tn_4096_224_2048,Gemm_Rocblas_621286443,0.014323
GemmTunableOp_Half_TN,tn_4096_6952_2048,Gemm_Hipblaslt_TN_9814,0.201901
GemmTunableOp_Half_TN,tn_14336_6773_4096,Gemm_Hipblaslt_TN_9220,1.29341
GemmTunableOp_Half_TN,tn_3072_7253_4096,Gemm_Hipblaslt_TN_9681,0.307089
GemmTunableOp_Half_TN,tn_4096_7386_7168,Gemm_Hipblaslt_TN_9749,0.707281
GemmTunableOp_Half_TN,tn_14336_5442_4096,Gemm_Rocblas_621294492,1.05771
GemmTunableOp_Half_TN,tn_3072_1592_4096,Gemm_Hipblaslt_TN_9561,0.0847457
GemmTunableOp_Half_TN,tn_3072_6976_4096,Gemm_Hipblaslt_TN_9619,0.303307
GemmTunableOp_Half_TN,tn_14336_6989_4096,Gemm_Hipblaslt_TN_159,1.2914
GemmTunableOp_Half_TN,tn_4096_1884_2048,Gemm_Hipblaslt_TN_9590,0.0651374
GemmTunableOp_Half_TN,tn_4096_8192_7168,Gemm_Rocblas_621294420,0.74721
GemmTunableOp_Half_TN,tn_4096_1698_7168,Gemm_Hipblaslt_TN_9265,0.184234
GemmTunableOp_Half_TN,tn_4096_3438_2048,Gemm_Hipblaslt_TN_9896,0.0998092
GemmTunableOp_Half_TN,tn_14336_5267_4096,Gemm_Hipblaslt_TN_159,1.01355
GemmTunableOp_Half_TN,tn_14336_6901_4096,Gemm_Hipblaslt_TN_9217,1.31236
GemmTunableOp_Half_TN,tn_4096_7190_7168,Gemm_Hipblaslt_TN_9694,0.679464
GemmTunableOp_Half_TN,tn_4096_5277_2048,Gemm_Hipblaslt_TN_9690,0.167808
GemmTunableOp_Half_TN,tn_3072_5541_4096,Gemm_Hipblaslt_TN_9725,0.223179
GemmTunableOp_Half_TN,tn_3072_7120_4096,Gemm_Hipblaslt_TN_9681,0.308969
GemmTunableOp_Half_TN,tn_3072_7475_4096,Gemm_Rocblas_621294473,0.329876
GemmTunableOp_Half_TN,tn_4096_1615_2048,Gemm_Hipblaslt_TN_9164,0.0562957
GemmTunableOp_Half_TN,tn_14336_7262_4096,Gemm_Hipblaslt_TN_9684,1.38564
GemmTunableOp_Half_TN,tn_4096_7033_7168,Gemm_Hipblaslt_TN_9694,0.665105
GemmTunableOp_Half_TN,tn_14336_3401_4096,Gemm_Hipblaslt_TN_9217,0.640628
GemmTunableOp_Half_TN,tn_3072_1810_4096,Gemm_Rocblas_621294520,0.0910026
GemmTunableOp_Half_TN,tn_4096_1981_7168,Gemm_Hipblaslt_TN_9267,0.209649
GemmTunableOp_Half_TN,tn_4096_8_2048,Gemm_Rocblas_621286307,0.0060194
GemmTunableOp_Half_TN,tn_3072_3748_4096,Gemm_Hipblaslt_TN_9852,0.16375
GemmTunableOp_Half_TN,tn_4096_6708_7168,Gemm_Hipblaslt_TN_9692,0.653714
GemmTunableOp_Half_TN,tn_14336_112_4096,Gemm_Rocblas_621286494,0.0400933
GemmTunableOp_Half_TN,tn_4096_1810_7168,Gemm_Hipblaslt_TN_9268,0.202869
GemmTunableOp_Half_TN,tn_64128_84_4096,Gemm_Hipblaslt_TN_9057,0.183104
GemmTunableOp_Half_TN,tn_4096_1822_2048,Gemm_Hipblaslt_TN_9134,0.0629681
GemmTunableOp_Half_TN,tn_4096_5570_2048,Gemm_Hipblaslt_TN_9799,0.17096
GemmTunableOp_Half_TN,tn_64128_256_4096,Gemm_Rocblas_621286905,0.283421
GemmTunableOp_Half_TN,tn_4096_1934_2048,Gemm_Hipblaslt_TN_9329,0.0657062
GemmTunableOp_Half_TN,tn_4096_1813_2048,Gemm_Hipblaslt_TN_9645,0.0619511
GemmTunableOp_Half_TN,tn_3072_1853_4096,Gemm_Hipblaslt_TN_9148,0.0928543
GemmTunableOp_Half_TN,tn_3072_6761_4096,Gemm_Hipblaslt_TN_9681,0.29683
GemmTunableOp_Half_TN,tn_3072_1599_4096,Gemm_Hipblaslt_TN_9561,0.0855755
GemmTunableOp_Half_TN,tn_64128_93_4096,Gemm_Hipblaslt_TN_9057,0.184342
GemmTunableOp_Half_TN,tn_4096_1931_7168,Gemm_Hipblaslt_TN_9645,0.210074
GemmTunableOp_Half_TN,tn_3072_1780_4096,Gemm_Rocblas_621286778,0.0910961
GemmTunableOp_Half_TN,tn_4096_192_2048,Gemm_Rocblas_621294175,0.0128336
GemmTunableOp_Half_TN,tn_14336_1825_4096,Gemm_Hipblaslt_TN_9187,0.366996
GemmTunableOp_Half_TN,tn_4096_3514_7168,Gemm_Hipblaslt_TN_9189,0.338619
GemmTunableOp_Half_TN,tn_3072_7109_4096,Gemm_Hipblaslt_TN_9681,0.307329
GemmTunableOp_Half_TN,tn_14336_224_4096,Gemm_Hipblaslt_TN_9634,0.0657005
GemmTunableOp_Half_TN,tn_14336_3564_4096,Gemm_Hipblaslt_TN_9220,0.657587
GemmTunableOp_Half_TN,tn_14336_248_4096,Gemm_Hipblaslt_TN_9634,0.0679023
GemmTunableOp_Half_TN,tn_64128_234_4096,Gemm_Rocblas_621286915,0.286209
GemmTunableOp_Half_TN,tn_4096_136_7168,Gemm_Hipblaslt_TN_9127,0.0345446
GemmTunableOp_Half_TN,tn_4096_8192_2048,Gemm_Hipblaslt_TN_9753,0.232977
GemmTunableOp_Half_TN,tn_64128_16_4096,Gemm_Rocblas_621286348,0.145288
GemmTunableOp_Half_TN,tn_4096_7248_2048,Gemm_Hipblaslt_TN_9743,0.208751
GemmTunableOp_Half_TN,tn_3072_200_4096,Gemm_Rocblas_621294168,0.0221091
GemmTunableOp_Half_TN,tn_14336_1683_4096,Gemm_Hipblaslt_TN_9697,0.352925
GemmTunableOp_Half_TN,tn_3072_7345_4096,Gemm_Hipblaslt_TN_9622,0.325367
GemmTunableOp_Half_TN,tn_14336_5530_4096,Gemm_Hipblaslt_TN_9217,1.06171
GemmTunableOp_Half_TN,tn_64128_219_4096,Gemm_Hipblaslt_TN_9226,0.271368
GemmTunableOp_Half_TN,tn_3072_6870_4096,Gemm_Hipblaslt_TN_9619,0.297317
GemmTunableOp_Half_TN,tn_4096_1711_7168,Gemm_Hipblaslt_TN_9265,0.1844
GemmTunableOp_Half_TN,tn_4096_7139_7168,Gemm_Hipblaslt_TN_9743,0.669259
GemmTunableOp_Half_TN,tn_14336_1625_4096,Gemm_Hipblaslt_TN_9189,0.350932
GemmTunableOp_Half_TN,tn_14336_1801_4096,Gemm_Hipblaslt_TN_9697,0.366711
GemmTunableOp_Half_TN,tn_14336_7327_4096,Gemm_Hipblaslt_TN_9900,1.41723
GemmTunableOp_Half_TN,tn_14336_1708_4096,Gemm_Hipblaslt_TN_9697,0.354692
GemmTunableOp_Half_TN,tn_4096_5605_7168,Gemm_Hipblaslt_TN_9689,0.558271
GemmTunableOp_Half_TN,tn_4096_1762_2048,Gemm_Hipblaslt_TN_9329,0.062473
GemmTunableOp_Half_TN,tn_64128_31_4096,Gemm_Rocblas_621286348,0.149611
GemmTunableOp_Half_TN,tn_3072_1600_4096,Gemm_Hipblaslt_TN_9561,0.0844797
GemmTunableOp_Half_TN,tn_64128_231_4096,Gemm_Rocblas_621286901,0.289729
GemmTunableOp_Half_TN,tn_4096_5319_7168,Gemm_Rocblas_621286580,0.543116
GemmTunableOp_Half_TN,tn_4096_1884_7168,Gemm_Hipblaslt_TN_9645,0.206714
GemmTunableOp_Half_TN,tn_14336_1702_4096,Gemm_Hipblaslt_TN_9677,0.353592
GemmTunableOp_Half_TN,tn_14336_6868_4096,Gemm_Rocblas_621294492,1.30258
GemmTunableOp_Half_TN,tn_14336_5413_4096,Gemm_Rocblas_621294492,1.0372
GemmTunableOp_Half_TN,tn_14336_5285_4096,Gemm_Hipblaslt_TN_159,1.01704
GemmTunableOp_Half_TN,tn_14336_1766_4096,Gemm_Hipblaslt_TN_9793,0.35852
GemmTunableOp_Half_TN,tn_3072_3382_4096,Gemm_Hipblaslt_TN_9629,0.151106
GemmTunableOp_Half_TN,tn_3072_3855_4096,Gemm_Hipblaslt_TN_9622,0.168912
GemmTunableOp_Half_TN,tn_3072_1875_4096,Gemm_Hipblaslt_TN_9613,0.0935106
GemmTunableOp_Half_TN,tn_14336_1742_4096,Gemm_Hipblaslt_TN_9697,0.362316
GemmTunableOp_Half_TN,tn_4096_7568_7168,Gemm_Rocblas_621294127,0.716089
GemmTunableOp_Half_TN,tn_3072_3691_4096,Gemm_Hipblaslt_TN_9852,0.164115
GemmTunableOp_Half_TN,tn_64128_230_4096,Gemm_Rocblas_621294658,0.288231
GemmTunableOp_Half_TN,tn_3072_1862_4096,Gemm_Hipblaslt_TN_9613,0.0930219
GemmTunableOp_Half_TN,tn_14336_3382_4096,Gemm_Rocblas_621286742,0.643994
GemmTunableOp_Half_TN,tn_4096_1813_7168,Gemm_Hipblaslt_TN_9680,0.20289
GemmTunableOp_Half_TN,tn_64128_207_4096,Gemm_Hipblaslt_TN_9260,0.271694
GemmTunableOp_Half_TN,tn_4096_1805_7168,Gemm_Hipblaslt_TN_9645,0.201498
GemmTunableOp_Half_TN,tn_3072_1774_4096,Gemm_Rocblas_621286778,0.0912991
GemmTunableOp_Half_TN,tn_3072_3630_4096,Gemm_Hipblaslt_TN_9570,0.158755
GemmTunableOp_Half_TN,tn_3072_1733_4096,Gemm_Hipblaslt_TN_9163,0.0898647
GemmTunableOp_Half_TN,tn_4096_6860_7168,Gemm_Hipblaslt_TN_9694,0.657892
GemmTunableOp_Half_TN,tn_4096_3578_7168,Gemm_Hipblaslt_TN_9732,0.338965
GemmTunableOp_Half_TN,tn_3072_3581_4096,Gemm_Hipblaslt_TN_9570,0.157332
GemmTunableOp_Half_TN,tn_3072_1627_4096,Gemm_Rocblas_621294520,0.0866462
GemmTunableOp_Half_TN,tn_4096_1682_2048,Gemm_Hipblaslt_TN_9164,0.0566987
GemmTunableOp_Half_TN,tn_3072_7327_4096,Gemm_Hipblaslt_TN_9787,0.326038
GemmTunableOp_Half_TN,tn_4096_1748_2048,Gemm_Hipblaslt_TN_9136,0.0616542
GemmTunableOp_Half_TN,tn_4096_144_2048,Gemm_Rocblas_621294175,0.0126124
GemmTunableOp_Half_TN,tn_64128_250_4096,Gemm_Rocblas_621294648,0.295147
GemmTunableOp_Half_TN,tn_4096_1933_7168,Gemm_Hipblaslt_TN_9645,0.210601
GemmTunableOp_Half_TN,tn_3072_1847_4096,Gemm_Hipblaslt_TN_9613,0.0927486
GemmTunableOp_Half_TN,tn_4096_1764_7168,Gemm_Hipblaslt_TN_9645,0.200627
GemmTunableOp_Half_TN,tn_4096_248_2048,Gemm_Rocblas_621286447,0.0147257
GemmTunableOp_Half_TN,tn_64128_237_4096,Gemm_Hipblaslt_TN_9122,0.29276
GemmTunableOp_Half_TN,tn_14336_5735_4096,Gemm_Hipblaslt_TN_159,1.08515
GemmTunableOp_Half_TN,tn_3072_1966_4096,Gemm_Hipblaslt_TN_9633,0.0999287
GemmTunableOp_Half_TN,tn_4096_1757_7168,Gemm_Hipblaslt_TN_9673,0.194941
GemmTunableOp_Half_TN,tn_14336_1824_4096,Gemm_Hipblaslt_TN_9697,0.36694
GemmTunableOp_Half_TN,tn_4096_7253_7168,Gemm_Hipblaslt_TN_9743,0.6801
GemmTunableOp_Half_TN,tn_4096_1745_2048,Gemm_Hipblaslt_TN_9680,0.0620389
GemmTunableOp_Half_TN,tn_4096_1727_7168,Gemm_Hipblaslt_TN_9587,0.18411
GemmTunableOp_Half_TN,tn_14336_88_4096,Gemm_Hipblaslt_TN_9129,0.036332
GemmTunableOp_Half_TN,tn_4096_3501_2048,Gemm_Hipblaslt_TN_9896,0.103363
GemmTunableOp_Half_TN,tn_4096_5427_2048,Gemm_Hipblaslt_TN_9799,0.169354
GemmTunableOp_Half_TN,tn_64128_133_4096,Gemm_Hipblaslt_TN_9108,0.217428
GemmTunableOp_Half_TN,tn_64128_107_4096,Gemm_Hipblaslt_TN_9264,0.198766
GemmTunableOp_Half_TN,tn_4096_3511_2048,Gemm_Hipblaslt_TN_9896,0.103444
GemmTunableOp_Half_TN,tn_64128_215_4096,Gemm_Hipblaslt_TN_9220,0.271512
GemmTunableOp_Half_TN,tn_3072_1830_4096,Gemm_Hipblaslt_TN_9613,0.0928644
GemmTunableOp_Half_TN,tn_64128_27_4096,Gemm_Rocblas_621286348,0.148485
GemmTunableOp_Half_TN,tn_4096_1853_2048,Gemm_Hipblaslt_TN_9590,0.0643979
GemmTunableOp_Half_TN,tn_4096_7130_7168,Gemm_Hipblaslt_TN_9743,0.677381
GemmTunableOp_Half_TN,tn_4096_1766_7168,Gemm_Hipblaslt_TN_9329,0.198727
GemmTunableOp_Half_TN,tn_3072_7730_4096,Gemm_Hipblaslt_TN_9779,0.335337
GemmTunableOp_Half_TN,tn_4096_136_2048,Gemm_Rocblas_621294171,0.0124887
GemmTunableOp_Half_TN,tn_3072_3612_4096,Gemm_Hipblaslt_TN_9619,0.156891
GemmTunableOp_Half_TN,tn_3072_6952_4096,Gemm_Hipblaslt_TN_9619,0.302472
GemmTunableOp_Half_TN,tn_4096_3706_2048,Gemm_Hipblaslt_TN_9898,0.111751
GemmTunableOp_Half_TN,tn_3072_5273_4096,Gemm_Hipblaslt_TN_9904,0.21385
GemmTunableOp_Half_TN,tn_4096_5274_7168,Gemm_Hipblaslt_TN_9799,0.540446
GemmTunableOp_Half_TN,tn_4096_1721_7168,Gemm_Hipblaslt_TN_9266,0.185197
GemmTunableOp_Half_TN,tn_4096_1978_2048,Gemm_Hipblaslt_TN_9645,0.0669177
GemmTunableOp_Half_TN,tn_3072_3420_4096,Gemm_Hipblaslt_TN_9774,0.151005
GemmTunableOp_Half_TN,tn_14336_5052_4096,Gemm_Hipblaslt_TN_9139,0.968696
GemmTunableOp_Half_TN,tn_64128_130_4096,Gemm_Hipblaslt_TN_9108,0.217177
GemmTunableOp_Half_TN,tn_4096_1864_2048,Gemm_Hipblaslt_TN_9136,0.0629127
GemmTunableOp_Half_TN,tn_14336_1590_4096,Gemm_Hipblaslt_TN_9691,0.324892
GemmTunableOp_Half_TN,tn_3072_144_4096,Gemm_Hipblaslt_TN_9443,0.0173235
GemmTunableOp_Half_TN,tn_3072_1909_4096,Gemm_Hipblaslt_TN_9613,0.0944445
GemmTunableOp_Half_TN,tn_4096_1778_2048,Gemm_Hipblaslt_TN_9136,0.0624534
GemmTunableOp_Half_TN,tn_4096_3830_7168,Gemm_Hipblaslt_TN_9220,0.367195
GemmTunableOp_Half_TN,tn_3072_1882_4096,Gemm_Hipblaslt_TN_9611,0.094728
GemmTunableOp_Half_TN,tn_4096_5512_2048,Gemm_Hipblaslt_TN_9709,0.17084
GemmTunableOp_Half_TN,tn_3072_1916_4096,Gemm_Hipblaslt_TN_9561,0.0924296
GemmTunableOp_Half_TN,tn_64128_240_4096,Gemm_Rocblas_621286905,0.294768
GemmTunableOp_Half_TN,tn_3072_3912_4096,Gemm_Rocblas_621286684,0.169923
GemmTunableOp_Half_TN,tn_4096_7730_7168,Gemm_Hipblaslt_TN_9753,0.723961
GemmTunableOp_Half_TN,tn_4096_3557_2048,Gemm_Hipblaslt_TN_9896,0.101198
GemmTunableOp_Half_TN,tn_4096_7067_7168,Gemm_Hipblaslt_TN_9796,0.670283
GemmTunableOp_Half_TN,tn_4096_3780_2048,Gemm_Hipblaslt_TN_9827,0.113239
GemmTunableOp_Half_TN,tn_4096_6976_7168,Gemm_Hipblaslt_TN_9743,0.66817
GemmTunableOp_Half_TN,tn_4096_1963_2048,Gemm_Hipblaslt_TN_9590,0.0660958
GemmTunableOp_Half_TN,tn_14336_6979_4096,Gemm_Hipblaslt_TN_159,1.28684
GemmTunableOp_Half_TN,tn_14336_5390_4096,Gemm_Hipblaslt_TN_9217,1.04694
GemmTunableOp_Half_TN,tn_3072_7138_4096,Gemm_Hipblaslt_TN_9619,0.307685
GemmTunableOp_Half_TN,tn_64128_87_4096,Gemm_Hipblaslt_TN_9058,0.184762
GemmTunableOp_Half_TN,tn_4096_1967_2048,Gemm_Hipblaslt_TN_9329,0.0659473
GemmTunableOp_Half_TN,tn_64128_53_4096,Gemm_Rocblas_621294562,0.164796
GemmTunableOp_Half_TN,tn_3072_1807_4096,Gemm_Rocblas_621294520,0.0918047
GemmTunableOp_Half_TN,tn_3072_5354_4096,Gemm_Hipblaslt_TN_9904,0.214213
GemmTunableOp_Half_TN,tn_64128_216_4096,Gemm_Rocblas_621286797,0.277483
GemmTunableOp_Half_TN,tn_3072_1963_4096,Gemm_Hipblaslt_TN_9633,0.099179
GemmTunableOp_Half_TN,tn_4096_3466_7168,Gemm_Hipblaslt_TN_9187,0.33456
GemmTunableOp_Half_TN,tn_3072_1597_4096,Gemm_Hipblaslt_TN_9561,0.0843261
GemmTunableOp_Half_TN,tn_3072_3688_4096,Gemm_Hipblaslt_TN_9852,0.163328
GemmTunableOp_Half_TN,tn_3072_1969_4096,Gemm_Hipblaslt_TN_9265,0.100465
GemmTunableOp_Half_TN,tn_4096_3309_2048,Gemm_Hipblaslt_TN_9684,0.10105
GemmTunableOp_Half_TN,tn_3072_1855_4096,Gemm_Hipblaslt_TN_9613,0.093374
GemmTunableOp_Half_TN,tn_4096_5271_2048,Gemm_Hipblaslt_TN_9709,0.168053
GemmTunableOp_Half_TN,tn_14336_3475_4096,Gemm_Hipblaslt_TN_9220,0.648371
GemmTunableOp_Half_TN,tn_64128_13_4096,Gemm_Rocblas_621294578,0.144442
GemmTunableOp_Half_TN,tn_4096_6843_7168,Gemm_Hipblaslt_TN_9743,0.663646
GemmTunableOp_Half_TN,tn_14336_1588_4096,Gemm_Hipblaslt_TN_9672,0.324999
GemmTunableOp_Half_TN,tn_4096_1749_7168,Gemm_Hipblaslt_TN_9673,0.194022
GemmTunableOp_Half_TN,tn_4096_1954_7168,Gemm_Hipblaslt_TN_9680,0.209873
GemmTunableOp_Half_TN,tn_3072_1655_4096,Gemm_Hipblaslt_TN_9148,0.0873874
GemmTunableOp_Half_TN,tn_4096_1599_7168,Gemm_Hipblaslt_TN_9587,0.179655
GemmTunableOp_Half_TN,tn_3072_120_4096,Gemm_Rocblas_621286279,0.0153409
GemmTunableOp_Half_TN,tn_64128_144_4096,Gemm_Hipblaslt_TN_9108,0.218225
GemmTunableOp_Half_TN,tn_4096_5125_2048,Gemm_Hipblaslt_TN_9709,0.164769
GemmTunableOp_Half_TN,tn_14336_5089_4096,Gemm_Hipblaslt_TN_9187,0.966381
GemmTunableOp_Half_TN,tn_3072_1625_4096,Gemm_Hipblaslt_TN_9561,0.086431
GemmTunableOp_Half_TN,tn_3072_1663_4096,Gemm_Hipblaslt_TN_9561,0.0876369
GemmTunableOp_Half_TN,tn_14336_3514_4096,Gemm_Hipblaslt_TN_9223,0.651233
GemmTunableOp_Half_TN,tn_4096_5322_2048,Gemm_Hipblaslt_TN_9709,0.167433
GemmTunableOp_Half_TN,tn_3072_1881_4096,Gemm_Hipblaslt_TN_9163,0.093992
GemmTunableOp_Half_TN,tn_4096_3427_2048,Gemm_Hipblaslt_TN_9896,0.10042
GemmTunableOp_Half_TN,tn_3072_1623_4096,Gemm_Rocblas_621294520,0.0860558
GemmTunableOp_Half_TN,tn_4096_3583_7168,Gemm_Hipblaslt_TN_9187,0.339949
GemmTunableOp_Half_TN,tn_14336_3622_4096,Gemm_Hipblaslt_TN_9187,0.726369
GemmTunableOp_Half_TN,tn_64128_80_4096,Gemm_Hipblaslt_TN_9057,0.178277
GemmTunableOp_Half_TN,tn_14336_3582_4096,Gemm_Hipblaslt_TN_9220,0.655511
GemmTunableOp_Half_TN,tn_4096_1727_2048,Gemm_Hipblaslt_TN_9180,0.0570281
GemmTunableOp_Half_TN,tn_64128_97_4096,Gemm_Hipblaslt_TN_9061,0.194512
GemmTunableOp_Half_TN,tn_3072_5390_4096,Gemm_Hipblaslt_TN_9726,0.22059
GemmTunableOp_Half_TN,tn_14336_5100_4096,Gemm_Hipblaslt_TN_9697,0.970541
GemmTunableOp_Half_TN,tn_14336_1931_4096,Gemm_Hipblaslt_TN_9217,0.392756
GemmTunableOp_Half_TN,tn_4096_1820_2048,Gemm_Hipblaslt_TN_9645,0.0623756
GemmTunableOp_Half_TN,tn_4096_3456_7168,Gemm_Rocblas_621286743,0.330766
GemmTunableOp_Half_TN,tn_3072_7023_4096,Gemm_Hipblaslt_TN_9681,0.304503
GemmTunableOp_Half_TN,tn_4096_7262_7168,Gemm_Hipblaslt_TN_9743,0.683801
GemmTunableOp_Half_TN,tn_3072_8192_4096,Gemm_Rocblas_621294467,0.347262
GemmTunableOp_Half_TN,tn_64128_42_4096,Gemm_Rocblas_621294562,0.163447
GemmTunableOp_Half_TN,tn_64128_56_4096,Gemm_Hipblaslt_TN_9097,0.167757
GemmTunableOp_Half_TN,tn_4096_5219_7168,Gemm_Rocblas_621286574,0.538344
GemmTunableOp_Half_TN,tn_4096_3400_2048,Gemm_Hipblaslt_TN_9896,0.102197
GemmTunableOp_Half_TN,tn_3072_3920_4096,Gemm_Hipblaslt_TN_9799,0.169998
GemmTunableOp_Half_TN,tn_14336_1648_4096,Gemm_Hipblaslt_TN_9677,0.347533
GemmTunableOp_Half_TN,tn_4096_6871_7168,Gemm_Hipblaslt_TN_9694,0.657773
GemmTunableOp_Half_TN,tn_4096_4096_5504,Gemm_Rocblas_621286281,0.301911
GemmTunableOp_Half_TN,tn_3072_1636_4096,Gemm_Hipblaslt_TN_9561,0.0863859
GemmTunableOp_Half_TN,tn_3072_3410_4096,Gemm_Hipblaslt_TN_9681,0.150782
GemmTunableOp_Half_TN,tn_4096_7077_2048,Gemm_Hipblaslt_TN_9694,0.205831
GemmTunableOp_Half_TN,tn_4096_3791_7168,Gemm_Hipblaslt_TN_9827,0.36226
GemmTunableOp_Half_TN,tn_4096_5196_2048,Gemm_Hipblaslt_TN_9672,0.165511
GemmTunableOp_Half_TN,tn_14336_6860_4096,Gemm_Hipblaslt_TN_9749,1.31075
GemmTunableOp_Half_TN,tn_4096_6630_7168,Gemm_Hipblaslt_TN_9743,0.65135
GemmTunableOp_Half_TN,tn_3072_3588_4096,Gemm_Hipblaslt_TN_9619,0.157202
GemmTunableOp_Half_TN,tn_4096_1852_2048,Gemm_Hipblaslt_TN_9590,0.0633132
GemmTunableOp_Half_TN,tn_3072_1896_4096,Gemm_Hipblaslt_TN_9611,0.0946607
GemmTunableOp_Half_TN,tn_14336_1945_4096,Gemm_Hipblaslt_TN_9223,0.395108
GemmTunableOp_Half_TN,tn_4096_1647_7168,Gemm_Hipblaslt_TN_9587,0.181752
GemmTunableOp_Half_TN,tn_4096_5442_2048,Gemm_Hipblaslt_TN_9690,0.170087
GemmTunableOp_Half_TN,tn_14336_1767_4096,Gemm_Hipblaslt_TN_9697,0.364814
GemmTunableOp_Half_TN,tn_3072_112_4096,Gemm_Rocblas_621294166,0.0148738
GemmTunableOp_Half_TN,tn_14336_1896_4096,Gemm_Hipblaslt_TN_9697,0.370532
GemmTunableOp_Half_TN,tn_14336_1620_4096,Gemm_Hipblaslt_TN_9187,0.351545
GemmTunableOp_Half_TN,tn_4096_1699_7168,Gemm_Hipblaslt_TN_9265,0.183886
GemmTunableOp_Half_TN,tn_3072_3592_4096,Gemm_Hipblaslt_TN_9570,0.15633
GemmTunableOp_Half_TN,tn_4096_5436_7168,Gemm_Hipblaslt_TN_9690,0.548766
GemmTunableOp_Half_TN,tn_64128_203_4096,Gemm_Hipblaslt_TN_9260,0.272815
GemmTunableOp_Half_TN,tn_64128_65_4096,Gemm_Hipblaslt_TN_9057,0.173111
GemmTunableOp_Half_TN,tn_3072_1852_4096,Gemm_Hipblaslt_TN_9613,0.0927939
GemmTunableOp_Half_TN,tn_4096_3666_7168,Gemm_Hipblaslt_TN_9217,0.356311
GemmTunableOp_Half_TN,tn_64128_86_4096,Gemm_Hipblaslt_TN_9057,0.181201
GemmTunableOp_Half_TN,tn_3072_5533_4096,Gemm_Hipblaslt_TN_9726,0.222189
GemmTunableOp_Half_TN,tn_64128_217_4096,Gemm_Hipblaslt_TN_9654,0.272433
GemmTunableOp_Half_TN,tn_64128_114_4096,Gemm_Rocblas_621286258,0.200831
GemmTunableOp_Half_TN,tn_3072_1898_4096,Gemm_Hipblaslt_TN_9148,0.0930812
GemmTunableOp_Half_TN,tn_64128_153_4096,Gemm_Hipblaslt_TN_9108,0.224758
GemmTunableOp_Half_TN,tn_4096_5067_7168,Gemm_Hipblaslt_TN_9681,0.525928
GemmTunableOp_Half_TN,tn_4096_1688_2048,Gemm_Hipblaslt_TN_9164,0.0577334
GemmTunableOp_Half_TN,tn_4096_1745_7168,Gemm_Hipblaslt_TN_9673,0.193903
GemmTunableOp_Half_TN,tn_3072_3455_4096,Gemm_Rocblas_621294495,0.151437
GemmTunableOp_Half_TN,tn_4096_5410_7168,Gemm_Hipblaslt_TN_9691,0.54959
GemmTunableOp_Half_TN,tn_4096_1916_2048,Gemm_Hipblaslt_TN_9590,0.0647885
GemmTunableOp_Half_TN,tn_14336_1733_4096,Gemm_Hipblaslt_TN_9793,0.359584
GemmTunableOp_Half_TN,tn_14336_1713_4096,Gemm_Hipblaslt_TN_9187,0.351944
GemmTunableOp_Half_TN,tn_4096_1877_7168,Gemm_Hipblaslt_TN_9645,0.207229
GemmTunableOp_Half_TN,tn_4096_144_7168,Gemm_Hipblaslt_TN_9298,0.0335225
GemmTunableOp_Half_TN,tn_14336_1822_4096,Gemm_Hipblaslt_TN_9677,0.36659
GemmTunableOp_Half_TN,tn_14336_7096_4096,Gemm_Hipblaslt_TN_159,1.30267
GemmTunableOp_Half_TN,tn_4096_1799_7168,Gemm_Hipblaslt_TN_9134,0.201157
GemmTunableOp_Half_TN,tn_4096_1801_2048,Gemm_Hipblaslt_TN_9137,0.0630899
GemmTunableOp_Half_TN,tn_4096_3219_2048,Gemm_Hipblaslt_TN_9684,0.0983034
GemmTunableOp_Half_TN,tn_4096_1742_7168,Gemm_Hipblaslt_TN_9673,0.194775
GemmTunableOp_Half_TN,tn_14336_6965_4096,Gemm_Hipblaslt_TN_9914,1.30404
GemmTunableOp_Half_TN,tn_64128_197_4096,Gemm_Hipblaslt_TN_9260,0.272933
GemmTunableOp_Half_TN,tn_64128_105_4096,Gemm_Rocblas_621286258,0.198524
GemmTunableOp_Half_TN,tn_3072_1772_4096,Gemm_Hipblaslt_TN_9613,0.0926277
GemmTunableOp_Half_TN,tn_4096_6901_7168,Gemm_Hipblaslt_TN_9694,0.659495
GemmTunableOp_Half_TN,tn_4096_5381_7168,Gemm_Hipblaslt_TN_9690,0.543026
GemmTunableOp_Half_TN,tn_3072_3401_4096,Gemm_Rocblas_621286753,0.150917
GemmTunableOp_Half_TN,tn_4096_5196_7168,Gemm_Hipblaslt_TN_9799,0.535297
GemmTunableOp_Half_TN,tn_14336_8192_4096,Gemm_Hipblaslt_TN_9753,1.53998
GemmTunableOp_Half_TN,tn_14336_7575_4096,Gemm_Rocblas_621294435,1.45605
GemmTunableOp_Half_TN,tn_4096_1665_2048,Gemm_Hipblaslt_TN_9607,0.0576988
GemmTunableOp_Half_TN,tn_4096_3748_7168,Gemm_Hipblaslt_TN_9768,0.36096
GemmTunableOp_Half_TN,tn_6144_4000_4096,Gemm_Rocblas_621294315,0.339748
GemmTunableOp_Half_TN,tn_14336_1966_4096,Gemm_Hipblaslt_TN_9217,0.395637
GemmTunableOp_Half_TN,tn_14336_1829_4096,Gemm_Hipblaslt_TN_9192,0.367548
GemmTunableOp_Half_TN,tn_14336_3773_4096,Gemm_Hipblaslt_TN_9187,0.73801
GemmTunableOp_Half_TN,tn_64128_188_4096,Gemm_Hipblaslt_TN_9956,0.257196
GemmTunableOp_Half_TN,tn_14336_1719_4096,Gemm_Hipblaslt_TN_9697,0.35431
GemmTunableOp_Half_TN,tn_4096_1823_2048,Gemm_Hipblaslt_TN_9590,0.0622546
GemmTunableOp_Half_TN,tn_14336_3600_4096,Gemm_Hipblaslt_TN_9697,0.725092
GemmTunableOp_Half_TN,tn_4096_5530_2048,Gemm_Hipblaslt_TN_9799,0.173033
GemmTunableOp_Half_TN,tn_14336_1957_4096,Gemm_Hipblaslt_TN_9223,0.396607
GemmTunableOp_Half_TN,tn_4096_1888_2048,Gemm_Hipblaslt_TN_9590,0.0655027
GemmTunableOp_Half_TN,tn_14336_1842_4096,Gemm_Hipblaslt_TN_9697,0.368013
GemmTunableOp_Half_TN,tn_4096_5583_7168,Gemm_Hipblaslt_TN_9687,0.55631
GemmTunableOp_Half_TN,tn_4096_5352_2048,Gemm_Hipblaslt_TN_9691,0.169567
GemmTunableOp_Half_TN,tn_4096_1610_7168,Gemm_Hipblaslt_TN_9359,0.181206
GemmTunableOp_Half_TN,tn_3072_3514_4096,Gemm_Rocblas_621286753,0.156471
GemmTunableOp_Half_TN,tn_64128_209_4096,Gemm_Hipblaslt_TN_9654,0.270959
GemmTunableOp_Half_TN,tn_14336_1762_4096,Gemm_Hipblaslt_TN_9192,0.364229
GemmTunableOp_Half_TN,tn_4096_1879_2048,Gemm_Hipblaslt_TN_9590,0.0642
GemmTunableOp_Half_TN,tn_4096_1593_2048,Gemm_Hipblaslt_TN_9587,0.0539779
GemmTunableOp_Half_TN,tn_4096_3855_7168,Gemm_Hipblaslt_TN_9217,0.366198
GemmTunableOp_Half_TN,tn_3072_3640_4096,Gemm_Hipblaslt_TN_9619,0.157846
GemmTunableOp_Half_TN,tn_14336_3682_4096,Gemm_Hipblaslt_TN_9192,0.731331
GemmTunableOp_Half_TN,tn_4096_1882_7168,Gemm_Hipblaslt_TN_9645,0.206582
GemmTunableOp_Half_TN,tn_4096_1717_2048,Gemm_Hipblaslt_TN_9164,0.0584431
GemmTunableOp_Half_TN,tn_4096_1961_2048,Gemm_Hipblaslt_TN_9590,0.0662665
GemmTunableOp_Half_TN,tn_14336_6630_4096,Gemm_Hipblaslt_TN_9827,1.28008
GemmTunableOp_Half_TN,tn_4096_1811_2048,Gemm_Hipblaslt_TN_9137,0.0641547
GemmTunableOp_Half_TN,tn_4096_3373_2048,Gemm_Hipblaslt_TN_9896,0.100398
GemmTunableOp_Half_TN,tn_4096_7108_7168,Gemm_Hipblaslt_TN_9677,0.674259
GemmTunableOp_Half_TN,tn_14336_1970_4096,Gemm_Hipblaslt_TN_9217,0.396099
GemmTunableOp_Half_TN,tn_4096_1847_2048,Gemm_Hipblaslt_TN_9590,0.0622097
GemmTunableOp_Half_TN,tn_3072_1725_4096,Gemm_Rocblas_621286778,0.0877311
GemmTunableOp_Half_TN,tn_4096_1827_7168,Gemm_Hipblaslt_TN_9268,0.201365
GemmTunableOp_Half_TN,tn_4096_1668_2048,Gemm_Hipblaslt_TN_9607,0.0578235
GemmTunableOp_Half_TN,tn_3072_6860_4096,Gemm_Hipblaslt_TN_9619,0.295873
GemmTunableOp_Half_TN,tn_3072_1877_4096,Gemm_Hipblaslt_TN_9324,0.0914837
GemmTunableOp_Half_TN,tn_4096_7050_2048,Gemm_Hipblaslt_TN_9694,0.204892
GemmTunableOp_Half_TN,tn_3072_1769_4096,Gemm_Rocblas_621286778,0.0898227
GemmTunableOp_Half_TN,tn_3072_7575_4096,Gemm_Rocblas_621294473,0.331767
GemmTunableOp_Half_TN,tn_4096_1867_7168,Gemm_Hipblaslt_TN_9680,0.209062
GemmTunableOp_Half_TN,tn_14336_184_4096,Gemm_Hipblaslt_TN_9352,0.0594869
GemmTunableOp_Half_TN,tn_3072_1615_4096,Gemm_Rocblas_621286778,0.0863154
GemmTunableOp_Half_TN,tn_14336_5030_4096,Gemm_Hipblaslt_TN_9187,0.964042
GemmTunableOp_Half_TN,tn_64128_221_4096,Gemm_Hipblaslt_TN_9768,0.275589
GemmTunableOp_Half_TN,tn_4096_3507_7168,Gemm_Hipblaslt_TN_9139,0.336765
GemmTunableOp_Half_TN,tn_14336_1589_4096,Gemm_Hipblaslt_TN_9690,0.325449
GemmTunableOp_Half_TN,tn_3072_1682_4096,Gemm_Hipblaslt_TN_9561,0.0860686
GemmTunableOp_Half_TN,tn_4096_1752_2048,Gemm_Hipblaslt_TN_9680,0.0618224
GemmTunableOp_Half_TN,tn_4096_3597_7168,Gemm_Hipblaslt_TN_9743,0.34431
GemmTunableOp_Half_TN,tn_3072_7262_4096,Gemm_Hipblaslt_TN_9681,0.31073
GemmTunableOp_Half_TN,tn_4096_7206_2048,Gemm_Hipblaslt_TN_9743,0.206381
GemmTunableOp_Half_TN,tn_4096_1628_7168,Gemm_Hipblaslt_TN_9587,0.181569
GemmTunableOp_Half_TN,tn_3072_1706_4096,Gemm_Rocblas_621286778,0.0885884
GemmTunableOp_Half_TN,tn_4096_1858_2048,Gemm_Hipblaslt_TN_9590,0.0631464
GemmTunableOp_Half_TN,tn_3072_7301_4096,Gemm_Hipblaslt_TN_9787,0.326533
GemmTunableOp_Half_TN,tn_4096_3767_2048,Gemm_Hipblaslt_TN_9873,0.112068
GemmTunableOp_Half_TN,tn_4096_5277_7168,Gemm_Hipblaslt_TN_9709,0.537194
GemmTunableOp_Half_TN,tn_3072_1728_4096,Gemm_Hipblaslt_TN_9148,0.088226
GemmTunableOp_Half_TN,tn_4096_1796_2048,Gemm_Hipblaslt_TN_9136,0.0630969
GemmTunableOp_Half_TN,tn_3072_3582_4096,Gemm_Rocblas_621294495,0.156835
GemmTunableOp_Half_TN,tn_4096_5274_2048,Gemm_Hipblaslt_TN_9691,0.167977
GemmTunableOp_Half_TN,tn_3072_5067_4096,Gemm_Hipblaslt_TN_9726,0.213584
GemmTunableOp_Half_TN,tn_3072_1707_4096,Gemm_Hipblaslt_TN_9148,0.086579
GemmTunableOp_Half_TN,tn_14336_3507_4096,Gemm_Hipblaslt_TN_9220,0.650435
GemmTunableOp_Half_TN,tn_4096_3767_7168,Gemm_Hipblaslt_TN_9827,0.359676
GemmTunableOp_Half_TN,tn_4096_7050_7168,Gemm_Hipblaslt_TN_9694,0.672171
GemmTunableOp_Half_TN,tn_4096_1877_2048,Gemm_Hipblaslt_TN_9136,0.0642258
GemmTunableOp_Half_TN,tn_14336_3584_4096,Gemm_Hipblaslt_TN_9223,0.652032
GemmTunableOp_Half_TN,tn_4096_6916_7168,Gemm_Hipblaslt_TN_9743,0.666866
GemmTunableOp_Half_TN,tn_64128_145_4096,Gemm_Hipblaslt_TN_9108,0.219204
GemmTunableOp_Half_TN,tn_14336_6841_4096,Gemm_Rocblas_621294492,1.29853
GemmTunableOp_Half_TN,tn_4096_7730_2048,Gemm_Hipblaslt_TN_9184,0.22558
GemmTunableOp_Half_TN,tn_14336_1633_4096,Gemm_Hipblaslt_TN_9677,0.349907
GemmTunableOp_Half_TN,tn_14336_1794_4096,Gemm_Hipblaslt_TN_9192,0.366086
GemmTunableOp_Half_TN,tn_14336_1977_4096,Gemm_Hipblaslt_TN_9223,0.396543
GemmTunableOp_Half_TN,tn_4096_1605_7168,Gemm_Hipblaslt_TN_9265,0.181447
GemmTunableOp_Half_TN,tn_14336_7109_4096,Gemm_Hipblaslt_TN_159,1.29558
GemmTunableOp_Half_TN,tn_3072_1871_4096,Gemm_Hipblaslt_TN_9133,0.0936416
GemmTunableOp_Half_TN,tn_14336_1597_4096,Gemm_Hipblaslt_TN_9690,0.324537
GemmTunableOp_Half_TN,tn_14336_7118_4096,Gemm_Hipblaslt_TN_9903,1.32027
GemmTunableOp_Half_TN,tn_4096_5068_7168,Gemm_Hipblaslt_TN_9690,0.52441
GemmTunableOp_Half_TN,tn_14336_104_4096,Gemm_Rocblas_621286493,0.0392979
GemmTunableOp_Half_TN,tn_4096_1589_7168,Gemm_Hipblaslt_TN_9265,0.178948
GemmTunableOp_Half_TN,tn_4096_1957_2048,Gemm_Hipblaslt_TN_9590,0.0660279
GemmTunableOp_Half_TN,tn_4096_40_2048,Gemm_Rocblas_621286337,0.00807968
GemmTunableOp_Half_TN,tn_3072_6881_4096,Gemm_Hipblaslt_TN_9681,0.294488
GemmTunableOp_Half_TN,tn_4096_5412_7168,Gemm_Hipblaslt_TN_9672,0.548245
GemmTunableOp_Half_TN,tn_3072_7478_4096,Gemm_Rocblas_621294473,0.329932
GemmTunableOp_Half_TN,tn_3072_7021_4096,Gemm_Hipblaslt_TN_9681,0.304314
GemmTunableOp_Half_TN,tn_3072_1708_4096,Gemm_Rocblas_621294520,0.0881352
GemmTunableOp_Half_TN,tn_14336_3511_4096,Gemm_Hipblaslt_TN_9223,0.65134
GemmTunableOp_Half_TN,tn_4096_1859_2048,Gemm_Hipblaslt_TN_9134,0.0633035
GemmTunableOp_Half_TN,tn_4096_1769_7168,Gemm_Hipblaslt_TN_9329,0.199255
GemmTunableOp_Half_TN,tn_3072_1722_4096,Gemm_Rocblas_621294520,0.08805
GemmTunableOp_Half_TN,tn_4096_1600_2048,Gemm_Hipblaslt_TN_9671,0.0564753
GemmTunableOp_Half_TN,tn_4096_3629_7168,Gemm_Hipblaslt_TN_9814,0.343128
GemmTunableOp_Half_TN,tn_64128_246_4096,Gemm_Hipblaslt_TN_9122,0.293415
GemmTunableOp_Half_TN,tn_3072_160_4096,Gemm_Rocblas_621286437,0.0183839
GemmTunableOp_Half_TN,tn_4096_7023_7168,Gemm_Hipblaslt_TN_9743,0.671078
GemmTunableOp_Half_TN,tn_4096_3369_7168,Gemm_Hipblaslt_TN_9682,0.324714
GemmTunableOp_Half_TN,tn_3072_1908_4096,Gemm_Hipblaslt_TN_9613,0.0958421
GemmTunableOp_Half_TN,tn_4096_152_2048,Gemm_Rocblas_621286443,0.0126703
GemmTunableOp_Half_TN,tn_4096_1902_7168,Gemm_Hipblaslt_TN_9645,0.208066
GemmTunableOp_Half_TN,tn_4096_1680_7168,Gemm_Hipblaslt_TN_9164,0.182047
GemmTunableOp_Half_TN,tn_14336_6715_4096,Gemm_Hipblaslt_TN_159,1.2824
GemmTunableOp_Half_TN,tn_4096_232_2048,Gemm_Rocblas_621286447,0.0145802
GemmTunableOp_Half_TN,tn_3072_7104_4096,Gemm_Hipblaslt_TN_9681,0.305201
GemmTunableOp_Half_TN,tn_14336_40_4096,Gemm_Rocblas_621294230,0.0285467
GemmTunableOp_Half_TN,tn_3072_5301_4096,Gemm_Hipblaslt_TN_9873,0.214241
GemmTunableOp_Half_TN,tn_4096_1691_2048,Gemm_Hipblaslt_TN_9607,0.0566503
GemmTunableOp_Half_TN,tn_4096_6952_7168,Gemm_Hipblaslt_TN_9694,0.666986
GemmTunableOp_Half_TN,tn_4096_7225_7168,Gemm_Hipblaslt_TN_9743,0.684063
GemmTunableOp_Half_TN,tn_3072_1869_4096,Gemm_Hipblaslt_TN_9324,0.0921403
GemmTunableOp_Half_TN,tn_4096_3520_7168,Gemm_Hipblaslt_TN_9189,0.338402
GemmTunableOp_Half_TN,tn_4096_3450_7168,Gemm_Hipblaslt_TN_9743,0.332785
GemmTunableOp_Half_TN,tn_3072_1829_4096,Gemm_Hipblaslt_TN_9324,0.0938245
GemmTunableOp_Half_TN,tn_4096_1608_7168,Gemm_Hipblaslt_TN_9266,0.181932
GemmTunableOp_Half_TN,tn_3072_80_4096,Gemm_Rocblas_621286278,0.0134617
GemmTunableOp_Half_TN,tn_14336_1866_4096,Gemm_Hipblaslt_TN_9697,0.371173
GemmTunableOp_Half_TN,tn_3072_1960_4096,Gemm_Hipblaslt_TN_9587,0.098829
GemmTunableOp_Half_TN,tn_14336_1884_4096,Gemm_Hipblaslt_TN_9187,0.37302
GemmTunableOp_Half_TN,tn_14336_3309_4096,Gemm_Rocblas_621294492,0.62635
GemmTunableOp_Half_TN,tn_4096_3764_2048,Gemm_Hipblaslt_TN_9841,0.112239
GemmTunableOp_Half_TN,tn_4096_5157_7168,Gemm_Hipblaslt_TN_9681,0.531535
GemmTunableOp_Half_TN,tn_4096_1790_2048,Gemm_Hipblaslt_TN_9136,0.0626116
GemmTunableOp_Half_TN,tn_4096_3497_7168,Gemm_Hipblaslt_TN_9697,0.336866
GemmTunableOp_Half_TN,tn_4096_248_7168,Gemm_Hipblaslt_TN_9497,0.0447395
GemmTunableOp_Half_TN,tn_4096_1622_2048,Gemm_Hipblaslt_TN_9616,0.0554038
GemmTunableOp_Half_TN,tn_3072_1684_4096,Gemm_Hipblaslt_TN_9322,0.0889488
GemmTunableOp_Half_TN,tn_3072_96_4096,Gemm_Rocblas_621286279,0.0134541
GemmTunableOp_Half_TN,tn_4096_5239_2048,Gemm_Hipblaslt_TN_9690,0.167612
GemmTunableOp_Half_TN,tn_3072_1796_4096,Gemm_Rocblas_621286778,0.0919234
GemmTunableOp_Half_TN,tn_4096_6800_7168,Gemm_Hipblaslt_TN_9694,0.658113
GemmTunableOp_Half_TN,tn_14336_5271_4096,Gemm_Hipblaslt_TN_159,1.01988
GemmTunableOp_Half_TN,tn_3072_1888_4096,Gemm_Hipblaslt_TN_9324,0.0928082
GemmTunableOp_Half_TN,tn_4096_7364_7168,Gemm_Hipblaslt_TN_9904,0.707782
GemmTunableOp_Half_TN,tn_4096_168_2048,Gemm_Rocblas_621286815,0.0134465
GemmTunableOp_Half_TN,tn_14336_6789_4096,Gemm_Hipblaslt_TN_9815,1.29833
GemmTunableOp_Half_TN,tn_3072_5271_4096,Gemm_Hipblaslt_TN_9850,0.216031
GemmStridedBatchedTunableOp_Half_TN,tn_1958_1958_128_B_16,Gemm_Hipblaslt_TN_6929,0.0845101
GemmStridedBatchedTunableOp_Half_TN,tn_1933_1933_128_B_16,Gemm_Hipblaslt_TN_6929,0.0849057
GemmStridedBatchedTunableOp_Half_TN,tn_1783_1783_128_B_16,Gemm_Hipblaslt_TN_6879,0.0754299
GemmStridedBatchedTunableOp_Half_TN,tn_1678_1678_128_B_16,Gemm_Rocblas_621294110,0.0696472
GemmStridedBatchedTunableOp_Half_TN,tn_1658_1658_128_B_16,Gemm_Hipblaslt_TN_7483,0.0663418
GemmStridedBatchedTunableOp_Half_TN,tn_1605_1605_128_B_16,Gemm_Rocblas_621294635,0.0651857
GemmStridedBatchedTunableOp_Half_TN,tn_1875_1875_128_B_16,Gemm_Hipblaslt_TN_6942,0.0826776
GemmStridedBatchedTunableOp_Half_TN,tn_1927_1927_128_B_16,Gemm_Rocblas_621294533,0.0865418
GemmStridedBatchedTunableOp_Half_TN,tn_1850_1850_128_B_16,Gemm_Hipblaslt_TN_6942,0.0799003
GemmStridedBatchedTunableOp_Half_TN,tn_1926_1926_128_B_16,Gemm_Hipblaslt_TN_6929,0.0844391
GemmStridedBatchedTunableOp_Half_TN,tn_1880_1880_128_B_16,Gemm_Hipblaslt_TN_150,0.077795
GemmStridedBatchedTunableOp_Half_TN,tn_1664_1664_128_B_16,Gemm_Rocblas_621286509,0.050392
GemmStridedBatchedTunableOp_Half_TN,tn_1979_1979_128_B_16,Gemm_Hipblaslt_TN_6867,0.087827
GemmStridedBatchedTunableOp_Half_TN,tn_1960_1960_128_B_16,Gemm_Hipblaslt_TN_150,0.0790339
GemmStridedBatchedTunableOp_Half_TN,tn_1761_1761_128_B_16,Gemm_Rocblas_621294108,0.0735007
GemmStridedBatchedTunableOp_Half_TN,tn_1659_1659_128_B_16,Gemm_Hipblaslt_TN_7483,0.0678121
GemmStridedBatchedTunableOp_Half_TN,tn_1772_1772_128_B_16,Gemm_Rocblas_621286413,0.0740945
GemmStridedBatchedTunableOp_Half_TN,tn_1884_1884_128_B_16,Gemm_Rocblas_621294725,0.0808617
GemmStridedBatchedTunableOp_Half_TN,tn_1689_1689_128_B_16,Gemm_Rocblas_621286413,0.0694295
GemmStridedBatchedTunableOp_Half_TN,tn_1821_1821_128_B_16,Gemm_Hipblaslt_TN_6942,0.0792572
GemmStridedBatchedTunableOp_Half_TN,tn_1977_1977_128_B_16,Gemm_Hipblaslt_TN_6867,0.0858063
GemmStridedBatchedTunableOp_Half_TN,tn_1580_1580_128_B_16,Gemm_Rocblas_621286413,0.0628728
GemmStridedBatchedTunableOp_Half_TN,tn_1809_1809_128_B_16,Gemm_Rocblas_621294110,0.0790134
GemmStridedBatchedTunableOp_Half_TN,tn_1721_1721_128_B_16,Gemm_Rocblas_621294110,0.0698735
GemmStridedBatchedTunableOp_Half_TN,tn_1651_1651_128_B_16,Gemm_Rocblas_621286775,0.0673413
GemmStridedBatchedTunableOp_Half_TN,tn_1857_1857_128_B_16,Gemm_Hipblaslt_TN_6942,0.0803902
GemmStridedBatchedTunableOp_Half_TN,tn_1642_1642_128_B_16,Gemm_Hipblaslt_TN_7483,0.0659339
GemmStridedBatchedTunableOp_Half_TN,tn_1591_1591_128_B_16,Gemm_Hipblaslt_TN_6879,0.0648421
GemmStridedBatchedTunableOp_Half_TN,tn_1729_1729_128_B_16,Gemm_Rocblas_621286413,0.071714
GemmStridedBatchedTunableOp_Half_TN,tn_1767_1767_128_B_16,Gemm_Rocblas_621286775,0.0750103
GemmStridedBatchedTunableOp_Half_TN,tn_1657_1657_128_B_16,Gemm_Rocblas_621294517,0.0674124
GemmStridedBatchedTunableOp_Half_TN,tn_1666_1666_128_B_16,Gemm_Hipblaslt_TN_9508,0.0685524
GemmStridedBatchedTunableOp_Half_TN,tn_1820_1820_128_B_16,Gemm_Rocblas_621286413,0.0776019
GemmStridedBatchedTunableOp_Half_TN,tn_1969_1969_128_B_16,Gemm_Hipblaslt_TN_6857,0.0886132
GemmStridedBatchedTunableOp_Half_TN,tn_1811_1811_128_B_16,Gemm_Rocblas_621294754,0.0788338
GemmStridedBatchedTunableOp_Half_TN,tn_1608_1608_128_B_16,Gemm_Hipblaslt_TN_149,0.062697
GemmStridedBatchedTunableOp_Half_TN,tn_1860_1860_128_B_16,Gemm_Hipblaslt_TN_6942,0.0797475
GemmStridedBatchedTunableOp_Half_TN,tn_1874_1874_128_B_16,Gemm_Hipblaslt_TN_6942,0.080959
GemmStridedBatchedTunableOp_Half_TN,tn_1824_1824_128_B_16,Gemm_Rocblas_621286771,0.0710197
GemmStridedBatchedTunableOp_Half_TN,tn_1984_1984_128_B_16,Gemm_Hipblaslt_TN_150,0.0769252
GemmStridedBatchedTunableOp_Half_TN,tn_1685_1685_128_B_16,Gemm_Rocblas_621294110,0.0702063
GemmStridedBatchedTunableOp_Half_TN,tn_1741_1741_128_B_16,Gemm_Hipblaslt_TN_7483,0.072499
GemmStridedBatchedTunableOp_Half_TN,tn_1898_1898_128_B_16,Gemm_Hipblaslt_TN_6942,0.0816719
GemmStridedBatchedTunableOp_Half_TN,tn_1610_1610_128_B_16,Gemm_Hipblaslt_TN_7483,0.065108
GemmStridedBatchedTunableOp_Half_TN,tn_1950_1950_128_B_16,Gemm_Hipblaslt_TN_6929,0.084992
GemmStridedBatchedTunableOp_Half_TN,tn_2000_2000_128_B_16,Gemm_Hipblaslt_TN_153,0.0776304
GemmStridedBatchedTunableOp_Half_TN,tn_1842_1842_128_B_16,Gemm_Hipblaslt_TN_6942,0.0790398
GemmStridedBatchedTunableOp_Half_TN,tn_1823_1823_128_B_16,Gemm_Hipblaslt_TN_6942,0.078481
GemmStridedBatchedTunableOp_Half_TN,tn_1870_1870_128_B_16,Gemm_Hipblaslt_TN_6942,0.0813518
GemmStridedBatchedTunableOp_Half_TN,tn_1628_1628_128_B_16,Gemm_Rocblas_621294517,0.0655071
GemmStridedBatchedTunableOp_Half_TN,tn_1909_1909_128_B_16,Gemm_Hipblaslt_TN_6942,0.0824798
GemmStridedBatchedTunableOp_Half_TN,tn_1916_1916_128_B_16,Gemm_Hipblaslt_TN_6942,0.081651
GemmStridedBatchedTunableOp_Half_TN,tn_1625_1625_128_B_16,Gemm_Hipblaslt_TN_7483,0.0661623
GemmStridedBatchedTunableOp_Half_TN,tn_1724_1724_128_B_16,Gemm_Rocblas_621286413,0.0702705
GemmStridedBatchedTunableOp_Half_TN,tn_1970_1970_128_B_16,Gemm_Rocblas_621294533,0.086488
GemmStridedBatchedTunableOp_Half_TN,tn_1951_1951_128_B_16,Gemm_Hipblaslt_TN_6867,0.0861823
GemmStridedBatchedTunableOp_Half_TN,tn_1597_1597_128_B_16,Gemm_Rocblas_621294650,0.0653076
GemmStridedBatchedTunableOp_Half_TN,tn_1906_1906_128_B_16,Gemm_Hipblaslt_TN_6942,0.0820257
GemmStridedBatchedTunableOp_Half_TN,tn_1941_1941_128_B_16,Gemm_Hipblaslt_TN_6879,0.0854597
GemmStridedBatchedTunableOp_Half_TN,tn_1750_1750_128_B_16,Gemm_Rocblas_621286413,0.071736
GemmStridedBatchedTunableOp_Half_TN,tn_1753_1753_128_B_16,Gemm_Rocblas_621294517,0.0732975
GemmStridedBatchedTunableOp_Half_TN,tn_1988_1988_128_B_16,Gemm_Hipblaslt_TN_6879,0.0855854
GemmStridedBatchedTunableOp_Half_TN,tn_1837_1837_128_B_16,Gemm_Hipblaslt_TN_7483,0.0812676
GemmStridedBatchedTunableOp_Half_TN,tn_1830_1830_128_B_16,Gemm_Hipblaslt_TN_7483,0.0775985
GemmStridedBatchedTunableOp_Half_TN,tn_1667_1667_128_B_16,Gemm_Rocblas_621286413,0.0688274
GemmStridedBatchedTunableOp_Half_TN,tn_1613_1613_128_B_16,Gemm_Hipblaslt_TN_7483,0.0653474
GemmStridedBatchedTunableOp_Half_TN,tn_1694_1694_128_B_16,Gemm_Rocblas_621286413,0.0678824
GemmStridedBatchedTunableOp_Half_TN,tn_1881_1881_128_B_16,Gemm_Hipblaslt_TN_6942,0.0817784
GemmStridedBatchedTunableOp_Half_TN,tn_1959_1959_128_B_16,Gemm_Hipblaslt_TN_6929,0.0872942
GemmStridedBatchedTunableOp_Half_TN,tn_1697_1697_128_B_16,Gemm_Rocblas_621294754,0.0694065
GemmStridedBatchedTunableOp_Half_TN,tn_1598_1598_128_B_16,Gemm_Hipblaslt_TN_7483,0.0619993
GemmStridedBatchedTunableOp_Half_TN,tn_1854_1854_128_B_16,Gemm_Hipblaslt_TN_6942,0.0798534
GemmStridedBatchedTunableOp_Half_TN,tn_1735_1735_128_B_16,Gemm_Rocblas_621294517,0.0723662
GemmStridedBatchedTunableOp_Half_TN,tn_1887_1887_128_B_16,Gemm_Hipblaslt_TN_6942,0.0816166
GemmStridedBatchedTunableOp_Half_TN,tn_1861_1861_128_B_16,Gemm_Hipblaslt_TN_6942,0.0813175
GemmStridedBatchedTunableOp_Half_TN,tn_1913_1913_128_B_16,Gemm_Hipblaslt_TN_6942,0.0826458
GemmStridedBatchedTunableOp_Half_TN,tn_1692_1692_128_B_16,Gemm_Rocblas_621286413,0.068436
GemmStridedBatchedTunableOp_Half_TN,tn_1886_1886_128_B_16,Gemm_Hipblaslt_TN_6942,0.0816689
GemmStridedBatchedTunableOp_Half_TN,tn_1885_1885_128_B_16,Gemm_Hipblaslt_TN_6942,0.0823144
GemmStridedBatchedTunableOp_Half_TN,tn_1786_1786_128_B_16,Gemm_Rocblas_621294517,0.0753604
GemmStridedBatchedTunableOp_Half_TN,tn_1586_1586_128_B_16,Gemm_Rocblas_621286413,0.0635821
GemmStridedBatchedTunableOp_Half_TN,tn_1691_1691_128_B_16,Gemm_Rocblas_621286413,0.0694565
GemmStridedBatchedTunableOp_Half_TN,tn_1794_1794_128_B_16,Gemm_Rocblas_621294110,0.0771047
GemmStridedBatchedTunableOp_Half_TN,tn_1703_1703_128_B_16,Gemm_Rocblas_621286413,0.0708951
GemmStridedBatchedTunableOp_Half_TN,tn_1662_1662_128_B_16,Gemm_Rocblas_621286775,0.0657757
GemmStridedBatchedTunableOp_Half_TN,tn_1687_1687_128_B_16,Gemm_Rocblas_621294110,0.0688829
GemmStridedBatchedTunableOp_Half_TN,tn_1649_1649_128_B_16,Gemm_Hipblaslt_TN_7483,0.0652867
GemmStridedBatchedTunableOp_Half_TN,tn_1795_1795_128_B_16,Gemm_Rocblas_621294754,0.077478
GemmStridedBatchedTunableOp_Half_TN,tn_1890_1890_128_B_16,Gemm_Hipblaslt_TN_6942,0.0812146
GemmStridedBatchedTunableOp_Half_TN,tn_1756_1756_128_B_16,Gemm_Rocblas_621294109,0.0728212
GemmStridedBatchedTunableOp_Half_TN,tn_1819_1819_128_B_16,Gemm_Hipblaslt_TN_6942,0.0791726
GemmStridedBatchedTunableOp_Half_TN,tn_1737_1737_128_B_16,Gemm_Rocblas_621286413,0.0724003
GemmStridedBatchedTunableOp_Half_TN,tn_1789_1789_128_B_16,Gemm_Hipblaslt_TN_6857,0.0754592
GemmStridedBatchedTunableOp_Half_TN,tn_1631_1631_128_B_16,Gemm_Hipblaslt_TN_7483,0.0662297
GemmStridedBatchedTunableOp_Half_TN,tn_1602_1602_128_B_16,Gemm_Rocblas_621286776,0.0648224
GemmTunableOp_Half_TN,tn_4096_8000_2048,Gemm_Rocblas_621286281,0.232183
GemmTunableOp_Half_TN,tn_64128_256_4096,Gemm_Rocblas_621286905,0.296158
GemmTunableOp_Half_TN,tn_4096_8192_2048,Gemm_Rocblas_621286281,0.232991
GemmTunableOp_Half_TN,tn_4096_256_7168,Gemm_Rocblas_621294230,0.042949
GemmStridedBatchedTunableOp_Half_TN,tn_1000_1000_128_B_16,Gemm_Rocblas_621293994,0.0251432
GemmTunableOp_Half_TN,tn_3072_1731_4096,Gemm_Hipblaslt_TN_9322,0.0908362
GemmTunableOp_Half_TN,tn_4096_6979_7168,Gemm_Hipblaslt_TN_9694,0.67599
GemmTunableOp_Half_TN,tn_4096_5089_2048,Gemm_Hipblaslt_TN_9689,0.166622
GemmTunableOp_Half_TN,tn_64128_122_4096,Gemm_Hipblaslt_TN_9698,0.202112
GemmTunableOp_Half_TN,tn_64128_35_4096,Gemm_Hipblaslt_TN_9097,0.158765
GemmTunableOp_Half_TN,tn_4096_1853_7168,Gemm_Hipblaslt_TN_9136,0.2062
GemmTunableOp_Half_TN,tn_4096_1771_2048,Gemm_Hipblaslt_TN_9136,0.0629878
GemmTunableOp_Half_TN,tn_64128_169_4096,Gemm_Hipblaslt_TN_9862,0.246809
GemmTunableOp_Half_TN,tn_14336_1790_4096,Gemm_Hipblaslt_TN_9697,0.367497
GemmTunableOp_Half_TN,tn_3072_1673_4096,Gemm_Hipblaslt_TN_9561,0.088693
GemmTunableOp_Half_TN,tn_3072_1615_4096,Gemm_Rocblas_621286778,0.0880922
GemmTunableOp_Half_TN,tn_3072_1794_4096,Gemm_Hipblaslt_TN_9322,0.092612
GemmTunableOp_Half_TN,tn_4096_3586_7168,Gemm_Hipblaslt_TN_9692,0.346543
GemmTunableOp_Half_TN,tn_4096_3710_7168,Gemm_Hipblaslt_TN_9768,0.361812
GemmTunableOp_Half_TN,tn_3072_3581_4096,Gemm_Hipblaslt_TN_9774,0.158426
GemmTunableOp_Half_TN,tn_14336_1794_4096,Gemm_Hipblaslt_TN_9697,0.371585
GemmTunableOp_Half_TN,tn_4096_6997_2048,Gemm_Hipblaslt_TN_9692,0.206983
GemmTunableOp_Half_TN,tn_4096_3214_2048,Gemm_Hipblaslt_TN_9684,0.0989628
GemmTunableOp_Half_TN,tn_4096_7196_7168,Gemm_Hipblaslt_TN_9694,0.691022
GemmTunableOp_Half_TN,tn_4096_3768_2048,Gemm_Hipblaslt_TN_9827,0.112605
GemmTunableOp_Half_TN,tn_14336_3645_4096,Gemm_Hipblaslt_TN_9697,0.733851
GemmTunableOp_Half_TN,tn_4096_3645_2048,Gemm_Hipblaslt_TN_9683,0.106525
GemmTunableOp_Half_TN,tn_4096_7730_7168,Gemm_Hipblaslt_TN_9704,0.733997
GemmTunableOp_Half_TN,tn_4096_5125_2048,Gemm_Hipblaslt_TN_9790,0.168053
GemmTunableOp_Half_TN,tn_4096_1931_7168,Gemm_Hipblaslt_TN_9645,0.210858
GemmTunableOp_Half_TN,tn_3072_1813_4096,Gemm_Hipblaslt_TN_9615,0.093247
GemmTunableOp_Half_TN,tn_3072_1608_4096,Gemm_Rocblas_621294520,0.0880909
GemmTunableOp_Half_TN,tn_4096_7579_7168,Gemm_Hipblaslt_TN_9869,0.730321
GemmTunableOp_Half_TN,tn_3072_1946_4096,Gemm_Hipblaslt_TN_9633,0.0985206
GemmTunableOp_Half_TN,tn_4096_1691_7168,Gemm_Hipblaslt_TN_9265,0.186558
GemmTunableOp_Half_TN,tn_4096_160_7168,Gemm_Rocblas_621286440,0.0365094
GemmTunableOp_Half_TN,tn_4096_1637_7168,Gemm_Hipblaslt_TN_9265,0.183371
GemmTunableOp_Half_TN,tn_14336_5223_4096,Gemm_Hipblaslt_TN_9933,1.04671
GemmTunableOp_Half_TN,tn_4096_3651_7168,Gemm_Hipblaslt_TN_9827,0.360142
GemmTunableOp_Half_TN,tn_14336_3300_4096,Gemm_Rocblas_621286678,0.637414
GemmTunableOp_Half_TN,tn_4096_7027_7168,Gemm_Hipblaslt_TN_9743,0.679812
GemmTunableOp_Half_TN,tn_3072_1796_4096,Gemm_Rocblas_621294520,0.0912909
GemmTunableOp_Half_TN,tn_4096_5271_7168,Gemm_Hipblaslt_TN_9691,0.546011
GemmTunableOp_Half_TN,tn_4096_1702_2048,Gemm_Hipblaslt_TN_9588,0.0583238
GemmTunableOp_Half_TN,tn_3072_1896_4096,Gemm_Hipblaslt_TN_9561,0.0936757
GemmTunableOp_Half_TN,tn_4096_1934_2048,Gemm_Hipblaslt_TN_9590,0.0655096
GemmTunableOp_Half_TN,tn_3072_1667_4096,Gemm_Hipblaslt_TN_9613,0.0888404
GemmTunableOp_Half_TN,tn_4096_1607_7168,Gemm_Hipblaslt_TN_9587,0.181297
GemmTunableOp_Half_TN,tn_3072_1622_4096,Gemm_Hipblaslt_TN_9322,0.0878954
GemmTunableOp_Half_TN,tn_3072_1934_4096,Gemm_Hipblaslt_TN_9636,0.0996715
GemmTunableOp_Half_TN,tn_3072_1815_4096,Gemm_Rocblas_621294520,0.0929077
GemmTunableOp_Half_TN,tn_3072_5470_4096,Gemm_Hipblaslt_TN_9726,0.226759
GemmTunableOp_Half_TN,tn_4096_1815_7168,Gemm_Hipblaslt_TN_9136,0.203355
GemmTunableOp_Half_TN,tn_4096_1802_2048,Gemm_Hipblaslt_TN_9590,0.0617186
GemmTunableOp_Half_TN,tn_4096_7096_7168,Gemm_Hipblaslt_TN_9743,0.679156
GemmTunableOp_Half_TN,tn_4096_1708_2048,Gemm_Hipblaslt_TN_9588,0.0585157
GemmTunableOp_Half_TN,tn_4096_1597_2048,Gemm_Hipblaslt_TN_9180,0.0551236
GemmTunableOp_Half_TN,tn_4096_1647_7168,Gemm_Hipblaslt_TN_9265,0.182738
GemmTunableOp_Half_TN,tn_14336_1787_4096,Gemm_Hipblaslt_TN_9793,0.367154
GemmTunableOp_Half_TN,tn_3072_3214_4096,Gemm_Hipblaslt_TN_9570,0.148977
GemmTunableOp_Half_TN,tn_3072_1652_4096,Gemm_Hipblaslt_TN_9561,0.0878586
GemmTunableOp_Half_TN,tn_14336_1767_4096,Gemm_Hipblaslt_TN_9697,0.368968
GemmTunableOp_Half_TN,tn_14336_3526_4096,Gemm_Rocblas_621286693,0.67399
GemmTunableOp_Half_TN,tn_64128_190_4096,Gemm_Hipblaslt_TN_9855,0.253812
GemmTunableOp_Half_TN,tn_4096_1860_7168,Gemm_Hipblaslt_TN_9645,0.206258
GemmTunableOp_Half_TN,tn_14336_1652_4096,Gemm_Hipblaslt_TN_9697,0.354934
GemmTunableOp_Half_TN,tn_4096_7190_7168,Gemm_Hipblaslt_TN_9743,0.688411
GemmTunableOp_Half_TN,tn_14336_6843_4096,Gemm_Hipblaslt_TN_9753,1.33495
GemmTunableOp_Half_TN,tn_4096_1887_2048,Gemm_Hipblaslt_TN_9590,0.0640221
GemmTunableOp_Half_TN,tn_4096_1711_2048,Gemm_Hipblaslt_TN_9588,0.0595514
GemmTunableOp_Half_TN,tn_4096_1767_2048,Gemm_Hipblaslt_TN_9136,0.0622768
GemmTunableOp_Half_TN,tn_4096_1765_2048,Gemm_Hipblaslt_TN_9680,0.062429
GemmTunableOp_Half_TN,tn_4096_1765_7168,Gemm_Hipblaslt_TN_9645,0.199869
GemmTunableOp_Half_TN,tn_4096_3535_7168,Gemm_Hipblaslt_TN_9187,0.343613
GemmTunableOp_Half_TN,tn_14336_1651_4096,Gemm_Hipblaslt_TN_9677,0.355896
GemmTunableOp_Half_TN,tn_3072_5447_4096,Gemm_Hipblaslt_TN_9726,0.226179
GemmTunableOp_Half_TN,tn_4096_1784_7168,Gemm_Hipblaslt_TN_9645,0.201937
GemmTunableOp_Half_TN,tn_4096_1839_7168,Gemm_Hipblaslt_TN_9645,0.206066
GemmTunableOp_Half_TN,tn_3072_1609_4096,Gemm_Rocblas_621286778,0.0879844
GemmTunableOp_Half_TN,tn_4096_1652_7168,Gemm_Hipblaslt_TN_9679,0.183535
GemmTunableOp_Half_TN,tn_14336_1867_4096,Gemm_Hipblaslt_TN_9677,0.375753
GemmTunableOp_Half_TN,tn_4096_7093_2048,Gemm_Hipblaslt_TN_9692,0.209669
GemmTunableOp_Half_TN,tn_64128_18_4096,Gemm_Rocblas_621286348,0.145565
GemmTunableOp_Half_TN,tn_4096_3382_2048,Gemm_Hipblaslt_TN_9896,0.101475
GemmTunableOp_Half_TN,tn_14336_1605_4096,Gemm_Hipblaslt_TN_9677,0.352408
GemmTunableOp_Half_TN,tn_4096_1670_7168,Gemm_Hipblaslt_TN_9671,0.184394
GemmTunableOp_Half_TN,tn_3072_1651_4096,Gemm_Hipblaslt_TN_9561,0.0887032
GemmTunableOp_Half_TN,tn_4096_3855_2048,Gemm_Hipblaslt_TN_9813,0.116612
GemmTunableOp_Half_TN,tn_4096_1857_2048,Gemm_Hipblaslt_TN_9590,0.0630405
GemmTunableOp_Half_TN,tn_3072_1801_4096,Gemm_Rocblas_621286778,0.0919862
GemmTunableOp_Half_TN,tn_4096_1609_7168,Gemm_Hipblaslt_TN_9265,0.182253
GemmTunableOp_Half_TN,tn_3072_3416_4096,Gemm_Hipblaslt_TN_9681,0.154119
GemmTunableOp_Half_TN,tn_14336_1607_4096,Gemm_Hipblaslt_TN_9697,0.354155
GemmTunableOp_Half_TN,tn_4096_3345_7168,Gemm_Hipblaslt_TN_9187,0.332496
GemmTunableOp_Half_TN,tn_4096_5495_7168,Gemm_Hipblaslt_TN_9672,0.560988
GemmTunableOp_Half_TN,tn_3072_3748_4096,Gemm_Hipblaslt_TN_9852,0.164669
GemmTunableOp_Half_TN,tn_4096_168_7168,Gemm_Rocblas_621294171,0.0385744
GemmTunableOp_Half_TN,tn_4096_1889_2048,Gemm_Hipblaslt_TN_9590,0.0650411
GemmTunableOp_Half_TN,tn_4096_1960_7168,Gemm_Hipblaslt_TN_9136,0.212899
GemmTunableOp_Half_TN,tn_4096_1960_2048,Gemm_Hipblaslt_TN_9590,0.066745
GemmTunableOp_Half_TN,tn_4096_3584_2048,Gemm_Hipblaslt_TN_9696,0.105233
GemmTunableOp_Half_TN,tn_64128_200_4096,Gemm_Hipblaslt_TN_9185,0.271041
GemmTunableOp_Half_TN,tn_14336_1618_4096,Gemm_Hipblaslt_TN_9697,0.351717
GemmTunableOp_Half_TN,tn_14336_7182_4096,Gemm_Hipblaslt_TN_9683,1.40724
GemmTunableOp_Half_TN,tn_14336_1647_4096,Gemm_Hipblaslt_TN_9697,0.3562
GemmTunableOp_Half_TN,tn_64128_246_4096,Gemm_Rocblas_621294658,0.286966
GemmTunableOp_Half_TN,tn_4096_5390_2048,Gemm_Hipblaslt_TN_9674,0.172179
GemmTunableOp_Half_TN,tn_14336_6744_4096,Gemm_Hipblaslt_TN_9815,1.32218
GemmTunableOp_Half_TN,tn_4096_3780_2048,Gemm_Hipblaslt_TN_9768,0.113107
GemmTunableOp_Half_TN,tn_4096_6976_7168,Gemm_Hipblaslt_TN_9694,0.676393
GemmTunableOp_Half_TN,tn_3072_7253_4096,Gemm_Hipblaslt_TN_9681,0.314748
GemmTunableOp_Half_TN,tn_4096_7386_7168,Gemm_Hipblaslt_TN_9853,0.716756
GemmTunableOp_Half_TN,tn_4096_1637_2048,Gemm_Hipblaslt_TN_9671,0.056044
GemmTunableOp_Half_TN,tn_3072_6971_4096,Gemm_Hipblaslt_TN_9681,0.307681
GemmTunableOp_Half_TN,tn_14336_6989_4096,Gemm_Hipblaslt_TN_9914,1.33502
GemmTunableOp_Half_TN,tn_4096_8192_7168,Gemm_Rocblas_621286678,0.76715
GemmTunableOp_Half_TN,tn_4096_1698_7168,Gemm_Hipblaslt_TN_9164,0.184974
GemmTunableOp_Half_TN,tn_3072_1739_4096,Gemm_Hipblaslt_TN_9133,0.0913356
GemmTunableOp_Half_TN,tn_4096_6868_2048,Gemm_Hipblaslt_TN_9732,0.205317
GemmTunableOp_Half_TN,tn_4096_7191_7168,Gemm_Hipblaslt_TN_9743,0.695738
GemmTunableOp_Half_TN,tn_4096_5223_2048,Gemm_Hipblaslt_TN_9671,0.168362
GemmTunableOp_Half_TN,tn_4096_5583_2048,Gemm_Hipblaslt_TN_9799,0.172672
GemmTunableOp_Half_TN,tn_14336_56_4096,Gemm_Rocblas_621286443,0.0297108
GemmTunableOp_Half_TN,tn_4096_32_2048,Gemm_Rocblas_621294144,0.00717311
GemmTunableOp_Half_TN,tn_3072_7182_4096,Gemm_Hipblaslt_TN_9681,0.315129
GemmTunableOp_Half_TN,tn_4096_24_2048,Gemm_Rocblas_621286273,0.00718793
GemmTunableOp_Half_TN,tn_64128_158_4096,Gemm_Hipblaslt_TN_9689,0.225057
GemmTunableOp_Half_TN,tn_14336_7439_4096,Gemm_Hipblaslt_TN_9914,1.47136
GemmTunableOp_Half_TN,tn_3072_1703_4096,Gemm_Hipblaslt_TN_9561,0.0898646
GemmTunableOp_Half_TN,tn_4096_3722_2048,Gemm_Hipblaslt_TN_9841,0.112898
GemmTunableOp_Half_TN,tn_4096_6841_2048,Gemm_Hipblaslt_TN_9743,0.203224
GemmTunableOp_Half_TN,tn_14336_16_4096,Gemm_Rocblas_621286317,0.0238372
GemmTunableOp_Half_TN,tn_4096_1665_2048,Gemm_Hipblaslt_TN_9164,0.0577691
GemmTunableOp_Half_TN,tn_4096_1857_7168,Gemm_Hipblaslt_TN_9645,0.205732
GemmTunableOp_Half_TN,tn_14336_1892_4096,Gemm_Hipblaslt_TN_9697,0.373789
GemmTunableOp_Half_TN,tn_4096_7118_7168,Gemm_Hipblaslt_TN_9743,0.683334
GemmTunableOp_Half_TN,tn_4096_7118_2048,Gemm_Hipblaslt_TN_9814,0.210333
GemmTunableOp_Half_TN,tn_3072_72_4096,Gemm_Rocblas_621294177,0.0133395
GemmTunableOp_Half_TN,tn_64128_222_4096,Gemm_Hipblaslt_TN_9185,0.276324
GemmTunableOp_Half_TN,tn_14336_1599_4096,Gemm_Hipblaslt_TN_9690,0.329401
GemmTunableOp_Half_TN,tn_4096_7568_2048,Gemm_Hipblaslt_TN_9815,0.22482
GemmTunableOp_Half_TN,tn_4096_1589_2048,Gemm_Hipblaslt_TN_9164,0.0568991
GemmTunableOp_Half_TN,tn_4096_5223_7168,Gemm_Rocblas_621294314,0.544816
GemmTunableOp_Half_TN,tn_4096_56_2048,Gemm_Rocblas_621286428,0.00797831
GemmTunableOp_Half_TN,tn_14336_5136_4096,Gemm_Hipblaslt_TN_9697,0.999095
GemmTunableOp_Half_TN,tn_14336_64_4096,Gemm_Rocblas_621286816,0.0303978
GemmTunableOp_Half_TN,tn_4096_208_7168,Gemm_Hipblaslt_TN_9497,0.0427744
GemmTunableOp_Half_TN,tn_4096_1739_2048,Gemm_Hipblaslt_TN_9329,0.0619132
GemmTunableOp_Half_TN,tn_4096_1884_2048,Gemm_Hipblaslt_TN_9590,0.0643737
GemmTunableOp_Half_TN,tn_64128_39_4096,Gemm_Hipblaslt_TN_9097,0.157502
GemmTunableOp_Half_TN,tn_4096_5052_7168,Gemm_Hipblaslt_TN_9681,0.532281
GemmTunableOp_Half_TN,tn_4096_1873_2048,Gemm_Hipblaslt_TN_9329,0.0656018
GemmTunableOp_Half_TN,tn_14336_248_4096,Gemm_Hipblaslt_TN_9160,0.0687038
GemmTunableOp_Half_TN,tn_64128_234_4096,Gemm_Rocblas_621286915,0.286961
GemmTunableOp_Half_TN,tn_3072_7475_4096,Gemm_Hipblaslt_TN_9687,0.332522
GemmTunableOp_Half_TN,tn_4096_7301_7168,Gemm_Hipblaslt_TN_9869,0.713489
GemmTunableOp_Half_TN,tn_4096_1787_2048,Gemm_Hipblaslt_TN_9136,0.0624553
GemmTunableOp_Half_TN,tn_14336_7170_4096,Gemm_Hipblaslt_TN_9684,1.40164
GemmTunableOp_Half_TN,tn_4096_1779_7168,Gemm_Hipblaslt_TN_9645,0.200952
GemmTunableOp_Half_TN,tn_3072_200_4096,Gemm_Rocblas_621286443,0.0221787
GemmTunableOp_Half_TN,tn_14336_6902_4096,Gemm_Hipblaslt_TN_9815,1.33054
GemmTunableOp_Half_TN,tn_4096_1615_7168,Gemm_Hipblaslt_TN_9265,0.183671
GemmTunableOp_Half_TN,tn_14336_7120_4096,Gemm_Hipblaslt_TN_9933,1.34778
GemmTunableOp_Half_TN,tn_4096_3468_7168,Gemm_Hipblaslt_TN_9192,0.336549
GemmTunableOp_Half_TN,tn_14336_7432_4096,Gemm_Hipblaslt_TN_9930,1.46767
GemmTunableOp_Half_TN,tn_4096_176_7168,Gemm_Hipblaslt_TN_9470,0.0384394
GemmTunableOp_Half_TN,tn_4096_224_2048,Gemm_Rocblas_621286447,0.0142321
GemmTunableOp_Half_TN,tn_4096_6747_7168,Gemm_Hipblaslt_TN_9677,0.658697
GemmTunableOp_Half_TN,tn_14336_1877_4096,Gemm_Hipblaslt_TN_9697,0.375361
GemmTunableOp_Half_TN,tn_64128_145_4096,Gemm_Hipblaslt_TN_9108,0.22264
GemmTunableOp_Half_TN,tn_4096_144_7168,Gemm_Hipblaslt_TN_8319,0.0365266
GemmTunableOp_Half_TN,tn_3072_3456_4096,Gemm_Rocblas_621286753,0.148614
GemmTunableOp_Half_TN,tn_4096_1733_2048,Gemm_Hipblaslt_TN_9136,0.0620639
GemmTunableOp_Half_TN,tn_14336_3691_4096,Gemm_Hipblaslt_TN_9187,0.746401
GemmTunableOp_Half_TN,tn_14336_3791_4096,Gemm_Hipblaslt_TN_9697,0.750427
GemmTunableOp_Half_TN,tn_14336_1660_4096,Gemm_Hipblaslt_TN_9697,0.355879
GemmTunableOp_Half_TN,tn_64128_7_4096,Gemm_Rocblas_621286348,0.142292
GemmTunableOp_Half_TN,tn_3072_1719_4096,Gemm_Rocblas_621294520,0.0893318
GemmTunableOp_Half_TN,tn_4096_1719_2048,Gemm_Hipblaslt_TN_9610,0.0591575
GemmTunableOp_Half_TN,tn_4096_7327_2048,Gemm_Hipblaslt_TN_9903,0.222965
GemmTunableOp_Half_TN,tn_3072_1760_4096,Gemm_Hipblaslt_TN_9613,0.0909282
GemmTunableOp_Half_TN,tn_14336_3629_4096,Gemm_Hipblaslt_TN_9187,0.734647
GemmTunableOp_Half_TN,tn_4096_1658_7168,Gemm_Hipblaslt_TN_9265,0.184723
GemmTunableOp_Half_TN,tn_4096_1737_2048,Gemm_Hipblaslt_TN_9329,0.0614692
GemmTunableOp_Half_TN,tn_14336_1752_4096,Gemm_Hipblaslt_TN_9189,0.368572
GemmTunableOp_Half_TN,tn_64128_64_4096,Gemm_Hipblaslt_TN_9097,0.162319
GemmTunableOp_Half_TN,tn_3072_1811_4096,Gemm_Rocblas_621286778,0.0918482
GemmTunableOp_Half_TN,tn_4096_1769_2048,Gemm_Hipblaslt_TN_9136,0.0624169
GemmTunableOp_Half_TN,tn_3072_3706_4096,Gemm_Hipblaslt_TN_9852,0.1636
GemmTunableOp_Half_TN,tn_28672_256_8192,Gemm_Hipblaslt_TN_9540,0.291877
GemmTunableOp_Half_TN,tn_4096_1742_7168,Gemm_Hipblaslt_TN_9329,0.198561
GemmTunableOp_Half_TN,tn_4096_6788_7168,Gemm_Hipblaslt_TN_9911,0.664476
GemmTunableOp_Half_TN,tn_4096_3373_2048,Gemm_Hipblaslt_TN_9896,0.102495
GemmTunableOp_Half_TN,tn_14336_3501_4096,Gemm_Hipblaslt_TN_9220,0.666924
GemmTunableOp_Half_TN,tn_3072_6989_4096,Gemm_Hipblaslt_TN_9619,0.311334
GemmTunableOp_Half_TN,tn_14336_3562_4096,Gemm_Rocblas_621286750,0.677819
GemmTunableOp_Half_TN,tn_3072_1648_4096,Gemm_Hipblaslt_TN_9561,0.088798
GemmTunableOp_Half_TN,tn_3072_1820_4096,Gemm_Hipblaslt_TN_9613,0.0936566
GemmTunableOp_Half_TN,tn_14336_1593_4096,Gemm_Hipblaslt_TN_9690,0.328738
GemmTunableOp_Half_TN,tn_4096_1618_2048,Gemm_Hipblaslt_TN_9607,0.056321
GemmTunableOp_Half_TN,tn_14336_1748_4096,Gemm_Hipblaslt_TN_9697,0.368504
GemmTunableOp_Half_TN,tn_14336_3713_4096,Gemm_Hipblaslt_TN_9697,0.745937
GemmTunableOp_Half_TN,tn_14336_6976_4096,Gemm_Hipblaslt_TN_9914,1.33324
GemmTunableOp_Half_TN,tn_3072_88_4096,Gemm_Rocblas_621286280,0.0141403
GemmTunableOp_Half_TN,tn_3072_7196_4096,Gemm_Hipblaslt_TN_9681,0.315934
GemmTunableOp_Half_TN,tn_3072_1933_4096,Gemm_Hipblaslt_TN_9587,0.0996706
GemmTunableOp_Half_TN,tn_3072_1854_4096,Gemm_Hipblaslt_TN_9148,0.093856
GemmTunableOp_Half_TN,tn_4096_7478_2048,Gemm_Hipblaslt_TN_9713,0.225072
GemmTunableOp_Half_TN,tn_3072_56_4096,Gemm_Rocblas_621286421,0.011372
GemmTunableOp_Half_TN,tn_64128_180_4096,Gemm_Hipblaslt_TN_9940,0.252536
GemmTunableOp_Half_TN,tn_4096_1864_7168,Gemm_Hipblaslt_TN_9645,0.206688
GemmTunableOp_Half_TN,tn_4096_5196_2048,Gemm_Hipblaslt_TN_9690,0.169318
GemmTunableOp_Half_TN,tn_4096_5319_2048,Gemm_Hipblaslt_TN_9691,0.170928
GemmTunableOp_Half_TN,tn_14336_6860_4096,Gemm_Hipblaslt_TN_9749,1.33312
GemmTunableOp_Half_TN,tn_4096_1883_7168,Gemm_Hipblaslt_TN_9136,0.209045
GemmTunableOp_Half_TN,tn_14336_7104_4096,Gemm_Hipblaslt_TN_9914,1.34535
GemmTunableOp_Half_TN,tn_14336_1735_4096,Gemm_Hipblaslt_TN_9192,0.364105
GemmTunableOp_Half_TN,tn_3072_1852_4096,Gemm_Hipblaslt_TN_9324,0.0929117
GemmTunableOp_Half_TN,tn_4096_1757_2048,Gemm_Hipblaslt_TN_9329,0.0623656
GemmTunableOp_Half_TN,tn_4096_7182_2048,Gemm_Hipblaslt_TN_9743,0.209319
GemmTunableOp_Half_TN,tn_4096_5273_7168,Gemm_Hipblaslt_TN_9690,0.546022
GemmTunableOp_Half_TN,tn_64128_191_4096,Gemm_Hipblaslt_TN_9694,0.252287
GemmTunableOp_Half_TN,tn_3072_3767_4096,Gemm_Hipblaslt_TN_9852,0.164827
GemmTunableOp_Half_TN,tn_3072_1961_4096,Gemm_Hipblaslt_TN_9633,0.0994585
GemmTunableOp_Half_TN,tn_4096_1815_2048,Gemm_Hipblaslt_TN_9136,0.0633132
GemmTunableOp_Half_TN,tn_4096_3600_2048,Gemm_Hipblaslt_TN_9212,0.103876
GemmTunableOp_Half_TN,tn_14336_1666_4096,Gemm_Hipblaslt_TN_9677,0.356371
GemmTunableOp_Half_TN,tn_14336_1864_4096,Gemm_Hipblaslt_TN_9139,0.376387
GemmTunableOp_Half_TN,tn_64128_53_4096,Gemm_Hipblaslt_TN_9097,0.164522
GemmTunableOp_Half_TN,tn_4096_1935_7168,Gemm_Hipblaslt_TN_9267,0.211489
GemmTunableOp_Half_TN,tn_4096_1867_2048,Gemm_Hipblaslt_TN_9590,0.0649967
GemmTunableOp_Half_TN,tn_14336_1737_4096,Gemm_Hipblaslt_TN_9793,0.368475
GemmTunableOp_Half_TN,tn_3072_3595_4096,Gemm_Hipblaslt_TN_9570,0.160903
GemmTunableOp_Half_TN,tn_4096_1708_7168,Gemm_Hipblaslt_TN_9265,0.185916
GemmTunableOp_Half_TN,tn_3072_7139_4096,Gemm_Hipblaslt_TN_9681,0.313174
GemmTunableOp_Half_TN,tn_64128_176_4096,Gemm_Hipblaslt_TN_9694,0.24926
GemmTunableOp_Half_TN,tn_64128_206_4096,Gemm_Hipblaslt_TN_9185,0.272296
GemmTunableOp_Half_TN,tn_4096_1981_2048,Gemm_Hipblaslt_TN_9590,0.0658797
GemmTunableOp_Half_TN,tn_14336_3565_4096,Gemm_Hipblaslt_TN_9220,0.675094
GemmTunableOp_Half_TN,tn_3072_80_4096,Gemm_Rocblas_621286449,0.0135947
GemmTunableOp_Half_TN,tn_14336_7047_4096,Gemm_Hipblaslt_TN_9914,1.3379
GemmTunableOp_Half_TN,tn_14336_1725_4096,Gemm_Hipblaslt_TN_9697,0.360108
GemmTunableOp_Half_TN,tn_64128_160_4096,Gemm_Hipblaslt_TN_9108,0.221314
GemmTunableOp_Half_TN,tn_4096_1778_2048,Gemm_Hipblaslt_TN_9136,0.0623108
GemmTunableOp_Half_TN,tn_4096_1970_7168,Gemm_Hipblaslt_TN_9267,0.213278
GemmTunableOp_Half_TN,tn_4096_6902_2048,Gemm_Hipblaslt_TN_9796,0.206119
GemmTunableOp_Half_TN,tn_14336_1978_4096,Gemm_Hipblaslt_TN_9217,0.403807
GemmTunableOp_Half_TN,tn_4096_1862_2048,Gemm_Hipblaslt_TN_9590,0.0635199
GemmTunableOp_Half_TN,tn_3072_1889_4096,Gemm_Hipblaslt_TN_9148,0.0939672
GemmTunableOp_Half_TN,tn_14336_7364_4096,Gemm_Hipblaslt_TN_9900,1.45066
GemmTunableOp_Half_TN,tn_64128_204_4096,Gemm_Hipblaslt_TN_9185,0.273332
GemmTunableOp_Half_TN,tn_4096_1829_2048,Gemm_Hipblaslt_TN_9590,0.063967
GemmTunableOp_Half_TN,tn_4096_1652_2048,Gemm_Hipblaslt_TN_9164,0.056468
GemmTunableOp_Half_TN,tn_4096_5136_2048,Gemm_Hipblaslt_TN_9671,0.168342
GemmTunableOp_Half_TN,tn_4096_3441_2048,Gemm_Hipblaslt_TN_9821,0.100713
GemmTunableOp_Half_TN,tn_14336_112_4096,Gemm_Hipblaslt_TN_9521,0.0415681
GemmTunableOp_Half_TN,tn_4096_1663_2048,Gemm_Hipblaslt_TN_9164,0.0570698
GemmTunableOp_Half_TN,tn_5120_4096_8192,Gemm_Hipblaslt_TN_9649,0.595885
GemmTunableOp_Half_TN,tn_4096_7432_7168,Gemm_Hipblaslt_TN_9914,0.722643
GemmTunableOp_Half_TN,tn_4096_1820_2048,Gemm_Hipblaslt_TN_9134,0.063488
GemmTunableOp_Half_TN,tn_64128_197_4096,Gemm_Hipblaslt_TN_9185,0.270838
GemmTunableOp_Half_TN,tn_3072_1924_4096,Gemm_Hipblaslt_TN_9633,0.0980209
GemmTunableOp_Half_TN,tn_3072_3547_4096,Gemm_Rocblas_621286753,0.158045
GemmTunableOp_Half_TN,tn_14336_6708_4096,Gemm_Hipblaslt_TN_9841,1.31016
GemmTunableOp_Half_TN,tn_4096_5067_7168,Gemm_Hipblaslt_TN_9681,0.533363
GemmTunableOp_Half_TN,tn_14336_5541_4096,Gemm_Rocblas_621286590,1.08684
GemmTunableOp_Half_TN,tn_14336_3912_4096,Gemm_Hipblaslt_TN_9697,0.774565
GemmTunableOp_Half_TN,tn_64128_227_4096,Gemm_Rocblas_621294658,0.287207
GemmTunableOp_Half_TN,tn_14336_7325_4096,Gemm_Hipblaslt_TN_9961,1.44513
GemmTunableOp_Half_TN,tn_4096_6721_7168,Gemm_Hipblaslt_TN_9694,0.661585
GemmTunableOp_Half_TN,tn_3072_1618_4096,Gemm_Hipblaslt_TN_9561,0.086075
GemmTunableOp_Half_TN,tn_14336_1667_4096,Gemm_Hipblaslt_TN_9192,0.356425
GemmTunableOp_Half_TN,tn_4096_1781_7168,Gemm_Hipblaslt_TN_9645,0.200249
GemmTunableOp_Half_TN,tn_3072_144_4096,Gemm_Hipblaslt_TN_9443,0.0172085
GemmTunableOp_Half_TN,tn_3072_1957_4096,Gemm_Hipblaslt_TN_9633,0.0990917
GemmTunableOp_Half_TN,tn_4096_1820_7168,Gemm_Hipblaslt_TN_9645,0.205318
GemmTunableOp_Half_TN,tn_14336_8192_4096,Gemm_Rocblas_621294127,1.5761
GemmTunableOp_Half_TN,tn_64128_13_4096,Gemm_Rocblas_621286348,0.144469
GemmTunableOp_Half_TN,tn_4096_1850_2048,Gemm_Hipblaslt_TN_9590,0.0627949
GemmTunableOp_Half_TN,tn_14336_1721_4096,Gemm_Hipblaslt_TN_9697,0.357091
GemmTunableOp_Half_TN,tn_64128_133_4096,Gemm_Hipblaslt_TN_9674,0.220266
GemmTunableOp_Half_TN,tn_64128_107_4096,Gemm_Rocblas_621294762,0.197656
GemmTunableOp_Half_TN,tn_4096_1620_7168,Gemm_Hipblaslt_TN_9587,0.181525
GemmTunableOp_Half_TN,tn_64128_172_4096,Gemm_Hipblaslt_TN_9694,0.249183
GemmTunableOp_Half_TN,tn_14336_5125_4096,Gemm_Hipblaslt_TN_9697,0.992199
GemmTunableOp_Half_TN,tn_4096_1798_7168,Gemm_Hipblaslt_TN_9134,0.203842
GemmTunableOp_Half_TN,tn_4096_3427_7168,Gemm_Hipblaslt_TN_9695,0.334758
GemmTunableOp_Half_TN,tn_4096_5354_7168,Gemm_Hipblaslt_TN_9690,0.550581
GemmTunableOp_Half_TN,tn_4096_1847_7168,Gemm_Hipblaslt_TN_9645,0.205422
GemmTunableOp_Half_TN,tn_4096_3466_7168,Gemm_Hipblaslt_TN_9187,0.336358
GemmTunableOp_Half_TN,tn_3072_3688_4096,Gemm_Hipblaslt_TN_9622,0.164801
GemmTunableOp_Half_TN,tn_4096_56_7168,Gemm_Rocblas_621286419,0.019314
GemmTunableOp_Half_TN,tn_64128_198_4096,Gemm_Hipblaslt_TN_9185,0.269634
GemmTunableOp_Half_TN,tn_3072_1969_4096,Gemm_Hipblaslt_TN_9587,0.100404
GemmTunableOp_Half_TN,tn_64128_218_4096,Gemm_Hipblaslt_TN_9185,0.276952
GemmTunableOp_Half_TN,tn_4096_3441_7168,Gemm_Hipblaslt_TN_9743,0.333131
GemmTunableOp_Half_TN,tn_3072_1978_4096,Gemm_Hipblaslt_TN_9633,0.0989175
GemmTunableOp_Half_TN,tn_4096_3640_7168,Gemm_Hipblaslt_TN_9743,0.347442
GemmTunableOp_Half_TN,tn_4096_5410_2048,Gemm_Hipblaslt_TN_9672,0.171693
GemmTunableOp_Half_TN,tn_4096_1625_7168,Gemm_Hipblaslt_TN_9265,0.182413
GemmTunableOp_Half_TN,tn_14336_3581_4096,Gemm_Hipblaslt_TN_9827,0.678412
GemmTunableOp_Half_TN,tn_14336_7484_4096,Gemm_Rocblas_621294127,1.47551
GemmTunableOp_Half_TN,tn_14336_1691_4096,Gemm_Hipblaslt_TN_9677,0.355873
GemmTunableOp_Half_TN,tn_4096_136_2048,Gemm_Rocblas_621294175,0.0127951
GemmTunableOp_Half_TN,tn_3072_7579_4096,Gemm_Rocblas_621294467,0.336962
GemmTunableOp_Half_TN,tn_4096_1713_7168,Gemm_Hipblaslt_TN_9164,0.18556
GemmTunableOp_Half_TN,tn_14336_5447_4096,Gemm_Hipblaslt_TN_9815,1.07457
GemmTunableOp_Half_TN,tn_3072_152_4096,Gemm_Rocblas_621294166,0.0178258
GemmTunableOp_Half_TN,tn_4096_6744_7168,Gemm_Hipblaslt_TN_9677,0.666796
GemmTunableOp_Half_TN,tn_14336_3388_4096,Gemm_Rocblas_621286590,0.662473
GemmTunableOp_Half_TN,tn_4096_6841_7168,Gemm_Hipblaslt_TN_9955,0.669458
GemmTunableOp_Half_TN,tn_64128_104_4096,Gemm_Hipblaslt_TN_9698,0.196754
GemmTunableOp_Half_TN,tn_4096_5498_2048,Gemm_Hipblaslt_TN_9799,0.172595
GemmTunableOp_Half_TN,tn_4096_1892_7168,Gemm_Hipblaslt_TN_9645,0.209396
GemmTunableOp_Half_TN,tn_4096_1658_2048,Gemm_Hipblaslt_TN_9164,0.0572989
GemmTunableOp_Half_TN,tn_3072_5723_4096,Gemm_Hipblaslt_TN_9624,0.261447
GemmTunableOp_Half_TN,tn_14336_1862_4096,Gemm_Hipblaslt_TN_9697,0.372317
GemmTunableOp_Half_TN,tn_4096_7120_2048,Gemm_Hipblaslt_TN_153,0.207359
GemmTunableOp_Half_TN,tn_14336_1698_4096,Gemm_Hipblaslt_TN_9697,0.357339
GemmTunableOp_Half_TN,tn_64128_69_4096,Gemm_Hipblaslt_TN_9057,0.178093
GemmTunableOp_Half_TN,tn_14336_136_4096,Gemm_Hipblaslt_TN_9312,0.0524072
GemmTunableOp_Half_TN,tn_14336_1839_4096,Gemm_Hipblaslt_TN_9697,0.371613
GemmTunableOp_Half_TN,tn_64128_140_4096,Gemm_Hipblaslt_TN_9674,0.221964
GemmTunableOp_Half_TN,tn_4096_3219_7168,Gemm_Hipblaslt_TN_9695,0.323865
GemmTunableOp_Half_TN,tn_8192_4096_14336,Gemm_Hipblaslt_TN_9756,1.72167
GemmTunableOp_Half_TN,tn_3072_32_4096,Gemm_Rocblas_621294054,0.00931112
GemmTunableOp_Half_TN,tn_4096_1762_2048,Gemm_Hipblaslt_TN_9329,0.0623915
GemmTunableOp_Half_TN,tn_14336_1857_4096,Gemm_Hipblaslt_TN_9697,0.374522
GemmTunableOp_Half_TN,tn_64128_31_4096,Gemm_Rocblas_621286348,0.148657
GemmTunableOp_Half_TN,tn_3072_8192_4096,Gemm_Rocblas_621294473,0.355892
GemmTunableOp_Half_TN,tn_64128_42_4096,Gemm_Hipblaslt_TN_9144,0.158246
GemmTunableOp_Half_TN,tn_4096_5322_7168,Gemm_Hipblaslt_TN_9690,0.548118
GemmTunableOp_Half_TN,tn_64128_56_4096,Gemm_Hipblaslt_TN_9097,0.163557
GemmTunableOp_Half_TN,tn_14336_5605_4096,Gemm_Hipblaslt_TN_9827,1.10644
GemmTunableOp_Half_TN,tn_64128_252_4096,Gemm_Rocblas_621286915,0.290725
GemmTunableOp_Half_TN,tn_4096_5436_2048,Gemm_Hipblaslt_TN_9687,0.170847
GemmTunableOp_Half_TN,tn_4096_1655_7168,Gemm_Hipblaslt_TN_9265,0.183875
GemmTunableOp_Half_TN,tn_4096_1622_2048,Gemm_Hipblaslt_TN_9164,0.0564675
GemmTunableOp_Half_TN,tn_3072_1684_4096,Gemm_Hipblaslt_TN_9163,0.0891648
GemmTunableOp_Half_TN,tn_4096_6920_7168,Gemm_Hipblaslt_TN_9694,0.669769
GemmTunableOp_Half_TN,tn_3072_96_4096,Gemm_Rocblas_621286280,0.0135559
GemmTunableOp_Half_TN,tn_64128_14_4096,Gemm_Rocblas_621286348,0.145167
GemmTunableOp_Half_TN,tn_14336_7023_4096,Gemm_Hipblaslt_TN_9914,1.33308
GemmTunableOp_Half_TN,tn_3072_7340_4096,Gemm_Hipblaslt_TN_9779,0.331404
GemmTunableOp_Half_TN,tn_3072_3781_4096,Gemm_Hipblaslt_TN_9924,0.164891
GemmTunableOp_Half_TN,tn_4096_6715_2048,Gemm_Hipblaslt_TN_9743,0.201894
GemmTunableOp_Half_TN,tn_64128_81_4096,Gemm_Hipblaslt_TN_9058,0.181967
GemmTunableOp_Half_TN,tn_14336_1860_4096,Gemm_Hipblaslt_TN_9697,0.374919
GemmTunableOp_Half_TN,tn_14336_1875_4096,Gemm_Hipblaslt_TN_9697,0.37382
GemmTunableOp_Half_TN,tn_4096_3589_7168,Gemm_Hipblaslt_TN_9694,0.345594
GemmTunableOp_Half_TN,tn_4096_1703_7168,Gemm_Hipblaslt_TN_9265,0.186318
GemmTunableOp_Half_TN,tn_4096_1682_2048,Gemm_Hipblaslt_TN_9164,0.0584598
GemmTunableOp_Half_TN,tn_3072_3475_4096,Gemm_Rocblas_621294495,0.155392
GemmTunableOp_Half_TN,tn_4096_1792_7168,Gemm_Hipblaslt_TN_9645,0.199937
GemmTunableOp_Half_TN,tn_4096_1823_7168,Gemm_Hipblaslt_TN_9645,0.206143
GemmTunableOp_Half_TN,tn_14336_3706_4096,Gemm_Hipblaslt_TN_9187,0.740894
GemmTunableOp_Half_TN,tn_4096_1733_7168,Gemm_Hipblaslt_TN_9673,0.196963
GemmTunableOp_Half_TN,tn_3072_3830_4096,Gemm_Hipblaslt_TN_9852,0.165047
GemmTunableOp_Half_TN,tn_3072_3780_4096,Gemm_Hipblaslt_TN_9852,0.164606
GemmTunableOp_Half_TN,tn_4096_1600_2048,Gemm_Hipblaslt_TN_9607,0.0567209
GemmTunableOp_Half_TN,tn_14336_1954_4096,Gemm_Hipblaslt_TN_9223,0.400361
GemmTunableOp_Half_TN,tn_14336_7301_4096,Gemm_Hipblaslt_TN_9900,1.45008
GemmTunableOp_Half_TN,tn_4096_3404_2048,Gemm_Hipblaslt_TN_9896,0.100534
GemmTunableOp_Half_TN,tn_4096_1590_2048,Gemm_Hipblaslt_TN_9607,0.05575
GemmTunableOp_Half_TN,tn_14336_1597_4096,Gemm_Hipblaslt_TN_9691,0.328165
GemmTunableOp_Half_TN,tn_14336_7118_4096,Gemm_Hipblaslt_TN_9914,1.35053
GemmTunableOp_Half_TN,tn_14336_1589_4096,Gemm_Hipblaslt_TN_9690,0.329205
GemmTunableOp_Half_TN,tn_4096_7345_7168,Gemm_Hipblaslt_TN_9888,0.713954
GemmTunableOp_Half_TN,tn_4096_3748_2048,Gemm_Hipblaslt_TN_9827,0.112979
GemmTunableOp_Half_TN,tn_4096_3588_7168,Gemm_Hipblaslt_TN_9677,0.346178
GemmTunableOp_Half_TN,tn_14336_1614_4096,Gemm_Hipblaslt_TN_9677,0.353778
GemmTunableOp_Half_TN,tn_3072_1790_4096,Gemm_Rocblas_621294520,0.0915806
GemmTunableOp_Half_TN,tn_4096_6630_2048,Gemm_Hipblaslt_TN_9743,0.201658
GemmTunableOp_Half_TN,tn_64128_236_4096,Gemm_Rocblas_621286915,0.288581
GemmTunableOp_Half_TN,tn_4096_3410_7168,Gemm_Hipblaslt_TN_9821,0.333308
GemmTunableOp_Half_TN,tn_3072_3582_4096,Gemm_Rocblas_621286753,0.15805
GemmTunableOp_Half_TN,tn_4096_3388_2048,Gemm_Hipblaslt_TN_9696,0.102512
GemmTunableOp_Half_TN,tn_14336_1946_4096,Gemm_Hipblaslt_TN_9223,0.40277
GemmTunableOp_Half_TN,tn_14336_3455_4096,Gemm_Rocblas_621294484,0.664546
GemmTunableOp_Half_TN,tn_4096_1683_7168,Gemm_Hipblaslt_TN_9265,0.185411
GemmTunableOp_Half_TN,tn_3072_3468_4096,Gemm_Rocblas_621286753,0.156615
GemmTunableOp_Half_TN,tn_14336_1637_4096,Gemm_Hipblaslt_TN_9677,0.357267
GemmTunableOp_Half_TN,tn_3072_5136_4096,Gemm_Rocblas_621294030,0.212847
GemmTunableOp_Half_TN,tn_4096_1973_2048,Gemm_Hipblaslt_TN_9590,0.0668398
GemmTunableOp_Half_TN,tn_64128_89_4096,Gemm_Hipblaslt_TN_9058,0.184686
GemmTunableOp_Half_TN,tn_14336_3547_4096,Gemm_Hipblaslt_TN_9220,0.676152
GemmTunableOp_Half_TN,tn_4096_3622_2048,Gemm_Hipblaslt_TN_9683,0.106596
