Gemm_Tune/Qwen2-7B-Instruct-2000inp/full_tuned1.csv
Validator,PT_VERSION,2.4.0
Validator,ROCM_VERSION,6.1.0.0-82-5fabb4c
Validator,HIPBLASLT_VERSION,0.7.0-1549b021
Validator,GCN_ARCH_NAME,gfx942:sramecc+:xnack-
Validator,ROCBLAS_VERSION,4.1.0-cefa4a9b-dirty
GemmTunableOp_Half_TN,tn_28672_6979_4096,Gemm_Hipblaslt_TN_159,2.75395
GemmTunableOp_Half_TN,tn_4096_3581_14336,Gemm_Hipblaslt_TN_9743,0.674439
GemmTunableOp_Half_TN,tn_28672_1796_4096,Gemm_Hipblaslt_TN_9684,0.777266
GemmTunableOp_Half_TN,tn_4096_5570_4096,Gemm_Hipblaslt_TN_9687,0.328895
GemmTunableOp_Half_TN,tn_28672_1889_4096,Gemm_Hipblaslt_TN_9684,0.781765
GemmTunableOp_Half_TN,tn_4096_1702_4096,Gemm_Hipblaslt_TN_9359,0.106234
GemmTunableOp_Half_TN,tn_4096_3688_14336,Gemm_Rocblas_621286281,0.705327
GemmTunableOp_Half_TN,tn_4096_1789_4096,Gemm_Hipblaslt_TN_9134,0.117358
GemmTunableOp_Half_TN,tn_4096_1708_4096,Gemm_Hipblaslt_TN_9607,0.106873
GemmTunableOp_Half_TN,tn_28672_232_4096,Gemm_Hipblaslt_TN_9372,0.121834
GemmTunableOp_Half_TN,tn_28672_7182_4096,Gemm_Hipblaslt_TN_159,2.80867
GemmTunableOp_Half_TN,tn_4096_1771_4096,Gemm_Hipblaslt_TN_9645,0.116062
GemmTunableOp_Half_TN,tn_4096_5605_4096,Gemm_Hipblaslt_TN_9690,0.33342
GemmTunableOp_Half_TN,tn_28672_1615_4096,Gemm_Rocblas_621294484,0.69313
GemmTunableOp_Half_TN,tn_4096_1794_14336,Gemm_Hipblaslt_TN_9268,0.399628
GemmTunableOp_Half_TN,tn_28672_7439_4096,Gemm_Hipblaslt_TN_159,2.84183
GemmTunableOp_Half_TN,tn_28672_3710_4096,Gemm_Hipblaslt_TN_9827,1.48985
GemmTunableOp_Half_TN,tn_6144_48_4096,Gemm_Rocblas_621294155,0.0157596
GemmTunableOp_Half_TN,tn_4096_3553_4096,Gemm_Hipblaslt_TN_9814,0.197831
GemmTunableOp_Half_TN,tn_28672_256_4096,Gemm_Rocblas_621294324,0.121202
GemmTunableOp_Half_TN,tn_28672_1874_4096,Gemm_Hipblaslt_TN_9684,0.782604
GemmTunableOp_Half_TN,tn_4096_7033_4096,Gemm_Hipblaslt_TN_9743,0.39719
GemmTunableOp_Half_TN,tn_4096_5357_14336,Gemm_Hipblaslt_TN_9799,1.0943
GemmTunableOp_Half_TN,tn_4096_7104_4096,Gemm_Hipblaslt_TN_9814,0.395679
GemmTunableOp_Half_TN,tn_28672_1728_4096,Gemm_Rocblas_621294420,0.711139
GemmTunableOp_Half_TN,tn_28672_1963_4096,Gemm_Hipblaslt_TN_9846,0.82067
GemmTunableOp_Half_TN,tn_4096_3701_4096,Gemm_Hipblaslt_TN_9827,0.207993
GemmTunableOp_Half_TN,tn_4096_1774_14336,Gemm_Hipblaslt_TN_9645,0.394713
GemmTunableOp_Half_TN,tn_128256_133_4096,Gemm_Hipblaslt_TN_9063,0.441305
GemmTunableOp_Half_TN,tn_6144_5680_4096,Gemm_Hipblaslt_TN_9690,0.500823
GemmTunableOp_Half_TN,tn_28672_6916_4096,Gemm_Hipblaslt_TN_9944,2.82077
GemmTunableOp_Half_TN,tn_128256_154_4096,Gemm_Hipblaslt_TN_9108,0.456986
GemmTunableOp_Half_TN,tn_128256_182_4096,Gemm_Hipblaslt_TN_9952,0.498745
GemmTunableOp_Half_TN,tn_128256_145_4096,Gemm_Hipblaslt_TN_9108,0.444544
GemmTunableOp_Half_TN,tn_128256_175_4096,Gemm_Hipblaslt_TN_9752,0.494235
GemmTunableOp_Half_TN,tn_4096_1981_4096,Gemm_Hipblaslt_TN_9134,0.122861
GemmTunableOp_Half_TN,tn_28672_5068_4096,Gemm_Hipblaslt_TN_9849,2.0506
GemmTunableOp_Half_TN,tn_6144_5442_4096,Gemm_Hipblaslt_TN_9704,0.445932
GemmTunableOp_Half_TN,tn_4096_5412_4096,Gemm_Hipblaslt_TN_9687,0.325112
GemmTunableOp_Half_TN,tn_4096_1610_14336,Gemm_Hipblaslt_TN_9671,0.357411
GemmTunableOp_Half_TN,tn_4096_1699_4096,Gemm_Hipblaslt_TN_9671,0.106419
GemmTunableOp_Half_TN,tn_4096_3388_4096,Gemm_Hipblaslt_TN_9743,0.19188
GemmTunableOp_Half_TN,tn_10240_2079_8192,Gemm_Hipblaslt_TN_9209,0.608137
GemmTunableOp_Half_TN,tn_4096_3475_4096,Gemm_Hipblaslt_TN_9743,0.197477
GemmTunableOp_Half_TN,tn_6144_1593_4096,Gemm_Rocblas_621286565,0.14832
GemmTunableOp_Half_TN,tn_4096_6788_14336,Gemm_Hipblaslt_TN_9743,1.36197
GemmTunableOp_Half_TN,tn_28672_1614_4096,Gemm_Rocblas_621286693,0.686728
GemmTunableOp_Half_TN,tn_4096_1636_4096,Gemm_Hipblaslt_TN_9607,0.105058
GemmTunableOp_Half_TN,tn_4096_3791_14336,Gemm_Hipblaslt_TN_9813,0.709521
GemmTunableOp_Half_TN,tn_4096_3219_14336,Gemm_Hipblaslt_TN_9697,0.634474
GemmTunableOp_Half_TN,tn_28672_3416_4096,Gemm_Hipblaslt_TN_9827,1.33422
GemmTunableOp_Half_TN,tn_6144_1850_4096,Gemm_Hipblaslt_TN_9799,0.163133
GemmTunableOp_Half_TN,tn_6144_1708_4096,Gemm_Hipblaslt_TN_9570,0.150365
GemmTunableOp_Half_TN,tn_6144_7072_4096,Gemm_Hipblaslt_TN_9697,0.589533
GemmTunableOp_Half_TN,tn_28672_1909_4096,Gemm_Hipblaslt_TN_9684,0.788183
GemmTunableOp_Half_TN,tn_28672_1599_4096,Gemm_Hipblaslt_TN_9222,0.68751
GemmTunableOp_Half_TN,tn_4096_1682_4096,Gemm_Hipblaslt_TN_9607,0.10743
GemmTunableOp_Half_TN,tn_4096_3706_14336,Gemm_Hipblaslt_TN_9827,0.711204
GemmTunableOp_Half_TN,tn_4096_1769_14336,Gemm_Hipblaslt_TN_9645,0.393863
GemmTunableOp_Half_TN,tn_6144_3706_4096,Gemm_Hipblaslt_TN_9672,0.328831
GemmTunableOp_Half_TN,tn_4096_80_14336,Gemm_Hipblaslt_TN_7160,0.0403409
GemmTunableOp_Half_TN,tn_6144_3547_4096,Gemm_Rocblas_621294495,0.314251
GemmTunableOp_Half_TN,tn_4096_1643_14336,Gemm_Hipblaslt_TN_9679,0.360836
GemmTunableOp_Half_TN,tn_6144_7345_4096,Gemm_Hipblaslt_TN_9753,0.617531
GemmTunableOp_Half_TN,tn_6144_3501_4096,Gemm_Rocblas_621286566,0.31234
GemmTunableOp_Half_TN,tn_6144_5498_4096,Gemm_Rocblas_621294420,0.446001
GemmTunableOp_Half_TN,tn_6144_6920_4096,Gemm_Hipblaslt_TN_9697,0.585715
GemmTunableOp_Half_TN,tn_28672_3767_4096,Gemm_Hipblaslt_TN_9827,1.49988
GemmTunableOp_Half_TN,tn_28672_1902_4096,Gemm_Hipblaslt_TN_9684,0.793823
GemmTunableOp_Half_TN,tn_28672_1684_4096,Gemm_Rocblas_621286678,0.70306
GemmTunableOp_Half_TN,tn_28672_1770_4096,Gemm_Rocblas_621294484,0.72404
GemmTunableOp_Half_TN,tn_4096_3855_14336,Gemm_Hipblaslt_TN_9827,0.737273
GemmTunableOp_Half_TN,tn_4096_1883_4096,Gemm_Hipblaslt_TN_9590,0.12158
GemmTunableOp_Half_TN,tn_8192_2000_8192,Gemm_Hipblaslt_TN_9202,0.424681
GemmTunableOp_Half_TN,tn_32000_56_8192,Gemm_Rocblas_621294203,0.157207
GemmTunableOp_Half_TN,tn_4096_1658_4096,Gemm_Hipblaslt_TN_9265,0.10573
GemmTunableOp_Half_TN,tn_4096_5271_4096,Gemm_Hipblaslt_TN_9799,0.318449
GemmTunableOp_Half_TN,tn_28672_1967_4096,Gemm_Hipblaslt_TN_9846,0.823087
GemmTunableOp_Half_TN,tn_28672_1857_4096,Gemm_Hipblaslt_TN_9684,0.783633
GemmTunableOp_Half_TN,tn_4096_6843_14336,Gemm_Hipblaslt_TN_9694,1.35604
GemmTunableOp_Half_TN,tn_28672_5267_4096,Gemm_Hipblaslt_TN_159,2.06911
GemmTunableOp_Half_TN,tn_128256_143_4096,Gemm_Hipblaslt_TN_9063,0.445606
GemmTunableOp_Half_TN,tn_4096_1824_4096,Gemm_Hipblaslt_TN_9605,0.119864
GemmTunableOp_Half_TN,tn_4096_6902_14336,Gemm_Hipblaslt_TN_9743,1.36282
GemmTunableOp_Half_TN,tn_6144_6630_4096,Gemm_Hipblaslt_TN_9814,0.561398
GemmTunableOp_Half_TN,tn_4096_1798_4096,Gemm_Hipblaslt_TN_9605,0.119941
GemmTunableOp_Half_TN,tn_28672_1875_4096,Gemm_Hipblaslt_TN_9684,0.790686
GemmTunableOp_Half_TN,tn_32000_68_8192,Gemm_Hipblaslt_TN_9479,0.183112
GemmTunableOp_Half_TN,tn_4096_5512_4096,Gemm_Hipblaslt_TN_9773,0.326984
GemmTunableOp_Half_TN,tn_6144_3713_4096,Gemm_Hipblaslt_TN_9690,0.329803
GemmTunableOp_Half_TN,tn_4096_3595_14336,Gemm_Hipblaslt_TN_9187,0.682185
GemmTunableOp_Half_TN,tn_4096_7325_14336,Gemm_Hipblaslt_TN_9749,1.48356
GemmTunableOp_Half_TN,tn_128256_130_4096,Gemm_Hipblaslt_TN_9108,0.439577
GemmTunableOp_Half_TN,tn_28672_1722_4096,Gemm_Hipblaslt_TN_9217,0.712389
GemmTunableOp_Half_TN,tn_6144_1686_4096,Gemm_Hipblaslt_TN_9570,0.150155
GemmTunableOp_Half_TN,tn_4096_1707_14336,Gemm_Hipblaslt_TN_9790,0.363146
GemmTunableOp_Half_TN,tn_6144_7104_4096,Gemm_Hipblaslt_TN_153,0.589065
GemmTunableOp_Half_TN,tn_4096_5498_4096,Gemm_Hipblaslt_TN_9691,0.330039
GemmTunableOp_Half_TN,tn_128256_73_4096,Gemm_Hipblaslt_TN_9057,0.354959
GemmTunableOp_Half_TN,tn_4096_1852_4096,Gemm_Hipblaslt_TN_9645,0.119826
GemmTunableOp_Half_TN,tn_6144_1957_4096,Gemm_Hipblaslt_TN_9536,0.176077
GemmTunableOp_Half_TN,tn_4096_3592_14336,Gemm_Hipblaslt_TN_9697,0.678152
GemmTunableOp_Half_TN,tn_128256_222_4096,Gemm_Hipblaslt_TN_9937,0.547644
GemmTunableOp_Half_TN,tn_57344_2177_8192,Gemm_Hipblaslt_TN_9827,3.99275
GemmTunableOp_Half_TN,tn_4096_1924_14336,Gemm_Hipblaslt_TN_9645,0.411708
GemmTunableOp_Half_TN,tn_28672_1731_4096,Gemm_Rocblas_621294484,0.715741
GemmTunableOp_Half_TN,tn_4096_5277_4096,Gemm_Hipblaslt_TN_9690,0.318514
GemmTunableOp_Half_TN,tn_8192_2113_8192,Gemm_Hipblaslt_TN_9742,0.499453
GemmTunableOp_Half_TN,tn_128256_240_4096,Gemm_Rocblas_621286892,0.568862
GemmTunableOp_Half_TN,tn_4096_1978_14336,Gemm_Hipblaslt_TN_9136,0.416917
GemmTunableOp_Half_TN,tn_57344_2289_8192,Gemm_Hipblaslt_TN_9757,4.06897
GemmTunableOp_Half_TN,tn_4096_6773_14336,Gemm_Hipblaslt_TN_9694,1.34679
GemmTunableOp_Half_TN,tn_28672_216_4096,Gemm_Hipblaslt_TN_9267,0.110723
GemmTunableOp_Half_TN,tn_28672_5427_4096,Gemm_Hipblaslt_TN_9852,2.21624
GemmTunableOp_Half_TN,tn_4096_5465_14336,Gemm_Hipblaslt_TN_9799,1.11308
GemmTunableOp_Half_TN,tn_4096_7120_4096,Gemm_Hipblaslt_TN_9743,0.399462
GemmTunableOp_Half_TN,tn_4096_1610_4096,Gemm_Hipblaslt_TN_9671,0.104924
GemmTunableOp_Half_TN,tn_28672_1858_4096,Gemm_Hipblaslt_TN_9684,0.779745
GemmTunableOp_Half_TN,tn_8192_62_28672,Gemm_Rocblas_621294228,0.143156
GemmTunableOp_Half_TN,tn_6144_3388_4096,Gemm_Hipblaslt_TN_9570,0.304667
GemmTunableOp_Half_TN,tn_6144_3410_4096,Gemm_Rocblas_621286753,0.305418
GemmTunableOp_Half_TN,tn_6144_1828_4096,Gemm_Hipblaslt_TN_9799,0.163948
GemmTunableOp_Half_TN,tn_4096_1873_14336,Gemm_Hipblaslt_TN_9645,0.409067
GemmTunableOp_Half_TN,tn_128256_121_4096,Gemm_Hipblaslt_TN_9061,0.409983
GemmTunableOp_Half_TN,tn_128256_29_4096,Gemm_Hipblaslt_TN_9451,0.30248
GemmTunableOp_Half_TN,tn_6144_1735_4096,Gemm_Hipblaslt_TN_9799,0.157103
GemmTunableOp_Half_TN,tn_8192_59_8192,Gemm_Hipblaslt_TN_7484,0.0389573
GemmTunableOp_Half_TN,tn_57344_2081_8192,Gemm_Hipblaslt_TN_9827,3.96586
GemmTunableOp_Half_TN,tn_4096_5273_14336,Gemm_Hipblaslt_TN_9799,1.07611
GemmTunableOp_Half_TN,tn_28672_1643_4096,Gemm_Rocblas_621294484,0.697018
GemmTunableOp_Half_TN,tn_28672_1727_4096,Gemm_Hipblaslt_TN_9223,0.712268
GemmTunableOp_Half_TN,tn_4096_3497_4096,Gemm_Hipblaslt_TN_9697,0.199512
GemmTunableOp_Half_TN,tn_28672_1961_4096,Gemm_Hipblaslt_TN_9846,0.820601
GemmTunableOp_Half_TN,tn_28672_5052_4096,Gemm_Hipblaslt_TN_9849,2.04246
GemmTunableOp_Half_TN,tn_4096_1597_4096,Gemm_Hipblaslt_TN_9671,0.103587
GemmTunableOp_Half_TN,tn_128256_46_4096,Gemm_Hipblaslt_TN_9451,0.310789
GemmTunableOp_Half_TN,tn_4096_1787_14336,Gemm_Hipblaslt_TN_9645,0.3955
GemmTunableOp_Half_TN,tn_6144_1757_4096,Gemm_Hipblaslt_TN_9799,0.15826
GemmTunableOp_Half_TN,tn_57344_28_8192,Gemm_Hipblaslt_TN_9424,0.246631
GemmTunableOp_Half_TN,tn_4096_7067_14336,Gemm_Hipblaslt_TN_9743,1.39062
GemmTunableOp_Half_TN,tn_57344_2049_8192,Gemm_Hipblaslt_TN_9827,3.92229
GemmTunableOp_Half_TN,tn_8192_2192_28672,Gemm_Hipblaslt_TN_9762,2.06322
GemmTunableOp_Half_TN,tn_28672_1862_4096,Gemm_Hipblaslt_TN_9684,0.78973
GemmTunableOp_Half_TN,tn_10240_67_8192,Gemm_Hipblaslt_TN_9304,0.0492568
GemmTunableOp_Half_TN,tn_8192_2161_28672,Gemm_Hipblaslt_TN_9762,2.0337
GemmTunableOp_Half_TN,tn_10240_2127_8192,Gemm_Hipblaslt_TN_9209,0.621649
GemmTunableOp_Half_TN,tn_4096_1839_4096,Gemm_Hipblaslt_TN_9620,0.121043
GemmTunableOp_Half_TN,tn_57344_4033_8192,Gemm_Rocblas_621294643,6.61371
GemmTunableOp_Half_TN,tn_4096_3630_14336,Gemm_Hipblaslt_TN_9187,0.684037
GemmTunableOp_Half_TN,tn_8192_2385_8192,Gemm_Hipblaslt_TN_9208,0.547893
GemmTunableOp_Half_TN,tn_4096_3600_4096,Gemm_Hipblaslt_TN_9743,0.200256
GemmTunableOp_Half_TN,tn_128256_246_4096,Gemm_Rocblas_621286892,0.576524
GemmTunableOp_Half_TN,tn_8192_2413_28672,Gemm_Hipblaslt_TN_9771,2.31662
GemmTunableOp_Half_TN,tn_10240_2129_8192,Gemm_Hipblaslt_TN_9209,0.623886
GemmTunableOp_Half_TN,tn_4096_1743_14336,Gemm_Hipblaslt_TN_9645,0.39228
GemmTunableOp_Half_TN,tn_28672_1588_4096,Gemm_Rocblas_621286693,0.689538
GemmTunableOp_Half_TN,tn_8192_2049_28672,Gemm_Hipblaslt_TN_9765,2.0841
GemmTunableOp_Half_TN,tn_4096_1957_14336,Gemm_Hipblaslt_TN_9680,0.414387
GemmTunableOp_Half_TN,tn_128256_93_4096,Gemm_Hipblaslt_TN_9057,0.366991
GemmTunableOp_Half_TN,tn_57344_4096_8192,Gemm_Hipblaslt_TN_9758,6.61928
GemmTunableOp_Half_TN,tn_6144_1826_4096,Gemm_Rocblas_621294426,0.163314
GemmTunableOp_Half_TN,tn_4096_3450_4096,Gemm_Hipblaslt_TN_9814,0.19435
GemmTunableOp_Half_TN,tn_128256_49_4096,Gemm_Rocblas_621286813,0.329296
GemmTunableOp_Half_TN,tn_4096_5089_4096,Gemm_Rocblas_621294550,0.312844
GemmTunableOp_Half_TN,tn_28672_3781_4096,Gemm_Hipblaslt_TN_9827,1.49239
GemmTunableOp_Half_TN,tn_6144_1667_4096,Gemm_Hipblaslt_TN_9570,0.149118
GemmTunableOp_Half_TN,tn_28672_1954_4096,Gemm_Hipblaslt_TN_9846,0.831094
GemmTunableOp_Half_TN,tn_28672_3602_4096,Gemm_Hipblaslt_TN_9832,1.43334
GemmTunableOp_Half_TN,tn_32000_65_8192,Gemm_Hipblaslt_TN_9479,0.183831
GemmTunableOp_Half_TN,tn_4096_5530_14336,Gemm_Hipblaslt_TN_9799,1.12878
GemmTunableOp_Half_TN,tn_6144_1787_4096,Gemm_Hipblaslt_TN_9672,0.161442
GemmTunableOp_Half_TN,tn_10240_2178_8192,Gemm_Hipblaslt_TN_9209,0.627753
GemmTunableOp_Half_TN,tn_128256_196_4096,Gemm_Hipblaslt_TN_9908,0.536706
GemmTunableOp_Half_TN,tn_8192_2315_28672,Gemm_Hipblaslt_TN_9649,2.26267
GemmTunableOp_Half_TN,tn_57344_55_8192,Gemm_Hipblaslt_TN_9459,0.297329
GemmTunableOp_Half_TN,tn_4096_3520_14336,Gemm_Hipblaslt_TN_9139,0.672999
GemmTunableOp_Half_TN,tn_4096_7327_14336,Gemm_Hipblaslt_TN_9768,1.48957
GemmTunableOp_Half_TN,tn_4096_7568_14336,Gemm_Hipblaslt_TN_9713,1.51136
GemmTunableOp_Half_TN,tn_57344_2191_8192,Gemm_Hipblaslt_TN_9841,3.9897
GemmTunableOp_Half_TN,tn_4096_1792_14336,Gemm_Hipblaslt_TN_9645,0.393858
GemmTunableOp_Half_TN,tn_4096_5530_4096,Gemm_Hipblaslt_TN_9672,0.329893
GemmTunableOp_Half_TN,tn_128256_94_4096,Gemm_Hipblaslt_TN_9057,0.363376
GemmTunableOp_Half_TN,tn_28672_3780_4096,Gemm_Hipblaslt_TN_9827,1.49784
GemmTunableOp_Half_TN,tn_6144_1722_4096,Gemm_Hipblaslt_TN_9570,0.154529
GemmTunableOp_Half_TN,tn_57344_4049_8192,Gemm_Hipblaslt_TN_9963,6.63198
GemmTunableOp_Half_TN,tn_6144_1830_4096,Gemm_Hipblaslt_TN_9691,0.163104
GemmTunableOp_Half_TN,tn_4096_3830_4096,Gemm_Hipblaslt_TN_9753,0.215974
GemmTunableOp_Half_TN,tn_28672_7139_4096,Gemm_Hipblaslt_TN_159,2.7665
GemmTunableOp_Half_TN,tn_57344_4066_8192,Gemm_Hipblaslt_TN_9758,6.65605
GemmTunableOp_Half_TN,tn_6144_6708_4096,Gemm_Hipblaslt_TN_9814,0.569188
GemmTunableOp_Half_TN,tn_57344_57_8192,Gemm_Hipblaslt_TN_7491,0.299081
GemmTunableOp_Half_TN,tn_57344_2129_8192,Gemm_Hipblaslt_TN_9827,3.95052
GemmTunableOp_Half_TN,tn_4096_3478_14336,Gemm_Hipblaslt_TN_9814,0.6743
GemmTunableOp_Half_TN,tn_57344_2315_8192,Gemm_Hipblaslt_TN_9716,4.39373
GemmTunableOp_Half_TN,tn_28672_1801_4096,Gemm_Hipblaslt_TN_9684,0.775138
GemmTunableOp_Half_TN,tn_4096_104_14336,Gemm_Hipblaslt_TN_7160,0.0454603
GemmTunableOp_Half_TN,tn_128256_169_4096,Gemm_Hipblaslt_TN_9952,0.492599
GemmTunableOp_Half_TN,tn_4096_112_14336,Gemm_Hipblaslt_TN_7534,0.0470331
GemmTunableOp_Half_TN,tn_10240_4049_8192,Gemm_Hipblaslt_TN_9743,1.12477
GemmTunableOp_Half_TN,tn_8192_2082_8192,Gemm_Hipblaslt_TN_9742,0.498407
GemmTunableOp_Half_TN,tn_28672_1973_4096,Gemm_Hipblaslt_TN_9846,0.823035
GemmTunableOp_Half_TN,tn_4096_1805_4096,Gemm_Hipblaslt_TN_9645,0.120411
GemmTunableOp_Half_TN,tn_10240_2082_8192,Gemm_Hipblaslt_TN_9209,0.620679
GemmTunableOp_Half_TN,tn_8192_2385_28672,Gemm_Hipblaslt_TN_9649,2.30161
GemmTunableOp_Half_TN,tn_28672_5359_4096,Gemm_Hipblaslt_TN_9890,2.09653
GemmTunableOp_Half_TN,tn_28672_1890_4096,Gemm_Hipblaslt_TN_9684,0.792572
GemmTunableOp_Half_TN,tn_8192_31_28672,Gemm_Rocblas_621286354,0.127873
GemmTunableOp_Half_TN,tn_128256_122_4096,Gemm_Hipblaslt_TN_9061,0.410973
GemmTunableOp_Half_TN,tn_6144_3557_4096,Gemm_Hipblaslt_TN_9570,0.31389
GemmTunableOp_Half_TN,tn_6144_1673_4096,Gemm_Hipblaslt_TN_9570,0.15098
GemmTunableOp_Half_TN,tn_57344_2096_8192,Gemm_Hipblaslt_TN_156,3.92737
GemmTunableOp_Half_TN,tn_4096_3722_14336,Gemm_Hipblaslt_TN_9813,0.711993
GemmTunableOp_Half_TN,tn_8192_2255_28672,Gemm_Hipblaslt_TN_9649,2.20655
GemmTunableOp_Half_TN,tn_4096_3219_4096,Gemm_Hipblaslt_TN_9814,0.186798
GemmTunableOp_Half_TN,tn_57344_2417_8192,Gemm_Hipblaslt_TN_9852,4.3833
GemmTunableOp_Half_TN,tn_28672_1799_4096,Gemm_Hipblaslt_TN_9832,0.780007
GemmTunableOp_Half_TN,tn_6144_3507_4096,Gemm_Rocblas_621294306,0.30918
GemmTunableOp_Half_TN,tn_4096_1763_14336,Gemm_Hipblaslt_TN_9645,0.391955
GemmTunableOp_Half_TN,tn_4096_3578_4096,Gemm_Hipblaslt_TN_9743,0.201662
GemmTunableOp_Half_TN,tn_8192_4081_8192,Gemm_Hipblaslt_TN_9184,0.880343
GemmTunableOp_Half_TN,tn_6144_1717_4096,Gemm_Hipblaslt_TN_9570,0.152356
GemmTunableOp_Half_TN,tn_28672_3647_4096,Gemm_Hipblaslt_TN_9832,1.44928
GemmTunableOp_Half_TN,tn_28672_5067_4096,Gemm_Hipblaslt_TN_9863,2.05122
GemmTunableOp_Half_TN,tn_6144_1802_4096,Gemm_Hipblaslt_TN_9691,0.162535
GemmTunableOp_Half_TN,tn_128256_68_4096,Gemm_Hipblaslt_TN_9057,0.356127
GemmTunableOp_Half_TN,tn_10240_2270_8192,Gemm_Rocblas_621294317,0.652952
GemmTunableOp_Half_TN,tn_4096_7262_4096,Gemm_Hipblaslt_TN_9743,0.400155
GemmTunableOp_Half_TN,tn_57344_2284_8192,Gemm_Rocblas_621294543,3.9991
GemmTunableOp_Half_TN,tn_6144_6800_4096,Gemm_Hipblaslt_TN_9677,0.575415
GemmTunableOp_Half_TN,tn_28672_3682_4096,Gemm_Hipblaslt_TN_9827,1.48098
GemmTunableOp_Half_TN,tn_4096_3583_14336,Gemm_Hipblaslt_TN_9743,0.679093
GemmTunableOp_Half_TN,tn_6144_1703_4096,Gemm_Hipblaslt_TN_9570,0.151243
GemmTunableOp_Half_TN,tn_4096_1961_14336,Gemm_Hipblaslt_TN_9680,0.418703
GemmTunableOp_Half_TN,tn_4096_7093_14336,Gemm_Hipblaslt_TN_9732,1.39467
GemmTunableOp_Half_TN,tn_57344_2161_8192,Gemm_Hipblaslt_TN_9733,4.01283
GemmTunableOp_Half_TN,tn_4096_1684_14336,Gemm_Hipblaslt_TN_9671,0.362558
GemmTunableOp_Half_TN,tn_128256_123_4096,Gemm_Hipblaslt_TN_9760,0.409112
GemmTunableOp_Half_TN,tn_4096_1973_4096,Gemm_Hipblaslt_TN_9134,0.123419
GemmTunableOp_Half_TN,tn_32000_59_8192,Gemm_Hipblaslt_TN_9463,0.15898
GemmTunableOp_Half_TN,tn_4096_5436_4096,Gemm_Hipblaslt_TN_9691,0.324217
GemmTunableOp_Half_TN,tn_28672_7579_4096,Gemm_Hipblaslt_TN_159,2.85731
GemmTunableOp_Half_TN,tn_10240_28_8192,Gemm_Hipblaslt_TN_9415,0.0403079
GemmTunableOp_Half_TN,tn_10240_2289_8192,Gemm_Rocblas_621286581,0.65422
GemmTunableOp_Half_TN,tn_57344_2082_8192,Gemm_Hipblaslt_TN_9827,3.96136
GemmTunableOp_Half_TN,tn_128256_214_4096,Gemm_Hipblaslt_TN_9908,0.5454
GemmTunableOp_Half_TN,tn_6144_5067_4096,Gemm_Hipblaslt_TN_9217,0.426766
GemmTunableOp_Half_TN,tn_6144_3748_4096,Gemm_Hipblaslt_TN_9690,0.330731
GemmTunableOp_Half_TN,tn_4096_1711_4096,Gemm_Hipblaslt_TN_9607,0.108549
GemmTunableOp_Half_TN,tn_4096_6761_14336,Gemm_Hipblaslt_TN_9694,1.35284
GemmTunableOp_Half_TN,tn_4096_1745_14336,Gemm_Hipblaslt_TN_9645,0.392958
GemmTunableOp_Half_TN,tn_128256_231_4096,Gemm_Rocblas_621286892,0.568583
GemmTunableOp_Half_TN,tn_6144_5125_4096,Gemm_Hipblaslt_TN_9753,0.425677
GemmTunableOp_Half_TN,tn_8192_59_28672,Gemm_Rocblas_621294228,0.146126
GemmTunableOp_Half_TN,tn_4096_3475_14336,Gemm_Hipblaslt_TN_9814,0.673018
GemmTunableOp_Half_TN,tn_6144_1867_4096,Gemm_Hipblaslt_TN_9799,0.16487
GemmTunableOp_Half_TN,tn_128256_8_4096,Gemm_Rocblas_621286325,0.272988
GemmTunableOp_Half_TN,tn_4096_6965_14336,Gemm_Hipblaslt_TN_9732,1.3864
GemmTunableOp_Half_TN,tn_128256_19_4096,Gemm_Rocblas_621286354,0.296955
GemmTunableOp_Half_TN,tn_4096_5267_4096,Gemm_Hipblaslt_TN_9690,0.317904
GemmTunableOp_Half_TN,tn_128256_76_4096,Gemm_Hipblaslt_TN_9057,0.353792
GemmTunableOp_Half_TN,tn_128256_87_4096,Gemm_Hipblaslt_TN_9057,0.363554
GemmTunableOp_Half_TN,tn_6144_1655_4096,Gemm_Rocblas_621286566,0.150895
GemmTunableOp_Half_TN,tn_128256_103_4096,Gemm_Hipblaslt_TN_9061,0.398022
GemmTunableOp_Half_TN,tn_6144_1884_4096,Gemm_Hipblaslt_TN_9799,0.164322
GemmTunableOp_Half_TN,tn_28672_5390_4096,Gemm_Hipblaslt_TN_9924,2.23105
GemmTunableOp_Half_TN,tn_128256_190_4096,Gemm_Hipblaslt_TN_9952,0.50556
GemmTunableOp_Half_TN,tn_128256_223_4096,Gemm_Hipblaslt_TN_9908,0.548336
GemmTunableOp_Half_TN,tn_6144_7120_4096,Gemm_Hipblaslt_TN_9743,0.589513
GemmTunableOp_Half_TN,tn_128256_209_4096,Gemm_Hipblaslt_TN_9937,0.540568
GemmTunableOp_Half_TN,tn_4096_1786_4096,Gemm_Hipblaslt_TN_9590,0.117001
GemmTunableOp_Half_TN,tn_8192_2079_28672,Gemm_Hipblaslt_TN_9650,2.08308
GemmTunableOp_Half_TN,tn_128256_25_4096,Gemm_Hipblaslt_TN_9451,0.299369
GemmTunableOp_Half_TN,tn_10240_2239_8192,Gemm_Hipblaslt_TN_9211,0.636046
GemmTunableOp_Half_TN,tn_28672_5285_4096,Gemm_Hipblaslt_TN_9914,2.07587
GemmTunableOp_Half_TN,tn_4096_3501_4096,Gemm_Hipblaslt_TN_9743,0.196734
GemmTunableOp_Half_TN,tn_128256_144_4096,Gemm_Hipblaslt_TN_9657,0.44856
GemmTunableOp_Half_TN,tn_128256_254_4096,Gemm_Rocblas_621294634,0.579234
GemmTunableOp_Half_TN,tn_6144_5273_4096,Gemm_Hipblaslt_TN_9933,0.43628
GemmTunableOp_Half_TN,tn_57344_68_8192,Gemm_Rocblas_621294520,0.309038
GemmTunableOp_Half_TN,tn_6144_1842_4096,Gemm_Hipblaslt_TN_9672,0.162499
GemmTunableOp_Half_TN,tn_8192_2207_28672,Gemm_Hipblaslt_TN_9762,2.0806
GemmTunableOp_Half_TN,tn_6144_1742_4096,Gemm_Hipblaslt_TN_9672,0.157226
GemmTunableOp_Half_TN,tn_128256_48_4096,Gemm_Hipblaslt_TN_9451,0.31024
GemmTunableOp_Half_TN,tn_28672_1807_4096,Gemm_Hipblaslt_TN_9684,0.777133
GemmTunableOp_Half_TN,tn_8192_2415_8192,Gemm_Hipblaslt_TN_9274,0.543291
GemmTunableOp_Half_TN,tn_28672_1603_4096,Gemm_Rocblas_621286742,0.689515
GemmTunableOp_Half_TN,tn_57344_56_8192,Gemm_Rocblas_621294203,0.297841
GemmTunableOp_Half_TN,tn_4096_5052_4096,Gemm_Hipblaslt_TN_9924,0.310281
GemmTunableOp_Half_TN,tn_6144_1663_4096,Gemm_Rocblas_621294495,0.151732
GemmTunableOp_Half_TN,tn_28672_1652_4096,Gemm_Rocblas_621286742,0.702038
GemmTunableOp_Half_TN,tn_4096_1766_14336,Gemm_Hipblaslt_TN_9645,0.393392
GemmTunableOp_Half_TN,tn_28672_1704_4096,Gemm_Rocblas_621286742,0.710307
GemmTunableOp_Half_TN,tn_4096_3382_14336,Gemm_Hipblaslt_TN_9821,0.654959
GemmTunableOp_Half_TN,tn_28672_6920_4096,Gemm_Hipblaslt_TN_9958,2.82804
GemmTunableOp_Half_TN,tn_6144_3475_4096,Gemm_Hipblaslt_TN_9570,0.31212
GemmTunableOp_Half_TN,tn_4096_1596_14336,Gemm_Hipblaslt_TN_9265,0.351758
GemmTunableOp_Half_TN,tn_32000_57_8192,Gemm_Rocblas_621286466,0.157747
GemmTunableOp_Half_TN,tn_28672_6747_4096,Gemm_Hipblaslt_TN_9899,2.74988
GemmTunableOp_Half_TN,tn_28672_96_4096,Gemm_Rocblas_621286719,0.0601224
GemmTunableOp_Half_TN,tn_128256_53_4096,Gemm_Rocblas_621286813,0.334968
GemmTunableOp_Half_TN,tn_4096_5410_14336,Gemm_Hipblaslt_TN_9687,1.11526
GemmTunableOp_Half_TN,tn_28672_1719_4096,Gemm_Hipblaslt_TN_9191,0.715887
GemmTunableOp_Half_TN,tn_4096_3583_4096,Gemm_Hipblaslt_TN_9814,0.200984
GemmTunableOp_Half_TN,tn_8192_2304_28672,Gemm_Hipblaslt_TN_9774,2.26126
GemmTunableOp_Half_TN,tn_4096_1960_14336,Gemm_Hipblaslt_TN_9645,0.414714
GemmTunableOp_Half_TN,tn_4096_1822_4096,Gemm_Hipblaslt_TN_9645,0.120733
GemmTunableOp_Half_TN,tn_4096_6916_4096,Gemm_Hipblaslt_TN_9692,0.391168
GemmTunableOp_Half_TN,tn_28672_5239_4096,Gemm_Hipblaslt_TN_159,2.05232
GemmTunableOp_Half_TN,tn_6144_1689_4096,Gemm_Hipblaslt_TN_9570,0.153831
GemmTunableOp_Half_TN,tn_57344_2413_8192,Gemm_Hipblaslt_TN_9800,4.39272
GemmTunableOp_Half_TN,tn_4096_3410_4096,Gemm_Hipblaslt_TN_9221,0.19297
GemmTunableOp_Half_TN,tn_28672_1620_4096,Gemm_Rocblas_621286742,0.701777
GemmTunableOp_Half_TN,tn_4096_1713_14336,Gemm_Hipblaslt_TN_9671,0.364708
GemmTunableOp_Half_TN,tn_8192_2161_8192,Gemm_Hipblaslt_TN_9742,0.504286
GemmTunableOp_Half_TN,tn_57344_2385_8192,Gemm_Hipblaslt_TN_9716,4.45746
GemmTunableOp_Half_TN,tn_6144_3564_4096,Gemm_Hipblaslt_TN_9570,0.315403
GemmTunableOp_Half_TN,tn_28672_3559_4096,Gemm_Hipblaslt_TN_9841,1.35771
GemmTunableOp_Half_TN,tn_4096_1954_14336,Gemm_Hipblaslt_TN_9680,0.415937
GemmTunableOp_Half_TN,tn_28672_1609_4096,Gemm_Rocblas_621286742,0.693524
GemmTunableOp_Half_TN,tn_4096_5030_14336,Gemm_Hipblaslt_TN_9799,1.04582
GemmTunableOp_Half_TN,tn_28672_5273_4096,Gemm_Hipblaslt_TN_9933,2.06589
GemmTunableOp_Half_TN,tn_6144_3404_4096,Gemm_Hipblaslt_TN_9570,0.305187
GemmTunableOp_Half_TN,tn_4096_3773_14336,Gemm_Hipblaslt_TN_9827,0.716084
GemmTunableOp_Half_TN,tn_4096_1934_14336,Gemm_Hipblaslt_TN_9645,0.414182
GemmTunableOp_Half_TN,tn_28672_1607_4096,Gemm_Hipblaslt_TN_9184,0.692619
GemmTunableOp_Half_TN,tn_28672_7170_4096,Gemm_Hipblaslt_TN_159,2.80759
GemmTunableOp_Half_TN,tn_28672_32_4096,Gemm_Rocblas_621286818,0.0457116
GemmTunableOp_Half_TN,tn_128256_191_4096,Gemm_Hipblaslt_TN_9952,0.500769
GemmTunableOp_Half_TN,tn_4096_1896_14336,Gemm_Hipblaslt_TN_9645,0.408147
GemmTunableOp_Half_TN,tn_4096_3592_4096,Gemm_Hipblaslt_TN_9221,0.200807
GemmTunableOp_Half_TN,tn_6144_3345_4096,Gemm_Hipblaslt_TN_9570,0.301203
GemmTunableOp_Half_TN,tn_28672_1763_4096,Gemm_Hipblaslt_TN_9191,0.721891
GemmTunableOp_Half_TN,tn_128256_163_4096,Gemm_Hipblaslt_TN_9952,0.487773
GemmTunableOp_Half_TN,tn_4096_5223_4096,Gemm_Hipblaslt_TN_9690,0.317785
GemmTunableOp_Half_TN,tn_4096_7240_14336,Gemm_Hipblaslt_TN_9743,1.40901
GemmTunableOp_Half_TN,tn_6144_5436_4096,Gemm_Hipblaslt_TN_9815,0.443054
GemmTunableOp_Half_TN,tn_4096_1690_4096,Gemm_Hipblaslt_TN_9265,0.105385
GemmTunableOp_Half_TN,tn_28672_1707_4096,Gemm_Rocblas_621294435,0.71306
GemmTunableOp_Half_TN,tn_28672_7327_4096,Gemm_Hipblaslt_TN_159,2.85141
GemmTunableOp_Half_TN,tn_4096_1622_14336,Gemm_Hipblaslt_TN_9671,0.356591
GemmTunableOp_Half_TN,tn_28672_7248_4096,Gemm_Hipblaslt_TN_159,2.84614
GemmTunableOp_Half_TN,tn_4096_1846_14336,Gemm_Hipblaslt_TN_9137,0.404496
GemmTunableOp_Half_TN,tn_28672_1703_4096,Gemm_Rocblas_621294484,0.711435
GemmTunableOp_Half_TN,tn_6144_7021_4096,Gemm_Hipblaslt_TN_9697,0.587864
GemmTunableOp_Half_TN,tn_28672_3520_4096,Gemm_Hipblaslt_TN_9827,1.35092
GemmTunableOp_Half_TN,tn_4096_136_14336,Gemm_Hipblaslt_TN_9298,0.0534311
GemmTunableOp_Half_TN,tn_4096_7191_14336,Gemm_Hipblaslt_TN_9732,1.40785
GemmTunableOp_Half_TN,tn_4096_240_4096,Gemm_Rocblas_621286444,0.0262385
GemmTunableOp_Half_TN,tn_6144_5533_4096,Gemm_Hipblaslt_TN_9704,0.444499
GemmTunableOp_Half_TN,tn_4096_1668_14336,Gemm_Hipblaslt_TN_9671,0.359299
GemmTunableOp_Half_TN,tn_6144_6871_4096,Gemm_Hipblaslt_TN_9677,0.580654
GemmTunableOp_Half_TN,tn_28672_64_4096,Gemm_Rocblas_621294374,0.0487601
GemmTunableOp_Half_TN,tn_4096_7364_14336,Gemm_Hipblaslt_TN_9749,1.48932
GemmTunableOp_Half_TN,tn_4096_1702_14336,Gemm_Hipblaslt_TN_9671,0.362851
GemmTunableOp_Half_TN,tn_6144_1646_4096,Gemm_Rocblas_621286753,0.15075
GemmTunableOp_Half_TN,tn_4096_1748_4096,Gemm_Hipblaslt_TN_9645,0.115791
GemmTunableOp_Half_TN,tn_4096_1857_4096,Gemm_Hipblaslt_TN_9590,0.121735
GemmTunableOp_Half_TN,tn_28672_3773_4096,Gemm_Hipblaslt_TN_9827,1.50771
GemmTunableOp_Half_TN,tn_128256_12_4096,Gemm_Rocblas_621294224,0.280088
GemmTunableOp_Half_TN,tn_4096_5125_4096,Gemm_Hipblaslt_TN_9690,0.314702
GemmTunableOp_Half_TN,tn_28672_3547_4096,Gemm_Hipblaslt_TN_9827,1.3534
GemmTunableOp_Half_TN,tn_28672_7301_4096,Gemm_Hipblaslt_TN_159,2.81359
GemmTunableOp_Half_TN,tn_6144_3373_4096,Gemm_Hipblaslt_TN_9570,0.303143
GemmTunableOp_Half_TN,tn_4096_96_14336,Gemm_Hipblaslt_TN_9294,0.0408601
GemmTunableOp_Half_TN,tn_4096_7136_4096,Gemm_Hipblaslt_TN_9743,0.393711
GemmTunableOp_Half_TN,tn_6144_7344_4096,Gemm_Rocblas_621286678,0.620207
GemmTunableOp_Half_TN,tn_6144_7267_4096,Gemm_Hipblaslt_TN_9743,0.598598
GemmTunableOp_Half_TN,tn_28672_1852_4096,Gemm_Hipblaslt_TN_9684,0.783983
GemmTunableOp_Half_TN,tn_6144_3581_4096,Gemm_Rocblas_621294495,0.314368
GemmTunableOp_Half_TN,tn_6144_112_4096,Gemm_Rocblas_621286440,0.0235792
GemmTunableOp_Half_TN,tn_128256_232_4096,Gemm_Rocblas_621294634,0.566237
GemmTunableOp_Half_TN,tn_28672_1838_4096,Gemm_Hipblaslt_TN_9684,0.77969
GemmTunableOp_Half_TN,tn_4096_3455_14336,Gemm_Hipblaslt_TN_9692,0.659516
GemmTunableOp_Half_TN,tn_28672_6708_4096,Gemm_Hipblaslt_TN_9943,2.64114
GemmTunableOp_Half_TN,tn_57344_2017_8192,Gemm_Hipblaslt_TN_9840,3.50726
GemmTunableOp_Half_TN,tn_4096_1765_14336,Gemm_Hipblaslt_TN_9645,0.393583
GemmTunableOp_Half_TN,tn_8192_66_28672,Gemm_Hipblaslt_TN_8899,0.16967
GemmTunableOp_Half_TN,tn_4096_1622_4096,Gemm_Hipblaslt_TN_9359,0.104921
GemmTunableOp_Half_TN,tn_4096_5442_4096,Gemm_Hipblaslt_TN_9690,0.326324
GemmTunableOp_Half_TN,tn_57344_2158_8192,Gemm_Hipblaslt_TN_9841,3.99803
GemmTunableOp_Half_TN,tn_10240_2160_8192,Gemm_Hipblaslt_TN_9182,0.626074
GemmTunableOp_Half_TN,tn_4096_3496_14336,Gemm_Hipblaslt_TN_9697,0.671686
GemmTunableOp_Half_TN,tn_28672_6990_4096,Gemm_Hipblaslt_TN_159,2.75365
GemmTunableOp_Half_TN,tn_6144_1731_4096,Gemm_Hipblaslt_TN_9799,0.157104
GemmTunableOp_Half_TN,tn_4096_6788_4096,Gemm_Hipblaslt_TN_9743,0.384387
GemmTunableOp_Half_TN,tn_6144_120_4096,Gemm_Rocblas_621286443,0.0241641
GemmTunableOp_Half_TN,tn_28672_7240_4096,Gemm_Hipblaslt_TN_159,2.85054
GemmTunableOp_Half_TN,tn_4096_1648_14336,Gemm_Hipblaslt_TN_9671,0.358821
GemmTunableOp_Half_TN,tn_4096_1828_14336,Gemm_Hipblaslt_TN_9137,0.402301
GemmTunableOp_Half_TN,tn_28672_6996_4096,Gemm_Hipblaslt_TN_159,2.77059
GemmTunableOp_Half_TN,tn_4096_256_14336,Gemm_Hipblaslt_TN_9303,0.0779416
GemmTunableOp_Half_TN,tn_28672_1682_4096,Gemm_Hipblaslt_TN_9223,0.704712
GemmTunableOp_Half_TN,tn_4096_1871_14336,Gemm_Hipblaslt_TN_9645,0.407047
GemmTunableOp_Half_TN,tn_4096_120_4096,Gemm_Rocblas_621286436,0.0174481
GemmTunableOp_Half_TN,tn_4096_1863_14336,Gemm_Hipblaslt_TN_9645,0.406165
GemmTunableOp_Half_TN,tn_4096_24_4096,Gemm_Rocblas_621294139,0.011718
GemmTunableOp_Half_TN,tn_4096_1646_14336,Gemm_Hipblaslt_TN_9265,0.35797
GemmTunableOp_Half_TN,tn_6144_1854_4096,Gemm_Hipblaslt_TN_9672,0.164599
GemmTunableOp_Half_TN,tn_28672_1908_4096,Gemm_Hipblaslt_TN_9684,0.794547
GemmTunableOp_Half_TN,tn_128256_181_4096,Gemm_Hipblaslt_TN_9855,0.501601
GemmTunableOp_Half_TN,tn_6144_5570_4096,Gemm_Rocblas_621286678,0.448398
GemmTunableOp_Half_TN,tn_28672_7196_4096,Gemm_Hipblaslt_TN_159,2.80459
GemmTunableOp_Half_TN,tn_4096_1796_14336,Gemm_Hipblaslt_TN_9645,0.402118
GemmTunableOp_Half_TN,tn_57344_4050_8192,Gemm_Hipblaslt_TN_9758,6.61453
GemmTunableOp_Half_TN,tn_4096_1889_4096,Gemm_Hipblaslt_TN_9645,0.12071
GemmTunableOp_Half_TN,tn_4096_3584_4096,Gemm_Hipblaslt_TN_9743,0.198193
GemmTunableOp_Half_TN,tn_4096_3427_4096,Gemm_Hipblaslt_TN_9188,0.194232
GemmTunableOp_Half_TN,tn_6144_3722_4096,Gemm_Hipblaslt_TN_9729,0.331688
GemmTunableOp_Half_TN,tn_128256_86_4096,Gemm_Hipblaslt_TN_9057,0.363928
GemmTunableOp_Half_TN,tn_4096_6868_14336,Gemm_Hipblaslt_TN_9694,1.36372
GemmTunableOp_Half_TN,tn_6144_3455_4096,Gemm_Rocblas_621286566,0.302842
GemmTunableOp_Half_TN,tn_8192_67_28672,Gemm_Hipblaslt_TN_8899,0.170742
GemmTunableOp_Half_TN,tn_4096_1825_4096,Gemm_Hipblaslt_TN_9645,0.119622
GemmTunableOp_Half_TN,tn_28672_1840_4096,Gemm_Hipblaslt_TN_9684,0.78493
GemmTunableOp_Half_TN,tn_28672_5413_4096,Gemm_Hipblaslt_TN_9924,2.22956
GemmTunableOp_Half_TN,tn_4096_224_14336,Gemm_Hipblaslt_TN_9303,0.069679
GemmTunableOp_Half_TN,tn_10240_65_8192,Gemm_Hipblaslt_TN_8095,0.049408
GemmTunableOp_Half_TN,tn_6144_6916_4096,Gemm_Hipblaslt_TN_9677,0.580273
GemmTunableOp_Half_TN,tn_4096_3710_4096,Gemm_Hipblaslt_TN_9841,0.207781
GemmTunableOp_Half_TN,tn_128256_105_4096,Gemm_Hipblaslt_TN_9061,0.396148
GemmTunableOp_Half_TN,tn_128256_44_4096,Gemm_Hipblaslt_TN_9451,0.308836
GemmTunableOp_Half_TN,tn_6144_1752_4096,Gemm_Hipblaslt_TN_9672,0.155519
GemmTunableOp_Half_TN,tn_4096_1784_14336,Gemm_Hipblaslt_TN_9645,0.394535
GemmTunableOp_Half_TN,tn_4096_208_14336,Gemm_Hipblaslt_TN_9363,0.0688325
GemmTunableOp_Half_TN,tn_6144_1831_4096,Gemm_Hipblaslt_TN_9672,0.164332
GemmTunableOp_Half_TN,tn_6144_5541_4096,Gemm_Hipblaslt_TN_9753,0.449367
GemmTunableOp_Half_TN,tn_28672_1781_4096,Gemm_Rocblas_621294420,0.723696
GemmTunableOp_Half_TN,tn_4096_1774_4096,Gemm_Hipblaslt_TN_9645,0.117912
GemmTunableOp_Half_TN,tn_6144_1789_4096,Gemm_Hipblaslt_TN_9691,0.16331
GemmTunableOp_Half_TN,tn_6144_1869_4096,Gemm_Hipblaslt_TN_9672,0.164633
GemmTunableOp_Half_TN,tn_6144_1930_4096,Gemm_Hipblaslt_TN_9697,0.173155
GemmTunableOp_Half_TN,tn_4096_5735_4096,Gemm_Hipblaslt_TN_9924,0.334847
GemmTunableOp_Half_TN,tn_4096_1663_4096,Gemm_Hipblaslt_TN_9359,0.105639
GemmTunableOp_Half_TN,tn_4096_1892_4096,Gemm_Hipblaslt_TN_9645,0.120493
GemmTunableOp_Half_TN,tn_4096_5512_14336,Gemm_Hipblaslt_TN_9676,1.1389
GemmTunableOp_Half_TN,tn_4096_1867_4096,Gemm_Hipblaslt_TN_9645,0.121743
GemmTunableOp_Half_TN,tn_4096_1859_4096,Gemm_Hipblaslt_TN_9645,0.12207
GemmTunableOp_Half_TN,tn_28672_6721_4096,Gemm_Hipblaslt_TN_9939,2.75539
GemmTunableOp_Half_TN,tn_6144_224_4096,Gemm_Hipblaslt_TN_9495,0.0335055
GemmTunableOp_Half_TN,tn_4096_5470_4096,Gemm_Hipblaslt_TN_9672,0.323787
GemmTunableOp_Half_TN,tn_6144_5068_4096,Gemm_Hipblaslt_TN_9768,0.423805
GemmTunableOp_Half_TN,tn_6144_1711_4096,Gemm_Rocblas_621286753,0.154938
GemmTunableOp_Half_TN,tn_28672_7475_4096,Gemm_Hipblaslt_TN_159,2.89471
GemmTunableOp_Half_TN,tn_4096_6708_14336,Gemm_Hipblaslt_TN_9692,1.34428
GemmTunableOp_Half_TN,tn_28672_1789_4096,Gemm_Hipblaslt_TN_9280,0.72742
GemmTunableOp_Half_TN,tn_128256_71_4096,Gemm_Hipblaslt_TN_9057,0.356304
GemmTunableOp_Half_TN,tn_4096_176_14336,Gemm_Hipblaslt_TN_7585,0.0616088
GemmTunableOp_Half_TN,tn_4096_1703_4096,Gemm_Hipblaslt_TN_9607,0.105176
GemmTunableOp_Half_TN,tn_28672_7136_4096,Gemm_Hipblaslt_TN_9934,2.81432
GemmTunableOp_Half_TN,tn_6144_3508_4096,Gemm_Rocblas_621286753,0.311775
GemmTunableOp_Half_TN,tn_4096_7364_4096,Gemm_Hipblaslt_TN_9914,0.413275
GemmTunableOp_Half_TN,tn_4096_3640_4096,Gemm_Hipblaslt_TN_9743,0.200543
GemmTunableOp_Half_TN,tn_28672_7186_4096,Gemm_Hipblaslt_TN_159,2.82092
GemmTunableOp_Half_TN,tn_4096_5239_4096,Gemm_Hipblaslt_TN_9799,0.319212
GemmTunableOp_Half_TN,tn_4096_160_14336,Gemm_Hipblaslt_TN_7234,0.0563995
GemmTunableOp_Half_TN,tn_4096_1827_4096,Gemm_Hipblaslt_TN_9645,0.120064
GemmTunableOp_Half_TN,tn_4096_6901_14336,Gemm_Hipblaslt_TN_9694,1.36617
GemmTunableOp_Half_TN,tn_8192_2208_28672,Gemm_Hipblaslt_TN_9762,2.08151
GemmTunableOp_Half_TN,tn_4096_1623_14336,Gemm_Hipblaslt_TN_9790,0.357765
GemmTunableOp_Half_TN,tn_10240_2208_8192,Gemm_Hipblaslt_TN_9182,0.629955
GemmTunableOp_Half_TN,tn_6144_1781_4096,Gemm_Hipblaslt_TN_9691,0.162738
GemmTunableOp_Half_TN,tn_28672_3507_4096,Gemm_Hipblaslt_TN_9827,1.35259
GemmTunableOp_Half_TN,tn_4096_16_4096,Gemm_Rocblas_621294130,0.0101508
GemmTunableOp_Half_TN,tn_28672_1680_4096,Gemm_Rocblas_621294420,0.701734
GemmTunableOp_Half_TN,tn_28672_7575_4096,Gemm_Hipblaslt_TN_159,2.87286
GemmTunableOp_Half_TN,tn_4096_104_4096,Gemm_Rocblas_621294164,0.0171439
GemmTunableOp_Half_TN,tn_4096_1879_4096,Gemm_Hipblaslt_TN_9645,0.121016
GemmTunableOp_Half_TN,tn_4096_6971_4096,Gemm_Hipblaslt_TN_9694,0.395117
GemmTunableOp_Half_TN,tn_6144_1592_4096,Gemm_Hipblaslt_TN_9690,0.14708
GemmTunableOp_Half_TN,tn_6144_5495_4096,Gemm_Hipblaslt_TN_9190,0.448996
GemmTunableOp_Half_TN,tn_6144_3574_4096,Gemm_Hipblaslt_TN_9570,0.313641
GemmTunableOp_Half_TN,tn_28672_3535_4096,Gemm_Hipblaslt_TN_9827,1.35023
GemmTunableOp_Half_TN,tn_4096_7096_4096,Gemm_Hipblaslt_TN_9743,0.393242
GemmTunableOp_Half_TN,tn_4096_1862_14336,Gemm_Hipblaslt_TN_9134,0.407071
GemmTunableOp_Half_TN,tn_8192_2270_28672,Gemm_Hipblaslt_TN_9649,2.23767
GemmTunableOp_Half_TN,tn_4096_5301_4096,Gemm_Hipblaslt_TN_9691,0.320269
GemmTunableOp_Half_TN,tn_6144_3214_4096,Gemm_Rocblas_621294306,0.293462
GemmTunableOp_Half_TN,tn_4096_1977_4096,Gemm_Hipblaslt_TN_9134,0.1232
GemmTunableOp_Half_TN,tn_28672_3588_4096,Gemm_Hipblaslt_TN_9828,1.44339
GemmTunableOp_Half_TN,tn_4096_3520_4096,Gemm_Hipblaslt_TN_9814,0.197061
GemmTunableOp_Half_TN,tn_4096_1647_4096,Gemm_Hipblaslt_TN_9587,0.106376
GemmTunableOp_Half_TN,tn_28672_7386_4096,Gemm_Hipblaslt_TN_159,2.84141
GemmTunableOp_Half_TN,tn_4096_6952_14336,Gemm_Hipblaslt_TN_9743,1.37676
GemmTunableOp_Half_TN,tn_6144_3629_4096,Gemm_Hipblaslt_TN_9570,0.316639
GemmTunableOp_Half_TN,tn_4096_7262_14336,Gemm_Hipblaslt_TN_9732,1.42093
GemmTunableOp_Half_TN,tn_4096_1710_14336,Gemm_Hipblaslt_TN_9671,0.363758
GemmTunableOp_Half_TN,tn_4096_1931_4096,Gemm_Hipblaslt_TN_9134,0.120243
GemmTunableOp_Half_TN,tn_4096_6860_4096,Gemm_Hipblaslt_TN_9955,0.386351
GemmTunableOp_Half_TN,tn_4096_1737_4096,Gemm_Hipblaslt_TN_9605,0.116228
GemmTunableOp_Half_TN,tn_6144_8192_4096,Gemm_Hipblaslt_TN_9220,0.668699
GemmTunableOp_Half_TN,tn_28672_5381_4096,Gemm_Hipblaslt_TN_9924,2.21507
GemmTunableOp_Half_TN,tn_28672_7171_4096,Gemm_Hipblaslt_TN_159,2.77624
GemmTunableOp_Half_TN,tn_4096_7206_4096,Gemm_Hipblaslt_TN_9743,0.398649
GemmTunableOp_Half_TN,tn_4096_1764_4096,Gemm_Hipblaslt_TN_9645,0.115246
GemmTunableOp_Half_TN,tn_4096_1948_14336,Gemm_Hipblaslt_TN_9645,0.414309
GemmTunableOp_Half_TN,tn_6144_7575_4096,Gemm_Hipblaslt_TN_9914,0.632688
GemmTunableOp_Half_TN,tn_4096_3612_14336,Gemm_Hipblaslt_TN_9743,0.68383
GemmTunableOp_Half_TN,tn_4096_7182_4096,Gemm_Hipblaslt_TN_9743,0.398749
GemmTunableOp_Half_TN,tn_28672_5357_4096,Gemm_Hipblaslt_TN_9890,2.09254
GemmTunableOp_Half_TN,tn_28672_1625_4096,Gemm_Hipblaslt_TN_9222,0.697733
GemmTunableOp_Half_TN,tn_4096_7345_4096,Gemm_Hipblaslt_TN_9914,0.415017
GemmTunableOp_Half_TN,tn_28672_7033_4096,Gemm_Hipblaslt_TN_159,2.77962
GemmTunableOp_Half_TN,tn_28672_3564_4096,Gemm_Hipblaslt_TN_9841,1.3598
GemmTunableOp_Half_TN,tn_4096_7253_4096,Gemm_Hipblaslt_TN_9743,0.402629
GemmTunableOp_Half_TN,tn_4096_144_4096,Gemm_Rocblas_621286443,0.022186
GemmTunableOp_Half_TN,tn_4096_1869_14336,Gemm_Hipblaslt_TN_9645,0.406456
GemmTunableOp_Half_TN,tn_4096_6747_4096,Gemm_Hipblaslt_TN_9692,0.388793
GemmTunableOp_Half_TN,tn_4096_1745_4096,Gemm_Hipblaslt_TN_9645,0.11631
GemmTunableOp_Half_TN,tn_28672_1663_4096,Gemm_Hipblaslt_TN_9223,0.701667
GemmTunableOp_Half_TN,tn_128256_98_4096,Gemm_Hipblaslt_TN_9061,0.392189
GemmTunableOp_Half_TN,tn_6144_1928_4096,Gemm_Hipblaslt_TN_9697,0.173993
GemmTunableOp_Half_TN,tn_6144_7225_4096,Gemm_Hipblaslt_TN_9743,0.591796
GemmTunableOp_Half_TN,tn_4096_1673_14336,Gemm_Hipblaslt_TN_9671,0.359872
GemmTunableOp_Half_TN,tn_6144_1829_4096,Gemm_Hipblaslt_TN_9799,0.163849
GemmTunableOp_Half_TN,tn_6144_5319_4096,Gemm_Hipblaslt_TN_9768,0.436002
GemmTunableOp_Half_TN,tn_28672_5319_4096,Gemm_Hipblaslt_TN_9933,2.07092
GemmTunableOp_Half_TN,tn_4096_1733_4096,Gemm_Hipblaslt_TN_9645,0.116374
GemmTunableOp_Half_TN,tn_4096_1830_14336,Gemm_Hipblaslt_TN_9645,0.400971
GemmTunableOp_Half_TN,tn_4096_1586_4096,Gemm_Hipblaslt_TN_9587,0.105076
GemmTunableOp_Half_TN,tn_57344_2465_8192,Gemm_Rocblas_621294015,4.40874
GemmTunableOp_Half_TN,tn_28672_7190_4096,Gemm_Hipblaslt_TN_159,2.78904
GemmTunableOp_Half_TN,tn_6144_1614_4096,Gemm_Rocblas_621286753,0.151138
GemmTunableOp_Half_TN,tn_6144_5136_4096,Gemm_Rocblas_621286750,0.428751
GemmTunableOp_Half_TN,tn_28672_1633_4096,Gemm_Rocblas_621286693,0.698013
GemmTunableOp_Half_TN,tn_4096_3574_4096,Gemm_Hipblaslt_TN_9221,0.198634
GemmTunableOp_Half_TN,tn_4096_1866_14336,Gemm_Hipblaslt_TN_9134,0.406653
GemmTunableOp_Half_TN,tn_6144_1888_4096,Gemm_Hipblaslt_TN_9672,0.163939
GemmTunableOp_Half_TN,tn_4096_1847_4096,Gemm_Hipblaslt_TN_9645,0.118711
GemmTunableOp_Half_TN,tn_6144_3497_4096,Gemm_Hipblaslt_TN_9570,0.310921
GemmTunableOp_Half_TN,tn_128256_241_4096,Gemm_Rocblas_621294634,0.571166
GemmTunableOp_Half_TN,tn_4096_3497_14336,Gemm_Hipblaslt_TN_9743,0.670536
GemmTunableOp_Half_TN,tn_6144_1792_4096,Gemm_Hipblaslt_TN_9711,0.161406
GemmTunableOp_Half_TN,tn_28672_1881_4096,Gemm_Hipblaslt_TN_9832,0.791145
GemmTunableOp_Half_TN,tn_4096_1710_4096,Gemm_Hipblaslt_TN_9671,0.106465
GemmTunableOp_Half_TN,tn_4096_3535_4096,Gemm_Hipblaslt_TN_9221,0.197959
GemmTunableOp_Half_TN,tn_10240_2397_8192,Gemm_Hipblaslt_TN_9209,0.667151
GemmTunableOp_Half_TN,tn_6144_1599_4096,Gemm_Rocblas_621294305,0.147194
GemmTunableOp_Half_TN,tn_6144_3793_4096,Gemm_Hipblaslt_TN_9672,0.330916
GemmTunableOp_Half_TN,tn_4096_3855_4096,Gemm_Hipblaslt_TN_9768,0.216022
GemmTunableOp_Half_TN,tn_6144_1573_4096,Gemm_Rocblas_621286565,0.14736
GemmTunableOp_Half_TN,tn_6144_3640_4096,Gemm_Hipblaslt_TN_9570,0.314318
GemmTunableOp_Half_TN,tn_4096_3494_14336,Gemm_Hipblaslt_TN_9743,0.671425
GemmTunableOp_Half_TN,tn_28672_1668_4096,Gemm_Rocblas_621294420,0.70137
GemmTunableOp_Half_TN,tn_4096_1884_14336,Gemm_Hipblaslt_TN_9645,0.409198
GemmTunableOp_Half_TN,tn_28672_3455_4096,Gemm_Hipblaslt_TN_9827,1.33736
GemmTunableOp_Half_TN,tn_6144_3379_4096,Gemm_Hipblaslt_TN_9774,0.303343
GemmTunableOp_Half_TN,tn_6144_6990_4096,Gemm_Hipblaslt_TN_9695,0.591325
GemmTunableOp_Half_TN,tn_4096_48_14336,Gemm_Hipblaslt_TN_8050,0.0313907
GemmTunableOp_Half_TN,tn_4096_1667_4096,Gemm_Hipblaslt_TN_9679,0.1058
GemmTunableOp_Half_TN,tn_4096_1704_4096,Gemm_Hipblaslt_TN_9607,0.104116
GemmTunableOp_Half_TN,tn_4096_5533_4096,Gemm_Hipblaslt_TN_9687,0.329883
GemmTunableOp_Half_TN,tn_28672_3496_4096,Gemm_Hipblaslt_TN_9827,1.34379
GemmTunableOp_Half_TN,tn_4096_1945_4096,Gemm_Hipblaslt_TN_9645,0.123595
GemmTunableOp_Half_TN,tn_4096_7386_14336,Gemm_Hipblaslt_TN_9713,1.49487
GemmTunableOp_Half_TN,tn_4096_1811_4096,Gemm_Hipblaslt_TN_9590,0.119136
GemmTunableOp_Half_TN,tn_4096_1721_14336,Gemm_Hipblaslt_TN_9671,0.363347
GemmTunableOp_Half_TN,tn_28672_1622_4096,Gemm_Hipblaslt_TN_9222,0.698005
GemmTunableOp_Half_TN,tn_4096_1667_14336,Gemm_Hipblaslt_TN_9671,0.361273
GemmTunableOp_Half_TN,tn_4096_7118_14336,Gemm_Hipblaslt_TN_9732,1.40921
GemmTunableOp_Half_TN,tn_4096_1934_4096,Gemm_Hipblaslt_TN_9134,0.122779
GemmTunableOp_Half_TN,tn_28672_3651_4096,Gemm_Hipblaslt_TN_9827,1.47402
GemmTunableOp_Half_TN,tn_128256_126_4096,Gemm_Rocblas_621294762,0.410714
GemmTunableOp_Half_TN,tn_4096_1805_14336,Gemm_Hipblaslt_TN_9174,0.403597
GemmTunableOp_Half_TN,tn_6144_7262_4096,Gemm_Hipblaslt_TN_9697,0.600599
GemmTunableOp_Half_TN,tn_8192_60_8192,Gemm_Hipblaslt_TN_7484,0.039191
GemmTunableOp_Half_TN,tn_28672_1688_4096,Gemm_Rocblas_621294330,0.707867
GemmTunableOp_Half_TN,tn_128256_201_4096,Gemm_Hipblaslt_TN_9653,0.545292
GemmTunableOp_Half_TN,tn_28672_1804_4096,Gemm_Hipblaslt_TN_9684,0.775218
GemmTunableOp_Half_TN,tn_28672_6841_4096,Gemm_Hipblaslt_TN_9955,2.75482
GemmTunableOp_Half_TN,tn_4096_3645_4096,Gemm_Hipblaslt_TN_9188,0.201445
GemmTunableOp_Half_TN,tn_4096_1916_4096,Gemm_Hipblaslt_TN_9645,0.121311
GemmTunableOp_Half_TN,tn_4096_3768_4096,Gemm_Rocblas_621286281,0.210483
GemmTunableOp_Half_TN,tn_6144_1620_4096,Gemm_Hipblaslt_TN_9570,0.151263
GemmStridedBatchedTunableOp_Half_TN,tn_1809_1809_128_B_32,Gemm_Hipblaslt_TN_6895,0.140117
GemmStridedBatchedTunableOp_Half_TN,tn_1704_1704_128_B_32,Gemm_Hipblaslt_TN_6942,0.118213
GemmStridedBatchedTunableOp_Half_TN,tn_1590_1590_128_B_32,Gemm_Rocblas_621286397,0.111746
GemmStridedBatchedTunableOp_Half_TN,tn_1959_1959_128_B_32,Gemm_Hipblaslt_TN_6879,0.15289
GemmStridedBatchedTunableOp_Half_TN,tn_1715_1715_128_B_32,Gemm_Rocblas_621294110,0.121268
GemmStridedBatchedTunableOp_Half_TN,tn_1818_1818_128_B_32,Gemm_Hipblaslt_TN_6942,0.135761
GemmStridedBatchedTunableOp_Half_TN,tn_1882_1882_128_B_32,Gemm_Hipblaslt_TN_6942,0.141561
GemmStridedBatchedTunableOp_Half_TN,tn_1666_1666_128_B_32,Gemm_Rocblas_621286397,0.117418
GemmStridedBatchedTunableOp_Half_TN,tn_1784_1784_128_B_32,Gemm_Rocblas_621294106,0.127015
GemmStridedBatchedTunableOp_Half_TN,tn_1865_1865_128_B_32,Gemm_Hipblaslt_TN_6939,0.145502
GemmStridedBatchedTunableOp_Half_TN,tn_1745_1745_128_B_32,Gemm_Rocblas_621286397,0.126429
GemmStridedBatchedTunableOp_Half_TN,tn_1855_1855_128_B_32,Gemm_Hipblaslt_TN_6942,0.141365
GemmStridedBatchedTunableOp_Half_TN,tn_1850_1850_128_B_32,Gemm_Hipblaslt_TN_6942,0.137372
GemmStridedBatchedTunableOp_Half_TN,tn_1847_1847_128_B_32,Gemm_Hipblaslt_TN_6942,0.139597
GemmStridedBatchedTunableOp_Half_TN,tn_1896_1896_128_B_32,Gemm_Hipblaslt_TN_157,0.134314
GemmStridedBatchedTunableOp_Half_TN,tn_1844_1844_128_B_32,Gemm_Hipblaslt_TN_6942,0.140145
GemmStridedBatchedTunableOp_Half_TN,tn_1841_1841_128_B_32,Gemm_Rocblas_621286397,0.143969
GemmStridedBatchedTunableOp_Half_TN,tn_1737_1737_128_B_32,Gemm_Rocblas_621286413,0.126048
GemmStridedBatchedTunableOp_Half_TN,tn_1926_1926_128_B_32,Gemm_Hipblaslt_TN_6879,0.152301
GemmStridedBatchedTunableOp_Half_TN,tn_1874_1874_128_B_32,Gemm_Hipblaslt_TN_6942,0.13996
GemmStridedBatchedTunableOp_Half_TN,tn_1625_1625_128_B_32,Gemm_Rocblas_621286397,0.116338
GemmStridedBatchedTunableOp_Half_TN,tn_1866_1866_128_B_32,Gemm_Rocblas_621286397,0.143
GemmStridedBatchedTunableOp_Half_TN,tn_1650_1650_128_B_32,Gemm_Rocblas_621286397,0.115474
GemmStridedBatchedTunableOp_Half_TN,tn_1696_1696_128_B_32,Gemm_Rocblas_621294110,0.108277
GemmStridedBatchedTunableOp_Half_TN,tn_1808_1808_128_B_32,Gemm_Hipblaslt_TN_153,0.129888
GemmStridedBatchedTunableOp_Half_TN,tn_1928_1928_128_B_32,Gemm_Hipblaslt_TN_157,0.146082
GemmStridedBatchedTunableOp_Half_TN,tn_1714_1714_128_B_32,Gemm_Hipblaslt_TN_6942,0.119577
GemmStridedBatchedTunableOp_Half_TN,tn_1634_1634_128_B_32,Gemm_Rocblas_621286397,0.112818
GemmStridedBatchedTunableOp_Half_TN,tn_1842_1842_128_B_32,Gemm_Hipblaslt_TN_6942,0.141347
GemmStridedBatchedTunableOp_Half_TN,tn_1681_1681_128_B_32,Gemm_Hipblaslt_TN_6942,0.118217
GemmStridedBatchedTunableOp_Half_TN,tn_1821_1821_128_B_32,Gemm_Hipblaslt_TN_6942,0.137033
GemmStridedBatchedTunableOp_Half_TN,tn_1616_1616_128_B_32,Gemm_Rocblas_621286397,0.105695
GemmStridedBatchedTunableOp_Half_TN,tn_1695_1695_128_B_32,Gemm_Rocblas_621286413,0.120626
GemmStridedBatchedTunableOp_Half_TN,tn_1943_1943_128_B_32,Gemm_Hipblaslt_TN_6879,0.155387
GemmStridedBatchedTunableOp_Half_TN,tn_1953_1953_128_B_32,Gemm_Hipblaslt_TN_6879,0.154758
GemmStridedBatchedTunableOp_Half_TN,tn_1869_1869_128_B_32,Gemm_Hipblaslt_TN_6942,0.143494
GemmStridedBatchedTunableOp_Half_TN,tn_2257_2257_128_B_64,Gemm_Rocblas_621294106,0.413617
GemmStridedBatchedTunableOp_Half_TN,tn_1835_1835_128_B_32,Gemm_Hipblaslt_TN_6942,0.136817
GemmStridedBatchedTunableOp_Half_TN,tn_1680_1680_128_B_32,Gemm_Rocblas_621286397,0.10932
GemmStridedBatchedTunableOp_Half_TN,tn_1823_1823_128_B_32,Gemm_Rocblas_621286397,0.139855
GemmStridedBatchedTunableOp_Half_TN,tn_1970_1970_128_B_32,Gemm_Rocblas_621294533,0.159643
GemmStridedBatchedTunableOp_Half_TN,tn_1769_1769_128_B_32,Gemm_Rocblas_621286397,0.130465
GemmStridedBatchedTunableOp_Half_TN,tn_1646_1646_128_B_32,Gemm_Hipblaslt_TN_6942,0.116134
GemmStridedBatchedTunableOp_Half_TN,tn_1983_1983_128_B_32,Gemm_Rocblas_621286397,0.156968
GemmStridedBatchedTunableOp_Half_TN,tn_1658_1658_128_B_32,Gemm_Hipblaslt_TN_6942,0.115562
GemmStridedBatchedTunableOp_Half_TN,tn_1631_1631_128_B_32,Gemm_Rocblas_621286397,0.115144
GemmStridedBatchedTunableOp_Half_TN,tn_2113_2113_128_B_64,Gemm_Rocblas_621294106,0.362799
GemmStridedBatchedTunableOp_Half_TN,tn_1812_1812_128_B_32,Gemm_Hipblaslt_TN_6942,0.134561
GemmStridedBatchedTunableOp_Half_TN,tn_2208_2208_128_B_64,Gemm_Hipblaslt_TN_158,0.358908
GemmStridedBatchedTunableOp_Half_TN,tn_2397_2397_128_B_64,Gemm_Rocblas_621294106,0.459517
GemmStridedBatchedTunableOp_Half_TN,tn_1746_1746_128_B_32,Gemm_Rocblas_621286397,0.125626
GemmStridedBatchedTunableOp_Half_TN,tn_1888_1888_128_B_32,Gemm_Hipblaslt_TN_153,0.132837
GemmStridedBatchedTunableOp_Half_TN,tn_2465_2465_128_B_64,Gemm_Rocblas_621294106,0.489378
GemmStridedBatchedTunableOp_Half_TN,tn_1678_1678_128_B_32,Gemm_Hipblaslt_TN_6942,0.116363
GemmStridedBatchedTunableOp_Half_TN,tn_1899_1899_128_B_32,Gemm_Hipblaslt_TN_6942,0.146037
GemmStridedBatchedTunableOp_Half_TN,tn_2082_2082_128_B_64,Gemm_Rocblas_621294106,0.349689
GemmStridedBatchedTunableOp_Half_TN,tn_2032_2032_128_B_64,Gemm_Hipblaslt_TN_157,0.33286
GemmStridedBatchedTunableOp_Half_TN,tn_1845_1845_128_B_32,Gemm_Hipblaslt_TN_6942,0.137314
GemmStridedBatchedTunableOp_Half_TN,tn_1940_1940_128_B_32,Gemm_Rocblas_621294533,0.152049
GemmStridedBatchedTunableOp_Half_TN,tn_2033_2033_128_B_64,Gemm_Hipblaslt_TN_6950,0.346709
GemmStridedBatchedTunableOp_Half_TN,tn_1684_1684_128_B_32,Gemm_Hipblaslt_TN_6942,0.117235
GemmStridedBatchedTunableOp_Half_TN,tn_1627_1627_128_B_32,Gemm_Rocblas_621286397,0.114608
GemmStridedBatchedTunableOp_Half_TN,tn_1585_1585_128_B_32,Gemm_Hipblaslt_TN_6929,0.112306
GemmStridedBatchedTunableOp_Half_TN,tn_2177_2177_128_B_64,Gemm_Rocblas_621294106,0.386267
GemmStridedBatchedTunableOp_Half_TN,tn_1778_1778_128_B_32,Gemm_Rocblas_621294106,0.130587
GemmStridedBatchedTunableOp_Half_TN,tn_2159_2159_128_B_64,Gemm_Rocblas_621294106,0.379644
GemmStridedBatchedTunableOp_Half_TN,tn_2304_2304_128_B_64,Gemm_Rocblas_621294551,0.34973
GemmStridedBatchedTunableOp_Half_TN,tn_1858_1858_128_B_32,Gemm_Hipblaslt_TN_6942,0.137137
GemmStridedBatchedTunableOp_Half_TN,tn_1883_1883_128_B_32,Gemm_Hipblaslt_TN_6942,0.145358
GemmStridedBatchedTunableOp_Half_TN,tn_1922_1922_128_B_32,Gemm_Hipblaslt_TN_6879,0.148379
GemmStridedBatchedTunableOp_Half_TN,tn_1679_1679_128_B_32,Gemm_Rocblas_621286397,0.118454
GemmStridedBatchedTunableOp_Half_TN,tn_1951_1951_128_B_32,Gemm_Rocblas_621294533,0.156431
GemmStridedBatchedTunableOp_Half_TN,tn_1682_1682_128_B_32,Gemm_Hipblaslt_TN_6942,0.117733
GemmStridedBatchedTunableOp_Half_TN,tn_1623_1623_128_B_32,Gemm_Rocblas_621294106,0.117416
GemmStridedBatchedTunableOp_Half_TN,tn_2225_2225_128_B_64,Gemm_Rocblas_621294106,0.396038
GemmStridedBatchedTunableOp_Half_TN,tn_2000_2000_128_B_64,Gemm_Hipblaslt_TN_9841,0.321101
GemmStridedBatchedTunableOp_Half_TN,tn_1661_1661_128_B_32,Gemm_Hipblaslt_TN_6895,0.11991
GemmStridedBatchedTunableOp_Half_TN,tn_1609_1609_128_B_32,Gemm_Hipblaslt_TN_6929,0.115714
GemmStridedBatchedTunableOp_Half_TN,tn_1601_1601_128_B_32,Gemm_Rocblas_621286397,0.113909
GemmStridedBatchedTunableOp_Half_TN,tn_1860_1860_128_B_32,Gemm_Hipblaslt_TN_6942,0.140947
GemmStridedBatchedTunableOp_Half_TN,tn_1955_1955_128_B_32,Gemm_Rocblas_621294533,0.156529
GemmStridedBatchedTunableOp_Half_TN,tn_1834_1834_128_B_32,Gemm_Hipblaslt_TN_6942,0.134954
GemmStridedBatchedTunableOp_Half_TN,tn_1909_1909_128_B_32,Gemm_Hipblaslt_TN_6942,0.145083
GemmStridedBatchedTunableOp_Half_TN,tn_1669_1669_128_B_32,Gemm_Hipblaslt_TN_6942,0.1163
GemmStridedBatchedTunableOp_Half_TN,tn_1918_1918_128_B_32,Gemm_Hipblaslt_TN_6942,0.146234
GemmStridedBatchedTunableOp_Half_TN,tn_1701_1701_128_B_32,Gemm_Hipblaslt_TN_6942,0.120998
GemmStridedBatchedTunableOp_Half_TN,tn_1593_1593_128_B_32,Gemm_Hipblaslt_TN_6942,0.111039
GemmStridedBatchedTunableOp_Half_TN,tn_1826_1826_128_B_32,Gemm_Hipblaslt_TN_6942,0.136365
GemmStridedBatchedTunableOp_Half_TN,tn_1964_1964_128_B_32,Gemm_Hipblaslt_TN_6879,0.154558
GemmStridedBatchedTunableOp_Half_TN,tn_1777_1777_128_B_32,Gemm_Hipblaslt_TN_6874,0.132281
GemmStridedBatchedTunableOp_Half_TN,tn_1832_1832_128_B_32,Gemm_Hipblaslt_TN_157,0.130967
GemmStridedBatchedTunableOp_Half_TN,tn_1938_1938_128_B_32,Gemm_Hipblaslt_TN_6879,0.15255
GemmStridedBatchedTunableOp_Half_TN,tn_1925_1925_128_B_32,Gemm_Hipblaslt_TN_6879,0.153617
GemmStridedBatchedTunableOp_Half_TN,tn_1662_1662_128_B_32,Gemm_Rocblas_621286397,0.114565
GemmStridedBatchedTunableOp_Half_TN,tn_1843_1843_128_B_32,Gemm_Hipblaslt_TN_6942,0.138753
GemmStridedBatchedTunableOp_Half_TN,tn_1969_1969_128_B_32,Gemm_Hipblaslt_TN_6879,0.157084
GemmStridedBatchedTunableOp_Half_TN,tn_1911_1911_128_B_32,Gemm_Hipblaslt_TN_6942,0.147192
GemmStridedBatchedTunableOp_Half_TN,tn_1586_1586_128_B_32,Gemm_Rocblas_621286397,0.111013
GemmStridedBatchedTunableOp_Half_TN,tn_1912_1912_128_B_32,Gemm_Hipblaslt_TN_153,0.138067
GemmStridedBatchedTunableOp_Half_TN,tn_1763_1763_128_B_32,Gemm_Hipblaslt_TN_6879,0.129542
GemmStridedBatchedTunableOp_Half_TN,tn_1600_1600_128_B_32,Gemm_Rocblas_621286810,0.100374
GemmStridedBatchedTunableOp_Half_TN,tn_1740_1740_128_B_32,Gemm_Rocblas_621286413,0.123326
GemmStridedBatchedTunableOp_Half_TN,tn_1749_1749_128_B_32,Gemm_Rocblas_621286397,0.125229
GemmStridedBatchedTunableOp_Half_TN,tn_1599_1599_128_B_32,Gemm_Hipblaslt_TN_6929,0.112471
GemmStridedBatchedTunableOp_Half_TN,tn_2190_2190_128_B_64,Gemm_Rocblas_621294106,0.390053
GemmStridedBatchedTunableOp_Half_TN,tn_1864_1864_128_B_32,Gemm_Hipblaslt_TN_157,0.137885
GemmStridedBatchedTunableOp_Half_TN,tn_1667_1667_128_B_32,Gemm_Rocblas_621286801,0.120686
GemmStridedBatchedTunableOp_Half_TN,tn_1856_1856_128_B_32,Gemm_Hipblaslt_TN_153,0.128197
GemmTunableOp_Half_TN,tn_4096_1608_14336,Gemm_Hipblaslt_TN_9671,0.358693
GemmTunableOp_Half_TN,tn_128256_127_4096,Gemm_Rocblas_621294324,0.411916
GemmTunableOp_Half_TN,tn_4096_1804_4096,Gemm_Hipblaslt_TN_9605,0.120559
GemmTunableOp_Half_TN,tn_4096_5125_14336,Gemm_Hipblaslt_TN_9924,1.07771
GemmTunableOp_Half_TN,tn_4096_1799_14336,Gemm_Hipblaslt_TN_9268,0.404226
GemmTunableOp_Half_TN,tn_4096_3309_14336,Gemm_Hipblaslt_TN_9139,0.653257
GemmTunableOp_Half_TN,tn_6144_3309_4096,Gemm_Rocblas_621294306,0.298598
GemmTunableOp_Half_TN,tn_6144_1719_4096,Gemm_Hipblaslt_TN_9570,0.154275
GemmTunableOp_Half_TN,tn_4096_3400_4096,Gemm_Hipblaslt_TN_9743,0.194502
GemmTunableOp_Half_TN,tn_4096_1874_14336,Gemm_Hipblaslt_TN_9136,0.413237
GemmTunableOp_Half_TN,tn_4096_3768_14336,Gemm_Hipblaslt_TN_9813,0.721554
GemmTunableOp_Half_TN,tn_6144_1651_4096,Gemm_Hipblaslt_TN_9570,0.150512
GemmTunableOp_Half_TN,tn_6144_6721_4096,Gemm_Hipblaslt_TN_9814,0.580415
GemmTunableOp_Half_TN,tn_6144_1874_4096,Gemm_Hipblaslt_TN_9672,0.164177
GemmTunableOp_Half_TN,tn_28672_5583_4096,Gemm_Hipblaslt_TN_9840,2.32348
GemmTunableOp_Half_TN,tn_4096_1628_4096,Gemm_Hipblaslt_TN_9607,0.106619
GemmTunableOp_Half_TN,tn_28672_1882_4096,Gemm_Hipblaslt_TN_9683,0.795315
GemmTunableOp_Half_TN,tn_6144_7096_4096,Gemm_Hipblaslt_TN_9743,0.596986
GemmTunableOp_Half_TN,tn_28672_6800_4096,Gemm_Hipblaslt_TN_9944,2.79997
GemmTunableOp_Half_TN,tn_28672_3645_4096,Gemm_Hipblaslt_TN_9832,1.48398
GemmTunableOp_Half_TN,tn_6144_1813_4096,Gemm_Rocblas_621286683,0.165282
GemmTunableOp_Half_TN,tn_4096_3496_4096,Gemm_Hipblaslt_TN_9814,0.199885
GemmTunableOp_Half_TN,tn_4096_1804_14336,Gemm_Hipblaslt_TN_9268,0.405061
GemmTunableOp_Half_TN,tn_4096_5357_4096,Gemm_Hipblaslt_TN_9924,0.326755
GemmTunableOp_Half_TN,tn_4096_1931_14336,Gemm_Hipblaslt_TN_9645,0.422036
GemmTunableOp_Half_TN,tn_6144_1825_4096,Gemm_Hipblaslt_TN_9672,0.165168
GemmTunableOp_Half_TN,tn_6144_3647_4096,Gemm_Hipblaslt_TN_9570,0.32062
GemmTunableOp_Half_TN,tn_128256_84_4096,Gemm_Hipblaslt_TN_9057,0.363319
GemmTunableOp_Half_TN,tn_4096_1963_14336,Gemm_Hipblaslt_TN_9620,0.422865
GemmTunableOp_Half_TN,tn_128256_85_4096,Gemm_Hipblaslt_TN_9057,0.366553
GemmTunableOp_Half_TN,tn_28672_1637_4096,Gemm_Hipblaslt_TN_9223,0.70586
GemmTunableOp_Half_TN,tn_4096_1767_14336,Gemm_Hipblaslt_TN_9645,0.39812
GemmTunableOp_Half_TN,tn_10240_2065_8192,Gemm_Rocblas_621286580,0.619236
GemmTunableOp_Half_TN,tn_4096_1890_14336,Gemm_Hipblaslt_TN_9645,0.416283
GemmTunableOp_Half_TN,tn_6144_3855_4096,Gemm_Hipblaslt_TN_9672,0.344633
GemmTunableOp_Half_TN,tn_6144_3791_4096,Gemm_Hipblaslt_TN_9687,0.334862
GemmTunableOp_Half_TN,tn_128256_139_4096,Gemm_Rocblas_621286565,0.44788
GemmTunableOp_Half_TN,tn_4096_1780_4096,Gemm_Hipblaslt_TN_9605,0.11735
GemmTunableOp_Half_TN,tn_4096_7253_14336,Gemm_Hipblaslt_TN_9743,1.43349
GemmTunableOp_Half_TN,tn_4096_3647_4096,Gemm_Hipblaslt_TN_9682,0.203202
GemmTunableOp_Half_TN,tn_4096_6997_14336,Gemm_Hipblaslt_TN_9694,1.41268
GemmTunableOp_Half_TN,tn_4096_1826_14336,Gemm_Hipblaslt_TN_9137,0.408461
GemmTunableOp_Half_TN,tn_4096_3629_14336,Gemm_Hipblaslt_TN_9743,0.69037
GemmTunableOp_Half_TN,tn_4096_5204_4096,Gemm_Hipblaslt_TN_9690,0.322389
GemmTunableOp_Half_TN,tn_28672_1811_4096,Gemm_Hipblaslt_TN_9684,0.78267
GemmTunableOp_Half_TN,tn_4096_1651_4096,Gemm_Hipblaslt_TN_9616,0.104496
GemmTunableOp_Half_TN,tn_4096_7484_14336,Gemm_Hipblaslt_TN_9813,1.52296
GemmTunableOp_Half_TN,tn_4096_1936_14336,Gemm_Hipblaslt_TN_9645,0.417511
GemmTunableOp_Half_TN,tn_4096_3597_4096,Gemm_Hipblaslt_TN_9221,0.203153
GemmTunableOp_Half_TN,tn_6144_3682_4096,Gemm_Hipblaslt_TN_9691,0.331308
GemmTunableOp_Half_TN,tn_28672_1623_4096,Gemm_Rocblas_621286693,0.710234
GemmTunableOp_Half_TN,tn_28672_1636_4096,Gemm_Rocblas_621294484,0.709761
GemmTunableOp_Half_TN,tn_4096_3589_14336,Gemm_Hipblaslt_TN_9682,0.69409
GemmTunableOp_Half_TN,tn_4096_1966_4096,Gemm_Hipblaslt_TN_9134,0.123705
GemmTunableOp_Half_TN,tn_6144_1702_4096,Gemm_Hipblaslt_TN_9570,0.154687
GemmTunableOp_Half_TN,tn_28672_1590_4096,Gemm_Rocblas_621286684,0.700364
GemmTunableOp_Half_TN,tn_28672_6976_4096,Gemm_Hipblaslt_TN_159,2.82621
GemmTunableOp_Half_TN,tn_4096_1889_14336,Gemm_Hipblaslt_TN_9645,0.416197
GemmTunableOp_Half_TN,tn_4096_1699_14336,Gemm_Hipblaslt_TN_9671,0.367047
GemmTunableOp_Half_TN,tn_28672_1827_4096,Gemm_Hipblaslt_TN_9683,0.78596
GemmTunableOp_Half_TN,tn_4096_1826_4096,Gemm_Hipblaslt_TN_9645,0.122365
GemmTunableOp_Half_TN,tn_4096_1742_4096,Gemm_Hipblaslt_TN_9590,0.116977
GemmTunableOp_Half_TN,tn_6144_1858_4096,Gemm_Hipblaslt_TN_9672,0.166506
GemmTunableOp_Half_TN,tn_28672_1945_4096,Gemm_Hipblaslt_TN_9846,0.847232
GemmTunableOp_Half_TN,tn_28672_7478_4096,Gemm_Hipblaslt_TN_159,2.90395
GemmTunableOp_Half_TN,tn_28672_1605_4096,Gemm_Hipblaslt_TN_9191,0.706181
GemmTunableOp_Half_TN,tn_128256_22_4096,Gemm_Rocblas_621294578,0.300722
GemmTunableOp_Half_TN,tn_4096_1652_4096,Gemm_Hipblaslt_TN_9587,0.105863
GemmTunableOp_Half_TN,tn_6144_3478_4096,Gemm_Hipblaslt_TN_9570,0.315164
GemmTunableOp_Half_TN,tn_6144_1862_4096,Gemm_Hipblaslt_TN_9691,0.167039
GemmTunableOp_Half_TN,tn_28672_3427_4096,Gemm_Hipblaslt_TN_9841,1.36747
GemmTunableOp_Half_TN,tn_28672_3441_4096,Gemm_Hipblaslt_TN_9827,1.36355
GemmTunableOp_Half_TN,tn_6144_5204_4096,Gemm_Hipblaslt_TN_9815,0.442863
GemmTunableOp_Half_TN,tn_28672_1683_4096,Gemm_Rocblas_621286678,0.720604
GemmTunableOp_Half_TN,tn_4096_1916_14336,Gemm_Hipblaslt_TN_9645,0.417582
GemmTunableOp_Half_TN,tn_28672_1702_4096,Gemm_Hipblaslt_TN_9223,0.718971
GemmTunableOp_Half_TN,tn_4096_3507_14336,Gemm_Hipblaslt_TN_9697,0.691509
GemmTunableOp_Half_TN,tn_4096_1592_14336,Gemm_Hipblaslt_TN_9671,0.359071
GemmTunableOp_Half_TN,tn_6144_1727_4096,Gemm_Hipblaslt_TN_9570,0.151955
GemmTunableOp_Half_TN,tn_4096_7170_14336,Gemm_Hipblaslt_TN_9743,1.42921
GemmTunableOp_Half_TN,tn_6144_1798_4096,Gemm_Rocblas_621286683,0.16592
GemmTunableOp_Half_TN,tn_4096_6989_14336,Gemm_Hipblaslt_TN_9743,1.41278
GemmTunableOp_Half_TN,tn_4096_1798_14336,Gemm_Hipblaslt_TN_9268,0.404351
GemmTunableOp_Half_TN,tn_4096_1722_14336,Gemm_Hipblaslt_TN_9790,0.36667
GemmTunableOp_Half_TN,tn_8192_4000_28672,Gemm_Rocblas_621294643,3.45995
GemmTunableOp_Half_TN,tn_4096_5390_14336,Gemm_Hipblaslt_TN_9799,1.12139
GemmTunableOp_Half_TN,tn_4096_3691_4096,Gemm_Hipblaslt_TN_9827,0.213695
GemmTunableOp_Half_TN,tn_4096_6920_14336,Gemm_Hipblaslt_TN_9683,1.40842
GemmTunableOp_Half_TN,tn_28672_1820_4096,Gemm_Hipblaslt_TN_9684,0.785746
GemmTunableOp_Half_TN,tn_4096_3501_14336,Gemm_Hipblaslt_TN_9743,0.68472
GemmTunableOp_Half_TN,tn_4096_5390_4096,Gemm_Hipblaslt_TN_9672,0.326227
GemmTunableOp_Half_TN,tn_4096_3713_14336,Gemm_Hipblaslt_TN_9813,0.716332
GemmTunableOp_Half_TN,tn_4096_1970_4096,Gemm_Hipblaslt_TN_9645,0.124128
GemmTunableOp_Half_TN,tn_4096_1838_4096,Gemm_Hipblaslt_TN_9590,0.121364
GemmTunableOp_Half_TN,tn_6144_1954_4096,Gemm_Hipblaslt_TN_9536,0.1771
GemmTunableOp_Half_TN,tn_4096_5498_14336,Gemm_Hipblaslt_TN_9799,1.14827
GemmTunableOp_Half_TN,tn_6144_1725_4096,Gemm_Rocblas_621286753,0.156483
GemmTunableOp_Half_TN,tn_8192_56_8192,Gemm_Hipblaslt_TN_7484,0.0393164
GemmTunableOp_Half_TN,tn_4096_1717_14336,Gemm_Hipblaslt_TN_9180,0.368334
GemmTunableOp_Half_TN,tn_10240_30_8192,Gemm_Hipblaslt_TN_9415,0.0400818
GemmTunableOp_Half_TN,tn_4096_1670_14336,Gemm_Hipblaslt_TN_9790,0.364183
GemmTunableOp_Half_TN,tn_28672_3420_4096,Gemm_Hipblaslt_TN_9827,1.3651
GemmTunableOp_Half_TN,tn_128256_116_4096,Gemm_Rocblas_621286644,0.406041
GemmTunableOp_Half_TN,tn_4096_5427_14336,Gemm_Hipblaslt_TN_9799,1.12858
GemmTunableOp_Half_TN,tn_4096_7552_14336,Gemm_Hipblaslt_TN_9749,1.5248
GemmTunableOp_Half_TN,tn_4096_1933_14336,Gemm_Hipblaslt_TN_9137,0.420069
GemmTunableOp_Half_TN,tn_4096_1967_14336,Gemm_Hipblaslt_TN_9645,0.424328
GemmTunableOp_Half_TN,tn_4096_1961_4096,Gemm_Hipblaslt_TN_9134,0.125087
GemmTunableOp_Half_TN,tn_28672_3666_4096,Gemm_Hipblaslt_TN_9827,1.50201
GemmTunableOp_Half_TN,tn_4096_3920_4096,Gemm_Rocblas_621294030,0.221593
GemmTunableOp_Half_TN,tn_4096_1894_14336,Gemm_Hipblaslt_TN_9645,0.417546
GemmTunableOp_Half_TN,tn_4096_7021_14336,Gemm_Hipblaslt_TN_9743,1.40863
GemmTunableOp_Half_TN,tn_4096_3416_4096,Gemm_Hipblaslt_TN_9821,0.195561
GemmTunableOp_Half_TN,tn_28672_1749_4096,Gemm_Hipblaslt_TN_9223,0.73173
GemmTunableOp_Half_TN,tn_4096_5157_14336,Gemm_Hipblaslt_TN_9799,1.07598
GemmTunableOp_Half_TN,tn_28672_6788_4096,Gemm_Hipblaslt_TN_9953,2.79623
GemmTunableOp_Half_TN,tn_128256_153_4096,Gemm_Hipblaslt_TN_9808,0.454486
GemmTunableOp_Half_TN,tn_6144_1590_4096,Gemm_Rocblas_621286566,0.148994
GemmTunableOp_Half_TN,tn_4096_3574_14336,Gemm_Hipblaslt_TN_9743,0.684765
GemmTunableOp_Half_TN,tn_4096_3748_4096,Gemm_Hipblaslt_TN_9827,0.213186
GemmTunableOp_Half_TN,tn_4096_7139_4096,Gemm_Hipblaslt_TN_9743,0.406497
GemmTunableOp_Half_TN,tn_6144_7248_4096,Gemm_Hipblaslt_TN_153,0.605982
GemmTunableOp_Half_TN,tn_4096_1636_14336,Gemm_Hipblaslt_TN_9790,0.362096
GemmTunableOp_Half_TN,tn_4096_1807_4096,Gemm_Hipblaslt_TN_9645,0.121465
GemmTunableOp_Half_TN,tn_4096_1618_14336,Gemm_Hipblaslt_TN_9671,0.360955
GemmTunableOp_Half_TN,tn_4096_5410_4096,Gemm_Hipblaslt_TN_9709,0.327447
GemmTunableOp_Half_TN,tn_4096_1822_14336,Gemm_Hipblaslt_TN_9137,0.411031
GemmTunableOp_Half_TN,tn_4096_7104_14336,Gemm_Hipblaslt_TN_9743,1.41638
GemmTunableOp_Half_TN,tn_4096_7120_14336,Gemm_Hipblaslt_TN_9743,1.43047
GemmTunableOp_Half_TN,tn_128256_114_4096,Gemm_Rocblas_621286644,0.403284
GemmTunableOp_Half_TN,tn_6144_1762_4096,Gemm_Rocblas_621294426,0.163679
GemmTunableOp_Half_TN,tn_4096_3466_4096,Gemm_Hipblaslt_TN_9827,0.201223
GemmTunableOp_Half_TN,tn_4096_6773_4096,Gemm_Hipblaslt_TN_9814,0.391882
GemmTunableOp_Half_TN,tn_10240_2113_8192,Gemm_Hipblaslt_TN_9729,0.640059
GemmTunableOp_Half_TN,tn_32000_30_8192,Gemm_Rocblas_621286350,0.151757
GemmTunableOp_Half_TN,tn_8192_4066_8192,Gemm_Rocblas_621286693,0.904126
GemmTunableOp_Half_TN,tn_28672_3562_4096,Gemm_Hipblaslt_TN_9827,1.38723
GemmTunableOp_Half_TN,tn_8192_4096_28672,Gemm_Rocblas_621294648,3.49302
GemmTunableOp_Half_TN,tn_10240_2315_8192,Gemm_Rocblas_621294320,0.681018
GemmTunableOp_Half_TN,tn_6144_1859_4096,Gemm_Hipblaslt_TN_9799,0.16558
GemmTunableOp_Half_TN,tn_8192_65_28672,Gemm_Hipblaslt_TN_8899,0.172446
GemmTunableOp_Half_TN,tn_28672_3652_4096,Gemm_Hipblaslt_TN_9827,1.49931
GemmTunableOp_Half_TN,tn_4096_1642_14336,Gemm_Hipblaslt_TN_9671,0.364986
GemmTunableOp_Half_TN,tn_8192_29_8192,Gemm_Hipblaslt_TN_9410,0.0332305
GemmTunableOp_Half_TN,tn_4096_5605_14336,Gemm_Hipblaslt_TN_9709,1.16944
GemmTunableOp_Half_TN,tn_6144_7340_4096,Gemm_Rocblas_621294420,0.626194
GemmTunableOp_Half_TN,tn_28672_192_4096,Gemm_Hipblaslt_TN_7286,0.096823
GemmTunableOp_Half_TN,tn_28672_3410_4096,Gemm_Hipblaslt_TN_9827,1.36191
GemmTunableOp_Half_TN,tn_28672_1596_4096,Gemm_Rocblas_621294420,0.705831
GemmTunableOp_Half_TN,tn_4096_6708_4096,Gemm_Hipblaslt_TN_9221,0.386806
GemmTunableOp_Half_TN,tn_128256_100_4096,Gemm_Rocblas_621286644,0.395894
GemmTunableOp_Half_TN,tn_8192_31_8192,Gemm_Hipblaslt_TN_9410,0.0334827
GemmTunableOp_Half_TN,tn_6144_1810_4096,Gemm_Hipblaslt_TN_9799,0.164969
GemmTunableOp_Half_TN,tn_6144_1780_4096,Gemm_Hipblaslt_TN_9672,0.164738
GemmTunableOp_Half_TN,tn_128256_210_4096,Gemm_Hipblaslt_TN_9893,0.551979
GemmTunableOp_Half_TN,tn_8192_29_28672,Gemm_Rocblas_621286354,0.131342
GemmTunableOp_Half_TN,tn_4096_1981_14336,Gemm_Hipblaslt_TN_9645,0.426141
GemmTunableOp_Half_TN,tn_8192_63_8192,Gemm_Hipblaslt_TN_7484,0.0397335
GemmTunableOp_Half_TN,tn_10240_2158_8192,Gemm_Rocblas_621286580,0.647966
GemmTunableOp_Half_TN,tn_10240_2193_8192,Gemm_Rocblas_621286580,0.648717
GemmTunableOp_Half_TN,tn_4096_3622_14336,Gemm_Hipblaslt_TN_9139,0.697668
GemmTunableOp_Half_TN,tn_4096_1928_4096,Gemm_Hipblaslt_TN_9590,0.124482
GemmTunableOp_Half_TN,tn_4096_3559_4096,Gemm_Hipblaslt_TN_9192,0.203541
GemmTunableOp_Half_TN,tn_4096_6721_14336,Gemm_Hipblaslt_TN_9743,1.37481
GemmTunableOp_Half_TN,tn_28672_1869_4096,Gemm_Hipblaslt_TN_9684,0.795433
GemmTunableOp_Half_TN,tn_28672_1658_4096,Gemm_Rocblas_621294420,0.7102
GemmTunableOp_Half_TN,tn_128256_199_4096,Gemm_Rocblas_621286797,0.547178
GemmTunableOp_Half_TN,tn_57344_2369_8192,Gemm_Rocblas_621294543,4.43659
GemmTunableOp_Half_TN,tn_8192_2370_28672,Gemm_Hipblaslt_TN_9771,2.32391
GemmTunableOp_Half_TN,tn_8192_2128_8192,Gemm_Hipblaslt_TN_9742,0.50932
GemmTunableOp_Half_TN,tn_4096_1928_14336,Gemm_Hipblaslt_TN_9134,0.416452
GemmTunableOp_Half_TN,tn_10240_2284_8192,Gemm_Hipblaslt_TN_9697,0.668165
GemmTunableOp_Half_TN,tn_4096_1894_4096,Gemm_Hipblaslt_TN_9620,0.123658
GemmTunableOp_Half_TN,tn_4096_3793_14336,Gemm_Hipblaslt_TN_9713,0.723875
GemmTunableOp_Half_TN,tn_57344_2145_8192,Gemm_Hipblaslt_TN_9827,4.06051
GemmTunableOp_Half_TN,tn_6144_7109_4096,Gemm_Hipblaslt_TN_9743,0.603874
GemmTunableOp_Half_TN,tn_10240_59_8192,Gemm_Hipblaslt_TN_9304,0.0477847
GemmTunableOp_Half_TN,tn_4096_3582_4096,Gemm_Hipblaslt_TN_9743,0.201598
GemmTunableOp_Half_TN,tn_8192_2028_8192,Gemm_Hipblaslt_TN_9742,0.480487
GemmTunableOp_Half_TN,tn_6144_1627_4096,Gemm_Rocblas_621294306,0.150933
GemmTunableOp_Half_TN,tn_6144_7730_4096,Gemm_Hipblaslt_TN_9220,0.652387
GemmTunableOp_Half_TN,tn_6144_136_4096,Gemm_Hipblaslt_TN_9474,0.0264229
GemmTunableOp_Half_TN,tn_8192_2321_28672,Gemm_Hipblaslt_TN_9771,2.30647
GemmTunableOp_Half_TN,tn_28672_3706_4096,Gemm_Hipblaslt_TN_9827,1.51265
GemmTunableOp_Half_TN,tn_4096_1711_14336,Gemm_Hipblaslt_TN_9607,0.368797
GemmTunableOp_Half_TN,tn_4096_1706_4096,Gemm_Hipblaslt_TN_9616,0.105524
GemmTunableOp_Half_TN,tn_6144_1609_4096,Gemm_Hipblaslt_TN_9570,0.150933
GemmTunableOp_Half_TN,tn_10240_4050_8192,Gemm_Hipblaslt_TN_9743,1.16619
GemmTunableOp_Half_TN,tn_4096_3588_4096,Gemm_Hipblaslt_TN_9221,0.203716
GemmTunableOp_Half_TN,tn_8192_4000_8192,Gemm_Hipblaslt_TN_9704,0.886214
GemmTunableOp_Half_TN,tn_8192_58_8192,Gemm_Hipblaslt_TN_7484,0.0394173
GemmTunableOp_Half_TN,tn_4096_3651_4096,Gemm_Hipblaslt_TN_9191,0.210435
GemmTunableOp_Half_TN,tn_8192_2305_28672,Gemm_Hipblaslt_TN_9771,2.31129
GemmTunableOp_Half_TN,tn_28672_1854_4096,Gemm_Hipblaslt_TN_9684,0.78494
GemmTunableOp_Half_TN,tn_4096_3764_14336,Gemm_Hipblaslt_TN_9217,0.726195
GemmTunableOp_Half_TN,tn_4096_1813_4096,Gemm_Hipblaslt_TN_9645,0.120065
GemmTunableOp_Half_TN,tn_6144_1698_4096,Gemm_Hipblaslt_TN_9570,0.155635
GemmTunableOp_Half_TN,tn_6144_1924_4096,Gemm_Hipblaslt_TN_9187,0.178006
GemmTunableOp_Half_TN,tn_6144_5410_4096,Gemm_Hipblaslt_TN_9704,0.45099
GemmTunableOp_Half_TN,tn_57344_2065_8192,Gemm_Rocblas_621294543,3.93072
GemmTunableOp_Half_TN,tn_8192_2337_28672,Gemm_Hipblaslt_TN_9771,2.29596
GemmTunableOp_Half_TN,tn_6144_3764_4096,Gemm_Hipblaslt_TN_9672,0.335091
GemmTunableOp_Half_TN,tn_4096_1727_14336,Gemm_Hipblaslt_TN_9164,0.368289
GemmTunableOp_Half_TN,tn_128256_249_4096,Gemm_Rocblas_621286892,0.582945
GemmTunableOp_Half_TN,tn_4096_1823_14336,Gemm_Hipblaslt_TN_9268,0.408685
GemmTunableOp_Half_TN,tn_57344_2321_8192,Gemm_Hipblaslt_TN_9733,4.50152
GemmTunableOp_Half_TN,tn_6144_200_4096,Gemm_Hipblaslt_TN_9495,0.0330522
GemmTunableOp_Half_TN,tn_10240_2415_8192,Gemm_Hipblaslt_TN_9697,0.700627
GemmTunableOp_Half_TN,tn_57344_4017_8192,Gemm_Rocblas_621294648,6.72817
GemmTunableOp_Half_TN,tn_10240_29_8192,Gemm_Hipblaslt_TN_9415,0.0401509
GemmTunableOp_Half_TN,tn_10240_56_8192,Gemm_Hipblaslt_TN_9304,0.046841
GemmTunableOp_Half_TN,tn_6144_6971_4096,Gemm_Hipblaslt_TN_9814,0.597246
GemmTunableOp_Half_TN,tn_4096_3781_14336,Gemm_Hipblaslt_TN_9827,0.724493
GemmTunableOp_Half_TN,tn_8192_54_8192,Gemm_Hipblaslt_TN_7484,0.0388619
GemmTunableOp_Half_TN,tn_28672_1823_4096,Gemm_Hipblaslt_TN_9683,0.789014
GemmTunableOp_Half_TN,tn_8192_4017_8192,Gemm_Hipblaslt_TN_9223,0.888316
GemmTunableOp_Half_TN,tn_8192_2000_28672,Gemm_Hipblaslt_TN_9593,1.74644
GemmTunableOp_Half_TN,tn_8192_2082_28672,Gemm_Hipblaslt_TN_9762,2.04768
GemmTunableOp_Half_TN,tn_128256_165_4096,Gemm_Hipblaslt_TN_9952,0.495088
GemmTunableOp_Half_TN,tn_6144_6715_4096,Gemm_Hipblaslt_TN_9814,0.577005
GemmTunableOp_Half_TN,tn_128256_91_4096,Gemm_Hipblaslt_TN_9058,0.372409
GemmTunableOp_Half_TN,tn_8192_2081_28672,Gemm_Hipblaslt_TN_9762,2.05618
GemmTunableOp_Half_TN,tn_6144_1760_4096,Gemm_Rocblas_621286684,0.155903
GemmTunableOp_Half_TN,tn_4096_3666_4096,Gemm_Hipblaslt_TN_9827,0.212762
GemmTunableOp_Half_TN,tn_28672_3612_4096,Gemm_Hipblaslt_TN_9832,1.47596
GemmTunableOp_Half_TN,tn_4096_1597_14336,Gemm_Hipblaslt_TN_9265,0.359642
GemmTunableOp_Half_TN,tn_6144_3622_4096,Gemm_Rocblas_621286566,0.314123
GemmTunableOp_Half_TN,tn_4096_3369_4096,Gemm_Hipblaslt_TN_9697,0.195788
GemmTunableOp_Half_TN,tn_28672_1766_4096,Gemm_Hipblaslt_TN_9184,0.735479
GemmTunableOp_Half_TN,tn_57344_2097_8192,Gemm_Hipblaslt_TN_9716,4.02541
GemmTunableOp_Half_TN,tn_28672_1872_4096,Gemm_Hipblaslt_TN_9684,0.796912
GemmTunableOp_Half_TN,tn_57344_65_8192,Gemm_Hipblaslt_TN_9478,0.328391
GemmTunableOp_Half_TN,tn_4096_200_14336,Gemm_Hipblaslt_TN_9363,0.0677909
GemmTunableOp_Half_TN,tn_8192_2417_28672,Gemm_Hipblaslt_TN_9771,2.34954
GemmTunableOp_Half_TN,tn_57344_2397_8192,Default,4.30063
GemmTunableOp_Half_TN,tn_128256_13_4096,Gemm_Rocblas_621294224,0.283364
GemmTunableOp_Half_TN,tn_10240_2369_8192,Gemm_Hipblaslt_TN_9182,0.688065
GemmTunableOp_Half_TN,tn_10240_4017_8192,Gemm_Hipblaslt_TN_9743,1.1309
GemmTunableOp_Half_TN,tn_10240_2302_8192,Gemm_Hipblaslt_TN_9677,0.673709
GemmTunableOp_Half_TN,tn_4096_56_4096,Gemm_Rocblas_621286428,0.013501
GemmTunableOp_Half_TN,tn_6144_5285_4096,Gemm_Hipblaslt_TN_9753,0.443179
GemmTunableOp_Half_TN,tn_4096_1825_14336,Gemm_Hipblaslt_TN_9268,0.406401
GemmTunableOp_Half_TN,tn_4096_3547_14336,Gemm_Hipblaslt_TN_9743,0.687729
GemmTunableOp_Half_TN,tn_6144_1879_4096,Gemm_Hipblaslt_TN_9691,0.167835
GemmTunableOp_Half_TN,tn_28672_1648_4096,Gemm_Rocblas_621294330,0.71296
GemmTunableOp_Half_TN,tn_28672_7345_4096,Gemm_Hipblaslt_TN_159,2.85846
GemmTunableOp_Half_TN,tn_57344_31_8192,Gemm_Hipblaslt_TN_9424,0.273995
GemmTunableOp_Half_TN,tn_28672_1708_4096,Gemm_Rocblas_621286590,0.724602
GemmTunableOp_Half_TN,tn_128256_186_4096,Gemm_Hipblaslt_TN_9952,0.506889
GemmTunableOp_Half_TN,tn_57344_2337_8192,Gemm_Hipblaslt_TN_9827,4.48775
GemmTunableOp_Half_TN,tn_8192_4066_28672,Gemm_Rocblas_621294643,3.49054
GemmTunableOp_Half_TN,tn_8192_2160_28672,Gemm_Hipblaslt_TN_9762,2.06568
GemmTunableOp_Half_TN,tn_8192_4033_28672,Gemm_Rocblas_621286768,3.45624
GemmTunableOp_Half_TN,tn_32000_31_8192,Gemm_Rocblas_621294578,0.15145
GemmTunableOp_Half_TN,tn_6144_1892_4096,Gemm_Hipblaslt_TN_9690,0.167872
GemmTunableOp_Half_TN,tn_8192_2178_8192,Gemm_Hipblaslt_TN_9742,0.517116
GemmTunableOp_Half_TN,tn_8192_2097_28672,Gemm_Hipblaslt_TN_9762,2.04058
GemmTunableOp_Half_TN,tn_4096_5381_4096,Gemm_Rocblas_621294320,0.326756
GemmTunableOp_Half_TN,tn_4096_6871_4096,Gemm_Hipblaslt_TN_9677,0.391525
GemmTunableOp_Half_TN,tn_8192_28_8192,Gemm_Hipblaslt_TN_9410,0.0333251
GemmTunableOp_Half_TN,tn_4096_1977_14336,Gemm_Hipblaslt_TN_9680,0.421661
GemmTunableOp_Half_TN,tn_28672_3478_4096,Gemm_Hipblaslt_TN_9841,1.37771
GemmTunableOp_Half_TN,tn_4096_6881_4096,Gemm_Hipblaslt_TN_9862,0.395785
GemmTunableOp_Half_TN,tn_6144_3515_4096,Gemm_Hipblaslt_TN_9570,0.314499
GemmTunableOp_Half_TN,tn_28672_5277_4096,Gemm_Hipblaslt_TN_9933,2.12516
GemmTunableOp_Half_TN,tn_4096_1603_14336,Gemm_Hipblaslt_TN_9671,0.360112
GemmTunableOp_Half_TN,tn_28672_1735_4096,Gemm_Rocblas_621286678,0.731942
GemmTunableOp_Half_TN,tn_10240_2097_8192,Gemm_Rocblas_621294314,0.640834
GemmTunableOp_Half_TN,tn_10240_66_8192,Gemm_Hipblaslt_TN_9304,0.0492391
GemmTunableOp_Half_TN,tn_4096_6870_14336,Gemm_Hipblaslt_TN_9694,1.3813
GemmTunableOp_Half_TN,tn_10240_2145_8192,Gemm_Hipblaslt_TN_9182,0.643211
GemmTunableOp_Half_TN,tn_8192_68_28672,Gemm_Hipblaslt_TN_8168,0.173609
GemmTunableOp_Half_TN,tn_28672_72_4096,Gemm_Rocblas_621286719,0.0569115
GemmTunableOp_Half_TN,tn_10240_4033_8192,Gemm_Hipblaslt_TN_9743,1.14466
GemmTunableOp_Half_TN,tn_4096_1815_4096,Gemm_Hipblaslt_TN_9645,0.120259
GemmTunableOp_Half_TN,tn_4096_3647_14336,Gemm_Hipblaslt_TN_9682,0.694711
GemmTunableOp_Half_TN,tn_57344_67_8192,Gemm_Rocblas_621294520,0.331018
GemmTunableOp_Half_TN,tn_4096_3781_4096,Gemm_Hipblaslt_TN_9841,0.213203
GemmTunableOp_Half_TN,tn_4096_1963_4096,Gemm_Hipblaslt_TN_9174,0.124088
GemmTunableOp_Half_TN,tn_6144_1931_4096,Gemm_Hipblaslt_TN_9189,0.177836
GemmTunableOp_Half_TN,tn_4096_5359_14336,Gemm_Hipblaslt_TN_9799,1.11743
GemmTunableOp_Half_TN,tn_6144_1794_4096,Gemm_Hipblaslt_TN_9690,0.164832
GemmTunableOp_Half_TN,tn_4096_5319_14336,Gemm_Hipblaslt_TN_9799,1.10602
GemmTunableOp_Half_TN,tn_8192_2238_8192,Gemm_Hipblaslt_TN_9742,0.526209
GemmTunableOp_Half_TN,tn_6144_1610_4096,Gemm_Hipblaslt_TN_9570,0.149408
GemmTunableOp_Half_TN,tn_128256_170_4096,Gemm_Hipblaslt_TN_9752,0.495169
GemmTunableOp_Half_TN,tn_10240_2028_8192,Gemm_Rocblas_621294309,0.608805
GemmTunableOp_Half_TN,tn_4096_1828_4096,Gemm_Hipblaslt_TN_9645,0.121497
GemmTunableOp_Half_TN,tn_57344_2192_8192,Default,3.93266
GemmTunableOp_Half_TN,tn_6144_144_4096,Gemm_Hipblaslt_TN_9127,0.0270681
GemmTunableOp_Half_TN,tn_6144_7171_4096,Gemm_Hipblaslt_TN_9697,0.606188
GemmTunableOp_Half_TN,tn_28672_1600_4096,Gemm_Rocblas_621294426,0.695901
GemmTunableOp_Half_TN,tn_128256_173_4096,Gemm_Hipblaslt_TN_9952,0.497385
GemmTunableOp_Half_TN,tn_4096_3373_14336,Gemm_Hipblaslt_TN_9139,0.662853
GemmTunableOp_Half_TN,tn_8192_2160_8192,Gemm_Hipblaslt_TN_9742,0.515775
GemmTunableOp_Half_TN,tn_10240_57_8192,Gemm_Hipblaslt_TN_7492,0.0469115
GemmTunableOp_Half_TN,tn_128256_185_4096,Gemm_Hipblaslt_TN_9818,0.507324
GemmTunableOp_Half_TN,tn_6144_1896_4096,Gemm_Rocblas_621294316,0.169122
GemmTunableOp_Half_TN,tn_6144_5267_4096,Gemm_Hipblaslt_TN_9959,0.442067
GemmTunableOp_Half_TN,tn_128256_216_4096,Gemm_Hipblaslt_TN_9653,0.5582
GemmTunableOp_Half_TN,tn_4096_1898_14336,Gemm_Hipblaslt_TN_9620,0.417507
GemmTunableOp_Half_TN,tn_8192_2304_8192,Gemm_Hipblaslt_TN_9742,0.525044
GemmTunableOp_Half_TN,tn_32000_61_8192,Gemm_Rocblas_621294203,0.166098
GemmTunableOp_Half_TN,tn_28672_3508_4096,Gemm_Hipblaslt_TN_9827,1.37589
GemmTunableOp_Half_TN,tn_4096_7171_4096,Gemm_Hipblaslt_TN_9743,0.407278
GemmTunableOp_Half_TN,tn_128256_132_4096,Gemm_Hipblaslt_TN_9108,0.441567
GemmTunableOp_Half_TN,tn_4096_3722_4096,Gemm_Hipblaslt_TN_9827,0.212758
GemmTunableOp_Half_TN,tn_10240_2049_8192,Gemm_Hipblaslt_TN_9729,0.6178
GemmTunableOp_Half_TN,tn_8192_2257_8192,Gemm_Hipblaslt_TN_9763,0.520089
GemmTunableOp_Half_TN,tn_32000_28_8192,Gemm_Rocblas_621294193,0.147415
GemmTunableOp_Half_TN,tn_57344_59_8192,Gemm_Rocblas_621286467,0.305634
GemmTunableOp_Half_TN,tn_28672_1871_4096,Gemm_Hipblaslt_TN_9683,0.795096
GemmTunableOp_Half_TN,tn_4096_1698_4096,Gemm_Hipblaslt_TN_9164,0.107137
GemmTunableOp_Half_TN,tn_4096_3682_14336,Gemm_Hipblaslt_TN_9841,0.716347
GemmTunableOp_Half_TN,tn_28672_1969_4096,Gemm_Hipblaslt_TN_9846,0.8408
GemmTunableOp_Half_TN,tn_128256_40_4096,Gemm_Hipblaslt_TN_9451,0.304974
GemmTunableOp_Half_TN,tn_28672_1748_4096,Gemm_Hipblaslt_TN_9223,0.728979
GemmTunableOp_Half_TN,tn_4096_120_14336,Gemm_Hipblaslt_TN_7160,0.0472913
GemmTunableOp_Half_TN,tn_8192_55_28672,Gemm_Rocblas_621294228,0.146562
GemmTunableOp_Half_TN,tn_128256_31_4096,Gemm_Hipblaslt_TN_9451,0.301724
GemmTunableOp_Half_TN,tn_128256_65_4096,Gemm_Hipblaslt_TN_9057,0.349839
GemmTunableOp_Half_TN,tn_4096_1686_14336,Gemm_Hipblaslt_TN_9671,0.367401
GemmTunableOp_Half_TN,tn_28672_5223_4096,Gemm_Hipblaslt_TN_9904,2.09923
GemmTunableOp_Half_TN,tn_4096_80_4096,Gemm_Rocblas_621286279,0.0152011
GemmTunableOp_Half_TN,tn_57344_2190_8192,Gemm_Rocblas_621294542,4.03372
GemmTunableOp_Half_TN,tn_28672_5495_4096,Gemm_Hipblaslt_TN_9865,2.29816
GemmTunableOp_Half_TN,tn_128256_81_4096,Gemm_Hipblaslt_TN_9057,0.358521
GemmTunableOp_Half_TN,tn_4096_1801_14336,Gemm_Hipblaslt_TN_9137,0.407784
GemmTunableOp_Half_TN,tn_4096_1627_4096,Gemm_Hipblaslt_TN_9180,0.104452
GemmTunableOp_Half_TN,tn_8192_4048_28672,Gemm_Hipblaslt_TN_9593,3.47274
GemmTunableOp_Half_TN,tn_8192_60_28672,Gemm_Rocblas_621294228,0.146591
GemmTunableOp_Half_TN,tn_6144_7432_4096,Gemm_Rocblas_621294420,0.63709
GemmTunableOp_Half_TN,tn_128256_156_4096,Gemm_Rocblas_621294305,0.461004
GemmTunableOp_Half_TN,tn_4096_216_14336,Gemm_Hipblaslt_TN_9303,0.0698795
GemmTunableOp_Half_TN,tn_57344_2127_8192,Default,3.91776
GemmTunableOp_Half_TN,tn_4096_1930_14336,Gemm_Hipblaslt_TN_9645,0.418298
GemmTunableOp_Half_TN,tn_28672_1934_4096,Gemm_Hipblaslt_TN_9846,0.840301
GemmTunableOp_Half_TN,tn_128256_226_4096,Gemm_Rocblas_621286892,0.562692
GemmTunableOp_Half_TN,tn_128256_62_4096,Gemm_Hipblaslt_TN_9146,0.337729
GemmTunableOp_Half_TN,tn_4096_1953_14336,Gemm_Hipblaslt_TN_9136,0.421606
GemmTunableOp_Half_TN,tn_4096_7047_14336,Gemm_Hipblaslt_TN_9743,1.41962
GemmTunableOp_Half_TN,tn_28672_1786_4096,Gemm_Hipblaslt_TN_9191,0.739587
GemmTunableOp_Half_TN,tn_10240_55_8192,Gemm_Hipblaslt_TN_7492,0.047251
GemmTunableOp_Half_TN,tn_4096_3383_14336,Gemm_Hipblaslt_TN_9139,0.667326
GemmTunableOp_Half_TN,tn_4096_7021_4096,Gemm_Hipblaslt_TN_9221,0.399963
GemmTunableOp_Half_TN,tn_128256_227_4096,Gemm_Rocblas_621286892,0.565962
GemmTunableOp_Half_TN,tn_4096_3612_4096,Gemm_Hipblaslt_TN_9743,0.200279
GemmTunableOp_Half_TN,tn_4096_7301_4096,Gemm_Hipblaslt_TN_9914,0.419919
GemmTunableOp_Half_TN,tn_4096_1673_4096,Gemm_Hipblaslt_TN_9607,0.108266
GemmTunableOp_Half_TN,tn_6144_7186_4096,Gemm_Hipblaslt_TN_9743,0.592992
GemmTunableOp_Half_TN,tn_4096_5723_4096,Gemm_Rocblas_621294320,0.339506
GemmTunableOp_Half_TN,tn_4096_3401_14336,Gemm_Hipblaslt_TN_9832,0.664733
GemmTunableOp_Half_TN,tn_28672_3629_4096,Gemm_Hipblaslt_TN_9832,1.4767
GemmTunableOp_Half_TN,tn_28672_3630_4096,Gemm_Hipblaslt_TN_9828,1.48356
GemmTunableOp_Half_TN,tn_6144_1684_4096,Gemm_Hipblaslt_TN_9570,0.150428
GemmTunableOp_Half_TN,tn_28672_6715_4096,Gemm_Hipblaslt_TN_9955,2.6813
GemmTunableOp_Half_TN,tn_8192_2017_8192,Gemm_Hipblaslt_TN_9742,0.478657
GemmTunableOp_Half_TN,tn_4096_6996_4096,Gemm_Hipblaslt_TN_9743,0.397814
GemmTunableOp_Half_TN,tn_28672_6868_4096,Gemm_Hipblaslt_TN_9943,2.80982
GemmTunableOp_Half_TN,tn_28672_5412_4096,Gemm_Hipblaslt_TN_9852,2.25725
GemmTunableOp_Half_TN,tn_28672_160_4096,Gemm_Hipblaslt_TN_9357,0.0871146
GemmTunableOp_Half_TN,tn_6144_6989_4096,Gemm_Hipblaslt_TN_9188,0.594769
GemmTunableOp_Half_TN,tn_4096_7027_14336,Gemm_Hipblaslt_TN_9814,1.41596
GemmTunableOp_Half_TN,tn_4096_6952_4096,Gemm_Hipblaslt_TN_9814,0.397436
GemmTunableOp_Half_TN,tn_6144_3526_4096,Gemm_Rocblas_621294495,0.315922
GemmTunableOp_Half_TN,tn_128256_248_4096,Gemm_Rocblas_621286892,0.585484
GemmTunableOp_Half_TN,tn_4096_3602_14336,Gemm_Hipblaslt_TN_9743,0.694853
GemmTunableOp_Half_TN,tn_4096_1752_14336,Gemm_Hipblaslt_TN_9645,0.394773
GemmTunableOp_Half_TN,tn_28672_1830_4096,Gemm_Hipblaslt_TN_9683,0.792457
GemmTunableOp_Half_TN,tn_4096_64_14336,Gemm_Rocblas_621294163,0.0351231
GemmTunableOp_Half_TN,tn_28672_1873_4096,Gemm_Hipblaslt_TN_9683,0.796631
GemmTunableOp_Half_TN,tn_4096_1781_14336,Gemm_Hipblaslt_TN_9645,0.400533
GemmTunableOp_Half_TN,tn_6144_256_4096,Gemm_Hipblaslt_TN_9516,0.0362751
GemmTunableOp_Half_TN,tn_4096_1879_14336,Gemm_Hipblaslt_TN_9134,0.413681
GemmTunableOp_Half_TN,tn_6144_6744_4096,Gemm_Hipblaslt_TN_9743,0.584208
GemmTunableOp_Half_TN,tn_4096_7067_4096,Gemm_Hipblaslt_TN_9743,0.397463
GemmTunableOp_Half_TN,tn_4096_7190_4096,Gemm_Hipblaslt_TN_9743,0.404029
GemmTunableOp_Half_TN,tn_4096_1625_14336,Gemm_Hipblaslt_TN_9671,0.36446
GemmTunableOp_Half_TN,tn_28672_5352_4096,Gemm_Hipblaslt_TN_9933,2.14399
GemmTunableOp_Half_TN,tn_6144_7478_4096,Gemm_Rocblas_621294127,0.634707
GemmTunableOp_Half_TN,tn_4096_7027_4096,Gemm_Hipblaslt_TN_9743,0.399322
GemmTunableOp_Half_TN,tn_128256_235_4096,Gemm_Rocblas_621294634,0.578885
GemmTunableOp_Half_TN,tn_6144_1770_4096,Gemm_Hipblaslt_TN_9672,0.163039
GemmTunableOp_Half_TN,tn_4096_7327_4096,Gemm_Hipblaslt_TN_9869,0.41935
GemmTunableOp_Half_TN,tn_8192_2255_8192,Gemm_Hipblaslt_TN_9763,0.526918
GemmTunableOp_Half_TN,tn_28672_3573_4096,Gemm_Hipblaslt_TN_9827,1.39621
GemmTunableOp_Half_TN,tn_28672_7077_4096,Gemm_Hipblaslt_TN_159,2.83387
GemmTunableOp_Half_TN,tn_28672_7568_4096,Gemm_Hipblaslt_TN_159,2.954
GemmTunableOp_Half_TN,tn_128256_108_4096,Gemm_Rocblas_621286584,0.399785
GemmTunableOp_Half_TN,tn_6144_7386_4096,Gemm_Rocblas_621294330,0.62281
GemmTunableOp_Half_TN,tn_128256_106_4096,Gemm_Rocblas_621286644,0.39841
GemmTunableOp_Half_TN,tn_8192_2128_28672,Gemm_Hipblaslt_TN_9762,2.05446
GemmTunableOp_Half_TN,tn_6144_3767_4096,Gemm_Hipblaslt_TN_9687,0.33648
GemmTunableOp_Half_TN,tn_6144_160_4096,Gemm_Rocblas_621294171,0.0281104
GemmTunableOp_Half_TN,tn_4096_1842_4096,Gemm_Hipblaslt_TN_9645,0.121798
GemmTunableOp_Half_TN,tn_4096_1888_14336,Gemm_Hipblaslt_TN_9645,0.41363
GemmTunableOp_Half_TN,tn_4096_7072_14336,Gemm_Hipblaslt_TN_9743,1.413
GemmTunableOp_Half_TN,tn_6144_1839_4096,Gemm_Hipblaslt_TN_9672,0.165735
GemmTunableOp_Half_TN,tn_28672_8192_4096,Gemm_Hipblaslt_TN_159,3.28073
GemmTunableOp_Half_TN,tn_28672_3511_4096,Gemm_Hipblaslt_TN_9827,1.37894
GemmTunableOp_Half_TN,tn_128256_203_4096,Gemm_Hipblaslt_TN_9654,0.543286
GemmTunableOp_Half_TN,tn_4096_3688_4096,Gemm_Rocblas_621294030,0.210953
GemmTunableOp_Half_TN,tn_28672_7267_4096,Gemm_Hipblaslt_TN_159,2.84607
GemmTunableOp_Half_TN,tn_28672_1608_4096,Gemm_Rocblas_621294484,0.704681
GemmTunableOp_Half_TN,tn_28672_7364_4096,Gemm_Hipblaslt_TN_159,2.86063
GemmTunableOp_Half_TN,tn_4096_3773_4096,Gemm_Hipblaslt_TN_9827,0.214015
GemmTunableOp_Half_TN,tn_6144_24_4096,Gemm_Rocblas_621294155,0.0139845
GemmTunableOp_Half_TN,tn_4096_5136_14336,Gemm_Hipblaslt_TN_9681,1.07859
GemmTunableOp_Half_TN,tn_6144_104_4096,Gemm_Rocblas_621286444,0.0235248
GemmTunableOp_Half_TN,tn_4096_5273_4096,Gemm_Rocblas_621286684,0.321835
GemmTunableOp_Half_TN,tn_28672_1769_4096,Gemm_Rocblas_621286678,0.737227
GemmTunableOp_Half_TN,tn_4096_7139_14336,Gemm_Hipblaslt_TN_9743,1.43971
GemmTunableOp_Half_TN,tn_4096_1779_4096,Gemm_Hipblaslt_TN_9134,0.117556
GemmTunableOp_Half_TN,tn_4096_1772_14336,Gemm_Hipblaslt_TN_9645,0.396125
GemmTunableOp_Half_TN,tn_128256_194_4096,Gemm_Rocblas_621286892,0.540018
GemmTunableOp_Half_TN,tn_6144_1665_4096,Gemm_Hipblaslt_TN_9570,0.152679
GemmTunableOp_Half_TN,tn_6144_7136_4096,Gemm_Hipblaslt_TN_9743,0.604982
GemmTunableOp_Half_TN,tn_4096_1877_4096,Gemm_Hipblaslt_TN_9645,0.122807
GemmTunableOp_Half_TN,tn_28672_16_4096,Gemm_Rocblas_621294053,0.0448771
GemmTunableOp_Half_TN,tn_28672_3722_4096,Gemm_Hipblaslt_TN_9827,1.50844
GemmTunableOp_Half_TN,tn_4096_1829_4096,Gemm_Hipblaslt_TN_9645,0.120406
GemmTunableOp_Half_TN,tn_4096_5196_4096,Gemm_Hipblaslt_TN_9729,0.321142
GemmTunableOp_Half_TN,tn_28672_7206_4096,Gemm_Hipblaslt_TN_159,2.81903
GemmTunableOp_Half_TN,tn_4096_1854_14336,Gemm_Hipblaslt_TN_9137,0.411478
GemmTunableOp_Half_TN,tn_4096_1790_4096,Gemm_Hipblaslt_TN_9134,0.117607
GemmTunableOp_Half_TN,tn_6144_3578_4096,Gemm_Rocblas_621286753,0.31818
GemmTunableOp_Half_TN,tn_4096_208_4096,Gemm_Rocblas_621294171,0.0256792
GemmTunableOp_Half_TN,tn_6144_1908_4096,Gemm_Hipblaslt_TN_9799,0.168521
GemmTunableOp_Half_TN,tn_128256_16_4096,Gemm_Rocblas_621294224,0.28496
GemmTunableOp_Half_TN,tn_4096_7196_14336,Gemm_Hipblaslt_TN_9743,1.42633
GemmTunableOp_Half_TN,tn_28672_7344_4096,Gemm_Hipblaslt_TN_9888,2.91096
GemmTunableOp_Half_TN,tn_4096_1958_14336,Gemm_Hipblaslt_TN_9680,0.422602
GemmTunableOp_Half_TN,tn_6144_1764_4096,Gemm_Hipblaslt_TN_9690,0.164017
GemmTunableOp_Half_TN,tn_8192_30_8192,Gemm_Hipblaslt_TN_9410,0.0333711
GemmTunableOp_Half_TN,tn_4096_1573_4096,Gemm_Hipblaslt_TN_9587,0.104218
GemmTunableOp_Half_TN,tn_4096_1757_4096,Gemm_Hipblaslt_TN_9590,0.117503
GemmTunableOp_Half_TN,tn_6144_6902_4096,Gemm_Hipblaslt_TN_9814,0.588736
GemmTunableOp_Half_TN,tn_4096_3652_4096,Gemm_Hipblaslt_TN_9827,0.211587
GemmTunableOp_Half_TN,tn_28672_7138_4096,Gemm_Hipblaslt_TN_159,2.84956
GemmTunableOp_Half_TN,tn_4096_7340_14336,Gemm_Hipblaslt_TN_9749,1.51366
GemmTunableOp_Half_TN,tn_4096_7267_14336,Gemm_Hipblaslt_TN_9743,1.44287
GemmTunableOp_Half_TN,tn_6144_1946_4096,Gemm_Hipblaslt_TN_9697,0.17903
GemmTunableOp_Half_TN,tn_4096_1883_14336,Gemm_Hipblaslt_TN_9620,0.4141
GemmTunableOp_Half_TN,tn_4096_1960_4096,Gemm_Hipblaslt_TN_9134,0.125112
GemmTunableOp_Half_TN,tn_4096_5354_4096,Gemm_Hipblaslt_TN_9924,0.32605
GemmTunableOp_Half_TN,tn_4096_3466_14336,Gemm_Hipblaslt_TN_9677,0.672166
GemmTunableOp_Half_TN,tn_28672_6744_4096,Gemm_Hipblaslt_TN_9939,2.78092
GemmTunableOp_Half_TN,tn_28672_248_4096,Gemm_Hipblaslt_TN_9669,0.124673
GemmTunableOp_Half_TN,tn_4096_3793_4096,Gemm_Hipblaslt_TN_9768,0.214911
GemmTunableOp_Half_TN,tn_28672_7072_4096,Gemm_Hipblaslt_TN_159,2.82811
GemmTunableOp_Half_TN,tn_28672_1739_4096,Gemm_Rocblas_621294435,0.730429
GemmTunableOp_Half_TN,tn_4096_1772_4096,Gemm_Hipblaslt_TN_9590,0.117245
GemmTunableOp_Half_TN,tn_4096_5470_14336,Gemm_Hipblaslt_TN_9799,1.14289
GemmTunableOp_Half_TN,tn_4096_1781_4096,Gemm_Hipblaslt_TN_9590,0.115918
GemmTunableOp_Half_TN,tn_28672_200_4096,Gemm_Hipblaslt_TN_9267,0.110776
GemmTunableOp_Half_TN,tn_4096_3652_14336,Gemm_Hipblaslt_TN_9813,0.716329
GemmTunableOp_Half_TN,tn_6144_1652_4096,Gemm_Hipblaslt_TN_9570,0.152666
GemmTunableOp_Half_TN,tn_6144_3688_4096,Gemm_Hipblaslt_TN_9687,0.331486
GemmTunableOp_Half_TN,tn_28672_1698_4096,Gemm_Rocblas_621294420,0.722425
GemmTunableOp_Half_TN,tn_6144_7325_4096,Gemm_Hipblaslt_TN_9220,0.62539
GemmTunableOp_Half_TN,tn_32000_62_8192,Gemm_Rocblas_621294204,0.163571
GemmTunableOp_Half_TN,tn_4096_6916_14336,Gemm_Hipblaslt_TN_9743,1.41164
GemmTunableOp_Half_TN,tn_4096_5680_14336,Gemm_Hipblaslt_TN_9799,1.18713
GemmTunableOp_Half_TN,tn_4096_5285_4096,Gemm_Hipblaslt_TN_9690,0.324488
GemmTunableOp_Half_TN,tn_4096_3588_14336,Gemm_Hipblaslt_TN_9187,0.692457
GemmTunableOp_Half_TN,tn_28672_1646_4096,Gemm_Rocblas_621294330,0.712216
GemmTunableOp_Half_TN,tn_28672_6773_4096,Gemm_Hipblaslt_TN_9943,2.79925
GemmTunableOp_Half_TN,tn_28672_1957_4096,Gemm_Hipblaslt_TN_9846,0.843156
GemmTunableOp_Half_TN,tn_4096_1614_14336,Gemm_Hipblaslt_TN_9671,0.358721
GemmTunableOp_Half_TN,tn_28672_176_4096,Gemm_Hipblaslt_TN_7286,0.0961791
GemmTunableOp_Half_TN,tn_4096_168_4096,Gemm_Rocblas_621294171,0.0228466
GemmTunableOp_Half_TN,tn_4096_6630_4096,Gemm_Hipblaslt_TN_9814,0.386172
GemmTunableOp_Half_TN,tn_4096_3438_14336,Gemm_Hipblaslt_TN_9139,0.668836
GemmTunableOp_Half_TN,tn_28672_5533_4096,Gemm_Hipblaslt_TN_9924,2.31708
GemmTunableOp_Half_TN,tn_128256_239_4096,Gemm_Rocblas_621294634,0.579673
GemmTunableOp_Half_TN,tn_4096_1935_4096,Gemm_Hipblaslt_TN_9134,0.122267
GemmTunableOp_Half_TN,tn_6144_1680_4096,Gemm_Rocblas_621286566,0.152414
GemmTunableOp_Half_TN,tn_6144_7403_4096,Gemm_Rocblas_621286590,0.631931
GemmTunableOp_Half_TN,tn_6144_40_4096,Gemm_Rocblas_621294029,0.0155172
GemmTunableOp_Half_TN,tn_4096_3666_14336,Gemm_Hipblaslt_TN_9813,0.716738
GemmTunableOp_Half_TN,tn_128256_80_4096,Gemm_Hipblaslt_TN_9057,0.356404
GemmTunableOp_Half_TN,tn_4096_3602_4096,Gemm_Hipblaslt_TN_9814,0.200429
GemmTunableOp_Half_TN,tn_4096_7050_14336,Gemm_Hipblaslt_TN_9694,1.40729
GemmTunableOp_Half_TN,tn_28672_1813_4096,Gemm_Hipblaslt_TN_9684,0.784597
GemmTunableOp_Half_TN,tn_4096_1682_14336,Gemm_Hipblaslt_TN_9180,0.36603
GemmTunableOp_Half_TN,tn_128256_200_4096,Gemm_Hipblaslt_TN_9738,0.544647
GemmTunableOp_Half_TN,tn_4096_1689_4096,Gemm_Hipblaslt_TN_9671,0.106905
GemmTunableOp_Half_TN,tn_6144_3583_4096,Gemm_Rocblas_621294306,0.319496
GemmTunableOp_Half_TN,tn_4096_3830_14336,Gemm_Rocblas_621294018,0.74162
GemmTunableOp_Half_TN,tn_6144_1767_4096,Gemm_Hipblaslt_TN_9672,0.164103
GemmTunableOp_Half_TN,tn_28672_7552_4096,Gemm_Hipblaslt_TN_159,2.95349
GemmTunableOp_Half_TN,tn_57344_4081_8192,Gemm_Hipblaslt_TN_9963,6.77343
GemmTunableOp_Half_TN,tn_4096_32_14336,Gemm_Hipblaslt_TN_9392,0.0273966
GemmTunableOp_Half_TN,tn_6144_5301_4096,Gemm_Hipblaslt_TN_9655,0.440255
GemmTunableOp_Half_TN,tn_4096_1864_4096,Gemm_Hipblaslt_TN_9645,0.123406
GemmTunableOp_Half_TN,tn_6144_3573_4096,Gemm_Rocblas_621294306,0.31648
GemmTunableOp_Half_TN,tn_6144_7047_4096,Gemm_Hipblaslt_TN_9188,0.599102
GemmTunableOp_Half_TN,tn_6144_3382_4096,Gemm_Hipblaslt_TN_9774,0.308875
GemmTunableOp_Half_TN,tn_28672_1767_4096,Gemm_Hipblaslt_TN_9184,0.732601
GemmTunableOp_Half_TN,tn_8192_4048_8192,Gemm_Rocblas_621286693,0.901627
GemmTunableOp_Half_TN,tn_4096_7568_4096,Gemm_Hipblaslt_TN_159,0.42699
GemmTunableOp_Half_TN,tn_6144_3768_4096,Gemm_Rocblas_621286575,0.335805
GemmTunableOp_Half_TN,tn_28672_1762_4096,Gemm_Hipblaslt_TN_9223,0.729331
GemmTunableOp_Half_TN,tn_6144_1805_4096,Gemm_Hipblaslt_TN_9690,0.164788
GemmTunableOp_Half_TN,tn_28672_184_4096,Gemm_Hipblaslt_TN_9054,0.0984989
GemmTunableOp_Half_TN,tn_4096_5157_4096,Gemm_Hipblaslt_TN_9681,0.319958
GemmTunableOp_Half_TN,tn_4096_7182_14336,Gemm_Hipblaslt_TN_9743,1.43113
GemmTunableOp_Half_TN,tn_4096_1731_4096,Gemm_Hipblaslt_TN_9590,0.116448
GemmTunableOp_Half_TN,tn_28672_3514_4096,Gemm_Hipblaslt_TN_9827,1.38162
GemmTunableOp_Half_TN,tn_28672_1787_4096,Gemm_Hipblaslt_TN_9191,0.741619
GemmTunableOp_Half_TN,tn_8192_2270_8192,Gemm_Hipblaslt_TN_9742,0.521523
GemmTunableOp_Half_TN,tn_4096_3557_4096,Gemm_Hipblaslt_TN_9188,0.204185
GemmTunableOp_Half_TN,tn_4096_7118_4096,Gemm_Hipblaslt_TN_9694,0.4088
GemmTunableOp_Half_TN,tn_128256_64_4096,Gemm_Rocblas_621294554,0.333822
GemmTunableOp_Half_TN,tn_6144_128_4096,Gemm_Rocblas_621294168,0.0235925
GemmTunableOp_Half_TN,tn_6144_1887_4096,Gemm_Hipblaslt_TN_9672,0.167176
GemmTunableOp_Half_TN,tn_28672_3401_4096,Gemm_Hipblaslt_TN_9827,1.3531
GemmTunableOp_Half_TN,tn_4096_5271_14336,Gemm_Hipblaslt_TN_9799,1.09509
GemmTunableOp_Half_TN,tn_4096_3640_14336,Gemm_Hipblaslt_TN_9187,0.697152
GemmTunableOp_Half_TN,tn_28672_7262_4096,Gemm_Hipblaslt_TN_159,2.84853
GemmTunableOp_Half_TN,tn_4096_3651_14336,Gemm_Hipblaslt_TN_9920,0.715622
GemmTunableOp_Half_TN,tn_4096_1858_4096,Gemm_Hipblaslt_TN_9645,0.122129
GemmTunableOp_Half_TN,tn_57344_2257_8192,Gemm_Rocblas_621294543,4.04115
GemmTunableOp_Half_TN,tn_28672_5498_4096,Gemm_Hipblaslt_TN_9924,2.30828
GemmTunableOp_Half_TN,tn_28672_5274_4096,Gemm_Hipblaslt_TN_159,2.12447
GemmTunableOp_Half_TN,tn_4096_7475_4096,Gemm_Hipblaslt_TN_9888,0.426344
GemmTunableOp_Half_TN,tn_4096_7191_4096,Gemm_Hipblaslt_TN_9188,0.409365
GemmTunableOp_Half_TN,tn_28672_1710_4096,Gemm_Hipblaslt_TN_9190,0.721968
GemmTunableOp_Half_TN,tn_128256_160_4096,Gemm_Hipblaslt_TN_7246,0.448359
GemmTunableOp_Half_TN,tn_28672_1863_4096,Gemm_Hipblaslt_TN_9683,0.797177
GemmTunableOp_Half_TN,tn_128256_242_4096,Gemm_Rocblas_621286905,0.581689
GemmTunableOp_Half_TN,tn_4096_1875_14336,Gemm_Hipblaslt_TN_9645,0.413024
GemmTunableOp_Half_TN,tn_6144_3383_4096,Gemm_Rocblas_621294495,0.307295
GemmTunableOp_Half_TN,tn_6144_3416_4096,Gemm_Hipblaslt_TN_9570,0.307196
GemmTunableOp_Half_TN,tn_4096_3416_14336,Gemm_Hipblaslt_TN_9832,0.670321
GemmTunableOp_Half_TN,tn_28672_5570_4096,Gemm_Hipblaslt_TN_9852,2.31678
GemmTunableOp_Half_TN,tn_4096_1936_4096,Gemm_Hipblaslt_TN_9645,0.122686
GemmTunableOp_Half_TN,tn_6144_1894_4096,Gemm_Hipblaslt_TN_9672,0.166403
GemmTunableOp_Half_TN,tn_28672_1743_4096,Gemm_Rocblas_621286678,0.730466
GemmTunableOp_Half_TN,tn_4096_5067_4096,Gemm_Rocblas_621294550,0.313832
GemmTunableOp_Half_TN,tn_28672_3592_4096,Gemm_Hipblaslt_TN_9832,1.47743
GemmTunableOp_Half_TN,tn_4096_1666_14336,Gemm_Hipblaslt_TN_9610,0.365343
GemmTunableOp_Half_TN,tn_6144_1811_4096,Gemm_Hipblaslt_TN_9799,0.165665
GemmTunableOp_Half_TN,tn_4096_1794_4096,Gemm_Hipblaslt_TN_9605,0.117692
GemmTunableOp_Half_TN,tn_128256_32_4096,Gemm_Rocblas_621294578,0.293683
GemmTunableOp_Half_TN,tn_6144_7484_4096,Gemm_Rocblas_621286742,0.635769
GemmTunableOp_Half_TN,tn_4096_3586_14336,Gemm_Hipblaslt_TN_9677,0.688639
GemmTunableOp_Half_TN,tn_128256_251_4096,Gemm_Rocblas_621286905,0.586339
GemmTunableOp_Half_TN,tn_6144_56_4096,Gemm_Rocblas_621286428,0.015947
GemmTunableOp_Half_TN,tn_8192_2239_8192,Gemm_Hipblaslt_TN_9742,0.518252
GemmTunableOp_Half_TN,tn_4096_1790_14336,Gemm_Hipblaslt_TN_9645,0.399642
GemmTunableOp_Half_TN,tn_4096_3586_4096,Gemm_Hipblaslt_TN_9683,0.203544
GemmTunableOp_Half_TN,tn_4096_7171_14336,Gemm_Hipblaslt_TN_9814,1.43003
GemmTunableOp_Half_TN,tn_4096_5583_4096,Gemm_Hipblaslt_TN_9687,0.331818
GemmTunableOp_Half_TN,tn_4096_5223_14336,Gemm_Hipblaslt_TN_9799,1.08298
GemmTunableOp_Half_TN,tn_6144_5322_4096,Gemm_Hipblaslt_TN_9655,0.441866
GemmTunableOp_Half_TN,tn_4096_3559_14336,Gemm_Hipblaslt_TN_9677,0.683989
GemmTunableOp_Half_TN,tn_6144_1784_4096,Gemm_Hipblaslt_TN_9690,0.165178
GemmTunableOp_Half_TN,tn_4096_1909_4096,Gemm_Hipblaslt_TN_9590,0.123342
GemmTunableOp_Half_TN,tn_128256_146_4096,Gemm_Hipblaslt_TN_9808,0.452296
GemmTunableOp_Half_TN,tn_28672_3582_4096,Gemm_Hipblaslt_TN_9827,1.38959
GemmTunableOp_Half_TN,tn_4096_1599_4096,Gemm_Hipblaslt_TN_9671,0.104444
GemmTunableOp_Half_TN,tn_4096_6747_14336,Gemm_Hipblaslt_TN_9743,1.3625
GemmTunableOp_Half_TN,tn_28672_1846_4096,Gemm_Hipblaslt_TN_9684,0.792789
GemmTunableOp_Half_TN,tn_4096_1890_4096,Gemm_Hipblaslt_TN_9645,0.122018
GemmTunableOp_Half_TN,tn_28672_7109_4096,Gemm_Hipblaslt_TN_159,2.82634
GemmTunableOp_Half_TN,tn_4096_1881_14336,Gemm_Hipblaslt_TN_9645,0.413955
GemmTunableOp_Half_TN,tn_6144_3494_4096,Gemm_Rocblas_621286566,0.313914
GemmTunableOp_Half_TN,tn_8192_68_8192,Gemm_Hipblaslt_TN_7508,0.0444674
GemmTunableOp_Half_TN,tn_6144_1790_4096,Gemm_Rocblas_621294425,0.163852
GemmTunableOp_Half_TN,tn_6144_1822_4096,Gemm_Hipblaslt_TN_9672,0.164387
GemmTunableOp_Half_TN,tn_4096_3526_4096,Gemm_Hipblaslt_TN_9188,0.200132
GemmTunableOp_Half_TN,tn_6144_3496_4096,Gemm_Hipblaslt_TN_9570,0.31362
GemmTunableOp_Half_TN,tn_4096_1855_14336,Gemm_Hipblaslt_TN_9137,0.410433
GemmTunableOp_Half_TN,tn_128256_90_4096,Gemm_Hipblaslt_TN_9057,0.368138
GemmTunableOp_Half_TN,tn_4096_1846_4096,Gemm_Hipblaslt_TN_9590,0.120429
GemmTunableOp_Half_TN,tn_6144_8_4096,Gemm_Rocblas_621286273,0.0129486
GemmTunableOp_Half_TN,tn_28672_1628_4096,Gemm_Rocblas_621286713,0.706553
GemmTunableOp_Half_TN,tn_4096_1721_4096,Gemm_Hipblaslt_TN_9671,0.109405
GemmTunableOp_Half_TN,tn_28672_5271_4096,Gemm_Hipblaslt_TN_159,2.12755
GemmTunableOp_Half_TN,tn_6144_1890_4096,Gemm_Hipblaslt_TN_9672,0.168126
GemmTunableOp_Half_TN,tn_4096_3478_4096,Gemm_Hipblaslt_TN_9743,0.200468
GemmTunableOp_Half_TN,tn_28672_3589_4096,Gemm_Hipblaslt_TN_9832,1.46562
GemmTunableOp_Half_TN,tn_128256_97_4096,Gemm_Hipblaslt_TN_9061,0.39274
GemmTunableOp_Half_TN,tn_128256_206_4096,Gemm_Hipblaslt_TN_9738,0.543217
GemmTunableOp_Half_TN,tn_6144_64_4096,Gemm_Rocblas_621294155,0.0160708
GemmTunableOp_Half_TN,tn_28672_1896_4096,Gemm_Hipblaslt_TN_9683,0.798039
GemmTunableOp_Half_TN,tn_28672_6871_4096,Gemm_Hipblaslt_TN_9939,2.80169
GemmStridedBatchedTunableOp_Half_TN,tn_1757_1757_128_B_32,Gemm_Rocblas_621294106,0.126867
GemmStridedBatchedTunableOp_Half_TN,tn_1638_1638_128_B_32,Gemm_Rocblas_621286397,0.117081
GemmStridedBatchedTunableOp_Half_TN,tn_1670_1670_128_B_32,Gemm_Rocblas_621294110,0.118364
GemmStridedBatchedTunableOp_Half_TN,tn_1594_1594_128_B_32,Gemm_Rocblas_621286397,0.109489
GemmStridedBatchedTunableOp_Half_TN,tn_1660_1660_128_B_32,Gemm_Rocblas_621286397,0.115924
GemmStridedBatchedTunableOp_Half_TN,tn_1948_1948_128_B_32,Gemm_Rocblas_621294533,0.155187
GemmStridedBatchedTunableOp_Half_TN,tn_1878_1878_128_B_32,Gemm_Hipblaslt_TN_6942,0.143184
GemmStridedBatchedTunableOp_Half_TN,tn_1879_1879_128_B_32,Gemm_Hipblaslt_TN_6942,0.144836
GemmStridedBatchedTunableOp_Half_TN,tn_1747_1747_128_B_32,Gemm_Rocblas_621294110,0.126343
GemmStridedBatchedTunableOp_Half_TN,tn_32_32_128_B_32,Gemm_Rocblas_621294459,0.00645288
GemmStridedBatchedTunableOp_Half_TN,tn_1853_1853_128_B_32,Gemm_Hipblaslt_TN_6942,0.139813
GemmStridedBatchedTunableOp_Half_TN,tn_1721_1721_128_B_32,Gemm_Hipblaslt_TN_6942,0.122611
GemmStridedBatchedTunableOp_Half_TN,tn_1797_1797_128_B_32,Gemm_Hipblaslt_TN_6942,0.134843
GemmStridedBatchedTunableOp_Half_TN,tn_1785_1785_128_B_32,Gemm_Rocblas_621294106,0.132851
GemmStridedBatchedTunableOp_Half_TN,tn_1788_1788_128_B_32,Gemm_Rocblas_621286397,0.128044
GemmStridedBatchedTunableOp_Half_TN,tn_1720_1720_128_B_32,Gemm_Rocblas_621294110,0.118471
GemmStridedBatchedTunableOp_Half_TN,tn_1643_1643_128_B_32,Gemm_Hipblaslt_TN_6942,0.117367
GemmStridedBatchedTunableOp_Half_TN,tn_1610_1610_128_B_32,Gemm_Rocblas_621286397,0.112163
GemmStridedBatchedTunableOp_Half_TN,tn_1735_1735_128_B_32,Gemm_Rocblas_621286397,0.122927
GemmStridedBatchedTunableOp_Half_TN,tn_1811_1811_128_B_32,Gemm_Hipblaslt_TN_6942,0.137643
GemmStridedBatchedTunableOp_Half_TN,tn_1798_1798_128_B_32,Gemm_Rocblas_621286397,0.137175
GemmStridedBatchedTunableOp_Half_TN,tn_1846_1846_128_B_32,Gemm_Hipblaslt_TN_6942,0.140529
GemmStridedBatchedTunableOp_Half_TN,tn_1724_1724_128_B_32,Gemm_Hipblaslt_TN_6942,0.121442
GemmStridedBatchedTunableOp_Half_TN,tn_1774_1774_128_B_32,Gemm_Rocblas_621286397,0.130279
GemmStridedBatchedTunableOp_Half_TN,tn_1710_1710_128_B_32,Gemm_Hipblaslt_TN_6942,0.121785
GemmStridedBatchedTunableOp_Half_TN,tn_1813_1813_128_B_32,Gemm_Hipblaslt_TN_6942,0.136247
GemmStridedBatchedTunableOp_Half_TN,tn_1851_1851_128_B_32,Gemm_Hipblaslt_TN_6942,0.140992
GemmStridedBatchedTunableOp_Half_TN,tn_1796_1796_128_B_32,Gemm_Rocblas_621286397,0.138636
GemmStridedBatchedTunableOp_Half_TN,tn_1870_1870_128_B_32,Gemm_Hipblaslt_TN_6942,0.143124
GemmStridedBatchedTunableOp_Half_TN,tn_1725_1725_128_B_32,Gemm_Hipblaslt_TN_6942,0.122485
GemmStridedBatchedTunableOp_Half_TN,tn_1668_1668_128_B_32,Gemm_Rocblas_621294110,0.117594
GemmStridedBatchedTunableOp_Half_TN,tn_1765_1765_128_B_32,Gemm_Rocblas_621286413,0.129485
GemmStridedBatchedTunableOp_Half_TN,tn_1771_1771_128_B_32,Gemm_Rocblas_621286397,0.129584
GemmStridedBatchedTunableOp_Half_TN,tn_1762_1762_128_B_32,Gemm_Rocblas_621286397,0.126958
GemmStridedBatchedTunableOp_Half_TN,tn_1573_1573_128_B_32,Gemm_Hipblaslt_TN_6929,0.110798
GemmStridedBatchedTunableOp_Half_TN,tn_1645_1645_128_B_32,Gemm_Hipblaslt_TN_6942,0.117593
GemmStridedBatchedTunableOp_Half_TN,tn_1659_1659_128_B_32,Gemm_Rocblas_621286397,0.116762
GemmStridedBatchedTunableOp_Half_TN,tn_1867_1867_128_B_32,Gemm_Rocblas_621286397,0.144375
GemmStridedBatchedTunableOp_Half_TN,tn_1706_1706_128_B_32,Gemm_Rocblas_621286413,0.119944
GemmStridedBatchedTunableOp_Half_TN,tn_1820_1820_128_B_32,Gemm_Rocblas_621286810,0.14054
GemmStridedBatchedTunableOp_Half_TN,tn_1884_1884_128_B_32,Gemm_Rocblas_621286397,0.143216
GemmStridedBatchedTunableOp_Half_TN,tn_1665_1665_128_B_32,Gemm_Rocblas_621286413,0.117756
GemmStridedBatchedTunableOp_Half_TN,tn_1752_1752_128_B_32,Gemm_Rocblas_621294106,0.121964
GemmStridedBatchedTunableOp_Half_TN,tn_1892_1892_128_B_32,Gemm_Hipblaslt_TN_6942,0.143957
GemmStridedBatchedTunableOp_Half_TN,tn_1840_1840_128_B_32,Gemm_Hipblaslt_TN_157,0.131472
GemmStridedBatchedTunableOp_Half_TN,tn_1629_1629_128_B_32,Gemm_Rocblas_621286397,0.114081
GemmStridedBatchedTunableOp_Half_TN,tn_1946_1946_128_B_32,Gemm_Hipblaslt_TN_6879,0.153184
GemmStridedBatchedTunableOp_Half_TN,tn_1907_1907_128_B_32,Gemm_Rocblas_621286397,0.142918
GemmStridedBatchedTunableOp_Half_TN,tn_1887_1887_128_B_32,Gemm_Hipblaslt_TN_6942,0.146021
GemmStridedBatchedTunableOp_Half_TN,tn_1767_1767_128_B_32,Gemm_Rocblas_621286397,0.129333
GemmStridedBatchedTunableOp_Half_TN,tn_1984_1984_128_B_32,Gemm_Rocblas_621294763,0.14936
GemmStridedBatchedTunableOp_Half_TN,tn_2127_2127_128_B_64,Gemm_Rocblas_621294106,0.368987
GemmStridedBatchedTunableOp_Half_TN,tn_1702_1702_128_B_32,Gemm_Rocblas_621286397,0.119561
GemmStridedBatchedTunableOp_Half_TN,tn_1954_1954_128_B_32,Gemm_Rocblas_621294533,0.157473
GemmStridedBatchedTunableOp_Half_TN,tn_2289_2289_128_B_64,Gemm_Rocblas_621294106,0.428774
GemmStridedBatchedTunableOp_Half_TN,tn_2081_2081_128_B_64,Gemm_Rocblas_621294106,0.361577
GemmStridedBatchedTunableOp_Half_TN,tn_1655_1655_128_B_32,Gemm_Rocblas_621294110,0.119101
GemmStridedBatchedTunableOp_Half_TN,tn_1827_1827_128_B_32,Gemm_Rocblas_621286397,0.140533
GemmStridedBatchedTunableOp_Half_TN,tn_1692_1692_128_B_32,Gemm_Rocblas_621286413,0.116296
GemmStridedBatchedTunableOp_Half_TN,tn_2160_2160_128_B_64,Gemm_Hipblaslt_TN_158,0.332113
GemmStridedBatchedTunableOp_Half_TN,tn_1591_1591_128_B_32,Gemm_Rocblas_621286413,0.113225
GemmStridedBatchedTunableOp_Half_TN,tn_1974_1974_128_B_32,Gemm_Hipblaslt_TN_6879,0.160005
GemmStridedBatchedTunableOp_Half_TN,tn_1651_1651_128_B_32,Gemm_Hipblaslt_TN_6942,0.116653
GemmStridedBatchedTunableOp_Half_TN,tn_1733_1733_128_B_32,Gemm_Rocblas_621294106,0.126797
GemmStridedBatchedTunableOp_Half_TN,tn_2413_2413_128_B_64,Gemm_Rocblas_621294106,0.487511
GemmStridedBatchedTunableOp_Half_TN,tn_1901_1901_128_B_32,Gemm_Hipblaslt_TN_6942,0.1466
GemmStridedBatchedTunableOp_Half_TN,tn_1607_1607_128_B_32,Gemm_Hipblaslt_TN_6929,0.115562
GemmStridedBatchedTunableOp_Half_TN,tn_1916_1916_128_B_32,Gemm_Hipblaslt_TN_6942,0.146687
GemmStridedBatchedTunableOp_Half_TN,tn_1837_1837_128_B_32,Gemm_Hipblaslt_TN_6942,0.13764
GemmStridedBatchedTunableOp_Half_TN,tn_2145_2145_128_B_64,Gemm_Rocblas_621294106,0.37863
GemmStridedBatchedTunableOp_Half_TN,tn_1619_1619_128_B_32,Gemm_Rocblas_621294106,0.114856
GemmStridedBatchedTunableOp_Half_TN,tn_2337_2337_128_B_64,Gemm_Rocblas_621294106,0.457827
GemmStridedBatchedTunableOp_Half_TN,tn_1713_1713_128_B_32,Gemm_Rocblas_621286397,0.12328
GemmStridedBatchedTunableOp_Half_TN,tn_2369_2369_128_B_64,Gemm_Rocblas_621294106,0.466321
GemmStridedBatchedTunableOp_Half_TN,tn_1750_1750_128_B_32,Gemm_Rocblas_621286397,0.125148
GemmStridedBatchedTunableOp_Half_TN,tn_1906_1906_128_B_32,Gemm_Hipblaslt_TN_6942,0.145522
GemmStridedBatchedTunableOp_Half_TN,tn_1758_1758_128_B_32,Gemm_Rocblas_621286397,0.126806
GemmStridedBatchedTunableOp_Half_TN,tn_2048_2048_128_B_64,Gemm_Hipblaslt_TN_9843,0.283237
GemmStridedBatchedTunableOp_Half_TN,tn_1923_1923_128_B_32,Gemm_Hipblaslt_TN_6879,0.151586
GemmStridedBatchedTunableOp_Half_TN,tn_2128_2128_128_B_64,Gemm_Hipblaslt_TN_158,0.323417
GemmStridedBatchedTunableOp_Half_TN,tn_1717_1717_128_B_32,Gemm_Rocblas_621294110,0.122811
GemmStridedBatchedTunableOp_Half_TN,tn_1654_1654_128_B_32,Gemm_Rocblas_621286397,0.116
GemmStridedBatchedTunableOp_Half_TN,tn_1885_1885_128_B_32,Gemm_Hipblaslt_TN_6942,0.14539
GemmStridedBatchedTunableOp_Half_TN,tn_1699_1699_128_B_32,Gemm_Rocblas_621286413,0.119997
GemmStridedBatchedTunableOp_Half_TN,tn_2270_2270_128_B_64,Gemm_Rocblas_621294106,0.409892
GemmStridedBatchedTunableOp_Half_TN,tn_2129_2129_128_B_64,Gemm_Rocblas_621294106,0.37174
GemmStridedBatchedTunableOp_Half_TN,tn_1863_1863_128_B_32,Gemm_Hipblaslt_TN_6942,0.142725
GemmStridedBatchedTunableOp_Half_TN,tn_1754_1754_128_B_32,Gemm_Rocblas_621286413,0.126969
GemmStridedBatchedTunableOp_Half_TN,tn_1780_1780_128_B_32,Gemm_Rocblas_621286397,0.127286
GemmStridedBatchedTunableOp_Half_TN,tn_1961_1961_128_B_32,Gemm_Rocblas_621294533,0.15805
GemmStridedBatchedTunableOp_Half_TN,tn_1741_1741_128_B_32,Gemm_Rocblas_621294106,0.126483
GemmStridedBatchedTunableOp_Half_TN,tn_1577_1577_128_B_32,Gemm_Hipblaslt_TN_6895,0.112723
GemmStridedBatchedTunableOp_Half_TN,tn_1790_1790_128_B_32,Gemm_Rocblas_621286397,0.131063
GemmStridedBatchedTunableOp_Half_TN,tn_1966_1966_128_B_32,Gemm_Hipblaslt_TN_6879,0.157595
GemmStridedBatchedTunableOp_Half_TN,tn_1857_1857_128_B_32,Gemm_Hipblaslt_TN_6942,0.139611
GemmStridedBatchedTunableOp_Half_TN,tn_1722_1722_128_B_32,Gemm_Rocblas_621294110,0.121339
GemmStridedBatchedTunableOp_Half_TN,tn_1602_1602_128_B_32,Gemm_Rocblas_621286397,0.110517
GemmStridedBatchedTunableOp_Half_TN,tn_2050_2050_128_B_64,Gemm_Rocblas_621294106,0.345372
GemmStridedBatchedTunableOp_Half_TN,tn_1611_1611_128_B_32,Gemm_Rocblas_621286397,0.115026
GemmStridedBatchedTunableOp_Half_TN,tn_1960_1960_128_B_32,Gemm_Hipblaslt_TN_153,0.149984
GemmStridedBatchedTunableOp_Half_TN,tn_1805_1805_128_B_32,Gemm_Hipblaslt_TN_6942,0.136988
GemmStridedBatchedTunableOp_Half_TN,tn_1890_1890_128_B_32,Gemm_Hipblaslt_TN_6942,0.145908
GemmStridedBatchedTunableOp_Half_TN,tn_1694_1694_128_B_32,Gemm_Rocblas_621286397,0.117354
GemmStridedBatchedTunableOp_Half_TN,tn_1712_1712_128_B_32,Gemm_Rocblas_621294108,0.115738
GemmStridedBatchedTunableOp_Half_TN,tn_1783_1783_128_B_32,Gemm_Rocblas_621294108,0.131947
GemmStridedBatchedTunableOp_Half_TN,tn_1902_1902_128_B_32,Gemm_Hipblaslt_TN_6942,0.147337
GemmStridedBatchedTunableOp_Half_TN,tn_1598_1598_128_B_32,Gemm_Rocblas_621286397,0.112177
GemmStridedBatchedTunableOp_Half_TN,tn_1852_1852_128_B_32,Gemm_Hipblaslt_TN_6942,0.139079
GemmStridedBatchedTunableOp_Half_TN,tn_1779_1779_128_B_32,Gemm_Rocblas_621286397,0.131471
GemmTunableOp_Half_TN,tn_28672_1772_4096,Gemm_Hipblaslt_TN_9223,0.717073
GemmTunableOp_Half_TN,tn_4096_3581_4096,Gemm_Hipblaslt_TN_9814,0.198224
GemmTunableOp_Half_TN,tn_4096_1796_4096,Gemm_Hipblaslt_TN_9602,0.117148
GemmTunableOp_Half_TN,tn_6144_1796_4096,Gemm_Hipblaslt_TN_9690,0.163029
GemmTunableOp_Half_TN,tn_4096_1660_4096,Gemm_Hipblaslt_TN_9587,0.105624
GemmTunableOp_Half_TN,tn_128256_6_4096,Gemm_Hipblaslt_TN_9405,0.268251
GemmTunableOp_Half_TN,tn_28672_1853_4096,Gemm_Hipblaslt_TN_9684,0.781131
GemmTunableOp_Half_TN,tn_4096_5219_14336,Gemm_Hipblaslt_TN_9799,1.07378
GemmTunableOp_Half_TN,tn_28672_5470_4096,Gemm_Hipblaslt_TN_9865,2.26106
GemmTunableOp_Half_TN,tn_6144_1860_4096,Gemm_Hipblaslt_TN_9691,0.165438
GemmTunableOp_Half_TN,tn_4096_1593_14336,Gemm_Hipblaslt_TN_9265,0.357442
GemmTunableOp_Half_TN,tn_128256_171_4096,Gemm_Hipblaslt_TN_9683,0.490542
GemmTunableOp_Half_TN,tn_4096_1752_4096,Gemm_Hipblaslt_TN_9645,0.117123
GemmTunableOp_Half_TN,tn_4096_1615_4096,Gemm_Hipblaslt_TN_9587,0.10424
GemmTunableOp_Half_TN,tn_6144_7240_4096,Gemm_Hipblaslt_TN_9743,0.59609
GemmTunableOp_Half_TN,tn_6144_5223_4096,Gemm_Hipblaslt_TN_9768,0.432332
GemmTunableOp_Half_TN,tn_6144_5723_4096,Gemm_Hipblaslt_TN_9687,0.50091
GemmTunableOp_Half_TN,tn_6144_1967_4096,Gemm_Hipblaslt_TN_9536,0.17825
GemmTunableOp_Half_TN,tn_6144_5605_4096,Gemm_Rocblas_621294426,0.495923
GemmTunableOp_Half_TN,tn_6144_1801_4096,Gemm_Hipblaslt_TN_9799,0.163788
GemmTunableOp_Half_TN,tn_4096_3401_4096,Gemm_Hipblaslt_TN_9814,0.193001
GemmTunableOp_Half_TN,tn_28672_1888_4096,Gemm_Hipblaslt_TN_9832,0.78627
GemmTunableOp_Half_TN,tn_4096_1888_4096,Gemm_Hipblaslt_TN_9645,0.122011
GemmTunableOp_Half_TN,tn_28672_1810_4096,Gemm_Hipblaslt_TN_9684,0.777857
GemmTunableOp_Half_TN,tn_28672_5447_4096,Gemm_Hipblaslt_TN_9924,2.25302
GemmTunableOp_Half_TN,tn_128256_215_4096,Gemm_Hipblaslt_TN_9898,0.547609
GemmTunableOp_Half_TN,tn_28672_5125_4096,Gemm_Hipblaslt_TN_9849,2.10569
GemmTunableOp_Half_TN,tn_28672_3466_4096,Gemm_Hipblaslt_TN_9827,1.33725
GemmTunableOp_Half_TN,tn_4096_1685_14336,Gemm_Hipblaslt_TN_9607,0.365122
GemmTunableOp_Half_TN,tn_28672_1946_4096,Gemm_Hipblaslt_TN_9846,0.813486
GemmTunableOp_Half_TN,tn_6144_1628_4096,Gemm_Rocblas_621294495,0.152255
GemmTunableOp_Half_TN,tn_6144_1804_4096,Gemm_Hipblaslt_TN_9672,0.163083
GemmTunableOp_Half_TN,tn_4096_3780_14336,Gemm_Hipblaslt_TN_9827,0.718996
GemmTunableOp_Half_TN,tn_4096_1779_14336,Gemm_Hipblaslt_TN_9645,0.395075
GemmTunableOp_Half_TN,tn_4096_1887_4096,Gemm_Hipblaslt_TN_9590,0.1218
GemmTunableOp_Half_TN,tn_4096_1823_4096,Gemm_Hipblaslt_TN_9134,0.119545
GemmTunableOp_Half_TN,tn_4096_1637_4096,Gemm_Hipblaslt_TN_9265,0.10546
GemmTunableOp_Half_TN,tn_6144_1637_4096,Gemm_Hipblaslt_TN_9570,0.151553
GemmTunableOp_Half_TN,tn_4096_5204_14336,Gemm_Hipblaslt_TN_9799,1.07904
GemmTunableOp_Half_TN,tn_6144_1934_4096,Gemm_Hipblaslt_TN_9693,0.175684
GemmTunableOp_Half_TN,tn_4096_1778_4096,Gemm_Hipblaslt_TN_9590,0.116952
GemmTunableOp_Half_TN,tn_4096_1703_14336,Gemm_Hipblaslt_TN_9671,0.365441
GemmTunableOp_Half_TN,tn_6144_3369_4096,Gemm_Hipblaslt_TN_9570,0.300413
GemmTunableOp_Half_TN,tn_4096_1743_4096,Gemm_Hipblaslt_TN_9590,0.116664
GemmTunableOp_Half_TN,tn_28672_1977_4096,Gemm_Hipblaslt_TN_9846,0.82568
GemmTunableOp_Half_TN,tn_6144_6789_4096,Gemm_Hipblaslt_TN_9814,0.575832
GemmTunableOp_Half_TN,tn_6144_1589_4096,Gemm_Rocblas_621294305,0.146574
GemmTunableOp_Half_TN,tn_128256_150_4096,Gemm_Hipblaslt_TN_9808,0.443486
GemmTunableOp_Half_TN,tn_28672_1764_4096,Gemm_Hipblaslt_TN_9191,0.714431
GemmTunableOp_Half_TN,tn_6144_1769_4096,Gemm_Hipblaslt_TN_9799,0.162561
GemmTunableOp_Half_TN,tn_4096_1739_4096,Gemm_Hipblaslt_TN_9590,0.116116
GemmTunableOp_Half_TN,tn_6144_7139_4096,Gemm_Hipblaslt_TN_9221,0.587663
GemmTunableOp_Half_TN,tn_28672_224_4096,Gemm_Hipblaslt_TN_9267,0.111523
GemmTunableOp_Half_TN,tn_4096_5267_14336,Gemm_Hipblaslt_TN_9799,1.07694
GemmTunableOp_Half_TN,tn_4096_7077_4096,Gemm_Hipblaslt_TN_9814,0.395761
GemmTunableOp_Half_TN,tn_4096_1652_14336,Gemm_Hipblaslt_TN_9671,0.361787
GemmTunableOp_Half_TN,tn_4096_1742_14336,Gemm_Hipblaslt_TN_9645,0.391488
GemmTunableOp_Half_TN,tn_28672_5723_4096,Gemm_Hipblaslt_TN_9841,2.30218
GemmTunableOp_Half_TN,tn_28672_1790_4096,Gemm_Hipblaslt_TN_9191,0.717184
GemmTunableOp_Half_TN,tn_10240_64_8192,Gemm_Hipblaslt_TN_7492,0.0481124
GemmTunableOp_Half_TN,tn_6144_1636_4096,Gemm_Rocblas_621286753,0.151902
GemmTunableOp_Half_TN,tn_28672_5100_4096,Gemm_Hipblaslt_TN_9951,2.0445
GemmTunableOp_Half_TN,tn_6144_216_4096,Gemm_Hipblaslt_TN_9495,0.0340169
GemmTunableOp_Half_TN,tn_28672_1859_4096,Gemm_Hipblaslt_TN_9684,0.785717
GemmTunableOp_Half_TN,tn_4096_3300_14336,Gemm_Hipblaslt_TN_9677,0.646689
GemmTunableOp_Half_TN,tn_4096_3682_4096,Gemm_Hipblaslt_TN_9827,0.208983
GemmTunableOp_Half_TN,tn_4096_5436_14336,Gemm_Hipblaslt_TN_9799,1.11316
GemmTunableOp_Half_TN,tn_4096_1614_4096,Gemm_Hipblaslt_TN_9265,0.104815
GemmTunableOp_Half_TN,tn_4096_5136_4096,Gemm_Hipblaslt_TN_9681,0.313519
GemmTunableOp_Half_TN,tn_6144_7033_4096,Gemm_Hipblaslt_TN_9677,0.584621
GemmTunableOp_Half_TN,tn_28672_3583_4096,Gemm_Hipblaslt_TN_9841,1.35952
GemmTunableOp_Half_TN,tn_4096_1838_14336,Gemm_Hipblaslt_TN_9268,0.402219
GemmTunableOp_Half_TN,tn_28672_3456_4096,Gemm_Hipblaslt_TN_9827,1.33185
GemmTunableOp_Half_TN,tn_128256_255_4096,Gemm_Rocblas_621294634,0.571121
GemmTunableOp_Half_TN,tn_28672_3400_4096,Gemm_Hipblaslt_TN_9827,1.33173
GemmTunableOp_Half_TN,tn_28672_5735_4096,Gemm_Hipblaslt_TN_9827,2.31509
GemmTunableOp_Half_TN,tn_6144_1948_4096,Gemm_Hipblaslt_TN_9693,0.175924
GemmTunableOp_Half_TN,tn_4096_1953_4096,Gemm_Hipblaslt_TN_9645,0.124159
GemmTunableOp_Half_TN,tn_6144_1978_4096,Gemm_Hipblaslt_TN_9693,0.176118
GemmTunableOp_Half_TN,tn_10240_2159_8192,Gemm_Rocblas_621286575,0.640112
GemmTunableOp_Half_TN,tn_57344_2255_8192,Default,3.95932
GemmTunableOp_Half_TN,tn_4096_1588_14336,Gemm_Hipblaslt_TN_9671,0.357275
GemmTunableOp_Half_TN,tn_4096_1850_4096,Gemm_Hipblaslt_TN_9645,0.119483
GemmTunableOp_Half_TN,tn_4096_1760_4096,Gemm_Hipblaslt_TN_9590,0.117482
GemmTunableOp_Half_TN,tn_57344_2415_8192,Default,4.33621
GemmTunableOp_Half_TN,tn_28672_1717_4096,Gemm_Hipblaslt_TN_9217,0.70558
GemmTunableOp_Half_TN,tn_4096_3535_14336,Gemm_Hipblaslt_TN_9743,0.67539
GemmTunableOp_Half_TN,tn_4096_5413_14336,Gemm_Hipblaslt_TN_9799,1.11205
GemmTunableOp_Half_TN,tn_4096_1864_14336,Gemm_Hipblaslt_TN_9136,0.409784
GemmTunableOp_Half_TN,tn_4096_1945_14336,Gemm_Hipblaslt_TN_9680,0.415591
GemmTunableOp_Half_TN,tn_4096_5322_14336,Gemm_Hipblaslt_TN_9799,1.10445
GemmTunableOp_Half_TN,tn_6144_3630_4096,Gemm_Rocblas_621294495,0.315601
GemmTunableOp_Half_TN,tn_128256_237_4096,Gemm_Rocblas_621286905,0.565938
GemmTunableOp_Half_TN,tn_28672_3578_4096,Gemm_Hipblaslt_TN_9827,1.35342
GemmTunableOp_Half_TN,tn_28672_5204_4096,Gemm_Hipblaslt_TN_9930,2.05226
GemmTunableOp_Half_TN,tn_6144_1855_4096,Gemm_Hipblaslt_TN_9672,0.163689
GemmTunableOp_Half_TN,tn_4096_1605_4096,Gemm_Hipblaslt_TN_9266,0.106162
GemmTunableOp_Half_TN,tn_4096_3600_14336,Gemm_Hipblaslt_TN_9814,0.684929
GemmTunableOp_Half_TN,tn_4096_1658_14336,Gemm_Hipblaslt_TN_9671,0.362357
GemmTunableOp_Half_TN,tn_128256_89_4096,Gemm_Hipblaslt_TN_9057,0.361524
GemmTunableOp_Half_TN,tn_4096_8192_4096,Gemm_Hipblaslt_TN_9655,0.447942
GemmTunableOp_Half_TN,tn_6144_1820_4096,Gemm_Hipblaslt_TN_9691,0.164134
GemmTunableOp_Half_TN,tn_28672_1928_4096,Gemm_Hipblaslt_TN_9846,0.816558
GemmTunableOp_Half_TN,tn_4096_136_4096,Gemm_Rocblas_621294168,0.0217069
GemmTunableOp_Half_TN,tn_128256_69_4096,Gemm_Hipblaslt_TN_9057,0.346245
GemmTunableOp_Half_TN,tn_28672_7484_4096,Gemm_Hipblaslt_TN_159,2.85565
GemmTunableOp_Half_TN,tn_128256_129_4096,Gemm_Hipblaslt_TN_9108,0.428391
GemmTunableOp_Half_TN,tn_4096_1706_14336,Gemm_Hipblaslt_TN_9265,0.364682
GemmTunableOp_Half_TN,tn_8192_67_8192,Gemm_Hipblaslt_TN_8197,0.0434619
GemmTunableOp_Half_TN,tn_4096_232_4096,Gemm_Rocblas_621286445,0.0261839
GemmTunableOp_Half_TN,tn_6144_3582_4096,Gemm_Rocblas_621286753,0.31447
GemmTunableOp_Half_TN,tn_28672_1933_4096,Gemm_Hipblaslt_TN_9846,0.817344
GemmTunableOp_Half_TN,tn_28672_1733_4096,Gemm_Hipblaslt_TN_9223,0.709846
GemmTunableOp_Half_TN,tn_4096_3383_4096,Gemm_Hipblaslt_TN_9832,0.193268
GemmTunableOp_Half_TN,tn_6144_3645_4096,Gemm_Rocblas_621294495,0.315385
GemmTunableOp_Half_TN,tn_4096_40_14336,Gemm_Hipblaslt_TN_8050,0.0311533
GemmTunableOp_Half_TN,tn_128256_37_4096,Gemm_Hipblaslt_TN_9451,0.300973
GemmTunableOp_Half_TN,tn_28672_3388_4096,Gemm_Hipblaslt_TN_9827,1.32241
GemmTunableOp_Half_TN,tn_6144_3612_4096,Gemm_Hipblaslt_TN_9570,0.31684
GemmTunableOp_Half_TN,tn_6144_1625_4096,Gemm_Hipblaslt_TN_9570,0.15166
GemmTunableOp_Half_TN,tn_28672_3713_4096,Gemm_Hipblaslt_TN_9827,1.48968
GemmTunableOp_Half_TN,tn_28672_1686_4096,Gemm_Rocblas_621294420,0.702294
GemmTunableOp_Half_TN,tn_6144_5447_4096,Gemm_Hipblaslt_TN_9655,0.442613
GemmTunableOp_Half_TN,tn_6144_3219_4096,Gemm_Rocblas_621286566,0.292409
GemmTunableOp_Half_TN,tn_128256_27_4096,Gemm_Rocblas_621286354,0.298056
GemmTunableOp_Half_TN,tn_4096_1749_14336,Gemm_Hipblaslt_TN_9645,0.396452
GemmTunableOp_Half_TN,tn_4096_1655_14336,Gemm_Hipblaslt_TN_9265,0.362771
GemmTunableOp_Half_TN,tn_10240_68_8192,Gemm_Hipblaslt_TN_9304,0.0487397
GemmTunableOp_Half_TN,tn_6144_1827_4096,Gemm_Hipblaslt_TN_9182,0.163823
GemmTunableOp_Half_TN,tn_4096_1725_14336,Gemm_Hipblaslt_TN_9610,0.36745
GemmTunableOp_Half_TN,tn_28672_3515_4096,Gemm_Hipblaslt_TN_9827,1.34659
GemmTunableOp_Half_TN,tn_4096_3379_14336,Gemm_Hipblaslt_TN_9677,0.655281
GemmTunableOp_Half_TN,tn_8192_2370_8192,Gemm_Hipblaslt_TN_9263,0.557202
GemmTunableOp_Half_TN,tn_4096_6979_14336,Gemm_Hipblaslt_TN_9743,1.37786
GemmTunableOp_Half_TN,tn_4096_1792_4096,Gemm_Hipblaslt_TN_9605,0.116491
GemmTunableOp_Half_TN,tn_28672_1883_4096,Gemm_Hipblaslt_TN_9684,0.789571
GemmTunableOp_Half_TN,tn_8192_2337_8192,Gemm_Hipblaslt_TN_9264,0.55827
GemmTunableOp_Half_TN,tn_4096_1789_14336,Gemm_Hipblaslt_TN_9134,0.396304
GemmTunableOp_Half_TN,tn_6144_1823_4096,Gemm_Hipblaslt_TN_9691,0.163793
GemmTunableOp_Half_TN,tn_6144_3562_4096,Gemm_Hipblaslt_TN_9570,0.311699
GemmTunableOp_Half_TN,tn_28672_3748_4096,Gemm_Hipblaslt_TN_9827,1.5002
GemmTunableOp_Half_TN,tn_6144_1953_4096,Gemm_Hipblaslt_TN_9697,0.177278
GemmTunableOp_Half_TN,tn_6144_3920_4096,Gemm_Hipblaslt_TN_9690,0.339135
GemmTunableOp_Half_TN,tn_10240_2366_8192,Gemm_Hipblaslt_TN_9672,0.67886
GemmTunableOp_Half_TN,tn_28672_7021_4096,Gemm_Hipblaslt_TN_9747,2.78035
GemmTunableOp_Half_TN,tn_28672_1713_4096,Gemm_Hipblaslt_TN_9223,0.707411
GemmTunableOp_Half_TN,tn_28672_1935_4096,Gemm_Hipblaslt_TN_9846,0.829808
GemmTunableOp_Half_TN,tn_4096_7077_14336,Gemm_Hipblaslt_TN_9743,1.38596
GemmTunableOp_Half_TN,tn_4096_1872_14336,Gemm_Hipblaslt_TN_9134,0.407382
GemmTunableOp_Half_TN,tn_6144_240_4096,Gemm_Hipblaslt_TN_9495,0.0338699
GemmTunableOp_Half_TN,tn_4096_48_4096,Gemm_Rocblas_621294155,0.0129053
GemmTunableOp_Half_TN,tn_4096_1799_4096,Gemm_Hipblaslt_TN_9645,0.118449
GemmTunableOp_Half_TN,tn_4096_1898_4096,Gemm_Hipblaslt_TN_9645,0.122583
GemmTunableOp_Half_TN,tn_28672_1822_4096,Gemm_Hipblaslt_TN_9684,0.773493
GemmTunableOp_Half_TN,tn_6144_1588_4096,Gemm_Rocblas_621294306,0.148537
GemmTunableOp_Half_TN,tn_10240_2161_8192,Gemm_Hipblaslt_TN_9690,0.639691
GemmTunableOp_Half_TN,tn_128256_107_4096,Gemm_Rocblas_621294385,0.392342
GemmTunableOp_Half_TN,tn_8192_2191_28672,Gemm_Hipblaslt_TN_9762,2.08466
GemmTunableOp_Half_TN,tn_10240_4066_8192,Gemm_Hipblaslt_TN_9743,1.14139
GemmTunableOp_Half_TN,tn_6144_6788_4096,Gemm_Hipblaslt_TN_9188,0.57521
GemmTunableOp_Half_TN,tn_28672_240_4096,Gemm_Hipblaslt_TN_9372,0.121891
GemmTunableOp_Half_TN,tn_28672_6971_4096,Gemm_Hipblaslt_TN_159,2.75707
GemmTunableOp_Half_TN,tn_28672_3373_4096,Gemm_Hipblaslt_TN_9827,1.32906
GemmTunableOp_Half_TN,tn_10240_4000_8192,Gemm_Hipblaslt_TN_9743,1.10879
GemmTunableOp_Half_TN,tn_4096_7439_14336,Gemm_Hipblaslt_TN_9813,1.49407
GemmTunableOp_Half_TN,tn_6144_1866_4096,Gemm_Hipblaslt_TN_9691,0.163747
GemmTunableOp_Half_TN,tn_57344_30_8192,Gemm_Rocblas_621286351,0.271125
GemmTunableOp_Half_TN,tn_8192_65_8192,Gemm_Hipblaslt_TN_8197,0.0428076
GemmTunableOp_Half_TN,tn_28672_1864_4096,Gemm_Hipblaslt_TN_9684,0.782083
GemmTunableOp_Half_TN,tn_28672_3830_4096,Gemm_Hipblaslt_TN_9944,1.53756
GemmTunableOp_Half_TN,tn_6144_1898_4096,Gemm_Hipblaslt_TN_9691,0.165432
GemmTunableOp_Half_TN,tn_4096_1780_14336,Gemm_Hipblaslt_TN_9645,0.394664
GemmTunableOp_Half_TN,tn_8192_2193_28672,Gemm_Hipblaslt_TN_9762,2.08732
GemmTunableOp_Half_TN,tn_6144_1877_4096,Gemm_Hipblaslt_TN_9672,0.165496
GemmTunableOp_Half_TN,tn_4096_5570_14336,Gemm_Rocblas_621294320,1.13877
GemmTunableOp_Half_TN,tn_6144_1597_4096,Gemm_Rocblas_621286566,0.147952
GemmTunableOp_Half_TN,tn_4096_1665_14336,Gemm_Hipblaslt_TN_9265,0.362303
GemmTunableOp_Half_TN,tn_10240_2304_8192,Gemm_Rocblas_621294353,0.656455
GemmTunableOp_Half_TN,tn_28672_1742_4096,Gemm_Hipblaslt_TN_9223,0.712034
GemmTunableOp_Half_TN,tn_28672_6630_4096,Gemm_Hipblaslt_TN_9955,2.62578
GemmTunableOp_Half_TN,tn_8192_2129_8192,Gemm_Hipblaslt_TN_9742,0.507284
GemmTunableOp_Half_TN,tn_8192_2127_28672,Gemm_Hipblaslt_TN_9762,2.0369
GemmTunableOp_Half_TN,tn_4096_3595_4096,Gemm_Hipblaslt_TN_9814,0.199296
GemmTunableOp_Half_TN,tn_10240_2017_8192,Gemm_Rocblas_621286569,0.603656
GemmTunableOp_Half_TN,tn_6144_6965_4096,Gemm_Hipblaslt_TN_9814,0.581021
GemmTunableOp_Half_TN,tn_128256_219_4096,Gemm_Hipblaslt_TN_9937,0.548432
GemmTunableOp_Half_TN,tn_8192_2190_8192,Gemm_Hipblaslt_TN_9763,0.513833
GemmTunableOp_Half_TN,tn_6144_1916_4096,Gemm_Hipblaslt_TN_9691,0.166823
GemmTunableOp_Half_TN,tn_4096_7575_14336,Gemm_Hipblaslt_TN_9813,1.49913
GemmTunableOp_Half_TN,tn_57344_2302_8192,Default,3.98067
GemmTunableOp_Half_TN,tn_28672_1948_4096,Gemm_Hipblaslt_TN_9846,0.823805
GemmTunableOp_Half_TN,tn_8192_4050_8192,Gemm_Hipblaslt_TN_9704,0.887445
GemmTunableOp_Half_TN,tn_4096_7386_4096,Gemm_Hipblaslt_TN_9890,0.416948
GemmTunableOp_Half_TN,tn_28672_56_4096,Gemm_Rocblas_621286463,0.0498922
GemmTunableOp_Half_TN,tn_8192_4049_28672,Gemm_Hipblaslt_TN_9737,3.45034
GemmTunableOp_Half_TN,tn_6144_1902_4096,Gemm_Hipblaslt_TN_9691,0.16615
GemmTunableOp_Half_TN,tn_6144_7475_4096,Gemm_Hipblaslt_TN_9903,0.625828
GemmTunableOp_Half_TN,tn_4096_1668_4096,Gemm_Hipblaslt_TN_9671,0.106175
GemmTunableOp_Half_TN,tn_4096_1786_14336,Gemm_Hipblaslt_TN_9645,0.395921
GemmTunableOp_Half_TN,tn_4096_1969_14336,Gemm_Hipblaslt_TN_9136,0.418945
GemmTunableOp_Half_TN,tn_28672_1981_4096,Gemm_Hipblaslt_TN_9846,0.82229
GemmTunableOp_Half_TN,tn_4096_1725_4096,Gemm_Hipblaslt_TN_9607,0.107391
GemmTunableOp_Half_TN,tn_28672_5354_4096,Gemm_Hipblaslt_TN_159,2.08462
GemmTunableOp_Half_TN,tn_8192_2413_8192,Gemm_Hipblaslt_TN_9263,0.564166
GemmTunableOp_Half_TN,tn_128256_213_4096,Gemm_Hipblaslt_TN_9738,0.54096
GemmTunableOp_Half_TN,tn_4096_7475_14336,Gemm_Hipblaslt_TN_9749,1.47606
GemmTunableOp_Half_TN,tn_4096_1954_4096,Gemm_Hipblaslt_TN_9620,0.124204
GemmTunableOp_Half_TN,tn_57344_58_8192,Gemm_Rocblas_621286468,0.302707
GemmTunableOp_Half_TN,tn_6144_5357_4096,Gemm_Hipblaslt_TN_9815,0.432989
GemmTunableOp_Half_TN,tn_10240_2096_8192,Gemm_Hipblaslt_TN_9182,0.631223
GemmTunableOp_Half_TN,tn_4096_1688_14336,Gemm_Hipblaslt_TN_9265,0.363555
GemmTunableOp_Half_TN,tn_57344_66_8192,Gemm_Hipblaslt_TN_9478,0.320712
GemmTunableOp_Half_TN,tn_128256_11_4096,Gemm_Rocblas_621294224,0.275999
GemmTunableOp_Half_TN,tn_8192_4081_28672,Gemm_Rocblas_621286894,3.47019
GemmTunableOp_Half_TN,tn_6144_96_4096,Gemm_Rocblas_621294028,0.0192365
GemmTunableOp_Half_TN,tn_4096_1770_14336,Gemm_Hipblaslt_TN_9645,0.397255
GemmTunableOp_Half_TN,tn_6144_1721_4096,Gemm_Rocblas_621294495,0.155746
GemmTunableOp_Half_TN,tn_4096_1820_4096,Gemm_Hipblaslt_TN_9605,0.118454
GemmTunableOp_Half_TN,tn_4096_1739_14336,Gemm_Hipblaslt_TN_9645,0.393471
GemmTunableOp_Half_TN,tn_8192_2321_8192,Gemm_Hipblaslt_TN_9264,0.556117
GemmTunableOp_Half_TN,tn_4096_7248_4096,Gemm_Hipblaslt_TN_9743,0.393145
GemmTunableOp_Half_TN,tn_6144_1807_4096,Gemm_Hipblaslt_TN_9691,0.163862
GemmTunableOp_Half_TN,tn_8192_2192_8192,Gemm_Hipblaslt_TN_9742,0.513808
GemmTunableOp_Half_TN,tn_10240_62_8192,Gemm_Hipblaslt_TN_9088,0.0483049
GemmTunableOp_Half_TN,tn_10240_2112_8192,Gemm_Hipblaslt_TN_9774,0.627955
GemmTunableOp_Half_TN,tn_6144_3691_4096,Gemm_Hipblaslt_TN_9691,0.330258
GemmTunableOp_Half_TN,tn_8192_2366_28672,Gemm_Hipblaslt_TN_9771,2.30912
GemmTunableOp_Half_TN,tn_4096_256_4096,Gemm_Rocblas_621294173,0.0267288
GemmTunableOp_Half_TN,tn_4096_1719_4096,Gemm_Hipblaslt_TN_9359,0.106107
GemmTunableOp_Half_TN,tn_4096_1618_4096,Gemm_Hipblaslt_TN_9266,0.106357
GemmTunableOp_Half_TN,tn_10240_4096_8192,Gemm_Hipblaslt_TN_9743,1.13333
GemmTunableOp_Half_TN,tn_32000_66_8192,Gemm_Hipblaslt_TN_9479,0.187922
GemmTunableOp_Half_TN,tn_28672_6997_4096,Gemm_Hipblaslt_TN_9747,2.78401
GemmTunableOp_Half_TN,tn_4096_1824_14336,Gemm_Hipblaslt_TN_9268,0.40385
GemmTunableOp_Half_TN,tn_6144_168_4096,Gemm_Rocblas_621286443,0.0284305
GemmTunableOp_Half_TN,tn_57344_2178_8192,Gemm_Rocblas_621294542,3.98389
GemmTunableOp_Half_TN,tn_6144_1875_4096,Gemm_Hipblaslt_TN_9672,0.164165
GemmTunableOp_Half_TN,tn_28672_5136_4096,Gemm_Rocblas_621294484,2.11697
GemmTunableOp_Half_TN,tn_128256_158_4096,Gemm_Rocblas_621286565,0.443607
GemmTunableOp_Half_TN,tn_6144_184_4096,Gemm_Rocblas_621286440,0.02893
GemmTunableOp_Half_TN,tn_128256_233_4096,Gemm_Rocblas_621286892,0.561318
GemmTunableOp_Half_TN,tn_128256_250_4096,Gemm_Rocblas_621286892,0.568816
GemmTunableOp_Half_TN,tn_10240_2190_8192,Gemm_Rocblas_621286580,0.64529
GemmTunableOp_Half_TN,tn_4096_6860_14336,Gemm_Hipblaslt_TN_9694,1.3614
GemmTunableOp_Half_TN,tn_6144_1738_4096,Gemm_Hipblaslt_TN_9799,0.158879
GemmTunableOp_Half_TN,tn_4096_1902_4096,Gemm_Hipblaslt_TN_9645,0.121497
GemmTunableOp_Half_TN,tn_8192_4017_28672,Gemm_Rocblas_621286894,3.4443
GemmTunableOp_Half_TN,tn_28672_3557_4096,Gemm_Hipblaslt_TN_9827,1.3412
GemmTunableOp_Half_TN,tn_28672_3382_4096,Gemm_Hipblaslt_TN_9841,1.32554
GemmTunableOp_Half_TN,tn_28672_3501_4096,Gemm_Hipblaslt_TN_9827,1.34605
GemmTunableOp_Half_TN,tn_57344_54_8192,Gemm_Rocblas_621294205,0.30165
GemmTunableOp_Half_TN,tn_6144_5157_4096,Gemm_Hipblaslt_TN_9768,0.432602
GemmTunableOp_Half_TN,tn_10240_2000_8192,Gemm_Hipblaslt_TN_9649,0.596492
GemmTunableOp_Half_TN,tn_10240_63_8192,Gemm_Hipblaslt_TN_9086,0.0489825
GemmTunableOp_Half_TN,tn_28672_7340_4096,Gemm_Hipblaslt_TN_159,2.81986
GemmTunableOp_Half_TN,tn_4096_7552_4096,Gemm_Rocblas_621286281,0.423125
GemmTunableOp_Half_TN,tn_57344_2079_8192,Gemm_Hipblaslt_TN_9827,3.95905
GemmTunableOp_Half_TN,tn_6144_32_4096,Gemm_Rocblas_621286488,0.0138198
GemmTunableOp_Half_TN,tn_6144_1966_4096,Gemm_Hipblaslt_TN_9693,0.177064
GemmTunableOp_Half_TN,tn_6144_1977_4096,Gemm_Hipblaslt_TN_9693,0.177998
GemmTunableOp_Half_TN,tn_4096_3562_14336,Gemm_Hipblaslt_TN_9743,0.676984
GemmTunableOp_Half_TN,tn_4096_1908_14336,Gemm_Hipblaslt_TN_9134,0.413299
GemmTunableOp_Half_TN,tn_4096_1778_14336,Gemm_Hipblaslt_TN_9645,0.39352
GemmTunableOp_Half_TN,tn_6144_1857_4096,Gemm_Hipblaslt_TN_9691,0.165078
GemmTunableOp_Half_TN,tn_57344_2270_8192,Gemm_Rocblas_621294543,3.99451
GemmTunableOp_Half_TN,tn_8192_2112_28672,Gemm_Hipblaslt_TN_9762,2.04923
GemmTunableOp_Half_TN,tn_4096_1882_14336,Gemm_Hipblaslt_TN_9137,0.412524
GemmTunableOp_Half_TN,tn_57344_4048_8192,Gemm_Rocblas_621286894,6.66716
GemmTunableOp_Half_TN,tn_4096_3508_14336,Gemm_Hipblaslt_TN_9139,0.676198
GemmTunableOp_Half_TN,tn_57344_2304_8192,Gemm_Rocblas_621294543,4.03561
GemmTunableOp_Half_TN,tn_6144_3565_4096,Gemm_Hipblaslt_TN_9570,0.312083
GemmTunableOp_Half_TN,tn_6144_5274_4096,Gemm_Hipblaslt_TN_9753,0.435183
GemmTunableOp_Half_TN,tn_28672_1824_4096,Gemm_Hipblaslt_TN_9684,0.777703
GemmTunableOp_Half_TN,tn_8192_2159_8192,Gemm_Hipblaslt_TN_9763,0.510689
GemmTunableOp_Half_TN,tn_28672_7191_4096,Gemm_Hipblaslt_TN_159,2.84304
GemmTunableOp_Half_TN,tn_4096_3584_14336,Gemm_Hipblaslt_TN_9743,0.677055
GemmTunableOp_Half_TN,tn_57344_2366_8192,Gemm_Rocblas_621294542,4.4415
GemmTunableOp_Half_TN,tn_128256_15_4096,Gemm_Rocblas_621286325,0.27811
GemmTunableOp_Half_TN,tn_8192_64_28672,Gemm_Rocblas_621286489,0.144827
GemmTunableOp_Half_TN,tn_32000_63_8192,Gemm_Rocblas_621294203,0.162825
GemmTunableOp_Half_TN,tn_10240_61_8192,Gemm_Hipblaslt_TN_7492,0.0484453
GemmTunableOp_Half_TN,tn_8192_56_28672,Gemm_Rocblas_621286489,0.145068
GemmTunableOp_Half_TN,tn_6144_3830_4096,Gemm_Hipblaslt_TN_9672,0.33242
GemmTunableOp_Half_TN,tn_28672_7067_4096,Gemm_Hipblaslt_TN_9747,2.79809
GemmTunableOp_Half_TN,tn_6144_1969_4096,Gemm_Hipblaslt_TN_9697,0.177872
GemmTunableOp_Half_TN,tn_4096_7484_4096,Gemm_Hipblaslt_TN_9914,0.422039
GemmTunableOp_Half_TN,tn_8192_2397_8192,Gemm_Hipblaslt_TN_9229,0.562116
GemmTunableOp_Half_TN,tn_4096_3345_4096,Gemm_Hipblaslt_TN_9814,0.192293
GemmTunableOp_Half_TN,tn_4096_1859_14336,Gemm_Hipblaslt_TN_9268,0.404629
GemmTunableOp_Half_TN,tn_4096_7130_4096,Gemm_Hipblaslt_TN_9743,0.391227
GemmTunableOp_Half_TN,tn_4096_3912_4096,Gemm_Rocblas_621294030,0.218127
GemmTunableOp_Half_TN,tn_28672_1670_4096,Gemm_Hipblaslt_TN_9217,0.696331
GemmTunableOp_Half_TN,tn_10240_2385_8192,Gemm_Hipblaslt_TN_9182,0.678691
GemmTunableOp_Half_TN,tn_8192_57_8192,Gemm_Hipblaslt_TN_7484,0.0395736
GemmTunableOp_Half_TN,tn_4096_1884_4096,Gemm_Hipblaslt_TN_9620,0.122269
GemmTunableOp_Half_TN,tn_4096_1666_4096,Gemm_Hipblaslt_TN_9607,0.106214
GemmTunableOp_Half_TN,tn_28672_5680_4096,Gemm_Hipblaslt_TN_9827,2.2812
GemmTunableOp_Half_TN,tn_4096_3345_14336,Gemm_Hipblaslt_TN_9682,0.650412
GemmTunableOp_Half_TN,tn_4096_1767_4096,Gemm_Hipblaslt_TN_9590,0.11611
GemmTunableOp_Half_TN,tn_28672_1831_4096,Gemm_Hipblaslt_TN_9832,0.784582
GemmTunableOp_Half_TN,tn_4096_1813_14336,Gemm_Hipblaslt_TN_9137,0.40353
GemmTunableOp_Half_TN,tn_4096_3468_4096,Gemm_Hipblaslt_TN_9814,0.196726
GemmTunableOp_Half_TN,tn_8192_2289_8192,Gemm_Hipblaslt_TN_9763,0.518702
GemmTunableOp_Half_TN,tn_4096_1811_14336,Gemm_Hipblaslt_TN_9680,0.402639
GemmTunableOp_Half_TN,tn_4096_1727_4096,Gemm_Hipblaslt_TN_9587,0.105007
GemmTunableOp_Half_TN,tn_6144_1728_4096,Gemm_Hipblaslt_TN_9570,0.149594
GemmTunableOp_Half_TN,tn_6144_7023_4096,Gemm_Hipblaslt_TN_9677,0.583795
GemmTunableOp_Half_TN,tn_57344_4000_8192,Gemm_Hipblaslt_TN_9825,6.62862
GemmTunableOp_Half_TN,tn_6144_1600_4096,Gemm_Rocblas_621294447,0.147259
GemmTunableOp_Half_TN,tn_6144_1961_4096,Gemm_Hipblaslt_TN_9693,0.177594
GemmTunableOp_Half_TN,tn_32000_64_8192,Gemm_Rocblas_621294203,0.162692
GemmTunableOp_Half_TN,tn_28672_3791_4096,Gemm_Hipblaslt_TN_9827,1.49947
GemmTunableOp_Half_TN,tn_128256_30_4096,Gemm_Rocblas_621286354,0.298275
GemmTunableOp_Half_TN,tn_10240_60_8192,Gemm_Hipblaslt_TN_7492,0.047312
GemmTunableOp_Half_TN,tn_28672_7118_4096,Gemm_Hipblaslt_TN_9747,2.79641
GemmTunableOp_Half_TN,tn_57344_2193_8192,Gemm_Rocblas_621294542,4.00072
GemmTunableOp_Half_TN,tn_4096_7109_4096,Gemm_Hipblaslt_TN_9743,0.393904
GemmTunableOp_Half_TN,tn_4096_7138_4096,Gemm_Hipblaslt_TN_9743,0.395888
GemmTunableOp_Half_TN,tn_6144_1737_4096,Gemm_Hipblaslt_TN_9799,0.156934
GemmTunableOp_Half_TN,tn_4096_1599_14336,Gemm_Hipblaslt_TN_9610,0.35758
GemmTunableOp_Half_TN,tn_6144_1647_4096,Gemm_Rocblas_621294306,0.151593
GemmTunableOp_Half_TN,tn_6144_1889_4096,Gemm_Hipblaslt_TN_9691,0.165985
GemmTunableOp_Half_TN,tn_4096_1867_14336,Gemm_Hipblaslt_TN_9136,0.407402
GemmTunableOp_Half_TN,tn_8192_2465_28672,Gemm_Hipblaslt_TN_9774,2.38064
GemmTunableOp_Half_TN,tn_6144_3300_4096,Gemm_Rocblas_621286566,0.297951
GemmTunableOp_Half_TN,tn_10240_2417_8192,Gemm_Hipblaslt_TN_9697,0.69677
GemmTunableOp_Half_TN,tn_128256_166_4096,Gemm_Hipblaslt_TN_9952,0.486737
GemmTunableOp_Half_TN,tn_8192_2257_28672,Gemm_Hipblaslt_TN_9774,2.23493
GemmTunableOp_Half_TN,tn_4096_1784_4096,Gemm_Hipblaslt_TN_9590,0.11755
GemmTunableOp_Half_TN,tn_8192_2207_8192,Gemm_Hipblaslt_TN_9742,0.508388
GemmTunableOp_Half_TN,tn_4096_1680_14336,Gemm_Hipblaslt_TN_9671,0.363368
GemmTunableOp_Half_TN,tn_28672_1936_4096,Gemm_Hipblaslt_TN_9846,0.814753
GemmTunableOp_Half_TN,tn_6144_1704_4096,Gemm_Hipblaslt_TN_9570,0.150509
GemmTunableOp_Half_TN,tn_128256_21_4096,Gemm_Rocblas_621286354,0.294255
GemmTunableOp_Half_TN,tn_8192_54_28672,Gemm_Rocblas_621286489,0.14657
GemmTunableOp_Half_TN,tn_4096_5427_4096,Gemm_Rocblas_621294426,0.325403
GemmTunableOp_Half_TN,tn_6144_1713_4096,Gemm_Hipblaslt_TN_9570,0.152477
GemmTunableOp_Half_TN,tn_4096_1586_14336,Gemm_Hipblaslt_TN_9265,0.355798
GemmTunableOp_Half_TN,tn_128256_78_4096,Gemm_Hipblaslt_TN_9057,0.353158
GemmTunableOp_Half_TN,tn_32000_54_8192,Gemm_Rocblas_621294203,0.159694
GemmTunableOp_Half_TN,tn_4096_5359_4096,Gemm_Hipblaslt_TN_9690,0.321164
GemmTunableOp_Half_TN,tn_4096_1589_14336,Gemm_Hipblaslt_TN_9790,0.356495
GemmTunableOp_Half_TN,tn_4096_1882_4096,Gemm_Hipblaslt_TN_9645,0.122831
GemmTunableOp_Half_TN,tn_28672_3475_4096,Gemm_Hipblaslt_TN_9827,1.33821
GemmTunableOp_Half_TN,tn_4096_1593_4096,Gemm_Hipblaslt_TN_9587,0.103397
GemmTunableOp_Half_TN,tn_4096_6901_4096,Gemm_Hipblaslt_TN_9814,0.390021
GemmTunableOp_Half_TN,tn_4096_1708_14336,Gemm_Hipblaslt_TN_9790,0.364605
GemmTunableOp_Half_TN,tn_57344_63_8192,Default,0.306913
GemmTunableOp_Half_TN,tn_57344_60_8192,Gemm_Hipblaslt_TN_9459,0.304472
GemmTunableOp_Half_TN,tn_4096_1842_14336,Gemm_Hipblaslt_TN_9268,0.404303
GemmTunableOp_Half_TN,tn_28672_7325_4096,Gemm_Hipblaslt_TN_159,2.78427
GemmTunableOp_Half_TN,tn_10240_2081_8192,Gemm_Hipblaslt_TN_9687,0.627251
GemmTunableOp_Half_TN,tn_6144_1881_4096,Gemm_Hipblaslt_TN_9691,0.165283
GemmTunableOp_Half_TN,tn_8192_2145_28672,Gemm_Hipblaslt_TN_9762,2.04695
GemmTunableOp_Half_TN,tn_128256_176_4096,Gemm_Hipblaslt_TN_9952,0.487156
GemmTunableOp_Half_TN,tn_4096_3214_14336,Gemm_Hipblaslt_TN_9677,0.63297
GemmTunableOp_Half_TN,tn_4096_6761_4096,Gemm_Hipblaslt_TN_9814,0.384599
GemmTunableOp_Half_TN,tn_4096_5413_4096,Gemm_Hipblaslt_TN_9690,0.323877
GemmTunableOp_Half_TN,tn_4096_3514_14336,Gemm_Hipblaslt_TN_9743,0.677064
GemmTunableOp_Half_TN,tn_6144_3584_4096,Gemm_Rocblas_621286566,0.313119
GemmTunableOp_Half_TN,tn_4096_3410_14336,Gemm_Hipblaslt_TN_9682,0.655648
GemmTunableOp_Half_TN,tn_128256_243_4096,Gemm_Rocblas_621286892,0.56523
GemmTunableOp_Half_TN,tn_4096_152_14336,Gemm_Hipblaslt_TN_7233,0.0575415
GemmTunableOp_Half_TN,tn_28672_1721_4096,Gemm_Hipblaslt_TN_9217,0.706833
GemmTunableOp_Half_TN,tn_4096_1802_4096,Gemm_Hipblaslt_TN_9605,0.119552
GemmTunableOp_Half_TN,tn_8192_2158_8192,Gemm_Hipblaslt_TN_9742,0.508894
GemmTunableOp_Half_TN,tn_8192_4096_8192,Gemm_Rocblas_621286590,0.887171
GemmTunableOp_Half_TN,tn_8192_2158_28672,Gemm_Hipblaslt_TN_9762,2.06676
GemmTunableOp_Half_TN,tn_28672_3622_4096,Gemm_Hipblaslt_TN_9832,1.44236
GemmTunableOp_Half_TN,tn_8192_2097_8192,Gemm_Hipblaslt_TN_9742,0.506511
GemmTunableOp_Half_TN,tn_4096_7579_14336,Gemm_Hipblaslt_TN_9815,1.4997
GemmTunableOp_Half_TN,tn_6144_1786_4096,Gemm_Hipblaslt_TN_9691,0.162473
GemmTunableOp_Half_TN,tn_4096_6715_14336,Gemm_Hipblaslt_TN_9732,1.34666
GemmTunableOp_Half_TN,tn_10240_2191_8192,Gemm_Hipblaslt_TN_9674,0.645216
GemmTunableOp_Half_TN,tn_4096_5100_14336,Gemm_Hipblaslt_TN_9681,1.04828
GemmTunableOp_Half_TN,tn_28672_48_4096,Gemm_Hipblaslt_TN_9144,0.0491463
GemmTunableOp_Half_TN,tn_28672_144_4096,Gemm_Hipblaslt_TN_9561,0.0849098
GemmTunableOp_Half_TN,tn_4096_1683_14336,Gemm_Hipblaslt_TN_9679,0.364759
GemmTunableOp_Half_TN,tn_28672_1828_4096,Gemm_Hipblaslt_TN_9684,0.781772
GemmTunableOp_Half_TN,tn_4096_1655_4096,Gemm_Hipblaslt_TN_9164,0.10469
GemmTunableOp_Half_TN,tn_4096_1909_14336,Gemm_Hipblaslt_TN_9645,0.413885
GemmTunableOp_Half_TN,tn_4096_7050_4096,Gemm_Hipblaslt_TN_9743,0.394279
GemmTunableOp_Half_TN,tn_28672_7108_4096,Gemm_Hipblaslt_TN_9859,2.79911
GemmTunableOp_Half_TN,tn_128256_253_4096,Gemm_Rocblas_621286892,0.567288
GemmTunableOp_Half_TN,tn_4096_72_4096,Gemm_Rocblas_621286280,0.014862
GemmTunableOp_Half_TN,tn_4096_1948_4096,Gemm_Hipblaslt_TN_9137,0.124956
GemmTunableOp_Half_TN,tn_4096_3557_14336,Gemm_Hipblaslt_TN_9743,0.677469
GemmTunableOp_Half_TN,tn_6144_1615_4096,Gemm_Hipblaslt_TN_9570,0.149119
GemmTunableOp_Half_TN,tn_4096_1600_4096,Gemm_Hipblaslt_TN_9164,0.105614
GemmTunableOp_Half_TN,tn_28672_6902_4096,Gemm_Hipblaslt_TN_9958,2.75052
GemmTunableOp_Half_TN,tn_4096_1607_14336,Gemm_Hipblaslt_TN_9679,0.35932
GemmTunableOp_Half_TN,tn_4096_1958_4096,Gemm_Hipblaslt_TN_9590,0.123186
GemmTunableOp_Half_TN,tn_4096_1627_14336,Gemm_Hipblaslt_TN_9164,0.360285
GemmTunableOp_Half_TN,tn_6144_7027_4096,Gemm_Hipblaslt_TN_9188,0.58584
GemmTunableOp_Half_TN,tn_28672_3691_4096,Gemm_Hipblaslt_TN_9827,1.49511
GemmTunableOp_Half_TN,tn_6144_3553_4096,Gemm_Rocblas_621286566,0.310801
GemmTunableOp_Half_TN,tn_6144_6843_4096,Gemm_Hipblaslt_TN_9743,0.574537
GemmTunableOp_Half_TN,tn_4096_3597_14336,Gemm_Hipblaslt_TN_9743,0.683838
GemmTunableOp_Half_TN,tn_6144_1710_4096,Gemm_Hipblaslt_TN_9570,0.15364
GemmTunableOp_Half_TN,tn_4096_1670_4096,Gemm_Hipblaslt_TN_9587,0.106377
GemmTunableOp_Half_TN,tn_28672_6952_4096,Gemm_Hipblaslt_TN_159,2.74683
GemmTunableOp_Half_TN,tn_4096_6976_4096,Gemm_Hipblaslt_TN_9743,0.393199
GemmTunableOp_Half_TN,tn_4096_5381_14336,Gemm_Hipblaslt_TN_9799,1.11001
GemmTunableOp_Half_TN,tn_4096_7033_14336,Gemm_Hipblaslt_TN_9694,1.38661
GemmTunableOp_Half_TN,tn_6144_6996_4096,Gemm_Hipblaslt_TN_9814,0.586406
GemmTunableOp_Half_TN,tn_4096_1573_14336,Gemm_Hipblaslt_TN_9671,0.35508
GemmTunableOp_Half_TN,tn_128256_50_4096,Gemm_Rocblas_621294557,0.328353
GemmTunableOp_Half_TN,tn_6144_7191_4096,Gemm_Hipblaslt_TN_9221,0.594731
GemmTunableOp_Half_TN,tn_6144_3600_4096,Gemm_Hipblaslt_TN_9570,0.314002
GemmTunableOp_Half_TN,tn_28672_5541_4096,Gemm_Hipblaslt_TN_9840,2.28349
GemmTunableOp_Half_TN,tn_6144_3602_4096,Gemm_Hipblaslt_TN_9570,0.314177
GemmTunableOp_Half_TN,tn_8192_2178_28672,Gemm_Hipblaslt_TN_9762,2.06685
GemmTunableOp_Half_TN,tn_4096_1869_4096,Gemm_Hipblaslt_TN_9645,0.121179
GemmTunableOp_Half_TN,tn_128256_256_4096,Gemm_Rocblas_621286892,0.56355
GemmTunableOp_Half_TN,tn_28672_6843_4096,Gemm_Hipblaslt_TN_9958,2.76018
GemmTunableOp_Half_TN,tn_6144_3710_4096,Gemm_Hipblaslt_TN_9672,0.328843
GemmTunableOp_Half_TN,tn_6144_1936_4096,Gemm_Hipblaslt_TN_9536,0.175842
GemmTunableOp_Half_TN,tn_4096_3526_14336,Gemm_Hipblaslt_TN_9743,0.674085
GemmTunableOp_Half_TN,tn_4096_7344_4096,Gemm_Rocblas_621286281,0.415076
GemmTunableOp_Half_TN,tn_4096_3441_14336,Gemm_Hipblaslt_TN_9139,0.662201
GemmTunableOp_Half_TN,tn_6144_1945_4096,Gemm_Hipblaslt_TN_9536,0.174947
GemmTunableOp_Half_TN,tn_28672_3526_4096,Gemm_Hipblaslt_TN_9841,1.35192
GemmTunableOp_Half_TN,tn_4096_1863_4096,Gemm_Hipblaslt_TN_9620,0.122405
GemmTunableOp_Half_TN,tn_28672_1699_4096,Gemm_Hipblaslt_TN_9217,0.706371
GemmTunableOp_Half_TN,tn_4096_1887_14336,Gemm_Hipblaslt_TN_9136,0.41082
GemmTunableOp_Half_TN,tn_128256_205_4096,Gemm_Hipblaslt_TN_9654,0.542296
GemmTunableOp_Half_TN,tn_28672_128_4096,Gemm_Rocblas_621286473,0.0670788
GemmTunableOp_Half_TN,tn_6144_3520_4096,Gemm_Hipblaslt_TN_9570,0.309262
GemmTunableOp_Half_TN,tn_6144_1682_4096,Gemm_Rocblas_621286753,0.153357
GemmTunableOp_Half_TN,tn_6144_5196_4096,Gemm_Hipblaslt_TN_9903,0.433221
GemmTunableOp_Half_TN,tn_4096_7579_4096,Gemm_Hipblaslt_TN_9914,0.420993
GemmTunableOp_Half_TN,tn_4096_216_4096,Gemm_Rocblas_621294171,0.0250166
GemmTunableOp_Half_TN,tn_4096_7225_14336,Gemm_Hipblaslt_TN_9743,1.39842
GemmTunableOp_Half_TN,tn_128256_57_4096,Gemm_Rocblas_621294554,0.331625
GemmTunableOp_Half_TN,tn_6144_6841_4096,Gemm_Hipblaslt_TN_9677,0.577753
GemmTunableOp_Half_TN,tn_6144_7327_4096,Gemm_Rocblas_621294455,0.621104
GemmTunableOp_Half_TN,tn_4096_248_4096,Gemm_Rocblas_621286440,0.0260223
GemmTunableOp_Half_TN,tn_28672_1651_4096,Gemm_Hipblaslt_TN_9217,0.695668
GemmTunableOp_Half_TN,tn_28672_5322_4096,Gemm_Hipblaslt_TN_9890,2.07659
GemmTunableOp_Half_TN,tn_4096_7345_14336,Gemm_Hipblaslt_TN_9815,1.47814
GemmTunableOp_Half_TN,tn_4096_5352_14336,Gemm_Hipblaslt_TN_9799,1.10323
GemmTunableOp_Half_TN,tn_4096_7186_14336,Gemm_Hipblaslt_TN_9743,1.39337
GemmTunableOp_Half_TN,tn_128256_247_4096,Gemm_Rocblas_621294634,0.569901
GemmTunableOp_Half_TN,tn_128256_164_4096,Gemm_Hipblaslt_TN_9683,0.483786
GemmTunableOp_Half_TN,tn_28672_104_4096,Gemm_Rocblas_621286473,0.0669193
GemmTunableOp_Half_TN,tn_4096_5274_4096,Gemm_Hipblaslt_TN_9799,0.319317
GemmTunableOp_Half_TN,tn_4096_1608_4096,Gemm_Hipblaslt_TN_9587,0.105015
GemmTunableOp_Half_TN,tn_28672_136_4096,Gemm_Hipblaslt_TN_9561,0.0834772
GemmTunableOp_Half_TN,tn_128256_135_4096,Gemm_Hipblaslt_TN_9808,0.435959
GemmTunableOp_Half_TN,tn_28672_7403_4096,Gemm_Hipblaslt_TN_159,2.83321
GemmTunableOp_Half_TN,tn_4096_240_14336,Gemm_Hipblaslt_TN_9303,0.0739269
GemmTunableOp_Half_TN,tn_128256_197_4096,Gemm_Hipblaslt_TN_9908,0.538931
GemmTunableOp_Half_TN,tn_4096_3912_14336,Gemm_Hipblaslt_TN_9841,0.739533
GemmTunableOp_Half_TN,tn_4096_1973_14336,Gemm_Hipblaslt_TN_9136,0.417032
GemmTunableOp_Half_TN,tn_128256_41_4096,Gemm_Hipblaslt_TN_9451,0.304305
GemmTunableOp_Half_TN,tn_28672_7047_4096,Gemm_Hipblaslt_TN_9919,2.78907
GemmTunableOp_Half_TN,tn_28672_1953_4096,Gemm_Hipblaslt_TN_9846,0.8187
GemmTunableOp_Half_TN,tn_4096_3691_14336,Gemm_Hipblaslt_TN_9827,0.714864
GemmTunableOp_Half_TN,tn_28672_3586_4096,Gemm_Hipblaslt_TN_9832,1.43769
GemmTunableOp_Half_TN,tn_4096_128_14336,Gemm_Hipblaslt_TN_7160,0.0470985
GemmTunableOp_Half_TN,tn_4096_5533_14336,Gemm_Hipblaslt_TN_9799,1.1306
GemmTunableOp_Half_TN,tn_4096_64_4096,Gemm_Rocblas_621294155,0.0133311
GemmTunableOp_Half_TN,tn_4096_1728_4096,Gemm_Hipblaslt_TN_9607,0.104306
GemmTunableOp_Half_TN,tn_128256_204_4096,Gemm_Hipblaslt_TN_9738,0.537461
GemmTunableOp_Half_TN,tn_6144_5089_4096,Gemm_Hipblaslt_TN_9223,0.425141
GemmTunableOp_Half_TN,tn_28672_1627_4096,Gemm_Rocblas_621294420,0.689466
GemmTunableOp_Half_TN,tn_28672_3497_4096,Gemm_Hipblaslt_TN_9827,1.33887
GemmTunableOp_Half_TN,tn_4096_1689_14336,Gemm_Hipblaslt_TN_9265,0.362816
GemmTunableOp_Half_TN,tn_6144_1847_4096,Gemm_Rocblas_621294425,0.164819
GemmTunableOp_Half_TN,tn_4096_192_4096,Gemm_Rocblas_621286440,0.0228782
GemmTunableOp_Half_TN,tn_6144_7253_4096,Gemm_Hipblaslt_TN_9743,0.595088
GemmTunableOp_Half_TN,tn_28672_3379_4096,Gemm_Hipblaslt_TN_9827,1.32486
GemmTunableOp_Half_TN,tn_28672_3404_4096,Gemm_Hipblaslt_TN_9827,1.33146
GemmTunableOp_Half_TN,tn_28672_152_4096,Gemm_Hipblaslt_TN_9561,0.0851734
GemmTunableOp_Half_TN,tn_4096_1738_4096,Gemm_Hipblaslt_TN_9590,0.116888
GemmTunableOp_Half_TN,tn_4096_1686_4096,Gemm_Hipblaslt_TN_9671,0.10557
GemmTunableOp_Half_TN,tn_4096_6841_14336,Gemm_Hipblaslt_TN_9694,1.36025
GemmTunableOp_Half_TN,tn_4096_7248_14336,Gemm_Hipblaslt_TN_9743,1.40785
GemmTunableOp_Half_TN,tn_4096_144_14336,Gemm_Hipblaslt_TN_9298,0.0545482
GemmTunableOp_Half_TN,tn_4096_3589_4096,Gemm_Hipblaslt_TN_9221,0.199895
GemmTunableOp_Half_TN,tn_6144_1605_4096,Gemm_Hipblaslt_TN_9570,0.151748
GemmTunableOp_Half_TN,tn_6144_3586_4096,Gemm_Hipblaslt_TN_9570,0.311817
GemmTunableOp_Half_TN,tn_4096_3373_4096,Gemm_Hipblaslt_TN_9221,0.193509
GemmTunableOp_Half_TN,tn_6144_232_4096,Gemm_Hipblaslt_TN_9494,0.0347476
GemmTunableOp_Half_TN,tn_28672_88_4096,Gemm_Rocblas_621286719,0.0580973
GemmTunableOp_Half_TN,tn_4096_6789_4096,Gemm_Hipblaslt_TN_9221,0.385317
GemmTunableOp_Half_TN,tn_8192_2225_28672,Gemm_Hipblaslt_TN_9762,2.1046
GemmTunableOp_Half_TN,tn_28672_1745_4096,Gemm_Rocblas_621286678,0.712185
GemmTunableOp_Half_TN,tn_28672_120_4096,Gemm_Hipblaslt_TN_9550,0.0700241
GemmTunableOp_Half_TN,tn_4096_1771_14336,Gemm_Hipblaslt_TN_9645,0.39638
GemmTunableOp_Half_TN,tn_28672_7253_4096,Gemm_Hipblaslt_TN_159,2.8564
GemmTunableOp_Half_TN,tn_4096_3511_14336,Gemm_Hipblaslt_TN_9139,0.673554
GemmTunableOp_Half_TN,tn_57344_2238_8192,Gemm_Rocblas_621294543,4.0173
GemmTunableOp_Half_TN,tn_4096_1588_4096,Gemm_Hipblaslt_TN_9587,0.103011
GemmTunableOp_Half_TN,tn_28672_6860_4096,Gemm_Hipblaslt_TN_9944,2.75663
GemmTunableOp_Half_TN,tn_4096_6721_4096,Gemm_Hipblaslt_TN_9221,0.383843
GemmTunableOp_Half_TN,tn_28672_7225_4096,Gemm_Hipblaslt_TN_159,2.83497
GemmTunableOp_Half_TN,tn_4096_5541_4096,Gemm_Hipblaslt_TN_9690,0.328001
GemmTunableOp_Half_TN,tn_4096_112_4096,Gemm_Rocblas_621294028,0.0168184
GemmTunableOp_Half_TN,tn_4096_56_14336,Gemm_Hipblaslt_TN_9436,0.0342608
GemmTunableOp_Half_TN,tn_4096_1866_4096,Gemm_Hipblaslt_TN_9645,0.120527
GemmTunableOp_Half_TN,tn_4096_88_14336,Gemm_Hipblaslt_TN_8146,0.0413787
GemmTunableOp_Half_TN,tn_28672_1667_4096,Gemm_Rocblas_621286693,0.695783
GemmTunableOp_Half_TN,tn_6144_7067_4096,Gemm_Hipblaslt_TN_9188,0.586578
GemmTunableOp_Half_TN,tn_4096_3547_4096,Gemm_Hipblaslt_TN_9221,0.198507
GemmTunableOp_Half_TN,tn_57344_62_8192,Gemm_Hipblaslt_TN_9459,0.306999
GemmTunableOp_Half_TN,tn_4096_24_14336,Gemm_Rocblas_621294021,0.0273253
GemmTunableOp_Half_TN,tn_4096_1738_14336,Gemm_Hipblaslt_TN_9645,0.391497
GemmTunableOp_Half_TN,tn_6144_5277_4096,Gemm_Hipblaslt_TN_9220,0.43409
GemmTunableOp_Half_TN,tn_4096_3701_14336,Gemm_Hipblaslt_TN_9827,0.70969
GemmTunableOp_Half_TN,tn_28672_3701_4096,Gemm_Hipblaslt_TN_9827,1.4987
GemmTunableOp_Half_TN,tn_6144_6747_4096,Gemm_Hipblaslt_TN_9188,0.574067
GemmTunableOp_Half_TN,tn_6144_1660_4096,Gemm_Hipblaslt_TN_9570,0.149612
GemmTunableOp_Half_TN,tn_6144_1739_4096,Gemm_Hipblaslt_TN_9690,0.157404
GemmTunableOp_Half_TN,tn_6144_1706_4096,Gemm_Hipblaslt_TN_9570,0.151838
GemmTunableOp_Half_TN,tn_4096_7096_14336,Gemm_Hipblaslt_TN_9694,1.38619
GemmTunableOp_Half_TN,tn_32000_256_8192,Gemm_Hipblaslt_TN_9541,0.329791
GemmTunableOp_Half_TN,tn_28672_1879_4096,Gemm_Hipblaslt_TN_9684,0.789166
GemmTunableOp_Half_TN,tn_6144_5030_4096,Gemm_Hipblaslt_TN_9220,0.423923
GemmTunableOp_Half_TN,tn_28672_1978_4096,Gemm_Hipblaslt_TN_9846,0.828158
GemmTunableOp_Half_TN,tn_6144_80_4096,Gemm_Rocblas_621286279,0.0189101
GemmTunableOp_Half_TN,tn_6144_1733_4096,Gemm_Rocblas_621286683,0.158968
GemmTunableOp_Half_TN,tn_4096_1787_4096,Gemm_Hipblaslt_TN_9645,0.11716
GemmTunableOp_Half_TN,tn_128256_211_4096,Gemm_Hipblaslt_TN_9898,0.546845
GemmTunableOp_Half_TN,tn_6144_1691_4096,Gemm_Hipblaslt_TN_9570,0.153013
GemmTunableOp_Half_TN,tn_4096_248_14336,Gemm_Hipblaslt_TN_9303,0.073483
GemmTunableOp_Half_TN,tn_6144_1596_4096,Gemm_Rocblas_621294306,0.149246
GemmTunableOp_Half_TN,tn_4096_152_4096,Gemm_Rocblas_621286443,0.0223288
GemmTunableOp_Half_TN,tn_57344_2159_8192,Gemm_Hipblaslt_TN_9827,4.00798
GemmTunableOp_Half_TN,tn_6144_5470_4096,Gemm_Hipblaslt_TN_9655,0.442176
GemmTunableOp_Half_TN,tn_4096_7432_4096,Gemm_Rocblas_621286281,0.416812
GemmTunableOp_Half_TN,tn_4096_3582_14336,Gemm_Hipblaslt_TN_9743,0.677391
GemmTunableOp_Half_TN,tn_128256_188_4096,Gemm_Hipblaslt_TN_9952,0.497523
GemmTunableOp_Half_TN,tn_4096_6630_14336,Gemm_Hipblaslt_TN_9692,1.33954
GemmTunableOp_Half_TN,tn_6144_1618_4096,Gemm_Rocblas_621294495,0.151751
GemmTunableOp_Half_TN,tn_4096_5068_14336,Gemm_Hipblaslt_TN_9681,1.047
GemmTunableOp_Half_TN,tn_4096_1603_4096,Gemm_Hipblaslt_TN_9587,0.102975
GemmTunableOp_Half_TN,tn_4096_1592_4096,Gemm_Hipblaslt_TN_9671,0.104947
GemmTunableOp_Half_TN,tn_28672_7023_4096,Gemm_Hipblaslt_TN_159,2.764
GemmTunableOp_Half_TN,tn_6144_5100_4096,Gemm_Hipblaslt_TN_9191,0.425741
GemmTunableOp_Half_TN,tn_6144_3597_4096,Gemm_Hipblaslt_TN_9570,0.313839
GemmTunableOp_Half_TN,tn_4096_7108_14336,Gemm_Hipblaslt_TN_9743,1.39705
GemmTunableOp_Half_TN,tn_6144_1748_4096,Gemm_Rocblas_621286705,0.15897
GemmTunableOp_Half_TN,tn_4096_5583_14336,Gemm_Hipblaslt_TN_9799,1.13533
GemmTunableOp_Half_TN,tn_6144_3652_4096,Gemm_Hipblaslt_TN_9687,0.325897
GemmTunableOp_Half_TN,tn_8192_66_8192,Gemm_Hipblaslt_TN_7093,0.0433538
GemmTunableOp_Half_TN,tn_4096_1853_4096,Gemm_Hipblaslt_TN_9590,0.120577
GemmTunableOp_Half_TN,tn_28672_3581_4096,Gemm_Hipblaslt_TN_9827,1.35097
GemmTunableOp_Half_TN,tn_4096_1609_4096,Gemm_Hipblaslt_TN_9180,0.105579
GemmTunableOp_Half_TN,tn_6144_1933_4096,Gemm_Hipblaslt_TN_9536,0.174961
GemmTunableOp_Half_TN,tn_6144_7077_4096,Gemm_Hipblaslt_TN_9814,0.588941
GemmTunableOp_Half_TN,tn_28672_1673_4096,Gemm_Hipblaslt_TN_9184,0.699369
GemmTunableOp_Half_TN,tn_32000_60_8192,Gemm_Rocblas_621286466,0.162671
GemmTunableOp_Half_TN,tn_6144_1690_4096,Gemm_Hipblaslt_TN_9570,0.153066
GemmTunableOp_Half_TN,tn_28672_5219_4096,Gemm_Hipblaslt_TN_9903,2.0474
GemmTunableOp_Half_TN,tn_28672_3383_4096,Gemm_Hipblaslt_TN_9827,1.3254
GemmTunableOp_Half_TN,tn_28672_6881_4096,Gemm_Hipblaslt_TN_9958,2.76228
GemmTunableOp_Half_TN,tn_4096_6744_4096,Gemm_Hipblaslt_TN_9832,0.386361
GemmTunableOp_Half_TN,tn_128256_112_4096,Gemm_Hipblaslt_TN_9061,0.397023
GemmTunableOp_Half_TN,tn_6144_1840_4096,Gemm_Hipblaslt_TN_9691,0.163225
GemmTunableOp_Half_TN,tn_4096_1589_4096,Gemm_Hipblaslt_TN_9180,0.102686
GemmTunableOp_Half_TN,tn_4096_6990_14336,Gemm_Hipblaslt_TN_9743,1.37665
GemmTunableOp_Half_TN,tn_8192_64_8192,Gemm_Hipblaslt_TN_7484,0.0397867
GemmTunableOp_Half_TN,tn_4096_1892_14336,Gemm_Hipblaslt_TN_9645,0.411734
GemmTunableOp_Half_TN,tn_4096_1815_14336,Gemm_Hipblaslt_TN_9645,0.404384
GemmTunableOp_Half_TN,tn_28672_1866_4096,Gemm_Hipblaslt_TN_9684,0.783066
GemmTunableOp_Half_TN,tn_6144_5735_4096,Gemm_Hipblaslt_TN_9799,0.501992
GemmTunableOp_Half_TN,tn_28672_1798_4096,Gemm_Hipblaslt_TN_9832,0.774016
GemmTunableOp_Half_TN,tn_4096_1691_4096,Gemm_Hipblaslt_TN_9359,0.107324
GemmTunableOp_Half_TN,tn_28672_3565_4096,Gemm_Hipblaslt_TN_9827,1.35309
GemmTunableOp_Half_TN,tn_4096_1601_14336,Gemm_Hipblaslt_TN_9265,0.357713
GemmTunableOp_Half_TN,tn_4096_1633_4096,Gemm_Hipblaslt_TN_9607,0.105644
GemmTunableOp_Half_TN,tn_4096_168_14336,Gemm_Hipblaslt_TN_7585,0.0608401
GemmTunableOp_Half_TN,tn_6144_5239_4096,Gemm_Hipblaslt_TN_9753,0.431047
GemmTunableOp_Half_TN,tn_28672_1660_4096,Gemm_Rocblas_621286678,0.699079
GemmTunableOp_Half_TN,tn_4096_6871_14336,Gemm_Hipblaslt_TN_9953,1.36852
GemmTunableOp_Half_TN,tn_4096_32_4096,Gemm_Rocblas_621286273,0.011371
GemmTunableOp_Half_TN,tn_28672_1784_4096,Gemm_Hipblaslt_TN_9223,0.717915
GemmTunableOp_Half_TN,tn_6144_3535_4096,Gemm_Hipblaslt_TN_9570,0.310702
GemmTunableOp_Half_TN,tn_4096_1764_14336,Gemm_Hipblaslt_TN_9645,0.3956
GemmTunableOp_Half_TN,tn_6144_3438_4096,Gemm_Rocblas_621286753,0.305331
GemmTunableOp_Half_TN,tn_8192_2129_28672,Gemm_Hipblaslt_TN_9762,2.0596
GemmTunableOp_Half_TN,tn_4096_7186_4096,Gemm_Hipblaslt_TN_9743,0.395448
GemmTunableOp_Half_TN,tn_4096_3420_4096,Gemm_Hipblaslt_TN_9743,0.193954
GemmTunableOp_Half_TN,tn_6144_1666_4096,Gemm_Rocblas_621294495,0.154043
GemmTunableOp_Half_TN,tn_6144_1586_4096,Gemm_Rocblas_621294306,0.148976
GemmTunableOp_Half_TN,tn_28672_1586_4096,Gemm_Rocblas_621286590,0.684653
GemmTunableOp_Half_TN,tn_28672_3300_4096,Gemm_Hipblaslt_TN_9827,1.33818
GemmTunableOp_Half_TN,tn_6144_5390_4096,Gemm_Hipblaslt_TN_9655,0.443111
GemmTunableOp_Half_TN,tn_32000_29_8192,Gemm_Rocblas_621286350,0.148363
GemmTunableOp_Half_TN,tn_6144_7138_4096,Gemm_Hipblaslt_TN_9188,0.59501
GemmTunableOp_Half_TN,tn_6144_5219_4096,Gemm_Hipblaslt_TN_9753,0.432289
GemmTunableOp_Half_TN,tn_28672_1597_4096,Gemm_Hipblaslt_TN_9217,0.687402
GemmTunableOp_Half_TN,tn_6144_3401_4096,Gemm_Hipblaslt_TN_9774,0.304202
GemmTunableOp_Half_TN,tn_28672_7730_4096,Gemm_Hipblaslt_TN_9930,2.99102
GemmTunableOp_Half_TN,tn_4096_1860_4096,Gemm_Hipblaslt_TN_9645,0.121512
GemmTunableOp_Half_TN,tn_4096_1860_14336,Gemm_Hipblaslt_TN_9268,0.406157
GemmTunableOp_Half_TN,tn_6144_3559_4096,Gemm_Rocblas_621294306,0.312145
GemmTunableOp_Half_TN,tn_4096_1601_4096,Gemm_Hipblaslt_TN_9265,0.103477
GemmTunableOp_Half_TN,tn_128256_131_4096,Gemm_Hipblaslt_TN_9108,0.427574
GemmTunableOp_Half_TN,tn_28672_6870_4096,Gemm_Hipblaslt_TN_9944,2.76157
GemmTunableOp_Half_TN,tn_4096_1647_14336,Gemm_Hipblaslt_TN_9790,0.360498
GemmTunableOp_Half_TN,tn_28672_5157_4096,Gemm_Hipblaslt_TN_9853,2.03671
GemmTunableOp_Half_TN,tn_128256_10_4096,Gemm_Rocblas_621294224,0.273347
GemmTunableOp_Half_TN,tn_4096_5068_4096,Gemm_Hipblaslt_TN_9774,0.311976
GemmTunableOp_Half_TN,tn_6144_1815_4096,Gemm_Hipblaslt_TN_9691,0.164312
GemmTunableOp_Half_TN,tn_6144_5412_4096,Gemm_Hipblaslt_TN_9815,0.444858
GemmTunableOp_Half_TN,tn_6144_3595_4096,Gemm_Hipblaslt_TN_9570,0.311993
GemmTunableOp_Half_TN,tn_6144_1871_4096,Gemm_Hipblaslt_TN_9691,0.165808
GemmStridedBatchedTunableOp_Half_TN,tn_1776_1776_128_B_32,Gemm_Rocblas_621294108,0.121893
GemmStridedBatchedTunableOp_Half_TN,tn_1652_1652_128_B_32,Gemm_Rocblas_621286397,0.114622
GemmStridedBatchedTunableOp_Half_TN,tn_1942_1942_128_B_32,Gemm_Hipblaslt_TN_6879,0.154035
GemmStridedBatchedTunableOp_Half_TN,tn_1635_1635_128_B_32,Gemm_Rocblas_621286397,0.113957
GemmStridedBatchedTunableOp_Half_TN,tn_1703_1703_128_B_32,Gemm_Hipblaslt_TN_6942,0.123002
GemmStridedBatchedTunableOp_Half_TN,tn_1727_1727_128_B_32,Gemm_Rocblas_621286397,0.122691
GemmStridedBatchedTunableOp_Half_TN,tn_1649_1649_128_B_32,Gemm_Hipblaslt_TN_6942,0.116644
GemmStridedBatchedTunableOp_Half_TN,tn_1608_1608_128_B_32,Gemm_Rocblas_621286397,0.109478
GemmStridedBatchedTunableOp_Half_TN,tn_1819_1819_128_B_32,Gemm_Hipblaslt_TN_6942,0.137431
GemmStridedBatchedTunableOp_Half_TN,tn_1653_1653_128_B_32,Gemm_Hipblaslt_TN_6942,0.119978
GemmStridedBatchedTunableOp_Half_TN,tn_1848_1848_128_B_32,Gemm_Hipblaslt_TN_6942,0.133517
GemmStridedBatchedTunableOp_Half_TN,tn_1647_1647_128_B_32,Gemm_Rocblas_621294110,0.118425
GemmStridedBatchedTunableOp_Half_TN,tn_1920_1920_128_B_32,Gemm_Rocblas_621294306,0.126347
GemmStridedBatchedTunableOp_Half_TN,tn_1743_1743_128_B_32,Gemm_Rocblas_621294110,0.123997
GemmStridedBatchedTunableOp_Half_TN,tn_1972_1972_128_B_32,Gemm_Rocblas_621294533,0.156806
GemmStridedBatchedTunableOp_Half_TN,tn_1614_1614_128_B_32,Gemm_Rocblas_621286397,0.11105
GemmStridedBatchedTunableOp_Half_TN,tn_1755_1755_128_B_32,Gemm_Rocblas_621286397,0.127224
GemmStridedBatchedTunableOp_Half_TN,tn_1854_1854_128_B_32,Gemm_Rocblas_621286397,0.142168
GemmStridedBatchedTunableOp_Half_TN,tn_1673_1673_128_B_32,Gemm_Hipblaslt_TN_6942,0.117732
GemmStridedBatchedTunableOp_Half_TN,tn_1732_1732_128_B_32,Gemm_Rocblas_621286397,0.122746
GemmStridedBatchedTunableOp_Half_TN,tn_1891_1891_128_B_32,Gemm_Hipblaslt_TN_6942,0.144234
GemmStridedBatchedTunableOp_Half_TN,tn_1657_1657_128_B_32,Gemm_Hipblaslt_TN_6942,0.117005
GemmStridedBatchedTunableOp_Half_TN,tn_1968_1968_128_B_32,Gemm_Rocblas_621286807,0.151927
GemmStridedBatchedTunableOp_Half_TN,tn_1700_1700_128_B_32,Gemm_Rocblas_621294110,0.120486
GemmStridedBatchedTunableOp_Half_TN,tn_1927_1927_128_B_32,Gemm_Rocblas_621294533,0.151153
GemmStridedBatchedTunableOp_Half_TN,tn_1936_1936_128_B_32,Gemm_Hipblaslt_TN_153,0.146025
GemmStridedBatchedTunableOp_Half_TN,tn_1830_1830_128_B_32,Gemm_Rocblas_621286397,0.141001
GemmStridedBatchedTunableOp_Half_TN,tn_1766_1766_128_B_32,Gemm_Rocblas_621294106,0.126737
GemmStridedBatchedTunableOp_Half_TN,tn_2079_2079_128_B_64,Gemm_Rocblas_621294106,0.360574
GemmStridedBatchedTunableOp_Half_TN,tn_1932_1932_128_B_32,Gemm_Hipblaslt_TN_6879,0.151278
GemmStridedBatchedTunableOp_Half_TN,tn_1836_1836_128_B_32,Gemm_Hipblaslt_TN_6942,0.141075
GemmStridedBatchedTunableOp_Half_TN,tn_1917_1917_128_B_32,Gemm_Hipblaslt_TN_6942,0.144962
GemmStridedBatchedTunableOp_Half_TN,tn_1839_1839_128_B_32,Gemm_Hipblaslt_TN_6942,0.144169
GemmStridedBatchedTunableOp_Half_TN,tn_1894_1894_128_B_32,Gemm_Hipblaslt_TN_6942,0.145956
GemmStridedBatchedTunableOp_Half_TN,tn_1604_1604_128_B_32,Gemm_Rocblas_621286397,0.111575
GemmStridedBatchedTunableOp_Half_TN,tn_1910_1910_128_B_32,Gemm_Hipblaslt_TN_6942,0.142354
GemmStridedBatchedTunableOp_Half_TN,tn_1718_1718_128_B_32,Gemm_Rocblas_621294110,0.123315
GemmStridedBatchedTunableOp_Half_TN,tn_1956_1956_128_B_32,Gemm_Hipblaslt_TN_6879,0.15431
GemmStridedBatchedTunableOp_Half_TN,tn_2385_2385_128_B_64,Gemm_Hipblaslt_TN_9831,0.470762
GemmStridedBatchedTunableOp_Half_TN,tn_1930_1930_128_B_32,Gemm_Hipblaslt_TN_6942,0.151871
GemmStridedBatchedTunableOp_Half_TN,tn_1626_1626_128_B_32,Gemm_Hipblaslt_TN_6929,0.116205
GemmStridedBatchedTunableOp_Half_TN,tn_2366_2366_128_B_64,Gemm_Hipblaslt_TN_158,0.459236
GemmStridedBatchedTunableOp_Half_TN,tn_1913_1913_128_B_32,Gemm_Hipblaslt_TN_6942,0.145254
GemmStridedBatchedTunableOp_Half_TN,tn_1947_1947_128_B_32,Gemm_Hipblaslt_TN_6879,0.155678
GemmStridedBatchedTunableOp_Half_TN,tn_2096_2096_128_B_64,Gemm_Hipblaslt_TN_158,0.331689
GemmStridedBatchedTunableOp_Half_TN,tn_1875_1875_128_B_32,Gemm_Hipblaslt_TN_6942,0.142763
GemmStridedBatchedTunableOp_Half_TN,tn_1802_1802_128_B_32,Gemm_Rocblas_621286397,0.137628
GemmStridedBatchedTunableOp_Half_TN,tn_1633_1633_128_B_32,Gemm_Rocblas_621286397,0.115747
GemmStridedBatchedTunableOp_Half_TN,tn_2192_2192_128_B_64,Gemm_Hipblaslt_TN_158,0.367872
GemmStridedBatchedTunableOp_Half_TN,tn_1734_1734_128_B_32,Gemm_Rocblas_621286397,0.121429
GemmStridedBatchedTunableOp_Half_TN,tn_1739_1739_128_B_32,Gemm_Rocblas_621294106,0.127112
GemmStridedBatchedTunableOp_Half_TN,tn_1744_1744_128_B_32,Gemm_Rocblas_621286413,0.115511
GemmStridedBatchedTunableOp_Half_TN,tn_1822_1822_128_B_32,Gemm_Hipblaslt_TN_6942,0.133728
GemmStridedBatchedTunableOp_Half_TN,tn_1914_1914_128_B_32,Gemm_Hipblaslt_TN_6942,0.145113
GemmStridedBatchedTunableOp_Half_TN,tn_1676_1676_128_B_32,Gemm_Hipblaslt_TN_6942,0.1161
GemmStridedBatchedTunableOp_Half_TN,tn_1588_1588_128_B_32,Gemm_Rocblas_621286397,0.109581
GemmStridedBatchedTunableOp_Half_TN,tn_2415_2415_128_B_64,Gemm_Rocblas_621294106,0.469797
GemmStridedBatchedTunableOp_Half_TN,tn_2161_2161_128_B_64,Gemm_Rocblas_621294106,0.388098
GemmStridedBatchedTunableOp_Half_TN,tn_1648_1648_128_B_32,Gemm_Rocblas_621286397,0.108779
GemmStridedBatchedTunableOp_Half_TN,tn_2065_2065_128_B_64,Gemm_Rocblas_621294106,0.355102
GemmStridedBatchedTunableOp_Half_TN,tn_1683_1683_128_B_32,Gemm_Rocblas_621286397,0.120859
GemmStridedBatchedTunableOp_Half_TN,tn_2239_2239_128_B_64,Gemm_Rocblas_621294106,0.404923
GemmStridedBatchedTunableOp_Half_TN,tn_1686_1686_128_B_32,Gemm_Hipblaslt_TN_6942,0.11715
GemmStridedBatchedTunableOp_Half_TN,tn_1898_1898_128_B_32,Gemm_Hipblaslt_TN_6942,0.14704
GemmStridedBatchedTunableOp_Half_TN,tn_2158_2158_128_B_64,Gemm_Hipblaslt_TN_158,0.365006
GemmStridedBatchedTunableOp_Half_TN,tn_2417_2417_128_B_64,Gemm_Rocblas_621294106,0.479928
GemmStridedBatchedTunableOp_Half_TN,tn_1622_1622_128_B_32,Gemm_Rocblas_621286397,0.112771
GemmStridedBatchedTunableOp_Half_TN,tn_2112_2112_128_B_64,Gemm_Hipblaslt_TN_9846,0.321764
GemmStridedBatchedTunableOp_Half_TN,tn_1693_1693_128_B_32,Gemm_Rocblas_621286413,0.118974
GemmStridedBatchedTunableOp_Half_TN,tn_1698_1698_128_B_32,Gemm_Rocblas_621294106,0.119059
GemmStridedBatchedTunableOp_Half_TN,tn_16_16_128_B_64,Gemm_Rocblas_621294459,0.00666188
GemmStridedBatchedTunableOp_Half_TN,tn_1963_1963_128_B_32,Gemm_Rocblas_621286397,0.156091
GemmStridedBatchedTunableOp_Half_TN,tn_1592_1592_128_B_32,Gemm_Rocblas_621286397,0.108616
GemmStridedBatchedTunableOp_Half_TN,tn_1795_1795_128_B_32,Gemm_Hipblaslt_TN_6895,0.139332
GemmStridedBatchedTunableOp_Half_TN,tn_1908_1908_128_B_32,Gemm_Hipblaslt_TN_6942,0.142275
GemmStridedBatchedTunableOp_Half_TN,tn_1773_1773_128_B_32,Gemm_Rocblas_621286397,0.129951
GemmStridedBatchedTunableOp_Half_TN,tn_1642_1642_128_B_32,Gemm_Rocblas_621286397,0.11445
GemmStridedBatchedTunableOp_Half_TN,tn_1829_1829_128_B_32,Gemm_Hipblaslt_TN_6942,0.13653
GemmStridedBatchedTunableOp_Half_TN,tn_1838_1838_128_B_32,Gemm_Hipblaslt_TN_6942,0.141751
GemmStridedBatchedTunableOp_Half_TN,tn_1729_1729_128_B_32,Gemm_Rocblas_621286397,0.123052
GemmStridedBatchedTunableOp_Half_TN,tn_2017_2017_128_B_64,Gemm_Hipblaslt_TN_6950,0.342323
GemmStridedBatchedTunableOp_Half_TN,tn_1807_1807_128_B_32,Gemm_Hipblaslt_TN_6942,0.134256
GemmStridedBatchedTunableOp_Half_TN,tn_1756_1756_128_B_32,Gemm_Rocblas_621286397,0.122524
GemmStridedBatchedTunableOp_Half_TN,tn_1828_1828_128_B_32,Gemm_Hipblaslt_TN_6939,0.141015
GemmStridedBatchedTunableOp_Half_TN,tn_1824_1824_128_B_32,Gemm_Rocblas_621286810,0.124741
GemmStridedBatchedTunableOp_Half_TN,tn_1949_1949_128_B_32,Gemm_Hipblaslt_TN_6879,0.155318
GemmStridedBatchedTunableOp_Half_TN,tn_1711_1711_128_B_32,Gemm_Hipblaslt_TN_6942,0.120099
GemmStridedBatchedTunableOp_Half_TN,tn_1804_1804_128_B_32,Gemm_Hipblaslt_TN_6895,0.138152
GemmStridedBatchedTunableOp_Half_TN,tn_1905_1905_128_B_32,Gemm_Hipblaslt_TN_6942,0.143536
GemmStridedBatchedTunableOp_Half_TN,tn_1772_1772_128_B_32,Gemm_Rocblas_621286397,0.129362
GemmStridedBatchedTunableOp_Half_TN,tn_1868_1868_128_B_32,Gemm_Rocblas_621294533,0.144164
GemmStridedBatchedTunableOp_Half_TN,tn_1933_1933_128_B_32,Gemm_Hipblaslt_TN_6879,0.151653
GemmStridedBatchedTunableOp_Half_TN,tn_1630_1630_128_B_32,Gemm_Rocblas_621286397,0.11189
GemmStridedBatchedTunableOp_Half_TN,tn_1685_1685_128_B_32,Gemm_Hipblaslt_TN_6942,0.120574
GemmStridedBatchedTunableOp_Half_TN,tn_1728_1728_128_B_32,Gemm_Rocblas_621294110,0.111016
GemmStridedBatchedTunableOp_Half_TN,tn_1677_1677_128_B_32,Gemm_Hipblaslt_TN_6942,0.117588
GemmStridedBatchedTunableOp_Half_TN,tn_1903_1903_128_B_32,Gemm_Hipblaslt_TN_6942,0.142956
GemmStridedBatchedTunableOp_Half_TN,tn_1800_1800_128_B_32,Gemm_Hipblaslt_TN_153,0.13278
GemmStridedBatchedTunableOp_Half_TN,tn_1981_1981_128_B_32,Gemm_Rocblas_621294533,0.159174
GemmStridedBatchedTunableOp_Half_TN,tn_1628_1628_128_B_32,Gemm_Rocblas_621286397,0.112894
GemmStridedBatchedTunableOp_Half_TN,tn_1786_1786_128_B_32,Gemm_Rocblas_621286411,0.13173
GemmStridedBatchedTunableOp_Half_TN,tn_1674_1674_128_B_32,Gemm_Hipblaslt_TN_6879,0.119899
GemmStridedBatchedTunableOp_Half_TN,tn_1886_1886_128_B_32,Gemm_Hipblaslt_TN_6942,0.139584
GemmStridedBatchedTunableOp_Half_TN,tn_1801_1801_128_B_32,Gemm_Hipblaslt_TN_6942,0.14156
GemmStridedBatchedTunableOp_Half_TN,tn_1675_1675_128_B_32,Gemm_Rocblas_621286397,0.118501
GemmStridedBatchedTunableOp_Half_TN,tn_1719_1719_128_B_32,Gemm_Rocblas_621294110,0.121006
GemmStridedBatchedTunableOp_Half_TN,tn_1941_1941_128_B_32,Gemm_Hipblaslt_TN_6879,0.154893
GemmStridedBatchedTunableOp_Half_TN,tn_1639_1639_128_B_32,Gemm_Hipblaslt_TN_6942,0.117325
GemmStridedBatchedTunableOp_Half_TN,tn_2370_2370_128_B_64,Gemm_Hipblaslt_TN_158,0.461686
GemmStridedBatchedTunableOp_Half_TN,tn_1760_1760_128_B_32,Gemm_Rocblas_621286413,0.113051
GemmTunableOp_Half_TN,tn_4096_1731_14336,Gemm_Hipblaslt_TN_9645,0.395562
GemmTunableOp_Half_TN,tn_6144_1799_4096,Gemm_Hipblaslt_TN_9691,0.163474
GemmTunableOp_Half_TN,tn_6144_1608_4096,Gemm_Hipblaslt_TN_9570,0.150223
GemmTunableOp_Half_TN,tn_4096_5447_4096,Gemm_Hipblaslt_TN_9799,0.327444
GemmTunableOp_Half_TN,tn_4096_1688_4096,Gemm_Hipblaslt_TN_9610,0.109008
GemmTunableOp_Half_TN,tn_6144_1958_4096,Gemm_Hipblaslt_TN_9693,0.178366
GemmTunableOp_Half_TN,tn_128256_218_4096,Gemm_Hipblaslt_TN_9898,0.559165
GemmTunableOp_Half_TN,tn_4096_3404_14336,Gemm_Hipblaslt_TN_9677,0.652744
GemmTunableOp_Half_TN,tn_28672_3309_4096,Gemm_Hipblaslt_TN_9827,1.3419
GemmTunableOp_Half_TN,tn_6144_1683_4096,Gemm_Hipblaslt_TN_9570,0.150993
GemmTunableOp_Half_TN,tn_28672_3688_4096,Gemm_Hipblaslt_TN_9827,1.48363
GemmTunableOp_Half_TN,tn_4096_1853_14336,Gemm_Hipblaslt_TN_9680,0.406256
GemmTunableOp_Half_TN,tn_6144_1970_4096,Gemm_Hipblaslt_TN_9693,0.178868
GemmTunableOp_Half_TN,tn_28672_1771_4096,Gemm_Hipblaslt_TN_9191,0.716459
GemmTunableOp_Half_TN,tn_4096_6800_4096,Gemm_Hipblaslt_TN_9832,0.385447
GemmTunableOp_Half_TN,tn_6144_1771_4096,Gemm_Hipblaslt_TN_9672,0.162185
GemmTunableOp_Half_TN,tn_4096_1748_14336,Gemm_Hipblaslt_TN_9329,0.397188
GemmTunableOp_Half_TN,tn_6144_1863_4096,Gemm_Hipblaslt_TN_9672,0.165484
GemmTunableOp_Half_TN,tn_28672_1805_4096,Gemm_Hipblaslt_TN_9832,0.782261
GemmTunableOp_Half_TN,tn_4096_3710_14336,Gemm_Hipblaslt_TN_9217,0.710914
GemmTunableOp_Half_TN,tn_28672_5605_4096,Gemm_Hipblaslt_TN_9919,2.28516
GemmTunableOp_Half_TN,tn_4096_1874_4096,Gemm_Hipblaslt_TN_9645,0.121932
GemmTunableOp_Half_TN,tn_4096_1873_4096,Gemm_Hipblaslt_TN_9134,0.121136
GemmTunableOp_Half_TN,tn_28672_7130_4096,Gemm_Hipblaslt_TN_159,2.79312
GemmTunableOp_Half_TN,tn_6144_3651_4096,Gemm_Hipblaslt_TN_9672,0.324475
GemmTunableOp_Half_TN,tn_4096_1810_14336,Gemm_Hipblaslt_TN_9268,0.401188
GemmTunableOp_Half_TN,tn_4096_1967_4096,Gemm_Hipblaslt_TN_9645,0.123769
GemmTunableOp_Half_TN,tn_28672_3768_4096,Gemm_Hipblaslt_TN_9827,1.50197
GemmTunableOp_Half_TN,tn_4096_3748_14336,Gemm_Hipblaslt_TN_9827,0.715368
GemmTunableOp_Half_TN,tn_4096_3565_14336,Gemm_Hipblaslt_TN_9743,0.673889
GemmTunableOp_Half_TN,tn_6144_3466_4096,Gemm_Hipblaslt_TN_9570,0.309999
GemmTunableOp_Half_TN,tn_6144_5512_4096,Gemm_Hipblaslt_TN_9815,0.446203
GemmTunableOp_Half_TN,tn_4096_1646_4096,Gemm_Hipblaslt_TN_9265,0.106605
GemmTunableOp_Half_TN,tn_4096_1946_14336,Gemm_Hipblaslt_TN_9680,0.417172
GemmTunableOp_Half_TN,tn_4096_1946_4096,Gemm_Hipblaslt_TN_9645,0.122985
GemmTunableOp_Half_TN,tn_6144_1779_4096,Gemm_Hipblaslt_TN_9799,0.163707
GemmTunableOp_Half_TN,tn_128256_142_4096,Gemm_Hipblaslt_TN_9108,0.450839
GemmTunableOp_Half_TN,tn_4096_72_14336,Gemm_Hipblaslt_TN_8023,0.0410268
GemmTunableOp_Half_TN,tn_4096_1970_14336,Gemm_Hipblaslt_TN_9680,0.41746
GemmTunableOp_Half_TN,tn_6144_1981_4096,Gemm_Hipblaslt_TN_9697,0.179582
GemmTunableOp_Half_TN,tn_4096_3300_4096,Gemm_Hipblaslt_TN_9221,0.192356
GemmTunableOp_Half_TN,tn_4096_3780_4096,Gemm_Hipblaslt_TN_9768,0.210929
GemmTunableOp_Half_TN,tn_28672_1778_4096,Gemm_Hipblaslt_TN_9223,0.718333
GemmTunableOp_Half_TN,tn_4096_1850_14336,Gemm_Hipblaslt_TN_9268,0.404593
GemmTunableOp_Half_TN,tn_8192_2366_8192,Gemm_Hipblaslt_TN_9651,0.564705
GemmTunableOp_Half_TN,tn_4096_192_14336,Gemm_Hipblaslt_TN_7584,0.0648213
GemmTunableOp_Half_TN,tn_6144_7206_4096,Gemm_Hipblaslt_TN_9743,0.592397
GemmTunableOp_Half_TN,tn_6144_3589_4096,Gemm_Rocblas_621286753,0.315341
GemmTunableOp_Half_TN,tn_28672_3450_4096,Gemm_Hipblaslt_TN_9827,1.32941
GemmTunableOp_Half_TN,tn_4096_1707_4096,Gemm_Hipblaslt_TN_9265,0.106333
GemmTunableOp_Half_TN,tn_28672_3912_4096,Gemm_Hipblaslt_TN_9841,1.54212
GemmTunableOp_Half_TN,tn_4096_5680_4096,Gemm_Hipblaslt_TN_9690,0.334797
GemmTunableOp_Half_TN,tn_6144_1607_4096,Gemm_Hipblaslt_TN_9570,0.150922
GemmTunableOp_Half_TN,tn_8192_2028_28672,Gemm_Hipblaslt_TN_9840,1.77302
GemmTunableOp_Half_TN,tn_4096_1877_14336,Gemm_Hipblaslt_TN_9134,0.410705
GemmTunableOp_Half_TN,tn_6144_1883_4096,Gemm_Hipblaslt_TN_9672,0.166572
GemmTunableOp_Half_TN,tn_4096_3450_14336,Gemm_Hipblaslt_TN_9677,0.658652
GemmTunableOp_Half_TN,tn_4096_1765_4096,Gemm_Hipblaslt_TN_9590,0.117188
GemmTunableOp_Half_TN,tn_28672_5530_4096,Gemm_Hipblaslt_TN_9924,2.25464
GemmTunableOp_Half_TN,tn_4096_1680_4096,Gemm_Hipblaslt_TN_9164,0.105897
GemmTunableOp_Half_TN,tn_128256_148_4096,Gemm_Hipblaslt_TN_9108,0.456389
GemmTunableOp_Half_TN,tn_4096_1735_4096,Gemm_Hipblaslt_TN_9645,0.116135
GemmTunableOp_Half_TN,tn_4096_1957_4096,Gemm_Hipblaslt_TN_9645,0.123585
GemmTunableOp_Half_TN,tn_6144_1882_4096,Gemm_Hipblaslt_TN_9672,0.166631
GemmTunableOp_Half_TN,tn_4096_200_4096,Gemm_Rocblas_621286443,0.0261415
GemmTunableOp_Half_TN,tn_6144_1749_4096,Gemm_Hipblaslt_TN_9691,0.159067
GemmTunableOp_Half_TN,tn_6144_1935_4096,Gemm_Hipblaslt_TN_9793,0.174865
GemmTunableOp_Half_TN,tn_128256_207_4096,Gemm_Hipblaslt_TN_9713,0.553867
GemmTunableOp_Half_TN,tn_128256_172_4096,Gemm_Hipblaslt_TN_9683,0.500132
GemmTunableOp_Half_TN,tn_28672_1690_4096,Gemm_Hipblaslt_TN_9191,0.702826
GemmTunableOp_Half_TN,tn_28672_1774_4096,Gemm_Hipblaslt_TN_9217,0.7164
GemmTunableOp_Half_TN,tn_6144_7108_4096,Gemm_Hipblaslt_TN_9814,0.589126
GemmTunableOp_Half_TN,tn_4096_1872_4096,Gemm_Hipblaslt_TN_9590,0.121496
GemmTunableOp_Half_TN,tn_4096_184_4096,Gemm_Rocblas_621286443,0.0235404
GemmTunableOp_Half_TN,tn_128256_183_4096,Gemm_Hipblaslt_TN_9803,0.50163
GemmTunableOp_Half_TN,tn_28672_1592_4096,Gemm_Hipblaslt_TN_9217,0.688015
GemmTunableOp_Half_TN,tn_6144_1838_4096,Gemm_Hipblaslt_TN_9691,0.164764
GemmTunableOp_Half_TN,tn_6144_5352_4096,Gemm_Hipblaslt_TN_9933,0.437226
GemmTunableOp_Half_TN,tn_6144_7568_4096,Gemm_Hipblaslt_TN_9768,0.63416
GemmTunableOp_Half_TN,tn_6144_3781_4096,Gemm_Hipblaslt_TN_9672,0.332442
GemmTunableOp_Half_TN,tn_6144_6870_4096,Gemm_Hipblaslt_TN_9188,0.577374
GemmTunableOp_Half_TN,tn_57344_2225_8192,Default,3.9926
GemmTunableOp_Half_TN,tn_28672_1916_4096,Gemm_Hipblaslt_TN_9683,0.790623
GemmTunableOp_Half_TN,tn_4096_1620_14336,Gemm_Hipblaslt_TN_9266,0.359745
GemmTunableOp_Half_TN,tn_4096_5219_4096,Gemm_Hipblaslt_TN_9691,0.319396
GemmTunableOp_Half_TN,tn_4096_5239_14336,Gemm_Hipblaslt_TN_9799,1.07916
GemmTunableOp_Half_TN,tn_28672_1760_4096,Gemm_Hipblaslt_TN_9223,0.712725
GemmTunableOp_Half_TN,tn_28672_1970_4096,Gemm_Hipblaslt_TN_9846,0.82129
GemmTunableOp_Half_TN,tn_6144_5413_4096,Gemm_Hipblaslt_TN_9655,0.446639
GemmTunableOp_Half_TN,tn_4096_6996_14336,Gemm_Hipblaslt_TN_9743,1.37786
GemmTunableOp_Half_TN,tn_4096_1875_4096,Gemm_Hipblaslt_TN_9645,0.120893
GemmTunableOp_Half_TN,tn_8192_2079_8192,Gemm_Hipblaslt_TN_9763,0.499218
GemmTunableOp_Half_TN,tn_6144_1699_4096,Gemm_Hipblaslt_TN_9570,0.154366
GemmTunableOp_Half_TN,tn_6144_1960_4096,Gemm_Hipblaslt_TN_9693,0.177757
GemmTunableOp_Half_TN,tn_4096_3706_4096,Gemm_Hipblaslt_TN_9827,0.212094
GemmTunableOp_Half_TN,tn_28672_3438_4096,Gemm_Hipblaslt_TN_9827,1.32805
GemmTunableOp_Half_TN,tn_4096_5735_14336,Gemm_Hipblaslt_TN_9709,1.15869
GemmTunableOp_Half_TN,tn_6144_1853_4096,Gemm_Hipblaslt_TN_9672,0.164345
GemmTunableOp_Half_TN,tn_4096_3920_14336,Gemm_Hipblaslt_TN_9217,0.737018
GemmTunableOp_Half_TN,tn_4096_1930_4096,Gemm_Hipblaslt_TN_9134,0.122894
GemmTunableOp_Half_TN,tn_4096_1830_4096,Gemm_Hipblaslt_TN_9137,0.122032
GemmTunableOp_Half_TN,tn_4096_1839_14336,Gemm_Hipblaslt_TN_9134,0.404732
GemmTunableOp_Half_TN,tn_8192_2096_8192,Gemm_Hipblaslt_TN_9742,0.497609
GemmTunableOp_Half_TN,tn_4096_1862_4096,Gemm_Hipblaslt_TN_9590,0.122725
GemmTunableOp_Half_TN,tn_4096_7047_4096,Gemm_Hipblaslt_TN_9221,0.395042
GemmTunableOp_Half_TN,tn_28672_1855_4096,Gemm_Hipblaslt_TN_9832,0.785984
GemmTunableOp_Half_TN,tn_32000_58_8192,Gemm_Rocblas_621294203,0.162968
GemmTunableOp_Half_TN,tn_4096_3427_14336,Gemm_Hipblaslt_TN_9677,0.656239
GemmTunableOp_Half_TN,tn_28672_1666_4096,Gemm_Rocblas_621294420,0.69939
GemmTunableOp_Half_TN,tn_6144_1688_4096,Gemm_Hipblaslt_TN_9570,0.153074
GemmTunableOp_Half_TN,tn_28672_1779_4096,Gemm_Hipblaslt_TN_9223,0.714858
GemmTunableOp_Half_TN,tn_28672_1706_4096,Gemm_Hipblaslt_TN_9217,0.706103
GemmTunableOp_Half_TN,tn_4096_1763_4096,Gemm_Hipblaslt_TN_9329,0.117302
GemmTunableOp_Half_TN,tn_4096_1881_4096,Gemm_Hipblaslt_TN_9590,0.12288
GemmTunableOp_Half_TN,tn_4096_1902_14336,Gemm_Hipblaslt_TN_9645,0.414017
GemmTunableOp_Half_TN,tn_28672_1842_4096,Gemm_Hipblaslt_TN_9832,0.785079
GemmTunableOp_Half_TN,tn_4096_3564_14336,Gemm_Hipblaslt_TN_9677,0.6689
GemmTunableOp_Half_TN,tn_4096_5274_14336,Gemm_Hipblaslt_TN_9799,1.08717
GemmTunableOp_Half_TN,tn_4096_1857_14336,Gemm_Hipblaslt_TN_9268,0.407412
GemmTunableOp_Half_TN,tn_28672_1931_4096,Gemm_Hipblaslt_TN_9846,0.813396
GemmTunableOp_Half_TN,tn_6144_7196_4096,Gemm_Hipblaslt_TN_9743,0.594032
GemmTunableOp_Half_TN,tn_28672_1752_4096,Gemm_Hipblaslt_TN_9190,0.712768
GemmTunableOp_Half_TN,tn_6144_208_4096,Gemm_Hipblaslt_TN_9495,0.0331664
GemmTunableOp_Half_TN,tn_4096_1735_14336,Gemm_Hipblaslt_TN_9645,0.395762
GemmTunableOp_Half_TN,tn_4096_5052_14336,Gemm_Hipblaslt_TN_9681,1.04822
GemmTunableOp_Half_TN,tn_4096_1757_14336,Gemm_Hipblaslt_TN_9267,0.396052
GemmTunableOp_Half_TN,tn_4096_1831_14336,Gemm_Hipblaslt_TN_9268,0.403947
GemmTunableOp_Half_TN,tn_10240_54_8192,Gemm_Hipblaslt_TN_7492,0.0471474
GemmTunableOp_Half_TN,tn_8192_2177_8192,Gemm_Hipblaslt_TN_9742,0.507084
GemmTunableOp_Half_TN,tn_4096_7340_4096,Gemm_Hipblaslt_TN_9914,0.416404
GemmTunableOp_Half_TN,tn_128256_63_4096,Gemm_Hipblaslt_TN_9097,0.336935
GemmTunableOp_Half_TN,tn_6144_1824_4096,Gemm_Hipblaslt_TN_9691,0.164816
GemmTunableOp_Half_TN,tn_6144_1745_4096,Gemm_Hipblaslt_TN_9672,0.158179
GemmTunableOp_Half_TN,tn_4096_1737_14336,Gemm_Hipblaslt_TN_9329,0.395046
GemmTunableOp_Half_TN,tn_6144_3514_4096,Gemm_Hipblaslt_TN_9570,0.31151
GemmTunableOp_Half_TN,tn_4096_1605_14336,Gemm_Hipblaslt_TN_9610,0.359476
GemmTunableOp_Half_TN,tn_6144_6881_4096,Gemm_Hipblaslt_TN_9814,0.575337
GemmTunableOp_Half_TN,tn_28672_1924_4096,Gemm_Hipblaslt_TN_9846,0.815154
GemmTunableOp_Half_TN,tn_28672_3793_4096,Gemm_Hipblaslt_TN_9827,1.5082
GemmTunableOp_Half_TN,tn_4096_3713_4096,Gemm_Hipblaslt_TN_9827,0.210366
GemmTunableOp_Half_TN,tn_4096_6841_4096,Gemm_Hipblaslt_TN_9743,0.384646
GemmTunableOp_Half_TN,tn_4096_1966_14336,Gemm_Hipblaslt_TN_9645,0.41952
GemmTunableOp_Half_TN,tn_28672_1826_4096,Gemm_Hipblaslt_TN_9683,0.780437
GemmTunableOp_Half_TN,tn_6144_3511_4096,Gemm_Rocblas_621286753,0.313342
GemmTunableOp_Half_TN,tn_6144_3400_4096,Gemm_Hipblaslt_TN_9570,0.305069
GemmTunableOp_Half_TN,tn_57344_61_8192,Gemm_Rocblas_621286468,0.303204
GemmTunableOp_Half_TN,tn_4096_5277_14336,Gemm_Hipblaslt_TN_9799,1.08141
GemmTunableOp_Half_TN,tn_6144_3456_4096,Gemm_Hipblaslt_TN_9570,0.30359
GemmTunableOp_Half_TN,tn_28672_1689_4096,Gemm_Rocblas_621294420,0.703019
GemmTunableOp_Half_TN,tn_28672_1610_4096,Gemm_Hipblaslt_TN_9190,0.689674
GemmTunableOp_Half_TN,tn_4096_3400_14336,Gemm_Hipblaslt_TN_9682,0.657775
GemmTunableOp_Half_TN,tn_4096_1802_14336,Gemm_Hipblaslt_TN_9268,0.401598
GemmTunableOp_Half_TN,tn_28672_3600_4096,Gemm_Hipblaslt_TN_9832,1.43503
GemmTunableOp_Half_TN,tn_28672_5512_4096,Gemm_Hipblaslt_TN_9840,2.26887
GemmTunableOp_Half_TN,tn_4096_1690_14336,Gemm_Hipblaslt_TN_9265,0.365757
GemmTunableOp_Half_TN,tn_6144_1864_4096,Gemm_Hipblaslt_TN_9691,0.166065
GemmTunableOp_Half_TN,tn_4096_6870_4096,Gemm_Hipblaslt_TN_9221,0.390413
GemmTunableOp_Half_TN,tn_128256_20_4096,Gemm_Rocblas_621286348,0.298851
GemmTunableOp_Half_TN,tn_6144_1963_4096,Gemm_Hipblaslt_TN_9693,0.17744
GemmTunableOp_Half_TN,tn_128256_42_4096,Gemm_Hipblaslt_TN_9451,0.313502
GemmTunableOp_Half_TN,tn_6144_6901_4096,Gemm_Hipblaslt_TN_9139,0.578196
GemmTunableOp_Half_TN,tn_28672_7432_4096,Gemm_Hipblaslt_TN_159,2.87897
GemmTunableOp_Half_TN,tn_4096_3455_4096,Gemm_Hipblaslt_TN_9221,0.194992
GemmTunableOp_Half_TN,tn_4096_1663_14336,Gemm_Hipblaslt_TN_9671,0.363744
GemmTunableOp_Half_TN,tn_6144_5381_4096,Gemm_Hipblaslt_TN_9815,0.439327
GemmTunableOp_Half_TN,tn_4096_1698_14336,Gemm_Hipblaslt_TN_9679,0.365931
GemmTunableOp_Half_TN,tn_6144_7182_4096,Gemm_Hipblaslt_TN_9743,0.591982
GemmTunableOp_Half_TN,tn_4096_3764_4096,Gemm_Hipblaslt_TN_9841,0.21132
GemmTunableOp_Half_TN,tn_28672_40_4096,Gemm_Rocblas_621286464,0.0487405
GemmTunableOp_Half_TN,tn_8192_2369_28672,Gemm_Hipblaslt_TN_9771,2.2995
GemmTunableOp_Half_TN,tn_10240_4081_8192,Gemm_Hipblaslt_TN_9743,1.15482
GemmTunableOp_Half_TN,tn_8192_2302_28672,Gemm_Hipblaslt_TN_9774,2.26159
GemmTunableOp_Half_TN,tn_4096_5447_14336,Gemm_Hipblaslt_TN_9799,1.12429
GemmTunableOp_Half_TN,tn_6144_1648_4096,Gemm_Hipblaslt_TN_9570,0.152982
GemmTunableOp_Half_TN,tn_6144_5427_4096,Gemm_Hipblaslt_TN_9704,0.441192
GemmTunableOp_Half_TN,tn_28672_1691_4096,Gemm_Hipblaslt_TN_9217,0.703352
GemmTunableOp_Half_TN,tn_4096_1596_4096,Gemm_Hipblaslt_TN_9164,0.104643
GemmTunableOp_Half_TN,tn_4096_1769_4096,Gemm_Hipblaslt_TN_9605,0.117037
GemmTunableOp_Half_TN,tn_8192_2081_8192,Gemm_Hipblaslt_TN_9742,0.49958
GemmTunableOp_Half_TN,tn_57344_2160_8192,Gemm_Hipblaslt_TN_154,3.99523
GemmTunableOp_Half_TN,tn_8192_61_8192,Gemm_Hipblaslt_TN_7484,0.0395596
GemmTunableOp_Half_TN,tn_6144_1668_4096,Gemm_Hipblaslt_TN_9570,0.154492
GemmTunableOp_Half_TN,tn_4096_3508_4096,Gemm_Hipblaslt_TN_9221,0.197642
GemmTunableOp_Half_TN,tn_8192_4050_28672,Gemm_Rocblas_621286905,3.44389
GemmTunableOp_Half_TN,tn_57344_2028_8192,Gemm_Hipblaslt_TN_9840,3.53437
GemmTunableOp_Half_TN,tn_8192_2017_28672,Gemm_Hipblaslt_TN_9840,1.77793
GemmTunableOp_Half_TN,tn_128256_124_4096,Gemm_Rocblas_621286396,0.417163
GemmTunableOp_Half_TN,tn_8192_2284_8192,Gemm_Hipblaslt_TN_9742,0.517636
GemmTunableOp_Half_TN,tn_4096_3767_14336,Gemm_Hipblaslt_TN_9217,0.716692
GemmTunableOp_Half_TN,tn_4096_224_4096,Gemm_Rocblas_621286445,0.0259456
GemmTunableOp_Half_TN,tn_4096_3309_4096,Gemm_Hipblaslt_TN_9798,0.192467
GemmTunableOp_Half_TN,tn_4096_1924_4096,Gemm_Hipblaslt_TN_9645,0.124042
GemmTunableOp_Half_TN,tn_128256_56_4096,Gemm_Hipblaslt_TN_9097,0.332308
GemmTunableOp_Half_TN,tn_8192_2305_8192,Gemm_Rocblas_621286785,0.555093
GemmTunableOp_Half_TN,tn_6144_1643_4096,Gemm_Hipblaslt_TN_9570,0.151533
GemmTunableOp_Half_TN,tn_8192_2465_8192,Gemm_Hipblaslt_TN_9690,0.598933
GemmTunableOp_Half_TN,tn_28672_1966_4096,Gemm_Hipblaslt_TN_9846,0.818486
GemmTunableOp_Half_TN,tn_4096_3404_4096,Gemm_Hipblaslt_TN_9814,0.193513
GemmTunableOp_Half_TN,tn_4096_6789_14336,Gemm_Hipblaslt_TN_9694,1.35577
GemmTunableOp_Half_TN,tn_10240_2207_8192,Gemm_Hipblaslt_TN_9691,0.640858
GemmTunableOp_Half_TN,tn_28672_1780_4096,Gemm_Hipblaslt_TN_9217,0.718175
GemmTunableOp_Half_TN,tn_4096_3573_14336,Gemm_Hipblaslt_TN_9677,0.670734
GemmTunableOp_Half_TN,tn_8192_2159_28672,Gemm_Hipblaslt_TN_9762,2.05641
GemmTunableOp_Half_TN,tn_6144_6773_4096,Gemm_Hipblaslt_TN_9814,0.573531
GemmTunableOp_Half_TN,tn_6144_6761_4096,Gemm_Hipblaslt_TN_9697,0.574483
GemmTunableOp_Half_TN,tn_8192_2284_28672,Gemm_Hipblaslt_TN_9774,2.26451
GemmTunableOp_Half_TN,tn_8192_2239_28672,Gemm_Hipblaslt_TN_9762,2.11264
GemmTunableOp_Half_TN,tn_8192_2302_8192,Gemm_Hipblaslt_TN_9742,0.516773
GemmTunableOp_Half_TN,tn_8192_2193_8192,Gemm_Hipblaslt_TN_9742,0.509203
GemmTunableOp_Half_TN,tn_28672_3369_4096,Gemm_Hipblaslt_TN_9827,1.32468
GemmTunableOp_Half_TN,tn_28672_1589_4096,Gemm_Rocblas_621294420,0.683312
GemmTunableOp_Half_TN,tn_8192_4049_8192,Gemm_Hipblaslt_TN_9704,0.88793
GemmTunableOp_Half_TN,tn_8192_2113_28672,Gemm_Hipblaslt_TN_9762,2.05021
GemmTunableOp_Half_TN,tn_10240_2255_8192,Gemm_Rocblas_621286578,0.656211
GemmTunableOp_Half_TN,tn_57344_2112_8192,Gemm_Rocblas_621294543,3.95228
GemmTunableOp_Half_TN,tn_4096_1801_4096,Gemm_Hipblaslt_TN_9645,0.119372
GemmTunableOp_Half_TN,tn_10240_58_8192,Gemm_Hipblaslt_TN_9304,0.0478062
GemmTunableOp_Half_TN,tn_4096_7190_14336,Gemm_Hipblaslt_TN_9743,1.39549
GemmTunableOp_Half_TN,tn_128256_245_4096,Gemm_Rocblas_621294634,0.580427
GemmTunableOp_Half_TN,tn_57344_2207_8192,Gemm_Rocblas_621294543,4.01083
GemmTunableOp_Half_TN,tn_4096_1770_4096,Gemm_Hipblaslt_TN_9329,0.116826
GemmTunableOp_Half_TN,tn_8192_62_8192,Gemm_Hipblaslt_TN_7484,0.0397197
GemmTunableOp_Half_TN,tn_128256_236_4096,Gemm_Rocblas_621286905,0.573572
GemmTunableOp_Half_TN,tn_6144_3420_4096,Gemm_Hipblaslt_TN_9570,0.30408
GemmTunableOp_Half_TN,tn_10240_2225_8192,Gemm_Hipblaslt_TN_9687,0.643308
GemmTunableOp_Half_TN,tn_4096_1896_4096,Gemm_Hipblaslt_TN_9645,0.123744
GemmTunableOp_Half_TN,tn_8192_2049_8192,Gemm_Hipblaslt_TN_9742,0.494648
GemmTunableOp_Half_TN,tn_8192_2289_28672,Gemm_Hipblaslt_TN_9649,2.25738
GemmTunableOp_Half_TN,tn_28672_5030_4096,Gemm_Hipblaslt_TN_9827,2.04213
GemmTunableOp_Half_TN,tn_8192_2065_8192,Gemm_Hipblaslt_TN_9742,0.498666
GemmTunableOp_Half_TN,tn_6144_3592_4096,Gemm_Hipblaslt_TN_9570,0.311806
GemmTunableOp_Half_TN,tn_4096_7206_14336,Gemm_Hipblaslt_TN_9743,1.39176
GemmTunableOp_Half_TN,tn_128256_167_4096,Gemm_Hipblaslt_TN_9816,0.50158
GemmTunableOp_Half_TN,tn_4096_3791_4096,Gemm_Hipblaslt_TN_9841,0.211328
GemmTunableOp_Half_TN,tn_6144_3701_4096,Gemm_Hipblaslt_TN_9690,0.330134
GemmTunableOp_Half_TN,tn_8192_30_28672,Gemm_Rocblas_621286354,0.128331
GemmTunableOp_Half_TN,tn_28672_7104_4096,Gemm_Hipblaslt_TN_9859,2.80223
GemmTunableOp_Half_TN,tn_28672_1847_4096,Gemm_Hipblaslt_TN_9683,0.781534
GemmTunableOp_Half_TN,tn_8192_2112_8192,Gemm_Hipblaslt_TN_9742,0.501393
GemmTunableOp_Half_TN,tn_28672_1802_4096,Gemm_Hipblaslt_TN_9684,0.781247
GemmTunableOp_Half_TN,tn_8192_2208_8192,Gemm_Hipblaslt_TN_9742,0.510724
GemmTunableOp_Half_TN,tn_4096_5285_14336,Gemm_Hipblaslt_TN_9799,1.09087
GemmTunableOp_Half_TN,tn_128256_168_4096,Gemm_Hipblaslt_TN_9931,0.501639
GemmTunableOp_Half_TN,tn_10240_2305_8192,Gemm_Rocblas_621286580,0.668085
GemmTunableOp_Half_TN,tn_4096_1969_4096,Gemm_Hipblaslt_TN_9590,0.123085
GemmTunableOp_Half_TN,tn_8192_2191_8192,Gemm_Hipblaslt_TN_9742,0.511548
GemmTunableOp_Half_TN,tn_4096_7575_4096,Gemm_Hipblaslt_TN_9914,0.422206
GemmTunableOp_Half_TN,tn_10240_31_8192,Gemm_Hipblaslt_TN_7899,0.040621
GemmTunableOp_Half_TN,tn_6144_7050_4096,Gemm_Hipblaslt_TN_9221,0.585825
GemmTunableOp_Half_TN,tn_10240_4048_8192,Gemm_Hipblaslt_TN_9743,1.1359
GemmTunableOp_Half_TN,tn_57344_2000_8192,Gemm_Hipblaslt_TN_156,3.5153
GemmTunableOp_Half_TN,tn_28672_5465_4096,Gemm_Hipblaslt_TN_9924,2.26113
GemmTunableOp_Half_TN,tn_4096_7730_14336,Gemm_Hipblaslt_TN_9813,1.53234
GemmTunableOp_Half_TN,tn_57344_2113_8192,Gemm_Hipblaslt_TN_9841,4.00166
GemmTunableOp_Half_TN,tn_10240_2128_8192,Gemm_Hipblaslt_TN_9729,0.628935
GemmTunableOp_Half_TN,tn_6144_5354_4096,Gemm_Hipblaslt_TN_9903,0.438826
GemmTunableOp_Half_TN,tn_28672_5410_4096,Gemm_Hipblaslt_TN_9924,2.2401
GemmTunableOp_Half_TN,tn_4096_96_4096,Gemm_Rocblas_621294029,0.0154209
GemmTunableOp_Half_TN,tn_8192_55_8192,Gemm_Hipblaslt_TN_7493,0.0402518
GemmTunableOp_Half_TN,tn_4096_3438_4096,Gemm_Hipblaslt_TN_9221,0.195578
GemmTunableOp_Half_TN,tn_6144_3666_4096,Gemm_Hipblaslt_TN_9672,0.324153
GemmTunableOp_Half_TN,tn_6144_1765_4096,Gemm_Hipblaslt_TN_9691,0.162492
GemmTunableOp_Half_TN,tn_6144_1685_4096,Gemm_Rocblas_621286753,0.155236
GemmTunableOp_Half_TN,tn_10240_2257_8192,Gemm_Hipblaslt_TN_9697,0.657954
GemmTunableOp_Half_TN,tn_8192_57_28672,Gemm_Rocblas_621286489,0.145769
GemmTunableOp_Half_TN,tn_4096_1665_4096,Gemm_Hipblaslt_TN_9587,0.105402
GemmTunableOp_Half_TN,tn_28672_6989_4096,Gemm_Hipblaslt_TN_159,2.76997
GemmTunableOp_Half_TN,tn_57344_64_8192,Gemm_Rocblas_621286467,0.305396
GemmTunableOp_Half_TN,tn_4096_1722_4096,Gemm_Hipblaslt_TN_9164,0.107187
GemmTunableOp_Half_TN,tn_4096_1810_4096,Gemm_Hipblaslt_TN_9605,0.118888
GemmTunableOp_Half_TN,tn_4096_1933_4096,Gemm_Hipblaslt_TN_9645,0.123995
GemmTunableOp_Half_TN,tn_4096_6902_4096,Gemm_Hipblaslt_TN_9955,0.388704
GemmTunableOp_Half_TN,tn_8192_2190_28672,Gemm_Hipblaslt_TN_9762,2.08389
GemmTunableOp_Half_TN,tn_4096_1590_4096,Gemm_Hipblaslt_TN_9671,0.103962
GemmTunableOp_Half_TN,tn_4096_7478_14336,Gemm_Hipblaslt_TN_9749,1.50256
GemmTunableOp_Half_TN,tn_10240_2337_8192,Gemm_Rocblas_621286580,0.668849
GemmTunableOp_Half_TN,tn_10240_2177_8192,Gemm_Hipblaslt_TN_9729,0.633825
GemmTunableOp_Half_TN,tn_4096_3388_14336,Gemm_Hipblaslt_TN_9677,0.655671
GemmTunableOp_Half_TN,tn_28672_7120_4096,Gemm_Hipblaslt_TN_9919,2.79658
GemmTunableOp_Half_TN,tn_8192_2315_8192,Gemm_Hipblaslt_TN_9651,0.557082
GemmTunableOp_Half_TN,tn_8192_2065_28672,Gemm_Hipblaslt_TN_9763,2.08354
GemmTunableOp_Half_TN,tn_57344_2370_8192,Default,4.35181
GemmTunableOp_Half_TN,tn_4096_3456_4096,Gemm_Hipblaslt_TN_9743,0.194662
GemmTunableOp_Half_TN,tn_28672_1593_4096,Gemm_Hipblaslt_TN_9223,0.685701
GemmTunableOp_Half_TN,tn_4096_6997_4096,Gemm_Hipblaslt_TN_9814,0.391983
GemmTunableOp_Half_TN,tn_6144_3588_4096,Gemm_Rocblas_621294495,0.314561
GemmTunableOp_Half_TN,tn_28672_1892_4096,Gemm_Hipblaslt_TN_9683,0.788337
GemmTunableOp_Half_TN,tn_6144_16_4096,Gemm_Rocblas_621286273,0.0132158
GemmTunableOp_Half_TN,tn_4096_3578_14336,Gemm_Hipblaslt_TN_9814,0.676427
GemmTunableOp_Half_TN,tn_4096_128_4096,Gemm_Rocblas_621294029,0.0175493
GemmTunableOp_Half_TN,tn_57344_2305_8192,Default,4.28825
GemmTunableOp_Half_TN,tn_6144_1872_4096,Gemm_Hipblaslt_TN_9691,0.165757
GemmTunableOp_Half_TN,tn_28672_1737_4096,Gemm_Hipblaslt_TN_9190,0.706846
GemmTunableOp_Half_TN,tn_128256_7_4096,Gemm_Hipblaslt_TN_9405,0.27557
GemmTunableOp_Half_TN,tn_4096_1628_14336,Gemm_Hipblaslt_TN_9265,0.359076
GemmTunableOp_Half_TN,tn_4096_1609_14336,Gemm_Hipblaslt_TN_9180,0.358485
GemmTunableOp_Half_TN,tn_28672_1618_4096,Gemm_Rocblas_621294420,0.693733
GemmTunableOp_Half_TN,tn_8192_61_28672,Gemm_Rocblas_621294228,0.147695
GemmTunableOp_Half_TN,tn_6144_7190_4096,Gemm_Hipblaslt_TN_9743,0.593876
GemmTunableOp_Half_TN,tn_57344_2208_8192,Default,3.96219
GemmTunableOp_Half_TN,tn_128256_18_4096,Gemm_Rocblas_621294578,0.29684
GemmTunableOp_Half_TN,tn_28672_1792_4096,Gemm_Rocblas_621294484,0.713203
GemmTunableOp_Half_TN,tn_128256_52_4096,Gemm_Rocblas_621286813,0.332383
GemmTunableOp_Half_TN,tn_4096_1625_4096,Gemm_Hipblaslt_TN_9265,0.106235
GemmTunableOp_Half_TN,tn_10240_2413_8192,Gemm_Hipblaslt_TN_9697,0.694164
GemmTunableOp_Half_TN,tn_28672_3553_4096,Gemm_Hipblaslt_TN_9827,1.35232
GemmTunableOp_Half_TN,tn_32000_55_8192,Gemm_Rocblas_621286466,0.162836
GemmTunableOp_Half_TN,tn_28672_5436_4096,Gemm_Hipblaslt_TN_9924,2.22556
GemmTunableOp_Half_TN,tn_8192_63_28672,Default,0.148765
GemmTunableOp_Half_TN,tn_4096_1643_4096,Gemm_Hipblaslt_TN_9607,0.105843
GemmTunableOp_Half_TN,tn_128256_189_4096,Gemm_Hipblaslt_TN_9803,0.510812
GemmTunableOp_Half_TN,tn_4096_3382_4096,Gemm_Hipblaslt_TN_9188,0.193716
GemmTunableOp_Half_TN,tn_28672_1825_4096,Gemm_Hipblaslt_TN_9832,0.784603
GemmTunableOp_Half_TN,tn_4096_7136_14336,Gemm_Hipblaslt_TN_9743,1.39674
GemmTunableOp_Half_TN,tn_4096_3468_14336,Gemm_Hipblaslt_TN_9697,0.665289
GemmTunableOp_Half_TN,tn_128256_60_4096,Gemm_Hipblaslt_TN_9097,0.340109
GemmTunableOp_Half_TN,tn_28672_1898_4096,Gemm_Hipblaslt_TN_9683,0.795566
GemmTunableOp_Half_TN,tn_6144_1642_4096,Gemm_Hipblaslt_TN_9570,0.152704
GemmTunableOp_Half_TN,tn_4096_1852_14336,Gemm_Hipblaslt_TN_9268,0.405453
GemmTunableOp_Half_TN,tn_128256_24_4096,Gemm_Hipblaslt_TN_9451,0.300014
GemmTunableOp_Half_TN,tn_8192_2417_8192,Gemm_Hipblaslt_TN_9274,0.561006
GemmTunableOp_Half_TN,tn_8192_4033_8192,Gemm_Rocblas_621286590,0.884836
GemmTunableOp_Half_TN,tn_128256_74_4096,Gemm_Hipblaslt_TN_9057,0.357563
GemmTunableOp_Half_TN,tn_6144_1852_4096,Gemm_Hipblaslt_TN_9182,0.164302
GemmTunableOp_Half_TN,tn_4096_8192_14336,Gemm_Hipblaslt_TN_9815,1.58426
GemmTunableOp_Half_TN,tn_128256_221_4096,Gemm_Hipblaslt_TN_9898,0.558728
GemmTunableOp_Half_TN,tn_4096_40_4096,Gemm_Rocblas_621294153,0.012866
GemmTunableOp_Half_TN,tn_28672_7050_4096,Gemm_Hipblaslt_TN_9920,2.79395
GemmTunableOp_Half_TN,tn_4096_1820_14336,Gemm_Hipblaslt_TN_9268,0.404609
GemmTunableOp_Half_TN,tn_128256_96_4096,Gemm_Hipblaslt_TN_9057,0.363016
GemmTunableOp_Half_TN,tn_4096_1935_14336,Gemm_Hipblaslt_TN_9680,0.416631
GemmTunableOp_Half_TN,tn_8192_58_28672,Default,0.147111
GemmTunableOp_Half_TN,tn_4096_7325_4096,Gemm_Hipblaslt_TN_9914,0.417074
GemmTunableOp_Half_TN,tn_4096_1766_4096,Gemm_Hipblaslt_TN_9590,0.117352
GemmTunableOp_Half_TN,tn_4096_1660_14336,Gemm_Hipblaslt_TN_9180,0.358329
GemmTunableOp_Half_TN,tn_128256_180_4096,Gemm_Hipblaslt_TN_9803,0.50492
GemmTunableOp_Half_TN,tn_6144_1743_4096,Gemm_Hipblaslt_TN_9691,0.158523
GemmTunableOp_Half_TN,tn_128256_212_4096,Gemm_Hipblaslt_TN_9937,0.555306
GemmTunableOp_Half_TN,tn_6144_1973_4096,Gemm_Hipblaslt_TN_9536,0.178934
GemmTunableOp_Half_TN,tn_4096_1749_4096,Gemm_Hipblaslt_TN_9590,0.116068
GemmTunableOp_Half_TN,tn_28672_3640_4096,Gemm_Hipblaslt_TN_9832,1.44062
GemmTunableOp_Half_TN,tn_4096_1858_14336,Gemm_Hipblaslt_TN_9680,0.405856
GemmTunableOp_Half_TN,tn_4096_1829_14336,Gemm_Hipblaslt_TN_9137,0.404023
GemmTunableOp_Half_TN,tn_28672_1725_4096,Gemm_Hipblaslt_TN_9217,0.708216
GemmTunableOp_Half_TN,tn_128256_140_4096,Gemm_Hipblaslt_TN_9808,0.448141
GemmTunableOp_Half_TN,tn_4096_3630_4096,Gemm_Hipblaslt_TN_9814,0.201392
GemmTunableOp_Half_TN,tn_28672_24_4096,Gemm_Rocblas_621286346,0.0460713
GemmTunableOp_Half_TN,tn_4096_3553_14336,Gemm_Hipblaslt_TN_9192,0.676494
GemmTunableOp_Half_TN,tn_4096_1827_14336,Gemm_Hipblaslt_TN_9268,0.404193
GemmTunableOp_Half_TN,tn_4096_1733_14336,Gemm_Hipblaslt_TN_9267,0.39485
GemmTunableOp_Half_TN,tn_4096_3562_4096,Gemm_Hipblaslt_TN_9743,0.19951
GemmTunableOp_Half_TN,tn_6144_1670_4096,Gemm_Hipblaslt_TN_9570,0.153374
GemmTunableOp_Half_TN,tn_4096_3456_14336,Gemm_Hipblaslt_TN_9821,0.660431
GemmTunableOp_Half_TN,tn_8192_2415_28672,Gemm_Hipblaslt_TN_9771,2.3319
GemmTunableOp_Half_TN,tn_128256_39_4096,Gemm_Hipblaslt_TN_9451,0.30956
GemmTunableOp_Half_TN,tn_4096_3441_4096,Gemm_Hipblaslt_TN_9221,0.194751
GemmTunableOp_Half_TN,tn_4096_7301_14336,Gemm_Hipblaslt_TN_9749,1.49207
GemmTunableOp_Half_TN,tn_6144_5359_4096,Gemm_Hipblaslt_TN_9753,0.434067
GemmTunableOp_Half_TN,tn_32000_67_8192,Gemm_Hipblaslt_TN_9479,0.186451
GemmTunableOp_Half_TN,tn_6144_1658_4096,Gemm_Hipblaslt_TN_9570,0.152552
GemmTunableOp_Half_TN,tn_128256_198_4096,Gemm_Hipblaslt_TN_9937,0.543696
GemmTunableOp_Half_TN,tn_4096_1691_14336,Gemm_Hipblaslt_TN_9265,0.365812
GemmTunableOp_Half_TN,tn_128256_119_4096,Gemm_Hipblaslt_TN_9596,0.415511
GemmTunableOp_Half_TN,tn_6144_1623_4096,Gemm_Hipblaslt_TN_9570,0.150306
GemmTunableOp_Half_TN,tn_4096_1719_14336,Gemm_Hipblaslt_TN_9265,0.366987
GemmTunableOp_Half_TN,tn_28672_5442_4096,Gemm_Hipblaslt_TN_9924,2.25624
GemmTunableOp_Half_TN,tn_4096_16_14336,Gemm_Rocblas_621294135,0.0243576
GemmTunableOp_Half_TN,tn_128256_83_4096,Gemm_Hipblaslt_TN_9057,0.359041
GemmTunableOp_Half_TN,tn_28672_1930_4096,Gemm_Hipblaslt_TN_9846,0.814956
GemmTunableOp_Half_TN,tn_6144_3912_4096,Gemm_Rocblas_621294426,0.339939
GemmTunableOp_Half_TN,tn_8192_2397_28672,Gemm_Hipblaslt_TN_9771,2.33022
GemmTunableOp_Half_TN,tn_4096_6744_14336,Gemm_Hipblaslt_TN_9956,1.35748
GemmTunableOp_Half_TN,tn_28672_1665_4096,Gemm_Hipblaslt_TN_9223,0.694795
GemmTunableOp_Half_TN,tn_57344_2239_8192,Gemm_Rocblas_621294543,4.0345
GemmTunableOp_Half_TN,tn_128256_225_4096,Gemm_Rocblas_621286892,0.56345
GemmTunableOp_Half_TN,tn_4096_6843_4096,Gemm_Hipblaslt_TN_9743,0.388329
GemmTunableOp_Half_TN,tn_4096_1590_14336,Gemm_Hipblaslt_TN_9180,0.35814
GemmTunableOp_Half_TN,tn_28672_3855_4096,Gemm_Hipblaslt_TN_9841,1.54129
GemmTunableOp_Half_TN,tn_28672_1867_4096,Gemm_Hipblaslt_TN_9832,0.784492
GemmTunableOp_Half_TN,tn_6144_7301_4096,Gemm_Hipblaslt_TN_9753,0.620754
GemmTunableOp_Half_TN,tn_4096_5352_4096,Gemm_Hipblaslt_TN_9773,0.323799
GemmTunableOp_Half_TN,tn_6144_1909_4096,Gemm_Hipblaslt_TN_9691,0.167221
GemmTunableOp_Half_TN,tn_6144_5465_4096,Gemm_Hipblaslt_TN_9190,0.436817
GemmTunableOp_Half_TN,tn_4096_1847_14336,Gemm_Hipblaslt_TN_9134,0.407377
GemmTunableOp_Half_TN,tn_4096_7432_14336,Gemm_Hipblaslt_TN_9749,1.48629
GemmTunableOp_Half_TN,tn_4096_1855_4096,Gemm_Hipblaslt_TN_9645,0.121168
GemmTunableOp_Half_TN,tn_8192_28_28672,Gemm_Rocblas_621286354,0.129732
GemmTunableOp_Half_TN,tn_4096_7138_14336,Gemm_Hipblaslt_TN_9814,1.39429
GemmTunableOp_Half_TN,tn_6144_6979_4096,Gemm_Hipblaslt_TN_9677,0.583657
GemmTunableOp_Half_TN,tn_4096_6800_14336,Gemm_Hipblaslt_TN_9683,1.36086
GemmTunableOp_Half_TN,tn_128256_152_4096,Gemm_Hipblaslt_TN_9108,0.455916
GemmTunableOp_Half_TN,tn_4096_7130_14336,Gemm_Hipblaslt_TN_9743,1.3909
GemmTunableOp_Half_TN,tn_28672_1829_4096,Gemm_Hipblaslt_TN_9683,0.780518
GemmTunableOp_Half_TN,tn_28672_1794_4096,Gemm_Hipblaslt_TN_9832,0.781127
GemmTunableOp_Half_TN,tn_28672_1642_4096,Gemm_Rocblas_621294420,0.696504
GemmTunableOp_Half_TN,tn_128256_14_4096,Gemm_Hipblaslt_TN_9405,0.27958
GemmTunableOp_Half_TN,tn_4096_6868_4096,Gemm_Hipblaslt_TN_9188,0.38676
GemmTunableOp_Half_TN,tn_4096_3515_14336,Gemm_Hipblaslt_TN_9189,0.673132
GemmTunableOp_Half_TN,tn_6144_3450_4096,Gemm_Hipblaslt_TN_9570,0.304476
GemmTunableOp_Half_TN,tn_4096_1637_14336,Gemm_Hipblaslt_TN_9610,0.361252
GemmTunableOp_Half_TN,tn_28672_1884_4096,Gemm_Hipblaslt_TN_9832,0.791812
GemmTunableOp_Half_TN,tn_6144_3427_4096,Gemm_Hipblaslt_TN_9570,0.304928
GemmTunableOp_Half_TN,tn_6144_3773_4096,Gemm_Hipblaslt_TN_9691,0.333433
GemmTunableOp_Half_TN,tn_4096_3622_4096,Gemm_Hipblaslt_TN_9188,0.199995
GemmTunableOp_Half_TN,tn_6144_6952_4096,Gemm_Hipblaslt_TN_9814,0.584046
GemmTunableOp_Half_TN,tn_4096_6989_4096,Gemm_Hipblaslt_TN_9743,0.384172
GemmTunableOp_Half_TN,tn_6144_7579_4096,Gemm_Hipblaslt_TN_9655,0.627468
GemmTunableOp_Half_TN,tn_4096_5319_4096,Gemm_Hipblaslt_TN_9690,0.323652
GemmTunableOp_Half_TN,tn_28672_1850_4096,Gemm_Hipblaslt_TN_9832,0.78383
GemmTunableOp_Half_TN,tn_4096_6715_4096,Gemm_Hipblaslt_TN_9221,0.382753
GemmTunableOp_Half_TN,tn_4096_7023_4096,Gemm_Hipblaslt_TN_9743,0.39085
GemmTunableOp_Half_TN,tn_6144_7118_4096,Gemm_Hipblaslt_TN_9677,0.592895
GemmTunableOp_Half_TN,tn_28672_5301_4096,Gemm_Hipblaslt_TN_159,2.07633
GemmTunableOp_Half_TN,tn_4096_1615_14336,Gemm_Hipblaslt_TN_9265,0.359434
GemmTunableOp_Half_TN,tn_28672_6901_4096,Gemm_Hipblaslt_TN_9955,2.75908
GemmTunableOp_Half_TN,tn_4096_6976_14336,Gemm_Hipblaslt_TN_9743,1.37707
GemmTunableOp_Half_TN,tn_6144_6860_4096,Gemm_Hipblaslt_TN_9743,0.576044
GemmTunableOp_Half_TN,tn_6144_5583_4096,Gemm_Rocblas_621294420,0.448572
GemmTunableOp_Half_TN,tn_128256_35_4096,Gemm_Hipblaslt_TN_9451,0.306342
GemmTunableOp_Half_TN,tn_4096_1760_14336,Gemm_Hipblaslt_TN_9645,0.398366
GemmTunableOp_Half_TN,tn_128256_229_4096,Gemm_Rocblas_621286892,0.564889
GemmTunableOp_Half_TN,tn_28672_3764_4096,Gemm_Hipblaslt_TN_9827,1.49352
GemmTunableOp_Half_TN,tn_128256_217_4096,Gemm_Hipblaslt_TN_9710,0.556124
GemmTunableOp_Half_TN,tn_10240_2370_8192,Gemm_Rocblas_621286684,0.676718
GemmTunableOp_Half_TN,tn_6144_6997_4096,Gemm_Hipblaslt_TN_9697,0.584924
GemmTunableOp_Half_TN,tn_6144_72_4096,Gemm_Rocblas_621286280,0.0190265
GemmTunableOp_Half_TN,tn_4096_8_14336,Gemm_Rocblas_621286312,0.0234511
GemmTunableOp_Half_TN,tn_6144_7093_4096,Gemm_Hipblaslt_TN_9221,0.585881
GemmTunableOp_Half_TN,tn_28672_1647_4096,Gemm_Hipblaslt_TN_9223,0.698297
GemmTunableOp_Half_TN,tn_4096_7109_14336,Gemm_Hipblaslt_TN_9743,1.38639
GemmTunableOp_Half_TN,tn_4096_7072_4096,Gemm_Hipblaslt_TN_9743,0.390733
GemmTunableOp_Half_TN,tn_4096_1600_14336,Gemm_Hipblaslt_TN_9265,0.35771
GemmTunableOp_Half_TN,tn_4096_1840_4096,Gemm_Hipblaslt_TN_9645,0.120577
GemmTunableOp_Half_TN,tn_4096_7344_14336,Gemm_Hipblaslt_TN_9815,1.49141
GemmTunableOp_Half_TN,tn_57344_29_8192,Gemm_Rocblas_621286350,0.273382
GemmTunableOp_Half_TN,tn_6144_7364_4096,Gemm_Hipblaslt_TN_9220,0.621845
GemmTunableOp_Half_TN,tn_6144_248_4096,Gemm_Rocblas_621294232,0.0366498
GemmTunableOp_Half_TN,tn_4096_3420_14336,Gemm_Hipblaslt_TN_9139,0.660545
GemmTunableOp_Half_TN,tn_6144_6976_4096,Gemm_Hipblaslt_TN_9697,0.583123
GemmTunableOp_Half_TN,tn_128256_9_4096,Gemm_Hipblaslt_TN_9405,0.276773
GemmTunableOp_Half_TN,tn_28672_3574_4096,Gemm_Hipblaslt_TN_9827,1.34921
GemmTunableOp_Half_TN,tn_6144_1846_4096,Gemm_Hipblaslt_TN_9672,0.165371
GemmTunableOp_Half_TN,tn_10240_2465_8192,Gemm_Hipblaslt_TN_9697,0.693478
GemmTunableOp_Half_TN,tn_128256_230_4096,Gemm_Rocblas_621286892,0.572096
GemmTunableOp_Half_TN,tn_28672_3345_4096,Gemm_Hipblaslt_TN_9827,1.33991
GemmTunableOp_Half_TN,tn_28672_3595_4096,Gemm_Hipblaslt_TN_9832,1.43734
GemmTunableOp_Half_TN,tn_28672_8_4096,Gemm_Rocblas_621294052,0.044912
GemmTunableOp_Half_TN,tn_4096_3494_4096,Gemm_Hipblaslt_TN_9221,0.198391
GemmTunableOp_Half_TN,tn_4096_3214_4096,Gemm_Hipblaslt_TN_9743,0.189007
GemmTunableOp_Half_TN,tn_6144_7170_4096,Gemm_Hipblaslt_TN_9743,0.591654
GemmTunableOp_Half_TN,tn_4096_1648_4096,Gemm_Hipblaslt_TN_9587,0.106784
GemmTunableOp_Half_TN,tn_28672_168_4096,Gemm_Hipblaslt_TN_9587,0.0975535
GemmTunableOp_Half_TN,tn_4096_7403_4096,Gemm_Hipblaslt_TN_9914,0.419378
GemmTunableOp_Half_TN,tn_4096_7023_14336,Gemm_Hipblaslt_TN_9743,1.36635
GemmTunableOp_Half_TN,tn_28672_208_4096,Gemm_Hipblaslt_TN_9134,0.115276
GemmTunableOp_Half_TN,tn_4096_3565_4096,Gemm_Hipblaslt_TN_9814,0.199149
GemmTunableOp_Half_TN,tn_8192_2145_8192,Gemm_Hipblaslt_TN_9742,0.505244
GemmTunableOp_Half_TN,tn_4096_1651_14336,Gemm_Hipblaslt_TN_9671,0.362656
GemmTunableOp_Half_TN,tn_6144_1873_4096,Gemm_Hipblaslt_TN_9691,0.166384
GemmTunableOp_Half_TN,tn_28672_3597_4096,Gemm_Hipblaslt_TN_9832,1.44114
GemmTunableOp_Half_TN,tn_6144_1772_4096,Gemm_Hipblaslt_TN_9672,0.163034
GemmTunableOp_Half_TN,tn_6144_1707_4096,Gemm_Hipblaslt_TN_9570,0.151852
GemmTunableOp_Half_TN,tn_4096_1620_4096,Gemm_Hipblaslt_TN_9266,0.105835
GemmTunableOp_Half_TN,tn_8192_2177_28672,Gemm_Hipblaslt_TN_9762,2.06951
GemmTunableOp_Half_TN,tn_4096_1713_4096,Gemm_Hipblaslt_TN_9359,0.10785
GemmTunableOp_Half_TN,tn_4096_5322_4096,Gemm_Hipblaslt_TN_9799,0.324195
GemmTunableOp_Half_TN,tn_6144_5271_4096,Gemm_Hipblaslt_TN_9853,0.437029
GemmTunableOp_Half_TN,tn_4096_7267_4096,Gemm_Hipblaslt_TN_9743,0.399405
GemmTunableOp_Half_TN,tn_28672_3219_4096,Gemm_Hipblaslt_TN_9827,1.32628
GemmTunableOp_Half_TN,tn_6144_5052_4096,Gemm_Hipblaslt_TN_9813,0.426644
GemmTunableOp_Half_TN,tn_6144_6868_4096,Gemm_Hipblaslt_TN_9814,0.573975
GemmTunableOp_Half_TN,tn_4096_6881_14336,Gemm_Hipblaslt_TN_9683,1.36529
GemmTunableOp_Half_TN,tn_4096_6979_4096,Gemm_Hipblaslt_TN_9814,0.391198
GemmTunableOp_Half_TN,tn_4096_7108_4096,Gemm_Hipblaslt_TN_9221,0.397509
GemmTunableOp_Half_TN,tn_128256_104_4096,Gemm_Hipblaslt_TN_9061,0.405068
GemmTunableOp_Half_TN,tn_4096_5354_14336,Gemm_Hipblaslt_TN_9799,1.10991
GemmTunableOp_Half_TN,tn_4096_7170_4096,Gemm_Hipblaslt_TN_9743,0.400951
GemmTunableOp_Half_TN,tn_4096_5723_14336,Gemm_Hipblaslt_TN_9799,1.15757
GemmTunableOp_Half_TN,tn_28672_5089_4096,Gemm_Hipblaslt_TN_9827,2.04192
GemmTunableOp_Half_TN,tn_4096_7403_14336,Gemm_Hipblaslt_TN_9815,1.49746
GemmTunableOp_Half_TN,tn_128256_109_4096,Gemm_Hipblaslt_TN_9061,0.407582
GemmTunableOp_Half_TN,tn_28672_7096_4096,Gemm_Hipblaslt_TN_9898,2.79543
GemmTunableOp_Half_TN,tn_4096_3629_4096,Gemm_Hipblaslt_TN_9221,0.200354
GemmTunableOp_Half_TN,tn_6144_3780_4096,Gemm_Hipblaslt_TN_9690,0.332698
GemmTunableOp_Half_TN,tn_4096_3645_14336,Gemm_Hipblaslt_TN_9189,0.682456
GemmTunableOp_Half_TN,tn_28672_1573_4096,Gemm_Rocblas_621294420,0.683657
GemmTunableOp_Half_TN,tn_4096_1762_4096,Gemm_Hipblaslt_TN_9645,0.11774
GemmTunableOp_Half_TN,tn_4096_5100_4096,Gemm_Hipblaslt_TN_9924,0.314235
GemmTunableOp_Half_TN,tn_4096_3514_4096,Gemm_Hipblaslt_TN_9743,0.197363
GemmTunableOp_Half_TN,tn_4096_5442_14336,Gemm_Hipblaslt_TN_9799,1.11867
GemmTunableOp_Half_TN,tn_4096_160_4096,Gemm_Rocblas_621286445,0.0230593
GemmTunableOp_Half_TN,tn_28672_6789_4096,Gemm_Hipblaslt_TN_9955,2.75828
GemmTunableOp_Half_TN,tn_4096_6971_14336,Gemm_Hipblaslt_TN_9743,1.37485
GemmTunableOp_Half_TN,tn_8192_2127_8192,Gemm_Hipblaslt_TN_9742,0.504852
GemmTunableOp_Half_TN,tn_4096_3573_4096,Gemm_Hipblaslt_TN_9814,0.198794
GemmTunableOp_Half_TN,tn_28672_1877_4096,Gemm_Hipblaslt_TN_9832,0.782037
GemmTunableOp_Half_TN,tn_28672_1711_4096,Gemm_Hipblaslt_TN_9223,0.702745
GemmTunableOp_Half_TN,tn_28672_6761_4096,Gemm_Hipblaslt_TN_9958,2.74784
GemmTunableOp_Half_TN,tn_6144_176_4096,Gemm_Rocblas_621286443,0.0287338
GemmTunableOp_Half_TN,tn_57344_2128_8192,Gemm_Hipblaslt_TN_154,3.98007
GemmTunableOp_Half_TN,tn_4096_1607_4096,Gemm_Hipblaslt_TN_9671,0.103863
GemmTunableOp_Half_TN,tn_28672_1894_4096,Gemm_Hipblaslt_TN_9832,0.792361
GemmTunableOp_Half_TN,tn_4096_88_4096,Gemm_Rocblas_621286279,0.0154062
GemmTunableOp_Half_TN,tn_28672_1655_4096,Gemm_Hipblaslt_TN_9217,0.69832
GemmTunableOp_Half_TN,tn_8192_2238_28672,Gemm_Hipblaslt_TN_9762,2.10112
GemmTunableOp_Half_TN,tn_28672_3584_4096,Gemm_Hipblaslt_TN_9841,1.34558
GemmTunableOp_Half_TN,tn_4096_6920_4096,Gemm_Hipblaslt_TN_9814,0.392682
GemmTunableOp_Half_TN,tn_4096_7730_4096,Gemm_Hipblaslt_TN_9914,0.42999
GemmTunableOp_Half_TN,tn_8192_2225_8192,Gemm_Hipblaslt_TN_9742,0.509695
GemmTunableOp_Half_TN,tn_28672_3920_4096,Gemm_Hipblaslt_TN_9841,1.54313
GemmTunableOp_Half_TN,tn_28672_3214_4096,Gemm_Hipblaslt_TN_9827,1.31894
GemmTunableOp_Half_TN,tn_4096_7439_4096,Gemm_Hipblaslt_TN_9914,0.418885
GemmTunableOp_Half_TN,tn_4096_1840_14336,Gemm_Hipblaslt_TN_9268,0.404499
GemmTunableOp_Half_TN,tn_28672_1887_4096,Gemm_Hipblaslt_TN_9683,0.784155
GemmTunableOp_Half_TN,tn_6144_7439_4096,Gemm_Hipblaslt_TN_9753,0.624695
GemmTunableOp_Half_TN,tn_4096_1717_4096,Gemm_Hipblaslt_TN_9616,0.10778
GemmTunableOp_Half_TN,tn_28672_7027_4096,Gemm_Hipblaslt_TN_9859,2.78544
GemmTunableOp_Half_TN,tn_4096_184_14336,Gemm_Hipblaslt_TN_7585,0.0631845
GemmTunableOp_Half_TN,tn_6144_7130_4096,Gemm_Hipblaslt_TN_9221,0.591503
GemmTunableOp_Half_TN,tn_6144_192_4096,Gemm_Rocblas_621294171,0.0285775
GemmTunableOp_Half_TN,tn_128256_177_4096,Gemm_Hipblaslt_TN_9803,0.504541
GemmTunableOp_Half_TN,tn_6144_88_4096,Gemm_Rocblas_621286280,0.0212437
GemmTunableOp_Half_TN,tn_4096_5541_14336,Gemm_Hipblaslt_TN_9799,1.13568
GemmTunableOp_Half_TN,tn_128256_178_4096,Gemm_Hipblaslt_TN_9952,0.503129
GemmTunableOp_Half_TN,tn_28672_1601_4096,Gemm_Hipblaslt_TN_9223,0.691529
GemmTunableOp_Half_TN,tn_4096_1908_4096,Gemm_Hipblaslt_TN_9590,0.122973
GemmTunableOp_Half_TN,tn_28672_3468_4096,Gemm_Hipblaslt_TN_9827,1.33799
GemmTunableOp_Half_TN,tn_4096_1685_4096,Gemm_Hipblaslt_TN_9671,0.10753
GemmTunableOp_Half_TN,tn_4096_1684_4096,Gemm_Hipblaslt_TN_9607,0.10608
GemmTunableOp_Half_TN,tn_28672_80_4096,Gemm_Rocblas_621294461,0.0611359
GemmTunableOp_Half_TN,tn_28672_6965_4096,Gemm_Hipblaslt_TN_159,2.77214
GemmTunableOp_Half_TN,tn_4096_6965_4096,Gemm_Hipblaslt_TN_9677,0.391559
GemmTunableOp_Half_TN,tn_28672_1757_4096,Gemm_Hipblaslt_TN_9223,0.713664
GemmTunableOp_Half_TN,tn_6144_1601_4096,Gemm_Hipblaslt_TN_9570,0.151161
GemmTunableOp_Half_TN,tn_128256_54_4096,Gemm_Rocblas_621294557,0.333448
GemmTunableOp_Half_TN,tn_4096_1762_14336,Gemm_Hipblaslt_TN_9645,0.396125
GemmTunableOp_Half_TN,tn_28672_7093_4096,Gemm_Hipblaslt_TN_9892,2.80259
GemmTunableOp_Half_TN,tn_4096_7093_4096,Gemm_Hipblaslt_TN_9743,0.395682
GemmTunableOp_Half_TN,tn_6144_1603_4096,Gemm_Hipblaslt_TN_9570,0.149655
GemmTunableOp_Half_TN,tn_10240_2238_8192,Gemm_Hipblaslt_TN_9182,0.639212
GemmTunableOp_Half_TN,tn_6144_1774_4096,Gemm_Hipblaslt_TN_9672,0.161683
GemmTunableOp_Half_TN,tn_4096_5067_14336,Gemm_Hipblaslt_TN_9880,1.05437
GemmTunableOp_Half_TN,tn_6144_7552_4096,Gemm_Hipblaslt_TN_9768,0.629046
GemmTunableOp_Half_TN,tn_4096_7196_4096,Gemm_Hipblaslt_TN_9743,0.396968
GemmTunableOp_Half_TN,tn_28672_1960_4096,Gemm_Hipblaslt_TN_9846,0.816232
GemmTunableOp_Half_TN,tn_4096_1871_4096,Gemm_Hipblaslt_TN_9590,0.123592
GemmTunableOp_Half_TN,tn_6144_1763_4096,Gemm_Hipblaslt_TN_9691,0.164138
GemmTunableOp_Half_TN,tn_28672_1958_4096,Gemm_Hipblaslt_TN_9846,0.822917
GemmTunableOp_Half_TN,tn_4096_3515_4096,Gemm_Hipblaslt_TN_9221,0.198607
GemmTunableOp_Half_TN,tn_4096_6990_4096,Gemm_Hipblaslt_TN_9694,0.390862
GemmTunableOp_Half_TN,tn_4096_5495_4096,Gemm_Hipblaslt_TN_9799,0.328691
GemmTunableOp_Half_TN,tn_10240_2321_8192,Gemm_Hipblaslt_TN_9691,0.670413
GemmTunableOp_Half_TN,tn_4096_5495_14336,Gemm_Hipblaslt_TN_9799,1.12347
GemmTunableOp_Half_TN,tn_6144_1633_4096,Gemm_Hipblaslt_TN_9570,0.15161
GemmTunableOp_Half_TN,tn_4096_1633_14336,Gemm_Hipblaslt_TN_9265,0.358885
GemmTunableOp_Half_TN,tn_4096_5301_14336,Gemm_Hipblaslt_TN_9799,1.10056
GemmTunableOp_Half_TN,tn_4096_7240_4096,Gemm_Hipblaslt_TN_9743,0.39628
GemmTunableOp_Half_TN,tn_4096_1978_4096,Gemm_Hipblaslt_TN_9645,0.125377
GemmTunableOp_Half_TN,tn_128256_33_4096,Gemm_Hipblaslt_TN_9451,0.303945
GemmTunableOp_Half_TN,tn_28672_1860_4096,Gemm_Hipblaslt_TN_9683,0.775559
GemmTunableOp_Half_TN,tn_28672_1839_4096,Gemm_Hipblaslt_TN_9683,0.783485
GemmTunableOp_Half_TN,tn_4096_5196_14336,Gemm_Hipblaslt_TN_9799,1.07511
GemmTunableOp_Half_TN,tn_4096_1807_14336,Gemm_Hipblaslt_TN_9268,0.402405
GemmTunableOp_Half_TN,tn_4096_3379_4096,Gemm_Hipblaslt_TN_9221,0.19335
GemmTunableOp_Half_TN,tn_4096_1728_14336,Gemm_Hipblaslt_TN_9180,0.364478
GemmTunableOp_Half_TN,tn_4096_5089_14336,Gemm_Hipblaslt_TN_9880,1.04948
GemmTunableOp_Half_TN,tn_4096_3564_4096,Gemm_Hipblaslt_TN_9221,0.198554
GemmTunableOp_Half_TN,tn_4096_3507_4096,Gemm_Hipblaslt_TN_9743,0.199402
GemmTunableOp_Half_TN,tn_4096_7478_4096,Gemm_Hipblaslt_TN_9890,0.422495
GemmTunableOp_Half_TN,tn_4096_1704_14336,Gemm_Hipblaslt_TN_9164,0.364225
GemmTunableOp_Half_TN,tn_6144_5530_4096,Gemm_Hipblaslt_TN_9190,0.448626
GemmTunableOp_Half_TN,tn_6144_3468_4096,Gemm_Rocblas_621286566,0.309543
GemmTunableOp_Half_TN,tn_4096_5465_4096,Gemm_Hipblaslt_TN_9773,0.327457
GemmTunableOp_Half_TN,tn_4096_5030_4096,Gemm_Hipblaslt_TN_9691,0.314076
GemmTunableOp_Half_TN,tn_28672_1765_4096,Gemm_Hipblaslt_TN_9223,0.717062
GemmTunableOp_Half_TN,tn_4096_3369_14336,Gemm_Hipblaslt_TN_9139,0.652081
GemmTunableOp_Half_TN,tn_8192_2369_8192,Gemm_Hipblaslt_TN_9229,0.560168
GemmTunableOp_Half_TN,tn_4096_1623_4096,Gemm_Hipblaslt_TN_9180,0.104627
GemmTunableOp_Half_TN,tn_4096_7225_4096,Gemm_Hipblaslt_TN_9743,0.396426
GemmTunableOp_Half_TN,tn_4096_3767_4096,Gemm_Hipblaslt_TN_9841,0.211585
GemmTunableOp_Half_TN,tn_28672_1738_4096,Gemm_Hipblaslt_TN_9191,0.710816
GemmTunableOp_Half_TN,tn_4096_1831_4096,Gemm_Hipblaslt_TN_9134,0.120191
GemmTunableOp_Half_TN,tn_4096_176_4096,Gemm_Rocblas_621294168,0.0234385
GemmTunableOp_Half_TN,tn_4096_1683_4096,Gemm_Hipblaslt_TN_9607,0.107512
GemmTunableOp_Half_TN,tn_128256_252_4096,Gemm_Rocblas_621294634,0.578204
GemmTunableOp_Half_TN,tn_28672_112_4096,Gemm_Hipblaslt_TN_9550,0.0716591
GemmTunableOp_Half_TN,tn_28672_3494_4096,Gemm_Hipblaslt_TN_9827,1.33755
GemmTunableOp_Half_TN,tn_128256_234_4096,Gemm_Rocblas_621294634,0.568557
GemmTunableOp_Half_TN,tn_6144_152_4096,Gemm_Rocblas_621294168,0.0280411
GemmTunableOp_Half_TN,tn_4096_8_4096,Gemm_Rocblas_621294130,0.00999454
GemmTunableOp_Half_TN,tn_6144_1778_4096,Gemm_Hipblaslt_TN_9691,0.164555
GemmTunableOp_Half_TN,tn_10240_2192_8192,Gemm_Hipblaslt_TN_9690,0.640047
GemmTunableOp_Half_TN,tn_6144_3441_4096,Gemm_Hipblaslt_TN_9570,0.304843
GemmTunableOp_Half_TN,tn_28672_5196_4096,Gemm_Hipblaslt_TN_9890,2.05693
GemmTunableOp_Half_TN,tn_28672_1685_4096,Gemm_Rocblas_621294420,0.701477
GemmTunableOp_Half_TN,tn_28672_1815_4096,Gemm_Hipblaslt_TN_9832,0.785615
GemmTunableOp_Half_TN,tn_4096_5412_14336,Gemm_Hipblaslt_TN_9799,1.11067
GemmTunableOp_Half_TN,tn_4096_232_14336,Gemm_Hipblaslt_TN_9303,0.0742201
GemmTunableOp_Half_TN,tn_6144_1766_4096,Gemm_Hipblaslt_TN_9672,0.162211
GemmTunableOp_Half_TN,tn_4096_1642_4096,Gemm_Hipblaslt_TN_9671,0.107125
GemmTunableOp_Half_TN,tn_8192_2096_28672,Gemm_Hipblaslt_TN_9762,2.05435
GemmTunableOp_Half_TN,tn_4096_3511_4096,Gemm_Hipblaslt_TN_9814,0.198209
GemmTunableOp_Half_TN,tn_6144_1622_4096,Gemm_Rocblas_621294306,0.151889
GemmTunableOp_Half_TN,tn_4096_1854_4096,Gemm_Hipblaslt_TN_9645,0.121827
GemmTunableOp_Half_TN,tn_128256_117_4096,Gemm_Hipblaslt_TN_9061,0.411447
GemmStridedBatchedTunableOp_Half_TN,tn_1731_1731_128_B_32,Gemm_Rocblas_621286413,0.12359
GemmStridedBatchedTunableOp_Half_TN,tn_1814_1814_128_B_32,Gemm_Rocblas_621286397,0.141453
GemmStridedBatchedTunableOp_Half_TN,tn_1637_1637_128_B_32,Gemm_Hipblaslt_TN_6929,0.116114
GemmStridedBatchedTunableOp_Half_TN,tn_1979_1979_128_B_32,Gemm_Hipblaslt_TN_6879,0.161431
GemmStridedBatchedTunableOp_Half_TN,tn_1794_1794_128_B_32,Gemm_Rocblas_621286810,0.13898
GemmStridedBatchedTunableOp_Half_TN,tn_1603_1603_128_B_32,Gemm_Hipblaslt_TN_6929,0.115718
GemmStridedBatchedTunableOp_Half_TN,tn_1958_1958_128_B_32,Gemm_Hipblaslt_TN_6879,0.157653
GemmStridedBatchedTunableOp_Half_TN,tn_1791_1791_128_B_32,Gemm_Rocblas_621286397,0.134974
GemmStridedBatchedTunableOp_Half_TN,tn_1789_1789_128_B_32,Gemm_Rocblas_621286397,0.133857
GemmStridedBatchedTunableOp_Half_TN,tn_1759_1759_128_B_32,Gemm_Rocblas_621286397,0.128015
GemmStridedBatchedTunableOp_Half_TN,tn_1872_1872_128_B_32,Gemm_Hipblaslt_TN_153,0.13384
GemmStridedBatchedTunableOp_Half_TN,tn_1612_1612_128_B_32,Gemm_Rocblas_621286397,0.112775
GemmStridedBatchedTunableOp_Half_TN,tn_1945_1945_128_B_32,Gemm_Hipblaslt_TN_6942,0.157339
GemmStridedBatchedTunableOp_Half_TN,tn_1825_1825_128_B_32,Gemm_Hipblaslt_TN_6942,0.140647
GemmStridedBatchedTunableOp_Half_TN,tn_1736_1736_128_B_32,Gemm_Rocblas_621286397,0.122787
GemmStridedBatchedTunableOp_Half_TN,tn_1663_1663_128_B_32,Gemm_Rocblas_621294108,0.121425
GemmStridedBatchedTunableOp_Half_TN,tn_1748_1748_128_B_32,Gemm_Rocblas_621286413,0.126677
GemmStridedBatchedTunableOp_Half_TN,tn_1861_1861_128_B_32,Gemm_Hipblaslt_TN_6942,0.144116
GemmStridedBatchedTunableOp_Half_TN,tn_1816_1816_128_B_32,Gemm_Hipblaslt_TN_157,0.131406
GemmStridedBatchedTunableOp_Half_TN,tn_1931_1931_128_B_32,Gemm_Hipblaslt_TN_6879,0.153026
GemmStridedBatchedTunableOp_Half_TN,tn_1810_1810_128_B_32,Gemm_Hipblaslt_TN_6942,0.138744
GemmStridedBatchedTunableOp_Half_TN,tn_1707_1707_128_B_32,Gemm_Hipblaslt_TN_6942,0.121581
GemmStridedBatchedTunableOp_Half_TN,tn_1976_1976_128_B_32,Gemm_Hipblaslt_TN_157,0.157358
GemmStridedBatchedTunableOp_Half_TN,tn_1781_1781_128_B_32,Gemm_Rocblas_621286397,0.132457
GemmStridedBatchedTunableOp_Half_TN,tn_1596_1596_128_B_32,Gemm_Rocblas_621286397,0.11191
GemmStridedBatchedTunableOp_Half_TN,tn_1900_1900_128_B_32,Gemm_Hipblaslt_TN_6939,0.148173
GemmStridedBatchedTunableOp_Half_TN,tn_1621_1621_128_B_32,Gemm_Rocblas_621294106,0.117932
GemmStridedBatchedTunableOp_Half_TN,tn_1952_1952_128_B_32,Gemm_Hipblaslt_TN_150,0.143798
GemmStridedBatchedTunableOp_Half_TN,tn_1904_1904_128_B_32,Gemm_Hipblaslt_TN_153,0.13555
GemmStridedBatchedTunableOp_Half_TN,tn_1977_1977_128_B_32,Gemm_Hipblaslt_TN_6879,0.160748
GemmStridedBatchedTunableOp_Half_TN,tn_2284_2284_128_B_64,Gemm_Rocblas_621294106,0.42198
GemmStridedBatchedTunableOp_Half_TN,tn_1978_1978_128_B_32,Gemm_Rocblas_621294533,0.162832
GemmStridedBatchedTunableOp_Half_TN,tn_1973_1973_128_B_32,Gemm_Hipblaslt_TN_6879,0.161713
GemmStridedBatchedTunableOp_Half_TN,tn_1708_1708_128_B_32,Gemm_Rocblas_621286413,0.121143
GemmStridedBatchedTunableOp_Half_TN,tn_1880_1880_128_B_32,Gemm_Hipblaslt_TN_157,0.135356
GemmStridedBatchedTunableOp_Half_TN,tn_2028_2028_128_B_64,Gemm_Hipblaslt_TN_6950,0.341351
GemmStridedBatchedTunableOp_Half_TN,tn_1689_1689_128_B_32,Gemm_Rocblas_621286413,0.122192
GemmStridedBatchedTunableOp_Half_TN,tn_1723_1723_128_B_32,Gemm_Rocblas_621286413,0.125843
GemmStridedBatchedTunableOp_Half_TN,tn_1924_1924_128_B_32,Gemm_Hipblaslt_TN_6879,0.152901
GemmStridedBatchedTunableOp_Half_TN,tn_1589_1589_128_B_32,Gemm_Hipblaslt_TN_6929,0.113809
GemmStridedBatchedTunableOp_Half_TN,tn_1950_1950_128_B_32,Gemm_Hipblaslt_TN_6879,0.15832
GemmStridedBatchedTunableOp_Half_TN,tn_1775_1775_128_B_32,Gemm_Rocblas_621294106,0.131586
GemmStridedBatchedTunableOp_Half_TN,tn_1764_1764_128_B_32,Gemm_Rocblas_621294110,0.128074
GemmStridedBatchedTunableOp_Half_TN,tn_1815_1815_128_B_32,Gemm_Hipblaslt_TN_6942,0.142283
GemmStridedBatchedTunableOp_Half_TN,tn_1605_1605_128_B_32,Gemm_Hipblaslt_TN_6931,0.115447
GemmStridedBatchedTunableOp_Half_TN,tn_2315_2315_128_B_64,Gemm_Hipblaslt_TN_6879,0.452764
GemmStridedBatchedTunableOp_Half_TN,tn_1859_1859_128_B_32,Gemm_Hipblaslt_TN_6939,0.147224
GemmStridedBatchedTunableOp_Half_TN,tn_1965_1965_128_B_32,Gemm_Hipblaslt_TN_6879,0.162648
GemmStridedBatchedTunableOp_Half_TN,tn_1738_1738_128_B_32,Gemm_Rocblas_621294110,0.12495
GemmStridedBatchedTunableOp_Half_TN,tn_1620_1620_128_B_32,Gemm_Rocblas_621286397,0.115652
GemmStridedBatchedTunableOp_Half_TN,tn_2178_2178_128_B_64,Gemm_Hipblaslt_TN_158,0.373085
GemmStridedBatchedTunableOp_Half_TN,tn_1615_1615_128_B_32,Gemm_Hipblaslt_TN_6929,0.115543
GemmStridedBatchedTunableOp_Half_TN,tn_2097_2097_128_B_64,Gemm_Rocblas_621294106,0.372518
GemmStridedBatchedTunableOp_Half_TN,tn_1831_1831_128_B_32,Gemm_Hipblaslt_TN_6871,0.145352
GemmStridedBatchedTunableOp_Half_TN,tn_2305_2305_128_B_64,Gemm_Rocblas_621294106,0.445277
GemmStridedBatchedTunableOp_Half_TN,tn_1935_1935_128_B_32,Gemm_Rocblas_621294533,0.156148
GemmStridedBatchedTunableOp_Half_TN,tn_1644_1644_128_B_32,Gemm_Hipblaslt_TN_6929,0.119601
GemmStridedBatchedTunableOp_Half_TN,tn_2255_2255_128_B_64,Gemm_Rocblas_621294106,0.417
GemmStridedBatchedTunableOp_Half_TN,tn_1934_1934_128_B_32,Gemm_Hipblaslt_TN_6879,0.154877
GemmStridedBatchedTunableOp_Half_TN,tn_1877_1877_128_B_32,Gemm_Hipblaslt_TN_6942,0.144295
GemmStridedBatchedTunableOp_Half_TN,tn_2193_2193_128_B_64,Gemm_Rocblas_621294533,0.402838
GemmStridedBatchedTunableOp_Half_TN,tn_1873_1873_128_B_32,Gemm_Hipblaslt_TN_6942,0.144634
GemmStridedBatchedTunableOp_Half_TN,tn_1876_1876_128_B_32,Gemm_Hipblaslt_TN_6942,0.142031
GemmStridedBatchedTunableOp_Half_TN,tn_1782_1782_128_B_32,Gemm_Rocblas_621286397,0.132128
GemmStridedBatchedTunableOp_Half_TN,tn_2321_2321_128_B_64,Gemm_Hipblaslt_TN_9831,0.453682
GemmStridedBatchedTunableOp_Half_TN,tn_2302_2302_128_B_64,Gemm_Rocblas_621294106,0.423921
GemmStridedBatchedTunableOp_Half_TN,tn_1618_1618_128_B_32,Gemm_Rocblas_621286397,0.113683
GemmStridedBatchedTunableOp_Half_TN,tn_1641_1641_128_B_32,Gemm_Rocblas_621294106,0.121509
GemmStridedBatchedTunableOp_Half_TN,tn_1742_1742_128_B_32,Gemm_Rocblas_621286413,0.125021
GemmStridedBatchedTunableOp_Half_TN,tn_1799_1799_128_B_32,Gemm_Hipblaslt_TN_6939,0.137809
GemmStridedBatchedTunableOp_Half_TN,tn_2207_2207_128_B_64,Gemm_Rocblas_621294106,0.405514
GemmStridedBatchedTunableOp_Half_TN,tn_1833_1833_128_B_32,Gemm_Hipblaslt_TN_6942,0.139393
GemmStridedBatchedTunableOp_Half_TN,tn_2191_2191_128_B_64,Gemm_Rocblas_621294106,0.399175
GemmStridedBatchedTunableOp_Half_TN,tn_1792_1792_128_B_32,Gemm_Rocblas_621286397,0.101241
GemmStridedBatchedTunableOp_Half_TN,tn_1988_1988_128_B_32,Gemm_Rocblas_621294533,0.164252
GemmStridedBatchedTunableOp_Half_TN,tn_2238_2238_128_B_64,Gemm_Rocblas_621294106,0.404004
GemmStridedBatchedTunableOp_Half_TN,tn_1944_1944_128_B_32,Gemm_Hipblaslt_TN_153,0.146713
GemmStridedBatchedTunableOp_Half_TN,tn_1817_1817_128_B_32,Gemm_Hipblaslt_TN_6942,0.141679
GemmStridedBatchedTunableOp_Half_TN,tn_1753_1753_128_B_32,Gemm_Rocblas_621286413,0.128124
GemmStridedBatchedTunableOp_Half_TN,tn_1806_1806_128_B_32,Gemm_Hipblaslt_TN_6942,0.137031
GemmStridedBatchedTunableOp_Half_TN,tn_1881_1881_128_B_32,Gemm_Hipblaslt_TN_6939,0.15117
GemmStridedBatchedTunableOp_Half_TN,tn_1636_1636_128_B_32,Gemm_Rocblas_621286397,0.113276
GemmStridedBatchedTunableOp_Half_TN,tn_1957_1957_128_B_32,Gemm_Hipblaslt_TN_6879,0.158678
GemmStridedBatchedTunableOp_Half_TN,tn_1580_1580_128_B_32,Gemm_Rocblas_621286397,0.109555
GemmStridedBatchedTunableOp_Half_TN,tn_1640_1640_128_B_32,Gemm_Rocblas_621286397,0.114764
GemmStridedBatchedTunableOp_Half_TN,tn_1690_1690_128_B_32,Gemm_Rocblas_621286413,0.118134
GemmStridedBatchedTunableOp_Half_TN,tn_1967_1967_128_B_32,Gemm_Hipblaslt_TN_6879,0.160253
GemmStridedBatchedTunableOp_Half_TN,tn_1761_1761_128_B_32,Gemm_Rocblas_621294108,0.130443
GemmStridedBatchedTunableOp_Half_TN,tn_1664_1664_128_B_32,Gemm_Rocblas_621286509,0.105041
GemmStridedBatchedTunableOp_Half_TN,tn_1862_1862_128_B_32,Gemm_Hipblaslt_TN_6942,0.142526
GemmStridedBatchedTunableOp_Half_TN,tn_1716_1716_128_B_32,Gemm_Rocblas_621294110,0.119175
GemmStridedBatchedTunableOp_Half_TN,tn_1971_1971_128_B_32,Gemm_Hipblaslt_TN_6879,0.160404
GemmStridedBatchedTunableOp_Half_TN,tn_1937_1937_128_B_32,Gemm_Hipblaslt_TN_6879,0.154367
GemmStridedBatchedTunableOp_Half_TN,tn_1697_1697_128_B_32,Gemm_Rocblas_621294110,0.119221
GemmStridedBatchedTunableOp_Half_TN,tn_1613_1613_128_B_32,Gemm_Hipblaslt_TN_6929,0.11619
GemmStridedBatchedTunableOp_Half_TN,tn_1889_1889_128_B_32,Gemm_Hipblaslt_TN_6942,0.146204
GemmStridedBatchedTunableOp_Half_TN,tn_1770_1770_128_B_32,Gemm_Rocblas_621286413,0.129232
GemmStridedBatchedTunableOp_Half_TN,tn_1691_1691_128_B_32,Gemm_Hipblaslt_TN_6942,0.122376
GemmStridedBatchedTunableOp_Half_TN,tn_1871_1871_128_B_32,Gemm_Hipblaslt_TN_6942,0.14454
GemmStridedBatchedTunableOp_Half_TN,tn_1688_1688_128_B_32,Gemm_Rocblas_621294110,0.11878
GemmStridedBatchedTunableOp_Half_TN,tn_1687_1687_128_B_32,Gemm_Rocblas_621286413,0.119332
GemmStridedBatchedTunableOp_Half_TN,tn_2049_2049_128_B_64,Gemm_Rocblas_621294106,0.349922
GemmStridedBatchedTunableOp_Half_TN,tn_1597_1597_128_B_32,Gemm_Rocblas_621286397,0.114485
GemmStridedBatchedTunableOp_Half_TN,tn_1975_1975_128_B_32,Gemm_Hipblaslt_TN_6879,0.162325
GemmStridedBatchedTunableOp_Half_TN,tn_1787_1787_128_B_32,Gemm_Rocblas_621286397,0.132936
GemmStridedBatchedTunableOp_Half_TN,tn_1705_1705_128_B_32,Gemm_Rocblas_621294110,0.120896
