Gemm_Tune/Llama-2-70b-hf-2000inp/full_tuned0.csv
Validator,PT_VERSION,2.4.0
Validator,ROCM_VERSION,6.1.0.0-82-5fabb4c
Validator,HIPBLASLT_VERSION,0.7.0-1549b021
Validator,GCN_ARCH_NAME,gfx942:sramecc+:xnack-
Validator,ROCBLAS_VERSION,4.1.0-cefa4a9b-dirty
GemmTunableOp_Half_TN,tn_28672_6979_4096,Gemm_Hipblaslt_TN_9958,2.88015
GemmTunableOp_Half_TN,tn_6144_5447_4096,Gemm_Rocblas_621294330,0.459281
GemmTunableOp_Half_TN,tn_4096_1688_4096,Gemm_Hipblaslt_TN_9569,0.106932
GemmTunableOp_Half_TN,tn_6144_1958_4096,Gemm_Hipblaslt_TN_9697,0.178077
GemmTunableOp_Half_TN,tn_4096_5089_14336,Gemm_Hipblaslt_TN_9799,1.06303
GemmTunableOp_Half_TN,tn_128256_218_4096,Gemm_Hipblaslt_TN_9937,0.581522
GemmTunableOp_Half_TN,tn_6144_1683_4096,Gemm_Hipblaslt_TN_9570,0.15508
GemmTunableOp_Half_TN,tn_28672_3688_4096,Gemm_Hipblaslt_TN_9827,1.50888
GemmTunableOp_Half_TN,tn_4096_1853_14336,Gemm_Hipblaslt_TN_9645,0.413442
GemmTunableOp_Half_TN,tn_4096_1967_4096,Gemm_Hipblaslt_TN_9645,0.124575
GemmTunableOp_Half_TN,tn_28672_232_4096,Gemm_Rocblas_621286584,0.121247
GemmTunableOp_Half_TN,tn_4096_5605_4096,Gemm_Rocblas_621294315,0.339375
GemmTunableOp_Half_TN,tn_4096_1794_14336,Gemm_Hipblaslt_TN_9137,0.41065
GemmTunableOp_Half_TN,tn_28672_3564_4096,Gemm_Hipblaslt_TN_9827,1.3883
GemmTunableOp_Half_TN,tn_28672_7439_4096,Gemm_Hipblaslt_TN_159,2.92964
GemmTunableOp_Half_TN,tn_28672_3710_4096,Gemm_Hipblaslt_TN_9827,1.51281
GemmTunableOp_Half_TN,tn_28672_1704_4096,Gemm_Rocblas_621294484,0.727573
GemmTunableOp_Half_TN,tn_6144_48_4096,Gemm_Rocblas_621286428,0.0154126
GemmTunableOp_Half_TN,tn_4096_3553_4096,Gemm_Hipblaslt_TN_9743,0.200659
GemmTunableOp_Half_TN,tn_28672_1801_4096,Gemm_Hipblaslt_TN_9683,0.779835
GemmTunableOp_Half_TN,tn_28672_256_4096,Gemm_Rocblas_621294324,0.1217
GemmTunableOp_Half_TN,tn_28672_1874_4096,Gemm_Hipblaslt_TN_9684,0.805546
GemmTunableOp_Half_TN,tn_28672_1888_4096,Gemm_Hipblaslt_TN_9683,0.79559
GemmTunableOp_Half_TN,tn_4096_1888_4096,Gemm_Hipblaslt_TN_9645,0.122488
GemmTunableOp_Half_TN,tn_28672_1810_4096,Gemm_Hipblaslt_TN_9684,0.793983
GemmTunableOp_Half_TN,tn_28672_5447_4096,Gemm_Hipblaslt_TN_9865,2.30134
GemmTunableOp_Half_TN,tn_128256_215_4096,Gemm_Hipblaslt_TN_9847,0.574092
GemmTunableOp_Half_TN,tn_28672_5125_4096,Gemm_Rocblas_621286742,2.16432
GemmTunableOp_Half_TN,tn_28672_3466_4096,Gemm_Hipblaslt_TN_9827,1.37036
GemmTunableOp_Half_TN,tn_4096_1685_14336,Gemm_Hipblaslt_TN_9679,0.368786
GemmTunableOp_Half_TN,tn_28672_1946_4096,Gemm_Hipblaslt_TN_9846,0.839554
GemmTunableOp_Half_TN,tn_6144_1804_4096,Gemm_Hipblaslt_TN_9799,0.162778
GemmTunableOp_Half_TN,tn_4096_1779_14336,Gemm_Hipblaslt_TN_9645,0.396157
GemmTunableOp_Half_TN,tn_4096_1887_4096,Gemm_Hipblaslt_TN_9645,0.12258
GemmTunableOp_Half_TN,tn_4096_1637_4096,Gemm_Hipblaslt_TN_9671,0.104992
GemmTunableOp_Half_TN,tn_6144_1637_4096,Gemm_Hipblaslt_TN_9570,0.155099
GemmTunableOp_Half_TN,tn_28672_1713_4096,Gemm_Hipblaslt_TN_9217,0.731765
GemmTunableOp_Half_TN,tn_4096_72_14336,Gemm_Hipblaslt_TN_7511,0.038286
GemmTunableOp_Half_TN,tn_4096_1850_14336,Gemm_Hipblaslt_TN_9137,0.412905
GemmTunableOp_Half_TN,tn_8192_2366_8192,Gemm_Hipblaslt_TN_9651,0.558109
GemmTunableOp_Half_TN,tn_4096_192_14336,Gemm_Hipblaslt_TN_7585,0.062339
GemmTunableOp_Half_TN,tn_4096_40_4096,Gemm_Rocblas_621294155,0.0126589
GemmTunableOp_Half_TN,tn_6144_7182_4096,Gemm_Hipblaslt_TN_9743,0.604367
GemmTunableOp_Half_TN,tn_6144_5100_4096,Gemm_Hipblaslt_TN_9815,0.434983
GemmTunableOp_Half_TN,tn_4096_1765_4096,Gemm_Hipblaslt_TN_9645,0.116519
GemmTunableOp_Half_TN,tn_28672_3781_4096,Gemm_Hipblaslt_TN_9827,1.51849
GemmTunableOp_Half_TN,tn_28672_1655_4096,Gemm_Hipblaslt_TN_9193,0.724252
GemmTunableOp_Half_TN,tn_4096_1771_4096,Gemm_Hipblaslt_TN_9645,0.116562
GemmTunableOp_Half_TN,tn_8192_4081_28672,Gemm_Rocblas_621294658,3.45453
GemmTunableOp_Half_TN,tn_6144_1721_4096,Gemm_Rocblas_621294495,0.156636
GemmTunableOp_Half_TN,tn_4096_1708_14336,Gemm_Hipblaslt_TN_9671,0.368739
GemmTunableOp_Half_TN,tn_4096_3535_14336,Gemm_Hipblaslt_TN_9697,0.688341
GemmTunableOp_Half_TN,tn_4096_3455_4096,Gemm_Hipblaslt_TN_9221,0.196501
GemmTunableOp_Half_TN,tn_8192_4050_8192,Gemm_Hipblaslt_TN_9753,0.88945
GemmTunableOp_Half_TN,tn_4096_1826_14336,Gemm_Hipblaslt_TN_9268,0.410556
GemmTunableOp_Half_TN,tn_4096_3629_14336,Gemm_Hipblaslt_TN_9814,0.701228
GemmTunableOp_Half_TN,tn_6144_3404_4096,Gemm_Rocblas_621286753,0.312113
GemmTunableOp_Half_TN,tn_4096_5204_4096,Gemm_Hipblaslt_TN_9690,0.321539
GemmTunableOp_Half_TN,tn_8192_2321_8192,Gemm_Hipblaslt_TN_9274,0.552601
GemmTunableOp_Half_TN,tn_4096_1588_14336,Gemm_Hipblaslt_TN_9265,0.357489
GemmTunableOp_Half_TN,tn_4096_3588_14336,Gemm_Hipblaslt_TN_9743,0.694242
GemmTunableOp_Half_TN,tn_28672_3682_4096,Gemm_Hipblaslt_TN_9827,1.51184
GemmTunableOp_Half_TN,tn_4096_1859_4096,Gemm_Hipblaslt_TN_9645,0.120912
GemmTunableOp_Half_TN,tn_4096_1643_4096,Gemm_Hipblaslt_TN_9610,0.107422
GemmTunableOp_Half_TN,tn_28672_1643_4096,Gemm_Hipblaslt_TN_9217,0.714418
GemmTunableOp_Half_TN,tn_28672_1867_4096,Gemm_Hipblaslt_TN_9684,0.803602
GemmTunableOp_Half_TN,tn_4096_1953_4096,Gemm_Hipblaslt_TN_9680,0.122012
GemmTunableOp_Half_TN,tn_6144_1636_4096,Gemm_Rocblas_621294495,0.153512
GemmTunableOp_Half_TN,tn_8192_4066_28672,Gemm_Rocblas_621286915,3.44063
GemmTunableOp_Half_TN,tn_6144_7206_4096,Gemm_Hipblaslt_TN_9743,0.609503
GemmTunableOp_Half_TN,tn_4096_5680_4096,Gemm_Rocblas_621286684,0.341678
GemmTunableOp_Half_TN,tn_8192_2000_28672,Gemm_Hipblaslt_TN_9653,1.7399
GemmTunableOp_Half_TN,tn_4096_1707_4096,Gemm_Hipblaslt_TN_9671,0.10723
GemmTunableOp_Half_TN,tn_4096_128_4096,Gemm_Rocblas_621286279,0.0175846
GemmTunableOp_Half_TN,tn_4096_5030_14336,Gemm_Hipblaslt_TN_9799,1.05807
GemmTunableOp_Half_TN,tn_6144_3612_4096,Gemm_Hipblaslt_TN_9570,0.32527
GemmTunableOp_Half_TN,tn_6144_5285_4096,Gemm_Hipblaslt_TN_9933,0.447732
GemmTunableOp_Half_TN,tn_4096_1931_4096,Gemm_Hipblaslt_TN_9645,0.122465
GemmTunableOp_Half_TN,tn_28672_3526_4096,Gemm_Hipblaslt_TN_9827,1.378
GemmTunableOp_Half_TN,tn_128256_119_4096,Gemm_Hipblaslt_TN_9061,0.434261
GemmTunableOp_Half_TN,tn_6144_7575_4096,Gemm_Hipblaslt_TN_9753,0.645906
GemmTunableOp_Half_TN,tn_28672_3630_4096,Gemm_Hipblaslt_TN_9832,1.48247
GemmTunableOp_Half_TN,tn_4096_80_14336,Gemm_Hipblaslt_TN_7511,0.0392305
GemmTunableOp_Half_TN,tn_6144_1853_4096,Gemm_Hipblaslt_TN_9799,0.164994
GemmTunableOp_Half_TN,tn_4096_3920_14336,Gemm_Rocblas_621294035,0.755215
GemmTunableOp_Half_TN,tn_6144_120_4096,Gemm_Rocblas_621286440,0.0241969
GemmTunableOp_Half_TN,tn_4096_1605_4096,Gemm_Hipblaslt_TN_9607,0.1062
GemmTunableOp_Half_TN,tn_4096_3600_14336,Gemm_Hipblaslt_TN_9743,0.698082
GemmTunableOp_Half_TN,tn_4096_8192_4096,Gemm_Hipblaslt_TN_9914,0.460275
GemmTunableOp_Half_TN,tn_4096_3219_4096,Gemm_Hipblaslt_TN_9187,0.188997
GemmTunableOp_Half_TN,tn_4096_1706_14336,Gemm_Hipblaslt_TN_9679,0.370747
GemmTunableOp_Half_TN,tn_8192_67_8192,Gemm_Hipblaslt_TN_9304,0.04429
GemmTunableOp_Half_TN,tn_4096_7023_14336,Gemm_Hipblaslt_TN_9732,1.43388
GemmTunableOp_Half_TN,tn_6144_1820_4096,Gemm_Rocblas_621286683,0.164675
GemmTunableOp_Half_TN,tn_4096_3780_14336,Gemm_Hipblaslt_TN_9713,0.734152
GemmTunableOp_Half_TN,tn_4096_1862_4096,Gemm_Hipblaslt_TN_9645,0.121227
GemmTunableOp_Half_TN,tn_28672_1855_4096,Gemm_Hipblaslt_TN_9832,0.803744
GemmTunableOp_Half_TN,tn_4096_1842_14336,Gemm_Hipblaslt_TN_9174,0.411132
GemmTunableOp_Half_TN,tn_28672_1909_4096,Gemm_Hipblaslt_TN_9832,0.809437
GemmTunableOp_Half_TN,tn_8192_2302_28672,Gemm_Hipblaslt_TN_9771,2.26482
GemmTunableOp_Half_TN,tn_6144_1916_4096,Gemm_Hipblaslt_TN_9799,0.16911
GemmTunableOp_Half_TN,tn_128256_203_4096,Gemm_Hipblaslt_TN_9937,0.56255
GemmTunableOp_Half_TN,tn_4096_3388_4096,Gemm_Hipblaslt_TN_9187,0.195445
GemmTunableOp_Half_TN,tn_4096_1857_14336,Gemm_Hipblaslt_TN_9620,0.412
GemmTunableOp_Half_TN,tn_4096_3508_14336,Gemm_Hipblaslt_TN_9192,0.689438
GemmTunableOp_Half_TN,tn_4096_1850_4096,Gemm_Hipblaslt_TN_9645,0.11996
GemmTunableOp_Half_TN,tn_28672_1752_4096,Gemm_Hipblaslt_TN_9184,0.740724
GemmTunableOp_Half_TN,tn_6144_208_4096,Gemm_Hipblaslt_TN_9494,0.0336578
GemmTunableOp_Half_TN,tn_4096_1966_14336,Gemm_Hipblaslt_TN_9592,0.422986
GemmTunableOp_Half_TN,tn_28672_5030_4096,Gemm_Hipblaslt_TN_9865,2.1147
GemmTunableOp_Half_TN,tn_28672_7072_4096,Gemm_Hipblaslt_TN_9944,2.90347
GemmTunableOp_Half_TN,tn_6144_1977_4096,Gemm_Hipblaslt_TN_9693,0.17813
GemmTunableOp_Half_TN,tn_28672_1933_4096,Gemm_Hipblaslt_TN_9846,0.846432
GemmTunableOp_Half_TN,tn_6144_1824_4096,Gemm_Rocblas_621294426,0.16667
GemmTunableOp_Half_TN,tn_4096_1688_14336,Gemm_Hipblaslt_TN_9790,0.367774
GemmTunableOp_Half_TN,tn_6144_1745_4096,Gemm_Hipblaslt_TN_9799,0.159225
GemmTunableOp_Half_TN,tn_57344_59_8192,Gemm_Rocblas_621286466,0.301089
GemmTunableOp_Half_TN,tn_28672_1627_4096,Gemm_Hipblaslt_TN_9246,0.719814
GemmTunableOp_Half_TN,tn_28672_7027_4096,Gemm_Hipblaslt_TN_9944,2.89408
GemmTunableOp_Half_TN,tn_28672_1781_4096,Gemm_Hipblaslt_TN_9223,0.743561
GemmTunableOp_Half_TN,tn_4096_232_4096,Gemm_Rocblas_621294230,0.0262273
GemmTunableOp_Half_TN,tn_4096_1735_14336,Gemm_Hipblaslt_TN_9645,0.394316
GemmTunableOp_Half_TN,tn_128256_225_4096,Gemm_Rocblas_621294634,0.594192
GemmTunableOp_Half_TN,tn_28672_1665_4096,Gemm_Hipblaslt_TN_9730,0.720903
GemmTunableOp_Half_TN,tn_28672_1766_4096,Gemm_Hipblaslt_TN_9223,0.741664
GemmTunableOp_Half_TN,tn_4096_5410_14336,Gemm_Hipblaslt_TN_9799,1.13225
GemmTunableOp_Half_TN,tn_4096_96_4096,Gemm_Rocblas_621286280,0.0156598
GemmTunableOp_Half_TN,tn_4096_1643_14336,Gemm_Hipblaslt_TN_9265,0.363385
GemmTunableOp_Half_TN,tn_6144_6868_4096,Gemm_Hipblaslt_TN_9697,0.586166
GemmTunableOp_Half_TN,tn_28672_1945_4096,Gemm_Hipblaslt_TN_9846,0.834102
GemmTunableOp_Half_TN,tn_6144_1601_4096,Gemm_Rocblas_621286753,0.15303
GemmTunableOp_Half_TN,tn_128256_37_4096,Gemm_Hipblaslt_TN_9451,0.324795
GemmTunableOp_Half_TN,tn_28672_3501_4096,Gemm_Hipblaslt_TN_9827,1.38128
GemmTunableOp_Half_TN,tn_128256_52_4096,Gemm_Rocblas_621294557,0.358048
GemmTunableOp_Half_TN,tn_8192_2082_28672,Gemm_Hipblaslt_TN_9762,2.04698
GemmTunableOp_Half_TN,tn_4096_5277_14336,Gemm_Hipblaslt_TN_9799,1.0903
GemmTunableOp_Half_TN,tn_28672_3420_4096,Gemm_Hipblaslt_TN_9827,1.36309
GemmTunableOp_Half_TN,tn_28672_1660_4096,Gemm_Hipblaslt_TN_9223,0.723691
GemmTunableOp_Half_TN,tn_4096_1961_4096,Gemm_Hipblaslt_TN_9645,0.124453
GemmTunableOp_Half_TN,tn_4096_1772_4096,Gemm_Hipblaslt_TN_9134,0.117136
GemmTunableOp_Half_TN,tn_4096_1760_4096,Gemm_Hipblaslt_TN_9645,0.116726
GemmTunableOp_Half_TN,tn_6144_3666_4096,Gemm_Hipblaslt_TN_9687,0.329102
GemmTunableOp_Half_TN,tn_4096_3559_14336,Gemm_Hipblaslt_TN_9189,0.687774
GemmTunableOp_Half_TN,tn_4096_1757_14336,Gemm_Hipblaslt_TN_9645,0.395807
GemmTunableOp_Half_TN,tn_8192_2238_8192,Gemm_Hipblaslt_TN_9742,0.509735
GemmTunableOp_Half_TN,tn_32000_256_8192,Gemm_Rocblas_621294717,0.325301
GemmTunableOp_Half_TN,tn_6144_3706_4096,Gemm_Hipblaslt_TN_9691,0.335586
GemmTunableOp_Half_TN,tn_6144_1823_4096,Gemm_Rocblas_621286683,0.166255
GemmTunableOp_Half_TN,tn_6144_1953_4096,Gemm_Hipblaslt_TN_9793,0.176812
GemmTunableOp_Half_TN,tn_4096_1924_4096,Gemm_Hipblaslt_TN_9645,0.122421
GemmTunableOp_Half_TN,tn_4096_1614_4096,Gemm_Hipblaslt_TN_9265,0.105214
GemmTunableOp_Half_TN,tn_4096_5381_14336,Gemm_Hipblaslt_TN_9799,1.12894
GemmTunableOp_Half_TN,tn_4096_1872_14336,Gemm_Hipblaslt_TN_9592,0.411489
GemmTunableOp_Half_TN,tn_128256_170_4096,Gemm_Hipblaslt_TN_9952,0.511697
GemmTunableOp_Half_TN,tn_128256_198_4096,Gemm_Hipblaslt_TN_9937,0.563478
GemmTunableOp_Half_TN,tn_128256_166_4096,Gemm_Hipblaslt_TN_9952,0.509357
GemmTunableOp_Half_TN,tn_10240_55_8192,Gemm_Hipblaslt_TN_9088,0.0474745
GemmTunableOp_Half_TN,tn_57344_2289_8192,Gemm_Rocblas_621294542,4.05874
GemmTunableOp_Half_TN,tn_4096_5465_14336,Gemm_Hipblaslt_TN_9709,1.15871
GemmTunableOp_Half_TN,tn_6144_1707_4096,Gemm_Rocblas_621294495,0.157734
GemmTunableOp_Half_TN,tn_4096_1586_14336,Gemm_Hipblaslt_TN_9679,0.359244
GemmTunableOp_Half_TN,tn_4096_1799_4096,Gemm_Hipblaslt_TN_9602,0.120148
GemmTunableOp_Half_TN,tn_6144_7478_4096,Gemm_Hipblaslt_TN_9753,0.638478
GemmTunableOp_Half_TN,tn_28672_168_4096,Gemm_Hipblaslt_TN_7286,0.0955217
GemmTunableOp_Half_TN,tn_28672_1842_4096,Gemm_Hipblaslt_TN_9684,0.797705
GemmTunableOp_Half_TN,tn_128256_74_4096,Gemm_Hipblaslt_TN_9057,0.38458
GemmTunableOp_Half_TN,tn_10240_2113_8192,Gemm_Hipblaslt_TN_9729,0.625172
GemmTunableOp_Half_TN,tn_28672_1847_4096,Gemm_Hipblaslt_TN_9684,0.801308
GemmTunableOp_Half_TN,tn_4096_7130_4096,Gemm_Hipblaslt_TN_9743,0.406944
GemmTunableOp_Half_TN,tn_6144_1957_4096,Gemm_Hipblaslt_TN_9793,0.176177
GemmTunableOp_Half_TN,tn_10240_31_8192,Gemm_Hipblaslt_TN_9415,0.0408391
GemmTunableOp_Half_TN,tn_8192_2239_8192,Gemm_Hipblaslt_TN_9742,0.509928
GemmTunableOp_Half_TN,tn_128256_207_4096,Gemm_Hipblaslt_TN_9937,0.56864
GemmTunableOp_Half_TN,tn_28672_1690_4096,Gemm_Rocblas_621286742,0.727752
GemmTunableOp_Half_TN,tn_10240_54_8192,Gemm_Hipblaslt_TN_7492,0.0469979
GemmTunableOp_Half_TN,tn_57344_2127_8192,Gemm_Hipblaslt_TN_9827,4.0125
GemmTunableOp_Half_TN,tn_6144_1670_4096,Gemm_Hipblaslt_TN_9570,0.154547
GemmTunableOp_Half_TN,tn_6144_7403_4096,Gemm_Rocblas_621286742,0.634959
GemmTunableOp_Half_TN,tn_6144_3562_4096,Gemm_Rocblas_621286753,0.322865
GemmTunableOp_Half_TN,tn_6144_7327_4096,Gemm_Hipblaslt_TN_9959,0.631569
GemmTunableOp_Half_TN,tn_8192_2160_28672,Gemm_Hipblaslt_TN_9762,2.06279
GemmTunableOp_Half_TN,tn_4096_7340_4096,Gemm_Hipblaslt_TN_9919,0.424279
GemmTunableOp_Half_TN,tn_10240_2415_8192,Gemm_Hipblaslt_TN_9697,0.695083
GemmTunableOp_Half_TN,tn_8192_2190_28672,Gemm_Hipblaslt_TN_9762,2.07512
GemmTunableOp_Half_TN,tn_128256_255_4096,Gemm_Rocblas_621286892,0.614434
GemmTunableOp_Half_TN,tn_57344_2160_8192,Gemm_Hipblaslt_TN_156,3.99395
GemmTunableOp_Half_TN,tn_8192_2337_8192,Gemm_Hipblaslt_TN_9229,0.551708
GemmTunableOp_Half_TN,tn_4096_1618_4096,Gemm_Hipblaslt_TN_9610,0.106423
GemmTunableOp_Half_TN,tn_4096_1827_14336,Gemm_Hipblaslt_TN_9268,0.412503
GemmTunableOp_Half_TN,tn_8192_2017_28672,Gemm_Hipblaslt_TN_9840,1.78082
GemmTunableOp_Half_TN,tn_28672_6860_4096,Gemm_Hipblaslt_TN_9958,2.84043
GemmTunableOp_Half_TN,tn_8192_2465_28672,Gemm_Hipblaslt_TN_9774,2.37357
GemmTunableOp_Half_TN,tn_32000_68_8192,Gemm_Hipblaslt_TN_9479,0.187814
GemmTunableOp_Half_TN,tn_8192_4017_28672,Gemm_Rocblas_621286894,3.4349
GemmTunableOp_Half_TN,tn_128256_35_4096,Gemm_Hipblaslt_TN_9451,0.322578
GemmTunableOp_Half_TN,tn_8192_2397_28672,Gemm_Hipblaslt_TN_9771,2.32709
GemmTunableOp_Half_TN,tn_4096_6744_14336,Gemm_Hipblaslt_TN_9694,1.38541
GemmTunableOp_Half_TN,tn_28672_1749_4096,Gemm_Hipblaslt_TN_9223,0.736371
GemmTunableOp_Half_TN,tn_8192_4049_28672,Gemm_Rocblas_621286915,3.44878
GemmTunableOp_Half_TN,tn_4096_1683_14336,Gemm_Hipblaslt_TN_9265,0.367313
GemmTunableOp_Half_TN,tn_4096_3573_4096,Gemm_Hipblaslt_TN_9187,0.20244
GemmTunableOp_Half_TN,tn_57344_2049_8192,Gemm_Rocblas_621294542,3.91467
GemmTunableOp_Half_TN,tn_6144_1826_4096,Gemm_Hipblaslt_TN_9788,0.165531
GemmTunableOp_Half_TN,tn_6144_5381_4096,Gemm_Hipblaslt_TN_9815,0.459867
GemmTunableOp_Half_TN,tn_4096_1698_14336,Gemm_Hipblaslt_TN_9790,0.36963
GemmTunableOp_Half_TN,tn_28672_1770_4096,Gemm_Hipblaslt_TN_9191,0.745477
GemmTunableOp_Half_TN,tn_28672_1892_4096,Gemm_Hipblaslt_TN_9683,0.802284
GemmTunableOp_Half_TN,tn_28672_1586_4096,Gemm_Hipblaslt_TN_9787,0.704129
GemmTunableOp_Half_TN,tn_6144_7108_4096,Gemm_Hipblaslt_TN_9743,0.596796
GemmTunableOp_Half_TN,tn_4096_3564_14336,Gemm_Hipblaslt_TN_9192,0.689981
GemmTunableOp_Half_TN,tn_10240_2145_8192,Gemm_Hipblaslt_TN_9690,0.63628
GemmTunableOp_Half_TN,tn_8192_68_28672,Gemm_Hipblaslt_TN_7871,0.174174
GemmTunableOp_Half_TN,tn_28672_6843_4096,Gemm_Hipblaslt_TN_9958,2.82851
GemmTunableOp_Half_TN,tn_10240_2257_8192,Gemm_Hipblaslt_TN_9697,0.656587
GemmTunableOp_Half_TN,tn_4096_3300_4096,Gemm_Hipblaslt_TN_9832,0.194212
GemmTunableOp_Half_TN,tn_128256_212_4096,Gemm_Hipblaslt_TN_9937,0.573726
GemmTunableOp_Half_TN,tn_6144_1973_4096,Gemm_Hipblaslt_TN_9793,0.176815
GemmTunableOp_Half_TN,tn_4096_1749_4096,Gemm_Hipblaslt_TN_9605,0.118548
GemmTunableOp_Half_TN,tn_4096_1858_14336,Gemm_Hipblaslt_TN_9137,0.412075
GemmTunableOp_Half_TN,tn_6144_1593_4096,Gemm_Hipblaslt_TN_9690,0.149694
GemmTunableOp_Half_TN,tn_57344_4048_8192,Gemm_Hipblaslt_TN_9882,6.63583
GemmTunableOp_Half_TN,tn_4096_5427_14336,Gemm_Hipblaslt_TN_9691,1.14878
GemmTunableOp_Half_TN,tn_57344_2079_8192,Gemm_Hipblaslt_TN_9827,3.98338
GemmTunableOp_Half_TN,tn_6144_32_4096,Gemm_Rocblas_621286273,0.0136703
GemmTunableOp_Half_TN,tn_10240_2082_8192,Gemm_Hipblaslt_TN_9690,0.625829
GemmTunableOp_Half_TN,tn_57344_31_8192,Gemm_Hipblaslt_TN_9429,0.253559
GemmTunableOp_Half_TN,tn_6144_7267_4096,Gemm_Hipblaslt_TN_9677,0.613985
GemmTunableOp_Half_TN,tn_4096_3706_14336,Gemm_Hipblaslt_TN_9859,0.72653
GemmTunableOp_Half_TN,tn_28672_1969_4096,Gemm_Hipblaslt_TN_9846,0.844395
GemmTunableOp_Half_TN,tn_28672_7118_4096,Gemm_Hipblaslt_TN_9860,2.92554
GemmTunableOp_Half_TN,tn_10240_68_8192,Gemm_Hipblaslt_TN_9304,0.0504932
GemmTunableOp_Half_TN,tn_4096_3557_4096,Gemm_Hipblaslt_TN_9743,0.200771
GemmTunableOp_Half_TN,tn_8192_2270_8192,Gemm_Hipblaslt_TN_9742,0.509451
GemmTunableOp_Half_TN,tn_10240_66_8192,Gemm_Hipblaslt_TN_8095,0.0494141
GemmTunableOp_Half_TN,tn_28672_3565_4096,Gemm_Hipblaslt_TN_9827,1.38972
GemmTunableOp_Half_TN,tn_28672_3456_4096,Gemm_Hipblaslt_TN_9827,1.37173
GemmTunableOp_Half_TN,tn_8192_58_8192,Gemm_Hipblaslt_TN_7484,0.0397321
GemmTunableOp_Half_TN,tn_28672_5465_4096,Gemm_Hipblaslt_TN_9865,2.32791
GemmTunableOp_Half_TN,tn_57344_2385_8192,Default,4.35834
GemmTunableOp_Half_TN,tn_28672_3581_4096,Gemm_Hipblaslt_TN_9827,1.38415
GemmTunableOp_Half_TN,tn_4096_1609_4096,Gemm_Hipblaslt_TN_9265,0.105601
GemmTunableOp_Half_TN,tn_6144_1933_4096,Gemm_Hipblaslt_TN_9187,0.176829
GemmTunableOp_Half_TN,tn_10240_56_8192,Gemm_Hipblaslt_TN_7492,0.0472449
GemmTunableOp_Half_TN,tn_57344_2113_8192,Gemm_Hipblaslt_TN_9827,3.99662
GemmTunableOp_Half_TN,tn_6144_6843_4096,Gemm_Hipblaslt_TN_9955,0.585958
GemmTunableOp_Half_TN,tn_128256_221_4096,Gemm_Hipblaslt_TN_9847,0.580892
GemmTunableOp_Half_TN,tn_8192_28_8192,Gemm_Hipblaslt_TN_9415,0.0337199
GemmTunableOp_Half_TN,tn_4096_1596_14336,Gemm_Hipblaslt_TN_9265,0.359396
GemmTunableOp_Half_TN,tn_8192_55_28672,Gemm_Rocblas_621294228,0.146029
GemmTunableOp_Half_TN,tn_4096_7579_14336,Gemm_Hipblaslt_TN_9738,1.55885
GemmTunableOp_Half_TN,tn_4096_3441_4096,Gemm_Hipblaslt_TN_9814,0.197681
GemmTunableOp_Half_TN,tn_128256_39_4096,Gemm_Hipblaslt_TN_9451,0.324722
GemmTunableOp_Half_TN,tn_57344_29_8192,Gemm_Hipblaslt_TN_9429,0.257099
GemmTunableOp_Half_TN,tn_4096_3562_14336,Gemm_Hipblaslt_TN_9187,0.688161
GemmTunableOp_Half_TN,tn_4096_1663_14336,Gemm_Hipblaslt_TN_9679,0.365157
GemmTunableOp_Half_TN,tn_8192_60_8192,Gemm_Hipblaslt_TN_7484,0.0395851
GemmTunableOp_Half_TN,tn_8192_2129_8192,Gemm_Hipblaslt_TN_9742,0.502796
GemmTunableOp_Half_TN,tn_57344_2302_8192,Gemm_Hipblaslt_TN_9855,4.12773
GemmTunableOp_Half_TN,tn_28672_1948_4096,Gemm_Hipblaslt_TN_9846,0.84094
GemmTunableOp_Half_TN,tn_6144_3410_4096,Gemm_Hipblaslt_TN_9570,0.31224
GemmTunableOp_Half_TN,tn_28672_1958_4096,Gemm_Hipblaslt_TN_9846,0.850245
GemmTunableOp_Half_TN,tn_4096_1665_14336,Gemm_Hipblaslt_TN_9265,0.367349
GemmTunableOp_Half_TN,tn_128256_252_4096,Gemm_Rocblas_621286892,0.615679
GemmTunableOp_Half_TN,tn_4096_1811_14336,Gemm_Hipblaslt_TN_9620,0.409072
GemmTunableOp_Half_TN,tn_8192_2417_28672,Gemm_Hipblaslt_TN_9771,2.32022
GemmTunableOp_Half_TN,tn_8192_56_8192,Gemm_Hipblaslt_TN_7492,0.039745
GemmTunableOp_Half_TN,tn_57344_2225_8192,Gemm_Rocblas_621294543,4.0167
GemmTunableOp_Half_TN,tn_57344_2028_8192,Gemm_Hipblaslt_TN_9840,3.53986
GemmTunableOp_Half_TN,tn_4096_6630_14336,Gemm_Hipblaslt_TN_9732,1.37006
GemmTunableOp_Half_TN,tn_8192_59_28672,Gemm_Rocblas_621294228,0.148999
GemmTunableOp_Half_TN,tn_28672_1970_4096,Gemm_Hipblaslt_TN_9846,0.855674
GemmTunableOp_Half_TN,tn_128256_69_4096,Gemm_Hipblaslt_TN_9057,0.375523
GemmTunableOp_Half_TN,tn_28672_3597_4096,Gemm_Hipblaslt_TN_9832,1.47119
GemmTunableOp_Half_TN,tn_32000_62_8192,Gemm_Rocblas_621294203,0.163411
GemmTunableOp_Half_TN,tn_28672_7182_4096,Gemm_Hipblaslt_TN_159,2.89826
GemmTunableOp_Half_TN,tn_6144_1909_4096,Gemm_Hipblaslt_TN_9799,0.16633
GemmTunableOp_Half_TN,tn_28672_3404_4096,Gemm_Hipblaslt_TN_9827,1.36308
GemmTunableOp_Half_TN,tn_4096_3640_4096,Gemm_Hipblaslt_TN_9743,0.203457
GemmTunableOp_Half_TN,tn_4096_1680_4096,Gemm_Hipblaslt_TN_9679,0.106878
GemmTunableOp_Half_TN,tn_128256_148_4096,Gemm_Hipblaslt_TN_9108,0.480942
GemmTunableOp_Half_TN,tn_6144_1660_4096,Gemm_Hipblaslt_TN_9570,0.150726
GemmTunableOp_Half_TN,tn_6144_3645_4096,Gemm_Hipblaslt_TN_9690,0.325583
GemmTunableOp_Half_TN,tn_4096_1625_4096,Gemm_Hipblaslt_TN_9616,0.105718
GemmTunableOp_Half_TN,tn_10240_2397_8192,Gemm_Hipblaslt_TN_9690,0.679562
GemmTunableOp_Half_TN,tn_32000_59_8192,Gemm_Rocblas_621286466,0.163253
GemmTunableOp_Half_TN,tn_4096_7484_4096,Gemm_Rocblas_621294127,0.429342
GemmTunableOp_Half_TN,tn_57344_2321_8192,Gemm_Rocblas_621294542,4.41331
GemmTunableOp_Half_TN,tn_28672_5442_4096,Gemm_Hipblaslt_TN_9924,2.31271
GemmTunableOp_Half_TN,tn_6144_128_4096,Gemm_Rocblas_621294172,0.0238059
GemmTunableOp_Half_TN,tn_28672_3791_4096,Gemm_Hipblaslt_TN_9827,1.5392
GemmTunableOp_Half_TN,tn_6144_1673_4096,Gemm_Hipblaslt_TN_9570,0.153193
GemmTunableOp_Half_TN,tn_57344_4049_8192,Gemm_Hipblaslt_TN_9963,6.68542
GemmTunableOp_Half_TN,tn_28672_56_4096,Gemm_Rocblas_621294232,0.0501478
GemmTunableOp_Half_TN,tn_57344_2129_8192,Gemm_Hipblaslt_TN_9733,4.01333
GemmTunableOp_Half_TN,tn_4096_5412_4096,Gemm_Hipblaslt_TN_9924,0.329512
GemmTunableOp_Half_TN,tn_8192_2413_8192,Gemm_Hipblaslt_TN_9651,0.558864
GemmTunableOp_Half_TN,tn_4096_7475_14336,Gemm_Hipblaslt_TN_9738,1.56518
GemmTunableOp_Half_TN,tn_6144_6788_4096,Gemm_Hipblaslt_TN_9697,0.584593
GemmTunableOp_Half_TN,tn_57344_4033_8192,Gemm_Rocblas_621294279,6.65389
GemmTunableOp_Half_TN,tn_28672_1614_4096,Gemm_Rocblas_621294420,0.712259
GemmTunableOp_Half_TN,tn_4096_1628_14336,Gemm_Hipblaslt_TN_9671,0.363351
GemmTunableOp_Half_TN,tn_4096_1823_4096,Gemm_Hipblaslt_TN_9645,0.119881
GemmTunableOp_Half_TN,tn_128256_24_4096,Gemm_Rocblas_621286354,0.315003
GemmTunableOp_Half_TN,tn_57344_2065_8192,Gemm_Rocblas_621294542,3.89636
GemmTunableOp_Half_TN,tn_28672_7579_4096,Gemm_Hipblaslt_TN_159,2.96056
GemmTunableOp_Half_TN,tn_4096_6976_14336,Gemm_Hipblaslt_TN_9694,1.41751
GemmTunableOp_Half_TN,tn_28672_1823_4096,Gemm_Hipblaslt_TN_9684,0.793049
GemmTunableOp_Half_TN,tn_128256_42_4096,Gemm_Hipblaslt_TN_9455,0.33359
GemmTunableOp_Half_TN,tn_4096_5498_14336,Gemm_Hipblaslt_TN_9799,1.15117
GemmTunableOp_Half_TN,tn_128256_83_4096,Gemm_Hipblaslt_TN_9057,0.38651
GemmTunableOp_Half_TN,tn_128256_168_4096,Gemm_Hipblaslt_TN_9952,0.514885
GemmTunableOp_Half_TN,tn_10240_2289_8192,Gemm_Rocblas_621286578,0.661366
GemmTunableOp_Half_TN,tn_4096_7325_4096,Gemm_Hipblaslt_TN_9869,0.42429
GemmTunableOp_Half_TN,tn_28672_1936_4096,Gemm_Hipblaslt_TN_9846,0.834879
GemmTunableOp_Half_TN,tn_128256_140_4096,Gemm_Hipblaslt_TN_9108,0.4764
GemmTunableOp_Half_TN,tn_6144_3565_4096,Gemm_Hipblaslt_TN_9690,0.323184
GemmTunableOp_Half_TN,tn_128256_180_4096,Gemm_Hipblaslt_TN_9952,0.520597
GemmTunableOp_Half_TN,tn_28672_6902_4096,Gemm_Hipblaslt_TN_9944,2.82592
GemmTunableOp_Half_TN,tn_28672_7021_4096,Gemm_Hipblaslt_TN_9859,2.89234
GemmTunableOp_Half_TN,tn_128256_245_4096,Gemm_Rocblas_621286905,0.612888
GemmTunableOp_Half_TN,tn_4096_6990_14336,Gemm_Hipblaslt_TN_9743,1.41961
GemmTunableOp_Half_TN,tn_128256_48_4096,Gemm_Hipblaslt_TN_9451,0.333269
GemmTunableOp_Half_TN,tn_8192_2305_28672,Gemm_Hipblaslt_TN_9771,2.27599
GemmTunableOp_Half_TN,tn_6144_1742_4096,Gemm_Hipblaslt_TN_9799,0.15979
GemmTunableOp_Half_TN,tn_28672_1725_4096,Gemm_Hipblaslt_TN_9217,0.732798
GemmTunableOp_Half_TN,tn_28672_3612_4096,Gemm_Hipblaslt_TN_9832,1.4778
GemmTunableOp_Half_TN,tn_32000_67_8192,Gemm_Hipblaslt_TN_9479,0.187255
GemmTunableOp_Half_TN,tn_4096_1719_14336,Gemm_Hipblaslt_TN_9671,0.369962
GemmTunableOp_Half_TN,tn_128256_7_4096,Gemm_Hipblaslt_TN_9405,0.285466
GemmTunableOp_Half_TN,tn_6144_3475_4096,Gemm_Hipblaslt_TN_9690,0.318341
GemmTunableOp_Half_TN,tn_28672_1721_4096,Gemm_Hipblaslt_TN_9223,0.728408
GemmTunableOp_Half_TN,tn_57344_67_8192,Gemm_Hipblaslt_TN_7091,0.318878
GemmTunableOp_Half_TN,tn_4096_7345_4096,Gemm_Hipblaslt_TN_9914,0.422268
GemmTunableOp_Half_TN,tn_6144_5390_4096,Gemm_Rocblas_621286678,0.457927
GemmTunableOp_Half_TN,tn_32000_54_8192,Gemm_Rocblas_621286467,0.163029
GemmTunableOp_Half_TN,tn_4096_1786_4096,Gemm_Hipblaslt_TN_9134,0.117291
GemmTunableOp_Half_TN,tn_28672_208_4096,Gemm_Hipblaslt_TN_9267,0.111233
GemmTunableOp_Half_TN,tn_128256_236_4096,Gemm_Rocblas_621294634,0.608275
GemmTunableOp_Half_TN,tn_28672_1780_4096,Gemm_Hipblaslt_TN_9190,0.745955
GemmTunableOp_Half_TN,tn_4096_3647_4096,Gemm_Hipblaslt_TN_9743,0.202765
GemmTunableOp_Half_TN,tn_4096_5495_4096,Gemm_Hipblaslt_TN_9691,0.333184
GemmTunableOp_Half_TN,tn_28672_1822_4096,Gemm_Hipblaslt_TN_9832,0.799694
GemmTunableOp_Half_TN,tn_4096_1722_4096,Gemm_Hipblaslt_TN_9679,0.107711
GemmTunableOp_Half_TN,tn_4096_112_4096,Gemm_Rocblas_621294029,0.0169665
GemmTunableOp_Half_TN,tn_4096_1970_14336,Gemm_Hipblaslt_TN_9645,0.423179
GemmTunableOp_Half_TN,tn_4096_7096_4096,Gemm_Hipblaslt_TN_9694,0.405894
GemmTunableOp_Half_TN,tn_4096_1810_4096,Gemm_Hipblaslt_TN_9645,0.117976
GemmTunableOp_Half_TN,tn_6144_1780_4096,Gemm_Hipblaslt_TN_9711,0.163535
GemmTunableOp_Half_TN,tn_57344_4081_8192,Gemm_Hipblaslt_TN_9882,6.67436
GemmTunableOp_Half_TN,tn_6144_1807_4096,Gemm_Rocblas_621286575,0.164275
GemmTunableOp_Half_TN,tn_6144_5196_4096,Gemm_Hipblaslt_TN_9704,0.444292
GemmTunableOp_Half_TN,tn_28672_1728_4096,Gemm_Rocblas_621286742,0.733616
GemmTunableOp_Half_TN,tn_4096_5357_14336,Gemm_Hipblaslt_TN_9709,1.12264
GemmTunableOp_Half_TN,tn_4096_7104_4096,Gemm_Hipblaslt_TN_9694,0.403198
GemmTunableOp_Half_TN,tn_6144_144_4096,Gemm_Rocblas_621286443,0.0272118
GemmTunableOp_Half_TN,tn_4096_3701_4096,Gemm_Hipblaslt_TN_9841,0.213757
GemmTunableOp_Half_TN,tn_6144_7191_4096,Gemm_Hipblaslt_TN_9743,0.607321
GemmTunableOp_Half_TN,tn_28672_1731_4096,Gemm_Hipblaslt_TN_9223,0.733245
GemmTunableOp_Half_TN,tn_4096_1690_4096,Gemm_Hipblaslt_TN_9607,0.10858
GemmTunableOp_Half_TN,tn_4096_1863_14336,Gemm_Hipblaslt_TN_9268,0.413114
GemmTunableOp_Half_TN,tn_4096_1866_4096,Gemm_Hipblaslt_TN_9645,0.120787
GemmTunableOp_Half_TN,tn_6144_1778_4096,Gemm_Rocblas_621294425,0.164873
GemmTunableOp_Half_TN,tn_28672_1769_4096,Gemm_Hipblaslt_TN_9190,0.74479
GemmTunableOp_Half_TN,tn_28672_5390_4096,Gemm_Hipblaslt_TN_9852,2.2734
GemmTunableOp_Half_TN,tn_6144_1884_4096,Gemm_Hipblaslt_TN_9788,0.168005
GemmTunableOp_Half_TN,tn_4096_5533_14336,Gemm_Hipblaslt_TN_9799,1.1553
GemmTunableOp_Half_TN,tn_128256_14_4096,Gemm_Hipblaslt_TN_9405,0.295023
GemmTunableOp_Half_TN,tn_4096_1787_14336,Gemm_Hipblaslt_TN_9645,0.397848
GemmTunableOp_Half_TN,tn_28672_1957_4096,Gemm_Hipblaslt_TN_9846,0.836768
GemmTunableOp_Half_TN,tn_28672_1667_4096,Gemm_Hipblaslt_TN_9730,0.724647
GemmTunableOp_Half_TN,tn_4096_1711_4096,Gemm_Hipblaslt_TN_9607,0.108888
GemmTunableOp_Half_TN,tn_6144_6630_4096,Gemm_Hipblaslt_TN_9697,0.575174
GemmTunableOp_Half_TN,tn_4096_6902_14336,Gemm_Hipblaslt_TN_9694,1.39911
GemmTunableOp_Half_TN,tn_4096_3595_14336,Gemm_Hipblaslt_TN_9743,0.699234
GemmTunableOp_Half_TN,tn_4096_3773_14336,Gemm_Hipblaslt_TN_9220,0.729981
GemmTunableOp_Half_TN,tn_6144_6979_4096,Gemm_Hipblaslt_TN_9677,0.592804
GemmTunableOp_Half_TN,tn_4096_1981_14336,Gemm_Hipblaslt_TN_9645,0.424085
GemmTunableOp_Half_TN,tn_8192_63_8192,Gemm_Hipblaslt_TN_7484,0.0396788
GemmTunableOp_Half_TN,tn_6144_5136_4096,Gemm_Hipblaslt_TN_9704,0.438833
GemmTunableOp_Half_TN,tn_4096_1699_14336,Gemm_Hipblaslt_TN_9265,0.366732
GemmTunableOp_Half_TN,tn_28672_7240_4096,Gemm_Hipblaslt_TN_159,2.9253
GemmTunableOp_Half_TN,tn_6144_6952_4096,Gemm_Hipblaslt_TN_9697,0.595212
GemmTunableOp_Half_TN,tn_4096_6989_4096,Gemm_Hipblaslt_TN_9694,0.402272
GemmTunableOp_Half_TN,tn_4096_3410_14336,Gemm_Hipblaslt_TN_9697,0.66963
GemmTunableOp_Half_TN,tn_6144_3584_4096,Gemm_Rocblas_621294495,0.321013
GemmTunableOp_Half_TN,tn_6144_7579_4096,Gemm_Hipblaslt_TN_9813,0.645714
GemmTunableOp_Half_TN,tn_4096_5319_4096,Gemm_Hipblaslt_TN_9691,0.326627
GemmTunableOp_Half_TN,tn_6144_1642_4096,Gemm_Hipblaslt_TN_9570,0.154246
GemmTunableOp_Half_TN,tn_6144_7190_4096,Gemm_Hipblaslt_TN_9697,0.61045
GemmTunableOp_Half_TN,tn_6144_7118_4096,Gemm_Hipblaslt_TN_9743,0.60223
GemmTunableOp_Half_TN,tn_28672_5301_4096,Gemm_Hipblaslt_TN_9860,2.16258
GemmTunableOp_Half_TN,tn_6144_6860_4096,Gemm_Hipblaslt_TN_9677,0.585755
GemmTunableOp_Half_TN,tn_6144_5583_4096,Gemm_Rocblas_621286678,0.457573
GemmTunableOp_Half_TN,tn_4096_1760_14336,Gemm_Hipblaslt_TN_9645,0.395148
GemmTunableOp_Half_TN,tn_128256_229_4096,Gemm_Rocblas_621294634,0.601083
GemmTunableOp_Half_TN,tn_28672_5541_4096,Gemm_Hipblaslt_TN_9852,2.3237
GemmTunableOp_Half_TN,tn_4096_3507_4096,Gemm_Hipblaslt_TN_9221,0.200974
GemmTunableOp_Half_TN,tn_28672_3748_4096,Gemm_Hipblaslt_TN_9827,1.52099
GemmTunableOp_Half_TN,tn_4096_7262_14336,Gemm_Hipblaslt_TN_9694,1.46007
GemmTunableOp_Half_TN,tn_128256_18_4096,Gemm_Rocblas_621294226,0.311502
GemmTunableOp_Half_TN,tn_6144_3602_4096,Gemm_Rocblas_621294495,0.325278
GemmTunableOp_Half_TN,tn_4096_1704_14336,Gemm_Hipblaslt_TN_9180,0.369785
GemmTunableOp_Half_TN,tn_4096_6901_4096,Gemm_Hipblaslt_TN_9743,0.396502
GemmTunableOp_Half_TN,tn_4096_1828_4096,Gemm_Hipblaslt_TN_9645,0.119774
GemmTunableOp_Half_TN,tn_4096_1869_4096,Gemm_Hipblaslt_TN_9645,0.121669
GemmTunableOp_Half_TN,tn_128256_108_4096,Gemm_Hipblaslt_TN_9061,0.427699
GemmTunableOp_Half_TN,tn_6144_3767_4096,Gemm_Hipblaslt_TN_9690,0.335956
GemmTunableOp_Half_TN,tn_6144_160_4096,Gemm_Rocblas_621294168,0.0275876
GemmTunableOp_Half_TN,tn_4096_5219_4096,Gemm_Hipblaslt_TN_9799,0.3223
GemmTunableOp_Half_TN,tn_4096_7072_14336,Gemm_Hipblaslt_TN_9732,1.43618
GemmTunableOp_Half_TN,tn_4096_256_14336,Gemm_Hipblaslt_TN_9303,0.0746157
GemmTunableOp_Half_TN,tn_4096_1864_4096,Gemm_Hipblaslt_TN_9645,0.120765
GemmTunableOp_Half_TN,tn_6144_3573_4096,Gemm_Rocblas_621286753,0.318967
GemmTunableOp_Half_TN,tn_6144_1658_4096,Gemm_Hipblaslt_TN_9570,0.153912
GemmTunableOp_Half_TN,tn_28672_3586_4096,Gemm_Hipblaslt_TN_9828,1.46855
GemmTunableOp_Half_TN,tn_32000_30_8192,Gemm_Rocblas_621294578,0.150622
GemmTunableOp_Half_TN,tn_6144_7138_4096,Gemm_Hipblaslt_TN_9697,0.609083
GemmTunableOp_Half_TN,tn_6144_1846_4096,Gemm_Rocblas_621286683,0.165815
GemmTunableOp_Half_TN,tn_128256_230_4096,Gemm_Rocblas_621286892,0.603282
GemmTunableOp_Half_TN,tn_6144_1706_4096,Gemm_Rocblas_621286753,0.156387
GemmTunableOp_Half_TN,tn_28672_6996_4096,Gemm_Hipblaslt_TN_9958,2.88849
GemmTunableOp_Half_TN,tn_28672_3595_4096,Gemm_Hipblaslt_TN_9832,1.47229
GemmTunableOp_Half_TN,tn_4096_1713_4096,Gemm_Hipblaslt_TN_9671,0.107778
GemmTunableOp_Half_TN,tn_4096_5322_4096,Gemm_Hipblaslt_TN_9687,0.322779
GemmTunableOp_Half_TN,tn_4096_3369_4096,Gemm_Hipblaslt_TN_9814,0.194245
GemmTunableOp_Half_TN,tn_28672_8_4096,Gemm_Rocblas_621294053,0.0447143
GemmTunableOp_Half_TN,tn_28672_1966_4096,Gemm_Hipblaslt_TN_9846,0.855152
GemmTunableOp_Half_TN,tn_4096_1820_4096,Gemm_Hipblaslt_TN_9645,0.118379
GemmTunableOp_Half_TN,tn_6144_7386_4096,Gemm_Hipblaslt_TN_9933,0.633094
GemmTunableOp_Half_TN,tn_6144_5495_4096,Gemm_Rocblas_621294420,0.459885
GemmTunableOp_Half_TN,tn_6144_1881_4096,Gemm_Rocblas_621286683,0.167302
GemmTunableOp_Half_TN,tn_6144_1699_4096,Gemm_Rocblas_621294495,0.156201
GemmTunableOp_Half_TN,tn_4096_3494_4096,Gemm_Hipblaslt_TN_9743,0.201322
GemmTunableOp_Half_TN,tn_4096_3214_4096,Gemm_Hipblaslt_TN_9697,0.188382
GemmTunableOp_Half_TN,tn_4096_7403_4096,Gemm_Rocblas_621294127,0.42435
GemmTunableOp_Half_TN,tn_4096_1648_14336,Gemm_Hipblaslt_TN_9265,0.365305
GemmTunableOp_Half_TN,tn_4096_1828_14336,Gemm_Hipblaslt_TN_9134,0.410652
GemmTunableOp_Half_TN,tn_28672_5239_4096,Gemm_Hipblaslt_TN_9914,2.15479
GemmTunableOp_Half_TN,tn_4096_8_14336,Gemm_Rocblas_621286312,0.0232647
GemmTunableOp_Half_TN,tn_6144_1873_4096,Gemm_Hipblaslt_TN_9799,0.166764
GemmTunableOp_Half_TN,tn_8192_2270_28672,Gemm_Hipblaslt_TN_9774,2.24222
GemmTunableOp_Half_TN,tn_28672_3515_4096,Gemm_Hipblaslt_TN_9827,1.38386
GemmTunableOp_Half_TN,tn_28672_5196_4096,Gemm_Hipblaslt_TN_159,2.13669
GemmTunableOp_Half_TN,tn_57344_2337_8192,Gemm_Rocblas_621294542,4.40813
GemmTunableOp_Half_TN,tn_4096_1774_14336,Gemm_Hipblaslt_TN_9645,0.397301
GemmTunableOp_Half_TN,tn_6144_7077_4096,Gemm_Hipblaslt_TN_9743,0.595405
GemmTunableOp_Half_TN,tn_28672_3793_4096,Gemm_Hipblaslt_TN_9827,1.53177
GemmTunableOp_Half_TN,tn_6144_1981_4096,Gemm_Hipblaslt_TN_9697,0.179668
GemmTunableOp_Half_TN,tn_4096_1830_14336,Gemm_Hipblaslt_TN_9268,0.411203
GemmTunableOp_Half_TN,tn_28672_1866_4096,Gemm_Hipblaslt_TN_9832,0.800986
GemmTunableOp_Half_TN,tn_6144_7253_4096,Gemm_Hipblaslt_TN_9743,0.611856
GemmTunableOp_Half_TN,tn_28672_152_4096,Gemm_Hipblaslt_TN_9253,0.0880574
GemmTunableOp_Half_TN,tn_4096_1738_4096,Gemm_Hipblaslt_TN_9134,0.116327
GemmTunableOp_Half_TN,tn_4096_1686_4096,Gemm_Hipblaslt_TN_9671,0.107985
GemmTunableOp_Half_TN,tn_28672_5136_4096,Gemm_Hipblaslt_TN_9191,2.17234
GemmTunableOp_Half_TN,tn_4096_7021_14336,Gemm_Hipblaslt_TN_9732,1.43657
GemmTunableOp_Half_TN,tn_4096_144_14336,Gemm_Hipblaslt_TN_7219,0.0530729
GemmTunableOp_Half_TN,tn_128256_234_4096,Gemm_Rocblas_621294634,0.60547
GemmTunableOp_Half_TN,tn_6144_152_4096,Gemm_Rocblas_621294171,0.027773
GemmTunableOp_Half_TN,tn_4096_3589_4096,Gemm_Hipblaslt_TN_9221,0.202557
GemmTunableOp_Half_TN,tn_6144_3586_4096,Gemm_Rocblas_621286753,0.324412
GemmTunableOp_Half_TN,tn_6144_232_4096,Gemm_Hipblaslt_TN_9495,0.0344344
GemmTunableOp_Half_TN,tn_4096_6990_4096,Gemm_Hipblaslt_TN_9743,0.400791
GemmTunableOp_Half_TN,tn_28672_1615_4096,Gemm_Hipblaslt_TN_9219,0.713263
GemmTunableOp_Half_TN,tn_28672_7067_4096,Gemm_Hipblaslt_TN_9920,2.90317
GemmTunableOp_Half_TN,tn_4096_256_4096,Gemm_Rocblas_621286491,0.0264695
GemmTunableOp_Half_TN,tn_128256_189_4096,Gemm_Hipblaslt_TN_9952,0.5253
GemmTunableOp_Half_TN,tn_4096_6789_4096,Gemm_Hipblaslt_TN_9694,0.393406
GemmTunableOp_Half_TN,tn_28672_1745_4096,Gemm_Hipblaslt_TN_9223,0.731793
GemmTunableOp_Half_TN,tn_28672_248_4096,Gemm_Rocblas_621294324,0.122531
GemmTunableOp_Half_TN,tn_6144_1666_4096,Gemm_Hipblaslt_TN_9570,0.155966
GemmTunableOp_Half_TN,tn_4096_6965_14336,Gemm_Hipblaslt_TN_9694,1.41264
GemmTunableOp_Half_TN,tn_6144_1586_4096,Gemm_Rocblas_621286565,0.148504
GemmTunableOp_Half_TN,tn_6144_1879_4096,Gemm_Hipblaslt_TN_9691,0.167366
GemmTunableOp_Half_TN,tn_4096_72_4096,Gemm_Rocblas_621286280,0.0150184
GemmTunableOp_Half_TN,tn_6144_3748_4096,Gemm_Hipblaslt_TN_9690,0.338398
GemmTunableOp_Half_TN,tn_4096_1948_4096,Gemm_Hipblaslt_TN_9134,0.123005
GemmTunableOp_Half_TN,tn_4096_5541_4096,Gemm_Rocblas_621286580,0.334983
GemmTunableOp_Half_TN,tn_6144_1618_4096,Gemm_Rocblas_621286753,0.151754
GemmTunableOp_Half_TN,tn_4096_1651_14336,Gemm_Hipblaslt_TN_9679,0.363668
GemmTunableOp_Half_TN,tn_4096_56_14336,Gemm_Hipblaslt_TN_7486,0.034092
GemmTunableOp_Half_TN,tn_4096_3710_4096,Gemm_Hipblaslt_TN_9841,0.215211
GemmTunableOp_Half_TN,tn_4096_6715_4096,Gemm_Hipblaslt_TN_9955,0.389251
GemmTunableOp_Half_TN,tn_128256_105_4096,Gemm_Hipblaslt_TN_9061,0.429919
GemmTunableOp_Half_TN,tn_28672_7191_4096,Gemm_Hipblaslt_TN_159,2.90538
GemmTunableOp_Half_TN,tn_4096_3584_14336,Gemm_Hipblaslt_TN_9743,0.690087
GemmTunableOp_Half_TN,tn_28672_6773_4096,Gemm_Hipblaslt_TN_9939,2.81973
GemmTunableOp_Half_TN,tn_4096_3595_4096,Gemm_Hipblaslt_TN_9743,0.203712
GemmTunableOp_Half_TN,tn_6144_1610_4096,Gemm_Rocblas_621286753,0.152855
GemmTunableOp_Half_TN,tn_4096_184_14336,Gemm_Hipblaslt_TN_8350,0.0633846
GemmTunableOp_Half_TN,tn_28672_3309_4096,Gemm_Hipblaslt_TN_9827,1.36688
GemmTunableOp_Half_TN,tn_6144_6747_4096,Gemm_Hipblaslt_TN_9695,0.585919
GemmTunableOp_Half_TN,tn_4096_168_4096,Gemm_Rocblas_621294168,0.0226618
GemmTunableOp_Half_TN,tn_4096_6773_4096,Gemm_Hipblaslt_TN_9955,0.390475
GemmTunableOp_Half_TN,tn_6144_3214_4096,Gemm_Rocblas_621286566,0.296108
GemmTunableOp_Half_TN,tn_6144_5030_4096,Gemm_Hipblaslt_TN_9655,0.431968
GemmTunableOp_Half_TN,tn_28672_1978_4096,Gemm_Hipblaslt_TN_9846,0.847644
GemmTunableOp_Half_TN,tn_10240_4000_8192,Gemm_Hipblaslt_TN_9814,1.11633
GemmTunableOp_Half_TN,tn_6144_1765_4096,Gemm_Hipblaslt_TN_9799,0.164088
GemmTunableOp_Half_TN,tn_4096_7439_14336,Gemm_Hipblaslt_TN_9738,1.54793
GemmTunableOp_Half_TN,tn_8192_59_8192,Gemm_Hipblaslt_TN_7484,0.039325
GemmTunableOp_Half_TN,tn_4096_5322_14336,Gemm_Hipblaslt_TN_9799,1.11485
GemmTunableOp_Half_TN,tn_4096_3583_14336,Gemm_Hipblaslt_TN_9743,0.688468
GemmTunableOp_Half_TN,tn_6144_80_4096,Gemm_Rocblas_621294029,0.0186182
GemmTunableOp_Half_TN,tn_4096_3520_4096,Gemm_Hipblaslt_TN_9221,0.1973
GemmTunableOp_Half_TN,tn_4096_1647_4096,Gemm_Hipblaslt_TN_9265,0.105487
GemmTunableOp_Half_TN,tn_28672_7225_4096,Gemm_Hipblaslt_TN_159,2.89174
GemmTunableOp_Half_TN,tn_4096_1623_14336,Gemm_Hipblaslt_TN_9610,0.360908
GemmTunableOp_Half_TN,tn_4096_5470_4096,Gemm_Hipblaslt_TN_9672,0.332811
GemmTunableOp_Half_TN,tn_4096_3382_4096,Gemm_Hipblaslt_TN_9187,0.196202
GemmTunableOp_Half_TN,tn_28672_5157_4096,Gemm_Hipblaslt_TN_9930,2.11817
GemmTunableOp_Half_TN,tn_4096_3404_14336,Gemm_Hipblaslt_TN_9697,0.666159
GemmTunableOp_Half_TN,tn_4096_6952_14336,Gemm_Hipblaslt_TN_9732,1.42411
GemmTunableOp_Half_TN,tn_128256_93_4096,Gemm_Hipblaslt_TN_9057,0.395904
GemmTunableOp_Half_TN,tn_4096_6860_4096,Gemm_Hipblaslt_TN_9955,0.392897
GemmTunableOp_Half_TN,tn_4096_1948_14336,Gemm_Hipblaslt_TN_9592,0.419459
GemmTunableOp_Half_TN,tn_4096_6721_4096,Gemm_Hipblaslt_TN_9677,0.392613
GemmTunableOp_Half_TN,tn_28672_7575_4096,Gemm_Hipblaslt_TN_159,2.95767
GemmTunableOp_Half_TN,tn_28672_120_4096,Gemm_Rocblas_621286473,0.0729875
GemmTunableOp_Half_TN,tn_4096_3612_14336,Gemm_Hipblaslt_TN_9743,0.698218
GemmTunableOp_Half_TN,tn_128256_96_4096,Gemm_Hipblaslt_TN_9057,0.39411
GemmTunableOp_Half_TN,tn_28672_7033_4096,Gemm_Hipblaslt_TN_9892,2.8994
GemmTunableOp_Half_TN,tn_6144_5530_4096,Gemm_Hipblaslt_TN_9704,0.464119
GemmTunableOp_Half_TN,tn_4096_1599_14336,Gemm_Hipblaslt_TN_9265,0.3577
GemmTunableOp_Half_TN,tn_128256_63_4096,Gemm_Rocblas_621294557,0.363747
GemmTunableOp_Half_TN,tn_4096_6761_4096,Gemm_Hipblaslt_TN_9955,0.392792
GemmTunableOp_Half_TN,tn_4096_7108_14336,Gemm_Hipblaslt_TN_9743,1.43399
GemmTunableOp_Half_TN,tn_6144_1748_4096,Gemm_Hipblaslt_TN_9799,0.16037
GemmTunableOp_Half_TN,tn_4096_5583_14336,Gemm_Hipblaslt_TN_9709,1.15541
GemmTunableOp_Half_TN,tn_6144_3652_4096,Gemm_Hipblaslt_TN_9690,0.32593
GemmTunableOp_Half_TN,tn_28672_3450_4096,Gemm_Hipblaslt_TN_9827,1.36852
GemmTunableOp_Half_TN,tn_4096_1853_4096,Gemm_Hipblaslt_TN_9645,0.12112
GemmTunableOp_Half_TN,tn_6144_6881_4096,Gemm_Hipblaslt_TN_9697,0.586624
GemmTunableOp_Half_TN,tn_10240_2321_8192,Gemm_Rocblas_621286684,0.674449
GemmTunableOp_Half_TN,tn_4096_5495_14336,Gemm_Hipblaslt_TN_9709,1.15505
GemmTunableOp_Half_TN,tn_28672_3416_4096,Gemm_Hipblaslt_TN_9827,1.36781
GemmTunableOp_Half_TN,tn_4096_1608_4096,Gemm_Hipblaslt_TN_9679,0.104859
GemmTunableOp_Half_TN,tn_6144_1936_4096,Gemm_Hipblaslt_TN_9793,0.174091
GemmTunableOp_Half_TN,tn_28672_8192_4096,Gemm_Hipblaslt_TN_9888,3.35566
GemmTunableOp_Half_TN,tn_6144_5357_4096,Gemm_Hipblaslt_TN_9704,0.449569
GemmTunableOp_Half_TN,tn_4096_1902_4096,Gemm_Hipblaslt_TN_9134,0.121211
GemmTunableOp_Half_TN,tn_4096_1737_4096,Gemm_Hipblaslt_TN_9590,0.117059
GemmTunableOp_Half_TN,tn_4096_1892_14336,Gemm_Hipblaslt_TN_9645,0.412634
GemmTunableOp_Half_TN,tn_6144_8192_4096,Gemm_Hipblaslt_TN_9813,0.685972
GemmTunableOp_Half_TN,tn_4096_1815_14336,Gemm_Hipblaslt_TN_9620,0.409461
GemmTunableOp_Half_TN,tn_32000_60_8192,Gemm_Rocblas_621286466,0.163802
GemmTunableOp_Half_TN,tn_28672_1673_4096,Gemm_Hipblaslt_TN_9223,0.729455
GemmTunableOp_Half_TN,tn_28672_3219_4096,Gemm_Hipblaslt_TN_9827,1.35405
GemmTunableOp_Half_TN,tn_4096_1739_4096,Gemm_Hipblaslt_TN_9645,0.115745
GemmTunableOp_Half_TN,tn_28672_6901_4096,Gemm_Hipblaslt_TN_9899,2.83798
GemmTunableOp_Half_TN,tn_6144_5089_4096,Gemm_Hipblaslt_TN_9813,0.434124
GemmTunableOp_Half_TN,tn_6144_5427_4096,Gemm_Hipblaslt_TN_9749,0.461122
GemmTunableOp_Half_TN,tn_4096_1589_14336,Gemm_Hipblaslt_TN_9610,0.359048
GemmTunableOp_Half_TN,tn_4096_5359_4096,Gemm_Hipblaslt_TN_9687,0.329849
GemmTunableOp_Half_TN,tn_6144_1935_4096,Gemm_Hipblaslt_TN_9697,0.176192
GemmTunableOp_Half_TN,tn_8192_2370_28672,Gemm_Hipblaslt_TN_9771,2.31064
GemmTunableOp_Half_TN,tn_4096_7186_4096,Gemm_Hipblaslt_TN_9694,0.408043
GemmTunableOp_Half_TN,tn_4096_1738_14336,Gemm_Hipblaslt_TN_9645,0.39402
GemmTunableOp_Half_TN,tn_28672_1597_4096,Gemm_Hipblaslt_TN_9674,0.708433
GemmTunableOp_Half_TN,tn_4096_1592_4096,Gemm_Hipblaslt_TN_9265,0.104393
GemmTunableOp_Half_TN,tn_6144_3438_4096,Gemm_Hipblaslt_TN_9570,0.312367
GemmTunableOp_Half_TN,tn_6144_3401_4096,Gemm_Rocblas_621286566,0.311193
GemmTunableOp_Half_TN,tn_4096_1860_4096,Gemm_Hipblaslt_TN_9645,0.120921
GemmTunableOp_Half_TN,tn_4096_1954_14336,Gemm_Hipblaslt_TN_9174,0.420737
GemmTunableOp_Half_TN,tn_28672_3559_4096,Gemm_Hipblaslt_TN_9841,1.39322
GemmTunableOp_Half_TN,tn_4096_1860_14336,Gemm_Hipblaslt_TN_9268,0.413025
GemmTunableOp_Half_TN,tn_6144_1668_4096,Gemm_Rocblas_621294495,0.156276
GemmTunableOp_Half_TN,tn_6144_5412_4096,Gemm_Hipblaslt_TN_9753,0.4568
GemmTunableOp_Half_TN,tn_128256_217_4096,Gemm_Hipblaslt_TN_9937,0.581587
GemmTunableOp_Half_TN,tn_4096_7248_14336,Gemm_Hipblaslt_TN_9694,1.46916
GemmTunableOp_Half_TN,tn_28672_1601_4096,Gemm_Hipblaslt_TN_9223,0.708535
GemmTunableOp_Half_TN,tn_28672_6870_4096,Gemm_Hipblaslt_TN_9939,2.83669
GemmTunableOp_Half_TN,tn_4096_1647_14336,Gemm_Hipblaslt_TN_9679,0.362128
GemmTunableOp_Half_TN,tn_6144_5204_4096,Gemm_Hipblaslt_TN_9704,0.44086
GemmTunableOp_Half_TN,tn_128256_10_4096,Gemm_Hipblaslt_TN_9405,0.287666
GemmTunableOp_Half_TN,tn_4096_5068_4096,Gemm_Hipblaslt_TN_9690,0.316584
GemmTunableOp_Half_TN,tn_4096_3345_4096,Gemm_Hipblaslt_TN_9188,0.194513
GemmTunableOp_Half_TN,tn_6144_1815_4096,Gemm_Hipblaslt_TN_9799,0.164157
GemmTunableOp_Half_TN,tn_6144_3595_4096,Gemm_Rocblas_621294495,0.325211
GemmTunableOp_Half_TN,tn_6144_1871_4096,Gemm_Rocblas_621294425,0.164977
GemmTunableOp_Half_TN,tn_4096_6744_4096,Gemm_Hipblaslt_TN_9862,0.393926
GemmTunableOp_Half_TN,tn_4096_1743_4096,Gemm_Hipblaslt_TN_9645,0.116988
GemmTunableOp_Half_TN,tn_28672_3589_4096,Gemm_Hipblaslt_TN_9832,1.47165
GemmTunableOp_Half_TN,tn_28672_3713_4096,Gemm_Hipblaslt_TN_9827,1.51301
GemmTunableOp_Half_TN,tn_128256_32_4096,Gemm_Rocblas_621294578,0.311982
GemmTunableOp_Half_TN,tn_6144_7484_4096,Gemm_Rocblas_621294127,0.642304
GemmTunableOp_Half_TN,tn_4096_1825_4096,Gemm_Hipblaslt_TN_9645,0.119798
GemmTunableOp_Half_TN,tn_128256_97_4096,Gemm_Rocblas_621294762,0.420778
GemmTunableOp_Half_TN,tn_28672_1779_4096,Gemm_Hipblaslt_TN_9217,0.748253
GemmTunableOp_Half_TN,tn_28672_1778_4096,Gemm_Hipblaslt_TN_9223,0.7402
GemmTunableOp_Half_TN,tn_4096_1858_4096,Gemm_Hipblaslt_TN_9645,0.120762
GemmTunableOp_Half_TN,tn_57344_2257_8192,Default,3.99286
GemmTunableOp_Half_TN,tn_4096_1896_4096,Gemm_Hipblaslt_TN_9645,0.120837
GemmStridedBatchedTunableOp_Half_TN,tn_1770_1770_128_B_32,Gemm_Rocblas_621286413,0.131645
GemmStridedBatchedTunableOp_Half_TN,tn_1603_1603_128_B_32,Gemm_Hipblaslt_TN_6942,0.11416
GemmStridedBatchedTunableOp_Half_TN,tn_1637_1637_128_B_32,Gemm_Hipblaslt_TN_6942,0.115844
GemmStridedBatchedTunableOp_Half_TN,tn_1979_1979_128_B_32,Gemm_Rocblas_621294533,0.164726
GemmStridedBatchedTunableOp_Half_TN,tn_1818_1818_128_B_32,Gemm_Hipblaslt_TN_6942,0.139939
GemmStridedBatchedTunableOp_Half_TN,tn_1882_1882_128_B_32,Gemm_Hipblaslt_TN_6942,0.145569
GemmStridedBatchedTunableOp_Half_TN,tn_1784_1784_128_B_32,Gemm_Rocblas_621294110,0.12874
GemmStridedBatchedTunableOp_Half_TN,tn_1865_1865_128_B_32,Gemm_Hipblaslt_TN_6942,0.142412
GemmStridedBatchedTunableOp_Half_TN,tn_1780_1780_128_B_32,Gemm_Hipblaslt_TN_6879,0.132777
GemmStridedBatchedTunableOp_Half_TN,tn_1850_1850_128_B_32,Gemm_Hipblaslt_TN_6942,0.144094
GemmStridedBatchedTunableOp_Half_TN,tn_1670_1670_128_B_32,Gemm_Hipblaslt_TN_6942,0.11792
GemmStridedBatchedTunableOp_Half_TN,tn_1829_1829_128_B_32,Gemm_Hipblaslt_TN_6942,0.140712
GemmStridedBatchedTunableOp_Half_TN,tn_1805_1805_128_B_32,Gemm_Hipblaslt_TN_6895,0.141484
GemmStridedBatchedTunableOp_Half_TN,tn_1890_1890_128_B_32,Gemm_Hipblaslt_TN_6942,0.149627
GemmStridedBatchedTunableOp_Half_TN,tn_1785_1785_128_B_32,Gemm_Rocblas_621286397,0.134379
GemmStridedBatchedTunableOp_Half_TN,tn_1720_1720_128_B_32,Gemm_Rocblas_621294110,0.118829
GemmStridedBatchedTunableOp_Half_TN,tn_1643_1643_128_B_32,Gemm_Hipblaslt_TN_6942,0.117409
GemmStridedBatchedTunableOp_Half_TN,tn_1781_1781_128_B_32,Gemm_Hipblaslt_TN_6879,0.134031
GemmStridedBatchedTunableOp_Half_TN,tn_1610_1610_128_B_32,Gemm_Hipblaslt_TN_6942,0.113465
GemmStridedBatchedTunableOp_Half_TN,tn_1580_1580_128_B_32,Gemm_Hipblaslt_TN_6895,0.110504
GemmStridedBatchedTunableOp_Half_TN,tn_1928_1928_128_B_32,Gemm_Hipblaslt_TN_153,0.145047
GemmStridedBatchedTunableOp_Half_TN,tn_1976_1976_128_B_32,Gemm_Hipblaslt_TN_153,0.153183
GemmStridedBatchedTunableOp_Half_TN,tn_1714_1714_128_B_32,Gemm_Rocblas_621286413,0.122983
GemmStridedBatchedTunableOp_Half_TN,tn_1842_1842_128_B_32,Gemm_Hipblaslt_TN_6942,0.144054
GemmStridedBatchedTunableOp_Half_TN,tn_1894_1894_128_B_32,Gemm_Rocblas_621294538,0.15005
GemmStridedBatchedTunableOp_Half_TN,tn_1601_1601_128_B_32,Gemm_Hipblaslt_TN_6942,0.113501
GemmStridedBatchedTunableOp_Half_TN,tn_1814_1814_128_B_32,Gemm_Hipblaslt_TN_6942,0.141097
GemmStridedBatchedTunableOp_Half_TN,tn_1903_1903_128_B_32,Gemm_Hipblaslt_TN_6942,0.15024
GemmStridedBatchedTunableOp_Half_TN,tn_1678_1678_128_B_32,Gemm_Hipblaslt_TN_6942,0.119874
GemmStridedBatchedTunableOp_Half_TN,tn_1769_1769_128_B_32,Gemm_Rocblas_621286397,0.131906
GemmStridedBatchedTunableOp_Half_TN,tn_1646_1646_128_B_32,Gemm_Hipblaslt_TN_6942,0.11719
GemmStridedBatchedTunableOp_Half_TN,tn_1618_1618_128_B_32,Gemm_Hipblaslt_TN_6942,0.114662
GemmStridedBatchedTunableOp_Half_TN,tn_1873_1873_128_B_32,Gemm_Hipblaslt_TN_6942,0.14558
GemmStridedBatchedTunableOp_Half_TN,tn_1905_1905_128_B_32,Gemm_Hipblaslt_TN_6942,0.150119
GemmStridedBatchedTunableOp_Half_TN,tn_1772_1772_128_B_32,Gemm_Rocblas_621294110,0.130443
GemmStridedBatchedTunableOp_Half_TN,tn_1723_1723_128_B_32,Gemm_Hipblaslt_TN_6942,0.125072
GemmStridedBatchedTunableOp_Half_TN,tn_1708_1708_128_B_32,Gemm_Hipblaslt_TN_6942,0.121478
GemmStridedBatchedTunableOp_Half_TN,tn_2028_2028_128_B_64,Gemm_Hipblaslt_TN_6950,0.340685
GemmStridedBatchedTunableOp_Half_TN,tn_1783_1783_128_B_32,Gemm_Rocblas_621286397,0.132572
GemmStridedBatchedTunableOp_Half_TN,tn_1973_1973_128_B_32,Gemm_Rocblas_621294533,0.162179
GemmStridedBatchedTunableOp_Half_TN,tn_1721_1721_128_B_32,Gemm_Rocblas_621294110,0.124777
GemmStridedBatchedTunableOp_Half_TN,tn_1950_1950_128_B_32,Gemm_Hipblaslt_TN_6879,0.157061
GemmStridedBatchedTunableOp_Half_TN,tn_1662_1662_128_B_32,Gemm_Hipblaslt_TN_6942,0.119688
GemmStridedBatchedTunableOp_Half_TN,tn_1883_1883_128_B_32,Gemm_Hipblaslt_TN_6889,0.151323
GemmStridedBatchedTunableOp_Half_TN,tn_2255_2255_128_B_64,Gemm_Rocblas_621294106,0.420102
GemmStridedBatchedTunableOp_Half_TN,tn_1619_1619_128_B_32,Gemm_Rocblas_621286397,0.108992
GemmStridedBatchedTunableOp_Half_TN,tn_1858_1858_128_B_32,Gemm_Rocblas_621294533,0.143009
GemmStridedBatchedTunableOp_Half_TN,tn_2096_2096_128_B_64,Gemm_Hipblaslt_TN_158,0.313417
GemmStridedBatchedTunableOp_Half_TN,tn_2193_2193_128_B_64,Gemm_Rocblas_621294106,0.400799
GemmStridedBatchedTunableOp_Half_TN,tn_2191_2191_128_B_64,Gemm_Rocblas_621294106,0.39451
GemmStridedBatchedTunableOp_Half_TN,tn_1940_1940_128_B_32,Gemm_Rocblas_621294533,0.155603
GemmStridedBatchedTunableOp_Half_TN,tn_2178_2178_128_B_64,Gemm_Hipblaslt_TN_158,0.372712
GemmStridedBatchedTunableOp_Half_TN,tn_16_16_128_B_64,Gemm_Rocblas_621286717,0.0068454
GemmStridedBatchedTunableOp_Half_TN,tn_2097_2097_128_B_64,Gemm_Hipblaslt_TN_6879,0.371538
GemmStridedBatchedTunableOp_Half_TN,tn_1911_1911_128_B_32,Gemm_Hipblaslt_TN_6950,0.150637
GemmStridedBatchedTunableOp_Half_TN,tn_1831_1831_128_B_32,Gemm_Hipblaslt_TN_6942,0.143361
GemmStridedBatchedTunableOp_Half_TN,tn_1712_1712_128_B_32,Gemm_Rocblas_621294110,0.113607
GemmStridedBatchedTunableOp_Half_TN,tn_1951_1951_128_B_32,Gemm_Hipblaslt_TN_6879,0.157453
GemmStridedBatchedTunableOp_Half_TN,tn_1679_1679_128_B_32,Gemm_Rocblas_621294110,0.119173
GemmStridedBatchedTunableOp_Half_TN,tn_1774_1774_128_B_32,Gemm_Rocblas_621286411,0.130721
GemmStridedBatchedTunableOp_Half_TN,tn_1621_1621_128_B_32,Gemm_Hipblaslt_TN_6942,0.114758
GemmStridedBatchedTunableOp_Half_TN,tn_2017_2017_128_B_64,Gemm_Hipblaslt_TN_6950,0.339588
GemmStridedBatchedTunableOp_Half_TN,tn_1908_1908_128_B_32,Gemm_Hipblaslt_TN_6942,0.146017
GemmStridedBatchedTunableOp_Half_TN,tn_1965_1965_128_B_32,Gemm_Rocblas_621286797,0.16163
GemmStridedBatchedTunableOp_Half_TN,tn_1620_1620_128_B_32,Gemm_Hipblaslt_TN_6942,0.113022
GemmStridedBatchedTunableOp_Half_TN,tn_2192_2192_128_B_64,Gemm_Hipblaslt_TN_158,0.370294
GemmStridedBatchedTunableOp_Half_TN,tn_1761_1761_128_B_32,Gemm_Rocblas_621286397,0.128565
GemmStridedBatchedTunableOp_Half_TN,tn_1664_1664_128_B_32,Gemm_Hipblaslt_TN_6942,0.107026
GemmStridedBatchedTunableOp_Half_TN,tn_1701_1701_128_B_32,Gemm_Rocblas_621286411,0.122958
GemmStridedBatchedTunableOp_Half_TN,tn_2161_2161_128_B_64,Gemm_Rocblas_621294106,0.388171
GemmStridedBatchedTunableOp_Half_TN,tn_1887_1887_128_B_32,Gemm_Hipblaslt_TN_6942,0.150289
GemmStridedBatchedTunableOp_Half_TN,tn_1767_1767_128_B_32,Gemm_Rocblas_621294108,0.128337
GemmStridedBatchedTunableOp_Half_TN,tn_1746_1746_128_B_32,Gemm_Rocblas_621286397,0.128296
GemmStridedBatchedTunableOp_Half_TN,tn_1888_1888_128_B_32,Gemm_Hipblaslt_TN_153,0.132379
GemmStridedBatchedTunableOp_Half_TN,tn_1834_1834_128_B_32,Gemm_Hipblaslt_TN_6942,0.140981
GemmStridedBatchedTunableOp_Half_TN,tn_1799_1799_128_B_32,Gemm_Hipblaslt_TN_6942,0.136552
GemmStridedBatchedTunableOp_Half_TN,tn_2079_2079_128_B_64,Gemm_Rocblas_621294106,0.360648
GemmStridedBatchedTunableOp_Half_TN,tn_1775_1775_128_B_32,Gemm_Rocblas_621286397,0.132514
GemmStridedBatchedTunableOp_Half_TN,tn_1598_1598_128_B_32,Gemm_Hipblaslt_TN_6942,0.112634
GemmStridedBatchedTunableOp_Half_TN,tn_1622_1622_128_B_32,Gemm_Hipblaslt_TN_6942,0.114447
GemmStridedBatchedTunableOp_Half_TN,tn_2417_2417_128_B_64,Gemm_Rocblas_621294106,0.48338
GemmStridedBatchedTunableOp_Half_TN,tn_1881_1881_128_B_32,Gemm_Hipblaslt_TN_6942,0.147208
GemmStridedBatchedTunableOp_Half_TN,tn_1658_1658_128_B_32,Gemm_Hipblaslt_TN_6942,0.118172
GemmStridedBatchedTunableOp_Half_TN,tn_1631_1631_128_B_32,Gemm_Hipblaslt_TN_6942,0.115672
GemmStridedBatchedTunableOp_Half_TN,tn_1977_1977_128_B_32,Gemm_Hipblaslt_TN_6879,0.163195
GemmStridedBatchedTunableOp_Half_TN,tn_1927_1927_128_B_32,Gemm_Rocblas_621294533,0.154782
GemmStridedBatchedTunableOp_Half_TN,tn_1957_1957_128_B_32,Gemm_Hipblaslt_TN_6879,0.157774
GemmStridedBatchedTunableOp_Half_TN,tn_1901_1901_128_B_32,Gemm_Hipblaslt_TN_6942,0.147822
GemmStridedBatchedTunableOp_Half_TN,tn_1828_1828_128_B_32,Gemm_Hipblaslt_TN_6942,0.140875
GemmStridedBatchedTunableOp_Half_TN,tn_1711_1711_128_B_32,Gemm_Hipblaslt_TN_6942,0.124722
GemmStridedBatchedTunableOp_Half_TN,tn_1804_1804_128_B_32,Gemm_Hipblaslt_TN_6942,0.138569
GemmStridedBatchedTunableOp_Half_TN,tn_1642_1642_128_B_32,Gemm_Rocblas_621286397,0.111705
GemmStridedBatchedTunableOp_Half_TN,tn_1728_1728_128_B_32,Gemm_Hipblaslt_TN_9774,0.112603
GemmStridedBatchedTunableOp_Half_TN,tn_2385_2385_128_B_64,Gemm_Hipblaslt_TN_9831,0.471353
GemmStridedBatchedTunableOp_Half_TN,tn_1925_1925_128_B_32,Gemm_Rocblas_621294533,0.154666
GemmStridedBatchedTunableOp_Half_TN,tn_1938_1938_128_B_32,Gemm_Rocblas_621294533,0.155152
GemmStridedBatchedTunableOp_Half_TN,tn_1969_1969_128_B_32,Gemm_Rocblas_621294533,0.162979
GemmStridedBatchedTunableOp_Half_TN,tn_1615_1615_128_B_32,Gemm_Hipblaslt_TN_6942,0.114688
GemmStridedBatchedTunableOp_Half_TN,tn_1611_1611_128_B_32,Gemm_Hipblaslt_TN_6942,0.113486
GemmStridedBatchedTunableOp_Half_TN,tn_1974_1974_128_B_32,Gemm_Rocblas_621294533,0.162987
GemmStridedBatchedTunableOp_Half_TN,tn_1964_1964_128_B_32,Gemm_Hipblaslt_TN_6879,0.157609
GemmStridedBatchedTunableOp_Half_TN,tn_1765_1765_128_B_32,Gemm_Hipblaslt_TN_6874,0.132485
GemmStridedBatchedTunableOp_Half_TN,tn_1609_1609_128_B_32,Gemm_Hipblaslt_TN_6942,0.114629
GemmStridedBatchedTunableOp_Half_TN,tn_1864_1864_128_B_32,Gemm_Hipblaslt_TN_157,0.133978
GemmStridedBatchedTunableOp_Half_TN,tn_2239_2239_128_B_64,Gemm_Rocblas_621294533,0.411973
GemmStridedBatchedTunableOp_Half_TN,tn_1856_1856_128_B_32,Gemm_Hipblaslt_TN_157,0.129601
GemmStridedBatchedTunableOp_Half_TN,tn_1749_1749_128_B_32,Gemm_Rocblas_621286413,0.128969
GemmTunableOp_Half_TN,tn_4096_3379_14336,Gemm_Hipblaslt_TN_9187,0.665455
GemmTunableOp_Half_TN,tn_4096_5447_4096,Gemm_Rocblas_621286580,0.335419
GemmTunableOp_Half_TN,tn_4096_3581_4096,Gemm_Hipblaslt_TN_9743,0.204197
GemmTunableOp_Half_TN,tn_6144_1796_4096,Gemm_Rocblas_621294349,0.165939
GemmTunableOp_Half_TN,tn_28672_1717_4096,Gemm_Hipblaslt_TN_9223,0.744382
GemmTunableOp_Half_TN,tn_6144_1704_4096,Gemm_Hipblaslt_TN_9799,0.157365
GemmTunableOp_Half_TN,tn_6144_3309_4096,Gemm_Hipblaslt_TN_9774,0.309989
GemmTunableOp_Half_TN,tn_6144_1719_4096,Gemm_Hipblaslt_TN_9570,0.158509
GemmTunableOp_Half_TN,tn_4096_3400_4096,Gemm_Hipblaslt_TN_9743,0.193573
GemmTunableOp_Half_TN,tn_4096_1874_14336,Gemm_Hipblaslt_TN_9620,0.418118
GemmTunableOp_Half_TN,tn_4096_3768_14336,Gemm_Hipblaslt_TN_9827,0.736125
GemmTunableOp_Half_TN,tn_4096_5605_14336,Gemm_Hipblaslt_TN_9689,1.2115
GemmTunableOp_Half_TN,tn_6144_1651_4096,Gemm_Rocblas_621294495,0.154104
GemmTunableOp_Half_TN,tn_6144_6721_4096,Gemm_Hipblaslt_TN_9677,0.593645
GemmTunableOp_Half_TN,tn_128256_139_4096,Gemm_Hipblaslt_TN_9108,0.472549
GemmTunableOp_Half_TN,tn_4096_5223_14336,Gemm_Hipblaslt_TN_9924,1.11059
GemmTunableOp_Half_TN,tn_6144_1874_4096,Gemm_Rocblas_621286705,0.168933
GemmTunableOp_Half_TN,tn_28672_5583_4096,Gemm_Hipblaslt_TN_9852,2.3819
GemmTunableOp_Half_TN,tn_4096_1628_4096,Gemm_Hipblaslt_TN_9265,0.105997
GemmTunableOp_Half_TN,tn_4096_3401_14336,Gemm_Hipblaslt_TN_9743,0.671269
GemmTunableOp_Half_TN,tn_28672_6800_4096,Gemm_Hipblaslt_TN_9855,2.86764
GemmTunableOp_Half_TN,tn_6144_1813_4096,Gemm_Rocblas_621294425,0.166086
GemmTunableOp_Half_TN,tn_4096_3496_4096,Gemm_Rocblas_621286281,0.204554
GemmTunableOp_Half_TN,tn_4096_1804_14336,Gemm_Hipblaslt_TN_9620,0.413136
GemmTunableOp_Half_TN,tn_6144_7730_4096,Gemm_Hipblaslt_TN_9815,0.67201
GemmTunableOp_Half_TN,tn_4096_5357_4096,Gemm_Rocblas_621294320,0.330688
GemmTunableOp_Half_TN,tn_4096_1931_14336,Gemm_Hipblaslt_TN_9620,0.422789
GemmTunableOp_Half_TN,tn_6144_1825_4096,Gemm_Rocblas_621294425,0.16609
GemmTunableOp_Half_TN,tn_6144_3647_4096,Gemm_Hipblaslt_TN_9570,0.328971
GemmTunableOp_Half_TN,tn_128256_84_4096,Gemm_Hipblaslt_TN_9057,0.38749
GemmTunableOp_Half_TN,tn_4096_1767_14336,Gemm_Hipblaslt_TN_9645,0.395744
GemmTunableOp_Half_TN,tn_4096_3651_4096,Gemm_Hipblaslt_TN_9827,0.215055
GemmTunableOp_Half_TN,tn_28672_6871_4096,Gemm_Hipblaslt_TN_9955,2.8737
GemmTunableOp_Half_TN,tn_28672_1934_4096,Gemm_Hipblaslt_TN_9846,0.860666
GemmTunableOp_Half_TN,tn_128256_206_4096,Gemm_Hipblaslt_TN_9937,0.570341
GemmTunableOp_Half_TN,tn_4096_1651_4096,Gemm_Hipblaslt_TN_9679,0.105895
GemmTunableOp_Half_TN,tn_28672_1811_4096,Gemm_Hipblaslt_TN_9684,0.800391
GemmTunableOp_Half_TN,tn_4096_1789_14336,Gemm_Hipblaslt_TN_9645,0.397357
GemmTunableOp_Half_TN,tn_4096_7170_14336,Gemm_Hipblaslt_TN_9743,1.4739
GemmTunableOp_Half_TN,tn_4096_1890_14336,Gemm_Hipblaslt_TN_9620,0.415706
GemmTunableOp_Half_TN,tn_4096_1690_14336,Gemm_Hipblaslt_TN_9790,0.366102
GemmTunableOp_Half_TN,tn_4096_5390_4096,Gemm_Rocblas_621286580,0.33094
GemmTunableOp_Half_TN,tn_4096_1981_4096,Gemm_Hipblaslt_TN_9645,0.124035
GemmTunableOp_Half_TN,tn_6144_5442_4096,Gemm_Hipblaslt_TN_9753,0.463443
GemmTunableOp_Half_TN,tn_128256_158_4096,Gemm_Hipblaslt_TN_9775,0.477831
GemmTunableOp_Half_TN,tn_6144_184_4096,Gemm_Rocblas_621286440,0.0290169
GemmTunableOp_Half_TN,tn_28672_1815_4096,Gemm_Hipblaslt_TN_9683,0.801529
GemmTunableOp_Half_TN,tn_4096_1898_14336,Gemm_Hipblaslt_TN_9620,0.415385
GemmTunableOp_Half_TN,tn_4096_7484_14336,Gemm_Hipblaslt_TN_9749,1.58659
GemmTunableOp_Half_TN,tn_28672_1623_4096,Gemm_Rocblas_621294484,0.72745
GemmTunableOp_Half_TN,tn_4096_3682_14336,Gemm_Hipblaslt_TN_9841,0.727413
GemmTunableOp_Half_TN,tn_128256_49_4096,Gemm_Hipblaslt_TN_9097,0.350429
GemmTunableOp_Half_TN,tn_4096_6788_14336,Gemm_Hipblaslt_TN_9743,1.41325
GemmTunableOp_Half_TN,tn_4096_1966_4096,Gemm_Hipblaslt_TN_9645,0.125457
GemmTunableOp_Half_TN,tn_4096_5239_14336,Gemm_Hipblaslt_TN_9709,1.09905
GemmTunableOp_Half_TN,tn_28672_6788_4096,Gemm_Hipblaslt_TN_9899,2.85448
GemmTunableOp_Half_TN,tn_28672_1708_4096,Gemm_Rocblas_621286742,0.74346
GemmTunableOp_Half_TN,tn_4096_1864_14336,Gemm_Hipblaslt_TN_9792,0.418444
GemmTunableOp_Half_TN,tn_28672_3557_4096,Gemm_Hipblaslt_TN_9827,1.41578
GemmTunableOp_Half_TN,tn_8192_4033_8192,Gemm_Hipblaslt_TN_9753,0.903661
GemmTunableOp_Half_TN,tn_28672_1636_4096,Gemm_Rocblas_621294420,0.730365
GemmTunableOp_Half_TN,tn_6144_3630_4096,Gemm_Rocblas_621294495,0.329038
GemmTunableOp_Half_TN,tn_4096_7050_4096,Gemm_Hipblaslt_TN_9743,0.403996
GemmTunableOp_Half_TN,tn_4096_1909_14336,Gemm_Hipblaslt_TN_9620,0.417393
GemmTunableOp_Half_TN,tn_28672_1896_4096,Gemm_Hipblaslt_TN_9683,0.818103
GemmTunableOp_Half_TN,tn_6144_64_4096,Gemm_Rocblas_621286426,0.0158131
GemmTunableOp_Half_TN,tn_10240_2065_8192,Gemm_Hipblaslt_TN_9675,0.621581
GemmTunableOp_Half_TN,tn_6144_1643_4096,Gemm_Rocblas_621294426,0.15559
GemmTunableOp_Half_TN,tn_4096_1945_14336,Gemm_Hipblaslt_TN_9620,0.42128
GemmTunableOp_Half_TN,tn_6144_200_4096,Gemm_Hipblaslt_TN_9495,0.0325044
GemmTunableOp_Half_TN,tn_4096_1633_14336,Gemm_Hipblaslt_TN_9671,0.362677
GemmTunableOp_Half_TN,tn_4096_1839_14336,Gemm_Hipblaslt_TN_9620,0.410655
GemmTunableOp_Half_TN,tn_4096_3515_4096,Gemm_Hipblaslt_TN_9743,0.202731
GemmTunableOp_Half_TN,tn_32000_58_8192,Gemm_Rocblas_621294203,0.159982
GemmTunableOp_Half_TN,tn_28672_1706_4096,Gemm_Rocblas_621294484,0.743094
GemmTunableOp_Half_TN,tn_8192_2207_8192,Gemm_Hipblaslt_TN_9742,0.520433
GemmTunableOp_Half_TN,tn_8192_2192_28672,Gemm_Hipblaslt_TN_9762,2.08979
GemmTunableOp_Half_TN,tn_6144_1633_4096,Gemm_Rocblas_621294495,0.15275
GemmTunableOp_Half_TN,tn_28672_7340_4096,Gemm_Hipblaslt_TN_159,2.95722
GemmTunableOp_Half_TN,tn_28672_1772_4096,Gemm_Rocblas_621286742,0.757916
GemmTunableOp_Half_TN,tn_128256_130_4096,Gemm_Hipblaslt_TN_9709,0.464702
GemmTunableOp_Half_TN,tn_6144_3713_4096,Gemm_Rocblas_621286575,0.342005
GemmTunableOp_Half_TN,tn_28672_3773_4096,Gemm_Hipblaslt_TN_9827,1.55696
GemmTunableOp_Half_TN,tn_4096_5498_4096,Gemm_Rocblas_621286580,0.340381
GemmTunableOp_Half_TN,tn_6144_1760_4096,Gemm_Rocblas_621286683,0.156158
GemmTunableOp_Half_TN,tn_4096_1852_4096,Gemm_Hipblaslt_TN_9645,0.121262
GemmTunableOp_Half_TN,tn_28672_1858_4096,Gemm_Hipblaslt_TN_9684,0.808438
GemmTunableOp_Half_TN,tn_8192_62_28672,Gemm_Rocblas_621286489,0.145496
GemmTunableOp_Half_TN,tn_6144_1978_4096,Gemm_Hipblaslt_TN_9697,0.179467
GemmTunableOp_Half_TN,tn_28672_3410_4096,Gemm_Hipblaslt_TN_9841,1.40017
GemmTunableOp_Half_TN,tn_10240_2159_8192,Gemm_Rocblas_621286684,0.648635
GemmTunableOp_Half_TN,tn_8192_2065_28672,Gemm_Hipblaslt_TN_9763,2.08664
GemmTunableOp_Half_TN,tn_6144_1685_4096,Gemm_Hipblaslt_TN_9570,0.155276
GemmTunableOp_Half_TN,tn_28672_1935_4096,Gemm_Hipblaslt_TN_9846,0.85116
GemmTunableOp_Half_TN,tn_4096_3666_4096,Gemm_Hipblaslt_TN_9827,0.2163
GemmTunableOp_Half_TN,tn_128256_104_4096,Gemm_Rocblas_621294762,0.423237
GemmTunableOp_Half_TN,tn_6144_3600_4096,Gemm_Rocblas_621286566,0.321361
GemmTunableOp_Half_TN,tn_4096_3748_4096,Gemm_Hipblaslt_TN_9827,0.216499
GemmTunableOp_Half_TN,tn_4096_7139_4096,Gemm_Hipblaslt_TN_9697,0.417963
GemmTunableOp_Half_TN,tn_6144_7248_4096,Gemm_Hipblaslt_TN_9814,0.618853
GemmTunableOp_Half_TN,tn_28672_1683_4096,Gemm_Hipblaslt_TN_9223,0.738085
GemmTunableOp_Half_TN,tn_4096_3369_14336,Gemm_Hipblaslt_TN_9743,0.666775
GemmTunableOp_Half_TN,tn_4096_5381_4096,Gemm_Hipblaslt_TN_9687,0.332663
GemmTunableOp_Half_TN,tn_6144_1892_4096,Gemm_Rocblas_621286705,0.170259
GemmTunableOp_Half_TN,tn_8192_2178_8192,Gemm_Hipblaslt_TN_9742,0.517673
GemmTunableOp_Half_TN,tn_28672_1872_4096,Gemm_Hipblaslt_TN_9832,0.807027
GemmTunableOp_Half_TN,tn_4096_1807_4096,Gemm_Hipblaslt_TN_9645,0.118729
GemmTunableOp_Half_TN,tn_4096_1618_14336,Gemm_Hipblaslt_TN_9671,0.363734
GemmTunableOp_Half_TN,tn_4096_7120_14336,Gemm_Hipblaslt_TN_9743,1.45411
GemmTunableOp_Half_TN,tn_28672_5322_4096,Gemm_Hipblaslt_TN_9934,2.19962
GemmTunableOp_Half_TN,tn_4096_1719_4096,Gemm_Hipblaslt_TN_9679,0.110142
GemmTunableOp_Half_TN,tn_8192_4066_8192,Gemm_Hipblaslt_TN_9704,0.909677
GemmTunableOp_Half_TN,tn_6144_3920_4096,Gemm_Hipblaslt_TN_9691,0.354367
GemmTunableOp_Half_TN,tn_32000_28_8192,Gemm_Rocblas_621294193,0.148411
GemmTunableOp_Half_TN,tn_8192_66_28672,Gemm_Hipblaslt_TN_8168,0.172912
GemmTunableOp_Half_TN,tn_8192_2225_8192,Gemm_Hipblaslt_TN_9763,0.525922
GemmTunableOp_Half_TN,tn_6144_1702_4096,Gemm_Rocblas_621294495,0.157557
GemmTunableOp_Half_TN,tn_4096_1603_14336,Gemm_Hipblaslt_TN_9679,0.360834
GemmTunableOp_Half_TN,tn_28672_1735_4096,Gemm_Hipblaslt_TN_9730,0.746709
GemmTunableOp_Half_TN,tn_8192_2305_8192,Gemm_Rocblas_621294527,0.563223
GemmTunableOp_Half_TN,tn_128256_65_4096,Gemm_Hipblaslt_TN_9058,0.37772
GemmTunableOp_Half_TN,tn_10240_2302_8192,Gemm_Rocblas_621294321,0.673292
GemmTunableOp_Half_TN,tn_8192_2079_28672,Gemm_Hipblaslt_TN_9763,2.07442
GemmTunableOp_Half_TN,tn_4096_7206_14336,Gemm_Hipblaslt_TN_9732,1.48177
GemmTunableOp_Half_TN,tn_57344_2112_8192,Gemm_Hipblaslt_TN_156,3.95537
GemmTunableOp_Half_TN,tn_8192_29_28672,Gemm_Rocblas_621294226,0.132357
GemmTunableOp_Half_TN,tn_32000_66_8192,Gemm_Hipblaslt_TN_9479,0.189235
GemmTunableOp_Half_TN,tn_28672_1698_4096,Gemm_Hipblaslt_TN_9223,0.737996
GemmTunableOp_Half_TN,tn_10240_2158_8192,Gemm_Rocblas_621286580,0.647353
GemmTunableOp_Half_TN,tn_10240_4081_8192,Gemm_Hipblaslt_TN_9743,1.14447
GemmTunableOp_Half_TN,tn_4096_1867_14336,Gemm_Hipblaslt_TN_9620,0.416092
GemmTunableOp_Half_TN,tn_10240_63_8192,Gemm_Hipblaslt_TN_9304,0.0485402
GemmTunableOp_Half_TN,tn_128256_8_4096,Gemm_Hipblaslt_TN_9405,0.29089
GemmTunableOp_Half_TN,tn_57344_2082_8192,Gemm_Rocblas_621294542,3.91891
GemmTunableOp_Half_TN,tn_4096_1909_4096,Gemm_Hipblaslt_TN_9645,0.122346
GemmTunableOp_Half_TN,tn_28672_3438_4096,Gemm_Hipblaslt_TN_9827,1.40304
GemmTunableOp_Half_TN,tn_4096_1764_14336,Gemm_Hipblaslt_TN_9645,0.393095
GemmTunableOp_Half_TN,tn_4096_7027_4096,Gemm_Hipblaslt_TN_9677,0.411594
GemmTunableOp_Half_TN,tn_4096_1792_4096,Gemm_Hipblaslt_TN_9136,0.11634
GemmTunableOp_Half_TN,tn_4096_1825_14336,Gemm_Hipblaslt_TN_9620,0.412945
GemmTunableOp_Half_TN,tn_10240_29_8192,Gemm_Hipblaslt_TN_9415,0.0400631
GemmTunableOp_Half_TN,tn_4096_1725_14336,Gemm_Hipblaslt_TN_9790,0.368621
GemmTunableOp_Half_TN,tn_57344_4017_8192,Gemm_Rocblas_621286915,6.71498
GemmTunableOp_Half_TN,tn_4096_3781_14336,Gemm_Hipblaslt_TN_9827,0.7361
GemmTunableOp_Half_TN,tn_6144_96_4096,Gemm_Rocblas_621294028,0.0184287
GemmTunableOp_Half_TN,tn_8192_4081_8192,Gemm_Hipblaslt_TN_9768,0.912904
GemmTunableOp_Half_TN,tn_28672_7344_4096,Gemm_Hipblaslt_TN_159,3.00541
GemmTunableOp_Half_TN,tn_8192_62_8192,Gemm_Hipblaslt_TN_7484,0.0396888
GemmTunableOp_Half_TN,tn_28672_1882_4096,Gemm_Hipblaslt_TN_9832,0.811936
GemmTunableOp_Half_TN,tn_6144_7096_4096,Gemm_Hipblaslt_TN_9677,0.607585
GemmTunableOp_Half_TN,tn_28672_3578_4096,Gemm_Hipblaslt_TN_9827,1.42437
GemmTunableOp_Half_TN,tn_4096_1752_14336,Gemm_Hipblaslt_TN_9645,0.396079
GemmTunableOp_Half_TN,tn_28672_1830_4096,Gemm_Hipblaslt_TN_9683,0.807742
GemmTunableOp_Half_TN,tn_4096_64_14336,Gemm_Rocblas_621294058,0.0343308
GemmTunableOp_Half_TN,tn_4096_1933_14336,Gemm_Hipblaslt_TN_9645,0.423705
GemmTunableOp_Half_TN,tn_4096_1967_14336,Gemm_Hipblaslt_TN_9620,0.4232
GemmTunableOp_Half_TN,tn_4096_1801_14336,Gemm_Hipblaslt_TN_9620,0.412426
GemmTunableOp_Half_TN,tn_4096_1627_4096,Gemm_Hipblaslt_TN_9587,0.105391
GemmTunableOp_Half_TN,tn_4096_16_4096,Gemm_Rocblas_621294130,0.0100947
GemmTunableOp_Half_TN,tn_8192_2082_8192,Gemm_Hipblaslt_TN_9742,0.50317
GemmTunableOp_Half_TN,tn_28672_1973_4096,Gemm_Hipblaslt_TN_9846,0.862113
GemmTunableOp_Half_TN,tn_4096_232_14336,Gemm_Hipblaslt_TN_9303,0.0765939
GemmTunableOp_Half_TN,tn_6144_1859_4096,Gemm_Hipblaslt_TN_9687,0.16644
GemmTunableOp_Half_TN,tn_8192_2017_8192,Gemm_Hipblaslt_TN_9840,0.478887
GemmTunableOp_Half_TN,tn_8192_65_28672,Gemm_Hipblaslt_TN_8168,0.174188
GemmTunableOp_Half_TN,tn_4096_1590_4096,Gemm_Hipblaslt_TN_9265,0.106126
GemmTunableOp_Half_TN,tn_4096_1916_14336,Gemm_Hipblaslt_TN_9620,0.417387
GemmTunableOp_Half_TN,tn_8192_2161_8192,Gemm_Hipblaslt_TN_9742,0.510899
GemmTunableOp_Half_TN,tn_28672_1824_4096,Gemm_Hipblaslt_TN_9684,0.803802
GemmTunableOp_Half_TN,tn_28672_1831_4096,Gemm_Hipblaslt_TN_9683,0.810586
GemmTunableOp_Half_TN,tn_6144_1600_4096,Gemm_Rocblas_621294305,0.145288
GemmTunableOp_Half_TN,tn_4096_3652_4096,Gemm_Hipblaslt_TN_9217,0.216171
GemmTunableOp_Half_TN,tn_128256_15_4096,Gemm_Hipblaslt_TN_9405,0.294273
GemmTunableOp_Half_TN,tn_128256_176_4096,Gemm_Hipblaslt_TN_9694,0.513422
GemmTunableOp_Half_TN,tn_57344_2369_8192,Default,4.35519
GemmTunableOp_Half_TN,tn_128256_219_4096,Gemm_Hipblaslt_TN_9919,0.579441
GemmTunableOp_Half_TN,tn_4096_1597_14336,Gemm_Hipblaslt_TN_9790,0.360582
GemmTunableOp_Half_TN,tn_6144_3622_4096,Gemm_Rocblas_621294495,0.325946
GemmTunableOp_Half_TN,tn_8192_2417_8192,Gemm_Hipblaslt_TN_9698,0.572329
GemmTunableOp_Half_TN,tn_6144_3764_4096,Gemm_Hipblaslt_TN_9691,0.34392
GemmTunableOp_Half_TN,tn_4096_1727_14336,Gemm_Hipblaslt_TN_9790,0.370567
GemmTunableOp_Half_TN,tn_128256_249_4096,Gemm_Rocblas_621286892,0.608816
GemmTunableOp_Half_TN,tn_4096_80_4096,Gemm_Rocblas_621286280,0.0151879
GemmTunableOp_Half_TN,tn_28672_5223_4096,Gemm_Hipblaslt_TN_9841,2.17858
GemmTunableOp_Half_TN,tn_4096_3547_14336,Gemm_Hipblaslt_TN_9841,0.694386
GemmTunableOp_Half_TN,tn_4096_1766_14336,Gemm_Hipblaslt_TN_9645,0.39535
GemmTunableOp_Half_TN,tn_28672_3478_4096,Gemm_Hipblaslt_TN_9827,1.41115
GemmTunableOp_Half_TN,tn_6144_7072_4096,Gemm_Hipblaslt_TN_9743,0.606014
GemmTunableOp_Half_TN,tn_57344_2145_8192,Gemm_Rocblas_621294543,3.97282
GemmTunableOp_Half_TN,tn_4096_1684_4096,Gemm_Hipblaslt_TN_9569,0.108064
GemmTunableOp_Half_TN,tn_32000_57_8192,Gemm_Hipblaslt_TN_9460,0.162921
GemmTunableOp_Half_TN,tn_8192_2255_8192,Gemm_Hipblaslt_TN_9742,0.520921
GemmTunableOp_Half_TN,tn_4096_1824_14336,Gemm_Hipblaslt_TN_9620,0.410559
GemmTunableOp_Half_TN,tn_10240_2369_8192,Gemm_Rocblas_621286684,0.687108
GemmTunableOp_Half_TN,tn_10240_2112_8192,Gemm_Hipblaslt_TN_9182,0.639942
GemmTunableOp_Half_TN,tn_4096_216_14336,Gemm_Hipblaslt_TN_9363,0.0717482
GemmTunableOp_Half_TN,tn_128256_227_4096,Gemm_Rocblas_621294634,0.59589
GemmTunableOp_Half_TN,tn_28672_3645_4096,Gemm_Hipblaslt_TN_9832,1.50753
GemmTunableOp_Half_TN,tn_128256_250_4096,Gemm_Rocblas_621294634,0.612735
GemmTunableOp_Half_TN,tn_32000_55_8192,Gemm_Rocblas_621286466,0.163029
GemmTunableOp_Half_TN,tn_28672_1670_4096,Gemm_Rocblas_621286742,0.736275
GemmTunableOp_Half_TN,tn_128256_160_4096,Gemm_Hipblaslt_TN_9775,0.47065
GemmTunableOp_Half_TN,tn_6144_3682_4096,Gemm_Rocblas_621294315,0.339703
GemmTunableOp_Half_TN,tn_128256_27_4096,Gemm_Hipblaslt_TN_9451,0.314246
GemmTunableOp_Half_TN,tn_6144_3219_4096,Gemm_Rocblas_621286566,0.296755
GemmTunableOp_Half_TN,tn_6144_3578_4096,Gemm_Rocblas_621286753,0.325664
GemmTunableOp_Half_TN,tn_10240_2238_8192,Gemm_Rocblas_621286580,0.65225
GemmTunableOp_Half_TN,tn_4096_3501_4096,Gemm_Hipblaslt_TN_9743,0.203254
GemmTunableOp_Half_TN,tn_4096_3764_14336,Gemm_Hipblaslt_TN_9827,0.739123
GemmTunableOp_Half_TN,tn_4096_1813_4096,Gemm_Hipblaslt_TN_9645,0.120611
GemmTunableOp_Half_TN,tn_8192_2000_8192,Gemm_Hipblaslt_TN_9768,0.442535
GemmTunableOp_Half_TN,tn_10240_2049_8192,Gemm_Hipblaslt_TN_9690,0.618394
GemmTunableOp_Half_TN,tn_10240_2097_8192,Gemm_Hipblaslt_TN_9209,0.641372
GemmTunableOp_Half_TN,tn_4096_3514_14336,Gemm_Hipblaslt_TN_9743,0.69225
GemmTunableOp_Half_TN,tn_8192_2289_28672,Gemm_Hipblaslt_TN_9774,2.25776
GemmTunableOp_Half_TN,tn_10240_2225_8192,Gemm_Rocblas_621286575,0.656273
GemmTunableOp_Half_TN,tn_28672_6708_4096,Gemm_Hipblaslt_TN_9958,2.74414
GemmTunableOp_Half_TN,tn_8192_63_28672,Gemm_Rocblas_621286489,0.148111
GemmTunableOp_Half_TN,tn_4096_3651_14336,Gemm_Hipblaslt_TN_9827,0.724947
GemmTunableOp_Half_TN,tn_28672_5498_4096,Gemm_Hipblaslt_TN_9840,2.35848
GemmTunableOp_Half_TN,tn_57344_2161_8192,Gemm_Rocblas_621294542,3.97019
GemmTunableOp_Half_TN,tn_4096_1823_14336,Gemm_Hipblaslt_TN_9645,0.410855
GemmTunableOp_Half_TN,tn_57344_2096_8192,Gemm_Rocblas_621294543,3.93996
GemmTunableOp_Half_TN,tn_4096_6971_14336,Gemm_Hipblaslt_TN_9732,1.4469
GemmTunableOp_Half_TN,tn_4096_5067_4096,Gemm_Hipblaslt_TN_9691,0.320245
GemmTunableOp_Half_TN,tn_4096_5442_14336,Gemm_Hipblaslt_TN_9924,1.17965
GemmTunableOp_Half_TN,tn_4096_1796_4096,Gemm_Hipblaslt_TN_9645,0.120196
GemmTunableOp_Half_TN,tn_128256_175_4096,Gemm_Hipblaslt_TN_9752,0.510733
GemmTunableOp_Half_TN,tn_28672_1600_4096,Gemm_Rocblas_621286684,0.71929
GemmTunableOp_Half_TN,tn_6144_240_4096,Gemm_Hipblaslt_TN_9494,0.0343695
GemmTunableOp_Half_TN,tn_57344_64_8192,Gemm_Rocblas_621294202,0.313255
GemmTunableOp_Half_TN,tn_6144_6871_4096,Gemm_Hipblaslt_TN_9677,0.599837
GemmTunableOp_Half_TN,tn_8192_2160_8192,Gemm_Hipblaslt_TN_9742,0.51775
GemmTunableOp_Half_TN,tn_32000_31_8192,Gemm_Rocblas_621294578,0.151193
GemmTunableOp_Half_TN,tn_4096_1711_14336,Gemm_Hipblaslt_TN_9790,0.368003
GemmTunableOp_Half_TN,tn_10240_58_8192,Gemm_Hipblaslt_TN_9304,0.0474841
GemmTunableOp_Half_TN,tn_28672_104_4096,Gemm_Rocblas_621286503,0.0687865
GemmTunableOp_Half_TN,tn_6144_1609_4096,Gemm_Hipblaslt_TN_9570,0.150573
GemmTunableOp_Half_TN,tn_8192_2028_28672,Gemm_Hipblaslt_TN_9840,1.77649
GemmTunableOp_Half_TN,tn_6144_1607_4096,Gemm_Rocblas_621286566,0.153423
GemmTunableOp_Half_TN,tn_8192_2112_8192,Gemm_Hipblaslt_TN_9742,0.504555
GemmTunableOp_Half_TN,tn_4096_1588_4096,Gemm_Hipblaslt_TN_9679,0.104986
GemmTunableOp_Half_TN,tn_57344_2190_8192,Default,3.89843
GemmTunableOp_Half_TN,tn_28672_1802_4096,Gemm_Hipblaslt_TN_9683,0.791705
GemmTunableOp_Half_TN,tn_6144_1858_4096,Gemm_Rocblas_621294447,0.168053
GemmTunableOp_Half_TN,tn_8192_2208_8192,Gemm_Hipblaslt_TN_9742,0.517501
GemmTunableOp_Half_TN,tn_4096_7267_14336,Gemm_Hipblaslt_TN_9694,1.48799
GemmTunableOp_Half_TN,tn_10240_59_8192,Gemm_Hipblaslt_TN_9086,0.0488889
GemmTunableOp_Half_TN,tn_8192_2028_8192,Gemm_Hipblaslt_TN_9742,0.483374
GemmTunableOp_Half_TN,tn_6144_1625_4096,Gemm_Rocblas_621286753,0.154702
GemmTunableOp_Half_TN,tn_57344_2417_8192,Gemm_Hipblaslt_TN_9800,4.46192
GemmTunableOp_Half_TN,tn_6144_1810_4096,Gemm_Rocblas_621294426,0.163918
GemmTunableOp_Half_TN,tn_4096_3791_4096,Gemm_Hipblaslt_TN_9841,0.218678
GemmTunableOp_Half_TN,tn_4096_5530_4096,Gemm_Rocblas_621286575,0.340127
GemmTunableOp_Half_TN,tn_4096_1615_14336,Gemm_Hipblaslt_TN_9790,0.361725
GemmTunableOp_Half_TN,tn_6144_1770_4096,Gemm_Rocblas_621294447,0.163752
GemmTunableOp_Half_TN,tn_8192_2159_28672,Gemm_Hipblaslt_TN_9742,2.05892
GemmTunableOp_Half_TN,tn_4096_3781_4096,Gemm_Hipblaslt_TN_9768,0.217525
GemmTunableOp_Half_TN,tn_6144_1931_4096,Gemm_Hipblaslt_TN_9697,0.17543
GemmTunableOp_Half_TN,tn_4096_5359_14336,Gemm_Hipblaslt_TN_9799,1.14026
GemmTunableOp_Half_TN,tn_10240_2028_8192,Gemm_Rocblas_621286570,0.614391
GemmTunableOp_Half_TN,tn_128256_41_4096,Gemm_Hipblaslt_TN_9451,0.329575
GemmTunableOp_Half_TN,tn_128256_243_4096,Gemm_Rocblas_621286892,0.608583
GemmTunableOp_Half_TN,tn_8192_60_28672,Gemm_Rocblas_621286489,0.148503
GemmTunableOp_Half_TN,tn_6144_7432_4096,Gemm_Hipblaslt_TN_159,0.649375
GemmTunableOp_Half_TN,tn_128256_153_4096,Gemm_Hipblaslt_TN_9799,0.482121
GemmTunableOp_Half_TN,tn_4096_3574_14336,Gemm_Hipblaslt_TN_9743,0.698474
GemmTunableOp_Half_TN,tn_57344_2315_8192,Gemm_Hipblaslt_TN_9716,4.46464
GemmTunableOp_Half_TN,tn_4096_104_14336,Gemm_Hipblaslt_TN_7160,0.044737
GemmTunableOp_Half_TN,tn_6144_1627_4096,Gemm_Hipblaslt_TN_9570,0.153059
GemmTunableOp_Half_TN,tn_4096_3589_14336,Gemm_Hipblaslt_TN_9187,0.699227
GemmTunableOp_Half_TN,tn_128256_211_4096,Gemm_Hipblaslt_TN_9919,0.573284
GemmTunableOp_Half_TN,tn_4096_1847_4096,Gemm_Hipblaslt_TN_9645,0.122278
GemmTunableOp_Half_TN,tn_4096_1875_14336,Gemm_Hipblaslt_TN_9620,0.4188
GemmTunableOp_Half_TN,tn_4096_8_4096,Gemm_Rocblas_621294130,0.0100009
GemmTunableOp_Half_TN,tn_10240_2177_8192,Gemm_Rocblas_621286580,0.648991
GemmTunableOp_Half_TN,tn_4096_3622_14336,Gemm_Hipblaslt_TN_9743,0.710699
GemmTunableOp_Half_TN,tn_6144_1769_4096,Gemm_Hipblaslt_TN_9711,0.16328
GemmTunableOp_Half_TN,tn_4096_1928_14336,Gemm_Hipblaslt_TN_9620,0.415185
GemmTunableOp_Half_TN,tn_10240_2284_8192,Gemm_Hipblaslt_TN_9697,0.666148
GemmTunableOp_Half_TN,tn_8192_58_28672,Gemm_Rocblas_621294228,0.145664
GemmTunableOp_Half_TN,tn_128256_16_4096,Gemm_Rocblas_621286325,0.29657
GemmTunableOp_Half_TN,tn_8192_2321_28672,Gemm_Hipblaslt_TN_9771,2.31156
GemmTunableOp_Half_TN,tn_6144_3588_4096,Gemm_Rocblas_621286566,0.322199
GemmTunableOp_Half_TN,tn_57344_2305_8192,Default,4.27503
GemmTunableOp_Half_TN,tn_4096_32_4096,Gemm_Rocblas_621286330,0.0115356
GemmTunableOp_Half_TN,tn_4096_5413_14336,Gemm_Rocblas_621294314,1.16537
GemmTunableOp_Half_TN,tn_6144_3830_4096,Gemm_Rocblas_621286575,0.346161
GemmTunableOp_Half_TN,tn_8192_2413_28672,Gemm_Hipblaslt_TN_9771,2.33564
GemmTunableOp_Half_TN,tn_6144_1590_4096,Gemm_Rocblas_621294305,0.147574
GemmTunableOp_Half_TN,tn_8192_2127_8192,Gemm_Hipblaslt_TN_9742,0.510087
GemmTunableOp_Half_TN,tn_6144_1805_4096,Gemm_Rocblas_621286609,0.166208
GemmTunableOp_Half_TN,tn_57344_2128_8192,Default,3.88423
GemmTunableOp_Half_TN,tn_8192_2145_28672,Gemm_Hipblaslt_TN_9762,2.06939
GemmTunableOp_Half_TN,tn_28672_7325_4096,Gemm_Hipblaslt_TN_159,2.90223
GemmTunableOp_Half_TN,tn_10240_2081_8192,Gemm_Hipblaslt_TN_9690,0.633853
GemmTunableOp_Half_TN,tn_8192_61_28672,Gemm_Rocblas_621286489,0.148119
GemmTunableOp_Half_TN,tn_4096_3420_4096,Gemm_Hipblaslt_TN_9814,0.198242
GemmTunableOp_Half_TN,tn_128256_19_4096,Gemm_Rocblas_621294226,0.310742
GemmTunableOp_Half_TN,tn_28672_1840_4096,Gemm_Hipblaslt_TN_9684,0.805029
GemmTunableOp_Half_TN,tn_4096_5354_4096,Gemm_Rocblas_621294314,0.330875
GemmTunableOp_Half_TN,tn_128256_89_4096,Gemm_Hipblaslt_TN_9058,0.394221
GemmTunableOp_Half_TN,tn_4096_1838_4096,Gemm_Hipblaslt_TN_9645,0.121554
GemmTunableOp_Half_TN,tn_6144_1954_4096,Gemm_Hipblaslt_TN_9536,0.177992
GemmTunableOp_Half_TN,tn_28672_1605_4096,Gemm_Rocblas_621294420,0.723576
GemmTunableOp_Half_TN,tn_10240_2337_8192,Gemm_Rocblas_621286580,0.683289
GemmTunableOp_Half_TN,tn_6144_3553_4096,Gemm_Rocblas_621286566,0.325343
GemmTunableOp_Half_TN,tn_28672_6990_4096,Gemm_Hipblaslt_TN_9812,2.9209
GemmTunableOp_Half_TN,tn_128256_103_4096,Gemm_Rocblas_621294762,0.422353
GemmTunableOp_Half_TN,tn_128256_121_4096,Gemm_Rocblas_621294762,0.435239
GemmTunableOp_Half_TN,tn_128256_129_4096,Gemm_Hipblaslt_TN_9108,0.466098
GemmTunableOp_Half_TN,tn_6144_1875_4096,Gemm_Hipblaslt_TN_9799,0.16967
GemmTunableOp_Half_TN,tn_8192_29_8192,Gemm_Hipblaslt_TN_9410,0.033377
GemmTunableOp_Half_TN,tn_28672_1798_4096,Gemm_Hipblaslt_TN_9683,0.796454
GemmTunableOp_Half_TN,tn_4096_1958_14336,Gemm_Hipblaslt_TN_9620,0.418117
GemmTunableOp_Half_TN,tn_128256_233_4096,Gemm_Rocblas_621286892,0.603817
GemmTunableOp_Half_TN,tn_4096_6881_14336,Gemm_Hipblaslt_TN_9696,1.41799
GemmTunableOp_Half_TN,tn_4096_200_14336,Gemm_Hipblaslt_TN_7378,0.0679465
GemmTunableOp_Half_TN,tn_28672_3666_4096,Gemm_Hipblaslt_TN_9827,1.53959
GemmTunableOp_Half_TN,tn_128256_253_4096,Gemm_Rocblas_621294634,0.611645
GemmTunableOp_Half_TN,tn_4096_3920_4096,Gemm_Rocblas_621294030,0.2231
GemmTunableOp_Half_TN,tn_4096_1894_14336,Gemm_Hipblaslt_TN_9620,0.416579
GemmTunableOp_Half_TN,tn_4096_3416_4096,Gemm_Hipblaslt_TN_9743,0.195335
GemmTunableOp_Half_TN,tn_4096_1973_14336,Gemm_Hipblaslt_TN_9592,0.42741
GemmTunableOp_Half_TN,tn_128256_197_4096,Gemm_Hipblaslt_TN_9937,0.567676
GemmTunableOp_Half_TN,tn_28672_1658_4096,Gemm_Rocblas_621294420,0.734416
GemmTunableOp_Half_TN,tn_128256_199_4096,Gemm_Hipblaslt_TN_9937,0.565906
GemmTunableOp_Half_TN,tn_6144_1924_4096,Gemm_Hipblaslt_TN_9697,0.176741
GemmTunableOp_Half_TN,tn_4096_3588_4096,Gemm_Hipblaslt_TN_9743,0.203387
GemmTunableOp_Half_TN,tn_4096_1887_14336,Gemm_Hipblaslt_TN_9645,0.416546
GemmTunableOp_Half_TN,tn_4096_1953_14336,Gemm_Hipblaslt_TN_9792,0.425886
GemmTunableOp_Half_TN,tn_4096_7047_14336,Gemm_Hipblaslt_TN_9732,1.44777
GemmTunableOp_Half_TN,tn_28672_1767_4096,Gemm_Rocblas_621286742,0.758053
GemmTunableOp_Half_TN,tn_6144_3382_4096,Gemm_Rocblas_621294495,0.314084
GemmTunableOp_Half_TN,tn_4096_7021_4096,Gemm_Hipblaslt_TN_9743,0.406711
GemmTunableOp_Half_TN,tn_128256_145_4096,Gemm_Hipblaslt_TN_9775,0.47432
GemmTunableOp_Half_TN,tn_4096_3559_4096,Gemm_Hipblaslt_TN_9743,0.204113
GemmTunableOp_Half_TN,tn_28672_1648_4096,Gemm_Rocblas_621286742,0.73118
GemmTunableOp_Half_TN,tn_4096_3383_4096,Gemm_Hipblaslt_TN_9743,0.194879
GemmTunableOp_Half_TN,tn_4096_5512_4096,Gemm_Rocblas_621294320,0.336261
GemmTunableOp_Half_TN,tn_6144_1727_4096,Gemm_Hipblaslt_TN_9570,0.158733
GemmTunableOp_Half_TN,tn_4096_5427_4096,Gemm_Hipblaslt_TN_9672,0.331323
GemmTunableOp_Half_TN,tn_28672_3830_4096,Gemm_Hipblaslt_TN_9827,1.60746
GemmTunableOp_Half_TN,tn_10240_30_8192,Gemm_Hipblaslt_TN_9415,0.0403348
GemmTunableOp_Half_TN,tn_4096_1717_14336,Gemm_Hipblaslt_TN_9671,0.368398
GemmTunableOp_Half_TN,tn_6144_1898_4096,Gemm_Rocblas_621294447,0.171663
GemmTunableOp_Half_TN,tn_4096_7301_4096,Gemm_Hipblaslt_TN_9914,0.429588
GemmTunableOp_Half_TN,tn_28672_1637_4096,Gemm_Hipblaslt_TN_9217,0.730433
GemmTunableOp_Half_TN,tn_4096_3494_14336,Gemm_Hipblaslt_TN_9187,0.697275
GemmTunableOp_Half_TN,tn_4096_1673_4096,Gemm_Hipblaslt_TN_9569,0.105384
GemmTunableOp_Half_TN,tn_28672_1680_4096,Gemm_Rocblas_621294484,0.736539
GemmTunableOp_Half_TN,tn_6144_7186_4096,Gemm_Hipblaslt_TN_9192,0.620607
GemmTunableOp_Half_TN,tn_128256_64_4096,Gemm_Rocblas_621286813,0.357636
GemmTunableOp_Half_TN,tn_4096_6996_14336,Gemm_Hipblaslt_TN_9732,1.44261
GemmTunableOp_Half_TN,tn_4096_5352_4096,Gemm_Rocblas_621294320,0.327474
GemmTunableOp_Half_TN,tn_4096_1623_4096,Gemm_Hipblaslt_TN_9679,0.10591
GemmTunableOp_Half_TN,tn_4096_7225_4096,Gemm_Hipblaslt_TN_9743,0.420383
GemmTunableOp_Half_TN,tn_6144_7170_4096,Gemm_Hipblaslt_TN_9743,0.618516
GemmTunableOp_Half_TN,tn_28672_6715_4096,Gemm_Hipblaslt_TN_9944,2.72619
GemmTunableOp_Half_TN,tn_4096_3557_14336,Gemm_Hipblaslt_TN_9841,0.693261
GemmTunableOp_Half_TN,tn_6144_1829_4096,Gemm_Rocblas_621286683,0.165149
GemmTunableOp_Half_TN,tn_4096_6868_4096,Gemm_Rocblas_621294476,0.398398
GemmTunableOp_Half_TN,tn_4096_7301_14336,Gemm_Hipblaslt_TN_9593,1.55343
GemmTunableOp_Half_TN,tn_4096_3515_14336,Gemm_Hipblaslt_TN_9743,0.68951
GemmTunableOp_Half_TN,tn_6144_7027_4096,Gemm_Hipblaslt_TN_9743,0.6061
GemmTunableOp_Half_TN,tn_4096_192_4096,Gemm_Rocblas_621286491,0.0230352
GemmTunableOp_Half_TN,tn_4096_1855_14336,Gemm_Hipblaslt_TN_9645,0.415565
GemmTunableOp_Half_TN,tn_128256_178_4096,Gemm_Hipblaslt_TN_9818,0.515927
GemmTunableOp_Half_TN,tn_4096_6841_14336,Gemm_Hipblaslt_TN_9732,1.42636
GemmTunableOp_Half_TN,tn_28672_1846_4096,Gemm_Hipblaslt_TN_9683,0.801938
GemmTunableOp_Half_TN,tn_28672_1873_4096,Gemm_Hipblaslt_TN_9683,0.806935
GemmTunableOp_Half_TN,tn_6144_256_4096,Gemm_Hipblaslt_TN_9545,0.0361399
GemmTunableOp_Half_TN,tn_4096_1879_14336,Gemm_Hipblaslt_TN_9620,0.416425
GemmTunableOp_Half_TN,tn_6144_6744_4096,Gemm_Hipblaslt_TN_9677,0.59389
GemmTunableOp_Half_TN,tn_4096_1822_14336,Gemm_Hipblaslt_TN_9645,0.411037
GemmTunableOp_Half_TN,tn_6144_1961_4096,Gemm_Hipblaslt_TN_9697,0.178032
GemmTunableOp_Half_TN,tn_4096_6789_14336,Gemm_Hipblaslt_TN_9696,1.40967
GemmTunableOp_Half_TN,tn_28672_3508_4096,Gemm_Hipblaslt_TN_9827,1.41
GemmTunableOp_Half_TN,tn_4096_3583_4096,Gemm_Hipblaslt_TN_9743,0.202219
GemmTunableOp_Half_TN,tn_4096_5136_14336,Gemm_Hipblaslt_TN_9709,1.09598
GemmTunableOp_Half_TN,tn_128256_235_4096,Gemm_Rocblas_621294634,0.606671
GemmTunableOp_Half_TN,tn_4096_7171_14336,Gemm_Hipblaslt_TN_9732,1.47879
GemmTunableOp_Half_TN,tn_6144_1686_4096,Gemm_Rocblas_621294306,0.155902
GemmTunableOp_Half_TN,tn_6144_6901_4096,Gemm_Hipblaslt_TN_9677,0.596285
GemmTunableOp_Half_TN,tn_4096_168_14336,Gemm_Hipblaslt_TN_7586,0.0603171
GemmTunableOp_Half_TN,tn_128256_78_4096,Gemm_Hipblaslt_TN_9058,0.388692
GemmTunableOp_Half_TN,tn_6144_6997_4096,Gemm_Hipblaslt_TN_9677,0.608537
GemmTunableOp_Half_TN,tn_4096_7248_4096,Gemm_Hipblaslt_TN_9743,0.417748
GemmTunableOp_Half_TN,tn_6144_72_4096,Gemm_Rocblas_621286280,0.0181935
GemmTunableOp_Half_TN,tn_6144_7364_4096,Gemm_Rocblas_621294484,0.639865
GemmTunableOp_Half_TN,tn_28672_1647_4096,Gemm_Rocblas_621294484,0.731623
GemmTunableOp_Half_TN,tn_4096_7136_14336,Gemm_Hipblaslt_TN_9743,1.47173
GemmTunableOp_Half_TN,tn_4096_6870_14336,Gemm_Hipblaslt_TN_9732,1.4283
GemmTunableOp_Half_TN,tn_6144_1896_4096,Gemm_Rocblas_621294447,0.169561
GemmTunableOp_Half_TN,tn_28672_1702_4096,Gemm_Rocblas_621286742,0.742665
GemmTunableOp_Half_TN,tn_4096_3507_14336,Gemm_Hipblaslt_TN_9743,0.691678
GemmTunableOp_Half_TN,tn_128256_256_4096,Gemm_Rocblas_621294648,0.605931
GemmTunableOp_Half_TN,tn_4096_7109_14336,Gemm_Hipblaslt_TN_9732,1.47327
GemmTunableOp_Half_TN,tn_4096_6901_14336,Gemm_Hipblaslt_TN_9732,1.43048
GemmTunableOp_Half_TN,tn_4096_7072_4096,Gemm_Hipblaslt_TN_9743,0.408821
GemmTunableOp_Half_TN,tn_4096_1854_4096,Gemm_Hipblaslt_TN_9645,0.120499
GemmTunableOp_Half_TN,tn_4096_3612_4096,Gemm_Hipblaslt_TN_9743,0.20612
GemmTunableOp_Half_TN,tn_28672_7301_4096,Gemm_Hipblaslt_TN_159,2.94174
GemmTunableOp_Half_TN,tn_28672_7170_4096,Gemm_Hipblaslt_TN_159,2.89311
GemmTunableOp_Half_TN,tn_6144_3373_4096,Gemm_Hipblaslt_TN_9774,0.313909
GemmTunableOp_Half_TN,tn_57344_2207_8192,Gemm_Rocblas_621294542,4.00115
GemmTunableOp_Half_TN,tn_4096_3497_4096,Gemm_Hipblaslt_TN_9743,0.200572
GemmTunableOp_Half_TN,tn_57344_57_8192,Gemm_Rocblas_621286468,0.310486
GemmTunableOp_Half_TN,tn_6144_6708_4096,Gemm_Hipblaslt_TN_9743,0.58596
GemmTunableOp_Half_TN,tn_4096_1666_14336,Gemm_Hipblaslt_TN_9671,0.365162
GemmTunableOp_Half_TN,tn_6144_1811_4096,Gemm_Hipblaslt_TN_9799,0.164143
GemmTunableOp_Half_TN,tn_4096_96_14336,Gemm_Hipblaslt_TN_7511,0.0401159
GemmTunableOp_Half_TN,tn_4096_7136_4096,Gemm_Hipblaslt_TN_9743,0.413104
GemmTunableOp_Half_TN,tn_4096_6773_14336,Gemm_Hipblaslt_TN_9696,1.41375
GemmTunableOp_Half_TN,tn_4096_3427_14336,Gemm_Hipblaslt_TN_9192,0.668379
GemmTunableOp_Half_TN,tn_6144_7344_4096,Gemm_Hipblaslt_TN_159,0.638644
GemmTunableOp_Half_TN,tn_28672_7253_4096,Gemm_Hipblaslt_TN_159,2.93995
GemmTunableOp_Half_TN,tn_28672_6841_4096,Gemm_Hipblaslt_TN_9899,2.85618
GemmTunableOp_Half_TN,tn_6144_7325_4096,Gemm_Hipblaslt_TN_9959,0.638668
GemmTunableOp_Half_TN,tn_6144_3581_4096,Gemm_Rocblas_621286566,0.319678
GemmTunableOp_Half_TN,tn_6144_112_4096,Gemm_Hipblaslt_TN_9470,0.0237675
GemmTunableOp_Half_TN,tn_4096_3455_14336,Gemm_Hipblaslt_TN_9743,0.675379
GemmTunableOp_Half_TN,tn_4096_1757_4096,Gemm_Hipblaslt_TN_9134,0.117462
GemmTunableOp_Half_TN,tn_6144_6902_4096,Gemm_Hipblaslt_TN_9743,0.595297
GemmTunableOp_Half_TN,tn_4096_3547_4096,Gemm_Hipblaslt_TN_9743,0.206463
GemmTunableOp_Half_TN,tn_4096_24_14336,Gemm_Hipblaslt_TN_9392,0.0270093
GemmTunableOp_Half_TN,tn_28672_80_4096,Gemm_Rocblas_621294461,0.0574854
GemmTunableOp_Half_TN,tn_6144_1614_4096,Gemm_Hipblaslt_TN_9570,0.15381
GemmTunableOp_Half_TN,tn_4096_1883_14336,Gemm_Hipblaslt_TN_9645,0.413759
GemmTunableOp_Half_TN,tn_28672_7345_4096,Gemm_Hipblaslt_TN_159,2.92672
GemmTunableOp_Half_TN,tn_4096_6997_4096,Gemm_Hipblaslt_TN_9955,0.408329
GemmTunableOp_Half_TN,tn_4096_1620_4096,Gemm_Hipblaslt_TN_9359,0.104305
GemmTunableOp_Half_TN,tn_4096_7267_4096,Gemm_Hipblaslt_TN_9814,0.421359
GemmTunableOp_Half_TN,tn_128256_85_4096,Gemm_Hipblaslt_TN_9057,0.390444
GemmTunableOp_Half_TN,tn_28672_7403_4096,Gemm_Hipblaslt_TN_159,2.94127
GemmTunableOp_Half_TN,tn_4096_5052_4096,Gemm_Hipblaslt_TN_9691,0.315775
GemmTunableOp_Half_TN,tn_4096_240_14336,Gemm_Hipblaslt_TN_9303,0.0769119
GemmTunableOp_Half_TN,tn_128256_114_4096,Gemm_Hipblaslt_TN_9596,0.43201
GemmTunableOp_Half_TN,tn_28672_1838_4096,Gemm_Hipblaslt_TN_9684,0.802721
GemmTunableOp_Half_TN,tn_6144_5157_4096,Gemm_Rocblas_621294420,0.448251
GemmTunableOp_Half_TN,tn_28672_224_4096,Gemm_Hipblaslt_TN_9267,0.112302
GemmTunableOp_Half_TN,tn_8192_2337_28672,Gemm_Hipblaslt_TN_9771,2.2987
GemmTunableOp_Half_TN,tn_6144_1867_4096,Gemm_Rocblas_621294425,0.167354
GemmTunableOp_Half_TN,tn_8192_30_8192,Gemm_Hipblaslt_TN_9410,0.0338625
GemmTunableOp_Half_TN,tn_4096_1573_4096,Gemm_Hipblaslt_TN_9679,0.104808
GemmTunableOp_Half_TN,tn_28672_1765_4096,Gemm_Rocblas_621286742,0.756815
GemmTunableOp_Half_TN,tn_28672_6721_4096,Gemm_Hipblaslt_TN_9944,2.82348
GemmTunableOp_Half_TN,tn_28672_7552_4096,Gemm_Hipblaslt_TN_159,2.98159
GemmTunableOp_Half_TN,tn_28672_5410_4096,Gemm_Hipblaslt_TN_9852,2.33205
GemmTunableOp_Half_TN,tn_4096_32_14336,Gemm_Hipblaslt_TN_9392,0.0272358
GemmTunableOp_Half_TN,tn_6144_1946_4096,Gemm_Hipblaslt_TN_9536,0.177373
GemmTunableOp_Half_TN,tn_28672_136_4096,Gemm_Hipblaslt_TN_7216,0.0857633
GemmTunableOp_Half_TN,tn_4096_1960_4096,Gemm_Hipblaslt_TN_9645,0.124683
GemmTunableOp_Half_TN,tn_4096_1888_14336,Gemm_Hipblaslt_TN_9645,0.418073
GemmTunableOp_Half_TN,tn_4096_1842_4096,Gemm_Hipblaslt_TN_9645,0.11936
GemmTunableOp_Half_TN,tn_4096_6920_14336,Gemm_Hipblaslt_TN_9696,1.43699
GemmTunableOp_Half_TN,tn_28672_3701_4096,Gemm_Hipblaslt_TN_9827,1.54958
GemmTunableOp_Half_TN,tn_28672_1820_4096,Gemm_Hipblaslt_TN_9683,0.798536
GemmTunableOp_Half_TN,tn_4096_224_14336,Gemm_Hipblaslt_TN_9363,0.0719541
GemmTunableOp_Half_TN,tn_10240_65_8192,Gemm_Hipblaslt_TN_8095,0.0489448
GemmTunableOp_Half_TN,tn_6144_6916_4096,Gemm_Hipblaslt_TN_9743,0.605602
GemmTunableOp_Half_TN,tn_128256_44_4096,Gemm_Hipblaslt_TN_9451,0.333859
GemmTunableOp_Half_TN,tn_128256_31_4096,Gemm_Hipblaslt_TN_9094,0.317194
GemmTunableOp_Half_TN,tn_4096_1771_14336,Gemm_Hipblaslt_TN_9645,0.397275
GemmTunableOp_Half_TN,tn_128256_205_4096,Gemm_Hipblaslt_TN_9937,0.571912
GemmTunableOp_Half_TN,tn_28672_128_4096,Gemm_Rocblas_621294215,0.0717117
GemmTunableOp_Half_TN,tn_4096_5470_14336,Gemm_Hipblaslt_TN_9672,1.17025
GemmTunableOp_Half_TN,tn_28672_160_4096,Gemm_Hipblaslt_TN_9561,0.0859278
GemmTunableOp_Half_TN,tn_6144_6989_4096,Gemm_Hipblaslt_TN_9192,0.609901
GemmTunableOp_Half_TN,tn_4096_1781_4096,Gemm_Hipblaslt_TN_9134,0.116743
GemmTunableOp_Half_TN,tn_28672_1961_4096,Gemm_Hipblaslt_TN_9846,0.856882
GemmTunableOp_Half_TN,tn_4096_3652_14336,Gemm_Hipblaslt_TN_9841,0.724596
GemmTunableOp_Half_TN,tn_6144_1828_4096,Gemm_Rocblas_621294425,0.165492
GemmTunableOp_Half_TN,tn_6144_1652_4096,Gemm_Rocblas_621294495,0.154173
GemmTunableOp_Half_TN,tn_6144_3688_4096,Gemm_Hipblaslt_TN_9689,0.336407
GemmTunableOp_Half_TN,tn_4096_1781_14336,Gemm_Hipblaslt_TN_9645,0.394923
GemmTunableOp_Half_TN,tn_4096_1762_4096,Gemm_Hipblaslt_TN_9645,0.116799
GemmTunableOp_Half_TN,tn_6144_1713_4096,Gemm_Rocblas_621286753,0.15822
GemmTunableOp_Half_TN,tn_4096_1831_14336,Gemm_Hipblaslt_TN_9620,0.410149
GemmTunableOp_Half_TN,tn_6144_6971_4096,Gemm_Hipblaslt_TN_9677,0.606665
GemmTunableOp_Half_TN,tn_4096_6916_14336,Gemm_Hipblaslt_TN_9743,1.43784
GemmTunableOp_Half_TN,tn_4096_3602_14336,Gemm_Hipblaslt_TN_9743,0.702767
GemmTunableOp_Half_TN,tn_4096_5680_14336,Gemm_Hipblaslt_TN_9689,1.2062
GemmTunableOp_Half_TN,tn_4096_3565_4096,Gemm_Hipblaslt_TN_9743,0.202542
GemmTunableOp_Half_TN,tn_4096_5285_4096,Gemm_Rocblas_621286580,0.32725
GemmTunableOp_Half_TN,tn_8192_57_28672,Default,0.147063
GemmTunableOp_Half_TN,tn_28672_1646_4096,Gemm_Rocblas_621294484,0.727933
GemmTunableOp_Half_TN,tn_10240_2208_8192,Gemm_Rocblas_621294320,0.649759
GemmTunableOp_Half_TN,tn_6144_1781_4096,Gemm_Rocblas_621294426,0.164559
GemmTunableOp_Half_TN,tn_4096_5274_14336,Gemm_Hipblaslt_TN_9924,1.11524
GemmTunableOp_Half_TN,tn_128256_188_4096,Gemm_Hipblaslt_TN_9661,0.520048
GemmTunableOp_Half_TN,tn_6144_7130_4096,Gemm_Hipblaslt_TN_9697,0.614101
GemmTunableOp_Half_TN,tn_4096_1592_14336,Gemm_Hipblaslt_TN_9671,0.360786
GemmTunableOp_Half_TN,tn_6144_192_4096,Gemm_Rocblas_621294171,0.028791
GemmTunableOp_Half_TN,tn_4096_1936_14336,Gemm_Hipblaslt_TN_9620,0.41943
GemmTunableOp_Half_TN,tn_4096_3214_14336,Gemm_Hipblaslt_TN_9187,0.641859
GemmTunableOp_Half_TN,tn_4096_7130_14336,Gemm_Hipblaslt_TN_9732,1.47309
GemmTunableOp_Half_TN,tn_6144_40_4096,Gemm_Rocblas_621286428,0.0151921
GemmTunableOp_Half_TN,tn_128256_80_4096,Gemm_Hipblaslt_TN_9057,0.384109
GemmTunableOp_Half_TN,tn_4096_3602_4096,Gemm_Hipblaslt_TN_9743,0.205549
GemmTunableOp_Half_TN,tn_6144_1622_4096,Gemm_Rocblas_621294495,0.153844
GemmTunableOp_Half_TN,tn_4096_7552_14336,Gemm_Hipblaslt_TN_9713,1.59022
GemmTunableOp_Half_TN,tn_128256_90_4096,Gemm_Hipblaslt_TN_9057,0.397743
GemmTunableOp_Half_TN,tn_6144_5319_4096,Gemm_Rocblas_621286678,0.455932
GemmTunableOp_Half_TN,tn_28672_1813_4096,Gemm_Hipblaslt_TN_9683,0.801073
GemmTunableOp_Half_TN,tn_4096_1854_14336,Gemm_Hipblaslt_TN_9620,0.414197
GemmTunableOp_Half_TN,tn_4096_1790_4096,Gemm_Hipblaslt_TN_9645,0.11822
GemmTunableOp_Half_TN,tn_4096_1963_14336,Gemm_Hipblaslt_TN_9592,0.425229
GemmTunableOp_Half_TN,tn_4096_5541_14336,Gemm_Hipblaslt_TN_9709,1.18238
GemmTunableOp_Half_TN,tn_57344_2465_8192,Gemm_Rocblas_621286535,4.46989
GemmTunableOp_Half_TN,tn_28672_7190_4096,Gemm_Hipblaslt_TN_159,2.93383
GemmTunableOp_Half_TN,tn_4096_1908_4096,Gemm_Hipblaslt_TN_9645,0.123115
GemmTunableOp_Half_TN,tn_28672_3468_4096,Gemm_Hipblaslt_TN_9827,1.40334
GemmTunableOp_Half_TN,tn_4096_5267_4096,Gemm_Hipblaslt_TN_9691,0.325845
GemmTunableOp_Half_TN,tn_4096_1685_4096,Gemm_Hipblaslt_TN_9671,0.105214
GemmTunableOp_Half_TN,tn_28672_7120_4096,Gemm_Hipblaslt_TN_9934,2.93455
GemmTunableOp_Half_TN,tn_128256_251_4096,Gemm_Rocblas_621294634,0.608679
GemmTunableOp_Half_TN,tn_28672_3369_4096,Gemm_Hipblaslt_TN_9827,1.38446
GemmTunableOp_Half_TN,tn_4096_7023_4096,Gemm_Hipblaslt_TN_9814,0.410817
GemmTunableOp_Half_TN,tn_8192_4048_8192,Gemm_Rocblas_621294435,0.903815
GemmTunableOp_Half_TN,tn_4096_7568_4096,Gemm_Hipblaslt_TN_159,0.437235
GemmTunableOp_Half_TN,tn_6144_3768_4096,Gemm_Hipblaslt_TN_9689,0.341405
GemmTunableOp_Half_TN,tn_6144_1588_4096,Gemm_Rocblas_621286565,0.146941
GemmTunableOp_Half_TN,tn_28672_184_4096,Gemm_Hipblaslt_TN_7286,0.0974051
GemmTunableOp_Half_TN,tn_6144_6715_4096,Gemm_Hipblaslt_TN_9697,0.587361
GemmTunableOp_Half_TN,tn_4096_6871_14336,Gemm_Hipblaslt_TN_9696,1.42147
GemmTunableOp_Half_TN,tn_28672_3514_4096,Gemm_Hipblaslt_TN_9827,1.41578
GemmTunableOp_Half_TN,tn_28672_1748_4096,Gemm_Rocblas_621294484,0.751546
GemmTunableOp_Half_TN,tn_4096_120_14336,Gemm_Hipblaslt_TN_7160,0.0495483
GemmTunableOp_Half_TN,tn_28672_1787_4096,Gemm_Hipblaslt_TN_9713,0.760565
GemmTunableOp_Half_TN,tn_6144_1737_4096,Gemm_Rocblas_621294426,0.159518
GemmTunableOp_Half_TN,tn_4096_7118_4096,Gemm_Hipblaslt_TN_9955,0.415012
GemmTunableOp_Half_TN,tn_28672_3722_4096,Gemm_Hipblaslt_TN_9827,1.5405
GemmTunableOp_Half_TN,tn_6144_1887_4096,Gemm_Rocblas_621286683,0.168897
GemmTunableOp_Half_TN,tn_4096_5271_14336,Gemm_Hipblaslt_TN_9924,1.10924
GemmTunableOp_Half_TN,tn_4096_7253_14336,Gemm_Hipblaslt_TN_9743,1.47293
GemmTunableOp_Half_TN,tn_4096_3640_14336,Gemm_Hipblaslt_TN_9814,0.70526
GemmTunableOp_Half_TN,tn_28672_7262_4096,Gemm_Hipblaslt_TN_159,2.94522
GemmTunableOp_Half_TN,tn_28672_5274_4096,Gemm_Hipblaslt_TN_9860,2.20616
GemmTunableOp_Half_TN,tn_4096_7475_4096,Gemm_Hipblaslt_TN_9904,0.439838
GemmTunableOp_Half_TN,tn_6144_3468_4096,Gemm_Hipblaslt_TN_9570,0.321779
GemmTunableOp_Half_TN,tn_4096_5465_4096,Gemm_Rocblas_621294320,0.335383
GemmTunableOp_Half_TN,tn_4096_7191_4096,Gemm_Hipblaslt_TN_9814,0.418192
GemmTunableOp_Half_TN,tn_28672_1710_4096,Gemm_Rocblas_621294484,0.741802
GemmTunableOp_Half_TN,tn_28672_1863_4096,Gemm_Hipblaslt_TN_9683,0.809008
GemmTunableOp_Half_TN,tn_28672_3652_4096,Gemm_Hipblaslt_TN_9827,1.53896
GemmTunableOp_Half_TN,tn_28672_5319_4096,Gemm_Hipblaslt_TN_9915,2.20269
GemmTunableOp_Half_TN,tn_4096_1733_4096,Gemm_Hipblaslt_TN_9134,0.117705
GemmTunableOp_Half_TN,tn_4096_1586_4096,Gemm_Hipblaslt_TN_9265,0.105786
GemmTunableOp_Half_TN,tn_4096_5301_4096,Gemm_Rocblas_621294320,0.328589
GemmTunableOp_Half_TN,tn_28672_1599_4096,Gemm_Hipblaslt_TN_9674,0.710633
GemmTunableOp_Half_TN,tn_6144_1894_4096,Gemm_Rocblas_621286683,0.166575
GemmTunableOp_Half_TN,tn_28672_1743_4096,Gemm_Hipblaslt_TN_9730,0.746455
GemmTunableOp_Half_TN,tn_128256_25_4096,Gemm_Hipblaslt_TN_9094,0.316939
GemmTunableOp_Half_TN,tn_28672_3592_4096,Gemm_Hipblaslt_TN_9832,1.49959
GemmTunableOp_Half_TN,tn_4096_1794_4096,Gemm_Hipblaslt_TN_9645,0.119841
GemmTunableOp_Half_TN,tn_4096_5030_4096,Gemm_Hipblaslt_TN_9924,0.319137
GemmTunableOp_Half_TN,tn_4096_3586_14336,Gemm_Hipblaslt_TN_9192,0.701043
GemmTunableOp_Half_TN,tn_4096_1790_14336,Gemm_Hipblaslt_TN_9645,0.398871
GemmTunableOp_Half_TN,tn_4096_3586_4096,Gemm_Hipblaslt_TN_9743,0.207877
GemmTunableOp_Half_TN,tn_4096_1784_4096,Gemm_Hipblaslt_TN_9134,0.117385
GemmTunableOp_Half_TN,tn_28672_1784_4096,Gemm_Hipblaslt_TN_9184,0.764714
GemmTunableOp_Half_TN,tn_6144_3535_4096,Gemm_Rocblas_621294306,0.320777
GemmTunableOp_Half_TN,tn_57344_2370_8192,Default,4.28524
GemmTunableOp_Half_TN,tn_4096_5157_14336,Gemm_Hipblaslt_TN_9709,1.10305
GemmTunableOp_Half_TN,tn_28672_7109_4096,Gemm_Hipblaslt_TN_9893,2.94708
GemmTunableOp_Half_TN,tn_4096_1881_14336,Gemm_Hipblaslt_TN_9620,0.415477
GemmTunableOp_Half_TN,tn_8192_2415_28672,Gemm_Hipblaslt_TN_9670,2.36557
GemmTunableOp_Half_TN,tn_6144_3478_4096,Gemm_Hipblaslt_TN_9570,0.321595
GemmTunableOp_Half_TN,tn_4096_5530_14336,Gemm_Hipblaslt_TN_9799,1.18729
GemmTunableOp_Half_TN,tn_28672_1642_4096,Gemm_Rocblas_621286590,0.729948
GemmTunableOp_Half_TN,tn_4096_1725_4096,Gemm_Hipblaslt_TN_9265,0.108965
GemmTunableOp_Half_TN,tn_6144_1790_4096,Gemm_Hipblaslt_TN_9711,0.164527
GemmTunableOp_Half_TN,tn_6144_1822_4096,Gemm_Rocblas_621286684,0.165789
GemmTunableOp_Half_TN,tn_4096_3722_4096,Gemm_Hipblaslt_TN_9768,0.217537
GemmTunableOp_Half_TN,tn_4096_3526_4096,Gemm_Hipblaslt_TN_9743,0.202673
GemmTunableOp_Half_TN,tn_28672_1871_4096,Gemm_Hipblaslt_TN_9683,0.815534
GemmTunableOp_Half_TN,tn_28672_5068_4096,Gemm_Hipblaslt_TN_9865,2.14285
GemmTunableOp_Half_TN,tn_28672_1685_4096,Gemm_Rocblas_621294484,0.734923
GemmTunableOp_Half_TN,tn_4096_5412_14336,Gemm_Hipblaslt_TN_9924,1.15596
GemmTunableOp_Half_TN,tn_6144_1764_4096,Gemm_Hipblaslt_TN_9799,0.161923
GemmTunableOp_Half_TN,tn_4096_1642_4096,Gemm_Hipblaslt_TN_9607,0.107495
GemmTunableOp_Half_TN,tn_4096_1945_4096,Gemm_Hipblaslt_TN_9680,0.126356
GemmTunableOp_Half_TN,tn_4096_6843_4096,Gemm_Hipblaslt_TN_9743,0.398015
GemmTunableOp_Half_TN,tn_4096_7386_14336,Gemm_Hipblaslt_TN_9593,1.55404
GemmTunableOp_Half_TN,tn_4096_1590_14336,Gemm_Hipblaslt_TN_9671,0.358739
GemmTunableOp_Half_TN,tn_4096_1811_4096,Gemm_Hipblaslt_TN_9645,0.118984
GemmTunableOp_Half_TN,tn_8192_2096_28672,Gemm_Hipblaslt_TN_9762,2.05955
GemmTunableOp_Half_TN,tn_4096_3511_4096,Gemm_Hipblaslt_TN_9743,0.203503
GemmTunableOp_Half_TN,tn_6144_8_4096,Gemm_Rocblas_621286311,0.0128564
GemmTunableOp_Half_TN,tn_28672_7050_4096,Gemm_Hipblaslt_TN_9934,2.9225
GemmTunableOp_Half_TN,tn_4096_7730_4096,Gemm_Hipblaslt_TN_9888,0.448458
GemmTunableOp_Half_TN,tn_4096_6630_4096,Gemm_Hipblaslt_TN_9955,0.395291
GemmTunableOp_Half_TN,tn_4096_3438_14336,Gemm_Hipblaslt_TN_9743,0.670097
GemmTunableOp_Half_TN,tn_128256_117_4096,Gemm_Rocblas_621294762,0.433231
GemmTunableOp_Half_TN,tn_28672_1689_4096,Gemm_Rocblas_621286742,0.740869
GemmStridedBatchedTunableOp_Half_TN,tn_1809_1809_128_B_32,Gemm_Rocblas_621294109,0.14236
GemmStridedBatchedTunableOp_Half_TN,tn_1666_1666_128_B_32,Gemm_Hipblaslt_TN_6942,0.118761
GemmStridedBatchedTunableOp_Half_TN,tn_1686_1686_128_B_32,Gemm_Hipblaslt_TN_6942,0.121741
GemmStridedBatchedTunableOp_Half_TN,tn_1776_1776_128_B_32,Gemm_Rocblas_621286397,0.122569
GemmStridedBatchedTunableOp_Half_TN,tn_1652_1652_128_B_32,Gemm_Rocblas_621286397,0.118156
GemmStridedBatchedTunableOp_Half_TN,tn_1942_1942_128_B_32,Gemm_Rocblas_621294533,0.156391
GemmStridedBatchedTunableOp_Half_TN,tn_1657_1657_128_B_32,Gemm_Hipblaslt_TN_6942,0.119786
GemmStridedBatchedTunableOp_Half_TN,tn_1589_1589_128_B_32,Gemm_Hipblaslt_TN_6939,0.113021
GemmStridedBatchedTunableOp_Half_TN,tn_1703_1703_128_B_32,Gemm_Rocblas_621294108,0.124922
GemmStridedBatchedTunableOp_Half_TN,tn_1949_1949_128_B_32,Gemm_Rocblas_621294533,0.158421
GemmStridedBatchedTunableOp_Half_TN,tn_1958_1958_128_B_32,Gemm_Rocblas_621294533,0.159987
GemmStridedBatchedTunableOp_Half_TN,tn_1791_1791_128_B_32,Gemm_Rocblas_621286411,0.131961
GemmStridedBatchedTunableOp_Half_TN,tn_1880_1880_128_B_32,Gemm_Hipblaslt_TN_157,0.135402
GemmStridedBatchedTunableOp_Half_TN,tn_1759_1759_128_B_32,Gemm_Rocblas_621286411,0.127798
GemmStridedBatchedTunableOp_Half_TN,tn_1872_1872_128_B_32,Gemm_Hipblaslt_TN_157,0.133466
GemmStridedBatchedTunableOp_Half_TN,tn_1859_1859_128_B_32,Gemm_Hipblaslt_TN_6942,0.145629
GemmStridedBatchedTunableOp_Half_TN,tn_1978_1978_128_B_32,Gemm_Hipblaslt_TN_6950,0.164318
GemmStridedBatchedTunableOp_Half_TN,tn_1612_1612_128_B_32,Gemm_Hipblaslt_TN_6942,0.11422
GemmStridedBatchedTunableOp_Half_TN,tn_1825_1825_128_B_32,Gemm_Hipblaslt_TN_6871,0.144523
GemmStridedBatchedTunableOp_Half_TN,tn_1737_1737_128_B_32,Gemm_Rocblas_621286397,0.12676
GemmStridedBatchedTunableOp_Half_TN,tn_1926_1926_128_B_32,Gemm_Hipblaslt_TN_6879,0.154687
GemmStridedBatchedTunableOp_Half_TN,tn_1874_1874_128_B_32,Gemm_Hipblaslt_TN_6942,0.144583
GemmStridedBatchedTunableOp_Half_TN,tn_1740_1740_128_B_32,Gemm_Rocblas_621286411,0.126249
GemmStridedBatchedTunableOp_Half_TN,tn_1661_1661_128_B_32,Gemm_Rocblas_621286397,0.119122
GemmStridedBatchedTunableOp_Half_TN,tn_1614_1614_128_B_32,Gemm_Rocblas_621286397,0.115374
GemmStridedBatchedTunableOp_Half_TN,tn_1755_1755_128_B_32,Gemm_Rocblas_621286397,0.13116
GemmStridedBatchedTunableOp_Half_TN,tn_1854_1854_128_B_32,Gemm_Hipblaslt_TN_6942,0.14505
GemmStridedBatchedTunableOp_Half_TN,tn_1789_1789_128_B_32,Gemm_Hipblaslt_TN_6879,0.134345
GemmStridedBatchedTunableOp_Half_TN,tn_1766_1766_128_B_32,Gemm_Rocblas_621286397,0.129549
GemmStridedBatchedTunableOp_Half_TN,tn_1900_1900_128_B_32,Gemm_Hipblaslt_TN_6950,0.148275
GemmStridedBatchedTunableOp_Half_TN,tn_1650_1650_128_B_32,Gemm_Hipblaslt_TN_6942,0.117873
GemmStridedBatchedTunableOp_Half_TN,tn_1710_1710_128_B_32,Gemm_Hipblaslt_TN_6942,0.123091
GemmStridedBatchedTunableOp_Half_TN,tn_1851_1851_128_B_32,Gemm_Rocblas_621294533,0.143798
GemmStridedBatchedTunableOp_Half_TN,tn_1909_1909_128_B_32,Gemm_Hipblaslt_TN_6950,0.151493
GemmStridedBatchedTunableOp_Half_TN,tn_1830_1830_128_B_32,Gemm_Rocblas_621294533,0.139004
GemmStridedBatchedTunableOp_Half_TN,tn_1935_1935_128_B_32,Gemm_Rocblas_621294533,0.156976
GemmStridedBatchedTunableOp_Half_TN,tn_1907_1907_128_B_32,Gemm_Hipblaslt_TN_6942,0.145507
GemmStridedBatchedTunableOp_Half_TN,tn_1719_1719_128_B_32,Gemm_Hipblaslt_TN_6942,0.124239
GemmStridedBatchedTunableOp_Half_TN,tn_1675_1675_128_B_32,Gemm_Hipblaslt_TN_6942,0.121802
GemmStridedBatchedTunableOp_Half_TN,tn_1673_1673_128_B_32,Gemm_Rocblas_621286397,0.121775
GemmStridedBatchedTunableOp_Half_TN,tn_2289_2289_128_B_64,Gemm_Rocblas_621294535,0.432284
GemmStridedBatchedTunableOp_Half_TN,tn_1932_1932_128_B_32,Gemm_Hipblaslt_TN_6879,0.154634
GemmStridedBatchedTunableOp_Half_TN,tn_1857_1857_128_B_32,Gemm_Hipblaslt_TN_6950,0.147941
GemmStridedBatchedTunableOp_Half_TN,tn_1956_1956_128_B_32,Gemm_Rocblas_621294533,0.157712
GemmStridedBatchedTunableOp_Half_TN,tn_1822_1822_128_B_32,Gemm_Rocblas_621286397,0.141412
GemmStridedBatchedTunableOp_Half_TN,tn_1869_1869_128_B_32,Gemm_Hipblaslt_TN_6942,0.148911
GemmStridedBatchedTunableOp_Half_TN,tn_1782_1782_128_B_32,Gemm_Hipblaslt_TN_6879,0.134194
GemmStridedBatchedTunableOp_Half_TN,tn_2366_2366_128_B_64,Gemm_Hipblaslt_TN_158,0.461341
GemmStridedBatchedTunableOp_Half_TN,tn_1892_1892_128_B_32,Gemm_Hipblaslt_TN_6942,0.147702
GemmStridedBatchedTunableOp_Half_TN,tn_1837_1837_128_B_32,Gemm_Hipblaslt_TN_6942,0.143409
GemmStridedBatchedTunableOp_Half_TN,tn_1917_1917_128_B_32,Gemm_Hipblaslt_TN_6950,0.152495
GemmStridedBatchedTunableOp_Half_TN,tn_1836_1836_128_B_32,Gemm_Hipblaslt_TN_6942,0.143005
GemmStridedBatchedTunableOp_Half_TN,tn_2145_2145_128_B_64,Gemm_Rocblas_621294106,0.387426
GemmStridedBatchedTunableOp_Half_TN,tn_1806_1806_128_B_32,Gemm_Hipblaslt_TN_6942,0.137164
GemmStridedBatchedTunableOp_Half_TN,tn_1627_1627_128_B_32,Gemm_Hipblaslt_TN_6942,0.115802
GemmStridedBatchedTunableOp_Half_TN,tn_1636_1636_128_B_32,Gemm_Rocblas_621286397,0.116124
GemmStridedBatchedTunableOp_Half_TN,tn_2160_2160_128_B_64,Gemm_Hipblaslt_TN_158,0.330204
GemmStridedBatchedTunableOp_Half_TN,tn_1821_1821_128_B_32,Gemm_Hipblaslt_TN_6942,0.14312
GemmStridedBatchedTunableOp_Half_TN,tn_1786_1786_128_B_32,Gemm_Hipblaslt_TN_6879,0.133613
GemmStridedBatchedTunableOp_Half_TN,tn_1682_1682_128_B_32,Gemm_Rocblas_621286397,0.120896
GemmStridedBatchedTunableOp_Half_TN,tn_1623_1623_128_B_32,Gemm_Rocblas_621286397,0.111047
GemmStridedBatchedTunableOp_Half_TN,tn_2129_2129_128_B_64,Gemm_Hipblaslt_TN_6879,0.382537
GemmStridedBatchedTunableOp_Half_TN,tn_1743_1743_128_B_32,Gemm_Rocblas_621294106,0.129338
GemmStridedBatchedTunableOp_Half_TN,tn_1777_1777_128_B_32,Gemm_Rocblas_621294108,0.132377
GemmStridedBatchedTunableOp_Half_TN,tn_1945_1945_128_B_32,Gemm_Rocblas_621294533,0.157906
GemmStridedBatchedTunableOp_Half_TN,tn_1947_1947_128_B_32,Gemm_Hipblaslt_TN_6879,0.158055
GemmStridedBatchedTunableOp_Half_TN,tn_2337_2337_128_B_64,Gemm_Rocblas_621294106,0.461738
GemmStridedBatchedTunableOp_Half_TN,tn_2048_2048_128_B_64,Gemm_Hipblaslt_TN_9843,0.281636
GemmStridedBatchedTunableOp_Half_TN,tn_2050_2050_128_B_64,Gemm_Rocblas_621294106,0.347126
GemmStridedBatchedTunableOp_Half_TN,tn_1734_1734_128_B_32,Gemm_Rocblas_621286397,0.127187
GemmStridedBatchedTunableOp_Half_TN,tn_1744_1744_128_B_32,Gemm_Rocblas_621294110,0.116773
GemmStridedBatchedTunableOp_Half_TN,tn_1885_1885_128_B_32,Gemm_Hipblaslt_TN_6942,0.149889
GemmStridedBatchedTunableOp_Half_TN,tn_1981_1981_128_B_32,Gemm_Rocblas_621294533,0.162903
GemmStridedBatchedTunableOp_Half_TN,tn_1699_1699_128_B_32,Gemm_Hipblaslt_TN_6942,0.123758
GemmStridedBatchedTunableOp_Half_TN,tn_2270_2270_128_B_64,Gemm_Rocblas_621294106,0.418209
GemmStridedBatchedTunableOp_Half_TN,tn_1826_1826_128_B_32,Gemm_Rocblas_621286397,0.14248
GemmStridedBatchedTunableOp_Half_TN,tn_1605_1605_128_B_32,Gemm_Rocblas_621286397,0.113692
GemmStridedBatchedTunableOp_Half_TN,tn_1754_1754_128_B_32,Gemm_Rocblas_621286397,0.129831
GemmStridedBatchedTunableOp_Half_TN,tn_1790_1790_128_B_32,Gemm_Hipblaslt_TN_6874,0.134639
GemmStridedBatchedTunableOp_Half_TN,tn_1762_1762_128_B_32,Gemm_Rocblas_621286397,0.129286
GemmStridedBatchedTunableOp_Half_TN,tn_1592_1592_128_B_32,Gemm_Rocblas_621286397,0.110999
GemmStridedBatchedTunableOp_Half_TN,tn_2413_2413_128_B_64,Gemm_Rocblas_621294106,0.488217
GemmStridedBatchedTunableOp_Half_TN,tn_1862_1862_128_B_32,Gemm_Hipblaslt_TN_6942,0.145313
GemmStridedBatchedTunableOp_Half_TN,tn_1677_1677_128_B_32,Gemm_Rocblas_621286413,0.122254
GemmStridedBatchedTunableOp_Half_TN,tn_1800_1800_128_B_32,Gemm_Hipblaslt_TN_157,0.12974
GemmStridedBatchedTunableOp_Half_TN,tn_1693_1693_128_B_32,Gemm_Rocblas_621286413,0.124288
GemmStridedBatchedTunableOp_Half_TN,tn_1698_1698_128_B_32,Gemm_Rocblas_621294110,0.1228
GemmStridedBatchedTunableOp_Half_TN,tn_1716_1716_128_B_32,Gemm_Rocblas_621286413,0.123064
GemmStridedBatchedTunableOp_Half_TN,tn_1971_1971_128_B_32,Gemm_Hipblaslt_TN_6879,0.159359
GemmStridedBatchedTunableOp_Half_TN,tn_1934_1934_128_B_32,Gemm_Hipblaslt_TN_6879,0.156954
GemmStridedBatchedTunableOp_Half_TN,tn_2128_2128_128_B_64,Gemm_Hipblaslt_TN_158,0.341991
GemmStridedBatchedTunableOp_Half_TN,tn_1626_1626_128_B_32,Gemm_Hipblaslt_TN_6942,0.115967
GemmStridedBatchedTunableOp_Half_TN,tn_1840_1840_128_B_32,Gemm_Hipblaslt_TN_157,0.130456
GemmStridedBatchedTunableOp_Half_TN,tn_1588_1588_128_B_32,Gemm_Hipblaslt_TN_6942,0.110257
GemmStridedBatchedTunableOp_Half_TN,tn_1669_1669_128_B_32,Gemm_Rocblas_621294110,0.121266
GemmStridedBatchedTunableOp_Half_TN,tn_1685_1685_128_B_32,Gemm_Rocblas_621294106,0.123068
GemmStridedBatchedTunableOp_Half_TN,tn_1918_1918_128_B_32,Gemm_Hipblaslt_TN_6950,0.152783
GemmStridedBatchedTunableOp_Half_TN,tn_1630_1630_128_B_32,Gemm_Hipblaslt_TN_6942,0.11532
GemmStridedBatchedTunableOp_Half_TN,tn_2127_2127_128_B_64,Gemm_Rocblas_621294106,0.382
GemmStridedBatchedTunableOp_Half_TN,tn_1639_1639_128_B_32,Gemm_Hipblaslt_TN_6942,0.11608
GemmStridedBatchedTunableOp_Half_TN,tn_1648_1648_128_B_32,Gemm_Rocblas_621286397,0.109646
GemmStridedBatchedTunableOp_Half_TN,tn_2081_2081_128_B_64,Gemm_Rocblas_621294106,0.363949
GemmStridedBatchedTunableOp_Half_TN,tn_1787_1787_128_B_32,Gemm_Rocblas_621294108,0.131854
GemmStridedBatchedTunableOp_Half_TN,tn_1779_1779_128_B_32,Gemm_Rocblas_621286397,0.132839
GemmStridedBatchedTunableOp_Half_TN,tn_1694_1694_128_B_32,Gemm_Rocblas_621286413,0.1206
GemmStridedBatchedTunableOp_Half_TN,tn_1936_1936_128_B_32,Gemm_Hipblaslt_TN_153,0.14236
GemmTunableOp_Half_TN,tn_6144_1799_4096,Gemm_Rocblas_621294447,0.164795
GemmTunableOp_Half_TN,tn_6144_1608_4096,Gemm_Rocblas_621294306,0.15406
GemmTunableOp_Half_TN,tn_6144_16_4096,Gemm_Rocblas_621286273,0.0129757
GemmTunableOp_Half_TN,tn_4096_3581_14336,Gemm_Hipblaslt_TN_9743,0.689059
GemmTunableOp_Half_TN,tn_28672_1796_4096,Gemm_Hipblaslt_TN_9832,0.794148
GemmTunableOp_Half_TN,tn_6144_1789_4096,Gemm_Hipblaslt_TN_9799,0.164545
GemmTunableOp_Half_TN,tn_4096_1789_4096,Gemm_Hipblaslt_TN_9134,0.116994
GemmTunableOp_Half_TN,tn_4096_1708_4096,Gemm_Hipblaslt_TN_9671,0.108474
GemmTunableOp_Half_TN,tn_128256_172_4096,Gemm_Hipblaslt_TN_9952,0.516598
GemmTunableOp_Half_TN,tn_4096_5089_4096,Gemm_Rocblas_621286580,0.316161
GemmTunableOp_Half_TN,tn_4096_6800_4096,Gemm_Hipblaslt_TN_9743,0.391794
GemmTunableOp_Half_TN,tn_6144_1771_4096,Gemm_Hipblaslt_TN_9691,0.164215
GemmTunableOp_Half_TN,tn_4096_1748_14336,Gemm_Hipblaslt_TN_9645,0.393012
GemmTunableOp_Half_TN,tn_6144_1863_4096,Gemm_Hipblaslt_TN_9691,0.166673
GemmTunableOp_Half_TN,tn_6144_5223_4096,Gemm_Hipblaslt_TN_9655,0.44462
GemmTunableOp_Half_TN,tn_6144_5723_4096,Gemm_Hipblaslt_TN_9690,0.50734
GemmTunableOp_Half_TN,tn_6144_1967_4096,Gemm_Hipblaslt_TN_9697,0.179149
GemmTunableOp_Half_TN,tn_6144_1628_4096,Gemm_Hipblaslt_TN_9570,0.15089
GemmTunableOp_Half_TN,tn_6144_5605_4096,Gemm_Rocblas_621286575,0.506304
GemmTunableOp_Half_TN,tn_4096_5413_4096,Gemm_Hipblaslt_TN_9691,0.328443
GemmTunableOp_Half_TN,tn_6144_1620_4096,Gemm_Hipblaslt_TN_9570,0.152992
GemmTunableOp_Half_TN,tn_4096_1731_14336,Gemm_Hipblaslt_TN_9645,0.394111
GemmTunableOp_Half_TN,tn_4096_3768_4096,Gemm_Rocblas_621294030,0.212079
GemmTunableOp_Half_TN,tn_28672_1771_4096,Gemm_Hipblaslt_TN_9217,0.74249
GemmTunableOp_Half_TN,tn_4096_1916_4096,Gemm_Hipblaslt_TN_9645,0.122095
GemmTunableOp_Half_TN,tn_4096_3645_4096,Gemm_Hipblaslt_TN_9814,0.20279
GemmTunableOp_Half_TN,tn_4096_1743_14336,Gemm_Hipblaslt_TN_9645,0.394377
GemmTunableOp_Half_TN,tn_6144_5512_4096,Gemm_Hipblaslt_TN_9768,0.456862
GemmTunableOp_Half_TN,tn_4096_1646_4096,Gemm_Hipblaslt_TN_9359,0.105189
GemmTunableOp_Half_TN,tn_4096_1946_14336,Gemm_Hipblaslt_TN_9645,0.422429
GemmTunableOp_Half_TN,tn_4096_1946_4096,Gemm_Hipblaslt_TN_9134,0.124674
GemmTunableOp_Half_TN,tn_4096_1871_14336,Gemm_Hipblaslt_TN_9645,0.415325
GemmTunableOp_Half_TN,tn_6144_1684_4096,Gemm_Rocblas_621286753,0.156579
GemmTunableOp_Half_TN,tn_4096_5442_4096,Gemm_Rocblas_621294320,0.331766
GemmTunableOp_Half_TN,tn_128256_133_4096,Gemm_Hipblaslt_TN_9108,0.470177
GemmTunableOp_Half_TN,tn_6144_5680_4096,Gemm_Rocblas_621286575,0.506675
GemmTunableOp_Half_TN,tn_4096_1707_14336,Gemm_Hipblaslt_TN_9790,0.368849
GemmTunableOp_Half_TN,tn_6144_3701_4096,Gemm_Rocblas_621286575,0.337078
GemmTunableOp_Half_TN,tn_28672_7104_4096,Gemm_Hipblaslt_TN_9898,2.8795
GemmTunableOp_Half_TN,tn_128256_154_4096,Gemm_Hipblaslt_TN_9108,0.481307
GemmTunableOp_Half_TN,tn_128256_182_4096,Gemm_Hipblaslt_TN_9683,0.523535
GemmTunableOp_Half_TN,tn_6144_3791_4096,Gemm_Hipblaslt_TN_9690,0.339203
GemmTunableOp_Half_TN,tn_4096_1780_4096,Gemm_Hipblaslt_TN_9134,0.116595
GemmTunableOp_Half_TN,tn_8192_2208_28672,Gemm_Hipblaslt_TN_9762,2.10085
GemmTunableOp_Half_TN,tn_6144_1883_4096,Gemm_Rocblas_621294425,0.168737
GemmTunableOp_Half_TN,tn_6144_136_4096,Gemm_Rocblas_621286440,0.0263293
GemmTunableOp_Half_TN,tn_28672_1825_4096,Gemm_Hipblaslt_TN_9832,0.798637
GemmTunableOp_Half_TN,tn_4096_3468_14336,Gemm_Hipblaslt_TN_9187,0.676644
GemmTunableOp_Half_TN,tn_28672_1827_4096,Gemm_Hipblaslt_TN_9683,0.796844
GemmTunableOp_Half_TN,tn_4096_1970_4096,Gemm_Hipblaslt_TN_9645,0.124786
GemmTunableOp_Half_TN,tn_4096_128_14336,Gemm_Hipblaslt_TN_7160,0.0469777
GemmTunableOp_Half_TN,tn_4096_5273_14336,Gemm_Hipblaslt_TN_9799,1.09477
GemmTunableOp_Half_TN,tn_10240_2017_8192,Gemm_Rocblas_621294310,0.60685
GemmTunableOp_Half_TN,tn_10240_2366_8192,Gemm_Hipblaslt_TN_9209,0.678446
GemmTunableOp_Half_TN,tn_8192_55_8192,Gemm_Hipblaslt_TN_7484,0.0388364
GemmTunableOp_Half_TN,tn_4096_5583_4096,Gemm_Hipblaslt_TN_9672,0.337534
GemmTunableOp_Half_TN,tn_128256_143_4096,Gemm_Hipblaslt_TN_9108,0.472541
GemmTunableOp_Half_TN,tn_28672_3562_4096,Gemm_Hipblaslt_TN_9827,1.38468
GemmTunableOp_Half_TN,tn_6144_1928_4096,Gemm_Rocblas_621294489,0.174819
GemmTunableOp_Half_TN,tn_6144_7225_4096,Gemm_Hipblaslt_TN_9814,0.605343
GemmTunableOp_Half_TN,tn_4096_1593_4096,Gemm_Hipblaslt_TN_9587,0.105095
GemmTunableOp_Half_TN,tn_4096_1838_14336,Gemm_Hipblaslt_TN_9680,0.410715
GemmTunableOp_Half_TN,tn_28672_3400_4096,Gemm_Hipblaslt_TN_9827,1.35744
GemmTunableOp_Half_TN,tn_6144_1648_4096,Gemm_Hipblaslt_TN_9570,0.152606
GemmTunableOp_Half_TN,tn_4096_1636_4096,Gemm_Hipblaslt_TN_9587,0.106085
GemmTunableOp_Half_TN,tn_4096_3373_14336,Gemm_Hipblaslt_TN_9677,0.663933
GemmTunableOp_Half_TN,tn_4096_7171_4096,Gemm_Hipblaslt_TN_9188,0.40943
GemmTunableOp_Half_TN,tn_8192_2178_28672,Gemm_Hipblaslt_TN_9762,2.07222
GemmTunableOp_Half_TN,tn_4096_3791_14336,Gemm_Hipblaslt_TN_9827,0.733112
GemmTunableOp_Half_TN,tn_28672_1916_4096,Gemm_Hipblaslt_TN_9832,0.811091
GemmTunableOp_Half_TN,tn_4096_1620_14336,Gemm_Hipblaslt_TN_9265,0.36226
GemmTunableOp_Half_TN,tn_6144_5273_4096,Gemm_Hipblaslt_TN_9933,0.445202
GemmTunableOp_Half_TN,tn_4096_1600_14336,Gemm_Hipblaslt_TN_9671,0.359645
GemmTunableOp_Half_TN,tn_4096_1805_14336,Gemm_Hipblaslt_TN_9792,0.409923
GemmTunableOp_Half_TN,tn_6144_1802_4096,Gemm_Hipblaslt_TN_9799,0.163263
GemmTunableOp_Half_TN,tn_4096_7033_4096,Gemm_Hipblaslt_TN_9743,0.395948
GemmTunableOp_Half_TN,tn_6144_3855_4096,Gemm_Rocblas_621286575,0.345488
GemmTunableOp_Half_TN,tn_4096_1699_4096,Gemm_Hipblaslt_TN_9265,0.10892
GemmTunableOp_Half_TN,tn_4096_1610_14336,Gemm_Hipblaslt_TN_9180,0.361707
GemmTunableOp_Half_TN,tn_4096_1847_14336,Gemm_Hipblaslt_TN_9680,0.412407
GemmTunableOp_Half_TN,tn_8192_2129_28672,Gemm_Hipblaslt_TN_9762,2.05368
GemmTunableOp_Half_TN,tn_4096_1769_14336,Gemm_Hipblaslt_TN_9645,0.396084
GemmTunableOp_Half_TN,tn_4096_1748_4096,Gemm_Hipblaslt_TN_9645,0.116223
GemmTunableOp_Half_TN,tn_6144_5052_4096,Gemm_Hipblaslt_TN_9704,0.431889
GemmTunableOp_Half_TN,tn_4096_1826_4096,Gemm_Hipblaslt_TN_9645,0.118914
GemmTunableOp_Half_TN,tn_4096_1605_14336,Gemm_Hipblaslt_TN_9265,0.361147
GemmTunableOp_Half_TN,tn_4096_3562_4096,Gemm_Hipblaslt_TN_9743,0.201311
GemmTunableOp_Half_TN,tn_28672_1862_4096,Gemm_Hipblaslt_TN_9684,0.806134
GemmTunableOp_Half_TN,tn_6144_3507_4096,Gemm_Hipblaslt_TN_9691,0.319021
GemmTunableOp_Half_TN,tn_4096_3300_14336,Gemm_Hipblaslt_TN_9697,0.661141
GemmTunableOp_Half_TN,tn_4096_1763_14336,Gemm_Hipblaslt_TN_9645,0.395308
GemmTunableOp_Half_TN,tn_8192_2097_8192,Gemm_Hipblaslt_TN_9742,0.506062
GemmTunableOp_Half_TN,tn_4096_5436_14336,Gemm_Hipblaslt_TN_9799,1.14117
GemmTunableOp_Half_TN,tn_28672_1902_4096,Gemm_Hipblaslt_TN_9832,0.808746
GemmTunableOp_Half_TN,tn_28672_1684_4096,Gemm_Rocblas_621294420,0.727157
GemmTunableOp_Half_TN,tn_4096_1883_4096,Gemm_Hipblaslt_TN_9645,0.1211
GemmTunableOp_Half_TN,tn_32000_56_8192,Gemm_Hipblaslt_TN_9460,0.160651
GemmTunableOp_Half_TN,tn_4096_3450_14336,Gemm_Hipblaslt_TN_9192,0.672833
GemmTunableOp_Half_TN,tn_8192_4000_28672,Gemm_Rocblas_621294634,3.44483
GemmTunableOp_Half_TN,tn_6144_1735_4096,Gemm_Hipblaslt_TN_9691,0.158263
GemmTunableOp_Half_TN,tn_28672_1760_4096,Gemm_Rocblas_621294484,0.739617
GemmTunableOp_Half_TN,tn_4096_1824_4096,Gemm_Hipblaslt_TN_9602,0.120552
GemmTunableOp_Half_TN,tn_4096_1798_4096,Gemm_Hipblaslt_TN_9134,0.120362
GemmTunableOp_Half_TN,tn_4096_5204_14336,Gemm_Hipblaslt_TN_9799,1.09384
GemmTunableOp_Half_TN,tn_28672_6976_4096,Gemm_Hipblaslt_TN_9747,2.86759
GemmTunableOp_Half_TN,tn_28672_1875_4096,Gemm_Hipblaslt_TN_9684,0.799589
GemmTunableOp_Half_TN,tn_28672_1651_4096,Gemm_Rocblas_621294420,0.720677
GemmTunableOp_Half_TN,tn_57344_2270_8192,Gemm_Hipblaslt_TN_9757,4.0889
GemmTunableOp_Half_TN,tn_4096_1737_14336,Gemm_Hipblaslt_TN_9645,0.3948
GemmTunableOp_Half_TN,tn_4096_1702_4096,Gemm_Hipblaslt_TN_9607,0.107352
GemmTunableOp_Half_TN,tn_4096_3713_4096,Gemm_Hipblaslt_TN_9768,0.213882
GemmTunableOp_Half_TN,tn_4096_6841_4096,Gemm_Hipblaslt_TN_9743,0.395156
GemmTunableOp_Half_TN,tn_6144_5410_4096,Gemm_Hipblaslt_TN_9704,0.454766
GemmTunableOp_Half_TN,tn_8192_2315_28672,Gemm_Hipblaslt_TN_9649,2.2703
GemmTunableOp_Half_TN,tn_10240_2079_8192,Gemm_Hipblaslt_TN_9675,0.61512
GemmTunableOp_Half_TN,tn_28672_1757_4096,Gemm_Hipblaslt_TN_9217,0.74024
GemmTunableOp_Half_TN,tn_6144_1969_4096,Gemm_Hipblaslt_TN_9187,0.179076
GemmTunableOp_Half_TN,tn_4096_1969_14336,Gemm_Hipblaslt_TN_9645,0.422485
GemmTunableOp_Half_TN,tn_28672_7139_4096,Gemm_Hipblaslt_TN_9892,2.89804
GemmTunableOp_Half_TN,tn_6144_5735_4096,Gemm_Rocblas_621286575,0.506474
GemmTunableOp_Half_TN,tn_6144_5271_4096,Gemm_Hipblaslt_TN_9704,0.446279
GemmTunableOp_Half_TN,tn_6144_56_4096,Gemm_Rocblas_621294061,0.0160603
GemmTunableOp_Half_TN,tn_6144_1749_4096,Gemm_Hipblaslt_TN_9672,0.159298
GemmTunableOp_Half_TN,tn_6144_1725_4096,Gemm_Hipblaslt_TN_9570,0.156154
GemmTunableOp_Half_TN,tn_6144_3456_4096,Gemm_Rocblas_621286753,0.309628
GemmTunableOp_Half_TN,tn_128256_20_4096,Gemm_Hipblaslt_TN_9451,0.311759
GemmTunableOp_Half_TN,tn_4096_3400_14336,Gemm_Hipblaslt_TN_9677,0.671558
GemmTunableOp_Half_TN,tn_4096_1633_4096,Gemm_Hipblaslt_TN_9671,0.104505
GemmTunableOp_Half_TN,tn_4096_1935_14336,Gemm_Hipblaslt_TN_9592,0.419046
GemmTunableOp_Half_TN,tn_128256_237_4096,Gemm_Rocblas_621294634,0.60139
GemmTunableOp_Half_TN,tn_28672_3600_4096,Gemm_Hipblaslt_TN_9832,1.46283
GemmTunableOp_Half_TN,tn_4096_6870_4096,Gemm_Hipblaslt_TN_9743,0.394335
GemmTunableOp_Half_TN,tn_6144_5359_4096,Gemm_Hipblaslt_TN_9768,0.450693
GemmTunableOp_Half_TN,tn_4096_3582_4096,Gemm_Hipblaslt_TN_9743,0.204091
GemmTunableOp_Half_TN,tn_4096_3410_4096,Gemm_Hipblaslt_TN_9743,0.193593
GemmTunableOp_Half_TN,tn_8192_2081_28672,Gemm_Hipblaslt_TN_9762,2.03394
GemmTunableOp_Half_TN,tn_4096_1882_14336,Gemm_Hipblaslt_TN_9645,0.415521
GemmTunableOp_Half_TN,tn_28672_1799_4096,Gemm_Hipblaslt_TN_9684,0.79624
GemmTunableOp_Half_TN,tn_28672_1869_4096,Gemm_Hipblaslt_TN_9832,0.804812
GemmTunableOp_Half_TN,tn_8192_57_8192,Gemm_Hipblaslt_TN_7492,0.0395604
GemmTunableOp_Half_TN,tn_4096_1766_4096,Gemm_Hipblaslt_TN_9134,0.116633
GemmTunableOp_Half_TN,tn_128256_107_4096,Gemm_Hipblaslt_TN_9061,0.423379
GemmTunableOp_Half_TN,tn_6144_7240_4096,Gemm_Hipblaslt_TN_9743,0.609452
GemmTunableOp_Half_TN,tn_6144_3383_4096,Gemm_Hipblaslt_TN_9570,0.309491
GemmTunableOp_Half_TN,tn_28672_1625_4096,Gemm_Rocblas_621294420,0.718593
GemmTunableOp_Half_TN,tn_8192_4096_28672,Gemm_Rocblas_621294643,3.47113
GemmTunableOp_Half_TN,tn_10240_2129_8192,Gemm_Hipblaslt_TN_9182,0.63409
GemmTunableOp_Half_TN,tn_6144_3379_4096,Gemm_Hipblaslt_TN_9570,0.308136
GemmTunableOp_Half_TN,tn_4096_1908_14336,Gemm_Hipblaslt_TN_9645,0.416571
GemmTunableOp_Half_TN,tn_128256_60_4096,Gemm_Rocblas_621294554,0.360333
GemmTunableOp_Half_TN,tn_28672_1889_4096,Gemm_Hipblaslt_TN_9683,0.805926
GemmTunableOp_Half_TN,tn_4096_1742_4096,Gemm_Hipblaslt_TN_9645,0.115677
GemmTunableOp_Half_TN,tn_128256_183_4096,Gemm_Hipblaslt_TN_9952,0.525172
GemmTunableOp_Half_TN,tn_57344_66_8192,Gemm_Rocblas_621294520,0.31903
GemmTunableOp_Half_TN,tn_6144_7109_4096,Gemm_Hipblaslt_TN_9677,0.600308
GemmTunableOp_Half_TN,tn_28672_5735_4096,Gemm_Hipblaslt_TN_9827,2.3811
GemmTunableOp_Half_TN,tn_4096_1745_14336,Gemm_Hipblaslt_TN_9645,0.395082
GemmTunableOp_Half_TN,tn_4096_6920_4096,Gemm_Hipblaslt_TN_9743,0.399164
GemmTunableOp_Half_TN,tn_4096_6788_4096,Gemm_Hipblaslt_TN_9944,0.394472
GemmTunableOp_Half_TN,tn_28672_3584_4096,Gemm_Hipblaslt_TN_9827,1.38684
GemmTunableOp_Half_TN,tn_8192_31_8192,Gemm_Hipblaslt_TN_9410,0.0336102
GemmTunableOp_Half_TN,tn_128256_210_4096,Gemm_Hipblaslt_TN_9937,0.574487
GemmTunableOp_Half_TN,tn_57344_54_8192,Gemm_Rocblas_621286466,0.304307
GemmTunableOp_Half_TN,tn_4096_1721_4096,Gemm_Hipblaslt_TN_9671,0.106769
GemmTunableOp_Half_TN,tn_4096_1890_4096,Gemm_Hipblaslt_TN_9645,0.122448
GemmTunableOp_Half_TN,tn_8192_2193_28672,Gemm_Hipblaslt_TN_9762,2.07503
GemmTunableOp_Half_TN,tn_4096_5570_14336,Gemm_Hipblaslt_TN_9799,1.16946
GemmTunableOp_Half_TN,tn_128256_167_4096,Gemm_Hipblaslt_TN_9952,0.515389
GemmTunableOp_Half_TN,tn_8192_56_28672,Gemm_Rocblas_621286489,0.14335
GemmTunableOp_Half_TN,tn_6144_3420_4096,Gemm_Hipblaslt_TN_9570,0.311897
GemmTunableOp_Half_TN,tn_8192_2191_28672,Gemm_Hipblaslt_TN_9762,2.06838
GemmTunableOp_Half_TN,tn_32000_29_8192,Gemm_Rocblas_621294193,0.147838
GemmTunableOp_Half_TN,tn_57344_55_8192,Gemm_Rocblas_621286466,0.305512
GemmTunableOp_Half_TN,tn_4096_3520_14336,Gemm_Hipblaslt_TN_9814,0.684654
GemmTunableOp_Half_TN,tn_28672_1686_4096,Gemm_Hipblaslt_TN_9223,0.727138
GemmTunableOp_Half_TN,tn_28672_6965_4096,Gemm_Hipblaslt_TN_9934,2.85518
GemmTunableOp_Half_TN,tn_6144_1766_4096,Gemm_Hipblaslt_TN_9799,0.162754
GemmTunableOp_Half_TN,tn_57344_2191_8192,Gemm_Hipblaslt_TN_9827,4.03218
GemmTunableOp_Half_TN,tn_8192_2097_28672,Gemm_Hipblaslt_TN_9762,2.06285
GemmTunableOp_Half_TN,tn_28672_1804_4096,Gemm_Hipblaslt_TN_9684,0.789984
GemmTunableOp_Half_TN,tn_8192_2315_8192,Gemm_Hipblaslt_TN_9274,0.556322
GemmTunableOp_Half_TN,tn_128256_201_4096,Gemm_Hipblaslt_TN_9847,0.561852
GemmTunableOp_Half_TN,tn_8192_64_8192,Gemm_Hipblaslt_TN_7484,0.0397577
GemmTunableOp_Half_TN,tn_10240_28_8192,Gemm_Hipblaslt_TN_9415,0.0402366
GemmTunableOp_Half_TN,tn_8192_2207_28672,Gemm_Hipblaslt_TN_9762,2.08493
GemmTunableOp_Half_TN,tn_6144_1842_4096,Gemm_Hipblaslt_TN_9799,0.166927
GemmTunableOp_Half_TN,tn_8192_2127_28672,Gemm_Hipblaslt_TN_9762,2.05251
GemmTunableOp_Half_TN,tn_4096_7138_14336,Gemm_Hipblaslt_TN_9743,1.44064
GemmTunableOp_Half_TN,tn_6144_1784_4096,Gemm_Rocblas_621294447,0.164075
GemmTunableOp_Half_TN,tn_28672_1703_4096,Gemm_Hipblaslt_TN_9223,0.730659
GemmTunableOp_Half_TN,tn_4096_1862_14336,Gemm_Hipblaslt_TN_9645,0.416035
GemmTunableOp_Half_TN,tn_4096_5285_14336,Gemm_Hipblaslt_TN_9799,1.11658
GemmTunableOp_Half_TN,tn_10240_2385_8192,Gemm_Hipblaslt_TN_9209,0.67923
GemmTunableOp_Half_TN,tn_4096_1670_14336,Gemm_Hipblaslt_TN_9679,0.366384
GemmTunableOp_Half_TN,tn_6144_3455_4096,Gemm_Hipblaslt_TN_9570,0.311372
GemmTunableOp_Half_TN,tn_10240_4066_8192,Gemm_Hipblaslt_TN_9743,1.1417
GemmTunableOp_Half_TN,tn_8192_67_28672,Gemm_Hipblaslt_TN_8168,0.173918
GemmTunableOp_Half_TN,tn_4096_7093_14336,Gemm_Hipblaslt_TN_9694,1.42769
GemmTunableOp_Half_TN,tn_28672_240_4096,Gemm_Rocblas_621286584,0.121796
GemmTunableOp_Half_TN,tn_28672_7093_4096,Gemm_Hipblaslt_TN_9920,2.88282
GemmTunableOp_Half_TN,tn_57344_30_8192,Gemm_Hipblaslt_TN_9429,0.257841
GemmTunableOp_Half_TN,tn_4096_1792_14336,Gemm_Hipblaslt_TN_9645,0.397427
GemmTunableOp_Half_TN,tn_6144_1864_4096,Gemm_Hipblaslt_TN_9799,0.166539
GemmTunableOp_Half_TN,tn_28672_3475_4096,Gemm_Hipblaslt_TN_9827,1.36542
GemmTunableOp_Half_TN,tn_6144_7047_4096,Gemm_Hipblaslt_TN_9677,0.597812
GemmTunableOp_Half_TN,tn_28672_1954_4096,Gemm_Hipblaslt_TN_9846,0.843692
GemmTunableOp_Half_TN,tn_10240_2315_8192,Gemm_Hipblaslt_TN_9674,0.6763
GemmTunableOp_Half_TN,tn_28672_1610_4096,Gemm_Rocblas_621286678,0.712753
GemmTunableOp_Half_TN,tn_32000_65_8192,Gemm_Hipblaslt_TN_9479,0.186476
GemmTunableOp_Half_TN,tn_28672_3382_4096,Gemm_Hipblaslt_TN_9827,1.35294
GemmTunableOp_Half_TN,tn_128256_46_4096,Gemm_Hipblaslt_TN_9451,0.336377
GemmTunableOp_Half_TN,tn_28672_3629_4096,Gemm_Hipblaslt_TN_9832,1.47369
GemmTunableOp_Half_TN,tn_4096_7386_4096,Gemm_Hipblaslt_TN_9914,0.423976
GemmTunableOp_Half_TN,tn_8192_2079_8192,Gemm_Hipblaslt_TN_9742,0.500523
GemmTunableOp_Half_TN,tn_57344_2415_8192,Gemm_Hipblaslt_TN_9852,4.42862
GemmTunableOp_Half_TN,tn_8192_54_8192,Gemm_Hipblaslt_TN_7484,0.0384931
GemmTunableOp_Half_TN,tn_4096_1774_4096,Gemm_Hipblaslt_TN_9645,0.117367
GemmTunableOp_Half_TN,tn_57344_2177_8192,Gemm_Rocblas_621294542,3.98475
GemmTunableOp_Half_TN,tn_128256_71_4096,Gemm_Hipblaslt_TN_9057,0.383138
GemmTunableOp_Half_TN,tn_6144_1970_4096,Gemm_Hipblaslt_TN_9793,0.178062
GemmTunableOp_Half_TN,tn_8192_2370_8192,Gemm_Hipblaslt_TN_9274,0.561409
GemmTunableOp_Half_TN,tn_4096_6979_14336,Gemm_Hipblaslt_TN_9694,1.42291
GemmTunableOp_Half_TN,tn_28672_1719_4096,Gemm_Rocblas_621294420,0.737409
GemmTunableOp_Half_TN,tn_4096_7139_14336,Gemm_Hipblaslt_TN_9743,1.42446
GemmTunableOp_Half_TN,tn_8192_2192_8192,Gemm_Hipblaslt_TN_9742,0.51109
GemmTunableOp_Half_TN,tn_28672_3507_4096,Gemm_Hipblaslt_TN_9827,1.37304
GemmTunableOp_Half_TN,tn_8192_2190_8192,Gemm_Hipblaslt_TN_9742,0.510643
GemmTunableOp_Half_TN,tn_28672_3345_4096,Gemm_Hipblaslt_TN_9841,1.37184
GemmTunableOp_Half_TN,tn_28672_1727_4096,Gemm_Hipblaslt_TN_9223,0.73243
GemmTunableOp_Half_TN,tn_4096_1713_14336,Gemm_Hipblaslt_TN_9790,0.368997
GemmTunableOp_Half_TN,tn_28672_3496_4096,Gemm_Hipblaslt_TN_9827,1.37575
GemmTunableOp_Half_TN,tn_57344_2000_8192,Gemm_Hipblaslt_TN_156,3.4967
GemmTunableOp_Half_TN,tn_6144_1882_4096,Gemm_Rocblas_621286684,0.167382
GemmTunableOp_Half_TN,tn_28672_3706_4096,Gemm_Hipblaslt_TN_9827,1.52156
GemmTunableOp_Half_TN,tn_28672_5052_4096,Gemm_Hipblaslt_TN_9863,2.09478
GemmTunableOp_Half_TN,tn_8192_2128_8192,Gemm_Hipblaslt_TN_9742,0.506909
GemmTunableOp_Half_TN,tn_4096_1874_4096,Gemm_Hipblaslt_TN_9645,0.123136
GemmTunableOp_Half_TN,tn_128256_62_4096,Gemm_Rocblas_621294554,0.35848
GemmTunableOp_Half_TN,tn_10240_4049_8192,Gemm_Hipblaslt_TN_9743,1.13302
GemmTunableOp_Half_TN,tn_4096_1805_4096,Gemm_Hipblaslt_TN_9645,0.118069
GemmTunableOp_Half_TN,tn_8192_4096_8192,Gemm_Hipblaslt_TN_9704,0.889648
GemmTunableOp_Half_TN,tn_4096_3574_4096,Gemm_Hipblaslt_TN_9187,0.202402
GemmTunableOp_Half_TN,tn_4096_1710_14336,Gemm_Hipblaslt_TN_9671,0.369002
GemmTunableOp_Half_TN,tn_57344_58_8192,Gemm_Rocblas_621286467,0.307934
GemmTunableOp_Half_TN,tn_4096_1954_4096,Gemm_Hipblaslt_TN_9645,0.124351
GemmTunableOp_Half_TN,tn_4096_1682_4096,Gemm_Hipblaslt_TN_9164,0.106313
GemmTunableOp_Half_TN,tn_28672_3691_4096,Gemm_Hipblaslt_TN_9827,1.51607
GemmTunableOp_Half_TN,tn_4096_3309_4096,Gemm_Hipblaslt_TN_9814,0.195201
GemmTunableOp_Half_TN,tn_6144_1691_4096,Gemm_Hipblaslt_TN_9570,0.154862
GemmTunableOp_Half_TN,tn_6144_7301_4096,Gemm_Hipblaslt_TN_9704,0.631214
GemmTunableOp_Half_TN,tn_4096_3496_14336,Gemm_Hipblaslt_TN_9187,0.685658
GemmTunableOp_Half_TN,tn_4096_40_14336,Gemm_Hipblaslt_TN_9411,0.0324507
GemmTunableOp_Half_TN,tn_10240_2160_8192,Gemm_Rocblas_621294426,0.638515
GemmTunableOp_Half_TN,tn_4096_5301_14336,Gemm_Hipblaslt_TN_9924,1.11282
GemmTunableOp_Half_TN,tn_57344_2081_8192,Gemm_Hipblaslt_TN_9733,3.97478
GemmTunableOp_Half_TN,tn_57344_2366_8192,Gemm_Rocblas_621294543,4.40961
GemmTunableOp_Half_TN,tn_4096_1855_4096,Gemm_Hipblaslt_TN_9645,0.119181
GemmTunableOp_Half_TN,tn_6144_1839_4096,Gemm_Rocblas_621286609,0.165627
GemmTunableOp_Half_TN,tn_6144_1966_4096,Gemm_Hipblaslt_TN_9693,0.177002
GemmTunableOp_Half_TN,tn_4096_1652_4096,Gemm_Hipblaslt_TN_9671,0.103174
GemmTunableOp_Half_TN,tn_6144_3511_4096,Gemm_Hipblaslt_TN_9570,0.315712
GemmTunableOp_Half_TN,tn_4096_3475_14336,Gemm_Hipblaslt_TN_9743,0.685642
GemmTunableOp_Half_TN,tn_57344_2159_8192,Gemm_Hipblaslt_TN_9666,4.00365
GemmTunableOp_Half_TN,tn_28672_1967_4096,Gemm_Hipblaslt_TN_9846,0.835053
GemmTunableOp_Half_TN,tn_28672_1762_4096,Gemm_Rocblas_621286742,0.740921
GemmTunableOp_Half_TN,tn_4096_6843_14336,Gemm_Hipblaslt_TN_9732,1.40471
GemmTunableOp_Half_TN,tn_28672_1668_4096,Gemm_Hipblaslt_TN_9223,0.725455
GemmTunableOp_Half_TN,tn_6144_6800_4096,Gemm_Hipblaslt_TN_9743,0.57998
GemmTunableOp_Half_TN,tn_28672_5512_4096,Gemm_Hipblaslt_TN_9865,2.31777
GemmTunableOp_Half_TN,tn_8192_4000_8192,Gemm_Hipblaslt_TN_9704,0.869522
GemmTunableOp_Half_TN,tn_8192_2113_8192,Gemm_Hipblaslt_TN_9742,0.50724
GemmTunableOp_Half_TN,tn_32000_64_8192,Gemm_Rocblas_621286466,0.162707
GemmTunableOp_Half_TN,tn_8192_4048_28672,Gemm_Rocblas_621294648,3.4567
GemmTunableOp_Half_TN,tn_6144_1711_4096,Gemm_Hipblaslt_TN_9570,0.157674
GemmTunableOp_Half_TN,tn_8192_2304_8192,Gemm_Hipblaslt_TN_9742,0.522312
GemmTunableOp_Half_TN,tn_28672_1963_4096,Gemm_Hipblaslt_TN_9846,0.84225
GemmTunableOp_Half_TN,tn_6144_1596_4096,Gemm_Rocblas_621294305,0.147831
GemmTunableOp_Half_TN,tn_4096_1877_4096,Gemm_Hipblaslt_TN_9134,0.121875
GemmTunableOp_Half_TN,tn_28672_5352_4096,Gemm_Hipblaslt_TN_159,2.18334
GemmTunableOp_Half_TN,tn_6144_1592_4096,Gemm_Rocblas_621294305,0.147154
GemmTunableOp_Half_TN,tn_4096_216_4096,Gemm_Rocblas_621286443,0.0258842
GemmTunableOp_Half_TN,tn_8192_2257_8192,Gemm_Hipblaslt_TN_9763,0.516032
GemmTunableOp_Half_TN,tn_28672_5436_4096,Gemm_Hipblaslt_TN_9924,2.28399
GemmTunableOp_Half_TN,tn_8192_4017_8192,Gemm_Hipblaslt_TN_9704,0.874512
GemmTunableOp_Half_TN,tn_28672_3767_4096,Gemm_Hipblaslt_TN_9827,1.53223
GemmTunableOp_Half_TN,tn_10240_57_8192,Gemm_Hipblaslt_TN_7492,0.0475281
GemmTunableOp_Half_TN,tn_128256_190_4096,Gemm_Hipblaslt_TN_9952,0.526257
GemmTunableOp_Half_TN,tn_4096_5052_14336,Gemm_Hipblaslt_TN_9787,1.06499
GemmTunableOp_Half_TN,tn_128256_123_4096,Gemm_Hipblaslt_TN_9760,0.440912
GemmTunableOp_Half_TN,tn_4096_5723_14336,Gemm_Hipblaslt_TN_9799,1.1921
GemmTunableOp_Half_TN,tn_10240_61_8192,Gemm_Hipblaslt_TN_7492,0.0480627
GemmTunableOp_Half_TN,tn_4096_1973_4096,Gemm_Hipblaslt_TN_9645,0.12352
GemmTunableOp_Half_TN,tn_128256_248_4096,Gemm_Rocblas_621294634,0.609649
GemmTunableOp_Half_TN,tn_8192_2257_28672,Gemm_Hipblaslt_TN_9649,2.23166
GemmTunableOp_Half_TN,tn_10240_2417_8192,Gemm_Hipblaslt_TN_9697,0.698555
GemmTunableOp_Half_TN,tn_4096_3438_4096,Gemm_Hipblaslt_TN_9743,0.197542
GemmTunableOp_Half_TN,tn_32000_61_8192,Gemm_Rocblas_621294203,0.162193
GemmTunableOp_Half_TN,tn_4096_1733_14336,Gemm_Hipblaslt_TN_9645,0.393624
GemmTunableOp_Half_TN,tn_28672_6916_4096,Gemm_Hipblaslt_TN_9958,2.88392
GemmTunableOp_Half_TN,tn_28672_3920_4096,Gemm_Hipblaslt_TN_9841,1.58007
GemmTunableOp_Half_TN,tn_128256_21_4096,Gemm_Rocblas_621294578,0.314094
GemmTunableOp_Half_TN,tn_4096_1614_14336,Gemm_Hipblaslt_TN_9610,0.361467
GemmTunableOp_Half_TN,tn_4096_88_14336,Gemm_Hipblaslt_TN_7160,0.0412695
GemmTunableOp_Half_TN,tn_8192_2128_28672,Gemm_Hipblaslt_TN_9762,2.0478
GemmTunableOp_Half_TN,tn_4096_1879_4096,Gemm_Hipblaslt_TN_9645,0.121358
GemmTunableOp_Half_TN,tn_8192_4033_28672,Gemm_Hipblaslt_TN_9591,3.43222
GemmTunableOp_Half_TN,tn_8192_2049_28672,Gemm_Hipblaslt_TN_9742,2.05994
GemmTunableOp_Half_TN,tn_57344_2397_8192,Gemm_Rocblas_621294543,4.4357
GemmTunableOp_Half_TN,tn_128256_13_4096,Gemm_Rocblas_621294224,0.292086
GemmTunableOp_Half_TN,tn_128256_76_4096,Gemm_Hipblaslt_TN_9057,0.384548
GemmTunableOp_Half_TN,tn_4096_6989_14336,Gemm_Hipblaslt_TN_9743,1.41756
GemmTunableOp_Half_TN,tn_28672_3582_4096,Gemm_Hipblaslt_TN_9827,1.39669
GemmTunableOp_Half_TN,tn_128256_146_4096,Gemm_Hipblaslt_TN_9108,0.471898
GemmTunableOp_Half_TN,tn_128256_169_4096,Gemm_Hipblaslt_TN_9952,0.518003
GemmTunableOp_Half_TN,tn_4096_5125_4096,Gemm_Hipblaslt_TN_9690,0.319156
GemmTunableOp_Half_TN,tn_4096_1767_4096,Gemm_Hipblaslt_TN_9590,0.117752
GemmTunableOp_Half_TN,tn_128256_40_4096,Gemm_Hipblaslt_TN_9451,0.327801
GemmTunableOp_Half_TN,tn_4096_1820_14336,Gemm_Hipblaslt_TN_9137,0.412567
GemmTunableOp_Half_TN,tn_4096_6868_14336,Gemm_Hipblaslt_TN_9694,1.39314
GemmTunableOp_Half_TN,tn_128256_216_4096,Gemm_Hipblaslt_TN_9847,0.579312
GemmTunableOp_Half_TN,tn_28672_1854_4096,Gemm_Hipblaslt_TN_9684,0.800584
GemmTunableOp_Half_TN,tn_4096_1930_14336,Gemm_Hipblaslt_TN_9645,0.414357
GemmTunableOp_Half_TN,tn_128256_226_4096,Gemm_Rocblas_621286892,0.594432
GemmTunableOp_Half_TN,tn_128256_242_4096,Gemm_Rocblas_621294634,0.610183
GemmTunableOp_Half_TN,tn_10240_2000_8192,Gemm_Rocblas_621294309,0.603479
GemmTunableOp_Half_TN,tn_4096_1802_4096,Gemm_Hipblaslt_TN_9645,0.11871
GemmTunableOp_Half_TN,tn_128256_152_4096,Gemm_Hipblaslt_TN_9108,0.476746
GemmTunableOp_Half_TN,tn_4096_3478_4096,Gemm_Hipblaslt_TN_9682,0.200634
GemmTunableOp_Half_TN,tn_6144_1890_4096,Gemm_Rocblas_621294425,0.166741
GemmTunableOp_Half_TN,tn_28672_5267_4096,Gemm_Hipblaslt_TN_9890,2.15249
GemmTunableOp_Half_TN,tn_6144_5301_4096,Gemm_Hipblaslt_TN_9704,0.446286
GemmTunableOp_Half_TN,tn_28672_6989_4096,Gemm_Hipblaslt_TN_9898,2.86679
GemmTunableOp_Half_TN,tn_10240_4050_8192,Gemm_Hipblaslt_TN_9814,1.14007
GemmTunableOp_Half_TN,tn_6144_1786_4096,Gemm_Hipblaslt_TN_9799,0.164155
GemmTunableOp_Half_TN,tn_28672_5354_4096,Gemm_Hipblaslt_TN_9860,2.18404
GemmTunableOp_Half_TN,tn_28672_1722_4096,Gemm_Hipblaslt_TN_9223,0.735253
GemmTunableOp_Half_TN,tn_10240_2161_8192,Gemm_Hipblaslt_TN_9729,0.639568
GemmTunableOp_Half_TN,tn_4096_16_14336,Gemm_Rocblas_621294135,0.0243804
GemmTunableOp_Half_TN,tn_28672_1739_4096,Gemm_Hipblaslt_TN_9220,0.735754
GemmTunableOp_Half_TN,tn_28672_1588_4096,Gemm_Hipblaslt_TN_9674,0.70549
GemmTunableOp_Half_TN,tn_4096_7432_14336,Gemm_Hipblaslt_TN_9753,1.54464
GemmTunableOp_Half_TN,tn_6144_3710_4096,Gemm_Hipblaslt_TN_9690,0.333587
GemmTunableOp_Half_TN,tn_28672_1852_4096,Gemm_Hipblaslt_TN_9832,0.798381
GemmTunableOp_Half_TN,tn_8192_2304_28672,Gemm_Hipblaslt_TN_9774,2.26588
GemmTunableOp_Half_TN,tn_4096_1960_14336,Gemm_Hipblaslt_TN_9792,0.421769
GemmTunableOp_Half_TN,tn_4096_1822_4096,Gemm_Hipblaslt_TN_9645,0.119471
GemmTunableOp_Half_TN,tn_57344_2284_8192,Gemm_Rocblas_621294543,4.04845
GemmTunableOp_Half_TN,tn_4096_1770_4096,Gemm_Hipblaslt_TN_9134,0.117506
GemmTunableOp_Half_TN,tn_6144_5413_4096,Gemm_Hipblaslt_TN_9768,0.45654
GemmTunableOp_Half_TN,tn_28672_1807_4096,Gemm_Hipblaslt_TN_9832,0.802243
GemmTunableOp_Half_TN,tn_4096_1801_4096,Gemm_Hipblaslt_TN_9645,0.118828
GemmTunableOp_Half_TN,tn_4096_6800_14336,Gemm_Hipblaslt_TN_9743,1.38213
GemmTunableOp_Half_TN,tn_28672_1829_4096,Gemm_Hipblaslt_TN_9832,0.794878
GemmTunableOp_Half_TN,tn_6144_1615_4096,Gemm_Hipblaslt_TN_9570,0.152928
GemmTunableOp_Half_TN,tn_6144_1599_4096,Gemm_Rocblas_621286565,0.146837
GemmTunableOp_Half_TN,tn_4096_1852_14336,Gemm_Hipblaslt_TN_9620,0.412988
GemmTunableOp_Half_TN,tn_4096_7262_4096,Gemm_Hipblaslt_TN_9743,0.408551
GemmTunableOp_Half_TN,tn_6144_1743_4096,Gemm_Hipblaslt_TN_9691,0.160145
GemmTunableOp_Half_TN,tn_4096_1607_14336,Gemm_Hipblaslt_TN_9265,0.360437
GemmTunableOp_Half_TN,tn_4096_1958_4096,Gemm_Hipblaslt_TN_9645,0.125362
GemmTunableOp_Half_TN,tn_6144_3450_4096,Gemm_Hipblaslt_TN_9570,0.312971
GemmTunableOp_Half_TN,tn_28672_1884_4096,Gemm_Hipblaslt_TN_9832,0.802334
GemmTunableOp_Half_TN,tn_6144_3427_4096,Gemm_Hipblaslt_TN_9774,0.308043
GemmTunableOp_Half_TN,tn_6144_3508_4096,Gemm_Rocblas_621294495,0.31718
GemmTunableOp_Half_TN,tn_4096_3830_14336,Gemm_Hipblaslt_TN_9827,0.750549
GemmTunableOp_Half_TN,tn_28672_1607_4096,Gemm_Hipblaslt_TN_9223,0.711309
GemmTunableOp_Half_TN,tn_6144_1787_4096,Gemm_Hipblaslt_TN_9691,0.163465
GemmTunableOp_Half_TN,tn_128256_191_4096,Gemm_Hipblaslt_TN_9952,0.526832
GemmTunableOp_Half_TN,tn_4096_1896_14336,Gemm_Hipblaslt_TN_9645,0.415739
GemmTunableOp_Half_TN,tn_4096_3592_4096,Gemm_Hipblaslt_TN_9814,0.206039
GemmTunableOp_Half_TN,tn_6144_3345_4096,Gemm_Rocblas_621286566,0.306532
GemmTunableOp_Half_TN,tn_128256_163_4096,Gemm_Hipblaslt_TN_9952,0.51185
GemmTunableOp_Half_TN,tn_4096_7240_14336,Gemm_Hipblaslt_TN_9743,1.44382
GemmTunableOp_Half_TN,tn_6144_3557_4096,Gemm_Hipblaslt_TN_9570,0.319873
GemmTunableOp_Half_TN,tn_4096_3501_14336,Gemm_Hipblaslt_TN_9743,0.682008
GemmTunableOp_Half_TN,tn_28672_3764_4096,Gemm_Hipblaslt_TN_9827,1.50922
GemmTunableOp_Half_TN,tn_4096_3573_14336,Gemm_Hipblaslt_TN_9743,0.690628
GemmTunableOp_Half_TN,tn_4096_7327_4096,Gemm_Hipblaslt_TN_9890,0.421778
GemmTunableOp_Half_TN,tn_128256_177_4096,Gemm_Hipblaslt_TN_9952,0.516609
GemmTunableOp_Half_TN,tn_28672_3573_4096,Gemm_Hipblaslt_TN_9827,1.38113
GemmTunableOp_Half_TN,tn_4096_1735_4096,Gemm_Hipblaslt_TN_9645,0.116233
GemmTunableOp_Half_TN,tn_6144_1689_4096,Gemm_Hipblaslt_TN_9570,0.155419
GemmTunableOp_Half_TN,tn_28672_6997_4096,Gemm_Hipblaslt_TN_9919,2.85821
GemmTunableOp_Half_TN,tn_28672_1850_4096,Gemm_Hipblaslt_TN_9684,0.798595
GemmTunableOp_Half_TN,tn_6144_168_4096,Gemm_Rocblas_621294168,0.0280246
GemmTunableOp_Half_TN,tn_28672_1887_4096,Gemm_Hipblaslt_TN_9832,0.808455
GemmTunableOp_Half_TN,tn_4096_5274_4096,Gemm_Hipblaslt_TN_9691,0.321623
GemmTunableOp_Half_TN,tn_4096_7033_14336,Gemm_Hipblaslt_TN_9743,1.42273
GemmTunableOp_Half_TN,tn_6144_6996_4096,Gemm_Hipblaslt_TN_9743,0.590893
GemmTunableOp_Half_TN,tn_4096_6997_14336,Gemm_Hipblaslt_TN_9743,1.41642
GemmTunableOp_Half_TN,tn_10240_4033_8192,Gemm_Hipblaslt_TN_9814,1.13851
GemmTunableOp_Half_TN,tn_4096_3647_14336,Gemm_Hipblaslt_TN_9743,0.697825
GemmTunableOp_Half_TN,tn_4096_1815_4096,Gemm_Hipblaslt_TN_9645,0.118337
GemmTunableOp_Half_TN,tn_28672_3583_4096,Gemm_Hipblaslt_TN_9827,1.37435
GemmTunableOp_Half_TN,tn_4096_7104_14336,Gemm_Hipblaslt_TN_9814,1.42732
GemmTunableOp_Half_TN,tn_6144_1762_4096,Gemm_Hipblaslt_TN_9672,0.164184
GemmTunableOp_Half_TN,tn_4096_3466_4096,Gemm_Hipblaslt_TN_9743,0.198736
GemmTunableOp_Half_TN,tn_6144_1794_4096,Gemm_Hipblaslt_TN_9691,0.164624
GemmTunableOp_Half_TN,tn_28672_7077_4096,Gemm_Hipblaslt_TN_9812,2.87813
GemmTunableOp_Half_TN,tn_57344_2097_8192,Gemm_Rocblas_621294543,3.92676
GemmTunableOp_Half_TN,tn_6144_6870_4096,Gemm_Hipblaslt_TN_9743,0.584186
GemmTunableOp_Half_TN,tn_4096_7109_4096,Gemm_Hipblaslt_TN_9743,0.407114
GemmTunableOp_Half_TN,tn_4096_3526_14336,Gemm_Hipblaslt_TN_9743,0.685645
GemmTunableOp_Half_TN,tn_4096_7344_4096,Gemm_Hipblaslt_TN_9933,0.423718
GemmTunableOp_Half_TN,tn_4096_3441_14336,Gemm_Hipblaslt_TN_9677,0.67169
GemmTunableOp_Half_TN,tn_6144_1682_4096,Gemm_Rocblas_621294495,0.155413
GemmTunableOp_Half_TN,tn_6144_3520_4096,Gemm_Hipblaslt_TN_9570,0.317457
GemmTunableOp_Half_TN,tn_128256_87_4096,Gemm_Hipblaslt_TN_9057,0.389248
GemmTunableOp_Half_TN,tn_6144_1945_4096,Gemm_Hipblaslt_TN_9697,0.177474
GemmTunableOp_Half_TN,tn_28672_48_4096,Gemm_Hipblaslt_TN_9532,0.0484523
GemmTunableOp_Half_TN,tn_4096_5533_4096,Gemm_Hipblaslt_TN_9689,0.33547
GemmTunableOp_Half_TN,tn_4096_1863_4096,Gemm_Hipblaslt_TN_9134,0.120334
GemmTunableOp_Half_TN,tn_28672_1699_4096,Gemm_Hipblaslt_TN_9223,0.727303
GemmTunableOp_Half_TN,tn_4096_1889_14336,Gemm_Hipblaslt_TN_9645,0.415592
GemmTunableOp_Half_TN,tn_4096_7579_4096,Gemm_Rocblas_621294127,0.432892
GemmTunableOp_Half_TN,tn_8192_2289_8192,Gemm_Hipblaslt_TN_9763,0.517385
GemmTunableOp_Half_TN,tn_4096_3468_4096,Gemm_Hipblaslt_TN_9743,0.198994
GemmTunableOp_Half_TN,tn_4096_7225_14336,Gemm_Hipblaslt_TN_9732,1.45396
GemmTunableOp_Half_TN,tn_4096_1884_14336,Gemm_Hipblaslt_TN_9620,0.416209
GemmTunableOp_Half_TN,tn_4096_1779_4096,Gemm_Hipblaslt_TN_9645,0.116837
GemmTunableOp_Half_TN,tn_4096_1772_14336,Gemm_Hipblaslt_TN_9645,0.395589
GemmTunableOp_Half_TN,tn_128256_181_4096,Gemm_Hipblaslt_TN_9952,0.520856
GemmTunableOp_Half_TN,tn_28672_7196_4096,Gemm_Hipblaslt_TN_159,2.89298
GemmTunableOp_Half_TN,tn_6144_1665_4096,Gemm_Hipblaslt_TN_9570,0.15303
GemmTunableOp_Half_TN,tn_28672_3373_4096,Gemm_Hipblaslt_TN_9827,1.34995
GemmTunableOp_Half_TN,tn_6144_7136_4096,Gemm_Hipblaslt_TN_9743,0.601624
GemmTunableOp_Half_TN,tn_28672_16_4096,Gemm_Rocblas_621294053,0.0447139
GemmTunableOp_Half_TN,tn_4096_5196_4096,Gemm_Rocblas_621294320,0.320324
GemmTunableOp_Half_TN,tn_28672_7206_4096,Gemm_Hipblaslt_TN_159,2.89725
GemmTunableOp_Half_TN,tn_6144_3369_4096,Gemm_Hipblaslt_TN_9570,0.304584
GemmTunableOp_Half_TN,tn_4096_208_4096,Gemm_Rocblas_621286443,0.0251423
GemmTunableOp_Half_TN,tn_128256_53_4096,Gemm_Hipblaslt_TN_9097,0.353822
GemmTunableOp_Half_TN,tn_6144_5352_4096,Gemm_Hipblaslt_TN_9933,0.446255
GemmTunableOp_Half_TN,tn_6144_1908_4096,Gemm_Hipblaslt_TN_9690,0.168988
GemmTunableOp_Half_TN,tn_4096_6747_14336,Gemm_Hipblaslt_TN_9743,1.37721
GemmTunableOp_Half_TN,tn_4096_3427_4096,Gemm_Hipblaslt_TN_9187,0.196178
GemmTunableOp_Half_TN,tn_6144_3722_4096,Gemm_Hipblaslt_TN_9691,0.336111
GemmTunableOp_Half_TN,tn_4096_3688_14336,Gemm_Hipblaslt_TN_9827,0.7214
GemmTunableOp_Half_TN,tn_28672_7047_4096,Gemm_Hipblaslt_TN_9898,2.87168
GemmTunableOp_Half_TN,tn_6144_3640_4096,Gemm_Rocblas_621286753,0.322043
GemmTunableOp_Half_TN,tn_28672_1953_4096,Gemm_Hipblaslt_TN_9846,0.844266
GemmTunableOp_Half_TN,tn_28672_1682_4096,Gemm_Hipblaslt_TN_9217,0.729463
GemmTunableOp_Half_TN,tn_28672_3300_4096,Gemm_Hipblaslt_TN_9827,1.36278
GemmTunableOp_Half_TN,tn_28672_5530_4096,Gemm_Hipblaslt_TN_9924,2.32543
GemmTunableOp_Half_TN,tn_4096_136_4096,Gemm_Hipblaslt_TN_9474,0.021547
GemmTunableOp_Half_TN,tn_4096_7730_14336,Gemm_Hipblaslt_TN_9749,1.58871
GemmTunableOp_Half_TN,tn_6144_3564_4096,Gemm_Rocblas_621286753,0.319807
GemmTunableOp_Half_TN,tn_4096_3691_14336,Gemm_Hipblaslt_TN_9827,0.726046
GemmTunableOp_Half_TN,tn_128256_204_4096,Gemm_Hipblaslt_TN_9847,0.568499
GemmTunableOp_Half_TN,tn_28672_3497_4096,Gemm_Hipblaslt_TN_9827,1.37571
GemmTunableOp_Half_TN,tn_4096_5319_14336,Gemm_Hipblaslt_TN_9799,1.12327
GemmTunableOp_Half_TN,tn_28672_3379_4096,Gemm_Hipblaslt_TN_9827,1.35658
GemmTunableOp_Half_TN,tn_28672_1792_4096,Gemm_Rocblas_621294420,0.739816
GemmTunableOp_Half_TN,tn_6144_216_4096,Gemm_Hipblaslt_TN_9495,0.0328811
GemmTunableOp_Half_TN,tn_4096_3478_14336,Gemm_Hipblaslt_TN_9192,0.688003
GemmTunableOp_Half_TN,tn_28672_5277_4096,Gemm_Hipblaslt_TN_159,2.16099
GemmTunableOp_Half_TN,tn_4096_24_4096,Gemm_Rocblas_621286330,0.0113992
GemmTunableOp_Half_TN,tn_6144_1854_4096,Gemm_Rocblas_621294425,0.164149
GemmTunableOp_Half_TN,tn_28672_1908_4096,Gemm_Hipblaslt_TN_9832,0.81021
GemmTunableOp_Half_TN,tn_28672_144_4096,Gemm_Hipblaslt_TN_9370,0.0865182
GemmTunableOp_Half_TN,tn_28672_1877_4096,Gemm_Hipblaslt_TN_9832,0.808904
GemmTunableOp_Half_TN,tn_4096_1796_14336,Gemm_Hipblaslt_TN_9680,0.406435
GemmTunableOp_Half_TN,tn_4096_3691_4096,Gemm_Hipblaslt_TN_9768,0.214739
GemmTunableOp_Half_TN,tn_28672_6761_4096,Gemm_Hipblaslt_TN_9939,2.81572
GemmTunableOp_Half_TN,tn_4096_1936_4096,Gemm_Hipblaslt_TN_9680,0.124177
GemmTunableOp_Half_TN,tn_4096_1872_4096,Gemm_Hipblaslt_TN_9645,0.120694
GemmTunableOp_Half_TN,tn_4096_7206_4096,Gemm_Hipblaslt_TN_9743,0.409389
GemmTunableOp_Half_TN,tn_4096_1749_14336,Gemm_Hipblaslt_TN_9645,0.392751
GemmTunableOp_Half_TN,tn_57344_4050_8192,Gemm_Hipblaslt_TN_9758,6.66123
GemmTunableOp_Half_TN,tn_4096_3584_4096,Gemm_Hipblaslt_TN_9743,0.200261
GemmTunableOp_Half_TN,tn_10240_4017_8192,Gemm_Hipblaslt_TN_9743,1.11895
GemmTunableOp_Half_TN,tn_128256_196_4096,Gemm_Hipblaslt_TN_9847,0.560058
GemmTunableOp_Half_TN,tn_28672_5413_4096,Gemm_Hipblaslt_TN_9852,2.2769
GemmTunableOp_Half_TN,tn_28672_6952_4096,Gemm_Hipblaslt_TN_9919,2.86537
GemmTunableOp_Half_TN,tn_4096_1670_4096,Gemm_Hipblaslt_TN_9671,0.107435
GemmTunableOp_Half_TN,tn_6144_6761_4096,Gemm_Hipblaslt_TN_9697,0.58595
GemmTunableOp_Half_TN,tn_4096_1600_4096,Gemm_Hipblaslt_TN_9359,0.102488
GemmTunableOp_Half_TN,tn_4096_160_4096,Gemm_Rocblas_621286491,0.0227437
GemmTunableOp_Half_TN,tn_28672_6789_4096,Gemm_Hipblaslt_TN_9958,2.80498
GemmTunableOp_Half_TN,tn_4096_3456_4096,Gemm_Rocblas_621286743,0.194831
GemmTunableOp_Half_TN,tn_28672_1589_4096,Gemm_Hipblaslt_TN_9674,0.708085
GemmTunableOp_Half_TN,tn_6144_176_4096,Gemm_Rocblas_621286440,0.0281031
GemmTunableOp_Half_TN,tn_28672_1774_4096,Gemm_Hipblaslt_TN_9223,0.739627
GemmTunableOp_Half_TN,tn_8192_2158_28672,Gemm_Hipblaslt_TN_9763,2.06458
GemmTunableOp_Half_TN,tn_28672_3622_4096,Gemm_Hipblaslt_TN_9832,1.47672
GemmTunableOp_Half_TN,tn_4096_1607_4096,Gemm_Hipblaslt_TN_9607,0.105485
GemmTunableOp_Half_TN,tn_4096_88_4096,Gemm_Rocblas_621286280,0.0154214
GemmTunableOp_Half_TN,tn_4096_1786_14336,Gemm_Hipblaslt_TN_9645,0.394892
GemmTunableOp_Half_TN,tn_4096_1769_4096,Gemm_Hipblaslt_TN_9134,0.11619
GemmTunableOp_Half_TN,tn_4096_7047_4096,Gemm_Hipblaslt_TN_9814,0.401968
GemmTunableOp_Half_TN,tn_4096_1840_14336,Gemm_Hipblaslt_TN_9645,0.412143
GemmTunableOp_Half_TN,tn_4096_6976_4096,Gemm_Hipblaslt_TN_9743,0.401867
GemmTunableOp_Half_TN,tn_4096_1703_4096,Gemm_Hipblaslt_TN_9569,0.107165
GemmTunableOp_Half_TN,tn_4096_3553_14336,Gemm_Hipblaslt_TN_9743,0.692643
GemmTunableOp_Half_TN,tn_6144_3583_4096,Gemm_Rocblas_621286753,0.322254
GemmTunableOp_Half_TN,tn_28672_3535_4096,Gemm_Hipblaslt_TN_9827,1.38423
GemmTunableOp_Half_TN,tn_4096_6902_4096,Gemm_Hipblaslt_TN_9695,0.398578
GemmTunableOp_Half_TN,tn_4096_1667_4096,Gemm_Hipblaslt_TN_9265,0.107381
GemmTunableOp_Half_TN,tn_6144_6990_4096,Gemm_Hipblaslt_TN_9743,0.59748
GemmTunableOp_Half_TN,tn_4096_5196_14336,Gemm_Hipblaslt_TN_9924,1.09135
GemmTunableOp_Half_TN,tn_8192_65_8192,Gemm_Hipblaslt_TN_7093,0.0432796
GemmTunableOp_Half_TN,tn_128256_239_4096,Gemm_Rocblas_621294634,0.606734
GemmTunableOp_Half_TN,tn_4096_1935_4096,Gemm_Hipblaslt_TN_9645,0.122712
GemmTunableOp_Half_TN,tn_6144_1680_4096,Gemm_Rocblas_621286753,0.15544
GemmTunableOp_Half_TN,tn_28672_1928_4096,Gemm_Hipblaslt_TN_9846,0.833492
GemmTunableOp_Half_TN,tn_28672_7138_4096,Gemm_Hipblaslt_TN_9892,2.89969
GemmTunableOp_Half_TN,tn_6144_88_4096,Gemm_Rocblas_621286279,0.018881
GemmTunableOp_Half_TN,tn_4096_3416_14336,Gemm_Hipblaslt_TN_9189,0.669331
GemmTunableOp_Half_TN,tn_8192_68_8192,Gemm_Hipblaslt_TN_7093,0.0442702
GemmTunableOp_Half_TN,tn_28672_1794_4096,Gemm_Hipblaslt_TN_9684,0.794498
GemmTunableOp_Half_TN,tn_128256_135_4096,Gemm_Hipblaslt_TN_9108,0.469129
GemmTunableOp_Half_TN,tn_4096_1691_14336,Gemm_Hipblaslt_TN_9265,0.367106
GemmTunableOp_Half_TN,tn_128256_9_4096,Gemm_Hipblaslt_TN_9405,0.286475
GemmTunableOp_Half_TN,tn_28672_3574_4096,Gemm_Hipblaslt_TN_9841,1.38991
GemmTunableOp_Half_TN,tn_4096_1682_14336,Gemm_Hipblaslt_TN_9679,0.367939
GemmTunableOp_Half_TN,tn_6144_3793_4096,Gemm_Hipblaslt_TN_9690,0.337989
GemmTunableOp_Half_TN,tn_4096_1689_4096,Gemm_Hipblaslt_TN_9265,0.108659
GemmTunableOp_Half_TN,tn_4096_6996_4096,Gemm_Hipblaslt_TN_9743,0.398041
GemmTunableOp_Half_TN,tn_4096_3793_14336,Gemm_Hipblaslt_TN_9827,0.734705
GemmTunableOp_Half_TN,tn_28672_1860_4096,Gemm_Hipblaslt_TN_9832,0.803233
GemmTunableOp_Half_TN,tn_4096_1728_14336,Gemm_Hipblaslt_TN_9265,0.372976
GemmTunableOp_Half_TN,tn_6144_1767_4096,Gemm_Hipblaslt_TN_9691,0.163306
GemmTunableOp_Half_TN,tn_4096_6965_4096,Gemm_Hipblaslt_TN_9743,0.398275
GemmTunableOp_Half_TN,tn_128256_54_4096,Gemm_Hipblaslt_TN_9057,0.359166
GemmTunableOp_Half_TN,tn_6144_1831_4096,Gemm_Hipblaslt_TN_9799,0.165968
GemmTunableOp_Half_TN,tn_4096_3630_14336,Gemm_Hipblaslt_TN_9743,0.696221
GemmTunableOp_Half_TN,tn_28672_3553_4096,Gemm_Hipblaslt_TN_9827,1.38094
GemmTunableOp_Half_TN,tn_4096_7575_4096,Gemm_Hipblaslt_TN_9853,0.435968
GemmTunableOp_Half_TN,tn_4096_5570_4096,Gemm_Rocblas_621286580,0.331793
GemmTunableOp_Half_TN,tn_4096_1648_4096,Gemm_Hipblaslt_TN_9671,0.105817
GemmTunableOp_Half_TN,tn_6144_1757_4096,Gemm_Hipblaslt_TN_9691,0.15977
GemmTunableOp_Half_TN,tn_4096_1762_14336,Gemm_Hipblaslt_TN_9645,0.393688
GemmTunableOp_Half_TN,tn_6144_7196_4096,Gemm_Hipblaslt_TN_9743,0.607372
GemmTunableOp_Half_TN,tn_4096_120_4096,Gemm_Rocblas_621286279,0.0173327
GemmTunableOp_Half_TN,tn_4096_7093_4096,Gemm_Hipblaslt_TN_9694,0.403655
GemmTunableOp_Half_TN,tn_6144_1603_4096,Gemm_Hipblaslt_TN_9570,0.148857
GemmTunableOp_Half_TN,tn_6144_1717_4096,Gemm_Hipblaslt_TN_9690,0.157529
GemmTunableOp_Half_TN,tn_28672_3647_4096,Gemm_Hipblaslt_TN_9832,1.47675
GemmTunableOp_Half_TN,tn_28672_5067_4096,Gemm_Hipblaslt_TN_9951,2.09054
GemmTunableOp_Half_TN,tn_6144_1774_4096,Gemm_Hipblaslt_TN_9691,0.164088
GemmTunableOp_Half_TN,tn_6144_1772_4096,Gemm_Hipblaslt_TN_9691,0.163652
GemmTunableOp_Half_TN,tn_6144_7552_4096,Gemm_Hipblaslt_TN_9655,0.648864
GemmTunableOp_Half_TN,tn_4096_3912_4096,Gemm_Hipblaslt_TN_9827,0.220683
GemmTunableOp_Half_TN,tn_4096_7196_4096,Gemm_Hipblaslt_TN_9743,0.412986
GemmTunableOp_Half_TN,tn_4096_3401_4096,Gemm_Hipblaslt_TN_9221,0.196095
GemmTunableOp_Half_TN,tn_28672_1663_4096,Gemm_Hipblaslt_TN_9217,0.722236
GemmTunableOp_Half_TN,tn_4096_5735_4096,Gemm_Hipblaslt_TN_9852,0.339779
GemmTunableOp_Half_TN,tn_128256_98_4096,Gemm_Rocblas_621294762,0.420342
GemmTunableOp_Half_TN,tn_28672_5495_4096,Gemm_Hipblaslt_TN_9840,2.31579
GemmTunableOp_Half_TN,tn_6144_3416_4096,Gemm_Hipblaslt_TN_9570,0.306681
GemmTunableOp_Half_TN,tn_28672_5570_4096,Gemm_Hipblaslt_TN_9840,2.33093
GemmTunableOp_Half_TN,tn_4096_3666_14336,Gemm_Hipblaslt_TN_9827,0.722717
GemmTunableOp_Half_TN,tn_28672_1633_4096,Gemm_Rocblas_621294420,0.71794
GemmTunableOp_Half_TN,tn_6144_5067_4096,Gemm_Hipblaslt_TN_9746,0.436819
GemmTunableOp_Half_TN,tn_6144_5125_4096,Gemm_Hipblaslt_TN_9704,0.436807
GemmTunableOp_Half_TN,tn_128256_33_4096,Gemm_Hipblaslt_TN_9451,0.324955
GemmTunableOp_Half_TN,tn_28672_1839_4096,Gemm_Hipblaslt_TN_9684,0.797609
GemmTunableOp_Half_TN,tn_4096_3564_4096,Gemm_Hipblaslt_TN_9743,0.201208
GemmTunableOp_Half_TN,tn_4096_6871_4096,Gemm_Hipblaslt_TN_9743,0.391698
GemmTunableOp_Half_TN,tn_28672_1881_4096,Gemm_Hipblaslt_TN_9832,0.805154
GemmTunableOp_Half_TN,tn_4096_1710_4096,Gemm_Hipblaslt_TN_9679,0.108915
GemmTunableOp_Half_TN,tn_4096_3535_4096,Gemm_Hipblaslt_TN_9743,0.200568
GemmTunableOp_Half_TN,tn_4096_6708_4096,Gemm_Hipblaslt_TN_9743,0.384567
GemmTunableOp_Half_TN,tn_128256_100_4096,Gemm_Rocblas_621294762,0.420401
GemmTunableOp_Half_TN,tn_4096_7182_14336,Gemm_Hipblaslt_TN_9732,1.44966
GemmTunableOp_Half_TN,tn_4096_5157_4096,Gemm_Hipblaslt_TN_9691,0.318445
GemmTunableOp_Half_TN,tn_4096_3855_4096,Gemm_Hipblaslt_TN_9704,0.22003
GemmTunableOp_Half_TN,tn_4096_3764_4096,Gemm_Hipblaslt_TN_9827,0.216199
GemmTunableOp_Half_TN,tn_6144_1830_4096,Gemm_Rocblas_621286684,0.165347
GemmTunableOp_Half_TN,tn_28672_5273_4096,Gemm_Hipblaslt_TN_159,2.15816
GemmTunableOp_Half_TN,tn_6144_1573_4096,Gemm_Rocblas_621286565,0.147411
GemmTunableOp_Half_TN,tn_6144_3494_4096,Gemm_Rocblas_621286753,0.318529
GemmTunableOp_Half_TN,tn_28672_3455_4096,Gemm_Hipblaslt_TN_9827,1.36562
GemmTunableOp_Half_TN,tn_6144_1752_4096,Gemm_Hipblaslt_TN_9799,0.159989
GemmTunableOp_Half_TN,tn_4096_1784_14336,Gemm_Hipblaslt_TN_9645,0.399302
GemmTunableOp_Half_TN,tn_6144_1801_4096,Gemm_Rocblas_621294426,0.165401
GemmTunableOp_Half_TN,tn_4096_1846_14336,Gemm_Hipblaslt_TN_9620,0.413724
GemmTunableOp_Half_TN,tn_6144_7050_4096,Gemm_Hipblaslt_TN_9677,0.598696
GemmTunableOp_Half_TN,tn_4096_1704_4096,Gemm_Hipblaslt_TN_9265,0.106731
GemmTunableOp_Half_TN,tn_4096_7182_4096,Gemm_Hipblaslt_TN_9743,0.410269
GemmTunableOp_Half_TN,tn_28672_5357_4096,Gemm_Hipblaslt_TN_159,2.18015
GemmTunableOp_Half_TN,tn_28672_5271_4096,Gemm_Hipblaslt_TN_9890,2.15983
GemmTunableOp_Half_TN,tn_4096_1698_4096,Gemm_Hipblaslt_TN_9679,0.105184
GemmTunableOp_Half_TN,tn_4096_1703_14336,Gemm_Hipblaslt_TN_9671,0.368723
GemmTunableOp_Half_TN,tn_28672_1733_4096,Gemm_Hipblaslt_TN_9223,0.735594
GemmTunableOp_Half_TN,tn_4096_1689_14336,Gemm_Hipblaslt_TN_9790,0.368886
GemmTunableOp_Half_TN,tn_4096_1778_4096,Gemm_Hipblaslt_TN_9134,0.117058
GemmTunableOp_Half_TN,tn_4096_6881_4096,Gemm_Hipblaslt_TN_9221,0.398446
GemmTunableOp_Half_TN,tn_10240_2192_8192,Gemm_Rocblas_621294320,0.644668
GemmTunableOp_Half_TN,tn_6144_1934_4096,Gemm_Rocblas_621286747,0.176341
GemmTunableOp_Half_TN,tn_8192_2366_28672,Gemm_Hipblaslt_TN_9771,2.30128
GemmTunableOp_Half_TN,tn_4096_1877_14336,Gemm_Hipblaslt_TN_9645,0.413891
GemmTunableOp_Half_TN,tn_6144_7262_4096,Gemm_Hipblaslt_TN_9697,0.610223
GemmTunableOp_Half_TN,tn_4096_1827_4096,Gemm_Hipblaslt_TN_9645,0.119446
GemmStridedBatchedTunableOp_Half_TN,tn_1757_1757_128_B_32,Gemm_Rocblas_621286397,0.126966
GemmStridedBatchedTunableOp_Half_TN,tn_1871_1871_128_B_32,Gemm_Hipblaslt_TN_6942,0.146722
GemmStridedBatchedTunableOp_Half_TN,tn_1733_1733_128_B_32,Gemm_Rocblas_621286397,0.124972
GemmStridedBatchedTunableOp_Half_TN,tn_1594_1594_128_B_32,Gemm_Rocblas_621286397,0.111188
GemmStridedBatchedTunableOp_Half_TN,tn_1659_1659_128_B_32,Gemm_Rocblas_621286397,0.117278
GemmStridedBatchedTunableOp_Half_TN,tn_1731_1731_128_B_32,Gemm_Rocblas_621286397,0.125715
GemmStridedBatchedTunableOp_Half_TN,tn_1660_1660_128_B_32,Gemm_Rocblas_621286397,0.115781
GemmStridedBatchedTunableOp_Half_TN,tn_1954_1954_128_B_32,Gemm_Rocblas_621286397,0.15644
GemmStridedBatchedTunableOp_Half_TN,tn_1948_1948_128_B_32,Gemm_Rocblas_621294533,0.154613
GemmStridedBatchedTunableOp_Half_TN,tn_1878_1878_128_B_32,Gemm_Hipblaslt_TN_6942,0.143888
GemmStridedBatchedTunableOp_Half_TN,tn_1649_1649_128_B_32,Gemm_Rocblas_621286397,0.116797
GemmStridedBatchedTunableOp_Half_TN,tn_1745_1745_128_B_32,Gemm_Rocblas_621286397,0.125757
GemmStridedBatchedTunableOp_Half_TN,tn_1943_1943_128_B_32,Gemm_Rocblas_621286397,0.157395
GemmStridedBatchedTunableOp_Half_TN,tn_1841_1841_128_B_32,Gemm_Hipblaslt_TN_6942,0.143155
GemmStridedBatchedTunableOp_Half_TN,tn_1625_1625_128_B_32,Gemm_Rocblas_621286397,0.114004
GemmStridedBatchedTunableOp_Half_TN,tn_1866_1866_128_B_32,Gemm_Hipblaslt_TN_6942,0.143099
GemmStridedBatchedTunableOp_Half_TN,tn_1736_1736_128_B_32,Gemm_Rocblas_621294106,0.121444
GemmStridedBatchedTunableOp_Half_TN,tn_1748_1748_128_B_32,Gemm_Rocblas_621286397,0.12407
GemmStridedBatchedTunableOp_Half_TN,tn_1861_1861_128_B_32,Gemm_Hipblaslt_TN_6942,0.145696
GemmStridedBatchedTunableOp_Half_TN,tn_1816_1816_128_B_32,Gemm_Hipblaslt_TN_157,0.131039
GemmStridedBatchedTunableOp_Half_TN,tn_1931_1931_128_B_32,Gemm_Rocblas_621286397,0.155425
GemmStridedBatchedTunableOp_Half_TN,tn_1707_1707_128_B_32,Gemm_Rocblas_621286397,0.121
GemmStridedBatchedTunableOp_Half_TN,tn_1735_1735_128_B_32,Gemm_Rocblas_621286397,0.125072
GemmStridedBatchedTunableOp_Half_TN,tn_1811_1811_128_B_32,Gemm_Rocblas_621286397,0.138745
GemmStridedBatchedTunableOp_Half_TN,tn_1717_1717_128_B_32,Gemm_Rocblas_621286397,0.12011
GemmStridedBatchedTunableOp_Half_TN,tn_1663_1663_128_B_32,Gemm_Rocblas_621286397,0.118106
GemmStridedBatchedTunableOp_Half_TN,tn_1654_1654_128_B_32,Gemm_Rocblas_621286397,0.11658
GemmStridedBatchedTunableOp_Half_TN,tn_1674_1674_128_B_32,Gemm_Rocblas_621286397,0.117284
GemmStridedBatchedTunableOp_Half_TN,tn_1810_1810_128_B_32,Gemm_Rocblas_621286397,0.139571
GemmStridedBatchedTunableOp_Half_TN,tn_1941_1941_128_B_32,Gemm_Rocblas_621286397,0.155616
GemmStridedBatchedTunableOp_Half_TN,tn_1968_1968_128_B_32,Gemm_Hipblaslt_TN_153,0.150447
GemmStridedBatchedTunableOp_Half_TN,tn_1700_1700_128_B_32,Gemm_Rocblas_621294110,0.119132
GemmStridedBatchedTunableOp_Half_TN,tn_1904_1904_128_B_32,Gemm_Hipblaslt_TN_157,0.135694
GemmStridedBatchedTunableOp_Half_TN,tn_1891_1891_128_B_32,Gemm_Hipblaslt_TN_6942,0.148549
GemmStridedBatchedTunableOp_Half_TN,tn_1668_1668_128_B_32,Gemm_Rocblas_621286397,0.116522
GemmStridedBatchedTunableOp_Half_TN,tn_1607_1607_128_B_32,Gemm_Hipblaslt_TN_6871,0.11516
GemmStridedBatchedTunableOp_Half_TN,tn_1955_1955_128_B_32,Gemm_Rocblas_621294533,0.158562
GemmStridedBatchedTunableOp_Half_TN,tn_1593_1593_128_B_32,Gemm_Hipblaslt_TN_6939,0.111092
GemmStridedBatchedTunableOp_Half_TN,tn_2207_2207_128_B_64,Gemm_Rocblas_621294106,0.402344
GemmStridedBatchedTunableOp_Half_TN,tn_1960_1960_128_B_32,Gemm_Hipblaslt_TN_157,0.151573
GemmStridedBatchedTunableOp_Half_TN,tn_1839_1839_128_B_32,Gemm_Hipblaslt_TN_6942,0.141063
GemmStridedBatchedTunableOp_Half_TN,tn_1879_1879_128_B_32,Gemm_Hipblaslt_TN_6942,0.149326
GemmStridedBatchedTunableOp_Half_TN,tn_1604_1604_128_B_32,Gemm_Rocblas_621286397,0.111138
GemmStridedBatchedTunableOp_Half_TN,tn_1847_1847_128_B_32,Gemm_Hipblaslt_TN_6942,0.144484
GemmStridedBatchedTunableOp_Half_TN,tn_1741_1741_128_B_32,Gemm_Rocblas_621286397,0.125746
GemmStridedBatchedTunableOp_Half_TN,tn_1798_1798_128_B_32,Gemm_Rocblas_621286397,0.135581
GemmStridedBatchedTunableOp_Half_TN,tn_2238_2238_128_B_64,Gemm_Rocblas_621294533,0.405585
GemmStridedBatchedTunableOp_Half_TN,tn_1684_1684_128_B_32,Gemm_Rocblas_621286397,0.117506
GemmStridedBatchedTunableOp_Half_TN,tn_2321_2321_128_B_64,Gemm_Rocblas_621294106,0.451047
GemmStridedBatchedTunableOp_Half_TN,tn_1863_1863_128_B_32,Gemm_Hipblaslt_TN_6942,0.147003
GemmStridedBatchedTunableOp_Half_TN,tn_1827_1827_128_B_32,Gemm_Hipblaslt_TN_6942,0.139896
GemmStridedBatchedTunableOp_Half_TN,tn_1692_1692_128_B_32,Gemm_Rocblas_621294110,0.119778
GemmStridedBatchedTunableOp_Half_TN,tn_1742_1742_128_B_32,Gemm_Rocblas_621294106,0.126316
GemmStridedBatchedTunableOp_Half_TN,tn_2315_2315_128_B_64,Gemm_Rocblas_621294106,0.442228
GemmStridedBatchedTunableOp_Half_TN,tn_1778_1778_128_B_32,Gemm_Rocblas_621294106,0.131265
GemmStridedBatchedTunableOp_Half_TN,tn_1801_1801_128_B_32,Gemm_Hipblaslt_TN_6942,0.139525
GemmStridedBatchedTunableOp_Half_TN,tn_2158_2158_128_B_64,Gemm_Hipblaslt_TN_158,0.365587
GemmStridedBatchedTunableOp_Half_TN,tn_1638_1638_128_B_32,Gemm_Rocblas_621286397,0.115766
GemmStridedBatchedTunableOp_Half_TN,tn_2302_2302_128_B_64,Gemm_Rocblas_621294106,0.421555
GemmStridedBatchedTunableOp_Half_TN,tn_2415_2415_128_B_64,Gemm_Rocblas_621294106,0.476439
GemmStridedBatchedTunableOp_Half_TN,tn_1655_1655_128_B_32,Gemm_Hipblaslt_TN_6942,0.118439
GemmStridedBatchedTunableOp_Half_TN,tn_1713_1713_128_B_32,Gemm_Rocblas_621286413,0.123022
GemmStridedBatchedTunableOp_Half_TN,tn_1963_1963_128_B_32,Gemm_Rocblas_621286397,0.155692
GemmStridedBatchedTunableOp_Half_TN,tn_1833_1833_128_B_32,Gemm_Hipblaslt_TN_6942,0.143821
GemmStridedBatchedTunableOp_Half_TN,tn_1896_1896_128_B_32,Gemm_Hipblaslt_TN_153,0.136839
GemmStridedBatchedTunableOp_Half_TN,tn_2369_2369_128_B_64,Gemm_Rocblas_621294106,0.465598
GemmStridedBatchedTunableOp_Half_TN,tn_1771_1771_128_B_32,Gemm_Rocblas_621286397,0.130976
GemmStridedBatchedTunableOp_Half_TN,tn_2305_2305_128_B_64,Gemm_Rocblas_621294106,0.44448
GemmStridedBatchedTunableOp_Half_TN,tn_1763_1763_128_B_32,Gemm_Rocblas_621286397,0.127854
GemmStridedBatchedTunableOp_Half_TN,tn_1600_1600_128_B_32,Gemm_Rocblas_621286397,0.101304
GemmStridedBatchedTunableOp_Half_TN,tn_1718_1718_128_B_32,Gemm_Rocblas_621286413,0.121321
GemmStridedBatchedTunableOp_Half_TN,tn_1832_1832_128_B_32,Gemm_Hipblaslt_TN_157,0.132547
GemmStridedBatchedTunableOp_Half_TN,tn_1602_1602_128_B_32,Gemm_Hipblaslt_TN_6942,0.110699
GemmStridedBatchedTunableOp_Half_TN,tn_1608_1608_128_B_32,Gemm_Rocblas_621286412,0.110142
GemmStridedBatchedTunableOp_Half_TN,tn_1984_1984_128_B_32,Gemm_Hipblaslt_TN_150,0.149408
GemmStridedBatchedTunableOp_Half_TN,tn_2284_2284_128_B_64,Gemm_Rocblas_621294106,0.417884
GemmStridedBatchedTunableOp_Half_TN,tn_1923_1923_128_B_32,Gemm_Hipblaslt_TN_6879,0.152284
GemmStridedBatchedTunableOp_Half_TN,tn_1724_1724_128_B_32,Gemm_Rocblas_621286413,0.123337
GemmStridedBatchedTunableOp_Half_TN,tn_1930_1930_128_B_32,Gemm_Hipblaslt_TN_6879,0.152151
GemmStridedBatchedTunableOp_Half_TN,tn_1914_1914_128_B_32,Gemm_Rocblas_621286397,0.148148
GemmStridedBatchedTunableOp_Half_TN,tn_1922_1922_128_B_32,Gemm_Rocblas_621286397,0.151034
GemmStridedBatchedTunableOp_Half_TN,tn_1855_1855_128_B_32,Gemm_Hipblaslt_TN_6942,0.143592
GemmStridedBatchedTunableOp_Half_TN,tn_2112_2112_128_B_64,Gemm_Hipblaslt_TN_9846,0.324659
GemmStridedBatchedTunableOp_Half_TN,tn_1644_1644_128_B_32,Gemm_Hipblaslt_TN_6942,0.11453
GemmStridedBatchedTunableOp_Half_TN,tn_1946_1946_128_B_32,Gemm_Rocblas_621294533,0.155616
GemmStridedBatchedTunableOp_Half_TN,tn_2065_2065_128_B_64,Gemm_Rocblas_621294106,0.356806
GemmStridedBatchedTunableOp_Half_TN,tn_1725_1725_128_B_32,Gemm_Hipblaslt_TN_6942,0.123807
GemmStridedBatchedTunableOp_Half_TN,tn_1752_1752_128_B_32,Gemm_Rocblas_621294108,0.122938
GemmStridedBatchedTunableOp_Half_TN,tn_1844_1844_128_B_32,Gemm_Hipblaslt_TN_6942,0.140566
GemmStridedBatchedTunableOp_Half_TN,tn_1591_1591_128_B_32,Gemm_Rocblas_621286397,0.111696
GemmStridedBatchedTunableOp_Half_TN,tn_1651_1651_128_B_32,Gemm_Hipblaslt_TN_6942,0.117738
GemmStridedBatchedTunableOp_Half_TN,tn_1764_1764_128_B_32,Gemm_Rocblas_621294106,0.126911
GemmStridedBatchedTunableOp_Half_TN,tn_1815_1815_128_B_32,Gemm_Hipblaslt_TN_6942,0.139008
GemmStridedBatchedTunableOp_Half_TN,tn_1628_1628_128_B_32,Gemm_Rocblas_621286397,0.108959
GemmStridedBatchedTunableOp_Half_TN,tn_1597_1597_128_B_32,Gemm_Hipblaslt_TN_6895,0.111097
GemmStridedBatchedTunableOp_Half_TN,tn_2049_2049_128_B_64,Gemm_Rocblas_621294106,0.347952
GemmStridedBatchedTunableOp_Half_TN,tn_1845_1845_128_B_32,Gemm_Hipblaslt_TN_6942,0.142771
GemmStridedBatchedTunableOp_Half_TN,tn_1906_1906_128_B_32,Gemm_Rocblas_621286397,0.150078
GemmStridedBatchedTunableOp_Half_TN,tn_1758_1758_128_B_32,Gemm_Rocblas_621294106,0.127495
GemmStridedBatchedTunableOp_Half_TN,tn_1573_1573_128_B_32,Gemm_Hipblaslt_TN_6879,0.110944
GemmStridedBatchedTunableOp_Half_TN,tn_1645_1645_128_B_32,Gemm_Hipblaslt_TN_6942,0.117326
GemmStridedBatchedTunableOp_Half_TN,tn_1813_1813_128_B_32,Gemm_Hipblaslt_TN_6942,0.138823
GemmStridedBatchedTunableOp_Half_TN,tn_1912_1912_128_B_32,Gemm_Hipblaslt_TN_157,0.137882
GemmStridedBatchedTunableOp_Half_TN,tn_1835_1835_128_B_32,Gemm_Hipblaslt_TN_6871,0.144544
GemmStridedBatchedTunableOp_Half_TN,tn_1739_1739_128_B_32,Gemm_Rocblas_621294110,0.12658
GemmStridedBatchedTunableOp_Half_TN,tn_1599_1599_128_B_32,Gemm_Rocblas_621286397,0.110187
GemmStridedBatchedTunableOp_Half_TN,tn_2370_2370_128_B_64,Gemm_Hipblaslt_TN_158,0.460926
GemmStridedBatchedTunableOp_Half_TN,tn_1760_1760_128_B_32,Gemm_Rocblas_621294110,0.114656
GemmStridedBatchedTunableOp_Half_TN,tn_1838_1838_128_B_32,Gemm_Hipblaslt_TN_6942,0.141347
GemmTunableOp_Half_TN,tn_4096_1608_14336,Gemm_Hipblaslt_TN_9671,0.358067
GemmTunableOp_Half_TN,tn_128256_127_4096,Gemm_Rocblas_621294762,0.430482
GemmTunableOp_Half_TN,tn_4096_1804_4096,Gemm_Hipblaslt_TN_9645,0.117941
GemmTunableOp_Half_TN,tn_28672_3401_4096,Gemm_Hipblaslt_TN_9841,1.35485
GemmTunableOp_Half_TN,tn_4096_5125_14336,Gemm_Hipblaslt_TN_9681,1.05977
GemmTunableOp_Half_TN,tn_4096_1799_14336,Gemm_Hipblaslt_TN_9620,0.40284
GemmTunableOp_Half_TN,tn_4096_3309_14336,Gemm_Hipblaslt_TN_9743,0.652361
GemmTunableOp_Half_TN,tn_4096_1660_4096,Gemm_Hipblaslt_TN_9671,0.10644
GemmTunableOp_Half_TN,tn_128256_6_4096,Gemm_Rocblas_621294224,0.280425
GemmTunableOp_Half_TN,tn_28672_1853_4096,Gemm_Hipblaslt_TN_9684,0.783872
GemmTunableOp_Half_TN,tn_4096_1728_4096,Gemm_Hipblaslt_TN_9607,0.105234
GemmTunableOp_Half_TN,tn_4096_5219_14336,Gemm_Hipblaslt_TN_9799,1.0817
GemmTunableOp_Half_TN,tn_28672_5470_4096,Gemm_Hipblaslt_TN_9924,2.29043
GemmTunableOp_Half_TN,tn_6144_1860_4096,Gemm_Hipblaslt_TN_9691,0.16497
GemmTunableOp_Half_TN,tn_4096_1593_14336,Gemm_Hipblaslt_TN_9671,0.357676
GemmTunableOp_Half_TN,tn_128256_171_4096,Gemm_Hipblaslt_TN_9952,0.518288
GemmTunableOp_Half_TN,tn_4096_1752_4096,Gemm_Hipblaslt_TN_9134,0.11547
GemmTunableOp_Half_TN,tn_4096_1615_4096,Gemm_Hipblaslt_TN_9616,0.104639
GemmTunableOp_Half_TN,tn_28672_1805_4096,Gemm_Hipblaslt_TN_9684,0.781125
GemmTunableOp_Half_TN,tn_4096_1873_4096,Gemm_Hipblaslt_TN_9645,0.120912
GemmTunableOp_Half_TN,tn_6144_7093_4096,Gemm_Hipblaslt_TN_9743,0.592508
GemmTunableOp_Half_TN,tn_28672_7130_4096,Gemm_Hipblaslt_TN_9919,2.90202
GemmTunableOp_Half_TN,tn_6144_3651_4096,Gemm_Hipblaslt_TN_9672,0.325994
GemmTunableOp_Half_TN,tn_4096_1810_14336,Gemm_Hipblaslt_TN_9268,0.401991
GemmTunableOp_Half_TN,tn_28672_3768_4096,Gemm_Hipblaslt_TN_9827,1.50853
GemmTunableOp_Half_TN,tn_28672_1737_4096,Gemm_Hipblaslt_TN_9184,0.733656
GemmTunableOp_Half_TN,tn_4096_3748_14336,Gemm_Hipblaslt_TN_9827,0.720005
GemmTunableOp_Half_TN,tn_4096_3565_14336,Gemm_Hipblaslt_TN_9677,0.684154
GemmTunableOp_Half_TN,tn_6144_3466_4096,Gemm_Rocblas_621294495,0.312036
GemmTunableOp_Half_TN,tn_28672_1931_4096,Gemm_Hipblaslt_TN_9846,0.822511
GemmTunableOp_Half_TN,tn_128256_232_4096,Gemm_Rocblas_621286892,0.593266
GemmTunableOp_Half_TN,tn_6144_3547_4096,Gemm_Rocblas_621294495,0.313219
GemmTunableOp_Half_TN,tn_4096_3780_4096,Gemm_Hipblaslt_TN_9827,0.21105
GemmTunableOp_Half_TN,tn_4096_1637_14336,Gemm_Hipblaslt_TN_9790,0.360911
GemmTunableOp_Half_TN,tn_128256_56_4096,Gemm_Rocblas_621286813,0.354809
GemmTunableOp_Half_TN,tn_128256_142_4096,Gemm_Hipblaslt_TN_9108,0.466355
GemmTunableOp_Half_TN,tn_28672_3651_4096,Gemm_Hipblaslt_TN_9827,1.49158
GemmTunableOp_Half_TN,tn_28672_6920_4096,Gemm_Hipblaslt_TN_9849,2.87383
GemmTunableOp_Half_TN,tn_4096_200_4096,Gemm_Rocblas_621286445,0.0252116
GemmTunableOp_Half_TN,tn_4096_1589_4096,Gemm_Hipblaslt_TN_9359,0.104502
GemmTunableOp_Half_TN,tn_6144_1852_4096,Gemm_Hipblaslt_TN_9672,0.16382
GemmTunableOp_Half_TN,tn_6144_3400_4096,Gemm_Hipblaslt_TN_9570,0.304003
GemmTunableOp_Half_TN,tn_4096_7077_4096,Gemm_Hipblaslt_TN_9814,0.398488
GemmTunableOp_Half_TN,tn_4096_1652_14336,Gemm_Hipblaslt_TN_9671,0.361862
GemmTunableOp_Half_TN,tn_6144_1827_4096,Gemm_Hipblaslt_TN_9690,0.162498
GemmTunableOp_Half_TN,tn_4096_1742_14336,Gemm_Hipblaslt_TN_9645,0.390964
GemmTunableOp_Half_TN,tn_4096_7191_14336,Gemm_Hipblaslt_TN_9743,1.43799
GemmTunableOp_Half_TN,tn_10240_64_8192,Gemm_Hipblaslt_TN_7492,0.0478092
GemmTunableOp_Half_TN,tn_6144_1605_4096,Gemm_Hipblaslt_TN_9570,0.149373
GemmTunableOp_Half_TN,tn_28672_1859_4096,Gemm_Hipblaslt_TN_9684,0.78702
GemmTunableOp_Half_TN,tn_4096_3682_4096,Gemm_Hipblaslt_TN_9217,0.212194
GemmTunableOp_Half_TN,tn_4096_5136_4096,Gemm_Hipblaslt_TN_9690,0.315797
GemmTunableOp_Half_TN,tn_6144_7033_4096,Gemm_Hipblaslt_TN_9187,0.592365
GemmTunableOp_Half_TN,tn_4096_7325_14336,Gemm_Hipblaslt_TN_9591,1.51823
GemmTunableOp_Half_TN,tn_6144_1838_4096,Gemm_Hipblaslt_TN_9691,0.163373
GemmTunableOp_Half_TN,tn_4096_1636_14336,Gemm_Hipblaslt_TN_9671,0.360219
GemmTunableOp_Half_TN,tn_28672_1924_4096,Gemm_Hipblaslt_TN_9846,0.82809
GemmTunableOp_Half_TN,tn_4096_1655_14336,Gemm_Hipblaslt_TN_9671,0.361304
GemmTunableOp_Half_TN,tn_6144_1708_4096,Gemm_Hipblaslt_TN_9570,0.153795
GemmTunableOp_Half_TN,tn_4096_3855_14336,Gemm_Hipblaslt_TN_9873,0.738922
GemmTunableOp_Half_TN,tn_4096_3456_14336,Gemm_Hipblaslt_TN_9677,0.659885
GemmTunableOp_Half_TN,tn_6144_3514_4096,Gemm_Rocblas_621286753,0.314404
GemmTunableOp_Half_TN,tn_4096_5723_4096,Gemm_Hipblaslt_TN_9852,0.333857
GemmTunableOp_Half_TN,tn_6144_1840_4096,Gemm_Hipblaslt_TN_9691,0.165396
GemmTunableOp_Half_TN,tn_28672_5204_4096,Gemm_Hipblaslt_TN_9890,2.13394
GemmTunableOp_Half_TN,tn_6144_6773_4096,Gemm_Hipblaslt_TN_9697,0.575747
GemmTunableOp_Half_TN,tn_28672_1742_4096,Gemm_Hipblaslt_TN_9223,0.730944
GemmTunableOp_Half_TN,tn_4096_7478_14336,Gemm_Hipblaslt_TN_9813,1.5427
GemmTunableOp_Half_TN,tn_28672_3640_4096,Gemm_Hipblaslt_TN_9832,1.45934
GemmTunableOp_Half_TN,tn_28672_1789_4096,Gemm_Hipblaslt_TN_9184,0.743322
GemmTunableOp_Half_TN,tn_6144_1850_4096,Gemm_Rocblas_621286705,0.165123
GemmTunableOp_Half_TN,tn_28672_1857_4096,Gemm_Hipblaslt_TN_9684,0.791389
GemmTunableOp_Half_TN,tn_6144_5498_4096,Gemm_Hipblaslt_TN_9655,0.452479
GemmTunableOp_Half_TN,tn_6144_3526_4096,Gemm_Hipblaslt_TN_9570,0.31167
GemmTunableOp_Half_TN,tn_4096_1599_4096,Gemm_Hipblaslt_TN_9359,0.102076
GemmTunableOp_Half_TN,tn_28672_32_4096,Gemm_Rocblas_621286818,0.0456501
GemmTunableOp_Half_TN,tn_4096_3578_4096,Gemm_Hipblaslt_TN_9743,0.198042
GemmTunableOp_Half_TN,tn_28672_3441_4096,Gemm_Hipblaslt_TN_9827,1.3555
GemmTunableOp_Half_TN,tn_4096_7364_14336,Gemm_Hipblaslt_TN_9591,1.52571
GemmTunableOp_Half_TN,tn_4096_5267_14336,Gemm_Hipblaslt_TN_9799,1.08664
GemmTunableOp_Half_TN,tn_28672_1590_4096,Gemm_Hipblaslt_TN_9674,0.696453
GemmTunableOp_Half_TN,tn_4096_1706_4096,Gemm_Hipblaslt_TN_9616,0.106458
GemmTunableOp_Half_TN,tn_6144_7067_4096,Gemm_Hipblaslt_TN_9187,0.593249
GemmTunableOp_Half_TN,tn_28672_1691_4096,Gemm_Hipblaslt_TN_9217,0.718624
GemmTunableOp_Half_TN,tn_4096_1609_14336,Gemm_Hipblaslt_TN_9671,0.358029
GemmTunableOp_Half_TN,tn_4096_1802_14336,Gemm_Hipblaslt_TN_9680,0.402509
GemmTunableOp_Half_TN,tn_4096_1881_4096,Gemm_Hipblaslt_TN_9645,0.120224
GemmTunableOp_Half_TN,tn_4096_5735_14336,Gemm_Rocblas_621286684,1.18199
GemmTunableOp_Half_TN,tn_28672_1883_4096,Gemm_Hipblaslt_TN_9684,0.789324
GemmTunableOp_Half_TN,tn_4096_5436_4096,Gemm_Hipblaslt_TN_9687,0.325457
GemmTunableOp_Half_TN,tn_4096_3219_14336,Gemm_Hipblaslt_TN_9682,0.635542
GemmTunableOp_Half_TN,tn_4096_1884_4096,Gemm_Hipblaslt_TN_9645,0.121065
GemmTunableOp_Half_TN,tn_6144_1779_4096,Gemm_Hipblaslt_TN_9687,0.162529
GemmTunableOp_Half_TN,tn_4096_1666_4096,Gemm_Hipblaslt_TN_9164,0.105147
GemmTunableOp_Half_TN,tn_28672_3388_4096,Gemm_Hipblaslt_TN_9827,1.35572
GemmTunableOp_Half_TN,tn_28672_1711_4096,Gemm_Hipblaslt_TN_9184,0.726435
GemmTunableOp_Half_TN,tn_28672_1898_4096,Gemm_Hipblaslt_TN_9683,0.795711
GemmTunableOp_Half_TN,tn_4096_5277_4096,Gemm_Hipblaslt_TN_9799,0.319472
GemmTunableOp_Half_TN,tn_10240_2193_8192,Gemm_Hipblaslt_TN_9211,0.627612
GemmTunableOp_Half_TN,tn_128256_240_4096,Gemm_Rocblas_621294634,0.595924
GemmTunableOp_Half_TN,tn_6144_3691_4096,Gemm_Hipblaslt_TN_9689,0.330144
GemmTunableOp_Half_TN,tn_4096_1770_14336,Gemm_Hipblaslt_TN_9645,0.392299
GemmTunableOp_Half_TN,tn_128256_231_4096,Gemm_Rocblas_621294634,0.592333
GemmTunableOp_Half_TN,tn_128256_222_4096,Gemm_Hipblaslt_TN_9847,0.570294
GemmTunableOp_Half_TN,tn_4096_3404_4096,Gemm_Hipblaslt_TN_9743,0.193843
GemmTunableOp_Half_TN,tn_28672_5605_4096,Gemm_Hipblaslt_TN_9865,2.30203
GemmTunableOp_Half_TN,tn_28672_1790_4096,Gemm_Hipblaslt_TN_9223,0.742386
GemmTunableOp_Half_TN,tn_4096_1924_14336,Gemm_Hipblaslt_TN_9680,0.414602
GemmTunableOp_Half_TN,tn_6144_3781_4096,Gemm_Hipblaslt_TN_9672,0.334339
GemmTunableOp_Half_TN,tn_4096_1655_4096,Gemm_Hipblaslt_TN_9607,0.105683
GemmTunableOp_Half_TN,tn_6144_3515_4096,Gemm_Hipblaslt_TN_9570,0.312744
GemmTunableOp_Half_TN,tn_4096_1978_14336,Gemm_Hipblaslt_TN_9136,0.417937
GemmTunableOp_Half_TN,tn_28672_216_4096,Gemm_Hipblaslt_TN_9360,0.113032
GemmTunableOp_Half_TN,tn_6144_1728_4096,Gemm_Rocblas_621294495,0.152727
GemmTunableOp_Half_TN,tn_6144_7023_4096,Gemm_Hipblaslt_TN_9187,0.592295
GemmTunableOp_Half_TN,tn_4096_3629_4096,Gemm_Hipblaslt_TN_9187,0.201135
GemmTunableOp_Half_TN,tn_4096_1846_4096,Gemm_Hipblaslt_TN_9134,0.120564
GemmTunableOp_Half_TN,tn_4096_1610_4096,Gemm_Hipblaslt_TN_9671,0.106055
GemmTunableOp_Half_TN,tn_4096_5390_14336,Gemm_Hipblaslt_TN_9799,1.12149
GemmTunableOp_Half_TN,tn_4096_1963_4096,Gemm_Hipblaslt_TN_9267,0.124047
GemmTunableOp_Half_TN,tn_4096_5067_14336,Gemm_Hipblaslt_TN_9880,1.05605
GemmTunableOp_Half_TN,tn_4096_1957_14336,Gemm_Hipblaslt_TN_9680,0.417541
GemmTunableOp_Half_TN,tn_6144_3388_4096,Gemm_Hipblaslt_TN_9570,0.303192
GemmTunableOp_Half_TN,tn_4096_1873_14336,Gemm_Hipblaslt_TN_9645,0.409944
GemmTunableOp_Half_TN,tn_4096_3600_4096,Gemm_Hipblaslt_TN_9743,0.202792
GemmTunableOp_Half_TN,tn_8192_2385_8192,Gemm_Hipblaslt_TN_9264,0.545936
GemmTunableOp_Half_TN,tn_128256_94_4096,Gemm_Hipblaslt_TN_9057,0.392278
GemmTunableOp_Half_TN,tn_8192_2112_28672,Gemm_Hipblaslt_TN_9762,2.02484
GemmTunableOp_Half_TN,tn_4096_3388_14336,Gemm_Hipblaslt_TN_9832,0.6595
GemmTunableOp_Half_TN,tn_6144_7568_4096,Gemm_Rocblas_621286678,0.637373
GemmTunableOp_Half_TN,tn_6144_1738_4096,Gemm_Hipblaslt_TN_9799,0.157604
GemmTunableOp_Half_TN,tn_8192_30_28672,Gemm_Rocblas_621286354,0.12831
GemmTunableOp_Half_TN,tn_28672_40_4096,Gemm_Hipblaslt_TN_9532,0.0487152
GemmTunableOp_Half_TN,tn_4096_1839_4096,Gemm_Hipblaslt_TN_9645,0.118692
GemmTunableOp_Half_TN,tn_28672_1620_4096,Gemm_Rocblas_621286678,0.708678
GemmTunableOp_Half_TN,tn_8192_2284_28672,Gemm_Hipblaslt_TN_9649,2.23739
GemmTunableOp_Half_TN,tn_8192_2239_28672,Gemm_Hipblaslt_TN_9762,2.09422
GemmTunableOp_Half_TN,tn_4096_3701_14336,Gemm_Hipblaslt_TN_9827,0.721401
GemmTunableOp_Half_TN,tn_6144_1963_4096,Gemm_Hipblaslt_TN_9693,0.177063
GemmTunableOp_Half_TN,tn_28672_7432_4096,Gemm_Hipblaslt_TN_159,2.96352
GemmTunableOp_Half_TN,tn_8192_2177_28672,Gemm_Hipblaslt_TN_9762,2.05391
GemmTunableOp_Half_TN,tn_4096_3475_4096,Gemm_Hipblaslt_TN_9814,0.197408
GemmTunableOp_Half_TN,tn_6144_1688_4096,Gemm_Rocblas_621286753,0.155073
GemmTunableOp_Half_TN,tn_28672_5680_4096,Gemm_Hipblaslt_TN_9841,2.34578
GemmTunableOp_Half_TN,tn_28672_1960_4096,Gemm_Hipblaslt_TN_9846,0.834548
GemmTunableOp_Half_TN,tn_4096_1859_14336,Gemm_Hipblaslt_TN_9680,0.407147
GemmTunableOp_Half_TN,tn_4096_3592_14336,Gemm_Hipblaslt_TN_9187,0.687177
GemmTunableOp_Half_TN,tn_28672_5427_4096,Gemm_Hipblaslt_TN_9924,2.25125
GemmTunableOp_Half_TN,tn_4096_7120_4096,Gemm_Hipblaslt_TN_9743,0.400162
GemmTunableOp_Half_TN,tn_10240_2178_8192,Gemm_Hipblaslt_TN_9209,0.627245
GemmTunableOp_Half_TN,tn_128256_214_4096,Gemm_Hipblaslt_TN_9903,0.569725
GemmTunableOp_Half_TN,tn_4096_3706_4096,Gemm_Hipblaslt_TN_9768,0.213025
GemmTunableOp_Half_TN,tn_28672_192_4096,Gemm_Hipblaslt_TN_9054,0.0988406
GemmTunableOp_Half_TN,tn_57344_68_8192,Gemm_Rocblas_621294520,0.321574
GemmTunableOp_Half_TN,tn_128256_213_4096,Gemm_Hipblaslt_TN_9738,0.571969
GemmTunableOp_Half_TN,tn_8192_2113_28672,Gemm_Hipblaslt_TN_9762,2.032
GemmTunableOp_Half_TN,tn_28672_1977_4096,Gemm_Hipblaslt_TN_9846,0.832093
GemmTunableOp_Half_TN,tn_57344_4096_8192,Gemm_Hipblaslt_TN_9963,6.64372
GemmTunableOp_Half_TN,tn_128256_173_4096,Gemm_Hipblaslt_TN_9857,0.513591
GemmTunableOp_Half_TN,tn_6144_1589_4096,Gemm_Rocblas_621286565,0.145977
GemmTunableOp_Half_TN,tn_6144_6789_4096,Gemm_Hipblaslt_TN_9697,0.580582
GemmTunableOp_Half_TN,tn_4096_1668_14336,Gemm_Hipblaslt_TN_9164,0.362938
GemmTunableOp_Half_TN,tn_6144_7139_4096,Gemm_Hipblaslt_TN_9187,0.602515
GemmTunableOp_Half_TN,tn_128256_68_4096,Gemm_Hipblaslt_TN_9057,0.371884
GemmTunableOp_Half_TN,tn_4096_3379_4096,Gemm_Hipblaslt_TN_9743,0.191177
GemmTunableOp_Half_TN,tn_4096_1807_14336,Gemm_Hipblaslt_TN_9645,0.403322
GemmTunableOp_Half_TN,tn_8192_64_28672,Gemm_Rocblas_621286489,0.144765
GemmTunableOp_Half_TN,tn_6144_1847_4096,Gemm_Hipblaslt_TN_9672,0.164128
GemmTunableOp_Half_TN,tn_128256_116_4096,Gemm_Rocblas_621294011,0.429804
GemmTunableOp_Half_TN,tn_128256_254_4096,Gemm_Rocblas_621286905,0.602044
GemmTunableOp_Half_TN,tn_32000_63_8192,Gemm_Rocblas_621294203,0.160806
GemmTunableOp_Half_TN,tn_4096_1627_14336,Gemm_Hipblaslt_TN_9790,0.359359
GemmTunableOp_Half_TN,tn_4096_176_14336,Gemm_Hipblaslt_TN_7586,0.0595885
GemmTunableOp_Half_TN,tn_10240_2305_8192,Gemm_Hipblaslt_TN_9675,0.658696
GemmTunableOp_Half_TN,tn_4096_1686_14336,Gemm_Hipblaslt_TN_9671,0.362317
GemmTunableOp_Half_TN,tn_28672_1688_4096,Gemm_Hipblaslt_TN_9223,0.722806
GemmTunableOp_Half_TN,tn_28672_6630_4096,Gemm_Hipblaslt_TN_9944,2.66745
GemmTunableOp_Half_TN,tn_128256_81_4096,Gemm_Hipblaslt_TN_9057,0.383803
GemmTunableOp_Half_TN,tn_8192_2193_8192,Gemm_Hipblaslt_TN_9763,0.506831
GemmTunableOp_Half_TN,tn_28672_3520_4096,Gemm_Hipblaslt_TN_9827,1.36329
GemmTunableOp_Half_TN,tn_10240_2207_8192,Gemm_Hipblaslt_TN_9182,0.627947
GemmTunableOp_Half_TN,tn_6144_1877_4096,Gemm_Hipblaslt_TN_9672,0.165501
GemmTunableOp_Half_TN,tn_4096_3597_4096,Gemm_Hipblaslt_TN_9682,0.20126
GemmTunableOp_Half_TN,tn_28672_7484_4096,Gemm_Hipblaslt_TN_159,2.92986
GemmTunableOp_Half_TN,tn_4096_1875_4096,Gemm_Hipblaslt_TN_9645,0.121078
GemmTunableOp_Half_TN,tn_8192_2255_28672,Gemm_Hipblaslt_TN_9649,2.21836
GemmTunableOp_Half_TN,tn_57344_2192_8192,Gemm_Hipblaslt_TN_154,3.99314
GemmTunableOp_Half_TN,tn_10240_2255_8192,Gemm_Rocblas_621286580,0.650749
GemmTunableOp_Half_TN,tn_6144_3496_4096,Gemm_Hipblaslt_TN_9570,0.312013
GemmTunableOp_Half_TN,tn_4096_5068_14336,Gemm_Hipblaslt_TN_9880,1.05235
GemmTunableOp_Half_TN,tn_57344_2304_8192,Gemm_Rocblas_621294542,4.02244
GemmTunableOp_Half_TN,tn_4096_3630_4096,Gemm_Hipblaslt_TN_9814,0.200806
GemmTunableOp_Half_TN,tn_28672_24_4096,Gemm_Rocblas_621286346,0.0459762
GemmTunableOp_Half_TN,tn_4096_1830_4096,Gemm_Hipblaslt_TN_9645,0.119599
GemmTunableOp_Half_TN,tn_128256_164_4096,Gemm_Hipblaslt_TN_9752,0.50321
GemmTunableOp_Half_TN,tn_28672_1593_4096,Gemm_Hipblaslt_TN_9783,0.699133
GemmTunableOp_Half_TN,tn_6144_1623_4096,Gemm_Hipblaslt_TN_9570,0.151192
GemmTunableOp_Half_TN,tn_28672_3427_4096,Gemm_Hipblaslt_TN_9827,1.35266
GemmTunableOp_Half_TN,tn_4096_1680_14336,Gemm_Hipblaslt_TN_9790,0.362289
GemmTunableOp_Half_TN,tn_6144_1862_4096,Gemm_Hipblaslt_TN_9691,0.165957
GemmTunableOp_Half_TN,tn_8192_2145_8192,Gemm_Hipblaslt_TN_9742,0.502815
GemmTunableOp_Half_TN,tn_4096_7027_14336,Gemm_Hipblaslt_TN_9743,1.40903
GemmTunableOp_Half_TN,tn_10240_2127_8192,Gemm_Rocblas_621286663,0.622773
GemmTunableOp_Half_TN,tn_4096_1702_14336,Gemm_Hipblaslt_TN_9180,0.364766
GemmTunableOp_Half_TN,tn_6144_1646_4096,Gemm_Hipblaslt_TN_9570,0.152521
GemmTunableOp_Half_TN,tn_10240_2370_8192,Gemm_Hipblaslt_TN_9209,0.667175
GemmTunableOp_Half_TN,tn_8192_2177_8192,Gemm_Hipblaslt_TN_9763,0.504617
GemmTunableOp_Half_TN,tn_10240_2190_8192,Gemm_Hipblaslt_TN_9211,0.627813
GemmTunableOp_Half_TN,tn_4096_6860_14336,Gemm_Hipblaslt_TN_9694,1.38788
GemmTunableOp_Half_TN,tn_8192_66_8192,Gemm_Hipblaslt_TN_7093,0.0436711
GemmTunableOp_Half_TN,tn_4096_3511_14336,Gemm_Hipblaslt_TN_9187,0.681011
GemmTunableOp_Half_TN,tn_57344_2238_8192,Gemm_Rocblas_621294542,3.97411
GemmTunableOp_Half_TN,tn_28672_3855_4096,Gemm_Hipblaslt_TN_9827,1.56096
GemmTunableOp_Half_TN,tn_8192_2159_8192,Gemm_Hipblaslt_TN_9742,0.500722
GemmTunableOp_Half_TN,tn_6144_5274_4096,Gemm_Rocblas_621294420,0.438169
GemmTunableOp_Half_TN,tn_128256_91_4096,Gemm_Hipblaslt_TN_9057,0.389224
GemmTunableOp_Half_TN,tn_6144_3574_4096,Gemm_Hipblaslt_TN_9570,0.317396
GemmTunableOp_Half_TN,tn_57344_61_8192,Gemm_Rocblas_621286468,0.304955
GemmTunableOp_Half_TN,tn_128256_30_4096,Gemm_Hipblaslt_TN_9451,0.310188
GemmTunableOp_Half_TN,tn_128256_22_4096,Gemm_Rocblas_621294578,0.309959
GemmTunableOp_Half_TN,tn_28672_1573_4096,Gemm_Hipblaslt_TN_9674,0.69496
GemmTunableOp_Half_TN,tn_6144_1597_4096,Gemm_Rocblas_621286565,0.147151
GemmTunableOp_Half_TN,tn_4096_1933_4096,Gemm_Hipblaslt_TN_9645,0.122795
GemmTunableOp_Half_TN,tn_4096_1780_14336,Gemm_Hipblaslt_TN_9645,0.393608
GemmTunableOp_Half_TN,tn_128256_165_4096,Gemm_Hipblaslt_TN_9752,0.512279
GemmTunableOp_Half_TN,tn_4096_1673_14336,Gemm_Hipblaslt_TN_9671,0.362856
GemmTunableOp_Half_TN,tn_8192_4049_8192,Gemm_Hipblaslt_TN_9184,0.880015
GemmTunableOp_Half_TN,tn_4096_3713_14336,Gemm_Hipblaslt_TN_9827,0.71902
GemmTunableOp_Half_TN,tn_6144_7171_4096,Gemm_Hipblaslt_TN_9187,0.603244
GemmTunableOp_Half_TN,tn_8192_61_8192,Gemm_Hipblaslt_TN_7484,0.0398102
GemmTunableOp_Half_TN,tn_57344_2208_8192,Gemm_Hipblaslt_TN_156,3.96586
GemmTunableOp_Half_TN,tn_28672_5219_4096,Gemm_Hipblaslt_TN_159,2.1338
GemmTunableOp_Half_TN,tn_28672_3383_4096,Gemm_Hipblaslt_TN_9827,1.35981
GemmTunableOp_Half_TN,tn_6144_3497_4096,Gemm_Rocblas_621294495,0.313814
GemmTunableOp_Half_TN,tn_4096_3508_4096,Gemm_Hipblaslt_TN_9743,0.199294
GemmTunableOp_Half_TN,tn_28672_5359_4096,Gemm_Hipblaslt_TN_9893,2.17022
GemmTunableOp_Half_TN,tn_8192_2385_28672,Gemm_Hipblaslt_TN_9649,2.28778
GemmTunableOp_Half_TN,tn_4096_48_4096,Gemm_Rocblas_621294155,0.0126613
GemmTunableOp_Half_TN,tn_28672_1890_4096,Gemm_Hipblaslt_TN_9684,0.789899
GemmTunableOp_Half_TN,tn_4096_3582_14336,Gemm_Hipblaslt_TN_9677,0.687422
GemmTunableOp_Half_TN,tn_10240_4096_8192,Gemm_Hipblaslt_TN_9743,1.1301
GemmTunableOp_Half_TN,tn_10240_62_8192,Gemm_Hipblaslt_TN_7492,0.0480553
GemmTunableOp_Half_TN,tn_57344_2178_8192,Default,3.89852
GemmTunableOp_Half_TN,tn_6144_3589_4096,Gemm_Rocblas_621286753,0.317012
GemmTunableOp_Half_TN,tn_28672_3912_4096,Gemm_Hipblaslt_TN_9827,1.56393
GemmTunableOp_Half_TN,tn_4096_7340_14336,Gemm_Hipblaslt_TN_9753,1.52436
GemmTunableOp_Half_TN,tn_4096_3830_4096,Gemm_Hipblaslt_TN_9827,0.216978
GemmTunableOp_Half_TN,tn_128256_126_4096,Gemm_Rocblas_621294762,0.430865
GemmTunableOp_Half_TN,tn_28672_1879_4096,Gemm_Hipblaslt_TN_9684,0.789876
GemmTunableOp_Half_TN,tn_10240_67_8192,Gemm_Hipblaslt_TN_9304,0.0497179
GemmTunableOp_Half_TN,tn_8192_2065_8192,Gemm_Hipblaslt_TN_9742,0.496493
GemmTunableOp_Half_TN,tn_6144_3592_4096,Gemm_Hipblaslt_TN_9570,0.316538
GemmTunableOp_Half_TN,tn_8192_2161_28672,Gemm_Hipblaslt_TN_9762,2.05102
GemmTunableOp_Half_TN,tn_28672_1764_4096,Gemm_Hipblaslt_TN_9223,0.739081
GemmTunableOp_Half_TN,tn_4096_6971_4096,Gemm_Hipblaslt_TN_9814,0.396919
GemmTunableOp_Half_TN,tn_4096_1813_14336,Gemm_Hipblaslt_TN_9137,0.404364
GemmTunableOp_Half_TN,tn_10240_2128_8192,Gemm_Rocblas_621286663,0.62403
GemmTunableOp_Half_TN,tn_6144_1960_4096,Gemm_Hipblaslt_TN_9693,0.175997
GemmTunableOp_Half_TN,tn_8192_2225_28672,Gemm_Hipblaslt_TN_9762,2.09006
GemmTunableOp_Half_TN,tn_28672_1596_4096,Gemm_Hipblaslt_TN_9783,0.699928
GemmTunableOp_Half_TN,tn_28672_1666_4096,Gemm_Hipblaslt_TN_9184,0.71521
GemmTunableOp_Half_TN,tn_10240_60_8192,Gemm_Hipblaslt_TN_9304,0.0470015
GemmTunableOp_Half_TN,tn_57344_2193_8192,Gemm_Hipblaslt_TN_9841,4.01315
GemmTunableOp_Half_TN,tn_4096_7138_4096,Gemm_Hipblaslt_TN_9814,0.404455
GemmTunableOp_Half_TN,tn_6144_1872_4096,Gemm_Hipblaslt_TN_9672,0.165621
GemmTunableOp_Half_TN,tn_4096_152_14336,Gemm_Hipblaslt_TN_7219,0.0542822
GemmTunableOp_Half_TN,tn_4096_1869_14336,Gemm_Hipblaslt_TN_9137,0.407369
GemmTunableOp_Half_TN,tn_57344_62_8192,Gemm_Rocblas_621286468,0.304352
GemmTunableOp_Half_TN,tn_6144_1869_4096,Gemm_Hipblaslt_TN_9690,0.165337
GemmTunableOp_Half_TN,tn_6144_1930_4096,Gemm_Hipblaslt_TN_9693,0.175151
GemmTunableOp_Half_TN,tn_6144_1866_4096,Gemm_Hipblaslt_TN_9672,0.1644
GemmTunableOp_Half_TN,tn_8192_28_28672,Gemm_Rocblas_621294226,0.129545
GemmTunableOp_Half_TN,tn_128256_200_4096,Gemm_Hipblaslt_TN_9738,0.564357
GemmTunableOp_Half_TN,tn_128256_124_4096,Gemm_Rocblas_621294105,0.432668
GemmTunableOp_Half_TN,tn_28672_1603_4096,Gemm_Hipblaslt_TN_9223,0.70596
GemmTunableOp_Half_TN,tn_8192_2415_8192,Gemm_Hipblaslt_TN_9264,0.546526
GemmTunableOp_Half_TN,tn_8192_2284_8192,Gemm_Hipblaslt_TN_9763,0.513136
GemmTunableOp_Half_TN,tn_57344_28_8192,Gemm_Rocblas_621294194,0.27193
GemmTunableOp_Half_TN,tn_8192_2158_8192,Gemm_Hipblaslt_TN_9763,0.504886
GemmTunableOp_Half_TN,tn_28672_1618_4096,Gemm_Rocblas_621286678,0.707224
GemmTunableOp_Half_TN,tn_57344_63_8192,Gemm_Rocblas_621286468,0.305124
GemmTunableOp_Half_TN,tn_57344_60_8192,Gemm_Rocblas_621286468,0.303696
GemmTunableOp_Half_TN,tn_4096_1882_4096,Gemm_Hipblaslt_TN_9134,0.121051
GemmTunableOp_Half_TN,tn_57344_2255_8192,Gemm_Hipblaslt_TN_9666,4.07223
GemmTunableOp_Half_TN,tn_57344_65_8192,Gemm_Rocblas_621294520,0.31923
GemmTunableOp_Half_TN,tn_4096_3767_14336,Gemm_Hipblaslt_TN_9827,0.71773
GemmTunableOp_Half_TN,tn_4096_224_4096,Gemm_Rocblas_621294168,0.0253008
GemmTunableOp_Half_TN,tn_8192_2238_28672,Gemm_Hipblaslt_TN_9762,2.09348
GemmTunableOp_Half_TN,tn_8192_2369_28672,Gemm_Hipblaslt_TN_9771,2.30076
GemmTunableOp_Half_TN,tn_128256_150_4096,Gemm_Hipblaslt_TN_9775,0.476611
GemmTunableOp_Half_TN,tn_128256_246_4096,Gemm_Rocblas_621286905,0.603748
GemmTunableOp_Half_TN,tn_6144_5322_4096,Gemm_Hipblaslt_TN_9190,0.437194
GemmTunableOp_Half_TN,tn_128256_194_4096,Gemm_Hipblaslt_TN_9847,0.555588
GemmTunableOp_Half_TN,tn_6144_3501_4096,Gemm_Rocblas_621286753,0.314147
GemmTunableOp_Half_TN,tn_4096_1798_14336,Gemm_Hipblaslt_TN_9136,0.402916
GemmTunableOp_Half_TN,tn_8192_4050_28672,Gemm_Rocblas_621294634,3.41561
GemmTunableOp_Half_TN,tn_128256_11_4096,Gemm_Rocblas_621286325,0.285689
GemmTunableOp_Half_TN,tn_28672_1864_4096,Gemm_Hipblaslt_TN_9684,0.793993
GemmTunableOp_Half_TN,tn_6144_5570_4096,Gemm_Rocblas_621286678,0.456913
GemmTunableOp_Half_TN,tn_28672_5533_4096,Gemm_Hipblaslt_TN_9852,2.30054
GemmTunableOp_Half_TN,tn_4096_6747_4096,Gemm_Hipblaslt_TN_9743,0.385158
GemmTunableOp_Half_TN,tn_8192_2397_8192,Gemm_Hipblaslt_TN_9208,0.549206
GemmTunableOp_Half_TN,tn_128256_50_4096,Gemm_Hipblaslt_TN_9057,0.347588
GemmTunableOp_Half_TN,tn_4096_7403_14336,Gemm_Hipblaslt_TN_9749,1.53227
GemmTunableOp_Half_TN,tn_128256_109_4096,Gemm_Hipblaslt_TN_9114,0.42471
GemmTunableOp_Half_TN,tn_4096_1829_14336,Gemm_Hipblaslt_TN_9137,0.405711
GemmTunableOp_Half_TN,tn_128256_73_4096,Gemm_Hipblaslt_TN_9057,0.378463
GemmTunableOp_Half_TN,tn_4096_8192_14336,Gemm_Hipblaslt_TN_9815,1.63938
GemmTunableOp_Half_TN,tn_128256_132_4096,Gemm_Hipblaslt_TN_9072,0.463475
GemmTunableOp_Half_TN,tn_128256_144_4096,Gemm_Hipblaslt_TN_9108,0.465908
GemmTunableOp_Half_TN,tn_128256_156_4096,Gemm_Hipblaslt_TN_9108,0.476406
GemmTunableOp_Half_TN,tn_57344_4000_8192,Gemm_Rocblas_621294643,6.59492
GemmTunableOp_Half_TN,tn_6144_1663_4096,Gemm_Hipblaslt_TN_9570,0.151694
GemmTunableOp_Half_TN,tn_28672_1652_4096,Gemm_Rocblas_621294420,0.716599
GemmTunableOp_Half_TN,tn_128256_186_4096,Gemm_Hipblaslt_TN_9683,0.515741
GemmTunableOp_Half_TN,tn_128256_209_4096,Gemm_Hipblaslt_TN_9903,0.568913
GemmTunableOp_Half_TN,tn_4096_3688_4096,Gemm_Rocblas_621286281,0.209948
GemmTunableOp_Half_TN,tn_128256_223_4096,Gemm_Hipblaslt_TN_9903,0.573916
GemmTunableOp_Half_TN,tn_6144_7120_4096,Gemm_Hipblaslt_TN_153,0.602137
GemmTunableOp_Half_TN,tn_4096_3912_14336,Gemm_Hipblaslt_TN_9827,0.747293
GemmTunableOp_Half_TN,tn_6144_7439_4096,Gemm_Hipblaslt_TN_159,0.632559
GemmTunableOp_Half_TN,tn_4096_1658_4096,Gemm_Hipblaslt_TN_9616,0.10487
GemmTunableOp_Half_TN,tn_4096_1596_4096,Gemm_Hipblaslt_TN_9607,0.10536
GemmTunableOp_Half_TN,tn_4096_1625_14336,Gemm_Hipblaslt_TN_9671,0.357407
GemmTunableOp_Half_TN,tn_4096_5271_4096,Gemm_Hipblaslt_TN_9687,0.317808
GemmTunableOp_Half_TN,tn_10240_4048_8192,Gemm_Hipblaslt_TN_9814,1.11924
GemmTunableOp_Half_TN,tn_4096_1977_14336,Gemm_Hipblaslt_TN_9137,0.418513
GemmTunableOp_Half_TN,tn_57344_56_8192,Gemm_Rocblas_621286468,0.305049
GemmTunableOp_Half_TN,tn_4096_3383_14336,Gemm_Hipblaslt_TN_9192,0.658982
GemmTunableOp_Half_TN,tn_4096_1902_14336,Gemm_Hipblaslt_TN_9620,0.412649
GemmTunableOp_Half_TN,tn_4096_3382_14336,Gemm_Hipblaslt_TN_9677,0.660677
GemmTunableOp_Half_TN,tn_6144_3582_4096,Gemm_Rocblas_621294306,0.316042
GemmTunableOp_Half_TN,tn_6144_5354_4096,Gemm_Rocblas_621294420,0.439323
GemmTunableOp_Half_TN,tn_6144_1798_4096,Gemm_Hipblaslt_TN_9690,0.164032
GemmTunableOp_Half_TN,tn_28672_1930_4096,Gemm_Hipblaslt_TN_9846,0.826198
GemmTunableOp_Half_TN,tn_6144_3912_4096,Gemm_Hipblaslt_TN_9672,0.341799
GemmTunableOp_Half_TN,tn_4096_5223_4096,Gemm_Hipblaslt_TN_9690,0.318657
GemmTunableOp_Half_TN,tn_6144_3773_4096,Gemm_Rocblas_621286684,0.332665
GemmTunableOp_Half_TN,tn_4096_3622_4096,Gemm_Hipblaslt_TN_9139,0.201732
GemmTunableOp_Half_TN,tn_4096_5410_4096,Gemm_Hipblaslt_TN_9687,0.324972
GemmTunableOp_Half_TN,tn_28672_7108_4096,Gemm_Hipblaslt_TN_9919,2.8799
GemmTunableOp_Half_TN,tn_8192_2191_8192,Gemm_Hipblaslt_TN_9763,0.505978
GemmTunableOp_Half_TN,tn_4096_1969_4096,Gemm_Hipblaslt_TN_9645,0.122992
GemmTunableOp_Half_TN,tn_6144_1698_4096,Gemm_Rocblas_621294495,0.156099
GemmTunableOp_Half_TN,tn_6144_5219_4096,Gemm_Rocblas_621294420,0.436608
GemmTunableOp_Half_TN,tn_28672_3494_4096,Gemm_Hipblaslt_TN_9827,1.36993
GemmTunableOp_Half_TN,tn_28672_1828_4096,Gemm_Hipblaslt_TN_9684,0.784144
GemmTunableOp_Half_TN,tn_4096_7050_14336,Gemm_Hipblaslt_TN_9694,1.4081
GemmTunableOp_Half_TN,tn_4096_1928_4096,Gemm_Hipblaslt_TN_9645,0.122749
GemmTunableOp_Half_TN,tn_28672_7478_4096,Gemm_Hipblaslt_TN_159,2.92043
GemmTunableOp_Half_TN,tn_10240_2413_8192,Gemm_Hipblaslt_TN_9139,0.687171
GemmTunableOp_Half_TN,tn_57344_2158_8192,Gemm_Hipblaslt_TN_9827,3.98447
GemmTunableOp_Half_TN,tn_28672_6868_4096,Gemm_Hipblaslt_TN_9958,2.78759
GemmTunableOp_Half_TN,tn_10240_2304_8192,Gemm_Rocblas_621286617,0.649122
GemmTunableOp_Half_TN,tn_128256_86_4096,Gemm_Hipblaslt_TN_9057,0.389698
GemmTunableOp_Half_TN,tn_28672_64_4096,Gemm_Rocblas_621294374,0.0481162
GemmTunableOp_Half_TN,tn_28672_5412_4096,Gemm_Hipblaslt_TN_9852,2.24382
GemmTunableOp_Half_TN,tn_4096_7196_14336,Gemm_Hipblaslt_TN_9694,1.43131
GemmTunableOp_Half_TN,tn_28672_3511_4096,Gemm_Hipblaslt_TN_9827,1.36818
GemmTunableOp_Half_TN,tn_6144_6965_4096,Gemm_Hipblaslt_TN_9677,0.587449
GemmTunableOp_Half_TN,tn_4096_6952_4096,Gemm_Hipblaslt_TN_9743,0.395221
GemmTunableOp_Half_TN,tn_6144_6841_4096,Gemm_Hipblaslt_TN_9677,0.581241
GemmTunableOp_Half_TN,tn_28672_3588_4096,Gemm_Hipblaslt_TN_9832,1.46131
GemmTunableOp_Half_TN,tn_4096_7077_14336,Gemm_Hipblaslt_TN_9743,1.42142
GemmTunableOp_Half_TN,tn_4096_7067_4096,Gemm_Hipblaslt_TN_9743,0.397511
GemmTunableOp_Half_TN,tn_4096_7190_4096,Gemm_Hipblaslt_TN_9743,0.403255
GemmTunableOp_Half_TN,tn_6144_3300_4096,Gemm_Rocblas_621286566,0.29948
GemmTunableOp_Half_TN,tn_4096_3597_14336,Gemm_Hipblaslt_TN_9677,0.684743
GemmTunableOp_Half_TN,tn_6144_1710_4096,Gemm_Rocblas_621286753,0.153917
GemmTunableOp_Half_TN,tn_6144_5436_4096,Gemm_Rocblas_621286750,0.450238
GemmTunableOp_Half_TN,tn_4096_7327_14336,Gemm_Hipblaslt_TN_9591,1.51612
GemmTunableOp_Half_TN,tn_28672_1707_4096,Gemm_Hipblaslt_TN_9223,0.72718
GemmTunableOp_Half_TN,tn_4096_1622_14336,Gemm_Hipblaslt_TN_9790,0.357668
GemmTunableOp_Half_TN,tn_28672_7248_4096,Gemm_Hipblaslt_TN_159,2.91299
GemmTunableOp_Half_TN,tn_28672_176_4096,Gemm_Hipblaslt_TN_9587,0.0966644
GemmTunableOp_Half_TN,tn_4096_7096_14336,Gemm_Hipblaslt_TN_9743,1.4222
GemmTunableOp_Half_TN,tn_6144_7021_4096,Gemm_Hipblaslt_TN_9743,0.590924
GemmTunableOp_Half_TN,tn_4096_7345_14336,Gemm_Hipblaslt_TN_9591,1.51844
GemmTunableOp_Half_TN,tn_4096_3450_4096,Gemm_Hipblaslt_TN_9743,0.195294
GemmTunableOp_Half_TN,tn_6144_5239_4096,Gemm_Rocblas_621294420,0.432012
GemmTunableOp_Half_TN,tn_28672_1609_4096,Gemm_Hipblaslt_TN_9217,0.703393
GemmTunableOp_Half_TN,tn_4096_136_14336,Gemm_Hipblaslt_TN_7219,0.0528843
GemmTunableOp_Half_TN,tn_4096_1857_4096,Gemm_Hipblaslt_TN_9645,0.119662
GemmTunableOp_Half_TN,tn_128256_12_4096,Gemm_Rocblas_621294224,0.28727
GemmTunableOp_Half_TN,tn_28672_1894_4096,Gemm_Hipblaslt_TN_9684,0.796487
GemmTunableOp_Half_TN,tn_28672_3547_4096,Gemm_Hipblaslt_TN_9827,1.37958
GemmTunableOp_Half_TN,tn_4096_1840_4096,Gemm_Hipblaslt_TN_9645,0.119086
GemmTunableOp_Half_TN,tn_4096_7344_14336,Gemm_Hipblaslt_TN_9738,1.52474
GemmTunableOp_Half_TN,tn_6144_248_4096,Gemm_Rocblas_621286493,0.0367484
GemmTunableOp_Half_TN,tn_6144_6976_4096,Gemm_Hipblaslt_TN_9697,0.589123
GemmTunableOp_Half_TN,tn_10240_2096_8192,Gemm_Hipblaslt_TN_9729,0.621161
GemmTunableOp_Half_TN,tn_28672_7267_4096,Gemm_Hipblaslt_TN_159,2.88107
GemmTunableOp_Half_TN,tn_28672_1608_4096,Gemm_Hipblaslt_TN_9217,0.707645
GemmTunableOp_Half_TN,tn_8192_2081_8192,Gemm_Hipblaslt_TN_9742,0.49872
GemmTunableOp_Half_TN,tn_4096_56_4096,Gemm_Rocblas_621286426,0.0128412
GemmTunableOp_Half_TN,tn_8192_54_28672,Gemm_Rocblas_621294228,0.141622
GemmTunableOp_Half_TN,tn_28672_7364_4096,Gemm_Hipblaslt_TN_159,2.91367
GemmTunableOp_Half_TN,tn_4096_3773_4096,Gemm_Hipblaslt_TN_9749,0.212493
GemmTunableOp_Half_TN,tn_28672_72_4096,Gemm_Rocblas_621294461,0.054532
GemmTunableOp_Half_TN,tn_128256_106_4096,Gemm_Hipblaslt_TN_9263,0.419065
GemmTunableOp_Half_TN,tn_28672_3602_4096,Gemm_Hipblaslt_TN_9832,1.46224
GemmTunableOp_Half_TN,tn_4096_3420_14336,Gemm_Hipblaslt_TN_9683,0.663305
GemmTunableOp_Half_TN,tn_128256_112_4096,Gemm_Hipblaslt_TN_9061,0.422758
GemmTunableOp_Half_TN,tn_28672_7730_4096,Gemm_Hipblaslt_TN_159,2.99741
GemmTunableOp_Half_TN,tn_6144_24_4096,Gemm_Rocblas_621286273,0.013556
GemmTunableOp_Half_TN,tn_6144_5068_4096,Gemm_Hipblaslt_TN_9220,0.430199
GemmTunableOp_Half_TN,tn_4096_3373_4096,Gemm_Hipblaslt_TN_9743,0.192523
GemmTunableOp_Half_TN,tn_6144_104_4096,Gemm_Rocblas_621294230,0.0226911
GemmTunableOp_Half_TN,tn_4096_5447_14336,Gemm_Hipblaslt_TN_9709,1.13139
GemmTunableOp_Half_TN,tn_4096_5273_4096,Gemm_Hipblaslt_TN_9799,0.318837
GemmTunableOp_Half_TN,tn_4096_1646_14336,Gemm_Hipblaslt_TN_9671,0.361969
GemmTunableOp_Half_TN,tn_4096_248_4096,Gemm_Rocblas_621286491,0.026499
GemmTunableOp_Half_TN,tn_28672_96_4096,Gemm_Rocblas_621294461,0.0578357
GemmTunableOp_Half_TN,tn_128256_57_4096,Gemm_Rocblas_621286813,0.354131
GemmTunableOp_Half_TN,tn_4096_1665_4096,Gemm_Hipblaslt_TN_9616,0.103456
GemmTunableOp_Half_TN,tn_8192_2302_8192,Gemm_Hipblaslt_TN_9763,0.515886
GemmTunableOp_Half_TN,tn_28672_7568_4096,Gemm_Hipblaslt_TN_159,2.97697
GemmTunableOp_Half_TN,tn_4096_5352_14336,Gemm_Hipblaslt_TN_9799,1.11571
GemmTunableOp_Half_TN,tn_6144_5533_4096,Gemm_Hipblaslt_TN_9704,0.454903
GemmTunableOp_Half_TN,tn_4096_240_4096,Gemm_Rocblas_621286440,0.0261374
GemmTunableOp_Half_TN,tn_10240_2270_8192,Gemm_Rocblas_621286617,0.652606
GemmTunableOp_Half_TN,tn_4096_7186_14336,Gemm_Hipblaslt_TN_9743,1.42418
GemmTunableOp_Half_TN,tn_28672_88_4096,Gemm_Rocblas_621294461,0.0571638
GemmTunableOp_Half_TN,tn_10240_2465_8192,Gemm_Hipblaslt_TN_9697,0.693573
GemmTunableOp_Half_TN,tn_128256_247_4096,Gemm_Rocblas_621286905,0.600968
GemmTunableOp_Half_TN,tn_28672_7136_4096,Gemm_Hipblaslt_TN_9919,2.89193
GemmTunableOp_Half_TN,tn_4096_48_14336,Gemm_Hipblaslt_TN_8050,0.0315206
GemmTunableOp_Half_TN,tn_4096_1622_4096,Gemm_Hipblaslt_TN_9607,0.1055
GemmTunableOp_Half_TN,tn_28672_7386_4096,Gemm_Hipblaslt_TN_159,2.87603
GemmTunableOp_Half_TN,tn_4096_7067_14336,Gemm_Hipblaslt_TN_9743,1.42042
GemmTunableOp_Half_TN,tn_8192_2096_8192,Gemm_Hipblaslt_TN_9763,0.500206
GemmTunableOp_Half_TN,tn_6144_7340_4096,Gemm_Hipblaslt_TN_9190,0.626879
GemmTunableOp_Half_TN,tn_6144_1731_4096,Gemm_Hipblaslt_TN_9799,0.157916
GemmTunableOp_Half_TN,tn_128256_29_4096,Gemm_Hipblaslt_TN_9451,0.310362
GemmTunableOp_Half_TN,tn_57344_2413_8192,Gemm_Hipblaslt_TN_9924,4.40781
GemmTunableOp_Half_TN,tn_4096_6979_4096,Gemm_Hipblaslt_TN_9743,0.394838
GemmTunableOp_Half_TN,tn_4096_7108_4096,Gemm_Hipblaslt_TN_9743,0.398989
GemmTunableOp_Half_TN,tn_4096_5354_14336,Gemm_Hipblaslt_TN_9709,1.11326
GemmTunableOp_Half_TN,tn_4096_7170_4096,Gemm_Hipblaslt_TN_9814,0.403332
GemmTunableOp_Half_TN,tn_28672_5089_4096,Gemm_Hipblaslt_TN_9849,2.08108
GemmTunableOp_Half_TN,tn_28672_7096_4096,Gemm_Hipblaslt_TN_9898,2.88065
GemmTunableOp_Half_TN,tn_4096_1764_4096,Gemm_Hipblaslt_TN_9134,0.117047
GemmTunableOp_Half_TN,tn_4096_184_4096,Gemm_Rocblas_621294230,0.0229693
GemmTunableOp_Half_TN,tn_6144_3780_4096,Gemm_Hipblaslt_TN_9687,0.332733
GemmTunableOp_Half_TN,tn_4096_3645_14336,Gemm_Hipblaslt_TN_9677,0.69159
GemmTunableOp_Half_TN,tn_6144_224_4096,Gemm_Hipblaslt_TN_9494,0.0338034
GemmTunableOp_Half_TN,tn_4096_7190_14336,Gemm_Hipblaslt_TN_9743,1.43012
GemmTunableOp_Half_TN,tn_4096_5100_4096,Gemm_Hipblaslt_TN_9924,0.313708
GemmTunableOp_Half_TN,tn_4096_3514_4096,Gemm_Hipblaslt_TN_9682,0.198541
GemmTunableOp_Half_TN,tn_28672_200_4096,Gemm_Hipblaslt_TN_9267,0.110764
GemmTunableOp_Half_TN,tn_4096_1658_14336,Gemm_Hipblaslt_TN_9671,0.361295
GemmTunableOp_Half_TN,tn_4096_3466_14336,Gemm_Hipblaslt_TN_9677,0.675129
GemmTunableOp_Half_TN,tn_4096_7118_14336,Gemm_Hipblaslt_TN_9743,1.42738
GemmTunableOp_Half_TN,tn_28672_6744_4096,Gemm_Hipblaslt_TN_9947,2.78236
GemmTunableOp_Half_TN,tn_4096_208_14336,Gemm_Hipblaslt_TN_9363,0.0696022
GemmTunableOp_Half_TN,tn_4096_1930_4096,Gemm_Hipblaslt_TN_9645,0.122564
GemmTunableOp_Half_TN,tn_6144_5541_4096,Gemm_Rocblas_621286713,0.453378
GemmTunableOp_Half_TN,tn_4096_1663_4096,Gemm_Hipblaslt_TN_9610,0.10639
GemmTunableOp_Half_TN,tn_4096_5512_14336,Gemm_Hipblaslt_TN_9691,1.15027
GemmTunableOp_Half_TN,tn_4096_1892_4096,Gemm_Hipblaslt_TN_9134,0.119891
GemmTunableOp_Half_TN,tn_4096_1867_4096,Gemm_Hipblaslt_TN_9645,0.121
GemmTunableOp_Half_TN,tn_28672_7475_4096,Gemm_Hipblaslt_TN_159,2.92614
GemmTunableOp_Half_TN,tn_4096_7364_4096,Gemm_Hipblaslt_TN_9890,0.418477
GemmTunableOp_Half_TN,tn_4096_1889_4096,Gemm_Hipblaslt_TN_9134,0.120402
GemmTunableOp_Half_TN,tn_6144_1690_4096,Gemm_Rocblas_621286753,0.155392
GemmTunableOp_Half_TN,tn_28672_1592_4096,Gemm_Hipblaslt_TN_9674,0.698753
GemmTunableOp_Half_TN,tn_6144_7104_4096,Gemm_Hipblaslt_TN_9187,0.5911
GemmTunableOp_Half_TN,tn_28672_7186_4096,Gemm_Hipblaslt_TN_159,2.87272
GemmTunableOp_Half_TN,tn_4096_1978_4096,Gemm_Hipblaslt_TN_9680,0.122613
GemmTunableOp_Half_TN,tn_4096_5239_4096,Gemm_Hipblaslt_TN_9691,0.316499
GemmTunableOp_Half_TN,tn_28672_1763_4096,Gemm_Hipblaslt_TN_9184,0.735371
GemmTunableOp_Half_TN,tn_128256_185_4096,Gemm_Hipblaslt_TN_9952,0.513992
GemmTunableOp_Half_TN,tn_6144_5267_4096,Gemm_Rocblas_621286678,0.437657
GemmTunableOp_Half_TN,tn_4096_1717_4096,Gemm_Hipblaslt_TN_9587,0.106984
GemmTunableOp_Half_TN,tn_4096_1894_4096,Gemm_Hipblaslt_TN_9645,0.120987
GemmTunableOp_Half_TN,tn_6144_1739_4096,Gemm_Hipblaslt_TN_9691,0.158244
GemmTunableOp_Half_TN,tn_4096_1898_4096,Gemm_Hipblaslt_TN_9134,0.120576
GemmTunableOp_Half_TN,tn_4096_1684_14336,Gemm_Hipblaslt_TN_9671,0.363181
GemmTunableOp_Half_TN,tn_4096_1660_14336,Gemm_Hipblaslt_TN_9671,0.361114
GemmTunableOp_Half_TN,tn_6144_1655_4096,Gemm_Rocblas_621286753,0.153854
GemmTunableOp_Half_TN,tn_4096_6721_14336,Gemm_Hipblaslt_TN_9683,1.37921
GemmTunableOp_Half_TN,tn_6144_1733_4096,Gemm_Hipblaslt_TN_9691,0.157069
GemmTunableOp_Half_TN,tn_4096_1961_14336,Gemm_Hipblaslt_TN_9136,0.414738
GemmTunableOp_Half_TN,tn_8192_2465_8192,Gemm_Hipblaslt_TN_9774,0.597415
GemmTunableOp_Half_TN,tn_4096_1787_4096,Gemm_Hipblaslt_TN_9134,0.117067
GemmTunableOp_Half_TN,tn_6144_1667_4096,Gemm_Rocblas_621286753,0.154027
GemmTunableOp_Half_TN,tn_6144_5277_4096,Gemm_Rocblas_621286713,0.438341
GemmTunableOp_Half_TN,tn_57344_2017_8192,Gemm_Hipblaslt_TN_9840,3.50167
GemmTunableOp_Half_TN,tn_4096_1765_14336,Gemm_Hipblaslt_TN_9645,0.394591
GemmTunableOp_Half_TN,tn_4096_7575_14336,Gemm_Hipblaslt_TN_9753,1.55086
GemmTunableOp_Half_TN,tn_28672_7327_4096,Gemm_Hipblaslt_TN_159,2.91292
GemmTunableOp_Half_TN,tn_4096_248_14336,Gemm_Hipblaslt_TN_8879,0.0787789
GemmTunableOp_Half_TN,tn_4096_7240_4096,Gemm_Hipblaslt_TN_153,0.405664
GemmTunableOp_Half_TN,tn_4096_112_14336,Gemm_Hipblaslt_TN_7160,0.0450069
GemmTunableOp_Half_TN,tn_8192_2049_8192,Gemm_Hipblaslt_TN_9742,0.490938
GemmTunableOp_Half_TN,tn_4096_152_4096,Gemm_Rocblas_621294168,0.0221306
GemmTunableOp_Half_TN,tn_6144_6920_4096,Gemm_Hipblaslt_TN_9677,0.589276
GemmTunableOp_Half_TN,tn_6144_5470_4096,Gemm_Hipblaslt_TN_9190,0.450998
GemmTunableOp_Half_TN,tn_4096_7568_14336,Gemm_Hipblaslt_TN_9753,1.54875
GemmTunableOp_Half_TN,tn_28672_1826_4096,Gemm_Hipblaslt_TN_9684,0.784785
GemmTunableOp_Half_TN,tn_4096_7552_4096,Gemm_Hipblaslt_TN_9753,0.424523
GemmTunableOp_Half_TN,tn_10240_2239_8192,Gemm_Hipblaslt_TN_9211,0.634914
GemmTunableOp_Half_TN,tn_28672_5285_4096,Gemm_Hipblaslt_TN_9915,2.14778
GemmTunableOp_Half_TN,tn_6144_1855_4096,Gemm_Hipblaslt_TN_9691,0.165301
GemmTunableOp_Half_TN,tn_4096_7432_4096,Gemm_Hipblaslt_TN_9914,0.422379
GemmTunableOp_Half_TN,tn_4096_1573_14336,Gemm_Hipblaslt_TN_9679,0.353635
GemmTunableOp_Half_TN,tn_4096_1603_4096,Gemm_Hipblaslt_TN_9607,0.103083
GemmTunableOp_Half_TN,tn_8192_2369_8192,Gemm_Hipblaslt_TN_9229,0.544763
GemmTunableOp_Half_TN,tn_4096_3767_4096,Gemm_Hipblaslt_TN_9841,0.213701
GemmTunableOp_Half_TN,tn_4096_3578_14336,Gemm_Hipblaslt_TN_9677,0.681939
GemmTunableOp_Half_TN,tn_6144_1902_4096,Gemm_Hipblaslt_TN_9690,0.16736
GemmTunableOp_Half_TN,tn_6144_7475_4096,Gemm_Hipblaslt_TN_9933,0.634182
GemmTunableOp_Half_TN,tn_4096_1668_4096,Gemm_Hipblaslt_TN_9587,0.102851
GemmTunableOp_Half_TN,tn_4096_1722_14336,Gemm_Hipblaslt_TN_9164,0.366333
GemmTunableOp_Half_TN,tn_4096_64_4096,Gemm_Rocblas_621286488,0.0126268
GemmTunableOp_Half_TN,tn_4096_1667_14336,Gemm_Hipblaslt_TN_9671,0.362622
GemmTunableOp_Half_TN,tn_28672_7023_4096,Gemm_Hipblaslt_TN_9747,2.86346
GemmTunableOp_Half_TN,tn_4096_5100_14336,Gemm_Hipblaslt_TN_9799,1.04877
GemmTunableOp_Half_TN,tn_10240_2191_8192,Gemm_Hipblaslt_TN_9211,0.629069
GemmTunableOp_Half_TN,tn_4096_6715_14336,Gemm_Hipblaslt_TN_9692,1.36312
GemmTunableOp_Half_TN,tn_57344_4066_8192,Gemm_Hipblaslt_TN_9882,6.63913
GemmTunableOp_Half_TN,tn_4096_3793_4096,Gemm_Hipblaslt_TN_9184,0.214622
GemmTunableOp_Half_TN,tn_4096_7253_4096,Gemm_Rocblas_621286701,0.406151
GemmTunableOp_Half_TN,tn_4096_144_4096,Gemm_Hipblaslt_TN_9127,0.0218486
GemmTunableOp_Half_TN,tn_6144_7345_4096,Gemm_Rocblas_621294455,0.624454
GemmTunableOp_Half_TN,tn_4096_1601_4096,Gemm_Hipblaslt_TN_9607,0.10432
GemmTunableOp_Half_TN,tn_6144_1722_4096,Gemm_Rocblas_621294495,0.155839
GemmTunableOp_Half_TN,tn_28672_3780_4096,Gemm_Hipblaslt_TN_9827,1.4997
GemmTunableOp_Half_TN,tn_28672_1786_4096,Gemm_Hipblaslt_TN_9223,0.741492
GemmTunableOp_Half_TN,tn_28672_6747_4096,Gemm_Hipblaslt_TN_9944,2.7827
GemmTunableOp_Half_TN,tn_28672_5723_4096,Gemm_Hipblaslt_TN_9924,2.40046
GemmTunableOp_Half_TN,tn_4096_1745_4096,Gemm_Hipblaslt_TN_9645,0.116254
GemmTunableOp_Half_TN,tn_4096_6916_4096,Gemm_Hipblaslt_TN_9694,0.39569
GemmTunableOp_Half_TN,tn_4096_1871_4096,Gemm_Hipblaslt_TN_9134,0.119795
GemmTunableOp_Half_TN,tn_28672_6971_4096,Gemm_Hipblaslt_TN_9898,2.84702
GemmTunableOp_Half_TN,tn_4096_1957_4096,Gemm_Hipblaslt_TN_9645,0.122827
GemmTunableOp_Half_TN,tn_6144_1763_4096,Gemm_Hipblaslt_TN_9691,0.162346
GemmTunableOp_Half_TN,tn_4096_1739_14336,Gemm_Hipblaslt_TN_9645,0.392077
GemmTunableOp_Half_TN,tn_6144_1948_4096,Gemm_Hipblaslt_TN_9693,0.177212
GemmTunableOp_Half_TN,tn_6144_3441_4096,Gemm_Rocblas_621286753,0.30813
GemmTunableOp_Half_TN,tn_28672_6881_4096,Gemm_Hipblaslt_TN_9958,2.80102
GemmTunableOp_Half_TN,tn_4096_1763_4096,Gemm_Hipblaslt_TN_9134,0.114714
GemmTunableOp_Half_TN,tn_6144_3597_4096,Gemm_Rocblas_621294495,0.315809
GemmTunableOp_Half_TN,tn_28672_3214_4096,Gemm_Hipblaslt_TN_9827,1.33738
GemmTunableOp_Half_TN,tn_4096_7439_4096,Gemm_Hipblaslt_TN_9904,0.42286
GemmTunableOp_Half_TN,tn_4096_104_4096,Gemm_Rocblas_621286280,0.0166432
GemmTunableOp_Half_TN,tn_128256_131_4096,Gemm_Hipblaslt_TN_9108,0.460778
GemmTunableOp_Half_TN,tn_4096_1866_14336,Gemm_Hipblaslt_TN_9620,0.408998
GemmTunableOp_Half_TN,tn_6144_1888_4096,Gemm_Hipblaslt_TN_9690,0.165982
GemmTunableOp_Half_TN,tn_128256_241_4096,Gemm_Rocblas_621286892,0.603132
GemmTunableOp_Half_TN,tn_4096_3497_14336,Gemm_Hipblaslt_TN_9677,0.676187
GemmTunableOp_Half_TN,tn_4096_6761_14336,Gemm_Hipblaslt_TN_9694,1.3722
GemmTunableOp_Half_TN,tn_4096_3722_14336,Gemm_Hipblaslt_TN_9827,0.717735
GemmTunableOp_Half_TN,tn_57344_2239_8192,Default,3.9479
GemmTunableOp_Half_TN,tn_6144_1792_4096,Gemm_Hipblaslt_TN_9793,0.160708
GemmTunableOp_Half_TN,tn_8192_31_28672,Gemm_Rocblas_621286354,0.128482
GemmTunableOp_Half_TN,tn_128256_122_4096,Gemm_Rocblas_621294105,0.433975
GemmTunableOp_Half_TN,tn_28672_5381_4096,Gemm_Hipblaslt_TN_9924,2.24765
GemmTunableOp_Half_TN,tn_28672_7171_4096,Gemm_Hipblaslt_TN_159,2.88834
GemmTunableOp_Half_TN,tn_4096_1829_4096,Gemm_Hipblaslt_TN_9645,0.118156
GemmTunableOp_Half_TN,tn_4096_3345_14336,Gemm_Hipblaslt_TN_9682,0.648534
GemmTunableOp_Half_TN,tn_28672_1738_4096,Gemm_Hipblaslt_TN_9190,0.727699
GemmTunableOp_Half_TN,tn_4096_1831_4096,Gemm_Hipblaslt_TN_9134,0.119452
GemmTunableOp_Half_TN,tn_28672_1981_4096,Gemm_Hipblaslt_TN_9846,0.844307
GemmTunableOp_Half_TN,tn_4096_176_4096,Gemm_Rocblas_621294230,0.0223551
GemmTunableOp_Half_TN,tn_4096_1683_4096,Gemm_Hipblaslt_TN_9164,0.10765
GemmTunableOp_Half_TN,tn_4096_1727_4096,Gemm_Hipblaslt_TN_9610,0.107854
GemmTunableOp_Half_TN,tn_28672_112_4096,Gemm_Rocblas_621286503,0.0688836
GemmTunableOp_Half_TN,tn_6144_5465_4096,Gemm_Hipblaslt_TN_9190,0.452909
GemmTunableOp_Half_TN,tn_6144_1857_4096,Gemm_Hipblaslt_TN_9687,0.164445
GemmTunableOp_Half_TN,tn_4096_1778_14336,Gemm_Hipblaslt_TN_9645,0.393476
GemmTunableOp_Half_TN,tn_4096_160_14336,Gemm_Hipblaslt_TN_8260,0.0549305
GemmTunableOp_Half_TN,tn_6144_3559_4096,Gemm_Hipblaslt_TN_9570,0.314715
GemmTunableOp_Half_TN,tn_4096_1691_4096,Gemm_Hipblaslt_TN_9265,0.107724
GemmTunableOp_Half_TN,tn_4096_1601_14336,Gemm_Hipblaslt_TN_9671,0.356699
GemmTunableOp_Half_TN,tn_4096_6708_14336,Gemm_Hipblaslt_TN_9732,1.36536
GemmTunableOp_Half_TN,tn_6144_1889_4096,Gemm_Hipblaslt_TN_9672,0.166494
GemmTunableOp_Half_TN,tn_6144_1647_4096,Gemm_Hipblaslt_TN_9570,0.149718
GemmTunableOp_Half_TN,tn_28672_1628_4096,Gemm_Rocblas_621286678,0.71121
GemmTunableOp_Half_TN,tn_4096_1642_14336,Gemm_Hipblaslt_TN_9671,0.360458
GemmTunableOp_Half_TN,tn_4096_3710_14336,Gemm_Hipblaslt_TN_9827,0.718385
GemmTunableOp_Half_TN,tn_4096_1731_4096,Gemm_Hipblaslt_TN_9267,0.116533
GemmTunableOp_Half_TN,tn_6144_3629_4096,Gemm_Hipblaslt_TN_9570,0.315893
GemmTunableOp_Half_TN,tn_4096_7478_4096,Gemm_Hipblaslt_TN_9933,0.420514
GemmTunableOp_Half_TN,tn_28672_5100_4096,Gemm_Hipblaslt_TN_9849,2.08269
GemmTunableOp_Half_TN,tn_4096_1597_4096,Gemm_Hipblaslt_TN_9607,0.105081
GemmTunableOp_Half_TN,tn_4096_1721_14336,Gemm_Hipblaslt_TN_9790,0.367193
GemmTunableOp_Half_TN,tn_28672_1622_4096,Gemm_Hipblaslt_TN_9219,0.710873
GemmTunableOp_Half_TN,tn_4096_1977_4096,Gemm_Hipblaslt_TN_9680,0.122809
GemmTunableOp_Half_TN,tn_6144_1703_4096,Gemm_Hipblaslt_TN_9570,0.155119
GemmTunableOp_Half_TN,tn_4096_1934_4096,Gemm_Hipblaslt_TN_9645,0.122552
GemmTunableOp_Half_TN,tn_4096_1934_14336,Gemm_Hipblaslt_TN_9680,0.412844
GemmStridedBatchedTunableOp_Half_TN,tn_1910_1910_128_B_32,Gemm_Hipblaslt_TN_6942,0.14835
GemmStridedBatchedTunableOp_Half_TN,tn_1704_1704_128_B_32,Gemm_Rocblas_621294110,0.115387
GemmStridedBatchedTunableOp_Half_TN,tn_1590_1590_128_B_32,Gemm_Rocblas_621286397,0.110068
GemmStridedBatchedTunableOp_Half_TN,tn_1715_1715_128_B_32,Gemm_Rocblas_621286397,0.122166
GemmStridedBatchedTunableOp_Half_TN,tn_1635_1635_128_B_32,Gemm_Rocblas_621286397,0.112771
GemmStridedBatchedTunableOp_Half_TN,tn_1975_1975_128_B_32,Gemm_Rocblas_621294533,0.161527
GemmStridedBatchedTunableOp_Half_TN,tn_1794_1794_128_B_32,Gemm_Rocblas_621286397,0.132882
GemmStridedBatchedTunableOp_Half_TN,tn_1727_1727_128_B_32,Gemm_Rocblas_621286397,0.122469
GemmStridedBatchedTunableOp_Half_TN,tn_1961_1961_128_B_32,Gemm_Hipblaslt_TN_6879,0.157138
GemmStridedBatchedTunableOp_Half_TN,tn_1916_1916_128_B_32,Gemm_Hipblaslt_TN_6942,0.14756
GemmStridedBatchedTunableOp_Half_TN,tn_1577_1577_128_B_32,Gemm_Hipblaslt_TN_6942,0.110304
GemmStridedBatchedTunableOp_Half_TN,tn_1788_1788_128_B_32,Gemm_Rocblas_621294106,0.12931
GemmStridedBatchedTunableOp_Half_TN,tn_1853_1853_128_B_32,Gemm_Hipblaslt_TN_6942,0.138986
GemmStridedBatchedTunableOp_Half_TN,tn_1797_1797_128_B_32,Gemm_Hipblaslt_TN_6942,0.134289
GemmStridedBatchedTunableOp_Half_TN,tn_1653_1653_128_B_32,Gemm_Hipblaslt_TN_6942,0.116508
GemmStridedBatchedTunableOp_Half_TN,tn_1920_1920_128_B_32,Gemm_Rocblas_621286566,0.126624
GemmStridedBatchedTunableOp_Half_TN,tn_1972_1972_128_B_32,Gemm_Hipblaslt_TN_6879,0.158239
GemmStridedBatchedTunableOp_Half_TN,tn_1696_1696_128_B_32,Gemm_Rocblas_621286413,0.108009
GemmStridedBatchedTunableOp_Half_TN,tn_1586_1586_128_B_32,Gemm_Rocblas_621286397,0.107623
GemmStridedBatchedTunableOp_Half_TN,tn_1808_1808_128_B_32,Gemm_Rocblas_621286810,0.12735
GemmStridedBatchedTunableOp_Half_TN,tn_1634_1634_128_B_32,Gemm_Hipblaslt_TN_6942,0.11102
GemmStridedBatchedTunableOp_Half_TN,tn_1877_1877_128_B_32,Gemm_Hipblaslt_TN_6942,0.143235
GemmStridedBatchedTunableOp_Half_TN,tn_1843_1843_128_B_32,Gemm_Rocblas_621286397,0.13903
GemmStridedBatchedTunableOp_Half_TN,tn_1875_1875_128_B_32,Gemm_Rocblas_621286397,0.145693
GemmStridedBatchedTunableOp_Half_TN,tn_1802_1802_128_B_32,Gemm_Hipblaslt_TN_6942,0.13441
GemmStridedBatchedTunableOp_Half_TN,tn_1633_1633_128_B_32,Gemm_Rocblas_621286397,0.114686
GemmStridedBatchedTunableOp_Half_TN,tn_1738_1738_128_B_32,Gemm_Rocblas_621286397,0.123489
GemmStridedBatchedTunableOp_Half_TN,tn_1952_1952_128_B_32,Gemm_Hipblaslt_TN_153,0.142895
GemmStridedBatchedTunableOp_Half_TN,tn_1796_1796_128_B_32,Gemm_Hipblaslt_TN_6942,0.131846
GemmStridedBatchedTunableOp_Half_TN,tn_1870_1870_128_B_32,Gemm_Hipblaslt_TN_6942,0.144848
GemmStridedBatchedTunableOp_Half_TN,tn_1732_1732_128_B_32,Gemm_Rocblas_621286397,0.122756
GemmStridedBatchedTunableOp_Half_TN,tn_1967_1967_128_B_32,Gemm_Rocblas_621286397,0.159138
GemmStridedBatchedTunableOp_Half_TN,tn_1676_1676_128_B_32,Gemm_Rocblas_621294110,0.115781
GemmStridedBatchedTunableOp_Half_TN,tn_1792_1792_128_B_32,Gemm_Rocblas_621286397,0.0997299
GemmStridedBatchedTunableOp_Half_TN,tn_1689_1689_128_B_32,Gemm_Hipblaslt_TN_6942,0.118461
GemmStridedBatchedTunableOp_Half_TN,tn_1868_1868_128_B_32,Gemm_Hipblaslt_TN_6942,0.141407
GemmStridedBatchedTunableOp_Half_TN,tn_1846_1846_128_B_32,Gemm_Rocblas_621286397,0.139522
GemmStridedBatchedTunableOp_Half_TN,tn_1681_1681_128_B_32,Gemm_Hipblaslt_TN_6942,0.118749
GemmStridedBatchedTunableOp_Half_TN,tn_1616_1616_128_B_32,Gemm_Rocblas_621294106,0.105716
GemmStridedBatchedTunableOp_Half_TN,tn_1750_1750_128_B_32,Gemm_Rocblas_621294110,0.125117
GemmStridedBatchedTunableOp_Half_TN,tn_2190_2190_128_B_64,Gemm_Rocblas_621294106,0.388216
GemmStridedBatchedTunableOp_Half_TN,tn_1641_1641_128_B_32,Gemm_Rocblas_621286397,0.112985
GemmStridedBatchedTunableOp_Half_TN,tn_1665_1665_128_B_32,Gemm_Hipblaslt_TN_6942,0.115269
GemmStridedBatchedTunableOp_Half_TN,tn_1970_1970_128_B_32,Gemm_Rocblas_621286397,0.158435
GemmStridedBatchedTunableOp_Half_TN,tn_1697_1697_128_B_32,Gemm_Hipblaslt_TN_6942,0.119826
GemmStridedBatchedTunableOp_Half_TN,tn_1795_1795_128_B_32,Gemm_Hipblaslt_TN_6942,0.133409
GemmStridedBatchedTunableOp_Half_TN,tn_1680_1680_128_B_32,Gemm_Rocblas_621294110,0.11038
GemmStridedBatchedTunableOp_Half_TN,tn_1823_1823_128_B_32,Gemm_Rocblas_621286397,0.135142
GemmStridedBatchedTunableOp_Half_TN,tn_1647_1647_128_B_32,Gemm_Hipblaslt_TN_6942,0.115192
GemmStridedBatchedTunableOp_Half_TN,tn_2113_2113_128_B_64,Gemm_Rocblas_621294106,0.36754
GemmStridedBatchedTunableOp_Half_TN,tn_1812_1812_128_B_32,Gemm_Rocblas_621286397,0.135641
GemmStridedBatchedTunableOp_Half_TN,tn_1819_1819_128_B_32,Gemm_Hipblaslt_TN_6942,0.136435
GemmStridedBatchedTunableOp_Half_TN,tn_2208_2208_128_B_64,Gemm_Hipblaslt_TN_158,0.362015
GemmStridedBatchedTunableOp_Half_TN,tn_2397_2397_128_B_64,Gemm_Rocblas_621294106,0.459404
GemmStridedBatchedTunableOp_Half_TN,tn_1824_1824_128_B_32,Gemm_Rocblas_621286810,0.12471
GemmStridedBatchedTunableOp_Half_TN,tn_1944_1944_128_B_32,Gemm_Hipblaslt_TN_153,0.145627
GemmStridedBatchedTunableOp_Half_TN,tn_1817_1817_128_B_32,Gemm_Hipblaslt_TN_6942,0.134498
GemmStridedBatchedTunableOp_Half_TN,tn_1753_1753_128_B_32,Gemm_Rocblas_621286397,0.125519
GemmStridedBatchedTunableOp_Half_TN,tn_1913_1913_128_B_32,Gemm_Hipblaslt_TN_6950,0.148731
GemmStridedBatchedTunableOp_Half_TN,tn_2304_2304_128_B_64,Gemm_Hipblaslt_TN_158,0.351234
GemmStridedBatchedTunableOp_Half_TN,tn_1899_1899_128_B_32,Gemm_Hipblaslt_TN_6942,0.147523
GemmStridedBatchedTunableOp_Half_TN,tn_2082_2082_128_B_64,Gemm_Rocblas_621294106,0.351159
GemmStridedBatchedTunableOp_Half_TN,tn_1691_1691_128_B_32,Gemm_Hipblaslt_TN_6942,0.120866
GemmStridedBatchedTunableOp_Half_TN,tn_1683_1683_128_B_32,Gemm_Hipblaslt_TN_6942,0.118129
GemmStridedBatchedTunableOp_Half_TN,tn_1667_1667_128_B_32,Gemm_Hipblaslt_TN_6942,0.117096
GemmStridedBatchedTunableOp_Half_TN,tn_1702_1702_128_B_32,Gemm_Hipblaslt_TN_6942,0.119884
GemmStridedBatchedTunableOp_Half_TN,tn_1585_1585_128_B_32,Gemm_Hipblaslt_TN_6942,0.110745
GemmStridedBatchedTunableOp_Half_TN,tn_2465_2465_128_B_64,Gemm_Rocblas_621294106,0.477157
GemmStridedBatchedTunableOp_Half_TN,tn_2033_2033_128_B_64,Gemm_Hipblaslt_TN_6950,0.344259
GemmStridedBatchedTunableOp_Half_TN,tn_1886_1886_128_B_32,Gemm_Hipblaslt_TN_6942,0.14394
GemmStridedBatchedTunableOp_Half_TN,tn_1706_1706_128_B_32,Gemm_Hipblaslt_TN_6942,0.118332
GemmStridedBatchedTunableOp_Half_TN,tn_1867_1867_128_B_32,Gemm_Hipblaslt_TN_6942,0.144295
GemmStridedBatchedTunableOp_Half_TN,tn_1820_1820_128_B_32,Gemm_Rocblas_621286397,0.134059
GemmStridedBatchedTunableOp_Half_TN,tn_1848_1848_128_B_32,Gemm_Hipblaslt_TN_157,0.132031
GemmStridedBatchedTunableOp_Half_TN,tn_2177_2177_128_B_64,Gemm_Rocblas_621294106,0.380353
GemmStridedBatchedTunableOp_Half_TN,tn_1884_1884_128_B_32,Gemm_Rocblas_621286397,0.144005
GemmStridedBatchedTunableOp_Half_TN,tn_2159_2159_128_B_64,Gemm_Rocblas_621294106,0.376961
GemmStridedBatchedTunableOp_Half_TN,tn_2225_2225_128_B_64,Gemm_Rocblas_621294106,0.394281
GemmStridedBatchedTunableOp_Half_TN,tn_1966_1966_128_B_32,Gemm_Rocblas_621286397,0.156426
GemmStridedBatchedTunableOp_Half_TN,tn_2000_2000_128_B_64,Gemm_Hipblaslt_TN_159,0.32236
GemmStridedBatchedTunableOp_Half_TN,tn_1924_1924_128_B_32,Gemm_Rocblas_621294533,0.150173
GemmStridedBatchedTunableOp_Half_TN,tn_2257_2257_128_B_64,Gemm_Rocblas_621294106,0.403266
GemmStridedBatchedTunableOp_Half_TN,tn_1773_1773_128_B_32,Gemm_Rocblas_621286397,0.130271
GemmStridedBatchedTunableOp_Half_TN,tn_1705_1705_128_B_32,Gemm_Hipblaslt_TN_6942,0.119216
GemmStridedBatchedTunableOp_Half_TN,tn_1807_1807_128_B_32,Gemm_Hipblaslt_TN_6942,0.134975
GemmStridedBatchedTunableOp_Half_TN,tn_32_32_128_B_32,Gemm_Rocblas_621294167,0.00608148
GemmStridedBatchedTunableOp_Half_TN,tn_1756_1756_128_B_32,Gemm_Rocblas_621286397,0.123357
GemmStridedBatchedTunableOp_Half_TN,tn_1640_1640_128_B_32,Gemm_Rocblas_621286397,0.111952
GemmStridedBatchedTunableOp_Half_TN,tn_1690_1690_128_B_32,Gemm_Rocblas_621294106,0.118126
GemmStridedBatchedTunableOp_Half_TN,tn_1959_1959_128_B_32,Gemm_Rocblas_621286397,0.154708
GemmStridedBatchedTunableOp_Half_TN,tn_1729_1729_128_B_32,Gemm_Rocblas_621286413,0.123068
GemmStridedBatchedTunableOp_Half_TN,tn_1876_1876_128_B_32,Gemm_Rocblas_621286397,0.139602
GemmStridedBatchedTunableOp_Half_TN,tn_1695_1695_128_B_32,Gemm_Rocblas_621286397,0.120025
GemmStridedBatchedTunableOp_Half_TN,tn_1596_1596_128_B_32,Gemm_Hipblaslt_TN_6942,0.108459
GemmStridedBatchedTunableOp_Half_TN,tn_1953_1953_128_B_32,Gemm_Rocblas_621286397,0.152506
GemmStridedBatchedTunableOp_Half_TN,tn_1902_1902_128_B_32,Gemm_Rocblas_621286397,0.146239
GemmStridedBatchedTunableOp_Half_TN,tn_1852_1852_128_B_32,Gemm_Hipblaslt_TN_6942,0.139692
GemmStridedBatchedTunableOp_Half_TN,tn_1983_1983_128_B_32,Gemm_Rocblas_621286397,0.156465
GemmStridedBatchedTunableOp_Half_TN,tn_1722_1722_128_B_32,Gemm_Rocblas_621286397,0.12117
GemmStridedBatchedTunableOp_Half_TN,tn_1898_1898_128_B_32,Gemm_Hipblaslt_TN_6942,0.144996
GemmStridedBatchedTunableOp_Half_TN,tn_1937_1937_128_B_32,Gemm_Hipblaslt_TN_6879,0.153822
GemmStridedBatchedTunableOp_Half_TN,tn_1747_1747_128_B_32,Gemm_Rocblas_621294106,0.125703
GemmStridedBatchedTunableOp_Half_TN,tn_1613_1613_128_B_32,Gemm_Hipblaslt_TN_6942,0.111503
GemmStridedBatchedTunableOp_Half_TN,tn_1860_1860_128_B_32,Gemm_Rocblas_621286397,0.137319
GemmStridedBatchedTunableOp_Half_TN,tn_1889_1889_128_B_32,Gemm_Rocblas_621286397,0.144352
GemmStridedBatchedTunableOp_Half_TN,tn_1933_1933_128_B_32,Gemm_Hipblaslt_TN_6879,0.154795
GemmStridedBatchedTunableOp_Half_TN,tn_1688_1688_128_B_32,Gemm_Rocblas_621294110,0.114279
GemmStridedBatchedTunableOp_Half_TN,tn_1988_1988_128_B_32,Gemm_Rocblas_621286397,0.160658
GemmStridedBatchedTunableOp_Half_TN,tn_1687_1687_128_B_32,Gemm_Hipblaslt_TN_6942,0.117822
GemmStridedBatchedTunableOp_Half_TN,tn_2032_2032_128_B_64,Gemm_Rocblas_621286397,0.332543
GemmStridedBatchedTunableOp_Half_TN,tn_1629_1629_128_B_32,Gemm_Rocblas_621286397,0.113353
