Gemm_Tune/Qwen1.5-110B-Chat-1000inp/full_tuned0.csv
Validator,PT_VERSION,2.4.0
Validator,ROCM_VERSION,6.1.0.0-82-5fabb4c
Validator,HIPBLASLT_VERSION,0.7.0-1549b021
Validator,GCN_ARCH_NAME,gfx942:sramecc+:xnack-
Validator,ROCBLAS_VERSION,4.1.0-cefa4a9b-dirty
GemmTunableOp_Half_TN,tn_4096_1900_2048,Gemm_Hipblaslt_TN_9590,0.063563
GemmTunableOp_Half_TN,tn_14336_877_4096,Gemm_Hipblaslt_TN_9677,0.180309
GemmTunableOp_Half_TN,tn_3072_881_4096,Gemm_Hipblaslt_TN_9131,0.0573261
GemmTunableOp_Half_TN,tn_14336_844_4096,Gemm_Hipblaslt_TN_9139,0.178341
GemmTunableOp_Half_TN,tn_14336_851_4096,Gemm_Hipblaslt_TN_9697,0.178702
GemmTunableOp_Half_TN,tn_3072_2635_4096,Gemm_Hipblaslt_TN_9134,0.122699
GemmTunableOp_Half_TN,tn_64128_80_4096,Gemm_Hipblaslt_TN_9058,0.180755
GemmTunableOp_Half_TN,tn_14336_7804_4096,Gemm_Hipblaslt_TN_9888,1.48956
GemmTunableOp_Half_TN,tn_64128_178_4096,Gemm_Hipblaslt_TN_9707,0.246175
GemmTunableOp_Half_TN,tn_14336_854_4096,Gemm_Hipblaslt_TN_9187,0.17897
GemmTunableOp_Half_TN,tn_4096_1881_7168,Gemm_Hipblaslt_TN_9134,0.206873
GemmTunableOp_Half_TN,tn_3072_851_4096,Gemm_Hipblaslt_TN_9368,0.0522063
GemmTunableOp_Half_TN,tn_4096_832_7168,Gemm_Hipblaslt_TN_9352,0.111297
GemmTunableOp_Half_TN,tn_3072_863_4096,Gemm_Hipblaslt_TN_9047,0.0557951
GemmTunableOp_Half_TN,tn_4096_951_7168,Gemm_Hipblaslt_TN_9604,0.119367
GemmTunableOp_Half_TN,tn_4096_861_7168,Gemm_Hipblaslt_TN_9604,0.112601
GemmTunableOp_Half_TN,tn_4096_3546_2048,Gemm_Hipblaslt_TN_9896,0.101071
GemmTunableOp_Half_TN,tn_3072_829_4096,Gemm_Hipblaslt_TN_9047,0.0525535
GemmTunableOp_Half_TN,tn_3072_916_4096,Gemm_Hipblaslt_TN_9352,0.0579191
GemmTunableOp_Half_TN,tn_4096_861_2048,Gemm_Hipblaslt_TN_9576,0.0362847
GemmTunableOp_Half_TN,tn_4096_808_2048,Gemm_Hipblaslt_TN_9604,0.033656
GemmTunableOp_Half_TN,tn_4096_2592_2048,Gemm_Hipblaslt_TN_9672,0.0836897
GemmTunableOp_Half_TN,tn_3072_7283_4096,Gemm_Hipblaslt_TN_9681,0.309262
GemmTunableOp_Half_TN,tn_4096_1614_7168,Gemm_Hipblaslt_TN_9359,0.180717
GemmTunableOp_Half_TN,tn_4096_1614_2048,Gemm_Hipblaslt_TN_9164,0.0566416
GemmTunableOp_Half_TN,tn_4096_7299_7168,Gemm_Hipblaslt_TN_9914,0.703303
GemmTunableOp_Half_TN,tn_4096_1705_2048,Gemm_Hipblaslt_TN_9164,0.0572555
GemmTunableOp_Half_TN,tn_14336_1897_4096,Gemm_Hipblaslt_TN_9697,0.371847
GemmTunableOp_Half_TN,tn_4096_1729_7168,Gemm_Hipblaslt_TN_9673,0.194659
GemmTunableOp_Half_TN,tn_3072_1729_4096,Gemm_Hipblaslt_TN_9322,0.0890354
GemmTunableOp_Half_TN,tn_4096_914_7168,Gemm_Hipblaslt_TN_9634,0.118557
GemmTunableOp_Half_TN,tn_4096_1831_2048,Gemm_Hipblaslt_TN_9590,0.0631775
GemmTunableOp_Half_TN,tn_64128_52_4096,Gemm_Hipblaslt_TN_9097,0.166767
GemmTunableOp_Half_TN,tn_3072_885_4096,Gemm_Hipblaslt_TN_9131,0.0566246
GemmTunableOp_Half_TN,tn_4096_923_2048,Gemm_Hipblaslt_TN_9576,0.0378382
GemmTunableOp_Half_TN,tn_14336_971_4096,Gemm_Hipblaslt_TN_9217,0.2023
GemmTunableOp_Half_TN,tn_64128_74_4096,Gemm_Hipblaslt_TN_9057,0.179588
GemmTunableOp_Half_TN,tn_3072_3546_4096,Gemm_Rocblas_621294495,0.156622
GemmTunableOp_Half_TN,tn_64128_175_4096,Gemm_Hipblaslt_TN_9816,0.243805
GemmTunableOp_Half_TN,tn_14336_2630_4096,Gemm_Hipblaslt_TN_9793,0.530322
GemmTunableOp_Half_TN,tn_3072_983_4096,Gemm_Hipblaslt_TN_9158,0.060805
GemmTunableOp_Half_TN,tn_4096_184_7168,Gemm_Rocblas_621286440,0.0394325
GemmTunableOp_Half_TN,tn_14336_961_4096,Gemm_Hipblaslt_TN_9217,0.201224
GemmTunableOp_Half_TN,tn_4096_875_2048,Gemm_Hipblaslt_TN_9576,0.036609
GemmTunableOp_Half_TN,tn_4096_908_7168,Gemm_Hipblaslt_TN_9577,0.118804
GemmTunableOp_Half_TN,tn_4096_1768_2048,Gemm_Hipblaslt_TN_9136,0.062436
GemmTunableOp_Half_TN,tn_3072_1768_4096,Gemm_Rocblas_621286778,0.0906053
GemmTunableOp_Half_TN,tn_3072_823_4096,Gemm_Hipblaslt_TN_9352,0.0546049
GemmTunableOp_Half_TN,tn_4096_8054_2048,Gemm_Hipblaslt_TN_9813,0.228812
GemmTunableOp_Half_TN,tn_4096_1672_2048,Gemm_Hipblaslt_TN_9616,0.0562944
GemmTunableOp_Half_TN,tn_14336_1831_4096,Gemm_Hipblaslt_TN_9677,0.365595
GemmTunableOp_Half_TN,tn_4096_2788_7168,Gemm_Hipblaslt_TN_9674,0.2796
GemmTunableOp_Half_TN,tn_3072_1880_4096,Gemm_Hipblaslt_TN_9324,0.0933968
GemmTunableOp_Half_TN,tn_4096_804_2048,Gemm_Hipblaslt_TN_9604,0.0341103
GemmTunableOp_Half_TN,tn_4096_2681_2048,Gemm_Hipblaslt_TN_9672,0.0844513
GemmTunableOp_Half_TN,tn_3072_1791_4096,Gemm_Rocblas_621286778,0.0916353
GemmTunableOp_Half_TN,tn_14336_2658_4096,Gemm_Hipblaslt_TN_9793,0.529095
GemmTunableOp_Half_TN,tn_3072_2681_4096,Gemm_Hipblaslt_TN_9134,0.123254
GemmTunableOp_Half_TN,tn_4096_1835_7168,Gemm_Hipblaslt_TN_9268,0.203021
GemmTunableOp_Half_TN,tn_14336_8156_4096,Gemm_Hipblaslt_TN_9933,1.53333
GemmTunableOp_Half_TN,tn_4096_800_7168,Gemm_Hipblaslt_TN_9352,0.109734
GemmTunableOp_Half_TN,tn_4096_901_7168,Gemm_Hipblaslt_TN_9576,0.117988
GemmTunableOp_Half_TN,tn_3072_924_4096,Gemm_Hipblaslt_TN_9131,0.0577746
GemmTunableOp_Half_TN,tn_14336_7809_4096,Gemm_Hipblaslt_TN_9914,1.49038
GemmTunableOp_Half_TN,tn_3072_831_4096,Gemm_Hipblaslt_TN_9047,0.0541768
GemmTunableOp_Half_TN,tn_14336_2635_4096,Gemm_Hipblaslt_TN_9793,0.529482
GemmTunableOp_Half_TN,tn_4096_7967_7168,Gemm_Hipblaslt_TN_9813,0.737103
GemmTunableOp_Half_TN,tn_3072_888_4096,Gemm_Hipblaslt_TN_9546,0.0588625
GemmTunableOp_Half_TN,tn_3072_7857_4096,Gemm_Rocblas_621294473,0.337152
GemmTunableOp_Half_TN,tn_3072_930_4096,Gemm_Hipblaslt_TN_9352,0.0583094
GemmTunableOp_Half_TN,tn_4096_7804_7168,Gemm_Hipblaslt_TN_9768,0.728606
GemmTunableOp_Half_TN,tn_4096_7787_2048,Gemm_Hipblaslt_TN_9768,0.22737
GemmTunableOp_Half_TN,tn_4096_8154_7168,Gemm_Rocblas_621286678,0.75085
GemmTunableOp_Half_TN,tn_4096_56_2048,Gemm_Rocblas_621294155,0.00798677
GemmTunableOp_Half_TN,tn_4096_1791_2048,Gemm_Hipblaslt_TN_9590,0.0629741
GemmTunableOp_Half_TN,tn_4096_946_2048,Gemm_Hipblaslt_TN_9604,0.038236
GemmTunableOp_Half_TN,tn_4096_8_2048,Gemm_Rocblas_621286311,0.00711547
GemmTunableOp_Half_TN,tn_4096_942_7168,Gemm_Hipblaslt_TN_9170,0.119564
GemmTunableOp_Half_TN,tn_14336_112_4096,Gemm_Rocblas_621286494,0.0403548
GemmTunableOp_Half_TN,tn_4096_2590_7168,Gemm_Hipblaslt_TN_9690,0.269821
GemmTunableOp_Half_TN,tn_4096_816_2048,Gemm_Hipblaslt_TN_9634,0.0340759
GemmTunableOp_Half_TN,tn_4096_1834_7168,Gemm_Hipblaslt_TN_9645,0.205109
GemmTunableOp_Half_TN,tn_3072_8192_4096,Gemm_Rocblas_621294473,0.351307
GemmTunableOp_Half_TN,tn_14336_3565_4096,Gemm_Hipblaslt_TN_9223,0.657067
GemmTunableOp_Half_TN,tn_4096_3352_7168,Gemm_Hipblaslt_TN_9697,0.327881
GemmTunableOp_Half_TN,tn_14336_2721_4096,Gemm_Hipblaslt_TN_9187,0.544013
GemmTunableOp_Half_TN,tn_3072_192_4096,Gemm_Rocblas_621294164,0.0185931
GemmTunableOp_Half_TN,tn_4096_821_7168,Gemm_Hipblaslt_TN_9131,0.11118
GemmTunableOp_Half_TN,tn_4096_1853_7168,Gemm_Hipblaslt_TN_9137,0.204461
GemmTunableOp_Half_TN,tn_64128_93_4096,Gemm_Hipblaslt_TN_9058,0.183836
GemmTunableOp_Half_TN,tn_4096_248_7168,Gemm_Rocblas_621286443,0.044406
GemmTunableOp_Half_TN,tn_64128_131_4096,Gemm_Hipblaslt_TN_9799,0.216034
GemmTunableOp_Half_TN,tn_14336_943_4096,Gemm_Hipblaslt_TN_9189,0.185105
GemmTunableOp_Half_TN,tn_4096_256_7168,Gemm_Rocblas_621294230,0.0445939
GemmTunableOp_Half_TN,tn_3072_1854_4096,Gemm_Hipblaslt_TN_9324,0.0934609
GemmTunableOp_Half_TN,tn_4096_1757_2048,Gemm_Hipblaslt_TN_9136,0.0623554
GemmTunableOp_Half_TN,tn_14336_8192_4096,Gemm_Hipblaslt_TN_9815,1.53072
GemmTunableOp_Half_TN,tn_14336_1886_4096,Gemm_Hipblaslt_TN_9187,0.370871
GemmTunableOp_Half_TN,tn_4096_814_2048,Gemm_Hipblaslt_TN_9604,0.0342081
GemmTunableOp_Half_TN,tn_14336_32_4096,Gemm_Rocblas_621286427,0.0258407
GemmTunableOp_Half_TN,tn_4096_1777_2048,Gemm_Hipblaslt_TN_9136,0.0619396
GemmTunableOp_Half_TN,tn_3072_1649_4096,Gemm_Hipblaslt_TN_9561,0.0888738
GemmTunableOp_Half_TN,tn_14336_838_4096,Gemm_Hipblaslt_TN_9139,0.178968
GemmTunableOp_Half_TN,tn_3072_811_4096,Gemm_Hipblaslt_TN_9047,0.0526778
GemmTunableOp_Half_TN,tn_64128_156_4096,Gemm_Hipblaslt_TN_9799,0.222793
GemmTunableOp_Half_TN,tn_4096_200_7168,Gemm_Rocblas_621294230,0.0423518
GemmTunableOp_Half_TN,tn_3072_1748_4096,Gemm_Hipblaslt_TN_9613,0.0906243
GemmTunableOp_Half_TN,tn_14336_1697_4096,Gemm_Hipblaslt_TN_9697,0.353323
GemmTunableOp_Half_TN,tn_64128_145_4096,Gemm_Hipblaslt_TN_9108,0.219489
GemmTunableOp_Half_TN,tn_4096_951_2048,Gemm_Rocblas_621286773,0.0392955
GemmTunableOp_Half_TN,tn_14336_2762_4096,Gemm_Hipblaslt_TN_9187,0.547243
GemmTunableOp_Half_TN,tn_14336_1743_4096,Gemm_Hipblaslt_TN_9793,0.357521
GemmTunableOp_Half_TN,tn_3072_1822_4096,Gemm_Rocblas_621294520,0.0907475
GemmTunableOp_Half_TN,tn_14336_1759_4096,Gemm_Hipblaslt_TN_9793,0.360039
GemmTunableOp_Half_TN,tn_64128_103_4096,Gemm_Hipblaslt_TN_9698,0.194917
GemmTunableOp_Half_TN,tn_4096_935_7168,Gemm_Hipblaslt_TN_9170,0.118666
GemmTunableOp_Half_TN,tn_3072_8000_4096,Gemm_Rocblas_621294473,0.338932
GemmTunableOp_Half_TN,tn_14336_5606_4096,Gemm_Rocblas_621294492,1.07387
GemmTunableOp_Half_TN,tn_14336_152_4096,Gemm_Hipblaslt_TN_9312,0.0524596
GemmTunableOp_Half_TN,tn_3072_809_4096,Gemm_Hipblaslt_TN_9047,0.0521334
GemmTunableOp_Half_TN,tn_3072_3418_4096,Gemm_Hipblaslt_TN_9629,0.152241
GemmTunableOp_Half_TN,tn_64128_221_4096,Gemm_Hipblaslt_TN_9593,0.274633
GemmTunableOp_Half_TN,tn_3072_879_4096,Gemm_Hipblaslt_TN_9546,0.0579342
GemmTunableOp_Half_TN,tn_3072_1763_4096,Gemm_Hipblaslt_TN_9615,0.0918514
GemmTunableOp_Half_TN,tn_4096_1883_2048,Gemm_Hipblaslt_TN_9590,0.0636716
GemmTunableOp_Half_TN,tn_64128_171_4096,Gemm_Hipblaslt_TN_9803,0.2443
GemmTunableOp_Half_TN,tn_14336_4483_4096,Gemm_Rocblas_621294330,0.860684
GemmTunableOp_Half_TN,tn_4096_2635_7168,Gemm_Hipblaslt_TN_9691,0.270682
GemmTunableOp_Half_TN,tn_4096_895_7168,Gemm_Hipblaslt_TN_9634,0.119326
GemmTunableOp_Half_TN,tn_64128_69_4096,Gemm_Hipblaslt_TN_9057,0.177939
GemmTunableOp_Half_TN,tn_14336_1614_4096,Gemm_Hipblaslt_TN_9697,0.351139
GemmTunableOp_Half_TN,tn_14336_812_4096,Gemm_Hipblaslt_TN_9697,0.177036
GemmTunableOp_Half_TN,tn_64128_185_4096,Gemm_Hipblaslt_TN_9694,0.248362
GemmTunableOp_Half_TN,tn_4096_160_2048,Gemm_Rocblas_621294171,0.012721
GemmTunableOp_Half_TN,tn_14336_939_4096,Gemm_Hipblaslt_TN_9697,0.184606
GemmTunableOp_Half_TN,tn_4096_852_2048,Gemm_Hipblaslt_TN_9354,0.035171
GemmTunableOp_Half_TN,tn_64128_169_4096,Gemm_Hipblaslt_TN_9661,0.243936
GemmTunableOp_Half_TN,tn_4096_1813_2048,Gemm_Hipblaslt_TN_9590,0.0622172
GemmTunableOp_Half_TN,tn_4096_2537_7168,Gemm_Hipblaslt_TN_9709,0.263016
GemmTunableOp_Half_TN,tn_14336_1794_4096,Gemm_Hipblaslt_TN_9189,0.366583
GemmTunableOp_Half_TN,tn_4096_1701_7168,Gemm_Hipblaslt_TN_9359,0.183018
GemmTunableOp_Half_TN,tn_64128_190_4096,Gemm_Hipblaslt_TN_9862,0.249629
GemmTunableOp_Half_TN,tn_4096_8154_2048,Gemm_Hipblaslt_TN_9813,0.232554
GemmTunableOp_Half_TN,tn_6144_232_4096,Gemm_Rocblas_621294207,0.0356155
GemmTunableOp_Half_TN,tn_4096_1785_7168,Gemm_Hipblaslt_TN_9136,0.200029
GemmTunableOp_Half_TN,tn_64128_180_4096,Gemm_Hipblaslt_TN_9862,0.246326
GemmTunableOp_Half_TN,tn_4096_1755_2048,Gemm_Hipblaslt_TN_9136,0.061833
GemmTunableOp_Half_TN,tn_64128_135_4096,Gemm_Hipblaslt_TN_9799,0.217739
GemmTunableOp_Half_TN,tn_64128_126_4096,Gemm_Rocblas_621294762,0.199906
GemmTunableOp_Half_TN,tn_4096_1746_2048,Gemm_Hipblaslt_TN_9329,0.062381
GemmTunableOp_Half_TN,tn_64128_35_4096,Gemm_Hipblaslt_TN_9097,0.163997
GemmTunableOp_Half_TN,tn_4096_853_7168,Gemm_Hipblaslt_TN_9353,0.115322
GemmTunableOp_Half_TN,tn_64128_227_4096,Gemm_Rocblas_621294658,0.282261
GemmTunableOp_Half_TN,tn_64128_19_4096,Gemm_Rocblas_621286348,0.145656
GemmTunableOp_Half_TN,tn_4096_862_7168,Gemm_Hipblaslt_TN_9604,0.113674
GemmTunableOp_Half_TN,tn_3072_2658_4096,Gemm_Hipblaslt_TN_9620,0.122963
GemmTunableOp_Half_TN,tn_4096_7944_7168,Gemm_Hipblaslt_TN_159,0.737537
GemmTunableOp_Half_TN,tn_64128_199_4096,Gemm_Hipblaslt_TN_9747,0.272091
GemmTunableOp_Half_TN,tn_4096_8069_7168,Gemm_Rocblas_621294420,0.741339
GemmTunableOp_Half_TN,tn_11008_4096_4096,Gemm_Rocblas_621294289,0.632704
GemmTunableOp_Half_TN,tn_4096_2571_7168,Gemm_Hipblaslt_TN_9799,0.268856
GemmTunableOp_Half_TN,tn_3072_2651_4096,Gemm_Hipblaslt_TN_9645,0.123594
GemmTunableOp_Half_TN,tn_14336_1864_4096,Gemm_Hipblaslt_TN_9697,0.367321
GemmTunableOp_Half_TN,tn_4096_2517_7168,Gemm_Hipblaslt_TN_9709,0.263564
GemmTunableOp_Half_TN,tn_3072_922_4096,Gemm_Hipblaslt_TN_9546,0.0579976
GemmTunableOp_Half_TN,tn_3072_969_4096,Gemm_Hipblaslt_TN_9317,0.0606141
GemmTunableOp_Half_TN,tn_14336_1695_4096,Gemm_Hipblaslt_TN_9697,0.35353
GemmTunableOp_Half_TN,tn_4096_2708_7168,Gemm_Hipblaslt_TN_9672,0.272501
GemmTunableOp_Half_TN,tn_4096_72_7168,Gemm_Rocblas_621294028,0.0245924
GemmTunableOp_Half_TN,tn_14336_862_4096,Gemm_Hipblaslt_TN_9192,0.181059
GemmTunableOp_Half_TN,tn_4096_2717_7168,Gemm_Hipblaslt_TN_9799,0.273082
GemmTunableOp_Half_TN,tn_4096_884_2048,Gemm_Hipblaslt_TN_9252,0.0375946
GemmTunableOp_Half_TN,tn_64128_15_4096,Gemm_Rocblas_621286348,0.143396
GemmTunableOp_Half_TN,tn_4096_992_2048,Gemm_Hipblaslt_TN_9589,0.0390752
GemmTunableOp_Half_TN,tn_4096_930_7168,Gemm_Hipblaslt_TN_9604,0.119276
GemmTunableOp_Half_TN,tn_4096_96_7168,Gemm_Hipblaslt_TN_9441,0.024829
GemmTunableOp_Half_TN,tn_14336_896_4096,Gemm_Hipblaslt_TN_9139,0.180922
GemmTunableOp_Half_TN,tn_14336_7436_4096,Gemm_Hipblaslt_TN_9890,1.45445
GemmTunableOp_Half_TN,tn_4096_2762_7168,Gemm_Hipblaslt_TN_9674,0.280302
GemmTunableOp_Half_TN,tn_3072_964_4096,Gemm_Hipblaslt_TN_9251,0.0596035
GemmTunableOp_Half_TN,tn_4096_1893_2048,Gemm_Hipblaslt_TN_9645,0.0650332
GemmTunableOp_Half_TN,tn_4096_878_2048,Gemm_Hipblaslt_TN_9576,0.0366757
GemmTunableOp_Half_TN,tn_4096_903_7168,Gemm_Hipblaslt_TN_9585,0.11831
GemmTunableOp_Half_TN,tn_3072_1742_4096,Gemm_Hipblaslt_TN_9163,0.0901626
GemmTunableOp_Half_TN,tn_4096_2872_7168,Gemm_Hipblaslt_TN_9672,0.281104
GemmTunableOp_Half_TN,tn_4096_3711_2048,Gemm_Hipblaslt_TN_9827,0.111812
GemmTunableOp_Half_TN,tn_3072_986_4096,Gemm_Hipblaslt_TN_9251,0.0604201
GemmTunableOp_Half_TN,tn_3072_1846_4096,Gemm_Hipblaslt_TN_9148,0.0930033
GemmTunableOp_Half_TN,tn_64128_213_4096,Gemm_Hipblaslt_TN_9654,0.274764
GemmTunableOp_Half_TN,tn_3072_804_4096,Gemm_Hipblaslt_TN_9047,0.0523476
GemmTunableOp_Half_TN,tn_4096_917_2048,Gemm_Hipblaslt_TN_9547,0.0369234
GemmTunableOp_Half_TN,tn_14336_820_4096,Gemm_Hipblaslt_TN_9677,0.177612
GemmTunableOp_Half_TN,tn_14336_830_4096,Gemm_Hipblaslt_TN_9677,0.176932
GemmTunableOp_Half_TN,tn_14336_3507_4096,Gemm_Hipblaslt_TN_9220,0.649234
GemmTunableOp_Half_TN,tn_4096_2764_2048,Gemm_Hipblaslt_TN_9674,0.0864187
GemmTunableOp_Half_TN,tn_4096_4096_2048,Gemm_Rocblas_621286281,0.118001
GemmTunableOp_Half_TN,tn_3072_1798_4096,Gemm_Rocblas_621286778,0.0910289
GemmTunableOp_Half_TN,tn_4096_1644_7168,Gemm_Hipblaslt_TN_9359,0.180874
GemmTunableOp_Half_TN,tn_4096_7823_2048,Gemm_Hipblaslt_TN_9746,0.228054
GemmTunableOp_Half_TN,tn_14336_903_4096,Gemm_Hipblaslt_TN_9677,0.182429
GemmTunableOp_Half_TN,tn_64128_100_4096,Gemm_Rocblas_621294762,0.195837
GemmTunableOp_Half_TN,tn_4096_914_2048,Gemm_Hipblaslt_TN_9604,0.0377752
GemmTunableOp_Half_TN,tn_3072_3752_4096,Gemm_Hipblaslt_TN_9852,0.162463
GemmTunableOp_Half_TN,tn_4096_898_2048,Gemm_Hipblaslt_TN_9577,0.0376687
GemmTunableOp_Half_TN,tn_4096_891_2048,Gemm_Hipblaslt_TN_9585,0.0382112
GemmTunableOp_Half_TN,tn_4096_7817_2048,Gemm_Hipblaslt_TN_9753,0.226795
GemmTunableOp_Half_TN,tn_4096_986_2048,Gemm_Hipblaslt_TN_9589,0.0394032
GemmTunableOp_Half_TN,tn_4096_3507_2048,Gemm_Hipblaslt_TN_9896,0.102576
GemmTunableOp_Half_TN,tn_3072_1756_4096,Gemm_Hipblaslt_TN_9163,0.0910226
GemmTunableOp_Half_TN,tn_3072_865_4096,Gemm_Hipblaslt_TN_9546,0.0574579
GemmTunableOp_Half_TN,tn_4096_924_7168,Gemm_Hipblaslt_TN_9634,0.119117
GemmTunableOp_Half_TN,tn_3072_3352_4096,Gemm_Hipblaslt_TN_9619,0.149702
GemmTunableOp_Half_TN,tn_3072_8110_4096,Gemm_Hipblaslt_TN_9935,0.350447
GemmTunableOp_Half_TN,tn_3072_1719_4096,Gemm_Hipblaslt_TN_9561,0.0884605
GemmTunableOp_Half_TN,tn_3072_821_4096,Gemm_Hipblaslt_TN_9048,0.0532901
GemmTunableOp_Half_TN,tn_4096_2636_7168,Gemm_Hipblaslt_TN_9799,0.27089
GemmTunableOp_Half_TN,tn_4096_911_2048,Gemm_Hipblaslt_TN_9577,0.0374957
GemmTunableOp_Half_TN,tn_4096_904_7168,Gemm_Hipblaslt_TN_9604,0.118477
GemmTunableOp_Half_TN,tn_3072_1666_4096,Gemm_Hipblaslt_TN_9561,0.0881153
GemmTunableOp_Half_TN,tn_4096_803_2048,Gemm_Hipblaslt_TN_9131,0.0338112
GemmTunableOp_Half_TN,tn_3072_248_4096,Gemm_Rocblas_621294230,0.0229347
GemmTunableOp_Half_TN,tn_4096_801_7168,Gemm_Hipblaslt_TN_9634,0.109443
GemmTunableOp_Half_TN,tn_4096_890_7168,Gemm_Hipblaslt_TN_9170,0.116757
GemmTunableOp_Half_TN,tn_4096_936_7168,Gemm_Hipblaslt_TN_9604,0.117495
GemmTunableOp_Half_TN,tn_3072_7817_4096,Gemm_Hipblaslt_TN_9779,0.337856
GemmTunableOp_Half_TN,tn_4096_815_7168,Gemm_Hipblaslt_TN_9131,0.109764
GemmTunableOp_Half_TN,tn_4096_879_7168,Gemm_Hipblaslt_TN_9170,0.117984
GemmTunableOp_Half_TN,tn_4096_908_2048,Gemm_Hipblaslt_TN_9604,0.037955
GemmTunableOp_Half_TN,tn_64128_37_4096,Gemm_Hipblaslt_TN_9144,0.163463
GemmTunableOp_Half_TN,tn_4096_992_7168,Gemm_Hipblaslt_TN_9052,0.12396
GemmTunableOp_Half_TN,tn_3072_797_4096,Gemm_Hipblaslt_TN_9047,0.053093
GemmTunableOp_Half_TN,tn_3072_801_4096,Gemm_Hipblaslt_TN_9047,0.0521544
GemmTunableOp_Half_TN,tn_64128_253_4096,Gemm_Rocblas_621294648,0.285071
GemmTunableOp_Half_TN,tn_14336_1701_4096,Gemm_Hipblaslt_TN_9192,0.355917
GemmTunableOp_Half_TN,tn_14336_136_4096,Gemm_Hipblaslt_TN_9553,0.0524494
GemmTunableOp_Half_TN,tn_4096_7967_2048,Gemm_Hipblaslt_TN_9768,0.228719
GemmTunableOp_Half_TN,tn_3072_936_4096,Gemm_Hipblaslt_TN_9131,0.0583387
GemmTunableOp_Half_TN,tn_3072_1777_4096,Gemm_Hipblaslt_TN_9322,0.0909689
GemmTunableOp_Half_TN,tn_4096_4242_7168,Gemm_Hipblaslt_TN_9217,0.384388
GemmTunableOp_Half_TN,tn_4096_1881_2048,Gemm_Hipblaslt_TN_9590,0.0636897
GemmTunableOp_Half_TN,tn_4096_88_7168,Gemm_Rocblas_621286279,0.0250584
GemmTunableOp_Half_TN,tn_4096_2699_7168,Gemm_Hipblaslt_TN_9672,0.27256
GemmTunableOp_Half_TN,tn_4096_868_7168,Gemm_Hipblaslt_TN_9355,0.117206
GemmTunableOp_Half_TN,tn_4096_918_7168,Gemm_Hipblaslt_TN_9604,0.118252
GemmTunableOp_Half_TN,tn_4096_938_7168,Gemm_Hipblaslt_TN_9604,0.119027
GemmTunableOp_Half_TN,tn_4096_1841_7168,Gemm_Hipblaslt_TN_9645,0.205824
GemmTunableOp_Half_TN,tn_4096_2719_2048,Gemm_Hipblaslt_TN_9689,0.0854848
GemmTunableOp_Half_TN,tn_64128_211_4096,Gemm_Hipblaslt_TN_9654,0.271748
GemmTunableOp_Half_TN,tn_4096_1783_7168,Gemm_Hipblaslt_TN_9329,0.200199
GemmTunableOp_Half_TN,tn_64128_83_4096,Gemm_Hipblaslt_TN_9057,0.181729
GemmTunableOp_Half_TN,tn_14336_2703_4096,Gemm_Hipblaslt_TN_9697,0.549016
GemmTunableOp_Half_TN,tn_3072_917_4096,Gemm_Hipblaslt_TN_9352,0.0586513
GemmTunableOp_Half_TN,tn_14336_842_4096,Gemm_Hipblaslt_TN_9677,0.179488
GemmTunableOp_Half_TN,tn_14336_1746_4096,Gemm_Hipblaslt_TN_9697,0.362014
GemmTunableOp_Half_TN,tn_14336_840_4096,Gemm_Hipblaslt_TN_9139,0.179417
GemmTunableOp_Half_TN,tn_4096_3310_7168,Gemm_Hipblaslt_TN_9192,0.325889
GemmTunableOp_Half_TN,tn_14336_4242_4096,Gemm_Rocblas_621294492,0.827251
GemmTunableOp_Half_TN,tn_4096_1759_7168,Gemm_Hipblaslt_TN_9673,0.196709
GemmTunableOp_Half_TN,tn_3072_7804_4096,Gemm_Hipblaslt_TN_9690,0.336543
GemmTunableOp_Half_TN,tn_64128_206_4096,Gemm_Hipblaslt_TN_9654,0.270935
GemmTunableOp_Half_TN,tn_14336_2698_4096,Gemm_Hipblaslt_TN_9677,0.546595
GemmTunableOp_Half_TN,tn_3072_1733_4096,Gemm_Hipblaslt_TN_9613,0.0906271
GemmTunableOp_Half_TN,tn_64128_94_4096,Gemm_Hipblaslt_TN_9057,0.1836
GemmTunableOp_Half_TN,tn_4096_1905_7168,Gemm_Hipblaslt_TN_9645,0.206555
GemmTunableOp_Half_TN,tn_14336_978_4096,Gemm_Hipblaslt_TN_9220,0.201696
GemmTunableOp_Half_TN,tn_3072_884_4096,Gemm_Hipblaslt_TN_9352,0.0570615
GemmTunableOp_Half_TN,tn_3072_2719_4096,Gemm_Hipblaslt_TN_9624,0.125175
GemmTunableOp_Half_TN,tn_3072_894_4096,Gemm_Hipblaslt_TN_9352,0.0571818
GemmTunableOp_Half_TN,tn_14336_819_4096,Gemm_Hipblaslt_TN_9697,0.177688
GemmTunableOp_Half_TN,tn_4096_821_2048,Gemm_Hipblaslt_TN_9634,0.0350537
GemmTunableOp_Half_TN,tn_64128_91_4096,Gemm_Hipblaslt_TN_9057,0.183443
GemmTunableOp_Half_TN,tn_4096_1763_7168,Gemm_Hipblaslt_TN_9134,0.198779
GemmTunableOp_Half_TN,tn_64128_20_4096,Gemm_Rocblas_621286348,0.145153
GemmTunableOp_Half_TN,tn_64128_9_4096,Gemm_Rocblas_621286348,0.141894
GemmTunableOp_Half_TN,tn_4096_888_7168,Gemm_Hipblaslt_TN_9170,0.118689
GemmTunableOp_Half_TN,tn_14336_1739_4096,Gemm_Hipblaslt_TN_9793,0.359906
GemmTunableOp_Half_TN,tn_4096_972_7168,Gemm_Hipblaslt_TN_9576,0.121322
GemmTunableOp_Half_TN,tn_4096_7266_7168,Gemm_Hipblaslt_TN_9743,0.677851
GemmTunableOp_Half_TN,tn_14336_816_4096,Gemm_Hipblaslt_TN_9697,0.177055
GemmTunableOp_Half_TN,tn_4096_849_2048,Gemm_Hipblaslt_TN_9354,0.0355384
GemmTunableOp_Half_TN,tn_3072_830_4096,Gemm_Hipblaslt_TN_9047,0.053345
GemmTunableOp_Half_TN,tn_14336_2537_4096,Gemm_Hipblaslt_TN_9690,0.502413
GemmTunableOp_Half_TN,tn_14336_916_4096,Gemm_Hipblaslt_TN_9697,0.182883
GemmTunableOp_Half_TN,tn_4096_968_2048,Gemm_Hipblaslt_TN_9578,0.0387824
GemmTunableOp_Half_TN,tn_14336_7787_4096,Gemm_Hipblaslt_TN_9914,1.48154
GemmTunableOp_Half_TN,tn_64128_14_4096,Gemm_Rocblas_621286348,0.14414
GemmTunableOp_Half_TN,tn_14336_894_4096,Gemm_Hipblaslt_TN_9677,0.180896
GemmTunableOp_Half_TN,tn_4096_837_7168,Gemm_Hipblaslt_TN_9170,0.113189
GemmTunableOp_Half_TN,tn_14336_1705_4096,Gemm_Hipblaslt_TN_9187,0.355382
GemmTunableOp_Half_TN,tn_14336_1931_4096,Gemm_Hipblaslt_TN_9110,0.397816
GemmTunableOp_Half_TN,tn_14336_2786_4096,Gemm_Hipblaslt_TN_9697,0.556086
GemmTunableOp_Half_TN,tn_3072_3431_4096,Gemm_Hipblaslt_TN_9619,0.154504
GemmTunableOp_Half_TN,tn_3072_877_4096,Gemm_Hipblaslt_TN_9352,0.0573987
GemmTunableOp_Half_TN,tn_14336_1880_4096,Gemm_Hipblaslt_TN_9697,0.370175
GemmTunableOp_Half_TN,tn_3072_842_4096,Gemm_Hipblaslt_TN_9368,0.0535652
GemmTunableOp_Half_TN,tn_4096_808_7168,Gemm_Hipblaslt_TN_9099,0.110373
GemmTunableOp_Half_TN,tn_4096_834_7168,Gemm_Hipblaslt_TN_9353,0.112196
GemmTunableOp_Half_TN,tn_4096_1864_2048,Gemm_Hipblaslt_TN_9590,0.0634868
GemmTunableOp_Half_TN,tn_4096_1897_7168,Gemm_Hipblaslt_TN_9645,0.207749
GemmTunableOp_Half_TN,tn_14336_832_4096,Gemm_Hipblaslt_TN_9677,0.178132
GemmTunableOp_Half_TN,tn_4096_3556_7168,Gemm_Hipblaslt_TN_9697,0.339117
GemmTunableOp_Half_TN,tn_14336_850_4096,Gemm_Hipblaslt_TN_9139,0.180543
GemmTunableOp_Half_TN,tn_4096_838_7168,Gemm_Hipblaslt_TN_9634,0.112353
GemmTunableOp_Half_TN,tn_14336_1785_4096,Gemm_Hipblaslt_TN_9677,0.360949
GemmTunableOp_Half_TN,tn_4096_921_7168,Gemm_Hipblaslt_TN_9576,0.11879
GemmTunableOp_Half_TN,tn_4096_922_2048,Gemm_Hipblaslt_TN_9577,0.0375951
GemmTunableOp_Half_TN,tn_3072_1841_4096,Gemm_Hipblaslt_TN_9148,0.0929761
GemmTunableOp_Half_TN,tn_4096_176_2048,Gemm_Rocblas_621286447,0.0134501
GemmTunableOp_Half_TN,tn_3072_808_4096,Gemm_Hipblaslt_TN_9048,0.0523335
GemmTunableOp_Half_TN,tn_14336_2732_4096,Gemm_Hipblaslt_TN_9677,0.552646
GemmTunableOp_Half_TN,tn_4096_906_2048,Gemm_Hipblaslt_TN_9577,0.0369448
GemmTunableOp_Half_TN,tn_14336_927_4096,Gemm_Hipblaslt_TN_9677,0.18247
GemmTunableOp_Half_TN,tn_3072_1900_4096,Gemm_Hipblaslt_TN_9613,0.0946578
GemmTunableOp_Half_TN,tn_4096_80_2048,Gemm_Rocblas_621294029,0.00902955
GemmTunableOp_Half_TN,tn_4096_1848_2048,Gemm_Hipblaslt_TN_9590,0.0635433
GemmTunableOp_Half_TN,tn_4096_896_7168,Gemm_Rocblas_621294512,0.117587
GemmTunableOp_Half_TN,tn_64128_154_4096,Gemm_Hipblaslt_TN_9871,0.222566
GemmTunableOp_Half_TN,tn_3072_949_4096,Gemm_Hipblaslt_TN_9353,0.0593175
GemmTunableOp_Half_TN,tn_14336_1783_4096,Gemm_Hipblaslt_TN_9677,0.361801
GemmTunableOp_Half_TN,tn_14336_1867_4096,Gemm_Hipblaslt_TN_9697,0.367122
GemmTunableOp_Half_TN,tn_14336_1756_4096,Gemm_Hipblaslt_TN_9793,0.361215
GemmTunableOp_Half_TN,tn_4096_2572_2048,Gemm_Hipblaslt_TN_9672,0.0833955
GemmTunableOp_Half_TN,tn_14336_815_4096,Gemm_Hipblaslt_TN_9677,0.177018
GemmTunableOp_Half_TN,tn_4096_1815_7168,Gemm_Hipblaslt_TN_9137,0.202118
GemmTunableOp_Half_TN,tn_4096_820_2048,Gemm_Hipblaslt_TN_9352,0.033808
GemmTunableOp_Half_TN,tn_64128_89_4096,Gemm_Hipblaslt_TN_9057,0.181504
GemmTunableOp_Half_TN,tn_4096_1828_7168,Gemm_Hipblaslt_TN_9137,0.202629
GemmTunableOp_Half_TN,tn_64128_251_4096,Gemm_Rocblas_621294658,0.287516
GemmTunableOp_Half_TN,tn_4096_2658_2048,Gemm_Hipblaslt_TN_9709,0.0841842
GemmTunableOp_Half_TN,tn_3072_898_4096,Gemm_Hipblaslt_TN_9251,0.0591013
GemmTunableOp_Half_TN,tn_4096_2571_2048,Gemm_Hipblaslt_TN_9689,0.0834455
GemmTunableOp_Half_TN,tn_14336_807_4096,Gemm_Hipblaslt_TN_9697,0.178451
GemmTunableOp_Half_TN,tn_4096_1693_2048,Gemm_Hipblaslt_TN_9164,0.0588275
GemmTunableOp_Half_TN,tn_14336_2675_4096,Gemm_Hipblaslt_TN_9793,0.537585
GemmTunableOp_Half_TN,tn_14336_2592_4096,Gemm_Hipblaslt_TN_9793,0.524346
GemmTunableOp_Half_TN,tn_3072_56_4096,Gemm_Rocblas_621286419,0.010939
GemmTunableOp_Half_TN,tn_4096_3571_7168,Gemm_Hipblaslt_TN_9188,0.338964
GemmTunableOp_Half_TN,tn_4096_946_7168,Gemm_Hipblaslt_TN_9604,0.119383
GemmTunableOp_Half_TN,tn_14336_2860_4096,Gemm_Hipblaslt_TN_9697,0.557825
GemmTunableOp_Half_TN,tn_4096_1695_2048,Gemm_Hipblaslt_TN_9588,0.0577869
GemmTunableOp_Half_TN,tn_64128_123_4096,Gemm_Rocblas_621294762,0.201128
GemmTunableOp_Half_TN,tn_14336_852_4096,Gemm_Hipblaslt_TN_9677,0.178765
GemmTunableOp_Half_TN,tn_14336_24_4096,Gemm_Rocblas_621294052,0.0256824
GemmTunableOp_Half_TN,tn_4096_64_7168,Gemm_Rocblas_621294148,0.0192856
GemmTunableOp_Half_TN,tn_14336_890_4096,Gemm_Hipblaslt_TN_9697,0.182701
GemmTunableOp_Half_TN,tn_14336_923_4096,Gemm_Hipblaslt_TN_9677,0.182947
GemmTunableOp_Half_TN,tn_14336_885_4096,Gemm_Hipblaslt_TN_9677,0.180152
GemmTunableOp_Half_TN,tn_3072_2788_4096,Gemm_Hipblaslt_TN_9624,0.127972
GemmTunableOp_Half_TN,tn_4096_2719_7168,Gemm_Hipblaslt_TN_9672,0.274677
GemmTunableOp_Half_TN,tn_4096_790_7168,Gemm_Hipblaslt_TN_9158,0.104893
GemmTunableOp_Half_TN,tn_4096_825_2048,Gemm_Hipblaslt_TN_9354,0.0342949
GemmTunableOp_Half_TN,tn_4096_8000_7168,Gemm_Hipblaslt_TN_159,0.738933
GemmTunableOp_Half_TN,tn_14336_1775_4096,Gemm_Hipblaslt_TN_9793,0.361458
GemmTunableOp_Half_TN,tn_4096_961_7168,Gemm_Hipblaslt_TN_9604,0.120414
GemmTunableOp_Half_TN,tn_4096_964_7168,Gemm_Hipblaslt_TN_9170,0.119588
GemmTunableOp_Half_TN,tn_4096_2672_7168,Gemm_Hipblaslt_TN_9672,0.270057
GemmTunableOp_Half_TN,tn_4096_1666_2048,Gemm_Hipblaslt_TN_9164,0.0565609
GemmTunableOp_Half_TN,tn_4096_2602_2048,Gemm_Hipblaslt_TN_9687,0.0836276
GemmTunableOp_Half_TN,tn_4096_944_7168,Gemm_Hipblaslt_TN_9604,0.119869
GemmTunableOp_Half_TN,tn_14336_8154_4096,Gemm_Hipblaslt_TN_159,1.5394
GemmTunableOp_Half_TN,tn_14336_1881_4096,Gemm_Hipblaslt_TN_9697,0.368661
GemmTunableOp_Half_TN,tn_3072_920_4096,Gemm_Hipblaslt_TN_9352,0.0568924
GemmTunableOp_Half_TN,tn_3072_7239_4096,Gemm_Hipblaslt_TN_9681,0.306936
GemmTunableOp_Half_TN,tn_3072_876_4096,Gemm_Hipblaslt_TN_9131,0.0583418
GemmTunableOp_Half_TN,tn_4096_1718_2048,Gemm_Hipblaslt_TN_9588,0.0580912
GemmTunableOp_Half_TN,tn_3072_8156_4096,Gemm_Rocblas_621294481,0.350305
GemmTunableOp_Half_TN,tn_3072_1730_4096,Gemm_Hipblaslt_TN_9613,0.0901879
GemmTunableOp_Half_TN,tn_4096_1778_7168,Gemm_Hipblaslt_TN_9134,0.19988
GemmTunableOp_Half_TN,tn_3072_2572_4096,Gemm_Hipblaslt_TN_9134,0.121086
GemmTunableOp_Half_TN,tn_4096_857_7168,Gemm_Hipblaslt_TN_9099,0.113198
GemmTunableOp_Half_TN,tn_14336_3711_4096,Gemm_Hipblaslt_TN_9697,0.735695
GemmTunableOp_Half_TN,tn_4096_1730_2048,Gemm_Hipblaslt_TN_9136,0.0626165
GemmTunableOp_Half_TN,tn_4096_7283_2048,Gemm_Hipblaslt_TN_9857,0.208629
GemmTunableOp_Half_TN,tn_3072_3310_4096,Gemm_Hipblaslt_TN_9570,0.148238
GemmTunableOp_Half_TN,tn_14336_2599_4096,Gemm_Hipblaslt_TN_9793,0.527656
GemmTunableOp_Half_TN,tn_64128_42_4096,Gemm_Hipblaslt_TN_9097,0.163836
GemmTunableOp_Half_TN,tn_4096_866_2048,Gemm_Hipblaslt_TN_9355,0.0362484
GemmTunableOp_Half_TN,tn_3072_816_4096,Gemm_Hipblaslt_TN_9047,0.0524994
GemmTunableOp_Half_TN,tn_3072_8154_4096,Gemm_Hipblaslt_TN_9935,0.352744
GemmTunableOp_Half_TN,tn_14336_1777_4096,Gemm_Hipblaslt_TN_9793,0.36566
GemmTunableOp_Half_TN,tn_4096_24_7168,Gemm_Rocblas_621286305,0.0151146
GemmTunableOp_Half_TN,tn_14336_7967_4096,Gemm_Hipblaslt_TN_9959,1.51241
GemmTunableOp_Half_TN,tn_64128_250_4096,Gemm_Rocblas_621286915,0.289858
GemmTunableOp_Half_TN,tn_3072_1886_4096,Gemm_Hipblaslt_TN_9324,0.0926266
GemmTunableOp_Half_TN,tn_3072_1783_4096,Gemm_Hipblaslt_TN_9322,0.0920201
GemmTunableOp_Half_TN,tn_4096_988_7168,Gemm_Hipblaslt_TN_9170,0.121657
GemmTunableOp_Half_TN,tn_64128_191_4096,Gemm_Hipblaslt_TN_9821,0.250187
GemmTunableOp_Half_TN,tn_4096_24_2048,Gemm_Rocblas_621286273,0.00721718
GemmTunableOp_Half_TN,tn_64128_217_4096,Gemm_Hipblaslt_TN_9654,0.274248
GemmTunableOp_Half_TN,tn_4096_876_7168,Gemm_Rocblas_621294512,0.118275
GemmTunableOp_Half_TN,tn_4096_947_7168,Gemm_Hipblaslt_TN_9604,0.118556
GemmTunableOp_Half_TN,tn_4096_1913_2048,Gemm_Hipblaslt_TN_9590,0.0641473
GemmTunableOp_Half_TN,tn_4096_1829_7168,Gemm_Hipblaslt_TN_9680,0.202774
GemmTunableOp_Half_TN,tn_4096_2648_2048,Gemm_Hipblaslt_TN_9657,0.0855246
GemmTunableOp_Half_TN,tn_3072_128_4096,Gemm_Rocblas_621294028,0.0149177
GemmTunableOp_Half_TN,tn_3072_1746_4096,Gemm_Hipblaslt_TN_9148,0.090687
GemmTunableOp_Half_TN,tn_3072_847_4096,Gemm_Hipblaslt_TN_9048,0.053443
GemmTunableOp_Half_TN,tn_14336_990_4096,Gemm_Hipblaslt_TN_9220,0.202757
GemmTunableOp_Half_TN,tn_4096_985_2048,Gemm_Hipblaslt_TN_9578,0.0394626
GemmTunableOp_Half_TN,tn_64128_132_4096,Gemm_Hipblaslt_TN_9799,0.219282
GemmTunableOp_Half_TN,tn_4096_8069_2048,Gemm_Hipblaslt_TN_9768,0.230417
GemmTunableOp_Half_TN,tn_4096_795_7168,Gemm_Hipblaslt_TN_9131,0.109636
GemmTunableOp_Half_TN,tn_4096_836_7168,Gemm_Hipblaslt_TN_9352,0.112878
GemmTunableOp_Half_TN,tn_3072_843_4096,Gemm_Hipblaslt_TN_9048,0.0535752
GemmTunableOp_Half_TN,tn_3072_872_4096,Gemm_Hipblaslt_TN_9546,0.0571199
GemmTunableOp_Half_TN,tn_4096_802_7168,Gemm_Hipblaslt_TN_9158,0.107386
GemmTunableOp_Half_TN,tn_64128_130_4096,Gemm_Hipblaslt_TN_9799,0.215067
GemmTunableOp_Half_TN,tn_4096_4483_2048,Gemm_Hipblaslt_TN_9763,0.138361
GemmTunableOp_Half_TN,tn_3072_1726_4096,Gemm_Hipblaslt_TN_9561,0.0882856
GemmTunableOp_Half_TN,tn_4096_954_7168,Gemm_Hipblaslt_TN_9604,0.119226
GemmTunableOp_Half_TN,tn_4096_871_2048,Gemm_Hipblaslt_TN_9577,0.0364613
GemmTunableOp_Half_TN,tn_4096_224_7168,Gemm_Rocblas_621286491,0.0429562
GemmTunableOp_Half_TN,tn_14336_1733_4096,Gemm_Hipblaslt_TN_9793,0.358418
GemmTunableOp_Half_TN,tn_14336_2590_4096,Gemm_Hipblaslt_TN_9793,0.52741
GemmTunableOp_Half_TN,tn_64128_243_4096,Gemm_Rocblas_621294658,0.286428
GemmTunableOp_Half_TN,tn_3072_914_4096,Gemm_Hipblaslt_TN_9131,0.0573349
GemmTunableOp_Half_TN,tn_64128_218_4096,Gemm_Hipblaslt_TN_9747,0.275777
GemmTunableOp_Half_TN,tn_4096_942_2048,Gemm_Hipblaslt_TN_9577,0.0381204
GemmTunableOp_Half_TN,tn_14336_1813_4096,Gemm_Hipblaslt_TN_9697,0.367442
GemmTunableOp_Half_TN,tn_4096_1694_7168,Gemm_Hipblaslt_TN_9180,0.184029
GemmTunableOp_Half_TN,tn_4096_3402_2048,Gemm_Hipblaslt_TN_9896,0.0997826
GemmTunableOp_Half_TN,tn_4096_958_2048,Gemm_Hipblaslt_TN_9634,0.0365627
GemmTunableOp_Half_TN,tn_4096_2509_7168,Gemm_Hipblaslt_TN_9709,0.262914
GemmTunableOp_Half_TN,tn_64128_222_4096,Gemm_Hipblaslt_TN_9961,0.273265
GemmTunableOp_Half_TN,tn_3072_834_4096,Gemm_Hipblaslt_TN_9048,0.0529719
GemmTunableOp_Half_TN,tn_3072_982_4096,Gemm_Hipblaslt_TN_9158,0.0602849
GemmTunableOp_Half_TN,tn_3072_216_4096,Gemm_Rocblas_621294173,0.0225479
GemmTunableOp_Half_TN,tn_14336_959_4096,Gemm_Hipblaslt_TN_9697,0.185458
GemmTunableOp_Half_TN,tn_14336_926_4096,Gemm_Hipblaslt_TN_9697,0.18382
GemmTunableOp_Half_TN,tn_4096_891_7168,Gemm_Hipblaslt_TN_9355,0.118472
GemmTunableOp_Half_TN,tn_3072_2698_4096,Gemm_Hipblaslt_TN_9624,0.125675
GemmTunableOp_Half_TN,tn_4096_3447_7168,Gemm_Hipblaslt_TN_9139,0.330506
GemmTunableOp_Half_TN,tn_64128_90_4096,Gemm_Hipblaslt_TN_9057,0.182782
GemmTunableOp_Half_TN,tn_4096_924_2048,Gemm_Hipblaslt_TN_9547,0.0367394
GemmTunableOp_Half_TN,tn_14336_1600_4096,Gemm_Rocblas_621294426,0.321152
GemmTunableOp_Half_TN,tn_64128_107_4096,Gemm_Hipblaslt_TN_9698,0.197126
GemmTunableOp_Half_TN,tn_64128_27_4096,Gemm_Rocblas_621286348,0.147048
GemmTunableOp_Half_TN,tn_14336_814_4096,Gemm_Hipblaslt_TN_9697,0.177003
GemmTunableOp_Half_TN,tn_4096_982_7168,Gemm_Hipblaslt_TN_9160,0.122543
GemmTunableOp_Half_TN,tn_4096_790_2048,Gemm_Hipblaslt_TN_9604,0.0343667
GemmTunableOp_Half_TN,tn_3072_905_4096,Gemm_Hipblaslt_TN_9352,0.0580567
GemmTunableOp_Half_TN,tn_64128_235_4096,Gemm_Rocblas_621294658,0.287656
GemmTunableOp_Half_TN,tn_14336_935_4096,Gemm_Hipblaslt_TN_9139,0.185183
GemmTunableOp_Half_TN,tn_4096_807_7168,Gemm_Hipblaslt_TN_9131,0.10977
GemmTunableOp_Half_TN,tn_64128_116_4096,Gemm_Hipblaslt_TN_9264,0.200393
GemmTunableOp_Half_TN,tn_3072_2786_4096,Gemm_Hipblaslt_TN_9567,0.127301
GemmTunableOp_Half_TN,tn_64128_142_4096,Gemm_Rocblas_621294305,0.218395
GemmTunableOp_Half_TN,tn_14336_8007_4096,Gemm_Hipblaslt_TN_9933,1.51559
GemmTunableOp_Half_TN,tn_3072_932_4096,Gemm_Hipblaslt_TN_9352,0.0589034
GemmTunableOp_Half_TN,tn_14336_248_4096,Gemm_Hipblaslt_TN_9634,0.0670069
GemmTunableOp_Half_TN,tn_3072_1897_4096,Gemm_Hipblaslt_TN_9613,0.0946467
GemmTunableOp_Half_TN,tn_4096_899_7168,Gemm_Hipblaslt_TN_9634,0.118072
GemmTunableOp_Half_TN,tn_4096_799_2048,Gemm_Hipblaslt_TN_9352,0.0334924
GemmTunableOp_Half_TN,tn_4096_971_2048,Gemm_Hipblaslt_TN_9583,0.0392536
GemmTunableOp_Half_TN,tn_4096_2764_7168,Gemm_Hipblaslt_TN_9690,0.278502
GemmTunableOp_Half_TN,tn_4096_200_2048,Gemm_Rocblas_621286443,0.0143506
GemmTunableOp_Half_TN,tn_14336_1768_4096,Gemm_Hipblaslt_TN_9793,0.361505
GemmTunableOp_Half_TN,tn_14336_920_4096,Gemm_Hipblaslt_TN_9187,0.183517
GemmTunableOp_Half_TN,tn_4096_1850_7168,Gemm_Hipblaslt_TN_9268,0.20417
GemmTunableOp_Half_TN,tn_4096_853_2048,Gemm_Hipblaslt_TN_9352,0.0343672
GemmTunableOp_Half_TN,tn_3072_232_4096,Gemm_Rocblas_621286440,0.0226476
GemmTunableOp_Half_TN,tn_64128_96_4096,Gemm_Hipblaslt_TN_9057,0.181863
GemmTunableOp_Half_TN,tn_3072_224_4096,Gemm_Rocblas_621286443,0.022908
GemmTunableOp_Half_TN,tn_4096_96_2048,Gemm_Rocblas_621286279,0.00939925
GemmTunableOp_Half_TN,tn_14336_866_4096,Gemm_Hipblaslt_TN_9677,0.179985
GemmTunableOp_Half_TN,tn_4096_184_2048,Gemm_Rocblas_621286447,0.0130291
GemmTunableOp_Half_TN,tn_4096_805_7168,Gemm_Hipblaslt_TN_9147,0.10709
GemmTunableOp_Half_TN,tn_4096_812_2048,Gemm_Hipblaslt_TN_9547,0.0346061
GemmTunableOp_Half_TN,tn_64128_205_4096,Gemm_Hipblaslt_TN_9654,0.269498
GemmTunableOp_Half_TN,tn_64128_112_4096,Gemm_Hipblaslt_TN_9670,0.198098
GemmTunableOp_Half_TN,tn_4096_1854_7168,Gemm_Hipblaslt_TN_9137,0.204102
GemmTunableOp_Half_TN,tn_64128_200_4096,Gemm_Hipblaslt_TN_9654,0.268538
GemmTunableOp_Half_TN,tn_64128_189_4096,Gemm_Hipblaslt_TN_9707,0.248631
GemmTunableOp_Half_TN,tn_4096_2793_2048,Gemm_Hipblaslt_TN_9689,0.0868166
GemmTunableOp_Half_TN,tn_64128_223_4096,Gemm_Hipblaslt_TN_9654,0.276065
GemmTunableOp_Half_TN,tn_64128_209_4096,Gemm_Hipblaslt_TN_9768,0.272732
GemmTunableOp_Half_TN,tn_3072_3670_4096,Gemm_Hipblaslt_TN_9777,0.162552
GemmTunableOp_Half_TN,tn_4096_2805_2048,Gemm_Hipblaslt_TN_9691,0.0881999
GemmTunableOp_Half_TN,tn_4096_932_7168,Gemm_Hipblaslt_TN_9170,0.118228
GemmTunableOp_Half_TN,tn_4096_2672_2048,Gemm_Hipblaslt_TN_9566,0.084051
GemmTunableOp_Half_TN,tn_4096_954_2048,Gemm_Hipblaslt_TN_9585,0.0387529
GemmTunableOp_Half_TN,tn_4096_8049_7168,Gemm_Hipblaslt_TN_9903,0.73783
GemmTunableOp_Half_TN,tn_4096_4242_2048,Gemm_Hipblaslt_TN_9184,0.119847
GemmTunableOp_Half_TN,tn_14336_868_4096,Gemm_Hipblaslt_TN_9697,0.18226
GemmTunableOp_Half_TN,tn_3072_240_4096,Gemm_Rocblas_621286440,0.0230957
GemmTunableOp_Half_TN,tn_3072_1837_4096,Gemm_Hipblaslt_TN_9324,0.0928748
GemmTunableOp_Half_TN,tn_14336_968_4096,Gemm_Hipblaslt_TN_9217,0.202666
GemmTunableOp_Half_TN,tn_14336_884_4096,Gemm_Hipblaslt_TN_9187,0.182517
GemmTunableOp_Half_TN,tn_4096_2860_2048,Gemm_Hipblaslt_TN_9689,0.0863841
GemmTunableOp_Half_TN,tn_4096_4463_2048,Gemm_Hipblaslt_TN_9831,0.139285
GemmTunableOp_Half_TN,tn_4096_940_7168,Gemm_Hipblaslt_TN_9576,0.11782
GemmTunableOp_Half_TN,tn_64128_108_4096,Gemm_Hipblaslt_TN_9771,0.198987
GemmTunableOp_Half_TN,tn_4096_3431_7168,Gemm_Hipblaslt_TN_9695,0.330792
GemmTunableOp_Half_TN,tn_64128_39_4096,Gemm_Hipblaslt_TN_9097,0.164477
GemmTunableOp_Half_TN,tn_4096_847_2048,Gemm_Hipblaslt_TN_9352,0.0346316
GemmTunableOp_Half_TN,tn_64128_84_4096,Gemm_Hipblaslt_TN_9057,0.180488
GemmTunableOp_Half_TN,tn_64128_170_4096,Gemm_Hipblaslt_TN_9661,0.244334
GemmTunableOp_Half_TN,tn_4096_2517_2048,Gemm_Hipblaslt_TN_9672,0.0824803
GemmTunableOp_Half_TN,tn_4096_873_7168,Gemm_Hipblaslt_TN_9355,0.117322
GemmTunableOp_Half_TN,tn_14336_7823_4096,Gemm_Hipblaslt_TN_9888,1.48518
GemmTunableOp_Half_TN,tn_4096_1827_2048,Gemm_Hipblaslt_TN_9136,0.0634602
GemmTunableOp_Half_TN,tn_14336_1807_4096,Gemm_Hipblaslt_TN_9697,0.365661
GemmTunableOp_Half_TN,tn_3072_2636_4096,Gemm_Hipblaslt_TN_9329,0.122812
GemmTunableOp_Half_TN,tn_64128_106_4096,Gemm_Hipblaslt_TN_9698,0.196855
GemmTunableOp_Half_TN,tn_14336_865_4096,Gemm_Hipblaslt_TN_9192,0.181299
GemmTunableOp_Half_TN,tn_4096_1798_2048,Gemm_Hipblaslt_TN_9136,0.0621946
GemmTunableOp_Half_TN,tn_3072_795_4096,Gemm_Hipblaslt_TN_9048,0.0519541
GemmTunableOp_Half_TN,tn_3072_869_4096,Gemm_Hipblaslt_TN_9352,0.0556927
GemmTunableOp_Half_TN,tn_4096_256_2048,Gemm_Rocblas_621286447,0.0144404
GemmTunableOp_Half_TN,tn_4096_845_2048,Gemm_Hipblaslt_TN_9354,0.0354895
GemmTunableOp_Half_TN,tn_3072_873_4096,Gemm_Hipblaslt_TN_9147,0.0569729
GemmTunableOp_Half_TN,tn_3072_7992_4096,Gemm_Hipblaslt_TN_9693,0.341012
GemmTunableOp_Half_TN,tn_4096_3352_2048,Gemm_Hipblaslt_TN_9896,0.101266
GemmTunableOp_Half_TN,tn_4096_829_2048,Gemm_Hipblaslt_TN_9354,0.0341752
GemmTunableOp_Half_TN,tn_4096_943_7168,Gemm_Hipblaslt_TN_9604,0.119418
GemmTunableOp_Half_TN,tn_14336_794_4096,Gemm_Hipblaslt_TN_9691,0.163128
GemmTunableOp_Half_TN,tn_3072_8007_4096,Gemm_Rocblas_621294473,0.34177
GemmTunableOp_Half_TN,tn_14336_104_4096,Gemm_Rocblas_621286470,0.0407269
GemmTunableOp_Half_TN,tn_14336_969_4096,Gemm_Hipblaslt_TN_9220,0.202691
GemmTunableOp_Half_TN,tn_64128_143_4096,Gemm_Hipblaslt_TN_9799,0.218996
GemmTunableOp_Half_TN,tn_4096_850_2048,Gemm_Hipblaslt_TN_9577,0.0352807
GemmTunableOp_Half_TN,tn_4096_1673_2048,Gemm_Hipblaslt_TN_9328,0.0572472
GemmTunableOp_Half_TN,tn_4096_7809_7168,Gemm_Hipblaslt_TN_9815,0.728656
GemmTunableOp_Half_TN,tn_4096_855_7168,Gemm_Hipblaslt_TN_9099,0.111897
GemmTunableOp_Half_TN,tn_14336_1757_4096,Gemm_Hipblaslt_TN_9793,0.360992
GemmTunableOp_Half_TN,tn_3072_896_4096,Gemm_Hipblaslt_TN_9550,0.0574956
GemmTunableOp_Half_TN,tn_4096_4483_7168,Gemm_Hipblaslt_TN_9765,0.457614
GemmTunableOp_Half_TN,tn_14336_870_4096,Gemm_Hipblaslt_TN_9677,0.180265
GemmTunableOp_Half_TN,tn_4096_1880_7168,Gemm_Hipblaslt_TN_9645,0.206095
GemmTunableOp_Half_TN,tn_4096_1886_7168,Gemm_Hipblaslt_TN_9645,0.206115
GemmTunableOp_Half_TN,tn_4096_48_7168,Gemm_Rocblas_621286332,0.0188262
GemmTunableOp_Half_TN,tn_64128_248_4096,Gemm_Rocblas_621286915,0.289671
GemmTunableOp_Half_TN,tn_4096_920_7168,Gemm_Hipblaslt_TN_9576,0.118295
GemmTunableOp_Half_TN,tn_4096_2658_7168,Gemm_Hipblaslt_TN_9672,0.270676
GemmTunableOp_Half_TN,tn_4096_1715_7168,Gemm_Hipblaslt_TN_9671,0.185426
GemmTunableOp_Half_TN,tn_4096_2606_2048,Gemm_Hipblaslt_TN_9689,0.0840613
GemmTunableOp_Half_TN,tn_4096_877_7168,Gemm_Hipblaslt_TN_9604,0.114836
GemmTunableOp_Half_TN,tn_4096_984_7168,Gemm_Hipblaslt_TN_9583,0.123612
GemmTunableOp_Half_TN,tn_4096_8007_2048,Gemm_Hipblaslt_TN_9768,0.229562
GemmTunableOp_Half_TN,tn_4096_1743_2048,Gemm_Hipblaslt_TN_9680,0.0624123
GemmTunableOp_Half_TN,tn_4096_1763_2048,Gemm_Hipblaslt_TN_9136,0.0618918
GemmTunableOp_Half_TN,tn_4096_905_7168,Gemm_Hipblaslt_TN_9604,0.117891
GemmTunableOp_Half_TN,tn_3072_937_4096,Gemm_Hipblaslt_TN_9158,0.0583092
GemmTunableOp_Half_TN,tn_4096_961_2048,Gemm_Hipblaslt_TN_9589,0.03841
GemmTunableOp_Half_TN,tn_3072_2826_4096,Gemm_Hipblaslt_TN_9567,0.12802
GemmTunableOp_Half_TN,tn_4096_2635_2048,Gemm_Hipblaslt_TN_9672,0.0835489
GemmTunableOp_Half_TN,tn_14336_1748_4096,Gemm_Hipblaslt_TN_9187,0.360609
GemmTunableOp_Half_TN,tn_4096_977_7168,Gemm_Hipblaslt_TN_9160,0.121349
GemmTunableOp_Half_TN,tn_3072_944_4096,Gemm_Hipblaslt_TN_9352,0.0584674
GemmTunableOp_Half_TN,tn_4096_3599_7168,Gemm_Hipblaslt_TN_9814,0.339875
GemmTunableOp_Half_TN,tn_4096_797_7168,Gemm_Hipblaslt_TN_9158,0.107338
GemmTunableOp_Half_TN,tn_4096_916_7168,Gemm_Hipblaslt_TN_9576,0.117885
GemmTunableOp_Half_TN,tn_4096_8110_2048,Gemm_Hipblaslt_TN_9813,0.231965
GemmTunableOp_Half_TN,tn_14336_2826_4096,Gemm_Hipblaslt_TN_9697,0.555516
GemmTunableOp_Half_TN,tn_4096_829_7168,Gemm_Hipblaslt_TN_9147,0.110675
GemmTunableOp_Half_TN,tn_4096_2599_7168,Gemm_Hipblaslt_TN_9799,0.26799
GemmTunableOp_Half_TN,tn_3072_3671_4096,Gemm_Hipblaslt_TN_9672,0.163449
GemmTunableOp_Half_TN,tn_4096_3752_7168,Gemm_Hipblaslt_TN_9827,0.359199
GemmTunableOp_Half_TN,tn_14336_1846_4096,Gemm_Hipblaslt_TN_9677,0.367897
GemmTunableOp_Half_TN,tn_14336_2509_4096,Gemm_Rocblas_621286575,0.501019
GemmTunableOp_Half_TN,tn_4096_2722_2048,Gemm_Hipblaslt_TN_9689,0.0861436
GemmTunableOp_Half_TN,tn_14336_88_4096,Gemm_Hipblaslt_TN_9350,0.0365315
GemmTunableOp_Half_TN,tn_3072_2509_4096,Gemm_Hipblaslt_TN_9624,0.119393
GemmTunableOp_Half_TN,tn_4096_2721_2048,Gemm_Hipblaslt_TN_9676,0.0867208
GemmTunableOp_Half_TN,tn_4096_1931_2048,Gemm_Hipblaslt_TN_9590,0.0652307
GemmTunableOp_Half_TN,tn_14336_3431_4096,Gemm_Hipblaslt_TN_9220,0.644399
GemmTunableOp_Half_TN,tn_4096_949_2048,Gemm_Hipblaslt_TN_9577,0.0384633
GemmTunableOp_Half_TN,tn_3072_814_4096,Gemm_Hipblaslt_TN_9048,0.0530239
GemmTunableOp_Half_TN,tn_64128_129_4096,Gemm_Hipblaslt_TN_9108,0.2146
GemmTunableOp_Half_TN,tn_4096_949_7168,Gemm_Hipblaslt_TN_9604,0.118966
GemmTunableOp_Half_TN,tn_14336_881_4096,Gemm_Hipblaslt_TN_9677,0.179388
GemmTunableOp_Half_TN,tn_64128_229_4096,Gemm_Rocblas_621294648,0.279764
GemmTunableOp_Half_TN,tn_4096_876_2048,Gemm_Hipblaslt_TN_9252,0.0374969
GemmTunableOp_Half_TN,tn_4096_1742_2048,Gemm_Hipblaslt_TN_9136,0.0625306
GemmTunableOp_Half_TN,tn_4096_1755_7168,Gemm_Hipblaslt_TN_9673,0.193908
GemmTunableOp_Half_TN,tn_3072_7266_4096,Gemm_Hipblaslt_TN_9681,0.309845
GemmTunableOp_Half_TN,tn_4096_875_7168,Gemm_Hipblaslt_TN_9170,0.116733
GemmTunableOp_Half_TN,tn_14336_948_4096,Gemm_Hipblaslt_TN_9697,0.185499
GemmTunableOp_Half_TN,tn_14336_944_4096,Gemm_Hipblaslt_TN_9677,0.184375
GemmTunableOp_Half_TN,tn_4096_1854_2048,Gemm_Hipblaslt_TN_9590,0.0622218
GemmTunableOp_Half_TN,tn_3072_32_4096,Gemm_Rocblas_621294054,0.00923821
GemmTunableOp_Half_TN,tn_3072_2860_4096,Gemm_Hipblaslt_TN_9624,0.127902
GemmTunableOp_Half_TN,tn_3072_2670_4096,Gemm_Hipblaslt_TN_9329,0.124347
GemmTunableOp_Half_TN,tn_14336_2601_4096,Gemm_Hipblaslt_TN_9793,0.528503
GemmTunableOp_Half_TN,tn_4096_208_2048,Gemm_Rocblas_621286447,0.0143499
GemmTunableOp_Half_TN,tn_14336_2628_4096,Gemm_Hipblaslt_TN_9793,0.527276
GemmTunableOp_Half_TN,tn_3072_7809_4096,Gemm_Hipblaslt_TN_9687,0.336907
GemmTunableOp_Half_TN,tn_3072_16_4096,Default,0.00831408
GemmTunableOp_Half_TN,tn_14336_1763_4096,Gemm_Hipblaslt_TN_9187,0.362488
GemmTunableOp_Half_TN,tn_3072_104_4096,Gemm_Rocblas_621286438,0.0147448
GemmTunableOp_Half_TN,tn_4096_7857_7168,Gemm_Rocblas_621294127,0.732637
GemmTunableOp_Half_TN,tn_4096_2537_2048,Gemm_Hipblaslt_TN_9689,0.0827209
GemmTunableOp_Half_TN,tn_4096_2786_7168,Gemm_Hipblaslt_TN_9691,0.278879
GemmTunableOp_Half_TN,tn_3072_859_4096,Gemm_Hipblaslt_TN_9368,0.0539583
GemmTunableOp_Half_TN,tn_4096_2682_2048,Gemm_Hipblaslt_TN_9687,0.0843957
GemmTunableOp_Half_TN,tn_64128_60_4096,Gemm_Hipblaslt_TN_9097,0.167454
GemmTunableOp_Half_TN,tn_4096_1805_7168,Gemm_Hipblaslt_TN_9680,0.200706
GemmTunableOp_Half_TN,tn_4096_2722_7168,Gemm_Hipblaslt_TN_9690,0.275847
GemmTunableOp_Half_TN,tn_14336_1827_4096,Gemm_Hipblaslt_TN_9187,0.369409
GemmTunableOp_Half_TN,tn_4096_2805_7168,Gemm_Hipblaslt_TN_9672,0.280517
GemmTunableOp_Half_TN,tn_4096_72_2048,Gemm_Rocblas_621286280,0.00905904
GemmTunableOp_Half_TN,tn_4096_2826_2048,Gemm_Hipblaslt_TN_9691,0.0879515
GemmTunableOp_Half_TN,tn_3072_3565_4096,Gemm_Rocblas_621286753,0.156154
GemmTunableOp_Half_TN,tn_14336_96_4096,Gemm_Hipblaslt_TN_9350,0.0376791
GemmTunableOp_Half_TN,tn_14336_964_4096,Gemm_Hipblaslt_TN_9220,0.201256
GemmTunableOp_Half_TN,tn_3072_961_4096,Gemm_Hipblaslt_TN_9251,0.0596864
GemmTunableOp_Half_TN,tn_3072_1695_4096,Gemm_Rocblas_621294520,0.0890957
GemmTunableOp_Half_TN,tn_14336_3447_4096,Gemm_Rocblas_621286693,0.651439
GemmTunableOp_Half_TN,tn_14336_936_4096,Gemm_Hipblaslt_TN_9677,0.185351
GemmTunableOp_Half_TN,tn_4096_1834_2048,Gemm_Hipblaslt_TN_9590,0.0622635
GemmTunableOp_Half_TN,tn_4096_801_2048,Gemm_Hipblaslt_TN_9354,0.0343963
GemmTunableOp_Half_TN,tn_4096_2681_7168,Gemm_Hipblaslt_TN_9799,0.269383
GemmTunableOp_Half_TN,tn_4096_48_2048,Gemm_Rocblas_621286428,0.00797152
GemmTunableOp_Half_TN,tn_3072_120_4096,Gemm_Rocblas_621294166,0.0152764
GemmTunableOp_Half_TN,tn_3072_176_4096,Gemm_Rocblas_621286436,0.017938
GemmTunableOp_Half_TN,tn_3072_8070_4096,Gemm_Rocblas_621294467,0.348947
GemmTunableOp_Half_TN,tn_4096_872_7168,Gemm_Hipblaslt_TN_9547,0.115213
GemmTunableOp_Half_TN,tn_14336_7239_4096,Gemm_Hipblaslt_TN_9677,1.38121
GemmTunableOp_Half_TN,tn_64128_46_4096,Gemm_Hipblaslt_TN_9097,0.165271
GemmTunableOp_Half_TN,tn_3072_80_4096,Gemm_Rocblas_621286449,0.0134595
GemmTunableOp_Half_TN,tn_4096_886_7168,Gemm_Hipblaslt_TN_9160,0.117807
GemmTunableOp_Half_TN,tn_3072_892_4096,Gemm_Hipblaslt_TN_9352,0.0564318
GemmTunableOp_Half_TN,tn_14336_2653_4096,Gemm_Hipblaslt_TN_9793,0.533944
GemmTunableOp_Half_TN,tn_4096_216_2048,Gemm_Rocblas_621286447,0.0143911
GemmTunableOp_Half_TN,tn_4096_969_2048,Gemm_Hipblaslt_TN_9604,0.0383621
GemmTunableOp_Half_TN,tn_3072_7967_4096,Gemm_Rocblas_621294473,0.340824
GemmTunableOp_Half_TN,tn_3072_890_4096,Gemm_Hipblaslt_TN_9546,0.0571472
GemmTunableOp_Half_TN,tn_14336_1913_4096,Gemm_Hipblaslt_TN_9697,0.372521
GemmTunableOp_Half_TN,tn_64128_160_4096,Gemm_Rocblas_621294320,0.220118
GemmTunableOp_Half_TN,tn_3072_2699_4096,Gemm_Hipblaslt_TN_9624,0.126138
GemmTunableOp_Half_TN,tn_4096_823_7168,Gemm_Hipblaslt_TN_9352,0.109941
GemmTunableOp_Half_TN,tn_14336_2750_4096,Gemm_Hipblaslt_TN_9677,0.549219
GemmTunableOp_Half_TN,tn_3072_2590_4096,Gemm_Hipblaslt_TN_9645,0.1213
GemmTunableOp_Half_TN,tn_4096_144_7168,Gemm_Rocblas_621286491,0.035832
GemmTunableOp_Half_TN,tn_4096_794_7168,Gemm_Hipblaslt_TN_9158,0.107828
GemmTunableOp_Half_TN,tn_3072_7937_4096,Gemm_Hipblaslt_TN_9779,0.337474
GemmTunableOp_Half_TN,tn_14336_1848_4096,Gemm_Hipblaslt_TN_9697,0.369113
GemmTunableOp_Half_TN,tn_3072_2793_4096,Gemm_Hipblaslt_TN_9624,0.126148
GemmTunableOp_Half_TN,tn_14336_925_4096,Gemm_Hipblaslt_TN_9677,0.182313
GemmTunableOp_Half_TN,tn_4096_2734_7168,Gemm_Hipblaslt_TN_9690,0.276689
GemmTunableOp_Half_TN,tn_4096_1835_2048,Gemm_Hipblaslt_TN_9590,0.0625258
GemmTunableOp_Half_TN,tn_64128_12_4096,Gemm_Rocblas_621294578,0.142954
GemmTunableOp_Half_TN,tn_64128_114_4096,Gemm_Hipblaslt_TN_9264,0.198755
GemmTunableOp_Half_TN,tn_4096_7863_2048,Gemm_Hipblaslt_TN_9184,0.2296
GemmTunableOp_Half_TN,tn_3072_7953_4096,Gemm_Hipblaslt_TN_9787,0.339112
GemmTunableOp_Half_TN,tn_14336_3599_4096,Gemm_Hipblaslt_TN_9677,0.722978
GemmTunableOp_Half_TN,tn_14336_932_4096,Gemm_Hipblaslt_TN_9139,0.184286
GemmTunableOp_Half_TN,tn_4096_1792_2048,Gemm_Hipblaslt_TN_9590,0.0609088
GemmTunableOp_Half_TN,tn_14336_785_4096,Gemm_Hipblaslt_TN_9691,0.162487
GemmTunableOp_Half_TN,tn_4096_816_7168,Gemm_Hipblaslt_TN_9352,0.109324
GemmTunableOp_Half_TN,tn_4096_104_7168,Gemm_Rocblas_621286436,0.0271618
GemmTunableOp_Half_TN,tn_14336_1795_4096,Gemm_Hipblaslt_TN_9697,0.366774
GemmTunableOp_Half_TN,tn_14336_2788_4096,Gemm_Hipblaslt_TN_9192,0.551734
GemmTunableOp_Half_TN,tn_3072_1913_4096,Gemm_Hipblaslt_TN_9613,0.0947502
GemmTunableOp_Half_TN,tn_4096_948_2048,Gemm_Hipblaslt_TN_9604,0.0385714
GemmTunableOp_Half_TN,tn_3072_946_4096,Gemm_Hipblaslt_TN_9147,0.059412
GemmTunableOp_Half_TN,tn_14336_256_4096,Gemm_Rocblas_621294514,0.0679139
GemmTunableOp_Half_TN,tn_3072_208_4096,Gemm_Rocblas_621294171,0.0219372
GemmTunableOp_Half_TN,tn_4096_835_2048,Gemm_Hipblaslt_TN_9352,0.0341433
GemmTunableOp_Half_TN,tn_4096_1719_2048,Gemm_Hipblaslt_TN_9164,0.0582121
GemmTunableOp_Half_TN,tn_4096_814_7168,Gemm_Hipblaslt_TN_9147,0.109787
GemmTunableOp_Half_TN,tn_3072_72_4096,Gemm_Rocblas_621294177,0.0133227
GemmTunableOp_Half_TN,tn_4096_918_2048,Gemm_Hipblaslt_TN_9577,0.0365619
GemmTunableOp_Half_TN,tn_3072_3479_4096,Gemm_Rocblas_621294495,0.155276
GemmTunableOp_Half_TN,tn_4096_1768_7168,Gemm_Hipblaslt_TN_9134,0.1993
GemmTunableOp_Half_TN,tn_14336_208_4096,Gemm_Hipblaslt_TN_9634,0.0655399
GemmTunableOp_Half_TN,tn_64128_241_4096,Gemm_Rocblas_621294658,0.288188
GemmTunableOp_Half_TN,tn_4096_7953_7168,Gemm_Rocblas_621294127,0.733235
GemmTunableOp_Half_TN,tn_4096_846_7168,Gemm_Hipblaslt_TN_9160,0.113888
GemmTunableOp_Half_TN,tn_64128_29_4096,Gemm_Rocblas_621286348,0.147811
GemmTunableOp_Half_TN,tn_3072_807_4096,Gemm_Hipblaslt_TN_9048,0.05284
GemmTunableOp_Half_TN,tn_14336_1815_4096,Gemm_Hipblaslt_TN_9697,0.366877
GemmTunableOp_Half_TN,tn_14336_918_4096,Gemm_Hipblaslt_TN_9697,0.184336
GemmTunableOp_Half_TN,tn_4096_2670_7168,Gemm_Hipblaslt_TN_9691,0.27143
GemmTunableOp_Half_TN,tn_14336_921_4096,Gemm_Hipblaslt_TN_9697,0.182924
GemmTunableOp_Half_TN,tn_14336_1729_4096,Gemm_Hipblaslt_TN_9793,0.362628
GemmTunableOp_Half_TN,tn_14336_898_4096,Gemm_Hipblaslt_TN_9697,0.183255
GemmTunableOp_Half_TN,tn_14336_216_4096,Gemm_Hipblaslt_TN_9252,0.06585
GemmTunableOp_Half_TN,tn_14336_1853_4096,Gemm_Hipblaslt_TN_9697,0.368991
GemmTunableOp_Half_TN,tn_14336_2722_4096,Gemm_Hipblaslt_TN_9697,0.54773
GemmTunableOp_Half_TN,tn_4096_4463_7168,Gemm_Hipblaslt_TN_9763,0.453553
GemmTunableOp_Half_TN,tn_4096_7992_2048,Gemm_Rocblas_621294030,0.227098
GemmTunableOp_Half_TN,tn_4096_2560_7168,Gemm_Rocblas_621294314,0.261479
GemmTunableOp_Half_TN,tn_64128_87_4096,Gemm_Hipblaslt_TN_9057,0.182725
GemmTunableOp_Half_TN,tn_64128_16_4096,Gemm_Rocblas_621286348,0.144661
GemmTunableOp_Half_TN,tn_4096_852_7168,Gemm_Hipblaslt_TN_9099,0.113294
GemmTunableOp_Half_TN,tn_4096_1775_7168,Gemm_Hipblaslt_TN_9645,0.20019
GemmTunableOp_Half_TN,tn_14336_891_4096,Gemm_Hipblaslt_TN_9677,0.180801
GemmTunableOp_Half_TN,tn_4096_926_2048,Gemm_Hipblaslt_TN_9577,0.0372701
GemmTunableOp_Half_TN,tn_3072_2708_4096,Gemm_Hipblaslt_TN_9624,0.126177
GemmTunableOp_Half_TN,tn_64128_22_4096,Gemm_Rocblas_621286348,0.145856
GemmTunableOp_Half_TN,tn_64128_63_4096,Gemm_Hipblaslt_TN_9097,0.168146
GemmTunableOp_Half_TN,tn_64128_81_4096,Gemm_Hipblaslt_TN_9057,0.180628
GemmTunableOp_Half_TN,tn_64128_117_4096,Gemm_Hipblaslt_TN_9698,0.199707
GemmTunableOp_Half_TN,tn_64128_105_4096,Gemm_Rocblas_621294762,0.196024
GemmTunableOp_Half_TN,tn_4096_3670_7168,Gemm_Hipblaslt_TN_9920,0.357994
GemmTunableOp_Half_TN,tn_14336_805_4096,Gemm_Hipblaslt_TN_9677,0.177705
GemmTunableOp_Half_TN,tn_4096_2630_2048,Gemm_Hipblaslt_TN_9689,0.0844508
GemmTunableOp_Half_TN,tn_64128_21_4096,Gemm_Rocblas_621286348,0.144221
GemmTunableOp_Half_TN,tn_64128_186_4096,Gemm_Hipblaslt_TN_9694,0.248443
GemmTunableOp_Half_TN,tn_64128_198_4096,Gemm_Hipblaslt_TN_9654,0.269749
GemmTunableOp_Half_TN,tn_3072_2805_4096,Gemm_Hipblaslt_TN_9624,0.12752
GemmTunableOp_Half_TN,tn_64128_204_4096,Gemm_Hipblaslt_TN_9654,0.268658
GemmTunableOp_Half_TN,tn_64128_239_4096,Gemm_Rocblas_621286915,0.285038
GemmTunableOp_Half_TN,tn_4096_2860_7168,Gemm_Hipblaslt_TN_9672,0.28127
GemmTunableOp_Half_TN,tn_3072_1694_4096,Gemm_Hipblaslt_TN_9561,0.0890064
GemmTunableOp_Half_TN,tn_4096_813_2048,Gemm_Hipblaslt_TN_9604,0.0347178
GemmTunableOp_Half_TN,tn_3072_857_4096,Gemm_Hipblaslt_TN_9352,0.056432
GemmTunableOp_Half_TN,tn_4096_926_7168,Gemm_Hipblaslt_TN_9576,0.118583
GemmTunableOp_Half_TN,tn_14336_972_4096,Gemm_Hipblaslt_TN_9220,0.202194
GemmTunableOp_Half_TN,tn_14336_817_4096,Gemm_Hipblaslt_TN_9677,0.17772
GemmTunableOp_Half_TN,tn_14336_1822_4096,Gemm_Hipblaslt_TN_9677,0.363205
GemmTunableOp_Half_TN,tn_4096_1701_2048,Gemm_Hipblaslt_TN_9164,0.0585641
GemmTunableOp_Half_TN,tn_14336_947_4096,Gemm_Hipblaslt_TN_9697,0.184455
GemmTunableOp_Half_TN,tn_3072_805_4096,Gemm_Hipblaslt_TN_9047,0.0535979
GemmTunableOp_Half_TN,tn_4096_1737_2048,Gemm_Hipblaslt_TN_9680,0.0623628
GemmTunableOp_Half_TN,tn_4096_982_2048,Gemm_Hipblaslt_TN_9577,0.0399646
GemmTunableOp_Half_TN,tn_64128_50_4096,Gemm_Hipblaslt_TN_9097,0.166199
GemmTunableOp_Half_TN,tn_3072_1718_4096,Gemm_Hipblaslt_TN_9561,0.087034
GemmTunableOp_Half_TN,tn_64128_104_4096,Gemm_Hipblaslt_TN_9670,0.196823
GemmTunableOp_Half_TN,tn_14336_802_4096,Gemm_Hipblaslt_TN_9677,0.175285
GemmTunableOp_Half_TN,tn_64128_163_4096,Gemm_Hipblaslt_TN_9816,0.242958
GemmTunableOp_Half_TN,tn_4096_1727_7168,Gemm_Hipblaslt_TN_9265,0.185659
GemmTunableOp_Half_TN,tn_4096_894_2048,Gemm_Hipblaslt_TN_9577,0.0366015
GemmTunableOp_Half_TN,tn_3072_940_4096,Gemm_Hipblaslt_TN_9546,0.0573132
GemmTunableOp_Half_TN,tn_4096_1739_2048,Gemm_Hipblaslt_TN_9645,0.0625281
GemmTunableOp_Half_TN,tn_4096_1644_2048,Gemm_Hipblaslt_TN_9616,0.0562373
GemmTunableOp_Half_TN,tn_4096_927_7168,Gemm_Hipblaslt_TN_9170,0.117713
GemmTunableOp_Half_TN,tn_3072_871_4096,Gemm_Hipblaslt_TN_9546,0.0575126
GemmTunableOp_Half_TN,tn_3072_2750_4096,Gemm_Hipblaslt_TN_9624,0.126934
GemmTunableOp_Half_TN,tn_14336_834_4096,Gemm_Hipblaslt_TN_9139,0.17767
GemmTunableOp_Half_TN,tn_3072_1893_4096,Gemm_Hipblaslt_TN_9148,0.0943943
GemmTunableOp_Half_TN,tn_3072_1759_4096,Gemm_Hipblaslt_TN_9613,0.0910946
GemmTunableOp_Half_TN,tn_4096_32_2048,Gemm_Rocblas_621286273,0.0070922
GemmTunableOp_Half_TN,tn_64128_56_4096,Gemm_Hipblaslt_TN_9097,0.167935
GemmTunableOp_Half_TN,tn_4096_1733_2048,Gemm_Hipblaslt_TN_9680,0.0613952
GemmTunableOp_Half_TN,tn_4096_929_2048,Gemm_Hipblaslt_TN_9577,0.0379037
GemmTunableOp_Half_TN,tn_64128_124_4096,Gemm_Rocblas_621294762,0.198892
GemmTunableOp_Half_TN,tn_4096_957_2048,Gemm_Hipblaslt_TN_9604,0.0374478
GemmTunableOp_Half_TN,tn_4096_1798_7168,Gemm_Hipblaslt_TN_9268,0.202752
GemmTunableOp_Half_TN,tn_3072_862_4096,Gemm_Hipblaslt_TN_9368,0.0522684
GemmTunableOp_Half_TN,tn_3072_7823_4096,Gemm_Hipblaslt_TN_9779,0.336699
GemmTunableOp_Half_TN,tn_3072_2599_4096,Gemm_Hipblaslt_TN_9645,0.122364
GemmTunableOp_Half_TN,tn_4096_2544_7168,Gemm_Hipblaslt_TN_9690,0.263669
GemmTunableOp_Half_TN,tn_4096_112_7168,Gemm_Rocblas_621286280,0.0276922
GemmTunableOp_Half_TN,tn_4096_1756_2048,Gemm_Hipblaslt_TN_9136,0.0619505
GemmTunableOp_Half_TN,tn_4096_1931_7168,Gemm_Hipblaslt_TN_9645,0.210276
GemmTunableOp_Half_TN,tn_4096_3711_7168,Gemm_Hipblaslt_TN_9827,0.358939
GemmTunableOp_Half_TN,tn_4096_1775_2048,Gemm_Hipblaslt_TN_9136,0.0618848
GemmTunableOp_Half_TN,tn_3072_2571_4096,Gemm_Hipblaslt_TN_9645,0.122181
GemmTunableOp_Half_TN,tn_64128_210_4096,Gemm_Hipblaslt_TN_9919,0.271668
GemmTunableOp_Half_TN,tn_4096_2560_2048,Gemm_Rocblas_621286705,0.0823692
GemmTunableOp_Half_TN,tn_14336_839_4096,Gemm_Hipblaslt_TN_9677,0.178201
GemmTunableOp_Half_TN,tn_64128_71_4096,Gemm_Hipblaslt_TN_9057,0.178645
GemmTunableOp_Half_TN,tn_3072_3571_4096,Gemm_Rocblas_621294495,0.155702
GemmTunableOp_Half_TN,tn_4096_7283_7168,Gemm_Hipblaslt_TN_9743,0.676304
GemmTunableOp_Half_TN,tn_64128_64_4096,Gemm_Hipblaslt_TN_9097,0.16667
GemmTunableOp_Half_TN,tn_4096_1785_2048,Gemm_Hipblaslt_TN_9590,0.0629259
GemmTunableOp_Half_TN,tn_4096_843_7168,Gemm_Hipblaslt_TN_9352,0.111715
GemmStridedBatchedTunableOp_Half_TN,tn_962_962_128_B_16,Gemm_Rocblas_621286794,0.027683
GemmStridedBatchedTunableOp_Half_TN,tn_890_890_128_B_16,Gemm_Rocblas_621294728,0.0264889
GemmStridedBatchedTunableOp_Half_TN,tn_904_904_128_B_16,Gemm_Rocblas_621293994,0.0238138
GemmStridedBatchedTunableOp_Half_TN,tn_835_835_128_B_16,Gemm_Rocblas_621286794,0.0255882
GemmStridedBatchedTunableOp_Half_TN,tn_911_911_128_B_16,Gemm_Rocblas_621294536,0.0267616
GemmStridedBatchedTunableOp_Half_TN,tn_829_829_128_B_16,Gemm_Rocblas_621294635,0.0239253
GemmStridedBatchedTunableOp_Half_TN,tn_934_934_128_B_16,Gemm_Rocblas_621294536,0.0272953
GemmStridedBatchedTunableOp_Half_TN,tn_872_872_128_B_16,Gemm_Rocblas_621293994,0.023345
GemmStridedBatchedTunableOp_Half_TN,tn_859_859_128_B_16,Gemm_Rocblas_621294536,0.0259492
GemmStridedBatchedTunableOp_Half_TN,tn_992_992_128_B_16,Gemm_Rocblas_621293994,0.0236996
GemmStridedBatchedTunableOp_Half_TN,tn_862_862_128_B_16,Gemm_Rocblas_621294728,0.0258092
GemmStridedBatchedTunableOp_Half_TN,tn_991_991_128_B_16,Gemm_Rocblas_621294536,0.0293344
GemmStridedBatchedTunableOp_Half_TN,tn_939_939_128_B_16,Gemm_Rocblas_621286794,0.0275301
GemmStridedBatchedTunableOp_Half_TN,tn_873_873_128_B_16,Gemm_Rocblas_621294728,0.0261737
GemmStridedBatchedTunableOp_Half_TN,tn_895_895_128_B_16,Gemm_Rocblas_621286794,0.0264757
GemmStridedBatchedTunableOp_Half_TN,tn_972_972_128_B_16,Gemm_Rocblas_621286794,0.0280339
GemmStridedBatchedTunableOp_Half_TN,tn_965_965_128_B_16,Gemm_Rocblas_621286794,0.0275254
GemmStridedBatchedTunableOp_Half_TN,tn_976_976_128_B_16,Gemm_Rocblas_621293994,0.0241145
GemmStridedBatchedTunableOp_Half_TN,tn_813_813_128_B_16,Gemm_Hipblaslt_TN_158,0.0239197
GemmStridedBatchedTunableOp_Half_TN,tn_879_879_128_B_16,Gemm_Rocblas_621294728,0.0261082
GemmStridedBatchedTunableOp_Half_TN,tn_809_809_128_B_16,Gemm_Hipblaslt_TN_158,0.0230547
GemmStridedBatchedTunableOp_Half_TN,tn_975_975_128_B_16,Gemm_Rocblas_621294536,0.027938
GemmStridedBatchedTunableOp_Half_TN,tn_995_995_128_B_16,Gemm_Rocblas_621294536,0.0291126
GemmStridedBatchedTunableOp_Half_TN,tn_930_930_128_B_16,Gemm_Rocblas_621286794,0.0274354
GemmStridedBatchedTunableOp_Half_TN,tn_870_870_128_B_16,Gemm_Rocblas_621294460,0.0259124
GemmStridedBatchedTunableOp_Half_TN,tn_956_956_128_B_16,Gemm_Rocblas_621286794,0.0277292
GemmStridedBatchedTunableOp_Half_TN,tn_867_867_128_B_16,Gemm_Rocblas_621294728,0.0260928
GemmStridedBatchedTunableOp_Half_TN,tn_790_790_128_B_16,Gemm_Rocblas_621286500,0.0220145
GemmStridedBatchedTunableOp_Half_TN,tn_839_839_128_B_16,Gemm_Rocblas_621286984,0.0256718
GemmStridedBatchedTunableOp_Half_TN,tn_853_853_128_B_16,Gemm_Rocblas_621294536,0.02573
GemmStridedBatchedTunableOp_Half_TN,tn_933_933_128_B_16,Gemm_Rocblas_621294536,0.027544
GemmStridedBatchedTunableOp_Half_TN,tn_804_804_128_B_16,Gemm_Hipblaslt_TN_158,0.0227419
GemmStridedBatchedTunableOp_Half_TN,tn_885_885_128_B_16,Gemm_Rocblas_621286794,0.0262559
GemmStridedBatchedTunableOp_Half_TN,tn_811_811_128_B_16,Gemm_Hipblaslt_TN_158,0.0231548
GemmStridedBatchedTunableOp_Half_TN,tn_812_812_128_B_16,Gemm_Hipblaslt_TN_158,0.023229
GemmStridedBatchedTunableOp_Half_TN,tn_874_874_128_B_16,Gemm_Rocblas_621286984,0.0259718
GemmStridedBatchedTunableOp_Half_TN,tn_989_989_128_B_16,Gemm_Rocblas_621294536,0.0286009
GemmStridedBatchedTunableOp_Half_TN,tn_924_924_128_B_16,Gemm_Rocblas_621286794,0.0271401
GemmStridedBatchedTunableOp_Half_TN,tn_977_977_128_B_16,Gemm_Rocblas_621286794,0.0283527
GemmStridedBatchedTunableOp_Half_TN,tn_864_864_128_B_16,Gemm_Hipblaslt_TN_150,0.0182563
GemmStridedBatchedTunableOp_Half_TN,tn_905_905_128_B_16,Gemm_Rocblas_621294536,0.0268059
GemmStridedBatchedTunableOp_Half_TN,tn_984_984_128_B_16,Gemm_Rocblas_621286240,0.0257696
GemmStridedBatchedTunableOp_Half_TN,tn_865_865_128_B_16,Gemm_Rocblas_621294536,0.0260212
GemmStridedBatchedTunableOp_Half_TN,tn_846_846_128_B_16,Gemm_Rocblas_621286718,0.0252923
GemmStridedBatchedTunableOp_Half_TN,tn_849_849_128_B_16,Gemm_Rocblas_621294552,0.0253102
GemmStridedBatchedTunableOp_Half_TN,tn_838_838_128_B_16,Gemm_Rocblas_621294728,0.0254469
GemmStridedBatchedTunableOp_Half_TN,tn_922_922_128_B_16,Gemm_Rocblas_621286794,0.0273188
GemmStridedBatchedTunableOp_Half_TN,tn_786_786_128_B_16,Gemm_Hipblaslt_TN_158,0.0223114
GemmStridedBatchedTunableOp_Half_TN,tn_969_969_128_B_16,Gemm_Rocblas_621286794,0.0283784
GemmStridedBatchedTunableOp_Half_TN,tn_964_964_128_B_16,Gemm_Rocblas_621294536,0.0281742
GemmStridedBatchedTunableOp_Half_TN,tn_990_990_128_B_16,Gemm_Rocblas_621286794,0.0278553
GemmStridedBatchedTunableOp_Half_TN,tn_961_961_128_B_16,Gemm_Rocblas_621294536,0.0281456
GemmStridedBatchedTunableOp_Half_TN,tn_909_909_128_B_16,Gemm_Rocblas_621286794,0.0268233
GemmStridedBatchedTunableOp_Half_TN,tn_946_946_128_B_16,Gemm_Rocblas_621294536,0.0277897
GemmStridedBatchedTunableOp_Half_TN,tn_851_851_128_B_16,Gemm_Rocblas_621286984,0.0258112
GemmStridedBatchedTunableOp_Half_TN,tn_1000_1000_128_B_16,Gemm_Rocblas_621293994,0.0253318
GemmStridedBatchedTunableOp_Half_TN,tn_844_844_128_B_16,Gemm_Rocblas_621294460,0.0242232
GemmStridedBatchedTunableOp_Half_TN,tn_814_814_128_B_16,Gemm_Hipblaslt_TN_158,0.0230788
GemmStridedBatchedTunableOp_Half_TN,tn_789_789_128_B_16,Gemm_Hipblaslt_TN_158,0.0225466
GemmStridedBatchedTunableOp_Half_TN,tn_892_892_128_B_16,Gemm_Rocblas_621294728,0.0262807
GemmStridedBatchedTunableOp_Half_TN,tn_861_861_128_B_16,Gemm_Rocblas_621286794,0.0259667
GemmStridedBatchedTunableOp_Half_TN,tn_953_953_128_B_16,Gemm_Rocblas_621294536,0.0275233
GemmStridedBatchedTunableOp_Half_TN,tn_877_877_128_B_16,Gemm_Rocblas_621286984,0.0262787
GemmStridedBatchedTunableOp_Half_TN,tn_820_820_128_B_16,Gemm_Hipblaslt_TN_158,0.0234185
GemmStridedBatchedTunableOp_Half_TN,tn_798_798_128_B_16,Gemm_Hipblaslt_TN_158,0.0223099
GemmStridedBatchedTunableOp_Half_TN,tn_913_913_128_B_16,Gemm_Rocblas_621294536,0.0271487
GemmStridedBatchedTunableOp_Half_TN,tn_856_856_128_B_16,Gemm_Hipblaslt_TN_150,0.0203201
GemmStridedBatchedTunableOp_Half_TN,tn_854_854_128_B_16,Gemm_Rocblas_621294635,0.0254156
GemmStridedBatchedTunableOp_Half_TN,tn_955_955_128_B_16,Gemm_Rocblas_621294536,0.0279601
GemmStridedBatchedTunableOp_Half_TN,tn_863_863_128_B_16,Gemm_Rocblas_621286984,0.0259212
GemmStridedBatchedTunableOp_Half_TN,tn_888_888_128_B_16,Gemm_Hipblaslt_TN_150,0.0203993
GemmStridedBatchedTunableOp_Half_TN,tn_918_918_128_B_16,Gemm_Rocblas_621294536,0.0272236
GemmStridedBatchedTunableOp_Half_TN,tn_840_840_128_B_16,Gemm_Hipblaslt_TN_150,0.0206951
GemmStridedBatchedTunableOp_Half_TN,tn_836_836_128_B_16,Gemm_Hipblaslt_TN_158,0.0243626
GemmStridedBatchedTunableOp_Half_TN,tn_810_810_128_B_16,Gemm_Hipblaslt_TN_158,0.0235239
GemmStridedBatchedTunableOp_Half_TN,tn_947_947_128_B_16,Gemm_Rocblas_621286794,0.0282821
GemmStridedBatchedTunableOp_Half_TN,tn_807_807_128_B_16,Gemm_Hipblaslt_TN_158,0.0227891
GemmStridedBatchedTunableOp_Half_TN,tn_920_920_128_B_16,Gemm_Rocblas_621293994,0.02396
GemmStridedBatchedTunableOp_Half_TN,tn_940_940_128_B_16,Gemm_Rocblas_621294536,0.0277645
GemmStridedBatchedTunableOp_Half_TN,tn_842_842_128_B_16,Gemm_Rocblas_621286718,0.0250883
GemmStridedBatchedTunableOp_Half_TN,tn_981_981_128_B_16,Gemm_Rocblas_621294536,0.0287518
GemmStridedBatchedTunableOp_Half_TN,tn_886_886_128_B_16,Gemm_Rocblas_621294728,0.0263488
GemmStridedBatchedTunableOp_Half_TN,tn_944_944_128_B_16,Gemm_Rocblas_621293994,0.0234695
GemmStridedBatchedTunableOp_Half_TN,tn_937_937_128_B_16,Gemm_Rocblas_621286794,0.0277247
GemmStridedBatchedTunableOp_Half_TN,tn_796_796_128_B_16,Gemm_Hipblaslt_TN_158,0.0222302
GemmStridedBatchedTunableOp_Half_TN,tn_936_936_128_B_16,Gemm_Rocblas_621293994,0.0240919
GemmStridedBatchedTunableOp_Half_TN,tn_912_912_128_B_16,Gemm_Rocblas_621293994,0.0229984
GemmStridedBatchedTunableOp_Half_TN,tn_987_987_128_B_16,Gemm_Rocblas_621294536,0.028379
GemmStridedBatchedTunableOp_Half_TN,tn_828_828_128_B_16,Gemm_Hipblaslt_TN_158,0.023885
GemmStridedBatchedTunableOp_Half_TN,tn_985_985_128_B_16,Gemm_Rocblas_621286794,0.0286647
GemmStridedBatchedTunableOp_Half_TN,tn_882_882_128_B_16,Gemm_Rocblas_621286984,0.0260369
GemmStridedBatchedTunableOp_Half_TN,tn_910_910_128_B_16,Gemm_Rocblas_621286794,0.0269848
GemmStridedBatchedTunableOp_Half_TN,tn_824_824_128_B_16,Gemm_Hipblaslt_TN_150,0.0192898
GemmStridedBatchedTunableOp_Half_TN,tn_802_802_128_B_16,Gemm_Hipblaslt_TN_158,0.0228472
GemmStridedBatchedTunableOp_Half_TN,tn_803_803_128_B_16,Gemm_Rocblas_621286500,0.0236699
GemmTunableOp_Half_TN,tn_14336_835_4096,Gemm_Hipblaslt_TN_9187,0.178967
GemmTunableOp_Half_TN,tn_4096_64_7168,Gemm_Rocblas_621286332,0.01926
GemmTunableOp_Half_TN,tn_4096_881_7168,Gemm_Hipblaslt_TN_9604,0.116881
GemmTunableOp_Half_TN,tn_3072_3556_4096,Gemm_Rocblas_621294495,0.157179
GemmTunableOp_Half_TN,tn_4096_2653_7168,Gemm_Hipblaslt_TN_9799,0.269246
GemmTunableOp_Half_TN,tn_4096_4242_7168,Gemm_Hipblaslt_TN_9217,0.387791
GemmTunableOp_Half_TN,tn_4096_1905_7168,Gemm_Hipblaslt_TN_9645,0.207615
GemmTunableOp_Half_TN,tn_4096_3571_7168,Gemm_Hipblaslt_TN_9743,0.340239
GemmTunableOp_Half_TN,tn_14336_935_4096,Gemm_Hipblaslt_TN_9677,0.185468
GemmTunableOp_Half_TN,tn_14336_1931_4096,Gemm_Hipblaslt_TN_9223,0.393993
GemmTunableOp_Half_TN,tn_4096_851_2048,Gemm_Hipblaslt_TN_9352,0.0346121
GemmTunableOp_Half_TN,tn_3072_1886_4096,Gemm_Hipblaslt_TN_9324,0.0924784
GemmTunableOp_Half_TN,tn_4096_801_7168,Gemm_Hipblaslt_TN_9147,0.108053
GemmTunableOp_Half_TN,tn_4096_1759_7168,Gemm_Hipblaslt_TN_9673,0.197339
GemmTunableOp_Half_TN,tn_3072_2721_4096,Gemm_Hipblaslt_TN_9624,0.127395
GemmTunableOp_Half_TN,tn_14336_930_4096,Gemm_Hipblaslt_TN_9697,0.185804
GemmTunableOp_Half_TN,tn_3072_1697_4096,Gemm_Hipblaslt_TN_9561,0.0886899
GemmTunableOp_Half_TN,tn_4096_891_2048,Gemm_Hipblaslt_TN_9252,0.0366206
GemmTunableOp_Half_TN,tn_4096_926_2048,Gemm_Hipblaslt_TN_9355,0.0377264
GemmTunableOp_Half_TN,tn_4096_192_2048,Gemm_Rocblas_621286447,0.0128813
GemmTunableOp_Half_TN,tn_14336_2572_4096,Gemm_Hipblaslt_TN_9793,0.533028
GemmTunableOp_Half_TN,tn_3072_2592_4096,Gemm_Hipblaslt_TN_9645,0.122994
GemmTunableOp_Half_TN,tn_4096_7809_2048,Gemm_Hipblaslt_TN_9713,0.226591
GemmTunableOp_Half_TN,tn_3072_914_4096,Gemm_Hipblaslt_TN_9131,0.0564962
GemmTunableOp_Half_TN,tn_14336_8054_4096,Gemm_Hipblaslt_TN_9930,1.52881
GemmTunableOp_Half_TN,tn_3072_800_4096,Gemm_Hipblaslt_TN_9368,0.0512656
GemmTunableOp_Half_TN,tn_14336_3310_4096,Gemm_Hipblaslt_TN_9223,0.631533
GemmTunableOp_Half_TN,tn_3072_1867_4096,Gemm_Hipblaslt_TN_9613,0.0937312
GemmTunableOp_Half_TN,tn_4096_1829_2048,Gemm_Hipblaslt_TN_9590,0.0636938
GemmTunableOp_Half_TN,tn_4096_2732_7168,Gemm_Hipblaslt_TN_9690,0.278755
GemmTunableOp_Half_TN,tn_3072_2560_4096,Gemm_Hipblaslt_TN_9624,0.119362
GemmTunableOp_Half_TN,tn_4096_136_7168,Gemm_Hipblaslt_TN_9472,0.0358777
GemmTunableOp_Half_TN,tn_4096_1886_7168,Gemm_Hipblaslt_TN_9645,0.207616
GemmTunableOp_Half_TN,tn_3072_1792_4096,Gemm_Rocblas_621286778,0.0898983
GemmTunableOp_Half_TN,tn_14336_8_4096,Gemm_Rocblas_621286317,0.0234692
GemmTunableOp_Half_TN,tn_14336_882_4096,Gemm_Hipblaslt_TN_9697,0.183236
GemmTunableOp_Half_TN,tn_4096_971_7168,Gemm_Hipblaslt_TN_9160,0.12242
GemmTunableOp_Half_TN,tn_14336_866_4096,Gemm_Hipblaslt_TN_9677,0.182223
GemmTunableOp_Half_TN,tn_4096_809_7168,Gemm_Hipblaslt_TN_9147,0.109128
GemmTunableOp_Half_TN,tn_4096_2788_2048,Gemm_Hipblaslt_TN_9799,0.0875003
GemmTunableOp_Half_TN,tn_4096_1913_7168,Gemm_Hipblaslt_TN_9645,0.208411
GemmTunableOp_Half_TN,tn_4096_3671_7168,Gemm_Hipblaslt_TN_9220,0.359123
GemmTunableOp_Half_TN,tn_14336_1829_4096,Gemm_Hipblaslt_TN_9697,0.368788
GemmTunableOp_Half_TN,tn_14336_1817_4096,Gemm_Hipblaslt_TN_9697,0.370167
GemmTunableOp_Half_TN,tn_4096_1672_7168,Gemm_Hipblaslt_TN_9359,0.182729
GemmTunableOp_Half_TN,tn_4096_956_7168,Gemm_Hipblaslt_TN_9576,0.11924
GemmTunableOp_Half_TN,tn_3072_2872_4096,Gemm_Hipblaslt_TN_9624,0.128764
GemmTunableOp_Half_TN,tn_4096_894_7168,Gemm_Hipblaslt_TN_9170,0.117583
GemmTunableOp_Half_TN,tn_14336_821_4096,Gemm_Hipblaslt_TN_9697,0.177355
GemmTunableOp_Half_TN,tn_3072_978_4096,Gemm_Hipblaslt_TN_9317,0.060774
GemmTunableOp_Half_TN,tn_3072_936_4096,Gemm_Hipblaslt_TN_9158,0.0577959
GemmTunableOp_Half_TN,tn_3072_1762_4096,Gemm_Rocblas_621286778,0.0915215
GemmTunableOp_Half_TN,tn_4096_794_2048,Gemm_Hipblaslt_TN_9131,0.0340947
GemmTunableOp_Half_TN,tn_4096_889_2048,Gemm_Hipblaslt_TN_9577,0.0372779
GemmTunableOp_Half_TN,tn_4096_2630_2048,Gemm_Hipblaslt_TN_9687,0.0835688
GemmTunableOp_Half_TN,tn_14336_1744_4096,Gemm_Hipblaslt_TN_9793,0.36284
GemmTunableOp_Half_TN,tn_4096_1730_7168,Gemm_Hipblaslt_TN_9673,0.195646
GemmTunableOp_Half_TN,tn_4096_1730_2048,Gemm_Hipblaslt_TN_9680,0.0612956
GemmTunableOp_Half_TN,tn_14336_2788_4096,Gemm_Hipblaslt_TN_9697,0.558277
GemmTunableOp_Half_TN,tn_4096_2719_7168,Gemm_Hipblaslt_TN_9672,0.274958
GemmTunableOp_Half_TN,tn_4096_1768_7168,Gemm_Hipblaslt_TN_9645,0.200417
GemmTunableOp_Half_TN,tn_4096_936_7168,Gemm_Hipblaslt_TN_9576,0.118308
GemmTunableOp_Half_TN,tn_14336_3352_4096,Gemm_Hipblaslt_TN_9223,0.626492
GemmTunableOp_Half_TN,tn_4096_248_2048,Gemm_Rocblas_621286447,0.0146031
GemmTunableOp_Half_TN,tn_14336_3752_4096,Gemm_Hipblaslt_TN_9677,0.742387
GemmTunableOp_Half_TN,tn_4096_152_7168,Gemm_Hipblaslt_TN_9298,0.0367988
GemmTunableOp_Half_TN,tn_4096_803_7168,Gemm_Hipblaslt_TN_9147,0.108405
GemmTunableOp_Half_TN,tn_4096_947_7168,Gemm_Hipblaslt_TN_9604,0.11876
GemmTunableOp_Half_TN,tn_4096_984_2048,Gemm_Hipblaslt_TN_9585,0.0384516
GemmTunableOp_Half_TN,tn_4096_3507_7168,Gemm_Hipblaslt_TN_9187,0.336928
GemmTunableOp_Half_TN,tn_14336_1791_4096,Gemm_Hipblaslt_TN_9793,0.36613
GemmTunableOp_Half_TN,tn_3072_7817_4096,Gemm_Hipblaslt_TN_9805,0.337478
GemmTunableOp_Half_TN,tn_4096_1864_2048,Gemm_Hipblaslt_TN_9590,0.0644488
GemmTunableOp_Half_TN,tn_4096_804_7168,Gemm_Hipblaslt_TN_9634,0.109309
GemmTunableOp_Half_TN,tn_14336_176_4096,Gemm_Hipblaslt_TN_9352,0.0587733
GemmTunableOp_Half_TN,tn_14336_1785_4096,Gemm_Hipblaslt_TN_9793,0.366202
GemmTunableOp_Half_TN,tn_4096_4471_2048,Gemm_Hipblaslt_TN_9763,0.140449
GemmTunableOp_Half_TN,tn_14336_56_4096,Gemm_Rocblas_621286498,0.0297165
GemmTunableOp_Half_TN,tn_4096_2606_2048,Gemm_Hipblaslt_TN_9687,0.083943
GemmTunableOp_Half_TN,tn_4096_16_7168,Gemm_Rocblas_621294135,0.0130976
GemmTunableOp_Half_TN,tn_64128_188_4096,Gemm_Hipblaslt_TN_9855,0.255426
GemmTunableOp_Half_TN,tn_14336_8110_4096,Gemm_Hipblaslt_TN_9888,1.54596
GemmTunableOp_Half_TN,tn_3072_817_4096,Gemm_Hipblaslt_TN_9047,0.052445
GemmTunableOp_Half_TN,tn_4096_224_7168,Gemm_Rocblas_621286491,0.0424693
GemmTunableOp_Half_TN,tn_3072_208_4096,Gemm_Rocblas_621286440,0.0220282
GemmTunableOp_Half_TN,tn_14336_1795_4096,Gemm_Hipblaslt_TN_9139,0.368702
GemmTunableOp_Half_TN,tn_4096_7804_2048,Gemm_Hipblaslt_TN_9753,0.224944
GemmTunableOp_Half_TN,tn_4096_2703_7168,Gemm_Hipblaslt_TN_9799,0.271992
GemmTunableOp_Half_TN,tn_4096_8192_2048,Gemm_Rocblas_621294030,0.233009
GemmTunableOp_Half_TN,tn_4096_2675_7168,Gemm_Hipblaslt_TN_9799,0.270786
GemmTunableOp_Half_TN,tn_4096_4471_7168,Gemm_Hipblaslt_TN_9763,0.460639
GemmTunableOp_Half_TN,tn_4096_959_2048,Gemm_Hipblaslt_TN_9604,0.037649
GemmTunableOp_Half_TN,tn_14336_840_4096,Gemm_Hipblaslt_TN_9677,0.17786
GemmTunableOp_Half_TN,tn_4096_880_7168,Gemm_Hipblaslt_TN_9604,0.116459
GemmTunableOp_Half_TN,tn_3072_1805_4096,Gemm_Rocblas_621294520,0.0914828
GemmTunableOp_Half_TN,tn_64128_247_4096,Gemm_Hipblaslt_TN_9122,0.294483
GemmTunableOp_Half_TN,tn_4096_869_7168,Gemm_Hipblaslt_TN_9604,0.115851
GemmTunableOp_Half_TN,tn_4096_3571_2048,Gemm_Hipblaslt_TN_9684,0.104019
GemmTunableOp_Half_TN,tn_14336_804_4096,Gemm_Hipblaslt_TN_9187,0.176889
GemmTunableOp_Half_TN,tn_4096_868_2048,Gemm_Hipblaslt_TN_9577,0.0358887
GemmTunableOp_Half_TN,tn_3072_176_4096,Gemm_Rocblas_621286436,0.0184036
GemmTunableOp_Half_TN,tn_14336_921_4096,Gemm_Hipblaslt_TN_9697,0.18371
GemmTunableOp_Half_TN,tn_14336_1729_4096,Gemm_Hipblaslt_TN_9697,0.360809
GemmTunableOp_Half_TN,tn_14336_887_4096,Gemm_Hipblaslt_TN_9187,0.182543
GemmTunableOp_Half_TN,tn_4096_885_7168,Gemm_Hipblaslt_TN_9547,0.116564
GemmTunableOp_Half_TN,tn_14336_3431_4096,Gemm_Rocblas_621286590,0.651478
GemmTunableOp_Half_TN,tn_4096_2826_7168,Gemm_Hipblaslt_TN_9799,0.281988
GemmTunableOp_Half_TN,tn_3072_985_4096,Gemm_Hipblaslt_TN_9317,0.0606232
GemmTunableOp_Half_TN,tn_4096_2826_2048,Gemm_Hipblaslt_TN_9799,0.0870883
GemmTunableOp_Half_TN,tn_14336_2601_4096,Gemm_Hipblaslt_TN_9793,0.535059
GemmTunableOp_Half_TN,tn_4096_208_2048,Gemm_Rocblas_621286440,0.0143154
GemmTunableOp_Half_TN,tn_3072_839_4096,Gemm_Hipblaslt_TN_9048,0.0524585
GemmTunableOp_Half_TN,tn_4096_32_7168,Gemm_Rocblas_621294044,0.0152922
GemmTunableOp_Half_TN,tn_4096_2721_2048,Gemm_Hipblaslt_TN_9799,0.0860149
GemmTunableOp_Half_TN,tn_3072_2509_4096,Gemm_Hipblaslt_TN_9134,0.120993
GemmTunableOp_Half_TN,tn_14336_1739_4096,Gemm_Hipblaslt_TN_9793,0.363003
GemmTunableOp_Half_TN,tn_3072_2732_4096,Gemm_Hipblaslt_TN_9567,0.128401
GemmTunableOp_Half_TN,tn_4096_795_2048,Gemm_Hipblaslt_TN_9634,0.0335239
GemmTunableOp_Half_TN,tn_64128_96_4096,Gemm_Hipblaslt_TN_9057,0.180219
GemmTunableOp_Half_TN,tn_3072_3479_4096,Gemm_Hipblaslt_TN_9570,0.155786
GemmTunableOp_Half_TN,tn_4096_918_2048,Gemm_Hipblaslt_TN_9577,0.0379672
GemmTunableOp_Half_TN,tn_3072_968_4096,Gemm_Hipblaslt_TN_9158,0.059391
GemmTunableOp_Half_TN,tn_4096_3599_7168,Gemm_Hipblaslt_TN_9694,0.34341
GemmTunableOp_Half_TN,tn_14336_2717_4096,Gemm_Hipblaslt_TN_9677,0.546568
GemmTunableOp_Half_TN,tn_4096_848_7168,Gemm_Hipblaslt_TN_9099,0.110808
GemmTunableOp_Half_TN,tn_4096_2635_2048,Gemm_Hipblaslt_TN_9672,0.0840469
GemmTunableOp_Half_TN,tn_4096_1828_7168,Gemm_Hipblaslt_TN_9268,0.204668
GemmTunableOp_Half_TN,tn_64128_20_4096,Gemm_Rocblas_621286348,0.144044
GemmTunableOp_Half_TN,tn_3072_2764_4096,Gemm_Hipblaslt_TN_9624,0.127933
GemmTunableOp_Half_TN,tn_4096_1697_2048,Gemm_Hipblaslt_TN_9164,0.0577289
GemmTunableOp_Half_TN,tn_3072_2762_4096,Gemm_Hipblaslt_TN_9624,0.127712
GemmTunableOp_Half_TN,tn_3072_3569_4096,Gemm_Hipblaslt_TN_9619,0.157274
GemmTunableOp_Half_TN,tn_3072_7804_4096,Gemm_Hipblaslt_TN_9800,0.338591
GemmTunableOp_Half_TN,tn_3072_889_4096,Gemm_Hipblaslt_TN_9131,0.0581571
GemmTunableOp_Half_TN,tn_14336_808_4096,Gemm_Hipblaslt_TN_9697,0.177604
GemmTunableOp_Half_TN,tn_4096_224_2048,Gemm_Rocblas_621286442,0.0147554
GemmTunableOp_Half_TN,tn_4096_843_2048,Gemm_Hipblaslt_TN_9354,0.0351308
GemmTunableOp_Half_TN,tn_14336_1883_4096,Gemm_Hipblaslt_TN_9677,0.371402
GemmTunableOp_Half_TN,tn_4096_1795_7168,Gemm_Hipblaslt_TN_9268,0.201229
GemmTunableOp_Half_TN,tn_4096_968_7168,Gemm_Hipblaslt_TN_9547,0.121055
GemmTunableOp_Half_TN,tn_4096_2509_2048,Gemm_Hipblaslt_TN_9672,0.0810683
GemmTunableOp_Half_TN,tn_3072_845_4096,Gemm_Hipblaslt_TN_9047,0.0539047
GemmTunableOp_Half_TN,tn_4096_881_2048,Gemm_Hipblaslt_TN_9578,0.0370389
GemmTunableOp_Half_TN,tn_3072_1723_4096,Gemm_Hipblaslt_TN_9148,0.0889509
GemmTunableOp_Half_TN,tn_14336_2630_4096,Gemm_Hipblaslt_TN_9793,0.530856
GemmTunableOp_Half_TN,tn_4096_8_7168,Gemm_Rocblas_621294135,0.0127748
GemmTunableOp_Half_TN,tn_4096_3479_2048,Gemm_Hipblaslt_TN_9683,0.101308
GemmTunableOp_Half_TN,tn_4096_859_7168,Gemm_Hipblaslt_TN_9099,0.11347
GemmTunableOp_Half_TN,tn_14336_844_4096,Gemm_Hipblaslt_TN_9677,0.179634
GemmTunableOp_Half_TN,tn_3072_1813_4096,Gemm_Hipblaslt_TN_9613,0.092975
GemmTunableOp_Half_TN,tn_4096_2699_7168,Gemm_Hipblaslt_TN_9674,0.273024
GemmTunableOp_Half_TN,tn_4096_986_7168,Gemm_Hipblaslt_TN_9170,0.120513
GemmTunableOp_Half_TN,tn_4096_3546_7168,Gemm_Hipblaslt_TN_9697,0.337927
GemmTunableOp_Half_TN,tn_4096_8069_2048,Gemm_Hipblaslt_TN_9815,0.230189
GemmTunableOp_Half_TN,tn_3072_1742_4096,Gemm_Hipblaslt_TN_9148,0.0893999
GemmTunableOp_Half_TN,tn_4096_1757_7168,Gemm_Hipblaslt_TN_9673,0.196897
GemmTunableOp_Half_TN,tn_3072_8000_4096,Gemm_Hipblaslt_TN_9800,0.340514
GemmTunableOp_Half_TN,tn_3072_1746_4096,Gemm_Hipblaslt_TN_9148,0.0906712
GemmTunableOp_Half_TN,tn_14336_2670_4096,Gemm_Hipblaslt_TN_9677,0.537832
GemmTunableOp_Half_TN,tn_64128_25_4096,Gemm_Rocblas_621286348,0.145773
GemmTunableOp_Half_TN,tn_4096_2717_2048,Gemm_Hipblaslt_TN_9672,0.0843099
GemmTunableOp_Half_TN,tn_4096_1727_2048,Gemm_Hipblaslt_TN_9588,0.0585579
GemmTunableOp_Half_TN,tn_14336_248_4096,Gemm_Hipblaslt_TN_9634,0.0685088
GemmTunableOp_Half_TN,tn_4096_850_2048,Gemm_Hipblaslt_TN_9576,0.0357968
GemmTunableOp_Half_TN,tn_14336_977_4096,Gemm_Hipblaslt_TN_9220,0.203303
GemmTunableOp_Half_TN,tn_64128_63_4096,Gemm_Hipblaslt_TN_9097,0.165152
GemmTunableOp_Half_TN,tn_4096_1822_7168,Gemm_Hipblaslt_TN_9268,0.202653
GemmTunableOp_Half_TN,tn_14336_876_4096,Gemm_Hipblaslt_TN_9139,0.181632
GemmTunableOp_Half_TN,tn_3072_903_4096,Gemm_Hipblaslt_TN_9546,0.0573475
GemmTunableOp_Half_TN,tn_4096_1794_2048,Gemm_Hipblaslt_TN_9136,0.0616718
GemmTunableOp_Half_TN,tn_3072_1673_4096,Gemm_Hipblaslt_TN_9561,0.0881295
GemmTunableOp_Half_TN,tn_4096_4000_2048,Gemm_Rocblas_621286281,0.115416
GemmTunableOp_Half_TN,tn_3072_880_4096,Gemm_Hipblaslt_TN_9251,0.0583445
GemmTunableOp_Half_TN,tn_4096_104_7168,Gemm_Rocblas_621294164,0.0272505
GemmTunableOp_Half_TN,tn_14336_785_4096,Gemm_Hipblaslt_TN_9691,0.162184
GemmTunableOp_Half_TN,tn_14336_927_4096,Gemm_Hipblaslt_TN_9187,0.185145
GemmTunableOp_Half_TN,tn_3072_40_4096,Gemm_Rocblas_621294148,0.0105999
GemmTunableOp_Half_TN,tn_64128_140_4096,Gemm_Hipblaslt_TN_9674,0.220451
GemmTunableOp_Half_TN,tn_3072_2788_4096,Gemm_Hipblaslt_TN_9624,0.127823
GemmTunableOp_Half_TN,tn_4096_886_2048,Gemm_Hipblaslt_TN_9576,0.0368127
GemmTunableOp_Half_TN,tn_3072_1803_4096,Gemm_Rocblas_621286778,0.0898958
GemmTunableOp_Half_TN,tn_4096_906_7168,Gemm_Hipblaslt_TN_9634,0.116759
GemmTunableOp_Half_TN,tn_4096_1831_7168,Gemm_Hipblaslt_TN_9268,0.202336
GemmTunableOp_Half_TN,tn_4096_811_2048,Gemm_Hipblaslt_TN_9604,0.0342624
GemmTunableOp_Half_TN,tn_3072_887_4096,Gemm_Hipblaslt_TN_9352,0.0572206
GemmTunableOp_Half_TN,tn_3072_4471_4096,Gemm_Hipblaslt_TN_9939,0.189072
GemmTunableOp_Half_TN,tn_4096_1846_2048,Gemm_Hipblaslt_TN_9590,0.0629426
GemmTunableOp_Half_TN,tn_14336_2544_4096,Gemm_Rocblas_621286684,0.502892
GemmTunableOp_Half_TN,tn_3072_8049_4096,Gemm_Rocblas_621294473,0.342305
GemmTunableOp_Half_TN,tn_4096_48_2048,Gemm_Rocblas_621294155,0.00796356
GemmTunableOp_Half_TN,tn_4096_801_2048,Gemm_Hipblaslt_TN_9634,0.0337976
GemmTunableOp_Half_TN,tn_14336_813_4096,Gemm_Hipblaslt_TN_9189,0.177543
GemmTunableOp_Half_TN,tn_4096_840_2048,Gemm_Hipblaslt_TN_9352,0.0339764
GemmTunableOp_Half_TN,tn_3072_921_4096,Gemm_Hipblaslt_TN_9131,0.0570296
GemmTunableOp_Half_TN,tn_64128_24_4096,Gemm_Rocblas_621286348,0.14569
GemmTunableOp_Half_TN,tn_3072_1846_4096,Gemm_Hipblaslt_TN_9613,0.0931325
GemmTunableOp_Half_TN,tn_64128_225_4096,Gemm_Rocblas_621294658,0.282325
GemmTunableOp_Half_TN,tn_3072_1848_4096,Gemm_Hipblaslt_TN_9564,0.0929562
GemmTunableOp_Half_TN,tn_4096_847_7168,Gemm_Hipblaslt_TN_9352,0.112396
GemmTunableOp_Half_TN,tn_64128_81_4096,Gemm_Hipblaslt_TN_9057,0.180135
GemmTunableOp_Half_TN,tn_4096_785_7168,Gemm_Hipblaslt_TN_9158,0.106859
GemmTunableOp_Half_TN,tn_4096_1666_7168,Gemm_Hipblaslt_TN_9164,0.181602
GemmTunableOp_Half_TN,tn_64128_203_4096,Gemm_Hipblaslt_TN_9654,0.268769
GemmTunableOp_Half_TN,tn_4096_851_7168,Gemm_Hipblaslt_TN_9099,0.11142
GemmTunableOp_Half_TN,tn_64128_65_4096,Gemm_Hipblaslt_TN_9057,0.176081
GemmTunableOp_Half_TN,tn_3072_875_4096,Gemm_Hipblaslt_TN_9546,0.056887
GemmTunableOp_Half_TN,tn_64128_148_4096,Gemm_Hipblaslt_TN_9108,0.220937
GemmTunableOp_Half_TN,tn_64128_122_4096,Gemm_Rocblas_621294105,0.205034
GemmTunableOp_Half_TN,tn_4096_2537_2048,Gemm_Hipblaslt_TN_9687,0.0812742
GemmTunableOp_Half_TN,tn_4096_7857_7168,Gemm_Hipblaslt_TN_9914,0.738419
GemmTunableOp_Half_TN,tn_14336_845_4096,Gemm_Hipblaslt_TN_9187,0.179919
GemmTunableOp_Half_TN,tn_3072_8054_4096,Gemm_Rocblas_621294467,0.341126
GemmTunableOp_Half_TN,tn_3072_990_4096,Gemm_Hipblaslt_TN_9158,0.0598221
GemmTunableOp_Half_TN,tn_3072_1864_4096,Gemm_Hipblaslt_TN_9613,0.0935754
GemmTunableOp_Half_TN,tn_4096_870_7168,Gemm_Hipblaslt_TN_9547,0.115258
GemmTunableOp_Half_TN,tn_4096_1733_2048,Gemm_Hipblaslt_TN_9136,0.0617335
GemmTunableOp_Half_TN,tn_14336_978_4096,Gemm_Hipblaslt_TN_9217,0.201437
GemmTunableOp_Half_TN,tn_64128_103_4096,Gemm_Rocblas_621286644,0.196498
GemmTunableOp_Half_TN,tn_4096_2699_2048,Gemm_Hipblaslt_TN_9687,0.0858148
GemmTunableOp_Half_TN,tn_3072_1794_4096,Gemm_Rocblas_621294520,0.0918217
GemmTunableOp_Half_TN,tn_14336_1853_4096,Gemm_Hipblaslt_TN_9697,0.369869
GemmTunableOp_Half_TN,tn_14336_3546_4096,Gemm_Hipblaslt_TN_9220,0.658232
GemmTunableOp_Half_TN,tn_3072_184_4096,Gemm_Rocblas_621294164,0.0183162
GemmTunableOp_Half_TN,tn_4096_1905_2048,Gemm_Hipblaslt_TN_9645,0.0665307
GemmTunableOp_Half_TN,tn_3072_1834_4096,Gemm_Hipblaslt_TN_9613,0.093646
GemmTunableOp_Half_TN,tn_3072_1600_4096,Gemm_Hipblaslt_TN_9561,0.0852594
GemmTunableOp_Half_TN,tn_14336_949_4096,Gemm_Hipblaslt_TN_9697,0.185966
GemmTunableOp_Half_TN,tn_14336_1715_4096,Gemm_Hipblaslt_TN_9697,0.35403
GemmTunableOp_Half_TN,tn_64128_221_4096,Gemm_Hipblaslt_TN_9654,0.272355
GemmTunableOp_Half_TN,tn_4096_3447_7168,Gemm_Hipblaslt_TN_9682,0.329826
GemmTunableOp_Half_TN,tn_14336_112_4096,Gemm_Rocblas_621294233,0.0408599
GemmTunableOp_Half_TN,tn_4096_2537_7168,Gemm_Hipblaslt_TN_9709,0.262864
GemmTunableOp_Half_TN,tn_64128_239_4096,Gemm_Rocblas_621294658,0.288887
GemmTunableOp_Half_TN,tn_14336_966_4096,Gemm_Hipblaslt_TN_9217,0.201436
GemmTunableOp_Half_TN,tn_4096_1600_7168,Gemm_Hipblaslt_TN_9265,0.180238
GemmTunableOp_Half_TN,tn_14336_905_4096,Gemm_Hipblaslt_TN_9139,0.18161
GemmTunableOp_Half_TN,tn_4096_853_7168,Gemm_Hipblaslt_TN_9099,0.110698
GemmTunableOp_Half_TN,tn_4096_797_2048,Gemm_Hipblaslt_TN_9634,0.0338644
GemmTunableOp_Half_TN,tn_64128_49_4096,Gemm_Hipblaslt_TN_9097,0.161017
GemmTunableOp_Half_TN,tn_14336_820_4096,Gemm_Hipblaslt_TN_9139,0.178429
GemmTunableOp_Half_TN,tn_3072_5606_4096,Gemm_Hipblaslt_TN_9624,0.252311
GemmTunableOp_Half_TN,tn_4096_888_2048,Gemm_Hipblaslt_TN_9577,0.0369156
GemmTunableOp_Half_TN,tn_4096_168_2048,Gemm_Rocblas_621286445,0.0131202
GemmTunableOp_Half_TN,tn_14336_7787_4096,Gemm_Hipblaslt_TN_9753,1.49794
GemmTunableOp_Half_TN,tn_4096_216_7168,Gemm_Rocblas_621294171,0.0431103
GemmTunableOp_Half_TN,tn_4096_923_7168,Gemm_Hipblaslt_TN_9634,0.118042
GemmTunableOp_Half_TN,tn_14336_795_4096,Gemm_Hipblaslt_TN_9691,0.163164
GemmTunableOp_Half_TN,tn_14336_1835_4096,Gemm_Hipblaslt_TN_9189,0.369913
GemmTunableOp_Half_TN,tn_64128_18_4096,Gemm_Rocblas_621286348,0.144491
GemmTunableOp_Half_TN,tn_4096_3662_2048,Gemm_Hipblaslt_TN_9827,0.111465
GemmTunableOp_Half_TN,tn_64128_166_4096,Gemm_Hipblaslt_TN_9752,0.245219
GemmTunableOp_Half_TN,tn_4096_800_2048,Gemm_Hipblaslt_TN_9634,0.0340699
GemmTunableOp_Half_TN,tn_4096_2872_2048,Gemm_Hipblaslt_TN_9687,0.0882602
GemmTunableOp_Half_TN,tn_4096_1600_2048,Gemm_Hipblaslt_TN_9164,0.0557601
GemmTunableOp_Half_TN,tn_64128_40_4096,Gemm_Hipblaslt_TN_9097,0.158261
GemmTunableOp_Half_TN,tn_64128_168_4096,Gemm_Hipblaslt_TN_9752,0.246442
GemmTunableOp_Half_TN,tn_4096_1792_7168,Gemm_Hipblaslt_TN_9267,0.19961
GemmTunableOp_Half_TN,tn_4096_2805_7168,Gemm_Hipblaslt_TN_9799,0.281298
GemmTunableOp_Half_TN,tn_4096_72_2048,Gemm_Rocblas_621294029,0.00908744
GemmTunableOp_Half_TN,tn_14336_1827_4096,Gemm_Hipblaslt_TN_9677,0.367651
GemmTunableOp_Half_TN,tn_4096_2670_2048,Gemm_Hipblaslt_TN_9799,0.0851991
GemmTunableOp_Half_TN,tn_3072_951_4096,Gemm_Hipblaslt_TN_9352,0.0585675
GemmTunableOp_Half_TN,tn_3072_835_4096,Gemm_Hipblaslt_TN_9047,0.0535249
GemmTunableOp_Half_TN,tn_14336_907_4096,Gemm_Hipblaslt_TN_9697,0.183886
GemmTunableOp_Half_TN,tn_14336_940_4096,Gemm_Hipblaslt_TN_9677,0.185387
GemmTunableOp_Half_TN,tn_4096_3752_2048,Gemm_Hipblaslt_TN_9768,0.110313
GemmTunableOp_Half_TN,tn_3072_904_4096,Gemm_Hipblaslt_TN_9131,0.0572146
GemmTunableOp_Half_TN,tn_64128_194_4096,Gemm_Hipblaslt_TN_9260,0.274451
GemmTunableOp_Half_TN,tn_3072_885_4096,Gemm_Hipblaslt_TN_9352,0.056995
GemmTunableOp_Half_TN,tn_14336_925_4096,Gemm_Hipblaslt_TN_9677,0.184296
GemmTunableOp_Half_TN,tn_14336_894_4096,Gemm_Hipblaslt_TN_9187,0.180105
GemmTunableOp_Half_TN,tn_3072_924_4096,Gemm_Hipblaslt_TN_9147,0.0598436
GemmTunableOp_Half_TN,tn_4096_901_7168,Gemm_Hipblaslt_TN_9634,0.117991
GemmTunableOp_Half_TN,tn_4096_7787_7168,Gemm_Hipblaslt_TN_9903,0.732338
GemmTunableOp_Half_TN,tn_4096_919_2048,Gemm_Hipblaslt_TN_9577,0.0370214
GemmTunableOp_Half_TN,tn_4096_835_2048,Gemm_Hipblaslt_TN_9131,0.0345538
GemmTunableOp_Half_TN,tn_3072_72_4096,Gemm_Rocblas_621286449,0.0133781
GemmTunableOp_Half_TN,tn_4096_2606_7168,Gemm_Hipblaslt_TN_9657,0.26762
GemmTunableOp_Half_TN,tn_4096_2651_2048,Gemm_Hipblaslt_TN_9709,0.0845989
GemmTunableOp_Half_TN,tn_4096_934_7168,Gemm_Hipblaslt_TN_9634,0.117361
GemmTunableOp_Half_TN,tn_14336_848_4096,Gemm_Hipblaslt_TN_9139,0.179188
GemmTunableOp_Half_TN,tn_14336_7817_4096,Gemm_Hipblaslt_TN_9914,1.49798
GemmTunableOp_Half_TN,tn_3072_813_4096,Gemm_Hipblaslt_TN_9047,0.0519697
GemmTunableOp_Half_TN,tn_4096_2763_2048,Gemm_Hipblaslt_TN_9799,0.0867402
GemmTunableOp_Half_TN,tn_4096_882_7168,Gemm_Hipblaslt_TN_9574,0.116592
GemmTunableOp_Half_TN,tn_4096_954_7168,Gemm_Hipblaslt_TN_9170,0.119395
GemmTunableOp_Half_TN,tn_4096_1697_7168,Gemm_Hipblaslt_TN_9679,0.184461
GemmTunableOp_Half_TN,tn_4096_1649_7168,Gemm_Hipblaslt_TN_9265,0.18193
GemmTunableOp_Half_TN,tn_64128_32_4096,Gemm_Rocblas_621286348,0.141115
GemmTunableOp_Half_TN,tn_3072_881_4096,Gemm_Hipblaslt_TN_9147,0.0562084
GemmTunableOp_Half_TN,tn_64128_254_4096,Gemm_Rocblas_621294658,0.296915
GemmTunableOp_Half_TN,tn_4096_854_2048,Gemm_Hipblaslt_TN_9354,0.0346948
GemmTunableOp_Half_TN,tn_4096_1778_2048,Gemm_Hipblaslt_TN_9136,0.0620295
GemmTunableOp_Half_TN,tn_14336_891_4096,Gemm_Hipblaslt_TN_9677,0.182474
GemmTunableOp_Half_TN,tn_64128_139_4096,Gemm_Hipblaslt_TN_9108,0.220649
GemmTunableOp_Half_TN,tn_4096_8049_7168,Gemm_Hipblaslt_TN_9959,0.743538
GemmTunableOp_Half_TN,tn_4096_954_2048,Gemm_Hipblaslt_TN_9577,0.0388073
GemmTunableOp_Half_TN,tn_4096_849_7168,Gemm_Hipblaslt_TN_9099,0.113679
GemmTunableOp_Half_TN,tn_4096_3569_2048,Gemm_Hipblaslt_TN_9896,0.103441
GemmTunableOp_Half_TN,tn_3072_7436_4096,Gemm_Hipblaslt_TN_9672,0.329354
GemmTunableOp_Half_TN,tn_3072_942_4096,Gemm_Hipblaslt_TN_9158,0.058917
GemmTunableOp_Half_TN,tn_64128_119_4096,Gemm_Hipblaslt_TN_9061,0.204848
GemmTunableOp_Half_TN,tn_4096_7953_7168,Gemm_Hipblaslt_TN_9655,0.741563
GemmTunableOp_Half_TN,tn_64128_182_4096,Gemm_Hipblaslt_TN_9817,0.249069
GemmTunableOp_Half_TN,tn_4096_1850_2048,Gemm_Hipblaslt_TN_9590,0.0645152
GemmTunableOp_Half_TN,tn_4096_2636_2048,Gemm_Hipblaslt_TN_9709,0.0844655
GemmTunableOp_Half_TN,tn_4096_2786_2048,Gemm_Hipblaslt_TN_9799,0.085856
GemmTunableOp_Half_TN,tn_4096_1756_2048,Gemm_Hipblaslt_TN_9329,0.06209
GemmTunableOp_Half_TN,tn_4096_2681_2048,Gemm_Hipblaslt_TN_9672,0.0845961
GemmTunableOp_Half_TN,tn_3072_844_4096,Gemm_Hipblaslt_TN_9368,0.0519854
GemmTunableOp_Half_TN,tn_4096_990_7168,Gemm_Hipblaslt_TN_9101,0.122596
GemmTunableOp_Half_TN,tn_14336_3671_4096,Gemm_Hipblaslt_TN_9697,0.737863
GemmTunableOp_Half_TN,tn_4096_868_7168,Gemm_Hipblaslt_TN_9634,0.11387
GemmTunableOp_Half_TN,tn_4096_3565_2048,Gemm_Hipblaslt_TN_9683,0.101966
GemmTunableOp_Half_TN,tn_4096_913_2048,Gemm_Hipblaslt_TN_9577,0.0365522
GemmTunableOp_Half_TN,tn_14336_855_4096,Gemm_Hipblaslt_TN_9697,0.181457
GemmTunableOp_Half_TN,tn_4096_2602_2048,Gemm_Hipblaslt_TN_9689,0.0844114
GemmTunableOp_Half_TN,tn_14336_2651_4096,Gemm_Hipblaslt_TN_9793,0.535714
GemmTunableOp_Half_TN,tn_14336_1850_4096,Gemm_Hipblaslt_TN_9139,0.369279
GemmTunableOp_Half_TN,tn_4096_785_2048,Gemm_Hipblaslt_TN_9354,0.0331558
GemmTunableOp_Half_TN,tn_4096_899_2048,Gemm_Hipblaslt_TN_9576,0.0366676
GemmTunableOp_Half_TN,tn_4096_811_7168,Gemm_Hipblaslt_TN_9158,0.108809
GemmTunableOp_Half_TN,tn_3072_1931_4096,Gemm_Hipblaslt_TN_9633,0.0982597
GemmTunableOp_Half_TN,tn_4096_56_7168,Gemm_Rocblas_621286332,0.019419
GemmTunableOp_Half_TN,tn_3072_1880_4096,Gemm_Hipblaslt_TN_9561,0.090563
GemmTunableOp_Half_TN,tn_14336_888_4096,Gemm_Hipblaslt_TN_9187,0.182688
GemmTunableOp_Half_TN,tn_14336_803_4096,Gemm_Hipblaslt_TN_9192,0.176376
GemmTunableOp_Half_TN,tn_4096_966_2048,Gemm_Hipblaslt_TN_9589,0.0376274
GemmTunableOp_Half_TN,tn_4096_1748_7168,Gemm_Hipblaslt_TN_9673,0.194088
GemmTunableOp_Half_TN,tn_14336_923_4096,Gemm_Hipblaslt_TN_9697,0.184916
GemmTunableOp_Half_TN,tn_14336_890_4096,Gemm_Hipblaslt_TN_9187,0.18244
GemmTunableOp_Half_TN,tn_3072_2703_4096,Gemm_Hipblaslt_TN_9567,0.125507
GemmTunableOp_Half_TN,tn_64128_234_4096,Gemm_Hipblaslt_TN_9122,0.293201
GemmTunableOp_Half_TN,tn_4096_977_7168,Gemm_Hipblaslt_TN_9604,0.122706
GemmTunableOp_Half_TN,tn_3072_802_4096,Gemm_Hipblaslt_TN_9047,0.0515808
GemmTunableOp_Half_TN,tn_3072_836_4096,Gemm_Hipblaslt_TN_9047,0.0527043
GemmTunableOp_Half_TN,tn_3072_3431_4096,Gemm_Hipblaslt_TN_9681,0.152723
GemmTunableOp_Half_TN,tn_14336_942_4096,Gemm_Hipblaslt_TN_9697,0.185408
GemmTunableOp_Half_TN,tn_4096_879_7168,Gemm_Hipblaslt_TN_9170,0.11758
GemmTunableOp_Half_TN,tn_14336_1792_4096,Gemm_Hipblaslt_TN_9793,0.363713
GemmTunableOp_Half_TN,tn_14336_919_4096,Gemm_Hipblaslt_TN_9697,0.184678
GemmTunableOp_Half_TN,tn_14336_2773_4096,Gemm_Hipblaslt_TN_9187,0.55405
GemmTunableOp_Half_TN,tn_3072_934_4096,Gemm_Hipblaslt_TN_9546,0.0581037
GemmTunableOp_Half_TN,tn_4096_831_7168,Gemm_Hipblaslt_TN_9634,0.110876
GemmTunableOp_Half_TN,tn_4096_905_2048,Gemm_Hipblaslt_TN_9604,0.0375008
GemmTunableOp_Half_TN,tn_4096_1850_7168,Gemm_Hipblaslt_TN_9268,0.204247
GemmTunableOp_Half_TN,tn_4096_1867_7168,Gemm_Hipblaslt_TN_9645,0.20445
GemmTunableOp_Half_TN,tn_4096_2762_2048,Gemm_Hipblaslt_TN_9689,0.0875387
GemmTunableOp_Half_TN,tn_4096_1815_7168,Gemm_Hipblaslt_TN_9268,0.203599
GemmTunableOp_Half_TN,tn_4096_232_7168,Gemm_Hipblaslt_TN_9303,0.0425552
GemmTunableOp_Half_TN,tn_4096_1848_7168,Gemm_Hipblaslt_TN_9268,0.203996
GemmTunableOp_Half_TN,tn_64128_175_4096,Gemm_Hipblaslt_TN_9821,0.245295
GemmTunableOp_Half_TN,tn_3072_2571_4096,Gemm_Hipblaslt_TN_9329,0.12214
GemmTunableOp_Half_TN,tn_14336_1644_4096,Gemm_Hipblaslt_TN_9189,0.353277
GemmTunableOp_Half_TN,tn_14336_956_4096,Gemm_Hipblaslt_TN_9697,0.186136
GemmTunableOp_Half_TN,tn_4096_877_2048,Gemm_Hipblaslt_TN_9634,0.0369644
GemmTunableOp_Half_TN,tn_14336_836_4096,Gemm_Hipblaslt_TN_9187,0.180055
GemmTunableOp_Half_TN,tn_64128_219_4096,Gemm_Hipblaslt_TN_9271,0.279608
GemmTunableOp_Half_TN,tn_4096_964_2048,Gemm_Hipblaslt_TN_9589,0.0388419
GemmTunableOp_Half_TN,tn_4096_1897_2048,Gemm_Hipblaslt_TN_9590,0.0631388
GemmTunableOp_Half_TN,tn_64128_154_4096,Gemm_Hipblaslt_TN_9674,0.224167
GemmTunableOp_Half_TN,tn_4096_951_7168,Gemm_Hipblaslt_TN_9604,0.120148
GemmTunableOp_Half_TN,tn_14336_908_4096,Gemm_Hipblaslt_TN_9697,0.18391
GemmTunableOp_Half_TN,tn_4096_3430_7168,Gemm_Hipblaslt_TN_9697,0.332689
GemmTunableOp_Half_TN,tn_4096_907_7168,Gemm_Hipblaslt_TN_9576,0.117957
GemmTunableOp_Half_TN,tn_3072_1705_4096,Gemm_Hipblaslt_TN_9561,0.0890688
GemmTunableOp_Half_TN,tn_4096_2630_7168,Gemm_Hipblaslt_TN_9799,0.269462
GemmTunableOp_Half_TN,tn_4096_816_2048,Gemm_Hipblaslt_TN_9604,0.0343614
GemmTunableOp_Half_TN,tn_14336_1649_4096,Gemm_Hipblaslt_TN_9189,0.354307
GemmTunableOp_Half_TN,tn_4096_3599_2048,Gemm_Hipblaslt_TN_9896,0.103564
GemmTunableOp_Half_TN,tn_3072_794_4096,Gemm_Hipblaslt_TN_9047,0.0520214
GemmTunableOp_Half_TN,tn_3072_2773_4096,Gemm_Hipblaslt_TN_9624,0.12881
GemmTunableOp_Half_TN,tn_3072_983_4096,Gemm_Hipblaslt_TN_9158,0.0606255
GemmTunableOp_Half_TN,tn_4096_184_7168,Gemm_Hipblaslt_TN_9470,0.0391301
GemmTunableOp_Half_TN,tn_4096_3670_2048,Gemm_Hipblaslt_TN_9841,0.111358
GemmTunableOp_Half_TN,tn_4096_1700_7168,Gemm_Hipblaslt_TN_9265,0.183999
GemmTunableOp_Half_TN,tn_4096_796_7168,Gemm_Hipblaslt_TN_9147,0.106836
GemmTunableOp_Half_TN,tn_3072_866_4096,Gemm_Hipblaslt_TN_9352,0.0559623
GemmTunableOp_Half_TN,tn_14336_823_4096,Gemm_Hipblaslt_TN_9187,0.177408
GemmTunableOp_Half_TN,tn_14336_2764_4096,Gemm_Hipblaslt_TN_9697,0.555909
GemmTunableOp_Half_TN,tn_3072_912_4096,Gemm_Hipblaslt_TN_9546,0.0568621
GemmTunableOp_Half_TN,tn_14336_1700_4096,Gemm_Hipblaslt_TN_9677,0.352062
GemmTunableOp_Half_TN,tn_64128_127_4096,Gemm_Hipblaslt_TN_9596,0.199079
GemmTunableOp_Half_TN,tn_4096_1744_7168,Gemm_Hipblaslt_TN_9673,0.193962
GemmTunableOp_Half_TN,tn_4096_938_2048,Gemm_Hipblaslt_TN_9355,0.0384629
GemmTunableOp_Half_TN,tn_4096_823_2048,Gemm_Hipblaslt_TN_9577,0.0354719
GemmTunableOp_Half_TN,tn_4096_923_2048,Gemm_Hipblaslt_TN_9577,0.0375025
GemmTunableOp_Half_TN,tn_4096_838_2048,Gemm_Hipblaslt_TN_9354,0.034398
GemmTunableOp_Half_TN,tn_14336_906_4096,Gemm_Hipblaslt_TN_9697,0.18385
GemmTunableOp_Half_TN,tn_4096_7953_2048,Gemm_Hipblaslt_TN_9813,0.229003
GemmTunableOp_Half_TN,tn_4096_1954_7168,Gemm_Hipblaslt_TN_9645,0.20955
GemmTunableOp_Half_TN,tn_14336_807_4096,Gemm_Hipblaslt_TN_9187,0.177446
GemmTunableOp_Half_TN,tn_4096_846_2048,Gemm_Hipblaslt_TN_9352,0.0353013
GemmTunableOp_Half_TN,tn_4096_8007_7168,Gemm_Hipblaslt_TN_9933,0.742681
GemmTunableOp_Half_TN,tn_3072_2648_4096,Gemm_Hipblaslt_TN_9134,0.123565
GemmTunableOp_Half_TN,tn_64128_144_4096,Gemm_Hipblaslt_TN_9108,0.218881
GemmTunableOp_Half_TN,tn_4096_873_7168,Gemm_Hipblaslt_TN_9355,0.117038
GemmTunableOp_Half_TN,tn_14336_1846_4096,Gemm_Hipblaslt_TN_9697,0.370759
GemmTunableOp_Half_TN,tn_14336_1803_4096,Gemm_Hipblaslt_TN_9677,0.367664
GemmTunableOp_Half_TN,tn_14336_1880_4096,Gemm_Hipblaslt_TN_9189,0.373166
GemmTunableOp_Half_TN,tn_4096_889_7168,Gemm_Hipblaslt_TN_9547,0.115433
GemmTunableOp_Half_TN,tn_4096_882_2048,Gemm_Hipblaslt_TN_9577,0.0358212
GemmTunableOp_Half_TN,tn_3072_938_4096,Gemm_Hipblaslt_TN_9546,0.0581454
GemmTunableOp_Half_TN,tn_3072_1744_4096,Gemm_Hipblaslt_TN_9163,0.0906086
GemmTunableOp_Half_TN,tn_4096_1718_7168,Gemm_Hipblaslt_TN_9265,0.185088
GemmTunableOp_Half_TN,tn_4096_2601_7168,Gemm_Hipblaslt_TN_9799,0.266935
GemmTunableOp_Half_TN,tn_3072_888_4096,Gemm_Hipblaslt_TN_9352,0.0567918
GemmTunableOp_Half_TN,tn_3072_882_4096,Gemm_Hipblaslt_TN_9546,0.0565858
GemmTunableOp_Half_TN,tn_4096_2628_7168,Gemm_Hipblaslt_TN_9799,0.269063
GemmTunableOp_Half_TN,tn_14336_929_4096,Gemm_Hipblaslt_TN_9697,0.184403
GemmTunableOp_Half_TN,tn_14336_825_4096,Gemm_Hipblaslt_TN_9697,0.179604
GemmTunableOp_Half_TN,tn_3072_939_4096,Gemm_Hipblaslt_TN_9251,0.0590353
GemmTunableOp_Half_TN,tn_64128_85_4096,Gemm_Hipblaslt_TN_9057,0.180375
GemmTunableOp_Half_TN,tn_4096_2682_2048,Gemm_Hipblaslt_TN_9799,0.0845239
GemmTunableOp_Half_TN,tn_4096_2722_7168,Gemm_Hipblaslt_TN_9799,0.278935
GemmTunableOp_Half_TN,tn_4096_1729_2048,Gemm_Hipblaslt_TN_9329,0.061677
GemmTunableOp_Half_TN,tn_3072_256_4096,Gemm_Rocblas_621294171,0.0233517
GemmTunableOp_Half_TN,tn_4096_8156_7168,Gemm_Rocblas_621294420,0.752313
GemmTunableOp_Half_TN,tn_4096_1744_2048,Gemm_Hipblaslt_TN_9680,0.0618269
GemmTunableOp_Half_TN,tn_4096_1748_2048,Gemm_Hipblaslt_TN_9329,0.0623126
GemmTunableOp_Half_TN,tn_4096_846_7168,Gemm_Hipblaslt_TN_9634,0.11251
GemmTunableOp_Half_TN,tn_4096_929_7168,Gemm_Hipblaslt_TN_9170,0.117312
GemmTunableOp_Half_TN,tn_4096_7863_2048,Gemm_Hipblaslt_TN_9813,0.229458
GemmTunableOp_Half_TN,tn_4096_160_7168,Gemm_Rocblas_621286440,0.0370777
GemmTunableOp_Half_TN,tn_64128_114_4096,Gemm_Rocblas_621286396,0.202015
GemmTunableOp_Half_TN,tn_4096_871_7168,Gemm_Hipblaslt_TN_9604,0.116284
GemmTunableOp_Half_TN,tn_3072_873_4096,Gemm_Hipblaslt_TN_9251,0.0583933
GemmTunableOp_Half_TN,tn_14336_1834_4096,Gemm_Hipblaslt_TN_9187,0.370468
GemmTunableOp_Half_TN,tn_4096_887_7168,Gemm_Hipblaslt_TN_9547,0.116419
GemmTunableOp_Half_TN,tn_14336_4463_4096,Gemm_Hipblaslt_TN_9220,0.852331
GemmTunableOp_Half_TN,tn_3072_1944_4096,Gemm_Hipblaslt_TN_9633,0.0991639
GemmTunableOp_Half_TN,tn_3072_869_4096,Gemm_Hipblaslt_TN_9131,0.0568177
GemmTunableOp_Half_TN,tn_4096_903_2048,Gemm_Hipblaslt_TN_9577,0.0358776
GemmTunableOp_Half_TN,tn_3072_943_4096,Gemm_Hipblaslt_TN_9546,0.0578016
GemmTunableOp_Half_TN,tn_4096_878_2048,Gemm_Hipblaslt_TN_9547,0.0372424
GemmTunableOp_Half_TN,tn_4096_891_7168,Gemm_Hipblaslt_TN_9576,0.116379
GemmTunableOp_Half_TN,tn_14336_854_4096,Gemm_Hipblaslt_TN_9139,0.180071
GemmTunableOp_Half_TN,tn_4096_1881_7168,Gemm_Hipblaslt_TN_9645,0.207635
GemmTunableOp_Half_TN,tn_64128_86_4096,Gemm_Hipblaslt_TN_9057,0.181871
GemmTunableOp_Half_TN,tn_4096_1848_2048,Gemm_Hipblaslt_TN_9590,0.0641779
GemmTunableOp_Half_TN,tn_4096_80_2048,Gemm_Rocblas_621294029,0.00926905
GemmTunableOp_Half_TN,tn_4096_1854_2048,Gemm_Hipblaslt_TN_9590,0.0624205
GemmTunableOp_Half_TN,tn_14336_2805_4096,Gemm_Hipblaslt_TN_9187,0.554785
GemmTunableOp_Half_TN,tn_4096_1944_7168,Gemm_Hipblaslt_TN_9645,0.208675
GemmTunableOp_Half_TN,tn_4096_1853_2048,Gemm_Hipblaslt_TN_9590,0.0637124
GemmTunableOp_Half_TN,tn_4096_885_2048,Gemm_Hipblaslt_TN_9578,0.0370551
GemmTunableOp_Half_TN,tn_4096_922_7168,Gemm_Hipblaslt_TN_9604,0.118774
GemmTunableOp_Half_TN,tn_4096_905_7168,Gemm_Hipblaslt_TN_9634,0.117827
GemmTunableOp_Half_TN,tn_3072_1693_4096,Gemm_Hipblaslt_TN_9148,0.0883647
GemmTunableOp_Half_TN,tn_14336_814_4096,Gemm_Hipblaslt_TN_9187,0.17646
GemmTunableOp_Half_TN,tn_14336_1600_4096,Gemm_Rocblas_621286684,0.32042
GemmTunableOp_Half_TN,tn_4096_1694_2048,Gemm_Hipblaslt_TN_9588,0.0583423
GemmTunableOp_Half_TN,tn_64128_215_4096,Gemm_Hipblaslt_TN_9654,0.270586
GemmTunableOp_Half_TN,tn_4096_815_2048,Gemm_Hipblaslt_TN_9604,0.0341422
GemmTunableOp_Half_TN,tn_4096_893_2048,Gemm_Hipblaslt_TN_9634,0.037738
GemmTunableOp_Half_TN,tn_4096_1900_7168,Gemm_Hipblaslt_TN_9645,0.208255
GemmTunableOp_Half_TN,tn_4096_1755_2048,Gemm_Hipblaslt_TN_9329,0.0621696
GemmTunableOp_Half_TN,tn_64128_180_4096,Gemm_Hipblaslt_TN_9855,0.251793
GemmTunableOp_Half_TN,tn_64128_207_4096,Gemm_Hipblaslt_TN_9654,0.269803
GemmTunableOp_Half_TN,tn_4096_872_2048,Gemm_Hipblaslt_TN_9356,0.0363431
GemmTunableOp_Half_TN,tn_14336_2682_4096,Gemm_Hipblaslt_TN_9677,0.539496
GemmTunableOp_Half_TN,tn_4096_2750_2048,Gemm_Hipblaslt_TN_9674,0.0865586
GemmTunableOp_Half_TN,tn_3072_837_4096,Gemm_Hipblaslt_TN_9047,0.0540143
GemmTunableOp_Half_TN,tn_4096_988_2048,Gemm_Hipblaslt_TN_9583,0.039089
GemmTunableOp_Half_TN,tn_64128_232_4096,Gemm_Rocblas_621286915,0.286223
GemmTunableOp_Half_TN,tn_4096_869_2048,Gemm_Hipblaslt_TN_9356,0.037182
GemmTunableOp_Half_TN,tn_4096_799_2048,Gemm_Hipblaslt_TN_9634,0.0334781
GemmTunableOp_Half_TN,tn_3072_790_4096,Gemm_Hipblaslt_TN_9368,0.0511927
GemmTunableOp_Half_TN,tn_14336_1718_4096,Gemm_Hipblaslt_TN_9189,0.355575
GemmTunableOp_Half_TN,tn_4096_926_7168,Gemm_Hipblaslt_TN_9170,0.118578
GemmTunableOp_Half_TN,tn_14336_4471_4096,Gemm_Rocblas_621286742,0.856286
GemmTunableOp_Half_TN,tn_4096_813_2048,Gemm_Hipblaslt_TN_9604,0.0354882
GemmTunableOp_Half_TN,tn_3072_971_4096,Gemm_Hipblaslt_TN_9352,0.0586797
GemmTunableOp_Half_TN,tn_14336_2517_4096,Gemm_Rocblas_621286684,0.502424
GemmTunableOp_Half_TN,tn_14336_1762_4096,Gemm_Hipblaslt_TN_9187,0.362436
GemmTunableOp_Half_TN,tn_3072_1815_4096,Gemm_Rocblas_621286778,0.0896365
GemmTunableOp_Half_TN,tn_14336_904_4096,Gemm_Hipblaslt_TN_9697,0.183427
GemmTunableOp_Half_TN,tn_4096_3430_2048,Gemm_Hipblaslt_TN_9692,0.100907
GemmTunableOp_Half_TN,tn_14336_3430_4096,Gemm_Rocblas_621286750,0.650982
GemmTunableOp_Half_TN,tn_4096_821_2048,Gemm_Hipblaslt_TN_9634,0.034165
GemmTunableOp_Half_TN,tn_11008_4000_4096,Gemm_Hipblaslt_TN_9832,0.626268
GemmTunableOp_Half_TN,tn_14336_1944_4096,Gemm_Hipblaslt_TN_9220,0.397917
GemmTunableOp_Half_TN,tn_4096_112_2048,Gemm_Rocblas_621286278,0.0105245
GemmTunableOp_Half_TN,tn_14336_160_4096,Gemm_Hipblaslt_TN_9312,0.0542477
GemmTunableOp_Half_TN,tn_64128_163_4096,Gemm_Hipblaslt_TN_9816,0.240806
GemmTunableOp_Half_TN,tn_3072_1727_4096,Gemm_Hipblaslt_TN_9561,0.0880068
GemmTunableOp_Half_TN,tn_14336_80_4096,Gemm_Hipblaslt_TN_9495,0.0341844
GemmTunableOp_Half_TN,tn_64128_13_4096,Gemm_Rocblas_621286348,0.143707
GemmTunableOp_Half_TN,tn_64128_5_4096,Gemm_Rocblas_621294224,0.138945
GemmTunableOp_Half_TN,tn_4096_907_2048,Gemm_Hipblaslt_TN_9577,0.0369217
GemmTunableOp_Half_TN,tn_3072_2675_4096,Gemm_Hipblaslt_TN_9174,0.124486
GemmTunableOp_Half_TN,tn_3072_958_4096,Gemm_Hipblaslt_TN_9131,0.0577075
GemmTunableOp_Half_TN,tn_14336_886_4096,Gemm_Hipblaslt_TN_9139,0.181026
GemmTunableOp_Half_TN,tn_4096_1695_2048,Gemm_Hipblaslt_TN_9164,0.0572015
GemmTunableOp_Half_TN,tn_4096_1815_2048,Gemm_Hipblaslt_TN_9590,0.0628872
GemmTunableOp_Half_TN,tn_4096_878_7168,Gemm_Hipblaslt_TN_9574,0.116168
GemmTunableOp_Half_TN,tn_4096_1867_2048,Gemm_Hipblaslt_TN_9590,0.06316
GemmTunableOp_Half_TN,tn_14336_1737_4096,Gemm_Hipblaslt_TN_9189,0.363336
GemmTunableOp_Half_TN,tn_64128_37_4096,Gemm_Hipblaslt_TN_9143,0.157145
GemmTunableOp_Half_TN,tn_64128_177_4096,Gemm_Hipblaslt_TN_9821,0.24684
GemmTunableOp_Half_TN,tn_4096_2785_7168,Gemm_Hipblaslt_TN_9799,0.280895
GemmTunableOp_Half_TN,tn_4096_1807_7168,Gemm_Hipblaslt_TN_9268,0.202558
GemmTunableOp_Half_TN,tn_4096_932_7168,Gemm_Hipblaslt_TN_9604,0.119342
GemmTunableOp_Half_TN,tn_4096_232_5504,Gemm_Rocblas_621294230,0.0339906
GemmTunableOp_Half_TN,tn_3072_8069_4096,Gemm_Rocblas_621294473,0.348986
GemmTunableOp_Half_TN,tn_4096_944_2048,Gemm_Hipblaslt_TN_9583,0.038208
GemmTunableOp_Half_TN,tn_4096_7798_2048,Gemm_Hipblaslt_TN_9713,0.22546
GemmTunableOp_Half_TN,tn_4096_797_7168,Gemm_Hipblaslt_TN_9147,0.108091
GemmTunableOp_Half_TN,tn_3072_1759_4096,Gemm_Hipblaslt_TN_9163,0.0908844
GemmTunableOp_Half_TN,tn_14336_1778_4096,Gemm_Hipblaslt_TN_9793,0.365117
GemmTunableOp_Half_TN,tn_4096_2773_7168,Gemm_Hipblaslt_TN_9672,0.279467
GemmTunableOp_Half_TN,tn_3072_2672_4096,Gemm_Hipblaslt_TN_9645,0.125038
GemmTunableOp_Half_TN,tn_14336_2698_4096,Gemm_Hipblaslt_TN_9697,0.549587
GemmTunableOp_Half_TN,tn_4096_192_7168,Gemm_Rocblas_621294168,0.037708
GemmTunableOp_Half_TN,tn_3072_3507_4096,Gemm_Rocblas_621294495,0.155813
GemmTunableOp_Half_TN,tn_4096_984_7168,Gemm_Hipblaslt_TN_9170,0.120666
GemmTunableOp_Half_TN,tn_3072_870_4096,Gemm_Hipblaslt_TN_9546,0.0561096
GemmTunableOp_Half_TN,tn_14336_811_4096,Gemm_Hipblaslt_TN_9677,0.176887
GemmTunableOp_Half_TN,tn_14336_2606_4096,Gemm_Hipblaslt_TN_9793,0.538704
GemmTunableOp_Half_TN,tn_64128_133_4096,Gemm_Hipblaslt_TN_9852,0.219148
GemmTunableOp_Half_TN,tn_4096_942_7168,Gemm_Hipblaslt_TN_9576,0.117927
GemmTunableOp_Half_TN,tn_4096_2544_2048,Gemm_Hipblaslt_TN_9687,0.0819161
GemmTunableOp_Half_TN,tn_4096_969_7168,Gemm_Hipblaslt_TN_9576,0.119982
GemmTunableOp_Half_TN,tn_3072_915_4096,Gemm_Hipblaslt_TN_9546,0.0578345
GemmTunableOp_Half_TN,tn_4096_3569_7168,Gemm_Hipblaslt_TN_9697,0.342546
GemmTunableOp_Half_TN,tn_4096_1835_7168,Gemm_Hipblaslt_TN_9137,0.205414
GemmTunableOp_Half_TN,tn_14336_224_4096,Gemm_Rocblas_621294218,0.0658564
GemmTunableOp_Half_TN,tn_3072_984_4096,Gemm_Hipblaslt_TN_9158,0.0602128
GemmTunableOp_Half_TN,tn_3072_1829_4096,Gemm_Hipblaslt_TN_9324,0.0936496
GemmTunableOp_Half_TN,tn_4096_901_2048,Gemm_Hipblaslt_TN_9604,0.0356067
GemmTunableOp_Half_TN,tn_3072_1614_4096,Gemm_Hipblaslt_TN_9561,0.0864353
GemmTunableOp_Half_TN,tn_3072_7952_4096,Gemm_Rocblas_621294473,0.34084
GemmTunableOp_Half_TN,tn_64128_237_4096,Gemm_Rocblas_621286915,0.285146
GemmTunableOp_Half_TN,tn_4096_854_7168,Gemm_Hipblaslt_TN_9352,0.114026
GemmTunableOp_Half_TN,tn_4096_990_2048,Gemm_Hipblaslt_TN_9577,0.0395512
GemmTunableOp_Half_TN,tn_14336_899_4096,Gemm_Hipblaslt_TN_9697,0.182814
GemmTunableOp_Half_TN,tn_14336_3662_4096,Gemm_Hipblaslt_TN_9187,0.735892
GemmTunableOp_Half_TN,tn_4096_2703_2048,Gemm_Hipblaslt_TN_9689,0.0850094
GemmTunableOp_Half_TN,tn_4096_3402_2048,Gemm_Hipblaslt_TN_9821,0.100276
GemmTunableOp_Half_TN,tn_4096_1837_7168,Gemm_Hipblaslt_TN_9267,0.203499
GemmTunableOp_Half_TN,tn_4096_2773_2048,Gemm_Hipblaslt_TN_9687,0.0849946
GemmTunableOp_Half_TN,tn_3072_1785_4096,Gemm_Rocblas_621294520,0.0911705
GemmTunableOp_Half_TN,tn_4096_5606_7168,Gemm_Hipblaslt_TN_9674,0.56212
GemmTunableOp_Half_TN,tn_3072_1763_4096,Gemm_Rocblas_621286778,0.0903453
GemmTunableOp_Half_TN,tn_14336_3418_4096,Gemm_Hipblaslt_TN_9223,0.649422
GemmTunableOp_Half_TN,tn_4096_927_2048,Gemm_Hipblaslt_TN_9576,0.037582
GemmTunableOp_Half_TN,tn_3072_3418_4096,Gemm_Rocblas_621286753,0.153047
GemmTunableOp_Half_TN,tn_14336_986_4096,Gemm_Hipblaslt_TN_9217,0.203548
GemmTunableOp_Half_TN,tn_4096_862_2048,Gemm_Hipblaslt_TN_9354,0.0351105
GemmTunableOp_Half_TN,tn_64128_172_4096,Gemm_Hipblaslt_TN_9752,0.24487
GemmTunableOp_Half_TN,tn_4096_2599_7168,Gemm_Hipblaslt_TN_9799,0.265589
GemmTunableOp_Half_TN,tn_64128_29_4096,Gemm_Hipblaslt_TN_9094,0.146989
GemmTunableOp_Half_TN,tn_14336_208_4096,Gemm_Hipblaslt_TN_9252,0.0652816
GemmTunableOp_Half_TN,tn_3072_992_4096,Gemm_Hipblaslt_TN_9158,0.0598206
GemmTunableOp_Half_TN,tn_64128_241_4096,Gemm_Hipblaslt_TN_9122,0.2926
GemmTunableOp_Half_TN,tn_4096_983_7168,Gemm_Hipblaslt_TN_9170,0.121461
GemmTunableOp_Half_TN,tn_4096_961_7168,Gemm_Hipblaslt_TN_9170,0.119757
GemmTunableOp_Half_TN,tn_14336_1723_4096,Gemm_Hipblaslt_TN_9697,0.355614
GemmTunableOp_Half_TN,tn_4096_896_2048,Gemm_Hipblaslt_TN_9585,0.0360416
GemmTunableOp_Half_TN,tn_4096_939_7168,Gemm_Hipblaslt_TN_9604,0.119548
GemmTunableOp_Half_TN,tn_14336_911_4096,Gemm_Hipblaslt_TN_9697,0.184357
GemmTunableOp_Half_TN,tn_14336_847_4096,Gemm_Hipblaslt_TN_9697,0.180309
GemmTunableOp_Half_TN,tn_4096_104_2048,Gemm_Rocblas_621286280,0.0108562
GemmTunableOp_Half_TN,tn_14336_2628_4096,Gemm_Hipblaslt_TN_9793,0.533432
GemmTunableOp_Half_TN,tn_3072_872_4096,Gemm_Hipblaslt_TN_9546,0.0565383
GemmTunableOp_Half_TN,tn_4096_2675_2048,Gemm_Hipblaslt_TN_9687,0.0845343
GemmTunableOp_Half_TN,tn_14336_2699_4096,Gemm_Hipblaslt_TN_9677,0.546646
GemmTunableOp_Half_TN,tn_3072_1827_4096,Gemm_Hipblaslt_TN_9324,0.0905869
GemmTunableOp_Half_TN,tn_4096_80_7168,Gemm_Hipblaslt_TN_9440,0.0235135
GemmTunableOp_Half_TN,tn_4096_904_2048,Gemm_Hipblaslt_TN_9604,0.0363371
GemmTunableOp_Half_TN,tn_14336_857_4096,Gemm_Hipblaslt_TN_9187,0.180319
GemmTunableOp_Half_TN,tn_4096_859_2048,Gemm_Hipblaslt_TN_9131,0.0357255
GemmTunableOp_Half_TN,tn_3072_878_4096,Gemm_Hipblaslt_TN_9546,0.0571849
GemmTunableOp_Half_TN,tn_3072_160_4096,Gemm_Rocblas_621294177,0.0181783
GemmTunableOp_Half_TN,tn_3072_807_4096,Gemm_Hipblaslt_TN_9047,0.0519857
GemmTunableOp_Half_TN,tn_14336_914_4096,Gemm_Hipblaslt_TN_9187,0.184727
GemmTunableOp_Half_TN,tn_4096_873_2048,Gemm_Hipblaslt_TN_9608,0.036562
GemmTunableOp_Half_TN,tn_3072_901_4096,Gemm_Hipblaslt_TN_9352,0.0580112
GemmTunableOp_Half_TN,tn_14336_1759_4096,Gemm_Hipblaslt_TN_9697,0.363113
GemmTunableOp_Half_TN,tn_4096_1705_7168,Gemm_Hipblaslt_TN_9265,0.185034
GemmTunableOp_Half_TN,tn_4096_64_2048,Gemm_Rocblas_621286488,0.00788306
GemmTunableOp_Half_TN,tn_3072_2544_4096,Gemm_Hipblaslt_TN_9134,0.1208
GemmTunableOp_Half_TN,tn_4096_128_7168,Gemm_Rocblas_621286436,0.0279398
GemmTunableOp_Half_TN,tn_14336_2762_4096,Gemm_Hipblaslt_TN_9697,0.554666
GemmTunableOp_Half_TN,tn_14336_859_4096,Gemm_Hipblaslt_TN_9697,0.181363
GemmTunableOp_Half_TN,tn_3072_4483_4096,Gemm_Hipblaslt_TN_9943,0.190107
GemmTunableOp_Half_TN,tn_4096_7952_2048,Gemm_Hipblaslt_TN_9655,0.228915
GemmTunableOp_Half_TN,tn_3072_922_4096,Gemm_Hipblaslt_TN_9131,0.0571564
GemmTunableOp_Half_TN,tn_3072_969_4096,Gemm_Hipblaslt_TN_9158,0.0598391
GemmTunableOp_Half_TN,tn_14336_900_4096,Gemm_Hipblaslt_TN_9697,0.183317
GemmTunableOp_Half_TN,tn_3072_1715_4096,Gemm_Rocblas_621286778,0.0880089
GemmTunableOp_Half_TN,tn_3072_895_4096,Gemm_Hipblaslt_TN_9352,0.0574534
GemmTunableOp_Half_TN,tn_3072_852_4096,Gemm_Hipblaslt_TN_9368,0.0519658
GemmTunableOp_Half_TN,tn_14336_984_4096,Gemm_Hipblaslt_TN_9220,0.205027
GemmTunableOp_Half_TN,tn_3072_7266_4096,Gemm_Hipblaslt_TN_9681,0.311381
GemmTunableOp_Half_TN,tn_3072_48_4096,Gemm_Rocblas_621294148,0.0106731
GemmTunableOp_Half_TN,tn_4096_144_2048,Gemm_Rocblas_621294168,0.0123809
GemmTunableOp_Half_TN,tn_14336_40_4096,Gemm_Rocblas_621294230,0.0286168
GemmTunableOp_Half_TN,tn_64128_201_4096,Gemm_Hipblaslt_TN_9260,0.277975
GemmTunableOp_Half_TN,tn_14336_924_4096,Gemm_Hipblaslt_TN_9697,0.184252
GemmTunableOp_Half_TN,tn_3072_829_4096,Gemm_Hipblaslt_TN_9048,0.0526696
GemmTunableOp_Half_TN,tn_64128_255_4096,Gemm_Hipblaslt_TN_9122,0.297962
GemmTunableOp_Half_TN,tn_64128_245_4096,Gemm_Hipblaslt_TN_9122,0.295575
GemmTunableOp_Half_TN,tn_4096_836_2048,Gemm_Hipblaslt_TN_9352,0.0341237
GemmTunableOp_Half_TN,tn_3072_144_4096,Gemm_Hipblaslt_TN_9443,0.0171125
GemmTunableOp_Half_TN,tn_64128_197_4096,Gemm_Hipblaslt_TN_9654,0.267995
GemmTunableOp_Half_TN,tn_64128_242_4096,Gemm_Rocblas_621294658,0.286624
GemmTunableOp_Half_TN,tn_4096_3310_2048,Gemm_Hipblaslt_TN_9696,0.101492
GemmTunableOp_Half_TN,tn_64128_105_4096,Gemm_Rocblas_621294762,0.194601
GemmTunableOp_Half_TN,tn_14336_7299_4096,Gemm_Hipblaslt_TN_9900,1.42187
GemmTunableOp_Half_TN,tn_4096_2592_7168,Gemm_Hipblaslt_TN_9799,0.268219
GemmTunableOp_Half_TN,tn_4096_256_7168,Gemm_Hipblaslt_TN_9470,0.0449812
GemmTunableOp_Half_TN,tn_3072_1854_4096,Gemm_Hipblaslt_TN_9148,0.0930059
GemmTunableOp_Half_TN,tn_4096_804_2048,Gemm_Hipblaslt_TN_9634,0.0337627
GemmTunableOp_Half_TN,tn_4096_8070_2048,Gemm_Hipblaslt_TN_9753,0.230438
GemmTunableOp_Half_TN,tn_4096_951_2048,Gemm_Hipblaslt_TN_9583,0.0388657
GemmTunableOp_Half_TN,tn_3072_4463_4096,Gemm_Hipblaslt_TN_9939,0.189621
GemmTunableOp_Half_TN,tn_14336_7857_4096,Gemm_Hipblaslt_TN_9933,1.50497
GemmTunableOp_Half_TN,tn_14336_869_4096,Gemm_Hipblaslt_TN_9697,0.183408
GemmTunableOp_Half_TN,tn_14336_232_4096,Gemm_Hipblaslt_TN_9634,0.0671873
GemmTunableOp_Half_TN,tn_14336_796_4096,Gemm_Hipblaslt_TN_9691,0.162378
GemmTunableOp_Half_TN,tn_4096_865_2048,Gemm_Hipblaslt_TN_9577,0.0357301
GemmTunableOp_Half_TN,tn_4096_136_2048,Gemm_Rocblas_621286447,0.0128132
GemmTunableOp_Half_TN,tn_4096_1954_2048,Gemm_Hipblaslt_TN_9590,0.0653673
GemmTunableOp_Half_TN,tn_4096_2785_2048,Gemm_Hipblaslt_TN_9672,0.0854402
GemmTunableOp_Half_TN,tn_4096_7944_2048,Gemm_Hipblaslt_TN_9813,0.227705
GemmTunableOp_Half_TN,tn_4096_7992_7168,Gemm_Hipblaslt_TN_9933,0.74189
GemmTunableOp_Half_TN,tn_14336_1893_4096,Gemm_Hipblaslt_TN_9697,0.372588
GemmTunableOp_Half_TN,tn_14336_934_4096,Gemm_Hipblaslt_TN_9697,0.185819
GemmTunableOp_Half_TN,tn_4096_176_7168,Gemm_Rocblas_621294168,0.0383934
GemmTunableOp_Half_TN,tn_64128_252_4096,Gemm_Rocblas_621286905,0.288519
GemmTunableOp_Half_TN,tn_3072_1881_4096,Gemm_Hipblaslt_TN_9613,0.0940342
GemmTunableOp_Half_TN,tn_14336_1695_4096,Gemm_Hipblaslt_TN_9697,0.355569
GemmTunableOp_Half_TN,tn_4096_937_7168,Gemm_Hipblaslt_TN_9577,0.118884
GemmTunableOp_Half_TN,tn_3072_2630_4096,Gemm_Hipblaslt_TN_9329,0.122369
GemmTunableOp_Half_TN,tn_64128_46_4096,Gemm_Hipblaslt_TN_9097,0.157941
GemmTunableOp_Half_TN,tn_3072_3599_4096,Gemm_Hipblaslt_TN_9681,0.158505
GemmTunableOp_Half_TN,tn_4096_814_2048,Gemm_Hipblaslt_TN_9353,0.0347179
GemmTunableOp_Half_TN,tn_3072_1748_4096,Gemm_Hipblaslt_TN_9163,0.0897727
GemmTunableOp_Half_TN,tn_4096_957_7168,Gemm_Hipblaslt_TN_9604,0.118934
GemmTunableOp_Half_TN,tn_4096_932_2048,Gemm_Hipblaslt_TN_9604,0.0359373
GemmTunableOp_Half_TN,tn_14336_1897_4096,Gemm_Hipblaslt_TN_9192,0.372772
GemmTunableOp_Half_TN,tn_3072_4242_4096,Gemm_Hipblaslt_TN_9793,0.181367
GemmTunableOp_Half_TN,tn_4096_2872_7168,Gemm_Hipblaslt_TN_9799,0.283495
GemmTunableOp_Half_TN,tn_4096_3711_2048,Gemm_Hipblaslt_TN_9768,0.111171
GemmTunableOp_Half_TN,tn_14336_8192_4096,Gemm_Hipblaslt_TN_9813,1.5512
GemmTunableOp_Half_TN,tn_4096_1723_7168,Gemm_Hipblaslt_TN_9610,0.184066
GemmTunableOp_Half_TN,tn_14336_7944_4096,Gemm_Hipblaslt_TN_9914,1.52119
GemmTunableOp_Half_TN,tn_4096_935_7168,Gemm_Hipblaslt_TN_9577,0.119067
GemmTunableOp_Half_TN,tn_4096_887_2048,Gemm_Hipblaslt_TN_9355,0.0375282
GemmTunableOp_Half_TN,tn_64128_196_4096,Gemm_Hipblaslt_TN_9260,0.274036
GemmTunableOp_Half_TN,tn_4096_7937_7168,Gemm_Hipblaslt_TN_9914,0.739062
GemmTunableOp_Half_TN,tn_64128_97_4096,Gemm_Rocblas_621294762,0.193805
GemmTunableOp_Half_TN,tn_14336_992_4096,Gemm_Hipblaslt_TN_9223,0.202467
GemmTunableOp_Half_TN,tn_3072_797_4096,Gemm_Hipblaslt_TN_9048,0.0517034
GemmTunableOp_Half_TN,tn_3072_923_4096,Gemm_Hipblaslt_TN_9131,0.0574504
GemmTunableOp_Half_TN,tn_14336_32_4096,Gemm_Rocblas_621294154,0.0257797
GemmTunableOp_Half_TN,tn_14336_1886_4096,Gemm_Hipblaslt_TN_9697,0.3721
GemmTunableOp_Half_TN,tn_14336_1719_4096,Gemm_Hipblaslt_TN_9697,0.354309
GemmTunableOp_Half_TN,tn_3072_1726_4096,Gemm_Hipblaslt_TN_9561,0.0881551
GemmTunableOp_Half_TN,tn_4096_7798_7168,Gemm_Hipblaslt_TN_9753,0.735392
GemmTunableOp_Half_TN,tn_4096_1803_2048,Gemm_Hipblaslt_TN_9590,0.0624762
GemmTunableOp_Half_TN,tn_4096_1805_2048,Gemm_Hipblaslt_TN_9590,0.0627971
GemmTunableOp_Half_TN,tn_3072_2601_4096,Gemm_Hipblaslt_TN_9329,0.122539
GemmTunableOp_Half_TN,tn_14336_48_4096,Gemm_Hipblaslt_TN_8940,0.0291584
GemmTunableOp_Half_TN,tn_4096_919_7168,Gemm_Hipblaslt_TN_9576,0.117933
GemmTunableOp_Half_TN,tn_4096_240_7168,Gemm_Rocblas_621286491,0.0442328
GemmTunableOp_Half_TN,tn_14336_800_4096,Gemm_Rocblas_621286684,0.159544
GemmTunableOp_Half_TN,tn_64128_131_4096,Gemm_Hipblaslt_TN_9674,0.216281
GemmTunableOp_Half_TN,tn_4096_8070_7168,Gemm_Rocblas_621286742,0.753608
GemmTunableOp_Half_TN,tn_4096_1746_7168,Gemm_Hipblaslt_TN_9673,0.192708
GemmTunableOp_Half_TN,tn_4096_2734_2048,Gemm_Hipblaslt_TN_9687,0.0859009
GemmTunableOp_Half_TN,tn_14336_120_4096,Gemm_Rocblas_621294233,0.0417463
GemmTunableOp_Half_TN,tn_3072_1743_4096,Gemm_Rocblas_621294520,0.090225
GemmTunableOp_Half_TN,tn_4096_925_7168,Gemm_Hipblaslt_TN_9604,0.117383
GemmTunableOp_Half_TN,tn_14336_982_4096,Gemm_Hipblaslt_TN_9217,0.201713
GemmTunableOp_Half_TN,tn_14336_832_4096,Gemm_Hipblaslt_TN_9677,0.178061
GemmTunableOp_Half_TN,tn_4096_911_7168,Gemm_Hipblaslt_TN_9170,0.117237
GemmTunableOp_Half_TN,tn_4096_40_7168,Gemm_Rocblas_621294058,0.0176516
GemmTunableOp_Half_TN,tn_4096_3565_7168,Gemm_Hipblaslt_TN_9139,0.341255
GemmTunableOp_Half_TN,tn_4096_2635_7168,Gemm_Hipblaslt_TN_9657,0.270413
GemmTunableOp_Half_TN,tn_4096_848_2048,Gemm_Hipblaslt_TN_9131,0.0356596
GemmTunableOp_Half_TN,tn_4096_120_7168,Gemm_Rocblas_621286438,0.0282775
GemmTunableOp_Half_TN,tn_4096_1807_2048,Gemm_Hipblaslt_TN_9680,0.0630045
GemmTunableOp_Half_TN,tn_64128_176_4096,Gemm_Hipblaslt_TN_9855,0.245503
GemmTunableOp_Half_TN,tn_4096_7283_7168,Gemm_Hipblaslt_TN_9743,0.6834
GemmTunableOp_Half_TN,tn_14336_892_4096,Gemm_Hipblaslt_TN_9677,0.182877
GemmTunableOp_Half_TN,tn_3072_2763_4096,Gemm_Hipblaslt_TN_9624,0.127612
GemmTunableOp_Half_TN,tn_14336_2721_4096,Gemm_Hipblaslt_TN_9677,0.553131
GemmTunableOp_Half_TN,tn_3072_819_4096,Gemm_Hipblaslt_TN_9047,0.0525838
GemmTunableOp_Half_TN,tn_3072_192_4096,Gemm_Rocblas_621286436,0.0190861
GemmTunableOp_Half_TN,tn_3072_2682_4096,Gemm_Hipblaslt_TN_9134,0.12267
GemmTunableOp_Half_TN,tn_4096_3352_7168,Gemm_Hipblaslt_TN_9677,0.327092
GemmTunableOp_Half_TN,tn_14336_3565_4096,Gemm_Hipblaslt_TN_9223,0.66428
GemmTunableOp_Half_TN,tn_3072_7944_4096,Gemm_Hipblaslt_TN_9935,0.340954
GemmTunableOp_Half_TN,tn_14336_958_4096,Gemm_Hipblaslt_TN_9677,0.184527
GemmTunableOp_Half_TN,tn_4096_1834_7168,Gemm_Hipblaslt_TN_9134,0.204134
GemmTunableOp_Half_TN,tn_3072_1672_4096,Gemm_Hipblaslt_TN_9561,0.0877759
GemmTunableOp_Half_TN,tn_14336_7798_4096,Gemm_Hipblaslt_TN_9914,1.4985
GemmTunableOp_Half_TN,tn_3072_2670_4096,Gemm_Hipblaslt_TN_9645,0.124217
GemmTunableOp_Half_TN,tn_3072_112_4096,Gemm_Rocblas_621294164,0.0145057
GemmTunableOp_Half_TN,tn_14336_1673_4096,Gemm_Hipblaslt_TN_9189,0.354466
GemmTunableOp_Half_TN,tn_4096_1806_2048,Gemm_Hipblaslt_TN_9590,0.0624305
GemmTunableOp_Half_TN,tn_4096_2793_7168,Gemm_Hipblaslt_TN_9799,0.280681
GemmTunableOp_Half_TN,tn_14336_951_4096,Gemm_Hipblaslt_TN_9139,0.186776
GemmTunableOp_Half_TN,tn_3072_1775_4096,Gemm_Rocblas_621286778,0.0915926
GemmTunableOp_Half_TN,tn_3072_918_4096,Gemm_Hipblaslt_TN_9352,0.0580373
GemmTunableOp_Half_TN,tn_14336_1854_4096,Gemm_Hipblaslt_TN_9187,0.37183
GemmTunableOp_Half_TN,tn_14336_2719_4096,Gemm_Hipblaslt_TN_9187,0.552469
GemmTunableOp_Half_TN,tn_64128_35_4096,Gemm_Hipblaslt_TN_9097,0.156404
GemmTunableOp_Half_TN,tn_64128_98_4096,Gemm_Rocblas_621294011,0.19691
GemmTunableOp_Half_TN,tn_4096_1673_7168,Gemm_Hipblaslt_TN_9265,0.183205
GemmTunableOp_Half_TN,tn_64128_153_4096,Gemm_Hipblaslt_TN_9108,0.223419
GemmTunableOp_Half_TN,tn_4096_7239_7168,Gemm_Hipblaslt_TN_9743,0.683816
GemmTunableOp_Half_TN,tn_64128_167_4096,Gemm_Hipblaslt_TN_9956,0.250103
GemmTunableOp_Half_TN,tn_4096_817_7168,Gemm_Hipblaslt_TN_9147,0.108918
GemmTunableOp_Half_TN,tn_64128_216_4096,Gemm_Hipblaslt_TN_9271,0.279653
GemmTunableOp_Half_TN,tn_64128_226_4096,Gemm_Hipblaslt_TN_9122,0.288935
GemmTunableOp_Half_TN,tn_3072_32_4096,Gemm_Rocblas_621294054,0.00926431
GemmTunableOp_Half_TN,tn_3072_825_4096,Gemm_Hipblaslt_TN_9047,0.0529938
GemmTunableOp_Half_TN,tn_4096_232_2048,Gemm_Rocblas_621294175,0.014259
GemmTunableOp_Half_TN,tn_14336_1693_4096,Gemm_Hipblaslt_TN_9697,0.353063
GemmTunableOp_Half_TN,tn_4096_3556_7168,Gemm_Hipblaslt_TN_9695,0.340893
GemmTunableOp_Half_TN,tn_3072_893_4096,Gemm_Hipblaslt_TN_9147,0.0576853
GemmTunableOp_Half_TN,tn_3072_64_4096,Gemm_Rocblas_621286332,0.0109741
GemmTunableOp_Half_TN,tn_14336_853_4096,Gemm_Hipblaslt_TN_9677,0.179583
GemmTunableOp_Half_TN,tn_3072_796_4096,Gemm_Hipblaslt_TN_9368,0.0519337
GemmTunableOp_Half_TN,tn_4096_152_2048,Gemm_Rocblas_621286447,0.0128196
GemmTunableOp_Half_TN,tn_3072_905_4096,Gemm_Hipblaslt_TN_9352,0.0566882
GemmTunableOp_Half_TN,tn_14336_861_4096,Gemm_Hipblaslt_TN_9192,0.182192
GemmTunableOp_Half_TN,tn_4096_1739_7168,Gemm_Hipblaslt_TN_9673,0.195348
GemmTunableOp_Half_TN,tn_3072_894_4096,Gemm_Hipblaslt_TN_9131,0.0569915
GemmTunableOp_Half_TN,tn_64128_54_4096,Gemm_Hipblaslt_TN_9097,0.163152
GemmTunableOp_Half_TN,tn_3072_2719_4096,Gemm_Hipblaslt_TN_9567,0.125603
GemmTunableOp_Half_TN,tn_3072_801_4096,Gemm_Hipblaslt_TN_9368,0.0507144
GemmTunableOp_Half_TN,tn_4096_7937_2048,Gemm_Hipblaslt_TN_9753,0.228733
GemmTunableOp_Half_TN,tn_4096_1794_7168,Gemm_Hipblaslt_TN_9268,0.202057
GemmTunableOp_Half_TN,tn_14336_913_4096,Gemm_Hipblaslt_TN_9697,0.183639
GemmTunableOp_Half_TN,tn_4096_1737_7168,Gemm_Hipblaslt_TN_9673,0.194974
GemmTunableOp_Half_TN,tn_4096_1881_2048,Gemm_Hipblaslt_TN_9590,0.0648388
GemmTunableOp_Half_TN,tn_14336_2785_4096,Gemm_Hipblaslt_TN_9677,0.556854
GemmTunableOp_Half_TN,tn_4096_240_2048,Gemm_Rocblas_621286445,0.0149632
GemmTunableOp_Half_TN,tn_4096_2708_7168,Gemm_Hipblaslt_TN_9799,0.274128
GemmTunableOp_Half_TN,tn_4096_2750_7168,Gemm_Hipblaslt_TN_9672,0.280572
GemmTunableOp_Half_TN,tn_4096_1837_2048,Gemm_Hipblaslt_TN_9134,0.062667
GemmTunableOp_Half_TN,tn_3072_959_4096,Gemm_Hipblaslt_TN_9352,0.0584648
GemmTunableOp_Half_TN,tn_4096_4000_5504,Gemm_Rocblas_621294030,0.293269
GemmTunableOp_Half_TN,tn_14336_1848_4096,Gemm_Hipblaslt_TN_9192,0.371091
GemmTunableOp_Half_TN,tn_4096_1742_2048,Gemm_Hipblaslt_TN_9680,0.0618971
GemmTunableOp_Half_TN,tn_14336_870_4096,Gemm_Hipblaslt_TN_9139,0.179523
GemmTunableOp_Half_TN,tn_3072_2734_4096,Gemm_Hipblaslt_TN_9624,0.127316
GemmTunableOp_Half_TN,tn_4096_2708_2048,Gemm_Hipblaslt_TN_9674,0.0848301
GemmTunableOp_Half_TN,tn_3072_871_4096,Gemm_Hipblaslt_TN_9546,0.0567205
GemmTunableOp_Half_TN,tn_4096_3556_2048,Gemm_Hipblaslt_TN_9212,0.103053
GemmTunableOp_Half_TN,tn_4096_949_7168,Gemm_Hipblaslt_TN_9170,0.118228
GemmTunableOp_Half_TN,tn_14336_968_4096,Gemm_Hipblaslt_TN_9220,0.20452
GemmTunableOp_Half_TN,tn_14336_884_4096,Gemm_Hipblaslt_TN_9697,0.182928
GemmTunableOp_Half_TN,tn_14336_2793_4096,Gemm_Hipblaslt_TN_9677,0.555052
GemmTunableOp_Half_TN,tn_64128_109_4096,Gemm_Hipblaslt_TN_9596,0.19518
GemmTunableOp_Half_TN,tn_4096_958_2048,Gemm_Hipblaslt_TN_9604,0.0376853
GemmTunableOp_Half_TN,tn_4096_2732_2048,Gemm_Hipblaslt_TN_9676,0.0866462
GemmTunableOp_Half_TN,tn_14336_3670_4096,Gemm_Hipblaslt_TN_9192,0.734227
GemmTunableOp_Half_TN,tn_14336_2636_4096,Gemm_Hipblaslt_TN_9793,0.535625
GemmTunableOp_Half_TN,tn_4096_807_7168,Gemm_Hipblaslt_TN_9634,0.110163
GemmTunableOp_Half_TN,tn_4096_948_7168,Gemm_Hipblaslt_TN_9604,0.119481
GemmTunableOp_Half_TN,tn_4096_914_2048,Gemm_Hipblaslt_TN_9577,0.037634
GemmTunableOp_Half_TN,tn_4096_8069_7168,Gemm_Rocblas_621294420,0.752464
GemmTunableOp_Half_TN,tn_4096_2628_2048,Gemm_Hipblaslt_TN_9672,0.0838231
GemmTunableOp_Half_TN,tn_4096_845_7168,Gemm_Hipblaslt_TN_9547,0.111722
GemmTunableOp_Half_TN,tn_14336_895_4096,Gemm_Hipblaslt_TN_9697,0.181641
GemmTunableOp_Half_TN,tn_3072_120_4096,Gemm_Rocblas_621286279,0.0150526
GemmTunableOp_Half_TN,tn_4096_2599_2048,Gemm_Hipblaslt_TN_9672,0.083679
GemmTunableOp_Half_TN,tn_4096_1644_2048,Gemm_Hipblaslt_TN_9359,0.0570172
GemmTunableOp_Half_TN,tn_4096_2762_7168,Gemm_Rocblas_621286574,0.281081
GemmTunableOp_Half_TN,tn_14336_871_4096,Gemm_Hipblaslt_TN_9697,0.182508
GemmTunableOp_Half_TN,tn_4096_2764_2048,Gemm_Hipblaslt_TN_9799,0.0873147
GemmTunableOp_Half_TN,tn_14336_16_4096,Gemm_Rocblas_621286317,0.0237453
GemmTunableOp_Half_TN,tn_3072_1883_4096,Gemm_Hipblaslt_TN_9613,0.0942929
GemmTunableOp_Half_TN,tn_3072_1807_4096,Gemm_Hipblaslt_TN_9322,0.0919148
GemmTunableOp_Half_TN,tn_14336_938_4096,Gemm_Hipblaslt_TN_9697,0.185504
GemmTunableOp_Half_TN,tn_3072_1755_4096,Gemm_Hipblaslt_TN_9613,0.0912252
GemmTunableOp_Half_TN,tn_14336_2763_4096,Gemm_Hipblaslt_TN_9677,0.554622
GemmTunableOp_Half_TN,tn_4096_7944_7168,Gemm_Hipblaslt_TN_9959,0.742021
GemmTunableOp_Half_TN,tn_14336_7992_4096,Gemm_Hipblaslt_TN_9903,1.52406
GemmTunableOp_Half_TN,tn_14336_889_4096,Gemm_Hipblaslt_TN_9697,0.183652
GemmTunableOp_Half_TN,tn_14336_880_4096,Gemm_Hipblaslt_TN_9187,0.180693
GemmTunableOp_Half_TN,tn_14336_946_4096,Gemm_Hipblaslt_TN_9697,0.186084
GemmTunableOp_Half_TN,tn_3072_2537_4096,Gemm_Hipblaslt_TN_9624,0.120485
GemmStridedBatchedTunableOp_Half_TN,tn_855_855_128_B_16,Gemm_Rocblas_621294728,0.0258194
GemmStridedBatchedTunableOp_Half_TN,tn_866_866_128_B_16,Gemm_Rocblas_621286811,0.0253069
GemmStridedBatchedTunableOp_Half_TN,tn_827_827_128_B_16,Gemm_Hipblaslt_TN_158,0.0241577
GemmStridedBatchedTunableOp_Half_TN,tn_959_959_128_B_16,Gemm_Rocblas_621286794,0.0277007
GemmStridedBatchedTunableOp_Half_TN,tn_971_971_128_B_16,Gemm_Rocblas_621294536,0.0281916
GemmStridedBatchedTunableOp_Half_TN,tn_796_796_128_B_16,Gemm_Hipblaslt_TN_158,0.0221668
GemmStridedBatchedTunableOp_Half_TN,tn_963_963_128_B_16,Gemm_Rocblas_621286794,0.0273877
GemmStridedBatchedTunableOp_Half_TN,tn_858_858_128_B_16,Gemm_Hipblaslt_TN_9605,0.0259413
GemmStridedBatchedTunableOp_Half_TN,tn_885_885_128_B_16,Gemm_Rocblas_621286984,0.0262982
GemmStridedBatchedTunableOp_Half_TN,tn_912_912_128_B_16,Gemm_Rocblas_621293994,0.0231461
GemmStridedBatchedTunableOp_Half_TN,tn_903_903_128_B_16,Gemm_Rocblas_621294536,0.0266003
GemmStridedBatchedTunableOp_Half_TN,tn_957_957_128_B_16,Gemm_Rocblas_621294536,0.0283454
GemmStridedBatchedTunableOp_Half_TN,tn_813_813_128_B_16,Gemm_Rocblas_621286810,0.0236323
GemmStridedBatchedTunableOp_Half_TN,tn_925_925_128_B_16,Gemm_Rocblas_621294536,0.0271539
GemmStridedBatchedTunableOp_Half_TN,tn_850_850_128_B_16,Gemm_Rocblas_621286811,0.0254317
GemmStridedBatchedTunableOp_Half_TN,tn_916_916_128_B_16,Gemm_Rocblas_621286794,0.0270038
GemmStridedBatchedTunableOp_Half_TN,tn_950_950_128_B_16,Gemm_Rocblas_621286794,0.0272946
GemmStridedBatchedTunableOp_Half_TN,tn_898_898_128_B_16,Gemm_Rocblas_621286794,0.0266428
GemmStridedBatchedTunableOp_Half_TN,tn_894_894_128_B_16,Gemm_Rocblas_621286794,0.0264399
GemmStridedBatchedTunableOp_Half_TN,tn_919_919_128_B_16,Gemm_Rocblas_621286794,0.0270079
GemmStridedBatchedTunableOp_Half_TN,tn_791_791_128_B_16,Gemm_Hipblaslt_TN_158,0.0224249
GemmStridedBatchedTunableOp_Half_TN,tn_968_968_128_B_16,Gemm_Rocblas_621293994,0.0243777
GemmStridedBatchedTunableOp_Half_TN,tn_976_976_128_B_16,Gemm_Rocblas_621286240,0.0241875
GemmStridedBatchedTunableOp_Half_TN,tn_857_857_128_B_16,Gemm_Rocblas_621286794,0.0260084
GemmStridedBatchedTunableOp_Half_TN,tn_801_801_128_B_16,Gemm_Hipblaslt_TN_158,0.0230928
GemmStridedBatchedTunableOp_Half_TN,tn_797_797_128_B_16,Gemm_Hipblaslt_TN_158,0.0225988
GemmStridedBatchedTunableOp_Half_TN,tn_848_848_128_B_16,Gemm_Hipblaslt_TN_150,0.0186927
GemmStridedBatchedTunableOp_Half_TN,tn_889_889_128_B_16,Gemm_Rocblas_621286794,0.0263915
GemmStridedBatchedTunableOp_Half_TN,tn_982_982_128_B_16,Gemm_Rocblas_621286794,0.0276806
GemmStridedBatchedTunableOp_Half_TN,tn_927_927_128_B_16,Gemm_Rocblas_621286794,0.0273244
GemmStridedBatchedTunableOp_Half_TN,tn_32_32_128_B_16,Gemm_Rocblas_621294748,0.00603421
GemmStridedBatchedTunableOp_Half_TN,tn_812_812_128_B_16,Gemm_Hipblaslt_TN_158,0.0226708
GemmStridedBatchedTunableOp_Half_TN,tn_871_871_128_B_16,Gemm_Rocblas_621294728,0.0262683
GemmStridedBatchedTunableOp_Half_TN,tn_867_867_128_B_16,Gemm_Rocblas_621294536,0.0260797
GemmStridedBatchedTunableOp_Half_TN,tn_819_819_128_B_16,Gemm_Hipblaslt_TN_158,0.0237535
GemmStridedBatchedTunableOp_Half_TN,tn_896_896_128_B_16,Gemm_Hipblaslt_TN_150,0.0184596
GemmStridedBatchedTunableOp_Half_TN,tn_966_966_128_B_16,Gemm_Rocblas_621294536,0.0275205
GemmStridedBatchedTunableOp_Half_TN,tn_935_935_128_B_16,Gemm_Rocblas_621294536,0.0275129
GemmStridedBatchedTunableOp_Half_TN,tn_830_830_128_B_16,Gemm_Rocblas_621286718,0.0245723
GemmStridedBatchedTunableOp_Half_TN,tn_851_851_128_B_16,Gemm_Rocblas_621294728,0.0258378
GemmStridedBatchedTunableOp_Half_TN,tn_815_815_128_B_16,Gemm_Hipblaslt_TN_158,0.0232709
GemmStridedBatchedTunableOp_Half_TN,tn_983_983_128_B_16,Gemm_Rocblas_621294536,0.0288952
GemmStridedBatchedTunableOp_Half_TN,tn_795_795_128_B_16,Gemm_Hipblaslt_TN_158,0.0229738
GemmStridedBatchedTunableOp_Half_TN,tn_964_964_128_B_16,Gemm_Rocblas_621286794,0.0273685
GemmStridedBatchedTunableOp_Half_TN,tn_887_887_128_B_16,Gemm_Rocblas_621294728,0.0265203
GemmStridedBatchedTunableOp_Half_TN,tn_893_893_128_B_16,Gemm_Rocblas_621294536,0.026567
GemmStridedBatchedTunableOp_Half_TN,tn_821_821_128_B_16,Gemm_Rocblas_621286811,0.0239767
GemmStridedBatchedTunableOp_Half_TN,tn_785_785_128_B_16,Gemm_Rocblas_621294402,0.0224512
GemmStridedBatchedTunableOp_Half_TN,tn_958_958_128_B_16,Gemm_Rocblas_621294536,0.0277156
GemmStridedBatchedTunableOp_Half_TN,tn_900_900_128_B_16,Gemm_Rocblas_621294536,0.0266261
GemmStridedBatchedTunableOp_Half_TN,tn_908_908_128_B_16,Gemm_Rocblas_621294536,0.0267399
GemmStridedBatchedTunableOp_Half_TN,tn_952_952_128_B_16,Gemm_Rocblas_621293994,0.0242564
GemmStridedBatchedTunableOp_Half_TN,tn_883_883_128_B_16,Gemm_Rocblas_621294728,0.0262192
GemmStridedBatchedTunableOp_Half_TN,tn_786_786_128_B_16,Gemm_Hipblaslt_TN_158,0.0217362
GemmStridedBatchedTunableOp_Half_TN,tn_926_926_128_B_16,Gemm_Rocblas_621294536,0.0271573
GemmStridedBatchedTunableOp_Half_TN,tn_831_831_128_B_16,Gemm_Hipblaslt_TN_158,0.0246793
GemmStridedBatchedTunableOp_Half_TN,tn_967_967_128_B_16,Gemm_Rocblas_621286794,0.0273079
GemmStridedBatchedTunableOp_Half_TN,tn_915_915_128_B_16,Gemm_Rocblas_621294536,0.0271332
GemmStridedBatchedTunableOp_Half_TN,tn_862_862_128_B_16,Gemm_Rocblas_621294728,0.0258887
GemmStridedBatchedTunableOp_Half_TN,tn_901_901_128_B_16,Gemm_Rocblas_621286794,0.0267722
GemmStridedBatchedTunableOp_Half_TN,tn_799_799_128_B_16,Gemm_Hipblaslt_TN_9602,0.0234306
GemmStridedBatchedTunableOp_Half_TN,tn_826_826_128_B_16,Gemm_Rocblas_621286811,0.0240255
GemmStridedBatchedTunableOp_Half_TN,tn_817_817_128_B_16,Gemm_Hipblaslt_TN_158,0.0239349
GemmStridedBatchedTunableOp_Half_TN,tn_965_965_128_B_16,Gemm_Rocblas_621294536,0.0276448
GemmStridedBatchedTunableOp_Half_TN,tn_853_853_128_B_16,Gemm_Rocblas_621286984,0.0258434
GemmStridedBatchedTunableOp_Half_TN,tn_837_837_128_B_16,Gemm_Hipblaslt_TN_158,0.0249037
GemmStridedBatchedTunableOp_Half_TN,tn_825_825_128_B_16,Gemm_Hipblaslt_TN_9602,0.0240737
GemmStridedBatchedTunableOp_Half_TN,tn_841_841_128_B_16,Gemm_Rocblas_621286794,0.0257367
GemmStridedBatchedTunableOp_Half_TN,tn_902_902_128_B_16,Gemm_Rocblas_621286794,0.0266266
GemmStridedBatchedTunableOp_Half_TN,tn_931_931_128_B_16,Gemm_Rocblas_621286794,0.027227
GemmStridedBatchedTunableOp_Half_TN,tn_944_944_128_B_16,Gemm_Rocblas_621293994,0.0234783
GemmStridedBatchedTunableOp_Half_TN,tn_929_929_128_B_16,Gemm_Rocblas_621286794,0.0272532
GemmStridedBatchedTunableOp_Half_TN,tn_942_942_128_B_16,Gemm_Rocblas_621294536,0.0275585
GemmStridedBatchedTunableOp_Half_TN,tn_847_847_128_B_16,Gemm_Rocblas_621286811,0.0251327
GemmStridedBatchedTunableOp_Half_TN,tn_822_822_128_B_16,Gemm_Hipblaslt_TN_158,0.0243772
GemmStridedBatchedTunableOp_Half_TN,tn_906_906_128_B_16,Gemm_Rocblas_621286794,0.0266874
GemmStridedBatchedTunableOp_Half_TN,tn_823_823_128_B_16,Gemm_Rocblas_621294552,0.024605
GemmStridedBatchedTunableOp_Half_TN,tn_954_954_128_B_16,Gemm_Rocblas_621286794,0.027531
GemmStridedBatchedTunableOp_Half_TN,tn_990_990_128_B_16,Gemm_Rocblas_621294536,0.0273436
GemmStridedBatchedTunableOp_Half_TN,tn_843_843_128_B_16,Gemm_Rocblas_621294728,0.0257215
GemmStridedBatchedTunableOp_Half_TN,tn_800_800_128_B_16,Gemm_Hipblaslt_TN_150,0.0175214
GemmStridedBatchedTunableOp_Half_TN,tn_881_881_128_B_16,Gemm_Rocblas_621294728,0.0262886
GemmStridedBatchedTunableOp_Half_TN,tn_921_921_128_B_16,Gemm_Rocblas_621294536,0.0272138
GemmStridedBatchedTunableOp_Half_TN,tn_939_939_128_B_16,Gemm_Rocblas_621286794,0.0273059
GemmStridedBatchedTunableOp_Half_TN,tn_16_16_128_B_16,Gemm_Rocblas_621286266,0.00645248
GemmStridedBatchedTunableOp_Half_TN,tn_808_808_128_B_16,Gemm_Hipblaslt_TN_150,0.0190603
GemmStridedBatchedTunableOp_Half_TN,tn_880_880_128_B_16,Gemm_Hipblaslt_TN_150,0.0196191
GemmStridedBatchedTunableOp_Half_TN,tn_930_930_128_B_16,Gemm_Rocblas_621294536,0.0272861
GemmStridedBatchedTunableOp_Half_TN,tn_970_970_128_B_16,Gemm_Rocblas_621294536,0.0275583
GemmStridedBatchedTunableOp_Half_TN,tn_974_974_128_B_16,Gemm_Rocblas_621294536,0.0273394
GemmStridedBatchedTunableOp_Half_TN,tn_895_895_128_B_16,Gemm_Rocblas_621286794,0.0265648
GemmStridedBatchedTunableOp_Half_TN,tn_879_879_128_B_16,Gemm_Rocblas_621294728,0.026119
GemmStridedBatchedTunableOp_Half_TN,tn_875_875_128_B_16,Gemm_Rocblas_621286984,0.0262384
GemmStridedBatchedTunableOp_Half_TN,tn_816_816_128_B_16,Gemm_Hipblaslt_TN_150,0.0184997
GemmStridedBatchedTunableOp_Half_TN,tn_905_905_128_B_16,Gemm_Rocblas_621294536,0.0267867
GemmStridedBatchedTunableOp_Half_TN,tn_917_917_128_B_16,Gemm_Rocblas_621286794,0.0271721
GemmStridedBatchedTunableOp_Half_TN,tn_909_909_128_B_16,Gemm_Rocblas_621286794,0.0264631
GemmStridedBatchedTunableOp_Half_TN,tn_824_824_128_B_16,Gemm_Hipblaslt_TN_150,0.0191953
GemmStridedBatchedTunableOp_Half_TN,tn_913_913_128_B_16,Gemm_Rocblas_621286794,0.0271695
GemmStridedBatchedTunableOp_Half_TN,tn_933_933_128_B_16,Gemm_Rocblas_621294536,0.0273133
GemmStridedBatchedTunableOp_Half_TN,tn_819_819_128_B_16,Gemm_Hipblaslt_TN_158,0.0241931
GemmStridedBatchedTunableOp_Half_TN,tn_839_839_128_B_16,Gemm_Rocblas_621286794,0.0256822
GemmStridedBatchedTunableOp_Half_TN,tn_837_837_128_B_16,Gemm_Hipblaslt_TN_158,0.0255378
GemmStridedBatchedTunableOp_Half_TN,tn_966_966_128_B_16,Gemm_Rocblas_621294536,0.0278768
GemmStridedBatchedTunableOp_Half_TN,tn_936_936_128_B_16,Gemm_Rocblas_621293994,0.024184
GemmStridedBatchedTunableOp_Half_TN,tn_825_825_128_B_16,Gemm_Hipblaslt_TN_158,0.0249689
GemmStridedBatchedTunableOp_Half_TN,tn_982_982_128_B_16,Gemm_Rocblas_621286794,0.0286553
GemmStridedBatchedTunableOp_Half_TN,tn_836_836_128_B_16,Gemm_Rocblas_621294635,0.0248398
GemmStridedBatchedTunableOp_Half_TN,tn_810_810_128_B_16,Gemm_Hipblaslt_TN_158,0.0231064
GemmStridedBatchedTunableOp_Half_TN,tn_833_833_128_B_16,Gemm_Rocblas_621294552,0.0248542
GemmStridedBatchedTunableOp_Half_TN,tn_874_874_128_B_16,Gemm_Rocblas_621294728,0.0262079
GemmStridedBatchedTunableOp_Half_TN,tn_943_943_128_B_16,Gemm_Rocblas_621294536,0.0276198
GemmStridedBatchedTunableOp_Half_TN,tn_832_832_128_B_16,Gemm_Hipblaslt_TN_150,0.0178059
GemmStridedBatchedTunableOp_Half_TN,tn_937_937_128_B_16,Gemm_Rocblas_621286794,0.0276015
GemmStridedBatchedTunableOp_Half_TN,tn_945_945_128_B_16,Gemm_Rocblas_621286794,0.028219
GemmStridedBatchedTunableOp_Half_TN,tn_981_981_128_B_16,Gemm_Rocblas_621286794,0.0279536
GemmStridedBatchedTunableOp_Half_TN,tn_920_920_128_B_16,Gemm_Rocblas_621293994,0.0241921
GemmStridedBatchedTunableOp_Half_TN,tn_906_906_128_B_16,Gemm_Rocblas_621294536,0.0268553
GemmStridedBatchedTunableOp_Half_TN,tn_970_970_128_B_16,Gemm_Rocblas_621286794,0.0286569
GemmStridedBatchedTunableOp_Half_TN,tn_817_817_128_B_16,Gemm_Hipblaslt_TN_158,0.0239597
GemmStridedBatchedTunableOp_Half_TN,tn_897_897_128_B_16,Gemm_Rocblas_621294536,0.0266766
GemmStridedBatchedTunableOp_Half_TN,tn_915_915_128_B_16,Gemm_Rocblas_621294536,0.0274562
GemmStridedBatchedTunableOp_Half_TN,tn_925_925_128_B_16,Gemm_Rocblas_621286794,0.0272781
GemmStridedBatchedTunableOp_Half_TN,tn_850_850_128_B_16,Gemm_Rocblas_621286984,0.0256863
GemmStridedBatchedTunableOp_Half_TN,tn_921_921_128_B_16,Gemm_Rocblas_621294536,0.0270218
GemmStridedBatchedTunableOp_Half_TN,tn_884_884_128_B_16,Gemm_Rocblas_621294728,0.0258472
GemmStridedBatchedTunableOp_Half_TN,tn_809_809_128_B_16,Gemm_Hipblaslt_TN_158,0.0230757
GemmStridedBatchedTunableOp_Half_TN,tn_898_898_128_B_16,Gemm_Rocblas_621286794,0.0266396
GemmStridedBatchedTunableOp_Half_TN,tn_950_950_128_B_16,Gemm_Rocblas_621286794,0.0281585
GemmStridedBatchedTunableOp_Half_TN,tn_792_792_128_B_16,Gemm_Hipblaslt_TN_150,0.0200491
GemmStridedBatchedTunableOp_Half_TN,tn_789_789_128_B_16,Gemm_Hipblaslt_TN_158,0.0221595
GemmStridedBatchedTunableOp_Half_TN,tn_878_878_128_B_16,Gemm_Rocblas_621294728,0.0259525
GemmStridedBatchedTunableOp_Half_TN,tn_911_911_128_B_16,Gemm_Rocblas_621294536,0.0269841
GemmStridedBatchedTunableOp_Half_TN,tn_880_880_128_B_16,Gemm_Hipblaslt_TN_150,0.0187283
GemmStridedBatchedTunableOp_Half_TN,tn_995_995_128_B_16,Gemm_Rocblas_621294536,0.028531
GemmStridedBatchedTunableOp_Half_TN,tn_904_904_128_B_16,Gemm_Rocblas_621293994,0.0240949
GemmStridedBatchedTunableOp_Half_TN,tn_882_882_128_B_16,Gemm_Rocblas_621294728,0.0261561
GemmStridedBatchedTunableOp_Half_TN,tn_859_859_128_B_16,Gemm_Rocblas_621286984,0.0261577
GemmStridedBatchedTunableOp_Half_TN,tn_816_816_128_B_16,Gemm_Hipblaslt_TN_150,0.0186221
GemmStridedBatchedTunableOp_Half_TN,tn_864_864_128_B_16,Gemm_Hipblaslt_TN_150,0.018344
GemmStridedBatchedTunableOp_Half_TN,tn_847_847_128_B_16,Gemm_Rocblas_621286794,0.0257832
GemmStridedBatchedTunableOp_Half_TN,tn_868_868_128_B_16,Gemm_Rocblas_621286718,0.0256974
GemmStridedBatchedTunableOp_Half_TN,tn_942_942_128_B_16,Gemm_Rocblas_621294536,0.0278419
GemmStridedBatchedTunableOp_Half_TN,tn_929_929_128_B_16,Gemm_Rocblas_621294536,0.0276246
GemmStridedBatchedTunableOp_Half_TN,tn_806_806_128_B_16,Gemm_Hipblaslt_TN_158,0.0229303
GemmStridedBatchedTunableOp_Half_TN,tn_821_821_128_B_16,Gemm_Rocblas_621286984,0.0246964
GemmStridedBatchedTunableOp_Half_TN,tn_887_887_128_B_16,Gemm_Rocblas_621294728,0.0264634
GemmStridedBatchedTunableOp_Half_TN,tn_983_983_128_B_16,Gemm_Rocblas_621294536,0.0279047
GemmStridedBatchedTunableOp_Half_TN,tn_890_890_128_B_16,Gemm_Rocblas_621294536,0.0263657
GemmStridedBatchedTunableOp_Half_TN,tn_974_974_128_B_16,Gemm_Rocblas_621286794,0.0280517
GemmStridedBatchedTunableOp_Half_TN,tn_877_877_128_B_16,Gemm_Rocblas_621294728,0.0262213
GemmStridedBatchedTunableOp_Half_TN,tn_916_916_128_B_16,Gemm_Rocblas_621286794,0.0272928
GemmStridedBatchedTunableOp_Half_TN,tn_834_834_128_B_16,Gemm_Hipblaslt_TN_158,0.025271
GemmStridedBatchedTunableOp_Half_TN,tn_940_940_128_B_16,Gemm_Rocblas_621294536,0.0274347
GemmStridedBatchedTunableOp_Half_TN,tn_968_968_128_B_16,Gemm_Rocblas_621293994,0.0246819
GemmStridedBatchedTunableOp_Half_TN,tn_800_800_128_B_16,Gemm_Rocblas_621286811,0.0206018
GemmStridedBatchedTunableOp_Half_TN,tn_991_991_128_B_16,Gemm_Rocblas_621286794,0.0282918
GemmStridedBatchedTunableOp_Half_TN,tn_846_846_128_B_16,Gemm_Rocblas_621294728,0.0255357
GemmStridedBatchedTunableOp_Half_TN,tn_865_865_128_B_16,Gemm_Rocblas_621286794,0.0260774
GemmStridedBatchedTunableOp_Half_TN,tn_963_963_128_B_16,Gemm_Rocblas_621294536,0.0281999
GemmStridedBatchedTunableOp_Half_TN,tn_986_986_128_B_16,Gemm_Rocblas_621286794,0.0289596
GemmStridedBatchedTunableOp_Half_TN,tn_891_891_128_B_16,Gemm_Rocblas_621294536,0.0265393
GemmStridedBatchedTunableOp_Half_TN,tn_852_852_128_B_16,Gemm_Rocblas_621294460,0.0254378
GemmStridedBatchedTunableOp_Half_TN,tn_914_914_128_B_16,Gemm_Rocblas_621294536,0.0273975
GemmStridedBatchedTunableOp_Half_TN,tn_899_899_128_B_16,Gemm_Rocblas_621286794,0.0265766
GemmStridedBatchedTunableOp_Half_TN,tn_988_988_128_B_16,Gemm_Rocblas_621286794,0.0278524
GemmStridedBatchedTunableOp_Half_TN,tn_811_811_128_B_16,Gemm_Hipblaslt_TN_158,0.0235709
GemmStridedBatchedTunableOp_Half_TN,tn_951_951_128_B_16,Gemm_Rocblas_621286794,0.0274491
GemmStridedBatchedTunableOp_Half_TN,tn_818_818_128_B_16,Gemm_Hipblaslt_TN_9602,0.024052
GemmStridedBatchedTunableOp_Half_TN,tn_805_805_128_B_16,Gemm_Hipblaslt_TN_158,0.022852
GemmStridedBatchedTunableOp_Half_TN,tn_855_855_128_B_16,Gemm_Rocblas_621294728,0.0258797
GemmStridedBatchedTunableOp_Half_TN,tn_872_872_128_B_16,Gemm_Hipblaslt_TN_150,0.019456
GemmStridedBatchedTunableOp_Half_TN,tn_949_949_128_B_16,Gemm_Rocblas_621286794,0.0283999
GemmStridedBatchedTunableOp_Half_TN,tn_903_903_128_B_16,Gemm_Rocblas_621286794,0.0267209
GemmStridedBatchedTunableOp_Half_TN,tn_938_938_128_B_16,Gemm_Rocblas_621294536,0.0281427
GemmStridedBatchedTunableOp_Half_TN,tn_907_907_128_B_16,Gemm_Rocblas_621286794,0.026746
GemmStridedBatchedTunableOp_Half_TN,tn_923_923_128_B_16,Gemm_Rocblas_621294536,0.0275061
GemmStridedBatchedTunableOp_Half_TN,tn_797_797_128_B_16,Gemm_Hipblaslt_TN_158,0.0230796
GemmStridedBatchedTunableOp_Half_TN,tn_866_866_128_B_16,Gemm_Rocblas_621294728,0.0260623
GemmStridedBatchedTunableOp_Half_TN,tn_985_985_128_B_16,Gemm_Rocblas_621294536,0.028785
GemmStridedBatchedTunableOp_Half_TN,tn_987_987_128_B_16,Gemm_Rocblas_621286794,0.0286995
GemmStridedBatchedTunableOp_Half_TN,tn_823_823_128_B_16,Gemm_Hipblaslt_TN_158,0.0243176
GemmStridedBatchedTunableOp_Half_TN,tn_999_999_128_B_16,Gemm_Rocblas_621286794,0.028979
GemmStridedBatchedTunableOp_Half_TN,tn_835_835_128_B_16,Gemm_Hipblaslt_TN_158,0.0252438
GemmStridedBatchedTunableOp_Half_TN,tn_876_876_128_B_16,Gemm_Rocblas_621294728,0.0258504
GemmStridedBatchedTunableOp_Half_TN,tn_969_969_128_B_16,Gemm_Rocblas_621294536,0.0284718
GemmStridedBatchedTunableOp_Half_TN,tn_989_989_128_B_16,Gemm_Rocblas_621286794,0.0289034
GemmStridedBatchedTunableOp_Half_TN,tn_922_922_128_B_16,Gemm_Rocblas_621286794,0.027438
GemmStridedBatchedTunableOp_Half_TN,tn_975_975_128_B_16,Gemm_Rocblas_621294536,0.0289659
GemmStridedBatchedTunableOp_Half_TN,tn_926_926_128_B_16,Gemm_Rocblas_621286794,0.027418
GemmStridedBatchedTunableOp_Half_TN,tn_860_860_128_B_16,Gemm_Rocblas_621286718,0.0256348
GemmTunableOp_Half_TN,tn_4096_1778_2048,Gemm_Hipblaslt_TN_9329,0.0623622
GemmTunableOp_Half_TN,tn_4096_877_2048,Gemm_Hipblaslt_TN_9576,0.0367937
GemmTunableOp_Half_TN,tn_14336_888_4096,Gemm_Hipblaslt_TN_9677,0.182487
GemmTunableOp_Half_TN,tn_4096_2636_2048,Gemm_Hipblaslt_TN_9689,0.0839005
GemmTunableOp_Half_TN,tn_14336_2675_4096,Gemm_Hipblaslt_TN_9793,0.535386
GemmTunableOp_Half_TN,tn_14336_881_4096,Gemm_Hipblaslt_TN_9139,0.179551
GemmTunableOp_Half_TN,tn_14336_865_4096,Gemm_Hipblaslt_TN_9187,0.181253
GemmTunableOp_Half_TN,tn_14336_8049_4096,Gemm_Hipblaslt_TN_9914,1.52813
GemmTunableOp_Half_TN,tn_3072_2517_4096,Gemm_Hipblaslt_TN_9134,0.11949
GemmTunableOp_Half_TN,tn_14336_1905_4096,Gemm_Hipblaslt_TN_9192,0.372438
GemmTunableOp_Half_TN,tn_14336_2602_4096,Gemm_Hipblaslt_TN_9793,0.530403
GemmTunableOp_Half_TN,tn_4096_850_7168,Gemm_Hipblaslt_TN_9547,0.112916
GemmTunableOp_Half_TN,tn_4096_1886_2048,Gemm_Hipblaslt_TN_9590,0.0639617
GemmTunableOp_Half_TN,tn_64128_112_4096,Gemm_Hipblaslt_TN_9264,0.199127
GemmTunableOp_Half_TN,tn_64128_211_4096,Gemm_Hipblaslt_TN_9271,0.272692
GemmTunableOp_Half_TN,tn_4096_2571_2048,Gemm_Hipblaslt_TN_9687,0.0839671
GemmTunableOp_Half_TN,tn_4096_866_2048,Gemm_Hipblaslt_TN_9577,0.0368648
GemmTunableOp_Half_TN,tn_4096_1746_7168,Gemm_Hipblaslt_TN_9673,0.194562
GemmTunableOp_Half_TN,tn_4096_1673_7168,Gemm_Hipblaslt_TN_9587,0.18239
GemmTunableOp_Half_TN,tn_3072_7798_4096,Gemm_Hipblaslt_TN_9672,0.335722
GemmTunableOp_Half_TN,tn_3072_808_4096,Gemm_Hipblaslt_TN_9047,0.0519584
GemmTunableOp_Half_TN,tn_14336_2750_4096,Gemm_Hipblaslt_TN_9192,0.548617
GemmTunableOp_Half_TN,tn_4096_887_7168,Gemm_Hipblaslt_TN_9640,0.11769
GemmTunableOp_Half_TN,tn_64128_104_4096,Gemm_Hipblaslt_TN_9061,0.197957
GemmTunableOp_Half_TN,tn_4096_922_2048,Gemm_Hipblaslt_TN_9577,0.0366709
GemmTunableOp_Half_TN,tn_4096_896_7168,Gemm_Rocblas_621286770,0.115612
GemmTunableOp_Half_TN,tn_3072_896_4096,Gemm_Rocblas_621286503,0.0586367
GemmTunableOp_Half_TN,tn_4096_2592_7168,Gemm_Hipblaslt_TN_9799,0.268581
GemmTunableOp_Half_TN,tn_4096_1831_7168,Gemm_Hipblaslt_TN_9680,0.203723
GemmTunableOp_Half_TN,tn_14336_898_4096,Gemm_Hipblaslt_TN_9677,0.183641
GemmTunableOp_Half_TN,tn_4096_2651_2048,Gemm_Hipblaslt_TN_9672,0.0841296
GemmTunableOp_Half_TN,tn_14336_2872_4096,Gemm_Hipblaslt_TN_9697,0.560955
GemmTunableOp_Half_TN,tn_3072_840_4096,Gemm_Hipblaslt_TN_9368,0.0531593
GemmTunableOp_Half_TN,tn_3072_1897_4096,Gemm_Hipblaslt_TN_9615,0.0950192
GemmTunableOp_Half_TN,tn_3072_1829_4096,Gemm_Hipblaslt_TN_9324,0.0905477
GemmTunableOp_Half_TN,tn_64128_190_4096,Gemm_Hipblaslt_TN_9862,0.251204
GemmTunableOp_Half_TN,tn_4096_913_2048,Gemm_Hipblaslt_TN_9604,0.0377266
GemmTunableOp_Half_TN,tn_3072_1835_4096,Gemm_Hipblaslt_TN_9148,0.0927698
GemmTunableOp_Half_TN,tn_4096_892_7168,Gemm_Hipblaslt_TN_9547,0.115507
GemmTunableOp_Half_TN,tn_4096_2606_7168,Gemm_Hipblaslt_TN_9799,0.269257
GemmTunableOp_Half_TN,tn_4096_814_7168,Gemm_Hipblaslt_TN_9158,0.106628
GemmTunableOp_Half_TN,tn_4096_802_2048,Gemm_Hipblaslt_TN_9352,0.0338176
GemmTunableOp_Half_TN,tn_3072_802_4096,Gemm_Hipblaslt_TN_9368,0.051264
GemmTunableOp_Half_TN,tn_4096_1727_2048,Gemm_Hipblaslt_TN_9164,0.0576078
GemmTunableOp_Half_TN,tn_4096_895_2048,Gemm_Hipblaslt_TN_9252,0.0372855
GemmTunableOp_Half_TN,tn_4096_985_7168,Gemm_Hipblaslt_TN_9160,0.121183
GemmTunableOp_Half_TN,tn_3072_954_4096,Gemm_Hipblaslt_TN_9546,0.0591117
GemmTunableOp_Half_TN,tn_4096_915_2048,Gemm_Hipblaslt_TN_9577,0.0365003
GemmTunableOp_Half_TN,tn_3072_853_4096,Gemm_Hipblaslt_TN_9047,0.0537853
GemmTunableOp_Half_TN,tn_3072_890_4096,Gemm_Hipblaslt_TN_9131,0.0566685
GemmTunableOp_Half_TN,tn_4096_1792_7168,Gemm_Hipblaslt_TN_9329,0.199086
GemmTunableOp_Half_TN,tn_3072_1733_4096,Gemm_Hipblaslt_TN_9163,0.090241
GemmTunableOp_Half_TN,tn_4096_924_7168,Gemm_Hipblaslt_TN_9576,0.11824
GemmTunableOp_Half_TN,tn_64128_90_4096,Gemm_Hipblaslt_TN_9057,0.180287
GemmTunableOp_Half_TN,tn_4096_924_2048,Gemm_Hipblaslt_TN_9604,0.0354876
GemmTunableOp_Half_TN,tn_64128_19_4096,Gemm_Hipblaslt_TN_9094,0.144428
GemmTunableOp_Half_TN,tn_4096_816_7168,Gemm_Hipblaslt_TN_9158,0.104752
GemmTunableOp_Half_TN,tn_14336_936_4096,Gemm_Hipblaslt_TN_9139,0.182551
GemmTunableOp_Half_TN,tn_4096_823_2048,Gemm_Hipblaslt_TN_9352,0.0338669
GemmTunableOp_Half_TN,tn_14336_906_4096,Gemm_Hipblaslt_TN_9677,0.182108
GemmTunableOp_Half_TN,tn_3072_923_4096,Gemm_Hipblaslt_TN_9546,0.0571763
GemmTunableOp_Half_TN,tn_4096_785_7168,Gemm_Hipblaslt_TN_9147,0.106525
GemmTunableOp_Half_TN,tn_4096_2648_7168,Gemm_Hipblaslt_TN_9672,0.271467
GemmTunableOp_Half_TN,tn_3072_7992_4096,Gemm_Hipblaslt_TN_9622,0.339511
GemmTunableOp_Half_TN,tn_4096_799_7168,Gemm_Hipblaslt_TN_9158,0.102972
GemmTunableOp_Half_TN,tn_4096_7857_2048,Gemm_Hipblaslt_TN_9713,0.229636
GemmTunableOp_Half_TN,tn_4096_938_7168,Gemm_Hipblaslt_TN_9604,0.118887
GemmTunableOp_Half_TN,tn_4096_128_7168,Gemm_Hipblaslt_TN_9438,0.0280503
GemmTunableOp_Half_TN,tn_3072_884_4096,Gemm_Hipblaslt_TN_9546,0.0567997
GemmTunableOp_Half_TN,tn_4096_825_7168,Gemm_Hipblaslt_TN_9147,0.109544
GemmTunableOp_Half_TN,tn_14336_1775_4096,Gemm_Hipblaslt_TN_9677,0.36272
GemmTunableOp_Half_TN,tn_4096_7798_7168,Gemm_Hipblaslt_TN_9753,0.72981
GemmTunableOp_Half_TN,tn_4096_934_2048,Gemm_Hipblaslt_TN_9576,0.0376689
GemmTunableOp_Half_TN,tn_4096_2672_7168,Gemm_Hipblaslt_TN_9690,0.271454
GemmTunableOp_Half_TN,tn_3072_815_4096,Gemm_Hipblaslt_TN_9047,0.0533108
GemmTunableOp_Half_TN,tn_4096_3752_2048,Gemm_Hipblaslt_TN_9768,0.110004
GemmTunableOp_Half_TN,tn_4096_852_2048,Gemm_Hipblaslt_TN_9608,0.035143
GemmTunableOp_Half_TN,tn_4096_8000_7168,Gemm_Hipblaslt_TN_9890,0.742311
GemmTunableOp_Half_TN,tn_3072_882_4096,Gemm_Hipblaslt_TN_9147,0.0576807
GemmTunableOp_Half_TN,tn_4096_3430_7168,Gemm_Hipblaslt_TN_9139,0.33122
GemmTunableOp_Half_TN,tn_3072_256_4096,Gemm_Rocblas_621286444,0.0227449
GemmTunableOp_Half_TN,tn_3072_2672_4096,Gemm_Hipblaslt_TN_9620,0.124047
GemmTunableOp_Half_TN,tn_4096_906_7168,Gemm_Hipblaslt_TN_9604,0.118252
GemmTunableOp_Half_TN,tn_14336_1673_4096,Gemm_Hipblaslt_TN_9677,0.35371
GemmTunableOp_Half_TN,tn_14336_3571_4096,Gemm_Hipblaslt_TN_9223,0.662434
GemmTunableOp_Half_TN,tn_14336_842_4096,Gemm_Hipblaslt_TN_9697,0.179352
GemmTunableOp_Half_TN,tn_3072_944_4096,Gemm_Hipblaslt_TN_9251,0.0603293
GemmTunableOp_Half_TN,tn_4096_1791_7168,Gemm_Hipblaslt_TN_9329,0.198538
GemmTunableOp_Half_TN,tn_4096_168_7168,Gemm_Rocblas_621286440,0.0387474
GemmTunableOp_Half_TN,tn_3072_8110_4096,Gemm_Rocblas_621294473,0.349122
GemmTunableOp_Half_TN,tn_3072_168_4096,Gemm_Rocblas_621286436,0.0180411
GemmTunableOp_Half_TN,tn_14336_192_4096,Gemm_Hipblaslt_TN_9352,0.0591094
GemmTunableOp_Half_TN,tn_4096_32_2048,Gemm_Rocblas_621294144,0.00718558
GemmTunableOp_Half_TN,tn_64128_6_4096,Gemm_Rocblas_621286300,0.139596
GemmTunableOp_Half_TN,tn_3072_1672_4096,Gemm_Rocblas_621294520,0.0870678
GemmTunableOp_Half_TN,tn_4096_1954_7168,Gemm_Hipblaslt_TN_9267,0.209704
GemmTunableOp_Half_TN,tn_14336_216_4096,Gemm_Hipblaslt_TN_9604,0.0659328
GemmTunableOp_Half_TN,tn_14336_937_4096,Gemm_Hipblaslt_TN_9697,0.184842
GemmTunableOp_Half_TN,tn_4096_1813_7168,Gemm_Hipblaslt_TN_9268,0.202776
GemmTunableOp_Half_TN,tn_4096_2734_2048,Gemm_Hipblaslt_TN_9689,0.0866884
GemmTunableOp_Half_TN,tn_64128_231_4096,Gemm_Rocblas_621294643,0.294368
GemmTunableOp_Half_TN,tn_4096_8070_7168,Gemm_Rocblas_621294420,0.750564
GemmTunableOp_Half_TN,tn_4096_1815_2048,Gemm_Hipblaslt_TN_9590,0.062694
GemmTunableOp_Half_TN,tn_3072_857_4096,Gemm_Hipblaslt_TN_9047,0.0537342
GemmTunableOp_Half_TN,tn_4096_977_2048,Gemm_Hipblaslt_TN_9577,0.0386003
GemmTunableOp_Half_TN,tn_4096_8049_2048,Gemm_Hipblaslt_TN_9753,0.230397
GemmTunableOp_Half_TN,tn_4096_1807_7168,Gemm_Hipblaslt_TN_9137,0.201633
GemmTunableOp_Half_TN,tn_4096_7817_7168,Gemm_Rocblas_621286693,0.735359
GemmTunableOp_Half_TN,tn_64128_129_4096,Gemm_Hipblaslt_TN_9108,0.215416
GemmTunableOp_Half_TN,tn_3072_898_4096,Gemm_Hipblaslt_TN_9546,0.0569877
GemmTunableOp_Half_TN,tn_4096_3402_7168,Gemm_Hipblaslt_TN_9139,0.330147
GemmTunableOp_Half_TN,tn_4096_812_7168,Gemm_Hipblaslt_TN_9158,0.105464
GemmTunableOp_Half_TN,tn_3072_2630_4096,Gemm_Hipblaslt_TN_9329,0.120152
GemmTunableOp_Half_TN,tn_3072_8069_4096,Gemm_Hipblaslt_TN_9693,0.347539
GemmTunableOp_Half_TN,tn_3072_1881_4096,Gemm_Hipblaslt_TN_9324,0.092927
GemmTunableOp_Half_TN,tn_14336_915_4096,Gemm_Hipblaslt_TN_9697,0.184483
GemmTunableOp_Half_TN,tn_4096_865_2048,Gemm_Hipblaslt_TN_9356,0.0365017
GemmTunableOp_Half_TN,tn_14336_184_4096,Gemm_Hipblaslt_TN_9353,0.0598798
GemmTunableOp_Half_TN,tn_14336_7299_4096,Gemm_Hipblaslt_TN_9900,1.4156
GemmTunableOp_Half_TN,tn_3072_144_4096,Gemm_Rocblas_621294166,0.0175928
GemmTunableOp_Half_TN,tn_4096_144_2048,Gemm_Rocblas_621294171,0.0123978
GemmTunableOp_Half_TN,tn_4096_1954_2048,Gemm_Hipblaslt_TN_9137,0.0651898
GemmTunableOp_Half_TN,tn_4096_136_2048,Gemm_Rocblas_621294171,0.0122712
GemmTunableOp_Half_TN,tn_4096_872_7168,Gemm_Hipblaslt_TN_9547,0.115441
GemmTunableOp_Half_TN,tn_4096_3670_2048,Gemm_Hipblaslt_TN_9827,0.112061
GemmTunableOp_Half_TN,tn_14336_2517_4096,Gemm_Rocblas_621286684,0.503147
GemmTunableOp_Half_TN,tn_3072_1723_4096,Gemm_Hipblaslt_TN_9561,0.0875768
GemmTunableOp_Half_TN,tn_14336_8070_4096,Gemm_Hipblaslt_TN_9869,1.54239
GemmTunableOp_Half_TN,tn_14336_964_4096,Gemm_Hipblaslt_TN_9220,0.202971
GemmTunableOp_Half_TN,tn_4096_80_7168,Gemm_Hipblaslt_TN_9432,0.0239395
GemmTunableOp_Half_TN,tn_14336_1803_4096,Gemm_Hipblaslt_TN_9697,0.367688
GemmTunableOp_Half_TN,tn_3072_2717_4096,Gemm_Hipblaslt_TN_9567,0.125466
GemmTunableOp_Half_TN,tn_3072_859_4096,Gemm_Hipblaslt_TN_9047,0.0541778
GemmTunableOp_Half_TN,tn_64128_183_4096,Gemm_Hipblaslt_TN_9862,0.249643
GemmTunableOp_Half_TN,tn_14336_40_4096,Gemm_Rocblas_621294557,0.0286783
GemmTunableOp_Half_TN,tn_3072_832_4096,Gemm_Hipblaslt_TN_9047,0.0536364
GemmTunableOp_Half_TN,tn_4096_3662_2048,Gemm_Hipblaslt_TN_9704,0.11059
GemmTunableOp_Half_TN,tn_4096_935_2048,Gemm_Hipblaslt_TN_9585,0.038643
GemmTunableOp_Half_TN,tn_14336_863_4096,Gemm_Hipblaslt_TN_9677,0.180424
GemmTunableOp_Half_TN,tn_3072_24_4096,Gemm_Rocblas_621294054,0.00924669
GemmTunableOp_Half_TN,tn_4096_3418_2048,Gemm_Hipblaslt_TN_9896,0.100308
GemmTunableOp_Half_TN,tn_4096_917_7168,Gemm_Hipblaslt_TN_9576,0.117274
GemmTunableOp_Half_TN,tn_3072_5606_4096,Gemm_Hipblaslt_TN_9624,0.25388
GemmTunableOp_Half_TN,tn_3072_814_4096,Gemm_Hipblaslt_TN_9047,0.0524393
GemmTunableOp_Half_TN,tn_14336_803_4096,Gemm_Hipblaslt_TN_9187,0.176545
GemmTunableOp_Half_TN,tn_4096_829_7168,Gemm_Hipblaslt_TN_9147,0.110697
GemmTunableOp_Half_TN,tn_14336_969_4096,Gemm_Hipblaslt_TN_9220,0.204692
GemmTunableOp_Half_TN,tn_14336_104_4096,Gemm_Rocblas_621294207,0.0397205
GemmTunableOp_Half_TN,tn_14336_2826_4096,Gemm_Hipblaslt_TN_9697,0.557643
GemmTunableOp_Half_TN,tn_4096_916_7168,Gemm_Hipblaslt_TN_9604,0.116566
GemmTunableOp_Half_TN,tn_4096_921_2048,Gemm_Hipblaslt_TN_9577,0.0376485
GemmTunableOp_Half_TN,tn_4096_956_2048,Gemm_Hipblaslt_TN_9604,0.0372107
GemmTunableOp_Half_TN,tn_14336_1726_4096,Gemm_Hipblaslt_TN_9192,0.357282
GemmTunableOp_Half_TN,tn_4096_7823_2048,Gemm_Hipblaslt_TN_9713,0.227439
GemmTunableOp_Half_TN,tn_3072_3711_4096,Gemm_Hipblaslt_TN_9852,0.163966
GemmTunableOp_Half_TN,tn_3072_899_4096,Gemm_Hipblaslt_TN_9546,0.0570613
GemmTunableOp_Half_TN,tn_4096_2544_2048,Gemm_Hipblaslt_TN_9687,0.0816699
GemmTunableOp_Half_TN,tn_14336_2805_4096,Gemm_Hipblaslt_TN_9677,0.55907
GemmTunableOp_Half_TN,tn_4096_2773_7168,Gemm_Hipblaslt_TN_9672,0.280866
GemmTunableOp_Half_TN,tn_4096_983_7168,Gemm_Hipblaslt_TN_9170,0.12135
GemmTunableOp_Half_TN,tn_3072_2682_4096,Gemm_Hipblaslt_TN_9134,0.122755
GemmTunableOp_Half_TN,tn_4096_917_2048,Gemm_Hipblaslt_TN_9577,0.0376278
GemmTunableOp_Half_TN,tn_3072_804_4096,Gemm_Hipblaslt_TN_9047,0.0509854
GemmTunableOp_Half_TN,tn_4096_2517_2048,Gemm_Hipblaslt_TN_9672,0.0810497
GemmTunableOp_Half_TN,tn_4096_2599_2048,Gemm_Hipblaslt_TN_9674,0.0837812
GemmTunableOp_Half_TN,tn_14336_1829_4096,Gemm_Hipblaslt_TN_9677,0.366788
GemmTunableOp_Half_TN,tn_14336_2708_4096,Gemm_Hipblaslt_TN_9192,0.549598
GemmTunableOp_Half_TN,tn_4096_4471_2048,Gemm_Hipblaslt_TN_9763,0.136573
GemmTunableOp_Half_TN,tn_3072_2722_4096,Gemm_Hipblaslt_TN_9624,0.126475
GemmTunableOp_Half_TN,tn_64128_206_4096,Gemm_Hipblaslt_TN_9260,0.273544
GemmTunableOp_Half_TN,tn_3072_1757_4096,Gemm_Hipblaslt_TN_9133,0.0911609
GemmTunableOp_Half_TN,tn_4096_7809_2048,Gemm_Hipblaslt_TN_9191,0.227585
GemmTunableOp_Half_TN,tn_4096_947_2048,Gemm_Hipblaslt_TN_9577,0.0376887
GemmTunableOp_Half_TN,tn_64128_212_4096,Gemm_Hipblaslt_TN_9961,0.275099
GemmTunableOp_Half_TN,tn_4096_2601_2048,Gemm_Hipblaslt_TN_9674,0.082983
GemmTunableOp_Half_TN,tn_3072_977_4096,Gemm_Hipblaslt_TN_9352,0.0595192
GemmTunableOp_Half_TN,tn_14336_992_4096,Gemm_Hipblaslt_TN_9217,0.203522
GemmTunableOp_Half_TN,tn_64128_48_4096,Gemm_Hipblaslt_TN_9097,0.161532
GemmTunableOp_Half_TN,tn_14336_2572_4096,Gemm_Hipblaslt_TN_9793,0.52892
GemmTunableOp_Half_TN,tn_64128_94_4096,Gemm_Hipblaslt_TN_9057,0.181455
GemmTunableOp_Half_TN,tn_4096_1805_7168,Gemm_Hipblaslt_TN_9137,0.202804
GemmTunableOp_Half_TN,tn_4096_7299_2048,Gemm_Hipblaslt_TN_9903,0.219317
GemmTunableOp_Half_TN,tn_3072_88_4096,Gemm_Rocblas_621294029,0.0135062
GemmTunableOp_Half_TN,tn_64128_57_4096,Gemm_Hipblaslt_TN_9097,0.163135
GemmTunableOp_Half_TN,tn_4096_1697_7168,Gemm_Hipblaslt_TN_9164,0.183749
GemmTunableOp_Half_TN,tn_64128_142_4096,Gemm_Hipblaslt_TN_9108,0.222465
GemmTunableOp_Half_TN,tn_64128_54_4096,Gemm_Hipblaslt_TN_9097,0.161947
GemmTunableOp_Half_TN,tn_6144_4096_4096,Gemm_Rocblas_621286715,0.362268
GemmTunableOp_Half_TN,tn_64128_172_4096,Gemm_Hipblaslt_TN_9956,0.24704
GemmTunableOp_Half_TN,tn_3072_3571_4096,Gemm_Hipblaslt_TN_9570,0.157743
GemmTunableOp_Half_TN,tn_4096_1813_2048,Gemm_Hipblaslt_TN_9590,0.0632697
GemmTunableOp_Half_TN,tn_3072_2636_4096,Gemm_Hipblaslt_TN_9329,0.122422
GemmTunableOp_Half_TN,tn_3072_1834_4096,Gemm_Hipblaslt_TN_9324,0.0921497
GemmTunableOp_Half_TN,tn_4096_2734_7168,Gemm_Hipblaslt_TN_9672,0.280323
GemmTunableOp_Half_TN,tn_16000_256_4096,Gemm_Rocblas_621294217,0.0782385
GemmTunableOp_Half_TN,tn_3072_1850_4096,Gemm_Hipblaslt_TN_9324,0.0932913
GemmTunableOp_Half_TN,tn_4096_2675_7168,Gemm_Hipblaslt_TN_9674,0.271119
GemmTunableOp_Half_TN,tn_4096_889_2048,Gemm_Hipblaslt_TN_9576,0.0369172
GemmTunableOp_Half_TN,tn_3072_3670_4096,Gemm_Hipblaslt_TN_9657,0.164211
GemmTunableOp_Half_TN,tn_3072_4471_4096,Gemm_Hipblaslt_TN_9944,0.190687
GemmTunableOp_Half_TN,tn_64128_189_4096,Gemm_Hipblaslt_TN_9857,0.252097
GemmTunableOp_Half_TN,tn_4096_1743_7168,Gemm_Hipblaslt_TN_9673,0.195659
GemmTunableOp_Half_TN,tn_3072_957_4096,Gemm_Hipblaslt_TN_9352,0.0590651
GemmTunableOp_Half_TN,tn_3072_2537_4096,Gemm_Hipblaslt_TN_9624,0.121135
GemmTunableOp_Half_TN,tn_64128_150_4096,Gemm_Hipblaslt_TN_9108,0.223509
GemmTunableOp_Half_TN,tn_64128_234_4096,Gemm_Rocblas_621294658,0.290082
GemmTunableOp_Half_TN,tn_4096_1783_2048,Gemm_Hipblaslt_TN_9329,0.0630476
GemmTunableOp_Half_TN,tn_14336_986_4096,Gemm_Hipblaslt_TN_9217,0.20441
GemmTunableOp_Half_TN,tn_4096_904_7168,Gemm_Hipblaslt_TN_9576,0.116829
GemmTunableOp_Half_TN,tn_3072_972_4096,Gemm_Hipblaslt_TN_9131,0.0599678
GemmTunableOp_Half_TN,tn_4096_2636_7168,Gemm_Hipblaslt_TN_9799,0.269622
GemmTunableOp_Half_TN,tn_3072_1737_4096,Gemm_Hipblaslt_TN_9163,0.08892
GemmTunableOp_Half_TN,tn_4096_943_2048,Gemm_Hipblaslt_TN_9577,0.0374211
GemmTunableOp_Half_TN,tn_14336_812_4096,Gemm_Hipblaslt_TN_9677,0.1772
GemmTunableOp_Half_TN,tn_4096_803_7168,Gemm_Hipblaslt_TN_9158,0.108192
GemmTunableOp_Half_TN,tn_64128_240_4096,Gemm_Hipblaslt_TN_9122,0.290222
GemmTunableOp_Half_TN,tn_14336_1649_4096,Gemm_Hipblaslt_TN_9697,0.352344
GemmTunableOp_Half_TN,tn_4096_8000_2048,Gemm_Rocblas_621294030,0.22968
GemmTunableOp_Half_TN,tn_14336_905_4096,Gemm_Hipblaslt_TN_9677,0.181304
GemmTunableOp_Half_TN,tn_14336_861_4096,Gemm_Hipblaslt_TN_9677,0.181408
GemmTunableOp_Half_TN,tn_4096_1739_7168,Gemm_Hipblaslt_TN_9673,0.1946
GemmTunableOp_Half_TN,tn_4096_877_7168,Gemm_Hipblaslt_TN_9170,0.117037
GemmTunableOp_Half_TN,tn_14336_3556_4096,Gemm_Hipblaslt_TN_9217,0.663916
GemmTunableOp_Half_TN,tn_14336_947_4096,Gemm_Hipblaslt_TN_9192,0.187142
GemmTunableOp_Half_TN,tn_3072_839_4096,Gemm_Hipblaslt_TN_9251,0.0559194
GemmTunableOp_Half_TN,tn_3072_805_4096,Gemm_Hipblaslt_TN_9047,0.0521309
GemmTunableOp_Half_TN,tn_3072_825_4096,Gemm_Hipblaslt_TN_9047,0.0536706
GemmTunableOp_Half_TN,tn_3072_920_4096,Gemm_Hipblaslt_TN_9352,0.0578142
GemmTunableOp_Half_TN,tn_64128_226_4096,Gemm_Rocblas_621294658,0.286858
GemmTunableOp_Half_TN,tn_4096_943_7168,Gemm_Hipblaslt_TN_9604,0.119181
GemmTunableOp_Half_TN,tn_14336_4242_4096,Gemm_Hipblaslt_TN_9217,0.832782
GemmTunableOp_Half_TN,tn_64128_254_4096,Gemm_Rocblas_621286915,0.292585
GemmTunableOp_Half_TN,tn_4096_1742_7168,Gemm_Hipblaslt_TN_9673,0.195946
GemmTunableOp_Half_TN,tn_4096_1723_2048,Gemm_Hipblaslt_TN_9164,0.0570041
GemmTunableOp_Half_TN,tn_64128_130_4096,Gemm_Hipblaslt_TN_9108,0.218394
GemmTunableOp_Half_TN,tn_64128_13_4096,Gemm_Rocblas_621286348,0.143357
GemmTunableOp_Half_TN,tn_14336_823_4096,Gemm_Hipblaslt_TN_9677,0.176872
GemmTunableOp_Half_TN,tn_3072_988_4096,Gemm_Hipblaslt_TN_9158,0.0605004
GemmTunableOp_Half_TN,tn_3072_907_4096,Gemm_Hipblaslt_TN_9251,0.0594889
GemmTunableOp_Half_TN,tn_4096_817_2048,Gemm_Hipblaslt_TN_9604,0.0340635
GemmTunableOp_Half_TN,tn_4096_870_2048,Gemm_Hipblaslt_TN_9577,0.0361085
GemmTunableOp_Half_TN,tn_3072_1813_4096,Gemm_Rocblas_621286778,0.0904914
GemmTunableOp_Half_TN,tn_4096_96_2048,Gemm_Rocblas_621294027,0.00922865
GemmTunableOp_Half_TN,tn_4096_1822_2048,Gemm_Hipblaslt_TN_9590,0.0633899
GemmTunableOp_Half_TN,tn_14336_988_4096,Gemm_Hipblaslt_TN_9217,0.204028
GemmTunableOp_Half_TN,tn_3072_911_4096,Gemm_Hipblaslt_TN_9546,0.0565758
GemmTunableOp_Half_TN,tn_14336_96_4096,Gemm_Hipblaslt_TN_9350,0.037459
GemmTunableOp_Half_TN,tn_3072_908_4096,Gemm_Hipblaslt_TN_9352,0.0569459
GemmTunableOp_Half_TN,tn_4096_1864_7168,Gemm_Hipblaslt_TN_9645,0.206756
GemmTunableOp_Half_TN,tn_3072_992_4096,Gemm_Hipblaslt_TN_9158,0.0604063
GemmTunableOp_Half_TN,tn_4096_160_7168,Gemm_Rocblas_621286440,0.0366676
GemmTunableOp_Half_TN,tn_4096_871_7168,Gemm_Hipblaslt_TN_9634,0.1127
GemmTunableOp_Half_TN,tn_4096_983_2048,Gemm_Hipblaslt_TN_9576,0.039993
GemmTunableOp_Half_TN,tn_3072_961_4096,Gemm_Hipblaslt_TN_9251,0.059941
GemmTunableOp_Half_TN,tn_14336_914_4096,Gemm_Hipblaslt_TN_9677,0.18382
GemmTunableOp_Half_TN,tn_14336_128_4096,Gemm_Rocblas_621294233,0.0407747
GemmTunableOp_Half_TN,tn_4096_884_7168,Gemm_Hipblaslt_TN_9170,0.116729
GemmTunableOp_Half_TN,tn_14336_2560_4096,Gemm_Rocblas_621286684,0.499014
GemmTunableOp_Half_TN,tn_3072_2872_4096,Gemm_Hipblaslt_TN_9624,0.129044
GemmTunableOp_Half_TN,tn_3072_978_4096,Gemm_Hipblaslt_TN_9158,0.0597325
GemmTunableOp_Half_TN,tn_3072_947_4096,Gemm_Hipblaslt_TN_9131,0.0575856
GemmTunableOp_Half_TN,tn_64128_171_4096,Gemm_Hipblaslt_TN_9816,0.244631
GemmTunableOp_Half_TN,tn_64128_123_4096,Gemm_Rocblas_621286789,0.201653
GemmTunableOp_Half_TN,tn_3072_880_4096,Gemm_Hipblaslt_TN_9546,0.057129
GemmTunableOp_Half_TN,tn_14336_240_4096,Gemm_Hipblaslt_TN_9634,0.0653329
GemmTunableOp_Half_TN,tn_4096_3671_7168,Gemm_Hipblaslt_TN_9217,0.357311
GemmTunableOp_Half_TN,tn_14336_80_4096,Gemm_Hipblaslt_TN_9495,0.0326373
GemmTunableOp_Half_TN,tn_3072_803_4096,Gemm_Hipblaslt_TN_9047,0.0519626
GemmTunableOp_Half_TN,tn_3072_812_4096,Gemm_Hipblaslt_TN_9047,0.0522989
GemmTunableOp_Half_TN,tn_64128_11_4096,Gemm_Rocblas_621286348,0.143732
GemmTunableOp_Half_TN,tn_4096_2763_2048,Gemm_Hipblaslt_TN_9689,0.0869661
GemmTunableOp_Half_TN,tn_4096_844_7168,Gemm_Hipblaslt_TN_9604,0.112402
GemmTunableOp_Half_TN,tn_14336_2606_4096,Gemm_Hipblaslt_TN_9793,0.532524
GemmTunableOp_Half_TN,tn_14336_811_4096,Gemm_Hipblaslt_TN_9697,0.177507
GemmTunableOp_Half_TN,tn_4096_1913_7168,Gemm_Hipblaslt_TN_9267,0.208171
GemmTunableOp_Half_TN,tn_4096_919_7168,Gemm_Hipblaslt_TN_9585,0.118704
GemmTunableOp_Half_TN,tn_4096_863_2048,Gemm_Hipblaslt_TN_9352,0.0347968
GemmTunableOp_Half_TN,tn_3072_852_4096,Gemm_Hipblaslt_TN_8961,0.0563273
GemmTunableOp_Half_TN,tn_4096_1748_2048,Gemm_Hipblaslt_TN_9680,0.0618206
GemmTunableOp_Half_TN,tn_4096_8156_7168,Gemm_Hipblaslt_TN_9190,0.754419
GemmTunableOp_Half_TN,tn_4096_1726_7168,Gemm_Hipblaslt_TN_9164,0.184311
GemmTunableOp_Half_TN,tn_14336_3310_4096,Gemm_Hipblaslt_TN_9220,0.637895
GemmTunableOp_Half_TN,tn_4096_870_7168,Gemm_Hipblaslt_TN_9170,0.116606
GemmTunableOp_Half_TN,tn_64128_33_4096,Gemm_Hipblaslt_TN_9097,0.157534
GemmTunableOp_Half_TN,tn_4096_1822_7168,Gemm_Hipblaslt_TN_9136,0.201956
GemmTunableOp_Half_TN,tn_4096_1705_2048,Gemm_Hipblaslt_TN_9164,0.0578499
GemmTunableOp_Half_TN,tn_3072_921_4096,Gemm_Hipblaslt_TN_9131,0.0564938
GemmTunableOp_Half_TN,tn_3072_1806_4096,Gemm_Rocblas_621294520,0.0904488
GemmTunableOp_Half_TN,tn_4096_1883_7168,Gemm_Hipblaslt_TN_9134,0.207136
GemmTunableOp_Half_TN,tn_4096_839_2048,Gemm_Hipblaslt_TN_9251,0.0346926
GemmTunableOp_Half_TN,tn_64128_80_4096,Gemm_Hipblaslt_TN_9057,0.178257
GemmTunableOp_Half_TN,tn_14336_7436_4096,Gemm_Hipblaslt_TN_9890,1.45393
GemmTunableOp_Half_TN,tn_14336_3352_4096,Gemm_Hipblaslt_TN_9217,0.637996
GemmTunableOp_Half_TN,tn_14336_3752_4096,Gemm_Hipblaslt_TN_9677,0.741732
GemmTunableOp_Half_TN,tn_4096_879_2048,Gemm_Hipblaslt_TN_9578,0.0366408
GemmTunableOp_Half_TN,tn_4096_915_7168,Gemm_Hipblaslt_TN_9604,0.117223
GemmTunableOp_Half_TN,tn_4096_900_2048,Gemm_Hipblaslt_TN_9634,0.035336
GemmTunableOp_Half_TN,tn_3072_799_4096,Gemm_Hipblaslt_TN_9368,0.0521805
GemmTunableOp_Half_TN,tn_4096_861_7168,Gemm_Hipblaslt_TN_9634,0.113041
GemmTunableOp_Half_TN,tn_14336_944_4096,Gemm_Hipblaslt_TN_9677,0.182749
GemmTunableOp_Half_TN,tn_3072_1817_4096,Gemm_Rocblas_621286778,0.0899352
GemmTunableOp_Half_TN,tn_3072_854_4096,Gemm_Hipblaslt_TN_9047,0.053714
GemmTunableOp_Half_TN,tn_4096_7823_7168,Gemm_Hipblaslt_TN_9217,0.733619
GemmTunableOp_Half_TN,tn_4096_2601_7168,Gemm_Hipblaslt_TN_9674,0.269863
GemmTunableOp_Half_TN,tn_64128_41_4096,Gemm_Hipblaslt_TN_9097,0.158106
GemmTunableOp_Half_TN,tn_6144_256_4096,Gemm_Rocblas_621286469,0.0363425
GemmTunableOp_Half_TN,tn_64128_87_4096,Gemm_Hipblaslt_TN_9058,0.181371
GemmTunableOp_Half_TN,tn_4096_2560_7168,Gemm_Rocblas_621294447,0.260116
GemmTunableOp_Half_TN,tn_14336_949_4096,Gemm_Hipblaslt_TN_9697,0.186058
GemmTunableOp_Half_TN,tn_4096_1846_2048,Gemm_Hipblaslt_TN_9590,0.0631029
GemmTunableOp_Half_TN,tn_4096_1737_2048,Gemm_Hipblaslt_TN_9329,0.0620961
GemmTunableOp_Half_TN,tn_4096_2750_7168,Gemm_Hipblaslt_TN_9672,0.278975
GemmTunableOp_Half_TN,tn_4096_859_2048,Gemm_Hipblaslt_TN_9576,0.0357452
GemmTunableOp_Half_TN,tn_14336_136_4096,Gemm_Hipblaslt_TN_9312,0.0507367
GemmTunableOp_Half_TN,tn_3072_40_4096,Gemm_Rocblas_621294146,0.0107062
GemmTunableOp_Half_TN,tn_64128_140_4096,Gemm_Hipblaslt_TN_9108,0.220348
GemmTunableOp_Half_TN,tn_4096_876_7168,Gemm_Rocblas_621286770,0.115984
GemmTunableOp_Half_TN,tn_64128_217_4096,Gemm_Rocblas_621286797,0.274185
GemmTunableOp_Half_TN,tn_3072_1831_4096,Gemm_Hipblaslt_TN_9613,0.092705
GemmTunableOp_Half_TN,tn_3072_948_4096,Gemm_Hipblaslt_TN_9546,0.0584748
GemmTunableOp_Half_TN,tn_3072_2635_4096,Gemm_Hipblaslt_TN_9329,0.122432
GemmTunableOp_Half_TN,tn_14336_2571_4096,Gemm_Hipblaslt_TN_9793,0.527239
GemmTunableOp_Half_TN,tn_14336_971_4096,Gemm_Hipblaslt_TN_9217,0.202008
GemmTunableOp_Half_TN,tn_3072_2681_4096,Gemm_Hipblaslt_TN_9329,0.123254
GemmTunableOp_Half_TN,tn_4096_894_2048,Gemm_Hipblaslt_TN_9576,0.0370128
GemmTunableOp_Half_TN,tn_4096_40_2048,Gemm_Rocblas_621286428,0.00794868
GemmTunableOp_Half_TN,tn_3072_913_4096,Gemm_Hipblaslt_TN_9546,0.057274
GemmTunableOp_Half_TN,tn_14336_917_4096,Gemm_Hipblaslt_TN_9677,0.184116
GemmTunableOp_Half_TN,tn_3072_886_4096,Gemm_Hipblaslt_TN_9546,0.0565224
GemmTunableOp_Half_TN,tn_4096_3431_7168,Gemm_Hipblaslt_TN_9683,0.332235
GemmTunableOp_Half_TN,tn_64128_39_4096,Gemm_Hipblaslt_TN_9097,0.159033
GemmTunableOp_Half_TN,tn_4096_911_7168,Gemm_Hipblaslt_TN_9576,0.117588
GemmTunableOp_Half_TN,tn_4096_1614_2048,Gemm_Hipblaslt_TN_9607,0.055422
GemmTunableOp_Half_TN,tn_3072_925_4096,Gemm_Hipblaslt_TN_9546,0.0586949
GemmTunableOp_Half_TN,tn_4096_1649_2048,Gemm_Hipblaslt_TN_9587,0.0550406
GemmTunableOp_Half_TN,tn_14336_983_4096,Gemm_Hipblaslt_TN_9217,0.203943
GemmTunableOp_Half_TN,tn_4096_3507_7168,Gemm_Hipblaslt_TN_9677,0.336368
GemmTunableOp_Half_TN,tn_4096_830_2048,Gemm_Hipblaslt_TN_9577,0.0356124
GemmTunableOp_Half_TN,tn_14336_916_4096,Gemm_Hipblaslt_TN_9139,0.182303
GemmTunableOp_Half_TN,tn_14336_2537_4096,Gemm_Rocblas_621294426,0.504309
GemmTunableOp_Half_TN,tn_4096_968_2048,Gemm_Hipblaslt_TN_9578,0.0389045
GemmTunableOp_Half_TN,tn_3072_1795_4096,Gemm_Hipblaslt_TN_9322,0.0916259
GemmTunableOp_Half_TN,tn_4096_978_7168,Gemm_Hipblaslt_TN_9576,0.122519
GemmTunableOp_Half_TN,tn_4096_880_2048,Gemm_Hipblaslt_TN_9577,0.0362373
GemmTunableOp_Half_TN,tn_4096_1827_7168,Gemm_Hipblaslt_TN_9268,0.202081
GemmTunableOp_Half_TN,tn_3072_1864_4096,Gemm_Hipblaslt_TN_9148,0.0931055
GemmTunableOp_Half_TN,tn_14336_7809_4096,Gemm_Hipblaslt_TN_9914,1.49766
GemmTunableOp_Half_TN,tn_4096_1900_7168,Gemm_Hipblaslt_TN_9645,0.207875
GemmTunableOp_Half_TN,tn_14336_835_4096,Gemm_Hipblaslt_TN_9187,0.179215
GemmTunableOp_Half_TN,tn_14336_821_4096,Gemm_Hipblaslt_TN_9697,0.178477
GemmTunableOp_Half_TN,tn_4096_863_7168,Gemm_Hipblaslt_TN_9634,0.111151
GemmTunableOp_Half_TN,tn_4096_3546_2048,Gemm_Hipblaslt_TN_9896,0.102006
GemmTunableOp_Half_TN,tn_3072_2560_4096,Gemm_Hipblaslt_TN_9624,0.121156
GemmTunableOp_Half_TN,tn_14336_1693_4096,Gemm_Hipblaslt_TN_9189,0.356183
GemmTunableOp_Half_TN,tn_3072_1762_4096,Gemm_Hipblaslt_TN_9148,0.0908698
GemmTunableOp_Half_TN,tn_4096_971_2048,Gemm_Hipblaslt_TN_9604,0.0391341
GemmTunableOp_Half_TN,tn_4096_939_2048,Gemm_Hipblaslt_TN_9604,0.037524
GemmTunableOp_Half_TN,tn_4096_844_2048,Gemm_Hipblaslt_TN_9352,0.0352106
GemmTunableOp_Half_TN,tn_4096_192_2048,Gemm_Rocblas_621286447,0.0127062
GemmTunableOp_Half_TN,tn_3072_838_4096,Gemm_Hipblaslt_TN_9048,0.0535126
GemmTunableOp_Half_TN,tn_4096_2698_7168,Gemm_Hipblaslt_TN_9672,0.271099
GemmTunableOp_Half_TN,tn_14336_7266_4096,Gemm_Hipblaslt_TN_9697,1.39139
GemmTunableOp_Half_TN,tn_14336_7953_4096,Gemm_Hipblaslt_TN_9903,1.51801
GemmTunableOp_Half_TN,tn_3072_938_4096,Gemm_Hipblaslt_TN_9251,0.0593595
GemmTunableOp_Half_TN,tn_4096_907_2048,Gemm_Hipblaslt_TN_9604,0.0377051
GemmTunableOp_Half_TN,tn_4096_7863_7168,Gemm_Hipblaslt_TN_9959,0.738289
GemmTunableOp_Half_TN,tn_4096_1762_7168,Gemm_Hipblaslt_TN_9134,0.19883
GemmTunableOp_Half_TN,tn_14336_1768_4096,Gemm_Hipblaslt_TN_9793,0.366113
GemmTunableOp_Half_TN,tn_3072_891_4096,Gemm_Hipblaslt_TN_9131,0.0573952
GemmTunableOp_Half_TN,tn_64128_119_4096,Gemm_Rocblas_621294762,0.201458
GemmTunableOp_Half_TN,tn_3072_900_4096,Gemm_Hipblaslt_TN_9546,0.057797
GemmTunableOp_Half_TN,tn_4096_942_2048,Gemm_Hipblaslt_TN_9577,0.0381804
GemmTunableOp_Half_TN,tn_14336_1813_4096,Gemm_Hipblaslt_TN_9187,0.368291
GemmTunableOp_Half_TN,tn_14336_3402_4096,Gemm_Rocblas_621294330,0.652004
GemmTunableOp_Half_TN,tn_4096_2805_2048,Gemm_Hipblaslt_TN_9689,0.0862305
GemmTunableOp_Half_TN,tn_4096_805_7168,Gemm_Hipblaslt_TN_9147,0.104676
GemmTunableOp_Half_TN,tn_14336_893_4096,Gemm_Hipblaslt_TN_9139,0.182125
GemmTunableOp_Half_TN,tn_14336_1798_4096,Gemm_Hipblaslt_TN_9187,0.366777
GemmTunableOp_Half_TN,tn_14336_3569_4096,Gemm_Hipblaslt_TN_9220,0.659512
GemmTunableOp_Half_TN,tn_4096_916_2048,Gemm_Hipblaslt_TN_9604,0.0374185
GemmTunableOp_Half_TN,tn_14336_176_4096,Gemm_Hipblaslt_TN_9353,0.0582987
GemmTunableOp_Half_TN,tn_14336_851_4096,Gemm_Hipblaslt_TN_9139,0.179969
GemmTunableOp_Half_TN,tn_3072_104_4096,Gemm_Rocblas_621286280,0.0148394
GemmTunableOp_Half_TN,tn_4096_893_7168,Gemm_Hipblaslt_TN_9604,0.113936
GemmTunableOp_Half_TN,tn_3072_906_4096,Gemm_Hipblaslt_TN_9352,0.0579157
GemmTunableOp_Half_TN,tn_3072_956_4096,Gemm_Hipblaslt_TN_9546,0.0590406
GemmTunableOp_Half_TN,tn_4096_1730_7168,Gemm_Hipblaslt_TN_9673,0.197011
GemmTunableOp_Half_TN,tn_3072_1954_4096,Gemm_Hipblaslt_TN_9265,0.100063
GemmTunableOp_Half_TN,tn_14336_1954_4096,Gemm_Hipblaslt_TN_9220,0.397116
GemmTunableOp_Half_TN,tn_14336_144_4096,Gemm_Hipblaslt_TN_9312,0.0514989
GemmTunableOp_Half_TN,tn_14336_7823_4096,Gemm_Hipblaslt_TN_9890,1.49573
GemmTunableOp_Half_TN,tn_14336_879_4096,Gemm_Hipblaslt_TN_9677,0.181081
GemmTunableOp_Half_TN,tn_4096_927_2048,Gemm_Hipblaslt_TN_9576,0.0373489
GemmTunableOp_Half_TN,tn_4096_785_2048,Gemm_Hipblaslt_TN_9352,0.0335188
GemmTunableOp_Half_TN,tn_14336_2651_4096,Gemm_Hipblaslt_TN_9793,0.532318
GemmTunableOp_Half_TN,tn_4096_208_7168,Gemm_Rocblas_621294230,0.0425252
GemmTunableOp_Half_TN,tn_4096_248_2048,Gemm_Rocblas_621286443,0.0148935
GemmTunableOp_Half_TN,tn_64128_219_4096,Gemm_Hipblaslt_TN_9919,0.276972
GemmTunableOp_Half_TN,tn_4096_964_2048,Gemm_Hipblaslt_TN_9604,0.0375833
GemmTunableOp_Half_TN,tn_3072_1791_4096,Gemm_Rocblas_621286778,0.0913734
GemmTunableOp_Half_TN,tn_14336_1837_4096,Gemm_Hipblaslt_TN_9697,0.36783
GemmTunableOp_Half_TN,tn_4096_1673_2048,Gemm_Hipblaslt_TN_9607,0.0560827
GemmTunableOp_Half_TN,tn_14336_977_4096,Gemm_Hipblaslt_TN_9217,0.203178
GemmTunableOp_Half_TN,tn_4096_1724_7168,Gemm_Hipblaslt_TN_9164,0.183305
GemmTunableOp_Half_TN,tn_4096_1828_2048,Gemm_Hipblaslt_TN_9590,0.0633527
GemmTunableOp_Half_TN,tn_4096_901_2048,Gemm_Hipblaslt_TN_9604,0.0349354
GemmTunableOp_Half_TN,tn_4096_913_7168,Gemm_Hipblaslt_TN_9604,0.11843
GemmTunableOp_Half_TN,tn_3072_1614_4096,Gemm_Rocblas_621294520,0.0863863
GemmTunableOp_Half_TN,tn_11008_256_4096,Gemm_Hipblaslt_TN_9550,0.0607382
GemmTunableOp_Half_TN,tn_14336_2635_4096,Gemm_Hipblaslt_TN_9793,0.534156
GemmTunableOp_Half_TN,tn_64128_91_4096,Gemm_Hipblaslt_TN_9057,0.179442
GemmTunableOp_Half_TN,tn_4096_885_2048,Gemm_Hipblaslt_TN_9576,0.0368889
GemmTunableOp_Half_TN,tn_4096_1853_2048,Gemm_Hipblaslt_TN_9590,0.0635611
GemmTunableOp_Half_TN,tn_64128_213_4096,Gemm_Hipblaslt_TN_9271,0.273688
GemmTunableOp_Half_TN,tn_4096_905_2048,Gemm_Hipblaslt_TN_9577,0.037851
GemmTunableOp_Half_TN,tn_64128_68_4096,Gemm_Hipblaslt_TN_9057,0.174249
GemmTunableOp_Half_TN,tn_4096_1777_7168,Gemm_Hipblaslt_TN_9134,0.200233
GemmTunableOp_Half_TN,tn_3072_930_4096,Gemm_Hipblaslt_TN_9546,0.0577792
GemmTunableOp_Half_TN,tn_14336_868_4096,Gemm_Hipblaslt_TN_9139,0.180929
GemmTunableOp_Half_TN,tn_4096_804_7168,Gemm_Hipblaslt_TN_9583,0.107124
GemmTunableOp_Half_TN,tn_3072_1756_4096,Gemm_Hipblaslt_TN_9163,0.091487
GemmTunableOp_Half_TN,tn_14336_922_4096,Gemm_Hipblaslt_TN_9677,0.183113
GemmTunableOp_Half_TN,tn_4096_948_7168,Gemm_Hipblaslt_TN_9604,0.118692
GemmTunableOp_Half_TN,tn_4096_7952_7168,Gemm_Hipblaslt_TN_9914,0.741606
GemmTunableOp_Half_TN,tn_4096_2703_2048,Gemm_Hipblaslt_TN_9674,0.0841577
GemmTunableOp_Half_TN,tn_14336_809_4096,Gemm_Hipblaslt_TN_9187,0.176339
GemmTunableOp_Half_TN,tn_14336_872_4096,Gemm_Hipblaslt_TN_9139,0.182028
GemmTunableOp_Half_TN,tn_4096_152_7168,Gemm_Rocblas_621294168,0.0370153
GemmTunableOp_Half_TN,tn_14336_7937_4096,Gemm_Hipblaslt_TN_9914,1.51831
GemmTunableOp_Half_TN,tn_64128_245_4096,Gemm_Rocblas_621286915,0.289944
GemmTunableOp_Half_TN,tn_64128_255_4096,Gemm_Rocblas_621286915,0.294103
GemmTunableOp_Half_TN,tn_3072_248_4096,Gemm_Rocblas_621294230,0.0227244
GemmTunableOp_Half_TN,tn_3072_2785_4096,Gemm_Hipblaslt_TN_9624,0.127539
GemmTunableOp_Half_TN,tn_4096_852_7168,Gemm_Hipblaslt_TN_9604,0.111081
GemmTunableOp_Half_TN,tn_64128_16_4096,Gemm_Rocblas_621286348,0.144318
GemmTunableOp_Half_TN,tn_4096_1795_2048,Gemm_Hipblaslt_TN_9137,0.0629549
GemmTunableOp_Half_TN,tn_14336_862_4096,Gemm_Hipblaslt_TN_9677,0.181487
GemmTunableOp_Half_TN,tn_4096_988_2048,Gemm_Hipblaslt_TN_9577,0.0381655
GemmTunableOp_Half_TN,tn_64128_233_4096,Gemm_Rocblas_621286915,0.2911
GemmTunableOp_Half_TN,tn_4096_2750_2048,Gemm_Hipblaslt_TN_9674,0.0855685
GemmTunableOp_Half_TN,tn_14336_901_4096,Gemm_Hipblaslt_TN_9697,0.183362
GemmTunableOp_Half_TN,tn_14336_1756_4096,Gemm_Hipblaslt_TN_9793,0.363863
GemmTunableOp_Half_TN,tn_4096_885_7168,Gemm_Hipblaslt_TN_9355,0.117399
GemmTunableOp_Half_TN,tn_3072_1775_4096,Gemm_Hipblaslt_TN_7091,0.0921145
GemmTunableOp_Half_TN,tn_3072_7299_4096,Gemm_Hipblaslt_TN_9779,0.325768
GemmTunableOp_Half_TN,tn_4096_813_7168,Gemm_Hipblaslt_TN_9099,0.109888
GemmTunableOp_Half_TN,tn_3072_2592_4096,Gemm_Hipblaslt_TN_9329,0.121702
GemmTunableOp_Half_TN,tn_14336_930_4096,Gemm_Hipblaslt_TN_9697,0.185327
GemmTunableOp_Half_TN,tn_4096_8_2048,Gemm_Rocblas_621294144,0.00730091
GemmTunableOp_Half_TN,tn_3072_1792_4096,Gemm_Rocblas_621294520,0.0897777
GemmTunableOp_Half_TN,tn_4096_923_7168,Gemm_Hipblaslt_TN_9604,0.118486
GemmTunableOp_Half_TN,tn_3072_7787_4096,Gemm_Hipblaslt_TN_9800,0.335799
GemmTunableOp_Half_TN,tn_4096_216_7168,Gemm_Hipblaslt_TN_9497,0.0422123
GemmTunableOp_Half_TN,tn_64128_14_4096,Gemm_Rocblas_621286348,0.143692
GemmTunableOp_Half_TN,tn_64128_8_4096,Gemm_Rocblas_621286348,0.14024
GemmTunableOp_Half_TN,tn_3072_1697_4096,Gemm_Hipblaslt_TN_9561,0.0870605
GemmTunableOp_Half_TN,tn_64128_62_4096,Gemm_Hipblaslt_TN_9097,0.164072
GemmTunableOp_Half_TN,tn_4096_1724_2048,Gemm_Hipblaslt_TN_9164,0.0593583
GemmTunableOp_Half_TN,tn_14336_7952_4096,Gemm_Hipblaslt_TN_9914,1.51414
GemmTunableOp_Half_TN,tn_4096_1762_2048,Gemm_Hipblaslt_TN_9136,0.0627704
GemmTunableOp_Half_TN,tn_3072_1724_4096,Gemm_Rocblas_621294520,0.0895794
GemmTunableOp_Half_TN,tn_4096_1831_2048,Gemm_Hipblaslt_TN_9680,0.0635134
GemmTunableOp_Half_TN,tn_4096_790_7168,Gemm_Hipblaslt_TN_9158,0.107493
GemmTunableOp_Half_TN,tn_4096_795_7168,Gemm_Hipblaslt_TN_9158,0.106674
GemmTunableOp_Half_TN,tn_64128_177_4096,Gemm_Hipblaslt_TN_9817,0.249346
GemmTunableOp_Half_TN,tn_4096_1777_2048,Gemm_Hipblaslt_TN_9590,0.0632674
GemmTunableOp_Half_TN,tn_3072_1649_4096,Gemm_Hipblaslt_TN_9561,0.0874412
GemmTunableOp_Half_TN,tn_64128_236_4096,Gemm_Hipblaslt_TN_9122,0.291301
GemmTunableOp_Half_TN,tn_14336_3430_4096,Gemm_Hipblaslt_TN_9223,0.651734
GemmTunableOp_Half_TN,tn_14336_873_4096,Gemm_Hipblaslt_TN_9697,0.182268
GemmTunableOp_Half_TN,tn_14336_990_4096,Gemm_Hipblaslt_TN_9220,0.205213
GemmTunableOp_Half_TN,tn_14336_799_4096,Gemm_Hipblaslt_TN_9691,0.162848
GemmTunableOp_Half_TN,tn_64128_22_4096,Gemm_Rocblas_621286348,0.145184
GemmTunableOp_Half_TN,tn_3072_2708_4096,Gemm_Hipblaslt_TN_9624,0.125376
GemmTunableOp_Half_TN,tn_3072_3447_4096,Gemm_Hipblaslt_TN_7589,0.152516
GemmTunableOp_Half_TN,tn_3072_7863_4096,Gemm_Hipblaslt_TN_9800,0.337742
GemmTunableOp_Half_TN,tn_3072_966_4096,Gemm_Hipblaslt_TN_9352,0.0587779
GemmTunableOp_Half_TN,tn_4096_809_7168,Gemm_Hipblaslt_TN_9352,0.108371
GemmTunableOp_Half_TN,tn_4096_1785_7168,Gemm_Hipblaslt_TN_9645,0.200526
GemmTunableOp_Half_TN,tn_4096_64_2048,Gemm_Rocblas_621294227,0.00787777
GemmTunableOp_Half_TN,tn_14336_1742_4096,Gemm_Hipblaslt_TN_9793,0.362749
GemmTunableOp_Half_TN,tn_14336_1822_4096,Gemm_Hipblaslt_TN_9677,0.367784
GemmTunableOp_Half_TN,tn_4096_811_7168,Gemm_Hipblaslt_TN_9147,0.108836
GemmTunableOp_Half_TN,tn_4096_1817_7168,Gemm_Hipblaslt_TN_9268,0.202764
GemmTunableOp_Half_TN,tn_14336_1881_4096,Gemm_Hipblaslt_TN_9697,0.371059
GemmTunableOp_Half_TN,tn_14336_1755_4096,Gemm_Hipblaslt_TN_9793,0.364064
GemmTunableOp_Half_TN,tn_64128_31_4096,Gemm_Hipblaslt_TN_9094,0.146657
GemmTunableOp_Half_TN,tn_4096_8192_7168,Gemm_Hipblaslt_TN_9217,0.758762
GemmTunableOp_Half_TN,tn_4096_160_2048,Gemm_Rocblas_621286442,0.0131497
GemmTunableOp_Half_TN,tn_4096_2763_7168,Gemm_Hipblaslt_TN_9690,0.280573
GemmTunableOp_Half_TN,tn_4096_256_2048,Gemm_Rocblas_621286447,0.0146203
GemmTunableOp_Half_TN,tn_4096_1893_7168,Gemm_Hipblaslt_TN_9680,0.207886
GemmTunableOp_Half_TN,tn_4096_1846_7168,Gemm_Hipblaslt_TN_9136,0.202777
GemmTunableOp_Half_TN,tn_3072_2628_4096,Gemm_Hipblaslt_TN_9624,0.123998
GemmTunableOp_Half_TN,tn_3072_878_4096,Gemm_Hipblaslt_TN_9131,0.0576017
GemmTunableOp_Half_TN,tn_14336_1730_4096,Gemm_Hipblaslt_TN_9793,0.360445
GemmTunableOp_Half_TN,tn_4096_957_2048,Gemm_Hipblaslt_TN_9576,0.0380812
GemmTunableOp_Half_TN,tn_64128_78_4096,Gemm_Hipblaslt_TN_9057,0.177477
GemmTunableOp_Half_TN,tn_4096_937_2048,Gemm_Hipblaslt_TN_9604,0.0375349
GemmTunableOp_Half_TN,tn_4096_5606_7168,Gemm_Hipblaslt_TN_9672,0.563137
GemmTunableOp_Half_TN,tn_4096_2773_2048,Gemm_Hipblaslt_TN_9672,0.0872451
GemmTunableOp_Half_TN,tn_3072_917_4096,Gemm_Hipblaslt_TN_9131,0.0590775
GemmTunableOp_Half_TN,tn_64128_144_4096,Gemm_Hipblaslt_TN_9108,0.221229
GemmTunableOp_Half_TN,tn_14336_794_4096,Gemm_Hipblaslt_TN_9691,0.163395
GemmTunableOp_Half_TN,tn_14336_1727_4096,Gemm_Hipblaslt_TN_9697,0.357097
GemmTunableOp_Half_TN,tn_4096_853_2048,Gemm_Hipblaslt_TN_9354,0.0350287
GemmTunableOp_Half_TN,tn_64128_30_4096,Gemm_Rocblas_621286348,0.147317
GemmTunableOp_Half_TN,tn_3072_919_4096,Gemm_Hipblaslt_TN_9546,0.0574952
GemmTunableOp_Half_TN,tn_4096_939_7168,Gemm_Hipblaslt_TN_9576,0.118042
GemmTunableOp_Half_TN,tn_4096_1600_2048,Gemm_Hipblaslt_TN_9328,0.057319
GemmTunableOp_Half_TN,tn_4096_800_2048,Gemm_Hipblaslt_TN_9604,0.0337108
GemmTunableOp_Half_TN,tn_4096_964_7168,Gemm_Hipblaslt_TN_9576,0.1195
GemmTunableOp_Half_TN,tn_3072_1807_4096,Gemm_Rocblas_621294520,0.0907376
GemmTunableOp_Half_TN,tn_3072_7857_4096,Gemm_Hipblaslt_TN_9779,0.338884
GemmTunableOp_Half_TN,tn_3072_1794_4096,Gemm_Hipblaslt_TN_9322,0.0919595
GemmTunableOp_Half_TN,tn_3072_3569_4096,Gemm_Hipblaslt_TN_9570,0.157878
GemmTunableOp_Half_TN,tn_4096_946_2048,Gemm_Hipblaslt_TN_9577,0.0379888
GemmTunableOp_Half_TN,tn_3072_845_4096,Gemm_Hipblaslt_TN_9047,0.054092
GemmTunableOp_Half_TN,tn_3072_1905_4096,Gemm_Hipblaslt_TN_9324,0.0929024
GemmTunableOp_Half_TN,tn_14336_8054_4096,Gemm_Hipblaslt_TN_9888,1.52097
GemmTunableOp_Half_TN,tn_4096_796_2048,Gemm_Hipblaslt_TN_9354,0.035167
GemmTunableOp_Half_TN,tn_14336_7863_4096,Gemm_Hipblaslt_TN_9903,1.51135
GemmTunableOp_Half_TN,tn_4096_96_7168,Gemm_Hipblaslt_TN_9440,0.0244576
GemmTunableOp_Half_TN,tn_64128_49_4096,Gemm_Hipblaslt_TN_9097,0.160739
GemmTunableOp_Half_TN,tn_3072_929_4096,Gemm_Hipblaslt_TN_9546,0.0577121
GemmTunableOp_Half_TN,tn_4096_817_7168,Gemm_Hipblaslt_TN_9158,0.106376
GemmTunableOp_Half_TN,tn_64128_216_4096,Gemm_Hipblaslt_TN_9271,0.27743
GemmTunableOp_Half_TN,tn_4096_7952_2048,Gemm_Rocblas_621294030,0.228151
GemmTunableOp_Half_TN,tn_3072_4483_4096,Gemm_Hipblaslt_TN_9943,0.190288
GemmTunableOp_Half_TN,tn_4096_1697_2048,Gemm_Hipblaslt_TN_9607,0.056164
GemmTunableOp_Half_TN,tn_3072_855_4096,Gemm_Hipblaslt_TN_9047,0.0537859
GemmTunableOp_Half_TN,tn_4096_809_2048,Gemm_Hipblaslt_TN_9604,0.0347438
GemmTunableOp_Half_TN,tn_3072_7283_4096,Gemm_Hipblaslt_TN_9681,0.310878
GemmTunableOp_Half_TN,tn_3072_2826_4096,Gemm_Hipblaslt_TN_9624,0.128544
GemmTunableOp_Half_TN,tn_4096_961_2048,Gemm_Hipblaslt_TN_9585,0.0380065
GemmTunableOp_Half_TN,tn_3072_2764_4096,Gemm_Hipblaslt_TN_9624,0.127444
GemmTunableOp_Half_TN,tn_3072_889_4096,Gemm_Hipblaslt_TN_9158,0.0578539
GemmTunableOp_Half_TN,tn_4096_2732_7168,Gemm_Hipblaslt_TN_9672,0.280234
GemmTunableOp_Half_TN,tn_64128_246_4096,Gemm_Rocblas_621294658,0.294828
GemmTunableOp_Half_TN,tn_3072_934_4096,Gemm_Hipblaslt_TN_9131,0.0583394
GemmTunableOp_Half_TN,tn_14336_1835_4096,Gemm_Hipblaslt_TN_9697,0.370452
GemmTunableOp_Half_TN,tn_14336_4483_4096,Gemm_Rocblas_621294330,0.863127
GemmTunableOp_Half_TN,tn_4096_1759_2048,Gemm_Hipblaslt_TN_9329,0.0615644
GemmTunableOp_Half_TN,tn_64128_209_4096,Gemm_Hipblaslt_TN_9919,0.273867
GemmTunableOp_Half_TN,tn_4096_2793_2048,Gemm_Hipblaslt_TN_9871,0.0879563
GemmTunableOp_Half_TN,tn_4096_1695_7168,Gemm_Hipblaslt_TN_9616,0.183603
GemmTunableOp_Half_TN,tn_3072_1700_4096,Gemm_Rocblas_621294520,0.0878223
GemmTunableOp_Half_TN,tn_4096_819_7168,Gemm_Hipblaslt_TN_9352,0.110406
GemmTunableOp_Half_TN,tn_4096_1743_2048,Gemm_Hipblaslt_TN_9136,0.0620356
GemmTunableOp_Half_TN,tn_64128_7_4096,Gemm_Rocblas_621286348,0.141334
GemmTunableOp_Half_TN,tn_4096_2708_2048,Gemm_Hipblaslt_TN_9674,0.0848364
GemmTunableOp_Half_TN,tn_3072_2734_4096,Gemm_Hipblaslt_TN_9624,0.127731
GemmTunableOp_Half_TN,tn_14336_932_4096,Gemm_Hipblaslt_TN_9192,0.187049
GemmTunableOp_Half_TN,tn_14336_3599_4096,Gemm_Hipblaslt_TN_9677,0.72699
GemmTunableOp_Half_TN,tn_3072_968_4096,Gemm_Rocblas_621294242,0.0605277
GemmTunableOp_Half_TN,tn_14336_1701_4096,Gemm_Hipblaslt_TN_9677,0.351615
GemmTunableOp_Half_TN,tn_64128_253_4096,Gemm_Hipblaslt_TN_9122,0.296535
GemmTunableOp_Half_TN,tn_4096_3569_7168,Gemm_Hipblaslt_TN_9677,0.340949
GemmTunableOp_Half_TN,tn_4096_969_7168,Gemm_Hipblaslt_TN_9160,0.119899
GemmTunableOp_Half_TN,tn_14336_869_4096,Gemm_Hipblaslt_TN_9139,0.177965
GemmTunableOp_Half_TN,tn_4096_832_2048,Gemm_Hipblaslt_TN_9353,0.0346273
GemmTunableOp_Half_TN,tn_14336_875_4096,Gemm_Hipblaslt_TN_9677,0.180053
GemmTunableOp_Half_TN,tn_4096_2651_7168,Gemm_Hipblaslt_TN_9799,0.269313
GemmTunableOp_Half_TN,tn_14336_3711_4096,Gemm_Hipblaslt_TN_9677,0.739367
GemmTunableOp_Half_TN,tn_4096_859_7168,Gemm_Hipblaslt_TN_9547,0.113563
GemmTunableOp_Half_TN,tn_64128_158_4096,Gemm_Hipblaslt_TN_9108,0.224402
GemmTunableOp_Half_TN,tn_4096_795_2048,Gemm_Hipblaslt_TN_9352,0.0334512
GemmTunableOp_Half_TN,tn_64128_116_4096,Gemm_Hipblaslt_TN_9264,0.200427
GemmTunableOp_Half_TN,tn_14336_3670_4096,Gemm_Hipblaslt_TN_9677,0.739259
GemmTunableOp_Half_TN,tn_3072_1805_4096,Gemm_Rocblas_621294520,0.0907331
GemmTunableOp_Half_TN,tn_4096_848_2048,Gemm_Hipblaslt_TN_9354,0.0349215
GemmTunableOp_Half_TN,tn_4096_3565_7168,Gemm_Hipblaslt_TN_9139,0.341274
GemmTunableOp_Half_TN,tn_3072_927_4096,Gemm_Hipblaslt_TN_9131,0.0566274
GemmTunableOp_Half_TN,tn_14336_1817_4096,Gemm_Hipblaslt_TN_9187,0.368235
GemmTunableOp_Half_TN,tn_4096_5606_2048,Gemm_Hipblaslt_TN_9687,0.173361
GemmTunableOp_Half_TN,tn_14336_985_4096,Gemm_Hipblaslt_TN_9220,0.20453
GemmTunableOp_Half_TN,tn_4096_88_2048,Gemm_Rocblas_621286278,0.00987486
GemmTunableOp_Half_TN,tn_14336_2590_4096,Gemm_Hipblaslt_TN_9793,0.530197
GemmTunableOp_Half_TN,tn_3072_2602_4096,Gemm_Hipblaslt_TN_9329,0.1229
GemmTunableOp_Half_TN,tn_14336_120_4096,Gemm_Rocblas_621286494,0.0407488
GemmTunableOp_Half_TN,tn_14336_801_4096,Gemm_Hipblaslt_TN_9187,0.174286
GemmTunableOp_Half_TN,tn_14336_8000_4096,Gemm_Hipblaslt_TN_9933,1.5177
GemmTunableOp_Half_TN,tn_4096_1757_7168,Gemm_Hipblaslt_TN_9673,0.196584
GemmTunableOp_Half_TN,tn_4096_32_7168,Gemm_Rocblas_621294138,0.015407
GemmTunableOp_Half_TN,tn_3072_8154_4096,Gemm_Hipblaslt_TN_9935,0.350003
GemmTunableOp_Half_TN,tn_3072_2606_4096,Gemm_Hipblaslt_TN_9624,0.123566
GemmTunableOp_Half_TN,tn_14336_7857_4096,Gemm_Hipblaslt_TN_9890,1.50905
GemmTunableOp_Half_TN,tn_3072_4463_4096,Gemm_Hipblaslt_TN_9721,0.185755
GemmTunableOp_Half_TN,tn_3072_985_4096,Gemm_Hipblaslt_TN_9352,0.0603911
GemmTunableOp_Half_TN,tn_4096_2826_7168,Gemm_Hipblaslt_TN_9674,0.281916
GemmTunableOp_Half_TN,tn_4096_8156_2048,Gemm_Hipblaslt_TN_9704,0.233402
GemmTunableOp_Half_TN,tn_4096_1806_2048,Gemm_Hipblaslt_TN_9590,0.0625179
GemmTunableOp_Half_TN,tn_3072_1853_4096,Gemm_Hipblaslt_TN_9615,0.0931969
GemmTunableOp_Half_TN,tn_4096_972_2048,Gemm_Hipblaslt_TN_9585,0.038978
GemmTunableOp_Half_TN,tn_3072_1695_4096,Gemm_Hipblaslt_TN_9148,0.0870049
GemmTunableOp_Half_TN,tn_3072_64_4096,Gemm_Rocblas_621286419,0.0108587
GemmTunableOp_Half_TN,tn_4096_16_2048,Gemm_Rocblas_621294144,0.00699245
GemmTunableOp_Half_TN,tn_14336_1744_4096,Gemm_Hipblaslt_TN_9697,0.362712
GemmTunableOp_Half_TN,tn_64128_186_4096,Gemm_Hipblaslt_TN_9683,0.250311
GemmTunableOp_Half_TN,tn_14336_7992_4096,Gemm_Hipblaslt_TN_9914,1.52125
GemmTunableOp_Half_TN,tn_14336_889_4096,Gemm_Hipblaslt_TN_9139,0.181525
GemmTunableOp_Half_TN,tn_4096_1817_2048,Gemm_Hipblaslt_TN_9680,0.0637873
GemmTunableOp_Half_TN,tn_4096_930_2048,Gemm_Hipblaslt_TN_9604,0.0354995
GemmTunableOp_Half_TN,tn_4096_802_7168,Gemm_Hipblaslt_TN_9147,0.107639
GemmTunableOp_Half_TN,tn_4096_2675_2048,Gemm_Hipblaslt_TN_9687,0.0839346
GemmTunableOp_Half_TN,tn_14336_1666_4096,Gemm_Hipblaslt_TN_9697,0.353054
GemmTunableOp_Half_TN,tn_4096_966_7168,Gemm_Hipblaslt_TN_9576,0.118376
GemmTunableOp_Half_TN,tn_14336_2699_4096,Gemm_Hipblaslt_TN_9677,0.546626
GemmTunableOp_Half_TN,tn_4096_120_2048,Gemm_Rocblas_621294171,0.0112644
GemmTunableOp_Half_TN,tn_3072_1893_4096,Gemm_Hipblaslt_TN_9324,0.0935442
GemmTunableOp_Half_TN,tn_4096_1794_2048,Gemm_Hipblaslt_TN_9136,0.0631905
GemmTunableOp_Half_TN,tn_14336_2648_4096,Gemm_Hipblaslt_TN_9793,0.537836
GemmTunableOp_Half_TN,tn_64128_73_4096,Gemm_Hipblaslt_TN_9057,0.177406
GemmTunableOp_Half_TN,tn_3072_893_4096,Gemm_Hipblaslt_TN_9546,0.0565019
GemmTunableOp_Half_TN,tn_3072_1701_4096,Gemm_Hipblaslt_TN_9561,0.0878206
GemmTunableOp_Half_TN,tn_14336_7804_4096,Gemm_Hipblaslt_TN_9853,1.49113
GemmTunableOp_Half_TN,tn_4096_845_7168,Gemm_Hipblaslt_TN_9547,0.113081
GemmTunableOp_Half_TN,tn_64128_121_4096,Gemm_Rocblas_621294762,0.202689
GemmTunableOp_Half_TN,tn_3072_136_4096,Gemm_Hipblaslt_TN_9434,0.0168
GemmTunableOp_Half_TN,tn_4096_940_2048,Gemm_Hipblaslt_TN_9577,0.0375733
GemmTunableOp_Half_TN,tn_64128_9_4096,Gemm_Rocblas_621294130,0.14235
GemmTunableOp_Half_TN,tn_4096_3571_2048,Gemm_Hipblaslt_TN_9896,0.103723
GemmTunableOp_Half_TN,tn_4096_929_2048,Gemm_Hipblaslt_TN_9604,0.0362566
GemmTunableOp_Half_TN,tn_3072_7944_4096,Gemm_Hipblaslt_TN_9693,0.341713
GemmTunableOp_Half_TN,tn_14336_958_4096,Gemm_Hipblaslt_TN_9677,0.187152
GemmTunableOp_Half_TN,tn_14336_1743_4096,Gemm_Hipblaslt_TN_9139,0.363797
GemmTunableOp_Half_TN,tn_4096_256_5504,Gemm_Rocblas_621294173,0.0363542
GemmTunableOp_Half_TN,tn_4096_830_7168,Gemm_Hipblaslt_TN_9147,0.109621
GemmTunableOp_Half_TN,tn_4096_7436_2048,Gemm_Hipblaslt_TN_9813,0.223202
GemmTunableOp_Half_TN,tn_14336_804_4096,Gemm_Hipblaslt_TN_9187,0.178119
GemmTunableOp_Half_TN,tn_3072_836_4096,Gemm_Hipblaslt_TN_9368,0.0525468
GemmTunableOp_Half_TN,tn_64128_198_4096,Gemm_Hipblaslt_TN_9919,0.272663
GemmTunableOp_Half_TN,tn_64128_247_4096,Gemm_Rocblas_621286915,0.292803
GemmTunableOp_Half_TN,tn_4096_2590_2048,Gemm_Hipblaslt_TN_9566,0.0830631
GemmTunableOp_Half_TN,tn_4096_869_7168,Gemm_Hipblaslt_TN_9634,0.113056
GemmTunableOp_Half_TN,tn_64128_127_4096,Gemm_Rocblas_621286789,0.202011
GemmTunableOp_Half_TN,tn_4096_912_7168,Gemm_Hipblaslt_TN_9604,0.117782
GemmTunableOp_Half_TN,tn_4096_8110_7168,Gemm_Rocblas_621286678,0.74654
GemmTunableOp_Half_TN,tn_64128_168_4096,Gemm_Hipblaslt_TN_9816,0.246347
GemmTunableOp_Half_TN,tn_64128_40_4096,Gemm_Hipblaslt_TN_9097,0.158255
GemmTunableOp_Half_TN,tn_14336_929_4096,Gemm_Hipblaslt_TN_9139,0.184428
GemmTunableOp_Half_TN,tn_14336_1805_4096,Gemm_Hipblaslt_TN_9697,0.368737
GemmTunableOp_Half_TN,tn_14336_847_4096,Gemm_Hipblaslt_TN_9139,0.17894
GemmTunableOp_Half_TN,tn_14336_2734_4096,Gemm_Hipblaslt_TN_9139,0.554091
GemmTunableOp_Half_TN,tn_14336_911_4096,Gemm_Hipblaslt_TN_9697,0.183736
GemmTunableOp_Half_TN,tn_64128_156_4096,Gemm_Hipblaslt_TN_9108,0.220689
GemmTunableOp_Half_TN,tn_14336_838_4096,Gemm_Hipblaslt_TN_9192,0.179984
GemmTunableOp_Half_TN,tn_4096_136_7168,Gemm_Hipblaslt_TN_9474,0.0342724
GemmTunableOp_Half_TN,tn_14336_954_4096,Gemm_Hipblaslt_TN_9139,0.184371
GemmTunableOp_Half_TN,tn_14336_2672_4096,Gemm_Hipblaslt_TN_9793,0.537525
GemmTunableOp_Half_TN,tn_3072_2762_4096,Gemm_Hipblaslt_TN_9624,0.126962
GemmTunableOp_Half_TN,tn_4096_2698_2048,Gemm_Hipblaslt_TN_9689,0.0850491
GemmTunableOp_Half_TN,tn_4096_8192_2048,Gemm_Rocblas_621286281,0.233179
GemmTunableOp_Half_TN,tn_14336_2599_4096,Gemm_Hipblaslt_TN_9793,0.530615
GemmTunableOp_Half_TN,tn_4096_1803_7168,Gemm_Hipblaslt_TN_9268,0.201434
GemmTunableOp_Half_TN,tn_4096_865_7168,Gemm_Hipblaslt_TN_9634,0.113217
GemmTunableOp_Half_TN,tn_4096_7804_2048,Gemm_Hipblaslt_TN_9813,0.227651
GemmTunableOp_Half_TN,tn_4096_920_2048,Gemm_Hipblaslt_TN_9604,0.0356061
GemmTunableOp_Half_TN,tn_11008_232_4096,Gemm_Rocblas_621294215,0.0594014
GemmTunableOp_Half_TN,tn_64128_204_4096,Gemm_Hipblaslt_TN_9919,0.274288
GemmTunableOp_Half_TN,tn_4096_892_2048,Gemm_Hipblaslt_TN_9577,0.0369615
GemmTunableOp_Half_TN,tn_64128_173_4096,Gemm_Hipblaslt_TN_9862,0.244051
GemmTunableOp_Half_TN,tn_4096_248_7168,Gemm_Rocblas_621286440,0.0452773
GemmTunableOp_Half_TN,tn_3072_96_4096,Gemm_Rocblas_621286280,0.0133569
GemmTunableOp_Half_TN,tn_4096_811_2048,Gemm_Hipblaslt_TN_9352,0.0342815
GemmTunableOp_Half_TN,tn_3072_2590_4096,Gemm_Hipblaslt_TN_9620,0.1235
GemmTunableOp_Half_TN,tn_3072_8_4096,Gemm_Rocblas_621294136,0.00822629
GemmTunableOp_Half_TN,tn_14336_2592_4096,Gemm_Hipblaslt_TN_9793,0.529402
GemmTunableOp_Half_TN,tn_4096_1853_7168,Gemm_Hipblaslt_TN_9680,0.202861
GemmTunableOp_Half_TN,tn_4096_821_7168,Gemm_Hipblaslt_TN_9099,0.110482
GemmTunableOp_Half_TN,tn_14336_1724_4096,Gemm_Hipblaslt_TN_9189,0.356596
GemmTunableOp_Half_TN,tn_4096_4463_7168,Gemm_Hipblaslt_TN_9763,0.453864
GemmTunableOp_Half_TN,tn_3072_785_4096,Gemm_Hipblaslt_TN_9048,0.0519396
GemmTunableOp_Half_TN,tn_3072_1739_4096,Gemm_Hipblaslt_TN_9322,0.0901948
GemmTunableOp_Half_TN,tn_14336_848_4096,Gemm_Hipblaslt_TN_9187,0.179257
GemmTunableOp_Half_TN,tn_4096_934_7168,Gemm_Hipblaslt_TN_9604,0.118212
GemmTunableOp_Half_TN,tn_4096_3310_7168,Gemm_Hipblaslt_TN_9697,0.327498
GemmTunableOp_Half_TN,tn_4096_794_2048,Gemm_Hipblaslt_TN_9354,0.03382
GemmTunableOp_Half_TN,tn_64128_256_4096,Gemm_Rocblas_621294648,0.281874
GemmTunableOp_Half_TN,tn_14336_8110_4096,Gemm_Hipblaslt_TN_9869,1.54513
GemmTunableOp_Half_TN,tn_4096_851_2048,Gemm_Hipblaslt_TN_9354,0.0351313
GemmTunableOp_Half_TN,tn_4096_2703_7168,Gemm_Hipblaslt_TN_9674,0.273339
GemmTunableOp_Half_TN,tn_14336_2658_4096,Gemm_Hipblaslt_TN_9793,0.533219
GemmTunableOp_Half_TN,tn_4096_2785_2048,Gemm_Hipblaslt_TN_9674,0.0872781
GemmTunableOp_Half_TN,tn_4096_925_2048,Gemm_Hipblaslt_TN_9577,0.0375541
GemmTunableOp_Half_TN,tn_3072_800_4096,Gemm_Hipblaslt_TN_9147,0.0551624
GemmTunableOp_Half_TN,tn_3072_200_4096,Gemm_Rocblas_621294171,0.0220341
GemmTunableOp_Half_TN,tn_3072_2653_4096,Gemm_Hipblaslt_TN_9620,0.124164
GemmTunableOp_Half_TN,tn_14336_913_4096,Gemm_Hipblaslt_TN_9139,0.183345
GemmTunableOp_Half_TN,tn_3072_1798_4096,Gemm_Rocblas_621286778,0.0908134
GemmTunableOp_Half_TN,tn_3072_3599_4096,Gemm_Hipblaslt_TN_9570,0.15919
GemmTunableOp_Half_TN,tn_14336_2717_4096,Gemm_Hipblaslt_TN_9139,0.550916
GemmTunableOp_Half_TN,tn_64128_164_4096,Gemm_Hipblaslt_TN_9857,0.241429
GemmTunableOp_Half_TN,tn_64128_152_4096,Gemm_Hipblaslt_TN_9799,0.226518
GemmTunableOp_Half_TN,tn_3072_3430_4096,Gemm_Hipblaslt_TN_9570,0.152679
GemmTunableOp_Half_TN,tn_4096_855_7168,Gemm_Hipblaslt_TN_9353,0.113313
GemmTunableOp_Half_TN,tn_4096_843_7168,Gemm_Hipblaslt_TN_9634,0.11206
GemmTunableOp_Half_TN,tn_4096_936_2048,Gemm_Hipblaslt_TN_9577,0.037578
GemmTunableOp_Half_TN,tn_64128_107_4096,Gemm_Hipblaslt_TN_9061,0.199353
GemmTunableOp_Half_TN,tn_64128_27_4096,Gemm_Hipblaslt_TN_9094,0.145697
GemmTunableOp_Half_TN,tn_64128_100_4096,Gemm_Hipblaslt_TN_9264,0.196386
GemmTunableOp_Half_TN,tn_4096_2653_2048,Gemm_Hipblaslt_TN_9672,0.0834418
GemmTunableOp_Half_TN,tn_64128_44_4096,Gemm_Hipblaslt_TN_9097,0.159141
GemmTunableOp_Half_TN,tn_64128_69_4096,Gemm_Hipblaslt_TN_9057,0.175858
GemmTunableOp_Half_TN,tn_4096_978_2048,Gemm_Hipblaslt_TN_9577,0.0387079
GemmTunableOp_Half_TN,tn_14336_843_4096,Gemm_Hipblaslt_TN_9677,0.181445
GemmTunableOp_Half_TN,tn_64128_89_4096,Gemm_Hipblaslt_TN_9057,0.181707
GemmTunableOp_Half_TN,tn_14336_200_4096,Gemm_Hipblaslt_TN_9634,0.0637928
GemmTunableOp_Half_TN,tn_64128_199_4096,Gemm_Hipblaslt_TN_9260,0.271592
GemmTunableOp_Half_TN,tn_64128_227_4096,Gemm_Rocblas_621286892,0.28958
GemmTunableOp_Half_TN,tn_4096_835_7168,Gemm_Hipblaslt_TN_9158,0.112287
GemmTunableOp_Half_TN,tn_64128_252_4096,Gemm_Rocblas_621286915,0.299233
GemmTunableOp_Half_TN,tn_14336_825_4096,Gemm_Hipblaslt_TN_9697,0.178373
GemmTunableOp_Half_TN,tn_4096_831_2048,Gemm_Hipblaslt_TN_9634,0.0341824
GemmTunableOp_Half_TN,tn_4096_1693_2048,Gemm_Hipblaslt_TN_9569,0.0579693
GemmTunableOp_Half_TN,tn_3072_8156_4096,Gemm_Rocblas_621294473,0.35085
GemmTunableOp_Half_TN,tn_14336_1828_4096,Gemm_Hipblaslt_TN_9697,0.368667
GemmTunableOp_Half_TN,tn_4096_1718_2048,Gemm_Hipblaslt_TN_9607,0.0570067
GemmTunableOp_Half_TN,tn_14336_2544_4096,Gemm_Rocblas_621294426,0.502357
GemmTunableOp_Half_TN,tn_4096_1694_7168,Gemm_Hipblaslt_TN_9265,0.183738
GemmTunableOp_Half_TN,tn_4096_1837_7168,Gemm_Hipblaslt_TN_9137,0.203754
GemmTunableOp_Half_TN,tn_14336_926_4096,Gemm_Hipblaslt_TN_9697,0.184065
GemmTunableOp_Half_TN,tn_14336_878_4096,Gemm_Hipblaslt_TN_9139,0.181169
GemmTunableOp_Half_TN,tn_4096_1944_2048,Gemm_Hipblaslt_TN_9174,0.0650277
GemmTunableOp_Half_TN,tn_64128_249_4096,Gemm_Hipblaslt_TN_9122,0.296261
GemmTunableOp_Half_TN,tn_4096_1880_2048,Gemm_Hipblaslt_TN_9590,0.0634947
GemmTunableOp_Half_TN,tn_3072_943_4096,Gemm_Hipblaslt_TN_9131,0.0581813
GemmTunableOp_Half_TN,tn_4096_903_2048,Gemm_Hipblaslt_TN_9576,0.0369863
GemmTunableOp_Half_TN,tn_14336_1737_4096,Gemm_Hipblaslt_TN_9793,0.36151
GemmTunableOp_Half_TN,tn_4096_1867_2048,Gemm_Hipblaslt_TN_9136,0.0628328
GemmTunableOp_Half_TN,tn_4096_805_2048,Gemm_Hipblaslt_TN_9604,0.0350381
GemmTunableOp_Half_TN,tn_3072_951_4096,Gemm_Hipblaslt_TN_9131,0.0582056
GemmTunableOp_Half_TN,tn_4096_857_2048,Gemm_Hipblaslt_TN_9251,0.0367833
GemmTunableOp_Half_TN,tn_4096_1756_7168,Gemm_Hipblaslt_TN_9673,0.197373
GemmTunableOp_Half_TN,tn_3072_1727_4096,Gemm_Rocblas_621286778,0.088452
GemmTunableOp_Half_TN,tn_3072_939_4096,Gemm_Hipblaslt_TN_9352,0.0592985
GemmTunableOp_Half_TN,tn_4096_920_7168,Gemm_Hipblaslt_TN_9576,0.118105
GemmTunableOp_Half_TN,tn_3072_990_4096,Gemm_Hipblaslt_TN_9131,0.0603314
GemmTunableOp_Half_TN,tn_14336_904_4096,Gemm_Hipblaslt_TN_9677,0.183668
GemmTunableOp_Half_TN,tn_4096_3671_2048,Gemm_Hipblaslt_TN_9827,0.11117
GemmTunableOp_Half_TN,tn_4096_1829_7168,Gemm_Hipblaslt_TN_9645,0.203657
GemmTunableOp_Half_TN,tn_4096_1913_2048,Gemm_Hipblaslt_TN_9590,0.0642842
GemmTunableOp_Half_TN,tn_3072_875_4096,Gemm_Hipblaslt_TN_9131,0.0559511
GemmTunableOp_Half_TN,tn_4096_992_7168,Gemm_Hipblaslt_TN_9101,0.124676
GemmTunableOp_Half_TN,tn_4096_176_7168,Gemm_Hipblaslt_TN_9470,0.0380475
GemmTunableOp_Half_TN,tn_4096_7992_7168,Gemm_Hipblaslt_TN_9914,0.741429
GemmTunableOp_Half_TN,tn_14336_934_4096,Gemm_Hipblaslt_TN_9697,0.185545
GemmTunableOp_Half_TN,tn_14336_1893_4096,Gemm_Hipblaslt_TN_9697,0.371035
GemmTunableOp_Half_TN,tn_4096_919_2048,Gemm_Hipblaslt_TN_9577,0.0372564
GemmTunableOp_Half_TN,tn_4096_3310_2048,Gemm_Hipblaslt_TN_9139,0.101024
GemmTunableOp_Half_TN,tn_64128_117_4096,Gemm_Rocblas_621286396,0.202102
GemmTunableOp_Half_TN,tn_4096_1700_2048,Gemm_Hipblaslt_TN_9588,0.0581126
GemmTunableOp_Half_TN,tn_14336_1806_4096,Gemm_Hipblaslt_TN_9697,0.36794
GemmTunableOp_Half_TN,tn_4096_948_2048,Gemm_Hipblaslt_TN_9604,0.0365589
GemmTunableOp_Half_TN,tn_14336_837_4096,Gemm_Hipblaslt_TN_9187,0.178472
GemmTunableOp_Half_TN,tn_4096_1848_7168,Gemm_Hipblaslt_TN_9268,0.203291
GemmTunableOp_Half_TN,tn_14336_946_4096,Gemm_Hipblaslt_TN_9677,0.18566
GemmTunableOp_Half_TN,tn_64128_74_4096,Gemm_Hipblaslt_TN_9057,0.178397
GemmTunableOp_Half_TN,tn_14336_880_4096,Gemm_Hipblaslt_TN_9139,0.181477
GemmTunableOp_Half_TN,tn_14336_871_4096,Gemm_Hipblaslt_TN_9677,0.178672
GemmTunableOp_Half_TN,tn_14336_56_4096,Gemm_Rocblas_621294557,0.0298098
GemmTunableOp_Half_TN,tn_14336_957_4096,Gemm_Hipblaslt_TN_9697,0.186613
GemmTunableOp_Half_TN,tn_3072_868_4096,Gemm_Hipblaslt_TN_9546,0.0572305
GemmTunableOp_Half_TN,tn_4096_958_7168,Gemm_Hipblaslt_TN_9634,0.118883
GemmTunableOp_Half_TN,tn_14336_877_4096,Gemm_Hipblaslt_TN_9139,0.181124
GemmTunableOp_Half_TN,tn_4096_807_2048,Gemm_Hipblaslt_TN_9604,0.0341404
GemmTunableOp_Half_TN,tn_4096_855_2048,Gemm_Hipblaslt_TN_9352,0.0359366
GemmTunableOp_Half_TN,tn_4096_1715_2048,Gemm_Hipblaslt_TN_9359,0.0578747
GemmTunableOp_Half_TN,tn_4096_3662_7168,Gemm_Hipblaslt_TN_9220,0.35467
GemmTunableOp_Half_TN,tn_3072_861_4096,Gemm_Hipblaslt_TN_9131,0.0564304
GemmTunableOp_Half_TN,tn_3072_1783_4096,Gemm_Rocblas_621294520,0.0909709
GemmTunableOp_Half_TN,tn_3072_1705_4096,Gemm_Hipblaslt_TN_9163,0.0879282
GemmTunableOp_Half_TN,tn_3072_1694_4096,Gemm_Rocblas_621294520,0.0873838
GemmTunableOp_Half_TN,tn_4096_2860_7168,Gemm_Hipblaslt_TN_9672,0.285158
GemmTunableOp_Half_TN,tn_4096_842_7168,Gemm_Hipblaslt_TN_9634,0.11285
GemmTunableOp_Half_TN,tn_3072_848_4096,Gemm_Hipblaslt_TN_9047,0.0533625
GemmTunableOp_Half_TN,tn_4096_2509_7168,Gemm_Hipblaslt_TN_9657,0.262752
GemmTunableOp_Half_TN,tn_3072_959_4096,Gemm_Hipblaslt_TN_9353,0.0597777
GemmTunableOp_Half_TN,tn_4096_1837_2048,Gemm_Hipblaslt_TN_9590,0.0638846
GemmTunableOp_Half_TN,tn_4096_2544_7168,Gemm_Hipblaslt_TN_9799,0.262203
GemmTunableOp_Half_TN,tn_4096_2786_2048,Gemm_Hipblaslt_TN_9689,0.0872782
GemmTunableOp_Half_TN,tn_14336_64_4096,Gemm_Rocblas_621286816,0.0300845
GemmTunableOp_Half_TN,tn_14336_885_4096,Gemm_Hipblaslt_TN_9187,0.182287
GemmTunableOp_Half_TN,tn_4096_886_2048,Gemm_Hipblaslt_TN_9576,0.0369841
GemmTunableOp_Half_TN,tn_4096_990_7168,Gemm_Hipblaslt_TN_9170,0.121117
GemmTunableOp_Half_TN,tn_4096_7798_2048,Gemm_Hipblaslt_TN_9713,0.227137
GemmStridedBatchedTunableOp_Half_TN,tn_958_958_128_B_16,Gemm_Rocblas_621286794,0.0277734
GemmStridedBatchedTunableOp_Half_TN,tn_822_822_128_B_16,Gemm_Hipblaslt_TN_158,0.0243482
GemmStridedBatchedTunableOp_Half_TN,tn_804_804_128_B_16,Gemm_Hipblaslt_TN_158,0.0228845
GemmStridedBatchedTunableOp_Half_TN,tn_886_886_128_B_16,Gemm_Rocblas_621286984,0.0263061
GemmStridedBatchedTunableOp_Half_TN,tn_935_935_128_B_16,Gemm_Rocblas_621294536,0.0278142
GemmStridedBatchedTunableOp_Half_TN,tn_875_875_128_B_16,Gemm_Rocblas_621286984,0.0264276
GemmStridedBatchedTunableOp_Half_TN,tn_806_806_128_B_16,Gemm_Hipblaslt_TN_158,0.023183
GemmStridedBatchedTunableOp_Half_TN,tn_927_927_128_B_16,Gemm_Rocblas_621294536,0.0280046
GemmStridedBatchedTunableOp_Half_TN,tn_908_908_128_B_16,Gemm_Rocblas_621286794,0.0272249
GemmStridedBatchedTunableOp_Half_TN,tn_900_900_128_B_16,Gemm_Rocblas_621286794,0.0269521
GemmStridedBatchedTunableOp_Half_TN,tn_902_902_128_B_16,Gemm_Rocblas_621286794,0.0271115
GemmStridedBatchedTunableOp_Half_TN,tn_805_805_128_B_16,Gemm_Rocblas_621286811,0.0241368
GemmStridedBatchedTunableOp_Half_TN,tn_818_818_128_B_16,Gemm_Rocblas_621286811,0.0236268
GemmStridedBatchedTunableOp_Half_TN,tn_852_852_128_B_16,Gemm_Rocblas_621286718,0.0245883
GemmStridedBatchedTunableOp_Half_TN,tn_891_891_128_B_16,Gemm_Rocblas_621286794,0.0268549
GemmStridedBatchedTunableOp_Half_TN,tn_899_899_128_B_16,Gemm_Rocblas_621286794,0.0268483
GemmStridedBatchedTunableOp_Half_TN,tn_808_808_128_B_16,Gemm_Hipblaslt_TN_150,0.0191661
GemmStridedBatchedTunableOp_Half_TN,tn_892_892_128_B_16,Gemm_Rocblas_621286984,0.0265354
GemmStridedBatchedTunableOp_Half_TN,tn_820_820_128_B_16,Gemm_Rocblas_621286718,0.0237909
GemmStridedBatchedTunableOp_Half_TN,tn_807_807_128_B_16,Gemm_Hipblaslt_TN_158,0.023267
GemmStridedBatchedTunableOp_Half_TN,tn_841_841_128_B_16,Gemm_Rocblas_621286811,0.0253707
GemmStridedBatchedTunableOp_Half_TN,tn_896_896_128_B_16,Gemm_Hipblaslt_TN_150,0.0182863
GemmStridedBatchedTunableOp_Half_TN,tn_918_918_128_B_16,Gemm_Rocblas_621294536,0.0277461
GemmStridedBatchedTunableOp_Half_TN,tn_888_888_128_B_16,Gemm_Hipblaslt_TN_150,0.0195808
GemmStridedBatchedTunableOp_Half_TN,tn_863_863_128_B_16,Gemm_Rocblas_621286794,0.0262026
GemmStridedBatchedTunableOp_Half_TN,tn_955_955_128_B_16,Gemm_Rocblas_621294536,0.028551
GemmStridedBatchedTunableOp_Half_TN,tn_917_917_128_B_16,Gemm_Rocblas_621294536,0.0274754
GemmStridedBatchedTunableOp_Half_TN,tn_992_992_128_B_16,Gemm_Rocblas_621286240,0.0246599
GemmStridedBatchedTunableOp_Half_TN,tn_901_901_128_B_16,Gemm_Rocblas_621286794,0.026999
GemmStridedBatchedTunableOp_Half_TN,tn_941_941_128_B_16,Gemm_Rocblas_621286794,0.0281048
GemmStridedBatchedTunableOp_Half_TN,tn_828_828_128_B_16,Gemm_Hipblaslt_TN_158,0.0240918
GemmStridedBatchedTunableOp_Half_TN,tn_803_803_128_B_16,Gemm_Hipblaslt_TN_158,0.0236894
GemmStridedBatchedTunableOp_Half_TN,tn_923_923_128_B_16,Gemm_Rocblas_621286794,0.0275677
GemmStridedBatchedTunableOp_Half_TN,tn_907_907_128_B_16,Gemm_Rocblas_621294536,0.0269127
GemmStridedBatchedTunableOp_Half_TN,tn_869_869_128_B_16,Gemm_Rocblas_621294728,0.0264797
GemmStridedBatchedTunableOp_Half_TN,tn_962_962_128_B_16,Gemm_Rocblas_621286794,0.0278703
GemmStridedBatchedTunableOp_Half_TN,tn_971_971_128_B_16,Gemm_Rocblas_621286794,0.0279454
GemmStridedBatchedTunableOp_Half_TN,tn_829_829_128_B_16,Gemm_Hipblaslt_TN_158,0.0248481
GemmStridedBatchedTunableOp_Half_TN,tn_845_845_128_B_16,Gemm_Hipblaslt_TN_9961,0.0258439
GemmStridedBatchedTunableOp_Half_TN,tn_934_934_128_B_16,Gemm_Rocblas_621294536,0.0277492
GemmStridedBatchedTunableOp_Half_TN,tn_856_856_128_B_16,Gemm_Hipblaslt_TN_150,0.0193811
GemmStridedBatchedTunableOp_Half_TN,tn_978_978_128_B_16,Gemm_Rocblas_621294536,0.028084
GemmStridedBatchedTunableOp_Half_TN,tn_827_827_128_B_16,Gemm_Hipblaslt_TN_158,0.0244315
GemmStridedBatchedTunableOp_Half_TN,tn_858_858_128_B_16,Gemm_Rocblas_621294728,0.0261252
GemmStridedBatchedTunableOp_Half_TN,tn_791_791_128_B_16,Gemm_Rocblas_621286500,0.0228994
GemmStridedBatchedTunableOp_Half_TN,tn_795_795_128_B_16,Gemm_Hipblaslt_TN_158,0.0230796
GemmStridedBatchedTunableOp_Half_TN,tn_815_815_128_B_16,Gemm_Hipblaslt_TN_158,0.0237863
GemmStridedBatchedTunableOp_Half_TN,tn_946_946_128_B_16,Gemm_Rocblas_621294536,0.0275758
GemmStridedBatchedTunableOp_Half_TN,tn_840_840_128_B_16,Gemm_Hipblaslt_TN_150,0.0192431
GemmStridedBatchedTunableOp_Half_TN,tn_949_949_128_B_16,Gemm_Rocblas_621294536,0.0279558
GemmStridedBatchedTunableOp_Half_TN,tn_952_952_128_B_16,Gemm_Rocblas_621293994,0.024431
GemmStridedBatchedTunableOp_Half_TN,tn_953_953_128_B_16,Gemm_Rocblas_621286794,0.0279594
GemmStridedBatchedTunableOp_Half_TN,tn_801_801_128_B_16,Gemm_Hipblaslt_TN_158,0.0229308
GemmStridedBatchedTunableOp_Half_TN,tn_931_931_128_B_16,Gemm_Rocblas_621294536,0.0279121
GemmStridedBatchedTunableOp_Half_TN,tn_832_832_128_B_16,Gemm_Hipblaslt_TN_150,0.0179989
GemmStridedBatchedTunableOp_Half_TN,tn_910_910_128_B_16,Gemm_Rocblas_621286794,0.0270508
GemmStridedBatchedTunableOp_Half_TN,tn_802_802_128_B_16,Gemm_Hipblaslt_TN_158,0.0238965
GemmStridedBatchedTunableOp_Half_TN,tn_988_988_128_B_16,Gemm_Rocblas_621294536,0.0279961
GemmStridedBatchedTunableOp_Half_TN,tn_977_977_128_B_16,Gemm_Rocblas_621286794,0.0284957
GemmStridedBatchedTunableOp_Half_TN,tn_957_957_128_B_16,Gemm_Rocblas_621294536,0.0285409
GemmStridedBatchedTunableOp_Half_TN,tn_897_897_128_B_16,Gemm_Rocblas_621294536,0.0269887
GemmStridedBatchedTunableOp_Half_TN,tn_959_959_128_B_16,Gemm_Rocblas_621286794,0.0278336
GemmStridedBatchedTunableOp_Half_TN,tn_785_785_128_B_16,Gemm_Hipblaslt_TN_158,0.0223818
GemmStridedBatchedTunableOp_Half_TN,tn_893_893_128_B_16,Gemm_Rocblas_621286794,0.0268819
GemmStridedBatchedTunableOp_Half_TN,tn_932_932_128_B_16,Gemm_Rocblas_621286794,0.027841
GemmStridedBatchedTunableOp_Half_TN,tn_860_860_128_B_16,Gemm_Rocblas_621294728,0.0259032
GemmStridedBatchedTunableOp_Half_TN,tn_956_956_128_B_16,Gemm_Rocblas_621294536,0.0283419
GemmStridedBatchedTunableOp_Half_TN,tn_870_870_128_B_16,Gemm_Rocblas_621294728,0.0263597
GemmStridedBatchedTunableOp_Half_TN,tn_842_842_128_B_16,Gemm_Hipblaslt_TN_158,0.0255292
GemmStridedBatchedTunableOp_Half_TN,tn_945_945_128_B_16,Gemm_Rocblas_621286794,0.0276745
GemmStridedBatchedTunableOp_Half_TN,tn_871_871_128_B_16,Gemm_Rocblas_621286984,0.0264826
GemmStridedBatchedTunableOp_Half_TN,tn_794_794_128_B_16,Gemm_Hipblaslt_TN_158,0.0222469
GemmStridedBatchedTunableOp_Half_TN,tn_972_972_128_B_16,Gemm_Rocblas_621294536,0.0284045
GemmStridedBatchedTunableOp_Half_TN,tn_826_826_128_B_16,Gemm_Hipblaslt_TN_158,0.024449
GemmStridedBatchedTunableOp_Half_TN,tn_873_873_128_B_16,Gemm_Rocblas_621286984,0.0264375
GemmStridedBatchedTunableOp_Half_TN,tn_843_843_128_B_16,Gemm_Rocblas_621286794,0.0259671
GemmStridedBatchedTunableOp_Half_TN,tn_973_973_128_B_16,Gemm_Rocblas_621286794,0.0280005
GemmStridedBatchedTunableOp_Half_TN,tn_919_919_128_B_16,Gemm_Rocblas_621294536,0.0274846
GemmStridedBatchedTunableOp_Half_TN,tn_844_844_128_B_16,Gemm_Rocblas_621294460,0.0245694
GemmStridedBatchedTunableOp_Half_TN,tn_894_894_128_B_16,Gemm_Rocblas_621286794,0.0269363
GemmStridedBatchedTunableOp_Half_TN,tn_948_948_128_B_16,Gemm_Rocblas_621294536,0.0274822
GemmStridedBatchedTunableOp_Half_TN,tn_943_943_128_B_16,Gemm_Rocblas_621294536,0.0278632
GemmStridedBatchedTunableOp_Half_TN,tn_849_849_128_B_16,Gemm_Rocblas_621294728,0.0259755
GemmStridedBatchedTunableOp_Half_TN,tn_838_838_128_B_16,Gemm_Hipblaslt_TN_158,0.0256271
GemmStridedBatchedTunableOp_Half_TN,tn_961_961_128_B_16,Gemm_Rocblas_621286794,0.0276805
GemmStridedBatchedTunableOp_Half_TN,tn_954_954_128_B_16,Gemm_Rocblas_621294536,0.0284987
GemmStridedBatchedTunableOp_Half_TN,tn_868_868_128_B_16,Gemm_Rocblas_621294728,0.025916
GemmStridedBatchedTunableOp_Half_TN,tn_878_878_128_B_16,Gemm_Rocblas_621294728,0.0261427
GemmStridedBatchedTunableOp_Half_TN,tn_833_833_128_B_16,Gemm_Hipblaslt_TN_158,0.0250173
GemmStridedBatchedTunableOp_Half_TN,tn_967_967_128_B_16,Gemm_Rocblas_621294536,0.0283627
GemmStridedBatchedTunableOp_Half_TN,tn_830_830_128_B_16,Gemm_Hipblaslt_TN_158,0.0246083
GemmStridedBatchedTunableOp_Half_TN,tn_792_792_128_B_16,Gemm_Hipblaslt_TN_150,0.019219
GemmStridedBatchedTunableOp_Half_TN,tn_848_848_128_B_16,Gemm_Hipblaslt_TN_150,0.0189527
GemmTunableOp_Half_TN,tn_3072_877_4096,Gemm_Hipblaslt_TN_9131,0.0574853
GemmTunableOp_Half_TN,tn_4096_1763_7168,Gemm_Hipblaslt_TN_9329,0.203468
GemmTunableOp_Half_TN,tn_4096_1666_2048,Gemm_Hipblaslt_TN_9569,0.0595658
GemmTunableOp_Half_TN,tn_3072_1817_4096,Gemm_Rocblas_621294520,0.0943083
GemmTunableOp_Half_TN,tn_3072_844_4096,Gemm_Hipblaslt_TN_9368,0.0533469
GemmTunableOp_Half_TN,tn_64128_32_4096,Gemm_Rocblas_621286348,0.14198
GemmTunableOp_Half_TN,tn_3072_1673_4096,Gemm_Hipblaslt_TN_9561,0.0886388
GemmTunableOp_Half_TN,tn_4096_1931_2048,Gemm_Hipblaslt_TN_9590,0.0672689
GemmTunableOp_Half_TN,tn_4096_915_7168,Gemm_Hipblaslt_TN_9634,0.120413
GemmTunableOp_Half_TN,tn_3072_956_4096,Gemm_Hipblaslt_TN_9131,0.0609256
GemmTunableOp_Half_TN,tn_4096_3565_2048,Gemm_Hipblaslt_TN_9683,0.107334
GemmTunableOp_Half_TN,tn_3072_866_4096,Gemm_Hipblaslt_TN_9546,0.0582322
GemmTunableOp_Half_TN,tn_14336_2571_4096,Gemm_Hipblaslt_TN_9793,0.546958
GemmTunableOp_Half_TN,tn_4096_876_2048,Gemm_Hipblaslt_TN_9252,0.0374589
GemmTunableOp_Half_TN,tn_4096_3352_2048,Gemm_Hipblaslt_TN_9696,0.103449
GemmTunableOp_Half_TN,tn_4096_863_7168,Gemm_Hipblaslt_TN_9547,0.115788
GemmTunableOp_Half_TN,tn_4096_2651_7168,Gemm_Hipblaslt_TN_9709,0.279838
GemmTunableOp_Half_TN,tn_4096_7283_2048,Gemm_Hipblaslt_TN_9731,0.218118
GemmTunableOp_Half_TN,tn_4096_808_7168,Gemm_Hipblaslt_TN_9158,0.109497
GemmTunableOp_Half_TN,tn_3072_892_4096,Gemm_Hipblaslt_TN_9131,0.0578313
GemmTunableOp_Half_TN,tn_64128_256_4096,Gemm_Rocblas_621286905,0.292536
GemmTunableOp_Half_TN,tn_3072_2773_4096,Gemm_Hipblaslt_TN_9624,0.130113
GemmTunableOp_Half_TN,tn_3072_900_4096,Gemm_Hipblaslt_TN_9352,0.0602507
GemmTunableOp_Half_TN,tn_14336_1757_4096,Gemm_Hipblaslt_TN_9793,0.372133
GemmTunableOp_Half_TN,tn_14336_4471_4096,Gemm_Hipblaslt_TN_9217,0.883368
GemmTunableOp_Half_TN,tn_14336_940_4096,Gemm_Hipblaslt_TN_9139,0.190248
GemmTunableOp_Half_TN,tn_4096_2572_2048,Gemm_Hipblaslt_TN_9672,0.0849489
GemmTunableOp_Half_TN,tn_3072_906_4096,Gemm_Hipblaslt_TN_9158,0.0583231
GemmTunableOp_Half_TN,tn_14336_800_4096,Gemm_Rocblas_621294425,0.164338
GemmTunableOp_Half_TN,tn_4096_1644_7168,Gemm_Hipblaslt_TN_9610,0.186733
GemmTunableOp_Half_TN,tn_4096_844_2048,Gemm_Hipblaslt_TN_9352,0.0354891
GemmTunableOp_Half_TN,tn_4096_1867_7168,Gemm_Hipblaslt_TN_9645,0.211597
GemmTunableOp_Half_TN,tn_3072_3352_4096,Gemm_Hipblaslt_TN_9629,0.155527
GemmTunableOp_Half_TN,tn_4096_1883_7168,Gemm_Hipblaslt_TN_9645,0.211693
GemmTunableOp_Half_TN,tn_3072_891_4096,Gemm_Hipblaslt_TN_9131,0.0581788
GemmTunableOp_Half_TN,tn_3072_942_4096,Gemm_Hipblaslt_TN_9546,0.0586784
GemmTunableOp_Half_TN,tn_4096_882_7168,Gemm_Hipblaslt_TN_9170,0.119113
GemmTunableOp_Half_TN,tn_4096_896_2048,Gemm_Hipblaslt_TN_9355,0.0372135
GemmTunableOp_Half_TN,tn_14336_907_4096,Gemm_Hipblaslt_TN_9677,0.188211
GemmTunableOp_Half_TN,tn_4096_882_2048,Gemm_Hipblaslt_TN_9576,0.0372867
GemmTunableOp_Half_TN,tn_4096_1841_7168,Gemm_Hipblaslt_TN_9268,0.209788
GemmTunableOp_Half_TN,tn_4096_911_2048,Gemm_Hipblaslt_TN_9585,0.0378209
GemmTunableOp_Half_TN,tn_4096_4242_2048,Gemm_Hipblaslt_TN_9768,0.12268
GemmTunableOp_Half_TN,tn_4096_1649_2048,Gemm_Hipblaslt_TN_9607,0.0565201
GemmTunableOp_Half_TN,tn_3072_8049_4096,Gemm_Rocblas_621294473,0.351271
GemmTunableOp_Half_TN,tn_3072_971_4096,Gemm_Hipblaslt_TN_9131,0.0597574
GemmTunableOp_Half_TN,tn_4096_232_7168,Gemm_Hipblaslt_TN_9303,0.0442031
GemmTunableOp_Half_TN,tn_3072_915_4096,Gemm_Hipblaslt_TN_9251,0.06008
GemmTunableOp_Half_TN,tn_4096_815_7168,Gemm_Hipblaslt_TN_9147,0.111919
GemmTunableOp_Half_TN,tn_4096_837_7168,Gemm_Hipblaslt_TN_9099,0.113545
GemmTunableOp_Half_TN,tn_3072_837_4096,Gemm_Hipblaslt_TN_9047,0.055536
GemmTunableOp_Half_TN,tn_4096_890_7168,Gemm_Hipblaslt_TN_9547,0.117294
GemmTunableOp_Half_TN,tn_64128_223_4096,Gemm_Hipblaslt_TN_9271,0.281049
GemmTunableOp_Half_TN,tn_14336_1783_4096,Gemm_Hipblaslt_TN_9187,0.372813
GemmTunableOp_Half_TN,tn_4096_918_7168,Gemm_Hipblaslt_TN_9576,0.120839
GemmTunableOp_Half_TN,tn_64128_85_4096,Gemm_Hipblaslt_TN_9057,0.183608
GemmTunableOp_Half_TN,tn_4096_1744_2048,Gemm_Hipblaslt_TN_9136,0.0628185
GemmTunableOp_Half_TN,tn_4096_893_7168,Gemm_Hipblaslt_TN_9547,0.119354
GemmTunableOp_Half_TN,tn_4096_1744_7168,Gemm_Hipblaslt_TN_9673,0.200463
GemmTunableOp_Half_TN,tn_4096_938_2048,Gemm_Hipblaslt_TN_9604,0.0378207
GemmTunableOp_Half_TN,tn_3072_795_4096,Gemm_Hipblaslt_TN_9048,0.0534441
GemmTunableOp_Half_TN,tn_14336_24_4096,Gemm_Rocblas_621294052,0.0257168
GemmTunableOp_Half_TN,tn_4096_803_2048,Gemm_Hipblaslt_TN_9352,0.0345278
GemmTunableOp_Half_TN,tn_4096_1777_7168,Gemm_Hipblaslt_TN_9329,0.204968
GemmTunableOp_Half_TN,tn_14336_954_4096,Gemm_Hipblaslt_TN_9697,0.19132
GemmTunableOp_Half_TN,tn_14336_1777_4096,Gemm_Hipblaslt_TN_9192,0.373144
GemmTunableOp_Half_TN,tn_4096_904_2048,Gemm_Hipblaslt_TN_9604,0.0385149
GemmTunableOp_Half_TN,tn_4096_8007_7168,Gemm_Hipblaslt_TN_9959,0.766114
GemmTunableOp_Half_TN,tn_3072_2648_4096,Gemm_Hipblaslt_TN_9134,0.125619
GemmTunableOp_Half_TN,tn_4096_2630_7168,Gemm_Hipblaslt_TN_9799,0.277213
GemmTunableOp_Half_TN,tn_14336_908_4096,Gemm_Hipblaslt_TN_9677,0.188423
GemmTunableOp_Half_TN,tn_4096_920_2048,Gemm_Hipblaslt_TN_9355,0.0390331
GemmTunableOp_Half_TN,tn_3072_1850_4096,Gemm_Hipblaslt_TN_9613,0.0954318
GemmTunableOp_Half_TN,tn_64128_250_4096,Gemm_Rocblas_621294648,0.294301
GemmTunableOp_Half_TN,tn_14336_224_4096,Gemm_Rocblas_621286479,0.0668766
GemmTunableOp_Half_TN,tn_4096_7863_7168,Gemm_Rocblas_621286678,0.755923
GemmTunableOp_Half_TN,tn_4096_7992_2048,Gemm_Rocblas_621286281,0.235646
GemmTunableOp_Half_TN,tn_14336_983_4096,Gemm_Rocblas_621286608,0.210455
GemmTunableOp_Half_TN,tn_64128_42_4096,Gemm_Hipblaslt_TN_9144,0.156896
GemmTunableOp_Half_TN,tn_3072_2763_4096,Gemm_Hipblaslt_TN_9624,0.130591
GemmTunableOp_Half_TN,tn_4096_937_7168,Gemm_Hipblaslt_TN_9170,0.119765
GemmTunableOp_Half_TN,tn_4096_1726_7168,Gemm_Hipblaslt_TN_9265,0.187755
GemmTunableOp_Half_TN,tn_4096_7817_2048,Gemm_Hipblaslt_TN_9655,0.231068
GemmTunableOp_Half_TN,tn_3072_984_4096,Gemm_Hipblaslt_TN_9317,0.0612402
GemmTunableOp_Half_TN,tn_3072_1883_4096,Gemm_Hipblaslt_TN_9324,0.0949745
GemmTunableOp_Half_TN,tn_4096_838_7168,Gemm_Hipblaslt_TN_9160,0.114933
GemmTunableOp_Half_TN,tn_4096_8110_7168,Gemm_Rocblas_621286713,0.777585
GemmTunableOp_Half_TN,tn_64128_152_4096,Gemm_Hipblaslt_TN_9108,0.234005
GemmTunableOp_Half_TN,tn_64128_7_4096,Gemm_Rocblas_621286325,0.141061
GemmTunableOp_Half_TN,tn_3072_1848_4096,Gemm_Hipblaslt_TN_9615,0.0954619
GemmTunableOp_Half_TN,tn_4096_7944_2048,Gemm_Rocblas_621286281,0.235753
GemmTunableOp_Half_TN,tn_14336_8007_4096,Gemm_Hipblaslt_TN_9903,1.57731
GemmTunableOp_Half_TN,tn_14336_918_4096,Gemm_Hipblaslt_TN_9697,0.188951
GemmTunableOp_Half_TN,tn_3072_865_4096,Gemm_Hipblaslt_TN_9546,0.0571823
GemmTunableOp_Half_TN,tn_3072_913_4096,Gemm_Hipblaslt_TN_9352,0.0579925
GemmTunableOp_Half_TN,tn_4096_120_7168,Gemm_Hipblaslt_TN_9419,0.0288074
GemmTunableOp_Half_TN,tn_4096_40_7168,Gemm_Rocblas_621294148,0.0189092
GemmTunableOp_Half_TN,tn_4096_2571_7168,Gemm_Hipblaslt_TN_9799,0.275773
GemmTunableOp_Half_TN,tn_3072_7953_4096,Gemm_Rocblas_621294473,0.349722
GemmTunableOp_Half_TN,tn_4096_1803_7168,Gemm_Hipblaslt_TN_9137,0.20758
GemmTunableOp_Half_TN,tn_3072_2675_4096,Gemm_Hipblaslt_TN_9329,0.127421
GemmTunableOp_Half_TN,tn_4096_1835_2048,Gemm_Hipblaslt_TN_9590,0.0647723
GemmTunableOp_Half_TN,tn_14336_802_4096,Gemm_Hipblaslt_TN_9697,0.179687
GemmTunableOp_Half_TN,tn_3072_1785_4096,Gemm_Rocblas_621294520,0.0911257
GemmTunableOp_Half_TN,tn_4096_7436_2048,Gemm_Hipblaslt_TN_9713,0.226625
GemmTunableOp_Half_TN,tn_4096_144_7168,Gemm_Hipblaslt_TN_9472,0.0352069
GemmTunableOp_Half_TN,tn_4096_887_2048,Gemm_Hipblaslt_TN_9355,0.0379472
GemmTunableOp_Half_TN,tn_4096_240_2048,Gemm_Rocblas_621294175,0.0146716
GemmTunableOp_Half_TN,tn_14336_948_4096,Gemm_Hipblaslt_TN_9697,0.191549
GemmTunableOp_Half_TN,tn_3072_7967_4096,Gemm_Rocblas_621294473,0.350326
GemmTunableOp_Half_TN,tn_4096_216_2048,Gemm_Rocblas_621286447,0.0147458
GemmTunableOp_Half_TN,tn_14336_2653_4096,Gemm_Hipblaslt_TN_9677,0.546581
GemmTunableOp_Half_TN,tn_4096_7299_2048,Gemm_Hipblaslt_TN_9713,0.225026
GemmTunableOp_Half_TN,tn_14336_859_4096,Gemm_Hipblaslt_TN_9697,0.184539
GemmTunableOp_Half_TN,tn_3072_929_4096,Gemm_Hipblaslt_TN_9546,0.0587917
GemmTunableOp_Half_TN,tn_4096_930_2048,Gemm_Hipblaslt_TN_9549,0.039232
GemmTunableOp_Half_TN,tn_4096_943_2048,Gemm_Hipblaslt_TN_9604,0.0373525
GemmTunableOp_Half_TN,tn_3072_2785_4096,Gemm_Hipblaslt_TN_9624,0.131375
GemmTunableOp_Half_TN,tn_3072_1795_4096,Gemm_Rocblas_621286778,0.0937597
GemmTunableOp_Half_TN,tn_4096_830_7168,Gemm_Hipblaslt_TN_9158,0.107217
GemmTunableOp_Half_TN,tn_4096_1759_2048,Gemm_Hipblaslt_TN_9136,0.0634405
GemmTunableOp_Half_TN,tn_14336_1723_4096,Gemm_Hipblaslt_TN_9192,0.361167
GemmTunableOp_Half_TN,tn_4096_2786_7168,Gemm_Hipblaslt_TN_9799,0.288062
GemmTunableOp_Half_TN,tn_64128_242_4096,Gemm_Rocblas_621286905,0.293242
GemmTunableOp_Half_TN,tn_14336_3418_4096,Gemm_Rocblas_621294492,0.676467
GemmTunableOp_Half_TN,tn_4096_5606_2048,Gemm_Hipblaslt_TN_9674,0.176568
GemmTunableOp_Half_TN,tn_4096_3752_7168,Default,0.369385
GemmTunableOp_Half_TN,tn_3072_3671_4096,Gemm_Hipblaslt_TN_9672,0.165495
GemmTunableOp_Half_TN,tn_4096_922_7168,Gemm_Hipblaslt_TN_9634,0.120381
GemmTunableOp_Half_TN,tn_4096_968_7168,Gemm_Hipblaslt_TN_9604,0.124022
GemmTunableOp_Half_TN,tn_64128_237_4096,Gemm_Rocblas_621286905,0.295166
GemmTunableOp_Half_TN,tn_14336_7817_4096,Gemm_Hipblaslt_TN_9853,1.54908
GemmTunableOp_Half_TN,tn_3072_803_4096,Gemm_Hipblaslt_TN_9368,0.052651
GemmTunableOp_Half_TN,tn_4096_200_7168,Gemm_Hipblaslt_TN_9303,0.0427519
GemmTunableOp_Half_TN,tn_4096_3447_2048,Gemm_Hipblaslt_TN_9816,0.104477
GemmTunableOp_Half_TN,tn_3072_168_4096,Gemm_Rocblas_621286437,0.01899
GemmTunableOp_Half_TN,tn_64128_24_4096,Gemm_Rocblas_621286348,0.146565
GemmTunableOp_Half_TN,tn_14336_943_4096,Gemm_Hipblaslt_TN_9139,0.190518
GemmTunableOp_Half_TN,tn_4096_959_7168,Gemm_Hipblaslt_TN_9634,0.123085
GemmTunableOp_Half_TN,tn_4096_978_2048,Gemm_Hipblaslt_TN_9577,0.0390549
GemmTunableOp_Half_TN,tn_14336_843_4096,Gemm_Hipblaslt_TN_9697,0.183847
GemmTunableOp_Half_TN,tn_4096_820_2048,Gemm_Hipblaslt_TN_9634,0.0345057
GemmTunableOp_Half_TN,tn_14336_795_4096,Gemm_Hipblaslt_TN_9690,0.168896
GemmTunableOp_Half_TN,tn_14336_901_4096,Gemm_Hipblaslt_TN_9192,0.188157
GemmTunableOp_Half_TN,tn_14336_808_4096,Gemm_Hipblaslt_TN_9677,0.181006
GemmTunableOp_Half_TN,tn_4096_8192_7168,Gemm_Rocblas_621286678,0.781733
GemmTunableOp_Half_TN,tn_64128_31_4096,Gemm_Rocblas_621286348,0.150263
GemmTunableOp_Half_TN,tn_3072_1743_4096,Gemm_Hipblaslt_TN_9163,0.0921677
GemmTunableOp_Half_TN,tn_3072_2602_4096,Gemm_Hipblaslt_TN_9134,0.12559
GemmTunableOp_Half_TN,tn_14336_1794_4096,Gemm_Hipblaslt_TN_9697,0.375415
GemmTunableOp_Half_TN,tn_4096_857_7168,Gemm_Hipblaslt_TN_9099,0.116294
GemmTunableOp_Half_TN,tn_3072_2572_4096,Gemm_Hipblaslt_TN_9645,0.125285
GemmTunableOp_Half_TN,tn_3072_850_4096,Gemm_Hipblaslt_TN_9368,0.0534233
GemmTunableOp_Half_TN,tn_4096_982_2048,Gemm_Hipblaslt_TN_9577,0.0396897
GemmTunableOp_Half_TN,tn_64128_71_4096,Gemm_Hipblaslt_TN_9057,0.180489
GemmTunableOp_Half_TN,tn_3072_2517_4096,Gemm_Hipblaslt_TN_9624,0.124133
GemmTunableOp_Half_TN,tn_3072_820_4096,Gemm_Hipblaslt_TN_9047,0.0545099
GemmTunableOp_Half_TN,tn_4096_4096_5504,Gemm_Rocblas_621286281,0.30064
GemmTunableOp_Half_TN,tn_3072_3402_4096,Gemm_Hipblaslt_TN_9570,0.15622
GemmTunableOp_Half_TN,tn_3072_96_4096,Gemm_Rocblas_621286280,0.0137838
GemmTunableOp_Half_TN,tn_4096_3418_2048,Gemm_Hipblaslt_TN_9683,0.103705
GemmTunableOp_Half_TN,tn_14336_809_4096,Gemm_Hipblaslt_TN_9187,0.180614
GemmTunableOp_Half_TN,tn_64128_165_4096,Gemm_Hipblaslt_TN_9752,0.252176
GemmTunableOp_Half_TN,tn_14336_1944_4096,Gemm_Hipblaslt_TN_9220,0.402978
GemmTunableOp_Half_TN,tn_3072_1715_4096,Gemm_Rocblas_621294520,0.0912736
GemmTunableOp_Half_TN,tn_14336_900_4096,Gemm_Hipblaslt_TN_9677,0.184458
GemmTunableOp_Half_TN,tn_14336_5606_4096,Gemm_Rocblas_621286590,1.12427
GemmTunableOp_Half_TN,tn_4096_7937_2048,Gemm_Hipblaslt_TN_9753,0.236174
GemmTunableOp_Half_TN,tn_4096_1794_7168,Gemm_Hipblaslt_TN_9268,0.206424
GemmTunableOp_Half_TN,tn_4096_956_2048,Gemm_Hipblaslt_TN_9576,0.038655
GemmTunableOp_Half_TN,tn_3072_831_4096,Gemm_Hipblaslt_TN_9047,0.0549557
GemmTunableOp_Half_TN,tn_14336_2672_4096,Gemm_Hipblaslt_TN_9192,0.551091
GemmTunableOp_Half_TN,tn_4096_176_2048,Gemm_Rocblas_621294171,0.0130386
GemmTunableOp_Half_TN,tn_4096_977_2048,Gemm_Hipblaslt_TN_9634,0.0394138
GemmTunableOp_Half_TN,tn_4096_873_2048,Gemm_Hipblaslt_TN_9355,0.0380501
GemmTunableOp_Half_TN,tn_4096_2721_7168,Gemm_Hipblaslt_TN_9674,0.288524
GemmTunableOp_Half_TN,tn_4096_1700_7168,Gemm_Hipblaslt_TN_9164,0.187715
GemmTunableOp_Half_TN,tn_4096_838_2048,Gemm_Hipblaslt_TN_9352,0.0351101
GemmTunableOp_Half_TN,tn_3072_899_4096,Gemm_Hipblaslt_TN_9131,0.0593845
GemmTunableOp_Half_TN,tn_3072_1828_4096,Gemm_Hipblaslt_TN_9324,0.0940336
GemmTunableOp_Half_TN,tn_4096_1729_7168,Gemm_Hipblaslt_TN_9673,0.199288
GemmTunableOp_Half_TN,tn_64128_139_4096,Gemm_Hipblaslt_TN_9108,0.222623
GemmTunableOp_Half_TN,tn_3072_2544_4096,Gemm_Hipblaslt_TN_9624,0.122321
GemmTunableOp_Half_TN,tn_4096_1726_2048,Gemm_Hipblaslt_TN_9671,0.0600458
GemmTunableOp_Half_TN,tn_3072_2658_4096,Gemm_Hipblaslt_TN_9329,0.127336
GemmTunableOp_Half_TN,tn_4096_1791_2048,Gemm_Hipblaslt_TN_9590,0.064301
GemmTunableOp_Half_TN,tn_3072_904_4096,Gemm_Hipblaslt_TN_9352,0.0582184
GemmTunableOp_Half_TN,tn_64128_194_4096,Gemm_Rocblas_621286797,0.275903
GemmTunableOp_Half_TN,tn_4096_2698_2048,Gemm_Hipblaslt_TN_9674,0.0862668
GemmTunableOp_Half_TN,tn_64128_76_4096,Gemm_Hipblaslt_TN_9057,0.182028
GemmTunableOp_Half_TN,tn_4096_805_2048,Gemm_Hipblaslt_TN_9634,0.0344631
GemmTunableOp_Half_TN,tn_64128_12_4096,Gemm_Rocblas_621294578,0.145334
GemmTunableOp_Half_TN,tn_4096_1900_2048,Gemm_Hipblaslt_TN_9680,0.0671206
GemmTunableOp_Half_TN,tn_3072_240_4096,Gemm_Rocblas_621294173,0.0229296
GemmTunableOp_Half_TN,tn_3072_796_4096,Gemm_Hipblaslt_TN_9048,0.0517893
GemmTunableOp_Half_TN,tn_4096_1693_7168,Gemm_Hipblaslt_TN_9265,0.187229
GemmTunableOp_Half_TN,tn_4096_921_7168,Gemm_Hipblaslt_TN_9170,0.119727
GemmTunableOp_Half_TN,tn_3072_8070_4096,Gemm_Rocblas_621294467,0.357599
GemmTunableOp_Half_TN,tn_4096_8156_2048,Gemm_Hipblaslt_TN_9655,0.240312
GemmTunableOp_Half_TN,tn_4096_7266_2048,Gemm_Hipblaslt_TN_9732,0.216392
GemmTunableOp_Half_TN,tn_14336_1746_4096,Gemm_Hipblaslt_TN_9793,0.371929
GemmTunableOp_Half_TN,tn_14336_1834_4096,Gemm_Hipblaslt_TN_9192,0.380097
GemmTunableOp_Half_TN,tn_14336_2703_4096,Gemm_Hipblaslt_TN_9677,0.561136
GemmTunableOp_Half_TN,tn_3072_1755_4096,Gemm_Hipblaslt_TN_9163,0.0924625
GemmTunableOp_Half_TN,tn_14336_2763_4096,Gemm_Hipblaslt_TN_9139,0.567178
GemmTunableOp_Half_TN,tn_14336_184_4096,Gemm_Hipblaslt_TN_9352,0.0603376
GemmTunableOp_Half_TN,tn_64128_210_4096,Gemm_Hipblaslt_TN_9271,0.281601
GemmTunableOp_Half_TN,tn_14336_2722_4096,Gemm_Hipblaslt_TN_9697,0.566604
GemmTunableOp_Half_TN,tn_64128_56_4096,Gemm_Rocblas_621294562,0.170383
GemmTunableOp_Half_TN,tn_4096_895_7168,Gemm_Hipblaslt_TN_9170,0.121076
GemmTunableOp_Half_TN,tn_3072_855_4096,Gemm_Hipblaslt_TN_9352,0.0574923
GemmTunableOp_Half_TN,tn_3072_799_4096,Gemm_Hipblaslt_TN_9047,0.0525727
GemmTunableOp_Half_TN,tn_4096_900_2048,Gemm_Hipblaslt_TN_9604,0.036553
GemmTunableOp_Half_TN,tn_14336_982_4096,Gemm_Hipblaslt_TN_9217,0.206415
GemmTunableOp_Half_TN,tn_64128_124_4096,Gemm_Rocblas_621286789,0.207899
GemmTunableOp_Half_TN,tn_3072_932_4096,Gemm_Hipblaslt_TN_9546,0.0590914
GemmTunableOp_Half_TN,tn_4096_878_7168,Gemm_Rocblas_621286770,0.120659
GemmTunableOp_Half_TN,tn_3072_935_4096,Gemm_Hipblaslt_TN_9158,0.0599631
GemmTunableOp_Half_TN,tn_4096_1893_2048,Gemm_Hipblaslt_TN_9136,0.0649092
GemmTunableOp_Half_TN,tn_4096_949_2048,Gemm_Hipblaslt_TN_9634,0.0384742
GemmTunableOp_Half_TN,tn_4096_8054_7168,Gemm_Hipblaslt_TN_9220,0.767033
GemmTunableOp_Half_TN,tn_64128_170_4096,Gemm_Hipblaslt_TN_9953,0.253334
GemmTunableOp_Half_TN,tn_4096_1719_7168,Gemm_Hipblaslt_TN_9679,0.18838
GemmTunableOp_Half_TN,tn_4096_847_2048,Gemm_Hipblaslt_TN_9634,0.0366844
GemmTunableOp_Half_TN,tn_4096_837_2048,Gemm_Hipblaslt_TN_9634,0.0350848
GemmTunableOp_Half_TN,tn_4096_7817_7168,Gemm_Hipblaslt_TN_9933,0.756299
GemmTunableOp_Half_TN,tn_14336_128_4096,Gemm_Rocblas_621286469,0.0437248
GemmTunableOp_Half_TN,tn_4096_908_7168,Gemm_Hipblaslt_TN_9604,0.120783
GemmTunableOp_Half_TN,tn_4096_944_2048,Gemm_Hipblaslt_TN_9604,0.0383087
GemmTunableOp_Half_TN,tn_14336_1913_4096,Gemm_Hipblaslt_TN_9187,0.382365
GemmTunableOp_Half_TN,tn_4096_809_2048,Gemm_Hipblaslt_TN_9634,0.0349367
GemmTunableOp_Half_TN,tn_14336_961_4096,Gemm_Rocblas_621286608,0.208803
GemmTunableOp_Half_TN,tn_3072_3546_4096,Gemm_Rocblas_621294495,0.16089
GemmTunableOp_Half_TN,tn_4096_983_2048,Gemm_Hipblaslt_TN_9170,0.0400737
GemmTunableOp_Half_TN,tn_4096_1672_2048,Gemm_Hipblaslt_TN_9164,0.0592042
GemmTunableOp_Half_TN,tn_14336_2872_4096,Gemm_Hipblaslt_TN_9192,0.576674
GemmTunableOp_Half_TN,tn_4096_1614_7168,Gemm_Hipblaslt_TN_9359,0.184381
GemmTunableOp_Half_TN,tn_4096_802_2048,Gemm_Hipblaslt_TN_9604,0.0342841
GemmTunableOp_Half_TN,tn_3072_911_4096,Gemm_Hipblaslt_TN_9546,0.0575322
GemmTunableOp_Half_TN,tn_14336_849_4096,Gemm_Hipblaslt_TN_9677,0.184129
GemmTunableOp_Half_TN,tn_14336_2636_4096,Gemm_Hipblaslt_TN_9677,0.550457
GemmTunableOp_Half_TN,tn_4096_2732_2048,Gemm_Hipblaslt_TN_9691,0.0888977
GemmTunableOp_Half_TN,tn_4096_1783_7168,Gemm_Hipblaslt_TN_9134,0.204108
GemmTunableOp_Half_TN,tn_4096_2653_7168,Gemm_Hipblaslt_TN_9691,0.2803
GemmTunableOp_Half_TN,tn_3072_1835_4096,Gemm_Hipblaslt_TN_9148,0.0957199
GemmTunableOp_Half_TN,tn_14336_7937_4096,Gemm_Hipblaslt_TN_9933,1.56779
GemmTunableOp_Half_TN,tn_3072_895_4096,Gemm_Hipblaslt_TN_9131,0.0595025
GemmTunableOp_Half_TN,tn_14336_1778_4096,Gemm_Hipblaslt_TN_9192,0.370818
GemmTunableOp_Half_TN,tn_14336_829_4096,Gemm_Hipblaslt_TN_9187,0.182556
GemmTunableOp_Half_TN,tn_14336_895_4096,Gemm_Hipblaslt_TN_9187,0.186595
GemmTunableOp_Half_TN,tn_4096_2601_2048,Gemm_Hipblaslt_TN_9672,0.085684
GemmTunableOp_Half_TN,tn_3072_842_4096,Gemm_Hipblaslt_TN_9047,0.0544132
GemmTunableOp_Half_TN,tn_4096_1672_7168,Gemm_Hipblaslt_TN_9607,0.186458
GemmTunableOp_Half_TN,tn_14336_1726_4096,Gemm_Hipblaslt_TN_9139,0.363366
GemmTunableOp_Half_TN,tn_14336_1905_4096,Gemm_Hipblaslt_TN_9189,0.383068
GemmTunableOp_Half_TN,tn_4096_1600_7168,Gemm_Hipblaslt_TN_9265,0.183649
GemmTunableOp_Half_TN,tn_4096_840_2048,Gemm_Hipblaslt_TN_9251,0.0348767
GemmTunableOp_Half_TN,tn_4096_892_7168,Gemm_Hipblaslt_TN_9160,0.119933
GemmTunableOp_Half_TN,tn_14336_1727_4096,Gemm_Hipblaslt_TN_9189,0.365363
GemmTunableOp_Half_TN,tn_4096_1886_2048,Gemm_Hipblaslt_TN_9134,0.0657635
GemmTunableOp_Half_TN,tn_4096_2648_7168,Gemm_Hipblaslt_TN_9674,0.279664
GemmTunableOp_Half_TN,tn_64128_251_4096,Gemm_Rocblas_621286905,0.297902
GemmTunableOp_Half_TN,tn_4096_7787_7168,Gemm_Rocblas_621294420,0.751948
GemmTunableOp_Half_TN,tn_3072_886_4096,Gemm_Hipblaslt_TN_9251,0.0591588
GemmTunableOp_Half_TN,tn_14336_1694_4096,Gemm_Hipblaslt_TN_9189,0.361972
GemmTunableOp_Half_TN,tn_64128_98_4096,Gemm_Hipblaslt_TN_9263,0.197475
GemmTunableOp_Half_TN,tn_4096_1850_2048,Gemm_Hipblaslt_TN_9134,0.0655479
GemmTunableOp_Half_TN,tn_64128_182_4096,Gemm_Hipblaslt_TN_9862,0.257955
GemmTunableOp_Half_TN,tn_3072_901_4096,Gemm_Hipblaslt_TN_9147,0.0585148
GemmTunableOp_Half_TN,tn_3072_184_4096,Gemm_Rocblas_621294164,0.0189208
GemmTunableOp_Half_TN,tn_14336_3546_4096,Gemm_Hipblaslt_TN_9223,0.684384
GemmTunableOp_Half_TN,tn_4096_3662_7168,Gemm_Hipblaslt_TN_9827,0.366336
GemmTunableOp_Half_TN,tn_3072_861_4096,Gemm_Hipblaslt_TN_9047,0.0556215
GemmTunableOp_Half_TN,tn_14336_845_4096,Gemm_Hipblaslt_TN_9697,0.183709
GemmTunableOp_Half_TN,tn_4096_1733_7168,Gemm_Hipblaslt_TN_9673,0.201036
GemmTunableOp_Half_TN,tn_3072_834_4096,Gemm_Hipblaslt_TN_9047,0.0545721
GemmTunableOp_Half_TN,tn_4096_831_2048,Gemm_Hipblaslt_TN_9352,0.0340884
GemmTunableOp_Half_TN,tn_3072_1600_4096,Gemm_Hipblaslt_TN_9561,0.0869781
GemmTunableOp_Half_TN,tn_4096_836_2048,Gemm_Hipblaslt_TN_9352,0.0356336
GemmTunableOp_Half_TN,tn_4096_1723_7168,Gemm_Hipblaslt_TN_9265,0.188843
GemmTunableOp_Half_TN,tn_4096_937_2048,Gemm_Hipblaslt_TN_9604,0.0382375
GemmTunableOp_Half_TN,tn_64128_78_4096,Gemm_Hipblaslt_TN_9057,0.180446
GemmTunableOp_Half_TN,tn_3072_851_4096,Gemm_Hipblaslt_TN_9047,0.0555356
GemmTunableOp_Half_TN,tn_3072_815_4096,Gemm_Hipblaslt_TN_9047,0.0541613
GemmTunableOp_Half_TN,tn_4096_985_7168,Gemm_Hipblaslt_TN_9170,0.126252
GemmTunableOp_Half_TN,tn_14336_72_4096,Gemm_Hipblaslt_TN_9495,0.0335167
GemmTunableOp_Half_TN,tn_14336_878_4096,Gemm_Hipblaslt_TN_9677,0.186534
GemmTunableOp_Half_TN,tn_64128_225_4096,Gemm_Rocblas_621286554,0.29688
GemmTunableOp_Half_TN,tn_4096_1944_2048,Gemm_Hipblaslt_TN_9590,0.0669908
GemmTunableOp_Half_TN,tn_64128_178_4096,Gemm_Hipblaslt_TN_9855,0.254819
GemmTunableOp_Half_TN,tn_4096_1729_2048,Gemm_Hipblaslt_TN_9329,0.062331
GemmTunableOp_Half_TN,tn_3072_3565_4096,Gemm_Rocblas_621294495,0.160152
GemmTunableOp_Half_TN,tn_3072_3556_4096,Gemm_Hipblaslt_TN_9619,0.16175
GemmTunableOp_Half_TN,tn_4096_944_7168,Gemm_Hipblaslt_TN_9604,0.121767
GemmTunableOp_Half_TN,tn_3072_854_4096,Gemm_Hipblaslt_TN_9048,0.0568106
GemmTunableOp_Half_TN,tn_4096_894_7168,Gemm_Hipblaslt_TN_9170,0.118889
GemmTunableOp_Half_TN,tn_4096_2717_2048,Gemm_Hipblaslt_TN_9799,0.0868065
GemmTunableOp_Half_TN,tn_4096_819_2048,Gemm_Hipblaslt_TN_9604,0.0353783
GemmTunableOp_Half_TN,tn_14336_2681_4096,Gemm_Hipblaslt_TN_9793,0.554399
GemmTunableOp_Half_TN,tn_3072_2721_4096,Gemm_Hipblaslt_TN_9624,0.130149
GemmTunableOp_Half_TN,tn_4096_2719_2048,Gemm_Hipblaslt_TN_9689,0.0861574
GemmTunableOp_Half_TN,tn_3072_954_4096,Gemm_Hipblaslt_TN_9158,0.0605394
GemmTunableOp_Half_TN,tn_4096_7967_7168,Gemm_Hipblaslt_TN_9903,0.764882
GemmTunableOp_Half_TN,tn_64128_181_4096,Gemm_Hipblaslt_TN_9855,0.255575
GemmTunableOp_Half_TN,tn_4096_1931_7168,Gemm_Hipblaslt_TN_9645,0.21484
GemmTunableOp_Half_TN,tn_4096_3711_7168,Gemm_Hipblaslt_TN_9220,0.368887
GemmTunableOp_Half_TN,tn_14336_2860_4096,Gemm_Hipblaslt_TN_9677,0.573854
GemmTunableOp_Half_TN,tn_4096_850_7168,Gemm_Hipblaslt_TN_9547,0.114386
GemmTunableOp_Half_TN,tn_3072_1913_4096,Gemm_Hipblaslt_TN_9561,0.0961187
GemmTunableOp_Half_TN,tn_4096_2717_7168,Gemm_Hipblaslt_TN_9672,0.28334
GemmTunableOp_Half_TN,tn_4096_940_2048,Gemm_Hipblaslt_TN_9634,0.0387106
GemmTunableOp_Half_TN,tn_3072_811_4096,Gemm_Hipblaslt_TN_9047,0.0533317
GemmTunableOp_Half_TN,tn_4096_7857_2048,Gemm_Hipblaslt_TN_9746,0.237087
GemmTunableOp_Half_TN,tn_4096_48_7168,Gemm_Rocblas_621286419,0.0195027
GemmTunableOp_Half_TN,tn_14336_2602_4096,Gemm_Hipblaslt_TN_9793,0.546073
GemmTunableOp_Half_TN,tn_4096_1649_7168,Gemm_Hipblaslt_TN_9265,0.186859
GemmTunableOp_Half_TN,tn_4096_808_2048,Gemm_Hipblaslt_TN_9604,0.0348293
GemmTunableOp_Half_TN,tn_3072_1729_4096,Gemm_Hipblaslt_TN_9163,0.0916906
GemmTunableOp_Half_TN,tn_4096_3430_2048,Gemm_Hipblaslt_TN_9896,0.103703
GemmTunableOp_Half_TN,tn_64128_236_4096,Gemm_Rocblas_621286905,0.293222
GemmTunableOp_Half_TN,tn_14336_873_4096,Gemm_Hipblaslt_TN_9139,0.18564
GemmTunableOp_Half_TN,tn_4096_925_7168,Gemm_Hipblaslt_TN_9604,0.120632
GemmTunableOp_Half_TN,tn_14336_1807_4096,Gemm_Hipblaslt_TN_9677,0.373721
GemmTunableOp_Half_TN,tn_4096_1785_2048,Gemm_Hipblaslt_TN_9680,0.0646297
GemmTunableOp_Half_TN,tn_4096_2590_7168,Gemm_Hipblaslt_TN_9799,0.276021
GemmTunableOp_Half_TN,tn_4096_900_7168,Gemm_Hipblaslt_TN_9576,0.119621
GemmTunableOp_Half_TN,tn_4096_2592_2048,Gemm_Hipblaslt_TN_9687,0.0859277
GemmTunableOp_Half_TN,tn_4096_2764_7168,Gemm_Hipblaslt_TN_9709,0.28887
GemmTunableOp_Half_TN,tn_14336_882_4096,Gemm_Hipblaslt_TN_9697,0.187008
GemmTunableOp_Half_TN,tn_14336_790_4096,Gemm_Hipblaslt_TN_9691,0.166545
GemmTunableOp_Half_TN,tn_4096_912_2048,Gemm_Hipblaslt_TN_9604,0.037338
GemmTunableOp_Half_TN,tn_4096_1768_2048,Gemm_Hipblaslt_TN_9329,0.0638682
GemmTunableOp_Half_TN,tn_3072_846_4096,Gemm_Hipblaslt_TN_9047,0.055098
GemmTunableOp_Half_TN,tn_14336_846_4096,Gemm_Hipblaslt_TN_9697,0.183636
GemmTunableOp_Half_TN,tn_14336_836_4096,Gemm_Hipblaslt_TN_9697,0.184013
GemmTunableOp_Half_TN,tn_4096_839_7168,Gemm_Hipblaslt_TN_9634,0.114476
GemmTunableOp_Half_TN,tn_3072_849_4096,Gemm_Hipblaslt_TN_9368,0.0544822
GemmTunableOp_Half_TN,tn_4096_8054_2048,Gemm_Hipblaslt_TN_9713,0.237454
GemmTunableOp_Half_TN,tn_14336_863_4096,Gemm_Hipblaslt_TN_9697,0.18508
GemmTunableOp_Half_TN,tn_3072_1718_4096,Gemm_Rocblas_621294520,0.0911313
GemmTunableOp_Half_TN,tn_64128_50_4096,Gemm_Hipblaslt_TN_9168,0.169373
GemmTunableOp_Half_TN,tn_4096_1666_7168,Gemm_Hipblaslt_TN_9164,0.185674
GemmTunableOp_Half_TN,tn_4096_861_2048,Gemm_Hipblaslt_TN_9583,0.0360968
GemmTunableOp_Half_TN,tn_14336_1831_4096,Gemm_Hipblaslt_TN_9189,0.378499
GemmTunableOp_Half_TN,tn_4096_3671_2048,Gemm_Hipblaslt_TN_9704,0.113732
GemmTunableOp_Half_TN,tn_4096_817_2048,Gemm_Hipblaslt_TN_9547,0.0349756
GemmTunableOp_Half_TN,tn_4096_870_2048,Gemm_Hipblaslt_TN_9252,0.0374396
GemmTunableOp_Half_TN,tn_4096_2628_2048,Gemm_Hipblaslt_TN_9689,0.0860326
GemmTunableOp_Half_TN,tn_3072_1730_4096,Gemm_Hipblaslt_TN_9163,0.0918349
GemmTunableOp_Half_TN,tn_4096_2788_2048,Gemm_Hipblaslt_TN_9689,0.0895124
GemmTunableOp_Half_TN,tn_4096_843_2048,Gemm_Hipblaslt_TN_9634,0.0360629
GemmTunableOp_Half_TN,tn_3072_949_4096,Gemm_Hipblaslt_TN_9158,0.0607669
GemmTunableOp_Half_TN,tn_64128_249_4096,Gemm_Rocblas_621286905,0.295827
GemmTunableOp_Half_TN,tn_4096_1880_2048,Gemm_Hipblaslt_TN_9134,0.0654053
GemmTunableOp_Half_TN,tn_4096_4471_7168,Gemm_Hipblaslt_TN_9763,0.465655
GemmTunableOp_Half_TN,tn_4096_825_7168,Gemm_Hipblaslt_TN_9158,0.111694
GemmTunableOp_Half_TN,tn_14336_1755_4096,Gemm_Hipblaslt_TN_9187,0.372374
GemmTunableOp_Half_TN,tn_4096_16_2048,Gemm_Rocblas_621294047,0.00707942
GemmTunableOp_Half_TN,tn_14336_853_4096,Gemm_Hipblaslt_TN_9677,0.185587
GemmTunableOp_Half_TN,tn_4096_7787_2048,Gemm_Hipblaslt_TN_9813,0.232565
GemmTunableOp_Half_TN,tn_14336_64_4096,Gemm_Rocblas_621294557,0.0305545
GemmTunableOp_Half_TN,tn_64128_205_4096,Gemm_Hipblaslt_TN_9260,0.277324
GemmTunableOp_Half_TN,tn_14336_16_4096,Gemm_Rocblas_621286317,0.0240143
GemmTunableOp_Half_TN,tn_4096_812_2048,Gemm_Hipblaslt_TN_9354,0.0345304
GemmTunableOp_Half_TN,tn_4096_825_2048,Gemm_Hipblaslt_TN_9634,0.0356905
GemmTunableOp_Half_TN,tn_4096_800_7168,Gemm_Hipblaslt_TN_9158,0.106394
GemmTunableOp_Half_TN,tn_4096_898_2048,Gemm_Hipblaslt_TN_9589,0.0370403
GemmTunableOp_Half_TN,tn_4096_1893_7168,Gemm_Hipblaslt_TN_9267,0.21244
GemmTunableOp_Half_TN,tn_3072_3752_4096,Gemm_Hipblaslt_TN_9852,0.167281
GemmTunableOp_Half_TN,tn_14336_1841_4096,Gemm_Hipblaslt_TN_9677,0.373975
GemmTunableOp_Half_TN,tn_4096_934_2048,Gemm_Hipblaslt_TN_9604,0.037631
GemmTunableOp_Half_TN,tn_14336_938_4096,Gemm_Hipblaslt_TN_9697,0.191114
GemmTunableOp_Half_TN,tn_4096_2658_2048,Gemm_Hipblaslt_TN_9657,0.0868182
GemmTunableOp_Half_TN,tn_4096_1798_2048,Gemm_Hipblaslt_TN_9590,0.0636704
GemmTunableOp_Half_TN,tn_64128_65_4096,Gemm_Hipblaslt_TN_9057,0.176659
GemmTunableOp_Half_TN,tn_4096_851_7168,Gemm_Hipblaslt_TN_9099,0.114825
GemmTunableOp_Half_TN,tn_4096_1817_7168,Gemm_Hipblaslt_TN_9136,0.207518
GemmTunableOp_Half_TN,tn_3072_3662_4096,Gemm_Hipblaslt_TN_9674,0.167106
GemmTunableOp_Half_TN,tn_3072_1837_4096,Gemm_Hipblaslt_TN_9615,0.0948811
GemmTunableOp_Half_TN,tn_14336_8069_4096,Gemm_Hipblaslt_TN_9930,1.60435
GemmTunableOp_Half_TN,tn_64128_153_4096,Gemm_Hipblaslt_TN_9108,0.230583
GemmTunableOp_Half_TN,tn_4096_906_2048,Gemm_Hipblaslt_TN_9604,0.035917
GemmTunableOp_Half_TN,tn_4096_842_7168,Gemm_Hipblaslt_TN_9170,0.116312
GemmTunableOp_Half_TN,tn_3072_1768_4096,Gemm_Rocblas_621286778,0.0915304
GemmTunableOp_Half_TN,tn_4096_7239_2048,Gemm_Hipblaslt_TN_9694,0.216631
GemmTunableOp_Half_TN,tn_4096_1805_2048,Gemm_Hipblaslt_TN_9590,0.0639801
GemmTunableOp_Half_TN,tn_4096_1803_2048,Gemm_Hipblaslt_TN_9590,0.0637641
GemmTunableOp_Half_TN,tn_4096_120_2048,Gemm_Rocblas_621286443,0.0113154
GemmTunableOp_Half_TN,tn_4096_2788_7168,Gemm_Hipblaslt_TN_9709,0.290671
GemmTunableOp_Half_TN,tn_3072_2750_4096,Gemm_Hipblaslt_TN_9624,0.130459
GemmTunableOp_Half_TN,tn_14336_7952_4096,Gemm_Hipblaslt_TN_9914,1.57005
GemmTunableOp_Half_TN,tn_64128_62_4096,Gemm_Hipblaslt_TN_9097,0.16432
GemmTunableOp_Half_TN,tn_4096_1724_2048,Gemm_Hipblaslt_TN_9569,0.0605646
GemmTunableOp_Half_TN,tn_3072_7787_4096,Gemm_Hipblaslt_TN_9800,0.348024
GemmTunableOp_Half_TN,tn_64128_167_4096,Gemm_Hipblaslt_TN_9817,0.252611
GemmTunableOp_Half_TN,tn_4096_7239_7168,Gemm_Hipblaslt_TN_9743,0.705353
GemmTunableOp_Half_TN,tn_14336_1791_4096,Gemm_Hipblaslt_TN_9192,0.370747
GemmTunableOp_Half_TN,tn_4096_835_7168,Gemm_Hipblaslt_TN_9634,0.114297
GemmTunableOp_Half_TN,tn_3072_912_4096,Gemm_Hipblaslt_TN_9546,0.058019
GemmTunableOp_Half_TN,tn_14336_2764_4096,Gemm_Hipblaslt_TN_9697,0.568388
GemmTunableOp_Half_TN,tn_3072_1867_4096,Gemm_Hipblaslt_TN_9324,0.093689
GemmTunableOp_Half_TN,tn_64128_230_4096,Gemm_Rocblas_621286892,0.293412
GemmTunableOp_Half_TN,tn_14336_1705_4096,Gemm_Hipblaslt_TN_9139,0.362688
GemmTunableOp_Half_TN,tn_3072_88_4096,Gemm_Rocblas_621286280,0.0138944
GemmTunableOp_Half_TN,tn_3072_1737_4096,Gemm_Hipblaslt_TN_9163,0.0917489
GemmTunableOp_Half_TN,tn_4096_7804_7168,Gemm_Hipblaslt_TN_9220,0.755132
GemmTunableOp_Half_TN,tn_64128_64_4096,Gemm_Hipblaslt_TN_9097,0.167344
GemmTunableOp_Half_TN,tn_14336_3402_4096,Gemm_Hipblaslt_TN_9220,0.669369
GemmTunableOp_Half_TN,tn_3072_862_4096,Gemm_Hipblaslt_TN_9047,0.0555814
GemmTunableOp_Half_TN,tn_3072_2599_4096,Gemm_Hipblaslt_TN_9645,0.124933
GemmTunableOp_Half_TN,tn_64128_30_4096,Gemm_Hipblaslt_TN_9094,0.147259
GemmTunableOp_Half_TN,tn_4096_1828_2048,Gemm_Hipblaslt_TN_9136,0.0639951
GemmTunableOp_Half_TN,tn_64128_218_4096,Gemm_Hipblaslt_TN_9271,0.281085
GemmTunableOp_Half_TN,tn_3072_868_4096,Gemm_Hipblaslt_TN_9546,0.0584343
GemmTunableOp_Half_TN,tn_4096_848_7168,Gemm_Hipblaslt_TN_9099,0.114589
GemmTunableOp_Half_TN,tn_14336_2786_4096,Gemm_Hipblaslt_TN_9187,0.566071
GemmTunableOp_Half_TN,tn_3072_2651_4096,Gemm_Hipblaslt_TN_9329,0.12635
GemmTunableOp_Half_TN,tn_64128_121_4096,Gemm_Hipblaslt_TN_9263,0.208006
GemmTunableOp_Half_TN,tn_4096_940_7168,Gemm_Hipblaslt_TN_9577,0.121471
GemmTunableOp_Half_TN,tn_4096_899_7168,Gemm_Hipblaslt_TN_9604,0.120084
GemmTunableOp_Half_TN,tn_14336_957_4096,Gemm_Hipblaslt_TN_9187,0.19117
GemmTunableOp_Half_TN,tn_3072_2793_4096,Gemm_Hipblaslt_TN_9624,0.129568
GemmTunableOp_Half_TN,tn_4096_2682_7168,Gemm_Hipblaslt_TN_9690,0.280603
GemmTunableOp_Half_TN,tn_3072_1777_4096,Gemm_Hipblaslt_TN_9720,0.0939652
GemmTunableOp_Half_TN,tn_14336_8049_4096,Gemm_Hipblaslt_TN_9930,1.57692
GemmTunableOp_Half_TN,tn_4096_3507_2048,Gemm_Hipblaslt_TN_9896,0.107701
GemmTunableOp_Half_TN,tn_4096_2628_7168,Gemm_Hipblaslt_TN_9799,0.278684
GemmTunableOp_Half_TN,tn_4096_986_2048,Gemm_Hipblaslt_TN_9608,0.039627
GemmTunableOp_Half_TN,tn_14336_2708_4096,Gemm_Hipblaslt_TN_9677,0.562824
GemmTunableOp_Half_TN,tn_4096_1762_2048,Gemm_Hipblaslt_TN_9680,0.0632866
GemmTunableOp_Half_TN,tn_3072_1724_4096,Gemm_Rocblas_621294520,0.0909916
GemmTunableOp_Half_TN,tn_4096_957_7168,Gemm_Hipblaslt_TN_9576,0.122197
GemmTunableOp_Half_TN,tn_3072_3507_4096,Gemm_Hipblaslt_TN_9570,0.159646
GemmTunableOp_Half_TN,tn_4096_8049_2048,Gemm_Hipblaslt_TN_9655,0.235935
GemmTunableOp_Half_TN,tn_14336_972_4096,Gemm_Hipblaslt_TN_9217,0.208168
GemmTunableOp_Half_TN,tn_4096_16_7168,Gemm_Rocblas_621294135,0.013229
GemmTunableOp_Half_TN,tn_4096_820_7168,Gemm_Hipblaslt_TN_9634,0.112746
GemmTunableOp_Half_TN,tn_4096_1701_2048,Gemm_Hipblaslt_TN_9671,0.0586376
GemmTunableOp_Half_TN,tn_4096_1700_2048,Gemm_Hipblaslt_TN_9671,0.0597266
GemmTunableOp_Half_TN,tn_4096_988_7168,Gemm_Hipblaslt_TN_9052,0.125867
GemmTunableOp_Half_TN,tn_4096_895_2048,Gemm_Hipblaslt_TN_9576,0.0373977
GemmTunableOp_Half_TN,tn_64128_191_4096,Gemm_Hipblaslt_TN_9862,0.259132
GemmTunableOp_Half_TN,tn_3072_863_4096,Gemm_Hipblaslt_TN_9047,0.0553452
GemmTunableOp_Half_TN,tn_4096_971_7168,Gemm_Hipblaslt_TN_9604,0.125077
GemmTunableOp_Half_TN,tn_14336_1828_4096,Gemm_Hipblaslt_TN_9697,0.377518
GemmTunableOp_Half_TN,tn_3072_876_4096,Gemm_Hipblaslt_TN_9352,0.0567586
GemmTunableOp_Half_TN,tn_4096_1737_7168,Gemm_Hipblaslt_TN_9673,0.199683
GemmTunableOp_Half_TN,tn_4096_854_2048,Gemm_Hipblaslt_TN_9352,0.0352856
GemmTunableOp_Half_TN,tn_4096_4483_2048,Gemm_Hipblaslt_TN_9831,0.144389
GemmTunableOp_Half_TN,tn_3072_948_4096,Gemm_Hipblaslt_TN_9131,0.0584998
GemmTunableOp_Half_TN,tn_14336_2785_4096,Gemm_Hipblaslt_TN_9697,0.570338
GemmTunableOp_Half_TN,tn_3072_1778_4096,Gemm_Rocblas_621286778,0.0927234
GemmTunableOp_Half_TN,tn_14336_1954_4096,Gemm_Hipblaslt_TN_9217,0.407096
GemmTunableOp_Half_TN,tn_3072_1815_4096,Gemm_Rocblas_621286778,0.0919919
GemmTunableOp_Half_TN,tn_3072_1954_4096,Gemm_Hipblaslt_TN_9633,0.0993173
GemmTunableOp_Half_TN,tn_14336_839_4096,Gemm_Hipblaslt_TN_9697,0.183726
GemmTunableOp_Half_TN,tn_14336_1762_4096,Gemm_Hipblaslt_TN_9139,0.374517
GemmTunableOp_Half_TN,tn_4096_927_7168,Gemm_Hipblaslt_TN_9634,0.119719
GemmTunableOp_Half_TN,tn_3072_853_4096,Gemm_Hipblaslt_TN_9047,0.0544442
GemmTunableOp_Half_TN,tn_4096_855_2048,Gemm_Hipblaslt_TN_9352,0.0358538
GemmTunableOp_Half_TN,tn_4096_7967_2048,Gemm_Hipblaslt_TN_9713,0.236289
GemmTunableOp_Half_TN,tn_14336_1719_4096,Gemm_Hipblaslt_TN_9697,0.360058
GemmTunableOp_Half_TN,tn_14336_956_4096,Gemm_Hipblaslt_TN_9697,0.190957
GemmTunableOp_Half_TN,tn_4096_1792_2048,Gemm_Hipblaslt_TN_9680,0.0627609
GemmTunableOp_Half_TN,tn_4096_799_7168,Gemm_Hipblaslt_TN_9158,0.108819
GemmTunableOp_Half_TN,tn_4096_8110_2048,Gemm_Hipblaslt_TN_9768,0.239979
GemmTunableOp_Half_TN,tn_14336_837_4096,Gemm_Hipblaslt_TN_9192,0.184536
GemmTunableOp_Half_TN,tn_4096_1775_2048,Gemm_Hipblaslt_TN_9136,0.0641305
GemmTunableOp_Half_TN,tn_14336_3447_4096,Gemm_Rocblas_621286693,0.668017
GemmTunableOp_Half_TN,tn_3072_1644_4096,Gemm_Hipblaslt_TN_9148,0.0899291
GemmTunableOp_Half_TN,tn_4096_1727_7168,Gemm_Hipblaslt_TN_9265,0.189326
GemmTunableOp_Half_TN,tn_4096_224_2048,Gemm_Rocblas_621294168,0.0151196
GemmTunableOp_Half_TN,tn_14336_4463_4096,Gemm_Hipblaslt_TN_9223,0.879714
GemmTunableOp_Half_TN,tn_3072_916_4096,Gemm_Hipblaslt_TN_9251,0.05967
GemmTunableOp_Half_TN,tn_64128_196_4096,Gemm_Rocblas_621286797,0.275705
GemmTunableOp_Half_TN,tn_4096_7436_7168,Gemm_Hipblaslt_TN_9914,0.733335
GemmTunableOp_Half_TN,tn_3072_1931_4096,Gemm_Hipblaslt_TN_9633,0.100087
GemmTunableOp_Half_TN,tn_14336_817_4096,Gemm_Hipblaslt_TN_9677,0.180538
GemmTunableOp_Half_TN,tn_4096_1829_2048,Gemm_Hipblaslt_TN_9680,0.0655308
GemmTunableOp_Half_TN,tn_4096_2590_2048,Gemm_Hipblaslt_TN_9799,0.0860409
GemmTunableOp_Half_TN,tn_14336_797_4096,Gemm_Hipblaslt_TN_9691,0.16809
GemmTunableOp_Half_TN,tn_3072_3711_4096,Gemm_Hipblaslt_TN_9852,0.168065
GemmTunableOp_Half_TN,tn_4096_2670_7168,Gemm_Hipblaslt_TN_9799,0.279763
GemmTunableOp_Half_TN,tn_4096_984_2048,Gemm_Hipblaslt_TN_9604,0.0404449
GemmTunableOp_Half_TN,tn_4096_88_2048,Gemm_Rocblas_621286278,0.00937046
GemmTunableOp_Half_TN,tn_14336_985_4096,Gemm_Rocblas_621286554,0.210163
GemmTunableOp_Half_TN,tn_4096_2509_2048,Gemm_Hipblaslt_TN_9687,0.0831908
GemmTunableOp_Half_TN,tn_64128_214_4096,Gemm_Hipblaslt_TN_9271,0.281769
GemmTunableOp_Half_TN,tn_4096_929_7168,Gemm_Hipblaslt_TN_9547,0.120083
GemmTunableOp_Half_TN,tn_4096_898_7168,Gemm_Hipblaslt_TN_9576,0.120305
GemmTunableOp_Half_TN,tn_4096_921_2048,Gemm_Hipblaslt_TN_9577,0.0377656
GemmTunableOp_Half_TN,tn_14336_168_4096,Gemm_Rocblas_621294461,0.0593458
GemmTunableOp_Half_TN,tn_64128_10_4096,Gemm_Rocblas_621286348,0.144169
GemmTunableOp_Half_TN,tn_14336_8156_4096,Gemm_Hipblaslt_TN_9903,1.60359
GemmTunableOp_Half_TN,tn_14336_7863_4096,Gemm_Hipblaslt_TN_9853,1.56678
GemmTunableOp_Half_TN,tn_4096_839_2048,Gemm_Hipblaslt_TN_9251,0.0349077
GemmTunableOp_Half_TN,tn_4096_956_7168,Gemm_Hipblaslt_TN_9170,0.12176
GemmTunableOp_Half_TN,tn_64128_243_4096,Gemm_Rocblas_621286905,0.299572
GemmTunableOp_Half_TN,tn_14336_1733_4096,Gemm_Hipblaslt_TN_9139,0.371953
GemmTunableOp_Half_TN,tn_64128_109_4096,Gemm_Hipblaslt_TN_9263,0.204632
GemmTunableOp_Half_TN,tn_14336_2793_4096,Gemm_Hipblaslt_TN_9677,0.571695
GemmTunableOp_Half_TN,tn_14336_951_4096,Gemm_Hipblaslt_TN_9697,0.191683
GemmTunableOp_Half_TN,tn_4096_2793_7168,Gemm_Hipblaslt_TN_9672,0.290227
GemmTunableOp_Half_TN,tn_4096_1719_2048,Gemm_Hipblaslt_TN_9328,0.0596053
GemmTunableOp_Half_TN,tn_4096_832_7168,Gemm_Hipblaslt_TN_9547,0.11354
GemmTunableOp_Half_TN,tn_4096_842_2048,Gemm_Hipblaslt_TN_9604,0.0363944
GemmTunableOp_Half_TN,tn_3072_2699_4096,Gemm_Hipblaslt_TN_9567,0.129043
GemmTunableOp_Half_TN,tn_4096_823_7168,Gemm_Hipblaslt_TN_9158,0.109956
GemmTunableOp_Half_TN,tn_64128_11_4096,Gemm_Rocblas_621286348,0.144391
GemmTunableOp_Half_TN,tn_64128_160_4096,Gemm_Rocblas_621286614,0.225421
GemmTunableOp_Half_TN,tn_4096_3670_7168,Gemm_Hipblaslt_TN_9223,0.367483
GemmTunableOp_Half_TN,tn_64128_146_4096,Gemm_Hipblaslt_TN_9108,0.225096
GemmTunableOp_Half_TN,tn_14336_805_4096,Gemm_Hipblaslt_TN_9677,0.180392
GemmTunableOp_Half_TN,tn_4096_40_2048,Gemm_Rocblas_621294155,0.00793952
GemmTunableOp_Half_TN,tn_3072_940_4096,Gemm_Hipblaslt_TN_9546,0.0589673
GemmTunableOp_Half_TN,tn_4096_1739_2048,Gemm_Hipblaslt_TN_9680,0.062607
GemmTunableOp_Half_TN,tn_3072_56_4096,Gemm_Rocblas_621294148,0.0113084
GemmTunableOp_Half_TN,tn_14336_887_4096,Gemm_Hipblaslt_TN_9139,0.18627
GemmTunableOp_Half_TN,tn_4096_1883_2048,Gemm_Hipblaslt_TN_9590,0.0651176
GemmTunableOp_Half_TN,tn_4096_1827_7168,Gemm_Hipblaslt_TN_9137,0.207649
GemmTunableOp_Half_TN,tn_4096_880_2048,Gemm_Hipblaslt_TN_9252,0.0376197
GemmTunableOp_Half_TN,tn_4096_978_7168,Gemm_Hipblaslt_TN_9052,0.124643
GemmTunableOp_Half_TN,tn_3072_2732_4096,Gemm_Hipblaslt_TN_9624,0.129079
GemmTunableOp_Half_TN,tn_14336_1837_4096,Gemm_Hipblaslt_TN_9677,0.377247
GemmTunableOp_Half_TN,tn_4096_3402_7168,Gemm_Hipblaslt_TN_9683,0.340709
GemmTunableOp_Half_TN,tn_3072_879_4096,Gemm_Hipblaslt_TN_9131,0.0578316
GemmTunableOp_Half_TN,tn_4096_2670_2048,Gemm_Hipblaslt_TN_9709,0.0865302
GemmTunableOp_Half_TN,tn_4096_3418_7168,Gemm_Hipblaslt_TN_9139,0.341845
GemmTunableOp_Half_TN,tn_4096_3479_7168,Gemm_Hipblaslt_TN_9139,0.345974
GemmTunableOp_Half_TN,tn_4096_3431_2048,Gemm_Hipblaslt_TN_9896,0.103614
GemmTunableOp_Half_TN,tn_3072_16_4096,Gemm_Rocblas_621294130,0.00834448
GemmTunableOp_Half_TN,tn_3072_809_4096,Gemm_Hipblaslt_TN_9047,0.0527965
GemmTunableOp_Half_TN,tn_3072_1905_4096,Gemm_Hipblaslt_TN_9561,0.0946158
GemmTunableOp_Half_TN,tn_4096_2658_7168,Gemm_Hipblaslt_TN_9799,0.280466
GemmTunableOp_Half_TN,tn_4096_1715_7168,Gemm_Hipblaslt_TN_9671,0.188459
GemmTunableOp_Half_TN,tn_16000_232_4096,Gemm_Rocblas_621294217,0.0751754
GemmTunableOp_Half_TN,tn_3072_24_4096,Gemm_Rocblas_621294054,0.00925243
GemmTunableOp_Half_TN,tn_14336_3662_4096,Gemm_Hipblaslt_TN_9677,0.755569
GemmTunableOp_Half_TN,tn_4096_990_2048,Gemm_Hipblaslt_TN_9608,0.0394196
GemmTunableOp_Half_TN,tn_4096_56_2048,Gemm_Rocblas_621294155,0.00803601
GemmTunableOp_Half_TN,tn_64128_133_4096,Gemm_Hipblaslt_TN_9108,0.226109
GemmTunableOp_Half_TN,tn_3072_832_4096,Gemm_Hipblaslt_TN_9368,0.0525099
GemmTunableOp_Half_TN,tn_4096_935_2048,Gemm_Hipblaslt_TN_9577,0.0383373
GemmTunableOp_Half_TN,tn_64128_203_4096,Gemm_Rocblas_621286797,0.278056
GemmTunableOp_Half_TN,tn_64128_53_4096,Gemm_Hipblaslt_TN_9146,0.169656
GemmTunableOp_Half_TN,tn_14336_152_4096,Gemm_Hipblaslt_TN_9312,0.053528
GemmTunableOp_Half_TN,tn_4096_888_7168,Gemm_Hipblaslt_TN_9634,0.121683
GemmTunableOp_Half_TN,tn_3072_1757_4096,Gemm_Hipblaslt_TN_9163,0.0922454
GemmTunableOp_Half_TN,tn_4096_1905_2048,Gemm_Hipblaslt_TN_9174,0.0669323
GemmTunableOp_Half_TN,tn_3072_7798_4096,Gemm_Hipblaslt_TN_9622,0.347465
GemmTunableOp_Half_TN,tn_4096_8000_2048,Gemm_Rocblas_621294030,0.235573
GemmTunableOp_Half_TN,tn_4096_2648_2048,Gemm_Hipblaslt_TN_9709,0.086913
GemmTunableOp_Half_TN,tn_3072_794_4096,Gemm_Hipblaslt_TN_9368,0.0525562
GemmTunableOp_Half_TN,tn_4096_3599_2048,Gemm_Hipblaslt_TN_9683,0.108491
GemmTunableOp_Half_TN,tn_14336_912_4096,Gemm_Hipblaslt_TN_9697,0.188913
GemmTunableOp_Half_TN,tn_4096_1854_7168,Gemm_Hipblaslt_TN_9136,0.207937
GemmTunableOp_Half_TN,tn_3072_887_4096,Gemm_Hipblaslt_TN_9546,0.0577098
GemmTunableOp_Half_TN,tn_14336_857_4096,Gemm_Hipblaslt_TN_9697,0.185505
GemmTunableOp_Half_TN,tn_3072_840_4096,Gemm_Hipblaslt_TN_9368,0.0567124
GemmTunableOp_Half_TN,tn_14336_1854_4096,Gemm_Hipblaslt_TN_9139,0.38068
GemmTunableOp_Half_TN,tn_4096_88_7168,Gemm_Rocblas_621286279,0.0249245
GemmTunableOp_Half_TN,tn_4096_915_2048,Gemm_Hipblaslt_TN_9604,0.0380079
GemmTunableOp_Half_TN,tn_14336_88_4096,Gemm_Hipblaslt_TN_9496,0.0358558
GemmTunableOp_Half_TN,tn_4096_866_7168,Gemm_Hipblaslt_TN_9355,0.119766
GemmTunableOp_Half_TN,tn_14336_7283_4096,Gemm_Hipblaslt_TN_9683,1.43411
GemmTunableOp_Half_TN,tn_4096_807_2048,Gemm_Hipblaslt_TN_9547,0.0347987
GemmTunableOp_Half_TN,tn_14336_8070_4096,Gemm_Hipblaslt_TN_9891,1.60507
GemmTunableOp_Half_TN,tn_4096_958_7168,Gemm_Hipblaslt_TN_9576,0.121102
GemmTunableOp_Half_TN,tn_14336_7239_4096,Gemm_Hipblaslt_TN_9683,1.44043
GemmTunableOp_Half_TN,tn_3072_1701_4096,Gemm_Hipblaslt_TN_9613,0.0917526
GemmTunableOp_Half_TN,tn_3072_152_4096,Gemm_Rocblas_621294166,0.0180886
GemmTunableOp_Half_TN,tn_3072_957_4096,Gemm_Hipblaslt_TN_9546,0.0597851
GemmTunableOp_Half_TN,tn_64128_183_4096,Gemm_Hipblaslt_TN_9862,0.25748
GemmTunableOp_Half_TN,tn_64128_201_4096,Gemm_Rocblas_621286797,0.277139
GemmTunableOp_Half_TN,tn_3072_1822_4096,Gemm_Rocblas_621286778,0.092697
GemmTunableOp_Half_TN,tn_14336_801_4096,Gemm_Hipblaslt_TN_9677,0.180567
GemmTunableOp_Half_TN,tn_4096_868_2048,Gemm_Hipblaslt_TN_9252,0.0371764
GemmTunableOp_Half_TN,tn_64128_145_4096,Gemm_Hipblaslt_TN_9108,0.226017
GemmTunableOp_Half_TN,tn_4096_3546_7168,Gemm_Hipblaslt_TN_9139,0.35156
GemmTunableOp_Half_TN,tn_4096_836_7168,Gemm_Hipblaslt_TN_9352,0.114153
GemmTunableOp_Half_TN,tn_14336_1718_4096,Gemm_Hipblaslt_TN_9697,0.364107
GemmTunableOp_Half_TN,tn_4096_2560_2048,Gemm_Rocblas_621294447,0.0829906
GemmTunableOp_Half_TN,tn_64128_122_4096,Gemm_Hipblaslt_TN_9263,0.206585
GemmTunableOp_Half_TN,tn_3072_946_4096,Gemm_Hipblaslt_TN_9546,0.0595744
GemmTunableOp_Half_TN,tn_14336_1806_4096,Gemm_Hipblaslt_TN_9677,0.372675
GemmTunableOp_Half_TN,tn_4096_8_7168,Gemm_Rocblas_621294135,0.0127659
GemmTunableOp_Half_TN,tn_14336_1697_4096,Gemm_Hipblaslt_TN_9697,0.361432
GemmTunableOp_Half_TN,tn_14336_3571_4096,Gemm_Hipblaslt_TN_9220,0.68614
GemmTunableOp_Half_TN,tn_64128_135_4096,Gemm_Rocblas_621294354,0.228174
GemmTunableOp_Half_TN,tn_14336_886_4096,Gemm_Hipblaslt_TN_9677,0.186105
GemmTunableOp_Half_TN,tn_14336_3507_4096,Gemm_Hipblaslt_TN_9223,0.680765
GemmTunableOp_Half_TN,tn_14336_830_4096,Gemm_Hipblaslt_TN_9697,0.182661
GemmTunableOp_Half_TN,tn_4096_881_7168,Gemm_Hipblaslt_TN_9355,0.119864
GemmTunableOp_Half_TN,tn_4096_1695_7168,Gemm_Hipblaslt_TN_9587,0.186124
GemmTunableOp_Half_TN,tn_4096_880_7168,Gemm_Hipblaslt_TN_9170,0.119017
GemmTunableOp_Half_TN,tn_4096_930_7168,Gemm_Hipblaslt_TN_9170,0.120456
GemmTunableOp_Half_TN,tn_4096_916_2048,Gemm_Hipblaslt_TN_9577,0.0379378
GemmTunableOp_Half_TN,tn_14336_3569_4096,Gemm_Hipblaslt_TN_9223,0.688495
GemmTunableOp_Half_TN,tn_4096_857_2048,Gemm_Hipblaslt_TN_9356,0.0380655
GemmTunableOp_Half_TN,tn_4096_24_2048,Gemm_Rocblas_621286311,0.00716073
GemmTunableOp_Half_TN,tn_4096_812_7168,Gemm_Hipblaslt_TN_9634,0.110828
GemmTunableOp_Half_TN,tn_4096_128_2048,Gemm_Rocblas_621286491,0.0112917
GemmTunableOp_Half_TN,tn_4096_4463_2048,Gemm_Hipblaslt_TN_9763,0.143145
GemmTunableOp_Half_TN,tn_4096_1742_7168,Gemm_Hipblaslt_TN_9645,0.201724
GemmTunableOp_Half_TN,tn_4096_2872_2048,Gemm_Hipblaslt_TN_9689,0.0892118
GemmTunableOp_Half_TN,tn_14336_799_4096,Gemm_Hipblaslt_TN_9182,0.167614
GemmTunableOp_Half_TN,tn_4096_7299_7168,Gemm_Hipblaslt_TN_9869,0.720624
GemmTunableOp_Half_TN,tn_64128_52_4096,Gemm_Hipblaslt_TN_9097,0.169736
GemmTunableOp_Half_TN,tn_3072_232_4096,Gemm_Rocblas_621286445,0.0233421
GemmTunableOp_Half_TN,tn_4096_232_2048,Gemm_Rocblas_621286447,0.0145762
GemmTunableOp_Half_TN,tn_4096_1795_2048,Gemm_Hipblaslt_TN_9134,0.0633234
GemmTunableOp_Half_TN,tn_3072_160_4096,Gemm_Hipblaslt_TN_9443,0.0182026
GemmTunableOp_Half_TN,tn_64128_246_4096,Gemm_Rocblas_621294648,0.294452
GemmTunableOp_Half_TN,tn_4096_890_2048,Gemm_Hipblaslt_TN_9252,0.0372072
GemmTunableOp_Half_TN,tn_4096_1757_2048,Gemm_Hipblaslt_TN_9136,0.06344
GemmTunableOp_Half_TN,tn_6144_4000_4096,Gemm_Rocblas_621294315,0.344175
GemmTunableOp_Half_TN,tn_14336_915_4096,Gemm_Hipblaslt_TN_9139,0.187715
GemmTunableOp_Half_TN,tn_3072_112_4096,Gemm_Rocblas_621294029,0.0146708
GemmTunableOp_Half_TN,tn_3072_2860_4096,Gemm_Hipblaslt_TN_9624,0.130892
GemmTunableOp_Half_TN,tn_4096_914_7168,Gemm_Hipblaslt_TN_9576,0.120304
GemmTunableOp_Half_TN,tn_4096_834_2048,Gemm_Hipblaslt_TN_9604,0.0352721
GemmTunableOp_Half_TN,tn_4096_1746_2048,Gemm_Hipblaslt_TN_9680,0.0635939
GemmTunableOp_Half_TN,tn_14336_892_4096,Gemm_Hipblaslt_TN_9697,0.185792
GemmTunableOp_Half_TN,tn_4096_1807_2048,Gemm_Hipblaslt_TN_9590,0.0637033
GemmTunableOp_Half_TN,tn_14336_1864_4096,Gemm_Hipblaslt_TN_9187,0.380773
GemmTunableOp_Half_TN,tn_14336_2734_4096,Gemm_Hipblaslt_TN_9187,0.566032
GemmTunableOp_Half_TN,tn_4096_104_2048,Gemm_Rocblas_621286278,0.010814
GemmTunableOp_Half_TN,tn_14336_1805_4096,Gemm_Hipblaslt_TN_9697,0.376413
GemmTunableOp_Half_TN,tn_14336_3479_4096,Gemm_Rocblas_621294492,0.674369
GemmTunableOp_Half_TN,tn_3072_830_4096,Gemm_Hipblaslt_TN_9047,0.0541596
GemmTunableOp_Half_TN,tn_4096_2602_7168,Gemm_Hipblaslt_TN_9799,0.278544
GemmTunableOp_Half_TN,tn_64128_93_4096,Gemm_Hipblaslt_TN_9057,0.186748
GemmTunableOp_Half_TN,tn_4096_208_7168,Gemm_Hipblaslt_TN_9303,0.0431227
GemmTunableOp_Half_TN,tn_4096_1813_7168,Gemm_Hipblaslt_TN_9134,0.208823
GemmTunableOp_Half_TN,tn_64128_207_4096,Gemm_Rocblas_621286797,0.27738
GemmTunableOp_Half_TN,tn_64128_164_4096,Gemm_Hipblaslt_TN_9862,0.253846
GemmTunableOp_Half_TN,tn_14336_831_4096,Gemm_Hipblaslt_TN_9187,0.182118
GemmTunableOp_Half_TN,tn_3072_966_4096,Gemm_Hipblaslt_TN_9131,0.06009
GemmTunableOp_Half_TN,tn_3072_7863_4096,Gemm_Hipblaslt_TN_9779,0.34785
GemmTunableOp_Half_TN,tn_3072_817_4096,Gemm_Hipblaslt_TN_9047,0.0536851
GemmTunableOp_Half_TN,tn_14336_1900_4096,Gemm_Hipblaslt_TN_9139,0.382362
GemmTunableOp_Half_TN,tn_4096_1795_7168,Gemm_Hipblaslt_TN_9137,0.207393
GemmTunableOp_Half_TN,tn_14336_1883_4096,Gemm_Hipblaslt_TN_9139,0.381588
GemmTunableOp_Half_TN,tn_64128_6_4096,Gemm_Rocblas_621286348,0.142698
GemmTunableOp_Half_TN,tn_4096_959_2048,Gemm_Hipblaslt_TN_9577,0.0389713
GemmTunableOp_Half_TN,tn_4096_875_2048,Gemm_Hipblaslt_TN_9604,0.0377957
GemmTunableOp_Half_TN,tn_14336_192_4096,Gemm_Hipblaslt_TN_9158,0.0605477
GemmTunableOp_Half_TN,tn_64128_73_4096,Gemm_Hipblaslt_TN_9057,0.178525
GemmTunableOp_Half_TN,tn_14336_834_4096,Gemm_Hipblaslt_TN_9697,0.183684
GemmTunableOp_Half_TN,tn_14336_2648_4096,Gemm_Hipblaslt_TN_9793,0.551741
GemmTunableOp_Half_TN,tn_3072_816_4096,Gemm_Hipblaslt_TN_9047,0.0539768
GemmTunableOp_Half_TN,tn_3072_4242_4096,Gemm_Hipblaslt_TN_9711,0.188886
GemmTunableOp_Half_TN,tn_4096_2653_2048,Gemm_Hipblaslt_TN_9799,0.0867297
GemmTunableOp_Half_TN,tn_64128_44_4096,Gemm_Hipblaslt_TN_9144,0.165081
GemmTunableOp_Half_TN,tn_3072_8192_4096,Gemm_Rocblas_621294467,0.359773
GemmTunableOp_Half_TN,tn_4096_1841_2048,Gemm_Hipblaslt_TN_9136,0.0648947
GemmTunableOp_Half_TN,tn_3072_1827_4096,Gemm_Hipblaslt_TN_9564,0.0947681
GemmTunableOp_Half_TN,tn_14336_8_4096,Gemm_Rocblas_621294052,0.0235788
GemmTunableOp_Half_TN,tn_4096_168_7168,Gemm_Rocblas_621294168,0.0384511
GemmTunableOp_Half_TN,tn_64128_188_4096,Gemm_Hipblaslt_TN_9862,0.257022
GemmTunableOp_Half_TN,tn_14336_896_4096,Gemm_Hipblaslt_TN_9139,0.185479
GemmTunableOp_Half_TN,tn_14336_903_4096,Gemm_Hipblaslt_TN_9697,0.18824
GemmTunableOp_Half_TN,tn_4096_796_2048,Gemm_Hipblaslt_TN_9604,0.0340412
GemmTunableOp_Half_TN,tn_4096_8154_2048,Gemm_Hipblaslt_TN_9768,0.24089
GemmTunableOp_Half_TN,tn_14336_1672_4096,Gemm_Hipblaslt_TN_9189,0.3612
GemmTunableOp_Half_TN,tn_64128_25_4096,Gemm_Rocblas_621286348,0.147008
GemmTunableOp_Half_TN,tn_64128_41_4096,Gemm_Hipblaslt_TN_9144,0.156996
GemmTunableOp_Half_TN,tn_3072_977_4096,Gemm_Hipblaslt_TN_9158,0.0611865
GemmTunableOp_Half_TN,tn_64128_97_4096,Gemm_Rocblas_621286396,0.199138
GemmTunableOp_Half_TN,tn_64128_231_4096,Gemm_Hipblaslt_TN_9122,0.298492
GemmTunableOp_Half_TN,tn_64128_143_4096,Gemm_Hipblaslt_TN_9108,0.227813
GemmTunableOp_Half_TN,tn_64128_166_4096,Gemm_Hipblaslt_TN_9661,0.254105
GemmTunableOp_Half_TN,tn_64128_197_4096,Gemm_Hipblaslt_TN_9260,0.276476
GemmTunableOp_Half_TN,tn_64128_215_4096,Gemm_Rocblas_621286797,0.282368
GemmTunableOp_Half_TN,tn_64128_232_4096,Gemm_Rocblas_621286905,0.292641
GemmTunableOp_Half_TN,tn_64128_240_4096,Gemm_Rocblas_621294648,0.294419
GemmTunableOp_Half_TN,tn_4096_797_2048,Gemm_Hipblaslt_TN_9352,0.0334703
GemmTunableOp_Half_TN,tn_64128_86_4096,Gemm_Hipblaslt_TN_9057,0.181975
GemmTunableOp_Half_TN,tn_64128_248_4096,Gemm_Rocblas_621286905,0.296339
GemmTunableOp_Half_TN,tn_4096_1694_2048,Gemm_Hipblaslt_TN_9588,0.0596431
GemmTunableOp_Half_TN,tn_3072_847_4096,Gemm_Hipblaslt_TN_9368,0.0540777
GemmTunableOp_Half_TN,tn_64128_212_4096,Gemm_Rocblas_621286797,0.281504
GemmTunableOp_Half_TN,tn_3072_823_4096,Gemm_Hipblaslt_TN_9048,0.0550299
GemmTunableOp_Half_TN,tn_4096_1944_7168,Gemm_Hipblaslt_TN_9267,0.215249
GemmTunableOp_Half_TN,tn_3072_224_4096,Gemm_Rocblas_621286443,0.022882
GemmTunableOp_Half_TN,tn_4096_1822_2048,Gemm_Hipblaslt_TN_9590,0.0646004
GemmTunableOp_Half_TN,tn_4096_790_2048,Gemm_Hipblaslt_TN_9634,0.0346685
GemmTunableOp_Half_TN,tn_64128_229_4096,Gemm_Hipblaslt_TN_9122,0.297974
GemmTunableOp_Half_TN,tn_4096_3556_2048,Gemm_Hipblaslt_TN_9683,0.107574
GemmTunableOp_Half_TN,tn_64128_222_4096,Gemm_Hipblaslt_TN_9271,0.283138
GemmTunableOp_Half_TN,tn_3072_848_4096,Gemm_Hipblaslt_TN_9047,0.0540542
GemmTunableOp_Half_TN,tn_3072_2698_4096,Gemm_Hipblaslt_TN_9624,0.12881
GemmTunableOp_Half_TN,tn_3072_1700_4096,Gemm_Rocblas_621294520,0.0898318
GemmTunableOp_Half_TN,tn_64128_148_4096,Gemm_Hipblaslt_TN_9108,0.229174
GemmTunableOp_Half_TN,tn_4096_832_2048,Gemm_Hipblaslt_TN_9634,0.0346137
GemmTunableOp_Half_TN,tn_3072_2628_4096,Gemm_Hipblaslt_TN_9134,0.125133
GemmTunableOp_Half_TN,tn_64128_106_4096,Gemm_Hipblaslt_TN_9263,0.202856
GemmTunableOp_Half_TN,tn_14336_160_4096,Gemm_Hipblaslt_TN_9312,0.0533286
GemmTunableOp_Half_TN,tn_4096_7266_7168,Gemm_Rocblas_621286589,0.708209
GemmTunableOp_Half_TN,tn_14336_816_4096,Gemm_Hipblaslt_TN_9697,0.180599
GemmTunableOp_Half_TN,tn_14336_939_4096,Gemm_Hipblaslt_TN_9697,0.190519
GemmTunableOp_Half_TN,tn_14336_3556_4096,Gemm_Hipblaslt_TN_9223,0.685285
GemmTunableOp_Half_TN,tn_4096_8154_7168,Gemm_Rocblas_621294420,0.779376
GemmTunableOp_Half_TN,tn_4096_2785_7168,Gemm_Hipblaslt_TN_9799,0.288641
GemmTunableOp_Half_TN,tn_14336_3671_4096,Gemm_Hipblaslt_TN_9187,0.759423
GemmTunableOp_Half_TN,tn_4096_2698_7168,Gemm_Hipblaslt_TN_9672,0.282314
GemmTunableOp_Half_TN,tn_64128_15_4096,Gemm_Rocblas_621286348,0.14431
GemmTunableOp_Half_TN,tn_3072_838_4096,Gemm_Hipblaslt_TN_9047,0.0560277
GemmTunableOp_Half_TN,tn_64128_18_4096,Gemm_Rocblas_621286348,0.145663
GemmTunableOp_Half_TN,tn_4096_992_2048,Gemm_Hipblaslt_TN_9585,0.0403973
GemmTunableOp_Half_TN,tn_14336_1867_4096,Gemm_Hipblaslt_TN_9697,0.380985
GemmTunableOp_Half_TN,tn_3072_926_4096,Gemm_Hipblaslt_TN_9251,0.0598093
GemmTunableOp_Half_TN,tn_3072_216_4096,Gemm_Rocblas_621294171,0.0229924
GemmTunableOp_Half_TN,tn_14336_959_4096,Gemm_Hipblaslt_TN_9697,0.192697
GemmTunableOp_Half_TN,tn_14336_876_4096,Gemm_Hipblaslt_TN_9697,0.184992
GemmTunableOp_Half_TN,tn_3072_903_4096,Gemm_Hipblaslt_TN_9546,0.057932
GemmTunableOp_Half_TN,tn_14336_966_4096,Gemm_Hipblaslt_TN_9217,0.208204
GemmTunableOp_Half_TN,tn_64128_68_4096,Gemm_Hipblaslt_TN_9057,0.179419
GemmTunableOp_Half_TN,tn_4096_2572_7168,Gemm_Hipblaslt_TN_9799,0.274698
GemmTunableOp_Half_TN,tn_4096_871_2048,Gemm_Hipblaslt_TN_9634,0.0381487
GemmTunableOp_Half_TN,tn_4096_884_7168,Gemm_Hipblaslt_TN_9170,0.119909
GemmTunableOp_Half_TN,tn_4096_917_7168,Gemm_Hipblaslt_TN_9604,0.121202
GemmTunableOp_Half_TN,tn_4096_888_2048,Gemm_Hipblaslt_TN_9356,0.0381146
GemmTunableOp_Half_TN,tn_3072_1693_4096,Gemm_Hipblaslt_TN_9561,0.0893115
GemmTunableOp_Half_TN,tn_64128_150_4096,Gemm_Rocblas_621294354,0.231058
GemmTunableOp_Half_TN,tn_14336_1715_4096,Gemm_Hipblaslt_TN_9139,0.362383
GemmTunableOp_Half_TN,tn_4096_862_7168,Gemm_Hipblaslt_TN_9099,0.114935
GemmTunableOp_Half_TN,tn_4096_1718_7168,Gemm_Hipblaslt_TN_9180,0.188025
GemmTunableOp_Half_TN,tn_14336_7266_4096,Gemm_Hipblaslt_TN_9683,1.43996
GemmTunableOp_Half_TN,tn_3072_1744_4096,Gemm_Hipblaslt_TN_9163,0.0915438
GemmTunableOp_Half_TN,tn_14336_7953_4096,Gemm_Hipblaslt_TN_9933,1.56849
GemmTunableOp_Half_TN,tn_14336_855_4096,Gemm_Hipblaslt_TN_9139,0.185308
GemmTunableOp_Half_TN,tn_14336_1798_4096,Gemm_Hipblaslt_TN_9192,0.377834
GemmTunableOp_Half_TN,tn_14336_8000_4096,Gemm_Hipblaslt_TN_9959,1.58005
GemmTunableOp_Half_TN,tn_4096_7809_7168,Gemm_Hipblaslt_TN_9888,0.752513
GemmTunableOp_Half_TN,tn_3072_3430_4096,Gemm_Rocblas_621286753,0.157166
GemmTunableOp_Half_TN,tn_64128_185_4096,Gemm_Hipblaslt_TN_9862,0.258326
GemmTunableOp_Half_TN,tn_4096_815_2048,Gemm_Hipblaslt_TN_9604,0.0354793
GemmTunableOp_Half_TN,tn_4096_893_2048,Gemm_Hipblaslt_TN_9634,0.0371136
GemmTunableOp_Half_TN,tn_4096_2763_7168,Gemm_Hipblaslt_TN_9799,0.288362
GemmTunableOp_Half_TN,tn_4096_845_2048,Gemm_Hipblaslt_TN_9353,0.0362317
GemmTunableOp_Half_TN,tn_4096_840_7168,Gemm_Hipblaslt_TN_9099,0.113624
GemmTunableOp_Half_TN,tn_4096_889_7168,Gemm_Hipblaslt_TN_9160,0.119784
GemmTunableOp_Half_TN,tn_14336_937_4096,Gemm_Hipblaslt_TN_9697,0.190516
GemmTunableOp_Half_TN,tn_64128_108_4096,Gemm_Hipblaslt_TN_9263,0.201926
GemmTunableOp_Half_TN,tn_14336_879_4096,Gemm_Hipblaslt_TN_9697,0.186503
GemmTunableOp_Half_TN,tn_4096_1827_2048,Gemm_Hipblaslt_TN_9590,0.0657106
GemmTunableOp_Half_TN,tn_4096_7952_7168,Gemm_Hipblaslt_TN_9959,0.760134
GemmTunableOp_Half_TN,tn_4096_813_7168,Gemm_Hipblaslt_TN_9158,0.108804
GemmTunableOp_Half_TN,tn_3072_7299_4096,Gemm_Hipblaslt_TN_9779,0.335559
GemmTunableOp_Half_TN,tn_3072_8007_4096,Gemm_Rocblas_621294473,0.353071
GemmTunableOp_Half_TN,tn_4096_1806_7168,Gemm_Hipblaslt_TN_9268,0.207617
GemmTunableOp_Half_TN,tn_4096_4483_7168,Gemm_Hipblaslt_TN_9874,0.47265
GemmTunableOp_Half_TN,tn_4096_1880_7168,Gemm_Hipblaslt_TN_9136,0.211915
