Gemm_Tune/Qwen2-72B-Instruct-2000inp/full_tuned3.csv
Validator,PT_VERSION,2.4.0
Validator,ROCM_VERSION,6.1.0.0-82-5fabb4c
Validator,HIPBLASLT_VERSION,0.7.0-1549b021
Validator,GCN_ARCH_NAME,gfx942:sramecc+:xnack-
Validator,ROCBLAS_VERSION,4.1.0-cefa4a9b-dirty
GemmTunableOp_Half_TN,tn_3072_1731_4096,Gemm_Hipblaslt_TN_9322,0.0908362
GemmTunableOp_Half_TN,tn_4096_6979_7168,Gemm_Hipblaslt_TN_9694,0.67599
GemmTunableOp_Half_TN,tn_4096_5089_2048,Gemm_Hipblaslt_TN_9689,0.166622
GemmTunableOp_Half_TN,tn_64128_122_4096,Gemm_Hipblaslt_TN_9698,0.202112
GemmTunableOp_Half_TN,tn_64128_35_4096,Gemm_Hipblaslt_TN_9097,0.158765
GemmTunableOp_Half_TN,tn_4096_1853_7168,Gemm_Hipblaslt_TN_9136,0.2062
GemmTunableOp_Half_TN,tn_4096_1771_2048,Gemm_Hipblaslt_TN_9136,0.0629878
GemmTunableOp_Half_TN,tn_64128_169_4096,Gemm_Hipblaslt_TN_9862,0.246809
GemmTunableOp_Half_TN,tn_14336_1790_4096,Gemm_Hipblaslt_TN_9697,0.367497
GemmTunableOp_Half_TN,tn_3072_1673_4096,Gemm_Hipblaslt_TN_9561,0.088693
GemmTunableOp_Half_TN,tn_3072_1615_4096,Gemm_Rocblas_621286778,0.0880922
GemmTunableOp_Half_TN,tn_3072_1794_4096,Gemm_Hipblaslt_TN_9322,0.092612
GemmTunableOp_Half_TN,tn_4096_3586_7168,Gemm_Hipblaslt_TN_9692,0.346543
GemmTunableOp_Half_TN,tn_4096_3710_7168,Gemm_Hipblaslt_TN_9768,0.361812
GemmTunableOp_Half_TN,tn_3072_3581_4096,Gemm_Hipblaslt_TN_9774,0.158426
GemmTunableOp_Half_TN,tn_14336_1794_4096,Gemm_Hipblaslt_TN_9697,0.371585
GemmTunableOp_Half_TN,tn_4096_6997_2048,Gemm_Hipblaslt_TN_9692,0.206983
GemmTunableOp_Half_TN,tn_4096_3214_2048,Gemm_Hipblaslt_TN_9684,0.0989628
GemmTunableOp_Half_TN,tn_4096_7196_7168,Gemm_Hipblaslt_TN_9694,0.691022
GemmTunableOp_Half_TN,tn_4096_3768_2048,Gemm_Hipblaslt_TN_9827,0.112605
GemmTunableOp_Half_TN,tn_14336_3645_4096,Gemm_Hipblaslt_TN_9697,0.733851
GemmTunableOp_Half_TN,tn_4096_3645_2048,Gemm_Hipblaslt_TN_9683,0.106525
GemmTunableOp_Half_TN,tn_4096_7730_7168,Gemm_Hipblaslt_TN_9704,0.733997
GemmTunableOp_Half_TN,tn_4096_5125_2048,Gemm_Hipblaslt_TN_9790,0.168053
GemmTunableOp_Half_TN,tn_4096_1931_7168,Gemm_Hipblaslt_TN_9645,0.210858
GemmTunableOp_Half_TN,tn_3072_1813_4096,Gemm_Hipblaslt_TN_9615,0.093247
GemmTunableOp_Half_TN,tn_3072_1608_4096,Gemm_Rocblas_621294520,0.0880909
GemmTunableOp_Half_TN,tn_4096_7579_7168,Gemm_Hipblaslt_TN_9869,0.730321
GemmTunableOp_Half_TN,tn_3072_1946_4096,Gemm_Hipblaslt_TN_9633,0.0985206
GemmTunableOp_Half_TN,tn_4096_1691_7168,Gemm_Hipblaslt_TN_9265,0.186558
GemmTunableOp_Half_TN,tn_4096_160_7168,Gemm_Rocblas_621286440,0.0365094
GemmTunableOp_Half_TN,tn_4096_1637_7168,Gemm_Hipblaslt_TN_9265,0.183371
GemmTunableOp_Half_TN,tn_14336_5223_4096,Gemm_Hipblaslt_TN_9933,1.04671
GemmTunableOp_Half_TN,tn_4096_3651_7168,Gemm_Hipblaslt_TN_9827,0.360142
GemmTunableOp_Half_TN,tn_14336_3300_4096,Gemm_Rocblas_621286678,0.637414
GemmTunableOp_Half_TN,tn_4096_7027_7168,Gemm_Hipblaslt_TN_9743,0.679812
GemmTunableOp_Half_TN,tn_3072_1796_4096,Gemm_Rocblas_621294520,0.0912909
GemmTunableOp_Half_TN,tn_4096_5271_7168,Gemm_Hipblaslt_TN_9691,0.546011
GemmTunableOp_Half_TN,tn_4096_1702_2048,Gemm_Hipblaslt_TN_9588,0.0583238
GemmTunableOp_Half_TN,tn_3072_1896_4096,Gemm_Hipblaslt_TN_9561,0.0936757
GemmTunableOp_Half_TN,tn_4096_1934_2048,Gemm_Hipblaslt_TN_9590,0.0655096
GemmTunableOp_Half_TN,tn_3072_1667_4096,Gemm_Hipblaslt_TN_9613,0.0888404
GemmTunableOp_Half_TN,tn_4096_1607_7168,Gemm_Hipblaslt_TN_9587,0.181297
GemmTunableOp_Half_TN,tn_3072_1622_4096,Gemm_Hipblaslt_TN_9322,0.0878954
GemmTunableOp_Half_TN,tn_3072_1934_4096,Gemm_Hipblaslt_TN_9636,0.0996715
GemmTunableOp_Half_TN,tn_3072_1815_4096,Gemm_Rocblas_621294520,0.0929077
GemmTunableOp_Half_TN,tn_3072_5470_4096,Gemm_Hipblaslt_TN_9726,0.226759
GemmTunableOp_Half_TN,tn_4096_1815_7168,Gemm_Hipblaslt_TN_9136,0.203355
GemmTunableOp_Half_TN,tn_4096_1802_2048,Gemm_Hipblaslt_TN_9590,0.0617186
GemmTunableOp_Half_TN,tn_4096_7096_7168,Gemm_Hipblaslt_TN_9743,0.679156
GemmTunableOp_Half_TN,tn_4096_1708_2048,Gemm_Hipblaslt_TN_9588,0.0585157
GemmTunableOp_Half_TN,tn_4096_1597_2048,Gemm_Hipblaslt_TN_9180,0.0551236
GemmTunableOp_Half_TN,tn_4096_1647_7168,Gemm_Hipblaslt_TN_9265,0.182738
GemmTunableOp_Half_TN,tn_14336_1787_4096,Gemm_Hipblaslt_TN_9793,0.367154
GemmTunableOp_Half_TN,tn_3072_3214_4096,Gemm_Hipblaslt_TN_9570,0.148977
GemmTunableOp_Half_TN,tn_3072_1652_4096,Gemm_Hipblaslt_TN_9561,0.0878586
GemmTunableOp_Half_TN,tn_14336_1767_4096,Gemm_Hipblaslt_TN_9697,0.368968
GemmTunableOp_Half_TN,tn_14336_3526_4096,Gemm_Rocblas_621286693,0.67399
GemmTunableOp_Half_TN,tn_64128_190_4096,Gemm_Hipblaslt_TN_9855,0.253812
GemmTunableOp_Half_TN,tn_4096_1860_7168,Gemm_Hipblaslt_TN_9645,0.206258
GemmTunableOp_Half_TN,tn_14336_1652_4096,Gemm_Hipblaslt_TN_9697,0.354934
GemmTunableOp_Half_TN,tn_4096_7190_7168,Gemm_Hipblaslt_TN_9743,0.688411
GemmTunableOp_Half_TN,tn_14336_6843_4096,Gemm_Hipblaslt_TN_9753,1.33495
GemmTunableOp_Half_TN,tn_4096_1887_2048,Gemm_Hipblaslt_TN_9590,0.0640221
GemmTunableOp_Half_TN,tn_4096_1711_2048,Gemm_Hipblaslt_TN_9588,0.0595514
GemmTunableOp_Half_TN,tn_4096_1767_2048,Gemm_Hipblaslt_TN_9136,0.0622768
GemmTunableOp_Half_TN,tn_4096_1765_2048,Gemm_Hipblaslt_TN_9680,0.062429
GemmTunableOp_Half_TN,tn_4096_1765_7168,Gemm_Hipblaslt_TN_9645,0.199869
GemmTunableOp_Half_TN,tn_4096_3535_7168,Gemm_Hipblaslt_TN_9187,0.343613
GemmTunableOp_Half_TN,tn_14336_1651_4096,Gemm_Hipblaslt_TN_9677,0.355896
GemmTunableOp_Half_TN,tn_3072_5447_4096,Gemm_Hipblaslt_TN_9726,0.226179
GemmTunableOp_Half_TN,tn_4096_1784_7168,Gemm_Hipblaslt_TN_9645,0.201937
GemmTunableOp_Half_TN,tn_4096_1839_7168,Gemm_Hipblaslt_TN_9645,0.206066
GemmTunableOp_Half_TN,tn_3072_1609_4096,Gemm_Rocblas_621286778,0.0879844
GemmTunableOp_Half_TN,tn_4096_1652_7168,Gemm_Hipblaslt_TN_9679,0.183535
GemmTunableOp_Half_TN,tn_14336_1867_4096,Gemm_Hipblaslt_TN_9677,0.375753
GemmTunableOp_Half_TN,tn_4096_7093_2048,Gemm_Hipblaslt_TN_9692,0.209669
GemmTunableOp_Half_TN,tn_64128_18_4096,Gemm_Rocblas_621286348,0.145565
GemmTunableOp_Half_TN,tn_4096_3382_2048,Gemm_Hipblaslt_TN_9896,0.101475
GemmTunableOp_Half_TN,tn_14336_1605_4096,Gemm_Hipblaslt_TN_9677,0.352408
GemmTunableOp_Half_TN,tn_4096_1670_7168,Gemm_Hipblaslt_TN_9671,0.184394
GemmTunableOp_Half_TN,tn_3072_1651_4096,Gemm_Hipblaslt_TN_9561,0.0887032
GemmTunableOp_Half_TN,tn_4096_3855_2048,Gemm_Hipblaslt_TN_9813,0.116612
GemmTunableOp_Half_TN,tn_4096_1857_2048,Gemm_Hipblaslt_TN_9590,0.0630405
GemmTunableOp_Half_TN,tn_3072_1801_4096,Gemm_Rocblas_621286778,0.0919862
GemmTunableOp_Half_TN,tn_4096_1609_7168,Gemm_Hipblaslt_TN_9265,0.182253
GemmTunableOp_Half_TN,tn_3072_3416_4096,Gemm_Hipblaslt_TN_9681,0.154119
GemmTunableOp_Half_TN,tn_14336_1607_4096,Gemm_Hipblaslt_TN_9697,0.354155
GemmTunableOp_Half_TN,tn_4096_3345_7168,Gemm_Hipblaslt_TN_9187,0.332496
GemmTunableOp_Half_TN,tn_4096_5495_7168,Gemm_Hipblaslt_TN_9672,0.560988
GemmTunableOp_Half_TN,tn_3072_3748_4096,Gemm_Hipblaslt_TN_9852,0.164669
GemmTunableOp_Half_TN,tn_4096_168_7168,Gemm_Rocblas_621294171,0.0385744
GemmTunableOp_Half_TN,tn_4096_1889_2048,Gemm_Hipblaslt_TN_9590,0.0650411
GemmTunableOp_Half_TN,tn_4096_1960_7168,Gemm_Hipblaslt_TN_9136,0.212899
GemmTunableOp_Half_TN,tn_4096_1960_2048,Gemm_Hipblaslt_TN_9590,0.066745
GemmTunableOp_Half_TN,tn_4096_3584_2048,Gemm_Hipblaslt_TN_9696,0.105233
GemmTunableOp_Half_TN,tn_64128_200_4096,Gemm_Hipblaslt_TN_9185,0.271041
GemmTunableOp_Half_TN,tn_14336_1618_4096,Gemm_Hipblaslt_TN_9697,0.351717
GemmTunableOp_Half_TN,tn_14336_7182_4096,Gemm_Hipblaslt_TN_9683,1.40724
GemmTunableOp_Half_TN,tn_14336_1647_4096,Gemm_Hipblaslt_TN_9697,0.3562
GemmTunableOp_Half_TN,tn_64128_246_4096,Gemm_Rocblas_621294658,0.286966
GemmTunableOp_Half_TN,tn_4096_5390_2048,Gemm_Hipblaslt_TN_9674,0.172179
GemmTunableOp_Half_TN,tn_14336_6744_4096,Gemm_Hipblaslt_TN_9815,1.32218
GemmTunableOp_Half_TN,tn_4096_3780_2048,Gemm_Hipblaslt_TN_9768,0.113107
GemmTunableOp_Half_TN,tn_4096_6976_7168,Gemm_Hipblaslt_TN_9694,0.676393
GemmTunableOp_Half_TN,tn_3072_7253_4096,Gemm_Hipblaslt_TN_9681,0.314748
GemmTunableOp_Half_TN,tn_4096_7386_7168,Gemm_Hipblaslt_TN_9853,0.716756
GemmTunableOp_Half_TN,tn_4096_1637_2048,Gemm_Hipblaslt_TN_9671,0.056044
GemmTunableOp_Half_TN,tn_3072_6971_4096,Gemm_Hipblaslt_TN_9681,0.307681
GemmTunableOp_Half_TN,tn_14336_6989_4096,Gemm_Hipblaslt_TN_9914,1.33502
GemmTunableOp_Half_TN,tn_4096_8192_7168,Gemm_Rocblas_621286678,0.76715
GemmTunableOp_Half_TN,tn_4096_1698_7168,Gemm_Hipblaslt_TN_9164,0.184974
GemmTunableOp_Half_TN,tn_3072_1739_4096,Gemm_Hipblaslt_TN_9133,0.0913356
GemmTunableOp_Half_TN,tn_4096_6868_2048,Gemm_Hipblaslt_TN_9732,0.205317
GemmTunableOp_Half_TN,tn_4096_7191_7168,Gemm_Hipblaslt_TN_9743,0.695738
GemmTunableOp_Half_TN,tn_4096_5223_2048,Gemm_Hipblaslt_TN_9671,0.168362
GemmTunableOp_Half_TN,tn_4096_5583_2048,Gemm_Hipblaslt_TN_9799,0.172672
GemmTunableOp_Half_TN,tn_14336_56_4096,Gemm_Rocblas_621286443,0.0297108
GemmTunableOp_Half_TN,tn_4096_32_2048,Gemm_Rocblas_621294144,0.00717311
GemmTunableOp_Half_TN,tn_3072_7182_4096,Gemm_Hipblaslt_TN_9681,0.315129
GemmTunableOp_Half_TN,tn_4096_24_2048,Gemm_Rocblas_621286273,0.00718793
GemmTunableOp_Half_TN,tn_64128_158_4096,Gemm_Hipblaslt_TN_9689,0.225057
GemmTunableOp_Half_TN,tn_14336_7439_4096,Gemm_Hipblaslt_TN_9914,1.47136
GemmTunableOp_Half_TN,tn_3072_1703_4096,Gemm_Hipblaslt_TN_9561,0.0898646
GemmTunableOp_Half_TN,tn_4096_3722_2048,Gemm_Hipblaslt_TN_9841,0.112898
GemmTunableOp_Half_TN,tn_4096_6841_2048,Gemm_Hipblaslt_TN_9743,0.203224
GemmTunableOp_Half_TN,tn_14336_16_4096,Gemm_Rocblas_621286317,0.0238372
GemmTunableOp_Half_TN,tn_4096_1665_2048,Gemm_Hipblaslt_TN_9164,0.0577691
GemmTunableOp_Half_TN,tn_4096_1857_7168,Gemm_Hipblaslt_TN_9645,0.205732
GemmTunableOp_Half_TN,tn_14336_1892_4096,Gemm_Hipblaslt_TN_9697,0.373789
GemmTunableOp_Half_TN,tn_4096_7118_7168,Gemm_Hipblaslt_TN_9743,0.683334
GemmTunableOp_Half_TN,tn_4096_7118_2048,Gemm_Hipblaslt_TN_9814,0.210333
GemmTunableOp_Half_TN,tn_3072_72_4096,Gemm_Rocblas_621294177,0.0133395
GemmTunableOp_Half_TN,tn_64128_222_4096,Gemm_Hipblaslt_TN_9185,0.276324
GemmTunableOp_Half_TN,tn_14336_1599_4096,Gemm_Hipblaslt_TN_9690,0.329401
GemmTunableOp_Half_TN,tn_4096_7568_2048,Gemm_Hipblaslt_TN_9815,0.22482
GemmTunableOp_Half_TN,tn_4096_1589_2048,Gemm_Hipblaslt_TN_9164,0.0568991
GemmTunableOp_Half_TN,tn_4096_5223_7168,Gemm_Rocblas_621294314,0.544816
GemmTunableOp_Half_TN,tn_4096_56_2048,Gemm_Rocblas_621286428,0.00797831
GemmTunableOp_Half_TN,tn_14336_5136_4096,Gemm_Hipblaslt_TN_9697,0.999095
GemmTunableOp_Half_TN,tn_14336_64_4096,Gemm_Rocblas_621286816,0.0303978
GemmTunableOp_Half_TN,tn_4096_208_7168,Gemm_Hipblaslt_TN_9497,0.0427744
GemmTunableOp_Half_TN,tn_4096_1739_2048,Gemm_Hipblaslt_TN_9329,0.0619132
GemmTunableOp_Half_TN,tn_4096_1884_2048,Gemm_Hipblaslt_TN_9590,0.0643737
GemmTunableOp_Half_TN,tn_64128_39_4096,Gemm_Hipblaslt_TN_9097,0.157502
GemmTunableOp_Half_TN,tn_4096_5052_7168,Gemm_Hipblaslt_TN_9681,0.532281
GemmTunableOp_Half_TN,tn_4096_1873_2048,Gemm_Hipblaslt_TN_9329,0.0656018
GemmTunableOp_Half_TN,tn_14336_248_4096,Gemm_Hipblaslt_TN_9160,0.0687038
GemmTunableOp_Half_TN,tn_64128_234_4096,Gemm_Rocblas_621286915,0.286961
GemmTunableOp_Half_TN,tn_3072_7475_4096,Gemm_Hipblaslt_TN_9687,0.332522
GemmTunableOp_Half_TN,tn_4096_7301_7168,Gemm_Hipblaslt_TN_9869,0.713489
GemmTunableOp_Half_TN,tn_4096_1787_2048,Gemm_Hipblaslt_TN_9136,0.0624553
GemmTunableOp_Half_TN,tn_14336_7170_4096,Gemm_Hipblaslt_TN_9684,1.40164
GemmTunableOp_Half_TN,tn_4096_1779_7168,Gemm_Hipblaslt_TN_9645,0.200952
GemmTunableOp_Half_TN,tn_3072_200_4096,Gemm_Rocblas_621286443,0.0221787
GemmTunableOp_Half_TN,tn_14336_6902_4096,Gemm_Hipblaslt_TN_9815,1.33054
GemmTunableOp_Half_TN,tn_4096_1615_7168,Gemm_Hipblaslt_TN_9265,0.183671
GemmTunableOp_Half_TN,tn_14336_7120_4096,Gemm_Hipblaslt_TN_9933,1.34778
GemmTunableOp_Half_TN,tn_4096_3468_7168,Gemm_Hipblaslt_TN_9192,0.336549
GemmTunableOp_Half_TN,tn_14336_7432_4096,Gemm_Hipblaslt_TN_9930,1.46767
GemmTunableOp_Half_TN,tn_4096_176_7168,Gemm_Hipblaslt_TN_9470,0.0384394
GemmTunableOp_Half_TN,tn_4096_224_2048,Gemm_Rocblas_621286447,0.0142321
GemmTunableOp_Half_TN,tn_4096_6747_7168,Gemm_Hipblaslt_TN_9677,0.658697
GemmTunableOp_Half_TN,tn_14336_1877_4096,Gemm_Hipblaslt_TN_9697,0.375361
GemmTunableOp_Half_TN,tn_64128_145_4096,Gemm_Hipblaslt_TN_9108,0.22264
GemmTunableOp_Half_TN,tn_4096_144_7168,Gemm_Hipblaslt_TN_8319,0.0365266
GemmTunableOp_Half_TN,tn_3072_3456_4096,Gemm_Rocblas_621286753,0.148614
GemmTunableOp_Half_TN,tn_4096_1733_2048,Gemm_Hipblaslt_TN_9136,0.0620639
GemmTunableOp_Half_TN,tn_14336_3691_4096,Gemm_Hipblaslt_TN_9187,0.746401
GemmTunableOp_Half_TN,tn_14336_3791_4096,Gemm_Hipblaslt_TN_9697,0.750427
GemmTunableOp_Half_TN,tn_14336_1660_4096,Gemm_Hipblaslt_TN_9697,0.355879
GemmTunableOp_Half_TN,tn_64128_7_4096,Gemm_Rocblas_621286348,0.142292
GemmTunableOp_Half_TN,tn_3072_1719_4096,Gemm_Rocblas_621294520,0.0893318
GemmTunableOp_Half_TN,tn_4096_1719_2048,Gemm_Hipblaslt_TN_9610,0.0591575
GemmTunableOp_Half_TN,tn_4096_7327_2048,Gemm_Hipblaslt_TN_9903,0.222965
GemmTunableOp_Half_TN,tn_3072_1760_4096,Gemm_Hipblaslt_TN_9613,0.0909282
GemmTunableOp_Half_TN,tn_14336_3629_4096,Gemm_Hipblaslt_TN_9187,0.734647
GemmTunableOp_Half_TN,tn_4096_1658_7168,Gemm_Hipblaslt_TN_9265,0.184723
GemmTunableOp_Half_TN,tn_4096_1737_2048,Gemm_Hipblaslt_TN_9329,0.0614692
GemmTunableOp_Half_TN,tn_14336_1752_4096,Gemm_Hipblaslt_TN_9189,0.368572
GemmTunableOp_Half_TN,tn_64128_64_4096,Gemm_Hipblaslt_TN_9097,0.162319
GemmTunableOp_Half_TN,tn_3072_1811_4096,Gemm_Rocblas_621286778,0.0918482
GemmTunableOp_Half_TN,tn_4096_1769_2048,Gemm_Hipblaslt_TN_9136,0.0624169
GemmTunableOp_Half_TN,tn_3072_3706_4096,Gemm_Hipblaslt_TN_9852,0.1636
GemmTunableOp_Half_TN,tn_28672_256_8192,Gemm_Hipblaslt_TN_9540,0.291877
GemmTunableOp_Half_TN,tn_4096_1742_7168,Gemm_Hipblaslt_TN_9329,0.198561
GemmTunableOp_Half_TN,tn_4096_6788_7168,Gemm_Hipblaslt_TN_9911,0.664476
GemmTunableOp_Half_TN,tn_4096_3373_2048,Gemm_Hipblaslt_TN_9896,0.102495
GemmTunableOp_Half_TN,tn_14336_3501_4096,Gemm_Hipblaslt_TN_9220,0.666924
GemmTunableOp_Half_TN,tn_3072_6989_4096,Gemm_Hipblaslt_TN_9619,0.311334
GemmTunableOp_Half_TN,tn_14336_3562_4096,Gemm_Rocblas_621286750,0.677819
GemmTunableOp_Half_TN,tn_3072_1648_4096,Gemm_Hipblaslt_TN_9561,0.088798
GemmTunableOp_Half_TN,tn_3072_1820_4096,Gemm_Hipblaslt_TN_9613,0.0936566
GemmTunableOp_Half_TN,tn_14336_1593_4096,Gemm_Hipblaslt_TN_9690,0.328738
GemmTunableOp_Half_TN,tn_4096_1618_2048,Gemm_Hipblaslt_TN_9607,0.056321
GemmTunableOp_Half_TN,tn_14336_1748_4096,Gemm_Hipblaslt_TN_9697,0.368504
GemmTunableOp_Half_TN,tn_14336_3713_4096,Gemm_Hipblaslt_TN_9697,0.745937
GemmTunableOp_Half_TN,tn_14336_6976_4096,Gemm_Hipblaslt_TN_9914,1.33324
GemmTunableOp_Half_TN,tn_3072_88_4096,Gemm_Rocblas_621286280,0.0141403
GemmTunableOp_Half_TN,tn_3072_7196_4096,Gemm_Hipblaslt_TN_9681,0.315934
GemmTunableOp_Half_TN,tn_3072_1933_4096,Gemm_Hipblaslt_TN_9587,0.0996706
GemmTunableOp_Half_TN,tn_3072_1854_4096,Gemm_Hipblaslt_TN_9148,0.093856
GemmTunableOp_Half_TN,tn_4096_7478_2048,Gemm_Hipblaslt_TN_9713,0.225072
GemmTunableOp_Half_TN,tn_3072_56_4096,Gemm_Rocblas_621286421,0.011372
GemmTunableOp_Half_TN,tn_64128_180_4096,Gemm_Hipblaslt_TN_9940,0.252536
GemmTunableOp_Half_TN,tn_4096_1864_7168,Gemm_Hipblaslt_TN_9645,0.206688
GemmTunableOp_Half_TN,tn_4096_5196_2048,Gemm_Hipblaslt_TN_9690,0.169318
GemmTunableOp_Half_TN,tn_4096_5319_2048,Gemm_Hipblaslt_TN_9691,0.170928
GemmTunableOp_Half_TN,tn_14336_6860_4096,Gemm_Hipblaslt_TN_9749,1.33312
GemmTunableOp_Half_TN,tn_4096_1883_7168,Gemm_Hipblaslt_TN_9136,0.209045
GemmTunableOp_Half_TN,tn_14336_7104_4096,Gemm_Hipblaslt_TN_9914,1.34535
GemmTunableOp_Half_TN,tn_14336_1735_4096,Gemm_Hipblaslt_TN_9192,0.364105
GemmTunableOp_Half_TN,tn_3072_1852_4096,Gemm_Hipblaslt_TN_9324,0.0929117
GemmTunableOp_Half_TN,tn_4096_1757_2048,Gemm_Hipblaslt_TN_9329,0.0623656
GemmTunableOp_Half_TN,tn_4096_7182_2048,Gemm_Hipblaslt_TN_9743,0.209319
GemmTunableOp_Half_TN,tn_4096_5273_7168,Gemm_Hipblaslt_TN_9690,0.546022
GemmTunableOp_Half_TN,tn_64128_191_4096,Gemm_Hipblaslt_TN_9694,0.252287
GemmTunableOp_Half_TN,tn_3072_3767_4096,Gemm_Hipblaslt_TN_9852,0.164827
GemmTunableOp_Half_TN,tn_3072_1961_4096,Gemm_Hipblaslt_TN_9633,0.0994585
GemmTunableOp_Half_TN,tn_4096_1815_2048,Gemm_Hipblaslt_TN_9136,0.0633132
GemmTunableOp_Half_TN,tn_4096_3600_2048,Gemm_Hipblaslt_TN_9212,0.103876
GemmTunableOp_Half_TN,tn_14336_1666_4096,Gemm_Hipblaslt_TN_9677,0.356371
GemmTunableOp_Half_TN,tn_14336_1864_4096,Gemm_Hipblaslt_TN_9139,0.376387
GemmTunableOp_Half_TN,tn_64128_53_4096,Gemm_Hipblaslt_TN_9097,0.164522
GemmTunableOp_Half_TN,tn_4096_1935_7168,Gemm_Hipblaslt_TN_9267,0.211489
GemmTunableOp_Half_TN,tn_4096_1867_2048,Gemm_Hipblaslt_TN_9590,0.0649967
GemmTunableOp_Half_TN,tn_14336_1737_4096,Gemm_Hipblaslt_TN_9793,0.368475
GemmTunableOp_Half_TN,tn_3072_3595_4096,Gemm_Hipblaslt_TN_9570,0.160903
GemmTunableOp_Half_TN,tn_4096_1708_7168,Gemm_Hipblaslt_TN_9265,0.185916
GemmTunableOp_Half_TN,tn_3072_7139_4096,Gemm_Hipblaslt_TN_9681,0.313174
GemmTunableOp_Half_TN,tn_64128_176_4096,Gemm_Hipblaslt_TN_9694,0.24926
GemmTunableOp_Half_TN,tn_64128_206_4096,Gemm_Hipblaslt_TN_9185,0.272296
GemmTunableOp_Half_TN,tn_4096_1981_2048,Gemm_Hipblaslt_TN_9590,0.0658797
GemmTunableOp_Half_TN,tn_14336_3565_4096,Gemm_Hipblaslt_TN_9220,0.675094
GemmTunableOp_Half_TN,tn_3072_80_4096,Gemm_Rocblas_621286449,0.0135947
GemmTunableOp_Half_TN,tn_14336_7047_4096,Gemm_Hipblaslt_TN_9914,1.3379
GemmTunableOp_Half_TN,tn_14336_1725_4096,Gemm_Hipblaslt_TN_9697,0.360108
GemmTunableOp_Half_TN,tn_64128_160_4096,Gemm_Hipblaslt_TN_9108,0.221314
GemmTunableOp_Half_TN,tn_4096_1778_2048,Gemm_Hipblaslt_TN_9136,0.0623108
GemmTunableOp_Half_TN,tn_4096_1970_7168,Gemm_Hipblaslt_TN_9267,0.213278
GemmTunableOp_Half_TN,tn_4096_6902_2048,Gemm_Hipblaslt_TN_9796,0.206119
GemmTunableOp_Half_TN,tn_14336_1978_4096,Gemm_Hipblaslt_TN_9217,0.403807
GemmTunableOp_Half_TN,tn_4096_1862_2048,Gemm_Hipblaslt_TN_9590,0.0635199
GemmTunableOp_Half_TN,tn_3072_1889_4096,Gemm_Hipblaslt_TN_9148,0.0939672
GemmTunableOp_Half_TN,tn_14336_7364_4096,Gemm_Hipblaslt_TN_9900,1.45066
GemmTunableOp_Half_TN,tn_64128_204_4096,Gemm_Hipblaslt_TN_9185,0.273332
GemmTunableOp_Half_TN,tn_4096_1829_2048,Gemm_Hipblaslt_TN_9590,0.063967
GemmTunableOp_Half_TN,tn_4096_1652_2048,Gemm_Hipblaslt_TN_9164,0.056468
GemmTunableOp_Half_TN,tn_4096_5136_2048,Gemm_Hipblaslt_TN_9671,0.168342
GemmTunableOp_Half_TN,tn_4096_3441_2048,Gemm_Hipblaslt_TN_9821,0.100713
GemmTunableOp_Half_TN,tn_14336_112_4096,Gemm_Hipblaslt_TN_9521,0.0415681
GemmTunableOp_Half_TN,tn_4096_1663_2048,Gemm_Hipblaslt_TN_9164,0.0570698
GemmTunableOp_Half_TN,tn_5120_4096_8192,Gemm_Hipblaslt_TN_9649,0.595885
GemmTunableOp_Half_TN,tn_4096_7432_7168,Gemm_Hipblaslt_TN_9914,0.722643
GemmTunableOp_Half_TN,tn_4096_1820_2048,Gemm_Hipblaslt_TN_9134,0.063488
GemmTunableOp_Half_TN,tn_64128_197_4096,Gemm_Hipblaslt_TN_9185,0.270838
GemmTunableOp_Half_TN,tn_3072_1924_4096,Gemm_Hipblaslt_TN_9633,0.0980209
GemmTunableOp_Half_TN,tn_3072_3547_4096,Gemm_Rocblas_621286753,0.158045
GemmTunableOp_Half_TN,tn_14336_6708_4096,Gemm_Hipblaslt_TN_9841,1.31016
GemmTunableOp_Half_TN,tn_4096_5067_7168,Gemm_Hipblaslt_TN_9681,0.533363
GemmTunableOp_Half_TN,tn_14336_5541_4096,Gemm_Rocblas_621286590,1.08684
GemmTunableOp_Half_TN,tn_14336_3912_4096,Gemm_Hipblaslt_TN_9697,0.774565
GemmTunableOp_Half_TN,tn_64128_227_4096,Gemm_Rocblas_621294658,0.287207
GemmTunableOp_Half_TN,tn_14336_7325_4096,Gemm_Hipblaslt_TN_9961,1.44513
GemmTunableOp_Half_TN,tn_4096_6721_7168,Gemm_Hipblaslt_TN_9694,0.661585
GemmTunableOp_Half_TN,tn_3072_1618_4096,Gemm_Hipblaslt_TN_9561,0.086075
GemmTunableOp_Half_TN,tn_14336_1667_4096,Gemm_Hipblaslt_TN_9192,0.356425
GemmTunableOp_Half_TN,tn_4096_1781_7168,Gemm_Hipblaslt_TN_9645,0.200249
GemmTunableOp_Half_TN,tn_3072_144_4096,Gemm_Hipblaslt_TN_9443,0.0172085
GemmTunableOp_Half_TN,tn_3072_1957_4096,Gemm_Hipblaslt_TN_9633,0.0990917
GemmTunableOp_Half_TN,tn_4096_1820_7168,Gemm_Hipblaslt_TN_9645,0.205318
GemmTunableOp_Half_TN,tn_14336_8192_4096,Gemm_Rocblas_621294127,1.5761
GemmTunableOp_Half_TN,tn_64128_13_4096,Gemm_Rocblas_621286348,0.144469
GemmTunableOp_Half_TN,tn_4096_1850_2048,Gemm_Hipblaslt_TN_9590,0.0627949
GemmTunableOp_Half_TN,tn_14336_1721_4096,Gemm_Hipblaslt_TN_9697,0.357091
GemmTunableOp_Half_TN,tn_64128_133_4096,Gemm_Hipblaslt_TN_9674,0.220266
GemmTunableOp_Half_TN,tn_64128_107_4096,Gemm_Rocblas_621294762,0.197656
GemmTunableOp_Half_TN,tn_4096_1620_7168,Gemm_Hipblaslt_TN_9587,0.181525
GemmTunableOp_Half_TN,tn_64128_172_4096,Gemm_Hipblaslt_TN_9694,0.249183
GemmTunableOp_Half_TN,tn_14336_5125_4096,Gemm_Hipblaslt_TN_9697,0.992199
GemmTunableOp_Half_TN,tn_4096_1798_7168,Gemm_Hipblaslt_TN_9134,0.203842
GemmTunableOp_Half_TN,tn_4096_3427_7168,Gemm_Hipblaslt_TN_9695,0.334758
GemmTunableOp_Half_TN,tn_4096_5354_7168,Gemm_Hipblaslt_TN_9690,0.550581
GemmTunableOp_Half_TN,tn_4096_1847_7168,Gemm_Hipblaslt_TN_9645,0.205422
GemmTunableOp_Half_TN,tn_4096_3466_7168,Gemm_Hipblaslt_TN_9187,0.336358
GemmTunableOp_Half_TN,tn_3072_3688_4096,Gemm_Hipblaslt_TN_9622,0.164801
GemmTunableOp_Half_TN,tn_4096_56_7168,Gemm_Rocblas_621286419,0.019314
GemmTunableOp_Half_TN,tn_64128_198_4096,Gemm_Hipblaslt_TN_9185,0.269634
GemmTunableOp_Half_TN,tn_3072_1969_4096,Gemm_Hipblaslt_TN_9587,0.100404
GemmTunableOp_Half_TN,tn_64128_218_4096,Gemm_Hipblaslt_TN_9185,0.276952
GemmTunableOp_Half_TN,tn_4096_3441_7168,Gemm_Hipblaslt_TN_9743,0.333131
GemmTunableOp_Half_TN,tn_3072_1978_4096,Gemm_Hipblaslt_TN_9633,0.0989175
GemmTunableOp_Half_TN,tn_4096_3640_7168,Gemm_Hipblaslt_TN_9743,0.347442
GemmTunableOp_Half_TN,tn_4096_5410_2048,Gemm_Hipblaslt_TN_9672,0.171693
GemmTunableOp_Half_TN,tn_4096_1625_7168,Gemm_Hipblaslt_TN_9265,0.182413
GemmTunableOp_Half_TN,tn_14336_3581_4096,Gemm_Hipblaslt_TN_9827,0.678412
GemmTunableOp_Half_TN,tn_14336_7484_4096,Gemm_Rocblas_621294127,1.47551
GemmTunableOp_Half_TN,tn_14336_1691_4096,Gemm_Hipblaslt_TN_9677,0.355873
GemmTunableOp_Half_TN,tn_4096_136_2048,Gemm_Rocblas_621294175,0.0127951
GemmTunableOp_Half_TN,tn_3072_7579_4096,Gemm_Rocblas_621294467,0.336962
GemmTunableOp_Half_TN,tn_4096_1713_7168,Gemm_Hipblaslt_TN_9164,0.18556
GemmTunableOp_Half_TN,tn_14336_5447_4096,Gemm_Hipblaslt_TN_9815,1.07457
GemmTunableOp_Half_TN,tn_3072_152_4096,Gemm_Rocblas_621294166,0.0178258
GemmTunableOp_Half_TN,tn_4096_6744_7168,Gemm_Hipblaslt_TN_9677,0.666796
GemmTunableOp_Half_TN,tn_14336_3388_4096,Gemm_Rocblas_621286590,0.662473
GemmTunableOp_Half_TN,tn_4096_6841_7168,Gemm_Hipblaslt_TN_9955,0.669458
GemmTunableOp_Half_TN,tn_64128_104_4096,Gemm_Hipblaslt_TN_9698,0.196754
GemmTunableOp_Half_TN,tn_4096_5498_2048,Gemm_Hipblaslt_TN_9799,0.172595
GemmTunableOp_Half_TN,tn_4096_1892_7168,Gemm_Hipblaslt_TN_9645,0.209396
GemmTunableOp_Half_TN,tn_4096_1658_2048,Gemm_Hipblaslt_TN_9164,0.0572989
GemmTunableOp_Half_TN,tn_3072_5723_4096,Gemm_Hipblaslt_TN_9624,0.261447
GemmTunableOp_Half_TN,tn_14336_1862_4096,Gemm_Hipblaslt_TN_9697,0.372317
GemmTunableOp_Half_TN,tn_4096_7120_2048,Gemm_Hipblaslt_TN_153,0.207359
GemmTunableOp_Half_TN,tn_14336_1698_4096,Gemm_Hipblaslt_TN_9697,0.357339
GemmTunableOp_Half_TN,tn_64128_69_4096,Gemm_Hipblaslt_TN_9057,0.178093
GemmTunableOp_Half_TN,tn_14336_136_4096,Gemm_Hipblaslt_TN_9312,0.0524072
GemmTunableOp_Half_TN,tn_14336_1839_4096,Gemm_Hipblaslt_TN_9697,0.371613
GemmTunableOp_Half_TN,tn_64128_140_4096,Gemm_Hipblaslt_TN_9674,0.221964
GemmTunableOp_Half_TN,tn_4096_3219_7168,Gemm_Hipblaslt_TN_9695,0.323865
GemmTunableOp_Half_TN,tn_8192_4096_14336,Gemm_Hipblaslt_TN_9756,1.72167
GemmTunableOp_Half_TN,tn_3072_32_4096,Gemm_Rocblas_621294054,0.00931112
GemmTunableOp_Half_TN,tn_4096_1762_2048,Gemm_Hipblaslt_TN_9329,0.0623915
GemmTunableOp_Half_TN,tn_14336_1857_4096,Gemm_Hipblaslt_TN_9697,0.374522
GemmTunableOp_Half_TN,tn_64128_31_4096,Gemm_Rocblas_621286348,0.148657
GemmTunableOp_Half_TN,tn_3072_8192_4096,Gemm_Rocblas_621294473,0.355892
GemmTunableOp_Half_TN,tn_64128_42_4096,Gemm_Hipblaslt_TN_9144,0.158246
GemmTunableOp_Half_TN,tn_4096_5322_7168,Gemm_Hipblaslt_TN_9690,0.548118
GemmTunableOp_Half_TN,tn_64128_56_4096,Gemm_Hipblaslt_TN_9097,0.163557
GemmTunableOp_Half_TN,tn_14336_5605_4096,Gemm_Hipblaslt_TN_9827,1.10644
GemmTunableOp_Half_TN,tn_64128_252_4096,Gemm_Rocblas_621286915,0.290725
GemmTunableOp_Half_TN,tn_4096_5436_2048,Gemm_Hipblaslt_TN_9687,0.170847
GemmTunableOp_Half_TN,tn_4096_1655_7168,Gemm_Hipblaslt_TN_9265,0.183875
GemmTunableOp_Half_TN,tn_4096_1622_2048,Gemm_Hipblaslt_TN_9164,0.0564675
GemmTunableOp_Half_TN,tn_3072_1684_4096,Gemm_Hipblaslt_TN_9163,0.0891648
GemmTunableOp_Half_TN,tn_4096_6920_7168,Gemm_Hipblaslt_TN_9694,0.669769
GemmTunableOp_Half_TN,tn_3072_96_4096,Gemm_Rocblas_621286280,0.0135559
GemmTunableOp_Half_TN,tn_64128_14_4096,Gemm_Rocblas_621286348,0.145167
GemmTunableOp_Half_TN,tn_14336_7023_4096,Gemm_Hipblaslt_TN_9914,1.33308
GemmTunableOp_Half_TN,tn_3072_7340_4096,Gemm_Hipblaslt_TN_9779,0.331404
GemmTunableOp_Half_TN,tn_3072_3781_4096,Gemm_Hipblaslt_TN_9924,0.164891
GemmTunableOp_Half_TN,tn_4096_6715_2048,Gemm_Hipblaslt_TN_9743,0.201894
GemmTunableOp_Half_TN,tn_64128_81_4096,Gemm_Hipblaslt_TN_9058,0.181967
GemmTunableOp_Half_TN,tn_14336_1860_4096,Gemm_Hipblaslt_TN_9697,0.374919
GemmTunableOp_Half_TN,tn_14336_1875_4096,Gemm_Hipblaslt_TN_9697,0.37382
GemmTunableOp_Half_TN,tn_4096_3589_7168,Gemm_Hipblaslt_TN_9694,0.345594
GemmTunableOp_Half_TN,tn_4096_1703_7168,Gemm_Hipblaslt_TN_9265,0.186318
GemmTunableOp_Half_TN,tn_4096_1682_2048,Gemm_Hipblaslt_TN_9164,0.0584598
GemmTunableOp_Half_TN,tn_3072_3475_4096,Gemm_Rocblas_621294495,0.155392
GemmTunableOp_Half_TN,tn_4096_1792_7168,Gemm_Hipblaslt_TN_9645,0.199937
GemmTunableOp_Half_TN,tn_4096_1823_7168,Gemm_Hipblaslt_TN_9645,0.206143
GemmTunableOp_Half_TN,tn_14336_3706_4096,Gemm_Hipblaslt_TN_9187,0.740894
GemmTunableOp_Half_TN,tn_4096_1733_7168,Gemm_Hipblaslt_TN_9673,0.196963
GemmTunableOp_Half_TN,tn_3072_3830_4096,Gemm_Hipblaslt_TN_9852,0.165047
GemmTunableOp_Half_TN,tn_3072_3780_4096,Gemm_Hipblaslt_TN_9852,0.164606
GemmTunableOp_Half_TN,tn_4096_1600_2048,Gemm_Hipblaslt_TN_9607,0.0567209
GemmTunableOp_Half_TN,tn_14336_1954_4096,Gemm_Hipblaslt_TN_9223,0.400361
GemmTunableOp_Half_TN,tn_14336_7301_4096,Gemm_Hipblaslt_TN_9900,1.45008
GemmTunableOp_Half_TN,tn_4096_3404_2048,Gemm_Hipblaslt_TN_9896,0.100534
GemmTunableOp_Half_TN,tn_4096_1590_2048,Gemm_Hipblaslt_TN_9607,0.05575
GemmTunableOp_Half_TN,tn_14336_1597_4096,Gemm_Hipblaslt_TN_9691,0.328165
GemmTunableOp_Half_TN,tn_14336_7118_4096,Gemm_Hipblaslt_TN_9914,1.35053
GemmTunableOp_Half_TN,tn_14336_1589_4096,Gemm_Hipblaslt_TN_9690,0.329205
GemmTunableOp_Half_TN,tn_4096_7345_7168,Gemm_Hipblaslt_TN_9888,0.713954
GemmTunableOp_Half_TN,tn_4096_3748_2048,Gemm_Hipblaslt_TN_9827,0.112979
GemmTunableOp_Half_TN,tn_4096_3588_7168,Gemm_Hipblaslt_TN_9677,0.346178
GemmTunableOp_Half_TN,tn_14336_1614_4096,Gemm_Hipblaslt_TN_9677,0.353778
GemmTunableOp_Half_TN,tn_3072_1790_4096,Gemm_Rocblas_621294520,0.0915806
GemmTunableOp_Half_TN,tn_4096_6630_2048,Gemm_Hipblaslt_TN_9743,0.201658
GemmTunableOp_Half_TN,tn_64128_236_4096,Gemm_Rocblas_621286915,0.288581
GemmTunableOp_Half_TN,tn_4096_3410_7168,Gemm_Hipblaslt_TN_9821,0.333308
GemmTunableOp_Half_TN,tn_3072_3582_4096,Gemm_Rocblas_621286753,0.15805
GemmTunableOp_Half_TN,tn_4096_3388_2048,Gemm_Hipblaslt_TN_9696,0.102512
GemmTunableOp_Half_TN,tn_14336_1946_4096,Gemm_Hipblaslt_TN_9223,0.40277
GemmTunableOp_Half_TN,tn_14336_3455_4096,Gemm_Rocblas_621294484,0.664546
GemmTunableOp_Half_TN,tn_4096_1683_7168,Gemm_Hipblaslt_TN_9265,0.185411
GemmTunableOp_Half_TN,tn_3072_3468_4096,Gemm_Rocblas_621286753,0.156615
GemmTunableOp_Half_TN,tn_14336_1637_4096,Gemm_Hipblaslt_TN_9677,0.357267
GemmTunableOp_Half_TN,tn_3072_5136_4096,Gemm_Rocblas_621294030,0.212847
GemmTunableOp_Half_TN,tn_4096_1973_2048,Gemm_Hipblaslt_TN_9590,0.0668398
GemmTunableOp_Half_TN,tn_64128_89_4096,Gemm_Hipblaslt_TN_9058,0.184686
GemmTunableOp_Half_TN,tn_14336_3547_4096,Gemm_Hipblaslt_TN_9220,0.676152
GemmTunableOp_Half_TN,tn_4096_3622_2048,Gemm_Hipblaslt_TN_9683,0.106596
GemmTunableOp_Half_TN,tn_4096_7262_7168,Gemm_Hipblaslt_TN_9694,0.695378
GemmTunableOp_Half_TN,tn_14336_1609_4096,Gemm_Hipblaslt_TN_9697,0.354413
GemmTunableOp_Half_TN,tn_3072_1702_4096,Gemm_Hipblaslt_TN_9148,0.0894917
GemmTunableOp_Half_TN,tn_4096_6860_2048,Gemm_Hipblaslt_TN_9814,0.205468
GemmTunableOp_Half_TN,tn_3072_1593_4096,Gemm_Hipblaslt_TN_9561,0.0863393
GemmTunableOp_Half_TN,tn_4096_5352_2048,Gemm_Hipblaslt_TN_9799,0.170301
GemmTunableOp_Half_TN,tn_4096_3781_2048,Gemm_Hipblaslt_TN_9704,0.114702
GemmTunableOp_Half_TN,tn_4096_5301_7168,Gemm_Hipblaslt_TN_9799,0.54735
GemmTunableOp_Half_TN,tn_3072_3682_4096,Gemm_Hipblaslt_TN_9852,0.164317
GemmTunableOp_Half_TN,tn_14336_1852_4096,Gemm_Hipblaslt_TN_9697,0.376146
GemmTunableOp_Half_TN,tn_14336_7136_4096,Gemm_Hipblaslt_TN_9853,1.35377
GemmTunableOp_Half_TN,tn_4096_1882_7168,Gemm_Hipblaslt_TN_9680,0.209511
GemmTunableOp_Half_TN,tn_4096_1859_7168,Gemm_Hipblaslt_TN_9645,0.206964
GemmTunableOp_Half_TN,tn_14336_1738_4096,Gemm_Hipblaslt_TN_9697,0.367978
GemmTunableOp_Half_TN,tn_3072_3764_4096,Gemm_Hipblaslt_TN_9852,0.165442
GemmTunableOp_Half_TN,tn_14336_1610_4096,Gemm_Hipblaslt_TN_9697,0.35491
GemmTunableOp_Half_TN,tn_4096_3582_2048,Gemm_Hipblaslt_TN_9683,0.104906
GemmTunableOp_Half_TN,tn_4096_96_2048,Gemm_Rocblas_621286279,0.00923699
GemmTunableOp_Half_TN,tn_4096_3652_7168,Gemm_Hipblaslt_TN_9827,0.360049
GemmTunableOp_Half_TN,tn_4096_1970_2048,Gemm_Hipblaslt_TN_9329,0.0664711
GemmTunableOp_Half_TN,tn_14336_3564_4096,Gemm_Hipblaslt_TN_9827,0.675406
GemmTunableOp_Half_TN,tn_4096_5100_7168,Gemm_Hipblaslt_TN_9774,0.531982
GemmTunableOp_Half_TN,tn_4096_5204_7168,Gemm_Hipblaslt_TN_9690,0.542417
GemmTunableOp_Half_TN,tn_14336_1690_4096,Gemm_Hipblaslt_TN_9697,0.358904
GemmTunableOp_Half_TN,tn_3072_1586_4096,Gemm_Hipblaslt_TN_9561,0.0858388
GemmTunableOp_Half_TN,tn_3072_1872_4096,Gemm_Hipblaslt_TN_9324,0.0947517
GemmTunableOp_Half_TN,tn_4096_1603_2048,Gemm_Hipblaslt_TN_9588,0.0577008
GemmTunableOp_Half_TN,tn_3072_1682_4096,Gemm_Hipblaslt_TN_9163,0.0888871
GemmTunableOp_Half_TN,tn_4096_3597_7168,Gemm_Hipblaslt_TN_9743,0.34721
GemmTunableOp_Half_TN,tn_3072_3379_4096,Gemm_Rocblas_621294495,0.152275
GemmTunableOp_Half_TN,tn_4096_7206_2048,Gemm_Hipblaslt_TN_9743,0.207578
GemmTunableOp_Half_TN,tn_4096_1628_7168,Gemm_Hipblaslt_TN_9587,0.182285
GemmTunableOp_Half_TN,tn_4096_7475_2048,Gemm_Hipblaslt_TN_9655,0.224918
GemmTunableOp_Half_TN,tn_4096_3520_2048,Gemm_Hipblaslt_TN_9821,0.104054
GemmTunableOp_Half_TN,tn_4096_6715_7168,Gemm_Hipblaslt_TN_9677,0.663969
GemmTunableOp_Half_TN,tn_3072_5680_4096,Gemm_Hipblaslt_TN_9624,0.257799
GemmTunableOp_Half_TN,tn_4096_7021_2048,Gemm_Hipblaslt_TN_9696,0.207802
GemmTunableOp_Half_TN,tn_3072_7478_4096,Gemm_Rocblas_621294473,0.336363
GemmTunableOp_Half_TN,tn_3072_6800_4096,Gemm_Hipblaslt_TN_9681,0.299498
GemmTunableOp_Half_TN,tn_3072_7171_4096,Gemm_Hipblaslt_TN_9681,0.316805
GemmTunableOp_Half_TN,tn_4096_3713_2048,Gemm_Hipblaslt_TN_9704,0.111053
GemmTunableOp_Half_TN,tn_14336_1881_4096,Gemm_Hipblaslt_TN_9697,0.375782
GemmTunableOp_Half_TN,tn_3072_3920_4096,Gemm_Hipblaslt_TN_9777,0.171338
GemmTunableOp_Half_TN,tn_14336_5470_4096,Gemm_Hipblaslt_TN_9749,1.08189
GemmTunableOp_Half_TN,tn_4096_1966_2048,Gemm_Hipblaslt_TN_9174,0.0665202
GemmTunableOp_Half_TN,tn_4096_3722_7168,Gemm_Hipblaslt_TN_9827,0.363551
GemmTunableOp_Half_TN,tn_64128_189_4096,Gemm_Hipblaslt_TN_9694,0.25191
GemmTunableOp_Half_TN,tn_64128_209_4096,Gemm_Hipblaslt_TN_9768,0.273187
GemmTunableOp_Half_TN,tn_14336_7579_4096,Gemm_Hipblaslt_TN_9914,1.48121
GemmTunableOp_Half_TN,tn_14336_1683_4096,Gemm_Hipblaslt_TN_9697,0.357867
GemmTunableOp_Half_TN,tn_4096_6721_2048,Gemm_Hipblaslt_TN_9956,0.205175
GemmTunableOp_Half_TN,tn_4096_1931_2048,Gemm_Hipblaslt_TN_9590,0.0664133
GemmTunableOp_Half_TN,tn_4096_1928_7168,Gemm_Hipblaslt_TN_9645,0.21173
GemmTunableOp_Half_TN,tn_4096_3400_7168,Gemm_Hipblaslt_TN_9694,0.333729
GemmTunableOp_Half_TN,tn_4096_1789_7168,Gemm_Hipblaslt_TN_9329,0.201884
GemmTunableOp_Half_TN,tn_3072_5271_4096,Gemm_Hipblaslt_TN_9751,0.217301
GemmTunableOp_Half_TN,tn_3072_3652_4096,Gemm_Hipblaslt_TN_9799,0.163978
GemmTunableOp_Half_TN,tn_4096_7552_7168,Gemm_Hipblaslt_TN_159,0.728081
GemmTunableOp_Half_TN,tn_4096_1909_7168,Gemm_Hipblaslt_TN_9645,0.208237
GemmTunableOp_Half_TN,tn_4096_80_7168,Gemm_Rocblas_621294029,0.0246404
GemmTunableOp_Half_TN,tn_4096_208_2048,Gemm_Rocblas_621294175,0.0144388
GemmTunableOp_Half_TN,tn_4096_1666_7168,Gemm_Hipblaslt_TN_9265,0.184233
GemmTunableOp_Half_TN,tn_14336_1763_4096,Gemm_Hipblaslt_TN_9793,0.369485
GemmTunableOp_Half_TN,tn_3072_104_4096,Gemm_Rocblas_621294029,0.0146006
GemmTunableOp_Half_TN,tn_64128_50_4096,Gemm_Hipblaslt_TN_9097,0.161661
GemmTunableOp_Half_TN,tn_14336_5512_4096,Gemm_Rocblas_621294492,1.08507
GemmTunableOp_Half_TN,tn_64128_213_4096,Gemm_Hipblaslt_TN_9768,0.274449
GemmTunableOp_Half_TN,tn_4096_7130_7168,Gemm_Hipblaslt_TN_9694,0.685581
GemmTunableOp_Half_TN,tn_4096_3497_7168,Gemm_Hipblaslt_TN_9139,0.341647
GemmTunableOp_Half_TN,tn_3072_16_4096,Gemm_Rocblas_621294130,0.00830962
GemmTunableOp_Half_TN,tn_3072_3622_4096,Gemm_Hipblaslt_TN_9619,0.158558
GemmTunableOp_Half_TN,tn_14336_1960_4096,Gemm_Hipblaslt_TN_9217,0.401057
GemmTunableOp_Half_TN,tn_3072_1633_4096,Gemm_Hipblaslt_TN_9561,0.0883442
GemmTunableOp_Half_TN,tn_14336_3855_4096,Gemm_Hipblaslt_TN_9677,0.76778
GemmTunableOp_Half_TN,tn_14336_1764_4096,Gemm_Hipblaslt_TN_9793,0.366105
GemmTunableOp_Half_TN,tn_4096_1924_2048,Gemm_Hipblaslt_TN_9620,0.0661252
GemmTunableOp_Half_TN,tn_3072_1711_4096,Gemm_Rocblas_621294520,0.0895604
GemmTunableOp_Half_TN,tn_4096_1830_7168,Gemm_Hipblaslt_TN_9645,0.203724
GemmTunableOp_Half_TN,tn_4096_200_7168,Gemm_Rocblas_621294230,0.0428967
GemmTunableOp_Half_TN,tn_64128_22_4096,Gemm_Rocblas_621286348,0.147312
GemmTunableOp_Half_TN,tn_4096_7364_7168,Gemm_Hipblaslt_TN_9749,0.711888
GemmTunableOp_Half_TN,tn_14336_3456_4096,Gemm_Rocblas_621286742,0.667523
GemmTunableOp_Half_TN,tn_3072_3404_4096,Gemm_Rocblas_621294495,0.153109
GemmTunableOp_Half_TN,tn_14336_1953_4096,Gemm_Hipblaslt_TN_9223,0.401635
GemmTunableOp_Half_TN,tn_14336_7345_4096,Gemm_Hipblaslt_TN_9900,1.45288
GemmTunableOp_Half_TN,tn_3072_1887_4096,Gemm_Hipblaslt_TN_9613,0.0953148
GemmTunableOp_Half_TN,tn_4096_7050_2048,Gemm_Hipblaslt_TN_9692,0.207418
GemmTunableOp_Half_TN,tn_3072_1769_4096,Gemm_Hipblaslt_TN_9720,0.0931023
GemmTunableOp_Half_TN,tn_4096_1909_2048,Gemm_Hipblaslt_TN_9134,0.0645178
GemmTunableOp_Half_TN,tn_3072_1772_4096,Gemm_Rocblas_621286778,0.0911531
GemmTunableOp_Half_TN,tn_64128_181_4096,Gemm_Hipblaslt_TN_9821,0.250638
GemmTunableOp_Half_TN,tn_64128_117_4096,Gemm_Hipblaslt_TN_9596,0.200743
GemmTunableOp_Half_TN,tn_4096_1722_2048,Gemm_Hipblaslt_TN_9164,0.0591115
GemmTunableOp_Half_TN,tn_4096_3581_2048,Gemm_Hipblaslt_TN_9692,0.105534
GemmTunableOp_Half_TN,tn_4096_7077_2048,Gemm_Hipblaslt_TN_9696,0.209066
GemmTunableOp_Half_TN,tn_3072_7077_4096,Gemm_Hipblaslt_TN_9774,0.31058
GemmTunableOp_Half_TN,tn_4096_40_7168,Gemm_Rocblas_621286332,0.0179191
GemmTunableOp_Half_TN,tn_3072_1771_4096,Gemm_Hipblaslt_TN_9322,0.0926128
GemmTunableOp_Half_TN,tn_4096_7109_2048,Gemm_Hipblaslt_TN_9694,0.205452
GemmTunableOp_Half_TN,tn_4096_3420_7168,Gemm_Hipblaslt_TN_9732,0.335101
GemmTunableOp_Half_TN,tn_64128_121_4096,Gemm_Hipblaslt_TN_9061,0.20344
GemmTunableOp_Half_TN,tn_14336_1896_4096,Gemm_Hipblaslt_TN_9139,0.377482
GemmTunableOp_Half_TN,tn_4096_3582_7168,Gemm_Hipblaslt_TN_9677,0.345797
GemmTunableOp_Half_TN,tn_3072_136_4096,Gemm_Rocblas_621286438,0.0176308
GemmTunableOp_Half_TN,tn_3072_6901_4096,Gemm_Hipblaslt_TN_9681,0.30395
GemmTunableOp_Half_TN,tn_4096_6952_7168,Gemm_Hipblaslt_TN_9694,0.672279
GemmTunableOp_Half_TN,tn_4096_7225_7168,Gemm_Hipblaslt_TN_9743,0.692676
GemmTunableOp_Half_TN,tn_4096_8192_2048,Gemm_Hipblaslt_TN_9655,0.2362
GemmTunableOp_Half_TN,tn_3072_6920_4096,Gemm_Hipblaslt_TN_9681,0.308638
GemmTunableOp_Half_TN,tn_3072_1908_4096,Gemm_Hipblaslt_TN_9324,0.0950558
GemmTunableOp_Half_TN,tn_64128_233_4096,Gemm_Rocblas_621294658,0.287458
GemmTunableOp_Half_TN,tn_4096_3383_2048,Gemm_Hipblaslt_TN_9896,0.100056
GemmTunableOp_Half_TN,tn_4096_6916_7168,Gemm_Hipblaslt_TN_9694,0.676811
GemmTunableOp_Half_TN,tn_14336_1866_4096,Gemm_Hipblaslt_TN_9677,0.371947
GemmTunableOp_Half_TN,tn_14336_3586_4096,Gemm_Hipblaslt_TN_9192,0.72938
GemmTunableOp_Half_TN,tn_3072_1745_4096,Gemm_Hipblaslt_TN_9613,0.0915368
GemmTunableOp_Half_TN,tn_14336_1884_4096,Gemm_Hipblaslt_TN_9677,0.375626
GemmTunableOp_Half_TN,tn_14336_3309_4096,Gemm_Rocblas_621294492,0.64572
GemmTunableOp_Half_TN,tn_4096_3764_2048,Gemm_Hipblaslt_TN_9827,0.111421
GemmTunableOp_Half_TN,tn_4096_5157_7168,Gemm_Hipblaslt_TN_9681,0.537748
GemmTunableOp_Half_TN,tn_4096_1866_7168,Gemm_Hipblaslt_TN_9645,0.208178
GemmTunableOp_Half_TN,tn_14336_3511_4096,Gemm_Hipblaslt_TN_9220,0.671076
GemmTunableOp_Half_TN,tn_4096_1822_7168,Gemm_Hipblaslt_TN_9268,0.20453
GemmTunableOp_Half_TN,tn_4096_1769_7168,Gemm_Hipblaslt_TN_9134,0.201913
GemmTunableOp_Half_TN,tn_14336_3379_4096,Gemm_Hipblaslt_TN_9220,0.656088
GemmTunableOp_Half_TN,tn_4096_7186_7168,Gemm_Hipblaslt_TN_9743,0.691382
GemmTunableOp_Half_TN,tn_4096_16_2048,Gemm_Rocblas_621286311,0.00704493
GemmTunableOp_Half_TN,tn_14336_1784_4096,Gemm_Hipblaslt_TN_9697,0.368589
GemmTunableOp_Half_TN,tn_4096_1933_2048,Gemm_Hipblaslt_TN_9590,0.0647103
GemmTunableOp_Half_TN,tn_4096_3578_2048,Gemm_Hipblaslt_TN_9212,0.105902
GemmTunableOp_Half_TN,tn_14336_5271_4096,Gemm_Hipblaslt_TN_9217,1.04793
GemmStridedBatchedTunableOp_Half_TN,tn_1875_1875_128_B_16,Gemm_Hipblaslt_TN_6942,0.0822899
GemmStridedBatchedTunableOp_Half_TN,tn_1818_1818_128_B_16,Gemm_Hipblaslt_TN_6942,0.0789365
GemmStridedBatchedTunableOp_Half_TN,tn_1966_1966_128_B_16,Gemm_Rocblas_621294533,0.0863617
GemmStridedBatchedTunableOp_Half_TN,tn_1928_1928_128_B_16,Gemm_Hipblaslt_TN_150,0.077587
GemmStridedBatchedTunableOp_Half_TN,tn_1944_1944_128_B_16,Gemm_Hipblaslt_TN_150,0.0798162
GemmStridedBatchedTunableOp_Half_TN,tn_1804_1804_128_B_16,Gemm_Rocblas_621286810,0.0779304
GemmStridedBatchedTunableOp_Half_TN,tn_1896_1896_128_B_16,Gemm_Hipblaslt_TN_150,0.0777939
GemmStridedBatchedTunableOp_Half_TN,tn_1918_1918_128_B_16,Gemm_Hipblaslt_TN_7483,0.0821856
GemmStridedBatchedTunableOp_Half_TN,tn_1747_1747_128_B_16,Gemm_Hipblaslt_TN_7483,0.0724357
GemmStridedBatchedTunableOp_Half_TN,tn_1940_1940_128_B_16,Gemm_Hipblaslt_TN_6929,0.0845153
GemmStridedBatchedTunableOp_Half_TN,tn_1969_1969_128_B_16,Gemm_Rocblas_621294533,0.0883793
GemmStridedBatchedTunableOp_Half_TN,tn_1888_1888_128_B_16,Gemm_Rocblas_621286808,0.0741751
GemmStridedBatchedTunableOp_Half_TN,tn_1829_1829_128_B_16,Gemm_Hipblaslt_TN_6942,0.0802265
GemmStridedBatchedTunableOp_Half_TN,tn_1957_1957_128_B_16,Gemm_Hipblaslt_TN_6867,0.086725
GemmStridedBatchedTunableOp_Half_TN,tn_1867_1867_128_B_16,Gemm_Hipblaslt_TN_6942,0.0815852
GemmStridedBatchedTunableOp_Half_TN,tn_1683_1683_128_B_16,Gemm_Hipblaslt_TN_7483,0.069564
GemmStridedBatchedTunableOp_Half_TN,tn_1978_1978_128_B_16,Gemm_Hipblaslt_TN_6867,0.0874459
GemmStridedBatchedTunableOp_Half_TN,tn_1604_1604_128_B_16,Gemm_Rocblas_621286397,0.0650318
GemmStridedBatchedTunableOp_Half_TN,tn_1870_1870_128_B_16,Gemm_Hipblaslt_TN_6942,0.0811273
GemmStridedBatchedTunableOp_Half_TN,tn_1809_1809_128_B_16,Gemm_Hipblaslt_TN_6942,0.0793609
GemmStridedBatchedTunableOp_Half_TN,tn_1930_1930_128_B_16,Gemm_Hipblaslt_TN_6857,0.0851065
GemmStridedBatchedTunableOp_Half_TN,tn_1721_1721_128_B_16,Gemm_Rocblas_621286413,0.072007
GemmStridedBatchedTunableOp_Half_TN,tn_1665_1665_128_B_16,Gemm_Rocblas_621294635,0.0700798
GemmStridedBatchedTunableOp_Half_TN,tn_1602_1602_128_B_16,Gemm_Hipblaslt_TN_6879,0.0663358
GemmStridedBatchedTunableOp_Half_TN,tn_1651_1651_128_B_16,Gemm_Rocblas_621294754,0.0666869
GemmStridedBatchedTunableOp_Half_TN,tn_1862_1862_128_B_16,Gemm_Rocblas_621294754,0.0812418
GemmStridedBatchedTunableOp_Half_TN,tn_1869_1869_128_B_16,Gemm_Hipblaslt_TN_6942,0.0821044
GemmStridedBatchedTunableOp_Half_TN,tn_1758_1758_128_B_16,Gemm_Rocblas_621286397,0.0731292
GemmStridedBatchedTunableOp_Half_TN,tn_1725_1725_128_B_16,Gemm_Rocblas_621286413,0.0721518
GemmStridedBatchedTunableOp_Half_TN,tn_1750_1750_128_B_16,Gemm_Hipblaslt_TN_7483,0.0724399
GemmStridedBatchedTunableOp_Half_TN,tn_1753_1753_128_B_16,Gemm_Rocblas_621286413,0.0741151
GemmStridedBatchedTunableOp_Half_TN,tn_1988_1988_128_B_16,Gemm_Rocblas_621286808,0.0879715
GemmStridedBatchedTunableOp_Half_TN,tn_1947_1947_128_B_16,Gemm_Rocblas_621294533,0.0875535
GemmStridedBatchedTunableOp_Half_TN,tn_1925_1925_128_B_16,Gemm_Hipblaslt_TN_6929,0.0871266
GemmStridedBatchedTunableOp_Half_TN,tn_1810_1810_128_B_16,Gemm_Hipblaslt_TN_6942,0.0789947
GemmStridedBatchedTunableOp_Half_TN,tn_1789_1789_128_B_16,Gemm_Hipblaslt_TN_6929,0.0743024
GemmStridedBatchedTunableOp_Half_TN,tn_1858_1858_128_B_16,Gemm_Hipblaslt_TN_6942,0.0805976
GemmStridedBatchedTunableOp_Half_TN,tn_1641_1641_128_B_16,Gemm_Hipblaslt_TN_7483,0.0667019
GemmStridedBatchedTunableOp_Half_TN,tn_1852_1852_128_B_16,Gemm_Hipblaslt_TN_6942,0.0794658
GemmStridedBatchedTunableOp_Half_TN,tn_1688_1688_128_B_16,Gemm_Hipblaslt_TN_9508,0.0680496
GemmStridedBatchedTunableOp_Half_TN,tn_1961_1961_128_B_16,Gemm_Hipblaslt_TN_6867,0.087584
GemmStridedBatchedTunableOp_Half_TN,tn_1599_1599_128_B_16,Gemm_Hipblaslt_TN_7483,0.0651404
GemmStridedBatchedTunableOp_Half_TN,tn_1800_1800_128_B_16,Gemm_Hipblaslt_TN_150,0.0727844
GemmStridedBatchedTunableOp_Half_TN,tn_2000_2000_128_B_32,Gemm_Rocblas_621286397,0.147752
GemmStridedBatchedTunableOp_Half_TN,tn_1807_1807_128_B_16,Gemm_Hipblaslt_TN_6929,0.0777034
GemmStridedBatchedTunableOp_Half_TN,tn_1763_1763_128_B_16,Gemm_Rocblas_621286808,0.0749422
GemmStridedBatchedTunableOp_Half_TN,tn_1903_1903_128_B_16,Gemm_Hipblaslt_TN_6942,0.0828215
GemmStridedBatchedTunableOp_Half_TN,tn_1716_1716_128_B_16,Gemm_Rocblas_621294702,0.070204
GemmStridedBatchedTunableOp_Half_TN,tn_1657_1657_128_B_16,Gemm_Hipblaslt_TN_7483,0.065666
GemmStridedBatchedTunableOp_Half_TN,tn_1733_1733_128_B_16,Gemm_Rocblas_621294110,0.0724806
GemmStridedBatchedTunableOp_Half_TN,tn_1885_1885_128_B_16,Gemm_Hipblaslt_TN_6942,0.0827166
GemmStridedBatchedTunableOp_Half_TN,tn_1692_1692_128_B_16,Gemm_Rocblas_621294754,0.068551
GemmStridedBatchedTunableOp_Half_TN,tn_1970_1970_128_B_16,Gemm_Hipblaslt_TN_6867,0.0879336
GemmStridedBatchedTunableOp_Half_TN,tn_1680_1680_128_B_16,Gemm_Rocblas_621294650,0.0641335
GemmStridedBatchedTunableOp_Half_TN,tn_1823_1823_128_B_16,Gemm_Hipblaslt_TN_6942,0.0799441
GemmStridedBatchedTunableOp_Half_TN,tn_1588_1588_128_B_16,Gemm_Hipblaslt_TN_7483,0.0620682
GemmStridedBatchedTunableOp_Half_TN,tn_1752_1752_128_B_16,Gemm_Rocblas_621286413,0.0716754
GemmStridedBatchedTunableOp_Half_TN,tn_1923_1923_128_B_16,Gemm_Hipblaslt_TN_7519,0.0866733
GemmStridedBatchedTunableOp_Half_TN,tn_1600_1600_128_B_16,Gemm_Rocblas_621286509,0.0573522
GemmStridedBatchedTunableOp_Half_TN,tn_1814_1814_128_B_16,Gemm_Rocblas_621294754,0.0779137
GemmStridedBatchedTunableOp_Half_TN,tn_1713_1713_128_B_16,Gemm_Rocblas_621294110,0.0711454
GemmStridedBatchedTunableOp_Half_TN,tn_1782_1782_128_B_16,Gemm_Rocblas_621294109,0.0754406
GemmStridedBatchedTunableOp_Half_TN,tn_1762_1762_128_B_16,Gemm_Rocblas_621294109,0.0743061
GemmStridedBatchedTunableOp_Half_TN,tn_1737_1737_128_B_16,Gemm_Hipblaslt_TN_7483,0.072421
GemmStridedBatchedTunableOp_Half_TN,tn_1607_1607_128_B_16,Gemm_Hipblaslt_TN_7483,0.0658264
GemmStridedBatchedTunableOp_Half_TN,tn_1958_1958_128_B_16,Gemm_Hipblaslt_TN_7519,0.0866999
GemmStridedBatchedTunableOp_Half_TN,tn_1963_1963_128_B_16,Gemm_Hipblaslt_TN_6879,0.088069
GemmStridedBatchedTunableOp_Half_TN,tn_1769_1769_128_B_16,Gemm_Hipblaslt_TN_7483,0.0718411
GemmStridedBatchedTunableOp_Half_TN,tn_1615_1615_128_B_16,Gemm_Hipblaslt_TN_7483,0.0658739
GemmStridedBatchedTunableOp_Half_TN,tn_1590_1590_128_B_16,Gemm_Rocblas_621286413,0.064467
GemmStridedBatchedTunableOp_Half_TN,tn_1825_1825_128_B_16,Gemm_Hipblaslt_TN_6942,0.080158
GemmStridedBatchedTunableOp_Half_TN,tn_1960_1960_128_B_16,Gemm_Hipblaslt_TN_150,0.0797685
GemmStridedBatchedTunableOp_Half_TN,tn_1679_1679_128_B_16,Gemm_Rocblas_621294754,0.0679771
GemmStridedBatchedTunableOp_Half_TN,tn_1766_1766_128_B_16,Gemm_Hipblaslt_TN_6929,0.0739729
GemmStridedBatchedTunableOp_Half_TN,tn_1796_1796_128_B_16,Gemm_Rocblas_621294110,0.0775374
GemmStridedBatchedTunableOp_Half_TN,tn_1702_1702_128_B_16,Gemm_Rocblas_621294754,0.0695436
GemmStridedBatchedTunableOp_Half_TN,tn_1732_1732_128_B_16,Gemm_Rocblas_621294108,0.0713856
GemmStridedBatchedTunableOp_Half_TN,tn_1901_1901_128_B_16,Gemm_Hipblaslt_TN_6942,0.0831064
GemmStridedBatchedTunableOp_Half_TN,tn_1797_1797_128_B_16,Gemm_Hipblaslt_TN_6879,0.0789301
GemmStridedBatchedTunableOp_Half_TN,tn_1735_1735_128_B_16,Gemm_Rocblas_621286413,0.0724202
GemmStridedBatchedTunableOp_Half_TN,tn_32_32_128_B_16,Gemm_Rocblas_621286461,0.00646245
GemmStridedBatchedTunableOp_Half_TN,tn_1861_1861_128_B_16,Gemm_Hipblaslt_TN_6942,0.0819729
GemmStridedBatchedTunableOp_Half_TN,tn_1700_1700_128_B_16,Gemm_Rocblas_621294517,0.0701344
GemmStridedBatchedTunableOp_Half_TN,tn_1959_1959_128_B_16,Gemm_Hipblaslt_TN_6867,0.0859566
GemmStridedBatchedTunableOp_Half_TN,tn_1697_1697_128_B_16,Gemm_Rocblas_621294754,0.0695803
GemmStridedBatchedTunableOp_Half_TN,tn_1586_1586_128_B_16,Gemm_Hipblaslt_TN_7483,0.0620073
GemmStridedBatchedTunableOp_Half_TN,tn_1916_1916_128_B_16,Gemm_Hipblaslt_TN_6942,0.0828557
GemmStridedBatchedTunableOp_Half_TN,tn_1691_1691_128_B_16,Gemm_Rocblas_621294110,0.0713803
GemmStridedBatchedTunableOp_Half_TN,tn_1794_1794_128_B_16,Gemm_Rocblas_621286980,0.0779981
GemmStridedBatchedTunableOp_Half_TN,tn_1703_1703_128_B_16,Gemm_Rocblas_621294754,0.0710911
GemmStridedBatchedTunableOp_Half_TN,tn_1662_1662_128_B_16,Gemm_Hipblaslt_TN_7483,0.0659881
GemmStridedBatchedTunableOp_Half_TN,tn_1687_1687_128_B_16,Gemm_Hipblaslt_TN_7483,0.0686578
GemmStridedBatchedTunableOp_Half_TN,tn_1649_1649_128_B_16,Gemm_Rocblas_621294754,0.0675343
GemmStridedBatchedTunableOp_Half_TN,tn_1795_1795_128_B_16,Gemm_Rocblas_621294754,0.0774783
GemmStridedBatchedTunableOp_Half_TN,tn_1667_1667_128_B_16,Gemm_Rocblas_621294635,0.0700174
GemmStridedBatchedTunableOp_Half_TN,tn_1756_1756_128_B_16,Gemm_Rocblas_621286411,0.0730163
GemmTunableOp_Half_TN,tn_14336_1600_4096,Gemm_Rocblas_621294426,0.327908
GemmTunableOp_Half_TN,tn_4096_7171_2048,Gemm_Hipblaslt_TN_9692,0.213431
GemmTunableOp_Half_TN,tn_4096_5447_7168,Gemm_Hipblaslt_TN_9687,0.569309
GemmTunableOp_Half_TN,tn_4096_5541_7168,Gemm_Rocblas_621286580,0.571333
GemmTunableOp_Half_TN,tn_4096_5605_2048,Gemm_Hipblaslt_TN_9709,0.178093
GemmTunableOp_Half_TN,tn_14336_3920_4096,Gemm_Hipblaslt_TN_9187,0.783915
GemmTunableOp_Half_TN,tn_3072_3564_4096,Gemm_Rocblas_621286753,0.159465
GemmTunableOp_Half_TN,tn_14336_3710_4096,Gemm_Hipblaslt_TN_9677,0.752684
GemmTunableOp_Half_TN,tn_4096_3622_7168,Gemm_Hipblaslt_TN_9677,0.352336
GemmTunableOp_Half_TN,tn_3072_1948_4096,Gemm_Hipblaslt_TN_9633,0.0994795
GemmTunableOp_Half_TN,tn_4096_3645_7168,Gemm_Hipblaslt_TN_9814,0.35369
GemmTunableOp_Half_TN,tn_4096_5052_2048,Gemm_Hipblaslt_TN_9690,0.168731
GemmTunableOp_Half_TN,tn_4096_3496_2048,Gemm_Hipblaslt_TN_9692,0.104111
GemmTunableOp_Half_TN,tn_4096_1825_2048,Gemm_Hipblaslt_TN_9680,0.064439
GemmTunableOp_Half_TN,tn_4096_1646_2048,Gemm_Hipblaslt_TN_9164,0.0578711
GemmTunableOp_Half_TN,tn_14336_3640_4096,Gemm_Hipblaslt_TN_9187,0.738668
GemmTunableOp_Half_TN,tn_4096_1881_2048,Gemm_Hipblaslt_TN_9590,0.0654809
GemmTunableOp_Half_TN,tn_4096_1828_2048,Gemm_Hipblaslt_TN_9590,0.0640665
GemmTunableOp_Half_TN,tn_4096_1839_2048,Gemm_Hipblaslt_TN_9590,0.0637216
GemmTunableOp_Half_TN,tn_3072_1767_4096,Gemm_Hipblaslt_TN_9322,0.0916178
GemmTunableOp_Half_TN,tn_64128_73_4096,Gemm_Hipblaslt_TN_9057,0.179691
GemmTunableOp_Half_TN,tn_3072_3300_4096,Gemm_Hipblaslt_TN_9774,0.155401
GemmTunableOp_Half_TN,tn_4096_1704_7168,Gemm_Hipblaslt_TN_9265,0.18788
GemmTunableOp_Half_TN,tn_4096_1603_7168,Gemm_Hipblaslt_TN_9679,0.182979
GemmTunableOp_Half_TN,tn_14336_3592_4096,Gemm_Hipblaslt_TN_9192,0.737337
GemmTunableOp_Half_TN,tn_4096_3553_7168,Gemm_Hipblaslt_TN_9192,0.350442
GemmTunableOp_Half_TN,tn_3072_3511_4096,Gemm_Rocblas_621286753,0.159167
GemmTunableOp_Half_TN,tn_14336_1887_4096,Gemm_Hipblaslt_TN_9677,0.381355
GemmTunableOp_Half_TN,tn_14336_7240_4096,Gemm_Hipblaslt_TN_9683,1.44079
GemmTunableOp_Half_TN,tn_4096_1810_7168,Gemm_Hipblaslt_TN_9680,0.205679
GemmTunableOp_Half_TN,tn_64128_84_4096,Gemm_Hipblaslt_TN_9057,0.184512
GemmTunableOp_Half_TN,tn_4096_1774_2048,Gemm_Hipblaslt_TN_9680,0.0629913
GemmTunableOp_Half_TN,tn_3072_1774_4096,Gemm_Rocblas_621286778,0.0915688
GemmTunableOp_Half_TN,tn_3072_5277_4096,Gemm_Rocblas_621286415,0.221769
GemmTunableOp_Half_TN,tn_4096_1967_7168,Gemm_Hipblaslt_TN_9680,0.216283
GemmTunableOp_Half_TN,tn_14336_1815_4096,Gemm_Hipblaslt_TN_9677,0.373964
GemmTunableOp_Half_TN,tn_14336_7138_4096,Gemm_Hipblaslt_TN_9869,1.38405
GemmTunableOp_Half_TN,tn_3072_1605_4096,Gemm_Rocblas_621294520,0.0885576
GemmTunableOp_Half_TN,tn_3072_1860_4096,Gemm_Hipblaslt_TN_9613,0.0954667
GemmTunableOp_Half_TN,tn_4096_3478_2048,Gemm_Hipblaslt_TN_9683,0.105596
GemmTunableOp_Half_TN,tn_3072_5223_4096,Gemm_Hipblaslt_TN_9920,0.219904
GemmTunableOp_Half_TN,tn_4096_1586_7168,Gemm_Hipblaslt_TN_9265,0.183971
GemmTunableOp_Half_TN,tn_14336_7552_4096,Gemm_Hipblaslt_TN_9890,1.50798
GemmTunableOp_Half_TN,tn_3072_1597_4096,Gemm_Hipblaslt_TN_9163,0.0871208
GemmTunableOp_Half_TN,tn_4096_3300_7168,Gemm_Hipblaslt_TN_9192,0.3329
GemmTunableOp_Half_TN,tn_14336_3535_4096,Gemm_Hipblaslt_TN_9223,0.676579
GemmTunableOp_Half_TN,tn_4096_3581_7168,Gemm_Hipblaslt_TN_9743,0.351814
GemmTunableOp_Half_TN,tn_64128_173_4096,Gemm_Hipblaslt_TN_9707,0.248095
GemmTunableOp_Half_TN,tn_3072_1603_4096,Gemm_Rocblas_621286778,0.087362
GemmTunableOp_Half_TN,tn_14336_80_4096,Gemm_Hipblaslt_TN_9494,0.0324189
GemmTunableOp_Half_TN,tn_3072_5089_4096,Gemm_Hipblaslt_TN_9726,0.217652
GemmTunableOp_Half_TN,tn_4096_3574_2048,Gemm_Hipblaslt_TN_9896,0.1068
GemmTunableOp_Half_TN,tn_14336_5067_4096,Gemm_Hipblaslt_TN_9697,1.01133
GemmTunableOp_Half_TN,tn_4096_3666_7168,Gemm_Hipblaslt_TN_9859,0.365891
GemmTunableOp_Half_TN,tn_3072_3666_4096,Gemm_Hipblaslt_TN_9709,0.166669
GemmTunableOp_Half_TN,tn_3072_3597_4096,Gemm_Hipblaslt_TN_9619,0.160601
GemmTunableOp_Half_TN,tn_3072_208_4096,Gemm_Rocblas_621286445,0.023026
GemmTunableOp_Half_TN,tn_3072_7190_4096,Gemm_Hipblaslt_TN_9681,0.319841
GemmTunableOp_Half_TN,tn_14336_6721_4096,Gemm_Hipblaslt_TN_9753,1.34966
GemmTunableOp_Half_TN,tn_14336_3573_4096,Gemm_Hipblaslt_TN_9220,0.683984
GemmTunableOp_Half_TN,tn_4096_6881_2048,Gemm_Hipblaslt_TN_9692,0.207558
GemmTunableOp_Half_TN,tn_4096_1786_7168,Gemm_Hipblaslt_TN_9645,0.20261
GemmTunableOp_Half_TN,tn_4096_1660_2048,Gemm_Hipblaslt_TN_9607,0.0571241
GemmTunableOp_Half_TN,tn_4096_5495_2048,Gemm_Hipblaslt_TN_9799,0.174199
GemmTunableOp_Half_TN,tn_4096_1778_7168,Gemm_Hipblaslt_TN_9645,0.202593
GemmTunableOp_Half_TN,tn_4096_136_7168,Gemm_Hipblaslt_TN_9472,0.0356821
GemmTunableOp_Half_TN,tn_14336_1765_4096,Gemm_Hipblaslt_TN_9192,0.371235
GemmTunableOp_Half_TN,tn_14336_3478_4096,Gemm_Hipblaslt_TN_9223,0.678684
GemmTunableOp_Half_TN,tn_4096_5219_7168,Gemm_Rocblas_621294426,0.548287
GemmTunableOp_Half_TN,tn_4096_6870_2048,Gemm_Hipblaslt_TN_9683,0.206216
GemmTunableOp_Half_TN,tn_3072_7033_4096,Gemm_Hipblaslt_TN_9681,0.312801
GemmTunableOp_Half_TN,tn_3072_1977_4096,Gemm_Hipblaslt_TN_9633,0.0994527
GemmTunableOp_Half_TN,tn_4096_1780_2048,Gemm_Hipblaslt_TN_9590,0.0641774
GemmTunableOp_Half_TN,tn_4096_5723_2048,Gemm_Hipblaslt_TN_9687,0.177722
GemmTunableOp_Half_TN,tn_4096_7072_7168,Gemm_Rocblas_621286743,0.695394
GemmTunableOp_Half_TN,tn_14336_1935_4096,Gemm_Hipblaslt_TN_9220,0.402424
GemmTunableOp_Half_TN,tn_4096_7225_2048,Gemm_Hipblaslt_TN_9188,0.21401
GemmTunableOp_Half_TN,tn_14336_6773_4096,Gemm_Hipblaslt_TN_9749,1.35747
GemmTunableOp_Half_TN,tn_3072_6996_4096,Gemm_Hipblaslt_TN_9619,0.314555
GemmTunableOp_Half_TN,tn_14336_3450_4096,Gemm_Hipblaslt_TN_9223,0.670581
GemmTunableOp_Half_TN,tn_4096_240_7168,Gemm_Hipblaslt_TN_9303,0.0445194
GemmTunableOp_Half_TN,tn_4096_1770_2048,Gemm_Hipblaslt_TN_9329,0.0627449
GemmTunableOp_Half_TN,tn_4096_1682_7168,Gemm_Hipblaslt_TN_9164,0.186996
GemmTunableOp_Half_TN,tn_4096_6868_7168,Gemm_Hipblaslt_TN_9677,0.677395
GemmTunableOp_Half_TN,tn_4096_5068_2048,Gemm_Hipblaslt_TN_9681,0.168722
GemmTunableOp_Half_TN,tn_4096_7267_7168,Gemm_Rocblas_621294443,0.704129
GemmTunableOp_Half_TN,tn_3072_7047_4096,Gemm_Hipblaslt_TN_9681,0.315367
GemmTunableOp_Half_TN,tn_64128_152_4096,Gemm_Hipblaslt_TN_9871,0.228488
GemmTunableOp_Half_TN,tn_4096_7364_2048,Gemm_Hipblaslt_TN_9704,0.224372
GemmTunableOp_Half_TN,tn_4096_1780_7168,Gemm_Hipblaslt_TN_9329,0.204005
GemmTunableOp_Half_TN,tn_4096_1946_7168,Gemm_Hipblaslt_TN_9680,0.213546
GemmTunableOp_Half_TN,tn_3072_1781_4096,Gemm_Rocblas_621286778,0.093247
GemmTunableOp_Half_TN,tn_4096_6920_2048,Gemm_Hipblaslt_TN_9732,0.20689
GemmTunableOp_Half_TN,tn_4096_7325_7168,Gemm_Hipblaslt_TN_9904,0.723465
GemmTunableOp_Half_TN,tn_4096_1786_2048,Gemm_Hipblaslt_TN_9680,0.062852
GemmTunableOp_Half_TN,tn_3072_1738_4096,Gemm_Hipblaslt_TN_9613,0.0916633
GemmTunableOp_Half_TN,tn_3072_1894_4096,Gemm_Hipblaslt_TN_9324,0.0953604
GemmTunableOp_Half_TN,tn_4096_5277_2048,Gemm_Hipblaslt_TN_9799,0.169638
GemmTunableOp_Half_TN,tn_3072_3793_4096,Gemm_Hipblaslt_TN_9852,0.167936
GemmTunableOp_Half_TN,tn_14336_3410_4096,Gemm_Hipblaslt_TN_9223,0.674567
GemmTunableOp_Half_TN,tn_14336_7096_4096,Gemm_Hipblaslt_TN_9904,1.37822
GemmTunableOp_Half_TN,tn_4096_5583_7168,Gemm_Rocblas_621294426,0.575343
GemmTunableOp_Half_TN,tn_14336_3373_4096,Gemm_Rocblas_621286693,0.667363
GemmTunableOp_Half_TN,tn_4096_3455_7168,Gemm_Hipblaslt_TN_9694,0.340756
GemmTunableOp_Half_TN,tn_3072_7386_4096,Gemm_Rocblas_621294473,0.337017
GemmTunableOp_Half_TN,tn_3072_3612_4096,Gemm_Hipblaslt_TN_9619,0.16182
GemmTunableOp_Half_TN,tn_3072_6952_4096,Gemm_Hipblaslt_TN_9681,0.311827
GemmTunableOp_Half_TN,tn_14336_7262_4096,Gemm_Hipblaslt_TN_9683,1.4292
GemmTunableOp_Half_TN,tn_4096_7033_7168,Gemm_Hipblaslt_TN_9743,0.690841
GemmTunableOp_Half_TN,tn_4096_240_2048,Gemm_Rocblas_621286815,0.0150853
GemmTunableOp_Half_TN,tn_3072_1810_4096,Gemm_Hipblaslt_TN_9322,0.0935137
GemmTunableOp_Half_TN,tn_4096_8_2048,Gemm_Rocblas_621294047,0.0071018
GemmTunableOp_Half_TN,tn_4096_6708_7168,Gemm_Hipblaslt_TN_9694,0.666562
GemmTunableOp_Half_TN,tn_14336_1615_4096,Gemm_Hipblaslt_TN_9697,0.357072
GemmTunableOp_Half_TN,tn_4096_5570_2048,Gemm_Hipblaslt_TN_9799,0.175375
GemmTunableOp_Half_TN,tn_3072_5030_4096,Gemm_Hipblaslt_TN_9726,0.215956
GemmTunableOp_Half_TN,tn_14336_120_4096,Gemm_Hipblaslt_TN_9516,0.0421461
GemmTunableOp_Half_TN,tn_3072_5274_4096,Gemm_Hipblaslt_TN_9920,0.220465
GemmTunableOp_Half_TN,tn_3072_7267_4096,Gemm_Hipblaslt_TN_9681,0.318979
GemmTunableOp_Half_TN,tn_4096_3369_7168,Gemm_Hipblaslt_TN_9694,0.3373
GemmTunableOp_Half_TN,tn_4096_1690_2048,Gemm_Hipblaslt_TN_9164,0.0583664
GemmTunableOp_Half_TN,tn_4096_3629_2048,Gemm_Hipblaslt_TN_9694,0.106815
GemmTunableOp_Half_TN,tn_3072_1840_4096,Gemm_Hipblaslt_TN_9613,0.0950725
GemmTunableOp_Half_TN,tn_3072_6708_4096,Gemm_Hipblaslt_TN_9619,0.302155
GemmTunableOp_Half_TN,tn_14336_1825_4096,Gemm_Hipblaslt_TN_9697,0.375075
GemmTunableOp_Half_TN,tn_4096_3514_7168,Gemm_Hipblaslt_TN_9697,0.350293
GemmTunableOp_Half_TN,tn_4096_5274_7168,Gemm_Rocblas_621294320,0.551198
GemmTunableOp_Half_TN,tn_14336_6747_4096,Gemm_Hipblaslt_TN_9813,1.35058
GemmTunableOp_Half_TN,tn_14336_224_4096,Gemm_Hipblaslt_TN_9634,0.0662419
GemmTunableOp_Half_TN,tn_14336_7093_4096,Gemm_Hipblaslt_TN_9890,1.37954
GemmTunableOp_Half_TN,tn_4096_1883_2048,Gemm_Hipblaslt_TN_9174,0.0658685
GemmTunableOp_Half_TN,tn_4096_1792_2048,Gemm_Hipblaslt_TN_9590,0.0619654
GemmTunableOp_Half_TN,tn_14336_168_4096,Gemm_Rocblas_621294461,0.0572116
GemmTunableOp_Half_TN,tn_64128_183_4096,Gemm_Hipblaslt_TN_9862,0.255064
GemmTunableOp_Half_TN,tn_14336_7033_4096,Gemm_Hipblaslt_TN_9827,1.36916
GemmTunableOp_Half_TN,tn_14336_1805_4096,Gemm_Hipblaslt_TN_9187,0.373082
GemmTunableOp_Half_TN,tn_3072_7345_4096,Gemm_Hipblaslt_TN_9924,0.335621
GemmTunableOp_Half_TN,tn_64128_119_4096,Gemm_Hipblaslt_TN_9263,0.206383
GemmTunableOp_Half_TN,tn_14336_1850_4096,Gemm_Hipblaslt_TN_9187,0.377401
GemmTunableOp_Half_TN,tn_4096_1763_2048,Gemm_Hipblaslt_TN_9329,0.0629593
GemmTunableOp_Half_TN,tn_14336_7253_4096,Gemm_Hipblaslt_TN_9192,1.44577
GemmTunableOp_Half_TN,tn_14336_1685_4096,Gemm_Hipblaslt_TN_9697,0.360514
GemmTunableOp_Half_TN,tn_64128_148_4096,Gemm_Hipblaslt_TN_9108,0.226946
GemmTunableOp_Half_TN,tn_64128_219_4096,Gemm_Hipblaslt_TN_9593,0.279914
GemmTunableOp_Half_TN,tn_64128_156_4096,Gemm_Hipblaslt_TN_9108,0.230896
GemmTunableOp_Half_TN,tn_3072_3501_4096,Gemm_Rocblas_621294495,0.15863
GemmTunableOp_Half_TN,tn_64128_40_4096,Gemm_Hipblaslt_TN_9097,0.166513
GemmTunableOp_Half_TN,tn_4096_7253_7168,Gemm_Hipblaslt_TN_9694,0.70825
GemmTunableOp_Half_TN,tn_4096_168_2048,Gemm_Rocblas_621286443,0.0130956
GemmTunableOp_Half_TN,tn_4096_1954_2048,Gemm_Hipblaslt_TN_9620,0.0665639
GemmTunableOp_Half_TN,tn_3072_5413_4096,Gemm_Hipblaslt_TN_9725,0.22803
GemmTunableOp_Half_TN,tn_3072_216_4096,Gemm_Rocblas_621294168,0.0223634
GemmTunableOp_Half_TN,tn_4096_152_7168,Gemm_Hipblaslt_TN_7583,0.0376234
GemmTunableOp_Half_TN,tn_4096_7575_2048,Gemm_Hipblaslt_TN_9768,0.226523
GemmTunableOp_Half_TN,tn_4096_7170_7168,Gemm_Hipblaslt_TN_9694,0.703902
GemmTunableOp_Half_TN,tn_4096_1668_7168,Gemm_Hipblaslt_TN_9265,0.185737
GemmTunableOp_Half_TN,tn_3072_3526_4096,Gemm_Hipblaslt_TN_9619,0.15855
GemmTunableOp_Half_TN,tn_4096_1924_7168,Gemm_Hipblaslt_TN_9680,0.213303
GemmTunableOp_Half_TN,tn_4096_3781_7168,Gemm_Hipblaslt_TN_9217,0.370455
GemmTunableOp_Half_TN,tn_4096_3416_2048,Gemm_Hipblaslt_TN_9683,0.103717
GemmTunableOp_Half_TN,tn_3072_1898_4096,Gemm_Hipblaslt_TN_9613,0.0958232
GemmTunableOp_Half_TN,tn_4096_5239_7168,Gemm_Rocblas_621286580,0.550592
GemmTunableOp_Half_TN,tn_3072_6965_4096,Gemm_Hipblaslt_TN_9681,0.310538
GemmTunableOp_Half_TN,tn_4096_1840_2048,Gemm_Hipblaslt_TN_9590,0.0641177
GemmTunableOp_Half_TN,tn_4096_1813_2048,Gemm_Hipblaslt_TN_9590,0.0632969
GemmTunableOp_Half_TN,tn_4096_6788_2048,Gemm_Hipblaslt_TN_9743,0.206031
GemmTunableOp_Half_TN,tn_4096_1699_2048,Gemm_Hipblaslt_TN_9671,0.0595449
GemmTunableOp_Half_TN,tn_64128_229_4096,Gemm_Rocblas_621286915,0.292017
GemmTunableOp_Half_TN,tn_4096_1875_7168,Gemm_Hipblaslt_TN_9645,0.211511
GemmTunableOp_Half_TN,tn_64128_194_4096,Gemm_Hipblaslt_TN_9654,0.273522
GemmTunableOp_Half_TN,tn_4096_3373_7168,Gemm_Hipblaslt_TN_9694,0.337801
GemmTunableOp_Half_TN,tn_3072_160_4096,Gemm_Rocblas_621294166,0.018506
GemmTunableOp_Half_TN,tn_4096_1643_7168,Gemm_Hipblaslt_TN_9587,0.184963
GemmTunableOp_Half_TN,tn_14336_1686_4096,Gemm_Hipblaslt_TN_9697,0.362023
GemmTunableOp_Half_TN,tn_3072_5285_4096,Gemm_Hipblaslt_TN_9751,0.220972
GemmTunableOp_Half_TN,tn_14336_1766_4096,Gemm_Hipblaslt_TN_9187,0.369836
GemmTunableOp_Half_TN,tn_4096_3764_7168,Gemm_Hipblaslt_TN_9217,0.368225
GemmTunableOp_Half_TN,tn_64128_126_4096,Gemm_Rocblas_621294762,0.204085
GemmTunableOp_Half_TN,tn_4096_1745_2048,Gemm_Hipblaslt_TN_9329,0.0632197
GemmTunableOp_Half_TN,tn_4096_1727_7168,Gemm_Hipblaslt_TN_9265,0.187902
GemmTunableOp_Half_TN,tn_3072_5410_4096,Gemm_Hipblaslt_TN_9710,0.22811
GemmTunableOp_Half_TN,tn_64128_215_4096,Gemm_Hipblaslt_TN_9768,0.279964
GemmTunableOp_Half_TN,tn_3072_1830_4096,Gemm_Hipblaslt_TN_9641,0.094781
GemmTunableOp_Half_TN,tn_64128_27_4096,Gemm_Rocblas_621286348,0.147413
GemmTunableOp_Half_TN,tn_4096_3511_2048,Gemm_Hipblaslt_TN_9683,0.105938
GemmTunableOp_Half_TN,tn_64128_178_4096,Gemm_Hipblaslt_TN_9855,0.251621
GemmTunableOp_Half_TN,tn_14336_1670_4096,Gemm_Hipblaslt_TN_9697,0.360059
GemmTunableOp_Half_TN,tn_64128_166_4096,Gemm_Hipblaslt_TN_9862,0.249551
GemmTunableOp_Half_TN,tn_4096_3427_2048,Gemm_Hipblaslt_TN_9896,0.103381
GemmTunableOp_Half_TN,tn_4096_3508_2048,Gemm_Hipblaslt_TN_9696,0.106732
GemmTunableOp_Half_TN,tn_4096_1916_2048,Gemm_Hipblaslt_TN_9134,0.0663696
GemmTunableOp_Half_TN,tn_3072_3586_4096,Gemm_Hipblaslt_TN_9619,0.161072
GemmTunableOp_Half_TN,tn_4096_3438_7168,Gemm_Hipblaslt_TN_9695,0.340713
GemmTunableOp_Half_TN,tn_4096_3647_7168,Gemm_Hipblaslt_TN_9192,0.355341
GemmTunableOp_Half_TN,tn_4096_1930_7168,Gemm_Hipblaslt_TN_9645,0.213471
GemmTunableOp_Half_TN,tn_4096_1728_2048,Gemm_Hipblaslt_TN_9164,0.0576393
GemmTunableOp_Half_TN,tn_14336_1710_4096,Gemm_Hipblaslt_TN_9187,0.360945
GemmTunableOp_Half_TN,tn_3072_3520_4096,Gemm_Hipblaslt_TN_9619,0.158049
GemmTunableOp_Half_TN,tn_4096_1764_7168,Gemm_Hipblaslt_TN_9329,0.200629
GemmTunableOp_Half_TN,tn_4096_1871_2048,Gemm_Hipblaslt_TN_9134,0.0652617
GemmTunableOp_Half_TN,tn_64128_237_4096,Gemm_Rocblas_621286554,0.296348
GemmTunableOp_Half_TN,tn_3072_1966_4096,Gemm_Hipblaslt_TN_9633,0.0994446
GemmTunableOp_Half_TN,tn_3072_3497_4096,Gemm_Rocblas_621286753,0.159206
GemmTunableOp_Half_TN,tn_3072_1733_4096,Gemm_Rocblas_621286778,0.0918148
GemmTunableOp_Half_TN,tn_4096_6860_7168,Gemm_Hipblaslt_TN_9743,0.678928
GemmTunableOp_Half_TN,tn_4096_1852_7168,Gemm_Hipblaslt_TN_9137,0.207835
GemmTunableOp_Half_TN,tn_64128_170_4096,Gemm_Hipblaslt_TN_9707,0.247857
GemmTunableOp_Half_TN,tn_14336_6916_4096,Gemm_Hipblaslt_TN_9815,1.36003
GemmTunableOp_Half_TN,tn_3072_256_4096,Gemm_Rocblas_621286445,0.0234607
GemmTunableOp_Half_TN,tn_3072_5735_4096,Gemm_Hipblaslt_TN_9624,0.260137
GemmTunableOp_Half_TN,tn_14336_1774_4096,Gemm_Hipblaslt_TN_9677,0.373076
GemmTunableOp_Half_TN,tn_4096_1766_7168,Gemm_Hipblaslt_TN_9645,0.201644
GemmTunableOp_Half_TN,tn_3072_1735_4096,Gemm_Hipblaslt_TN_9322,0.0910638
GemmTunableOp_Half_TN,tn_3072_6868_4096,Gemm_Hipblaslt_TN_9619,0.306392
GemmTunableOp_Half_TN,tn_4096_5427_2048,Gemm_Hipblaslt_TN_9799,0.172391
GemmTunableOp_Half_TN,tn_3072_3600_4096,Gemm_Hipblaslt_TN_9619,0.159637
GemmTunableOp_Half_TN,tn_4096_1592_2048,Gemm_Hipblaslt_TN_9164,0.0574756
GemmTunableOp_Half_TN,tn_4096_120_2048,Gemm_Rocblas_621286279,0.011127
GemmTunableOp_Half_TN,tn_4096_1902_7168,Gemm_Hipblaslt_TN_9645,0.212376
GemmTunableOp_Half_TN,tn_4096_152_2048,Gemm_Rocblas_621294173,0.0132091
GemmTunableOp_Half_TN,tn_4096_1706_2048,Gemm_Hipblaslt_TN_9607,0.057638
GemmTunableOp_Half_TN,tn_4096_1957_2048,Gemm_Hipblaslt_TN_9590,0.066265
GemmTunableOp_Half_TN,tn_4096_40_2048,Gemm_Rocblas_621286428,0.00796229
GemmTunableOp_Half_TN,tn_4096_1978_7168,Gemm_Hipblaslt_TN_9680,0.214444
GemmTunableOp_Half_TN,tn_3072_1614_4096,Gemm_Hipblaslt_TN_9322,0.0882535
GemmTunableOp_Half_TN,tn_4096_1599_2048,Gemm_Hipblaslt_TN_9607,0.0566551
GemmTunableOp_Half_TN,tn_4096_1610_2048,Gemm_Hipblaslt_TN_9607,0.0565473
GemmTunableOp_Half_TN,tn_3072_7109_4096,Gemm_Hipblaslt_TN_9681,0.31421
GemmTunableOp_Half_TN,tn_14336_3404_4096,Gemm_Rocblas_621294435,0.668249
GemmTunableOp_Half_TN,tn_3072_3508_4096,Gemm_Rocblas_621286753,0.160091
GemmTunableOp_Half_TN,tn_64128_71_4096,Gemm_Hipblaslt_TN_9057,0.180572
GemmTunableOp_Half_TN,tn_14336_3468_4096,Gemm_Rocblas_621294330,0.679883
GemmTunableOp_Half_TN,tn_14336_1829_4096,Gemm_Hipblaslt_TN_9697,0.378261
GemmTunableOp_Half_TN,tn_14336_3773_4096,Gemm_Hipblaslt_TN_9697,0.760384
GemmTunableOp_Half_TN,tn_4096_1722_7168,Gemm_Hipblaslt_TN_9359,0.187985
GemmTunableOp_Half_TN,tn_4096_1642_2048,Gemm_Hipblaslt_TN_9607,0.0574281
GemmTunableOp_Half_TN,tn_4096_3562_2048,Gemm_Hipblaslt_TN_9896,0.105979
GemmTunableOp_Half_TN,tn_14336_3748_4096,Gemm_Hipblaslt_TN_9192,0.754368
GemmTunableOp_Half_TN,tn_4096_1597_7168,Gemm_Hipblaslt_TN_9265,0.184016
GemmTunableOp_Half_TN,tn_64128_165_4096,Gemm_Hipblaslt_TN_9862,0.249535
GemmTunableOp_Half_TN,tn_4096_1840_7168,Gemm_Hipblaslt_TN_9680,0.207632
GemmTunableOp_Half_TN,tn_4096_5533_2048,Gemm_Hipblaslt_TN_9691,0.175538
GemmTunableOp_Half_TN,tn_28672_232_8192,Gemm_Hipblaslt_TN_9540,0.292156
GemmTunableOp_Half_TN,tn_14336_5413_4096,Gemm_Rocblas_621294492,1.09873
GemmTunableOp_Half_TN,tn_14336_3441_4096,Gemm_Hipblaslt_TN_9200,0.675741
GemmTunableOp_Half_TN,tn_4096_3475_7168,Gemm_Hipblaslt_TN_9192,0.344969
GemmTunableOp_Half_TN,tn_14336_1789_4096,Gemm_Hipblaslt_TN_9192,0.373231
GemmTunableOp_Half_TN,tn_3072_1787_4096,Gemm_Rocblas_621294520,0.091326
GemmTunableOp_Half_TN,tn_4096_1933_7168,Gemm_Hipblaslt_TN_9136,0.21395
GemmTunableOp_Half_TN,tn_3072_6916_4096,Gemm_Hipblaslt_TN_9681,0.313287
GemmTunableOp_Half_TN,tn_14336_5390_4096,Gemm_Hipblaslt_TN_9220,1.09739
GemmTunableOp_Half_TN,tn_4096_1967_2048,Gemm_Hipblaslt_TN_9590,0.0677769
GemmTunableOp_Half_TN,tn_64128_33_4096,Gemm_Hipblaslt_TN_9097,0.165116
GemmTunableOp_Half_TN,tn_14336_1924_4096,Gemm_Hipblaslt_TN_9223,0.402404
GemmTunableOp_Half_TN,tn_4096_1688_2048,Gemm_Hipblaslt_TN_9180,0.0586964
GemmTunableOp_Half_TN,tn_14336_1838_4096,Gemm_Hipblaslt_TN_9192,0.378239
GemmTunableOp_Half_TN,tn_4096_144_2048,Gemm_Rocblas_621294171,0.0125644
GemmTunableOp_Half_TN,tn_3072_1822_4096,Gemm_Rocblas_621286778,0.0927857
GemmTunableOp_Half_TN,tn_64128_142_4096,Gemm_Rocblas_621294354,0.226457
GemmTunableOp_Half_TN,tn_64128_201_4096,Gemm_Hipblaslt_TN_9185,0.276676
GemmTunableOp_Half_TN,tn_4096_3612_7168,Gemm_Hipblaslt_TN_9682,0.353334
GemmTunableOp_Half_TN,tn_64128_245_4096,Gemm_Rocblas_621294648,0.289588
GemmTunableOp_Half_TN,tn_3072_7191_4096,Gemm_Hipblaslt_TN_9681,0.318812
GemmTunableOp_Half_TN,tn_4096_200_2048,Gemm_Rocblas_621294175,0.0143148
GemmTunableOp_Half_TN,tn_3072_7325_4096,Gemm_Hipblaslt_TN_9783,0.334365
GemmTunableOp_Half_TN,tn_3072_1688_4096,Gemm_Hipblaslt_TN_9561,0.0889684
GemmTunableOp_Half_TN,tn_4096_6630_7168,Gemm_Hipblaslt_TN_9814,0.668935
GemmTunableOp_Half_TN,tn_3072_3588_4096,Gemm_Hipblaslt_TN_9570,0.160096
GemmTunableOp_Half_TN,tn_4096_3920_2048,Gemm_Rocblas_621286281,0.115308
GemmTunableOp_Half_TN,tn_64128_212_4096,Gemm_Hipblaslt_TN_9654,0.279441
GemmTunableOp_Half_TN,tn_14336_1909_4096,Gemm_Hipblaslt_TN_9677,0.38059
GemmTunableOp_Half_TN,tn_4096_5436_7168,Gemm_Hipblaslt_TN_9672,0.562678
GemmTunableOp_Half_TN,tn_3072_3701_4096,Gemm_Hipblaslt_TN_9805,0.167837
GemmTunableOp_Half_TN,tn_3072_5196_4096,Gemm_Hipblaslt_TN_9726,0.220072
GemmTunableOp_Half_TN,tn_4096_5285_7168,Gemm_Rocblas_621294320,0.557985
GemmTunableOp_Half_TN,tn_64128_94_4096,Gemm_Hipblaslt_TN_9057,0.187449
GemmTunableOp_Half_TN,tn_4096_3578_7168,Gemm_Hipblaslt_TN_9743,0.348564
GemmTunableOp_Half_TN,tn_4096_5381_2048,Gemm_Hipblaslt_TN_9799,0.172835
GemmTunableOp_Half_TN,tn_3072_1765_4096,Gemm_Hipblaslt_TN_9148,0.0919687
GemmTunableOp_Half_TN,tn_4096_1748_2048,Gemm_Hipblaslt_TN_9136,0.0625252
GemmTunableOp_Half_TN,tn_64128_214_4096,Gemm_Hipblaslt_TN_9185,0.279439
GemmTunableOp_Half_TN,tn_4096_1668_2048,Gemm_Hipblaslt_TN_9164,0.0583832
GemmTunableOp_Half_TN,tn_64128_32_4096,Gemm_Rocblas_621286348,0.141589
GemmTunableOp_Half_TN,tn_14336_48_4096,Gemm_Rocblas_621286443,0.0292584
GemmTunableOp_Half_TN,tn_14336_3520_4096,Gemm_Hipblaslt_TN_9223,0.680351
GemmTunableOp_Half_TN,tn_14336_1889_4096,Gemm_Hipblaslt_TN_9677,0.379177
GemmTunableOp_Half_TN,tn_4096_5274_2048,Gemm_Hipblaslt_TN_9709,0.170967
GemmTunableOp_Half_TN,tn_64128_168_4096,Gemm_Hipblaslt_TN_9661,0.248974
GemmTunableOp_Half_TN,tn_14336_1970_4096,Gemm_Hipblaslt_TN_9220,0.404373
GemmTunableOp_Half_TN,tn_4096_6870_7168,Gemm_Hipblaslt_TN_9694,0.679476
GemmTunableOp_Half_TN,tn_4096_7077_7168,Gemm_Hipblaslt_TN_9743,0.694698
GemmTunableOp_Half_TN,tn_8192_256_14336,Gemm_Rocblas_621286469,0.139528
GemmTunableOp_Half_TN,tn_3072_1596_4096,Gemm_Hipblaslt_TN_9561,0.0854559
GemmTunableOp_Half_TN,tn_3072_5541_4096,Gemm_Hipblaslt_TN_9726,0.229798
GemmTunableOp_Half_TN,tn_3072_1686_4096,Gemm_Hipblaslt_TN_9148,0.0896679
GemmTunableOp_Half_TN,tn_4096_1698_2048,Gemm_Hipblaslt_TN_9588,0.0594809
GemmTunableOp_Half_TN,tn_4096_1684_7168,Gemm_Hipblaslt_TN_9671,0.18722
GemmTunableOp_Half_TN,tn_14336_1757_4096,Gemm_Hipblaslt_TN_9192,0.371395
GemmTunableOp_Half_TN,tn_4096_1608_2048,Gemm_Hipblaslt_TN_9164,0.0569091
GemmTunableOp_Half_TN,tn_14336_208_4096,Gemm_Rocblas_621294215,0.0652944
GemmTunableOp_Half_TN,tn_14336_7108_4096,Gemm_Hipblaslt_TN_9914,1.3767
GemmTunableOp_Half_TN,tn_4096_7096_2048,Gemm_Hipblaslt_TN_9743,0.211076
GemmTunableOp_Half_TN,tn_8192_4096_4096,Gemm_Hipblaslt_TN_9768,0.464807
GemmTunableOp_Half_TN,tn_4096_1636_7168,Gemm_Hipblaslt_TN_9265,0.185882
GemmTunableOp_Half_TN,tn_14336_3589_4096,Gemm_Hipblaslt_TN_9187,0.737419
GemmTunableOp_Half_TN,tn_4096_1888_2048,Gemm_Hipblaslt_TN_9680,0.0648623
GemmTunableOp_Half_TN,tn_14336_1842_4096,Gemm_Hipblaslt_TN_9697,0.377621
GemmTunableOp_Half_TN,tn_4096_5723_7168,Gemm_Hipblaslt_TN_9923,0.583216
GemmTunableOp_Half_TN,tn_4096_1738_2048,Gemm_Hipblaslt_TN_9329,0.0626453
GemmTunableOp_Half_TN,tn_14336_1628_4096,Gemm_Hipblaslt_TN_9697,0.35806
GemmTunableOp_Half_TN,tn_3072_1824_4096,Gemm_Rocblas_621294520,0.0914817
GemmTunableOp_Half_TN,tn_14336_1798_4096,Gemm_Hipblaslt_TN_9697,0.373592
GemmTunableOp_Half_TN,tn_14336_176_4096,Gemm_Rocblas_621286719,0.0565093
GemmTunableOp_Half_TN,tn_4096_5412_7168,Gemm_Hipblaslt_TN_9799,0.563606
GemmTunableOp_Half_TN,tn_4096_3455_2048,Gemm_Hipblaslt_TN_9896,0.101075
GemmTunableOp_Half_TN,tn_4096_5357_7168,Gemm_Rocblas_621294320,0.561578
GemmTunableOp_Half_TN,tn_64128_235_4096,Gemm_Rocblas_621286915,0.294233
GemmTunableOp_Half_TN,tn_3072_1699_4096,Gemm_Hipblaslt_TN_9322,0.0890211
GemmTunableOp_Half_TN,tn_4096_7109_7168,Gemm_Hipblaslt_TN_9139,0.698591
GemmTunableOp_Half_TN,tn_64128_57_4096,Gemm_Hipblaslt_TN_9097,0.169306
GemmTunableOp_Half_TN,tn_4096_5465_2048,Gemm_Hipblaslt_TN_9799,0.173388
GemmTunableOp_Half_TN,tn_64128_239_4096,Gemm_Hipblaslt_TN_9122,0.295908
GemmTunableOp_Half_TN,tn_14336_5354_4096,Gemm_Hipblaslt_TN_159,1.07376
GemmTunableOp_Half_TN,tn_4096_1683_2048,Gemm_Hipblaslt_TN_9180,0.0586082
GemmTunableOp_Half_TN,tn_14336_1590_4096,Gemm_Hipblaslt_TN_9690,0.332608
GemmTunableOp_Half_TN,tn_4096_1642_7168,Gemm_Hipblaslt_TN_9359,0.184756
GemmTunableOp_Half_TN,tn_4096_1609_2048,Gemm_Hipblaslt_TN_9587,0.0553581
GemmTunableOp_Half_TN,tn_14336_1658_4096,Gemm_Hipblaslt_TN_9677,0.357392
GemmTunableOp_Half_TN,tn_14336_1961_4096,Gemm_Hipblaslt_TN_9220,0.405121
GemmTunableOp_Half_TN,tn_3072_3573_4096,Gemm_Hipblaslt_TN_9570,0.159727
GemmTunableOp_Half_TN,tn_4096_3508_7168,Gemm_Hipblaslt_TN_9677,0.346139
GemmTunableOp_Half_TN,tn_64128_46_4096,Gemm_Hipblaslt_TN_9097,0.168503
GemmTunableOp_Half_TN,tn_64128_154_4096,Gemm_Hipblaslt_TN_9063,0.226719
GemmTunableOp_Half_TN,tn_4096_5277_7168,Gemm_Rocblas_621294426,0.553935
GemmTunableOp_Half_TN,tn_4096_3501_7168,Gemm_Hipblaslt_TN_9187,0.346355
GemmTunableOp_Half_TN,tn_3072_1879_4096,Gemm_Hipblaslt_TN_9148,0.0956491
GemmTunableOp_Half_TN,tn_14336_1596_4096,Gemm_Hipblaslt_TN_9690,0.332141
GemmTunableOp_Half_TN,tn_14336_1811_4096,Gemm_Hipblaslt_TN_9697,0.374448
GemmTunableOp_Half_TN,tn_14336_1948_4096,Gemm_Hipblaslt_TN_9217,0.40469
GemmTunableOp_Half_TN,tn_3072_5390_4096,Gemm_Hipblaslt_TN_9726,0.228199
GemmTunableOp_Half_TN,tn_14336_5100_4096,Gemm_Hipblaslt_TN_9677,1.01652
GemmTunableOp_Half_TN,tn_4096_1618_7168,Gemm_Hipblaslt_TN_9616,0.183711
GemmTunableOp_Half_TN,tn_4096_3559_2048,Gemm_Hipblaslt_TN_9684,0.106568
GemmTunableOp_Half_TN,tn_64128_150_4096,Gemm_Hipblaslt_TN_9674,0.226531
GemmTunableOp_Half_TN,tn_3072_3691_4096,Gemm_Hipblaslt_TN_9709,0.167061
GemmTunableOp_Half_TN,tn_64128_230_4096,Gemm_Rocblas_621286915,0.291976
GemmTunableOp_Half_TN,tn_3072_3651_4096,Gemm_Hipblaslt_TN_9799,0.166669
GemmTunableOp_Half_TN,tn_3072_1862_4096,Gemm_Hipblaslt_TN_9613,0.0945331
GemmTunableOp_Half_TN,tn_4096_5273_2048,Gemm_Hipblaslt_TN_9691,0.169916
GemmTunableOp_Half_TN,tn_4096_1704_2048,Gemm_Hipblaslt_TN_9588,0.0597518
GemmTunableOp_Half_TN,tn_4096_1627_2048,Gemm_Hipblaslt_TN_9588,0.0581223
GemmTunableOp_Half_TN,tn_14336_1655_4096,Gemm_Hipblaslt_TN_9139,0.358911
GemmTunableOp_Half_TN,tn_4096_1850_7168,Gemm_Hipblaslt_TN_9645,0.208482
GemmTunableOp_Half_TN,tn_4096_1801_7168,Gemm_Hipblaslt_TN_9137,0.208043
GemmTunableOp_Half_TN,tn_4096_1760_2048,Gemm_Hipblaslt_TN_9680,0.0634924
GemmTunableOp_Half_TN,tn_3072_3557_4096,Gemm_Rocblas_621286753,0.159929
GemmTunableOp_Half_TN,tn_64128_203_4096,Gemm_Hipblaslt_TN_9593,0.277242
GemmTunableOp_Half_TN,tn_64128_83_4096,Gemm_Hipblaslt_TN_9057,0.182872
GemmTunableOp_Half_TN,tn_14336_1727_4096,Gemm_Hipblaslt_TN_9189,0.362775
GemmTunableOp_Half_TN,tn_4096_1643_2048,Gemm_Hipblaslt_TN_9588,0.057778
GemmTunableOp_Half_TN,tn_4096_1588_7168,Gemm_Hipblaslt_TN_9359,0.182941
GemmTunableOp_Half_TN,tn_14336_5680_4096,Gemm_Hipblaslt_TN_9813,1.13363
GemmTunableOp_Half_TN,tn_4096_1847_2048,Gemm_Hipblaslt_TN_9590,0.0633436
GemmTunableOp_Half_TN,tn_4096_232_2048,Gemm_Rocblas_621294175,0.0146402
GemmTunableOp_Half_TN,tn_64128_52_4096,Gemm_Hipblaslt_TN_9097,0.168022
GemmTunableOp_Half_TN,tn_14336_1769_4096,Gemm_Hipblaslt_TN_9189,0.373583
GemmTunableOp_Half_TN,tn_3072_5512_4096,Gemm_Hipblaslt_TN_9710,0.226766
GemmTunableOp_Half_TN,tn_14336_5533_4096,Gemm_Hipblaslt_TN_9815,1.10756
GemmTunableOp_Half_TN,tn_4096_6952_2048,Gemm_Hipblaslt_TN_9743,0.206295
GemmTunableOp_Half_TN,tn_4096_1963_7168,Gemm_Hipblaslt_TN_9645,0.214378
GemmTunableOp_Half_TN,tn_4096_1593_2048,Gemm_Hipblaslt_TN_9164,0.0565392
GemmTunableOp_Half_TN,tn_14336_7340_4096,Gemm_Hipblaslt_TN_9900,1.47403
GemmTunableOp_Half_TN,tn_4096_1977_7168,Gemm_Hipblaslt_TN_9680,0.215536
GemmTunableOp_Half_TN,tn_4096_3588_2048,Gemm_Hipblaslt_TN_9896,0.105534
GemmTunableOp_Half_TN,tn_4096_5470_7168,Gemm_Rocblas_621286684,0.569078
GemmTunableOp_Half_TN,tn_5120_256_8192,Gemm_Rocblas_621286764,0.0591285
GemmTunableOp_Half_TN,tn_3072_3438_4096,Gemm_Rocblas_621286753,0.155032
GemmTunableOp_Half_TN,tn_4096_5271_2048,Gemm_Hipblaslt_TN_9709,0.170635
GemmTunableOp_Half_TN,tn_14336_1749_4096,Gemm_Hipblaslt_TN_9187,0.369558
GemmTunableOp_Half_TN,tn_4096_3855_7168,Gemm_Hipblaslt_TN_9919,0.377899
GemmTunableOp_Half_TN,tn_14336_1728_4096,Gemm_Hipblaslt_TN_9677,0.359863
GemmTunableOp_Half_TN,tn_3072_3640_4096,Gemm_Hipblaslt_TN_9570,0.161488
GemmTunableOp_Half_TN,tn_4096_1858_2048,Gemm_Hipblaslt_TN_9590,0.063972
GemmTunableOp_Half_TN,tn_4096_1770_7168,Gemm_Hipblaslt_TN_9645,0.203384
GemmTunableOp_Half_TN,tn_4096_1882_2048,Gemm_Hipblaslt_TN_9329,0.0667019
GemmTunableOp_Half_TN,tn_14336_3383_4096,Gemm_Hipblaslt_TN_9223,0.67365
GemmTunableOp_Half_TN,tn_3072_1882_4096,Gemm_Hipblaslt_TN_9561,0.0942447
GemmTunableOp_Half_TN,tn_4096_1859_2048,Gemm_Hipblaslt_TN_9136,0.0646833
GemmTunableOp_Half_TN,tn_8192_4000_4096,Gemm_Hipblaslt_TN_9655,0.452701
GemmTunableOp_Half_TN,tn_14336_7171_4096,Gemm_Hipblaslt_TN_9683,1.42178
GemmTunableOp_Half_TN,tn_14336_1646_4096,Gemm_Hipblaslt_TN_9677,0.355309
GemmTunableOp_Half_TN,tn_14336_3630_4096,Gemm_Hipblaslt_TN_9677,0.738267
GemmTunableOp_Half_TN,tn_14336_6630_4096,Gemm_Hipblaslt_TN_9827,1.32698
GemmTunableOp_Half_TN,tn_4096_1673_7168,Gemm_Hipblaslt_TN_9265,0.18617
GemmTunableOp_Half_TN,tn_64128_6_4096,Gemm_Rocblas_621294578,0.1412
GemmTunableOp_Half_TN,tn_3072_5605_4096,Gemm_Hipblaslt_TN_9910,0.258771
GemmTunableOp_Half_TN,tn_4096_3688_7168,Default,0.366735
GemmTunableOp_Half_TN,tn_3072_5442_4096,Gemm_Hipblaslt_TN_9710,0.226213
GemmTunableOp_Half_TN,tn_4096_1881_7168,Gemm_Hipblaslt_TN_9680,0.211347
GemmTunableOp_Half_TN,tn_64128_248_4096,Gemm_Rocblas_621286905,0.294665
GemmTunableOp_Half_TN,tn_4096_7182_7168,Gemm_Hipblaslt_TN_9187,0.70336
GemmTunableOp_Half_TN,tn_64128_124_4096,Gemm_Rocblas_621294762,0.205601
GemmTunableOp_Half_TN,tn_4096_1827_7168,Gemm_Hipblaslt_TN_9268,0.207239
GemmTunableOp_Half_TN,tn_3072_1757_4096,Gemm_Hipblaslt_TN_9163,0.0928235
GemmTunableOp_Half_TN,tn_14336_152_4096,Gemm_Hipblaslt_TN_9312,0.0520041
GemmTunableOp_Half_TN,tn_4096_32_7168,Gemm_Rocblas_621286329,0.0155129
GemmTunableOp_Half_TN,tn_4096_1827_2048,Gemm_Hipblaslt_TN_9137,0.0645008
GemmTunableOp_Half_TN,tn_3072_7552_4096,Gemm_Rocblas_621294473,0.339293
GemmTunableOp_Half_TN,tn_4096_3535_2048,Gemm_Hipblaslt_TN_9896,0.103145
GemmTunableOp_Half_TN,tn_4096_3526_7168,Gemm_Hipblaslt_TN_9697,0.34732
GemmTunableOp_Half_TN,tn_14336_5204_4096,Gemm_Rocblas_621286750,1.0626
GemmTunableOp_Half_TN,tn_3072_192_4096,Gemm_Rocblas_621294165,0.0191722
GemmTunableOp_Half_TN,tn_3072_3791_4096,Gemm_Hipblaslt_TN_9924,0.168443
GemmTunableOp_Half_TN,tn_3072_7136_4096,Gemm_Hipblaslt_TN_9619,0.318537
GemmTunableOp_Half_TN,tn_3072_1764_4096,Gemm_Hipblaslt_TN_9322,0.0930912
GemmTunableOp_Half_TN,tn_4096_1842_2048,Gemm_Hipblaslt_TN_9590,0.0635252
GemmTunableOp_Half_TN,tn_14336_3466_4096,Gemm_Rocblas_621286693,0.676054
GemmTunableOp_Half_TN,tn_4096_72_2048,Gemm_Rocblas_621294028,0.00928027
GemmTunableOp_Half_TN,tn_4096_1877_7168,Gemm_Hipblaslt_TN_9645,0.212574
GemmTunableOp_Half_TN,tn_3072_6860_4096,Gemm_Hipblaslt_TN_9681,0.306622
GemmTunableOp_Half_TN,tn_3072_1877_4096,Gemm_Hipblaslt_TN_9324,0.0956377
GemmTunableOp_Half_TN,tn_4096_1898_7168,Gemm_Hipblaslt_TN_9680,0.212213
GemmTunableOp_Half_TN,tn_3072_3583_4096,Gemm_Hipblaslt_TN_9570,0.160588
GemmTunableOp_Half_TN,tn_3072_7575_4096,Gemm_Rocblas_621294473,0.337604
GemmTunableOp_Half_TN,tn_4096_1867_7168,Gemm_Hipblaslt_TN_9645,0.210214
GemmTunableOp_Half_TN,tn_14336_184_4096,Gemm_Hipblaslt_TN_9158,0.0588732
GemmTunableOp_Half_TN,tn_14336_5030_4096,Gemm_Hipblaslt_TN_9677,1.01079
GemmTunableOp_Half_TN,tn_64128_221_4096,Gemm_Hipblaslt_TN_9185,0.280919
GemmTunableOp_Half_TN,tn_4096_3507_7168,Gemm_Hipblaslt_TN_9697,0.349384
GemmTunableOp_Half_TN,tn_4096_3507_2048,Gemm_Hipblaslt_TN_9743,0.106324
GemmTunableOp_Half_TN,tn_14336_1958_4096,Gemm_Hipblaslt_TN_9223,0.405172
GemmTunableOp_Half_TN,tn_3072_64_4096,Gemm_Rocblas_621294146,0.0107525
GemmTunableOp_Half_TN,tn_3072_48_4096,Gemm_Rocblas_621294146,0.0106157
GemmTunableOp_Half_TN,tn_64128_108_4096,Gemm_Rocblas_621294762,0.200443
GemmTunableOp_Half_TN,tn_4096_5465_7168,Gemm_Rocblas_621286580,0.567786
GemmTunableOp_Half_TN,tn_4096_1667_2048,Gemm_Hipblaslt_TN_9164,0.0579541
GemmTunableOp_Half_TN,tn_64128_19_4096,Gemm_Rocblas_621286348,0.145384
GemmTunableOp_Half_TN,tn_14336_6841_4096,Gemm_Hipblaslt_TN_9753,1.36133
GemmTunableOp_Half_TN,tn_4096_7206_7168,Gemm_Rocblas_621294469,0.707984
GemmTunableOp_Half_TN,tn_3072_3515_4096,Gemm_Rocblas_621294495,0.158424
GemmTunableOp_Half_TN,tn_64128_91_4096,Gemm_Hipblaslt_TN_9057,0.184978
GemmTunableOp_Half_TN,tn_14336_1771_4096,Gemm_Hipblaslt_TN_9793,0.371042
GemmTunableOp_Half_TN,tn_4096_1728_7168,Gemm_Hipblaslt_TN_9266,0.187997
GemmTunableOp_Half_TN,tn_3072_5067_4096,Gemm_Hipblaslt_TN_9725,0.216668
GemmTunableOp_Half_TN,tn_3072_184_4096,Gemm_Rocblas_621286436,0.01903
GemmTunableOp_Half_TN,tn_3072_3400_4096,Gemm_Rocblas_621294495,0.154516
GemmTunableOp_Half_TN,tn_14336_3507_4096,Gemm_Hipblaslt_TN_9827,0.680754
GemmTunableOp_Half_TN,tn_14336_3497_4096,Gemm_Hipblaslt_TN_9223,0.682016
GemmTunableOp_Half_TN,tn_3072_7432_4096,Gemm_Hipblaslt_TN_9928,0.335429
GemmTunableOp_Half_TN,tn_4096_7050_7168,Gemm_Hipblaslt_TN_9814,0.690995
GemmTunableOp_Half_TN,tn_4096_3416_7168,Gemm_Hipblaslt_TN_9821,0.337495
GemmTunableOp_Half_TN,tn_4096_6747_2048,Gemm_Hipblaslt_TN_9695,0.204103
GemmTunableOp_Half_TN,tn_14336_6868_4096,Gemm_Hipblaslt_TN_9815,1.36376
GemmTunableOp_Half_TN,tn_4096_5030_7168,Gemm_Hipblaslt_TN_9681,0.539196
GemmTunableOp_Half_TN,tn_4096_5470_2048,Gemm_Hipblaslt_TN_9799,0.173311
GemmTunableOp_Half_TN,tn_4096_1767_7168,Gemm_Hipblaslt_TN_9645,0.201052
GemmTunableOp_Half_TN,tn_4096_1826_2048,Gemm_Hipblaslt_TN_9136,0.0639715
GemmTunableOp_Half_TN,tn_14336_1648_4096,Gemm_Hipblaslt_TN_9697,0.358416
GemmTunableOp_Half_TN,tn_14336_6952_4096,Gemm_Hipblaslt_TN_159,1.36802
GemmTunableOp_Half_TN,tn_3072_1680_4096,Gemm_Hipblaslt_TN_9322,0.0902369
GemmTunableOp_Half_TN,tn_14336_1633_4096,Gemm_Hipblaslt_TN_9697,0.358513
GemmTunableOp_Half_TN,tn_4096_1717_2048,Gemm_Hipblaslt_TN_9164,0.0584033
GemmTunableOp_Half_TN,tn_14336_1977_4096,Gemm_Hipblaslt_TN_9220,0.406859
GemmTunableOp_Half_TN,tn_4096_1605_7168,Gemm_Hipblaslt_TN_9359,0.182344
GemmTunableOp_Half_TN,tn_8192_256_4096,Gemm_Rocblas_621294232,0.0426777
GemmTunableOp_Half_TN,tn_3072_1871_4096,Gemm_Hipblaslt_TN_9613,0.095415
GemmTunableOp_Half_TN,tn_14336_1625_4096,Gemm_Hipblaslt_TN_9697,0.359315
GemmTunableOp_Half_TN,tn_14336_7327_4096,Gemm_Hipblaslt_TN_9900,1.46505
GemmTunableOp_Half_TN,tn_3072_1799_4096,Gemm_Rocblas_621294520,0.0922188
GemmTunableOp_Half_TN,tn_4096_1727_2048,Gemm_Hipblaslt_TN_9588,0.059563
GemmTunableOp_Half_TN,tn_3072_1847_4096,Gemm_Hipblaslt_TN_9613,0.0951381
GemmTunableOp_Half_TN,tn_4096_6990_2048,Gemm_Hipblaslt_TN_9692,0.209632
GemmTunableOp_Half_TN,tn_14336_6965_4096,Gemm_Hipblaslt_TN_9914,1.36537
GemmTunableOp_Half_TN,tn_64128_242_4096,Gemm_Rocblas_621286905,0.293747
GemmTunableOp_Half_TN,tn_4096_1953_2048,Gemm_Hipblaslt_TN_9590,0.0659757
GemmTunableOp_Half_TN,tn_64128_256_4096,Gemm_Rocblas_621294648,0.292529
GemmTunableOp_Half_TN,tn_4096_24_7168,Gemm_Rocblas_621286305,0.0152604
GemmTunableOp_Half_TN,tn_3072_5322_4096,Gemm_Rocblas_621286415,0.220691
GemmTunableOp_Half_TN,tn_3072_24_4096,Gemm_Rocblas_621294054,0.00928307
GemmTunableOp_Half_TN,tn_4096_3565_2048,Gemm_Hipblaslt_TN_9896,0.106921
GemmTunableOp_Half_TN,tn_3072_1864_4096,Gemm_Hipblaslt_TN_9561,0.0929286
GemmTunableOp_Half_TN,tn_4096_7248_7168,Gemm_Hipblaslt_TN_9677,0.706061
GemmTunableOp_Half_TN,tn_3072_6788_4096,Gemm_Hipblaslt_TN_9681,0.305201
GemmTunableOp_Half_TN,tn_4096_5157_2048,Gemm_Hipblaslt_TN_9690,0.17011
GemmTunableOp_Half_TN,tn_4096_3612_2048,Gemm_Hipblaslt_TN_9828,0.10819
GemmTunableOp_Half_TN,tn_4096_1855_7168,Gemm_Hipblaslt_TN_9645,0.210077
GemmTunableOp_Half_TN,tn_3072_1909_4096,Gemm_Hipblaslt_TN_9163,0.095463
GemmTunableOp_Half_TN,tn_14336_7186_4096,Gemm_Hipblaslt_TN_9677,1.44078
GemmTunableOp_Half_TN,tn_4096_7033_2048,Gemm_Hipblaslt_TN_9692,0.211182
GemmTunableOp_Half_TN,tn_4096_1858_7168,Gemm_Hipblaslt_TN_9645,0.210149
GemmTunableOp_Half_TN,tn_3072_5436_4096,Gemm_Hipblaslt_TN_9710,0.225857
GemmTunableOp_Half_TN,tn_14336_5274_4096,Gemm_Hipblaslt_TN_9869,1.06452
GemmTunableOp_Half_TN,tn_4096_1779_2048,Gemm_Hipblaslt_TN_9590,0.0626423
GemmTunableOp_Half_TN,tn_14336_1936_4096,Gemm_Hipblaslt_TN_9220,0.403724
GemmTunableOp_Half_TN,tn_4096_5530_7168,Gemm_Hipblaslt_TN_9687,0.568116
GemmTunableOp_Half_TN,tn_4096_1762_7168,Gemm_Hipblaslt_TN_9645,0.202359
GemmTunableOp_Half_TN,tn_3072_7344_4096,Gemm_Hipblaslt_TN_9779,0.33362
GemmTunableOp_Half_TN,tn_3072_7104_4096,Gemm_Hipblaslt_TN_9681,0.312872
GemmTunableOp_Half_TN,tn_14336_40_4096,Gemm_Rocblas_621294230,0.0286512
GemmTunableOp_Half_TN,tn_64128_175_4096,Gemm_Hipblaslt_TN_9707,0.251856
GemmTunableOp_Half_TN,tn_4096_5267_7168,Gemm_Hipblaslt_TN_9799,0.549818
GemmTunableOp_Half_TN,tn_14336_3508_4096,Gemm_Hipblaslt_TN_9220,0.683281
GemmTunableOp_Half_TN,tn_4096_1608_7168,Gemm_Hipblaslt_TN_9265,0.183017
GemmTunableOp_Half_TN,tn_14336_1873_4096,Gemm_Hipblaslt_TN_9697,0.379257
GemmTunableOp_Half_TN,tn_3072_1869_4096,Gemm_Hipblaslt_TN_9324,0.0946877
GemmTunableOp_Half_TN,tn_3072_1829_4096,Gemm_Hipblaslt_TN_9720,0.0941029
GemmTunableOp_Half_TN,tn_4096_1743_2048,Gemm_Hipblaslt_TN_9680,0.0626543
GemmTunableOp_Half_TN,tn_4096_16_7168,Gemm_Rocblas_621294135,0.0132398
GemmTunableOp_Half_TN,tn_14336_1731_4096,Gemm_Hipblaslt_TN_9677,0.36709
GemmTunableOp_Half_TN,tn_4096_1877_2048,Gemm_Hipblaslt_TN_9590,0.0657122
GemmTunableOp_Half_TN,tn_14336_3780_4096,Gemm_Hipblaslt_TN_9187,0.752659
GemmTunableOp_Half_TN,tn_14336_256_4096,Gemm_Rocblas_621294514,0.0680937
GemmTunableOp_Half_TN,tn_4096_176_2048,Gemm_Rocblas_621294168,0.0129213
GemmTunableOp_Half_TN,tn_3072_112_4096,Gemm_Rocblas_621294166,0.0149764
GemmTunableOp_Half_TN,tn_3072_1863_4096,Gemm_Hipblaslt_TN_9561,0.0944298
GemmTunableOp_Half_TN,tn_4096_3514_2048,Gemm_Hipblaslt_TN_9683,0.105128
GemmTunableOp_Half_TN,tn_14336_216_4096,Gemm_Rocblas_621286478,0.0649438
GemmTunableOp_Half_TN,tn_14336_7225_4096,Gemm_Hipblaslt_TN_9683,1.4378
GemmStridedBatchedTunableOp_Half_TN,tn_1647_1647_128_B_16,Gemm_Rocblas_621294754,0.0682417
GemmStridedBatchedTunableOp_Half_TN,tn_1670_1670_128_B_16,Gemm_Rocblas_621286510,0.0687606
GemmStridedBatchedTunableOp_Half_TN,tn_1612_1612_128_B_16,Gemm_Rocblas_621294650,0.0662064
GemmStridedBatchedTunableOp_Half_TN,tn_1748_1748_128_B_16,Gemm_Rocblas_621294109,0.0729203
GemmStridedBatchedTunableOp_Half_TN,tn_1635_1635_128_B_16,Gemm_Rocblas_621294754,0.0661799
GemmStridedBatchedTunableOp_Half_TN,tn_1594_1594_128_B_16,Gemm_Rocblas_621294754,0.0649102
GemmStridedBatchedTunableOp_Half_TN,tn_1974_1974_128_B_16,Gemm_Rocblas_621294533,0.0883555
GemmStridedBatchedTunableOp_Half_TN,tn_1764_1764_128_B_16,Gemm_Hipblaslt_TN_6929,0.0734918
GemmStridedBatchedTunableOp_Half_TN,tn_1681_1681_128_B_16,Gemm_Rocblas_621294754,0.0694435
GemmStridedBatchedTunableOp_Half_TN,tn_1775_1775_128_B_16,Gemm_Rocblas_621286808,0.0752126
GemmStridedBatchedTunableOp_Half_TN,tn_1805_1805_128_B_16,Gemm_Hipblaslt_TN_6929,0.0788501
GemmStridedBatchedTunableOp_Half_TN,tn_1623_1623_128_B_16,Gemm_Hipblaslt_TN_7483,0.0642647
GemmStridedBatchedTunableOp_Half_TN,tn_1655_1655_128_B_16,Gemm_Hipblaslt_TN_7483,0.0655622
GemmStridedBatchedTunableOp_Half_TN,tn_1816_1816_128_B_16,Gemm_Hipblaslt_TN_150,0.0728896
GemmStridedBatchedTunableOp_Half_TN,tn_1937_1937_128_B_16,Gemm_Rocblas_621286807,0.0890397
GemmStridedBatchedTunableOp_Half_TN,tn_1905_1905_128_B_16,Gemm_Hipblaslt_TN_6942,0.0836144
GemmStridedBatchedTunableOp_Half_TN,tn_1785_1785_128_B_16,Gemm_Hipblaslt_TN_7483,0.0762072
GemmStridedBatchedTunableOp_Half_TN,tn_1935_1935_128_B_16,Gemm_Hipblaslt_TN_6929,0.0851483
GemmStridedBatchedTunableOp_Half_TN,tn_1712_1712_128_B_16,Gemm_Rocblas_621294110,0.0652749
GemmStridedBatchedTunableOp_Half_TN,tn_1953_1953_128_B_16,Gemm_Hipblaslt_TN_6867,0.0874713
GemmStridedBatchedTunableOp_Half_TN,tn_1633_1633_128_B_16,Gemm_Hipblaslt_TN_7483,0.0660806
GemmStridedBatchedTunableOp_Half_TN,tn_1627_1627_128_B_16,Gemm_Rocblas_621294109,0.0663035
GemmStridedBatchedTunableOp_Half_TN,tn_1855_1855_128_B_16,Gemm_Hipblaslt_TN_6942,0.0811962
GemmStridedBatchedTunableOp_Half_TN,tn_1910_1910_128_B_16,Gemm_Hipblaslt_TN_6942,0.0834055
GemmStridedBatchedTunableOp_Half_TN,tn_1843_1843_128_B_16,Gemm_Hipblaslt_TN_6942,0.0811548
GemmStridedBatchedTunableOp_Half_TN,tn_1949_1949_128_B_16,Gemm_Hipblaslt_TN_6879,0.0866251
GemmStridedBatchedTunableOp_Half_TN,tn_1791_1791_128_B_16,Gemm_Rocblas_621294725,0.0763749
GemmStridedBatchedTunableOp_Half_TN,tn_1778_1778_128_B_16,Gemm_Rocblas_621286807,0.0753757
GemmStridedBatchedTunableOp_Half_TN,tn_1686_1686_128_B_16,Gemm_Rocblas_621286413,0.0684398
GemmStridedBatchedTunableOp_Half_TN,tn_1740_1740_128_B_16,Gemm_Rocblas_621286413,0.0711935
GemmStridedBatchedTunableOp_Half_TN,tn_1845_1845_128_B_16,Gemm_Hipblaslt_TN_6942,0.0803166
GemmStridedBatchedTunableOp_Half_TN,tn_1749_1749_128_B_16,Gemm_Rocblas_621294013,0.0742038
GemmStridedBatchedTunableOp_Half_TN,tn_1815_1815_128_B_16,Gemm_Hipblaslt_TN_6929,0.0781551
GemmStridedBatchedTunableOp_Half_TN,tn_1673_1673_128_B_16,Gemm_Rocblas_621294754,0.0691648
GemmStridedBatchedTunableOp_Half_TN,tn_1938_1938_128_B_16,Gemm_Rocblas_621294533,0.0860336
GemmStridedBatchedTunableOp_Half_TN,tn_1690_1690_128_B_16,Gemm_Rocblas_621294754,0.0680465
GemmStridedBatchedTunableOp_Half_TN,tn_1646_1646_128_B_16,Gemm_Rocblas_621286776,0.0673489
GemmStridedBatchedTunableOp_Half_TN,tn_1971_1971_128_B_16,Gemm_Hipblaslt_TN_6929,0.0872682
GemmStridedBatchedTunableOp_Half_TN,tn_1573_1573_128_B_16,Gemm_Hipblaslt_TN_7483,0.0624287
GemmStridedBatchedTunableOp_Half_TN,tn_1603_1603_128_B_16,Gemm_Rocblas_621286775,0.0663154
GemmStridedBatchedTunableOp_Half_TN,tn_1945_1945_128_B_16,Gemm_Hipblaslt_TN_6929,0.0859441
GemmStridedBatchedTunableOp_Half_TN,tn_1784_1784_128_B_16,Gemm_Hipblaslt_TN_149,0.0729668
GemmStridedBatchedTunableOp_Half_TN,tn_1708_1708_128_B_16,Gemm_Rocblas_621286413,0.0688953
GemmStridedBatchedTunableOp_Half_TN,tn_1668_1668_128_B_16,Gemm_Rocblas_621294110,0.0676421
GemmStridedBatchedTunableOp_Half_TN,tn_1838_1838_128_B_16,Gemm_Hipblaslt_TN_6942,0.0797118
GemmStridedBatchedTunableOp_Half_TN,tn_1777_1777_128_B_16,Gemm_Hipblaslt_TN_7483,0.0757219
GemmStridedBatchedTunableOp_Half_TN,tn_1922_1922_128_B_16,Gemm_Rocblas_621294533,0.0856001
GemmStridedBatchedTunableOp_Half_TN,tn_1967_1967_128_B_16,Gemm_Hipblaslt_TN_6867,0.0874265
GemmStridedBatchedTunableOp_Half_TN,tn_1856_1856_128_B_16,Gemm_Hipblaslt_TN_150,0.0729885
GemmStridedBatchedTunableOp_Half_TN,tn_1942_1942_128_B_16,Gemm_Hipblaslt_TN_6929,0.084449
GemmStridedBatchedTunableOp_Half_TN,tn_1724_1724_128_B_16,Gemm_Rocblas_621286413,0.0702564
GemmStridedBatchedTunableOp_Half_TN,tn_1593_1593_128_B_16,Gemm_Rocblas_621294109,0.0657041
GemmStridedBatchedTunableOp_Half_TN,tn_1839_1839_128_B_16,Gemm_Hipblaslt_TN_6942,0.0796007
GemmStridedBatchedTunableOp_Half_TN,tn_1846_1846_128_B_16,Gemm_Hipblaslt_TN_6942,0.0798255
GemmStridedBatchedTunableOp_Half_TN,tn_1790_1790_128_B_16,Gemm_Rocblas_621294516,0.0750454
GemmStridedBatchedTunableOp_Half_TN,tn_1650_1650_128_B_16,Gemm_Rocblas_621286397,0.0675415
GemmStridedBatchedTunableOp_Half_TN,tn_1652_1652_128_B_16,Gemm_Rocblas_621294517,0.0667121
GemmStridedBatchedTunableOp_Half_TN,tn_1699_1699_128_B_16,Gemm_Rocblas_621286413,0.0700604
GemmStridedBatchedTunableOp_Half_TN,tn_1964_1964_128_B_16,Gemm_Rocblas_621294533,0.0865004
GemmStridedBatchedTunableOp_Half_TN,tn_1676_1676_128_B_16,Gemm_Rocblas_621286413,0.0669964
GemmStridedBatchedTunableOp_Half_TN,tn_1707_1707_128_B_16,Gemm_Rocblas_621286413,0.0688131
GemmStridedBatchedTunableOp_Half_TN,tn_1621_1621_128_B_16,Gemm_Rocblas_621286775,0.0671285
GemmStridedBatchedTunableOp_Half_TN,tn_1675_1675_128_B_16,Gemm_Hipblaslt_TN_6879,0.0704285
GemmStridedBatchedTunableOp_Half_TN,tn_1889_1889_128_B_16,Gemm_Hipblaslt_TN_6942,0.0828931
GemmStridedBatchedTunableOp_Half_TN,tn_1844_1844_128_B_16,Gemm_Hipblaslt_TN_6929,0.0787228
GemmStridedBatchedTunableOp_Half_TN,tn_1872_1872_128_B_16,Gemm_Hipblaslt_TN_150,0.0731976
GemmStridedBatchedTunableOp_Half_TN,tn_1585_1585_128_B_16,Gemm_Rocblas_621294109,0.0645683
GemmStridedBatchedTunableOp_Half_TN,tn_1943_1943_128_B_16,Gemm_Rocblas_621294533,0.0883179
GemmStridedBatchedTunableOp_Half_TN,tn_1828_1828_128_B_16,Gemm_Rocblas_621294110,0.0785177
GemmStridedBatchedTunableOp_Half_TN,tn_1611_1611_128_B_16,Gemm_Rocblas_621294635,0.065758
GemmStridedBatchedTunableOp_Half_TN,tn_16_16_128_B_32,Default,0.00633588
GemmStridedBatchedTunableOp_Half_TN,tn_1771_1771_128_B_16,Gemm_Hipblaslt_TN_6929,0.0740362
GemmStridedBatchedTunableOp_Half_TN,tn_1806_1806_128_B_16,Gemm_Rocblas_621294754,0.0764462
GemmStridedBatchedTunableOp_Half_TN,tn_1719_1719_128_B_16,Gemm_Rocblas_621286413,0.0712775
GemmStridedBatchedTunableOp_Half_TN,tn_1710_1710_128_B_16,Gemm_Rocblas_621294110,0.0708413
GemmStridedBatchedTunableOp_Half_TN,tn_1645_1645_128_B_16,Gemm_Rocblas_621294725,0.067508
GemmStridedBatchedTunableOp_Half_TN,tn_1973_1973_128_B_16,Gemm_Hipblaslt_TN_6867,0.0885857
GemmStridedBatchedTunableOp_Half_TN,tn_1774_1774_128_B_16,Gemm_Rocblas_621294013,0.0756914
GemmStridedBatchedTunableOp_Half_TN,tn_1865_1865_128_B_16,Gemm_Hipblaslt_TN_6942,0.0819488
GemmStridedBatchedTunableOp_Half_TN,tn_1836_1836_128_B_16,Gemm_Rocblas_621294110,0.0795432
GemmStridedBatchedTunableOp_Half_TN,tn_1847_1847_128_B_16,Gemm_Hipblaslt_TN_6942,0.0808935
GemmStridedBatchedTunableOp_Half_TN,tn_1924_1924_128_B_16,Gemm_Hipblaslt_TN_6929,0.0840502
GemmStridedBatchedTunableOp_Half_TN,tn_1833_1833_128_B_16,Gemm_Rocblas_621286413,0.0802914
GemmStridedBatchedTunableOp_Half_TN,tn_1917_1917_128_B_16,Gemm_Hipblaslt_TN_6942,0.0841165
GemmStridedBatchedTunableOp_Half_TN,tn_1972_1972_128_B_16,Gemm_Hipblaslt_TN_6867,0.0869135
GemmStridedBatchedTunableOp_Half_TN,tn_1853_1853_128_B_16,Gemm_Hipblaslt_TN_6942,0.0813356
GemmStridedBatchedTunableOp_Half_TN,tn_1727_1727_128_B_16,Gemm_Hipblaslt_TN_7483,0.0711376
GemmStridedBatchedTunableOp_Half_TN,tn_1848_1848_128_B_16,Gemm_Hipblaslt_TN_150,0.0753565
GemmStridedBatchedTunableOp_Half_TN,tn_1792_1792_128_B_16,Gemm_Rocblas_621286612,0.0529038
GemmStridedBatchedTunableOp_Half_TN,tn_1904_1904_128_B_16,Gemm_Hipblaslt_TN_150,0.0770847
GemmStridedBatchedTunableOp_Half_TN,tn_1597_1597_128_B_16,Gemm_Rocblas_621286775,0.0653404
GemmStridedBatchedTunableOp_Half_TN,tn_1859_1859_128_B_16,Gemm_Hipblaslt_TN_7483,0.0812609
GemmStridedBatchedTunableOp_Half_TN,tn_1684_1684_128_B_16,Gemm_Rocblas_621286413,0.0673536
GemmStridedBatchedTunableOp_Half_TN,tn_1950_1950_128_B_16,Gemm_Hipblaslt_TN_6867,0.0867595
GemmStridedBatchedTunableOp_Half_TN,tn_1614_1614_128_B_16,Gemm_Rocblas_621294725,0.0655875
GemmStridedBatchedTunableOp_Half_TN,tn_1780_1780_128_B_16,Gemm_Hipblaslt_TN_7483,0.0721413
GemmStridedBatchedTunableOp_Half_TN,tn_1723_1723_128_B_16,Gemm_Rocblas_621286413,0.070658
GemmStridedBatchedTunableOp_Half_TN,tn_1629_1629_128_B_16,Gemm_Hipblaslt_TN_7483,0.0649726
GemmStridedBatchedTunableOp_Half_TN,tn_1695_1695_128_B_16,Gemm_Rocblas_621294110,0.0694966
GemmStridedBatchedTunableOp_Half_TN,tn_1900_1900_128_B_16,Gemm_Hipblaslt_TN_6942,0.081736
GemmStridedBatchedTunableOp_Half_TN,tn_1871_1871_128_B_16,Gemm_Hipblaslt_TN_6929,0.0813607
GemmStridedBatchedTunableOp_Half_TN,tn_1902_1902_128_B_16,Gemm_Hipblaslt_TN_7483,0.0820032
GemmStridedBatchedTunableOp_Half_TN,tn_1622_1622_128_B_16,Gemm_Hipblaslt_TN_7483,0.0654009
GemmStridedBatchedTunableOp_Half_TN,tn_1731_1731_128_B_16,Gemm_Rocblas_621286413,0.0734647
GemmStridedBatchedTunableOp_Half_TN,tn_1664_1664_128_B_16,Gemm_Rocblas_621286509,0.0502647
GemmStridedBatchedTunableOp_Half_TN,tn_1979_1979_128_B_16,Gemm_Hipblaslt_TN_6867,0.0878348
GemmStridedBatchedTunableOp_Half_TN,tn_1767_1767_128_B_16,Gemm_Hipblaslt_TN_7483,0.0747974
GemmStridedBatchedTunableOp_Half_TN,tn_1761_1761_128_B_16,Gemm_Hipblaslt_TN_7483,0.0731487
GemmStridedBatchedTunableOp_Half_TN,tn_1659_1659_128_B_16,Gemm_Rocblas_621286776,0.0687014
GemmStridedBatchedTunableOp_Half_TN,tn_1822_1822_128_B_16,Gemm_Rocblas_621294110,0.0785479
GemmStridedBatchedTunableOp_Half_TN,tn_1898_1898_128_B_16,Gemm_Hipblaslt_TN_6942,0.0823378
GemmStridedBatchedTunableOp_Half_TN,tn_1824_1824_128_B_16,Gemm_Rocblas_621286807,0.0708642
GemmStridedBatchedTunableOp_Half_TN,tn_1884_1884_128_B_16,Gemm_Hipblaslt_TN_6942,0.0815445
GemmStridedBatchedTunableOp_Half_TN,tn_1689_1689_128_B_16,Gemm_Rocblas_621294702,0.0702832
GemmStridedBatchedTunableOp_Half_TN,tn_1821_1821_128_B_16,Gemm_Hipblaslt_TN_6942,0.0795254
GemmStridedBatchedTunableOp_Half_TN,tn_1977_1977_128_B_16,Gemm_Hipblaslt_TN_6929,0.0867715
GemmStridedBatchedTunableOp_Half_TN,tn_1580_1580_128_B_16,Gemm_Rocblas_621294517,0.0626588
GemmStridedBatchedTunableOp_Half_TN,tn_1948_1948_128_B_16,Gemm_Hipblaslt_TN_6867,0.0850064
GemmStridedBatchedTunableOp_Half_TN,tn_1682_1682_128_B_16,Gemm_Rocblas_621294110,0.0685689
GemmStridedBatchedTunableOp_Half_TN,tn_1694_1694_128_B_16,Gemm_Rocblas_621294110,0.068689
GemmStridedBatchedTunableOp_Half_TN,tn_1613_1613_128_B_16,Gemm_Rocblas_621294517,0.0654795
GemmStridedBatchedTunableOp_Half_TN,tn_1619_1619_128_B_16,Gemm_Hipblaslt_TN_7483,0.0654665
GemmStridedBatchedTunableOp_Half_TN,tn_1835_1835_128_B_16,Gemm_Hipblaslt_TN_6942,0.0800657
GemmStridedBatchedTunableOp_Half_TN,tn_1706_1706_128_B_16,Gemm_Rocblas_621286413,0.0696454
GemmStridedBatchedTunableOp_Half_TN,tn_1642_1642_128_B_16,Gemm_Hipblaslt_TN_7483,0.0648963
GemmStridedBatchedTunableOp_Half_TN,tn_1591_1591_128_B_16,Gemm_Hipblaslt_TN_7483,0.063321
GemmStridedBatchedTunableOp_Half_TN,tn_1741_1741_128_B_16,Gemm_Rocblas_621286775,0.0722952
GemmStridedBatchedTunableOp_Half_TN,tn_1813_1813_128_B_16,Gemm_Rocblas_621294754,0.0792355
GemmStridedBatchedTunableOp_Half_TN,tn_1890_1890_128_B_16,Gemm_Hipblaslt_TN_6942,0.0816644
GemmStridedBatchedTunableOp_Half_TN,tn_1654_1654_128_B_16,Gemm_Hipblaslt_TN_7483,0.0645925
GemmStridedBatchedTunableOp_Half_TN,tn_1754_1754_128_B_16,Gemm_Rocblas_621286413,0.0734266
GemmStridedBatchedTunableOp_Half_TN,tn_1892_1892_128_B_16,Gemm_Hipblaslt_TN_6942,0.0804497
GemmStridedBatchedTunableOp_Half_TN,tn_1834_1834_128_B_16,Gemm_Hipblaslt_TN_6942,0.0796327
GemmStridedBatchedTunableOp_Half_TN,tn_1887_1887_128_B_16,Gemm_Hipblaslt_TN_6942,0.0829149
GemmStridedBatchedTunableOp_Half_TN,tn_1718_1718_128_B_16,Gemm_Rocblas_621286413,0.069758
GemmStridedBatchedTunableOp_Half_TN,tn_1842_1842_128_B_16,Gemm_Hipblaslt_TN_6942,0.0799548
GemmStridedBatchedTunableOp_Half_TN,tn_1628_1628_128_B_16,Gemm_Rocblas_621294725,0.0654907
GemmStridedBatchedTunableOp_Half_TN,tn_1909_1909_128_B_16,Gemm_Hipblaslt_TN_6942,0.0831809
GemmStridedBatchedTunableOp_Half_TN,tn_1625_1625_128_B_16,Gemm_Rocblas_621294635,0.0654899
GemmStridedBatchedTunableOp_Half_TN,tn_1666_1666_128_B_16,Gemm_Rocblas_621294249,0.068631
GemmStridedBatchedTunableOp_Half_TN,tn_1820_1820_128_B_16,Gemm_Rocblas_621294110,0.0775666
GemmStridedBatchedTunableOp_Half_TN,tn_1819_1819_128_B_16,Gemm_Hipblaslt_TN_7483,0.0795484
GemmStridedBatchedTunableOp_Half_TN,tn_1669_1669_128_B_16,Gemm_Rocblas_621286413,0.0684706
GemmStridedBatchedTunableOp_Half_TN,tn_1908_1908_128_B_16,Gemm_Hipblaslt_TN_6942,0.0821561
GemmStridedBatchedTunableOp_Half_TN,tn_1983_1983_128_B_16,Gemm_Hipblaslt_TN_6929,0.0871555
GemmStridedBatchedTunableOp_Half_TN,tn_1811_1811_128_B_16,Gemm_Hipblaslt_TN_6942,0.0792992
GemmStridedBatchedTunableOp_Half_TN,tn_1729_1729_128_B_16,Gemm_Rocblas_621286413,0.0720057
GemmStridedBatchedTunableOp_Half_TN,tn_1626_1626_128_B_16,Gemm_Hipblaslt_TN_7483,0.0657518
GemmStridedBatchedTunableOp_Half_TN,tn_1914_1914_128_B_16,Gemm_Hipblaslt_TN_6942,0.0827748
GemmStridedBatchedTunableOp_Half_TN,tn_1965_1965_128_B_16,Gemm_Rocblas_621294533,0.0882858
GemmStridedBatchedTunableOp_Half_TN,tn_1951_1951_128_B_16,Gemm_Hipblaslt_TN_7483,0.0877777
GemmStridedBatchedTunableOp_Half_TN,tn_1742_1742_128_B_16,Gemm_Hipblaslt_TN_7483,0.0713455
GemmStridedBatchedTunableOp_Half_TN,tn_1799_1799_128_B_16,Gemm_Hipblaslt_TN_6942,0.0786669
GemmStridedBatchedTunableOp_Half_TN,tn_1608_1608_128_B_16,Gemm_Hipblaslt_TN_149,0.0632427
GemmStridedBatchedTunableOp_Half_TN,tn_1860_1860_128_B_16,Gemm_Hipblaslt_TN_6942,0.0804957
GemmStridedBatchedTunableOp_Half_TN,tn_1976_1976_128_B_16,Gemm_Hipblaslt_TN_150,0.0788772
GemmStridedBatchedTunableOp_Half_TN,tn_1696_1696_128_B_16,Gemm_Rocblas_621286638,0.0632358
GemmStridedBatchedTunableOp_Half_TN,tn_1715_1715_128_B_16,Gemm_Rocblas_621294754,0.0692014
GemmStridedBatchedTunableOp_Half_TN,tn_1981_1981_128_B_16,Gemm_Rocblas_621294533,0.0887168
GemmStridedBatchedTunableOp_Half_TN,tn_1830_1830_128_B_16,Gemm_Hipblaslt_TN_6942,0.0792942
GemmStridedBatchedTunableOp_Half_TN,tn_1631_1631_128_B_16,Gemm_Rocblas_621294725,0.0648578
GemmStridedBatchedTunableOp_Half_TN,tn_1954_1954_128_B_16,Gemm_Hipblaslt_TN_6879,0.085041
GemmStridedBatchedTunableOp_Half_TN,tn_1598_1598_128_B_16,Gemm_Hipblaslt_TN_7483,0.0628889
GemmStridedBatchedTunableOp_Half_TN,tn_1854_1854_128_B_16,Gemm_Hipblaslt_TN_6942,0.0805315
GemmStridedBatchedTunableOp_Half_TN,tn_1941_1941_128_B_16,Gemm_Hipblaslt_TN_7519,0.0855749
GemmStridedBatchedTunableOp_Half_TN,tn_1589_1589_128_B_16,Gemm_Hipblaslt_TN_7483,0.0641078
GemmStridedBatchedTunableOp_Half_TN,tn_1660_1660_128_B_16,Gemm_Rocblas_621294518,0.0668324
GemmStridedBatchedTunableOp_Half_TN,tn_1786_1786_128_B_16,Gemm_Hipblaslt_TN_7483,0.0733093
GemmStridedBatchedTunableOp_Half_TN,tn_1738_1738_128_B_16,Gemm_Rocblas_621286413,0.072119
GemmStridedBatchedTunableOp_Half_TN,tn_1705_1705_128_B_16,Gemm_Rocblas_621286413,0.0700923
GemmStridedBatchedTunableOp_Half_TN,tn_1886_1886_128_B_16,Gemm_Hipblaslt_TN_6942,0.0820397
GemmStridedBatchedTunableOp_Half_TN,tn_1826_1826_128_B_16,Gemm_Hipblaslt_TN_6942,0.0791873
GemmStridedBatchedTunableOp_Half_TN,tn_1787_1787_128_B_16,Gemm_Hipblaslt_TN_7483,0.0747095
GemmStridedBatchedTunableOp_Half_TN,tn_1881_1881_128_B_16,Gemm_Hipblaslt_TN_6942,0.082415
GemmStridedBatchedTunableOp_Half_TN,tn_1637_1637_128_B_16,Gemm_Rocblas_621286775,0.0668167
GemmStridedBatchedTunableOp_Half_TN,tn_1851_1851_128_B_16,Gemm_Hipblaslt_TN_6942,0.0806089
GemmStridedBatchedTunableOp_Half_TN,tn_1630_1630_128_B_16,Gemm_Hipblaslt_TN_7483,0.0619227
GemmStridedBatchedTunableOp_Half_TN,tn_1577_1577_128_B_16,Gemm_Hipblaslt_TN_7483,0.0623821
GemmStridedBatchedTunableOp_Half_TN,tn_1911_1911_128_B_16,Gemm_Hipblaslt_TN_6942,0.0831322
GemmStridedBatchedTunableOp_Half_TN,tn_1714_1714_128_B_16,Gemm_Rocblas_621294110,0.0702841
GemmStridedBatchedTunableOp_Half_TN,tn_1674_1674_128_B_16,Gemm_Rocblas_621286413,0.0676854
GemmStridedBatchedTunableOp_Half_TN,tn_1776_1776_128_B_16,Gemm_Rocblas_621294109,0.0691579
GemmStridedBatchedTunableOp_Half_TN,tn_1739_1739_128_B_16,Gemm_Hipblaslt_TN_7483,0.0728844
GemmStridedBatchedTunableOp_Half_TN,tn_1704_1704_128_B_16,Gemm_Hipblaslt_TN_7483,0.0672072
GemmStridedBatchedTunableOp_Half_TN,tn_1857_1857_128_B_16,Gemm_Hipblaslt_TN_6942,0.0810774
GemmStridedBatchedTunableOp_Half_TN,tn_1698_1698_128_B_16,Gemm_Rocblas_621286413,0.0704794
GemmStridedBatchedTunableOp_Half_TN,tn_1894_1894_128_B_16,Gemm_Hipblaslt_TN_6942,0.0820969
GemmStridedBatchedTunableOp_Half_TN,tn_1868_1868_128_B_16,Gemm_Hipblaslt_TN_6942,0.0803228
GemmStridedBatchedTunableOp_Half_TN,tn_1685_1685_128_B_16,Gemm_Rocblas_621294110,0.0692845
GemmStridedBatchedTunableOp_Half_TN,tn_1620_1620_128_B_16,Gemm_Hipblaslt_TN_7483,0.0651077
GemmTunableOp_Half_TN,tn_3072_6979_4096,Gemm_Hipblaslt_TN_9681,0.305578
GemmTunableOp_Half_TN,tn_14336_1703_4096,Gemm_Hipblaslt_TN_9697,0.35722
GemmTunableOp_Half_TN,tn_4096_1790_7168,Gemm_Hipblaslt_TN_9267,0.201934
GemmTunableOp_Half_TN,tn_4096_5089_7168,Gemm_Hipblaslt_TN_9681,0.532996
GemmTunableOp_Half_TN,tn_4096_3309_7168,Gemm_Hipblaslt_TN_9677,0.330581
GemmTunableOp_Half_TN,tn_4096_5605_7168,Gemm_Hipblaslt_TN_9690,0.569698
GemmTunableOp_Half_TN,tn_14336_6979_4096,Gemm_Hipblaslt_TN_9888,1.33291
GemmTunableOp_Half_TN,tn_4096_1680_2048,Gemm_Hipblaslt_TN_9607,0.057209
GemmTunableOp_Half_TN,tn_4096_1794_7168,Gemm_Hipblaslt_TN_9136,0.202753
GemmTunableOp_Half_TN,tn_4096_1731_7168,Gemm_Hipblaslt_TN_9673,0.19728
GemmTunableOp_Half_TN,tn_3072_5157_4096,Gemm_Hipblaslt_TN_9920,0.215151
GemmTunableOp_Half_TN,tn_14336_1801_4096,Gemm_Hipblaslt_TN_9697,0.369316
GemmTunableOp_Half_TN,tn_4096_1801_2048,Gemm_Hipblaslt_TN_9590,0.0625359
GemmTunableOp_Half_TN,tn_64128_123_4096,Gemm_Rocblas_621294762,0.198065
GemmTunableOp_Half_TN,tn_3072_1804_4096,Gemm_Hipblaslt_TN_9561,0.0925944
GemmTunableOp_Half_TN,tn_14336_7386_4096,Gemm_Hipblaslt_TN_9900,1.44584
GemmTunableOp_Half_TN,tn_14336_1627_4096,Gemm_Hipblaslt_TN_9677,0.354412
GemmTunableOp_Half_TN,tn_3072_3710_4096,Gemm_Hipblaslt_TN_9852,0.165763
GemmTunableOp_Half_TN,tn_64128_10_4096,Gemm_Rocblas_621286348,0.142731
GemmTunableOp_Half_TN,tn_4096_1742_2048,Gemm_Hipblaslt_TN_9329,0.0623673
GemmTunableOp_Half_TN,tn_4096_7120_7168,Gemm_Hipblaslt_TN_9743,0.68315
GemmTunableOp_Half_TN,tn_14336_1688_4096,Gemm_Hipblaslt_TN_9677,0.35766
GemmTunableOp_Half_TN,tn_4096_1651_7168,Gemm_Hipblaslt_TN_9587,0.182513
GemmTunableOp_Half_TN,tn_3072_1646_4096,Gemm_Hipblaslt_TN_9561,0.0881854
GemmTunableOp_Half_TN,tn_14336_1779_4096,Gemm_Hipblaslt_TN_9793,0.368992
GemmTunableOp_Half_TN,tn_64128_139_4096,Gemm_Hipblaslt_TN_9799,0.219203
GemmTunableOp_Half_TN,tn_4096_5427_7168,Gemm_Hipblaslt_TN_9689,0.554944
GemmTunableOp_Half_TN,tn_4096_3300_2048,Gemm_Hipblaslt_TN_9817,0.101182
GemmTunableOp_Half_TN,tn_4096_1934_7168,Gemm_Hipblaslt_TN_9645,0.212622
GemmTunableOp_Half_TN,tn_4096_6761_2048,Gemm_Hipblaslt_TN_9816,0.204659
GemmTunableOp_Half_TN,tn_4096_1810_2048,Gemm_Hipblaslt_TN_9136,0.0627683
GemmTunableOp_Half_TN,tn_4096_1667_7168,Gemm_Hipblaslt_TN_9164,0.184842
GemmTunableOp_Half_TN,tn_4096_1596_7168,Gemm_Hipblaslt_TN_9587,0.182253
GemmTunableOp_Half_TN,tn_4096_3564_7168,Gemm_Hipblaslt_TN_9139,0.343301
GemmTunableOp_Half_TN,tn_4096_1896_7168,Gemm_Hipblaslt_TN_9645,0.209847
GemmTunableOp_Half_TN,tn_14336_3553_4096,Gemm_Hipblaslt_TN_9217,0.670023
GemmTunableOp_Half_TN,tn_3072_3441_4096,Gemm_Rocblas_621286753,0.153405
GemmTunableOp_Half_TN,tn_3072_3647_4096,Gemm_Hipblaslt_TN_9570,0.16064
GemmTunableOp_Half_TN,tn_4096_1846_2048,Gemm_Hipblaslt_TN_9590,0.0633693
GemmTunableOp_Half_TN,tn_4096_1774_7168,Gemm_Hipblaslt_TN_9134,0.200431
GemmTunableOp_Half_TN,tn_14336_1622_4096,Gemm_Hipblaslt_TN_9677,0.351218
GemmTunableOp_Half_TN,tn_14336_1668_4096,Gemm_Hipblaslt_TN_9793,0.358331
GemmTunableOp_Half_TN,tn_4096_3494_2048,Gemm_Hipblaslt_TN_9695,0.101565
GemmTunableOp_Half_TN,tn_4096_1592_7168,Gemm_Hipblaslt_TN_9587,0.181422
GemmTunableOp_Half_TN,tn_4096_3597_2048,Gemm_Hipblaslt_TN_9683,0.105178
GemmTunableOp_Half_TN,tn_14336_5357_4096,Gemm_Hipblaslt_TN_9220,1.04744
GemmTunableOp_Half_TN,tn_3072_7186_4096,Gemm_Hipblaslt_TN_9681,0.312943
GemmTunableOp_Half_TN,tn_3072_1710_4096,Gemm_Hipblaslt_TN_9561,0.0881533
GemmTunableOp_Half_TN,tn_14336_5068_4096,Gemm_Hipblaslt_TN_9677,0.984184
GemmTunableOp_Half_TN,tn_3072_1749_4096,Gemm_Hipblaslt_TN_9613,0.0914718
GemmTunableOp_Half_TN,tn_14336_3722_4096,Gemm_Hipblaslt_TN_9677,0.746751
GemmTunableOp_Half_TN,tn_3072_3722_4096,Gemm_Hipblaslt_TN_9852,0.16481
GemmTunableOp_Half_TN,tn_3072_3602_4096,Gemm_Hipblaslt_TN_9619,0.158904
GemmTunableOp_Half_TN,tn_4096_3497_2048,Gemm_Hipblaslt_TN_9684,0.10298
GemmTunableOp_Half_TN,tn_14336_5196_4096,Gemm_Rocblas_621294492,1.03826
GemmTunableOp_Half_TN,tn_14336_3767_4096,Gemm_Hipblaslt_TN_9677,0.750623
GemmTunableOp_Half_TN,tn_4096_1707_2048,Gemm_Hipblaslt_TN_9671,0.0591909
GemmTunableOp_Half_TN,tn_4096_3574_7168,Gemm_Hipblaslt_TN_9677,0.340491
GemmTunableOp_Half_TN,tn_4096_6800_2048,Gemm_Hipblaslt_TN_9743,0.202919
GemmTunableOp_Half_TN,tn_14336_1894_4096,Gemm_Hipblaslt_TN_9697,0.376319
GemmTunableOp_Half_TN,tn_4096_1936_2048,Gemm_Hipblaslt_TN_9174,0.0657349
GemmTunableOp_Half_TN,tn_4096_3666_2048,Gemm_Hipblaslt_TN_9827,0.111736
GemmTunableOp_Half_TN,tn_4096_1607_2048,Gemm_Hipblaslt_TN_9607,0.0563326
GemmTunableOp_Half_TN,tn_14336_5570_4096,Gemm_Rocblas_621294492,1.08545
GemmTunableOp_Half_TN,tn_3072_3855_4096,Gemm_Hipblaslt_TN_9779,0.170543
GemmTunableOp_Half_TN,tn_3072_5301_4096,Gemm_Hipblaslt_TN_9710,0.215093
GemmTunableOp_Half_TN,tn_14336_1573_4096,Gemm_Hipblaslt_TN_9690,0.327673
GemmTunableOp_Half_TN,tn_4096_5319_7168,Gemm_Rocblas_621286684,0.548865
GemmTunableOp_Half_TN,tn_3072_1786_4096,Gemm_Hipblaslt_TN_9322,0.0910187
GemmTunableOp_Half_TN,tn_3072_3478_4096,Gemm_Hipblaslt_TN_7589,0.15688
GemmTunableOp_Half_TN,tn_4096_3652_2048,Gemm_Hipblaslt_TN_9215,0.113021
GemmTunableOp_Half_TN,tn_4096_6871_2048,Gemm_Hipblaslt_TN_9683,0.204879
GemmTunableOp_Half_TN,tn_3072_1960_4096,Gemm_Hipblaslt_TN_9587,0.100811
GemmTunableOp_Half_TN,tn_14336_1739_4096,Gemm_Hipblaslt_TN_9697,0.366526
GemmTunableOp_Half_TN,tn_14336_6761_4096,Gemm_Hipblaslt_TN_9815,1.32326
GemmTunableOp_Half_TN,tn_4096_7552_2048,Gemm_Rocblas_621294030,0.224602
GemmTunableOp_Half_TN,tn_3072_6773_4096,Gemm_Hipblaslt_TN_9681,0.302603
GemmTunableOp_Half_TN,tn_4096_1707_7168,Gemm_Hipblaslt_TN_9180,0.185411
GemmTunableOp_Half_TN,tn_4096_7575_7168,Gemm_Hipblaslt_TN_9869,0.724084
GemmTunableOp_Half_TN,tn_4096_3793_7168,Gemm_Hipblaslt_TN_9827,0.364451
GemmTunableOp_Half_TN,tn_4096_64_2048,Gemm_Rocblas_621286488,0.00789379
GemmTunableOp_Half_TN,tn_3072_6721_4096,Gemm_Hipblaslt_TN_9681,0.300603
GemmTunableOp_Half_TN,tn_4096_1636_2048,Gemm_Hipblaslt_TN_9616,0.0552013
GemmTunableOp_Half_TN,tn_3072_6747_4096,Gemm_Hipblaslt_TN_9688,0.30126
GemmTunableOp_Half_TN,tn_4096_6996_7168,Gemm_Hipblaslt_TN_9694,0.676398
GemmTunableOp_Half_TN,tn_4096_6996_2048,Gemm_Hipblaslt_TN_9743,0.206917
GemmTunableOp_Half_TN,tn_4096_1966_7168,Gemm_Hipblaslt_TN_9267,0.212007
GemmTunableOp_Half_TN,tn_14336_1717_4096,Gemm_Hipblaslt_TN_9682,0.358063
GemmTunableOp_Half_TN,tn_4096_3494_7168,Gemm_Hipblaslt_TN_9677,0.335378
GemmTunableOp_Half_TN,tn_3072_1823_4096,Gemm_Hipblaslt_TN_9322,0.0913299
GemmTunableOp_Half_TN,tn_3072_7130_4096,Gemm_Hipblaslt_TN_9619,0.312316
GemmTunableOp_Half_TN,tn_4096_1596_2048,Gemm_Hipblaslt_TN_9607,0.0556242
GemmTunableOp_Half_TN,tn_14336_7191_4096,Gemm_Hipblaslt_TN_9697,1.39653
GemmTunableOp_Half_TN,tn_14336_5442_4096,Gemm_Rocblas_621286750,1.0747
GemmTunableOp_Half_TN,tn_3072_5530_4096,Gemm_Hipblaslt_TN_9726,0.225074
GemmTunableOp_Half_TN,tn_4096_3630_7168,Gemm_Hipblaslt_TN_9139,0.345798
GemmTunableOp_Half_TN,tn_4096_6990_7168,Gemm_Hipblaslt_TN_9692,0.678101
GemmTunableOp_Half_TN,tn_4096_1752_2048,Gemm_Hipblaslt_TN_9645,0.0624904
GemmTunableOp_Half_TN,tn_3072_1743_4096,Gemm_Hipblaslt_TN_9163,0.0900131
GemmTunableOp_Half_TN,tn_14336_1828_4096,Gemm_Hipblaslt_TN_9192,0.37223
GemmTunableOp_Half_TN,tn_3072_1828_4096,Gemm_Hipblaslt_TN_9324,0.0937254
GemmTunableOp_Half_TN,tn_3072_5381_4096,Gemm_Hipblaslt_TN_9710,0.223142
GemmTunableOp_Half_TN,tn_4096_7047_7168,Gemm_Hipblaslt_TN_9743,0.675823
GemmTunableOp_Half_TN,tn_4096_1646_7168,Gemm_Hipblaslt_TN_9610,0.184398
GemmTunableOp_Half_TN,tn_3072_1689_4096,Gemm_Hipblaslt_TN_9561,0.087088
GemmTunableOp_Half_TN,tn_3072_5412_4096,Gemm_Hipblaslt_TN_9726,0.223553
GemmTunableOp_Half_TN,tn_14336_192_4096,Gemm_Hipblaslt_TN_9147,0.0583727
GemmTunableOp_Half_TN,tn_14336_3595_4096,Gemm_Hipblaslt_TN_9697,0.735068
GemmTunableOp_Half_TN,tn_3072_7568_4096,Gemm_Rocblas_621294473,0.332459
GemmTunableOp_Half_TN,tn_4096_6773_2048,Gemm_Hipblaslt_TN_9683,0.203245
GemmTunableOp_Half_TN,tn_4096_7067_2048,Gemm_Hipblaslt_TN_9732,0.208307
GemmTunableOp_Half_TN,tn_4096_1953_7168,Gemm_Hipblaslt_TN_9136,0.211837
GemmTunableOp_Half_TN,tn_4096_5125_7168,Gemm_Hipblaslt_TN_9681,0.529486
GemmTunableOp_Half_TN,tn_64128_253_4096,Gemm_Rocblas_621286915,0.284662
GemmTunableOp_Half_TN,tn_4096_1874_2048,Gemm_Hipblaslt_TN_9590,0.0642171
GemmTunableOp_Half_TN,tn_3072_1850_4096,Gemm_Hipblaslt_TN_9324,0.0927457
GemmTunableOp_Half_TN,tn_14336_6870_4096,Gemm_Hipblaslt_TN_9753,1.32977
GemmTunableOp_Half_TN,tn_3072_1780_4096,Gemm_Rocblas_621294520,0.0917066
GemmTunableOp_Half_TN,tn_4096_192_2048,Gemm_Rocblas_621286445,0.0130743
GemmTunableOp_Half_TN,tn_4096_5204_2048,Gemm_Hipblaslt_TN_9691,0.169383
GemmTunableOp_Half_TN,tn_14336_1673_4096,Gemm_Hipblaslt_TN_9189,0.358113
GemmTunableOp_Half_TN,tn_14336_1796_4096,Gemm_Hipblaslt_TN_9697,0.369335
GemmTunableOp_Half_TN,tn_4096_3647_2048,Gemm_Hipblaslt_TN_9896,0.105581
GemmTunableOp_Half_TN,tn_14336_5583_4096,Gemm_Rocblas_621294492,1.08574
GemmTunableOp_Half_TN,tn_3072_1778_4096,Gemm_Rocblas_621286778,0.0911532
GemmTunableOp_Half_TN,tn_4096_1855_2048,Gemm_Hipblaslt_TN_9590,0.0632473
GemmTunableOp_Half_TN,tn_3072_3219_4096,Gemm_Hipblaslt_TN_9619,0.150723
GemmTunableOp_Half_TN,tn_4096_1601_2048,Gemm_Hipblaslt_TN_9164,0.0562405
GemmTunableOp_Half_TN,tn_4096_7301_2048,Gemm_Hipblaslt_TN_9869,0.222084
GemmTunableOp_Half_TN,tn_3072_240_4096,Gemm_Rocblas_621286444,0.0232492
GemmTunableOp_Half_TN,tn_4096_3438_2048,Gemm_Hipblaslt_TN_9896,0.101626
GemmTunableOp_Half_TN,tn_4096_1908_7168,Gemm_Hipblaslt_TN_9645,0.209629
GemmTunableOp_Half_TN,tn_4096_1725_2048,Gemm_Hipblaslt_TN_9164,0.0583142
GemmTunableOp_Half_TN,tn_3072_6715_4096,Gemm_Hipblaslt_TN_9681,0.301206
GemmTunableOp_Half_TN,tn_14336_1871_4096,Gemm_Hipblaslt_TN_9697,0.37467
GemmTunableOp_Half_TN,tn_4096_5442_7168,Gemm_Rocblas_621286580,0.558659
GemmTunableOp_Half_TN,tn_4096_1890_2048,Gemm_Hipblaslt_TN_9590,0.0648134
GemmTunableOp_Half_TN,tn_14336_1840_4096,Gemm_Hipblaslt_TN_9187,0.372821
GemmTunableOp_Half_TN,tn_64128_76_4096,Gemm_Hipblaslt_TN_9058,0.176542
GemmTunableOp_Half_TN,tn_4096_7047_2048,Gemm_Hipblaslt_TN_9694,0.20483
GemmTunableOp_Half_TN,tn_4096_1772_2048,Gemm_Hipblaslt_TN_9268,0.0626794
GemmTunableOp_Half_TN,tn_3072_6990_4096,Gemm_Hipblaslt_TN_9681,0.308355
GemmTunableOp_Half_TN,tn_4096_192_7168,Gemm_Hipblaslt_TN_9470,0.0388597
GemmTunableOp_Half_TN,tn_4096_1772_7168,Gemm_Hipblaslt_TN_9680,0.201193
GemmTunableOp_Half_TN,tn_3072_7072_4096,Gemm_Hipblaslt_TN_9681,0.30921
GemmTunableOp_Half_TN,tn_64128_247_4096,Gemm_Rocblas_621294658,0.285583
GemmTunableOp_Half_TN,tn_14336_1603_4096,Gemm_Hipblaslt_TN_9697,0.352562
GemmTunableOp_Half_TN,tn_4096_216_2048,Gemm_Rocblas_621294175,0.0147464
GemmTunableOp_Half_TN,tn_4096_6789_7168,Gemm_Hipblaslt_TN_9743,0.664047
GemmTunableOp_Half_TN,tn_3072_1600_4096,Gemm_Hipblaslt_TN_9561,0.0853509
GemmTunableOp_Half_TN,tn_4096_1961_2048,Gemm_Hipblaslt_TN_9590,0.0661448
GemmTunableOp_Half_TN,tn_4096_5680_7168,Gemm_Rocblas_621286580,0.569905
GemmTunableOp_Half_TN,tn_3072_3450_4096,Gemm_Rocblas_621286753,0.153435
GemmTunableOp_Half_TN,tn_4096_7108_2048,Gemm_Hipblaslt_TN_9694,0.204924
GemmTunableOp_Half_TN,tn_3072_1967_4096,Gemm_Hipblaslt_TN_9633,0.0992604
GemmTunableOp_Half_TN,tn_4096_3589_2048,Gemm_Hipblaslt_TN_9796,0.105155
GemmTunableOp_Half_TN,tn_4096_1807_2048,Gemm_Hipblaslt_TN_9136,0.0622376
GemmTunableOp_Half_TN,tn_4096_1599_7168,Gemm_Hipblaslt_TN_9610,0.182993
GemmTunableOp_Half_TN,tn_64128_144_4096,Gemm_Hipblaslt_TN_9108,0.217839
GemmTunableOp_Half_TN,tn_3072_3645_4096,Gemm_Hipblaslt_TN_9619,0.160616
GemmTunableOp_Half_TN,tn_4096_1860_2048,Gemm_Hipblaslt_TN_9590,0.0637882
GemmTunableOp_Half_TN,tn_3072_3401_4096,Gemm_Rocblas_621294495,0.154051
GemmTunableOp_Half_TN,tn_4096_1930_2048,Gemm_Hipblaslt_TN_9620,0.0657503
GemmTunableOp_Half_TN,tn_4096_3565_7168,Gemm_Hipblaslt_TN_9743,0.343559
GemmTunableOp_Half_TN,tn_3072_1805_4096,Gemm_Rocblas_621286778,0.0915235
GemmTunableOp_Half_TN,tn_3072_1888_4096,Gemm_Hipblaslt_TN_9324,0.0927766
GemmTunableOp_Half_TN,tn_4096_120_7168,Gemm_Rocblas_621286438,0.0277745
GemmTunableOp_Half_TN,tn_4096_3515_2048,Gemm_Hipblaslt_TN_9696,0.102948
GemmTunableOp_Half_TN,tn_14336_1820_4096,Gemm_Hipblaslt_TN_9187,0.372786
GemmTunableOp_Half_TN,tn_14336_3651_4096,Gemm_Hipblaslt_TN_9677,0.741208
GemmTunableOp_Half_TN,tn_3072_1592_4096,Gemm_Hipblaslt_TN_9561,0.0849363
GemmTunableOp_Half_TN,tn_3072_1842_4096,Gemm_Hipblaslt_TN_9148,0.0930192
GemmTunableOp_Half_TN,tn_14336_5322_4096,Gemm_Hipblaslt_TN_9217,1.04539
GemmTunableOp_Half_TN,tn_4096_1590_7168,Gemm_Hipblaslt_TN_9265,0.181268
GemmTunableOp_Half_TN,tn_4096_3768_7168,Gemm_Rocblas_621286281,0.363236
GemmTunableOp_Half_TN,tn_64128_41_4096,Gemm_Hipblaslt_TN_9097,0.159546
GemmTunableOp_Half_TN,tn_4096_3388_7168,Gemm_Hipblaslt_TN_9677,0.331554
GemmTunableOp_Half_TN,tn_3072_176_4096,Gemm_Rocblas_621286436,0.0180903
GemmTunableOp_Half_TN,tn_14336_1620_4096,Gemm_Hipblaslt_TN_9793,0.355343
GemmTunableOp_Half_TN,tn_14336_3438_4096,Gemm_Hipblaslt_TN_9217,0.660081
GemmTunableOp_Half_TN,tn_4096_1655_2048,Gemm_Hipblaslt_TN_9607,0.0567728
GemmTunableOp_Half_TN,tn_4096_3780_7168,Gemm_Hipblaslt_TN_9827,0.366218
GemmTunableOp_Half_TN,tn_14336_6990_4096,Gemm_Hipblaslt_TN_9888,1.3315
GemmTunableOp_Half_TN,tn_14336_1663_4096,Gemm_Hipblaslt_TN_9677,0.356237
GemmTunableOp_Half_TN,tn_4096_1864_2048,Gemm_Hipblaslt_TN_9134,0.0635551
GemmTunableOp_Half_TN,tn_3072_1670_4096,Gemm_Hipblaslt_TN_9561,0.088515
GemmTunableOp_Half_TN,tn_14336_5273_4096,Gemm_Hipblaslt_TN_9903,1.0429
GemmTunableOp_Half_TN,tn_4096_3767_7168,Gemm_Hipblaslt_TN_9217,0.365138
GemmTunableOp_Half_TN,tn_14336_3830_4096,Gemm_Hipblaslt_TN_9677,0.754139
GemmTunableOp_Half_TN,tn_4096_1735_2048,Gemm_Hipblaslt_TN_9602,0.0628535
GemmTunableOp_Half_TN,tn_4096_72_7168,Gemm_Rocblas_621286280,0.0242682
GemmTunableOp_Half_TN,tn_3072_5498_4096,Gemm_Hipblaslt_TN_9726,0.224934
GemmTunableOp_Half_TN,tn_14336_1824_4096,Gemm_Hipblaslt_TN_9677,0.370198
GemmTunableOp_Half_TN,tn_4096_1633_2048,Gemm_Hipblaslt_TN_9164,0.0566162
GemmTunableOp_Half_TN,tn_3072_1892_4096,Gemm_Hipblaslt_TN_9324,0.0946905
GemmTunableOp_Half_TN,tn_4096_5352_7168,Gemm_Rocblas_621286684,0.551117
GemmTunableOp_Half_TN,tn_4096_3559_7168,Gemm_Hipblaslt_TN_9697,0.344094
GemmTunableOp_Half_TN,tn_4096_3688_2048,Gemm_Hipblaslt_TN_9768,0.110989
GemmTunableOp_Half_TN,tn_4096_5498_7168,Gemm_Rocblas_621286684,0.561122
GemmTunableOp_Half_TN,tn_4096_1684_2048,Gemm_Hipblaslt_TN_9164,0.0594217
GemmTunableOp_Half_TN,tn_4096_7093_7168,Gemm_Hipblaslt_TN_9694,0.677241
GemmTunableOp_Half_TN,tn_14336_5277_4096,Gemm_Hipblaslt_TN_9223,1.044
GemmTunableOp_Half_TN,tn_4096_6989_2048,Gemm_Hipblaslt_TN_9743,0.207264
GemmTunableOp_Half_TN,tn_4096_6976_2048,Gemm_Hipblaslt_TN_9814,0.207204
GemmTunableOp_Half_TN,tn_4096_6965_7168,Gemm_Hipblaslt_TN_9743,0.674378
GemmTunableOp_Half_TN,tn_3072_224_4096,Gemm_Rocblas_621286440,0.0227688
GemmTunableOp_Half_TN,tn_4096_3511_7168,Gemm_Hipblaslt_TN_9697,0.33973
GemmTunableOp_Half_TN,tn_3072_1707_4096,Gemm_Rocblas_621294520,0.0889337
GemmTunableOp_Half_TN,tn_14336_7568_4096,Gemm_Hipblaslt_TN_9914,1.4745
GemmTunableOp_Half_TN,tn_4096_1978_2048,Gemm_Hipblaslt_TN_9174,0.0667365
GemmTunableOp_Half_TN,tn_4096_1610_7168,Gemm_Hipblaslt_TN_9265,0.182313
GemmTunableOp_Half_TN,tn_14336_1957_4096,Gemm_Hipblaslt_TN_9223,0.400927
GemmTunableOp_Half_TN,tn_4096_1628_2048,Gemm_Hipblaslt_TN_9607,0.0560323
GemmTunableOp_Half_TN,tn_64128_223_4096,Gemm_Hipblaslt_TN_9747,0.275182
GemmTunableOp_Half_TN,tn_4096_3379_7168,Gemm_Hipblaslt_TN_9682,0.333534
GemmTunableOp_Half_TN,tn_3072_3514_4096,Gemm_Rocblas_621286753,0.158143
GemmTunableOp_Half_TN,tn_3072_1627_4096,Gemm_Rocblas_621286778,0.0876461
GemmTunableOp_Half_TN,tn_4096_1689_7168,Gemm_Hipblaslt_TN_9265,0.184609
GemmTunableOp_Half_TN,tn_4096_1614_2048,Gemm_Hipblaslt_TN_9607,0.05643
GemmTunableOp_Half_TN,tn_4096_6708_2048,Gemm_Hipblaslt_TN_9743,0.200592
GemmTunableOp_Half_TN,tn_4096_1749_7168,Gemm_Hipblaslt_TN_9673,0.198056
GemmTunableOp_Half_TN,tn_5120_232_8192,Gemm_Hipblaslt_TN_9468,0.0579772
GemmTunableOp_Half_TN,tn_14336_3600_4096,Gemm_Hipblaslt_TN_9814,0.732614
GemmTunableOp_Half_TN,tn_4096_3456_7168,Gemm_Rocblas_621286743,0.334642
GemmTunableOp_Half_TN,tn_3072_7023_4096,Gemm_Hipblaslt_TN_9681,0.306383
GemmTunableOp_Half_TN,tn_3072_1936_4096,Gemm_Hipblaslt_TN_9633,0.0987173
GemmTunableOp_Half_TN,tn_3072_1807_4096,Gemm_Rocblas_621286778,0.0922738
GemmTunableOp_Half_TN,tn_4096_1825_7168,Gemm_Hipblaslt_TN_9136,0.205003
GemmTunableOp_Half_TN,tn_4096_1685_7168,Gemm_Hipblaslt_TN_9359,0.183961
GemmTunableOp_Half_TN,tn_4096_7484_2048,Gemm_Hipblaslt_TN_9704,0.224786
GemmTunableOp_Half_TN,tn_64128_243_4096,Gemm_Rocblas_621294658,0.287274
GemmTunableOp_Half_TN,tn_14336_160_4096,Gemm_Hipblaslt_TN_9312,0.0544875
GemmTunableOp_Half_TN,tn_64128_163_4096,Gemm_Hipblaslt_TN_9707,0.239957
GemmTunableOp_Half_TN,tn_4096_1787_7168,Gemm_Hipblaslt_TN_9329,0.199748
GemmTunableOp_Half_TN,tn_4096_6901_2048,Gemm_Hipblaslt_TN_9684,0.205032
GemmTunableOp_Half_TN,tn_4096_7138_2048,Gemm_Hipblaslt_TN_9731,0.210441
GemmTunableOp_Half_TN,tn_3072_1857_4096,Gemm_Hipblaslt_TN_9613,0.0937336
GemmTunableOp_Half_TN,tn_3072_1683_4096,Gemm_Hipblaslt_TN_9148,0.0894405
GemmTunableOp_Half_TN,tn_64128_116_4096,Gemm_Hipblaslt_TN_9061,0.196978
GemmTunableOp_Half_TN,tn_64128_211_4096,Gemm_Hipblaslt_TN_9185,0.273118
GemmTunableOp_Half_TN,tn_64128_65_4096,Gemm_Hipblaslt_TN_9058,0.17461
GemmTunableOp_Half_TN,tn_14336_1623_4096,Gemm_Hipblaslt_TN_9139,0.35406
GemmTunableOp_Half_TN,tn_64128_167_4096,Gemm_Hipblaslt_TN_9731,0.243992
GemmTunableOp_Half_TN,tn_4096_3309_2048,Gemm_Hipblaslt_TN_9821,0.100154
GemmTunableOp_Half_TN,tn_4096_1894_7168,Gemm_Hipblaslt_TN_9645,0.209363
GemmTunableOp_Half_TN,tn_3072_1855_4096,Gemm_Hipblaslt_TN_9148,0.0927744
GemmTunableOp_Half_TN,tn_14336_1826_4096,Gemm_Hipblaslt_TN_9677,0.371621
GemmTunableOp_Half_TN,tn_64128_186_4096,Gemm_Hipblaslt_TN_9683,0.248291
GemmTunableOp_Half_TN,tn_64128_225_4096,Gemm_Rocblas_621294658,0.284835
GemmTunableOp_Half_TN,tn_4096_7104_7168,Gemm_Rocblas_621286743,0.684021
GemmTunableOp_Half_TN,tn_14336_7067_4096,Gemm_Hipblaslt_TN_9888,1.33648
GemmTunableOp_Half_TN,tn_64128_21_4096,Gemm_Rocblas_621286348,0.145965
GemmTunableOp_Half_TN,tn_4096_1823_2048,Gemm_Hipblaslt_TN_9590,0.0620723
GemmTunableOp_Half_TN,tn_4096_96_7168,Gemm_Rocblas_621286280,0.0248716
GemmTunableOp_Half_TN,tn_64128_188_4096,Gemm_Hipblaslt_TN_9683,0.249512
GemmTunableOp_Half_TN,tn_64128_232_4096,Gemm_Rocblas_621294658,0.286954
GemmTunableOp_Half_TN,tn_4096_1799_7168,Gemm_Hipblaslt_TN_9137,0.204529
GemmTunableOp_Half_TN,tn_4096_1805_2048,Gemm_Hipblaslt_TN_9590,0.0638988
GemmTunableOp_Half_TN,tn_14336_1813_4096,Gemm_Hipblaslt_TN_9697,0.370475
GemmTunableOp_Half_TN,tn_4096_5447_2048,Gemm_Hipblaslt_TN_9709,0.172088
GemmTunableOp_Half_TN,tn_4096_6773_7168,Gemm_Hipblaslt_TN_9694,0.664804
GemmTunableOp_Half_TN,tn_4096_3706_2048,Gemm_Hipblaslt_TN_9768,0.111631
GemmTunableOp_Half_TN,tn_14336_3764_4096,Gemm_Hipblaslt_TN_9187,0.745568
GemmTunableOp_Half_TN,tn_14336_3427_4096,Gemm_Hipblaslt_TN_9220,0.656571
GemmTunableOp_Half_TN,tn_4096_184_2048,Gemm_Rocblas_621286445,0.0134559
GemmTunableOp_Half_TN,tn_14336_1854_4096,Gemm_Hipblaslt_TN_9697,0.374533
GemmTunableOp_Half_TN,tn_14336_5052_4096,Gemm_Hipblaslt_TN_9697,0.982634
GemmTunableOp_Half_TN,tn_4096_1690_7168,Gemm_Hipblaslt_TN_9265,0.184344
GemmTunableOp_Half_TN,tn_4096_3475_2048,Gemm_Hipblaslt_TN_9683,0.104229
GemmTunableOp_Half_TN,tn_64128_251_4096,Gemm_Rocblas_621286915,0.286861
GemmTunableOp_Half_TN,tn_3072_5533_4096,Gemm_Hipblaslt_TN_9710,0.22386
GemmTunableOp_Half_TN,tn_64128_114_4096,Gemm_Hipblaslt_TN_9698,0.197008
GemmTunableOp_Half_TN,tn_4096_1875_2048,Gemm_Hipblaslt_TN_9590,0.0645519
GemmTunableOp_Half_TN,tn_3072_1658_4096,Gemm_Rocblas_621294520,0.0885705
GemmTunableOp_Half_TN,tn_8192_232_4096,Gemm_Rocblas_621294207,0.0427668
GemmTunableOp_Half_TN,tn_3072_7096_4096,Gemm_Hipblaslt_TN_9619,0.308597
GemmTunableOp_Half_TN,tn_14336_3219_4096,Gemm_Rocblas_621286590,0.632483
GemmTunableOp_Half_TN,tn_14336_1643_4096,Gemm_Hipblaslt_TN_9697,0.353484
GemmTunableOp_Half_TN,tn_16000_256_8192,Gemm_Hipblaslt_TN_9583,0.165512
GemmTunableOp_Half_TN,tn_3072_6976_4096,Gemm_Hipblaslt_TN_9681,0.306538
GemmTunableOp_Half_TN,tn_64128_8_4096,Gemm_Rocblas_621286348,0.14111
GemmTunableOp_Half_TN,tn_14336_5412_4096,Gemm_Hipblaslt_TN_9217,1.06133
GemmTunableOp_Half_TN,tn_4096_3501_2048,Gemm_Hipblaslt_TN_9684,0.10593
GemmTunableOp_Half_TN,tn_4096_3547_7168,Gemm_Hipblaslt_TN_9697,0.342389
GemmTunableOp_Half_TN,tn_4096_1699_7168,Gemm_Hipblaslt_TN_9265,0.18427
GemmTunableOp_Half_TN,tn_3072_3494_4096,Gemm_Hipblaslt_TN_9774,0.156519
GemmTunableOp_Half_TN,tn_4096_224_7168,Gemm_Rocblas_621286491,0.0428868
GemmTunableOp_Half_TN,tn_4096_7439_2048,Gemm_Hipblaslt_TN_9815,0.225037
GemmTunableOp_Half_TN,tn_3072_3592_4096,Gemm_Hipblaslt_TN_9570,0.162213
GemmTunableOp_Half_TN,tn_64128_49_4096,Gemm_Hipblaslt_TN_9097,0.160303
GemmTunableOp_Half_TN,tn_4096_7344_2048,Gemm_Hipblaslt_TN_9768,0.221556
GemmTunableOp_Half_TN,tn_4096_1731_2048,Gemm_Hipblaslt_TN_9136,0.06254
GemmTunableOp_Half_TN,tn_14336_7403_4096,Gemm_Hipblaslt_TN_9914,1.47009
GemmTunableOp_Half_TN,tn_3072_3713_4096,Gemm_Hipblaslt_TN_9852,0.164573
GemmTunableOp_Half_TN,tn_8192_4000_14336,Gemm_Hipblaslt_TN_9841,1.70036
GemmTunableOp_Half_TN,tn_14336_1722_4096,Gemm_Hipblaslt_TN_9187,0.355398
GemmTunableOp_Half_TN,tn_14336_1781_4096,Gemm_Hipblaslt_TN_9697,0.369218
GemmTunableOp_Half_TN,tn_64128_97_4096,Gemm_Hipblaslt_TN_9061,0.191992
GemmTunableOp_Half_TN,tn_4096_3520_7168,Gemm_Hipblaslt_TN_9189,0.341078
GemmTunableOp_Half_TN,tn_4096_3450_7168,Gemm_Hipblaslt_TN_9677,0.335924
GemmTunableOp_Half_TN,tn_4096_5413_2048,Gemm_Hipblaslt_TN_9799,0.170947
GemmTunableOp_Half_TN,tn_4096_1743_7168,Gemm_Hipblaslt_TN_9673,0.198157
GemmTunableOp_Half_TN,tn_14336_1853_4096,Gemm_Hipblaslt_TN_9697,0.375764
GemmTunableOp_Half_TN,tn_64128_80_4096,Gemm_Hipblaslt_TN_9057,0.177916
GemmTunableOp_Half_TN,tn_3072_1779_4096,Gemm_Hipblaslt_TN_9148,0.0916148
GemmTunableOp_Half_TN,tn_14336_6871_4096,Gemm_Hipblaslt_TN_9220,1.33328
GemmTunableOp_Half_TN,tn_8192_232_14336,Gemm_Hipblaslt_TN_9575,0.135818
GemmTunableOp_Half_TN,tn_3072_1763_4096,Gemm_Hipblaslt_TN_9322,0.0912058
GemmTunableOp_Half_TN,tn_14336_3583_4096,Gemm_Hipblaslt_TN_9223,0.668535
GemmTunableOp_Half_TN,tn_3072_1691_4096,Gemm_Hipblaslt_TN_9148,0.087818
GemmTunableOp_Half_TN,tn_4096_7345_2048,Gemm_Hipblaslt_TN_9713,0.222251
GemmTunableOp_Half_TN,tn_64128_103_4096,Gemm_Hipblaslt_TN_9670,0.197004
GemmTunableOp_Half_TN,tn_4096_3557_2048,Gemm_Hipblaslt_TN_9684,0.105227
GemmTunableOp_Half_TN,tn_4096_7067_7168,Gemm_Hipblaslt_TN_9743,0.68285
GemmTunableOp_Half_TN,tn_14336_3597_4096,Gemm_Hipblaslt_TN_9187,0.730964
GemmTunableOp_Half_TN,tn_14336_7730_4096,Gemm_Hipblaslt_TN_9914,1.50278
GemmTunableOp_Half_TN,tn_3072_7021_4096,Gemm_Hipblaslt_TN_9681,0.308485
GemmTunableOp_Half_TN,tn_4096_3404_7168,Gemm_Hipblaslt_TN_9682,0.334762
GemmTunableOp_Half_TN,tn_14336_1902_4096,Gemm_Hipblaslt_TN_9139,0.377073
GemmTunableOp_Half_TN,tn_4096_1688_7168,Gemm_Hipblaslt_TN_9359,0.185901
GemmTunableOp_Half_TN,tn_14336_6920_4096,Gemm_Rocblas_621294484,1.33285
GemmTunableOp_Half_TN,tn_4096_3583_2048,Gemm_Hipblaslt_TN_9694,0.103796
GemmTunableOp_Half_TN,tn_3072_1826_4096,Gemm_Hipblaslt_TN_9148,0.0933157
GemmTunableOp_Half_TN,tn_14336_1827_4096,Gemm_Hipblaslt_TN_9697,0.372607
GemmTunableOp_Half_TN,tn_4096_3400_2048,Gemm_Hipblaslt_TN_9821,0.101502
GemmTunableOp_Half_TN,tn_3072_1748_4096,Gemm_Hipblaslt_TN_9613,0.0910451
GemmTunableOp_Half_TN,tn_3072_7170_4096,Gemm_Hipblaslt_TN_9681,0.31327
GemmTunableOp_Half_TN,tn_4096_3602_2048,Gemm_Hipblaslt_TN_9683,0.104664
GemmTunableOp_Half_TN,tn_4096_3691_7168,Gemm_Hipblaslt_TN_9223,0.361197
GemmTunableOp_Half_TN,tn_4096_7190_2048,Gemm_Hipblaslt_TN_9743,0.207993
GemmTunableOp_Half_TN,tn_14336_3574_4096,Gemm_Hipblaslt_TN_9223,0.668597
GemmTunableOp_Half_TN,tn_4096_5390_7168,Gemm_Rocblas_621286580,0.553079
GemmTunableOp_Half_TN,tn_4096_3748_7168,Gemm_Hipblaslt_TN_9815,0.364804
GemmTunableOp_Half_TN,tn_3072_1954_4096,Gemm_Hipblaslt_TN_9633,0.0992455
GemmTunableOp_Half_TN,tn_4096_3830_2048,Gemm_Hipblaslt_TN_9710,0.115283
GemmTunableOp_Half_TN,tn_4096_6965_2048,Gemm_Hipblaslt_TN_9814,0.205165
GemmTunableOp_Half_TN,tn_4096_7170_2048,Gemm_Hipblaslt_TN_9814,0.210047
GemmTunableOp_Half_TN,tn_3072_3420_4096,Gemm_Hipblaslt_TN_9681,0.152257
GemmTunableOp_Half_TN,tn_3072_1930_4096,Gemm_Hipblaslt_TN_9265,0.0998585
GemmTunableOp_Half_TN,tn_4096_1802_7168,Gemm_Hipblaslt_TN_9268,0.203223
GemmTunableOp_Half_TN,tn_3072_1708_4096,Gemm_Hipblaslt_TN_9561,0.088223
GemmTunableOp_Half_TN,tn_4096_3710_2048,Gemm_Hipblaslt_TN_9873,0.113341
GemmTunableOp_Half_TN,tn_64128_98_4096,Gemm_Hipblaslt_TN_9061,0.194092
GemmTunableOp_Half_TN,tn_4096_3383_7168,Gemm_Hipblaslt_TN_9694,0.332623
GemmTunableOp_Half_TN,tn_14336_200_4096,Gemm_Hipblaslt_TN_9634,0.0639987
GemmTunableOp_Half_TN,tn_3072_40_4096,Gemm_Rocblas_621286419,0.0106676
GemmTunableOp_Half_TN,tn_4096_1625_2048,Gemm_Hipblaslt_TN_9607,0.0562563
GemmTunableOp_Half_TN,tn_4096_1872_2048,Gemm_Hipblaslt_TN_9590,0.0640785
GemmTunableOp_Half_TN,tn_4096_1719_7168,Gemm_Hipblaslt_TN_9265,0.185486
GemmTunableOp_Half_TN,tn_4096_1963_2048,Gemm_Hipblaslt_TN_9620,0.0656509
GemmTunableOp_Half_TN,tn_14336_3514_4096,Gemm_Hipblaslt_TN_9223,0.662649
GemmTunableOp_Half_TN,tn_4096_5381_7168,Gemm_Rocblas_621286684,0.553383
GemmTunableOp_Half_TN,tn_14336_7575_4096,Gemm_Hipblaslt_TN_9903,1.48443
GemmTunableOp_Half_TN,tn_4096_1831_7168,Gemm_Hipblaslt_TN_9137,0.204251
GemmTunableOp_Half_TN,tn_4096_6744_2048,Gemm_Hipblaslt_TN_9275,0.201365
GemmTunableOp_Half_TN,tn_64128_182_4096,Gemm_Hipblaslt_TN_9862,0.245169
GemmTunableOp_Half_TN,tn_4096_1702_7168,Gemm_Hipblaslt_TN_9587,0.184499
GemmTunableOp_Half_TN,tn_4096_6843_7168,Gemm_Hipblaslt_TN_9814,0.670392
GemmTunableOp_Half_TN,tn_14336_1588_4096,Gemm_Hipblaslt_TN_9690,0.328407
GemmTunableOp_Half_TN,tn_3072_5495_4096,Gemm_Hipblaslt_TN_9726,0.2251
GemmTunableOp_Half_TN,tn_14336_1945_4096,Gemm_Hipblaslt_TN_9217,0.400121
GemmTunableOp_Half_TN,tn_64128_132_4096,Gemm_Hipblaslt_TN_9674,0.216806
GemmTunableOp_Half_TN,tn_64128_130_4096,Gemm_Hipblaslt_TN_9799,0.215853
GemmTunableOp_Half_TN,tn_14336_1969_4096,Gemm_Hipblaslt_TN_9220,0.40034
GemmTunableOp_Half_TN,tn_4096_1973_7168,Gemm_Hipblaslt_TN_9645,0.212433
GemmTunableOp_Half_TN,tn_64128_86_4096,Gemm_Hipblaslt_TN_9057,0.180758
GemmTunableOp_Half_TN,tn_3072_3507_4096,Gemm_Rocblas_621294495,0.156191
GemmTunableOp_Half_TN,tn_14336_1847_4096,Gemm_Hipblaslt_TN_9189,0.372166
GemmTunableOp_Half_TN,tn_14336_1822_4096,Gemm_Hipblaslt_TN_9139,0.371963
GemmTunableOp_Half_TN,tn_14336_3688_4096,Gemm_Hipblaslt_TN_9187,0.742421
GemmTunableOp_Half_TN,tn_3072_1698_4096,Gemm_Hipblaslt_TN_9561,0.0879518
GemmTunableOp_Half_TN,tn_3072_3535_4096,Gemm_Hipblaslt_TN_9570,0.157149
GemmTunableOp_Half_TN,tn_14336_1708_4096,Gemm_Hipblaslt_TN_9697,0.359017
GemmTunableOp_Half_TN,tn_3072_1831_4096,Gemm_Hipblaslt_TN_9148,0.0913764
GemmTunableOp_Half_TN,tn_14336_8_4096,Gemm_Rocblas_621294048,0.02329
GemmTunableOp_Half_TN,tn_4096_1711_7168,Gemm_Hipblaslt_TN_9265,0.185386
GemmTunableOp_Half_TN,tn_14336_1636_4096,Gemm_Hipblaslt_TN_9697,0.355864
GemmTunableOp_Half_TN,tn_4096_1666_2048,Gemm_Hipblaslt_TN_9180,0.056837
GemmTunableOp_Half_TN,tn_3072_5239_4096,Gemm_Hipblaslt_TN_9710,0.214697
GemmTunableOp_Half_TN,tn_4096_1838_7168,Gemm_Hipblaslt_TN_9268,0.20579
GemmTunableOp_Half_TN,tn_3072_3383_4096,Gemm_Rocblas_621286753,0.151855
GemmTunableOp_Half_TN,tn_4096_1685_2048,Gemm_Hipblaslt_TN_9671,0.0571599
GemmTunableOp_Half_TN,tn_14336_6800_4096,Gemm_Hipblaslt_TN_9749,1.3221
GemmTunableOp_Half_TN,tn_3072_1655_4096,Gemm_Hipblaslt_TN_9561,0.0877631
GemmTunableOp_Half_TN,tn_4096_1647_2048,Gemm_Hipblaslt_TN_9607,0.0571316
GemmTunableOp_Half_TN,tn_64128_90_4096,Gemm_Hipblaslt_TN_9058,0.178412
GemmTunableOp_Half_TN,tn_64128_171_4096,Gemm_Hipblaslt_TN_9855,0.24445
GemmTunableOp_Half_TN,tn_3072_1846_4096,Gemm_Hipblaslt_TN_9324,0.0914056
GemmTunableOp_Half_TN,tn_14336_3578_4096,Gemm_Hipblaslt_TN_9223,0.67303
GemmTunableOp_Half_TN,tn_64128_24_4096,Gemm_Hipblaslt_TN_9094,0.146084
GemmTunableOp_Half_TN,tn_14336_3682_4096,Gemm_Hipblaslt_TN_9677,0.744471
GemmTunableOp_Half_TN,tn_14336_5427_4096,Gemm_Hipblaslt_TN_9217,1.06334
GemmTunableOp_Half_TN,tn_28672_4000_8192,Gemm_Rocblas_621294634,3.32549
GemmTunableOp_Half_TN,tn_14336_3652_4096,Gemm_Hipblaslt_TN_9192,0.741098
GemmTunableOp_Half_TN,tn_3072_6630_4096,Gemm_Hipblaslt_TN_9681,0.300897
GemmTunableOp_Half_TN,tn_4096_1706_7168,Gemm_Hipblaslt_TN_9265,0.185514
GemmTunableOp_Half_TN,tn_4096_6989_7168,Gemm_Hipblaslt_TN_9743,0.678022
GemmTunableOp_Half_TN,tn_3072_1884_4096,Gemm_Hipblaslt_TN_9324,0.0926722
GemmTunableOp_Half_TN,tn_4096_3791_7168,Gemm_Hipblaslt_TN_9223,0.364671
GemmTunableOp_Half_TN,tn_64128_131_4096,Gemm_Hipblaslt_TN_9108,0.214539
GemmTunableOp_Half_TN,tn_3072_1590_4096,Gemm_Hipblaslt_TN_9561,0.085734
GemmTunableOp_Half_TN,tn_14336_1908_4096,Gemm_Hipblaslt_TN_9187,0.377273
GemmTunableOp_Half_TN,tn_64128_254_4096,Gemm_Rocblas_621286915,0.287906
GemmTunableOp_Half_TN,tn_14336_1586_4096,Gemm_Hipblaslt_TN_9672,0.328139
GemmTunableOp_Half_TN,tn_3072_5319_4096,Gemm_Hipblaslt_TN_9898,0.216476
GemmTunableOp_Half_TN,tn_4096_5541_2048,Gemm_Hipblaslt_TN_9799,0.173125
GemmTunableOp_Half_TN,tn_4096_7136_7168,Gemm_Hipblaslt_TN_9743,0.683982
GemmTunableOp_Half_TN,tn_4096_1852_2048,Gemm_Hipblaslt_TN_9590,0.0631171
GemmTunableOp_Half_TN,tn_4096_3379_2048,Gemm_Hipblaslt_TN_9896,0.100618
GemmTunableOp_Half_TN,tn_4096_3573_2048,Gemm_Hipblaslt_TN_9694,0.105073
GemmTunableOp_Half_TN,tn_14336_1608_4096,Gemm_Hipblaslt_TN_9187,0.352871
GemmTunableOp_Half_TN,tn_4096_1627_7168,Gemm_Hipblaslt_TN_9587,0.182921
GemmTunableOp_Half_TN,tn_14336_1682_4096,Gemm_Hipblaslt_TN_9189,0.358179
GemmTunableOp_Half_TN,tn_4096_5359_7168,Gemm_Rocblas_621294426,0.552501
GemmTunableOp_Half_TN,tn_3072_5204_4096,Gemm_Hipblaslt_TN_159,0.216802
GemmTunableOp_Half_TN,tn_14336_72_4096,Gemm_Hipblaslt_TN_9493,0.0340015
GemmTunableOp_Half_TN,tn_3072_1666_4096,Gemm_Hipblaslt_TN_9322,0.0885942
GemmTunableOp_Half_TN,tn_4096_7579_2048,Gemm_Hipblaslt_TN_9768,0.225791
GemmTunableOp_Half_TN,tn_3072_1706_4096,Gemm_Rocblas_621286778,0.0890559
GemmTunableOp_Half_TN,tn_3072_1668_4096,Gemm_Hipblaslt_TN_9148,0.0883673
GemmTunableOp_Half_TN,tn_4096_5512_7168,Gemm_Rocblas_621294426,0.56155
GemmTunableOp_Half_TN,tn_3072_1916_4096,Gemm_Hipblaslt_TN_9611,0.0949153
GemmTunableOp_Half_TN,tn_4096_5512_2048,Gemm_Hipblaslt_TN_9691,0.174148
GemmTunableOp_Half_TN,tn_4096_3701_7168,Gemm_Hipblaslt_TN_9220,0.362731
GemmTunableOp_Half_TN,tn_4096_1745_7168,Gemm_Hipblaslt_TN_9673,0.196261
GemmTunableOp_Half_TN,tn_3072_3455_4096,Gemm_Hipblaslt_TN_7589,0.153435
GemmTunableOp_Half_TN,tn_3072_1690_4096,Gemm_Hipblaslt_TN_9561,0.0879594
GemmTunableOp_Half_TN,tn_3072_1636_4096,Gemm_Hipblaslt_TN_9613,0.0895434
GemmTunableOp_Half_TN,tn_4096_1586_2048,Gemm_Hipblaslt_TN_9607,0.0560163
GemmTunableOp_Half_TN,tn_4096_6881_7168,Gemm_Hipblaslt_TN_9862,0.67163
GemmTunableOp_Half_TN,tn_4096_1811_7168,Gemm_Hipblaslt_TN_9680,0.204941
GemmTunableOp_Half_TN,tn_3072_7301_4096,Gemm_Hipblaslt_TN_9783,0.330322
GemmTunableOp_Half_TN,tn_3072_1728_4096,Gemm_Hipblaslt_TN_9322,0.0891079
GemmTunableOp_Half_TN,tn_3072_1825_4096,Gemm_Hipblaslt_TN_9324,0.0903375
GemmTunableOp_Half_TN,tn_4096_7484_7168,Gemm_Rocblas_621294127,0.721566
GemmTunableOp_Half_TN,tn_14336_7077_4096,Gemm_Hipblaslt_TN_159,1.33687
GemmTunableOp_Half_TN,tn_14336_1890_4096,Gemm_Hipblaslt_TN_9187,0.3746
GemmTunableOp_Half_TN,tn_3072_3553_4096,Gemm_Rocblas_621294495,0.157721
GemmTunableOp_Half_TN,tn_4096_1757_7168,Gemm_Hipblaslt_TN_9673,0.197209
GemmTunableOp_Half_TN,tn_14336_1846_4096,Gemm_Hipblaslt_TN_9697,0.374165
GemmTunableOp_Half_TN,tn_4096_1771_7168,Gemm_Hipblaslt_TN_9134,0.200787
GemmTunableOp_Half_TN,tn_4096_5533_7168,Gemm_Hipblaslt_TN_9672,0.559966
GemmTunableOp_Half_TN,tn_14336_1883_4096,Gemm_Hipblaslt_TN_9189,0.376296
GemmTunableOp_Half_TN,tn_4096_7478_7168,Gemm_Rocblas_621294127,0.722472
GemmTunableOp_Half_TN,tn_4096_216_7168,Gemm_Hipblaslt_TN_9497,0.0430324
GemmTunableOp_Half_TN,tn_14336_1665_4096,Gemm_Hipblaslt_TN_9139,0.357225
GemmTunableOp_Half_TN,tn_14336_1981_4096,Gemm_Hipblaslt_TN_9223,0.403673
GemmTunableOp_Half_TN,tn_64128_29_4096,Gemm_Hipblaslt_TN_9094,0.147102
GemmTunableOp_Half_TN,tn_64128_241_4096,Gemm_Rocblas_621286915,0.287744
GemmTunableOp_Half_TN,tn_4096_7138_7168,Gemm_Hipblaslt_TN_9743,0.674158
GemmTunableOp_Half_TN,tn_3072_7262_4096,Gemm_Hipblaslt_TN_9681,0.315206
GemmTunableOp_Half_TN,tn_4096_1969_2048,Gemm_Hipblaslt_TN_9590,0.0664275
GemmTunableOp_Half_TN,tn_4096_7240_7168,Gemm_Hipblaslt_TN_9743,0.689193
GemmTunableOp_Half_TN,tn_4096_1958_2048,Gemm_Hipblaslt_TN_9590,0.0668768
GemmTunableOp_Half_TN,tn_14336_5285_4096,Gemm_Hipblaslt_TN_9217,1.04206
GemmTunableOp_Half_TN,tn_4096_1573_7168,Gemm_Hipblaslt_TN_9359,0.181452
GemmTunableOp_Half_TN,tn_4096_5735_7168,Gemm_Hipblaslt_TN_9852,0.575596
GemmTunableOp_Half_TN,tn_3072_6881_4096,Gemm_Hipblaslt_TN_9681,0.301187
GemmTunableOp_Half_TN,tn_14336_1898_4096,Gemm_Hipblaslt_TN_9677,0.374969
GemmTunableOp_Half_TN,tn_3072_1784_4096,Gemm_Rocblas_621286778,0.0907717
GemmTunableOp_Half_TN,tn_4096_7021_7168,Gemm_Hipblaslt_TN_9677,0.675121
GemmTunableOp_Half_TN,tn_4096_1892_2048,Gemm_Hipblaslt_TN_9590,0.0653568
GemmTunableOp_Half_TN,tn_14336_1859_4096,Gemm_Hipblaslt_TN_9677,0.372052
GemmTunableOp_Half_TN,tn_3072_3559_4096,Gemm_Rocblas_621294495,0.15858
GemmTunableOp_Half_TN,tn_4096_1686_7168,Gemm_Hipblaslt_TN_9587,0.183361
GemmTunableOp_Half_TN,tn_64128_106_4096,Gemm_Hipblaslt_TN_9596,0.196007
GemmTunableOp_Half_TN,tn_4096_1794_2048,Gemm_Hipblaslt_TN_9590,0.0626291
GemmTunableOp_Half_TN,tn_4096_1573_2048,Gemm_Hipblaslt_TN_9164,0.0557116
GemmTunableOp_Half_TN,tn_4096_1838_2048,Gemm_Hipblaslt_TN_9329,0.0637735
GemmTunableOp_Half_TN,tn_14336_3781_4096,Gemm_Hipblaslt_TN_9187,0.748557
GemmTunableOp_Half_TN,tn_14336_128_4096,Gemm_Hipblaslt_TN_9516,0.0418201
GemmTunableOp_Half_TN,tn_4096_1872_7168,Gemm_Hipblaslt_TN_9645,0.204834
GemmTunableOp_Half_TN,tn_3072_1573_4096,Gemm_Hipblaslt_TN_9561,0.0845168
GemmTunableOp_Half_TN,tn_4096_256_2048,Gemm_Rocblas_621286445,0.0147966
GemmTunableOp_Half_TN,tn_3072_1958_4096,Gemm_Hipblaslt_TN_9633,0.0991281
GemmTunableOp_Half_TN,tn_3072_3466_4096,Gemm_Hipblaslt_TN_7589,0.157528
GemmTunableOp_Half_TN,tn_3072_6870_4096,Gemm_Hipblaslt_TN_9681,0.30196
GemmTunableOp_Half_TN,tn_14336_1689_4096,Gemm_Hipblaslt_TN_9677,0.356565
GemmTunableOp_Half_TN,tn_64128_68_4096,Gemm_Hipblaslt_TN_9058,0.175803
GemmTunableOp_Half_TN,tn_4096_5354_2048,Gemm_Hipblaslt_TN_9709,0.168282
GemmTunableOp_Half_TN,tn_4096_1633_7168,Gemm_Hipblaslt_TN_9587,0.182881
GemmTunableOp_Half_TN,tn_4096_1824_2048,Gemm_Hipblaslt_TN_9590,0.0634575
GemmTunableOp_Half_TN,tn_4096_1680_7168,Gemm_Hipblaslt_TN_9610,0.184656
GemmTunableOp_Half_TN,tn_14336_6715_4096,Gemm_Hipblaslt_TN_9827,1.3033
GemmTunableOp_Half_TN,tn_14336_1642_4096,Gemm_Hipblaslt_TN_9192,0.357106
GemmTunableOp_Half_TN,tn_4096_1605_2048,Gemm_Hipblaslt_TN_9607,0.0560677
GemmTunableOp_Half_TN,tn_3072_1838_4096,Gemm_Hipblaslt_TN_9613,0.0941034
GemmTunableOp_Half_TN,tn_3072_6997_4096,Gemm_Hipblaslt_TN_9681,0.307832
GemmTunableOp_Half_TN,tn_3072_7439_4096,Gemm_Hipblaslt_TN_9674,0.331268
GemmTunableOp_Half_TN,tn_14336_7072_4096,Gemm_Hipblaslt_TN_9914,1.33767
GemmTunableOp_Half_TN,tn_3072_1963_4096,Gemm_Hipblaslt_TN_9633,0.100425
GemmTunableOp_Half_TN,tn_4096_6789_2048,Gemm_Hipblaslt_TN_9743,0.202316
GemmTunableOp_Half_TN,tn_4096_6843_2048,Gemm_Hipblaslt_TN_9683,0.204834
GemmTunableOp_Half_TN,tn_14336_7475_4096,Gemm_Hipblaslt_TN_9903,1.47652
GemmTunableOp_Half_TN,tn_4096_1874_7168,Gemm_Hipblaslt_TN_9134,0.207436
GemmTunableOp_Half_TN,tn_4096_1935_2048,Gemm_Hipblaslt_TN_9174,0.0657784
GemmTunableOp_Half_TN,tn_3072_1752_4096,Gemm_Rocblas_621286778,0.0909974
GemmTunableOp_Half_TN,tn_14336_3496_4096,Gemm_Rocblas_621286590,0.664437
GemmTunableOp_Half_TN,tn_4096_3573_7168,Gemm_Hipblaslt_TN_9697,0.346413
GemmTunableOp_Half_TN,tn_4096_1713_2048,Gemm_Hipblaslt_TN_9588,0.0587105
GemmTunableOp_Half_TN,tn_4096_5239_2048,Gemm_Hipblaslt_TN_9709,0.169688
GemmTunableOp_Half_TN,tn_4096_6997_7168,Gemm_Hipblaslt_TN_9743,0.675531
GemmTunableOp_Half_TN,tn_4096_1735_7168,Gemm_Hipblaslt_TN_9673,0.195952
GemmTunableOp_Half_TN,tn_4096_5530_2048,Gemm_Hipblaslt_TN_9799,0.171975
GemmTunableOp_Half_TN,tn_4096_48_2048,Gemm_Rocblas_621294155,0.00795909
GemmTunableOp_Half_TN,tn_4096_1888_7168,Gemm_Hipblaslt_TN_9134,0.208037
GemmTunableOp_Half_TN,tn_4096_3562_7168,Gemm_Hipblaslt_TN_9139,0.344399
GemmTunableOp_Half_TN,tn_4096_3912_2048,Gemm_Hipblaslt_TN_9898,0.116639
GemmTunableOp_Half_TN,tn_4096_3630_2048,Gemm_Hipblaslt_TN_9683,0.104756
GemmTunableOp_Half_TN,tn_14336_5157_4096,Gemm_Hipblaslt_TN_9697,0.987613
GemmTunableOp_Half_TN,tn_14336_1963_4096,Gemm_Hipblaslt_TN_9217,0.400504
GemmTunableOp_Half_TN,tn_4096_7072_2048,Gemm_Hipblaslt_TN_9696,0.204439
GemmStridedBatchedTunableOp_Half_TN,tn_1744_1744_128_B_16,Gemm_Rocblas_621286413,0.0687909
GemmStridedBatchedTunableOp_Half_TN,tn_1933_1933_128_B_16,Gemm_Rocblas_621294533,0.0888695
GemmStridedBatchedTunableOp_Half_TN,tn_1837_1837_128_B_16,Gemm_Hipblaslt_TN_7483,0.0810935
GemmStridedBatchedTunableOp_Half_TN,tn_1678_1678_128_B_16,Gemm_Rocblas_621286413,0.0698773
GemmStridedBatchedTunableOp_Half_TN,tn_1658_1658_128_B_16,Gemm_Hipblaslt_TN_7483,0.0650812
GemmStridedBatchedTunableOp_Half_TN,tn_1605_1605_128_B_16,Gemm_Hipblaslt_TN_7483,0.0651042
GemmStridedBatchedTunableOp_Half_TN,tn_1927_1927_128_B_16,Gemm_Hipblaslt_TN_7519,0.0874739
GemmStridedBatchedTunableOp_Half_TN,tn_1878_1878_128_B_16,Gemm_Hipblaslt_TN_6942,0.0825022
GemmStridedBatchedTunableOp_Half_TN,tn_1850_1850_128_B_16,Gemm_Hipblaslt_TN_6942,0.0810251
GemmStridedBatchedTunableOp_Half_TN,tn_1926_1926_128_B_16,Gemm_Rocblas_621294533,0.087816
GemmStridedBatchedTunableOp_Half_TN,tn_1596_1596_128_B_16,Gemm_Rocblas_621286413,0.0652563
GemmStridedBatchedTunableOp_Half_TN,tn_1880_1880_128_B_16,Gemm_Hipblaslt_TN_150,0.0763518
GemmStridedBatchedTunableOp_Half_TN,tn_1801_1801_128_B_16,Gemm_Hipblaslt_TN_6942,0.0800065
GemmStridedBatchedTunableOp_Half_TN,tn_1831_1831_128_B_16,Gemm_Hipblaslt_TN_6942,0.0813428
GemmStridedBatchedTunableOp_Half_TN,tn_1864_1864_128_B_16,Gemm_Hipblaslt_TN_150,0.0767033
GemmStridedBatchedTunableOp_Half_TN,tn_1882_1882_128_B_16,Gemm_Hipblaslt_TN_7483,0.0813043
GemmStridedBatchedTunableOp_Half_TN,tn_1841_1841_128_B_16,Gemm_Hipblaslt_TN_6942,0.0808841
GemmStridedBatchedTunableOp_Half_TN,tn_1772_1772_128_B_16,Gemm_Hipblaslt_TN_7483,0.0750394
GemmStridedBatchedTunableOp_Half_TN,tn_1720_1720_128_B_16,Gemm_Rocblas_621294108,0.0704243
GemmStridedBatchedTunableOp_Half_TN,tn_1634_1634_128_B_16,Gemm_Rocblas_621286413,0.068727
GemmStridedBatchedTunableOp_Half_TN,tn_1876_1876_128_B_16,Gemm_Hipblaslt_TN_6942,0.0816193
GemmStridedBatchedTunableOp_Half_TN,tn_1920_1920_128_B_16,Gemm_Rocblas_621294463,0.066782
GemmStridedBatchedTunableOp_Half_TN,tn_1936_1936_128_B_16,Gemm_Hipblaslt_TN_150,0.0773559
GemmStridedBatchedTunableOp_Half_TN,tn_1722_1722_128_B_16,Gemm_Rocblas_621294702,0.0731137
GemmStridedBatchedTunableOp_Half_TN,tn_1891_1891_128_B_16,Gemm_Hipblaslt_TN_6942,0.0837129
GemmStridedBatchedTunableOp_Half_TN,tn_1693_1693_128_B_16,Gemm_Rocblas_621294754,0.0720207
GemmStridedBatchedTunableOp_Half_TN,tn_1783_1783_128_B_16,Gemm_Hipblaslt_TN_7483,0.0740487
GemmStridedBatchedTunableOp_Half_TN,tn_1701_1701_128_B_16,Gemm_Hipblaslt_TN_7483,0.0707396
GemmStridedBatchedTunableOp_Half_TN,tn_1912_1912_128_B_16,Gemm_Hipblaslt_TN_150,0.0796783
GemmStridedBatchedTunableOp_Half_TN,tn_1638_1638_128_B_16,Gemm_Rocblas_621294517,0.0684318
GemmStridedBatchedTunableOp_Half_TN,tn_1653_1653_128_B_16,Gemm_Hipblaslt_TN_7483,0.0655851
GemmStridedBatchedTunableOp_Half_TN,tn_1781_1781_128_B_16,Gemm_Hipblaslt_TN_7483,0.0757356
GemmStridedBatchedTunableOp_Half_TN,tn_1736_1736_128_B_16,Gemm_Hipblaslt_TN_155,0.0724432
GemmStridedBatchedTunableOp_Half_TN,tn_1779_1779_128_B_16,Gemm_Rocblas_621286775,0.0770615
GemmStridedBatchedTunableOp_Half_TN,tn_1873_1873_128_B_16,Gemm_Hipblaslt_TN_6942,0.0826836
GemmStridedBatchedTunableOp_Half_TN,tn_1648_1648_128_B_16,Gemm_Rocblas_621286509,0.0624829
GemmStridedBatchedTunableOp_Half_TN,tn_1757_1757_128_B_16,Gemm_Rocblas_621286413,0.0754759
GemmStridedBatchedTunableOp_Half_TN,tn_1661_1661_128_B_16,Gemm_Rocblas_621294517,0.0697431
GemmStridedBatchedTunableOp_Half_TN,tn_1812_1812_128_B_16,Gemm_Hipblaslt_TN_6942,0.079235
GemmStridedBatchedTunableOp_Half_TN,tn_1601_1601_128_B_16,Gemm_Hipblaslt_TN_7483,0.0674165
GemmStridedBatchedTunableOp_Half_TN,tn_1745_1745_128_B_16,Gemm_Rocblas_621286413,0.0751098
GemmStridedBatchedTunableOp_Half_TN,tn_1616_1616_128_B_16,Gemm_Rocblas_621286509,0.0605589
GemmStridedBatchedTunableOp_Half_TN,tn_1956_1956_128_B_16,Gemm_Rocblas_621294533,0.0882863
GemmStridedBatchedTunableOp_Half_TN,tn_1899_1899_128_B_16,Gemm_Hipblaslt_TN_7483,0.0822517
GemmStridedBatchedTunableOp_Half_TN,tn_1913_1913_128_B_16,Gemm_Hipblaslt_TN_7483,0.0846606
GemmStridedBatchedTunableOp_Half_TN,tn_1832_1832_128_B_16,Gemm_Hipblaslt_TN_150,0.0771004
GemmStridedBatchedTunableOp_Half_TN,tn_1907_1907_128_B_16,Gemm_Hipblaslt_TN_6942,0.0836235
GemmStridedBatchedTunableOp_Half_TN,tn_1728_1728_128_B_16,Gemm_Rocblas_621286519,0.0649134
GemmStridedBatchedTunableOp_Half_TN,tn_1636_1636_128_B_16,Gemm_Hipblaslt_TN_7483,0.067793
GemmStridedBatchedTunableOp_Half_TN,tn_1743_1743_128_B_16,Gemm_Hipblaslt_TN_7483,0.0736804
GemmStridedBatchedTunableOp_Half_TN,tn_1906_1906_128_B_16,Gemm_Hipblaslt_TN_6942,0.0833225
GemmStridedBatchedTunableOp_Half_TN,tn_1610_1610_128_B_16,Gemm_Rocblas_621286413,0.0670564
GemmStridedBatchedTunableOp_Half_TN,tn_1968_1968_128_B_16,Gemm_Hipblaslt_TN_150,0.0802924
GemmStridedBatchedTunableOp_Half_TN,tn_1609_1609_128_B_16,Gemm_Hipblaslt_TN_7483,0.0660596
GemmStridedBatchedTunableOp_Half_TN,tn_1975_1975_128_B_16,Gemm_Hipblaslt_TN_7519,0.0912403
GemmStridedBatchedTunableOp_Half_TN,tn_1883_1883_128_B_16,Gemm_Hipblaslt_TN_6942,0.0830888
GemmStridedBatchedTunableOp_Half_TN,tn_1592_1592_128_B_16,Gemm_Rocblas_621286509,0.0647785
GemmStridedBatchedTunableOp_Half_TN,tn_1746_1746_128_B_16,Gemm_Rocblas_621286413,0.0744896
GemmStridedBatchedTunableOp_Half_TN,tn_1734_1734_128_B_16,Gemm_Rocblas_621286413,0.0739954
GemmStridedBatchedTunableOp_Half_TN,tn_1874_1874_128_B_16,Gemm_Hipblaslt_TN_6942,0.0818848
GemmStridedBatchedTunableOp_Half_TN,tn_1984_1984_128_B_16,Gemm_Hipblaslt_TN_150,0.0779954
GemmStridedBatchedTunableOp_Half_TN,tn_1817_1817_128_B_16,Gemm_Hipblaslt_TN_6942,0.0803813
GemmStridedBatchedTunableOp_Half_TN,tn_1644_1644_128_B_16,Gemm_Rocblas_621286775,0.0679649
GemmStridedBatchedTunableOp_Half_TN,tn_1866_1866_128_B_16,Gemm_Hipblaslt_TN_6942,0.0823465
GemmStridedBatchedTunableOp_Half_TN,tn_1759_1759_128_B_16,Gemm_Hipblaslt_TN_7483,0.0751615
GemmStridedBatchedTunableOp_Half_TN,tn_1946_1946_128_B_16,Gemm_Hipblaslt_TN_6867,0.0875023
GemmStridedBatchedTunableOp_Half_TN,tn_1955_1955_128_B_16,Gemm_Rocblas_621294533,0.0900937
GemmStridedBatchedTunableOp_Half_TN,tn_1643_1643_128_B_16,Gemm_Hipblaslt_TN_7483,0.0690482
GemmStridedBatchedTunableOp_Half_TN,tn_1931_1931_128_B_16,Gemm_Rocblas_621294533,0.0889708
GemmStridedBatchedTunableOp_Half_TN,tn_1827_1827_128_B_16,Gemm_Hipblaslt_TN_6942,0.0809209
GemmStridedBatchedTunableOp_Half_TN,tn_1934_1934_128_B_16,Gemm_Hipblaslt_TN_6929,0.086192
GemmStridedBatchedTunableOp_Half_TN,tn_1798_1798_128_B_16,Gemm_Hipblaslt_TN_6942,0.0793258
GemmStridedBatchedTunableOp_Half_TN,tn_1663_1663_128_B_16,Gemm_Rocblas_621286774,0.0700644
GemmStridedBatchedTunableOp_Half_TN,tn_1879_1879_128_B_16,Gemm_Hipblaslt_TN_6942,0.0828006
GemmStridedBatchedTunableOp_Half_TN,tn_1618_1618_128_B_16,Gemm_Hipblaslt_TN_7483,0.0655915
GemmStridedBatchedTunableOp_Half_TN,tn_1640_1640_128_B_16,Gemm_Hipblaslt_TN_7483,0.0670628
GemmStridedBatchedTunableOp_Half_TN,tn_1760_1760_128_B_16,Gemm_Rocblas_621294255,0.0674083
GemmStridedBatchedTunableOp_Half_TN,tn_1711_1711_128_B_16,Gemm_Rocblas_621294754,0.072772
GemmStridedBatchedTunableOp_Half_TN,tn_1770_1770_128_B_16,Gemm_Rocblas_621294108,0.0763476
GemmStridedBatchedTunableOp_Half_TN,tn_1808_1808_128_B_16,Gemm_Hipblaslt_TN_150,0.0731452
GemmStridedBatchedTunableOp_Half_TN,tn_1932_1932_128_B_16,Gemm_Rocblas_621294533,0.0865903
GemmStridedBatchedTunableOp_Half_TN,tn_1773_1773_128_B_16,Gemm_Rocblas_621286775,0.0771044
GemmStridedBatchedTunableOp_Half_TN,tn_1863_1863_128_B_16,Gemm_Hipblaslt_TN_6942,0.0824184
GemmStridedBatchedTunableOp_Half_TN,tn_1717_1717_128_B_16,Gemm_Rocblas_621286413,0.0725465
GemmStridedBatchedTunableOp_Half_TN,tn_1877_1877_128_B_16,Gemm_Hipblaslt_TN_6942,0.0826358
GemmStridedBatchedTunableOp_Half_TN,tn_1755_1755_128_B_16,Gemm_Rocblas_621286775,0.0746944
GemmStridedBatchedTunableOp_Half_TN,tn_1952_1952_128_B_16,Gemm_Hipblaslt_TN_150,0.0764025
GemmStridedBatchedTunableOp_Half_TN,tn_1639_1639_128_B_16,Gemm_Rocblas_621286775,0.0685959
GemmStridedBatchedTunableOp_Half_TN,tn_1788_1788_128_B_16,Gemm_Rocblas_621286807,0.0761459
GemmStridedBatchedTunableOp_Half_TN,tn_1765_1765_128_B_16,Gemm_Rocblas_621286413,0.076443
GemmStridedBatchedTunableOp_Half_TN,tn_1802_1802_128_B_16,Gemm_Hipblaslt_TN_6942,0.0794887
GemmStridedBatchedTunableOp_Half_TN,tn_1677_1677_128_B_16,Gemm_Rocblas_621286413,0.0701602
GemmStridedBatchedTunableOp_Half_TN,tn_1840_1840_128_B_16,Gemm_Hipblaslt_TN_150,0.0760915
GemmTunableOp_Half_TN,tn_4096_1710_7168,Gemm_Hipblaslt_TN_9610,0.187846
GemmTunableOp_Half_TN,tn_4096_1796_2048,Gemm_Hipblaslt_TN_9590,0.0637309
GemmTunableOp_Half_TN,tn_3072_3309_4096,Gemm_Hipblaslt_TN_9619,0.150374
GemmTunableOp_Half_TN,tn_3072_7093_4096,Gemm_Hipblaslt_TN_9619,0.308765
GemmTunableOp_Half_TN,tn_4096_128_2048,Gemm_Rocblas_621286491,0.0112997
GemmTunableOp_Half_TN,tn_4096_5357_2048,Gemm_Hipblaslt_TN_9709,0.172205
GemmTunableOp_Half_TN,tn_4096_1651_2048,Gemm_Hipblaslt_TN_9164,0.0577946
GemmTunableOp_Half_TN,tn_3072_1660_4096,Gemm_Hipblaslt_TN_9561,0.0890326
GemmTunableOp_Half_TN,tn_4096_5136_7168,Gemm_Hipblaslt_TN_9774,0.540303
GemmTunableOp_Half_TN,tn_3072_3388_4096,Gemm_Hipblaslt_TN_9681,0.155531
GemmTunableOp_Half_TN,tn_14336_3214_4096,Gemm_Hipblaslt_TN_9223,0.633835
GemmTunableOp_Half_TN,tn_4096_6971_2048,Gemm_Hipblaslt_TN_9695,0.209319
GemmTunableOp_Half_TN,tn_3072_7067_4096,Gemm_Hipblaslt_TN_9681,0.311583
GemmTunableOp_Half_TN,tn_4096_3496_7168,Gemm_Hipblaslt_TN_9187,0.340063
GemmTunableOp_Half_TN,tn_3072_1873_4096,Gemm_Hipblaslt_TN_9613,0.0948927
GemmTunableOp_Half_TN,tn_4096_1804_7168,Gemm_Hipblaslt_TN_9680,0.206717
GemmTunableOp_Half_TN,tn_4096_1804_2048,Gemm_Hipblaslt_TN_9590,0.0640041
GemmTunableOp_Half_TN,tn_4096_7386_2048,Gemm_Hipblaslt_TN_9815,0.224498
GemmTunableOp_Half_TN,tn_4096_3345_2048,Gemm_Hipblaslt_TN_9814,0.102419
GemmTunableOp_Half_TN,tn_14336_1882_4096,Gemm_Hipblaslt_TN_9187,0.3764
GemmTunableOp_Half_TN,tn_4096_1887_7168,Gemm_Hipblaslt_TN_9645,0.209504
GemmTunableOp_Half_TN,tn_4096_3651_2048,Gemm_Hipblaslt_TN_9768,0.11399
GemmTunableOp_Half_TN,tn_4096_1889_7168,Gemm_Hipblaslt_TN_9645,0.210186
GemmTunableOp_Half_TN,tn_14336_1934_4096,Gemm_Hipblaslt_TN_9223,0.40361
GemmTunableOp_Half_TN,tn_64128_74_4096,Gemm_Hipblaslt_TN_9057,0.18125
GemmTunableOp_Half_TN,tn_14336_1684_4096,Gemm_Hipblaslt_TN_9677,0.358857
GemmTunableOp_Half_TN,tn_14336_3369_4096,Gemm_Rocblas_621286742,0.655106
GemmTunableOp_Half_TN,tn_4096_3595_7168,Gemm_Hipblaslt_TN_9677,0.345416
GemmTunableOp_Half_TN,tn_14336_1804_4096,Gemm_Hipblaslt_TN_9697,0.371053
GemmTunableOp_Half_TN,tn_3072_3373_4096,Gemm_Hipblaslt_TN_9619,0.152315
GemmTunableOp_Half_TN,tn_14336_3345_4096,Gemm_Hipblaslt_TN_9217,0.645297
GemmTunableOp_Half_TN,tn_3072_1685_4096,Gemm_Hipblaslt_TN_9322,0.0907236
GemmTunableOp_Half_TN,tn_4096_1977_2048,Gemm_Hipblaslt_TN_9590,0.0674178
GemmTunableOp_Half_TN,tn_4096_1846_7168,Gemm_Hipblaslt_TN_9680,0.206418
GemmTunableOp_Half_TN,tn_3072_1802_4096,Gemm_Rocblas_621294520,0.0920882
GemmTunableOp_Half_TN,tn_14336_1830_4096,Gemm_Hipblaslt_TN_9187,0.372189
GemmTunableOp_Half_TN,tn_4096_3401_7168,Gemm_Hipblaslt_TN_9697,0.336106
GemmTunableOp_Half_TN,tn_3072_1601_4096,Gemm_Hipblaslt_TN_9561,0.0877682
GemmTunableOp_Half_TN,tn_14336_1778_4096,Gemm_Hipblaslt_TN_9793,0.370162
GemmTunableOp_Half_TN,tn_4096_1928_2048,Gemm_Hipblaslt_TN_9590,0.0659298
GemmTunableOp_Half_TN,tn_14336_3494_4096,Gemm_Rocblas_621294435,0.663856
GemmTunableOp_Half_TN,tn_4096_1946_2048,Gemm_Hipblaslt_TN_9620,0.0663288
GemmTunableOp_Half_TN,tn_3072_1973_4096,Gemm_Hipblaslt_TN_9633,0.101138
GemmTunableOp_Half_TN,tn_14336_1601_4096,Gemm_Hipblaslt_TN_9697,0.3527
GemmTunableOp_Half_TN,tn_4096_248_7168,Gemm_Hipblaslt_TN_9497,0.044368
GemmTunableOp_Half_TN,tn_14336_5723_4096,Gemm_Hipblaslt_TN_9815,1.10802
GemmTunableOp_Half_TN,tn_14336_3515_4096,Gemm_Hipblaslt_TN_9220,0.666495
GemmTunableOp_Half_TN,tn_4096_5219_2048,Gemm_Hipblaslt_TN_9691,0.170781
GemmTunableOp_Half_TN,tn_3072_1727_4096,Gemm_Hipblaslt_TN_9561,0.0905144
GemmTunableOp_Half_TN,tn_3072_1721_4096,Gemm_Hipblaslt_TN_9561,0.0890047
GemmTunableOp_Half_TN,tn_3072_3565_4096,Gemm_Rocblas_621286753,0.161148
GemmTunableOp_Half_TN,tn_14336_1704_4096,Gemm_Hipblaslt_TN_9697,0.359808
GemmTunableOp_Half_TN,tn_3072_1607_4096,Gemm_Hipblaslt_TN_9133,0.0896784
GemmTunableOp_Half_TN,tn_3072_7108_4096,Gemm_Hipblaslt_TN_9681,0.314224
GemmTunableOp_Half_TN,tn_14336_1973_4096,Gemm_Hipblaslt_TN_9223,0.404581
GemmTunableOp_Half_TN,tn_4096_1648_2048,Gemm_Hipblaslt_TN_9588,0.0564318
GemmTunableOp_Half_TN,tn_4096_1945_7168,Gemm_Hipblaslt_TN_9645,0.211194
GemmTunableOp_Half_TN,tn_4096_1896_2048,Gemm_Hipblaslt_TN_9136,0.0653498
GemmTunableOp_Half_TN,tn_4096_3595_2048,Gemm_Hipblaslt_TN_9696,0.107004
GemmTunableOp_Half_TN,tn_4096_6871_7168,Gemm_Hipblaslt_TN_9955,0.670057
GemmTunableOp_Half_TN,tn_4096_1710_2048,Gemm_Hipblaslt_TN_9588,0.0591428
GemmTunableOp_Half_TN,tn_4096_1866_2048,Gemm_Hipblaslt_TN_9590,0.0650759
GemmTunableOp_Half_TN,tn_3072_120_4096,Gemm_Rocblas_621294028,0.0149844
GemmTunableOp_Half_TN,tn_4096_3592_7168,Gemm_Hipblaslt_TN_9743,0.34576
GemmTunableOp_Half_TN,tn_3072_5357_4096,Gemm_Hipblaslt_TN_9726,0.218253
GemmTunableOp_Half_TN,tn_14336_3612_4096,Gemm_Hipblaslt_TN_9192,0.736345
GemmTunableOp_Half_TN,tn_14336_1874_4096,Gemm_Hipblaslt_TN_9697,0.376814
GemmTunableOp_Half_TN,tn_3072_3574_4096,Gemm_Rocblas_621294495,0.161244
GemmTunableOp_Half_TN,tn_3072_5352_4096,Gemm_Rocblas_621286281,0.217104
GemmTunableOp_Half_TN,tn_4096_1894_2048,Gemm_Hipblaslt_TN_9590,0.0646526
GemmTunableOp_Half_TN,tn_4096_1826_7168,Gemm_Hipblaslt_TN_9645,0.205978
GemmTunableOp_Half_TN,tn_4096_5735_2048,Gemm_Hipblaslt_TN_9672,0.177655
GemmTunableOp_Half_TN,tn_4096_3369_2048,Gemm_Hipblaslt_TN_9896,0.102257
GemmTunableOp_Half_TN,tn_14336_1831_4096,Gemm_Hipblaslt_TN_9187,0.373633
GemmTunableOp_Half_TN,tn_4096_1789_2048,Gemm_Hipblaslt_TN_9329,0.0644157
GemmTunableOp_Half_TN,tn_4096_1739_7168,Gemm_Hipblaslt_TN_9673,0.197527
GemmTunableOp_Half_TN,tn_4096_1660_7168,Gemm_Hipblaslt_TN_9587,0.184574
GemmTunableOp_Half_TN,tn_14336_1928_4096,Gemm_Hipblaslt_TN_9217,0.402167
GemmTunableOp_Half_TN,tn_4096_1790_2048,Gemm_Hipblaslt_TN_9329,0.0639215
GemmTunableOp_Half_TN,tn_4096_1689_2048,Gemm_Hipblaslt_TN_9569,0.0597704
GemmTunableOp_Half_TN,tn_4096_6761_7168,Gemm_Hipblaslt_TN_9677,0.666828
GemmTunableOp_Half_TN,tn_4096_3600_7168,Gemm_Hipblaslt_TN_9695,0.345729
GemmTunableOp_Half_TN,tn_4096_5030_2048,Gemm_Hipblaslt_TN_9790,0.168061
GemmTunableOp_Half_TN,tn_4096_7253_2048,Gemm_Hipblaslt_TN_9814,0.212863
GemmTunableOp_Half_TN,tn_4096_1717_7168,Gemm_Hipblaslt_TN_9265,0.187902
GemmTunableOp_Half_TN,tn_14336_6996_4096,Gemm_Hipblaslt_TN_9914,1.33352
GemmTunableOp_Half_TN,tn_4096_1828_7168,Gemm_Hipblaslt_TN_9680,0.206512
GemmTunableOp_Half_TN,tn_14336_1933_4096,Gemm_Hipblaslt_TN_9223,0.399593
GemmTunableOp_Half_TN,tn_3072_5068_4096,Gemm_Hipblaslt_TN_9726,0.216919
GemmTunableOp_Half_TN,tn_4096_1916_7168,Gemm_Hipblaslt_TN_9645,0.211537
GemmTunableOp_Half_TN,tn_3072_6744_4096,Gemm_Hipblaslt_TN_9681,0.301757
GemmTunableOp_Half_TN,tn_14336_232_4096,Gemm_Rocblas_621286478,0.068212
GemmTunableOp_Half_TN,tn_4096_3691_2048,Gemm_Hipblaslt_TN_9841,0.113829
GemmTunableOp_Half_TN,tn_3072_6789_4096,Gemm_Hipblaslt_TN_9619,0.303035
GemmTunableOp_Half_TN,tn_4096_6971_7168,Gemm_Hipblaslt_TN_9694,0.672521
GemmTunableOp_Half_TN,tn_4096_3214_7168,Gemm_Hipblaslt_TN_9684,0.326688
GemmTunableOp_Half_TN,tn_4096_3592_2048,Gemm_Hipblaslt_TN_9683,0.106632
GemmTunableOp_Half_TN,tn_3072_1792_4096,Gemm_Hipblaslt_TN_9641,0.0916548
GemmTunableOp_Half_TN,tn_3072_5267_4096,Gemm_Hipblaslt_TN_9903,0.216335
GemmTunableOp_Half_TN,tn_4096_1601_7168,Gemm_Hipblaslt_TN_9265,0.183588
GemmTunableOp_Half_TN,tn_4096_3382_7168,Gemm_Hipblaslt_TN_9695,0.334247
GemmTunableOp_Half_TN,tn_4096_3773_2048,Gemm_Hipblaslt_TN_9190,0.1123
GemmTunableOp_Half_TN,tn_14336_3416_4096,Gemm_Hipblaslt_TN_9220,0.654894
GemmTunableOp_Half_TN,tn_14336_3768_4096,Gemm_Hipblaslt_TN_9677,0.752223
GemmTunableOp_Half_TN,tn_14336_32_4096,Gemm_Rocblas_621286427,0.0261703
GemmTunableOp_Half_TN,tn_14336_5267_4096,Gemm_Hipblaslt_TN_9914,1.04559
GemmTunableOp_Half_TN,tn_14336_6901_4096,Gemm_Hipblaslt_TN_9753,1.33079
GemmTunableOp_Half_TN,tn_4096_6916_2048,Gemm_Hipblaslt_TN_9743,0.207001
GemmTunableOp_Half_TN,tn_4096_7130_2048,Gemm_Hipblaslt_TN_9694,0.207186
GemmTunableOp_Half_TN,tn_4096_104_2048,Gemm_Rocblas_621294029,0.0109548
GemmTunableOp_Half_TN,tn_64128_44_4096,Gemm_Hipblaslt_TN_9097,0.162372
GemmTunableOp_Half_TN,tn_4096_1871_7168,Gemm_Hipblaslt_TN_9645,0.210331
GemmTunableOp_Half_TN,tn_3072_7120_4096,Gemm_Hipblaslt_TN_9681,0.312753
GemmTunableOp_Half_TN,tn_4096_5067_2048,Gemm_Hipblaslt_TN_9689,0.168882
GemmTunableOp_Half_TN,tn_14336_5301_4096,Gemm_Hipblaslt_TN_9223,1.04804
GemmTunableOp_Half_TN,tn_4096_1615_2048,Gemm_Hipblaslt_TN_9607,0.0562552
GemmTunableOp_Half_TN,tn_4096_7403_7168,Gemm_Hipblaslt_TN_9904,0.720449
GemmTunableOp_Half_TN,tn_3072_7364_4096,Gemm_Hipblaslt_TN_9779,0.333359
GemmTunableOp_Half_TN,tn_3072_7403_4096,Gemm_Hipblaslt_TN_9657,0.335542
GemmTunableOp_Half_TN,tn_14336_5495_4096,Gemm_Hipblaslt_TN_9220,1.08369
GemmTunableOp_Half_TN,tn_3072_1827_4096,Gemm_Hipblaslt_TN_9324,0.0921596
GemmTunableOp_Half_TN,tn_3072_1647_4096,Gemm_Hipblaslt_TN_9561,0.088828
GemmTunableOp_Half_TN,tn_4096_1822_2048,Gemm_Hipblaslt_TN_9136,0.0643738
GemmTunableOp_Half_TN,tn_14336_5219_4096,Gemm_Hipblaslt_TN_9223,1.03849
GemmTunableOp_Half_TN,tn_4096_1620_2048,Gemm_Hipblaslt_TN_9607,0.0564194
GemmTunableOp_Half_TN,tn_14336_1592_4096,Gemm_Hipblaslt_TN_9690,0.32942
GemmTunableOp_Half_TN,tn_3072_1928_4096,Gemm_Hipblaslt_TN_9266,0.101317
GemmTunableOp_Half_TN,tn_64128_196_4096,Gemm_Hipblaslt_TN_9260,0.276635
GemmTunableOp_Half_TN,tn_3072_1853_4096,Gemm_Hipblaslt_TN_9613,0.0950051
GemmTunableOp_Half_TN,tn_14336_7109_4096,Gemm_Hipblaslt_TN_9869,1.33562
GemmTunableOp_Half_TN,tn_14336_1810_4096,Gemm_Hipblaslt_TN_9697,0.373953
GemmTunableOp_Half_TN,tn_4096_1830_2048,Gemm_Hipblaslt_TN_9136,0.0647264
GemmTunableOp_Half_TN,tn_3072_6761_4096,Gemm_Hipblaslt_TN_9688,0.303278
GemmTunableOp_Half_TN,tn_3072_1599_4096,Gemm_Hipblaslt_TN_9561,0.0862223
GemmTunableOp_Half_TN,tn_64128_93_4096,Gemm_Hipblaslt_TN_9057,0.188678
GemmTunableOp_Half_TN,tn_14336_1931_4096,Gemm_Hipblaslt_TN_9223,0.401094
GemmTunableOp_Half_TN,tn_14336_1762_4096,Gemm_Hipblaslt_TN_9697,0.369539
GemmTunableOp_Half_TN,tn_4096_1879_2048,Gemm_Hipblaslt_TN_9590,0.0640108
GemmTunableOp_Half_TN,tn_14336_1888_4096,Gemm_Hipblaslt_TN_9139,0.376399
GemmTunableOp_Half_TN,tn_4096_1760_7168,Gemm_Hipblaslt_TN_9673,0.198337
GemmTunableOp_Half_TN,tn_4096_1890_7168,Gemm_Hipblaslt_TN_9645,0.209149
GemmTunableOp_Half_TN,tn_4096_7262_2048,Gemm_Hipblaslt_TN_9188,0.213768
GemmTunableOp_Half_TN,tn_4096_3547_2048,Gemm_Hipblaslt_TN_9212,0.106708
GemmTunableOp_Half_TN,tn_4096_184_7168,Gemm_Hipblaslt_TN_9497,0.0399815
GemmTunableOp_Half_TN,tn_64128_226_4096,Gemm_Rocblas_621286905,0.288212
GemmTunableOp_Half_TN,tn_3072_1628_4096,Gemm_Rocblas_621286778,0.0875609
GemmTunableOp_Half_TN,tn_64128_60_4096,Gemm_Rocblas_621286821,0.167359
GemmTunableOp_Half_TN,tn_4096_256_7168,Gemm_Hipblaslt_TN_9497,0.0454936
GemmTunableOp_Half_TN,tn_4096_1908_2048,Gemm_Hipblaslt_TN_9590,0.0651761
GemmTunableOp_Half_TN,tn_3072_1953_4096,Gemm_Hipblaslt_TN_9633,0.100474
GemmTunableOp_Half_TN,tn_4096_128_7168,Gemm_Rocblas_621286438,0.0284148
GemmTunableOp_Half_TN,tn_3072_3369_4096,Gemm_Hipblaslt_TN_9619,0.15444
GemmTunableOp_Half_TN,tn_14336_7130_4096,Gemm_Hipblaslt_TN_9914,1.33744
GemmTunableOp_Half_TN,tn_14336_24_4096,Gemm_Rocblas_621294154,0.026119
GemmTunableOp_Half_TN,tn_4096_64_7168,Gemm_Rocblas_621286421,0.0201213
GemmTunableOp_Half_TN,tn_3072_128_4096,Gemm_Rocblas_621294166,0.015266
GemmTunableOp_Half_TN,tn_4096_112_7168,Gemm_Rocblas_621294164,0.0279686
GemmTunableOp_Half_TN,tn_4096_7186_2048,Gemm_Hipblaslt_TN_9692,0.210094
GemmTunableOp_Half_TN,tn_3072_5219_4096,Gemm_Hipblaslt_TN_9747,0.217351
GemmTunableOp_Half_TN,tn_14336_1855_4096,Gemm_Hipblaslt_TN_9187,0.373728
GemmTunableOp_Half_TN,tn_4096_3767_2048,Gemm_Hipblaslt_TN_9190,0.113031
GemmTunableOp_Half_TN,tn_3072_7138_4096,Gemm_Hipblaslt_TN_9681,0.315139
GemmTunableOp_Half_TN,tn_64128_87_4096,Gemm_Hipblaslt_TN_9057,0.18735
GemmTunableOp_Half_TN,tn_14336_88_4096,Gemm_Hipblaslt_TN_9350,0.037835
GemmTunableOp_Half_TN,tn_4096_7248_2048,Gemm_Hipblaslt_TN_9221,0.213295
GemmTunableOp_Half_TN,tn_3072_1789_4096,Gemm_Hipblaslt_TN_9613,0.0938683
GemmTunableOp_Half_TN,tn_14336_5465_4096,Gemm_Hipblaslt_TN_9753,1.08005
GemmTunableOp_Half_TN,tn_4096_7432_2048,Gemm_Rocblas_621286281,0.226413
GemmTunableOp_Half_TN,tn_14336_7267_4096,Gemm_Hipblaslt_TN_9683,1.40898
GemmTunableOp_Half_TN,tn_14336_3666_4096,Gemm_Hipblaslt_TN_9677,0.74465
GemmTunableOp_Half_TN,tn_4096_1853_2048,Gemm_Hipblaslt_TN_9590,0.0649024
GemmTunableOp_Half_TN,tn_4096_7475_7168,Gemm_Hipblaslt_TN_9853,0.72635
GemmTunableOp_Half_TN,tn_4096_3466_2048,Gemm_Hipblaslt_TN_9571,0.105404
GemmTunableOp_Half_TN,tn_4096_5196_7168,Gemm_Rocblas_621294314,0.546265
GemmTunableOp_Half_TN,tn_14336_1967_4096,Gemm_Hipblaslt_TN_9220,0.403543
GemmTunableOp_Half_TN,tn_14336_1966_4096,Gemm_Hipblaslt_TN_9220,0.403549
GemmTunableOp_Half_TN,tn_4096_3791_2048,Gemm_Hipblaslt_TN_9827,0.11484
GemmTunableOp_Half_TN,tn_4096_1854_7168,Gemm_Hipblaslt_TN_9680,0.20862
GemmTunableOp_Half_TN,tn_64128_250_4096,Gemm_Rocblas_621294648,0.291829
GemmTunableOp_Half_TN,tn_14336_5530_4096,Gemm_Hipblaslt_TN_9220,1.08386
GemmTunableOp_Half_TN,tn_4096_1663_7168,Gemm_Hipblaslt_TN_9265,0.184224
GemmTunableOp_Half_TN,tn_4096_7196_2048,Gemm_Hipblaslt_TN_9694,0.210224
GemmTunableOp_Half_TN,tn_14336_1879_4096,Gemm_Hipblaslt_TN_9697,0.376314
GemmTunableOp_Half_TN,tn_4096_3713_7168,Gemm_Hipblaslt_TN_9217,0.363836
GemmTunableOp_Half_TN,tn_3072_1945_4096,Gemm_Hipblaslt_TN_9633,0.100406
GemmTunableOp_Half_TN,tn_14336_5352_4096,Gemm_Hipblaslt_TN_159,1.05433
GemmTunableOp_Half_TN,tn_3072_3382_4096,Gemm_Rocblas_621294495,0.154469
GemmTunableOp_Half_TN,tn_4096_5570_7168,Gemm_Hipblaslt_TN_9687,0.566799
GemmTunableOp_Half_TN,tn_4096_5285_2048,Gemm_Hipblaslt_TN_9674,0.171545
GemmTunableOp_Half_TN,tn_14336_1772_4096,Gemm_Hipblaslt_TN_9192,0.368705
GemmTunableOp_Half_TN,tn_64128_127_4096,Gemm_Hipblaslt_TN_9263,0.209623
GemmTunableOp_Half_TN,tn_4096_1831_2048,Gemm_Hipblaslt_TN_9134,0.0631643
GemmTunableOp_Half_TN,tn_3072_1935_4096,Gemm_Hipblaslt_TN_9633,0.100767
GemmTunableOp_Half_TN,tn_14336_7344_4096,Gemm_Hipblaslt_TN_9961,1.44426
GemmTunableOp_Half_TN,tn_4096_3706_7168,Gemm_Hipblaslt_TN_9223,0.364543
GemmTunableOp_Half_TN,tn_64128_48_4096,Gemm_Hipblaslt_TN_9097,0.158021
GemmTunableOp_Half_TN,tn_3072_7730_4096,Gemm_Hipblaslt_TN_9800,0.340338
GemmTunableOp_Half_TN,tn_14336_1699_4096,Gemm_Hipblaslt_TN_9697,0.358607
GemmTunableOp_Half_TN,tn_3072_1742_4096,Gemm_Hipblaslt_TN_9613,0.0916463
GemmTunableOp_Half_TN,tn_4096_1805_7168,Gemm_Hipblaslt_TN_9268,0.206119
GemmTunableOp_Half_TN,tn_3072_3630_4096,Gemm_Hipblaslt_TN_9619,0.16129
GemmTunableOp_Half_TN,tn_3072_1642_4096,Gemm_Hipblaslt_TN_9561,0.0890555
GemmTunableOp_Half_TN,tn_4096_1784_2048,Gemm_Hipblaslt_TN_9645,0.0636977
GemmTunableOp_Half_TN,tn_4096_1902_2048,Gemm_Hipblaslt_TN_9590,0.0644586
GemmTunableOp_Half_TN,tn_3072_3578_4096,Gemm_Rocblas_621286753,0.158811
GemmTunableOp_Half_TN,tn_3072_1839_4096,Gemm_Hipblaslt_TN_9613,0.0937663
GemmTunableOp_Half_TN,tn_4096_1945_2048,Gemm_Hipblaslt_TN_9590,0.0658551
GemmTunableOp_Half_TN,tn_3072_3427_4096,Gemm_Rocblas_621286753,0.155837
GemmTunableOp_Half_TN,tn_3072_7240_4096,Gemm_Hipblaslt_TN_9619,0.313795
GemmTunableOp_Half_TN,tn_14336_7478_4096,Gemm_Hipblaslt_TN_9888,1.4765
GemmTunableOp_Half_TN,tn_4096_1737_7168,Gemm_Hipblaslt_TN_9673,0.200612
GemmTunableOp_Half_TN,tn_14336_5735_4096,Gemm_Hipblaslt_TN_9753,1.1093
GemmTunableOp_Half_TN,tn_3072_1725_4096,Gemm_Rocblas_621294520,0.0894317
GemmTunableOp_Half_TN,tn_3072_1665_4096,Gemm_Hipblaslt_TN_9561,0.088833
GemmTunableOp_Half_TN,tn_14336_1869_4096,Gemm_Hipblaslt_TN_9192,0.374857
GemmTunableOp_Half_TN,tn_4096_1752_7168,Gemm_Hipblaslt_TN_9673,0.199062
GemmTunableOp_Half_TN,tn_3072_1717_4096,Gemm_Hipblaslt_TN_9561,0.0911465
GemmTunableOp_Half_TN,tn_3072_5583_4096,Gemm_Hipblaslt_TN_9726,0.227102
GemmTunableOp_Half_TN,tn_3072_5354_4096,Gemm_Hipblaslt_TN_9747,0.218069
GemmTunableOp_Half_TN,tn_14336_1858_4096,Gemm_Hipblaslt_TN_9697,0.374831
GemmTunableOp_Half_TN,tn_4096_7340_2048,Gemm_Hipblaslt_TN_9903,0.225792
GemmTunableOp_Half_TN,tn_64128_210_4096,Gemm_Rocblas_621286797,0.279477
GemmTunableOp_Half_TN,tn_4096_3410_2048,Gemm_Hipblaslt_TN_9896,0.103161
GemmTunableOp_Half_TN,tn_4096_1824_7168,Gemm_Hipblaslt_TN_9645,0.20724
GemmTunableOp_Half_TN,tn_4096_7439_7168,Gemm_Hipblaslt_TN_9890,0.725458
GemmTunableOp_Half_TN,tn_4096_1969_7168,Gemm_Hipblaslt_TN_9680,0.212995
GemmTunableOp_Half_TN,tn_4096_3830_7168,Gemm_Hipblaslt_TN_9827,0.371603
GemmTunableOp_Half_TN,tn_4096_3773_7168,Gemm_Hipblaslt_TN_9217,0.365959
GemmTunableOp_Half_TN,tn_3072_1981_4096,Gemm_Hipblaslt_TN_9633,0.0998336
GemmTunableOp_Half_TN,tn_4096_1936_7168,Gemm_Hipblaslt_TN_9645,0.211806
GemmTunableOp_Half_TN,tn_14336_1680_4096,Gemm_Hipblaslt_TN_9677,0.358541
GemmTunableOp_Half_TN,tn_3072_1875_4096,Gemm_Hipblaslt_TN_9148,0.0944533
GemmTunableOp_Half_TN,tn_4096_1763_7168,Gemm_Hipblaslt_TN_9645,0.201755
GemmTunableOp_Half_TN,tn_3072_1890_4096,Gemm_Hipblaslt_TN_9613,0.0947652
GemmTunableOp_Half_TN,tn_3072_1798_4096,Gemm_Rocblas_621286778,0.0938707
GemmTunableOp_Half_TN,tn_3072_7206_4096,Gemm_Hipblaslt_TN_9681,0.313281
GemmTunableOp_Half_TN,tn_4096_1725_7168,Gemm_Hipblaslt_TN_9610,0.187132
GemmTunableOp_Half_TN,tn_4096_248_2048,Gemm_Rocblas_621294175,0.0150129
GemmTunableOp_Half_TN,tn_4096_5412_2048,Gemm_Hipblaslt_TN_9799,0.173526
GemmTunableOp_Half_TN,tn_4096_3682_2048,Gemm_Hipblaslt_TN_9841,0.113786
GemmTunableOp_Half_TN,tn_4096_1898_2048,Gemm_Hipblaslt_TN_9590,0.0651097
GemmTunableOp_Half_TN,tn_14336_7050_4096,Gemm_Hipblaslt_TN_9888,1.3389
GemmTunableOp_Half_TN,tn_14336_3701_4096,Gemm_Hipblaslt_TN_9697,0.745245
GemmTunableOp_Half_TN,tn_4096_3583_7168,Gemm_Hipblaslt_TN_9743,0.344183
GemmTunableOp_Half_TN,tn_14336_3622_4096,Gemm_Hipblaslt_TN_9814,0.73407
GemmTunableOp_Half_TN,tn_4096_3602_7168,Gemm_Hipblaslt_TN_9697,0.344836
GemmTunableOp_Half_TN,tn_4096_104_7168,Gemm_Rocblas_621286438,0.0277831
GemmTunableOp_Half_TN,tn_4096_1869_7168,Gemm_Hipblaslt_TN_9645,0.208068
GemmTunableOp_Half_TN,tn_4096_1691_2048,Gemm_Hipblaslt_TN_9607,0.0569082
GemmTunableOp_Half_TN,tn_4096_88_2048,Gemm_Rocblas_621286278,0.00939744
GemmTunableOp_Half_TN,tn_4096_80_2048,Gemm_Rocblas_621294027,0.00945663
GemmTunableOp_Half_TN,tn_4096_1954_7168,Gemm_Hipblaslt_TN_9680,0.211783
GemmTunableOp_Half_TN,tn_14336_7139_4096,Gemm_Hipblaslt_TN_9888,1.34114
GemmTunableOp_Half_TN,tn_64128_249_4096,Gemm_Rocblas_621294648,0.291844
GemmTunableOp_Half_TN,tn_28672_4096_8192,Gemm_Rocblas_621294636,3.33009
GemmTunableOp_Half_TN,tn_14336_6881_4096,Gemm_Rocblas_621294492,1.32676
GemmTunableOp_Half_TN,tn_4096_1588_2048,Gemm_Hipblaslt_TN_9607,0.0561511
GemmTunableOp_Half_TN,tn_14336_1872_4096,Gemm_Hipblaslt_TN_9697,0.374664
GemmTunableOp_Half_TN,tn_14336_1711_4096,Gemm_Hipblaslt_TN_9677,0.359136
GemmTunableOp_Half_TN,tn_3072_6841_4096,Gemm_Hipblaslt_TN_9681,0.304022
GemmTunableOp_Half_TN,tn_4096_3920_7168,Gemm_Hipblaslt_TN_9217,0.373276
GemmTunableOp_Half_TN,tn_4096_5413_7168,Gemm_Hipblaslt_TN_9690,0.555891
GemmTunableOp_Half_TN,tn_4096_1798_2048,Gemm_Hipblaslt_TN_9590,0.0653554
GemmTunableOp_Half_TN,tn_14336_3475_4096,Gemm_Hipblaslt_TN_9220,0.656497
GemmTunableOp_Half_TN,tn_64128_217_4096,Gemm_Hipblaslt_TN_9271,0.281322
GemmTunableOp_Half_TN,tn_4096_1593_7168,Gemm_Hipblaslt_TN_9607,0.184054
GemmTunableOp_Half_TN,tn_4096_1813_7168,Gemm_Hipblaslt_TN_9134,0.204888
GemmTunableOp_Half_TN,tn_64128_54_4096,Gemm_Rocblas_621286821,0.166357
GemmTunableOp_Half_TN,tn_4096_1665_7168,Gemm_Hipblaslt_TN_9671,0.185953
GemmTunableOp_Half_TN,tn_64128_207_4096,Gemm_Hipblaslt_TN_9260,0.277585
GemmTunableOp_Half_TN,tn_14336_3382_4096,Gemm_Rocblas_621286750,0.655862
GemmTunableOp_Half_TN,tn_64128_30_4096,Gemm_Hipblaslt_TN_9094,0.146788
GemmTunableOp_Half_TN,tn_4096_1948_7168,Gemm_Hipblaslt_TN_9136,0.212317
GemmTunableOp_Half_TN,tn_3072_5359_4096,Gemm_Hipblaslt_TN_159,0.219109
GemmTunableOp_Half_TN,tn_3072_1858_4096,Gemm_Hipblaslt_TN_9613,0.0942721
GemmTunableOp_Half_TN,tn_4096_7139_7168,Gemm_Hipblaslt_TN_9743,0.676885
GemmTunableOp_Half_TN,tn_4096_3219_2048,Gemm_Hipblaslt_TN_9212,0.101058
GemmTunableOp_Half_TN,tn_4096_7104_2048,Gemm_Rocblas_621286743,0.206467
GemmTunableOp_Half_TN,tn_4096_3584_7168,Gemm_Hipblaslt_TN_9187,0.345666
GemmTunableOp_Half_TN,tn_14336_3559_4096,Gemm_Hipblaslt_TN_9217,0.671617
GemmTunableOp_Half_TN,tn_64128_105_4096,Gemm_Hipblaslt_TN_9263,0.201298
GemmTunableOp_Half_TN,tn_64128_11_4096,Gemm_Rocblas_621294224,0.143745
GemmTunableOp_Half_TN,tn_4096_3701_2048,Gemm_Hipblaslt_TN_9190,0.112196
GemmTunableOp_Half_TN,tn_4096_1884_7168,Gemm_Hipblaslt_TN_9680,0.210188
GemmTunableOp_Half_TN,tn_14336_1702_4096,Gemm_Hipblaslt_TN_9697,0.359239
GemmTunableOp_Half_TN,tn_64128_85_4096,Gemm_Hipblaslt_TN_9057,0.186702
GemmTunableOp_Half_TN,tn_64128_231_4096,Gemm_Rocblas_621286905,0.290024
GemmTunableOp_Half_TN,tn_64128_146_4096,Gemm_Hipblaslt_TN_9108,0.229577
GemmTunableOp_Half_TN,tn_64128_164_4096,Gemm_Hipblaslt_TN_9817,0.253516
GemmTunableOp_Half_TN,tn_4096_7730_2048,Gemm_Hipblaslt_TN_9713,0.229249
GemmTunableOp_Half_TN,tn_4096_5100_2048,Gemm_Hipblaslt_TN_9690,0.168155
GemmTunableOp_Half_TN,tn_3072_1588_4096,Gemm_Hipblaslt_TN_9561,0.085361
GemmTunableOp_Half_TN,tn_64128_25_4096,Gemm_Hipblaslt_TN_9094,0.146523
GemmTunableOp_Half_TN,tn_5120_4000_8192,Gemm_Hipblaslt_TN_9649,0.602327
GemmTunableOp_Half_TN,tn_3072_1704_4096,Gemm_Hipblaslt_TN_9561,0.0909164
GemmTunableOp_Half_TN,tn_4096_1686_2048,Gemm_Hipblaslt_TN_9607,0.0578317
GemmTunableOp_Half_TN,tn_14336_7021_4096,Gemm_Hipblaslt_TN_9888,1.3362
GemmTunableOp_Half_TN,tn_4096_1670_2048,Gemm_Hipblaslt_TN_9607,0.0571973
GemmTunableOp_Half_TN,tn_4096_48_7168,Gemm_Rocblas_621294148,0.0192143
GemmTunableOp_Half_TN,tn_3072_6871_4096,Gemm_Hipblaslt_TN_9681,0.305319
GemmTunableOp_Half_TN,tn_64128_37_4096,Gemm_Hipblaslt_TN_9097,0.160397
GemmTunableOp_Half_TN,tn_3072_3496_4096,Gemm_Rocblas_621286753,0.157347
GemmTunableOp_Half_TN,tn_4096_6902_7168,Gemm_Hipblaslt_TN_9743,0.66777
GemmTunableOp_Half_TN,tn_4096_5680_2048,Gemm_Hipblaslt_TN_9691,0.177777
GemmTunableOp_Half_TN,tn_14336_5498_4096,Gemm_Hipblaslt_TN_9217,1.08119
GemmTunableOp_Half_TN,tn_3072_6843_4096,Gemm_Hipblaslt_TN_9681,0.303781
GemmTunableOp_Half_TN,tn_4096_7403_2048,Gemm_Hipblaslt_TN_9713,0.225409
GemmTunableOp_Half_TN,tn_3072_1874_4096,Gemm_Hipblaslt_TN_9324,0.0930957
GemmTunableOp_Half_TN,tn_14336_96_4096,Gemm_Hipblaslt_TN_9350,0.0386976
GemmTunableOp_Half_TN,tn_3072_232_4096,Gemm_Rocblas_621286443,0.0224869
GemmTunableOp_Half_TN,tn_3072_3629_4096,Gemm_Hipblaslt_TN_9619,0.160504
GemmTunableOp_Half_TN,tn_64128_109_4096,Gemm_Hipblaslt_TN_9263,0.203247
GemmTunableOp_Half_TN,tn_64128_9_4096,Gemm_Rocblas_621286348,0.142557
GemmTunableOp_Half_TN,tn_64128_20_4096,Gemm_Hipblaslt_TN_9094,0.147223
GemmTunableOp_Half_TN,tn_14336_1743_4096,Gemm_Hipblaslt_TN_9697,0.36747
GemmTunableOp_Half_TN,tn_3072_6902_4096,Gemm_Hipblaslt_TN_9688,0.30458
GemmTunableOp_Half_TN,tn_64128_185_4096,Gemm_Hipblaslt_TN_9855,0.260676
GemmTunableOp_Half_TN,tn_4096_1807_7168,Gemm_Hipblaslt_TN_9268,0.205767
GemmTunableOp_Half_TN,tn_14336_3793_4096,Gemm_Hipblaslt_TN_9677,0.752027
GemmTunableOp_Half_TN,tn_14336_1713_4096,Gemm_Hipblaslt_TN_9697,0.359998
GemmTunableOp_Half_TN,tn_4096_7344_7168,Gemm_Hipblaslt_TN_159,0.716941
GemmTunableOp_Half_TN,tn_4096_5359_2048,Gemm_Hipblaslt_TN_9709,0.171274
GemmTunableOp_Half_TN,tn_4096_1614_7168,Gemm_Hipblaslt_TN_9616,0.183257
GemmTunableOp_Half_TN,tn_14336_1742_4096,Gemm_Hipblaslt_TN_9192,0.365584
GemmTunableOp_Half_TN,tn_3072_1883_4096,Gemm_Hipblaslt_TN_9613,0.0942135
GemmTunableOp_Half_TN,tn_4096_3912_7168,Gemm_Hipblaslt_TN_9217,0.372893
GemmTunableOp_Half_TN,tn_14336_1760_4096,Gemm_Hipblaslt_TN_9793,0.369049
GemmTunableOp_Half_TN,tn_4096_7568_7168,Gemm_Hipblaslt_TN_9888,0.728855
GemmTunableOp_Half_TN,tn_64128_62_4096,Gemm_Hipblaslt_TN_9097,0.167353
GemmTunableOp_Half_TN,tn_64128_112_4096,Gemm_Hipblaslt_TN_9061,0.204068
GemmTunableOp_Half_TN,tn_4096_1721_2048,Gemm_Hipblaslt_TN_9588,0.0594151
GemmTunableOp_Half_TN,tn_4096_3526_2048,Gemm_Hipblaslt_TN_9684,0.10604
GemmTunableOp_Half_TN,tn_4096_3564_2048,Gemm_Hipblaslt_TN_9694,0.105965
GemmTunableOp_Half_TN,tn_3072_1737_4096,Gemm_Hipblaslt_TN_9163,0.0912877
GemmTunableOp_Half_TN,tn_64128_96_4096,Gemm_Hipblaslt_TN_9057,0.185953
GemmTunableOp_Half_TN,tn_4096_1648_7168,Gemm_Hipblaslt_TN_9265,0.18498
GemmTunableOp_Half_TN,tn_3072_3410_4096,Gemm_Hipblaslt_TN_9681,0.155744
GemmTunableOp_Half_TN,tn_4096_1863_7168,Gemm_Hipblaslt_TN_9134,0.209343
GemmTunableOp_Half_TN,tn_3072_5465_4096,Gemm_Hipblaslt_TN_9710,0.225422
GemmTunableOp_Half_TN,tn_3072_1589_4096,Gemm_Hipblaslt_TN_9561,0.0860251
GemmTunableOp_Half_TN,tn_14336_1733_4096,Gemm_Hipblaslt_TN_9793,0.367759
GemmTunableOp_Half_TN,tn_64128_240_4096,Gemm_Rocblas_621286905,0.292757
GemmTunableOp_Half_TN,tn_14336_5359_4096,Gemm_Hipblaslt_TN_9933,1.05501
GemmTunableOp_Half_TN,tn_3072_3912_4096,Gemm_Hipblaslt_TN_9691,0.172493
GemmTunableOp_Half_TN,tn_4096_1799_2048,Gemm_Hipblaslt_TN_9590,0.0629515
GemmTunableOp_Half_TN,tn_64128_205_4096,Gemm_Rocblas_621286797,0.279977
GemmTunableOp_Half_TN,tn_4096_8_7168,Gemm_Rocblas_621286312,0.0128107
GemmTunableOp_Half_TN,tn_64128_78_4096,Gemm_Hipblaslt_TN_9057,0.182007
GemmTunableOp_Half_TN,tn_64128_100_4096,Gemm_Hipblaslt_TN_9061,0.200532
GemmTunableOp_Half_TN,tn_4096_3401_2048,Gemm_Hipblaslt_TN_9683,0.103966
GemmTunableOp_Half_TN,tn_3072_1625_4096,Gemm_Rocblas_621286778,0.0888401
GemmTunableOp_Half_TN,tn_64128_216_4096,Gemm_Rocblas_621286797,0.282583
GemmTunableOp_Half_TN,tn_14336_3557_4096,Gemm_Hipblaslt_TN_9217,0.670352
GemmTunableOp_Half_TN,tn_14336_1792_4096,Gemm_Hipblaslt_TN_9793,0.367443
GemmTunableOp_Half_TN,tn_14336_144_4096,Gemm_Hipblaslt_TN_9312,0.0531217
GemmTunableOp_Half_TN,tn_3072_1663_4096,Gemm_Hipblaslt_TN_9561,0.089817
GemmTunableOp_Half_TN,tn_3072_1931_4096,Gemm_Hipblaslt_TN_9587,0.100845
GemmTunableOp_Half_TN,tn_4096_1622_7168,Gemm_Hipblaslt_TN_9164,0.184367
GemmTunableOp_Half_TN,tn_3072_1866_4096,Gemm_Hipblaslt_TN_9613,0.0950247
GemmTunableOp_Half_TN,tn_4096_5322_2048,Gemm_Hipblaslt_TN_9709,0.168874
GemmTunableOp_Half_TN,tn_3072_3584_4096,Gemm_Hipblaslt_TN_9619,0.160255
GemmTunableOp_Half_TN,tn_3072_1881_4096,Gemm_Hipblaslt_TN_9163,0.0951431
GemmTunableOp_Half_TN,tn_3072_1623_4096,Gemm_Rocblas_621294520,0.0880341
GemmTunableOp_Half_TN,tn_14336_1863_4096,Gemm_Hipblaslt_TN_9697,0.375143
GemmTunableOp_Half_TN,tn_64128_153_4096,Gemm_Hipblaslt_TN_9063,0.231861
GemmTunableOp_Half_TN,tn_4096_112_2048,Gemm_Rocblas_621286278,0.0109686
GemmTunableOp_Half_TN,tn_14336_1807_4096,Gemm_Hipblaslt_TN_9139,0.372874
GemmTunableOp_Half_TN,tn_14336_1719_4096,Gemm_Hipblaslt_TN_9139,0.361711
GemmTunableOp_Half_TN,tn_64128_177_4096,Gemm_Hipblaslt_TN_9862,0.25694
GemmTunableOp_Half_TN,tn_14336_1799_4096,Gemm_Hipblaslt_TN_9187,0.371497
GemmTunableOp_Half_TN,tn_3072_3562_4096,Gemm_Rocblas_621286753,0.160099
GemmTunableOp_Half_TN,tn_3072_5273_4096,Gemm_Hipblaslt_TN_9904,0.218344
GemmTunableOp_Half_TN,tn_4096_1721_7168,Gemm_Hipblaslt_TN_9164,0.185686
GemmTunableOp_Half_TN,tn_14336_3400_4096,Gemm_Hipblaslt_TN_9220,0.656363
GemmTunableOp_Half_TN,tn_14336_5436_4096,Gemm_Hipblaslt_TN_9217,1.07769
GemmTunableOp_Half_TN,tn_14336_3582_4096,Gemm_Hipblaslt_TN_9223,0.670551
GemmTunableOp_Half_TN,tn_4096_7267_2048,Gemm_Hipblaslt_TN_9743,0.211561
GemmTunableOp_Half_TN,tn_14336_6788_4096,Gemm_Hipblaslt_TN_9815,1.32377
GemmTunableOp_Half_TN,tn_14336_1930_4096,Gemm_Hipblaslt_TN_9223,0.401415
GemmTunableOp_Half_TN,tn_3072_1867_4096,Gemm_Hipblaslt_TN_9564,0.0952944
GemmTunableOp_Half_TN,tn_14336_6971_4096,Gemm_Hipblaslt_TN_9933,1.3341
GemmTunableOp_Half_TN,tn_4096_1869_2048,Gemm_Hipblaslt_TN_9134,0.0649789
GemmTunableOp_Half_TN,tn_14336_6997_4096,Gemm_Hipblaslt_TN_9853,1.33795
GemmTunableOp_Half_TN,tn_3072_5125_4096,Gemm_Hipblaslt_TN_9726,0.217032
GemmTunableOp_Half_TN,tn_4096_1873_7168,Gemm_Hipblaslt_TN_9680,0.20946
GemmTunableOp_Half_TN,tn_3072_7027_4096,Gemm_Hipblaslt_TN_9681,0.311207
GemmTunableOp_Half_TN,tn_4096_1766_2048,Gemm_Hipblaslt_TN_9329,0.062856
GemmTunableOp_Half_TN,tn_14336_1745_4096,Gemm_Hipblaslt_TN_9697,0.368072
GemmTunableOp_Half_TN,tn_14336_5381_4096,Gemm_Rocblas_621286750,1.06373
GemmTunableOp_Half_TN,tn_4096_5410_7168,Gemm_Hipblaslt_TN_9690,0.553589
GemmTunableOp_Half_TN,tn_3072_1610_4096,Gemm_Hipblaslt_TN_9561,0.0878403
GemmTunableOp_Half_TN,tn_4096_3640_2048,Gemm_Hipblaslt_TN_9821,0.106032
GemmTunableOp_Half_TN,tn_3072_1620_4096,Gemm_Hipblaslt_TN_9561,0.0876269
GemmTunableOp_Half_TN,tn_3072_1722_4096,Gemm_Hipblaslt_TN_9561,0.0910485
GemmTunableOp_Half_TN,tn_4096_3629_7168,Gemm_Hipblaslt_TN_9187,0.347874
GemmTunableOp_Half_TN,tn_14336_7027_4096,Gemm_Hipblaslt_TN_9930,1.3341
GemmTunableOp_Half_TN,tn_4096_3682_7168,Gemm_Rocblas_621294420,0.361673
GemmTunableOp_Half_TN,tn_14336_3401_4096,Gemm_Rocblas_621286693,0.648783
GemmTunableOp_Half_TN,tn_4096_1981_7168,Gemm_Hipblaslt_TN_9645,0.213643
GemmTunableOp_Half_TN,tn_14336_1770_4096,Gemm_Hipblaslt_TN_9192,0.369391
GemmTunableOp_Half_TN,tn_3072_1859_4096,Gemm_Hipblaslt_TN_9324,0.092167
GemmTunableOp_Half_TN,tn_14336_7196_4096,Gemm_Hipblaslt_TN_9677,1.40578
GemmTunableOp_Half_TN,tn_4096_7325_2048,Gemm_Hipblaslt_TN_9713,0.223968
GemmTunableOp_Half_TN,tn_3072_1770_4096,Gemm_Hipblaslt_TN_9613,0.0932691
GemmTunableOp_Half_TN,tn_64128_16_4096,Gemm_Rocblas_621294224,0.145425
GemmTunableOp_Half_TN,tn_3072_248_4096,Gemm_Rocblas_621286443,0.023314
GemmTunableOp_Half_TN,tn_4096_1703_2048,Gemm_Hipblaslt_TN_9607,0.0579271
GemmTunableOp_Half_TN,tn_4096_1811_2048,Gemm_Hipblaslt_TN_9136,0.063554
GemmTunableOp_Half_TN,tn_64128_129_4096,Gemm_Hipblaslt_TN_9108,0.221438
GemmTunableOp_Half_TN,tn_4096_7108_7168,Gemm_Hipblaslt_TN_9743,0.672635
GemmTunableOp_Half_TN,tn_4096_3420_2048,Gemm_Hipblaslt_TN_9896,0.103272
GemmTunableOp_Half_TN,tn_4096_7171_7168,Gemm_Hipblaslt_TN_9743,0.688759
GemmTunableOp_Half_TN,tn_4096_1600_7168,Gemm_Hipblaslt_TN_9587,0.184371
GemmTunableOp_Half_TN,tn_64128_199_4096,Gemm_Hipblaslt_TN_9260,0.276513
GemmTunableOp_Half_TN,tn_4096_5442_2048,Gemm_Hipblaslt_TN_9691,0.174914
GemmTunableOp_Half_TN,tn_4096_6901_7168,Gemm_Hipblaslt_TN_9743,0.668498
GemmTunableOp_Half_TN,tn_14336_3420_4096,Gemm_Hipblaslt_TN_9220,0.656886
GemmTunableOp_Half_TN,tn_4096_6800_7168,Gemm_Hipblaslt_TN_9677,0.670646
GemmTunableOp_Half_TN,tn_3072_3589_4096,Gemm_Hipblaslt_TN_9570,0.162178
GemmTunableOp_Half_TN,tn_4096_5068_7168,Gemm_Hipblaslt_TN_9774,0.534533
GemmTunableOp_Half_TN,tn_3072_1970_4096,Gemm_Hipblaslt_TN_9633,0.101203
GemmTunableOp_Half_TN,tn_4096_1957_7168,Gemm_Hipblaslt_TN_9680,0.212736
GemmTunableOp_Half_TN,tn_3072_1637_4096,Gemm_Hipblaslt_TN_9613,0.0896888
GemmTunableOp_Half_TN,tn_3072_5427_4096,Gemm_Hipblaslt_TN_9726,0.223809
GemmTunableOp_Half_TN,tn_14336_6789_4096,Gemm_Hipblaslt_TN_9753,1.32205
GemmTunableOp_Half_TN,tn_3072_1766_4096,Gemm_Rocblas_621286778,0.0925012
GemmTunableOp_Half_TN,tn_4096_5267_2048,Gemm_Hipblaslt_TN_9672,0.170268
GemmTunableOp_Half_TN,tn_4096_3793_2048,Gemm_Hipblaslt_TN_9704,0.11481
GemmTunableOp_Half_TN,tn_14336_1706_4096,Gemm_Hipblaslt_TN_9189,0.361035
GemmTunableOp_Half_TN,tn_4096_1738_7168,Gemm_Hipblaslt_TN_9673,0.197274
GemmTunableOp_Half_TN,tn_4096_3468_2048,Gemm_Hipblaslt_TN_9683,0.105297
GemmTunableOp_Half_TN,tn_14336_1780_4096,Gemm_Hipblaslt_TN_9697,0.370483
GemmTunableOp_Half_TN,tn_4096_1623_2048,Gemm_Hipblaslt_TN_9607,0.0582175
GemmTunableOp_Half_TN,tn_4096_1673_2048,Gemm_Hipblaslt_TN_9607,0.0586456
GemmTunableOp_Half_TN,tn_64128_143_4096,Gemm_Hipblaslt_TN_9108,0.225429
GemmTunableOp_Half_TN,tn_4096_1958_7168,Gemm_Hipblaslt_TN_9680,0.214355
GemmTunableOp_Half_TN,tn_4096_3456_2048,Gemm_Rocblas_621294485,0.102153
GemmTunableOp_Half_TN,tn_14336_1802_4096,Gemm_Hipblaslt_TN_9697,0.370992
GemmTunableOp_Half_TN,tn_4096_7136_2048,Gemm_Hipblaslt_TN_9696,0.211129
GemmTunableOp_Half_TN,tn_4096_7023_2048,Gemm_Hipblaslt_TN_9694,0.207509
GemmTunableOp_Half_TN,tn_4096_1863_2048,Gemm_Hipblaslt_TN_9174,0.0657503
GemmTunableOp_Half_TN,tn_14336_5319_4096,Gemm_Hipblaslt_TN_9220,1.05559
GemmTunableOp_Half_TN,tn_14336_1916_4096,Gemm_Hipblaslt_TN_9139,0.378661
GemmTunableOp_Half_TN,tn_4096_1764_2048,Gemm_Hipblaslt_TN_9590,0.0644611
GemmTunableOp_Half_TN,tn_3072_1762_4096,Gemm_Hipblaslt_TN_9613,0.0927254
GemmTunableOp_Half_TN,tn_4096_1948_2048,Gemm_Hipblaslt_TN_9590,0.0661838
GemmTunableOp_Half_TN,tn_64128_63_4096,Gemm_Hipblaslt_TN_9097,0.167924
GemmTunableOp_Half_TN,tn_3072_3768_4096,Gemm_Hipblaslt_TN_9924,0.166725
GemmTunableOp_Half_TN,tn_3072_7484_4096,Gemm_Hipblaslt_TN_9779,0.335895
GemmTunableOp_Half_TN,tn_3072_7050_4096,Gemm_Hipblaslt_TN_9774,0.312705
GemmTunableOp_Half_TN,tn_4096_1854_2048,Gemm_Hipblaslt_TN_9590,0.0648155
GemmTunableOp_Half_TN,tn_4096_3553_2048,Gemm_Hipblaslt_TN_9683,0.106987
GemmTunableOp_Half_TN,tn_3072_1713_4096,Gemm_Hipblaslt_TN_9561,0.0895531
GemmTunableOp_Half_TN,tn_4096_1879_7168,Gemm_Hipblaslt_TN_9645,0.208991
GemmTunableOp_Half_TN,tn_3072_5052_4096,Gemm_Hipblaslt_TN_9726,0.215368
GemmTunableOp_Half_TN,tn_14336_3584_4096,Gemm_Rocblas_621286742,0.669504
GemmTunableOp_Half_TN,tn_4096_88_7168,Gemm_Rocblas_621286279,0.0256672
GemmTunableOp_Half_TN,tn_4096_1623_7168,Gemm_Hipblaslt_TN_9607,0.185198
GemmTunableOp_Half_TN,tn_4096_1781_2048,Gemm_Hipblaslt_TN_9329,0.0629781
GemmTunableOp_Half_TN,tn_4096_3515_7168,Gemm_Hipblaslt_TN_9187,0.342096
GemmTunableOp_Half_TN,tn_14336_1786_4096,Gemm_Hipblaslt_TN_9697,0.371089
GemmTunableOp_Half_TN,tn_3072_8_4096,Gemm_Rocblas_621294130,0.0083016
GemmTunableOp_Half_TN,tn_4096_7240_2048,Gemm_Hipblaslt_TN_9743,0.21175
GemmTunableOp_Half_TN,tn_4096_3450_2048,Gemm_Hipblaslt_TN_9896,0.102175
GemmTunableOp_Half_TN,tn_64128_135_4096,Gemm_Hipblaslt_TN_9108,0.226042
GemmTunableOp_Half_TN,tn_64128_15_4096,Gemm_Rocblas_621286325,0.145318
GemmTunableOp_Half_TN,tn_3072_3345_4096,Gemm_Rocblas_621294495,0.152988
GemmTunableOp_Half_TN,tn_4096_1749_2048,Gemm_Hipblaslt_TN_9136,0.0629433
GemmTunableOp_Half_TN,tn_4096_7327_7168,Gemm_Hipblaslt_TN_9888,0.717463
GemmTunableOp_Half_TN,tn_4096_3557_7168,Gemm_Hipblaslt_TN_9677,0.344474
GemmTunableOp_Half_TN,tn_14336_240_4096,Gemm_Hipblaslt_TN_9604,0.0672176
GemmTunableOp_Half_TN,tn_3072_7225_4096,Gemm_Hipblaslt_TN_9619,0.316407
GemmTunableOp_Half_TN,tn_14336_7190_4096,Gemm_Hipblaslt_TN_9139,1.40555
GemmTunableOp_Half_TN,tn_4096_1961_7168,Gemm_Hipblaslt_TN_9645,0.213433
GemmTunableOp_Half_TN,tn_3072_7327_4096,Gemm_Hipblaslt_TN_9787,0.329709
GemmTunableOp_Half_TN,tn_4096_3586_2048,Gemm_Hipblaslt_TN_9696,0.106881
GemmTunableOp_Half_TN,tn_3072_168_4096,Gemm_Rocblas_621294165,0.0188337
GemmTunableOp_Half_TN,tn_4096_7139_2048,Gemm_Hipblaslt_TN_9212,0.210247
GemmTunableOp_Half_TN,tn_14336_104_4096,Gemm_Rocblas_621286493,0.0406081
GemmTunableOp_Half_TN,tn_4096_1589_7168,Gemm_Hipblaslt_TN_9265,0.182155
GemmTunableOp_Half_TN,tn_14336_7248_4096,Gemm_Hipblaslt_TN_9683,1.41032
GemmTunableOp_Half_TN,tn_4096_7191_2048,Gemm_Hipblaslt_TN_9743,0.211114
GemmTunableOp_Half_TN,tn_64128_255_4096,Gemm_Rocblas_621294648,0.292522
GemmTunableOp_Half_TN,tn_3072_1902_4096,Gemm_Hipblaslt_TN_9613,0.0954529
GemmTunableOp_Half_TN,tn_4096_7023_7168,Gemm_Hipblaslt_TN_9694,0.674465
GemmTunableOp_Half_TN,tn_3072_7248_4096,Gemm_Hipblaslt_TN_9619,0.312115
GemmTunableOp_Half_TN,tn_4096_1842_7168,Gemm_Hipblaslt_TN_9268,0.208638
GemmTunableOp_Half_TN,tn_16000_232_8192,Gemm_Rocblas_621294217,0.16003
GemmTunableOp_Half_TN,tn_14336_3647_4096,Gemm_Hipblaslt_TN_9187,0.737282
GemmTunableOp_Half_TN,tn_4096_160_2048,Gemm_Rocblas_621286442,0.0132498
GemmTunableOp_Half_TN,tn_14336_5089_4096,Gemm_Hipblaslt_TN_9677,0.986907
GemmTunableOp_Half_TN,tn_4096_1829_7168,Gemm_Hipblaslt_TN_9137,0.207639
GemmTunableOp_Half_TN,tn_4096_3478_7168,Gemm_Hipblaslt_TN_9697,0.33766
GemmTunableOp_Half_TN,tn_3072_1643_4096,Gemm_Hipblaslt_TN_9561,0.0894644
GemmTunableOp_Half_TN,tn_3072_7118_4096,Gemm_Hipblaslt_TN_9619,0.311171
GemmTunableOp_Half_TN,tn_14336_3588_4096,Gemm_Hipblaslt_TN_9697,0.73298
GemmTunableOp_Half_TN,tn_4096_5301_2048,Gemm_Hipblaslt_TN_9808,0.171821
GemmTunableOp_Half_TN,tn_14336_3602_4096,Gemm_Hipblaslt_TN_9677,0.736029
GemmTunableOp_Half_TN,tn_4096_1796_7168,Gemm_Hipblaslt_TN_9268,0.204246
GemmTunableOp_Half_TN,tn_3072_3773_4096,Gemm_Hipblaslt_TN_9800,0.166561
GemmTunableOp_Half_TN,tn_3072_5100_4096,Gemm_Hipblaslt_TN_9726,0.21787
GemmTunableOp_Half_TN,tn_14336_1707_4096,Gemm_Hipblaslt_TN_9677,0.360814
GemmTunableOp_Half_TN,tn_14336_5410_4096,Gemm_Rocblas_621294492,1.06351
GemmTunableOp_Half_TN,tn_4096_6979_2048,Gemm_Hipblaslt_TN_9732,0.205522
GemmTunableOp_Half_TN,tn_4096_1748_7168,Gemm_Hipblaslt_TN_9673,0.198857
GemmTunableOp_Half_TN,tn_14336_1823_4096,Gemm_Hipblaslt_TN_9192,0.372828
GemmTunableOp_Half_TN,tn_4096_7027_2048,Gemm_Hipblaslt_TN_9814,0.207508
GemmTunableOp_Half_TN,tn_14336_5239_4096,Gemm_Hipblaslt_TN_9223,1.04475
GemmTunableOp_Half_TN,tn_3072_5570_4096,Gemm_Hipblaslt_TN_9710,0.223416
GemmTunableOp_Half_TN,tn_64128_12_4096,Gemm_Rocblas_621286348,0.144411
GemmTunableOp_Half_TN,tn_4096_1862_7168,Gemm_Hipblaslt_TN_9680,0.208214
GemmTunableOp_Half_TN,tn_14336_7206_4096,Gemm_Hipblaslt_TN_9697,1.40382
GemmTunableOp_Half_TN,tn_4096_7340_7168,Gemm_Hipblaslt_TN_9890,0.717341
GemmTunableOp_Half_TN,tn_4096_232_7168,Gemm_Rocblas_621286440,0.0450549
