Gemm_Tune/Meta-Llama-3.1-8B-1000inp/full_tuned2.csv
Validator,PT_VERSION,2.4.0
Validator,ROCM_VERSION,6.1.0.0-82-5fabb4c
Validator,HIPBLASLT_VERSION,0.7.0-1549b021
Validator,GCN_ARCH_NAME,gfx942:sramecc+:xnack-
Validator,ROCBLAS_VERSION,4.1.0-cefa4a9b-dirty
GemmTunableOp_Half_TN,tn_57344_4082_8192,Gemm_Hipblaslt_TN_9936,6.60572
GemmTunableOp_Half_TN,tn_8192_3425_28672,Gemm_Hipblaslt_TN_9732,2.95428
GemmTunableOp_Half_TN,tn_10240_121_8192,Gemm_Hipblaslt_TN_7543,0.0631201
GemmTunableOp_Half_TN,tn_10240_101_8192,Gemm_Rocblas_621294504,0.0595292
GemmTunableOp_Half_TN,tn_8192_1233_28672,Gemm_Hipblaslt_TN_9774,1.18398
GemmTunableOp_Half_TN,tn_8192_3331_8192,Gemm_Hipblaslt_TN_9697,0.745936
GemmTunableOp_Half_TN,tn_8192_1233_8192,Gemm_Hipblaslt_TN_9691,0.298669
GemmTunableOp_Half_TN,tn_8192_1268_28672,Gemm_Hipblaslt_TN_9774,1.19267
GemmTunableOp_Half_TN,tn_8192_116_8192,Gemm_Hipblaslt_TN_9303,0.0539973
GemmTunableOp_Half_TN,tn_8192_1185_8192,Gemm_Hipblaslt_TN_9209,0.294593
GemmTunableOp_Half_TN,tn_8192_2041_8192,Gemm_Hipblaslt_TN_9742,0.477053
GemmTunableOp_Half_TN,tn_57344_111_8192,Gemm_Rocblas_621294530,0.358677
GemmTunableOp_Half_TN,tn_10240_1268_8192,Gemm_Hipblaslt_TN_9192,0.359554
GemmTunableOp_Half_TN,tn_8192_1208_28672,Gemm_Hipblaslt_TN_9774,1.1858
GemmTunableOp_Half_TN,tn_8192_3206_8192,Gemm_Hipblaslt_TN_9697,0.724213
GemmTunableOp_Half_TN,tn_8192_1321_28672,Gemm_Hipblaslt_TN_9774,1.21885
GemmTunableOp_Half_TN,tn_57344_1112_8192,Gemm_Hipblaslt_TN_9774,2.07104
GemmTunableOp_Half_TN,tn_8192_14_8192,Gemm_Hipblaslt_TN_9392,0.0305944
GemmTunableOp_Half_TN,tn_8192_1168_28672,Gemm_Hipblaslt_TN_9774,1.15811
GemmTunableOp_Half_TN,tn_8192_126_28672,Gemm_Hipblaslt_TN_8378,0.20904
GemmTunableOp_Half_TN,tn_8192_3451_28672,Gemm_Hipblaslt_TN_9732,2.95896
GemmTunableOp_Half_TN,tn_8192_3546_28672,Gemm_Hipblaslt_TN_9732,3.02378
GemmTunableOp_Half_TN,tn_8192_1249_28672,Gemm_Hipblaslt_TN_9774,1.19686
GemmTunableOp_Half_TN,tn_10240_1208_8192,Gemm_Hipblaslt_TN_9798,0.351978
GemmTunableOp_Half_TN,tn_8192_3379_28672,Gemm_Hipblaslt_TN_9732,2.9336
GemmTunableOp_Half_TN,tn_10240_113_8192,Gemm_Rocblas_621294504,0.060286
GemmTunableOp_Half_TN,tn_8192_107_8192,Gemm_Hipblaslt_TN_8891,0.052926
GemmTunableOp_Half_TN,tn_57344_1281_8192,Gemm_Hipblaslt_TN_9841,2.35931
GemmTunableOp_Half_TN,tn_10240_3747_8192,Gemm_Hipblaslt_TN_9763,1.06245
GemmTunableOp_Half_TN,tn_57344_1360_8192,Gemm_Hipblaslt_TN_9830,2.57426
GemmTunableOp_Half_TN,tn_10240_1377_8192,Gemm_Hipblaslt_TN_9194,0.395475
GemmTunableOp_Half_TN,tn_57344_4063_8192,Gemm_Hipblaslt_TN_9882,6.68066
GemmTunableOp_Half_TN,tn_8192_1208_8192,Gemm_Hipblaslt_TN_9690,0.296675
GemmTunableOp_Half_TN,tn_8192_3203_28672,Gemm_Hipblaslt_TN_9732,2.86907
GemmTunableOp_Half_TN,tn_57344_2000_8192,Gemm_Hipblaslt_TN_156,3.4991
GemmTunableOp_Half_TN,tn_10240_2000_8192,Gemm_Hipblaslt_TN_9649,0.592736
GemmTunableOp_Half_TN,tn_57344_1000_8192,Gemm_Rocblas_621286801,1.81598
GemmTunableOp_Half_TN,tn_57344_3379_8192,Gemm_Hipblaslt_TN_159,5.7259
GemmTunableOp_Half_TN,tn_10240_2166_8192,Gemm_Hipblaslt_TN_9788,0.641083
GemmTunableOp_Half_TN,tn_57344_132_8192,Gemm_Hipblaslt_TN_9565,0.396349
GemmTunableOp_Half_TN,tn_57344_1104_8192,Gemm_Hipblaslt_TN_9841,2.02829
GemmTunableOp_Half_TN,tn_32000_102_8192,Gemm_Rocblas_621294212,0.21157
GemmTunableOp_Half_TN,tn_57344_1248_8192,Gemm_Hipblaslt_TN_9793,2.35411
GemmTunableOp_Half_TN,tn_10240_1360_8192,Gemm_Hipblaslt_TN_9237,0.393677
GemmTunableOp_Half_TN,tn_10240_130_8192,Gemm_Hipblaslt_TN_7229,0.06745
GemmTunableOp_Half_TN,tn_57344_3274_8192,Gemm_Hipblaslt_TN_9816,5.82995
GemmTunableOp_Half_TN,tn_32000_91_8192,Gemm_Hipblaslt_TN_9482,0.203162
GemmTunableOp_Half_TN,tn_57344_3971_8192,Gemm_Rocblas_621294648,6.63004
GemmTunableOp_Half_TN,tn_8192_3475_8192,Gemm_Hipblaslt_TN_9677,0.770615
GemmTunableOp_Half_TN,tn_10240_1249_8192,Gemm_Hipblaslt_TN_9697,0.359116
GemmTunableOp_Half_TN,tn_10240_1025_8192,Gemm_Hipblaslt_TN_9211,0.308003
GemmTunableOp_Half_TN,tn_32000_119_8192,Gemm_Rocblas_621294212,0.217214
GemmTunableOp_Half_TN,tn_32000_132_8192,Gemm_Hipblaslt_TN_9506,0.244174
GemmTunableOp_Half_TN,tn_57344_1392_8192,Gemm_Hipblaslt_TN_9830,2.59379
GemmTunableOp_Half_TN,tn_8192_12_28672,Gemm_Rocblas_621294224,0.120906
GemmTunableOp_Half_TN,tn_8192_3283_28672,Gemm_Hipblaslt_TN_9684,2.91372
GemmTunableOp_Half_TN,tn_8192_99_28672,Gemm_Hipblaslt_TN_8378,0.196151
GemmTunableOp_Half_TN,tn_10240_3178_8192,Gemm_Hipblaslt_TN_9753,0.880167
GemmTunableOp_Half_TN,tn_32000_104_8192,Gemm_Rocblas_621286475,0.211121
GemmTunableOp_Half_TN,tn_8192_3235_28672,Gemm_Hipblaslt_TN_9732,2.89533
GemmTunableOp_Half_TN,tn_10240_117_8192,Gemm_Rocblas_621294504,0.0628704
GemmTunableOp_Half_TN,tn_57344_1374_8192,Gemm_Hipblaslt_TN_9830,2.57775
GemmTunableOp_Half_TN,tn_8192_1153_28672,Gemm_Hipblaslt_TN_9774,1.14809
GemmTunableOp_Half_TN,tn_8192_1329_8192,Gemm_Hipblaslt_TN_9697,0.314365
GemmTunableOp_Half_TN,tn_10240_3498_8192,Gemm_Rocblas_621294320,1.00922
GemmTunableOp_Half_TN,tn_8192_4083_8192,Gemm_Hipblaslt_TN_9749,0.895786
GemmTunableOp_Half_TN,tn_10240_1281_8192,Gemm_Hipblaslt_TN_9697,0.359207
GemmTunableOp_Half_TN,tn_10240_133_8192,Gemm_Hipblaslt_TN_9367,0.0689293
GemmTunableOp_Half_TN,tn_10240_3619_8192,Gemm_Hipblaslt_TN_9814,1.03059
GemmTunableOp_Half_TN,tn_8192_3235_8192,Gemm_Hipblaslt_TN_9697,0.723394
GemmTunableOp_Half_TN,tn_10240_3000_8192,Gemm_Hipblaslt_TN_9813,0.839224
GemmTunableOp_Half_TN,tn_57344_3400_8192,Gemm_Hipblaslt_TN_9915,5.77953
GemmTunableOp_Half_TN,tn_10240_18_8192,Gemm_Hipblaslt_TN_9415,0.0387502
GemmTunableOp_Half_TN,tn_57344_2015_8192,Gemm_Hipblaslt_TN_9830,3.52307
GemmTunableOp_Half_TN,tn_8192_11_8192,Gemm_Hipblaslt_TN_9392,0.0304747
GemmTunableOp_Half_TN,tn_57344_5_8192,Gemm_Rocblas_621286321,0.249526
GemmTunableOp_Half_TN,tn_10240_3187_8192,Gemm_Hipblaslt_TN_9815,0.876982
GemmTunableOp_Half_TN,tn_8192_5_28672,Gemm_Rocblas_621294224,0.119266
GemmTunableOp_Half_TN,tn_8192_1296_28672,Gemm_Hipblaslt_TN_9774,1.20445
GemmTunableOp_Half_TN,tn_8192_3747_28672,Gemm_Rocblas_621294734,3.26912
GemmTunableOp_Half_TN,tn_10240_25_8192,Gemm_Hipblaslt_TN_9415,0.0400865
GemmTunableOp_Half_TN,tn_10240_2859_8192,Gemm_Hipblaslt_TN_9697,0.781646
GemmTunableOp_Half_TN,tn_8192_3178_28672,Gemm_Hipblaslt_TN_9732,2.8642
GemmTunableOp_Half_TN,tn_8192_3546_8192,Gemm_Hipblaslt_TN_9743,0.776835
GemmTunableOp_Half_TN,tn_8192_3425_8192,Gemm_Hipblaslt_TN_9697,0.755391
GemmTunableOp_Half_TN,tn_8192_124_28672,Gemm_Hipblaslt_TN_8378,0.205805
GemmTunableOp_Half_TN,tn_8192_110_8192,Gemm_Rocblas_621294504,0.0531854
GemmTunableOp_Half_TN,tn_57344_1350_8192,Gemm_Hipblaslt_TN_9830,2.57349
GemmTunableOp_Half_TN,tn_32000_129_8192,Gemm_Hipblaslt_TN_9506,0.243294
GemmTunableOp_Half_TN,tn_10240_17_8192,Gemm_Hipblaslt_TN_9415,0.038792
GemmTunableOp_Half_TN,tn_32000_14_8192,Gemm_Rocblas_621286319,0.137571
GemmTunableOp_Half_TN,tn_8192_104_28672,Gemm_Hipblaslt_TN_8378,0.200836
GemmTunableOp_Half_TN,tn_8192_105_8192,Gemm_Hipblaslt_TN_8891,0.0498644
GemmTunableOp_Half_TN,tn_10240_3651_8192,Gemm_Hipblaslt_TN_9798,1.05312
GemmTunableOp_Half_TN,tn_10240_109_8192,Gemm_Rocblas_621294504,0.0612056
GemmTunableOp_Half_TN,tn_10240_1008_8192,Gemm_Rocblas_621286663,0.297671
GemmTunableOp_Half_TN,tn_10240_1329_8192,Gemm_Hipblaslt_TN_9697,0.364149
GemmTunableOp_Half_TN,tn_32000_256_8192,Gemm_Rocblas_621286993,0.326943
GemmTunableOp_Half_TN,tn_32000_16_8192,Gemm_Rocblas_621294187,0.138945
GemmTunableOp_Half_TN,tn_8192_105_28672,Gemm_Hipblaslt_TN_8378,0.200514
GemmTunableOp_Half_TN,tn_32000_115_8192,Gemm_Rocblas_621286475,0.214997
GemmTunableOp_Half_TN,tn_8192_3139_8192,Gemm_Hipblaslt_TN_9697,0.717014
GemmTunableOp_Half_TN,tn_8192_1367_8192,Gemm_Hipblaslt_TN_9691,0.319036
GemmTunableOp_Half_TN,tn_8192_98_8192,Gemm_Hipblaslt_TN_7157,0.0497911
GemmTunableOp_Half_TN,tn_8192_1276_28672,Gemm_Hipblaslt_TN_9774,1.19736
GemmTunableOp_Half_TN,tn_57344_7_8192,Gemm_Rocblas_621286320,0.251649
GemmTunableOp_Half_TN,tn_10240_3482_8192,Gemm_Hipblaslt_TN_9799,1.00102
GemmTunableOp_Half_TN,tn_8192_3299_8192,Gemm_Hipblaslt_TN_9697,0.746133
GemmTunableOp_Half_TN,tn_8192_1008_8192,Gemm_Rocblas_621286559,0.246859
GemmTunableOp_Half_TN,tn_8192_95_8192,Gemm_Hipblaslt_TN_8891,0.0477297
GemmTunableOp_Half_TN,tn_32000_128_8192,Gemm_Rocblas_621286475,0.216846
GemmTunableOp_Half_TN,tn_10240_3283_8192,Gemm_Hipblaslt_TN_9753,0.888314
GemmTunableOp_Half_TN,tn_8192_21_8192,Gemm_Hipblaslt_TN_9410,0.0324683
GemmTunableOp_Half_TN,tn_8192_23_28672,Gemm_Rocblas_621286354,0.129851
GemmTunableOp_Half_TN,tn_8192_97_28672,Gemm_Hipblaslt_TN_8378,0.194844
GemmTunableOp_Half_TN,tn_32000_103_8192,Gemm_Rocblas_621286475,0.211339
GemmTunableOp_Half_TN,tn_10240_2479_8192,Gemm_Hipblaslt_TN_9697,0.700586
GemmTunableOp_Half_TN,tn_10240_1321_8192,Gemm_Hipblaslt_TN_9697,0.363017
GemmTunableOp_Half_TN,tn_8192_102_28672,Gemm_Hipblaslt_TN_8378,0.198928
GemmTunableOp_Half_TN,tn_8192_2622_28672,Gemm_Hipblaslt_TN_9774,2.37811
GemmTunableOp_Half_TN,tn_57344_129_8192,Gemm_Hipblaslt_TN_9507,0.389101
GemmTunableOp_Half_TN,tn_10240_3491_8192,Gemm_Hipblaslt_TN_9799,1.00427
GemmTunableOp_Half_TN,tn_57344_108_8192,Gemm_Rocblas_621286788,0.357696
GemmTunableOp_Half_TN,tn_57344_2032_8192,Gemm_Hipblaslt_TN_154,3.51969
GemmTunableOp_Half_TN,tn_8192_4090_8192,Gemm_Hipblaslt_TN_9277,0.898722
GemmTunableOp_Half_TN,tn_8192_104_8192,Gemm_Hipblaslt_TN_8891,0.051665
GemmTunableOp_Half_TN,tn_10240_3274_8192,Gemm_Hipblaslt_TN_9753,0.889005
GemmTunableOp_Half_TN,tn_10240_106_8192,Gemm_Hipblaslt_TN_7543,0.0611001
GemmTunableOp_Half_TN,tn_57344_122_8192,Gemm_Rocblas_621286788,0.365086
GemmTunableOp_Half_TN,tn_57344_115_8192,Gemm_Rocblas_621286788,0.362276
GemmTunableOp_Half_TN,tn_8192_2551_28672,Gemm_Hipblaslt_TN_9774,2.34807
GemmTunableOp_Half_TN,tn_8192_2728_28672,Gemm_Rocblas_621286568,2.52389
GemmTunableOp_Half_TN,tn_10240_1313_8192,Gemm_Hipblaslt_TN_9192,0.364502
GemmTunableOp_Half_TN,tn_10240_94_8192,Gemm_Hipblaslt_TN_8095,0.0548827
GemmTunableOp_Half_TN,tn_8192_3619_8192,Gemm_Hipblaslt_TN_9697,0.782916
GemmTunableOp_Half_TN,tn_10240_16_8192,Gemm_Hipblaslt_TN_9411,0.0372857
GemmTunableOp_Half_TN,tn_10240_2802_8192,Gemm_Hipblaslt_TN_9743,0.773867
GemmTunableOp_Half_TN,tn_57344_3491_8192,Gemm_Hipblaslt_TN_159,5.77622
GemmTunableOp_Half_TN,tn_32000_108_8192,Gemm_Rocblas_621294212,0.214522
GemmTunableOp_Half_TN,tn_57344_97_8192,Default,0.350863
GemmTunableOp_Half_TN,tn_57344_2802_8192,Gemm_Hipblaslt_TN_9734,4.99952
GemmTunableOp_Half_TN,tn_8192_3498_28672,Gemm_Hipblaslt_TN_9732,3.00814
GemmTunableOp_Half_TN,tn_8192_16_8192,Gemm_Hipblaslt_TN_9388,0.0307775
GemmTunableOp_Half_TN,tn_10240_3235_8192,Gemm_Hipblaslt_TN_9815,0.880822
GemmTunableOp_Half_TN,tn_8192_1319_28672,Gemm_Hipblaslt_TN_9774,1.22025
GemmTunableOp_Half_TN,tn_8192_19_28672,Gemm_Rocblas_621286354,0.126449
GemmTunableOp_Half_TN,tn_8192_3971_28672,Gemm_Rocblas_621294658,3.40267
GemmTunableOp_Half_TN,tn_8192_96_28672,Gemm_Hipblaslt_TN_8899,0.184266
GemmTunableOp_Half_TN,tn_32000_17_8192,Gemm_Rocblas_621286348,0.14839
GemmTunableOp_Half_TN,tn_8192_1321_8192,Gemm_Hipblaslt_TN_9697,0.316297
GemmTunableOp_Half_TN,tn_32000_120_8192,Gemm_Rocblas_621294212,0.218752
GemmTunableOp_Half_TN,tn_10240_125_8192,Gemm_Hipblaslt_TN_8892,0.0632024
GemmTunableOp_Half_TN,tn_57344_1264_8192,Gemm_Hipblaslt_TN_9827,2.33824
GemmTunableOp_Half_TN,tn_8192_13_28672,Gemm_Rocblas_621294224,0.120175
GemmTunableOp_Half_TN,tn_8192_2032_28672,Gemm_Hipblaslt_TN_9840,1.77499
GemmTunableOp_Half_TN,tn_8192_2274_8192,Gemm_Hipblaslt_TN_9742,0.514628
GemmTunableOp_Half_TN,tn_57344_3290_8192,Gemm_Hipblaslt_TN_9803,5.87282
GemmTunableOp_Half_TN,tn_8192_4000_28672,Gemm_Rocblas_621294634,3.41896
GemmTunableOp_Half_TN,tn_10240_2760_8192,Gemm_Hipblaslt_TN_9743,0.768405
GemmTunableOp_Half_TN,tn_10240_110_8192,Gemm_Hipblaslt_TN_7543,0.0626113
GemmTunableOp_Half_TN,tn_8192_18_8192,Gemm_Hipblaslt_TN_9410,0.0320795
GemmTunableOp_Half_TN,tn_8192_2866_8192,Gemm_Rocblas_621286575,0.654381
GemmTunableOp_Half_TN,tn_8192_2728_8192,Gemm_Hipblaslt_TN_9691,0.646897
GemmTunableOp_Half_TN,tn_8192_17_8192,Gemm_Hipblaslt_TN_9410,0.0319974
GemmTunableOp_Half_TN,tn_10240_3153_8192,Gemm_Hipblaslt_TN_9815,0.878901
GemmTunableOp_Half_TN,tn_8192_106_28672,Gemm_Hipblaslt_TN_8378,0.200032
GemmTunableOp_Half_TN,tn_8192_3000_28672,Gemm_Hipblaslt_TN_9709,2.67075
GemmTunableOp_Half_TN,tn_8192_95_28672,Gemm_Hipblaslt_TN_8899,0.184259
GemmTunableOp_Half_TN,tn_57344_17_8192,Gemm_Rocblas_621286350,0.264628
GemmTunableOp_Half_TN,tn_57344_114_8192,Gemm_Rocblas_621286788,0.360874
GemmTunableOp_Half_TN,tn_8192_4096_8192,Gemm_Rocblas_621294330,0.890168
GemmTunableOp_Half_TN,tn_8192_1185_28672,Gemm_Hipblaslt_TN_9774,1.17045
GemmTunableOp_Half_TN,tn_8192_91_8192,Gemm_Hipblaslt_TN_8095,0.0476058
GemmTunableOp_Half_TN,tn_8192_2692_28672,Gemm_Rocblas_621286579,2.51393
GemmTunableOp_Half_TN,tn_8192_1224_28672,Gemm_Hipblaslt_TN_9774,1.18528
GemmTunableOp_Half_TN,tn_8192_1286_28672,Gemm_Hipblaslt_TN_9774,1.20077
GemmTunableOp_Half_TN,tn_8192_3120_8192,Gemm_Hipblaslt_TN_9793,0.703755
GemmTunableOp_Half_TN,tn_8192_130_28672,Gemm_Hipblaslt_TN_8662,0.219895
GemmTunableOp_Half_TN,tn_57344_19_8192,Gemm_Rocblas_621286350,0.268285
GemmTunableOp_Half_TN,tn_8192_3331_28672,Gemm_Hipblaslt_TN_9684,2.94325
GemmTunableOp_Half_TN,tn_32000_122_8192,Gemm_Rocblas_621286475,0.219048
GemmTunableOp_Half_TN,tn_57344_1217_8192,Gemm_Hipblaslt_TN_9827,2.32322
GemmTunableOp_Half_TN,tn_32000_94_8192,Gemm_Rocblas_621294212,0.203457
GemmTunableOp_Half_TN,tn_10240_116_8192,Gemm_Rocblas_621294504,0.0622617
GemmTunableOp_Half_TN,tn_57344_3754_8192,Gemm_Hipblaslt_TN_9747,6.46626
GemmTunableOp_Half_TN,tn_8192_4025_8192,Gemm_Hipblaslt_TN_9753,0.870496
GemmTunableOp_Half_TN,tn_32000_133_8192,Gemm_Hipblaslt_TN_9506,0.245787
GemmTunableOp_Half_TN,tn_57344_112_8192,Gemm_Rocblas_621286788,0.359385
GemmTunableOp_Half_TN,tn_57344_2664_8192,Gemm_Rocblas_621286739,4.63153
GemmTunableOp_Half_TN,tn_10240_1374_8192,Gemm_Hipblaslt_TN_9278,0.395439
GemmTunableOp_Half_TN,tn_8192_106_8192,Gemm_Rocblas_621294504,0.0529563
GemmTunableOp_Half_TN,tn_8192_4000_8192,Gemm_Hipblaslt_TN_9815,0.871455
GemmTunableOp_Half_TN,tn_57344_3206_8192,Gemm_Hipblaslt_TN_9817,5.57178
GemmTunableOp_Half_TN,tn_8192_135_8192,Gemm_Hipblaslt_TN_9306,0.0584749
GemmStridedBatchedTunableOp_Half_TN,tn_1272_1272_128_B_64,Gemm_Rocblas_621286252,0.140704
GemmStridedBatchedTunableOp_Half_TN,tn_1360_1360_128_B_64,Gemm_Rocblas_621286412,0.149738
GemmStridedBatchedTunableOp_Half_TN,tn_1208_1208_128_B_64,Gemm_Rocblas_621294106,0.128956
GemmStridedBatchedTunableOp_Half_TN,tn_1089_1089_128_B_64,Gemm_Hipblaslt_TN_6879,0.112336
GemmStridedBatchedTunableOp_Half_TN,tn_1271_1271_128_B_64,Gemm_Hipblaslt_TN_6884,0.143024
GemmStridedBatchedTunableOp_Half_TN,tn_1048_1048_128_B_64,Gemm_Rocblas_621294725,0.104515
GemmStridedBatchedTunableOp_Half_TN,tn_1216_1216_128_B_64,Gemm_Rocblas_621294106,0.123124
GemmStridedBatchedTunableOp_Half_TN,tn_1192_1192_128_B_64,Gemm_Rocblas_621294106,0.126174
GemmStridedBatchedTunableOp_Half_TN,tn_1345_1345_128_B_64,Gemm_Rocblas_621286412,0.162034
GemmStridedBatchedTunableOp_Half_TN,tn_1013_1013_128_B_64,Gemm_Hipblaslt_TN_6879,0.0984066
GemmStridedBatchedTunableOp_Half_TN,tn_1329_1329_128_B_64,Gemm_Rocblas_621286412,0.158291
GemmStridedBatchedTunableOp_Half_TN,tn_1286_1286_128_B_64,Gemm_Hipblaslt_TN_6884,0.146835
GemmStridedBatchedTunableOp_Half_TN,tn_1024_1024_128_B_64,Gemm_Rocblas_621286412,0.0671326
GemmStridedBatchedTunableOp_Half_TN,tn_1281_1281_128_B_64,Gemm_Hipblaslt_TN_6879,0.150986
GemmStridedBatchedTunableOp_Half_TN,tn_1280_1280_128_B_64,Gemm_Hipblaslt_TN_158,0.115778
GemmStridedBatchedTunableOp_Half_TN,tn_1319_1319_128_B_64,Gemm_Rocblas_621294109,0.154146
GemmStridedBatchedTunableOp_Half_TN,tn_1279_1279_128_B_64,Gemm_Hipblaslt_TN_6879,0.142282
GemmStridedBatchedTunableOp_Half_TN,tn_1161_1161_128_B_64,Gemm_Hipblaslt_TN_6879,0.126497
GemmStridedBatchedTunableOp_Half_TN,tn_1335_1335_128_B_64,Gemm_Rocblas_621294109,0.158985
GemmStridedBatchedTunableOp_Half_TN,tn_1248_1248_128_B_64,Gemm_Rocblas_621294110,0.125798
GemmStridedBatchedTunableOp_Half_TN,tn_1160_1160_128_B_64,Gemm_Rocblas_621294106,0.123832
GemmStridedBatchedTunableOp_Half_TN,tn_1137_1137_128_B_64,Gemm_Rocblas_621294725,0.120793
GemmStridedBatchedTunableOp_Half_TN,tn_1185_1185_128_B_64,Gemm_Hipblaslt_TN_6879,0.129713
GemmStridedBatchedTunableOp_Half_TN,tn_1383_1383_128_B_64,Gemm_Rocblas_621294106,0.171869
GemmTunableOp_Half_TN,tn_8192_4082_8192,Gemm_Hipblaslt_TN_9223,0.898902
GemmTunableOp_Half_TN,tn_57344_101_8192,Gemm_Rocblas_621286477,0.344687
GemmTunableOp_Half_TN,tn_10240_2639_8192,Gemm_Hipblaslt_TN_9743,0.746597
GemmTunableOp_Half_TN,tn_57344_3153_8192,Gemm_Hipblaslt_TN_9818,5.61526
GemmTunableOp_Half_TN,tn_10240_100_8192,Gemm_Rocblas_621286764,0.0599973
GemmTunableOp_Half_TN,tn_8192_20_28672,Gemm_Rocblas_621286354,0.12829
GemmTunableOp_Half_TN,tn_57344_2760_8192,Gemm_Hipblaslt_TN_156,4.90452
GemmTunableOp_Half_TN,tn_8192_109_28672,Gemm_Hipblaslt_TN_8378,0.203022
GemmTunableOp_Half_TN,tn_57344_2549_8192,Default,4.38978
GemmTunableOp_Half_TN,tn_8192_3498_8192,Gemm_Hipblaslt_TN_9697,0.793084
GemmTunableOp_Half_TN,tn_57344_106_8192,Gemm_Rocblas_621294214,0.34875
GemmTunableOp_Half_TN,tn_8192_3379_8192,Gemm_Hipblaslt_TN_9187,0.772542
GemmTunableOp_Half_TN,tn_57344_107_8192,Gemm_Rocblas_621294214,0.346799
GemmTunableOp_Half_TN,tn_10240_126_8192,Gemm_Rocblas_621294504,0.0636951
GemmTunableOp_Half_TN,tn_8192_3251_8192,Gemm_Hipblaslt_TN_9743,0.730239
GemmTunableOp_Half_TN,tn_57344_1280_8192,Default,2.35997
GemmTunableOp_Half_TN,tn_10240_103_8192,Gemm_Rocblas_621294504,0.0596808
GemmTunableOp_Half_TN,tn_10240_104_8192,Gemm_Rocblas_621294504,0.0603762
GemmTunableOp_Half_TN,tn_10240_1297_8192,Gemm_Hipblaslt_TN_9189,0.362406
GemmTunableOp_Half_TN,tn_57344_3642_8192,Gemm_Hipblaslt_TN_9752,6.42861
GemmTunableOp_Half_TN,tn_8192_1374_28672,Gemm_Hipblaslt_TN_9799,1.28185
GemmTunableOp_Half_TN,tn_8192_1286_8192,Gemm_Rocblas_621294315,0.312468
GemmTunableOp_Half_TN,tn_8192_3187_28672,Gemm_Hipblaslt_TN_9684,2.89502
GemmTunableOp_Half_TN,tn_57344_1377_8192,Gemm_Hipblaslt_TN_9832,2.5976
GemmTunableOp_Half_TN,tn_8192_3619_28672,Gemm_Hipblaslt_TN_9732,3.06465
GemmTunableOp_Half_TN,tn_57344_3603_8192,Gemm_Hipblaslt_TN_9908,6.43174
GemmTunableOp_Half_TN,tn_8192_108_8192,Gemm_Hipblaslt_TN_8891,0.053644
GemmTunableOp_Half_TN,tn_57344_4025_8192,Gemm_Rocblas_621286894,6.72613
GemmTunableOp_Half_TN,tn_10240_98_8192,Gemm_Hipblaslt_TN_7543,0.0595509
GemmTunableOp_Half_TN,tn_10240_97_8192,Gemm_Hipblaslt_TN_7543,0.0589644
GemmTunableOp_Half_TN,tn_10240_1185_8192,Gemm_Hipblaslt_TN_9798,0.346663
GemmTunableOp_Half_TN,tn_10240_3411_8192,Gemm_Rocblas_621286580,1.01905
GemmTunableOp_Half_TN,tn_8192_2274_28672,Gemm_Hipblaslt_TN_9771,2.2594
GemmTunableOp_Half_TN,tn_8192_103_8192,Gemm_Hipblaslt_TN_8891,0.0491972
GemmTunableOp_Half_TN,tn_57344_3747_8192,Gemm_Hipblaslt_TN_9908,6.53859
GemmTunableOp_Half_TN,tn_57344_98_8192,Gemm_Rocblas_621286477,0.342568
GemmTunableOp_Half_TN,tn_8192_1281_28672,Gemm_Hipblaslt_TN_9774,1.2007
GemmTunableOp_Half_TN,tn_10240_1000_8192,Gemm_Hipblaslt_TN_9714,0.30087
GemmTunableOp_Half_TN,tn_8192_1104_28672,Gemm_Hipblaslt_TN_9762,1.06392
GemmTunableOp_Half_TN,tn_57344_20_8192,Gemm_Rocblas_621286351,0.271434
GemmTunableOp_Half_TN,tn_10240_3400_8192,Gemm_Hipblaslt_TN_9743,1.0128
GemmTunableOp_Half_TN,tn_57344_109_8192,Gemm_Rocblas_621286477,0.35045
GemmTunableOp_Half_TN,tn_8192_3555_28672,Gemm_Hipblaslt_TN_9732,3.06587
GemmTunableOp_Half_TN,tn_8192_92_8192,Gemm_Hipblaslt_TN_8197,0.046773
GemmTunableOp_Half_TN,tn_8192_2914_8192,Gemm_Rocblas_621294320,0.688787
GemmTunableOp_Half_TN,tn_8192_3482_8192,Gemm_Hipblaslt_TN_9743,0.777535
GemmTunableOp_Half_TN,tn_10240_2866_8192,Gemm_Hipblaslt_TN_9743,0.798067
GemmTunableOp_Half_TN,tn_57344_110_8192,Gemm_Rocblas_621286477,0.350879
GemmTunableOp_Half_TN,tn_8192_20_8192,Gemm_Hipblaslt_TN_9410,0.0325262
GemmTunableOp_Half_TN,tn_8192_9_28672,Gemm_Rocblas_621294224,0.118773
GemmTunableOp_Half_TN,tn_8192_2717_28672,Gemm_Rocblas_621286568,2.53424
GemmTunableOp_Half_TN,tn_8192_18_28672,Gemm_Rocblas_621286354,0.130083
GemmTunableOp_Half_TN,tn_8192_3642_8192,Gemm_Hipblaslt_TN_9697,0.806223
GemmTunableOp_Half_TN,tn_8192_3140_8192,Gemm_Hipblaslt_TN_9697,0.722503
GemmTunableOp_Half_TN,tn_32000_107_8192,Gemm_Rocblas_621294212,0.211902
GemmTunableOp_Half_TN,tn_57344_104_8192,Gemm_Rocblas_621286477,0.345751
GemmTunableOp_Half_TN,tn_8192_3203_8192,Gemm_Hipblaslt_TN_9697,0.730471
GemmTunableOp_Half_TN,tn_57344_1297_8192,Gemm_Hipblaslt_TN_9827,2.40381
GemmTunableOp_Half_TN,tn_8192_1264_8192,Gemm_Rocblas_621294320,0.302846
GemmTunableOp_Half_TN,tn_10240_1361_8192,Gemm_Hipblaslt_TN_9284,0.39892
GemmTunableOp_Half_TN,tn_8192_118_28672,Gemm_Hipblaslt_TN_8378,0.206021
GemmTunableOp_Half_TN,tn_57344_2692_8192,Gemm_Hipblaslt_TN_9805,4.98583
GemmTunableOp_Half_TN,tn_8192_1265_28672,Gemm_Hipblaslt_TN_9774,1.19628
GemmTunableOp_Half_TN,tn_8192_3274_28672,Gemm_Rocblas_621286589,2.93704
GemmTunableOp_Half_TN,tn_10240_1248_8192,Gemm_Hipblaslt_TN_9189,0.355858
GemmTunableOp_Half_TN,tn_57344_3619_8192,Gemm_Hipblaslt_TN_9908,6.4518
GemmTunableOp_Half_TN,tn_8192_125_28672,Gemm_Hipblaslt_TN_8378,0.208903
GemmTunableOp_Half_TN,tn_8192_3411_28672,Gemm_Hipblaslt_TN_9696,3.00053
GemmTunableOp_Half_TN,tn_8192_21_28672,Gemm_Rocblas_621294226,0.130979
GemmTunableOp_Half_TN,tn_10240_20_8192,Gemm_Hipblaslt_TN_9415,0.0393512
GemmTunableOp_Half_TN,tn_10240_3379_8192,Gemm_Hipblaslt_TN_9697,1.01067
GemmTunableOp_Half_TN,tn_8192_10_28672,Gemm_Rocblas_621286325,0.119508
GemmTunableOp_Half_TN,tn_57344_21_8192,Gemm_Rocblas_621286351,0.27202
GemmTunableOp_Half_TN,tn_8192_3000_8192,Gemm_Hipblaslt_TN_9182,0.69598
GemmTunableOp_Half_TN,tn_57344_91_8192,Gemm_Hipblaslt_TN_9481,0.33414
GemmTunableOp_Half_TN,tn_10240_2041_8192,Gemm_Rocblas_621286569,0.615026
GemmTunableOp_Half_TN,tn_10240_92_8192,Gemm_Hipblaslt_TN_9304,0.0553549
GemmTunableOp_Half_TN,tn_10240_2549_8192,Gemm_Hipblaslt_TN_9743,0.743905
GemmTunableOp_Half_TN,tn_10240_1271_8192,Gemm_Hipblaslt_TN_9743,0.360981
GemmTunableOp_Half_TN,tn_57344_1389_8192,Gemm_Hipblaslt_TN_9830,2.63065
GemmTunableOp_Half_TN,tn_8192_129_28672,Gemm_Hipblaslt_TN_8662,0.223945
GemmTunableOp_Half_TN,tn_57344_126_8192,Gemm_Rocblas_621286477,0.35554
GemmTunableOp_Half_TN,tn_10240_4090_8192,Gemm_Hipblaslt_TN_9743,1.16017
GemmTunableOp_Half_TN,tn_57344_127_8192,Gemm_Rocblas_621286477,0.353606
GemmTunableOp_Half_TN,tn_8192_13_8192,Gemm_Hipblaslt_TN_9392,0.0305977
GemmTunableOp_Half_TN,tn_57344_10_8192,Gemm_Rocblas_621286321,0.258702
GemmTunableOp_Half_TN,tn_10240_4096_8192,Gemm_Hipblaslt_TN_9743,1.14684
GemmTunableOp_Half_TN,tn_10240_9_8192,Gemm_Hipblaslt_TN_9411,0.0373202
GemmTunableOp_Half_TN,tn_32000_7_8192,Gemm_Rocblas_621286319,0.134416
GemmTunableOp_Half_TN,tn_8192_2479_8192,Gemm_Rocblas_621294314,0.60757
GemmTunableOp_Half_TN,tn_8192_129_8192,Gemm_Hipblaslt_TN_9306,0.0573948
GemmTunableOp_Half_TN,tn_8192_111_8192,Gemm_Hipblaslt_TN_8891,0.0509125
GemmTunableOp_Half_TN,tn_10240_23_8192,Gemm_Hipblaslt_TN_9415,0.0397053
GemmTunableOp_Half_TN,tn_10240_14_8192,Gemm_Hipblaslt_TN_9411,0.0374395
GemmTunableOp_Half_TN,tn_8192_115_28672,Gemm_Hipblaslt_TN_8378,0.204689
GemmTunableOp_Half_TN,tn_57344_3000_8192,Gemm_Rocblas_621294476,5.09792
GemmTunableOp_Half_TN,tn_57344_1319_8192,Gemm_Hipblaslt_TN_9827,2.41797
GemmTunableOp_Half_TN,tn_8192_5_8192,Gemm_Hipblaslt_TN_9388,0.0302472
GemmTunableOp_Half_TN,tn_8192_1256_28672,Gemm_Rocblas_621294353,1.20293
GemmTunableOp_Half_TN,tn_8192_3626_8192,Gemm_Hipblaslt_TN_9697,0.800833
GemmTunableOp_Half_TN,tn_57344_1286_8192,Gemm_Hipblaslt_TN_9847,2.4089
GemmTunableOp_Half_TN,tn_57344_2866_8192,Default,5.14195
GemmTunableOp_Half_TN,tn_8192_2717_8192,Gemm_Rocblas_621286580,0.643819
GemmTunableOp_Half_TN,tn_57344_125_8192,Gemm_Rocblas_621294214,0.35696
GemmTunableOp_Half_TN,tn_8192_1112_8192,Gemm_Hipblaslt_TN_9195,0.266999
GemmTunableOp_Half_TN,tn_57344_3203_8192,Gemm_Hipblaslt_TN_9817,5.63807
GemmTunableOp_Half_TN,tn_8192_3603_28672,Gemm_Hipblaslt_TN_9732,3.05633
GemmTunableOp_Half_TN,tn_8192_1350_28672,Gemm_Hipblaslt_TN_9799,1.27393
GemmTunableOp_Half_TN,tn_8192_1008_28672,Gemm_Hipblaslt_TN_9665,1.03843
GemmTunableOp_Half_TN,tn_57344_3347_8192,Gemm_Hipblaslt_TN_9816,5.9835
GemmTunableOp_Half_TN,tn_57344_13_8192,Gemm_Hipblaslt_TN_9405,0.259149
GemmTunableOp_Half_TN,tn_8192_24_8192,Gemm_Hipblaslt_TN_9410,0.03296
GemmTunableOp_Half_TN,tn_57344_118_8192,Gemm_Rocblas_621294214,0.353414
GemmTunableOp_Half_TN,tn_10240_4025_8192,Gemm_Hipblaslt_TN_9743,1.11524
GemmTunableOp_Half_TN,tn_8192_3482_28672,Gemm_Hipblaslt_TN_9732,3.00462
GemmTunableOp_Half_TN,tn_10240_3603_8192,Gemm_Hipblaslt_TN_9814,1.04804
GemmTunableOp_Half_TN,tn_10240_1224_8192,Gemm_Hipblaslt_TN_9697,0.355977
GemmTunableOp_Half_TN,tn_10240_2551_8192,Gemm_Hipblaslt_TN_9677,0.74216
GemmTunableOp_Half_TN,tn_57344_1313_8192,Gemm_Hipblaslt_TN_9847,2.39608
GemmTunableOp_Half_TN,tn_10240_114_8192,Gemm_Rocblas_621286764,0.0619318
GemmTunableOp_Half_TN,tn_10240_2274_8192,Gemm_Hipblaslt_TN_9697,0.665382
GemmTunableOp_Half_TN,tn_8192_3747_8192,Gemm_Hipblaslt_TN_9768,0.846646
GemmTunableOp_Half_TN,tn_57344_1160_8192,Gemm_Hipblaslt_TN_9827,2.30594
GemmTunableOp_Half_TN,tn_57344_16_8192,Gemm_Hipblaslt_TN_9398,0.262218
GemmTunableOp_Half_TN,tn_8192_98_28672,Gemm_Hipblaslt_TN_8378,0.197673
GemmTunableOp_Half_TN,tn_10240_111_8192,Gemm_Rocblas_621294504,0.0602175
GemmTunableOp_Half_TN,tn_57344_124_8192,Default,0.356779
GemmTunableOp_Half_TN,tn_57344_99_8192,Gemm_Rocblas_621294214,0.343335
GemmTunableOp_Half_TN,tn_10240_120_8192,Gemm_Hipblaslt_TN_7543,0.063091
GemmTunableOp_Half_TN,tn_8192_4091_28672,Gemm_Rocblas_621286894,3.48728
GemmTunableOp_Half_TN,tn_32000_105_8192,Gemm_Rocblas_621286475,0.210819
GemmTunableOp_Half_TN,tn_8192_4025_28672,Gemm_Rocblas_621294658,3.4666
GemmTunableOp_Half_TN,tn_57344_102_8192,Gemm_Rocblas_621286477,0.34677
GemmTunableOp_Half_TN,tn_32000_101_8192,Gemm_Rocblas_621286475,0.207931
GemmTunableOp_Half_TN,tn_57344_131_8192,Gemm_Hipblaslt_TN_9507,0.396099
GemmTunableOp_Half_TN,tn_57344_121_8192,Gemm_Rocblas_621286477,0.354552
GemmTunableOp_Half_TN,tn_8192_3785_28672,Gemm_Rocblas_621294734,3.32947
GemmTunableOp_Half_TN,tn_8192_3347_28672,Gemm_Hipblaslt_TN_9732,2.94934
GemmTunableOp_Half_TN,tn_8192_1217_8192,Gemm_Hipblaslt_TN_9799,0.296926
GemmTunableOp_Half_TN,tn_8192_3274_8192,Gemm_Hipblaslt_TN_9798,0.755207
GemmTunableOp_Half_TN,tn_57344_135_8192,Gemm_Hipblaslt_TN_9507,0.399283
GemmTunableOp_Half_TN,tn_10240_2015_8192,Gemm_Hipblaslt_TN_9649,0.608339
GemmTunableOp_Half_TN,tn_57344_1249_8192,Gemm_Hipblaslt_TN_9827,2.36569
GemmTunableOp_Half_TN,tn_10240_127_8192,Gemm_Hipblaslt_TN_7157,0.0621715
GemmTunableOp_Half_TN,tn_8192_2859_8192,Gemm_Rocblas_621286580,0.662013
GemmTunableOp_Half_TN,tn_57344_1201_8192,Default,2.32497
GemmTunableOp_Half_TN,tn_8192_123_8192,Gemm_Hipblaslt_TN_8891,0.0531481
GemmTunableOp_Half_TN,tn_8192_1271_28672,Gemm_Rocblas_621286579,1.20173
GemmTunableOp_Half_TN,tn_10240_118_8192,Gemm_Rocblas_621286764,0.0621546
GemmTunableOp_Half_TN,tn_10240_4035_8192,Gemm_Hipblaslt_TN_9743,1.14525
GemmTunableOp_Half_TN,tn_57344_2962_8192,Gemm_Rocblas_621286734,5.10121
GemmTunableOp_Half_TN,tn_8192_25_8192,Gemm_Hipblaslt_TN_9415,0.0334344
GemmTunableOp_Half_TN,tn_57344_96_8192,Gemm_Hipblaslt_TN_9478,0.332245
GemmTunableOp_Half_TN,tn_8192_3475_28672,Gemm_Hipblaslt_TN_9732,3.01002
GemmTunableOp_Half_TN,tn_10240_1160_8192,Gemm_Hipblaslt_TN_9798,0.346789
GemmTunableOp_Half_TN,tn_8192_93_28672,Gemm_Hipblaslt_TN_8899,0.186187
GemmTunableOp_Half_TN,tn_8192_4083_28672,Gemm_Rocblas_621286905,3.4819
GemmTunableOp_Half_TN,tn_8192_121_8192,Gemm_Hipblaslt_TN_8891,0.0517787
GemmTunableOp_Half_TN,tn_8192_1000_8192,Gemm_Hipblaslt_TN_9207,0.246878
GemmTunableOp_Half_TN,tn_10240_128_8192,Gemm_Rocblas_621294504,0.0602156
GemmTunableOp_Half_TN,tn_10240_3754_8192,Gemm_Hipblaslt_TN_9763,1.08656
GemmTunableOp_Half_TN,tn_10240_132_8192,Gemm_Hipblaslt_TN_9367,0.0670794
GemmTunableOp_Half_TN,tn_8192_117_8192,Gemm_Hipblaslt_TN_8891,0.0516314
GemmTunableOp_Half_TN,tn_57344_3299_8192,Gemm_Rocblas_621286901,5.91698
GemmTunableOp_Half_TN,tn_8192_3162_28672,Gemm_Hipblaslt_TN_9731,2.89424
GemmTunableOp_Half_TN,tn_8192_127_28672,Gemm_Hipblaslt_TN_8378,0.209598
GemmTunableOp_Half_TN,tn_57344_1321_8192,Gemm_Hipblaslt_TN_9847,2.4037
GemmTunableOp_Half_TN,tn_8192_22_8192,Gemm_Hipblaslt_TN_9410,0.0327571
GemmTunableOp_Half_TN,tn_57344_4083_8192,Gemm_Rocblas_621294658,6.75394
GemmTunableOp_Half_TN,tn_57344_1367_8192,Gemm_Hipblaslt_TN_9830,2.60326
GemmTunableOp_Half_TN,tn_8192_114_8192,Gemm_Hipblaslt_TN_8891,0.0510778
GemmTunableOp_Half_TN,tn_8192_4063_8192,Gemm_Rocblas_621294330,0.905031
GemmTunableOp_Half_TN,tn_10240_4000_8192,Gemm_Hipblaslt_TN_9743,1.14793
GemmTunableOp_Half_TN,tn_8192_2859_28672,Gemm_Hipblaslt_TN_9690,2.64676
GemmTunableOp_Half_TN,tn_8192_107_28672,Gemm_Hipblaslt_TN_8378,0.203407
GemmTunableOp_Half_TN,tn_32000_121_8192,Gemm_Rocblas_621286475,0.218269
GemmTunableOp_Half_TN,tn_8192_120_8192,Gemm_Hipblaslt_TN_8891,0.053491
GemmTunableOp_Half_TN,tn_10240_4091_8192,Gemm_Hipblaslt_TN_9743,1.14684
GemmTunableOp_Half_TN,tn_10240_1265_8192,Gemm_Hipblaslt_TN_9814,0.359688
GemmTunableOp_Half_TN,tn_8192_2866_28672,Gemm_Hipblaslt_TN_9674,2.6458
GemmTunableOp_Half_TN,tn_8192_4090_28672,Gemm_Rocblas_621294648,3.49199
GemmTunableOp_Half_TN,tn_8192_3299_28672,Gemm_Rocblas_621286589,2.95908
GemmTunableOp_Half_TN,tn_10240_1112_8192,Gemm_Rocblas_621286683,0.320633
GemmTunableOp_Half_TN,tn_32000_131_8192,Gemm_Hipblaslt_TN_9506,0.240097
GemmTunableOp_Half_TN,tn_10240_3369_8192,Gemm_Hipblaslt_TN_9674,1.00853
GemmTunableOp_Half_TN,tn_32000_114_8192,Gemm_Hipblaslt_TN_9583,0.215897
GemmTunableOp_Half_TN,tn_8192_111_28672,Gemm_Hipblaslt_TN_8378,0.200943
GemmTunableOp_Half_TN,tn_10240_1389_8192,Gemm_Hipblaslt_TN_9284,0.403733
GemmStridedBatchedTunableOp_Half_TN,tn_1168_1168_128_B_64,Gemm_Rocblas_621286397,0.120068
GemmStridedBatchedTunableOp_Half_TN,tn_1009_1009_128_B_64,Gemm_Hipblaslt_TN_6879,0.0997654
GemmStridedBatchedTunableOp_Half_TN,tn_1224_1224_128_B_64,Gemm_Rocblas_621286397,0.130982
GemmStridedBatchedTunableOp_Half_TN,tn_1008_1008_128_B_64,Gemm_Hipblaslt_TN_153,0.0929342
GemmStridedBatchedTunableOp_Half_TN,tn_1368_1368_128_B_64,Gemm_Rocblas_621294109,0.158087
GemmStridedBatchedTunableOp_Half_TN,tn_1041_1041_128_B_64,Gemm_Rocblas_621294725,0.102777
GemmStridedBatchedTunableOp_Half_TN,tn_1297_1297_128_B_64,Gemm_Rocblas_621294109,0.152803
GemmStridedBatchedTunableOp_Half_TN,tn_1153_1153_128_B_64,Gemm_Rocblas_621286397,0.126671
GemmStridedBatchedTunableOp_Half_TN,tn_1377_1377_128_B_64,Gemm_Rocblas_621294109,0.170737
GemmStridedBatchedTunableOp_Half_TN,tn_1112_1112_128_B_64,Gemm_Rocblas_621294725,0.113243
GemmStridedBatchedTunableOp_Half_TN,tn_1119_1119_128_B_64,Gemm_Hipblaslt_TN_6879,0.114602
GemmStridedBatchedTunableOp_Half_TN,tn_1382_1382_128_B_64,Gemm_Rocblas_621294109,0.164294
GemmStridedBatchedTunableOp_Half_TN,tn_1276_1276_128_B_64,Gemm_Hipblaslt_TN_6879,0.140246
GemmStridedBatchedTunableOp_Half_TN,tn_1176_1176_128_B_64,Gemm_Rocblas_621294106,0.124222
GemmStridedBatchedTunableOp_Half_TN,tn_1073_1073_128_B_64,Gemm_Hipblaslt_TN_6879,0.108959
GemmStridedBatchedTunableOp_Half_TN,tn_1104_1104_128_B_64,Gemm_Rocblas_621294728,0.107748
GemmStridedBatchedTunableOp_Half_TN,tn_1233_1233_128_B_64,Gemm_Hipblaslt_TN_6879,0.137756
GemmStridedBatchedTunableOp_Half_TN,tn_1028_1028_128_B_64,Gemm_Rocblas_621294725,0.101983
GemmStridedBatchedTunableOp_Half_TN,tn_1096_1096_128_B_64,Gemm_Rocblas_621294725,0.111
GemmStridedBatchedTunableOp_Half_TN,tn_1301_1301_128_B_64,Gemm_Rocblas_621294109,0.153995
GemmStridedBatchedTunableOp_Half_TN,tn_1457_1457_128_B_64,Gemm_Rocblas_621294106,0.185739
GemmStridedBatchedTunableOp_Half_TN,tn_1201_1201_128_B_64,Gemm_Hipblaslt_TN_6879,0.131668
GemmStridedBatchedTunableOp_Half_TN,tn_1000_1000_128_B_64,Gemm_Hipblaslt_TN_153,0.0921837
GemmStridedBatchedTunableOp_Half_TN,tn_1169_1169_128_B_64,Gemm_Hipblaslt_TN_6879,0.127355
GemmStridedBatchedTunableOp_Half_TN,tn_1361_1361_128_B_64,Gemm_Rocblas_621294109,0.164007
GemmTunableOp_Half_TN,tn_8192_3206_28672,Gemm_Hipblaslt_TN_9732,2.88064
GemmTunableOp_Half_TN,tn_32000_22_8192,Gemm_Rocblas_621286350,0.146151
GemmTunableOp_Half_TN,tn_10240_3425_8192,Gemm_Hipblaslt_TN_9209,0.995888
GemmTunableOp_Half_TN,tn_8192_2549_28672,Gemm_Hipblaslt_TN_9774,2.33982
GemmTunableOp_Half_TN,tn_10240_2692_8192,Gemm_Hipblaslt_TN_9743,0.75974
GemmTunableOp_Half_TN,tn_8192_4035_8192,Gemm_Hipblaslt_TN_9753,0.886335
GemmTunableOp_Half_TN,tn_57344_24_8192,Gemm_Rocblas_621286351,0.264925
GemmTunableOp_Half_TN,tn_10240_3290_8192,Gemm_Hipblaslt_TN_9815,0.891792
GemmTunableOp_Half_TN,tn_8192_1276_8192,Gemm_Hipblaslt_TN_9690,0.302544
GemmTunableOp_Half_TN,tn_8192_2962_8192,Gemm_Hipblaslt_TN_9209,0.68034
GemmTunableOp_Half_TN,tn_10240_1367_8192,Gemm_Hipblaslt_TN_9193,0.399826
GemmTunableOp_Half_TN,tn_10240_2728_8192,Gemm_Hipblaslt_TN_9697,0.764065
GemmTunableOp_Half_TN,tn_8192_4063_28672,Gemm_Rocblas_621294636,3.46151
GemmTunableOp_Half_TN,tn_57344_1121_8192,Gemm_Hipblaslt_TN_9774,2.06885
GemmTunableOp_Half_TN,tn_57344_2639_8192,Gemm_Hipblaslt_TN_159,4.62873
GemmTunableOp_Half_TN,tn_10240_1217_8192,Gemm_Hipblaslt_TN_9697,0.351068
GemmTunableOp_Half_TN,tn_10240_3347_8192,Gemm_Hipblaslt_TN_9753,0.895
GemmTunableOp_Half_TN,tn_10240_3546_8192,Gemm_Hipblaslt_TN_9763,1.02178
GemmTunableOp_Half_TN,tn_32000_126_8192,Gemm_Rocblas_621286475,0.217023
GemmTunableOp_Half_TN,tn_32000_95_8192,Gemm_Rocblas_621286475,0.199623
GemmTunableOp_Half_TN,tn_10240_3140_8192,Gemm_Hipblaslt_TN_9815,0.87579
GemmTunableOp_Half_TN,tn_8192_1297_28672,Gemm_Hipblaslt_TN_9774,1.20205
GemmTunableOp_Half_TN,tn_8192_3347_8192,Gemm_Hipblaslt_TN_9743,0.751078
GemmTunableOp_Half_TN,tn_8192_94_8192,Gemm_Hipblaslt_TN_8891,0.0478626
GemmTunableOp_Half_TN,tn_8192_1389_8192,Gemm_Hipblaslt_TN_9690,0.325363
GemmTunableOp_Half_TN,tn_10240_24_8192,Gemm_Hipblaslt_TN_9415,0.0396115
GemmTunableOp_Half_TN,tn_8192_1392_28672,Gemm_Hipblaslt_TN_9799,1.28695
GemmTunableOp_Half_TN,tn_57344_4035_8192,Gemm_Hipblaslt_TN_9936,6.65531
GemmTunableOp_Half_TN,tn_8192_3400_28672,Gemm_Hipblaslt_TN_9732,2.96772
GemmTunableOp_Half_TN,tn_8192_1360_28672,Gemm_Hipblaslt_TN_9799,1.27786
GemmTunableOp_Half_TN,tn_57344_3626_8192,Gemm_Hipblaslt_TN_9752,6.27332
GemmTunableOp_Half_TN,tn_8192_3754_28672,Gemm_Rocblas_621294734,3.29955
GemmTunableOp_Half_TN,tn_8192_1271_8192,Gemm_Hipblaslt_TN_9691,0.302988
GemmTunableOp_Half_TN,tn_8192_103_28672,Gemm_Hipblaslt_TN_8378,0.197249
GemmTunableOp_Half_TN,tn_8192_1281_8192,Gemm_Rocblas_621294426,0.314449
GemmTunableOp_Half_TN,tn_8192_2802_28672,Gemm_Rocblas_621286579,2.54599
GemmTunableOp_Half_TN,tn_8192_133_28672,Gemm_Hipblaslt_TN_8662,0.22071
GemmTunableOp_Half_TN,tn_10240_93_8192,Gemm_Hipblaslt_TN_8095,0.0555728
GemmTunableOp_Half_TN,tn_8192_3859_8192,Gemm_Hipblaslt_TN_9704,0.858514
GemmTunableOp_Half_TN,tn_8192_121_28672,Gemm_Hipblaslt_TN_8378,0.204487
GemmTunableOp_Half_TN,tn_57344_116_8192,Gemm_Rocblas_621286477,0.34883
GemmTunableOp_Half_TN,tn_10240_2664_8192,Gemm_Hipblaslt_TN_9743,0.739724
GemmTunableOp_Half_TN,tn_8192_3290_28672,Gemm_Hipblaslt_TN_9732,2.93571
GemmTunableOp_Half_TN,tn_8192_93_8192,Gemm_Hipblaslt_TN_8197,0.0471032
GemmTunableOp_Half_TN,tn_10240_2914_8192,Gemm_Hipblaslt_TN_9753,0.819639
GemmTunableOp_Half_TN,tn_57344_3235_8192,Gemm_Hipblaslt_TN_9817,5.56591
GemmTunableOp_Half_TN,tn_32000_117_8192,Gemm_Rocblas_621294212,0.21397
GemmTunableOp_Half_TN,tn_8192_116_28672,Gemm_Hipblaslt_TN_8378,0.202662
GemmTunableOp_Half_TN,tn_57344_2728_8192,Gemm_Hipblaslt_TN_156,4.84373
GemmTunableOp_Half_TN,tn_10240_7_8192,Gemm_Hipblaslt_TN_9411,0.0369307
GemmTunableOp_Half_TN,tn_32000_124_8192,Gemm_Rocblas_621294212,0.217401
GemmTunableOp_Half_TN,tn_8192_3178_8192,Gemm_Hipblaslt_TN_9814,0.727873
GemmTunableOp_Half_TN,tn_57344_2622_8192,Gemm_Rocblas_621294470,4.63261
GemmTunableOp_Half_TN,tn_32000_13_8192,Gemm_Rocblas_621286319,0.133638
GemmTunableOp_Half_TN,tn_32000_125_8192,Gemm_Rocblas_621286475,0.217317
GemmTunableOp_Half_TN,tn_10240_1319_8192,Gemm_Hipblaslt_TN_9697,0.365758
GemmTunableOp_Half_TN,tn_8192_3785_8192,Gemm_Hipblaslt_TN_9753,0.838794
GemmTunableOp_Half_TN,tn_8192_3153_28672,Gemm_Hipblaslt_TN_9732,2.8735
GemmTunableOp_Half_TN,tn_10240_1280_8192,Gemm_Hipblaslt_TN_9697,0.360879
GemmTunableOp_Half_TN,tn_8192_135_28672,Gemm_Hipblaslt_TN_8099,0.222258
GemmTunableOp_Half_TN,tn_57344_4000_8192,Gemm_Hipblaslt_TN_9882,6.62328
GemmTunableOp_Half_TN,tn_32000_123_8192,Gemm_Rocblas_621286475,0.215238
GemmTunableOp_Half_TN,tn_32000_12_8192,Gemm_Rocblas_621294187,0.133756
GemmTunableOp_Half_TN,tn_8192_1201_8192,Gemm_Hipblaslt_TN_9691,0.298614
GemmTunableOp_Half_TN,tn_10240_19_8192,Gemm_Hipblaslt_TN_9415,0.0389546
GemmTunableOp_Half_TN,tn_32000_109_8192,Gemm_Rocblas_621286475,0.211173
GemmTunableOp_Half_TN,tn_8192_10_8192,Gemm_Hipblaslt_TN_9392,0.0304491
GemmTunableOp_Half_TN,tn_57344_3369_8192,Gemm_Hipblaslt_TN_159,5.6402
GemmTunableOp_Half_TN,tn_8192_3626_28672,Gemm_Hipblaslt_TN_9732,3.06007
GemmTunableOp_Half_TN,tn_32000_10_8192,Default,0.135082
GemmTunableOp_Half_TN,tn_57344_3187_8192,Gemm_Hipblaslt_TN_9803,5.5588
GemmTunableOp_Half_TN,tn_57344_3555_8192,Gemm_Hipblaslt_TN_9937,5.90105
GemmTunableOp_Half_TN,tn_8192_3642_28672,Gemm_Hipblaslt_TN_9731,3.04961
GemmTunableOp_Half_TN,tn_10240_3139_8192,Gemm_Hipblaslt_TN_9220,0.869297
GemmTunableOp_Half_TN,tn_8192_17_28672,Gemm_Rocblas_621286354,0.128865
GemmTunableOp_Half_TN,tn_8192_11_28672,Gemm_Rocblas_621294224,0.119656
GemmTunableOp_Half_TN,tn_8192_1350_8192,Gemm_Hipblaslt_TN_9799,0.321239
GemmTunableOp_Half_TN,tn_57344_3251_8192,Gemm_Hipblaslt_TN_9803,5.57635
GemmTunableOp_Half_TN,tn_8192_96_8192,Gemm_Hipblaslt_TN_8197,0.047436
GemmTunableOp_Half_TN,tn_57344_1233_8192,Gemm_Hipblaslt_TN_9068,2.32746
GemmTunableOp_Half_TN,tn_57344_3120_8192,Gemm_Hipblaslt_TN_9817,5.53039
GemmTunableOp_Half_TN,tn_8192_1329_28672,Gemm_Hipblaslt_TN_9774,1.20833
GemmTunableOp_Half_TN,tn_32000_106_8192,Gemm_Rocblas_621294212,0.209195
GemmTunableOp_Half_TN,tn_8192_4096_28672,Gemm_Rocblas_621294643,3.46846
GemmTunableOp_Half_TN,tn_8192_3400_8192,Gemm_Hipblaslt_TN_9697,0.753395
GemmTunableOp_Half_TN,tn_57344_3140_8192,Gemm_Hipblaslt_TN_9803,5.52956
GemmTunableOp_Half_TN,tn_10240_95_8192,Gemm_Hipblaslt_TN_8095,0.0535411
GemmTunableOp_Half_TN,tn_8192_3369_28672,Gemm_Hipblaslt_TN_9684,2.94671
GemmTunableOp_Half_TN,tn_8192_3754_8192,Gemm_Rocblas_621286590,0.829855
GemmTunableOp_Half_TN,tn_57344_4091_8192,Gemm_Hipblaslt_TN_9758,6.67952
GemmTunableOp_Half_TN,tn_8192_1224_8192,Gemm_Hipblaslt_TN_9691,0.299421
GemmTunableOp_Half_TN,tn_57344_2041_8192,Gemm_Hipblaslt_TN_9882,3.55738
GemmTunableOp_Half_TN,tn_10240_5_8192,Gemm_Rocblas_621294049,0.0365774
GemmTunableOp_Half_TN,tn_57344_95_8192,Gemm_Hipblaslt_TN_9478,0.330013
GemmTunableOp_Half_TN,tn_8192_2551_8192,Gemm_Rocblas_621286580,0.609504
GemmTunableOp_Half_TN,tn_32000_20_8192,Gemm_Rocblas_621286350,0.14643
GemmTunableOp_Half_TN,tn_8192_2479_28672,Gemm_Hipblaslt_TN_9775,2.38648
GemmTunableOp_Half_TN,tn_8192_3120_28672,Gemm_Hipblaslt_TN_9793,2.84603
GemmTunableOp_Half_TN,tn_8192_24_28672,Gemm_Rocblas_621286354,0.129126
GemmTunableOp_Half_TN,tn_32000_21_8192,Default,0.147367
GemmTunableOp_Half_TN,tn_57344_3651_8192,Gemm_Hipblaslt_TN_9937,6.39983
GemmTunableOp_Half_TN,tn_10240_1264_8192,Gemm_Hipblaslt_TN_9192,0.361961
GemmTunableOp_Half_TN,tn_32000_11_8192,Gemm_Rocblas_621294187,0.133724
GemmTunableOp_Half_TN,tn_8192_3859_28672,Gemm_Rocblas_621294291,3.39115
GemmTunableOp_Half_TN,tn_8192_9_8192,Gemm_Hipblaslt_TN_9388,0.0302993
GemmTunableOp_Half_TN,tn_8192_3971_8192,Gemm_Hipblaslt_TN_9753,0.870587
GemmTunableOp_Half_TN,tn_10240_12_8192,Gemm_Hipblaslt_TN_9411,0.0372485
GemmTunableOp_Half_TN,tn_8192_1313_8192,Gemm_Hipblaslt_TN_9691,0.318412
GemmTunableOp_Half_TN,tn_8192_1168_8192,Gemm_Hipblaslt_TN_9691,0.293616
GemmTunableOp_Half_TN,tn_57344_3498_8192,Gemm_Hipblaslt_TN_159,5.83991
GemmTunableOp_Half_TN,tn_10240_22_8192,Gemm_Hipblaslt_TN_9415,0.0395286
GemmTunableOp_Half_TN,tn_57344_3178_8192,Gemm_Hipblaslt_TN_9817,5.53424
GemmTunableOp_Half_TN,tn_57344_2166_8192,Default,3.92705
GemmTunableOp_Half_TN,tn_57344_3785_8192,Gemm_Hipblaslt_TN_9937,6.47824
GemmTunableOp_Half_TN,tn_8192_1280_8192,Gemm_Rocblas_621294426,0.299598
GemmTunableOp_Half_TN,tn_8192_1377_28672,Gemm_Hipblaslt_TN_9799,1.27357
GemmTunableOp_Half_TN,tn_8192_12_8192,Gemm_Hipblaslt_TN_9392,0.0306113
GemmTunableOp_Half_TN,tn_8192_97_8192,Gemm_Hipblaslt_TN_8891,0.049423
GemmTunableOp_Half_TN,tn_8192_1112_28672,Gemm_Hipblaslt_TN_9762,1.05862
GemmTunableOp_Half_TN,tn_10240_2717_8192,Gemm_Hipblaslt_TN_9697,0.76353
GemmTunableOp_Half_TN,tn_8192_7_8192,Gemm_Hipblaslt_TN_9392,0.0303357
GemmTunableOp_Half_TN,tn_57344_92_8192,Gemm_Hipblaslt_TN_9481,0.329215
GemmTunableOp_Half_TN,tn_32000_9_8192,Gemm_Rocblas_621294189,0.132987
GemmTunableOp_Half_TN,tn_57344_3546_8192,Gemm_Hipblaslt_TN_159,5.82308
GemmTunableOp_Half_TN,tn_57344_119_8192,Gemm_Rocblas_621286477,0.352108
GemmTunableOp_Half_TN,tn_57344_1256_8192,Gemm_Hipblaslt_TN_9068,2.35605
GemmTunableOp_Half_TN,tn_32000_19_8192,Gemm_Rocblas_621286350,0.146921
GemmTunableOp_Half_TN,tn_8192_1361_8192,Gemm_Rocblas_621286684,0.322129
GemmTunableOp_Half_TN,tn_8192_2015_28672,Gemm_Hipblaslt_TN_9737,1.75232
GemmTunableOp_Half_TN,tn_57344_103_8192,Gemm_Rocblas_621294214,0.342456
GemmTunableOp_Half_TN,tn_8192_112_28672,Gemm_Hipblaslt_TN_8378,0.19995
GemmTunableOp_Half_TN,tn_8192_23_8192,Gemm_Hipblaslt_TN_9415,0.0328414
GemmTunableOp_Half_TN,tn_8192_131_28672,Gemm_Hipblaslt_TN_8662,0.221195
GemmTunableOp_Half_TN,tn_8192_1160_28672,Gemm_Hipblaslt_TN_9774,1.15457
GemmTunableOp_Half_TN,tn_8192_2802_8192,Gemm_Hipblaslt_TN_9672,0.650986
GemmTunableOp_Half_TN,tn_57344_1008_8192,Gemm_Rocblas_621294543,1.80795
GemmTunableOp_Half_TN,tn_8192_3715_28672,Default,3.22047
GemmTunableOp_Half_TN,tn_8192_2664_8192,Gemm_Hipblaslt_TN_9774,0.621428
GemmTunableOp_Half_TN,tn_8192_1264_28672,Gemm_Hipblaslt_TN_9774,1.19664
GemmTunableOp_Half_TN,tn_32000_112_8192,Gemm_Rocblas_621294212,0.21196
GemmTunableOp_Half_TN,tn_10240_96_8192,Gemm_Hipblaslt_TN_8095,0.0544537
GemmTunableOp_Half_TN,tn_10240_3331_8192,Gemm_Hipblaslt_TN_9815,0.890619
GemmTunableOp_Half_TN,tn_8192_133_8192,Gemm_Hipblaslt_TN_9306,0.0583796
GemmTunableOp_Half_TN,tn_8192_113_28672,Gemm_Hipblaslt_TN_8378,0.201783
GemmTunableOp_Half_TN,tn_57344_14_8192,Gemm_Rocblas_621294053,0.256703
GemmTunableOp_Half_TN,tn_8192_91_28672,Gemm_Hipblaslt_TN_8899,0.182361
GemmTunableOp_Half_TN,tn_8192_19_8192,Gemm_Hipblaslt_TN_9410,0.0321176
GemmTunableOp_Half_TN,tn_57344_2717_8192,Gemm_Hipblaslt_TN_9733,4.94742
GemmTunableOp_Half_TN,tn_57344_130_8192,Gemm_Hipblaslt_TN_9507,0.396508
GemmTunableOp_Half_TN,tn_57344_123_8192,Gemm_Rocblas_621286477,0.352639
GemmTunableOp_Half_TN,tn_8192_127_8192,Gemm_Hipblaslt_TN_8891,0.0542434
GemmTunableOp_Half_TN,tn_8192_125_8192,Gemm_Hipblaslt_TN_8891,0.0542415
GemmTunableOp_Half_TN,tn_10240_2032_8192,Gemm_Rocblas_621286569,0.605035
GemmTunableOp_Half_TN,tn_8192_2032_8192,Gemm_Hipblaslt_TN_9840,0.471285
GemmTunableOp_Half_TN,tn_8192_7_28672,Gemm_Rocblas_621294224,0.119815
GemmTunableOp_Half_TN,tn_32000_18_8192,Gemm_Rocblas_621286350,0.146146
GemmTunableOp_Half_TN,tn_10240_3971_8192,Gemm_Hipblaslt_TN_9743,1.10763
GemmTunableOp_Half_TN,tn_10240_3475_8192,Gemm_Hipblaslt_TN_9209,1.00844
GemmTunableOp_Half_TN,tn_10240_1153_8192,Gemm_Hipblaslt_TN_9697,0.343838
GemmTunableOp_Half_TN,tn_8192_3187_8192,Gemm_Hipblaslt_TN_9697,0.726712
GemmTunableOp_Half_TN,tn_57344_2859_8192,Gemm_Rocblas_621294486,5.07652
GemmTunableOp_Half_TN,tn_10240_124_8192,Gemm_Rocblas_621294504,0.0622457
GemmTunableOp_Half_TN,tn_8192_120_28672,Gemm_Hipblaslt_TN_8378,0.204196
GemmTunableOp_Half_TN,tn_8192_4082_28672,Gemm_Rocblas_621294643,3.46851
GemmTunableOp_Half_TN,tn_8192_118_8192,Gemm_Hipblaslt_TN_8891,0.052998
GemmTunableOp_Half_TN,tn_8192_94_28672,Gemm_Hipblaslt_TN_8899,0.182636
GemmTunableOp_Half_TN,tn_32000_113_8192,Gemm_Rocblas_621286475,0.213269
GemmTunableOp_Half_TN,tn_10240_119_8192,Gemm_Rocblas_621286764,0.0619278
GemmTunableOp_Half_TN,tn_10240_3715_8192,Gemm_Hipblaslt_TN_9763,1.06121
GemmTunableOp_Half_TN,tn_8192_122_8192,Gemm_Hipblaslt_TN_8891,0.052227
GemmTunableOp_Half_TN,tn_32000_116_8192,Gemm_Rocblas_621286475,0.213339
GemmTunableOp_Half_TN,tn_8192_1153_8192,Gemm_Hipblaslt_TN_9690,0.292925
GemmTunableOp_Half_TN,tn_8192_109_8192,Gemm_Hipblaslt_TN_8891,0.0524798
GemmTunableOp_Half_TN,tn_8192_1296_8192,Gemm_Hipblaslt_TN_9209,0.31509
GemmTunableOp_Half_TN,tn_8192_122_28672,Gemm_Hipblaslt_TN_8378,0.208587
GemmTunableOp_Half_TN,tn_32000_111_8192,Gemm_Rocblas_621294212,0.213669
GemmTunableOp_Half_TN,tn_8192_3451_8192,Gemm_Hipblaslt_TN_9677,0.755904
GemmTunableOp_Half_TN,tn_8192_3491_28672,Gemm_Hipblaslt_TN_9732,3.00347
GemmTunableOp_Half_TN,tn_57344_1276_8192,Gemm_Hipblaslt_TN_9068,2.35935
GemmTunableOp_Half_TN,tn_57344_1329_8192,Gemm_Hipblaslt_TN_9827,2.39711
GemmTunableOp_Half_TN,tn_57344_22_8192,Gemm_Rocblas_621286351,0.265003
GemmStridedBatchedTunableOp_Half_TN,tn_1268_1268_128_B_64,Gemm_Rocblas_621286397,0.139802
GemmStridedBatchedTunableOp_Half_TN,tn_1249_1249_128_B_64,Gemm_Rocblas_621286397,0.137883
GemmStridedBatchedTunableOp_Half_TN,tn_1473_1473_128_B_64,Gemm_Rocblas_621294106,0.187715
GemmStridedBatchedTunableOp_Half_TN,tn_1321_1321_128_B_64,Gemm_Rocblas_621286412,0.155689
GemmStridedBatchedTunableOp_Half_TN,tn_1015_1015_128_B_64,Gemm_Hipblaslt_TN_6935,0.10098
GemmStridedBatchedTunableOp_Half_TN,tn_1025_1025_128_B_64,Gemm_Hipblaslt_TN_6879,0.100181
GemmStridedBatchedTunableOp_Half_TN,tn_1042_1042_128_B_64,Gemm_Rocblas_621286397,0.105412
GemmStridedBatchedTunableOp_Half_TN,tn_1316_1316_128_B_64,Gemm_Rocblas_621294109,0.148978
GemmStridedBatchedTunableOp_Half_TN,tn_1265_1265_128_B_64,Gemm_Hipblaslt_TN_6879,0.139426
GemmStridedBatchedTunableOp_Half_TN,tn_1039_1039_128_B_64,Gemm_Hipblaslt_TN_6879,0.104225
GemmStridedBatchedTunableOp_Half_TN,tn_1351_1351_128_B_64,Gemm_Rocblas_621286412,0.158743
GemmStridedBatchedTunableOp_Half_TN,tn_1409_1409_128_B_64,Gemm_Rocblas_621294106,0.171142
GemmStridedBatchedTunableOp_Half_TN,tn_1287_1287_128_B_64,Gemm_Hipblaslt_TN_6879,0.151225
GemmStridedBatchedTunableOp_Half_TN,tn_1391_1391_128_B_64,Gemm_Rocblas_621294109,0.166952
GemmStridedBatchedTunableOp_Half_TN,tn_1121_1121_128_B_64,Gemm_Rocblas_621294725,0.113972
GemmStridedBatchedTunableOp_Half_TN,tn_1264_1264_128_B_64,Gemm_Rocblas_621286397,0.12633
GemmStridedBatchedTunableOp_Half_TN,tn_1374_1374_128_B_64,Gemm_Rocblas_621294109,0.160853
GemmStridedBatchedTunableOp_Half_TN,tn_1105_1105_128_B_64,Gemm_Hipblaslt_TN_6879,0.11215
GemmStridedBatchedTunableOp_Half_TN,tn_1393_1393_128_B_64,Gemm_Rocblas_621294109,0.168757
GemmStridedBatchedTunableOp_Half_TN,tn_1217_1217_128_B_64,Gemm_Rocblas_621286397,0.131544
GemmStridedBatchedTunableOp_Half_TN,tn_1313_1313_128_B_64,Gemm_Rocblas_621286412,0.154095
GemmStridedBatchedTunableOp_Half_TN,tn_1144_1144_128_B_64,Gemm_Rocblas_621294725,0.117563
GemmStridedBatchedTunableOp_Half_TN,tn_1489_1489_128_B_64,Gemm_Rocblas_621294106,0.191239
GemmTunableOp_Half_TN,tn_57344_3425_8192,Gemm_Hipblaslt_TN_159,5.75101
GemmTunableOp_Half_TN,tn_10240_122_8192,Gemm_Hipblaslt_TN_8892,0.0609699
GemmTunableOp_Half_TN,tn_10240_3299_8192,Gemm_Hipblaslt_TN_9240,0.886451
GemmTunableOp_Half_TN,tn_57344_3331_8192,Gemm_Hipblaslt_TN_9816,5.87814
GemmTunableOp_Half_TN,tn_8192_3603_8192,Gemm_Hipblaslt_TN_9743,0.777253
GemmTunableOp_Half_TN,tn_8192_1367_28672,Gemm_Hipblaslt_TN_9799,1.26873
GemmTunableOp_Half_TN,tn_10240_1276_8192,Gemm_Hipblaslt_TN_9192,0.355321
GemmTunableOp_Half_TN,tn_10240_1296_8192,Gemm_Hipblaslt_TN_9192,0.355652
GemmTunableOp_Half_TN,tn_57344_23_8192,Gemm_Rocblas_621294194,0.264557
GemmTunableOp_Half_TN,tn_57344_3162_8192,Gemm_Hipblaslt_TN_9803,5.51392
GemmTunableOp_Half_TN,tn_8192_1121_8192,Gemm_Hipblaslt_TN_9195,0.262992
GemmTunableOp_Half_TN,tn_57344_2274_8192,Gemm_Hipblaslt_TN_9757,4.06156
GemmTunableOp_Half_TN,tn_10240_13_8192,Gemm_Hipblaslt_TN_9411,0.0371771
GemmTunableOp_Half_TN,tn_8192_3139_28672,Gemm_Hipblaslt_TN_9732,2.85509
GemmTunableOp_Half_TN,tn_57344_1208_8192,Gemm_Hipblaslt_TN_9827,2.31176
GemmTunableOp_Half_TN,tn_32000_118_8192,Gemm_Rocblas_621286475,0.209955
GemmTunableOp_Half_TN,tn_32000_96_8192,Gemm_Rocblas_621286475,0.195905
GemmTunableOp_Half_TN,tn_8192_128_28672,Gemm_Hipblaslt_TN_8378,0.205358
GemmTunableOp_Half_TN,tn_10240_3451_8192,Gemm_Hipblaslt_TN_9674,0.990645
GemmTunableOp_Half_TN,tn_32000_92_8192,Gemm_Rocblas_621286475,0.194982
GemmTunableOp_Half_TN,tn_32000_24_8192,Gemm_Rocblas_621294578,0.146407
GemmTunableOp_Half_TN,tn_8192_4035_28672,Gemm_Rocblas_621286894,3.39548
GemmTunableOp_Half_TN,tn_8192_1025_28672,Gemm_Hipblaslt_TN_9762,1.0214
GemmTunableOp_Half_TN,tn_10240_115_8192,Gemm_Rocblas_621286764,0.060191
GemmTunableOp_Half_TN,tn_57344_94_8192,Gemm_Hipblaslt_TN_9478,0.331338
GemmTunableOp_Half_TN,tn_8192_1389_28672,Gemm_Hipblaslt_TN_9799,1.27354
GemmTunableOp_Half_TN,tn_10240_105_8192,Gemm_Rocblas_621286764,0.0587783
GemmTunableOp_Half_TN,tn_8192_1268_8192,Gemm_Rocblas_621286683,0.301228
GemmTunableOp_Half_TN,tn_8192_1360_8192,Gemm_Rocblas_621286683,0.318293
GemmTunableOp_Half_TN,tn_10240_1392_8192,Gemm_Hipblaslt_TN_9222,0.39607
GemmTunableOp_Half_TN,tn_8192_2760_8192,Gemm_Hipblaslt_TN_9182,0.638707
GemmTunableOp_Half_TN,tn_8192_1377_8192,Gemm_Rocblas_621294425,0.318417
GemmTunableOp_Half_TN,tn_8192_2760_28672,Gemm_Rocblas_621286667,2.52524
GemmTunableOp_Half_TN,tn_8192_2639_8192,Gemm_Hipblaslt_TN_9774,0.612339
GemmTunableOp_Half_TN,tn_8192_132_28672,Gemm_Hipblaslt_TN_8099,0.216367
GemmTunableOp_Half_TN,tn_8192_132_8192,Gemm_Hipblaslt_TN_9306,0.056159
GemmTunableOp_Half_TN,tn_8192_2914_28672,Gemm_Hipblaslt_TN_9799,2.63187
GemmTunableOp_Half_TN,tn_10240_1233_8192,Gemm_Hipblaslt_TN_9192,0.351108
GemmTunableOp_Half_TN,tn_10240_11_8192,Gemm_Hipblaslt_TN_9411,0.0371927
GemmTunableOp_Half_TN,tn_8192_2000_28672,Gemm_Hipblaslt_TN_9591,1.71995
GemmTunableOp_Half_TN,tn_8192_1297_8192,Gemm_Hipblaslt_TN_9182,0.311861
GemmTunableOp_Half_TN,tn_57344_1224_8192,Gemm_Hipblaslt_TN_9827,2.32233
GemmTunableOp_Half_TN,tn_8192_2000_8192,Gemm_Hipblaslt_TN_9190,0.428009
GemmTunableOp_Half_TN,tn_8192_1000_28672,Gemm_Hipblaslt_TN_9665,1.02254
GemmTunableOp_Half_TN,tn_57344_2479_8192,Default,4.3311
GemmTunableOp_Half_TN,tn_8192_1201_28672,Gemm_Hipblaslt_TN_9774,1.16342
GemmTunableOp_Half_TN,tn_8192_2166_8192,Gemm_Hipblaslt_TN_9763,0.503191
GemmTunableOp_Half_TN,tn_57344_1361_8192,Gemm_Hipblaslt_TN_9830,2.55426
GemmTunableOp_Half_TN,tn_10240_10_8192,Gemm_Hipblaslt_TN_9411,0.0370185
GemmTunableOp_Half_TN,tn_10240_3642_8192,Gemm_Hipblaslt_TN_9814,1.03462
GemmTunableOp_Half_TN,tn_8192_99_8192,Gemm_Hipblaslt_TN_8891,0.0489802
GemmTunableOp_Half_TN,tn_57344_1265_8192,Gemm_Hipblaslt_TN_9827,2.32988
GemmTunableOp_Half_TN,tn_8192_3369_8192,Gemm_Hipblaslt_TN_9697,0.738387
GemmTunableOp_Half_TN,tn_10240_3120_8192,Gemm_Hipblaslt_TN_9655,0.842655
GemmTunableOp_Half_TN,tn_8192_113_8192,Gemm_Hipblaslt_TN_8891,0.0497667
GemmTunableOp_Half_TN,tn_57344_93_8192,Gemm_Hipblaslt_TN_9481,0.329687
GemmTunableOp_Half_TN,tn_32000_97_8192,Gemm_Rocblas_621294212,0.197076
GemmTunableOp_Half_TN,tn_57344_3411_8192,Gemm_Hipblaslt_TN_159,5.70627
GemmTunableOp_Half_TN,tn_8192_2664_28672,Gemm_Hipblaslt_TN_9774,2.36006
GemmTunableOp_Half_TN,tn_57344_3482_8192,Gemm_Hipblaslt_TN_159,5.79858
GemmTunableOp_Half_TN,tn_8192_2622_8192,Gemm_Hipblaslt_TN_9774,0.604598
GemmTunableOp_Half_TN,tn_57344_3283_8192,Gemm_Hipblaslt_TN_9818,5.81764
GemmTunableOp_Half_TN,tn_8192_3283_8192,Gemm_Hipblaslt_TN_9677,0.73288
GemmTunableOp_Half_TN,tn_57344_113_8192,Gemm_Rocblas_621286477,0.348115
GemmTunableOp_Half_TN,tn_8192_102_8192,Gemm_Hipblaslt_TN_8891,0.0497925
GemmTunableOp_Half_TN,tn_8192_1025_8192,Gemm_Hipblaslt_TN_9207,0.255963
GemmTunableOp_Half_TN,tn_8192_1160_8192,Gemm_Hipblaslt_TN_9691,0.292767
GemmTunableOp_Half_TN,tn_8192_3411_8192,Gemm_Hipblaslt_TN_9187,0.742745
GemmTunableOp_Half_TN,tn_10240_108_8192,Gemm_Rocblas_621286764,0.0602348
GemmTunableOp_Half_TN,tn_10240_3859_8192,Gemm_Hipblaslt_TN_9743,1.08039
GemmTunableOp_Half_TN,tn_32000_23_8192,Gemm_Rocblas_621294193,0.145611
GemmTunableOp_Half_TN,tn_32000_110_8192,Gemm_Rocblas_621286475,0.206734
GemmTunableOp_Half_TN,tn_8192_3491_8192,Gemm_Hipblaslt_TN_9677,0.766089
GemmTunableOp_Half_TN,tn_57344_1296_8192,Gemm_Hipblaslt_TN_9841,2.34034
GemmTunableOp_Half_TN,tn_8192_2166_28672,Gemm_Hipblaslt_TN_9762,2.05027
GemmTunableOp_Half_TN,tn_8192_2549_8192,Gemm_Hipblaslt_TN_9774,0.604502
GemmTunableOp_Half_TN,tn_57344_3475_8192,Gemm_Hipblaslt_TN_159,5.72304
GemmTunableOp_Half_TN,tn_8192_1248_28672,Gemm_Hipblaslt_TN_9774,1.18341
GemmTunableOp_Half_TN,tn_10240_3626_8192,Gemm_Hipblaslt_TN_9814,1.03386
GemmTunableOp_Half_TN,tn_57344_128_8192,Default,0.351868
GemmTunableOp_Half_TN,tn_10240_4063_8192,Gemm_Hipblaslt_TN_9743,1.12303
GemmTunableOp_Half_TN,tn_10240_1350_8192,Gemm_Hipblaslt_TN_9237,0.392025
GemmTunableOp_Half_TN,tn_57344_100_8192,Gemm_Rocblas_621286477,0.338734
GemmTunableOp_Half_TN,tn_57344_2551_8192,Gemm_Hipblaslt_TN_9800,4.47266
GemmTunableOp_Half_TN,tn_57344_18_8192,Gemm_Rocblas_621286351,0.263249
GemmTunableOp_Half_TN,tn_8192_1319_8192,Gemm_Hipblaslt_TN_9799,0.314183
GemmTunableOp_Half_TN,tn_8192_14_28672,Gemm_Hipblaslt_TN_9398,0.12122
GemmTunableOp_Half_TN,tn_8192_22_28672,Gemm_Rocblas_621286354,0.125961
GemmTunableOp_Half_TN,tn_10240_3785_8192,Gemm_Hipblaslt_TN_9814,1.05069
GemmTunableOp_Half_TN,tn_57344_12_8192,Gemm_Hipblaslt_TN_9405,0.255054
GemmTunableOp_Half_TN,tn_32000_100_8192,Gemm_Rocblas_621286475,0.197539
GemmTunableOp_Half_TN,tn_57344_4090_8192,Gemm_Hipblaslt_TN_9901,6.64593
GemmTunableOp_Half_TN,tn_57344_1153_8192,Default,2.2609
GemmTunableOp_Half_TN,tn_10240_3162_8192,Gemm_Hipblaslt_TN_9815,0.871148
GemmTunableOp_Half_TN,tn_57344_3139_8192,Gemm_Hipblaslt_TN_9816,5.49204
GemmTunableOp_Half_TN,tn_10240_21_8192,Gemm_Hipblaslt_TN_9415,0.039072
GemmTunableOp_Half_TN,tn_57344_11_8192,Gemm_Hipblaslt_TN_9405,0.252837
GemmTunableOp_Half_TN,tn_10240_2622_8192,Gemm_Hipblaslt_TN_9697,0.72815
GemmTunableOp_Half_TN,tn_8192_1256_8192,Gemm_Rocblas_621294426,0.299953
GemmTunableOp_Half_TN,tn_57344_2914_8192,Gemm_Hipblaslt_TN_9816,4.98403
GemmTunableOp_Half_TN,tn_10240_1104_8192,Gemm_Hipblaslt_TN_9209,0.315128
GemmTunableOp_Half_TN,tn_8192_1374_8192,Gemm_Hipblaslt_TN_9209,0.320148
GemmTunableOp_Half_TN,tn_8192_3140_28672,Gemm_Hipblaslt_TN_9732,2.84938
GemmTunableOp_Half_TN,tn_32000_98_8192,Gemm_Rocblas_621286475,0.198003
GemmTunableOp_Half_TN,tn_8192_2692_8192,Gemm_Rocblas_621294320,0.624957
GemmTunableOp_Half_TN,tn_8192_2962_28672,Gemm_Hipblaslt_TN_9799,2.63934
GemmTunableOp_Half_TN,tn_8192_2041_28672,Gemm_Hipblaslt_TN_9840,1.72997
GemmTunableOp_Half_TN,tn_10240_2962_8192,Gemm_Hipblaslt_TN_9815,0.825817
GemmTunableOp_Half_TN,tn_32000_5_8192,Gemm_Rocblas_621294187,0.13447
GemmTunableOp_Half_TN,tn_8192_1313_28672,Gemm_Hipblaslt_TN_9774,1.19816
GemmTunableOp_Half_TN,tn_8192_100_28672,Gemm_Hipblaslt_TN_8378,0.1963
GemmTunableOp_Half_TN,tn_8192_25_28672,Gemm_Rocblas_621286354,0.125983
GemmTunableOp_Half_TN,tn_10240_131_8192,Gemm_Hipblaslt_TN_9367,0.0664484
GemmTunableOp_Half_TN,tn_8192_1280_28672,Gemm_Rocblas_621286613,1.18808
GemmTunableOp_Half_TN,tn_10240_123_8192,Gemm_Rocblas_621294504,0.0615473
GemmTunableOp_Half_TN,tn_8192_2639_28672,Gemm_Hipblaslt_TN_9774,2.35624
GemmTunableOp_Half_TN,tn_10240_4083_8192,Gemm_Hipblaslt_TN_9743,1.12621
GemmTunableOp_Half_TN,tn_10240_3206_8192,Gemm_Hipblaslt_TN_9753,0.875052
GemmTunableOp_Half_TN,tn_10240_1168_8192,Gemm_Hipblaslt_TN_9697,0.341819
GemmTunableOp_Half_TN,tn_8192_126_8192,Gemm_Hipblaslt_TN_8891,0.0527228
GemmTunableOp_Half_TN,tn_8192_3555_8192,Gemm_Hipblaslt_TN_9743,0.77234
GemmTunableOp_Half_TN,tn_32000_135_8192,Gemm_Hipblaslt_TN_9506,0.23797
GemmTunableOp_Half_TN,tn_32000_99_8192,Gemm_Rocblas_621294212,0.199893
GemmTunableOp_Half_TN,tn_57344_117_8192,Gemm_Rocblas_621294214,0.348933
GemmTunableOp_Half_TN,tn_57344_1168_8192,Gemm_Hipblaslt_TN_9068,2.27531
GemmTunableOp_Half_TN,tn_57344_1268_8192,Gemm_Hipblaslt_TN_9793,2.33651
GemmTunableOp_Half_TN,tn_32000_25_8192,Gemm_Rocblas_621286350,0.146317
GemmTunableOp_Half_TN,tn_8192_110_28672,Gemm_Hipblaslt_TN_8378,0.19547
GemmTunableOp_Half_TN,tn_32000_93_8192,Gemm_Rocblas_621294212,0.196292
GemmTunableOp_Half_TN,tn_57344_3451_8192,Gemm_Hipblaslt_TN_159,5.76479
GemmTunableOp_Half_TN,tn_32000_130_8192,Gemm_Hipblaslt_TN_9506,0.23949
GemmTunableOp_Half_TN,tn_10240_129_8192,Gemm_Hipblaslt_TN_9367,0.0655617
GemmTunableOp_Half_TN,tn_8192_1121_28672,Gemm_Hipblaslt_TN_9774,1.10958
GemmTunableOp_Half_TN,tn_57344_1185_8192,Gemm_Hipblaslt_TN_9827,2.2927
GemmTunableOp_Half_TN,tn_8192_92_28672,Gemm_Hipblaslt_TN_8899,0.180633
GemmTunableOp_Half_TN,tn_8192_114_28672,Gemm_Hipblaslt_TN_8378,0.197763
GemmTunableOp_Half_TN,tn_8192_1248_8192,Gemm_Hipblaslt_TN_9674,0.299318
GemmTunableOp_Half_TN,tn_57344_1025_8192,Gemm_Hipblaslt_TN_9841,1.95022
GemmTunableOp_Half_TN,tn_10240_1256_8192,Gemm_Hipblaslt_TN_9697,0.35379
GemmTunableOp_Half_TN,tn_10240_135_8192,Gemm_Hipblaslt_TN_9367,0.0670353
GemmTunableOp_Half_TN,tn_10240_1121_8192,Gemm_Hipblaslt_TN_9697,0.322447
GemmTunableOp_Half_TN,tn_8192_112_8192,Gemm_Hipblaslt_TN_8891,0.0525777
GemmTunableOp_Half_TN,tn_57344_133_8192,Gemm_Hipblaslt_TN_9507,0.394309
GemmTunableOp_Half_TN,tn_10240_4082_8192,Gemm_Hipblaslt_TN_9814,1.13025
GemmTunableOp_Half_TN,tn_57344_3859_8192,Gemm_Rocblas_621286905,6.48505
GemmTunableOp_Half_TN,tn_8192_3290_8192,Gemm_Hipblaslt_TN_9677,0.731875
GemmTunableOp_Half_TN,tn_32000_127_8192,Gemm_Rocblas_621286475,0.214324
GemmTunableOp_Half_TN,tn_8192_4091_8192,Gemm_Rocblas_621294435,0.882518
GemmTunableOp_Half_TN,tn_8192_1249_8192,Gemm_Hipblaslt_TN_9799,0.298531
GemmTunableOp_Half_TN,tn_8192_3651_28672,Default,3.20361
GemmTunableOp_Half_TN,tn_57344_4096_8192,Gemm_Rocblas_621294486,6.65488
GemmTunableOp_Half_TN,tn_8192_131_8192,Gemm_Hipblaslt_TN_9306,0.0577893
GemmTunableOp_Half_TN,tn_8192_100_8192,Gemm_Hipblaslt_TN_8891,0.0483642
GemmTunableOp_Half_TN,tn_8192_108_28672,Gemm_Hipblaslt_TN_8378,0.198778
GemmTunableOp_Half_TN,tn_8192_16_28672,Gemm_Rocblas_621294224,0.119117
GemmTunableOp_Half_TN,tn_8192_3715_8192,Gemm_Hipblaslt_TN_9193,0.81716
GemmTunableOp_Half_TN,tn_8192_1392_8192,Gemm_Rocblas_621294426,0.320389
GemmTunableOp_Half_TN,tn_8192_1104_8192,Gemm_Hipblaslt_TN_9229,0.260819
GemmTunableOp_Half_TN,tn_8192_117_28672,Gemm_Hipblaslt_TN_8378,0.203067
GemmTunableOp_Half_TN,tn_10240_3203_8192,Gemm_Hipblaslt_TN_9753,0.865103
GemmTunableOp_Half_TN,tn_57344_1271_8192,Gemm_Hipblaslt_TN_9827,2.34954
GemmTunableOp_Half_TN,tn_10240_1286_8192,Gemm_Hipblaslt_TN_9189,0.356564
GemmTunableOp_Half_TN,tn_8192_130_8192,Gemm_Hipblaslt_TN_9306,0.0563219
GemmTunableOp_Half_TN,tn_10240_107_8192,Gemm_Hipblaslt_TN_7543,0.0594395
GemmTunableOp_Half_TN,tn_10240_99_8192,Gemm_Rocblas_621294504,0.0590072
GemmTunableOp_Half_TN,tn_8192_1217_28672,Gemm_Hipblaslt_TN_9774,1.18014
GemmTunableOp_Half_TN,tn_8192_3153_8192,Gemm_Hipblaslt_TN_9677,0.707094
GemmTunableOp_Half_TN,tn_57344_3715_8192,Gemm_Hipblaslt_TN_9922,6.40307
GemmTunableOp_Half_TN,tn_10240_3555_8192,Gemm_Hipblaslt_TN_9928,1.02253
GemmTunableOp_Half_TN,tn_57344_120_8192,Gemm_Rocblas_621286477,0.351987
GemmTunableOp_Half_TN,tn_57344_9_8192,Gemm_Hipblaslt_TN_9404,0.252545
GemmTunableOp_Half_TN,tn_8192_1265_8192,Gemm_Rocblas_621294426,0.299695
GemmTunableOp_Half_TN,tn_8192_101_8192,Gemm_Hipblaslt_TN_8891,0.0495095
GemmTunableOp_Half_TN,tn_10240_3251_8192,Gemm_Hipblaslt_TN_9753,0.879414
GemmTunableOp_Half_TN,tn_10240_91_8192,Gemm_Hipblaslt_TN_8095,0.0527323
GemmTunableOp_Half_TN,tn_8192_119_28672,Gemm_Hipblaslt_TN_8378,0.201014
GemmTunableOp_Half_TN,tn_10240_112_8192,Gemm_Rocblas_621286764,0.060096
GemmTunableOp_Half_TN,tn_8192_123_28672,Gemm_Hipblaslt_TN_8378,0.203732
GemmTunableOp_Half_TN,tn_8192_115_8192,Gemm_Hipblaslt_TN_8891,0.0511207
GemmTunableOp_Half_TN,tn_8192_3162_8192,Gemm_Hipblaslt_TN_9677,0.70326
GemmTunableOp_Half_TN,tn_8192_119_8192,Gemm_Hipblaslt_TN_8891,0.0516404
GemmTunableOp_Half_TN,tn_8192_3251_28672,Gemm_Hipblaslt_TN_9732,2.87239
GemmTunableOp_Half_TN,tn_8192_101_28672,Gemm_Hipblaslt_TN_8378,0.193308
GemmTunableOp_Half_TN,tn_57344_105_8192,Gemm_Rocblas_621294214,0.342637
GemmTunableOp_Half_TN,tn_8192_2015_8192,Gemm_Hipblaslt_TN_9217,0.428517
GemmTunableOp_Half_TN,tn_57344_25_8192,Default,0.265998
GemmTunableOp_Half_TN,tn_8192_1361_28672,Gemm_Hipblaslt_TN_9687,1.26923
GemmTunableOp_Half_TN,tn_8192_128_8192,Gemm_Hipblaslt_TN_8891,0.0534785
GemmTunableOp_Half_TN,tn_10240_1201_8192,Gemm_Hipblaslt_TN_9697,0.345088
GemmTunableOp_Half_TN,tn_8192_3651_8192,Gemm_Hipblaslt_TN_9813,0.808918
GemmTunableOp_Half_TN,tn_10240_102_8192,Gemm_Rocblas_621294504,0.059722
GemmTunableOp_Half_TN,tn_8192_124_8192,Gemm_Hipblaslt_TN_8891,0.0534574
GemmStridedBatchedTunableOp_Half_TN,tn_1152_1152_128_B_64,Gemm_Hipblaslt_TN_9774,0.0981979
GemmStridedBatchedTunableOp_Half_TN,tn_1151_1151_128_B_64,Gemm_Hipblaslt_TN_6879,0.118839
GemmStridedBatchedTunableOp_Half_TN,tn_1080_1080_128_B_64,Gemm_Rocblas_621294725,0.106286
GemmStridedBatchedTunableOp_Half_TN,tn_1341_1341_128_B_64,Gemm_Rocblas_621294109,0.155672
GemmStridedBatchedTunableOp_Half_TN,tn_1057_1057_128_B_64,Gemm_Rocblas_621294725,0.107389
GemmStridedBatchedTunableOp_Half_TN,tn_1367_1367_128_B_64,Gemm_Rocblas_621294109,0.158215
GemmStridedBatchedTunableOp_Half_TN,tn_1389_1389_128_B_64,Gemm_Rocblas_621294109,0.163063
GemmStridedBatchedTunableOp_Half_TN,tn_1038_1038_128_B_64,Gemm_Rocblas_621294725,0.10082
GemmStridedBatchedTunableOp_Half_TN,tn_1296_1296_128_B_64,Gemm_Rocblas_621294551,0.136107
GemmStridedBatchedTunableOp_Half_TN,tn_1128_1128_128_B_64,Gemm_Rocblas_621294725,0.114166
GemmStridedBatchedTunableOp_Half_TN,tn_1441_1441_128_B_64,Gemm_Rocblas_621294106,0.174575
GemmStridedBatchedTunableOp_Half_TN,tn_16_16_128_B_64,Gemm_Rocblas_621286717,0.00667556
GemmStridedBatchedTunableOp_Half_TN,tn_1350_1350_128_B_64,Gemm_Rocblas_621286412,0.154488
GemmStridedBatchedTunableOp_Half_TN,tn_1064_1064_128_B_64,Gemm_Rocblas_621294725,0.102961
GemmStridedBatchedTunableOp_Half_TN,tn_1076_1076_128_B_64,Gemm_Rocblas_621286397,0.108036
GemmStridedBatchedTunableOp_Half_TN,tn_1256_1256_128_B_64,Gemm_Rocblas_621294106,0.131775
GemmStridedBatchedTunableOp_Half_TN,tn_1392_1392_128_B_64,Gemm_Rocblas_621286412,0.148962
GemmStridedBatchedTunableOp_Half_TN,tn_1010_1010_128_B_64,Gemm_Hipblaslt_TN_6879,0.0964034
GemmStridedBatchedTunableOp_Half_TN,tn_1032_1032_128_B_64,Gemm_Rocblas_621294725,0.0996483
GemmStridedBatchedTunableOp_Half_TN,tn_1263_1263_128_B_64,Gemm_Hipblaslt_TN_6879,0.136173
GemmStridedBatchedTunableOp_Half_TN,tn_1022_1022_128_B_64,Gemm_Hipblaslt_TN_6879,0.0975572
GemmStridedBatchedTunableOp_Half_TN,tn_1455_1455_128_B_64,Gemm_Rocblas_621286397,0.179817
GemmStridedBatchedTunableOp_Half_TN,tn_1425_1425_128_B_64,Gemm_Rocblas_621294106,0.173502
GemmStridedBatchedTunableOp_Half_TN,tn_1318_1318_128_B_64,Gemm_Rocblas_621294109,0.151668
GemmStridedBatchedTunableOp_Half_TN,tn_1404_1404_128_B_64,Gemm_Rocblas_621286412,0.16285
