Gemm_Tune/Llama-2-7b-chat-hf-2000inp/full_tuned2.csv
Validator,PT_VERSION,2.4.0
Validator,ROCM_VERSION,6.1.0.0-82-5fabb4c
Validator,HIPBLASLT_VERSION,0.7.0-1549b021
Validator,GCN_ARCH_NAME,gfx942:sramecc+:xnack-
Validator,ROCBLAS_VERSION,4.1.0-cefa4a9b-dirty
GemmTunableOp_Half_TN,tn_4096_1608_14336,Gemm_Hipblaslt_TN_9265,0.360034
GemmTunableOp_Half_TN,tn_4096_1804_4096,Gemm_Hipblaslt_TN_9645,0.11915
GemmTunableOp_Half_TN,tn_28672_3401_4096,Gemm_Hipblaslt_TN_9827,1.36299
GemmTunableOp_Half_TN,tn_4096_1799_14336,Gemm_Hipblaslt_TN_9645,0.409725
GemmTunableOp_Half_TN,tn_28672_1889_4096,Gemm_Hipblaslt_TN_9684,0.812043
GemmTunableOp_Half_TN,tn_4096_1702_4096,Gemm_Hipblaslt_TN_9607,0.108581
GemmTunableOp_Half_TN,tn_4096_3688_14336,Gemm_Hipblaslt_TN_9827,0.719858
GemmTunableOp_Half_TN,tn_4096_1789_4096,Gemm_Hipblaslt_TN_9134,0.117036
GemmTunableOp_Half_TN,tn_4096_1708_4096,Gemm_Hipblaslt_TN_9616,0.105262
GemmTunableOp_Half_TN,tn_4096_3630_14336,Gemm_Hipblaslt_TN_9743,0.697665
GemmTunableOp_Half_TN,tn_28672_1771_4096,Gemm_Hipblaslt_TN_9223,0.742458
GemmTunableOp_Half_TN,tn_4096_3573_14336,Gemm_Hipblaslt_TN_9743,0.689676
GemmTunableOp_Half_TN,tn_4096_1794_14336,Gemm_Hipblaslt_TN_9645,0.407493
GemmTunableOp_Half_TN,tn_6144_1863_4096,Gemm_Hipblaslt_TN_9799,0.164596
GemmTunableOp_Half_TN,tn_28672_1805_4096,Gemm_Hipblaslt_TN_9684,0.805032
GemmTunableOp_Half_TN,tn_4096_5447_14336,Gemm_Hipblaslt_TN_9799,1.15527
GemmTunableOp_Half_TN,tn_4096_3710_14336,Gemm_Hipblaslt_TN_9827,0.722053
GemmTunableOp_Half_TN,tn_4096_1874_4096,Gemm_Hipblaslt_TN_9645,0.121079
GemmTunableOp_Half_TN,tn_4096_1873_4096,Gemm_Hipblaslt_TN_9645,0.120455
GemmTunableOp_Half_TN,tn_6144_7093_4096,Gemm_Hipblaslt_TN_9677,0.597318
GemmTunableOp_Half_TN,tn_28672_7130_4096,Gemm_Hipblaslt_TN_9893,2.92638
GemmTunableOp_Half_TN,tn_6144_3651_4096,Gemm_Hipblaslt_TN_9690,0.327073
GemmTunableOp_Half_TN,tn_4096_1810_14336,Gemm_Hipblaslt_TN_9645,0.408106
GemmTunableOp_Half_TN,tn_28672_3768_4096,Gemm_Hipblaslt_TN_9827,1.52088
GemmTunableOp_Half_TN,tn_28672_1804_4096,Gemm_Hipblaslt_TN_9683,0.79749
GemmTunableOp_Half_TN,tn_6144_5125_4096,Gemm_Hipblaslt_TN_9753,0.438941
GemmTunableOp_Half_TN,tn_4096_3427_4096,Gemm_Hipblaslt_TN_9743,0.195753
GemmTunableOp_Half_TN,tn_4096_6761_14336,Gemm_Hipblaslt_TN_9743,1.38044
GemmTunableOp_Half_TN,tn_4096_80_14336,Gemm_Hipblaslt_TN_8036,0.0394742
GemmTunableOp_Half_TN,tn_12288_2272_4096,Gemm_Hipblaslt_TN_9677,0.392532
GemmTunableOp_Half_TN,tn_4096_1774_14336,Gemm_Hipblaslt_TN_9645,0.396641
GemmTunableOp_Half_TN,tn_4096_7138_4096,Gemm_Hipblaslt_TN_9694,0.410003
GemmTunableOp_Half_TN,tn_4096_3612_4096,Gemm_Hipblaslt_TN_9814,0.201776
GemmTunableOp_Half_TN,tn_28672_1930_4096,Gemm_Hipblaslt_TN_9846,0.831204
GemmTunableOp_Half_TN,tn_28672_5219_4096,Gemm_Hipblaslt_TN_9893,2.14607
GemmTunableOp_Half_TN,tn_28672_7118_4096,Gemm_Hipblaslt_TN_9919,2.92588
GemmTunableOp_Half_TN,tn_28672_5680_4096,Gemm_Hipblaslt_TN_9919,2.37742
GemmTunableOp_Half_TN,tn_4096_7130_4096,Gemm_Hipblaslt_TN_9743,0.402831
GemmTunableOp_Half_TN,tn_4096_3592_14336,Gemm_Hipblaslt_TN_9192,0.693324
GemmTunableOp_Half_TN,tn_128256_150_4096,Gemm_Hipblaslt_TN_9709,0.48078
GemmTunableOp_Half_TN,tn_28672_3388_4096,Gemm_Hipblaslt_TN_9827,1.35373
GemmTunableOp_Half_TN,tn_28672_1764_4096,Gemm_Hipblaslt_TN_9223,0.744874
GemmTunableOp_Half_TN,tn_4096_7077_4096,Gemm_Hipblaslt_TN_9743,0.403418
GemmTunableOp_Half_TN,tn_6144_1827_4096,Gemm_Rocblas_621286684,0.167058
GemmTunableOp_Half_TN,tn_4096_1742_14336,Gemm_Hipblaslt_TN_9645,0.394679
GemmTunableOp_Half_TN,tn_6144_3456_4096,Gemm_Rocblas_621286566,0.31063
GemmTunableOp_Half_TN,tn_28672_7108_4096,Gemm_Hipblaslt_TN_9860,2.92787
GemmTunableOp_Half_TN,tn_22016_2337_4096,Gemm_Hipblaslt_TN_9846,0.794016
GemmTunableOp_Half_TN,tn_28672_1859_4096,Gemm_Hipblaslt_TN_9683,0.806863
GemmTunableOp_Half_TN,tn_28672_184_4096,Gemm_Hipblaslt_TN_7286,0.0990795
GemmTunableOp_Half_TN,tn_4096_1882_4096,Gemm_Hipblaslt_TN_9645,0.121661
GemmTunableOp_Half_TN,tn_4096_3682_4096,Gemm_Hipblaslt_TN_9813,0.213515
GemmTunableOp_Half_TN,tn_6144_1838_4096,Gemm_Rocblas_621294425,0.164461
GemmTunableOp_Half_TN,tn_6144_3589_4096,Gemm_Hipblaslt_TN_9570,0.322759
GemmTunableOp_Half_TN,tn_28672_1708_4096,Gemm_Rocblas_621294420,0.734777
GemmTunableOp_Half_TN,tn_22016_2161_4096,Gemm_Hipblaslt_TN_9827,0.684632
GemmTunableOp_Half_TN,tn_6144_3515_4096,Gemm_Rocblas_621294306,0.312731
GemmTunableOp_Half_TN,tn_28672_1894_4096,Gemm_Hipblaslt_TN_9832,0.808044
GemmTunableOp_Half_TN,tn_4096_3767_14336,Gemm_Hipblaslt_TN_9841,0.73081
GemmTunableOp_Half_TN,tn_6144_1877_4096,Gemm_Hipblaslt_TN_9799,0.167647
GemmTunableOp_Half_TN,tn_32000_152_4096,Gemm_Hipblaslt_TN_9564,0.108711
GemmTunableOp_Half_TN,tn_6144_3920_4096,Gemm_Hipblaslt_TN_9690,0.345523
GemmTunableOp_Half_TN,tn_4096_1924_4096,Gemm_Hipblaslt_TN_9645,0.12174
GemmTunableOp_Half_TN,tn_6144_7139_4096,Gemm_Hipblaslt_TN_9697,0.606987
GemmTunableOp_Half_TN,tn_4096_1699_4096,Gemm_Hipblaslt_TN_9607,0.10964
GemmTunableOp_Half_TN,tn_6144_3764_4096,Gemm_Hipblaslt_TN_9690,0.341028
GemmTunableOp_Half_TN,tn_4096_1706_14336,Gemm_Hipblaslt_TN_9790,0.370598
GemmTunableOp_Half_TN,tn_4096_1680_14336,Gemm_Hipblaslt_TN_9265,0.365839
GemmTunableOp_Half_TN,tn_28672_3427_4096,Gemm_Hipblaslt_TN_9841,1.36572
GemmTunableOp_Half_TN,tn_128256_234_4096,Gemm_Rocblas_621286892,0.603886
GemmTunableOp_Half_TN,tn_28672_1936_4096,Gemm_Hipblaslt_TN_9846,0.838296
GemmTunableOp_Half_TN,tn_28672_1627_4096,Gemm_Hipblaslt_TN_9223,0.722933
GemmTunableOp_Half_TN,tn_4096_2273_4096,Gemm_Hipblaslt_TN_9173,0.139749
GemmTunableOp_Half_TN,tn_6144_3404_4096,Gemm_Rocblas_621294495,0.308007
GemmTunableOp_Half_TN,tn_6144_1916_4096,Gemm_Hipblaslt_TN_9691,0.167428
GemmTunableOp_Half_TN,tn_4096_1813_14336,Gemm_Hipblaslt_TN_9645,0.411006
GemmTunableOp_Half_TN,tn_6144_5583_4096,Gemm_Hipblaslt_TN_9655,0.462799
GemmTunableOp_Half_TN,tn_6144_1760_4096,Gemm_Rocblas_621286705,0.155082
GemmTunableOp_Half_TN,tn_4096_5498_4096,Gemm_Hipblaslt_TN_9691,0.335804
GemmTunableOp_Half_TN,tn_4096_1829_14336,Gemm_Hipblaslt_TN_9137,0.40915
GemmTunableOp_Half_TN,tn_28672_3612_4096,Gemm_Hipblaslt_TN_9832,1.47503
GemmTunableOp_Half_TN,tn_6144_7190_4096,Gemm_Hipblaslt_TN_9697,0.609877
GemmTunableOp_Half_TN,tn_6144_7023_4096,Gemm_Hipblaslt_TN_9743,0.592707
GemmTunableOp_Half_TN,tn_28672_1883_4096,Gemm_Hipblaslt_TN_9683,0.805644
GemmTunableOp_Half_TN,tn_4096_1778_14336,Gemm_Hipblaslt_TN_9645,0.396918
GemmTunableOp_Half_TN,tn_6144_1857_4096,Gemm_Rocblas_621286575,0.165466
GemmTunableOp_Half_TN,tn_4096_1884_4096,Gemm_Hipblaslt_TN_9645,0.121862
GemmTunableOp_Half_TN,tn_22016_2129_4096,Gemm_Hipblaslt_TN_9827,0.684165
GemmTunableOp_Half_TN,tn_28672_7340_4096,Gemm_Hipblaslt_TN_9890,2.96319
GemmTunableOp_Half_TN,tn_128256_130_4096,Gemm_Hipblaslt_TN_9108,0.466773
GemmTunableOp_Half_TN,tn_28672_1722_4096,Gemm_Hipblaslt_TN_9217,0.737313
GemmTunableOp_Half_TN,tn_6144_1875_4096,Gemm_Rocblas_621294425,0.166711
GemmTunableOp_Half_TN,tn_128256_20_4096,Gemm_Rocblas_621294578,0.312105
GemmTunableOp_Half_TN,tn_6144_1597_4096,Gemm_Rocblas_621294305,0.145392
GemmTunableOp_Half_TN,tn_4096_1665_14336,Gemm_Hipblaslt_TN_9679,0.364659
GemmTunableOp_Half_TN,tn_6144_1686_4096,Gemm_Hipblaslt_TN_9570,0.154529
GemmTunableOp_Half_TN,tn_128256_27_4096,Gemm_Rocblas_621286354,0.317239
GemmTunableOp_Half_TN,tn_6144_3578_4096,Gemm_Rocblas_621286753,0.323787
GemmTunableOp_Half_TN,tn_4096_1743_4096,Gemm_Hipblaslt_TN_9645,0.116106
GemmTunableOp_Half_TN,tn_4096_1749_4096,Gemm_Hipblaslt_TN_9645,0.11691
GemmTunableOp_Half_TN,tn_128256_212_4096,Gemm_Hipblaslt_TN_9919,0.576856
GemmTunableOp_Half_TN,tn_6144_7568_4096,Gemm_Hipblaslt_TN_9704,0.640534
GemmTunableOp_Half_TN,tn_6144_1738_4096,Gemm_Rocblas_621294447,0.15927
GemmTunableOp_Half_TN,tn_4096_6800_4096,Gemm_Hipblaslt_TN_9694,0.393904
GemmTunableOp_Half_TN,tn_28672_3781_4096,Gemm_Hipblaslt_TN_9827,1.52497
GemmTunableOp_Half_TN,tn_28672_1610_4096,Gemm_Rocblas_621294492,0.717941
GemmTunableOp_Half_TN,tn_4096_3501_4096,Gemm_Hipblaslt_TN_9814,0.199228
GemmTunableOp_Half_TN,tn_4096_3764_14336,Gemm_Hipblaslt_TN_9813,0.732825
GemmTunableOp_Half_TN,tn_28672_1792_4096,Gemm_Rocblas_621286742,0.742945
GemmTunableOp_Half_TN,tn_12288_2401_4096,Gemm_Hipblaslt_TN_9768,0.417886
GemmTunableOp_Half_TN,tn_28672_3600_4096,Gemm_Hipblaslt_TN_9832,1.46871
GemmTunableOp_Half_TN,tn_28672_5512_4096,Gemm_Hipblaslt_TN_9852,2.31214
GemmTunableOp_Half_TN,tn_28672_5436_4096,Gemm_Hipblaslt_TN_9852,2.28028
GemmTunableOp_Half_TN,tn_4096_1620_14336,Gemm_Hipblaslt_TN_9610,0.361797
GemmTunableOp_Half_TN,tn_22016_148_4096,Gemm_Hipblaslt_TN_9319,0.0740874
GemmTunableOp_Half_TN,tn_6144_5273_4096,Gemm_Hipblaslt_TN_9933,0.445667
GemmTunableOp_Half_TN,tn_28672_1660_4096,Gemm_Hipblaslt_TN_9194,0.725767
GemmTunableOp_Half_TN,tn_28672_1590_4096,Gemm_Rocblas_621294435,0.710765
GemmTunableOp_Half_TN,tn_28672_1799_4096,Gemm_Hipblaslt_TN_9683,0.792032
GemmTunableOp_Half_TN,tn_6144_5413_4096,Gemm_Hipblaslt_TN_9704,0.459568
GemmTunableOp_Half_TN,tn_28672_1807_4096,Gemm_Hipblaslt_TN_9684,0.794215
GemmTunableOp_Half_TN,tn_4096_1822_4096,Gemm_Hipblaslt_TN_9134,0.12036
GemmTunableOp_Half_TN,tn_4096_1589_4096,Gemm_Hipblaslt_TN_9265,0.105292
GemmTunableOp_Half_TN,tn_12288_139_4096,Gemm_Rocblas_621294209,0.0437752
GemmTunableOp_Half_TN,tn_128256_121_4096,Gemm_Hipblaslt_TN_9596,0.437088
GemmTunableOp_Half_TN,tn_128256_29_4096,Gemm_Rocblas_621294578,0.318148
GemmTunableOp_Half_TN,tn_4096_1609_4096,Gemm_Hipblaslt_TN_9616,0.105891
GemmTunableOp_Half_TN,tn_6144_1933_4096,Gemm_Hipblaslt_TN_9697,0.176821
GemmTunableOp_Half_TN,tn_22016_4017_4096,Gemm_Hipblaslt_TN_9841,1.26498
GemmTunableOp_Half_TN,tn_28672_3468_4096,Gemm_Hipblaslt_TN_9841,1.37085
GemmTunableOp_Half_TN,tn_32000_140_4096,Gemm_Hipblaslt_TN_9606,0.109597
GemmTunableOp_Half_TN,tn_6144_1928_4096,Gemm_Hipblaslt_TN_9793,0.175343
GemmTunableOp_Half_TN,tn_4096_1673_14336,Gemm_Hipblaslt_TN_9790,0.366331
GemmTunableOp_Half_TN,tn_4096_48_4096,Gemm_Rocblas_621286426,0.0127891
GemmTunableOp_Half_TN,tn_128256_142_4096,Gemm_Hipblaslt_TN_9657,0.474449
GemmTunableOp_Half_TN,tn_32000_135_4096,Gemm_Hipblaslt_TN_9564,0.10809
GemmTunableOp_Half_TN,tn_28672_1779_4096,Gemm_Hipblaslt_TN_9190,0.746017
GemmTunableOp_Half_TN,tn_22016_2225_4096,Gemm_Hipblaslt_TN_9827,0.692061
GemmTunableOp_Half_TN,tn_12288_2081_4096,Gemm_Hipblaslt_TN_9697,0.366555
GemmTunableOp_Half_TN,tn_6144_1866_4096,Gemm_Hipblaslt_TN_9799,0.165663
GemmTunableOp_Half_TN,tn_4096_7484_4096,Gemm_Hipblaslt_TN_9933,0.428742
GemmTunableOp_Half_TN,tn_4096_2113_4096,Gemm_Hipblaslt_TN_9698,0.131747
GemmTunableOp_Half_TN,tn_4096_5125_14336,Gemm_Hipblaslt_TN_9799,1.07932
GemmTunableOp_Half_TN,tn_22016_149_4096,Gemm_Hipblaslt_TN_9319,0.0743008
GemmTunableOp_Half_TN,tn_28672_7096_4096,Gemm_Hipblaslt_TN_9892,2.90929
GemmTunableOp_Half_TN,tn_12288_2258_4096,Gemm_Hipblaslt_TN_9743,0.388152
GemmTunableOp_Half_TN,tn_28672_1605_4096,Gemm_Rocblas_621286678,0.713847
GemmTunableOp_Half_TN,tn_6144_1737_4096,Gemm_Hipblaslt_TN_9691,0.159149
GemmTunableOp_Half_TN,tn_6144_3441_4096,Gemm_Hipblaslt_TN_9570,0.312931
GemmTunableOp_Half_TN,tn_4096_2272_4096,Gemm_Hipblaslt_TN_9218,0.140001
GemmTunableOp_Half_TN,tn_28672_1573_4096,Gemm_Rocblas_621286750,0.700904
GemmTunableOp_Half_TN,tn_4096_3706_4096,Gemm_Hipblaslt_TN_9768,0.213277
GemmTunableOp_Half_TN,tn_28672_192_4096,Gemm_Hipblaslt_TN_7286,0.0982443
GemmTunableOp_Half_TN,tn_4096_135_4096,Gemm_Hipblaslt_TN_9472,0.0219629
GemmTunableOp_Half_TN,tn_6144_3592_4096,Gemm_Rocblas_621294306,0.321365
GemmTunableOp_Half_TN,tn_4096_2000_11008,Gemm_Hipblaslt_TN_9174,0.326494
GemmTunableOp_Half_TN,tn_4096_2192_4096,Gemm_Hipblaslt_TN_9181,0.137827
GemmTunableOp_Half_TN,tn_4096_1846_4096,Gemm_Hipblaslt_TN_9645,0.119476
GemmTunableOp_Half_TN,tn_4096_3629_4096,Gemm_Hipblaslt_TN_9743,0.202575
GemmTunableOp_Half_TN,tn_28672_7138_4096,Gemm_Hipblaslt_TN_9804,2.91404
GemmTunableOp_Half_TN,tn_4096_160_11008,Gemm_Hipblaslt_TN_7563,0.0476171
GemmTunableOp_Half_TN,tn_6144_1643_4096,Gemm_Hipblaslt_TN_9570,0.154001
GemmTunableOp_Half_TN,tn_4096_150_4096,Gemm_Rocblas_621286491,0.0218706
GemmTunableOp_Half_TN,tn_28672_7262_4096,Gemm_Hipblaslt_TN_159,2.92715
GemmTunableOp_Half_TN,tn_4096_3912_4096,Gemm_Rocblas_621294030,0.221501
GemmTunableOp_Half_TN,tn_4096_3630_4096,Gemm_Hipblaslt_TN_9221,0.201895
GemmTunableOp_Half_TN,tn_128256_245_4096,Gemm_Rocblas_621286892,0.609864
GemmTunableOp_Half_TN,tn_6144_1670_4096,Gemm_Hipblaslt_TN_9570,0.151967
GemmTunableOp_Half_TN,tn_6144_7403_4096,Gemm_Rocblas_621286742,0.638049
GemmTunableOp_Half_TN,tn_4096_1857_4096,Gemm_Hipblaslt_TN_9645,0.12075
GemmTunableOp_Half_TN,tn_28672_3773_4096,Gemm_Hipblaslt_TN_9827,1.53595
GemmTunableOp_Half_TN,tn_28672_168_4096,Gemm_Hipblaslt_TN_9254,0.0974924
GemmTunableOp_Half_TN,tn_128256_114_4096,Gemm_Rocblas_621294762,0.428835
GemmTunableOp_Half_TN,tn_4096_2065_11008,Gemm_Hipblaslt_TN_9698,0.347828
GemmTunableOp_Half_TN,tn_4096_5067_14336,Gemm_Hipblaslt_TN_9681,1.06794
GemmTunableOp_Half_TN,tn_28672_1588_4096,Gemm_Hipblaslt_TN_9787,0.709265
GemmTunableOp_Half_TN,tn_4096_1711_14336,Gemm_Hipblaslt_TN_9679,0.369783
GemmTunableOp_Half_TN,tn_4096_3400_14336,Gemm_Hipblaslt_TN_9187,0.666021
GemmTunableOp_Half_TN,tn_28672_1614_4096,Gemm_Hipblaslt_TN_9245,0.715385
GemmTunableOp_Half_TN,tn_28672_6788_4096,Gemm_Hipblaslt_TN_9958,2.82057
GemmTunableOp_Half_TN,tn_6144_1665_4096,Gemm_Hipblaslt_TN_9570,0.154041
GemmTunableOp_Half_TN,tn_28672_3722_4096,Gemm_Hipblaslt_TN_9827,1.49923
GemmTunableOp_Half_TN,tn_128256_180_4096,Gemm_Hipblaslt_TN_9956,0.518339
GemmTunableOp_Half_TN,tn_28672_1593_4096,Gemm_Hipblaslt_TN_9193,0.709132
GemmTunableOp_Half_TN,tn_22016_142_4096,Gemm_Hipblaslt_TN_9319,0.0725774
GemmTunableOp_Half_TN,tn_28672_1933_4096,Gemm_Hipblaslt_TN_9846,0.832054
GemmTunableOp_Half_TN,tn_4096_1772_4096,Gemm_Hipblaslt_TN_9645,0.117294
GemmTunableOp_Half_TN,tn_12288_2063_4096,Gemm_Hipblaslt_TN_9743,0.368901
GemmTunableOp_Half_TN,tn_128256_53_4096,Gemm_Hipblaslt_TN_9097,0.357803
GemmTunableOp_Half_TN,tn_32000_153_4096,Gemm_Hipblaslt_TN_9564,0.108256
GemmTunableOp_Half_TN,tn_6144_1805_4096,Gemm_Rocblas_621286684,0.163237
GemmTunableOp_Half_TN,tn_4096_2177_4096,Gemm_Hipblaslt_TN_9767,0.137582
GemmTunableOp_Half_TN,tn_28672_80_4096,Gemm_Rocblas_621294461,0.0597274
GemmTunableOp_Half_TN,tn_4096_4082_11008,Gemm_Hipblaslt_TN_9190,0.599611
GemmTunableOp_Half_TN,tn_128256_183_4096,Gemm_Hipblaslt_TN_9732,0.519019
GemmTunableOp_Half_TN,tn_28672_7240_4096,Gemm_Hipblaslt_TN_9903,2.95
GemmTunableOp_Half_TN,tn_28672_1592_4096,Gemm_Rocblas_621294420,0.707682
GemmTunableOp_Half_TN,tn_12288_4050_4096,Gemm_Hipblaslt_TN_9815,0.681907
GemmTunableOp_Half_TN,tn_28672_5239_4096,Gemm_Hipblaslt_TN_9934,2.15778
GemmTunableOp_Half_TN,tn_6144_1864_4096,Gemm_Hipblaslt_TN_9799,0.168695
GemmTunableOp_Half_TN,tn_6144_5359_4096,Gemm_Hipblaslt_TN_9704,0.445097
GemmTunableOp_Half_TN,tn_22016_7_4096,Gemm_Rocblas_621294186,0.0352041
GemmTunableOp_Half_TN,tn_22016_2465_4096,Gemm_Hipblaslt_TN_9846,0.806869
GemmTunableOp_Half_TN,tn_4096_2481_4096,Gemm_Hipblaslt_TN_9691,0.154652
GemmTunableOp_Half_TN,tn_28672_1858_4096,Gemm_Hipblaslt_TN_9832,0.806521
GemmTunableOp_Half_TN,tn_28672_1719_4096,Gemm_Hipblaslt_TN_9190,0.737016
GemmTunableOp_Half_TN,tn_4096_6789_14336,Gemm_Hipblaslt_TN_9694,1.38697
GemmTunableOp_Half_TN,tn_4096_1963_4096,Gemm_Hipblaslt_TN_9645,0.12409
GemmTunableOp_Half_TN,tn_4096_2481_11008,Gemm_Hipblaslt_TN_9681,0.401172
GemmTunableOp_Half_TN,tn_4096_130_4096,Gemm_Hipblaslt_TN_9474,0.0211019
GemmTunableOp_Half_TN,tn_6144_32_4096,Gemm_Rocblas_621294144,0.0135835
GemmTunableOp_Half_TN,tn_4096_1970_14336,Gemm_Hipblaslt_TN_9645,0.419446
GemmTunableOp_Half_TN,tn_6144_5274_4096,Gemm_Hipblaslt_TN_9933,0.441618
GemmTunableOp_Half_TN,tn_28672_3855_4096,Gemm_Hipblaslt_TN_9841,1.57083
GemmTunableOp_Half_TN,tn_4096_1824_14336,Gemm_Hipblaslt_TN_9137,0.410625
GemmTunableOp_Half_TN,tn_4096_1858_14336,Gemm_Hipblaslt_TN_9620,0.412948
GemmTunableOp_Half_TN,tn_28672_3640_4096,Gemm_Hipblaslt_TN_9832,1.48781
GemmTunableOp_Half_TN,tn_4096_2417_11008,Gemm_Hipblaslt_TN_9698,0.379322
GemmTunableOp_Half_TN,tn_28672_3589_4096,Gemm_Hipblaslt_TN_9832,1.46315
GemmTunableOp_Half_TN,tn_4096_1877_4096,Gemm_Hipblaslt_TN_9645,0.121536
GemmTunableOp_Half_TN,tn_22016_150_4096,Gemm_Hipblaslt_TN_9319,0.0733379
GemmTunableOp_Half_TN,tn_4096_224_4096,Gemm_Rocblas_621294173,0.0260333
GemmTunableOp_Half_TN,tn_32000_139_4096,Gemm_Hipblaslt_TN_9564,0.109059
GemmTunableOp_Half_TN,tn_12288_150_4096,Gemm_Rocblas_621294209,0.0442946
GemmTunableOp_Half_TN,tn_12288_160_4096,Gemm_Rocblas_621286472,0.0439463
GemmTunableOp_Half_TN,tn_4096_1713_14336,Gemm_Hipblaslt_TN_9679,0.368904
GemmTunableOp_Half_TN,tn_4096_4000_4096,Gemm_Rocblas_621294030,0.223478
GemmTunableOp_Half_TN,tn_128256_127_4096,Gemm_Hipblaslt_TN_9596,0.439829
GemmTunableOp_Half_TN,tn_4096_132_11008,Gemm_Hipblaslt_TN_9298,0.0442502
GemmTunableOp_Half_TN,tn_6144_6860_4096,Gemm_Hipblaslt_TN_9697,0.585748
GemmTunableOp_Half_TN,tn_4096_5723_4096,Gemm_Hipblaslt_TN_9689,0.341193
GemmTunableOp_Half_TN,tn_28672_5605_4096,Gemm_Hipblaslt_TN_9865,2.33077
GemmTunableOp_Half_TN,tn_28672_1790_4096,Gemm_Hipblaslt_TN_9190,0.74667
GemmTunableOp_Half_TN,tn_28672_5100_4096,Gemm_Hipblaslt_TN_9951,2.11197
GemmTunableOp_Half_TN,tn_28672_1648_4096,Gemm_Hipblaslt_TN_9217,0.724664
GemmTunableOp_Half_TN,tn_32000_145_4096,Gemm_Hipblaslt_TN_9564,0.108952
GemmTunableOp_Half_TN,tn_4096_129_11008,Gemm_Hipblaslt_TN_7219,0.0449703
GemmTunableOp_Half_TN,tn_128256_74_4096,Gemm_Hipblaslt_TN_9057,0.381303
GemmTunableOp_Half_TN,tn_4096_1928_4096,Gemm_Hipblaslt_TN_9645,0.123503
GemmTunableOp_Half_TN,tn_12288_131_4096,Gemm_Hipblaslt_TN_9144,0.0427147
GemmTunableOp_Half_TN,tn_28672_5052_4096,Gemm_Hipblaslt_TN_9951,2.10369
GemmTunableOp_Half_TN,tn_128256_140_4096,Gemm_Hipblaslt_TN_9108,0.472852
GemmTunableOp_Half_TN,tn_22016_2209_4096,Gemm_Hipblaslt_TN_9827,0.687566
GemmTunableOp_Half_TN,tn_4096_135_11008,Gemm_Hipblaslt_TN_7219,0.0458783
GemmTunableOp_Half_TN,tn_6144_1771_4096,Gemm_Hipblaslt_TN_9672,0.163016
GemmTunableOp_Half_TN,tn_12288_2321_4096,Gemm_Rocblas_621294484,0.4134
GemmTunableOp_Half_TN,tn_4096_143_11008,Gemm_Hipblaslt_TN_9298,0.0453608
GemmTunableOp_Half_TN,tn_28672_5465_4096,Gemm_Hipblaslt_TN_9852,2.31012
GemmTunableOp_Half_TN,tn_4096_3410_4096,Gemm_Hipblaslt_TN_9743,0.195529
GemmTunableOp_Half_TN,tn_28672_1737_4096,Gemm_Hipblaslt_TN_9190,0.740138
GemmTunableOp_Half_TN,tn_128256_7_4096,Gemm_Hipblaslt_TN_9405,0.286834
GemmTunableOp_Half_TN,tn_4096_3382_4096,Gemm_Hipblaslt_TN_9814,0.195049
GemmTunableOp_Half_TN,tn_128256_189_4096,Gemm_Hipblaslt_TN_9952,0.518269
GemmTunableOp_Half_TN,tn_28672_3438_4096,Gemm_Hipblaslt_TN_9827,1.36926
GemmTunableOp_Half_TN,tn_6144_5136_4096,Gemm_Hipblaslt_TN_9753,0.43082
GemmTunableOp_Half_TN,tn_22016_160_4096,Gemm_Hipblaslt_TN_9319,0.0725378
GemmTunableOp_Half_TN,tn_4096_1691_4096,Gemm_Hipblaslt_TN_9265,0.107718
GemmTunableOp_Half_TN,tn_28672_1798_4096,Gemm_Hipblaslt_TN_9683,0.7964
GemmTunableOp_Half_TN,tn_4096_1601_14336,Gemm_Hipblaslt_TN_9610,0.358226
GemmTunableOp_Half_TN,tn_22016_152_4096,Gemm_Hipblaslt_TN_9321,0.0749419
GemmTunableOp_Half_TN,tn_4096_161_4096,Gemm_Rocblas_621294168,0.0218682
GemmTunableOp_Half_TN,tn_12288_2241_4096,Gemm_Hipblaslt_TN_9743,0.384326
GemmTunableOp_Half_TN,tn_22016_4082_4096,Gemm_Hipblaslt_TN_9841,1.30317
GemmTunableOp_Half_TN,tn_6144_1600_4096,Gemm_Rocblas_621286684,0.146718
GemmTunableOp_Half_TN,tn_22016_2303_4096,Gemm_Hipblaslt_TN_9832,0.747907
GemmTunableOp_Half_TN,tn_4096_7484_14336,Gemm_Hipblaslt_TN_9738,1.55715
GemmTunableOp_Half_TN,tn_4096_2274_4096,Gemm_Hipblaslt_TN_9262,0.140547
GemmTunableOp_Half_TN,tn_4096_1908_14336,Gemm_Hipblaslt_TN_9645,0.415528
GemmTunableOp_Half_TN,tn_22016_139_4096,Gemm_Hipblaslt_TN_9319,0.0733475
GemmTunableOp_Half_TN,tn_4096_157_4096,Gemm_Rocblas_621286491,0.0221281
GemmTunableOp_Half_TN,tn_12288_2255_4096,Gemm_Hipblaslt_TN_9697,0.389217
GemmTunableOp_Half_TN,tn_128256_131_4096,Gemm_Hipblaslt_TN_9808,0.466582
GemmTunableOp_Half_TN,tn_4096_132_4096,Gemm_Hipblaslt_TN_9474,0.0212493
GemmTunableOp_Half_TN,tn_4096_3701_4096,Gemm_Hipblaslt_TN_9841,0.211362
GemmTunableOp_Half_TN,tn_4096_4050_11008,Gemm_Hipblaslt_TN_9190,0.599577
GemmTunableOp_Half_TN,tn_28672_1977_4096,Gemm_Hipblaslt_TN_9846,0.8492
GemmTunableOp_Half_TN,tn_28672_1625_4096,Gemm_Hipblaslt_TN_9193,0.718832
GemmTunableOp_Half_TN,tn_4096_2097_4096,Gemm_Hipblaslt_TN_9686,0.132934
GemmTunableOp_Half_TN,tn_4096_2401_4096,Gemm_Hipblaslt_TN_9698,0.145268
GemmTunableOp_Half_TN,tn_4096_3645_4096,Gemm_Hipblaslt_TN_9221,0.205222
GemmTunableOp_Half_TN,tn_4096_1831_4096,Gemm_Hipblaslt_TN_9645,0.119249
GemmTunableOp_Half_TN,tn_128256_14_4096,Gemm_Hipblaslt_TN_9405,0.291466
GemmTunableOp_Half_TN,tn_6144_1854_4096,Gemm_Rocblas_621286683,0.163938
GemmTunableOp_Half_TN,tn_4096_1666_4096,Gemm_Hipblaslt_TN_9671,0.108018
GemmTunableOp_Half_TN,tn_6144_1779_4096,Gemm_Hipblaslt_TN_9799,0.163968
GemmTunableOp_Half_TN,tn_6144_6773_4096,Gemm_Hipblaslt_TN_9697,0.591522
GemmTunableOp_Half_TN,tn_4096_3507_4096,Gemm_Hipblaslt_TN_9814,0.20195
GemmTunableOp_Half_TN,tn_128256_24_4096,Gemm_Hipblaslt_TN_9451,0.313721
GemmTunableOp_Half_TN,tn_128256_42_4096,Gemm_Hipblaslt_TN_9451,0.33515
GemmTunableOp_Half_TN,tn_28672_3441_4096,Gemm_Hipblaslt_TN_9827,1.36645
GemmTunableOp_Half_TN,tn_12288_158_4096,Gemm_Rocblas_621294209,0.0440462
GemmTunableOp_Half_TN,tn_128256_83_4096,Gemm_Hipblaslt_TN_9057,0.389608
GemmTunableOp_Half_TN,tn_4096_1636_14336,Gemm_Hipblaslt_TN_9265,0.359611
GemmTunableOp_Half_TN,tn_12288_2369_4096,Gemm_Rocblas_621286742,0.411421
GemmTunableOp_Half_TN,tn_28672_1892_4096,Gemm_Hipblaslt_TN_9683,0.807075
GemmTunableOp_Half_TN,tn_32000_137_4096,Gemm_Hipblaslt_TN_9324,0.106793
GemmTunableOp_Half_TN,tn_28672_1586_4096,Gemm_Hipblaslt_TN_9787,0.707161
GemmTunableOp_Half_TN,tn_22016_2000_4096,Gemm_Hipblaslt_TN_9840,0.667141
GemmTunableOp_Half_TN,tn_6144_1618_4096,Gemm_Rocblas_621286753,0.15396
GemmTunableOp_Half_TN,tn_128256_168_4096,Gemm_Hipblaslt_TN_9817,0.513569
GemmTunableOp_Half_TN,tn_32000_129_4096,Gemm_Hipblaslt_TN_9613,0.104994
GemmTunableOp_Half_TN,tn_28672_6744_4096,Gemm_Hipblaslt_TN_9944,2.82609
GemmTunableOp_Half_TN,tn_4096_1647_4096,Gemm_Hipblaslt_TN_9610,0.107634
GemmTunableOp_Half_TN,tn_128256_96_4096,Gemm_Hipblaslt_TN_9057,0.39379
GemmTunableOp_Half_TN,tn_4096_1935_14336,Gemm_Hipblaslt_TN_9645,0.419202
GemmTunableOp_Half_TN,tn_4096_7325_4096,Gemm_Hipblaslt_TN_9933,0.422293
GemmTunableOp_Half_TN,tn_128256_119_4096,Gemm_Hipblaslt_TN_9061,0.433335
GemmTunableOp_Half_TN,tn_128256_148_4096,Gemm_Hipblaslt_TN_9709,0.478022
GemmTunableOp_Half_TN,tn_6144_1660_4096,Gemm_Hipblaslt_TN_9570,0.153061
GemmTunableOp_Half_TN,tn_128256_198_4096,Gemm_Hipblaslt_TN_9937,0.567982
GemmTunableOp_Half_TN,tn_32000_144_4096,Gemm_Hipblaslt_TN_9564,0.107945
GemmTunableOp_Half_TN,tn_4096_1725_4096,Gemm_Hipblaslt_TN_9265,0.108317
GemmTunableOp_Half_TN,tn_28672_1794_4096,Gemm_Hipblaslt_TN_9832,0.790165
GemmTunableOp_Half_TN,tn_4096_1890_4096,Gemm_Hipblaslt_TN_9645,0.11994
GemmTunableOp_Half_TN,tn_28672_7109_4096,Gemm_Hipblaslt_TN_9892,2.91657
GemmTunableOp_Half_TN,tn_128256_207_4096,Gemm_Hipblaslt_TN_9937,0.568563
GemmTunableOp_Half_TN,tn_128256_172_4096,Gemm_Hipblaslt_TN_9803,0.512167
GemmTunableOp_Half_TN,tn_28672_1690_4096,Gemm_Rocblas_621286678,0.725926
GemmTunableOp_Half_TN,tn_28672_1728_4096,Gemm_Hipblaslt_TN_9223,0.736214
GemmTunableOp_Half_TN,tn_28672_3562_4096,Gemm_Hipblaslt_TN_9827,1.38815
GemmTunableOp_Half_TN,tn_4096_5223_4096,Gemm_Hipblaslt_TN_9799,0.321069
GemmTunableOp_Half_TN,tn_4096_137_4096,Gemm_Hipblaslt_TN_9472,0.0216163
GemmTunableOp_Half_TN,tn_28672_3622_4096,Gemm_Hipblaslt_TN_9832,1.48063
GemmTunableOp_Half_TN,tn_6144_5319_4096,Gemm_Hipblaslt_TN_9959,0.447778
GemmTunableOp_Half_TN,tn_4096_7050_14336,Gemm_Hipblaslt_TN_9694,1.42249
GemmTunableOp_Half_TN,tn_4096_7579_14336,Gemm_Hipblaslt_TN_9738,1.56139
GemmTunableOp_Half_TN,tn_32000_161_4096,Gemm_Hipblaslt_TN_9616,0.117938
GemmTunableOp_Half_TN,tn_128256_31_4096,Gemm_Hipblaslt_TN_9451,0.316891
GemmTunableOp_Half_TN,tn_4096_3855_14336,Gemm_Hipblaslt_TN_9217,0.75177
GemmTunableOp_Half_TN,tn_4096_3404_4096,Gemm_Hipblaslt_TN_9697,0.195549
GemmTunableOp_Half_TN,tn_6144_3582_4096,Gemm_Hipblaslt_TN_9691,0.32293
GemmTunableOp_Half_TN,tn_6144_5354_4096,Gemm_Hipblaslt_TN_9704,0.44792
GemmTunableOp_Half_TN,tn_6144_3557_4096,Gemm_Hipblaslt_TN_9570,0.322111
GemmTunableOp_Half_TN,tn_6144_1673_4096,Gemm_Hipblaslt_TN_9570,0.154178
GemmTunableOp_Half_TN,tn_28672_5204_4096,Gemm_Hipblaslt_TN_9893,2.15328
GemmTunableOp_Half_TN,tn_4096_6971_14336,Gemm_Hipblaslt_TN_9743,1.42549
GemmTunableOp_Half_TN,tn_4096_1954_4096,Gemm_Hipblaslt_TN_9645,0.12473
GemmTunableOp_Half_TN,tn_6144_5030_4096,Gemm_Hipblaslt_TN_9813,0.436397
GemmTunableOp_Half_TN,tn_6144_1786_4096,Gemm_Rocblas_621286683,0.164487
GemmTunableOp_Half_TN,tn_28672_1852_4096,Gemm_Hipblaslt_TN_9683,0.803614
GemmTunableOp_Half_TN,tn_6144_1879_4096,Gemm_Rocblas_621286683,0.166211
GemmTunableOp_Half_TN,tn_4096_1977_14336,Gemm_Hipblaslt_TN_9645,0.423828
GemmTunableOp_Half_TN,tn_28672_7478_4096,Gemm_Hipblaslt_TN_159,2.99449
GemmTunableOp_Half_TN,tn_28672_3526_4096,Gemm_Hipblaslt_TN_9827,1.38113
GemmTunableOp_Half_TN,tn_28672_6868_4096,Gemm_Hipblaslt_TN_9944,2.84079
GemmTunableOp_Half_TN,tn_4096_7196_14336,Gemm_Hipblaslt_TN_9743,1.45024
GemmTunableOp_Half_TN,tn_4096_7027_14336,Gemm_Hipblaslt_TN_9732,1.43783
GemmTunableOp_Half_TN,tn_128256_203_4096,Gemm_Hipblaslt_TN_9937,0.571513
GemmTunableOp_Half_TN,tn_28672_3511_4096,Gemm_Hipblaslt_TN_9827,1.37654
GemmTunableOp_Half_TN,tn_4096_6952_4096,Gemm_Hipblaslt_TN_9743,0.403762
GemmTunableOp_Half_TN,tn_6144_3526_4096,Gemm_Rocblas_621286753,0.320409
GemmTunableOp_Half_TN,tn_6144_7432_4096,Gemm_Hipblaslt_TN_159,0.637253
GemmTunableOp_Half_TN,tn_28672_1830_4096,Gemm_Hipblaslt_TN_9832,0.802301
GemmTunableOp_Half_TN,tn_4096_1727_4096,Gemm_Hipblaslt_TN_9587,0.107586
GemmTunableOp_Half_TN,tn_128256_252_4096,Gemm_Rocblas_621294634,0.608414
GemmTunableOp_Half_TN,tn_28672_112_4096,Gemm_Rocblas_621286473,0.0727812
GemmTunableOp_Half_TN,tn_28672_1873_4096,Gemm_Hipblaslt_TN_9683,0.811602
GemmTunableOp_Half_TN,tn_6144_6744_4096,Gemm_Hipblaslt_TN_9743,0.58075
GemmTunableOp_Half_TN,tn_6144_1815_4096,Gemm_Hipblaslt_TN_9799,0.165318
GemmTunableOp_Half_TN,tn_28672_3691_4096,Gemm_Hipblaslt_TN_9827,1.51241
GemmTunableOp_Half_TN,tn_6144_3553_4096,Gemm_Rocblas_621286753,0.321059
GemmTunableOp_Half_TN,tn_28672_7386_4096,Gemm_Hipblaslt_TN_9891,2.96656
GemmTunableOp_Half_TN,tn_28672_6990_4096,Gemm_Hipblaslt_TN_9919,2.87232
GemmTunableOp_Half_TN,tn_6144_7118_4096,Gemm_Hipblaslt_TN_9743,0.604411
GemmTunableOp_Half_TN,tn_28672_5301_4096,Gemm_Hipblaslt_TN_9860,2.17283
GemmTunableOp_Half_TN,tn_28672_6901_4096,Gemm_Hipblaslt_TN_9958,2.84799
GemmTunableOp_Half_TN,tn_4096_6976_14336,Gemm_Hipblaslt_TN_9694,1.41576
GemmTunableOp_Half_TN,tn_4096_1655_14336,Gemm_Hipblaslt_TN_9265,0.364811
GemmTunableOp_Half_TN,tn_128256_35_4096,Gemm_Hipblaslt_TN_9451,0.323002
GemmTunableOp_Half_TN,tn_4096_1760_14336,Gemm_Hipblaslt_TN_9645,0.394369
GemmTunableOp_Half_TN,tn_128256_229_4096,Gemm_Rocblas_621294634,0.600521
GemmTunableOp_Half_TN,tn_6144_7191_4096,Gemm_Hipblaslt_TN_9743,0.605645
GemmTunableOp_Half_TN,tn_6144_7327_4096,Gemm_Hipblaslt_TN_9933,0.625535
GemmTunableOp_Half_TN,tn_12288_2113_4096,Gemm_Hipblaslt_TN_9697,0.376567
GemmTunableOp_Half_TN,tn_28672_5541_4096,Gemm_Hipblaslt_TN_9852,2.32096
GemmTunableOp_Half_TN,tn_128256_18_4096,Gemm_Rocblas_621286354,0.310491
GemmTunableOp_Half_TN,tn_6144_3602_4096,Gemm_Rocblas_621294495,0.322945
GemmTunableOp_Half_TN,tn_4096_6901_4096,Gemm_Hipblaslt_TN_9743,0.396927
GemmTunableOp_Half_TN,tn_4096_1852_4096,Gemm_Hipblaslt_TN_9645,0.121005
GemmTunableOp_Half_TN,tn_4096_1869_4096,Gemm_Hipblaslt_TN_9645,0.12024
GemmTunableOp_Half_TN,tn_28672_6870_4096,Gemm_Hipblaslt_TN_9955,2.83969
GemmTunableOp_Half_TN,tn_4096_6_11008,Gemm_Rocblas_621294135,0.0227087
GemmTunableOp_Half_TN,tn_128256_108_4096,Gemm_Rocblas_621294762,0.42694
GemmTunableOp_Half_TN,tn_6144_3767_4096,Gemm_Hipblaslt_TN_9691,0.336642
GemmTunableOp_Half_TN,tn_28672_1963_4096,Gemm_Hipblaslt_TN_9846,0.853188
GemmTunableOp_Half_TN,tn_6144_160_4096,Gemm_Rocblas_621286440,0.0275211
GemmTunableOp_Half_TN,tn_32000_150_4096,Gemm_Hipblaslt_TN_9564,0.108961
GemmTunableOp_Half_TN,tn_28672_6721_4096,Gemm_Hipblaslt_TN_9955,2.82069
GemmTunableOp_Half_TN,tn_4096_7072_14336,Gemm_Hipblaslt_TN_9743,1.422
GemmTunableOp_Half_TN,tn_4096_147_4096,Gemm_Rocblas_621294171,0.0220669
GemmTunableOp_Half_TN,tn_4096_1665_4096,Gemm_Hipblaslt_TN_9265,0.106842
GemmTunableOp_Half_TN,tn_6144_1839_4096,Gemm_Rocblas_621286705,0.165828
GemmTunableOp_Half_TN,tn_28672_8192_4096,Gemm_Hipblaslt_TN_9882,3.34764
GemmTunableOp_Half_TN,tn_4096_2161_11008,Gemm_Hipblaslt_TN_9698,0.355331
GemmTunableOp_Half_TN,tn_6144_3573_4096,Gemm_Hipblaslt_TN_9570,0.323411
GemmTunableOp_Half_TN,tn_4096_176_4096,Gemm_Rocblas_621286491,0.0229747
GemmTunableOp_Half_TN,tn_4096_3588_14336,Gemm_Hipblaslt_TN_9192,0.693502
GemmTunableOp_Half_TN,tn_6144_1846_4096,Gemm_Hipblaslt_TN_9672,0.164456
GemmTunableOp_Half_TN,tn_4096_1643_4096,Gemm_Hipblaslt_TN_9679,0.106384
GemmTunableOp_Half_TN,tn_4096_150_11008,Gemm_Hipblaslt_TN_7219,0.047216
GemmTunableOp_Half_TN,tn_128256_230_4096,Gemm_Rocblas_621294634,0.601584
GemmTunableOp_Half_TN,tn_28672_6996_4096,Gemm_Hipblaslt_TN_9859,2.88076
GemmTunableOp_Half_TN,tn_28672_176_4096,Gemm_Hipblaslt_TN_7286,0.0970954
GemmTunableOp_Half_TN,tn_28672_3595_4096,Gemm_Hipblaslt_TN_9832,1.4763
GemmTunableOp_Half_TN,tn_4096_3369_4096,Gemm_Hipblaslt_TN_9743,0.193781
GemmTunableOp_Half_TN,tn_28672_8_4096,Gemm_Rocblas_621286317,0.0448181
GemmTunableOp_Half_TN,tn_28672_1966_4096,Gemm_Hipblaslt_TN_9846,0.836633
GemmTunableOp_Half_TN,tn_6144_7386_4096,Gemm_Hipblaslt_TN_9914,0.629951
GemmTunableOp_Half_TN,tn_6144_1699_4096,Gemm_Rocblas_621294495,0.155489
GemmTunableOp_Half_TN,tn_4096_3494_4096,Gemm_Hipblaslt_TN_9743,0.201166
GemmTunableOp_Half_TN,tn_6144_3713_4096,Gemm_Hipblaslt_TN_9691,0.330814
GemmTunableOp_Half_TN,tn_4096_3214_4096,Gemm_Hipblaslt_TN_9743,0.189081
GemmTunableOp_Half_TN,tn_4096_1648_4096,Gemm_Hipblaslt_TN_9671,0.107351
GemmTunableOp_Half_TN,tn_4096_7403_4096,Gemm_Rocblas_621294127,0.431079
GemmTunableOp_Half_TN,tn_4096_5267_14336,Gemm_Hipblaslt_TN_9799,1.09014
GemmTunableOp_Half_TN,tn_4096_1828_14336,Gemm_Hipblaslt_TN_9620,0.408335
GemmTunableOp_Half_TN,tn_4096_1779_4096,Gemm_Hipblaslt_TN_9134,0.117009
GemmTunableOp_Half_TN,tn_4096_56_14336,Gemm_Hipblaslt_TN_8060,0.0347671
GemmTunableOp_Half_TN,tn_6144_1862_4096,Gemm_Hipblaslt_TN_9799,0.16446
GemmTunableOp_Half_TN,tn_4096_3710_4096,Gemm_Hipblaslt_TN_9768,0.212132
GemmTunableOp_Half_TN,tn_4096_1772_14336,Gemm_Hipblaslt_TN_9645,0.396636
GemmTunableOp_Half_TN,tn_28672_1864_4096,Gemm_Hipblaslt_TN_9832,0.807042
GemmTunableOp_Half_TN,tn_28672_7196_4096,Gemm_Hipblaslt_TN_159,2.91151
GemmTunableOp_Half_TN,tn_6144_1658_4096,Gemm_Rocblas_621294495,0.154348
GemmTunableOp_Half_TN,tn_28672_16_4096,Gemm_Rocblas_621294186,0.044903
GemmTunableOp_Half_TN,tn_4096_5196_4096,Gemm_Hipblaslt_TN_9690,0.322046
GemmTunableOp_Half_TN,tn_28672_7206_4096,Gemm_Hipblaslt_TN_159,2.9172
GemmTunableOp_Half_TN,tn_4096_3647_14336,Gemm_Hipblaslt_TN_9743,0.696331
GemmTunableOp_Half_TN,tn_4096_3300_4096,Gemm_Hipblaslt_TN_9814,0.194008
GemmTunableOp_Half_TN,tn_4096_7067_14336,Gemm_Hipblaslt_TN_9743,1.41925
GemmTunableOp_Half_TN,tn_6144_1731_4096,Gemm_Rocblas_621294425,0.158209
GemmTunableOp_Half_TN,tn_6144_120_4096,Gemm_Rocblas_621286443,0.0240611
GemmTunableOp_Half_TN,tn_128256_221_4096,Gemm_Hipblaslt_TN_9919,0.577663
GemmTunableOp_Half_TN,tn_4096_8192_14336,Gemm_Hipblaslt_TN_9738,1.6706
GemmTunableOp_Half_TN,tn_4096_7478_14336,Gemm_Hipblaslt_TN_9738,1.5619
GemmTunableOp_Half_TN,tn_4096_7190_14336,Gemm_Hipblaslt_TN_9743,1.4396
GemmTunableOp_Half_TN,tn_4096_1781_14336,Gemm_Hipblaslt_TN_9645,0.397288
GemmTunableOp_Half_TN,tn_4096_5100_4096,Gemm_Hipblaslt_TN_9799,0.318567
GemmTunableOp_Half_TN,tn_28672_200_4096,Gemm_Hipblaslt_TN_9360,0.112853
GemmTunableOp_Half_TN,tn_4096_3466_14336,Gemm_Hipblaslt_TN_9187,0.676208
GemmTunableOp_Half_TN,tn_6144_1789_4096,Gemm_Rocblas_621294426,0.162861
GemmTunableOp_Half_TN,tn_28672_5274_4096,Gemm_Hipblaslt_TN_9860,2.16149
GemmTunableOp_Half_TN,tn_28672_248_4096,Gemm_Rocblas_621286584,0.123739
GemmTunableOp_Half_TN,tn_6144_1586_4096,Gemm_Rocblas_621286565,0.145823
GemmTunableOp_Half_TN,tn_28672_6843_4096,Gemm_Hipblaslt_TN_9944,2.84431
GemmTunableOp_Half_TN,tn_28672_7432_4096,Gemm_Hipblaslt_TN_159,2.96912
GemmTunableOp_Half_TN,tn_4096_6721_4096,Gemm_Hipblaslt_TN_9697,0.391902
GemmTunableOp_Half_TN,tn_4096_72_4096,Gemm_Rocblas_621286280,0.014994
GemmTunableOp_Half_TN,tn_4096_3920_4096,Gemm_Rocblas_621294030,0.220999
GemmTunableOp_Half_TN,tn_6144_3748_4096,Gemm_Rocblas_621286575,0.336104
GemmTunableOp_Half_TN,tn_4096_1948_4096,Gemm_Hipblaslt_TN_9645,0.122754
GemmTunableOp_Half_TN,tn_4096_5541_4096,Gemm_Rocblas_621286580,0.334805
GemmTunableOp_Half_TN,tn_4096_3722_14336,Gemm_Hipblaslt_TN_9217,0.721801
GemmTunableOp_Half_TN,tn_4096_112_4096,Gemm_Rocblas_621294029,0.0169958
GemmTunableOp_Half_TN,tn_28672_7191_4096,Gemm_Hipblaslt_TN_159,2.90251
GemmTunableOp_Half_TN,tn_4096_3584_14336,Gemm_Hipblaslt_TN_9192,0.688699
GemmTunableOp_Half_TN,tn_28672_3456_4096,Gemm_Hipblaslt_TN_9827,1.36656
GemmTunableOp_Half_TN,tn_28672_6773_4096,Gemm_Hipblaslt_TN_9943,2.82196
GemmTunableOp_Half_TN,tn_4096_3595_4096,Gemm_Hipblaslt_TN_9814,0.202858
GemmTunableOp_Half_TN,tn_28672_7072_4096,Gemm_Hipblaslt_TN_9892,2.8939
GemmTunableOp_Half_TN,tn_4096_2255_11008,Gemm_Hipblaslt_TN_9698,0.364141
GemmTunableOp_Half_TN,tn_4096_1894_4096,Gemm_Hipblaslt_TN_9645,0.121645
GemmTunableOp_Half_TN,tn_4096_1770_14336,Gemm_Hipblaslt_TN_9645,0.395688
GemmTunableOp_Half_TN,tn_6144_1721_4096,Gemm_Hipblaslt_TN_9690,0.155873
GemmTunableOp_Half_TN,tn_28672_5533_4096,Gemm_Hipblaslt_TN_9924,2.31426
GemmTunableOp_Half_TN,tn_4096_168_4096,Gemm_Rocblas_621294230,0.0224199
GemmTunableOp_Half_TN,tn_4096_6773_4096,Gemm_Hipblaslt_TN_9695,0.395121
GemmTunableOp_Half_TN,tn_128256_239_4096,Gemm_Rocblas_621294634,0.609138
GemmTunableOp_Half_TN,tn_4096_1935_4096,Gemm_Hipblaslt_TN_9134,0.123538
GemmTunableOp_Half_TN,tn_4096_1908_4096,Gemm_Hipblaslt_TN_9645,0.121204
GemmTunableOp_Half_TN,tn_4096_1733_14336,Gemm_Hipblaslt_TN_9645,0.391408
GemmTunableOp_Half_TN,tn_4096_5723_14336,Gemm_Hipblaslt_TN_9689,1.18801
GemmTunableOp_Half_TN,tn_128256_9_4096,Gemm_Hipblaslt_TN_9405,0.285688
GemmTunableOp_Half_TN,tn_4096_5541_14336,Gemm_Hipblaslt_TN_9709,1.17363
GemmTunableOp_Half_TN,tn_28672_6860_4096,Gemm_Hipblaslt_TN_9931,2.84344
GemmTunableOp_Half_TN,tn_4096_1685_4096,Gemm_Hipblaslt_TN_9265,0.108438
GemmTunableOp_Half_TN,tn_28672_7225_4096,Gemm_Hipblaslt_TN_159,2.90172
GemmTunableOp_Half_TN,tn_4096_1623_14336,Gemm_Hipblaslt_TN_9265,0.36092
GemmTunableOp_Half_TN,tn_6144_7267_4096,Gemm_Hipblaslt_TN_9677,0.609574
GemmTunableOp_Half_TN,tn_4096_2192_11008,Gemm_Hipblaslt_TN_9728,0.357544
GemmTunableOp_Half_TN,tn_4096_7023_4096,Gemm_Hipblaslt_TN_9743,0.402484
GemmTunableOp_Half_TN,tn_4096_6843_4096,Gemm_Hipblaslt_TN_9694,0.391195
GemmTunableOp_Half_TN,tn_4096_1590_14336,Gemm_Hipblaslt_TN_9265,0.356767
GemmTunableOp_Half_TN,tn_4096_7568_4096,Gemm_Rocblas_621294127,0.428998
GemmTunableOp_Half_TN,tn_4096_216_14336,Gemm_Hipblaslt_TN_9363,0.0705401
GemmTunableOp_Half_TN,tn_6144_6715_4096,Gemm_Hipblaslt_TN_9955,0.578705
GemmTunableOp_Half_TN,tn_4096_1573_14336,Gemm_Hipblaslt_TN_9265,0.356211
GemmTunableOp_Half_TN,tn_4096_1668_4096,Gemm_Hipblaslt_TN_9265,0.107845
GemmTunableOp_Half_TN,tn_4096_64_4096,Gemm_Rocblas_621294227,0.0127086
GemmTunableOp_Half_TN,tn_6144_128_4096,Gemm_Rocblas_621286443,0.0230216
GemmTunableOp_Half_TN,tn_6144_1887_4096,Gemm_Hipblaslt_TN_9799,0.16715
GemmTunableOp_Half_TN,tn_4096_7253_14336,Gemm_Hipblaslt_TN_9694,1.46408
GemmTunableOp_Half_TN,tn_6144_5100_4096,Gemm_Hipblaslt_TN_9768,0.43222
GemmTunableOp_Half_TN,tn_4096_1786_14336,Gemm_Hipblaslt_TN_9645,0.397066
GemmTunableOp_Half_TN,tn_28672_5319_4096,Gemm_Hipblaslt_TN_9860,2.1777
GemmTunableOp_Half_TN,tn_4096_6761_4096,Gemm_Hipblaslt_TN_9955,0.396175
GemmTunableOp_Half_TN,tn_4096_2063_11008,Gemm_Hipblaslt_TN_9698,0.348153
GemmTunableOp_Half_TN,tn_4096_1684_4096,Gemm_Hipblaslt_TN_9671,0.108232
GemmTunableOp_Half_TN,tn_6144_3584_4096,Gemm_Hipblaslt_TN_9570,0.32274
GemmTunableOp_Half_TN,tn_6144_1748_4096,Gemm_Hipblaslt_TN_9799,0.159168
GemmTunableOp_Half_TN,tn_6144_3652_4096,Gemm_Hipblaslt_TN_9690,0.325867
GemmTunableOp_Half_TN,tn_4096_1853_4096,Gemm_Hipblaslt_TN_9645,0.120033
GemmTunableOp_Half_TN,tn_6144_1589_4096,Gemm_Rocblas_621286565,0.147737
GemmTunableOp_Half_TN,tn_4096_1668_14336,Gemm_Hipblaslt_TN_9679,0.364179
GemmTunableOp_Half_TN,tn_6144_1981_4096,Gemm_Hipblaslt_TN_9187,0.178857
GemmTunableOp_Half_TN,tn_4096_1830_14336,Gemm_Hipblaslt_TN_9137,0.408053
GemmTunableOp_Half_TN,tn_4096_1586_4096,Gemm_Hipblaslt_TN_9265,0.105868
GemmTunableOp_Half_TN,tn_4096_1743_14336,Gemm_Hipblaslt_TN_9645,0.394203
GemmTunableOp_Half_TN,tn_6144_5219_4096,Gemm_Hipblaslt_TN_9959,0.444304
GemmTunableOp_Half_TN,tn_28672_3494_4096,Gemm_Hipblaslt_TN_9827,1.37277
GemmTunableOp_Half_TN,tn_28672_3416_4096,Gemm_Hipblaslt_TN_9841,1.36932
GemmTunableOp_Half_TN,tn_6144_3666_4096,Gemm_Hipblaslt_TN_9690,0.329929
GemmTunableOp_Half_TN,tn_4096_3559_14336,Gemm_Hipblaslt_TN_9743,0.68578
GemmTunableOp_Half_TN,tn_28672_3214_4096,Gemm_Hipblaslt_TN_9827,1.35185
GemmTunableOp_Half_TN,tn_4096_7439_4096,Gemm_Hipblaslt_TN_9933,0.425138
GemmTunableOp_Half_TN,tn_6144_1871_4096,Gemm_Rocblas_621294425,0.1685
GemmTunableOp_Half_TN,tn_4096_5301_14336,Gemm_Hipblaslt_TN_9799,1.11178
GemmTunableOp_Half_TN,tn_4096_7240_4096,Gemm_Hipblaslt_TN_9958,0.410316
GemmTunableOp_Half_TN,tn_4096_112_14336,Gemm_Hipblaslt_TN_7160,0.0452287
GemmTunableOp_Half_TN,tn_28672_1826_4096,Gemm_Hipblaslt_TN_9683,0.800924
GemmTunableOp_Half_TN,tn_4096_1978_4096,Gemm_Hipblaslt_TN_9680,0.124722
GemmTunableOp_Half_TN,tn_6144_1970_4096,Gemm_Hipblaslt_TN_9693,0.177634
GemmTunableOp_Half_TN,tn_4096_1866_14336,Gemm_Hipblaslt_TN_9645,0.413234
GemmTunableOp_Half_TN,tn_6144_88_4096,Gemm_Rocblas_621294029,0.018761
GemmTunableOp_Half_TN,tn_6144_1888_4096,Gemm_Rocblas_621286683,0.167355
GemmTunableOp_Half_TN,tn_4096_1825_14336,Gemm_Hipblaslt_TN_9645,0.407576
GemmTunableOp_Half_TN,tn_4096_5271_4096,Gemm_Hipblaslt_TN_9773,0.322289
GemmTunableOp_Half_TN,tn_6144_3497_4096,Gemm_Hipblaslt_TN_9672,0.317946
GemmTunableOp_Half_TN,tn_4096_1854_14336,Gemm_Hipblaslt_TN_9645,0.413695
GemmTunableOp_Half_TN,tn_4096_3497_14336,Gemm_Hipblaslt_TN_9697,0.686063
GemmTunableOp_Half_TN,tn_28672_1652_4096,Gemm_Rocblas_621286678,0.722294
GemmTunableOp_Half_TN,tn_6144_1792_4096,Gemm_Hipblaslt_TN_9711,0.162409
GemmTunableOp_Half_TN,tn_6144_5530_4096,Gemm_Hipblaslt_TN_9704,0.463745
GemmTunableOp_Half_TN,tn_4096_3564_14336,Gemm_Hipblaslt_TN_9743,0.687235
GemmTunableOp_Half_TN,tn_6144_3547_4096,Gemm_Rocblas_621286753,0.320334
GemmTunableOp_Half_TN,tn_4096_3535_14336,Gemm_Hipblaslt_TN_9743,0.68123
GemmTunableOp_Half_TN,tn_4096_7186_4096,Gemm_Hipblaslt_TN_9694,0.412262
GemmTunableOp_Half_TN,tn_4096_1586_14336,Gemm_Hipblaslt_TN_9679,0.35701
GemmTunableOp_Half_TN,tn_6144_1829_4096,Gemm_Hipblaslt_TN_9672,0.166123
GemmTunableOp_Half_TN,tn_28672_1738_4096,Gemm_Rocblas_621294420,0.739777
GemmTunableOp_Half_TN,tn_4096_1881_4096,Gemm_Hipblaslt_TN_9645,0.121047
GemmTunableOp_Half_TN,tn_4096_1825_4096,Gemm_Hipblaslt_TN_9645,0.120467
GemmTunableOp_Half_TN,tn_128256_97_4096,Gemm_Rocblas_621286783,0.421329
GemmTunableOp_Half_TN,tn_6144_248_4096,Gemm_Rocblas_621286469,0.0364901
GemmTunableOp_Half_TN,tn_4096_1683_4096,Gemm_Hipblaslt_TN_9671,0.106763
GemmTunableOp_Half_TN,tn_6144_5465_4096,Gemm_Hipblaslt_TN_9704,0.457806
GemmTunableOp_Half_TN,tn_6144_3559_4096,Gemm_Rocblas_621294495,0.320751
GemmTunableOp_Half_TN,tn_4096_1601_4096,Gemm_Hipblaslt_TN_9359,0.105661
GemmTunableOp_Half_TN,tn_4096_131_4096,Gemm_Rocblas_621294168,0.0213991
GemmTunableOp_Half_TN,tn_6144_1647_4096,Gemm_Rocblas_621286753,0.153696
GemmTunableOp_Half_TN,tn_6144_3400_4096,Gemm_Rocblas_621286753,0.310017
GemmTunableOp_Half_TN,tn_4096_5068_4096,Gemm_Hipblaslt_TN_9924,0.314449
GemmTunableOp_Half_TN,tn_4096_1859_14336,Gemm_Hipblaslt_TN_9592,0.412144
GemmTunableOp_Half_TN,tn_4096_3345_4096,Gemm_Hipblaslt_TN_9743,0.194712
GemmTunableOp_Half_TN,tn_6144_5412_4096,Gemm_Hipblaslt_TN_9190,0.45923
GemmTunableOp_Half_TN,tn_6144_1680_4096,Gemm_Hipblaslt_TN_9691,0.155063
GemmTunableOp_Half_TN,tn_6144_3595_4096,Gemm_Rocblas_621286566,0.321756
GemmTunableOp_Half_TN,tn_4096_5359_4096,Gemm_Hipblaslt_TN_9799,0.327853
GemmTunableOp_Half_TN,tn_32000_130_4096,Gemm_Hipblaslt_TN_9564,0.104536
GemmTunableOp_Half_TN,tn_6144_1902_4096,Gemm_Rocblas_621294426,0.16728
GemmTunableOp_Half_TN,tn_4096_3578_14336,Gemm_Hipblaslt_TN_9189,0.690908
GemmTunableOp_Half_TN,tn_28672_1721_4096,Gemm_Hipblaslt_TN_9217,0.735208
GemmTunableOp_Half_TN,tn_4096_6744_4096,Gemm_Hipblaslt_TN_9955,0.393181
GemmTunableOp_Half_TN,tn_4096_6630_14336,Gemm_Hipblaslt_TN_9732,1.37026
GemmTunableOp_Half_TN,tn_6144_3612_4096,Gemm_Rocblas_621286753,0.321893
GemmTunableOp_Half_TN,tn_6144_1596_4096,Gemm_Rocblas_621286565,0.147493
GemmTunableOp_Half_TN,tn_4096_152_4096,Gemm_Rocblas_621294168,0.022109
GemmTunableOp_Half_TN,tn_28672_5498_4096,Gemm_Hipblaslt_TN_9924,2.32128
GemmTunableOp_Half_TN,tn_4096_1896_4096,Gemm_Hipblaslt_TN_9645,0.121711
GemmTunableOp_Half_TN,tn_12288_152_4096,Gemm_Rocblas_621286472,0.045085
GemmTunableOp_Half_TN,tn_4096_72_14336,Gemm_Hipblaslt_TN_9294,0.0394345
GemmTunableOp_Half_TN,tn_28672_5277_4096,Gemm_Hipblaslt_TN_9893,2.16489
GemmTunableOp_Half_TN,tn_128256_56_4096,Gemm_Rocblas_621294554,0.357741
GemmTunableOp_Half_TN,tn_6144_7484_4096,Gemm_Hipblaslt_TN_9753,0.640391
GemmTunableOp_Half_TN,tn_4096_1637_14336,Gemm_Hipblaslt_TN_9265,0.360562
GemmTunableOp_Half_TN,tn_28672_1778_4096,Gemm_Hipblaslt_TN_9190,0.746223
GemmTunableOp_Half_TN,tn_4096_3780_4096,Gemm_Hipblaslt_TN_9827,0.216485
GemmTunableOp_Half_TN,tn_128256_232_4096,Gemm_Rocblas_621294634,0.602372
GemmTunableOp_Half_TN,tn_28672_6630_4096,Gemm_Hipblaslt_TN_9958,2.70081
GemmTunableOp_Half_TN,tn_4096_1663_14336,Gemm_Hipblaslt_TN_9265,0.365616
GemmTunableOp_Half_TN,tn_28672_1688_4096,Gemm_Hipblaslt_TN_9191,0.733272
GemmStridedBatchedTunableOp_Half_TN,tn_1670_1670_128_B_32,Gemm_Rocblas_621294110,0.117704
GemmStridedBatchedTunableOp_Half_TN,tn_1764_1764_128_B_32,Gemm_Rocblas_621286397,0.127288
GemmStridedBatchedTunableOp_Half_TN,tn_1942_1942_128_B_32,Gemm_Hipblaslt_TN_6879,0.156835
GemmStridedBatchedTunableOp_Half_TN,tn_1635_1635_128_B_32,Gemm_Hipblaslt_TN_6942,0.114704
GemmStridedBatchedTunableOp_Half_TN,tn_1958_1958_128_B_32,Gemm_Rocblas_621294533,0.159613
GemmStridedBatchedTunableOp_Half_TN,tn_1935_1935_128_B_32,Gemm_Hipblaslt_TN_6879,0.154509
GemmStridedBatchedTunableOp_Half_TN,tn_1896_1896_128_B_32,Gemm_Hipblaslt_TN_157,0.136962
GemmStridedBatchedTunableOp_Half_TN,tn_1819_1819_128_B_32,Gemm_Hipblaslt_TN_6942,0.142668
GemmStridedBatchedTunableOp_Half_TN,tn_1653_1653_128_B_32,Gemm_Hipblaslt_TN_6942,0.118525
GemmStridedBatchedTunableOp_Half_TN,tn_1848_1848_128_B_32,Gemm_Hipblaslt_TN_157,0.133399
GemmStridedBatchedTunableOp_Half_TN,tn_1683_1683_128_B_32,Gemm_Hipblaslt_TN_6942,0.122287
GemmStridedBatchedTunableOp_Half_TN,tn_1874_1874_128_B_32,Gemm_Hipblaslt_TN_6942,0.14682
GemmStridedBatchedTunableOp_Half_TN,tn_1661_1661_128_B_32,Gemm_Hipblaslt_TN_6942,0.119041
GemmStridedBatchedTunableOp_Half_TN,tn_1743_1743_128_B_32,Gemm_Rocblas_621286397,0.129792
GemmStridedBatchedTunableOp_Half_TN,tn_1614_1614_128_B_32,Gemm_Hipblaslt_TN_6942,0.114621
GemmStridedBatchedTunableOp_Half_TN,tn_1673_1673_128_B_32,Gemm_Rocblas_621294106,0.11674
GemmStridedBatchedTunableOp_Half_TN,tn_1789_1789_128_B_32,Gemm_Rocblas_621286397,0.133697
GemmStridedBatchedTunableOp_Half_TN,tn_1797_1797_128_B_32,Gemm_Hipblaslt_TN_6942,0.14052
GemmStridedBatchedTunableOp_Half_TN,tn_1766_1766_128_B_32,Gemm_Rocblas_621286397,0.131105
GemmStridedBatchedTunableOp_Half_TN,tn_1837_1837_128_B_32,Gemm_Rocblas_621294740,0.144923
GemmStridedBatchedTunableOp_Half_TN,tn_1845_1845_128_B_32,Gemm_Hipblaslt_TN_6942,0.146427
GemmStridedBatchedTunableOp_Half_TN,tn_1770_1770_128_B_32,Gemm_Rocblas_621286413,0.131316
GemmStridedBatchedTunableOp_Half_TN,tn_1691_1691_128_B_32,Gemm_Rocblas_621294110,0.120076
GemmStridedBatchedTunableOp_Half_TN,tn_1891_1891_128_B_32,Gemm_Hipblaslt_TN_6942,0.147421
GemmStridedBatchedTunableOp_Half_TN,tn_1826_1826_128_B_32,Gemm_Hipblaslt_TN_6942,0.140187
GemmStridedBatchedTunableOp_Half_TN,tn_1802_1802_128_B_32,Gemm_Hipblaslt_TN_6942,0.135942
GemmStridedBatchedTunableOp_Half_TN,tn_1620_1620_128_B_32,Gemm_Hipblaslt_TN_6942,0.113968
GemmStridedBatchedTunableOp_Half_TN,tn_1988_1988_128_B_32,Gemm_Hipblaslt_TN_6879,0.163671
GemmStridedBatchedTunableOp_Half_TN,tn_1977_1977_128_B_32,Gemm_Rocblas_621294533,0.163862
GemmStridedBatchedTunableOp_Half_TN,tn_2337_2337_128_B_32,Gemm_Rocblas_621294106,0.232298
GemmStridedBatchedTunableOp_Half_TN,tn_1885_1885_128_B_32,Gemm_Hipblaslt_TN_6942,0.147493
GemmStridedBatchedTunableOp_Half_TN,tn_1944_1944_128_B_32,Gemm_Hipblaslt_TN_157,0.145672
GemmStridedBatchedTunableOp_Half_TN,tn_1613_1613_128_B_32,Gemm_Hipblaslt_TN_6942,0.115478
GemmStridedBatchedTunableOp_Half_TN,tn_1782_1782_128_B_32,Gemm_Hipblaslt_TN_6874,0.133404
GemmStridedBatchedTunableOp_Half_TN,tn_1981_1981_128_B_32,Gemm_Hipblaslt_TN_6879,0.161574
GemmStridedBatchedTunableOp_Half_TN,tn_1741_1741_128_B_32,Gemm_Rocblas_621294108,0.128494
GemmStridedBatchedTunableOp_Half_TN,tn_1605_1605_128_B_32,Gemm_Rocblas_621286397,0.109736
GemmStridedBatchedTunableOp_Half_TN,tn_1943_1943_128_B_32,Gemm_Rocblas_621294533,0.157899
GemmStridedBatchedTunableOp_Half_TN,tn_2369_2369_128_B_32,Gemm_Hipblaslt_TN_6950,0.240785
GemmStridedBatchedTunableOp_Half_TN,tn_1932_1932_128_B_32,Gemm_Hipblaslt_TN_6879,0.151962
GemmStridedBatchedTunableOp_Half_TN,tn_1857_1857_128_B_32,Gemm_Hipblaslt_TN_6942,0.14371
GemmStridedBatchedTunableOp_Half_TN,tn_2401_2401_128_B_32,Gemm_Rocblas_621294106,0.244769
GemmStridedBatchedTunableOp_Half_TN,tn_1689_1689_128_B_32,Gemm_Hipblaslt_TN_6942,0.121106
GemmStridedBatchedTunableOp_Half_TN,tn_1723_1723_128_B_32,Gemm_Rocblas_621286413,0.124709
GemmStridedBatchedTunableOp_Half_TN,tn_2289_2289_128_B_32,Gemm_Rocblas_621294106,0.218495
GemmStridedBatchedTunableOp_Half_TN,tn_1647_1647_128_B_32,Gemm_Hipblaslt_TN_6942,0.116285
GemmStridedBatchedTunableOp_Half_TN,tn_1762_1762_128_B_32,Gemm_Rocblas_621294110,0.130336
GemmStridedBatchedTunableOp_Half_TN,tn_1794_1794_128_B_32,Gemm_Hipblaslt_TN_6942,0.136766
GemmStridedBatchedTunableOp_Half_TN,tn_1974_1974_128_B_32,Gemm_Hipblaslt_TN_6879,0.163186
GemmStridedBatchedTunableOp_Half_TN,tn_1964_1964_128_B_32,Gemm_Rocblas_621294533,0.159279
GemmStridedBatchedTunableOp_Half_TN,tn_2225_2225_128_B_32,Gemm_Rocblas_621294106,0.205191
GemmStridedBatchedTunableOp_Half_TN,tn_1648_1648_128_B_32,Gemm_Rocblas_621286412,0.110788
GemmStridedBatchedTunableOp_Half_TN,tn_1975_1975_128_B_32,Gemm_Hipblaslt_TN_6879,0.163211
GemmStridedBatchedTunableOp_Half_TN,tn_1787_1787_128_B_32,Gemm_Hipblaslt_TN_6879,0.133282
GemmStridedBatchedTunableOp_Half_TN,tn_2497_2497_128_B_32,Gemm_Rocblas_621294106,0.259157
GemmStridedBatchedTunableOp_Half_TN,tn_1871_1871_128_B_32,Gemm_Hipblaslt_TN_6942,0.147442
GemmStridedBatchedTunableOp_Half_TN,tn_1918_1918_128_B_32,Gemm_Hipblaslt_TN_6942,0.149964
GemmStridedBatchedTunableOp_Half_TN,tn_1688_1688_128_B_32,Gemm_Rocblas_621286413,0.118234
GemmStridedBatchedTunableOp_Half_TN,tn_2193_2193_128_B_32,Gemm_Rocblas_621294106,0.200933
GemmStridedBatchedTunableOp_Half_TN,tn_1973_1973_128_B_32,Gemm_Rocblas_621294533,0.16211
GemmStridedBatchedTunableOp_Half_TN,tn_2272_2272_128_B_32,Gemm_Rocblas_621286411,0.180828
GemmStridedBatchedTunableOp_Half_TN,tn_1740_1740_128_B_32,Gemm_Rocblas_621286397,0.126858
GemmStridedBatchedTunableOp_Half_TN,tn_2063_2063_128_B_32,Gemm_Rocblas_621286397,0.177224
GemmStridedBatchedTunableOp_Half_TN,tn_1909_1909_128_B_32,Gemm_Hipblaslt_TN_6942,0.148496
GemmStridedBatchedTunableOp_Half_TN,tn_1799_1799_128_B_32,Gemm_Hipblaslt_TN_6942,0.13503
GemmStridedBatchedTunableOp_Half_TN,tn_1694_1694_128_B_32,Gemm_Rocblas_621286413,0.119962
GemmStridedBatchedTunableOp_Half_TN,tn_1950_1950_128_B_32,Gemm_Rocblas_621294533,0.157564
GemmStridedBatchedTunableOp_Half_TN,tn_1855_1855_128_B_32,Gemm_Hipblaslt_TN_6942,0.146312
GemmStridedBatchedTunableOp_Half_TN,tn_1790_1790_128_B_32,Gemm_Rocblas_621294108,0.132795
GemmStridedBatchedTunableOp_Half_TN,tn_1755_1755_128_B_32,Gemm_Hipblaslt_TN_6874,0.130846
GemmStridedBatchedTunableOp_Half_TN,tn_1854_1854_128_B_32,Gemm_Hipblaslt_TN_6942,0.145803
GemmStridedBatchedTunableOp_Half_TN,tn_1662_1662_128_B_32,Gemm_Hipblaslt_TN_6942,0.118193
GemmStridedBatchedTunableOp_Half_TN,tn_1775_1775_128_B_32,Gemm_Rocblas_621286397,0.132454
GemmStridedBatchedTunableOp_Half_TN,tn_1833_1833_128_B_32,Gemm_Hipblaslt_TN_6942,0.14156
GemmStridedBatchedTunableOp_Half_TN,tn_1840_1840_128_B_32,Gemm_Hipblaslt_TN_153,0.131657
GemmStridedBatchedTunableOp_Half_TN,tn_1761_1761_128_B_32,Gemm_Rocblas_621294108,0.128537
GemmStridedBatchedTunableOp_Half_TN,tn_1592_1592_128_B_32,Gemm_Rocblas_621286397,0.109975
GemmStridedBatchedTunableOp_Half_TN,tn_1862_1862_128_B_32,Gemm_Hipblaslt_TN_6942,0.145107
GemmStridedBatchedTunableOp_Half_TN,tn_1956_1956_128_B_32,Gemm_Rocblas_621294533,0.158837
GemmStridedBatchedTunableOp_Half_TN,tn_1925_1925_128_B_32,Gemm_Rocblas_621294533,0.154437
GemmStridedBatchedTunableOp_Half_TN,tn_1947_1947_128_B_32,Gemm_Rocblas_621294533,0.158167
GemmStridedBatchedTunableOp_Half_TN,tn_1858_1858_128_B_32,Gemm_Hipblaslt_TN_6942,0.142795
GemmStridedBatchedTunableOp_Half_TN,tn_1814_1814_128_B_32,Gemm_Hipblaslt_TN_6942,0.136882
GemmStridedBatchedTunableOp_Half_TN,tn_1903_1903_128_B_32,Gemm_Hipblaslt_TN_6942,0.150856
GemmStridedBatchedTunableOp_Half_TN,tn_1678_1678_128_B_32,Gemm_Hipblaslt_TN_6942,0.119607
GemmStridedBatchedTunableOp_Half_TN,tn_1611_1611_128_B_32,Gemm_Hipblaslt_TN_6942,0.115339
GemmStridedBatchedTunableOp_Half_TN,tn_1682_1682_128_B_32,Gemm_Rocblas_621286413,0.119527
GemmStridedBatchedTunableOp_Half_TN,tn_1655_1655_128_B_32,Gemm_Hipblaslt_TN_6942,0.118827
GemmStridedBatchedTunableOp_Half_TN,tn_1791_1791_128_B_32,Gemm_Hipblaslt_TN_6874,0.134075
GemmStridedBatchedTunableOp_Half_TN,tn_1645_1645_128_B_32,Gemm_Hipblaslt_TN_6942,0.116962
GemmStridedBatchedTunableOp_Half_TN,tn_1912_1912_128_B_32,Gemm_Hipblaslt_TN_157,0.138929
GemmStridedBatchedTunableOp_Half_TN,tn_1938_1938_128_B_32,Gemm_Hipblaslt_TN_6879,0.154014
GemmStridedBatchedTunableOp_Half_TN,tn_1753_1753_128_B_32,Gemm_Rocblas_621294110,0.13072
GemmStridedBatchedTunableOp_Half_TN,tn_1904_1904_128_B_32,Gemm_Hipblaslt_TN_157,0.136408
GemmStridedBatchedTunableOp_Half_TN,tn_1700_1700_128_B_32,Gemm_Rocblas_621294110,0.120488
GemmStridedBatchedTunableOp_Half_TN,tn_1900_1900_128_B_32,Gemm_Hipblaslt_TN_6942,0.147344
GemmStridedBatchedTunableOp_Half_TN,tn_1650_1650_128_B_32,Gemm_Hipblaslt_TN_6942,0.116568
GemmStridedBatchedTunableOp_Half_TN,tn_1710_1710_128_B_32,Gemm_Rocblas_621286413,0.120703
GemmStridedBatchedTunableOp_Half_TN,tn_1657_1657_128_B_32,Gemm_Hipblaslt_TN_6942,0.119133
GemmStridedBatchedTunableOp_Half_TN,tn_2385_2385_128_B_32,Gemm_Hipblaslt_TN_6879,0.242315
GemmStridedBatchedTunableOp_Half_TN,tn_1968_1968_128_B_32,Gemm_Hipblaslt_TN_153,0.148049
GemmTunableOp_Half_TN,tn_28672_6979_4096,Gemm_Hipblaslt_TN_159,2.89171
GemmTunableOp_Half_TN,tn_4096_5447_4096,Gemm_Rocblas_621294426,0.336887
GemmTunableOp_Half_TN,tn_4096_3581_4096,Gemm_Hipblaslt_TN_9682,0.205862
GemmTunableOp_Half_TN,tn_4096_1796_4096,Gemm_Hipblaslt_TN_9134,0.118639
GemmTunableOp_Half_TN,tn_6144_1796_4096,Gemm_Hipblaslt_TN_9799,0.166166
GemmTunableOp_Half_TN,tn_28672_1717_4096,Gemm_Hipblaslt_TN_9217,0.749827
GemmTunableOp_Half_TN,tn_4096_3309_14336,Gemm_Hipblaslt_TN_9743,0.660759
GemmTunableOp_Half_TN,tn_4096_1660_4096,Gemm_Hipblaslt_TN_9679,0.108063
GemmTunableOp_Half_TN,tn_128256_6_4096,Gemm_Rocblas_621294224,0.284735
GemmTunableOp_Half_TN,tn_4096_1658_14336,Gemm_Hipblaslt_TN_9671,0.363782
GemmTunableOp_Half_TN,tn_4096_5219_14336,Gemm_Hipblaslt_TN_9799,1.11238
GemmTunableOp_Half_TN,tn_4096_1593_14336,Gemm_Hipblaslt_TN_9679,0.35746
GemmTunableOp_Half_TN,tn_128256_171_4096,Gemm_Hipblaslt_TN_9752,0.513778
GemmTunableOp_Half_TN,tn_4096_1752_4096,Gemm_Hipblaslt_TN_9134,0.117197
GemmTunableOp_Half_TN,tn_4096_1615_4096,Gemm_Hipblaslt_TN_9671,0.105034
GemmTunableOp_Half_TN,tn_6144_7240_4096,Gemm_Rocblas_621286743,0.620956
GemmTunableOp_Half_TN,tn_6144_5223_4096,Gemm_Hipblaslt_TN_9704,0.451766
GemmTunableOp_Half_TN,tn_6144_1967_4096,Gemm_Hipblaslt_TN_9697,0.17963
GemmTunableOp_Half_TN,tn_6144_48_4096,Gemm_Rocblas_621294061,0.0156684
GemmTunableOp_Half_TN,tn_6144_1717_4096,Gemm_Hipblaslt_TN_9799,0.158466
GemmTunableOp_Half_TN,tn_28672_3647_4096,Gemm_Hipblaslt_TN_9832,1.49545
GemmTunableOp_Half_TN,tn_4096_7033_4096,Gemm_Hipblaslt_TN_9743,0.404946
GemmTunableOp_Half_TN,tn_6144_1620_4096,Gemm_Hipblaslt_TN_9570,0.150935
GemmTunableOp_Half_TN,tn_6144_7730_4096,Gemm_Rocblas_621294484,0.670305
GemmTunableOp_Half_TN,tn_28672_1931_4096,Gemm_Hipblaslt_TN_9846,0.856427
GemmTunableOp_Half_TN,tn_28672_256_4096,Gemm_Rocblas_621294324,0.121344
GemmTunableOp_Half_TN,tn_6144_5512_4096,Gemm_Rocblas_621286693,0.466256
GemmTunableOp_Half_TN,tn_4096_1871_14336,Gemm_Hipblaslt_TN_9645,0.411732
GemmTunableOp_Half_TN,tn_4096_1805_14336,Gemm_Hipblaslt_TN_9620,0.408866
GemmTunableOp_Half_TN,tn_28672_3651_4096,Gemm_Hipblaslt_TN_9827,1.53012
GemmTunableOp_Half_TN,tn_28672_3645_4096,Gemm_Hipblaslt_TN_9832,1.50475
GemmTunableOp_Half_TN,tn_28672_6920_4096,Gemm_Hipblaslt_TN_9944,2.91586
GemmTunableOp_Half_TN,tn_4096_1934_14336,Gemm_Hipblaslt_TN_9645,0.423114
GemmTunableOp_Half_TN,tn_4096_1934_4096,Gemm_Hipblaslt_TN_9645,0.124297
GemmTunableOp_Half_TN,tn_4096_7118_14336,Gemm_Hipblaslt_TN_9743,1.46735
GemmTunableOp_Half_TN,tn_6144_64_4096,Gemm_Rocblas_621286428,0.0156846
GemmTunableOp_Half_TN,tn_12288_2385_4096,Gemm_Rocblas_621294484,0.423928
GemmTunableOp_Half_TN,tn_4096_7050_4096,Gemm_Hipblaslt_TN_9743,0.409607
GemmTunableOp_Half_TN,tn_28672_7403_4096,Gemm_Hipblaslt_TN_159,2.9529
GemmTunableOp_Half_TN,tn_4096_1879_14336,Gemm_Hipblaslt_TN_9645,0.41633
GemmTunableOp_Half_TN,tn_6144_5723_4096,Gemm_Rocblas_621294426,0.511866
GemmTunableOp_Half_TN,tn_4096_141_4096,Gemm_Hipblaslt_TN_9474,0.0214404
GemmTunableOp_Half_TN,tn_4096_6788_14336,Gemm_Hipblaslt_TN_9696,1.42208
GemmTunableOp_Half_TN,tn_6144_1883_4096,Gemm_Rocblas_621294425,0.168468
GemmTunableOp_Half_TN,tn_6144_3688_4096,Gemm_Rocblas_621286684,0.338238
GemmTunableOp_Half_TN,tn_4096_5204_4096,Gemm_Rocblas_621294320,0.327222
GemmTunableOp_Half_TN,tn_28672_1603_4096,Gemm_Rocblas_621294420,0.729961
GemmTunableOp_Half_TN,tn_28672_3379_4096,Gemm_Hipblaslt_TN_9841,1.39617
GemmTunableOp_Half_TN,tn_28672_1847_4096,Gemm_Hipblaslt_TN_9683,0.810764
GemmTunableOp_Half_TN,tn_6144_1882_4096,Gemm_Rocblas_621294425,0.170203
GemmTunableOp_Half_TN,tn_4096_1764_4096,Gemm_Hipblaslt_TN_9134,0.116897
GemmTunableOp_Half_TN,tn_4096_1872_4096,Gemm_Hipblaslt_TN_9645,0.12288
GemmTunableOp_Half_TN,tn_4096_1961_4096,Gemm_Hipblaslt_TN_9645,0.125777
GemmTunableOp_Half_TN,tn_4096_1771_14336,Gemm_Hipblaslt_TN_9645,0.395274
GemmTunableOp_Half_TN,tn_128256_182_4096,Gemm_Hipblaslt_TN_9857,0.519471
GemmTunableOp_Half_TN,tn_6144_3682_4096,Gemm_Rocblas_621286684,0.339497
GemmTunableOp_Half_TN,tn_28672_1623_4096,Gemm_Hipblaslt_TN_9730,0.732711
GemmTunableOp_Half_TN,tn_4096_3691_4096,Gemm_Hipblaslt_TN_9827,0.214104
GemmTunableOp_Half_TN,tn_4096_3640_14336,Gemm_Hipblaslt_TN_9814,0.710021
GemmTunableOp_Half_TN,tn_28672_1636_4096,Gemm_Hipblaslt_TN_9730,0.736774
GemmTunableOp_Half_TN,tn_28672_5068_4096,Gemm_Hipblaslt_TN_9849,2.14041
GemmTunableOp_Half_TN,tn_4096_7190_4096,Gemm_Hipblaslt_TN_9743,0.422844
GemmTunableOp_Half_TN,tn_6144_1636_4096,Gemm_Rocblas_621294495,0.15447
GemmTunableOp_Half_TN,tn_4096_16_14336,Gemm_Rocblas_621286312,0.024414
GemmTunableOp_Half_TN,tn_28672_3791_4096,Gemm_Hipblaslt_TN_9841,1.5728
GemmTunableOp_Half_TN,tn_4096_1588_14336,Gemm_Hipblaslt_TN_9671,0.358857
GemmTunableOp_Half_TN,tn_128256_10_4096,Gemm_Hipblaslt_TN_9405,0.289236
GemmTunableOp_Half_TN,tn_4096_3496_4096,Gemm_Hipblaslt_TN_9814,0.200605
GemmTunableOp_Half_TN,tn_4096_1708_14336,Gemm_Hipblaslt_TN_9671,0.37142
GemmTunableOp_Half_TN,tn_4096_3629_14336,Gemm_Hipblaslt_TN_9187,0.705042
GemmTunableOp_Half_TN,tn_6144_5285_4096,Gemm_Hipblaslt_TN_9190,0.455851
GemmTunableOp_Half_TN,tn_28672_1787_4096,Gemm_Hipblaslt_TN_9217,0.759021
GemmTunableOp_Half_TN,tn_4096_3557_4096,Gemm_Hipblaslt_TN_9743,0.204004
GemmTunableOp_Half_TN,tn_4096_1807_4096,Gemm_Hipblaslt_TN_9645,0.121059
GemmTunableOp_Half_TN,tn_4096_1933_4096,Gemm_Hipblaslt_TN_9645,0.123017
GemmTunableOp_Half_TN,tn_4096_6902_4096,Gemm_Hipblaslt_TN_9958,0.404225
GemmTunableOp_Half_TN,tn_28672_1801_4096,Gemm_Hipblaslt_TN_9683,0.801282
GemmTunableOp_Half_TN,tn_4096_104_14336,Gemm_Hipblaslt_TN_7160,0.0441034
GemmTunableOp_Half_TN,tn_28672_1769_4096,Gemm_Hipblaslt_TN_9190,0.758745
GemmTunableOp_Half_TN,tn_28672_3630_4096,Gemm_Hipblaslt_TN_9832,1.51625
GemmTunableOp_Half_TN,tn_6144_1826_4096,Gemm_Rocblas_621294425,0.166861
GemmTunableOp_Half_TN,tn_28672_3508_4096,Gemm_Hipblaslt_TN_9827,1.40657
GemmTunableOp_Half_TN,tn_4096_1605_4096,Gemm_Hipblaslt_TN_9679,0.105548
GemmTunableOp_Half_TN,tn_4096_3600_14336,Gemm_Hipblaslt_TN_9139,0.707674
GemmTunableOp_Half_TN,tn_22016_2305_4096,Gemm_Hipblaslt_TN_9846,0.800987
GemmTunableOp_Half_TN,tn_4096_8192_4096,Gemm_Rocblas_621286281,0.467393
GemmTunableOp_Half_TN,tn_6144_3562_4096,Gemm_Rocblas_621294306,0.323775
GemmTunableOp_Half_TN,tn_4096_3562_14336,Gemm_Hipblaslt_TN_9743,0.693107
GemmTunableOp_Half_TN,tn_6144_3420_4096,Gemm_Hipblaslt_TN_9570,0.316684
GemmTunableOp_Half_TN,tn_4096_3219_4096,Gemm_Hipblaslt_TN_9187,0.189939
GemmTunableOp_Half_TN,tn_6144_1820_4096,Gemm_Rocblas_621286683,0.164083
GemmTunableOp_Half_TN,tn_28672_1928_4096,Gemm_Hipblaslt_TN_9846,0.859433
GemmTunableOp_Half_TN,tn_4096_1820_4096,Gemm_Hipblaslt_TN_9602,0.119262
GemmTunableOp_Half_TN,tn_22016_2257_4096,Gemm_Hipblaslt_TN_9832,0.758299
GemmTunableOp_Half_TN,tn_4096_3515_4096,Gemm_Hipblaslt_TN_9743,0.203077
GemmTunableOp_Half_TN,tn_6144_5239_4096,Gemm_Rocblas_621286678,0.449779
GemmTunableOp_Half_TN,tn_28672_1706_4096,Gemm_Rocblas_621286742,0.75077
GemmTunableOp_Half_TN,tn_6144_1609_4096,Gemm_Rocblas_621294495,0.151869
GemmTunableOp_Half_TN,tn_4096_1916_14336,Gemm_Hipblaslt_TN_9620,0.421626
GemmTunableOp_Half_TN,tn_4096_1850_4096,Gemm_Hipblaslt_TN_9645,0.120828
GemmTunableOp_Half_TN,tn_28672_1752_4096,Gemm_Hipblaslt_TN_9730,0.755442
GemmTunableOp_Half_TN,tn_4096_1966_14336,Gemm_Hipblaslt_TN_9620,0.426152
GemmTunableOp_Half_TN,tn_4096_1757_14336,Gemm_Hipblaslt_TN_9645,0.395146
GemmTunableOp_Half_TN,tn_28672_1872_4096,Gemm_Hipblaslt_TN_9821,0.823787
GemmTunableOp_Half_TN,tn_6144_1745_4096,Gemm_Hipblaslt_TN_9799,0.157331
GemmTunableOp_Half_TN,tn_28672_1748_4096,Gemm_Hipblaslt_TN_9220,0.757278
GemmTunableOp_Half_TN,tn_4096_6916_4096,Gemm_Hipblaslt_TN_9694,0.409339
GemmTunableOp_Half_TN,tn_4096_1737_14336,Gemm_Hipblaslt_TN_9645,0.394645
GemmTunableOp_Half_TN,tn_4096_3713_14336,Gemm_Hipblaslt_TN_9841,0.729555
GemmTunableOp_Half_TN,tn_128256_90_4096,Gemm_Hipblaslt_TN_9057,0.396768
GemmTunableOp_Half_TN,tn_28672_1866_4096,Gemm_Hipblaslt_TN_9684,0.816383
GemmTunableOp_Half_TN,tn_28672_3478_4096,Gemm_Hipblaslt_TN_9827,1.40935
GemmTunableOp_Half_TN,tn_4096_1838_4096,Gemm_Hipblaslt_TN_9645,0.121734
GemmTunableOp_Half_TN,tn_4096_155_4096,Gemm_Rocblas_621286440,0.0224078
GemmTunableOp_Half_TN,tn_4096_1590_4096,Gemm_Hipblaslt_TN_9616,0.106102
GemmTunableOp_Half_TN,tn_4096_143_4096,Gemm_Rocblas_621294168,0.0218762
GemmTunableOp_Half_TN,tn_4096_5498_14336,Gemm_Hipblaslt_TN_9709,1.18467
GemmTunableOp_Half_TN,tn_4096_1735_14336,Gemm_Hipblaslt_TN_9645,0.392695
GemmTunableOp_Half_TN,tn_4096_3651_14336,Gemm_Hipblaslt_TN_9813,0.720528
GemmTunableOp_Half_TN,tn_4096_1858_4096,Gemm_Hipblaslt_TN_9134,0.121662
GemmTunableOp_Half_TN,tn_6144_1599_4096,Gemm_Rocblas_621286565,0.147689
GemmTunableOp_Half_TN,tn_4096_240_4096,Gemm_Rocblas_621286440,0.0264054
GemmTunableOp_Half_TN,tn_4096_1643_14336,Gemm_Hipblaslt_TN_9679,0.36376
GemmTunableOp_Half_TN,tn_6144_7345_4096,Gemm_Hipblaslt_TN_9815,0.642353
GemmTunableOp_Half_TN,tn_28672_3780_4096,Gemm_Hipblaslt_TN_9827,1.56234
GemmTunableOp_Half_TN,tn_4096_1804_14336,Gemm_Hipblaslt_TN_9592,0.412049
GemmTunableOp_Half_TN,tn_128256_37_4096,Gemm_Hipblaslt_TN_9451,0.333735
GemmTunableOp_Half_TN,tn_4096_5277_14336,Gemm_Hipblaslt_TN_9709,1.10754
GemmTunableOp_Half_TN,tn_28672_3420_4096,Gemm_Hipblaslt_TN_9827,1.40456
GemmTunableOp_Half_TN,tn_6144_1610_4096,Gemm_Rocblas_621286753,0.152315
GemmTunableOp_Half_TN,tn_128256_170_4096,Gemm_Hipblaslt_TN_9952,0.510421
GemmTunableOp_Half_TN,tn_4096_1760_4096,Gemm_Hipblaslt_TN_9134,0.116585
GemmTunableOp_Half_TN,tn_4096_1739_4096,Gemm_Hipblaslt_TN_9134,0.117937
GemmTunableOp_Half_TN,tn_4096_144_11008,Gemm_Hipblaslt_TN_8260,0.0468802
GemmTunableOp_Half_TN,tn_4096_5157_14336,Gemm_Hipblaslt_TN_9799,1.09853
GemmTunableOp_Half_TN,tn_4096_2258_11008,Gemm_Hipblaslt_TN_9698,0.362494
GemmTunableOp_Half_TN,tn_128256_32_4096,Gemm_Rocblas_621294578,0.316597
GemmTunableOp_Half_TN,tn_28672_7047_4096,Gemm_Hipblaslt_TN_9747,2.93545
GemmTunableOp_Half_TN,tn_4096_1623_4096,Gemm_Hipblaslt_TN_9679,0.104786
GemmTunableOp_Half_TN,tn_4096_1946_14336,Gemm_Hipblaslt_TN_9620,0.420512
GemmTunableOp_Half_TN,tn_4096_3748_4096,Gemm_Hipblaslt_TN_9827,0.218214
GemmTunableOp_Half_TN,tn_128256_165_4096,Gemm_Hipblaslt_TN_9732,0.512259
GemmTunableOp_Half_TN,tn_4096_1827_4096,Gemm_Hipblaslt_TN_9134,0.121742
GemmTunableOp_Half_TN,tn_4096_155_11008,Gemm_Hipblaslt_TN_8260,0.0482249
GemmTunableOp_Half_TN,tn_28672_7186_4096,Gemm_Hipblaslt_TN_159,2.94463
GemmTunableOp_Half_TN,tn_4096_154_4096,Gemm_Rocblas_621294168,0.0221342
GemmTunableOp_Half_TN,tn_12288_2209_4096,Gemm_Hipblaslt_TN_9677,0.390432
GemmTunableOp_Half_TN,tn_4096_2274_11008,Gemm_Hipblaslt_TN_9728,0.364254
GemmTunableOp_Half_TN,tn_6144_6789_4096,Gemm_Hipblaslt_TN_9955,0.595942
GemmTunableOp_Half_TN,tn_4096_3501_14336,Gemm_Hipblaslt_TN_9187,0.692204
GemmTunableOp_Half_TN,tn_4096_129_4096,Gemm_Rocblas_621286443,0.0217761
GemmTunableOp_Half_TN,tn_28672_5354_4096,Gemm_Hipblaslt_TN_9915,2.21659
GemmTunableOp_Half_TN,tn_22016_137_4096,Gemm_Hipblaslt_TN_9319,0.0721338
GemmTunableOp_Half_TN,tn_22016_2192_4096,Gemm_Hipblaslt_TN_9827,0.69698
GemmTunableOp_Half_TN,tn_4096_1815_14336,Gemm_Hipblaslt_TN_9645,0.408165
GemmTunableOp_Half_TN,tn_28672_1970_4096,Gemm_Hipblaslt_TN_9846,0.86507
GemmTunableOp_Half_TN,tn_12288_4017_4096,Gemm_Hipblaslt_TN_9749,0.68461
GemmTunableOp_Half_TN,tn_4096_2081_4096,Gemm_Hipblaslt_TN_9686,0.131643
GemmTunableOp_Half_TN,tn_22016_2272_4096,Gemm_Hipblaslt_TN_9832,0.764161
GemmTunableOp_Half_TN,tn_4096_5570_14336,Gemm_Hipblaslt_TN_9672,1.19367
GemmTunableOp_Half_TN,tn_4096_1896_14336,Gemm_Hipblaslt_TN_9620,0.416964
GemmTunableOp_Half_TN,tn_4096_7386_4096,Gemm_Rocblas_621294127,0.432822
GemmTunableOp_Half_TN,tn_28672_56_4096,Gemm_Hipblaslt_TN_9157,0.0502827
GemmTunableOp_Half_TN,tn_4096_3781_4096,Gemm_Hipblaslt_TN_9768,0.21801
GemmTunableOp_Half_TN,tn_6144_5381_4096,Gemm_Rocblas_621294420,0.464012
GemmTunableOp_Half_TN,tn_22016_136_4096,Gemm_Hipblaslt_TN_9319,0.0713774
GemmTunableOp_Half_TN,tn_4096_2497_4096,Gemm_Hipblaslt_TN_9799,0.155706
GemmTunableOp_Half_TN,tn_4096_147_11008,Gemm_Hipblaslt_TN_7219,0.0470868
GemmTunableOp_Half_TN,tn_128256_146_4096,Gemm_Hipblaslt_TN_9108,0.476508
GemmTunableOp_Half_TN,tn_6144_6788_4096,Gemm_Hipblaslt_TN_9955,0.598655
GemmTunableOp_Half_TN,tn_4096_139_4096,Gemm_Rocblas_621286491,0.0222422
GemmTunableOp_Half_TN,tn_22016_2401_4096,Gemm_Hipblaslt_TN_9846,0.81263
GemmTunableOp_Half_TN,tn_28672_6971_4096,Gemm_Hipblaslt_TN_9915,2.91067
GemmTunableOp_Half_TN,tn_28672_7093_4096,Gemm_Hipblaslt_TN_159,2.93717
GemmTunableOp_Half_TN,tn_12288_2064_4096,Gemm_Hipblaslt_TN_9697,0.372649
GemmTunableOp_Half_TN,tn_28672_1749_4096,Gemm_Hipblaslt_TN_9730,0.754875
GemmTunableOp_Half_TN,tn_12288_2353_4096,Gemm_Rocblas_621294484,0.42018
GemmTunableOp_Half_TN,tn_4096_1704_4096,Gemm_Hipblaslt_TN_9607,0.106723
GemmTunableOp_Half_TN,tn_6144_7050_4096,Gemm_Hipblaslt_TN_9192,0.612268
GemmTunableOp_Half_TN,tn_128256_256_4096,Gemm_Rocblas_621294634,0.60731
GemmTunableOp_Half_TN,tn_6144_5322_4096,Gemm_Rocblas_621294420,0.452042
GemmTunableOp_Half_TN,tn_4096_4082_4096,Gemm_Hipblaslt_TN_9768,0.231857
GemmTunableOp_Half_TN,tn_6144_6996_4096,Gemm_Hipblaslt_TN_9743,0.613048
GemmTunableOp_Half_TN,tn_4096_2497_11008,Gemm_Hipblaslt_TN_9709,0.404153
GemmTunableOp_Half_TN,tn_28672_3666_4096,Gemm_Hipblaslt_TN_9827,1.53128
GemmTunableOp_Half_TN,tn_4096_3920_14336,Gemm_Rocblas_621286281,0.751191
GemmTunableOp_Half_TN,tn_4096_1823_14336,Gemm_Hipblaslt_TN_9620,0.410047
GemmTunableOp_Half_TN,tn_128256_62_4096,Gemm_Rocblas_621294554,0.362362
GemmTunableOp_Half_TN,tn_28672_7033_4096,Gemm_Hipblaslt_TN_159,2.92258
GemmTunableOp_Half_TN,tn_22016_143_4096,Gemm_Hipblaslt_TN_9319,0.0714856
GemmTunableOp_Half_TN,tn_128256_216_4096,Gemm_Hipblaslt_TN_9937,0.576274
GemmTunableOp_Half_TN,tn_28672_1854_4096,Gemm_Hipblaslt_TN_9684,0.817584
GemmTunableOp_Half_TN,tn_22016_2481_4096,Gemm_Hipblaslt_TN_9846,0.818726
GemmTunableOp_Half_TN,tn_4096_1739_14336,Gemm_Hipblaslt_TN_9645,0.391298
GemmTunableOp_Half_TN,tn_128256_190_4096,Gemm_Hipblaslt_TN_9684,0.519442
GemmTunableOp_Half_TN,tn_4096_2097_11008,Gemm_Hipblaslt_TN_9748,0.349493
GemmTunableOp_Half_TN,tn_6144_184_4096,Gemm_Rocblas_621286440,0.0291948
GemmTunableOp_Half_TN,tn_22016_2193_4096,Gemm_Hipblaslt_TN_9827,0.699934
GemmTunableOp_Half_TN,tn_4096_2225_4096,Gemm_Hipblaslt_TN_9698,0.137635
GemmTunableOp_Half_TN,tn_4096_6841_14336,Gemm_Hipblaslt_TN_9696,1.42411
GemmTunableOp_Half_TN,tn_28672_1846_4096,Gemm_Hipblaslt_TN_9684,0.814384
GemmTunableOp_Half_TN,tn_28672_1704_4096,Gemm_Rocblas_621286678,0.744341
GemmTunableOp_Half_TN,tn_4096_1902_14336,Gemm_Hipblaslt_TN_9620,0.415005
GemmTunableOp_Half_TN,tn_4096_7109_4096,Gemm_Hipblaslt_TN_9743,0.417118
GemmTunableOp_Half_TN,tn_4096_5274_14336,Gemm_Hipblaslt_TN_9709,1.12383
GemmTunableOp_Half_TN,tn_4096_2289_4096,Gemm_Hipblaslt_TN_9698,0.140262
GemmTunableOp_Half_TN,tn_6144_1948_4096,Gemm_Hipblaslt_TN_9697,0.176316
GemmTunableOp_Half_TN,tn_28672_3382_4096,Gemm_Hipblaslt_TN_9827,1.39855
GemmTunableOp_Half_TN,tn_22016_134_4096,Gemm_Hipblaslt_TN_9319,0.0717614
GemmTunableOp_Half_TN,tn_128256_242_4096,Gemm_Rocblas_621294634,0.606104
GemmTunableOp_Half_TN,tn_12288_159_4096,Gemm_Rocblas_621286472,0.0446154
GemmTunableOp_Half_TN,tn_12288_2065_4096,Gemm_Hipblaslt_TN_9677,0.367997
GemmTunableOp_Half_TN,tn_4096_2129_11008,Gemm_Hipblaslt_TN_9698,0.351578
GemmTunableOp_Half_TN,tn_4096_1666_14336,Gemm_Hipblaslt_TN_9671,0.365959
GemmTunableOp_Half_TN,tn_22016_2369_4096,Gemm_Hipblaslt_TN_9846,0.813917
GemmTunableOp_Half_TN,tn_6144_3379_4096,Gemm_Rocblas_621286753,0.312492
GemmTunableOp_Half_TN,tn_4096_1946_4096,Gemm_Hipblaslt_TN_9645,0.125018
GemmTunableOp_Half_TN,tn_4096_1618_14336,Gemm_Hipblaslt_TN_9790,0.362159
GemmTunableOp_Half_TN,tn_4096_5410_4096,Gemm_Rocblas_621286684,0.335016
GemmTunableOp_Half_TN,tn_6144_5357_4096,Gemm_Hipblaslt_TN_9704,0.456822
GemmTunableOp_Half_TN,tn_4096_1822_14336,Gemm_Hipblaslt_TN_9645,0.412102
GemmTunableOp_Half_TN,tn_6144_7262_4096,Gemm_Hipblaslt_TN_9743,0.620833
GemmTunableOp_Half_TN,tn_4096_1877_14336,Gemm_Hipblaslt_TN_9645,0.417614
GemmTunableOp_Half_TN,tn_4096_7120_14336,Gemm_Hipblaslt_TN_9743,1.47192
GemmTunableOp_Half_TN,tn_4096_3466_4096,Gemm_Hipblaslt_TN_9814,0.202615
GemmTunableOp_Half_TN,tn_28672_5442_4096,Gemm_Hipblaslt_TN_9924,2.37063
GemmTunableOp_Half_TN,tn_4096_2303_4096,Gemm_Hipblaslt_TN_9698,0.1402
GemmTunableOp_Half_TN,tn_4096_1890_14336,Gemm_Hipblaslt_TN_9620,0.416511
GemmTunableOp_Half_TN,tn_28672_1663_4096,Gemm_Hipblaslt_TN_9730,0.739457
GemmTunableOp_Half_TN,tn_28672_3475_4096,Gemm_Hipblaslt_TN_9827,1.40231
GemmTunableOp_Half_TN,tn_12288_2161_4096,Gemm_Hipblaslt_TN_9697,0.386853
GemmTunableOp_Half_TN,tn_4096_138_4096,Gemm_Hipblaslt_TN_9472,0.0214304
GemmTunableOp_Half_TN,tn_4096_1864_4096,Gemm_Hipblaslt_TN_9134,0.12139
GemmTunableOp_Half_TN,tn_6144_7047_4096,Gemm_Hipblaslt_TN_9677,0.612716
GemmTunableOp_Half_TN,tn_28672_3496_4096,Gemm_Hipblaslt_TN_9827,1.4066
GemmTunableOp_Half_TN,tn_4096_133_11008,Gemm_Hipblaslt_TN_8260,0.0462243
GemmTunableOp_Half_TN,tn_4096_7575_14336,Gemm_Hipblaslt_TN_9713,1.58824
GemmTunableOp_Half_TN,tn_4096_3441_14336,Gemm_Hipblaslt_TN_9814,0.675922
GemmTunableOp_Half_TN,tn_22016_2385_4096,Gemm_Hipblaslt_TN_9846,0.801621
GemmTunableOp_Half_TN,tn_6144_1652_4096,Gemm_Hipblaslt_TN_9570,0.151531
GemmTunableOp_Half_TN,tn_6144_240_4096,Gemm_Hipblaslt_TN_9494,0.035236
GemmTunableOp_Half_TN,tn_128256_173_4096,Gemm_Hipblaslt_TN_9661,0.515102
GemmTunableOp_Half_TN,tn_4096_1721_14336,Gemm_Hipblaslt_TN_9679,0.373051
GemmTunableOp_Half_TN,tn_22016_2145_4096,Gemm_Hipblaslt_TN_9827,0.692198
GemmTunableOp_Half_TN,tn_6144_1840_4096,Gemm_Rocblas_621286683,0.165223
GemmTunableOp_Half_TN,tn_4096_7340_4096,Gemm_Hipblaslt_TN_9914,0.429461
GemmTunableOp_Half_TN,tn_4096_5381_4096,Gemm_Hipblaslt_TN_9672,0.330823
GemmTunableOp_Half_TN,tn_4096_7120_4096,Gemm_Hipblaslt_TN_9743,0.410208
GemmTunableOp_Half_TN,tn_4096_146_4096,Gemm_Rocblas_621294171,0.0221298
GemmTunableOp_Half_TN,tn_12288_132_4096,Gemm_Hipblaslt_TN_9155,0.0434549
GemmTunableOp_Half_TN,tn_4096_1802_4096,Gemm_Hipblaslt_TN_9645,0.119103
GemmTunableOp_Half_TN,tn_4096_1627_4096,Gemm_Hipblaslt_TN_9607,0.105555
GemmTunableOp_Half_TN,tn_22016_156_4096,Gemm_Hipblaslt_TN_9319,0.0743037
GemmTunableOp_Half_TN,tn_6144_3710_4096,Gemm_Rocblas_621294315,0.340132
GemmTunableOp_Half_TN,tn_6144_1936_4096,Gemm_Hipblaslt_TN_9697,0.176833
GemmTunableOp_Half_TN,tn_6144_5541_4096,Gemm_Hipblaslt_TN_9768,0.469
GemmTunableOp_Half_TN,tn_4096_1774_4096,Gemm_Hipblaslt_TN_9645,0.117025
GemmTunableOp_Half_TN,tn_4096_2305_4096,Gemm_Hipblaslt_TN_9207,0.143903
GemmTunableOp_Half_TN,tn_32000_156_4096,Gemm_Hipblaslt_TN_9564,0.0978152
GemmTunableOp_Half_TN,tn_128256_196_4096,Gemm_Hipblaslt_TN_9893,0.569858
GemmTunableOp_Half_TN,tn_4096_7139_4096,Gemm_Hipblaslt_TN_9743,0.413727
GemmTunableOp_Half_TN,tn_6144_7248_4096,Gemm_Hipblaslt_TN_9192,0.624001
GemmTunableOp_Half_TN,tn_128256_181_4096,Gemm_Hipblaslt_TN_9683,0.518435
GemmTunableOp_Half_TN,tn_4096_5427_14336,Gemm_Hipblaslt_TN_9672,1.16292
GemmTunableOp_Half_TN,tn_12288_147_4096,Gemm_Rocblas_621286472,0.043849
GemmTunableOp_Half_TN,tn_4096_7552_14336,Gemm_Hipblaslt_TN_9815,1.58589
GemmTunableOp_Half_TN,tn_4096_2289_11008,Gemm_Hipblaslt_TN_9627,0.366015
GemmTunableOp_Half_TN,tn_4096_149_11008,Gemm_Hipblaslt_TN_7219,0.0472133
GemmTunableOp_Half_TN,tn_4096_1573_4096,Gemm_Hipblaslt_TN_9679,0.105735
GemmTunableOp_Half_TN,tn_4096_7_4096,Gemm_Rocblas_621294130,0.00995887
GemmTunableOp_Half_TN,tn_6144_1728_4096,Gemm_Hipblaslt_TN_9570,0.154629
GemmTunableOp_Half_TN,tn_128256_210_4096,Gemm_Hipblaslt_TN_9937,0.572766
GemmTunableOp_Half_TN,tn_32000_6_4096,Gemm_Rocblas_621294053,0.0523041
GemmTunableOp_Half_TN,tn_28672_5470_4096,Gemm_Hipblaslt_TN_9849,2.34993
GemmTunableOp_Half_TN,tn_128256_154_4096,Gemm_Hipblaslt_TN_9808,0.483208
GemmTunableOp_Half_TN,tn_12288_2192_4096,Gemm_Hipblaslt_TN_9677,0.387535
GemmTunableOp_Half_TN,tn_4096_3526_14336,Gemm_Hipblaslt_TN_9743,0.685253
GemmTunableOp_Half_TN,tn_4096_1780_4096,Gemm_Hipblaslt_TN_9134,0.116723
GemmTunableOp_Half_TN,tn_12288_140_4096,Gemm_Hipblaslt_TN_9144,0.0433976
GemmTunableOp_Half_TN,tn_12288_2433_4096,Gemm_Rocblas_621286742,0.427899
GemmTunableOp_Half_TN,tn_128256_226_4096,Gemm_Rocblas_621286892,0.598344
GemmTunableOp_Half_TN,tn_6144_3597_4096,Gemm_Rocblas_621286753,0.32734
GemmTunableOp_Half_TN,tn_4096_1857_14336,Gemm_Hipblaslt_TN_9645,0.415151
GemmTunableOp_Half_TN,tn_4096_159_4096,Gemm_Rocblas_621286491,0.0220316
GemmTunableOp_Half_TN,tn_4096_3383_14336,Gemm_Hipblaslt_TN_9192,0.669203
GemmTunableOp_Half_TN,tn_4096_1953_4096,Gemm_Hipblaslt_TN_9136,0.125535
GemmTunableOp_Half_TN,tn_28672_3410_4096,Gemm_Hipblaslt_TN_9827,1.38651
GemmTunableOp_Half_TN,tn_12288_129_4096,Gemm_Rocblas_621286472,0.0423444
GemmTunableOp_Half_TN,tn_4096_2080_11008,Gemm_Hipblaslt_TN_9273,0.347095
GemmTunableOp_Half_TN,tn_4096_2000_4096,Gemm_Hipblaslt_TN_9136,0.125899
GemmTunableOp_Half_TN,tn_4096_2257_11008,Gemm_Hipblaslt_TN_9698,0.361159
GemmTunableOp_Half_TN,tn_6144_1824_4096,Gemm_Rocblas_621286683,0.166276
GemmTunableOp_Half_TN,tn_22016_130_4096,Gemm_Hipblaslt_TN_9319,0.0722992
GemmTunableOp_Half_TN,tn_12288_144_4096,Gemm_Hipblaslt_TN_9154,0.0425816
GemmTunableOp_Half_TN,tn_128256_248_4096,Gemm_Rocblas_621286905,0.617522
GemmTunableOp_Half_TN,tn_4096_2369_11008,Gemm_Hipblaslt_TN_9698,0.374766
GemmTunableOp_Half_TN,tn_22016_155_4096,Gemm_Hipblaslt_TN_9319,0.0742072
GemmTunableOp_Half_TN,tn_4096_1625_14336,Gemm_Hipblaslt_TN_9671,0.364424
GemmTunableOp_Half_TN,tn_6144_7478_4096,Gemm_Rocblas_621294127,0.65214
GemmTunableOp_Half_TN,tn_4096_3450_14336,Gemm_Hipblaslt_TN_9814,0.672723
GemmTunableOp_Half_TN,tn_4096_1722_14336,Gemm_Hipblaslt_TN_9671,0.371107
GemmTunableOp_Half_TN,tn_4096_2321_4096,Gemm_Hipblaslt_TN_9698,0.141589
GemmTunableOp_Half_TN,tn_12288_137_4096,Gemm_Rocblas_621286472,0.0430068
GemmTunableOp_Half_TN,tn_4096_2385_4096,Gemm_Hipblaslt_TN_9698,0.142352
GemmTunableOp_Half_TN,tn_4096_6870_14336,Gemm_Hipblaslt_TN_9743,1.42202
GemmTunableOp_Half_TN,tn_28672_3565_4096,Gemm_Hipblaslt_TN_9827,1.41564
GemmTunableOp_Half_TN,tn_6144_1742_4096,Gemm_Rocblas_621286705,0.159928
GemmTunableOp_Half_TN,tn_6144_7108_4096,Gemm_Hipblaslt_TN_9814,0.61843
GemmTunableOp_Half_TN,tn_128256_73_4096,Gemm_Hipblaslt_TN_9057,0.383574
GemmTunableOp_Half_TN,tn_12288_130_4096,Gemm_Rocblas_621286472,0.0430486
GemmTunableOp_Half_TN,tn_4096_6881_14336,Gemm_Hipblaslt_TN_9953,1.42914
GemmTunableOp_Half_TN,tn_128256_50_4096,Gemm_Rocblas_621294557,0.357815
GemmTunableOp_Half_TN,tn_128256_60_4096,Gemm_Rocblas_621286813,0.361728
GemmTunableOp_Half_TN,tn_4096_1869_14336,Gemm_Hipblaslt_TN_9645,0.416298
GemmTunableOp_Half_TN,tn_4096_176_14336,Gemm_Hipblaslt_TN_8350,0.0618706
GemmTunableOp_Half_TN,tn_4096_1827_14336,Gemm_Hipblaslt_TN_9620,0.412478
GemmTunableOp_Half_TN,tn_4096_3553_14336,Gemm_Hipblaslt_TN_9187,0.696131
GemmTunableOp_Half_TN,tn_28672_1766_4096,Gemm_Hipblaslt_TN_9223,0.756417
GemmTunableOp_Half_TN,tn_22016_151_4096,Gemm_Hipblaslt_TN_9319,0.0737239
GemmTunableOp_Half_TN,tn_4096_6870_4096,Gemm_Hipblaslt_TN_9743,0.400565
GemmTunableOp_Half_TN,tn_4096_2465_4096,Gemm_Hipblaslt_TN_9799,0.153951
GemmTunableOp_Half_TN,tn_4096_2113_11008,Gemm_Hipblaslt_TN_9728,0.350348
GemmTunableOp_Half_TN,tn_22016_154_4096,Gemm_Hipblaslt_TN_9319,0.074887
GemmTunableOp_Half_TN,tn_4096_2321_11008,Gemm_Hipblaslt_TN_9748,0.374955
GemmTunableOp_Half_TN,tn_6144_216_4096,Gemm_Hipblaslt_TN_9494,0.0338081
GemmTunableOp_Half_TN,tn_22016_132_4096,Gemm_Hipblaslt_TN_9321,0.0734432
GemmTunableOp_Half_TN,tn_128256_69_4096,Gemm_Hipblaslt_TN_9057,0.382731
GemmTunableOp_Half_TN,tn_28672_7484_4096,Gemm_Hipblaslt_TN_159,2.97806
GemmTunableOp_Half_TN,tn_22016_161_4096,Gemm_Rocblas_621286778,0.08578
GemmTunableOp_Half_TN,tn_22016_153_4096,Gemm_Hipblaslt_TN_9321,0.0749747
GemmTunableOp_Half_TN,tn_4096_1790_4096,Gemm_Hipblaslt_TN_9134,0.116904
GemmTunableOp_Half_TN,tn_6144_1627_4096,Gemm_Hipblaslt_TN_9570,0.151226
GemmTunableOp_Half_TN,tn_4096_2063_4096,Gemm_Hipblaslt_TN_9273,0.131344
GemmTunableOp_Half_TN,tn_4096_1960_14336,Gemm_Hipblaslt_TN_9592,0.422245
GemmTunableOp_Half_TN,tn_4096_3706_14336,Gemm_Hipblaslt_TN_9920,0.73404
GemmTunableOp_Half_TN,tn_128256_91_4096,Gemm_Hipblaslt_TN_9057,0.398778
GemmTunableOp_Half_TN,tn_6144_5495_4096,Gemm_Hipblaslt_TN_9753,0.470041
GemmTunableOp_Half_TN,tn_6144_1881_4096,Gemm_Rocblas_621286683,0.167355
GemmTunableOp_Half_TN,tn_128256_22_4096,Gemm_Hipblaslt_TN_9455,0.314582
GemmTunableOp_Half_TN,tn_4096_3682_14336,Gemm_Rocblas_621294018,0.730273
GemmTunableOp_Half_TN,tn_28672_1969_4096,Gemm_Hipblaslt_TN_9846,0.864731
GemmTunableOp_Half_TN,tn_128256_40_4096,Gemm_Hipblaslt_TN_9451,0.335099
GemmTunableOp_Half_TN,tn_6144_1860_4096,Gemm_Rocblas_621286705,0.167881
GemmTunableOp_Half_TN,tn_4096_1704_14336,Gemm_Hipblaslt_TN_9790,0.367685
GemmTunableOp_Half_TN,tn_4096_1686_14336,Gemm_Hipblaslt_TN_9790,0.368304
GemmTunableOp_Half_TN,tn_4096_80_4096,Gemm_Rocblas_621294028,0.0152824
GemmTunableOp_Half_TN,tn_4096_1735_4096,Gemm_Hipblaslt_TN_9134,0.11648
GemmTunableOp_Half_TN,tn_6144_1689_4096,Gemm_Rocblas_621286753,0.155266
GemmTunableOp_Half_TN,tn_128256_81_4096,Gemm_Hipblaslt_TN_9057,0.388015
GemmTunableOp_Half_TN,tn_128256_132_4096,Gemm_Hipblaslt_TN_9808,0.472305
GemmTunableOp_Half_TN,tn_4096_5100_14336,Gemm_Hipblaslt_TN_9787,1.08643
GemmTunableOp_Half_TN,tn_28672_48_4096,Gemm_Hipblaslt_TN_9532,0.0485305
GemmTunableOp_Half_TN,tn_128256_201_4096,Gemm_Hipblaslt_TN_9937,0.570857
GemmTunableOp_Half_TN,tn_4096_3589_14336,Gemm_Hipblaslt_TN_9187,0.705717
GemmTunableOp_Half_TN,tn_6144_1691_4096,Gemm_Rocblas_621286753,0.156505
GemmTunableOp_Half_TN,tn_4096_1699_14336,Gemm_Hipblaslt_TN_9671,0.369001
GemmTunableOp_Half_TN,tn_4096_3622_4096,Gemm_Hipblaslt_TN_9743,0.208094
GemmTunableOp_Half_TN,tn_28672_1668_4096,Gemm_Hipblaslt_TN_9730,0.740241
GemmTunableOp_Half_TN,tn_28672_1831_4096,Gemm_Hipblaslt_TN_9683,0.818957
GemmTunableOp_Half_TN,tn_28672_5530_4096,Gemm_Hipblaslt_TN_9804,2.37686
GemmTunableOp_Half_TN,tn_4096_136_4096,Gemm_Hipblaslt_TN_9474,0.0216078
GemmTunableOp_Half_TN,tn_6144_3564_4096,Gemm_Rocblas_621286566,0.319138
GemmTunableOp_Half_TN,tn_6144_3706_4096,Gemm_Rocblas_621294426,0.339882
GemmTunableOp_Half_TN,tn_4096_7170_14336,Gemm_Hipblaslt_TN_9743,1.45814
GemmTunableOp_Half_TN,tn_4096_1973_14336,Gemm_Hipblaslt_TN_9592,0.425414
GemmTunableOp_Half_TN,tn_4096_141_11008,Gemm_Hipblaslt_TN_9298,0.0467354
GemmTunableOp_Half_TN,tn_6144_3912_4096,Gemm_Rocblas_621286683,0.352395
GemmTunableOp_Half_TN,tn_128256_13_4096,Gemm_Rocblas_621294224,0.293054
GemmTunableOp_Half_TN,tn_6144_6800_4096,Gemm_Hipblaslt_TN_9677,0.591985
GemmTunableOp_Half_TN,tn_28672_1725_4096,Gemm_Hipblaslt_TN_9730,0.74564
GemmTunableOp_Half_TN,tn_28672_1596_4096,Gemm_Hipblaslt_TN_9762,0.720603
GemmTunableOp_Half_TN,tn_128256_100_4096,Gemm_Rocblas_621294762,0.424845
GemmTunableOp_Half_TN,tn_128256_145_4096,Gemm_Hipblaslt_TN_9108,0.474586
GemmTunableOp_Half_TN,tn_6144_1764_4096,Gemm_Hipblaslt_TN_9711,0.162842
GemmTunableOp_Half_TN,tn_128256_186_4096,Gemm_Hipblaslt_TN_9752,0.519433
GemmTunableOp_Half_TN,tn_4096_1889_4096,Gemm_Hipblaslt_TN_9645,0.123053
GemmTunableOp_Half_TN,tn_4096_3584_4096,Gemm_Rocblas_621286415,0.202958
GemmTunableOp_Half_TN,tn_6144_1698_4096,Gemm_Rocblas_621294495,0.157957
GemmTunableOp_Half_TN,tn_6144_7475_4096,Gemm_Hipblaslt_TN_9853,0.654382
GemmTunableOp_Half_TN,tn_28672_1828_4096,Gemm_Hipblaslt_TN_9683,0.802459
GemmTunableOp_Half_TN,tn_4096_1655_4096,Gemm_Hipblaslt_TN_9607,0.107472
GemmTunableOp_Half_TN,tn_4096_7130_14336,Gemm_Hipblaslt_TN_9743,1.46677
GemmTunableOp_Half_TN,tn_4096_3214_14336,Gemm_Hipblaslt_TN_9187,0.642991
GemmTunableOp_Half_TN,tn_4096_1670_14336,Gemm_Hipblaslt_TN_9671,0.365847
GemmTunableOp_Half_TN,tn_28672_1973_4096,Gemm_Hipblaslt_TN_9846,0.862042
GemmTunableOp_Half_TN,tn_4096_2065_4096,Gemm_Hipblaslt_TN_9698,0.134522
GemmTunableOp_Half_TN,tn_28672_1829_4096,Gemm_Hipblaslt_TN_9832,0.818715
GemmTunableOp_Half_TN,tn_4096_3701_14336,Gemm_Hipblaslt_TN_9827,0.728345
GemmTunableOp_Half_TN,tn_28672_3701_4096,Gemm_Hipblaslt_TN_9827,1.53613
GemmTunableOp_Half_TN,tn_4096_1600_4096,Gemm_Hipblaslt_TN_9265,0.105221
GemmTunableOp_Half_TN,tn_4096_1607_14336,Gemm_Hipblaslt_TN_9671,0.362861
GemmTunableOp_Half_TN,tn_4096_1958_4096,Gemm_Hipblaslt_TN_9645,0.126533
GemmTunableOp_Half_TN,tn_4096_1627_14336,Gemm_Hipblaslt_TN_9679,0.362307
GemmTunableOp_Half_TN,tn_6144_7027_4096,Gemm_Hipblaslt_TN_9189,0.613573
GemmTunableOp_Half_TN,tn_28672_7730_4096,Gemm_Hipblaslt_TN_159,3.03556
GemmTunableOp_Half_TN,tn_4096_3345_14336,Gemm_Hipblaslt_TN_9814,0.663702
GemmTunableOp_Half_TN,tn_4096_7077_14336,Gemm_Hipblaslt_TN_9732,1.45695
GemmTunableOp_Half_TN,tn_4096_6860_14336,Gemm_Hipblaslt_TN_9732,1.4318
GemmTunableOp_Half_TN,tn_6144_40_4096,Gemm_Rocblas_621286428,0.0153077
GemmTunableOp_Half_TN,tn_4096_2257_4096,Gemm_Hipblaslt_TN_9627,0.139985
GemmTunableOp_Half_TN,tn_4096_1902_4096,Gemm_Hipblaslt_TN_9134,0.122762
GemmTunableOp_Half_TN,tn_4096_5136_14336,Gemm_Hipblaslt_TN_9799,1.10426
GemmTunableOp_Half_TN,tn_6144_1945_4096,Gemm_Hipblaslt_TN_9697,0.178084
GemmTunableOp_Half_TN,tn_28672_7345_4096,Gemm_Hipblaslt_TN_159,2.93438
GemmTunableOp_Half_TN,tn_4096_5157_4096,Gemm_Hipblaslt_TN_9690,0.324394
GemmTunableOp_Half_TN,tn_4096_1764_14336,Gemm_Hipblaslt_TN_9645,0.394796
GemmTunableOp_Half_TN,tn_4096_7027_4096,Gemm_Rocblas_621294443,0.411017
GemmTunableOp_Half_TN,tn_128256_235_4096,Gemm_Rocblas_621294634,0.609125
GemmTunableOp_Half_TN,tn_4096_7171_14336,Gemm_Hipblaslt_TN_9743,1.46858
GemmTunableOp_Half_TN,tn_4096_7021_4096,Gemm_Hipblaslt_TN_9743,0.410801
GemmTunableOp_Half_TN,tn_6144_224_4096,Gemm_Hipblaslt_TN_9495,0.0345019
GemmTunableOp_Half_TN,tn_4096_64_14336,Gemm_Hipblaslt_TN_8060,0.0345625
GemmTunableOp_Half_TN,tn_4096_7191_4096,Gemm_Rocblas_621294443,0.416708
GemmTunableOp_Half_TN,tn_28672_1853_4096,Gemm_Hipblaslt_TN_9832,0.817234
GemmTunableOp_Half_TN,tn_6144_6901_4096,Gemm_Hipblaslt_TN_9677,0.59765
GemmTunableOp_Half_TN,tn_6144_6997_4096,Gemm_Hipblaslt_TN_9743,0.606544
GemmTunableOp_Half_TN,tn_4096_7248_4096,Gemm_Hipblaslt_TN_9743,0.417135
GemmTunableOp_Half_TN,tn_6144_72_4096,Gemm_Rocblas_621286279,0.0188224
GemmTunableOp_Half_TN,tn_6144_7364_4096,Gemm_Hipblaslt_TN_9713,0.645764
GemmTunableOp_Half_TN,tn_4096_7364_4096,Gemm_Hipblaslt_TN_9888,0.429551
GemmTunableOp_Half_TN,tn_28672_7136_4096,Gemm_Hipblaslt_TN_9893,2.95806
GemmTunableOp_Half_TN,tn_4096_1790_14336,Gemm_Hipblaslt_TN_9645,0.395505
GemmTunableOp_Half_TN,tn_4096_3553_4096,Gemm_Hipblaslt_TN_9221,0.20401
GemmTunableOp_Half_TN,tn_6144_3468_4096,Gemm_Rocblas_621286753,0.321341
GemmTunableOp_Half_TN,tn_28672_1825_4096,Gemm_Hipblaslt_TN_9832,0.811892
GemmTunableOp_Half_TN,tn_4096_3468_14336,Gemm_Hipblaslt_TN_9841,0.68927
GemmTunableOp_Half_TN,tn_4096_7136_14336,Gemm_Hipblaslt_TN_9732,1.47757
GemmTunableOp_Half_TN,tn_4096_1592_14336,Gemm_Hipblaslt_TN_9671,0.360667
GemmTunableOp_Half_TN,tn_4096_5359_14336,Gemm_Hipblaslt_TN_9709,1.15725
GemmTunableOp_Half_TN,tn_4096_7344_4096,Gemm_Hipblaslt_TN_159,0.428995
GemmTunableOp_Half_TN,tn_6144_1682_4096,Gemm_Rocblas_621294495,0.155159
GemmTunableOp_Half_TN,tn_28672_128_4096,Gemm_Rocblas_621286478,0.0730262
GemmTunableOp_Half_TN,tn_6144_3520_4096,Gemm_Rocblas_621294426,0.321705
GemmTunableOp_Half_TN,tn_4096_3496_14336,Gemm_Hipblaslt_TN_9743,0.688629
GemmTunableOp_Half_TN,tn_4096_40_14336,Gemm_Hipblaslt_TN_8050,0.0314029
GemmTunableOp_Half_TN,tn_4096_7067_4096,Gemm_Hipblaslt_TN_9697,0.413559
GemmTunableOp_Half_TN,tn_4096_1882_14336,Gemm_Hipblaslt_TN_9620,0.414329
GemmTunableOp_Half_TN,tn_6144_168_4096,Gemm_Rocblas_621294171,0.0284913
GemmTunableOp_Half_TN,tn_28672_1699_4096,Gemm_Hipblaslt_TN_9730,0.74092
GemmTunableOp_Half_TN,tn_28672_1874_4096,Gemm_Hipblaslt_TN_9683,0.818643
GemmTunableOp_Half_TN,tn_4096_1646_4096,Gemm_Hipblaslt_TN_9265,0.106735
GemmTunableOp_Half_TN,tn_4096_1887_14336,Gemm_Hipblaslt_TN_9592,0.416214
GemmTunableOp_Half_TN,tn_4096_216_4096,Gemm_Rocblas_621286491,0.025512
GemmTunableOp_Half_TN,tn_4096_7136_4096,Gemm_Hipblaslt_TN_9743,0.414263
GemmTunableOp_Half_TN,tn_4096_6773_14336,Gemm_Hipblaslt_TN_9696,1.407
GemmTunableOp_Half_TN,tn_4096_3427_14336,Gemm_Hipblaslt_TN_9743,0.669958
GemmTunableOp_Half_TN,tn_6144_7344_4096,Gemm_Hipblaslt_TN_159,0.637114
GemmTunableOp_Half_TN,tn_28672_7253_4096,Gemm_Hipblaslt_TN_159,2.90436
GemmTunableOp_Half_TN,tn_28672_6841_4096,Gemm_Hipblaslt_TN_9955,2.86408
GemmTunableOp_Half_TN,tn_6144_1710_4096,Gemm_Hipblaslt_TN_9570,0.156486
GemmTunableOp_Half_TN,tn_6144_3581_4096,Gemm_Rocblas_621286753,0.326901
GemmTunableOp_Half_TN,tn_6144_112_4096,Gemm_Rocblas_621294171,0.023463
GemmTunableOp_Half_TN,tn_6144_1762_4096,Gemm_Rocblas_621294425,0.16368
GemmTunableOp_Half_TN,tn_6144_5157_4096,Gemm_Hipblaslt_TN_9753,0.445249
GemmTunableOp_Half_TN,tn_28672_1838_4096,Gemm_Hipblaslt_TN_9684,0.810531
GemmTunableOp_Half_TN,tn_4096_3455_14336,Gemm_Hipblaslt_TN_9192,0.678109
GemmTunableOp_Half_TN,tn_6144_1615_4096,Gemm_Rocblas_621294495,0.153366
GemmTunableOp_Half_TN,tn_6144_6902_4096,Gemm_Hipblaslt_TN_9814,0.597753
GemmTunableOp_Half_TN,tn_6144_5277_4096,Gemm_Hipblaslt_TN_9933,0.453054
GemmTunableOp_Half_TN,tn_28672_1961_4096,Gemm_Hipblaslt_TN_9846,0.86918
GemmTunableOp_Half_TN,tn_4096_1981_14336,Gemm_Hipblaslt_TN_9792,0.42928
GemmTunableOp_Half_TN,tn_6144_1614_4096,Gemm_Rocblas_621294495,0.153248
GemmTunableOp_Half_TN,tn_4096_1667_4096,Gemm_Hipblaslt_TN_9671,0.106686
GemmTunableOp_Half_TN,tn_4096_48_14336,Gemm_Hipblaslt_TN_9411,0.0319406
GemmTunableOp_Half_TN,tn_28672_3602_4096,Gemm_Hipblaslt_TN_9832,1.5004
GemmTunableOp_Half_TN,tn_28672_1702_4096,Gemm_Rocblas_621286742,0.745137
GemmTunableOp_Half_TN,tn_4096_3507_14336,Gemm_Hipblaslt_TN_9743,0.691996
GemmTunableOp_Half_TN,tn_128256_112_4096,Gemm_Hipblaslt_TN_9760,0.429885
GemmTunableOp_Half_TN,tn_128256_41_4096,Gemm_Hipblaslt_TN_9451,0.335162
GemmTunableOp_Half_TN,tn_28672_224_4096,Gemm_Hipblaslt_TN_9267,0.113013
GemmTunableOp_Half_TN,tn_4096_2417_4096,Gemm_Hipblaslt_TN_9698,0.1428
GemmTunableOp_Half_TN,tn_6144_1867_4096,Gemm_Rocblas_621286683,0.16739
GemmTunableOp_Half_TN,tn_12288_154_4096,Gemm_Rocblas_621286472,0.0439821
GemmTunableOp_Half_TN,tn_28672_1953_4096,Gemm_Hipblaslt_TN_9846,0.858015
GemmTunableOp_Half_TN,tn_4096_1651_4096,Gemm_Hipblaslt_TN_9616,0.107335
GemmTunableOp_Half_TN,tn_4096_3691_14336,Gemm_Hipblaslt_TN_9813,0.723585
GemmTunableOp_Half_TN,tn_28672_3586_4096,Gemm_Hipblaslt_TN_9828,1.50645
GemmTunableOp_Half_TN,tn_4096_128_14336,Gemm_Hipblaslt_TN_7160,0.047549
GemmTunableOp_Half_TN,tn_4096_1667_14336,Gemm_Hipblaslt_TN_9671,0.365994
GemmTunableOp_Half_TN,tn_4096_1728_4096,Gemm_Hipblaslt_TN_9616,0.105922
GemmTunableOp_Half_TN,tn_128256_204_4096,Gemm_Hipblaslt_TN_9937,0.573354
GemmTunableOp_Half_TN,tn_6144_5089_4096,Gemm_Hipblaslt_TN_9815,0.438488
GemmTunableOp_Half_TN,tn_28672_3497_4096,Gemm_Hipblaslt_TN_9827,1.40347
GemmTunableOp_Half_TN,tn_128256_116_4096,Gemm_Hipblaslt_TN_9760,0.437613
GemmTunableOp_Half_TN,tn_6144_1847_4096,Gemm_Rocblas_621286684,0.166729
GemmTunableOp_Half_TN,tn_4096_192_4096,Gemm_Rocblas_621286491,0.0230292
GemmTunableOp_Half_TN,tn_6144_7186_4096,Gemm_Hipblaslt_TN_9743,0.61947
GemmTunableOp_Half_TN,tn_12288_2481_4096,Gemm_Hipblaslt_TN_9813,0.442578
GemmTunableOp_Half_TN,tn_4096_160_14336,Gemm_Hipblaslt_TN_7219,0.0553012
GemmTunableOp_Half_TN,tn_4096_1762_14336,Gemm_Hipblaslt_TN_9645,0.395467
GemmTunableOp_Half_TN,tn_128256_199_4096,Gemm_Hipblaslt_TN_9738,0.567922
GemmTunableOp_Half_TN,tn_4096_3652_4096,Gemm_Hipblaslt_TN_9827,0.213549
GemmTunableOp_Half_TN,tn_28672_3912_4096,Gemm_Hipblaslt_TN_9827,1.61308
GemmTunableOp_Half_TN,tn_4096_1888_14336,Gemm_Hipblaslt_TN_9620,0.414093
GemmTunableOp_Half_TN,tn_6144_256_4096,Gemm_Hipblaslt_TN_9496,0.0361622
GemmTunableOp_Half_TN,tn_22016_2289_4096,Gemm_Hipblaslt_TN_9832,0.760025
GemmTunableOp_Half_TN,tn_4096_7267_14336,Gemm_Hipblaslt_TN_9743,1.47969
GemmTunableOp_Half_TN,tn_6144_3722_4096,Gemm_Hipblaslt_TN_9691,0.339252
GemmTunableOp_Half_TN,tn_28672_120_4096,Gemm_Rocblas_621286478,0.0739128
GemmTunableOp_Half_TN,tn_4096_6868_14336,Gemm_Hipblaslt_TN_9696,1.42935
GemmTunableOp_Half_TN,tn_28672_5413_4096,Gemm_Hipblaslt_TN_9924,2.30816
GemmTunableOp_Half_TN,tn_4096_224_14336,Gemm_Hipblaslt_TN_7378,0.0730482
GemmTunableOp_Half_TN,tn_6144_6916_4096,Gemm_Hipblaslt_TN_9697,0.604493
GemmTunableOp_Half_TN,tn_28672_1945_4096,Gemm_Hipblaslt_TN_9846,0.863006
GemmTunableOp_Half_TN,tn_128256_54_4096,Gemm_Hipblaslt_TN_9097,0.360972
GemmTunableOp_Half_TN,tn_6144_1930_4096,Gemm_Hipblaslt_TN_9697,0.174853
GemmTunableOp_Half_TN,tn_4096_1588_4096,Gemm_Hipblaslt_TN_9359,0.102338
GemmTunableOp_Half_TN,tn_4096_5470_14336,Gemm_Hipblaslt_TN_9799,1.17398
GemmTunableOp_Half_TN,tn_6144_6989_4096,Gemm_Hipblaslt_TN_9677,0.603418
GemmTunableOp_Half_TN,tn_4096_7579_4096,Gemm_Hipblaslt_TN_9888,0.43854
GemmTunableOp_Half_TN,tn_6144_5196_4096,Gemm_Rocblas_621294420,0.44788
GemmTunableOp_Half_TN,tn_12288_2497_4096,Gemm_Hipblaslt_TN_9259,0.442207
GemmTunableOp_Half_TN,tn_128256_240_4096,Gemm_Rocblas_621294634,0.606914
GemmTunableOp_Half_TN,tn_6144_7104_4096,Gemm_Hipblaslt_TN_9677,0.609376
GemmTunableOp_Half_TN,tn_4096_5239_4096,Gemm_Rocblas_621286684,0.326894
GemmTunableOp_Half_TN,tn_28672_1763_4096,Gemm_Rocblas_621294484,0.757005
GemmTunableOp_Half_TN,tn_4096_3438_4096,Gemm_Hipblaslt_TN_9821,0.198843
GemmTunableOp_Half_TN,tn_4096_6901_14336,Gemm_Hipblaslt_TN_9743,1.4198
GemmTunableOp_Half_TN,tn_6144_6965_4096,Gemm_Hipblaslt_TN_9743,0.604928
GemmTunableOp_Half_TN,tn_4096_5680_14336,Gemm_Rocblas_621294425,1.21488
GemmTunableOp_Half_TN,tn_4096_3565_4096,Gemm_Hipblaslt_TN_9768,0.204538
GemmTunableOp_Half_TN,tn_6144_7130_4096,Gemm_Hipblaslt_TN_9743,0.61829
GemmTunableOp_Half_TN,tn_4096_1781_4096,Gemm_Hipblaslt_TN_9134,0.118011
GemmTunableOp_Half_TN,tn_4096_144_4096,Gemm_Rocblas_621286440,0.0224567
GemmTunableOp_Half_TN,tn_28672_1813_4096,Gemm_Hipblaslt_TN_9832,0.812303
GemmTunableOp_Half_TN,tn_4096_6989_14336,Gemm_Hipblaslt_TN_9732,1.44884
GemmTunableOp_Half_TN,tn_6144_1733_4096,Gemm_Hipblaslt_TN_9799,0.159547
GemmTunableOp_Half_TN,tn_4096_1787_4096,Gemm_Hipblaslt_TN_9134,0.118717
GemmTunableOp_Half_TN,tn_6144_1667_4096,Gemm_Hipblaslt_TN_9570,0.153838
GemmTunableOp_Half_TN,tn_4096_5136_4096,Gemm_Hipblaslt_TN_9690,0.322375
GemmTunableOp_Half_TN,tn_6144_7033_4096,Gemm_Hipblaslt_TN_9677,0.607727
GemmTunableOp_Half_TN,tn_4096_1680_4096,Gemm_Hipblaslt_TN_9265,0.108635
GemmTunableOp_Half_TN,tn_28672_1684_4096,Gemm_Rocblas_621286678,0.742811
GemmTunableOp_Half_TN,tn_28672_1823_4096,Gemm_Hipblaslt_TN_9683,0.81131
GemmTunableOp_Half_TN,tn_4096_1652_14336,Gemm_Hipblaslt_TN_9790,0.366149
GemmTunableOp_Half_TN,tn_28672_6965_4096,Gemm_Hipblaslt_TN_9934,2.89293
GemmTunableOp_Half_TN,tn_4096_2209_4096,Gemm_Hipblaslt_TN_9698,0.13975
GemmTunableOp_Half_TN,tn_4096_3547_4096,Gemm_Hipblaslt_TN_9743,0.201195
GemmTunableOp_Half_TN,tn_4096_24_14336,Gemm_Hipblaslt_TN_9388,0.0274382
GemmTunableOp_Half_TN,tn_4096_6965_4096,Gemm_Hipblaslt_TN_9743,0.406587
GemmTunableOp_Half_TN,tn_28672_1757_4096,Gemm_Rocblas_621294484,0.752821
GemmTunableOp_Half_TN,tn_28672_3553_4096,Gemm_Hipblaslt_TN_9827,1.41674
GemmTunableOp_Half_TN,tn_4096_7575_4096,Gemm_Rocblas_621294127,0.437916
GemmTunableOp_Half_TN,tn_4096_7568_14336,Gemm_Hipblaslt_TN_9591,1.59433
GemmTunableOp_Half_TN,tn_28672_1786_4096,Gemm_Rocblas_621294484,0.763781
GemmTunableOp_Half_TN,tn_28672_6747_4096,Gemm_Hipblaslt_TN_9944,2.83745
GemmTunableOp_Half_TN,tn_6144_1790_4096,Gemm_Rocblas_621286683,0.164374
GemmTunableOp_Half_TN,tn_4096_1663_4096,Gemm_Hipblaslt_TN_9265,0.107078
GemmTunableOp_Half_TN,tn_4096_5735_4096,Gemm_Rocblas_621286580,0.347725
GemmTunableOp_Half_TN,tn_6144_1702_4096,Gemm_Hipblaslt_TN_9570,0.157955
GemmTunableOp_Half_TN,tn_128256_98_4096,Gemm_Rocblas_621294762,0.421697
GemmTunableOp_Half_TN,tn_4096_1660_14336,Gemm_Hipblaslt_TN_9671,0.365151
GemmTunableOp_Half_TN,tn_28672_3383_4096,Gemm_Hipblaslt_TN_9827,1.38695
GemmTunableOp_Half_TN,tn_6144_1889_4096,Gemm_Rocblas_621286705,0.167532
GemmTunableOp_Half_TN,tn_28672_6881_4096,Gemm_Hipblaslt_TN_9943,2.86203
GemmTunableOp_Half_TN,tn_4096_1745_4096,Gemm_Hipblaslt_TN_9645,0.116775
GemmTunableOp_Half_TN,tn_28672_5723_4096,Gemm_Hipblaslt_TN_9827,2.42956
GemmTunableOp_Half_TN,tn_4096_1608_4096,Gemm_Hipblaslt_TN_9359,0.103071
GemmTunableOp_Half_TN,tn_6144_1690_4096,Gemm_Hipblaslt_TN_9570,0.152808
GemmTunableOp_Half_TN,tn_28672_1673_4096,Gemm_Hipblaslt_TN_9220,0.734243
GemmTunableOp_Half_TN,tn_28672_1683_4096,Gemm_Hipblaslt_TN_9730,0.742872
GemmTunableOp_Half_TN,tn_4096_1866_4096,Gemm_Hipblaslt_TN_9645,0.12129
GemmTunableOp_Half_TN,tn_6144_3586_4096,Gemm_Rocblas_621286566,0.325822
GemmTunableOp_Half_TN,tn_4096_1710_4096,Gemm_Hipblaslt_TN_9164,0.110702
GemmTunableOp_Half_TN,tn_6144_3565_4096,Gemm_Rocblas_621286753,0.325235
GemmTunableOp_Half_TN,tn_6144_5427_4096,Gemm_Hipblaslt_TN_9713,0.464325
GemmTunableOp_Half_TN,tn_28672_1824_4096,Gemm_Hipblaslt_TN_9684,0.8152
GemmTunableOp_Half_TN,tn_28672_1867_4096,Gemm_Hipblaslt_TN_9683,0.815574
GemmTunableOp_Half_TN,tn_128256_122_4096,Gemm_Hipblaslt_TN_9061,0.434879
GemmTunableOp_Half_TN,tn_4096_3622_14336,Gemm_Hipblaslt_TN_9677,0.708168
GemmTunableOp_Half_TN,tn_28672_5381_4096,Gemm_Hipblaslt_TN_9923,2.30449
GemmTunableOp_Half_TN,tn_4096_1710_14336,Gemm_Hipblaslt_TN_9790,0.369593
GemmTunableOp_Half_TN,tn_4096_3535_4096,Gemm_Hipblaslt_TN_9743,0.202047
GemmTunableOp_Half_TN,tn_128256_124_4096,Gemm_Rocblas_621294762,0.43977
GemmTunableOp_Half_TN,tn_6144_3793_4096,Gemm_Rocblas_621294426,0.34473
GemmTunableOp_Half_TN,tn_28672_1957_4096,Gemm_Hipblaslt_TN_9846,0.863689
GemmTunableOp_Half_TN,tn_4096_1614_14336,Gemm_Hipblaslt_TN_9671,0.362206
GemmTunableOp_Half_TN,tn_4096_1813_4096,Gemm_Hipblaslt_TN_9134,0.11972
GemmTunableOp_Half_TN,tn_4096_1780_14336,Gemm_Hipblaslt_TN_9645,0.396835
GemmTunableOp_Half_TN,tn_4096_1881_14336,Gemm_Hipblaslt_TN_9620,0.411224
GemmTunableOp_Half_TN,tn_4096_6747_4096,Gemm_Hipblaslt_TN_9677,0.401117
GemmTunableOp_Half_TN,tn_6144_3478_4096,Gemm_Rocblas_621286753,0.322147
GemmTunableOp_Half_TN,tn_4096_5530_14336,Gemm_Hipblaslt_TN_9799,1.18187
GemmTunableOp_Half_TN,tn_4096_3494_14336,Gemm_Hipblaslt_TN_9743,0.684132
GemmTunableOp_Half_TN,tn_6144_1810_4096,Gemm_Rocblas_621286705,0.165021
GemmTunableOp_Half_TN,tn_4096_1884_14336,Gemm_Hipblaslt_TN_9645,0.415336
GemmTunableOp_Half_TN,tn_28672_3455_4096,Gemm_Hipblaslt_TN_9827,1.40018
GemmTunableOp_Half_TN,tn_4096_208_14336,Gemm_Hipblaslt_TN_9363,0.0699585
GemmTunableOp_Half_TN,tn_4096_1784_14336,Gemm_Hipblaslt_TN_9645,0.39521
GemmTunableOp_Half_TN,tn_4096_1846_14336,Gemm_Hipblaslt_TN_9645,0.409842
GemmTunableOp_Half_TN,tn_6144_7225_4096,Gemm_Hipblaslt_TN_9677,0.622682
GemmTunableOp_Half_TN,tn_4096_1603_4096,Gemm_Hipblaslt_TN_9671,0.105222
GemmTunableOp_Half_TN,tn_28672_5357_4096,Gemm_Hipblaslt_TN_9915,2.21206
GemmTunableOp_Half_TN,tn_4096_1863_4096,Gemm_Hipblaslt_TN_9134,0.122179
GemmTunableOp_Half_TN,tn_4096_5533_4096,Gemm_Rocblas_621286580,0.335135
GemmTunableOp_Half_TN,tn_4096_7478_4096,Gemm_Hipblaslt_TN_9907,0.435863
GemmTunableOp_Half_TN,tn_4096_1597_4096,Gemm_Hipblaslt_TN_9587,0.104592
GemmTunableOp_Half_TN,tn_28672_1622_4096,Gemm_Hipblaslt_TN_9730,0.723614
GemmTunableOp_Half_TN,tn_4096_1622_14336,Gemm_Hipblaslt_TN_9671,0.360498
GemmTunableOp_Half_TN,tn_4096_1977_4096,Gemm_Hipblaslt_TN_9267,0.126083
GemmTunableOp_Half_TN,tn_6144_1703_4096,Gemm_Rocblas_621294495,0.155934
GemmStridedBatchedTunableOp_Half_TN,tn_1910_1910_128_B_32,Gemm_Hipblaslt_TN_6950,0.150295
GemmStridedBatchedTunableOp_Half_TN,tn_1899_1899_128_B_32,Gemm_Hipblaslt_TN_6950,0.152806
GemmStridedBatchedTunableOp_Half_TN,tn_1652_1652_128_B_32,Gemm_Hipblaslt_TN_6942,0.117299
GemmStridedBatchedTunableOp_Half_TN,tn_1603_1603_128_B_32,Gemm_Hipblaslt_TN_6942,0.113703
GemmStridedBatchedTunableOp_Half_TN,tn_1637_1637_128_B_32,Gemm_Rocblas_621286397,0.113208
GemmStridedBatchedTunableOp_Half_TN,tn_1979_1979_128_B_32,Gemm_Rocblas_621294533,0.163512
GemmStridedBatchedTunableOp_Half_TN,tn_1727_1727_128_B_32,Gemm_Rocblas_621286413,0.127582
GemmStridedBatchedTunableOp_Half_TN,tn_1577_1577_128_B_32,Gemm_Hipblaslt_TN_6895,0.111641
GemmStridedBatchedTunableOp_Half_TN,tn_32_32_128_B_32,Gemm_Rocblas_621286717,0.00651903
GemmStridedBatchedTunableOp_Half_TN,tn_1846_1846_128_B_32,Gemm_Hipblaslt_TN_6942,0.14224
GemmStridedBatchedTunableOp_Half_TN,tn_1589_1589_128_B_32,Gemm_Hipblaslt_TN_6931,0.113128
GemmStridedBatchedTunableOp_Half_TN,tn_1721_1721_128_B_32,Gemm_Rocblas_621286397,0.118477
GemmStridedBatchedTunableOp_Half_TN,tn_1772_1772_128_B_32,Gemm_Rocblas_621286397,0.128974
GemmStridedBatchedTunableOp_Half_TN,tn_1590_1590_128_B_32,Gemm_Rocblas_621286397,0.111886
GemmStridedBatchedTunableOp_Half_TN,tn_1890_1890_128_B_32,Gemm_Hipblaslt_TN_6942,0.148559
GemmStridedBatchedTunableOp_Half_TN,tn_1649_1649_128_B_32,Gemm_Hipblaslt_TN_6942,0.120215
GemmStridedBatchedTunableOp_Half_TN,tn_1788_1788_128_B_32,Gemm_Rocblas_621286397,0.131256
GemmStridedBatchedTunableOp_Half_TN,tn_1720_1720_128_B_32,Gemm_Rocblas_621286397,0.121277
GemmStridedBatchedTunableOp_Half_TN,tn_1643_1643_128_B_32,Gemm_Hipblaslt_TN_9770,0.1195
GemmStridedBatchedTunableOp_Half_TN,tn_1875_1875_128_B_32,Gemm_Hipblaslt_TN_6942,0.148928
GemmStridedBatchedTunableOp_Half_TN,tn_1965_1965_128_B_32,Gemm_Rocblas_621294533,0.161469
GemmStridedBatchedTunableOp_Half_TN,tn_1610_1610_128_B_32,Gemm_Rocblas_621286397,0.114964
GemmStridedBatchedTunableOp_Half_TN,tn_1580_1580_128_B_32,Gemm_Hipblaslt_TN_6942,0.11165
GemmStridedBatchedTunableOp_Half_TN,tn_1928_1928_128_B_32,Gemm_Hipblaslt_TN_153,0.144526
GemmStridedBatchedTunableOp_Half_TN,tn_1703_1703_128_B_32,Gemm_Rocblas_621286397,0.122836
GemmStridedBatchedTunableOp_Half_TN,tn_1976_1976_128_B_32,Gemm_Hipblaslt_TN_150,0.158353
GemmStridedBatchedTunableOp_Half_TN,tn_1714_1714_128_B_32,Gemm_Rocblas_621286397,0.12473
GemmStridedBatchedTunableOp_Half_TN,tn_1834_1834_128_B_32,Gemm_Hipblaslt_TN_6942,0.14389
GemmStridedBatchedTunableOp_Half_TN,tn_1668_1668_128_B_32,Gemm_Rocblas_621286413,0.118188
GemmStridedBatchedTunableOp_Half_TN,tn_1619_1619_128_B_32,Gemm_Hipblaslt_TN_6942,0.115192
GemmStridedBatchedTunableOp_Half_TN,tn_1713_1713_128_B_32,Gemm_Rocblas_621286397,0.121446
GemmStridedBatchedTunableOp_Half_TN,tn_1771_1771_128_B_32,Gemm_Rocblas_621286397,0.132344
GemmStridedBatchedTunableOp_Half_TN,tn_1774_1774_128_B_32,Gemm_Rocblas_621294110,0.132912
GemmStridedBatchedTunableOp_Half_TN,tn_1621_1621_128_B_32,Gemm_Hipblaslt_TN_6931,0.116011
GemmStridedBatchedTunableOp_Half_TN,tn_2049_2049_128_B_32,Gemm_Rocblas_621294106,0.175363
GemmStridedBatchedTunableOp_Half_TN,tn_1869_1869_128_B_32,Gemm_Rocblas_621294533,0.148227
GemmStridedBatchedTunableOp_Half_TN,tn_1627_1627_128_B_32,Gemm_Rocblas_621286397,0.111165
GemmStridedBatchedTunableOp_Half_TN,tn_1618_1618_128_B_32,Gemm_Hipblaslt_TN_6942,0.115264
GemmStridedBatchedTunableOp_Half_TN,tn_1623_1623_128_B_32,Gemm_Rocblas_621286397,0.116625
GemmStridedBatchedTunableOp_Half_TN,tn_2465_2465_128_B_32,Gemm_Rocblas_621294106,0.251939
GemmStridedBatchedTunableOp_Half_TN,tn_2161_2161_128_B_32,Gemm_Rocblas_621294106,0.193738
GemmStridedBatchedTunableOp_Half_TN,tn_1906_1906_128_B_32,Gemm_Hipblaslt_TN_6942,0.148816
GemmStridedBatchedTunableOp_Half_TN,tn_2192_2192_128_B_32,Gemm_Rocblas_621286397,0.184477
GemmStridedBatchedTunableOp_Half_TN,tn_1781_1781_128_B_32,Gemm_Rocblas_621294108,0.131742
GemmStridedBatchedTunableOp_Half_TN,tn_2433_2433_128_B_32,Gemm_Rocblas_621294106,0.250798
GemmStridedBatchedTunableOp_Half_TN,tn_1636_1636_128_B_32,Gemm_Rocblas_621286397,0.116461
GemmStridedBatchedTunableOp_Half_TN,tn_1831_1831_128_B_32,Gemm_Hipblaslt_TN_6942,0.142883
GemmStridedBatchedTunableOp_Half_TN,tn_1822_1822_128_B_32,Gemm_Rocblas_621286397,0.1421
GemmStridedBatchedTunableOp_Half_TN,tn_1916_1916_128_B_32,Gemm_Hipblaslt_TN_6950,0.150676
GemmStridedBatchedTunableOp_Half_TN,tn_2033_2033_128_B_32,Gemm_Hipblaslt_TN_6879,0.169786
GemmStridedBatchedTunableOp_Half_TN,tn_1887_1887_128_B_32,Gemm_Rocblas_621286397,0.151112
GemmStridedBatchedTunableOp_Half_TN,tn_1767_1767_128_B_32,Gemm_Rocblas_621286397,0.126153
GemmStridedBatchedTunableOp_Half_TN,tn_1746_1746_128_B_32,Gemm_Rocblas_621286397,0.126483
GemmStridedBatchedTunableOp_Half_TN,tn_1984_1984_128_B_32,Gemm_Hipblaslt_TN_153,0.149941
GemmStridedBatchedTunableOp_Half_TN,tn_1598_1598_128_B_32,Gemm_Hipblaslt_TN_6939,0.111953
GemmStridedBatchedTunableOp_Half_TN,tn_1692_1692_128_B_32,Gemm_Rocblas_621294110,0.120072
GemmStridedBatchedTunableOp_Half_TN,tn_1725_1725_128_B_32,Gemm_Rocblas_621286411,0.126895
GemmStridedBatchedTunableOp_Half_TN,tn_1907_1907_128_B_32,Gemm_Hipblaslt_TN_6942,0.146881
GemmStridedBatchedTunableOp_Half_TN,tn_1946_1946_128_B_32,Gemm_Rocblas_621286397,0.159219
GemmStridedBatchedTunableOp_Half_TN,tn_1785_1785_128_B_32,Gemm_Rocblas_621286397,0.132421
GemmStridedBatchedTunableOp_Half_TN,tn_1697_1697_128_B_32,Gemm_Rocblas_621286413,0.122526
GemmStridedBatchedTunableOp_Half_TN,tn_1765_1765_128_B_32,Gemm_Hipblaslt_TN_6879,0.132901
GemmStridedBatchedTunableOp_Half_TN,tn_1728_1728_128_B_32,Gemm_Hipblaslt_TN_9830,0.109642
GemmStridedBatchedTunableOp_Half_TN,tn_1966_1966_128_B_32,Gemm_Rocblas_621294533,0.160919
GemmStridedBatchedTunableOp_Half_TN,tn_2080_2080_128_B_32,Gemm_Rocblas_621286810,0.157663
GemmStridedBatchedTunableOp_Half_TN,tn_1856_1856_128_B_32,Gemm_Hipblaslt_TN_153,0.130882
GemmStridedBatchedTunableOp_Half_TN,tn_2000_2000_128_B_32,Gemm_Hipblaslt_TN_153,0.156425
GemmStridedBatchedTunableOp_Half_TN,tn_1704_1704_128_B_32,Gemm_Rocblas_621286397,0.120095
GemmStridedBatchedTunableOp_Half_TN,tn_1957_1957_128_B_32,Gemm_Rocblas_621294533,0.159396
GemmStridedBatchedTunableOp_Half_TN,tn_1901_1901_128_B_32,Gemm_Hipblaslt_TN_6950,0.152916
GemmStridedBatchedTunableOp_Half_TN,tn_1607_1607_128_B_32,Gemm_Hipblaslt_TN_6942,0.115788
GemmStridedBatchedTunableOp_Half_TN,tn_1828_1828_128_B_32,Gemm_Rocblas_621286397,0.143999
GemmStridedBatchedTunableOp_Half_TN,tn_1795_1795_128_B_32,Gemm_Hipblaslt_TN_6942,0.137975
GemmStridedBatchedTunableOp_Half_TN,tn_1823_1823_128_B_32,Gemm_Rocblas_621286397,0.142564
GemmStridedBatchedTunableOp_Half_TN,tn_1908_1908_128_B_32,Gemm_Hipblaslt_TN_6942,0.14943
GemmStridedBatchedTunableOp_Half_TN,tn_1804_1804_128_B_32,Gemm_Hipblaslt_TN_6942,0.140018
GemmStridedBatchedTunableOp_Half_TN,tn_1642_1642_128_B_32,Gemm_Hipblaslt_TN_6942,0.117964
GemmStridedBatchedTunableOp_Half_TN,tn_1716_1716_128_B_32,Gemm_Rocblas_621294106,0.120145
GemmStridedBatchedTunableOp_Half_TN,tn_1971_1971_128_B_32,Gemm_Hipblaslt_TN_6879,0.159657
GemmStridedBatchedTunableOp_Half_TN,tn_1677_1677_128_B_32,Gemm_Rocblas_621294110,0.122728
GemmStridedBatchedTunableOp_Half_TN,tn_1853_1853_128_B_32,Gemm_Hipblaslt_TN_6942,0.145412
GemmStridedBatchedTunableOp_Half_TN,tn_2177_2177_128_B_32,Gemm_Rocblas_621294106,0.191326
GemmStridedBatchedTunableOp_Half_TN,tn_1769_1769_128_B_32,Gemm_Rocblas_621286397,0.13378
GemmStridedBatchedTunableOp_Half_TN,tn_1800_1800_128_B_32,Gemm_Hipblaslt_TN_157,0.130465
GemmStridedBatchedTunableOp_Half_TN,tn_1693_1693_128_B_32,Gemm_Hipblaslt_TN_6942,0.122894
GemmStridedBatchedTunableOp_Half_TN,tn_1698_1698_128_B_32,Gemm_Rocblas_621286397,0.122922
GemmStridedBatchedTunableOp_Half_TN,tn_1898_1898_128_B_32,Gemm_Hipblaslt_TN_6950,0.151123
GemmStridedBatchedTunableOp_Half_TN,tn_1622_1622_128_B_32,Gemm_Rocblas_621286397,0.116309
GemmStridedBatchedTunableOp_Half_TN,tn_1937_1937_128_B_32,Gemm_Hipblaslt_TN_6879,0.156337
GemmStridedBatchedTunableOp_Half_TN,tn_1747_1747_128_B_32,Gemm_Rocblas_621286397,0.128369
GemmStridedBatchedTunableOp_Half_TN,tn_2129_2129_128_B_32,Gemm_Rocblas_621294538,0.187901
GemmStridedBatchedTunableOp_Half_TN,tn_1601_1601_128_B_32,Gemm_Hipblaslt_TN_6942,0.114713
GemmStridedBatchedTunableOp_Half_TN,tn_1889_1889_128_B_32,Gemm_Hipblaslt_TN_6942,0.150268
GemmStridedBatchedTunableOp_Half_TN,tn_1824_1824_128_B_32,Gemm_Hipblaslt_TN_153,0.12877
GemmStridedBatchedTunableOp_Half_TN,tn_1949_1949_128_B_32,Gemm_Rocblas_621294533,0.159717
GemmStridedBatchedTunableOp_Half_TN,tn_1711_1711_128_B_32,Gemm_Hipblaslt_TN_6942,0.124301
GemmStridedBatchedTunableOp_Half_TN,tn_1817_1817_128_B_32,Gemm_Hipblaslt_TN_6942,0.142101
GemmStridedBatchedTunableOp_Half_TN,tn_1783_1783_128_B_32,Gemm_Rocblas_621286411,0.132956
GemmStridedBatchedTunableOp_Half_TN,tn_2481_2481_128_B_32,Gemm_Rocblas_621294106,0.255011
GemmStridedBatchedTunableOp_Half_TN,tn_1701_1701_128_B_32,Gemm_Rocblas_621286397,0.120082
GemmStridedBatchedTunableOp_Half_TN,tn_1609_1609_128_B_32,Gemm_Hipblaslt_TN_6942,0.114712
GemmStridedBatchedTunableOp_Half_TN,tn_1864_1864_128_B_32,Gemm_Hipblaslt_TN_157,0.134942
GemmStridedBatchedTunableOp_Half_TN,tn_1749_1749_128_B_32,Gemm_Rocblas_621286397,0.128655
GemmStridedBatchedTunableOp_Half_TN,tn_1752_1752_128_B_32,Gemm_Rocblas_621286397,0.124892
GemmStridedBatchedTunableOp_Half_TN,tn_1951_1951_128_B_32,Gemm_Hipblaslt_TN_6879,0.156777
GemmStridedBatchedTunableOp_Half_TN,tn_1842_1842_128_B_32,Gemm_Hipblaslt_TN_6942,0.142406
GemmTunableOp_Half_TN,tn_4096_3379_14336,Gemm_Hipblaslt_TN_9677,0.666711
GemmTunableOp_Half_TN,tn_28672_1772_4096,Gemm_Hipblaslt_TN_9223,0.741199
GemmTunableOp_Half_TN,tn_4096_3581_14336,Gemm_Hipblaslt_TN_9743,0.689331
GemmTunableOp_Half_TN,tn_28672_1796_4096,Gemm_Hipblaslt_TN_9832,0.794223
GemmTunableOp_Half_TN,tn_6144_3309_4096,Gemm_Rocblas_621294306,0.305015
GemmTunableOp_Half_TN,tn_4096_3400_4096,Gemm_Hipblaslt_TN_9743,0.194458
GemmTunableOp_Half_TN,tn_4096_1874_14336,Gemm_Hipblaslt_TN_9645,0.413955
GemmTunableOp_Half_TN,tn_4096_3768_14336,Gemm_Hipblaslt_TN_9827,0.730703
GemmTunableOp_Half_TN,tn_6144_1813_4096,Gemm_Hipblaslt_TN_9691,0.165034
GemmTunableOp_Half_TN,tn_6144_1651_4096,Gemm_Rocblas_621286566,0.153727
GemmTunableOp_Half_TN,tn_128256_139_4096,Gemm_Hipblaslt_TN_9808,0.468592
GemmTunableOp_Half_TN,tn_4096_5223_14336,Gemm_Hipblaslt_TN_9924,1.08934
GemmTunableOp_Half_TN,tn_28672_5583_4096,Gemm_Hipblaslt_TN_9840,2.33697
GemmTunableOp_Half_TN,tn_4096_1597_14336,Gemm_Hipblaslt_TN_9265,0.357011
GemmTunableOp_Half_TN,tn_4096_1752_14336,Gemm_Hipblaslt_TN_9645,0.3934
GemmTunableOp_Half_TN,tn_4096_3768_4096,Gemm_Rocblas_621294030,0.214802
GemmTunableOp_Half_TN,tn_4096_1916_4096,Gemm_Hipblaslt_TN_9680,0.122454
GemmTunableOp_Half_TN,tn_4096_3565_14336,Gemm_Hipblaslt_TN_9743,0.68714
GemmTunableOp_Half_TN,tn_4096_5357_4096,Gemm_Rocblas_621286580,0.328999
GemmTunableOp_Half_TN,tn_4096_1931_14336,Gemm_Hipblaslt_TN_9645,0.419957
GemmTunableOp_Half_TN,tn_6144_1931_4096,Gemm_Rocblas_621286747,0.177666
GemmTunableOp_Half_TN,tn_6144_1825_4096,Gemm_Hipblaslt_TN_9691,0.165493
GemmTunableOp_Half_TN,tn_128256_84_4096,Gemm_Hipblaslt_TN_9057,0.391914
GemmTunableOp_Half_TN,tn_4096_1963_14336,Gemm_Hipblaslt_TN_9645,0.422331
GemmTunableOp_Half_TN,tn_4096_1767_14336,Gemm_Hipblaslt_TN_9645,0.394708
GemmTunableOp_Half_TN,tn_28672_1767_4096,Gemm_Hipblaslt_TN_9191,0.74276
GemmTunableOp_Half_TN,tn_4096_3651_4096,Gemm_Hipblaslt_TN_9827,0.210406
GemmTunableOp_Half_TN,tn_28672_6871_4096,Gemm_Hipblaslt_TN_9943,2.82075
GemmTunableOp_Half_TN,tn_28672_1934_4096,Gemm_Hipblaslt_TN_9846,0.826124
GemmTunableOp_Half_TN,tn_128256_206_4096,Gemm_Hipblaslt_TN_9847,0.558947
GemmTunableOp_Half_TN,tn_6144_1607_4096,Gemm_Rocblas_621286753,0.15332
GemmTunableOp_Half_TN,tn_28672_1689_4096,Gemm_Hipblaslt_TN_9223,0.726198
GemmTunableOp_Half_TN,tn_4096_1831_14336,Gemm_Hipblaslt_TN_9645,0.412135
GemmTunableOp_Half_TN,tn_128256_117_4096,Gemm_Hipblaslt_TN_9771,0.428896
GemmTunableOp_Half_TN,tn_4096_7730_4096,Gemm_Hipblaslt_TN_9704,0.436487
GemmTunableOp_Half_TN,tn_4096_1854_4096,Gemm_Hipblaslt_TN_9134,0.119712
GemmTunableOp_Half_TN,tn_6144_1622_4096,Gemm_Hipblaslt_TN_9570,0.153985
GemmTunableOp_Half_TN,tn_4096_1762_4096,Gemm_Hipblaslt_TN_9645,0.116818
GemmTunableOp_Half_TN,tn_4096_1945_4096,Gemm_Hipblaslt_TN_9645,0.12374
GemmTunableOp_Half_TN,tn_4096_3583_4096,Gemm_Hipblaslt_TN_9814,0.200425
GemmTunableOp_Half_TN,tn_4096_6997_4096,Gemm_Hipblaslt_TN_9743,0.399275
GemmTunableOp_Half_TN,tn_6144_6721_4096,Gemm_Hipblaslt_TN_9743,0.584068
GemmTunableOp_Half_TN,tn_28672_3450_4096,Gemm_Hipblaslt_TN_9827,1.36984
GemmTunableOp_Half_TN,tn_4096_136_4096,Gemm_Rocblas_621286443,0.021761
GemmTunableOp_Half_TN,tn_4096_1707_4096,Gemm_Hipblaslt_TN_9671,0.107747
GemmTunableOp_Half_TN,tn_4096_5680_4096,Gemm_Hipblaslt_TN_9689,0.338151
GemmTunableOp_Half_TN,tn_28672_5030_4096,Gemm_Hipblaslt_TN_9849,2.08008
GemmTunableOp_Half_TN,tn_4096_1765_4096,Gemm_Hipblaslt_TN_9645,0.117836
GemmTunableOp_Half_TN,tn_4096_128_4096,Gemm_Rocblas_621294164,0.0174497
GemmTunableOp_Half_TN,tn_6144_7206_4096,Gemm_Hipblaslt_TN_9743,0.607246
GemmTunableOp_Half_TN,tn_28672_7301_4096,Gemm_Hipblaslt_TN_159,2.88562
GemmTunableOp_Half_TN,tn_4096_3455_4096,Gemm_Hipblaslt_TN_9743,0.194842
GemmTunableOp_Half_TN,tn_4096_1826_14336,Gemm_Hipblaslt_TN_9620,0.409545
GemmTunableOp_Half_TN,tn_6144_5204_4096,Gemm_Hipblaslt_TN_9713,0.446288
GemmTunableOp_Half_TN,tn_4096_3781_14336,Gemm_Hipblaslt_TN_9827,0.726505
GemmTunableOp_Half_TN,tn_4096_1658_4096,Gemm_Hipblaslt_TN_9616,0.103608
GemmTunableOp_Half_TN,tn_6144_1719_4096,Gemm_Hipblaslt_TN_9799,0.157659
GemmTunableOp_Half_TN,tn_32000_155_4096,Gemm_Hipblaslt_TN_9564,0.108357
GemmTunableOp_Half_TN,tn_28672_3682_4096,Gemm_Hipblaslt_TN_9827,1.51619
GemmTunableOp_Half_TN,tn_4096_3583_14336,Gemm_Hipblaslt_TN_9743,0.692821
GemmTunableOp_Half_TN,tn_4096_3369_14336,Gemm_Hipblaslt_TN_9192,0.66588
GemmTunableOp_Half_TN,tn_4096_3640_4096,Gemm_Hipblaslt_TN_9743,0.204622
GemmTunableOp_Half_TN,tn_4096_1859_4096,Gemm_Hipblaslt_TN_9134,0.122079
GemmTunableOp_Half_TN,tn_6144_1593_4096,Gemm_Rocblas_621294305,0.148141
GemmTunableOp_Half_TN,tn_12288_138_4096,Gemm_Rocblas_621286472,0.0427548
GemmTunableOp_Half_TN,tn_28672_7023_4096,Gemm_Hipblaslt_TN_9958,2.86787
GemmTunableOp_Half_TN,tn_128256_48_4096,Gemm_Hipblaslt_TN_9451,0.329218
GemmTunableOp_Half_TN,tn_6144_6870_4096,Gemm_Hipblaslt_TN_9955,0.588825
GemmTunableOp_Half_TN,tn_4096_5735_14336,Gemm_Hipblaslt_TN_9689,1.19203
GemmTunableOp_Half_TN,tn_6144_3855_4096,Gemm_Hipblaslt_TN_9689,0.342543
GemmTunableOp_Half_TN,tn_12288_2305_4096,Gemm_Hipblaslt_TN_9220,0.409104
GemmTunableOp_Half_TN,tn_4096_1690_14336,Gemm_Hipblaslt_TN_9790,0.368861
GemmTunableOp_Half_TN,tn_28672_1850_4096,Gemm_Hipblaslt_TN_9684,0.806098
GemmTunableOp_Half_TN,tn_28672_5352_4096,Gemm_Hipblaslt_TN_9892,2.17929
GemmTunableOp_Half_TN,tn_4096_1600_14336,Gemm_Hipblaslt_TN_9679,0.360164
GemmTunableOp_Half_TN,tn_28672_7050_4096,Gemm_Hipblaslt_TN_9919,2.87052
GemmTunableOp_Half_TN,tn_6144_8_4096,Gemm_Rocblas_621286311,0.0129241
GemmTunableOp_Half_TN,tn_4096_40_4096,Gemm_Rocblas_621286428,0.0126465
GemmTunableOp_Half_TN,tn_4096_1875_14336,Gemm_Hipblaslt_TN_9645,0.415584
GemmTunableOp_Half_TN,tn_4096_1864_14336,Gemm_Hipblaslt_TN_9645,0.413243
GemmTunableOp_Half_TN,tn_28672_3557_4096,Gemm_Hipblaslt_TN_9841,1.38663
GemmTunableOp_Half_TN,tn_4096_3468_4096,Gemm_Hipblaslt_TN_9814,0.200131
GemmTunableOp_Half_TN,tn_6144_200_4096,Gemm_Hipblaslt_TN_9495,0.0323022
GemmTunableOp_Half_TN,tn_4096_3373_14336,Gemm_Hipblaslt_TN_9189,0.665623
GemmTunableOp_Half_TN,tn_28672_1916_4096,Gemm_Hipblaslt_TN_9684,0.812222
GemmTunableOp_Half_TN,tn_4096_3791_14336,Gemm_Hipblaslt_TN_9827,0.734395
GemmTunableOp_Half_TN,tn_6144_1935_4096,Gemm_Hipblaslt_TN_9693,0.177248
GemmTunableOp_Half_TN,tn_28672_1954_4096,Gemm_Hipblaslt_TN_9846,0.841008
GemmTunableOp_Half_TN,tn_28672_3767_4096,Gemm_Hipblaslt_TN_9827,1.52492
GemmTunableOp_Half_TN,tn_4096_1862_4096,Gemm_Hipblaslt_TN_9134,0.121669
GemmTunableOp_Half_TN,tn_6144_1973_4096,Gemm_Hipblaslt_TN_9693,0.17932
GemmTunableOp_Half_TN,tn_28672_1902_4096,Gemm_Hipblaslt_TN_9684,0.807645
GemmTunableOp_Half_TN,tn_4096_1909_4096,Gemm_Hipblaslt_TN_9645,0.121624
GemmTunableOp_Half_TN,tn_22016_2081_4096,Gemm_Hipblaslt_TN_9827,0.683497
GemmTunableOp_Half_TN,tn_6144_3781_4096,Gemm_Hipblaslt_TN_9691,0.337873
GemmTunableOp_Half_TN,tn_6144_3345_4096,Gemm_Rocblas_621286566,0.307505
GemmTunableOp_Half_TN,tn_28672_3514_4096,Gemm_Hipblaslt_TN_9827,1.37924
GemmTunableOp_Half_TN,tn_4096_1648_14336,Gemm_Hipblaslt_TN_9679,0.363752
GemmTunableOp_Half_TN,tn_28672_1784_4096,Gemm_Hipblaslt_TN_9220,0.744527
GemmTunableOp_Half_TN,tn_6144_3574_4096,Gemm_Hipblaslt_TN_9570,0.321535
GemmTunableOp_Half_TN,tn_4096_3562_4096,Gemm_Hipblaslt_TN_9743,0.203148
GemmTunableOp_Half_TN,tn_22016_129_4096,Gemm_Hipblaslt_TN_9022,0.0706709
GemmTunableOp_Half_TN,tn_28672_1869_4096,Gemm_Hipblaslt_TN_9684,0.806824
GemmTunableOp_Half_TN,tn_4096_7340_14336,Gemm_Hipblaslt_TN_9738,1.53545
GemmTunableOp_Half_TN,tn_4096_6788_4096,Gemm_Hipblaslt_TN_9955,0.393023
GemmTunableOp_Half_TN,tn_128256_15_4096,Gemm_Hipblaslt_TN_9405,0.290994
GemmTunableOp_Half_TN,tn_128256_219_4096,Gemm_Hipblaslt_TN_9937,0.572681
GemmTunableOp_Half_TN,tn_6144_1798_4096,Gemm_Hipblaslt_TN_9691,0.164833
GemmTunableOp_Half_TN,tn_4096_1798_14336,Gemm_Hipblaslt_TN_9680,0.407654
GemmTunableOp_Half_TN,tn_4096_1799_4096,Gemm_Hipblaslt_TN_9645,0.118714
GemmTunableOp_Half_TN,tn_4096_1930_14336,Gemm_Hipblaslt_TN_9645,0.418186
GemmTunableOp_Half_TN,tn_4096_1970_4096,Gemm_Hipblaslt_TN_9645,0.125522
GemmTunableOp_Half_TN,tn_128256_225_4096,Gemm_Rocblas_621294634,0.588299
GemmTunableOp_Half_TN,tn_28672_1898_4096,Gemm_Hipblaslt_TN_9832,0.80634
GemmTunableOp_Half_TN,tn_4096_1828_4096,Gemm_Hipblaslt_TN_9645,0.120839
GemmTunableOp_Half_TN,tn_4096_2290_4096,Gemm_Hipblaslt_TN_9767,0.140238
GemmTunableOp_Half_TN,tn_6144_1978_4096,Gemm_Hipblaslt_TN_9536,0.179754
GemmTunableOp_Half_TN,tn_4096_1614_4096,Gemm_Hipblaslt_TN_9679,0.106638
GemmTunableOp_Half_TN,tn_6144_1831_4096,Gemm_Rocblas_621286683,0.164727
GemmTunableOp_Half_TN,tn_4096_3511_4096,Gemm_Hipblaslt_TN_9814,0.201819
GemmTunableOp_Half_TN,tn_22016_2290_4096,Gemm_Hipblaslt_TN_9832,0.75489
GemmTunableOp_Half_TN,tn_128256_153_4096,Gemm_Hipblaslt_TN_9808,0.478347
GemmTunableOp_Half_TN,tn_4096_3574_14336,Gemm_Hipblaslt_TN_9743,0.691855
GemmTunableOp_Half_TN,tn_28672_3748_4096,Gemm_Hipblaslt_TN_9827,1.52581
GemmTunableOp_Half_TN,tn_4096_120_4096,Gemm_Rocblas_621286436,0.0174108
GemmTunableOp_Half_TN,tn_6144_1953_4096,Gemm_Hipblaslt_TN_9693,0.177814
GemmTunableOp_Half_TN,tn_6144_144_4096,Gemm_Hipblaslt_TN_9472,0.026238
GemmTunableOp_Half_TN,tn_4096_3514_14336,Gemm_Hipblaslt_TN_9743,0.684807
GemmTunableOp_Half_TN,tn_4096_3416_14336,Gemm_Hipblaslt_TN_9832,0.66794
GemmTunableOp_Half_TN,tn_4096_3410_14336,Gemm_Hipblaslt_TN_9192,0.671394
GemmTunableOp_Half_TN,tn_4096_139_11008,Gemm_Hipblaslt_TN_7219,0.0453522
GemmTunableOp_Half_TN,tn_4096_7072_4096,Gemm_Hipblaslt_TN_9743,0.399424
GemmTunableOp_Half_TN,tn_28672_216_4096,Gemm_Hipblaslt_TN_9680,0.112976
GemmTunableOp_Half_TN,tn_6144_1780_4096,Gemm_Rocblas_621286684,0.164674
GemmTunableOp_Half_TN,tn_28672_1760_4096,Gemm_Hipblaslt_TN_9191,0.73655
GemmTunableOp_Half_TN,tn_4096_1898_4096,Gemm_Hipblaslt_TN_9645,0.120666
GemmTunableOp_Half_TN,tn_28672_1822_4096,Gemm_Hipblaslt_TN_9684,0.797016
GemmTunableOp_Half_TN,tn_6144_7325_4096,Gemm_Hipblaslt_TN_9914,0.630243
GemmTunableOp_Half_TN,tn_4096_3508_14336,Gemm_Hipblaslt_TN_9677,0.686331
GemmTunableOp_Half_TN,tn_28672_1770_4096,Gemm_Hipblaslt_TN_9223,0.73815
GemmTunableOp_Half_TN,tn_4096_1713_4096,Gemm_Hipblaslt_TN_9679,0.108885
GemmTunableOp_Half_TN,tn_4096_5322_4096,Gemm_Rocblas_621286580,0.325825
GemmTunableOp_Half_TN,tn_12288_2273_4096,Gemm_Hipblaslt_TN_9743,0.391019
GemmTunableOp_Half_TN,tn_6144_1623_4096,Gemm_Rocblas_621294495,0.153887
GemmTunableOp_Half_TN,tn_4096_1719_14336,Gemm_Hipblaslt_TN_9265,0.370209
GemmTunableOp_Half_TN,tn_4096_1763_14336,Gemm_Hipblaslt_TN_9645,0.39635
GemmTunableOp_Half_TN,tn_4096_3647_4096,Gemm_Hipblaslt_TN_9697,0.203331
GemmTunableOp_Half_TN,tn_28672_1882_4096,Gemm_Hipblaslt_TN_9832,0.810485
GemmTunableOp_Half_TN,tn_6144_7096_4096,Gemm_Hipblaslt_TN_9743,0.594294
GemmTunableOp_Half_TN,tn_4096_5495_4096,Gemm_Rocblas_621294320,0.332335
GemmTunableOp_Half_TN,tn_4096_1625_4096,Gemm_Hipblaslt_TN_9607,0.105778
GemmTunableOp_Half_TN,tn_4096_1769_14336,Gemm_Hipblaslt_TN_9645,0.398778
GemmTunableOp_Half_TN,tn_4096_1618_4096,Gemm_Hipblaslt_TN_9671,0.106746
GemmTunableOp_Half_TN,tn_6144_1807_4096,Gemm_Rocblas_621286683,0.165677
GemmTunableOp_Half_TN,tn_12288_4082_4096,Gemm_Hipblaslt_TN_9704,0.685049
GemmTunableOp_Half_TN,tn_4096_1628_14336,Gemm_Hipblaslt_TN_9610,0.362254
GemmTunableOp_Half_TN,tn_4096_1842_14336,Gemm_Hipblaslt_TN_9268,0.412938
GemmTunableOp_Half_TN,tn_4096_1867_4096,Gemm_Hipblaslt_TN_9645,0.121983
GemmTunableOp_Half_TN,tn_4096_5390_14336,Gemm_Hipblaslt_TN_9709,1.1297
GemmTunableOp_Half_TN,tn_4096_1852_14336,Gemm_Hipblaslt_TN_9645,0.415328
GemmTunableOp_Half_TN,tn_4096_7262_4096,Gemm_Hipblaslt_TN_9743,0.411445
GemmTunableOp_Half_TN,tn_28672_1820_4096,Gemm_Hipblaslt_TN_9832,0.799642
GemmTunableOp_Half_TN,tn_128256_250_4096,Gemm_Rocblas_621286892,0.607727
GemmTunableOp_Half_TN,tn_22016_2113_4096,Gemm_Hipblaslt_TN_9827,0.671788
GemmTunableOp_Half_TN,tn_4096_5030_14336,Gemm_Hipblaslt_TN_9799,1.05235
GemmTunableOp_Half_TN,tn_4096_3582_4096,Gemm_Hipblaslt_TN_9743,0.200555
GemmTunableOp_Half_TN,tn_4096_1757_4096,Gemm_Hipblaslt_TN_9134,0.116489
GemmTunableOp_Half_TN,tn_4096_2353_4096,Gemm_Hipblaslt_TN_9698,0.143272
GemmTunableOp_Half_TN,tn_4096_1636_4096,Gemm_Hipblaslt_TN_9359,0.103805
GemmTunableOp_Half_TN,tn_12288_133_4096,Gemm_Hipblaslt_TN_9154,0.0422173
GemmTunableOp_Half_TN,tn_22016_2258_4096,Gemm_Hipblaslt_TN_9832,0.748342
GemmTunableOp_Half_TN,tn_12288_2145_4096,Gemm_Hipblaslt_TN_9697,0.381228
GemmTunableOp_Half_TN,tn_4096_148_11008,Gemm_Hipblaslt_TN_7219,0.0468059
GemmTunableOp_Half_TN,tn_32000_142_4096,Gemm_Hipblaslt_TN_9325,0.107349
GemmTunableOp_Half_TN,tn_28672_3706_4096,Gemm_Hipblaslt_TN_9827,1.51843
GemmTunableOp_Half_TN,tn_4096_1967_14336,Gemm_Hipblaslt_TN_9592,0.421608
GemmTunableOp_Half_TN,tn_4096_1801_14336,Gemm_Hipblaslt_TN_9680,0.409011
GemmTunableOp_Half_TN,tn_4096_16_4096,Gemm_Rocblas_621294136,0.0101584
GemmTunableOp_Half_TN,tn_28672_1727_4096,Gemm_Hipblaslt_TN_9190,0.735982
GemmTunableOp_Half_TN,tn_28672_1896_4096,Gemm_Hipblaslt_TN_9683,0.805535
GemmTunableOp_Half_TN,tn_4096_151_11008,Gemm_Hipblaslt_TN_7219,0.046329
GemmTunableOp_Half_TN,tn_28672_1935_4096,Gemm_Hipblaslt_TN_9846,0.832293
GemmTunableOp_Half_TN,tn_4096_136_11008,Gemm_Hipblaslt_TN_7219,0.0448455
GemmTunableOp_Half_TN,tn_12288_2274_4096,Gemm_Hipblaslt_TN_9697,0.388494
GemmTunableOp_Half_TN,tn_4096_1826_4096,Gemm_Hipblaslt_TN_9645,0.120171
GemmTunableOp_Half_TN,tn_6144_1977_4096,Gemm_Hipblaslt_TN_9693,0.177217
GemmTunableOp_Half_TN,tn_4096_2273_11008,Gemm_Hipblaslt_TN_9748,0.365884
GemmTunableOp_Half_TN,tn_4096_1924_14336,Gemm_Hipblaslt_TN_9620,0.420111
GemmTunableOp_Half_TN,tn_128256_78_4096,Gemm_Hipblaslt_TN_9057,0.385712
GemmTunableOp_Half_TN,tn_128256_71_4096,Gemm_Hipblaslt_TN_9057,0.381281
GemmTunableOp_Half_TN,tn_6144_3773_4096,Gemm_Hipblaslt_TN_9799,0.338198
GemmTunableOp_Half_TN,tn_22016_6_4096,Gemm_Rocblas_621286317,0.0351581
GemmTunableOp_Half_TN,tn_4096_7118_4096,Gemm_Hipblaslt_TN_9814,0.406944
GemmTunableOp_Half_TN,tn_22016_138_4096,Gemm_Hipblaslt_TN_9319,0.072647
GemmTunableOp_Half_TN,tn_32000_157_4096,Gemm_Hipblaslt_TN_9612,0.106812
GemmTunableOp_Half_TN,tn_4096_1683_14336,Gemm_Hipblaslt_TN_9671,0.367938
GemmTunableOp_Half_TN,tn_4096_158_4096,Gemm_Rocblas_621294230,0.0223786
GemmTunableOp_Half_TN,tn_6144_1946_4096,Gemm_Hipblaslt_TN_9536,0.178096
GemmTunableOp_Half_TN,tn_4096_5413_14336,Gemm_Hipblaslt_TN_9799,1.14049
GemmTunableOp_Half_TN,tn_4096_2290_11008,Gemm_Hipblaslt_TN_9748,0.366728
GemmTunableOp_Half_TN,tn_4096_2177_11008,Gemm_Hipblaslt_TN_9728,0.358563
GemmTunableOp_Half_TN,tn_22016_159_4096,Gemm_Hipblaslt_TN_9370,0.0755408
GemmTunableOp_Half_TN,tn_6144_5410_4096,Gemm_Hipblaslt_TN_9753,0.455962
GemmTunableOp_Half_TN,tn_22016_2273_4096,Gemm_Hipblaslt_TN_9832,0.749414
GemmTunableOp_Half_TN,tn_4096_2145_11008,Gemm_Hipblaslt_TN_9698,0.353793
GemmTunableOp_Half_TN,tn_4096_1883_4096,Gemm_Hipblaslt_TN_9134,0.120841
GemmTunableOp_Half_TN,tn_4096_133_4096,Gemm_Rocblas_621286440,0.0215518
GemmTunableOp_Half_TN,tn_4096_152_4096,Gemm_Rocblas_621286440,0.0220273
GemmTunableOp_Half_TN,tn_4096_131_11008,Gemm_Hipblaslt_TN_8260,0.04528
GemmTunableOp_Half_TN,tn_4096_151_4096,Gemm_Rocblas_621294168,0.0221082
GemmTunableOp_Half_TN,tn_4096_2303_11008,Gemm_Hipblaslt_TN_9748,0.365218
GemmTunableOp_Half_TN,tn_4096_5273_14336,Gemm_Hipblaslt_TN_9924,1.09649
GemmTunableOp_Half_TN,tn_28672_1643_4096,Gemm_Hipblaslt_TN_9184,0.720427
GemmTunableOp_Half_TN,tn_12288_4000_4096,Gemm_Hipblaslt_TN_9753,0.671887
GemmTunableOp_Half_TN,tn_4096_3586_4096,Gemm_Hipblaslt_TN_9221,0.20269
GemmTunableOp_Half_TN,tn_4096_5465_14336,Gemm_Hipblaslt_TN_9799,1.15825
GemmTunableOp_Half_TN,tn_12288_161_4096,Gemm_Rocblas_621286472,0.0442098
GemmTunableOp_Half_TN,tn_4096_3645_14336,Gemm_Hipblaslt_TN_9743,0.697502
GemmTunableOp_Half_TN,tn_4096_5470_4096,Gemm_Rocblas_621286580,0.333448
GemmTunableOp_Half_TN,tn_4096_2433_11008,Gemm_Hipblaslt_TN_9681,0.394353
GemmTunableOp_Half_TN,tn_4096_1698_14336,Gemm_Hipblaslt_TN_9671,0.368805
GemmTunableOp_Half_TN,tn_32000_138_4096,Gemm_Hipblaslt_TN_9606,0.10788
GemmTunableOp_Half_TN,tn_4096_5412_4096,Gemm_Hipblaslt_TN_9691,0.329274
GemmTunableOp_Half_TN,tn_4096_134_11008,Gemm_Hipblaslt_TN_7219,0.0450732
GemmTunableOp_Half_TN,tn_128256_129_4096,Gemm_Hipblaslt_TN_9108,0.461643
GemmTunableOp_Half_TN,tn_4096_2337_4096,Gemm_Hipblaslt_TN_9195,0.143094
GemmTunableOp_Half_TN,tn_28672_7325_4096,Gemm_Hipblaslt_TN_159,2.9165
GemmTunableOp_Half_TN,tn_4096_140_11008,Gemm_Hipblaslt_TN_7219,0.0465377
GemmTunableOp_Half_TN,tn_4096_7267_4096,Gemm_Hipblaslt_TN_9743,0.413218
GemmTunableOp_Half_TN,tn_4096_5605_14336,Gemm_Hipblaslt_TN_9799,1.1804
GemmTunableOp_Half_TN,tn_6144_7340_4096,Gemm_Hipblaslt_TN_9890,0.633087
GemmTunableOp_Half_TN,tn_128256_205_4096,Gemm_Hipblaslt_TN_9847,0.560584
GemmTunableOp_Half_TN,tn_4096_2080_4096,Gemm_Hipblaslt_TN_9670,0.132376
GemmTunableOp_Half_TN,tn_128256_107_4096,Gemm_Rocblas_621294762,0.42044
GemmTunableOp_Half_TN,tn_4096_5067_4096,Gemm_Hipblaslt_TN_9691,0.314336
GemmTunableOp_Half_TN,tn_4096_200_4096,Gemm_Rocblas_621294171,0.0247618
GemmTunableOp_Half_TN,tn_6144_1802_4096,Gemm_Rocblas_621294425,0.164314
GemmTunableOp_Half_TN,tn_6144_3830_4096,Gemm_Hipblaslt_TN_9691,0.339605
GemmTunableOp_Half_TN,tn_4096_2401_11008,Gemm_Hipblaslt_TN_9728,0.379828
GemmTunableOp_Half_TN,tn_4096_157_11008,Gemm_Hipblaslt_TN_7219,0.0478399
GemmTunableOp_Half_TN,tn_128256_163_4096,Gemm_Hipblaslt_TN_9732,0.509891
GemmTunableOp_Half_TN,tn_22016_141_4096,Gemm_Hipblaslt_TN_9319,0.0720745
GemmTunableOp_Half_TN,tn_4096_7047_14336,Gemm_Hipblaslt_TN_9692,1.42984
GemmTunableOp_Half_TN,tn_12288_2097_4096,Gemm_Hipblaslt_TN_9697,0.368779
GemmTunableOp_Half_TN,tn_4096_4017_4096,Gemm_Hipblaslt_TN_9827,0.225951
GemmTunableOp_Half_TN,tn_4096_7225_14336,Gemm_Hipblaslt_TN_9743,1.43997
GemmTunableOp_Half_TN,tn_128256_57_4096,Gemm_Rocblas_621286813,0.358713
GemmTunableOp_Half_TN,tn_12288_151_4096,Gemm_Rocblas_621294209,0.0434441
GemmTunableOp_Half_TN,tn_4096_2064_11008,Gemm_Hipblaslt_TN_9698,0.350311
GemmTunableOp_Half_TN,tn_4096_1820_14336,Gemm_Hipblaslt_TN_9592,0.412478
GemmTunableOp_Half_TN,tn_28672_160_4096,Gemm_Hipblaslt_TN_9561,0.0880811
GemmTunableOp_Half_TN,tn_4096_232_14336,Gemm_Hipblaslt_TN_9303,0.0723614
GemmTunableOp_Half_TN,tn_22016_2433_4096,Gemm_Hipblaslt_TN_9846,0.803048
GemmTunableOp_Half_TN,tn_4096_1789_14336,Gemm_Hipblaslt_TN_9645,0.395673
GemmTunableOp_Half_TN,tn_6144_1823_4096,Gemm_Rocblas_621294426,0.165709
GemmTunableOp_Half_TN,tn_32000_151_4096,Gemm_Hipblaslt_TN_9564,0.107995
GemmTunableOp_Half_TN,tn_28672_104_4096,Gemm_Hipblaslt_TN_9634,0.069408
GemmTunableOp_Half_TN,tn_28672_1655_4096,Gemm_Hipblaslt_TN_9184,0.724774
GemmTunableOp_Half_TN,tn_6144_96_4096,Gemm_Rocblas_621294029,0.018389
GemmTunableOp_Half_TN,tn_4096_134_4096,Gemm_Rocblas_621286491,0.0216976
GemmTunableOp_Half_TN,tn_4096_5285_14336,Gemm_Hipblaslt_TN_9799,1.11511
GemmTunableOp_Half_TN,tn_4096_7182_14336,Gemm_Hipblaslt_TN_9743,1.44212
GemmTunableOp_Half_TN,tn_6144_1957_4096,Gemm_Hipblaslt_TN_9793,0.176707
GemmTunableOp_Half_TN,tn_22016_2417_4096,Gemm_Hipblaslt_TN_9832,0.807003
GemmTunableOp_Half_TN,tn_28672_3559_4096,Gemm_Hipblaslt_TN_9827,1.38287
GemmTunableOp_Half_TN,tn_4096_1954_14336,Gemm_Hipblaslt_TN_9592,0.422279
GemmTunableOp_Half_TN,tn_22016_133_4096,Gemm_Hipblaslt_TN_9319,0.0720099
GemmTunableOp_Half_TN,tn_4096_6997_14336,Gemm_Hipblaslt_TN_9694,1.42115
GemmTunableOp_Half_TN,tn_12288_2177_4096,Gemm_Hipblaslt_TN_9677,0.382341
GemmTunableOp_Half_TN,tn_4096_159_11008,Gemm_Hipblaslt_TN_7219,0.0477172
GemmTunableOp_Half_TN,tn_4096_1725_14336,Gemm_Hipblaslt_TN_9679,0.369427
GemmTunableOp_Half_TN,tn_12288_153_4096,Gemm_Rocblas_621286472,0.0439418
GemmTunableOp_Half_TN,tn_4096_1815_4096,Gemm_Hipblaslt_TN_9645,0.119082
GemmTunableOp_Half_TN,tn_6144_6747_4096,Gemm_Hipblaslt_TN_9677,0.584514
GemmTunableOp_Half_TN,tn_12288_155_4096,Gemm_Rocblas_621286472,0.0440388
GemmTunableOp_Half_TN,tn_6144_3647_4096,Gemm_Hipblaslt_TN_9570,0.3232
GemmTunableOp_Half_TN,tn_22016_4050_4096,Gemm_Hipblaslt_TN_9841,1.30059
GemmTunableOp_Half_TN,tn_22016_135_4096,Gemm_Hipblaslt_TN_9321,0.0728314
GemmTunableOp_Half_TN,tn_22016_147_4096,Gemm_Hipblaslt_TN_9319,0.0722395
GemmTunableOp_Half_TN,tn_28672_7027_4096,Gemm_Hipblaslt_TN_9892,2.8663
GemmTunableOp_Half_TN,tn_4096_140_4096,Gemm_Rocblas_621294230,0.0220613
GemmTunableOp_Half_TN,tn_4096_6971_4096,Gemm_Hipblaslt_TN_9743,0.39975
GemmTunableOp_Half_TN,tn_6144_1704_4096,Gemm_Hipblaslt_TN_9570,0.154752
GemmTunableOp_Half_TN,tn_4096_2353_11008,Gemm_Hipblaslt_TN_9728,0.377835
GemmTunableOp_Half_TN,tn_28672_7120_4096,Gemm_Hipblaslt_TN_9919,2.89571
GemmTunableOp_Half_TN,tn_4096_152_11008,Gemm_Hipblaslt_TN_7219,0.0467962
GemmTunableOp_Half_TN,tn_6144_3600_4096,Gemm_Rocblas_621286753,0.318674
GemmTunableOp_Half_TN,tn_4096_6708_4096,Gemm_Hipblaslt_TN_9743,0.384007
GemmTunableOp_Half_TN,tn_4096_1742_4096,Gemm_Hipblaslt_TN_9645,0.116972
GemmTunableOp_Half_TN,tn_6144_1858_4096,Gemm_Hipblaslt_TN_9209,0.166914
GemmTunableOp_Half_TN,tn_6144_7067_4096,Gemm_Hipblaslt_TN_9743,0.598653
GemmTunableOp_Half_TN,tn_4096_3475_14336,Gemm_Hipblaslt_TN_9677,0.680998
GemmTunableOp_Half_TN,tn_22016_131_4096,Gemm_Hipblaslt_TN_7216,0.0712772
GemmTunableOp_Half_TN,tn_12288_2193_4096,Gemm_Hipblaslt_TN_9743,0.382275
GemmTunableOp_Half_TN,tn_6144_1765_4096,Gemm_Rocblas_621286705,0.165249
GemmTunableOp_Half_TN,tn_6144_1685_4096,Gemm_Hipblaslt_TN_9570,0.153565
GemmTunableOp_Half_TN,tn_128256_236_4096,Gemm_Rocblas_621286892,0.601546
GemmTunableOp_Half_TN,tn_12288_157_4096,Gemm_Rocblas_621294209,0.0442032
GemmTunableOp_Half_TN,tn_4096_1748_4096,Gemm_Hipblaslt_TN_9645,0.11721
GemmTunableOp_Half_TN,tn_28672_1765_4096,Gemm_Hipblaslt_TN_9223,0.739177
GemmTunableOp_Half_TN,tn_4096_4096_11008,Gemm_Rocblas_621294034,0.596202
GemmTunableOp_Half_TN,tn_4096_6920_14336,Gemm_Hipblaslt_TN_9694,1.41344
GemmTunableOp_Half_TN,tn_12288_134_4096,Gemm_Rocblas_621286472,0.0429224
GemmTunableOp_Half_TN,tn_4096_1796_14336,Gemm_Hipblaslt_TN_9592,0.407193
GemmTunableOp_Half_TN,tn_128256_39_4096,Gemm_Hipblaslt_TN_9451,0.327826
GemmTunableOp_Half_TN,tn_4096_3441_4096,Gemm_Hipblaslt_TN_9814,0.198087
GemmTunableOp_Half_TN,tn_28672_7579_4096,Gemm_Hipblaslt_TN_159,2.96825
GemmTunableOp_Half_TN,tn_4096_2337_11008,Gemm_Hipblaslt_TN_9686,0.377398
GemmTunableOp_Half_TN,tn_128256_176_4096,Gemm_Hipblaslt_TN_9732,0.510295
GemmTunableOp_Half_TN,tn_4096_3388_4096,Gemm_Hipblaslt_TN_9743,0.196419
GemmTunableOp_Half_TN,tn_4096_3748_14336,Gemm_Hipblaslt_TN_9827,0.730037
GemmTunableOp_Half_TN,tn_6144_1666_4096,Gemm_Hipblaslt_TN_9570,0.153891
GemmTunableOp_Half_TN,tn_4096_3420_4096,Gemm_Hipblaslt_TN_9743,0.195835
GemmTunableOp_Half_TN,tn_128256_19_4096,Gemm_Rocblas_621294226,0.309643
GemmTunableOp_Half_TN,tn_4096_3582_14336,Gemm_Hipblaslt_TN_9743,0.686393
GemmTunableOp_Half_TN,tn_6144_1648_4096,Gemm_Hipblaslt_TN_9570,0.153678
GemmTunableOp_Half_TN,tn_28672_1863_4096,Gemm_Hipblaslt_TN_9832,0.802223
GemmTunableOp_Half_TN,tn_32000_158_4096,Gemm_Hipblaslt_TN_9612,0.110392
GemmTunableOp_Half_TN,tn_4096_1596_14336,Gemm_Hipblaslt_TN_9671,0.359893
GemmTunableOp_Half_TN,tn_4096_154_11008,Gemm_Hipblaslt_TN_8260,0.048282
GemmTunableOp_Half_TN,tn_4096_6976_4096,Gemm_Hipblaslt_TN_9743,0.399421
GemmTunableOp_Half_TN,tn_4096_1703_4096,Gemm_Hipblaslt_TN_9265,0.107592
GemmTunableOp_Half_TN,tn_128256_8_4096,Gemm_Rocblas_621294224,0.285919
GemmTunableOp_Half_TN,tn_28672_1827_4096,Gemm_Hipblaslt_TN_9684,0.797957
GemmTunableOp_Half_TN,tn_128256_89_4096,Gemm_Hipblaslt_TN_9057,0.394348
GemmTunableOp_Half_TN,tn_6144_1961_4096,Gemm_Hipblaslt_TN_9793,0.177946
GemmTunableOp_Half_TN,tn_128256_158_4096,Gemm_Hipblaslt_TN_9709,0.480333
GemmTunableOp_Half_TN,tn_128256_233_4096,Gemm_Rocblas_621286892,0.596669
GemmTunableOp_Half_TN,tn_4096_200_14336,Gemm_Hipblaslt_TN_7378,0.0685815
GemmTunableOp_Half_TN,tn_12288_2080_4096,Gemm_Hipblaslt_TN_9677,0.369464
GemmTunableOp_Half_TN,tn_4096_6916_14336,Gemm_Hipblaslt_TN_9694,1.41162
GemmTunableOp_Half_TN,tn_128256_188_4096,Gemm_Hipblaslt_TN_9953,0.516678
GemmTunableOp_Half_TN,tn_128256_46_4096,Gemm_Hipblaslt_TN_9451,0.334471
GemmTunableOp_Half_TN,tn_28672_1815_4096,Gemm_Hipblaslt_TN_9684,0.789828
GemmTunableOp_Half_TN,tn_4096_3912_14336,Gemm_Hipblaslt_TN_9815,0.751708
GemmTunableOp_Half_TN,tn_128256_197_4096,Gemm_Hipblaslt_TN_9847,0.557945
GemmTunableOp_Half_TN,tn_4096_5442_14336,Gemm_Hipblaslt_TN_9657,1.14958
GemmTunableOp_Half_TN,tn_128256_243_4096,Gemm_Rocblas_621294634,0.603176
GemmTunableOp_Half_TN,tn_6144_3475_4096,Gemm_Hipblaslt_TN_9570,0.316439
GemmTunableOp_Half_TN,tn_4096_152_14336,Gemm_Hipblaslt_TN_7219,0.0556537
GemmTunableOp_Half_TN,tn_28672_1670_4096,Gemm_Hipblaslt_TN_9190,0.725201
GemmTunableOp_Half_TN,tn_4096_5089_4096,Gemm_Hipblaslt_TN_9691,0.314332
GemmTunableOp_Half_TN,tn_32000_143_4096,Gemm_Hipblaslt_TN_9564,0.105667
GemmTunableOp_Half_TN,tn_128256_160_4096,Gemm_Hipblaslt_TN_9108,0.472985
GemmTunableOp_Half_TN,tn_4096_5427_4096,Gemm_Rocblas_621294275,0.328566
GemmTunableOp_Half_TN,tn_4096_1889_14336,Gemm_Hipblaslt_TN_9792,0.417747
GemmTunableOp_Half_TN,tn_4096_248_4096,Gemm_Rocblas_621286491,0.0262476
GemmTunableOp_Half_TN,tn_4096_1969_4096,Gemm_Hipblaslt_TN_9645,0.124096
GemmTunableOp_Half_TN,tn_28672_1875_4096,Gemm_Hipblaslt_TN_9684,0.801716
GemmTunableOp_Half_TN,tn_28672_1909_4096,Gemm_Hipblaslt_TN_9832,0.812145
GemmTunableOp_Half_TN,tn_4096_1945_14336,Gemm_Hipblaslt_TN_9645,0.42054
GemmTunableOp_Half_TN,tn_4096_3382_14336,Gemm_Hipblaslt_TN_9187,0.664471
GemmTunableOp_Half_TN,tn_6144_3508_4096,Gemm_Hipblaslt_TN_9570,0.318359
GemmTunableOp_Half_TN,tn_4096_3713_4096,Gemm_Hipblaslt_TN_9768,0.215822
GemmTunableOp_Half_TN,tn_32000_160_4096,Gemm_Hipblaslt_TN_9612,0.106018
GemmTunableOp_Half_TN,tn_4096_130_11008,Gemm_Hipblaslt_TN_7219,0.0442955
GemmTunableOp_Half_TN,tn_4096_5410_14336,Gemm_Hipblaslt_TN_9799,1.13097
GemmTunableOp_Half_TN,tn_4096_5352_14336,Gemm_Hipblaslt_TN_9924,1.12636
GemmTunableOp_Half_TN,tn_4096_7186_14336,Gemm_Hipblaslt_TN_9743,1.44243
GemmTunableOp_Half_TN,tn_6144_7120_4096,Gemm_Hipblaslt_TN_9743,0.600943
GemmTunableOp_Half_TN,tn_4096_1722_4096,Gemm_Hipblaslt_TN_9265,0.107903
GemmTunableOp_Half_TN,tn_28672_96_4096,Gemm_Rocblas_621286719,0.0578304
GemmTunableOp_Half_TN,tn_4096_1850_14336,Gemm_Hipblaslt_TN_9592,0.412227
GemmTunableOp_Half_TN,tn_6144_1909_4096,Gemm_Hipblaslt_TN_9672,0.166575
GemmTunableOp_Half_TN,tn_4096_1883_14336,Gemm_Hipblaslt_TN_9645,0.413133
GemmTunableOp_Half_TN,tn_4096_120_14336,Gemm_Hipblaslt_TN_7160,0.0460711
GemmTunableOp_Half_TN,tn_28672_1780_4096,Gemm_Hipblaslt_TN_9217,0.740945
GemmTunableOp_Half_TN,tn_4096_5219_4096,Gemm_Hipblaslt_TN_9924,0.319798
GemmTunableOp_Half_TN,tn_4096_6744_14336,Gemm_Hipblaslt_TN_9743,1.38376
GemmTunableOp_Half_TN,tn_28672_7021_4096,Gemm_Hipblaslt_TN_9812,2.86764
GemmTunableOp_Half_TN,tn_4096_3497_4096,Gemm_Hipblaslt_TN_9743,0.200048
GemmTunableOp_Half_TN,tn_22016_2064_4096,Gemm_Hipblaslt_TN_9841,0.678842
GemmTunableOp_Half_TN,tn_4096_7301_4096,Gemm_Hipblaslt_TN_9914,0.418559
GemmTunableOp_Half_TN,tn_28672_3507_4096,Gemm_Hipblaslt_TN_9827,1.37466
GemmTunableOp_Half_TN,tn_4096_1673_4096,Gemm_Hipblaslt_TN_9679,0.107286
GemmTunableOp_Half_TN,tn_22016_2255_4096,Gemm_Hipblaslt_TN_9832,0.747543
GemmTunableOp_Half_TN,tn_128256_64_4096,Gemm_Rocblas_621286813,0.355313
GemmTunableOp_Half_TN,tn_4096_6996_14336,Gemm_Hipblaslt_TN_9694,1.42257
GemmTunableOp_Half_TN,tn_4096_5352_4096,Gemm_Hipblaslt_TN_9691,0.326712
GemmTunableOp_Half_TN,tn_4096_5570_4096,Gemm_Rocblas_621286580,0.337073
GemmTunableOp_Half_TN,tn_6144_7170_4096,Gemm_Hipblaslt_TN_9743,0.606869
GemmTunableOp_Half_TN,tn_6144_3511_4096,Gemm_Rocblas_621286753,0.31719
GemmTunableOp_Half_TN,tn_28672_6715_4096,Gemm_Hipblaslt_TN_9958,2.69322
GemmTunableOp_Half_TN,tn_28672_1731_4096,Gemm_Hipblaslt_TN_9223,0.734221
GemmTunableOp_Half_TN,tn_4096_160_4096,Gemm_Rocblas_621286491,0.0224308
GemmTunableOp_Half_TN,tn_4096_1690_4096,Gemm_Hipblaslt_TN_9607,0.109214
GemmTunableOp_Half_TN,tn_6144_1892_4096,Gemm_Rocblas_621286683,0.16796
GemmTunableOp_Half_TN,tn_4096_7104_4096,Gemm_Hipblaslt_TN_9743,0.397805
GemmTunableOp_Half_TN,tn_28672_5390_4096,Gemm_Hipblaslt_TN_9852,2.287
GemmTunableOp_Half_TN,tn_6144_1884_4096,Gemm_Rocblas_621286683,0.168533
GemmTunableOp_Half_TN,tn_4096_1787_14336,Gemm_Hipblaslt_TN_9645,0.396708
GemmTunableOp_Half_TN,tn_4096_6843_14336,Gemm_Hipblaslt_TN_9694,1.39235
GemmTunableOp_Half_TN,tn_6144_6630_4096,Gemm_Hipblaslt_TN_9814,0.575737
GemmTunableOp_Half_TN,tn_4096_2225_11008,Gemm_Hipblaslt_TN_9748,0.361208
GemmTunableOp_Half_TN,tn_4096_6902_14336,Gemm_Hipblaslt_TN_9694,1.40485
GemmTunableOp_Half_TN,tn_4096_3595_14336,Gemm_Hipblaslt_TN_9743,0.697974
GemmTunableOp_Half_TN,tn_4096_3773_14336,Gemm_Hipblaslt_TN_9827,0.733946
GemmTunableOp_Half_TN,tn_28672_1607_4096,Gemm_Rocblas_621294420,0.716323
GemmTunableOp_Half_TN,tn_28672_7170_4096,Gemm_Hipblaslt_TN_159,2.87631
GemmTunableOp_Half_TN,tn_4096_7093_14336,Gemm_Hipblaslt_TN_9694,1.43181
GemmTunableOp_Half_TN,tn_4096_7240_14336,Gemm_Hipblaslt_TN_9743,1.44614
GemmTunableOp_Half_TN,tn_28672_3764_4096,Gemm_Hipblaslt_TN_9827,1.52672
GemmTunableOp_Half_TN,tn_4096_7327_4096,Gemm_Hipblaslt_TN_9914,0.424596
GemmTunableOp_Half_TN,tn_28672_3373_4096,Gemm_Hipblaslt_TN_9827,1.36323
GemmTunableOp_Half_TN,tn_4096_1711_4096,Gemm_Hipblaslt_TN_9587,0.105532
GemmTunableOp_Half_TN,tn_4096_88_14336,Gemm_Hipblaslt_TN_7511,0.0401636
GemmTunableOp_Half_TN,tn_28672_6997_4096,Gemm_Hipblaslt_TN_9898,2.87689
GemmTunableOp_Half_TN,tn_22016_140_4096,Gemm_Hipblaslt_TN_9321,0.0730434
GemmTunableOp_Half_TN,tn_28672_1698_4096,Gemm_Hipblaslt_TN_9223,0.725387
GemmTunableOp_Half_TN,tn_4096_5274_4096,Gemm_Rocblas_621286580,0.321784
GemmTunableOp_Half_TN,tn_4096_5381_14336,Gemm_Hipblaslt_TN_9924,1.13606
GemmTunableOp_Half_TN,tn_4096_7033_14336,Gemm_Hipblaslt_TN_9743,1.41532
GemmTunableOp_Half_TN,tn_28672_6952_4096,Gemm_Hipblaslt_TN_9944,2.85556
GemmTunableOp_Half_TN,tn_6144_6761_4096,Gemm_Hipblaslt_TN_9677,0.583223
GemmTunableOp_Half_TN,tn_4096_1670_4096,Gemm_Hipblaslt_TN_9265,0.10686
GemmTunableOp_Half_TN,tn_6144_1711_4096,Gemm_Hipblaslt_TN_9691,0.156952
GemmTunableOp_Half_TN,tn_28672_7475_4096,Gemm_Hipblaslt_TN_159,2.94247
GemmTunableOp_Half_TN,tn_6144_1794_4096,Gemm_Hipblaslt_TN_9799,0.163813
GemmTunableOp_Half_TN,tn_28672_7077_4096,Gemm_Hipblaslt_TN_9812,2.884
GemmTunableOp_Half_TN,tn_4096_1615_14336,Gemm_Hipblaslt_TN_9610,0.36071
GemmTunableOp_Half_TN,tn_4096_7109_14336,Gemm_Hipblaslt_TN_9743,1.43754
GemmTunableOp_Half_TN,tn_6144_3416_4096,Gemm_Hipblaslt_TN_9774,0.309914
GemmTunableOp_Half_TN,tn_128256_167_4096,Gemm_Hipblaslt_TN_9953,0.50456
GemmTunableOp_Half_TN,tn_4096_7206_14336,Gemm_Hipblaslt_TN_9743,1.45136
GemmTunableOp_Half_TN,tn_6144_3410_4096,Gemm_Hipblaslt_TN_9774,0.309987
GemmTunableOp_Half_TN,tn_6144_1828_4096,Gemm_Hipblaslt_TN_9691,0.164958
GemmTunableOp_Half_TN,tn_6144_3373_4096,Gemm_Hipblaslt_TN_9570,0.30619
GemmTunableOp_Half_TN,tn_4096_1811_4096,Gemm_Hipblaslt_TN_9602,0.120962
GemmTunableOp_Half_TN,tn_4096_7386_14336,Gemm_Hipblaslt_TN_9738,1.54801
GemmTunableOp_Half_TN,tn_6144_6708_4096,Gemm_Hipblaslt_TN_9814,0.581
GemmTunableOp_Half_TN,tn_6144_1811_4096,Gemm_Hipblaslt_TN_9691,0.164615
GemmTunableOp_Half_TN,tn_4096_96_14336,Gemm_Hipblaslt_TN_7511,0.0404252
GemmTunableOp_Half_TN,tn_6144_6841_4096,Gemm_Hipblaslt_TN_9677,0.587863
GemmTunableOp_Half_TN,tn_4096_148_4096,Gemm_Rocblas_621286491,0.0221795
GemmTunableOp_Half_TN,tn_128256_213_4096,Gemm_Hipblaslt_TN_9847,0.566848
GemmTunableOp_Half_TN,tn_128256_249_4096,Gemm_Rocblas_621286892,0.605027
GemmTunableOp_Half_TN,tn_12288_2290_4096,Gemm_Hipblaslt_TN_9697,0.389143
GemmTunableOp_Half_TN,tn_28672_5223_4096,Gemm_Hipblaslt_TN_159,2.14696
GemmTunableOp_Half_TN,tn_4096_7345_14336,Gemm_Hipblaslt_TN_9815,1.54288
GemmTunableOp_Half_TN,tn_28672_88_4096,Gemm_Rocblas_621286719,0.0572898
GemmTunableOp_Half_TN,tn_128256_247_4096,Gemm_Rocblas_621294648,0.605063
GemmTunableOp_Half_TN,tn_4096_1830_4096,Gemm_Hipblaslt_TN_9645,0.120504
GemmTunableOp_Half_TN,tn_4096_1839_14336,Gemm_Hipblaslt_TN_9620,0.414363
GemmTunableOp_Half_TN,tn_128256_164_4096,Gemm_Hipblaslt_TN_9818,0.506625
GemmTunableOp_Half_TN,tn_28672_1637_4096,Gemm_Rocblas_621294420,0.721246
GemmTunableOp_Half_TN,tn_6144_6976_4096,Gemm_Hipblaslt_TN_9677,0.593788
GemmTunableOp_Half_TN,tn_4096_1620_4096,Gemm_Hipblaslt_TN_9671,0.106951
GemmTunableOp_Half_TN,tn_128256_85_4096,Gemm_Hipblaslt_TN_9057,0.389284
GemmTunableOp_Half_TN,tn_6144_1663_4096,Gemm_Rocblas_621286753,0.155669
GemmTunableOp_Half_TN,tn_4096_5052_4096,Gemm_Hipblaslt_TN_9691,0.314754
GemmTunableOp_Half_TN,tn_4096_240_14336,Gemm_Hipblaslt_TN_9303,0.0769419
GemmTunableOp_Half_TN,tn_6144_136_4096,Gemm_Hipblaslt_TN_9472,0.026349
GemmTunableOp_Half_TN,tn_6144_7077_4096,Gemm_Hipblaslt_TN_9743,0.599481
GemmTunableOp_Half_TN,tn_28672_3793_4096,Gemm_Hipblaslt_TN_9919,1.54459
GemmTunableOp_Half_TN,tn_28672_6800_4096,Gemm_Hipblaslt_TN_9899,2.81117
GemmTunableOp_Half_TN,tn_6144_208_4096,Gemm_Hipblaslt_TN_9495,0.0328646
GemmTunableOp_Half_TN,tn_28672_1710_4096,Gemm_Hipblaslt_TN_9223,0.726592
GemmTunableOp_Half_TN,tn_6144_5052_4096,Gemm_Rocblas_621286678,0.435588
GemmTunableOp_Half_TN,tn_6144_6868_4096,Gemm_Hipblaslt_TN_9677,0.588998
GemmTunableOp_Half_TN,tn_4096_7104_14336,Gemm_Hipblaslt_TN_9743,1.42358
GemmTunableOp_Half_TN,tn_4096_6979_4096,Gemm_Hipblaslt_TN_9743,0.399403
GemmTunableOp_Half_TN,tn_6144_3494_4096,Gemm_Hipblaslt_TN_9690,0.317439
GemmTunableOp_Half_TN,tn_4096_3401_14336,Gemm_Hipblaslt_TN_9743,0.669359
GemmTunableOp_Half_TN,tn_4096_7108_4096,Gemm_Hipblaslt_TN_9955,0.404178
GemmTunableOp_Half_TN,tn_4096_3666_4096,Gemm_Hipblaslt_TN_9768,0.21259
GemmTunableOp_Half_TN,tn_4096_5354_14336,Gemm_Hipblaslt_TN_9799,1.136
GemmTunableOp_Half_TN,tn_4096_7170_4096,Gemm_Hipblaslt_TN_9221,0.412847
GemmTunableOp_Half_TN,tn_6144_1787_4096,Gemm_Hipblaslt_TN_9672,0.164311
GemmTunableOp_Half_TN,tn_4096_1792_4096,Gemm_Hipblaslt_TN_9134,0.116537
GemmTunableOp_Half_TN,tn_28672_5089_4096,Gemm_Hipblaslt_TN_9951,2.10273
GemmTunableOp_Half_TN,tn_4096_7403_14336,Gemm_Rocblas_621294585,1.54325
GemmTunableOp_Half_TN,tn_22016_146_4096,Gemm_Hipblaslt_TN_9319,0.0729714
GemmTunableOp_Half_TN,tn_128256_109_4096,Gemm_Hipblaslt_TN_9771,0.419292
GemmTunableOp_Half_TN,tn_4096_256_14336,Gemm_Hipblaslt_TN_9303,0.0739259
GemmTunableOp_Half_TN,tn_28672_1682_4096,Gemm_Hipblaslt_TN_9190,0.725504
GemmTunableOp_Half_TN,tn_28672_1881_4096,Gemm_Hipblaslt_TN_9684,0.798617
GemmTunableOp_Half_TN,tn_4096_5512_4096,Gemm_Hipblaslt_TN_9690,0.330793
GemmTunableOp_Half_TN,tn_4096_1792_14336,Gemm_Hipblaslt_TN_9645,0.39556
GemmTunableOp_Half_TN,tn_28672_1735_4096,Gemm_Hipblaslt_TN_9223,0.733551
GemmTunableOp_Half_TN,tn_4096_1863_14336,Gemm_Hipblaslt_TN_9620,0.412644
GemmTunableOp_Half_TN,tn_4096_24_4096,Gemm_Rocblas_621286330,0.0112324
GemmTunableOp_Half_TN,tn_4096_1646_14336,Gemm_Hipblaslt_TN_9671,0.363676
GemmTunableOp_Half_TN,tn_28672_1908_4096,Gemm_Hipblaslt_TN_9832,0.805527
GemmTunableOp_Half_TN,tn_4096_7253_4096,Gemm_Hipblaslt_TN_9743,0.41059
GemmTunableOp_Half_TN,tn_4096_1936_4096,Gemm_Hipblaslt_TN_9645,0.12419
GemmTunableOp_Half_TN,tn_6144_3780_4096,Gemm_Hipblaslt_TN_9690,0.336213
GemmTunableOp_Half_TN,tn_4096_1894_14336,Gemm_Hipblaslt_TN_9645,0.414421
GemmTunableOp_Half_TN,tn_4096_7021_14336,Gemm_Hipblaslt_TN_9743,1.42926
GemmTunableOp_Half_TN,tn_22016_2063_4096,Gemm_Hipblaslt_TN_9827,0.67329
GemmTunableOp_Half_TN,tn_4096_3416_4096,Gemm_Hipblaslt_TN_9814,0.197162
GemmTunableOp_Half_TN,tn_4096_1872_14336,Gemm_Hipblaslt_TN_9645,0.413812
GemmTunableOp_Half_TN,tn_4096_184_4096,Gemm_Rocblas_621286445,0.0230138
GemmTunableOp_Half_TN,tn_4096_7206_4096,Gemm_Hipblaslt_TN_9743,0.409647
GemmTunableOp_Half_TN,tn_6144_3466_4096,Gemm_Rocblas_621286753,0.315592
GemmTunableOp_Half_TN,tn_28672_136_4096,Gemm_Hipblaslt_TN_9561,0.0871697
GemmTunableOp_Half_TN,tn_4096_1960_4096,Gemm_Hipblaslt_TN_9645,0.124184
GemmTunableOp_Half_TN,tn_4096_1842_4096,Gemm_Hipblaslt_TN_9645,0.120665
GemmTunableOp_Half_TN,tn_4096_5052_14336,Gemm_Hipblaslt_TN_9709,1.06425
GemmTunableOp_Half_TN,tn_4096_1622_4096,Gemm_Hipblaslt_TN_9607,0.106316
GemmTunableOp_Half_TN,tn_4096_6708_14336,Gemm_Hipblaslt_TN_9953,1.38575
GemmTunableOp_Half_TN,tn_12288_5_4096,Gemm_Rocblas_621294052,0.0212722
GemmTunableOp_Half_TN,tn_28672_1789_4096,Gemm_Hipblaslt_TN_9191,0.745753
GemmTunableOp_Half_TN,tn_6144_5267_4096,Gemm_Hipblaslt_TN_9704,0.445529
GemmTunableOp_Half_TN,tn_6144_1896_4096,Gemm_Rocblas_621286580,0.16901
GemmTunableOp_Half_TN,tn_6144_6971_4096,Gemm_Hipblaslt_TN_9677,0.595599
GemmTunableOp_Half_TN,tn_4096_3602_14336,Gemm_Hipblaslt_TN_9814,0.698895
GemmTunableOp_Half_TN,tn_128256_191_4096,Gemm_Hipblaslt_TN_9956,0.516685
GemmTunableOp_Half_TN,tn_28672_32_4096,Gemm_Rocblas_621286818,0.0457579
GemmTunableOp_Half_TN,tn_4096_5285_4096,Gemm_Rocblas_621294320,0.324006
GemmTunableOp_Half_TN,tn_4096_1766_4096,Gemm_Hipblaslt_TN_9645,0.116572
GemmTunableOp_Half_TN,tn_6144_1655_4096,Gemm_Rocblas_621294306,0.155242
GemmTunableOp_Half_TN,tn_28672_1646_4096,Gemm_Hipblaslt_TN_9223,0.720664
GemmTunableOp_Half_TN,tn_6144_1781_4096,Gemm_Hipblaslt_TN_9799,0.163948
GemmTunableOp_Half_TN,tn_4096_7182_4096,Gemm_Hipblaslt_TN_9955,0.40859
GemmTunableOp_Half_TN,tn_4096_5_4096,Gemm_Rocblas_621294136,0.00991239
GemmTunableOp_Half_TN,tn_4096_3379_4096,Gemm_Hipblaslt_TN_9187,0.196158
GemmTunableOp_Half_TN,tn_4096_184_14336,Gemm_Hipblaslt_TN_7586,0.0612655
GemmTunableOp_Half_TN,tn_6144_1739_4096,Gemm_Hipblaslt_TN_9691,0.158771
GemmTunableOp_Half_TN,tn_28672_3345_4096,Gemm_Hipblaslt_TN_9841,1.37398
GemmTunableOp_Half_TN,tn_4096_7096_14336,Gemm_Hipblaslt_TN_9743,1.41586
GemmTunableOp_Half_TN,tn_28672_1879_4096,Gemm_Hipblaslt_TN_9684,0.806648
GemmTunableOp_Half_TN,tn_4096_1684_14336,Gemm_Hipblaslt_TN_9671,0.366915
GemmTunableOp_Half_TN,tn_6144_5470_4096,Gemm_Hipblaslt_TN_9768,0.457289
GemmTunableOp_Half_TN,tn_6144_6920_4096,Gemm_Hipblaslt_TN_9743,0.594599
GemmTunableOp_Half_TN,tn_28672_3588_4096,Gemm_Hipblaslt_TN_9834,1.47439
GemmTunableOp_Half_TN,tn_4096_3722_4096,Gemm_Hipblaslt_TN_9841,0.214958
GemmTunableOp_Half_TN,tn_4096_3520_4096,Gemm_Hipblaslt_TN_9814,0.200602
GemmTunableOp_Half_TN,tn_128256_251_4096,Gemm_Rocblas_621286892,0.610602
GemmTunableOp_Half_TN,tn_28672_3369_4096,Gemm_Hipblaslt_TN_9827,1.35628
GemmTunableOp_Half_TN,tn_4096_5319_4096,Gemm_Rocblas_621294320,0.324139
GemmTunableOp_Half_TN,tn_6144_1890_4096,Gemm_Rocblas_621294425,0.167869
GemmTunableOp_Half_TN,tn_28672_7552_4096,Gemm_Hipblaslt_TN_159,2.98605
GemmTunableOp_Half_TN,tn_4096_32_14336,Gemm_Hipblaslt_TN_9392,0.0274089
GemmTunableOp_Half_TN,tn_6144_5301_4096,Gemm_Hipblaslt_TN_9815,0.444862
GemmTunableOp_Half_TN,tn_4096_3309_4096,Gemm_Hipblaslt_TN_9743,0.193655
GemmTunableOp_Half_TN,tn_128256_211_4096,Gemm_Hipblaslt_TN_9937,0.569328
GemmTunableOp_Half_TN,tn_4096_248_14336,Gemm_Hipblaslt_TN_8879,0.0784176
GemmTunableOp_Half_TN,tn_4096_7552_4096,Gemm_Rocblas_621286281,0.432486
GemmTunableOp_Half_TN,tn_6144_1855_4096,Gemm_Rocblas_621286684,0.166513
GemmTunableOp_Half_TN,tn_4096_7432_4096,Gemm_Hipblaslt_TN_159,0.431254
GemmTunableOp_Half_TN,tn_4096_5068_14336,Gemm_Hipblaslt_TN_9709,1.06461
GemmTunableOp_Half_TN,tn_4096_6715_14336,Gemm_Hipblaslt_TN_9732,1.3763
GemmTunableOp_Half_TN,tn_4096_1599_14336,Gemm_Hipblaslt_TN_9679,0.359522
GemmTunableOp_Half_TN,tn_4096_1867_14336,Gemm_Hipblaslt_TN_9620,0.412322
GemmTunableOp_Half_TN,tn_4096_7475_4096,Gemm_Hipblaslt_TN_9933,0.434384
GemmTunableOp_Half_TN,tn_4096_5465_4096,Gemm_Rocblas_621286580,0.334228
GemmTunableOp_Half_TN,tn_6144_1874_4096,Gemm_Rocblas_621294425,0.1671
GemmTunableOp_Half_TN,tn_4096_1871_4096,Gemm_Hipblaslt_TN_9645,0.120981
GemmTunableOp_Half_TN,tn_4096_1957_4096,Gemm_Hipblaslt_TN_9645,0.125404
GemmTunableOp_Half_TN,tn_4096_1628_4096,Gemm_Hipblaslt_TN_9679,0.107752
GemmTunableOp_Half_TN,tn_4096_3514_4096,Gemm_Hipblaslt_TN_9743,0.200573
GemmTunableOp_Half_TN,tn_28672_1958_4096,Gemm_Hipblaslt_TN_9846,0.836824
GemmTunableOp_Half_TN,tn_6144_1725_4096,Gemm_Hipblaslt_TN_9570,0.156275
GemmTunableOp_Half_TN,tn_4096_6990_4096,Gemm_Hipblaslt_TN_9743,0.403312
GemmTunableOp_Half_TN,tn_4096_1605_14336,Gemm_Hipblaslt_TN_9679,0.35854
GemmTunableOp_Half_TN,tn_6144_6881_4096,Gemm_Hipblaslt_TN_9743,0.584735
GemmTunableOp_Half_TN,tn_4096_5495_14336,Gemm_Hipblaslt_TN_9799,1.16296
GemmTunableOp_Half_TN,tn_6144_1966_4096,Gemm_Hipblaslt_TN_9677,0.178917
GemmTunableOp_Half_TN,tn_4096_1652_4096,Gemm_Hipblaslt_TN_9265,0.106314
GemmTunableOp_Half_TN,tn_4096_1786_4096,Gemm_Hipblaslt_TN_9267,0.117422
GemmTunableOp_Half_TN,tn_28672_5570_4096,Gemm_Hipblaslt_TN_9924,2.3244
GemmTunableOp_Half_TN,tn_4096_6871_14336,Gemm_Hipblaslt_TN_9743,1.39263
GemmTunableOp_Half_TN,tn_4096_3666_14336,Gemm_Hipblaslt_TN_9827,0.723388
GemmTunableOp_Half_TN,tn_28672_7139_4096,Gemm_Hipblaslt_TN_9892,2.89457
GemmTunableOp_Half_TN,tn_4096_3602_4096,Gemm_Hipblaslt_TN_9221,0.203023
GemmTunableOp_Half_TN,tn_4096_2385_11008,Gemm_Hipblaslt_TN_9698,0.377832
GemmTunableOp_Half_TN,tn_28672_1599_4096,Gemm_Hipblaslt_TN_9674,0.708618
GemmTunableOp_Half_TN,tn_6144_1894_4096,Gemm_Hipblaslt_TN_9672,0.168225
GemmTunableOp_Half_TN,tn_28672_1743_4096,Gemm_Hipblaslt_TN_9223,0.729147
GemmTunableOp_Half_TN,tn_12288_135_4096,Gemm_Hipblaslt_TN_9154,0.041769
GemmTunableOp_Half_TN,tn_4096_3588_4096,Gemm_Hipblaslt_TN_9743,0.20066
GemmTunableOp_Half_TN,tn_128256_25_4096,Gemm_Rocblas_621294578,0.311005
GemmTunableOp_Half_TN,tn_28672_3592_4096,Gemm_Hipblaslt_TN_9832,1.46378
GemmTunableOp_Half_TN,tn_4096_1794_4096,Gemm_Hipblaslt_TN_9645,0.11871
GemmTunableOp_Half_TN,tn_4096_5030_4096,Gemm_Hipblaslt_TN_9690,0.314009
GemmTunableOp_Half_TN,tn_4096_3586_14336,Gemm_Hipblaslt_TN_9743,0.695565
GemmTunableOp_Half_TN,tn_4096_5271_14336,Gemm_Hipblaslt_TN_9799,1.09961
GemmTunableOp_Half_TN,tn_4096_145_4096,Gemm_Rocblas_621286440,0.0219787
GemmTunableOp_Half_TN,tn_4096_168_14336,Gemm_Hipblaslt_TN_7586,0.0605913
GemmTunableOp_Half_TN,tn_4096_1717_14336,Gemm_Hipblaslt_TN_9671,0.368371
GemmTunableOp_Half_TN,tn_6144_1898_4096,Gemm_Hipblaslt_TN_9672,0.167882
GemmTunableOp_Half_TN,tn_4096_32_4096,Gemm_Rocblas_621286273,0.0117091
GemmTunableOp_Half_TN,tn_4096_1784_4096,Gemm_Hipblaslt_TN_9645,0.117455
GemmTunableOp_Half_TN,tn_6144_3535_4096,Gemm_Hipblaslt_TN_9570,0.315376
GemmTunableOp_Half_TN,tn_28672_1802_4096,Gemm_Hipblaslt_TN_9684,0.792824
GemmTunableOp_Half_TN,tn_6144_1763_4096,Gemm_Rocblas_621286684,0.163955
GemmTunableOp_Half_TN,tn_6144_6871_4096,Gemm_Hipblaslt_TN_9743,0.583389
GemmTunableOp_Half_TN,tn_128256_63_4096,Gemm_Rocblas_621286816,0.360223
GemmTunableOp_Half_TN,tn_4096_3855_4096,Gemm_Hipblaslt_TN_9841,0.222288
GemmTunableOp_Half_TN,tn_4096_3764_4096,Gemm_Hipblaslt_TN_9768,0.214544
GemmTunableOp_Half_TN,tn_28672_40_4096,Gemm_Hipblaslt_TN_9532,0.0481763
GemmTunableOp_Half_TN,tn_6144_1830_4096,Gemm_Rocblas_621286684,0.164891
GemmTunableOp_Half_TN,tn_28672_5273_4096,Gemm_Hipblaslt_TN_9890,2.16055
GemmTunableOp_Half_TN,tn_4096_1936_14336,Gemm_Hipblaslt_TN_9645,0.42144
GemmTunableOp_Half_TN,tn_28672_1703_4096,Gemm_Hipblaslt_TN_9217,0.731871
GemmTunableOp_Half_TN,tn_4096_3478_14336,Gemm_Hipblaslt_TN_9192,0.686907
GemmTunableOp_Half_TN,tn_6144_1573_4096,Gemm_Rocblas_621286565,0.146707
GemmTunableOp_Half_TN,tn_6144_3640_4096,Gemm_Hipblaslt_TN_9570,0.321069
GemmTunableOp_Half_TN,tn_4096_5125_4096,Gemm_Rocblas_621294320,0.319961
GemmTunableOp_Half_TN,tn_6144_1822_4096,Gemm_Hipblaslt_TN_9691,0.165243
GemmTunableOp_Half_TN,tn_4096_3526_4096,Gemm_Hipblaslt_TN_9743,0.199603
GemmTunableOp_Half_TN,tn_28672_6789_4096,Gemm_Hipblaslt_TN_9899,2.80983
GemmTunableOp_Half_TN,tn_28672_1871_4096,Gemm_Hipblaslt_TN_9832,0.803575
GemmTunableOp_Half_TN,tn_4096_3547_14336,Gemm_Hipblaslt_TN_9743,0.688451
GemmTunableOp_Half_TN,tn_4096_1855_14336,Gemm_Hipblaslt_TN_9645,0.411906
GemmTunableOp_Half_TN,tn_28672_1647_4096,Gemm_Hipblaslt_TN_9190,0.721393
GemmTunableOp_Half_TN,tn_28672_1685_4096,Gemm_Hipblaslt_TN_9190,0.730195
GemmTunableOp_Half_TN,tn_4096_5412_14336,Gemm_Hipblaslt_TN_9709,1.13679
GemmTunableOp_Half_TN,tn_6144_1766_4096,Gemm_Hipblaslt_TN_9799,0.163937
GemmTunableOp_Half_TN,tn_4096_1642_4096,Gemm_Hipblaslt_TN_9671,0.105407
GemmStridedBatchedTunableOp_Half_TN,tn_1666_1666_128_B_32,Gemm_Rocblas_621286397,0.116557
GemmStridedBatchedTunableOp_Half_TN,tn_1686_1686_128_B_32,Gemm_Rocblas_621286413,0.119608
GemmStridedBatchedTunableOp_Half_TN,tn_1959_1959_128_B_32,Gemm_Rocblas_621286397,0.157412
GemmStridedBatchedTunableOp_Half_TN,tn_1695_1695_128_B_32,Gemm_Hipblaslt_TN_6942,0.120983
GemmStridedBatchedTunableOp_Half_TN,tn_1882_1882_128_B_32,Gemm_Hipblaslt_TN_6942,0.147105
GemmStridedBatchedTunableOp_Half_TN,tn_1715_1715_128_B_32,Gemm_Rocblas_621294106,0.12397
GemmStridedBatchedTunableOp_Half_TN,tn_1878_1878_128_B_32,Gemm_Hipblaslt_TN_6942,0.14502
GemmStridedBatchedTunableOp_Half_TN,tn_1961_1961_128_B_32,Gemm_Hipblaslt_TN_6879,0.159149
GemmStridedBatchedTunableOp_Half_TN,tn_1745_1745_128_B_32,Gemm_Rocblas_621294106,0.127793
GemmStridedBatchedTunableOp_Half_TN,tn_1759_1759_128_B_32,Gemm_Rocblas_621286397,0.128663
GemmStridedBatchedTunableOp_Half_TN,tn_1872_1872_128_B_32,Gemm_Hipblaslt_TN_153,0.132778
GemmStridedBatchedTunableOp_Half_TN,tn_1859_1859_128_B_32,Gemm_Hipblaslt_TN_6942,0.145013
GemmStridedBatchedTunableOp_Half_TN,tn_1978_1978_128_B_32,Gemm_Rocblas_621286397,0.160657
GemmStridedBatchedTunableOp_Half_TN,tn_1945_1945_128_B_32,Gemm_Rocblas_621294533,0.156407
GemmStridedBatchedTunableOp_Half_TN,tn_1736_1736_128_B_32,Gemm_Rocblas_621286397,0.121632
GemmStridedBatchedTunableOp_Half_TN,tn_1931_1931_128_B_32,Gemm_Rocblas_621286397,0.155108
GemmStridedBatchedTunableOp_Half_TN,tn_1612_1612_128_B_32,Gemm_Rocblas_621286397,0.110391
GemmStridedBatchedTunableOp_Half_TN,tn_1735_1735_128_B_32,Gemm_Rocblas_621286397,0.126667
GemmStridedBatchedTunableOp_Half_TN,tn_1811_1811_128_B_32,Gemm_Hipblaslt_TN_6942,0.138155
GemmStridedBatchedTunableOp_Half_TN,tn_1798_1798_128_B_32,Gemm_Hipblaslt_TN_6942,0.137598
GemmStridedBatchedTunableOp_Half_TN,tn_1663_1663_128_B_32,Gemm_Rocblas_621286397,0.118164
GemmStridedBatchedTunableOp_Half_TN,tn_1654_1654_128_B_32,Gemm_Rocblas_621286397,0.116117
GemmStridedBatchedTunableOp_Half_TN,tn_1699_1699_128_B_32,Gemm_Rocblas_621286397,0.121496
GemmStridedBatchedTunableOp_Half_TN,tn_1911_1911_128_B_32,Gemm_Rocblas_621286397,0.150288
GemmStridedBatchedTunableOp_Half_TN,tn_1813_1813_128_B_32,Gemm_Hipblaslt_TN_6942,0.139157
GemmStridedBatchedTunableOp_Half_TN,tn_1851_1851_128_B_32,Gemm_Hipblaslt_TN_6942,0.142882
GemmStridedBatchedTunableOp_Half_TN,tn_1873_1873_128_B_32,Gemm_Hipblaslt_TN_6942,0.146298
GemmStridedBatchedTunableOp_Half_TN,tn_1608_1608_128_B_32,Gemm_Rocblas_621286397,0.109374
GemmStridedBatchedTunableOp_Half_TN,tn_2241_2241_128_B_32,Gemm_Rocblas_621294106,0.205756
GemmStridedBatchedTunableOp_Half_TN,tn_1863_1863_128_B_32,Gemm_Hipblaslt_TN_6942,0.146478
GemmStridedBatchedTunableOp_Half_TN,tn_1664_1664_128_B_32,Gemm_Rocblas_621286397,0.104509
GemmStridedBatchedTunableOp_Half_TN,tn_1588_1588_128_B_32,Gemm_Rocblas_621286397,0.109783
GemmStridedBatchedTunableOp_Half_TN,tn_1593_1593_128_B_32,Gemm_Hipblaslt_TN_6942,0.109068
GemmStridedBatchedTunableOp_Half_TN,tn_2064_2064_128_B_32,Gemm_Rocblas_621294106,0.162397
GemmStridedBatchedTunableOp_Half_TN,tn_1718_1718_128_B_32,Gemm_Rocblas_621286397,0.121532
GemmStridedBatchedTunableOp_Half_TN,tn_1832_1832_128_B_32,Gemm_Hipblaslt_TN_157,0.132221
GemmStridedBatchedTunableOp_Half_TN,tn_1777_1777_128_B_32,Gemm_Rocblas_621286397,0.131647
GemmStridedBatchedTunableOp_Half_TN,tn_2353_2353_128_B_32,Gemm_Rocblas_621294106,0.234105
GemmStridedBatchedTunableOp_Half_TN,tn_1884_1884_128_B_32,Gemm_Hipblaslt_TN_6942,0.144022
GemmStridedBatchedTunableOp_Half_TN,tn_1724_1724_128_B_32,Gemm_Rocblas_621286397,0.122193
GemmStridedBatchedTunableOp_Half_TN,tn_1681_1681_128_B_32,Gemm_Rocblas_621286397,0.121391
GemmStridedBatchedTunableOp_Half_TN,tn_1930_1930_128_B_32,Gemm_Rocblas_621294533,0.152228
GemmStridedBatchedTunableOp_Half_TN,tn_1934_1934_128_B_32,Gemm_Rocblas_621294533,0.153423
GemmStridedBatchedTunableOp_Half_TN,tn_1923_1923_128_B_32,Gemm_Hipblaslt_TN_6879,0.153113
GemmStridedBatchedTunableOp_Half_TN,tn_1626_1626_128_B_32,Gemm_Rocblas_621286397,0.114104
GemmStridedBatchedTunableOp_Half_TN,tn_2145_2145_128_B_32,Gemm_Rocblas_621294106,0.186998
GemmStridedBatchedTunableOp_Half_TN,tn_1707_1707_128_B_32,Gemm_Rocblas_621286413,0.122508
GemmStridedBatchedTunableOp_Half_TN,tn_2255_2255_128_B_32,Gemm_Rocblas_621294106,0.209098
GemmStridedBatchedTunableOp_Half_TN,tn_2303_2303_128_B_32,Gemm_Rocblas_621294106,0.222096
GemmStridedBatchedTunableOp_Half_TN,tn_1955_1955_128_B_32,Gemm_Rocblas_621294533,0.158953
GemmStridedBatchedTunableOp_Half_TN,tn_1830_1830_128_B_32,Gemm_Rocblas_621286397,0.142243
GemmStridedBatchedTunableOp_Half_TN,tn_1684_1684_128_B_32,Gemm_Rocblas_621286397,0.116094
GemmStridedBatchedTunableOp_Half_TN,tn_1702_1702_128_B_32,Gemm_Hipblaslt_TN_6942,0.120106
GemmStridedBatchedTunableOp_Half_TN,tn_1880_1880_128_B_32,Gemm_Hipblaslt_TN_157,0.133631
GemmStridedBatchedTunableOp_Half_TN,tn_16_16_128_B_32,Gemm_Rocblas_621286302,0.00617402
GemmStridedBatchedTunableOp_Half_TN,tn_1936_1936_128_B_32,Gemm_Hipblaslt_TN_153,0.145295
GemmStridedBatchedTunableOp_Half_TN,tn_1748_1748_128_B_32,Gemm_Rocblas_621286397,0.125188
GemmStridedBatchedTunableOp_Half_TN,tn_2321_2321_128_B_32,Gemm_Rocblas_621294106,0.232316
GemmStridedBatchedTunableOp_Half_TN,tn_1604_1604_128_B_32,Gemm_Rocblas_621286397,0.107669
GemmStridedBatchedTunableOp_Half_TN,tn_1839_1839_128_B_32,Gemm_Rocblas_621286397,0.14355
GemmStridedBatchedTunableOp_Half_TN,tn_1812_1812_128_B_32,Gemm_Hipblaslt_TN_6942,0.139609
GemmStridedBatchedTunableOp_Half_TN,tn_1861_1861_128_B_32,Gemm_Rocblas_621294109,0.146729
GemmStridedBatchedTunableOp_Half_TN,tn_1816_1816_128_B_32,Gemm_Hipblaslt_TN_157,0.130817
GemmStridedBatchedTunableOp_Half_TN,tn_2065_2065_128_B_32,Gemm_Rocblas_621294106,0.175777
GemmStridedBatchedTunableOp_Half_TN,tn_2209_2209_128_B_32,Gemm_Rocblas_621294106,0.199314
GemmStridedBatchedTunableOp_Half_TN,tn_2258_2258_128_B_32,Gemm_Rocblas_621294106,0.204261
GemmStridedBatchedTunableOp_Half_TN,tn_1825_1825_128_B_32,Gemm_Hipblaslt_TN_6895,0.141544
GemmStridedBatchedTunableOp_Half_TN,tn_1963_1963_128_B_32,Gemm_Rocblas_621286397,0.157226
GemmStridedBatchedTunableOp_Half_TN,tn_1776_1776_128_B_32,Gemm_Rocblas_621286397,0.118423
GemmStridedBatchedTunableOp_Half_TN,tn_1591_1591_128_B_32,Gemm_Hipblaslt_TN_6939,0.110117
GemmStridedBatchedTunableOp_Half_TN,tn_1651_1651_128_B_32,Gemm_Rocblas_621286397,0.117953
GemmStridedBatchedTunableOp_Half_TN,tn_1616_1616_128_B_32,Gemm_Rocblas_621286397,0.105709
GemmStridedBatchedTunableOp_Half_TN,tn_1786_1786_128_B_32,Gemm_Rocblas_621294106,0.132266
GemmStridedBatchedTunableOp_Half_TN,tn_1676_1676_128_B_32,Gemm_Rocblas_621286397,0.115933
GemmStridedBatchedTunableOp_Half_TN,tn_1754_1754_128_B_32,Gemm_Rocblas_621286397,0.126064
GemmStridedBatchedTunableOp_Half_TN,tn_1967_1967_128_B_32,Gemm_Rocblas_621294533,0.159725
GemmStridedBatchedTunableOp_Half_TN,tn_1778_1778_128_B_32,Gemm_Rocblas_621294106,0.131661
GemmStridedBatchedTunableOp_Half_TN,tn_1940_1940_128_B_32,Gemm_Rocblas_621294533,0.154902
GemmStridedBatchedTunableOp_Half_TN,tn_1674_1674_128_B_32,Gemm_Rocblas_621294110,0.118007
GemmStridedBatchedTunableOp_Half_TN,tn_1886_1886_128_B_32,Gemm_Rocblas_621286397,0.145495
GemmStridedBatchedTunableOp_Half_TN,tn_1801_1801_128_B_32,Gemm_Hipblaslt_TN_6942,0.140231
GemmStridedBatchedTunableOp_Half_TN,tn_1852_1852_128_B_32,Gemm_Hipblaslt_TN_6942,0.141669
GemmStridedBatchedTunableOp_Half_TN,tn_1722_1722_128_B_32,Gemm_Rocblas_621294110,0.122801
GemmStridedBatchedTunableOp_Half_TN,tn_1809_1809_128_B_32,Gemm_Hipblaslt_TN_6942,0.137799
GemmStridedBatchedTunableOp_Half_TN,tn_1868_1868_128_B_32,Gemm_Rocblas_621286397,0.14363
GemmStridedBatchedTunableOp_Half_TN,tn_1675_1675_128_B_32,Gemm_Hipblaslt_TN_6942,0.119205
GemmStridedBatchedTunableOp_Half_TN,tn_1719_1719_128_B_32,Gemm_Rocblas_621286397,0.123511
GemmStridedBatchedTunableOp_Half_TN,tn_1818_1818_128_B_32,Gemm_Hipblaslt_TN_6942,0.138032
GemmStridedBatchedTunableOp_Half_TN,tn_1836_1836_128_B_32,Gemm_Hipblaslt_TN_6942,0.138705
GemmStridedBatchedTunableOp_Half_TN,tn_1917_1917_128_B_32,Gemm_Hipblaslt_TN_6942,0.149281
GemmStridedBatchedTunableOp_Half_TN,tn_1810_1810_128_B_32,Gemm_Hipblaslt_TN_6942,0.138932
GemmStridedBatchedTunableOp_Half_TN,tn_1941_1941_128_B_32,Gemm_Rocblas_621294533,0.15644
GemmStridedBatchedTunableOp_Half_TN,tn_1639_1639_128_B_32,Gemm_Hipblaslt_TN_6942,0.115531
GemmStridedBatchedTunableOp_Half_TN,tn_1597_1597_128_B_32,Gemm_Rocblas_621286397,0.111596
GemmStridedBatchedTunableOp_Half_TN,tn_1669_1669_128_B_32,Gemm_Hipblaslt_TN_6942,0.11955
GemmStridedBatchedTunableOp_Half_TN,tn_1933_1933_128_B_32,Gemm_Rocblas_621294533,0.154122
GemmStridedBatchedTunableOp_Half_TN,tn_1630_1630_128_B_32,Gemm_Hipblaslt_TN_6942,0.113198
GemmStridedBatchedTunableOp_Half_TN,tn_1685_1685_128_B_32,Gemm_Rocblas_621286397,0.120598
GemmStridedBatchedTunableOp_Half_TN,tn_1705_1705_128_B_32,Gemm_Rocblas_621294110,0.121871
GemmStridedBatchedTunableOp_Half_TN,tn_1734_1734_128_B_32,Gemm_Rocblas_621286397,0.124211
GemmStridedBatchedTunableOp_Half_TN,tn_1739_1739_128_B_32,Gemm_Rocblas_621286397,0.126718
GemmStridedBatchedTunableOp_Half_TN,tn_1744_1744_128_B_32,Gemm_Rocblas_621286397,0.117064
GemmStridedBatchedTunableOp_Half_TN,tn_1760_1760_128_B_32,Gemm_Rocblas_621294110,0.11414
GemmStridedBatchedTunableOp_Half_TN,tn_1881_1881_128_B_32,Gemm_Rocblas_621286412,0.1475
GemmStridedBatchedTunableOp_Half_TN,tn_1806_1806_128_B_32,Gemm_Hipblaslt_TN_6942,0.137301
GemmTunableOp_Half_TN,tn_4096_1731_14336,Gemm_Hipblaslt_TN_9645,0.39052
GemmTunableOp_Half_TN,tn_6144_1799_4096,Gemm_Hipblaslt_TN_9691,0.163587
GemmTunableOp_Half_TN,tn_6144_1608_4096,Gemm_Rocblas_621286753,0.151504
GemmTunableOp_Half_TN,tn_6144_16_4096,Gemm_Rocblas_621286273,0.0129429
GemmTunableOp_Half_TN,tn_6144_1958_4096,Gemm_Hipblaslt_TN_9187,0.177747
GemmTunableOp_Half_TN,tn_128256_218_4096,Gemm_Hipblaslt_TN_9937,0.566326
GemmTunableOp_Half_TN,tn_28672_3309_4096,Gemm_Hipblaslt_TN_9827,1.35514
GemmTunableOp_Half_TN,tn_6144_1683_4096,Gemm_Rocblas_621286753,0.153849
GemmTunableOp_Half_TN,tn_28672_3688_4096,Gemm_Hipblaslt_TN_9827,1.50374
GemmTunableOp_Half_TN,tn_6144_1853_4096,Gemm_Hipblaslt_TN_9672,0.164854
GemmTunableOp_Half_TN,tn_4096_1967_4096,Gemm_Hipblaslt_TN_9680,0.122241
GemmTunableOp_Half_TN,tn_28672_232_4096,Gemm_Rocblas_621294324,0.12052
GemmTunableOp_Half_TN,tn_28672_7182_4096,Gemm_Hipblaslt_TN_159,2.85337
GemmTunableOp_Half_TN,tn_4096_5357_14336,Gemm_Hipblaslt_TN_9799,1.11085
GemmTunableOp_Half_TN,tn_4096_1748_14336,Gemm_Hipblaslt_TN_9645,0.391928
GemmTunableOp_Half_TN,tn_28672_7439_4096,Gemm_Hipblaslt_TN_159,2.92461
GemmTunableOp_Half_TN,tn_6144_5605_4096,Gemm_Rocblas_621294426,0.496851
GemmTunableOp_Half_TN,tn_6144_1801_4096,Gemm_Hipblaslt_TN_9672,0.162328
GemmTunableOp_Half_TN,tn_4096_3401_4096,Gemm_Hipblaslt_TN_9697,0.19533
GemmTunableOp_Half_TN,tn_28672_1888_4096,Gemm_Hipblaslt_TN_9684,0.794032
GemmTunableOp_Half_TN,tn_4096_1888_4096,Gemm_Hipblaslt_TN_9134,0.122726
GemmTunableOp_Half_TN,tn_28672_1810_4096,Gemm_Hipblaslt_TN_9684,0.784474
GemmTunableOp_Half_TN,tn_28672_5447_4096,Gemm_Hipblaslt_TN_9865,2.29181
GemmTunableOp_Half_TN,tn_128256_215_4096,Gemm_Hipblaslt_TN_9937,0.563177
GemmTunableOp_Half_TN,tn_28672_5125_4096,Gemm_Hipblaslt_TN_9191,2.16218
GemmTunableOp_Half_TN,tn_28672_3466_4096,Gemm_Hipblaslt_TN_9827,1.36002
GemmTunableOp_Half_TN,tn_6144_3645_4096,Gemm_Rocblas_621286753,0.316516
GemmTunableOp_Half_TN,tn_4096_1685_14336,Gemm_Hipblaslt_TN_9790,0.363284
GemmTunableOp_Half_TN,tn_28672_1946_4096,Gemm_Hipblaslt_TN_9846,0.832635
GemmTunableOp_Half_TN,tn_6144_1628_4096,Gemm_Hipblaslt_TN_9570,0.152024
GemmTunableOp_Half_TN,tn_6144_1804_4096,Gemm_Hipblaslt_TN_9691,0.163045
GemmTunableOp_Half_TN,tn_4096_1887_4096,Gemm_Hipblaslt_TN_9645,0.12085
GemmTunableOp_Half_TN,tn_4096_1823_4096,Gemm_Hipblaslt_TN_9645,0.118456
GemmTunableOp_Half_TN,tn_4096_1637_4096,Gemm_Hipblaslt_TN_9616,0.104983
GemmTunableOp_Half_TN,tn_6144_1637_4096,Gemm_Hipblaslt_TN_9570,0.148961
GemmTunableOp_Half_TN,tn_28672_1713_4096,Gemm_Hipblaslt_TN_9223,0.72531
GemmTunableOp_Half_TN,tn_4096_1767_4096,Gemm_Hipblaslt_TN_9134,0.115266
GemmTunableOp_Half_TN,tn_4096_5204_14336,Gemm_Hipblaslt_TN_9799,1.07727
GemmTunableOp_Half_TN,tn_4096_1682_4096,Gemm_Hipblaslt_TN_9679,0.106027
GemmTunableOp_Half_TN,tn_4096_6965_14336,Gemm_Hipblaslt_TN_9743,1.40058
GemmTunableOp_Half_TN,tn_6144_3507_4096,Gemm_Rocblas_621286566,0.312884
GemmTunableOp_Half_TN,tn_4096_146_11008,Gemm_Hipblaslt_TN_7219,0.0463665
GemmTunableOp_Half_TN,tn_4096_7171_4096,Gemm_Hipblaslt_TN_9221,0.404927
GemmTunableOp_Half_TN,tn_6144_3791_4096,Gemm_Rocblas_621286684,0.332776
GemmTunableOp_Half_TN,tn_128256_49_4096,Gemm_Hipblaslt_TN_9097,0.346769
GemmTunableOp_Half_TN,tn_28672_1691_4096,Gemm_Hipblaslt_TN_9220,0.722844
GemmTunableOp_Half_TN,tn_4096_1596_4096,Gemm_Hipblaslt_TN_9180,0.104256
GemmTunableOp_Half_TN,tn_4096_1769_4096,Gemm_Hipblaslt_TN_9136,0.115802
GemmTunableOp_Half_TN,tn_4096_1847_4096,Gemm_Hipblaslt_TN_9134,0.120636
GemmTunableOp_Half_TN,tn_4096_1981_4096,Gemm_Hipblaslt_TN_9645,0.124076
GemmTunableOp_Half_TN,tn_128256_80_4096,Gemm_Hipblaslt_TN_9057,0.380603
GemmTunableOp_Half_TN,tn_6144_5680_4096,Gemm_Rocblas_621286575,0.5011
GemmTunableOp_Half_TN,tn_4096_1898_14336,Gemm_Hipblaslt_TN_9645,0.412766
GemmTunableOp_Half_TN,tn_6144_1770_4096,Gemm_Hipblaslt_TN_9672,0.163569
GemmTunableOp_Half_TN,tn_28672_5735_4096,Gemm_Hipblaslt_TN_9827,2.40123
GemmTunableOp_Half_TN,tn_4096_5239_14336,Gemm_Hipblaslt_TN_9799,1.08405
GemmTunableOp_Half_TN,tn_4096_1603_14336,Gemm_Hipblaslt_TN_9679,0.357807
GemmTunableOp_Half_TN,tn_128256_104_4096,Gemm_Hipblaslt_TN_9669,0.415782
GemmTunableOp_Half_TN,tn_28672_1924_4096,Gemm_Hipblaslt_TN_9846,0.83223
GemmTunableOp_Half_TN,tn_6144_1625_4096,Gemm_Hipblaslt_TN_9570,0.152058
GemmTunableOp_Half_TN,tn_4096_3219_14336,Gemm_Hipblaslt_TN_9187,0.638222
GemmTunableOp_Half_TN,tn_6144_1850_4096,Gemm_Hipblaslt_TN_9690,0.165064
GemmTunableOp_Half_TN,tn_4096_1930_4096,Gemm_Hipblaslt_TN_9645,0.12252
GemmTunableOp_Half_TN,tn_6144_7072_4096,Gemm_Hipblaslt_TN_9187,0.593496
GemmTunableOp_Half_TN,tn_4096_3456_14336,Gemm_Hipblaslt_TN_9187,0.665398
GemmTunableOp_Half_TN,tn_4096_1875_4096,Gemm_Hipblaslt_TN_9620,0.122103
GemmTunableOp_Half_TN,tn_28672_3629_4096,Gemm_Hipblaslt_TN_9832,1.46928
GemmTunableOp_Half_TN,tn_4096_1909_14336,Gemm_Hipblaslt_TN_9645,0.413865
GemmTunableOp_Half_TN,tn_4096_2369_4096,Gemm_Hipblaslt_TN_9698,0.140539
GemmTunableOp_Half_TN,tn_6144_1869_4096,Gemm_Hipblaslt_TN_9691,0.166137
GemmTunableOp_Half_TN,tn_4096_4050_4096,Gemm_Hipblaslt_TN_9191,0.226929
GemmTunableOp_Half_TN,tn_128256_93_4096,Gemm_Hipblaslt_TN_9605,0.394207
GemmTunableOp_Half_TN,tn_28672_1862_4096,Gemm_Hipblaslt_TN_9684,0.791793
GemmTunableOp_Half_TN,tn_28672_1840_4096,Gemm_Hipblaslt_TN_9684,0.785255
GemmTunableOp_Half_TN,tn_6144_1706_4096,Gemm_Hipblaslt_TN_9570,0.152134
GemmTunableOp_Half_TN,tn_28672_3597_4096,Gemm_Hipblaslt_TN_9832,1.45817
GemmTunableOp_Half_TN,tn_6144_1772_4096,Gemm_Hipblaslt_TN_9799,0.161253
GemmTunableOp_Half_TN,tn_4096_1802_14336,Gemm_Hipblaslt_TN_9137,0.4042
GemmTunableOp_Half_TN,tn_4096_2465_11008,Gemm_Hipblaslt_TN_9681,0.390969
GemmTunableOp_Half_TN,tn_12288_2465_4096,Gemm_Hipblaslt_TN_9222,0.424368
GemmTunableOp_Half_TN,tn_6144_1668_4096,Gemm_Rocblas_621286753,0.153873
GemmTunableOp_Half_TN,tn_28672_1967_4096,Gemm_Hipblaslt_TN_9846,0.836978
GemmTunableOp_Half_TN,tn_4096_3300_14336,Gemm_Hipblaslt_TN_9743,0.653262
GemmTunableOp_Half_TN,tn_6144_192_4096,Gemm_Rocblas_621286440,0.0282322
GemmTunableOp_Half_TN,tn_4096_3511_14336,Gemm_Hipblaslt_TN_9139,0.684879
GemmTunableOp_Half_TN,tn_6144_5447_4096,Gemm_Rocblas_621286693,0.450288
GemmTunableOp_Half_TN,tn_6144_3219_4096,Gemm_Rocblas_621294306,0.293932
GemmTunableOp_Half_TN,tn_4096_1855_4096,Gemm_Hipblaslt_TN_9134,0.120194
GemmTunableOp_Half_TN,tn_4096_1749_14336,Gemm_Hipblaslt_TN_9645,0.393382
GemmTunableOp_Half_TN,tn_4096_138_11008,Gemm_Hipblaslt_TN_7219,0.0454972
GemmTunableOp_Half_TN,tn_6144_5271_4096,Gemm_Hipblaslt_TN_9223,0.43646
GemmTunableOp_Half_TN,tn_6144_56_4096,Gemm_Rocblas_621286428,0.0156149
GemmTunableOp_Half_TN,tn_128256_175_4096,Gemm_Hipblaslt_TN_9953,0.508908
GemmTunableOp_Half_TN,tn_6144_5533_4096,Gemm_Rocblas_621286678,0.454661
GemmTunableOp_Half_TN,tn_4096_6920_4096,Gemm_Hipblaslt_TN_9743,0.393035
GemmTunableOp_Half_TN,tn_4096_1745_14336,Gemm_Hipblaslt_TN_9645,0.392115
GemmTunableOp_Half_TN,tn_128256_231_4096,Gemm_Rocblas_621286892,0.588902
GemmTunableOp_Half_TN,tn_22016_2274_4096,Gemm_Hipblaslt_TN_9832,0.745586
GemmTunableOp_Half_TN,tn_4096_5277_4096,Gemm_Hipblaslt_TN_9690,0.317838
GemmTunableOp_Half_TN,tn_4096_1978_14336,Gemm_Hipblaslt_TN_9134,0.418019
GemmTunableOp_Half_TN,tn_6144_1707_4096,Gemm_Hipblaslt_TN_9570,0.153701
GemmTunableOp_Half_TN,tn_4096_6871_4096,Gemm_Hipblaslt_TN_9743,0.388458
GemmTunableOp_Half_TN,tn_4096_7325_14336,Gemm_Hipblaslt_TN_9738,1.5253
GemmTunableOp_Half_TN,tn_28672_1774_4096,Gemm_Hipblaslt_TN_9223,0.736387
GemmTunableOp_Half_TN,tn_4096_1961_14336,Gemm_Hipblaslt_TN_9267,0.417913
GemmTunableOp_Half_TN,tn_4096_1957_14336,Gemm_Hipblaslt_TN_9136,0.415684
GemmTunableOp_Half_TN,tn_6144_3388_4096,Gemm_Hipblaslt_TN_9570,0.302351
GemmTunableOp_Half_TN,tn_4096_1973_4096,Gemm_Hipblaslt_TN_9645,0.123456
GemmTunableOp_Half_TN,tn_28672_1981_4096,Gemm_Hipblaslt_TN_9846,0.843948
GemmTunableOp_Half_TN,tn_128256_123_4096,Gemm_Rocblas_621294762,0.420448
GemmTunableOp_Half_TN,tn_4096_5354_4096,Gemm_Hipblaslt_TN_9687,0.323139
GemmTunableOp_Half_TN,tn_12288_6_4096,Gemm_Rocblas_621286318,0.0212778
GemmTunableOp_Half_TN,tn_6144_1722_4096,Gemm_Rocblas_621286753,0.155973
GemmTunableOp_Half_TN,tn_6144_1859_4096,Gemm_Hipblaslt_TN_9209,0.166365
GemmTunableOp_Half_TN,tn_4096_1798_4096,Gemm_Hipblaslt_TN_9645,0.117738
GemmTunableOp_Half_TN,tn_4096_5436_4096,Gemm_Hipblaslt_TN_9924,0.325427
GemmTunableOp_Half_TN,tn_4096_1727_14336,Gemm_Hipblaslt_TN_9265,0.366819
GemmTunableOp_Half_TN,tn_28672_1620_4096,Gemm_Hipblaslt_TN_9222,0.707962
GemmTunableOp_Half_TN,tn_6144_3691_4096,Gemm_Hipblaslt_TN_9690,0.32999
GemmTunableOp_Half_TN,tn_4096_4017_11008,Gemm_Hipblaslt_TN_9713,0.580137
GemmTunableOp_Half_TN,tn_4096_3388_14336,Gemm_Hipblaslt_TN_9832,0.66172
GemmTunableOp_Half_TN,tn_28672_1666_4096,Gemm_Rocblas_621286678,0.719095
GemmTunableOp_Half_TN,tn_4096_3475_4096,Gemm_Hipblaslt_TN_9743,0.199626
GemmTunableOp_Half_TN,tn_28672_3581_4096,Gemm_Hipblaslt_TN_9841,1.37977
GemmTunableOp_Half_TN,tn_6144_1688_4096,Gemm_Hipblaslt_TN_9570,0.155173
GemmTunableOp_Half_TN,tn_28672_1618_4096,Gemm_Hipblaslt_TN_9217,0.707848
GemmTunableOp_Half_TN,tn_6144_3588_4096,Gemm_Hipblaslt_TN_9570,0.316033
GemmTunableOp_Half_TN,tn_6144_1684_4096,Gemm_Hipblaslt_TN_9570,0.153435
GemmTunableOp_Half_TN,tn_4096_5442_4096,Gemm_Hipblaslt_TN_9690,0.327227
GemmTunableOp_Half_TN,tn_6144_5498_4096,Gemm_Hipblaslt_TN_9704,0.452402
GemmTunableOp_Half_TN,tn_6144_7253_4096,Gemm_Hipblaslt_TN_9677,0.599342
GemmTunableOp_Half_TN,tn_28672_1781_4096,Gemm_Hipblaslt_TN_9223,0.734668
GemmTunableOp_Half_TN,tn_4096_232_4096,Gemm_Rocblas_621286491,0.0256928
GemmTunableOp_Half_TN,tn_4096_1706_4096,Gemm_Hipblaslt_TN_9616,0.106046
GemmTunableOp_Half_TN,tn_4096_1733_4096,Gemm_Hipblaslt_TN_9134,0.11507
GemmTunableOp_Half_TN,tn_28672_3830_4096,Gemm_Hipblaslt_TN_9827,1.56225
GemmTunableOp_Half_TN,tn_4096_1840_14336,Gemm_Hipblaslt_TN_9137,0.403894
GemmTunableOp_Half_TN,tn_6144_1727_4096,Gemm_Hipblaslt_TN_9570,0.153361
GemmTunableOp_Half_TN,tn_6144_1713_4096,Gemm_Hipblaslt_TN_9570,0.153247
GemmTunableOp_Half_TN,tn_4096_7730_14336,Gemm_Hipblaslt_TN_9753,1.56772
GemmTunableOp_Half_TN,tn_22016_2065_4096,Gemm_Hipblaslt_TN_9827,0.668176
GemmTunableOp_Half_TN,tn_4096_1853_14336,Gemm_Hipblaslt_TN_9137,0.404745
GemmTunableOp_Half_TN,tn_128256_68_4096,Gemm_Hipblaslt_TN_9057,0.373899
GemmTunableOp_Half_TN,tn_6144_7301_4096,Gemm_Rocblas_621294420,0.623047
GemmTunableOp_Half_TN,tn_12288_2303_4096,Gemm_Hipblaslt_TN_9743,0.383851
GemmTunableOp_Half_TN,tn_6144_7196_4096,Gemm_Rocblas_621286589,0.605005
GemmTunableOp_Half_TN,tn_6144_1924_4096,Gemm_Hipblaslt_TN_9693,0.173985
GemmTunableOp_Half_TN,tn_4096_136_14336,Gemm_Hipblaslt_TN_7219,0.0515683
GemmTunableOp_Half_TN,tn_6144_80_4096,Gemm_Rocblas_621294029,0.0179934
GemmTunableOp_Half_TN,tn_4096_1599_4096,Gemm_Hipblaslt_TN_9607,0.103585
GemmTunableOp_Half_TN,tn_4096_6_4096,Gemm_Rocblas_621294130,0.0100037
GemmTunableOp_Half_TN,tn_4096_2193_4096,Gemm_Hipblaslt_TN_9698,0.135438
GemmTunableOp_Half_TN,tn_4096_1593_4096,Gemm_Hipblaslt_TN_9607,0.102307
GemmTunableOp_Half_TN,tn_4096_3559_4096,Gemm_Hipblaslt_TN_9682,0.200725
GemmTunableOp_Half_TN,tn_28672_240_4096,Gemm_Rocblas_621294324,0.121068
GemmTunableOp_Half_TN,tn_28672_1686_4096,Gemm_Hipblaslt_TN_9220,0.721547
GemmTunableOp_Half_TN,tn_4096_6721_14336,Gemm_Hipblaslt_TN_9743,1.36663
GemmTunableOp_Half_TN,tn_28672_1600_4096,Gemm_Rocblas_621294420,0.695589
GemmTunableOp_Half_TN,tn_128256_169_4096,Gemm_Hipblaslt_TN_9684,0.507415
GemmTunableOp_Half_TN,tn_6144_3630_4096,Gemm_Hipblaslt_TN_9570,0.315794
GemmTunableOp_Half_TN,tn_6144_3214_4096,Gemm_Rocblas_621294306,0.292161
GemmTunableOp_Half_TN,tn_4096_1839_4096,Gemm_Hipblaslt_TN_9134,0.11922
GemmTunableOp_Half_TN,tn_6144_1963_4096,Gemm_Hipblaslt_TN_9693,0.177464
GemmTunableOp_Half_TN,tn_4096_1933_14336,Gemm_Hipblaslt_TN_9645,0.414911
GemmTunableOp_Half_TN,tn_4096_1698_4096,Gemm_Hipblaslt_TN_9359,0.106665
GemmTunableOp_Half_TN,tn_128256_223_4096,Gemm_Hipblaslt_TN_9919,0.567877
GemmTunableOp_Half_TN,tn_28672_3583_4096,Gemm_Hipblaslt_TN_9827,1.38303
GemmTunableOp_Half_TN,tn_22016_157_4096,Gemm_Hipblaslt_TN_7216,0.0760254
GemmTunableOp_Half_TN,tn_22016_4000_4096,Gemm_Hipblaslt_TN_9832,1.23896
GemmTunableOp_Half_TN,tn_128256_126_4096,Gemm_Rocblas_621294762,0.420813
GemmTunableOp_Half_TN,tn_6144_1749_4096,Gemm_Hipblaslt_TN_9672,0.157639
GemmTunableOp_Half_TN,tn_28672_1742_4096,Gemm_Hipblaslt_TN_9184,0.729855
GemmTunableOp_Half_TN,tn_12288_149_4096,Gemm_Rocblas_621286472,0.0431545
GemmTunableOp_Half_TN,tn_32000_148_4096,Gemm_Hipblaslt_TN_9564,0.0965265
GemmTunableOp_Half_TN,tn_4096_142_11008,Gemm_Hipblaslt_TN_7219,0.0455021
GemmTunableOp_Half_TN,tn_4096_137_11008,Gemm_Hipblaslt_TN_8260,0.0446911
GemmTunableOp_Half_TN,tn_4096_3404_14336,Gemm_Hipblaslt_TN_9743,0.663722
GemmTunableOp_Half_TN,tn_4096_6952_14336,Gemm_Hipblaslt_TN_9743,1.40549
GemmTunableOp_Half_TN,tn_6144_7552_4096,Gemm_Hipblaslt_TN_9768,0.635853
GemmTunableOp_Half_TN,tn_22016_2497_4096,Gemm_Hipblaslt_TN_9832,0.793345
GemmTunableOp_Half_TN,tn_4096_2193_11008,Gemm_Hipblaslt_TN_9748,0.357324
GemmTunableOp_Half_TN,tn_4096_2081_11008,Gemm_Hipblaslt_TN_9698,0.34512
GemmTunableOp_Half_TN,tn_4096_1770_4096,Gemm_Hipblaslt_TN_9267,0.117481
GemmTunableOp_Half_TN,tn_32000_132_4096,Gemm_Hipblaslt_TN_9564,0.0937796
GemmTunableOp_Half_TN,tn_4096_142_4096,Gemm_Hipblaslt_TN_9474,0.0216611
GemmTunableOp_Half_TN,tn_12288_2289_4096,Gemm_Hipblaslt_TN_9677,0.384279
GemmTunableOp_Half_TN,tn_6144_1954_4096,Gemm_Hipblaslt_TN_9793,0.176768
GemmTunableOp_Half_TN,tn_32000_141_4096,Gemm_Hipblaslt_TN_9564,0.0951893
GemmTunableOp_Half_TN,tn_4096_7191_14336,Gemm_Hipblaslt_TN_9743,1.43365
GemmTunableOp_Half_TN,tn_32000_256_4096,Gemm_Hipblaslt_TN_9845,0.13307
GemmTunableOp_Half_TN,tn_4096_1840_4096,Gemm_Hipblaslt_TN_9134,0.119122
GemmTunableOp_Half_TN,tn_32000_147_4096,Gemm_Hipblaslt_TN_9612,0.0964412
GemmTunableOp_Half_TN,tn_4096_2241_11008,Gemm_Hipblaslt_TN_9698,0.359252
GemmTunableOp_Half_TN,tn_6144_1784_4096,Gemm_Hipblaslt_TN_9672,0.163007
GemmTunableOp_Half_TN,tn_4096_3478_4096,Gemm_Hipblaslt_TN_9743,0.19924
GemmTunableOp_Half_TN,tn_4096_1824_4096,Gemm_Hipblaslt_TN_9602,0.118618
GemmTunableOp_Half_TN,tn_12288_4096_4096,Gemm_Hipblaslt_TN_9220,0.677582
GemmTunableOp_Half_TN,tn_4096_3578_4096,Gemm_Hipblaslt_TN_9743,0.200621
GemmTunableOp_Half_TN,tn_32000_149_4096,Gemm_Hipblaslt_TN_9564,0.0958326
GemmTunableOp_Half_TN,tn_128256_133_4096,Gemm_Hipblaslt_TN_9808,0.459091
GemmTunableOp_Half_TN,tn_22016_145_4096,Gemm_Hipblaslt_TN_9321,0.0735501
GemmTunableOp_Half_TN,tn_4096_1838_14336,Gemm_Hipblaslt_TN_9137,0.403714
GemmTunableOp_Half_TN,tn_6144_3382_4096,Gemm_Rocblas_621294495,0.30464
GemmTunableOp_Half_TN,tn_32000_146_4096,Gemm_Hipblaslt_TN_9612,0.0953952
GemmTunableOp_Half_TN,tn_6144_5442_4096,Gemm_Hipblaslt_TN_9746,0.453722
GemmTunableOp_Half_TN,tn_32000_134_4096,Gemm_Hipblaslt_TN_9564,0.0935757
GemmTunableOp_Half_TN,tn_4096_2209_11008,Gemm_Hipblaslt_TN_9698,0.356741
GemmTunableOp_Half_TN,tn_4096_2161_4096,Gemm_Hipblaslt_TN_9686,0.13345
GemmTunableOp_Half_TN,tn_6144_3383_4096,Gemm_Hipblaslt_TN_9570,0.303813
GemmTunableOp_Half_TN,tn_32000_133_4096,Gemm_Hipblaslt_TN_9564,0.0939486
GemmTunableOp_Half_TN,tn_4096_5267_4096,Gemm_Hipblaslt_TN_9687,0.318709
GemmTunableOp_Half_TN,tn_128256_76_4096,Gemm_Hipblaslt_TN_9057,0.381138
GemmTunableOp_Half_TN,tn_6144_3514_4096,Gemm_Hipblaslt_TN_9570,0.31395
GemmTunableOp_Half_TN,tn_6144_1752_4096,Gemm_Hipblaslt_TN_9799,0.158672
GemmTunableOp_Half_TN,tn_4096_2272_11008,Gemm_Hipblaslt_TN_9728,0.361183
GemmTunableOp_Half_TN,tn_22016_144_4096,Gemm_Hipblaslt_TN_9319,0.0720027
GemmTunableOp_Half_TN,tn_4096_6630_4096,Gemm_Hipblaslt_TN_9814,0.383062
GemmTunableOp_Half_TN,tn_4096_3438_14336,Gemm_Hipblaslt_TN_9695,0.666132
GemmTunableOp_Half_TN,tn_28672_1948_4096,Gemm_Hipblaslt_TN_9846,0.829552
GemmTunableOp_Half_TN,tn_4096_1607_4096,Gemm_Hipblaslt_TN_9359,0.102683
GemmTunableOp_Half_TN,tn_12288_2337_4096,Gemm_Rocblas_621294420,0.407826
GemmTunableOp_Half_TN,tn_28672_5427_4096,Gemm_Hipblaslt_TN_9924,2.26287
GemmTunableOp_Half_TN,tn_12288_136_4096,Gemm_Hipblaslt_TN_9144,0.0419959
GemmTunableOp_Half_TN,tn_4096_1610_4096,Gemm_Hipblaslt_TN_9607,0.103689
GemmTunableOp_Half_TN,tn_4096_153_4096,Gemm_Rocblas_621294230,0.0221939
GemmTunableOp_Half_TN,tn_4096_156_11008,Gemm_Hipblaslt_TN_7563,0.0489789
GemmTunableOp_Half_TN,tn_4096_6989_4096,Gemm_Hipblaslt_TN_9221,0.395771
GemmTunableOp_Half_TN,tn_4096_1721_4096,Gemm_Hipblaslt_TN_9607,0.10669
GemmTunableOp_Half_TN,tn_4096_5512_14336,Gemm_Hipblaslt_TN_9799,1.14371
GemmTunableOp_Half_TN,tn_4096_1892_4096,Gemm_Hipblaslt_TN_9645,0.120371
GemmTunableOp_Half_TN,tn_6144_7439_4096,Gemm_Rocblas_621286678,0.630169
GemmTunableOp_Half_TN,tn_28672_3564_4096,Gemm_Hipblaslt_TN_9827,1.3843
GemmTunableOp_Half_TN,tn_4096_144_4096,Gemm_Hipblaslt_TN_9474,0.0220657
GemmTunableOp_Half_TN,tn_4096_1763_4096,Gemm_Hipblaslt_TN_9134,0.116003
GemmTunableOp_Half_TN,tn_4096_4000_11008,Gemm_Rocblas_621294034,0.575544
GemmTunableOp_Half_TN,tn_6144_7021_4096,Gemm_Hipblaslt_TN_9743,0.592795
GemmTunableOp_Half_TN,tn_6144_6990_4096,Gemm_Hipblaslt_TN_9188,0.593076
GemmTunableOp_Half_TN,tn_4096_5196_14336,Gemm_Hipblaslt_TN_9799,1.08183
GemmTunableOp_Half_TN,tn_6144_3455_4096,Gemm_Hipblaslt_TN_9570,0.306445
GemmTunableOp_Half_TN,tn_22016_5_4096,Gemm_Rocblas_621286346,0.0350924
GemmTunableOp_Half_TN,tn_4096_5605_4096,Gemm_Rocblas_621294320,0.332885
GemmTunableOp_Half_TN,tn_4096_2255_4096,Gemm_Hipblaslt_TN_9627,0.137978
GemmTunableOp_Half_TN,tn_6144_3622_4096,Gemm_Hipblaslt_TN_9570,0.315455
GemmTunableOp_Half_TN,tn_28672_3501_4096,Gemm_Hipblaslt_TN_9827,1.36421
GemmTunableOp_Half_TN,tn_128256_52_4096,Gemm_Rocblas_621286816,0.349663
GemmTunableOp_Half_TN,tn_12288_7_4096,Gemm_Rocblas_621286318,0.0213314
GemmTunableOp_Half_TN,tn_4096_1771_4096,Gemm_Hipblaslt_TN_9329,0.116511
GemmTunableOp_Half_TN,tn_22016_2321_4096,Gemm_Hipblaslt_TN_9846,0.780565
GemmTunableOp_Half_TN,tn_4096_158_11008,Gemm_Hipblaslt_TN_8260,0.0475472
GemmTunableOp_Half_TN,tn_6144_1592_4096,Gemm_Rocblas_621286565,0.147068
GemmTunableOp_Half_TN,tn_22016_2097_4096,Gemm_Hipblaslt_TN_9827,0.669489
GemmTunableOp_Half_TN,tn_128256_185_4096,Gemm_Hipblaslt_TN_9953,0.514064
GemmTunableOp_Half_TN,tn_4096_1879_4096,Gemm_Hipblaslt_TN_9134,0.121621
GemmTunableOp_Half_TN,tn_22016_4096_4096,Gemm_Hipblaslt_TN_9840,1.28167
GemmTunableOp_Half_TN,tn_4096_161_11008,Gemm_Hipblaslt_TN_7586,0.0495424
GemmTunableOp_Half_TN,tn_4096_160_4096,Gemm_Rocblas_621294230,0.0221627
GemmTunableOp_Half_TN,tn_128256_255_4096,Gemm_Rocblas_621286892,0.601769
GemmTunableOp_Half_TN,tn_28672_3400_4096,Gemm_Hipblaslt_TN_9827,1.35225
GemmTunableOp_Half_TN,tn_4096_192_14336,Gemm_Hipblaslt_TN_7585,0.0617654
GemmTunableOp_Half_TN,tn_128256_241_4096,Gemm_Rocblas_621294634,0.594876
GemmTunableOp_Half_TN,tn_6144_3501_4096,Gemm_Rocblas_621294495,0.314193
GemmTunableOp_Half_TN,tn_128256_194_4096,Gemm_Hipblaslt_TN_9898,0.554758
GemmTunableOp_Half_TN,tn_4096_1778_4096,Gemm_Hipblaslt_TN_9134,0.114609
GemmTunableOp_Half_TN,tn_4096_2241_4096,Gemm_Hipblaslt_TN_9698,0.136457
GemmTunableOp_Half_TN,tn_4096_1928_14336,Gemm_Hipblaslt_TN_9620,0.415997
GemmTunableOp_Half_TN,tn_4096_2433_4096,Gemm_Rocblas_621286753,0.151882
GemmTunableOp_Half_TN,tn_4096_5390_4096,Gemm_Hipblaslt_TN_9672,0.323499
GemmTunableOp_Half_TN,tn_6144_5067_4096,Gemm_Hipblaslt_TN_9768,0.429648
GemmTunableOp_Half_TN,tn_32000_154_4096,Gemm_Hipblaslt_TN_9564,0.0965441
GemmTunableOp_Half_TN,tn_28672_3219_4096,Gemm_Hipblaslt_TN_9827,1.33266
GemmTunableOp_Half_TN,tn_6144_1757_4096,Gemm_Hipblaslt_TN_9799,0.158272
GemmTunableOp_Half_TN,tn_4096_7_11008,Gemm_Rocblas_621294054,0.023334
GemmTunableOp_Half_TN,tn_4096_3780_14336,Gemm_Hipblaslt_TN_9813,0.720282
GemmTunableOp_Half_TN,tn_32000_159_4096,Gemm_Hipblaslt_TN_9606,0.0985324
GemmTunableOp_Half_TN,tn_12288_2257_4096,Gemm_Hipblaslt_TN_9743,0.38146
GemmTunableOp_Half_TN,tn_22016_2353_4096,Gemm_Hipblaslt_TN_9832,0.807986
GemmTunableOp_Half_TN,tn_128256_209_4096,Gemm_Hipblaslt_TN_9937,0.55826
GemmTunableOp_Half_TN,tn_6144_1642_4096,Gemm_Hipblaslt_TN_9570,0.149891
GemmTunableOp_Half_TN,tn_4096_3688_4096,Gemm_Rocblas_621286281,0.21056
GemmTunableOp_Half_TN,tn_4096_153_11008,Gemm_Hipblaslt_TN_8260,0.048148
GemmTunableOp_Half_TN,tn_6144_1708_4096,Gemm_Rocblas_621286753,0.155722
GemmTunableOp_Half_TN,tn_4096_1719_4096,Gemm_Hipblaslt_TN_9616,0.105488
GemmTunableOp_Half_TN,tn_28672_3710_4096,Gemm_Hipblaslt_TN_9827,1.50593
GemmTunableOp_Half_TN,tn_12288_2225_4096,Gemm_Hipblaslt_TN_9697,0.379236
GemmTunableOp_Half_TN,tn_28672_3582_4096,Gemm_Hipblaslt_TN_9827,1.38169
GemmTunableOp_Half_TN,tn_4096_6841_4096,Gemm_Hipblaslt_TN_9743,0.389548
GemmTunableOp_Half_TN,tn_12288_145_4096,Gemm_Rocblas_621286472,0.0431609
GemmTunableOp_Half_TN,tn_28672_7364_4096,Gemm_Hipblaslt_TN_159,2.91305
GemmTunableOp_Half_TN,tn_6144_3438_4096,Gemm_Rocblas_621286753,0.307303
GemmTunableOp_Half_TN,tn_22016_158_4096,Gemm_Hipblaslt_TN_9319,0.0755997
GemmTunableOp_Half_TN,tn_4096_5413_4096,Gemm_Hipblaslt_TN_9691,0.325228
GemmTunableOp_Half_TN,tn_6144_7171_4096,Gemm_Hipblaslt_TN_9139,0.603071
GemmTunableOp_Half_TN,tn_32000_131_4096,Gemm_Hipblaslt_TN_9564,0.0935829
GemmTunableOp_Half_TN,tn_6144_3629_4096,Gemm_Rocblas_621286753,0.317793
GemmTunableOp_Half_TN,tn_32000_5_4096,Gemm_Rocblas_621294053,0.0486438
GemmTunableOp_Half_TN,tn_4096_7262_14336,Gemm_Hipblaslt_TN_9743,1.44195
GemmTunableOp_Half_TN,tn_4096_3508_4096,Gemm_Hipblaslt_TN_9743,0.198846
GemmTunableOp_Half_TN,tn_28672_5359_4096,Gemm_Hipblaslt_TN_9893,2.16773
GemmTunableOp_Half_TN,tn_32000_7_4096,Gemm_Rocblas_621294053,0.0487732
GemmTunableOp_Half_TN,tn_28672_1890_4096,Gemm_Hipblaslt_TN_9683,0.78902
GemmTunableOp_Half_TN,tn_6144_7136_4096,Gemm_Hipblaslt_TN_9743,0.596747
GemmTunableOp_Half_TN,tn_12288_141_4096,Gemm_Rocblas_621286472,0.0428667
GemmTunableOp_Half_TN,tn_6144_1969_4096,Gemm_Hipblaslt_TN_9793,0.175711
GemmTunableOp_Half_TN,tn_4096_149_4096,Gemm_Rocblas_621294168,0.0219267
GemmTunableOp_Half_TN,tn_12288_2000_4096,Gemm_Rocblas_621286747,0.350137
GemmTunableOp_Half_TN,tn_128256_103_4096,Gemm_Rocblas_621294762,0.417356
GemmTunableOp_Half_TN,tn_4096_1609_14336,Gemm_Hipblaslt_TN_9671,0.357107
GemmTunableOp_Half_TN,tn_4096_1860_14336,Gemm_Hipblaslt_TN_9680,0.40826
GemmTunableOp_Half_TN,tn_128256_94_4096,Gemm_Hipblaslt_TN_9057,0.390788
GemmTunableOp_Half_TN,tn_28672_5157_4096,Gemm_Hipblaslt_TN_159,2.10559
GemmTunableOp_Half_TN,tn_12288_2129_4096,Gemm_Hipblaslt_TN_9187,0.37315
GemmTunableOp_Half_TN,tn_4096_2258_4096,Gemm_Hipblaslt_TN_9686,0.13835
GemmTunableOp_Half_TN,tn_6144_1769_4096,Gemm_Hipblaslt_TN_9672,0.162678
GemmTunableOp_Half_TN,tn_12288_156_4096,Gemm_Rocblas_621286472,0.0432792
GemmTunableOp_Half_TN,tn_12288_143_4096,Gemm_Hipblaslt_TN_9154,0.0416261
GemmTunableOp_Half_TN,tn_4096_3600_4096,Gemm_Hipblaslt_TN_9743,0.202177
GemmTunableOp_Half_TN,tn_4096_3557_14336,Gemm_Hipblaslt_TN_9677,0.678982
GemmTunableOp_Half_TN,tn_28672_1628_4096,Gemm_Hipblaslt_TN_9217,0.710404
GemmTunableOp_Half_TN,tn_128256_11_4096,Gemm_Hipblaslt_TN_9405,0.286934
GemmTunableOp_Half_TN,tn_6144_5570_4096,Gemm_Hipblaslt_TN_9704,0.455689
GemmTunableOp_Half_TN,tn_128256_21_4096,Gemm_Hipblaslt_TN_9451,0.308268
GemmTunableOp_Half_TN,tn_4096_156_4096,Gemm_Rocblas_621294230,0.0221645
GemmTunableOp_Half_TN,tn_28672_1665_4096,Gemm_Hipblaslt_TN_9223,0.713487
GemmTunableOp_Half_TN,tn_128256_65_4096,Gemm_Hipblaslt_TN_9057,0.367787
GemmTunableOp_Half_TN,tn_128256_87_4096,Gemm_Hipblaslt_TN_9058,0.387395
GemmTunableOp_Half_TN,tn_128256_156_4096,Gemm_Hipblaslt_TN_9808,0.467904
GemmTunableOp_Half_TN,tn_4096_256_4096,Gemm_Rocblas_621294173,0.0264835
GemmTunableOp_Half_TN,tn_4096_2064_4096,Gemm_Hipblaslt_TN_9728,0.132527
GemmTunableOp_Half_TN,tn_128256_166_4096,Gemm_Hipblaslt_TN_9696,0.505864
GemmTunableOp_Half_TN,tn_128256_135_4096,Gemm_Hipblaslt_TN_9808,0.459289
GemmTunableOp_Half_TN,tn_4096_1691_14336,Gemm_Hipblaslt_TN_9790,0.364852
GemmTunableOp_Half_TN,tn_4096_1731_4096,Gemm_Hipblaslt_TN_9645,0.115659
GemmTunableOp_Half_TN,tn_128256_237_4096,Gemm_Rocblas_621294634,0.595968
GemmTunableOp_Half_TN,tn_4096_1703_14336,Gemm_Hipblaslt_TN_9265,0.363217
GemmTunableOp_Half_TN,tn_28672_1811_4096,Gemm_Hipblaslt_TN_9684,0.785247
GemmTunableOp_Half_TN,tn_128256_246_4096,Gemm_Rocblas_621286905,0.601938
GemmTunableOp_Half_TN,tn_28672_5285_4096,Gemm_Hipblaslt_TN_9893,2.15152
GemmTunableOp_Half_TN,tn_128256_144_4096,Gemm_Hipblaslt_TN_9852,0.461752
GemmTunableOp_Half_TN,tn_4096_3830_4096,Gemm_Hipblaslt_TN_9827,0.218106
GemmTunableOp_Half_TN,tn_28672_1658_4096,Gemm_Hipblaslt_TN_9223,0.716332
GemmTunableOp_Half_TN,tn_4096_1610_14336,Gemm_Hipblaslt_TN_9610,0.357578
GemmTunableOp_Half_TN,tn_4096_1779_14336,Gemm_Hipblaslt_TN_9645,0.393649
GemmTunableOp_Half_TN,tn_4096_1953_14336,Gemm_Hipblaslt_TN_9680,0.418421
GemmTunableOp_Half_TN,tn_4096_1873_14336,Gemm_Hipblaslt_TN_9645,0.409315
GemmTunableOp_Half_TN,tn_12288_142_4096,Gemm_Rocblas_621286493,0.043452
GemmTunableOp_Half_TN,tn_128256_30_4096,Gemm_Rocblas_621294578,0.313593
GemmTunableOp_Half_TN,tn_4096_7047_4096,Gemm_Hipblaslt_TN_9743,0.395515
GemmTunableOp_Half_TN,tn_28672_1855_4096,Gemm_Hipblaslt_TN_9683,0.786933
GemmTunableOp_Half_TN,tn_128256_227_4096,Gemm_Rocblas_621294634,0.590047
GemmTunableOp_Half_TN,tn_28672_1884_4096,Gemm_Hipblaslt_TN_9684,0.791022
GemmTunableOp_Half_TN,tn_28672_3713_4096,Gemm_Hipblaslt_TN_9827,1.50281
GemmTunableOp_Half_TN,tn_6144_3427_4096,Gemm_Hipblaslt_TN_9570,0.306224
GemmTunableOp_Half_TN,tn_6144_1872_4096,Gemm_Hipblaslt_TN_9690,0.165618
GemmTunableOp_Half_TN,tn_4096_1766_14336,Gemm_Hipblaslt_TN_9645,0.392263
GemmTunableOp_Half_TN,tn_4096_1847_14336,Gemm_Hipblaslt_TN_9137,0.40632
GemmTunableOp_Half_TN,tn_4096_7432_14336,Gemm_Hipblaslt_TN_9813,1.54034
GemmTunableOp_Half_TN,tn_6144_1934_4096,Gemm_Hipblaslt_TN_9793,0.175807
GemmTunableOp_Half_TN,tn_4096_6881_4096,Gemm_Hipblaslt_TN_9694,0.392397
GemmTunableOp_Half_TN,tn_28672_1857_4096,Gemm_Hipblaslt_TN_9684,0.792157
GemmTunableOp_Half_TN,tn_28672_1762_4096,Gemm_Hipblaslt_TN_9184,0.732369
GemmTunableOp_Half_TN,tn_28672_5267_4096,Gemm_Hipblaslt_TN_9860,2.14621
GemmTunableOp_Half_TN,tn_28672_5410_4096,Gemm_Hipblaslt_TN_9924,2.24786
GemmTunableOp_Half_TN,tn_28672_3578_4096,Gemm_Hipblaslt_TN_9827,1.37479
GemmTunableOp_Half_TN,tn_4096_1707_14336,Gemm_Hipblaslt_TN_9790,0.365979
GemmTunableOp_Half_TN,tn_4096_3791_4096,Gemm_Hipblaslt_TN_9827,0.211359
GemmTunableOp_Half_TN,tn_22016_2080_4096,Gemm_Hipblaslt_TN_9841,0.672568
GemmTunableOp_Half_TN,tn_4096_5530_4096,Gemm_Rocblas_621294426,0.329366
GemmTunableOp_Half_TN,tn_6144_3701_4096,Gemm_Rocblas_621286684,0.330136
GemmTunableOp_Half_TN,tn_28672_7104_4096,Gemm_Hipblaslt_TN_9747,2.8869
GemmTunableOp_Half_TN,tn_4096_3520_14336,Gemm_Hipblaslt_TN_9677,0.680083
GemmTunableOp_Half_TN,tn_4096_7327_14336,Gemm_Hipblaslt_TN_9591,1.52412
GemmTunableOp_Half_TN,tn_28672_6916_4096,Gemm_Hipblaslt_TN_9944,2.87665
GemmTunableOp_Half_TN,tn_28672_3920_4096,Gemm_Hipblaslt_TN_9827,1.56686
GemmTunableOp_Half_TN,tn_4096_7138_14336,Gemm_Hipblaslt_TN_9743,1.42745
GemmTunableOp_Half_TN,tn_128256_152_4096,Gemm_Hipblaslt_TN_9808,0.466507
GemmTunableOp_Half_TN,tn_128256_253_4096,Gemm_Rocblas_621294634,0.601687
GemmTunableOp_Half_TN,tn_28672_1642_4096,Gemm_Rocblas_621294420,0.713646
GemmTunableOp_Half_TN,tn_4096_6868_4096,Gemm_Hipblaslt_TN_9743,0.390713
GemmTunableOp_Half_TN,tn_28672_5322_4096,Gemm_Hipblaslt_TN_9893,2.16042
GemmTunableOp_Half_TN,tn_28672_1651_4096,Gemm_Rocblas_621286678,0.71458
GemmTunableOp_Half_TN,tn_4096_3450_4096,Gemm_Hipblaslt_TN_9188,0.195139
GemmTunableOp_Half_TN,tn_28672_6976_4096,Gemm_Hipblaslt_TN_9919,2.86204
GemmTunableOp_Half_TN,tn_4096_3515_14336,Gemm_Hipblaslt_TN_9139,0.683872
GemmTunableOp_Half_TN,tn_6144_3450_4096,Gemm_Hipblaslt_TN_9570,0.30722
GemmTunableOp_Half_TN,tn_128256_222_4096,Gemm_Hipblaslt_TN_9919,0.568271
GemmTunableOp_Half_TN,tn_4096_6800_14336,Gemm_Hipblaslt_TN_9694,1.37486
GemmTunableOp_Half_TN,tn_6144_6979_4096,Gemm_Hipblaslt_TN_9677,0.590234
GemmTunableOp_Half_TN,tn_6144_6952_4096,Gemm_Hipblaslt_TN_9221,0.590426
GemmTunableOp_Half_TN,tn_12288_2417_4096,Gemm_Hipblaslt_TN_9217,0.410031
GemmTunableOp_Half_TN,tn_6144_7579_4096,Gemm_Rocblas_621294492,0.637507
GemmTunableOp_Half_TN,tn_28672_1842_4096,Gemm_Hipblaslt_TN_9684,0.788354
GemmTunableOp_Half_TN,tn_6144_6843_4096,Gemm_Hipblaslt_TN_9187,0.58233
GemmTunableOp_Half_TN,tn_22016_2177_4096,Gemm_Hipblaslt_TN_9827,0.685704
GemmTunableOp_Half_TN,tn_6144_3300_4096,Gemm_Rocblas_621286566,0.298965
GemmTunableOp_Half_TN,tn_4096_3597_14336,Gemm_Hipblaslt_TN_9189,0.687913
GemmTunableOp_Half_TN,tn_6144_5436_4096,Gemm_Rocblas_621294420,0.450331
GemmTunableOp_Half_TN,tn_28672_1707_4096,Gemm_Hipblaslt_TN_9217,0.722103
GemmTunableOp_Half_TN,tn_28672_7327_4096,Gemm_Hipblaslt_TN_159,2.89761
GemmTunableOp_Half_TN,tn_28672_7248_4096,Gemm_Hipblaslt_TN_9914,2.91636
GemmTunableOp_Half_TN,tn_28672_3520_4096,Gemm_Hipblaslt_TN_9827,1.37938
GemmTunableOp_Half_TN,tn_4096_144_14336,Gemm_Hipblaslt_TN_7219,0.0533032
GemmTunableOp_Half_TN,tn_28672_1589_4096,Gemm_Hipblaslt_TN_9674,0.700622
GemmTunableOp_Half_TN,tn_4096_1633_14336,Gemm_Hipblaslt_TN_9610,0.358736
GemmTunableOp_Half_TN,tn_28672_1609_4096,Gemm_Hipblaslt_TN_9217,0.707652
GemmTunableOp_Half_TN,tn_128256_86_4096,Gemm_Hipblaslt_TN_9057,0.384346
GemmTunableOp_Half_TN,tn_4096_1688_4096,Gemm_Hipblaslt_TN_9359,0.106934
GemmTunableOp_Half_TN,tn_28672_64_4096,Gemm_Rocblas_621286634,0.0481018
GemmTunableOp_Half_TN,tn_4096_1969_14336,Gemm_Hipblaslt_TN_9680,0.418207
GemmTunableOp_Half_TN,tn_28672_5412_4096,Gemm_Hipblaslt_TN_9852,2.24065
GemmTunableOp_Half_TN,tn_4096_7364_14336,Gemm_Hipblaslt_TN_9753,1.52719
GemmTunableOp_Half_TN,tn_4096_1702_14336,Gemm_Hipblaslt_TN_9790,0.364886
GemmTunableOp_Half_TN,tn_6144_1646_4096,Gemm_Hipblaslt_TN_9570,0.150752
GemmTunableOp_Half_TN,tn_6144_7138_4096,Gemm_Hipblaslt_TN_9743,0.599694
GemmTunableOp_Half_TN,tn_128256_12_4096,Gemm_Hipblaslt_TN_9405,0.287476
GemmTunableOp_Half_TN,tn_28672_3547_4096,Gemm_Hipblaslt_TN_9827,1.37768
GemmTunableOp_Half_TN,tn_28672_24_4096,Gemm_Rocblas_621294559,0.0459923
GemmTunableOp_Half_TN,tn_4096_3420_14336,Gemm_Hipblaslt_TN_9743,0.663846
GemmTunableOp_Half_TN,tn_28672_3574_4096,Gemm_Hipblaslt_TN_9827,1.36917
GemmTunableOp_Half_TN,tn_28672_7267_4096,Gemm_Hipblaslt_TN_159,2.8668
GemmTunableOp_Half_TN,tn_28672_1608_4096,Gemm_Hipblaslt_TN_9217,0.707529
GemmTunableOp_Half_TN,tn_4096_56_4096,Gemm_Rocblas_621286426,0.0128143
GemmTunableOp_Half_TN,tn_4096_3773_4096,Gemm_Hipblaslt_TN_9768,0.214034
GemmTunableOp_Half_TN,tn_32000_136_4096,Gemm_Hipblaslt_TN_9564,0.0946117
GemmTunableOp_Half_TN,tn_28672_72_4096,Gemm_Rocblas_621286719,0.0560541
GemmTunableOp_Half_TN,tn_4096_3574_4096,Gemm_Hipblaslt_TN_9743,0.200027
GemmTunableOp_Half_TN,tn_128256_106_4096,Gemm_Hipblaslt_TN_9596,0.416777
GemmTunableOp_Half_TN,tn_4096_5273_4096,Gemm_Hipblaslt_TN_9924,0.319115
GemmTunableOp_Half_TN,tn_28672_7568_4096,Gemm_Hipblaslt_TN_159,2.93913
GemmTunableOp_Half_TN,tn_12288_148_4096,Gemm_Rocblas_621294209,0.0436437
GemmTunableOp_Half_TN,tn_4096_7139_14336,Gemm_Hipblaslt_TN_9743,1.4248
GemmTunableOp_Half_TN,tn_4096_8_14336,Gemm_Rocblas_621286312,0.0233877
GemmTunableOp_Half_TN,tn_4096_7023_14336,Gemm_Hipblaslt_TN_9743,1.40342
GemmTunableOp_Half_TN,tn_28672_208_4096,Gemm_Hipblaslt_TN_9267,0.110974
GemmTunableOp_Half_TN,tn_4096_1651_14336,Gemm_Hipblaslt_TN_9607,0.361559
GemmTunableOp_Half_TN,tn_4096_6979_14336,Gemm_Hipblaslt_TN_9743,1.40291
GemmTunableOp_Half_TN,tn_28672_5196_4096,Gemm_Hipblaslt_TN_9890,2.13043
GemmTunableOp_Half_TN,tn_6144_3369_4096,Gemm_Hipblaslt_TN_9570,0.303243
GemmTunableOp_Half_TN,tn_4096_208_4096,Gemm_Rocblas_621286491,0.0258103
GemmTunableOp_Half_TN,tn_6144_5352_4096,Gemm_Hipblaslt_TN_9704,0.442835
GemmTunableOp_Half_TN,tn_6144_1908_4096,Gemm_Hipblaslt_TN_9691,0.164789
GemmTunableOp_Half_TN,tn_6144_7109_4096,Gemm_Hipblaslt_TN_9697,0.597842
GemmTunableOp_Half_TN,tn_4096_6747_14336,Gemm_Hipblaslt_TN_9743,1.37504
GemmTunableOp_Half_TN,tn_128256_16_4096,Gemm_Hipblaslt_TN_9405,0.290247
GemmTunableOp_Half_TN,tn_6144_1605_4096,Gemm_Hipblaslt_TN_9570,0.149199
GemmTunableOp_Half_TN,tn_28672_7344_4096,Gemm_Hipblaslt_TN_159,2.91047
GemmTunableOp_Half_TN,tn_4096_1966_4096,Gemm_Hipblaslt_TN_9267,0.121912
GemmTunableOp_Half_TN,tn_4096_1958_14336,Gemm_Hipblaslt_TN_9267,0.41676
GemmTunableOp_Half_TN,tn_28672_5136_4096,Gemm_Rocblas_621294035,2.16974
GemmTunableOp_Half_TN,tn_28672_6902_4096,Gemm_Hipblaslt_TN_9939,2.81222
GemmTunableOp_Half_TN,tn_6144_1588_4096,Gemm_Rocblas_621294305,0.147141
GemmTunableOp_Half_TN,tn_4096_3456_4096,Gemm_Hipblaslt_TN_9743,0.194735
GemmTunableOp_Half_TN,tn_4096_1738_4096,Gemm_Hipblaslt_TN_9329,0.117787
GemmTunableOp_Half_TN,tn_4096_1686_4096,Gemm_Hipblaslt_TN_9607,0.106363
GemmTunableOp_Half_TN,tn_6144_104_4096,Gemm_Rocblas_621294168,0.0232012
GemmTunableOp_Half_TN,tn_4096_3373_4096,Gemm_Hipblaslt_TN_9139,0.194389
GemmTunableOp_Half_TN,tn_6144_232_4096,Gemm_Hipblaslt_TN_9495,0.0344326
GemmTunableOp_Half_TN,tn_28672_1615_4096,Gemm_Hipblaslt_TN_9223,0.705041
GemmTunableOp_Half_TN,tn_28672_7067_4096,Gemm_Hipblaslt_TN_9812,2.87567
GemmTunableOp_Half_TN,tn_4096_7108_14336,Gemm_Hipblaslt_TN_9743,1.42773
GemmTunableOp_Half_TN,tn_4096_5583_14336,Gemm_Hipblaslt_TN_9709,1.15554
GemmTunableOp_Half_TN,tn_6144_1852_4096,Gemm_Hipblaslt_TN_9799,0.165688
GemmTunableOp_Half_TN,tn_28672_1633_4096,Gemm_Hipblaslt_TN_9217,0.709179
GemmTunableOp_Half_TN,tn_4096_6789_4096,Gemm_Hipblaslt_TN_9743,0.386713
GemmTunableOp_Half_TN,tn_6144_1960_4096,Gemm_Hipblaslt_TN_9793,0.176548
GemmTunableOp_Half_TN,tn_28672_1745_4096,Gemm_Rocblas_621286678,0.730327
GemmTunableOp_Half_TN,tn_4096_1589_14336,Gemm_Hipblaslt_TN_9679,0.354126
GemmTunableOp_Half_TN,tn_4096_1801_4096,Gemm_Hipblaslt_TN_9645,0.118486
GemmTunableOp_Half_TN,tn_28672_1597_4096,Gemm_Rocblas_621294420,0.699233
GemmTunableOp_Half_TN,tn_4096_1688_14336,Gemm_Hipblaslt_TN_9671,0.363534
GemmTunableOp_Half_TN,tn_6144_3496_4096,Gemm_Rocblas_621286566,0.304596
GemmTunableOp_Half_TN,tn_28672_144_4096,Gemm_Hipblaslt_TN_7216,0.0851103
GemmTunableOp_Half_TN,tn_4096_3573_4096,Gemm_Hipblaslt_TN_9697,0.199783
GemmTunableOp_Half_TN,tn_6144_1590_4096,Gemm_Rocblas_621294305,0.146372
GemmTunableOp_Half_TN,tn_28672_1877_4096,Gemm_Hipblaslt_TN_9683,0.79325
GemmTunableOp_Half_TN,tn_28672_1711_4096,Gemm_Rocblas_621294420,0.727298
GemmTunableOp_Half_TN,tn_28672_6761_4096,Gemm_Hipblaslt_TN_9958,2.76673
GemmTunableOp_Half_TN,tn_4096_4096_4096,Gemm_Hipblaslt_TN_9827,0.227375
GemmTunableOp_Half_TN,tn_6144_176_4096,Gemm_Rocblas_621294171,0.0286612
GemmTunableOp_Half_TN,tn_6144_5068_4096,Gemm_Rocblas_621294330,0.428019
GemmTunableOp_Half_TN,tn_4096_88_4096,Gemm_Rocblas_621286280,0.0151546
GemmTunableOp_Half_TN,tn_28672_6989_4096,Gemm_Hipblaslt_TN_9859,2.85524
GemmTunableOp_Half_TN,tn_28672_3584_4096,Gemm_Hipblaslt_TN_9827,1.37748
GemmTunableOp_Half_TN,tn_28672_1887_4096,Gemm_Hipblaslt_TN_9683,0.791635
GemmTunableOp_Half_TN,tn_28672_152_4096,Gemm_Hipblaslt_TN_9370,0.0883483
GemmTunableOp_Half_TN,tn_4096_1717_4096,Gemm_Hipblaslt_TN_9164,0.107006
GemmTunableOp_Half_TN,tn_4096_2129_4096,Gemm_Hipblaslt_TN_9698,0.132281
GemmTunableOp_Half_TN,tn_6144_3583_4096,Gemm_Rocblas_621286753,0.315279
GemmTunableOp_Half_TN,tn_28672_3535_4096,Gemm_Hipblaslt_TN_9827,1.37006
GemmTunableOp_Half_TN,tn_4096_1805_4096,Gemm_Hipblaslt_TN_9645,0.118723
GemmTunableOp_Half_TN,tn_4096_7096_4096,Gemm_Hipblaslt_TN_9743,0.395653
GemmTunableOp_Half_TN,tn_4096_1862_14336,Gemm_Hipblaslt_TN_9620,0.41026
GemmTunableOp_Half_TN,tn_22016_2241_4096,Gemm_Hipblaslt_TN_9832,0.734246
GemmTunableOp_Half_TN,tn_28672_3515_4096,Gemm_Hipblaslt_TN_9827,1.36786
GemmTunableOp_Half_TN,tn_4096_5301_4096,Gemm_Hipblaslt_TN_9924,0.322456
GemmTunableOp_Half_TN,tn_4096_1810_4096,Gemm_Hipblaslt_TN_9645,0.118004
GemmTunableOp_Half_TN,tn_4096_1811_14336,Gemm_Hipblaslt_TN_9268,0.401042
GemmTunableOp_Half_TN,tn_4096_7344_14336,Gemm_Hipblaslt_TN_9738,1.53036
GemmTunableOp_Half_TN,tn_4096_7475_14336,Gemm_Hipblaslt_TN_9749,1.5413
GemmTunableOp_Half_TN,tn_28672_1978_4096,Gemm_Hipblaslt_TN_9846,0.836142
GemmTunableOp_Half_TN,tn_4096_2305_11008,Gemm_Hipblaslt_TN_9698,0.369483
GemmTunableOp_Half_TN,tn_4096_1689_14336,Gemm_Hipblaslt_TN_9790,0.362746
GemmTunableOp_Half_TN,tn_4096_2145_4096,Gemm_Hipblaslt_TN_9686,0.134112
GemmTunableOp_Half_TN,tn_4096_7439_14336,Gemm_Hipblaslt_TN_9749,1.53534
GemmTunableOp_Half_TN,tn_6144_1735_4096,Gemm_Hipblaslt_TN_9209,0.158429
GemmTunableOp_Half_TN,tn_4096_5322_14336,Gemm_Hipblaslt_TN_9799,1.09943
GemmTunableOp_Half_TN,tn_4096_6996_4096,Gemm_Hipblaslt_TN_9743,0.399113
GemmTunableOp_Half_TN,tn_4096_1682_14336,Gemm_Hipblaslt_TN_9790,0.360881
GemmTunableOp_Half_TN,tn_128256_200_4096,Gemm_Hipblaslt_TN_9937,0.557838
GemmTunableOp_Half_TN,tn_4096_1689_4096,Gemm_Hipblaslt_TN_9607,0.105483
GemmTunableOp_Half_TN,tn_4096_3830_14336,Gemm_Hipblaslt_TN_9827,0.745008
GemmTunableOp_Half_TN,tn_4096_3793_14336,Gemm_Hipblaslt_TN_9827,0.723784
GemmTunableOp_Half_TN,tn_28672_1860_4096,Gemm_Hipblaslt_TN_9684,0.78617
GemmTunableOp_Half_TN,tn_128256_177_4096,Gemm_Hipblaslt_TN_9684,0.507202
GemmTunableOp_Half_TN,tn_28672_3573_4096,Gemm_Hipblaslt_TN_9827,1.37798
GemmTunableOp_Half_TN,tn_128256_217_4096,Gemm_Hipblaslt_TN_9735,0.567533
GemmTunableOp_Half_TN,tn_4096_1807_14336,Gemm_Hipblaslt_TN_9137,0.404538
GemmTunableOp_Half_TN,tn_4096_1728_14336,Gemm_Hipblaslt_TN_9790,0.365666
GemmTunableOp_Half_TN,tn_4096_145_11008,Gemm_Hipblaslt_TN_7219,0.0466408
GemmTunableOp_Half_TN,tn_6144_1767_4096,Gemm_Hipblaslt_TN_9672,0.1614
GemmTunableOp_Half_TN,tn_4096_6715_4096,Gemm_Hipblaslt_TN_9743,0.383529
GemmTunableOp_Half_TN,tn_128256_105_4096,Gemm_Rocblas_621294762,0.414793
GemmTunableOp_Half_TN,tn_4096_96_4096,Gemm_Rocblas_621286279,0.0152884
GemmTunableOp_Half_TN,tn_128256_44_4096,Gemm_Hipblaslt_TN_9451,0.329675
GemmTunableOp_Half_TN,tn_4096_1931_4096,Gemm_Hipblaslt_TN_9680,0.121157
GemmTunableOp_Half_TN,tn_4096_6860_4096,Gemm_Hipblaslt_TN_9743,0.386561
GemmTunableOp_Half_TN,tn_28672_3404_4096,Gemm_Hipblaslt_TN_9841,1.3512
GemmTunableOp_Half_TN,tn_4096_5319_14336,Gemm_Hipblaslt_TN_9799,1.10561
GemmTunableOp_Half_TN,tn_4096_1737_4096,Gemm_Hipblaslt_TN_9134,0.116492
GemmTunableOp_Half_TN,tn_4096_1892_14336,Gemm_Hipblaslt_TN_9134,0.410783
GemmTunableOp_Half_TN,tn_6144_8192_4096,Gemm_Hipblaslt_TN_9914,0.67739
GemmTunableOp_Half_TN,tn_28672_7171_4096,Gemm_Hipblaslt_TN_159,2.83502
GemmTunableOp_Half_TN,tn_4096_1948_14336,Gemm_Hipblaslt_TN_9645,0.41739
GemmTunableOp_Half_TN,tn_28672_5495_4096,Gemm_Hipblaslt_TN_9852,2.28814
GemmTunableOp_Half_TN,tn_4096_5436_14336,Gemm_Hipblaslt_TN_9799,1.13044
GemmTunableOp_Half_TN,tn_6144_7575_4096,Gemm_Rocblas_621286678,0.634418
GemmTunableOp_Half_TN,tn_28672_1680_4096,Gemm_Hipblaslt_TN_9223,0.721245
GemmTunableOp_Half_TN,tn_28672_7575_4096,Gemm_Hipblaslt_TN_159,2.96075
GemmTunableOp_Half_TN,tn_6144_1873_4096,Gemm_Hipblaslt_TN_9691,0.16469
GemmTunableOp_Half_TN,tn_4096_104_4096,Gemm_Rocblas_621286278,0.0167806
GemmTunableOp_Half_TN,tn_4096_3612_14336,Gemm_Hipblaslt_TN_9682,0.689102
GemmTunableOp_Half_TN,tn_4096_7345_4096,Gemm_Hipblaslt_TN_9888,0.418431
GemmTunableOp_Half_TN,tn_28672_3300_4096,Gemm_Hipblaslt_TN_9827,1.35466
GemmTunableOp_Half_TN,tn_6144_5390_4096,Gemm_Hipblaslt_TN_9191,0.448922
GemmTunableOp_Half_TN,tn_4096_1738_14336,Gemm_Hipblaslt_TN_9645,0.390995
GemmTunableOp_Half_TN,tn_4096_7093_4096,Gemm_Hipblaslt_TN_9743,0.399611
GemmTunableOp_Half_TN,tn_6144_1603_4096,Gemm_Rocblas_621294495,0.151103
GemmTunableOp_Half_TN,tn_28672_5067_4096,Gemm_Hipblaslt_TN_9849,2.08312
GemmTunableOp_Half_TN,tn_6144_1774_4096,Gemm_Hipblaslt_TN_9690,0.162791
GemmTunableOp_Half_TN,tn_4096_7196_4096,Gemm_Hipblaslt_TN_9743,0.407029
GemmTunableOp_Half_TN,tn_28672_1960_4096,Gemm_Hipblaslt_TN_9846,0.831448
GemmTunableOp_Half_TN,tn_28672_3652_4096,Gemm_Hipblaslt_TN_9827,1.4977
GemmTunableOp_Half_TN,tn_4096_1642_14336,Gemm_Hipblaslt_TN_9265,0.360097
GemmTunableOp_Half_TN,tn_4096_3652_14336,Gemm_Hipblaslt_TN_9217,0.714922
GemmTunableOp_Half_TN,tn_12288_146_4096,Gemm_Rocblas_621286472,0.042934
GemmTunableOp_Half_TN,tn_6144_1743_4096,Gemm_Hipblaslt_TN_9672,0.158737
GemmTunableOp_Half_TN,tn_6144_3768_4096,Gemm_Hipblaslt_TN_9689,0.331158
GemmTunableOp_Half_TN,tn_4096_3793_4096,Gemm_Hipblaslt_TN_9827,0.211801
GemmTunableOp_Half_TN,tn_28672_1739_4096,Gemm_Hipblaslt_TN_9191,0.733683
GemmTunableOp_Half_TN,tn_6144_7182_4096,Gemm_Hipblaslt_TN_9139,0.603956
GemmTunableOp_Half_TN,tn_6144_1842_4096,Gemm_Rocblas_621294425,0.165016
GemmTunableOp_Half_TN,tn_6144_1633_4096,Gemm_Hipblaslt_TN_9570,0.149445
GemmTunableOp_Half_TN,tn_28672_7190_4096,Gemm_Hipblaslt_TN_159,2.86146
GemmTunableOp_Half_TN,tn_128256_143_4096,Gemm_Hipblaslt_TN_9808,0.462003
GemmTunableOp_Half_TN,tn_128256_178_4096,Gemm_Hipblaslt_TN_9818,0.510041
GemmTunableOp_Half_TN,tn_4096_7248_14336,Gemm_Hipblaslt_TN_9743,1.44364
GemmTunableOp_Half_TN,tn_28672_1601_4096,Gemm_Rocblas_621286678,0.699574
GemmTunableOp_Half_TN,tn_4096_3592_4096,Gemm_Hipblaslt_TN_9743,0.199233
GemmTunableOp_Half_TN,tn_4096_3597_4096,Gemm_Hipblaslt_TN_9187,0.200663
GemmTunableOp_Half_TN,tn_128256_33_4096,Gemm_Hipblaslt_TN_9451,0.316806
GemmTunableOp_Half_TN,tn_128256_214_4096,Gemm_Hipblaslt_TN_9937,0.569531
GemmTunableOp_Half_TN,tn_28672_1839_4096,Gemm_Hipblaslt_TN_9684,0.789697
GemmTunableOp_Half_TN,tn_4096_5089_14336,Gemm_Hipblaslt_TN_9799,1.05083
GemmTunableOp_Half_TN,tn_4096_3564_4096,Gemm_Hipblaslt_TN_9221,0.202061
GemmTunableOp_Half_TN,tn_6144_5735_4096,Gemm_Rocblas_621294426,0.499773
GemmTunableOp_Half_TN,tn_4096_1633_4096,Gemm_Hipblaslt_TN_9679,0.105353
GemmTunableOp_Half_TN,tn_4096_5583_4096,Gemm_Hipblaslt_TN_9689,0.331398
GemmTunableOp_Half_TN,tn_4096_1829_4096,Gemm_Hipblaslt_TN_9645,0.119002
GemmTunableOp_Half_TN,tn_28672_6708_4096,Gemm_Hipblaslt_TN_9958,2.68253
GemmTunableOp_Half_TN,tn_4096_1765_14336,Gemm_Hipblaslt_TN_9645,0.393565
GemmTunableOp_Half_TN,tn_4096_7225_4096,Gemm_Hipblaslt_TN_9743,0.403754
GemmTunableOp_Half_TN,tn_4096_3767_4096,Gemm_Hipblaslt_TN_9827,0.212925
GemmTunableOp_Half_TN,tn_4096_1592_4096,Gemm_Hipblaslt_TN_9679,0.104787
GemmTunableOp_Half_TN,tn_4096_5533_14336,Gemm_Hipblaslt_TN_9709,1.14833
GemmTunableOp_Half_TN,tn_28672_1667_4096,Gemm_Hipblaslt_TN_9217,0.71693
GemmTunableOp_Half_TN,tn_4096_8_4096,Gemm_Rocblas_621294130,0.010019
GemmTunableOp_Half_TN,tn_6144_1778_4096,Gemm_Hipblaslt_TN_9799,0.162769
GemmTunableOp_Half_TN,tn_6144_3401_4096,Gemm_Rocblas_621286566,0.306082
GemmTunableOp_Half_TN,tn_4096_5_11008,Gemm_Rocblas_621286323,0.0230981
GemmTunableOp_Half_TN,tn_6144_24_4096,Gemm_Rocblas_621286273,0.0134969
GemmTunableOp_Half_TN,tn_4096_1860_4096,Gemm_Hipblaslt_TN_9645,0.119764
GemmTunableOp_Half_TN,tn_4096_7301_14336,Gemm_Hipblaslt_TN_9749,1.5148
GemmTunableOp_Half_TN,tn_4096_6990_14336,Gemm_Hipblaslt_TN_9694,1.41185
GemmTunableOp_Half_TN,tn_4096_3589_4096,Gemm_Hipblaslt_TN_9743,0.201233
GemmTunableOp_Half_TN,tn_6144_152_4096,Gemm_Rocblas_621294168,0.0272959
GemmTunableOp_Half_TN,tn_6144_1601_4096,Gemm_Rocblas_621286753,0.151279
GemmTunableOp_Half_TN,tn_4096_3383_4096,Gemm_Hipblaslt_TN_9743,0.192768
GemmTunableOp_Half_TN,tn_28672_1733_4096,Gemm_Hipblaslt_TN_9190,0.731869
GemmTunableOp_Half_TN,tn_128256_254_4096,Gemm_Rocblas_621286892,0.604505
GemmTunableOp_Half_TN,tn_4096_1647_14336,Gemm_Hipblaslt_TN_9610,0.36014
GemmTunableOp_Half_TN,tn_28672_5271_4096,Gemm_Hipblaslt_TN_9915,2.14912
GemmStridedBatchedTunableOp_Half_TN,tn_1757_1757_128_B_32,Gemm_Rocblas_621286397,0.124994
GemmStridedBatchedTunableOp_Half_TN,tn_1717_1717_128_B_32,Gemm_Rocblas_621286397,0.121703
GemmStridedBatchedTunableOp_Half_TN,tn_1805_1805_128_B_32,Gemm_Hipblaslt_TN_6942,0.134235
GemmStridedBatchedTunableOp_Half_TN,tn_1733_1733_128_B_32,Gemm_Rocblas_621286397,0.126324
GemmStridedBatchedTunableOp_Half_TN,tn_1594_1594_128_B_32,Gemm_Hipblaslt_TN_6942,0.108792
GemmStridedBatchedTunableOp_Half_TN,tn_1731_1731_128_B_32,Gemm_Rocblas_621286413,0.122824
GemmStridedBatchedTunableOp_Half_TN,tn_1660_1660_128_B_32,Gemm_Rocblas_621286397,0.11385
GemmStridedBatchedTunableOp_Half_TN,tn_1954_1954_128_B_32,Gemm_Hipblaslt_TN_6879,0.155124
GemmStridedBatchedTunableOp_Half_TN,tn_1784_1784_128_B_32,Gemm_Rocblas_621294108,0.125089
GemmStridedBatchedTunableOp_Half_TN,tn_1948_1948_128_B_32,Gemm_Rocblas_621286397,0.152726
GemmStridedBatchedTunableOp_Half_TN,tn_1865_1865_128_B_32,Gemm_Rocblas_621286397,0.144486
GemmStridedBatchedTunableOp_Half_TN,tn_1905_1905_128_B_32,Gemm_Rocblas_621286397,0.14265
GemmStridedBatchedTunableOp_Half_TN,tn_1780_1780_128_B_32,Gemm_Rocblas_621286397,0.127008
GemmStridedBatchedTunableOp_Half_TN,tn_1850_1850_128_B_32,Gemm_Hipblaslt_TN_6942,0.137696
GemmStridedBatchedTunableOp_Half_TN,tn_1847_1847_128_B_32,Gemm_Hipblaslt_TN_6942,0.143583
GemmStridedBatchedTunableOp_Half_TN,tn_1927_1927_128_B_32,Gemm_Rocblas_621286397,0.151266
GemmStridedBatchedTunableOp_Half_TN,tn_1844_1844_128_B_32,Gemm_Rocblas_621286397,0.138035
GemmStridedBatchedTunableOp_Half_TN,tn_1841_1841_128_B_32,Gemm_Hipblaslt_TN_6942,0.138601
GemmStridedBatchedTunableOp_Half_TN,tn_1821_1821_128_B_32,Gemm_Hipblaslt_TN_6942,0.134625
GemmStridedBatchedTunableOp_Half_TN,tn_1913_1913_128_B_32,Gemm_Hipblaslt_TN_6942,0.144188
GemmStridedBatchedTunableOp_Half_TN,tn_1737_1737_128_B_32,Gemm_Rocblas_621286397,0.124449
GemmStridedBatchedTunableOp_Half_TN,tn_1732_1732_128_B_32,Gemm_Rocblas_621286397,0.122217
GemmStridedBatchedTunableOp_Half_TN,tn_1972_1972_128_B_32,Gemm_Rocblas_621286397,0.156698
GemmStridedBatchedTunableOp_Half_TN,tn_1696_1696_128_B_32,Gemm_Rocblas_621286413,0.109688
GemmStridedBatchedTunableOp_Half_TN,tn_1586_1586_128_B_32,Gemm_Rocblas_621286397,0.107486
GemmStridedBatchedTunableOp_Half_TN,tn_1808_1808_128_B_32,Gemm_Rocblas_621286810,0.127286
GemmStridedBatchedTunableOp_Half_TN,tn_1680_1680_128_B_32,Gemm_Rocblas_621286397,0.11154
GemmStridedBatchedTunableOp_Half_TN,tn_1634_1634_128_B_32,Gemm_Hipblaslt_TN_6942,0.112297
GemmStridedBatchedTunableOp_Half_TN,tn_1877_1877_128_B_32,Gemm_Rocblas_621286397,0.143198
GemmStridedBatchedTunableOp_Half_TN,tn_1633_1633_128_B_32,Gemm_Hipblaslt_TN_6942,0.115167
GemmStridedBatchedTunableOp_Half_TN,tn_1738_1738_128_B_32,Gemm_Rocblas_621286397,0.124495
GemmStridedBatchedTunableOp_Half_TN,tn_1952_1952_128_B_32,Gemm_Hipblaslt_TN_153,0.144849
GemmStridedBatchedTunableOp_Half_TN,tn_1879_1879_128_B_32,Gemm_Hipblaslt_TN_6942,0.143972
GemmStridedBatchedTunableOp_Half_TN,tn_1894_1894_128_B_32,Gemm_Rocblas_621286397,0.143963
GemmStridedBatchedTunableOp_Half_TN,tn_1860_1860_128_B_32,Gemm_Hipblaslt_TN_6942,0.138942
GemmStridedBatchedTunableOp_Half_TN,tn_1625_1625_128_B_32,Gemm_Hipblaslt_TN_6942,0.113873
GemmStridedBatchedTunableOp_Half_TN,tn_1866_1866_128_B_32,Gemm_Hipblaslt_TN_6942,0.141917
GemmStridedBatchedTunableOp_Half_TN,tn_1807_1807_128_B_32,Gemm_Hipblaslt_TN_6942,0.135415
GemmStridedBatchedTunableOp_Half_TN,tn_1667_1667_128_B_32,Gemm_Rocblas_621294110,0.117405
GemmStridedBatchedTunableOp_Half_TN,tn_1888_1888_128_B_32,Gemm_Hipblaslt_TN_153,0.132283
GemmStridedBatchedTunableOp_Half_TN,tn_1712_1712_128_B_32,Gemm_Rocblas_621294110,0.112523
GemmStridedBatchedTunableOp_Half_TN,tn_1599_1599_128_B_32,Gemm_Hipblaslt_TN_6939,0.111001
GemmStridedBatchedTunableOp_Half_TN,tn_1708_1708_128_B_32,Gemm_Rocblas_621294110,0.117812
GemmStridedBatchedTunableOp_Half_TN,tn_2305_2305_128_B_32,Gemm_Rocblas_621294542,0.223513
GemmStridedBatchedTunableOp_Half_TN,tn_1585_1585_128_B_32,Gemm_Rocblas_621286397,0.108077
GemmStridedBatchedTunableOp_Half_TN,tn_1750_1750_128_B_32,Gemm_Rocblas_621286397,0.125131
GemmStridedBatchedTunableOp_Half_TN,tn_1573_1573_128_B_32,Gemm_Hipblaslt_TN_6942,0.108024
GemmStridedBatchedTunableOp_Half_TN,tn_1773_1773_128_B_32,Gemm_Rocblas_621294108,0.130429
GemmStridedBatchedTunableOp_Half_TN,tn_1970_1970_128_B_32,Gemm_Rocblas_621286397,0.157377
GemmStridedBatchedTunableOp_Half_TN,tn_2097_2097_128_B_32,Gemm_Rocblas_621294106,0.180096
GemmStridedBatchedTunableOp_Half_TN,tn_1679_1679_128_B_32,Gemm_Hipblaslt_TN_6942,0.118709
GemmStridedBatchedTunableOp_Half_TN,tn_2081_2081_128_B_32,Gemm_Rocblas_621294106,0.17911
GemmStridedBatchedTunableOp_Half_TN,tn_1596_1596_128_B_32,Gemm_Rocblas_621286397,0.104996
GemmStridedBatchedTunableOp_Half_TN,tn_1953_1953_128_B_32,Gemm_Hipblaslt_TN_6879,0.156109
GemmStridedBatchedTunableOp_Half_TN,tn_1646_1646_128_B_32,Gemm_Rocblas_621286397,0.113273
GemmStridedBatchedTunableOp_Half_TN,tn_1983_1983_128_B_32,Gemm_Rocblas_621286397,0.158472
GemmStridedBatchedTunableOp_Half_TN,tn_2273_2273_128_B_32,Gemm_Rocblas_621294106,0.21057
GemmStridedBatchedTunableOp_Half_TN,tn_2257_2257_128_B_32,Gemm_Rocblas_621294106,0.208049
GemmStridedBatchedTunableOp_Half_TN,tn_2274_2274_128_B_32,Gemm_Rocblas_621294106,0.207323
GemmStridedBatchedTunableOp_Half_TN,tn_1763_1763_128_B_32,Gemm_Rocblas_621286397,0.127869
GemmStridedBatchedTunableOp_Half_TN,tn_1892_1892_128_B_32,Gemm_Rocblas_621286397,0.142018
GemmStridedBatchedTunableOp_Half_TN,tn_1600_1600_128_B_32,Gemm_Rocblas_621286412,0.0998605
GemmStridedBatchedTunableOp_Half_TN,tn_1687_1687_128_B_32,Gemm_Hipblaslt_TN_6942,0.117722
GemmStridedBatchedTunableOp_Half_TN,tn_2017_2017_128_B_32,Gemm_Rocblas_621286397,0.164558
GemmStridedBatchedTunableOp_Half_TN,tn_1629_1629_128_B_32,Gemm_Rocblas_621286397,0.113831
GemmStridedBatchedTunableOp_Half_TN,tn_1926_1926_128_B_32,Gemm_Hipblaslt_TN_6879,0.150504
GemmStridedBatchedTunableOp_Half_TN,tn_1665_1665_128_B_32,Gemm_Hipblaslt_TN_6942,0.117532
GemmStridedBatchedTunableOp_Half_TN,tn_2290_2290_128_B_32,Gemm_Rocblas_621294106,0.210626
GemmStridedBatchedTunableOp_Half_TN,tn_1756_1756_128_B_32,Gemm_Rocblas_621286397,0.124517
GemmStridedBatchedTunableOp_Half_TN,tn_2113_2113_128_B_32,Gemm_Rocblas_621294106,0.180661
GemmStridedBatchedTunableOp_Half_TN,tn_1640_1640_128_B_32,Gemm_Rocblas_621286397,0.109316
GemmStridedBatchedTunableOp_Half_TN,tn_1690_1690_128_B_32,Gemm_Rocblas_621286397,0.115591
GemmStridedBatchedTunableOp_Half_TN,tn_1829_1829_128_B_32,Gemm_Hipblaslt_TN_6942,0.138695
GemmStridedBatchedTunableOp_Half_TN,tn_1729_1729_128_B_32,Gemm_Rocblas_621294110,0.123043
GemmStridedBatchedTunableOp_Half_TN,tn_1876_1876_128_B_32,Gemm_Hipblaslt_TN_6942,0.141369
GemmStridedBatchedTunableOp_Half_TN,tn_1838_1838_128_B_32,Gemm_Hipblaslt_TN_6942,0.138646
GemmStridedBatchedTunableOp_Half_TN,tn_1638_1638_128_B_32,Gemm_Rocblas_621286397,0.113214
GemmStridedBatchedTunableOp_Half_TN,tn_1641_1641_128_B_32,Gemm_Rocblas_621286397,0.11522
GemmStridedBatchedTunableOp_Half_TN,tn_1827_1827_128_B_32,Gemm_Hipblaslt_TN_6942,0.138115
GemmStridedBatchedTunableOp_Half_TN,tn_1742_1742_128_B_32,Gemm_Rocblas_621286397,0.123078
GemmStridedBatchedTunableOp_Half_TN,tn_1796_1796_128_B_32,Gemm_Rocblas_621286397,0.134103
GemmStridedBatchedTunableOp_Half_TN,tn_1792_1792_128_B_32,Gemm_Rocblas_621294106,0.100451
GemmStridedBatchedTunableOp_Half_TN,tn_1644_1644_128_B_32,Gemm_Hipblaslt_TN_6942,0.112941
GemmStridedBatchedTunableOp_Half_TN,tn_1658_1658_128_B_32,Gemm_Rocblas_621286397,0.113841
GemmStridedBatchedTunableOp_Half_TN,tn_1631_1631_128_B_32,Gemm_Rocblas_621286397,0.112073
GemmStridedBatchedTunableOp_Half_TN,tn_1815_1815_128_B_32,Gemm_Hipblaslt_TN_6942,0.137813
GemmStridedBatchedTunableOp_Half_TN,tn_1628_1628_128_B_32,Gemm_Rocblas_621286397,0.111635
GemmStridedBatchedTunableOp_Half_TN,tn_1870_1870_128_B_32,Gemm_Hipblaslt_TN_6942,0.138592
GemmStridedBatchedTunableOp_Half_TN,tn_1758_1758_128_B_32,Gemm_Rocblas_621294106,0.125072
GemmStridedBatchedTunableOp_Half_TN,tn_1602_1602_128_B_32,Gemm_Rocblas_621286397,0.108877
GemmStridedBatchedTunableOp_Half_TN,tn_1924_1924_128_B_32,Gemm_Rocblas_621286397,0.146546
GemmStridedBatchedTunableOp_Half_TN,tn_2417_2417_128_B_32,Gemm_Rocblas_621294106,0.238258
GemmStridedBatchedTunableOp_Half_TN,tn_1960_1960_128_B_32,Gemm_Hipblaslt_TN_153,0.151748
GemmStridedBatchedTunableOp_Half_TN,tn_1843_1843_128_B_32,Gemm_Hipblaslt_TN_6942,0.13758
GemmStridedBatchedTunableOp_Half_TN,tn_1615_1615_128_B_32,Gemm_Hipblaslt_TN_6942,0.111136
GemmStridedBatchedTunableOp_Half_TN,tn_1969_1969_128_B_32,Gemm_Rocblas_621286397,0.15863
GemmStridedBatchedTunableOp_Half_TN,tn_1883_1883_128_B_32,Gemm_Hipblaslt_TN_6942,0.14561
GemmStridedBatchedTunableOp_Half_TN,tn_1914_1914_128_B_32,Gemm_Hipblaslt_TN_6942,0.144454
GemmStridedBatchedTunableOp_Half_TN,tn_1922_1922_128_B_32,Gemm_Hipblaslt_TN_6879,0.150371
GemmStridedBatchedTunableOp_Half_TN,tn_1920_1920_128_B_32,Gemm_Rocblas_621294699,0.126687
GemmStridedBatchedTunableOp_Half_TN,tn_1835_1835_128_B_32,Gemm_Rocblas_621286397,0.13766
GemmStridedBatchedTunableOp_Half_TN,tn_1659_1659_128_B_32,Gemm_Hipblaslt_TN_6942,0.117354
GemmStridedBatchedTunableOp_Half_TN,tn_1820_1820_128_B_32,Gemm_Hipblaslt_TN_6942,0.133694
GemmStridedBatchedTunableOp_Half_TN,tn_1706_1706_128_B_32,Gemm_Hipblaslt_TN_6942,0.118225
GemmStridedBatchedTunableOp_Half_TN,tn_1867_1867_128_B_32,Gemm_Hipblaslt_TN_6942,0.143449
GemmStridedBatchedTunableOp_Half_TN,tn_1902_1902_128_B_32,Gemm_Hipblaslt_TN_6942,0.143954
GemmStridedBatchedTunableOp_Half_TN,tn_1779_1779_128_B_32,Gemm_Rocblas_621294108,0.129316
