Gemm_Tune/Llama-2-7b-chat-hf-1000inp/full_tuned2.csv
Validator,PT_VERSION,2.4.0
Validator,ROCM_VERSION,6.1.0.0-82-5fabb4c
Validator,HIPBLASLT_VERSION,0.7.0-1549b021
Validator,GCN_ARCH_NAME,gfx942:sramecc+:xnack-
Validator,ROCBLAS_VERSION,4.1.0-cefa4a9b-dirty
GemmTunableOp_Half_TN,tn_6144_830_4096,Gemm_Rocblas_621294520,0.0883468
GemmTunableOp_Half_TN,tn_128256_237_4096,Gemm_Rocblas_621294634,0.607348
GemmTunableOp_Half_TN,tn_4096_7798_14336,Gemm_Hipblaslt_TN_9738,1.60356
GemmTunableOp_Half_TN,tn_4096_1807_4096,Gemm_Hipblaslt_TN_9645,0.120504
GemmTunableOp_Half_TN,tn_4096_4471_14336,Gemm_Hipblaslt_TN_9698,0.942632
GemmTunableOp_Half_TN,tn_4096_3402_14336,Gemm_Hipblaslt_TN_9697,0.665579
GemmTunableOp_Half_TN,tn_4096_3662_14336,Gemm_Rocblas_621294484,0.716592
GemmTunableOp_Half_TN,tn_28672_830_4096,Gemm_Hipblaslt_TN_9683,0.383281
GemmTunableOp_Half_TN,tn_4096_1757_4096,Gemm_Hipblaslt_TN_9645,0.11688
GemmTunableOp_Half_TN,tn_28672_940_4096,Gemm_Hipblaslt_TN_9684,0.396625
GemmTunableOp_Half_TN,tn_4096_241_4096,Gemm_Rocblas_621286443,0.0260915
GemmTunableOp_Half_TN,tn_4096_985_4096,Gemm_Hipblaslt_TN_9576,0.0718508
GemmTunableOp_Half_TN,tn_6144_873_4096,Gemm_Hipblaslt_TN_9613,0.0919913
GemmTunableOp_Half_TN,tn_6144_807_4096,Gemm_Rocblas_621286778,0.0884462
GemmTunableOp_Half_TN,tn_4096_1726_4096,Gemm_Hipblaslt_TN_9671,0.108469
GemmTunableOp_Half_TN,tn_6144_1805_4096,Gemm_Rocblas_621294425,0.164245
GemmTunableOp_Half_TN,tn_6144_2651_4096,Gemm_Hipblaslt_TN_9749,0.224442
GemmTunableOp_Half_TN,tn_28672_1813_4096,Gemm_Hipblaslt_TN_9832,0.796205
GemmTunableOp_Half_TN,tn_4096_937_4096,Gemm_Hipblaslt_TN_9634,0.0690655
GemmTunableOp_Half_TN,tn_4096_839_14336,Gemm_Hipblaslt_TN_9580,0.224344
GemmTunableOp_Half_TN,tn_28672_937_4096,Gemm_Hipblaslt_TN_9684,0.395832
GemmTunableOp_Half_TN,tn_6144_1864_4096,Gemm_Hipblaslt_TN_9799,0.165434
GemmTunableOp_Half_TN,tn_6144_1693_4096,Gemm_Hipblaslt_TN_9570,0.156674
GemmTunableOp_Half_TN,tn_6144_1733_4096,Gemm_Rocblas_621286609,0.159858
GemmTunableOp_Half_TN,tn_4096_2793_14336,Gemm_Hipblaslt_TN_9799,0.572939
GemmTunableOp_Half_TN,tn_4096_8000_4096,Gemm_Hipblaslt_TN_9933,0.449078
GemmTunableOp_Half_TN,tn_6144_904_4096,Gemm_Hipblaslt_TN_9613,0.0934181
GemmTunableOp_Half_TN,tn_4096_3925_11008,Gemm_Hipblaslt_TN_9768,0.585223
GemmTunableOp_Half_TN,tn_4096_855_4096,Gemm_Hipblaslt_TN_9131,0.0655578
GemmTunableOp_Half_TN,tn_4096_1718_4096,Gemm_Hipblaslt_TN_9265,0.109646
GemmTunableOp_Half_TN,tn_32000_36_4096,Gemm_Hipblaslt_TN_9514,0.0553999
GemmTunableOp_Half_TN,tn_28672_820_4096,Gemm_Hipblaslt_TN_9683,0.382233
GemmTunableOp_Half_TN,tn_4096_884_4096,Gemm_Hipblaslt_TN_9170,0.0667912
GemmTunableOp_Half_TN,tn_28672_1883_4096,Gemm_Hipblaslt_TN_9684,0.793634
GemmTunableOp_Half_TN,tn_4096_929_14336,Gemm_Hipblaslt_TN_9585,0.231726
GemmTunableOp_Half_TN,tn_6144_3670_4096,Gemm_Hipblaslt_TN_9690,0.329327
GemmTunableOp_Half_TN,tn_4096_794_14336,Gemm_Hipblaslt_TN_9158,0.212598
GemmTunableOp_Half_TN,tn_22016_253_4096,Gemm_Hipblaslt_TN_9720,0.102147
GemmTunableOp_Half_TN,tn_4096_880_4096,Gemm_Hipblaslt_TN_9170,0.0659359
GemmTunableOp_Half_TN,tn_4096_2721_14336,Gemm_Hipblaslt_TN_9676,0.566292
GemmTunableOp_Half_TN,tn_4096_895_14336,Gemm_Hipblaslt_TN_9580,0.219771
GemmTunableOp_Half_TN,tn_4096_3813_11008,Gemm_Hipblaslt_TN_9768,0.574353
GemmTunableOp_Half_TN,tn_28672_1718_4096,Gemm_Hipblaslt_TN_9217,0.732808
GemmTunableOp_Half_TN,tn_6144_875_4096,Gemm_Hipblaslt_TN_9613,0.0923809
GemmTunableOp_Half_TN,tn_12288_4083_4096,Gemm_Hipblaslt_TN_9768,0.688923
GemmTunableOp_Half_TN,tn_4096_985_14336,Gemm_Hipblaslt_TN_9586,0.246885
GemmTunableOp_Half_TN,tn_128256_165_4096,Gemm_Hipblaslt_TN_9953,0.504842
GemmTunableOp_Half_TN,tn_4096_3923_11008,Gemm_Hipblaslt_TN_9768,0.582928
GemmTunableOp_Half_TN,tn_6144_3402_4096,Gemm_Rocblas_621286753,0.311418
GemmTunableOp_Half_TN,tn_4096_830_14336,Gemm_Hipblaslt_TN_9158,0.21432
GemmTunableOp_Half_TN,tn_28672_834_4096,Gemm_Hipblaslt_TN_9684,0.384721
GemmTunableOp_Half_TN,tn_128256_100_4096,Gemm_Hipblaslt_TN_9868,0.421621
GemmTunableOp_Half_TN,tn_4096_811_4096,Gemm_Hipblaslt_TN_9131,0.0642323
GemmTunableOp_Half_TN,tn_4096_832_4096,Gemm_Hipblaslt_TN_9634,0.0650062
GemmTunableOp_Half_TN,tn_128256_226_4096,Gemm_Rocblas_621286892,0.590632
GemmTunableOp_Half_TN,tn_4096_2785_4096,Gemm_Hipblaslt_TN_9709,0.165698
GemmTunableOp_Half_TN,tn_4096_2000_11008,Gemm_Hipblaslt_TN_9645,0.326649
GemmTunableOp_Half_TN,tn_6144_853_4096,Gemm_Rocblas_621286778,0.0878619
GemmTunableOp_Half_TN,tn_4096_1701_4096,Gemm_Hipblaslt_TN_9679,0.107721
GemmTunableOp_Half_TN,tn_4096_104_14336,Gemm_Hipblaslt_TN_7160,0.0440521
GemmTunableOp_Half_TN,tn_4096_847_4096,Gemm_Hipblaslt_TN_9634,0.0650418
GemmTunableOp_Half_TN,tn_4096_1694_14336,Gemm_Hipblaslt_TN_9790,0.369407
GemmTunableOp_Half_TN,tn_4096_1715_4096,Gemm_Hipblaslt_TN_9265,0.1087
GemmTunableOp_Half_TN,tn_28672_879_4096,Gemm_Hipblaslt_TN_9684,0.389108
GemmTunableOp_Half_TN,tn_128256_142_4096,Gemm_Hipblaslt_TN_9808,0.468705
GemmTunableOp_Half_TN,tn_28672_2602_4096,Gemm_Hipblaslt_TN_9827,1.07905
GemmTunableOp_Half_TN,tn_28672_7266_4096,Gemm_Hipblaslt_TN_159,2.9429
GemmTunableOp_Half_TN,tn_28672_951_4096,Gemm_Hipblaslt_TN_9684,0.399222
GemmTunableOp_Half_TN,tn_128256_223_4096,Gemm_Hipblaslt_TN_9937,0.57087
GemmTunableOp_Half_TN,tn_28672_3447_4096,Gemm_Hipblaslt_TN_9827,1.36783
GemmTunableOp_Half_TN,tn_28672_1867_4096,Gemm_Hipblaslt_TN_9683,0.801928
GemmTunableOp_Half_TN,tn_4096_868_14336,Gemm_Hipblaslt_TN_9580,0.218639
GemmTunableOp_Half_TN,tn_4096_128_4096,Gemm_Rocblas_621286279,0.0169101
GemmTunableOp_Half_TN,tn_4096_254_11008,Gemm_Hipblaslt_TN_7618,0.0677327
GemmTunableOp_Half_TN,tn_4096_1755_14336,Gemm_Hipblaslt_TN_9645,0.394853
GemmTunableOp_Half_TN,tn_128256_201_4096,Gemm_Hipblaslt_TN_9937,0.558567
GemmTunableOp_Half_TN,tn_6144_1724_4096,Gemm_Rocblas_621286753,0.15658
GemmTunableOp_Half_TN,tn_4096_248_4096,Gemm_Rocblas_621286491,0.0265531
GemmTunableOp_Half_TN,tn_4096_7817_4096,Gemm_Rocblas_621294127,0.443679
GemmTunableOp_Half_TN,tn_4096_216_14336,Gemm_Hipblaslt_TN_9363,0.069996
GemmTunableOp_Half_TN,tn_128256_246_4096,Gemm_Rocblas_621294634,0.6123
GemmTunableOp_Half_TN,tn_128256_253_4096,Gemm_Rocblas_621294634,0.610257
GemmTunableOp_Half_TN,tn_128256_144_4096,Gemm_Hipblaslt_TN_9775,0.465625
GemmTunableOp_Half_TN,tn_4096_2734_14336,Gemm_Hipblaslt_TN_9799,0.567353
GemmTunableOp_Half_TN,tn_6144_2592_4096,Gemm_Hipblaslt_TN_9191,0.219924
GemmTunableOp_Half_TN,tn_128256_90_4096,Gemm_Hipblaslt_TN_9057,0.390874
GemmTunableOp_Half_TN,tn_6144_1695_4096,Gemm_Rocblas_621286753,0.155313
GemmTunableOp_Half_TN,tn_128256_240_4096,Gemm_Rocblas_621294648,0.608452
GemmTunableOp_Half_TN,tn_4096_72_14336,Gemm_Hipblaslt_TN_9294,0.0394984
GemmTunableOp_Half_TN,tn_128256_63_4096,Gemm_Rocblas_621294557,0.359849
GemmTunableOp_Half_TN,tn_28672_835_4096,Gemm_Hipblaslt_TN_9683,0.38695
GemmTunableOp_Half_TN,tn_4096_1834_4096,Gemm_Hipblaslt_TN_9645,0.119656
GemmTunableOp_Half_TN,tn_12288_27_4096,Gemm_Rocblas_621294154,0.0231913
GemmTunableOp_Half_TN,tn_4096_893_4096,Gemm_Hipblaslt_TN_9170,0.0663802
GemmTunableOp_Half_TN,tn_4096_11_11008,Gemm_Rocblas_621294135,0.0240233
GemmTunableOp_Half_TN,tn_128256_108_4096,Gemm_Hipblaslt_TN_9596,0.42675
GemmTunableOp_Half_TN,tn_6144_8110_4096,Gemm_Hipblaslt_TN_9753,0.682256
GemmTunableOp_Half_TN,tn_4096_7823_14336,Gemm_Hipblaslt_TN_9738,1.59748
GemmTunableOp_Half_TN,tn_6144_1881_4096,Gemm_Hipblaslt_TN_9799,0.167049
GemmTunableOp_Half_TN,tn_128256_91_4096,Gemm_Hipblaslt_TN_9057,0.400907
GemmTunableOp_Half_TN,tn_32000_226_4096,Gemm_Hipblaslt_TN_9845,0.144619
GemmTunableOp_Half_TN,tn_4096_2560_14336,Gemm_Hipblaslt_TN_9799,0.527563
GemmTunableOp_Half_TN,tn_28672_8110_4096,Gemm_Hipblaslt_TN_9890,3.33334
GemmTunableOp_Half_TN,tn_4096_831_4096,Gemm_Hipblaslt_TN_9634,0.0636626
GemmTunableOp_Half_TN,tn_12288_248_4096,Gemm_Rocblas_621294215,0.0592946
GemmTunableOp_Half_TN,tn_4096_5606_14336,Gemm_Hipblaslt_TN_9799,1.17386
GemmTunableOp_Half_TN,tn_4096_24_4096,Gemm_Rocblas_621286328,0.0115259
GemmTunableOp_Half_TN,tn_4096_2818_11008,Gemm_Hipblaslt_TN_9566,0.438123
GemmTunableOp_Half_TN,tn_12288_8_4096,Gemm_Rocblas_621286318,0.0214747
GemmTunableOp_Half_TN,tn_4096_930_4096,Gemm_Hipblaslt_TN_9604,0.0700648
GemmTunableOp_Half_TN,tn_4096_240_4096,Gemm_Rocblas_621286445,0.0262866
GemmTunableOp_Half_TN,tn_4096_886_14336,Gemm_Hipblaslt_TN_9580,0.219214
GemmTunableOp_Half_TN,tn_12288_231_4096,Gemm_Rocblas_621294215,0.0587292
GemmTunableOp_Half_TN,tn_4096_906_4096,Gemm_Hipblaslt_TN_9604,0.0688248
GemmTunableOp_Half_TN,tn_22016_238_4096,Gemm_Hipblaslt_TN_9720,0.100204
GemmTunableOp_Half_TN,tn_12288_3530_4096,Gemm_Hipblaslt_TN_9677,0.598473
GemmTunableOp_Half_TN,tn_28672_868_4096,Gemm_Hipblaslt_TN_9684,0.39034
GemmTunableOp_Half_TN,tn_4096_7436_14336,Gemm_Hipblaslt_TN_9738,1.55583
GemmTunableOp_Half_TN,tn_22016_240_4096,Gemm_Hipblaslt_TN_9720,0.099952
GemmTunableOp_Half_TN,tn_4096_1944_14336,Gemm_Hipblaslt_TN_9592,0.418779
GemmTunableOp_Half_TN,tn_22016_2750_4096,Gemm_Hipblaslt_TN_9827,0.892466
GemmTunableOp_Half_TN,tn_6144_876_4096,Gemm_Hipblaslt_TN_9613,0.0922483
GemmTunableOp_Half_TN,tn_22016_230_4096,Gemm_Hipblaslt_TN_9720,0.100103
GemmTunableOp_Half_TN,tn_12288_2938_4096,Gemm_Rocblas_621286575,0.512841
GemmTunableOp_Half_TN,tn_4096_3577_4096,Gemm_Hipblaslt_TN_9743,0.203163
GemmTunableOp_Half_TN,tn_28672_1743_4096,Gemm_Rocblas_621286678,0.735966
GemmTunableOp_Half_TN,tn_22016_223_4096,Gemm_Hipblaslt_TN_9720,0.0975753
GemmTunableOp_Half_TN,tn_4096_2750_4096,Gemm_Hipblaslt_TN_9799,0.166314
GemmTunableOp_Half_TN,tn_4096_1867_14336,Gemm_Hipblaslt_TN_9645,0.415064
GemmTunableOp_Half_TN,tn_4096_4096_11008,Gemm_Hipblaslt_TN_9655,0.60122
GemmTunableOp_Half_TN,tn_28672_882_4096,Gemm_Hipblaslt_TN_9684,0.391864
GemmTunableOp_Half_TN,tn_32000_220_4096,Gemm_Hipblaslt_TN_9590,0.139928
GemmTunableOp_Half_TN,tn_6144_2719_4096,Gemm_Hipblaslt_TN_9742,0.254015
GemmTunableOp_Half_TN,tn_12288_2754_4096,Gemm_Hipblaslt_TN_9691,0.49722
GemmTunableOp_Half_TN,tn_4096_1737_4096,Gemm_Hipblaslt_TN_9645,0.11592
GemmTunableOp_Half_TN,tn_6144_8192_4096,Gemm_Hipblaslt_TN_9655,0.682704
GemmTunableOp_Half_TN,tn_22016_4083_4096,Gemm_Hipblaslt_TN_9841,1.29976
GemmTunableOp_Half_TN,tn_28672_2699_4096,Gemm_Hipblaslt_TN_9787,1.17265
GemmTunableOp_Half_TN,tn_128256_160_4096,Gemm_Hipblaslt_TN_9623,0.466403
GemmTunableOp_Half_TN,tn_128256_30_4096,Gemm_Rocblas_621286354,0.319615
GemmTunableOp_Half_TN,tn_4096_7809_4096,Gemm_Hipblaslt_TN_9914,0.442644
GemmTunableOp_Half_TN,tn_4096_796_14336,Gemm_Hipblaslt_TN_9147,0.214417
GemmTunableOp_Half_TN,tn_6144_957_4096,Gemm_Hipblaslt_TN_9561,0.0956782
GemmTunableOp_Half_TN,tn_4096_3785_4096,Gemm_Hipblaslt_TN_9827,0.214762
GemmTunableOp_Half_TN,tn_4096_895_4096,Gemm_Hipblaslt_TN_9604,0.0678201
GemmTunableOp_Half_TN,tn_4096_2798_4096,Gemm_Rocblas_621294426,0.167499
GemmTunableOp_Half_TN,tn_6144_2708_4096,Gemm_Hipblaslt_TN_9742,0.25258
GemmTunableOp_Half_TN,tn_6144_944_4096,Gemm_Hipblaslt_TN_9133,0.0943892
GemmTunableOp_Half_TN,tn_4096_240_11008,Gemm_Hipblaslt_TN_9303,0.0653776
GemmTunableOp_Half_TN,tn_4096_8049_14336,Gemm_Hipblaslt_TN_9738,1.63481
GemmTunableOp_Half_TN,tn_4096_3671_4096,Gemm_Hipblaslt_TN_9768,0.210773
GemmTunableOp_Half_TN,tn_4096_3000_4096,Gemm_Hipblaslt_TN_9709,0.175193
GemmTunableOp_Half_TN,tn_4096_3717_4096,Gemm_Hipblaslt_TN_9841,0.214484
GemmTunableOp_Half_TN,tn_6144_1742_4096,Gemm_Hipblaslt_TN_9799,0.159183
GemmTunableOp_Half_TN,tn_4096_849_14336,Gemm_Hipblaslt_TN_9580,0.219426
GemmTunableOp_Half_TN,tn_28672_852_4096,Gemm_Hipblaslt_TN_9192,0.38711
GemmTunableOp_Half_TN,tn_4096_2398_4096,Gemm_Hipblaslt_TN_9698,0.144658
GemmTunableOp_Half_TN,tn_128256_171_4096,Gemm_Hipblaslt_TN_9953,0.510543
GemmTunableOp_Half_TN,tn_12288_240_4096,Gemm_Rocblas_621294215,0.0593646
GemmTunableOp_Half_TN,tn_4096_2544_14336,Gemm_Hipblaslt_TN_9799,0.523883
GemmTunableOp_Half_TN,tn_4096_1813_14336,Gemm_Hipblaslt_TN_9136,0.408186
GemmTunableOp_Half_TN,tn_28672_1831_4096,Gemm_Hipblaslt_TN_9684,0.793122
GemmTunableOp_Half_TN,tn_4096_236_11008,Gemm_Hipblaslt_TN_9303,0.0649062
GemmTunableOp_Half_TN,tn_32000_233_4096,Gemm_Rocblas_621286974,0.145835
GemmTunableOp_Half_TN,tn_4096_1000_11008,Gemm_Hipblaslt_TN_9640,0.195185
GemmTunableOp_Half_TN,tn_6144_795_4096,Gemm_Hipblaslt_TN_9253,0.0867091
GemmTunableOp_Half_TN,tn_32000_227_4096,Gemm_Rocblas_621286974,0.146993
GemmTunableOp_Half_TN,tn_4096_1813_4096,Gemm_Hipblaslt_TN_9602,0.118355
GemmTunableOp_Half_TN,tn_4096_223_11008,Gemm_Hipblaslt_TN_9301,0.0610775
GemmTunableOp_Half_TN,tn_4096_7266_14336,Gemm_Hipblaslt_TN_9743,1.45101
GemmTunableOp_Half_TN,tn_12288_244_4096,Gemm_Rocblas_621294215,0.0594479
GemmTunableOp_Half_TN,tn_4096_2850_11008,Gemm_Hipblaslt_TN_9566,0.445043
GemmTunableOp_Half_TN,tn_4096_29_4096,Gemm_Rocblas_621294139,0.0115357
GemmTunableOp_Half_TN,tn_28672_889_4096,Gemm_Hipblaslt_TN_9683,0.391828
GemmTunableOp_Half_TN,tn_6144_986_4096,Gemm_Hipblaslt_TN_9180,0.102206
GemmTunableOp_Half_TN,tn_4096_3243_11008,Gemm_Hipblaslt_TN_9683,0.498384
GemmTunableOp_Half_TN,tn_6144_832_4096,Gemm_Rocblas_621286778,0.0893961
GemmTunableOp_Half_TN,tn_28672_923_4096,Gemm_Hipblaslt_TN_9683,0.395413
GemmTunableOp_Half_TN,tn_4096_984_4096,Gemm_Hipblaslt_TN_9576,0.0717283
GemmTunableOp_Half_TN,tn_22016_235_4096,Gemm_Hipblaslt_TN_9720,0.0991802
GemmTunableOp_Half_TN,tn_4096_1807_14336,Gemm_Hipblaslt_TN_9137,0.41015
GemmTunableOp_Half_TN,tn_4096_1700_14336,Gemm_Hipblaslt_TN_9671,0.370169
GemmTunableOp_Half_TN,tn_4096_869_14336,Gemm_Hipblaslt_TN_9580,0.216467
GemmTunableOp_Half_TN,tn_28672_176_4096,Gemm_Hipblaslt_TN_7286,0.0974146
GemmTunableOp_Half_TN,tn_6144_959_4096,Gemm_Hipblaslt_TN_9613,0.094678
GemmTunableOp_Half_TN,tn_4096_4051_11008,Gemm_Hipblaslt_TN_9190,0.5995
GemmTunableOp_Half_TN,tn_4096_2681_14336,Gemm_Hipblaslt_TN_9799,0.548117
GemmTunableOp_Half_TN,tn_6144_961_4096,Gemm_Hipblaslt_TN_9633,0.100437
GemmTunableOp_Half_TN,tn_4096_88_4096,Gemm_Rocblas_621286280,0.0153251
GemmTunableOp_Half_TN,tn_4096_7804_4096,Gemm_Hipblaslt_TN_9753,0.441168
GemmTunableOp_Half_TN,tn_22016_4051_4096,Gemm_Hipblaslt_TN_9827,1.30846
GemmTunableOp_Half_TN,tn_4096_1746_4096,Gemm_Hipblaslt_TN_9645,0.117521
GemmTunableOp_Half_TN,tn_4096_911_14336,Gemm_Hipblaslt_TN_9634,0.230286
GemmTunableOp_Half_TN,tn_4096_27_11008,Gemm_Rocblas_621286305,0.0242793
GemmTunableOp_Half_TN,tn_4096_825_14336,Gemm_Hipblaslt_TN_9147,0.214505
GemmTunableOp_Half_TN,tn_128256_212_4096,Gemm_Hipblaslt_TN_9937,0.572422
GemmTunableOp_Half_TN,tn_4096_920_14336,Gemm_Hipblaslt_TN_9585,0.232682
GemmTunableOp_Half_TN,tn_28672_2732_4096,Gemm_Hipblaslt_TN_9917,1.18225
GemmTunableOp_Half_TN,tn_22016_228_4096,Gemm_Hipblaslt_TN_9720,0.0989035
GemmTunableOp_Half_TN,tn_4096_873_14336,Gemm_Hipblaslt_TN_9580,0.217654
GemmTunableOp_Half_TN,tn_32000_8_4096,Gemm_Rocblas_621294053,0.0486673
GemmTunableOp_Half_TN,tn_28672_936_4096,Gemm_Hipblaslt_TN_9684,0.396773
GemmTunableOp_Half_TN,tn_4096_830_4096,Gemm_Hipblaslt_TN_9634,0.0646001
GemmTunableOp_Half_TN,tn_128256_232_4096,Gemm_Rocblas_621286892,0.601173
GemmTunableOp_Half_TN,tn_4096_2770_4096,Gemm_Hipblaslt_TN_9799,0.166539
GemmTunableOp_Half_TN,tn_22016_2930_4096,Gemm_Hipblaslt_TN_9827,0.915977
GemmTunableOp_Half_TN,tn_12288_4035_4096,Gemm_Rocblas_621294435,0.686025
GemmTunableOp_Half_TN,tn_4096_977_4096,Gemm_Hipblaslt_TN_9634,0.0718932
GemmTunableOp_Half_TN,tn_28672_1763_4096,Gemm_Hipblaslt_TN_9190,0.74346
GemmTunableOp_Half_TN,tn_6144_785_4096,Gemm_Hipblaslt_TN_9253,0.0865422
GemmTunableOp_Half_TN,tn_28672_914_4096,Gemm_Hipblaslt_TN_9684,0.397581
GemmTunableOp_Half_TN,tn_22016_2778_4096,Gemm_Hipblaslt_TN_9827,0.897523
GemmTunableOp_Half_TN,tn_28672_862_4096,Gemm_Hipblaslt_TN_9684,0.386525
GemmTunableOp_Half_TN,tn_4096_1897_14336,Gemm_Hipblaslt_TN_9645,0.41612
GemmTunableOp_Half_TN,tn_32000_24_4096,Gemm_Hipblaslt_TN_7468,0.0516066
GemmTunableOp_Half_TN,tn_6144_817_4096,Gemm_Rocblas_621294520,0.0865633
GemmTunableOp_Half_TN,tn_22016_3535_4096,Gemm_Hipblaslt_TN_9841,1.09133
GemmTunableOp_Half_TN,tn_6144_2722_4096,Gemm_Hipblaslt_TN_9742,0.25252
GemmTunableOp_Half_TN,tn_4096_3953_4096,Gemm_Hipblaslt_TN_9768,0.222196
GemmTunableOp_Half_TN,tn_4096_219_4096,Gemm_Rocblas_621286491,0.0251623
GemmTunableOp_Half_TN,tn_28672_1905_4096,Gemm_Hipblaslt_TN_9684,0.799242
GemmTunableOp_Half_TN,tn_22016_218_4096,Gemm_Hipblaslt_TN_9720,0.0984052
GemmTunableOp_Half_TN,tn_128256_169_4096,Gemm_Hipblaslt_TN_9953,0.508889
GemmTunableOp_Half_TN,tn_6144_1837_4096,Gemm_Hipblaslt_TN_9799,0.166881
GemmTunableOp_Half_TN,tn_4096_168_4096,Gemm_Rocblas_621286491,0.0227429
GemmTunableOp_Half_TN,tn_6144_2672_4096,Gemm_Hipblaslt_TN_9768,0.223904
GemmTunableOp_Half_TN,tn_22016_233_4096,Gemm_Hipblaslt_TN_9720,0.0988706
GemmTunableOp_Half_TN,tn_12288_34_4096,Gemm_Rocblas_621286462,0.0255044
GemmTunableOp_Half_TN,tn_4096_16_11008,Gemm_Rocblas_621286312,0.0226533
GemmTunableOp_Half_TN,tn_6144_951_4096,Gemm_Hipblaslt_TN_9561,0.0933741
GemmTunableOp_Half_TN,tn_4096_3430_4096,Gemm_Hipblaslt_TN_9743,0.196105
GemmTunableOp_Half_TN,tn_12288_7_4096,Gemm_Rocblas_621294052,0.0213621
GemmTunableOp_Half_TN,tn_28672_972_4096,Gemm_Hipblaslt_TN_9631,0.441441
GemmTunableOp_Half_TN,tn_128256_217_4096,Gemm_Hipblaslt_TN_9919,0.571577
GemmTunableOp_Half_TN,tn_12288_4051_4096,Gemm_Hipblaslt_TN_9749,0.688673
GemmTunableOp_Half_TN,tn_4096_889_4096,Gemm_Hipblaslt_TN_9634,0.066411
GemmTunableOp_Half_TN,tn_6144_7283_4096,Gemm_Hipblaslt_TN_9814,0.609558
GemmTunableOp_Half_TN,tn_4096_238_11008,Gemm_Hipblaslt_TN_9303,0.0640068
GemmTunableOp_Half_TN,tn_12288_1261_4096,Gemm_Hipblaslt_TN_9217,0.219784
GemmTunableOp_Half_TN,tn_6144_912_4096,Gemm_Hipblaslt_TN_9611,0.0934713
GemmTunableOp_Half_TN,tn_128256_41_4096,Gemm_Hipblaslt_TN_9451,0.324719
GemmTunableOp_Half_TN,tn_32000_246_4096,Gemm_Hipblaslt_TN_9665,0.148808
GemmTunableOp_Half_TN,tn_128256_57_4096,Gemm_Rocblas_621286813,0.361005
GemmTunableOp_Half_TN,tn_22016_245_4096,Gemm_Hipblaslt_TN_9641,0.102722
GemmTunableOp_Half_TN,tn_4096_3621_4096,Gemm_Hipblaslt_TN_9221,0.201365
GemmTunableOp_Half_TN,tn_4096_2962_11008,Gemm_Hipblaslt_TN_9709,0.459116
GemmTunableOp_Half_TN,tn_12288_3953_4096,Gemm_Hipblaslt_TN_9753,0.665668
GemmTunableOp_Half_TN,tn_4096_1828_4096,Gemm_Hipblaslt_TN_9645,0.119757
GemmTunableOp_Half_TN,tn_28672_903_4096,Gemm_Hipblaslt_TN_9683,0.394528
GemmTunableOp_Half_TN,tn_12288_256_4096,Gemm_Rocblas_621286478,0.0577117
GemmTunableOp_Half_TN,tn_4096_4000_4096,Gemm_Rocblas_621294030,0.222614
GemmTunableOp_Half_TN,tn_4096_805_4096,Gemm_Hipblaslt_TN_9604,0.0638246
GemmTunableOp_Half_TN,tn_4096_160_14336,Gemm_Hipblaslt_TN_7219,0.0554473
GemmTunableOp_Half_TN,tn_28672_934_4096,Gemm_Hipblaslt_TN_9683,0.397525
GemmTunableOp_Half_TN,tn_4096_1827_4096,Gemm_Hipblaslt_TN_9645,0.119445
GemmTunableOp_Half_TN,tn_12288_255_4096,Gemm_Rocblas_621286478,0.0597837
GemmTunableOp_Half_TN,tn_128256_35_4096,Gemm_Hipblaslt_TN_9451,0.321606
GemmTunableOp_Half_TN,tn_4096_1715_14336,Gemm_Hipblaslt_TN_9790,0.369995
GemmTunableOp_Half_TN,tn_28672_790_4096,Gemm_Hipblaslt_TN_9674,0.355422
GemmTunableOp_Half_TN,tn_28672_8049_4096,Gemm_Hipblaslt_TN_159,3.18864
GemmTunableOp_Half_TN,tn_28672_971_4096,Gemm_Hipblaslt_TN_9666,0.436835
GemmTunableOp_Half_TN,tn_4096_2788_4096,Gemm_Hipblaslt_TN_9799,0.16408
GemmTunableOp_Half_TN,tn_12288_33_4096,Gemm_Rocblas_621294171,0.0253858
GemmTunableOp_Half_TN,tn_4096_2826_4096,Gemm_Hipblaslt_TN_9799,0.169373
GemmTunableOp_Half_TN,tn_22016_3173_4096,Gemm_Hipblaslt_TN_9832,1.00726
GemmTunableOp_Half_TN,tn_4096_823_4096,Gemm_Hipblaslt_TN_9604,0.0638243
GemmTunableOp_Half_TN,tn_128256_29_4096,Gemm_Rocblas_621294226,0.318928
GemmTunableOp_Half_TN,tn_6144_829_4096,Gemm_Rocblas_621294520,0.0877372
GemmTunableOp_Half_TN,tn_4096_3451_11008,Gemm_Hipblaslt_TN_9683,0.521471
GemmTunableOp_Half_TN,tn_4096_2708_14336,Gemm_Hipblaslt_TN_9799,0.556291
GemmTunableOp_Half_TN,tn_6144_837_4096,Gemm_Rocblas_621294520,0.0888527
GemmTunableOp_Half_TN,tn_12288_2898_4096,Gemm_Hipblaslt_TN_9691,0.515371
GemmTunableOp_Half_TN,tn_22016_256_4096,Gemm_Hipblaslt_TN_9720,0.102165
GemmTunableOp_Half_TN,tn_4096_948_4096,Gemm_Hipblaslt_TN_9576,0.0700768
GemmTunableOp_Half_TN,tn_4096_24_11008,Gemm_Rocblas_621286305,0.0240317
GemmTunableOp_Half_TN,tn_4096_957_4096,Gemm_Hipblaslt_TN_9576,0.0696516
GemmTunableOp_Half_TN,tn_4096_885_14336,Gemm_Hipblaslt_TN_9580,0.220315
GemmTunableOp_Half_TN,tn_4096_254_4096,Gemm_Rocblas_621294230,0.02645
GemmTunableOp_Half_TN,tn_22016_2978_4096,Gemm_Hipblaslt_TN_9827,0.917098
GemmTunableOp_Half_TN,tn_4096_819_4096,Gemm_Hipblaslt_TN_9634,0.0636426
GemmTunableOp_Half_TN,tn_6144_2590_4096,Gemm_Hipblaslt_TN_9749,0.22069
GemmTunableOp_Half_TN,tn_22016_4096_4096,Gemm_Hipblaslt_TN_9840,1.28908
GemmTunableOp_Half_TN,tn_22016_3333_4096,Gemm_Hipblaslt_TN_9841,1.08658
GemmTunableOp_Half_TN,tn_128256_122_4096,Gemm_Rocblas_621294762,0.430415
GemmTunableOp_Half_TN,tn_22016_29_4096,Gemm_Rocblas_621294191,0.0365436
GemmTunableOp_Half_TN,tn_4096_3451_4096,Gemm_Hipblaslt_TN_9189,0.197136
GemmTunableOp_Half_TN,tn_4096_231_4096,Gemm_Rocblas_621286491,0.025975
GemmTunableOp_Half_TN,tn_4096_255_4096,Gemm_Rocblas_621286443,0.0263424
GemmTunableOp_Half_TN,tn_4096_236_4096,Gemm_Rocblas_621286491,0.0259629
GemmTunableOp_Half_TN,tn_12288_3923_4096,Gemm_Hipblaslt_TN_9704,0.662623
GemmTunableOp_Half_TN,tn_4096_231_11008,Gemm_Hipblaslt_TN_8879,0.0636435
GemmTunableOp_Half_TN,tn_128256_143_4096,Gemm_Hipblaslt_TN_9808,0.47105
GemmTunableOp_Half_TN,tn_32000_31_4096,Gemm_Rocblas_621286346,0.0523147
GemmTunableOp_Half_TN,tn_12288_1293_4096,Gemm_Rocblas_621294484,0.220058
GemmTunableOp_Half_TN,tn_28672_1744_4096,Gemm_Hipblaslt_TN_9223,0.736279
GemmTunableOp_Half_TN,tn_12288_4096_4096,Gemm_Hipblaslt_TN_9768,0.693155
GemmTunableOp_Half_TN,tn_6144_1743_4096,Gemm_Hipblaslt_TN_9672,0.160113
GemmTunableOp_Half_TN,tn_4096_1727_14336,Gemm_Hipblaslt_TN_9265,0.370421
GemmTunableOp_Half_TN,tn_4096_2788_14336,Gemm_Hipblaslt_TN_9799,0.571348
GemmTunableOp_Half_TN,tn_12288_3987_4096,Gemm_Hipblaslt_TN_9753,0.667375
GemmTunableOp_Half_TN,tn_4096_916_14336,Gemm_Hipblaslt_TN_9634,0.230604
GemmTunableOp_Half_TN,tn_4096_2734_4096,Gemm_Hipblaslt_TN_9674,0.165164
GemmTunableOp_Half_TN,tn_4096_221_4096,Gemm_Rocblas_621294230,0.0254791
GemmTunableOp_Half_TN,tn_128256_13_4096,Gemm_Hipblaslt_TN_9405,0.29189
GemmTunableOp_Half_TN,tn_128256_21_4096,Gemm_Rocblas_621294578,0.313776
GemmTunableOp_Half_TN,tn_28672_823_4096,Gemm_Hipblaslt_TN_9683,0.383342
GemmTunableOp_Half_TN,tn_4096_224_14336,Gemm_Hipblaslt_TN_7378,0.0723288
GemmTunableOp_Half_TN,tn_4096_1759_4096,Gemm_Hipblaslt_TN_9645,0.117408
GemmTunableOp_Half_TN,tn_28672_849_4096,Gemm_Hipblaslt_TN_9683,0.383745
GemmTunableOp_Half_TN,tn_128256_181_4096,Gemm_Hipblaslt_TN_9956,0.511526
GemmTunableOp_Half_TN,tn_4096_3717_11008,Gemm_Hipblaslt_TN_9749,0.559806
GemmTunableOp_Half_TN,tn_128256_231_4096,Gemm_Rocblas_621286892,0.600684
GemmTunableOp_Half_TN,tn_6144_851_4096,Gemm_Rocblas_621286778,0.0882258
GemmTunableOp_Half_TN,tn_4096_96_14336,Gemm_Hipblaslt_TN_8036,0.0412858
GemmTunableOp_Half_TN,tn_6144_5606_4096,Gemm_Hipblaslt_TN_9690,0.504561
GemmTunableOp_Half_TN,tn_28672_2670_4096,Gemm_Hipblaslt_TN_9841,1.0958
GemmTunableOp_Half_TN,tn_4096_4471_4096,Gemm_Hipblaslt_TN_9742,0.267132
GemmTunableOp_Half_TN,tn_6144_899_4096,Gemm_Hipblaslt_TN_9133,0.0932988
GemmTunableOp_Half_TN,tn_4096_2628_4096,Gemm_Hipblaslt_TN_9657,0.161141
GemmTunableOp_Half_TN,tn_28672_192_4096,Gemm_Hipblaslt_TN_7286,0.0971549
GemmTunableOp_Half_TN,tn_4096_2786_14336,Gemm_Hipblaslt_TN_9799,0.572627
GemmTunableOp_Half_TN,tn_6144_184_4096,Gemm_Rocblas_621286443,0.0283334
GemmTunableOp_Half_TN,tn_128256_176_4096,Gemm_Hipblaslt_TN_9661,0.509071
GemmTunableOp_Half_TN,tn_4096_3972_4096,Gemm_Hipblaslt_TN_9713,0.225403
GemmTunableOp_Half_TN,tn_4096_1841_4096,Gemm_Hipblaslt_TN_9645,0.120374
GemmTunableOp_Half_TN,tn_4096_845_14336,Gemm_Hipblaslt_TN_9580,0.217528
GemmTunableOp_Half_TN,tn_4096_984_14336,Gemm_Hipblaslt_TN_9586,0.246282
GemmTunableOp_Half_TN,tn_28672_3662_4096,Gemm_Hipblaslt_TN_9827,1.50312
GemmTunableOp_Half_TN,tn_4096_2599_4096,Gemm_Hipblaslt_TN_9799,0.161335
GemmTunableOp_Half_TN,tn_28672_2517_4096,Gemm_Hipblaslt_TN_9846,1.03723
GemmTunableOp_Half_TN,tn_4096_2675_4096,Gemm_Hipblaslt_TN_9657,0.162704
GemmTunableOp_Half_TN,tn_6144_917_4096,Gemm_Hipblaslt_TN_9615,0.0937862
GemmTunableOp_Half_TN,tn_28672_831_4096,Gemm_Hipblaslt_TN_9683,0.383162
GemmTunableOp_Half_TN,tn_6144_88_4096,Gemm_Rocblas_621294028,0.0194639
GemmTunableOp_Half_TN,tn_4096_7952_4096,Gemm_Hipblaslt_TN_9933,0.446174
GemmTunableOp_Half_TN,tn_4096_865_4096,Gemm_Hipblaslt_TN_9170,0.0659286
GemmTunableOp_Half_TN,tn_4096_899_4096,Gemm_Hipblaslt_TN_9634,0.0680092
GemmTunableOp_Half_TN,tn_6144_1828_4096,Gemm_Hipblaslt_TN_9799,0.165091
GemmTunableOp_Half_TN,tn_4096_988_14336,Gemm_Hipblaslt_TN_9586,0.24624
GemmTunableOp_Half_TN,tn_4096_2802_11008,Gemm_Hipblaslt_TN_9709,0.441421
GemmTunableOp_Half_TN,tn_6144_1827_4096,Gemm_Rocblas_621294426,0.166505
GemmTunableOp_Half_TN,tn_4096_799_14336,Gemm_Hipblaslt_TN_9147,0.211471
GemmTunableOp_Half_TN,tn_4096_2750_14336,Gemm_Rocblas_621286684,0.565383
GemmTunableOp_Half_TN,tn_4096_208_14336,Gemm_Hipblaslt_TN_9363,0.0697125
GemmTunableOp_Half_TN,tn_4096_1848_4096,Gemm_Hipblaslt_TN_9645,0.120475
GemmTunableOp_Half_TN,tn_4096_35_4096,Gemm_Rocblas_621286428,0.0125973
GemmTunableOp_Half_TN,tn_4096_1744_14336,Gemm_Hipblaslt_TN_9645,0.393401
GemmTunableOp_Half_TN,tn_4096_3925_4096,Gemm_Hipblaslt_TN_9713,0.223282
GemmTunableOp_Half_TN,tn_6144_3571_4096,Gemm_Hipblaslt_TN_9570,0.322976
GemmTunableOp_Half_TN,tn_6144_136_4096,Gemm_Rocblas_621286443,0.026867
GemmTunableOp_Half_TN,tn_32000_251_4096,Gemm_Hipblaslt_TN_9845,0.152358
GemmTunableOp_Half_TN,tn_6144_906_4096,Gemm_Hipblaslt_TN_9613,0.093689
GemmTunableOp_Half_TN,tn_6144_862_4096,Gemm_Rocblas_621294520,0.0885322
GemmTunableOp_Half_TN,tn_4096_1798_4096,Gemm_Hipblaslt_TN_9602,0.116531
GemmTunableOp_Half_TN,tn_4096_40_4096,Gemm_Rocblas_621286428,0.0126553
GemmTunableOp_Half_TN,tn_6144_2773_4096,Gemm_Hipblaslt_TN_9742,0.25565
GemmTunableOp_Half_TN,tn_4096_2732_4096,Gemm_Rocblas_621286705,0.166588
GemmTunableOp_Half_TN,tn_6144_32_4096,Gemm_Rocblas_621286488,0.0138763
GemmTunableOp_Half_TN,tn_28672_964_4096,Gemm_Hipblaslt_TN_9863,0.436702
GemmTunableOp_Half_TN,tn_4096_919_4096,Gemm_Hipblaslt_TN_9576,0.0683054
GemmTunableOp_Half_TN,tn_128256_18_4096,Gemm_Rocblas_621286354,0.310903
GemmTunableOp_Half_TN,tn_6144_1791_4096,Gemm_Rocblas_621294447,0.16374
GemmTunableOp_Half_TN,tn_128256_204_4096,Gemm_Hipblaslt_TN_9937,0.564535
GemmTunableOp_Half_TN,tn_6144_946_4096,Gemm_Hipblaslt_TN_9613,0.0945088
GemmTunableOp_Half_TN,tn_6144_7798_4096,Gemm_Hipblaslt_TN_9815,0.657151
GemmTunableOp_Half_TN,tn_28672_7823_4096,Gemm_Hipblaslt_TN_159,3.05491
GemmTunableOp_Half_TN,tn_28672_7809_4096,Gemm_Hipblaslt_TN_159,3.02644
GemmTunableOp_Half_TN,tn_6144_96_4096,Gemm_Rocblas_621294028,0.0192006
GemmTunableOp_Half_TN,tn_4096_3711_14336,Gemm_Hipblaslt_TN_9827,0.725056
GemmTunableOp_Half_TN,tn_4096_2763_14336,Gemm_Hipblaslt_TN_9799,0.573062
GemmTunableOp_Half_TN,tn_6144_1763_4096,Gemm_Hipblaslt_TN_9672,0.163048
GemmTunableOp_Half_TN,tn_28672_926_4096,Gemm_Hipblaslt_TN_9683,0.397906
GemmTunableOp_Half_TN,tn_4096_8070_14336,Gemm_Hipblaslt_TN_9749,1.64941
GemmTunableOp_Half_TN,tn_4096_1693_14336,Gemm_Hipblaslt_TN_9671,0.368748
GemmTunableOp_Half_TN,tn_6144_1726_4096,Gemm_Hipblaslt_TN_9691,0.157012
GemmTunableOp_Half_TN,tn_28672_878_4096,Gemm_Hipblaslt_TN_9683,0.392212
GemmTunableOp_Half_TN,tn_4096_2915_11008,Gemm_Hipblaslt_TN_9799,0.454377
GemmTunableOp_Half_TN,tn_4096_4463_4096,Gemm_Hipblaslt_TN_9742,0.269847
GemmTunableOp_Half_TN,tn_28672_232_4096,Gemm_Rocblas_621286584,0.121676
GemmTunableOp_Half_TN,tn_12288_22_4096,Gemm_Rocblas_621294052,0.0223823
GemmTunableOp_Half_TN,tn_28672_1817_4096,Gemm_Hipblaslt_TN_9684,0.793463
GemmTunableOp_Half_TN,tn_6144_160_4096,Gemm_Rocblas_621286440,0.0272664
GemmTunableOp_Half_TN,tn_28672_2698_4096,Gemm_Hipblaslt_TN_9847,1.16825
GemmTunableOp_Half_TN,tn_4096_852_4096,Gemm_Hipblaslt_TN_9170,0.0650919
GemmTunableOp_Half_TN,tn_4096_840_14336,Gemm_Hipblaslt_TN_9580,0.224305
GemmTunableOp_Half_TN,tn_4096_4242_4096,Gemm_Hipblaslt_TN_9768,0.231988
GemmTunableOp_Half_TN,tn_4096_1666_4096,Gemm_Hipblaslt_TN_9679,0.107589
GemmTunableOp_Half_TN,tn_4096_2862_11008,Gemm_Hipblaslt_TN_9674,0.444353
GemmTunableOp_Half_TN,tn_6144_924_4096,Gemm_Hipblaslt_TN_9615,0.0940882
GemmTunableOp_Half_TN,tn_4096_812_4096,Gemm_Hipblaslt_TN_9634,0.0639394
GemmTunableOp_Half_TN,tn_4096_834_14336,Gemm_Hipblaslt_TN_9131,0.221609
GemmTunableOp_Half_TN,tn_128256_213_4096,Gemm_Hipblaslt_TN_9847,0.566046
GemmTunableOp_Half_TN,tn_6144_8070_4096,Gemm_Hipblaslt_TN_9753,0.680161
GemmTunableOp_Half_TN,tn_4096_1614_14336,Gemm_Hipblaslt_TN_9679,0.360509
GemmTunableOp_Half_TN,tn_28672_7798_4096,Gemm_Hipblaslt_TN_159,3.00749
GemmTunableOp_Half_TN,tn_28672_88_4096,Gemm_Rocblas_621294461,0.058988
GemmTunableOp_Half_TN,tn_4096_2698_14336,Gemm_Hipblaslt_TN_9799,0.552161
GemmTunableOp_Half_TN,tn_4096_829_4096,Gemm_Hipblaslt_TN_9634,0.0640084
GemmTunableOp_Half_TN,tn_4096_160_4096,Gemm_Rocblas_621286491,0.022221
GemmTunableOp_Half_TN,tn_28672_917_4096,Gemm_Hipblaslt_TN_9683,0.397639
GemmTunableOp_Half_TN,tn_6144_2786_4096,Gemm_Hipblaslt_TN_9742,0.256498
GemmTunableOp_Half_TN,tn_4096_184_14336,Gemm_Hipblaslt_TN_7585,0.0635051
GemmTunableOp_Half_TN,tn_128256_186_4096,Gemm_Hipblaslt_TN_9857,0.514151
GemmTunableOp_Half_TN,tn_4096_4096_4096,Gemm_Rocblas_621294030,0.229596
GemmTunableOp_Half_TN,tn_6144_176_4096,Gemm_Rocblas_621294171,0.0289225
GemmTunableOp_Half_TN,tn_28672_1777_4096,Gemm_Hipblaslt_TN_9191,0.744992
GemmTunableOp_Half_TN,tn_4096_216_4096,Gemm_Rocblas_621294230,0.025214
GemmTunableOp_Half_TN,tn_4096_8156_14336,Gemm_Hipblaslt_TN_9713,1.66119
GemmTunableOp_Half_TN,tn_28672_2590_4096,Gemm_Hipblaslt_TN_9827,1.0813
GemmTunableOp_Half_TN,tn_28672_1768_4096,Gemm_Hipblaslt_TN_9223,0.74037
GemmTunableOp_Half_TN,tn_4096_875_4096,Gemm_Hipblaslt_TN_9634,0.0666313
GemmTunableOp_Half_TN,tn_4096_168_14336,Gemm_Hipblaslt_TN_7586,0.0605166
GemmTunableOp_Half_TN,tn_6144_796_4096,Gemm_Hipblaslt_TN_9357,0.087297
GemmTunableOp_Half_TN,tn_6144_64_4096,Gemm_Rocblas_621294155,0.0157628
GemmTunableOp_Half_TN,tn_6144_896_4096,Gemm_Hipblaslt_TN_9561,0.0908582
GemmTunableOp_Half_TN,tn_4096_112_4096,Gemm_Rocblas_621286278,0.0170354
GemmTunableOp_Half_TN,tn_4096_847_14336,Gemm_Hipblaslt_TN_9580,0.220607
GemmTunableOp_Half_TN,tn_128256_83_4096,Gemm_Hipblaslt_TN_9057,0.390765
GemmTunableOp_Half_TN,tn_12288_230_4096,Gemm_Rocblas_621286478,0.0586283
GemmTunableOp_Half_TN,tn_4096_7823_4096,Gemm_Hipblaslt_TN_9933,0.435077
GemmTunableOp_Half_TN,tn_4096_8_4096,Gemm_Rocblas_621294136,0.0100278
GemmTunableOp_Half_TN,tn_4096_904_14336,Gemm_Hipblaslt_TN_9634,0.22958
GemmTunableOp_Half_TN,tn_4096_908_4096,Gemm_Hipblaslt_TN_9576,0.0676873
GemmTunableOp_Half_TN,tn_4096_64_14336,Gemm_Hipblaslt_TN_9436,0.0352489
GemmTunableOp_Half_TN,tn_4096_1729_4096,Gemm_Hipblaslt_TN_9267,0.117641
GemmTunableOp_Half_TN,tn_22016_2834_4096,Gemm_Hipblaslt_TN_9827,0.893067
GemmTunableOp_Half_TN,tn_4096_954_4096,Gemm_Hipblaslt_TN_9634,0.0687785
GemmTunableOp_Half_TN,tn_6144_7967_4096,Gemm_Hipblaslt_TN_9813,0.666156
GemmTunableOp_Half_TN,tn_4096_2842_4096,Gemm_Rocblas_621294425,0.169705
GemmTunableOp_Half_TN,tn_4096_7863_14336,Gemm_Hipblaslt_TN_9738,1.6222
GemmTunableOp_Half_TN,tn_28672_875_4096,Gemm_Hipblaslt_TN_9683,0.387687
GemmTunableOp_Half_TN,tn_128256_209_4096,Gemm_Hipblaslt_TN_9937,0.569134
GemmTunableOp_Half_TN,tn_28672_72_4096,Gemm_Rocblas_621286719,0.055828
GemmTunableOp_Half_TN,tn_4096_802_14336,Gemm_Hipblaslt_TN_9147,0.21354
GemmTunableOp_Half_TN,tn_4096_873_4096,Gemm_Hipblaslt_TN_9170,0.0655821
GemmTunableOp_Half_TN,tn_4096_232_4096,Gemm_Rocblas_621294230,0.0260554
GemmTunableOp_Half_TN,tn_6144_821_4096,Gemm_Rocblas_621286778,0.0887981
GemmTunableOp_Half_TN,tn_4096_2517_14336,Gemm_Hipblaslt_TN_9799,0.522926
GemmTunableOp_Half_TN,tn_4096_1850_14336,Gemm_Hipblaslt_TN_9645,0.414051
GemmTunableOp_Half_TN,tn_4096_8192_14336,Gemm_Hipblaslt_TN_9753,1.65841
GemmTunableOp_Half_TN,tn_4096_988_4096,Gemm_Hipblaslt_TN_9634,0.0718032
GemmTunableOp_Half_TN,tn_4096_8069_14336,Gemm_Hipblaslt_TN_9749,1.64897
GemmTunableOp_Half_TN,tn_4096_8054_4096,Gemm_Rocblas_621294127,0.44919
GemmTunableOp_Half_TN,tn_6144_7299_4096,Gemm_Hipblaslt_TN_9888,0.62514
GemmTunableOp_Half_TN,tn_28672_1742_4096,Gemm_Hipblaslt_TN_9217,0.732644
GemmTunableOp_Half_TN,tn_4096_7944_4096,Gemm_Rocblas_621294127,0.446457
GemmTunableOp_Half_TN,tn_28672_892_4096,Gemm_Hipblaslt_TN_9683,0.392575
GemmTunableOp_Half_TN,tn_28672_2722_4096,Gemm_Hipblaslt_TN_9827,1.16994
GemmTunableOp_Half_TN,tn_6144_865_4096,Gemm_Hipblaslt_TN_9253,0.0922057
GemmTunableOp_Half_TN,tn_4096_851_4096,Gemm_Hipblaslt_TN_9604,0.0650282
GemmTunableOp_Half_TN,tn_6144_1813_4096,Gemm_Rocblas_621286683,0.163589
GemmTunableOp_Half_TN,tn_28672_3402_4096,Gemm_Hipblaslt_TN_9827,1.36474
GemmTunableOp_Half_TN,tn_4096_8154_14336,Gemm_Hipblaslt_TN_9738,1.65389
GemmTunableOp_Half_TN,tn_128256_194_4096,Gemm_Hipblaslt_TN_9937,0.548207
GemmTunableOp_Half_TN,tn_4096_232_14336,Gemm_Hipblaslt_TN_9303,0.0764057
GemmTunableOp_Half_TN,tn_4096_915_4096,Gemm_Hipblaslt_TN_9604,0.0663598
GemmTunableOp_Half_TN,tn_128256_114_4096,Gemm_Hipblaslt_TN_9698,0.430373
GemmTunableOp_Half_TN,tn_4096_923_4096,Gemm_Hipblaslt_TN_9634,0.0683715
GemmTunableOp_Half_TN,tn_6144_988_4096,Gemm_Rocblas_621286571,0.101579
GemmTunableOp_Half_TN,tn_4096_1913_4096,Gemm_Hipblaslt_TN_9645,0.1215
GemmTunableOp_Half_TN,tn_4096_801_14336,Gemm_Hipblaslt_TN_9147,0.212122
GemmTunableOp_Half_TN,tn_128256_196_4096,Gemm_Hipblaslt_TN_9937,0.556288
GemmTunableOp_Half_TN,tn_4096_844_14336,Gemm_Hipblaslt_TN_9580,0.219998
GemmTunableOp_Half_TN,tn_28672_1806_4096,Gemm_Hipblaslt_TN_9684,0.78729
GemmTunableOp_Half_TN,tn_4096_1880_14336,Gemm_Hipblaslt_TN_9645,0.415119
GemmTunableOp_Half_TN,tn_4096_785_14336,Gemm_Hipblaslt_TN_9147,0.212642
GemmTunableOp_Half_TN,tn_28672_982_4096,Gemm_Hipblaslt_TN_9667,0.437929
GemmTunableOp_Half_TN,tn_128256_131_4096,Gemm_Hipblaslt_TN_9808,0.464737
GemmTunableOp_Half_TN,tn_4096_3669_11008,Gemm_Hipblaslt_TN_9655,0.557808
GemmTunableOp_Half_TN,tn_4096_795_14336,Gemm_Hipblaslt_TN_9158,0.2114
GemmTunableOp_Half_TN,tn_28672_7817_4096,Gemm_Hipblaslt_TN_159,3.05539
GemmTunableOp_Half_TN,tn_4096_1768_14336,Gemm_Hipblaslt_TN_9645,0.395786
GemmTunableOp_Half_TN,tn_28672_2703_4096,Gemm_Hipblaslt_TN_9246,1.17764
GemmTunableOp_Half_TN,tn_28672_908_4096,Gemm_Hipblaslt_TN_9684,0.394249
GemmTunableOp_Half_TN,tn_4096_800_14336,Gemm_Hipblaslt_TN_9158,0.212455
GemmTunableOp_Half_TN,tn_4096_921_14336,Gemm_Hipblaslt_TN_9634,0.232159
GemmTunableOp_Half_TN,tn_4096_821_14336,Gemm_Hipblaslt_TN_9147,0.21266
GemmTunableOp_Half_TN,tn_4096_2571_4096,Gemm_Rocblas_621294426,0.159954
GemmTunableOp_Half_TN,tn_4096_3571_4096,Gemm_Hipblaslt_TN_9188,0.202629
GemmTunableOp_Half_TN,tn_22016_248_4096,Gemm_Hipblaslt_TN_9720,0.10242
GemmTunableOp_Half_TN,tn_6144_1666_4096,Gemm_Hipblaslt_TN_9690,0.155681
GemmTunableOp_Half_TN,tn_22016_16_4096,Gemm_Rocblas_621294186,0.0353742
GemmTunableOp_Half_TN,tn_4096_3569_14336,Gemm_Hipblaslt_TN_9743,0.681782
GemmTunableOp_Half_TN,tn_28672_896_4096,Gemm_Hipblaslt_TN_9683,0.392352
GemmTunableOp_Half_TN,tn_28672_907_4096,Gemm_Hipblaslt_TN_9683,0.395249
GemmTunableOp_Half_TN,tn_4096_890_14336,Gemm_Hipblaslt_TN_9580,0.220151
GemmTunableOp_Half_TN,tn_4096_881_14336,Gemm_Hipblaslt_TN_9580,0.218718
GemmTunableOp_Half_TN,tn_6144_954_4096,Gemm_Hipblaslt_TN_9561,0.0934879
GemmTunableOp_Half_TN,tn_6144_2785_4096,Gemm_Hipblaslt_TN_9742,0.257058
GemmTunableOp_Half_TN,tn_28672_1649_4096,Gemm_Hipblaslt_TN_9245,0.720062
GemmTunableOp_Half_TN,tn_6144_1893_4096,Gemm_Rocblas_621294447,0.167418
GemmTunableOp_Half_TN,tn_4096_802_4096,Gemm_Hipblaslt_TN_9604,0.0632025
GemmTunableOp_Half_TN,tn_4096_871_4096,Gemm_Hipblaslt_TN_9170,0.0654291
GemmTunableOp_Half_TN,tn_28672_3479_4096,Gemm_Hipblaslt_TN_9827,1.3727
GemmTunableOp_Half_TN,tn_4096_882_4096,Gemm_Hipblaslt_TN_9634,0.0664424
GemmTunableOp_Half_TN,tn_6144_879_4096,Gemm_Hipblaslt_TN_9613,0.0925508
GemmTunableOp_Half_TN,tn_4096_1883_4096,Gemm_Hipblaslt_TN_9645,0.122261
GemmTunableOp_Half_TN,tn_4096_2560_4096,Gemm_Rocblas_621286683,0.153655
GemmTunableOp_Half_TN,tn_128256_73_4096,Gemm_Hipblaslt_TN_9057,0.38816
GemmTunableOp_Half_TN,tn_28672_956_4096,Gemm_Hipblaslt_TN_9684,0.402874
GemmTunableOp_Half_TN,tn_6144_3546_4096,Gemm_Rocblas_621286753,0.320762
GemmTunableOp_Half_TN,tn_4096_144_14336,Gemm_Hipblaslt_TN_7234,0.0557471
GemmTunableOp_Half_TN,tn_4096_7787_14336,Gemm_Hipblaslt_TN_9815,1.58933
GemmTunableOp_Half_TN,tn_6144_1897_4096,Gemm_Rocblas_621294425,0.16764
GemmTunableOp_Half_TN,tn_4096_846_4096,Gemm_Hipblaslt_TN_9634,0.0651788
GemmTunableOp_Half_TN,tn_6144_800_4096,Gemm_Hipblaslt_TN_9163,0.0856377
GemmTunableOp_Half_TN,tn_28672_898_4096,Gemm_Hipblaslt_TN_9684,0.390598
GemmTunableOp_Half_TN,tn_6144_819_4096,Gemm_Rocblas_621294520,0.0876451
GemmTunableOp_Half_TN,tn_4096_14_4096,Gemm_Rocblas_621294130,0.0100461
GemmTunableOp_Half_TN,tn_128256_175_4096,Gemm_Hipblaslt_TN_9661,0.511559
GemmTunableOp_Half_TN,tn_28672_3565_4096,Gemm_Hipblaslt_TN_9841,1.39664
GemmTunableOp_Half_TN,tn_6144_1759_4096,Gemm_Hipblaslt_TN_9799,0.158132
GemmTunableOp_Half_TN,tn_6144_24_4096,Gemm_Rocblas_621286273,0.0136893
GemmTunableOp_Half_TN,tn_4096_2681_4096,Gemm_Hipblaslt_TN_9657,0.161774
GemmTunableOp_Half_TN,tn_128256_93_4096,Gemm_Hipblaslt_TN_9057,0.393275
GemmTunableOp_Half_TN,tn_128256_200_4096,Gemm_Hipblaslt_TN_9937,0.558014
GemmTunableOp_Half_TN,tn_128256_124_4096,Gemm_Rocblas_621294762,0.433797
GemmTunableOp_Half_TN,tn_28672_887_4096,Gemm_Hipblaslt_TN_9684,0.389536
GemmTunableOp_Half_TN,tn_28672_2721_4096,Gemm_Hipblaslt_TN_9917,1.18745
GemmTunableOp_Half_TN,tn_28672_851_4096,Gemm_Hipblaslt_TN_9684,0.386427
GemmTunableOp_Half_TN,tn_4096_1835_14336,Gemm_Hipblaslt_TN_9134,0.41007
GemmTunableOp_Half_TN,tn_4096_926_14336,Gemm_Hipblaslt_TN_9634,0.232153
GemmTunableOp_Half_TN,tn_128256_103_4096,Gemm_Rocblas_621294762,0.421877
GemmTunableOp_Half_TN,tn_28672_870_4096,Gemm_Hipblaslt_TN_9683,0.39222
GemmTunableOp_Half_TN,tn_12288_3000_4096,Gemm_Rocblas_621294315,0.521522
GemmTunableOp_Half_TN,tn_4096_966_14336,Gemm_Hipblaslt_TN_9589,0.242249
GemmTunableOp_Half_TN,tn_28672_1854_4096,Gemm_Hipblaslt_TN_9684,0.793033
GemmTunableOp_Half_TN,tn_4096_921_4096,Gemm_Hipblaslt_TN_9576,0.0691997
GemmTunableOp_Half_TN,tn_6144_3352_4096,Gemm_Rocblas_621294306,0.306673
GemmTunableOp_Half_TN,tn_4096_1748_14336,Gemm_Hipblaslt_TN_9645,0.395489
GemmTunableOp_Half_TN,tn_4096_846_14336,Gemm_Hipblaslt_TN_9580,0.219404
GemmTunableOp_Half_TN,tn_4096_915_14336,Gemm_Hipblaslt_TN_9634,0.230918
GemmTunableOp_Half_TN,tn_6144_3752_4096,Gemm_Hipblaslt_TN_9690,0.332462
GemmTunableOp_Half_TN,tn_22016_3263_4096,Gemm_Hipblaslt_TN_9834,1.02745
GemmTunableOp_Half_TN,tn_4096_1905_4096,Gemm_Hipblaslt_TN_9645,0.122368
GemmTunableOp_Half_TN,tn_4096_851_14336,Gemm_Hipblaslt_TN_9580,0.218424
GemmTunableOp_Half_TN,tn_4096_881_4096,Gemm_Hipblaslt_TN_9634,0.0664636
GemmTunableOp_Half_TN,tn_6144_3479_4096,Gemm_Hipblaslt_TN_9570,0.317249
GemmTunableOp_Half_TN,tn_4096_1881_14336,Gemm_Hipblaslt_TN_9645,0.415496
GemmTunableOp_Half_TN,tn_28672_1841_4096,Gemm_Hipblaslt_TN_9684,0.792246
GemmTunableOp_Half_TN,tn_28672_7283_4096,Gemm_Hipblaslt_TN_159,2.94515
GemmTunableOp_Half_TN,tn_4096_2675_14336,Gemm_Hipblaslt_TN_9799,0.548418
GemmTunableOp_Half_TN,tn_4096_966_4096,Gemm_Hipblaslt_TN_9634,0.0699774
GemmStridedBatchedTunableOp_Half_TN,tn_853_853_128_B_32,Gemm_Rocblas_621294635,0.0452451
GemmStridedBatchedTunableOp_Half_TN,tn_872_872_128_B_32,Gemm_Hipblaslt_TN_150,0.0389283
GemmStridedBatchedTunableOp_Half_TN,tn_880_880_128_B_32,Gemm_Hipblaslt_TN_150,0.037749
GemmStridedBatchedTunableOp_Half_TN,tn_953_953_128_B_32,Gemm_Hipblaslt_TN_6857,0.0529384
GemmStridedBatchedTunableOp_Half_TN,tn_840_840_128_B_32,Gemm_Hipblaslt_TN_150,0.0374293
GemmStridedBatchedTunableOp_Half_TN,tn_898_898_128_B_32,Gemm_Hipblaslt_TN_9508,0.0489937
GemmStridedBatchedTunableOp_Half_TN,tn_1265_1265_128_B_32,Gemm_Hipblaslt_TN_6929,0.0765037
GemmStridedBatchedTunableOp_Half_TN,tn_1283_1283_128_B_32,Gemm_Rocblas_621294725,0.0828653
GemmStridedBatchedTunableOp_Half_TN,tn_821_821_128_B_32,Gemm_Rocblas_621294635,0.0422271
GemmStridedBatchedTunableOp_Half_TN,tn_832_832_128_B_32,Gemm_Hipblaslt_TN_150,0.0350709
GemmStridedBatchedTunableOp_Half_TN,tn_868_868_128_B_32,Gemm_Rocblas_621294635,0.044626
GemmStridedBatchedTunableOp_Half_TN,tn_812_812_128_B_32,Gemm_Rocblas_621294635,0.0410668
GemmStridedBatchedTunableOp_Half_TN,tn_846_846_128_B_32,Gemm_Rocblas_621294635,0.0437383
GemmStridedBatchedTunableOp_Half_TN,tn_867_867_128_B_32,Gemm_Rocblas_621294527,0.046444
GemmStridedBatchedTunableOp_Half_TN,tn_794_794_128_B_32,Gemm_Rocblas_621294635,0.0399916
GemmStridedBatchedTunableOp_Half_TN,tn_904_904_128_B_32,Gemm_Rocblas_621293994,0.0464986
GemmStridedBatchedTunableOp_Half_TN,tn_789_789_128_B_32,Gemm_Rocblas_621294635,0.0402011
GemmStridedBatchedTunableOp_Half_TN,tn_1425_1425_128_B_32,Gemm_Rocblas_621286413,0.0938922
GemmStridedBatchedTunableOp_Half_TN,tn_1143_1143_128_B_32,Gemm_Hipblaslt_TN_7483,0.0657953
GemmStridedBatchedTunableOp_Half_TN,tn_893_893_128_B_32,Gemm_Rocblas_621294105,0.0476547
GemmStridedBatchedTunableOp_Half_TN,tn_889_889_128_B_32,Gemm_Rocblas_621294105,0.0475847
GemmStridedBatchedTunableOp_Half_TN,tn_845_845_128_B_32,Gemm_Rocblas_621294635,0.0440862
GemmStridedBatchedTunableOp_Half_TN,tn_1089_1089_128_B_32,Gemm_Rocblas_621294725,0.0628755
GemmStridedBatchedTunableOp_Half_TN,tn_909_909_128_B_32,Gemm_Rocblas_621294635,0.0507059
GemmStridedBatchedTunableOp_Half_TN,tn_1261_1261_128_B_32,Gemm_Rocblas_621294725,0.076106
GemmStridedBatchedTunableOp_Half_TN,tn_1197_1197_128_B_32,Gemm_Rocblas_621294725,0.0716801
GemmStridedBatchedTunableOp_Half_TN,tn_930_930_128_B_32,Gemm_Hipblaslt_TN_7519,0.0504047
GemmStridedBatchedTunableOp_Half_TN,tn_992_992_128_B_32,Gemm_Hipblaslt_TN_153,0.0453965
GemmStridedBatchedTunableOp_Half_TN,tn_905_905_128_B_32,Gemm_Rocblas_621294635,0.0495247
GemmStridedBatchedTunableOp_Half_TN,tn_831_831_128_B_32,Gemm_Rocblas_621294635,0.0420533
GemmStridedBatchedTunableOp_Half_TN,tn_844_844_128_B_32,Gemm_Rocblas_621294635,0.0435916
GemmStridedBatchedTunableOp_Half_TN,tn_1447_1447_128_B_32,Gemm_Rocblas_621286807,0.0977174
GemmStridedBatchedTunableOp_Half_TN,tn_801_801_128_B_32,Gemm_Rocblas_621294635,0.0404136
GemmStridedBatchedTunableOp_Half_TN,tn_970_970_128_B_32,Gemm_Hipblaslt_TN_7483,0.0529063
GemmStridedBatchedTunableOp_Half_TN,tn_1457_1457_128_B_32,Gemm_Hipblaslt_TN_6879,0.0981319
GemmStridedBatchedTunableOp_Half_TN,tn_933_933_128_B_32,Gemm_Hipblaslt_TN_7519,0.0500795
GemmStridedBatchedTunableOp_Half_TN,tn_1319_1319_128_B_32,Gemm_Hipblaslt_TN_9774,0.0856934
GemmStridedBatchedTunableOp_Half_TN,tn_804_804_128_B_32,Gemm_Rocblas_621294635,0.040588
GemmStridedBatchedTunableOp_Half_TN,tn_1037_1037_128_B_32,Gemm_Rocblas_621294725,0.0579847
GemmStridedBatchedTunableOp_Half_TN,tn_962_962_128_B_32,Gemm_Rocblas_621286809,0.0522811
GemmStridedBatchedTunableOp_Half_TN,tn_1047_1047_128_B_32,Gemm_Rocblas_621294725,0.0597382
GemmStridedBatchedTunableOp_Half_TN,tn_1314_1314_128_B_32,Gemm_Hipblaslt_TN_6871,0.0843499
GemmStridedBatchedTunableOp_Half_TN,tn_1080_1080_128_B_32,Gemm_Rocblas_621294725,0.0579552
GemmStridedBatchedTunableOp_Half_TN,tn_800_800_128_B_32,Gemm_Hipblaslt_TN_150,0.0357196
GemmStridedBatchedTunableOp_Half_TN,tn_1085_1085_128_B_32,Gemm_Rocblas_621294725,0.0614995
GemmStridedBatchedTunableOp_Half_TN,tn_900_900_128_B_32,Gemm_Rocblas_621294635,0.0470692
GemmStridedBatchedTunableOp_Half_TN,tn_890_890_128_B_32,Gemm_Rocblas_621294635,0.0470273
GemmStridedBatchedTunableOp_Half_TN,tn_942_942_128_B_32,Gemm_Hipblaslt_TN_6879,0.051647
GemmStridedBatchedTunableOp_Half_TN,tn_946_946_128_B_32,Gemm_Hipblaslt_TN_9351,0.0513072
GemmStridedBatchedTunableOp_Half_TN,tn_966_966_128_B_32,Gemm_Rocblas_621294550,0.0529138
GemmStridedBatchedTunableOp_Half_TN,tn_826_826_128_B_32,Gemm_Rocblas_621294635,0.0418846
GemmStridedBatchedTunableOp_Half_TN,tn_974_974_128_B_32,Gemm_Rocblas_621294550,0.053698
GemmStridedBatchedTunableOp_Half_TN,tn_967_967_128_B_32,Gemm_Hipblaslt_TN_7483,0.0531108
GemmStridedBatchedTunableOp_Half_TN,tn_925_925_128_B_32,Gemm_Hipblaslt_TN_7519,0.050794
GemmStridedBatchedTunableOp_Half_TN,tn_991_991_128_B_32,Gemm_Hipblaslt_TN_7483,0.0541583
GemmStridedBatchedTunableOp_Half_TN,tn_838_838_128_B_32,Gemm_Rocblas_621294635,0.0442315
GemmStridedBatchedTunableOp_Half_TN,tn_887_887_128_B_32,Gemm_Hipblaslt_TN_7483,0.0467583
GemmStridedBatchedTunableOp_Half_TN,tn_932_932_128_B_32,Gemm_Rocblas_621294635,0.0512724
GemmStridedBatchedTunableOp_Half_TN,tn_1421_1421_128_B_32,Gemm_Rocblas_621294110,0.0923548
GemmStridedBatchedTunableOp_Half_TN,tn_952_952_128_B_32,Gemm_Rocblas_621286240,0.0477752
GemmStridedBatchedTunableOp_Half_TN,tn_964_964_128_B_32,Gemm_Rocblas_621294550,0.051949
GemmStridedBatchedTunableOp_Half_TN,tn_936_936_128_B_32,Gemm_Hipblaslt_TN_153,0.0468374
GemmStridedBatchedTunableOp_Half_TN,tn_901_901_128_B_32,Gemm_Hipblaslt_TN_7519,0.0479355
GemmStridedBatchedTunableOp_Half_TN,tn_958_958_128_B_32,Gemm_Hipblaslt_TN_7519,0.051394
GemmStridedBatchedTunableOp_Half_TN,tn_935_935_128_B_32,Gemm_Hipblaslt_TN_7519,0.0510626
GemmStridedBatchedTunableOp_Half_TN,tn_858_858_128_B_32,Gemm_Rocblas_621294529,0.045546
GemmStridedBatchedTunableOp_Half_TN,tn_836_836_128_B_32,Gemm_Rocblas_621294635,0.0444036
GemmTunableOp_Half_TN,tn_28672_877_4096,Gemm_Hipblaslt_TN_9683,0.39537
GemmTunableOp_Half_TN,tn_4096_843_14336,Gemm_Hipblaslt_TN_9580,0.222802
GemmTunableOp_Half_TN,tn_4096_971_14336,Gemm_Hipblaslt_TN_9632,0.244532
GemmTunableOp_Half_TN,tn_4096_920_4096,Gemm_Hipblaslt_TN_9634,0.0691661
GemmTunableOp_Half_TN,tn_28672_1900_4096,Gemm_Hipblaslt_TN_9683,0.818874
GemmTunableOp_Half_TN,tn_4096_925_14336,Gemm_Hipblaslt_TN_9634,0.231138
GemmTunableOp_Half_TN,tn_4096_1828_14336,Gemm_Hipblaslt_TN_9792,0.413173
GemmTunableOp_Half_TN,tn_4096_2872_4096,Gemm_Rocblas_621294425,0.171673
GemmTunableOp_Half_TN,tn_4096_2628_14336,Gemm_Hipblaslt_TN_9799,0.543194
GemmTunableOp_Half_TN,tn_28672_56_4096,Gemm_Rocblas_621286499,0.0502677
GemmTunableOp_Half_TN,tn_6144_930_4096,Gemm_Hipblaslt_TN_9615,0.0950731
GemmTunableOp_Half_TN,tn_4096_3507_4096,Gemm_Hipblaslt_TN_9814,0.204229
GemmTunableOp_Half_TN,tn_28672_2606_4096,Gemm_Hipblaslt_TN_9827,1.11031
GemmTunableOp_Half_TN,tn_6144_2517_4096,Gemm_Hipblaslt_TN_9768,0.221598
GemmTunableOp_Half_TN,tn_4096_1644_4096,Gemm_Hipblaslt_TN_9610,0.107275
GemmTunableOp_Half_TN,tn_4096_2773_4096,Gemm_Rocblas_621286684,0.165732
GemmTunableOp_Half_TN,tn_4096_7787_4096,Gemm_Hipblaslt_TN_9903,0.451932
GemmTunableOp_Half_TN,tn_4096_890_4096,Gemm_Hipblaslt_TN_9604,0.0670124
GemmTunableOp_Half_TN,tn_6144_887_4096,Gemm_Hipblaslt_TN_9133,0.0935785
GemmTunableOp_Half_TN,tn_4096_1805_14336,Gemm_Hipblaslt_TN_9645,0.412544
GemmTunableOp_Half_TN,tn_28672_939_4096,Gemm_Hipblaslt_TN_9684,0.402066
GemmTunableOp_Half_TN,tn_4096_4463_14336,Gemm_Hipblaslt_TN_9698,0.960095
GemmTunableOp_Half_TN,tn_6144_880_4096,Gemm_Hipblaslt_TN_9133,0.0931338
GemmTunableOp_Half_TN,tn_4096_7953_14336,Gemm_Hipblaslt_TN_9815,1.64592
GemmTunableOp_Half_TN,tn_28672_829_4096,Gemm_Hipblaslt_TN_9684,0.389332
GemmTunableOp_Half_TN,tn_6144_900_4096,Gemm_Hipblaslt_TN_9613,0.0938409
GemmTunableOp_Half_TN,tn_4096_1697_14336,Gemm_Hipblaslt_TN_9671,0.367978
GemmTunableOp_Half_TN,tn_28672_885_4096,Gemm_Hipblaslt_TN_9683,0.396447
GemmTunableOp_Half_TN,tn_128256_49_4096,Gemm_Rocblas_621286813,0.357397
GemmTunableOp_Half_TN,tn_6144_956_4096,Gemm_Hipblaslt_TN_9613,0.0955279
GemmTunableOp_Half_TN,tn_28672_814_4096,Gemm_Hipblaslt_TN_9684,0.382268
GemmTunableOp_Half_TN,tn_28672_2860_4096,Gemm_Hipblaslt_TN_9827,1.20048
GemmTunableOp_Half_TN,tn_4096_1649_14336,Gemm_Hipblaslt_TN_9671,0.36413
GemmTunableOp_Half_TN,tn_4096_1649_4096,Gemm_Hipblaslt_TN_9569,0.107413
GemmTunableOp_Half_TN,tn_4096_2785_14336,Gemm_Hipblaslt_TN_9799,0.570583
GemmTunableOp_Half_TN,tn_28672_7857_4096,Gemm_Hipblaslt_TN_159,3.19385
GemmTunableOp_Half_TN,tn_28672_911_4096,Gemm_Hipblaslt_TN_9684,0.399829
GemmTunableOp_Half_TN,tn_28672_924_4096,Gemm_Hipblaslt_TN_9683,0.401266
GemmTunableOp_Half_TN,tn_4096_894_14336,Gemm_Hipblaslt_TN_9580,0.220662
GemmTunableOp_Half_TN,tn_6144_809_4096,Gemm_Rocblas_621294520,0.0878317
GemmTunableOp_Half_TN,tn_4096_978_14336,Gemm_Hipblaslt_TN_9586,0.244657
GemmTunableOp_Half_TN,tn_4096_832_14336,Gemm_Hipblaslt_TN_9158,0.220543
GemmTunableOp_Half_TN,tn_4096_807_4096,Gemm_Hipblaslt_TN_9634,0.0646785
GemmTunableOp_Half_TN,tn_4096_2805_4096,Gemm_Rocblas_621286683,0.170737
GemmTunableOp_Half_TN,tn_4096_908_14336,Gemm_Hipblaslt_TN_9634,0.230797
GemmTunableOp_Half_TN,tn_6144_1768_4096,Gemm_Rocblas_621286683,0.163137
GemmTunableOp_Half_TN,tn_4096_823_14336,Gemm_Hipblaslt_TN_9147,0.216434
GemmTunableOp_Half_TN,tn_4096_1697_4096,Gemm_Hipblaslt_TN_9607,0.107526
GemmTunableOp_Half_TN,tn_28672_891_4096,Gemm_Hipblaslt_TN_9683,0.392021
GemmTunableOp_Half_TN,tn_4096_795_4096,Gemm_Hipblaslt_TN_9634,0.0637763
GemmTunableOp_Half_TN,tn_28672_1730_4096,Gemm_Rocblas_621286742,0.750757
GemmTunableOp_Half_TN,tn_28672_918_4096,Gemm_Hipblaslt_TN_9683,0.402157
GemmTunableOp_Half_TN,tn_28672_2788_4096,Gemm_Hipblaslt_TN_9917,1.21278
GemmTunableOp_Half_TN,tn_28672_1805_4096,Gemm_Hipblaslt_TN_9684,0.803984
GemmTunableOp_Half_TN,tn_6144_1815_4096,Gemm_Rocblas_621286683,0.164876
GemmTunableOp_Half_TN,tn_4096_835_14336,Gemm_Hipblaslt_TN_9353,0.223613
GemmTunableOp_Half_TN,tn_28672_40_4096,Gemm_Hipblaslt_TN_9532,0.0480131
GemmTunableOp_Half_TN,tn_4096_900_4096,Gemm_Hipblaslt_TN_9634,0.0674331
GemmTunableOp_Half_TN,tn_4096_804_4096,Gemm_Hipblaslt_TN_9634,0.0641426
GemmTunableOp_Half_TN,tn_6144_804_4096,Gemm_Rocblas_621294520,0.0880958
GemmTunableOp_Half_TN,tn_6144_8154_4096,Gemm_Hipblaslt_TN_9914,0.700094
GemmTunableOp_Half_TN,tn_4096_2590_14336,Gemm_Hipblaslt_TN_9799,0.541598
GemmTunableOp_Half_TN,tn_28672_1795_4096,Gemm_Hipblaslt_TN_9683,0.80231
GemmTunableOp_Half_TN,tn_6144_2648_4096,Gemm_Hipblaslt_TN_9813,0.225952
GemmTunableOp_Half_TN,tn_6144_990_4096,Gemm_Rocblas_621294530,0.101983
GemmTunableOp_Half_TN,tn_28672_808_4096,Gemm_Hipblaslt_TN_9684,0.384455
GemmTunableOp_Half_TN,tn_28672_7787_4096,Gemm_Hipblaslt_TN_159,3.04658
GemmTunableOp_Half_TN,tn_4096_1739_4096,Gemm_Hipblaslt_TN_9134,0.117678
GemmTunableOp_Half_TN,tn_28672_3546_4096,Gemm_Hipblaslt_TN_9827,1.41739
GemmTunableOp_Half_TN,tn_4096_862_4096,Gemm_Hipblaslt_TN_9170,0.0661662
GemmTunableOp_Half_TN,tn_6144_2675_4096,Gemm_Hipblaslt_TN_9827,0.227646
GemmTunableOp_Half_TN,tn_28672_1666_4096,Gemm_Rocblas_621286742,0.740593
GemmTunableOp_Half_TN,tn_6144_1846_4096,Gemm_Rocblas_621294425,0.164546
GemmTunableOp_Half_TN,tn_28672_7863_4096,Gemm_Hipblaslt_TN_159,3.23703
GemmTunableOp_Half_TN,tn_28672_884_4096,Gemm_Hipblaslt_TN_9683,0.394351
GemmTunableOp_Half_TN,tn_128256_221_4096,Gemm_Hipblaslt_TN_9937,0.586046
GemmTunableOp_Half_TN,tn_128256_215_4096,Gemm_Hipblaslt_TN_9937,0.584748
GemmTunableOp_Half_TN,tn_6144_200_4096,Gemm_Hipblaslt_TN_9495,0.032483
GemmTunableOp_Half_TN,tn_6144_2670_4096,Gemm_Hipblaslt_TN_9768,0.225021
GemmTunableOp_Half_TN,tn_4096_2572_4096,Gemm_Hipblaslt_TN_9657,0.160408
GemmTunableOp_Half_TN,tn_4096_848_14336,Gemm_Hipblaslt_TN_9580,0.218434
GemmTunableOp_Half_TN,tn_4096_2592_14336,Gemm_Hipblaslt_TN_9691,0.540684
GemmTunableOp_Half_TN,tn_4096_7804_14336,Gemm_Hipblaslt_TN_9593,1.62027
GemmTunableOp_Half_TN,tn_128256_9_4096,Gemm_Hipblaslt_TN_9405,0.290396
GemmTunableOp_Half_TN,tn_4096_8070_4096,Gemm_Hipblaslt_TN_9914,0.465093
GemmTunableOp_Half_TN,tn_4096_961_4096,Gemm_Hipblaslt_TN_9634,0.0707425
GemmTunableOp_Half_TN,tn_6144_168_4096,Gemm_Rocblas_621294168,0.0282042
GemmTunableOp_Half_TN,tn_28672_2653_4096,Gemm_Hipblaslt_TN_9841,1.11343
GemmTunableOp_Half_TN,tn_4096_884_14336,Gemm_Hipblaslt_TN_9580,0.220339
GemmTunableOp_Half_TN,tn_4096_8154_4096,Gemm_Hipblaslt_TN_9753,0.466179
GemmTunableOp_Half_TN,tn_6144_192_4096,Gemm_Rocblas_621286443,0.0291152
GemmTunableOp_Half_TN,tn_28672_1719_4096,Gemm_Hipblaslt_TN_9223,0.746705
GemmTunableOp_Half_TN,tn_28672_2762_4096,Gemm_Hipblaslt_TN_9747,1.20337
GemmTunableOp_Half_TN,tn_4096_1672_14336,Gemm_Hipblaslt_TN_9671,0.366273
GemmTunableOp_Half_TN,tn_4096_922_4096,Gemm_Hipblaslt_TN_9604,0.0673605
GemmTunableOp_Half_TN,tn_4096_1815_4096,Gemm_Hipblaslt_TN_9645,0.119736
GemmTunableOp_Half_TN,tn_28672_7952_4096,Gemm_Hipblaslt_TN_159,3.25105
GemmTunableOp_Half_TN,tn_4096_7967_14336,Gemm_Hipblaslt_TN_9753,1.65471
GemmTunableOp_Half_TN,tn_6144_3599_4096,Gemm_Rocblas_621286753,0.32543
GemmTunableOp_Half_TN,tn_6144_843_4096,Gemm_Rocblas_621286778,0.0891072
GemmTunableOp_Half_TN,tn_28672_256_4096,Gemm_Rocblas_621286584,0.120845
GemmTunableOp_Half_TN,tn_6144_2544_4096,Gemm_Hipblaslt_TN_9768,0.221944
GemmTunableOp_Half_TN,tn_6144_859_4096,Gemm_Rocblas_621286778,0.0889867
GemmTunableOp_Half_TN,tn_4096_831_14336,Gemm_Hipblaslt_TN_9158,0.216269
GemmTunableOp_Half_TN,tn_28672_802_4096,Gemm_Hipblaslt_TN_9684,0.380797
GemmTunableOp_Half_TN,tn_28672_869_4096,Gemm_Hipblaslt_TN_9683,0.389929
GemmTunableOp_Half_TN,tn_6144_2571_4096,Gemm_Hipblaslt_TN_9768,0.222528
GemmTunableOp_Half_TN,tn_28672_1614_4096,Gemm_Rocblas_621294484,0.728262
GemmTunableOp_Half_TN,tn_6144_2763_4096,Gemm_Hipblaslt_TN_9742,0.257421
GemmTunableOp_Half_TN,tn_28672_2599_4096,Gemm_Hipblaslt_TN_9827,1.09404
GemmTunableOp_Half_TN,tn_4096_16_14336,Gemm_Rocblas_621294135,0.024269
GemmTunableOp_Half_TN,tn_4096_7944_14336,Gemm_Hipblaslt_TN_9738,1.64238
GemmTunableOp_Half_TN,tn_4096_2764_4096,Gemm_Rocblas_621286684,0.166439
GemmTunableOp_Half_TN,tn_4096_3565_14336,Gemm_Hipblaslt_TN_9743,0.692138
GemmTunableOp_Half_TN,tn_28672_128_4096,Gemm_Rocblas_621294215,0.0712404
GemmTunableOp_Half_TN,tn_28672_1828_4096,Gemm_Hipblaslt_TN_9684,0.804531
GemmTunableOp_Half_TN,tn_28672_8156_4096,Gemm_Hipblaslt_TN_9904,3.37725
GemmTunableOp_Half_TN,tn_4096_200_14336,Gemm_Hipblaslt_TN_9363,0.0690368
GemmTunableOp_Half_TN,tn_6144_799_4096,Gemm_Hipblaslt_TN_9357,0.0872153
GemmTunableOp_Half_TN,tn_4096_1719_14336,Gemm_Hipblaslt_TN_9671,0.371658
GemmTunableOp_Half_TN,tn_4096_907_14336,Gemm_Hipblaslt_TN_9634,0.22981
GemmTunableOp_Half_TN,tn_4096_956_4096,Gemm_Hipblaslt_TN_9576,0.0699245
GemmTunableOp_Half_TN,tn_28672_112_4096,Gemm_Hipblaslt_TN_9589,0.0715754
GemmTunableOp_Half_TN,tn_4096_935_14336,Gemm_Hipblaslt_TN_9634,0.234796
GemmTunableOp_Half_TN,tn_4096_2572_14336,Gemm_Hipblaslt_TN_9799,0.541649
GemmTunableOp_Half_TN,tn_128256_229_4096,Gemm_Rocblas_621286892,0.59561
GemmTunableOp_Half_TN,tn_28672_2773_4096,Gemm_Hipblaslt_TN_9945,1.21692
GemmTunableOp_Half_TN,tn_128256_145_4096,Gemm_Hipblaslt_TN_9108,0.476768
GemmTunableOp_Half_TN,tn_4096_200_4096,Gemm_Rocblas_621294230,0.0252529
GemmTunableOp_Half_TN,tn_4096_7857_14336,Gemm_Hipblaslt_TN_9815,1.63887
GemmTunableOp_Half_TN,tn_128256_127_4096,Gemm_Hipblaslt_TN_9061,0.441708
GemmTunableOp_Half_TN,tn_128256_190_4096,Gemm_Hipblaslt_TN_9816,0.533978
GemmTunableOp_Half_TN,tn_4096_924_4096,Gemm_Hipblaslt_TN_9576,0.0702233
GemmTunableOp_Half_TN,tn_4096_80_14336,Gemm_Hipblaslt_TN_7511,0.0396856
GemmTunableOp_Half_TN,tn_6144_890_4096,Gemm_Hipblaslt_TN_9253,0.0938287
GemmTunableOp_Half_TN,tn_28672_1827_4096,Gemm_Hipblaslt_TN_9684,0.80835
GemmTunableOp_Half_TN,tn_28672_863_4096,Gemm_Hipblaslt_TN_9684,0.395024
GemmTunableOp_Half_TN,tn_4096_40_14336,Gemm_Hipblaslt_TN_8050,0.0311001
GemmTunableOp_Half_TN,tn_28672_948_4096,Gemm_Hipblaslt_TN_9684,0.408885
GemmTunableOp_Half_TN,tn_4096_1783_14336,Gemm_Hipblaslt_TN_9645,0.397012
GemmTunableOp_Half_TN,tn_6144_839_4096,Gemm_Rocblas_621286778,0.0892487
GemmTunableOp_Half_TN,tn_28672_16_4096,Gemm_Rocblas_621294053,0.0449449
GemmTunableOp_Half_TN,tn_4096_1829_4096,Gemm_Hipblaslt_TN_9134,0.12125
GemmTunableOp_Half_TN,tn_6144_844_4096,Gemm_Rocblas_621286778,0.0880775
GemmTunableOp_Half_TN,tn_28672_1723_4096,Gemm_Rocblas_621286742,0.748494
GemmTunableOp_Half_TN,tn_4096_880_14336,Gemm_Hipblaslt_TN_9580,0.219883
GemmTunableOp_Half_TN,tn_4096_1730_14336,Gemm_Hipblaslt_TN_9645,0.391544
GemmTunableOp_Half_TN,tn_4096_2537_14336,Gemm_Hipblaslt_TN_9657,0.528685
GemmTunableOp_Half_TN,tn_4096_796_4096,Gemm_Hipblaslt_TN_9634,0.0643631
GemmTunableOp_Half_TN,tn_4096_919_14336,Gemm_Hipblaslt_TN_9634,0.232582
GemmTunableOp_Half_TN,tn_4096_2635_14336,Gemm_Hipblaslt_TN_9799,0.547094
GemmTunableOp_Half_TN,tn_4096_3711_4096,Gemm_Hipblaslt_TN_9713,0.217141
GemmTunableOp_Half_TN,tn_4096_892_4096,Gemm_Hipblaslt_TN_9634,0.0683858
GemmTunableOp_Half_TN,tn_28672_954_4096,Gemm_Hipblaslt_TN_9683,0.404136
GemmTunableOp_Half_TN,tn_4096_8069_4096,Gemm_Hipblaslt_TN_9815,0.467373
GemmTunableOp_Half_TN,tn_28672_3418_4096,Gemm_Hipblaslt_TN_9827,1.3909
GemmTunableOp_Half_TN,tn_6144_914_4096,Gemm_Hipblaslt_TN_9613,0.0945906
GemmTunableOp_Half_TN,tn_28672_8000_4096,Gemm_Hipblaslt_TN_159,3.22154
GemmTunableOp_Half_TN,tn_4096_24_14336,Gemm_Hipblaslt_TN_9392,0.0270086
GemmTunableOp_Half_TN,tn_28672_80_4096,Gemm_Rocblas_621294461,0.0565837
GemmTunableOp_Half_TN,tn_4096_7992_14336,Gemm_Hipblaslt_TN_9593,1.65968
GemmTunableOp_Half_TN,tn_28672_978_4096,Gemm_Hipblaslt_TN_9666,0.446698
GemmTunableOp_Half_TN,tn_6144_120_4096,Gemm_Rocblas_621286491,0.0236462
GemmTunableOp_Half_TN,tn_28672_2592_4096,Gemm_Hipblaslt_TN_9841,1.09932
GemmTunableOp_Half_TN,tn_4096_907_4096,Gemm_Hipblaslt_TN_9634,0.0676218
GemmTunableOp_Half_TN,tn_22016_3813_4096,Gemm_Hipblaslt_TN_9899,1.22029
GemmTunableOp_Half_TN,tn_4096_1822_4096,Gemm_Hipblaslt_TN_9602,0.117959
GemmTunableOp_Half_TN,tn_28672_8069_4096,Gemm_Hipblaslt_TN_9914,3.3653
GemmTunableOp_Half_TN,tn_4096_3530_11008,Gemm_Hipblaslt_TN_9743,0.532874
GemmTunableOp_Half_TN,tn_128256_183_4096,Gemm_Hipblaslt_TN_9952,0.527394
GemmTunableOp_Half_TN,tn_32000_217_4096,Gemm_Hipblaslt_TN_9620,0.139443
GemmTunableOp_Half_TN,tn_4096_1778_4096,Gemm_Hipblaslt_TN_9134,0.117421
GemmTunableOp_Half_TN,tn_128256_230_4096,Gemm_Rocblas_621286892,0.606394
GemmTunableOp_Half_TN,tn_4096_1806_14336,Gemm_Hipblaslt_TN_9137,0.411185
GemmTunableOp_Half_TN,tn_28672_1715_4096,Gemm_Rocblas_621294484,0.747927
GemmTunableOp_Half_TN,tn_4096_248_14336,Gemm_Hipblaslt_TN_9303,0.0799395
GemmTunableOp_Half_TN,tn_4096_3785_11008,Gemm_Hipblaslt_TN_9813,0.568505
GemmTunableOp_Half_TN,tn_4096_3173_4096,Gemm_Hipblaslt_TN_9743,0.188063
GemmTunableOp_Half_TN,tn_4096_946_14336,Gemm_Hipblaslt_TN_9634,0.232983
GemmTunableOp_Half_TN,tn_32000_235_4096,Gemm_Hipblaslt_TN_9845,0.148361
GemmTunableOp_Half_TN,tn_4096_3987_11008,Gemm_Hipblaslt_TN_9813,0.587614
GemmTunableOp_Half_TN,tn_28672_1792_4096,Gemm_Rocblas_621294484,0.749173
GemmTunableOp_Half_TN,tn_4096_2834_11008,Gemm_Rocblas_621286684,0.446055
GemmTunableOp_Half_TN,tn_4096_2717_14336,Gemm_Hipblaslt_TN_9799,0.55673
GemmTunableOp_Half_TN,tn_4096_2601_14336,Gemm_Hipblaslt_TN_9799,0.543274
GemmTunableOp_Half_TN,tn_4096_817_4096,Gemm_Hipblaslt_TN_9634,0.0646186
GemmTunableOp_Half_TN,tn_22016_234_4096,Gemm_Hipblaslt_TN_9720,0.0981638
GemmTunableOp_Half_TN,tn_4096_803_4096,Gemm_Hipblaslt_TN_9634,0.0634482
GemmTunableOp_Half_TN,tn_4096_799_4096,Gemm_Hipblaslt_TN_9547,0.0633092
GemmTunableOp_Half_TN,tn_4096_923_14336,Gemm_Hipblaslt_TN_9604,0.233341
GemmTunableOp_Half_TN,tn_4096_990_4096,Gemm_Hipblaslt_TN_9634,0.0716814
GemmTunableOp_Half_TN,tn_28672_838_4096,Gemm_Hipblaslt_TN_9684,0.392048
GemmTunableOp_Half_TN,tn_4096_2860_4096,Gemm_Rocblas_621294425,0.171839
GemmTunableOp_Half_TN,tn_4096_21_11008,Gemm_Rocblas_621286270,0.0242119
GemmTunableOp_Half_TN,tn_12288_19_4096,Gemm_Rocblas_621294064,0.0223659
GemmTunableOp_Half_TN,tn_28672_1673_4096,Gemm_Rocblas_621294484,0.742776
GemmTunableOp_Half_TN,tn_12288_2894_4096,Gemm_Rocblas_621286747,0.519522
GemmTunableOp_Half_TN,tn_28672_8054_4096,Gemm_Hipblaslt_TN_159,3.20737
GemmTunableOp_Half_TN,tn_128256_132_4096,Gemm_Hipblaslt_TN_9108,0.470612
GemmTunableOp_Half_TN,tn_28672_2805_4096,Gemm_Hipblaslt_TN_9847,1.20688
GemmTunableOp_Half_TN,tn_22016_242_4096,Gemm_Hipblaslt_TN_9720,0.0991531
GemmTunableOp_Half_TN,tn_4096_3310_14336,Gemm_Hipblaslt_TN_9743,0.66122
GemmTunableOp_Half_TN,tn_28672_1897_4096,Gemm_Hipblaslt_TN_9683,0.822965
GemmTunableOp_Half_TN,tn_32000_256_4096,Gemm_Hipblaslt_TN_9665,0.146907
GemmTunableOp_Half_TN,tn_4096_951_4096,Gemm_Hipblaslt_TN_9634,0.0687851
GemmTunableOp_Half_TN,tn_32000_241_4096,Gemm_Hipblaslt_TN_9845,0.148221
GemmTunableOp_Half_TN,tn_128256_107_4096,Gemm_Hipblaslt_TN_9061,0.431905
GemmTunableOp_Half_TN,tn_22016_8_4096,Gemm_Rocblas_621294186,0.0351163
GemmTunableOp_Half_TN,tn_28672_848_4096,Gemm_Hipblaslt_TN_9684,0.387505
GemmTunableOp_Half_TN,tn_12288_228_4096,Gemm_Rocblas_621294215,0.0574977
GemmTunableOp_Half_TN,tn_22016_3577_4096,Gemm_Hipblaslt_TN_9841,1.12222
GemmTunableOp_Half_TN,tn_22016_2754_4096,Gemm_Hipblaslt_TN_9827,0.916863
GemmTunableOp_Half_TN,tn_4096_8110_4096,Gemm_Hipblaslt_TN_9914,0.466038
GemmTunableOp_Half_TN,tn_4096_1724_14336,Gemm_Hipblaslt_TN_9790,0.370741
GemmTunableOp_Half_TN,tn_6144_2653_4096,Gemm_Hipblaslt_TN_9768,0.226168
GemmTunableOp_Half_TN,tn_4096_1293_4096,Gemm_Hipblaslt_TN_9148,0.0931801
GemmTunableOp_Half_TN,tn_6144_8007_4096,Gemm_Rocblas_621286693,0.685606
GemmTunableOp_Half_TN,tn_4096_857_4096,Gemm_Hipblaslt_TN_9634,0.0651608
GemmTunableOp_Half_TN,tn_4096_256_4096,Gemm_Rocblas_621294230,0.0258269
GemmTunableOp_Half_TN,tn_28672_990_4096,Gemm_Hipblaslt_TN_9716,0.449614
GemmTunableOp_Half_TN,tn_22016_4000_4096,Gemm_Hipblaslt_TN_9832,1.28002
GemmTunableOp_Half_TN,tn_32000_29_4096,Gemm_Rocblas_621286346,0.0524194
GemmTunableOp_Half_TN,tn_12288_239_4096,Gemm_Rocblas_621286478,0.05813
GemmTunableOp_Half_TN,tn_128256_60_4096,Gemm_Rocblas_621286813,0.361037
GemmTunableOp_Half_TN,tn_4096_248_11008,Gemm_Hipblaslt_TN_8652,0.0663267
GemmTunableOp_Half_TN,tn_12288_16_4096,Default,0.0208646
GemmTunableOp_Half_TN,tn_4096_2599_14336,Gemm_Hipblaslt_TN_9799,0.544673
GemmTunableOp_Half_TN,tn_6144_144_4096,Gemm_Hipblaslt_TN_9127,0.0264798
GemmTunableOp_Half_TN,tn_22016_239_4096,Gemm_Hipblaslt_TN_9720,0.09844
GemmTunableOp_Half_TN,tn_4096_2636_4096,Gemm_Hipblaslt_TN_9657,0.161862
GemmTunableOp_Half_TN,tn_28672_2872_4096,Gemm_Hipblaslt_TN_9841,1.19602
GemmTunableOp_Half_TN,tn_4096_934_4096,Gemm_Hipblaslt_TN_9634,0.068545
GemmTunableOp_Half_TN,tn_4096_8110_14336,Gemm_Hipblaslt_TN_9815,1.67872
GemmTunableOp_Half_TN,tn_22016_3243_4096,Gemm_Hipblaslt_TN_9832,1.02845
GemmTunableOp_Half_TN,tn_4096_2000_4096,Gemm_Hipblaslt_TN_9267,0.125856
GemmTunableOp_Half_TN,tn_6144_2703_4096,Gemm_Hipblaslt_TN_9742,0.255593
GemmTunableOp_Half_TN,tn_4096_2894_11008,Gemm_Hipblaslt_TN_9799,0.451107
GemmTunableOp_Half_TN,tn_28672_915_4096,Gemm_Hipblaslt_TN_9683,0.403633
GemmTunableOp_Half_TN,tn_4096_927_14336,Gemm_Hipblaslt_TN_9604,0.231917
GemmTunableOp_Half_TN,tn_28672_4463_4096,Gemm_Hipblaslt_TN_159,1.84189
GemmTunableOp_Half_TN,tn_4096_225_4096,Gemm_Rocblas_621286440,0.0256008
GemmTunableOp_Half_TN,tn_22016_220_4096,Gemm_Hipblaslt_TN_9720,0.0974029
GemmTunableOp_Half_TN,tn_12288_3785_4096,Gemm_Rocblas_621294484,0.654141
GemmTunableOp_Half_TN,tn_32000_219_4096,Gemm_Hipblaslt_TN_9620,0.14118
GemmTunableOp_Half_TN,tn_12288_3451_4096,Gemm_Hipblaslt_TN_9697,0.593916
GemmTunableOp_Half_TN,tn_4096_3621_11008,Gemm_Hipblaslt_TN_9743,0.547852
GemmTunableOp_Half_TN,tn_6144_947_4096,Gemm_Hipblaslt_TN_9615,0.0953834
GemmTunableOp_Half_TN,tn_4096_1748_4096,Gemm_Hipblaslt_TN_9645,0.117724
GemmTunableOp_Half_TN,tn_4096_2778_4096,Gemm_Rocblas_621286705,0.16756
GemmTunableOp_Half_TN,tn_28672_920_4096,Gemm_Hipblaslt_TN_9683,0.402985
GemmTunableOp_Half_TN,tn_4096_4058_4096,Gemm_Hipblaslt_TN_9768,0.230902
GemmTunableOp_Half_TN,tn_128256_235_4096,Gemm_Rocblas_621286892,0.607486
GemmTunableOp_Half_TN,tn_4096_225_11008,Gemm_Hipblaslt_TN_9303,0.0618792
GemmTunableOp_Half_TN,tn_22016_3000_4096,Gemm_Hipblaslt_TN_9827,0.940274
GemmTunableOp_Half_TN,tn_12288_233_4096,Gemm_Rocblas_621286478,0.0584651
GemmTunableOp_Half_TN,tn_4096_239_11008,Gemm_Hipblaslt_TN_9303,0.0614289
GemmTunableOp_Half_TN,tn_4096_944_4096,Gemm_Hipblaslt_TN_9634,0.0701454
GemmTunableOp_Half_TN,tn_22016_30_4096,Gemm_Rocblas_621286346,0.0364759
GemmTunableOp_Half_TN,tn_28672_2509_4096,Gemm_Hipblaslt_TN_9846,1.05332
GemmTunableOp_Half_TN,tn_4096_256_11008,Gemm_Hipblaslt_TN_9303,0.0672877
GemmTunableOp_Half_TN,tn_6144_1778_4096,Gemm_Hipblaslt_TN_9711,0.163052
GemmTunableOp_Half_TN,tn_4096_836_4096,Gemm_Hipblaslt_TN_9634,0.0647118
GemmTunableOp_Half_TN,tn_4096_247_4096,Gemm_Rocblas_621286491,0.0262268
GemmTunableOp_Half_TN,tn_6144_948_4096,Gemm_Hipblaslt_TN_9615,0.0954033
GemmTunableOp_Half_TN,tn_22016_31_4096,Gemm_Rocblas_621286460,0.0365664
GemmTunableOp_Half_TN,tn_28672_1762_4096,Gemm_Rocblas_621294484,0.760912
GemmTunableOp_Half_TN,tn_4096_3972_11008,Gemm_Hipblaslt_TN_9712,0.587669
GemmTunableOp_Half_TN,tn_22016_226_4096,Gemm_Hipblaslt_TN_9720,0.0975205
GemmTunableOp_Half_TN,tn_12288_226_4096,Gemm_Rocblas_621294215,0.0580221
GemmTunableOp_Half_TN,tn_32000_11_4096,Gemm_Rocblas_621294053,0.0497549
GemmTunableOp_Half_TN,tn_12288_252_4096,Gemm_Rocblas_621286478,0.0585555
GemmTunableOp_Half_TN,tn_6144_1694_4096,Gemm_Rocblas_621286753,0.157009
GemmTunableOp_Half_TN,tn_4096_1841_14336,Gemm_Hipblaslt_TN_9645,0.411183
GemmTunableOp_Half_TN,tn_4096_2773_14336,Gemm_Hipblaslt_TN_9799,0.567903
GemmTunableOp_Half_TN,tn_4096_235_4096,Gemm_Rocblas_621294230,0.0257047
GemmTunableOp_Half_TN,tn_28672_1733_4096,Gemm_Rocblas_621294484,0.746481
GemmTunableOp_Half_TN,tn_6144_836_4096,Gemm_Rocblas_621294520,0.0884065
GemmTunableOp_Half_TN,tn_4096_252_11008,Gemm_Hipblaslt_TN_8879,0.0643508
GemmTunableOp_Half_TN,tn_4096_1743_14336,Gemm_Hipblaslt_TN_9645,0.395745
GemmTunableOp_Half_TN,tn_4096_4035_11008,Gemm_Hipblaslt_TN_9929,0.603071
GemmTunableOp_Half_TN,tn_22016_35_4096,Gemm_Rocblas_621294233,0.0383682
GemmTunableOp_Half_TN,tn_32000_240_4096,Gemm_Hipblaslt_TN_9845,0.145347
GemmTunableOp_Half_TN,tn_6144_1673_4096,Gemm_Hipblaslt_TN_9570,0.155228
GemmTunableOp_Half_TN,tn_4096_1837_4096,Gemm_Hipblaslt_TN_9645,0.120209
GemmTunableOp_Half_TN,tn_22016_3953_4096,Gemm_Hipblaslt_TN_9832,1.26652
GemmTunableOp_Half_TN,tn_22016_2818_4096,Gemm_Hipblaslt_TN_9827,0.93023
GemmTunableOp_Half_TN,tn_6144_1718_4096,Gemm_Hipblaslt_TN_9570,0.158472
GemmTunableOp_Half_TN,tn_4096_1954_4096,Gemm_Hipblaslt_TN_9645,0.126665
GemmTunableOp_Half_TN,tn_22016_2398_4096,Gemm_Hipblaslt_TN_9846,0.818345
GemmTunableOp_Half_TN,tn_22016_2842_4096,Gemm_Hipblaslt_TN_9827,0.931502
GemmTunableOp_Half_TN,tn_4096_4051_4096,Gemm_Hipblaslt_TN_9768,0.229785
GemmTunableOp_Half_TN,tn_28672_2764_4096,Gemm_Rocblas_621294484,1.20268
GemmTunableOp_Half_TN,tn_4096_120_4096,Gemm_Rocblas_621286278,0.0172036
GemmTunableOp_Half_TN,tn_6144_871_4096,Gemm_Hipblaslt_TN_9613,0.0929085
GemmTunableOp_Half_TN,tn_6144_814_4096,Gemm_Rocblas_621294520,0.0888335
GemmTunableOp_Half_TN,tn_4096_217_4096,Gemm_Rocblas_621294173,0.0256189
GemmTunableOp_Half_TN,tn_4096_983_4096,Gemm_Hipblaslt_TN_9604,0.0701036
GemmTunableOp_Half_TN,tn_28672_796_4096,Gemm_Hipblaslt_TN_9691,0.361166
GemmTunableOp_Half_TN,tn_6144_7937_4096,Gemm_Hipblaslt_TN_9768,0.68209
GemmTunableOp_Half_TN,tn_12288_238_4096,Gemm_Rocblas_621286478,0.0584746
GemmTunableOp_Half_TN,tn_22016_250_4096,Gemm_Hipblaslt_TN_9720,0.100263
GemmTunableOp_Half_TN,tn_6144_811_4096,Gemm_Rocblas_621294520,0.088297
GemmTunableOp_Half_TN,tn_4096_3752_4096,Gemm_Rocblas_621286281,0.213517
GemmTunableOp_Half_TN,tn_12288_2818_4096,Gemm_Rocblas_621294426,0.511437
GemmTunableOp_Half_TN,tn_4096_226_4096,Gemm_Rocblas_621294172,0.0259013
GemmTunableOp_Half_TN,tn_12288_3430_4096,Gemm_Hipblaslt_TN_9677,0.594961
GemmTunableOp_Half_TN,tn_128256_242_4096,Gemm_Rocblas_621286892,0.608938
GemmTunableOp_Half_TN,tn_32000_19_4096,Gemm_Rocblas_621294191,0.0522165
GemmTunableOp_Half_TN,tn_12288_2770_4096,Gemm_Rocblas_621294426,0.508074
GemmTunableOp_Half_TN,tn_128256_5_4096,Gemm_Hipblaslt_TN_9405,0.28804
GemmTunableOp_Half_TN,tn_6144_3431_4096,Gemm_Rocblas_621286566,0.313149
GemmTunableOp_Half_TN,tn_4096_176_4096,Gemm_Rocblas_621286491,0.0228137
GemmTunableOp_Half_TN,tn_4096_31_4096,Gemm_Rocblas_621294047,0.0116722
GemmTunableOp_Half_TN,tn_4096_1913_14336,Gemm_Hipblaslt_TN_9620,0.415702
GemmTunableOp_Half_TN,tn_4096_885_4096,Gemm_Hipblaslt_TN_9604,0.0657221
GemmTunableOp_Half_TN,tn_4096_3430_14336,Gemm_Hipblaslt_TN_9743,0.672148
GemmTunableOp_Half_TN,tn_28672_935_4096,Gemm_Hipblaslt_TN_9683,0.405172
GemmTunableOp_Half_TN,tn_4096_2946_11008,Gemm_Hipblaslt_TN_9799,0.455986
GemmTunableOp_Half_TN,tn_6144_969_4096,Gemm_Hipblaslt_TN_9633,0.0997964
GemmTunableOp_Half_TN,tn_6144_80_4096,Gemm_Rocblas_621286280,0.0183672
GemmTunableOp_Half_TN,tn_22016_224_4096,Gemm_Hipblaslt_TN_9641,0.0978211
GemmTunableOp_Half_TN,tn_4096_3430_11008,Gemm_Hipblaslt_TN_9743,0.516687
GemmTunableOp_Half_TN,tn_4096_247_11008,Gemm_Hipblaslt_TN_9303,0.0633504
GemmTunableOp_Half_TN,tn_4096_2658_4096,Gemm_Hipblaslt_TN_9799,0.162589
GemmTunableOp_Half_TN,tn_4096_230_4096,Gemm_Rocblas_621294230,0.0259069
GemmTunableOp_Half_TN,tn_12288_31_4096,Gemm_Rocblas_621294064,0.0228216
GemmTunableOp_Half_TN,tn_4096_813_14336,Gemm_Hipblaslt_TN_9158,0.216434
GemmTunableOp_Half_TN,tn_28672_1881_4096,Gemm_Hipblaslt_TN_9684,0.812751
GemmTunableOp_Half_TN,tn_4096_7992_4096,Gemm_Hipblaslt_TN_9655,0.458329
GemmTunableOp_Half_TN,tn_128256_203_4096,Gemm_Hipblaslt_TN_9937,0.577826
GemmTunableOp_Half_TN,tn_28672_1853_4096,Gemm_Hipblaslt_TN_9684,0.818682
GemmTunableOp_Half_TN,tn_4096_2786_4096,Gemm_Hipblaslt_TN_9799,0.167379
GemmTunableOp_Half_TN,tn_28672_855_4096,Gemm_Hipblaslt_TN_9683,0.392052
GemmTunableOp_Half_TN,tn_4096_785_4096,Gemm_Hipblaslt_TN_9604,0.063707
GemmTunableOp_Half_TN,tn_6144_1834_4096,Gemm_Rocblas_621294425,0.164854
GemmTunableOp_Half_TN,tn_4096_840_4096,Gemm_Hipblaslt_TN_9634,0.0652305
GemmTunableOp_Half_TN,tn_4096_2818_4096,Gemm_Rocblas_621286684,0.170594
GemmTunableOp_Half_TN,tn_12288_2962_4096,Gemm_Rocblas_621286575,0.528696
GemmTunableOp_Half_TN,tn_4096_3267_11008,Gemm_Hipblaslt_TN_9743,0.508673
GemmTunableOp_Half_TN,tn_4096_2946_4096,Gemm_Rocblas_621294425,0.175954
GemmTunableOp_Half_TN,tn_28672_1727_4096,Gemm_Rocblas_621294484,0.751025
GemmTunableOp_Half_TN,tn_12288_9_4096,Gemm_Rocblas_621286313,0.0204796
GemmTunableOp_Half_TN,tn_128256_65_4096,Gemm_Hipblaslt_TN_9057,0.379077
GemmTunableOp_Half_TN,tn_128256_37_4096,Gemm_Hipblaslt_TN_9451,0.331129
GemmTunableOp_Half_TN,tn_4096_7283_14336,Gemm_Hipblaslt_TN_9743,1.48233
GemmTunableOp_Half_TN,tn_4096_2915_4096,Gemm_Rocblas_621294425,0.174105
GemmTunableOp_Half_TN,tn_12288_2930_4096,Gemm_Hipblaslt_TN_9687,0.52909
GemmTunableOp_Half_TN,tn_4096_218_11008,Gemm_Hipblaslt_TN_9363,0.0588198
GemmTunableOp_Half_TN,tn_22016_33_4096,Gemm_Rocblas_621294201,0.0379621
GemmTunableOp_Half_TN,tn_28672_893_4096,Gemm_Hipblaslt_TN_9684,0.395119
GemmTunableOp_Half_TN,tn_28672_1837_4096,Gemm_Hipblaslt_TN_9684,0.814268
GemmTunableOp_Half_TN,tn_4096_971_4096,Gemm_Hipblaslt_TN_9604,0.0708369
GemmTunableOp_Half_TN,tn_32000_7_4096,Gemm_Rocblas_621294053,0.048702
GemmTunableOp_Half_TN,tn_28672_7992_4096,Gemm_Hipblaslt_TN_159,3.26279
GemmTunableOp_Half_TN,tn_28672_871_4096,Gemm_Hipblaslt_TN_9683,0.395017
GemmTunableOp_Half_TN,tn_128256_7_4096,Gemm_Hipblaslt_TN_9405,0.286959
GemmTunableOp_Half_TN,tn_32000_34_4096,Gemm_Hipblaslt_TN_9514,0.0554812
GemmTunableOp_Half_TN,tn_4096_2962_4096,Gemm_Rocblas_621286683,0.177009
GemmTunableOp_Half_TN,tn_6144_913_4096,Gemm_Hipblaslt_TN_9606,0.0948747
GemmTunableOp_Half_TN,tn_4096_9_4096,Gemm_Rocblas_621294136,0.0100305
GemmTunableOp_Half_TN,tn_22016_34_4096,Gemm_Rocblas_621294201,0.038294
GemmTunableOp_Half_TN,tn_4096_1293_11008,Gemm_Hipblaslt_TN_9611,0.240459
GemmTunableOp_Half_TN,tn_6144_2805_4096,Gemm_Hipblaslt_TN_9763,0.260676
GemmTunableOp_Half_TN,tn_32000_243_4096,Gemm_Hipblaslt_TN_9845,0.147891
GemmTunableOp_Half_TN,tn_128256_106_4096,Gemm_Hipblaslt_TN_9061,0.431096
GemmTunableOp_Half_TN,tn_4096_19_4096,Default,0.0108478
GemmTunableOp_Half_TN,tn_4096_2571_14336,Gemm_Hipblaslt_TN_9799,0.540181
GemmTunableOp_Half_TN,tn_4096_14_11008,Gemm_Rocblas_621294135,0.0235431
GemmTunableOp_Half_TN,tn_22016_2786_4096,Gemm_Hipblaslt_TN_9827,0.919616
GemmTunableOp_Half_TN,tn_28672_836_4096,Gemm_Hipblaslt_TN_9683,0.386887
GemmTunableOp_Half_TN,tn_4096_4083_11008,Gemm_Hipblaslt_TN_9746,0.61343
GemmTunableOp_Half_TN,tn_12288_3925_4096,Gemm_Hipblaslt_TN_9746,0.678379
GemmTunableOp_Half_TN,tn_128256_71_4096,Gemm_Hipblaslt_TN_9057,0.385663
GemmTunableOp_Half_TN,tn_22016_24_4096,Gemm_Rocblas_621286346,0.0361889
GemmTunableOp_Half_TN,tn_128256_78_4096,Gemm_Hipblaslt_TN_9057,0.383922
GemmTunableOp_Half_TN,tn_6144_2682_4096,Gemm_Hipblaslt_TN_9202,0.229052
GemmTunableOp_Half_TN,tn_4096_36_11008,Gemm_Rocblas_621286332,0.0274165
GemmTunableOp_Half_TN,tn_4096_152_14336,Gemm_Hipblaslt_TN_7219,0.0565154
GemmTunableOp_Half_TN,tn_12288_3263_4096,Gemm_Hipblaslt_TN_9677,0.572777
GemmTunableOp_Half_TN,tn_22016_2898_4096,Gemm_Hipblaslt_TN_9827,0.935309
GemmTunableOp_Half_TN,tn_22016_3972_4096,Gemm_Hipblaslt_TN_9832,1.27147
GemmTunableOp_Half_TN,tn_4096_1755_4096,Gemm_Hipblaslt_TN_9134,0.116929
GemmTunableOp_Half_TN,tn_12288_2000_4096,Gemm_Rocblas_621286747,0.361069
GemmTunableOp_Half_TN,tn_128256_121_4096,Gemm_Hipblaslt_TN_9061,0.439419
GemmTunableOp_Half_TN,tn_4096_2798_11008,Gemm_Hipblaslt_TN_9799,0.43553
GemmTunableOp_Half_TN,tn_6144_866_4096,Gemm_Hipblaslt_TN_9561,0.0910608
GemmTunableOp_Half_TN,tn_4096_2958_4096,Gemm_Hipblaslt_TN_9209,0.177005
GemmTunableOp_Half_TN,tn_128256_214_4096,Gemm_Hipblaslt_TN_9937,0.585317
GemmTunableOp_Half_TN,tn_12288_254_4096,Gemm_Rocblas_621286478,0.058537
GemmTunableOp_Half_TN,tn_4096_990_14336,Gemm_Hipblaslt_TN_9584,0.248214
GemmTunableOp_Half_TN,tn_28672_913_4096,Gemm_Hipblaslt_TN_9683,0.398301
GemmTunableOp_Half_TN,tn_128256_109_4096,Gemm_Hipblaslt_TN_9263,0.433444
GemmTunableOp_Half_TN,tn_12288_3717_4096,Gemm_Hipblaslt_TN_9815,0.650682
GemmTunableOp_Half_TN,tn_6144_985_4096,Gemm_Hipblaslt_TN_9265,0.101486
GemmTunableOp_Half_TN,tn_4096_22_4096,Gemm_Rocblas_621294139,0.0110802
GemmTunableOp_Half_TN,tn_4096_1000_4096,Gemm_Hipblaslt_TN_9604,0.071914
GemmTunableOp_Half_TN,tn_6144_2762_4096,Gemm_Hipblaslt_TN_9763,0.258641
GemmTunableOp_Half_TN,tn_128256_16_4096,Gemm_Hipblaslt_TN_9405,0.29818
GemmTunableOp_Half_TN,tn_4096_1673_4096,Gemm_Hipblaslt_TN_9616,0.106672
GemmTunableOp_Half_TN,tn_32000_242_4096,Gemm_Rocblas_621294529,0.15042
GemmTunableOp_Half_TN,tn_12288_2750_4096,Gemm_Hipblaslt_TN_9690,0.507183
GemmTunableOp_Half_TN,tn_28672_958_4096,Gemm_Hipblaslt_TN_9683,0.411222
GemmTunableOp_Half_TN,tn_4096_969_14336,Gemm_Rocblas_621294507,0.244591
GemmTunableOp_Half_TN,tn_128256_53_4096,Gemm_Rocblas_621286813,0.360345
GemmTunableOp_Half_TN,tn_4096_800_4096,Gemm_Hipblaslt_TN_9634,0.0640721
GemmTunableOp_Half_TN,tn_4096_816_4096,Gemm_Hipblaslt_TN_9170,0.0636765
GemmTunableOp_Half_TN,tn_128256_68_4096,Gemm_Hipblaslt_TN_9057,0.382149
GemmTunableOp_Half_TN,tn_128256_87_4096,Gemm_Hipblaslt_TN_9057,0.394056
GemmTunableOp_Half_TN,tn_28672_2682_4096,Gemm_Hipblaslt_TN_9827,1.12005
GemmTunableOp_Half_TN,tn_128256_44_4096,Gemm_Hipblaslt_TN_9451,0.340775
GemmTunableOp_Half_TN,tn_128256_105_4096,Gemm_Hipblaslt_TN_9061,0.4295
GemmTunableOp_Half_TN,tn_6144_2560_4096,Gemm_Hipblaslt_TN_9827,0.222175
GemmTunableOp_Half_TN,tn_4096_2862_4096,Gemm_Hipblaslt_TN_9852,0.172714
GemmTunableOp_Half_TN,tn_128256_140_4096,Gemm_Hipblaslt_TN_9108,0.475001
GemmTunableOp_Half_TN,tn_128256_158_4096,Gemm_Hipblaslt_TN_9108,0.484067
GemmTunableOp_Half_TN,tn_28672_842_4096,Gemm_Hipblaslt_TN_9684,0.390044
GemmTunableOp_Half_TN,tn_128256_164_4096,Gemm_Hipblaslt_TN_9952,0.516355
GemmTunableOp_Half_TN,tn_128256_39_4096,Gemm_Hipblaslt_TN_9451,0.331101
GemmTunableOp_Half_TN,tn_6144_2699_4096,Gemm_Hipblaslt_TN_9742,0.255988
GemmTunableOp_Half_TN,tn_128256_173_4096,Gemm_Hipblaslt_TN_9952,0.521919
GemmTunableOp_Half_TN,tn_6144_1792_4096,Gemm_Hipblaslt_TN_9711,0.163193
GemmTunableOp_Half_TN,tn_28672_1846_4096,Gemm_Hipblaslt_TN_9684,0.815881
GemmTunableOp_Half_TN,tn_128256_166_4096,Gemm_Hipblaslt_TN_9952,0.519158
GemmTunableOp_Half_TN,tn_128256_198_4096,Gemm_Hipblaslt_TN_9937,0.573755
GemmTunableOp_Half_TN,tn_28672_2544_4096,Gemm_Hipblaslt_TN_9846,1.06306
GemmTunableOp_Half_TN,tn_32000_35_4096,Gemm_Hipblaslt_TN_9514,0.0556686
GemmTunableOp_Half_TN,tn_128256_206_4096,Gemm_Hipblaslt_TN_9937,0.581796
GemmTunableOp_Half_TN,tn_6144_949_4096,Gemm_Hipblaslt_TN_9133,0.0954411
GemmTunableOp_Half_TN,tn_28672_1829_4096,Gemm_Hipblaslt_TN_9683,0.813812
GemmTunableOp_Half_TN,tn_22016_255_4096,Gemm_Hipblaslt_TN_9720,0.102007
GemmTunableOp_Half_TN,tn_4096_863_4096,Gemm_Hipblaslt_TN_9604,0.0654332
GemmTunableOp_Half_TN,tn_28672_797_4096,Gemm_Hipblaslt_TN_9691,0.361053
GemmTunableOp_Half_TN,tn_128256_249_4096,Gemm_Rocblas_621294634,0.614266
GemmTunableOp_Half_TN,tn_6144_921_4096,Gemm_Hipblaslt_TN_9613,0.0946275
GemmTunableOp_Half_TN,tn_32000_231_4096,Gemm_Hipblaslt_TN_9845,0.145159
GemmTunableOp_Half_TN,tn_4096_812_14336,Gemm_Hipblaslt_TN_9147,0.213651
GemmTunableOp_Half_TN,tn_6144_1744_4096,Gemm_Hipblaslt_TN_9799,0.160221
GemmTunableOp_Half_TN,tn_4096_2930_4096,Gemm_Hipblaslt_TN_9566,0.175113
GemmTunableOp_Half_TN,tn_22016_254_4096,Gemm_Hipblaslt_TN_9720,0.100034
GemmTunableOp_Half_TN,tn_4096_1746_14336,Gemm_Hipblaslt_TN_9645,0.392623
GemmTunableOp_Half_TN,tn_128256_218_4096,Gemm_Hipblaslt_TN_9937,0.585132
GemmTunableOp_Half_TN,tn_4096_1806_4096,Gemm_Hipblaslt_TN_9645,0.120028
GemmTunableOp_Half_TN,tn_6144_847_4096,Gemm_Rocblas_621294520,0.0885421
GemmTunableOp_Half_TN,tn_6144_2860_4096,Gemm_Hipblaslt_TN_9763,0.267685
GemmTunableOp_Half_TN,tn_4096_2722_14336,Gemm_Hipblaslt_TN_9799,0.56413
GemmTunableOp_Half_TN,tn_4096_3402_4096,Gemm_Hipblaslt_TN_9743,0.194868
GemmTunableOp_Half_TN,tn_4096_251_4096,Gemm_Rocblas_621286491,0.0265102
GemmTunableOp_Half_TN,tn_4096_7_11008,Gemm_Rocblas_621294135,0.0225683
GemmTunableOp_Half_TN,tn_28672_1822_4096,Gemm_Hipblaslt_TN_9684,0.806739
GemmTunableOp_Half_TN,tn_4096_1853_14336,Gemm_Hipblaslt_TN_9645,0.417521
GemmTunableOp_Half_TN,tn_4096_2672_14336,Gemm_Hipblaslt_TN_9799,0.545339
GemmTunableOp_Half_TN,tn_28672_811_4096,Gemm_Hipblaslt_TN_9684,0.385277
GemmTunableOp_Half_TN,tn_4096_1737_14336,Gemm_Hipblaslt_TN_9645,0.395174
GemmTunableOp_Half_TN,tn_4096_3333_4096,Gemm_Hipblaslt_TN_9743,0.192486
GemmTunableOp_Half_TN,tn_6144_889_4096,Gemm_Hipblaslt_TN_9148,0.0934633
GemmTunableOp_Half_TN,tn_28672_3556_4096,Gemm_Hipblaslt_TN_9827,1.42088
GemmTunableOp_Half_TN,tn_4096_2850_4096,Gemm_Hipblaslt_TN_9852,0.1683
GemmTunableOp_Half_TN,tn_6144_968_4096,Gemm_Rocblas_621294311,0.0990199
GemmTunableOp_Half_TN,tn_4096_926_4096,Gemm_Hipblaslt_TN_9634,0.0689572
GemmTunableOp_Half_TN,tn_4096_869_4096,Gemm_Hipblaslt_TN_9604,0.0663478
GemmTunableOp_Half_TN,tn_12288_221_4096,Gemm_Rocblas_621294215,0.0579468
GemmTunableOp_Half_TN,tn_6144_1723_4096,Gemm_Hipblaslt_TN_9570,0.158545
GemmTunableOp_Half_TN,tn_4096_3447_4096,Gemm_Hipblaslt_TN_9743,0.196985
GemmTunableOp_Half_TN,tn_128256_19_4096,Gemm_Rocblas_621286354,0.314579
GemmTunableOp_Half_TN,tn_6144_7436_4096,Gemm_Hipblaslt_TN_9704,0.65163
GemmTunableOp_Half_TN,tn_28672_1724_4096,Gemm_Rocblas_621294484,0.75254
GemmTunableOp_Half_TN,tn_4096_854_14336,Gemm_Hipblaslt_TN_9580,0.219041
GemmTunableOp_Half_TN,tn_4096_228_4096,Gemm_Rocblas_621294171,0.0251974
GemmTunableOp_Half_TN,tn_4096_244_4096,Gemm_Rocblas_621294230,0.0259541
GemmTunableOp_Half_TN,tn_6144_2628_4096,Gemm_Hipblaslt_TN_9202,0.225172
GemmTunableOp_Half_TN,tn_4096_836_14336,Gemm_Hipblaslt_TN_9604,0.225803
GemmTunableOp_Half_TN,tn_28672_819_4096,Gemm_Hipblaslt_TN_9684,0.38628
GemmTunableOp_Half_TN,tn_4096_940_4096,Gemm_Hipblaslt_TN_9634,0.0704908
GemmTunableOp_Half_TN,tn_6144_1931_4096,Gemm_Hipblaslt_TN_9187,0.177784
GemmTunableOp_Half_TN,tn_28672_932_4096,Gemm_Hipblaslt_TN_9684,0.402963
GemmTunableOp_Half_TN,tn_4096_843_4096,Gemm_Hipblaslt_TN_9170,0.0651087
GemmTunableOp_Half_TN,tn_6144_816_4096,Gemm_Rocblas_621286778,0.0877803
GemmTunableOp_Half_TN,tn_4096_939_14336,Gemm_Hipblaslt_TN_9585,0.23453
GemmTunableOp_Half_TN,tn_6144_978_4096,Gemm_Hipblaslt_TN_9671,0.101873
GemmTunableOp_Half_TN,tn_4096_938_14336,Gemm_Hipblaslt_TN_9589,0.233898
GemmTunableOp_Half_TN,tn_4096_2764_14336,Gemm_Hipblaslt_TN_9799,0.569764
GemmTunableOp_Half_TN,tn_28672_873_4096,Gemm_Hipblaslt_TN_9684,0.393723
GemmTunableOp_Half_TN,tn_128256_96_4096,Gemm_Hipblaslt_TN_9057,0.393856
GemmTunableOp_Half_TN,tn_6144_8000_4096,Gemm_Hipblaslt_TN_159,0.68413
GemmTunableOp_Half_TN,tn_4096_986_14336,Gemm_Hipblaslt_TN_9586,0.248015
GemmTunableOp_Half_TN,tn_28672_880_4096,Gemm_Hipblaslt_TN_9684,0.392237
GemmTunableOp_Half_TN,tn_28672_904_4096,Gemm_Hipblaslt_TN_9684,0.399887
GemmTunableOp_Half_TN,tn_4096_2606_4096,Gemm_Hipblaslt_TN_9799,0.160588
GemmTunableOp_Half_TN,tn_4096_152_4096,Gemm_Rocblas_621294168,0.022158
GemmTunableOp_Half_TN,tn_4096_912_4096,Gemm_Hipblaslt_TN_9576,0.0698675
GemmTunableOp_Half_TN,tn_4096_1864_4096,Gemm_Hipblaslt_TN_9134,0.12171
GemmTunableOp_Half_TN,tn_12288_11_4096,Gemm_Rocblas_621294048,0.0205173
GemmTunableOp_Half_TN,tn_28672_1815_4096,Gemm_Hipblaslt_TN_9684,0.803811
GemmTunableOp_Half_TN,tn_4096_837_14336,Gemm_Hipblaslt_TN_9539,0.225627
GemmTunableOp_Half_TN,tn_6144_805_4096,Gemm_Rocblas_621294520,0.0880477
GemmTunableOp_Half_TN,tn_4096_838_4096,Gemm_Hipblaslt_TN_9634,0.0646664
GemmTunableOp_Half_TN,tn_128256_133_4096,Gemm_Hipblaslt_TN_9108,0.468184
GemmTunableOp_Half_TN,tn_6144_1600_4096,Gemm_Rocblas_621286684,0.147813
GemmTunableOp_Half_TN,tn_4096_805_14336,Gemm_Hipblaslt_TN_9131,0.213632
GemmTunableOp_Half_TN,tn_32000_16_4096,Gemm_Hipblaslt_TN_9514,0.0537696
GemmTunableOp_Half_TN,tn_32000_14_4096,Gemm_Rocblas_621294053,0.0501342
GemmTunableOp_Half_TN,tn_6144_919_4096,Gemm_Hipblaslt_TN_9613,0.0944448
GemmTunableOp_Half_TN,tn_28672_795_4096,Gemm_Hipblaslt_TN_9691,0.362541
GemmTunableOp_Half_TN,tn_6144_813_4096,Gemm_Rocblas_621294520,0.0885407
GemmTunableOp_Half_TN,tn_6144_1756_4096,Gemm_Hipblaslt_TN_9799,0.159741
GemmTunableOp_Half_TN,tn_6144_884_4096,Gemm_Hipblaslt_TN_9613,0.0942161
GemmTunableOp_Half_TN,tn_4096_878_4096,Gemm_Hipblaslt_TN_9604,0.0668289
GemmTunableOp_Half_TN,tn_28672_886_4096,Gemm_Hipblaslt_TN_9684,0.395126
GemmTunableOp_Half_TN,tn_6144_2601_4096,Gemm_Hipblaslt_TN_9768,0.221145
GemmTunableOp_Half_TN,tn_4096_1893_14336,Gemm_Hipblaslt_TN_9620,0.417461
GemmTunableOp_Half_TN,tn_4096_3431_4096,Gemm_Hipblaslt_TN_9743,0.19568
GemmTunableOp_Half_TN,tn_28672_985_4096,Gemm_Hipblaslt_TN_9666,0.44502
GemmTunableOp_Half_TN,tn_128256_27_4096,Gemm_Rocblas_621294578,0.320097
GemmTunableOp_Half_TN,tn_6144_1853_4096,Gemm_Rocblas_621294425,0.168644
GemmTunableOp_Half_TN,tn_4096_906_14336,Gemm_Hipblaslt_TN_9634,0.229811
GemmTunableOp_Half_TN,tn_6144_926_4096,Gemm_Hipblaslt_TN_9615,0.0940294
GemmTunableOp_Half_TN,tn_4096_1886_14336,Gemm_Hipblaslt_TN_9620,0.417745
GemmTunableOp_Half_TN,tn_28672_992_4096,Gemm_Hipblaslt_TN_9825,0.446484
GemmTunableOp_Half_TN,tn_6144_2606_4096,Gemm_Hipblaslt_TN_9827,0.223991
GemmTunableOp_Half_TN,tn_28672_3671_4096,Gemm_Hipblaslt_TN_9827,1.54801
GemmTunableOp_Half_TN,tn_28672_1850_4096,Gemm_Hipblaslt_TN_9683,0.810195
GemmTunableOp_Half_TN,tn_6144_2599_4096,Gemm_Rocblas_621294484,0.225451
GemmTunableOp_Half_TN,tn_6144_901_4096,Gemm_Hipblaslt_TN_9133,0.0931659
GemmTunableOp_Half_TN,tn_4096_1837_14336,Gemm_Hipblaslt_TN_9645,0.413132
GemmTunableOp_Half_TN,tn_4096_982_4096,Gemm_Hipblaslt_TN_9604,0.071552
GemmTunableOp_Half_TN,tn_4096_853_4096,Gemm_Hipblaslt_TN_9604,0.0658382
GemmTunableOp_Half_TN,tn_4096_886_4096,Gemm_Hipblaslt_TN_9634,0.0678188
GemmTunableOp_Half_TN,tn_4096_3352_4096,Gemm_Hipblaslt_TN_9743,0.196998
GemmTunableOp_Half_TN,tn_4096_8049_4096,Gemm_Hipblaslt_TN_9914,0.457902
GemmTunableOp_Half_TN,tn_4096_3267_4096,Gemm_Hipblaslt_TN_9743,0.190763
GemmTunableOp_Half_TN,tn_4096_983_14336,Gemm_Hipblaslt_TN_9586,0.247037
GemmTunableOp_Half_TN,tn_6144_872_4096,Gemm_Hipblaslt_TN_9613,0.0924872
GemmTunableOp_Half_TN,tn_22016_246_4096,Gemm_Hipblaslt_TN_9720,0.100211
GemmTunableOp_Half_TN,tn_128256_153_4096,Gemm_Hipblaslt_TN_9108,0.485689
GemmTunableOp_Half_TN,tn_6144_4463_4096,Gemm_Hipblaslt_TN_9677,0.394287
GemmTunableOp_Half_TN,tn_4096_1886_4096,Gemm_Hipblaslt_TN_9134,0.12281
GemmStridedBatchedTunableOp_Half_TN,tn_911_911_128_B_32,Gemm_Rocblas_621294635,0.050145
GemmStridedBatchedTunableOp_Half_TN,tn_906_906_128_B_32,Gemm_Hipblaslt_TN_6879,0.0496085
GemmStridedBatchedTunableOp_Half_TN,tn_956_956_128_B_32,Gemm_Hipblaslt_TN_6879,0.0513201
GemmStridedBatchedTunableOp_Half_TN,tn_786_786_128_B_32,Gemm_Rocblas_621286810,0.0393935
GemmStridedBatchedTunableOp_Half_TN,tn_910_910_128_B_32,Gemm_Hipblaslt_TN_7519,0.0476906
GemmStridedBatchedTunableOp_Half_TN,tn_883_883_128_B_32,Gemm_Hipblaslt_TN_7483,0.0446941
GemmStridedBatchedTunableOp_Half_TN,tn_884_884_128_B_32,Gemm_Rocblas_621294527,0.046794
GemmStridedBatchedTunableOp_Half_TN,tn_828_828_128_B_32,Gemm_Rocblas_621294635,0.0413282
GemmStridedBatchedTunableOp_Half_TN,tn_976_976_128_B_32,Gemm_Hipblaslt_TN_153,0.0457563
GemmStridedBatchedTunableOp_Half_TN,tn_837_837_128_B_32,Gemm_Hipblaslt_TN_7483,0.0442564
GemmStridedBatchedTunableOp_Half_TN,tn_819_819_128_B_32,Gemm_Rocblas_621294635,0.0406363
GemmStridedBatchedTunableOp_Half_TN,tn_847_847_128_B_32,Gemm_Hipblaslt_TN_7059,0.0441346
GemmStridedBatchedTunableOp_Half_TN,tn_862_862_128_B_32,Gemm_Rocblas_621294635,0.0430901
GemmStridedBatchedTunableOp_Half_TN,tn_1383_1383_128_B_32,Gemm_Rocblas_621294725,0.0890208
GemmStridedBatchedTunableOp_Half_TN,tn_938_938_128_B_32,Gemm_Hipblaslt_TN_7519,0.0491503
GemmStridedBatchedTunableOp_Half_TN,tn_882_882_128_B_32,Gemm_Rocblas_621294527,0.0466922
GemmStridedBatchedTunableOp_Half_TN,tn_983_983_128_B_32,Gemm_Hipblaslt_TN_7483,0.0529918
GemmStridedBatchedTunableOp_Half_TN,tn_972_972_128_B_32,Gemm_Rocblas_621286809,0.0512187
GemmStridedBatchedTunableOp_Half_TN,tn_1175_1175_128_B_32,Gemm_Rocblas_621294725,0.0669024
GemmStridedBatchedTunableOp_Half_TN,tn_968_968_128_B_32,Gemm_Hipblaslt_TN_153,0.0473087
GemmStridedBatchedTunableOp_Half_TN,tn_796_796_128_B_32,Gemm_Rocblas_621294635,0.0394897
GemmStridedBatchedTunableOp_Half_TN,tn_1223_1223_128_B_32,Gemm_Rocblas_621294725,0.0710162
GemmStridedBatchedTunableOp_Half_TN,tn_1361_1361_128_B_32,Gemm_Rocblas_621286412,0.0865495
GemmStridedBatchedTunableOp_Half_TN,tn_1202_1202_128_B_32,Gemm_Rocblas_621294725,0.0684695
GemmStridedBatchedTunableOp_Half_TN,tn_835_835_128_B_32,Gemm_Rocblas_621294635,0.0431946
GemmStridedBatchedTunableOp_Half_TN,tn_977_977_128_B_32,Gemm_Rocblas_621286809,0.0515128
GemmStridedBatchedTunableOp_Half_TN,tn_1313_1313_128_B_32,Gemm_Rocblas_621294725,0.0829878
GemmStridedBatchedTunableOp_Half_TN,tn_879_879_128_B_32,Gemm_Hipblaslt_TN_7483,0.0460091
GemmStridedBatchedTunableOp_Half_TN,tn_1245_1245_128_B_32,Gemm_Hipblaslt_TN_7519,0.0739662
GemmStridedBatchedTunableOp_Half_TN,tn_908_908_128_B_32,Gemm_Hipblaslt_TN_7483,0.0490748
GemmStridedBatchedTunableOp_Half_TN,tn_859_859_128_B_32,Gemm_Rocblas_621294635,0.0447461
GemmStridedBatchedTunableOp_Half_TN,tn_1255_1255_128_B_32,Gemm_Rocblas_621294725,0.0748056
GemmStridedBatchedTunableOp_Half_TN,tn_32_32_128_B_32,Gemm_Rocblas_621286443,0.00621085
GemmStridedBatchedTunableOp_Half_TN,tn_1351_1351_128_B_32,Gemm_Rocblas_621294725,0.0857536
GemmStridedBatchedTunableOp_Half_TN,tn_850_850_128_B_32,Gemm_Rocblas_621294635,0.0443931
GemmStridedBatchedTunableOp_Half_TN,tn_1105_1105_128_B_32,Gemm_Hipblaslt_TN_7519,0.0635382
GemmStridedBatchedTunableOp_Half_TN,tn_1329_1329_128_B_32,Gemm_Rocblas_621294725,0.0851735
GemmStridedBatchedTunableOp_Half_TN,tn_939_939_128_B_32,Gemm_Hipblaslt_TN_7519,0.0497738
GemmStridedBatchedTunableOp_Half_TN,tn_941_941_128_B_32,Gemm_Hipblaslt_TN_7519,0.0520105
GemmStridedBatchedTunableOp_Half_TN,tn_1293_1293_128_B_32,Gemm_Rocblas_621294725,0.0814813
GemmStridedBatchedTunableOp_Half_TN,tn_920_920_128_B_32,Gemm_Hipblaslt_TN_153,0.0456988
GemmStridedBatchedTunableOp_Half_TN,tn_975_975_128_B_32,Gemm_Rocblas_621294550,0.0517682
GemmStridedBatchedTunableOp_Half_TN,tn_902_902_128_B_32,Gemm_Hipblaslt_TN_7519,0.0482149
GemmStridedBatchedTunableOp_Half_TN,tn_1282_1282_128_B_32,Gemm_Rocblas_621286810,0.0805907
GemmStridedBatchedTunableOp_Half_TN,tn_816_816_128_B_32,Gemm_Hipblaslt_TN_150,0.0365764
GemmStridedBatchedTunableOp_Half_TN,tn_921_921_128_B_32,Gemm_Hipblaslt_TN_7519,0.049502
GemmStridedBatchedTunableOp_Half_TN,tn_842_842_128_B_32,Gemm_Hipblaslt_TN_7059,0.0445894
GemmStridedBatchedTunableOp_Half_TN,tn_895_895_128_B_32,Gemm_Rocblas_621294105,0.0475789
GemmStridedBatchedTunableOp_Half_TN,tn_1287_1287_128_B_32,Gemm_Rocblas_621294725,0.0808874
GemmStridedBatchedTunableOp_Half_TN,tn_948_948_128_B_32,Gemm_Hipblaslt_TN_7519,0.0519871
GemmStridedBatchedTunableOp_Half_TN,tn_907_907_128_B_32,Gemm_Hipblaslt_TN_7483,0.0490586
GemmStridedBatchedTunableOp_Half_TN,tn_903_903_128_B_32,Gemm_Hipblaslt_TN_7519,0.0485892
GemmStridedBatchedTunableOp_Half_TN,tn_820_820_128_B_32,Gemm_Rocblas_621294635,0.0410848
GemmStridedBatchedTunableOp_Half_TN,tn_817_817_128_B_32,Gemm_Rocblas_621294635,0.0416485
GemmStridedBatchedTunableOp_Half_TN,tn_999_999_128_B_32,Gemm_Hipblaslt_TN_7519,0.0539013
GemmStridedBatchedTunableOp_Half_TN,tn_791_791_128_B_32,Gemm_Rocblas_621294635,0.0394494
GemmStridedBatchedTunableOp_Half_TN,tn_987_987_128_B_32,Gemm_Rocblas_621294550,0.0529654
GemmStridedBatchedTunableOp_Half_TN,tn_1473_1473_128_B_32,Gemm_Rocblas_621286413,0.0984713
GemmStridedBatchedTunableOp_Half_TN,tn_848_848_128_B_32,Gemm_Hipblaslt_TN_150,0.0378699
GemmStridedBatchedTunableOp_Half_TN,tn_988_988_128_B_32,Gemm_Rocblas_621294550,0.0520274
GemmStridedBatchedTunableOp_Half_TN,tn_957_957_128_B_32,Gemm_Hipblaslt_TN_7519,0.0518567
GemmStridedBatchedTunableOp_Half_TN,tn_809_809_128_B_32,Gemm_Rocblas_621294635,0.0405951
GemmStridedBatchedTunableOp_Half_TN,tn_945_945_128_B_32,Gemm_Hipblaslt_TN_7519,0.05133
GemmStridedBatchedTunableOp_Half_TN,tn_861_861_128_B_32,Gemm_Rocblas_621294635,0.0456009
GemmStridedBatchedTunableOp_Half_TN,tn_944_944_128_B_32,Gemm_Rocblas_621286240,0.0465851
GemmStridedBatchedTunableOp_Half_TN,tn_873_873_128_B_32,Gemm_Rocblas_621294635,0.0466577
GemmTunableOp_Half_TN,tn_28672_1778_4096,Gemm_Hipblaslt_TN_9190,0.739991
GemmTunableOp_Half_TN,tn_128256_256_4096,Gemm_Rocblas_621294634,0.602182
GemmTunableOp_Half_TN,tn_4096_877_14336,Gemm_Hipblaslt_TN_9580,0.221218
GemmTunableOp_Half_TN,tn_28672_1600_4096,Gemm_Rocblas_621286678,0.70554
GemmTunableOp_Half_TN,tn_28672_2658_4096,Gemm_Hipblaslt_TN_9827,1.1015
GemmTunableOp_Half_TN,tn_12288_224_4096,Gemm_Rocblas_621286478,0.0570073
GemmTunableOp_Half_TN,tn_6144_854_4096,Gemm_Rocblas_621286778,0.0881062
GemmTunableOp_Half_TN,tn_4096_797_14336,Gemm_Hipblaslt_TN_9158,0.211899
GemmTunableOp_Half_TN,tn_6144_3507_4096,Gemm_Hipblaslt_TN_9570,0.319178
GemmTunableOp_Half_TN,tn_4096_80_4096,Gemm_Rocblas_621286279,0.0153972
GemmTunableOp_Half_TN,tn_4096_1759_14336,Gemm_Hipblaslt_TN_9645,0.395794
GemmTunableOp_Half_TN,tn_128256_24_4096,Gemm_Rocblas_621294578,0.31333
GemmTunableOp_Half_TN,tn_4096_932_4096,Gemm_Hipblaslt_TN_9576,0.0690358
GemmTunableOp_Half_TN,tn_6144_2602_4096,Gemm_Hipblaslt_TN_9768,0.219887
GemmTunableOp_Half_TN,tn_128256_42_4096,Gemm_Hipblaslt_TN_9451,0.332509
GemmTunableOp_Half_TN,tn_6144_1854_4096,Gemm_Hipblaslt_TN_9690,0.167159
GemmTunableOp_Half_TN,tn_28672_3571_4096,Gemm_Hipblaslt_TN_9827,1.38944
GemmTunableOp_Half_TN,tn_4096_1864_14336,Gemm_Hipblaslt_TN_9620,0.412597
GemmTunableOp_Half_TN,tn_4096_56_4096,Gemm_Rocblas_621294227,0.0128569
GemmTunableOp_Half_TN,tn_4096_1756_14336,Gemm_Hipblaslt_TN_9645,0.394562
GemmTunableOp_Half_TN,tn_28672_1807_4096,Gemm_Hipblaslt_TN_9684,0.797324
GemmTunableOp_Half_TN,tn_128256_48_4096,Gemm_Hipblaslt_TN_9451,0.334701
GemmTunableOp_Half_TN,tn_4096_2703_4096,Gemm_Rocblas_621286705,0.164233
GemmTunableOp_Half_TN,tn_28672_7299_4096,Gemm_Hipblaslt_TN_159,2.89316
GemmTunableOp_Half_TN,tn_4096_2544_4096,Gemm_Hipblaslt_TN_9674,0.156706
GemmTunableOp_Half_TN,tn_4096_1756_4096,Gemm_Hipblaslt_TN_9267,0.117267
GemmTunableOp_Half_TN,tn_28672_876_4096,Gemm_Hipblaslt_TN_9683,0.388801
GemmTunableOp_Half_TN,tn_128256_84_4096,Gemm_Hipblaslt_TN_9058,0.392193
GemmTunableOp_Half_TN,tn_6144_938_4096,Gemm_Hipblaslt_TN_9613,0.0944726
GemmTunableOp_Half_TN,tn_4096_2754_4096,Gemm_Rocblas_621286705,0.16782
GemmTunableOp_Half_TN,tn_4096_2651_14336,Gemm_Hipblaslt_TN_9799,0.547172
GemmTunableOp_Half_TN,tn_6144_886_4096,Gemm_Hipblaslt_TN_9253,0.0933056
GemmTunableOp_Half_TN,tn_4096_4483_4096,Gemm_Hipblaslt_TN_9742,0.270293
GemmTunableOp_Half_TN,tn_6144_1794_4096,Gemm_Rocblas_621294447,0.165613
GemmTunableOp_Half_TN,tn_4096_914_14336,Gemm_Hipblaslt_TN_9634,0.231154
GemmTunableOp_Half_TN,tn_4096_3430_4096,Gemm_Hipblaslt_TN_9743,0.196631
GemmTunableOp_Half_TN,tn_6144_958_4096,Gemm_Hipblaslt_TN_9613,0.0953221
GemmTunableOp_Half_TN,tn_6144_868_4096,Gemm_Hipblaslt_TN_9253,0.0920284
GemmTunableOp_Half_TN,tn_28672_1746_4096,Gemm_Hipblaslt_TN_9220,0.73605
GemmTunableOp_Half_TN,tn_12288_247_4096,Gemm_Rocblas_621294215,0.0587711
GemmTunableOp_Half_TN,tn_128256_243_4096,Gemm_Rocblas_621286892,0.600088
GemmTunableOp_Half_TN,tn_4096_849_4096,Gemm_Hipblaslt_TN_9634,0.0647932
GemmTunableOp_Half_TN,tn_4096_957_14336,Gemm_Hipblaslt_TN_9634,0.23287
GemmTunableOp_Half_TN,tn_128256_236_4096,Gemm_Rocblas_621286892,0.603677
GemmTunableOp_Half_TN,tn_6144_932_4096,Gemm_Hipblaslt_TN_9613,0.0946435
GemmTunableOp_Half_TN,tn_12288_246_4096,Gemm_Rocblas_621294215,0.0584623
GemmTunableOp_Half_TN,tn_28672_2786_4096,Gemm_Hipblaslt_TN_9917,1.19818
GemmTunableOp_Half_TN,tn_4096_1733_4096,Gemm_Hipblaslt_TN_9645,0.116073
GemmTunableOp_Half_TN,tn_4096_2699_14336,Gemm_Hipblaslt_TN_9799,0.554716
GemmTunableOp_Half_TN,tn_4096_2658_14336,Gemm_Hipblaslt_TN_9799,0.551031
GemmTunableOp_Half_TN,tn_4096_1742_4096,Gemm_Hipblaslt_TN_9645,0.116486
GemmTunableOp_Half_TN,tn_128256_251_4096,Gemm_Rocblas_621294648,0.610776
GemmTunableOp_Half_TN,tn_22016_3530_4096,Gemm_Hipblaslt_TN_9827,1.09997
GemmTunableOp_Half_TN,tn_6144_2732_4096,Gemm_Hipblaslt_TN_9742,0.254375
GemmTunableOp_Half_TN,tn_4096_1848_14336,Gemm_Hipblaslt_TN_9620,0.411399
GemmTunableOp_Half_TN,tn_4096_903_4096,Gemm_Hipblaslt_TN_9576,0.0671181
GemmTunableOp_Half_TN,tn_6144_2698_4096,Gemm_Hipblaslt_TN_9742,0.253633
GemmTunableOp_Half_TN,tn_28672_2635_4096,Gemm_Hipblaslt_TN_9841,1.09432
GemmTunableOp_Half_TN,tn_28672_1672_4096,Gemm_Rocblas_621294420,0.726658
GemmTunableOp_Half_TN,tn_28672_832_4096,Gemm_Hipblaslt_TN_9684,0.381786
GemmTunableOp_Half_TN,tn_4096_1695_14336,Gemm_Hipblaslt_TN_9679,0.369334
GemmTunableOp_Half_TN,tn_28672_2719_4096,Gemm_Hipblaslt_TN_9787,1.17693
GemmTunableOp_Half_TN,tn_4096_850_14336,Gemm_Hipblaslt_TN_9580,0.219812
GemmTunableOp_Half_TN,tn_6144_2636_4096,Gemm_Hipblaslt_TN_9217,0.223923
GemmTunableOp_Half_TN,tn_4096_927_4096,Gemm_Hipblaslt_TN_9604,0.0697617
GemmTunableOp_Half_TN,tn_6144_1913_4096,Gemm_Rocblas_621286684,0.1685
GemmTunableOp_Half_TN,tn_4096_2635_4096,Gemm_Hipblaslt_TN_9672,0.161541
GemmTunableOp_Half_TN,tn_4096_1701_14336,Gemm_Hipblaslt_TN_9180,0.367894
GemmTunableOp_Half_TN,tn_4096_176_14336,Gemm_Hipblaslt_TN_7585,0.0608831
GemmTunableOp_Half_TN,tn_28672_845_4096,Gemm_Hipblaslt_TN_9683,0.383061
GemmTunableOp_Half_TN,tn_6144_882_4096,Gemm_Hipblaslt_TN_9613,0.0925518
GemmTunableOp_Half_TN,tn_28672_785_4096,Gemm_Hipblaslt_TN_9674,0.351906
GemmTunableOp_Half_TN,tn_6144_929_4096,Gemm_Hipblaslt_TN_9615,0.0941019
GemmTunableOp_Half_TN,tn_28672_1693_4096,Gemm_Hipblaslt_TN_9190,0.729357
GemmTunableOp_Half_TN,tn_28672_812_4096,Gemm_Hipblaslt_TN_9684,0.3789
GemmTunableOp_Half_TN,tn_6144_2537_4096,Gemm_Hipblaslt_TN_9841,0.218736
GemmTunableOp_Half_TN,tn_128256_252_4096,Gemm_Rocblas_621286892,0.612624
GemmTunableOp_Half_TN,tn_28672_839_4096,Gemm_Hipblaslt_TN_9683,0.383628
GemmTunableOp_Half_TN,tn_128256_86_4096,Gemm_Hipblaslt_TN_9057,0.388731
GemmTunableOp_Half_TN,tn_6144_825_4096,Gemm_Rocblas_621294520,0.087979
GemmTunableOp_Half_TN,tn_28672_1739_4096,Gemm_Hipblaslt_TN_9217,0.737651
GemmTunableOp_Half_TN,tn_128256_245_4096,Gemm_Rocblas_621286892,0.606639
GemmTunableOp_Half_TN,tn_4096_936_4096,Gemm_Hipblaslt_TN_9576,0.0708449
GemmTunableOp_Half_TN,tn_128256_219_4096,Gemm_Hipblaslt_TN_9847,0.574409
GemmTunableOp_Half_TN,tn_128256_15_4096,Gemm_Hipblaslt_TN_9405,0.291693
GemmTunableOp_Half_TN,tn_4096_2630_14336,Gemm_Hipblaslt_TN_9799,0.545423
GemmTunableOp_Half_TN,tn_32000_225_4096,Gemm_Hipblaslt_TN_9845,0.128277
GemmTunableOp_Half_TN,tn_4096_1600_4096,Gemm_Hipblaslt_TN_9671,0.10529
GemmTunableOp_Half_TN,tn_4096_253_4096,Gemm_Rocblas_621286440,0.0264178
GemmTunableOp_Half_TN,tn_12288_14_4096,Gemm_Hipblaslt_TN_9176,0.0217795
GemmTunableOp_Half_TN,tn_4096_968_4096,Gemm_Hipblaslt_TN_9604,0.0710184
GemmTunableOp_Half_TN,tn_6144_1783_4096,Gemm_Hipblaslt_TN_9799,0.164338
GemmTunableOp_Half_TN,tn_128256_123_4096,Gemm_Rocblas_621294762,0.430731
GemmTunableOp_Half_TN,tn_128256_94_4096,Gemm_Hipblaslt_TN_9057,0.394494
GemmTunableOp_Half_TN,tn_128256_74_4096,Gemm_Hipblaslt_TN_9058,0.383409
GemmTunableOp_Half_TN,tn_6144_1737_4096,Gemm_Hipblaslt_TN_9799,0.158471
GemmTunableOp_Half_TN,tn_4096_1846_14336,Gemm_Hipblaslt_TN_9620,0.414495
GemmTunableOp_Half_TN,tn_4096_4058_11008,Gemm_Hipblaslt_TN_9768,0.597747
GemmTunableOp_Half_TN,tn_128256_56_4096,Gemm_Rocblas_621286813,0.356519
GemmTunableOp_Half_TN,tn_32000_238_4096,Gemm_Hipblaslt_TN_9845,0.132812
GemmTunableOp_Half_TN,tn_128256_40_4096,Gemm_Hipblaslt_TN_9451,0.328111
GemmTunableOp_Half_TN,tn_4096_242_4096,Gemm_Rocblas_621294171,0.0262218
GemmTunableOp_Half_TN,tn_28672_1759_4096,Gemm_Hipblaslt_TN_9223,0.73669
GemmTunableOp_Half_TN,tn_4096_861_14336,Gemm_Hipblaslt_TN_9580,0.220633
GemmTunableOp_Half_TN,tn_128256_11_4096,Gemm_Hipblaslt_TN_9405,0.290744
GemmTunableOp_Half_TN,tn_12288_29_4096,Gemm_Rocblas_621294154,0.0231917
GemmTunableOp_Half_TN,tn_22016_237_4096,Gemm_Hipblaslt_TN_9720,0.0997993
GemmTunableOp_Half_TN,tn_4096_252_4096,Gemm_Rocblas_621286491,0.0262735
GemmTunableOp_Half_TN,tn_28672_5606_4096,Gemm_Hipblaslt_TN_9865,2.32661
GemmTunableOp_Half_TN,tn_4096_224_4096,Gemm_Rocblas_621294230,0.0253669
GemmTunableOp_Half_TN,tn_4096_246_4096,Gemm_Rocblas_621294173,0.0264827
GemmTunableOp_Half_TN,tn_4096_33_4096,Gemm_Rocblas_621294155,0.0125657
GemmTunableOp_Half_TN,tn_128256_168_4096,Gemm_Hipblaslt_TN_9953,0.511753
GemmTunableOp_Half_TN,tn_4096_872_4096,Gemm_Hipblaslt_TN_9170,0.0660513
GemmTunableOp_Half_TN,tn_32000_237_4096,Gemm_Hipblaslt_TN_9845,0.130243
GemmTunableOp_Half_TN,tn_28672_208_4096,Gemm_Hipblaslt_TN_9267,0.111535
GemmTunableOp_Half_TN,tn_4096_3565_4096,Gemm_Hipblaslt_TN_9188,0.201044
GemmTunableOp_Half_TN,tn_12288_2862_4096,Gemm_Hipblaslt_TN_9690,0.507436
GemmTunableOp_Half_TN,tn_6144_790_4096,Gemm_Hipblaslt_TN_9253,0.0861198
GemmTunableOp_Half_TN,tn_32000_255_4096,Gemm_Hipblaslt_TN_9845,0.139237
GemmTunableOp_Half_TN,tn_4096_30_11008,Gemm_Rocblas_621294044,0.0248803
GemmTunableOp_Half_TN,tn_4096_1931_14336,Gemm_Hipblaslt_TN_9645,0.419499
GemmTunableOp_Half_TN,tn_32000_239_4096,Gemm_Hipblaslt_TN_9845,0.136026
GemmTunableOp_Half_TN,tn_4096_893_14336,Gemm_Hipblaslt_TN_9580,0.220615
GemmTunableOp_Half_TN,tn_28672_1729_4096,Gemm_Rocblas_621286678,0.732543
GemmTunableOp_Half_TN,tn_4096_228_11008,Gemm_Hipblaslt_TN_8879,0.062397
GemmTunableOp_Half_TN,tn_4096_2717_4096,Gemm_Hipblaslt_TN_9674,0.16289
GemmTunableOp_Half_TN,tn_28672_805_4096,Gemm_Hipblaslt_TN_9684,0.382354
GemmTunableOp_Half_TN,tn_4096_16_4096,Gemm_Rocblas_621294130,0.0101629
GemmTunableOp_Half_TN,tn_4096_2670_4096,Gemm_Hipblaslt_TN_9657,0.162121
GemmTunableOp_Half_TN,tn_6144_1822_4096,Gemm_Hipblaslt_TN_9799,0.167684
GemmTunableOp_Half_TN,tn_6144_8049_4096,Gemm_Hipblaslt_TN_9914,0.673754
GemmTunableOp_Half_TN,tn_4096_813_4096,Gemm_Hipblaslt_TN_9604,0.0641701
GemmTunableOp_Half_TN,tn_32000_33_4096,Gemm_Hipblaslt_TN_9532,0.0538328
GemmTunableOp_Half_TN,tn_4096_2630_4096,Gemm_Hipblaslt_TN_9799,0.160597
GemmTunableOp_Half_TN,tn_12288_2834_4096,Gemm_Rocblas_621286747,0.504052
GemmTunableOp_Half_TN,tn_32000_223_4096,Gemm_Hipblaslt_TN_9592,0.127616
GemmTunableOp_Half_TN,tn_4096_3671_14336,Gemm_Hipblaslt_TN_9815,0.725696
GemmTunableOp_Half_TN,tn_128256_170_4096,Gemm_Hipblaslt_TN_9732,0.509009
GemmTunableOp_Half_TN,tn_4096_961_14336,Gemm_Hipblaslt_TN_9634,0.236524
GemmTunableOp_Half_TN,tn_12288_219_4096,Gemm_Rocblas_621294215,0.0567192
GemmTunableOp_Half_TN,tn_4096_8_11008,Gemm_Rocblas_621294135,0.0231124
GemmTunableOp_Half_TN,tn_4096_2601_4096,Gemm_Hipblaslt_TN_9672,0.160972
GemmTunableOp_Half_TN,tn_12288_3173_4096,Gemm_Hipblaslt_TN_9697,0.557069
GemmTunableOp_Half_TN,tn_28672_3431_4096,Gemm_Hipblaslt_TN_9827,1.36718
GemmTunableOp_Half_TN,tn_6144_1944_4096,Gemm_Hipblaslt_TN_9697,0.179022
GemmTunableOp_Half_TN,tn_4096_251_11008,Gemm_Hipblaslt_TN_9303,0.0665194
GemmTunableOp_Half_TN,tn_4096_948_14336,Gemm_Hipblaslt_TN_9634,0.233962
GemmTunableOp_Half_TN,tn_4096_2786_11008,Gemm_Hipblaslt_TN_9799,0.437597
GemmTunableOp_Half_TN,tn_4096_930_14336,Gemm_Hipblaslt_TN_9634,0.233328
GemmTunableOp_Half_TN,tn_28672_2750_4096,Gemm_Rocblas_621286742,1.194
GemmTunableOp_Half_TN,tn_128256_116_4096,Gemm_Hipblaslt_TN_9771,0.424559
GemmTunableOp_Half_TN,tn_4096_982_14336,Gemm_Hipblaslt_TN_9586,0.245653
GemmTunableOp_Half_TN,tn_22016_252_4096,Gemm_Hipblaslt_TN_9641,0.10111
GemmTunableOp_Half_TN,tn_22016_2962_4096,Gemm_Hipblaslt_TN_9827,0.917353
GemmTunableOp_Half_TN,tn_32000_230_4096,Gemm_Hipblaslt_TN_9845,0.133691
GemmTunableOp_Half_TN,tn_12288_223_4096,Gemm_Rocblas_621286478,0.0570145
GemmTunableOp_Half_TN,tn_28672_983_4096,Gemm_Hipblaslt_TN_9825,0.439595
GemmTunableOp_Half_TN,tn_4096_1729_14336,Gemm_Hipblaslt_TN_9645,0.393799
GemmTunableOp_Half_TN,tn_4096_949_14336,Gemm_Hipblaslt_TN_9634,0.23301
GemmTunableOp_Half_TN,tn_12288_3333_4096,Gemm_Hipblaslt_TN_9677,0.574765
GemmTunableOp_Half_TN,tn_12288_2842_4096,Gemm_Hipblaslt_TN_9691,0.507354
GemmTunableOp_Half_TN,tn_4096_1785_4096,Gemm_Hipblaslt_TN_9645,0.117991
GemmTunableOp_Half_TN,tn_4096_888_14336,Gemm_Hipblaslt_TN_9580,0.220115
GemmTunableOp_Half_TN,tn_6144_877_4096,Gemm_Hipblaslt_TN_9253,0.0915438
GemmTunableOp_Half_TN,tn_22016_3267_4096,Gemm_Hipblaslt_TN_9827,1.08055
GemmTunableOp_Half_TN,tn_4096_1261_4096,Gemm_Hipblaslt_TN_9148,0.0898464
GemmTunableOp_Half_TN,tn_28672_2628_4096,Gemm_Hipblaslt_TN_9827,1.08062
GemmTunableOp_Half_TN,tn_22016_4035_4096,Gemm_Hipblaslt_TN_9841,1.30101
GemmTunableOp_Half_TN,tn_22016_27_4096,Gemm_Rocblas_621286346,0.0364471
GemmTunableOp_Half_TN,tn_28672_895_4096,Gemm_Hipblaslt_TN_9677,0.39193
GemmTunableOp_Half_TN,tn_4096_216_11008,Gemm_Hipblaslt_TN_9363,0.0586959
GemmTunableOp_Half_TN,tn_4096_8192_4096,Gemm_Hipblaslt_TN_9813,0.460281
GemmTunableOp_Half_TN,tn_32000_252_4096,Gemm_Hipblaslt_TN_9845,0.138175
GemmTunableOp_Half_TN,tn_28672_881_4096,Gemm_Hipblaslt_TN_9677,0.391472
GemmTunableOp_Half_TN,tn_4096_36_4096,Gemm_Rocblas_621294155,0.0125986
GemmTunableOp_Half_TN,tn_28672_1755_4096,Gemm_Hipblaslt_TN_9190,0.740225
GemmTunableOp_Half_TN,tn_4096_3352_14336,Gemm_Hipblaslt_TN_9187,0.664762
GemmTunableOp_Half_TN,tn_4096_2860_14336,Gemm_Hipblaslt_TN_9799,0.580749
GemmTunableOp_Half_TN,tn_12288_218_4096,Gemm_Rocblas_621294215,0.0567689
GemmTunableOp_Half_TN,tn_4096_2762_14336,Gemm_Hipblaslt_TN_9799,0.564602
GemmTunableOp_Half_TN,tn_4096_2866_11008,Gemm_Hipblaslt_TN_9566,0.447448
GemmTunableOp_Half_TN,tn_4096_2708_4096,Gemm_Hipblaslt_TN_9799,0.164182
GemmTunableOp_Half_TN,tn_4096_891_14336,Gemm_Hipblaslt_TN_9580,0.222402
GemmTunableOp_Half_TN,tn_6144_1757_4096,Gemm_Hipblaslt_TN_9799,0.158909
GemmTunableOp_Half_TN,tn_4096_1762_14336,Gemm_Hipblaslt_TN_9645,0.395475
GemmTunableOp_Half_TN,tn_128256_199_4096,Gemm_Hipblaslt_TN_9847,0.562763
GemmTunableOp_Half_TN,tn_6144_128_4096,Gemm_Rocblas_621286491,0.0236427
GemmTunableOp_Half_TN,tn_22016_221_4096,Gemm_Hipblaslt_TN_9720,0.0965832
GemmTunableOp_Half_TN,tn_4096_2648_14336,Gemm_Hipblaslt_TN_9799,0.548825
GemmTunableOp_Half_TN,tn_4096_3263_11008,Gemm_Hipblaslt_TN_9696,0.503938
GemmTunableOp_Half_TN,tn_4096_22_11008,Gemm_Rocblas_621286305,0.0243162
GemmTunableOp_Half_TN,tn_22016_1261_4096,Gemm_Rocblas_621286670,0.431397
GemmTunableOp_Half_TN,tn_22016_241_4096,Gemm_Hipblaslt_TN_9720,0.099132
GemmTunableOp_Half_TN,tn_28672_3569_4096,Gemm_Hipblaslt_TN_9827,1.38592
GemmTunableOp_Half_TN,tn_22016_21_4096,Gemm_Rocblas_621286346,0.0360588
GemmTunableOp_Half_TN,tn_4096_1762_4096,Gemm_Hipblaslt_TN_9134,0.116693
GemmTunableOp_Half_TN,tn_4096_911_4096,Gemm_Hipblaslt_TN_9604,0.0681439
GemmTunableOp_Half_TN,tn_4096_838_14336,Gemm_Hipblaslt_TN_9131,0.224792
GemmTunableOp_Half_TN,tn_6144_2734_4096,Gemm_Hipblaslt_TN_9742,0.254722
GemmTunableOp_Half_TN,tn_4096_30_4096,Gemm_Rocblas_621286328,0.0120024
GemmTunableOp_Half_TN,tn_22016_14_4096,Gemm_Rocblas_621286317,0.0352393
GemmTunableOp_Half_TN,tn_4096_2842_11008,Gemm_Hipblaslt_TN_9676,0.446881
GemmTunableOp_Half_TN,tn_4096_217_11008,Gemm_Hipblaslt_TN_9363,0.0586257
GemmTunableOp_Half_TN,tn_12288_24_4096,Gemm_Rocblas_621286427,0.0229337
GemmTunableOp_Half_TN,tn_6144_845_4096,Gemm_Rocblas_621286778,0.0882046
GemmTunableOp_Half_TN,tn_28672_2672_4096,Gemm_Hipblaslt_TN_9827,1.09383
GemmTunableOp_Half_TN,tn_4096_2978_11008,Gemm_Hipblaslt_TN_9799,0.460248
GemmTunableOp_Half_TN,tn_28672_922_4096,Gemm_Hipblaslt_TN_9684,0.397072
GemmTunableOp_Half_TN,tn_4096_220_11008,Gemm_Hipblaslt_TN_9363,0.0598465
GemmTunableOp_Half_TN,tn_4096_1829_14336,Gemm_Hipblaslt_TN_9620,0.410141
GemmTunableOp_Half_TN,tn_4096_7_4096,Gemm_Rocblas_621294136,0.00999943
GemmTunableOp_Half_TN,tn_4096_3670_4096,Gemm_Hipblaslt_TN_9841,0.214638
GemmTunableOp_Half_TN,tn_22016_227_4096,Gemm_Hipblaslt_TN_9720,0.0981179
GemmTunableOp_Half_TN,tn_28672_4483_4096,Gemm_Hipblaslt_TN_9840,1.84912
GemmTunableOp_Half_TN,tn_4096_2682_4096,Gemm_Hipblaslt_TN_9799,0.163033
GemmTunableOp_Half_TN,tn_6144_1886_4096,Gemm_Rocblas_621286684,0.167037
GemmTunableOp_Half_TN,tn_4096_31_11008,Gemm_Rocblas_621286323,0.0246816
GemmTunableOp_Half_TN,tn_4096_224_11008,Gemm_Hipblaslt_TN_9363,0.058516
GemmTunableOp_Half_TN,tn_32000_9_4096,Gemm_Rocblas_621294053,0.0522657
GemmTunableOp_Half_TN,tn_12288_3243_4096,Gemm_Hipblaslt_TN_9697,0.56371
GemmTunableOp_Half_TN,tn_28672_1783_4096,Gemm_Hipblaslt_TN_9223,0.741961
GemmTunableOp_Half_TN,tn_6144_1900_4096,Gemm_Hipblaslt_TN_9209,0.169487
GemmTunableOp_Half_TN,tn_6144_3711_4096,Gemm_Hipblaslt_TN_9690,0.334524
GemmTunableOp_Half_TN,tn_28672_136_4096,Gemm_Hipblaslt_TN_9319,0.0866331
GemmTunableOp_Half_TN,tn_4096_4021_11008,Gemm_Hipblaslt_TN_9768,0.589229
GemmTunableOp_Half_TN,tn_6144_4242_4096,Gemm_Rocblas_621286747,0.377817
GemmTunableOp_Half_TN,tn_6144_248_4096,Gemm_Rocblas_621294232,0.0369077
GemmTunableOp_Half_TN,tn_4096_947_4096,Gemm_Hipblaslt_TN_9634,0.0695347
GemmTunableOp_Half_TN,tn_128256_98_4096,Gemm_Rocblas_621294762,0.415061
GemmTunableOp_Half_TN,tn_28672_1775_4096,Gemm_Hipblaslt_TN_9223,0.74257
GemmTunableOp_Half_TN,tn_32000_254_4096,Gemm_Hipblaslt_TN_9845,0.132725
GemmTunableOp_Half_TN,tn_6144_1762_4096,Gemm_Hipblaslt_TN_9672,0.163785
GemmTunableOp_Half_TN,tn_4096_255_11008,Gemm_Hipblaslt_TN_9303,0.0670618
GemmTunableOp_Half_TN,tn_4096_821_4096,Gemm_Hipblaslt_TN_9634,0.0638725
GemmTunableOp_Half_TN,tn_4096_2602_4096,Gemm_Hipblaslt_TN_9799,0.161255
GemmTunableOp_Half_TN,tn_12288_35_4096,Gemm_Rocblas_621286443,0.0255565
GemmTunableOp_Half_TN,tn_32000_245_4096,Gemm_Hipblaslt_TN_9745,0.138389
GemmTunableOp_Half_TN,tn_4096_1705_14336,Gemm_Hipblaslt_TN_9671,0.36746
GemmTunableOp_Half_TN,tn_28672_2785_4096,Gemm_Hipblaslt_TN_9917,1.19682
GemmTunableOp_Half_TN,tn_4096_2978_4096,Gemm_Rocblas_621286683,0.174386
GemmTunableOp_Half_TN,tn_4096_136_4096,Gemm_Hipblaslt_TN_9474,0.0216031
GemmTunableOp_Half_TN,tn_6144_2509_4096,Gemm_Hipblaslt_TN_9768,0.219548
GemmTunableOp_Half_TN,tn_12288_30_4096,Gemm_Rocblas_621286427,0.0231803
GemmTunableOp_Half_TN,tn_12288_237_4096,Gemm_Rocblas_621286478,0.0575946
GemmTunableOp_Half_TN,tn_128256_139_4096,Gemm_Hipblaslt_TN_9808,0.468275
GemmTunableOp_Half_TN,tn_4096_790_4096,Gemm_Hipblaslt_TN_9352,0.0638632
GemmTunableOp_Half_TN,tn_6144_208_4096,Gemm_Hipblaslt_TN_9495,0.0331524
GemmTunableOp_Half_TN,tn_128256_211_4096,Gemm_Hipblaslt_TN_9847,0.571354
GemmTunableOp_Half_TN,tn_28672_816_4096,Gemm_Hipblaslt_TN_9684,0.38055
GemmTunableOp_Half_TN,tn_28672_3507_4096,Gemm_Hipblaslt_TN_9827,1.37142
GemmTunableOp_Half_TN,tn_6144_939_4096,Gemm_Hipblaslt_TN_9133,0.0951574
GemmTunableOp_Half_TN,tn_32000_218_4096,Gemm_Hipblaslt_TN_9590,0.125497
GemmTunableOp_Half_TN,tn_4096_2754_11008,Gemm_Hipblaslt_TN_9799,0.437042
GemmTunableOp_Half_TN,tn_4096_3891_11008,Gemm_Hipblaslt_TN_9190,0.578519
GemmTunableOp_Half_TN,tn_6144_40_4096,Gemm_Rocblas_621294155,0.0154215
GemmTunableOp_Half_TN,tn_128256_64_4096,Gemm_Rocblas_621286813,0.353831
GemmTunableOp_Half_TN,tn_32000_236_4096,Gemm_Hipblaslt_TN_9845,0.130797
GemmTunableOp_Half_TN,tn_28672_1697_4096,Gemm_Hipblaslt_TN_9223,0.728647
GemmTunableOp_Half_TN,tn_4096_2722_4096,Gemm_Hipblaslt_TN_9674,0.165456
GemmTunableOp_Half_TN,tn_128256_188_4096,Gemm_Hipblaslt_TN_9752,0.519691
GemmTunableOp_Half_TN,tn_128256_80_4096,Gemm_Hipblaslt_TN_9057,0.383922
GemmTunableOp_Half_TN,tn_6144_992_4096,Gemm_Rocblas_621294311,0.100124
GemmTunableOp_Half_TN,tn_4096_4021_4096,Gemm_Hipblaslt_TN_9768,0.226265
GemmTunableOp_Half_TN,tn_22016_2894_4096,Gemm_Hipblaslt_TN_9827,0.918994
GemmTunableOp_Half_TN,tn_6144_1777_4096,Gemm_Rocblas_621286683,0.164138
GemmTunableOp_Half_TN,tn_32000_234_4096,Gemm_Hipblaslt_TN_9845,0.134659
GemmTunableOp_Half_TN,tn_4096_2938_4096,Gemm_Rocblas_621294425,0.175267
GemmTunableOp_Half_TN,tn_22016_3925_4096,Gemm_Hipblaslt_TN_9832,1.24699
GemmTunableOp_Half_TN,tn_4096_244_11008,Gemm_Hipblaslt_TN_9303,0.065302
GemmTunableOp_Half_TN,tn_28672_4242_4096,Gemm_Hipblaslt_TN_9827,1.66199
GemmTunableOp_Half_TN,tn_6144_927_4096,Gemm_Hipblaslt_TN_9613,0.0935098
GemmTunableOp_Half_TN,tn_22016_19_4096,Gemm_Rocblas_621286346,0.035901
GemmTunableOp_Half_TN,tn_6144_7817_4096,Gemm_Hipblaslt_TN_9753,0.663042
GemmTunableOp_Half_TN,tn_22016_231_4096,Gemm_Hipblaslt_TN_9720,0.100021
GemmTunableOp_Half_TN,tn_6144_863_4096,Gemm_Rocblas_621294520,0.0887438
GemmTunableOp_Half_TN,tn_28672_847_4096,Gemm_Hipblaslt_TN_9684,0.384195
GemmTunableOp_Half_TN,tn_4096_3000_11008,Gemm_Hipblaslt_TN_9709,0.461372
GemmTunableOp_Half_TN,tn_4096_226_11008,Gemm_Hipblaslt_TN_7627,0.0620461
GemmTunableOp_Half_TN,tn_4096_104_4096,Gemm_Rocblas_621286279,0.0166285
GemmTunableOp_Half_TN,tn_4096_253_11008,Gemm_Hipblaslt_TN_7627,0.0668006
GemmTunableOp_Half_TN,tn_4096_3431_14336,Gemm_Hipblaslt_TN_9187,0.67207
GemmTunableOp_Half_TN,tn_4096_1744_4096,Gemm_Hipblaslt_TN_9645,0.117435
GemmTunableOp_Half_TN,tn_6144_3310_4096,Gemm_Hipblaslt_TN_9570,0.304308
GemmTunableOp_Half_TN,tn_6144_808_4096,Gemm_Hipblaslt_TN_9561,0.0862167
GemmTunableOp_Half_TN,tn_4096_243_4096,Gemm_Rocblas_621286491,0.0265812
GemmTunableOp_Half_TN,tn_128256_163_4096,Gemm_Hipblaslt_TN_9732,0.507553
GemmTunableOp_Half_TN,tn_22016_1000_4096,Gemm_Rocblas_621286792,0.361532
GemmTunableOp_Half_TN,tn_28672_1834_4096,Gemm_Hipblaslt_TN_9684,0.799775
GemmTunableOp_Half_TN,tn_128256_180_4096,Gemm_Hipblaslt_TN_9661,0.515848
GemmTunableOp_Half_TN,tn_28672_921_4096,Gemm_Hipblaslt_TN_9684,0.397578
GemmTunableOp_Half_TN,tn_4096_848_4096,Gemm_Hipblaslt_TN_9604,0.0648502
GemmTunableOp_Half_TN,tn_6144_1775_4096,Gemm_Rocblas_621286684,0.164051
GemmTunableOp_Half_TN,tn_22016_36_4096,Gemm_Rocblas_621286464,0.0383203
GemmTunableOp_Half_TN,tn_4096_905_14336,Gemm_Hipblaslt_TN_9634,0.231656
GemmTunableOp_Half_TN,tn_22016_2946_4096,Gemm_Hipblaslt_TN_9841,0.920374
GemmTunableOp_Half_TN,tn_4096_916_4096,Gemm_Hipblaslt_TN_9634,0.0692759
GemmTunableOp_Half_TN,tn_4096_227_4096,Gemm_Rocblas_621286491,0.0256191
GemmTunableOp_Half_TN,tn_22016_243_4096,Gemm_Hipblaslt_TN_9720,0.098341
GemmTunableOp_Half_TN,tn_4096_918_14336,Gemm_Hipblaslt_TN_9634,0.231282
GemmTunableOp_Half_TN,tn_22016_7_4096,Gemm_Rocblas_621286317,0.0351318
GemmTunableOp_Half_TN,tn_4096_809_4096,Gemm_Hipblaslt_TN_9634,0.0638618
GemmTunableOp_Half_TN,tn_4096_237_4096,Gemm_Rocblas_621286443,0.0258896
GemmTunableOp_Half_TN,tn_4096_7239_4096,Gemm_Hipblaslt_TN_9221,0.412276
GemmTunableOp_Half_TN,tn_4096_120_14336,Gemm_Hipblaslt_TN_7160,0.0466908
GemmTunableOp_Half_TN,tn_6144_915_4096,Gemm_Hipblaslt_TN_9613,0.0936069
GemmTunableOp_Half_TN,tn_22016_2000_4096,Gemm_Hipblaslt_TN_9840,0.677548
GemmTunableOp_Half_TN,tn_6144_1803_4096,Gemm_Rocblas_621286684,0.163575
GemmTunableOp_Half_TN,tn_4096_221_11008,Gemm_Hipblaslt_TN_9363,0.0600351
GemmTunableOp_Half_TN,tn_4096_3263_4096,Gemm_Hipblaslt_TN_9832,0.189779
GemmTunableOp_Half_TN,tn_4096_1730_4096,Gemm_Hipblaslt_TN_9645,0.117107
GemmTunableOp_Half_TN,tn_12288_3891_4096,Gemm_Hipblaslt_TN_9768,0.661803
GemmTunableOp_Half_TN,tn_4096_862_14336,Gemm_Hipblaslt_TN_9580,0.220651
GemmTunableOp_Half_TN,tn_12288_3535_4096,Gemm_Hipblaslt_TN_9677,0.600267
GemmTunableOp_Half_TN,tn_4096_8000_14336,Gemm_Hipblaslt_TN_9753,1.61435
GemmTunableOp_Half_TN,tn_22016_3987_4096,Gemm_Hipblaslt_TN_9832,1.25303
GemmTunableOp_Half_TN,tn_4096_72_4096,Gemm_Rocblas_621294029,0.0153086
GemmTunableOp_Half_TN,tn_6144_925_4096,Gemm_Hipblaslt_TN_9613,0.0939661
GemmTunableOp_Half_TN,tn_28672_843_4096,Gemm_Hipblaslt_TN_9683,0.385769
GemmTunableOp_Half_TN,tn_4096_3418_4096,Gemm_Hipblaslt_TN_9814,0.196643
GemmTunableOp_Half_TN,tn_12288_253_4096,Gemm_Rocblas_621286478,0.0583243
GemmTunableOp_Half_TN,tn_6144_1719_4096,Gemm_Hipblaslt_TN_9570,0.156515
GemmTunableOp_Half_TN,tn_4096_4483_14336,Gemm_Hipblaslt_TN_9763,0.955675
GemmTunableOp_Half_TN,tn_4096_837_4096,Gemm_Hipblaslt_TN_9604,0.0649697
GemmTunableOp_Half_TN,tn_4096_2750_11008,Gemm_Hipblaslt_TN_9799,0.439526
GemmTunableOp_Half_TN,tn_28672_966_4096,Gemm_Hipblaslt_TN_9716,0.435165
GemmTunableOp_Half_TN,tn_4096_1805_4096,Gemm_Hipblaslt_TN_9680,0.119386
GemmTunableOp_Half_TN,tn_28672_1785_4096,Gemm_Hipblaslt_TN_9217,0.744141
GemmTunableOp_Half_TN,tn_32000_247_4096,Gemm_Hipblaslt_TN_9845,0.131832
GemmTunableOp_Half_TN,tn_28672_8070_4096,Gemm_Hipblaslt_TN_9959,3.3229
GemmTunableOp_Half_TN,tn_28672_7944_4096,Gemm_Hipblaslt_TN_159,3.18154
GemmTunableOp_Half_TN,tn_128256_227_4096,Gemm_Rocblas_621286892,0.595388
GemmTunableOp_Half_TN,tn_4096_3599_4096,Gemm_Hipblaslt_TN_9743,0.203154
GemmTunableOp_Half_TN,tn_6144_3662_4096,Gemm_Hipblaslt_TN_9672,0.326397
GemmTunableOp_Half_TN,tn_4096_969_4096,Gemm_Hipblaslt_TN_9604,0.0710166
GemmTunableOp_Half_TN,tn_4096_7239_14336,Gemm_Hipblaslt_TN_9743,1.45153
GemmTunableOp_Half_TN,tn_4096_245_11008,Gemm_Hipblaslt_TN_8879,0.0636716
GemmTunableOp_Half_TN,tn_28672_859_4096,Gemm_Hipblaslt_TN_9683,0.384485
GemmTunableOp_Half_TN,tn_28672_24_4096,Gemm_Rocblas_621286346,0.0459863
GemmTunableOp_Half_TN,tn_28672_901_4096,Gemm_Hipblaslt_TN_9189,0.394018
GemmTunableOp_Half_TN,tn_4096_5606_4096,Gemm_Rocblas_621286580,0.337371
GemmTunableOp_Half_TN,tn_28672_957_4096,Gemm_Hipblaslt_TN_9683,0.398664
GemmTunableOp_Half_TN,tn_12288_2802_4096,Gemm_Hipblaslt_TN_9690,0.501974
GemmTunableOp_Half_TN,tn_28672_48_4096,Gemm_Hipblaslt_TN_9532,0.0486199
GemmTunableOp_Half_TN,tn_6144_840_4096,Gemm_Rocblas_621286778,0.0890351
GemmTunableOp_Half_TN,tn_28672_3752_4096,Gemm_Hipblaslt_TN_9827,1.52772
GemmTunableOp_Half_TN,tn_4096_7436_4096,Gemm_Rocblas_621294127,0.428521
GemmTunableOp_Half_TN,tn_28672_4471_4096,Gemm_Hipblaslt_TN_9904,1.79947
GemmTunableOp_Half_TN,tn_4096_1794_14336,Gemm_Hipblaslt_TN_9268,0.409715
GemmTunableOp_Half_TN,tn_4096_218_4096,Gemm_Rocblas_621286491,0.0252347
GemmTunableOp_Half_TN,tn_6144_112_4096,Gemm_Rocblas_621286440,0.0232851
GemmTunableOp_Half_TN,tn_6144_1835_4096,Gemm_Rocblas_621286683,0.166009
GemmTunableOp_Half_TN,tn_4096_1763_4096,Gemm_Hipblaslt_TN_9134,0.116645
GemmTunableOp_Half_TN,tn_4096_3479_14336,Gemm_Hipblaslt_TN_9743,0.683774
GemmTunableOp_Half_TN,tn_6144_964_4096,Gemm_Rocblas_621286571,0.100676
GemmTunableOp_Half_TN,tn_4096_8007_14336,Gemm_Hipblaslt_TN_9749,1.63331
GemmTunableOp_Half_TN,tn_4096_944_14336,Gemm_Hipblaslt_TN_9634,0.233399
GemmTunableOp_Half_TN,tn_4096_136_14336,Gemm_Hipblaslt_TN_7219,0.0518657
GemmTunableOp_Half_TN,tn_6144_934_4096,Gemm_Hipblaslt_TN_9613,0.0938853
GemmTunableOp_Half_TN,tn_4096_144_4096,Gemm_Hipblaslt_TN_9127,0.0223303
GemmTunableOp_Half_TN,tn_4096_2762_4096,Gemm_Hipblaslt_TN_9799,0.166054
GemmTunableOp_Half_TN,tn_6144_937_4096,Gemm_Hipblaslt_TN_9611,0.0934973
GemmTunableOp_Half_TN,tn_4096_128_14336,Gemm_Hipblaslt_TN_7160,0.0471168
GemmTunableOp_Half_TN,tn_22016_251_4096,Gemm_Hipblaslt_TN_9720,0.100884
GemmTunableOp_Half_TN,tn_28672_1913_4096,Gemm_Hipblaslt_TN_9832,0.809249
GemmTunableOp_Half_TN,tn_128256_154_4096,Gemm_Hipblaslt_TN_9808,0.476261
GemmTunableOp_Half_TN,tn_4096_954_14336,Gemm_Hipblaslt_TN_9634,0.233118
GemmTunableOp_Half_TN,tn_28672_916_4096,Gemm_Hipblaslt_TN_9684,0.397225
GemmTunableOp_Half_TN,tn_128256_20_4096,Gemm_Hipblaslt_TN_9451,0.311655
GemmTunableOp_Half_TN,tn_4096_245_4096,Gemm_Rocblas_621294230,0.0263164
GemmTunableOp_Half_TN,tn_28672_2571_4096,Gemm_Hipblaslt_TN_9827,1.08951
GemmTunableOp_Half_TN,tn_4096_855_14336,Gemm_Hipblaslt_TN_9580,0.22141
GemmTunableOp_Half_TN,tn_4096_924_14336,Gemm_Hipblaslt_TN_9589,0.233123
GemmTunableOp_Half_TN,tn_28672_3430_4096,Gemm_Hipblaslt_TN_9827,1.36714
GemmTunableOp_Half_TN,tn_28672_200_4096,Gemm_Hipblaslt_TN_9267,0.109554
GemmTunableOp_Half_TN,tn_6144_2826_4096,Gemm_Hipblaslt_TN_9742,0.263614
GemmTunableOp_Half_TN,tn_4096_184_4096,Gemm_Rocblas_621294168,0.0234796
GemmTunableOp_Half_TN,tn_4096_7817_14336,Gemm_Hipblaslt_TN_9815,1.60179
GemmTunableOp_Half_TN,tn_28672_2630_4096,Gemm_Hipblaslt_TN_9827,1.08496
GemmTunableOp_Half_TN,tn_4096_891_4096,Gemm_Hipblaslt_TN_9547,0.0667685
GemmTunableOp_Half_TN,tn_22016_2850_4096,Gemm_Hipblaslt_TN_9827,0.912447
GemmTunableOp_Half_TN,tn_4096_2509_4096,Gemm_Hipblaslt_TN_9709,0.156482
GemmTunableOp_Half_TN,tn_22016_2798_4096,Gemm_Hipblaslt_TN_9827,0.899317
GemmTunableOp_Half_TN,tn_6144_861_4096,Gemm_Rocblas_621286778,0.0886776
GemmTunableOp_Half_TN,tn_4096_834_4096,Gemm_Hipblaslt_TN_9604,0.0647014
GemmTunableOp_Half_TN,tn_6144_7266_4096,Gemm_Hipblaslt_TN_9677,0.608994
GemmTunableOp_Half_TN,tn_4096_8_14336,Gemm_Rocblas_621286312,0.0232557
GemmTunableOp_Half_TN,tn_6144_72_4096,Gemm_Rocblas_621294029,0.0181376
GemmTunableOp_Half_TN,tn_28672_8192_4096,Gemm_Hipblaslt_TN_9804,3.33706
GemmTunableOp_Half_TN,tn_28672_929_4096,Gemm_Hipblaslt_TN_9683,0.40308
GemmTunableOp_Half_TN,tn_4096_1724_4096,Gemm_Hipblaslt_TN_9679,0.107961
GemmTunableOp_Half_TN,tn_4096_1785_14336,Gemm_Hipblaslt_TN_9645,0.397018
GemmTunableOp_Half_TN,tn_28672_837_4096,Gemm_Hipblaslt_TN_9684,0.380998
GemmTunableOp_Half_TN,tn_4096_934_14336,Gemm_Hipblaslt_TN_9634,0.233686
GemmTunableOp_Half_TN,tn_4096_4242_14336,Gemm_Hipblaslt_TN_9713,0.794144
GemmTunableOp_Half_TN,tn_4096_2699_4096,Gemm_Hipblaslt_TN_9672,0.163537
GemmTunableOp_Half_TN,tn_4096_913_14336,Gemm_Hipblaslt_TN_9634,0.231492
GemmTunableOp_Half_TN,tn_22016_236_4096,Gemm_Hipblaslt_TN_9720,0.100047
GemmTunableOp_Half_TN,tn_6144_240_4096,Gemm_Hipblaslt_TN_9495,0.0335753
GemmTunableOp_Half_TN,tn_6144_7952_4096,Gemm_Hipblaslt_TN_9914,0.667231
GemmTunableOp_Half_TN,tn_4096_2778_11008,Gemm_Hipblaslt_TN_9709,0.435431
GemmTunableOp_Half_TN,tn_28672_925_4096,Gemm_Hipblaslt_TN_9684,0.39811
GemmTunableOp_Half_TN,tn_6144_7823_4096,Gemm_Hipblaslt_TN_9704,0.663069
GemmTunableOp_Half_TN,tn_4096_216_4096,Gemm_Rocblas_621294230,0.0256291
GemmTunableOp_Half_TN,tn_4096_3669_4096,Gemm_Hipblaslt_TN_9704,0.212
GemmTunableOp_Half_TN,tn_28672_1705_4096,Gemm_Hipblaslt_TN_9217,0.730442
GemmTunableOp_Half_TN,tn_28672_2560_4096,Gemm_Hipblaslt_TN_9846,1.04063
GemmTunableOp_Half_TN,tn_28672_7937_4096,Gemm_Hipblaslt_TN_159,3.18984
GemmTunableOp_Half_TN,tn_4096_1723_14336,Gemm_Hipblaslt_TN_9671,0.370301
GemmTunableOp_Half_TN,tn_28672_1893_4096,Gemm_Hipblaslt_TN_9832,0.810963
GemmTunableOp_Half_TN,tn_28672_2601_4096,Gemm_Hipblaslt_TN_9827,1.08684
GemmTunableOp_Half_TN,tn_6144_7953_4096,Gemm_Hipblaslt_TN_9768,0.66774
GemmTunableOp_Half_TN,tn_4096_888_4096,Gemm_Hipblaslt_TN_9252,0.0683467
GemmTunableOp_Half_TN,tn_4096_871_14336,Gemm_Hipblaslt_TN_9580,0.221524
GemmTunableOp_Half_TN,tn_4096_7967_4096,Gemm_Rocblas_621294127,0.448145
GemmTunableOp_Half_TN,tn_4096_811_14336,Gemm_Hipblaslt_TN_9147,0.213129
GemmTunableOp_Half_TN,tn_4096_7266_4096,Gemm_Hipblaslt_TN_9814,0.412069
GemmTunableOp_Half_TN,tn_4096_2732_14336,Gemm_Hipblaslt_TN_9799,0.569047
GemmTunableOp_Half_TN,tn_4096_2750_4096,Gemm_Rocblas_621286683,0.166426
GemmTunableOp_Half_TN,tn_4096_8054_14336,Gemm_Hipblaslt_TN_9815,1.62003
GemmTunableOp_Half_TN,tn_6144_3565_4096,Gemm_Hipblaslt_TN_9570,0.318796
GemmTunableOp_Half_TN,tn_4096_901_14336,Gemm_Hipblaslt_TN_9634,0.230787
GemmTunableOp_Half_TN,tn_6144_835_4096,Gemm_Rocblas_621286778,0.0878239
GemmTunableOp_Half_TN,tn_12288_4000_4096,Gemm_Hipblaslt_TN_9223,0.668354
GemmTunableOp_Half_TN,tn_4096_2805_14336,Gemm_Hipblaslt_TN_9799,0.569991
GemmTunableOp_Half_TN,tn_4096_935_4096,Gemm_Hipblaslt_TN_9634,0.067871
GemmTunableOp_Half_TN,tn_4096_7937_4096,Gemm_Hipblaslt_TN_9914,0.44395
GemmTunableOp_Half_TN,tn_4096_32_14336,Gemm_Hipblaslt_TN_9392,0.0274074
GemmTunableOp_Half_TN,tn_22016_2938_4096,Gemm_Hipblaslt_TN_9827,0.910975
GemmTunableOp_Half_TN,tn_128256_8_4096,Gemm_Hipblaslt_TN_9405,0.285333
GemmTunableOp_Half_TN,tn_4096_7953_4096,Gemm_Hipblaslt_TN_9933,0.448056
GemmTunableOp_Half_TN,tn_4096_1803_4096,Gemm_Hipblaslt_TN_9134,0.120282
GemmTunableOp_Half_TN,tn_28672_872_4096,Gemm_Hipblaslt_TN_9683,0.38825
GemmTunableOp_Half_TN,tn_6144_152_4096,Gemm_Rocblas_621286440,0.0276514
GemmTunableOp_Half_TN,tn_128256_234_4096,Gemm_Rocblas_621286892,0.600233
GemmTunableOp_Half_TN,tn_4096_820_14336,Gemm_Hipblaslt_TN_9147,0.215325
GemmTunableOp_Half_TN,tn_28672_144_4096,Gemm_Hipblaslt_TN_9357,0.0863849
GemmTunableOp_Half_TN,tn_28672_801_4096,Gemm_Hipblaslt_TN_9683,0.380836
GemmTunableOp_Half_TN,tn_4096_940_14336,Gemm_Hipblaslt_TN_9634,0.232796
GemmTunableOp_Half_TN,tn_6144_820_4096,Gemm_Rocblas_621294520,0.0884775
GemmTunableOp_Half_TN,tn_4096_853_14336,Gemm_Hipblaslt_TN_9580,0.219185
GemmTunableOp_Half_TN,tn_4096_1718_14336,Gemm_Hipblaslt_TN_9790,0.370012
GemmTunableOp_Half_TN,tn_28672_942_4096,Gemm_Hipblaslt_TN_9684,0.399036
GemmTunableOp_Half_TN,tn_4096_804_14336,Gemm_Hipblaslt_TN_9158,0.212059
GemmTunableOp_Half_TN,tn_128256_33_4096,Gemm_Hipblaslt_TN_9451,0.316191
GemmTunableOp_Half_TN,tn_28672_1880_4096,Gemm_Hipblaslt_TN_9832,0.809248
GemmTunableOp_Half_TN,tn_28672_1954_4096,Gemm_Hipblaslt_TN_9846,0.835724
GemmTunableOp_Half_TN,tn_4096_797_4096,Gemm_Hipblaslt_TN_9604,0.0633502
GemmTunableOp_Half_TN,tn_6144_3556_4096,Gemm_Rocblas_621286753,0.319253
GemmTunableOp_Half_TN,tn_4096_1695_4096,Gemm_Hipblaslt_TN_9265,0.109015
GemmTunableOp_Half_TN,tn_6144_2793_4096,Gemm_Hipblaslt_TN_9742,0.256447
GemmTunableOp_Half_TN,tn_4096_892_14336,Gemm_Hipblaslt_TN_9580,0.220588
GemmTunableOp_Half_TN,tn_28672_825_4096,Gemm_Hipblaslt_TN_9684,0.382535
GemmTunableOp_Half_TN,tn_22016_2958_4096,Gemm_Hipblaslt_TN_9827,0.916109
GemmTunableOp_Half_TN,tn_6144_885_4096,Gemm_Hipblaslt_TN_9253,0.0930864
GemmTunableOp_Half_TN,tn_6144_1672_4096,Gemm_Rocblas_621294495,0.155433
GemmTunableOp_Half_TN,tn_4096_943_14336,Gemm_Hipblaslt_TN_9634,0.233361
GemmTunableOp_Half_TN,tn_4096_3891_4096,Gemm_Hipblaslt_TN_9920,0.223111
GemmTunableOp_Half_TN,tn_4096_88_14336,Gemm_Hipblaslt_TN_8036,0.040064
GemmTunableOp_Half_TN,tn_4096_3546_4096,Gemm_Hipblaslt_TN_9743,0.200542
GemmTunableOp_Half_TN,tn_4096_3507_14336,Gemm_Hipblaslt_TN_9743,0.687815
GemmTunableOp_Half_TN,tn_4096_1827_14336,Gemm_Hipblaslt_TN_9592,0.4097
GemmTunableOp_Half_TN,tn_28672_168_4096,Gemm_Hipblaslt_TN_7286,0.096038
GemmTunableOp_Half_TN,tn_22016_217_4096,Gemm_Hipblaslt_TN_9720,0.0967435
GemmTunableOp_Half_TN,tn_4096_986_4096,Gemm_Hipblaslt_TN_9604,0.0682721
GemmTunableOp_Half_TN,tn_28672_899_4096,Gemm_Hipblaslt_TN_9683,0.391848
GemmTunableOp_Half_TN,tn_6144_812_4096,Gemm_Rocblas_621294520,0.0877863
GemmTunableOp_Half_TN,tn_128256_189_4096,Gemm_Hipblaslt_TN_9857,0.517475
GemmTunableOp_Half_TN,tn_28672_1757_4096,Gemm_Rocblas_621294420,0.73732
GemmTunableOp_Half_TN,tn_4096_7299_14336,Gemm_Hipblaslt_TN_9749,1.52899
GemmTunableOp_Half_TN,tn_28672_919_4096,Gemm_Hipblaslt_TN_9683,0.396006
GemmTunableOp_Half_TN,tn_4096_939_4096,Gemm_Hipblaslt_TN_9634,0.0686209
GemmTunableOp_Half_TN,tn_12288_243_4096,Gemm_Rocblas_621286478,0.0587149
GemmTunableOp_Half_TN,tn_28672_1931_4096,Gemm_Hipblaslt_TN_9846,0.842474
GemmTunableOp_Half_TN,tn_6144_878_4096,Gemm_Hipblaslt_TN_9253,0.0923708
GemmTunableOp_Half_TN,tn_4096_2898_4096,Gemm_Rocblas_621286684,0.174609
GemmTunableOp_Half_TN,tn_4096_859_4096,Gemm_Hipblaslt_TN_9131,0.0664955
GemmTunableOp_Half_TN,tn_4096_2606_14336,Gemm_Hipblaslt_TN_9799,0.544259
GemmTunableOp_Half_TN,tn_4096_894_4096,Gemm_Hipblaslt_TN_9604,0.0668115
GemmTunableOp_Half_TN,tn_4096_2719_14336,Gemm_Hipblaslt_TN_9799,0.55323
GemmTunableOp_Half_TN,tn_6144_2717_4096,Gemm_Hipblaslt_TN_9742,0.252819
GemmTunableOp_Half_TN,tn_4096_968_14336,Gemm_Hipblaslt_TN_9539,0.244213
GemmTunableOp_Half_TN,tn_28672_815_4096,Gemm_Hipblaslt_TN_9684,0.381797
GemmTunableOp_Half_TN,tn_6144_849_4096,Gemm_Rocblas_621286778,0.0895622
GemmTunableOp_Half_TN,tn_28672_809_4096,Gemm_Hipblaslt_TN_9684,0.379912
GemmTunableOp_Half_TN,tn_6144_971_4096,Gemm_Rocblas_621294311,0.101737
GemmTunableOp_Half_TN,tn_4096_1795_4096,Gemm_Hipblaslt_TN_9134,0.119114
GemmTunableOp_Half_TN,tn_6144_1795_4096,Gemm_Rocblas_621286684,0.164066
GemmTunableOp_Half_TN,tn_4096_839_4096,Gemm_Hipblaslt_TN_9634,0.0648054
GemmTunableOp_Half_TN,tn_128256_250_4096,Gemm_Rocblas_621294634,0.605974
GemmTunableOp_Half_TN,tn_6144_846_4096,Gemm_Rocblas_621286778,0.0891804
GemmTunableOp_Half_TN,tn_4096_3569_4096,Gemm_Hipblaslt_TN_9743,0.200869
GemmTunableOp_Half_TN,tn_6144_2764_4096,Gemm_Hipblaslt_TN_9742,0.256797
GemmTunableOp_Half_TN,tn_128256_50_4096,Gemm_Hipblaslt_TN_9097,0.352606
GemmTunableOp_Half_TN,tn_4096_3447_14336,Gemm_Hipblaslt_TN_9743,0.672158
GemmTunableOp_Half_TN,tn_4096_936_14336,Gemm_Hipblaslt_TN_9634,0.234386
GemmTunableOp_Half_TN,tn_4096_2930_11008,Gemm_Hipblaslt_TN_9799,0.457677
GemmTunableOp_Half_TN,tn_6144_977_4096,Gemm_Hipblaslt_TN_9633,0.101204
GemmTunableOp_Half_TN,tn_6144_898_4096,Gemm_Hipblaslt_TN_9615,0.0939565
GemmTunableOp_Half_TN,tn_4096_2653_4096,Gemm_Hipblaslt_TN_9672,0.162285
GemmTunableOp_Half_TN,tn_28672_1835_4096,Gemm_Hipblaslt_TN_9832,0.801992
GemmTunableOp_Half_TN,tn_4096_1831_4096,Gemm_Hipblaslt_TN_9645,0.120031
GemmTunableOp_Half_TN,tn_28672_184_4096,Gemm_Hipblaslt_TN_9587,0.098957
GemmTunableOp_Half_TN,tn_4096_899_14336,Gemm_Hipblaslt_TN_9589,0.230585
GemmTunableOp_Half_TN,tn_6144_232_4096,Gemm_Hipblaslt_TN_9495,0.0348399
GemmTunableOp_Half_TN,tn_6144_104_4096,Gemm_Rocblas_621294173,0.0233084
GemmTunableOp_Half_TN,tn_4096_1705_4096,Gemm_Hipblaslt_TN_9671,0.105587
GemmTunableOp_Half_TN,tn_28672_888_4096,Gemm_Hipblaslt_TN_9684,0.392328
GemmTunableOp_Half_TN,tn_128256_135_4096,Gemm_Hipblaslt_TN_9808,0.465466
GemmTunableOp_Half_TN,tn_128256_85_4096,Gemm_Hipblaslt_TN_9057,0.388781
GemmTunableOp_Half_TN,tn_4096_898_14336,Gemm_Hipblaslt_TN_9634,0.229155
GemmTunableOp_Half_TN,tn_4096_1850_4096,Gemm_Hipblaslt_TN_9645,0.120656
GemmTunableOp_Half_TN,tn_6144_1807_4096,Gemm_Rocblas_621286684,0.165471
GemmTunableOp_Half_TN,tn_28672_1726_4096,Gemm_Hipblaslt_TN_9220,0.735428
GemmTunableOp_Half_TN,tn_22016_3669_4096,Gemm_Hipblaslt_TN_9827,1.13105
GemmTunableOp_Half_TN,tn_32000_224_4096,Gemm_Hipblaslt_TN_9592,0.124472
GemmTunableOp_Half_TN,tn_4096_240_4096,Gemm_Rocblas_621286443,0.0259227
GemmTunableOp_Half_TN,tn_4096_844_4096,Gemm_Hipblaslt_TN_9604,0.0652262
GemmTunableOp_Half_TN,tn_6144_2572_4096,Gemm_Hipblaslt_TN_9827,0.219084
GemmTunableOp_Half_TN,tn_22016_4058_4096,Gemm_Hipblaslt_TN_9827,1.30078
GemmTunableOp_Half_TN,tn_4096_2721_4096,Gemm_Hipblaslt_TN_9784,0.166571
GemmTunableOp_Half_TN,tn_6144_922_4096,Gemm_Hipblaslt_TN_9613,0.0944354
GemmTunableOp_Half_TN,tn_6144_2681_4096,Gemm_Hipblaslt_TN_9827,0.224654
GemmTunableOp_Half_TN,tn_128256_126_4096,Gemm_Rocblas_621294762,0.42822
GemmTunableOp_Half_TN,tn_4096_2653_14336,Gemm_Hipblaslt_TN_9657,0.548898
GemmTunableOp_Half_TN,tn_4096_887_14336,Gemm_Hipblaslt_TN_9580,0.220022
GemmTunableOp_Half_TN,tn_4096_1944_4096,Gemm_Hipblaslt_TN_9645,0.124161
GemmTunableOp_Half_TN,tn_128256_207_4096,Gemm_Hipblaslt_TN_9847,0.560443
GemmTunableOp_Half_TN,tn_6144_2630_4096,Gemm_Hipblaslt_TN_9827,0.22152
GemmTunableOp_Half_TN,tn_4096_3243_4096,Gemm_Hipblaslt_TN_9743,0.190367
GemmTunableOp_Half_TN,tn_6144_1697_4096,Gemm_Hipblaslt_TN_9570,0.156299
GemmTunableOp_Half_TN,tn_4096_922_14336,Gemm_Hipblaslt_TN_9634,0.232119
GemmTunableOp_Half_TN,tn_4096_3310_4096,Gemm_Hipblaslt_TN_9743,0.194059
GemmTunableOp_Half_TN,tn_4096_815_4096,Gemm_Hipblaslt_TN_9634,0.0634026
GemmTunableOp_Half_TN,tn_22016_3923_4096,Gemm_Hipblaslt_TN_9832,1.24208
GemmTunableOp_Half_TN,tn_6144_801_4096,Gemm_Rocblas_621294520,0.0880498
GemmTunableOp_Half_TN,tn_6144_850_4096,Gemm_Rocblas_621286778,0.0897579
GemmTunableOp_Half_TN,tn_4096_1931_4096,Gemm_Hipblaslt_TN_9645,0.123016
GemmTunableOp_Half_TN,tn_6144_842_4096,Gemm_Rocblas_621294520,0.0885623
GemmTunableOp_Half_TN,tn_4096_1817_4096,Gemm_Hipblaslt_TN_9602,0.119077
GemmTunableOp_Half_TN,tn_28672_8154_4096,Gemm_Hipblaslt_TN_9841,3.3367
GemmTunableOp_Half_TN,tn_4096_1666_14336,Gemm_Hipblaslt_TN_9679,0.366189
GemmTunableOp_Half_TN,tn_4096_1777_4096,Gemm_Hipblaslt_TN_9134,0.116653
GemmTunableOp_Half_TN,tn_6144_895_4096,Gemm_Hipblaslt_TN_9613,0.092891
GemmTunableOp_Half_TN,tn_4096_3546_14336,Gemm_Hipblaslt_TN_9743,0.68657
GemmStridedBatchedTunableOp_Half_TN,tn_827_827_128_B_32,Gemm_Rocblas_621294635,0.0413414
GemmStridedBatchedTunableOp_Half_TN,tn_914_914_128_B_32,Gemm_Hipblaslt_TN_7519,0.0489663
GemmStridedBatchedTunableOp_Half_TN,tn_857_857_128_B_32,Gemm_Rocblas_621294635,0.043498
GemmStridedBatchedTunableOp_Half_TN,tn_799_799_128_B_32,Gemm_Rocblas_621294109,0.0406893
GemmStridedBatchedTunableOp_Half_TN,tn_876_876_128_B_32,Gemm_Rocblas_621294105,0.0458943
GemmStridedBatchedTunableOp_Half_TN,tn_926_926_128_B_32,Gemm_Rocblas_621294635,0.0502454
GemmStridedBatchedTunableOp_Half_TN,tn_864_864_128_B_32,Gemm_Hipblaslt_TN_150,0.0363537
GemmStridedBatchedTunableOp_Half_TN,tn_971_971_128_B_32,Gemm_Hipblaslt_TN_7483,0.0527849
GemmStridedBatchedTunableOp_Half_TN,tn_854_854_128_B_32,Gemm_Rocblas_621294635,0.0443288
GemmStridedBatchedTunableOp_Half_TN,tn_834_834_128_B_32,Gemm_Rocblas_621286774,0.0445389
GemmStridedBatchedTunableOp_Half_TN,tn_1079_1079_128_B_32,Gemm_Rocblas_621294725,0.0586472
GemmStridedBatchedTunableOp_Half_TN,tn_877_877_128_B_32,Gemm_Rocblas_621294105,0.0455426
GemmStridedBatchedTunableOp_Half_TN,tn_1149_1149_128_B_32,Gemm_Hipblaslt_TN_7483,0.0665641
GemmStridedBatchedTunableOp_Half_TN,tn_865_865_128_B_32,Gemm_Rocblas_621294105,0.0449649
GemmStridedBatchedTunableOp_Half_TN,tn_955_955_128_B_32,Gemm_Hipblaslt_TN_7519,0.0505784
GemmStridedBatchedTunableOp_Half_TN,tn_1297_1297_128_B_32,Gemm_Rocblas_621294725,0.0814743
GemmStridedBatchedTunableOp_Half_TN,tn_965_965_128_B_32,Gemm_Hipblaslt_TN_7483,0.0518469
GemmStridedBatchedTunableOp_Half_TN,tn_892_892_128_B_32,Gemm_Rocblas_621286396,0.0464911
GemmStridedBatchedTunableOp_Half_TN,tn_940_940_128_B_32,Gemm_Hipblaslt_TN_7519,0.0494483
GemmStridedBatchedTunableOp_Half_TN,tn_1201_1201_128_B_32,Gemm_Rocblas_621294725,0.0702058
GemmStridedBatchedTunableOp_Half_TN,tn_849_849_128_B_32,Gemm_Rocblas_621294635,0.0445471
GemmStridedBatchedTunableOp_Half_TN,tn_798_798_128_B_32,Gemm_Rocblas_621294635,0.0398656
GemmStridedBatchedTunableOp_Half_TN,tn_1000_1000_128_B_32,Gemm_Hipblaslt_TN_153,0.0488738
GemmStridedBatchedTunableOp_Half_TN,tn_813_813_128_B_32,Gemm_Rocblas_621294635,0.0418666
GemmStridedBatchedTunableOp_Half_TN,tn_1409_1409_128_B_32,Gemm_Rocblas_621286397,0.0918751
GemmStridedBatchedTunableOp_Half_TN,tn_927_927_128_B_32,Gemm_Rocblas_621294635,0.0506982
GemmStridedBatchedTunableOp_Half_TN,tn_984_984_128_B_32,Gemm_Hipblaslt_TN_149,0.047366
GemmStridedBatchedTunableOp_Half_TN,tn_1144_1144_128_B_32,Gemm_Rocblas_621294725,0.063269
GemmStridedBatchedTunableOp_Half_TN,tn_1357_1357_128_B_32,Gemm_Rocblas_621294725,0.0867363
GemmStridedBatchedTunableOp_Half_TN,tn_851_851_128_B_32,Gemm_Rocblas_621294635,0.0436448
GemmStridedBatchedTunableOp_Half_TN,tn_1069_1069_128_B_32,Gemm_Rocblas_621294725,0.0592252
GemmStridedBatchedTunableOp_Half_TN,tn_917_917_128_B_32,Gemm_Rocblas_621294635,0.0489556
GemmStridedBatchedTunableOp_Half_TN,tn_985_985_128_B_32,Gemm_Hipblaslt_TN_7519,0.0520217
GemmStridedBatchedTunableOp_Half_TN,tn_1111_1111_128_B_32,Gemm_Rocblas_621294725,0.0640452
GemmStridedBatchedTunableOp_Half_TN,tn_875_875_128_B_32,Gemm_Rocblas_621294635,0.0452215
GemmStridedBatchedTunableOp_Half_TN,tn_792_792_128_B_32,Gemm_Hipblaslt_TN_150,0.0375431
GemmStridedBatchedTunableOp_Half_TN,tn_1271_1271_128_B_32,Gemm_Rocblas_621286411,0.0765922
GemmStridedBatchedTunableOp_Half_TN,tn_1239_1239_128_B_32,Gemm_Rocblas_621294725,0.0738055
GemmStridedBatchedTunableOp_Half_TN,tn_1393_1393_128_B_32,Gemm_Rocblas_621294725,0.0896124
GemmStridedBatchedTunableOp_Half_TN,tn_1281_1281_128_B_32,Gemm_Rocblas_621294551,0.0797515
GemmStridedBatchedTunableOp_Half_TN,tn_949_949_128_B_32,Gemm_Hipblaslt_TN_7519,0.0510537
GemmStridedBatchedTunableOp_Half_TN,tn_829_829_128_B_32,Gemm_Rocblas_621294635,0.0420496
GemmStridedBatchedTunableOp_Half_TN,tn_1441_1441_128_B_32,Gemm_Rocblas_621294106,0.0943091
GemmStridedBatchedTunableOp_Half_TN,tn_795_795_128_B_32,Gemm_Rocblas_621286810,0.0403243
GemmStridedBatchedTunableOp_Half_TN,tn_989_989_128_B_32,Gemm_Rocblas_621294550,0.0512303
GemmStridedBatchedTunableOp_Half_TN,tn_843_843_128_B_32,Gemm_Rocblas_621294635,0.0438672
GemmStridedBatchedTunableOp_Half_TN,tn_878_878_128_B_32,Gemm_Rocblas_621294527,0.0461574
GemmStridedBatchedTunableOp_Half_TN,tn_986_986_128_B_32,Gemm_Rocblas_621294550,0.0523638
GemmStridedBatchedTunableOp_Half_TN,tn_814_814_128_B_32,Gemm_Rocblas_621294635,0.0417841
GemmStridedBatchedTunableOp_Half_TN,tn_16_16_128_B_32,Gemm_Rocblas_621294459,0.00641393
GemmStridedBatchedTunableOp_Half_TN,tn_824_824_128_B_32,Gemm_Hipblaslt_TN_150,0.038067
GemmStridedBatchedTunableOp_Half_TN,tn_950_950_128_B_32,Gemm_Hipblaslt_TN_7519,0.0494308
GemmStridedBatchedTunableOp_Half_TN,tn_841_841_128_B_32,Gemm_Hipblaslt_TN_7483,0.0433582
GemmStridedBatchedTunableOp_Half_TN,tn_894_894_128_B_32,Gemm_Rocblas_621286396,0.0462352
GemmStridedBatchedTunableOp_Half_TN,tn_915_915_128_B_32,Gemm_Hipblaslt_TN_7519,0.0492889
GemmStridedBatchedTunableOp_Half_TN,tn_995_995_128_B_32,Gemm_Rocblas_621286809,0.0534779
GemmStridedBatchedTunableOp_Half_TN,tn_807_807_128_B_32,Gemm_Rocblas_621294635,0.0408368
GemmStridedBatchedTunableOp_Half_TN,tn_963_963_128_B_32,Gemm_Rocblas_621286809,0.0515733
GemmStridedBatchedTunableOp_Half_TN,tn_855_855_128_B_32,Gemm_Hipblaslt_TN_7059,0.0446484
GemmStridedBatchedTunableOp_Half_TN,tn_839_839_128_B_32,Gemm_Rocblas_621294635,0.0438993
GemmStridedBatchedTunableOp_Half_TN,tn_959_959_128_B_32,Gemm_Hipblaslt_TN_9351,0.0506783
GemmStridedBatchedTunableOp_Half_TN,tn_891_891_128_B_32,Gemm_Rocblas_621294105,0.0465256
GemmStridedBatchedTunableOp_Half_TN,tn_802_802_128_B_32,Gemm_Rocblas_621294635,0.0392262
GemmStridedBatchedTunableOp_Half_TN,tn_954_954_128_B_32,Gemm_Hipblaslt_TN_7519,0.0514067
GemmStridedBatchedTunableOp_Half_TN,tn_1139_1139_128_B_32,Gemm_Hipblaslt_TN_7483,0.0643736
GemmStridedBatchedTunableOp_Half_TN,tn_982_982_128_B_32,Gemm_Rocblas_621294550,0.0524334
GemmStridedBatchedTunableOp_Half_TN,tn_912_912_128_B_32,Gemm_Hipblaslt_TN_153,0.0447441
GemmStridedBatchedTunableOp_Half_TN,tn_1169_1169_128_B_32,Gemm_Rocblas_621294725,0.0681956
GemmStridedBatchedTunableOp_Half_TN,tn_823_823_128_B_32,Gemm_Rocblas_621294635,0.0407406
GemmTunableOp_Half_TN,tn_4096_1900_14336,Gemm_Hipblaslt_TN_9645,0.412982
GemmTunableOp_Half_TN,tn_6144_2635_4096,Gemm_Hipblaslt_TN_9184,0.220031
GemmTunableOp_Half_TN,tn_6144_966_4096,Gemm_Hipblaslt_TN_9671,0.0994952
GemmTunableOp_Half_TN,tn_4096_877_4096,Gemm_Hipblaslt_TN_9170,0.0651232
GemmTunableOp_Half_TN,tn_4096_2793_4096,Gemm_Rocblas_621286705,0.166101
GemmTunableOp_Half_TN,tn_22016_11_4096,Gemm_Rocblas_621294186,0.035228
GemmTunableOp_Half_TN,tn_4096_842_14336,Gemm_Hipblaslt_TN_9580,0.220875
GemmTunableOp_Half_TN,tn_4096_3479_4096,Gemm_Hipblaslt_TN_9743,0.200047
GemmTunableOp_Half_TN,tn_28672_906_4096,Gemm_Hipblaslt_TN_9684,0.389234
GemmTunableOp_Half_TN,tn_6144_831_4096,Gemm_Rocblas_621286778,0.0878476
GemmTunableOp_Half_TN,tn_6144_216_4096,Gemm_Hipblaslt_TN_9495,0.0344571
GemmTunableOp_Half_TN,tn_4096_1834_14336,Gemm_Hipblaslt_TN_9268,0.405644
GemmTunableOp_Half_TN,tn_4096_1777_14336,Gemm_Hipblaslt_TN_9645,0.395497
GemmTunableOp_Half_TN,tn_28672_2537_4096,Gemm_Hipblaslt_TN_9846,1.03517
GemmTunableOp_Half_TN,tn_4096_1795_14336,Gemm_Hipblaslt_TN_9136,0.400568
GemmTunableOp_Half_TN,tn_6144_834_4096,Gemm_Rocblas_621286778,0.0867267
GemmTunableOp_Half_TN,tn_6144_1798_4096,Gemm_Hipblaslt_TN_9691,0.162825
GemmTunableOp_Half_TN,tn_28672_1798_4096,Gemm_Hipblaslt_TN_9684,0.780172
GemmTunableOp_Half_TN,tn_28672_3711_4096,Gemm_Hipblaslt_TN_9827,1.49009
GemmTunableOp_Half_TN,tn_128256_52_4096,Gemm_Rocblas_621294554,0.351795
GemmTunableOp_Half_TN,tn_4096_4083_4096,Gemm_Hipblaslt_TN_9768,0.227883
GemmTunableOp_Half_TN,tn_28672_813_4096,Gemm_Hipblaslt_TN_9684,0.378472
GemmTunableOp_Half_TN,tn_4096_835_4096,Gemm_Hipblaslt_TN_9634,0.064499
GemmTunableOp_Half_TN,tn_4096_1775_14336,Gemm_Hipblaslt_TN_9645,0.394336
GemmTunableOp_Half_TN,tn_28672_7239_4096,Gemm_Hipblaslt_TN_159,2.93118
GemmTunableOp_Half_TN,tn_22016_3451_4096,Gemm_Hipblaslt_TN_9827,1.07707
GemmTunableOp_Half_TN,tn_4096_1803_14336,Gemm_Hipblaslt_TN_9134,0.402683
GemmTunableOp_Half_TN,tn_6144_1715_4096,Gemm_Hipblaslt_TN_9570,0.153482
GemmTunableOp_Half_TN,tn_128256_6_4096,Gemm_Rocblas_621294224,0.279144
GemmTunableOp_Half_TN,tn_4096_1693_4096,Gemm_Hipblaslt_TN_9610,0.105187
GemmTunableOp_Half_TN,tn_28672_807_4096,Gemm_Hipblaslt_TN_9684,0.375994
GemmTunableOp_Half_TN,tn_4096_870_14336,Gemm_Hipblaslt_TN_9580,0.2182
GemmTunableOp_Half_TN,tn_4096_2398_11008,Gemm_Hipblaslt_TN_9698,0.373354
GemmTunableOp_Half_TN,tn_4096_2670_14336,Gemm_Hipblaslt_TN_9799,0.536464
GemmTunableOp_Half_TN,tn_28672_912_4096,Gemm_Hipblaslt_TN_9683,0.387524
GemmTunableOp_Half_TN,tn_4096_868_4096,Gemm_Hipblaslt_TN_9604,0.0669667
GemmTunableOp_Half_TN,tn_28672_949_4096,Gemm_Hipblaslt_TN_9683,0.39244
GemmTunableOp_Half_TN,tn_28672_216_4096,Gemm_Hipblaslt_TN_9267,0.11162
GemmTunableOp_Half_TN,tn_4096_932_14336,Gemm_Hipblaslt_TN_9604,0.232533
GemmTunableOp_Half_TN,tn_4096_929_4096,Gemm_Hipblaslt_TN_9634,0.0687193
GemmTunableOp_Half_TN,tn_4096_3670_14336,Gemm_Hipblaslt_TN_9223,0.714714
GemmTunableOp_Half_TN,tn_6144_870_4096,Gemm_Hipblaslt_TN_9613,0.0916971
GemmTunableOp_Half_TN,tn_128256_46_4096,Gemm_Hipblaslt_TN_9455,0.328595
GemmTunableOp_Half_TN,tn_28672_959_4096,Gemm_Hipblaslt_TN_9683,0.394766
GemmTunableOp_Half_TN,tn_4096_1792_4096,Gemm_Hipblaslt_TN_9134,0.11606
GemmTunableOp_Half_TN,tn_4096_943_4096,Gemm_Hipblaslt_TN_9576,0.0693623
GemmTunableOp_Half_TN,tn_4096_1881_4096,Gemm_Hipblaslt_TN_9645,0.120908
GemmTunableOp_Half_TN,tn_128256_97_4096,Gemm_Rocblas_621294762,0.408236
GemmTunableOp_Half_TN,tn_4096_1815_14336,Gemm_Hipblaslt_TN_9268,0.40243
GemmTunableOp_Half_TN,tn_4096_1739_14336,Gemm_Hipblaslt_TN_9645,0.391421
GemmTunableOp_Half_TN,tn_4096_1897_4096,Gemm_Hipblaslt_TN_9645,0.120656
GemmTunableOp_Half_TN,tn_128256_177_4096,Gemm_Hipblaslt_TN_9661,0.511909
GemmTunableOp_Half_TN,tn_6144_1727_4096,Gemm_Hipblaslt_TN_9570,0.156235
GemmTunableOp_Half_TN,tn_4096_3843_4096,Gemm_Hipblaslt_TN_9827,0.218032
GemmTunableOp_Half_TN,tn_4096_905_4096,Gemm_Hipblaslt_TN_9576,0.0669991
GemmTunableOp_Half_TN,tn_12288_241_4096,Gemm_Rocblas_621286478,0.0574092
GemmTunableOp_Half_TN,tn_4096_1905_14336,Gemm_Hipblaslt_TN_9620,0.412246
GemmTunableOp_Half_TN,tn_6144_1755_4096,Gemm_Hipblaslt_TN_9799,0.159394
GemmTunableOp_Half_TN,tn_6144_891_4096,Gemm_Hipblaslt_TN_9613,0.0920496
GemmTunableOp_Half_TN,tn_128256_172_4096,Gemm_Hipblaslt_TN_9752,0.510166
GemmTunableOp_Half_TN,tn_28672_2636_4096,Gemm_Hipblaslt_TN_9827,1.06265
GemmTunableOp_Half_TN,tn_4096_972_14336,Gemm_Hipblaslt_TN_9586,0.243891
GemmTunableOp_Half_TN,tn_4096_4035_4096,Gemm_Hipblaslt_TN_9768,0.226654
GemmTunableOp_Half_TN,tn_4096_219_11008,Gemm_Hipblaslt_TN_7378,0.0586048
GemmTunableOp_Half_TN,tn_4096_3556_14336,Gemm_Hipblaslt_TN_9677,0.682119
GemmTunableOp_Half_TN,tn_28672_986_4096,Gemm_Hipblaslt_TN_9666,0.433356
GemmTunableOp_Half_TN,tn_4096_947_14336,Gemm_Hipblaslt_TN_9589,0.233638
GemmTunableOp_Half_TN,tn_4096_1846_4096,Gemm_Hipblaslt_TN_9645,0.119806
GemmTunableOp_Half_TN,tn_4096_2894_4096,Gemm_Hipblaslt_TN_9566,0.170416
GemmTunableOp_Half_TN,tn_6144_7239_4096,Gemm_Hipblaslt_TN_9139,0.602166
GemmTunableOp_Half_TN,tn_6144_972_4096,Gemm_Rocblas_621286571,0.0993725
GemmTunableOp_Half_TN,tn_32000_253_4096,Gemm_Hipblaslt_TN_9845,0.149471
GemmTunableOp_Half_TN,tn_4096_2682_14336,Gemm_Hipblaslt_TN_9799,0.542061
GemmTunableOp_Half_TN,tn_6144_936_4096,Gemm_Hipblaslt_TN_9606,0.0941379
GemmTunableOp_Half_TN,tn_4096_814_14336,Gemm_Hipblaslt_TN_9158,0.21052
GemmTunableOp_Half_TN,tn_28672_2717_4096,Gemm_Hipblaslt_TN_9783,1.16928
GemmTunableOp_Half_TN,tn_4096_8007_4096,Gemm_Hipblaslt_TN_9903,0.442747
GemmTunableOp_Half_TN,tn_4096_870_4096,Gemm_Hipblaslt_TN_9170,0.0649136
GemmTunableOp_Half_TN,tn_28672_1694_4096,Gemm_Hipblaslt_TN_9184,0.722005
GemmTunableOp_Half_TN,tn_6144_3430_4096,Gemm_Rocblas_621294306,0.307257
GemmTunableOp_Half_TN,tn_128256_210_4096,Gemm_Hipblaslt_TN_9937,0.566108
GemmTunableOp_Half_TN,tn_4096_825_4096,Gemm_Hipblaslt_TN_9634,0.0634035
GemmTunableOp_Half_TN,tn_128256_248_4096,Gemm_Rocblas_621286892,0.600833
GemmTunableOp_Half_TN,tn_128256_233_4096,Gemm_Rocblas_621286892,0.590772
GemmTunableOp_Half_TN,tn_128256_167_4096,Gemm_Hipblaslt_TN_9694,0.512028
GemmTunableOp_Half_TN,tn_128256_156_4096,Gemm_Hipblaslt_TN_9808,0.477
GemmTunableOp_Half_TN,tn_28672_7953_4096,Gemm_Hipblaslt_TN_159,3.16031
GemmTunableOp_Half_TN,tn_128256_150_4096,Gemm_Hipblaslt_TN_9108,0.471269
GemmTunableOp_Half_TN,tn_128256_130_4096,Gemm_Hipblaslt_TN_9808,0.460213
GemmTunableOp_Half_TN,tn_128256_117_4096,Gemm_Rocblas_621294762,0.42477
GemmTunableOp_Half_TN,tn_128256_216_4096,Gemm_Hipblaslt_TN_9847,0.569928
GemmTunableOp_Half_TN,tn_128256_89_4096,Gemm_Hipblaslt_TN_9057,0.388141
GemmTunableOp_Half_TN,tn_128256_69_4096,Gemm_Hipblaslt_TN_9057,0.36974
GemmTunableOp_Half_TN,tn_4096_1835_4096,Gemm_Hipblaslt_TN_9645,0.119494
GemmTunableOp_Half_TN,tn_12288_217_4096,Gemm_Rocblas_621294215,0.057071
GemmTunableOp_Half_TN,tn_4096_956_14336,Gemm_Hipblaslt_TN_9634,0.234055
GemmTunableOp_Half_TN,tn_4096_1600_14336,Gemm_Hipblaslt_TN_9265,0.355217
GemmTunableOp_Half_TN,tn_4096_220_4096,Gemm_Rocblas_621286491,0.0256608
GemmTunableOp_Half_TN,tn_6144_1701_4096,Gemm_Rocblas_621286753,0.154207
GemmTunableOp_Half_TN,tn_6144_855_4096,Gemm_Rocblas_621286778,0.0883185
GemmTunableOp_Half_TN,tn_4096_992_14336,Gemm_Hipblaslt_TN_9586,0.245549
GemmTunableOp_Half_TN,tn_12288_4058_4096,Gemm_Rocblas_621294420,0.673271
GemmTunableOp_Half_TN,tn_4096_1757_14336,Gemm_Hipblaslt_TN_9645,0.392551
GemmTunableOp_Half_TN,tn_4096_946_4096,Gemm_Hipblaslt_TN_9576,0.0699035
GemmTunableOp_Half_TN,tn_28672_984_4096,Gemm_Hipblaslt_TN_9631,0.433134
GemmTunableOp_Half_TN,tn_4096_903_14336,Gemm_Hipblaslt_TN_9604,0.230502
GemmTunableOp_Half_TN,tn_12288_2946_4096,Gemm_Rocblas_621294426,0.510174
GemmTunableOp_Half_TN,tn_4096_2802_4096,Gemm_Hipblaslt_TN_9674,0.166152
GemmTunableOp_Half_TN,tn_12288_235_4096,Gemm_Rocblas_621286478,0.0569684
GemmTunableOp_Half_TN,tn_4096_1831_14336,Gemm_Hipblaslt_TN_9268,0.404976
GemmTunableOp_Half_TN,tn_4096_3662_4096,Gemm_Hipblaslt_TN_9827,0.209924
GemmTunableOp_Half_TN,tn_32000_228_4096,Gemm_Hipblaslt_TN_9845,0.144104
GemmTunableOp_Half_TN,tn_22016_2862_4096,Gemm_Hipblaslt_TN_9827,0.906812
GemmTunableOp_Half_TN,tn_6144_1817_4096,Gemm_Rocblas_621294425,0.16482
GemmTunableOp_Half_TN,tn_128256_32_4096,Gemm_Rocblas_621294578,0.304566
GemmTunableOp_Half_TN,tn_28672_800_4096,Gemm_Rocblas_621286576,0.344821
GemmTunableOp_Half_TN,tn_6144_16_4096,Gemm_Rocblas_621286273,0.0130915
GemmTunableOp_Half_TN,tn_4096_35_11008,Gemm_Rocblas_621286332,0.0274313
GemmTunableOp_Half_TN,tn_4096_1853_4096,Gemm_Hipblaslt_TN_9645,0.118038
GemmTunableOp_Half_TN,tn_4096_2590_4096,Gemm_Hipblaslt_TN_9657,0.159548
GemmTunableOp_Half_TN,tn_4096_1733_14336,Gemm_Hipblaslt_TN_9645,0.392361
GemmTunableOp_Half_TN,tn_22016_3891_4096,Gemm_Hipblaslt_TN_9832,1.22293
GemmTunableOp_Half_TN,tn_4096_3418_14336,Gemm_Hipblaslt_TN_9187,0.663323
GemmTunableOp_Half_TN,tn_12288_2786_4096,Gemm_Rocblas_621286684,0.494895
GemmTunableOp_Half_TN,tn_12288_3577_4096,Gemm_Hipblaslt_TN_9743,0.595025
GemmTunableOp_Half_TN,tn_4096_9_11008,Gemm_Rocblas_621286312,0.0233867
GemmTunableOp_Half_TN,tn_6144_1649_4096,Gemm_Hipblaslt_TN_9570,0.14983
GemmTunableOp_Half_TN,tn_12288_2958_4096,Gemm_Rocblas_621286684,0.512177
GemmTunableOp_Half_TN,tn_6144_1848_4096,Gemm_Hipblaslt_TN_9799,0.165188
GemmTunableOp_Half_TN,tn_128256_104_4096,Gemm_Rocblas_621294762,0.418076
GemmTunableOp_Half_TN,tn_4096_887_4096,Gemm_Hipblaslt_TN_9634,0.0666606
GemmTunableOp_Half_TN,tn_6144_848_4096,Gemm_Rocblas_621286778,0.0873027
GemmTunableOp_Half_TN,tn_12288_3843_4096,Gemm_Rocblas_621286742,0.64712
GemmTunableOp_Half_TN,tn_28672_804_4096,Gemm_Hipblaslt_TN_9684,0.375731
GemmTunableOp_Half_TN,tn_4096_243_11008,Gemm_Hipblaslt_TN_9303,0.0655266
GemmTunableOp_Half_TN,tn_128256_54_4096,Gemm_Rocblas_621286813,0.349982
GemmTunableOp_Half_TN,tn_28672_894_4096,Gemm_Hipblaslt_TN_9683,0.385337
GemmTunableOp_Half_TN,tn_4096_237_11008,Gemm_Hipblaslt_TN_9303,0.0641631
GemmTunableOp_Half_TN,tn_6144_1746_4096,Gemm_Hipblaslt_TN_9799,0.156763
GemmTunableOp_Half_TN,tn_128256_22_4096,Gemm_Rocblas_621294578,0.311722
GemmTunableOp_Half_TN,tn_12288_236_4096,Gemm_Rocblas_621286478,0.0567734
GemmTunableOp_Half_TN,tn_22016_3430_4096,Gemm_Hipblaslt_TN_9827,1.06257
GemmTunableOp_Half_TN,tn_4096_1822_14336,Gemm_Hipblaslt_TN_9134,0.402077
GemmTunableOp_Half_TN,tn_6144_2658_4096,Gemm_Hipblaslt_TN_9827,0.220326
GemmTunableOp_Half_TN,tn_6144_1880_4096,Gemm_Hipblaslt_TN_9672,0.164419
GemmTunableOp_Half_TN,tn_4096_912_14336,Gemm_Hipblaslt_TN_9604,0.230697
GemmTunableOp_Half_TN,tn_4096_1742_14336,Gemm_Hipblaslt_TN_9645,0.391716
GemmTunableOp_Half_TN,tn_12288_2778_4096,Gemm_Rocblas_621294426,0.495978
GemmTunableOp_Half_TN,tn_6144_1867_4096,Gemm_Hipblaslt_TN_9691,0.165015
GemmTunableOp_Half_TN,tn_28672_224_4096,Gemm_Hipblaslt_TN_9680,0.110679
GemmTunableOp_Half_TN,tn_4096_3333_11008,Gemm_Rocblas_621294485,0.507101
GemmTunableOp_Half_TN,tn_6144_823_4096,Gemm_Rocblas_621286778,0.0875304
GemmTunableOp_Half_TN,tn_28672_846_4096,Gemm_Hipblaslt_TN_9683,0.38083
GemmTunableOp_Half_TN,tn_128256_205_4096,Gemm_Hipblaslt_TN_9738,0.563001
GemmTunableOp_Half_TN,tn_28672_1756_4096,Gemm_Hipblaslt_TN_9223,0.733168
GemmTunableOp_Half_TN,tn_4096_876_14336,Gemm_Hipblaslt_TN_9580,0.219619
GemmTunableOp_Half_TN,tn_32000_244_4096,Gemm_Hipblaslt_TN_9745,0.149857
GemmTunableOp_Half_TN,tn_4096_859_14336,Gemm_Hipblaslt_TN_9580,0.217966
GemmTunableOp_Half_TN,tn_4096_1719_4096,Gemm_Hipblaslt_TN_9610,0.107288
GemmTunableOp_Half_TN,tn_4096_234_11008,Gemm_Hipblaslt_TN_8879,0.0632156
GemmTunableOp_Half_TN,tn_28672_2651_4096,Gemm_Hipblaslt_TN_9827,1.08266
GemmTunableOp_Half_TN,tn_28672_890_4096,Gemm_Hipblaslt_TN_9683,0.38447
GemmTunableOp_Half_TN,tn_6144_920_4096,Gemm_Hipblaslt_TN_9613,0.0932454
GemmTunableOp_Half_TN,tn_12288_1000_4096,Gemm_Hipblaslt_TN_9697,0.181568
GemmTunableOp_Half_TN,tn_4096_876_4096,Gemm_Hipblaslt_TN_9634,0.0662026
GemmTunableOp_Half_TN,tn_4096_34_4096,Gemm_Rocblas_621286428,0.0125852
GemmTunableOp_Half_TN,tn_4096_16_4096,Gemm_Rocblas_621294130,0.0101488
GemmTunableOp_Half_TN,tn_4096_918_4096,Gemm_Hipblaslt_TN_9634,0.066632
GemmTunableOp_Half_TN,tn_4096_2770_11008,Gemm_Hipblaslt_TN_9799,0.430204
GemmTunableOp_Half_TN,tn_12288_2915_4096,Gemm_Rocblas_621286684,0.509656
GemmTunableOp_Half_TN,tn_6144_4471_4096,Gemm_Hipblaslt_TN_9697,0.383877
GemmTunableOp_Half_TN,tn_4096_246_11008,Gemm_Hipblaslt_TN_8879,0.0647122
GemmTunableOp_Half_TN,tn_4096_3530_4096,Gemm_Hipblaslt_TN_9743,0.199329
GemmTunableOp_Half_TN,tn_4096_2898_11008,Gemm_Hipblaslt_TN_9709,0.446929
GemmTunableOp_Half_TN,tn_4096_872_14336,Gemm_Hipblaslt_TN_9580,0.219451
GemmTunableOp_Half_TN,tn_22016_225_4096,Gemm_Hipblaslt_TN_9720,0.096063
GemmTunableOp_Half_TN,tn_32000_22_4096,Gemm_Rocblas_621294191,0.0522864
GemmTunableOp_Half_TN,tn_4096_816_14336,Gemm_Hipblaslt_TN_9158,0.212252
GemmTunableOp_Half_TN,tn_4096_808_14336,Gemm_Hipblaslt_TN_9158,0.211606
GemmTunableOp_Half_TN,tn_4096_3813_4096,Gemm_Hipblaslt_TN_9768,0.216069
GemmTunableOp_Half_TN,tn_4096_852_14336,Gemm_Hipblaslt_TN_9580,0.218855
GemmTunableOp_Half_TN,tn_22016_2802_4096,Gemm_Hipblaslt_TN_9827,0.899041
GemmTunableOp_Half_TN,tn_6144_797_4096,Gemm_Hipblaslt_TN_9357,0.0857572
GemmTunableOp_Half_TN,tn_4096_3535_4096,Gemm_Hipblaslt_TN_9221,0.200883
GemmTunableOp_Half_TN,tn_4096_3953_11008,Gemm_Hipblaslt_TN_9815,0.576814
GemmTunableOp_Half_TN,tn_28672_3670_4096,Gemm_Hipblaslt_TN_9827,1.50037
GemmTunableOp_Half_TN,tn_28672_961_4096,Gemm_Hipblaslt_TN_9863,0.432206
GemmTunableOp_Half_TN,tn_22016_244_4096,Gemm_Hipblaslt_TN_9720,0.097428
GemmTunableOp_Half_TN,tn_4096_1775_4096,Gemm_Hipblaslt_TN_9134,0.117095
GemmTunableOp_Half_TN,tn_22016_3785_4096,Gemm_Hipblaslt_TN_9827,1.1476
GemmTunableOp_Half_TN,tn_22016_219_4096,Gemm_Hipblaslt_TN_9720,0.09498
GemmTunableOp_Half_TN,tn_6144_7809_4096,Gemm_Rocblas_621294435,0.642996
GemmTunableOp_Half_TN,tn_4096_2866_4096,Gemm_Hipblaslt_TN_9672,0.166908
GemmTunableOp_Half_TN,tn_28672_853_4096,Gemm_Hipblaslt_TN_9683,0.38099
GemmTunableOp_Half_TN,tn_128256_185_4096,Gemm_Hipblaslt_TN_9683,0.515432
GemmTunableOp_Half_TN,tn_4096_3577_11008,Gemm_Rocblas_621286743,0.526286
GemmTunableOp_Half_TN,tn_28672_927_4096,Gemm_Hipblaslt_TN_9683,0.391139
GemmTunableOp_Half_TN,tn_4096_1854_4096,Gemm_Hipblaslt_TN_9645,0.118283
GemmTunableOp_Half_TN,tn_12288_225_4096,Gemm_Rocblas_621286478,0.0566211
GemmTunableOp_Half_TN,tn_4096_19_11008,Gemm_Rocblas_621294054,0.023523
GemmTunableOp_Half_TN,tn_4096_1778_14336,Gemm_Hipblaslt_TN_9645,0.393793
GemmTunableOp_Half_TN,tn_4096_2703_14336,Gemm_Hipblaslt_TN_9799,0.540125
GemmTunableOp_Half_TN,tn_22016_9_4096,Gemm_Rocblas_621294186,0.0353266
GemmTunableOp_Half_TN,tn_4096_958_4096,Gemm_Hipblaslt_TN_9576,0.0680451
GemmTunableOp_Half_TN,tn_4096_2651_4096,Gemm_Hipblaslt_TN_9690,0.161605
GemmTunableOp_Half_TN,tn_12288_250_4096,Gemm_Rocblas_621286478,0.0575596
GemmTunableOp_Half_TN,tn_4096_224_4096,Gemm_Rocblas_621286440,0.0250363
GemmTunableOp_Half_TN,tn_12288_2798_4096,Gemm_Rocblas_621294426,0.49357
GemmTunableOp_Half_TN,tn_6144_923_4096,Gemm_Hipblaslt_TN_9613,0.092953
GemmTunableOp_Half_TN,tn_4096_1954_14336,Gemm_Hipblaslt_TN_9136,0.415332
GemmTunableOp_Half_TN,tn_4096_914_4096,Gemm_Hipblaslt_TN_9634,0.0680299
GemmTunableOp_Half_TN,tn_4096_230_11008,Gemm_Hipblaslt_TN_9303,0.064209
GemmTunableOp_Half_TN,tn_4096_2938_11008,Gemm_Hipblaslt_TN_9709,0.447695
GemmTunableOp_Half_TN,tn_4096_32_4096,Gemm_Rocblas_621286330,0.0115028
GemmTunableOp_Half_TN,tn_4096_250_4096,Gemm_Rocblas_621294230,0.0262183
GemmTunableOp_Half_TN,tn_22016_2915_4096,Gemm_Hipblaslt_TN_9827,0.903004
GemmTunableOp_Half_TN,tn_6144_1850_4096,Gemm_Hipblaslt_TN_9691,0.164884
GemmTunableOp_Half_TN,tn_4096_11_4096,Gemm_Rocblas_621294130,0.0100431
GemmTunableOp_Half_TN,tn_4096_896_4096,Gemm_Hipblaslt_TN_9604,0.066337
GemmTunableOp_Half_TN,tn_6144_1700_4096,Gemm_Hipblaslt_TN_9570,0.154905
GemmTunableOp_Half_TN,tn_28672_1794_4096,Gemm_Hipblaslt_TN_9683,0.782634
GemmTunableOp_Half_TN,tn_12288_3267_4096,Gemm_Hipblaslt_TN_9677,0.565837
GemmTunableOp_Half_TN,tn_12288_21_4096,Gemm_Rocblas_621294064,0.0224674
GemmTunableOp_Half_TN,tn_4096_1673_14336,Gemm_Hipblaslt_TN_9671,0.361432
GemmTunableOp_Half_TN,tn_28672_821_4096,Gemm_Hipblaslt_TN_9684,0.378409
GemmTunableOp_Half_TN,tn_4096_1867_4096,Gemm_Hipblaslt_TN_9645,0.122
GemmTunableOp_Half_TN,tn_4096_817_14336,Gemm_Hipblaslt_TN_9158,0.21017
GemmTunableOp_Half_TN,tn_22016_3717_4096,Gemm_Hipblaslt_TN_9841,1.13618
GemmTunableOp_Half_TN,tn_22016_3621_4096,Gemm_Hipblaslt_TN_9827,1.11081
GemmTunableOp_Half_TN,tn_4096_1792_14336,Gemm_Hipblaslt_TN_9134,0.395582
GemmTunableOp_Half_TN,tn_128256_62_4096,Gemm_Rocblas_621294554,0.356109
GemmTunableOp_Half_TN,tn_4096_233_11008,Gemm_Hipblaslt_TN_7627,0.0639179
GemmTunableOp_Half_TN,tn_32000_216_4096,Gemm_Hipblaslt_TN_9590,0.139119
GemmTunableOp_Half_TN,tn_4096_227_11008,Gemm_Hipblaslt_TN_8879,0.0612862
GemmTunableOp_Half_TN,tn_28672_64_4096,Gemm_Rocblas_621286634,0.048452
GemmTunableOp_Half_TN,tn_4096_3571_14336,Gemm_Hipblaslt_TN_9677,0.682981
GemmTunableOp_Half_TN,tn_4096_875_14336,Gemm_Hipblaslt_TN_9580,0.218773
GemmTunableOp_Half_TN,tn_6144_982_4096,Gemm_Hipblaslt_TN_9587,0.101059
GemmTunableOp_Half_TN,tn_12288_3972_4096,Gemm_Rocblas_621286590,0.653086
GemmTunableOp_Half_TN,tn_6144_8069_4096,Gemm_Rocblas_621286678,0.672145
GemmTunableOp_Half_TN,tn_4096_3987_4096,Gemm_Hipblaslt_TN_9841,0.221735
GemmTunableOp_Half_TN,tn_28672_96_4096,Gemm_Rocblas_621286719,0.0585059
GemmTunableOp_Half_TN,tn_4096_233_4096,Gemm_Rocblas_621294168,0.0257831
GemmTunableOp_Half_TN,tn_4096_1791_4096,Gemm_Hipblaslt_TN_9134,0.115972
GemmTunableOp_Half_TN,tn_22016_1293_4096,Gemm_Rocblas_621294455,0.448383
GemmTunableOp_Half_TN,tn_4096_239_4096,Gemm_Rocblas_621286491,0.0259694
GemmTunableOp_Half_TN,tn_6144_984_4096,Gemm_Hipblaslt_TN_9633,0.100126
GemmTunableOp_Half_TN,tn_4096_819_14336,Gemm_Hipblaslt_TN_9158,0.213518
GemmTunableOp_Half_TN,tn_128256_129_4096,Gemm_Hipblaslt_TN_9808,0.456698
GemmTunableOp_Half_TN,tn_12288_227_4096,Gemm_Rocblas_621294215,0.0568654
GemmTunableOp_Half_TN,tn_22016_2866_4096,Gemm_Hipblaslt_TN_9841,0.906235
GemmTunableOp_Half_TN,tn_28672_977_4096,Gemm_Hipblaslt_TN_9733,0.427124
GemmTunableOp_Half_TN,tn_28672_248_4096,Gemm_Rocblas_621286584,0.122412
GemmTunableOp_Half_TN,tn_4096_21_4096,Gemm_Rocblas_621294139,0.0109623
GemmTunableOp_Half_TN,tn_128256_148_4096,Gemm_Hipblaslt_TN_9808,0.468487
GemmTunableOp_Half_TN,tn_6144_903_4096,Gemm_Hipblaslt_TN_9561,0.0926457
GemmTunableOp_Half_TN,tn_4096_34_11008,Gemm_Rocblas_621286332,0.0268375
GemmTunableOp_Half_TN,tn_28672_2681_4096,Gemm_Hipblaslt_TN_9827,1.08556
GemmTunableOp_Half_TN,tn_28672_3599_4096,Gemm_Hipblaslt_TN_9832,1.45782
GemmTunableOp_Half_TN,tn_32000_250_4096,Gemm_Hipblaslt_TN_9638,0.149937
GemmTunableOp_Half_TN,tn_4096_3535_11008,Gemm_Rocblas_621286743,0.526783
GemmTunableOp_Half_TN,tn_12288_2866_4096,Gemm_Rocblas_621294426,0.500468
GemmTunableOp_Half_TN,tn_4096_3173_11008,Gemm_Hipblaslt_TN_9817,0.491829
GemmTunableOp_Half_TN,tn_4096_2592_4096,Gemm_Rocblas_621294426,0.15941
GemmTunableOp_Half_TN,tn_12288_220_4096,Gemm_Rocblas_621294215,0.0563784
GemmTunableOp_Half_TN,tn_4096_29_11008,Gemm_Rocblas_621286305,0.0250826
GemmTunableOp_Half_TN,tn_12288_3621_4096,Gemm_Hipblaslt_TN_9677,0.597918
GemmTunableOp_Half_TN,tn_22016_3843_4096,Gemm_Hipblaslt_TN_9832,1.23071
GemmTunableOp_Half_TN,tn_4096_1723_4096,Gemm_Hipblaslt_TN_9616,0.104782
GemmTunableOp_Half_TN,tn_6144_852_4096,Gemm_Rocblas_621294520,0.0881951
GemmTunableOp_Half_TN,tn_4096_842_4096,Gemm_Hipblaslt_TN_9170,0.0641673
GemmTunableOp_Half_TN,tn_28672_840_4096,Gemm_Hipblaslt_TN_9684,0.380788
GemmTunableOp_Half_TN,tn_28672_2572_4096,Gemm_Hipblaslt_TN_9827,1.07594
GemmTunableOp_Half_TN,tn_22016_247_4096,Gemm_Hipblaslt_TN_9641,0.0986421
GemmTunableOp_Half_TN,tn_4096_8_4096,Gemm_Rocblas_621286300,0.00998498
GemmTunableOp_Half_TN,tn_4096_241_11008,Gemm_Hipblaslt_TN_8879,0.0651561
GemmTunableOp_Half_TN,tn_128256_182_4096,Gemm_Hipblaslt_TN_9683,0.51578
GemmTunableOp_Half_TN,tn_32000_30_4096,Gemm_Rocblas_621286346,0.0527233
GemmTunableOp_Half_TN,tn_28672_803_4096,Gemm_Hipblaslt_TN_9684,0.374877
GemmTunableOp_Half_TN,tn_6144_1739_4096,Gemm_Hipblaslt_TN_9799,0.157272
GemmTunableOp_Half_TN,tn_6144_48_4096,Gemm_Rocblas_621286337,0.0153713
GemmTunableOp_Half_TN,tn_6144_907_4096,Gemm_Hipblaslt_TN_9613,0.0923675
GemmTunableOp_Half_TN,tn_4096_917_14336,Gemm_Hipblaslt_TN_9634,0.230493
GemmTunableOp_Half_TN,tn_4096_1261_11008,Gemm_Hipblaslt_TN_9148,0.231433
GemmTunableOp_Half_TN,tn_28672_1944_4096,Gemm_Hipblaslt_TN_9846,0.83142
GemmTunableOp_Half_TN,tn_4096_1743_4096,Gemm_Hipblaslt_TN_9134,0.116203
GemmTunableOp_Half_TN,tn_4096_978_4096,Gemm_Hipblaslt_TN_9604,0.0700195
GemmTunableOp_Half_TN,tn_6144_838_4096,Gemm_Rocblas_621294520,0.0880424
GemmTunableOp_Half_TN,tn_4096_861_4096,Gemm_Hipblaslt_TN_9634,0.0650923
GemmTunableOp_Half_TN,tn_12288_242_4096,Gemm_Rocblas_621286478,0.057809
GemmTunableOp_Half_TN,tn_32000_27_4096,Gemm_Rocblas_621294191,0.0524928
GemmTunableOp_Half_TN,tn_4096_238_4096,Gemm_Rocblas_621286440,0.0263398
GemmTunableOp_Half_TN,tn_4096_1854_14336,Gemm_Hipblaslt_TN_9137,0.404567
GemmTunableOp_Half_TN,tn_128256_241_4096,Gemm_Rocblas_621286905,0.604034
GemmTunableOp_Half_TN,tn_4096_192_14336,Gemm_Hipblaslt_TN_7586,0.0621068
GemmTunableOp_Half_TN,tn_12288_3813_4096,Gemm_Rocblas_621294420,0.645509
GemmTunableOp_Half_TN,tn_4096_879_14336,Gemm_Hipblaslt_TN_9580,0.218662
GemmTunableOp_Half_TN,tn_6144_943_4096,Gemm_Hipblaslt_TN_9613,0.093785
GemmTunableOp_Half_TN,tn_4096_223_4096,Gemm_Rocblas_621286491,0.0251378
GemmTunableOp_Half_TN,tn_28672_1695_4096,Gemm_Hipblaslt_TN_9190,0.723261
GemmTunableOp_Half_TN,tn_4096_866_4096,Gemm_Hipblaslt_TN_9170,0.0648331
GemmTunableOp_Half_TN,tn_22016_4021_4096,Gemm_Hipblaslt_TN_9832,1.25101
GemmTunableOp_Half_TN,tn_128256_254_4096,Gemm_Rocblas_621286905,0.60372
GemmTunableOp_Half_TN,tn_28672_7804_4096,Gemm_Hipblaslt_TN_159,3.05018
GemmTunableOp_Half_TN,tn_4096_2834_4096,Gemm_Hipblaslt_TN_9674,0.165348
GemmTunableOp_Half_TN,tn_4096_889_14336,Gemm_Hipblaslt_TN_9580,0.220307
GemmTunableOp_Half_TN,tn_12288_216_4096,Gemm_Rocblas_621294215,0.056247
GemmTunableOp_Half_TN,tn_22016_2770_4096,Gemm_Hipblaslt_TN_9827,0.889592
GemmTunableOp_Half_TN,tn_12288_251_4096,Gemm_Rocblas_621286478,0.0583451
GemmTunableOp_Half_TN,tn_4096_815_14336,Gemm_Hipblaslt_TN_9158,0.212093
GemmTunableOp_Half_TN,tn_12288_3669_4096,Gemm_Rocblas_621286678,0.622962
GemmTunableOp_Half_TN,tn_12288_36_4096,Gemm_Rocblas_621294171,0.0252905
GemmTunableOp_Half_TN,tn_6144_7787_4096,Gemm_Rocblas_621294420,0.650566
GemmTunableOp_Half_TN,tn_28672_865_4096,Gemm_Hipblaslt_TN_9684,0.38219
GemmTunableOp_Half_TN,tn_4096_2517_4096,Gemm_Hipblaslt_TN_9674,0.154886
GemmTunableOp_Half_TN,tn_6144_905_4096,Gemm_Hipblaslt_TN_9613,0.0929793
GemmTunableOp_Half_TN,tn_6144_893_4096,Gemm_Hipblaslt_TN_9253,0.0917766
GemmTunableOp_Half_TN,tn_4096_2698_4096,Gemm_Hipblaslt_TN_9691,0.162945
GemmTunableOp_Half_TN,tn_4096_4000_11008,Gemm_Rocblas_621286281,0.578878
GemmTunableOp_Half_TN,tn_12288_2978_4096,Gemm_Rocblas_621286684,0.513586
GemmTunableOp_Half_TN,tn_4096_234_4096,Gemm_Rocblas_621294230,0.0259609
GemmTunableOp_Half_TN,tn_6144_2721_4096,Gemm_Hipblaslt_TN_9567,0.25256
GemmTunableOp_Half_TN,tn_4096_2958_11008,Gemm_Hipblaslt_TN_9689,0.452127
GemmTunableOp_Half_TN,tn_4096_3556_4096,Gemm_Hipblaslt_TN_9743,0.198973
GemmTunableOp_Half_TN,tn_4096_7299_4096,Gemm_Hipblaslt_TN_9890,0.41671
GemmTunableOp_Half_TN,tn_32000_21_4096,Gemm_Rocblas_621286346,0.0522984
GemmTunableOp_Half_TN,tn_4096_33_11008,Gemm_Rocblas_621286332,0.0268576
GemmTunableOp_Half_TN,tn_32000_221_4096,Gemm_Hipblaslt_TN_9620,0.137854
GemmTunableOp_Half_TN,tn_22016_216_4096,Gemm_Hipblaslt_TN_9641,0.0950367
GemmTunableOp_Half_TN,tn_4096_242_11008,Gemm_Hipblaslt_TN_8879,0.0650263
GemmTunableOp_Half_TN,tn_4096_235_11008,Gemm_Hipblaslt_TN_8879,0.0642724
GemmTunableOp_Half_TN,tn_4096_850_4096,Gemm_Hipblaslt_TN_9604,0.0645391
GemmTunableOp_Half_TN,tn_128256_14_4096,Gemm_Rocblas_621294224,0.290396
GemmTunableOp_Half_TN,tn_28672_938_4096,Gemm_Hipblaslt_TN_9684,0.391589
GemmTunableOp_Half_TN,tn_6144_1954_4096,Gemm_Hipblaslt_TN_9693,0.176276
GemmTunableOp_Half_TN,tn_4096_949_4096,Gemm_Hipblaslt_TN_9634,0.0682521
GemmTunableOp_Half_TN,tn_12288_2850_4096,Gemm_Rocblas_621294426,0.497091
GemmTunableOp_Half_TN,tn_128256_112_4096,Gemm_Hipblaslt_TN_9263,0.422298
GemmTunableOp_Half_TN,tn_6144_794_4096,Gemm_Hipblaslt_TN_9357,0.0861928
GemmTunableOp_Half_TN,tn_28672_794_4096,Gemm_Hipblaslt_TN_9691,0.349491
GemmTunableOp_Half_TN,tn_28672_946_4096,Gemm_Hipblaslt_TN_9683,0.393153
GemmTunableOp_Half_TN,tn_4096_2602_14336,Gemm_Hipblaslt_TN_9657,0.53809
GemmTunableOp_Half_TN,tn_32000_248_4096,Gemm_Hipblaslt_TN_9665,0.147262
GemmTunableOp_Half_TN,tn_4096_1783_4096,Gemm_Hipblaslt_TN_9134,0.117436
GemmTunableOp_Half_TN,tn_4096_964_4096,Gemm_Hipblaslt_TN_9604,0.0711024
GemmTunableOp_Half_TN,tn_12288_234_4096,Gemm_Rocblas_621294215,0.0577459
GemmTunableOp_Half_TN,tn_6144_857_4096,Gemm_Rocblas_621294520,0.0880794
GemmTunableOp_Half_TN,tn_6144_3671_4096,Gemm_Hipblaslt_TN_9687,0.325616
GemmTunableOp_Half_TN,tn_4096_964_14336,Gemm_Hipblaslt_TN_9170,0.239032
GemmTunableOp_Half_TN,tn_4096_829_14336,Gemm_Hipblaslt_TN_9147,0.213384
GemmTunableOp_Half_TN,tn_4096_794_4096,Gemm_Hipblaslt_TN_9131,0.0635107
GemmTunableOp_Half_TN,tn_28672_1803_4096,Gemm_Hipblaslt_TN_9684,0.782682
GemmTunableOp_Half_TN,tn_4096_1893_4096,Gemm_Hipblaslt_TN_9645,0.120501
GemmTunableOp_Half_TN,tn_4096_1672_4096,Gemm_Hipblaslt_TN_9569,0.104893
GemmTunableOp_Half_TN,tn_28672_857_4096,Gemm_Hipblaslt_TN_9683,0.382493
GemmTunableOp_Half_TN,tn_6144_1785_4096,Gemm_Hipblaslt_TN_9676,0.163303
GemmTunableOp_Half_TN,tn_128256_119_4096,Gemm_Hipblaslt_TN_9760,0.425269
GemmTunableOp_Half_TN,tn_4096_878_14336,Gemm_Hipblaslt_TN_9580,0.219019
GemmTunableOp_Half_TN,tn_6144_3447_4096,Gemm_Hipblaslt_TN_9570,0.307039
GemmTunableOp_Half_TN,tn_6144_3418_4096,Gemm_Rocblas_621286753,0.306863
GemmTunableOp_Half_TN,tn_28672_8_4096,Gemm_Rocblas_621294053,0.0440225
GemmTunableOp_Half_TN,tn_6144_7992_4096,Gemm_Rocblas_621294435,0.665326
GemmTunableOp_Half_TN,tn_128256_255_4096,Gemm_Rocblas_621286892,0.601257
GemmTunableOp_Half_TN,tn_28672_2763_4096,Gemm_Hipblaslt_TN_9223,1.18244
GemmTunableOp_Half_TN,tn_28672_1700_4096,Gemm_Hipblaslt_TN_9223,0.724131
GemmTunableOp_Half_TN,tn_4096_865_14336,Gemm_Hipblaslt_TN_9580,0.217164
GemmTunableOp_Half_TN,tn_4096_790_14336,Gemm_Hipblaslt_TN_9158,0.207962
GemmTunableOp_Half_TN,tn_4096_48_4096,Gemm_Rocblas_621294153,0.0127751
GemmTunableOp_Half_TN,tn_6144_56_4096,Gemm_Rocblas_621286426,0.0156958
GemmTunableOp_Half_TN,tn_28672_854_4096,Gemm_Hipblaslt_TN_9684,0.381618
GemmTunableOp_Half_TN,tn_4096_820_4096,Gemm_Hipblaslt_TN_9634,0.0639265
GemmTunableOp_Half_TN,tn_4096_992_4096,Gemm_Hipblaslt_TN_9634,0.0704083
GemmTunableOp_Half_TN,tn_6144_908_4096,Gemm_Hipblaslt_TN_9606,0.0930935
GemmTunableOp_Half_TN,tn_4096_250_11008,Gemm_Hipblaslt_TN_9303,0.066369
GemmTunableOp_Half_TN,tn_6144_869_4096,Gemm_Hipblaslt_TN_9253,0.0918982
GemmTunableOp_Half_TN,tn_6144_256_4096,Gemm_Hipblaslt_TN_9496,0.0354628
GemmTunableOp_Half_TN,tn_28672_969_4096,Gemm_Hipblaslt_TN_9666,0.43214
GemmTunableOp_Half_TN,tn_28672_1864_4096,Gemm_Hipblaslt_TN_9684,0.791675
GemmTunableOp_Half_TN,tn_4096_96_4096,Gemm_Rocblas_621286279,0.0156277
GemmTunableOp_Half_TN,tn_128256_225_4096,Gemm_Rocblas_621286892,0.588221
GemmTunableOp_Half_TN,tn_6144_802_4096,Gemm_Rocblas_621286778,0.087296
GemmTunableOp_Half_TN,tn_6144_935_4096,Gemm_Hipblaslt_TN_9613,0.0933972
GemmTunableOp_Half_TN,tn_28672_2826_4096,Gemm_Hipblaslt_TN_9827,1.15098
GemmTunableOp_Half_TN,tn_6144_1748_4096,Gemm_Hipblaslt_TN_9691,0.158833
GemmTunableOp_Half_TN,tn_6144_8_4096,Gemm_Rocblas_621286273,0.0128996
GemmTunableOp_Half_TN,tn_128256_81_4096,Gemm_Hipblaslt_TN_9057,0.374082
GemmTunableOp_Half_TN,tn_6144_4483_4096,Gemm_Hipblaslt_TN_9192,0.384635
GemmTunableOp_Half_TN,tn_22016_22_4096,Gemm_Rocblas_621286346,0.0359403
GemmTunableOp_Half_TN,tn_4096_866_14336,Gemm_Hipblaslt_TN_9580,0.219277
GemmTunableOp_Half_TN,tn_4096_958_14336,Gemm_Hipblaslt_TN_9634,0.234363
GemmTunableOp_Half_TN,tn_4096_807_14336,Gemm_Hipblaslt_TN_9158,0.212132
GemmTunableOp_Half_TN,tn_4096_898_4096,Gemm_Hipblaslt_TN_9634,0.0688251
GemmTunableOp_Half_TN,tn_4096_1694_4096,Gemm_Hipblaslt_TN_9265,0.107693
GemmTunableOp_Half_TN,tn_6144_2750_4096,Gemm_Hipblaslt_TN_9763,0.255051
GemmTunableOp_Half_TN,tn_4096_3752_14336,Gemm_Rocblas_621294030,0.718665
GemmTunableOp_Half_TN,tn_6144_940_4096,Gemm_Hipblaslt_TN_9613,0.0930649
GemmTunableOp_Half_TN,tn_6144_1831_4096,Gemm_Hipblaslt_TN_9672,0.164918
GemmTunableOp_Half_TN,tn_4096_1614_4096,Gemm_Hipblaslt_TN_9671,0.104356
GemmTunableOp_Half_TN,tn_6144_983_4096,Gemm_Rocblas_621286571,0.100694
GemmTunableOp_Half_TN,tn_4096_1900_4096,Gemm_Hipblaslt_TN_9645,0.119334
GemmTunableOp_Half_TN,tn_128256_12_4096,Gemm_Rocblas_621294224,0.286509
GemmTunableOp_Half_TN,tn_4096_2719_4096,Gemm_Hipblaslt_TN_9691,0.160823
GemmTunableOp_Half_TN,tn_4096_896_14336,Gemm_Hipblaslt_TN_9580,0.218723
GemmTunableOp_Half_TN,tn_28672_850_4096,Gemm_Hipblaslt_TN_9684,0.379841
GemmTunableOp_Half_TN,tn_4096_904_4096,Gemm_Hipblaslt_TN_9576,0.0680652
GemmTunableOp_Half_TN,tn_4096_2636_14336,Gemm_Rocblas_621294447,0.538265
GemmTunableOp_Half_TN,tn_4096_2537_4096,Gemm_Hipblaslt_TN_9657,0.155808
GemmTunableOp_Half_TN,tn_4096_56_14336,Gemm_Hipblaslt_TN_7486,0.033924
GemmTunableOp_Half_TN,tn_28672_905_4096,Gemm_Hipblaslt_TN_9683,0.388714
GemmTunableOp_Half_TN,tn_28672_2793_4096,Gemm_Rocblas_621294330,1.18707
GemmTunableOp_Half_TN,tn_28672_988_4096,Gemm_Hipblaslt_TN_9716,0.433988
GemmTunableOp_Half_TN,tn_4096_942_4096,Gemm_Hipblaslt_TN_9576,0.06836
GemmTunableOp_Half_TN,tn_4096_208_4096,Gemm_Rocblas_621286443,0.0253462
GemmTunableOp_Half_TN,tn_4096_2509_14336,Gemm_Hipblaslt_TN_9799,0.51947
GemmTunableOp_Half_TN,tn_28672_968_4096,Gemm_Hipblaslt_TN_9666,0.432431
GemmTunableOp_Half_TN,tn_4096_192_4096,Gemm_Rocblas_621286491,0.0229139
GemmTunableOp_Half_TN,tn_128256_222_4096,Gemm_Hipblaslt_TN_9937,0.569921
GemmTunableOp_Half_TN,tn_4096_1727_4096,Gemm_Hipblaslt_TN_9616,0.107343
GemmTunableOp_Half_TN,tn_28672_1791_4096,Gemm_Hipblaslt_TN_9223,0.743234
GemmTunableOp_Half_TN,tn_28672_240_4096,Gemm_Rocblas_621294324,0.121022
GemmTunableOp_Half_TN,tn_4096_256_14336,Gemm_Hipblaslt_TN_9303,0.0746161
GemmTunableOp_Half_TN,tn_6144_918_4096,Gemm_Hipblaslt_TN_9613,0.0927024
GemmTunableOp_Half_TN,tn_6144_7804_4096,Gemm_Hipblaslt_TN_9217,0.654225
GemmTunableOp_Half_TN,tn_4096_2672_4096,Gemm_Hipblaslt_TN_9799,0.159553
GemmTunableOp_Half_TN,tn_6144_8054_4096,Gemm_Rocblas_621286590,0.66734
GemmTunableOp_Half_TN,tn_28672_120_4096,Gemm_Hipblaslt_TN_9589,0.0707642
GemmTunableOp_Half_TN,tn_6144_894_4096,Gemm_Hipblaslt_TN_9613,0.0918838
GemmTunableOp_Half_TN,tn_4096_803_14336,Gemm_Hipblaslt_TN_9158,0.209274
GemmTunableOp_Half_TN,tn_4096_801_4096,Gemm_Hipblaslt_TN_9634,0.063341
GemmTunableOp_Half_TN,tn_128256_10_4096,Gemm_Rocblas_621294224,0.284787
GemmTunableOp_Half_TN,tn_4096_3599_14336,Gemm_Hipblaslt_TN_9139,0.686734
GemmTunableOp_Half_TN,tn_128256_239_4096,Gemm_Rocblas_621286892,0.600678
GemmTunableOp_Half_TN,tn_4096_913_4096,Gemm_Hipblaslt_TN_9576,0.068781
GemmTunableOp_Half_TN,tn_4096_1817_14336,Gemm_Hipblaslt_TN_9268,0.402566
GemmTunableOp_Half_TN,tn_4096_938_4096,Gemm_Hipblaslt_TN_9576,0.0685742
GemmTunableOp_Half_TN,tn_128256_247_4096,Gemm_Rocblas_621286892,0.6024
GemmTunableOp_Half_TN,tn_128256_197_4096,Gemm_Hipblaslt_TN_9847,0.555251
GemmTunableOp_Half_TN,tn_4096_2872_14336,Gemm_Hipblaslt_TN_9799,0.574338
GemmTunableOp_Half_TN,tn_28672_2675_4096,Gemm_Hipblaslt_TN_9827,1.07623
GemmTunableOp_Half_TN,tn_4096_2826_14336,Gemm_Hipblaslt_TN_9799,0.564649
GemmTunableOp_Half_TN,tn_6144_224_4096,Gemm_Hipblaslt_TN_9494,0.0337579
GemmTunableOp_Half_TN,tn_6144_7944_4096,Gemm_Rocblas_621294420,0.66017
GemmTunableOp_Half_TN,tn_4096_854_4096,Gemm_Hipblaslt_TN_9634,0.0648843
GemmTunableOp_Half_TN,tn_28672_160_4096,Gemm_Hipblaslt_TN_9370,0.0861851
GemmTunableOp_Half_TN,tn_28672_7967_4096,Gemm_Hipblaslt_TN_159,3.16625
GemmTunableOp_Half_TN,tn_4096_1644_14336,Gemm_Hipblaslt_TN_9790,0.359374
GemmTunableOp_Half_TN,tn_28672_861_4096,Gemm_Hipblaslt_TN_9683,0.382568
GemmTunableOp_Half_TN,tn_6144_803_4096,Gemm_Rocblas_621286778,0.0874948
GemmTunableOp_Half_TN,tn_4096_7952_14336,Gemm_Hipblaslt_TN_9749,1.60382
GemmTunableOp_Half_TN,tn_4096_1700_4096,Gemm_Hipblaslt_TN_9616,0.106072
GemmTunableOp_Half_TN,tn_28672_7436_4096,Gemm_Hipblaslt_TN_159,2.95858
GemmTunableOp_Half_TN,tn_4096_900_14336,Gemm_Hipblaslt_TN_9634,0.229539
GemmTunableOp_Half_TN,tn_28672_8007_4096,Gemm_Hipblaslt_TN_159,3.18764
GemmTunableOp_Half_TN,tn_4096_7283_4096,Gemm_Hipblaslt_TN_9743,0.408608
GemmTunableOp_Half_TN,tn_28672_3310_4096,Gemm_Hipblaslt_TN_9827,1.35948
GemmTunableOp_Half_TN,tn_4096_7863_4096,Gemm_Rocblas_621294127,0.441511
GemmTunableOp_Half_TN,tn_128256_31_4096,Gemm_Hipblaslt_TN_9451,0.313745
GemmTunableOp_Half_TN,tn_128256_191_4096,Gemm_Hipblaslt_TN_9952,0.515428
GemmTunableOp_Half_TN,tn_28672_32_4096,Gemm_Rocblas_621294559,0.0458326
GemmTunableOp_Half_TN,tn_4096_7798_4096,Gemm_Hipblaslt_TN_9655,0.436803
GemmTunableOp_Half_TN,tn_4096_925_4096,Gemm_Hipblaslt_TN_9576,0.0693536
GemmTunableOp_Half_TN,tn_4096_7857_4096,Gemm_Hipblaslt_TN_9959,0.441484
GemmTunableOp_Half_TN,tn_6144_7863_4096,Gemm_Hipblaslt_TN_9768,0.660405
GemmTunableOp_Half_TN,tn_128256_152_4096,Gemm_Hipblaslt_TN_9852,0.474174
GemmTunableOp_Half_TN,tn_4096_7809_14336,Gemm_Hipblaslt_TN_9753,1.58262
GemmTunableOp_Half_TN,tn_28672_3352_4096,Gemm_Hipblaslt_TN_9827,1.36722
GemmTunableOp_Half_TN,tn_4096_1798_14336,Gemm_Hipblaslt_TN_9268,0.402635
GemmTunableOp_Half_TN,tn_28672_2734_4096,Gemm_Rocblas_621294330,1.18299
GemmTunableOp_Half_TN,tn_28672_900_4096,Gemm_Hipblaslt_TN_9684,0.387612
GemmTunableOp_Half_TN,tn_4096_48_14336,Gemm_Hipblaslt_TN_8050,0.0313216
GemmTunableOp_Half_TN,tn_4096_808_4096,Gemm_Hipblaslt_TN_9604,0.0628505
GemmTunableOp_Half_TN,tn_28672_2648_4096,Gemm_Hipblaslt_TN_9827,1.07871
GemmTunableOp_Half_TN,tn_4096_1880_4096,Gemm_Hipblaslt_TN_9134,0.120041
GemmTunableOp_Half_TN,tn_4096_879_4096,Gemm_Hipblaslt_TN_9604,0.0668133
GemmTunableOp_Half_TN,tn_4096_2648_4096,Gemm_Hipblaslt_TN_9691,0.161209
GemmTunableOp_Half_TN,tn_128256_146_4096,Gemm_Hipblaslt_TN_9808,0.468407
GemmTunableOp_Half_TN,tn_6144_1829_4096,Gemm_Hipblaslt_TN_9690,0.164677
GemmTunableOp_Half_TN,tn_28672_799_4096,Gemm_Hipblaslt_TN_9691,0.350342
GemmTunableOp_Half_TN,tn_12288_2398_4096,Gemm_Hipblaslt_TN_9220,0.409398
GemmTunableOp_Half_TN,tn_4096_1726_14336,Gemm_Hipblaslt_TN_9790,0.366402
GemmTunableOp_Half_TN,tn_4096_1794_4096,Gemm_Hipblaslt_TN_9134,0.118173
GemmTunableOp_Half_TN,tn_28672_947_4096,Gemm_Hipblaslt_TN_9684,0.393327
GemmTunableOp_Half_TN,tn_12288_4021_4096,Gemm_Hipblaslt_TN_9220,0.658736
GemmTunableOp_Half_TN,tn_28672_866_4096,Gemm_Hipblaslt_TN_9683,0.382727
GemmTunableOp_Half_TN,tn_4096_8156_4096,Gemm_Rocblas_621294287,0.451605
GemmTunableOp_Half_TN,tn_4096_937_14336,Gemm_Hipblaslt_TN_9589,0.232926
GemmTunableOp_Half_TN,tn_4096_1768_4096,Gemm_Hipblaslt_TN_9134,0.115451
GemmTunableOp_Half_TN,tn_4096_3843_11008,Gemm_Hipblaslt_TN_9827,0.568256
GemmTunableOp_Half_TN,tn_4096_959_14336,Gemm_Hipblaslt_TN_9634,0.233958
GemmTunableOp_Half_TN,tn_6144_1705_4096,Gemm_Rocblas_621294306,0.156277
GemmTunableOp_Half_TN,tn_4096_901_4096,Gemm_Hipblaslt_TN_9634,0.069045
GemmTunableOp_Half_TN,tn_128256_178_4096,Gemm_Hipblaslt_TN_9732,0.514337
GemmTunableOp_Half_TN,tn_4096_951_14336,Gemm_Hipblaslt_TN_9589,0.233748
GemmTunableOp_Half_TN,tn_4096_942_14336,Gemm_Hipblaslt_TN_9634,0.23235
GemmTunableOp_Half_TN,tn_28672_1701_4096,Gemm_Hipblaslt_TN_9223,0.726897
GemmTunableOp_Half_TN,tn_6144_1806_4096,Gemm_Hipblaslt_TN_9672,0.162329
GemmTunableOp_Half_TN,tn_4096_959_4096,Gemm_Hipblaslt_TN_9576,0.0686001
GemmTunableOp_Half_TN,tn_4096_64_4096,Gemm_Rocblas_621294227,0.0126373
GemmTunableOp_Half_TN,tn_6144_815_4096,Gemm_Rocblas_621286778,0.0881597
GemmTunableOp_Half_TN,tn_4096_917_4096,Gemm_Hipblaslt_TN_9576,0.068205
GemmTunableOp_Half_TN,tn_6144_916_4096,Gemm_Hipblaslt_TN_9613,0.0933471
GemmTunableOp_Half_TN,tn_4096_863_14336,Gemm_Hipblaslt_TN_9580,0.218277
GemmTunableOp_Half_TN,tn_28672_1886_4096,Gemm_Hipblaslt_TN_9684,0.794609
GemmTunableOp_Half_TN,tn_4096_972_4096,Gemm_Hipblaslt_TN_9604,0.0700948
GemmTunableOp_Half_TN,tn_6144_888_4096,Gemm_Hipblaslt_TN_9253,0.0918796
GemmTunableOp_Half_TN,tn_4096_814_4096,Gemm_Hipblaslt_TN_9634,0.0639389
GemmTunableOp_Half_TN,tn_28672_104_4096,Gemm_Rocblas_621294210,0.0670152
GemmTunableOp_Half_TN,tn_6144_942_4096,Gemm_Hipblaslt_TN_9613,0.0935141
GemmTunableOp_Half_TN,tn_6144_1729_4096,Gemm_Hipblaslt_TN_9799,0.156685
GemmTunableOp_Half_TN,tn_6144_892_4096,Gemm_Hipblaslt_TN_9253,0.0911054
GemmTunableOp_Half_TN,tn_6144_2788_4096,Gemm_Hipblaslt_TN_9763,0.256753
GemmTunableOp_Half_TN,tn_6144_1883_4096,Gemm_Hipblaslt_TN_9799,0.165776
GemmTunableOp_Half_TN,tn_4096_857_14336,Gemm_Hipblaslt_TN_9580,0.219216
GemmTunableOp_Half_TN,tn_28672_152_4096,Gemm_Hipblaslt_TN_9370,0.0868465
GemmTunableOp_Half_TN,tn_4096_1883_14336,Gemm_Hipblaslt_TN_9137,0.412978
GemmTunableOp_Half_TN,tn_4096_27_4096,Gemm_Rocblas_621286330,0.0115622
GemmTunableOp_Half_TN,tn_6144_1614_4096,Gemm_Hipblaslt_TN_9570,0.15158
GemmTunableOp_Half_TN,tn_6144_7857_4096,Gemm_Hipblaslt_TN_9813,0.658739
GemmTunableOp_Half_TN,tn_28672_943_4096,Gemm_Hipblaslt_TN_9684,0.392616
GemmTunableOp_Half_TN,tn_4096_845_4096,Gemm_Hipblaslt_TN_9131,0.0645468
GemmTunableOp_Half_TN,tn_6144_911_4096,Gemm_Hipblaslt_TN_9613,0.0930854
GemmTunableOp_Half_TN,tn_6144_8156_4096,Gemm_Hipblaslt_TN_9223,0.67678
GemmTunableOp_Half_TN,tn_128256_25_4096,Gemm_Rocblas_621294578,0.309432
GemmTunableOp_Half_TN,tn_28672_1848_4096,Gemm_Hipblaslt_TN_9684,0.790336
GemmTunableOp_Half_TN,tn_4096_3923_4096,Gemm_Hipblaslt_TN_9841,0.218843
GemmTunableOp_Half_TN,tn_4096_1763_14336,Gemm_Hipblaslt_TN_9645,0.393221
GemmTunableOp_Half_TN,tn_4096_1791_14336,Gemm_Hipblaslt_TN_9645,0.394552
GemmTunableOp_Half_TN,tn_6144_1644_4096,Gemm_Rocblas_621286753,0.152839
GemmTunableOp_Half_TN,tn_6144_1841_4096,Gemm_Hipblaslt_TN_9672,0.164134
GemmTunableOp_Half_TN,tn_28672_1644_4096,Gemm_Hipblaslt_TN_9223,0.715165
GemmTunableOp_Half_TN,tn_6144_3569_4096,Gemm_Hipblaslt_TN_9570,0.313703
GemmTunableOp_Half_TN,tn_28672_2708_4096,Gemm_Hipblaslt_TN_9847,1.16513
GemmTunableOp_Half_TN,tn_6144_1730_4096,Gemm_Hipblaslt_TN_9799,0.156441
GemmTunableOp_Half_TN,tn_4096_112_14336,Gemm_Hipblaslt_TN_7160,0.0447133
GemmTunableOp_Half_TN,tn_4096_7937_14336,Gemm_Hipblaslt_TN_9749,1.60825
GemmTunableOp_Half_TN,tn_28672_930_4096,Gemm_Hipblaslt_TN_9683,0.387552
GemmTunableOp_Half_TN,tn_28672_1748_4096,Gemm_Hipblaslt_TN_9184,0.733186
GemmTunableOp_Half_TN,tn_4096_240_14336,Gemm_Hipblaslt_TN_9303,0.0728751
GemmTunableOp_Half_TN,tn_4096_2763_4096,Gemm_Hipblaslt_TN_9799,0.164935
GemmTunableOp_Half_TN,tn_28672_817_4096,Gemm_Hipblaslt_TN_9684,0.376545
GemmTunableOp_Half_TN,tn_28672_944_4096,Gemm_Hipblaslt_TN_9683,0.392481
GemmTunableOp_Half_TN,tn_6144_1905_4096,Gemm_Hipblaslt_TN_9691,0.166017
GemmTunableOp_Half_TN,tn_28672_1737_4096,Gemm_Hipblaslt_TN_9184,0.732682
GemmTunableOp_Half_TN,tn_12288_245_4096,Gemm_Rocblas_621286478,0.0579762
GemmTunableOp_Half_TN,tn_4096_809_14336,Gemm_Hipblaslt_TN_9158,0.211696
GemmTunableOp_Half_TN,tn_28672_844_4096,Gemm_Hipblaslt_TN_9684,0.379664
GemmTunableOp_Half_TN,tn_128256_76_4096,Gemm_Hipblaslt_TN_9057,0.376377
GemmTunableOp_Half_TN,tn_6144_2872_4096,Gemm_Hipblaslt_TN_9565,0.260534
GemmTunableOp_Half_TN,tn_4096_977_14336,Gemm_Hipblaslt_TN_9640,0.244467
GemmTunableOp_Half_TN,tn_4096_882_14336,Gemm_Hipblaslt_TN_9580,0.218495
GemmTunableOp_Half_TN,tn_6144_881_4096,Gemm_Hipblaslt_TN_9253,0.0914784
GemmStridedBatchedTunableOp_Half_TN,tn_822_822_128_B_32,Gemm_Rocblas_621294635,0.0400909
GemmStridedBatchedTunableOp_Half_TN,tn_899_899_128_B_32,Gemm_Hipblaslt_TN_6879,0.0489288
GemmStridedBatchedTunableOp_Half_TN,tn_871_871_128_B_32,Gemm_Hipblaslt_TN_7483,0.0442854
GemmStridedBatchedTunableOp_Half_TN,tn_937_937_128_B_32,Gemm_Hipblaslt_TN_7519,0.050691
GemmStridedBatchedTunableOp_Half_TN,tn_885_885_128_B_32,Gemm_Rocblas_621294635,0.0462287
GemmStridedBatchedTunableOp_Half_TN,tn_990_990_128_B_32,Gemm_Rocblas_621294550,0.0525892
GemmStridedBatchedTunableOp_Half_TN,tn_922_922_128_B_32,Gemm_Hipblaslt_TN_7519,0.0478156
GemmStridedBatchedTunableOp_Half_TN,tn_981_981_128_B_32,Gemm_Rocblas_621294550,0.0521225
GemmStridedBatchedTunableOp_Half_TN,tn_1165_1165_128_B_32,Gemm_Rocblas_621294725,0.0668976
GemmStridedBatchedTunableOp_Half_TN,tn_896_896_128_B_32,Gemm_Hipblaslt_TN_9598,0.0365518
GemmStridedBatchedTunableOp_Half_TN,tn_978_978_128_B_32,Gemm_Rocblas_621286809,0.0508197
GemmStridedBatchedTunableOp_Half_TN,tn_797_797_128_B_32,Gemm_Rocblas_621294635,0.0394689
GemmStridedBatchedTunableOp_Half_TN,tn_947_947_128_B_32,Gemm_Hipblaslt_TN_7519,0.0505149
GemmStridedBatchedTunableOp_Half_TN,tn_790_790_128_B_32,Gemm_Rocblas_621294635,0.0391126
GemmStridedBatchedTunableOp_Half_TN,tn_808_808_128_B_32,Gemm_Hipblaslt_TN_150,0.037668
GemmStridedBatchedTunableOp_Half_TN,tn_803_803_128_B_32,Gemm_Rocblas_621294635,0.03998
GemmStridedBatchedTunableOp_Half_TN,tn_785_785_128_B_32,Gemm_Rocblas_621294551,0.039384
GemmStridedBatchedTunableOp_Half_TN,tn_1207_1207_128_B_32,Gemm_Rocblas_621294725,0.0667705
GemmStridedBatchedTunableOp_Half_TN,tn_1191_1191_128_B_32,Gemm_Rocblas_621294725,0.0672788
GemmStridedBatchedTunableOp_Half_TN,tn_1469_1469_128_B_32,Gemm_Rocblas_621286397,0.0952156
GemmStridedBatchedTunableOp_Half_TN,tn_1021_1021_128_B_32,Gemm_Rocblas_621294536,0.0529556
GemmStridedBatchedTunableOp_Half_TN,tn_919_919_128_B_32,Gemm_Rocblas_621294635,0.0493052
GemmStridedBatchedTunableOp_Half_TN,tn_1048_1048_128_B_32,Gemm_Hipblaslt_TN_149,0.056004
GemmStridedBatchedTunableOp_Half_TN,tn_1489_1489_128_B_32,Gemm_Hipblaslt_TN_6942,0.096901
GemmStridedBatchedTunableOp_Half_TN,tn_913_913_128_B_32,Gemm_Hipblaslt_TN_7483,0.0502237
GemmStridedBatchedTunableOp_Half_TN,tn_805_805_128_B_32,Gemm_Rocblas_621294635,0.0398266
GemmStridedBatchedTunableOp_Half_TN,tn_969_969_128_B_32,Gemm_Rocblas_621294550,0.0526558
GemmStridedBatchedTunableOp_Half_TN,tn_1137_1137_128_B_32,Gemm_Hipblaslt_TN_7483,0.0640044
GemmStridedBatchedTunableOp_Half_TN,tn_1367_1367_128_B_32,Gemm_Rocblas_621286412,0.0853859
GemmStridedBatchedTunableOp_Half_TN,tn_923_923_128_B_32,Gemm_Hipblaslt_TN_6879,0.0498104
GemmStridedBatchedTunableOp_Half_TN,tn_1458_1458_128_B_32,Gemm_Rocblas_621294110,0.0926064
GemmStridedBatchedTunableOp_Half_TN,tn_1415_1415_128_B_32,Gemm_Rocblas_621286413,0.0908974
GemmStridedBatchedTunableOp_Half_TN,tn_916_916_128_B_32,Gemm_Rocblas_621294635,0.0489974
GemmStridedBatchedTunableOp_Half_TN,tn_1479_1479_128_B_32,Gemm_Rocblas_621294106,0.0971239
GemmStridedBatchedTunableOp_Half_TN,tn_888_888_128_B_32,Gemm_Hipblaslt_TN_150,0.0390417
GemmStridedBatchedTunableOp_Half_TN,tn_961_961_128_B_32,Gemm_Rocblas_621286809,0.0510659
GemmStridedBatchedTunableOp_Half_TN,tn_897_897_128_B_32,Gemm_Hipblaslt_TN_9351,0.0480894
GemmStridedBatchedTunableOp_Half_TN,tn_874_874_128_B_32,Gemm_Hipblaslt_TN_7483,0.0433848
GemmStridedBatchedTunableOp_Half_TN,tn_1377_1377_128_B_32,Gemm_Rocblas_621294725,0.0869679
GemmStridedBatchedTunableOp_Half_TN,tn_1345_1345_128_B_32,Gemm_Rocblas_621294109,0.0835429
GemmStridedBatchedTunableOp_Half_TN,tn_929_929_128_B_32,Gemm_Rocblas_621294635,0.0489757
GemmStridedBatchedTunableOp_Half_TN,tn_1219_1219_128_B_32,Gemm_Rocblas_621294725,0.0713163
GemmStridedBatchedTunableOp_Half_TN,tn_811_811_128_B_32,Gemm_Rocblas_621294635,0.0404726
GemmStridedBatchedTunableOp_Half_TN,tn_1222_1222_128_B_32,Gemm_Rocblas_621294725,0.0691948
GemmStridedBatchedTunableOp_Half_TN,tn_806_806_128_B_32,Gemm_Rocblas_621294635,0.0400619
GemmStridedBatchedTunableOp_Half_TN,tn_818_818_128_B_32,Gemm_Rocblas_621294635,0.0404773
GemmStridedBatchedTunableOp_Half_TN,tn_856_856_128_B_32,Gemm_Hipblaslt_TN_150,0.0387376
GemmStridedBatchedTunableOp_Half_TN,tn_886_886_128_B_32,Gemm_Hipblaslt_TN_7483,0.0442098
GemmStridedBatchedTunableOp_Half_TN,tn_870_870_128_B_32,Gemm_Hipblaslt_TN_7483,0.0435319
GemmStridedBatchedTunableOp_Half_TN,tn_852_852_128_B_32,Gemm_Hipblaslt_TN_7483,0.0419331
GemmStridedBatchedTunableOp_Half_TN,tn_810_810_128_B_32,Gemm_Rocblas_621294635,0.0396172
GemmStridedBatchedTunableOp_Half_TN,tn_833_833_128_B_32,Gemm_Rocblas_621294635,0.0434743
GemmStridedBatchedTunableOp_Half_TN,tn_825_825_128_B_32,Gemm_Rocblas_621294635,0.0405721
GemmStridedBatchedTunableOp_Half_TN,tn_866_866_128_B_32,Gemm_Hipblaslt_TN_7483,0.044835
GemmStridedBatchedTunableOp_Half_TN,tn_863_863_128_B_32,Gemm_Rocblas_621294635,0.0435877
GemmStridedBatchedTunableOp_Half_TN,tn_934_934_128_B_32,Gemm_Hipblaslt_TN_7519,0.0505366
GemmStridedBatchedTunableOp_Half_TN,tn_815_815_128_B_32,Gemm_Rocblas_621294635,0.0409134
GemmStridedBatchedTunableOp_Half_TN,tn_943_943_128_B_32,Gemm_Hipblaslt_TN_7519,0.0501662
GemmStridedBatchedTunableOp_Half_TN,tn_931_931_128_B_32,Gemm_Hipblaslt_TN_9508,0.0509099
GemmStridedBatchedTunableOp_Half_TN,tn_869_869_128_B_32,Gemm_Hipblaslt_TN_7483,0.0457441
GemmStridedBatchedTunableOp_Half_TN,tn_924_924_128_B_32,Gemm_Rocblas_621294635,0.0494854
GemmStridedBatchedTunableOp_Half_TN,tn_918_918_128_B_32,Gemm_Rocblas_621294635,0.0473698
GemmStridedBatchedTunableOp_Half_TN,tn_881_881_128_B_32,Gemm_Rocblas_621294635,0.0440179
GemmStridedBatchedTunableOp_Half_TN,tn_951_951_128_B_32,Gemm_Hipblaslt_TN_9351,0.050317
GemmStridedBatchedTunableOp_Half_TN,tn_973_973_128_B_32,Gemm_Rocblas_621294550,0.0523897
GemmStridedBatchedTunableOp_Half_TN,tn_830_830_128_B_32,Gemm_Rocblas_621294635,0.0410086
GemmStridedBatchedTunableOp_Half_TN,tn_860_860_128_B_32,Gemm_Hipblaslt_TN_7483,0.0430592
