Gemm_Tune/Qwen1.5-110B-Chat-2000inp/full_tuned2.csv
Validator,PT_VERSION,2.4.0
Validator,ROCM_VERSION,6.1.0.0-82-5fabb4c
Validator,HIPBLASLT_VERSION,0.7.0-1549b021
Validator,GCN_ARCH_NAME,gfx942:sramecc+:xnack-
Validator,ROCBLAS_VERSION,4.1.0-cefa4a9b-dirty
GemmTunableOp_Half_TN,tn_14336_1600_4096,Gemm_Rocblas_621294426,0.319751
GemmTunableOp_Half_TN,tn_4096_1717_7168,Gemm_Hipblaslt_TN_9265,0.184618
GemmTunableOp_Half_TN,tn_3072_1789_4096,Gemm_Rocblas_621286778,0.0906555
GemmTunableOp_Half_TN,tn_4096_1916_7168,Gemm_Hipblaslt_TN_9645,0.208419
GemmTunableOp_Half_TN,tn_4096_3688_2048,Gemm_Rocblas_621286281,0.111001
GemmTunableOp_Half_TN,tn_4096_6761_2048,Gemm_Hipblaslt_TN_9743,0.200224
GemmTunableOp_Half_TN,tn_3072_1794_4096,Gemm_Rocblas_621294520,0.0908009
GemmTunableOp_Half_TN,tn_14336_3920_4096,Gemm_Hipblaslt_TN_9192,0.753054
GemmTunableOp_Half_TN,tn_4096_1731_7168,Gemm_Hipblaslt_TN_9673,0.195857
GemmTunableOp_Half_TN,tn_4096_3710_7168,Gemm_Hipblaslt_TN_9217,0.35933
GemmTunableOp_Half_TN,tn_4096_3214_2048,Gemm_Hipblaslt_TN_9139,0.0990112
GemmTunableOp_Half_TN,tn_4096_3588_2048,Gemm_Hipblaslt_TN_9896,0.10306
GemmTunableOp_Half_TN,tn_4096_5052_2048,Gemm_Hipblaslt_TN_9690,0.163922
GemmTunableOp_Half_TN,tn_3072_1608_4096,Gemm_Rocblas_621286778,0.0865475
GemmTunableOp_Half_TN,tn_3072_1946_4096,Gemm_Hipblaslt_TN_9633,0.0976436
GemmTunableOp_Half_TN,tn_4096_1691_7168,Gemm_Hipblaslt_TN_9265,0.183889
GemmTunableOp_Half_TN,tn_4096_160_7168,Gemm_Rocblas_621294230,0.0371704
GemmTunableOp_Half_TN,tn_4096_3651_7168,Gemm_Hipblaslt_TN_9223,0.355298
GemmTunableOp_Half_TN,tn_14336_3300_4096,Gemm_Rocblas_621294484,0.627752
GemmTunableOp_Half_TN,tn_3072_1813_4096,Gemm_Rocblas_621286778,0.0913717
GemmTunableOp_Half_TN,tn_4096_1603_7168,Gemm_Hipblaslt_TN_9359,0.181274
GemmTunableOp_Half_TN,tn_14336_3592_4096,Gemm_Hipblaslt_TN_9697,0.72392
GemmTunableOp_Half_TN,tn_3072_3369_4096,Gemm_Rocblas_621294495,0.151121
GemmTunableOp_Half_TN,tn_3072_3511_4096,Gemm_Rocblas_621286753,0.155277
GemmTunableOp_Half_TN,tn_4096_1815_7168,Gemm_Hipblaslt_TN_9137,0.202053
GemmTunableOp_Half_TN,tn_3072_1977_4096,Gemm_Hipblaslt_TN_9587,0.100805
GemmTunableOp_Half_TN,tn_4096_1774_2048,Gemm_Hipblaslt_TN_9329,0.0618364
GemmTunableOp_Half_TN,tn_3072_1609_4096,Gemm_Rocblas_621294520,0.0859581
GemmTunableOp_Half_TN,tn_4096_1652_7168,Gemm_Hipblaslt_TN_9587,0.181677
GemmTunableOp_Half_TN,tn_3072_1652_4096,Gemm_Hipblaslt_TN_9561,0.0863447
GemmTunableOp_Half_TN,tn_14336_1622_4096,Gemm_Hipblaslt_TN_9139,0.352826
GemmTunableOp_Half_TN,tn_4096_7579_7168,Gemm_Hipblaslt_TN_9904,0.717813
GemmTunableOp_Half_TN,tn_4096_1928_2048,Gemm_Hipblaslt_TN_9590,0.0644411
GemmTunableOp_Half_TN,tn_14336_1815_4096,Gemm_Hipblaslt_TN_9697,0.367791
GemmTunableOp_Half_TN,tn_14336_7138_4096,Gemm_Hipblaslt_TN_9890,1.3164
GemmTunableOp_Half_TN,tn_4096_6841_7168,Gemm_Hipblaslt_TN_9694,0.65836
GemmTunableOp_Half_TN,tn_4096_1860_7168,Gemm_Hipblaslt_TN_9645,0.205401
GemmTunableOp_Half_TN,tn_14336_1652_4096,Gemm_Hipblaslt_TN_9697,0.350709
GemmTunableOp_Half_TN,tn_4096_3645_7168,Gemm_Hipblaslt_TN_9695,0.342909
GemmTunableOp_Half_TN,tn_4096_1887_2048,Gemm_Hipblaslt_TN_9590,0.063706
GemmTunableOp_Half_TN,tn_14336_7240_4096,Gemm_Hipblaslt_TN_9189,1.37912
GemmTunableOp_Half_TN,tn_14336_1601_4096,Gemm_Hipblaslt_TN_9697,0.347964
GemmTunableOp_Half_TN,tn_3072_3450_4096,Gemm_Hipblaslt_TN_9629,0.152973
GemmTunableOp_Half_TN,tn_14336_1586_4096,Gemm_Rocblas_621286684,0.324439
GemmTunableOp_Half_TN,tn_4096_3597_2048,Gemm_Hipblaslt_TN_9683,0.103294
GemmTunableOp_Half_TN,tn_14336_5357_4096,Gemm_Hipblaslt_TN_9220,1.02868
GemmTunableOp_Half_TN,tn_4096_6979_2048,Gemm_Hipblaslt_TN_9696,0.204712
GemmTunableOp_Half_TN,tn_4096_1647_2048,Gemm_Hipblaslt_TN_9164,0.0566714
GemmTunableOp_Half_TN,tn_14336_1710_4096,Gemm_Hipblaslt_TN_9697,0.354643
GemmTunableOp_Half_TN,tn_4096_1931_2048,Gemm_Hipblaslt_TN_9620,0.0654426
GemmTunableOp_Half_TN,tn_4096_3300_7168,Gemm_Hipblaslt_TN_9187,0.326489
GemmTunableOp_Half_TN,tn_4096_3722_2048,Gemm_Hipblaslt_TN_9827,0.111117
GemmTunableOp_Half_TN,tn_14336_7104_4096,Gemm_Hipblaslt_TN_159,1.30849
GemmTunableOp_Half_TN,tn_4096_1710_2048,Gemm_Hipblaslt_TN_9616,0.0586272
GemmTunableOp_Half_TN,tn_4096_1784_2048,Gemm_Hipblaslt_TN_9329,0.0619717
GemmTunableOp_Half_TN,tn_4096_7171_2048,Gemm_Hipblaslt_TN_9814,0.207418
GemmTunableOp_Half_TN,tn_4096_1866_2048,Gemm_Hipblaslt_TN_9590,0.0640457
GemmTunableOp_Half_TN,tn_4096_3592_7168,Gemm_Hipblaslt_TN_9743,0.342726
GemmTunableOp_Half_TN,tn_4096_6997_2048,Gemm_Hipblaslt_TN_9221,0.204947
GemmTunableOp_Half_TN,tn_4096_3574_2048,Gemm_Hipblaslt_TN_9896,0.10452
GemmTunableOp_Half_TN,tn_3072_1651_4096,Gemm_Hipblaslt_TN_9561,0.0884213
GemmTunableOp_Half_TN,tn_14336_5125_4096,Gemm_Hipblaslt_TN_9192,0.969834
GemmTunableOp_Half_TN,tn_4096_1798_7168,Gemm_Hipblaslt_TN_9680,0.202029
GemmTunableOp_Half_TN,tn_4096_1607_2048,Gemm_Hipblaslt_TN_9607,0.0557794
GemmTunableOp_Half_TN,tn_14336_5570_4096,Gemm_Hipblaslt_TN_9223,1.0587
GemmTunableOp_Half_TN,tn_4096_1633_2048,Gemm_Hipblaslt_TN_9607,0.0561432
GemmTunableOp_Half_TN,tn_4096_5495_7168,Gemm_Hipblaslt_TN_9672,0.555906
GemmTunableOp_Half_TN,tn_4096_1739_7168,Gemm_Hipblaslt_TN_9673,0.193757
GemmTunableOp_Half_TN,tn_4096_1660_7168,Gemm_Hipblaslt_TN_9265,0.183663
GemmTunableOp_Half_TN,tn_14336_1928_4096,Gemm_Hipblaslt_TN_9217,0.393573
GemmTunableOp_Half_TN,tn_4096_1888_7168,Gemm_Hipblaslt_TN_9645,0.206231
GemmTunableOp_Half_TN,tn_4096_1637_7168,Gemm_Hipblaslt_TN_9610,0.181117
GemmTunableOp_Half_TN,tn_4096_1898_2048,Gemm_Hipblaslt_TN_9590,0.0643582
GemmTunableOp_Half_TN,tn_3072_3383_4096,Gemm_Hipblaslt_TN_9619,0.152766
GemmTunableOp_Half_TN,tn_4096_6761_7168,Gemm_Rocblas_621294476,0.651571
GemmTunableOp_Half_TN,tn_14336_3478_4096,Gemm_Hipblaslt_TN_9217,0.645833
GemmTunableOp_Half_TN,tn_14336_1647_4096,Gemm_Hipblaslt_TN_9139,0.350562
GemmTunableOp_Half_TN,tn_3072_88_4096,Gemm_Rocblas_621294027,0.0139036
GemmTunableOp_Half_TN,tn_3072_7196_4096,Gemm_Hipblaslt_TN_9681,0.311358
GemmTunableOp_Half_TN,tn_4096_7552_7168,Gemm_Hipblaslt_TN_9853,0.716021
GemmTunableOp_Half_TN,tn_4096_6902_7168,Gemm_Hipblaslt_TN_9955,0.66535
GemmTunableOp_Half_TN,tn_14336_1933_4096,Gemm_Hipblaslt_TN_9223,0.394118
GemmTunableOp_Half_TN,tn_4096_224_2048,Gemm_Rocblas_621286443,0.014323
GemmTunableOp_Half_TN,tn_4096_6952_2048,Gemm_Hipblaslt_TN_9814,0.201901
GemmTunableOp_Half_TN,tn_14336_6773_4096,Gemm_Hipblaslt_TN_9220,1.29341
GemmTunableOp_Half_TN,tn_3072_7253_4096,Gemm_Hipblaslt_TN_9681,0.307089
GemmTunableOp_Half_TN,tn_4096_7386_7168,Gemm_Hipblaslt_TN_9749,0.707281
GemmTunableOp_Half_TN,tn_14336_5442_4096,Gemm_Rocblas_621294492,1.05771
GemmTunableOp_Half_TN,tn_3072_1592_4096,Gemm_Hipblaslt_TN_9561,0.0847457
GemmTunableOp_Half_TN,tn_3072_6976_4096,Gemm_Hipblaslt_TN_9619,0.303307
GemmTunableOp_Half_TN,tn_14336_6989_4096,Gemm_Hipblaslt_TN_159,1.2914
GemmTunableOp_Half_TN,tn_4096_1884_2048,Gemm_Hipblaslt_TN_9590,0.0651374
GemmTunableOp_Half_TN,tn_4096_8192_7168,Gemm_Rocblas_621294420,0.74721
GemmTunableOp_Half_TN,tn_4096_1698_7168,Gemm_Hipblaslt_TN_9265,0.184234
GemmTunableOp_Half_TN,tn_4096_3438_2048,Gemm_Hipblaslt_TN_9896,0.0998092
GemmTunableOp_Half_TN,tn_14336_5267_4096,Gemm_Hipblaslt_TN_159,1.01355
GemmTunableOp_Half_TN,tn_14336_6901_4096,Gemm_Hipblaslt_TN_9217,1.31236
GemmTunableOp_Half_TN,tn_4096_7190_7168,Gemm_Hipblaslt_TN_9694,0.679464
GemmTunableOp_Half_TN,tn_4096_5277_2048,Gemm_Hipblaslt_TN_9690,0.167808
GemmTunableOp_Half_TN,tn_3072_5541_4096,Gemm_Hipblaslt_TN_9725,0.223179
GemmTunableOp_Half_TN,tn_3072_7120_4096,Gemm_Hipblaslt_TN_9681,0.308969
GemmTunableOp_Half_TN,tn_3072_7475_4096,Gemm_Rocblas_621294473,0.329876
GemmTunableOp_Half_TN,tn_4096_1615_2048,Gemm_Hipblaslt_TN_9164,0.0562957
GemmTunableOp_Half_TN,tn_14336_7262_4096,Gemm_Hipblaslt_TN_9684,1.38564
GemmTunableOp_Half_TN,tn_4096_7033_7168,Gemm_Hipblaslt_TN_9694,0.665105
GemmTunableOp_Half_TN,tn_14336_3401_4096,Gemm_Hipblaslt_TN_9217,0.640628
GemmTunableOp_Half_TN,tn_3072_1810_4096,Gemm_Rocblas_621294520,0.0910026
GemmTunableOp_Half_TN,tn_4096_1981_7168,Gemm_Hipblaslt_TN_9267,0.209649
GemmTunableOp_Half_TN,tn_4096_8_2048,Gemm_Rocblas_621286307,0.0060194
GemmTunableOp_Half_TN,tn_3072_3748_4096,Gemm_Hipblaslt_TN_9852,0.16375
GemmTunableOp_Half_TN,tn_4096_6708_7168,Gemm_Hipblaslt_TN_9692,0.653714
GemmTunableOp_Half_TN,tn_14336_112_4096,Gemm_Rocblas_621286494,0.0400933
GemmTunableOp_Half_TN,tn_4096_1810_7168,Gemm_Hipblaslt_TN_9268,0.202869
GemmTunableOp_Half_TN,tn_64128_84_4096,Gemm_Hipblaslt_TN_9057,0.183104
GemmTunableOp_Half_TN,tn_4096_1822_2048,Gemm_Hipblaslt_TN_9134,0.0629681
GemmTunableOp_Half_TN,tn_4096_5570_2048,Gemm_Hipblaslt_TN_9799,0.17096
GemmTunableOp_Half_TN,tn_64128_256_4096,Gemm_Rocblas_621286905,0.283421
GemmTunableOp_Half_TN,tn_4096_1934_2048,Gemm_Hipblaslt_TN_9329,0.0657062
GemmTunableOp_Half_TN,tn_4096_1813_2048,Gemm_Hipblaslt_TN_9645,0.0619511
GemmTunableOp_Half_TN,tn_3072_1853_4096,Gemm_Hipblaslt_TN_9148,0.0928543
GemmTunableOp_Half_TN,tn_3072_6761_4096,Gemm_Hipblaslt_TN_9681,0.29683
GemmTunableOp_Half_TN,tn_3072_1599_4096,Gemm_Hipblaslt_TN_9561,0.0855755
GemmTunableOp_Half_TN,tn_64128_93_4096,Gemm_Hipblaslt_TN_9057,0.184342
GemmTunableOp_Half_TN,tn_4096_1931_7168,Gemm_Hipblaslt_TN_9645,0.210074
GemmTunableOp_Half_TN,tn_3072_1780_4096,Gemm_Rocblas_621286778,0.0910961
GemmTunableOp_Half_TN,tn_4096_192_2048,Gemm_Rocblas_621294175,0.0128336
GemmTunableOp_Half_TN,tn_14336_1825_4096,Gemm_Hipblaslt_TN_9187,0.366996
GemmTunableOp_Half_TN,tn_4096_3514_7168,Gemm_Hipblaslt_TN_9189,0.338619
GemmTunableOp_Half_TN,tn_3072_7109_4096,Gemm_Hipblaslt_TN_9681,0.307329
GemmTunableOp_Half_TN,tn_14336_224_4096,Gemm_Hipblaslt_TN_9634,0.0657005
GemmTunableOp_Half_TN,tn_14336_3564_4096,Gemm_Hipblaslt_TN_9220,0.657587
GemmTunableOp_Half_TN,tn_14336_248_4096,Gemm_Hipblaslt_TN_9634,0.0679023
GemmTunableOp_Half_TN,tn_64128_234_4096,Gemm_Rocblas_621286915,0.286209
GemmTunableOp_Half_TN,tn_4096_136_7168,Gemm_Hipblaslt_TN_9127,0.0345446
GemmTunableOp_Half_TN,tn_4096_8192_2048,Gemm_Hipblaslt_TN_9753,0.232977
GemmTunableOp_Half_TN,tn_64128_16_4096,Gemm_Rocblas_621286348,0.145288
GemmTunableOp_Half_TN,tn_4096_7248_2048,Gemm_Hipblaslt_TN_9743,0.208751
GemmTunableOp_Half_TN,tn_3072_200_4096,Gemm_Rocblas_621294168,0.0221091
GemmTunableOp_Half_TN,tn_14336_1683_4096,Gemm_Hipblaslt_TN_9697,0.352925
GemmTunableOp_Half_TN,tn_3072_7345_4096,Gemm_Hipblaslt_TN_9622,0.325367
GemmTunableOp_Half_TN,tn_14336_5530_4096,Gemm_Hipblaslt_TN_9217,1.06171
GemmTunableOp_Half_TN,tn_64128_219_4096,Gemm_Hipblaslt_TN_9226,0.271368
GemmTunableOp_Half_TN,tn_3072_6870_4096,Gemm_Hipblaslt_TN_9619,0.297317
GemmTunableOp_Half_TN,tn_4096_1711_7168,Gemm_Hipblaslt_TN_9265,0.1844
GemmTunableOp_Half_TN,tn_4096_7139_7168,Gemm_Hipblaslt_TN_9743,0.669259
GemmTunableOp_Half_TN,tn_14336_1625_4096,Gemm_Hipblaslt_TN_9189,0.350932
GemmTunableOp_Half_TN,tn_14336_1801_4096,Gemm_Hipblaslt_TN_9697,0.366711
GemmTunableOp_Half_TN,tn_14336_7327_4096,Gemm_Hipblaslt_TN_9900,1.41723
GemmTunableOp_Half_TN,tn_14336_1708_4096,Gemm_Hipblaslt_TN_9697,0.354692
GemmTunableOp_Half_TN,tn_4096_5605_7168,Gemm_Hipblaslt_TN_9689,0.558271
GemmTunableOp_Half_TN,tn_4096_1762_2048,Gemm_Hipblaslt_TN_9329,0.062473
GemmTunableOp_Half_TN,tn_64128_31_4096,Gemm_Rocblas_621286348,0.149611
GemmTunableOp_Half_TN,tn_3072_1600_4096,Gemm_Hipblaslt_TN_9561,0.0844797
GemmTunableOp_Half_TN,tn_64128_231_4096,Gemm_Rocblas_621286901,0.289729
GemmTunableOp_Half_TN,tn_4096_5319_7168,Gemm_Rocblas_621286580,0.543116
GemmTunableOp_Half_TN,tn_4096_1884_7168,Gemm_Hipblaslt_TN_9645,0.206714
GemmTunableOp_Half_TN,tn_14336_1702_4096,Gemm_Hipblaslt_TN_9677,0.353592
GemmTunableOp_Half_TN,tn_14336_6868_4096,Gemm_Rocblas_621294492,1.30258
GemmTunableOp_Half_TN,tn_14336_5413_4096,Gemm_Rocblas_621294492,1.0372
GemmTunableOp_Half_TN,tn_14336_5285_4096,Gemm_Hipblaslt_TN_159,1.01704
GemmTunableOp_Half_TN,tn_14336_1766_4096,Gemm_Hipblaslt_TN_9793,0.35852
GemmTunableOp_Half_TN,tn_3072_3382_4096,Gemm_Hipblaslt_TN_9629,0.151106
GemmTunableOp_Half_TN,tn_3072_3855_4096,Gemm_Hipblaslt_TN_9622,0.168912
GemmTunableOp_Half_TN,tn_3072_1875_4096,Gemm_Hipblaslt_TN_9613,0.0935106
GemmTunableOp_Half_TN,tn_14336_1742_4096,Gemm_Hipblaslt_TN_9697,0.362316
GemmTunableOp_Half_TN,tn_4096_7568_7168,Gemm_Rocblas_621294127,0.716089
GemmTunableOp_Half_TN,tn_3072_3691_4096,Gemm_Hipblaslt_TN_9852,0.164115
GemmTunableOp_Half_TN,tn_64128_230_4096,Gemm_Rocblas_621294658,0.288231
GemmTunableOp_Half_TN,tn_3072_1862_4096,Gemm_Hipblaslt_TN_9613,0.0930219
GemmTunableOp_Half_TN,tn_14336_3382_4096,Gemm_Rocblas_621286742,0.643994
GemmTunableOp_Half_TN,tn_4096_1813_7168,Gemm_Hipblaslt_TN_9680,0.20289
GemmTunableOp_Half_TN,tn_64128_207_4096,Gemm_Hipblaslt_TN_9260,0.271694
GemmTunableOp_Half_TN,tn_4096_1805_7168,Gemm_Hipblaslt_TN_9645,0.201498
GemmTunableOp_Half_TN,tn_3072_1774_4096,Gemm_Rocblas_621286778,0.0912991
GemmTunableOp_Half_TN,tn_3072_3630_4096,Gemm_Hipblaslt_TN_9570,0.158755
GemmTunableOp_Half_TN,tn_3072_1733_4096,Gemm_Hipblaslt_TN_9163,0.0898647
GemmTunableOp_Half_TN,tn_4096_6860_7168,Gemm_Hipblaslt_TN_9694,0.657892
GemmTunableOp_Half_TN,tn_4096_3578_7168,Gemm_Hipblaslt_TN_9732,0.338965
GemmTunableOp_Half_TN,tn_3072_3581_4096,Gemm_Hipblaslt_TN_9570,0.157332
GemmTunableOp_Half_TN,tn_3072_1627_4096,Gemm_Rocblas_621294520,0.0866462
GemmTunableOp_Half_TN,tn_4096_1682_2048,Gemm_Hipblaslt_TN_9164,0.0566987
GemmTunableOp_Half_TN,tn_3072_7327_4096,Gemm_Hipblaslt_TN_9787,0.326038
GemmTunableOp_Half_TN,tn_4096_1748_2048,Gemm_Hipblaslt_TN_9136,0.0616542
GemmTunableOp_Half_TN,tn_4096_144_2048,Gemm_Rocblas_621294175,0.0126124
GemmTunableOp_Half_TN,tn_64128_250_4096,Gemm_Rocblas_621294648,0.295147
GemmTunableOp_Half_TN,tn_4096_1933_7168,Gemm_Hipblaslt_TN_9645,0.210601
GemmTunableOp_Half_TN,tn_3072_1847_4096,Gemm_Hipblaslt_TN_9613,0.0927486
GemmTunableOp_Half_TN,tn_4096_1764_7168,Gemm_Hipblaslt_TN_9645,0.200627
GemmTunableOp_Half_TN,tn_4096_248_2048,Gemm_Rocblas_621286447,0.0147257
GemmTunableOp_Half_TN,tn_64128_237_4096,Gemm_Hipblaslt_TN_9122,0.29276
GemmTunableOp_Half_TN,tn_14336_5735_4096,Gemm_Hipblaslt_TN_159,1.08515
GemmTunableOp_Half_TN,tn_3072_1966_4096,Gemm_Hipblaslt_TN_9633,0.0999287
GemmTunableOp_Half_TN,tn_4096_1757_7168,Gemm_Hipblaslt_TN_9673,0.194941
GemmTunableOp_Half_TN,tn_14336_1824_4096,Gemm_Hipblaslt_TN_9697,0.36694
GemmTunableOp_Half_TN,tn_4096_7253_7168,Gemm_Hipblaslt_TN_9743,0.6801
GemmTunableOp_Half_TN,tn_4096_1745_2048,Gemm_Hipblaslt_TN_9680,0.0620389
GemmTunableOp_Half_TN,tn_4096_1727_7168,Gemm_Hipblaslt_TN_9587,0.18411
GemmTunableOp_Half_TN,tn_14336_88_4096,Gemm_Hipblaslt_TN_9129,0.036332
GemmTunableOp_Half_TN,tn_4096_3501_2048,Gemm_Hipblaslt_TN_9896,0.103363
GemmTunableOp_Half_TN,tn_4096_5427_2048,Gemm_Hipblaslt_TN_9799,0.169354
GemmTunableOp_Half_TN,tn_64128_133_4096,Gemm_Hipblaslt_TN_9108,0.217428
GemmTunableOp_Half_TN,tn_64128_107_4096,Gemm_Hipblaslt_TN_9264,0.198766
GemmTunableOp_Half_TN,tn_4096_3511_2048,Gemm_Hipblaslt_TN_9896,0.103444
GemmTunableOp_Half_TN,tn_64128_215_4096,Gemm_Hipblaslt_TN_9220,0.271512
GemmTunableOp_Half_TN,tn_3072_1830_4096,Gemm_Hipblaslt_TN_9613,0.0928644
GemmTunableOp_Half_TN,tn_64128_27_4096,Gemm_Rocblas_621286348,0.148485
GemmTunableOp_Half_TN,tn_4096_1853_2048,Gemm_Hipblaslt_TN_9590,0.0643979
GemmTunableOp_Half_TN,tn_4096_7130_7168,Gemm_Hipblaslt_TN_9743,0.677381
GemmTunableOp_Half_TN,tn_4096_1766_7168,Gemm_Hipblaslt_TN_9329,0.198727
GemmTunableOp_Half_TN,tn_3072_7730_4096,Gemm_Hipblaslt_TN_9779,0.335337
GemmTunableOp_Half_TN,tn_4096_136_2048,Gemm_Rocblas_621294171,0.0124887
GemmTunableOp_Half_TN,tn_3072_3612_4096,Gemm_Hipblaslt_TN_9619,0.156891
GemmTunableOp_Half_TN,tn_3072_6952_4096,Gemm_Hipblaslt_TN_9619,0.302472
GemmTunableOp_Half_TN,tn_4096_3706_2048,Gemm_Hipblaslt_TN_9898,0.111751
GemmTunableOp_Half_TN,tn_3072_5273_4096,Gemm_Hipblaslt_TN_9904,0.21385
GemmTunableOp_Half_TN,tn_4096_5274_7168,Gemm_Hipblaslt_TN_9799,0.540446
GemmTunableOp_Half_TN,tn_4096_1721_7168,Gemm_Hipblaslt_TN_9266,0.185197
GemmTunableOp_Half_TN,tn_4096_1978_2048,Gemm_Hipblaslt_TN_9645,0.0669177
GemmTunableOp_Half_TN,tn_3072_3420_4096,Gemm_Hipblaslt_TN_9774,0.151005
GemmTunableOp_Half_TN,tn_14336_5052_4096,Gemm_Hipblaslt_TN_9139,0.968696
GemmTunableOp_Half_TN,tn_64128_130_4096,Gemm_Hipblaslt_TN_9108,0.217177
GemmTunableOp_Half_TN,tn_4096_1864_2048,Gemm_Hipblaslt_TN_9136,0.0629127
GemmTunableOp_Half_TN,tn_14336_1590_4096,Gemm_Hipblaslt_TN_9691,0.324892
GemmTunableOp_Half_TN,tn_3072_144_4096,Gemm_Hipblaslt_TN_9443,0.0173235
GemmTunableOp_Half_TN,tn_3072_1909_4096,Gemm_Hipblaslt_TN_9613,0.0944445
GemmTunableOp_Half_TN,tn_4096_1778_2048,Gemm_Hipblaslt_TN_9136,0.0624534
GemmTunableOp_Half_TN,tn_4096_3830_7168,Gemm_Hipblaslt_TN_9220,0.367195
GemmTunableOp_Half_TN,tn_3072_1882_4096,Gemm_Hipblaslt_TN_9611,0.094728
GemmTunableOp_Half_TN,tn_4096_5512_2048,Gemm_Hipblaslt_TN_9709,0.17084
GemmTunableOp_Half_TN,tn_3072_1916_4096,Gemm_Hipblaslt_TN_9561,0.0924296
GemmTunableOp_Half_TN,tn_64128_240_4096,Gemm_Rocblas_621286905,0.294768
GemmTunableOp_Half_TN,tn_3072_3912_4096,Gemm_Rocblas_621286684,0.169923
GemmTunableOp_Half_TN,tn_4096_7730_7168,Gemm_Hipblaslt_TN_9753,0.723961
GemmTunableOp_Half_TN,tn_4096_3557_2048,Gemm_Hipblaslt_TN_9896,0.101198
GemmTunableOp_Half_TN,tn_4096_7067_7168,Gemm_Hipblaslt_TN_9796,0.670283
GemmTunableOp_Half_TN,tn_4096_3780_2048,Gemm_Hipblaslt_TN_9827,0.113239
GemmTunableOp_Half_TN,tn_4096_6976_7168,Gemm_Hipblaslt_TN_9743,0.66817
GemmTunableOp_Half_TN,tn_4096_1963_2048,Gemm_Hipblaslt_TN_9590,0.0660958
GemmTunableOp_Half_TN,tn_14336_6979_4096,Gemm_Hipblaslt_TN_159,1.28684
GemmTunableOp_Half_TN,tn_14336_5390_4096,Gemm_Hipblaslt_TN_9217,1.04694
GemmTunableOp_Half_TN,tn_3072_7138_4096,Gemm_Hipblaslt_TN_9619,0.307685
GemmTunableOp_Half_TN,tn_64128_87_4096,Gemm_Hipblaslt_TN_9058,0.184762
GemmTunableOp_Half_TN,tn_4096_1967_2048,Gemm_Hipblaslt_TN_9329,0.0659473
GemmTunableOp_Half_TN,tn_64128_53_4096,Gemm_Rocblas_621294562,0.164796
GemmTunableOp_Half_TN,tn_3072_1807_4096,Gemm_Rocblas_621294520,0.0918047
GemmTunableOp_Half_TN,tn_3072_5354_4096,Gemm_Hipblaslt_TN_9904,0.214213
GemmTunableOp_Half_TN,tn_64128_216_4096,Gemm_Rocblas_621286797,0.277483
GemmTunableOp_Half_TN,tn_3072_1963_4096,Gemm_Hipblaslt_TN_9633,0.099179
GemmTunableOp_Half_TN,tn_4096_3466_7168,Gemm_Hipblaslt_TN_9187,0.33456
GemmTunableOp_Half_TN,tn_3072_1597_4096,Gemm_Hipblaslt_TN_9561,0.0843261
GemmTunableOp_Half_TN,tn_3072_3688_4096,Gemm_Hipblaslt_TN_9852,0.163328
GemmTunableOp_Half_TN,tn_3072_1969_4096,Gemm_Hipblaslt_TN_9265,0.100465
GemmTunableOp_Half_TN,tn_4096_3309_2048,Gemm_Hipblaslt_TN_9684,0.10105
GemmTunableOp_Half_TN,tn_3072_1855_4096,Gemm_Hipblaslt_TN_9613,0.093374
GemmTunableOp_Half_TN,tn_4096_5271_2048,Gemm_Hipblaslt_TN_9709,0.168053
GemmTunableOp_Half_TN,tn_14336_3475_4096,Gemm_Hipblaslt_TN_9220,0.648371
GemmTunableOp_Half_TN,tn_64128_13_4096,Gemm_Rocblas_621294578,0.144442
GemmTunableOp_Half_TN,tn_4096_6843_7168,Gemm_Hipblaslt_TN_9743,0.663646
GemmTunableOp_Half_TN,tn_14336_1588_4096,Gemm_Hipblaslt_TN_9672,0.324999
GemmTunableOp_Half_TN,tn_4096_1749_7168,Gemm_Hipblaslt_TN_9673,0.194022
GemmTunableOp_Half_TN,tn_4096_1954_7168,Gemm_Hipblaslt_TN_9680,0.209873
GemmTunableOp_Half_TN,tn_3072_1655_4096,Gemm_Hipblaslt_TN_9148,0.0873874
GemmTunableOp_Half_TN,tn_4096_1599_7168,Gemm_Hipblaslt_TN_9587,0.179655
GemmTunableOp_Half_TN,tn_3072_120_4096,Gemm_Rocblas_621286279,0.0153409
GemmTunableOp_Half_TN,tn_64128_144_4096,Gemm_Hipblaslt_TN_9108,0.218225
GemmTunableOp_Half_TN,tn_4096_5125_2048,Gemm_Hipblaslt_TN_9709,0.164769
GemmTunableOp_Half_TN,tn_14336_5089_4096,Gemm_Hipblaslt_TN_9187,0.966381
GemmTunableOp_Half_TN,tn_3072_1625_4096,Gemm_Hipblaslt_TN_9561,0.086431
GemmTunableOp_Half_TN,tn_3072_1663_4096,Gemm_Hipblaslt_TN_9561,0.0876369
GemmTunableOp_Half_TN,tn_14336_3514_4096,Gemm_Hipblaslt_TN_9223,0.651233
GemmTunableOp_Half_TN,tn_4096_5322_2048,Gemm_Hipblaslt_TN_9709,0.167433
GemmTunableOp_Half_TN,tn_3072_1881_4096,Gemm_Hipblaslt_TN_9163,0.093992
GemmTunableOp_Half_TN,tn_4096_3427_2048,Gemm_Hipblaslt_TN_9896,0.10042
GemmTunableOp_Half_TN,tn_3072_1623_4096,Gemm_Rocblas_621294520,0.0860558
GemmTunableOp_Half_TN,tn_4096_3583_7168,Gemm_Hipblaslt_TN_9187,0.339949
GemmTunableOp_Half_TN,tn_14336_3622_4096,Gemm_Hipblaslt_TN_9187,0.726369
GemmTunableOp_Half_TN,tn_64128_80_4096,Gemm_Hipblaslt_TN_9057,0.178277
GemmTunableOp_Half_TN,tn_14336_3582_4096,Gemm_Hipblaslt_TN_9220,0.655511
GemmTunableOp_Half_TN,tn_4096_1727_2048,Gemm_Hipblaslt_TN_9180,0.0570281
GemmTunableOp_Half_TN,tn_64128_97_4096,Gemm_Hipblaslt_TN_9061,0.194512
GemmTunableOp_Half_TN,tn_3072_5390_4096,Gemm_Hipblaslt_TN_9726,0.22059
GemmTunableOp_Half_TN,tn_14336_5100_4096,Gemm_Hipblaslt_TN_9697,0.970541
GemmTunableOp_Half_TN,tn_14336_1931_4096,Gemm_Hipblaslt_TN_9217,0.392756
GemmTunableOp_Half_TN,tn_4096_1820_2048,Gemm_Hipblaslt_TN_9645,0.0623756
GemmTunableOp_Half_TN,tn_4096_3456_7168,Gemm_Rocblas_621286743,0.330766
GemmTunableOp_Half_TN,tn_3072_7023_4096,Gemm_Hipblaslt_TN_9681,0.304503
GemmTunableOp_Half_TN,tn_4096_7262_7168,Gemm_Hipblaslt_TN_9743,0.683801
GemmTunableOp_Half_TN,tn_3072_8192_4096,Gemm_Rocblas_621294467,0.347262
GemmTunableOp_Half_TN,tn_64128_42_4096,Gemm_Rocblas_621294562,0.163447
GemmTunableOp_Half_TN,tn_64128_56_4096,Gemm_Hipblaslt_TN_9097,0.167757
GemmTunableOp_Half_TN,tn_4096_5219_7168,Gemm_Rocblas_621286574,0.538344
GemmTunableOp_Half_TN,tn_4096_3400_2048,Gemm_Hipblaslt_TN_9896,0.102197
GemmTunableOp_Half_TN,tn_3072_3920_4096,Gemm_Hipblaslt_TN_9799,0.169998
GemmTunableOp_Half_TN,tn_14336_1648_4096,Gemm_Hipblaslt_TN_9677,0.347533
GemmTunableOp_Half_TN,tn_4096_6871_7168,Gemm_Hipblaslt_TN_9694,0.657773
GemmTunableOp_Half_TN,tn_4096_4096_5504,Gemm_Rocblas_621286281,0.301911
GemmTunableOp_Half_TN,tn_3072_1636_4096,Gemm_Hipblaslt_TN_9561,0.0863859
GemmTunableOp_Half_TN,tn_3072_3410_4096,Gemm_Hipblaslt_TN_9681,0.150782
GemmTunableOp_Half_TN,tn_4096_7077_2048,Gemm_Hipblaslt_TN_9694,0.205831
GemmTunableOp_Half_TN,tn_4096_3791_7168,Gemm_Hipblaslt_TN_9827,0.36226
GemmTunableOp_Half_TN,tn_4096_5196_2048,Gemm_Hipblaslt_TN_9672,0.165511
GemmTunableOp_Half_TN,tn_14336_6860_4096,Gemm_Hipblaslt_TN_9749,1.31075
GemmTunableOp_Half_TN,tn_4096_6630_7168,Gemm_Hipblaslt_TN_9743,0.65135
GemmTunableOp_Half_TN,tn_3072_3588_4096,Gemm_Hipblaslt_TN_9619,0.157202
GemmTunableOp_Half_TN,tn_4096_1852_2048,Gemm_Hipblaslt_TN_9590,0.0633132
GemmTunableOp_Half_TN,tn_3072_1896_4096,Gemm_Hipblaslt_TN_9611,0.0946607
GemmTunableOp_Half_TN,tn_14336_1945_4096,Gemm_Hipblaslt_TN_9223,0.395108
GemmTunableOp_Half_TN,tn_4096_1647_7168,Gemm_Hipblaslt_TN_9587,0.181752
GemmTunableOp_Half_TN,tn_4096_5442_2048,Gemm_Hipblaslt_TN_9690,0.170087
GemmTunableOp_Half_TN,tn_14336_1767_4096,Gemm_Hipblaslt_TN_9697,0.364814
GemmTunableOp_Half_TN,tn_3072_112_4096,Gemm_Rocblas_621294166,0.0148738
GemmTunableOp_Half_TN,tn_14336_1896_4096,Gemm_Hipblaslt_TN_9697,0.370532
GemmTunableOp_Half_TN,tn_14336_1620_4096,Gemm_Hipblaslt_TN_9187,0.351545
GemmTunableOp_Half_TN,tn_4096_1699_7168,Gemm_Hipblaslt_TN_9265,0.183886
GemmTunableOp_Half_TN,tn_3072_3592_4096,Gemm_Hipblaslt_TN_9570,0.15633
GemmTunableOp_Half_TN,tn_4096_5436_7168,Gemm_Hipblaslt_TN_9690,0.548766
GemmTunableOp_Half_TN,tn_64128_203_4096,Gemm_Hipblaslt_TN_9260,0.272815
GemmTunableOp_Half_TN,tn_64128_65_4096,Gemm_Hipblaslt_TN_9057,0.173111
GemmTunableOp_Half_TN,tn_3072_1852_4096,Gemm_Hipblaslt_TN_9613,0.0927939
GemmTunableOp_Half_TN,tn_4096_3666_7168,Gemm_Hipblaslt_TN_9217,0.356311
GemmTunableOp_Half_TN,tn_64128_86_4096,Gemm_Hipblaslt_TN_9057,0.181201
GemmTunableOp_Half_TN,tn_3072_5533_4096,Gemm_Hipblaslt_TN_9726,0.222189
GemmTunableOp_Half_TN,tn_64128_217_4096,Gemm_Hipblaslt_TN_9654,0.272433
GemmTunableOp_Half_TN,tn_64128_114_4096,Gemm_Rocblas_621286258,0.200831
GemmTunableOp_Half_TN,tn_3072_1898_4096,Gemm_Hipblaslt_TN_9148,0.0930812
GemmTunableOp_Half_TN,tn_64128_153_4096,Gemm_Hipblaslt_TN_9108,0.224758
GemmTunableOp_Half_TN,tn_4096_5067_7168,Gemm_Hipblaslt_TN_9681,0.525928
GemmTunableOp_Half_TN,tn_4096_1688_2048,Gemm_Hipblaslt_TN_9164,0.0577334
GemmTunableOp_Half_TN,tn_4096_1745_7168,Gemm_Hipblaslt_TN_9673,0.193903
GemmTunableOp_Half_TN,tn_3072_3455_4096,Gemm_Rocblas_621294495,0.151437
GemmTunableOp_Half_TN,tn_4096_5410_7168,Gemm_Hipblaslt_TN_9691,0.54959
GemmTunableOp_Half_TN,tn_4096_1916_2048,Gemm_Hipblaslt_TN_9590,0.0647885
GemmTunableOp_Half_TN,tn_14336_1733_4096,Gemm_Hipblaslt_TN_9793,0.359584
GemmTunableOp_Half_TN,tn_14336_1713_4096,Gemm_Hipblaslt_TN_9187,0.351944
GemmTunableOp_Half_TN,tn_4096_1877_7168,Gemm_Hipblaslt_TN_9645,0.207229
GemmTunableOp_Half_TN,tn_4096_144_7168,Gemm_Hipblaslt_TN_9298,0.0335225
GemmTunableOp_Half_TN,tn_14336_1822_4096,Gemm_Hipblaslt_TN_9677,0.36659
GemmTunableOp_Half_TN,tn_14336_7096_4096,Gemm_Hipblaslt_TN_159,1.30267
GemmTunableOp_Half_TN,tn_4096_1799_7168,Gemm_Hipblaslt_TN_9134,0.201157
GemmTunableOp_Half_TN,tn_4096_1801_2048,Gemm_Hipblaslt_TN_9137,0.0630899
GemmTunableOp_Half_TN,tn_4096_3219_2048,Gemm_Hipblaslt_TN_9684,0.0983034
GemmTunableOp_Half_TN,tn_4096_1742_7168,Gemm_Hipblaslt_TN_9673,0.194775
GemmTunableOp_Half_TN,tn_14336_6965_4096,Gemm_Hipblaslt_TN_9914,1.30404
GemmTunableOp_Half_TN,tn_64128_197_4096,Gemm_Hipblaslt_TN_9260,0.272933
GemmTunableOp_Half_TN,tn_64128_105_4096,Gemm_Rocblas_621286258,0.198524
GemmTunableOp_Half_TN,tn_3072_1772_4096,Gemm_Hipblaslt_TN_9613,0.0926277
GemmTunableOp_Half_TN,tn_4096_6901_7168,Gemm_Hipblaslt_TN_9694,0.659495
GemmTunableOp_Half_TN,tn_4096_5381_7168,Gemm_Hipblaslt_TN_9690,0.543026
GemmTunableOp_Half_TN,tn_3072_3401_4096,Gemm_Rocblas_621286753,0.150917
GemmTunableOp_Half_TN,tn_4096_5196_7168,Gemm_Hipblaslt_TN_9799,0.535297
GemmTunableOp_Half_TN,tn_14336_8192_4096,Gemm_Hipblaslt_TN_9753,1.53998
GemmTunableOp_Half_TN,tn_14336_7575_4096,Gemm_Rocblas_621294435,1.45605
GemmTunableOp_Half_TN,tn_4096_1665_2048,Gemm_Hipblaslt_TN_9607,0.0576988
GemmTunableOp_Half_TN,tn_4096_3748_7168,Gemm_Hipblaslt_TN_9768,0.36096
GemmTunableOp_Half_TN,tn_6144_4000_4096,Gemm_Rocblas_621294315,0.339748
GemmTunableOp_Half_TN,tn_14336_1966_4096,Gemm_Hipblaslt_TN_9217,0.395637
GemmTunableOp_Half_TN,tn_14336_1829_4096,Gemm_Hipblaslt_TN_9192,0.367548
GemmTunableOp_Half_TN,tn_14336_3773_4096,Gemm_Hipblaslt_TN_9187,0.73801
GemmTunableOp_Half_TN,tn_64128_188_4096,Gemm_Hipblaslt_TN_9956,0.257196
GemmTunableOp_Half_TN,tn_14336_1719_4096,Gemm_Hipblaslt_TN_9697,0.35431
GemmTunableOp_Half_TN,tn_4096_1823_2048,Gemm_Hipblaslt_TN_9590,0.0622546
GemmTunableOp_Half_TN,tn_14336_3600_4096,Gemm_Hipblaslt_TN_9697,0.725092
GemmTunableOp_Half_TN,tn_4096_5530_2048,Gemm_Hipblaslt_TN_9799,0.173033
GemmTunableOp_Half_TN,tn_14336_1957_4096,Gemm_Hipblaslt_TN_9223,0.396607
GemmTunableOp_Half_TN,tn_4096_1888_2048,Gemm_Hipblaslt_TN_9590,0.0655027
GemmTunableOp_Half_TN,tn_14336_1842_4096,Gemm_Hipblaslt_TN_9697,0.368013
GemmTunableOp_Half_TN,tn_4096_5583_7168,Gemm_Hipblaslt_TN_9687,0.55631
GemmTunableOp_Half_TN,tn_4096_5352_2048,Gemm_Hipblaslt_TN_9691,0.169567
GemmTunableOp_Half_TN,tn_4096_1610_7168,Gemm_Hipblaslt_TN_9359,0.181206
GemmTunableOp_Half_TN,tn_3072_3514_4096,Gemm_Rocblas_621286753,0.156471
GemmTunableOp_Half_TN,tn_64128_209_4096,Gemm_Hipblaslt_TN_9654,0.270959
GemmTunableOp_Half_TN,tn_14336_1762_4096,Gemm_Hipblaslt_TN_9192,0.364229
GemmTunableOp_Half_TN,tn_4096_1879_2048,Gemm_Hipblaslt_TN_9590,0.0642
GemmTunableOp_Half_TN,tn_4096_1593_2048,Gemm_Hipblaslt_TN_9587,0.0539779
GemmTunableOp_Half_TN,tn_4096_3855_7168,Gemm_Hipblaslt_TN_9217,0.366198
GemmTunableOp_Half_TN,tn_3072_3640_4096,Gemm_Hipblaslt_TN_9619,0.157846
GemmTunableOp_Half_TN,tn_14336_3682_4096,Gemm_Hipblaslt_TN_9192,0.731331
GemmTunableOp_Half_TN,tn_4096_1882_7168,Gemm_Hipblaslt_TN_9645,0.206582
GemmTunableOp_Half_TN,tn_4096_1717_2048,Gemm_Hipblaslt_TN_9164,0.0584431
GemmTunableOp_Half_TN,tn_4096_1961_2048,Gemm_Hipblaslt_TN_9590,0.0662665
GemmTunableOp_Half_TN,tn_14336_6630_4096,Gemm_Hipblaslt_TN_9827,1.28008
GemmTunableOp_Half_TN,tn_4096_1811_2048,Gemm_Hipblaslt_TN_9137,0.0641547
GemmTunableOp_Half_TN,tn_4096_3373_2048,Gemm_Hipblaslt_TN_9896,0.100398
GemmTunableOp_Half_TN,tn_4096_7108_7168,Gemm_Hipblaslt_TN_9677,0.674259
GemmTunableOp_Half_TN,tn_14336_1970_4096,Gemm_Hipblaslt_TN_9217,0.396099
GemmTunableOp_Half_TN,tn_4096_1847_2048,Gemm_Hipblaslt_TN_9590,0.0622097
GemmTunableOp_Half_TN,tn_3072_1725_4096,Gemm_Rocblas_621286778,0.0877311
GemmTunableOp_Half_TN,tn_4096_1827_7168,Gemm_Hipblaslt_TN_9268,0.201365
GemmTunableOp_Half_TN,tn_4096_1668_2048,Gemm_Hipblaslt_TN_9607,0.0578235
GemmTunableOp_Half_TN,tn_3072_6860_4096,Gemm_Hipblaslt_TN_9619,0.295873
GemmTunableOp_Half_TN,tn_3072_1877_4096,Gemm_Hipblaslt_TN_9324,0.0914837
GemmTunableOp_Half_TN,tn_4096_7050_2048,Gemm_Hipblaslt_TN_9694,0.204892
GemmTunableOp_Half_TN,tn_3072_1769_4096,Gemm_Rocblas_621286778,0.0898227
GemmTunableOp_Half_TN,tn_3072_7575_4096,Gemm_Rocblas_621294473,0.331767
GemmTunableOp_Half_TN,tn_4096_1867_7168,Gemm_Hipblaslt_TN_9680,0.209062
GemmTunableOp_Half_TN,tn_14336_184_4096,Gemm_Hipblaslt_TN_9352,0.0594869
GemmTunableOp_Half_TN,tn_3072_1615_4096,Gemm_Rocblas_621286778,0.0863154
GemmTunableOp_Half_TN,tn_14336_5030_4096,Gemm_Hipblaslt_TN_9187,0.964042
GemmTunableOp_Half_TN,tn_64128_221_4096,Gemm_Hipblaslt_TN_9768,0.275589
GemmTunableOp_Half_TN,tn_4096_3507_7168,Gemm_Hipblaslt_TN_9139,0.336765
GemmTunableOp_Half_TN,tn_14336_1589_4096,Gemm_Hipblaslt_TN_9690,0.325449
GemmTunableOp_Half_TN,tn_3072_1682_4096,Gemm_Hipblaslt_TN_9561,0.0860686
GemmTunableOp_Half_TN,tn_4096_1752_2048,Gemm_Hipblaslt_TN_9680,0.0618224
GemmTunableOp_Half_TN,tn_4096_3597_7168,Gemm_Hipblaslt_TN_9743,0.34431
GemmTunableOp_Half_TN,tn_3072_7262_4096,Gemm_Hipblaslt_TN_9681,0.31073
GemmTunableOp_Half_TN,tn_4096_7206_2048,Gemm_Hipblaslt_TN_9743,0.206381
GemmTunableOp_Half_TN,tn_4096_1628_7168,Gemm_Hipblaslt_TN_9587,0.181569
GemmTunableOp_Half_TN,tn_3072_1706_4096,Gemm_Rocblas_621286778,0.0885884
GemmTunableOp_Half_TN,tn_4096_1858_2048,Gemm_Hipblaslt_TN_9590,0.0631464
GemmTunableOp_Half_TN,tn_3072_7301_4096,Gemm_Hipblaslt_TN_9787,0.326533
GemmTunableOp_Half_TN,tn_4096_3767_2048,Gemm_Hipblaslt_TN_9873,0.112068
GemmTunableOp_Half_TN,tn_4096_5277_7168,Gemm_Hipblaslt_TN_9709,0.537194
GemmTunableOp_Half_TN,tn_3072_1728_4096,Gemm_Hipblaslt_TN_9148,0.088226
GemmTunableOp_Half_TN,tn_4096_1796_2048,Gemm_Hipblaslt_TN_9136,0.0630969
GemmTunableOp_Half_TN,tn_3072_3582_4096,Gemm_Rocblas_621294495,0.156835
GemmTunableOp_Half_TN,tn_4096_5274_2048,Gemm_Hipblaslt_TN_9691,0.167977
GemmTunableOp_Half_TN,tn_3072_5067_4096,Gemm_Hipblaslt_TN_9726,0.213584
GemmTunableOp_Half_TN,tn_3072_1707_4096,Gemm_Hipblaslt_TN_9148,0.086579
GemmTunableOp_Half_TN,tn_14336_3507_4096,Gemm_Hipblaslt_TN_9220,0.650435
GemmTunableOp_Half_TN,tn_4096_3767_7168,Gemm_Hipblaslt_TN_9827,0.359676
GemmTunableOp_Half_TN,tn_4096_7050_7168,Gemm_Hipblaslt_TN_9694,0.672171
GemmTunableOp_Half_TN,tn_4096_1877_2048,Gemm_Hipblaslt_TN_9136,0.0642258
GemmTunableOp_Half_TN,tn_14336_3584_4096,Gemm_Hipblaslt_TN_9223,0.652032
GemmTunableOp_Half_TN,tn_4096_6916_7168,Gemm_Hipblaslt_TN_9743,0.666866
GemmTunableOp_Half_TN,tn_64128_145_4096,Gemm_Hipblaslt_TN_9108,0.219204
GemmTunableOp_Half_TN,tn_14336_6841_4096,Gemm_Rocblas_621294492,1.29853
GemmTunableOp_Half_TN,tn_4096_7730_2048,Gemm_Hipblaslt_TN_9184,0.22558
GemmTunableOp_Half_TN,tn_14336_1633_4096,Gemm_Hipblaslt_TN_9677,0.349907
GemmTunableOp_Half_TN,tn_14336_1794_4096,Gemm_Hipblaslt_TN_9192,0.366086
GemmTunableOp_Half_TN,tn_14336_1977_4096,Gemm_Hipblaslt_TN_9223,0.396543
GemmTunableOp_Half_TN,tn_4096_1605_7168,Gemm_Hipblaslt_TN_9265,0.181447
GemmTunableOp_Half_TN,tn_14336_7109_4096,Gemm_Hipblaslt_TN_159,1.29558
GemmTunableOp_Half_TN,tn_3072_1871_4096,Gemm_Hipblaslt_TN_9133,0.0936416
GemmTunableOp_Half_TN,tn_14336_1597_4096,Gemm_Hipblaslt_TN_9690,0.324537
GemmTunableOp_Half_TN,tn_14336_7118_4096,Gemm_Hipblaslt_TN_9903,1.32027
GemmTunableOp_Half_TN,tn_4096_5068_7168,Gemm_Hipblaslt_TN_9690,0.52441
GemmTunableOp_Half_TN,tn_14336_104_4096,Gemm_Rocblas_621286493,0.0392979
GemmTunableOp_Half_TN,tn_4096_1589_7168,Gemm_Hipblaslt_TN_9265,0.178948
GemmTunableOp_Half_TN,tn_4096_1957_2048,Gemm_Hipblaslt_TN_9590,0.0660279
GemmTunableOp_Half_TN,tn_4096_40_2048,Gemm_Rocblas_621286337,0.00807968
GemmTunableOp_Half_TN,tn_3072_6881_4096,Gemm_Hipblaslt_TN_9681,0.294488
GemmTunableOp_Half_TN,tn_4096_5412_7168,Gemm_Hipblaslt_TN_9672,0.548245
GemmTunableOp_Half_TN,tn_3072_7478_4096,Gemm_Rocblas_621294473,0.329932
GemmTunableOp_Half_TN,tn_3072_7021_4096,Gemm_Hipblaslt_TN_9681,0.304314
GemmTunableOp_Half_TN,tn_3072_1708_4096,Gemm_Rocblas_621294520,0.0881352
GemmTunableOp_Half_TN,tn_14336_3511_4096,Gemm_Hipblaslt_TN_9223,0.65134
GemmTunableOp_Half_TN,tn_4096_1859_2048,Gemm_Hipblaslt_TN_9134,0.0633035
GemmTunableOp_Half_TN,tn_4096_1769_7168,Gemm_Hipblaslt_TN_9329,0.199255
GemmTunableOp_Half_TN,tn_3072_1722_4096,Gemm_Rocblas_621294520,0.08805
GemmTunableOp_Half_TN,tn_4096_1600_2048,Gemm_Hipblaslt_TN_9671,0.0564753
GemmTunableOp_Half_TN,tn_4096_3629_7168,Gemm_Hipblaslt_TN_9814,0.343128
GemmTunableOp_Half_TN,tn_64128_246_4096,Gemm_Hipblaslt_TN_9122,0.293415
GemmTunableOp_Half_TN,tn_3072_160_4096,Gemm_Rocblas_621286437,0.0183839
GemmTunableOp_Half_TN,tn_4096_7023_7168,Gemm_Hipblaslt_TN_9743,0.671078
GemmTunableOp_Half_TN,tn_4096_3369_7168,Gemm_Hipblaslt_TN_9682,0.324714
GemmTunableOp_Half_TN,tn_3072_1908_4096,Gemm_Hipblaslt_TN_9613,0.0958421
GemmTunableOp_Half_TN,tn_4096_152_2048,Gemm_Rocblas_621286443,0.0126703
GemmTunableOp_Half_TN,tn_4096_1902_7168,Gemm_Hipblaslt_TN_9645,0.208066
GemmTunableOp_Half_TN,tn_4096_1680_7168,Gemm_Hipblaslt_TN_9164,0.182047
GemmTunableOp_Half_TN,tn_14336_6715_4096,Gemm_Hipblaslt_TN_159,1.2824
GemmTunableOp_Half_TN,tn_4096_232_2048,Gemm_Rocblas_621286447,0.0145802
GemmTunableOp_Half_TN,tn_3072_7104_4096,Gemm_Hipblaslt_TN_9681,0.305201
GemmTunableOp_Half_TN,tn_14336_40_4096,Gemm_Rocblas_621294230,0.0285467
GemmTunableOp_Half_TN,tn_3072_5301_4096,Gemm_Hipblaslt_TN_9873,0.214241
GemmTunableOp_Half_TN,tn_4096_1691_2048,Gemm_Hipblaslt_TN_9607,0.0566503
GemmTunableOp_Half_TN,tn_4096_6952_7168,Gemm_Hipblaslt_TN_9694,0.666986
GemmTunableOp_Half_TN,tn_4096_7225_7168,Gemm_Hipblaslt_TN_9743,0.684063
GemmTunableOp_Half_TN,tn_3072_1869_4096,Gemm_Hipblaslt_TN_9324,0.0921403
GemmTunableOp_Half_TN,tn_4096_3520_7168,Gemm_Hipblaslt_TN_9189,0.338402
GemmTunableOp_Half_TN,tn_4096_3450_7168,Gemm_Hipblaslt_TN_9743,0.332785
GemmTunableOp_Half_TN,tn_3072_1829_4096,Gemm_Hipblaslt_TN_9324,0.0938245
GemmTunableOp_Half_TN,tn_4096_1608_7168,Gemm_Hipblaslt_TN_9266,0.181932
GemmTunableOp_Half_TN,tn_3072_80_4096,Gemm_Rocblas_621286278,0.0134617
GemmTunableOp_Half_TN,tn_14336_1866_4096,Gemm_Hipblaslt_TN_9697,0.371173
GemmTunableOp_Half_TN,tn_3072_1960_4096,Gemm_Hipblaslt_TN_9587,0.098829
GemmTunableOp_Half_TN,tn_14336_1884_4096,Gemm_Hipblaslt_TN_9187,0.37302
GemmTunableOp_Half_TN,tn_14336_3309_4096,Gemm_Rocblas_621294492,0.62635
GemmTunableOp_Half_TN,tn_4096_3764_2048,Gemm_Hipblaslt_TN_9841,0.112239
GemmTunableOp_Half_TN,tn_4096_5157_7168,Gemm_Hipblaslt_TN_9681,0.531535
GemmTunableOp_Half_TN,tn_4096_1790_2048,Gemm_Hipblaslt_TN_9136,0.0626116
GemmTunableOp_Half_TN,tn_4096_3497_7168,Gemm_Hipblaslt_TN_9697,0.336866
GemmTunableOp_Half_TN,tn_4096_248_7168,Gemm_Hipblaslt_TN_9497,0.0447395
GemmTunableOp_Half_TN,tn_4096_1622_2048,Gemm_Hipblaslt_TN_9616,0.0554038
GemmTunableOp_Half_TN,tn_3072_1684_4096,Gemm_Hipblaslt_TN_9322,0.0889488
GemmTunableOp_Half_TN,tn_3072_96_4096,Gemm_Rocblas_621286279,0.0134541
GemmTunableOp_Half_TN,tn_4096_5239_2048,Gemm_Hipblaslt_TN_9690,0.167612
GemmTunableOp_Half_TN,tn_3072_1796_4096,Gemm_Rocblas_621286778,0.0919234
GemmTunableOp_Half_TN,tn_4096_6800_7168,Gemm_Hipblaslt_TN_9694,0.658113
GemmTunableOp_Half_TN,tn_14336_5271_4096,Gemm_Hipblaslt_TN_159,1.01988
GemmTunableOp_Half_TN,tn_3072_1888_4096,Gemm_Hipblaslt_TN_9324,0.0928082
GemmTunableOp_Half_TN,tn_4096_7364_7168,Gemm_Hipblaslt_TN_9904,0.707782
GemmTunableOp_Half_TN,tn_4096_168_2048,Gemm_Rocblas_621286815,0.0134465
GemmTunableOp_Half_TN,tn_14336_6789_4096,Gemm_Hipblaslt_TN_9815,1.29833
GemmTunableOp_Half_TN,tn_3072_5271_4096,Gemm_Hipblaslt_TN_9850,0.216031
GemmStridedBatchedTunableOp_Half_TN,tn_1958_1958_128_B_16,Gemm_Hipblaslt_TN_6929,0.0845101
GemmStridedBatchedTunableOp_Half_TN,tn_1933_1933_128_B_16,Gemm_Hipblaslt_TN_6929,0.0849057
GemmStridedBatchedTunableOp_Half_TN,tn_1783_1783_128_B_16,Gemm_Hipblaslt_TN_6879,0.0754299
GemmStridedBatchedTunableOp_Half_TN,tn_1678_1678_128_B_16,Gemm_Rocblas_621294110,0.0696472
GemmStridedBatchedTunableOp_Half_TN,tn_1658_1658_128_B_16,Gemm_Hipblaslt_TN_7483,0.0663418
GemmStridedBatchedTunableOp_Half_TN,tn_1605_1605_128_B_16,Gemm_Rocblas_621294635,0.0651857
GemmStridedBatchedTunableOp_Half_TN,tn_1875_1875_128_B_16,Gemm_Hipblaslt_TN_6942,0.0826776
GemmStridedBatchedTunableOp_Half_TN,tn_1927_1927_128_B_16,Gemm_Rocblas_621294533,0.0865418
GemmStridedBatchedTunableOp_Half_TN,tn_1850_1850_128_B_16,Gemm_Hipblaslt_TN_6942,0.0799003
GemmStridedBatchedTunableOp_Half_TN,tn_1926_1926_128_B_16,Gemm_Hipblaslt_TN_6929,0.0844391
GemmStridedBatchedTunableOp_Half_TN,tn_1880_1880_128_B_16,Gemm_Hipblaslt_TN_150,0.077795
GemmStridedBatchedTunableOp_Half_TN,tn_1664_1664_128_B_16,Gemm_Rocblas_621286509,0.050392
GemmStridedBatchedTunableOp_Half_TN,tn_1979_1979_128_B_16,Gemm_Hipblaslt_TN_6867,0.087827
GemmStridedBatchedTunableOp_Half_TN,tn_1960_1960_128_B_16,Gemm_Hipblaslt_TN_150,0.0790339
GemmStridedBatchedTunableOp_Half_TN,tn_1761_1761_128_B_16,Gemm_Rocblas_621294108,0.0735007
GemmStridedBatchedTunableOp_Half_TN,tn_1659_1659_128_B_16,Gemm_Hipblaslt_TN_7483,0.0678121
GemmStridedBatchedTunableOp_Half_TN,tn_1772_1772_128_B_16,Gemm_Rocblas_621286413,0.0740945
GemmStridedBatchedTunableOp_Half_TN,tn_1884_1884_128_B_16,Gemm_Rocblas_621294725,0.0808617
GemmStridedBatchedTunableOp_Half_TN,tn_1689_1689_128_B_16,Gemm_Rocblas_621286413,0.0694295
GemmStridedBatchedTunableOp_Half_TN,tn_1821_1821_128_B_16,Gemm_Hipblaslt_TN_6942,0.0792572
GemmStridedBatchedTunableOp_Half_TN,tn_1977_1977_128_B_16,Gemm_Hipblaslt_TN_6867,0.0858063
GemmStridedBatchedTunableOp_Half_TN,tn_1580_1580_128_B_16,Gemm_Rocblas_621286413,0.0628728
GemmStridedBatchedTunableOp_Half_TN,tn_1809_1809_128_B_16,Gemm_Rocblas_621294110,0.0790134
GemmStridedBatchedTunableOp_Half_TN,tn_1721_1721_128_B_16,Gemm_Rocblas_621294110,0.0698735
GemmStridedBatchedTunableOp_Half_TN,tn_1651_1651_128_B_16,Gemm_Rocblas_621286775,0.0673413
GemmStridedBatchedTunableOp_Half_TN,tn_1857_1857_128_B_16,Gemm_Hipblaslt_TN_6942,0.0803902
GemmStridedBatchedTunableOp_Half_TN,tn_1642_1642_128_B_16,Gemm_Hipblaslt_TN_7483,0.0659339
GemmStridedBatchedTunableOp_Half_TN,tn_1591_1591_128_B_16,Gemm_Hipblaslt_TN_6879,0.0648421
GemmStridedBatchedTunableOp_Half_TN,tn_1729_1729_128_B_16,Gemm_Rocblas_621286413,0.071714
GemmStridedBatchedTunableOp_Half_TN,tn_1767_1767_128_B_16,Gemm_Rocblas_621286775,0.0750103
GemmStridedBatchedTunableOp_Half_TN,tn_1657_1657_128_B_16,Gemm_Rocblas_621294517,0.0674124
GemmStridedBatchedTunableOp_Half_TN,tn_1666_1666_128_B_16,Gemm_Hipblaslt_TN_9508,0.0685524
GemmStridedBatchedTunableOp_Half_TN,tn_1820_1820_128_B_16,Gemm_Rocblas_621286413,0.0776019
GemmStridedBatchedTunableOp_Half_TN,tn_1969_1969_128_B_16,Gemm_Hipblaslt_TN_6857,0.0886132
GemmStridedBatchedTunableOp_Half_TN,tn_1811_1811_128_B_16,Gemm_Rocblas_621294754,0.0788338
GemmStridedBatchedTunableOp_Half_TN,tn_1608_1608_128_B_16,Gemm_Hipblaslt_TN_149,0.062697
GemmStridedBatchedTunableOp_Half_TN,tn_1860_1860_128_B_16,Gemm_Hipblaslt_TN_6942,0.0797475
GemmStridedBatchedTunableOp_Half_TN,tn_1874_1874_128_B_16,Gemm_Hipblaslt_TN_6942,0.080959
GemmStridedBatchedTunableOp_Half_TN,tn_1824_1824_128_B_16,Gemm_Rocblas_621286771,0.0710197
GemmStridedBatchedTunableOp_Half_TN,tn_1984_1984_128_B_16,Gemm_Hipblaslt_TN_150,0.0769252
GemmStridedBatchedTunableOp_Half_TN,tn_1685_1685_128_B_16,Gemm_Rocblas_621294110,0.0702063
GemmStridedBatchedTunableOp_Half_TN,tn_1741_1741_128_B_16,Gemm_Hipblaslt_TN_7483,0.072499
GemmStridedBatchedTunableOp_Half_TN,tn_1898_1898_128_B_16,Gemm_Hipblaslt_TN_6942,0.0816719
GemmStridedBatchedTunableOp_Half_TN,tn_1610_1610_128_B_16,Gemm_Hipblaslt_TN_7483,0.065108
GemmStridedBatchedTunableOp_Half_TN,tn_1950_1950_128_B_16,Gemm_Hipblaslt_TN_6929,0.084992
GemmStridedBatchedTunableOp_Half_TN,tn_2000_2000_128_B_16,Gemm_Hipblaslt_TN_153,0.0776304
GemmStridedBatchedTunableOp_Half_TN,tn_1842_1842_128_B_16,Gemm_Hipblaslt_TN_6942,0.0790398
GemmStridedBatchedTunableOp_Half_TN,tn_1823_1823_128_B_16,Gemm_Hipblaslt_TN_6942,0.078481
GemmStridedBatchedTunableOp_Half_TN,tn_1870_1870_128_B_16,Gemm_Hipblaslt_TN_6942,0.0813518
GemmStridedBatchedTunableOp_Half_TN,tn_1628_1628_128_B_16,Gemm_Rocblas_621294517,0.0655071
GemmStridedBatchedTunableOp_Half_TN,tn_1909_1909_128_B_16,Gemm_Hipblaslt_TN_6942,0.0824798
GemmStridedBatchedTunableOp_Half_TN,tn_1916_1916_128_B_16,Gemm_Hipblaslt_TN_6942,0.081651
GemmStridedBatchedTunableOp_Half_TN,tn_1625_1625_128_B_16,Gemm_Hipblaslt_TN_7483,0.0661623
GemmStridedBatchedTunableOp_Half_TN,tn_1724_1724_128_B_16,Gemm_Rocblas_621286413,0.0702705
GemmStridedBatchedTunableOp_Half_TN,tn_1970_1970_128_B_16,Gemm_Rocblas_621294533,0.086488
GemmStridedBatchedTunableOp_Half_TN,tn_1951_1951_128_B_16,Gemm_Hipblaslt_TN_6867,0.0861823
GemmStridedBatchedTunableOp_Half_TN,tn_1597_1597_128_B_16,Gemm_Rocblas_621294650,0.0653076
GemmStridedBatchedTunableOp_Half_TN,tn_1906_1906_128_B_16,Gemm_Hipblaslt_TN_6942,0.0820257
GemmStridedBatchedTunableOp_Half_TN,tn_1941_1941_128_B_16,Gemm_Hipblaslt_TN_6879,0.0854597
GemmStridedBatchedTunableOp_Half_TN,tn_1750_1750_128_B_16,Gemm_Rocblas_621286413,0.071736
GemmStridedBatchedTunableOp_Half_TN,tn_1753_1753_128_B_16,Gemm_Rocblas_621294517,0.0732975
GemmStridedBatchedTunableOp_Half_TN,tn_1988_1988_128_B_16,Gemm_Hipblaslt_TN_6879,0.0855854
GemmStridedBatchedTunableOp_Half_TN,tn_1837_1837_128_B_16,Gemm_Hipblaslt_TN_7483,0.0812676
GemmStridedBatchedTunableOp_Half_TN,tn_1830_1830_128_B_16,Gemm_Hipblaslt_TN_7483,0.0775985
GemmStridedBatchedTunableOp_Half_TN,tn_1667_1667_128_B_16,Gemm_Rocblas_621286413,0.0688274
GemmStridedBatchedTunableOp_Half_TN,tn_1613_1613_128_B_16,Gemm_Hipblaslt_TN_7483,0.0653474
GemmStridedBatchedTunableOp_Half_TN,tn_1694_1694_128_B_16,Gemm_Rocblas_621286413,0.0678824
GemmStridedBatchedTunableOp_Half_TN,tn_1881_1881_128_B_16,Gemm_Hipblaslt_TN_6942,0.0817784
GemmStridedBatchedTunableOp_Half_TN,tn_1959_1959_128_B_16,Gemm_Hipblaslt_TN_6929,0.0872942
GemmStridedBatchedTunableOp_Half_TN,tn_1697_1697_128_B_16,Gemm_Rocblas_621294754,0.0694065
GemmStridedBatchedTunableOp_Half_TN,tn_1598_1598_128_B_16,Gemm_Hipblaslt_TN_7483,0.0619993
GemmStridedBatchedTunableOp_Half_TN,tn_1854_1854_128_B_16,Gemm_Hipblaslt_TN_6942,0.0798534
GemmStridedBatchedTunableOp_Half_TN,tn_1735_1735_128_B_16,Gemm_Rocblas_621294517,0.0723662
GemmStridedBatchedTunableOp_Half_TN,tn_1887_1887_128_B_16,Gemm_Hipblaslt_TN_6942,0.0816166
GemmStridedBatchedTunableOp_Half_TN,tn_1861_1861_128_B_16,Gemm_Hipblaslt_TN_6942,0.0813175
GemmStridedBatchedTunableOp_Half_TN,tn_1913_1913_128_B_16,Gemm_Hipblaslt_TN_6942,0.0826458
GemmStridedBatchedTunableOp_Half_TN,tn_1692_1692_128_B_16,Gemm_Rocblas_621286413,0.068436
GemmStridedBatchedTunableOp_Half_TN,tn_1886_1886_128_B_16,Gemm_Hipblaslt_TN_6942,0.0816689
GemmStridedBatchedTunableOp_Half_TN,tn_1885_1885_128_B_16,Gemm_Hipblaslt_TN_6942,0.0823144
GemmStridedBatchedTunableOp_Half_TN,tn_1786_1786_128_B_16,Gemm_Rocblas_621294517,0.0753604
GemmStridedBatchedTunableOp_Half_TN,tn_1586_1586_128_B_16,Gemm_Rocblas_621286413,0.0635821
GemmStridedBatchedTunableOp_Half_TN,tn_1691_1691_128_B_16,Gemm_Rocblas_621286413,0.0694565
GemmStridedBatchedTunableOp_Half_TN,tn_1794_1794_128_B_16,Gemm_Rocblas_621294110,0.0771047
GemmStridedBatchedTunableOp_Half_TN,tn_1703_1703_128_B_16,Gemm_Rocblas_621286413,0.0708951
GemmStridedBatchedTunableOp_Half_TN,tn_1662_1662_128_B_16,Gemm_Rocblas_621286775,0.0657757
GemmStridedBatchedTunableOp_Half_TN,tn_1687_1687_128_B_16,Gemm_Rocblas_621294110,0.0688829
GemmStridedBatchedTunableOp_Half_TN,tn_1649_1649_128_B_16,Gemm_Hipblaslt_TN_7483,0.0652867
GemmStridedBatchedTunableOp_Half_TN,tn_1795_1795_128_B_16,Gemm_Rocblas_621294754,0.077478
GemmStridedBatchedTunableOp_Half_TN,tn_1890_1890_128_B_16,Gemm_Hipblaslt_TN_6942,0.0812146
GemmStridedBatchedTunableOp_Half_TN,tn_1756_1756_128_B_16,Gemm_Rocblas_621294109,0.0728212
GemmStridedBatchedTunableOp_Half_TN,tn_1819_1819_128_B_16,Gemm_Hipblaslt_TN_6942,0.0791726
GemmStridedBatchedTunableOp_Half_TN,tn_1737_1737_128_B_16,Gemm_Rocblas_621286413,0.0724003
GemmStridedBatchedTunableOp_Half_TN,tn_1789_1789_128_B_16,Gemm_Hipblaslt_TN_6857,0.0754592
GemmStridedBatchedTunableOp_Half_TN,tn_1631_1631_128_B_16,Gemm_Hipblaslt_TN_7483,0.0662297
GemmStridedBatchedTunableOp_Half_TN,tn_1602_1602_128_B_16,Gemm_Rocblas_621286776,0.0648224
GemmTunableOp_Half_TN,tn_3072_1731_4096,Gemm_Hipblaslt_TN_9613,0.0907597
GemmTunableOp_Half_TN,tn_3072_3379_4096,Gemm_Rocblas_621286753,0.151923
GemmTunableOp_Half_TN,tn_4096_1608_2048,Gemm_Hipblaslt_TN_9607,0.0569751
GemmTunableOp_Half_TN,tn_4096_5089_7168,Gemm_Hipblaslt_TN_9681,0.525725
GemmTunableOp_Half_TN,tn_3072_1850_4096,Gemm_Hipblaslt_TN_9148,0.0931146
GemmTunableOp_Half_TN,tn_4096_3309_7168,Gemm_Hipblaslt_TN_9677,0.321533
GemmTunableOp_Half_TN,tn_4096_1771_2048,Gemm_Hipblaslt_TN_9136,0.0622302
GemmTunableOp_Half_TN,tn_3072_3309_4096,Gemm_Hipblaslt_TN_9619,0.151502
GemmTunableOp_Half_TN,tn_64128_119_4096,Gemm_Rocblas_621286258,0.200831
GemmTunableOp_Half_TN,tn_3072_1846_4096,Gemm_Hipblaslt_TN_9615,0.0939993
GemmTunableOp_Half_TN,tn_4096_1680_2048,Gemm_Hipblaslt_TN_9588,0.0583336
GemmTunableOp_Half_TN,tn_4096_1794_7168,Gemm_Hipblaslt_TN_9137,0.20265
GemmTunableOp_Half_TN,tn_4096_3586_7168,Gemm_Hipblaslt_TN_9683,0.340606
GemmTunableOp_Half_TN,tn_3072_1804_4096,Gemm_Rocblas_621286778,0.0894028
GemmTunableOp_Half_TN,tn_4096_6971_2048,Gemm_Hipblaslt_TN_9814,0.206165
GemmTunableOp_Half_TN,tn_14336_1888_4096,Gemm_Hipblaslt_TN_9189,0.373339
GemmTunableOp_Half_TN,tn_64128_190_4096,Gemm_Hipblaslt_TN_9694,0.250425
GemmTunableOp_Half_TN,tn_14336_3645_4096,Gemm_Hipblaslt_TN_9677,0.723725
GemmTunableOp_Half_TN,tn_4096_3496_7168,Gemm_Hipblaslt_TN_9187,0.332425
GemmTunableOp_Half_TN,tn_3072_1688_4096,Gemm_Hipblaslt_TN_9148,0.0888097
GemmTunableOp_Half_TN,tn_14336_3640_4096,Gemm_Hipblaslt_TN_9192,0.729407
GemmTunableOp_Half_TN,tn_14336_1882_4096,Gemm_Hipblaslt_TN_9697,0.370947
GemmTunableOp_Half_TN,tn_4096_1887_7168,Gemm_Hipblaslt_TN_9645,0.206151
GemmTunableOp_Half_TN,tn_64128_196_4096,Gemm_Hipblaslt_TN_9654,0.266498
GemmTunableOp_Half_TN,tn_4096_1667_7168,Gemm_Hipblaslt_TN_9587,0.181915
GemmTunableOp_Half_TN,tn_14336_6871_4096,Gemm_Rocblas_621294492,1.28725
GemmTunableOp_Half_TN,tn_4096_1762_7168,Gemm_Hipblaslt_TN_9267,0.197965
GemmTunableOp_Half_TN,tn_3072_3441_4096,Gemm_Hipblaslt_TN_9629,0.152887
GemmTunableOp_Half_TN,tn_4096_6715_7168,Gemm_Hipblaslt_TN_9677,0.649381
GemmTunableOp_Half_TN,tn_14336_3345_4096,Gemm_Hipblaslt_TN_9223,0.626217
GemmTunableOp_Half_TN,tn_4096_7096_7168,Gemm_Hipblaslt_TN_9743,0.665779
GemmTunableOp_Half_TN,tn_3072_7579_4096,Gemm_Hipblaslt_TN_9779,0.332734
GemmTunableOp_Half_TN,tn_14336_1592_4096,Gemm_Hipblaslt_TN_9690,0.324863
GemmTunableOp_Half_TN,tn_14336_1830_4096,Gemm_Hipblaslt_TN_9697,0.367187
GemmTunableOp_Half_TN,tn_4096_1830_2048,Gemm_Hipblaslt_TN_9590,0.0630126
GemmTunableOp_Half_TN,tn_4096_3401_7168,Gemm_Hipblaslt_TN_9187,0.330958
GemmTunableOp_Half_TN,tn_3072_1601_4096,Gemm_Rocblas_621294520,0.0870303
GemmTunableOp_Half_TN,tn_14336_1778_4096,Gemm_Hipblaslt_TN_9697,0.363656
GemmTunableOp_Half_TN,tn_14336_1946_4096,Gemm_Hipblaslt_TN_9217,0.39625
GemmTunableOp_Half_TN,tn_4096_7196_2048,Gemm_Hipblaslt_TN_9743,0.204069
GemmTunableOp_Half_TN,tn_14336_3553_4096,Gemm_Hipblaslt_TN_9223,0.655401
GemmTunableOp_Half_TN,tn_4096_3612_2048,Gemm_Hipblaslt_TN_9896,0.104715
GemmTunableOp_Half_TN,tn_4096_3768_2048,Gemm_Hipblaslt_TN_9768,0.109706
GemmTunableOp_Half_TN,tn_3072_1860_4096,Gemm_Hipblaslt_TN_9613,0.0934721
GemmTunableOp_Half_TN,tn_4096_1592_2048,Gemm_Hipblaslt_TN_9164,0.0566078
GemmTunableOp_Half_TN,tn_4096_3478_2048,Gemm_Hipblaslt_TN_9896,0.102323
GemmTunableOp_Half_TN,tn_4096_1881_7168,Gemm_Hipblaslt_TN_9645,0.206499
GemmTunableOp_Half_TN,tn_4096_5533_2048,Gemm_Hipblaslt_TN_9799,0.170972
GemmTunableOp_Half_TN,tn_4096_1586_7168,Gemm_Hipblaslt_TN_9587,0.179119
GemmTunableOp_Half_TN,tn_4096_1710_7168,Gemm_Hipblaslt_TN_9164,0.183237
GemmTunableOp_Half_TN,tn_4096_1767_2048,Gemm_Hipblaslt_TN_9329,0.061605
GemmTunableOp_Half_TN,tn_4096_1765_7168,Gemm_Hipblaslt_TN_9329,0.198117
GemmTunableOp_Half_TN,tn_3072_3565_4096,Gemm_Rocblas_621286753,0.155993
GemmTunableOp_Half_TN,tn_14336_5068_4096,Gemm_Hipblaslt_TN_9677,0.968578
GemmTunableOp_Half_TN,tn_14336_3456_4096,Gemm_Rocblas_621286590,0.648373
GemmTunableOp_Half_TN,tn_4096_1648_2048,Gemm_Hipblaslt_TN_9328,0.0578761
GemmTunableOp_Half_TN,tn_3072_1757_4096,Gemm_Hipblaslt_TN_9613,0.0905197
GemmTunableOp_Half_TN,tn_3072_3722_4096,Gemm_Hipblaslt_TN_9852,0.16395
GemmTunableOp_Half_TN,tn_4096_1945_7168,Gemm_Hipblaslt_TN_9645,0.205933
GemmTunableOp_Half_TN,tn_4096_1896_2048,Gemm_Hipblaslt_TN_9590,0.0631526
GemmTunableOp_Half_TN,tn_3072_7093_4096,Gemm_Hipblaslt_TN_9619,0.3066
GemmTunableOp_Half_TN,tn_64128_18_4096,Gemm_Rocblas_621286348,0.143726
GemmTunableOp_Half_TN,tn_4096_1655_7168,Gemm_Hipblaslt_TN_9265,0.181847
GemmTunableOp_Half_TN,tn_64128_173_4096,Gemm_Hipblaslt_TN_9661,0.245376
GemmTunableOp_Half_TN,tn_4096_3612_7168,Gemm_Hipblaslt_TN_9743,0.339641
GemmTunableOp_Half_TN,tn_4096_1670_7168,Gemm_Hipblaslt_TN_9265,0.181484
GemmTunableOp_Half_TN,tn_14336_1894_4096,Gemm_Hipblaslt_TN_9697,0.369827
GemmTunableOp_Half_TN,tn_4096_1936_2048,Gemm_Hipblaslt_TN_9590,0.0654124
GemmTunableOp_Half_TN,tn_3072_5223_4096,Gemm_Hipblaslt_TN_9905,0.213491
GemmTunableOp_Half_TN,tn_3072_1936_4096,Gemm_Hipblaslt_TN_9633,0.098567
GemmTunableOp_Half_TN,tn_4096_3666_2048,Gemm_Hipblaslt_TN_9827,0.110389
GemmTunableOp_Half_TN,tn_4096_3855_2048,Gemm_Hipblaslt_TN_9898,0.114208
GemmTunableOp_Half_TN,tn_4096_1881_2048,Gemm_Hipblaslt_TN_9134,0.0649467
GemmTunableOp_Half_TN,tn_4096_5301_7168,Gemm_Rocblas_621286705,0.54262
GemmTunableOp_Half_TN,tn_14336_3701_4096,Gemm_Hipblaslt_TN_9187,0.736807
GemmTunableOp_Half_TN,tn_3072_1603_4096,Gemm_Hipblaslt_TN_9613,0.0885768
GemmTunableOp_Half_TN,tn_4096_1609_7168,Gemm_Hipblaslt_TN_9587,0.181203
GemmTunableOp_Half_TN,tn_14336_1831_4096,Gemm_Hipblaslt_TN_9697,0.368437
GemmTunableOp_Half_TN,tn_3072_5285_4096,Gemm_Hipblaslt_TN_9920,0.211993
GemmTunableOp_Half_TN,tn_4096_3600_7168,Gemm_Hipblaslt_TN_9187,0.338942
GemmTunableOp_Half_TN,tn_4096_1731_2048,Gemm_Hipblaslt_TN_9136,0.0620564
GemmTunableOp_Half_TN,tn_4096_1707_7168,Gemm_Hipblaslt_TN_9359,0.184862
GemmTunableOp_Half_TN,tn_14336_5219_4096,Gemm_Hipblaslt_TN_9223,1.0285
GemmTunableOp_Half_TN,tn_3072_1717_4096,Gemm_Rocblas_621286778,0.0896503
GemmTunableOp_Half_TN,tn_4096_5390_2048,Gemm_Hipblaslt_TN_9691,0.170723
GemmTunableOp_Half_TN,tn_4096_7432_7168,Gemm_Hipblaslt_TN_159,0.712865
GemmTunableOp_Half_TN,tn_4096_6996_2048,Gemm_Hipblaslt_TN_9221,0.204534
GemmTunableOp_Half_TN,tn_14336_1717_4096,Gemm_Hipblaslt_TN_9697,0.353934
GemmTunableOp_Half_TN,tn_3072_1823_4096,Gemm_Hipblaslt_TN_9163,0.0924823
GemmTunableOp_Half_TN,tn_4096_6971_7168,Gemm_Hipblaslt_TN_9743,0.666146
GemmTunableOp_Half_TN,tn_4096_3592_2048,Gemm_Hipblaslt_TN_9683,0.102498
GemmTunableOp_Half_TN,tn_4096_1637_2048,Gemm_Hipblaslt_TN_9164,0.0562268
GemmTunableOp_Half_TN,tn_4096_7186_2048,Gemm_Hipblaslt_TN_9188,0.208141
GemmTunableOp_Half_TN,tn_3072_7047_4096,Gemm_Hipblaslt_TN_9681,0.302507
GemmTunableOp_Half_TN,tn_14336_7484_4096,Gemm_Hipblaslt_TN_159,1.44218
GemmTunableOp_Half_TN,tn_4096_1780_7168,Gemm_Hipblaslt_TN_9329,0.198312
GemmTunableOp_Half_TN,tn_4096_1946_7168,Gemm_Hipblaslt_TN_9645,0.208191
GemmTunableOp_Half_TN,tn_4096_6708_2048,Gemm_Hipblaslt_TN_9743,0.195773
GemmTunableOp_Half_TN,tn_4096_6916_2048,Gemm_Hipblaslt_TN_9695,0.204416
GemmTunableOp_Half_TN,tn_3072_7096_4096,Gemm_Hipblaslt_TN_9681,0.307424
GemmTunableOp_Half_TN,tn_4096_32_2048,Gemm_Rocblas_621286273,0.00743912
GemmTunableOp_Half_TN,tn_4096_7182_2048,Gemm_Hipblaslt_TN_9692,0.207147
GemmTunableOp_Half_TN,tn_4096_7403_7168,Gemm_Rocblas_621286678,0.705673
GemmTunableOp_Half_TN,tn_4096_7484_2048,Gemm_Hipblaslt_TN_9813,0.223097
GemmTunableOp_Half_TN,tn_3072_1703_4096,Gemm_Rocblas_621294520,0.0882542
GemmTunableOp_Half_TN,tn_4096_6841_2048,Gemm_Hipblaslt_TN_9953,0.201943
GemmTunableOp_Half_TN,tn_4096_7403_2048,Gemm_Hipblaslt_TN_9655,0.221935
GemmTunableOp_Half_TN,tn_3072_1874_4096,Gemm_Hipblaslt_TN_9611,0.0945433
GemmTunableOp_Half_TN,tn_4096_1857_7168,Gemm_Hipblaslt_TN_9645,0.205582
GemmTunableOp_Half_TN,tn_14336_1863_4096,Gemm_Hipblaslt_TN_9697,0.366768
GemmTunableOp_Half_TN,tn_4096_3416_2048,Gemm_Hipblaslt_TN_9896,0.100516
GemmTunableOp_Half_TN,tn_14336_1892_4096,Gemm_Hipblaslt_TN_9677,0.365892
GemmTunableOp_Half_TN,tn_14336_7027_4096,Gemm_Hipblaslt_TN_159,1.29526
GemmTunableOp_Half_TN,tn_4096_1953_7168,Gemm_Hipblaslt_TN_9680,0.208901
GemmTunableOp_Half_TN,tn_14336_24_4096,Gemm_Rocblas_621294154,0.0258011
GemmTunableOp_Half_TN,tn_3072_1866_4096,Gemm_Hipblaslt_TN_9613,0.0939192
GemmTunableOp_Half_TN,tn_14336_1603_4096,Gemm_Hipblaslt_TN_9677,0.349107
GemmTunableOp_Half_TN,tn_14336_3586_4096,Gemm_Hipblaslt_TN_9697,0.722367
GemmTunableOp_Half_TN,tn_4096_7568_2048,Gemm_Rocblas_621286281,0.220525
GemmTunableOp_Half_TN,tn_4096_1589_2048,Gemm_Hipblaslt_TN_9671,0.0559071
GemmTunableOp_Half_TN,tn_4096_5204_2048,Gemm_Hipblaslt_TN_9690,0.16866
GemmTunableOp_Half_TN,tn_14336_1673_4096,Gemm_Hipblaslt_TN_9793,0.351553
GemmTunableOp_Half_TN,tn_3072_3438_4096,Gemm_Rocblas_621286753,0.152326
GemmTunableOp_Half_TN,tn_14336_7345_4096,Gemm_Hipblaslt_TN_9900,1.41627
GemmTunableOp_Half_TN,tn_14336_5136_4096,Gemm_Hipblaslt_TN_9139,0.966618
GemmTunableOp_Half_TN,tn_14336_64_4096,Gemm_Rocblas_621294557,0.0303437
GemmTunableOp_Half_TN,tn_4096_1739_2048,Gemm_Hipblaslt_TN_9136,0.0617338
GemmTunableOp_Half_TN,tn_4096_5052_7168,Gemm_Hipblaslt_TN_9681,0.521428
GemmTunableOp_Half_TN,tn_3072_1628_4096,Gemm_Rocblas_621294520,0.0877527
GemmTunableOp_Half_TN,tn_3072_1710_4096,Gemm_Hipblaslt_TN_9133,0.089936
GemmTunableOp_Half_TN,tn_4096_256_7168,Gemm_Hipblaslt_TN_9497,0.0444242
GemmTunableOp_Half_TN,tn_4096_1742_2048,Gemm_Hipblaslt_TN_9136,0.0622603
GemmTunableOp_Half_TN,tn_4096_7364_2048,Gemm_Hipblaslt_TN_9713,0.219391
GemmTunableOp_Half_TN,tn_64128_222_4096,Gemm_Hipblaslt_TN_9185,0.275268
GemmTunableOp_Half_TN,tn_3072_3345_4096,Gemm_Hipblaslt_TN_9570,0.150643
GemmTunableOp_Half_TN,tn_14336_32_4096,Gemm_Rocblas_621286427,0.0256964
GemmTunableOp_Half_TN,tn_4096_1908_7168,Gemm_Hipblaslt_TN_9645,0.205888
GemmTunableOp_Half_TN,tn_14336_1608_4096,Gemm_Hipblaslt_TN_9677,0.349973
GemmTunableOp_Half_TN,tn_4096_7104_2048,Gemm_Hipblaslt_TN_9732,0.203765
GemmTunableOp_Half_TN,tn_14336_3559_4096,Gemm_Hipblaslt_TN_9223,0.652666
GemmTunableOp_Half_TN,tn_14336_168_4096,Gemm_Rocblas_621294461,0.0575983
GemmTunableOp_Half_TN,tn_14336_3468_4096,Gemm_Hipblaslt_TN_9827,0.654234
GemmTunableOp_Half_TN,tn_4096_5447_2048,Gemm_Hipblaslt_TN_9799,0.170612
GemmTunableOp_Half_TN,tn_4096_6773_7168,Gemm_Hipblaslt_TN_9743,0.651743
GemmTunableOp_Half_TN,tn_14336_7253_4096,Gemm_Hipblaslt_TN_9697,1.37552
GemmTunableOp_Half_TN,tn_4096_1966_7168,Gemm_Hipblaslt_TN_9645,0.211177
GemmTunableOp_Half_TN,tn_14336_1685_4096,Gemm_Hipblaslt_TN_9697,0.352567
GemmTunableOp_Half_TN,tn_4096_1772_2048,Gemm_Hipblaslt_TN_9136,0.0624631
GemmTunableOp_Half_TN,tn_64128_121_4096,Gemm_Hipblaslt_TN_9698,0.199916
GemmTunableOp_Half_TN,tn_64128_73_4096,Gemm_Hipblaslt_TN_9058,0.177367
GemmTunableOp_Half_TN,tn_3072_176_4096,Gemm_Rocblas_621286436,0.0184924
GemmTunableOp_Half_TN,tn_14336_80_4096,Gemm_Hipblaslt_TN_9494,0.033147
GemmTunableOp_Half_TN,tn_3072_224_4096,Gemm_Rocblas_621286440,0.0222989
GemmTunableOp_Half_TN,tn_4096_1646_2048,Gemm_Hipblaslt_TN_9671,0.05741
GemmTunableOp_Half_TN,tn_4096_3691_2048,Gemm_Hipblaslt_TN_9827,0.111507
GemmTunableOp_Half_TN,tn_14336_1690_4096,Gemm_Hipblaslt_TN_9677,0.350296
GemmTunableOp_Half_TN,tn_4096_1702_7168,Gemm_Hipblaslt_TN_9164,0.182936
GemmTunableOp_Half_TN,tn_14336_1867_4096,Gemm_Hipblaslt_TN_9697,0.369756
GemmTunableOp_Half_TN,tn_4096_5239_7168,Gemm_Hipblaslt_TN_9672,0.532896
GemmTunableOp_Half_TN,tn_14336_1748_4096,Gemm_Hipblaslt_TN_9192,0.361757
GemmTunableOp_Half_TN,tn_14336_5436_4096,Gemm_Rocblas_621286742,1.06048
GemmTunableOp_Half_TN,tn_14336_6997_4096,Gemm_Hipblaslt_TN_159,1.27983
GemmTunableOp_Half_TN,tn_3072_7325_4096,Gemm_Hipblaslt_TN_9800,0.324846
GemmTunableOp_Half_TN,tn_14336_1826_4096,Gemm_Hipblaslt_TN_9192,0.362446
GemmTunableOp_Half_TN,tn_14336_7067_4096,Gemm_Hipblaslt_TN_159,1.29026
GemmTunableOp_Half_TN,tn_4096_208_7168,Gemm_Rocblas_621294230,0.0429322
GemmTunableOp_Half_TN,tn_14336_3781_4096,Gemm_Hipblaslt_TN_9192,0.74097
GemmTunableOp_Half_TN,tn_4096_5285_7168,Gemm_Hipblaslt_TN_9691,0.54325
GemmTunableOp_Half_TN,tn_4096_6788_7168,Gemm_Hipblaslt_TN_9694,0.648824
GemmTunableOp_Half_TN,tn_4096_1699_2048,Gemm_Hipblaslt_TN_9588,0.0582725
GemmTunableOp_Half_TN,tn_4096_7108_2048,Gemm_Hipblaslt_TN_9814,0.208198
GemmTunableOp_Half_TN,tn_14336_1811_4096,Gemm_Hipblaslt_TN_9677,0.364501
GemmTunableOp_Half_TN,tn_4096_1875_7168,Gemm_Hipblaslt_TN_9645,0.206632
GemmTunableOp_Half_TN,tn_4096_7240_2048,Gemm_Hipblaslt_TN_9956,0.20792
GemmTunableOp_Half_TN,tn_4096_1573_7168,Gemm_Hipblaslt_TN_9587,0.179804
GemmTunableOp_Half_TN,tn_3072_1798_4096,Gemm_Rocblas_621294520,0.0915057
GemmTunableOp_Half_TN,tn_14336_136_4096,Gemm_Hipblaslt_TN_9312,0.052899
GemmTunableOp_Half_TN,tn_64128_140_4096,Gemm_Hipblaslt_TN_9108,0.220229
GemmTunableOp_Half_TN,tn_4096_1643_7168,Gemm_Hipblaslt_TN_9359,0.182264
GemmTunableOp_Half_TN,tn_14336_1853_4096,Gemm_Hipblaslt_TN_9697,0.366795
GemmTunableOp_Half_TN,tn_14336_3501_4096,Gemm_Hipblaslt_TN_9217,0.646963
GemmTunableOp_Half_TN,tn_64128_123_4096,Gemm_Hipblaslt_TN_9596,0.199902
GemmTunableOp_Half_TN,tn_3072_1648_4096,Gemm_Hipblaslt_TN_9322,0.0889631
GemmTunableOp_Half_TN,tn_3072_1820_4096,Gemm_Hipblaslt_TN_9322,0.0918362
GemmTunableOp_Half_TN,tn_14336_1728_4096,Gemm_Hipblaslt_TN_9109,0.353468
GemmTunableOp_Half_TN,tn_14336_1593_4096,Gemm_Hipblaslt_TN_9690,0.324226
GemmTunableOp_Half_TN,tn_4096_3515_2048,Gemm_Hipblaslt_TN_9696,0.103152
GemmTunableOp_Half_TN,tn_4096_1590_7168,Gemm_Hipblaslt_TN_9679,0.180416
GemmTunableOp_Half_TN,tn_4096_1935_2048,Gemm_Hipblaslt_TN_9590,0.0649035
GemmTunableOp_Half_TN,tn_4096_176_2048,Gemm_Rocblas_621294556,0.0139332
GemmTunableOp_Half_TN,tn_3072_1883_4096,Gemm_Hipblaslt_TN_9613,0.0940483
GemmTunableOp_Half_TN,tn_4096_1790_7168,Gemm_Hipblaslt_TN_9136,0.199654
GemmTunableOp_Half_TN,tn_4096_6721_2048,Gemm_Hipblaslt_TN_9743,0.199404
GemmTunableOp_Half_TN,tn_64128_33_4096,Gemm_Hipblaslt_TN_9097,0.162734
GemmTunableOp_Half_TN,tn_4096_7171_7168,Gemm_Hipblaslt_TN_9221,0.678199
GemmTunableOp_Half_TN,tn_64128_100_4096,Gemm_Rocblas_621286396,0.197085
GemmTunableOp_Half_TN,tn_3072_104_4096,Gemm_Rocblas_621286438,0.0147354
GemmTunableOp_Half_TN,tn_14336_1763_4096,Gemm_Hipblaslt_TN_9677,0.362039
GemmTunableOp_Half_TN,tn_14336_3438_4096,Gemm_Rocblas_621294484,0.642801
GemmTunableOp_Half_TN,tn_4096_1807_7168,Gemm_Hipblaslt_TN_9267,0.2021
GemmTunableOp_Half_TN,tn_4096_7340_2048,Gemm_Hipblaslt_TN_9191,0.220825
GemmTunableOp_Half_TN,tn_4096_6744_2048,Gemm_Hipblaslt_TN_9743,0.201961
GemmTunableOp_Half_TN,tn_4096_5498_2048,Gemm_Hipblaslt_TN_9709,0.171247
GemmTunableOp_Half_TN,tn_64128_210_4096,Gemm_Rocblas_621286791,0.284085
GemmTunableOp_Half_TN,tn_4096_3410_2048,Gemm_Hipblaslt_TN_9692,0.10054
GemmTunableOp_Half_TN,tn_6144_232_4096,Gemm_Hipblaslt_TN_9495,0.0341704
GemmTunableOp_Half_TN,tn_14336_1628_4096,Gemm_Hipblaslt_TN_9793,0.351408
GemmTunableOp_Half_TN,tn_4096_1824_7168,Gemm_Hipblaslt_TN_9268,0.203551
GemmTunableOp_Half_TN,tn_4096_1706_2048,Gemm_Hipblaslt_TN_9588,0.0583705
GemmTunableOp_Half_TN,tn_64128_152_4096,Gemm_Hipblaslt_TN_9108,0.223399
GemmTunableOp_Half_TN,tn_4096_1981_2048,Gemm_Hipblaslt_TN_9137,0.0658921
GemmTunableOp_Half_TN,tn_14336_3427_4096,Gemm_Rocblas_621294330,0.651556
GemmTunableOp_Half_TN,tn_14336_1725_4096,Gemm_Hipblaslt_TN_9139,0.354878
GemmTunableOp_Half_TN,tn_4096_5723_7168,Gemm_Hipblaslt_TN_9672,0.563878
GemmTunableOp_Half_TN,tn_14336_1934_4096,Gemm_Hipblaslt_TN_9217,0.39642
GemmTunableOp_Half_TN,tn_64128_160_4096,Gemm_Rocblas_621294354,0.221847
GemmTunableOp_Half_TN,tn_14336_1978_4096,Gemm_Hipblaslt_TN_9217,0.396781
GemmTunableOp_Half_TN,tn_3072_3416_4096,Gemm_Rocblas_621294495,0.152583
GemmTunableOp_Half_TN,tn_14336_5273_4096,Gemm_Hipblaslt_TN_9223,1.03835
GemmTunableOp_Half_TN,tn_4096_3920_2048,Gemm_Rocblas_621294030,0.114668
GemmTunableOp_Half_TN,tn_4096_216_7168,Gemm_Rocblas_621286445,0.0434093
GemmTunableOp_Half_TN,tn_3072_1961_4096,Gemm_Hipblaslt_TN_9633,0.0998982
GemmTunableOp_Half_TN,tn_4096_1961_7168,Gemm_Hipblaslt_TN_9267,0.20867
GemmTunableOp_Half_TN,tn_4096_1666_2048,Gemm_Hipblaslt_TN_9359,0.0569481
GemmTunableOp_Half_TN,tn_14336_1898_4096,Gemm_Hipblaslt_TN_9697,0.369371
GemmTunableOp_Half_TN,tn_14336_6744_4096,Gemm_Rocblas_621294484,1.28934
GemmTunableOp_Half_TN,tn_4096_5267_7168,Gemm_Hipblaslt_TN_9687,0.53809
GemmTunableOp_Half_TN,tn_4096_7130_2048,Gemm_Hipblaslt_TN_9188,0.208393
GemmTunableOp_Half_TN,tn_4096_1892_7168,Gemm_Hipblaslt_TN_9645,0.21052
GemmTunableOp_Half_TN,tn_4096_6788_2048,Gemm_Hipblaslt_TN_9696,0.201959
GemmTunableOp_Half_TN,tn_64128_49_4096,Gemm_Hipblaslt_TN_9097,0.166477
GemmTunableOp_Half_TN,tn_14336_6902_4096,Gemm_Hipblaslt_TN_9815,1.3057
GemmTunableOp_Half_TN,tn_14336_1665_4096,Gemm_Hipblaslt_TN_9697,0.353522
GemmTunableOp_Half_TN,tn_4096_3780_7168,Gemm_Hipblaslt_TN_9827,0.360386
GemmTunableOp_Half_TN,tn_14336_1924_4096,Gemm_Hipblaslt_TN_9217,0.394599
GemmTunableOp_Half_TN,tn_14336_1663_4096,Gemm_Hipblaslt_TN_9677,0.354279
GemmTunableOp_Half_TN,tn_4096_1786_2048,Gemm_Hipblaslt_TN_9136,0.062668
GemmTunableOp_Half_TN,tn_4096_1663_7168,Gemm_Hipblaslt_TN_9164,0.182241
GemmTunableOp_Half_TN,tn_64128_236_4096,Gemm_Hipblaslt_TN_9122,0.293533
GemmTunableOp_Half_TN,tn_3072_3547_4096,Gemm_Hipblaslt_TN_9619,0.155801
GemmTunableOp_Half_TN,tn_14336_6708_4096,Gemm_Hipblaslt_TN_9827,1.28
GemmTunableOp_Half_TN,tn_4096_7267_7168,Gemm_Hipblaslt_TN_9743,0.672912
GemmTunableOp_Half_TN,tn_14336_7325_4096,Gemm_Hipblaslt_TN_9900,1.42111
GemmTunableOp_Half_TN,tn_14336_1840_4096,Gemm_Hipblaslt_TN_9697,0.366382
GemmTunableOp_Half_TN,tn_64128_198_4096,Gemm_Hipblaslt_TN_9260,0.274491
GemmTunableOp_Half_TN,tn_64128_213_4096,Gemm_Hipblaslt_TN_9271,0.279087
GemmTunableOp_Half_TN,tn_14336_8_4096,Gemm_Rocblas_621286317,0.0234695
GemmTunableOp_Half_TN,tn_64128_172_4096,Gemm_Hipblaslt_TN_9956,0.252187
GemmTunableOp_Half_TN,tn_64128_104_4096,Gemm_Rocblas_621286396,0.199351
GemmTunableOp_Half_TN,tn_4096_1825_2048,Gemm_Hipblaslt_TN_9590,0.0625375
GemmTunableOp_Half_TN,tn_14336_7439_4096,Gemm_Hipblaslt_TN_159,1.43339
GemmTunableOp_Half_TN,tn_14336_5410_4096,Gemm_Rocblas_621286750,1.05138
GemmTunableOp_Half_TN,tn_14336_1807_4096,Gemm_Hipblaslt_TN_9697,0.367826
GemmTunableOp_Half_TN,tn_3072_7072_4096,Gemm_Hipblaslt_TN_9688,0.304859
GemmTunableOp_Half_TN,tn_64128_177_4096,Gemm_Hipblaslt_TN_9940,0.246421
GemmTunableOp_Half_TN,tn_4096_7345_2048,Gemm_Hipblaslt_TN_9655,0.218609
GemmTunableOp_Half_TN,tn_3072_1699_4096,Gemm_Hipblaslt_TN_9561,0.0871525
GemmTunableOp_Half_TN,tn_4096_3400_7168,Gemm_Hipblaslt_TN_9695,0.330321
GemmTunableOp_Half_TN,tn_64128_89_4096,Gemm_Hipblaslt_TN_9057,0.182846
GemmTunableOp_Half_TN,tn_3072_3219_4096,Gemm_Hipblaslt_TN_9619,0.150137
GemmTunableOp_Half_TN,tn_4096_1733_2048,Gemm_Hipblaslt_TN_9136,0.0619064
GemmTunableOp_Half_TN,tn_4096_3420_7168,Gemm_Hipblaslt_TN_9743,0.330189
GemmTunableOp_Half_TN,tn_4096_4000_2048,Gemm_Rocblas_621286281,0.117405
GemmTunableOp_Half_TN,tn_4096_1614_7168,Gemm_Hipblaslt_TN_9359,0.179685
GemmTunableOp_Half_TN,tn_4096_1628_2048,Gemm_Hipblaslt_TN_9164,0.0561463
GemmTunableOp_Half_TN,tn_64128_69_4096,Gemm_Hipblaslt_TN_9057,0.180302
GemmTunableOp_Half_TN,tn_4096_5470_7168,Gemm_Hipblaslt_TN_9690,0.54385
GemmTunableOp_Half_TN,tn_4096_3595_2048,Gemm_Hipblaslt_TN_9896,0.103939
GemmTunableOp_Half_TN,tn_4096_3383_7168,Gemm_Hipblaslt_TN_9694,0.330462
GemmTunableOp_Half_TN,tn_64128_44_4096,Gemm_Hipblaslt_TN_9144,0.158692
GemmTunableOp_Half_TN,tn_14336_3652_4096,Gemm_Hipblaslt_TN_9677,0.731762
GemmTunableOp_Half_TN,tn_64128_189_4096,Gemm_Hipblaslt_TN_9862,0.255901
GemmTunableOp_Half_TN,tn_4096_232_5504,Gemm_Rocblas_621286443,0.035078
GemmTunableOp_Half_TN,tn_4096_1786_7168,Gemm_Hipblaslt_TN_9136,0.199632
GemmTunableOp_Half_TN,tn_3072_3652_4096,Gemm_Hipblaslt_TN_9672,0.162463
GemmTunableOp_Half_TN,tn_4096_1609_2048,Gemm_Hipblaslt_TN_9164,0.056255
GemmTunableOp_Half_TN,tn_3072_6965_4096,Gemm_Hipblaslt_TN_9681,0.301451
GemmTunableOp_Half_TN,tn_14336_1854_4096,Gemm_Hipblaslt_TN_9697,0.370354
GemmTunableOp_Half_TN,tn_4096_7023_2048,Gemm_Hipblaslt_TN_9694,0.204855
GemmTunableOp_Half_TN,tn_4096_1636_7168,Gemm_Hipblaslt_TN_9587,0.178639
GemmTunableOp_Half_TN,tn_4096_1752_7168,Gemm_Hipblaslt_TN_9673,0.197403
GemmTunableOp_Half_TN,tn_64128_227_4096,Gemm_Hipblaslt_TN_9122,0.28853
GemmTunableOp_Half_TN,tn_4096_232_2048,Gemm_Rocblas_621294167,0.0143984
GemmTunableOp_Half_TN,tn_64128_117_4096,Gemm_Rocblas_621294105,0.20458
GemmTunableOp_Half_TN,tn_3072_1588_4096,Gemm_Hipblaslt_TN_9561,0.0848318
GemmTunableOp_Half_TN,tn_64128_25_4096,Gemm_Rocblas_621294578,0.147244
GemmTunableOp_Half_TN,tn_4096_3578_2048,Gemm_Hipblaslt_TN_9683,0.102619
GemmTunableOp_Half_TN,tn_14336_1967_4096,Gemm_Hipblaslt_TN_9220,0.395764
GemmTunableOp_Half_TN,tn_4096_1850_7168,Gemm_Hipblaslt_TN_9136,0.204117
GemmTunableOp_Half_TN,tn_14336_3404_4096,Gemm_Hipblaslt_TN_9220,0.650538
GemmTunableOp_Half_TN,tn_4096_7136_2048,Gemm_Hipblaslt_TN_9743,0.207919
GemmTunableOp_Half_TN,tn_14336_5723_4096,Gemm_Rocblas_621294492,1.08027
GemmTunableOp_Half_TN,tn_4096_7120_7168,Gemm_Hipblaslt_TN_9743,0.672899
GemmTunableOp_Half_TN,tn_4096_1760_2048,Gemm_Hipblaslt_TN_9329,0.0617585
GemmTunableOp_Half_TN,tn_3072_3557_4096,Gemm_Rocblas_621294495,0.157527
GemmTunableOp_Half_TN,tn_4096_1627_2048,Gemm_Hipblaslt_TN_9164,0.0563463
GemmTunableOp_Half_TN,tn_14336_1623_4096,Gemm_Hipblaslt_TN_9677,0.349514
GemmTunableOp_Half_TN,tn_14336_1655_4096,Gemm_Hipblaslt_TN_9697,0.352159
GemmTunableOp_Half_TN,tn_14336_1765_4096,Gemm_Hipblaslt_TN_9677,0.361752
GemmTunableOp_Half_TN,tn_3072_1698_4096,Gemm_Hipblaslt_TN_9561,0.088093
GemmTunableOp_Half_TN,tn_4096_7439_2048,Gemm_Hipblaslt_TN_9655,0.221996
GemmTunableOp_Half_TN,tn_4096_5381_2048,Gemm_Hipblaslt_TN_9690,0.170602
GemmTunableOp_Half_TN,tn_3072_5465_4096,Gemm_Hipblaslt_TN_9725,0.223781
GemmTunableOp_Half_TN,tn_4096_5359_2048,Gemm_Hipblaslt_TN_9799,0.169117
GemmTunableOp_Half_TN,tn_14336_5204_4096,Gemm_Rocblas_621294330,1.02676
GemmTunableOp_Half_TN,tn_64128_81_4096,Gemm_Hipblaslt_TN_9057,0.180847
GemmTunableOp_Half_TN,tn_14336_1642_4096,Gemm_Hipblaslt_TN_9697,0.351771
GemmTunableOp_Half_TN,tn_4096_1605_2048,Gemm_Hipblaslt_TN_9607,0.0552418
GemmTunableOp_Half_TN,tn_64128_131_4096,Gemm_Hipblaslt_TN_9799,0.214925
GemmTunableOp_Half_TN,tn_64128_9_4096,Gemm_Rocblas_621286325,0.142634
GemmTunableOp_Half_TN,tn_4096_48_7168,Gemm_Rocblas_621286419,0.0187797
GemmTunableOp_Half_TN,tn_3072_3584_4096,Gemm_Rocblas_621286753,0.156708
GemmTunableOp_Half_TN,tn_14336_5605_4096,Gemm_Rocblas_621286742,1.07367
GemmTunableOp_Half_TN,tn_64128_252_4096,Gemm_Rocblas_621286915,0.298364
GemmTunableOp_Half_TN,tn_11008_4000_4096,Gemm_Hipblaslt_TN_9832,0.632769
GemmTunableOp_Half_TN,tn_64128_165_4096,Gemm_Hipblaslt_TN_9661,0.249142
GemmTunableOp_Half_TN,tn_3072_6841_4096,Gemm_Hipblaslt_TN_9681,0.295128
GemmTunableOp_Half_TN,tn_3072_3583_4096,Gemm_Rocblas_621294495,0.157367
GemmTunableOp_Half_TN,tn_4096_1799_2048,Gemm_Hipblaslt_TN_9268,0.06408
GemmTunableOp_Half_TN,tn_4096_1660_2048,Gemm_Hipblaslt_TN_9671,0.0567444
GemmTunableOp_Half_TN,tn_4096_1935_7168,Gemm_Hipblaslt_TN_9134,0.209291
GemmTunableOp_Half_TN,tn_3072_1889_4096,Gemm_Hipblaslt_TN_9613,0.0934301
GemmTunableOp_Half_TN,tn_14336_7171_4096,Gemm_Hipblaslt_TN_9677,1.36945
GemmTunableOp_Half_TN,tn_64128_204_4096,Gemm_Hipblaslt_TN_9768,0.272718
GemmTunableOp_Half_TN,tn_4096_1652_2048,Gemm_Hipblaslt_TN_9164,0.0570484
GemmTunableOp_Half_TN,tn_3072_7248_4096,Gemm_Hipblaslt_TN_9681,0.307489
GemmTunableOp_Half_TN,tn_64128_176_4096,Gemm_Hipblaslt_TN_9816,0.251385
GemmTunableOp_Half_TN,tn_4096_1872_2048,Gemm_Hipblaslt_TN_9590,0.0628171
GemmTunableOp_Half_TN,tn_4096_1719_7168,Gemm_Hipblaslt_TN_9265,0.184866
GemmTunableOp_Half_TN,tn_64128_170_4096,Gemm_Hipblaslt_TN_9857,0.251302
GemmTunableOp_Half_TN,tn_4096_1721_2048,Gemm_Hipblaslt_TN_9588,0.0581942
GemmTunableOp_Half_TN,tn_3072_1691_4096,Gemm_Hipblaslt_TN_9561,0.0882422
GemmTunableOp_Half_TN,tn_14336_6916_4096,Gemm_Rocblas_621294492,1.2975
GemmTunableOp_Half_TN,tn_14336_1961_4096,Gemm_Hipblaslt_TN_9223,0.398641
GemmTunableOp_Half_TN,tn_14336_3420_4096,Gemm_Hipblaslt_TN_9220,0.640699
GemmTunableOp_Half_TN,tn_64128_39_4096,Gemm_Rocblas_621286821,0.1604
GemmTunableOp_Half_TN,tn_64128_154_4096,Gemm_Hipblaslt_TN_9108,0.225788
GemmTunableOp_Half_TN,tn_4096_3501_7168,Gemm_Hipblaslt_TN_9187,0.331654
GemmTunableOp_Half_TN,tn_4096_80_2048,Gemm_Rocblas_621286280,0.00901668
GemmTunableOp_Half_TN,tn_64128_98_4096,Gemm_Rocblas_621294105,0.197811
GemmTunableOp_Half_TN,tn_3072_1802_4096,Gemm_Hipblaslt_TN_9613,0.0926882
GemmTunableOp_Half_TN,tn_4096_6860_2048,Gemm_Hipblaslt_TN_9857,0.202241
GemmTunableOp_Half_TN,tn_3072_1593_4096,Gemm_Hipblaslt_TN_9561,0.0846414
GemmTunableOp_Half_TN,tn_4096_5465_2048,Gemm_Hipblaslt_TN_9690,0.172177
GemmTunableOp_Half_TN,tn_14336_5354_4096,Gemm_Hipblaslt_TN_9933,1.03866
GemmTunableOp_Half_TN,tn_14336_1745_4096,Gemm_Hipblaslt_TN_9793,0.362137
GemmTunableOp_Half_TN,tn_14336_5381_4096,Gemm_Hipblaslt_TN_9749,1.05554
GemmTunableOp_Half_TN,tn_64128_206_4096,Gemm_Hipblaslt_TN_9898,0.277531
GemmTunableOp_Half_TN,tn_14336_1752_4096,Gemm_Hipblaslt_TN_9677,0.361681
GemmTunableOp_Half_TN,tn_4096_128_7168,Gemm_Rocblas_621286438,0.0282642
GemmTunableOp_Half_TN,tn_3072_1842_4096,Gemm_Hipblaslt_TN_9324,0.0910971
GemmTunableOp_Half_TN,tn_4096_1588_2048,Gemm_Hipblaslt_TN_9587,0.0546176
GemmTunableOp_Half_TN,tn_14336_1872_4096,Gemm_Hipblaslt_TN_9697,0.371395
GemmTunableOp_Half_TN,tn_4096_6868_2048,Gemm_Hipblaslt_TN_9743,0.204149
GemmTunableOp_Half_TN,tn_3072_1690_4096,Gemm_Rocblas_621294520,0.0895799
GemmTunableOp_Half_TN,tn_4096_7027_2048,Gemm_Hipblaslt_TN_9743,0.204233
GemmTunableOp_Half_TN,tn_4096_1658_2048,Gemm_Hipblaslt_TN_9607,0.0565172
GemmTunableOp_Half_TN,tn_14336_1823_4096,Gemm_Hipblaslt_TN_9677,0.368677
GemmTunableOp_Half_TN,tn_4096_1642_2048,Gemm_Hipblaslt_TN_9607,0.0551336
GemmTunableOp_Half_TN,tn_4096_3562_2048,Gemm_Hipblaslt_TN_9896,0.103236
GemmTunableOp_Half_TN,tn_14336_7344_4096,Gemm_Hipblaslt_TN_9961,1.41014
GemmTunableOp_Half_TN,tn_4096_3383_2048,Gemm_Hipblaslt_TN_9896,0.101111
GemmTunableOp_Half_TN,tn_14336_6996_4096,Gemm_Hipblaslt_TN_159,1.28638
GemmTunableOp_Half_TN,tn_4096_3589_2048,Gemm_Hipblaslt_TN_9896,0.104503
GemmTunableOp_Half_TN,tn_4096_1892_2048,Gemm_Hipblaslt_TN_9590,0.0644126
GemmTunableOp_Half_TN,tn_4096_1623_2048,Gemm_Hipblaslt_TN_9607,0.0556524
GemmTunableOp_Half_TN,tn_14336_1859_4096,Gemm_Hipblaslt_TN_9697,0.367369
GemmTunableOp_Half_TN,tn_4096_1838_7168,Gemm_Hipblaslt_TN_9268,0.202375
GemmTunableOp_Half_TN,tn_14336_1722_4096,Gemm_Hipblaslt_TN_9697,0.35528
GemmTunableOp_Half_TN,tn_3072_3651_4096,Gemm_Hipblaslt_TN_9799,0.163188
GemmTunableOp_Half_TN,tn_14336_7340_4096,Gemm_Hipblaslt_TN_9900,1.41934
GemmTunableOp_Half_TN,tn_64128_171_4096,Gemm_Hipblaslt_TN_9694,0.243667
GemmTunableOp_Half_TN,tn_14336_7136_4096,Gemm_Hipblaslt_TN_9933,1.30848
GemmTunableOp_Half_TN,tn_14336_5427_4096,Gemm_Rocblas_621294492,1.0521
GemmTunableOp_Half_TN,tn_4096_1909_2048,Gemm_Hipblaslt_TN_9590,0.0648592
GemmTunableOp_Half_TN,tn_3072_1864_4096,Gemm_Hipblaslt_TN_9133,0.09337
GemmTunableOp_Half_TN,tn_4096_6630_2048,Gemm_Hipblaslt_TN_9798,0.198682
GemmTunableOp_Half_TN,tn_14336_1738_4096,Gemm_Hipblaslt_TN_9697,0.36015
GemmTunableOp_Half_TN,tn_4096_3652_7168,Gemm_Hipblaslt_TN_9217,0.353628
GemmTunableOp_Half_TN,tn_4096_3573_7168,Gemm_Hipblaslt_TN_9683,0.336223
GemmTunableOp_Half_TN,tn_4096_1713_2048,Gemm_Hipblaslt_TN_9616,0.0561283
GemmTunableOp_Half_TN,tn_4096_1970_2048,Gemm_Hipblaslt_TN_9136,0.0648164
GemmTunableOp_Half_TN,tn_4096_3497_2048,Gemm_Hipblaslt_TN_9683,0.103088
GemmTunableOp_Half_TN,tn_3072_3791_4096,Gemm_Hipblaslt_TN_9852,0.164323
GemmTunableOp_Half_TN,tn_4096_7191_2048,Gemm_Hipblaslt_TN_9694,0.208115
GemmTunableOp_Half_TN,tn_4096_1772_7168,Gemm_Hipblaslt_TN_9645,0.199016
GemmTunableOp_Half_TN,tn_4096_1847_7168,Gemm_Hipblaslt_TN_9268,0.20284
GemmTunableOp_Half_TN,tn_4096_1859_7168,Gemm_Hipblaslt_TN_9645,0.204893
GemmTunableOp_Half_TN,tn_4096_6965_2048,Gemm_Hipblaslt_TN_9814,0.205117
GemmTunableOp_Half_TN,tn_3072_1764_4096,Gemm_Rocblas_621294520,0.0915781
GemmTunableOp_Half_TN,tn_14336_5412_4096,Gemm_Rocblas_621294492,1.05005
GemmTunableOp_Half_TN,tn_4096_1842_2048,Gemm_Hipblaslt_TN_9645,0.0630902
GemmTunableOp_Half_TN,tn_4096_1894_7168,Gemm_Hipblaslt_TN_9645,0.206302
GemmTunableOp_Half_TN,tn_3072_3706_4096,Gemm_Hipblaslt_TN_9852,0.161712
GemmTunableOp_Half_TN,tn_14336_1780_4096,Gemm_Hipblaslt_TN_9793,0.36311
GemmTunableOp_Half_TN,tn_3072_40_4096,Gemm_Rocblas_621294058,0.0102041
GemmTunableOp_Half_TN,tn_4096_1625_2048,Gemm_Hipblaslt_TN_9671,0.0565474
GemmTunableOp_Half_TN,tn_14336_1802_4096,Gemm_Hipblaslt_TN_9697,0.365737
GemmTunableOp_Half_TN,tn_14336_1686_4096,Gemm_Hipblaslt_TN_9189,0.354305
GemmTunableOp_Half_TN,tn_14336_1610_4096,Gemm_Hipblaslt_TN_9677,0.350072
GemmTunableOp_Half_TN,tn_64128_199_4096,Gemm_Hipblaslt_TN_9260,0.275409
GemmTunableOp_Half_TN,tn_4096_3507_2048,Gemm_Hipblaslt_TN_9828,0.10434
GemmTunableOp_Half_TN,tn_4096_1930_7168,Gemm_Hipblaslt_TN_9136,0.208595
GemmTunableOp_Half_TN,tn_3072_6901_4096,Gemm_Hipblaslt_TN_9681,0.297274
GemmTunableOp_Half_TN,tn_14336_1682_4096,Gemm_Hipblaslt_TN_9793,0.35381
GemmTunableOp_Half_TN,tn_3072_7240_4096,Gemm_Hipblaslt_TN_9681,0.309599
GemmTunableOp_Half_TN,tn_14336_7478_4096,Gemm_Hipblaslt_TN_9888,1.45316
GemmTunableOp_Half_TN,tn_3072_5204_4096,Gemm_Hipblaslt_TN_9710,0.211982
GemmTunableOp_Half_TN,tn_4096_104_7168,Gemm_Rocblas_621286438,0.0271982
GemmTunableOp_Half_TN,tn_4096_1858_7168,Gemm_Hipblaslt_TN_9645,0.205773
GemmTunableOp_Half_TN,tn_3072_64_4096,Gemm_Rocblas_621286333,0.012286
GemmTunableOp_Half_TN,tn_3072_48_4096,Gemm_Rocblas_621286419,0.0102016
GemmTunableOp_Half_TN,tn_4096_256_2048,Gemm_Rocblas_621294173,0.0145261
GemmTunableOp_Half_TN,tn_14336_3588_4096,Gemm_Hipblaslt_TN_9192,0.728606
GemmTunableOp_Half_TN,tn_14336_1596_4096,Gemm_Hipblaslt_TN_9691,0.325697
GemmTunableOp_Half_TN,tn_3072_1879_4096,Gemm_Hipblaslt_TN_9613,0.0937141
GemmTunableOp_Half_TN,tn_3072_3515_4096,Gemm_Hipblaslt_TN_9629,0.156998
GemmTunableOp_Half_TN,tn_14336_1771_4096,Gemm_Hipblaslt_TN_9677,0.360652
GemmTunableOp_Half_TN,tn_14336_5322_4096,Gemm_Hipblaslt_TN_9217,1.04491
GemmTunableOp_Half_TN,tn_64128_37_4096,Gemm_Hipblaslt_TN_9097,0.163303
GemmTunableOp_Half_TN,tn_4096_5100_7168,Gemm_Hipblaslt_TN_9681,0.519358
GemmTunableOp_Half_TN,tn_64128_126_4096,Gemm_Hipblaslt_TN_9596,0.199261
GemmTunableOp_Half_TN,tn_4096_1728_7168,Gemm_Hipblaslt_TN_9679,0.184101
GemmTunableOp_Half_TN,tn_4096_1873_2048,Gemm_Hipblaslt_TN_9590,0.0630018
GemmTunableOp_Half_TN,tn_14336_1869_4096,Gemm_Hipblaslt_TN_9697,0.368659
GemmTunableOp_Half_TN,tn_3072_1863_4096,Gemm_Hipblaslt_TN_9561,0.0932552
GemmTunableOp_Half_TN,tn_4096_4000_5504,Gemm_Rocblas_621294030,0.291563
GemmTunableOp_Half_TN,tn_4096_3514_2048,Gemm_Hipblaslt_TN_9896,0.102288
GemmTunableOp_Half_TN,tn_64128_63_4096,Gemm_Hipblaslt_TN_9097,0.161535
GemmTunableOp_Half_TN,tn_4096_5465_7168,Gemm_Hipblaslt_TN_9672,0.553664
GemmTunableOp_Half_TN,tn_3072_7484_4096,Gemm_Hipblaslt_TN_9687,0.329818
GemmTunableOp_Half_TN,tn_14336_7050_4096,Gemm_Hipblaslt_TN_159,1.29665
GemmTunableOp_Half_TN,tn_3072_7050_4096,Gemm_Hipblaslt_TN_9681,0.307322
GemmTunableOp_Half_TN,tn_14336_1646_4096,Gemm_Hipblaslt_TN_9677,0.347641
GemmTunableOp_Half_TN,tn_4096_1867_2048,Gemm_Hipblaslt_TN_9590,0.0651722
GemmTunableOp_Half_TN,tn_4096_1854_2048,Gemm_Hipblaslt_TN_9590,0.0627793
GemmTunableOp_Half_TN,tn_14336_7196_4096,Gemm_Hipblaslt_TN_9677,1.36229
GemmTunableOp_Half_TN,tn_4096_1828_7168,Gemm_Hipblaslt_TN_9268,0.202946
GemmTunableOp_Half_TN,tn_4096_1690_7168,Gemm_Hipblaslt_TN_9265,0.182491
GemmTunableOp_Half_TN,tn_4096_1928_7168,Gemm_Hipblaslt_TN_9134,0.209463
GemmTunableOp_Half_TN,tn_3072_6979_4096,Gemm_Hipblaslt_TN_9619,0.301471
GemmTunableOp_Half_TN,tn_4096_1623_7168,Gemm_Hipblaslt_TN_9587,0.178347
GemmTunableOp_Half_TN,tn_4096_1781_2048,Gemm_Hipblaslt_TN_9590,0.0631328
GemmTunableOp_Half_TN,tn_4096_6976_2048,Gemm_Hipblaslt_TN_9814,0.203016
GemmTunableOp_Half_TN,tn_4096_6965_7168,Gemm_Hipblaslt_TN_9694,0.664181
GemmTunableOp_Half_TN,tn_4096_5735_7168,Gemm_Hipblaslt_TN_9672,0.561936
GemmTunableOp_Half_TN,tn_4096_3300_2048,Gemm_Hipblaslt_TN_9896,0.0995994
GemmTunableOp_Half_TN,tn_3072_1711_4096,Gemm_Hipblaslt_TN_9561,0.0880982
GemmTunableOp_Half_TN,tn_3072_168_4096,Gemm_Rocblas_621286436,0.0184197
GemmTunableOp_Half_TN,tn_4096_7139_2048,Gemm_Hipblaslt_TN_9743,0.205354
GemmTunableOp_Half_TN,tn_4096_1711_2048,Gemm_Hipblaslt_TN_9607,0.0574405
GemmTunableOp_Half_TN,tn_14336_7248_4096,Gemm_Hipblaslt_TN_9697,1.37099
GemmTunableOp_Half_TN,tn_3072_1586_4096,Gemm_Hipblaslt_TN_9561,0.0829879
GemmTunableOp_Half_TN,tn_4096_1603_2048,Gemm_Hipblaslt_TN_9607,0.0556179
GemmTunableOp_Half_TN,tn_4096_7033_2048,Gemm_Hipblaslt_TN_9696,0.204755
GemmTunableOp_Half_TN,tn_14336_1936_4096,Gemm_Hipblaslt_TN_9217,0.391752
GemmTunableOp_Half_TN,tn_4096_3586_2048,Gemm_Hipblaslt_TN_9896,0.103269
GemmTunableOp_Half_TN,tn_4096_5530_7168,Gemm_Hipblaslt_TN_9799,0.55667
GemmTunableOp_Half_TN,tn_3072_1742_4096,Gemm_Hipblaslt_TN_9148,0.0908779
GemmTunableOp_Half_TN,tn_3072_7077_4096,Gemm_Hipblaslt_TN_9681,0.304701
GemmTunableOp_Half_TN,tn_3072_1771_4096,Gemm_Rocblas_621294520,0.0901396
GemmTunableOp_Half_TN,tn_4096_7109_2048,Gemm_Hipblaslt_TN_9743,0.205206
GemmTunableOp_Half_TN,tn_3072_5723_4096,Gemm_Hipblaslt_TN_9624,0.256471
GemmTunableOp_Half_TN,tn_14336_1862_4096,Gemm_Hipblaslt_TN_9697,0.369396
GemmTunableOp_Half_TN,tn_4096_5354_2048,Gemm_Hipblaslt_TN_9709,0.169332
GemmTunableOp_Half_TN,tn_3072_16_4096,Gemm_Rocblas_621294136,0.00832845
GemmTunableOp_Half_TN,tn_4096_1948_2048,Gemm_Hipblaslt_TN_9620,0.0660515
GemmTunableOp_Half_TN,tn_14336_1637_4096,Gemm_Hipblaslt_TN_9677,0.349606
GemmTunableOp_Half_TN,tn_3072_1637_4096,Gemm_Hipblaslt_TN_9322,0.0888851
GemmTunableOp_Half_TN,tn_3072_6800_4096,Gemm_Hipblaslt_TN_9681,0.294641
GemmTunableOp_Half_TN,tn_3072_1890_4096,Gemm_Hipblaslt_TN_9613,0.0940995
GemmTunableOp_Half_TN,tn_3072_3507_4096,Gemm_Rocblas_621294495,0.155257
GemmTunableOp_Half_TN,tn_14336_5223_4096,Gemm_Hipblaslt_TN_9888,1.02523
GemmTunableOp_Half_TN,tn_4096_1725_2048,Gemm_Hipblaslt_TN_9588,0.05831
GemmTunableOp_Half_TN,tn_4096_88_7168,Gemm_Hipblaslt_TN_9440,0.0239462
GemmTunableOp_Half_TN,tn_14336_240_4096,Gemm_Hipblaslt_TN_9252,0.067943
GemmTunableOp_Half_TN,tn_14336_1731_4096,Gemm_Hipblaslt_TN_9187,0.359791
GemmTunableOp_Half_TN,tn_4096_5413_2048,Gemm_Hipblaslt_TN_9799,0.168916
GemmTunableOp_Half_TN,tn_3072_1957_4096,Gemm_Hipblaslt_TN_9633,0.0987809
GemmTunableOp_Half_TN,tn_14336_7186_4096,Gemm_Hipblaslt_TN_9677,1.37224
GemmTunableOp_Half_TN,tn_4096_16_2048,Gemm_Rocblas_621294047,0.00708299
GemmTunableOp_Half_TN,tn_14336_1784_4096,Gemm_Hipblaslt_TN_9697,0.362127
GemmTunableOp_Half_TN,tn_4096_1673_7168,Gemm_Hipblaslt_TN_9587,0.181752
GemmTunableOp_Half_TN,tn_4096_7345_7168,Gemm_Hipblaslt_TN_9768,0.705991
GemmTunableOp_Half_TN,tn_4096_3466_2048,Gemm_Hipblaslt_TN_9896,0.102028
GemmTunableOp_Half_TN,tn_4096_48_2048,Gemm_Rocblas_621286428,0.00794909
GemmTunableOp_Half_TN,tn_4096_1708_2048,Gemm_Hipblaslt_TN_9164,0.0584829
GemmTunableOp_Half_TN,tn_4096_120_7168,Gemm_Rocblas_621286438,0.0278448
GemmTunableOp_Half_TN,tn_4096_5271_7168,Gemm_Rocblas_621286666,0.53796
GemmTunableOp_Half_TN,tn_64128_12_4096,Gemm_Hipblaslt_TN_9094,0.144524
GemmTunableOp_Half_TN,tn_4096_7340_7168,Gemm_Hipblaslt_TN_9749,0.706448
GemmTunableOp_Half_TN,tn_3072_5359_4096,Gemm_Hipblaslt_TN_9933,0.212974
GemmTunableOp_Half_TN,tn_4096_1948_7168,Gemm_Hipblaslt_TN_9136,0.208574
GemmTunableOp_Half_TN,tn_14336_5533_4096,Gemm_Rocblas_621294484,1.0601
GemmTunableOp_Half_TN,tn_4096_8_7168,Gemm_Rocblas_621286312,0.0127727
GemmTunableOp_Half_TN,tn_64128_205_4096,Gemm_Hipblaslt_TN_9260,0.274809
GemmStridedBatchedTunableOp_Half_TN,tn_1744_1744_128_B_16,Gemm_Rocblas_621294110,0.0676056
GemmStridedBatchedTunableOp_Half_TN,tn_1878_1878_128_B_16,Gemm_Hipblaslt_TN_6929,0.080171
GemmStridedBatchedTunableOp_Half_TN,tn_1829_1829_128_B_16,Gemm_Hipblaslt_TN_6928,0.0781719
GemmStridedBatchedTunableOp_Half_TN,tn_1766_1766_128_B_16,Gemm_Rocblas_621286397,0.0737901
GemmStridedBatchedTunableOp_Half_TN,tn_1966_1966_128_B_16,Gemm_Hipblaslt_TN_6929,0.0861321
GemmStridedBatchedTunableOp_Half_TN,tn_1930_1930_128_B_16,Gemm_Hipblaslt_TN_6929,0.0834278
GemmStridedBatchedTunableOp_Half_TN,tn_1928_1928_128_B_16,Gemm_Hipblaslt_TN_150,0.0778104
GemmStridedBatchedTunableOp_Half_TN,tn_1944_1944_128_B_16,Gemm_Hipblaslt_TN_150,0.0785556
GemmStridedBatchedTunableOp_Half_TN,tn_1797_1797_128_B_16,Gemm_Rocblas_621286980,0.0780121
GemmStridedBatchedTunableOp_Half_TN,tn_1888_1888_128_B_16,Gemm_Rocblas_621286808,0.0733963
GemmStridedBatchedTunableOp_Half_TN,tn_1835_1835_128_B_16,Gemm_Hipblaslt_TN_6942,0.0800799
GemmStridedBatchedTunableOp_Half_TN,tn_1810_1810_128_B_16,Gemm_Rocblas_621294754,0.0773787
GemmStridedBatchedTunableOp_Half_TN,tn_1665_1665_128_B_16,Gemm_Rocblas_621286510,0.069292
GemmStridedBatchedTunableOp_Half_TN,tn_1634_1634_128_B_16,Gemm_Hipblaslt_TN_7483,0.0662904
GemmStridedBatchedTunableOp_Half_TN,tn_1876_1876_128_B_16,Gemm_Hipblaslt_TN_6942,0.0809802
GemmStridedBatchedTunableOp_Half_TN,tn_1683_1683_128_B_16,Gemm_Rocblas_621286413,0.070409
GemmStridedBatchedTunableOp_Half_TN,tn_1978_1978_128_B_16,Gemm_Hipblaslt_TN_6929,0.0861316
GemmStridedBatchedTunableOp_Half_TN,tn_1682_1682_128_B_16,Gemm_Rocblas_621286413,0.0692756
GemmStridedBatchedTunableOp_Half_TN,tn_1918_1918_128_B_16,Gemm_Hipblaslt_TN_6942,0.0832097
GemmStridedBatchedTunableOp_Half_TN,tn_1747_1747_128_B_16,Gemm_Rocblas_621286413,0.0729243
GemmStridedBatchedTunableOp_Half_TN,tn_1754_1754_128_B_16,Gemm_Rocblas_621294110,0.0726792
GemmStridedBatchedTunableOp_Half_TN,tn_1677_1677_128_B_16,Gemm_Rocblas_621294754,0.0680525
GemmStridedBatchedTunableOp_Half_TN,tn_1733_1733_128_B_16,Gemm_Rocblas_621286413,0.07231
GemmStridedBatchedTunableOp_Half_TN,tn_1633_1633_128_B_16,Gemm_Rocblas_621294754,0.0640879
GemmStridedBatchedTunableOp_Half_TN,tn_1855_1855_128_B_16,Gemm_Hipblaslt_TN_7483,0.0803658
GemmStridedBatchedTunableOp_Half_TN,tn_1846_1846_128_B_16,Gemm_Rocblas_621294754,0.0801226
GemmStridedBatchedTunableOp_Half_TN,tn_1896_1896_128_B_16,Gemm_Hipblaslt_TN_150,0.0770048
GemmStridedBatchedTunableOp_Half_TN,tn_1650_1650_128_B_16,Gemm_Hipblaslt_TN_7483,0.0651841
GemmStridedBatchedTunableOp_Half_TN,tn_1818_1818_128_B_16,Gemm_Rocblas_621294754,0.0771422
GemmStridedBatchedTunableOp_Half_TN,tn_1843_1843_128_B_16,Gemm_Hipblaslt_TN_7483,0.0790167
GemmStridedBatchedTunableOp_Half_TN,tn_1891_1891_128_B_16,Gemm_Hipblaslt_TN_7483,0.0818911
GemmStridedBatchedTunableOp_Half_TN,tn_1922_1922_128_B_16,Gemm_Rocblas_621294533,0.0847904
GemmStridedBatchedTunableOp_Half_TN,tn_1636_1636_128_B_16,Gemm_Hipblaslt_TN_7483,0.0654842
GemmStridedBatchedTunableOp_Half_TN,tn_1814_1814_128_B_16,Gemm_Rocblas_621294110,0.0787075
GemmStridedBatchedTunableOp_Half_TN,tn_1713_1713_128_B_16,Gemm_Hipblaslt_TN_7483,0.0702423
GemmStridedBatchedTunableOp_Half_TN,tn_1791_1791_128_B_16,Gemm_Rocblas_621286808,0.0751105
GemmStridedBatchedTunableOp_Half_TN,tn_1686_1686_128_B_16,Gemm_Rocblas_621294754,0.0660122
GemmStridedBatchedTunableOp_Half_TN,tn_1690_1690_128_B_16,Gemm_Rocblas_621286413,0.0689026
GemmStridedBatchedTunableOp_Half_TN,tn_1945_1945_128_B_16,Gemm_Hipblaslt_TN_6867,0.0862543
GemmStridedBatchedTunableOp_Half_TN,tn_1708_1708_128_B_16,Gemm_Rocblas_621294754,0.0659203
GemmStridedBatchedTunableOp_Half_TN,tn_1668_1668_128_B_16,Gemm_Rocblas_621294110,0.0672482
GemmStridedBatchedTunableOp_Half_TN,tn_1611_1611_128_B_16,Gemm_Rocblas_621294517,0.0665526
GemmStridedBatchedTunableOp_Half_TN,tn_1907_1907_128_B_16,Gemm_Hipblaslt_TN_6942,0.0822911
GemmStridedBatchedTunableOp_Half_TN,tn_1838_1838_128_B_16,Gemm_Hipblaslt_TN_6942,0.0795526
GemmStridedBatchedTunableOp_Half_TN,tn_1967_1967_128_B_16,Gemm_Hipblaslt_TN_6867,0.085975
GemmStridedBatchedTunableOp_Half_TN,tn_1654_1654_128_B_16,Gemm_Hipblaslt_TN_7483,0.0632583
GemmStridedBatchedTunableOp_Half_TN,tn_16_16_128_B_16,Default,0.00645167
GemmStridedBatchedTunableOp_Half_TN,tn_1661_1661_128_B_16,Gemm_Hipblaslt_TN_7483,0.0659103
GemmStridedBatchedTunableOp_Half_TN,tn_1812_1812_128_B_16,Gemm_Rocblas_621294110,0.0774352
GemmStridedBatchedTunableOp_Half_TN,tn_1782_1782_128_B_16,Gemm_Hipblaslt_TN_7483,0.0739484
GemmStridedBatchedTunableOp_Half_TN,tn_1588_1588_128_B_16,Gemm_Rocblas_621286413,0.0640827
GemmStridedBatchedTunableOp_Half_TN,tn_1752_1752_128_B_16,Gemm_Rocblas_621294109,0.0709687
GemmStridedBatchedTunableOp_Half_TN,tn_1638_1638_128_B_16,Gemm_Hipblaslt_TN_7483,0.0668902
GemmStridedBatchedTunableOp_Half_TN,tn_1956_1956_128_B_16,Gemm_Hipblaslt_TN_6929,0.084364
GemmStridedBatchedTunableOp_Half_TN,tn_1652_1652_128_B_16,Gemm_Hipblaslt_TN_7483,0.0635211
GemmStridedBatchedTunableOp_Half_TN,tn_1964_1964_128_B_16,Gemm_Hipblaslt_TN_6929,0.0853389
GemmStridedBatchedTunableOp_Half_TN,tn_1863_1863_128_B_16,Gemm_Hipblaslt_TN_7483,0.080576
GemmStridedBatchedTunableOp_Half_TN,tn_1607_1607_128_B_16,Gemm_Rocblas_621294517,0.0646038
GemmStridedBatchedTunableOp_Half_TN,tn_1699_1699_128_B_16,Gemm_Hipblaslt_TN_7483,0.0693622
GemmStridedBatchedTunableOp_Half_TN,tn_1845_1845_128_B_16,Gemm_Hipblaslt_TN_6942,0.0801165
GemmStridedBatchedTunableOp_Half_TN,tn_1669_1669_128_B_16,Gemm_Rocblas_621286413,0.069171
GemmStridedBatchedTunableOp_Half_TN,tn_1749_1749_128_B_16,Gemm_Rocblas_621294516,0.0738191
GemmStridedBatchedTunableOp_Half_TN,tn_1616_1616_128_B_16,Gemm_Rocblas_621286509,0.0597649
GemmStridedBatchedTunableOp_Half_TN,tn_1734_1734_128_B_16,Gemm_Rocblas_621286413,0.0722771
GemmStridedBatchedTunableOp_Half_TN,tn_1615_1615_128_B_16,Gemm_Hipblaslt_TN_7483,0.0645809
GemmStridedBatchedTunableOp_Half_TN,tn_1806_1806_128_B_16,Gemm_Hipblaslt_TN_6942,0.0780709
GemmStridedBatchedTunableOp_Half_TN,tn_1719_1719_128_B_16,Gemm_Rocblas_621294110,0.0701873
GemmStridedBatchedTunableOp_Half_TN,tn_1774_1774_128_B_16,Gemm_Hipblaslt_TN_7483,0.0732856
GemmStridedBatchedTunableOp_Half_TN,tn_1781_1781_128_B_16,Gemm_Rocblas_621294517,0.0754028
GemmStridedBatchedTunableOp_Half_TN,tn_1865_1865_128_B_16,Gemm_Hipblaslt_TN_6942,0.0817214
GemmStridedBatchedTunableOp_Half_TN,tn_1833_1833_128_B_16,Gemm_Hipblaslt_TN_6929,0.0792611
GemmStridedBatchedTunableOp_Half_TN,tn_1804_1804_128_B_16,Gemm_Rocblas_621294754,0.0771162
GemmStridedBatchedTunableOp_Half_TN,tn_1851_1851_128_B_16,Gemm_Hipblaslt_TN_6929,0.0797388
GemmStridedBatchedTunableOp_Half_TN,tn_1630_1630_128_B_16,Gemm_Hipblaslt_TN_7483,0.065604
GemmStridedBatchedTunableOp_Half_TN,tn_1758_1758_128_B_16,Gemm_Rocblas_621294530,0.0740594
GemmStridedBatchedTunableOp_Half_TN,tn_1705_1705_128_B_16,Gemm_Rocblas_621286413,0.0706385
GemmStridedBatchedTunableOp_Half_TN,tn_1883_1883_128_B_16,Gemm_Hipblaslt_TN_6942,0.0821958
GemmStridedBatchedTunableOp_Half_TN,tn_1738_1738_128_B_16,Gemm_Rocblas_621286411,0.0706811
GemmStridedBatchedTunableOp_Half_TN,tn_1577_1577_128_B_16,Gemm_Hipblaslt_TN_7483,0.0626822
GemmStridedBatchedTunableOp_Half_TN,tn_1911_1911_128_B_16,Gemm_Hipblaslt_TN_6867,0.0824584
GemmStridedBatchedTunableOp_Half_TN,tn_1728_1728_128_B_16,Gemm_Rocblas_621294754,0.0586251
GemmStridedBatchedTunableOp_Half_TN,tn_1714_1714_128_B_16,Gemm_Rocblas_621294754,0.0685936
GemmStridedBatchedTunableOp_Half_TN,tn_1739_1739_128_B_16,Gemm_Hipblaslt_TN_7483,0.0713719
GemmStridedBatchedTunableOp_Half_TN,tn_1882_1882_128_B_16,Gemm_Hipblaslt_TN_6942,0.081344
GemmStridedBatchedTunableOp_Half_TN,tn_1792_1792_128_B_16,Gemm_Rocblas_621294352,0.0517587
GemmStridedBatchedTunableOp_Half_TN,tn_1940_1940_128_B_16,Gemm_Hipblaslt_TN_6867,0.0851898
GemmStridedBatchedTunableOp_Half_TN,tn_1904_1904_128_B_16,Gemm_Rocblas_621294665,0.0767507
GemmStridedBatchedTunableOp_Half_TN,tn_1877_1877_128_B_16,Gemm_Hipblaslt_TN_7483,0.0818023
GemmStridedBatchedTunableOp_Half_TN,tn_1755_1755_128_B_16,Gemm_Rocblas_621286413,0.0732384
GemmStridedBatchedTunableOp_Half_TN,tn_1952_1952_128_B_16,Gemm_Hipblaslt_TN_150,0.0751656
GemmStridedBatchedTunableOp_Half_TN,tn_1573_1573_128_B_16,Gemm_Hipblaslt_TN_7483,0.0597703
GemmStridedBatchedTunableOp_Half_TN,tn_1770_1770_128_B_16,Gemm_Rocblas_621286775,0.0741716
GemmStridedBatchedTunableOp_Half_TN,tn_1635_1635_128_B_16,Gemm_Rocblas_621294517,0.0661072
GemmStridedBatchedTunableOp_Half_TN,tn_1798_1798_128_B_16,Gemm_Rocblas_621286413,0.0781888
GemmStridedBatchedTunableOp_Half_TN,tn_1973_1973_128_B_16,Gemm_Hipblaslt_TN_6929,0.0862767
GemmStridedBatchedTunableOp_Half_TN,tn_1802_1802_128_B_16,Gemm_Rocblas_621294754,0.0776998
GemmStridedBatchedTunableOp_Half_TN,tn_1674_1674_128_B_16,Gemm_Rocblas_621286413,0.0670551
GemmStridedBatchedTunableOp_Half_TN,tn_1894_1894_128_B_16,Gemm_Hipblaslt_TN_6942,0.0815152
GemmStridedBatchedTunableOp_Half_TN,tn_1899_1899_128_B_16,Gemm_Hipblaslt_TN_6942,0.0816656
GemmStridedBatchedTunableOp_Half_TN,tn_1596_1596_128_B_16,Gemm_Hipblaslt_TN_7483,0.0632691
GemmStridedBatchedTunableOp_Half_TN,tn_1696_1696_128_B_16,Gemm_Rocblas_621286509,0.0613834
GemmStridedBatchedTunableOp_Half_TN,tn_1695_1695_128_B_16,Gemm_Rocblas_621286413,0.069646
GemmStridedBatchedTunableOp_Half_TN,tn_1784_1784_128_B_16,Gemm_Rocblas_621294109,0.072818
GemmStridedBatchedTunableOp_Half_TN,tn_1974_1974_128_B_16,Gemm_Hipblaslt_TN_6867,0.0877505
GemmStridedBatchedTunableOp_Half_TN,tn_1623_1623_128_B_16,Gemm_Hipblaslt_TN_7483,0.0640657
GemmStridedBatchedTunableOp_Half_TN,tn_1622_1622_128_B_16,Gemm_Rocblas_621294517,0.0654464
GemmStridedBatchedTunableOp_Half_TN,tn_1740_1740_128_B_16,Gemm_Rocblas_621294518,0.0719357
GemmStridedBatchedTunableOp_Half_TN,tn_1764_1764_128_B_16,Gemm_Rocblas_621294108,0.0725781
GemmStridedBatchedTunableOp_Half_TN,tn_1864_1864_128_B_16,Gemm_Hipblaslt_TN_150,0.0763489
GemmStridedBatchedTunableOp_Half_TN,tn_1841_1841_128_B_16,Gemm_Hipblaslt_TN_6942,0.079527
GemmStridedBatchedTunableOp_Half_TN,tn_1866_1866_128_B_16,Gemm_Hipblaslt_TN_6942,0.0806488
GemmStridedBatchedTunableOp_Half_TN,tn_1822_1822_128_B_16,Gemm_Rocblas_621294110,0.0783608
GemmStridedBatchedTunableOp_Half_TN,tn_1920_1920_128_B_16,Gemm_Rocblas_621286509,0.0660802
GemmStridedBatchedTunableOp_Half_TN,tn_1817_1817_128_B_16,Gemm_Hipblaslt_TN_6942,0.0791878
GemmStridedBatchedTunableOp_Half_TN,tn_1889_1889_128_B_16,Gemm_Hipblaslt_TN_6942,0.0817888
GemmStridedBatchedTunableOp_Half_TN,tn_1936_1936_128_B_16,Gemm_Hipblaslt_TN_150,0.0776772
GemmStridedBatchedTunableOp_Half_TN,tn_1762_1762_128_B_16,Gemm_Rocblas_621294013,0.0736457
GemmStridedBatchedTunableOp_Half_TN,tn_1639_1639_128_B_16,Gemm_Hipblaslt_TN_7483,0.0640833
GemmStridedBatchedTunableOp_Half_TN,tn_1862_1862_128_B_16,Gemm_Hipblaslt_TN_6942,0.0802678
GemmStridedBatchedTunableOp_Half_TN,tn_1831_1831_128_B_16,Gemm_Hipblaslt_TN_6942,0.0794483
GemmStridedBatchedTunableOp_Half_TN,tn_1869_1869_128_B_16,Gemm_Hipblaslt_TN_6942,0.0810618
GemmStridedBatchedTunableOp_Half_TN,tn_1725_1725_128_B_16,Gemm_Hipblaslt_TN_7483,0.0708772
GemmStridedBatchedTunableOp_Half_TN,tn_1614_1614_128_B_16,Gemm_Hipblaslt_TN_7483,0.0631598
GemmStridedBatchedTunableOp_Half_TN,tn_1968_1968_128_B_16,Gemm_Hipblaslt_TN_150,0.0762008
GemmStridedBatchedTunableOp_Half_TN,tn_1807_1807_128_B_16,Gemm_Hipblaslt_TN_6942,0.0787811
GemmStridedBatchedTunableOp_Half_TN,tn_1946_1946_128_B_16,Gemm_Rocblas_621294533,0.085724
GemmStridedBatchedTunableOp_Half_TN,tn_1965_1965_128_B_16,Gemm_Rocblas_621286808,0.0877339
GemmStridedBatchedTunableOp_Half_TN,tn_1957_1957_128_B_16,Gemm_Rocblas_621294533,0.0874799
GemmStridedBatchedTunableOp_Half_TN,tn_1859_1859_128_B_16,Gemm_Hipblaslt_TN_6942,0.0808384
GemmStridedBatchedTunableOp_Half_TN,tn_1760_1760_128_B_16,Gemm_Rocblas_621294255,0.0649903
GemmStridedBatchedTunableOp_Half_TN,tn_1971_1971_128_B_16,Gemm_Hipblaslt_TN_6867,0.0858659
GemmStridedBatchedTunableOp_Half_TN,tn_1943_1943_128_B_16,Gemm_Hipblaslt_TN_6929,0.0857751
GemmStridedBatchedTunableOp_Half_TN,tn_1925_1925_128_B_16,Gemm_Hipblaslt_TN_6879,0.0856806
GemmStridedBatchedTunableOp_Half_TN,tn_1711_1711_128_B_16,Gemm_Rocblas_621294725,0.0694992
GemmStridedBatchedTunableOp_Half_TN,tn_1629_1629_128_B_16,Gemm_Hipblaslt_TN_7483,0.0653805
GemmStridedBatchedTunableOp_Half_TN,tn_1858_1858_128_B_16,Gemm_Hipblaslt_TN_6942,0.0800101
GemmStridedBatchedTunableOp_Half_TN,tn_1720_1720_128_B_16,Gemm_Rocblas_621286413,0.0682231
GemmStridedBatchedTunableOp_Half_TN,tn_1641_1641_128_B_16,Gemm_Hipblaslt_TN_7483,0.0647592
GemmStridedBatchedTunableOp_Half_TN,tn_1787_1787_128_B_16,Gemm_Rocblas_621294518,0.0746564
GemmStridedBatchedTunableOp_Half_TN,tn_1663_1663_128_B_16,Gemm_Hipblaslt_TN_7483,0.0657019
GemmStridedBatchedTunableOp_Half_TN,tn_1688_1688_128_B_16,Gemm_Rocblas_621286413,0.0665452
GemmStridedBatchedTunableOp_Half_TN,tn_1961_1961_128_B_16,Gemm_Hipblaslt_TN_6857,0.087785
GemmStridedBatchedTunableOp_Half_TN,tn_1853_1853_128_B_16,Gemm_Hipblaslt_TN_6942,0.0796333
GemmStridedBatchedTunableOp_Half_TN,tn_1727_1727_128_B_16,Gemm_Rocblas_621286413,0.0722088
GemmStridedBatchedTunableOp_Half_TN,tn_1599_1599_128_B_16,Gemm_Hipblaslt_TN_7483,0.063268
GemmStridedBatchedTunableOp_Half_TN,tn_1903_1903_128_B_16,Gemm_Hipblaslt_TN_6942,0.0822853
GemmStridedBatchedTunableOp_Half_TN,tn_1892_1892_128_B_16,Gemm_Rocblas_621294530,0.0801547
GemmStridedBatchedTunableOp_Half_TN,tn_1902_1902_128_B_16,Gemm_Hipblaslt_TN_7483,0.081889
GemmStridedBatchedTunableOp_Half_TN,tn_1732_1732_128_B_16,Gemm_Rocblas_621286397,0.0707038
GemmStridedBatchedTunableOp_Half_TN,tn_1627_1627_128_B_16,Gemm_Rocblas_621294635,0.0645389
GemmStridedBatchedTunableOp_Half_TN,tn_1780_1780_128_B_16,Gemm_Rocblas_621294108,0.0733589
GemmStridedBatchedTunableOp_Half_TN,tn_1680_1680_128_B_16,Gemm_Rocblas_621294110,0.0635317
GemmStridedBatchedTunableOp_Half_TN,tn_1771_1771_128_B_16,Gemm_Rocblas_621286775,0.0748061
GemmStridedBatchedTunableOp_Half_TN,tn_1746_1746_128_B_16,Gemm_Rocblas_621286413,0.0729724
GemmStridedBatchedTunableOp_Half_TN,tn_1745_1745_128_B_16,Gemm_Rocblas_621294517,0.0726693
GemmStridedBatchedTunableOp_Half_TN,tn_1777_1777_128_B_16,Gemm_Hipblaslt_TN_7483,0.0750325
GemmStridedBatchedTunableOp_Half_TN,tn_1593_1593_128_B_16,Gemm_Rocblas_621294517,0.0645158
GemmStridedBatchedTunableOp_Half_TN,tn_1600_1600_128_B_16,Gemm_Rocblas_621286774,0.0580829
GemmStridedBatchedTunableOp_Half_TN,tn_1585_1585_128_B_16,Gemm_Rocblas_621286775,0.0640677
GemmStridedBatchedTunableOp_Half_TN,tn_1923_1923_128_B_16,Gemm_Hipblaslt_TN_6929,0.0844183
GemmStridedBatchedTunableOp_Half_TN,tn_1912_1912_128_B_16,Gemm_Hipblaslt_TN_150,0.0785487
GemmStridedBatchedTunableOp_Half_TN,tn_1963_1963_128_B_16,Gemm_Rocblas_621286807,0.087636
GemmStridedBatchedTunableOp_Half_TN,tn_1722_1722_128_B_16,Gemm_Rocblas_621286413,0.0694893
GemmStridedBatchedTunableOp_Half_TN,tn_1621_1621_128_B_16,Gemm_Hipblaslt_TN_7483,0.0644837
GemmStridedBatchedTunableOp_Half_TN,tn_1867_1867_128_B_16,Gemm_Hipblaslt_TN_6942,0.0809689
GemmStridedBatchedTunableOp_Half_TN,tn_1934_1934_128_B_16,Gemm_Hipblaslt_TN_6929,0.0838371
GemmStridedBatchedTunableOp_Half_TN,tn_1643_1643_128_B_16,Gemm_Hipblaslt_TN_7483,0.0646936
GemmStridedBatchedTunableOp_Half_TN,tn_1676_1676_128_B_16,Gemm_Rocblas_621286413,0.0680477
GemmStridedBatchedTunableOp_Half_TN,tn_1773_1773_128_B_16,Gemm_Rocblas_621294517,0.0751287
GemmStridedBatchedTunableOp_Half_TN,tn_1947_1947_128_B_16,Gemm_Rocblas_621286808,0.087217
GemmStridedBatchedTunableOp_Half_TN,tn_1879_1879_128_B_16,Gemm_Hipblaslt_TN_6942,0.0813948
GemmStridedBatchedTunableOp_Half_TN,tn_1640_1640_128_B_16,Gemm_Hipblaslt_TN_149,0.0623291
GemmStridedBatchedTunableOp_Half_TN,tn_1788_1788_128_B_16,Gemm_Rocblas_621294517,0.0732225
GemmStridedBatchedTunableOp_Half_TN,tn_1765_1765_128_B_16,Gemm_Rocblas_621286413,0.0748517
GemmStridedBatchedTunableOp_Half_TN,tn_1710_1710_128_B_16,Gemm_Rocblas_621294110,0.0694706
GemmStridedBatchedTunableOp_Half_TN,tn_1800_1800_128_B_16,Gemm_Hipblaslt_TN_150,0.071927
GemmStridedBatchedTunableOp_Half_TN,tn_1827_1827_128_B_16,Gemm_Hipblaslt_TN_6942,0.0794733
GemmStridedBatchedTunableOp_Half_TN,tn_1917_1917_128_B_16,Gemm_Hipblaslt_TN_6942,0.0824053
GemmStridedBatchedTunableOp_Half_TN,tn_1723_1723_128_B_16,Gemm_Hipblaslt_TN_7483,0.0710306
GemmStridedBatchedTunableOp_Half_TN,tn_1808_1808_128_B_16,Gemm_Rocblas_621286810,0.071614
GemmStridedBatchedTunableOp_Half_TN,tn_1932_1932_128_B_16,Gemm_Rocblas_621294533,0.0850587
GemmStridedBatchedTunableOp_Half_TN,tn_1684_1684_128_B_16,Gemm_Rocblas_621286413,0.0669799
GemmStridedBatchedTunableOp_Half_TN,tn_1743_1743_128_B_16,Gemm_Hipblaslt_TN_6857,0.072459
GemmStridedBatchedTunableOp_Half_TN,tn_1910_1910_128_B_16,Gemm_Hipblaslt_TN_6942,0.081881
GemmStridedBatchedTunableOp_Half_TN,tn_1648_1648_128_B_16,Gemm_Rocblas_621286509,0.0604078
GemmStridedBatchedTunableOp_Half_TN,tn_1757_1757_128_B_16,Gemm_Hipblaslt_TN_6879,0.0744561
GemmStridedBatchedTunableOp_Half_TN,tn_1856_1856_128_B_16,Gemm_Rocblas_621286509,0.0723637
GemmStridedBatchedTunableOp_Half_TN,tn_1836_1836_128_B_16,Gemm_Hipblaslt_TN_6942,0.0786317
GemmStridedBatchedTunableOp_Half_TN,tn_1847_1847_128_B_16,Gemm_Hipblaslt_TN_6942,0.0798847
GemmStridedBatchedTunableOp_Half_TN,tn_1840_1840_128_B_16,Gemm_Rocblas_621286509,0.0732407
GemmTunableOp_Half_TN,tn_14336_1703_4096,Gemm_Hipblaslt_TN_9697,0.354098
GemmTunableOp_Half_TN,tn_3072_5089_4096,Gemm_Hipblaslt_TN_9726,0.21388
GemmTunableOp_Half_TN,tn_3072_3388_4096,Gemm_Rocblas_621294495,0.153019
GemmTunableOp_Half_TN,tn_3072_1704_4096,Gemm_Rocblas_621294520,0.0886565
GemmTunableOp_Half_TN,tn_4096_5735_2048,Gemm_Hipblaslt_TN_9773,0.175025
GemmTunableOp_Half_TN,tn_4096_1670_2048,Gemm_Hipblaslt_TN_9607,0.056708
GemmTunableOp_Half_TN,tn_14336_1787_4096,Gemm_Hipblaslt_TN_9192,0.364207
GemmTunableOp_Half_TN,tn_3072_3214_4096,Gemm_Hipblaslt_TN_9681,0.146531
GemmTunableOp_Half_TN,tn_14336_1627_4096,Gemm_Hipblaslt_TN_9192,0.350972
GemmTunableOp_Half_TN,tn_14336_1727_4096,Gemm_Hipblaslt_TN_9139,0.356233
GemmTunableOp_Half_TN,tn_14336_1743_4096,Gemm_Hipblaslt_TN_9793,0.360973
GemmTunableOp_Half_TN,tn_4096_3565_7168,Gemm_Hipblaslt_TN_9221,0.341761
GemmTunableOp_Half_TN,tn_4096_7386_2048,Gemm_Hipblaslt_TN_9749,0.221844
GemmTunableOp_Half_TN,tn_4096_1871_7168,Gemm_Hipblaslt_TN_9645,0.206245
GemmTunableOp_Half_TN,tn_4096_3345_2048,Gemm_Hipblaslt_TN_9896,0.100777
GemmTunableOp_Half_TN,tn_4096_5136_7168,Gemm_Hipblaslt_TN_9681,0.527206
GemmTunableOp_Half_TN,tn_14336_5680_4096,Gemm_Hipblaslt_TN_9827,1.09614
GemmTunableOp_Half_TN,tn_4096_1805_2048,Gemm_Hipblaslt_TN_9137,0.0627713
GemmTunableOp_Half_TN,tn_64128_74_4096,Gemm_Hipblaslt_TN_9057,0.176009
GemmTunableOp_Half_TN,tn_14336_3369_4096,Gemm_Rocblas_621294492,0.648468
GemmTunableOp_Half_TN,tn_4096_3553_7168,Gemm_Hipblaslt_TN_9682,0.338748
GemmTunableOp_Half_TN,tn_4096_1651_7168,Gemm_Hipblaslt_TN_9359,0.181962
GemmTunableOp_Half_TN,tn_14336_1804_4096,Gemm_Hipblaslt_TN_9677,0.365539
GemmTunableOp_Half_TN,tn_3072_3373_4096,Gemm_Rocblas_621286753,0.152142
GemmTunableOp_Half_TN,tn_4096_1977_2048,Gemm_Hipblaslt_TN_9590,0.0644864
GemmTunableOp_Half_TN,tn_4096_3564_2048,Gemm_Hipblaslt_TN_9896,0.103012
GemmTunableOp_Half_TN,tn_14336_1855_4096,Gemm_Hipblaslt_TN_9187,0.37021
GemmTunableOp_Half_TN,tn_4096_3559_2048,Gemm_Hipblaslt_TN_9696,0.103053
GemmTunableOp_Half_TN,tn_3072_5277_4096,Gemm_Hipblaslt_TN_9726,0.213701
GemmTunableOp_Half_TN,tn_64128_54_4096,Gemm_Hipblaslt_TN_9097,0.161278
GemmTunableOp_Half_TN,tn_4096_1665_7168,Gemm_Hipblaslt_TN_9265,0.182081
GemmTunableOp_Half_TN,tn_14336_7386_4096,Gemm_Hipblaslt_TN_9900,1.42171
GemmTunableOp_Half_TN,tn_3072_1973_4096,Gemm_Hipblaslt_TN_9636,0.100931
GemmTunableOp_Half_TN,tn_14336_5359_4096,Gemm_Hipblaslt_TN_9217,1.03399
GemmTunableOp_Half_TN,tn_3072_6989_4096,Gemm_Hipblaslt_TN_9681,0.302027
GemmTunableOp_Half_TN,tn_14336_3793_4096,Gemm_Hipblaslt_TN_9677,0.744062
GemmTunableOp_Half_TN,tn_14336_1651_4096,Gemm_Hipblaslt_TN_9139,0.352497
GemmTunableOp_Half_TN,tn_4096_3214_7168,Gemm_Hipblaslt_TN_9682,0.320445
GemmTunableOp_Half_TN,tn_3072_5447_4096,Gemm_Hipblaslt_TN_9726,0.221848
GemmTunableOp_Half_TN,tn_4096_1973_7168,Gemm_Hipblaslt_TN_9680,0.210505
GemmTunableOp_Half_TN,tn_3072_1749_4096,Gemm_Rocblas_621286778,0.0900588
GemmTunableOp_Half_TN,tn_14336_3722_4096,Gemm_Hipblaslt_TN_9192,0.736182
GemmTunableOp_Half_TN,tn_4096_3602_2048,Gemm_Hipblaslt_TN_9896,0.103617
GemmTunableOp_Half_TN,tn_3072_5157_4096,Gemm_Hipblaslt_TN_9892,0.21307
GemmTunableOp_Half_TN,tn_3072_3497_4096,Gemm_Rocblas_621286753,0.155289
GemmTunableOp_Half_TN,tn_14336_5196_4096,Gemm_Hipblaslt_TN_9220,1.03183
GemmTunableOp_Half_TN,tn_14336_1828_4096,Gemm_Hipblaslt_TN_9697,0.368361
GemmTunableOp_Half_TN,tn_14336_3767_4096,Gemm_Hipblaslt_TN_9697,0.744213
GemmTunableOp_Half_TN,tn_4096_3574_7168,Gemm_Hipblaslt_TN_9697,0.341093
GemmTunableOp_Half_TN,tn_14336_6843_4096,Gemm_Hipblaslt_TN_9753,1.31042
GemmTunableOp_Half_TN,tn_4096_6800_2048,Gemm_Hipblaslt_TN_9857,0.201361
GemmTunableOp_Half_TN,tn_4096_1894_2048,Gemm_Hipblaslt_TN_9590,0.0632646
GemmTunableOp_Half_TN,tn_4096_1857_2048,Gemm_Hipblaslt_TN_9590,0.063807
GemmTunableOp_Half_TN,tn_4096_3535_7168,Gemm_Hipblaslt_TN_9187,0.338769
GemmTunableOp_Half_TN,tn_3072_208_4096,Gemm_Rocblas_621286443,0.0226139
GemmTunableOp_Half_TN,tn_4096_6881_2048,Gemm_Hipblaslt_TN_9743,0.203129
GemmTunableOp_Half_TN,tn_4096_1960_7168,Gemm_Hipblaslt_TN_9645,0.209686
GemmTunableOp_Half_TN,tn_4096_1960_2048,Gemm_Hipblaslt_TN_9134,0.0656754
GemmTunableOp_Half_TN,tn_14336_208_4096,Gemm_Hipblaslt_TN_9604,0.063873
GemmTunableOp_Half_TN,tn_4096_5495_2048,Gemm_Hipblaslt_TN_9799,0.171628
GemmTunableOp_Half_TN,tn_4096_1778_7168,Gemm_Hipblaslt_TN_9134,0.200496
GemmTunableOp_Half_TN,tn_64128_200_4096,Gemm_Hipblaslt_TN_9738,0.272212
GemmTunableOp_Half_TN,tn_4096_5605_2048,Gemm_Hipblaslt_TN_9799,0.170806
GemmTunableOp_Half_TN,tn_14336_1618_4096,Gemm_Hipblaslt_TN_9697,0.350446
GemmTunableOp_Half_TN,tn_14336_7182_4096,Gemm_Hipblaslt_TN_9697,1.38147
GemmTunableOp_Half_TN,tn_3072_3475_4096,Gemm_Hipblaslt_TN_9619,0.154081
GemmTunableOp_Half_TN,tn_4096_6870_2048,Gemm_Hipblaslt_TN_9188,0.202471
GemmTunableOp_Half_TN,tn_4096_5030_2048,Gemm_Hipblaslt_TN_9672,0.166398
GemmTunableOp_Half_TN,tn_4096_7253_2048,Gemm_Hipblaslt_TN_9696,0.20927
GemmTunableOp_Half_TN,tn_4096_1668_7168,Gemm_Hipblaslt_TN_9359,0.180958
GemmTunableOp_Half_TN,tn_4096_64_2048,Gemm_Rocblas_621294227,0.00787497
GemmTunableOp_Half_TN,tn_14336_7139_4096,Gemm_Hipblaslt_TN_9914,1.33121
GemmTunableOp_Half_TN,tn_14336_3410_4096,Gemm_Rocblas_621294435,0.64631
GemmTunableOp_Half_TN,tn_3072_5068_4096,Gemm_Hipblaslt_TN_9726,0.211886
GemmTunableOp_Half_TN,tn_4096_6996_7168,Gemm_Hipblaslt_TN_9694,0.669379
GemmTunableOp_Half_TN,tn_3072_6789_4096,Gemm_Hipblaslt_TN_9681,0.298053
GemmTunableOp_Half_TN,tn_4096_1596_2048,Gemm_Hipblaslt_TN_9587,0.0543783
GemmTunableOp_Half_TN,tn_3072_1792_4096,Gemm_Rocblas_621286778,0.0903719
GemmTunableOp_Half_TN,tn_4096_5447_7168,Gemm_Rocblas_621286684,0.550846
GemmTunableOp_Half_TN,tn_3072_6971_4096,Gemm_Hipblaslt_TN_9681,0.302048
GemmTunableOp_Half_TN,tn_3072_3595_4096,Gemm_Hipblaslt_TN_9570,0.158353
GemmTunableOp_Half_TN,tn_3072_5267_4096,Gemm_Hipblaslt_TN_9920,0.213493
GemmTunableOp_Half_TN,tn_4096_3420_2048,Gemm_Hipblaslt_TN_9896,0.100197
GemmTunableOp_Half_TN,tn_4096_16_7168,Gemm_Rocblas_621294135,0.0132114
GemmTunableOp_Half_TN,tn_4096_3773_2048,Gemm_Hipblaslt_TN_9873,0.112612
GemmTunableOp_Half_TN,tn_14336_3416_4096,Gemm_Hipblaslt_TN_9220,0.652007
GemmTunableOp_Half_TN,tn_4096_3581_7168,Gemm_Hipblaslt_TN_9695,0.34148
GemmTunableOp_Half_TN,tn_4096_6920_7168,Gemm_Hipblaslt_TN_9677,0.667249
GemmTunableOp_Half_TN,tn_3072_1739_4096,Gemm_Hipblaslt_TN_9163,0.0901047
GemmTunableOp_Half_TN,tn_4096_6990_7168,Gemm_Hipblaslt_TN_9694,0.672
GemmTunableOp_Half_TN,tn_4096_7191_7168,Gemm_Hipblaslt_TN_9743,0.68058
GemmTunableOp_Half_TN,tn_4096_5223_2048,Gemm_Hipblaslt_TN_9690,0.168789
GemmTunableOp_Half_TN,tn_4096_5583_2048,Gemm_Hipblaslt_TN_9799,0.172677
GemmTunableOp_Half_TN,tn_14336_6971_4096,Gemm_Hipblaslt_TN_9903,1.31504
GemmTunableOp_Half_TN,tn_4096_1779_2048,Gemm_Hipblaslt_TN_9136,0.0617182
GemmTunableOp_Half_TN,tn_4096_1646_7168,Gemm_Hipblaslt_TN_9587,0.180722
GemmTunableOp_Half_TN,tn_3072_1689_4096,Gemm_Hipblaslt_TN_9163,0.0879633
GemmTunableOp_Half_TN,tn_3072_5412_4096,Gemm_Hipblaslt_TN_9726,0.220428
GemmTunableOp_Half_TN,tn_14336_192_4096,Gemm_Hipblaslt_TN_9147,0.0579574
GemmTunableOp_Half_TN,tn_3072_7182_4096,Gemm_Hipblaslt_TN_9681,0.308733
GemmTunableOp_Half_TN,tn_14336_1599_4096,Gemm_Hipblaslt_TN_9690,0.323976
GemmTunableOp_Half_TN,tn_14336_1860_4096,Gemm_Hipblaslt_TN_9187,0.370441
GemmTunableOp_Half_TN,tn_3072_1827_4096,Gemm_Hipblaslt_TN_9324,0.0926187
GemmTunableOp_Half_TN,tn_14336_16_4096,Gemm_Rocblas_621286317,0.0237739
GemmTunableOp_Half_TN,tn_14336_6990_4096,Gemm_Hipblaslt_TN_9888,1.31924
GemmTunableOp_Half_TN,tn_14336_3651_4096,Gemm_Hipblaslt_TN_9677,0.734356
GemmTunableOp_Half_TN,tn_3072_1953_4096,Gemm_Hipblaslt_TN_9266,0.0998557
GemmTunableOp_Half_TN,tn_4096_5125_7168,Gemm_Hipblaslt_TN_9681,0.526803
GemmTunableOp_Half_TN,tn_3072_5030_4096,Gemm_Hipblaslt_TN_9726,0.211451
GemmTunableOp_Half_TN,tn_14336_120_4096,Gemm_Rocblas_621294233,0.0409893
GemmTunableOp_Half_TN,tn_3072_7267_4096,Gemm_Hipblaslt_TN_9681,0.31152
GemmTunableOp_Half_TN,tn_4096_5223_7168,Gemm_Hipblaslt_TN_9691,0.538732
GemmTunableOp_Half_TN,tn_14336_1796_4096,Gemm_Hipblaslt_TN_9139,0.36811
GemmTunableOp_Half_TN,tn_4096_3647_2048,Gemm_Hipblaslt_TN_9683,0.104711
GemmTunableOp_Half_TN,tn_4096_7262_2048,Gemm_Hipblaslt_TN_9731,0.209371
GemmTunableOp_Half_TN,tn_3072_1935_4096,Gemm_Hipblaslt_TN_9616,0.10029
GemmTunableOp_Half_TN,tn_4096_3547_2048,Gemm_Hipblaslt_TN_9896,0.104634
GemmTunableOp_Half_TN,tn_64128_226_4096,Gemm_Rocblas_621286915,0.289619
GemmTunableOp_Half_TN,tn_3072_128_4096,Gemm_Rocblas_621286438,0.0151446
GemmTunableOp_Half_TN,tn_3072_7432_4096,Gemm_Rocblas_621294473,0.327403
GemmTunableOp_Half_TN,tn_14336_7093_4096,Gemm_Hipblaslt_TN_9869,1.32597
GemmTunableOp_Half_TN,tn_4096_1883_2048,Gemm_Hipblaslt_TN_9590,0.0631404
GemmTunableOp_Half_TN,tn_4096_5357_7168,Gemm_Rocblas_621286684,0.546435
GemmTunableOp_Half_TN,tn_64128_235_4096,Gemm_Rocblas_621286915,0.293568
GemmTunableOp_Half_TN,tn_64128_158_4096,Gemm_Hipblaslt_TN_9108,0.223816
GemmTunableOp_Half_TN,tn_14336_256_4096,Gemm_Rocblas_621286481,0.0660199
GemmTunableOp_Half_TN,tn_4096_1792_2048,Gemm_Hipblaslt_TN_9680,0.0605167
GemmTunableOp_Half_TN,tn_14336_1871_4096,Gemm_Hipblaslt_TN_9697,0.3711
GemmTunableOp_Half_TN,tn_4096_5442_7168,Gemm_Rocblas_621294320,0.553823
GemmTunableOp_Half_TN,tn_4096_1890_2048,Gemm_Hipblaslt_TN_9590,0.064599
GemmTunableOp_Half_TN,tn_14336_1805_4096,Gemm_Hipblaslt_TN_9697,0.364756
GemmTunableOp_Half_TN,tn_4096_7432_2048,Gemm_Hipblaslt_TN_9768,0.222323
GemmTunableOp_Half_TN,tn_4096_1703_7168,Gemm_Hipblaslt_TN_9671,0.184782
GemmTunableOp_Half_TN,tn_14336_3666_4096,Gemm_Hipblaslt_TN_9192,0.735629
GemmTunableOp_Half_TN,tn_4096_88_2048,Gemm_Rocblas_621286278,0.0101623
GemmTunableOp_Half_TN,tn_4096_1615_7168,Gemm_Hipblaslt_TN_9679,0.180569
GemmTunableOp_Half_TN,tn_14336_7120_4096,Gemm_Hipblaslt_TN_9933,1.32918
GemmTunableOp_Half_TN,tn_4096_192_7168,Gemm_Hipblaslt_TN_9470,0.0386261
GemmTunableOp_Half_TN,tn_4096_3468_7168,Gemm_Hipblaslt_TN_9192,0.333891
GemmTunableOp_Half_TN,tn_3072_1873_4096,Gemm_Hipblaslt_TN_9613,0.0938673
GemmTunableOp_Half_TN,tn_4096_200_7168,Gemm_Hipblaslt_TN_9303,0.0417634
GemmTunableOp_Half_TN,tn_4096_1728_2048,Gemm_Hipblaslt_TN_9164,0.0568332
GemmTunableOp_Half_TN,tn_14336_7432_4096,Gemm_Hipblaslt_TN_159,1.4593
GemmTunableOp_Half_TN,tn_4096_6901_2048,Gemm_Hipblaslt_TN_9821,0.204714
GemmTunableOp_Half_TN,tn_4096_176_7168,Gemm_Hipblaslt_TN_9470,0.0385528
GemmTunableOp_Half_TN,tn_3072_1948_4096,Gemm_Hipblaslt_TN_9587,0.0995921
GemmTunableOp_Half_TN,tn_4096_6747_7168,Gemm_Hipblaslt_TN_9677,0.653488
GemmTunableOp_Half_TN,tn_14336_1877_4096,Gemm_Hipblaslt_TN_9192,0.372378
GemmTunableOp_Half_TN,tn_4096_1684_2048,Gemm_Hipblaslt_TN_9588,0.0585704
GemmTunableOp_Half_TN,tn_14336_1873_4096,Gemm_Hipblaslt_TN_9697,0.371001
GemmTunableOp_Half_TN,tn_3072_216_4096,Gemm_Rocblas_621286440,0.0220262
GemmTunableOp_Half_TN,tn_4096_1784_7168,Gemm_Hipblaslt_TN_9329,0.200085
GemmTunableOp_Half_TN,tn_3072_184_4096,Gemm_Rocblas_621294164,0.0189929
GemmTunableOp_Half_TN,tn_4096_5723_2048,Gemm_Hipblaslt_TN_9687,0.175187
GemmTunableOp_Half_TN,tn_4096_232_7168,Gemm_Hipblaslt_TN_9303,0.0440771
GemmTunableOp_Half_TN,tn_3072_3300_4096,Gemm_Hipblaslt_TN_9681,0.148793
GemmTunableOp_Half_TN,tn_3072_5570_4096,Gemm_Hipblaslt_TN_9726,0.222855
GemmTunableOp_Half_TN,tn_4096_120_2048,Gemm_Rocblas_621294029,0.0111476
GemmTunableOp_Half_TN,tn_14336_216_4096,Gemm_Hipblaslt_TN_9634,0.0645984
GemmTunableOp_Half_TN,tn_14336_7225_4096,Gemm_Hipblaslt_TN_9697,1.39026
GemmTunableOp_Half_TN,tn_14336_5352_4096,Gemm_Hipblaslt_TN_159,1.04211
GemmTunableOp_Half_TN,tn_4096_1977_7168,Gemm_Hipblaslt_TN_9645,0.210267
GemmTunableOp_Half_TN,tn_3072_1633_4096,Gemm_Hipblaslt_TN_9133,0.0879623
GemmTunableOp_Half_TN,tn_4096_7206_7168,Gemm_Hipblaslt_TN_9694,0.674437
GemmTunableOp_Half_TN,tn_4096_1719_2048,Gemm_Hipblaslt_TN_9671,0.0587626
GemmTunableOp_Half_TN,tn_4096_1597_2048,Gemm_Hipblaslt_TN_9607,0.0567266
GemmTunableOp_Half_TN,tn_4096_1600_7168,Gemm_Hipblaslt_TN_9679,0.180519
GemmTunableOp_Half_TN,tn_14336_3629_4096,Gemm_Hipblaslt_TN_9814,0.725106
GemmTunableOp_Half_TN,tn_4096_5204_7168,Gemm_Hipblaslt_TN_9691,0.535274
GemmTunableOp_Half_TN,tn_4096_1874_7168,Gemm_Hipblaslt_TN_9645,0.204814
GemmTunableOp_Half_TN,tn_14336_3496_4096,Gemm_Hipblaslt_TN_9223,0.654346
GemmTunableOp_Half_TN,tn_14336_1699_4096,Gemm_Hipblaslt_TN_9697,0.354152
GemmTunableOp_Half_TN,tn_64128_182_4096,Gemm_Hipblaslt_TN_9857,0.246581
GemmTunableOp_Half_TN,tn_14336_3400_4096,Gemm_Rocblas_621286693,0.649596
GemmTunableOp_Half_TN,tn_4096_1703_2048,Gemm_Hipblaslt_TN_9607,0.0577554
GemmTunableOp_Half_TN,tn_64128_129_4096,Gemm_Hipblaslt_TN_9108,0.216103
GemmTunableOp_Half_TN,tn_4096_3219_7168,Gemm_Hipblaslt_TN_9139,0.319607
GemmTunableOp_Half_TN,tn_14336_1981_4096,Gemm_Hipblaslt_TN_9220,0.399433
GemmTunableOp_Half_TN,tn_4096_1875_2048,Gemm_Hipblaslt_TN_9590,0.0633453
GemmTunableOp_Half_TN,tn_3072_1658_4096,Gemm_Hipblaslt_TN_9148,0.0872713
GemmTunableOp_Half_TN,tn_14336_3219_4096,Gemm_Rocblas_621286678,0.626075
GemmTunableOp_Half_TN,tn_14336_1643_4096,Gemm_Hipblaslt_TN_9793,0.352146
GemmTunableOp_Half_TN,tn_3072_1930_4096,Gemm_Hipblaslt_TN_9616,0.0994651
GemmTunableOp_Half_TN,tn_4096_1807_2048,Gemm_Hipblaslt_TN_9136,0.0626012
GemmTunableOp_Half_TN,tn_4096_1860_2048,Gemm_Hipblaslt_TN_9174,0.0644439
GemmTunableOp_Half_TN,tn_4096_1930_2048,Gemm_Hipblaslt_TN_9680,0.0653149
GemmTunableOp_Half_TN,tn_4096_3602_7168,Gemm_Hipblaslt_TN_9677,0.336982
GemmTunableOp_Half_TN,tn_14336_5274_4096,Gemm_Hipblaslt_TN_9223,1.03245
GemmTunableOp_Half_TN,tn_4096_1869_7168,Gemm_Hipblaslt_TN_9645,0.205611
GemmTunableOp_Half_TN,tn_4096_3912_2048,Gemm_Hipblaslt_TN_9873,0.115702
GemmTunableOp_Half_TN,tn_4096_3562_7168,Gemm_Hipblaslt_TN_9696,0.341448
GemmTunableOp_Half_TN,tn_14336_1820_4096,Gemm_Hipblaslt_TN_9677,0.367235
GemmTunableOp_Half_TN,tn_64128_60_4096,Gemm_Hipblaslt_TN_9097,0.162317
GemmTunableOp_Half_TN,tn_4096_3520_2048,Gemm_Hipblaslt_TN_9683,0.102371
GemmTunableOp_Half_TN,tn_4096_1839_7168,Gemm_Hipblaslt_TN_9137,0.20356
GemmTunableOp_Half_TN,tn_4096_7579_2048,Gemm_Hipblaslt_TN_9655,0.220885
GemmTunableOp_Half_TN,tn_4096_1618_2048,Gemm_Hipblaslt_TN_9671,0.0553764
GemmTunableOp_Half_TN,tn_4096_3345_7168,Gemm_Hipblaslt_TN_9695,0.329141
GemmTunableOp_Half_TN,tn_3072_3427_4096,Gemm_Hipblaslt_TN_9619,0.153488
GemmTunableOp_Half_TN,tn_4096_1737_7168,Gemm_Hipblaslt_TN_9329,0.19809
GemmTunableOp_Half_TN,tn_3072_3710_4096,Gemm_Hipblaslt_TN_9805,0.163987
GemmTunableOp_Half_TN,tn_4096_1973_2048,Gemm_Hipblaslt_TN_9590,0.0662231
GemmTunableOp_Half_TN,tn_4096_7021_7168,Gemm_Hipblaslt_TN_9683,0.672992
GemmTunableOp_Half_TN,tn_4096_3526_7168,Gemm_Hipblaslt_TN_9677,0.337967
GemmTunableOp_Half_TN,tn_4096_1936_7168,Gemm_Hipblaslt_TN_9134,0.208655
GemmTunableOp_Half_TN,tn_4096_1596_7168,Gemm_Hipblaslt_TN_9607,0.181669
GemmTunableOp_Half_TN,tn_3072_1665_4096,Gemm_Hipblaslt_TN_9163,0.088331
GemmTunableOp_Half_TN,tn_4096_7267_2048,Gemm_Hipblaslt_TN_9796,0.209542
GemmTunableOp_Half_TN,tn_4096_1966_2048,Gemm_Hipblaslt_TN_9590,0.0651108
GemmTunableOp_Half_TN,tn_4096_1642_7168,Gemm_Hipblaslt_TN_9616,0.180803
GemmTunableOp_Half_TN,tn_4096_1854_7168,Gemm_Hipblaslt_TN_9268,0.204275
GemmTunableOp_Half_TN,tn_4096_1840_2048,Gemm_Hipblaslt_TN_9137,0.0642074
GemmTunableOp_Half_TN,tn_4096_7072_7168,Gemm_Hipblaslt_TN_9694,0.675928
GemmTunableOp_Half_TN,tn_4096_184_7168,Gemm_Hipblaslt_TN_9470,0.0389413
GemmTunableOp_Half_TN,tn_3072_3767_4096,Gemm_Hipblaslt_TN_9852,0.162957
GemmTunableOp_Half_TN,tn_4096_1890_7168,Gemm_Hipblaslt_TN_9645,0.207188
GemmTunableOp_Half_TN,tn_64128_41_4096,Gemm_Hipblaslt_TN_9097,0.159337
GemmTunableOp_Half_TN,tn_4096_1815_2048,Gemm_Hipblaslt_TN_9134,0.0631852
GemmTunableOp_Half_TN,tn_4096_3600_2048,Gemm_Hipblaslt_TN_9683,0.104445
GemmTunableOp_Half_TN,tn_64128_212_4096,Gemm_Hipblaslt_TN_9898,0.273361
GemmTunableOp_Half_TN,tn_4096_6871_2048,Gemm_Hipblaslt_TN_9953,0.20306
GemmTunableOp_Half_TN,tn_3072_1745_4096,Gemm_Hipblaslt_TN_9613,0.090672
GemmTunableOp_Half_TN,tn_3072_5274_4096,Gemm_Hipblaslt_TN_9920,0.212386
GemmTunableOp_Half_TN,tn_4096_3456_2048,Gemm_Hipblaslt_TN_9896,0.0999661
GemmTunableOp_Half_TN,tn_4096_3622_7168,Gemm_Hipblaslt_TN_9187,0.344107
GemmTunableOp_Half_TN,tn_14336_1969_4096,Gemm_Hipblaslt_TN_9217,0.398112
GemmTunableOp_Half_TN,tn_64128_148_4096,Gemm_Hipblaslt_TN_9108,0.219211
GemmTunableOp_Half_TN,tn_4096_3706_7168,Gemm_Hipblaslt_TN_9768,0.359094
GemmTunableOp_Half_TN,tn_14336_1691_4096,Gemm_Hipblaslt_TN_9697,0.352579
GemmTunableOp_Half_TN,tn_64128_48_4096,Gemm_Hipblaslt_TN_9097,0.157109
GemmTunableOp_Half_TN,tn_4096_1769_2048,Gemm_Hipblaslt_TN_9268,0.0619053
GemmTunableOp_Half_TN,tn_4096_3511_7168,Gemm_Hipblaslt_TN_9697,0.335743
GemmTunableOp_Half_TN,tn_4096_3508_2048,Gemm_Hipblaslt_TN_9821,0.10305
GemmTunableOp_Half_TN,tn_3072_1610_4096,Gemm_Rocblas_621294520,0.0869477
GemmTunableOp_Half_TN,tn_14336_1721_4096,Gemm_Hipblaslt_TN_9697,0.355714
GemmTunableOp_Half_TN,tn_3072_5498_4096,Gemm_Hipblaslt_TN_9726,0.223974
GemmTunableOp_Half_TN,tn_4096_1789_2048,Gemm_Hipblaslt_TN_9329,0.0630903
GemmTunableOp_Half_TN,tn_3072_6920_4096,Gemm_Hipblaslt_TN_9681,0.303173
GemmTunableOp_Half_TN,tn_14336_3780_4096,Gemm_Hipblaslt_TN_9192,0.743038
GemmTunableOp_Half_TN,tn_14336_1935_4096,Gemm_Hipblaslt_TN_9217,0.39765
GemmTunableOp_Half_TN,tn_64128_20_4096,Gemm_Rocblas_621286348,0.144643
GemmTunableOp_Half_TN,tn_3072_232_4096,Gemm_Rocblas_621294230,0.0223931
GemmTunableOp_Half_TN,tn_64128_109_4096,Gemm_Hipblaslt_TN_9061,0.198025
GemmTunableOp_Half_TN,tn_64128_166_4096,Gemm_Hipblaslt_TN_9817,0.243788
GemmTunableOp_Half_TN,tn_4096_1685_2048,Gemm_Hipblaslt_TN_9607,0.0573933
GemmTunableOp_Half_TN,tn_14336_1799_4096,Gemm_Hipblaslt_TN_9677,0.367572
GemmTunableOp_Half_TN,tn_4096_1586_2048,Gemm_Hipblaslt_TN_9164,0.0560401
GemmTunableOp_Half_TN,tn_4096_1811_7168,Gemm_Hipblaslt_TN_9136,0.201502
GemmTunableOp_Half_TN,tn_14336_3597_4096,Gemm_Hipblaslt_TN_9192,0.724087
GemmTunableOp_Half_TN,tn_14336_7730_4096,Gemm_Hipblaslt_TN_9914,1.48621
GemmTunableOp_Half_TN,tn_64128_15_4096,Gemm_Rocblas_621286348,0.143586
GemmTunableOp_Half_TN,tn_4096_7327_7168,Gemm_Hipblaslt_TN_9914,0.708392
GemmTunableOp_Half_TN,tn_4096_1749_2048,Gemm_Hipblaslt_TN_9329,0.0616396
GemmTunableOp_Half_TN,tn_3072_5125_4096,Gemm_Hipblaslt_TN_9726,0.213582
GemmTunableOp_Half_TN,tn_4096_1873_7168,Gemm_Hipblaslt_TN_9645,0.205488
GemmTunableOp_Half_TN,tn_4096_5136_2048,Gemm_Hipblaslt_TN_9689,0.16569
GemmTunableOp_Half_TN,tn_4096_3441_2048,Gemm_Hipblaslt_TN_9684,0.101633
GemmTunableOp_Half_TN,tn_4096_1663_2048,Gemm_Hipblaslt_TN_9679,0.0579357
GemmTunableOp_Half_TN,tn_4096_1883_7168,Gemm_Hipblaslt_TN_9136,0.207419
GemmTunableOp_Half_TN,tn_14336_5067_4096,Gemm_Hipblaslt_TN_9677,0.972461
GemmTunableOp_Half_TN,tn_4096_256_2048,Gemm_Rocblas_621286439,0.0144849
GemmTunableOp_Half_TN,tn_3072_1840_4096,Gemm_Hipblaslt_TN_9324,0.090961
GemmTunableOp_Half_TN,tn_3072_5136_4096,Gemm_Rocblas_621286281,0.212044
GemmTunableOp_Half_TN,tn_3072_1670_4096,Gemm_Hipblaslt_TN_9561,0.0867553
GemmTunableOp_Half_TN,tn_4096_5354_7168,Gemm_Hipblaslt_TN_9672,0.546687
GemmTunableOp_Half_TN,tn_14336_3455_4096,Gemm_Rocblas_621286742,0.654784
GemmTunableOp_Half_TN,tn_3072_1666_4096,Gemm_Hipblaslt_TN_9148,0.0874676
GemmTunableOp_Half_TN,tn_14336_176_4096,Gemm_Hipblaslt_TN_9352,0.057112
GemmTunableOp_Half_TN,tn_4096_5273_7168,Gemm_Hipblaslt_TN_9799,0.541272
GemmTunableOp_Half_TN,tn_4096_152_7168,Gemm_Hipblaslt_TN_9298,0.0372854
GemmTunableOp_Half_TN,tn_14336_1760_4096,Gemm_Hipblaslt_TN_9793,0.36336
GemmTunableOp_Half_TN,tn_4096_3912_7168,Gemm_Hipblaslt_TN_9223,0.371104
GemmTunableOp_Half_TN,tn_64128_232_4096,Gemm_Rocblas_621286915,0.290278
GemmTunableOp_Half_TN,tn_4096_1738_7168,Gemm_Hipblaslt_TN_9673,0.197196
GemmTunableOp_Half_TN,tn_14336_1706_4096,Gemm_Hipblaslt_TN_9697,0.355025
GemmTunableOp_Half_TN,tn_4096_3547_7168,Gemm_Hipblaslt_TN_9187,0.338915
GemmTunableOp_Half_TN,tn_3072_3597_4096,Gemm_Hipblaslt_TN_9570,0.158299
GemmTunableOp_Half_TN,tn_4096_1713_7168,Gemm_Hipblaslt_TN_9265,0.184414
GemmTunableOp_Half_TN,tn_14336_3388_4096,Gemm_Hipblaslt_TN_9223,0.646141
GemmTunableOp_Half_TN,tn_4096_3830_2048,Gemm_Hipblaslt_TN_9853,0.114658
GemmTunableOp_Half_TN,tn_4096_7170_2048,Gemm_Hipblaslt_TN_9743,0.207314
GemmTunableOp_Half_TN,tn_3072_5352_4096,Gemm_Rocblas_621286281,0.214881
GemmTunableOp_Half_TN,tn_64128_167_4096,Gemm_Hipblaslt_TN_9816,0.242402
GemmTunableOp_Half_TN,tn_3072_1799_4096,Gemm_Rocblas_621294520,0.0903934
GemmTunableOp_Half_TN,tn_14336_1614_4096,Gemm_Hipblaslt_TN_9677,0.350901
GemmTunableOp_Half_TN,tn_4096_3595_7168,Gemm_Hipblaslt_TN_9683,0.341945
GemmTunableOp_Half_TN,tn_3072_3404_4096,Gemm_Hipblaslt_TN_9570,0.151689
GemmTunableOp_Half_TN,tn_4096_1673_2048,Gemm_Hipblaslt_TN_9180,0.0573325
GemmTunableOp_Half_TN,tn_14336_56_4096,Gemm_Rocblas_621286491,0.0296627
GemmTunableOp_Half_TN,tn_3072_3559_4096,Gemm_Rocblas_621286753,0.157694
GemmTunableOp_Half_TN,tn_4096_1686_7168,Gemm_Hipblaslt_TN_9265,0.183064
GemmTunableOp_Half_TN,tn_64128_143_4096,Gemm_Hipblaslt_TN_9108,0.217763
GemmTunableOp_Half_TN,tn_14336_1850_4096,Gemm_Hipblaslt_TN_9697,0.369759
GemmTunableOp_Half_TN,tn_4096_1763_2048,Gemm_Hipblaslt_TN_9329,0.0618822
GemmTunableOp_Half_TN,tn_3072_1924_4096,Gemm_Hipblaslt_TN_9633,0.0991282
GemmTunableOp_Half_TN,tn_14336_3912_4096,Gemm_Hipblaslt_TN_9697,0.759787
GemmTunableOp_Half_TN,tn_14336_6721_4096,Gemm_Hipblaslt_TN_9815,1.30768
GemmTunableOp_Half_TN,tn_14336_3573_4096,Gemm_Rocblas_621286590,0.660756
GemmTunableOp_Half_TN,tn_4096_3404_2048,Gemm_Hipblaslt_TN_9896,0.0999919
GemmTunableOp_Half_TN,tn_4096_1804_2048,Gemm_Hipblaslt_TN_9590,0.0630787
GemmTunableOp_Half_TN,tn_4096_4096_2048,Gemm_Hipblaslt_TN_9655,0.117548
GemmTunableOp_Half_TN,tn_4096_7072_2048,Gemm_Hipblaslt_TN_9743,0.205003
GemmTunableOp_Half_TN,tn_14336_1963_4096,Gemm_Hipblaslt_TN_9223,0.396353
GemmTunableOp_Half_TN,tn_4096_1825_7168,Gemm_Hipblaslt_TN_9268,0.202864
GemmTunableOp_Half_TN,tn_4096_1685_7168,Gemm_Hipblaslt_TN_9359,0.183811
GemmTunableOp_Half_TN,tn_64128_243_4096,Gemm_Rocblas_621294658,0.290791
GemmTunableOp_Half_TN,tn_14336_160_4096,Gemm_Hipblaslt_TN_9312,0.0516693
GemmTunableOp_Half_TN,tn_64128_163_4096,Gemm_Hipblaslt_TN_9818,0.242907
GemmTunableOp_Half_TN,tn_4096_96_2048,Gemm_Rocblas_621294029,0.00962278
GemmTunableOp_Half_TN,tn_64128_96_4096,Gemm_Hipblaslt_TN_9057,0.177343
GemmTunableOp_Half_TN,tn_4096_3748_2048,Gemm_Hipblaslt_TN_9768,0.111832
GemmTunableOp_Half_TN,tn_4096_5285_2048,Gemm_Hipblaslt_TN_9799,0.168157
GemmTunableOp_Half_TN,tn_4096_3475_2048,Gemm_Hipblaslt_TN_9896,0.102247
GemmTunableOp_Half_TN,tn_64128_251_4096,Gemm_Rocblas_621286915,0.29357
GemmTunableOp_Half_TN,tn_3072_1647_4096,Gemm_Hipblaslt_TN_9322,0.0884448
GemmTunableOp_Half_TN,tn_14336_1735_4096,Gemm_Hipblaslt_TN_9677,0.362797
GemmTunableOp_Half_TN,tn_14336_1858_4096,Gemm_Hipblaslt_TN_9697,0.370254
GemmTunableOp_Half_TN,tn_64128_223_4096,Gemm_Hipblaslt_TN_9919,0.277035
GemmTunableOp_Half_TN,tn_64128_146_4096,Gemm_Hipblaslt_TN_9108,0.220045
GemmTunableOp_Half_TN,tn_64128_164_4096,Gemm_Hipblaslt_TN_9953,0.244093
GemmTunableOp_Half_TN,tn_14336_7033_4096,Gemm_Hipblaslt_TN_9914,1.32071
GemmTunableOp_Half_TN,tn_4096_1820_7168,Gemm_Hipblaslt_TN_9268,0.202923
GemmTunableOp_Half_TN,tn_14336_1857_4096,Gemm_Hipblaslt_TN_9139,0.368538
GemmTunableOp_Half_TN,tn_3072_1978_4096,Gemm_Hipblaslt_TN_9587,0.100246
GemmTunableOp_Half_TN,tn_14336_1792_4096,Gemm_Hipblaslt_TN_9793,0.363622
GemmTunableOp_Half_TN,tn_4096_3640_7168,Gemm_Hipblaslt_TN_9697,0.344152
GemmTunableOp_Half_TN,tn_64128_29_4096,Gemm_Hipblaslt_TN_9094,0.146555
GemmTunableOp_Half_TN,tn_4096_7138_7168,Gemm_Hipblaslt_TN_9955,0.678727
GemmTunableOp_Half_TN,tn_64128_94_4096,Gemm_Hipblaslt_TN_9057,0.180034
GemmTunableOp_Half_TN,tn_64128_139_4096,Gemm_Hipblaslt_TN_9108,0.217141
GemmTunableOp_Half_TN,tn_4096_1970_7168,Gemm_Hipblaslt_TN_9645,0.210706
GemmTunableOp_Half_TN,tn_4096_1934_7168,Gemm_Hipblaslt_TN_9136,0.210047
GemmTunableOp_Half_TN,tn_4096_6902_2048,Gemm_Hipblaslt_TN_9953,0.204523
GemmTunableOp_Half_TN,tn_3072_3496_4096,Gemm_Rocblas_621286753,0.155659
GemmTunableOp_Half_TN,tn_11008_4096_4096,Gemm_Rocblas_621286656,0.648307
GemmTunableOp_Half_TN,tn_3072_1945_4096,Gemm_Hipblaslt_TN_9633,0.0988686
GemmTunableOp_Half_TN,tn_64128_8_4096,Gemm_Rocblas_621286348,0.14126
GemmTunableOp_Half_TN,tn_4096_1733_7168,Gemm_Hipblaslt_TN_9673,0.194931
GemmTunableOp_Half_TN,tn_3072_1902_4096,Gemm_Hipblaslt_TN_9613,0.0944156
GemmTunableOp_Half_TN,tn_3072_3666_4096,Gemm_Hipblaslt_TN_9672,0.161745
GemmTunableOp_Half_TN,tn_3072_3562_4096,Gemm_Hipblaslt_TN_9570,0.15754
GemmTunableOp_Half_TN,tn_3072_1618_4096,Gemm_Rocblas_621286778,0.0863234
GemmTunableOp_Half_TN,tn_64128_14_4096,Gemm_Rocblas_621286348,0.143408
GemmTunableOp_Half_TN,tn_14336_7023_4096,Gemm_Hipblaslt_TN_159,1.31608
GemmTunableOp_Half_TN,tn_3072_7340_4096,Gemm_Hipblaslt_TN_9779,0.326782
GemmTunableOp_Half_TN,tn_3072_3781_4096,Gemm_Hipblaslt_TN_9852,0.163911
GemmTunableOp_Half_TN,tn_14336_3768_4096,Gemm_Hipblaslt_TN_9192,0.740725
GemmTunableOp_Half_TN,tn_4096_1924_7168,Gemm_Hipblaslt_TN_9645,0.208015
GemmTunableOp_Half_TN,tn_4096_6715_2048,Gemm_Hipblaslt_TN_9743,0.197961
GemmTunableOp_Half_TN,tn_64128_62_4096,Gemm_Hipblaslt_TN_9097,0.164516
GemmTunableOp_Half_TN,tn_64128_112_4096,Gemm_Hipblaslt_TN_9061,0.198526
GemmTunableOp_Half_TN,tn_4096_1688_7168,Gemm_Hipblaslt_TN_9359,0.183327
GemmTunableOp_Half_TN,tn_4096_5322_7168,Gemm_Hipblaslt_TN_9691,0.546236
GemmTunableOp_Half_TN,tn_64128_183_4096,Gemm_Hipblaslt_TN_9862,0.246753
GemmTunableOp_Half_TN,tn_64128_78_4096,Gemm_Hipblaslt_TN_9057,0.177169
GemmTunableOp_Half_TN,tn_3072_5413_4096,Gemm_Hipblaslt_TN_9726,0.221444
GemmTunableOp_Half_TN,tn_3072_6630_4096,Gemm_Hipblaslt_TN_9681,0.297113
GemmTunableOp_Half_TN,tn_14336_7552_4096,Gemm_Hipblaslt_TN_9914,1.45898
GemmTunableOp_Half_TN,tn_14336_1954_4096,Gemm_Hipblaslt_TN_9217,0.397998
GemmTunableOp_Half_TN,tn_64128_127_4096,Gemm_Hipblaslt_TN_9263,0.203648
GemmTunableOp_Half_TN,tn_14336_7301_4096,Gemm_Hipblaslt_TN_9900,1.41825
GemmTunableOp_Half_TN,tn_3072_5605_4096,Gemm_Hipblaslt_TN_9624,0.252922
GemmTunableOp_Half_TN,tn_4096_3622_2048,Gemm_Hipblaslt_TN_9896,0.10444
GemmTunableOp_Half_TN,tn_3072_3622_4096,Gemm_Hipblaslt_TN_9570,0.159347
GemmTunableOp_Half_TN,tn_4096_3688_7168,Gemm_Hipblaslt_TN_9217,0.358394
GemmTunableOp_Half_TN,tn_3072_5442_4096,Gemm_Hipblaslt_TN_9726,0.219694
GemmTunableOp_Half_TN,tn_4096_6843_2048,Gemm_Hipblaslt_TN_9695,0.201966
GemmTunableOp_Half_TN,tn_4096_24_2048,Gemm_Rocblas_621286311,0.0071595
GemmTunableOp_Half_TN,tn_14336_7475_4096,Gemm_Hipblaslt_TN_9914,1.45916
GemmTunableOp_Half_TN,tn_3072_3830_4096,Gemm_Hipblaslt_TN_9852,0.163893
GemmTunableOp_Half_TN,tn_4096_7067_2048,Gemm_Hipblaslt_TN_9743,0.203541
GemmTunableOp_Half_TN,tn_3072_3701_4096,Gemm_Hipblaslt_TN_9852,0.163034
GemmTunableOp_Half_TN,tn_3072_1892_4096,Gemm_Hipblaslt_TN_9148,0.094123
GemmTunableOp_Half_TN,tn_14336_1660_4096,Gemm_Hipblaslt_TN_9189,0.352812
GemmTunableOp_Half_TN,tn_3072_1719_4096,Gemm_Rocblas_621286778,0.0891014
GemmTunableOp_Half_TN,tn_3072_1685_4096,Gemm_Hipblaslt_TN_9163,0.088134
GemmTunableOp_Half_TN,tn_14336_3691_4096,Gemm_Hipblaslt_TN_9697,0.737242
GemmTunableOp_Half_TN,tn_14336_3791_4096,Gemm_Hipblaslt_TN_9192,0.741113
GemmTunableOp_Half_TN,tn_4096_3588_7168,Gemm_Hipblaslt_TN_9677,0.340932
GemmTunableOp_Half_TN,tn_4096_1822_7168,Gemm_Hipblaslt_TN_9136,0.203015
GemmTunableOp_Half_TN,tn_4096_1963_7168,Gemm_Hipblaslt_TN_9645,0.209739
GemmTunableOp_Half_TN,tn_4096_1829_2048,Gemm_Hipblaslt_TN_9329,0.0639305
GemmTunableOp_Half_TN,tn_14336_1916_4096,Gemm_Hipblaslt_TN_9187,0.373743
GemmTunableOp_Half_TN,tn_11008_232_4096,Gemm_Rocblas_621286478,0.0592376
GemmTunableOp_Half_TN,tn_4096_3559_7168,Gemm_Hipblaslt_TN_9697,0.342575
GemmTunableOp_Half_TN,tn_3072_8_4096,Gemm_Rocblas_621294136,0.00820546
GemmTunableOp_Half_TN,tn_3072_3468_4096,Gemm_Hipblaslt_TN_9681,0.157122
GemmTunableOp_Half_TN,tn_3072_6744_4096,Gemm_Hipblaslt_TN_9681,0.296487
GemmTunableOp_Half_TN,tn_4096_5498_7168,Gemm_Rocblas_621294426,0.552336
GemmTunableOp_Half_TN,tn_4096_1683_2048,Gemm_Hipblaslt_TN_9164,0.057102
GemmTunableOp_Half_TN,tn_4096_7120_2048,Gemm_Hipblaslt_TN_9694,0.206298
GemmTunableOp_Half_TN,tn_14336_1698_4096,Gemm_Hipblaslt_TN_9139,0.356886
GemmTunableOp_Half_TN,tn_3072_1683_4096,Gemm_Hipblaslt_TN_9148,0.0871807
GemmTunableOp_Half_TN,tn_64128_156_4096,Gemm_Hipblaslt_TN_9108,0.22232
GemmTunableOp_Half_TN,tn_4096_1725_7168,Gemm_Hipblaslt_TN_9265,0.184503
GemmTunableOp_Half_TN,tn_4096_1839_2048,Gemm_Hipblaslt_TN_9329,0.063126
GemmTunableOp_Half_TN,tn_64128_254_4096,Gemm_Rocblas_621294658,0.292442
GemmTunableOp_Half_TN,tn_4096_3920_7168,Gemm_Hipblaslt_TN_9220,0.370102
GemmTunableOp_Half_TN,tn_4096_5413_7168,Gemm_Rocblas_621286684,0.548975
GemmTunableOp_Half_TN,tn_4096_5410_2048,Gemm_Hipblaslt_TN_9799,0.168929
GemmTunableOp_Half_TN,tn_4096_3455_7168,Gemm_Hipblaslt_TN_9682,0.331643
GemmTunableOp_Half_TN,tn_3072_7386_4096,Gemm_Hipblaslt_TN_9779,0.330016
GemmTunableOp_Half_TN,tn_14336_3830_4096,Gemm_Hipblaslt_TN_9697,0.746875
GemmTunableOp_Half_TN,tn_3072_1928_4096,Gemm_Hipblaslt_TN_9633,0.0986713
GemmTunableOp_Half_TN,tn_4096_1864_7168,Gemm_Hipblaslt_TN_9136,0.205864
GemmTunableOp_Half_TN,tn_14336_3595_4096,Gemm_Hipblaslt_TN_9677,0.725908
GemmTunableOp_Half_TN,tn_4096_5068_2048,Gemm_Hipblaslt_TN_9690,0.165785
GemmTunableOp_Half_TN,tn_3072_7568_4096,Gemm_Hipblaslt_TN_9924,0.332154
GemmTunableOp_Half_TN,tn_3072_1702_4096,Gemm_Hipblaslt_TN_9148,0.0882491
GemmTunableOp_Half_TN,tn_4096_1829_7168,Gemm_Hipblaslt_TN_9268,0.201909
GemmTunableOp_Half_TN,tn_4096_1593_7168,Gemm_Hipblaslt_TN_9679,0.179578
GemmTunableOp_Half_TN,tn_4096_1748_7168,Gemm_Hipblaslt_TN_9645,0.199113
GemmTunableOp_Half_TN,tn_64128_90_4096,Gemm_Hipblaslt_TN_9057,0.18119
GemmTunableOp_Half_TN,tn_3072_3682_4096,Gemm_Hipblaslt_TN_9852,0.161848
GemmTunableOp_Half_TN,tn_3072_6721_4096,Gemm_Hipblaslt_TN_9688,0.293846
GemmTunableOp_Half_TN,tn_14336_1770_4096,Gemm_Hipblaslt_TN_9793,0.365622
GemmTunableOp_Half_TN,tn_3072_3764_4096,Gemm_Hipblaslt_TN_9800,0.164611
GemmTunableOp_Half_TN,tn_4096_3494_2048,Gemm_Hipblaslt_TN_9896,0.102392
GemmTunableOp_Half_TN,tn_4096_1862_2048,Gemm_Hipblaslt_TN_9136,0.0631744
GemmTunableOp_Half_TN,tn_64128_248_4096,Gemm_Rocblas_621294658,0.294384
GemmTunableOp_Half_TN,tn_3072_3589_4096,Gemm_Hipblaslt_TN_9681,0.158374
GemmTunableOp_Half_TN,tn_3072_1970_4096,Gemm_Hipblaslt_TN_9633,0.098859
GemmTunableOp_Half_TN,tn_4096_3713_2048,Gemm_Hipblaslt_TN_9704,0.110413
GemmTunableOp_Half_TN,tn_3072_7171_4096,Gemm_Hipblaslt_TN_9681,0.309057
GemmTunableOp_Half_TN,tn_14336_1847_4096,Gemm_Hipblaslt_TN_9697,0.370243
GemmTunableOp_Half_TN,tn_4096_3647_7168,Gemm_Hipblaslt_TN_9139,0.344106
GemmTunableOp_Half_TN,tn_14336_1827_4096,Gemm_Hipblaslt_TN_9697,0.367464
GemmTunableOp_Half_TN,tn_4096_5359_7168,Gemm_Rocblas_621294426,0.547929
GemmTunableOp_Half_TN,tn_4096_32_7168,Gemm_Rocblas_621286305,0.0154202
GemmTunableOp_Half_TN,tn_4096_1827_2048,Gemm_Hipblaslt_TN_9590,0.0633229
GemmTunableOp_Half_TN,tn_3072_7552_4096,Gemm_Hipblaslt_TN_9800,0.330398
GemmTunableOp_Half_TN,tn_4096_3584_2048,Gemm_Hipblaslt_TN_9696,0.10412
GemmTunableOp_Half_TN,tn_4096_3535_2048,Gemm_Hipblaslt_TN_9896,0.103159
GemmTunableOp_Half_TN,tn_14336_3713_4096,Gemm_Hipblaslt_TN_9187,0.737241
GemmTunableOp_Half_TN,tn_14336_6976_4096,Gemm_Hipblaslt_TN_9914,1.32039
GemmTunableOp_Half_TN,tn_4096_3589_7168,Gemm_Hipblaslt_TN_9697,0.342656
GemmTunableOp_Half_TN,tn_4096_1689_7168,Gemm_Hipblaslt_TN_9359,0.183908
GemmTunableOp_Half_TN,tn_14336_3379_4096,Gemm_Rocblas_621294492,0.648407
GemmTunableOp_Half_TN,tn_4096_5030_7168,Gemm_Hipblaslt_TN_9681,0.518819
GemmTunableOp_Half_TN,tn_4096_3781_2048,Gemm_Hipblaslt_TN_9190,0.113637
GemmTunableOp_Half_TN,tn_4096_1614_2048,Gemm_Hipblaslt_TN_9607,0.055625
GemmTunableOp_Half_TN,tn_3072_7190_4096,Gemm_Hipblaslt_TN_9681,0.307504
GemmTunableOp_Half_TN,tn_14336_3565_4096,Gemm_Rocblas_621294330,0.661898
GemmTunableOp_Half_TN,tn_14336_1958_4096,Gemm_Hipblaslt_TN_9223,0.398635
GemmTunableOp_Half_TN,tn_4096_1771_7168,Gemm_Hipblaslt_TN_9136,0.198388
GemmTunableOp_Half_TN,tn_14336_1883_4096,Gemm_Hipblaslt_TN_9697,0.371045
GemmTunableOp_Half_TN,tn_14336_5541_4096,Gemm_Rocblas_621294492,1.0721
GemmTunableOp_Half_TN,tn_4096_7475_2048,Gemm_Hipblaslt_TN_9704,0.223245
GemmTunableOp_Half_TN,tn_3072_5680_4096,Gemm_Hipblaslt_TN_9624,0.254619
GemmTunableOp_Half_TN,tn_4096_1810_2048,Gemm_Hipblaslt_TN_9590,0.0632919
GemmTunableOp_Half_TN,tn_4096_1625_7168,Gemm_Hipblaslt_TN_9359,0.179008
GemmTunableOp_Half_TN,tn_14336_7364_4096,Gemm_Hipblaslt_TN_9900,1.41348
GemmTunableOp_Half_TN,tn_14336_1737_4096,Gemm_Hipblaslt_TN_9793,0.362655
GemmTunableOp_Half_TN,tn_14336_3630_4096,Gemm_Hipblaslt_TN_9677,0.7274
GemmTunableOp_Half_TN,tn_4096_5470_2048,Gemm_Hipblaslt_TN_9799,0.170308
GemmTunableOp_Half_TN,tn_4096_7096_2048,Gemm_Hipblaslt_TN_9694,0.202034
GemmTunableOp_Half_TN,tn_4096_7109_7168,Gemm_Hipblaslt_TN_9743,0.67455
GemmTunableOp_Half_TN,tn_4096_56_2048,Gemm_Rocblas_621294155,0.00798113
GemmTunableOp_Half_TN,tn_4096_1763_7168,Gemm_Hipblaslt_TN_9329,0.197875
GemmTunableOp_Half_TN,tn_3072_3494_4096,Gemm_Rocblas_621294495,0.155739
GemmTunableOp_Half_TN,tn_4096_3553_2048,Gemm_Hipblaslt_TN_9896,0.1032
GemmTunableOp_Half_TN,tn_4096_1826_2048,Gemm_Hipblaslt_TN_9590,0.0620602
GemmTunableOp_Half_TN,tn_14336_7190_4096,Gemm_Hipblaslt_TN_9683,1.38255
GemmTunableOp_Half_TN,tn_3072_1686_4096,Gemm_Hipblaslt_TN_9148,0.0881373
GemmTunableOp_Half_TN,tn_3072_1713_4096,Gemm_Hipblaslt_TN_9148,0.0871871
GemmTunableOp_Half_TN,tn_4096_1879_7168,Gemm_Hipblaslt_TN_9645,0.205764
GemmTunableOp_Half_TN,tn_4096_3494_7168,Gemm_Hipblaslt_TN_9677,0.336016
GemmTunableOp_Half_TN,tn_4096_1909_7168,Gemm_Hipblaslt_TN_9134,0.206561
GemmTunableOp_Half_TN,tn_4096_5427_7168,Gemm_Rocblas_621294426,0.547975
GemmTunableOp_Half_TN,tn_4096_80_7168,Gemm_Rocblas_621294028,0.0243824
GemmTunableOp_Half_TN,tn_4096_208_2048,Gemm_Rocblas_621294175,0.014069
GemmTunableOp_Half_TN,tn_64128_242_4096,Gemm_Rocblas_621286915,0.29215
GemmTunableOp_Half_TN,tn_4096_3382_7168,Gemm_Hipblaslt_TN_9682,0.327422
GemmTunableOp_Half_TN,tn_64128_50_4096,Gemm_Hipblaslt_TN_9097,0.161187
GemmTunableOp_Half_TN,tn_4096_1789_7168,Gemm_Hipblaslt_TN_9645,0.200358
GemmTunableOp_Half_TN,tn_4096_1902_2048,Gemm_Hipblaslt_TN_9590,0.0633097
GemmTunableOp_Half_TN,tn_4096_7240_7168,Gemm_Hipblaslt_TN_9743,0.681341
GemmTunableOp_Half_TN,tn_4096_160_2048,Gemm_Rocblas_621294171,0.0130718
GemmTunableOp_Half_TN,tn_3072_3602_4096,Gemm_Hipblaslt_TN_9629,0.158701
GemmTunableOp_Half_TN,tn_64128_135_4096,Gemm_Hipblaslt_TN_9108,0.217506
GemmTunableOp_Half_TN,tn_4096_3416_7168,Gemm_Hipblaslt_TN_9682,0.3318
GemmTunableOp_Half_TN,tn_4096_6747_2048,Gemm_Hipblaslt_TN_9857,0.202286
GemmTunableOp_Half_TN,tn_4096_1896_7168,Gemm_Hipblaslt_TN_9645,0.207501
GemmTunableOp_Half_TN,tn_4096_1846_7168,Gemm_Hipblaslt_TN_9137,0.203969
GemmTunableOp_Half_TN,tn_4096_1855_7168,Gemm_Hipblaslt_TN_9267,0.203304
GemmTunableOp_Half_TN,tn_14336_1790_4096,Gemm_Hipblaslt_TN_9192,0.364416
GemmTunableOp_Half_TN,tn_3072_1673_4096,Gemm_Hipblaslt_TN_9561,0.0880528
GemmTunableOp_Half_TN,tn_4096_1573_2048,Gemm_Hipblaslt_TN_9587,0.054157
GemmTunableOp_Half_TN,tn_4096_7478_2048,Gemm_Hipblaslt_TN_9768,0.223221
GemmTunableOp_Half_TN,tn_3072_56_4096,Gemm_Rocblas_621294146,0.0106796
GemmTunableOp_Half_TN,tn_3072_7139_4096,Gemm_Hipblaslt_TN_9681,0.308366
GemmTunableOp_Half_TN,tn_4096_1842_7168,Gemm_Hipblaslt_TN_9268,0.203055
GemmTunableOp_Half_TN,tn_14336_3647_4096,Gemm_Hipblaslt_TN_9192,0.724967
GemmTunableOp_Half_TN,tn_4096_3478_7168,Gemm_Hipblaslt_TN_9697,0.334755
GemmTunableOp_Half_TN,tn_3072_7118_4096,Gemm_Hipblaslt_TN_9619,0.310074
GemmTunableOp_Half_TN,tn_64128_218_4096,Gemm_Hipblaslt_TN_9919,0.278275
GemmTunableOp_Half_TN,tn_4096_3441_7168,Gemm_Hipblaslt_TN_9695,0.331558
GemmTunableOp_Half_TN,tn_64128_30_4096,Gemm_Hipblaslt_TN_9094,0.146655
GemmTunableOp_Half_TN,tn_4096_1622_7168,Gemm_Hipblaslt_TN_9587,0.180585
GemmTunableOp_Half_TN,tn_4096_5301_2048,Gemm_Hipblaslt_TN_9672,0.169057
GemmTunableOp_Half_TN,tn_14336_152_4096,Gemm_Hipblaslt_TN_9312,0.0516727
GemmTunableOp_Half_TN,tn_3072_1735_4096,Gemm_Hipblaslt_TN_9163,0.0883178
GemmTunableOp_Half_TN,tn_3072_6868_4096,Gemm_Hipblaslt_TN_9681,0.298783
GemmTunableOp_Half_TN,tn_14336_144_4096,Gemm_Hipblaslt_TN_9312,0.0506925
GemmTunableOp_Half_TN,tn_3072_7344_4096,Gemm_Hipblaslt_TN_9924,0.325195
GemmTunableOp_Half_TN,tn_4096_3557_7168,Gemm_Hipblaslt_TN_9677,0.338914
GemmTunableOp_Half_TN,tn_64128_233_4096,Gemm_Rocblas_621286915,0.289648
GemmTunableOp_Half_TN,tn_14336_1764_4096,Gemm_Hipblaslt_TN_9793,0.364688
GemmTunableOp_Half_TN,tn_14336_3855_4096,Gemm_Hipblaslt_TN_9187,0.753736
GemmTunableOp_Half_TN,tn_3072_7191_4096,Gemm_Hipblaslt_TN_9681,0.309731
GemmTunableOp_Half_TN,tn_3072_1838_4096,Gemm_Hipblaslt_TN_9324,0.0927031
GemmTunableOp_Half_TN,tn_3072_1770_4096,Gemm_Hipblaslt_TN_9613,0.0921533
GemmTunableOp_Half_TN,tn_4096_1757_2048,Gemm_Hipblaslt_TN_9136,0.0624506
GemmTunableOp_Half_TN,tn_4096_5352_7168,Gemm_Hipblaslt_TN_9690,0.545973
GemmTunableOp_Half_TN,tn_3072_248_4096,Gemm_Rocblas_621286491,0.0227288
GemmTunableOp_Half_TN,tn_14336_1789_4096,Gemm_Hipblaslt_TN_9793,0.366096
GemmTunableOp_Half_TN,tn_4096_1760_7168,Gemm_Hipblaslt_TN_9673,0.199267
GemmTunableOp_Half_TN,tn_3072_6916_4096,Gemm_Hipblaslt_TN_9681,0.302694
GemmTunableOp_Half_TN,tn_14336_3508_4096,Gemm_Hipblaslt_TN_9220,0.651245
GemmTunableOp_Half_TN,tn_64128_181_4096,Gemm_Hipblaslt_TN_9855,0.249224
GemmTunableOp_Half_TN,tn_4096_1722_2048,Gemm_Hipblaslt_TN_9164,0.0574247
GemmTunableOp_Half_TN,tn_4096_3581_2048,Gemm_Hipblaslt_TN_9896,0.105136
GemmTunableOp_Half_TN,tn_64128_85_4096,Gemm_Hipblaslt_TN_9057,0.177953
GemmTunableOp_Half_TN,tn_4096_72_2048,Gemm_Rocblas_621286278,0.00894457
GemmTunableOp_Half_TN,tn_4096_24_7168,Gemm_Rocblas_621294044,0.0150994
GemmTunableOp_Half_TN,tn_3072_6843_4096,Gemm_Hipblaslt_TN_9681,0.296673
GemmTunableOp_Half_TN,tn_4096_96_7168,Gemm_Rocblas_621286279,0.0245142
GemmTunableOp_Half_TN,tn_64128_169_4096,Gemm_Hipblaslt_TN_9661,0.244391
GemmTunableOp_Half_TN,tn_4096_6789_2048,Gemm_Hipblaslt_TN_9683,0.203404
GemmTunableOp_Half_TN,tn_4096_1945_2048,Gemm_Hipblaslt_TN_9134,0.0646065
GemmTunableOp_Half_TN,tn_14336_3547_4096,Gemm_Rocblas_621294492,0.65703
GemmTunableOp_Half_TN,tn_4096_7021_2048,Gemm_Hipblaslt_TN_9694,0.204897
GemmTunableOp_Half_TN,tn_4096_3455_2048,Gemm_Hipblaslt_TN_9896,0.101216
GemmTunableOp_Half_TN,tn_4096_6990_2048,Gemm_Hipblaslt_TN_9743,0.204314
GemmStridedBatchedTunableOp_Half_TN,tn_1647_1647_128_B_16,Gemm_Hipblaslt_TN_7483,0.0670022
GemmStridedBatchedTunableOp_Half_TN,tn_1778_1778_128_B_16,Gemm_Rocblas_621286260,0.0768156
GemmStridedBatchedTunableOp_Half_TN,tn_1670_1670_128_B_16,Gemm_Rocblas_621294650,0.0701517
GemmStridedBatchedTunableOp_Half_TN,tn_1603_1603_128_B_16,Gemm_Hipblaslt_TN_7483,0.0653974
GemmStridedBatchedTunableOp_Half_TN,tn_1612_1612_128_B_16,Gemm_Rocblas_621294754,0.066111
GemmStridedBatchedTunableOp_Half_TN,tn_1748_1748_128_B_16,Gemm_Hipblaslt_TN_6929,0.0731117
GemmStridedBatchedTunableOp_Half_TN,tn_1604_1604_128_B_16,Gemm_Rocblas_621294109,0.0664439
GemmStridedBatchedTunableOp_Half_TN,tn_1594_1594_128_B_16,Gemm_Hipblaslt_TN_7483,0.0639396
GemmStridedBatchedTunableOp_Half_TN,tn_1948_1948_128_B_16,Gemm_Hipblaslt_TN_6929,0.0856217
GemmStridedBatchedTunableOp_Half_TN,tn_1900_1900_128_B_16,Gemm_Hipblaslt_TN_7483,0.0827628
GemmStridedBatchedTunableOp_Half_TN,tn_1790_1790_128_B_16,Gemm_Hipblaslt_TN_7483,0.0759611
GemmStridedBatchedTunableOp_Half_TN,tn_1731_1731_128_B_16,Gemm_Rocblas_621286413,0.0748366
GemmStridedBatchedTunableOp_Half_TN,tn_1717_1717_128_B_16,Gemm_Rocblas_621294754,0.0704741
GemmStridedBatchedTunableOp_Half_TN,tn_1801_1801_128_B_16,Gemm_Hipblaslt_TN_6929,0.0786476
GemmStridedBatchedTunableOp_Half_TN,tn_1645_1645_128_B_16,Gemm_Hipblaslt_TN_7483,0.0660309
GemmStridedBatchedTunableOp_Half_TN,tn_1655_1655_128_B_16,Gemm_Rocblas_621294754,0.0658343
GemmStridedBatchedTunableOp_Half_TN,tn_1816_1816_128_B_16,Gemm_Hipblaslt_TN_150,0.0759586
GemmStridedBatchedTunableOp_Half_TN,tn_1848_1848_128_B_16,Gemm_Hipblaslt_TN_150,0.077588
GemmStridedBatchedTunableOp_Half_TN,tn_1828_1828_128_B_16,Gemm_Hipblaslt_TN_6942,0.0793342
GemmStridedBatchedTunableOp_Half_TN,tn_1905_1905_128_B_16,Gemm_Hipblaslt_TN_6942,0.0840375
GemmStridedBatchedTunableOp_Half_TN,tn_1785_1785_128_B_16,Gemm_Hipblaslt_TN_7483,0.0764426
GemmStridedBatchedTunableOp_Half_TN,tn_1646_1646_128_B_16,Gemm_Hipblaslt_TN_7483,0.0660269
GemmStridedBatchedTunableOp_Half_TN,tn_1712_1712_128_B_16,Gemm_Rocblas_621286413,0.0675478
GemmStridedBatchedTunableOp_Half_TN,tn_1949_1949_128_B_16,Gemm_Rocblas_621294533,0.0889792
GemmStridedBatchedTunableOp_Half_TN,tn_1832_1832_128_B_16,Gemm_Hipblaslt_TN_150,0.0758477
GemmStridedBatchedTunableOp_Half_TN,tn_1825_1825_128_B_16,Gemm_Hipblaslt_TN_6928,0.0789569
GemmStridedBatchedTunableOp_Half_TN,tn_1955_1955_128_B_16,Gemm_Hipblaslt_TN_6929,0.0884112
GemmStridedBatchedTunableOp_Half_TN,tn_1653_1653_128_B_16,Gemm_Rocblas_621294517,0.0693097
GemmStridedBatchedTunableOp_Half_TN,tn_1779_1779_128_B_16,Gemm_Hipblaslt_TN_6929,0.0749562
GemmStridedBatchedTunableOp_Half_TN,tn_1873_1873_128_B_16,Gemm_Hipblaslt_TN_7483,0.0822997
GemmStridedBatchedTunableOp_Half_TN,tn_1618_1618_128_B_16,Gemm_Hipblaslt_TN_7483,0.0645569
GemmStridedBatchedTunableOp_Half_TN,tn_1707_1707_128_B_16,Gemm_Rocblas_621294754,0.0721594
GemmStridedBatchedTunableOp_Half_TN,tn_1716_1716_128_B_16,Gemm_Rocblas_621286413,0.0704801
GemmStridedBatchedTunableOp_Half_TN,tn_1953_1953_128_B_16,Gemm_Hipblaslt_TN_6879,0.0876234
GemmStridedBatchedTunableOp_Half_TN,tn_1852_1852_128_B_16,Gemm_Hipblaslt_TN_6942,0.0806139
GemmStridedBatchedTunableOp_Half_TN,tn_1626_1626_128_B_16,Gemm_Rocblas_621294516,0.0674469
GemmStridedBatchedTunableOp_Half_TN,tn_1914_1914_128_B_16,Gemm_Hipblaslt_TN_6942,0.0835786
GemmStridedBatchedTunableOp_Half_TN,tn_1742_1742_128_B_16,Gemm_Rocblas_621286413,0.0736377
GemmStridedBatchedTunableOp_Half_TN,tn_1799_1799_128_B_16,Gemm_Hipblaslt_TN_6942,0.0796491
GemmStridedBatchedTunableOp_Half_TN,tn_1763_1763_128_B_16,Gemm_Hipblaslt_TN_7483,0.0748813
GemmStridedBatchedTunableOp_Half_TN,tn_1976_1976_128_B_16,Gemm_Hipblaslt_TN_150,0.0808845
GemmStridedBatchedTunableOp_Half_TN,tn_1839_1839_128_B_16,Gemm_Hipblaslt_TN_6929,0.0791006
GemmStridedBatchedTunableOp_Half_TN,tn_1769_1769_128_B_16,Gemm_Hipblaslt_TN_7483,0.0765333
GemmStridedBatchedTunableOp_Half_TN,tn_1954_1954_128_B_16,Gemm_Hipblaslt_TN_6929,0.0862842
GemmStridedBatchedTunableOp_Half_TN,tn_1681_1681_128_B_16,Gemm_Hipblaslt_TN_6929,0.0710281
GemmStridedBatchedTunableOp_Half_TN,tn_1775_1775_128_B_16,Gemm_Hipblaslt_TN_7519,0.0756933
GemmStridedBatchedTunableOp_Half_TN,tn_1693_1693_128_B_16,Gemm_Rocblas_621294754,0.0682289
GemmStridedBatchedTunableOp_Half_TN,tn_1706_1706_128_B_16,Gemm_Rocblas_621294754,0.0705408
GemmStridedBatchedTunableOp_Half_TN,tn_1701_1701_128_B_16,Gemm_Rocblas_621294754,0.07025
GemmStridedBatchedTunableOp_Half_TN,tn_1983_1983_128_B_16,Gemm_Rocblas_621286807,0.0899786
GemmStridedBatchedTunableOp_Half_TN,tn_1644_1644_128_B_16,Gemm_Hipblaslt_TN_7483,0.0653692
GemmStridedBatchedTunableOp_Half_TN,tn_1871_1871_128_B_16,Gemm_Hipblaslt_TN_7483,0.0827298
GemmStridedBatchedTunableOp_Half_TN,tn_1759_1759_128_B_16,Gemm_Hipblaslt_TN_7483,0.0745888
GemmStridedBatchedTunableOp_Half_TN,tn_1805_1805_128_B_16,Gemm_Hipblaslt_TN_6942,0.0800782
GemmStridedBatchedTunableOp_Half_TN,tn_1601_1601_128_B_16,Gemm_Rocblas_621294635,0.0652846
GemmStridedBatchedTunableOp_Half_TN,tn_1592_1592_128_B_16,Gemm_Hipblaslt_TN_7519,0.0634035
GemmStridedBatchedTunableOp_Half_TN,tn_1675_1675_128_B_16,Gemm_Rocblas_621294754,0.0717159
GemmStridedBatchedTunableOp_Half_TN,tn_1813_1813_128_B_16,Gemm_Hipblaslt_TN_6929,0.0781921
GemmStridedBatchedTunableOp_Half_TN,tn_1589_1589_128_B_16,Gemm_Rocblas_621294538,0.065892
GemmStridedBatchedTunableOp_Half_TN,tn_1924_1924_128_B_16,Gemm_Hipblaslt_TN_6929,0.0843504
GemmStridedBatchedTunableOp_Half_TN,tn_1718_1718_128_B_16,Gemm_Rocblas_621286413,0.0708053
GemmStridedBatchedTunableOp_Half_TN,tn_1609_1609_128_B_16,Gemm_Hipblaslt_TN_7483,0.0639132
GemmStridedBatchedTunableOp_Half_TN,tn_1975_1975_128_B_16,Gemm_Hipblaslt_TN_6867,0.0888512
GemmStridedBatchedTunableOp_Half_TN,tn_1834_1834_128_B_16,Gemm_Hipblaslt_TN_6942,0.081373
GemmStridedBatchedTunableOp_Half_TN,tn_1715_1715_128_B_16,Gemm_Rocblas_621294754,0.0719838
GemmStridedBatchedTunableOp_Half_TN,tn_1937_1937_128_B_16,Gemm_Hipblaslt_TN_6867,0.0868829
GemmStridedBatchedTunableOp_Half_TN,tn_1981_1981_128_B_16,Gemm_Hipblaslt_TN_6867,0.0884173
GemmStridedBatchedTunableOp_Half_TN,tn_1590_1590_128_B_16,Gemm_Hipblaslt_TN_7483,0.0652203
GemmStridedBatchedTunableOp_Half_TN,tn_1679_1679_128_B_16,Gemm_Rocblas_621294754,0.0702288
GemmStridedBatchedTunableOp_Half_TN,tn_1796_1796_128_B_16,Gemm_Rocblas_621294754,0.0778783
GemmStridedBatchedTunableOp_Half_TN,tn_1935_1935_128_B_16,Gemm_Hipblaslt_TN_6867,0.0863172
GemmStridedBatchedTunableOp_Half_TN,tn_1868_1868_128_B_16,Gemm_Hipblaslt_TN_6942,0.0816763
GemmStridedBatchedTunableOp_Half_TN,tn_1844_1844_128_B_16,Gemm_Hipblaslt_TN_6942,0.079905
GemmStridedBatchedTunableOp_Half_TN,tn_1872_1872_128_B_16,Gemm_Hipblaslt_TN_150,0.0741879
GemmStridedBatchedTunableOp_Half_TN,tn_1702_1702_128_B_16,Gemm_Rocblas_621286413,0.0708586
GemmStridedBatchedTunableOp_Half_TN,tn_1901_1901_128_B_16,Gemm_Hipblaslt_TN_6929,0.0833327
GemmStridedBatchedTunableOp_Half_TN,tn_1637_1637_128_B_16,Gemm_Hipblaslt_TN_7483,0.0671236
GemmStridedBatchedTunableOp_Half_TN,tn_32_32_128_B_16,Gemm_Rocblas_621294062,0.00619526
GemmStridedBatchedTunableOp_Half_TN,tn_1700_1700_128_B_16,Gemm_Rocblas_621294754,0.0687422
GemmStridedBatchedTunableOp_Half_TN,tn_1660_1660_128_B_16,Gemm_Hipblaslt_TN_7483,0.0650222
GemmStridedBatchedTunableOp_Half_TN,tn_1815_1815_128_B_16,Gemm_Hipblaslt_TN_6942,0.0802424
GemmStridedBatchedTunableOp_Half_TN,tn_1942_1942_128_B_16,Gemm_Hipblaslt_TN_6929,0.0858699
GemmStridedBatchedTunableOp_Half_TN,tn_1673_1673_128_B_16,Gemm_Rocblas_621294754,0.0693956
GemmStridedBatchedTunableOp_Half_TN,tn_1736_1736_128_B_16,Gemm_Hipblaslt_TN_149,0.0703072
GemmStridedBatchedTunableOp_Half_TN,tn_1938_1938_128_B_16,Gemm_Hipblaslt_TN_6867,0.0864384
GemmStridedBatchedTunableOp_Half_TN,tn_1972_1972_128_B_16,Gemm_Hipblaslt_TN_6867,0.0884014
GemmStridedBatchedTunableOp_Half_TN,tn_1826_1826_128_B_16,Gemm_Hipblaslt_TN_6929,0.0792567
GemmStridedBatchedTunableOp_Half_TN,tn_1908_1908_128_B_16,Gemm_Hipblaslt_TN_6942,0.0836092
GemmStridedBatchedTunableOp_Half_TN,tn_1776_1776_128_B_16,Gemm_Rocblas_621286411,0.0710466
GemmStridedBatchedTunableOp_Half_TN,tn_1704_1704_128_B_16,Gemm_Rocblas_621286413,0.0696093
GemmStridedBatchedTunableOp_Half_TN,tn_1698_1698_128_B_16,Gemm_Rocblas_621286397,0.0712426
GemmStridedBatchedTunableOp_Half_TN,tn_1619_1619_128_B_16,Gemm_Hipblaslt_TN_7483,0.0656786
GemmStridedBatchedTunableOp_Half_TN,tn_1931_1931_128_B_16,Gemm_Hipblaslt_TN_6929,0.0858787
GemmStridedBatchedTunableOp_Half_TN,tn_1620_1620_128_B_16,Gemm_Hipblaslt_TN_7483,0.0675618
GemmTunableOp_Half_TN,tn_4096_6979_7168,Gemm_Hipblaslt_TN_9694,0.689245
GemmTunableOp_Half_TN,tn_14336_3581_4096,Gemm_Hipblaslt_TN_9223,0.685599
GemmTunableOp_Half_TN,tn_64128_122_4096,Gemm_Rocblas_621294762,0.202381
GemmTunableOp_Half_TN,tn_64128_35_4096,Gemm_Hipblaslt_TN_9144,0.156559
GemmTunableOp_Half_TN,tn_3072_3564_4096,Gemm_Rocblas_621286753,0.159887
GemmTunableOp_Half_TN,tn_14336_3710_4096,Gemm_Hipblaslt_TN_9677,0.760151
GemmTunableOp_Half_TN,tn_4096_1704_7168,Gemm_Hipblaslt_TN_9359,0.188734
GemmTunableOp_Half_TN,tn_4096_7027_7168,Gemm_Hipblaslt_TN_9743,0.69059
GemmTunableOp_Half_TN,tn_4096_7196_7168,Gemm_Rocblas_621294443,0.705099
GemmTunableOp_Half_TN,tn_3072_1931_4096,Gemm_Hipblaslt_TN_9633,0.100361
GemmTunableOp_Half_TN,tn_4096_1831_2048,Gemm_Hipblaslt_TN_9590,0.0643145
GemmTunableOp_Half_TN,tn_14336_1810_4096,Gemm_Hipblaslt_TN_9187,0.377556
GemmTunableOp_Half_TN,tn_3072_7067_4096,Gemm_Hipblaslt_TN_9681,0.313837
GemmTunableOp_Half_TN,tn_3072_3645_4096,Gemm_Hipblaslt_TN_9619,0.164243
GemmTunableOp_Half_TN,tn_64128_10_4096,Gemm_Rocblas_621286348,0.143168
GemmTunableOp_Half_TN,tn_14336_3466_4096,Gemm_Hipblaslt_TN_9223,0.677231
GemmTunableOp_Half_TN,tn_14336_1688_4096,Gemm_Hipblaslt_TN_9697,0.360005
GemmTunableOp_Half_TN,tn_3072_1646_4096,Gemm_Hipblaslt_TN_9163,0.0894366
GemmTunableOp_Half_TN,tn_14336_1781_4096,Gemm_Hipblaslt_TN_9192,0.372224
GemmTunableOp_Half_TN,tn_4096_40_7168,Gemm_Rocblas_621286332,0.0179894
GemmTunableOp_Half_TN,tn_4096_1828_2048,Gemm_Hipblaslt_TN_9590,0.0637514
GemmTunableOp_Half_TN,tn_14336_1779_4096,Gemm_Hipblaslt_TN_9139,0.374045
GemmTunableOp_Half_TN,tn_4096_3651_2048,Gemm_Hipblaslt_TN_9190,0.113581
GemmTunableOp_Half_TN,tn_14336_1680_4096,Gemm_Hipblaslt_TN_9677,0.361234
GemmTunableOp_Half_TN,tn_14336_1684_4096,Gemm_Hipblaslt_TN_9139,0.362206
GemmTunableOp_Half_TN,tn_3072_1894_4096,Gemm_Hipblaslt_TN_9613,0.0958348
GemmTunableOp_Half_TN,tn_4096_3564_7168,Gemm_Hipblaslt_TN_9682,0.346981
GemmTunableOp_Half_TN,tn_4096_5157_2048,Gemm_Hipblaslt_TN_9709,0.167499
GemmTunableOp_Half_TN,tn_14336_1607_4096,Gemm_Hipblaslt_TN_9189,0.357896
GemmTunableOp_Half_TN,tn_4096_3496_2048,Gemm_Hipblaslt_TN_9683,0.10595
GemmTunableOp_Half_TN,tn_3072_1667_4096,Gemm_Hipblaslt_TN_9561,0.0908009
GemmTunableOp_Half_TN,tn_3072_1934_4096,Gemm_Hipblaslt_TN_9633,0.101094
GemmTunableOp_Half_TN,tn_3072_1815_4096,Gemm_Rocblas_621286778,0.0936122
GemmTunableOp_Half_TN,tn_4096_6721_7168,Gemm_Hipblaslt_TN_9694,0.675236
GemmTunableOp_Half_TN,tn_14336_1887_4096,Gemm_Hipblaslt_TN_9677,0.379603
GemmTunableOp_Half_TN,tn_3072_1790_4096,Gemm_Rocblas_621286778,0.0933739
GemmTunableOp_Half_TN,tn_3072_1784_4096,Gemm_Hipblaslt_TN_9322,0.0927567
GemmTunableOp_Half_TN,tn_4096_1774_7168,Gemm_Hipblaslt_TN_9645,0.20381
GemmTunableOp_Half_TN,tn_3072_3466_4096,Gemm_Rocblas_621286753,0.160773
GemmTunableOp_Half_TN,tn_14336_3688_4096,Gemm_Hipblaslt_TN_9192,0.756039
GemmTunableOp_Half_TN,tn_14336_3526_4096,Gemm_Hipblaslt_TN_9217,0.680737
GemmTunableOp_Half_TN,tn_3072_1805_4096,Gemm_Hipblaslt_TN_9322,0.0938184
GemmTunableOp_Half_TN,tn_4096_1707_2048,Gemm_Hipblaslt_TN_9588,0.0595294
GemmTunableOp_Half_TN,tn_4096_104_2048,Gemm_Rocblas_621286278,0.010777
GemmTunableOp_Half_TN,tn_4096_1946_2048,Gemm_Hipblaslt_TN_9620,0.0665979
GemmTunableOp_Half_TN,tn_4096_1592_7168,Gemm_Hipblaslt_TN_9359,0.183595
GemmTunableOp_Half_TN,tn_4096_1831_7168,Gemm_Hipblaslt_TN_9134,0.208752
GemmTunableOp_Half_TN,tn_64128_21_4096,Gemm_Rocblas_621286348,0.147144
GemmTunableOp_Half_TN,tn_4096_1801_7168,Gemm_Hipblaslt_TN_9268,0.206867
GemmTunableOp_Half_TN,tn_14336_3515_4096,Gemm_Hipblaslt_TN_9220,0.682201
GemmTunableOp_Half_TN,tn_4096_5219_2048,Gemm_Hipblaslt_TN_9709,0.169405
GemmTunableOp_Half_TN,tn_4096_1765_2048,Gemm_Hipblaslt_TN_9680,0.0635574
GemmTunableOp_Half_TN,tn_3072_3535_4096,Gemm_Rocblas_621286753,0.15914
GemmTunableOp_Half_TN,tn_3072_7186_4096,Gemm_Hipblaslt_TN_9681,0.317959
GemmTunableOp_Half_TN,tn_14336_1704_4096,Gemm_Hipblaslt_TN_9139,0.363855
GemmTunableOp_Half_TN,tn_3072_6871_4096,Gemm_Hipblaslt_TN_9619,0.308469
GemmTunableOp_Half_TN,tn_3072_1607_4096,Gemm_Rocblas_621294520,0.0882127
GemmTunableOp_Half_TN,tn_14336_6747_4096,Gemm_Hipblaslt_TN_9753,1.34881
GemmTunableOp_Half_TN,tn_14336_3535_4096,Gemm_Hipblaslt_TN_9220,0.679085
GemmTunableOp_Half_TN,tn_14336_3497_4096,Gemm_Hipblaslt_TN_9223,0.674481
GemmTunableOp_Half_TN,tn_4096_1871_2048,Gemm_Hipblaslt_TN_9590,0.0646006
GemmTunableOp_Half_TN,tn_4096_7093_2048,Gemm_Hipblaslt_TN_9743,0.211569
GemmTunableOp_Half_TN,tn_3072_1787_4096,Gemm_Rocblas_621294520,0.0917001
GemmTunableOp_Half_TN,tn_4096_1866_7168,Gemm_Hipblaslt_TN_9680,0.21411
GemmTunableOp_Half_TN,tn_4096_3382_2048,Gemm_Hipblaslt_TN_9275,0.103376
GemmTunableOp_Half_TN,tn_3072_5357_4096,Gemm_Hipblaslt_TN_9873,0.221257
GemmTunableOp_Half_TN,tn_14336_3612_4096,Gemm_Hipblaslt_TN_9187,0.741051
GemmTunableOp_Half_TN,tn_14336_1874_4096,Gemm_Hipblaslt_TN_9189,0.380457
GemmTunableOp_Half_TN,tn_3072_1801_4096,Gemm_Hipblaslt_TN_9322,0.0937432
GemmTunableOp_Half_TN,tn_3072_1573_4096,Gemm_Hipblaslt_TN_9561,0.0866615
GemmTunableOp_Half_TN,tn_4096_5067_2048,Gemm_Hipblaslt_TN_9690,0.168832
GemmTunableOp_Half_TN,tn_14336_5301_4096,Gemm_Hipblaslt_TN_9933,1.07068
GemmTunableOp_Half_TN,tn_4096_1702_2048,Gemm_Hipblaslt_TN_9164,0.0600811
GemmTunableOp_Half_TN,tn_4096_3369_2048,Gemm_Hipblaslt_TN_9696,0.102421
GemmTunableOp_Half_TN,tn_3072_1660_4096,Gemm_Rocblas_621286778,0.0904963
GemmTunableOp_Half_TN,tn_4096_1767_7168,Gemm_Hipblaslt_TN_9329,0.203997
GemmTunableOp_Half_TN,tn_14336_1573_4096,Gemm_Hipblaslt_TN_9691,0.332748
GemmTunableOp_Half_TN,tn_4096_1889_2048,Gemm_Hipblaslt_TN_9590,0.0652104
GemmTunableOp_Half_TN,tn_3072_3478_4096,Gemm_Rocblas_621294495,0.156928
GemmTunableOp_Half_TN,tn_4096_3652_2048,Gemm_Hipblaslt_TN_9841,0.113932
GemmTunableOp_Half_TN,tn_4096_3710_2048,Gemm_Hipblaslt_TN_9710,0.114971
GemmTunableOp_Half_TN,tn_4096_1689_2048,Gemm_Hipblaslt_TN_9607,0.0582243
GemmTunableOp_Half_TN,tn_4096_7552_2048,Gemm_Rocblas_621286281,0.227323
GemmTunableOp_Half_TN,tn_4096_7575_7168,Gemm_Hipblaslt_TN_9217,0.739099
GemmTunableOp_Half_TN,tn_4096_3793_7168,Gemm_Hipblaslt_TN_9827,0.370213
GemmTunableOp_Half_TN,tn_4096_1636_2048,Gemm_Hipblaslt_TN_9607,0.0570156
GemmTunableOp_Half_TN,tn_3072_7130_4096,Gemm_Hipblaslt_TN_9619,0.31843
GemmTunableOp_Half_TN,tn_4096_3768_7168,Gemm_Rocblas_621294030,0.369155
GemmTunableOp_Half_TN,tn_3072_6747_4096,Gemm_Hipblaslt_TN_9619,0.301437
GemmTunableOp_Half_TN,tn_4096_7225_2048,Gemm_Hipblaslt_TN_9814,0.215915
GemmTunableOp_Half_TN,tn_3072_3780_4096,Gemm_Hipblaslt_TN_9852,0.168001
GemmTunableOp_Half_TN,tn_3072_3793_4096,Gemm_Hipblaslt_TN_9852,0.168119
GemmTunableOp_Half_TN,tn_64128_249_4096,Gemm_Rocblas_621286905,0.296129
GemmTunableOp_Half_TN,tn_4096_112_2048,Gemm_Rocblas_621286280,0.0107591
GemmTunableOp_Half_TN,tn_3072_6996_4096,Gemm_Hipblaslt_TN_9681,0.313527
GemmTunableOp_Half_TN,tn_14336_3450_4096,Gemm_Rocblas_621286742,0.67559
GemmTunableOp_Half_TN,tn_4096_240_7168,Gemm_Hipblaslt_TN_9303,0.0443877
GemmTunableOp_Half_TN,tn_4096_1770_2048,Gemm_Hipblaslt_TN_9329,0.0632469
GemmTunableOp_Half_TN,tn_14336_7191_4096,Gemm_Hipblaslt_TN_9677,1.43535
GemmTunableOp_Half_TN,tn_4096_1607_7168,Gemm_Hipblaslt_TN_9616,0.185867
GemmTunableOp_Half_TN,tn_4096_6868_7168,Gemm_Hipblaslt_TN_9694,0.67707
GemmTunableOp_Half_TN,tn_3072_6773_4096,Gemm_Hipblaslt_TN_9681,0.305289
GemmTunableOp_Half_TN,tn_14336_7047_4096,Gemm_Hipblaslt_TN_9903,1.36539
GemmTunableOp_Half_TN,tn_4096_6989_2048,Gemm_Hipblaslt_TN_9814,0.211945
GemmTunableOp_Half_TN,tn_3072_5530_4096,Gemm_Hipblaslt_TN_9725,0.229987
GemmTunableOp_Half_TN,tn_4096_1898_7168,Gemm_Hipblaslt_TN_9645,0.212354
GemmTunableOp_Half_TN,tn_3072_1781_4096,Gemm_Rocblas_621294520,0.0939544
GemmTunableOp_Half_TN,tn_4096_6920_2048,Gemm_Hipblaslt_TN_9731,0.211693
GemmTunableOp_Half_TN,tn_4096_7325_7168,Gemm_Hipblaslt_TN_9914,0.724297
GemmTunableOp_Half_TN,tn_3072_1738_4096,Gemm_Hipblaslt_TN_9322,0.0922576
GemmTunableOp_Half_TN,tn_4096_1853_7168,Gemm_Hipblaslt_TN_9268,0.210576
GemmTunableOp_Half_TN,tn_3072_1743_4096,Gemm_Hipblaslt_TN_9163,0.0918345
GemmTunableOp_Half_TN,tn_3072_1828_4096,Gemm_Hipblaslt_TN_9163,0.0951663
GemmTunableOp_Half_TN,tn_64128_132_4096,Gemm_Hipblaslt_TN_9674,0.220944
GemmTunableOp_Half_TN,tn_3072_5381_4096,Gemm_Hipblaslt_TN_9725,0.226429
GemmTunableOp_Half_TN,tn_4096_7047_7168,Gemm_Hipblaslt_TN_9743,0.69124
GemmTunableOp_Half_TN,tn_4096_1601_7168,Gemm_Hipblaslt_TN_9164,0.181948
GemmTunableOp_Half_TN,tn_4096_1666_7168,Gemm_Hipblaslt_TN_9610,0.186439
GemmTunableOp_Half_TN,tn_3072_7033_4096,Gemm_Hipblaslt_TN_9681,0.316481
GemmTunableOp_Half_TN,tn_4096_3701_2048,Gemm_Hipblaslt_TN_9813,0.115141
GemmTunableOp_Half_TN,tn_4096_1958_2048,Gemm_Hipblaslt_TN_9136,0.0656425
GemmTunableOp_Half_TN,tn_3072_7364_4096,Gemm_Hipblaslt_TN_9779,0.337557
GemmTunableOp_Half_TN,tn_3072_7403_4096,Gemm_Rocblas_621294473,0.338097
GemmTunableOp_Half_TN,tn_4096_240_2048,Gemm_Rocblas_621286447,0.0148991
GemmTunableOp_Half_TN,tn_4096_6773_2048,Gemm_Hipblaslt_TN_9911,0.206308
GemmTunableOp_Half_TN,tn_14336_1615_4096,Gemm_Hipblaslt_TN_9697,0.358871
GemmTunableOp_Half_TN,tn_4096_56_7168,Gemm_Rocblas_621286421,0.0198709
GemmTunableOp_Half_TN,tn_4096_7118_2048,Gemm_Hipblaslt_TN_9696,0.213887
GemmTunableOp_Half_TN,tn_4096_1802_2048,Gemm_Hipblaslt_TN_9590,0.064239
GemmTunableOp_Half_TN,tn_4096_224_7168,Gemm_Rocblas_621286491,0.0431857
GemmTunableOp_Half_TN,tn_64128_253_4096,Gemm_Rocblas_621294648,0.294595
GemmTunableOp_Half_TN,tn_4096_1874_2048,Gemm_Hipblaslt_TN_9680,0.0662581
GemmTunableOp_Half_TN,tn_4096_1969_2048,Gemm_Hipblaslt_TN_9590,0.0673747
GemmTunableOp_Half_TN,tn_14336_6870_4096,Gemm_Rocblas_621294492,1.36408
GemmTunableOp_Half_TN,tn_4096_1597_7168,Gemm_Hipblaslt_TN_9359,0.184518
GemmTunableOp_Half_TN,tn_4096_7118_7168,Gemm_Hipblaslt_TN_9743,0.695773
GemmTunableOp_Half_TN,tn_3072_192_4096,Gemm_Rocblas_621286436,0.0191298
GemmTunableOp_Half_TN,tn_4096_3629_2048,Gemm_Hipblaslt_TN_9696,0.106942
GemmTunableOp_Half_TN,tn_4096_200_2048,Gemm_Rocblas_621286447,0.0141191
GemmTunableOp_Half_TN,tn_4096_5089_2048,Gemm_Hipblaslt_TN_9690,0.168927
GemmTunableOp_Half_TN,tn_14336_1948_4096,Gemm_Hipblaslt_TN_9223,0.404664
GemmTunableOp_Half_TN,tn_3072_6708_4096,Gemm_Hipblaslt_TN_9681,0.304565
GemmTunableOp_Half_TN,tn_3072_7225_4096,Gemm_Hipblaslt_TN_9681,0.318793
GemmTunableOp_Half_TN,tn_4096_1780_2048,Gemm_Hipblaslt_TN_9136,0.0637087
GemmTunableOp_Half_TN,tn_14336_5583_4096,Gemm_Rocblas_621294492,1.10509
GemmTunableOp_Half_TN,tn_3072_1778_4096,Gemm_Hipblaslt_TN_9322,0.0918289
GemmTunableOp_Half_TN,tn_3072_6990_4096,Gemm_Hipblaslt_TN_9619,0.311904
GemmTunableOp_Half_TN,tn_4096_1601_2048,Gemm_Hipblaslt_TN_9671,0.0582455
GemmTunableOp_Half_TN,tn_3072_7108_4096,Gemm_Hipblaslt_TN_9619,0.320765
GemmTunableOp_Half_TN,tn_3072_3456_4096,Gemm_Rocblas_621286753,0.152245
GemmTunableOp_Half_TN,tn_4096_7301_2048,Gemm_Hipblaslt_TN_9813,0.225513
GemmTunableOp_Half_TN,tn_3072_240_4096,Gemm_Rocblas_621294171,0.0230125
GemmTunableOp_Half_TN,tn_4096_112_7168,Gemm_Rocblas_621286438,0.0282066
GemmTunableOp_Half_TN,tn_14336_200_4096,Gemm_Rocblas_621286478,0.0659398
GemmTunableOp_Half_TN,tn_14336_6881_4096,Gemm_Hipblaslt_TN_9753,1.35934
GemmTunableOp_Half_TN,tn_3072_6715_4096,Gemm_Hipblaslt_TN_9681,0.308137
GemmTunableOp_Half_TN,tn_3072_5219_4096,Gemm_Hipblaslt_TN_9920,0.221088
GemmTunableOp_Half_TN,tn_4096_1787_2048,Gemm_Hipblaslt_TN_9680,0.0639824
GemmTunableOp_Half_TN,tn_14336_7170_4096,Gemm_Hipblaslt_TN_9684,1.43532
GemmTunableOp_Half_TN,tn_4096_1855_2048,Gemm_Hipblaslt_TN_9590,0.0649447
GemmTunableOp_Half_TN,tn_4096_1779_7168,Gemm_Hipblaslt_TN_9136,0.202137
GemmTunableOp_Half_TN,tn_4096_5541_7168,Gemm_Rocblas_621294320,0.57199
GemmTunableOp_Half_TN,tn_3072_1779_4096,Gemm_Rocblas_621294520,0.0933378
GemmTunableOp_Half_TN,tn_3072_72_4096,Gemm_Rocblas_621286280,0.0135274
GemmTunableOp_Half_TN,tn_14336_5465_4096,Gemm_Rocblas_621286750,1.0951
GemmTunableOp_Half_TN,tn_3072_5583_4096,Gemm_Hipblaslt_TN_9726,0.232766
GemmTunableOp_Half_TN,tn_64128_76_4096,Gemm_Hipblaslt_TN_9057,0.185324
GemmTunableOp_Half_TN,tn_4096_7047_2048,Gemm_Hipblaslt_TN_9814,0.212179
GemmTunableOp_Half_TN,tn_3072_6902_4096,Gemm_Hipblaslt_TN_9619,0.305533
GemmTunableOp_Half_TN,tn_64128_185_4096,Gemm_Hipblaslt_TN_9862,0.253771
GemmTunableOp_Half_TN,tn_4096_7475_7168,Gemm_Hipblaslt_TN_159,0.733322
GemmTunableOp_Half_TN,tn_64128_40_4096,Gemm_Hipblaslt_TN_9144,0.158237
GemmTunableOp_Half_TN,tn_4096_1954_2048,Gemm_Hipblaslt_TN_9620,0.066517
GemmTunableOp_Half_TN,tn_3072_1589_4096,Gemm_Hipblaslt_TN_9561,0.0870953
GemmTunableOp_Half_TN,tn_4096_1690_2048,Gemm_Hipblaslt_TN_9164,0.0583493
GemmTunableOp_Half_TN,tn_4096_6789_7168,Gemm_Hipblaslt_TN_9955,0.677721
GemmTunableOp_Half_TN,tn_14336_5495_4096,Gemm_Rocblas_621286750,1.10286
GemmTunableOp_Half_TN,tn_4096_7575_2048,Gemm_Hipblaslt_TN_9753,0.229323
GemmTunableOp_Half_TN,tn_3072_3526_4096,Gemm_Rocblas_621286753,0.158021
GemmTunableOp_Half_TN,tn_14336_1636_4096,Gemm_Hipblaslt_TN_9192,0.358502
GemmTunableOp_Half_TN,tn_3072_3773_4096,Gemm_Hipblaslt_TN_9852,0.168159
GemmTunableOp_Half_TN,tn_4096_1737_2048,Gemm_Hipblaslt_TN_9680,0.0631937
GemmTunableOp_Half_TN,tn_4096_7327_2048,Gemm_Hipblaslt_TN_9713,0.225848
GemmTunableOp_Half_TN,tn_4096_1908_2048,Gemm_Hipblaslt_TN_9590,0.0655868
GemmTunableOp_Half_TN,tn_64128_64_4096,Gemm_Hipblaslt_TN_9097,0.165015
GemmTunableOp_Half_TN,tn_3072_1766_4096,Gemm_Hipblaslt_TN_9322,0.0926121
GemmTunableOp_Half_TN,tn_3072_3586_4096,Gemm_Hipblaslt_TN_9619,0.161118
GemmTunableOp_Half_TN,tn_4096_3438_7168,Gemm_Hipblaslt_TN_9821,0.338671
GemmTunableOp_Half_TN,tn_4096_5267_2048,Gemm_Hipblaslt_TN_9799,0.169862
GemmTunableOp_Half_TN,tn_14336_72_4096,Gemm_Hipblaslt_TN_9468,0.0338952
GemmTunableOp_Half_TN,tn_4096_1683_7168,Gemm_Hipblaslt_TN_9265,0.186355
GemmTunableOp_Half_TN,tn_3072_1642_4096,Gemm_Hipblaslt_TN_9561,0.0888737
GemmTunableOp_Half_TN,tn_3072_1839_4096,Gemm_Hipblaslt_TN_9613,0.094551
GemmTunableOp_Half_TN,tn_14336_3214_4096,Gemm_Rocblas_621286678,0.646441
GemmTunableOp_Half_TN,tn_64128_103_4096,Gemm_Rocblas_621294762,0.200053
GemmTunableOp_Half_TN,tn_4096_1651_2048,Gemm_Hipblaslt_TN_9164,0.0584354
GemmTunableOp_Half_TN,tn_3072_1786_4096,Gemm_Hipblaslt_TN_9561,0.0928796
GemmTunableOp_Half_TN,tn_3072_1933_4096,Gemm_Hipblaslt_TN_9633,0.100972
GemmTunableOp_Half_TN,tn_4096_1869_2048,Gemm_Hipblaslt_TN_9590,0.0654918
GemmTunableOp_Half_TN,tn_14336_1813_4096,Gemm_Hipblaslt_TN_9697,0.376974
GemmTunableOp_Half_TN,tn_4096_1933_2048,Gemm_Hipblaslt_TN_9590,0.0665315
GemmTunableOp_Half_TN,tn_4096_7077_7168,Gemm_Hipblaslt_TN_9743,0.695629
GemmTunableOp_Half_TN,tn_4096_5273_2048,Gemm_Hipblaslt_TN_9709,0.170613
GemmTunableOp_Half_TN,tn_4096_3427_7168,Gemm_Hipblaslt_TN_9821,0.339398
GemmTunableOp_Half_TN,tn_4096_3468_2048,Gemm_Hipblaslt_TN_9694,0.105775
GemmTunableOp_Half_TN,tn_14336_3494_4096,Gemm_Rocblas_621286750,0.679567
GemmTunableOp_Half_TN,tn_64128_180_4096,Gemm_Hipblaslt_TN_9683,0.255306
GemmTunableOp_Half_TN,tn_4096_1590_2048,Gemm_Hipblaslt_TN_9607,0.0563293
GemmTunableOp_Half_TN,tn_4096_3388_7168,Gemm_Hipblaslt_TN_9694,0.338752
GemmTunableOp_Half_TN,tn_4096_1840_7168,Gemm_Hipblaslt_TN_9137,0.208877
GemmTunableOp_Half_TN,tn_64128_168_4096,Gemm_Hipblaslt_TN_9661,0.251409
GemmTunableOp_Half_TN,tn_4096_3379_7168,Gemm_Hipblaslt_TN_9695,0.339665
GemmTunableOp_Half_TN,tn_14336_7579_4096,Gemm_Hipblaslt_TN_9890,1.50779
GemmTunableOp_Half_TN,tn_14336_1973_4096,Gemm_Hipblaslt_TN_9220,0.406577
GemmTunableOp_Half_TN,tn_4096_6870_7168,Gemm_Hipblaslt_TN_9743,0.677296
GemmTunableOp_Half_TN,tn_4096_1735_2048,Gemm_Hipblaslt_TN_9136,0.0637515
GemmTunableOp_Half_TN,tn_4096_1863_7168,Gemm_Hipblaslt_TN_9680,0.211888
GemmTunableOp_Half_TN,tn_4096_5436_2048,Gemm_Hipblaslt_TN_9691,0.175091
GemmTunableOp_Half_TN,tn_3072_1854_4096,Gemm_Hipblaslt_TN_9613,0.0951003
GemmTunableOp_Half_TN,tn_4096_1655_2048,Gemm_Hipblaslt_TN_9607,0.0568881
GemmTunableOp_Half_TN,tn_14336_1879_4096,Gemm_Hipblaslt_TN_9697,0.381608
GemmTunableOp_Half_TN,tn_4096_3713_7168,Gemm_Hipblaslt_TN_9919,0.369217
GemmTunableOp_Half_TN,tn_4096_5533_7168,Gemm_Rocblas_621294426,0.571531
GemmTunableOp_Half_TN,tn_4096_7478_7168,Gemm_Hipblaslt_TN_9888,0.733579
GemmTunableOp_Half_TN,tn_64128_194_4096,Gemm_Hipblaslt_TN_9654,0.272003
GemmTunableOp_Half_TN,tn_4096_3373_7168,Gemm_Hipblaslt_TN_9695,0.337675
GemmTunableOp_Half_TN,tn_4096_6989_7168,Gemm_Hipblaslt_TN_9743,0.68835
GemmTunableOp_Half_TN,tn_3072_1884_4096,Gemm_Hipblaslt_TN_9148,0.0961518
GemmTunableOp_Half_TN,tn_64128_229_4096,Gemm_Rocblas_621286905,0.293181
GemmTunableOp_Half_TN,tn_64128_191_4096,Gemm_Hipblaslt_TN_9707,0.255641
GemmTunableOp_Half_TN,tn_14336_6800_4096,Gemm_Hipblaslt_TN_9815,1.35413
GemmTunableOp_Half_TN,tn_14336_7130_4096,Gemm_Hipblaslt_TN_9890,1.37154
GemmTunableOp_Half_TN,tn_4096_64_7168,Gemm_Rocblas_621286419,0.0202527
GemmTunableOp_Half_TN,tn_4096_1658_7168,Gemm_Hipblaslt_TN_9265,0.186701
GemmTunableOp_Half_TN,tn_64128_106_4096,Gemm_Rocblas_621294762,0.197976
GemmTunableOp_Half_TN,tn_4096_1794_2048,Gemm_Hipblaslt_TN_9590,0.0635232
GemmTunableOp_Half_TN,tn_3072_1981_4096,Gemm_Hipblaslt_TN_9633,0.103069
GemmTunableOp_Half_TN,tn_64128_124_4096,Gemm_Rocblas_621294762,0.202009
GemmTunableOp_Half_TN,tn_4096_1686_2048,Gemm_Hipblaslt_TN_9164,0.0595056
GemmTunableOp_Half_TN,tn_14336_7021_4096,Gemm_Hipblaslt_TN_9903,1.37202
GemmTunableOp_Half_TN,tn_14336_5498_4096,Gemm_Hipblaslt_TN_9753,1.10302
GemmTunableOp_Half_TN,tn_3072_1858_4096,Gemm_Hipblaslt_TN_9148,0.0946387
GemmTunableOp_Half_TN,tn_6144_256_4096,Gemm_Rocblas_621286469,0.035643
GemmTunableOp_Half_TN,tn_14336_5512_4096,Gemm_Rocblas_621286750,1.10381
GemmTunableOp_Half_TN,tn_4096_7093_7168,Gemm_Hipblaslt_TN_9743,0.693461
GemmTunableOp_Half_TN,tn_14336_5277_4096,Gemm_Hipblaslt_TN_9217,1.06471
GemmTunableOp_Half_TN,tn_3072_5470_4096,Gemm_Hipblaslt_TN_9712,0.230033
GemmTunableOp_Half_TN,tn_4096_1978_7168,Gemm_Hipblaslt_TN_9645,0.216101
GemmTunableOp_Half_TN,tn_14336_7267_4096,Gemm_Hipblaslt_TN_9683,1.43474
GemmTunableOp_Half_TN,tn_4096_3764_7168,Gemm_Hipblaslt_TN_9827,0.368299
GemmTunableOp_Half_TN,tn_14336_6920_4096,Gemm_Hipblaslt_TN_9815,1.36775
GemmTunableOp_Half_TN,tn_4096_3583_2048,Gemm_Hipblaslt_TN_9683,0.107258
GemmTunableOp_Half_TN,tn_3072_1954_4096,Gemm_Hipblaslt_TN_9633,0.0999887
GemmTunableOp_Half_TN,tn_3072_5239_4096,Gemm_Hipblaslt_TN_9914,0.221972
GemmTunableOp_Half_TN,tn_14336_3574_4096,Gemm_Hipblaslt_TN_9223,0.689236
GemmTunableOp_Half_TN,tn_4096_5390_7168,Gemm_Hipblaslt_TN_9672,0.560583
GemmTunableOp_Half_TN,tn_4096_1722_7168,Gemm_Hipblaslt_TN_9265,0.189017
GemmTunableOp_Half_TN,tn_14336_3748_4096,Gemm_Hipblaslt_TN_9677,0.762424
GemmTunableOp_Half_TN,tn_4096_1852_7168,Gemm_Hipblaslt_TN_9268,0.208552
GemmTunableOp_Half_TN,tn_3072_1825_4096,Gemm_Hipblaslt_TN_9613,0.0942469
GemmTunableOp_Half_TN,tn_3072_1872_4096,Gemm_Hipblaslt_TN_9612,0.0963532
GemmTunableOp_Half_TN,tn_3072_1620_4096,Gemm_Hipblaslt_TN_9561,0.0890025
GemmTunableOp_Half_TN,tn_3072_3647_4096,Gemm_Hipblaslt_TN_9619,0.160344
GemmTunableOp_Half_TN,tn_4096_3640_2048,Gemm_Hipblaslt_TN_9212,0.107083
GemmTunableOp_Half_TN,tn_4096_3475_7168,Gemm_Hipblaslt_TN_9192,0.343769
GemmTunableOp_Half_TN,tn_3072_1614_4096,Gemm_Rocblas_621294520,0.0882808
GemmTunableOp_Half_TN,tn_4096_3682_7168,Gemm_Rocblas_621294420,0.367724
GemmTunableOp_Half_TN,tn_14336_3383_4096,Gemm_Rocblas_621294435,0.664314
GemmTunableOp_Half_TN,tn_14336_1852_4096,Gemm_Hipblaslt_TN_9187,0.377734
GemmTunableOp_Half_TN,tn_3072_1822_4096,Gemm_Rocblas_621286778,0.0932412
GemmTunableOp_Half_TN,tn_64128_201_4096,Gemm_Hipblaslt_TN_9593,0.274479
GemmTunableOp_Half_TN,tn_64128_142_4096,Gemm_Hipblaslt_TN_9871,0.222952
GemmTunableOp_Half_TN,tn_4096_3691_7168,Gemm_Hipblaslt_TN_9220,0.369206
GemmTunableOp_Half_TN,tn_14336_232_4096,Gemm_Rocblas_621286478,0.0680107
GemmTunableOp_Half_TN,tn_64128_241_4096,Gemm_Rocblas_621294648,0.294552
GemmTunableOp_Half_TN,tn_4096_1764_2048,Gemm_Hipblaslt_TN_9680,0.0635916
GemmTunableOp_Half_TN,tn_4096_1684_7168,Gemm_Hipblaslt_TN_9359,0.186816
GemmTunableOp_Half_TN,tn_14336_1757_4096,Gemm_Hipblaslt_TN_9139,0.375047
GemmTunableOp_Half_TN,tn_14336_7108_4096,Gemm_Hipblaslt_TN_9888,1.37213
GemmTunableOp_Half_TN,tn_4096_7190_2048,Gemm_Hipblaslt_TN_9743,0.211849
GemmTunableOp_Half_TN,tn_4096_3773_7168,Gemm_Hipblaslt_TN_9827,0.369868
GemmTunableOp_Half_TN,tn_3072_3768_4096,Gemm_Hipblaslt_TN_9852,0.166759
GemmTunableOp_Half_TN,tn_64128_108_4096,Gemm_Rocblas_621294762,0.199861
GemmTunableOp_Half_TN,tn_4096_1667_2048,Gemm_Hipblaslt_TN_9588,0.0576955
GemmTunableOp_Half_TN,tn_64128_19_4096,Gemm_Rocblas_621286348,0.146069
GemmTunableOp_Half_TN,tn_14336_96_4096,Gemm_Hipblaslt_TN_9350,0.0371871
GemmTunableOp_Half_TN,tn_14336_1875_4096,Gemm_Hipblaslt_TN_9697,0.379055
GemmTunableOp_Half_TN,tn_14336_1609_4096,Gemm_Hipblaslt_TN_9697,0.356398
GemmTunableOp_Half_TN,tn_4096_256_5504,Gemm_Rocblas_621294173,0.0354832
GemmTunableOp_Half_TN,tn_64128_245_4096,Gemm_Rocblas_621294648,0.294496
GemmTunableOp_Half_TN,tn_64128_91_4096,Gemm_Hipblaslt_TN_9058,0.187578
GemmTunableOp_Half_TN,tn_4096_1704_2048,Gemm_Hipblaslt_TN_9588,0.0603132
GemmTunableOp_Half_TN,tn_4096_1796_7168,Gemm_Hipblaslt_TN_9136,0.207651
GemmTunableOp_Half_TN,tn_4096_1735_7168,Gemm_Hipblaslt_TN_9673,0.198576
GemmTunableOp_Half_TN,tn_3072_5410_4096,Gemm_Hipblaslt_TN_9726,0.229732
GemmTunableOp_Half_TN,tn_14336_1739_4096,Gemm_Hipblaslt_TN_9192,0.372124
GemmTunableOp_Half_TN,tn_14336_6761_4096,Gemm_Rocblas_621286750,1.35143
GemmTunableOp_Half_TN,tn_14336_1772_4096,Gemm_Hipblaslt_TN_9697,0.372771
GemmTunableOp_Half_TN,tn_4096_1823_7168,Gemm_Hipblaslt_TN_9137,0.209754
GemmTunableOp_Half_TN,tn_4096_1792_7168,Gemm_Hipblaslt_TN_9645,0.204409
GemmTunableOp_Half_TN,tn_14336_3706_4096,Gemm_Hipblaslt_TN_9187,0.757225
GemmTunableOp_Half_TN,tn_4096_3791_2048,Gemm_Hipblaslt_TN_9768,0.1129
GemmTunableOp_Half_TN,tn_3072_1752_4096,Gemm_Hipblaslt_TN_9163,0.0924596
GemmTunableOp_Half_TN,tn_14336_1839_4096,Gemm_Hipblaslt_TN_9677,0.37611
GemmTunableOp_Half_TN,tn_64128_32_4096,Gemm_Rocblas_621286348,0.142963
GemmTunableOp_Half_TN,tn_3072_1590_4096,Gemm_Hipblaslt_TN_9561,0.0865229
GemmTunableOp_Half_TN,tn_14336_1908_4096,Gemm_Hipblaslt_TN_9677,0.382581
GemmTunableOp_Half_TN,tn_3072_1831_4096,Gemm_Hipblaslt_TN_9133,0.0955315
GemmTunableOp_Half_TN,tn_14336_1889_4096,Gemm_Hipblaslt_TN_9187,0.381476
GemmTunableOp_Half_TN,tn_6144_4096_4096,Gemm_Rocblas_621286747,0.361089
GemmTunableOp_Half_TN,tn_4096_7170_7168,Gemm_Hipblaslt_TN_9677,0.705369
GemmTunableOp_Half_TN,tn_4096_1958_7168,Gemm_Hipblaslt_TN_9645,0.213
GemmTunableOp_Half_TN,tn_4096_3404_7168,Gemm_Hipblaslt_TN_9695,0.339013
GemmTunableOp_Half_TN,tn_4096_1633_7168,Gemm_Hipblaslt_TN_9180,0.184211
GemmTunableOp_Half_TN,tn_4096_1824_2048,Gemm_Hipblaslt_TN_9590,0.0654909
GemmTunableOp_Half_TN,tn_4096_3526_2048,Gemm_Hipblaslt_TN_9694,0.107395
GemmTunableOp_Half_TN,tn_64128_6_4096,Gemm_Rocblas_621286348,0.142661
GemmTunableOp_Half_TN,tn_3072_1760_4096,Gemm_Rocblas_621286778,0.0917219
GemmTunableOp_Half_TN,tn_14336_1658_4096,Gemm_Hipblaslt_TN_9697,0.358343
GemmTunableOp_Half_TN,tn_3072_1605_4096,Gemm_Rocblas_621294520,0.0890578
GemmTunableOp_Half_TN,tn_4096_5570_7168,Gemm_Rocblas_621286580,0.570067
GemmTunableOp_Half_TN,tn_16000_256_4096,Gemm_Rocblas_621294247,0.0741489
GemmTunableOp_Half_TN,tn_64128_57_4096,Gemm_Hipblaslt_TN_9097,0.167222
GemmTunableOp_Half_TN,tn_3072_3578_4096,Gemm_Rocblas_621286753,0.160487
GemmTunableOp_Half_TN,tn_4096_72_7168,Gemm_Rocblas_621286279,0.0246953
GemmTunableOp_Half_TN,tn_4096_1850_2048,Gemm_Hipblaslt_TN_9680,0.0646765
GemmTunableOp_Half_TN,tn_14336_1707_4096,Gemm_Hipblaslt_TN_9189,0.363701
GemmTunableOp_Half_TN,tn_3072_5100_4096,Gemm_Hipblaslt_TN_9726,0.217171
GemmTunableOp_Half_TN,tn_3072_1824_4096,Gemm_Rocblas_621294520,0.0930512
GemmTunableOp_Half_TN,tn_3072_3508_4096,Gemm_Hipblaslt_TN_9619,0.160808
GemmTunableOp_Half_TN,tn_64128_71_4096,Gemm_Hipblaslt_TN_9058,0.180976
GemmTunableOp_Half_TN,tn_3072_1622_4096,Gemm_Rocblas_621294520,0.0878878
GemmTunableOp_Half_TN,tn_3072_1643_4096,Gemm_Hipblaslt_TN_9561,0.0904965
GemmTunableOp_Half_TN,tn_14336_1798_4096,Gemm_Hipblaslt_TN_9192,0.376975
GemmTunableOp_Half_TN,tn_64128_239_4096,Gemm_Rocblas_621294648,0.296668
GemmTunableOp_Half_TN,tn_3072_5319_4096,Gemm_Hipblaslt_TN_9710,0.221151
GemmTunableOp_Half_TN,tn_4096_5541_2048,Gemm_Hipblaslt_TN_9799,0.176471
GemmTunableOp_Half_TN,tn_4096_7136_7168,Gemm_Hipblaslt_TN_9743,0.689627
GemmTunableOp_Half_TN,tn_64128_116_4096,Gemm_Rocblas_621294762,0.20158
GemmTunableOp_Half_TN,tn_14336_1774_4096,Gemm_Hipblaslt_TN_9697,0.373625
GemmTunableOp_Half_TN,tn_4096_1648_7168,Gemm_Hipblaslt_TN_9265,0.1865
GemmTunableOp_Half_TN,tn_4096_1830_7168,Gemm_Hipblaslt_TN_9134,0.20771
GemmTunableOp_Half_TN,tn_4096_1804_7168,Gemm_Hipblaslt_TN_9137,0.206121
GemmTunableOp_Half_TN,tn_3072_1763_4096,Gemm_Hipblaslt_TN_9641,0.0938612
GemmTunableOp_Half_TN,tn_14336_3583_4096,Gemm_Rocblas_621286750,0.685595
GemmTunableOp_Half_TN,tn_4096_5680_7168,Gemm_Hipblaslt_TN_9852,0.582228
GemmTunableOp_Half_TN,tn_4096_1882_2048,Gemm_Hipblaslt_TN_9174,0.0656631
GemmTunableOp_Half_TN,tn_14336_3441_4096,Gemm_Hipblaslt_TN_9220,0.669686
GemmTunableOp_Half_TN,tn_4096_1618_7168,Gemm_Hipblaslt_TN_9265,0.184944
GemmTunableOp_Half_TN,tn_4096_1846_2048,Gemm_Hipblaslt_TN_9134,0.0643482
GemmTunableOp_Half_TN,tn_64128_150_4096,Gemm_Hipblaslt_TN_9852,0.227436
GemmTunableOp_Half_TN,tn_3072_7136_4096,Gemm_Hipblaslt_TN_9681,0.318004
GemmTunableOp_Half_TN,tn_14336_5157_4096,Gemm_Hipblaslt_TN_9697,1.01334
GemmTunableOp_Half_TN,tn_4096_3630_2048,Gemm_Hipblaslt_TN_9694,0.106397
GemmTunableOp_Half_TN,tn_3072_1596_4096,Gemm_Hipblaslt_TN_9561,0.0873114
GemmTunableOp_Half_TN,tn_64128_211_4096,Gemm_Hipblaslt_TN_9593,0.276412
GemmTunableOp_Half_TN,tn_64128_83_4096,Gemm_Hipblaslt_TN_9058,0.180214
GemmTunableOp_Half_TN,tn_14336_3562_4096,Gemm_Hipblaslt_TN_9220,0.684005
GemmTunableOp_Half_TN,tn_4096_3573_2048,Gemm_Hipblaslt_TN_9696,0.107
GemmTunableOp_Half_TN,tn_3072_1762_4096,Gemm_Hipblaslt_TN_9322,0.0922004
GemmTunableOp_Half_TN,tn_3072_3573_4096,Gemm_Rocblas_621286753,0.158911
GemmTunableOp_Half_TN,tn_64128_46_4096,Gemm_Hipblaslt_TN_9143,0.159608
GemmTunableOp_Half_TN,tn_4096_3508_7168,Gemm_Hipblaslt_TN_9697,0.348344
GemmTunableOp_Half_TN,tn_3072_5196_4096,Gemm_Hipblaslt_TN_9726,0.219003
GemmTunableOp_Half_TN,tn_14336_128_4096,Gemm_Rocblas_621286493,0.0423669
GemmTunableOp_Half_TN,tn_4096_1826_7168,Gemm_Hipblaslt_TN_9268,0.208831
GemmTunableOp_Half_TN,tn_3072_1826_4096,Gemm_Hipblaslt_TN_9615,0.093886
GemmTunableOp_Half_TN,tn_3072_32_4096,Gemm_Rocblas_621294054,0.00937081
GemmTunableOp_Half_TN,tn_4096_128_2048,Gemm_Rocblas_621286278,0.0110333
GemmTunableOp_Half_TN,tn_14336_1769_4096,Gemm_Hipblaslt_TN_9192,0.371752
GemmTunableOp_Half_TN,tn_14336_1902_4096,Gemm_Hipblaslt_TN_9677,0.378537
GemmTunableOp_Half_TN,tn_3072_5512_4096,Gemm_Hipblaslt_TN_9725,0.228397
GemmTunableOp_Half_TN,tn_4096_7344_7168,Gemm_Hipblaslt_TN_9890,0.720424
GemmTunableOp_Half_TN,tn_4096_1889_7168,Gemm_Hipblaslt_TN_9136,0.210761
GemmTunableOp_Half_TN,tn_14336_3764_4096,Gemm_Hipblaslt_TN_9677,0.760094
GemmTunableOp_Half_TN,tn_4096_168_7168,Gemm_Rocblas_621294168,0.0376956
GemmTunableOp_Half_TN,tn_4096_184_2048,Gemm_Rocblas_621286443,0.0132135
GemmTunableOp_Half_TN,tn_14336_1864_4096,Gemm_Hipblaslt_TN_9677,0.380055
GemmTunableOp_Half_TN,tn_14336_1666_4096,Gemm_Hipblaslt_TN_9697,0.360719
GemmTunableOp_Half_TN,tn_3072_1958_4096,Gemm_Hipblaslt_TN_9633,0.100131
GemmTunableOp_Half_TN,tn_3072_1737_4096,Gemm_Rocblas_621286778,0.0925824
GemmTunableOp_Half_TN,tn_14336_1881_4096,Gemm_Hipblaslt_TN_9192,0.382208
GemmTunableOp_Half_TN,tn_4096_3388_2048,Gemm_Hipblaslt_TN_9683,0.103474
GemmTunableOp_Half_TN,tn_3072_3574_4096,Gemm_Hipblaslt_TN_9619,0.161204
GemmTunableOp_Half_TN,tn_3072_3400_4096,Gemm_Rocblas_621294495,0.155966
GemmTunableOp_Half_TN,tn_14336_7568_4096,Gemm_Hipblaslt_TN_9890,1.51302
GemmTunableOp_Half_TN,tn_4096_1620_7168,Gemm_Hipblaslt_TN_9587,0.186175
GemmTunableOp_Half_TN,tn_3072_1967_4096,Gemm_Hipblaslt_TN_9633,0.0993517
GemmTunableOp_Half_TN,tn_4096_1708_7168,Gemm_Hipblaslt_TN_9265,0.188317
GemmTunableOp_Half_TN,tn_64128_52_4096,Gemm_Hipblaslt_TN_9146,0.164372
GemmTunableOp_Half_TN,tn_3072_3629_4096,Gemm_Hipblaslt_TN_9619,0.16275
GemmTunableOp_Half_TN,tn_3072_1748_4096,Gemm_Rocblas_621294520,0.0929771
GemmTunableOp_Half_TN,tn_4096_1924_2048,Gemm_Hipblaslt_TN_9590,0.0663464
GemmTunableOp_Half_TN,tn_3072_7170_4096,Gemm_Hipblaslt_TN_9681,0.319506
GemmTunableOp_Half_TN,tn_3072_5436_4096,Gemm_Hipblaslt_TN_9725,0.228418
GemmTunableOp_Half_TN,tn_4096_1706_7168,Gemm_Hipblaslt_TN_9265,0.18801
GemmTunableOp_Half_TN,tn_4096_7439_7168,Gemm_Hipblaslt_TN_9933,0.729157
GemmTunableOp_Half_TN,tn_4096_7344_2048,Gemm_Rocblas_621294030,0.225078
GemmTunableOp_Half_TN,tn_14336_7403_4096,Gemm_Hipblaslt_TN_9890,1.49434
GemmTunableOp_Half_TN,tn_3072_3713_4096,Gemm_Hipblaslt_TN_9852,0.168552
GemmTunableOp_Half_TN,tn_4096_1969_7168,Gemm_Hipblaslt_TN_9136,0.214106
GemmTunableOp_Half_TN,tn_3072_3600_4096,Gemm_Hipblaslt_TN_9619,0.161342
GemmTunableOp_Half_TN,tn_3072_256_4096,Gemm_Rocblas_621294173,0.0225906
GemmTunableOp_Half_TN,tn_3072_5735_4096,Gemm_Hipblaslt_TN_9624,0.26509
GemmTunableOp_Half_TN,tn_4096_7301_7168,Gemm_Hipblaslt_TN_9869,0.722504
GemmTunableOp_Half_TN,tn_4096_3781_7168,Gemm_Hipblaslt_TN_9220,0.370421
GemmTunableOp_Half_TN,tn_3072_7027_4096,Gemm_Hipblaslt_TN_9681,0.313337
GemmTunableOp_Half_TN,tn_64128_247_4096,Gemm_Rocblas_621294658,0.291333
GemmTunableOp_Half_TN,tn_14336_3589_4096,Gemm_Hipblaslt_TN_9187,0.739195
GemmTunableOp_Half_TN,tn_14336_1838_4096,Gemm_Hipblaslt_TN_9697,0.379644
GemmTunableOp_Half_TN,tn_14336_48_4096,Gemm_Rocblas_621286491,0.0294035
GemmTunableOp_Half_TN,tn_4096_1802_7168,Gemm_Hipblaslt_TN_9268,0.205533
GemmTunableOp_Half_TN,tn_14336_3520_4096,Gemm_Hipblaslt_TN_9223,0.679544
GemmTunableOp_Half_TN,tn_14336_1711_4096,Gemm_Hipblaslt_TN_9139,0.363512
GemmTunableOp_Half_TN,tn_4096_3645_2048,Gemm_Hipblaslt_TN_9696,0.105567
GemmTunableOp_Half_TN,tn_3072_1727_4096,Gemm_Rocblas_621286778,0.0892015
GemmTunableOp_Half_TN,tn_4096_6881_7168,Gemm_Hipblaslt_TN_9694,0.679523
GemmTunableOp_Half_TN,tn_4096_1770_7168,Gemm_Hipblaslt_TN_9134,0.203258
GemmTunableOp_Half_TN,tn_4096_1698_2048,Gemm_Hipblaslt_TN_9164,0.0579719
GemmTunableOp_Half_TN,tn_4096_7484_7168,Gemm_Hipblaslt_TN_9903,0.731653
GemmTunableOp_Half_TN,tn_4096_3410_7168,Gemm_Hipblaslt_TN_9743,0.342162
GemmTunableOp_Half_TN,tn_64128_11_4096,Gemm_Rocblas_621286348,0.143955
GemmTunableOp_Half_TN,tn_3072_1767_4096,Gemm_Rocblas_621286778,0.0920869
GemmTunableOp_Half_TN,tn_3072_1859_4096,Gemm_Hipblaslt_TN_9561,0.0925239
GemmTunableOp_Half_TN,tn_3072_6997_4096,Gemm_Hipblaslt_TN_9681,0.311904
GemmTunableOp_Half_TN,tn_14336_1953_4096,Gemm_Hipblaslt_TN_9220,0.405559
GemmTunableOp_Half_TN,tn_4096_1588_7168,Gemm_Hipblaslt_TN_9587,0.184509
GemmTunableOp_Half_TN,tn_4096_7325_2048,Gemm_Hipblaslt_TN_9813,0.223862
GemmTunableOp_Half_TN,tn_3072_136_4096,Gemm_Hipblaslt_TN_9443,0.0174489
GemmTunableOp_Half_TN,tn_4096_3582_7168,Gemm_Hipblaslt_TN_9189,0.352258
GemmTunableOp_Half_TN,tn_14336_3578_4096,Gemm_Rocblas_621286693,0.685263
GemmTunableOp_Half_TN,tn_14336_1605_4096,Gemm_Hipblaslt_TN_9677,0.357943
GemmTunableOp_Half_TN,tn_64128_24_4096,Gemm_Rocblas_621286348,0.14707
GemmTunableOp_Half_TN,tn_14336_1749_4096,Gemm_Hipblaslt_TN_9192,0.37193
GemmTunableOp_Half_TN,tn_3072_1887_4096,Gemm_Hipblaslt_TN_9561,0.0955655
GemmTunableOp_Half_TN,tn_64128_186_4096,Gemm_Hipblaslt_TN_9855,0.253426
GemmTunableOp_Half_TN,tn_64128_225_4096,Gemm_Rocblas_621294658,0.290598
GemmTunableOp_Half_TN,tn_4096_7104_7168,Gemm_Hipblaslt_TN_9743,0.696762
GemmTunableOp_Half_TN,tn_4096_1682_7168,Gemm_Hipblaslt_TN_9359,0.187888
GemmTunableOp_Half_TN,tn_3072_1811_4096,Gemm_Rocblas_621294520,0.0933331
GemmTunableOp_Half_TN,tn_4096_5100_2048,Gemm_Hipblaslt_TN_9690,0.169914
GemmTunableOp_Half_TN,tn_3072_5427_4096,Gemm_Hipblaslt_TN_9726,0.227157
GemmTunableOp_Half_TN,tn_4096_3450_2048,Gemm_Hipblaslt_TN_9683,0.104251
GemmTunableOp_Half_TN,tn_4096_3793_2048,Gemm_Hipblaslt_TN_9827,0.115407
GemmTunableOp_Half_TN,tn_4096_5357_2048,Gemm_Hipblaslt_TN_9799,0.171831
GemmTunableOp_Half_TN,tn_4096_3379_2048,Gemm_Hipblaslt_TN_9896,0.101863
GemmTunableOp_Half_TN,tn_4096_5680_2048,Gemm_Hipblaslt_TN_9687,0.175114
GemmTunableOp_Half_TN,tn_14336_3557_4096,Gemm_Rocblas_621286750,0.685262
GemmTunableOp_Half_TN,tn_14336_5319_4096,Gemm_Hipblaslt_TN_9904,1.07175
GemmTunableOp_Half_TN,tn_14336_1909_4096,Gemm_Hipblaslt_TN_9697,0.383862
GemmTunableOp_Half_TN,tn_14336_1689_4096,Gemm_Hipblaslt_TN_9697,0.36045
GemmTunableOp_Half_TN,tn_64128_68_4096,Gemm_Hipblaslt_TN_9058,0.174818
GemmTunableOp_Half_TN,tn_3072_1668_4096,Gemm_Hipblaslt_TN_9561,0.0905373
GemmTunableOp_Half_TN,tn_4096_5512_7168,Gemm_Rocblas_621286574,0.570852
GemmTunableOp_Half_TN,tn_4096_1738_2048,Gemm_Hipblaslt_TN_9136,0.0634317
GemmTunableOp_Half_TN,tn_4096_3701_7168,Gemm_Hipblaslt_TN_9217,0.368392
GemmTunableOp_Half_TN,tn_14336_7077_4096,Gemm_Hipblaslt_TN_9933,1.3753
GemmTunableOp_Half_TN,tn_14336_1890_4096,Gemm_Hipblaslt_TN_9187,0.382925
GemmTunableOp_Half_TN,tn_3072_3553_4096,Gemm_Rocblas_621294495,0.160861
GemmTunableOp_Half_TN,tn_4096_1620_2048,Gemm_Hipblaslt_TN_9607,0.0564771
GemmTunableOp_Half_TN,tn_14336_1846_4096,Gemm_Hipblaslt_TN_9697,0.378655
GemmTunableOp_Half_TN,tn_14336_6788_4096,Gemm_Hipblaslt_TN_9815,1.34874
GemmTunableOp_Half_TN,tn_14336_1930_4096,Gemm_Hipblaslt_TN_9223,0.404311
GemmTunableOp_Half_TN,tn_3072_1867_4096,Gemm_Hipblaslt_TN_9324,0.0953913
GemmTunableOp_Half_TN,tn_4096_3722_7168,Gemm_Hipblaslt_TN_9220,0.369158
GemmTunableOp_Half_TN,tn_14336_1668_4096,Gemm_Hipblaslt_TN_9187,0.362129
GemmTunableOp_Half_TN,tn_3072_5052_4096,Gemm_Hipblaslt_TN_9725,0.216949
GemmTunableOp_Half_TN,tn_4096_7182_7168,Gemm_Hipblaslt_TN_9743,0.70048
GemmTunableOp_Half_TN,tn_4096_216_2048,Gemm_Rocblas_621294175,0.0146907
GemmTunableOp_Half_TN,tn_14336_5470_4096,Gemm_Hipblaslt_TN_9223,1.10284
GemmTunableOp_Half_TN,tn_14336_6952_4096,Gemm_Hipblaslt_TN_9904,1.36135
GemmTunableOp_Half_TN,tn_4096_3582_2048,Gemm_Hipblaslt_TN_9683,0.106343
GemmTunableOp_Half_TN,tn_4096_1872_7168,Gemm_Hipblaslt_TN_9645,0.212379
GemmTunableOp_Half_TN,tn_3072_5495_4096,Gemm_Hipblaslt_TN_9725,0.225814
GemmTunableOp_Half_TN,tn_4096_5412_2048,Gemm_Hipblaslt_TN_9799,0.173046
GemmTunableOp_Half_TN,tn_11008_256_4096,Gemm_Rocblas_621286636,0.0618395
GemmTunableOp_Half_TN,tn_4096_3682_2048,Gemm_Hipblaslt_TN_9190,0.11526
GemmTunableOp_Half_TN,tn_3072_3520_4096,Gemm_Rocblas_621294495,0.159932
GemmTunableOp_Half_TN,tn_4096_3515_7168,Gemm_Hipblaslt_TN_9682,0.347319
GemmTunableOp_Half_TN,tn_14336_1786_4096,Gemm_Hipblaslt_TN_9677,0.375475
GemmTunableOp_Half_TN,tn_3072_1680_4096,Gemm_Rocblas_621286778,0.0908539
GemmTunableOp_Half_TN,tn_14336_1960_4096,Gemm_Hipblaslt_TN_9223,0.406196
GemmTunableOp_Half_TN,tn_4096_7186_7168,Gemm_Hipblaslt_TN_9697,0.705329
GemmTunableOp_Half_TN,tn_4096_3584_7168,Gemm_Hipblaslt_TN_153,0.35223
GemmTunableOp_Half_TN,tn_4096_1627_7168,Gemm_Hipblaslt_TN_9359,0.185031
GemmTunableOp_Half_TN,tn_4096_1953_2048,Gemm_Hipblaslt_TN_9590,0.0671162
GemmTunableOp_Half_TN,tn_3072_5322_4096,Gemm_Hipblaslt_TN_9726,0.221624
GemmTunableOp_Half_TN,tn_16000_232_4096,Gemm_Rocblas_621286480,0.0733774
GemmTunableOp_Half_TN,tn_3072_24_4096,Gemm_Rocblas_621294054,0.00921056
GemmTunableOp_Half_TN,tn_4096_3565_2048,Gemm_Hipblaslt_TN_9896,0.107082
GemmTunableOp_Half_TN,tn_14336_5447_4096,Gemm_Rocblas_621286750,1.09709
GemmTunableOp_Half_TN,tn_3072_152_4096,Gemm_Hipblaslt_TN_9444,0.0181092
GemmTunableOp_Half_TN,tn_4096_1599_2048,Gemm_Hipblaslt_TN_9164,0.0570057
GemmTunableOp_Half_TN,tn_4096_3630_7168,Gemm_Hipblaslt_TN_9139,0.353527
GemmTunableOp_Half_TN,tn_4096_1766_2048,Gemm_Hipblaslt_TN_9590,0.0644291
GemmTunableOp_Half_TN,tn_4096_1610_2048,Gemm_Hipblaslt_TN_9607,0.0564914
GemmTunableOp_Half_TN,tn_4096_6744_7168,Gemm_Hipblaslt_TN_9694,0.672407
GemmTunableOp_Half_TN,tn_4096_7248_7168,Gemm_Rocblas_621294329,0.706887
GemmTunableOp_Half_TN,tn_3072_6788_4096,Gemm_Hipblaslt_TN_9619,0.304794
GemmTunableOp_Half_TN,tn_3072_3501_4096,Gemm_Rocblas_621286753,0.156587
GemmTunableOp_Half_TN,tn_64128_22_4096,Gemm_Rocblas_621286348,0.148148
GemmTunableOp_Half_TN,tn_64128_255_4096,Gemm_Rocblas_621286905,0.294686
GemmTunableOp_Half_TN,tn_4096_1838_2048,Gemm_Hipblaslt_TN_9136,0.0641159
GemmTunableOp_Half_TN,tn_4096_1743_7168,Gemm_Hipblaslt_TN_9673,0.202225
GemmTunableOp_Half_TN,tn_4096_1787_7168,Gemm_Hipblaslt_TN_9134,0.203932
GemmTunableOp_Half_TN,tn_4096_7138_2048,Gemm_Hipblaslt_TN_9743,0.213987
GemmTunableOp_Half_TN,tn_3072_1857_4096,Gemm_Hipblaslt_TN_9613,0.0953955
GemmTunableOp_Half_TN,tn_14336_3602_4096,Gemm_Hipblaslt_TN_9192,0.74018
GemmTunableOp_Half_TN,tn_4096_1798_2048,Gemm_Hipblaslt_TN_9590,0.0633926
GemmTunableOp_Half_TN,tn_4096_1862_7168,Gemm_Hipblaslt_TN_9645,0.21124
GemmTunableOp_Half_TN,tn_14336_7206_4096,Gemm_Hipblaslt_TN_9677,1.4343
GemmTunableOp_Half_TN,tn_4096_5319_2048,Gemm_Hipblaslt_TN_9690,0.172124
GemmTunableOp_Half_TN,tn_4096_1643_2048,Gemm_Hipblaslt_TN_9607,0.0577654
GemmTunableOp_Half_TN,tn_4096_1957_7168,Gemm_Hipblaslt_TN_9680,0.214807
GemmTunableOp_Half_TN,tn_64128_175_4096,Gemm_Hipblaslt_TN_9707,0.251067
GemmTunableOp_Half_TN,tn_4096_1967_7168,Gemm_Hipblaslt_TN_9680,0.214969
GemmTunableOp_Half_TN,tn_14336_1667_4096,Gemm_Hipblaslt_TN_9677,0.358681
GemmTunableOp_Half_TN,tn_3072_1721_4096,Gemm_Rocblas_621294520,0.0902124
GemmTunableOp_Half_TN,tn_4096_1781_7168,Gemm_Hipblaslt_TN_9645,0.204786
GemmTunableOp_Half_TN,tn_3072_7439_4096,Gemm_Rocblas_621294473,0.338765
GemmTunableOp_Half_TN,tn_3072_1765_4096,Gemm_Hipblaslt_TN_9322,0.0935255
GemmTunableOp_Half_TN,tn_64128_214_4096,Gemm_Hipblaslt_TN_9593,0.277889
GemmTunableOp_Half_TN,tn_14336_7072_4096,Gemm_Hipblaslt_TN_9914,1.36874
GemmTunableOp_Half_TN,tn_64128_7_4096,Gemm_Rocblas_621286348,0.142695
GemmTunableOp_Half_TN,tn_4096_1863_2048,Gemm_Hipblaslt_TN_9680,0.0648788
GemmTunableOp_Half_TN,tn_4096_1743_2048,Gemm_Hipblaslt_TN_9136,0.0625908
GemmTunableOp_Half_TN,tn_4096_3401_2048,Gemm_Hipblaslt_TN_9683,0.104575
GemmTunableOp_Half_TN,tn_14336_5239_4096,Gemm_Hipblaslt_TN_9217,1.06193
GemmTunableOp_Half_TN,tn_14336_3373_4096,Gemm_Rocblas_621286693,0.665177
GemmTunableOp_Half_TN,tn_3072_7206_4096,Gemm_Hipblaslt_TN_9681,0.319147
GemmTunableOp_Half_TN,tn_14336_1670_4096,Gemm_Hipblaslt_TN_9189,0.363083
GemmTunableOp_Half_TN,tn_64128_178_4096,Gemm_Hipblaslt_TN_9956,0.251328
GemmTunableOp_Half_TN,tn_4096_6997_7168,Gemm_Hipblaslt_TN_9743,0.685369
