Gemm_Tune/LLAMA_INFERENCE/full_tuned3.csv
Validator,PT_VERSION,2.4.0
Validator,ROCM_VERSION,6.1.0.0-82-5fabb4c
Validator,HIPBLASLT_VERSION,0.7.0-1549b021
Validator,GCN_ARCH_NAME,gfx942:sramecc+:xnack-
Validator,ROCBLAS_VERSION,4.1.0-cefa4a9b-dirty
GemmTunableOp_Half_TN,tn_7168_8192_8192,Gemm_Hipblaslt_TN_9941,1.57533
GemmTunableOp_Half_TN,tn_8192_4_1024,Gemm_Rocblas_621294372,0.00673405
GemmTunableOp_Half_TN,tn_8192_8_1024,Gemm_Rocblas_621294054,0.00642198
GemmTunableOp_Half_TN,tn_7168_64_8192,Gemm_Hipblaslt_TN_9435,0.0357979
GemmTunableOp_Half_TN,tn_8192_8_3584,Gemm_Rocblas_621294041,0.0125992
GemmTunableOp_Half_TN,tn_1280_72_8192,Gemm_Rocblas_621286277,0.0129826
GemmTunableOp_Half_TN,tn_8192_256_1024,Gemm_Rocblas_621294178,0.0135807
GemmTunableOp_Half_TN,tn_7168_120_8192,Gemm_Hipblaslt_TN_8891,0.0507037
GemmTunableOp_Half_TN,tn_8192_176_3584,Gemm_Hipblaslt_TN_9496,0.0305516
GemmTunableOp_Half_TN,tn_8192_200_1024,Gemm_Hipblaslt_TN_9532,0.013474
GemmTunableOp_Half_TN,tn_7168_160_8192,Gemm_Hipblaslt_TN_8098,0.0561201
GemmTunableOp_Half_TN,tn_1280_248_8192,Gemm_Hipblaslt_TN_9432,0.0240339
GemmTunableOp_Half_TN,tn_7168_168_8192,Gemm_Hipblaslt_TN_7287,0.0610333
GemmTunableOp_Half_TN,tn_1280_96_8192,Gemm_Rocblas_621294026,0.0137325
GemmTunableOp_Half_TN,tn_1280_144_8192,Gemm_Rocblas_621294162,0.0187617
GemmTunableOp_Half_TN,tn_8192_80_1024,Gemm_Rocblas_621294175,0.00818001
GemmTunableOp_Half_TN,tn_8192_240_3584,Gemm_Rocblas_621286493,0.0376268
GemmTunableOp_Half_TN,tn_1280_128_8192,Gemm_Rocblas_621286434,0.0166468
GemmTunableOp_Half_TN,tn_8192_4_3584,Gemm_Rocblas_621294041,0.0125571
GemmTunableOp_Half_TN,tn_7168_240_8192,Gemm_Hipblaslt_TN_9573,0.0730757
GemmTunableOp_Half_TN,tn_8192_216_3584,Gemm_Rocblas_621294232,0.0366805
GemmTunableOp_Half_TN,tn_7168_208_8192,Gemm_Hipblaslt_TN_9365,0.0693979
GemmTunableOp_Half_TN,tn_1280_176_8192,Gemm_Hipblaslt_TN_9414,0.0201585
GemmTunableOp_Half_TN,tn_1280_216_8192,Gemm_Rocblas_621286435,0.022022
GemmTunableOp_Half_TN,tn_1280_168_8192,Gemm_Rocblas_621294163,0.0201951
GemmTunableOp_Half_TN,tn_8192_72_1024,Gemm_Rocblas_621286447,0.00801556
GemmTunableOp_Half_TN,tn_8192_192_1024,Gemm_Rocblas_621294208,0.0124901
GemmTunableOp_Half_TN,tn_8192_224_1024,Gemm_Rocblas_621294207,0.0137028
GemmTunableOp_Half_TN,tn_8192_256_3584,Gemm_Rocblas_621294232,0.0373688
GemmTunableOp_Half_TN,tn_8192_208_3584,Gemm_Hipblaslt_TN_9545,0.0359843
GemmTunableOp_Half_TN,tn_7168_56_8192,Gemm_Hipblaslt_TN_7484,0.0354793
GemmTunableOp_Half_TN,tn_1280_120_8192,Gemm_Rocblas_621294162,0.0165671
GemmTunableOp_Half_TN,tn_8192_144_1024,Gemm_Rocblas_621294209,0.0117844
GemmTunableOp_Half_TN,tn_1280_88_8192,Gemm_Rocblas_621294026,0.0138044
GemmTunableOp_Half_TN,tn_8192_40_3584,Gemm_Rocblas_621286278,0.0164085
GemmTunableOp_Half_TN,tn_8192_176_1024,Gemm_Rocblas_621286455,0.0133087
GemmTunableOp_Half_TN,tn_8192_8192_1024,Gemm_Hipblaslt_TN_9704,0.258724
GemmTunableOp_Half_TN,tn_8192_64_1024,Gemm_Rocblas_621286423,0.0068346
GemmTunableOp_Half_TN,tn_8192_96_3584,Gemm_Rocblas_621294168,0.0230973
GemmTunableOp_Half_TN,tn_7168_88_8192,Gemm_Hipblaslt_TN_7509,0.0421729
GemmTunableOp_Half_TN,tn_7168_144_8192,Gemm_Hipblaslt_TN_9095,0.0550191
GemmTunableOp_Half_TN,tn_8192_72_3584,Gemm_Rocblas_621286443,0.0224467
GemmTunableOp_Half_TN,tn_8192_128_3584,Gemm_Rocblas_621286444,0.0242277
GemmTunableOp_Half_TN,tn_7168_48_8192,Gemm_Rocblas_621294153,0.0329419
GemmTunableOp_Half_TN,tn_1280_200_8192,Gemm_Hipblaslt_TN_9432,0.021839
GemmTunableOp_Half_TN,tn_1280_152_8192,Gemm_Rocblas_621286435,0.0193737
GemmTunableOp_Half_TN,tn_7168_216_8192,Gemm_Hipblaslt_TN_9365,0.069765
GemmTunableOp_Half_TN,tn_7168_112_8192,Gemm_Hipblaslt_TN_9303,0.0478064
GemmTunableOp_Half_TN,tn_8192_184_3584,Gemm_Hipblaslt_TN_9573,0.0322975
GemmTunableOp_Half_TN,tn_8192_192_3584,Gemm_Hipblaslt_TN_9496,0.0311697
GemmTunableOp_Half_TN,tn_1280_64_8192,Gemm_Rocblas_621294145,0.0119538
GemmTunableOp_Half_TN,tn_8192_208_1024,Gemm_Rocblas_621294183,0.0137726
GemmTunableOp_Half_TN,tn_8192_88_3584,Gemm_Rocblas_621294168,0.0228902
GemmTunableOp_Half_TN,tn_7168_2_8192,Gemm_Hipblaslt_TN_9392,0.0266538
GemmTunableOp_Half_TN,tn_7168_200_8192,Gemm_Hipblaslt_TN_9573,0.0681178
GemmTunableOp_Half_TN,tn_1280_192_8192,Gemm_Rocblas_621294163,0.0206288
GemmTunableOp_Half_TN,tn_7168_248_8192,Gemm_Hipblaslt_TN_9573,0.0744931
GemmTunableOp_Half_TN,tn_7168_224_8192,Gemm_Hipblaslt_TN_9365,0.0693126
GemmTunableOp_Half_TN,tn_8192_168_3584,Gemm_Hipblaslt_TN_9129,0.0318274
GemmTunableOp_Half_TN,tn_8192_120_3584,Gemm_Rocblas_621294168,0.0240839
GemmTunableOp_Half_TN,tn_8192_144_3584,Gemm_Hipblaslt_TN_9494,0.0286583
GemmTunableOp_Half_TN,tn_8192_2_1024,Gemm_Rocblas_621294047,0.00605704
GemmTunableOp_Half_TN,tn_8192_40_1024,Gemm_Rocblas_621286427,0.00679674
GemmTunableOp_Half_TN,tn_1280_24_8192,Gemm_Rocblas_621286326,0.00886803
GemmTunableOp_Half_TN,tn_7168_32_8192,Gemm_Hipblaslt_TN_9410,0.0303297
GemmTunableOp_Half_TN,tn_7168_96_8192,Gemm_Hipblaslt_TN_7509,0.04316
GemmTunableOp_Half_TN,tn_8192_96_1024,Gemm_Rocblas_621294167,0.00832773
GemmTunableOp_Half_TN,tn_7168_80_8192,Gemm_Hipblaslt_TN_7509,0.0405425
GemmTunableOp_Half_TN,tn_8192_184_1024,Gemm_Hipblaslt_TN_9532,0.0128807
GemmTunableOp_Half_TN,tn_1280_4_8192,Gemm_Rocblas_621294136,0.0087154
GemmTunableOp_Half_TN,tn_8192_56_1024,Gemm_Rocblas_621286427,0.0069712
GemmTunableOp_Half_TN,tn_1280_240_8192,Gemm_Rocblas_621286438,0.0251551
GemmTunableOp_Half_TN,tn_8192_136_3584,Gemm_Hipblaslt_TN_9495,0.0284144
GemmTunableOp_Half_TN,tn_8192_232_3584,Gemm_Rocblas_621286493,0.0369426
GemmTunableOp_Half_TN,tn_7168_184_8192,Gemm_Hipblaslt_TN_9364,0.0620458
GemmTunableOp_Half_TN,tn_7168_192_8192,Gemm_Hipblaslt_TN_9307,0.0611092
GemmTunableOp_Half_TN,tn_7168_24_8192,Gemm_Hipblaslt_TN_9410,0.0297163
GemmTunableOp_Half_TN,tn_8192_200_3584,Gemm_Rocblas_621286470,0.0356595
GemmTunableOp_Half_TN,tn_8192_48_3584,Gemm_Rocblas_621286428,0.016752
GemmTunableOp_Half_TN,tn_7168_72_8192,Gemm_Hipblaslt_TN_7070,0.0395731
GemmTunableOp_Half_TN,tn_1280_2_8192,Gemm_Rocblas_621294136,0.00868415
GemmTunableOp_Half_TN,tn_1280_48_8192,Gemm_Rocblas_621286418,0.0119198
GemmTunableOp_Half_TN,tn_8192_160_1024,Gemm_Hipblaslt_TN_9495,0.0116753
GemmTunableOp_Half_TN,tn_8192_80_3584,Gemm_Rocblas_621294171,0.0228337
GemmTunableOp_Half_TN,tn_8192_120_1024,Gemm_Rocblas_621294175,0.00879632
GemmTunableOp_Half_TN,tn_7168_232_8192,Gemm_Hipblaslt_TN_9154,0.0721033
GemmTunableOp_Half_TN,tn_1280_208_8192,Gemm_Rocblas_621286435,0.022496
GemmTunableOp_Half_TN,tn_1280_232_8192,Gemm_Hipblaslt_TN_9441,0.0244351
GemmTunableOp_Half_TN,tn_8192_240_1024,Gemm_Rocblas_621294207,0.0137632
GemmTunableOp_Half_TN,tn_8192_168_1024,Gemm_Rocblas_621294183,0.0131729
GemmTunableOp_Half_TN,tn_1280_256_8192,Gemm_Hipblaslt_TN_9296,0.0254769
GemmTunableOp_Half_TN,tn_8192_104_3584,Gemm_Rocblas_621286440,0.0235143
GemmTunableOp_Half_TN,tn_8192_136_1024,Gemm_Hipblaslt_TN_9492,0.0115476
GemmTunableOp_Half_TN,tn_1280_8192_8192,Gemm_Rocblas_621294480,0.299323
GemmTunableOp_Half_TN,tn_8192_128_1024,Gemm_Rocblas_621286447,0.0085825
GemmTunableOp_Half_TN,tn_8192_152_3584,Gemm_Hipblaslt_TN_9494,0.0287848
GemmTunableOp_Half_TN,tn_7168_40_8192,Gemm_Hipblaslt_TN_7484,0.0331427
GemmTunableOp_Half_TN,tn_8192_8192_3584,Gemm_Rocblas_621286590,0.78205
GemmTunableOp_Half_TN,tn_8192_48_1024,Gemm_Rocblas_621286280,0.00694476
GemmTunableOp_Half_TN,tn_8192_32_3584,Gemm_Rocblas_621286335,0.0139708
GemmTunableOp_Half_TN,tn_7168_256_8192,Gemm_Hipblaslt_TN_9514,0.0744018
GemmTunableOp_Half_TN,tn_8192_24_1024,Gemm_Rocblas_621294144,0.00619925
GemmTunableOp_Half_TN,tn_1280_80_8192,Gemm_Rocblas_621294026,0.0133587
GemmTunableOp_Half_TN,tn_1280_112_8192,Gemm_Rocblas_621294162,0.0164818
GemmTunableOp_Half_TN,tn_8192_232_1024,Gemm_Rocblas_621286470,0.0139604
GemmTunableOp_Half_TN,tn_8192_88_1024,Gemm_Rocblas_621286440,0.00860484
GemmTunableOp_Half_TN,tn_1280_184_8192,Gemm_Hipblaslt_TN_9414,0.0211421
GemmTunableOp_Half_TN,tn_8192_152_1024,Gemm_Rocblas_621286472,0.0121197
GemmTunableOp_Half_TN,tn_7168_4_8192,Gemm_Hipblaslt_TN_9392,0.0267948
GemmTunableOp_Half_TN,tn_7168_176_8192,Gemm_Hipblaslt_TN_7582,0.0603365
GemmTunableOp_Half_TN,tn_8192_32_1024,Gemm_Rocblas_621286488,0.00651372
GemmTunableOp_Half_TN,tn_8192_56_3584,Gemm_Rocblas_621286337,0.0171441
GemmTunableOp_Half_TN,tn_1280_160_8192,Gemm_Rocblas_621294163,0.0188273
GemmTunableOp_Half_TN,tn_1280_32_8192,Gemm_Rocblas_621294136,0.00887244
GemmTunableOp_Half_TN,tn_1280_8_8192,Gemm_Rocblas_621286326,0.00876308
GemmTunableOp_Half_TN,tn_8192_216_1024,Gemm_Rocblas_621294209,0.0137335
GemmTunableOp_Half_TN,tn_8192_160_3584,Gemm_Hipblaslt_TN_9495,0.0287411
GemmTunableOp_Half_TN,tn_1280_56_8192,Gemm_Rocblas_621294145,0.0119634
GemmTunableOp_Half_TN,tn_8192_248_1024,Gemm_Rocblas_621286470,0.0140124
GemmTunableOp_Half_TN,tn_7168_136_8192,Gemm_Hipblaslt_TN_9306,0.0535558
GemmTunableOp_Half_TN,tn_7168_152_8192,Gemm_Hipblaslt_TN_8098,0.0555674
GemmTunableOp_Half_TN,tn_8192_2_3584,Gemm_Rocblas_621294041,0.0125491
GemmTunableOp_Half_TN,tn_8192_224_3584,Gemm_Rocblas_621286493,0.0363895
GemmTunableOp_Half_TN,tn_8192_24_3584,Gemm_Rocblas_621286335,0.0135835
GemmTunableOp_Half_TN,tn_8192_248_3584,Gemm_Rocblas_621286470,0.0377852
GemmTunableOp_Half_TN,tn_1280_40_8192,Gemm_Rocblas_621294145,0.0119138
GemmTunableOp_Half_TN,tn_8192_64_3584,Gemm_Rocblas_621286428,0.0168091
GemmTunableOp_Half_TN,tn_7168_8_8192,Gemm_Hipblaslt_TN_9392,0.0270039
GemmTunableOp_Half_TN,tn_7168_128_8192,Gemm_Hipblaslt_TN_7158,0.047804
GemmTunableOp_Half_TN,tn_1280_224_8192,Gemm_Rocblas_621294163,0.0217443
GemmTunableOp_Half_TN,tn_1280_136_8192,Gemm_Hipblaslt_TN_9414,0.0189983
GemmTunableOp_Half_TN,tn_7168_104_8192,Gemm_Hipblaslt_TN_9303,0.0473626
GemmTunableOp_Half_TN,tn_1280_104_8192,Gemm_Rocblas_621286434,0.0164173
GemmTunableOp_Half_TN,tn_8192_112_1024,Gemm_Rocblas_621286447,0.0086436
GemmTunableOp_Half_TN,tn_8192_112_3584,Gemm_Rocblas_621286440,0.0240711
GemmTunableOp_Half_TN,tn_8192_104_1024,Gemm_Rocblas_621294167,0.00863719
