Gemm_Tune/Qwen2-7B-Instruct-1000inp/full_tuned3.csv
Validator,PT_VERSION,2.4.0
Validator,ROCM_VERSION,6.1.0.0-82-5fabb4c
Validator,HIPBLASLT_VERSION,0.7.0-1549b021
Validator,GCN_ARCH_NAME,gfx942:sramecc+:xnack-
Validator,ROCBLAS_VERSION,4.1.0-cefa4a9b-dirty
GemmTunableOp_Half_TN,tn_28672_1778_4096,Gemm_Hipblaslt_TN_9220,0.725297
GemmTunableOp_Half_TN,tn_4096_966_4096,Gemm_Hipblaslt_TN_9576,0.0693889
GemmTunableOp_Half_TN,tn_6144_2708_4096,Gemm_Hipblaslt_TN_9565,0.25023
GemmTunableOp_Half_TN,tn_6144_1719_4096,Gemm_Hipblaslt_TN_9570,0.154544
GemmTunableOp_Half_TN,tn_4096_3546_14336,Gemm_Hipblaslt_TN_9677,0.672709
GemmTunableOp_Half_TN,tn_6144_895_4096,Gemm_Hipblaslt_TN_9613,0.092876
GemmTunableOp_Half_TN,tn_28672_4471_4096,Gemm_Hipblaslt_TN_9888,1.7669
GemmTunableOp_Half_TN,tn_28672_881_4096,Gemm_Hipblaslt_TN_9192,0.380979
GemmTunableOp_Half_TN,tn_6144_881_4096,Gemm_Hipblaslt_TN_9133,0.09232
GemmTunableOp_Half_TN,tn_28672_844_4096,Gemm_Hipblaslt_TN_9684,0.382348
GemmTunableOp_Half_TN,tn_4096_2703_14336,Gemm_Hipblaslt_TN_9799,0.541716
GemmTunableOp_Half_TN,tn_4096_872_14336,Gemm_Hipblaslt_TN_9580,0.220077
GemmTunableOp_Half_TN,tn_4096_1905_4096,Gemm_Hipblaslt_TN_9645,0.122123
GemmTunableOp_Half_TN,tn_6144_3752_4096,Gemm_Hipblaslt_TN_9687,0.329796
GemmTunableOp_Half_TN,tn_4096_915_14336,Gemm_Hipblaslt_TN_9585,0.231213
GemmTunableOp_Half_TN,tn_4096_846_14336,Gemm_Hipblaslt_TN_9158,0.21877
GemmTunableOp_Half_TN,tn_4096_1828_4096,Gemm_Hipblaslt_TN_9645,0.119485
GemmTunableOp_Half_TN,tn_28672_2572_4096,Gemm_Hipblaslt_TN_9827,1.05531
GemmTunableOp_Half_TN,tn_4096_240_14336,Gemm_Hipblaslt_TN_9303,0.0758796
GemmTunableOp_Half_TN,tn_28672_1748_4096,Gemm_Rocblas_621286742,0.720013
GemmTunableOp_Half_TN,tn_4096_1893_4096,Gemm_Hipblaslt_TN_9134,0.122443
GemmTunableOp_Half_TN,tn_6144_2571_4096,Gemm_Hipblaslt_TN_9827,0.213467
GemmTunableOp_Half_TN,tn_6144_1697_4096,Gemm_Rocblas_621286753,0.153984
GemmTunableOp_Half_TN,tn_6144_819_4096,Gemm_Rocblas_621286778,0.0892414
GemmTunableOp_Half_TN,tn_4096_2601_4096,Gemm_Hipblaslt_TN_9799,0.158454
GemmTunableOp_Half_TN,tn_6144_808_4096,Gemm_Rocblas_621294520,0.0877544
GemmTunableOp_Half_TN,tn_6144_863_4096,Gemm_Rocblas_621294520,0.0897365
GemmTunableOp_Half_TN,tn_28672_2606_4096,Gemm_Hipblaslt_TN_9841,1.07161
GemmTunableOp_Half_TN,tn_4096_2732_4096,Gemm_Hipblaslt_TN_9690,0.164229
GemmTunableOp_Half_TN,tn_6144_1791_4096,Gemm_Hipblaslt_TN_9672,0.161983
GemmTunableOp_Half_TN,tn_4096_966_14336,Gemm_Hipblaslt_TN_9160,0.238163
GemmTunableOp_Half_TN,tn_6144_906_4096,Gemm_Hipblaslt_TN_9613,0.0929197
GemmTunableOp_Half_TN,tn_6144_785_4096,Gemm_Hipblaslt_TN_9561,0.0858191
GemmTunableOp_Half_TN,tn_4096_1644_4096,Gemm_Hipblaslt_TN_9587,0.105103
GemmTunableOp_Half_TN,tn_6144_811_4096,Gemm_Hipblaslt_TN_9322,0.0887354
GemmTunableOp_Half_TN,tn_4096_2773_4096,Gemm_Hipblaslt_TN_9672,0.163904
GemmTunableOp_Half_TN,tn_28672_3546_4096,Gemm_Hipblaslt_TN_9827,1.34072
GemmTunableOp_Half_TN,tn_4096_922_4096,Gemm_Hipblaslt_TN_9604,0.0686507
GemmTunableOp_Half_TN,tn_4096_1954_4096,Gemm_Hipblaslt_TN_9620,0.123421
GemmTunableOp_Half_TN,tn_4096_2805_4096,Gemm_Hipblaslt_TN_9799,0.165197
GemmTunableOp_Half_TN,tn_6144_2805_4096,Gemm_Hipblaslt_TN_9742,0.255164
GemmTunableOp_Half_TN,tn_4096_16_14336,Gemm_Rocblas_621294135,0.0243616
GemmTunableOp_Half_TN,tn_4096_1805_14336,Gemm_Hipblaslt_TN_9134,0.402568
GemmTunableOp_Half_TN,tn_4096_811_14336,Gemm_Hipblaslt_TN_9147,0.212003
GemmTunableOp_Half_TN,tn_128256_31_4096,Gemm_Hipblaslt_TN_9451,0.300823
GemmTunableOp_Half_TN,tn_28672_1848_4096,Gemm_Hipblaslt_TN_9684,0.782098
GemmTunableOp_Half_TN,tn_28672_1883_4096,Gemm_Hipblaslt_TN_9684,0.785649
GemmTunableOp_Half_TN,tn_6144_2721_4096,Gemm_Hipblaslt_TN_9742,0.252707
GemmTunableOp_Half_TN,tn_6144_1897_4096,Gemm_Hipblaslt_TN_9672,0.165006
GemmTunableOp_Half_TN,tn_4096_2560_14336,Gemm_Hipblaslt_TN_9657,0.524505
GemmTunableOp_Half_TN,tn_4096_7436_4096,Gemm_Rocblas_621294127,0.419403
GemmTunableOp_Half_TN,tn_6144_939_4096,Gemm_Hipblaslt_TN_9613,0.0936055
GemmTunableOp_Half_TN,tn_4096_1733_4096,Gemm_Hipblaslt_TN_9590,0.116198
GemmTunableOp_Half_TN,tn_28672_886_4096,Gemm_Hipblaslt_TN_9683,0.383887
GemmTunableOp_Half_TN,tn_4096_1742_4096,Gemm_Hipblaslt_TN_9590,0.118122
GemmTunableOp_Half_TN,tn_6144_1755_4096,Gemm_Hipblaslt_TN_9690,0.157795
GemmTunableOp_Half_TN,tn_57344_1264_8192,Gemm_Hipblaslt_TN_9841,2.34598
GemmTunableOp_Half_TN,tn_28672_2636_4096,Gemm_Hipblaslt_TN_9827,1.06705
GemmTunableOp_Half_TN,tn_8192_3290_28672,Gemm_Hipblaslt_TN_9684,2.90453
GemmTunableOp_Half_TN,tn_6144_905_4096,Gemm_Hipblaslt_TN_9613,0.0923677
GemmTunableOp_Half_TN,tn_6144_893_4096,Gemm_Hipblaslt_TN_9613,0.092441
GemmTunableOp_Half_TN,tn_4096_1794_4096,Gemm_Hipblaslt_TN_9645,0.120042
GemmTunableOp_Half_TN,tn_4096_805_4096,Gemm_Hipblaslt_TN_9131,0.0628536
GemmTunableOp_Half_TN,tn_128256_226_4096,Gemm_Rocblas_621286892,0.560599
GemmTunableOp_Half_TN,tn_4096_817_4096,Gemm_Hipblaslt_TN_9352,0.0644836
GemmTunableOp_Half_TN,tn_4096_812_14336,Gemm_Hipblaslt_TN_9158,0.208942
GemmTunableOp_Half_TN,tn_128256_235_4096,Gemm_Rocblas_621294634,0.570679
GemmTunableOp_Half_TN,tn_28672_920_4096,Gemm_Hipblaslt_TN_9684,0.389852
GemmTunableOp_Half_TN,tn_128256_218_4096,Gemm_Hipblaslt_TN_9937,0.553986
GemmTunableOp_Half_TN,tn_128256_206_4096,Gemm_Hipblaslt_TN_9937,0.547354
GemmTunableOp_Half_TN,tn_128256_198_4096,Gemm_Hipblaslt_TN_9738,0.542192
GemmTunableOp_Half_TN,tn_8192_3235_8192,Gemm_Hipblaslt_TN_9677,0.710094
GemmTunableOp_Half_TN,tn_128256_177_4096,Gemm_Hipblaslt_TN_9952,0.493086
GemmTunableOp_Half_TN,tn_128256_249_4096,Gemm_Rocblas_621294634,0.57496
GemmTunableOp_Half_TN,tn_128256_122_4096,Gemm_Hipblaslt_TN_9061,0.409304
GemmTunableOp_Half_TN,tn_128256_108_4096,Gemm_Rocblas_621294385,0.400699
GemmTunableOp_Half_TN,tn_6144_1730_4096,Gemm_Hipblaslt_TN_9672,0.156732
GemmTunableOp_Half_TN,tn_128256_90_4096,Gemm_Hipblaslt_TN_9057,0.3667
GemmTunableOp_Half_TN,tn_4096_1700_4096,Gemm_Hipblaslt_TN_9616,0.106045
GemmTunableOp_Half_TN,tn_128256_73_4096,Gemm_Hipblaslt_TN_9057,0.351282
GemmTunableOp_Half_TN,tn_4096_905_4096,Gemm_Hipblaslt_TN_9634,0.0668875
GemmTunableOp_Half_TN,tn_128256_242_4096,Gemm_Rocblas_621294634,0.574733
GemmTunableOp_Half_TN,tn_28672_816_4096,Gemm_Hipblaslt_TN_9683,0.377761
GemmTunableOp_Half_TN,tn_4096_1834_14336,Gemm_Hipblaslt_TN_9645,0.404541
GemmTunableOp_Half_TN,tn_4096_1693_14336,Gemm_Hipblaslt_TN_9671,0.362492
GemmTunableOp_Half_TN,tn_10240_112_8192,Gemm_Rocblas_621286764,0.0603158
GemmTunableOp_Half_TN,tn_4096_7817_4096,Gemm_Rocblas_621294484,0.43477
GemmTunableOp_Half_TN,tn_28672_7953_4096,Gemm_Hipblaslt_TN_159,3.10327
GemmTunableOp_Half_TN,tn_8192_3619_28672,Gemm_Hipblaslt_TN_9731,3.03672
GemmTunableOp_Half_TN,tn_8192_1319_28672,Gemm_Hipblaslt_TN_9774,1.20437
GemmTunableOp_Half_TN,tn_4096_1817_14336,Gemm_Hipblaslt_TN_9174,0.404065
GemmTunableOp_Half_TN,tn_8192_3140_28672,Gemm_Hipblaslt_TN_9732,2.85759
GemmTunableOp_Half_TN,tn_8192_124_8192,Gemm_Hipblaslt_TN_8891,0.053883
GemmTunableOp_Half_TN,tn_57344_92_8192,Gemm_Hipblaslt_TN_9478,0.329916
GemmTunableOp_Half_TN,tn_6144_7967_4096,Gemm_Rocblas_621286678,0.6546
GemmTunableOp_Half_TN,tn_32000_12_8192,Gemm_Rocblas_621286319,0.135333
GemmTunableOp_Half_TN,tn_10240_93_8192,Gemm_Hipblaslt_TN_8095,0.053027
GemmTunableOp_Half_TN,tn_4096_898_4096,Gemm_Hipblaslt_TN_9604,0.0677926
GemmTunableOp_Half_TN,tn_4096_1694_4096,Gemm_Hipblaslt_TN_9671,0.10406
GemmTunableOp_Half_TN,tn_4096_847_4096,Gemm_Hipblaslt_TN_9634,0.06554
GemmTunableOp_Half_TN,tn_32000_112_8192,Gemm_Rocblas_621286475,0.207164
GemmTunableOp_Half_TN,tn_8192_113_28672,Gemm_Hipblaslt_TN_8378,0.196811
GemmTunableOp_Half_TN,tn_57344_18_8192,Gemm_Rocblas_621286348,0.264097
GemmTunableOp_Half_TN,tn_57344_3715_8192,Gemm_Hipblaslt_TN_9908,6.37549
GemmTunableOp_Half_TN,tn_10240_2866_8192,Gemm_Hipblaslt_TN_9814,0.779174
GemmTunableOp_Half_TN,tn_28672_894_4096,Gemm_Hipblaslt_TN_9192,0.383449
GemmTunableOp_Half_TN,tn_57344_109_8192,Gemm_Rocblas_621286477,0.345704
GemmTunableOp_Half_TN,tn_8192_16_28672,Gemm_Rocblas_621294224,0.118476
GemmTunableOp_Half_TN,tn_32000_109_8192,Gemm_Rocblas_621286475,0.206305
GemmTunableOp_Half_TN,tn_8192_3546_8192,Gemm_Hipblaslt_TN_9677,0.772775
GemmTunableOp_Half_TN,tn_8192_109_8192,Gemm_Hipblaslt_TN_7157,0.0523166
GemmTunableOp_Half_TN,tn_128256_63_4096,Gemm_Hipblaslt_TN_9146,0.338079
GemmTunableOp_Half_TN,tn_57344_1008_8192,Gemm_Rocblas_621294542,1.8043
GemmTunableOp_Half_TN,tn_8192_5_28672,Gemm_Hipblaslt_TN_9403,0.120593
GemmTunableOp_Half_TN,tn_8192_3785_8192,Gemm_Hipblaslt_TN_9217,0.823607
GemmTunableOp_Half_TN,tn_4096_986_14336,Gemm_Hipblaslt_TN_9632,0.242745
GemmTunableOp_Half_TN,tn_4096_972_14336,Gemm_Hipblaslt_TN_9586,0.241148
GemmTunableOp_Half_TN,tn_4096_802_14336,Gemm_Hipblaslt_TN_9147,0.214287
GemmTunableOp_Half_TN,tn_128256_153_4096,Gemm_Hipblaslt_TN_9108,0.451912
GemmTunableOp_Half_TN,tn_57344_25_8192,Gemm_Rocblas_621294194,0.26728
GemmTunableOp_Half_TN,tn_128256_46_4096,Gemm_Hipblaslt_TN_9451,0.306652
GemmTunableOp_Half_TN,tn_8192_2015_8192,Gemm_Hipblaslt_TN_9191,0.429675
GemmTunableOp_Half_TN,tn_4096_870_14336,Gemm_Hipblaslt_TN_9580,0.218877
GemmTunableOp_Half_TN,tn_57344_1392_8192,Gemm_Hipblaslt_TN_9830,2.57561
GemmTunableOp_Half_TN,tn_4096_1817_4096,Gemm_Hipblaslt_TN_9602,0.118765
GemmTunableOp_Half_TN,tn_4096_901_4096,Gemm_Hipblaslt_TN_9634,0.0683805
GemmTunableOp_Half_TN,tn_32000_132_8192,Gemm_Hipblaslt_TN_9506,0.242113
GemmTunableOp_Half_TN,tn_128256_146_4096,Gemm_Hipblaslt_TN_9063,0.445645
GemmTunableOp_Half_TN,tn_4096_943_4096,Gemm_Hipblaslt_TN_9576,0.0695134
GemmTunableOp_Half_TN,tn_8192_11_8192,Gemm_Hipblaslt_TN_9392,0.0304676
GemmTunableOp_Half_TN,tn_28672_852_4096,Gemm_Hipblaslt_TN_9684,0.382345
GemmTunableOp_Half_TN,tn_57344_2015_8192,Gemm_Hipblaslt_TN_9840,3.49223
GemmTunableOp_Half_TN,tn_8192_112_28672,Gemm_Hipblaslt_TN_8378,0.196433
GemmTunableOp_Half_TN,tn_8192_127_8192,Gemm_Hipblaslt_TN_7157,0.0543573
GemmTunableOp_Half_TN,tn_10240_1121_8192,Gemm_Hipblaslt_TN_9697,0.323445
GemmTunableOp_Half_TN,tn_8192_4083_28672,Gemm_Rocblas_621294658,3.41278
GemmTunableOp_Half_TN,tn_8192_112_8192,Gemm_Hipblaslt_TN_8891,0.0492786
GemmTunableOp_Half_TN,tn_8192_2692_28672,Gemm_Rocblas_621286568,2.49413
GemmTunableOp_Half_TN,tn_6144_1600_4096,Gemm_Rocblas_621294305,0.147272
GemmTunableOp_Half_TN,tn_4096_2599_14336,Gemm_Hipblaslt_TN_9657,0.535603
GemmTunableOp_Half_TN,tn_28672_912_4096,Gemm_Hipblaslt_TN_9684,0.388596
GemmTunableOp_Half_TN,tn_4096_2670_14336,Gemm_Hipblaslt_TN_9799,0.538795
GemmTunableOp_Half_TN,tn_28672_1737_4096,Gemm_Rocblas_621286678,0.716907
GemmTunableOp_Half_TN,tn_10240_3651_8192,Gemm_Hipblaslt_TN_9798,1.04592
GemmTunableOp_Half_TN,tn_6144_954_4096,Gemm_Hipblaslt_TN_9133,0.0940882
GemmTunableOp_Half_TN,tn_32000_99_8192,Gemm_Rocblas_621294212,0.195376
GemmTunableOp_Half_TN,tn_28672_866_4096,Gemm_Hipblaslt_TN_9684,0.381646
GemmTunableOp_Half_TN,tn_10240_131_8192,Gemm_Hipblaslt_TN_9367,0.0664025
GemmTunableOp_Half_TN,tn_8192_3747_28672,Gemm_Rocblas_621286968,3.24186
GemmTunableOp_Half_TN,tn_128256_80_4096,Gemm_Hipblaslt_TN_9057,0.35591
GemmTunableOp_Half_TN,tn_8192_101_28672,Gemm_Hipblaslt_TN_8378,0.193395
GemmTunableOp_Half_TN,tn_8192_25_28672,Gemm_Rocblas_621294226,0.129453
GemmTunableOp_Half_TN,tn_10240_3187_8192,Gemm_Hipblaslt_TN_9815,0.870524
GemmTunableOp_Half_TN,tn_57344_1367_8192,Gemm_Hipblaslt_TN_9830,2.55672
GemmTunableOp_Half_TN,tn_10240_132_8192,Gemm_Hipblaslt_TN_9367,0.0662572
GemmTunableOp_Half_TN,tn_4096_888_14336,Gemm_Hipblaslt_TN_9580,0.221443
GemmTunableOp_Half_TN,tn_28672_2805_4096,Gemm_Rocblas_621286742,1.16858
GemmTunableOp_Half_TN,tn_10240_3369_8192,Gemm_Hipblaslt_TN_9209,0.980313
GemmTunableOp_Half_TN,tn_6144_887_4096,Gemm_Hipblaslt_TN_9613,0.0921021
GemmTunableOp_Half_TN,tn_4096_990_4096,Gemm_Hipblaslt_TN_9585,0.0710614
GemmTunableOp_Half_TN,tn_28672_1600_4096,Gemm_Rocblas_621286693,0.683862
GemmTunableOp_Half_TN,tn_128256_169_4096,Gemm_Hipblaslt_TN_9683,0.491681
GemmTunableOp_Half_TN,tn_28672_1727_4096,Gemm_Rocblas_621286678,0.717131
GemmTunableOp_Half_TN,tn_6144_958_4096,Gemm_Hipblaslt_TN_9163,0.093739
GemmTunableOp_Half_TN,tn_10240_117_8192,Gemm_Hipblaslt_TN_8892,0.0618758
GemmTunableOp_Half_TN,tn_8192_4091_8192,Gemm_Hipblaslt_TN_9753,0.881024
GemmTunableOp_Half_TN,tn_4096_2826_4096,Gemm_Rocblas_621286684,0.166066
GemmTunableOp_Half_TN,tn_10240_119_8192,Gemm_Rocblas_621286764,0.0605328
GemmTunableOp_Half_TN,tn_57344_23_8192,Gemm_Rocblas_621294194,0.264892
GemmTunableOp_Half_TN,tn_4096_964_14336,Gemm_Hipblaslt_TN_9604,0.240849
GemmTunableOp_Half_TN,tn_8192_2760_8192,Gemm_Rocblas_621294426,0.640401
GemmTunableOp_Half_TN,tn_4096_917_4096,Gemm_Hipblaslt_TN_9604,0.0688381
GemmTunableOp_Half_TN,tn_10240_1256_8192,Gemm_Hipblaslt_TN_9192,0.350989
GemmTunableOp_Half_TN,tn_10240_1268_8192,Gemm_Hipblaslt_TN_9697,0.354142
GemmTunableOp_Half_TN,tn_128256_83_4096,Gemm_Hipblaslt_TN_9057,0.365209
GemmTunableOp_Half_TN,tn_28672_934_4096,Gemm_Hipblaslt_TN_9684,0.391298
GemmTunableOp_Half_TN,tn_8192_1248_8192,Gemm_Hipblaslt_TN_9209,0.298163
GemmTunableOp_Half_TN,tn_6144_1785_4096,Gemm_Hipblaslt_TN_9799,0.160464
GemmTunableOp_Half_TN,tn_10240_1321_8192,Gemm_Hipblaslt_TN_9192,0.361531
GemmTunableOp_Half_TN,tn_32000_130_8192,Gemm_Hipblaslt_TN_9506,0.239032
GemmTunableOp_Half_TN,tn_28672_232_4096,Gemm_Rocblas_621294324,0.123141
GemmTunableOp_Half_TN,tn_6144_1806_4096,Gemm_Hipblaslt_TN_9691,0.163162
GemmTunableOp_Half_TN,tn_57344_3187_8192,Gemm_Hipblaslt_TN_9803,5.52408
GemmTunableOp_Half_TN,tn_10240_1201_8192,Gemm_Hipblaslt_TN_9697,0.347524
GemmTunableOp_Half_TN,tn_8192_7_8192,Gemm_Hipblaslt_TN_9388,0.0302743
GemmTunableOp_Half_TN,tn_4096_2672_14336,Gemm_Hipblaslt_TN_9799,0.538934
GemmTunableOp_Half_TN,tn_57344_2914_8192,Gemm_Hipblaslt_TN_9803,4.98425
GemmTunableOp_Half_TN,tn_4096_836_14336,Gemm_Hipblaslt_TN_9099,0.222421
GemmTunableOp_Half_TN,tn_8192_3475_8192,Gemm_Hipblaslt_TN_9192,0.767792
GemmTunableOp_Half_TN,tn_10240_108_8192,Gemm_Rocblas_621294504,0.0602939
GemmTunableOp_Half_TN,tn_4096_5606_14336,Gemm_Hipblaslt_TN_9691,1.15282
GemmTunableOp_Half_TN,tn_8192_3411_8192,Gemm_Hipblaslt_TN_9677,0.743493
GemmTunableOp_Half_TN,tn_8192_4090_8192,Gemm_Hipblaslt_TN_9749,0.886543
GemmTunableOp_Half_TN,tn_10240_1313_8192,Gemm_Hipblaslt_TN_9192,0.358015
GemmTunableOp_Half_TN,tn_8192_3153_8192,Gemm_Hipblaslt_TN_9139,0.706356
GemmTunableOp_Half_TN,tn_57344_3369_8192,Gemm_Rocblas_621294470,5.63258
GemmTunableOp_Half_TN,tn_57344_1185_8192,Gemm_Hipblaslt_TN_9068,2.28891
GemmTunableOp_Half_TN,tn_28672_845_4096,Gemm_Hipblaslt_TN_9684,0.378982
GemmTunableOp_Half_TN,tn_4096_951_4096,Gemm_Hipblaslt_TN_9604,0.0700527
GemmTunableOp_Half_TN,tn_28672_834_4096,Gemm_Hipblaslt_TN_9684,0.377615
GemmTunableOp_Half_TN,tn_4096_978_4096,Gemm_Hipblaslt_TN_9576,0.0704129
GemmTunableOp_Half_TN,tn_4096_1806_4096,Gemm_Hipblaslt_TN_9645,0.120173
GemmTunableOp_Half_TN,tn_6144_812_4096,Gemm_Rocblas_621294520,0.0882679
GemmTunableOp_Half_TN,tn_4096_8192_4096,Gemm_Hipblaslt_TN_9815,0.448354
GemmTunableOp_Half_TN,tn_128256_209_4096,Gemm_Hipblaslt_TN_9738,0.544857
GemmTunableOp_Half_TN,tn_8192_1389_28672,Gemm_Hipblaslt_TN_9799,1.27866
GemmTunableOp_Half_TN,tn_57344_133_8192,Gemm_Hipblaslt_TN_9507,0.390953
GemmTunableOp_Half_TN,tn_57344_1374_8192,Gemm_Hipblaslt_TN_9830,2.56532
GemmTunableOp_Half_TN,tn_28672_1715_4096,Gemm_Hipblaslt_TN_9220,0.713288
GemmTunableOp_Half_TN,tn_28672_900_4096,Gemm_Hipblaslt_TN_9683,0.387439
GemmTunableOp_Half_TN,tn_57344_12_8192,Gemm_Hipblaslt_TN_9405,0.253979
GemmTunableOp_Half_TN,tn_4096_2675_14336,Gemm_Hipblaslt_TN_9799,0.539414
GemmTunableOp_Half_TN,tn_32000_135_8192,Gemm_Hipblaslt_TN_9506,0.238385
GemmTunableOp_Half_TN,tn_6144_7809_4096,Gemm_Rocblas_621286693,0.643945
GemmTunableOp_Half_TN,tn_4096_865_4096,Gemm_Hipblaslt_TN_9576,0.0664663
GemmTunableOp_Half_TN,tn_57344_3379_8192,Gemm_Hipblaslt_TN_159,5.6605
GemmTunableOp_Half_TN,tn_8192_2639_28672,Gemm_Hipblaslt_TN_9774,2.34689
GemmTunableOp_Half_TN,tn_32000_22_8192,Gemm_Rocblas_621294578,0.148126
GemmTunableOp_Half_TN,tn_8192_111_8192,Gemm_Hipblaslt_TN_8891,0.0509529
GemmTunableOp_Half_TN,tn_10240_22_8192,Gemm_Hipblaslt_TN_9415,0.0393071
GemmTunableOp_Half_TN,tn_8192_3555_8192,Gemm_Hipblaslt_TN_9697,0.772373
GemmTunableOp_Half_TN,tn_10240_1249_8192,Gemm_Hipblaslt_TN_9743,0.352277
GemmTunableOp_Half_TN,tn_10240_2166_8192,Gemm_Hipblaslt_TN_9182,0.629883
GemmTunableOp_Half_TN,tn_4096_2630_4096,Gemm_Hipblaslt_TN_9674,0.157427
GemmTunableOp_Half_TN,tn_57344_2000_8192,Gemm_Hipblaslt_TN_9840,3.48608
GemmTunableOp_Half_TN,tn_8192_1377_8192,Gemm_Hipblaslt_TN_9799,0.320169
GemmTunableOp_Half_TN,tn_10240_1208_8192,Gemm_Hipblaslt_TN_9192,0.347083
GemmTunableOp_Half_TN,tn_10240_120_8192,Gemm_Hipblaslt_TN_8892,0.0621913
GemmTunableOp_Half_TN,tn_8192_1360_8192,Gemm_Rocblas_621286683,0.319025
GemmTunableOp_Half_TN,tn_28672_1881_4096,Gemm_Hipblaslt_TN_9684,0.78735
GemmTunableOp_Half_TN,tn_57344_1248_8192,Gemm_Hipblaslt_TN_9783,2.32911
GemmTunableOp_Half_TN,tn_32000_129_8192,Gemm_Hipblaslt_TN_9506,0.236495
GemmTunableOp_Half_TN,tn_10240_1377_8192,Gemm_Hipblaslt_TN_9278,0.395815
GemmTunableOp_Half_TN,tn_6144_920_4096,Gemm_Hipblaslt_TN_9561,0.0923156
GemmTunableOp_Half_TN,tn_10240_3425_8192,Gemm_Hipblaslt_TN_9799,0.987948
GemmTunableOp_Half_TN,tn_128256_183_4096,Gemm_Hipblaslt_TN_9952,0.494026
GemmTunableOp_Half_TN,tn_128256_11_4096,Gemm_Rocblas_621286325,0.279084
GemmTunableOp_Half_TN,tn_4096_1644_14336,Gemm_Hipblaslt_TN_9671,0.362048
GemmTunableOp_Half_TN,tn_10240_1296_8192,Gemm_Hipblaslt_TN_9697,0.357307
GemmTunableOp_Half_TN,tn_6144_4471_4096,Gemm_Hipblaslt_TN_9697,0.383461
GemmTunableOp_Half_TN,tn_8192_127_28672,Gemm_Hipblaslt_TN_8378,0.20511
GemmTunableOp_Half_TN,tn_28672_882_4096,Gemm_Hipblaslt_TN_9684,0.383379
GemmTunableOp_Half_TN,tn_8192_3203_28672,Gemm_Hipblaslt_TN_9732,2.87326
GemmTunableOp_Half_TN,tn_57344_3347_8192,Gemm_Hipblaslt_TN_9803,5.86387
GemmTunableOp_Half_TN,tn_6144_898_4096,Gemm_Hipblaslt_TN_9611,0.0931761
GemmTunableOp_Half_TN,tn_4096_1701_4096,Gemm_Hipblaslt_TN_9587,0.105364
GemmTunableOp_Half_TN,tn_28672_8000_4096,Gemm_Hipblaslt_TN_159,3.11109
GemmTunableOp_Half_TN,tn_10240_3251_8192,Gemm_Hipblaslt_TN_9749,0.880188
GemmTunableOp_Half_TN,tn_28672_831_4096,Gemm_Hipblaslt_TN_9684,0.379781
GemmTunableOp_Half_TN,tn_6144_2793_4096,Gemm_Hipblaslt_TN_9742,0.254053
GemmTunableOp_Half_TN,tn_10240_1276_8192,Gemm_Hipblaslt_TN_9192,0.357932
GemmTunableOp_Half_TN,tn_8192_107_8192,Gemm_Hipblaslt_TN_7544,0.0521501
GemmTunableOp_Half_TN,tn_4096_1944_14336,Gemm_Hipblaslt_TN_9645,0.414897
GemmTunableOp_Half_TN,tn_57344_3162_8192,Gemm_Hipblaslt_TN_9816,5.50549
GemmTunableOp_Half_TN,tn_28672_3507_4096,Gemm_Hipblaslt_TN_9827,1.35504
GemmTunableOp_Half_TN,tn_6144_3430_4096,Gemm_Hipblaslt_TN_9774,0.305968
GemmTunableOp_Half_TN,tn_8192_110_8192,Gemm_Hipblaslt_TN_8891,0.0493723
GemmTunableOp_Half_TN,tn_28672_3479_4096,Gemm_Hipblaslt_TN_9827,1.33501
GemmTunableOp_Half_TN,tn_6144_800_4096,Gemm_Hipblaslt_TN_9163,0.0858816
GemmTunableOp_Half_TN,tn_32000_16_8192,Gemm_Rocblas_621286319,0.138391
GemmTunableOp_Half_TN,tn_4096_1694_14336,Gemm_Hipblaslt_TN_9607,0.364105
GemmTunableOp_Half_TN,tn_4096_48_4096,Gemm_Rocblas_621286428,0.0128905
GemmTunableOp_Half_TN,tn_10240_96_8192,Gemm_Hipblaslt_TN_7102,0.0543958
GemmTunableOp_Half_TN,tn_8192_1233_8192,Gemm_Hipblaslt_TN_9182,0.298218
GemmTunableOp_Half_TN,tn_10240_121_8192,Gemm_Hipblaslt_TN_8892,0.061312
GemmTunableOp_Half_TN,tn_8192_1361_28672,Gemm_Hipblaslt_TN_9799,1.27035
GemmTunableOp_Half_TN,tn_10240_3139_8192,Gemm_Hipblaslt_TN_9815,0.866064
GemmTunableOp_Half_TN,tn_8192_1233_28672,Gemm_Hipblaslt_TN_9774,1.172
GemmTunableOp_Half_TN,tn_6144_956_4096,Gemm_Hipblaslt_TN_9561,0.0937645
GemmTunableOp_Half_TN,tn_8192_1367_8192,Gemm_Hipblaslt_TN_9799,0.317146
GemmTunableOp_Half_TN,tn_4096_3352_14336,Gemm_Hipblaslt_TN_9732,0.652391
GemmTunableOp_Half_TN,tn_4096_797_4096,Gemm_Hipblaslt_TN_9158,0.0627767
GemmTunableOp_Half_TN,tn_28672_814_4096,Gemm_Hipblaslt_TN_9684,0.374862
GemmTunableOp_Half_TN,tn_4096_1756_4096,Gemm_Hipblaslt_TN_9645,0.117482
GemmTunableOp_Half_TN,tn_57344_3754_8192,Gemm_Hipblaslt_TN_9922,6.40966
GemmTunableOp_Half_TN,tn_4096_184_14336,Gemm_Hipblaslt_TN_7585,0.0616892
GemmTunableOp_Half_TN,tn_8192_1321_28672,Gemm_Hipblaslt_TN_9774,1.21152
GemmTunableOp_Half_TN,tn_57344_2274_8192,Gemm_Hipblaslt_TN_9734,4.06523
GemmTunableOp_Half_TN,tn_28672_972_4096,Gemm_Rocblas_621286703,0.431754
GemmTunableOp_Half_TN,tn_32000_92_8192,Gemm_Rocblas_621294212,0.192121
GemmTunableOp_Half_TN,tn_6144_951_4096,Gemm_Hipblaslt_TN_9613,0.0937549
GemmTunableOp_Half_TN,tn_10240_4035_8192,Gemm_Hipblaslt_TN_9743,1.11957
GemmTunableOp_Half_TN,tn_6144_16_4096,Gemm_Rocblas_621294144,0.0130864
GemmTunableOp_Half_TN,tn_8192_100_8192,Gemm_Hipblaslt_TN_8891,0.0516247
GemmTunableOp_Half_TN,tn_6144_2651_4096,Gemm_Hipblaslt_TN_9768,0.217603
GemmTunableOp_Half_TN,tn_28672_2722_4096,Gemm_Rocblas_621286742,1.1567
GemmTunableOp_Half_TN,tn_28672_853_4096,Gemm_Hipblaslt_TN_9684,0.38281
GemmTunableOp_Half_TN,tn_8192_111_28672,Gemm_Hipblaslt_TN_8378,0.193754
GemmTunableOp_Half_TN,tn_10240_3491_8192,Gemm_Hipblaslt_TN_9209,0.993185
GemmTunableOp_Half_TN,tn_4096_809_14336,Gemm_Hipblaslt_TN_9158,0.210599
GemmTunableOp_Half_TN,tn_28672_1726_4096,Gemm_Hipblaslt_TN_9217,0.716118
GemmTunableOp_Half_TN,tn_32000_91_8192,Gemm_Rocblas_621294212,0.195753
GemmTunableOp_Half_TN,tn_6144_1835_4096,Gemm_Hipblaslt_TN_9690,0.163447
GemmTunableOp_Half_TN,tn_10240_3178_8192,Gemm_Hipblaslt_TN_9223,0.867977
GemmTunableOp_Half_TN,tn_32000_17_8192,Gemm_Rocblas_621286350,0.143841
GemmTunableOp_Half_TN,tn_128256_8_4096,Gemm_Rocblas_621294224,0.276593
GemmTunableOp_Half_TN,tn_6144_948_4096,Gemm_Hipblaslt_TN_9613,0.0943927
GemmTunableOp_Half_TN,tn_8192_1104_28672,Gemm_Hipblaslt_TN_9762,1.07739
GemmTunableOp_Half_TN,tn_10240_3555_8192,Gemm_Hipblaslt_TN_9744,1.01429
GemmTunableOp_Half_TN,tn_128256_256_4096,Gemm_Rocblas_621286892,0.568213
GemmTunableOp_Half_TN,tn_8192_1201_28672,Gemm_Hipblaslt_TN_9774,1.164
GemmTunableOp_Half_TN,tn_28672_790_4096,Gemm_Hipblaslt_TN_9674,0.345661
GemmTunableOp_Half_TN,tn_4096_1746_4096,Gemm_Hipblaslt_TN_9134,0.116405
GemmTunableOp_Half_TN,tn_10240_1297_8192,Gemm_Hipblaslt_TN_9192,0.357414
GemmTunableOp_Half_TN,tn_4096_956_4096,Gemm_Hipblaslt_TN_9634,0.0675524
GemmTunableOp_Half_TN,tn_128256_225_4096,Gemm_Rocblas_621294634,0.560726
GemmTunableOp_Half_TN,tn_4096_7809_14336,Gemm_Hipblaslt_TN_9753,1.53601
GemmTunableOp_Half_TN,tn_28672_1867_4096,Gemm_Hipblaslt_TN_9684,0.786765
GemmTunableOp_Half_TN,tn_4096_977_14336,Gemm_Hipblaslt_TN_9586,0.241859
GemmTunableOp_Half_TN,tn_28672_898_4096,Gemm_Hipblaslt_TN_9683,0.387551
GemmTunableOp_Half_TN,tn_6144_913_4096,Gemm_Hipblaslt_TN_9613,0.092195
GemmTunableOp_Half_TN,tn_8192_14_28672,Gemm_Rocblas_621294224,0.123434
GemmTunableOp_Half_TN,tn_8192_1249_28672,Gemm_Rocblas_621286579,1.18343
GemmTunableOp_Half_TN,tn_8192_1360_28672,Gemm_Hipblaslt_TN_9799,1.27205
GemmTunableOp_Half_TN,tn_10240_2000_8192,Gemm_Hipblaslt_TN_9649,0.58276
GemmTunableOp_Half_TN,tn_28672_2517_4096,Gemm_Hipblaslt_TN_9846,1.02272
GemmTunableOp_Half_TN,tn_8192_1208_28672,Gemm_Hipblaslt_TN_9774,1.17172
GemmTunableOp_Half_TN,tn_8192_14_8192,Gemm_Hipblaslt_TN_9392,0.030689
GemmTunableOp_Half_TN,tn_57344_1112_8192,Gemm_Hipblaslt_TN_9774,2.05476
GemmTunableOp_Half_TN,tn_28672_990_4096,Gemm_Rocblas_621286801,0.431283
GemmTunableOp_Half_TN,tn_8192_3140_8192,Gemm_Hipblaslt_TN_9189,0.710464
GemmTunableOp_Half_TN,tn_10240_13_8192,Gemm_Hipblaslt_TN_9411,0.0370685
GemmTunableOp_Half_TN,tn_28672_927_4096,Gemm_Hipblaslt_TN_9684,0.391401
GemmTunableOp_Half_TN,tn_4096_1841_4096,Gemm_Hipblaslt_TN_9645,0.121275
GemmTunableOp_Half_TN,tn_4096_168_14336,Gemm_Hipblaslt_TN_7585,0.0606716
GemmTunableOp_Half_TN,tn_8192_3283_28672,Gemm_Hipblaslt_TN_9732,2.87605
GemmTunableOp_Half_TN,tn_128256_114_4096,Gemm_Rocblas_621286644,0.403457
GemmTunableOp_Half_TN,tn_4096_949_4096,Gemm_Hipblaslt_TN_9576,0.0688495
GemmTunableOp_Half_TN,tn_6144_1762_4096,Gemm_Hipblaslt_TN_9799,0.162816
GemmTunableOp_Half_TN,tn_57344_1160_8192,Gemm_Hipblaslt_TN_9827,2.27319
GemmTunableOp_Half_TN,tn_32000_127_8192,Gemm_Rocblas_621294212,0.208865
GemmTunableOp_Half_TN,tn_6144_232_4096,Gemm_Hipblaslt_TN_9495,0.0342164
GemmTunableOp_Half_TN,tn_57344_7_8192,Gemm_Hipblaslt_TN_9405,0.252233
GemmTunableOp_Half_TN,tn_10240_3482_8192,Gemm_Hipblaslt_TN_9799,0.993983
GemmTunableOp_Half_TN,tn_10240_3331_8192,Gemm_Hipblaslt_TN_9815,0.889372
GemmTunableOp_Half_TN,tn_8192_1276_28672,Gemm_Rocblas_621286579,1.19427
GemmTunableOp_Half_TN,tn_28672_1695_4096,Gemm_Rocblas_621286678,0.711761
GemmTunableOp_Half_TN,tn_28672_794_4096,Gemm_Hipblaslt_TN_9674,0.34405
GemmTunableOp_Half_TN,tn_57344_95_8192,Gemm_Hipblaslt_TN_9478,0.333105
GemmTunableOp_Half_TN,tn_8192_1296_28672,Gemm_Hipblaslt_TN_9774,1.19868
GemmTunableOp_Half_TN,tn_28672_7299_4096,Gemm_Hipblaslt_TN_159,2.83619
GemmTunableOp_Half_TN,tn_28672_224_4096,Gemm_Hipblaslt_TN_9680,0.11029
GemmTunableOp_Half_TN,tn_8192_3619_8192,Gemm_Hipblaslt_TN_9743,0.780459
GemmTunableOp_Half_TN,tn_128256_129_4096,Gemm_Hipblaslt_TN_9775,0.439612
GemmTunableOp_Half_TN,tn_4096_896_4096,Gemm_Hipblaslt_TN_9604,0.0670082
GemmTunableOp_Half_TN,tn_6144_1700_4096,Gemm_Hipblaslt_TN_9570,0.151657
GemmTunableOp_Half_TN,tn_8192_21_28672,Gemm_Rocblas_621294226,0.128864
GemmTunableOp_Half_TN,tn_57344_1000_8192,Gemm_Rocblas_621286801,1.80221
GemmTunableOp_Half_TN,tn_32000_119_8192,Gemm_Rocblas_621286475,0.209632
GemmTunableOp_Half_TN,tn_4096_7787_4096,Gemm_Hipblaslt_TN_9768,0.434358
GemmTunableOp_Half_TN,tn_10240_1168_8192,Gemm_Hipblaslt_TN_9697,0.342429
GemmTunableOp_Half_TN,tn_8192_2622_28672,Gemm_Hipblaslt_TN_9774,2.33987
GemmTunableOp_Half_TN,tn_4096_978_14336,Gemm_Hipblaslt_TN_9170,0.24165
GemmTunableOp_Half_TN,tn_8192_3331_8192,Gemm_Hipblaslt_TN_9697,0.735087
GemmTunableOp_Half_TN,tn_8192_1286_28672,Gemm_Hipblaslt_TN_9774,1.19706
GemmTunableOp_Half_TN,tn_10240_3451_8192,Gemm_Hipblaslt_TN_9674,0.992147
GemmTunableOp_Half_TN,tn_8192_1224_28672,Gemm_Hipblaslt_TN_9774,1.18612
GemmTunableOp_Half_TN,tn_4096_7857_4096,Gemm_Rocblas_621294127,0.435188
GemmTunableOp_Half_TN,tn_57344_21_8192,Gemm_Rocblas_621286351,0.263805
GemmTunableOp_Half_TN,tn_6144_1828_4096,Gemm_Hipblaslt_TN_9672,0.163525
GemmTunableOp_Half_TN,tn_28672_2699_4096,Gemm_Hipblaslt_TN_9787,1.15249
GemmTunableOp_Half_TN,tn_128256_160_4096,Gemm_Hipblaslt_TN_7246,0.448735
GemmTunableOp_Half_TN,tn_128256_30_4096,Gemm_Hipblaslt_TN_9451,0.300584
GemmTunableOp_Half_TN,tn_28672_813_4096,Gemm_Hipblaslt_TN_9684,0.375841
GemmTunableOp_Half_TN,tn_4096_969_14336,Gemm_Hipblaslt_TN_9586,0.240681
GemmTunableOp_Half_TN,tn_10240_3274_8192,Gemm_Hipblaslt_TN_9815,0.883638
GemmTunableOp_Half_TN,tn_4096_1954_14336,Gemm_Hipblaslt_TN_9174,0.413495
GemmTunableOp_Half_TN,tn_128256_25_4096,Gemm_Hipblaslt_TN_9455,0.30043
GemmTunableOp_Half_TN,tn_10240_102_8192,Gemm_Hipblaslt_TN_7157,0.0594041
GemmTunableOp_Half_TN,tn_57344_1025_8192,Gemm_Hipblaslt_TN_9841,1.9577
GemmTunableOp_Half_TN,tn_8192_22_8192,Gemm_Hipblaslt_TN_9410,0.0326589
GemmTunableOp_Half_TN,tn_4096_865_14336,Gemm_Hipblaslt_TN_9580,0.218634
GemmTunableOp_Half_TN,tn_128256_20_4096,Gemm_Rocblas_621286354,0.297026
GemmTunableOp_Half_TN,tn_4096_1748_4096,Gemm_Hipblaslt_TN_9645,0.116645
GemmTunableOp_Half_TN,tn_4096_1900_4096,Gemm_Hipblaslt_TN_9645,0.121733
GemmTunableOp_Half_TN,tn_10240_2274_8192,Gemm_Hipblaslt_TN_9644,0.65137
GemmTunableOp_Half_TN,tn_8192_95_8192,Gemm_Hipblaslt_TN_7093,0.0473925
GemmTunableOp_Half_TN,tn_57344_122_8192,Default,0.351052
GemmTunableOp_Half_TN,tn_57344_120_8192,Gemm_Rocblas_621294214,0.351559
GemmTunableOp_Half_TN,tn_57344_110_8192,Gemm_Rocblas_621294214,0.344165
GemmTunableOp_Half_TN,tn_4096_838_14336,Gemm_Hipblaslt_TN_9158,0.218127
GemmTunableOp_Half_TN,tn_8192_3120_28672,Gemm_Rocblas_621286731,2.81228
GemmTunableOp_Half_TN,tn_6144_2658_4096,Gemm_Hipblaslt_TN_9827,0.21602
GemmTunableOp_Half_TN,tn_8192_24_28672,Gemm_Rocblas_621286354,0.128156
GemmTunableOp_Half_TN,tn_4096_855_4096,Gemm_Hipblaslt_TN_9604,0.0656461
GemmTunableOp_Half_TN,tn_8192_1265_8192,Gemm_Hipblaslt_TN_9691,0.300166
GemmTunableOp_Half_TN,tn_6144_984_4096,Gemm_Hipblaslt_TN_9587,0.101134
GemmTunableOp_Half_TN,tn_4096_1893_14336,Gemm_Hipblaslt_TN_9645,0.40923
GemmTunableOp_Half_TN,tn_4096_3431_4096,Gemm_Hipblaslt_TN_9814,0.192345
GemmTunableOp_Half_TN,tn_10240_1392_8192,Gemm_Hipblaslt_TN_9237,0.397472
GemmTunableOp_Half_TN,tn_8192_101_8192,Gemm_Hipblaslt_TN_8891,0.0477988
GemmTunableOp_Half_TN,tn_57344_3140_8192,Gemm_Hipblaslt_TN_9816,5.48204
GemmTunableOp_Half_TN,tn_6144_1848_4096,Gemm_Hipblaslt_TN_9691,0.163918
GemmTunableOp_Half_TN,tn_8192_2274_8192,Gemm_Hipblaslt_TN_9742,0.512479
GemmTunableOp_Half_TN,tn_4096_1931_14336,Gemm_Hipblaslt_TN_9620,0.414628
GemmTunableOp_Half_TN,tn_4096_1864_14336,Gemm_Hipblaslt_TN_9645,0.407075
GemmTunableOp_Half_TN,tn_6144_857_4096,Gemm_Rocblas_621286778,0.090096
GemmTunableOp_Half_TN,tn_6144_929_4096,Gemm_Hipblaslt_TN_9613,0.0933131
GemmTunableOp_Half_TN,tn_6144_2509_4096,Gemm_Hipblaslt_TN_9768,0.213297
GemmTunableOp_Half_TN,tn_4096_871_14336,Gemm_Hipblaslt_TN_9580,0.21934
GemmTunableOp_Half_TN,tn_4096_1905_14336,Gemm_Hipblaslt_TN_9620,0.412295
GemmTunableOp_Half_TN,tn_4096_855_14336,Gemm_Hipblaslt_TN_9580,0.219253
GemmTunableOp_Half_TN,tn_4096_932_14336,Gemm_Hipblaslt_TN_9634,0.23132
GemmTunableOp_Half_TN,tn_28672_949_4096,Gemm_Hipblaslt_TN_9683,0.39175
GemmTunableOp_Half_TN,tn_10240_101_8192,Gemm_Rocblas_621294504,0.0579524
GemmTunableOp_Half_TN,tn_6144_868_4096,Gemm_Hipblaslt_TN_9613,0.0914944
GemmTunableOp_Half_TN,tn_28672_904_4096,Gemm_Hipblaslt_TN_9683,0.387461
GemmTunableOp_Half_TN,tn_6144_1778_4096,Gemm_Hipblaslt_TN_9799,0.16204
GemmTunableOp_Half_TN,tn_4096_934_4096,Gemm_Hipblaslt_TN_9604,0.0686076
GemmTunableOp_Half_TN,tn_4096_1737_4096,Gemm_Hipblaslt_TN_9645,0.115298
GemmTunableOp_Half_TN,tn_6144_8192_4096,Gemm_Hipblaslt_TN_9220,0.669262
GemmTunableOp_Half_TN,tn_4096_971_4096,Gemm_Hipblaslt_TN_9604,0.0678651
GemmTunableOp_Half_TN,tn_6144_1853_4096,Gemm_Hipblaslt_TN_9690,0.164371
GemmTunableOp_Half_TN,tn_128256_103_4096,Gemm_Rocblas_621294762,0.397993
GemmTunableOp_Half_TN,tn_4096_926_14336,Gemm_Hipblaslt_TN_9634,0.230676
GemmTunableOp_Half_TN,tn_8192_1121_8192,Gemm_Hipblaslt_TN_9207,0.26232
GemmTunableOp_Half_TN,tn_6144_1775_4096,Gemm_Rocblas_621294425,0.162331
GemmTunableOp_Half_TN,tn_4096_794_14336,Gemm_Hipblaslt_TN_9158,0.212181
GemmTunableOp_Half_TN,tn_28672_992_4096,Gemm_Hipblaslt_TN_9666,0.433514
GemmTunableOp_Half_TN,tn_6144_3507_4096,Gemm_Rocblas_621294495,0.312138
GemmTunableOp_Half_TN,tn_6144_988_4096,Gemm_Hipblaslt_TN_9633,0.100637
GemmTunableOp_Half_TN,tn_6144_2599_4096,Gemm_Hipblaslt_TN_9827,0.215501
GemmTunableOp_Half_TN,tn_6144_2606_4096,Gemm_Hipblaslt_TN_9768,0.215201
GemmTunableOp_Half_TN,tn_4096_2606_4096,Gemm_Hipblaslt_TN_9674,0.15841
GemmTunableOp_Half_TN,tn_4096_863_4096,Gemm_Hipblaslt_TN_9604,0.0659694
GemmTunableOp_Half_TN,tn_4096_839_4096,Gemm_Hipblaslt_TN_9634,0.064804
GemmTunableOp_Half_TN,tn_28672_1837_4096,Gemm_Hipblaslt_TN_9684,0.777127
GemmTunableOp_Half_TN,tn_4096_2544_4096,Gemm_Hipblaslt_TN_9709,0.155468
GemmTunableOp_Half_TN,tn_4096_1777_14336,Gemm_Hipblaslt_TN_9645,0.393978
GemmTunableOp_Half_TN,tn_4096_857_14336,Gemm_Hipblaslt_TN_9580,0.217487
GemmTunableOp_Half_TN,tn_6144_894_4096,Gemm_Hipblaslt_TN_9613,0.0926717
GemmTunableOp_Half_TN,tn_6144_1954_4096,Gemm_Hipblaslt_TN_9536,0.176956
GemmTunableOp_Half_TN,tn_6144_1777_4096,Gemm_Hipblaslt_TN_9799,0.161455
GemmTunableOp_Half_TN,tn_4096_1730_4096,Gemm_Hipblaslt_TN_9645,0.113438
GemmTunableOp_Half_TN,tn_4096_2630_14336,Gemm_Hipblaslt_TN_9657,0.535433
GemmTunableOp_Half_TN,tn_6144_878_4096,Gemm_Hipblaslt_TN_9357,0.0918914
GemmTunableOp_Half_TN,tn_57344_1168_8192,Gemm_Hipblaslt_TN_9827,2.27444
GemmTunableOp_Half_TN,tn_4096_939_4096,Gemm_Hipblaslt_TN_9604,0.0699393
GemmTunableOp_Half_TN,tn_28672_919_4096,Gemm_Hipblaslt_TN_9684,0.390244
GemmTunableOp_Half_TN,tn_4096_1792_4096,Gemm_Hipblaslt_TN_9590,0.11522
GemmTunableOp_Half_TN,tn_128256_247_4096,Gemm_Rocblas_621294634,0.578064
GemmTunableOp_Half_TN,tn_4096_861_14336,Gemm_Hipblaslt_TN_9580,0.219823
GemmTunableOp_Half_TN,tn_28672_1807_4096,Gemm_Hipblaslt_TN_9684,0.778344
GemmTunableOp_Half_TN,tn_6144_8154_4096,Gemm_Hipblaslt_TN_9655,0.665309
GemmTunableOp_Half_TN,tn_6144_854_4096,Gemm_Rocblas_621286778,0.0872459
GemmTunableOp_Half_TN,tn_4096_1798_14336,Gemm_Hipblaslt_TN_9268,0.399931
GemmTunableOp_Half_TN,tn_128256_140_4096,Gemm_Hipblaslt_TN_9063,0.443279
GemmTunableOp_Half_TN,tn_4096_7992_14336,Gemm_Hipblaslt_TN_9815,1.55222
GemmTunableOp_Half_TN,tn_28672_80_4096,Gemm_Rocblas_621286719,0.056186
GemmTunableOp_Half_TN,tn_6144_914_4096,Gemm_Hipblaslt_TN_9611,0.0924358
GemmTunableOp_Half_TN,tn_28672_946_4096,Gemm_Hipblaslt_TN_9683,0.393815
GemmTunableOp_Half_TN,tn_10240_113_8192,Gemm_Rocblas_621286764,0.0597835
GemmTunableOp_Half_TN,tn_4096_2602_14336,Gemm_Hipblaslt_TN_9657,0.53415
GemmTunableOp_Half_TN,tn_4096_1783_4096,Gemm_Hipblaslt_TN_9590,0.116996
GemmTunableOp_Half_TN,tn_6144_1822_4096,Gemm_Hipblaslt_TN_9672,0.164191
GemmTunableOp_Half_TN,tn_4096_2670_4096,Gemm_Hipblaslt_TN_9799,0.160564
GemmTunableOp_Half_TN,tn_4096_2628_4096,Gemm_Hipblaslt_TN_9672,0.159847
GemmTunableOp_Half_TN,tn_28672_192_4096,Gemm_Hipblaslt_TN_9616,0.0986399
GemmTunableOp_Half_TN,tn_4096_794_4096,Gemm_Hipblaslt_TN_9158,0.062988
GemmTunableOp_Half_TN,tn_4096_946_4096,Gemm_Hipblaslt_TN_9576,0.0700472
GemmTunableOp_Half_TN,tn_4096_2675_4096,Gemm_Hipblaslt_TN_9674,0.158671
GemmTunableOp_Half_TN,tn_4096_7952_4096,Gemm_Hipblaslt_TN_9827,0.440427
GemmTunableOp_Half_TN,tn_28672_1744_4096,Gemm_Hipblaslt_TN_9217,0.719777
GemmTunableOp_Half_TN,tn_4096_988_14336,Gemm_Hipblaslt_TN_9586,0.24428
GemmTunableOp_Half_TN,tn_6144_3418_4096,Gemm_Hipblaslt_TN_9570,0.30336
GemmTunableOp_Half_TN,tn_128256_186_4096,Gemm_Hipblaslt_TN_9683,0.506008
GemmTunableOp_Half_TN,tn_57344_3451_8192,Gemm_Hipblaslt_TN_159,5.7759
GemmTunableOp_Half_TN,tn_6144_7992_4096,Gemm_Hipblaslt_TN_9655,0.653652
GemmTunableOp_Half_TN,tn_4096_2763_4096,Gemm_Hipblaslt_TN_9799,0.164001
GemmTunableOp_Half_TN,tn_28672_2509_4096,Gemm_Hipblaslt_TN_9846,1.02178
GemmTunableOp_Half_TN,tn_4096_8154_14336,Gemm_Hipblaslt_TN_9815,1.5907
GemmTunableOp_Half_TN,tn_28672_1700_4096,Gemm_Hipblaslt_TN_9191,0.711478
GemmTunableOp_Half_TN,tn_128256_96_4096,Gemm_Hipblaslt_TN_9057,0.364252
GemmTunableOp_Half_TN,tn_4096_32_4096,Gemm_Rocblas_621286273,0.0116927
GemmTunableOp_Half_TN,tn_4096_790_14336,Gemm_Hipblaslt_TN_9158,0.213971
GemmTunableOp_Half_TN,tn_6144_56_4096,Gemm_Rocblas_621294155,0.0160616
GemmTunableOp_Half_TN,tn_28672_854_4096,Gemm_Hipblaslt_TN_9683,0.380948
GemmTunableOp_Half_TN,tn_4096_820_4096,Gemm_Hipblaslt_TN_9604,0.0638919
GemmTunableOp_Half_TN,tn_28672_3752_4096,Gemm_Hipblaslt_TN_9827,1.49131
GemmTunableOp_Half_TN,tn_28672_208_4096,Gemm_Hipblaslt_TN_9590,0.110643
GemmTunableOp_Half_TN,tn_4096_2698_4096,Gemm_Hipblaslt_TN_9674,0.161381
GemmTunableOp_Half_TN,tn_4096_3479_14336,Gemm_Hipblaslt_TN_9743,0.676615
GemmTunableOp_Half_TN,tn_6144_144_4096,Gemm_Rocblas_621286443,0.0274366
GemmTunableOp_Half_TN,tn_4096_192_4096,Gemm_Rocblas_621294230,0.0228962
GemmTunableOp_Half_TN,tn_4096_2537_14336,Gemm_Hipblaslt_TN_9709,0.523272
GemmTunableOp_Half_TN,tn_8192_3206_8192,Gemm_Hipblaslt_TN_9192,0.709996
GemmTunableOp_Half_TN,tn_4096_120_4096,Gemm_Rocblas_621294164,0.0175803
GemmTunableOp_Half_TN,tn_6144_799_4096,Gemm_Hipblaslt_TN_9613,0.0870565
GemmTunableOp_Half_TN,tn_28672_2734_4096,Gemm_Rocblas_621294484,1.15696
GemmTunableOp_Half_TN,tn_57344_3120_8192,Gemm_Hipblaslt_TN_9803,5.48448
GemmTunableOp_Half_TN,tn_4096_136_14336,Gemm_Hipblaslt_TN_9298,0.0521307
GemmTunableOp_Half_TN,tn_10240_129_8192,Gemm_Hipblaslt_TN_9367,0.0660544
GemmTunableOp_Half_TN,tn_6144_2826_4096,Gemm_Hipblaslt_TN_9565,0.257871
GemmTunableOp_Half_TN,tn_8192_2551_28672,Gemm_Hipblaslt_TN_9774,2.32567
GemmTunableOp_Half_TN,tn_4096_870_4096,Gemm_Hipblaslt_TN_9634,0.0663961
GemmTunableOp_Half_TN,tn_4096_3711_14336,Gemm_Hipblaslt_TN_9841,0.712274
GemmTunableOp_Half_TN,tn_4096_942_14336,Gemm_Hipblaslt_TN_9604,0.232071
GemmTunableOp_Half_TN,tn_4096_2763_14336,Gemm_Hipblaslt_TN_9799,0.555754
GemmTunableOp_Half_TN,tn_4096_7937_14336,Gemm_Hipblaslt_TN_9815,1.57325
GemmTunableOp_Half_TN,tn_6144_1763_4096,Gemm_Hipblaslt_TN_9672,0.161256
GemmTunableOp_Half_TN,tn_4096_224_14336,Gemm_Hipblaslt_TN_9363,0.0706905
GemmTunableOp_Half_TN,tn_6144_908_4096,Gemm_Hipblaslt_TN_9613,0.092717
GemmTunableOp_Half_TN,tn_4096_819_4096,Gemm_Hipblaslt_TN_9131,0.063917
GemmTunableOp_Half_TN,tn_4096_795_4096,Gemm_Hipblaslt_TN_9158,0.0627675
GemmTunableOp_Half_TN,tn_4096_4463_4096,Gemm_Hipblaslt_TN_9926,0.264999
GemmTunableOp_Half_TN,tn_4096_894_14336,Gemm_Hipblaslt_TN_9580,0.221819
GemmTunableOp_Half_TN,tn_4096_7944_14336,Gemm_Hipblaslt_TN_9713,1.57139
GemmTunableOp_Half_TN,tn_10240_3715_8192,Gemm_Hipblaslt_TN_9814,1.05133
GemmTunableOp_Half_TN,tn_28672_2599_4096,Gemm_Hipblaslt_TN_9827,1.06167
GemmTunableOp_Half_TN,tn_4096_890_4096,Gemm_Hipblaslt_TN_9170,0.0660145
GemmTunableOp_Half_TN,tn_32000_116_8192,Gemm_Rocblas_621294212,0.208057
GemmTunableOp_Half_TN,tn_10240_3475_8192,Gemm_Hipblaslt_TN_9211,0.997594
GemmTunableOp_Half_TN,tn_4096_1666_4096,Gemm_Hipblaslt_TN_9607,0.104388
GemmTunableOp_Half_TN,tn_6144_924_4096,Gemm_Hipblaslt_TN_9561,0.0918242
GemmTunableOp_Half_TN,tn_8192_92_28672,Gemm_Hipblaslt_TN_8899,0.18318
GemmTunableOp_Half_TN,tn_4096_803_4096,Gemm_Hipblaslt_TN_9604,0.063946
GemmTunableOp_Half_TN,tn_4096_940_14336,Gemm_Hipblaslt_TN_9604,0.232349
GemmTunableOp_Half_TN,tn_6144_943_4096,Gemm_Hipblaslt_TN_9613,0.0947961
GemmTunableOp_Half_TN,tn_6144_176_4096,Gemm_Rocblas_621286443,0.0284605
GemmTunableOp_Half_TN,tn_4096_8156_14336,Gemm_Hipblaslt_TN_9815,1.59398
GemmTunableOp_Half_TN,tn_28672_8192_4096,Gemm_Hipblaslt_TN_159,3.20071
GemmTunableOp_Half_TN,tn_57344_2664_8192,Gemm_Rocblas_621286739,4.61163
GemmTunableOp_Half_TN,tn_4096_160_4096,Gemm_Rocblas_621294230,0.0221494
GemmTunableOp_Half_TN,tn_8192_1208_8192,Gemm_Hipblaslt_TN_9209,0.2955
GemmTunableOp_Half_TN,tn_28672_929_4096,Gemm_Hipblaslt_TN_9189,0.389928
GemmTunableOp_Half_TN,tn_28672_2590_4096,Gemm_Hipblaslt_TN_9827,1.05759
GemmTunableOp_Half_TN,tn_4096_168_4096,Gemm_Rocblas_621286445,0.0230452
GemmTunableOp_Half_TN,tn_28672_1768_4096,Gemm_Hipblaslt_TN_9217,0.721319
GemmTunableOp_Half_TN,tn_4096_884_14336,Gemm_Hipblaslt_TN_9580,0.2182
GemmTunableOp_Half_TN,tn_8192_2914_8192,Gemm_Rocblas_621294320,0.661242
GemmTunableOp_Half_TN,tn_4096_7863_14336,Gemm_Hipblaslt_TN_9749,1.56478
GemmTunableOp_Half_TN,tn_28672_917_4096,Gemm_Hipblaslt_TN_9684,0.389232
GemmTunableOp_Half_TN,tn_28672_160_4096,Gemm_Hipblaslt_TN_9561,0.0854141
GemmTunableOp_Half_TN,tn_28672_7967_4096,Gemm_Hipblaslt_TN_159,3.09602
GemmTunableOp_Half_TN,tn_4096_7952_14336,Gemm_Hipblaslt_TN_9753,1.55609
GemmTunableOp_Half_TN,tn_128256_254_4096,Gemm_Rocblas_621286892,0.576523
GemmTunableOp_Half_TN,tn_28672_7804_4096,Gemm_Hipblaslt_TN_159,2.98621
GemmTunableOp_Half_TN,tn_4096_1666_14336,Gemm_Hipblaslt_TN_9671,0.36073
GemmTunableOp_Half_TN,tn_6144_855_4096,Gemm_Rocblas_621286778,0.0891321
GemmTunableOp_Half_TN,tn_128256_56_4096,Gemm_Hipblaslt_TN_9168,0.336124
GemmTunableOp_Half_TN,tn_6144_1718_4096,Gemm_Hipblaslt_TN_9570,0.153122
GemmTunableOp_Half_TN,tn_4096_24_4096,Gemm_Rocblas_621286273,0.011393
GemmTunableOp_Half_TN,tn_57344_1350_8192,Gemm_Hipblaslt_TN_9830,2.55038
GemmTunableOp_Half_TN,tn_28672_3352_4096,Gemm_Hipblaslt_TN_9827,1.34955
GemmTunableOp_Half_TN,tn_8192_1153_8192,Gemm_Hipblaslt_TN_9672,0.292016
GemmTunableOp_Half_TN,tn_6144_3402_4096,Gemm_Hipblaslt_TN_9570,0.303658
GemmTunableOp_Half_TN,tn_28672_850_4096,Gemm_Hipblaslt_TN_9683,0.380088
GemmTunableOp_Half_TN,tn_28672_72_4096,Gemm_Rocblas_621286719,0.0562903
GemmTunableOp_Half_TN,tn_6144_957_4096,Gemm_Hipblaslt_TN_9613,0.0941439
GemmTunableOp_Half_TN,tn_8192_102_28672,Gemm_Hipblaslt_TN_8378,0.197131
GemmTunableOp_Half_TN,tn_6144_862_4096,Gemm_Hipblaslt_TN_9148,0.0885211
GemmTunableOp_Half_TN,tn_4096_873_4096,Gemm_Hipblaslt_TN_9604,0.0669817
GemmTunableOp_Half_TN,tn_4096_232_4096,Gemm_Rocblas_621294171,0.0256139
GemmTunableOp_Half_TN,tn_128256_191_4096,Gemm_Hipblaslt_TN_9683,0.503516
GemmTunableOp_Half_TN,tn_28672_32_4096,Gemm_Rocblas_621294559,0.0458974
GemmTunableOp_Half_TN,tn_4096_7798_4096,Gemm_Hipblaslt_TN_9753,0.431364
GemmTunableOp_Half_TN,tn_4096_925_4096,Gemm_Hipblaslt_TN_9634,0.0681094
GemmTunableOp_Half_TN,tn_4096_8_14336,Gemm_Rocblas_621286312,0.0233938
GemmTunableOp_Half_TN,tn_6144_7863_4096,Gemm_Hipblaslt_TN_9768,0.65296
GemmTunableOp_Half_TN,tn_128256_152_4096,Gemm_Hipblaslt_TN_9623,0.456543
GemmTunableOp_Half_TN,tn_6144_7787_4096,Gemm_Rocblas_621294484,0.642702
GemmTunableOp_Half_TN,tn_28672_1897_4096,Gemm_Hipblaslt_TN_9684,0.785466
GemmTunableOp_Half_TN,tn_4096_1733_14336,Gemm_Hipblaslt_TN_9645,0.392216
GemmTunableOp_Half_TN,tn_4096_915_4096,Gemm_Hipblaslt_TN_9604,0.0660988
GemmTunableOp_Half_TN,tn_4096_801_14336,Gemm_Hipblaslt_TN_9131,0.21542
GemmTunableOp_Half_TN,tn_128256_196_4096,Gemm_Rocblas_621286797,0.543319
GemmTunableOp_Half_TN,tn_28672_1806_4096,Gemm_Hipblaslt_TN_9832,0.779888
GemmTunableOp_Half_TN,tn_28672_836_4096,Gemm_Hipblaslt_TN_9684,0.37702
GemmTunableOp_Half_TN,tn_6144_1726_4096,Gemm_Rocblas_621294495,0.155301
GemmTunableOp_Half_TN,tn_4096_879_4096,Gemm_Hipblaslt_TN_9634,0.0660792
GemmTunableOp_Half_TN,tn_4096_879_14336,Gemm_Hipblaslt_TN_9580,0.218568
GemmTunableOp_Half_TN,tn_28672_926_4096,Gemm_Hipblaslt_TN_9683,0.389902
GemmTunableOp_Half_TN,tn_28672_799_4096,Gemm_Hipblaslt_TN_9691,0.347272
GemmTunableOp_Half_TN,tn_6144_2788_4096,Gemm_Hipblaslt_TN_9742,0.255794
GemmTunableOp_Half_TN,tn_4096_1726_14336,Gemm_Hipblaslt_TN_9790,0.364954
GemmTunableOp_Half_TN,tn_6144_918_4096,Gemm_Hipblaslt_TN_9613,0.0929233
GemmTunableOp_Half_TN,tn_4096_3507_14336,Gemm_Hipblaslt_TN_9187,0.67688
GemmTunableOp_Half_TN,tn_128256_35_4096,Gemm_Hipblaslt_TN_9451,0.301779
GemmTunableOp_Half_TN,tn_28672_1730_4096,Gemm_Hipblaslt_TN_9223,0.716478
GemmTunableOp_Half_TN,tn_6144_128_4096,Gemm_Rocblas_621294172,0.0237741
GemmTunableOp_Half_TN,tn_28672_795_4096,Gemm_Hipblaslt_TN_9674,0.345059
GemmTunableOp_Half_TN,tn_4096_1697_4096,Gemm_Hipblaslt_TN_9607,0.106263
GemmTunableOp_Half_TN,tn_6144_817_4096,Gemm_Rocblas_621294520,0.0874279
GemmTunableOp_Half_TN,tn_8192_126_28672,Gemm_Hipblaslt_TN_8378,0.201827
GemmTunableOp_Half_TN,tn_4096_2708_4096,Gemm_Hipblaslt_TN_9690,0.161249
GemmTunableOp_Half_TN,tn_4096_3479_4096,Gemm_Hipblaslt_TN_9814,0.197186
GemmTunableOp_Half_TN,tn_8192_3400_8192,Gemm_Hipblaslt_TN_9187,0.746011
GemmTunableOp_Half_TN,tn_28672_961_4096,Gemm_Hipblaslt_TN_9863,0.415533
GemmTunableOp_Half_TN,tn_6144_2722_4096,Gemm_Hipblaslt_TN_9742,0.254158
GemmTunableOp_Half_TN,tn_8192_1389_8192,Gemm_Hipblaslt_TN_9674,0.321838
GemmTunableOp_Half_TN,tn_28672_978_4096,Gemm_Hipblaslt_TN_9666,0.428105
GemmTunableOp_Half_TN,tn_4096_837_14336,Gemm_Hipblaslt_TN_9099,0.217217
GemmTunableOp_Half_TN,tn_28672_1701_4096,Gemm_Hipblaslt_TN_9217,0.709679
GemmTunableOp_Half_TN,tn_57344_132_8192,Gemm_Hipblaslt_TN_9507,0.395151
GemmTunableOp_Half_TN,tn_4096_899_4096,Gemm_Hipblaslt_TN_9634,0.0668211
GemmTunableOp_Half_TN,tn_28672_2717_4096,Gemm_Rocblas_621294484,1.15303
GemmTunableOp_Half_TN,tn_4096_2721_4096,Gemm_Hipblaslt_TN_9672,0.163595
GemmTunableOp_Half_TN,tn_6144_1756_4096,Gemm_Hipblaslt_TN_9799,0.157681
GemmTunableOp_Half_TN,tn_28672_907_4096,Gemm_Hipblaslt_TN_9684,0.389017
GemmTunableOp_Half_TN,tn_8192_3206_28672,Gemm_Hipblaslt_TN_9731,2.86292
GemmTunableOp_Half_TN,tn_4096_890_14336,Gemm_Hipblaslt_TN_9580,0.220358
GemmTunableOp_Half_TN,tn_28672_136_4096,Gemm_Hipblaslt_TN_9561,0.0834912
GemmTunableOp_Half_TN,tn_4096_1723_4096,Gemm_Hipblaslt_TN_9359,0.107565
GemmTunableOp_Half_TN,tn_6144_916_4096,Gemm_Hipblaslt_TN_9357,0.0926769
GemmTunableOp_Half_TN,tn_4096_863_14336,Gemm_Hipblaslt_TN_9580,0.218515
GemmTunableOp_Half_TN,tn_4096_911_4096,Gemm_Hipblaslt_TN_9170,0.0687975
GemmTunableOp_Half_TN,tn_4096_850_4096,Gemm_Hipblaslt_TN_9634,0.065421
GemmTunableOp_Half_TN,tn_57344_4083_8192,Gemm_Rocblas_621294285,6.6467
GemmTunableOp_Half_TN,tn_28672_1649_4096,Gemm_Rocblas_621294420,0.6981
GemmTunableOp_Half_TN,tn_4096_802_4096,Gemm_Hipblaslt_TN_9634,0.0646884
GemmTunableOp_Half_TN,tn_10240_1329_8192,Gemm_Hipblaslt_TN_9139,0.361557
GemmTunableOp_Half_TN,tn_4096_882_4096,Gemm_Hipblaslt_TN_9604,0.06679
GemmTunableOp_Half_TN,tn_4096_977_4096,Gemm_Hipblaslt_TN_9576,0.070724
GemmTunableOp_Half_TN,tn_6144_814_4096,Gemm_Rocblas_621286778,0.0888144
GemmTunableOp_Half_TN,tn_128256_49_4096,Gemm_Hipblaslt_TN_9097,0.33007
GemmTunableOp_Half_TN,tn_28672_885_4096,Gemm_Hipblaslt_TN_9192,0.379834
GemmTunableOp_Half_TN,tn_4096_895_4096,Gemm_Hipblaslt_TN_9604,0.0673126
GemmTunableOp_Half_TN,tn_4096_895_14336,Gemm_Hipblaslt_TN_9580,0.220335
GemmTunableOp_Half_TN,tn_4096_1813_14336,Gemm_Hipblaslt_TN_9680,0.400536
GemmTunableOp_Half_TN,tn_28672_1831_4096,Gemm_Hipblaslt_TN_9832,0.7851
GemmStridedBatchedTunableOp_Half_TN,tn_827_827_128_B_32,Gemm_Rocblas_621294109,0.0439017
GemmStridedBatchedTunableOp_Half_TN,tn_871_871_128_B_32,Gemm_Rocblas_621286774,0.0481034
GemmStridedBatchedTunableOp_Half_TN,tn_885_885_128_B_32,Gemm_Rocblas_621286775,0.0479396
GemmStridedBatchedTunableOp_Half_TN,tn_864_864_128_B_32,Gemm_Hipblaslt_TN_150,0.0364507
GemmStridedBatchedTunableOp_Half_TN,tn_971_971_128_B_32,Gemm_Hipblaslt_TN_9351,0.0540959
GemmStridedBatchedTunableOp_Half_TN,tn_798_798_128_B_32,Gemm_Rocblas_621286412,0.0434011
GemmStridedBatchedTunableOp_Half_TN,tn_854_854_128_B_32,Gemm_Rocblas_621294517,0.045693
GemmStridedBatchedTunableOp_Half_TN,tn_882_882_128_B_32,Gemm_Rocblas_621294518,0.0478123
GemmStridedBatchedTunableOp_Half_TN,tn_945_945_128_B_32,Gemm_Rocblas_621294536,0.0531045
GemmStridedBatchedTunableOp_Half_TN,tn_975_975_128_B_32,Gemm_Hipblaslt_TN_9351,0.0533529
GemmStridedBatchedTunableOp_Half_TN,tn_961_961_128_B_32,Gemm_Rocblas_621286794,0.0531404
GemmStridedBatchedTunableOp_Half_TN,tn_819_819_128_B_32,Gemm_Rocblas_621286776,0.0446499
GemmStridedBatchedTunableOp_Half_TN,tn_809_809_128_B_32,Gemm_Rocblas_621294109,0.0436345
GemmStridedBatchedTunableOp_Half_TN,tn_859_859_128_B_32,Gemm_Rocblas_621286774,0.0469782
GemmStridedBatchedTunableOp_Half_TN,tn_967_967_128_B_32,Gemm_Hipblaslt_TN_9351,0.0536304
GemmStridedBatchedTunableOp_Half_TN,tn_1153_1153_128_B_64,Gemm_Rocblas_621286397,0.120748
GemmStridedBatchedTunableOp_Half_TN,tn_1404_1404_128_B_64,Gemm_Rocblas_621294109,0.163683
GemmStridedBatchedTunableOp_Half_TN,tn_1296_1296_128_B_64,Gemm_Rocblas_621286412,0.136165
GemmStridedBatchedTunableOp_Half_TN,tn_1048_1048_128_B_64,Gemm_Rocblas_621294106,0.102824
GemmStridedBatchedTunableOp_Half_TN,tn_1128_1128_128_B_64,Gemm_Rocblas_621294106,0.113464
GemmStridedBatchedTunableOp_Half_TN,tn_948_948_128_B_32,Gemm_Hipblaslt_TN_6879,0.052553
GemmStridedBatchedTunableOp_Half_TN,tn_1425_1425_128_B_64,Gemm_Rocblas_621294106,0.173248
GemmStridedBatchedTunableOp_Half_TN,tn_1455_1455_128_B_64,Gemm_Rocblas_621286397,0.18034
GemmStridedBatchedTunableOp_Half_TN,tn_1224_1224_128_B_64,Gemm_Rocblas_621294106,0.126786
GemmStridedBatchedTunableOp_Half_TN,tn_1009_1009_128_B_64,Gemm_Hipblaslt_TN_6879,0.0982249
GemmStridedBatchedTunableOp_Half_TN,tn_850_850_128_B_32,Gemm_Rocblas_621294635,0.0452152
GemmStridedBatchedTunableOp_Half_TN,tn_847_847_128_B_32,Gemm_Rocblas_621294635,0.0455166
GemmStridedBatchedTunableOp_Half_TN,tn_844_844_128_B_32,Gemm_Rocblas_621286774,0.0449893
GemmStridedBatchedTunableOp_Half_TN,tn_1032_1032_128_B_64,Gemm_Rocblas_621294725,0.0990668
GemmStridedBatchedTunableOp_Half_TN,tn_1010_1010_128_B_64,Gemm_Hipblaslt_TN_6879,0.096948
GemmStridedBatchedTunableOp_Half_TN,tn_32_32_128_B_32,Gemm_Rocblas_621294459,0.00647249
GemmStridedBatchedTunableOp_Half_TN,tn_1392_1392_128_B_64,Gemm_Rocblas_621294109,0.147605
GemmStridedBatchedTunableOp_Half_TN,tn_835_835_128_B_32,Gemm_Rocblas_621286774,0.0451326
GemmStridedBatchedTunableOp_Half_TN,tn_1256_1256_128_B_64,Gemm_Rocblas_621286397,0.130847
GemmStridedBatchedTunableOp_Half_TN,tn_1076_1076_128_B_64,Gemm_Rocblas_621294725,0.107431
GemmStridedBatchedTunableOp_Half_TN,tn_1008_1008_128_B_64,Gemm_Rocblas_621294763,0.0904428
GemmStridedBatchedTunableOp_Half_TN,tn_791_791_128_B_32,Gemm_Rocblas_621294635,0.0418198
GemmStridedBatchedTunableOp_Half_TN,tn_1064_1064_128_B_64,Gemm_Rocblas_621294725,0.10479
GemmStridedBatchedTunableOp_Half_TN,tn_1368_1368_128_B_64,Gemm_Rocblas_621294109,0.153186
GemmStridedBatchedTunableOp_Half_TN,tn_972_972_128_B_32,Gemm_Hipblaslt_TN_6879,0.0537721
GemmStridedBatchedTunableOp_Half_TN,tn_1367_1367_128_B_64,Gemm_Rocblas_621286412,0.161519
GemmStridedBatchedTunableOp_Half_TN,tn_1038_1038_128_B_64,Gemm_Rocblas_621294725,0.101263
GemmStridedBatchedTunableOp_Half_TN,tn_939_939_128_B_32,Gemm_Hipblaslt_TN_6879,0.0527381
GemmStridedBatchedTunableOp_Half_TN,tn_1297_1297_128_B_64,Gemm_Rocblas_621294109,0.151135
GemmStridedBatchedTunableOp_Half_TN,tn_1350_1350_128_B_64,Gemm_Rocblas_621294109,0.154477
GemmStridedBatchedTunableOp_Half_TN,tn_902_902_128_B_32,Gemm_Hipblaslt_TN_7519,0.0514709
GemmStridedBatchedTunableOp_Half_TN,tn_816_816_128_B_32,Gemm_Hipblaslt_TN_150,0.0369509
GemmStridedBatchedTunableOp_Half_TN,tn_921_921_128_B_32,Gemm_Hipblaslt_TN_6879,0.0521134
GemmStridedBatchedTunableOp_Half_TN,tn_1216_1216_128_B_64,Gemm_Rocblas_621286397,0.117951
GemmStridedBatchedTunableOp_Half_TN,tn_983_983_128_B_32,Gemm_Rocblas_621294536,0.0538132
GemmStridedBatchedTunableOp_Half_TN,tn_1441_1441_128_B_64,Gemm_Rocblas_621286397,0.175661
GemmStridedBatchedTunableOp_Half_TN,tn_977_977_128_B_32,Gemm_Hipblaslt_TN_7483,0.0534354
GemmStridedBatchedTunableOp_Half_TN,tn_16_16_128_B_64,Gemm_Rocblas_621286332,0.00646596
GemmStridedBatchedTunableOp_Half_TN,tn_938_938_128_B_32,Gemm_Rocblas_621286794,0.05263
GemmStridedBatchedTunableOp_Half_TN,tn_969_969_128_B_32,Gemm_Hipblaslt_TN_9351,0.0528904
GemmStridedBatchedTunableOp_Half_TN,tn_976_976_128_B_32,Gemm_Rocblas_621293994,0.0488203
GemmStridedBatchedTunableOp_Half_TN,tn_828_828_128_B_32,Gemm_Rocblas_621294635,0.0432618
GemmStridedBatchedTunableOp_Half_TN,tn_1041_1041_128_B_64,Gemm_Hipblaslt_TN_6879,0.102872
GemmStridedBatchedTunableOp_Half_TN,tn_884_884_128_B_32,Gemm_Rocblas_621286775,0.0472834
GemmStridedBatchedTunableOp_Half_TN,tn_883_883_128_B_32,Gemm_Rocblas_621294635,0.0463034
GemmStridedBatchedTunableOp_Half_TN,tn_838_838_128_B_32,Gemm_Rocblas_621294517,0.0453167
GemmStridedBatchedTunableOp_Half_TN,tn_910_910_128_B_32,Gemm_Hipblaslt_TN_6879,0.05086
GemmStridedBatchedTunableOp_Half_TN,tn_941_941_128_B_32,Gemm_Rocblas_621294536,0.0529906
GemmStridedBatchedTunableOp_Half_TN,tn_991_991_128_B_32,Gemm_Rocblas_621294536,0.0539236
GemmStridedBatchedTunableOp_Half_TN,tn_796_796_128_B_32,Gemm_Rocblas_621294635,0.0416474
GemmStridedBatchedTunableOp_Half_TN,tn_968_968_128_B_32,Gemm_Rocblas_621293994,0.0492442
GemmStridedBatchedTunableOp_Half_TN,tn_914_914_128_B_32,Gemm_Hipblaslt_TN_7519,0.0519933
GemmStridedBatchedTunableOp_Half_TN,tn_786_786_128_B_32,Gemm_Rocblas_621294635,0.0424716
GemmStridedBatchedTunableOp_Half_TN,tn_987_987_128_B_32,Gemm_Hipblaslt_TN_7483,0.0535075
GemmStridedBatchedTunableOp_Half_TN,tn_988_988_128_B_32,Gemm_Rocblas_621294536,0.0535721
GemmStridedBatchedTunableOp_Half_TN,tn_848_848_128_B_32,Gemm_Hipblaslt_TN_150,0.0367942
GemmStridedBatchedTunableOp_Half_TN,tn_1022_1022_128_B_64,Gemm_Hipblaslt_TN_6879,0.0990424
GemmStridedBatchedTunableOp_Half_TN,tn_842_842_128_B_32,Gemm_Rocblas_621286774,0.0457922
GemmStridedBatchedTunableOp_Half_TN,tn_907_907_128_B_32,Gemm_Rocblas_621294536,0.0519155
GemmStridedBatchedTunableOp_Half_TN,tn_903_903_128_B_32,Gemm_Hipblaslt_TN_6879,0.051033
GemmStridedBatchedTunableOp_Half_TN,tn_800_800_128_B_32,Gemm_Hipblaslt_TN_150,0.0343576
GemmStridedBatchedTunableOp_Half_TN,tn_999_999_128_B_32,Gemm_Rocblas_621286794,0.0540022
GemmStridedBatchedTunableOp_Half_TN,tn_920_920_128_B_32,Gemm_Rocblas_621293994,0.047728
GemmTunableOp_Half_TN,tn_28672_948_4096,Gemm_Hipblaslt_TN_9683,0.397298
GemmTunableOp_Half_TN,tn_6144_2635_4096,Gemm_Hipblaslt_TN_9827,0.219415
GemmTunableOp_Half_TN,tn_4096_1719_14336,Gemm_Hipblaslt_TN_9164,0.369058
GemmTunableOp_Half_TN,tn_4096_835_14336,Gemm_Hipblaslt_TN_9099,0.221543
GemmTunableOp_Half_TN,tn_4096_906_14336,Gemm_Hipblaslt_TN_9604,0.232018
GemmTunableOp_Half_TN,tn_28672_913_4096,Gemm_Hipblaslt_TN_9684,0.392198
GemmTunableOp_Half_TN,tn_4096_176_4096,Gemm_Rocblas_621286445,0.0228058
GemmTunableOp_Half_TN,tn_28672_2750_4096,Gemm_Rocblas_621286742,1.18513
GemmTunableOp_Half_TN,tn_4096_971_14336,Gemm_Hipblaslt_TN_9052,0.244222
GemmTunableOp_Half_TN,tn_28672_1827_4096,Gemm_Hipblaslt_TN_9684,0.79533
GemmTunableOp_Half_TN,tn_4096_7967_14336,Gemm_Hipblaslt_TN_9815,1.59282
GemmTunableOp_Half_TN,tn_4096_920_4096,Gemm_Hipblaslt_TN_9576,0.0697875
GemmTunableOp_Half_TN,tn_4096_807_4096,Gemm_Hipblaslt_TN_9158,0.0645968
GemmTunableOp_Half_TN,tn_28672_1900_4096,Gemm_Hipblaslt_TN_9684,0.797452
GemmTunableOp_Half_TN,tn_4096_925_14336,Gemm_Hipblaslt_TN_9604,0.233466
GemmTunableOp_Half_TN,tn_28672_2872_4096,Gemm_Hipblaslt_TN_9827,1.17056
GemmTunableOp_Half_TN,tn_28672_915_4096,Gemm_Hipblaslt_TN_9677,0.391605
GemmTunableOp_Half_TN,tn_4096_1828_14336,Gemm_Hipblaslt_TN_9137,0.40791
GemmTunableOp_Half_TN,tn_28672_922_4096,Gemm_Hipblaslt_TN_9684,0.393331
GemmTunableOp_Half_TN,tn_128256_243_4096,Gemm_Rocblas_621286905,0.582434
GemmTunableOp_Half_TN,tn_4096_930_14336,Gemm_Hipblaslt_TN_9585,0.234667
GemmTunableOp_Half_TN,tn_4096_3507_4096,Gemm_Hipblaslt_TN_9743,0.200448
GemmTunableOp_Half_TN,tn_28672_2732_4096,Gemm_Hipblaslt_TN_9847,1.18328
GemmTunableOp_Half_TN,tn_4096_907_14336,Gemm_Hipblaslt_TN_9604,0.232574
GemmTunableOp_Half_TN,tn_4096_891_14336,Gemm_Hipblaslt_TN_9580,0.221503
GemmTunableOp_Half_TN,tn_128256_207_4096,Gemm_Hipblaslt_TN_9937,0.543542
GemmTunableOp_Half_TN,tn_4096_891_4096,Gemm_Hipblaslt_TN_9547,0.0663708
GemmTunableOp_Half_TN,tn_28672_984_4096,Gemm_Hipblaslt_TN_9666,0.439427
GemmTunableOp_Half_TN,tn_4096_1791_14336,Gemm_Hipblaslt_TN_9134,0.400523
GemmTunableOp_Half_TN,tn_128256_148_4096,Gemm_Hipblaslt_TN_9808,0.456438
GemmTunableOp_Half_TN,tn_4096_887_4096,Gemm_Hipblaslt_TN_9170,0.068295
GemmTunableOp_Half_TN,tn_4096_829_14336,Gemm_Hipblaslt_TN_9147,0.215496
GemmTunableOp_Half_TN,tn_4096_811_4096,Gemm_Hipblaslt_TN_9604,0.0651506
GemmTunableOp_Half_TN,tn_4096_3430_14336,Gemm_Hipblaslt_TN_9139,0.668165
GemmTunableOp_Half_TN,tn_4096_4463_14336,Gemm_Hipblaslt_TN_9670,0.938918
GemmTunableOp_Half_TN,tn_4096_2860_4096,Gemm_Hipblaslt_TN_9691,0.168984
GemmTunableOp_Half_TN,tn_6144_2653_4096,Gemm_Hipblaslt_TN_9827,0.221775
GemmTunableOp_Half_TN,tn_4096_7953_14336,Gemm_Hipblaslt_TN_9815,1.59863
GemmTunableOp_Half_TN,tn_4096_1806_14336,Gemm_Hipblaslt_TN_9174,0.409062
GemmTunableOp_Half_TN,tn_28672_829_4096,Gemm_Hipblaslt_TN_9684,0.382973
GemmTunableOp_Half_TN,tn_4096_1897_14336,Gemm_Hipblaslt_TN_9645,0.416637
GemmTunableOp_Half_TN,tn_6144_3565_4096,Gemm_Rocblas_621294306,0.315041
GemmTunableOp_Half_TN,tn_6144_900_4096,Gemm_Hipblaslt_TN_9561,0.0910157
GemmTunableOp_Half_TN,tn_28672_1829_4096,Gemm_Hipblaslt_TN_9684,0.79101
GemmTunableOp_Half_TN,tn_6144_1729_4096,Gemm_Hipblaslt_TN_9799,0.159072
GemmTunableOp_Half_TN,tn_4096_1835_4096,Gemm_Hipblaslt_TN_9645,0.12183
GemmTunableOp_Half_TN,tn_6144_1893_4096,Gemm_Hipblaslt_TN_9691,0.167586
GemmTunableOp_Half_TN,tn_6144_875_4096,Gemm_Hipblaslt_TN_9613,0.0934725
GemmTunableOp_Half_TN,tn_6144_815_4096,Gemm_Hipblaslt_TN_9322,0.0893379
GemmTunableOp_Half_TN,tn_28672_873_4096,Gemm_Hipblaslt_TN_9683,0.388715
GemmTunableOp_Half_TN,tn_4096_947_14336,Gemm_Hipblaslt_TN_9604,0.236056
GemmTunableOp_Half_TN,tn_4096_2764_14336,Gemm_Hipblaslt_TN_9799,0.563068
GemmTunableOp_Half_TN,tn_6144_1727_4096,Gemm_Hipblaslt_TN_9570,0.155615
GemmTunableOp_Half_TN,tn_4096_816_14336,Gemm_Hipblaslt_TN_9147,0.210347
GemmTunableOp_Half_TN,tn_6144_834_4096,Gemm_Rocblas_621286778,0.0898014
GemmTunableOp_Half_TN,tn_4096_1795_14336,Gemm_Hipblaslt_TN_9134,0.402912
GemmTunableOp_Half_TN,tn_28672_796_4096,Gemm_Hipblaslt_TN_9674,0.349123
GemmTunableOp_Half_TN,tn_57344_94_8192,Gemm_Rocblas_621286477,0.329982
GemmTunableOp_Half_TN,tn_4096_1886_14336,Gemm_Hipblaslt_TN_9620,0.416448
GemmTunableOp_Half_TN,tn_4096_2785_4096,Gemm_Hipblaslt_TN_9852,0.167482
GemmTunableOp_Half_TN,tn_6144_1724_4096,Gemm_Hipblaslt_TN_9570,0.152929
GemmTunableOp_Half_TN,tn_4096_248_4096,Gemm_Rocblas_621294230,0.0268764
GemmTunableOp_Half_TN,tn_4096_1867_14336,Gemm_Hipblaslt_TN_9645,0.413019
GemmTunableOp_Half_TN,tn_4096_1701_14336,Gemm_Hipblaslt_TN_9265,0.36756
GemmTunableOp_Half_TN,tn_57344_10_8192,Gemm_Hipblaslt_TN_9429,0.240633
GemmTunableOp_Half_TN,tn_6144_1913_4096,Gemm_Hipblaslt_TN_9691,0.169303
GemmTunableOp_Half_TN,tn_4096_2635_4096,Gemm_Hipblaslt_TN_9690,0.161745
GemmTunableOp_Half_TN,tn_4096_248_14336,Gemm_Hipblaslt_TN_9303,0.0753166
GemmTunableOp_Half_TN,tn_128256_211_4096,Gemm_Hipblaslt_TN_9738,0.550223
GemmTunableOp_Half_TN,tn_6144_901_4096,Gemm_Hipblaslt_TN_9613,0.0928636
GemmTunableOp_Half_TN,tn_128256_170_4096,Gemm_Hipblaslt_TN_9952,0.494272
GemmTunableOp_Half_TN,tn_32000_256_8192,Gemm_Hipblaslt_TN_9541,0.332258
GemmTunableOp_Half_TN,tn_128256_163_4096,Gemm_Hipblaslt_TN_9952,0.488955
GemmTunableOp_Half_TN,tn_10240_3290_8192,Gemm_Hipblaslt_TN_9815,0.910423
GemmTunableOp_Half_TN,tn_6144_2590_4096,Gemm_Hipblaslt_TN_9827,0.219352
GemmTunableOp_Half_TN,tn_128256_74_4096,Gemm_Hipblaslt_TN_9057,0.354696
GemmTunableOp_Half_TN,tn_6144_1737_4096,Gemm_Hipblaslt_TN_9799,0.159576
GemmTunableOp_Half_TN,tn_4096_908_14336,Gemm_Hipblaslt_TN_9604,0.231399
GemmTunableOp_Half_TN,tn_128256_27_4096,Gemm_Hipblaslt_TN_9451,0.297833
GemmTunableOp_Half_TN,tn_128256_14_4096,Gemm_Rocblas_621286325,0.280236
GemmTunableOp_Half_TN,tn_128256_7_4096,Gemm_Rocblas_621286325,0.272735
GemmTunableOp_Half_TN,tn_8192_130_8192,Gemm_Hipblaslt_TN_7230,0.059566
GemmTunableOp_Half_TN,tn_10240_107_8192,Gemm_Rocblas_621286764,0.0598809
GemmTunableOp_Half_TN,tn_10240_4090_8192,Gemm_Hipblaslt_TN_9743,1.13281
GemmTunableOp_Half_TN,tn_10240_24_8192,Gemm_Hipblaslt_TN_9415,0.0396906
GemmTunableOp_Half_TN,tn_4096_823_14336,Gemm_Hipblaslt_TN_9131,0.216472
GemmTunableOp_Half_TN,tn_57344_2802_8192,Gemm_Rocblas_621294542,5.07411
GemmTunableOp_Half_TN,tn_28672_982_4096,Gemm_Hipblaslt_TN_9666,0.44018
GemmTunableOp_Half_TN,tn_57344_115_8192,Gemm_Rocblas_621286477,0.345797
GemmTunableOp_Half_TN,tn_57344_1361_8192,Gemm_Hipblaslt_TN_9832,2.61008
GemmTunableOp_Half_TN,tn_4096_842_14336,Gemm_Hipblaslt_TN_9099,0.223464
GemmTunableOp_Half_TN,tn_8192_3747_8192,Gemm_Rocblas_621294484,0.850237
GemmTunableOp_Half_TN,tn_8192_4090_28672,Gemm_Rocblas_621286915,3.48431
GemmTunableOp_Half_TN,tn_10240_1280_8192,Gemm_Hipblaslt_TN_9192,0.360097
GemmTunableOp_Half_TN,tn_10240_97_8192,Gemm_Rocblas_621286764,0.0583162
GemmTunableOp_Half_TN,tn_4096_1763_14336,Gemm_Hipblaslt_TN_9645,0.399371
GemmTunableOp_Half_TN,tn_10240_4025_8192,Gemm_Hipblaslt_TN_9743,1.10952
GemmTunableOp_Half_TN,tn_8192_3153_28672,Gemm_Hipblaslt_TN_9731,2.89433
GemmTunableOp_Half_TN,tn_8192_2866_28672,Gemm_Hipblaslt_TN_9709,2.63616
GemmTunableOp_Half_TN,tn_10240_1265_8192,Gemm_Hipblaslt_TN_9697,0.357488
GemmTunableOp_Half_TN,tn_4096_785_14336,Gemm_Hipblaslt_TN_9099,0.215063
GemmTunableOp_Half_TN,tn_10240_4091_8192,Gemm_Hipblaslt_TN_9814,1.17367
GemmTunableOp_Half_TN,tn_6144_880_4096,Gemm_Hipblaslt_TN_9613,0.0930751
GemmTunableOp_Half_TN,tn_4096_813_4096,Gemm_Hipblaslt_TN_9158,0.0636531
GemmTunableOp_Half_TN,tn_10240_2032_8192,Gemm_Rocblas_621294309,0.616151
GemmTunableOp_Half_TN,tn_28672_930_4096,Gemm_Hipblaslt_TN_9683,0.394351
GemmTunableOp_Half_TN,tn_8192_1025_28672,Gemm_Hipblaslt_TN_9762,1.06341
GemmTunableOp_Half_TN,tn_32000_133_8192,Gemm_Hipblaslt_TN_9506,0.244381
GemmTunableOp_Half_TN,tn_57344_1121_8192,Gemm_Hipblaslt_TN_9774,2.09594
GemmTunableOp_Half_TN,tn_128256_107_4096,Gemm_Rocblas_621294385,0.399892
GemmTunableOp_Half_TN,tn_6144_2703_4096,Gemm_Hipblaslt_TN_9742,0.253705
GemmTunableOp_Half_TN,tn_10240_2479_8192,Gemm_Hipblaslt_TN_9743,0.712419
GemmTunableOp_Half_TN,tn_8192_1297_8192,Gemm_Rocblas_621294426,0.31562
GemmTunableOp_Half_TN,tn_6144_797_4096,Gemm_Hipblaslt_TN_9163,0.0870121
GemmTunableOp_Half_TN,tn_8192_3331_28672,Gemm_Hipblaslt_TN_9684,2.97783
GemmTunableOp_Half_TN,tn_8192_2479_8192,Gemm_Hipblaslt_TN_9182,0.610143
GemmTunableOp_Half_TN,tn_10240_3400_8192,Gemm_Hipblaslt_TN_9182,1.01248
GemmTunableOp_Half_TN,tn_4096_924_14336,Gemm_Hipblaslt_TN_9634,0.23447
GemmTunableOp_Half_TN,tn_6144_879_4096,Gemm_Hipblaslt_TN_9357,0.0930988
GemmTunableOp_Half_TN,tn_6144_8049_4096,Gemm_Hipblaslt_TN_9914,0.671716
GemmTunableOp_Half_TN,tn_8192_3859_28672,Gemm_Rocblas_621294648,3.42492
GemmTunableOp_Half_TN,tn_8192_3369_8192,Gemm_Hipblaslt_TN_9697,0.758508
GemmTunableOp_Half_TN,tn_4096_847_14336,Gemm_Hipblaslt_TN_9580,0.219596
GemmTunableOp_Half_TN,tn_4096_3556_14336,Gemm_Hipblaslt_TN_9677,0.685246
GemmTunableOp_Half_TN,tn_4096_7809_4096,Gemm_Hipblaslt_TN_9853,0.440727
GemmTunableOp_Half_TN,tn_8192_1104_8192,Gemm_Hipblaslt_TN_9207,0.265249
GemmTunableOp_Half_TN,tn_28672_1794_4096,Gemm_Hipblaslt_TN_9684,0.789425
GemmTunableOp_Half_TN,tn_57344_3603_8192,Gemm_Hipblaslt_TN_9818,6.41219
GemmTunableOp_Half_TN,tn_4096_1724_4096,Gemm_Hipblaslt_TN_9671,0.109286
GemmTunableOp_Half_TN,tn_8192_3120_8192,Gemm_Hipblaslt_TN_9793,0.719106
GemmTunableOp_Half_TN,tn_4096_843_14336,Gemm_Hipblaslt_TN_9580,0.220222
GemmTunableOp_Half_TN,tn_10240_99_8192,Gemm_Rocblas_621294504,0.0590545
GemmTunableOp_Half_TN,tn_6144_872_4096,Gemm_Hipblaslt_TN_9613,0.0928007
GemmTunableOp_Half_TN,tn_28672_5606_4096,Gemm_Hipblaslt_TN_9827,2.337
GemmTunableOp_Half_TN,tn_8192_91_8192,Gemm_Hipblaslt_TN_9304,0.0475822
GemmTunableOp_Half_TN,tn_28672_1746_4096,Gemm_Hipblaslt_TN_9223,0.726378
GemmTunableOp_Half_TN,tn_57344_2479_8192,Default,4.35606
GemmTunableOp_Half_TN,tn_8192_4025_28672,Gemm_Rocblas_621286915,3.48148
GemmTunableOp_Half_TN,tn_10240_127_8192,Gemm_Rocblas_621294504,0.0618579
GemmTunableOp_Half_TN,tn_28672_890_4096,Gemm_Hipblaslt_TN_9683,0.389258
GemmTunableOp_Half_TN,tn_8192_4096_8192,Gemm_Rocblas_621286693,0.909237
GemmTunableOp_Half_TN,tn_10240_1367_8192,Gemm_Hipblaslt_TN_9237,0.403628
GemmTunableOp_Half_TN,tn_10240_116_8192,Gemm_Rocblas_621294504,0.0629109
GemmTunableOp_Half_TN,tn_4096_799_14336,Gemm_Hipblaslt_TN_9099,0.216464
GemmTunableOp_Half_TN,tn_4096_2750_14336,Gemm_Hipblaslt_TN_9799,0.565281
GemmTunableOp_Half_TN,tn_128256_123_4096,Gemm_Rocblas_621294385,0.412777
GemmTunableOp_Half_TN,tn_10240_133_8192,Gemm_Hipblaslt_TN_9367,0.0689764
GemmTunableOp_Half_TN,tn_32000_128_8192,Gemm_Rocblas_621294212,0.219448
GemmTunableOp_Half_TN,tn_10240_3283_8192,Gemm_Rocblas_621294435,0.89726
GemmTunableOp_Half_TN,tn_57344_17_8192,Gemm_Hipblaslt_TN_9429,0.246699
GemmTunableOp_Half_TN,tn_8192_2166_8192,Gemm_Hipblaslt_TN_9742,0.510811
GemmTunableOp_Half_TN,tn_10240_3153_8192,Gemm_Hipblaslt_TN_9753,0.892534
GemmTunableOp_Half_TN,tn_57344_2032_8192,Gemm_Hipblaslt_TN_154,3.56715
GemmTunableOp_Half_TN,tn_28672_2675_4096,Gemm_Hipblaslt_TN_9827,1.09805
GemmTunableOp_Half_TN,tn_8192_2728_8192,Gemm_Rocblas_621286580,0.657076
GemmTunableOp_Half_TN,tn_6144_930_4096,Gemm_Hipblaslt_TN_9253,0.0943046
GemmTunableOp_Half_TN,tn_57344_1286_8192,Gemm_Hipblaslt_TN_9827,2.39965
GemmTunableOp_Half_TN,tn_8192_3425_8192,Gemm_Hipblaslt_TN_9697,0.760825
GemmTunableOp_Half_TN,tn_8192_2866_8192,Gemm_Rocblas_621286684,0.67086
GemmTunableOp_Half_TN,tn_6144_7857_4096,Gemm_Rocblas_621286693,0.652269
GemmTunableOp_Half_TN,tn_10240_126_8192,Gemm_Rocblas_621286764,0.0633824
GemmTunableOp_Half_TN,tn_128256_154_4096,Gemm_Rocblas_621286565,0.460214
GemmTunableOp_Half_TN,tn_57344_4025_8192,Gemm_Rocblas_621286905,6.74865
GemmTunableOp_Half_TN,tn_28672_7798_4096,Gemm_Hipblaslt_TN_159,3.00046
GemmTunableOp_Half_TN,tn_6144_888_4096,Gemm_Hipblaslt_TN_9613,0.0930988
GemmTunableOp_Half_TN,tn_57344_1201_8192,Gemm_Hipblaslt_TN_9827,2.34331
GemmTunableOp_Half_TN,tn_28672_3430_4096,Gemm_Hipblaslt_TN_9841,1.3693
GemmTunableOp_Half_TN,tn_10240_2015_8192,Gemm_Hipblaslt_TN_9649,0.609055
GemmTunableOp_Half_TN,tn_57344_3651_8192,Gemm_Hipblaslt_TN_9937,6.44355
GemmTunableOp_Half_TN,tn_4096_2544_14336,Gemm_Hipblaslt_TN_9709,0.529218
GemmTunableOp_Half_TN,tn_28672_2698_4096,Gemm_Hipblaslt_TN_9787,1.17033
GemmTunableOp_Half_TN,tn_8192_135_8192,Gemm_Hipblaslt_TN_9306,0.0571462
GemmTunableOp_Half_TN,tn_8192_1217_8192,Gemm_Hipblaslt_TN_9691,0.297306
GemmTunableOp_Half_TN,tn_6144_896_4096,Gemm_Hipblaslt_TN_9613,0.0934409
GemmTunableOp_Half_TN,tn_4096_112_4096,Gemm_Rocblas_621294164,0.0172385
GemmTunableOp_Half_TN,tn_8192_1268_8192,Gemm_Hipblaslt_TN_9691,0.298594
GemmTunableOp_Half_TN,tn_6144_88_4096,Gemm_Rocblas_621294028,0.0196005
GemmTunableOp_Half_TN,tn_128256_84_4096,Gemm_Hipblaslt_TN_9057,0.36547
GemmTunableOp_Half_TN,tn_8192_3274_28672,Gemm_Hipblaslt_TN_9684,2.92417
GemmTunableOp_Half_TN,tn_10240_2551_8192,Gemm_Hipblaslt_TN_9798,0.745985
GemmTunableOp_Half_TN,tn_28672_1718_4096,Gemm_Hipblaslt_TN_9223,0.728337
GemmTunableOp_Half_TN,tn_4096_832_14336,Gemm_Hipblaslt_TN_9158,0.216765
GemmTunableOp_Half_TN,tn_6144_938_4096,Gemm_Hipblaslt_TN_9163,0.0948512
GemmTunableOp_Half_TN,tn_8192_3411_28672,Gemm_Hipblaslt_TN_9732,2.95892
GemmTunableOp_Half_TN,tn_57344_13_8192,Gemm_Hipblaslt_TN_9429,0.240903
GemmTunableOp_Half_TN,tn_8192_106_28672,Gemm_Hipblaslt_TN_8378,0.200997
GemmTunableOp_Half_TN,tn_8192_3626_8192,Gemm_Hipblaslt_TN_9677,0.804398
GemmTunableOp_Half_TN,tn_10240_95_8192,Gemm_Hipblaslt_TN_8095,0.0546446
GemmTunableOp_Half_TN,tn_10240_92_8192,Gemm_Hipblaslt_TN_8095,0.0546662
GemmTunableOp_Half_TN,tn_8192_13_28672,Gemm_Rocblas_621286325,0.118948
GemmTunableOp_Half_TN,tn_57344_24_8192,Gemm_Hipblaslt_TN_9429,0.25001
GemmTunableOp_Half_TN,tn_4096_908_4096,Gemm_Hipblaslt_TN_9604,0.0665731
GemmTunableOp_Half_TN,tn_4096_1739_14336,Gemm_Hipblaslt_TN_9645,0.39628
GemmTunableOp_Half_TN,tn_8192_3274_8192,Gemm_Hipblaslt_TN_9192,0.755586
GemmTunableOp_Half_TN,tn_128256_190_4096,Gemm_Hipblaslt_TN_9683,0.507595
GemmTunableOp_Half_TN,tn_6144_3447_4096,Gemm_Hipblaslt_TN_9570,0.309118
GemmTunableOp_Half_TN,tn_8192_130_28672,Gemm_Hipblaslt_TN_8662,0.223507
GemmTunableOp_Half_TN,tn_4096_1881_4096,Gemm_Hipblaslt_TN_9134,0.121949
GemmTunableOp_Half_TN,tn_4096_862_4096,Gemm_Hipblaslt_TN_9634,0.066366
GemmTunableOp_Half_TN,tn_8192_3642_28672,Gemm_Hipblaslt_TN_9732,3.07281
GemmTunableOp_Half_TN,tn_6144_3310_4096,Gemm_Rocblas_621294306,0.302243
GemmTunableOp_Half_TN,tn_128256_57_4096,Gemm_Hipblaslt_TN_9146,0.340073
GemmTunableOp_Half_TN,tn_57344_1233_8192,Gemm_Hipblaslt_TN_9068,2.35737
GemmTunableOp_Half_TN,tn_32000_9_8192,Gemm_Rocblas_621286319,0.140342
GemmTunableOp_Half_TN,tn_32000_101_8192,Gemm_Rocblas_621294212,0.208584
GemmTunableOp_Half_TN,tn_28672_1693_4096,Gemm_Rocblas_621286693,0.719411
GemmTunableOp_Half_TN,tn_57344_121_8192,Gemm_Hipblaslt_TN_9486,0.348514
GemmTunableOp_Half_TN,tn_28672_1775_4096,Gemm_Hipblaslt_TN_9191,0.729019
GemmTunableOp_Half_TN,tn_10240_3411_8192,Gemm_Hipblaslt_TN_9743,1.0135
GemmTunableOp_Half_TN,tn_4096_958_4096,Gemm_Hipblaslt_TN_9604,0.0690091
GemmTunableOp_Half_TN,tn_8192_2000_8192,Gemm_Hipblaslt_TN_9202,0.444294
GemmTunableOp_Half_TN,tn_8192_4063_8192,Gemm_Hipblaslt_TN_9753,0.908903
GemmTunableOp_Half_TN,tn_6144_1644_4096,Gemm_Rocblas_621286753,0.154769
GemmTunableOp_Half_TN,tn_4096_80_4096,Gemm_Rocblas_621286280,0.015377
GemmTunableOp_Half_TN,tn_4096_1759_14336,Gemm_Hipblaslt_TN_9645,0.397201
GemmTunableOp_Half_TN,tn_57344_106_8192,Gemm_Hipblaslt_TN_9486,0.338901
GemmTunableOp_Half_TN,tn_4096_96_14336,Gemm_Hipblaslt_TN_9294,0.0401447
GemmTunableOp_Half_TN,tn_8192_108_8192,Gemm_Hipblaslt_TN_8891,0.0508962
GemmTunableOp_Half_TN,tn_10240_14_8192,Gemm_Hipblaslt_TN_9411,0.0375005
GemmTunableOp_Half_TN,tn_28672_847_4096,Gemm_Hipblaslt_TN_9684,0.383505
GemmTunableOp_Half_TN,tn_8192_1276_8192,Gemm_Rocblas_621294425,0.304603
GemmTunableOp_Half_TN,tn_4096_2682_4096,Gemm_Hipblaslt_TN_9674,0.162337
GemmTunableOp_Half_TN,tn_6144_1886_4096,Gemm_Hipblaslt_TN_9691,0.167128
GemmTunableOp_Half_TN,tn_57344_2717_8192,Gemm_Hipblaslt_TN_9800,4.98939
GemmTunableOp_Half_TN,tn_10240_125_8192,Gemm_Hipblaslt_TN_7157,0.0631865
GemmTunableOp_Half_TN,tn_128256_135_4096,Gemm_Hipblaslt_TN_9808,0.446001
GemmTunableOp_Half_TN,tn_8192_1374_28672,Gemm_Hipblaslt_TN_9799,1.27436
GemmTunableOp_Half_TN,tn_57344_124_8192,Gemm_Rocblas_621286477,0.350501
GemmTunableOp_Half_TN,tn_6144_891_4096,Gemm_Hipblaslt_TN_9253,0.0923721
GemmTunableOp_Half_TN,tn_4096_832_4096,Gemm_Hipblaslt_TN_9158,0.0642925
GemmTunableOp_Half_TN,tn_8192_4000_28672,Gemm_Rocblas_621286915,3.48575
GemmTunableOp_Half_TN,tn_4096_1778_4096,Gemm_Hipblaslt_TN_9605,0.118133
GemmTunableOp_Half_TN,tn_10240_110_8192,Gemm_Rocblas_621286764,0.0611869
GemmTunableOp_Half_TN,tn_128256_39_4096,Gemm_Hipblaslt_TN_9451,0.306546
GemmTunableOp_Half_TN,tn_10240_1185_8192,Gemm_Hipblaslt_TN_9697,0.348836
GemmTunableOp_Half_TN,tn_4096_3711_4096,Gemm_Hipblaslt_TN_9827,0.212102
GemmTunableOp_Half_TN,tn_57344_129_8192,Gemm_Hipblaslt_TN_9507,0.375064
GemmTunableOp_Half_TN,tn_8192_2166_28672,Gemm_Hipblaslt_TN_9742,2.05837
GemmTunableOp_Half_TN,tn_128256_40_4096,Gemm_Hipblaslt_TN_9451,0.310669
GemmTunableOp_Half_TN,tn_10240_98_8192,Gemm_Rocblas_621294504,0.0590275
GemmTunableOp_Half_TN,tn_8192_10_28672,Gemm_Rocblas_621286325,0.120585
GemmTunableOp_Half_TN,tn_10240_111_8192,Gemm_Rocblas_621286764,0.0601142
GemmTunableOp_Half_TN,tn_4096_7937_4096,Gemm_Hipblaslt_TN_9753,0.441826
GemmTunableOp_Half_TN,tn_6144_1944_4096,Gemm_Hipblaslt_TN_9793,0.178108
GemmTunableOp_Half_TN,tn_128256_204_4096,Gemm_Hipblaslt_TN_9937,0.546408
GemmTunableOp_Half_TN,tn_128256_252_4096,Gemm_Rocblas_621286892,0.58613
GemmTunableOp_Half_TN,tn_4096_1727_4096,Gemm_Hipblaslt_TN_9671,0.108613
GemmTunableOp_Half_TN,tn_4096_790_4096,Gemm_Hipblaslt_TN_9634,0.0628111
GemmTunableOp_Half_TN,tn_6144_7436_4096,Gemm_Rocblas_621294420,0.639459
GemmTunableOp_Half_TN,tn_4096_968_4096,Gemm_Hipblaslt_TN_9576,0.0706689
GemmTunableOp_Half_TN,tn_28672_923_4096,Gemm_Hipblaslt_TN_9684,0.395608
GemmTunableOp_Half_TN,tn_6144_832_4096,Gemm_Rocblas_621294520,0.0888453
GemmTunableOp_Half_TN,tn_4096_2572_4096,Gemm_Hipblaslt_TN_9799,0.160712
GemmTunableOp_Half_TN,tn_6144_1739_4096,Gemm_Rocblas_621286683,0.160556
GemmTunableOp_Half_TN,tn_8192_1000_8192,Gemm_Hipblaslt_TN_9207,0.246362
GemmTunableOp_Half_TN,tn_6144_966_4096,Gemm_Hipblaslt_TN_9359,0.101137
GemmTunableOp_Half_TN,tn_57344_1319_8192,Gemm_Hipblaslt_TN_9841,2.41323
GemmTunableOp_Half_TN,tn_4096_2672_4096,Gemm_Hipblaslt_TN_9674,0.160879
GemmTunableOp_Half_TN,tn_4096_881_14336,Gemm_Hipblaslt_TN_9580,0.219378
GemmTunableOp_Half_TN,tn_6144_853_4096,Gemm_Hipblaslt_TN_9322,0.0904909
GemmTunableOp_Half_TN,tn_8192_3299_8192,Gemm_Hipblaslt_TN_9677,0.755096
GemmTunableOp_Half_TN,tn_8192_3251_8192,Gemm_Hipblaslt_TN_9697,0.742833
GemmTunableOp_Half_TN,tn_8192_106_8192,Gemm_Hipblaslt_TN_8891,0.0525039
GemmTunableOp_Half_TN,tn_128256_116_4096,Gemm_Rocblas_621294385,0.406323
GemmTunableOp_Half_TN,tn_8192_1264_8192,Gemm_Rocblas_621286684,0.30097
GemmTunableOp_Half_TN,tn_8192_1265_28672,Gemm_Rocblas_621294409,1.20427
GemmTunableOp_Half_TN,tn_4096_1700_14336,Gemm_Hipblaslt_TN_9266,0.369106
GemmTunableOp_Half_TN,tn_28672_896_4096,Gemm_Hipblaslt_TN_9192,0.38763
GemmTunableOp_Half_TN,tn_8192_1286_8192,Gemm_Hipblaslt_TN_9799,0.314376
GemmTunableOp_Half_TN,tn_28672_2653_4096,Gemm_Hipblaslt_TN_9827,1.08588
GemmTunableOp_Half_TN,tn_128256_98_4096,Gemm_Hipblaslt_TN_9061,0.395794
GemmTunableOp_Half_TN,tn_8192_2962_8192,Gemm_Rocblas_621286580,0.685963
GemmTunableOp_Half_TN,tn_8192_3651_8192,Gemm_Hipblaslt_TN_9753,0.825077
GemmTunableOp_Half_TN,tn_8192_104_8192,Gemm_Hipblaslt_TN_8891,0.049553
GemmTunableOp_Half_TN,tn_8192_2549_28672,Gemm_Hipblaslt_TN_9774,2.3767
GemmTunableOp_Half_TN,tn_57344_107_8192,Gemm_Hipblaslt_TN_9486,0.337831
GemmTunableOp_Half_TN,tn_6144_825_4096,Gemm_Rocblas_621286778,0.0889217
GemmTunableOp_Half_TN,tn_8192_5_8192,Gemm_Hipblaslt_TN_9392,0.030248
GemmTunableOp_Half_TN,tn_128256_180_4096,Gemm_Hipblaslt_TN_9940,0.508195
GemmTunableOp_Half_TN,tn_8192_3187_28672,Gemm_Hipblaslt_TN_9732,2.89007
GemmTunableOp_Half_TN,tn_8192_1329_8192,Gemm_Rocblas_621286683,0.316762
GemmTunableOp_Half_TN,tn_10240_2041_8192,Gemm_Rocblas_621286569,0.613696
GemmTunableOp_Half_TN,tn_6144_1743_4096,Gemm_Hipblaslt_TN_9799,0.158992
GemmTunableOp_Half_TN,tn_4096_1600_4096,Gemm_Hipblaslt_TN_9587,0.105922
GemmTunableOp_Half_TN,tn_10240_1160_8192,Gemm_Hipblaslt_TN_9697,0.346358
GemmTunableOp_Half_TN,tn_32000_107_8192,Gemm_Rocblas_621286475,0.213586
GemmTunableOp_Half_TN,tn_4096_875_4096,Gemm_Hipblaslt_TN_9547,0.0666844
GemmTunableOp_Half_TN,tn_4096_839_14336,Gemm_Hipblaslt_TN_9099,0.223089
GemmTunableOp_Half_TN,tn_4096_957_14336,Gemm_Hipblaslt_TN_9608,0.235973
GemmTunableOp_Half_TN,tn_8192_3754_8192,Gemm_Hipblaslt_TN_9753,0.831815
GemmTunableOp_Half_TN,tn_10240_1224_8192,Gemm_Hipblaslt_TN_9798,0.353746
GemmTunableOp_Half_TN,tn_4096_882_14336,Gemm_Hipblaslt_TN_9580,0.221637
GemmTunableOp_Half_TN,tn_8192_4035_8192,Gemm_Rocblas_621294435,0.899916
GemmTunableOp_Half_TN,tn_8192_4082_28672,Gemm_Rocblas_621294648,3.50252
GemmTunableOp_Half_TN,tn_4096_7863_4096,Gemm_Rocblas_621294127,0.44591
GemmTunableOp_Half_TN,tn_4096_1730_14336,Gemm_Hipblaslt_TN_9645,0.394554
GemmTunableOp_Half_TN,tn_57344_19_8192,Gemm_Hipblaslt_TN_9429,0.243715
GemmTunableOp_Half_TN,tn_57344_1280_8192,Gemm_Hipblaslt_TN_9830,2.34741
GemmTunableOp_Half_TN,tn_57344_4082_8192,Gemm_Hipblaslt_TN_9882,6.67013
GemmTunableOp_Half_TN,tn_10240_3000_8192,Gemm_Hipblaslt_TN_9753,0.851795
GemmTunableOp_Half_TN,tn_8192_1350_28672,Gemm_Hipblaslt_TN_9799,1.27183
GemmTunableOp_Half_TN,tn_4096_144_4096,Gemm_Hipblaslt_TN_9474,0.0218436
GemmTunableOp_Half_TN,tn_4096_2762_4096,Gemm_Hipblaslt_TN_9799,0.165956
GemmTunableOp_Half_TN,tn_128256_245_4096,Gemm_Rocblas_621286892,0.583064
GemmTunableOp_Half_TN,tn_10240_3546_8192,Gemm_Hipblaslt_TN_9744,1.04088
GemmTunableOp_Half_TN,tn_4096_868_4096,Gemm_Hipblaslt_TN_9170,0.0664201
GemmTunableOp_Half_TN,tn_128256_29_4096,Gemm_Hipblaslt_TN_9451,0.299019
GemmTunableOp_Half_TN,tn_8192_3203_8192,Gemm_Hipblaslt_TN_9677,0.727082
GemmTunableOp_Half_TN,tn_6144_861_4096,Gemm_Rocblas_621286778,0.0901004
GemmTunableOp_Half_TN,tn_57344_128_8192,Default,0.347744
GemmTunableOp_Half_TN,tn_6144_8070_4096,Gemm_Rocblas_621286693,0.671521
GemmTunableOp_Half_TN,tn_4096_1614_14336,Gemm_Hipblaslt_TN_9671,0.361974
GemmTunableOp_Half_TN,tn_128256_15_4096,Gemm_Rocblas_621294224,0.281141
GemmTunableOp_Half_TN,tn_10240_115_8192,Gemm_Rocblas_621294504,0.0608778
GemmTunableOp_Half_TN,tn_57344_126_8192,Gemm_Rocblas_621294214,0.348787
GemmTunableOp_Half_TN,tn_57344_1377_8192,Gemm_Hipblaslt_TN_9832,2.60703
GemmTunableOp_Half_TN,tn_128256_199_4096,Gemm_Hipblaslt_TN_9738,0.538255
GemmTunableOp_Half_TN,tn_4096_1762_14336,Gemm_Hipblaslt_TN_9645,0.398881
GemmTunableOp_Half_TN,tn_28672_8110_4096,Gemm_Hipblaslt_TN_159,3.1994
GemmTunableOp_Half_TN,tn_32000_11_8192,Gemm_Rocblas_621286319,0.140979
GemmTunableOp_Half_TN,tn_8192_104_28672,Gemm_Hipblaslt_TN_8378,0.200097
GemmTunableOp_Half_TN,tn_4096_821_14336,Gemm_Hipblaslt_TN_9158,0.212648
GemmTunableOp_Half_TN,tn_8192_1008_28672,Gemm_Hipblaslt_TN_9665,1.0432
GemmTunableOp_Half_TN,tn_6144_2732_4096,Gemm_Hipblaslt_TN_9763,0.256872
GemmTunableOp_Half_TN,tn_4096_829_4096,Gemm_Hipblaslt_TN_9158,0.0621209
GemmTunableOp_Half_TN,tn_8192_1112_8192,Gemm_Hipblaslt_TN_9207,0.265752
GemmTunableOp_Half_TN,tn_57344_3619_8192,Gemm_Hipblaslt_TN_9752,6.44345
GemmTunableOp_Half_TN,tn_28672_812_4096,Gemm_Hipblaslt_TN_9683,0.380979
GemmTunableOp_Half_TN,tn_32000_131_8192,Gemm_Hipblaslt_TN_9506,0.242333
GemmTunableOp_Half_TN,tn_8192_18_28672,Gemm_Rocblas_621286354,0.12815
GemmTunableOp_Half_TN,tn_6144_977_4096,Gemm_Hipblaslt_TN_9633,0.0999718
GemmTunableOp_Half_TN,tn_8192_2717_28672,Gemm_Rocblas_621294319,2.53005
GemmTunableOp_Half_TN,tn_6144_985_4096,Gemm_Hipblaslt_TN_9587,0.100179
GemmTunableOp_Half_TN,tn_8192_98_28672,Gemm_Hipblaslt_TN_8378,0.198261
GemmTunableOp_Half_TN,tn_57344_91_8192,Gemm_Rocblas_621286477,0.328951
GemmTunableOp_Half_TN,tn_57344_16_8192,Gemm_Hipblaslt_TN_9429,0.244028
GemmTunableOp_Half_TN,tn_10240_109_8192,Gemm_Rocblas_621294504,0.0608822
GemmTunableOp_Half_TN,tn_57344_99_8192,Gemm_Hipblaslt_TN_9486,0.332195
GemmTunableOp_Half_TN,tn_10240_9_8192,Gemm_Hipblaslt_TN_9411,0.0372845
GemmTunableOp_Half_TN,tn_8192_125_28672,Gemm_Hipblaslt_TN_8378,0.208257
GemmTunableOp_Half_TN,tn_128256_236_4096,Gemm_Rocblas_621294634,0.578131
GemmTunableOp_Half_TN,tn_8192_1201_8192,Gemm_Hipblaslt_TN_9691,0.295707
GemmTunableOp_Half_TN,tn_4096_192_14336,Gemm_Hipblaslt_TN_7585,0.0616543
GemmTunableOp_Half_TN,tn_4096_1913_4096,Gemm_Hipblaslt_TN_9645,0.123241
GemmTunableOp_Half_TN,tn_4096_2722_4096,Gemm_Hipblaslt_TN_9690,0.165926
GemmTunableOp_Half_TN,tn_4096_1880_14336,Gemm_Hipblaslt_TN_9645,0.413643
GemmTunableOp_Half_TN,tn_128256_188_4096,Gemm_Hipblaslt_TN_9940,0.507647
GemmTunableOp_Half_TN,tn_28672_1815_4096,Gemm_Hipblaslt_TN_9684,0.790541
GemmTunableOp_Half_TN,tn_8192_4091_28672,Gemm_Rocblas_621286905,3.48808
GemmTunableOp_Half_TN,tn_128256_50_4096,Gemm_Rocblas_621286816,0.334045
GemmTunableOp_Half_TN,tn_32000_94_8192,Gemm_Hipblaslt_TN_9354,0.203378
GemmTunableOp_Half_TN,tn_32000_122_8192,Gemm_Hipblaslt_TN_9640,0.221675
GemmTunableOp_Half_TN,tn_4096_1829_4096,Gemm_Hipblaslt_TN_9134,0.121967
GemmTunableOp_Half_TN,tn_8192_3451_8192,Gemm_Hipblaslt_TN_9697,0.768776
GemmTunableOp_Half_TN,tn_8192_117_28672,Gemm_Hipblaslt_TN_8378,0.203512
GemmTunableOp_Half_TN,tn_8192_2802_28672,Gemm_Rocblas_621286568,2.56391
GemmTunableOp_Half_TN,tn_8192_117_8192,Gemm_Hipblaslt_TN_8891,0.0513202
GemmTunableOp_Half_TN,tn_128256_86_4096,Gemm_Hipblaslt_TN_9057,0.366829
GemmTunableOp_Half_TN,tn_28672_892_4096,Gemm_Hipblaslt_TN_9683,0.38955
GemmTunableOp_Half_TN,tn_10240_1271_8192,Gemm_Hipblaslt_TN_9697,0.357802
GemmTunableOp_Half_TN,tn_4096_8_4096,Gemm_Rocblas_621294136,0.0100526
GemmTunableOp_Half_TN,tn_4096_1763_4096,Gemm_Hipblaslt_TN_9590,0.11746
GemmTunableOp_Half_TN,tn_4096_1755_14336,Gemm_Hipblaslt_TN_9645,0.396046
GemmTunableOp_Half_TN,tn_10240_2728_8192,Gemm_Hipblaslt_TN_9697,0.779565
GemmTunableOp_Half_TN,tn_6144_1759_4096,Gemm_Hipblaslt_TN_9672,0.159358
GemmTunableOp_Half_TN,tn_8192_120_28672,Gemm_Hipblaslt_TN_8378,0.205545
GemmTunableOp_Half_TN,tn_4096_2509_4096,Gemm_Hipblaslt_TN_9799,0.156765
GemmTunableOp_Half_TN,tn_57344_1313_8192,Gemm_Hipblaslt_TN_9841,2.38667
GemmTunableOp_Half_TN,tn_10240_114_8192,Gemm_Hipblaslt_TN_8892,0.0611504
GemmTunableOp_Half_TN,tn_8192_3603_28672,Gemm_Hipblaslt_TN_9732,3.06442
GemmTunableOp_Half_TN,tn_57344_3203_8192,Gemm_Hipblaslt_TN_9803,5.63579
GemmTunableOp_Half_TN,tn_6144_2786_4096,Gemm_Hipblaslt_TN_9742,0.258182
GemmTunableOp_Half_TN,tn_4096_876_4096,Gemm_Hipblaslt_TN_9547,0.066719
GemmTunableOp_Half_TN,tn_28672_903_4096,Gemm_Hipblaslt_TN_9684,0.392141
GemmTunableOp_Half_TN,tn_4096_880_4096,Gemm_Hipblaslt_TN_9604,0.0673599
GemmTunableOp_Half_TN,tn_4096_2721_14336,Gemm_Hipblaslt_TN_9799,0.561127
GemmTunableOp_Half_TN,tn_6144_1742_4096,Gemm_Hipblaslt_TN_9672,0.159293
GemmTunableOp_Half_TN,tn_4096_1792_14336,Gemm_Hipblaslt_TN_9134,0.399409
GemmTunableOp_Half_TN,tn_6144_1864_4096,Gemm_Hipblaslt_TN_9691,0.165378
GemmTunableOp_Half_TN,tn_4096_885_4096,Gemm_Hipblaslt_TN_9634,0.0668095
GemmTunableOp_Half_TN,tn_28672_937_4096,Gemm_Hipblaslt_TN_9684,0.395219
GemmTunableOp_Half_TN,tn_6144_1693_4096,Gemm_Hipblaslt_TN_9570,0.1514
GemmTunableOp_Half_TN,tn_10240_1389_8192,Gemm_Hipblaslt_TN_9217,0.406336
GemmTunableOp_Half_TN,tn_28672_1733_4096,Gemm_Rocblas_621286590,0.729253
GemmTunableOp_Half_TN,tn_4096_838_4096,Gemm_Hipblaslt_TN_9604,0.0653334
GemmTunableOp_Half_TN,tn_4096_929_14336,Gemm_Hipblaslt_TN_9604,0.233865
GemmTunableOp_Half_TN,tn_4096_128_14336,Gemm_Hipblaslt_TN_7160,0.0479581
GemmTunableOp_Half_TN,tn_8192_1000_28672,Gemm_Hipblaslt_TN_9665,1.03984
GemmTunableOp_Half_TN,tn_4096_871_4096,Gemm_Hipblaslt_TN_9634,0.066646
GemmTunableOp_Half_TN,tn_4096_7823_14336,Gemm_Hipblaslt_TN_9753,1.57732
GemmTunableOp_Half_TN,tn_4096_884_4096,Gemm_Hipblaslt_TN_9634,0.0671644
GemmTunableOp_Half_TN,tn_28672_932_4096,Gemm_Hipblaslt_TN_9677,0.393077
GemmTunableOp_Half_TN,tn_6144_1931_4096,Gemm_Hipblaslt_TN_9793,0.17656
GemmTunableOp_Half_TN,tn_28672_64_4096,Gemm_Rocblas_621294374,0.0490311
GemmTunableOp_Half_TN,tn_4096_7944_4096,Gemm_Rocblas_621286713,0.444368
GemmTunableOp_Half_TN,tn_6144_949_4096,Gemm_Hipblaslt_TN_9613,0.0948149
GemmTunableOp_Half_TN,tn_28672_807_4096,Gemm_Hipblaslt_TN_9684,0.377288
GemmTunableOp_Half_TN,tn_4096_3310_4096,Gemm_Hipblaslt_TN_9743,0.19379
GemmTunableOp_Half_TN,tn_8192_4063_28672,Gemm_Rocblas_621286894,3.50426
GemmTunableOp_Half_TN,tn_6144_1715_4096,Gemm_Hipblaslt_TN_9570,0.153498
GemmTunableOp_Half_TN,tn_32000_7_8192,Gemm_Rocblas_621286321,0.139607
GemmTunableOp_Half_TN,tn_28672_1756_4096,Gemm_Rocblas_621294330,0.73254
GemmTunableOp_Half_TN,tn_4096_914_4096,Gemm_Hipblaslt_TN_9576,0.0693268
GemmTunableOp_Half_TN,tn_8192_2859_8192,Gemm_Rocblas_621286684,0.67015
GemmTunableOp_Half_TN,tn_6144_904_4096,Gemm_Hipblaslt_TN_9613,0.0935514
GemmTunableOp_Half_TN,tn_28672_842_4096,Gemm_Hipblaslt_TN_9684,0.38249
GemmTunableOp_Half_TN,tn_28672_862_4096,Gemm_Hipblaslt_TN_9683,0.384212
GemmTunableOp_Half_TN,tn_4096_840_4096,Gemm_Hipblaslt_TN_9604,0.0652624
GemmTunableOp_Half_TN,tn_4096_8049_14336,Gemm_Hipblaslt_TN_9753,1.60164
GemmTunableOp_Half_TN,tn_10240_19_8192,Gemm_Hipblaslt_TN_9415,0.0390454
GemmTunableOp_Half_TN,tn_4096_2793_14336,Gemm_Hipblaslt_TN_9799,0.567302
GemmTunableOp_Half_TN,tn_4096_8000_4096,Gemm_Hipblaslt_TN_9768,0.446432
GemmTunableOp_Half_TN,tn_4096_984_4096,Gemm_Hipblaslt_TN_9576,0.0718499
GemmTunableOp_Half_TN,tn_8192_3555_28672,Gemm_Hipblaslt_TN_9732,3.04298
GemmTunableOp_Half_TN,tn_6144_1733_4096,Gemm_Hipblaslt_TN_9799,0.15976
GemmTunableOp_Half_TN,tn_28672_871_4096,Gemm_Hipblaslt_TN_9684,0.385833
GemmTunableOp_Half_TN,tn_4096_817_14336,Gemm_Hipblaslt_TN_9147,0.217897
GemmTunableOp_Half_TN,tn_28672_957_4096,Gemm_Hipblaslt_TN_9683,0.397826
GemmTunableOp_Half_TN,tn_6144_926_4096,Gemm_Hipblaslt_TN_9613,0.0943594
GemmTunableOp_Half_TN,tn_4096_7436_14336,Gemm_Hipblaslt_TN_9749,1.52228
GemmTunableOp_Half_TN,tn_28672_1777_4096,Gemm_Hipblaslt_TN_9190,0.737034
GemmTunableOp_Half_TN,tn_8192_3347_28672,Gemm_Rocblas_621294329,2.97737
GemmTunableOp_Half_TN,tn_4096_823_4096,Gemm_Hipblaslt_TN_9158,0.0619334
GemmTunableOp_Half_TN,tn_4096_3569_4096,Gemm_Hipblaslt_TN_9697,0.203913
GemmTunableOp_Half_TN,tn_28672_1813_4096,Gemm_Hipblaslt_TN_9684,0.78459
GemmTunableOp_Half_TN,tn_4096_1726_4096,Gemm_Hipblaslt_TN_9607,0.108873
GemmTunableOp_Half_TN,tn_8192_3482_28672,Gemm_Rocblas_621294329,3.03929
GemmTunableOp_Half_TN,tn_4096_825_14336,Gemm_Hipblaslt_TN_7357,0.217922
GemmTunableOp_Half_TN,tn_6144_807_4096,Gemm_Rocblas_621286778,0.087976
GemmTunableOp_Half_TN,tn_4096_1834_4096,Gemm_Hipblaslt_TN_9645,0.120725
GemmTunableOp_Half_TN,tn_28672_2537_4096,Gemm_Hipblaslt_TN_9846,1.04188
GemmTunableOp_Half_TN,tn_4096_1778_14336,Gemm_Hipblaslt_TN_9645,0.399458
GemmTunableOp_Half_TN,tn_4096_876_14336,Gemm_Hipblaslt_TN_9580,0.220805
GemmTunableOp_Half_TN,tn_8192_1185_28672,Gemm_Hipblaslt_TN_9774,1.17417
GemmTunableOp_Half_TN,tn_4096_889_14336,Gemm_Hipblaslt_TN_9580,0.221611
GemmTunableOp_Half_TN,tn_4096_1743_4096,Gemm_Hipblaslt_TN_9590,0.117085
GemmTunableOp_Half_TN,tn_128256_219_4096,Gemm_Hipblaslt_TN_9937,0.552276
GemmTunableOp_Half_TN,tn_4096_958_14336,Gemm_Hipblaslt_TN_9604,0.237548
GemmTunableOp_Half_TN,tn_10240_3379_8192,Gemm_Hipblaslt_TN_9674,1.0057
GemmTunableOp_Half_TN,tn_4096_2590_4096,Gemm_Hipblaslt_TN_9657,0.161143
GemmTunableOp_Half_TN,tn_8192_118_28672,Gemm_Hipblaslt_TN_8378,0.205698
GemmTunableOp_Half_TN,tn_4096_843_4096,Gemm_Hipblaslt_TN_9634,0.0658977
GemmTunableOp_Half_TN,tn_28672_861_4096,Gemm_Hipblaslt_TN_9683,0.383504
GemmTunableOp_Half_TN,tn_128256_112_4096,Gemm_Rocblas_621294385,0.399793
GemmTunableOp_Half_TN,tn_6144_8110_4096,Gemm_Rocblas_621286693,0.675647
GemmTunableOp_Half_TN,tn_28672_1792_4096,Gemm_Rocblas_621294484,0.736745
GemmTunableOp_Half_TN,tn_28672_2681_4096,Gemm_Hipblaslt_TN_9827,1.09857
GemmTunableOp_Half_TN,tn_6144_959_4096,Gemm_Hipblaslt_TN_9133,0.0956137
GemmTunableOp_Half_TN,tn_28672_954_4096,Gemm_Hipblaslt_TN_9683,0.397801
GemmTunableOp_Half_TN,tn_4096_923_4096,Gemm_Hipblaslt_TN_9634,0.069
GemmTunableOp_Half_TN,tn_4096_1794_14336,Gemm_Hipblaslt_TN_9137,0.406648
GemmTunableOp_Half_TN,tn_28672_935_4096,Gemm_Hipblaslt_TN_9683,0.396915
GemmTunableOp_Half_TN,tn_57344_1249_8192,Default,2.36635
GemmTunableOp_Half_TN,tn_28672_848_4096,Gemm_Hipblaslt_TN_9683,0.383819
GemmTunableOp_Half_TN,tn_4096_857_4096,Gemm_Hipblaslt_TN_9160,0.0664135
GemmTunableOp_Half_TN,tn_4096_872_4096,Gemm_Hipblaslt_TN_9634,0.067168
GemmTunableOp_Half_TN,tn_6144_8007_4096,Gemm_Hipblaslt_TN_9914,0.66986
GemmTunableOp_Half_TN,tn_128256_76_4096,Gemm_Hipblaslt_TN_9058,0.361387
GemmTunableOp_Half_TN,tn_4096_2635_14336,Gemm_Hipblaslt_TN_9799,0.545184
GemmTunableOp_Half_TN,tn_6144_831_4096,Gemm_Hipblaslt_TN_9322,0.0887902
GemmTunableOp_Half_TN,tn_4096_919_14336,Gemm_Hipblaslt_TN_9634,0.232581
GemmTunableOp_Half_TN,tn_6144_866_4096,Gemm_Hipblaslt_TN_9613,0.0923998
GemmTunableOp_Half_TN,tn_4096_796_4096,Gemm_Hipblaslt_TN_9634,0.0646068
GemmTunableOp_Half_TN,tn_4096_815_14336,Gemm_Hipblaslt_TN_9147,0.216383
GemmTunableOp_Half_TN,tn_128256_250_4096,Gemm_Rocblas_621286892,0.585965
GemmTunableOp_Half_TN,tn_28672_8049_4096,Gemm_Hipblaslt_TN_159,3.13356
GemmTunableOp_Half_TN,tn_4096_3599_4096,Gemm_Hipblaslt_TN_9743,0.204269
GemmTunableOp_Half_TN,tn_8192_2274_28672,Gemm_Hipblaslt_TN_9774,2.25649
GemmTunableOp_Half_TN,tn_6144_844_4096,Gemm_Rocblas_621286778,0.0890127
GemmTunableOp_Half_TN,tn_128256_203_4096,Gemm_Hipblaslt_TN_9654,0.546306
GemmTunableOp_Half_TN,tn_6144_969_4096,Gemm_Hipblaslt_TN_9633,0.101136
GemmTunableOp_Half_TN,tn_28672_24_4096,Gemm_Rocblas_621294191,0.0459339
GemmTunableOp_Half_TN,tn_4096_5606_4096,Gemm_Hipblaslt_TN_9689,0.336951
GemmTunableOp_Half_TN,tn_4096_2717_4096,Gemm_Hipblaslt_TN_9674,0.162671
GemmTunableOp_Half_TN,tn_128256_127_4096,Gemm_Rocblas_621294385,0.411753
GemmTunableOp_Half_TN,tn_6144_1748_4096,Gemm_Hipblaslt_TN_9799,0.159343
GemmTunableOp_Half_TN,tn_6144_8_4096,Gemm_Rocblas_621286311,0.0129774
GemmTunableOp_Half_TN,tn_4096_866_14336,Gemm_Hipblaslt_TN_9580,0.218878
GemmTunableOp_Half_TN,tn_128256_65_4096,Gemm_Hipblaslt_TN_9057,0.350468
GemmTunableOp_Half_TN,tn_4096_848_14336,Gemm_Hipblaslt_TN_9099,0.221421
GemmTunableOp_Half_TN,tn_4096_3752_14336,Gemm_Rocblas_621294030,0.724254
GemmTunableOp_Half_TN,tn_28672_3711_4096,Gemm_Hipblaslt_TN_9827,1.51261
GemmTunableOp_Half_TN,tn_128256_139_4096,Gemm_Hipblaslt_TN_9108,0.449355
GemmTunableOp_Half_TN,tn_4096_1729_4096,Gemm_Hipblaslt_TN_9645,0.116621
GemmTunableOp_Half_TN,tn_128256_5_4096,Gemm_Rocblas_621294224,0.272493
GemmTunableOp_Half_TN,tn_4096_819_14336,Gemm_Hipblaslt_TN_9147,0.214103
GemmTunableOp_Half_TN,tn_4096_1831_4096,Gemm_Hipblaslt_TN_9645,0.120848
GemmTunableOp_Half_TN,tn_6144_934_4096,Gemm_Hipblaslt_TN_9613,0.0944263
GemmTunableOp_Half_TN,tn_4096_2762_14336,Gemm_Hipblaslt_TN_9799,0.566517
GemmTunableOp_Half_TN,tn_10240_7_8192,Gemm_Hipblaslt_TN_9411,0.0369468
GemmTunableOp_Half_TN,tn_6144_937_4096,Gemm_Hipblaslt_TN_9613,0.0950853
GemmTunableOp_Half_TN,tn_8192_97_28672,Gemm_Hipblaslt_TN_8378,0.196486
GemmTunableOp_Half_TN,tn_4096_64_4096,Gemm_Rocblas_621286426,0.01314
GemmTunableOp_Half_TN,tn_4096_1803_4096,Gemm_Hipblaslt_TN_9620,0.122657
GemmTunableOp_Half_TN,tn_4096_3565_4096,Gemm_Hipblaslt_TN_9743,0.200449
GemmTunableOp_Half_TN,tn_28672_1913_4096,Gemm_Hipblaslt_TN_9683,0.802118
GemmTunableOp_Half_TN,tn_128256_172_4096,Gemm_Hipblaslt_TN_9952,0.498203
GemmTunableOp_Half_TN,tn_6144_1744_4096,Gemm_Hipblaslt_TN_9799,0.159538
GemmTunableOp_Half_TN,tn_28672_916_4096,Gemm_Hipblaslt_TN_9684,0.392283
GemmTunableOp_Half_TN,tn_32000_103_8192,Gemm_Rocblas_621286475,0.211495
GemmTunableOp_Half_TN,tn_28672_2571_4096,Gemm_Hipblaslt_TN_9827,1.06571
GemmTunableOp_Half_TN,tn_28672_868_4096,Gemm_Hipblaslt_TN_9684,0.385526
GemmTunableOp_Half_TN,tn_4096_821_4096,Gemm_Hipblaslt_TN_9604,0.0655013
GemmTunableOp_Half_TN,tn_6144_1649_4096,Gemm_Hipblaslt_TN_9570,0.151547
GemmTunableOp_Half_TN,tn_6144_4242_4096,Gemm_Rocblas_621286747,0.369679
GemmTunableOp_Half_TN,tn_6144_248_4096,Gemm_Rocblas_621294206,0.0373382
GemmTunableOp_Half_TN,tn_6144_7266_4096,Gemm_Rocblas_621286701,0.604668
GemmTunableOp_Half_TN,tn_28672_88_4096,Gemm_Rocblas_621286719,0.0587029
GemmTunableOp_Half_TN,tn_4096_1705_14336,Gemm_Hipblaslt_TN_9164,0.367152
GemmTunableOp_Half_TN,tn_6144_72_4096,Gemm_Rocblas_621286280,0.0183414
GemmTunableOp_Half_TN,tn_10240_1248_8192,Gemm_Hipblaslt_TN_9697,0.35573
GemmTunableOp_Half_TN,tn_4096_2651_14336,Gemm_Hipblaslt_TN_9657,0.546701
GemmTunableOp_Half_TN,tn_6144_64_4096,Gemm_Rocblas_621294029,0.0161117
GemmTunableOp_Half_TN,tn_4096_3310_14336,Gemm_Hipblaslt_TN_9697,0.662131
GemmTunableOp_Half_TN,tn_4096_7823_4096,Gemm_Hipblaslt_TN_9933,0.440188
GemmTunableOp_Half_TN,tn_6144_1803_4096,Gemm_Hipblaslt_TN_9672,0.162671
GemmTunableOp_Half_TN,tn_6144_136_4096,Gemm_Rocblas_621294168,0.027141
GemmTunableOp_Half_TN,tn_4096_1715_4096,Gemm_Hipblaslt_TN_9607,0.106984
GemmTunableOp_Half_TN,tn_4096_7804_4096,Gemm_Hipblaslt_TN_9853,0.441806
GemmTunableOp_Half_TN,tn_28672_3447_4096,Gemm_Hipblaslt_TN_9827,1.36584
GemmTunableOp_Half_TN,tn_4096_930_4096,Gemm_Hipblaslt_TN_9170,0.0690663
GemmTunableOp_Half_TN,tn_4096_2592_14336,Gemm_Hipblaslt_TN_9799,0.539205
GemmTunableOp_Half_TN,tn_28672_1673_4096,Gemm_Hipblaslt_TN_9184,0.720063
GemmTunableOp_Half_TN,tn_8192_3498_8192,Gemm_Hipblaslt_TN_9697,0.785898
GemmTunableOp_Half_TN,tn_10240_2914_8192,Gemm_Hipblaslt_TN_9753,0.838289
GemmTunableOp_Half_TN,tn_6144_1841_4096,Gemm_Hipblaslt_TN_9690,0.167365
GemmTunableOp_Half_TN,tn_6144_2670_4096,Gemm_Hipblaslt_TN_9184,0.223182
GemmTunableOp_Half_TN,tn_128256_33_4096,Gemm_Hipblaslt_TN_9451,0.299866
GemmTunableOp_Half_TN,tn_4096_892_4096,Gemm_Hipblaslt_TN_9547,0.0672745
GemmTunableOp_Half_TN,tn_4096_1837_4096,Gemm_Hipblaslt_TN_9645,0.121472
GemmTunableOp_Half_TN,tn_28672_879_4096,Gemm_Hipblaslt_TN_9192,0.385167
GemmTunableOp_Half_TN,tn_6144_1673_4096,Gemm_Hipblaslt_TN_9570,0.150338
GemmTunableOp_Half_TN,tn_128256_94_4096,Gemm_Hipblaslt_TN_9057,0.375021
GemmTunableOp_Half_TN,tn_6144_200_4096,Gemm_Hipblaslt_TN_9494,0.0329975
GemmTunableOp_Half_TN,tn_128256_215_4096,Gemm_Hipblaslt_TN_9898,0.549745
GemmTunableOp_Half_TN,tn_10240_2692_8192,Gemm_Hipblaslt_TN_9743,0.773687
GemmTunableOp_Half_TN,tn_6144_2764_4096,Gemm_Hipblaslt_TN_9742,0.25684
GemmTunableOp_Half_TN,tn_4096_988_4096,Gemm_Hipblaslt_TN_9604,0.0728681
GemmTunableOp_Half_TN,tn_4096_8192_14336,Gemm_Hipblaslt_TN_9813,1.63836
GemmTunableOp_Half_TN,tn_128256_221_4096,Gemm_Hipblaslt_TN_9654,0.558347
GemmTunableOp_Half_TN,tn_28672_884_4096,Gemm_Hipblaslt_TN_9683,0.386398
GemmTunableOp_Half_TN,tn_6144_978_4096,Gemm_Hipblaslt_TN_9587,0.10106
GemmTunableOp_Half_TN,tn_128256_143_4096,Gemm_Hipblaslt_TN_9775,0.4507
GemmTunableOp_Half_TN,tn_128256_178_4096,Gemm_Hipblaslt_TN_9952,0.501326
GemmTunableOp_Half_TN,tn_28672_8070_4096,Gemm_Hipblaslt_TN_159,3.20107
GemmTunableOp_Half_TN,tn_6144_835_4096,Gemm_Rocblas_621286778,0.0885323
GemmTunableOp_Half_TN,tn_4096_935_4096,Gemm_Hipblaslt_TN_9634,0.0683107
GemmTunableOp_Half_TN,tn_28672_8_4096,Gemm_Rocblas_621294053,0.0443455
GemmTunableOp_Half_TN,tn_8192_124_28672,Gemm_Hipblaslt_TN_8378,0.208594
GemmTunableOp_Half_TN,tn_4096_3670_4096,Gemm_Hipblaslt_TN_9827,0.211631
GemmTunableOp_Half_TN,tn_4096_927_14336,Gemm_Hipblaslt_TN_9608,0.235709
GemmTunableOp_Half_TN,tn_28672_4483_4096,Gemm_Hipblaslt_TN_9840,1.82935
GemmTunableOp_Half_TN,tn_4096_1777_4096,Gemm_Hipblaslt_TN_9590,0.117089
GemmTunableOp_Half_TN,tn_6144_7283_4096,Gemm_Hipblaslt_TN_9697,0.610148
GemmTunableOp_Half_TN,tn_4096_889_4096,Gemm_Hipblaslt_TN_9634,0.0687223
GemmTunableOp_Half_TN,tn_6144_152_4096,Gemm_Rocblas_621294171,0.0271718
GemmTunableOp_Half_TN,tn_128256_234_4096,Gemm_Rocblas_621286892,0.574601
GemmTunableOp_Half_TN,tn_6144_2734_4096,Gemm_Hipblaslt_TN_9742,0.257018
GemmTunableOp_Half_TN,tn_6144_845_4096,Gemm_Hipblaslt_TN_9322,0.0905814
GemmTunableOp_Half_TN,tn_28672_808_4096,Gemm_Hipblaslt_TN_9684,0.381926
GemmTunableOp_Half_TN,tn_4096_917_14336,Gemm_Hipblaslt_TN_9604,0.233767
GemmTunableOp_Half_TN,tn_128256_64_4096,Gemm_Rocblas_621286813,0.335964
GemmTunableOp_Half_TN,tn_6144_990_4096,Gemm_Hipblaslt_TN_9633,0.100921
GemmTunableOp_Half_TN,tn_4096_954_4096,Gemm_Hipblaslt_TN_9634,0.0683161
GemmTunableOp_Half_TN,tn_6144_2648_4096,Gemm_Hipblaslt_TN_9190,0.220499
GemmTunableOp_Half_TN,tn_8192_3425_28672,Gemm_Rocblas_621294329,3.00614
GemmTunableOp_Half_TN,tn_32000_126_8192,Gemm_Rocblas_621286475,0.220011
GemmTunableOp_Half_TN,tn_4096_184_4096,Gemm_Rocblas_621286491,0.0236714
GemmTunableOp_Half_TN,tn_28672_1795_4096,Gemm_Hipblaslt_TN_9684,0.782875
GemmTunableOp_Half_TN,tn_32000_105_8192,Gemm_Rocblas_621286475,0.212155
GemmTunableOp_Half_TN,tn_6144_804_4096,Gemm_Rocblas_621294520,0.0879508
GemmTunableOp_Half_TN,tn_8192_3379_8192,Gemm_Hipblaslt_TN_9697,0.769411
GemmTunableOp_Half_TN,tn_4096_804_4096,Gemm_Hipblaslt_TN_9604,0.0642565
GemmTunableOp_Half_TN,tn_4096_900_4096,Gemm_Hipblaslt_TN_9634,0.0670889
GemmTunableOp_Half_TN,tn_8192_96_8192,Gemm_Hipblaslt_TN_8197,0.0471253
GemmTunableOp_Half_TN,tn_4096_2788_14336,Gemm_Rocblas_621294447,0.572139
GemmTunableOp_Half_TN,tn_28672_863_4096,Gemm_Hipblaslt_TN_9683,0.383636
GemmTunableOp_Half_TN,tn_4096_834_14336,Gemm_Hipblaslt_TN_9099,0.222576
GemmTunableOp_Half_TN,tn_8192_2032_28672,Gemm_Hipblaslt_TN_9840,1.77435
GemmTunableOp_Half_TN,tn_128256_213_4096,Gemm_Hipblaslt_TN_9654,0.551309
GemmTunableOp_Half_TN,tn_28672_168_4096,Gemm_Hipblaslt_TN_7286,0.0969035
GemmTunableOp_Half_TN,tn_6144_884_4096,Gemm_Hipblaslt_TN_9613,0.0933119
GemmTunableOp_Half_TN,tn_28672_899_4096,Gemm_Hipblaslt_TN_9683,0.390317
GemmTunableOp_Half_TN,tn_4096_1743_14336,Gemm_Hipblaslt_TN_9645,0.397826
GemmTunableOp_Half_TN,tn_6144_1768_4096,Gemm_Hipblaslt_TN_9691,0.162876
GemmTunableOp_Half_TN,tn_28672_200_4096,Gemm_Hipblaslt_TN_9680,0.110956
GemmTunableOp_Half_TN,tn_4096_2773_14336,Gemm_Hipblaslt_TN_9799,0.562898
GemmTunableOp_Half_TN,tn_4096_961_4096,Gemm_Hipblaslt_TN_9604,0.0709308
GemmTunableOp_Half_TN,tn_57344_1297_8192,Gemm_Hipblaslt_TN_9841,2.38003
GemmTunableOp_Half_TN,tn_28672_144_4096,Gemm_Hipblaslt_TN_9561,0.0846571
GemmTunableOp_Half_TN,tn_4096_814_14336,Gemm_Hipblaslt_TN_9158,0.21796
GemmTunableOp_Half_TN,tn_28672_1864_4096,Gemm_Hipblaslt_TN_9684,0.793548
GemmTunableOp_Half_TN,tn_28672_849_4096,Gemm_Hipblaslt_TN_9684,0.382435
GemmTunableOp_Half_TN,tn_57344_4091_8192,Gemm_Hipblaslt_TN_9963,6.75268
GemmTunableOp_Half_TN,tn_4096_3571_4096,Gemm_Hipblaslt_TN_9814,0.201684
GemmTunableOp_Half_TN,tn_4096_911_14336,Gemm_Hipblaslt_TN_9634,0.233707
GemmTunableOp_Half_TN,tn_6144_1666_4096,Gemm_Hipblaslt_TN_9570,0.15112
GemmTunableOp_Half_TN,tn_4096_3569_14336,Gemm_Hipblaslt_TN_9743,0.687774
GemmTunableOp_Half_TN,tn_4096_959_4096,Gemm_Hipblaslt_TN_9634,0.0688876
GemmTunableOp_Half_TN,tn_4096_2592_4096,Gemm_Hipblaslt_TN_9799,0.161086
GemmTunableOp_Half_TN,tn_4096_859_14336,Gemm_Hipblaslt_TN_9580,0.219287
GemmTunableOp_Half_TN,tn_28672_2764_4096,Gemm_Hipblaslt_TN_9917,1.18303
GemmTunableOp_Half_TN,tn_128256_217_4096,Gemm_Hipblaslt_TN_9654,0.555131
GemmTunableOp_Half_TN,tn_6144_983_4096,Gemm_Rocblas_621286571,0.101696
GemmTunableOp_Half_TN,tn_6144_1792_4096,Gemm_Hipblaslt_TN_9711,0.165068
GemmTunableOp_Half_TN,tn_6144_935_4096,Gemm_Hipblaslt_TN_9163,0.0949037
GemmTunableOp_Half_TN,tn_6144_802_4096,Gemm_Rocblas_621286778,0.0879751
GemmTunableOp_Half_TN,tn_8192_3000_28672,Gemm_Rocblas_621286574,2.70958
GemmTunableOp_Half_TN,tn_28672_1886_4096,Gemm_Hipblaslt_TN_9684,0.80358
GemmTunableOp_Half_TN,tn_4096_936_14336,Gemm_Hipblaslt_TN_9634,0.235944
GemmTunableOp_Half_TN,tn_4096_2653_4096,Gemm_Hipblaslt_TN_9799,0.162892
GemmTunableOp_Half_TN,tn_28672_870_4096,Gemm_Hipblaslt_TN_9683,0.385429
GemmTunableOp_Half_TN,tn_4096_900_14336,Gemm_Hipblaslt_TN_9604,0.232468
GemmStridedBatchedTunableOp_Half_TN,tn_862_862_128_B_32,Gemm_Rocblas_621294635,0.0462927
GemmStridedBatchedTunableOp_Half_TN,tn_879_879_128_B_32,Gemm_Rocblas_621286775,0.0469912
GemmStridedBatchedTunableOp_Half_TN,tn_911_911_128_B_32,Gemm_Hipblaslt_TN_7519,0.0515695
GemmStridedBatchedTunableOp_Half_TN,tn_953_953_128_B_32,Gemm_Hipblaslt_TN_7519,0.0517863
GemmStridedBatchedTunableOp_Half_TN,tn_905_905_128_B_32,Gemm_Hipblaslt_TN_7519,0.0520287
GemmStridedBatchedTunableOp_Half_TN,tn_861_861_128_B_32,Gemm_Rocblas_621294635,0.0467906
GemmStridedBatchedTunableOp_Half_TN,tn_944_944_128_B_32,Gemm_Rocblas_621293994,0.0475899
GemmStridedBatchedTunableOp_Half_TN,tn_813_813_128_B_32,Gemm_Rocblas_621294635,0.0429929
GemmStridedBatchedTunableOp_Half_TN,tn_912_912_128_B_32,Gemm_Rocblas_621293994,0.0464573
GemmStridedBatchedTunableOp_Half_TN,tn_823_823_128_B_32,Gemm_Rocblas_621294109,0.0439205
GemmStridedBatchedTunableOp_Half_TN,tn_984_984_128_B_32,Gemm_Hipblaslt_TN_149,0.0515503
GemmStridedBatchedTunableOp_Half_TN,tn_982_982_128_B_32,Gemm_Hipblaslt_TN_9351,0.054373
GemmStridedBatchedTunableOp_Half_TN,tn_868_868_128_B_32,Gemm_Rocblas_621294517,0.0469494
GemmStridedBatchedTunableOp_Half_TN,tn_1249_1249_128_B_64,Gemm_Rocblas_621294106,0.140749
GemmStridedBatchedTunableOp_Half_TN,tn_1201_1201_128_B_64,Gemm_Hipblaslt_TN_6879,0.132613
GemmStridedBatchedTunableOp_Half_TN,tn_1489_1489_128_B_64,Gemm_Rocblas_621294106,0.194509
GemmStridedBatchedTunableOp_Half_TN,tn_1360_1360_128_B_64,Gemm_Rocblas_621286412,0.150485
GemmStridedBatchedTunableOp_Half_TN,tn_1382_1382_128_B_64,Gemm_Rocblas_621294109,0.163989
GemmStridedBatchedTunableOp_Half_TN,tn_1457_1457_128_B_64,Gemm_Rocblas_621294106,0.184352
GemmStridedBatchedTunableOp_Half_TN,tn_1301_1301_128_B_64,Gemm_Rocblas_621286412,0.153256
GemmStridedBatchedTunableOp_Half_TN,tn_1176_1176_128_B_64,Gemm_Rocblas_621294106,0.12506
GemmStridedBatchedTunableOp_Half_TN,tn_875_875_128_B_32,Gemm_Rocblas_621294517,0.0473527
GemmStridedBatchedTunableOp_Half_TN,tn_1042_1042_128_B_64,Gemm_Hipblaslt_TN_6879,0.105384
GemmStridedBatchedTunableOp_Half_TN,tn_1272_1272_128_B_64,Gemm_Rocblas_621294007,0.140529
GemmStridedBatchedTunableOp_Half_TN,tn_1208_1208_128_B_64,Gemm_Rocblas_621294106,0.129671
GemmStridedBatchedTunableOp_Half_TN,tn_1119_1119_128_B_64,Gemm_Rocblas_621294725,0.114525
GemmStridedBatchedTunableOp_Half_TN,tn_807_807_128_B_32,Gemm_Rocblas_621294109,0.0431123
GemmStridedBatchedTunableOp_Half_TN,tn_1028_1028_128_B_64,Gemm_Rocblas_621294725,0.10262
GemmStridedBatchedTunableOp_Half_TN,tn_947_947_128_B_32,Gemm_Rocblas_621294635,0.0529229
GemmStridedBatchedTunableOp_Half_TN,tn_1316_1316_128_B_64,Gemm_Rocblas_621294109,0.153081
GemmStridedBatchedTunableOp_Half_TN,tn_937_937_128_B_32,Gemm_Hipblaslt_TN_7519,0.0521395
GemmStridedBatchedTunableOp_Half_TN,tn_1409_1409_128_B_64,Gemm_Rocblas_621294106,0.176686
GemmStridedBatchedTunableOp_Half_TN,tn_1089_1089_128_B_64,Gemm_Hipblaslt_TN_6879,0.111751
GemmStridedBatchedTunableOp_Half_TN,tn_1233_1233_128_B_64,Gemm_Rocblas_621286397,0.137376
GemmStridedBatchedTunableOp_Half_TN,tn_1104_1104_128_B_64,Gemm_Hipblaslt_TN_158,0.108573
GemmStridedBatchedTunableOp_Half_TN,tn_964_964_128_B_32,Gemm_Hipblaslt_TN_9351,0.0527057
GemmStridedBatchedTunableOp_Half_TN,tn_1000_1000_128_B_64,Gemm_Hipblaslt_TN_153,0.0916353
GemmStridedBatchedTunableOp_Half_TN,tn_831_831_128_B_32,Gemm_Rocblas_621294635,0.0442228
GemmStridedBatchedTunableOp_Half_TN,tn_1073_1073_128_B_64,Gemm_Rocblas_621294725,0.109866
GemmStridedBatchedTunableOp_Half_TN,tn_1039_1039_128_B_64,Gemm_Rocblas_621294725,0.104161
GemmStridedBatchedTunableOp_Half_TN,tn_832_832_128_B_32,Gemm_Hipblaslt_TN_150,0.0362188
GemmStridedBatchedTunableOp_Half_TN,tn_1169_1169_128_B_64,Gemm_Hipblaslt_TN_6879,0.127001
GemmStridedBatchedTunableOp_Half_TN,tn_916_916_128_B_32,Gemm_Rocblas_621294635,0.0506874
GemmStridedBatchedTunableOp_Half_TN,tn_1265_1265_128_B_64,Gemm_Hipblaslt_TN_6879,0.141857
GemmStridedBatchedTunableOp_Half_TN,tn_790_790_128_B_32,Gemm_Rocblas_621294635,0.0412731
GemmStridedBatchedTunableOp_Half_TN,tn_909_909_128_B_32,Gemm_Hipblaslt_TN_7519,0.0516004
GemmStridedBatchedTunableOp_Half_TN,tn_904_904_128_B_32,Gemm_Rocblas_621293994,0.0475434
GemmStridedBatchedTunableOp_Half_TN,tn_963_963_128_B_32,Gemm_Hipblaslt_TN_6879,0.0537358
GemmStridedBatchedTunableOp_Half_TN,tn_855_855_128_B_32,Gemm_Rocblas_621286775,0.0457742
GemmStridedBatchedTunableOp_Half_TN,tn_789_789_128_B_32,Gemm_Hipblaslt_TN_9613,0.0428742
GemmStridedBatchedTunableOp_Half_TN,tn_802_802_128_B_32,Gemm_Rocblas_621294635,0.0436008
GemmStridedBatchedTunableOp_Half_TN,tn_840_840_128_B_32,Gemm_Hipblaslt_TN_150,0.0377209
GemmStridedBatchedTunableOp_Half_TN,tn_1276_1276_128_B_64,Gemm_Rocblas_621286397,0.142479
GemmStridedBatchedTunableOp_Half_TN,tn_888_888_128_B_32,Gemm_Hipblaslt_TN_150,0.0389712
GemmStridedBatchedTunableOp_Half_TN,tn_959_959_128_B_32,Gemm_Hipblaslt_TN_6879,0.0540257
GemmStridedBatchedTunableOp_Half_TN,tn_981_981_128_B_32,Gemm_Rocblas_621294536,0.0541853
GemmStridedBatchedTunableOp_Half_TN,tn_806_806_128_B_32,Gemm_Rocblas_621294635,0.0425819
GemmStridedBatchedTunableOp_Half_TN,tn_895_895_128_B_32,Gemm_Rocblas_621294517,0.0479987
GemmStridedBatchedTunableOp_Half_TN,tn_867_867_128_B_32,Gemm_Rocblas_621286774,0.0463133
GemmStridedBatchedTunableOp_Half_TN,tn_794_794_128_B_32,Gemm_Hipblaslt_TN_9613,0.0420246
GemmStridedBatchedTunableOp_Half_TN,tn_870_870_128_B_32,Gemm_Rocblas_621286774,0.0466723
GemmStridedBatchedTunableOp_Half_TN,tn_892_892_128_B_32,Gemm_Rocblas_621286776,0.0480322
GemmStridedBatchedTunableOp_Half_TN,tn_898_898_128_B_32,Gemm_Hipblaslt_TN_7519,0.0504804
GemmStridedBatchedTunableOp_Half_TN,tn_852_852_128_B_32,Gemm_Rocblas_621294109,0.045528
GemmStridedBatchedTunableOp_Half_TN,tn_929_929_128_B_32,Gemm_Hipblaslt_TN_7519,0.051703
GemmStridedBatchedTunableOp_Half_TN,tn_866_866_128_B_32,Gemm_Rocblas_621294518,0.0464972
GemmStridedBatchedTunableOp_Half_TN,tn_923_923_128_B_32,Gemm_Rocblas_621286794,0.0528395
GemmStridedBatchedTunableOp_Half_TN,tn_839_839_128_B_32,Gemm_Rocblas_621294635,0.0445395
GemmStridedBatchedTunableOp_Half_TN,tn_810_810_128_B_32,Gemm_Rocblas_621294635,0.0432442
GemmStridedBatchedTunableOp_Half_TN,tn_833_833_128_B_32,Gemm_Hipblaslt_TN_7059,0.0442441
GemmStridedBatchedTunableOp_Half_TN,tn_891_891_128_B_32,Gemm_Rocblas_621286775,0.0482024
GemmStridedBatchedTunableOp_Half_TN,tn_889_889_128_B_32,Gemm_Rocblas_621286775,0.0477404
GemmStridedBatchedTunableOp_Half_TN,tn_869_869_128_B_32,Gemm_Rocblas_621294516,0.0468757
GemmStridedBatchedTunableOp_Half_TN,tn_954_954_128_B_32,Gemm_Hipblaslt_TN_6879,0.0537642
GemmStridedBatchedTunableOp_Half_TN,tn_851_851_128_B_32,Gemm_Rocblas_621294518,0.0466891
GemmTunableOp_Half_TN,tn_28672_938_4096,Gemm_Hipblaslt_TN_9684,0.39262
GemmTunableOp_Half_TN,tn_4096_1900_14336,Gemm_Hipblaslt_TN_9645,0.412556
GemmTunableOp_Half_TN,tn_4096_1822_4096,Gemm_Hipblaslt_TN_9590,0.118944
GemmTunableOp_Half_TN,tn_28672_985_4096,Gemm_Hipblaslt_TN_9863,0.432016
GemmTunableOp_Half_TN,tn_28672_877_4096,Gemm_Hipblaslt_TN_9683,0.383999
GemmTunableOp_Half_TN,tn_28672_1841_4096,Gemm_Hipblaslt_TN_9832,0.781784
GemmTunableOp_Half_TN,tn_4096_1881_14336,Gemm_Hipblaslt_TN_9680,0.412136
GemmTunableOp_Half_TN,tn_6144_7299_4096,Gemm_Hipblaslt_TN_9704,0.61961
GemmTunableOp_Half_TN,tn_6144_3479_4096,Gemm_Rocblas_621286566,0.310851
GemmTunableOp_Half_TN,tn_4096_985_14336,Gemm_Hipblaslt_TN_9586,0.243708
GemmTunableOp_Half_TN,tn_4096_7266_14336,Gemm_Hipblaslt_TN_9743,1.41859
GemmTunableOp_Half_TN,tn_28672_1905_4096,Gemm_Hipblaslt_TN_9684,0.792106
GemmTunableOp_Half_TN,tn_6144_1905_4096,Gemm_Hipblaslt_TN_9672,0.166714
GemmTunableOp_Half_TN,tn_6144_2872_4096,Gemm_Hipblaslt_TN_9565,0.259489
GemmTunableOp_Half_TN,tn_4096_3662_4096,Gemm_Hipblaslt_TN_9827,0.209787
GemmTunableOp_Half_TN,tn_28672_944_4096,Gemm_Hipblaslt_TN_9684,0.391713
GemmTunableOp_Half_TN,tn_6144_944_4096,Gemm_Hipblaslt_TN_9613,0.0933395
GemmTunableOp_Half_TN,tn_4096_2571_4096,Gemm_Hipblaslt_TN_9674,0.158039
GemmTunableOp_Half_TN,tn_128256_91_4096,Gemm_Hipblaslt_TN_9057,0.356479
GemmTunableOp_Half_TN,tn_6144_3352_4096,Gemm_Rocblas_621286566,0.299411
GemmTunableOp_Half_TN,tn_4096_921_4096,Gemm_Hipblaslt_TN_9604,0.0666821
GemmTunableOp_Half_TN,tn_6144_820_4096,Gemm_Rocblas_621286778,0.088445
GemmTunableOp_Half_TN,tn_6144_2630_4096,Gemm_Hipblaslt_TN_9827,0.215813
GemmTunableOp_Half_TN,tn_4096_907_4096,Gemm_Hipblaslt_TN_9604,0.068771
GemmTunableOp_Half_TN,tn_6144_2517_4096,Gemm_Hipblaslt_TN_9768,0.214197
GemmTunableOp_Half_TN,tn_28672_891_4096,Gemm_Hipblaslt_TN_9192,0.383938
GemmTunableOp_Half_TN,tn_6144_796_4096,Gemm_Hipblaslt_TN_9133,0.0870477
GemmTunableOp_Half_TN,tn_6144_2719_4096,Gemm_Hipblaslt_TN_9565,0.253018
GemmTunableOp_Half_TN,tn_28672_887_4096,Gemm_Hipblaslt_TN_9684,0.385715
GemmTunableOp_Half_TN,tn_4096_949_14336,Gemm_Hipblaslt_TN_9604,0.233179
GemmTunableOp_Half_TN,tn_4096_1837_14336,Gemm_Hipblaslt_TN_9137,0.402286
GemmTunableOp_Half_TN,tn_128256_239_4096,Gemm_Rocblas_621294634,0.561312
GemmTunableOp_Half_TN,tn_128256_251_4096,Gemm_Rocblas_621294634,0.567761
GemmTunableOp_Half_TN,tn_4096_1848_14336,Gemm_Hipblaslt_TN_9134,0.404906
GemmTunableOp_Half_TN,tn_4096_873_14336,Gemm_Hipblaslt_TN_9580,0.218738
GemmTunableOp_Half_TN,tn_57344_4000_8192,Gemm_Hipblaslt_TN_9963,6.63735
GemmTunableOp_Half_TN,tn_28672_7283_4096,Gemm_Hipblaslt_TN_159,2.81054
GemmTunableOp_Half_TN,tn_6144_2698_4096,Gemm_Hipblaslt_TN_9742,0.251486
GemmTunableOp_Half_TN,tn_28672_2635_4096,Gemm_Hipblaslt_TN_9827,1.059
GemmTunableOp_Half_TN,tn_4096_992_14336,Gemm_Hipblaslt_TN_9052,0.244459
GemmTunableOp_Half_TN,tn_6144_1695_4096,Gemm_Hipblaslt_TN_9570,0.152914
GemmTunableOp_Half_TN,tn_4096_904_14336,Gemm_Hipblaslt_TN_9604,0.230537
GemmTunableOp_Half_TN,tn_6144_2628_4096,Gemm_Hipblaslt_TN_9827,0.215871
GemmTunableOp_Half_TN,tn_6144_2762_4096,Gemm_Hipblaslt_TN_9763,0.254332
GemmTunableOp_Half_TN,tn_128256_175_4096,Gemm_Hipblaslt_TN_9683,0.487143
GemmTunableOp_Half_TN,tn_4096_2636_4096,Gemm_Hipblaslt_TN_9674,0.157833
GemmTunableOp_Half_TN,tn_128256_19_4096,Gemm_Hipblaslt_TN_9420,0.293532
GemmTunableOp_Half_TN,tn_128256_60_4096,Gemm_Rocblas_621294557,0.330317
GemmTunableOp_Half_TN,tn_4096_947_4096,Gemm_Hipblaslt_TN_9634,0.0690898
GemmTunableOp_Half_TN,tn_4096_854_14336,Gemm_Hipblaslt_TN_9099,0.217547
GemmTunableOp_Half_TN,tn_6144_1614_4096,Gemm_Hipblaslt_TN_9570,0.148713
GemmTunableOp_Half_TN,tn_4096_875_14336,Gemm_Hipblaslt_TN_9580,0.218905
GemmTunableOp_Half_TN,tn_6144_982_4096,Gemm_Hipblaslt_TN_9587,0.0997971
GemmTunableOp_Half_TN,tn_4096_1822_14336,Gemm_Hipblaslt_TN_9134,0.403559
GemmTunableOp_Half_TN,tn_4096_1755_4096,Gemm_Hipblaslt_TN_9605,0.11634
GemmTunableOp_Half_TN,tn_128256_144_4096,Gemm_Hipblaslt_TN_9709,0.439824
GemmTunableOp_Half_TN,tn_4096_1846_4096,Gemm_Hipblaslt_TN_9590,0.119166
GemmTunableOp_Half_TN,tn_28672_1724_4096,Gemm_Hipblaslt_TN_9223,0.708704
GemmTunableOp_Half_TN,tn_4096_1746_14336,Gemm_Hipblaslt_TN_9645,0.395207
GemmTunableOp_Half_TN,tn_128256_246_4096,Gemm_Rocblas_621286892,0.562744
GemmTunableOp_Half_TN,tn_128256_223_4096,Gemm_Hipblaslt_TN_9937,0.5455
GemmTunableOp_Half_TN,tn_128256_212_4096,Gemm_Hipblaslt_TN_9937,0.543991
GemmTunableOp_Half_TN,tn_128256_201_4096,Gemm_Hipblaslt_TN_9738,0.535114
GemmTunableOp_Half_TN,tn_6144_2601_4096,Gemm_Hipblaslt_TN_9815,0.215744
GemmTunableOp_Half_TN,tn_128256_171_4096,Gemm_Hipblaslt_TN_9952,0.48519
GemmTunableOp_Half_TN,tn_4096_1723_14336,Gemm_Hipblaslt_TN_9671,0.364521
GemmTunableOp_Half_TN,tn_128256_130_4096,Gemm_Hipblaslt_TN_9072,0.43075
GemmTunableOp_Half_TN,tn_57344_3425_8192,Gemm_Hipblaslt_TN_159,5.71125
GemmTunableOp_Half_TN,tn_4096_1729_14336,Gemm_Hipblaslt_TN_9645,0.394209
GemmTunableOp_Half_TN,tn_128256_87_4096,Gemm_Hipblaslt_TN_9057,0.352906
GemmTunableOp_Half_TN,tn_4096_881_4096,Gemm_Hipblaslt_TN_9604,0.0673527
GemmTunableOp_Half_TN,tn_6144_2682_4096,Gemm_Hipblaslt_TN_9827,0.21788
GemmTunableOp_Half_TN,tn_128256_78_4096,Gemm_Hipblaslt_TN_9057,0.349695
GemmTunableOp_Half_TN,tn_128256_21_4096,Gemm_Rocblas_621286354,0.29163
GemmTunableOp_Half_TN,tn_128256_164_4096,Gemm_Hipblaslt_TN_9952,0.478881
GemmTunableOp_Half_TN,tn_28672_2708_4096,Gemm_Hipblaslt_TN_9217,1.14371
GemmTunableOp_Half_TN,tn_32000_14_8192,Gemm_Rocblas_621294187,0.138689
GemmTunableOp_Half_TN,tn_57344_2166_8192,Gemm_Hipblaslt_TN_9716,4.00484
GemmTunableOp_Half_TN,tn_8192_122_28672,Gemm_Hipblaslt_TN_8378,0.209574
GemmTunableOp_Half_TN,tn_128256_124_4096,Gemm_Rocblas_621286644,0.400947
GemmTunableOp_Half_TN,tn_128256_200_4096,Gemm_Hipblaslt_TN_9738,0.536555
GemmTunableOp_Half_TN,tn_28672_7817_4096,Gemm_Hipblaslt_TN_159,2.92925
GemmTunableOp_Half_TN,tn_4096_896_14336,Gemm_Hipblaslt_TN_9580,0.218157
GemmTunableOp_Half_TN,tn_4096_830_14336,Gemm_Hipblaslt_TN_9147,0.211464
GemmTunableOp_Half_TN,tn_8192_105_28672,Gemm_Hipblaslt_TN_8378,0.198323
GemmTunableOp_Half_TN,tn_28672_1850_4096,Gemm_Hipblaslt_TN_9684,0.782475
GemmTunableOp_Half_TN,tn_28672_3671_4096,Gemm_Hipblaslt_TN_9827,1.48703
GemmTunableOp_Half_TN,tn_128256_168_4096,Gemm_Hipblaslt_TN_9683,0.485819
GemmTunableOp_Half_TN,tn_10240_1361_8192,Gemm_Hipblaslt_TN_9237,0.397865
GemmTunableOp_Half_TN,tn_128256_181_4096,Gemm_Hipblaslt_TN_9683,0.491402
GemmTunableOp_Half_TN,tn_57344_1329_8192,Gemm_Hipblaslt_TN_9841,2.38485
GemmTunableOp_Half_TN,tn_6144_8000_4096,Gemm_Hipblaslt_TN_9768,0.650544
GemmTunableOp_Half_TN,tn_57344_9_8192,Gemm_Hipblaslt_TN_9424,0.241077
GemmTunableOp_Half_TN,tn_6144_889_4096,Gemm_Hipblaslt_TN_9613,0.09163
GemmTunableOp_Half_TN,tn_8192_105_8192,Gemm_Hipblaslt_TN_7157,0.0505064
GemmTunableOp_Half_TN,tn_8192_3785_28672,Gemm_Rocblas_621286836,3.31835
GemmTunableOp_Half_TN,tn_6144_4483_4096,Gemm_Hipblaslt_TN_9192,0.381452
GemmTunableOp_Half_TN,tn_28672_801_4096,Gemm_Hipblaslt_TN_9684,0.374719
GemmTunableOp_Half_TN,tn_10240_2664_8192,Gemm_Hipblaslt_TN_9697,0.737618
GemmTunableOp_Half_TN,tn_4096_224_4096,Gemm_Rocblas_621286443,0.0254148
GemmTunableOp_Half_TN,tn_10240_12_8192,Gemm_Hipblaslt_TN_9411,0.0370963
GemmTunableOp_Half_TN,tn_8192_3491_8192,Gemm_Hipblaslt_TN_9743,0.776951
GemmTunableOp_Half_TN,tn_10240_1360_8192,Gemm_Hipblaslt_TN_9768,0.400979
GemmTunableOp_Half_TN,tn_32000_114_8192,Gemm_Hipblaslt_TN_9356,0.216341
GemmTunableOp_Half_TN,tn_10240_1112_8192,Gemm_Hipblaslt_TN_9209,0.31802
GemmTunableOp_Half_TN,tn_57344_108_8192,Gemm_Hipblaslt_TN_9486,0.341024
GemmTunableOp_Half_TN,tn_10240_1350_8192,Gemm_Hipblaslt_TN_9237,0.397674
GemmTunableOp_Half_TN,tn_4096_969_4096,Gemm_Hipblaslt_TN_9604,0.0677774
GemmTunableOp_Half_TN,tn_10240_106_8192,Gemm_Rocblas_621294504,0.0607256
GemmTunableOp_Half_TN,tn_8192_3187_8192,Gemm_Hipblaslt_TN_9697,0.725104
GemmTunableOp_Half_TN,tn_32000_115_8192,Gemm_Hipblaslt_TN_9355,0.216569
GemmTunableOp_Half_TN,tn_10240_3971_8192,Gemm_Hipblaslt_TN_9743,1.10556
GemmTunableOp_Half_TN,tn_57344_2866_8192,Gemm_Rocblas_621294396,5.10182
GemmTunableOp_Half_TN,tn_10240_2859_8192,Gemm_Hipblaslt_TN_9814,0.780263
GemmTunableOp_Half_TN,tn_28672_823_4096,Gemm_Hipblaslt_TN_9683,0.377016
GemmTunableOp_Half_TN,tn_8192_3546_28672,Gemm_Hipblaslt_TN_9732,3.04517
GemmTunableOp_Half_TN,tn_28672_2703_4096,Gemm_Rocblas_621294330,1.14616
GemmTunableOp_Half_TN,tn_10240_124_8192,Gemm_Rocblas_621294504,0.0628576
GemmTunableOp_Half_TN,tn_28672_876_4096,Gemm_Hipblaslt_TN_9684,0.383758
GemmTunableOp_Half_TN,tn_57344_2859_8192,Gemm_Rocblas_621294288,5.05856
GemmTunableOp_Half_TN,tn_8192_108_28672,Gemm_Hipblaslt_TN_8378,0.199206
GemmTunableOp_Half_TN,tn_32000_104_8192,Gemm_Rocblas_621286475,0.212174
GemmTunableOp_Half_TN,tn_4096_797_14336,Gemm_Hipblaslt_TN_9158,0.213393
GemmTunableOp_Half_TN,tn_128256_156_4096,Gemm_Hipblaslt_TN_9108,0.445808
GemmTunableOp_Half_TN,tn_4096_913_14336,Gemm_Hipblaslt_TN_9608,0.230511
GemmTunableOp_Half_TN,tn_57344_96_8192,Gemm_Hipblaslt_TN_9322,0.325709
GemmTunableOp_Half_TN,tn_4096_986_4096,Gemm_Hipblaslt_TN_9604,0.0691249
GemmTunableOp_Half_TN,tn_6144_256_4096,Gemm_Rocblas_621294232,0.0352723
GemmTunableOp_Half_TN,tn_4096_3671_4096,Gemm_Hipblaslt_TN_9220,0.209099
GemmTunableOp_Half_TN,tn_8192_131_8192,Gemm_Hipblaslt_TN_7230,0.0579759
GemmTunableOp_Half_TN,tn_28672_2601_4096,Gemm_Hipblaslt_TN_9827,1.06264
GemmTunableOp_Half_TN,tn_8192_135_28672,Gemm_Hipblaslt_TN_8662,0.224891
GemmTunableOp_Half_TN,tn_6144_8054_4096,Gemm_Rocblas_621286750,0.654282
GemmTunableOp_Half_TN,tn_10240_1025_8192,Gemm_Hipblaslt_TN_9209,0.310986
GemmTunableOp_Half_TN,tn_10240_3626_8192,Gemm_Hipblaslt_TN_9798,1.05106
GemmTunableOp_Half_TN,tn_28672_802_4096,Gemm_Hipblaslt_TN_9683,0.376358
GemmTunableOp_Half_TN,tn_6144_871_4096,Gemm_Hipblaslt_TN_9133,0.0919198
GemmTunableOp_Half_TN,tn_8192_23_8192,Gemm_Hipblaslt_TN_9410,0.0324351
GemmTunableOp_Half_TN,tn_28672_924_4096,Gemm_Hipblaslt_TN_9684,0.388438
GemmTunableOp_Half_TN,tn_4096_844_14336,Gemm_Hipblaslt_TN_9580,0.2189
GemmTunableOp_Half_TN,tn_57344_130_8192,Gemm_Hipblaslt_TN_9507,0.375475
GemmTunableOp_Half_TN,tn_128256_41_4096,Gemm_Hipblaslt_TN_9451,0.307093
GemmTunableOp_Half_TN,tn_8192_2015_28672,Gemm_Hipblaslt_TN_9591,1.74876
GemmTunableOp_Half_TN,tn_128256_68_4096,Gemm_Hipblaslt_TN_9057,0.342311
GemmTunableOp_Half_TN,tn_57344_119_8192,Gemm_Hipblaslt_TN_9486,0.346615
GemmTunableOp_Half_TN,tn_6144_1807_4096,Gemm_Hipblaslt_TN_9672,0.163244
GemmTunableOp_Half_TN,tn_4096_3670_14336,Gemm_Hipblaslt_TN_9220,0.709947
GemmTunableOp_Half_TN,tn_32000_93_8192,Gemm_Hipblaslt_TN_9482,0.206759
GemmTunableOp_Half_TN,tn_8192_110_28672,Gemm_Hipblaslt_TN_8378,0.199878
GemmTunableOp_Half_TN,tn_28672_7266_4096,Gemm_Hipblaslt_TN_159,2.81322
GemmTunableOp_Half_TN,tn_32000_25_8192,Gemm_Rocblas_621286350,0.149678
GemmTunableOp_Half_TN,tn_4096_869_14336,Gemm_Hipblaslt_TN_9580,0.21824
GemmTunableOp_Half_TN,tn_4096_152_14336,Gemm_Hipblaslt_TN_7234,0.0571935
GemmTunableOp_Half_TN,tn_8192_126_8192,Gemm_Hipblaslt_TN_8891,0.0544797
GemmTunableOp_Half_TN,tn_6144_7817_4096,Gemm_Rocblas_621286590,0.644041
GemmTunableOp_Half_TN,tn_10240_130_8192,Gemm_Hipblaslt_TN_9367,0.0669518
GemmTunableOp_Half_TN,tn_128256_13_4096,Gemm_Rocblas_621286325,0.272287
GemmTunableOp_Half_TN,tn_4096_899_14336,Gemm_Hipblaslt_TN_9604,0.23106
GemmTunableOp_Half_TN,tn_10240_123_8192,Gemm_Hipblaslt_TN_7543,0.0624921
GemmTunableOp_Half_TN,tn_4096_862_14336,Gemm_Hipblaslt_TN_9580,0.218358
GemmTunableOp_Half_TN,tn_32000_125_8192,Gemm_Hipblaslt_TN_9356,0.220512
GemmTunableOp_Half_TN,tn_6144_986_4096,Gemm_Hipblaslt_TN_9633,0.0999598
GemmTunableOp_Half_TN,tn_8192_114_8192,Gemm_Hipblaslt_TN_8891,0.0518527
GemmTunableOp_Half_TN,tn_28672_875_4096,Gemm_Hipblaslt_TN_9684,0.385267
GemmTunableOp_Half_TN,tn_57344_3235_8192,Gemm_Hipblaslt_TN_9816,5.55337
GemmTunableOp_Half_TN,tn_6144_972_4096,Gemm_Hipblaslt_TN_9164,0.100731
GemmTunableOp_Half_TN,tn_8192_129_28672,Gemm_Hipblaslt_TN_8662,0.216898
GemmTunableOp_Half_TN,tn_28672_951_4096,Gemm_Hipblaslt_TN_9684,0.39254
GemmTunableOp_Half_TN,tn_10240_3859_8192,Gemm_Hipblaslt_TN_9798,1.0922
GemmTunableOp_Half_TN,tn_8192_92_8192,Gemm_Hipblaslt_TN_8197,0.047129
GemmTunableOp_Half_TN,tn_57344_3498_8192,Gemm_Hipblaslt_TN_159,5.82742
GemmTunableOp_Half_TN,tn_128256_104_4096,Gemm_Rocblas_621286584,0.392316
GemmTunableOp_Half_TN,tn_10240_3754_8192,Gemm_Hipblaslt_TN_9763,1.06622
GemmTunableOp_Half_TN,tn_57344_3411_8192,Gemm_Hipblaslt_TN_159,5.79201
GemmTunableOp_Half_TN,tn_28672_3662_4096,Gemm_Hipblaslt_TN_9827,1.48328
GemmTunableOp_Half_TN,tn_6144_1850_4096,Gemm_Hipblaslt_TN_9691,0.164997
GemmTunableOp_Half_TN,tn_8192_2639_8192,Gemm_Hipblaslt_TN_9774,0.618299
GemmTunableOp_Half_TN,tn_4096_24_14336,Gemm_Hipblaslt_TN_9388,0.0271658
GemmTunableOp_Half_TN,tn_10240_3206_8192,Gemm_Hipblaslt_TN_9815,0.880062
GemmTunableOp_Half_TN,tn_8192_113_8192,Gemm_Hipblaslt_TN_8891,0.0508448
GemmTunableOp_Half_TN,tn_6144_2773_4096,Gemm_Hipblaslt_TN_9742,0.255596
GemmTunableOp_Half_TN,tn_10240_3120_8192,Gemm_Hipblaslt_TN_9827,0.85771
GemmTunableOp_Half_TN,tn_8192_3451_28672,Gemm_Hipblaslt_TN_9732,2.97056
GemmTunableOp_Half_TN,tn_57344_1265_8192,Gemm_Hipblaslt_TN_9068,2.35914
GemmTunableOp_Half_TN,tn_6144_120_4096,Gemm_Rocblas_621294171,0.0240772
GemmTunableOp_Half_TN,tn_28672_843_4096,Gemm_Hipblaslt_TN_9684,0.38342
GemmTunableOp_Half_TN,tn_28672_1719_4096,Gemm_Hipblaslt_TN_9223,0.705365
GemmTunableOp_Half_TN,tn_6144_870_4096,Gemm_Hipblaslt_TN_9357,0.0915961
GemmTunableOp_Half_TN,tn_8192_20_28672,Gemm_Rocblas_621286354,0.128685
GemmTunableOp_Half_TN,tn_10240_2622_8192,Gemm_Hipblaslt_TN_9743,0.734984
GemmTunableOp_Half_TN,tn_28672_1672_4096,Gemm_Rocblas_621294420,0.699783
GemmTunableOp_Half_TN,tn_128256_32_4096,Gemm_Rocblas_621294578,0.293542
GemmTunableOp_Half_TN,tn_28672_2672_4096,Gemm_Hipblaslt_TN_9827,1.06406
GemmTunableOp_Half_TN,tn_28672_800_4096,Gemm_Hipblaslt_TN_9691,0.342665
GemmTunableOp_Half_TN,tn_57344_3971_8192,Gemm_Hipblaslt_TN_9963,6.61408
GemmTunableOp_Half_TN,tn_57344_1276_8192,Gemm_Hipblaslt_TN_9827,2.37061
GemmTunableOp_Half_TN,tn_8192_109_28672,Gemm_Hipblaslt_TN_8378,0.199753
GemmTunableOp_Half_TN,tn_32000_97_8192,Gemm_Rocblas_621286475,0.209393
GemmTunableOp_Half_TN,tn_8192_3971_8192,Gemm_Hipblaslt_TN_9655,0.869194
GemmTunableOp_Half_TN,tn_8192_99_8192,Gemm_Hipblaslt_TN_8891,0.0483321
GemmTunableOp_Half_TN,tn_4096_834_4096,Gemm_Hipblaslt_TN_9634,0.064978
GemmTunableOp_Half_TN,tn_128256_117_4096,Gemm_Rocblas_621294385,0.39929
GemmTunableOp_Half_TN,tn_28672_184_4096,Gemm_Hipblaslt_TN_7286,0.096838
GemmTunableOp_Half_TN,tn_8192_3235_28672,Gemm_Hipblaslt_TN_9732,2.8935
GemmTunableOp_Half_TN,tn_28672_914_4096,Gemm_Hipblaslt_TN_9683,0.388156
GemmTunableOp_Half_TN,tn_8192_115_28672,Gemm_Hipblaslt_TN_8378,0.20502
GemmTunableOp_Half_TN,tn_8192_122_8192,Gemm_Hipblaslt_TN_9303,0.0550049
GemmTunableOp_Half_TN,tn_8192_22_28672,Gemm_Rocblas_621286354,0.131609
GemmTunableOp_Half_TN,tn_4096_56_14336,Gemm_Rocblas_621294058,0.0356714
GemmTunableOp_Half_TN,tn_6144_24_4096,Gemm_Rocblas_621294047,0.0137542
GemmTunableOp_Half_TN,tn_4096_2681_4096,Gemm_Hipblaslt_TN_9657,0.160898
GemmTunableOp_Half_TN,tn_57344_3785_8192,Gemm_Hipblaslt_TN_9908,6.47088
GemmTunableOp_Half_TN,tn_57344_2549_8192,Default,4.41921
GemmTunableOp_Half_TN,tn_32000_5_8192,Gemm_Rocblas_621294189,0.137601
GemmTunableOp_Half_TN,tn_57344_93_8192,Gemm_Rocblas_621286477,0.327307
GemmTunableOp_Half_TN,tn_57344_2760_8192,Gemm_Hipblaslt_TN_9666,4.9551
GemmTunableOp_Half_TN,tn_10240_122_8192,Gemm_Rocblas_621286493,0.0633549
GemmTunableOp_Half_TN,tn_32000_19_8192,Gemm_Rocblas_621286350,0.14685
GemmTunableOp_Half_TN,tn_8192_3642_8192,Gemm_Hipblaslt_TN_9697,0.781631
GemmTunableOp_Half_TN,tn_32000_120_8192,Gemm_Rocblas_621294212,0.220986
GemmTunableOp_Half_TN,tn_8192_9_28672,Gemm_Rocblas_621294224,0.118257
GemmTunableOp_Half_TN,tn_4096_805_14336,Gemm_Hipblaslt_TN_9158,0.208858
GemmTunableOp_Half_TN,tn_10240_1286_8192,Gemm_Hipblaslt_TN_9697,0.361568
GemmTunableOp_Half_TN,tn_57344_1360_8192,Gemm_Hipblaslt_TN_9830,2.57078
GemmTunableOp_Half_TN,tn_6144_968_4096,Gemm_Hipblaslt_TN_9633,0.100135
GemmTunableOp_Half_TN,tn_57344_1321_8192,Gemm_Hipblaslt_TN_9847,2.38823
GemmTunableOp_Half_TN,tn_8192_3290_8192,Gemm_Hipblaslt_TN_9743,0.742219
GemmTunableOp_Half_TN,tn_32000_96_8192,Gemm_Hipblaslt_TN_9251,0.20729
GemmTunableOp_Half_TN,tn_8192_3498_28672,Gemm_Hipblaslt_TN_9732,3.01098
GemmTunableOp_Half_TN,tn_8192_99_28672,Gemm_Hipblaslt_TN_8378,0.194815
GemmTunableOp_Half_TN,tn_4096_1850_14336,Gemm_Hipblaslt_TN_9268,0.403362
GemmTunableOp_Half_TN,tn_4096_1835_14336,Gemm_Hipblaslt_TN_9268,0.403208
GemmTunableOp_Half_TN,tn_8192_20_8192,Gemm_Hipblaslt_TN_9410,0.032243
GemmTunableOp_Half_TN,tn_28672_805_4096,Gemm_Hipblaslt_TN_9683,0.374136
GemmTunableOp_Half_TN,tn_4096_918_4096,Gemm_Hipblaslt_TN_9170,0.0683065
GemmTunableOp_Half_TN,tn_6144_2672_4096,Gemm_Hipblaslt_TN_9827,0.21618
GemmTunableOp_Half_TN,tn_57344_3331_8192,Gemm_Hipblaslt_TN_9803,5.89646
GemmTunableOp_Half_TN,tn_8192_1361_8192,Gemm_Rocblas_621294426,0.321171
GemmTunableOp_Half_TN,tn_10240_3603_8192,Gemm_Hipblaslt_TN_9814,1.04098
GemmTunableOp_Half_TN,tn_8192_2479_28672,Gemm_Hipblaslt_TN_9776,2.38925
GemmTunableOp_Half_TN,tn_4096_903_4096,Gemm_Hipblaslt_TN_9604,0.0690771
GemmTunableOp_Half_TN,tn_4096_866_4096,Gemm_Hipblaslt_TN_9547,0.0655587
GemmTunableOp_Half_TN,tn_8192_2914_28672,Gemm_Rocblas_621286574,2.66377
GemmTunableOp_Half_TN,tn_8192_3754_28672,Gemm_Rocblas_621294734,3.29933
GemmTunableOp_Half_TN,tn_8192_1281_28672,Gemm_Hipblaslt_TN_9774,1.20314
GemmTunableOp_Half_TN,tn_32000_98_8192,Gemm_Rocblas_621286475,0.209575
GemmTunableOp_Half_TN,tn_4096_888_4096,Gemm_Hipblaslt_TN_9547,0.0658579
GemmTunableOp_Half_TN,tn_128256_145_4096,Gemm_Rocblas_621286565,0.434829
GemmTunableOp_Half_TN,tn_4096_812_4096,Gemm_Hipblaslt_TN_9158,0.0634597
GemmTunableOp_Half_TN,tn_8192_2802_8192,Gemm_Rocblas_621286609,0.647746
GemmTunableOp_Half_TN,tn_4096_1768_4096,Gemm_Hipblaslt_TN_9134,0.11626
GemmTunableOp_Half_TN,tn_10240_3747_8192,Gemm_Hipblaslt_TN_9763,1.07157
GemmTunableOp_Half_TN,tn_8192_1248_28672,Gemm_Hipblaslt_TN_9774,1.18812
GemmTunableOp_Half_TN,tn_8192_2549_8192,Gemm_Hipblaslt_TN_9690,0.607182
GemmTunableOp_Half_TN,tn_4096_924_4096,Gemm_Hipblaslt_TN_9604,0.0677093
GemmTunableOp_Half_TN,tn_28672_2721_4096,Gemm_Hipblaslt_TN_9184,1.15733
GemmTunableOp_Half_TN,tn_8192_2664_8192,Gemm_Rocblas_621294320,0.627321
GemmTunableOp_Half_TN,tn_128256_240_4096,Gemm_Rocblas_621294634,0.561405
GemmTunableOp_Half_TN,tn_28672_2773_4096,Gemm_Hipblaslt_TN_9223,1.1527
GemmTunableOp_Half_TN,tn_28672_112_4096,Gemm_Rocblas_621286473,0.0670097
GemmTunableOp_Half_TN,tn_32000_124_8192,Gemm_Rocblas_621294212,0.221642
GemmTunableOp_Half_TN,tn_128256_22_4096,Gemm_Hipblaslt_TN_9455,0.295969
GemmTunableOp_Half_TN,tn_57344_1389_8192,Gemm_Hipblaslt_TN_9830,2.59108
GemmTunableOp_Half_TN,tn_10240_3299_8192,Gemm_Hipblaslt_TN_9749,0.892784
GemmTunableOp_Half_TN,tn_4096_937_4096,Gemm_Hipblaslt_TN_9170,0.0677136
GemmTunableOp_Half_TN,tn_8192_2622_8192,Gemm_Hipblaslt_TN_9774,0.619913
GemmTunableOp_Half_TN,tn_10240_103_8192,Gemm_Rocblas_621294504,0.0579329
GemmTunableOp_Half_TN,tn_28672_855_4096,Gemm_Hipblaslt_TN_9683,0.38109
GemmTunableOp_Half_TN,tn_10240_3785_8192,Gemm_Hipblaslt_TN_9763,1.08047
GemmTunableOp_Half_TN,tn_28672_1944_4096,Gemm_Hipblaslt_TN_9846,0.817545
GemmTunableOp_Half_TN,tn_6144_886_4096,Gemm_Hipblaslt_TN_9613,0.0924464
GemmTunableOp_Half_TN,tn_6144_821_4096,Gemm_Rocblas_621294520,0.088659
GemmTunableOp_Half_TN,tn_4096_2517_14336,Gemm_Hipblaslt_TN_9799,0.521932
GemmTunableOp_Half_TN,tn_8192_1168_8192,Gemm_Hipblaslt_TN_9690,0.295042
GemmTunableOp_Half_TN,tn_6144_790_4096,Gemm_Hipblaslt_TN_9357,0.0870757
GemmTunableOp_Half_TN,tn_10240_4000_8192,Gemm_Hipblaslt_TN_9743,1.1045
GemmTunableOp_Half_TN,tn_57344_3283_8192,Gemm_Hipblaslt_TN_9816,5.85663
GemmTunableOp_Half_TN,tn_8192_128_28672,Gemm_Hipblaslt_TN_8378,0.207948
GemmTunableOp_Half_TN,tn_8192_121_28672,Gemm_Hipblaslt_TN_8378,0.203349
GemmTunableOp_Half_TN,tn_8192_128_8192,Gemm_Hipblaslt_TN_8891,0.0524701
GemmTunableOp_Half_TN,tn_57344_2041_8192,Gemm_Hipblaslt_TN_9830,3.54068
GemmTunableOp_Half_TN,tn_6144_3662_4096,Gemm_Hipblaslt_TN_9690,0.324674
GemmTunableOp_Half_TN,tn_32000_123_8192,Gemm_Hipblaslt_TN_9356,0.221196
GemmTunableOp_Half_TN,tn_4096_216_14336,Gemm_Hipblaslt_TN_9300,0.0698597
GemmTunableOp_Half_TN,tn_8192_3715_8192,Gemm_Hipblaslt_TN_9753,0.827749
GemmTunableOp_Half_TN,tn_4096_935_14336,Gemm_Hipblaslt_TN_9585,0.232976
GemmTunableOp_Half_TN,tn_8192_1392_8192,Gemm_Hipblaslt_TN_9209,0.323255
GemmTunableOp_Half_TN,tn_57344_11_8192,Gemm_Hipblaslt_TN_9429,0.243296
GemmTunableOp_Half_TN,tn_10240_21_8192,Gemm_Hipblaslt_TN_9415,0.0392169
GemmTunableOp_Half_TN,tn_4096_7787_14336,Gemm_Hipblaslt_TN_9815,1.5279
GemmTunableOp_Half_TN,tn_8192_1281_8192,Gemm_Rocblas_621286663,0.31224
GemmTunableOp_Half_TN,tn_4096_3431_14336,Gemm_Hipblaslt_TN_9677,0.654324
GemmTunableOp_Half_TN,tn_4096_1744_4096,Gemm_Hipblaslt_TN_9590,0.116547
GemmTunableOp_Half_TN,tn_4096_1748_14336,Gemm_Hipblaslt_TN_9645,0.394843
GemmTunableOp_Half_TN,tn_8192_2692_8192,Gemm_Rocblas_621286580,0.626173
GemmTunableOp_Half_TN,tn_57344_22_8192,Gemm_Hipblaslt_TN_9429,0.245081
GemmTunableOp_Half_TN,tn_6144_2572_4096,Gemm_Hipblaslt_TN_9768,0.214995
GemmTunableOp_Half_TN,tn_10240_18_8192,Gemm_Hipblaslt_TN_9415,0.038389
GemmTunableOp_Half_TN,tn_4096_7798_14336,Gemm_Hipblaslt_TN_9749,1.5319
GemmTunableOp_Half_TN,tn_57344_3139_8192,Gemm_Hipblaslt_TN_9752,5.51503
GemmTunableOp_Half_TN,tn_28672_838_4096,Gemm_Hipblaslt_TN_9684,0.377179
GemmTunableOp_Half_TN,tn_4096_946_14336,Gemm_Hipblaslt_TN_9589,0.234318
GemmTunableOp_Half_TN,tn_4096_923_14336,Gemm_Hipblaslt_TN_9604,0.23403
GemmTunableOp_Half_TN,tn_57344_1153_8192,Gemm_Hipblaslt_TN_9068,2.28661
GemmTunableOp_Half_TN,tn_28672_1854_4096,Gemm_Hipblaslt_TN_9684,0.782341
GemmTunableOp_Half_TN,tn_6144_7804_4096,Gemm_Rocblas_621286678,0.638418
GemmTunableOp_Half_TN,tn_10240_1374_8192,Gemm_Hipblaslt_TN_9278,0.403339
GemmTunableOp_Half_TN,tn_10240_91_8192,Gemm_Hipblaslt_TN_8095,0.0535665
GemmTunableOp_Half_TN,tn_28672_940_4096,Gemm_Hipblaslt_TN_9684,0.389502
GemmTunableOp_Half_TN,tn_6144_840_4096,Gemm_Rocblas_621286778,0.0887162
GemmTunableOp_Half_TN,tn_6144_873_4096,Gemm_Hipblaslt_TN_9613,0.090992
GemmTunableOp_Half_TN,tn_8192_17_8192,Gemm_Hipblaslt_TN_9410,0.0319126
GemmTunableOp_Half_TN,tn_28672_1694_4096,Gemm_Hipblaslt_TN_9223,0.704718
GemmTunableOp_Half_TN,tn_128256_210_4096,Gemm_Hipblaslt_TN_9961,0.540256
GemmTunableOp_Half_TN,tn_57344_3482_8192,Gemm_Hipblaslt_TN_159,5.7807
GemmTunableOp_Half_TN,tn_8192_132_8192,Gemm_Hipblaslt_TN_9306,0.0574926
GemmTunableOp_Half_TN,tn_8192_3369_28672,Gemm_Hipblaslt_TN_9684,2.96645
GemmTunableOp_Half_TN,tn_57344_3555_8192,Gemm_Hipblaslt_TN_159,5.81733
GemmTunableOp_Half_TN,tn_28672_893_4096,Gemm_Hipblaslt_TN_9684,0.385333
GemmTunableOp_Half_TN,tn_128256_253_4096,Gemm_Rocblas_621286905,0.571067
GemmTunableOp_Half_TN,tn_4096_72_4096,Gemm_Rocblas_621286279,0.0150393
GemmTunableOp_Half_TN,tn_57344_103_8192,Gemm_Hipblaslt_TN_9486,0.336751
GemmTunableOp_Half_TN,tn_128256_133_4096,Gemm_Rocblas_621286565,0.431694
GemmTunableOp_Half_TN,tn_4096_2648_14336,Gemm_Hipblaslt_TN_9657,0.534907
GemmTunableOp_Half_TN,tn_57344_2551_8192,Gemm_Hipblaslt_TN_9800,4.50154
GemmTunableOp_Half_TN,tn_4096_2699_14336,Gemm_Hipblaslt_TN_9799,0.540883
GemmTunableOp_Half_TN,tn_4096_878_4096,Gemm_Hipblaslt_TN_9547,0.0655424
GemmTunableOp_Half_TN,tn_10240_20_8192,Gemm_Hipblaslt_TN_9415,0.0391071
GemmTunableOp_Half_TN,tn_57344_1271_8192,Gemm_Hipblaslt_TN_9827,2.35907
GemmTunableOp_Half_TN,tn_28672_971_4096,Gemm_Hipblaslt_TN_9863,0.420046
GemmTunableOp_Half_TN,tn_8192_3491_28672,Gemm_Hipblaslt_TN_9732,3.02378
GemmTunableOp_Half_TN,tn_4096_2682_14336,Gemm_Hipblaslt_TN_9799,0.539306
GemmTunableOp_Half_TN,tn_6144_936_4096,Gemm_Hipblaslt_TN_9613,0.0929193
GemmTunableOp_Half_TN,tn_10240_4063_8192,Gemm_Hipblaslt_TN_9814,1.13569
GemmTunableOp_Half_TN,tn_8192_18_8192,Gemm_Hipblaslt_TN_9410,0.0321191
GemmTunableOp_Half_TN,tn_28672_865_4096,Gemm_Hipblaslt_TN_9684,0.379175
GemmTunableOp_Half_TN,tn_8192_95_28672,Gemm_Hipblaslt_TN_8899,0.185073
GemmTunableOp_Half_TN,tn_4096_3447_14336,Gemm_Hipblaslt_TN_9677,0.653962
GemmTunableOp_Half_TN,tn_28672_968_4096,Gemm_Hipblaslt_TN_9863,0.421543
GemmTunableOp_Half_TN,tn_32000_100_8192,Gemm_Hipblaslt_TN_9252,0.21223
GemmTunableOp_Half_TN,tn_4096_796_14336,Gemm_Hipblaslt_TN_9158,0.20954
GemmTunableOp_Half_TN,tn_57344_97_8192,Gemm_Rocblas_621294214,0.32705
GemmTunableOp_Half_TN,tn_28672_921_4096,Gemm_Hipblaslt_TN_9683,0.38803
GemmTunableOp_Half_TN,tn_8192_16_8192,Gemm_Hipblaslt_TN_9392,0.0305463
GemmTunableOp_Half_TN,tn_6144_961_4096,Gemm_Hipblaslt_TN_9587,0.0999202
GemmTunableOp_Half_TN,tn_28672_2670_4096,Gemm_Hipblaslt_TN_9827,1.06853
GemmTunableOp_Half_TN,tn_8192_1313_28672,Gemm_Hipblaslt_TN_9774,1.21496
GemmTunableOp_Half_TN,tn_4096_813_14336,Gemm_Hipblaslt_TN_9147,0.209279
GemmTunableOp_Half_TN,tn_6144_813_4096,Gemm_Hipblaslt_TN_9561,0.0872269
GemmTunableOp_Half_TN,tn_4096_1848_4096,Gemm_Hipblaslt_TN_9268,0.121055
GemmTunableOp_Half_TN,tn_4096_948_4096,Gemm_Hipblaslt_TN_9604,0.0694796
GemmTunableOp_Half_TN,tn_28672_895_4096,Gemm_Hipblaslt_TN_9684,0.383987
GemmTunableOp_Half_TN,tn_57344_1268_8192,Gemm_Hipblaslt_TN_9068,2.35336
GemmTunableOp_Half_TN,tn_4096_1715_14336,Gemm_Hipblaslt_TN_9790,0.365087
GemmTunableOp_Half_TN,tn_4096_2636_14336,Gemm_Hipblaslt_TN_9657,0.537341
GemmTunableOp_Half_TN,tn_57344_2639_8192,Gemm_Hipblaslt_TN_159,4.64522
GemmTunableOp_Half_TN,tn_4096_904_4096,Gemm_Hipblaslt_TN_9604,0.0674448
GemmTunableOp_Half_TN,tn_28672_3431_4096,Gemm_Hipblaslt_TN_9827,1.33087
GemmTunableOp_Half_TN,tn_57344_4090_8192,Gemm_Hipblaslt_TN_9936,6.69465
GemmTunableOp_Half_TN,tn_28672_7787_4096,Gemm_Hipblaslt_TN_159,2.90808
GemmTunableOp_Half_TN,tn_28672_839_4096,Gemm_Hipblaslt_TN_9684,0.378158
GemmTunableOp_Half_TN,tn_4096_961_14336,Gemm_Hipblaslt_TN_9608,0.235091
GemmTunableOp_Half_TN,tn_6144_1757_4096,Gemm_Hipblaslt_TN_9691,0.157336
GemmTunableOp_Half_TN,tn_6144_842_4096,Gemm_Rocblas_621294520,0.0885998
GemmTunableOp_Half_TN,tn_4096_7817_14336,Gemm_Hipblaslt_TN_9749,1.5298
GemmTunableOp_Half_TN,tn_10240_17_8192,Gemm_Hipblaslt_TN_9415,0.0386903
GemmTunableOp_Half_TN,tn_28672_2630_4096,Gemm_Hipblaslt_TN_9827,1.07201
GemmTunableOp_Half_TN,tn_4096_1785_14336,Gemm_Hipblaslt_TN_9329,0.397353
GemmTunableOp_Half_TN,tn_6144_80_4096,Gemm_Rocblas_621286280,0.0190705
GemmTunableOp_Half_TN,tn_8192_12_28672,Gemm_Rocblas_621286325,0.120943
GemmTunableOp_Half_TN,tn_4096_982_4096,Gemm_Hipblaslt_TN_9604,0.0713122
GemmTunableOp_Half_TN,tn_10240_104_8192,Gemm_Hipblaslt_TN_7543,0.060325
GemmTunableOp_Half_TN,tn_4096_853_4096,Gemm_Hipblaslt_TN_9604,0.0658164
GemmTunableOp_Half_TN,tn_4096_2786_4096,Gemm_Hipblaslt_TN_9691,0.165017
GemmTunableOp_Half_TN,tn_28672_2544_4096,Gemm_Hipblaslt_TN_9846,1.02217
GemmTunableOp_Half_TN,tn_57344_127_8192,Gemm_Rocblas_621286477,0.347962
GemmTunableOp_Half_TN,tn_128256_42_4096,Gemm_Hipblaslt_TN_9451,0.308018
GemmTunableOp_Half_TN,tn_8192_3299_28672,Gemm_Hipblaslt_TN_9732,2.94065
GemmTunableOp_Half_TN,tn_4096_8049_4096,Gemm_Hipblaslt_TN_9190,0.436985
GemmTunableOp_Half_TN,tn_4096_208_4096,Gemm_Rocblas_621294171,0.0252509
GemmTunableOp_Half_TN,tn_128256_53_4096,Gemm_Rocblas_621286816,0.329929
GemmTunableOp_Half_TN,tn_4096_3352_4096,Gemm_Hipblaslt_TN_9814,0.192865
GemmTunableOp_Half_TN,tn_6144_7952_4096,Gemm_Rocblas_621286590,0.647769
GemmTunableOp_Half_TN,tn_4096_2658_4096,Gemm_Hipblaslt_TN_9691,0.160595
GemmTunableOp_Half_TN,tn_4096_869_4096,Gemm_Hipblaslt_TN_9547,0.0655705
GemmTunableOp_Half_TN,tn_28672_986_4096,Gemm_Hipblaslt_TN_9863,0.425579
GemmTunableOp_Half_TN,tn_4096_1783_14336,Gemm_Hipblaslt_TN_9645,0.397094
GemmTunableOp_Half_TN,tn_4096_983_14336,Gemm_Hipblaslt_TN_9170,0.241873
GemmTunableOp_Half_TN,tn_57344_104_8192,Gemm_Hipblaslt_TN_9486,0.33677
GemmTunableOp_Half_TN,tn_4096_921_14336,Gemm_Hipblaslt_TN_9640,0.233261
GemmTunableOp_Half_TN,tn_6144_1834_4096,Gemm_Hipblaslt_TN_9799,0.163733
GemmTunableOp_Half_TN,tn_4096_785_4096,Gemm_Hipblaslt_TN_9158,0.0619083
GemmTunableOp_Half_TN,tn_4096_2786_14336,Gemm_Hipblaslt_TN_9799,0.560889
GemmTunableOp_Half_TN,tn_128256_214_4096,Gemm_Hipblaslt_TN_9847,0.543933
GemmTunableOp_Half_TN,tn_28672_3418_4096,Gemm_Hipblaslt_TN_9827,1.32689
GemmTunableOp_Half_TN,tn_128256_132_4096,Gemm_Hipblaslt_TN_9775,0.430288
GemmTunableOp_Half_TN,tn_6144_4463_4096,Gemm_Hipblaslt_TN_9188,0.380032
GemmTunableOp_Half_TN,tn_4096_1886_4096,Gemm_Hipblaslt_TN_9590,0.119881
GemmTunableOp_Half_TN,tn_6144_1723_4096,Gemm_Hipblaslt_TN_9570,0.152122
GemmTunableOp_Half_TN,tn_28672_1853_4096,Gemm_Hipblaslt_TN_9684,0.784377
GemmTunableOp_Half_TN,tn_4096_1807_14336,Gemm_Hipblaslt_TN_9268,0.401228
GemmTunableOp_Half_TN,tn_6144_216_4096,Gemm_Hipblaslt_TN_9495,0.0336647
GemmTunableOp_Half_TN,tn_6144_803_4096,Gemm_Rocblas_621286778,0.0871266
GemmTunableOp_Half_TN,tn_6144_3671_4096,Gemm_Hipblaslt_TN_9690,0.325585
GemmTunableOp_Half_TN,tn_4096_844_4096,Gemm_Hipblaslt_TN_9634,0.0656869
GemmTunableOp_Half_TN,tn_6144_917_4096,Gemm_Hipblaslt_TN_9163,0.0925873
GemmTunableOp_Half_TN,tn_6144_8156_4096,Gemm_Rocblas_621286750,0.663499
GemmTunableOp_Half_TN,tn_28672_2658_4096,Gemm_Hipblaslt_TN_9827,1.06559
GemmTunableOp_Half_TN,tn_4096_40_14336,Gemm_Hipblaslt_TN_8050,0.0312174
GemmTunableOp_Half_TN,tn_8192_1217_28672,Gemm_Hipblaslt_TN_9774,1.18152
GemmTunableOp_Half_TN,tn_28672_1759_4096,Gemm_Hipblaslt_TN_9223,0.712739
GemmTunableOp_Half_TN,tn_4096_916_14336,Gemm_Hipblaslt_TN_9604,0.231671
GemmTunableOp_Half_TN,tn_6144_1883_4096,Gemm_Hipblaslt_TN_9691,0.166044
GemmTunableOp_Half_TN,tn_128256_48_4096,Gemm_Hipblaslt_TN_9451,0.31089
GemmTunableOp_Half_TN,tn_6144_925_4096,Gemm_Hipblaslt_TN_9613,0.0931236
GemmTunableOp_Half_TN,tn_57344_1217_8192,Gemm_Hipblaslt_TN_9068,2.3135
GemmTunableOp_Half_TN,tn_4096_4483_14336,Gemm_Hipblaslt_TN_9826,0.925099
GemmTunableOp_Half_TN,tn_4096_2606_14336,Gemm_Hipblaslt_TN_9799,0.529977
GemmTunableOp_Half_TN,tn_4096_4471_4096,Gemm_Hipblaslt_TN_9926,0.263509
GemmTunableOp_Half_TN,tn_28672_966_4096,Gemm_Hipblaslt_TN_9863,0.420292
GemmTunableOp_Half_TN,tn_4096_1805_4096,Gemm_Hipblaslt_TN_9620,0.119461
GemmTunableOp_Half_TN,tn_6144_809_4096,Gemm_Rocblas_621294520,0.0871967
GemmTunableOp_Half_TN,tn_6144_3711_4096,Gemm_Rocblas_621286684,0.329002
GemmTunableOp_Half_TN,tn_8192_1256_8192,Gemm_Hipblaslt_TN_9799,0.302279
GemmTunableOp_Half_TN,tn_28672_1785_4096,Gemm_Hipblaslt_TN_9217,0.717268
GemmTunableOp_Half_TN,tn_4096_880_14336,Gemm_Hipblaslt_TN_9580,0.218598
GemmTunableOp_Half_TN,tn_28672_1723_4096,Gemm_Hipblaslt_TN_9217,0.706159
GemmTunableOp_Half_TN,tn_6144_921_4096,Gemm_Hipblaslt_TN_9613,0.093215
GemmTunableOp_Half_TN,tn_4096_7239_14336,Gemm_Hipblaslt_TN_9694,1.40476
GemmTunableOp_Half_TN,tn_6144_839_4096,Gemm_Hipblaslt_TN_9322,0.0894592
GemmTunableOp_Half_TN,tn_6144_2560_4096,Gemm_Hipblaslt_TN_9223,0.21557
GemmTunableOp_Half_TN,tn_28672_901_4096,Gemm_Hipblaslt_TN_9189,0.385437
GemmTunableOp_Half_TN,tn_4096_80_14336,Gemm_Hipblaslt_TN_8023,0.0398825
GemmTunableOp_Half_TN,tn_6144_890_4096,Gemm_Hipblaslt_TN_9613,0.0915806
GemmTunableOp_Half_TN,tn_4096_2734_4096,Gemm_Hipblaslt_TN_9674,0.163649
GemmTunableOp_Half_TN,tn_4096_200_4096,Gemm_Rocblas_621294173,0.0255943
GemmTunableOp_Half_TN,tn_128256_229_4096,Gemm_Rocblas_621286892,0.552905
GemmTunableOp_Half_TN,tn_4096_96_4096,Gemm_Rocblas_621286280,0.0155653
GemmTunableOp_Half_TN,tn_57344_112_8192,Gemm_Hipblaslt_TN_9491,0.340708
GemmTunableOp_Half_TN,tn_4096_240_4096,Gemm_Rocblas_621294168,0.0261924
GemmTunableOp_Half_TN,tn_4096_2572_14336,Gemm_Hipblaslt_TN_9799,0.532986
GemmTunableOp_Half_TN,tn_28672_1762_4096,Gemm_Hipblaslt_TN_9217,0.712197
GemmTunableOp_Half_TN,tn_6144_1805_4096,Gemm_Rocblas_621294425,0.163502
GemmTunableOp_Half_TN,tn_4096_8007_14336,Gemm_Hipblaslt_TN_9813,1.56393
GemmTunableOp_Half_TN,tn_4096_1614_4096,Gemm_Hipblaslt_TN_9671,0.105812
GemmTunableOp_Half_TN,tn_128256_12_4096,Gemm_Rocblas_621294224,0.27037
GemmTunableOp_Half_TN,tn_6144_838_4096,Gemm_Rocblas_621286778,0.0884778
GemmTunableOp_Half_TN,tn_128256_255_4096,Gemm_Rocblas_621294634,0.566281
GemmTunableOp_Half_TN,tn_28672_2763_4096,Gemm_Hipblaslt_TN_9223,1.16478
GemmTunableOp_Half_TN,tn_6144_96_4096,Gemm_Rocblas_621286280,0.0201477
GemmTunableOp_Half_TN,tn_128256_194_4096,Gemm_Hipblaslt_TN_9937,0.531592
GemmTunableOp_Half_TN,tn_4096_232_14336,Gemm_Hipblaslt_TN_9303,0.0719474
GemmTunableOp_Half_TN,tn_4096_200_14336,Gemm_Hipblaslt_TN_9363,0.0681435
GemmTunableOp_Half_TN,tn_28672_835_4096,Gemm_Hipblaslt_TN_9683,0.379942
GemmTunableOp_Half_TN,tn_28672_958_4096,Gemm_Hipblaslt_TN_9684,0.394323
GemmTunableOp_Half_TN,tn_4096_7299_4096,Gemm_Hipblaslt_TN_9853,0.412171
GemmTunableOp_Half_TN,tn_4096_2537_4096,Gemm_Hipblaslt_TN_9691,0.155867
GemmTunableOp_Half_TN,tn_28672_905_4096,Gemm_Hipblaslt_TN_9684,0.383324
GemmTunableOp_Half_TN,tn_4096_942_4096,Gemm_Hipblaslt_TN_9604,0.0683261
GemmTunableOp_Half_TN,tn_4096_2509_14336,Gemm_Hipblaslt_TN_9657,0.518525
GemmTunableOp_Half_TN,tn_4096_990_14336,Gemm_Hipblaslt_TN_9586,0.243927
GemmTunableOp_Half_TN,tn_4096_1841_14336,Gemm_Hipblaslt_TN_9137,0.405645
GemmTunableOp_Half_TN,tn_28672_1817_4096,Gemm_Hipblaslt_TN_9684,0.77539
GemmTunableOp_Half_TN,tn_28672_120_4096,Gemm_Hipblaslt_TN_9576,0.0704493
GemmTunableOp_Half_TN,tn_4096_804_14336,Gemm_Hipblaslt_TN_9131,0.212975
GemmTunableOp_Half_TN,tn_4096_803_14336,Gemm_Hipblaslt_TN_9147,0.214871
GemmTunableOp_Half_TN,tn_28672_240_4096,Gemm_Rocblas_621294221,0.123097
GemmTunableOp_Half_TN,tn_4096_256_14336,Gemm_Hipblaslt_TN_9303,0.0755357
GemmTunableOp_Half_TN,tn_6144_907_4096,Gemm_Hipblaslt_TN_9613,0.0923753
GemmTunableOp_Half_TN,tn_28672_988_4096,Gemm_Rocblas_621286760,0.429419
GemmTunableOp_Half_TN,tn_28672_2793_4096,Gemm_Rocblas_621286742,1.16165
GemmTunableOp_Half_TN,tn_28672_152_4096,Gemm_Hipblaslt_TN_9561,0.085886
GemmTunableOp_Half_TN,tn_4096_800_14336,Gemm_Hipblaslt_TN_9158,0.213365
GemmTunableOp_Half_TN,tn_28672_840_4096,Gemm_Hipblaslt_TN_9684,0.380319
GemmTunableOp_Half_TN,tn_4096_1673_14336,Gemm_Hipblaslt_TN_9164,0.362272
GemmTunableOp_Half_TN,tn_6144_1701_4096,Gemm_Hipblaslt_TN_9570,0.15146
GemmTunableOp_Half_TN,tn_8192_103_28672,Gemm_Hipblaslt_TN_8378,0.197012
GemmTunableOp_Half_TN,tn_28672_8154_4096,Gemm_Hipblaslt_TN_9903,3.19674
GemmTunableOp_Half_TN,tn_28672_821_4096,Gemm_Hipblaslt_TN_9684,0.37592
GemmTunableOp_Half_TN,tn_6144_1829_4096,Gemm_Hipblaslt_TN_9690,0.163353
GemmTunableOp_Half_TN,tn_28672_4463_4096,Gemm_Hipblaslt_TN_9904,1.75142
GemmTunableOp_Half_TN,tn_4096_1727_14336,Gemm_Hipblaslt_TN_9607,0.36457
GemmTunableOp_Half_TN,tn_8192_2760_28672,Gemm_Rocblas_621286581,2.53828
GemmTunableOp_Half_TN,tn_6144_1817_4096,Gemm_Rocblas_621294447,0.164348
GemmTunableOp_Half_TN,tn_4096_3402_4096,Gemm_Hipblaslt_TN_9814,0.19292
GemmTunableOp_Half_TN,tn_4096_801_4096,Gemm_Hipblaslt_TN_9158,0.0640429
GemmTunableOp_Half_TN,tn_28672_3571_4096,Gemm_Hipblaslt_TN_9827,1.35417
GemmTunableOp_Half_TN,tn_4096_3599_14336,Gemm_Hipblaslt_TN_9677,0.670276
GemmTunableOp_Half_TN,tn_8192_1319_8192,Gemm_Rocblas_621294425,0.320229
GemmTunableOp_Half_TN,tn_4096_8154_4096,Gemm_Hipblaslt_TN_9903,0.443382
GemmTunableOp_Half_TN,tn_10240_3162_8192,Gemm_Hipblaslt_TN_9815,0.878749
GemmTunableOp_Half_TN,tn_4096_808_14336,Gemm_Hipblaslt_TN_9158,0.209116
GemmTunableOp_Half_TN,tn_4096_938_4096,Gemm_Hipblaslt_TN_9604,0.0682168
GemmTunableOp_Half_TN,tn_4096_2872_14336,Gemm_Hipblaslt_TN_9799,0.566218
GemmTunableOp_Half_TN,tn_4096_983_4096,Gemm_Hipblaslt_TN_9604,0.0701913
GemmTunableOp_Half_TN,tn_4096_160_14336,Gemm_Hipblaslt_TN_7219,0.0546873
GemmTunableOp_Half_TN,tn_4096_2826_14336,Gemm_Hipblaslt_TN_9799,0.562281
GemmTunableOp_Half_TN,tn_4096_7283_14336,Gemm_Hipblaslt_TN_9694,1.41508
GemmTunableOp_Half_TN,tn_6144_192_4096,Gemm_Rocblas_621294171,0.0285502
GemmTunableOp_Half_TN,tn_28672_837_4096,Gemm_Hipblaslt_TN_9684,0.378004
GemmTunableOp_Half_TN,tn_4096_934_14336,Gemm_Hipblaslt_TN_9604,0.232971
GemmTunableOp_Half_TN,tn_28672_1931_4096,Gemm_Hipblaslt_TN_9846,0.814648
GemmTunableOp_Half_TN,tn_4096_2699_4096,Gemm_Hipblaslt_TN_9674,0.160653
GemmTunableOp_Half_TN,tn_6144_240_4096,Gemm_Hipblaslt_TN_9495,0.0348032
GemmTunableOp_Half_TN,tn_28672_925_4096,Gemm_Hipblaslt_TN_9683,0.389386
GemmTunableOp_Half_TN,tn_8192_132_28672,Gemm_Hipblaslt_TN_8099,0.220947
GemmTunableOp_Half_TN,tn_6144_7823_4096,Gemm_Hipblaslt_TN_9217,0.644713
GemmTunableOp_Half_TN,tn_4096_216_4096,Gemm_Rocblas_621294175,0.0260197
GemmTunableOp_Half_TN,tn_28672_1705_4096,Gemm_Hipblaslt_TN_9223,0.707024
GemmTunableOp_Half_TN,tn_8192_23_28672,Gemm_Rocblas_621294226,0.130607
GemmTunableOp_Half_TN,tn_28672_7937_4096,Gemm_Hipblaslt_TN_9930,3.10922
GemmTunableOp_Half_TN,tn_6144_865_4096,Gemm_Hipblaslt_TN_9613,0.0915857
GemmTunableOp_Half_TN,tn_28672_1893_4096,Gemm_Hipblaslt_TN_9684,0.785618
GemmTunableOp_Half_TN,tn_4096_7967_4096,Gemm_Rocblas_621294127,0.435532
GemmTunableOp_Half_TN,tn_10240_1281_8192,Gemm_Hipblaslt_TN_9697,0.361161
GemmTunableOp_Half_TN,tn_10240_1233_8192,Gemm_Hipblaslt_TN_9697,0.354068
GemmTunableOp_Half_TN,tn_4096_7266_4096,Gemm_Hipblaslt_TN_9743,0.399553
GemmTunableOp_Half_TN,tn_4096_2750_4096,Gemm_Hipblaslt_TN_9691,0.163661
GemmTunableOp_Half_TN,tn_4096_8054_14336,Gemm_Hipblaslt_TN_9753,1.56135
GemmTunableOp_Half_TN,tn_4096_1846_14336,Gemm_Hipblaslt_TN_9680,0.405597
GemmTunableOp_Half_TN,tn_4096_8110_14336,Gemm_Hipblaslt_TN_9753,1.57845
GemmTunableOp_Half_TN,tn_28672_8069_4096,Gemm_Hipblaslt_TN_159,3.14256
GemmTunableOp_Half_TN,tn_4096_851_14336,Gemm_Hipblaslt_TN_9580,0.218211
GemmTunableOp_Half_TN,tn_10240_3235_8192,Gemm_Hipblaslt_TN_9753,0.881785
GemmTunableOp_Half_TN,tn_4096_1739_4096,Gemm_Hipblaslt_TN_9605,0.115181
GemmTunableOp_Half_TN,tn_4096_851_4096,Gemm_Hipblaslt_TN_9604,0.0658981
GemmTunableOp_Half_TN,tn_8192_3715_28672,Default,3.23451
GemmTunableOp_Half_TN,tn_6144_1813_4096,Gemm_Hipblaslt_TN_9799,0.163516
GemmTunableOp_Half_TN,tn_4096_1883_4096,Gemm_Hipblaslt_TN_9620,0.122278
GemmTunableOp_Half_TN,tn_128256_227_4096,Gemm_Rocblas_621286892,0.549833
GemmTunableOp_Half_TN,tn_57344_4096_8192,Gemm_Hipblaslt_TN_9758,6.69594
GemmTunableOp_Half_TN,tn_57344_3206_8192,Gemm_Hipblaslt_TN_9803,5.51241
GemmTunableOp_Half_TN,tn_4096_1880_4096,Gemm_Hipblaslt_TN_9590,0.121798
GemmTunableOp_Half_TN,tn_28672_40_4096,Gemm_Hipblaslt_TN_9532,0.0485602
GemmTunableOp_Half_TN,tn_4096_1827_4096,Gemm_Hipblaslt_TN_9645,0.120766
GemmTunableOp_Half_TN,tn_32000_24_8192,Gemm_Rocblas_621294193,0.148821
GemmTunableOp_Half_TN,tn_28672_785_4096,Gemm_Hipblaslt_TN_9674,0.341566
GemmTunableOp_Half_TN,tn_6144_3556_4096,Gemm_Rocblas_621286753,0.312954
GemmTunableOp_Half_TN,tn_8192_3251_28672,Gemm_Hipblaslt_TN_9732,2.89042
GemmTunableOp_Half_TN,tn_4096_892_14336,Gemm_Hipblaslt_TN_9580,0.221451
GemmTunableOp_Half_TN,tn_28672_825_4096,Gemm_Hipblaslt_TN_9684,0.377859
GemmTunableOp_Half_TN,tn_6144_1672_4096,Gemm_Rocblas_621294306,0.152482
GemmTunableOp_Half_TN,tn_4096_943_14336,Gemm_Hipblaslt_TN_9604,0.234428
GemmTunableOp_Half_TN,tn_4096_951_14336,Gemm_Hipblaslt_TN_9604,0.234323
GemmTunableOp_Half_TN,tn_4096_88_14336,Gemm_Hipblaslt_TN_8146,0.0416625
GemmTunableOp_Half_TN,tn_4096_912_14336,Gemm_Hipblaslt_TN_9604,0.231429
GemmTunableOp_Half_TN,tn_4096_1742_14336,Gemm_Hipblaslt_TN_9645,0.393407
GemmTunableOp_Half_TN,tn_28672_947_4096,Gemm_Hipblaslt_TN_9683,0.393281
GemmTunableOp_Half_TN,tn_128256_189_4096,Gemm_Hipblaslt_TN_9683,0.494908
GemmTunableOp_Half_TN,tn_4096_936_4096,Gemm_Hipblaslt_TN_9604,0.0679288
GemmTunableOp_Half_TN,tn_28672_2786_4096,Gemm_Hipblaslt_TN_9876,1.1693
GemmTunableOp_Half_TN,tn_8192_4025_8192,Gemm_Hipblaslt_TN_9704,0.872824
GemmTunableOp_Half_TN,tn_4096_944_4096,Gemm_Hipblaslt_TN_9583,0.0687544
GemmTunableOp_Half_TN,tn_6144_877_4096,Gemm_Hipblaslt_TN_9613,0.0921153
GemmTunableOp_Half_TN,tn_128256_232_4096,Gemm_Rocblas_621286892,0.558475
GemmTunableOp_Half_TN,tn_4096_1785_4096,Gemm_Hipblaslt_TN_9645,0.117794
GemmTunableOp_Half_TN,tn_28672_911_4096,Gemm_Hipblaslt_TN_9189,0.38712
GemmTunableOp_Half_TN,tn_8192_3162_28672,Gemm_Hipblaslt_TN_9732,2.87674
GemmTunableOp_Half_TN,tn_4096_3752_4096,Gemm_Hipblaslt_TN_9827,0.211161
GemmTunableOp_Half_TN,tn_4096_2717_14336,Gemm_Hipblaslt_TN_9799,0.547467
GemmTunableOp_Half_TN,tn_6144_859_4096,Gemm_Rocblas_621294520,0.0887369
GemmTunableOp_Half_TN,tn_4096_1673_4096,Gemm_Hipblaslt_TN_9180,0.103146
GemmTunableOp_Half_TN,tn_28672_7857_4096,Gemm_Hipblaslt_TN_159,3.05309
GemmTunableOp_Half_TN,tn_4096_1831_14336,Gemm_Hipblaslt_TN_9137,0.403737
GemmTunableOp_Half_TN,tn_28672_809_4096,Gemm_Hipblaslt_TN_9684,0.378124
GemmTunableOp_Half_TN,tn_8192_1160_8192,Gemm_Hipblaslt_TN_9690,0.295248
GemmTunableOp_Half_TN,tn_6144_971_4096,Gemm_Hipblaslt_TN_9633,0.100313
GemmTunableOp_Half_TN,tn_8192_2664_28672,Gemm_Hipblaslt_TN_9774,2.40472
GemmTunableOp_Half_TN,tn_6144_823_4096,Gemm_Rocblas_621286778,0.0880001
GemmTunableOp_Half_TN,tn_4096_814_4096,Gemm_Hipblaslt_TN_9604,0.0645863
GemmTunableOp_Half_TN,tn_8192_1249_8192,Gemm_Hipblaslt_TN_9690,0.301675
GemmTunableOp_Half_TN,tn_8192_4000_8192,Gemm_Hipblaslt_TN_9768,0.868793
GemmTunableOp_Half_TN,tn_6144_942_4096,Gemm_Hipblaslt_TN_9613,0.0928985
GemmTunableOp_Half_TN,tn_6144_892_4096,Gemm_Hipblaslt_TN_9613,0.0930992
GemmTunableOp_Half_TN,tn_4096_956_14336,Gemm_Hipblaslt_TN_9634,0.235405
GemmTunableOp_Half_TN,tn_4096_144_14336,Gemm_Hipblaslt_TN_7234,0.0556792
GemmTunableOp_Half_TN,tn_6144_932_4096,Gemm_Hipblaslt_TN_9133,0.0934501
GemmTunableOp_Half_TN,tn_4096_885_14336,Gemm_Hipblaslt_TN_9580,0.218195
GemmTunableOp_Half_TN,tn_28672_819_4096,Gemm_Hipblaslt_TN_9684,0.377583
GemmTunableOp_Half_TN,tn_6144_911_4096,Gemm_Hipblaslt_TN_9561,0.0906812
GemmTunableOp_Half_TN,tn_8192_129_8192,Gemm_Hipblaslt_TN_9306,0.0575975
GemmTunableOp_Half_TN,tn_57344_1281_8192,Gemm_Hipblaslt_TN_9827,2.36543
GemmTunableOp_Half_TN,tn_4096_1897_4096,Gemm_Hipblaslt_TN_9590,0.122985
GemmTunableOp_Half_TN,tn_4096_2732_14336,Gemm_Hipblaslt_TN_9799,0.556484
GemmTunableOp_Half_TN,tn_4096_48_14336,Gemm_Hipblaslt_TN_7486,0.0325503
GemmTunableOp_Half_TN,tn_4096_72_14336,Gemm_Hipblaslt_TN_8023,0.0396019
GemmTunableOp_Half_TN,tn_28672_846_4096,Gemm_Hipblaslt_TN_9683,0.382346
GemmTunableOp_Half_TN,tn_4096_846_4096,Gemm_Hipblaslt_TN_9604,0.0655276
GemmTunableOp_Half_TN,tn_6144_829_4096,Gemm_Hipblaslt_TN_9148,0.088546
GemmTunableOp_Half_TN,tn_128256_142_4096,Gemm_Hipblaslt_TN_9108,0.439809
GemmTunableOp_Half_TN,tn_6144_1705_4096,Gemm_Rocblas_621286753,0.154923
GemmTunableOp_Half_TN,tn_128256_93_4096,Gemm_Hipblaslt_TN_9057,0.364041
GemmTunableOp_Half_TN,tn_28672_1763_4096,Gemm_Hipblaslt_TN_9191,0.716275
GemmStridedBatchedTunableOp_Half_TN,tn_872_872_128_B_32,Gemm_Hipblaslt_TN_150,0.0381842
GemmStridedBatchedTunableOp_Half_TN,tn_880_880_128_B_32,Gemm_Hipblaslt_TN_150,0.0378608
GemmStridedBatchedTunableOp_Half_TN,tn_906_906_128_B_32,Gemm_Hipblaslt_TN_6879,0.0516552
GemmStridedBatchedTunableOp_Half_TN,tn_956_956_128_B_32,Gemm_Hipblaslt_TN_7519,0.0533127
GemmStridedBatchedTunableOp_Half_TN,tn_873_873_128_B_32,Gemm_Rocblas_621294517,0.0469284
GemmStridedBatchedTunableOp_Half_TN,tn_836_836_128_B_32,Gemm_Rocblas_621294517,0.0444969
GemmStridedBatchedTunableOp_Half_TN,tn_901_901_128_B_32,Gemm_Rocblas_621286794,0.0515777
GemmStridedBatchedTunableOp_Half_TN,tn_958_958_128_B_32,Gemm_Rocblas_621286794,0.0534508
GemmStridedBatchedTunableOp_Half_TN,tn_935_935_128_B_32,Gemm_Hipblaslt_TN_6879,0.0522893
GemmStridedBatchedTunableOp_Half_TN,tn_936_936_128_B_32,Gemm_Hipblaslt_TN_149,0.0482956
GemmStridedBatchedTunableOp_Half_TN,tn_952_952_128_B_32,Gemm_Rocblas_621293994,0.0489551
GemmStridedBatchedTunableOp_Half_TN,tn_846_846_128_B_32,Gemm_Rocblas_621294635,0.0458263
GemmStridedBatchedTunableOp_Half_TN,tn_1112_1112_128_B_64,Gemm_Hipblaslt_TN_6879,0.113856
GemmStridedBatchedTunableOp_Half_TN,tn_1377_1377_128_B_64,Gemm_Rocblas_621286412,0.165406
GemmStridedBatchedTunableOp_Half_TN,tn_957_957_128_B_32,Gemm_Rocblas_621294536,0.0534863
GemmStridedBatchedTunableOp_Half_TN,tn_1080_1080_128_B_64,Gemm_Rocblas_621286397,0.107134
GemmStridedBatchedTunableOp_Half_TN,tn_815_815_128_B_32,Gemm_Rocblas_621294635,0.043229
GemmStridedBatchedTunableOp_Half_TN,tn_834_834_128_B_32,Gemm_Rocblas_621294635,0.0448043
GemmStridedBatchedTunableOp_Half_TN,tn_865_865_128_B_32,Gemm_Rocblas_621286774,0.0467548
GemmStridedBatchedTunableOp_Half_TN,tn_825_825_128_B_32,Gemm_Rocblas_621286776,0.0448057
GemmStridedBatchedTunableOp_Half_TN,tn_863_863_128_B_32,Gemm_Rocblas_621294635,0.0463298
GemmStridedBatchedTunableOp_Half_TN,tn_1393_1393_128_B_64,Gemm_Rocblas_621294109,0.166729
GemmStridedBatchedTunableOp_Half_TN,tn_1152_1152_128_B_64,Gemm_Hipblaslt_TN_9774,0.0995975
GemmStridedBatchedTunableOp_Half_TN,tn_1096_1096_128_B_64,Gemm_Rocblas_621286397,0.109656
GemmStridedBatchedTunableOp_Half_TN,tn_805_805_128_B_32,Gemm_Rocblas_621294635,0.0438892
GemmStridedBatchedTunableOp_Half_TN,tn_915_915_128_B_32,Gemm_Hipblaslt_TN_6879,0.0512523
GemmStridedBatchedTunableOp_Half_TN,tn_1105_1105_128_B_64,Gemm_Hipblaslt_TN_6879,0.112993
GemmStridedBatchedTunableOp_Half_TN,tn_843_843_128_B_32,Gemm_Hipblaslt_TN_7059,0.0455577
GemmStridedBatchedTunableOp_Half_TN,tn_1263_1263_128_B_64,Gemm_Hipblaslt_TN_6879,0.139281
GemmStridedBatchedTunableOp_Half_TN,tn_1313_1313_128_B_64,Gemm_Rocblas_621286412,0.152151
GemmStridedBatchedTunableOp_Half_TN,tn_1121_1121_128_B_64,Gemm_Hipblaslt_TN_6879,0.114654
GemmStridedBatchedTunableOp_Half_TN,tn_894_894_128_B_32,Gemm_Rocblas_621294517,0.0479263
GemmStridedBatchedTunableOp_Half_TN,tn_1318_1318_128_B_64,Gemm_Rocblas_621294109,0.152258
GemmStridedBatchedTunableOp_Half_TN,tn_811_811_128_B_32,Gemm_Rocblas_621294635,0.0432943
GemmStridedBatchedTunableOp_Half_TN,tn_829_829_128_B_32,Gemm_Rocblas_621294635,0.0433218
GemmStridedBatchedTunableOp_Half_TN,tn_896_896_128_B_32,Gemm_Hipblaslt_TN_150,0.0363049
GemmStridedBatchedTunableOp_Half_TN,tn_927_927_128_B_32,Gemm_Hipblaslt_TN_7059,0.0517687
GemmStridedBatchedTunableOp_Half_TN,tn_881_881_128_B_32,Gemm_Rocblas_621286776,0.0478192
GemmStridedBatchedTunableOp_Half_TN,tn_1391_1391_128_B_64,Gemm_Rocblas_621294109,0.167147
GemmStridedBatchedTunableOp_Half_TN,tn_785_785_128_B_32,Gemm_Rocblas_621294635,0.041864
GemmStridedBatchedTunableOp_Half_TN,tn_1057_1057_128_B_64,Gemm_Rocblas_621294725,0.106631
GemmStridedBatchedTunableOp_Half_TN,tn_886_886_128_B_32,Gemm_Rocblas_621294516,0.0478753
GemmStridedBatchedTunableOp_Half_TN,tn_856_856_128_B_32,Gemm_Hipblaslt_TN_150,0.0375337
GemmStridedBatchedTunableOp_Half_TN,tn_1341_1341_128_B_64,Gemm_Rocblas_621294109,0.156925
GemmStridedBatchedTunableOp_Half_TN,tn_853_853_128_B_32,Gemm_Rocblas_621294516,0.0460937
GemmStridedBatchedTunableOp_Half_TN,tn_1361_1361_128_B_64,Gemm_Rocblas_621286412,0.161555
GemmStridedBatchedTunableOp_Half_TN,tn_978_978_128_B_32,Gemm_Hipblaslt_TN_9351,0.05254
GemmStridedBatchedTunableOp_Half_TN,tn_1374_1374_128_B_64,Gemm_Rocblas_621294109,0.160888
GemmStridedBatchedTunableOp_Half_TN,tn_1351_1351_128_B_64,Gemm_Rocblas_621294109,0.157246
GemmStridedBatchedTunableOp_Half_TN,tn_1264_1264_128_B_64,Gemm_Rocblas_621286397,0.127253
GemmStridedBatchedTunableOp_Half_TN,tn_1287_1287_128_B_64,Gemm_Rocblas_621294109,0.149548
GemmStridedBatchedTunableOp_Half_TN,tn_919_919_128_B_32,Gemm_Hipblaslt_TN_7519,0.0507701
GemmStridedBatchedTunableOp_Half_TN,tn_1151_1151_128_B_64,Gemm_Hipblaslt_TN_6879,0.118413
GemmStridedBatchedTunableOp_Half_TN,tn_808_808_128_B_32,Gemm_Hipblaslt_TN_150,0.0372682
GemmStridedBatchedTunableOp_Half_TN,tn_841_841_128_B_32,Gemm_Rocblas_621286775,0.0457504
GemmStridedBatchedTunableOp_Half_TN,tn_1217_1217_128_B_64,Gemm_Rocblas_621294106,0.1318
GemmStridedBatchedTunableOp_Half_TN,tn_973_973_128_B_32,Gemm_Hipblaslt_TN_9351,0.0533758
GemmStridedBatchedTunableOp_Half_TN,tn_1389_1389_128_B_64,Gemm_Rocblas_621286412,0.168405
GemmStridedBatchedTunableOp_Half_TN,tn_824_824_128_B_32,Gemm_Hipblaslt_TN_150,0.0379583
GemmStridedBatchedTunableOp_Half_TN,tn_795_795_128_B_32,Gemm_Rocblas_621294635,0.042564
GemmStridedBatchedTunableOp_Half_TN,tn_950_950_128_B_32,Gemm_Rocblas_621286794,0.0536705
GemmStridedBatchedTunableOp_Half_TN,tn_1144_1144_128_B_64,Gemm_Hipblaslt_TN_6879,0.117918
GemmStridedBatchedTunableOp_Half_TN,tn_849_849_128_B_32,Gemm_Rocblas_621294635,0.0454471
GemmStridedBatchedTunableOp_Half_TN,tn_818_818_128_B_32,Gemm_Rocblas_621294635,0.0433037
GemmStridedBatchedTunableOp_Half_TN,tn_965_965_128_B_32,Gemm_Hipblaslt_TN_7483,0.0521615
GemmStridedBatchedTunableOp_Half_TN,tn_940_940_128_B_32,Gemm_Rocblas_621294536,0.0527702
GemmStridedBatchedTunableOp_Half_TN,tn_878_878_128_B_32,Gemm_Rocblas_621286775,0.047432
GemmStridedBatchedTunableOp_Half_TN,tn_797_797_128_B_32,Gemm_Rocblas_621294635,0.0420907
GemmStridedBatchedTunableOp_Half_TN,tn_917_917_128_B_32,Gemm_Hipblaslt_TN_6879,0.0517947
GemmStridedBatchedTunableOp_Half_TN,tn_995_995_128_B_32,Gemm_Rocblas_621294536,0.0533244
GemmStridedBatchedTunableOp_Half_TN,tn_897_897_128_B_32,Gemm_Hipblaslt_TN_9508,0.0506307
GemmStridedBatchedTunableOp_Half_TN,tn_874_874_128_B_32,Gemm_Rocblas_621286775,0.0471582
GemmStridedBatchedTunableOp_Half_TN,tn_985_985_128_B_32,Gemm_Hipblaslt_TN_9351,0.0536165
GemmStridedBatchedTunableOp_Half_TN,tn_931_931_128_B_32,Gemm_Hipblaslt_TN_6879,0.0526935
GemmStridedBatchedTunableOp_Half_TN,tn_924_924_128_B_32,Gemm_Hipblaslt_TN_6879,0.0511074
GemmTunableOp_Half_TN,tn_6144_830_4096,Gemm_Rocblas_621294520,0.0897671
GemmTunableOp_Half_TN,tn_6144_1900_4096,Gemm_Hipblaslt_TN_9691,0.165827
GemmTunableOp_Half_TN,tn_4096_877_14336,Gemm_Hipblaslt_TN_9580,0.220793
GemmTunableOp_Half_TN,tn_4096_877_4096,Gemm_Hipblaslt_TN_9547,0.0650748
GemmTunableOp_Half_TN,tn_4096_2793_4096,Gemm_Hipblaslt_TN_9689,0.166299
GemmTunableOp_Half_TN,tn_4096_1854_4096,Gemm_Hipblaslt_TN_9645,0.122211
GemmTunableOp_Half_TN,tn_4096_959_14336,Gemm_Hipblaslt_TN_9604,0.235684
GemmTunableOp_Half_TN,tn_4096_913_4096,Gemm_Hipblaslt_TN_9634,0.0687763
GemmTunableOp_Half_TN,tn_4096_901_14336,Gemm_Hipblaslt_TN_9604,0.232667
GemmTunableOp_Half_TN,tn_4096_944_14336,Gemm_Hipblaslt_TN_9576,0.235408
GemmTunableOp_Half_TN,tn_4096_1931_4096,Gemm_Hipblaslt_TN_9590,0.122915
GemmTunableOp_Half_TN,tn_28672_4242_4096,Gemm_Hipblaslt_TN_9827,1.62161
GemmTunableOp_Half_TN,tn_28672_7944_4096,Gemm_Hipblaslt_TN_159,3.09664
GemmTunableOp_Half_TN,tn_4096_2602_4096,Gemm_Hipblaslt_TN_9799,0.160876
GemmTunableOp_Half_TN,tn_4096_850_14336,Gemm_Hipblaslt_TN_9580,0.220945
GemmTunableOp_Half_TN,tn_4096_815_4096,Gemm_Hipblaslt_TN_9158,0.0634265
GemmTunableOp_Half_TN,tn_4096_2872_4096,Gemm_Hipblaslt_TN_9672,0.167276
GemmTunableOp_Half_TN,tn_4096_2628_14336,Gemm_Hipblaslt_TN_9799,0.538619
GemmTunableOp_Half_TN,tn_4096_922_14336,Gemm_Hipblaslt_TN_9634,0.232225
GemmTunableOp_Half_TN,tn_4096_112_14336,Gemm_Hipblaslt_TN_8114,0.0492108
GemmTunableOp_Half_TN,tn_6144_3569_4096,Gemm_Hipblaslt_TN_9570,0.314386
GemmTunableOp_Half_TN,tn_4096_878_14336,Gemm_Hipblaslt_TN_9580,0.22056
GemmTunableOp_Half_TN,tn_28672_104_4096,Gemm_Hipblaslt_TN_9550,0.0686462
GemmTunableOp_Half_TN,tn_4096_8007_4096,Gemm_Rocblas_621294127,0.438323
GemmTunableOp_Half_TN,tn_28672_1791_4096,Gemm_Hipblaslt_TN_9217,0.721303
GemmTunableOp_Half_TN,tn_4096_1791_4096,Gemm_Hipblaslt_TN_9134,0.118094
GemmTunableOp_Half_TN,tn_28672_906_4096,Gemm_Hipblaslt_TN_9684,0.385455
GemmTunableOp_Half_TN,tn_4096_861_4096,Gemm_Hipblaslt_TN_9604,0.0667554
GemmTunableOp_Half_TN,tn_6144_848_4096,Gemm_Rocblas_621294520,0.089651
GemmTunableOp_Half_TN,tn_28672_1835_4096,Gemm_Hipblaslt_TN_9832,0.777815
GemmTunableOp_Half_TN,tn_28672_3569_4096,Gemm_Hipblaslt_TN_9827,1.35328
GemmTunableOp_Half_TN,tn_4096_1944_4096,Gemm_Hipblaslt_TN_9645,0.123585
GemmTunableOp_Half_TN,tn_4096_1600_14336,Gemm_Hipblaslt_TN_9180,0.356255
GemmTunableOp_Half_TN,tn_4096_887_14336,Gemm_Hipblaslt_TN_9580,0.22252
GemmTunableOp_Half_TN,tn_4096_2805_14336,Gemm_Hipblaslt_TN_9690,0.566208
GemmTunableOp_Half_TN,tn_28672_2560_4096,Gemm_Hipblaslt_TN_9846,1.02629
GemmTunableOp_Half_TN,tn_6144_922_4096,Gemm_Hipblaslt_TN_9253,0.0931573
GemmTunableOp_Half_TN,tn_28672_811_4096,Gemm_Hipblaslt_TN_9684,0.377275
GemmTunableOp_Half_TN,tn_28672_1798_4096,Gemm_Hipblaslt_TN_9684,0.776389
GemmTunableOp_Half_TN,tn_4096_2571_14336,Gemm_Hipblaslt_TN_9799,0.537179
GemmTunableOp_Half_TN,tn_28672_3565_4096,Gemm_Hipblaslt_TN_9827,1.35157
GemmTunableOp_Half_TN,tn_4096_1695_14336,Gemm_Hipblaslt_TN_9265,0.364951
GemmTunableOp_Half_TN,tn_28672_2719_4096,Gemm_Rocblas_621286590,1.14644
GemmTunableOp_Half_TN,tn_6144_850_4096,Gemm_Rocblas_621294520,0.0887509
GemmTunableOp_Half_TN,tn_6144_2699_4096,Gemm_Hipblaslt_TN_9565,0.252118
GemmTunableOp_Half_TN,tn_57344_113_8192,Gemm_Hipblaslt_TN_9486,0.340777
GemmTunableOp_Half_TN,tn_28672_815_4096,Gemm_Hipblaslt_TN_9697,0.37851
GemmTunableOp_Half_TN,tn_6144_816_4096,Gemm_Hipblaslt_TN_9322,0.0887663
GemmTunableOp_Half_TN,tn_4096_1827_14336,Gemm_Hipblaslt_TN_9268,0.404341
GemmTunableOp_Half_TN,tn_4096_816_4096,Gemm_Hipblaslt_TN_9158,0.0634227
GemmTunableOp_Half_TN,tn_10240_1104_8192,Gemm_Hipblaslt_TN_9211,0.318534
GemmTunableOp_Half_TN,tn_4096_800_4096,Gemm_Hipblaslt_TN_9158,0.0623792
GemmTunableOp_Half_TN,tn_28672_1755_4096,Gemm_Hipblaslt_TN_9220,0.72012
GemmTunableOp_Half_TN,tn_4096_3447_4096,Gemm_Hipblaslt_TN_9221,0.194914
GemmTunableOp_Half_TN,tn_28672_959_4096,Gemm_Hipblaslt_TN_9684,0.392083
GemmTunableOp_Half_TN,tn_128256_54_4096,Gemm_Hipblaslt_TN_9097,0.337335
GemmTunableOp_Half_TN,tn_4096_939_14336,Gemm_Hipblaslt_TN_9604,0.235516
GemmTunableOp_Half_TN,tn_6144_1831_4096,Gemm_Hipblaslt_TN_9672,0.164387
GemmTunableOp_Half_TN,tn_4096_926_4096,Gemm_Hipblaslt_TN_9170,0.0685921
GemmTunableOp_Half_TN,tn_4096_1737_14336,Gemm_Hipblaslt_TN_9645,0.393952
GemmTunableOp_Half_TN,tn_28672_1822_4096,Gemm_Hipblaslt_TN_9684,0.778512
GemmTunableOp_Half_TN,tn_8192_13_8192,Gemm_Hipblaslt_TN_9392,0.0306344
GemmTunableOp_Half_TN,tn_28672_2682_4096,Gemm_Hipblaslt_TN_9827,1.08025
GemmTunableOp_Half_TN,tn_28672_832_4096,Gemm_Hipblaslt_TN_9684,0.37693
GemmTunableOp_Half_TN,tn_10240_4082_8192,Gemm_Hipblaslt_TN_9743,1.14091
GemmTunableOp_Half_TN,tn_6144_992_4096,Gemm_Hipblaslt_TN_9633,0.10245
GemmTunableOp_Half_TN,tn_6144_1694_4096,Gemm_Hipblaslt_TN_9570,0.153596
GemmTunableOp_Half_TN,tn_28672_851_4096,Gemm_Hipblaslt_TN_9683,0.380285
GemmTunableOp_Half_TN,tn_6144_1746_4096,Gemm_Hipblaslt_TN_9691,0.159332
GemmTunableOp_Half_TN,tn_4096_825_4096,Gemm_Hipblaslt_TN_9158,0.06491
GemmTunableOp_Half_TN,tn_4096_1913_14336,Gemm_Hipblaslt_TN_9645,0.415752
GemmTunableOp_Half_TN,tn_28672_3599_4096,Gemm_Hipblaslt_TN_9828,1.43365
GemmTunableOp_Half_TN,tn_4096_972_4096,Gemm_Hipblaslt_TN_9604,0.0686915
GemmTunableOp_Half_TN,tn_28672_3556_4096,Gemm_Hipblaslt_TN_9827,1.35011
GemmTunableOp_Half_TN,tn_128256_158_4096,Gemm_Hipblaslt_TN_9808,0.461346
GemmTunableOp_Half_TN,tn_8192_93_28672,Gemm_Hipblaslt_TN_8899,0.18903
GemmTunableOp_Half_TN,tn_6144_184_4096,Gemm_Rocblas_621294171,0.02927
GemmTunableOp_Half_TN,tn_4096_852_14336,Gemm_Hipblaslt_TN_9574,0.218482
GemmTunableOp_Half_TN,tn_128256_150_4096,Gemm_Hipblaslt_TN_9108,0.460123
GemmTunableOp_Half_TN,tn_128256_216_4096,Gemm_Hipblaslt_TN_9908,0.555913
GemmTunableOp_Half_TN,tn_128256_89_4096,Gemm_Hipblaslt_TN_9057,0.368667
GemmTunableOp_Half_TN,tn_128256_62_4096,Gemm_Hipblaslt_TN_9146,0.340137
GemmTunableOp_Half_TN,tn_10240_3203_8192,Gemm_Hipblaslt_TN_9815,0.879725
GemmTunableOp_Half_TN,tn_28672_2785_4096,Gemm_Rocblas_621286590,1.15933
GemmTunableOp_Half_TN,tn_28672_1666_4096,Gemm_Hipblaslt_TN_9184,0.701004
GemmTunableOp_Half_TN,tn_128256_37_4096,Gemm_Hipblaslt_TN_9451,0.30651
GemmTunableOp_Half_TN,tn_128256_16_4096,Gemm_Rocblas_621294224,0.281873
GemmTunableOp_Half_TN,tn_128256_10_4096,Gemm_Hipblaslt_TN_9405,0.277866
GemmTunableOp_Half_TN,tn_57344_135_8192,Gemm_Hipblaslt_TN_9333,0.388565
GemmTunableOp_Half_TN,tn_28672_888_4096,Gemm_Hipblaslt_TN_9683,0.384061
GemmTunableOp_Half_TN,tn_8192_1121_28672,Gemm_Hipblaslt_TN_9774,1.11189
GemmTunableOp_Half_TN,tn_8192_3162_8192,Gemm_Hipblaslt_TN_9697,0.716708
GemmTunableOp_Half_TN,tn_6144_8069_4096,Gemm_Rocblas_621286693,0.661448
GemmTunableOp_Half_TN,tn_10240_2802_8192,Gemm_Hipblaslt_TN_9743,0.776046
GemmTunableOp_Half_TN,tn_10240_16_8192,Gemm_Hipblaslt_TN_9411,0.0371934
GemmTunableOp_Half_TN,tn_8192_114_28672,Gemm_Hipblaslt_TN_8378,0.207531
GemmTunableOp_Half_TN,tn_8192_2551_8192,Gemm_Rocblas_621294426,0.612792
GemmTunableOp_Half_TN,tn_8192_123_28672,Gemm_Hipblaslt_TN_8378,0.20943
GemmTunableOp_Half_TN,tn_8192_119_28672,Gemm_Hipblaslt_TN_8378,0.208589
GemmTunableOp_Half_TN,tn_128256_233_4096,Gemm_Rocblas_621294634,0.569283
GemmTunableOp_Half_TN,tn_8192_1280_28672,Gemm_Rocblas_621286667,1.19832
GemmTunableOp_Half_TN,tn_4096_937_14336,Gemm_Hipblaslt_TN_9634,0.233565
GemmTunableOp_Half_TN,tn_4096_8156_4096,Gemm_Hipblaslt_TN_9655,0.444579
GemmTunableOp_Half_TN,tn_8192_120_8192,Gemm_Hipblaslt_TN_8891,0.05219
GemmTunableOp_Half_TN,tn_8192_118_8192,Gemm_Hipblaslt_TN_8891,0.0524721
GemmTunableOp_Half_TN,tn_28672_1757_4096,Gemm_Hipblaslt_TN_9223,0.712453
GemmTunableOp_Half_TN,tn_10240_1217_8192,Gemm_Hipblaslt_TN_9743,0.354533
GemmTunableOp_Half_TN,tn_8192_3603_8192,Gemm_Hipblaslt_TN_9814,0.787833
GemmTunableOp_Half_TN,tn_4096_8070_4096,Gemm_Hipblaslt_TN_9704,0.441845
GemmTunableOp_Half_TN,tn_8192_131_28672,Gemm_Hipblaslt_TN_7251,0.222381
GemmTunableOp_Half_TN,tn_4096_968_14336,Gemm_Hipblaslt_TN_9170,0.240678
GemmTunableOp_Half_TN,tn_57344_1104_8192,Gemm_Hipblaslt_TN_9793,2.06114
GemmTunableOp_Half_TN,tn_57344_3251_8192,Gemm_Hipblaslt_TN_9803,5.59729
GemmTunableOp_Half_TN,tn_6144_849_4096,Gemm_Hipblaslt_TN_9613,0.090817
GemmTunableOp_Half_TN,tn_28672_1828_4096,Gemm_Hipblaslt_TN_9684,0.780625
GemmTunableOp_Half_TN,tn_8192_19_8192,Gemm_Hipblaslt_TN_9410,0.0324077
GemmTunableOp_Half_TN,tn_4096_809_4096,Gemm_Hipblaslt_TN_9131,0.0635899
GemmTunableOp_Half_TN,tn_4096_854_4096,Gemm_Hipblaslt_TN_9352,0.0669493
GemmTunableOp_Half_TN,tn_4096_8054_4096,Gemm_Rocblas_621294127,0.439604
GemmTunableOp_Half_TN,tn_4096_893_14336,Gemm_Hipblaslt_TN_9580,0.222161
GemmTunableOp_Half_TN,tn_57344_102_8192,Gemm_Hipblaslt_TN_9486,0.337771
GemmTunableOp_Half_TN,tn_10240_1153_8192,Gemm_Hipblaslt_TN_9798,0.345579
GemmTunableOp_Half_TN,tn_8192_2962_28672,Gemm_Rocblas_621294314,2.69054
GemmTunableOp_Half_TN,tn_6144_1798_4096,Gemm_Hipblaslt_TN_9691,0.163338
GemmTunableOp_Half_TN,tn_57344_118_8192,Gemm_Hipblaslt_TN_9486,0.346333
GemmTunableOp_Half_TN,tn_28672_16_4096,Gemm_Rocblas_621294053,0.0449732
GemmTunableOp_Half_TN,tn_8192_24_8192,Gemm_Hipblaslt_TN_9410,0.0328916
GemmTunableOp_Half_TN,tn_8192_1153_28672,Gemm_Hipblaslt_TN_9774,1.14809
GemmTunableOp_Half_TN,tn_10240_128_8192,Gemm_Rocblas_621294504,0.0610155
GemmTunableOp_Half_TN,tn_128256_9_4096,Gemm_Hipblaslt_TN_9405,0.2772
GemmTunableOp_Half_TN,tn_28672_7952_4096,Gemm_Hipblaslt_TN_159,3.11424
GemmTunableOp_Half_TN,tn_28672_2628_4096,Gemm_Hipblaslt_TN_9827,1.06129
GemmTunableOp_Half_TN,tn_8192_3139_8192,Gemm_Hipblaslt_TN_9697,0.719695
GemmTunableOp_Half_TN,tn_57344_3859_8192,Gemm_Rocblas_621294634,6.4785
GemmTunableOp_Half_TN,tn_128256_185_4096,Gemm_Hipblaslt_TN_9707,0.507775
GemmTunableOp_Half_TN,tn_4096_905_14336,Gemm_Hipblaslt_TN_9634,0.232555
GemmTunableOp_Half_TN,tn_32000_113_8192,Gemm_Rocblas_621294507,0.218305
GemmTunableOp_Half_TN,tn_10240_25_8192,Gemm_Hipblaslt_TN_9415,0.0399426
GemmTunableOp_Half_TN,tn_4096_2648_4096,Gemm_Hipblaslt_TN_9672,0.15928
GemmTunableOp_Half_TN,tn_8192_121_8192,Gemm_Rocblas_621294504,0.0556333
GemmTunableOp_Half_TN,tn_4096_7239_4096,Gemm_Hipblaslt_TN_9814,0.400816
GemmTunableOp_Half_TN,tn_4096_1775_4096,Gemm_Hipblaslt_TN_9605,0.118246
GemmTunableOp_Half_TN,tn_4096_1744_14336,Gemm_Hipblaslt_TN_9645,0.394476
GemmTunableOp_Half_TN,tn_6144_2636_4096,Gemm_Hipblaslt_TN_9827,0.217167
GemmTunableOp_Half_TN,tn_8192_115_8192,Gemm_Rocblas_621294504,0.0536363
GemmTunableOp_Half_TN,tn_128256_121_4096,Gemm_Hipblaslt_TN_9061,0.414712
GemmTunableOp_Half_TN,tn_28672_128_4096,Gemm_Rocblas_621286473,0.0694913
GemmTunableOp_Half_TN,tn_128256_205_4096,Gemm_Hipblaslt_TN_9908,0.551317
GemmTunableOp_Half_TN,tn_8192_21_8192,Gemm_Hipblaslt_TN_9410,0.0325584
GemmTunableOp_Half_TN,tn_8192_3000_8192,Gemm_Rocblas_621286580,0.674448
GemmTunableOp_Half_TN,tn_6144_946_4096,Gemm_Hipblaslt_TN_9163,0.0934312
GemmTunableOp_Half_TN,tn_8192_2000_28672,Gemm_Hipblaslt_TN_9840,1.746
GemmTunableOp_Half_TN,tn_4096_2517_4096,Gemm_Hipblaslt_TN_9691,0.156982
GemmTunableOp_Half_TN,tn_4096_136_4096,Gemm_Rocblas_621286443,0.0221768
GemmTunableOp_Half_TN,tn_57344_1256_8192,Gemm_Hipblaslt_TN_9827,2.34757
GemmTunableOp_Half_TN,tn_8192_3475_28672,Gemm_Rocblas_621294329,3.00844
GemmTunableOp_Half_TN,tn_32000_117_8192,Gemm_Rocblas_621294212,0.218904
GemmTunableOp_Half_TN,tn_8192_25_8192,Gemm_Hipblaslt_TN_9410,0.0330938
GemmTunableOp_Half_TN,tn_6144_1794_4096,Gemm_Hipblaslt_TN_9182,0.163182
GemmTunableOp_Half_TN,tn_6144_801_4096,Gemm_Rocblas_621294520,0.0889874
GemmTunableOp_Half_TN,tn_4096_3402_14336,Gemm_Hipblaslt_TN_9697,0.659737
GemmTunableOp_Half_TN,tn_10240_1008_8192,Gemm_Rocblas_621294309,0.297875
GemmTunableOp_Half_TN,tn_128256_182_4096,Gemm_Hipblaslt_TN_9683,0.504929
GemmTunableOp_Half_TN,tn_6144_1783_4096,Gemm_Hipblaslt_TN_9691,0.162723
GemmTunableOp_Half_TN,tn_128256_230_4096,Gemm_Rocblas_621294634,0.565996
GemmTunableOp_Half_TN,tn_6144_104_4096,Gemm_Rocblas_621286440,0.0235432
GemmTunableOp_Half_TN,tn_57344_2962_8192,Gemm_Hipblaslt_TN_9816,5.02502
GemmTunableOp_Half_TN,tn_128256_109_4096,Gemm_Rocblas_621294762,0.407026
GemmTunableOp_Half_TN,tn_8192_1271_28672,Gemm_Hipblaslt_TN_9774,1.19888
GemmTunableOp_Half_TN,tn_4096_7953_4096,Gemm_Hipblaslt_TN_9813,0.436196
GemmTunableOp_Half_TN,tn_8192_2041_8192,Gemm_Hipblaslt_TN_9763,0.478236
GemmTunableOp_Half_TN,tn_8192_116_28672,Gemm_Hipblaslt_TN_8378,0.207587
GemmTunableOp_Half_TN,tn_8192_1321_8192,Gemm_Hipblaslt_TN_9697,0.315805
GemmTunableOp_Half_TN,tn_28672_256_4096,Gemm_Rocblas_621286584,0.123424
GemmTunableOp_Half_TN,tn_4096_940_4096,Gemm_Hipblaslt_TN_9604,0.0702963
GemmTunableOp_Half_TN,tn_4096_1762_4096,Gemm_Hipblaslt_TN_9645,0.11695
GemmTunableOp_Half_TN,tn_10240_135_8192,Gemm_Hipblaslt_TN_9367,0.0681211
GemmTunableOp_Half_TN,tn_28672_830_4096,Gemm_Hipblaslt_TN_9684,0.37644
GemmTunableOp_Half_TN,tn_4096_1757_4096,Gemm_Hipblaslt_TN_9329,0.116802
GemmTunableOp_Half_TN,tn_128256_167_4096,Gemm_Hipblaslt_TN_9752,0.499608
GemmTunableOp_Half_TN,tn_4096_840_14336,Gemm_Hipblaslt_TN_9574,0.220736
GemmTunableOp_Half_TN,tn_4096_4242_14336,Gemm_Hipblaslt_TN_9813,0.76782
GemmTunableOp_Half_TN,tn_8192_123_8192,Gemm_Hipblaslt_TN_8891,0.0553319
GemmTunableOp_Half_TN,tn_10240_100_8192,Gemm_Hipblaslt_TN_8892,0.0608963
GemmTunableOp_Half_TN,tn_8192_1297_28672,Gemm_Hipblaslt_TN_9774,1.21069
GemmTunableOp_Half_TN,tn_8192_3626_28672,Gemm_Hipblaslt_TN_9732,3.06046
GemmTunableOp_Half_TN,tn_57344_3491_8192,Gemm_Hipblaslt_TN_159,5.77898
GemmTunableOp_Half_TN,tn_4096_3571_14336,Gemm_Hipblaslt_TN_9192,0.679072
GemmTunableOp_Half_TN,tn_4096_1854_14336,Gemm_Hipblaslt_TN_9268,0.406951
GemmTunableOp_Half_TN,tn_128256_241_4096,Gemm_Rocblas_621294634,0.576479
GemmTunableOp_Half_TN,tn_10240_1319_8192,Gemm_Hipblaslt_TN_9697,0.365986
GemmTunableOp_Half_TN,tn_4096_1815_14336,Gemm_Hipblaslt_TN_9680,0.402746
GemmTunableOp_Half_TN,tn_8192_116_8192,Gemm_Hipblaslt_TN_8891,0.053378
GemmTunableOp_Half_TN,tn_8192_2859_28672,Gemm_Hipblaslt_TN_9709,2.61745
GemmTunableOp_Half_TN,tn_128256_165_4096,Gemm_Hipblaslt_TN_9752,0.498109
GemmTunableOp_Half_TN,tn_4096_1672_14336,Gemm_Hipblaslt_TN_9265,0.363577
GemmTunableOp_Half_TN,tn_6144_160_4096,Gemm_Rocblas_621286440,0.0282604
GemmTunableOp_Half_TN,tn_4096_831_14336,Gemm_Hipblaslt_TN_9147,0.215026
GemmTunableOp_Half_TN,tn_8192_1160_28672,Gemm_Hipblaslt_TN_9774,1.15442
GemmTunableOp_Half_TN,tn_10240_4096_8192,Gemm_Hipblaslt_TN_9743,1.13185
GemmTunableOp_Half_TN,tn_128256_105_4096,Gemm_Hipblaslt_TN_9061,0.40345
GemmTunableOp_Half_TN,tn_6144_168_4096,Gemm_Rocblas_621286443,0.0288327
GemmTunableOp_Half_TN,tn_4096_893_4096,Gemm_Hipblaslt_TN_9170,0.0681549
GemmTunableOp_Half_TN,tn_4096_104_4096,Gemm_Rocblas_621286436,0.0173471
GemmTunableOp_Half_TN,tn_57344_123_8192,Gemm_Hipblaslt_TN_9491,0.349287
GemmTunableOp_Half_TN,tn_6144_923_4096,Gemm_Hipblaslt_TN_9613,0.0934697
GemmTunableOp_Half_TN,tn_28672_7823_4096,Gemm_Hipblaslt_TN_159,2.96344
GemmTunableOp_Half_TN,tn_10240_3619_8192,Gemm_Hipblaslt_TN_9814,1.0339
GemmTunableOp_Half_TN,tn_4096_2722_14336,Gemm_Hipblaslt_TN_9672,0.562038
GemmTunableOp_Half_TN,tn_8192_3859_8192,Gemm_Hipblaslt_TN_9655,0.850041
GemmTunableOp_Half_TN,tn_10240_1000_8192,Gemm_Rocblas_621286569,0.297244
GemmTunableOp_Half_TN,tn_32000_13_8192,Gemm_Rocblas_621286321,0.143909
GemmTunableOp_Half_TN,tn_57344_2622_8192,Gemm_Rocblas_621294467,4.61891
GemmTunableOp_Half_TN,tn_8192_3178_8192,Gemm_Hipblaslt_TN_9743,0.724583
GemmTunableOp_Half_TN,tn_8192_1280_8192,Gemm_Rocblas_621286580,0.299105
GemmTunableOp_Half_TN,tn_57344_114_8192,Gemm_Hipblaslt_TN_9486,0.344791
GemmTunableOp_Half_TN,tn_32000_95_8192,Gemm_Hipblaslt_TN_9482,0.205736
GemmTunableOp_Half_TN,tn_57344_98_8192,Gemm_Hipblaslt_TN_9486,0.331306
GemmTunableOp_Half_TN,tn_6144_903_4096,Gemm_Hipblaslt_TN_9613,0.0935002
GemmTunableOp_Half_TN,tn_4096_2708_14336,Gemm_Hipblaslt_TN_9674,0.550037
GemmTunableOp_Half_TN,tn_6144_837_4096,Gemm_Rocblas_621294520,0.0893749
GemmTunableOp_Half_TN,tn_4096_982_14336,Gemm_Hipblaslt_TN_9052,0.245074
GemmTunableOp_Half_TN,tn_10240_2717_8192,Gemm_Hipblaslt_TN_9743,0.760265
GemmTunableOp_Half_TN,tn_8192_3379_28672,Gemm_Hipblaslt_TN_9732,2.94932
GemmTunableOp_Half_TN,tn_57344_2692_8192,Gemm_Hipblaslt_TN_9800,4.93451
GemmTunableOp_Half_TN,tn_6144_852_4096,Gemm_Hipblaslt_TN_9148,0.0910805
GemmTunableOp_Half_TN,tn_10240_23_8192,Gemm_Hipblaslt_TN_9415,0.0395172
GemmTunableOp_Half_TN,tn_8192_1268_28672,Gemm_Hipblaslt_TN_9774,1.20303
GemmTunableOp_Half_TN,tn_57344_3747_8192,Gemm_Hipblaslt_TN_9922,6.46363
GemmTunableOp_Half_TN,tn_10240_11_8192,Gemm_Hipblaslt_TN_9411,0.0372468
GemmTunableOp_Half_TN,tn_8192_1112_28672,Gemm_Hipblaslt_TN_9762,1.08855
GemmTunableOp_Half_TN,tn_28672_936_4096,Gemm_Hipblaslt_TN_9684,0.389308
GemmTunableOp_Half_TN,tn_128256_69_4096,Gemm_Hipblaslt_TN_9057,0.35866
GemmTunableOp_Half_TN,tn_10240_3140_8192,Gemm_Hipblaslt_TN_9753,0.874166
GemmTunableOp_Half_TN,tn_8192_1168_28672,Gemm_Hipblaslt_TN_9774,1.16916
GemmTunableOp_Half_TN,tn_57344_3274_8192,Gemm_Rocblas_621286901,5.84057
GemmTunableOp_Half_TN,tn_6144_3546_4096,Gemm_Hipblaslt_TN_9570,0.311469
GemmTunableOp_Half_TN,tn_128256_44_4096,Gemm_Hipblaslt_TN_9451,0.308847
GemmTunableOp_Half_TN,tn_10240_2760_8192,Gemm_Hipblaslt_TN_9697,0.76775
GemmTunableOp_Half_TN,tn_6144_1867_4096,Gemm_Hipblaslt_TN_9691,0.165395
GemmTunableOp_Half_TN,tn_57344_116_8192,Gemm_Rocblas_621286477,0.346684
GemmTunableOp_Half_TN,tn_8192_1367_28672,Gemm_Hipblaslt_TN_9799,1.28458
GemmTunableOp_Half_TN,tn_8192_102_8192,Gemm_Rocblas_621286764,0.0521877
GemmTunableOp_Half_TN,tn_10240_5_8192,Gemm_Hipblaslt_TN_9411,0.0369103
GemmTunableOp_Half_TN,tn_8192_133_28672,Gemm_Hipblaslt_TN_8662,0.220183
GemmTunableOp_Half_TN,tn_4096_894_4096,Gemm_Hipblaslt_TN_9634,0.0681237
GemmTunableOp_Half_TN,tn_57344_3546_8192,Gemm_Hipblaslt_TN_159,5.85999
GemmTunableOp_Half_TN,tn_57344_4035_8192,Gemm_Rocblas_621294636,6.65483
GemmTunableOp_Half_TN,tn_4096_8070_14336,Gemm_Hipblaslt_TN_9815,1.56591
GemmTunableOp_Half_TN,tn_57344_111_8192,Gemm_Hipblaslt_TN_9486,0.341513
GemmTunableOp_Half_TN,tn_28672_1739_4096,Gemm_Hipblaslt_TN_9223,0.70831
GemmTunableOp_Half_TN,tn_57344_20_8192,Gemm_Hipblaslt_TN_9424,0.249637
GemmTunableOp_Half_TN,tn_32000_10_8192,Gemm_Rocblas_621286321,0.141992
GemmTunableOp_Half_TN,tn_8192_3651_28672,Default,3.23243
GemmTunableOp_Half_TN,tn_8192_1271_8192,Gemm_Hipblaslt_TN_9690,0.302963
GemmTunableOp_Half_TN,tn_57344_3153_8192,Gemm_Hipblaslt_TN_9803,5.5145
GemmTunableOp_Half_TN,tn_6144_208_4096,Gemm_Hipblaslt_TN_9495,0.0330766
GemmTunableOp_Half_TN,tn_10240_3642_8192,Gemm_Hipblaslt_TN_9814,1.03661
GemmTunableOp_Half_TN,tn_8192_2728_28672,Gemm_Rocblas_621294319,2.522
GemmTunableOp_Half_TN,tn_57344_101_8192,Gemm_Hipblaslt_TN_9491,0.336806
GemmTunableOp_Half_TN,tn_4096_64_14336,Gemm_Hipblaslt_TN_7486,0.0365366
GemmTunableOp_Half_TN,tn_4096_1867_4096,Gemm_Hipblaslt_TN_9645,0.122473
GemmTunableOp_Half_TN,tn_57344_14_8192,Gemm_Hipblaslt_TN_9429,0.245878
GemmTunableOp_Half_TN,tn_4096_799_4096,Gemm_Hipblaslt_TN_9158,0.063865
GemmTunableOp_Half_TN,tn_28672_803_4096,Gemm_Hipblaslt_TN_9684,0.377902
GemmTunableOp_Half_TN,tn_8192_9_8192,Gemm_Hipblaslt_TN_9388,0.030357
GemmTunableOp_Half_TN,tn_6144_3599_4096,Gemm_Hipblaslt_TN_9570,0.315077
GemmTunableOp_Half_TN,tn_8192_94_8192,Gemm_Hipblaslt_TN_7093,0.0476435
GemmTunableOp_Half_TN,tn_128256_24_4096,Gemm_Rocblas_621294578,0.301942
GemmTunableOp_Half_TN,tn_28672_1834_4096,Gemm_Hipblaslt_TN_9684,0.779582
GemmTunableOp_Half_TN,tn_8192_4096_28672,Gemm_Rocblas_621294643,3.4486
GemmTunableOp_Half_TN,tn_10240_3498_8192,Gemm_Hipblaslt_TN_9799,1.00127
GemmTunableOp_Half_TN,tn_128256_197_4096,Gemm_Hipblaslt_TN_9908,0.545801
GemmTunableOp_Half_TN,tn_57344_4063_8192,Gemm_Hipblaslt_TN_9825,6.67087
GemmTunableOp_Half_TN,tn_8192_1185_8192,Gemm_Rocblas_621294425,0.294651
GemmTunableOp_Half_TN,tn_10240_3347_8192,Gemm_Hipblaslt_TN_9815,0.899636
GemmTunableOp_Half_TN,tn_4096_3418_4096,Gemm_Hipblaslt_TN_9821,0.192647
GemmTunableOp_Half_TN,tn_6144_2681_4096,Gemm_Hipblaslt_TN_9827,0.2186
GemmTunableOp_Half_TN,tn_8192_98_8192,Gemm_Hipblaslt_TN_8891,0.050528
GemmTunableOp_Half_TN,tn_4096_1798_4096,Gemm_Hipblaslt_TN_9602,0.118145
GemmTunableOp_Half_TN,tn_57344_3642_8192,Gemm_Hipblaslt_TN_9752,6.343
GemmTunableOp_Half_TN,tn_4096_1883_14336,Gemm_Hipblaslt_TN_9645,0.410983
GemmTunableOp_Half_TN,tn_6144_2860_4096,Gemm_Hipblaslt_TN_9565,0.260211
GemmTunableOp_Half_TN,tn_8192_1256_28672,Gemm_Hipblaslt_TN_9774,1.19834
GemmTunableOp_Half_TN,tn_32000_121_8192,Gemm_Rocblas_621286475,0.220611
GemmTunableOp_Half_TN,tn_4096_2698_14336,Gemm_Hipblaslt_TN_9690,0.550813
GemmTunableOp_Half_TN,tn_4096_848_4096,Gemm_Hipblaslt_TN_9604,0.0661158
GemmTunableOp_Half_TN,tn_32000_108_8192,Gemm_Rocblas_621294507,0.215425
GemmTunableOp_Half_TN,tn_6144_940_4096,Gemm_Hipblaslt_TN_9613,0.0949071
GemmTunableOp_Half_TN,tn_8192_1313_8192,Gemm_Hipblaslt_TN_9697,0.311946
GemmTunableOp_Half_TN,tn_6144_805_4096,Gemm_Rocblas_621294520,0.0889746
GemmTunableOp_Half_TN,tn_8192_4035_28672,Gemm_Rocblas_621294510,3.43528
GemmTunableOp_Half_TN,tn_8192_1374_8192,Gemm_Rocblas_621286684,0.322309
GemmTunableOp_Half_TN,tn_57344_2728_8192,Gemm_Hipblaslt_TN_156,4.89542
GemmTunableOp_Half_TN,tn_4096_4483_4096,Gemm_Hipblaslt_TN_9742,0.267366
GemmTunableOp_Half_TN,tn_6144_947_4096,Gemm_Hipblaslt_TN_9613,0.0946319
GemmTunableOp_Half_TN,tn_4096_920_14336,Gemm_Hipblaslt_TN_9634,0.232916
GemmTunableOp_Half_TN,tn_8192_19_28672,Gemm_Rocblas_621286354,0.137733
GemmTunableOp_Half_TN,tn_8192_1350_8192,Gemm_Hipblaslt_TN_9211,0.319371
GemmTunableOp_Half_TN,tn_6144_2675_4096,Gemm_Hipblaslt_TN_9827,0.216684
GemmTunableOp_Half_TN,tn_32000_23_8192,Gemm_Rocblas_621286350,0.149747
GemmTunableOp_Half_TN,tn_8192_3347_8192,Gemm_Hipblaslt_TN_9697,0.743942
GemmTunableOp_Half_TN,tn_32000_110_8192,Gemm_Hipblaslt_TN_9252,0.214944
GemmTunableOp_Half_TN,tn_8192_1329_28672,Gemm_Hipblaslt_TN_9774,1.21991
GemmTunableOp_Half_TN,tn_4096_4242_4096,Gemm_Hipblaslt_TN_9704,0.229581
GemmTunableOp_Half_TN,tn_32000_106_8192,Gemm_Rocblas_621294212,0.215507
GemmTunableOp_Half_TN,tn_28672_3670_4096,Gemm_Hipblaslt_TN_9827,1.48411
GemmTunableOp_Half_TN,tn_10240_105_8192,Gemm_Rocblas_621294504,0.0600432
GemmTunableOp_Half_TN,tn_10240_2962_8192,Gemm_Hipblaslt_TN_9813,0.831545
GemmTunableOp_Half_TN,tn_4096_1768_14336,Gemm_Hipblaslt_TN_9645,0.39706
GemmTunableOp_Half_TN,tn_4096_8069_4096,Gemm_Hipblaslt_TN_9655,0.439
GemmTunableOp_Half_TN,tn_128256_52_4096,Gemm_Hipblaslt_TN_9097,0.335764
GemmTunableOp_Half_TN,tn_4096_842_4096,Gemm_Hipblaslt_TN_9604,0.0665798
GemmTunableOp_Half_TN,tn_32000_20_8192,Gemm_Rocblas_621286350,0.150499
GemmTunableOp_Half_TN,tn_10240_2549_8192,Gemm_Hipblaslt_TN_9846,0.732225
GemmTunableOp_Half_TN,tn_32000_18_8192,Default,0.149376
GemmTunableOp_Half_TN,tn_28672_3310_4096,Gemm_Hipblaslt_TN_9827,1.32992
GemmTunableOp_Half_TN,tn_32000_118_8192,Gemm_Hipblaslt_TN_9252,0.221547
GemmTunableOp_Half_TN,tn_8192_7_28672,Gemm_Hipblaslt_TN_9403,0.125723
GemmTunableOp_Half_TN,tn_8192_1008_8192,Gemm_Rocblas_621294299,0.247197
GemmTunableOp_Half_TN,tn_4096_1697_14336,Gemm_Hipblaslt_TN_9180,0.362585
GemmTunableOp_Half_TN,tn_28672_1880_4096,Gemm_Hipblaslt_TN_9832,0.783542
GemmTunableOp_Half_TN,tn_8192_93_8192,Gemm_Hipblaslt_TN_7093,0.0477779
GemmTunableOp_Half_TN,tn_8192_1264_28672,Gemm_Hipblaslt_TN_9774,1.19708
GemmTunableOp_Half_TN,tn_4096_3671_14336,Gemm_Hipblaslt_TN_9223,0.710943
GemmTunableOp_Half_TN,tn_128256_248_4096,Gemm_Rocblas_621294634,0.579247
GemmTunableOp_Half_TN,tn_28672_1729_4096,Gemm_Hipblaslt_TN_9191,0.711644
GemmTunableOp_Half_TN,tn_4096_2764_4096,Gemm_Hipblaslt_TN_9690,0.165888
GemmTunableOp_Half_TN,tn_8192_4083_8192,Gemm_Rocblas_621286590,0.89995
GemmTunableOp_Half_TN,tn_28672_7436_4096,Gemm_Hipblaslt_TN_159,2.86208
GemmTunableOp_Half_TN,tn_8192_1224_8192,Gemm_Hipblaslt_TN_9799,0.298571
GemmTunableOp_Half_TN,tn_57344_1224_8192,Gemm_Hipblaslt_TN_9827,2.3231
GemmTunableOp_Half_TN,tn_8192_3482_8192,Gemm_Hipblaslt_TN_9677,0.769624
GemmTunableOp_Half_TN,tn_8192_12_8192,Gemm_Hipblaslt_TN_9392,0.0303486
GemmTunableOp_Half_TN,tn_4096_886_4096,Gemm_Hipblaslt_TN_9170,0.0678729
GemmTunableOp_Half_TN,tn_10240_118_8192,Gemm_Rocblas_621294504,0.0621245
GemmTunableOp_Half_TN,tn_28672_908_4096,Gemm_Hipblaslt_TN_9684,0.386226
GemmTunableOp_Half_TN,tn_8192_97_8192,Gemm_Hipblaslt_TN_8891,0.0490541
GemmTunableOp_Half_TN,tn_4096_2788_4096,Gemm_Hipblaslt_TN_9672,0.164592
GemmTunableOp_Half_TN,tn_8192_103_8192,Gemm_Hipblaslt_TN_8891,0.0502305
GemmTunableOp_Half_TN,tn_4096_208_14336,Gemm_Hipblaslt_TN_9363,0.0702306
GemmTunableOp_Half_TN,tn_57344_3000_8192,Gemm_Hipblaslt_TN_9816,5.06233
GemmTunableOp_Half_TN,tn_8192_91_28672,Gemm_Hipblaslt_TN_8899,0.188546
GemmTunableOp_Half_TN,tn_57344_3400_8192,Gemm_Rocblas_621286728,5.76923
GemmTunableOp_Half_TN,tn_6144_5606_4096,Gemm_Rocblas_621294426,0.498086
GemmTunableOp_Half_TN,tn_8192_1296_8192,Gemm_Hipblaslt_TN_9697,0.313608
GemmTunableOp_Half_TN,tn_57344_105_8192,Gemm_Hipblaslt_TN_9486,0.338428
GemmTunableOp_Half_TN,tn_8192_4082_8192,Gemm_Hipblaslt_TN_9753,0.889269
GemmTunableOp_Half_TN,tn_57344_3290_8192,Gemm_Rocblas_621286901,5.82807
GemmTunableOp_Half_TN,tn_8192_3139_28672,Gemm_Hipblaslt_TN_9732,2.87185
GemmTunableOp_Half_TN,tn_32000_21_8192,Gemm_Rocblas_621294193,0.150571
GemmTunableOp_Half_TN,tn_4096_8000_14336,Gemm_Hipblaslt_TN_9753,1.55231
GemmTunableOp_Half_TN,tn_128256_6_4096,Gemm_Rocblas_621294224,0.274693
GemmTunableOp_Half_TN,tn_4096_1693_4096,Gemm_Hipblaslt_TN_9671,0.105995
GemmTunableOp_Half_TN,tn_10240_1264_8192,Gemm_Hipblaslt_TN_9697,0.359078
GemmTunableOp_Half_TN,tn_57344_131_8192,Gemm_Hipblaslt_TN_9507,0.380429
GemmTunableOp_Half_TN,tn_4096_2703_4096,Gemm_Hipblaslt_TN_9690,0.161745
GemmTunableOp_Half_TN,tn_4096_2560_4096,Gemm_Hipblaslt_TN_9674,0.154198
GemmTunableOp_Half_TN,tn_57344_125_8192,Gemm_Rocblas_621294214,0.349966
GemmTunableOp_Half_TN,tn_8192_2717_8192,Gemm_Hipblaslt_TN_9691,0.630912
GemmTunableOp_Half_TN,tn_4096_914_14336,Gemm_Hipblaslt_TN_9160,0.233429
GemmTunableOp_Half_TN,tn_6144_2763_4096,Gemm_Hipblaslt_TN_9742,0.253534
GemmTunableOp_Half_TN,tn_4096_3430_4096,Gemm_Hipblaslt_TN_9188,0.194289
GemmTunableOp_Half_TN,tn_8192_17_28672,Gemm_Rocblas_621286354,0.136676
GemmTunableOp_Half_TN,tn_8192_11_28672,Gemm_Hipblaslt_TN_9403,0.126984
GemmTunableOp_Half_TN,tn_8192_119_8192,Gemm_Hipblaslt_TN_8891,0.0547425
GemmTunableOp_Half_TN,tn_8192_3178_28672,Gemm_Hipblaslt_TN_9732,2.87438
GemmTunableOp_Half_TN,tn_10240_94_8192,Gemm_Hipblaslt_TN_8095,0.0555436
GemmTunableOp_Half_TN,tn_28672_1846_4096,Gemm_Hipblaslt_TN_9832,0.783676
GemmTunableOp_Half_TN,tn_28672_2602_4096,Gemm_Hipblaslt_TN_9827,1.06485
GemmTunableOp_Half_TN,tn_10240_2639_8192,Gemm_Hipblaslt_TN_9743,0.740329
GemmTunableOp_Half_TN,tn_128256_173_4096,Gemm_Hipblaslt_TN_9931,0.503659
GemmTunableOp_Half_TN,tn_4096_1853_4096,Gemm_Hipblaslt_TN_9620,0.123118
GemmTunableOp_Half_TN,tn_4096_3418_14336,Gemm_Hipblaslt_TN_9139,0.658487
GemmTunableOp_Half_TN,tn_57344_3178_8192,Gemm_Hipblaslt_TN_9816,5.57344
GemmTunableOp_Half_TN,tn_8192_100_28672,Gemm_Hipblaslt_TN_8378,0.196901
GemmTunableOp_Half_TN,tn_6144_7953_4096,Gemm_Rocblas_621294435,0.649982
GemmTunableOp_Half_TN,tn_8192_96_28672,Gemm_Hipblaslt_TN_7093,0.188018
GemmTunableOp_Half_TN,tn_57344_3299_8192,Gemm_Rocblas_621286892,5.88139
GemmTunableOp_Half_TN,tn_6144_1854_4096,Gemm_Hipblaslt_TN_9691,0.164447
GemmTunableOp_Half_TN,tn_8192_3283_8192,Gemm_Hipblaslt_TN_9697,0.741544
GemmTunableOp_Half_TN,tn_4096_845_4096,Gemm_Hipblaslt_TN_9634,0.0661053
GemmTunableOp_Half_TN,tn_4096_2599_4096,Gemm_Hipblaslt_TN_9674,0.15952
GemmTunableOp_Half_TN,tn_4096_1705_4096,Gemm_Hipblaslt_TN_9607,0.106208
GemmTunableOp_Half_TN,tn_128256_126_4096,Gemm_Hipblaslt_TN_9061,0.414703
GemmTunableOp_Half_TN,tn_4096_1724_14336,Gemm_Hipblaslt_TN_9180,0.365046
GemmTunableOp_Half_TN,tn_4096_8110_4096,Gemm_Hipblaslt_TN_9753,0.437542
GemmTunableOp_Half_TN,tn_32000_102_8192,Gemm_Rocblas_621294212,0.209611
GemmTunableOp_Half_TN,tn_4096_964_4096,Gemm_Hipblaslt_TN_9604,0.070096
GemmTunableOp_Half_TN,tn_4096_912_4096,Gemm_Hipblaslt_TN_9604,0.0682256
GemmTunableOp_Half_TN,tn_4096_152_4096,Gemm_Rocblas_621286440,0.0232325
GemmTunableOp_Half_TN,tn_4096_1759_4096,Gemm_Hipblaslt_TN_9590,0.116996
GemmTunableOp_Half_TN,tn_6144_224_4096,Gemm_Hipblaslt_TN_9495,0.0350236
GemmTunableOp_Half_TN,tn_6144_3670_4096,Gemm_Hipblaslt_TN_9729,0.324835
GemmTunableOp_Half_TN,tn_128256_97_4096,Gemm_Rocblas_621294762,0.39603
GemmTunableOp_Half_TN,tn_28672_820_4096,Gemm_Hipblaslt_TN_9684,0.377148
GemmTunableOp_Half_TN,tn_6144_1846_4096,Gemm_Hipblaslt_TN_9672,0.164346
GemmTunableOp_Half_TN,tn_28672_969_4096,Gemm_Hipblaslt_TN_9863,0.428856
GemmTunableOp_Half_TN,tn_28672_878_4096,Gemm_Hipblaslt_TN_9684,0.385049
GemmTunableOp_Half_TN,tn_4096_256_4096,Gemm_Rocblas_621294171,0.0269667
GemmTunableOp_Half_TN,tn_4096_1718_4096,Gemm_Hipblaslt_TN_9607,0.107481
GemmTunableOp_Half_TN,tn_4096_868_14336,Gemm_Hipblaslt_TN_9580,0.221401
GemmTunableOp_Half_TN,tn_4096_128_4096,Gemm_Rocblas_621286280,0.0172494
GemmTunableOp_Half_TN,tn_4096_948_14336,Gemm_Hipblaslt_TN_9585,0.236677
GemmTunableOp_Half_TN,tn_8192_10_8192,Gemm_Hipblaslt_TN_9392,0.0304007
GemmTunableOp_Half_TN,tn_4096_1756_14336,Gemm_Hipblaslt_TN_9329,0.397995
GemmTunableOp_Half_TN,tn_4096_56_4096,Gemm_Rocblas_621294156,0.0135871
GemmTunableOp_Half_TN,tn_4096_1695_4096,Gemm_Hipblaslt_TN_9164,0.106445
GemmTunableOp_Half_TN,tn_4096_916_4096,Gemm_Hipblaslt_TN_9634,0.068046
GemmTunableOp_Half_TN,tn_4096_3556_4096,Gemm_Hipblaslt_TN_9221,0.199348
GemmTunableOp_Half_TN,tn_28672_939_4096,Gemm_Hipblaslt_TN_9192,0.391088
GemmTunableOp_Half_TN,tn_4096_1803_14336,Gemm_Hipblaslt_TN_9268,0.401143
GemmTunableOp_Half_TN,tn_4096_2653_14336,Gemm_Hipblaslt_TN_9799,0.544065
GemmTunableOp_Half_TN,tn_28672_2592_4096,Gemm_Hipblaslt_TN_9827,1.06516
GemmTunableOp_Half_TN,tn_28672_7239_4096,Gemm_Hipblaslt_TN_159,2.84908
GemmTunableOp_Half_TN,tn_4096_835_4096,Gemm_Hipblaslt_TN_9634,0.0659784
GemmTunableOp_Half_TN,tn_8192_1392_28672,Gemm_Rocblas_621286574,1.28852
GemmTunableOp_Half_TN,tn_4096_1775_14336,Gemm_Hipblaslt_TN_9134,0.398581
GemmTunableOp_Half_TN,tn_4096_1719_4096,Gemm_Hipblaslt_TN_9164,0.108889
GemmTunableOp_Half_TN,tn_4096_1757_14336,Gemm_Hipblaslt_TN_9645,0.396312
GemmTunableOp_Half_TN,tn_6144_794_4096,Gemm_Hipblaslt_TN_9561,0.0847873
GemmTunableOp_Half_TN,tn_8192_2032_8192,Gemm_Hipblaslt_TN_9840,0.478261
GemmTunableOp_Half_TN,tn_28672_2651_4096,Gemm_Hipblaslt_TN_9827,1.07494
GemmTunableOp_Half_TN,tn_4096_927_4096,Gemm_Hipblaslt_TN_9577,0.0693509
GemmTunableOp_Half_TN,tn_4096_852_4096,Gemm_Hipblaslt_TN_9634,0.0666657
GemmTunableOp_Half_TN,tn_6144_3431_4096,Gemm_Rocblas_621294306,0.305885
GemmTunableOp_Half_TN,tn_28672_3402_4096,Gemm_Hipblaslt_TN_9827,1.32228
GemmTunableOp_Half_TN,tn_8192_125_8192,Gemm_Hipblaslt_TN_8891,0.0548235
GemmTunableOp_Half_TN,tn_4096_932_4096,Gemm_Hipblaslt_TN_9583,0.0686454
GemmTunableOp_Half_TN,tn_6144_836_4096,Gemm_Rocblas_621286778,0.0894525
GemmTunableOp_Half_TN,tn_6144_2602_4096,Gemm_Hipblaslt_TN_9191,0.217958
GemmTunableOp_Half_TN,tn_28672_176_4096,Gemm_Hipblaslt_TN_7286,0.0965069
GemmTunableOp_Half_TN,tn_4096_2658_14336,Gemm_Hipblaslt_TN_9799,0.545133
GemmTunableOp_Half_TN,tn_28672_1743_4096,Gemm_Hipblaslt_TN_9184,0.712396
GemmTunableOp_Half_TN,tn_6144_876_4096,Gemm_Hipblaslt_TN_9613,0.092608
GemmTunableOp_Half_TN,tn_28672_7992_4096,Gemm_Hipblaslt_TN_159,3.10631
GemmTunableOp_Half_TN,tn_6144_919_4096,Gemm_Hipblaslt_TN_9613,0.0941455
GemmTunableOp_Half_TN,tn_128256_231_4096,Gemm_Rocblas_621286892,0.56948
GemmTunableOp_Half_TN,tn_28672_804_4096,Gemm_Hipblaslt_TN_9684,0.374735
GemmTunableOp_Half_TN,tn_4096_4471_14336,Gemm_Hipblaslt_TN_9670,0.92844
GemmTunableOp_Half_TN,tn_6144_2592_4096,Gemm_Hipblaslt_TN_9827,0.215743
GemmTunableOp_Half_TN,tn_4096_2734_14336,Gemm_Hipblaslt_TN_9799,0.560552
GemmTunableOp_Half_TN,tn_4096_2860_14336,Gemm_Hipblaslt_TN_9689,0.568591
GemmTunableOp_Half_TN,tn_4096_1813_4096,Gemm_Hipblaslt_TN_9645,0.120433
GemmTunableOp_Half_TN,tn_4096_918_14336,Gemm_Hipblaslt_TN_9585,0.234605
GemmTunableOp_Half_TN,tn_4096_886_14336,Gemm_Hipblaslt_TN_9580,0.222392
GemmTunableOp_Half_TN,tn_4096_906_4096,Gemm_Hipblaslt_TN_9576,0.069344
GemmTunableOp_Half_TN,tn_128256_237_4096,Gemm_Rocblas_621294634,0.575169
GemmTunableOp_Half_TN,tn_4096_830_4096,Gemm_Hipblaslt_TN_9131,0.0650897
GemmTunableOp_Half_TN,tn_8192_3971_28672,Gemm_Rocblas_621286915,3.38489
GemmTunableOp_Half_TN,tn_6144_851_4096,Gemm_Rocblas_621294520,0.089243
GemmTunableOp_Half_TN,tn_6144_2750_4096,Gemm_Hipblaslt_TN_9763,0.255881
GemmTunableOp_Half_TN,tn_4096_837_4096,Gemm_Hipblaslt_TN_9634,0.0657315
GemmTunableOp_Half_TN,tn_57344_3626_8192,Gemm_Hipblaslt_TN_9817,6.34566
GemmTunableOp_Half_TN,tn_4096_88_4096,Gemm_Rocblas_621294029,0.0154541
GemmTunableOp_Half_TN,tn_28672_1644_4096,Gemm_Hipblaslt_TN_9223,0.700018
GemmTunableOp_Half_TN,tn_4096_32_14336,Gemm_Rocblas_621294021,0.0279666
GemmTunableOp_Half_TN,tn_57344_1208_8192,Gemm_Hipblaslt_TN_9827,2.32082
GemmTunableOp_Half_TN,tn_128256_176_4096,Gemm_Hipblaslt_TN_9752,0.503929
GemmTunableOp_Half_TN,tn_4096_849_14336,Gemm_Hipblaslt_TN_9580,0.2207
GemmTunableOp_Half_TN,tn_57344_5_8192,Gemm_Hipblaslt_TN_9429,0.242432
GemmTunableOp_Half_TN,tn_4096_845_14336,Gemm_Hipblaslt_TN_9099,0.220361
GemmTunableOp_Half_TN,tn_4096_984_14336,Gemm_Hipblaslt_TN_9052,0.245523
GemmTunableOp_Half_TN,tn_28672_1803_4096,Gemm_Hipblaslt_TN_9684,0.775243
GemmTunableOp_Half_TN,tn_4096_1672_4096,Gemm_Hipblaslt_TN_9266,0.107483
GemmTunableOp_Half_TN,tn_28672_857_4096,Gemm_Hipblaslt_TN_9684,0.383519
GemmTunableOp_Half_TN,tn_128256_119_4096,Gemm_Hipblaslt_TN_9061,0.413481
GemmTunableOp_Half_TN,tn_6144_1827_4096,Gemm_Hipblaslt_TN_9799,0.165042
GemmTunableOp_Half_TN,tn_128256_18_4096,Gemm_Rocblas_621286354,0.2984
GemmTunableOp_Half_TN,tn_6144_7239_4096,Gemm_Hipblaslt_TN_9743,0.59154
GemmTunableOp_Half_TN,tn_4096_992_4096,Gemm_Hipblaslt_TN_9576,0.0720681
GemmTunableOp_Half_TN,tn_6144_869_4096,Gemm_Hipblaslt_TN_9133,0.0927267
GemmTunableOp_Half_TN,tn_28672_8054_4096,Gemm_Hipblaslt_TN_159,3.09956
GemmTunableOp_Half_TN,tn_28672_1697_4096,Gemm_Hipblaslt_TN_9220,0.7073
GemmTunableOp_Half_TN,tn_6144_48_4096,Gemm_Rocblas_621294029,0.0160853
GemmTunableOp_Half_TN,tn_6144_3571_4096,Gemm_Hipblaslt_TN_9570,0.313817
GemmTunableOp_Half_TN,tn_28672_48_4096,Gemm_Hipblaslt_TN_9492,0.0490706
GemmTunableOp_Half_TN,tn_4096_40_4096,Gemm_Rocblas_621286428,0.0128813
GemmTunableOp_Half_TN,tn_6144_32_4096,Gemm_Rocblas_621286488,0.0136925
GemmTunableOp_Half_TN,tn_28672_964_4096,Gemm_Rocblas_621286760,0.429598
GemmTunableOp_Half_TN,tn_4096_938_14336,Gemm_Hipblaslt_TN_9634,0.235179
GemmTunableOp_Half_TN,tn_6144_112_4096,Gemm_Rocblas_621294171,0.0238409
GemmTunableOp_Half_TN,tn_4096_104_14336,Gemm_Hipblaslt_TN_8114,0.0479913
GemmTunableOp_Half_TN,tn_6144_846_4096,Gemm_Rocblas_621294520,0.0895294
GemmTunableOp_Half_TN,tn_4096_919_4096,Gemm_Hipblaslt_TN_9547,0.0690991
GemmTunableOp_Half_TN,tn_4096_836_4096,Gemm_Hipblaslt_TN_9634,0.0653979
GemmTunableOp_Half_TN,tn_8192_2041_28672,Gemm_Hipblaslt_TN_9840,1.78722
GemmTunableOp_Half_TN,tn_6144_7798_4096,Gemm_Rocblas_621294420,0.643509
GemmTunableOp_Half_TN,tn_6144_915_4096,Gemm_Hipblaslt_TN_9613,0.0932967
GemmTunableOp_Half_TN,tn_4096_120_14336,Gemm_Hipblaslt_TN_7160,0.0471477
GemmTunableOp_Half_TN,tn_28672_8007_4096,Gemm_Hipblaslt_TN_159,3.09009
GemmTunableOp_Half_TN,tn_6144_964_4096,Gemm_Rocblas_621294311,0.101591
GemmTunableOp_Half_TN,tn_28672_869_4096,Gemm_Hipblaslt_TN_9684,0.382928
GemmTunableOp_Half_TN,tn_6144_1837_4096,Gemm_Hipblaslt_TN_9691,0.164968
GemmTunableOp_Half_TN,tn_28672_7809_4096,Gemm_Hipblaslt_TN_159,2.95164
GemmTunableOp_Half_TN,tn_28672_880_4096,Gemm_Hipblaslt_TN_9189,0.38555
GemmTunableOp_Half_TN,tn_4096_2719_4096,Gemm_Hipblaslt_TN_9672,0.162181
GemmTunableOp_Half_TN,tn_4096_820_14336,Gemm_Hipblaslt_TN_9158,0.212835
GemmTunableOp_Half_TN,tn_4096_807_14336,Gemm_Hipblaslt_TN_9158,0.216575
GemmTunableOp_Half_TN,tn_28672_8156_4096,Gemm_Hipblaslt_TN_159,3.18064
GemmTunableOp_Half_TN,tn_8192_107_28672,Gemm_Hipblaslt_TN_8378,0.203738
GemmTunableOp_Half_TN,tn_128256_166_4096,Gemm_Hipblaslt_TN_9694,0.499154
GemmTunableOp_Half_TN,tn_32000_111_8192,Gemm_Hipblaslt_TN_9356,0.216638
GemmTunableOp_Half_TN,tn_4096_3565_14336,Gemm_Hipblaslt_TN_9677,0.675853
GemmTunableOp_Half_TN,tn_6144_847_4096,Gemm_Rocblas_621286778,0.0897403
GemmTunableOp_Half_TN,tn_4096_1853_14336,Gemm_Hipblaslt_TN_9268,0.405551
GemmTunableOp_Half_TN,tn_28672_889_4096,Gemm_Hipblaslt_TN_9684,0.387105
GemmTunableOp_Half_TN,tn_128256_222_4096,Gemm_Rocblas_621286797,0.554697
GemmTunableOp_Half_TN,tn_4096_176_14336,Gemm_Hipblaslt_TN_7586,0.0611218
GemmTunableOp_Half_TN,tn_128256_71_4096,Gemm_Hipblaslt_TN_9057,0.355734
GemmTunableOp_Half_TN,tn_6144_2544_4096,Gemm_Hipblaslt_TN_9827,0.21503
GemmTunableOp_Half_TN,tn_10240_4083_8192,Gemm_Hipblaslt_TN_9743,1.13578
GemmTunableOp_Half_TN,tn_28672_797_4096,Gemm_Hipblaslt_TN_9674,0.344948
GemmTunableOp_Half_TN,tn_4096_1815_4096,Gemm_Hipblaslt_TN_9645,0.121026
GemmTunableOp_Half_TN,tn_28672_56_4096,Gemm_Rocblas_621294374,0.0508436
GemmTunableOp_Half_TN,tn_28672_2762_4096,Gemm_Rocblas_621294330,1.15787
GemmTunableOp_Half_TN,tn_6144_7944_4096,Gemm_Rocblas_621294435,0.650574
GemmTunableOp_Half_TN,tn_28672_96_4096,Gemm_Rocblas_621286719,0.0606239
GemmTunableOp_Half_TN,tn_4096_3546_4096,Gemm_Hipblaslt_TN_9221,0.199453
GemmTunableOp_Half_TN,tn_4096_831_4096,Gemm_Hipblaslt_TN_9158,0.0635625
GemmTunableOp_Half_TN,tn_28672_216_4096,Gemm_Hipblaslt_TN_9267,0.114055
GemmTunableOp_Half_TN,tn_4096_16_4096,Gemm_Rocblas_621294136,0.0101496
GemmTunableOp_Half_TN,tn_4096_985_4096,Gemm_Hipblaslt_TN_9583,0.0711292
GemmTunableOp_Half_TN,tn_4096_7992_4096,Gemm_Hipblaslt_TN_9853,0.439207
GemmTunableOp_Half_TN,tn_8192_3400_28672,Gemm_Hipblaslt_TN_9732,2.95494
GemmTunableOp_Half_TN,tn_4096_2601_14336,Gemm_Hipblaslt_TN_9657,0.540943
GemmTunableOp_Half_TN,tn_128256_106_4096,Gemm_Hipblaslt_TN_9263,0.401883
GemmTunableOp_Half_TN,tn_4096_1864_4096,Gemm_Hipblaslt_TN_9134,0.121085
GemmTunableOp_Half_TN,tn_28672_1954_4096,Gemm_Hipblaslt_TN_9846,0.822343
GemmTunableOp_Half_TN,tn_4096_7804_14336,Gemm_Hipblaslt_TN_9815,1.53437
GemmTunableOp_Half_TN,tn_8192_94_28672,Gemm_Hipblaslt_TN_8899,0.189632
GemmTunableOp_Half_TN,tn_28672_817_4096,Gemm_Hipblaslt_TN_9684,0.375911
GemmTunableOp_Half_TN,tn_4096_7283_4096,Gemm_Hipblaslt_TN_9743,0.401699
GemmTunableOp_Half_TN,tn_28672_7863_4096,Gemm_Hipblaslt_TN_159,3.06417
GemmTunableOp_Half_TN,tn_57344_3475_8192,Gemm_Hipblaslt_TN_159,5.79934
GemmTunableOp_Half_TN,tn_28672_248_4096,Gemm_Rocblas_621294221,0.125693
GemmTunableOp_Half_TN,tn_6144_7937_4096,Gemm_Hipblaslt_TN_9768,0.652382
GemmTunableOp_Half_TN,tn_6144_40_4096,Gemm_Rocblas_621294029,0.0156694
GemmTunableOp_Half_TN,tn_4096_2681_14336,Gemm_Hipblaslt_TN_9672,0.546134
GemmTunableOp_Half_TN,tn_28672_977_4096,Gemm_Hipblaslt_TN_9863,0.422078
GemmTunableOp_Half_TN,tn_28672_2826_4096,Gemm_Hipblaslt_TN_9841,1.13762
GemmTunableOp_Half_TN,tn_6144_899_4096,Gemm_Hipblaslt_TN_9613,0.0930387
GemmTunableOp_Half_TN,tn_4096_8069_14336,Gemm_Hipblaslt_TN_9753,1.57958
GemmTunableOp_Half_TN,tn_28672_872_4096,Gemm_Hipblaslt_TN_9684,0.385528
GemmTunableOp_Half_TN,tn_28672_1742_4096,Gemm_Hipblaslt_TN_9191,0.713967
GemmTunableOp_Half_TN,tn_4096_954_14336,Gemm_Hipblaslt_TN_9604,0.235467
GemmTunableOp_Half_TN,tn_4096_903_14336,Gemm_Hipblaslt_TN_9608,0.232407
GemmTunableOp_Half_TN,tn_6144_2785_4096,Gemm_Hipblaslt_TN_9742,0.255879
GemmTunableOp_Half_TN,tn_10240_10_8192,Gemm_Hipblaslt_TN_9411,0.0371934
GemmTunableOp_Half_TN,tn_4096_808_4096,Gemm_Hipblaslt_TN_9131,0.0650296
GemmTunableOp_Half_TN,tn_28672_2648_4096,Gemm_Hipblaslt_TN_9827,1.0618
GemmTunableOp_Half_TN,tn_6144_1880_4096,Gemm_Hipblaslt_TN_9690,0.166689
GemmTunableOp_Half_TN,tn_4096_1807_4096,Gemm_Hipblaslt_TN_9605,0.119869
GemmTunableOp_Half_TN,tn_6144_1815_4096,Gemm_Hipblaslt_TN_9691,0.164511
GemmTunableOp_Half_TN,tn_6144_912_4096,Gemm_Hipblaslt_TN_9613,0.0940754
GemmTunableOp_Half_TN,tn_28672_1805_4096,Gemm_Hipblaslt_TN_9684,0.775583
GemmTunableOp_Half_TN,tn_4096_7299_14336,Gemm_Hipblaslt_TN_9749,1.47846
GemmTunableOp_Half_TN,tn_8192_1377_28672,Gemm_Hipblaslt_TN_9799,1.28566
GemmTunableOp_Half_TN,tn_4096_2590_14336,Gemm_Hipblaslt_TN_9657,0.543972
GemmTunableOp_Half_TN,tn_28672_1614_4096,Gemm_Hipblaslt_TN_9190,0.695136
GemmTunableOp_Half_TN,tn_28672_2788_4096,Gemm_Hipblaslt_TN_9184,1.16227
GemmTunableOp_Half_TN,tn_6144_927_4096,Gemm_Hipblaslt_TN_9133,0.0944195
GemmTunableOp_Half_TN,tn_28672_918_4096,Gemm_Hipblaslt_TN_9684,0.387554
GemmTunableOp_Half_TN,tn_6144_795_4096,Gemm_Hipblaslt_TN_9163,0.0861312
GemmTunableOp_Half_TN,tn_128256_131_4096,Gemm_Hipblaslt_TN_9108,0.44578
GemmTunableOp_Half_TN,tn_4096_795_14336,Gemm_Hipblaslt_TN_9131,0.215391
GemmTunableOp_Half_TN,tn_57344_117_8192,Gemm_Rocblas_621294214,0.346414
GemmTunableOp_Half_TN,tn_6144_843_4096,Gemm_Rocblas_621286778,0.0895767
GemmTunableOp_Half_TN,tn_128256_100_4096,Gemm_Hipblaslt_TN_9760,0.398619
GemmTunableOp_Half_TN,tn_4096_2651_4096,Gemm_Hipblaslt_TN_9674,0.158896
GemmTunableOp_Half_TN,tn_6144_1881_4096,Gemm_Hipblaslt_TN_9672,0.166283
GemmTunableOp_Half_TN,tn_4096_898_14336,Gemm_Hipblaslt_TN_9604,0.231929
GemmTunableOp_Half_TN,tn_128256_85_4096,Gemm_Hipblaslt_TN_9057,0.369139
GemmTunableOp_Half_TN,tn_4096_859_4096,Gemm_Hipblaslt_TN_9634,0.0675231
GemmTunableOp_Half_TN,tn_28672_983_4096,Gemm_Hipblaslt_TN_9863,0.429192
GemmTunableOp_Half_TN,tn_57344_100_8192,Default,0.335889
GemmTunableOp_Half_TN,tn_4096_2719_14336,Gemm_Hipblaslt_TN_9676,0.549887
GemmTunableOp_Half_TN,tn_6144_2717_4096,Gemm_Hipblaslt_TN_9565,0.252981
GemmTunableOp_Half_TN,tn_28672_1783_4096,Gemm_Hipblaslt_TN_9190,0.71841
GemmTunableOp_Half_TN,tn_8192_133_8192,Gemm_Hipblaslt_TN_9306,0.0573169
GemmTunableOp_Half_TN,tn_28672_859_4096,Gemm_Hipblaslt_TN_9684,0.381564
GemmTunableOp_Half_TN,tn_128256_81_4096,Gemm_Hipblaslt_TN_9057,0.360002
GemmTunableOp_Half_TN,tn_6144_885_4096,Gemm_Hipblaslt_TN_9613,0.0935094
GemmTunableOp_Half_TN,tn_4096_849_4096,Gemm_Hipblaslt_TN_9634,0.0666647
GemmTunableOp_Half_TN,tn_4096_1649_4096,Gemm_Hipblaslt_TN_9359,0.106757
GemmTunableOp_Half_TN,tn_28672_943_4096,Gemm_Hipblaslt_TN_9684,0.390602
GemmTunableOp_Half_TN,tn_4096_929_4096,Gemm_Hipblaslt_TN_9576,0.0696755
GemmTunableOp_Half_TN,tn_4096_1649_14336,Gemm_Hipblaslt_TN_9265,0.359521
GemmTunableOp_Half_TN,tn_4096_7857_14336,Gemm_Hipblaslt_TN_9749,1.55501
GemmTunableOp_Half_TN,tn_4096_1795_4096,Gemm_Hipblaslt_TN_9605,0.118421
GemmTunableOp_Half_TN,tn_6144_1795_4096,Gemm_Hipblaslt_TN_9799,0.164288
GemmTunableOp_Half_TN,tn_6144_882_4096,Gemm_Hipblaslt_TN_9163,0.0919521
GemmTunableOp_Half_TN,tn_4096_957_4096,Gemm_Hipblaslt_TN_9604,0.0703856
GemmTunableOp_Half_TN,tn_28672_2860_4096,Gemm_Hipblaslt_TN_9827,1.13768
GemmTunableOp_Half_TN,tn_57344_1296_8192,Gemm_Hipblaslt_TN_9841,2.36694
GemmTunableOp_Half_TN,tn_28672_956_4096,Gemm_Hipblaslt_TN_9683,0.391399
GemmTunableOp_Half_TN,tn_6144_2537_4096,Gemm_Hipblaslt_TN_9827,0.214413
GemmTunableOp_Half_TN,tn_4096_1829_14336,Gemm_Hipblaslt_TN_9680,0.404522
GemmTunableOp_Half_TN,tn_4096_853_14336,Gemm_Hipblaslt_TN_9580,0.219665
GemmTunableOp_Half_TN,tn_4096_1718_14336,Gemm_Hipblaslt_TN_9790,0.366254
GemmTunableOp_Half_TN,tn_4096_3662_14336,Gemm_Hipblaslt_TN_9841,0.7127
GemmTunableOp_Half_TN,tn_4096_2785_14336,Gemm_Hipblaslt_TN_9672,0.562339
GemmTunableOp_Half_TN,tn_28672_942_4096,Gemm_Hipblaslt_TN_9684,0.389709
GemmTunableOp_Half_TN,tn_8192_1025_8192,Gemm_Hipblaslt_TN_9229,0.257127
GemmTunableOp_Half_TN,tn_4096_1850_4096,Gemm_Hipblaslt_TN_9645,0.12115
GemmStridedBatchedTunableOp_Half_TN,tn_822_822_128_B_32,Gemm_Rocblas_621294635,0.0457151
GemmStridedBatchedTunableOp_Half_TN,tn_899_899_128_B_32,Gemm_Rocblas_621294635,0.0497902
GemmStridedBatchedTunableOp_Half_TN,tn_799_799_128_B_32,Gemm_Rocblas_621294109,0.0425194
GemmStridedBatchedTunableOp_Half_TN,tn_876_876_128_B_32,Gemm_Rocblas_621286775,0.0479574
GemmStridedBatchedTunableOp_Half_TN,tn_926_926_128_B_32,Gemm_Hipblaslt_TN_6879,0.053069
GemmStridedBatchedTunableOp_Half_TN,tn_918_918_128_B_32,Gemm_Rocblas_621286794,0.0530318
GemmStridedBatchedTunableOp_Half_TN,tn_860_860_128_B_32,Gemm_Rocblas_621286775,0.0466446
GemmStridedBatchedTunableOp_Half_TN,tn_934_934_128_B_32,Gemm_Rocblas_621286794,0.0533818
GemmStridedBatchedTunableOp_Half_TN,tn_951_951_128_B_32,Gemm_Hipblaslt_TN_7059,0.0543422
GemmStridedBatchedTunableOp_Half_TN,tn_932_932_128_B_32,Gemm_Rocblas_621286794,0.0531122
GemmStridedBatchedTunableOp_Half_TN,tn_877_877_128_B_32,Gemm_Rocblas_621286785,0.049361
GemmStridedBatchedTunableOp_Half_TN,tn_989_989_128_B_32,Gemm_Hipblaslt_TN_9351,0.0550831
GemmStridedBatchedTunableOp_Half_TN,tn_1280_1280_128_B_64,Gemm_Rocblas_621286397,0.116023
GemmStridedBatchedTunableOp_Half_TN,tn_1015_1015_128_B_64,Gemm_Hipblaslt_TN_6879,0.100493
GemmStridedBatchedTunableOp_Half_TN,tn_1281_1281_128_B_64,Gemm_Rocblas_621286412,0.150845
GemmStridedBatchedTunableOp_Half_TN,tn_1383_1383_128_B_64,Gemm_Rocblas_621286397,0.170848
GemmStridedBatchedTunableOp_Half_TN,tn_1279_1279_128_B_64,Gemm_Hipblaslt_TN_6939,0.146105
GemmStridedBatchedTunableOp_Half_TN,tn_1345_1345_128_B_64,Gemm_Rocblas_621286412,0.160142
GemmStridedBatchedTunableOp_Half_TN,tn_1185_1185_128_B_64,Gemm_Hipblaslt_TN_6879,0.127036
GemmStridedBatchedTunableOp_Half_TN,tn_1321_1321_128_B_64,Gemm_Rocblas_621286412,0.156659
GemmStridedBatchedTunableOp_Half_TN,tn_1137_1137_128_B_64,Gemm_Hipblaslt_TN_6879,0.118141
GemmStridedBatchedTunableOp_Half_TN,tn_1192_1192_128_B_64,Gemm_Rocblas_621294106,0.12651
GemmStridedBatchedTunableOp_Half_TN,tn_857_857_128_B_32,Gemm_Rocblas_621286775,0.0467549
GemmStridedBatchedTunableOp_Half_TN,tn_1271_1271_128_B_64,Gemm_Hipblaslt_TN_6879,0.138173
GemmStridedBatchedTunableOp_Half_TN,tn_803_803_128_B_32,Gemm_Rocblas_621294635,0.0430862
GemmStridedBatchedTunableOp_Half_TN,tn_845_845_128_B_32,Gemm_Rocblas_621294635,0.0455837
GemmStridedBatchedTunableOp_Half_TN,tn_820_820_128_B_32,Gemm_Rocblas_621294635,0.0437884
GemmStridedBatchedTunableOp_Half_TN,tn_804_804_128_B_32,Gemm_Rocblas_621294635,0.0435085
GemmStridedBatchedTunableOp_Half_TN,tn_1335_1335_128_B_64,Gemm_Rocblas_621286412,0.159146
GemmStridedBatchedTunableOp_Half_TN,tn_1168_1168_128_B_64,Gemm_Rocblas_621294110,0.121045
GemmStridedBatchedTunableOp_Half_TN,tn_1319_1319_128_B_64,Gemm_Rocblas_621294109,0.155381
GemmStridedBatchedTunableOp_Half_TN,tn_826_826_128_B_32,Gemm_Rocblas_621294635,0.044273
GemmStridedBatchedTunableOp_Half_TN,tn_974_974_128_B_32,Gemm_Hipblaslt_TN_9351,0.0550333
GemmStridedBatchedTunableOp_Half_TN,tn_1248_1248_128_B_64,Gemm_Rocblas_621286413,0.125791
GemmStridedBatchedTunableOp_Half_TN,tn_1013_1013_128_B_64,Gemm_Hipblaslt_TN_6879,0.100222
GemmStridedBatchedTunableOp_Half_TN,tn_1286_1286_128_B_64,Gemm_Rocblas_621286412,0.145991
GemmStridedBatchedTunableOp_Half_TN,tn_1329_1329_128_B_64,Gemm_Rocblas_621286412,0.159908
GemmStridedBatchedTunableOp_Half_TN,tn_812_812_128_B_32,Gemm_Hipblaslt_TN_6999,0.0441588
GemmStridedBatchedTunableOp_Half_TN,tn_1473_1473_128_B_64,Gemm_Rocblas_621294106,0.190109
GemmStridedBatchedTunableOp_Half_TN,tn_1161_1161_128_B_64,Gemm_Rocblas_621294106,0.126695
GemmStridedBatchedTunableOp_Half_TN,tn_1024_1024_128_B_64,Gemm_Rocblas_621294109,0.065845
GemmStridedBatchedTunableOp_Half_TN,tn_986_986_128_B_32,Gemm_Hipblaslt_TN_7483,0.0550563
GemmStridedBatchedTunableOp_Half_TN,tn_949_949_128_B_32,Gemm_Rocblas_621286794,0.0541031
GemmStridedBatchedTunableOp_Half_TN,tn_792_792_128_B_32,Gemm_Hipblaslt_TN_150,0.0378729
GemmStridedBatchedTunableOp_Half_TN,tn_970_970_128_B_32,Gemm_Hipblaslt_TN_9351,0.053983
GemmStridedBatchedTunableOp_Half_TN,tn_1160_1160_128_B_64,Gemm_Rocblas_621294106,0.123169
GemmStridedBatchedTunableOp_Half_TN,tn_814_814_128_B_32,Gemm_Rocblas_621294635,0.0447627
GemmStridedBatchedTunableOp_Half_TN,tn_922_922_128_B_32,Gemm_Hipblaslt_TN_7519,0.0522406
GemmStridedBatchedTunableOp_Half_TN,tn_966_966_128_B_32,Gemm_Hipblaslt_TN_9351,0.0540261
GemmStridedBatchedTunableOp_Half_TN,tn_946_946_128_B_32,Gemm_Hipblaslt_TN_7519,0.0525318
GemmStridedBatchedTunableOp_Half_TN,tn_830_830_128_B_32,Gemm_Rocblas_621294517,0.045868
GemmStridedBatchedTunableOp_Half_TN,tn_893_893_128_B_32,Gemm_Rocblas_621294517,0.0493802
GemmStridedBatchedTunableOp_Half_TN,tn_933_933_128_B_32,Gemm_Rocblas_621286794,0.0535025
GemmStridedBatchedTunableOp_Half_TN,tn_900_900_128_B_32,Gemm_Rocblas_621294536,0.0520078
GemmStridedBatchedTunableOp_Half_TN,tn_913_913_128_B_32,Gemm_Rocblas_621294536,0.0531792
GemmStridedBatchedTunableOp_Half_TN,tn_992_992_128_B_32,Gemm_Rocblas_621286252,0.0502748
GemmStridedBatchedTunableOp_Half_TN,tn_930_930_128_B_32,Gemm_Rocblas_621286794,0.0533535
GemmStridedBatchedTunableOp_Half_TN,tn_955_955_128_B_32,Gemm_Rocblas_621294536,0.0539655
GemmStridedBatchedTunableOp_Half_TN,tn_890_890_128_B_32,Gemm_Rocblas_621286774,0.0478037
GemmStridedBatchedTunableOp_Half_TN,tn_821_821_128_B_32,Gemm_Rocblas_621294109,0.0444602
GemmStridedBatchedTunableOp_Half_TN,tn_837_837_128_B_32,Gemm_Rocblas_621286775,0.0461251
GemmStridedBatchedTunableOp_Half_TN,tn_942_942_128_B_32,Gemm_Rocblas_621286794,0.0536425
GemmStridedBatchedTunableOp_Half_TN,tn_858_858_128_B_32,Gemm_Rocblas_621286775,0.0473775
GemmStridedBatchedTunableOp_Half_TN,tn_1025_1025_128_B_64,Gemm_Hipblaslt_TN_6879,0.101735
GemmStridedBatchedTunableOp_Half_TN,tn_925_925_128_B_32,Gemm_Rocblas_621294635,0.0527001
GemmStridedBatchedTunableOp_Half_TN,tn_990_990_128_B_32,Gemm_Rocblas_621294536,0.0555191
GemmStridedBatchedTunableOp_Half_TN,tn_908_908_128_B_32,Gemm_Rocblas_621294536,0.052123
GemmStridedBatchedTunableOp_Half_TN,tn_817_817_128_B_32,Gemm_Rocblas_621294109,0.0441349
GemmStridedBatchedTunableOp_Half_TN,tn_801_801_128_B_32,Gemm_Rocblas_621294109,0.0428769
GemmStridedBatchedTunableOp_Half_TN,tn_1268_1268_128_B_64,Gemm_Hipblaslt_TN_6879,0.142012
GemmStridedBatchedTunableOp_Half_TN,tn_962_962_128_B_32,Gemm_Hipblaslt_TN_9351,0.0539243
GemmStridedBatchedTunableOp_Half_TN,tn_943_943_128_B_32,Gemm_Hipblaslt_TN_7483,0.0540807
GemmStridedBatchedTunableOp_Half_TN,tn_887_887_128_B_32,Gemm_Rocblas_621286775,0.0485872
