Gemm_Tune/Qwen2-72B-Instruct-1000inp/full_tuned0.csv
Validator,PT_VERSION,2.4.0
Validator,ROCM_VERSION,6.1.0.0-82-5fabb4c
Validator,HIPBLASLT_VERSION,0.7.0-1549b021
Validator,GCN_ARCH_NAME,gfx942:sramecc+:xnack-
Validator,ROCBLAS_VERSION,4.1.0-cefa4a9b-dirty
GemmTunableOp_Half_TN,tn_4096_836_2048,Gemm_Hipblaslt_TN_9604,0.0349801
GemmTunableOp_Half_TN,tn_14336_1778_4096,Gemm_Hipblaslt_TN_9697,0.367827
GemmTunableOp_Half_TN,tn_14336_1719_4096,Gemm_Hipblaslt_TN_9677,0.35706
GemmTunableOp_Half_TN,tn_4096_835_7168,Gemm_Hipblaslt_TN_9634,0.112909
GemmTunableOp_Half_TN,tn_4096_1854_7168,Gemm_Hipblaslt_TN_9137,0.206647
GemmTunableOp_Half_TN,tn_14336_878_4096,Gemm_Hipblaslt_TN_9697,0.183072
GemmTunableOp_Half_TN,tn_4096_1827_7168,Gemm_Hipblaslt_TN_9137,0.207708
GemmTunableOp_Half_TN,tn_3072_844_4096,Gemm_Hipblaslt_TN_9368,0.0529037
GemmTunableOp_Half_TN,tn_4096_1905_7168,Gemm_Hipblaslt_TN_9620,0.210837
GemmTunableOp_Half_TN,tn_4096_3571_7168,Gemm_Hipblaslt_TN_9677,0.346599
GemmTunableOp_Half_TN,tn_4096_1931_2048,Gemm_Hipblaslt_TN_9329,0.0653052
GemmTunableOp_Half_TN,tn_14336_935_4096,Gemm_Hipblaslt_TN_9697,0.186388
GemmTunableOp_Half_TN,tn_14336_1931_4096,Gemm_Hipblaslt_TN_9217,0.401207
GemmTunableOp_Half_TN,tn_4096_850_2048,Gemm_Hipblaslt_TN_9352,0.0352007
GemmTunableOp_Half_TN,tn_14336_956_4096,Gemm_Hipblaslt_TN_9192,0.188428
GemmTunableOp_Half_TN,tn_3072_866_4096,Gemm_Hipblaslt_TN_9352,0.0551074
GemmTunableOp_Half_TN,tn_4096_785_2048,Gemm_Hipblaslt_TN_9634,0.0343211
GemmTunableOp_Half_TN,tn_4096_3565_2048,Gemm_Hipblaslt_TN_9696,0.105534
GemmTunableOp_Half_TN,tn_3072_915_4096,Gemm_Hipblaslt_TN_9352,0.0573611
GemmTunableOp_Half_TN,tn_3072_913_4096,Gemm_Hipblaslt_TN_9546,0.057113
GemmTunableOp_Half_TN,tn_4096_1881_7168,Gemm_Hipblaslt_TN_9645,0.206305
GemmTunableOp_Half_TN,tn_4096_3569_2048,Gemm_Hipblaslt_TN_9683,0.105898
GemmTunableOp_Half_TN,tn_4096_1746_7168,Gemm_Hipblaslt_TN_9645,0.199803
GemmTunableOp_Half_TN,tn_3072_2636_4096,Gemm_Hipblaslt_TN_9620,0.124355
GemmTunableOp_Half_TN,tn_14336_72_4096,Gemm_Hipblaslt_TN_9495,0.0331541
GemmTunableOp_Half_TN,tn_4096_900_7168,Gemm_Hipblaslt_TN_9576,0.118877
GemmTunableOp_Half_TN,tn_4096_3546_2048,Gemm_Hipblaslt_TN_9896,0.104122
GemmTunableOp_Half_TN,tn_4096_844_7168,Gemm_Hipblaslt_TN_9158,0.110764
GemmTunableOp_Half_TN,tn_14336_811_4096,Gemm_Hipblaslt_TN_9697,0.177009
GemmTunableOp_Half_TN,tn_3072_906_4096,Gemm_Hipblaslt_TN_9352,0.0575989
GemmTunableOp_Half_TN,tn_3072_2592_4096,Gemm_Hipblaslt_TN_9645,0.121944
GemmTunableOp_Half_TN,tn_4096_7809_2048,Gemm_Hipblaslt_TN_9768,0.231083
GemmTunableOp_Half_TN,tn_14336_898_4096,Gemm_Hipblaslt_TN_9677,0.18325
GemmTunableOp_Half_TN,tn_3072_56_4096,Gemm_Rocblas_621286419,0.0106885
GemmTunableOp_Half_TN,tn_4096_851_2048,Gemm_Hipblaslt_TN_9354,0.0350861
GemmTunableOp_Half_TN,tn_14336_1614_4096,Gemm_Hipblaslt_TN_9697,0.351906
GemmTunableOp_Half_TN,tn_4096_1897_7168,Gemm_Hipblaslt_TN_9645,0.209355
GemmTunableOp_Half_TN,tn_4096_1644_7168,Gemm_Hipblaslt_TN_9607,0.184138
GemmTunableOp_Half_TN,tn_4096_1778_2048,Gemm_Hipblaslt_TN_9680,0.0627285
GemmTunableOp_Half_TN,tn_4096_1729_7168,Gemm_Hipblaslt_TN_9673,0.197251
GemmTunableOp_Half_TN,tn_4096_2606_7168,Gemm_Hipblaslt_TN_9672,0.269325
GemmTunableOp_Half_TN,tn_4096_136_7168,Gemm_Hipblaslt_TN_9472,0.035757
GemmTunableOp_Half_TN,tn_3072_852_4096,Gemm_Hipblaslt_TN_9047,0.05349
GemmTunableOp_Half_TN,tn_4096_1883_7168,Gemm_Hipblaslt_TN_9645,0.210379
GemmTunableOp_Half_TN,tn_14336_917_4096,Gemm_Hipblaslt_TN_9192,0.184864
GemmTunableOp_Half_TN,tn_14336_882_4096,Gemm_Hipblaslt_TN_9139,0.182111
GemmTunableOp_Half_TN,tn_3072_863_4096,Gemm_Hipblaslt_TN_9048,0.0529848
GemmTunableOp_Half_TN,tn_4096_971_7168,Gemm_Hipblaslt_TN_9170,0.121244
GemmTunableOp_Half_TN,tn_3072_7266_4096,Gemm_Hipblaslt_TN_9681,0.317446
GemmTunableOp_Half_TN,tn_4096_1748_7168,Gemm_Hipblaslt_TN_9673,0.197379
GemmTunableOp_Half_TN,tn_3072_894_4096,Gemm_Hipblaslt_TN_9131,0.0580995
GemmTunableOp_Half_TN,tn_3072_925_4096,Gemm_Hipblaslt_TN_9546,0.0582927
GemmTunableOp_Half_TN,tn_4096_1649_2048,Gemm_Hipblaslt_TN_9180,0.0568909
GemmTunableOp_Half_TN,tn_4096_832_7168,Gemm_Hipblaslt_TN_9099,0.111281
GemmTunableOp_Half_TN,tn_3072_971_4096,Gemm_Rocblas_621294242,0.0617669
GemmTunableOp_Half_TN,tn_4096_232_7168,Gemm_Hipblaslt_TN_9303,0.0442932
GemmTunableOp_Half_TN,tn_4096_849_7168,Gemm_Hipblaslt_TN_9604,0.114458
GemmTunableOp_Half_TN,tn_64128_168_4096,Gemm_Hipblaslt_TN_9752,0.247734
GemmTunableOp_Half_TN,tn_3072_837_4096,Gemm_Hipblaslt_TN_9048,0.053086
GemmTunableOp_Half_TN,tn_3072_812_4096,Gemm_Hipblaslt_TN_9047,0.0537017
GemmTunableOp_Half_TN,tn_4096_3671_7168,Gemm_Hipblaslt_TN_9827,0.361008
GemmTunableOp_Half_TN,tn_14336_1829_4096,Gemm_Hipblaslt_TN_9697,0.372642
GemmTunableOp_Half_TN,tn_14336_1817_4096,Gemm_Hipblaslt_TN_9677,0.369178
GemmTunableOp_Half_TN,tn_14336_1644_4096,Gemm_Hipblaslt_TN_9189,0.357216
GemmTunableOp_Half_TN,tn_14336_2630_4096,Gemm_Hipblaslt_TN_9192,0.5425
GemmTunableOp_Half_TN,tn_4096_184_7168,Gemm_Rocblas_621294168,0.038104
GemmTunableOp_Half_TN,tn_14336_894_4096,Gemm_Hipblaslt_TN_9677,0.183426
GemmTunableOp_Half_TN,tn_4096_7787_7168,Gemm_Hipblaslt_TN_9815,0.742243
GemmTunableOp_Half_TN,tn_4096_796_7168,Gemm_Hipblaslt_TN_9583,0.107727
GemmTunableOp_Half_TN,tn_14336_823_4096,Gemm_Hipblaslt_TN_9187,0.17805
GemmTunableOp_Half_TN,tn_4096_794_2048,Gemm_Hipblaslt_TN_9604,0.0341595
GemmTunableOp_Half_TN,tn_4096_889_2048,Gemm_Hipblaslt_TN_9576,0.0370662
GemmTunableOp_Half_TN,tn_3072_956_4096,Gemm_Hipblaslt_TN_9131,0.0595164
GemmTunableOp_Half_TN,tn_14336_1744_4096,Gemm_Hipblaslt_TN_9697,0.365266
GemmTunableOp_Half_TN,tn_4096_1730_7168,Gemm_Hipblaslt_TN_9673,0.196629
GemmTunableOp_Half_TN,tn_4096_1730_2048,Gemm_Hipblaslt_TN_9680,0.0625662
GemmTunableOp_Half_TN,tn_4096_2719_7168,Gemm_Hipblaslt_TN_9799,0.277739
GemmTunableOp_Half_TN,tn_3072_1817_4096,Gemm_Rocblas_621286778,0.0921889
GemmTunableOp_Half_TN,tn_4096_861_7168,Gemm_Hipblaslt_TN_9604,0.113474
GemmTunableOp_Half_TN,tn_4096_7992_7168,Gemm_Hipblaslt_TN_9869,0.753082
GemmTunableOp_Half_TN,tn_4096_248_2048,Gemm_Rocblas_621294175,0.014841
GemmTunableOp_Half_TN,tn_4096_799_7168,Gemm_Hipblaslt_TN_9147,0.108701
GemmTunableOp_Half_TN,tn_3072_7787_4096,Gemm_Hipblaslt_TN_9800,0.342518
GemmTunableOp_Half_TN,tn_4096_1600_2048,Gemm_Hipblaslt_TN_9588,0.0561612
GemmTunableOp_Half_TN,tn_4096_7857_2048,Gemm_Hipblaslt_TN_9768,0.230336
GemmTunableOp_Half_TN,tn_4096_2717_2048,Gemm_Hipblaslt_TN_9799,0.0860863
GemmTunableOp_Half_TN,tn_4096_1744_2048,Gemm_Hipblaslt_TN_9136,0.061992
GemmTunableOp_Half_TN,tn_4096_920_2048,Gemm_Hipblaslt_TN_9604,0.0385564
GemmTunableOp_Half_TN,tn_4096_2773_2048,Gemm_Hipblaslt_TN_9689,0.0878649
GemmTunableOp_Half_TN,tn_3072_1850_4096,Gemm_Hipblaslt_TN_9163,0.0947004
GemmTunableOp_Half_TN,tn_3072_1614_4096,Gemm_Rocblas_621286778,0.0888961
GemmTunableOp_Half_TN,tn_14336_3752_4096,Gemm_Hipblaslt_TN_9697,0.75105
GemmTunableOp_Half_TN,tn_3072_40_4096,Gemm_Rocblas_621286332,0.0104988
GemmTunableOp_Half_TN,tn_4096_2785_2048,Gemm_Hipblaslt_TN_9672,0.0876905
GemmTunableOp_Half_TN,tn_4096_3507_7168,Gemm_Hipblaslt_TN_9695,0.34184
GemmTunableOp_Half_TN,tn_4096_4242_7168,Gemm_Rocblas_621286742,0.395397
GemmTunableOp_Half_TN,tn_14336_3352_4096,Gemm_Rocblas_621286742,0.645245
GemmTunableOp_Half_TN,tn_14336_7436_4096,Gemm_Hipblaslt_TN_9933,1.48174
GemmTunableOp_Half_TN,tn_14336_136_4096,Gemm_Hipblaslt_TN_9312,0.0519552
GemmTunableOp_Half_TN,tn_14336_2635_4096,Gemm_Hipblaslt_TN_9192,0.540104
GemmTunableOp_Half_TN,tn_4096_1726_7168,Gemm_Hipblaslt_TN_9671,0.186359
GemmTunableOp_Half_TN,tn_64128_230_4096,Gemm_Rocblas_621294658,0.289047
GemmTunableOp_Half_TN,tn_4096_2762_2048,Gemm_Hipblaslt_TN_9687,0.0874694
GemmTunableOp_Half_TN,tn_14336_951_4096,Gemm_Hipblaslt_TN_9187,0.190105
GemmTunableOp_Half_TN,tn_3072_7952_4096,Gemm_Hipblaslt_TN_9805,0.34542
GemmTunableOp_Half_TN,tn_3072_1715_4096,Gemm_Rocblas_621286778,0.0895202
GemmTunableOp_Half_TN,tn_14336_7798_4096,Gemm_Hipblaslt_TN_9914,1.51385
GemmTunableOp_Half_TN,tn_3072_938_4096,Gemm_Hipblaslt_TN_9147,0.0584797
GemmTunableOp_Half_TN,tn_14336_112_4096,Gemm_Rocblas_621286470,0.0416318
GemmTunableOp_Half_TN,tn_4096_1834_7168,Gemm_Hipblaslt_TN_9137,0.20655
GemmTunableOp_Half_TN,tn_4096_8069_2048,Gemm_Hipblaslt_TN_9713,0.236219
GemmTunableOp_Half_TN,tn_4096_942_7168,Gemm_Hipblaslt_TN_9170,0.119538
GemmTunableOp_Half_TN,tn_14336_192_4096,Gemm_Hipblaslt_TN_9352,0.0599103
GemmTunableOp_Half_TN,tn_64128_6_4096,Gemm_Rocblas_621286348,0.142514
GemmTunableOp_Half_TN,tn_14336_1883_4096,Gemm_Hipblaslt_TN_9697,0.376227
GemmTunableOp_Half_TN,tn_14336_937_4096,Gemm_Hipblaslt_TN_9187,0.186937
GemmTunableOp_Half_TN,tn_3072_799_4096,Gemm_Hipblaslt_TN_9368,0.0509174
GemmTunableOp_Half_TN,tn_4096_7944_7168,Gemm_Hipblaslt_TN_9903,0.753529
GemmTunableOp_Half_TN,tn_3072_900_4096,Gemm_Hipblaslt_TN_9147,0.057962
GemmTunableOp_Half_TN,tn_14336_3402_4096,Gemm_Rocblas_621286693,0.658275
GemmTunableOp_Half_TN,tn_4096_912_7168,Gemm_Hipblaslt_TN_9634,0.117385
GemmTunableOp_Half_TN,tn_3072_891_4096,Gemm_Hipblaslt_TN_9546,0.058802
GemmTunableOp_Half_TN,tn_64128_194_4096,Gemm_Hipblaslt_TN_9898,0.269596
GemmTunableOp_Half_TN,tn_64128_63_4096,Gemm_Hipblaslt_TN_9097,0.163481
GemmTunableOp_Half_TN,tn_3072_3599_4096,Gemm_Rocblas_621286753,0.161198
GemmTunableOp_Half_TN,tn_64128_225_4096,Gemm_Rocblas_621286915,0.287049
GemmTunableOp_Half_TN,tn_4096_872_2048,Gemm_Hipblaslt_TN_9577,0.036729
GemmTunableOp_Half_TN,tn_3072_8049_4096,Gemm_Rocblas_621294473,0.347892
GemmTunableOp_Half_TN,tn_14336_813_4096,Gemm_Hipblaslt_TN_9677,0.176697
GemmTunableOp_Half_TN,tn_64128_57_4096,Gemm_Hipblaslt_TN_9097,0.164051
GemmTunableOp_Half_TN,tn_4096_811_2048,Gemm_Hipblaslt_TN_9604,0.0339755
GemmTunableOp_Half_TN,tn_14336_7992_4096,Gemm_Hipblaslt_TN_9933,1.54466
GemmTunableOp_Half_TN,tn_4096_968_2048,Gemm_Hipblaslt_TN_9577,0.0392888
GemmTunableOp_Half_TN,tn_4096_847_2048,Gemm_Hipblaslt_TN_9354,0.0361118
GemmTunableOp_Half_TN,tn_4096_915_7168,Gemm_Hipblaslt_TN_9576,0.118851
GemmTunableOp_Half_TN,tn_64128_239_4096,Gemm_Rocblas_621294658,0.288511
GemmTunableOp_Half_TN,tn_4096_2537_7168,Gemm_Hipblaslt_TN_9691,0.264264
GemmTunableOp_Half_TN,tn_3072_2544_4096,Gemm_Hipblaslt_TN_9624,0.120962
GemmTunableOp_Half_TN,tn_4096_2785_7168,Gemm_Hipblaslt_TN_9799,0.282184
GemmTunableOp_Half_TN,tn_64128_256_4096,Gemm_Rocblas_621294648,0.282896
GemmTunableOp_Half_TN,tn_4096_2721_7168,Gemm_Hipblaslt_TN_9799,0.280764
GemmTunableOp_Half_TN,tn_4096_3447_2048,Gemm_Hipblaslt_TN_9896,0.103075
GemmTunableOp_Half_TN,tn_4096_2628_2048,Gemm_Hipblaslt_TN_9687,0.0851054
GemmTunableOp_Half_TN,tn_4096_842_7168,Gemm_Hipblaslt_TN_9170,0.113325
GemmTunableOp_Half_TN,tn_4096_1746_2048,Gemm_Hipblaslt_TN_9590,0.0627107
GemmTunableOp_Half_TN,tn_4096_2805_2048,Gemm_Hipblaslt_TN_9799,0.0872941
GemmTunableOp_Half_TN,tn_14336_899_4096,Gemm_Hipblaslt_TN_9697,0.184222
GemmTunableOp_Half_TN,tn_14336_1854_4096,Gemm_Hipblaslt_TN_9677,0.373325
GemmTunableOp_Half_TN,tn_3072_861_4096,Gemm_Hipblaslt_TN_9047,0.0540106
GemmTunableOp_Half_TN,tn_14336_2805_4096,Gemm_Hipblaslt_TN_9677,0.563718
GemmTunableOp_Half_TN,tn_64128_87_4096,Gemm_Hipblaslt_TN_9058,0.182788
GemmTunableOp_Half_TN,tn_4096_1756_7168,Gemm_Hipblaslt_TN_9673,0.200542
GemmTunableOp_Half_TN,tn_4096_948_7168,Gemm_Hipblaslt_TN_9604,0.120946
GemmTunableOp_Half_TN,tn_4096_1694_7168,Gemm_Hipblaslt_TN_9610,0.186253
GemmTunableOp_Half_TN,tn_14336_893_4096,Gemm_Hipblaslt_TN_9677,0.182303
GemmTunableOp_Half_TN,tn_64128_203_4096,Gemm_Hipblaslt_TN_9768,0.274665
GemmTunableOp_Half_TN,tn_4096_813_7168,Gemm_Hipblaslt_TN_9158,0.111444
GemmTunableOp_Half_TN,tn_3072_834_4096,Gemm_Hipblaslt_TN_9368,0.0543829
GemmTunableOp_Half_TN,tn_4096_2658_2048,Gemm_Hipblaslt_TN_9799,0.0840208
GemmTunableOp_Half_TN,tn_64128_171_4096,Gemm_Hipblaslt_TN_9857,0.248492
GemmTunableOp_Half_TN,tn_64128_150_4096,Gemm_Hipblaslt_TN_9108,0.225596
GemmTunableOp_Half_TN,tn_3072_940_4096,Gemm_Hipblaslt_TN_9546,0.0581533
GemmTunableOp_Half_TN,tn_4096_1727_2048,Gemm_Hipblaslt_TN_9164,0.0580022
GemmTunableOp_Half_TN,tn_64128_97_4096,Gemm_Hipblaslt_TN_9061,0.196505
GemmTunableOp_Half_TN,tn_4096_930_2048,Gemm_Hipblaslt_TN_9604,0.0367289
GemmTunableOp_Half_TN,tn_4096_208_2048,Gemm_Rocblas_621294175,0.0143442
GemmTunableOp_Half_TN,tn_4096_957_2048,Gemm_Hipblaslt_TN_9604,0.036521
GemmTunableOp_Half_TN,tn_4096_88_2048,Gemm_Rocblas_621294027,0.00945053
GemmTunableOp_Half_TN,tn_14336_1822_4096,Gemm_Hipblaslt_TN_9697,0.372186
GemmTunableOp_Half_TN,tn_64128_119_4096,Gemm_Hipblaslt_TN_9596,0.202703
GemmTunableOp_Half_TN,tn_4096_1733_2048,Gemm_Hipblaslt_TN_9680,0.0623604
GemmTunableOp_Half_TN,tn_14336_880_4096,Gemm_Hipblaslt_TN_9139,0.181685
GemmTunableOp_Half_TN,tn_64128_25_4096,Gemm_Hipblaslt_TN_9094,0.146147
GemmTunableOp_Half_TN,tn_4096_905_2048,Gemm_Hipblaslt_TN_9604,0.0356789
GemmTunableOp_Half_TN,tn_64128_68_4096,Gemm_Hipblaslt_TN_9057,0.177523
GemmTunableOp_Half_TN,tn_14336_986_4096,Gemm_Hipblaslt_TN_9217,0.204486
GemmTunableOp_Half_TN,tn_3072_836_4096,Gemm_Hipblaslt_TN_9047,0.053288
GemmTunableOp_Half_TN,tn_4096_2590_2048,Gemm_Hipblaslt_TN_9657,0.0839999
GemmTunableOp_Half_TN,tn_14336_2734_4096,Gemm_Hipblaslt_TN_9677,0.560001
GemmTunableOp_Half_TN,tn_4096_1743_7168,Gemm_Hipblaslt_TN_9673,0.19686
GemmTunableOp_Half_TN,tn_3072_144_4096,Gemm_Hipblaslt_TN_9443,0.0171293
GemmTunableOp_Half_TN,tn_14336_1900_4096,Gemm_Hipblaslt_TN_9677,0.374803
GemmTunableOp_Half_TN,tn_4096_2699_2048,Gemm_Hipblaslt_TN_9687,0.0855421
GemmTunableOp_Half_TN,tn_14336_184_4096,Gemm_Hipblaslt_TN_9131,0.060204
GemmTunableOp_Half_TN,tn_4096_927_2048,Gemm_Hipblaslt_TN_9577,0.0375525
GemmTunableOp_Half_TN,tn_3072_1705_4096,Gemm_Hipblaslt_TN_9561,0.0882275
GemmTunableOp_Half_TN,tn_64128_254_4096,Gemm_Rocblas_621294658,0.290321
GemmTunableOp_Half_TN,tn_4096_802_2048,Gemm_Hipblaslt_TN_9634,0.0340583
GemmTunableOp_Half_TN,tn_4096_1785_7168,Gemm_Hipblaslt_TN_9645,0.201593
GemmTunableOp_Half_TN,tn_64128_255_4096,Gemm_Rocblas_621294648,0.290358
GemmTunableOp_Half_TN,tn_14336_48_4096,Gemm_Rocblas_621286462,0.0293427
GemmTunableOp_Half_TN,tn_4096_943_7168,Gemm_Hipblaslt_TN_9160,0.119674
GemmTunableOp_Half_TN,tn_4096_2672_2048,Gemm_Hipblaslt_TN_9657,0.0854083
GemmTunableOp_Half_TN,tn_14336_947_4096,Gemm_Hipblaslt_TN_9677,0.185294
GemmTunableOp_Half_TN,tn_3072_2719_4096,Gemm_Hipblaslt_TN_9567,0.127385
GemmTunableOp_Half_TN,tn_4096_834_7168,Gemm_Hipblaslt_TN_9158,0.11149
GemmTunableOp_Half_TN,tn_14336_939_4096,Gemm_Hipblaslt_TN_9677,0.184499
GemmTunableOp_Half_TN,tn_4096_1775_2048,Gemm_Hipblaslt_TN_9329,0.0623939
GemmTunableOp_Half_TN,tn_64128_215_4096,Gemm_Hipblaslt_TN_9185,0.276294
GemmTunableOp_Half_TN,tn_4096_803_7168,Gemm_Hipblaslt_TN_9099,0.109183
GemmTunableOp_Half_TN,tn_4096_988_2048,Gemm_Hipblaslt_TN_9604,0.0398697
GemmTunableOp_Half_TN,tn_64128_207_4096,Gemm_Hipblaslt_TN_9222,0.274018
GemmTunableOp_Half_TN,tn_14336_1768_4096,Gemm_Hipblaslt_TN_9677,0.365483
GemmTunableOp_Half_TN,tn_3072_1944_4096,Gemm_Hipblaslt_TN_9633,0.0986952
GemmTunableOp_Half_TN,tn_14336_128_4096,Gemm_Rocblas_621294206,0.0423677
GemmTunableOp_Half_TN,tn_14336_966_4096,Gemm_Hipblaslt_TN_9220,0.204295
GemmTunableOp_Half_TN,tn_4096_817_7168,Gemm_Hipblaslt_TN_9131,0.111046
GemmTunableOp_Half_TN,tn_4096_1931_7168,Gemm_Hipblaslt_TN_9645,0.209754
GemmTunableOp_Half_TN,tn_3072_1897_4096,Gemm_Hipblaslt_TN_9611,0.0945836
GemmTunableOp_Half_TN,tn_4096_152_7168,Gemm_Hipblaslt_TN_9298,0.0376601
GemmTunableOp_Half_TN,tn_64128_232_4096,Gemm_Rocblas_621286915,0.286515
GemmTunableOp_Half_TN,tn_3072_2590_4096,Gemm_Hipblaslt_TN_9645,0.124248
GemmTunableOp_Half_TN,tn_4096_886_2048,Gemm_Hipblaslt_TN_9577,0.0371051
GemmTunableOp_Half_TN,tn_14336_7809_4096,Gemm_Hipblaslt_TN_9904,1.5209
GemmTunableOp_Half_TN,tn_14336_944_4096,Gemm_Hipblaslt_TN_9677,0.184429
GemmTunableOp_Half_TN,tn_3072_1834_4096,Gemm_Hipblaslt_TN_9720,0.0945859
GemmTunableOp_Half_TN,tn_64128_130_4096,Gemm_Hipblaslt_TN_9063,0.219151
GemmTunableOp_Half_TN,tn_4096_932_2048,Gemm_Hipblaslt_TN_9604,0.0377899
GemmTunableOp_Half_TN,tn_64128_142_4096,Gemm_Hipblaslt_TN_9623,0.222696
GemmTunableOp_Half_TN,tn_4096_144_2048,Gemm_Rocblas_621294175,0.0123861
GemmTunableOp_Half_TN,tn_14336_924_4096,Gemm_Hipblaslt_TN_9697,0.186405
GemmTunableOp_Half_TN,tn_4096_2750_7168,Gemm_Hipblaslt_TN_9799,0.281527
GemmTunableOp_Half_TN,tn_4096_2672_7168,Gemm_Hipblaslt_TN_9691,0.275165
GemmTunableOp_Half_TN,tn_4096_7823_7168,Gemm_Rocblas_621286678,0.74591
GemmTunableOp_Half_TN,tn_3072_893_4096,Gemm_Hipblaslt_TN_9147,0.0579056
GemmTunableOp_Half_TN,tn_3072_957_4096,Gemm_Hipblaslt_TN_9131,0.0590251
GemmTunableOp_Half_TN,tn_3072_152_4096,Gemm_Rocblas_621286437,0.0188117
GemmTunableOp_Half_TN,tn_14336_923_4096,Gemm_Hipblaslt_TN_9697,0.184696
GemmTunableOp_Half_TN,tn_3072_3711_4096,Gemm_Hipblaslt_TN_9805,0.165051
GemmTunableOp_Half_TN,tn_3072_988_4096,Gemm_Hipblaslt_TN_9131,0.0587239
GemmTunableOp_Half_TN,tn_3072_1813_4096,Gemm_Rocblas_621294520,0.0924682
GemmTunableOp_Half_TN,tn_4096_870_7168,Gemm_Hipblaslt_TN_9170,0.116639
GemmTunableOp_Half_TN,tn_3072_879_4096,Gemm_Hipblaslt_TN_9352,0.0565654
GemmTunableOp_Half_TN,tn_14336_862_4096,Gemm_Hipblaslt_TN_9697,0.182063
GemmTunableOp_Half_TN,tn_64128_107_4096,Gemm_Rocblas_621294762,0.199769
GemmTunableOp_Half_TN,tn_3072_7863_4096,Gemm_Hipblaslt_TN_9779,0.343225
GemmTunableOp_Half_TN,tn_4096_982_2048,Gemm_Hipblaslt_TN_9634,0.0401822
GemmTunableOp_Half_TN,tn_3072_1700_4096,Gemm_Hipblaslt_TN_9322,0.0897376
GemmTunableOp_Half_TN,tn_14336_1835_4096,Gemm_Hipblaslt_TN_9677,0.36822
GemmTunableOp_Half_TN,tn_64128_18_4096,Gemm_Rocblas_621286348,0.14465
GemmTunableOp_Half_TN,tn_4096_8156_2048,Gemm_Hipblaslt_TN_9813,0.235156
GemmTunableOp_Half_TN,tn_4096_816_2048,Gemm_Hipblaslt_TN_9352,0.0336301
GemmTunableOp_Half_TN,tn_3072_794_4096,Gemm_Hipblaslt_TN_9368,0.0535055
GemmTunableOp_Half_TN,tn_14336_1828_4096,Gemm_Hipblaslt_TN_9697,0.370687
GemmTunableOp_Half_TN,tn_3072_1828_4096,Gemm_Hipblaslt_TN_9324,0.0932969
GemmTunableOp_Half_TN,tn_4096_925_7168,Gemm_Hipblaslt_TN_9170,0.118752
GemmTunableOp_Half_TN,tn_14336_982_4096,Gemm_Hipblaslt_TN_9217,0.20385
GemmTunableOp_Half_TN,tn_14336_901_4096,Gemm_Hipblaslt_TN_9697,0.184964
GemmTunableOp_Half_TN,tn_3072_2785_4096,Gemm_Hipblaslt_TN_9624,0.129566
GemmTunableOp_Half_TN,tn_3072_32_4096,Gemm_Rocblas_621294054,0.00937962
GemmTunableOp_Half_TN,tn_5120_232_8192,Gemm_Rocblas_621286764,0.0575177
GemmTunableOp_Half_TN,tn_14336_932_4096,Gemm_Hipblaslt_TN_9697,0.184497
GemmTunableOp_Half_TN,tn_4096_817_2048,Gemm_Hipblaslt_TN_9352,0.034394
GemmTunableOp_Half_TN,tn_3072_796_4096,Gemm_Hipblaslt_TN_9368,0.0539532
GemmTunableOp_Half_TN,tn_4096_943_2048,Gemm_Hipblaslt_TN_9577,0.0380645
GemmTunableOp_Half_TN,tn_64128_73_4096,Gemm_Hipblaslt_TN_9057,0.17833
GemmTunableOp_Half_TN,tn_4096_814_7168,Gemm_Hipblaslt_TN_9170,0.111387
GemmTunableOp_Half_TN,tn_64128_121_4096,Gemm_Rocblas_621294762,0.201238
GemmTunableOp_Half_TN,tn_4096_885_7168,Gemm_Rocblas_621286770,0.118526
GemmTunableOp_Half_TN,tn_4096_1715_2048,Gemm_Hipblaslt_TN_9164,0.0575229
GemmTunableOp_Half_TN,tn_4096_949_2048,Gemm_Hipblaslt_TN_9577,0.0378878
GemmTunableOp_Half_TN,tn_3072_848_4096,Gemm_Hipblaslt_TN_9368,0.0526239
GemmTunableOp_Half_TN,tn_14336_32_4096,Gemm_Rocblas_621286427,0.0259107
GemmTunableOp_Half_TN,tn_3072_847_4096,Gemm_Hipblaslt_TN_9047,0.0545515
GemmTunableOp_Half_TN,tn_3072_3447_4096,Gemm_Hipblaslt_TN_9681,0.15398
GemmTunableOp_Half_TN,tn_3072_2708_4096,Gemm_Hipblaslt_TN_9624,0.12752
GemmTunableOp_Half_TN,tn_4096_1724_2048,Gemm_Hipblaslt_TN_9588,0.0596651
GemmTunableOp_Half_TN,tn_3072_930_4096,Gemm_Hipblaslt_TN_9131,0.0587076
GemmTunableOp_Half_TN,tn_14336_868_4096,Gemm_Hipblaslt_TN_9187,0.18093
GemmTunableOp_Half_TN,tn_3072_2651_4096,Gemm_Hipblaslt_TN_9134,0.123415
GemmTunableOp_Half_TN,tn_14336_7944_4096,Gemm_Hipblaslt_TN_9933,1.54116
GemmTunableOp_Half_TN,tn_3072_1798_4096,Gemm_Rocblas_621286778,0.0907445
GemmTunableOp_Half_TN,tn_14336_2717_4096,Gemm_Hipblaslt_TN_9192,0.558959
GemmTunableOp_Half_TN,tn_3072_920_4096,Gemm_Hipblaslt_TN_9131,0.0583591
GemmTunableOp_Half_TN,tn_14336_8000_4096,Gemm_Hipblaslt_TN_9933,1.54384
GemmTunableOp_Half_TN,tn_4096_842_2048,Gemm_Hipblaslt_TN_9577,0.035334
GemmTunableOp_Half_TN,tn_4096_815_2048,Gemm_Hipblaslt_TN_9634,0.0343866
GemmTunableOp_Half_TN,tn_64128_116_4096,Gemm_Rocblas_621294762,0.201037
GemmTunableOp_Half_TN,tn_4096_1762_2048,Gemm_Hipblaslt_TN_9329,0.0630862
GemmTunableOp_Half_TN,tn_3072_1795_4096,Gemm_Rocblas_621294520,0.0910625
GemmTunableOp_Half_TN,tn_64128_31_4096,Gemm_Hipblaslt_TN_9094,0.147135
GemmTunableOp_Half_TN,tn_3072_1864_4096,Gemm_Hipblaslt_TN_9148,0.0938699
GemmTunableOp_Half_TN,tn_3072_918_4096,Gemm_Hipblaslt_TN_9131,0.0588374
GemmTunableOp_Half_TN,tn_4096_865_7168,Gemm_Hipblaslt_TN_9547,0.115854
GemmTunableOp_Half_TN,tn_14336_1673_4096,Gemm_Hipblaslt_TN_9189,0.357392
GemmTunableOp_Half_TN,tn_3072_2732_4096,Gemm_Hipblaslt_TN_9624,0.126716
GemmTunableOp_Half_TN,tn_3072_825_4096,Gemm_Hipblaslt_TN_9047,0.0527677
GemmTunableOp_Half_TN,tn_3072_805_4096,Gemm_Hipblaslt_TN_9368,0.0519265
GemmTunableOp_Half_TN,tn_4096_1701_2048,Gemm_Hipblaslt_TN_9164,0.0584179
GemmTunableOp_Half_TN,tn_64128_198_4096,Gemm_Hipblaslt_TN_9222,0.272172
GemmTunableOp_Half_TN,tn_4096_1831_2048,Gemm_Hipblaslt_TN_9590,0.063426
GemmTunableOp_Half_TN,tn_4096_2628_7168,Gemm_Hipblaslt_TN_9799,0.271667
GemmTunableOp_Half_TN,tn_14336_852_4096,Gemm_Hipblaslt_TN_9697,0.180894
GemmTunableOp_Half_TN,tn_3072_4242_4096,Gemm_Hipblaslt_TN_9656,0.184758
GemmTunableOp_Half_TN,tn_14336_8192_4096,Gemm_Hipblaslt_TN_9749,1.58295
GemmTunableOp_Half_TN,tn_14336_871_4096,Gemm_Hipblaslt_TN_9677,0.180868
GemmTunableOp_Half_TN,tn_4096_936_7168,Gemm_Hipblaslt_TN_9170,0.119446
GemmTunableOp_Half_TN,tn_14336_790_4096,Gemm_Hipblaslt_TN_9691,0.163932
GemmTunableOp_Half_TN,tn_4096_805_2048,Gemm_Hipblaslt_TN_9634,0.0345956
GemmTunableOp_Half_TN,tn_64128_49_4096,Gemm_Hipblaslt_TN_9097,0.161441
GemmTunableOp_Half_TN,tn_4096_832_2048,Gemm_Hipblaslt_TN_9604,0.0351444
GemmTunableOp_Half_TN,tn_4096_898_2048,Gemm_Hipblaslt_TN_9577,0.0373166
GemmTunableOp_Half_TN,tn_14336_799_4096,Gemm_Hipblaslt_TN_9691,0.16587
GemmTunableOp_Half_TN,tn_4096_1737_7168,Gemm_Hipblaslt_TN_9673,0.198235
GemmTunableOp_Half_TN,tn_3072_7798_4096,Gemm_Rocblas_621294473,0.341229
GemmTunableOp_Half_TN,tn_4096_911_2048,Gemm_Hipblaslt_TN_9604,0.0365211
GemmTunableOp_Half_TN,tn_3072_959_4096,Gemm_Hipblaslt_TN_9546,0.0594425
GemmTunableOp_Half_TN,tn_4096_904_7168,Gemm_Hipblaslt_TN_9604,0.118718
GemmTunableOp_Half_TN,tn_4096_1693_2048,Gemm_Hipblaslt_TN_9588,0.0585654
GemmTunableOp_Half_TN,tn_4096_972_7168,Gemm_Hipblaslt_TN_9604,0.12346
GemmTunableOp_Half_TN,tn_14336_816_4096,Gemm_Hipblaslt_TN_9677,0.177823
GemmTunableOp_Half_TN,tn_4096_2670_2048,Gemm_Hipblaslt_TN_9672,0.085074
GemmTunableOp_Half_TN,tn_4096_804_7168,Gemm_Hipblaslt_TN_9147,0.105557
GemmTunableOp_Half_TN,tn_4096_1719_2048,Gemm_Hipblaslt_TN_9164,0.0569347
GemmTunableOp_Half_TN,tn_4096_96_7168,Gemm_Hipblaslt_TN_9440,0.0248134
GemmTunableOp_Half_TN,tn_14336_896_4096,Gemm_Hipblaslt_TN_9697,0.184298
GemmTunableOp_Half_TN,tn_3072_1854_4096,Gemm_Hipblaslt_TN_9613,0.094053
GemmTunableOp_Half_TN,tn_3072_240_4096,Gemm_Rocblas_621286440,0.0233205
GemmTunableOp_Half_TN,tn_3072_1837_4096,Gemm_Hipblaslt_TN_9613,0.0935791
GemmTunableOp_Half_TN,tn_4096_4463_2048,Gemm_Hipblaslt_TN_9763,0.139525
GemmTunableOp_Half_TN,tn_64128_108_4096,Gemm_Hipblaslt_TN_9596,0.199505
GemmTunableOp_Half_TN,tn_5120_4000_8192,Gemm_Hipblaslt_TN_9649,0.583654
GemmTunableOp_Half_TN,tn_28672_256_8192,Gemm_Rocblas_621294717,0.290593
GemmTunableOp_Half_TN,tn_4096_1827_2048,Gemm_Hipblaslt_TN_9590,0.0630711
GemmTunableOp_Half_TN,tn_3072_2681_4096,Gemm_Hipblaslt_TN_9329,0.125554
GemmTunableOp_Half_TN,tn_4096_2773_7168,Gemm_Hipblaslt_TN_9691,0.283084
GemmTunableOp_Half_TN,tn_3072_934_4096,Gemm_Hipblaslt_TN_9546,0.0579976
GemmTunableOp_Half_TN,tn_3072_7804_4096,Gemm_Hipblaslt_TN_9622,0.340978
GemmTunableOp_Half_TN,tn_4096_192_7168,Gemm_Hipblaslt_TN_9470,0.0387183
GemmTunableOp_Half_TN,tn_14336_873_4096,Gemm_Hipblaslt_TN_9677,0.180142
GemmTunableOp_Half_TN,tn_14336_1807_4096,Gemm_Hipblaslt_TN_9139,0.371597
GemmTunableOp_Half_TN,tn_64128_106_4096,Gemm_Rocblas_621294762,0.198252
GemmTunableOp_Half_TN,tn_4096_1798_2048,Gemm_Hipblaslt_TN_9590,0.0622254
GemmTunableOp_Half_TN,tn_4096_845_2048,Gemm_Hipblaslt_TN_9352,0.0345801
GemmTunableOp_Half_TN,tn_3072_1893_4096,Gemm_Hipblaslt_TN_9561,0.0901814
GemmTunableOp_Half_TN,tn_5120_4096_8192,Gemm_Rocblas_621286651,0.599902
GemmTunableOp_Half_TN,tn_3072_1759_4096,Gemm_Hipblaslt_TN_9612,0.0916859
GemmTunableOp_Half_TN,tn_4096_2805_7168,Gemm_Hipblaslt_TN_9799,0.285099
GemmTunableOp_Half_TN,tn_14336_926_4096,Gemm_Hipblaslt_TN_9697,0.18595
GemmTunableOp_Half_TN,tn_4096_891_7168,Gemm_Hipblaslt_TN_9170,0.117848
GemmTunableOp_Half_TN,tn_3072_8007_4096,Gemm_Rocblas_621294473,0.346303
GemmTunableOp_Half_TN,tn_3072_2601_4096,Gemm_Hipblaslt_TN_9645,0.124089
GemmTunableOp_Half_TN,tn_14336_2606_4096,Gemm_Hipblaslt_TN_9677,0.542172
GemmTunableOp_Half_TN,tn_3072_889_4096,Gemm_Hipblaslt_TN_9546,0.0591264
GemmTunableOp_Half_TN,tn_3072_899_4096,Gemm_Hipblaslt_TN_9352,0.0582452
GemmTunableOp_Half_TN,tn_14336_1727_4096,Gemm_Hipblaslt_TN_9697,0.358107
GemmTunableOp_Half_TN,tn_4096_809_2048,Gemm_Hipblaslt_TN_9352,0.0339552
GemmTunableOp_Half_TN,tn_4096_961_2048,Gemm_Hipblaslt_TN_9577,0.0391421
GemmTunableOp_Half_TN,tn_4096_969_7168,Gemm_Hipblaslt_TN_9604,0.123314
GemmTunableOp_Half_TN,tn_64128_253_4096,Gemm_Rocblas_621286915,0.290674
GemmTunableOp_Half_TN,tn_14336_4483_4096,Gemm_Hipblaslt_TN_9220,0.882487
GemmTunableOp_Half_TN,tn_4096_1768_7168,Gemm_Hipblaslt_TN_9645,0.200964
GemmTunableOp_Half_TN,tn_14336_232_4096,Gemm_Hipblaslt_TN_9634,0.0663845
GemmTunableOp_Half_TN,tn_4096_7953_7168,Gemm_Hipblaslt_TN_9933,0.750754
GemmTunableOp_Half_TN,tn_4096_819_7168,Gemm_Hipblaslt_TN_9158,0.111669
GemmTunableOp_Half_TN,tn_14336_3599_4096,Gemm_Hipblaslt_TN_9192,0.734637
GemmTunableOp_Half_TN,tn_4096_2601_7168,Gemm_Hipblaslt_TN_9799,0.269566
GemmTunableOp_Half_TN,tn_3072_968_4096,Gemm_Hipblaslt_TN_9131,0.0595923
GemmTunableOp_Half_TN,tn_14336_3670_4096,Gemm_Hipblaslt_TN_9187,0.739959
GemmTunableOp_Half_TN,tn_4096_795_2048,Gemm_Hipblaslt_TN_9634,0.0339419
GemmTunableOp_Half_TN,tn_3072_232_4096,Gemm_Rocblas_621286440,0.0225741
GemmTunableOp_Half_TN,tn_14336_2544_4096,Gemm_Rocblas_621286575,0.512817
GemmTunableOp_Half_TN,tn_4096_1883_2048,Gemm_Hipblaslt_TN_9590,0.0641078
GemmTunableOp_Half_TN,tn_3072_216_4096,Gemm_Rocblas_621294168,0.0228917
GemmTunableOp_Half_TN,tn_4096_3418_7168,Gemm_Hipblaslt_TN_9139,0.335283
GemmTunableOp_Half_TN,tn_4096_3418_2048,Gemm_Hipblaslt_TN_9896,0.102939
GemmTunableOp_Half_TN,tn_3072_2509_4096,Gemm_Hipblaslt_TN_9624,0.121351
GemmTunableOp_Half_TN,tn_14336_1723_4096,Gemm_Hipblaslt_TN_9697,0.359437
GemmTunableOp_Half_TN,tn_14336_2788_4096,Gemm_Hipblaslt_TN_9677,0.562402
GemmTunableOp_Half_TN,tn_4096_1854_2048,Gemm_Hipblaslt_TN_9590,0.0627198
GemmTunableOp_Half_TN,tn_14336_992_4096,Gemm_Hipblaslt_TN_9217,0.203509
GemmTunableOp_Half_TN,tn_4096_7937_7168,Gemm_Hipblaslt_TN_9903,0.754739
GemmTunableOp_Half_TN,tn_4096_900_2048,Gemm_Hipblaslt_TN_9355,0.0373679
GemmTunableOp_Half_TN,tn_64128_172_4096,Gemm_Hipblaslt_TN_9855,0.2489
GemmTunableOp_Half_TN,tn_3072_1831_4096,Gemm_Hipblaslt_TN_9561,0.093017
GemmTunableOp_Half_TN,tn_4096_2786_7168,Gemm_Hipblaslt_TN_9799,0.282891
GemmTunableOp_Half_TN,tn_3072_859_4096,Gemm_Hipblaslt_TN_9368,0.052003
GemmTunableOp_Half_TN,tn_64128_85_4096,Gemm_Hipblaslt_TN_9057,0.180557
GemmTunableOp_Half_TN,tn_4096_2682_2048,Gemm_Hipblaslt_TN_9657,0.0853997
GemmTunableOp_Half_TN,tn_4096_2722_7168,Gemm_Hipblaslt_TN_9799,0.281127
GemmTunableOp_Half_TN,tn_4096_72_2048,Gemm_Rocblas_621286280,0.00913966
GemmTunableOp_Half_TN,tn_4096_2826_2048,Gemm_Hipblaslt_TN_9672,0.0878269
GemmTunableOp_Half_TN,tn_14336_2572_4096,Gemm_Hipblaslt_TN_9677,0.538799
GemmTunableOp_Half_TN,tn_3072_80_4096,Gemm_Rocblas_621286278,0.0135843
GemmTunableOp_Half_TN,tn_14336_96_4096,Gemm_Hipblaslt_TN_9350,0.0364064
GemmTunableOp_Half_TN,tn_14336_120_4096,Gemm_Rocblas_621286470,0.0424218
GemmTunableOp_Half_TN,tn_3072_8000_4096,Gemm_Rocblas_621294473,0.343726
GemmTunableOp_Half_TN,tn_3072_8192_4096,Gemm_Hipblaslt_TN_9935,0.355055
GemmTunableOp_Half_TN,tn_64128_44_4096,Gemm_Hipblaslt_TN_9144,0.157835
GemmTunableOp_Half_TN,tn_4096_104_2048,Gemm_Rocblas_621286278,0.0106872
GemmTunableOp_Half_TN,tn_4096_40_2048,Gemm_Rocblas_621294155,0.00792745
GemmTunableOp_Half_TN,tn_3072_1695_4096,Gemm_Hipblaslt_TN_9322,0.0894527
GemmTunableOp_Half_TN,tn_4096_16_2048,Gemm_Rocblas_621294144,0.00721358
GemmTunableOp_Half_TN,tn_64128_186_4096,Gemm_Hipblaslt_TN_9694,0.252986
GemmTunableOp_Half_TN,tn_14336_843_4096,Gemm_Hipblaslt_TN_9677,0.179826
GemmTunableOp_Half_TN,tn_4096_2544_7168,Gemm_Hipblaslt_TN_9672,0.264555
GemmTunableOp_Half_TN,tn_4096_983_7168,Gemm_Hipblaslt_TN_9160,0.124499
GemmTunableOp_Half_TN,tn_4096_120_2048,Gemm_Rocblas_621286280,0.0108113
GemmTunableOp_Half_TN,tn_4096_1649_7168,Gemm_Hipblaslt_TN_9679,0.183309
GemmTunableOp_Half_TN,tn_4096_854_2048,Gemm_Hipblaslt_TN_9577,0.0362714
GemmTunableOp_Half_TN,tn_3072_929_4096,Gemm_Hipblaslt_TN_9546,0.0585732
GemmTunableOp_Half_TN,tn_14336_859_4096,Gemm_Hipblaslt_TN_9697,0.182521
GemmTunableOp_Half_TN,tn_4096_136_2048,Gemm_Rocblas_621286443,0.0124985
GemmTunableOp_Half_TN,tn_3072_7967_4096,Gemm_Rocblas_621294473,0.345736
GemmTunableOp_Half_TN,tn_64128_81_4096,Gemm_Hipblaslt_TN_9057,0.180322
GemmTunableOp_Half_TN,tn_4096_7299_2048,Gemm_Hipblaslt_TN_9713,0.222194
GemmTunableOp_Half_TN,tn_3072_983_4096,Gemm_Hipblaslt_TN_9131,0.0589539
GemmTunableOp_Half_TN,tn_14336_804_4096,Gemm_Hipblaslt_TN_9677,0.175604
GemmTunableOp_Half_TN,tn_4096_216_2048,Gemm_Rocblas_621286447,0.0142253
GemmTunableOp_Half_TN,tn_64128_205_4096,Gemm_Rocblas_621286797,0.273244
GemmTunableOp_Half_TN,tn_14336_144_4096,Gemm_Hipblaslt_TN_9312,0.0510516
GemmTunableOp_Half_TN,tn_4096_862_2048,Gemm_Hipblaslt_TN_9354,0.0357775
GemmTunableOp_Half_TN,tn_4096_240_2048,Gemm_Rocblas_621294173,0.0150228
GemmTunableOp_Half_TN,tn_4096_1806_2048,Gemm_Hipblaslt_TN_9590,0.0623461
GemmTunableOp_Half_TN,tn_3072_1853_4096,Gemm_Hipblaslt_TN_9324,0.0925869
GemmTunableOp_Half_TN,tn_4096_972_2048,Gemm_Hipblaslt_TN_9589,0.0385345
GemmTunableOp_Half_TN,tn_4096_887_2048,Gemm_Hipblaslt_TN_9576,0.037186
GemmTunableOp_Half_TN,tn_4096_3711_7168,Gemm_Hipblaslt_TN_9827,0.3616
GemmTunableOp_Half_TN,tn_64128_117_4096,Gemm_Rocblas_621294762,0.201738
GemmTunableOp_Half_TN,tn_4096_814_2048,Gemm_Hipblaslt_TN_9577,0.0354711
GemmTunableOp_Half_TN,tn_14336_1886_4096,Gemm_Hipblaslt_TN_9697,0.376037
GemmTunableOp_Half_TN,tn_3072_1785_4096,Gemm_Hipblaslt_TN_9322,0.091555
GemmTunableOp_Half_TN,tn_14336_1743_4096,Gemm_Hipblaslt_TN_9793,0.365105
GemmTunableOp_Half_TN,tn_4096_1807_7168,Gemm_Hipblaslt_TN_9267,0.202616
GemmTunableOp_Half_TN,tn_14336_8154_4096,Gemm_Hipblaslt_TN_9813,1.58417
GemmTunableOp_Half_TN,tn_4096_240_7168,Gemm_Hipblaslt_TN_9303,0.0436329
GemmTunableOp_Half_TN,tn_3072_921_4096,Gemm_Hipblaslt_TN_9131,0.0573307
GemmTunableOp_Half_TN,tn_3072_1846_4096,Gemm_Hipblaslt_TN_9148,0.0934592
GemmTunableOp_Half_TN,tn_4096_3571_2048,Gemm_Hipblaslt_TN_9696,0.107167
GemmTunableOp_Half_TN,tn_14336_1700_4096,Gemm_Hipblaslt_TN_9697,0.356496
GemmTunableOp_Half_TN,tn_3072_807_4096,Gemm_Hipblaslt_TN_9048,0.0527225
GemmTunableOp_Half_TN,tn_4096_7804_2048,Gemm_Hipblaslt_TN_9768,0.228907
GemmTunableOp_Half_TN,tn_4096_966_2048,Gemm_Hipblaslt_TN_9583,0.0391021
GemmTunableOp_Half_TN,tn_4096_1829_2048,Gemm_Hipblaslt_TN_9590,0.0631882
GemmTunableOp_Half_TN,tn_4096_892_2048,Gemm_Hipblaslt_TN_9634,0.0372653
GemmTunableOp_Half_TN,tn_64128_173_4096,Gemm_Hipblaslt_TN_9816,0.249968
GemmTunableOp_Half_TN,tn_4096_248_7168,Gemm_Rocblas_621294171,0.0456731
GemmTunableOp_Half_TN,tn_14336_2732_4096,Gemm_Hipblaslt_TN_9677,0.557486
GemmTunableOp_Half_TN,tn_3072_8_4096,Gemm_Rocblas_621294130,0.00824873
GemmTunableOp_Half_TN,tn_3072_905_4096,Gemm_Hipblaslt_TN_9352,0.0576644
GemmTunableOp_Half_TN,tn_14336_2592_4096,Gemm_Hipblaslt_TN_9192,0.542815
GemmTunableOp_Half_TN,tn_3072_922_4096,Gemm_Hipblaslt_TN_9352,0.0578669
GemmTunableOp_Half_TN,tn_3072_817_4096,Gemm_Hipblaslt_TN_9047,0.0532635
GemmStridedBatchedTunableOp_Half_TN,tn_958_958_128_B_16,Gemm_Rocblas_621294536,0.0273418
GemmStridedBatchedTunableOp_Half_TN,tn_822_822_128_B_16,Gemm_Rocblas_621294635,0.0243574
GemmStridedBatchedTunableOp_Half_TN,tn_871_871_128_B_16,Gemm_Rocblas_621286984,0.0262791
GemmStridedBatchedTunableOp_Half_TN,tn_966_966_128_B_16,Gemm_Rocblas_621286794,0.0286994
GemmStridedBatchedTunableOp_Half_TN,tn_785_785_128_B_16,Gemm_Rocblas_621286661,0.0221236
GemmStridedBatchedTunableOp_Half_TN,tn_815_815_128_B_16,Gemm_Hipblaslt_TN_158,0.0237209
GemmStridedBatchedTunableOp_Half_TN,tn_843_843_128_B_16,Gemm_Rocblas_621294635,0.0254845
GemmStridedBatchedTunableOp_Half_TN,tn_821_821_128_B_16,Gemm_Hipblaslt_TN_158,0.0244547
GemmStridedBatchedTunableOp_Half_TN,tn_935_935_128_B_16,Gemm_Rocblas_621286794,0.0275971
GemmStridedBatchedTunableOp_Half_TN,tn_862_862_128_B_16,Gemm_Rocblas_621294728,0.0258472
GemmStridedBatchedTunableOp_Half_TN,tn_800_800_128_B_16,Gemm_Hipblaslt_TN_150,0.0176716
GemmStridedBatchedTunableOp_Half_TN,tn_883_883_128_B_16,Gemm_Rocblas_621294728,0.0261652
GemmStridedBatchedTunableOp_Half_TN,tn_851_851_128_B_16,Gemm_Rocblas_621294536,0.0258404
GemmStridedBatchedTunableOp_Half_TN,tn_874_874_128_B_16,Gemm_Rocblas_621294728,0.0261626
GemmStridedBatchedTunableOp_Half_TN,tn_908_908_128_B_16,Gemm_Rocblas_621286794,0.0268073
GemmStridedBatchedTunableOp_Half_TN,tn_838_838_128_B_16,Gemm_Rocblas_621294552,0.0249656
GemmStridedBatchedTunableOp_Half_TN,tn_926_926_128_B_16,Gemm_Rocblas_621294536,0.027352
GemmStridedBatchedTunableOp_Half_TN,tn_896_896_128_B_16,Gemm_Hipblaslt_TN_150,0.018989
GemmStridedBatchedTunableOp_Half_TN,tn_830_830_128_B_16,Gemm_Rocblas_621294635,0.0246829
GemmStridedBatchedTunableOp_Half_TN,tn_884_884_128_B_16,Gemm_Rocblas_621294728,0.0258352
GemmStridedBatchedTunableOp_Half_TN,tn_803_803_128_B_16,Gemm_Hipblaslt_TN_158,0.0232463
GemmStridedBatchedTunableOp_Half_TN,tn_1000_1000_128_B_32,Gemm_Hipblaslt_TN_149,0.0449833
GemmStridedBatchedTunableOp_Half_TN,tn_932_932_128_B_16,Gemm_Rocblas_621294536,0.0273627
GemmStridedBatchedTunableOp_Half_TN,tn_834_834_128_B_16,Gemm_Hipblaslt_TN_158,0.0249463
GemmStridedBatchedTunableOp_Half_TN,tn_875_875_128_B_16,Gemm_Rocblas_621286984,0.0262326
GemmStridedBatchedTunableOp_Half_TN,tn_898_898_128_B_16,Gemm_Rocblas_621286794,0.0266191
GemmStridedBatchedTunableOp_Half_TN,tn_955_955_128_B_16,Gemm_Rocblas_621286794,0.027628
GemmStridedBatchedTunableOp_Half_TN,tn_892_892_128_B_16,Gemm_Rocblas_621294728,0.0263379
GemmStridedBatchedTunableOp_Half_TN,tn_805_805_128_B_16,Gemm_Hipblaslt_TN_158,0.0228545
GemmStridedBatchedTunableOp_Half_TN,tn_789_789_128_B_16,Gemm_Hipblaslt_TN_158,0.0225483
GemmStridedBatchedTunableOp_Half_TN,tn_792_792_128_B_16,Gemm_Hipblaslt_TN_150,0.0190648
GemmStridedBatchedTunableOp_Half_TN,tn_802_802_128_B_16,Gemm_Hipblaslt_TN_158,0.0224755
GemmStridedBatchedTunableOp_Half_TN,tn_819_819_128_B_16,Gemm_Rocblas_621294551,0.0242205
GemmStridedBatchedTunableOp_Half_TN,tn_950_950_128_B_16,Gemm_Rocblas_621286794,0.0276365
GemmStridedBatchedTunableOp_Half_TN,tn_880_880_128_B_16,Gemm_Hipblaslt_TN_150,0.0188501
GemmStridedBatchedTunableOp_Half_TN,tn_790_790_128_B_16,Gemm_Rocblas_621286661,0.0232599
GemmStridedBatchedTunableOp_Half_TN,tn_909_909_128_B_16,Gemm_Rocblas_621294536,0.0266699
GemmStridedBatchedTunableOp_Half_TN,tn_837_837_128_B_16,Gemm_Hipblaslt_TN_158,0.0247922
GemmStridedBatchedTunableOp_Half_TN,tn_841_841_128_B_16,Gemm_Rocblas_621294728,0.0257824
GemmStridedBatchedTunableOp_Half_TN,tn_988_988_128_B_16,Gemm_Rocblas_621286794,0.0286575
GemmStridedBatchedTunableOp_Half_TN,tn_944_944_128_B_16,Gemm_Rocblas_621293994,0.0240944
GemmStridedBatchedTunableOp_Half_TN,tn_947_947_128_B_16,Gemm_Rocblas_621294536,0.027652
GemmStridedBatchedTunableOp_Half_TN,tn_965_965_128_B_16,Gemm_Rocblas_621286794,0.0281495
GemmStridedBatchedTunableOp_Half_TN,tn_918_918_128_B_16,Gemm_Rocblas_621294536,0.0273258
GemmStridedBatchedTunableOp_Half_TN,tn_982_982_128_B_16,Gemm_Rocblas_621286794,0.0287549
GemmStridedBatchedTunableOp_Half_TN,tn_813_813_128_B_16,Gemm_Rocblas_621286811,0.0237216
GemmStridedBatchedTunableOp_Half_TN,tn_920_920_128_B_16,Gemm_Rocblas_621293994,0.0243333
GemmStridedBatchedTunableOp_Half_TN,tn_930_930_128_B_16,Gemm_Rocblas_621286794,0.0273277
GemmStridedBatchedTunableOp_Half_TN,tn_852_852_128_B_16,Gemm_Rocblas_621286718,0.0250116
GemmStridedBatchedTunableOp_Half_TN,tn_951_951_128_B_16,Gemm_Rocblas_621286794,0.0273928
GemmStridedBatchedTunableOp_Half_TN,tn_807_807_128_B_16,Gemm_Hipblaslt_TN_158,0.023503
GemmStridedBatchedTunableOp_Half_TN,tn_818_818_128_B_16,Gemm_Hipblaslt_TN_158,0.023647
GemmStridedBatchedTunableOp_Half_TN,tn_943_943_128_B_16,Gemm_Rocblas_621294536,0.0280206
GemmTunableOp_Half_TN,tn_3072_877_4096,Gemm_Hipblaslt_TN_9147,0.0579361
GemmTunableOp_Half_TN,tn_4096_835_2048,Gemm_Hipblaslt_TN_9352,0.035296
GemmTunableOp_Half_TN,tn_14336_1827_4096,Gemm_Hipblaslt_TN_9187,0.377485
GemmTunableOp_Half_TN,tn_3072_881_4096,Gemm_Hipblaslt_TN_9131,0.0576574
GemmTunableOp_Half_TN,tn_14336_851_4096,Gemm_Hipblaslt_TN_9697,0.182847
GemmTunableOp_Half_TN,tn_3072_2635_4096,Gemm_Hipblaslt_TN_9329,0.124042
GemmTunableOp_Half_TN,tn_14336_4242_4096,Gemm_Rocblas_621294420,0.849594
GemmTunableOp_Half_TN,tn_3072_2602_4096,Gemm_Hipblaslt_TN_9134,0.122835
GemmTunableOp_Half_TN,tn_4096_1886_2048,Gemm_Hipblaslt_TN_9134,0.0648923
GemmTunableOp_Half_TN,tn_3072_917_4096,Gemm_Hipblaslt_TN_9352,0.0587358
GemmTunableOp_Half_TN,tn_14336_844_4096,Gemm_Hipblaslt_TN_9677,0.182005
GemmTunableOp_Half_TN,tn_14336_985_4096,Gemm_Hipblaslt_TN_9217,0.20927
GemmTunableOp_Half_TN,tn_4096_1900_7168,Gemm_Hipblaslt_TN_9645,0.211038
GemmTunableOp_Half_TN,tn_4096_805_7168,Gemm_Hipblaslt_TN_9158,0.110971
GemmTunableOp_Half_TN,tn_14336_2571_4096,Gemm_Hipblaslt_TN_9793,0.544841
GemmTunableOp_Half_TN,tn_64128_80_4096,Gemm_Hipblaslt_TN_9058,0.179927
GemmTunableOp_Half_TN,tn_14336_1853_4096,Gemm_Hipblaslt_TN_9187,0.379554
GemmTunableOp_Half_TN,tn_4096_7283_2048,Gemm_Hipblaslt_TN_9743,0.215564
GemmTunableOp_Half_TN,tn_4096_808_7168,Gemm_Hipblaslt_TN_9147,0.106086
GemmTunableOp_Half_TN,tn_3072_808_4096,Gemm_Hipblaslt_TN_9047,0.052754
GemmTunableOp_Half_TN,tn_4096_2732_2048,Gemm_Hipblaslt_TN_9672,0.0888027
GemmTunableOp_Half_TN,tn_4096_2719_2048,Gemm_Hipblaslt_TN_9690,0.0872749
GemmTunableOp_Half_TN,tn_14336_861_4096,Gemm_Hipblaslt_TN_9187,0.184149
GemmTunableOp_Half_TN,tn_14336_803_4096,Gemm_Hipblaslt_TN_9697,0.179042
GemmTunableOp_Half_TN,tn_3072_2773_4096,Gemm_Hipblaslt_TN_9567,0.131539
GemmTunableOp_Half_TN,tn_14336_846_4096,Gemm_Hipblaslt_TN_9677,0.182627
GemmTunableOp_Half_TN,tn_4096_850_7168,Gemm_Hipblaslt_TN_9099,0.113792
GemmTunableOp_Half_TN,tn_3072_7283_4096,Gemm_Hipblaslt_TN_9681,0.32049
GemmTunableOp_Half_TN,tn_14336_8054_4096,Gemm_Hipblaslt_TN_9890,1.58229
GemmTunableOp_Half_TN,tn_3072_2872_4096,Gemm_Hipblaslt_TN_9567,0.133462
GemmTunableOp_Half_TN,tn_4096_800_2048,Gemm_Hipblaslt_TN_9352,0.0334913
GemmTunableOp_Half_TN,tn_14336_3310_4096,Gemm_Hipblaslt_TN_9223,0.647569
GemmTunableOp_Half_TN,tn_14336_930_4096,Gemm_Hipblaslt_TN_9697,0.189396
GemmTunableOp_Half_TN,tn_3072_840_4096,Gemm_Hipblaslt_TN_9047,0.0541286
GemmTunableOp_Half_TN,tn_3072_1867_4096,Gemm_Hipblaslt_TN_9641,0.0949976
GemmTunableOp_Half_TN,tn_4096_4242_2048,Gemm_Hipblaslt_TN_9704,0.121877
GemmTunableOp_Half_TN,tn_64128_83_4096,Gemm_Hipblaslt_TN_9057,0.181376
GemmTunableOp_Half_TN,tn_3072_819_4096,Gemm_Hipblaslt_TN_9047,0.054026
GemmTunableOp_Half_TN,tn_14336_1792_4096,Gemm_Hipblaslt_TN_9139,0.374395
GemmTunableOp_Half_TN,tn_14336_7823_4096,Gemm_Hipblaslt_TN_9933,1.54923
GemmTunableOp_Half_TN,tn_4096_2572_7168,Gemm_Hipblaslt_TN_9799,0.275935
GemmTunableOp_Half_TN,tn_14336_849_4096,Gemm_Hipblaslt_TN_9697,0.182424
GemmTunableOp_Half_TN,tn_4096_1913_7168,Gemm_Hipblaslt_TN_9645,0.211358
GemmTunableOp_Half_TN,tn_14336_890_4096,Gemm_Hipblaslt_TN_9677,0.182976
GemmTunableOp_Half_TN,tn_64128_175_4096,Gemm_Hipblaslt_TN_9707,0.249846
GemmTunableOp_Half_TN,tn_4096_1792_7168,Gemm_Hipblaslt_TN_9645,0.203158
GemmTunableOp_Half_TN,tn_4096_2717_7168,Gemm_Hipblaslt_TN_9690,0.278998
GemmTunableOp_Half_TN,tn_14336_983_4096,Gemm_Hipblaslt_TN_9220,0.209857
GemmTunableOp_Half_TN,tn_14336_821_4096,Gemm_Hipblaslt_TN_9187,0.180785
GemmTunableOp_Half_TN,tn_4096_908_2048,Gemm_Hipblaslt_TN_9355,0.0385015
GemmTunableOp_Half_TN,tn_4096_24_7168,Gemm_Rocblas_621286305,0.0151162
GemmTunableOp_Half_TN,tn_4096_2537_2048,Gemm_Hipblaslt_TN_9687,0.0828716
GemmTunableOp_Half_TN,tn_3072_2670_4096,Gemm_Hipblaslt_TN_9134,0.125395
GemmTunableOp_Half_TN,tn_3072_1666_4096,Gemm_Rocblas_621286778,0.0896403
GemmTunableOp_Half_TN,tn_3072_1777_4096,Gemm_Hipblaslt_TN_9561,0.0913136
GemmTunableOp_Half_TN,tn_4096_8054_2048,Gemm_Hipblaslt_TN_9655,0.236879
GemmTunableOp_Half_TN,tn_14336_795_4096,Gemm_Hipblaslt_TN_9209,0.165661
GemmTunableOp_Half_TN,tn_14336_24_4096,Gemm_Rocblas_621286423,0.0258298
GemmTunableOp_Half_TN,tn_4096_803_2048,Gemm_Hipblaslt_TN_9604,0.0345849
GemmTunableOp_Half_TN,tn_3072_811_4096,Gemm_Hipblaslt_TN_9047,0.0522581
GemmTunableOp_Half_TN,tn_14336_1954_4096,Gemm_Hipblaslt_TN_9217,0.404985
GemmTunableOp_Half_TN,tn_14336_954_4096,Gemm_Hipblaslt_TN_9187,0.190894
GemmTunableOp_Half_TN,tn_14336_879_4096,Gemm_Hipblaslt_TN_9139,0.185054
GemmTunableOp_Half_TN,tn_4096_879_2048,Gemm_Hipblaslt_TN_9634,0.0380356
GemmTunableOp_Half_TN,tn_4096_1880_2048,Gemm_Hipblaslt_TN_9134,0.0651703
GemmTunableOp_Half_TN,tn_4096_1813_2048,Gemm_Hipblaslt_TN_9590,0.0635786
GemmTunableOp_Half_TN,tn_3072_1791_4096,Gemm_Hipblaslt_TN_9322,0.0921009
GemmTunableOp_Half_TN,tn_14336_908_4096,Gemm_Hipblaslt_TN_9677,0.188728
GemmTunableOp_Half_TN,tn_4096_7937_2048,Gemm_Hipblaslt_TN_9768,0.236331
GemmTunableOp_Half_TN,tn_4096_7809_7168,Gemm_Hipblaslt_TN_9815,0.753577
GemmTunableOp_Half_TN,tn_14336_1775_4096,Gemm_Hipblaslt_TN_9192,0.372987
GemmTunableOp_Half_TN,tn_3072_1883_4096,Gemm_Hipblaslt_TN_9148,0.0949403
GemmTunableOp_Half_TN,tn_14336_2860_4096,Gemm_Hipblaslt_TN_9677,0.575398
GemmTunableOp_Half_TN,tn_3072_2675_4096,Gemm_Hipblaslt_TN_9329,0.125669
GemmTunableOp_Half_TN,tn_4096_7798_7168,Gemm_Hipblaslt_TN_9914,0.756441
GemmTunableOp_Half_TN,tn_4096_851_7168,Gemm_Hipblaslt_TN_9547,0.114186
GemmTunableOp_Half_TN,tn_14336_8069_4096,Gemm_Hipblaslt_TN_9942,1.60105
GemmTunableOp_Half_TN,tn_4096_7239_7168,Gemm_Rocblas_621286701,0.704482
GemmTunableOp_Half_TN,tn_14336_1791_4096,Gemm_Hipblaslt_TN_9192,0.370818
GemmTunableOp_Half_TN,tn_14336_845_4096,Gemm_Hipblaslt_TN_9697,0.182953
GemmTunableOp_Half_TN,tn_4096_861_2048,Gemm_Hipblaslt_TN_9352,0.0356863
GemmTunableOp_Half_TN,tn_14336_7967_4096,Gemm_Hipblaslt_TN_9914,1.57229
GemmTunableOp_Half_TN,tn_4096_112_7168,Gemm_Rocblas_621286436,0.0275756
GemmTunableOp_Half_TN,tn_3072_7817_4096,Gemm_Hipblaslt_TN_9935,0.346119
GemmTunableOp_Half_TN,tn_3072_2672_4096,Gemm_Hipblaslt_TN_9329,0.124685
GemmTunableOp_Half_TN,tn_4096_906_7168,Gemm_Hipblaslt_TN_9576,0.118965
GemmTunableOp_Half_TN,tn_4096_984_2048,Gemm_Hipblaslt_TN_9577,0.0402618
GemmTunableOp_Half_TN,tn_4096_1748_2048,Gemm_Hipblaslt_TN_9136,0.0620047
GemmTunableOp_Half_TN,tn_4096_876_7168,Gemm_Hipblaslt_TN_9170,0.119053
GemmTunableOp_Half_TN,tn_3072_128_4096,Gemm_Rocblas_621294166,0.0150481
GemmTunableOp_Half_TN,tn_14336_1742_4096,Gemm_Hipblaslt_TN_9697,0.371669
GemmTunableOp_Half_TN,tn_3072_878_4096,Gemm_Hipblaslt_TN_9131,0.056992
GemmTunableOp_Half_TN,tn_3072_2599_4096,Gemm_Hipblaslt_TN_9134,0.124584
GemmTunableOp_Half_TN,tn_3072_3571_4096,Gemm_Rocblas_621286753,0.159718
GemmTunableOp_Half_TN,tn_4096_1880_7168,Gemm_Hipblaslt_TN_9645,0.210743
GemmTunableOp_Half_TN,tn_14336_855_4096,Gemm_Hipblaslt_TN_9697,0.182378
GemmTunableOp_Half_TN,tn_64128_189_4096,Gemm_Hipblaslt_TN_9816,0.254127
GemmTunableOp_Half_TN,tn_3072_964_4096,Gemm_Hipblaslt_TN_9131,0.0592514
GemmTunableOp_Half_TN,tn_4096_8049_7168,Gemm_Hipblaslt_TN_9903,0.765279
GemmTunableOp_Half_TN,tn_14336_1798_4096,Gemm_Hipblaslt_TN_9697,0.375985
GemmTunableOp_Half_TN,tn_14336_1649_4096,Gemm_Hipblaslt_TN_9192,0.357795
GemmTunableOp_Half_TN,tn_4096_2636_7168,Gemm_Hipblaslt_TN_9799,0.272603
GemmTunableOp_Half_TN,tn_3072_821_4096,Gemm_Hipblaslt_TN_9047,0.0547343
GemmTunableOp_Half_TN,tn_3072_862_4096,Gemm_Hipblaslt_TN_9048,0.0546132
GemmTunableOp_Half_TN,tn_14336_797_4096,Gemm_Hipblaslt_TN_9691,0.167753
GemmTunableOp_Half_TN,tn_3072_1739_4096,Gemm_Hipblaslt_TN_9163,0.0908263
GemmTunableOp_Half_TN,tn_4096_914_2048,Gemm_Hipblaslt_TN_9577,0.037583
GemmTunableOp_Half_TN,tn_64128_200_4096,Gemm_Hipblaslt_TN_9747,0.272705
GemmTunableOp_Half_TN,tn_4096_2788_2048,Gemm_Hipblaslt_TN_9689,0.0888907
GemmTunableOp_Half_TN,tn_3072_949_4096,Gemm_Hipblaslt_TN_9131,0.0603807
GemmTunableOp_Half_TN,tn_4096_1739_2048,Gemm_Hipblaslt_TN_9136,0.0623635
GemmTunableOp_Half_TN,tn_4096_807_2048,Gemm_Hipblaslt_TN_9352,0.0342119
GemmTunableOp_Half_TN,tn_3072_958_4096,Gemm_Hipblaslt_TN_9352,0.060224
GemmTunableOp_Half_TN,tn_4096_820_2048,Gemm_Hipblaslt_TN_9547,0.0347174
GemmTunableOp_Half_TN,tn_64128_27_4096,Gemm_Hipblaslt_TN_9094,0.146859
GemmTunableOp_Half_TN,tn_14336_1724_4096,Gemm_Hipblaslt_TN_9187,0.359763
GemmTunableOp_Half_TN,tn_4096_949_7168,Gemm_Hipblaslt_TN_9576,0.122004
GemmTunableOp_Half_TN,tn_14336_796_4096,Gemm_Hipblaslt_TN_9691,0.166809
GemmTunableOp_Half_TN,tn_4096_884_2048,Gemm_Hipblaslt_TN_9576,0.0369457
GemmTunableOp_Half_TN,tn_64128_248_4096,Gemm_Rocblas_621294648,0.291413
GemmTunableOp_Half_TN,tn_3072_872_4096,Gemm_Hipblaslt_TN_9352,0.057324
GemmTunableOp_Half_TN,tn_3072_871_4096,Gemm_Hipblaslt_TN_9352,0.0565532
GemmTunableOp_Half_TN,tn_14336_943_4096,Gemm_Hipblaslt_TN_9697,0.188905
GemmTunableOp_Half_TN,tn_14336_200_4096,Gemm_Rocblas_621294215,0.0643745
GemmTunableOp_Half_TN,tn_4096_2648_7168,Gemm_Hipblaslt_TN_9799,0.275916
GemmTunableOp_Half_TN,tn_64128_180_4096,Gemm_Hipblaslt_TN_9707,0.250991
GemmTunableOp_Half_TN,tn_3072_911_4096,Gemm_Hipblaslt_TN_9131,0.0579276
GemmTunableOp_Half_TN,tn_3072_795_4096,Gemm_Hipblaslt_TN_9368,0.0511585
GemmTunableOp_Half_TN,tn_4096_1822_2048,Gemm_Hipblaslt_TN_9590,0.0631051
GemmTunableOp_Half_TN,tn_4096_871_2048,Gemm_Hipblaslt_TN_9576,0.0370797
GemmTunableOp_Half_TN,tn_14336_3479_4096,Gemm_Hipblaslt_TN_9220,0.676895
GemmTunableOp_Half_TN,tn_14336_938_4096,Gemm_Hipblaslt_TN_9677,0.189547
GemmTunableOp_Half_TN,tn_3072_855_4096,Gemm_Hipblaslt_TN_9368,0.0539331
GemmTunableOp_Half_TN,tn_4096_838_2048,Gemm_Hipblaslt_TN_9547,0.0351798
GemmTunableOp_Half_TN,tn_4096_1867_7168,Gemm_Hipblaslt_TN_9680,0.210917
GemmTunableOp_Half_TN,tn_64128_210_4096,Gemm_Hipblaslt_TN_9654,0.274821
GemmTunableOp_Half_TN,tn_64128_14_4096,Gemm_Rocblas_621286348,0.143607
GemmTunableOp_Half_TN,tn_4096_853_7168,Gemm_Hipblaslt_TN_9099,0.114348
GemmTunableOp_Half_TN,tn_4096_8000_2048,Gemm_Rocblas_621286281,0.234807
GemmTunableOp_Half_TN,tn_4096_797_2048,Gemm_Hipblaslt_TN_9352,0.0339111
GemmTunableOp_Half_TN,tn_3072_168_4096,Gemm_Rocblas_621294164,0.0182749
GemmTunableOp_Half_TN,tn_4096_1900_2048,Gemm_Hipblaslt_TN_9134,0.0665473
GemmTunableOp_Half_TN,tn_4096_2699_7168,Gemm_Hipblaslt_TN_9799,0.278424
GemmTunableOp_Half_TN,tn_4096_1733_7168,Gemm_Hipblaslt_TN_9673,0.198299
GemmTunableOp_Half_TN,tn_3072_1701_4096,Gemm_Hipblaslt_TN_9163,0.0893572
GemmTunableOp_Half_TN,tn_4096_1600_7168,Gemm_Hipblaslt_TN_9265,0.18443
GemmTunableOp_Half_TN,tn_4096_3507_2048,Gemm_Hipblaslt_TN_9677,0.104495
GemmTunableOp_Half_TN,tn_64128_199_4096,Gemm_Hipblaslt_TN_9961,0.272319
GemmTunableOp_Half_TN,tn_64128_56_4096,Gemm_Hipblaslt_TN_9097,0.163458
GemmTunableOp_Half_TN,tn_14336_2636_4096,Gemm_Hipblaslt_TN_9677,0.542239
GemmTunableOp_Half_TN,tn_4096_3569_7168,Gemm_Hipblaslt_TN_9677,0.349242
GemmTunableOp_Half_TN,tn_4096_903_7168,Gemm_Hipblaslt_TN_9634,0.11919
GemmTunableOp_Half_TN,tn_3072_24_4096,Gemm_Rocblas_621286323,0.0092338
GemmTunableOp_Half_TN,tn_3072_2750_4096,Gemm_Hipblaslt_TN_9624,0.130337
GemmTunableOp_Half_TN,tn_4096_24_2048,Gemm_Rocblas_621286273,0.00719876
GemmTunableOp_Half_TN,tn_3072_3402_4096,Gemm_Rocblas_621294495,0.155267
GemmTunableOp_Half_TN,tn_4096_927_7168,Gemm_Hipblaslt_TN_9634,0.121159
GemmTunableOp_Half_TN,tn_14336_3565_4096,Gemm_Hipblaslt_TN_9217,0.685076
GemmTunableOp_Half_TN,tn_4096_7817_2048,Gemm_Hipblaslt_TN_9815,0.230797
GemmTunableOp_Half_TN,tn_4096_986_2048,Gemm_Hipblaslt_TN_9576,0.0394067
GemmTunableOp_Half_TN,tn_4096_3671_2048,Gemm_Hipblaslt_TN_9873,0.113613
GemmTunableOp_Half_TN,tn_14336_2703_4096,Gemm_Hipblaslt_TN_9677,0.560824
GemmTunableOp_Half_TN,tn_14336_16_4096,Gemm_Rocblas_621294052,0.023953
GemmTunableOp_Half_TN,tn_64128_235_4096,Gemm_Rocblas_621286915,0.295055
GemmTunableOp_Half_TN,tn_64128_217_4096,Gemm_Hipblaslt_TN_9841,0.2767
GemmTunableOp_Half_TN,tn_14336_840_4096,Gemm_Hipblaslt_TN_9677,0.18133
GemmTunableOp_Half_TN,tn_64128_35_4096,Gemm_Hipblaslt_TN_9144,0.155278
GemmTunableOp_Half_TN,tn_64128_227_4096,Gemm_Rocblas_621294294,0.289814
GemmTunableOp_Half_TN,tn_14336_2785_4096,Gemm_Hipblaslt_TN_9187,0.564341
GemmTunableOp_Half_TN,tn_14336_2708_4096,Gemm_Hipblaslt_TN_9697,0.565116
GemmTunableOp_Half_TN,tn_4096_2517_7168,Gemm_Hipblaslt_TN_9799,0.266201
GemmTunableOp_Half_TN,tn_3072_1724_4096,Gemm_Rocblas_621286778,0.0899276
GemmTunableOp_Half_TN,tn_4096_1763_7168,Gemm_Hipblaslt_TN_9645,0.201091
GemmTunableOp_Half_TN,tn_4096_990_2048,Gemm_Hipblaslt_TN_9589,0.03937
GemmTunableOp_Half_TN,tn_14336_104_4096,Gemm_Rocblas_621286494,0.0404722
GemmTunableOp_Half_TN,tn_4096_3711_2048,Gemm_Hipblaslt_TN_9873,0.114435
GemmTunableOp_Half_TN,tn_14336_3447_4096,Gemm_Rocblas_621294492,0.676818
GemmTunableOp_Half_TN,tn_14336_1729_4096,Gemm_Hipblaslt_TN_9189,0.370047
GemmTunableOp_Half_TN,tn_64128_122_4096,Gemm_Rocblas_621294385,0.20215
GemmTunableOp_Half_TN,tn_64128_213_4096,Gemm_Hipblaslt_TN_9654,0.275325
GemmTunableOp_Half_TN,tn_4096_1726_2048,Gemm_Hipblaslt_TN_9164,0.0587755
GemmTunableOp_Half_TN,tn_64128_219_4096,Gemm_Hipblaslt_TN_9841,0.278183
GemmTunableOp_Half_TN,tn_64128_148_4096,Gemm_Rocblas_621286565,0.224892
GemmTunableOp_Half_TN,tn_3072_1718_4096,Gemm_Hipblaslt_TN_9561,0.0896807
GemmTunableOp_Half_TN,tn_4096_120_7168,Gemm_Rocblas_621286279,0.0279794
GemmTunableOp_Half_TN,tn_4096_912_2048,Gemm_Hipblaslt_TN_9604,0.0368915
GemmTunableOp_Half_TN,tn_3072_256_4096,Gemm_Rocblas_621286440,0.0231166
GemmTunableOp_Half_TN,tn_64128_89_4096,Gemm_Hipblaslt_TN_9058,0.184455
GemmTunableOp_Half_TN,tn_4096_2560_2048,Gemm_Rocblas_621294447,0.083367
GemmTunableOp_Half_TN,tn_4096_4471_7168,Gemm_Hipblaslt_TN_9742,0.465784
GemmTunableOp_Half_TN,tn_64128_135_4096,Gemm_Hipblaslt_TN_9657,0.222611
GemmTunableOp_Half_TN,tn_4096_1864_2048,Gemm_Hipblaslt_TN_9134,0.0654858
GemmTunableOp_Half_TN,tn_14336_837_4096,Gemm_Hipblaslt_TN_9697,0.182015
GemmTunableOp_Half_TN,tn_4096_2630_2048,Gemm_Hipblaslt_TN_9672,0.0857159
GemmTunableOp_Half_TN,tn_3072_96_4096,Gemm_Rocblas_621286279,0.0137101
GemmTunableOp_Half_TN,tn_14336_1794_4096,Gemm_Hipblaslt_TN_9677,0.370833
GemmTunableOp_Half_TN,tn_64128_190_4096,Gemm_Hipblaslt_TN_9707,0.24714
GemmTunableOp_Half_TN,tn_4096_983_2048,Gemm_Hipblaslt_TN_9577,0.0400735
GemmTunableOp_Half_TN,tn_3072_873_4096,Gemm_Hipblaslt_TN_9352,0.0565093
GemmTunableOp_Half_TN,tn_3072_1719_4096,Gemm_Hipblaslt_TN_9561,0.0882494
GemmTunableOp_Half_TN,tn_8192_232_4096,Gemm_Rocblas_621294206,0.0428572
GemmTunableOp_Half_TN,tn_3072_839_4096,Gemm_Hipblaslt_TN_9047,0.0558188
GemmTunableOp_Half_TN,tn_14336_794_4096,Gemm_Hipblaslt_TN_9691,0.166226
GemmTunableOp_Half_TN,tn_3072_790_4096,Gemm_Hipblaslt_TN_9368,0.0525231
GemmTunableOp_Half_TN,tn_8192_256_4096,Gemm_Hipblaslt_TN_9573,0.0430706
GemmTunableOp_Half_TN,tn_3072_2630_4096,Gemm_Hipblaslt_TN_9134,0.125343
GemmTunableOp_Half_TN,tn_64128_46_4096,Gemm_Hipblaslt_TN_9144,0.158026
GemmTunableOp_Half_TN,tn_4096_892_7168,Gemm_Hipblaslt_TN_9547,0.118665
GemmTunableOp_Half_TN,tn_14336_2826_4096,Gemm_Hipblaslt_TN_9697,0.574266
GemmTunableOp_Half_TN,tn_4096_1777_7168,Gemm_Hipblaslt_TN_9645,0.202976
GemmTunableOp_Half_TN,tn_5120_256_8192,Gemm_Rocblas_621294504,0.0586715
GemmTunableOp_Half_TN,tn_4096_982_7168,Gemm_Hipblaslt_TN_9170,0.125071
GemmTunableOp_Half_TN,tn_4096_3479_7168,Gemm_Hipblaslt_TN_9187,0.347658
GemmTunableOp_Half_TN,tn_4096_1614_2048,Gemm_Hipblaslt_TN_9607,0.0555735
GemmTunableOp_Half_TN,tn_14336_2763_4096,Gemm_Hipblaslt_TN_9677,0.567126
GemmTunableOp_Half_TN,tn_64128_241_4096,Gemm_Rocblas_621294648,0.29331
GemmTunableOp_Half_TN,tn_4096_3430_2048,Gemm_Hipblaslt_TN_9896,0.102517
GemmTunableOp_Half_TN,tn_4096_3556_2048,Gemm_Hipblaslt_TN_9896,0.104696
GemmTunableOp_Half_TN,tn_8192_256_14336,Gemm_Hipblaslt_TN_9545,0.137783
GemmTunableOp_Half_TN,tn_3072_946_4096,Gemm_Hipblaslt_TN_9352,0.0597293
GemmTunableOp_Half_TN,tn_64128_218_4096,Gemm_Hipblaslt_TN_9654,0.277434
GemmTunableOp_Half_TN,tn_3072_2805_4096,Gemm_Hipblaslt_TN_9624,0.130875
GemmTunableOp_Half_TN,tn_4096_256_7168,Gemm_Rocblas_621294171,0.0455148
GemmTunableOp_Half_TN,tn_64128_60_4096,Gemm_Hipblaslt_TN_9097,0.162266
GemmTunableOp_Half_TN,tn_4096_922_2048,Gemm_Hipblaslt_TN_9160,0.0387836
GemmTunableOp_Half_TN,tn_28672_232_8192,Gemm_Hipblaslt_TN_9540,0.292726
GemmTunableOp_Half_TN,tn_14336_812_4096,Gemm_Hipblaslt_TN_9677,0.179726
GemmTunableOp_Half_TN,tn_3072_3418_4096,Gemm_Rocblas_621294495,0.156204
GemmTunableOp_Half_TN,tn_4096_2635_7168,Gemm_Hipblaslt_TN_9799,0.272883
GemmTunableOp_Half_TN,tn_4096_880_7168,Gemm_Hipblaslt_TN_9632,0.119025
GemmTunableOp_Half_TN,tn_64128_69_4096,Gemm_Hipblaslt_TN_9057,0.178172
GemmTunableOp_Half_TN,tn_14336_1666_4096,Gemm_Hipblaslt_TN_9139,0.361024
GemmTunableOp_Half_TN,tn_14336_1864_4096,Gemm_Hipblaslt_TN_9139,0.379593
GemmTunableOp_Half_TN,tn_4096_1807_2048,Gemm_Hipblaslt_TN_9590,0.0632594
GemmTunableOp_Half_TN,tn_64128_104_4096,Gemm_Rocblas_621286644,0.198457
GemmTunableOp_Half_TN,tn_14336_1756_4096,Gemm_Hipblaslt_TN_9697,0.371138
GemmTunableOp_Half_TN,tn_3072_3662_4096,Gemm_Hipblaslt_TN_9779,0.167089
GemmTunableOp_Half_TN,tn_14336_1693_4096,Gemm_Hipblaslt_TN_9697,0.361591
GemmTunableOp_Half_TN,tn_14336_224_4096,Gemm_Hipblaslt_TN_9355,0.0668329
GemmTunableOp_Half_TN,tn_4096_7239_2048,Gemm_Hipblaslt_TN_9694,0.213088
GemmTunableOp_Half_TN,tn_4096_1803_2048,Gemm_Hipblaslt_TN_9134,0.0637893
GemmTunableOp_Half_TN,tn_4096_812_2048,Gemm_Hipblaslt_TN_9634,0.0344475
GemmTunableOp_Half_TN,tn_4096_128_7168,Gemm_Rocblas_621286436,0.028886
GemmTunableOp_Half_TN,tn_4096_1783_2048,Gemm_Hipblaslt_TN_9680,0.0636373
GemmTunableOp_Half_TN,tn_64128_64_4096,Gemm_Hipblaslt_TN_9097,0.162023
GemmTunableOp_Half_TN,tn_3072_800_4096,Gemm_Hipblaslt_TN_9368,0.0529677
GemmTunableOp_Half_TN,tn_64128_98_4096,Gemm_Rocblas_621294762,0.193424
GemmTunableOp_Half_TN,tn_64128_233_4096,Gemm_Rocblas_621286905,0.291724
GemmTunableOp_Half_TN,tn_14336_240_4096,Gemm_Hipblaslt_TN_9604,0.0670895
GemmTunableOp_Half_TN,tn_4096_1791_7168,Gemm_Hipblaslt_TN_9134,0.202372
GemmTunableOp_Half_TN,tn_14336_1913_4096,Gemm_Hipblaslt_TN_9677,0.379403
GemmTunableOp_Half_TN,tn_64128_169_4096,Gemm_Hipblaslt_TN_9707,0.244661
GemmTunableOp_Half_TN,tn_4096_932_7168,Gemm_Hipblaslt_TN_9585,0.121601
GemmTunableOp_Half_TN,tn_4096_2675_2048,Gemm_Hipblaslt_TN_9657,0.0856881
GemmTunableOp_Half_TN,tn_3072_8069_4096,Gemm_Hipblaslt_TN_9693,0.355511
GemmTunableOp_Half_TN,tn_14336_925_4096,Gemm_Hipblaslt_TN_9187,0.189066
GemmTunableOp_Half_TN,tn_14336_847_4096,Gemm_Hipblaslt_TN_9697,0.182347
GemmTunableOp_Half_TN,tn_4096_2599_2048,Gemm_Hipblaslt_TN_9672,0.0851372
GemmTunableOp_Half_TN,tn_14336_839_4096,Gemm_Hipblaslt_TN_9187,0.182191
GemmTunableOp_Half_TN,tn_3072_972_4096,Gemm_Hipblaslt_TN_9158,0.0612523
GemmTunableOp_Half_TN,tn_3072_120_4096,Gemm_Rocblas_621286280,0.0153626
GemmTunableOp_Half_TN,tn_4096_1893_7168,Gemm_Hipblaslt_TN_9134,0.212477
GemmTunableOp_Half_TN,tn_4096_1846_7168,Gemm_Hipblaslt_TN_9136,0.209454
GemmTunableOp_Half_TN,tn_64128_71_4096,Gemm_Hipblaslt_TN_9057,0.179347
GemmTunableOp_Half_TN,tn_4096_8069_7168,Gemm_Rocblas_621286678,0.780399
GemmTunableOp_Half_TN,tn_64128_206_4096,Gemm_Hipblaslt_TN_9654,0.273978
GemmTunableOp_Half_TN,tn_4096_839_2048,Gemm_Hipblaslt_TN_9634,0.0354406
GemmTunableOp_Half_TN,tn_3072_2722_4096,Gemm_Hipblaslt_TN_9567,0.132271
GemmTunableOp_Half_TN,tn_14336_2653_4096,Gemm_Hipblaslt_TN_9677,0.552565
GemmTunableOp_Half_TN,tn_4096_2572_2048,Gemm_Hipblaslt_TN_9674,0.0848633
GemmTunableOp_Half_TN,tn_4096_4471_2048,Gemm_Hipblaslt_TN_9763,0.141395
GemmTunableOp_Half_TN,tn_4096_1737_2048,Gemm_Hipblaslt_TN_9590,0.0627887
GemmTunableOp_Half_TN,tn_4096_176_7168,Gemm_Hipblaslt_TN_9470,0.0388962
GemmTunableOp_Half_TN,tn_14336_853_4096,Gemm_Hipblaslt_TN_9697,0.184032
GemmTunableOp_Half_TN,tn_64128_212_4096,Gemm_Hipblaslt_TN_9841,0.276635
GemmTunableOp_Half_TN,tn_3072_1694_4096,Gemm_Hipblaslt_TN_9561,0.0891348
GemmTunableOp_Half_TN,tn_3072_2606_4096,Gemm_Hipblaslt_TN_9134,0.124013
GemmTunableOp_Half_TN,tn_14336_7266_4096,Gemm_Hipblaslt_TN_9683,1.43696
GemmTunableOp_Half_TN,tn_4096_7817_7168,Gemm_Hipblaslt_TN_9853,0.753491
GemmTunableOp_Half_TN,tn_64128_11_4096,Gemm_Rocblas_621286348,0.142168
GemmTunableOp_Half_TN,tn_4096_1848_2048,Gemm_Hipblaslt_TN_9590,0.0635746
GemmTunableOp_Half_TN,tn_4096_2698_7168,Gemm_Hipblaslt_TN_9672,0.281395
GemmTunableOp_Half_TN,tn_3072_1756_4096,Gemm_Hipblaslt_TN_9163,0.0918736
GemmTunableOp_Half_TN,tn_4096_1700_2048,Gemm_Hipblaslt_TN_9569,0.0594461
GemmTunableOp_Half_TN,tn_64128_191_4096,Gemm_Hipblaslt_TN_9862,0.256219
GemmTunableOp_Half_TN,tn_64128_188_4096,Gemm_Hipblaslt_TN_9855,0.255076
GemmTunableOp_Half_TN,tn_14336_884_4096,Gemm_Hipblaslt_TN_9677,0.184564
GemmTunableOp_Half_TN,tn_4096_940_7168,Gemm_Hipblaslt_TN_9170,0.121333
GemmTunableOp_Half_TN,tn_4096_1727_7168,Gemm_Hipblaslt_TN_9359,0.189362
GemmTunableOp_Half_TN,tn_4096_959_7168,Gemm_Hipblaslt_TN_9576,0.121223
GemmTunableOp_Half_TN,tn_4096_48_7168,Gemm_Rocblas_621294146,0.0188582
GemmTunableOp_Half_TN,tn_4096_1666_2048,Gemm_Hipblaslt_TN_9164,0.0572428
GemmTunableOp_Half_TN,tn_4096_944_7168,Gemm_Hipblaslt_TN_9576,0.120011
GemmTunableOp_Half_TN,tn_8192_4096_4096,Gemm_Hipblaslt_TN_9220,0.462264
GemmTunableOp_Half_TN,tn_14336_4463_4096,Gemm_Hipblaslt_TN_9890,0.885924
GemmTunableOp_Half_TN,tn_3072_797_4096,Gemm_Hipblaslt_TN_9048,0.0528466
GemmTunableOp_Half_TN,tn_4096_855_2048,Gemm_Hipblaslt_TN_9251,0.0354365
GemmTunableOp_Half_TN,tn_4096_7967_2048,Gemm_Hipblaslt_TN_9704,0.235197
GemmTunableOp_Half_TN,tn_4096_859_7168,Gemm_Hipblaslt_TN_9099,0.116981
GemmTunableOp_Half_TN,tn_4096_3479_2048,Gemm_Hipblaslt_TN_9683,0.106072
GemmTunableOp_Half_TN,tn_3072_823_4096,Gemm_Hipblaslt_TN_9047,0.0533191
GemmTunableOp_Half_TN,tn_4096_1792_2048,Gemm_Hipblaslt_TN_9590,0.061661
GemmTunableOp_Half_TN,tn_14336_936_4096,Gemm_Hipblaslt_TN_9697,0.189197
GemmTunableOp_Half_TN,tn_4096_48_2048,Gemm_Rocblas_621294155,0.00796791
GemmTunableOp_Half_TN,tn_4096_2658_7168,Gemm_Hipblaslt_TN_9674,0.277976
GemmTunableOp_Half_TN,tn_4096_8110_2048,Gemm_Hipblaslt_TN_9815,0.240918
GemmTunableOp_Half_TN,tn_14336_969_4096,Gemm_Hipblaslt_TN_9217,0.208054
GemmTunableOp_Half_TN,tn_64128_143_4096,Gemm_Hipblaslt_TN_9657,0.223494
GemmTunableOp_Half_TN,tn_4096_1673_2048,Gemm_Hipblaslt_TN_9164,0.057675
GemmTunableOp_Half_TN,tn_3072_8154_4096,Gemm_Rocblas_621294473,0.359789
GemmTunableOp_Half_TN,tn_14336_892_4096,Gemm_Hipblaslt_TN_9677,0.182702
GemmTunableOp_Half_TN,tn_3072_192_4096,Gemm_Rocblas_621294164,0.0187103
GemmTunableOp_Half_TN,tn_14336_834_4096,Gemm_Hipblaslt_TN_9697,0.181364
GemmTunableOp_Half_TN,tn_14336_916_4096,Gemm_Hipblaslt_TN_9187,0.187531
GemmTunableOp_Half_TN,tn_3072_2682_4096,Gemm_Hipblaslt_TN_9329,0.126455
GemmTunableOp_Half_TN,tn_14336_1757_4096,Gemm_Hipblaslt_TN_9192,0.368888
GemmTunableOp_Half_TN,tn_4096_4483_7168,Gemm_Hipblaslt_TN_9763,0.46363
GemmTunableOp_Half_TN,tn_14336_2509_4096,Gemm_Rocblas_621286575,0.518254
GemmTunableOp_Half_TN,tn_14336_2670_4096,Gemm_Hipblaslt_TN_9793,0.552553
GemmTunableOp_Half_TN,tn_4096_821_2048,Gemm_Hipblaslt_TN_9634,0.0349729
GemmTunableOp_Half_TN,tn_14336_900_4096,Gemm_Hipblaslt_TN_9187,0.186888
GemmTunableOp_Half_TN,tn_64128_250_4096,Gemm_Rocblas_621294648,0.294305
GemmTunableOp_Half_TN,tn_14336_984_4096,Gemm_Rocblas_621294294,0.209345
GemmTunableOp_Half_TN,tn_64128_50_4096,Gemm_Hipblaslt_TN_9097,0.161742
GemmTunableOp_Half_TN,tn_3072_7809_4096,Gemm_Rocblas_621294473,0.343607
GemmTunableOp_Half_TN,tn_4096_1666_7168,Gemm_Hipblaslt_TN_9265,0.185761
GemmTunableOp_Half_TN,tn_4096_901_7168,Gemm_Hipblaslt_TN_9585,0.120661
GemmTunableOp_Half_TN,tn_4096_1719_7168,Gemm_Hipblaslt_TN_9265,0.187533
GemmTunableOp_Half_TN,tn_3072_2826_4096,Gemm_Hipblaslt_TN_9567,0.130522
GemmTunableOp_Half_TN,tn_4096_829_7168,Gemm_Hipblaslt_TN_9158,0.113202
GemmTunableOp_Half_TN,tn_4096_978_2048,Gemm_Hipblaslt_TN_9589,0.0390812
GemmTunableOp_Half_TN,tn_4096_1705_7168,Gemm_Hipblaslt_TN_9265,0.1869
GemmTunableOp_Half_TN,tn_4096_1805_2048,Gemm_Hipblaslt_TN_9590,0.0628759
GemmTunableOp_Half_TN,tn_4096_859_2048,Gemm_Hipblaslt_TN_9354,0.0355844
GemmTunableOp_Half_TN,tn_4096_873_2048,Gemm_Hipblaslt_TN_9576,0.0364974
GemmTunableOp_Half_TN,tn_14336_857_4096,Gemm_Hipblaslt_TN_9192,0.1835
GemmTunableOp_Half_TN,tn_4096_862_7168,Gemm_Hipblaslt_TN_9099,0.115291
GemmTunableOp_Half_TN,tn_3072_4463_4096,Gemm_Hipblaslt_TN_9896,0.192883
GemmTunableOp_Half_TN,tn_4096_1755_7168,Gemm_Hipblaslt_TN_9673,0.200044
GemmTunableOp_Half_TN,tn_14336_1739_4096,Gemm_Hipblaslt_TN_9192,0.367689
GemmTunableOp_Half_TN,tn_14336_863_4096,Gemm_Hipblaslt_TN_9677,0.182901
GemmTunableOp_Half_TN,tn_14336_7804_4096,Gemm_Hipblaslt_TN_9888,1.54423
GemmTunableOp_Half_TN,tn_4096_959_2048,Gemm_Hipblaslt_TN_9604,0.0382664
GemmTunableOp_Half_TN,tn_3072_176_4096,Gemm_Rocblas_621286438,0.0186543
GemmTunableOp_Half_TN,tn_4096_2826_7168,Gemm_Hipblaslt_TN_9672,0.289027
GemmTunableOp_Half_TN,tn_4096_1759_2048,Gemm_Hipblaslt_TN_9136,0.0625797
GemmTunableOp_Half_TN,tn_14336_964_4096,Gemm_Hipblaslt_TN_9217,0.207213
GemmTunableOp_Half_TN,tn_3072_961_4096,Gemm_Hipblaslt_TN_9131,0.0593727
GemmTunableOp_Half_TN,tn_14336_3507_4096,Gemm_Hipblaslt_TN_9280,0.679334
GemmTunableOp_Half_TN,tn_3072_184_4096,Gemm_Rocblas_621294164,0.0184015
GemmTunableOp_Half_TN,tn_14336_820_4096,Gemm_Hipblaslt_TN_9187,0.182048
GemmTunableOp_Half_TN,tn_14336_958_4096,Gemm_Hipblaslt_TN_9697,0.190154
GemmTunableOp_Half_TN,tn_4096_200_7168,Gemm_Hipblaslt_TN_9497,0.0430863
GemmTunableOp_Half_TN,tn_3072_3507_4096,Gemm_Hipblaslt_TN_9619,0.159632
GemmTunableOp_Half_TN,tn_4096_8049_2048,Gemm_Hipblaslt_TN_9753,0.235059
GemmTunableOp_Half_TN,tn_4096_794_7168,Gemm_Hipblaslt_TN_9547,0.111761
GemmTunableOp_Half_TN,tn_14336_7299_4096,Gemm_Hipblaslt_TN_9900,1.46369
GemmTunableOp_Half_TN,tn_3072_831_4096,Gemm_Hipblaslt_TN_9047,0.0548403
GemmTunableOp_Half_TN,tn_14336_2672_4096,Gemm_Hipblaslt_TN_9192,0.55116
GemmTunableOp_Half_TN,tn_4096_7952_2048,Gemm_Rocblas_621294030,0.231788
GemmTunableOp_Half_TN,tn_14336_2601_4096,Gemm_Hipblaslt_TN_9677,0.54701
GemmTunableOp_Half_TN,tn_4096_869_7168,Gemm_Hipblaslt_TN_9355,0.11695
GemmTunableOp_Half_TN,tn_3072_1881_4096,Gemm_Hipblaslt_TN_9613,0.0948622
GemmTunableOp_Half_TN,tn_3072_160_4096,Gemm_Rocblas_621286436,0.0180796
GemmTunableOp_Half_TN,tn_3072_935_4096,Gemm_Hipblaslt_TN_9546,0.0593663
GemmTunableOp_Half_TN,tn_14336_876_4096,Gemm_Hipblaslt_TN_9677,0.183071
GemmTunableOp_Half_TN,tn_4096_1695_7168,Gemm_Hipblaslt_TN_9359,0.186302
GemmTunableOp_Half_TN,tn_4096_7266_2048,Gemm_Hipblaslt_TN_9692,0.215621
GemmTunableOp_Half_TN,tn_3072_985_4096,Gemm_Hipblaslt_TN_9251,0.0608377
GemmTunableOp_Half_TN,tn_4096_144_7168,Gemm_Rocblas_621286440,0.0363848
GemmTunableOp_Half_TN,tn_3072_7937_4096,Gemm_Hipblaslt_TN_9800,0.35067
GemmTunableOp_Half_TN,tn_3072_936_4096,Gemm_Hipblaslt_TN_9352,0.0589729
GemmTunableOp_Half_TN,tn_4096_2872_2048,Gemm_Hipblaslt_TN_9689,0.0897997
GemmTunableOp_Half_TN,tn_14336_88_4096,Gemm_Hipblaslt_TN_9350,0.0371451
GemmTunableOp_Half_TN,tn_4096_232_2048,Gemm_Rocblas_621286447,0.0146968
GemmTunableOp_Half_TN,tn_4096_1757_2048,Gemm_Hipblaslt_TN_9680,0.0623751
GemmTunableOp_Half_TN,tn_14336_915_4096,Gemm_Hipblaslt_TN_9677,0.187732
GemmTunableOp_Half_TN,tn_4096_834_2048,Gemm_Hipblaslt_TN_9547,0.0350015
GemmTunableOp_Half_TN,tn_14336_1848_4096,Gemm_Hipblaslt_TN_9187,0.378688
GemmTunableOp_Half_TN,tn_14336_168_4096,Gemm_Rocblas_621294461,0.0571262
GemmTunableOp_Half_TN,tn_14336_1805_4096,Gemm_Hipblaslt_TN_9697,0.375051
GemmTunableOp_Half_TN,tn_64128_158_4096,Gemm_Hipblaslt_TN_9674,0.227607
GemmTunableOp_Half_TN,tn_4096_977_2048,Gemm_Hipblaslt_TN_9578,0.039344
GemmTunableOp_Half_TN,tn_4096_3352_7168,Gemm_Hipblaslt_TN_9189,0.337893
GemmTunableOp_Half_TN,tn_4096_2606_2048,Gemm_Hipblaslt_TN_9691,0.0851152
GemmTunableOp_Half_TN,tn_4096_3546_7168,Gemm_Hipblaslt_TN_9697,0.348107
GemmTunableOp_Half_TN,tn_4096_1705_2048,Gemm_Hipblaslt_TN_9588,0.0596656
GemmTunableOp_Half_TN,tn_14336_3431_4096,Gemm_Hipblaslt_TN_9220,0.676743
GemmTunableOp_Half_TN,tn_3072_814_4096,Gemm_Hipblaslt_TN_9047,0.0531082
GemmTunableOp_Half_TN,tn_14336_3662_4096,Gemm_Hipblaslt_TN_9677,0.752816
GemmTunableOp_Half_TN,tn_64128_54_4096,Gemm_Hipblaslt_TN_9097,0.161735
GemmTunableOp_Half_TN,tn_4096_1813_7168,Gemm_Hipblaslt_TN_9645,0.208216
GemmTunableOp_Half_TN,tn_4096_1828_2048,Gemm_Hipblaslt_TN_9329,0.0648752
GemmTunableOp_Half_TN,tn_4096_40_7168,Gemm_Rocblas_621286332,0.0183618
GemmTunableOp_Half_TN,tn_4096_104_7168,Gemm_Rocblas_621294164,0.0276345
GemmTunableOp_Half_TN,tn_14336_869_4096,Gemm_Hipblaslt_TN_9677,0.183163
GemmTunableOp_Half_TN,tn_3072_1672_4096,Gemm_Rocblas_621294520,0.0891877
GemmTunableOp_Half_TN,tn_14336_978_4096,Gemm_Hipblaslt_TN_9217,0.208725
GemmTunableOp_Half_TN,tn_4096_7944_2048,Gemm_Hipblaslt_TN_9933,0.234796
GemmTunableOp_Half_TN,tn_3072_1848_4096,Gemm_Hipblaslt_TN_9613,0.0938972
GemmTunableOp_Half_TN,tn_4096_866_2048,Gemm_Hipblaslt_TN_9576,0.0370721
GemmTunableOp_Half_TN,tn_28672_4000_8192,Gemm_Hipblaslt_TN_9866,3.31931
GemmTunableOp_Half_TN,tn_3072_816_4096,Gemm_Hipblaslt_TN_9047,0.0528373
GemmTunableOp_Half_TN,tn_4096_1841_2048,Gemm_Hipblaslt_TN_9134,0.0632921
GemmTunableOp_Half_TN,tn_14336_1705_4096,Gemm_Hipblaslt_TN_9189,0.362833
GemmTunableOp_Half_TN,tn_3072_88_4096,Gemm_Rocblas_621286279,0.0137137
GemmTunableOp_Half_TN,tn_14336_866_4096,Gemm_Hipblaslt_TN_9697,0.183328
GemmTunableOp_Half_TN,tn_3072_1827_4096,Gemm_Hipblaslt_TN_9324,0.0934652
GemmTunableOp_Half_TN,tn_4096_168_7168,Gemm_Rocblas_621286440,0.0374327
GemmTunableOp_Half_TN,tn_4096_16_7168,Gemm_Rocblas_621294135,0.0131489
GemmTunableOp_Half_TN,tn_4096_2860_2048,Gemm_Hipblaslt_TN_9689,0.0890647
GemmTunableOp_Half_TN,tn_4096_8_2048,Gemm_Rocblas_621294047,0.007089
GemmTunableOp_Half_TN,tn_4096_946_2048,Gemm_Hipblaslt_TN_9604,0.038262
GemmTunableOp_Half_TN,tn_4096_936_2048,Gemm_Hipblaslt_TN_9604,0.0378674
GemmTunableOp_Half_TN,tn_4096_1742_2048,Gemm_Hipblaslt_TN_9590,0.0615784
GemmTunableOp_Half_TN,tn_14336_922_4096,Gemm_Hipblaslt_TN_9139,0.188464
GemmTunableOp_Half_TN,tn_4096_857_7168,Gemm_Hipblaslt_TN_9099,0.114544
GemmTunableOp_Half_TN,tn_4096_985_2048,Gemm_Hipblaslt_TN_9583,0.0404833
GemmStridedBatchedTunableOp_Half_TN,tn_913_913_128_B_16,Gemm_Rocblas_621294536,0.0273108
GemmStridedBatchedTunableOp_Half_TN,tn_953_953_128_B_16,Gemm_Rocblas_621286794,0.0278676
GemmStridedBatchedTunableOp_Half_TN,tn_886_886_128_B_16,Gemm_Rocblas_621294728,0.0265135
GemmStridedBatchedTunableOp_Half_TN,tn_798_798_128_B_16,Gemm_Hipblaslt_TN_158,0.0235418
GemmStridedBatchedTunableOp_Half_TN,tn_796_796_128_B_16,Gemm_Hipblaslt_TN_158,0.022317
GemmStridedBatchedTunableOp_Half_TN,tn_961_961_128_B_16,Gemm_Rocblas_621286794,0.0276699
GemmStridedBatchedTunableOp_Half_TN,tn_861_861_128_B_16,Gemm_Rocblas_621294536,0.0261129
GemmStridedBatchedTunableOp_Half_TN,tn_876_876_128_B_16,Gemm_Rocblas_621294728,0.0258963
GemmStridedBatchedTunableOp_Half_TN,tn_929_929_128_B_16,Gemm_Rocblas_621294536,0.0279652
GemmStridedBatchedTunableOp_Half_TN,tn_806_806_128_B_16,Gemm_Hipblaslt_TN_158,0.023165
GemmStridedBatchedTunableOp_Half_TN,tn_832_832_128_B_16,Gemm_Hipblaslt_TN_150,0.0182313
GemmStridedBatchedTunableOp_Half_TN,tn_974_974_128_B_16,Gemm_Rocblas_621294536,0.0290474
GemmStridedBatchedTunableOp_Half_TN,tn_900_900_128_B_16,Gemm_Rocblas_621294536,0.0268819
GemmStridedBatchedTunableOp_Half_TN,tn_839_839_128_B_16,Gemm_Hipblaslt_TN_158,0.0254595
GemmStridedBatchedTunableOp_Half_TN,tn_857_857_128_B_16,Gemm_Hipblaslt_TN_9921,0.0258201
GemmStridedBatchedTunableOp_Half_TN,tn_32_32_128_B_16,Gemm_Rocblas_621286717,0.00670161
GemmStridedBatchedTunableOp_Half_TN,tn_828_828_128_B_16,Gemm_Hipblaslt_TN_158,0.0244894
GemmStridedBatchedTunableOp_Half_TN,tn_846_846_128_B_16,Gemm_Rocblas_621294728,0.025763
GemmStridedBatchedTunableOp_Half_TN,tn_991_991_128_B_16,Gemm_Rocblas_621294536,0.0286189
GemmStridedBatchedTunableOp_Half_TN,tn_954_954_128_B_16,Gemm_Rocblas_621294536,0.0275397
GemmStridedBatchedTunableOp_Half_TN,tn_856_856_128_B_16,Gemm_Rocblas_621293994,0.0231533
GemmStridedBatchedTunableOp_Half_TN,tn_848_848_128_B_16,Gemm_Hipblaslt_TN_150,0.019471
GemmStridedBatchedTunableOp_Half_TN,tn_933_933_128_B_16,Gemm_Rocblas_621286794,0.0282911
GemmStridedBatchedTunableOp_Half_TN,tn_967_967_128_B_16,Gemm_Rocblas_621286794,0.0287811
GemmStridedBatchedTunableOp_Half_TN,tn_797_797_128_B_16,Gemm_Hipblaslt_TN_158,0.0236377
GemmStridedBatchedTunableOp_Half_TN,tn_983_983_128_B_16,Gemm_Rocblas_621286794,0.0285817
GemmStridedBatchedTunableOp_Half_TN,tn_786_786_128_B_16,Gemm_Hipblaslt_TN_158,0.0223
GemmStridedBatchedTunableOp_Half_TN,tn_964_964_128_B_16,Gemm_Rocblas_621294536,0.0283927
GemmStridedBatchedTunableOp_Half_TN,tn_919_919_128_B_16,Gemm_Rocblas_621294536,0.0279696
GemmStridedBatchedTunableOp_Half_TN,tn_809_809_128_B_16,Gemm_Rocblas_621294552,0.0237203
GemmStridedBatchedTunableOp_Half_TN,tn_799_799_128_B_16,Gemm_Rocblas_621286500,0.0232994
GemmStridedBatchedTunableOp_Half_TN,tn_924_924_128_B_16,Gemm_Rocblas_621294536,0.0275301
GemmStridedBatchedTunableOp_Half_TN,tn_977_977_128_B_16,Gemm_Rocblas_621294536,0.0280258
GemmStridedBatchedTunableOp_Half_TN,tn_16_16_128_B_32,Default,0.00625657
GemmStridedBatchedTunableOp_Half_TN,tn_910_910_128_B_16,Gemm_Rocblas_621294536,0.0272041
GemmStridedBatchedTunableOp_Half_TN,tn_905_905_128_B_16,Gemm_Rocblas_621286794,0.0272129
GemmStridedBatchedTunableOp_Half_TN,tn_936_936_128_B_16,Gemm_Rocblas_621293994,0.0244841
GemmStridedBatchedTunableOp_Half_TN,tn_831_831_128_B_16,Gemm_Rocblas_621286811,0.0255364
GemmStridedBatchedTunableOp_Half_TN,tn_888_888_128_B_16,Gemm_Hipblaslt_TN_150,0.0196274
GemmStridedBatchedTunableOp_Half_TN,tn_956_956_128_B_16,Gemm_Rocblas_621294536,0.0288493
GemmStridedBatchedTunableOp_Half_TN,tn_990_990_128_B_16,Gemm_Rocblas_621294536,0.0291774
GemmStridedBatchedTunableOp_Half_TN,tn_860_860_128_B_16,Gemm_Rocblas_621286718,0.0247667
GemmStridedBatchedTunableOp_Half_TN,tn_816_816_128_B_16,Gemm_Hipblaslt_TN_150,0.0203559
GemmStridedBatchedTunableOp_Half_TN,tn_817_817_128_B_16,Gemm_Hipblaslt_TN_158,0.0245504
GemmStridedBatchedTunableOp_Half_TN,tn_897_897_128_B_16,Gemm_Rocblas_621294536,0.0268627
GemmStridedBatchedTunableOp_Half_TN,tn_847_847_128_B_16,Gemm_Rocblas_621294728,0.0260735
GemmStridedBatchedTunableOp_Half_TN,tn_906_906_128_B_16,Gemm_Rocblas_621286794,0.0273275
GemmStridedBatchedTunableOp_Half_TN,tn_804_804_128_B_16,Gemm_Rocblas_621294552,0.022317
GemmStridedBatchedTunableOp_Half_TN,tn_939_939_128_B_16,Gemm_Rocblas_621294536,0.0276634
GemmStridedBatchedTunableOp_Half_TN,tn_808_808_128_B_16,Gemm_Hipblaslt_TN_150,0.0206192
GemmStridedBatchedTunableOp_Half_TN,tn_981_981_128_B_16,Gemm_Rocblas_621286794,0.0280117
GemmStridedBatchedTunableOp_Half_TN,tn_970_970_128_B_16,Gemm_Rocblas_621294536,0.0284615
GemmStridedBatchedTunableOp_Half_TN,tn_895_895_128_B_16,Gemm_Rocblas_621294536,0.0269201
GemmStridedBatchedTunableOp_Half_TN,tn_902_902_128_B_16,Gemm_Rocblas_621286794,0.02678
GemmStridedBatchedTunableOp_Half_TN,tn_962_962_128_B_16,Gemm_Rocblas_621286794,0.0274156
GemmStridedBatchedTunableOp_Half_TN,tn_890_890_128_B_16,Gemm_Rocblas_621294728,0.0264687
GemmStridedBatchedTunableOp_Half_TN,tn_864_864_128_B_16,Gemm_Hipblaslt_TN_150,0.0184467
GemmStridedBatchedTunableOp_Half_TN,tn_911_911_128_B_16,Gemm_Rocblas_621286794,0.0270434
GemmStridedBatchedTunableOp_Half_TN,tn_872_872_128_B_16,Gemm_Hipblaslt_TN_150,0.0196164
GemmStridedBatchedTunableOp_Half_TN,tn_952_952_128_B_16,Gemm_Rocblas_621293994,0.0243773
GemmStridedBatchedTunableOp_Half_TN,tn_869_869_128_B_16,Gemm_Rocblas_621294728,0.02624
GemmStridedBatchedTunableOp_Half_TN,tn_887_887_128_B_16,Gemm_Rocblas_621286794,0.0266019
GemmStridedBatchedTunableOp_Half_TN,tn_858_858_128_B_16,Gemm_Rocblas_621286811,0.0246617
GemmStridedBatchedTunableOp_Half_TN,tn_978_978_128_B_16,Gemm_Rocblas_621294536,0.0286634
GemmStridedBatchedTunableOp_Half_TN,tn_904_904_128_B_16,Gemm_Rocblas_621293994,0.0240075
GemmStridedBatchedTunableOp_Half_TN,tn_833_833_128_B_16,Gemm_Rocblas_621286794,0.0256394
GemmStridedBatchedTunableOp_Half_TN,tn_946_946_128_B_16,Gemm_Rocblas_621294536,0.0279753
GemmStridedBatchedTunableOp_Half_TN,tn_840_840_128_B_16,Gemm_Hipblaslt_TN_150,0.0193491
GemmStridedBatchedTunableOp_Half_TN,tn_963_963_128_B_16,Gemm_Rocblas_621286794,0.0284651
GemmStridedBatchedTunableOp_Half_TN,tn_986_986_128_B_16,Gemm_Rocblas_621294536,0.0280061
GemmStridedBatchedTunableOp_Half_TN,tn_973_973_128_B_16,Gemm_Rocblas_621286794,0.0276926
GemmStridedBatchedTunableOp_Half_TN,tn_922_922_128_B_16,Gemm_Rocblas_621294536,0.0276367
GemmStridedBatchedTunableOp_Half_TN,tn_865_865_128_B_16,Gemm_Rocblas_621286794,0.026191
GemmStridedBatchedTunableOp_Half_TN,tn_992_992_128_B_16,Gemm_Rocblas_621293994,0.0239355
GemmStridedBatchedTunableOp_Half_TN,tn_931_931_128_B_16,Gemm_Rocblas_621286794,0.0274996
GemmStridedBatchedTunableOp_Half_TN,tn_949_949_128_B_16,Gemm_Rocblas_621294536,0.0282115
GemmStridedBatchedTunableOp_Half_TN,tn_989_989_128_B_16,Gemm_Rocblas_621294536,0.0290092
GemmStridedBatchedTunableOp_Half_TN,tn_849_849_128_B_16,Gemm_Rocblas_621294552,0.0254188
GemmStridedBatchedTunableOp_Half_TN,tn_968_968_128_B_16,Gemm_Rocblas_621293994,0.024747
GemmStridedBatchedTunableOp_Half_TN,tn_907_907_128_B_16,Gemm_Rocblas_621286794,0.0266423
GemmStridedBatchedTunableOp_Half_TN,tn_903_903_128_B_16,Gemm_Rocblas_621294536,0.0269157
GemmStridedBatchedTunableOp_Half_TN,tn_923_923_128_B_16,Gemm_Rocblas_621294536,0.0274461
GemmStridedBatchedTunableOp_Half_TN,tn_824_824_128_B_16,Gemm_Hipblaslt_TN_150,0.0198487
GemmStridedBatchedTunableOp_Half_TN,tn_893_893_128_B_16,Gemm_Rocblas_621286794,0.0267347
GemmStridedBatchedTunableOp_Half_TN,tn_879_879_128_B_16,Gemm_Rocblas_621294728,0.026265
GemmStridedBatchedTunableOp_Half_TN,tn_812_812_128_B_16,Gemm_Rocblas_621286718,0.0232201
GemmStridedBatchedTunableOp_Half_TN,tn_975_975_128_B_16,Gemm_Rocblas_621294536,0.028914
GemmStridedBatchedTunableOp_Half_TN,tn_842_842_128_B_16,Gemm_Rocblas_621294460,0.0256727
GemmStridedBatchedTunableOp_Half_TN,tn_820_820_128_B_16,Gemm_Rocblas_621286811,0.0241042
GemmStridedBatchedTunableOp_Half_TN,tn_794_794_128_B_16,Gemm_Hipblaslt_TN_158,0.0234146
GemmStridedBatchedTunableOp_Half_TN,tn_972_972_128_B_16,Gemm_Rocblas_621286794,0.0283235
GemmStridedBatchedTunableOp_Half_TN,tn_995_995_128_B_16,Gemm_Rocblas_621286794,0.0286014
GemmStridedBatchedTunableOp_Half_TN,tn_826_826_128_B_16,Gemm_Hipblaslt_TN_158,0.0245023
GemmStridedBatchedTunableOp_Half_TN,tn_863_863_128_B_16,Gemm_Rocblas_621294728,0.0260328
GemmStridedBatchedTunableOp_Half_TN,tn_882_882_128_B_16,Gemm_Rocblas_621294728,0.0261705
GemmStridedBatchedTunableOp_Half_TN,tn_870_870_128_B_16,Gemm_Rocblas_621294728,0.0262503
GemmStridedBatchedTunableOp_Half_TN,tn_825_825_128_B_16,Gemm_Hipblaslt_TN_158,0.0248363
GemmStridedBatchedTunableOp_Half_TN,tn_873_873_128_B_16,Gemm_Rocblas_621286984,0.0264106
GemmStridedBatchedTunableOp_Half_TN,tn_835_835_128_B_16,Gemm_Hipblaslt_TN_158,0.0248907
GemmStridedBatchedTunableOp_Half_TN,tn_969_969_128_B_16,Gemm_Rocblas_621286794,0.0286297
GemmStridedBatchedTunableOp_Half_TN,tn_894_894_128_B_16,Gemm_Rocblas_621286794,0.0266726
GemmStridedBatchedTunableOp_Half_TN,tn_957_957_128_B_16,Gemm_Rocblas_621294536,0.0277127
GemmStridedBatchedTunableOp_Half_TN,tn_987_987_128_B_16,Gemm_Rocblas_621294536,0.0281993
GemmStridedBatchedTunableOp_Half_TN,tn_823_823_128_B_16,Gemm_Hipblaslt_TN_158,0.0247369
GemmStridedBatchedTunableOp_Half_TN,tn_999_999_128_B_16,Gemm_Rocblas_621294536,0.0291893
GemmTunableOp_Half_TN,tn_4096_877_7168,Gemm_Hipblaslt_TN_9547,0.116086
GemmTunableOp_Half_TN,tn_3072_804_4096,Gemm_Hipblaslt_TN_9047,0.0516869
GemmTunableOp_Half_TN,tn_4096_2560_7168,Gemm_Rocblas_621286705,0.263971
GemmTunableOp_Half_TN,tn_4096_913_7168,Gemm_Hipblaslt_TN_9576,0.118463
GemmTunableOp_Half_TN,tn_3072_884_4096,Gemm_Hipblaslt_TN_9546,0.0573612
GemmTunableOp_Half_TN,tn_14336_881_4096,Gemm_Hipblaslt_TN_9677,0.181262
GemmTunableOp_Half_TN,tn_4096_1829_7168,Gemm_Hipblaslt_TN_9136,0.204992
GemmTunableOp_Half_TN,tn_4096_2698_2048,Gemm_Hipblaslt_TN_9674,0.0852347
GemmTunableOp_Half_TN,tn_4096_1817_7168,Gemm_Hipblaslt_TN_9137,0.205129
GemmTunableOp_Half_TN,tn_3072_1886_4096,Gemm_Hipblaslt_TN_9324,0.0944359
GemmTunableOp_Half_TN,tn_4096_801_7168,Gemm_Hipblaslt_TN_9147,0.107792
GemmTunableOp_Half_TN,tn_4096_1759_7168,Gemm_Hipblaslt_TN_9673,0.196766
GemmTunableOp_Half_TN,tn_4096_3310_7168,Gemm_Hipblaslt_TN_9697,0.330306
GemmTunableOp_Half_TN,tn_4096_2721_2048,Gemm_Hipblaslt_TN_9672,0.0863586
GemmTunableOp_Half_TN,tn_64128_211_4096,Gemm_Hipblaslt_TN_9271,0.276245
GemmTunableOp_Half_TN,tn_4096_2571_2048,Gemm_Hipblaslt_TN_9672,0.0831559
GemmTunableOp_Half_TN,tn_4096_1777_2048,Gemm_Hipblaslt_TN_9329,0.0629796
GemmTunableOp_Half_TN,tn_3072_851_4096,Gemm_Hipblaslt_TN_9047,0.0537981
GemmTunableOp_Half_TN,tn_4096_3670_7168,Gemm_Hipblaslt_TN_9223,0.360716
GemmTunableOp_Half_TN,tn_4096_1673_7168,Gemm_Hipblaslt_TN_9164,0.182479
GemmTunableOp_Half_TN,tn_4096_951_7168,Gemm_Hipblaslt_TN_9576,0.119968
GemmTunableOp_Half_TN,tn_4096_907_7168,Gemm_Hipblaslt_TN_9634,0.119733
GemmTunableOp_Half_TN,tn_4096_881_2048,Gemm_Hipblaslt_TN_9577,0.0371407
GemmTunableOp_Half_TN,tn_3072_892_4096,Gemm_Hipblaslt_TN_9550,0.0588588
GemmTunableOp_Half_TN,tn_4096_906_2048,Gemm_Hipblaslt_TN_9577,0.0374647
GemmTunableOp_Half_TN,tn_14336_835_4096,Gemm_Hipblaslt_TN_9677,0.177271
GemmTunableOp_Half_TN,tn_4096_926_2048,Gemm_Hipblaslt_TN_9577,0.0377132
GemmTunableOp_Half_TN,tn_14336_2750_4096,Gemm_Hipblaslt_TN_9192,0.554017
GemmTunableOp_Half_TN,tn_4096_831_7168,Gemm_Hipblaslt_TN_9158,0.106288
GemmTunableOp_Half_TN,tn_4096_887_7168,Gemm_Hipblaslt_TN_9547,0.11754
GemmTunableOp_Half_TN,tn_3072_829_4096,Gemm_Hipblaslt_TN_9368,0.0527801
GemmTunableOp_Half_TN,tn_14336_940_4096,Gemm_Hipblaslt_TN_9677,0.185845
GemmTunableOp_Half_TN,tn_4096_1905_2048,Gemm_Hipblaslt_TN_9590,0.0650565
GemmTunableOp_Half_TN,tn_4096_2592_7168,Gemm_Hipblaslt_TN_9657,0.270474
GemmTunableOp_Half_TN,tn_3072_914_4096,Gemm_Hipblaslt_TN_9131,0.0573737
GemmTunableOp_Half_TN,tn_4096_921_7168,Gemm_Hipblaslt_TN_9170,0.118847
GemmTunableOp_Half_TN,tn_4096_1693_7168,Gemm_Hipblaslt_TN_9359,0.18523
GemmTunableOp_Half_TN,tn_64128_84_4096,Gemm_Hipblaslt_TN_9057,0.179066
GemmTunableOp_Half_TN,tn_14336_988_4096,Gemm_Hipblaslt_TN_9217,0.206773
GemmTunableOp_Half_TN,tn_4096_2732_7168,Gemm_Hipblaslt_TN_9672,0.282811
GemmTunableOp_Half_TN,tn_3072_2560_4096,Gemm_Hipblaslt_TN_9624,0.120952
GemmTunableOp_Half_TN,tn_4096_64_7168,Gemm_Rocblas_621294148,0.0191839
GemmTunableOp_Half_TN,tn_4096_901_2048,Gemm_Hipblaslt_TN_9577,0.0376455
GemmTunableOp_Half_TN,tn_14336_895_4096,Gemm_Hipblaslt_TN_9697,0.184104
GemmTunableOp_Half_TN,tn_3072_895_4096,Gemm_Hipblaslt_TN_9546,0.0575685
GemmTunableOp_Half_TN,tn_4096_819_2048,Gemm_Hipblaslt_TN_9604,0.0347545
GemmTunableOp_Half_TN,tn_3072_977_4096,Gemm_Hipblaslt_TN_9131,0.0605373
GemmTunableOp_Half_TN,tn_64128_109_4096,Gemm_Hipblaslt_TN_9061,0.199434
GemmTunableOp_Half_TN,tn_4096_7299_7168,Gemm_Hipblaslt_TN_9914,0.711381
GemmTunableOp_Half_TN,tn_64128_52_4096,Gemm_Hipblaslt_TN_9097,0.162449
GemmTunableOp_Half_TN,tn_4096_885_2048,Gemm_Hipblaslt_TN_9355,0.0374476
GemmTunableOp_Half_TN,tn_4096_1886_7168,Gemm_Hipblaslt_TN_9645,0.209875
GemmTunableOp_Half_TN,tn_4096_942_2048,Gemm_Hipblaslt_TN_9604,0.0377726
GemmTunableOp_Half_TN,tn_3072_1792_4096,Gemm_Rocblas_621286778,0.0907477
GemmTunableOp_Half_TN,tn_14336_8_4096,Gemm_Rocblas_621286317,0.023411
GemmTunableOp_Half_TN,tn_4096_1805_7168,Gemm_Hipblaslt_TN_9268,0.203316
GemmTunableOp_Half_TN,tn_4096_802_7168,Gemm_Hipblaslt_TN_9147,0.108539
GemmTunableOp_Half_TN,tn_3072_1841_4096,Gemm_Hipblaslt_TN_9148,0.0928006
GemmTunableOp_Half_TN,tn_14336_971_4096,Gemm_Hipblaslt_TN_9217,0.203733
GemmTunableOp_Half_TN,tn_4096_971_2048,Gemm_Hipblaslt_TN_9634,0.0385459
GemmTunableOp_Half_TN,tn_64128_74_4096,Gemm_Hipblaslt_TN_9057,0.17692
GemmTunableOp_Half_TN,tn_4096_837_2048,Gemm_Hipblaslt_TN_9577,0.0362602
GemmTunableOp_Half_TN,tn_3072_3546_4096,Gemm_Rocblas_621286753,0.156534
GemmTunableOp_Half_TN,tn_4096_890_7168,Gemm_Hipblaslt_TN_9547,0.117019
GemmTunableOp_Half_TN,tn_64128_223_4096,Gemm_Hipblaslt_TN_9185,0.279859
GemmTunableOp_Half_TN,tn_3072_890_4096,Gemm_Hipblaslt_TN_9158,0.0577754
GemmTunableOp_Half_TN,tn_4096_918_7168,Gemm_Hipblaslt_TN_9576,0.119816
GemmTunableOp_Half_TN,tn_14336_1783_4096,Gemm_Hipblaslt_TN_9793,0.368333
GemmTunableOp_Half_TN,tn_3072_1733_4096,Gemm_Rocblas_621286778,0.0906614
GemmTunableOp_Half_TN,tn_4096_930_7168,Gemm_Hipblaslt_TN_9576,0.11906
GemmTunableOp_Half_TN,tn_64128_19_4096,Gemm_Rocblas_621294578,0.145579
GemmTunableOp_Half_TN,tn_4096_894_2048,Gemm_Hipblaslt_TN_9576,0.0375638
GemmTunableOp_Half_TN,tn_4096_816_7168,Gemm_Hipblaslt_TN_9158,0.106455
GemmTunableOp_Half_TN,tn_3072_978_4096,Gemm_Hipblaslt_TN_9317,0.0607244
GemmTunableOp_Half_TN,tn_4096_3310_2048,Gemm_Hipblaslt_TN_9947,0.101824
GemmTunableOp_Half_TN,tn_4096_1768_2048,Gemm_Hipblaslt_TN_9329,0.0631011
GemmTunableOp_Half_TN,tn_4096_3431_7168,Gemm_Hipblaslt_TN_9677,0.332285
GemmTunableOp_Half_TN,tn_64128_123_4096,Gemm_Hipblaslt_TN_9061,0.201702
GemmTunableOp_Half_TN,tn_14336_906_4096,Gemm_Hipblaslt_TN_9139,0.183891
GemmTunableOp_Half_TN,tn_3072_923_4096,Gemm_Hipblaslt_TN_9352,0.0585861
GemmTunableOp_Half_TN,tn_4096_1954_7168,Gemm_Hipblaslt_TN_9134,0.211012
GemmTunableOp_Half_TN,tn_4096_785_7168,Gemm_Hipblaslt_TN_9158,0.108682
GemmTunableOp_Half_TN,tn_64128_249_4096,Gemm_Rocblas_621286915,0.295279
GemmTunableOp_Half_TN,tn_4096_2648_2048,Gemm_Hipblaslt_TN_9674,0.0843085
GemmTunableOp_Half_TN,tn_4096_954_7168,Gemm_Hipblaslt_TN_9604,0.120531
GemmTunableOp_Half_TN,tn_3072_2788_4096,Gemm_Hipblaslt_TN_9624,0.130444
GemmTunableOp_Half_TN,tn_4096_7863_2048,Gemm_Hipblaslt_TN_9655,0.231075
GemmTunableOp_Half_TN,tn_4096_849_2048,Gemm_Hipblaslt_TN_9354,0.0366053
GemmTunableOp_Half_TN,tn_4096_1835_7168,Gemm_Hipblaslt_TN_9137,0.205041
GemmTunableOp_Half_TN,tn_14336_1803_4096,Gemm_Hipblaslt_TN_9697,0.372407
GemmTunableOp_Half_TN,tn_4096_797_7168,Gemm_Hipblaslt_TN_9158,0.108691
GemmTunableOp_Half_TN,tn_4096_840_2048,Gemm_Hipblaslt_TN_9354,0.0357333
GemmTunableOp_Half_TN,tn_4096_844_2048,Gemm_Hipblaslt_TN_9352,0.0345633
GemmTunableOp_Half_TN,tn_4096_947_7168,Gemm_Hipblaslt_TN_9585,0.121139
GemmTunableOp_Half_TN,tn_64128_33_4096,Gemm_Hipblaslt_TN_9097,0.158177
GemmTunableOp_Half_TN,tn_4096_7992_2048,Gemm_Hipblaslt_TN_9704,0.231096
GemmTunableOp_Half_TN,tn_3072_8156_4096,Gemm_Rocblas_621294481,0.355349
GemmTunableOp_Half_TN,tn_64128_42_4096,Gemm_Hipblaslt_TN_9097,0.160489
GemmTunableOp_Half_TN,tn_14336_921_4096,Gemm_Hipblaslt_TN_9697,0.184988
GemmTunableOp_Half_TN,tn_3072_943_4096,Gemm_Hipblaslt_TN_9131,0.0580635
GemmTunableOp_Half_TN,tn_4096_869_2048,Gemm_Hipblaslt_TN_9577,0.0366936
GemmTunableOp_Half_TN,tn_4096_795_7168,Gemm_Hipblaslt_TN_9158,0.107237
GemmTunableOp_Half_TN,tn_4096_889_7168,Gemm_Hipblaslt_TN_9170,0.117933
GemmTunableOp_Half_TN,tn_4096_937_2048,Gemm_Hipblaslt_TN_9576,0.0385721
GemmTunableOp_Half_TN,tn_4096_961_7168,Gemm_Hipblaslt_TN_9160,0.11821
GemmTunableOp_Half_TN,tn_4096_992_7168,Gemm_Hipblaslt_TN_9052,0.124876
GemmTunableOp_Half_TN,tn_4096_825_2048,Gemm_Hipblaslt_TN_9577,0.0360562
GemmTunableOp_Half_TN,tn_64128_183_4096,Gemm_Hipblaslt_TN_9862,0.248352
GemmTunableOp_Half_TN,tn_64128_78_4096,Gemm_Hipblaslt_TN_9057,0.178326
GemmTunableOp_Half_TN,tn_4096_891_2048,Gemm_Hipblaslt_TN_9578,0.0373774
GemmTunableOp_Half_TN,tn_14336_990_4096,Gemm_Hipblaslt_TN_9223,0.204233
GemmTunableOp_Half_TN,tn_14336_865_4096,Gemm_Hipblaslt_TN_9677,0.182042
GemmTunableOp_Half_TN,tn_14336_2602_4096,Gemm_Hipblaslt_TN_9793,0.532479
GemmTunableOp_Half_TN,tn_3072_869_4096,Gemm_Hipblaslt_TN_9147,0.0579546
GemmTunableOp_Half_TN,tn_4096_1614_7168,Gemm_Hipblaslt_TN_9359,0.182372
GemmTunableOp_Half_TN,tn_14336_2872_4096,Gemm_Hipblaslt_TN_9189,0.566323
GemmTunableOp_Half_TN,tn_4096_809_7168,Gemm_Hipblaslt_TN_9158,0.109119
GemmTunableOp_Half_TN,tn_4096_811_7168,Gemm_Hipblaslt_TN_9147,0.108361
GemmTunableOp_Half_TN,tn_14336_2682_4096,Gemm_Hipblaslt_TN_9793,0.537012
GemmTunableOp_Half_TN,tn_3072_1835_4096,Gemm_Hipblaslt_TN_9148,0.0937674
GemmTunableOp_Half_TN,tn_14336_7937_4096,Gemm_Hipblaslt_TN_9914,1.53306
GemmTunableOp_Half_TN,tn_3072_248_4096,Gemm_Rocblas_621294230,0.0231835
GemmTunableOp_Half_TN,tn_64128_16_4096,Gemm_Rocblas_621286348,0.144534
GemmTunableOp_Half_TN,tn_4096_2786_2048,Gemm_Hipblaslt_TN_9689,0.0872088
GemmTunableOp_Half_TN,tn_14336_2773_4096,Gemm_Hipblaslt_TN_9677,0.559868
GemmTunableOp_Half_TN,tn_14336_176_4096,Gemm_Hipblaslt_TN_9352,0.0581519
GemmTunableOp_Half_TN,tn_4096_845_7168,Gemm_Hipblaslt_TN_9158,0.113011
GemmTunableOp_Half_TN,tn_14336_3430_4096,Gemm_Hipblaslt_TN_9220,0.654832
GemmTunableOp_Half_TN,tn_3072_1815_4096,Gemm_Rocblas_621286778,0.0907096
GemmTunableOp_Half_TN,tn_14336_56_4096,Gemm_Rocblas_621286462,0.0296171
GemmTunableOp_Half_TN,tn_4096_72_7168,Gemm_Hipblaslt_TN_9440,0.0238906
GemmTunableOp_Half_TN,tn_4096_2750_2048,Gemm_Hipblaslt_TN_9799,0.0869946
GemmTunableOp_Half_TN,tn_3072_2571_4096,Gemm_Hipblaslt_TN_9645,0.123891
GemmTunableOp_Half_TN,tn_14336_1762_4096,Gemm_Hipblaslt_TN_9793,0.367729
GemmTunableOp_Half_TN,tn_4096_1756_2048,Gemm_Hipblaslt_TN_9268,0.0623564
GemmTunableOp_Half_TN,tn_4096_820_7168,Gemm_Hipblaslt_TN_9147,0.110117
GemmTunableOp_Half_TN,tn_4096_1853_7168,Gemm_Hipblaslt_TN_9136,0.205599
GemmTunableOp_Half_TN,tn_4096_3352_2048,Gemm_Hipblaslt_TN_9896,0.100183
GemmTunableOp_Half_TN,tn_4096_923_7168,Gemm_Hipblaslt_TN_9604,0.119245
GemmTunableOp_Half_TN,tn_14336_7787_4096,Gemm_Hipblaslt_TN_9853,1.50823
GemmTunableOp_Half_TN,tn_14336_807_4096,Gemm_Hipblaslt_TN_9677,0.178924
GemmTunableOp_Half_TN,tn_14336_7863_4096,Gemm_Hipblaslt_TN_9914,1.52999
GemmTunableOp_Half_TN,tn_3072_3431_4096,Gemm_Rocblas_621286753,0.154175
GemmTunableOp_Half_TN,tn_3072_868_4096,Gemm_Hipblaslt_TN_9147,0.0579194
GemmTunableOp_Half_TN,tn_64128_5_4096,Gemm_Rocblas_621286348,0.14091
GemmTunableOp_Half_TN,tn_3072_224_4096,Gemm_Rocblas_621294171,0.0224687
GemmTunableOp_Half_TN,tn_14336_886_4096,Gemm_Hipblaslt_TN_9187,0.183604
GemmTunableOp_Half_TN,tn_4096_1841_7168,Gemm_Hipblaslt_TN_9134,0.204625
GemmTunableOp_Half_TN,tn_4096_938_7168,Gemm_Hipblaslt_TN_9604,0.119789
GemmTunableOp_Half_TN,tn_14336_957_4096,Gemm_Hipblaslt_TN_9139,0.187721
GemmTunableOp_Half_TN,tn_4096_898_7168,Gemm_Hipblaslt_TN_9585,0.118379
GemmTunableOp_Half_TN,tn_14336_7952_4096,Gemm_Hipblaslt_TN_9888,1.5348
GemmTunableOp_Half_TN,tn_3072_820_4096,Gemm_Hipblaslt_TN_9047,0.0540594
GemmTunableOp_Half_TN,tn_4096_2734_7168,Gemm_Hipblaslt_TN_9672,0.281596
GemmTunableOp_Half_TN,tn_14336_2560_4096,Gemm_Rocblas_621286684,0.506524
GemmTunableOp_Half_TN,tn_4096_888_2048,Gemm_Hipblaslt_TN_9355,0.0377371
GemmTunableOp_Half_TN,tn_4096_884_7168,Gemm_Hipblaslt_TN_9547,0.114502
GemmTunableOp_Half_TN,tn_4096_8070_2048,Gemm_Hipblaslt_TN_9815,0.231238
GemmTunableOp_Half_TN,tn_14336_914_4096,Gemm_Hipblaslt_TN_9697,0.185877
GemmTunableOp_Half_TN,tn_4096_871_7168,Gemm_Rocblas_621286770,0.118043
GemmTunableOp_Half_TN,tn_4096_929_2048,Gemm_Hipblaslt_TN_9577,0.0378698
GemmTunableOp_Half_TN,tn_64128_166_4096,Gemm_Hipblaslt_TN_9817,0.245569
GemmTunableOp_Half_TN,tn_4096_3662_2048,Gemm_Hipblaslt_TN_9277,0.112479
GemmTunableOp_Half_TN,tn_4096_2708_2048,Gemm_Hipblaslt_TN_9672,0.0853415
GemmTunableOp_Half_TN,tn_3072_951_4096,Gemm_Hipblaslt_TN_9546,0.0580099
GemmTunableOp_Half_TN,tn_14336_4471_4096,Gemm_Rocblas_621294492,0.864528
GemmTunableOp_Half_TN,tn_4096_1848_7168,Gemm_Hipblaslt_TN_9137,0.205107
GemmTunableOp_Half_TN,tn_3072_1744_4096,Gemm_Hipblaslt_TN_9613,0.0913762
GemmTunableOp_Half_TN,tn_14336_1813_4096,Gemm_Hipblaslt_TN_9677,0.370268
GemmTunableOp_Half_TN,tn_4096_1837_7168,Gemm_Hipblaslt_TN_9137,0.205198
GemmTunableOp_Half_TN,tn_4096_3402_2048,Gemm_Hipblaslt_TN_9694,0.100663
GemmTunableOp_Half_TN,tn_4096_848_7168,Gemm_Hipblaslt_TN_9547,0.111549
GemmTunableOp_Half_TN,tn_4096_903_2048,Gemm_Hipblaslt_TN_9577,0.0373566
GemmTunableOp_Half_TN,tn_3072_2517_4096,Gemm_Hipblaslt_TN_9624,0.121375
GemmTunableOp_Half_TN,tn_4096_1795_7168,Gemm_Hipblaslt_TN_9268,0.204391
GemmTunableOp_Half_TN,tn_64128_140_4096,Gemm_Hipblaslt_TN_9108,0.221674
GemmTunableOp_Half_TN,tn_4096_919_2048,Gemm_Hipblaslt_TN_9577,0.0373695
GemmTunableOp_Half_TN,tn_14336_1893_4096,Gemm_Hipblaslt_TN_9677,0.375303
GemmTunableOp_Half_TN,tn_4096_880_2048,Gemm_Hipblaslt_TN_9576,0.0376074
GemmTunableOp_Half_TN,tn_3072_939_4096,Gemm_Rocblas_621286503,0.0605167
GemmTunableOp_Half_TN,tn_64128_234_4096,Gemm_Rocblas_621286915,0.290031
GemmTunableOp_Half_TN,tn_14336_905_4096,Gemm_Hipblaslt_TN_9677,0.183726
GemmTunableOp_Half_TN,tn_64128_240_4096,Gemm_Rocblas_621286915,0.291525
GemmTunableOp_Half_TN,tn_64128_127_4096,Gemm_Rocblas_621286789,0.204394
GemmTunableOp_Half_TN,tn_4096_32_7168,Gemm_Rocblas_621286268,0.0156598
GemmTunableOp_Half_TN,tn_64128_226_4096,Gemm_Rocblas_621286915,0.287052
GemmTunableOp_Half_TN,tn_3072_846_4096,Gemm_Hipblaslt_TN_9048,0.0533181
GemmTunableOp_Half_TN,tn_4096_1718_2048,Gemm_Hipblaslt_TN_9164,0.0584531
GemmTunableOp_Half_TN,tn_64128_216_4096,Gemm_Hipblaslt_TN_9185,0.280623
GemmTunableOp_Half_TN,tn_3072_1905_4096,Gemm_Hipblaslt_TN_9324,0.0925145
GemmTunableOp_Half_TN,tn_4096_3565_7168,Gemm_Hipblaslt_TN_9695,0.345609
GemmTunableOp_Half_TN,tn_3072_3430_4096,Gemm_Hipblaslt_TN_7589,0.153977
GemmTunableOp_Half_TN,tn_64128_177_4096,Gemm_Hipblaslt_TN_9707,0.244805
GemmTunableOp_Half_TN,tn_8192_4000_14336,Gemm_Hipblaslt_TN_9841,1.69663
GemmTunableOp_Half_TN,tn_3072_1644_4096,Gemm_Hipblaslt_TN_9163,0.0888268
GemmTunableOp_Half_TN,tn_3072_3569_4096,Gemm_Rocblas_621286753,0.156794
GemmTunableOp_Half_TN,tn_14336_814_4096,Gemm_Hipblaslt_TN_9697,0.179707
GemmTunableOp_Half_TN,tn_4096_986_7168,Gemm_Hipblaslt_TN_9170,0.12194
GemmTunableOp_Half_TN,tn_64128_12_4096,Gemm_Rocblas_621294578,0.143205
GemmTunableOp_Half_TN,tn_4096_966_7168,Gemm_Hipblaslt_TN_9604,0.12288
GemmTunableOp_Half_TN,tn_4096_888_7168,Gemm_Hipblaslt_TN_9547,0.116413
GemmTunableOp_Half_TN,tn_4096_964_2048,Gemm_Hipblaslt_TN_9583,0.0385942
GemmTunableOp_Half_TN,tn_64128_154_4096,Gemm_Hipblaslt_TN_9108,0.225841
GemmTunableOp_Half_TN,tn_14336_934_4096,Gemm_Hipblaslt_TN_9697,0.187757
GemmTunableOp_Half_TN,tn_4096_1831_7168,Gemm_Hipblaslt_TN_9137,0.203278
GemmTunableOp_Half_TN,tn_3072_1768_4096,Gemm_Rocblas_621286778,0.0903531
GemmTunableOp_Half_TN,tn_64128_182_4096,Gemm_Hipblaslt_TN_9855,0.248481
GemmTunableOp_Half_TN,tn_14336_1777_4096,Gemm_Hipblaslt_TN_9793,0.367874
GemmTunableOp_Half_TN,tn_3072_1803_4096,Gemm_Rocblas_621286778,0.089914
GemmTunableOp_Half_TN,tn_4096_926_7168,Gemm_Hipblaslt_TN_9576,0.118997
GemmTunableOp_Half_TN,tn_64128_29_4096,Gemm_Rocblas_621286348,0.146981
GemmTunableOp_Half_TN,tn_4096_3556_7168,Gemm_Hipblaslt_TN_9814,0.343949
GemmTunableOp_Half_TN,tn_3072_8070_4096,Gemm_Rocblas_621294473,0.351377
GemmTunableOp_Half_TN,tn_4096_112_2048,Gemm_Rocblas_621286280,0.0111196
GemmTunableOp_Half_TN,tn_3072_1649_4096,Gemm_Hipblaslt_TN_9561,0.0874952
GemmTunableOp_Half_TN,tn_3072_8110_4096,Gemm_Hipblaslt_TN_9935,0.353784
GemmTunableOp_Half_TN,tn_64128_7_4096,Gemm_Rocblas_621294578,0.142129
GemmTunableOp_Half_TN,tn_4096_1743_2048,Gemm_Hipblaslt_TN_9680,0.0622122
GemmTunableOp_Half_TN,tn_8192_232_14336,Gemm_Hipblaslt_TN_9575,0.135961
GemmTunableOp_Half_TN,tn_3072_990_4096,Gemm_Hipblaslt_TN_9158,0.0606632
GemmTunableOp_Half_TN,tn_4096_920_7168,Gemm_Hipblaslt_TN_9634,0.119181
GemmTunableOp_Half_TN,tn_4096_799_2048,Gemm_Hipblaslt_TN_9352,0.0337876
GemmTunableOp_Half_TN,tn_4096_200_2048,Gemm_Rocblas_621294175,0.0140402
GemmTunableOp_Half_TN,tn_4096_2763_2048,Gemm_Hipblaslt_TN_9674,0.086734
GemmTunableOp_Half_TN,tn_64128_252_4096,Gemm_Rocblas_621294658,0.291568
GemmTunableOp_Half_TN,tn_14336_1695_4096,Gemm_Hipblaslt_TN_9189,0.357329
GemmTunableOp_Half_TN,tn_4096_1697_2048,Gemm_Hipblaslt_TN_9607,0.057107
GemmTunableOp_Half_TN,tn_3072_865_4096,Gemm_Hipblaslt_TN_9546,0.0578211
GemmTunableOp_Half_TN,tn_4096_958_7168,Gemm_Hipblaslt_TN_9576,0.119569
GemmTunableOp_Half_TN,tn_4096_1815_7168,Gemm_Hipblaslt_TN_9137,0.205291
GemmTunableOp_Half_TN,tn_64128_22_4096,Gemm_Rocblas_621286348,0.144783
GemmTunableOp_Half_TN,tn_4096_2675_7168,Gemm_Hipblaslt_TN_9672,0.27421
GemmTunableOp_Half_TN,tn_3072_876_4096,Gemm_Hipblaslt_TN_9352,0.0567716
GemmTunableOp_Half_TN,tn_3072_992_4096,Gemm_Hipblaslt_TN_9158,0.0611283
GemmTunableOp_Half_TN,tn_4096_1864_7168,Gemm_Hipblaslt_TN_9645,0.208086
GemmTunableOp_Half_TN,tn_64128_37_4096,Gemm_Hipblaslt_TN_9097,0.158045
GemmTunableOp_Half_TN,tn_4096_1763_2048,Gemm_Hipblaslt_TN_9329,0.0622743
GemmTunableOp_Half_TN,tn_64128_48_4096,Gemm_Hipblaslt_TN_9097,0.160973
GemmTunableOp_Half_TN,tn_14336_1746_4096,Gemm_Hipblaslt_TN_9697,0.365786
GemmTunableOp_Half_TN,tn_64128_204_4096,Gemm_Hipblaslt_TN_9260,0.27584
GemmTunableOp_Half_TN,tn_4096_1742_7168,Gemm_Hipblaslt_TN_9673,0.195586
GemmTunableOp_Half_TN,tn_64128_197_4096,Gemm_Hipblaslt_TN_9736,0.274496
GemmTunableOp_Half_TN,tn_64128_105_4096,Gemm_Hipblaslt_TN_9061,0.198246
GemmTunableOp_Half_TN,tn_64128_112_4096,Gemm_Hipblaslt_TN_9061,0.200228
GemmTunableOp_Half_TN,tn_3072_3670_4096,Gemm_Hipblaslt_TN_9657,0.16565
GemmTunableOp_Half_TN,tn_64128_209_4096,Gemm_Hipblaslt_TN_9961,0.276115
GemmTunableOp_Half_TN,tn_4096_1723_2048,Gemm_Hipblaslt_TN_9607,0.0581189
GemmTunableOp_Half_TN,tn_4096_1778_7168,Gemm_Hipblaslt_TN_9136,0.20152
GemmTunableOp_Half_TN,tn_4096_905_7168,Gemm_Hipblaslt_TN_9604,0.117439
GemmTunableOp_Half_TN,tn_4096_1944_7168,Gemm_Hipblaslt_TN_9136,0.211969
GemmTunableOp_Half_TN,tn_64128_62_4096,Gemm_Hipblaslt_TN_9097,0.163749
GemmTunableOp_Half_TN,tn_4096_1828_7168,Gemm_Hipblaslt_TN_9268,0.20542
GemmTunableOp_Half_TN,tn_64128_94_4096,Gemm_Hipblaslt_TN_9057,0.180858
GemmTunableOp_Half_TN,tn_3072_200_4096,Gemm_Rocblas_621286443,0.022211
GemmTunableOp_Half_TN,tn_14336_1905_4096,Gemm_Hipblaslt_TN_9677,0.373316
GemmTunableOp_Half_TN,tn_14336_2599_4096,Gemm_Hipblaslt_TN_9793,0.534451
GemmTunableOp_Half_TN,tn_4096_1694_2048,Gemm_Hipblaslt_TN_9588,0.0582774
GemmTunableOp_Half_TN,tn_14336_977_4096,Gemm_Hipblaslt_TN_9220,0.204839
GemmTunableOp_Half_TN,tn_4096_924_2048,Gemm_Hipblaslt_TN_9604,0.0376174
GemmTunableOp_Half_TN,tn_4096_1775_7168,Gemm_Hipblaslt_TN_9645,0.200849
GemmTunableOp_Half_TN,tn_4096_1755_2048,Gemm_Hipblaslt_TN_9680,0.0629763
GemmTunableOp_Half_TN,tn_3072_2764_4096,Gemm_Hipblaslt_TN_9567,0.128042
GemmTunableOp_Half_TN,tn_4096_978_7168,Gemm_Hipblaslt_TN_9170,0.120585
GemmTunableOp_Half_TN,tn_4096_1794_2048,Gemm_Hipblaslt_TN_9590,0.0619746
GemmTunableOp_Half_TN,tn_3072_903_4096,Gemm_Hipblaslt_TN_9352,0.0595063
GemmTunableOp_Half_TN,tn_4096_1822_7168,Gemm_Hipblaslt_TN_9680,0.204927
GemmTunableOp_Half_TN,tn_4096_935_2048,Gemm_Hipblaslt_TN_9577,0.0379631
GemmTunableOp_Half_TN,tn_4096_1867_2048,Gemm_Hipblaslt_TN_9590,0.0634477
GemmTunableOp_Half_TN,tn_14336_1737_4096,Gemm_Hipblaslt_TN_9793,0.366826
GemmTunableOp_Half_TN,tn_3072_880_4096,Gemm_Hipblaslt_TN_9131,0.0575652
GemmTunableOp_Half_TN,tn_14336_1715_4096,Gemm_Hipblaslt_TN_9189,0.360751
GemmTunableOp_Half_TN,tn_4096_3447_7168,Gemm_Hipblaslt_TN_9682,0.334978
GemmTunableOp_Half_TN,tn_4096_868_2048,Gemm_Hipblaslt_TN_9576,0.0362999
GemmTunableOp_Half_TN,tn_3072_2698_4096,Gemm_Hipblaslt_TN_9624,0.126707
GemmTunableOp_Half_TN,tn_14336_832_4096,Gemm_Hipblaslt_TN_9677,0.178799
GemmTunableOp_Half_TN,tn_4096_790_2048,Gemm_Hipblaslt_TN_9634,0.0339887
GemmTunableOp_Half_TN,tn_14336_248_4096,Gemm_Hipblaslt_TN_9355,0.068387
GemmTunableOp_Half_TN,tn_3072_1727_4096,Gemm_Hipblaslt_TN_9322,0.0896663
GemmTunableOp_Half_TN,tn_64128_245_4096,Gemm_Rocblas_621286915,0.290879
GemmTunableOp_Half_TN,tn_4096_839_7168,Gemm_Hipblaslt_TN_9099,0.111857
GemmTunableOp_Half_TN,tn_4096_1853_2048,Gemm_Hipblaslt_TN_9590,0.0638217
GemmTunableOp_Half_TN,tn_4096_852_2048,Gemm_Hipblaslt_TN_9576,0.0353066
GemmTunableOp_Half_TN,tn_4096_2708_7168,Gemm_Hipblaslt_TN_9691,0.277577
GemmTunableOp_Half_TN,tn_4096_1881_2048,Gemm_Hipblaslt_TN_9590,0.0643209
GemmTunableOp_Half_TN,tn_3072_907_4096,Gemm_Hipblaslt_TN_9131,0.0588227
GemmTunableOp_Half_TN,tn_4096_870_2048,Gemm_Hipblaslt_TN_9577,0.036974
GemmTunableOp_Half_TN,tn_4096_853_2048,Gemm_Hipblaslt_TN_9354,0.0351585
GemmTunableOp_Half_TN,tn_4096_96_2048,Gemm_Rocblas_621286278,0.00926064
GemmTunableOp_Half_TN,tn_14336_920_4096,Gemm_Hipblaslt_TN_9697,0.18622
GemmTunableOp_Half_TN,tn_4096_8110_7168,Gemm_Hipblaslt_TN_9815,0.758054
GemmTunableOp_Half_TN,tn_14336_929_4096,Gemm_Hipblaslt_TN_9697,0.185093
GemmTunableOp_Half_TN,tn_4096_7798_2048,Gemm_Hipblaslt_TN_9713,0.230519
GemmTunableOp_Half_TN,tn_64128_231_4096,Gemm_Rocblas_621294658,0.289223
GemmTunableOp_Half_TN,tn_14336_2648_4096,Gemm_Hipblaslt_TN_9793,0.538549
GemmTunableOp_Half_TN,tn_14336_2675_4096,Gemm_Hipblaslt_TN_9793,0.538473
GemmTunableOp_Half_TN,tn_4096_2509_2048,Gemm_Hipblaslt_TN_9672,0.0820572
GemmTunableOp_Half_TN,tn_4096_8192_7168,Gemm_Hipblaslt_TN_9217,0.761293
GemmTunableOp_Half_TN,tn_4096_990_7168,Gemm_Hipblaslt_TN_9170,0.122276
GemmTunableOp_Half_TN,tn_4096_843_2048,Gemm_Hipblaslt_TN_9353,0.0351626
GemmTunableOp_Half_TN,tn_14336_877_4096,Gemm_Hipblaslt_TN_9697,0.182553
GemmTunableOp_Half_TN,tn_4096_8156_7168,Gemm_Rocblas_621286678,0.764552
GemmTunableOp_Half_TN,tn_4096_224_2048,Gemm_Rocblas_621286447,0.0144459
GemmTunableOp_Half_TN,tn_8192_4096_14336,Gemm_Rocblas_621286905,1.73431
GemmTunableOp_Half_TN,tn_14336_808_4096,Gemm_Hipblaslt_TN_9187,0.177904
GemmTunableOp_Half_TN,tn_3072_4483_4096,Gemm_Hipblaslt_TN_9834,0.191586
GemmTunableOp_Half_TN,tn_64128_10_4096,Gemm_Rocblas_621294578,0.143416
GemmTunableOp_Half_TN,tn_14336_2651_4096,Gemm_Hipblaslt_TN_9793,0.537813
GemmTunableOp_Half_TN,tn_64128_91_4096,Gemm_Hipblaslt_TN_9057,0.180456
GemmTunableOp_Half_TN,tn_4096_2544_2048,Gemm_Hipblaslt_TN_9687,0.0821957
GemmTunableOp_Half_TN,tn_14336_1763_4096,Gemm_Hipblaslt_TN_9793,0.367536
GemmTunableOp_Half_TN,tn_4096_7266_7168,Gemm_Hipblaslt_TN_9743,0.688205
GemmTunableOp_Half_TN,tn_4096_1846_2048,Gemm_Hipblaslt_TN_9590,0.0628984
GemmTunableOp_Half_TN,tn_4096_3599_7168,Gemm_Hipblaslt_TN_9682,0.343617
GemmTunableOp_Half_TN,tn_4096_916_7168,Gemm_Hipblaslt_TN_9576,0.119384
GemmTunableOp_Half_TN,tn_4096_968_7168,Gemm_Hipblaslt_TN_9604,0.121913
GemmTunableOp_Half_TN,tn_64128_237_4096,Gemm_Rocblas_621286915,0.288912
GemmTunableOp_Half_TN,tn_16000_256_8192,Gemm_Hipblaslt_TN_9583,0.162961
GemmTunableOp_Half_TN,tn_4096_2793_7168,Gemm_Hipblaslt_TN_9799,0.284029
GemmTunableOp_Half_TN,tn_14336_805_4096,Gemm_Hipblaslt_TN_9187,0.178218
GemmTunableOp_Half_TN,tn_4096_847_7168,Gemm_Hipblaslt_TN_9547,0.114454
GemmTunableOp_Half_TN,tn_14336_1837_4096,Gemm_Hipblaslt_TN_9192,0.373649
GemmTunableOp_Half_TN,tn_14336_887_4096,Gemm_Hipblaslt_TN_9187,0.183649
GemmTunableOp_Half_TN,tn_4096_5606_7168,Gemm_Rocblas_621294426,0.567912
GemmTunableOp_Half_TN,tn_14336_2719_4096,Gemm_Hipblaslt_TN_9139,0.55809
GemmTunableOp_Half_TN,tn_4096_2722_2048,Gemm_Hipblaslt_TN_9691,0.0866443
GemmTunableOp_Half_TN,tn_3072_927_4096,Gemm_Hipblaslt_TN_9147,0.0592766
GemmTunableOp_Half_TN,tn_4096_5606_2048,Gemm_Hipblaslt_TN_9852,0.174872
GemmTunableOp_Half_TN,tn_14336_2590_4096,Gemm_Hipblaslt_TN_9793,0.533098
GemmTunableOp_Half_TN,tn_14336_875_4096,Gemm_Hipblaslt_TN_9677,0.18308
GemmTunableOp_Half_TN,tn_4096_1757_7168,Gemm_Hipblaslt_TN_9673,0.199077
GemmTunableOp_Half_TN,tn_4096_875_7168,Gemm_Hipblaslt_TN_9634,0.119213
GemmTunableOp_Half_TN,tn_4096_7967_7168,Gemm_Hipblaslt_TN_9930,0.749926
GemmTunableOp_Half_TN,tn_14336_801_4096,Gemm_Hipblaslt_TN_9697,0.177306
GemmTunableOp_Half_TN,tn_14336_872_4096,Gemm_Hipblaslt_TN_9697,0.183703
GemmTunableOp_Half_TN,tn_3072_832_4096,Gemm_Hipblaslt_TN_9047,0.0530338
GemmTunableOp_Half_TN,tn_14336_40_4096,Gemm_Rocblas_621294171,0.0286629
GemmTunableOp_Half_TN,tn_4096_8_7168,Gemm_Rocblas_621286312,0.0127731
GemmTunableOp_Half_TN,tn_4096_152_2048,Gemm_Rocblas_621286440,0.0127586
GemmTunableOp_Half_TN,tn_14336_1815_4096,Gemm_Hipblaslt_TN_9192,0.370306
GemmTunableOp_Half_TN,tn_4096_1817_2048,Gemm_Hipblaslt_TN_9590,0.0635318
GemmTunableOp_Half_TN,tn_14336_2628_4096,Gemm_Hipblaslt_TN_9793,0.532638
GemmTunableOp_Half_TN,tn_14336_2699_4096,Gemm_Hipblaslt_TN_9677,0.55117
GemmTunableOp_Half_TN,tn_4096_80_7168,Gemm_Hipblaslt_TN_9432,0.0238297
GemmTunableOp_Half_TN,tn_14336_918_4096,Gemm_Hipblaslt_TN_9139,0.185345
GemmTunableOp_Half_TN,tn_4096_935_7168,Gemm_Hipblaslt_TN_9576,0.119107
GemmTunableOp_Half_TN,tn_14336_8070_4096,Gemm_Hipblaslt_TN_159,1.55777
GemmTunableOp_Half_TN,tn_14336_904_4096,Gemm_Hipblaslt_TN_9677,0.185053
GemmTunableOp_Half_TN,tn_14336_7239_4096,Gemm_Hipblaslt_TN_9683,1.40385
GemmTunableOp_Half_TN,tn_3072_1822_4096,Gemm_Rocblas_621286778,0.091831
GemmTunableOp_Half_TN,tn_64128_20_4096,Gemm_Rocblas_621286348,0.144469
GemmTunableOp_Half_TN,tn_64128_131_4096,Gemm_Hipblaslt_TN_9108,0.218744
GemmTunableOp_Half_TN,tn_64128_152_4096,Gemm_Hipblaslt_TN_9108,0.223082
GemmTunableOp_Half_TN,tn_4096_7863_7168,Gemm_Hipblaslt_TN_159,0.749121
GemmTunableOp_Half_TN,tn_4096_977_7168,Gemm_Hipblaslt_TN_9547,0.120115
GemmTunableOp_Half_TN,tn_14336_1748_4096,Gemm_Hipblaslt_TN_9793,0.366067
GemmTunableOp_Half_TN,tn_14336_2764_4096,Gemm_Hipblaslt_TN_9677,0.558562
GemmTunableOp_Half_TN,tn_14336_1806_4096,Gemm_Hipblaslt_TN_9187,0.370845
GemmTunableOp_Half_TN,tn_3072_2699_4096,Gemm_Hipblaslt_TN_9624,0.126967
GemmTunableOp_Half_TN,tn_64128_145_4096,Gemm_Hipblaslt_TN_9108,0.219652
GemmTunableOp_Half_TN,tn_3072_937_4096,Gemm_Hipblaslt_TN_9546,0.0573525
GemmTunableOp_Half_TN,tn_4096_1803_7168,Gemm_Hipblaslt_TN_9602,0.202802
GemmTunableOp_Half_TN,tn_4096_876_2048,Gemm_Hipblaslt_TN_9252,0.0374844
GemmTunableOp_Half_TN,tn_14336_1697_4096,Gemm_Hipblaslt_TN_9697,0.359317
GemmTunableOp_Half_TN,tn_64128_15_4096,Gemm_Rocblas_621286348,0.143959
GemmTunableOp_Half_TN,tn_3072_1748_4096,Gemm_Hipblaslt_TN_9611,0.0915056
GemmTunableOp_Half_TN,tn_3072_1755_4096,Gemm_Hipblaslt_TN_9148,0.0910866
GemmTunableOp_Half_TN,tn_4096_823_7168,Gemm_Hipblaslt_TN_9131,0.110846
GemmTunableOp_Half_TN,tn_14336_850_4096,Gemm_Hipblaslt_TN_9697,0.181765
GemmTunableOp_Half_TN,tn_4096_838_7168,Gemm_Hipblaslt_TN_9099,0.111521
GemmTunableOp_Half_TN,tn_14336_838_4096,Gemm_Hipblaslt_TN_9677,0.180388
GemmTunableOp_Half_TN,tn_4096_830_7168,Gemm_Hipblaslt_TN_9147,0.10938
GemmTunableOp_Half_TN,tn_4096_7436_2048,Gemm_Hipblaslt_TN_9746,0.224653
GemmTunableOp_Half_TN,tn_64128_8_4096,Gemm_Rocblas_621286300,0.141213
GemmTunableOp_Half_TN,tn_3072_2762_4096,Gemm_Hipblaslt_TN_9624,0.129206
GemmTunableOp_Half_TN,tn_4096_8192_2048,Gemm_Hipblaslt_TN_9768,0.235685
GemmTunableOp_Half_TN,tn_4096_160_2048,Gemm_Rocblas_621294171,0.01255
GemmTunableOp_Half_TN,tn_4096_2703_7168,Gemm_Hipblaslt_TN_9672,0.274245
GemmTunableOp_Half_TN,tn_4096_924_7168,Gemm_Hipblaslt_TN_9604,0.119021
GemmTunableOp_Half_TN,tn_4096_1837_2048,Gemm_Hipblaslt_TN_9136,0.0635114
GemmTunableOp_Half_TN,tn_4096_8070_7168,Gemm_Hipblaslt_TN_159,0.763517
GemmTunableOp_Half_TN,tn_3072_7992_4096,Gemm_Hipblaslt_TN_9622,0.341107
GemmTunableOp_Half_TN,tn_64128_93_4096,Gemm_Hipblaslt_TN_9057,0.180552
GemmTunableOp_Half_TN,tn_4096_7857_7168,Gemm_Hipblaslt_TN_9890,0.744811
GemmTunableOp_Half_TN,tn_3072_8054_4096,Gemm_Hipblaslt_TN_9928,0.349801
GemmTunableOp_Half_TN,tn_4096_208_7168,Gemm_Hipblaslt_TN_9303,0.0425881
GemmTunableOp_Half_TN,tn_4096_2734_2048,Gemm_Hipblaslt_TN_9691,0.0871992
GemmTunableOp_Half_TN,tn_4096_830_2048,Gemm_Hipblaslt_TN_9604,0.0348047
GemmTunableOp_Half_TN,tn_14336_216_4096,Gemm_Hipblaslt_TN_9355,0.0656871
GemmTunableOp_Half_TN,tn_3072_2786_4096,Gemm_Hipblaslt_TN_9624,0.128317
GemmTunableOp_Half_TN,tn_4096_1815_2048,Gemm_Hipblaslt_TN_9590,0.0626542
GemmTunableOp_Half_TN,tn_14336_8007_4096,Gemm_Hipblaslt_TN_9888,1.53539
GemmTunableOp_Half_TN,tn_4096_32_2048,Gemm_Rocblas_621286273,0.00706536
GemmTunableOp_Half_TN,tn_3072_912_4096,Gemm_Hipblaslt_TN_9546,0.0570508
GemmTunableOp_Half_TN,tn_4096_4463_7168,Gemm_Hipblaslt_TN_9763,0.462766
GemmTunableOp_Half_TN,tn_4096_925_2048,Gemm_Hipblaslt_TN_9577,0.0376743
GemmTunableOp_Half_TN,tn_14336_913_4096,Gemm_Hipblaslt_TN_9697,0.185732
GemmTunableOp_Half_TN,tn_64128_164_4096,Gemm_Hipblaslt_TN_9816,0.244153
GemmTunableOp_Half_TN,tn_14336_1785_4096,Gemm_Hipblaslt_TN_9793,0.367965
GemmTunableOp_Half_TN,tn_4096_3430_7168,Gemm_Hipblaslt_TN_9677,0.32926
GemmTunableOp_Half_TN,tn_4096_7283_7168,Gemm_Hipblaslt_TN_9743,0.687192
GemmTunableOp_Half_TN,tn_3072_984_4096,Gemm_Hipblaslt_TN_9352,0.060609
GemmTunableOp_Half_TN,tn_14336_1701_4096,Gemm_Hipblaslt_TN_9697,0.358744
GemmTunableOp_Half_TN,tn_3072_64_4096,Gemm_Rocblas_621286419,0.0109079
GemmTunableOp_Half_TN,tn_3072_48_4096,Gemm_Rocblas_621286419,0.0103939
GemmTunableOp_Half_TN,tn_4096_8000_7168,Gemm_Hipblaslt_TN_9903,0.748596
GemmStridedBatchedTunableOp_Half_TN,tn_959_959_128_B_16,Gemm_Rocblas_621294536,0.028576
GemmStridedBatchedTunableOp_Half_TN,tn_945_945_128_B_16,Gemm_Rocblas_621294536,0.0280256
GemmStridedBatchedTunableOp_Half_TN,tn_845_845_128_B_16,Gemm_Rocblas_621294552,0.0245093
GemmStridedBatchedTunableOp_Half_TN,tn_829_829_128_B_16,Gemm_Hipblaslt_TN_158,0.0253759
GemmStridedBatchedTunableOp_Half_TN,tn_801_801_128_B_16,Gemm_Hipblaslt_TN_158,0.0233655
GemmStridedBatchedTunableOp_Half_TN,tn_859_859_128_B_16,Gemm_Rocblas_621286794,0.026226
GemmStridedBatchedTunableOp_Half_TN,tn_836_836_128_B_16,Gemm_Hipblaslt_TN_158,0.0247187
GemmStridedBatchedTunableOp_Half_TN,tn_810_810_128_B_16,Gemm_Hipblaslt_TN_158,0.0230463
GemmStridedBatchedTunableOp_Half_TN,tn_811_811_128_B_16,Gemm_Hipblaslt_TN_158,0.0235862
GemmStridedBatchedTunableOp_Half_TN,tn_885_885_128_B_16,Gemm_Rocblas_621286984,0.0265547
GemmStridedBatchedTunableOp_Half_TN,tn_917_917_128_B_16,Gemm_Rocblas_621286794,0.0279432
GemmStridedBatchedTunableOp_Half_TN,tn_827_827_128_B_16,Gemm_Hipblaslt_TN_158,0.024515
GemmStridedBatchedTunableOp_Half_TN,tn_814_814_128_B_16,Gemm_Rocblas_621286811,0.0235908
GemmStridedBatchedTunableOp_Half_TN,tn_866_866_128_B_16,Gemm_Rocblas_621294728,0.0262472
GemmStridedBatchedTunableOp_Half_TN,tn_854_854_128_B_16,Gemm_Rocblas_621294728,0.0259641
GemmStridedBatchedTunableOp_Half_TN,tn_867_867_128_B_16,Gemm_Rocblas_621294728,0.0263615
GemmStridedBatchedTunableOp_Half_TN,tn_938_938_128_B_16,Gemm_Rocblas_621294536,0.0275103
GemmStridedBatchedTunableOp_Half_TN,tn_891_891_128_B_16,Gemm_Rocblas_621286984,0.0270321
GemmStridedBatchedTunableOp_Half_TN,tn_948_948_128_B_16,Gemm_Rocblas_621294536,0.027448
GemmStridedBatchedTunableOp_Half_TN,tn_855_855_128_B_16,Gemm_Rocblas_621286984,0.0261236
GemmStridedBatchedTunableOp_Half_TN,tn_934_934_128_B_16,Gemm_Rocblas_621286794,0.0276533
GemmStridedBatchedTunableOp_Half_TN,tn_850_850_128_B_16,Gemm_Rocblas_621294728,0.0259311
GemmStridedBatchedTunableOp_Half_TN,tn_878_878_128_B_16,Gemm_Rocblas_621294728,0.0261149
GemmStridedBatchedTunableOp_Half_TN,tn_976_976_128_B_16,Gemm_Rocblas_621293994,0.0245314
GemmStridedBatchedTunableOp_Half_TN,tn_889_889_128_B_16,Gemm_Rocblas_621286984,0.0266885
GemmStridedBatchedTunableOp_Half_TN,tn_985_985_128_B_16,Gemm_Rocblas_621294536,0.0287755
GemmStridedBatchedTunableOp_Half_TN,tn_791_791_128_B_16,Gemm_Hipblaslt_TN_158,0.0226459
GemmStridedBatchedTunableOp_Half_TN,tn_795_795_128_B_16,Gemm_Hipblaslt_TN_158,0.0234222
GemmStridedBatchedTunableOp_Half_TN,tn_916_916_128_B_16,Gemm_Rocblas_621286794,0.028099
GemmStridedBatchedTunableOp_Half_TN,tn_915_915_128_B_16,Gemm_Rocblas_621294536,0.0280733
GemmStridedBatchedTunableOp_Half_TN,tn_925_925_128_B_16,Gemm_Rocblas_621294536,0.0282496
GemmStridedBatchedTunableOp_Half_TN,tn_844_844_128_B_16,Gemm_Rocblas_621294552,0.0252154
GemmStridedBatchedTunableOp_Half_TN,tn_971_971_128_B_16,Gemm_Rocblas_621294536,0.0285931
GemmStridedBatchedTunableOp_Half_TN,tn_927_927_128_B_16,Gemm_Rocblas_621286794,0.0277893
GemmStridedBatchedTunableOp_Half_TN,tn_940_940_128_B_16,Gemm_Rocblas_621294536,0.0276575
GemmStridedBatchedTunableOp_Half_TN,tn_921_921_128_B_16,Gemm_Rocblas_621286794,0.0278452
GemmStridedBatchedTunableOp_Half_TN,tn_912_912_128_B_16,Gemm_Rocblas_621293994,0.0240855
GemmStridedBatchedTunableOp_Half_TN,tn_984_984_128_B_16,Gemm_Rocblas_621286240,0.0261901
GemmStridedBatchedTunableOp_Half_TN,tn_914_914_128_B_16,Gemm_Rocblas_621286794,0.0275756
GemmStridedBatchedTunableOp_Half_TN,tn_899_899_128_B_16,Gemm_Rocblas_621294536,0.0271087
GemmStridedBatchedTunableOp_Half_TN,tn_942_942_128_B_16,Gemm_Rocblas_621286794,0.0288683
GemmStridedBatchedTunableOp_Half_TN,tn_853_853_128_B_16,Gemm_Rocblas_621294728,0.0260302
GemmStridedBatchedTunableOp_Half_TN,tn_877_877_128_B_16,Gemm_Rocblas_621286984,0.0265336
GemmStridedBatchedTunableOp_Half_TN,tn_868_868_128_B_16,Gemm_Rocblas_621294728,0.0260032
GemmStridedBatchedTunableOp_Half_TN,tn_937_937_128_B_16,Gemm_Rocblas_621286794,0.0277834
GemmStridedBatchedTunableOp_Half_TN,tn_881_881_128_B_16,Gemm_Rocblas_621294728,0.0264476
GemmStridedBatchedTunableOp_Half_TN,tn_901_901_128_B_16,Gemm_Rocblas_621286794,0.0270827
GemmStridedBatchedTunableOp_Half_TN,tn_941_941_128_B_16,Gemm_Rocblas_621286794,0.0283922
GemmTunableOp_Half_TN,tn_3072_1900_4096,Gemm_Hipblaslt_TN_9613,0.0956798
GemmTunableOp_Half_TN,tn_4096_917_2048,Gemm_Hipblaslt_TN_9583,0.0390114
GemmTunableOp_Half_TN,tn_3072_1746_4096,Gemm_Hipblaslt_TN_9163,0.0919242
GemmTunableOp_Half_TN,tn_4096_877_2048,Gemm_Hipblaslt_TN_9355,0.0371443
GemmTunableOp_Half_TN,tn_4096_2636_2048,Gemm_Hipblaslt_TN_9687,0.0861184
GemmTunableOp_Half_TN,tn_14336_1600_4096,Gemm_Rocblas_621294426,0.325368
GemmTunableOp_Half_TN,tn_3072_1600_4096,Gemm_Hipblaslt_TN_9163,0.0869878
GemmTunableOp_Half_TN,tn_3072_3556_4096,Gemm_Hipblaslt_TN_9681,0.159196
GemmTunableOp_Half_TN,tn_3072_901_4096,Gemm_Hipblaslt_TN_9546,0.0589639
GemmTunableOp_Half_TN,tn_4096_2653_7168,Gemm_Hipblaslt_TN_9674,0.276016
GemmTunableOp_Half_TN,tn_4096_56_7168,Gemm_Rocblas_621286332,0.0196109
GemmTunableOp_Half_TN,tn_4096_873_7168,Gemm_Hipblaslt_TN_9355,0.118976
GemmTunableOp_Half_TN,tn_64128_221_4096,Gemm_Hipblaslt_TN_9185,0.281654
GemmTunableOp_Half_TN,tn_64128_178_4096,Gemm_Hipblaslt_TN_9707,0.253277
GemmTunableOp_Half_TN,tn_3072_2721_4096,Gemm_Hipblaslt_TN_9624,0.128734
GemmTunableOp_Half_TN,tn_4096_917_7168,Gemm_Hipblaslt_TN_9604,0.12
GemmTunableOp_Half_TN,tn_4096_863_7168,Gemm_Hipblaslt_TN_9604,0.116119
GemmTunableOp_Half_TN,tn_4096_863_2048,Gemm_Hipblaslt_TN_9583,0.0370605
GemmTunableOp_Half_TN,tn_3072_1931_4096,Gemm_Hipblaslt_TN_9633,0.100103
GemmTunableOp_Half_TN,tn_3072_966_4096,Gemm_Hipblaslt_TN_9131,0.0602965
GemmTunableOp_Half_TN,tn_4096_3662_7168,Gemm_Hipblaslt_TN_9217,0.36195
GemmTunableOp_Half_TN,tn_4096_907_2048,Gemm_Hipblaslt_TN_9604,0.03765
GemmTunableOp_Half_TN,tn_14336_2537_4096,Gemm_Rocblas_621294426,0.51151
GemmTunableOp_Half_TN,tn_14336_3546_4096,Gemm_Hipblaslt_TN_9223,0.66877
GemmTunableOp_Half_TN,tn_4096_2602_2048,Gemm_Hipblaslt_TN_9799,0.0854806
GemmTunableOp_Half_TN,tn_4096_192_2048,Gemm_Rocblas_621294175,0.013125
GemmTunableOp_Half_TN,tn_4096_896_7168,Gemm_Rocblas_621286770,0.120324
GemmTunableOp_Half_TN,tn_4096_1785_2048,Gemm_Hipblaslt_TN_9268,0.0642922
GemmTunableOp_Half_TN,tn_3072_2860_4096,Gemm_Hipblaslt_TN_9624,0.130596
GemmTunableOp_Half_TN,tn_64128_133_4096,Gemm_Hipblaslt_TN_9799,0.225766
GemmTunableOp_Half_TN,tn_4096_1850_2048,Gemm_Hipblaslt_TN_9590,0.064894
GemmTunableOp_Half_TN,tn_14336_848_4096,Gemm_Hipblaslt_TN_9677,0.181567
GemmTunableOp_Half_TN,tn_4096_2651_2048,Gemm_Hipblaslt_TN_9672,0.085479
GemmTunableOp_Half_TN,tn_4096_944_2048,Gemm_Hipblaslt_TN_9577,0.0392334
GemmTunableOp_Half_TN,tn_3072_2703_4096,Gemm_Hipblaslt_TN_9567,0.127459
GemmTunableOp_Half_TN,tn_4096_1729_2048,Gemm_Hipblaslt_TN_9136,0.0622683
GemmTunableOp_Half_TN,tn_3072_1729_4096,Gemm_Hipblaslt_TN_9163,0.0903761
GemmTunableOp_Half_TN,tn_4096_899_2048,Gemm_Hipblaslt_TN_9355,0.0391923
GemmTunableOp_Half_TN,tn_4096_846_2048,Gemm_Hipblaslt_TN_9353,0.0359861
GemmTunableOp_Half_TN,tn_4096_881_7168,Gemm_Hipblaslt_TN_9170,0.118691
GemmTunableOp_Half_TN,tn_14336_885_4096,Gemm_Hipblaslt_TN_9697,0.183761
GemmTunableOp_Half_TN,tn_3072_885_4096,Gemm_Hipblaslt_TN_9546,0.057228
GemmTunableOp_Half_TN,tn_4096_2602_7168,Gemm_Hipblaslt_TN_9799,0.274779
GemmTunableOp_Half_TN,tn_4096_2703_2048,Gemm_Hipblaslt_TN_9687,0.0859075
GemmTunableOp_Half_TN,tn_3072_942_4096,Gemm_Hipblaslt_TN_9147,0.0591167
GemmTunableOp_Half_TN,tn_4096_801_2048,Gemm_Hipblaslt_TN_9634,0.0343169
GemmTunableOp_Half_TN,tn_3072_896_4096,Gemm_Hipblaslt_TN_9352,0.0586049
GemmTunableOp_Half_TN,tn_4096_896_2048,Gemm_Hipblaslt_TN_9252,0.0373307
GemmTunableOp_Half_TN,tn_3072_835_4096,Gemm_Hipblaslt_TN_9368,0.0535589
GemmTunableOp_Half_TN,tn_14336_907_4096,Gemm_Hipblaslt_TN_9677,0.185981
GemmTunableOp_Half_TN,tn_4096_882_2048,Gemm_Hipblaslt_TN_9355,0.0372633
GemmTunableOp_Half_TN,tn_4096_808_2048,Gemm_Hipblaslt_TN_9604,0.0357227
GemmTunableOp_Half_TN,tn_3072_802_4096,Gemm_Hipblaslt_TN_9047,0.053215
GemmTunableOp_Half_TN,tn_14336_1841_4096,Gemm_Hipblaslt_TN_9677,0.372264
GemmTunableOp_Half_TN,tn_4096_915_2048,Gemm_Hipblaslt_TN_9604,0.0366748
GemmTunableOp_Half_TN,tn_4096_2592_2048,Gemm_Hipblaslt_TN_9672,0.085081
GemmTunableOp_Half_TN,tn_64128_90_4096,Gemm_Hipblaslt_TN_9057,0.188757
GemmTunableOp_Half_TN,tn_4096_815_7168,Gemm_Hipblaslt_TN_9352,0.111862
GemmTunableOp_Half_TN,tn_4096_2651_7168,Gemm_Hipblaslt_TN_9690,0.276941
GemmTunableOp_Half_TN,tn_14336_815_4096,Gemm_Hipblaslt_TN_9189,0.180633
GemmTunableOp_Half_TN,tn_3072_801_4096,Gemm_Hipblaslt_TN_9047,0.053364
GemmTunableOp_Half_TN,tn_3072_853_4096,Gemm_Hipblaslt_TN_9048,0.0541658
GemmTunableOp_Half_TN,tn_3072_1697_4096,Gemm_Hipblaslt_TN_9148,0.089063
GemmTunableOp_Half_TN,tn_4096_985_7168,Gemm_Hipblaslt_TN_9170,0.124486
GemmTunableOp_Half_TN,tn_3072_815_4096,Gemm_Hipblaslt_TN_9047,0.0537574
GemmTunableOp_Half_TN,tn_4096_1783_7168,Gemm_Hipblaslt_TN_9680,0.203471
GemmTunableOp_Half_TN,tn_4096_1806_7168,Gemm_Hipblaslt_TN_9645,0.206873
GemmTunableOp_Half_TN,tn_3072_1806_4096,Gemm_Rocblas_621294520,0.0932297
GemmTunableOp_Half_TN,tn_4096_899_7168,Gemm_Hipblaslt_TN_9576,0.11957
GemmTunableOp_Half_TN,tn_14336_961_4096,Gemm_Hipblaslt_TN_9217,0.202922
GemmTunableOp_Half_TN,tn_4096_875_2048,Gemm_Hipblaslt_TN_9252,0.0381134
GemmTunableOp_Half_TN,tn_4096_911_7168,Gemm_Hipblaslt_TN_9576,0.119892
GemmTunableOp_Half_TN,tn_4096_908_7168,Gemm_Hipblaslt_TN_9604,0.119272
GemmTunableOp_Half_TN,tn_3072_3565_4096,Gemm_Rocblas_621294495,0.159546
GemmTunableOp_Half_TN,tn_4096_893_7168,Gemm_Hipblaslt_TN_9547,0.119442
GemmTunableOp_Half_TN,tn_4096_823_2048,Gemm_Hipblaslt_TN_9354,0.0355599
GemmTunableOp_Half_TN,tn_4096_2601_2048,Gemm_Hipblaslt_TN_9672,0.085096
GemmTunableOp_Half_TN,tn_4096_1744_7168,Gemm_Hipblaslt_TN_9673,0.196531
GemmTunableOp_Half_TN,tn_4096_938_2048,Gemm_Hipblaslt_TN_9604,0.0376072
GemmTunableOp_Half_TN,tn_4096_1672_2048,Gemm_Hipblaslt_TN_9607,0.0570935
GemmTunableOp_Half_TN,tn_14336_1831_4096,Gemm_Hipblaslt_TN_9697,0.373576
GemmTunableOp_Half_TN,tn_4096_2788_7168,Gemm_Hipblaslt_TN_9691,0.285368
GemmTunableOp_Half_TN,tn_4096_2590_7168,Gemm_Hipblaslt_TN_9690,0.274591
GemmTunableOp_Half_TN,tn_4096_879_7168,Gemm_Hipblaslt_TN_9355,0.118922
GemmTunableOp_Half_TN,tn_3072_1880_4096,Gemm_Hipblaslt_TN_9324,0.0943095
GemmTunableOp_Half_TN,tn_4096_2681_2048,Gemm_Hipblaslt_TN_9672,0.0842784
GemmTunableOp_Half_TN,tn_4096_904_2048,Gemm_Hipblaslt_TN_9577,0.0378882
GemmTunableOp_Half_TN,tn_4096_2630_7168,Gemm_Hipblaslt_TN_9691,0.27477
GemmTunableOp_Half_TN,tn_4096_8054_7168,Gemm_Hipblaslt_TN_9933,0.753655
GemmTunableOp_Half_TN,tn_14336_8156_4096,Gemm_Hipblaslt_TN_9853,1.56531
GemmTunableOp_Half_TN,tn_4096_3431_2048,Gemm_Hipblaslt_TN_9896,0.103299
GemmTunableOp_Half_TN,tn_4096_800_7168,Gemm_Hipblaslt_TN_9158,0.109931
GemmTunableOp_Half_TN,tn_3072_849_4096,Gemm_Hipblaslt_TN_9047,0.0552488
GemmTunableOp_Half_TN,tn_3072_3752_4096,Gemm_Hipblaslt_TN_9672,0.166075
GemmTunableOp_Half_TN,tn_4096_934_2048,Gemm_Hipblaslt_TN_9604,0.0368816
GemmTunableOp_Half_TN,tn_4096_7953_2048,Gemm_Hipblaslt_TN_9813,0.233333
GemmTunableOp_Half_TN,tn_4096_956_7168,Gemm_Hipblaslt_TN_9604,0.122524
GemmTunableOp_Half_TN,tn_14336_2721_4096,Gemm_Hipblaslt_TN_9139,0.55202
GemmTunableOp_Half_TN,tn_3072_924_4096,Gemm_Hipblaslt_TN_9131,0.0577848
GemmTunableOp_Half_TN,tn_3072_1743_4096,Gemm_Rocblas_621286778,0.0917319
GemmTunableOp_Half_TN,tn_4096_914_7168,Gemm_Hipblaslt_TN_9576,0.119073
GemmTunableOp_Half_TN,tn_4096_893_2048,Gemm_Hipblaslt_TN_9578,0.0382313
GemmTunableOp_Half_TN,tn_4096_894_7168,Gemm_Hipblaslt_TN_9547,0.120116
GemmTunableOp_Half_TN,tn_3072_4471_4096,Gemm_Hipblaslt_TN_9721,0.193174
GemmTunableOp_Half_TN,tn_4096_1897_2048,Gemm_Hipblaslt_TN_9134,0.0653106
GemmTunableOp_Half_TN,tn_3072_2763_4096,Gemm_Hipblaslt_TN_9624,0.128629
GemmTunableOp_Half_TN,tn_4096_937_7168,Gemm_Hipblaslt_TN_9577,0.121037
GemmTunableOp_Half_TN,tn_3072_882_4096,Gemm_Hipblaslt_TN_9251,0.0599578
GemmTunableOp_Half_TN,tn_3072_888_4096,Gemm_Hipblaslt_TN_9147,0.0580722
GemmTunableOp_Half_TN,tn_14336_1730_4096,Gemm_Hipblaslt_TN_9793,0.364995
GemmTunableOp_Half_TN,tn_4096_7804_7168,Gemm_Hipblaslt_TN_9220,0.745047
GemmTunableOp_Half_TN,tn_14336_785_4096,Gemm_Hipblaslt_TN_9691,0.164552
GemmTunableOp_Half_TN,tn_3072_947_4096,Gemm_Hipblaslt_TN_9546,0.0592346
GemmTunableOp_Half_TN,tn_4096_216_7168,Gemm_Rocblas_621286491,0.044182
GemmTunableOp_Half_TN,tn_4096_7952_7168,Gemm_Rocblas_621294127,0.751219
GemmTunableOp_Half_TN,tn_4096_954_2048,Gemm_Hipblaslt_TN_9577,0.0387063
GemmTunableOp_Half_TN,tn_14336_64_4096,Gemm_Rocblas_621286816,0.0306203
GemmTunableOp_Half_TN,tn_4096_7787_2048,Gemm_Hipblaslt_TN_9191,0.23064
GemmTunableOp_Half_TN,tn_4096_916_2048,Gemm_Hipblaslt_TN_9577,0.037833
GemmTunableOp_Half_TN,tn_64128_181_4096,Gemm_Hipblaslt_TN_9862,0.255557
GemmTunableOp_Half_TN,tn_14336_3418_4096,Gemm_Hipblaslt_TN_9223,0.654357
GemmTunableOp_Half_TN,tn_64128_185_4096,Gemm_Hipblaslt_TN_9855,0.254696
GemmTunableOp_Half_TN,tn_28672_4096_8192,Gemm_Rocblas_621286539,3.34397
GemmTunableOp_Half_TN,tn_3072_2658_4096,Gemm_Hipblaslt_TN_9329,0.125653
GemmTunableOp_Half_TN,tn_4096_1672_7168,Gemm_Hipblaslt_TN_9610,0.186659
GemmTunableOp_Half_TN,tn_4096_256_2048,Gemm_Rocblas_621286447,0.0146078
GemmTunableOp_Half_TN,tn_4096_2763_7168,Gemm_Hipblaslt_TN_9672,0.284512
GemmTunableOp_Half_TN,tn_3072_830_4096,Gemm_Hipblaslt_TN_9047,0.0543768
GemmTunableOp_Half_TN,tn_4096_2764_2048,Gemm_Hipblaslt_TN_9687,0.0881148
GemmTunableOp_Half_TN,tn_4096_946_7168,Gemm_Hipblaslt_TN_9604,0.120937
GemmTunableOp_Half_TN,tn_14336_942_4096,Gemm_Hipblaslt_TN_9697,0.188688
GemmTunableOp_Half_TN,tn_4096_837_7168,Gemm_Hipblaslt_TN_9604,0.114544
GemmTunableOp_Half_TN,tn_14336_2786_4096,Gemm_Hipblaslt_TN_9187,0.561201
GemmTunableOp_Half_TN,tn_3072_898_4096,Gemm_Hipblaslt_TN_9352,0.0584017
GemmTunableOp_Half_TN,tn_4096_2860_7168,Gemm_Hipblaslt_TN_9672,0.287623
GemmTunableOp_Half_TN,tn_3072_1783_4096,Gemm_Rocblas_621294520,0.0921499
GemmTunableOp_Half_TN,tn_4096_80_2048,Gemm_Rocblas_621286279,0.00967606
GemmTunableOp_Half_TN,tn_3072_1726_4096,Gemm_Hipblaslt_TN_9148,0.0896464
GemmTunableOp_Half_TN,tn_4096_1762_7168,Gemm_Hipblaslt_TN_9645,0.203004
GemmTunableOp_Half_TN,tn_14336_1880_4096,Gemm_Hipblaslt_TN_9697,0.37469
GemmTunableOp_Half_TN,tn_3072_1775_4096,Gemm_Rocblas_621294520,0.0927833
GemmTunableOp_Half_TN,tn_3072_944_4096,Gemm_Hipblaslt_TN_9546,0.058593
GemmTunableOp_Half_TN,tn_4096_1795_2048,Gemm_Hipblaslt_TN_9134,0.0650841
GemmTunableOp_Half_TN,tn_3072_908_4096,Gemm_Hipblaslt_TN_9546,0.0579336
GemmTunableOp_Half_TN,tn_14336_7953_4096,Gemm_Hipblaslt_TN_9933,1.54062
GemmTunableOp_Half_TN,tn_4096_4483_2048,Gemm_Hipblaslt_TN_9742,0.14367
GemmTunableOp_Half_TN,tn_14336_825_4096,Gemm_Hipblaslt_TN_9697,0.179271
GemmTunableOp_Half_TN,tn_4096_128_2048,Gemm_Rocblas_621294029,0.0110421
GemmTunableOp_Half_TN,tn_4096_3752_2048,Gemm_Hipblaslt_TN_9190,0.115131
GemmTunableOp_Half_TN,tn_3072_904_4096,Gemm_Hipblaslt_TN_9352,0.0592681
GemmTunableOp_Half_TN,tn_3072_1829_4096,Gemm_Hipblaslt_TN_9148,0.0916059
GemmTunableOp_Half_TN,tn_14336_809_4096,Gemm_Hipblaslt_TN_9697,0.181055
GemmTunableOp_Half_TN,tn_4096_958_2048,Gemm_Hipblaslt_TN_9585,0.0393726
GemmTunableOp_Half_TN,tn_3072_857_4096,Gemm_Hipblaslt_TN_9158,0.0574506
GemmTunableOp_Half_TN,tn_4096_1701_7168,Gemm_Hipblaslt_TN_9164,0.185278
GemmTunableOp_Half_TN,tn_64128_165_4096,Gemm_Hipblaslt_TN_9953,0.249951
GemmTunableOp_Half_TN,tn_14336_1944_4096,Gemm_Hipblaslt_TN_9220,0.400957
GemmTunableOp_Half_TN,tn_4096_2599_7168,Gemm_Hipblaslt_TN_9691,0.27482
GemmTunableOp_Half_TN,tn_3072_7857_4096,Gemm_Hipblaslt_TN_9622,0.338032
GemmTunableOp_Half_TN,tn_64128_96_4096,Gemm_Hipblaslt_TN_9058,0.185404
GemmTunableOp_Half_TN,tn_4096_957_7168,Gemm_Hipblaslt_TN_9634,0.121991
GemmTunableOp_Half_TN,tn_14336_949_4096,Gemm_Hipblaslt_TN_9697,0.187728
GemmTunableOp_Half_TN,tn_14336_1897_4096,Gemm_Hipblaslt_TN_9187,0.377225
GemmTunableOp_Half_TN,tn_14336_1867_4096,Gemm_Hipblaslt_TN_9677,0.374312
GemmTunableOp_Half_TN,tn_64128_132_4096,Gemm_Hipblaslt_TN_9108,0.22345
GemmTunableOp_Half_TN,tn_3072_843_4096,Gemm_Hipblaslt_TN_9368,0.0566292
GemmTunableOp_Half_TN,tn_3072_5606_4096,Gemm_Hipblaslt_TN_9926,0.255183
GemmTunableOp_Half_TN,tn_14336_870_4096,Gemm_Hipblaslt_TN_9697,0.184088
GemmTunableOp_Half_TN,tn_3072_803_4096,Gemm_Hipblaslt_TN_9047,0.0533688
GemmTunableOp_Half_TN,tn_14336_2722_4096,Gemm_Hipblaslt_TN_9677,0.556775
GemmTunableOp_Half_TN,tn_3072_813_4096,Gemm_Hipblaslt_TN_9047,0.0537103
GemmTunableOp_Half_TN,tn_64128_236_4096,Gemm_Rocblas_621294648,0.288235
GemmTunableOp_Half_TN,tn_4096_923_2048,Gemm_Hipblaslt_TN_9577,0.0378151
GemmTunableOp_Half_TN,tn_3072_982_4096,Gemm_Hipblaslt_TN_9352,0.0615408
GemmTunableOp_Half_TN,tn_14336_3556_4096,Gemm_Rocblas_621294435,0.662363
GemmTunableOp_Half_TN,tn_64128_222_4096,Gemm_Hipblaslt_TN_9961,0.283267
GemmTunableOp_Half_TN,tn_4096_940_2048,Gemm_Hipblaslt_TN_9604,0.0385523
GemmTunableOp_Half_TN,tn_4096_1697_7168,Gemm_Hipblaslt_TN_9265,0.186451
GemmTunableOp_Half_TN,tn_4096_890_2048,Gemm_Hipblaslt_TN_9252,0.0377268
GemmTunableOp_Half_TN,tn_64128_201_4096,Gemm_Hipblaslt_TN_9747,0.277728
GemmTunableOp_Half_TN,tn_3072_838_4096,Gemm_Hipblaslt_TN_9131,0.0565449
GemmTunableOp_Half_TN,tn_4096_922_7168,Gemm_Hipblaslt_TN_9634,0.12052
GemmTunableOp_Half_TN,tn_4096_2762_7168,Gemm_Hipblaslt_TN_9672,0.282146
GemmTunableOp_Half_TN,tn_64128_65_4096,Gemm_Hipblaslt_TN_9057,0.179794
GemmTunableOp_Half_TN,tn_3072_1693_4096,Gemm_Hipblaslt_TN_9163,0.0895689
GemmTunableOp_Half_TN,tn_14336_1850_4096,Gemm_Hipblaslt_TN_9677,0.372875
GemmTunableOp_Half_TN,tn_3072_7436_4096,Gemm_Rocblas_621294473,0.334429
GemmTunableOp_Half_TN,tn_4096_8007_2048,Gemm_Hipblaslt_TN_9768,0.232846
GemmTunableOp_Half_TN,tn_4096_992_2048,Gemm_Hipblaslt_TN_9577,0.0405678
GemmTunableOp_Half_TN,tn_4096_160_7168,Gemm_Rocblas_621294230,0.037627
GemmTunableOp_Half_TN,tn_4096_2517_2048,Gemm_Hipblaslt_TN_9687,0.0830893
GemmTunableOp_Half_TN,tn_64128_170_4096,Gemm_Hipblaslt_TN_9940,0.252748
GemmTunableOp_Half_TN,tn_4096_1700_7168,Gemm_Hipblaslt_TN_9265,0.186678
GemmTunableOp_Half_TN,tn_3072_926_4096,Gemm_Hipblaslt_TN_9546,0.059764
GemmTunableOp_Half_TN,tn_4096_1794_7168,Gemm_Hipblaslt_TN_9268,0.203502
GemmTunableOp_Half_TN,tn_14336_5606_4096,Gemm_Hipblaslt_TN_9749,1.1009
GemmTunableOp_Half_TN,tn_14336_2681_4096,Gemm_Hipblaslt_TN_9793,0.540068
GemmTunableOp_Half_TN,tn_3072_842_4096,Gemm_Hipblaslt_TN_9368,0.0542299
GemmTunableOp_Half_TN,tn_4096_878_7168,Gemm_Hipblaslt_TN_9355,0.119802
GemmTunableOp_Half_TN,tn_3072_932_4096,Gemm_Hipblaslt_TN_9147,0.0595121
GemmTunableOp_Half_TN,tn_3072_1742_4096,Gemm_Hipblaslt_TN_9133,0.0909629
GemmTunableOp_Half_TN,tn_3072_986_4096,Gemm_Hipblaslt_TN_9352,0.0620149
GemmTunableOp_Half_TN,tn_64128_40_4096,Gemm_Hipblaslt_TN_9144,0.165021
GemmTunableOp_Half_TN,tn_64128_176_4096,Gemm_Hipblaslt_TN_9956,0.253442
GemmTunableOp_Half_TN,tn_16000_232_8192,Gemm_Rocblas_621286480,0.15931
GemmTunableOp_Half_TN,tn_3072_2537_4096,Gemm_Hipblaslt_TN_9624,0.122412
GemmTunableOp_Half_TN,tn_64128_167_4096,Gemm_Hipblaslt_TN_9956,0.250304
GemmTunableOp_Half_TN,tn_4096_843_7168,Gemm_Hipblaslt_TN_9099,0.114485
GemmTunableOp_Half_TN,tn_64128_153_4096,Gemm_Hipblaslt_TN_9108,0.229498
GemmTunableOp_Half_TN,tn_64128_126_4096,Gemm_Rocblas_621286396,0.205971
GemmTunableOp_Half_TN,tn_64128_124_4096,Gemm_Rocblas_621294762,0.203679
GemmTunableOp_Half_TN,tn_64128_100_4096,Gemm_Rocblas_621294105,0.200133
GemmTunableOp_Half_TN,tn_4096_807_7168,Gemm_Hipblaslt_TN_9158,0.108689
GemmTunableOp_Half_TN,tn_4096_2653_2048,Gemm_Hipblaslt_TN_9691,0.0861596
GemmTunableOp_Half_TN,tn_3072_2572_4096,Gemm_Hipblaslt_TN_9134,0.123285
GemmTunableOp_Half_TN,tn_3072_850_4096,Gemm_Hipblaslt_TN_9047,0.0542423
GemmTunableOp_Half_TN,tn_4096_895_2048,Gemm_Hipblaslt_TN_9583,0.0378878
GemmTunableOp_Half_TN,tn_4096_1739_7168,Gemm_Hipblaslt_TN_9673,0.198389
GemmTunableOp_Half_TN,tn_14336_2658_4096,Gemm_Hipblaslt_TN_9793,0.540163
GemmTunableOp_Half_TN,tn_4096_918_2048,Gemm_Hipblaslt_TN_9577,0.0383497
GemmTunableOp_Half_TN,tn_3072_886_4096,Gemm_Hipblaslt_TN_9546,0.0573835
GemmTunableOp_Half_TN,tn_3072_7953_4096,Gemm_Rocblas_621294473,0.345688
GemmTunableOp_Half_TN,tn_4096_1723_7168,Gemm_Hipblaslt_TN_9265,0.18683
GemmTunableOp_Half_TN,tn_4096_2509_7168,Gemm_Hipblaslt_TN_9672,0.267424
GemmTunableOp_Half_TN,tn_4096_2571_7168,Gemm_Hipblaslt_TN_9690,0.27267
GemmTunableOp_Half_TN,tn_14336_80_4096,Gemm_Hipblaslt_TN_9494,0.0331551
GemmTunableOp_Half_TN,tn_4096_1695_2048,Gemm_Hipblaslt_TN_9164,0.0584124
GemmTunableOp_Half_TN,tn_8192_4000_4096,Gemm_Hipblaslt_TN_9753,0.445182
GemmTunableOp_Half_TN,tn_64128_13_4096,Gemm_Rocblas_621286348,0.143997
GemmTunableOp_Half_TN,tn_14336_888_4096,Gemm_Hipblaslt_TN_9677,0.185453
GemmTunableOp_Half_TN,tn_3072_136_4096,Gemm_Rocblas_621286436,0.0170493
GemmTunableOp_Half_TN,tn_64128_24_4096,Gemm_Rocblas_621286348,0.145846
GemmTunableOp_Half_TN,tn_14336_919_4096,Gemm_Hipblaslt_TN_9677,0.18605
GemmTunableOp_Half_TN,tn_14336_903_4096,Gemm_Hipblaslt_TN_9192,0.185679
GemmTunableOp_Half_TN,tn_4096_7823_2048,Gemm_Hipblaslt_TN_9713,0.230412
GemmTunableOp_Half_TN,tn_64128_32_4096,Gemm_Rocblas_621286348,0.142259
GemmTunableOp_Half_TN,tn_14336_854_4096,Gemm_Hipblaslt_TN_9677,0.182506
GemmTunableOp_Half_TN,tn_64128_114_4096,Gemm_Rocblas_621294762,0.202564
GemmTunableOp_Half_TN,tn_3072_948_4096,Gemm_Hipblaslt_TN_9546,0.0599881
GemmTunableOp_Half_TN,tn_4096_1715_7168,Gemm_Hipblaslt_TN_9265,0.186919
GemmTunableOp_Half_TN,tn_4096_2635_2048,Gemm_Hipblaslt_TN_9672,0.0851202
GemmTunableOp_Half_TN,tn_14336_1834_4096,Gemm_Hipblaslt_TN_9192,0.374674
GemmTunableOp_Half_TN,tn_4096_934_7168,Gemm_Hipblaslt_TN_9576,0.120811
GemmTunableOp_Half_TN,tn_4096_8007_7168,Gemm_Rocblas_621286678,0.749315
GemmTunableOp_Half_TN,tn_4096_2681_7168,Gemm_Hipblaslt_TN_9691,0.277855
GemmTunableOp_Half_TN,tn_3072_1954_4096,Gemm_Hipblaslt_TN_9633,0.100822
GemmTunableOp_Half_TN,tn_14336_1694_4096,Gemm_Hipblaslt_TN_9697,0.358534
GemmTunableOp_Half_TN,tn_4096_956_2048,Gemm_Hipblaslt_TN_9634,0.0386334
GemmTunableOp_Half_TN,tn_4096_8154_7168,Gemm_Rocblas_621286678,0.762587
GemmTunableOp_Half_TN,tn_4096_988_7168,Gemm_Hipblaslt_TN_9576,0.128456
GemmTunableOp_Half_TN,tn_4096_948_2048,Gemm_Hipblaslt_TN_9583,0.0386608
GemmTunableOp_Half_TN,tn_3072_1737_4096,Gemm_Hipblaslt_TN_9564,0.0922181
GemmTunableOp_Half_TN,tn_3072_916_4096,Gemm_Hipblaslt_TN_9131,0.05845
GemmTunableOp_Half_TN,tn_64128_196_4096,Gemm_Hipblaslt_TN_9185,0.277084
GemmTunableOp_Half_TN,tn_4096_2670_7168,Gemm_Hipblaslt_TN_9657,0.277128
GemmTunableOp_Half_TN,tn_64128_41_4096,Gemm_Hipblaslt_TN_9144,0.163088
GemmTunableOp_Half_TN,tn_14336_2698_4096,Gemm_Hipblaslt_TN_9677,0.551064
GemmTunableOp_Half_TN,tn_14336_911_4096,Gemm_Hipblaslt_TN_9187,0.185592
GemmTunableOp_Half_TN,tn_14336_959_4096,Gemm_Hipblaslt_TN_9697,0.188726
GemmTunableOp_Half_TN,tn_14336_1726_4096,Gemm_Hipblaslt_TN_9697,0.359356
GemmTunableOp_Half_TN,tn_64128_86_4096,Gemm_Hipblaslt_TN_9057,0.187108
GemmTunableOp_Half_TN,tn_14336_160_4096,Gemm_Hipblaslt_TN_9312,0.0556948
GemmTunableOp_Half_TN,tn_64128_163_4096,Gemm_Hipblaslt_TN_9683,0.248335
GemmTunableOp_Half_TN,tn_4096_895_7168,Gemm_Hipblaslt_TN_9160,0.120542
GemmTunableOp_Half_TN,tn_4096_813_2048,Gemm_Hipblaslt_TN_9354,0.0348463
GemmTunableOp_Half_TN,tn_4096_825_7168,Gemm_Hipblaslt_TN_9131,0.113393
GemmTunableOp_Half_TN,tn_4096_1644_2048,Gemm_Hipblaslt_TN_9607,0.0575046
GemmTunableOp_Half_TN,tn_14336_1881_4096,Gemm_Hipblaslt_TN_9677,0.375429
GemmTunableOp_Half_TN,tn_14336_1755_4096,Gemm_Hipblaslt_TN_9793,0.367678
GemmTunableOp_Half_TN,tn_4096_224_7168,Gemm_Rocblas_621286491,0.0445022
GemmTunableOp_Half_TN,tn_4096_1913_2048,Gemm_Hipblaslt_TN_9134,0.0656309
GemmTunableOp_Half_TN,tn_4096_2682_7168,Gemm_Hipblaslt_TN_9799,0.27722
GemmTunableOp_Half_TN,tn_4096_1944_2048,Gemm_Hipblaslt_TN_9590,0.0658699
GemmTunableOp_Half_TN,tn_14336_948_4096,Gemm_Hipblaslt_TN_9697,0.187874
GemmTunableOp_Half_TN,tn_64128_139_4096,Gemm_Hipblaslt_TN_9783,0.226802
GemmTunableOp_Half_TN,tn_4096_3670_2048,Gemm_Hipblaslt_TN_9190,0.112588
GemmTunableOp_Half_TN,tn_14336_972_4096,Gemm_Hipblaslt_TN_9220,0.205319
GemmTunableOp_Half_TN,tn_14336_889_4096,Gemm_Hipblaslt_TN_9697,0.184918
GemmTunableOp_Half_TN,tn_64128_247_4096,Gemm_Rocblas_621294648,0.293806
GemmTunableOp_Half_TN,tn_14336_1846_4096,Gemm_Hipblaslt_TN_9697,0.372331
GemmTunableOp_Half_TN,tn_64128_146_4096,Gemm_Hipblaslt_TN_9108,0.226565
GemmTunableOp_Half_TN,tn_14336_8049_4096,Gemm_Hipblaslt_TN_9888,1.54644
GemmTunableOp_Half_TN,tn_4096_2872_7168,Gemm_Hipblaslt_TN_9672,0.288864
GemmTunableOp_Half_TN,tn_4096_790_7168,Gemm_Hipblaslt_TN_9147,0.110691
GemmTunableOp_Half_TN,tn_4096_939_7168,Gemm_Hipblaslt_TN_9604,0.121606
GemmTunableOp_Half_TN,tn_4096_964_7168,Gemm_Hipblaslt_TN_9604,0.122426
GemmTunableOp_Half_TN,tn_4096_829_2048,Gemm_Hipblaslt_TN_9634,0.0350314
GemmTunableOp_Half_TN,tn_4096_1798_7168,Gemm_Hipblaslt_TN_9137,0.20499
GemmTunableOp_Half_TN,tn_64128_251_4096,Gemm_Rocblas_621294648,0.289503
GemmTunableOp_Half_TN,tn_3072_785_4096,Gemm_Hipblaslt_TN_9368,0.0533579
GemmTunableOp_Half_TN,tn_4096_184_2048,Gemm_Rocblas_621294168,0.0132021
GemmTunableOp_Half_TN,tn_4096_821_7168,Gemm_Hipblaslt_TN_9158,0.109587
GemmTunableOp_Half_TN,tn_3072_3479_4096,Gemm_Rocblas_621286753,0.159517
GemmTunableOp_Half_TN,tn_3072_1778_4096,Gemm_Rocblas_621294520,0.0923373
GemmTunableOp_Half_TN,tn_14336_836_4096,Gemm_Hipblaslt_TN_9677,0.179877
GemmTunableOp_Half_TN,tn_64128_39_4096,Gemm_Hipblaslt_TN_9097,0.165023
GemmTunableOp_Half_TN,tn_3072_854_4096,Gemm_Hipblaslt_TN_9047,0.0548033
GemmTunableOp_Half_TN,tn_3072_1757_4096,Gemm_Hipblaslt_TN_9163,0.0919234
GemmTunableOp_Half_TN,tn_14336_152_4096,Gemm_Hipblaslt_TN_9312,0.0552091
GemmTunableOp_Half_TN,tn_4096_878_2048,Gemm_Hipblaslt_TN_9576,0.0373843
GemmTunableOp_Half_TN,tn_4096_1893_2048,Gemm_Hipblaslt_TN_9590,0.0659771
GemmTunableOp_Half_TN,tn_4096_868_7168,Gemm_Hipblaslt_TN_9170,0.117712
GemmTunableOp_Half_TN,tn_14336_3671_4096,Gemm_Hipblaslt_TN_9677,0.747177
GemmTunableOp_Half_TN,tn_64128_30_4096,Gemm_Rocblas_621286348,0.148848
GemmTunableOp_Half_TN,tn_3072_919_4096,Gemm_Hipblaslt_TN_9131,0.0581825
GemmTunableOp_Half_TN,tn_14336_927_4096,Gemm_Hipblaslt_TN_9697,0.186529
GemmTunableOp_Half_TN,tn_3072_1673_4096,Gemm_Hipblaslt_TN_9561,0.0894001
GemmTunableOp_Half_TN,tn_3072_2628_4096,Gemm_Hipblaslt_TN_9590,0.126354
GemmTunableOp_Half_TN,tn_3072_2648_4096,Gemm_Hipblaslt_TN_9134,0.1241
GemmTunableOp_Half_TN,tn_64128_144_4096,Gemm_Rocblas_621286565,0.228717
GemmTunableOp_Half_TN,tn_3072_875_4096,Gemm_Hipblaslt_TN_9546,0.0577826
GemmTunableOp_Half_TN,tn_14336_946_4096,Gemm_Hipblaslt_TN_9677,0.188303
GemmTunableOp_Half_TN,tn_3072_1807_4096,Gemm_Hipblaslt_TN_9641,0.0944149
GemmTunableOp_Half_TN,tn_4096_855_7168,Gemm_Hipblaslt_TN_9170,0.115894
GemmTunableOp_Half_TN,tn_4096_840_7168,Gemm_Hipblaslt_TN_9604,0.114813
GemmTunableOp_Half_TN,tn_3072_1794_4096,Gemm_Rocblas_621294520,0.0929154
GemmTunableOp_Half_TN,tn_4096_831_2048,Gemm_Hipblaslt_TN_9604,0.0354198
GemmTunableOp_Half_TN,tn_14336_968_4096,Gemm_Hipblaslt_TN_9217,0.204735
GemmTunableOp_Half_TN,tn_64128_160_4096,Gemm_Rocblas_621286532,0.226581
GemmTunableOp_Half_TN,tn_3072_3310_4096,Gemm_Hipblaslt_TN_9681,0.150137
GemmTunableOp_Half_TN,tn_4096_796_2048,Gemm_Hipblaslt_TN_9354,0.035048
GemmTunableOp_Half_TN,tn_14336_800_4096,Gemm_Rocblas_621286683,0.16188
GemmTunableOp_Half_TN,tn_64128_9_4096,Gemm_Rocblas_621286348,0.141863
GemmTunableOp_Half_TN,tn_4096_7436_7168,Gemm_Hipblaslt_TN_9890,0.72185
GemmTunableOp_Half_TN,tn_14336_817_4096,Gemm_Hipblaslt_TN_9697,0.179809
GemmTunableOp_Half_TN,tn_14336_829_4096,Gemm_Hipblaslt_TN_9697,0.180836
GemmTunableOp_Half_TN,tn_4096_2764_7168,Gemm_Hipblaslt_TN_9690,0.283711
GemmTunableOp_Half_TN,tn_4096_1718_7168,Gemm_Hipblaslt_TN_9587,0.186798
GemmTunableOp_Half_TN,tn_64128_246_4096,Gemm_Rocblas_621286905,0.289934
GemmTunableOp_Half_TN,tn_4096_984_7168,Gemm_Hipblaslt_TN_9160,0.123891
GemmTunableOp_Half_TN,tn_4096_1834_2048,Gemm_Hipblaslt_TN_9137,0.0652406
GemmTunableOp_Half_TN,tn_3072_969_4096,Gemm_Hipblaslt_TN_9131,0.0608206
GemmTunableOp_Half_TN,tn_4096_939_2048,Gemm_Hipblaslt_TN_9577,0.0384577
GemmTunableOp_Half_TN,tn_14336_1733_4096,Gemm_Hipblaslt_TN_9793,0.365557
GemmTunableOp_Half_TN,tn_64128_243_4096,Gemm_Rocblas_621294648,0.289015
GemmTunableOp_Half_TN,tn_14336_830_4096,Gemm_Hipblaslt_TN_9697,0.179181
GemmTunableOp_Half_TN,tn_3072_1723_4096,Gemm_Hipblaslt_TN_9148,0.0902445
GemmTunableOp_Half_TN,tn_64128_76_4096,Gemm_Hipblaslt_TN_9057,0.183264
GemmTunableOp_Half_TN,tn_64128_214_4096,Gemm_Hipblaslt_TN_9226,0.281057
GemmTunableOp_Half_TN,tn_4096_947_2048,Gemm_Hipblaslt_TN_9577,0.0385127
GemmTunableOp_Half_TN,tn_4096_929_7168,Gemm_Hipblaslt_TN_9585,0.120241
GemmTunableOp_Half_TN,tn_4096_921_2048,Gemm_Hipblaslt_TN_9577,0.038391
GemmTunableOp_Half_TN,tn_3072_7944_4096,Gemm_Rocblas_621294473,0.342784
GemmTunableOp_Half_TN,tn_3072_3352_4096,Gemm_Hipblaslt_TN_9619,0.152184
GemmTunableOp_Half_TN,tn_14336_2793_4096,Gemm_Hipblaslt_TN_9677,0.560036
GemmTunableOp_Half_TN,tn_4096_854_7168,Gemm_Hipblaslt_TN_9547,0.11503
GemmTunableOp_Half_TN,tn_3072_870_4096,Gemm_Hipblaslt_TN_9546,0.0571867
GemmTunableOp_Half_TN,tn_3072_3671_4096,Gemm_Hipblaslt_TN_9672,0.166414
GemmTunableOp_Half_TN,tn_4096_969_2048,Gemm_Hipblaslt_TN_9577,0.037859
GemmTunableOp_Half_TN,tn_4096_3752_7168,Gemm_Hipblaslt_TN_9217,0.365518
GemmTunableOp_Half_TN,tn_14336_831_4096,Gemm_Hipblaslt_TN_9677,0.181549
GemmTunableOp_Half_TN,tn_3072_1763_4096,Gemm_Hipblaslt_TN_9613,0.0933333
GemmTunableOp_Half_TN,tn_3072_16_4096,Gemm_Rocblas_621294136,0.00831764
GemmTunableOp_Half_TN,tn_3072_809_4096,Gemm_Hipblaslt_TN_9048,0.0563114
GemmTunableOp_Half_TN,tn_64128_242_4096,Gemm_Rocblas_621294648,0.291238
GemmTunableOp_Half_TN,tn_14336_2517_4096,Gemm_Rocblas_621286684,0.508051
GemmTunableOp_Half_TN,tn_3072_104_4096,Gemm_Rocblas_621286438,0.015119
GemmTunableOp_Half_TN,tn_3072_2653_4096,Gemm_Hipblaslt_TN_9329,0.125051
GemmTunableOp_Half_TN,tn_4096_3599_2048,Gemm_Hipblaslt_TN_9696,0.104641
GemmTunableOp_Half_TN,tn_14336_912_4096,Gemm_Hipblaslt_TN_9697,0.185479
GemmTunableOp_Half_TN,tn_3072_1762_4096,Gemm_Hipblaslt_TN_9322,0.0926978
GemmTunableOp_Half_TN,tn_3072_887_4096,Gemm_Hipblaslt_TN_9546,0.0579698
GemmTunableOp_Half_TN,tn_3072_1730_4096,Gemm_Hipblaslt_TN_9133,0.0925435
GemmTunableOp_Half_TN,tn_4096_1724_7168,Gemm_Hipblaslt_TN_9610,0.187433
GemmTunableOp_Half_TN,tn_3072_2717_4096,Gemm_Hipblaslt_TN_9567,0.127542
GemmTunableOp_Half_TN,tn_4096_913_2048,Gemm_Hipblaslt_TN_9160,0.0388531
GemmTunableOp_Half_TN,tn_3072_2734_4096,Gemm_Hipblaslt_TN_9624,0.128517
GemmTunableOp_Half_TN,tn_4096_88_7168,Gemm_Hipblaslt_TN_9441,0.0250302
GemmTunableOp_Half_TN,tn_3072_7299_4096,Gemm_Hipblaslt_TN_9779,0.330703
GemmTunableOp_Half_TN,tn_14336_819_4096,Gemm_Hipblaslt_TN_9697,0.180543
GemmTunableOp_Half_TN,tn_4096_919_7168,Gemm_Rocblas_621294514,0.120902
GemmTunableOp_Half_TN,tn_4096_56_2048,Gemm_Rocblas_621286428,0.00809049
GemmTunableOp_Half_TN,tn_3072_954_4096,Gemm_Hipblaslt_TN_9352,0.0605045
GemmTunableOp_Half_TN,tn_4096_872_7168,Gemm_Hipblaslt_TN_9547,0.116503
GemmTunableOp_Half_TN,tn_14336_7283_4096,Gemm_Hipblaslt_TN_9192,1.41419
GemmTunableOp_Half_TN,tn_4096_886_7168,Gemm_Hipblaslt_TN_9170,0.118612
GemmTunableOp_Half_TN,tn_14336_2762_4096,Gemm_Hipblaslt_TN_9192,0.559115
GemmTunableOp_Half_TN,tn_14336_1718_4096,Gemm_Hipblaslt_TN_9697,0.360811
GemmTunableOp_Half_TN,tn_4096_836_7168,Gemm_Hipblaslt_TN_9099,0.114963
GemmTunableOp_Half_TN,tn_14336_7817_4096,Gemm_Hipblaslt_TN_9933,1.51979
GemmTunableOp_Half_TN,tn_4096_804_2048,Gemm_Hipblaslt_TN_9131,0.0341967
GemmTunableOp_Half_TN,tn_4096_951_2048,Gemm_Hipblaslt_TN_9577,0.0391581
GemmTunableOp_Half_TN,tn_14336_7857_4096,Gemm_Hipblaslt_TN_159,1.52439
GemmTunableOp_Half_TN,tn_4096_865_2048,Gemm_Hipblaslt_TN_9577,0.0364589
GemmTunableOp_Half_TN,tn_4096_168_2048,Gemm_Rocblas_621286447,0.0129685
GemmTunableOp_Half_TN,tn_4096_8154_2048,Gemm_Hipblaslt_TN_9813,0.235063
GemmTunableOp_Half_TN,tn_64128_103_4096,Gemm_Hipblaslt_TN_9061,0.198915
GemmTunableOp_Half_TN,tn_4096_2793_2048,Gemm_Hipblaslt_TN_9689,0.0888292
GemmTunableOp_Half_TN,tn_4096_848_2048,Gemm_Hipblaslt_TN_9577,0.0358694
GemmTunableOp_Half_TN,tn_3072_1805_4096,Gemm_Hipblaslt_TN_9720,0.0937549
GemmTunableOp_Half_TN,tn_64128_156_4096,Gemm_Hipblaslt_TN_9108,0.230591
GemmTunableOp_Half_TN,tn_14336_3569_4096,Gemm_Hipblaslt_TN_9223,0.666979
GemmTunableOp_Half_TN,tn_4096_857_2048,Gemm_Hipblaslt_TN_9354,0.0359466
GemmTunableOp_Half_TN,tn_4096_64_2048,Gemm_Rocblas_621286488,0.00789501
GemmTunableOp_Half_TN,tn_14336_1759_4096,Gemm_Hipblaslt_TN_9192,0.366582
GemmTunableOp_Half_TN,tn_4096_812_7168,Gemm_Hipblaslt_TN_9634,0.112529
GemmTunableOp_Half_TN,tn_4096_3402_7168,Gemm_Hipblaslt_TN_9682,0.33384
GemmTunableOp_Half_TN,tn_64128_53_4096,Gemm_Hipblaslt_TN_9097,0.169597
GemmTunableOp_Half_TN,tn_4096_852_7168,Gemm_Hipblaslt_TN_9099,0.114197
GemmTunableOp_Half_TN,tn_64128_229_4096,Gemm_Rocblas_621294648,0.289192
GemmTunableOp_Half_TN,tn_64128_129_4096,Gemm_Hipblaslt_TN_9108,0.219125
GemmTunableOp_Half_TN,tn_3072_2793_4096,Gemm_Hipblaslt_TN_9624,0.130676
GemmTunableOp_Half_TN,tn_14336_802_4096,Gemm_Hipblaslt_TN_9697,0.179828
GemmTunableOp_Half_TN,tn_4096_1835_2048,Gemm_Hipblaslt_TN_9590,0.064226
GemmTunableOp_Half_TN,tn_4096_866_7168,Gemm_Hipblaslt_TN_9170,0.11811
GemmTunableOp_Half_TN,tn_3072_7823_4096,Gemm_Rocblas_621294473,0.344047
GemmTunableOp_Half_TN,tn_64128_21_4096,Gemm_Rocblas_621286348,0.145515
GemmTunableOp_Half_TN,tn_3072_1913_4096,Gemm_Hipblaslt_TN_9148,0.0956724
GemmTunableOp_Half_TN,tn_14336_1795_4096,Gemm_Hipblaslt_TN_9697,0.370993
GemmTunableOp_Half_TN,tn_14336_3711_4096,Gemm_Hipblaslt_TN_9187,0.745828
GemmTunableOp_Half_TN,tn_4096_176_2048,Gemm_Rocblas_621286447,0.0132121
GemmTunableOp_Half_TN,tn_14336_256_4096,Gemm_Hipblaslt_TN_9160,0.067158
GemmTunableOp_Half_TN,tn_3072_208_4096,Gemm_Rocblas_621294173,0.0228718
GemmTunableOp_Half_TN,tn_14336_3571_4096,Gemm_Rocblas_621286590,0.671452
GemmTunableOp_Half_TN,tn_3072_72_4096,Gemm_Rocblas_621294177,0.0136424
GemmTunableOp_Half_TN,tn_3072_112_4096,Gemm_Rocblas_621294029,0.0150092
GemmTunableOp_Half_TN,tn_4096_1850_7168,Gemm_Hipblaslt_TN_9680,0.207436
GemmTunableOp_Half_TN,tn_14336_208_4096,Gemm_Rocblas_621286479,0.0671146
GemmTunableOp_Half_TN,tn_4096_1954_2048,Gemm_Hipblaslt_TN_9590,0.0666957
GemmTunableOp_Half_TN,tn_3072_7239_4096,Gemm_Hipblaslt_TN_9688,0.316294
GemmTunableOp_Half_TN,tn_14336_8110_4096,Gemm_Hipblaslt_TN_9914,1.56206
GemmTunableOp_Half_TN,tn_14336_891_4096,Gemm_Hipblaslt_TN_9677,0.18283
GemmTunableOp_Half_TN,tn_4096_882_7168,Gemm_Hipblaslt_TN_9170,0.119785
GemmTunableOp_Half_TN,tn_14336_842_4096,Gemm_Hipblaslt_TN_9677,0.181954
GemmTunableOp_Half_TN,tn_3072_845_4096,Gemm_Hipblaslt_TN_9047,0.0549113
GemmTunableOp_Half_TN,tn_4096_1791_2048,Gemm_Hipblaslt_TN_9136,0.0630929
GemmTunableOp_Half_TN,tn_4096_846_7168,Gemm_Hipblaslt_TN_9158,0.114728
GemmTunableOp_Half_TN,tn_14336_1672_4096,Gemm_Hipblaslt_TN_9697,0.358374
